[{"gpt-4-1106-preview_direct_sole-planning_results": "Travel Plan:\n\nDays: 1\nCurrent City: from Medford to Grand Junction\nTransportation: Self-driving, from Medford to Grand Junction, duration: 15 hours 49 mins, distance: 1,640 km, cost: 82\nBreakfast: -\nAttraction: -\nLunch: -\nDinner: Austin's BBQ and Oyster Bar, Grand Junction, cost: 15, cuisines: Tea, Bakery, Fast Food, Indian, Seafood\nAccommodation: NYC Apartment near Central Park!, Grand Junction, cost: 1118, maximum occupancy: 5, house rules: No children under 10, minimum nights: 3\n\nNumber of people: 1\nTotal cost: 1 x 82 + 1 x 15 + 1 x 1118 = 1215\nAccommodation minimum nights: 1/3\n\nDays: 2\nCurrent City: Grand Junction\nTransportation: -\nBreakfast: 2 Dog, Grand Junction, cost: 29, cuisines: Desserts, BBQ, Fast Food, Cafe, American\nAttraction: Museum of the West, Museums of Western Colorado, Grand Junction; Western Colorado Botanical Gardens, Grand Junction\nLunch: Thakur Bakers, Grand Junction, cost: 100, cuisines: French, Pizza, Cafe, BBQ\nDinner: Punjab Da Pind, Grand Junction, cost: 52, cuisines: Desserts, Pizza, Bakery, Chinese, Mediterranean, Seafood\nAccommodation: NYC Apartment near Central Park!, Grand Junction, cost: 1118, maximum occupancy: 5, house rules: No children under 10, minimum nights: 3\n\nNumber of people: 1\nTotal cost: 1 x 29 + 1 x 100 + 1 x 52 + 1 x 1118 = 1299\nAccommodation minimum nights: 2/3\n\nDays: 3\nCurrent City: Grand Junction\nTransportation: -\nBreakfast: Shanghai Bar & Lounge - The Bristol Hotel, Grand Junction, cost: 31, cuisines: Cafe, Pizza\nAttraction: Canyon View Park, Grand Junction; Cross Orchards Historic Site, Museums of Western Colorado, Grand Junction\nLunch: Baba Chicken Ludhiana Wale, Grand Junction, cost: 12, cuisines: Tea, Pizza, Indian, Fast Food\nDinner: Cha Bar, Grand Junction, cost: 10, cuisines: Tea, Bakery, American, BBQ\nAccommodation: NYC Apartment near Central Park!, Grand Junction, cost: 1118, maximum occupancy: 5, house rules: No children under 10, minimum nights: 3\n\nNumber of people: 1\nTotal cost: 1 x 31 + 1 x 12 + 1 x 10 + 1 x 1118 = 1171\nAccommodation minimum nights: 3/3\n\nDays: 4\nCurrent City: from Grand Junction to Durango\nTransportation: Self-driving, from Grand Junction to Durango, duration: 3 hours 33 mins, distance: 269 km, cost: 13\nBreakfast: -\nAttraction: -\nLunch: Samurai Japanese Cuisine & Sushi Bar, Durango, cost: 67, cuisines: Bakery, Desserts, Fast Food\nDinner: Dub's High on the Hog, Durango, cost: 98, cuisines: Tea, Italian, French, Cafe, Seafood\nAccommodation: Lux 1BR in the heart of NYC Theater district!, Durango, cost: 81, maximum occupancy: 3, house rules: No children under 10, minimum nights: 30\n\nNumber of people: 1\nTotal cost: 1 x 13 + 1 x 67 + 1 x 98 + 1 x 81 = 259\nAccommodation minimum nights: 1/30\n\nDays: 5\nCurrent City: Durango\nTransportation: -\nBreakfast: Hot & Tasty Chinese Food, Durango, cost: 17, cuisines: Tea, French, Fast Food\nAttraction: Durango & Silverton Narrow Gauge Railroad, Durango; Durango Adventures and Zipline Tours, Durango\nLunch: Chickenette, Durango, cost: 31, cuisines: Tea, Pizza, Desserts, Fast Food\nDinner: Asian Haus, Durango, cost: 26, cuisines: Fast Food, Seafood, Pizza, Italian\nAccommodation: Lux 1BR in the heart of NYC Theater district!, Durango, cost: 81, maximum occupancy: 3, house rules: No children under 10, minimum nights: 30\n\nNumber of people: 1\nTotal cost: 1 x 17 + 1 x 31 + 1 x 26 + 1 x 81 = 155\nAccommodation minimum nights: 2/30\n\nDays: 6\nCurrent City: from Durango to Gunnison\nTransportation: Self-driving, from Durango to Gunnison, duration: 3 hours 47 mins, distance: 275 km, cost: 13\nBreakfast: -\nAttraction: -\nLunch: Happy Joe's Pizza & Ice Cream, Gunnison, cost: 74, cuisines: Desserts, Italian, Bakery, Indian, Seafood\nDinner: SALT, Gunnison, cost: 44, cuisines: Tea, Chinese, BBQ\nAccommodation: Full-size loft bed in East Village, Gunnison, cost: 104, maximum occupancy: 1, house rules: No visitors & No pets & No parties, minimum nights: 1\n\nNumber of people: 1\nTotal cost: 1 x 13 + 1 x 74 + 1 x 44 + 1 x 104 = 235\nAccommodation minimum nights: 1/1\n\nDays: 7\nCurrent City: from Gunnison to Medford\nTransportation: Self-driving, from Gunnison to Medford, duration: 18 hours 4 mins, distance: 1,832 km, cost: 91\nBreakfast: -\nAttraction: -\nLunch: -\nDinner: -\nAccommodation: -\n\nNumber of people: 1\nTotal cost: 1 x 91 = 91\n\nTotal cost across all days: 1215 + 1299 + 1171 + 259 + 155 + 235 + 91 = 4425\n\nUnfortunately, the total cost of the travel plan ($4,425) exceeds the specified budget of $2,400. Adjustments would need to be made to the plan to reduce costs, such as choosing less expensive accommodations or dining options. However, given the constraints and the provided data, it is not possible to create a plan within the budget.", "gpt-4-1106-preview_direct_sole-planning_parsed_results": [{"day": 1, "current_city": "from Medford to Grand Junction", "transportation": "Self-driving, from Medford to Grand Junction, duration: 15 hours 49 mins, distance: 1,640 km", "breakfast": "-", "attraction": "-", "lunch": "-", "dinner": "Austin's BBQ and Oyster Bar, Grand Junction", "accommodation": "NYC Apartment near Central Park!, Grand Junction"}, {"day": 2, "current_city": "Grand Junction", "transportation": "-", "breakfast": "2 Dog, Grand Junction", "attraction": "Museum of the West, Museums of Western Colorado, Grand Junction;Western Colorado Botanical Gardens, Grand Junction;", "lunch": "Thakur Bakers, Grand Junction", "dinner": "Punjab Da Pind, Grand Junction", "accommodation": "NYC Apartment near Central Park!, Grand Junction"}, {"day": 3, "current_city": "Grand Junction", "transportation": "-", "breakfast": "Shanghai Bar & Lounge - The Bristol Hotel, Grand Junction", "attraction": "Canyon View Park, Grand Junction;Cross Orchards Historic Site, Museums of Western Colorado, Grand Junction;", "lunch": "Baba Chicken Ludhiana Wale, Grand Junction", "dinner": "Cha Bar, Grand Junction", "accommodation": "NYC Apartment near Central Park!, Grand Junction"}, {"day": 4, "current_city": "from Grand Junction to Durango", "transportation": "Self-driving, from Grand Junction to Durango, duration: 3 hours 33 mins, distance: 269 km", "breakfast": "-", "attraction": "-", "lunch": "Samurai Japanese Cuisine & Sushi Bar, Durango", "dinner": "Dub's High on the Hog, Durango", "accommodation": "Lux 1BR in the heart of NYC Theater district!, Durango"}, {"day": 5, "current_city": "Durango", "transportation": "-", "breakfast": "Hot & Tasty Chinese Food, Durango", "attraction": "Durango & Silverton Narrow Gauge Railroad, Durango;Durango Adventures and Zipline Tours, Durango;", "lunch": "Chickenette, Durango", "dinner": "Asian Haus, Durango", "accommodation": "Lux 1BR in the heart of NYC Theater district!, Durango"}, {"day": 6, "current_city": "from Durango to Gunnison", "transportation": "Self-driving, from Durango to Gunnison, duration: 3 hours 47 mins, distance: 275 km", "breakfast": "-", "attraction": "-", "lunch": "Happy Joe's Pizza & Ice Cream, Gunnison", "dinner": "SALT, Gunnison", "accommodation": "Full-size loft bed in East Village, Gunnison"}, {"day": 7, "current_city": "from Gunnison to Medford", "transportation": "Self-driving, from Gunnison to Medford, duration: 18 hours 4 mins, distance: 1,832 km", "breakfast": "-", "attraction": "-", "lunch": "-", "dinner": "-", "accommodation": "-"}]}]