[{"gpt-4-1106-preview_direct_sole-planning_results": "Travel Plan:\n\nDay 1: North Platte to Grand Junction\n- Transportation: Self-driving from North Platte to Grand Junction, duration: 7 hours 27 mins, distance: 809 km, cost: $40 x 2 = $80\n- Breakfast: -\n- Attraction: -\n- Lunch: -\n- Dinner: Austin's BBQ and Oyster Bar, Grand Junction, cost: $15 x 2 = $30, cuisines: Tea, Bakery, Fast Food, Indian, Seafood\n- Accommodation: NYC Apartment near Central Park!, Grand Junction, cost: $1118 x 1 = $1118, room type: Entire home/apt, house rules: No children under 10, minimum nights: 3, maximum occupancy: 5\n\nTotal cost for Day 1: $80 + $30 + $1118 = $1228\n\nDay 2: Grand Junction\n- Transportation: -\n- Breakfast: 2 Dog, Grand Junction, cost: $29 x 2 = $58, cuisines: Desserts, BBQ, Fast Food, Cafe, American\n- Attraction: Museum of the West, Museums of Western Colorado, Grand Junction\n- Lunch: Thakur Bakers, Grand Junction, cost: $100 x 2 = $200, cuisines: French, Pizza, Cafe, BBQ\n- Dinner: Pind Balluchi, Grand Junction, cost: $17 x 2 = $34, cuisines: Fast Food, Chinese, Seafood\n- Accommodation: NYC Apartment near Central Park!, Grand Junction, cost: $1118 x 1 = $1118, room type: Entire home/apt, house rules: No children under 10, minimum nights: 3, maximum occupancy: 5\n\nTotal cost for Day 2: $58 + $200 + $34 + $1118 = $1410\n\nDay 3: Grand Junction\n- Transportation: -\n- Breakfast: Shanghai Bar & Lounge - The Bristol Hotel, Grand Junction, cost: $31 x 2 = $62, cuisines: Cafe, Pizza\n- Attraction: Western Colorado Botanical Gardens, Grand Junction\n- Lunch: Cocoa Tree, Grand Junction, cost: $68 x 2 = $136, cuisines: Tea, Chinese, Cafe, Fast Food\n- Dinner: Punjab Da Pind, Grand Junction, cost: $52 x 2 = $104, cuisines: Desserts, Pizza, Bakery, Chinese, Mediterranean, Seafood\n- Accommodation: NYC Apartment near Central Park!, Grand Junction, cost: $1118 x 1 = $1118, room type: Entire home/apt, house rules: No children under 10, minimum nights: 3, maximum occupancy: 5\n\nTotal cost for Day 3: $62 + $136 + $104 + $1118 = $1420\n\nDay 4: Grand Junction to Durango\n- Transportation: Self-driving from Grand Junction to Durango, duration: 3 hours 33 mins, distance: 269 km, cost: $13 x 2 = $26\n- Breakfast: -\n- Attraction: Eureka! McConnell Science Museum, Grand Junction\n- Lunch: Cha Bar, Grand Junction, cost: $10 x 2 = $20, cuisines: Tea, Bakery, American, BBQ\n- Dinner: Samurai Japanese Cuisine & Sushi Bar, Durango, cost: $67 x 2 = $134, cuisines: Bakery, Desserts, Fast Food\n- Accommodation: Lux 1BR in the heart of NYC Theater district!, Durango, cost: $81 x 1 = $81, room type: Entire home/apt, house rules: No children under 10, minimum nights: 30, maximum occupancy: 3\n\nTotal cost for Day 4: $26 + $20 + $134 + $81 = $261\n\nDay 5: Durango\n- Transportation: -\n- Breakfast: Dub's High on the Hog, Durango, cost: $98 x 2 = $196, cuisines: Tea, Italian, French, Cafe, Seafood\n- Attraction: Durango & Silverton Narrow Gauge Railroad, Durango\n- Lunch: Hot & Tasty Chinese Food, Durango, cost: $17 x 2 = $34, cuisines: Tea, French, Fast Food\n- Dinner: Standard Chicken Point, Durango, cost: $50 x 2 = $100, cuisines: Mexican, Indian, BBQ, Seafood\n- Accommodation: Lux 1BR in the heart of NYC Theater district!, Durango, cost: $81 x 1 = $81, room type: Entire home/apt, house rules: No children under 10, minimum nights: 30, maximum occupancy: 3\n\nTotal cost for Day 5: $196 + $34 + $100 + $81 = $411\n\nDay 6: Durango to Colorado Springs\n- Transportation: Self-driving from Durango to Colorado Springs, duration: 5 hours 27 mins, distance: 504 km, cost: $25 x 2 = $50\n- Breakfast: -\n- Attraction: Pinkerton Hot Springs, Durango\n- Lunch: Chickenette, Durango, cost: $31 x 2 = $62, cuisines: Tea, Pizza, Desserts, Fast Food\n- Dinner: Raglan Road Irish Pub and Restaurant, Colorado Springs, cost: $97 x 2 = $194, cuisines: Chinese, Bakery, Pizza, Mediterranean\n- Accommodation: Large sunny park slope apartment, Colorado Springs, cost: $82 x 1 = $82, room type: Entire home/apt, house rules: No smoking & No parties & No pets, minimum nights: 1, maximum occupancy: 3\n\nTotal cost for Day 6: $50 + $62 + $194 + $82 = $388\n\nDay 7: Colorado Springs to North Platte\n- Transportation: Self-driving from Colorado Springs to North Platte, duration: 4 hours 40 mins, distance: 536 km, cost: $26 x 2 = $52\n- Breakfast: Derby, Colorado Springs, cost: $67 x 2 = $134, cuisines: Desserts, Fast Food\n- Attraction: Garden of the Gods, Colorado Springs\n- Lunch: Club Tokyo - Best Western Skycity Hotel, Colorado Springs, cost: $64 x 2 = $128, cuisines: Tea, Bakery, Mediterranean, Fast Food\n- Dinner: -\n- Accommodation: -\n\nTotal cost for Day 7: $52 + $134 + $128 = $314\n\nTotal cost across all days: $1228 + $1410 + $1420 + $261 + $411 + $388 + $314 = $5032\n\nRemaining budget: $6500 - $5032 = $1468\n\nCuisines: The prompt specifies no cuisines, so all cuisine constraints are satisfied.\nAccommodations: All accommodations are non-shared rooms, and parties are allowed where not explicitly prohibited by house rules.\nTransportation: No flights were included as per the request, and all transportation methods correspond correctly to the specified cities.\n\nPlease note that the costs are estimated based on the provided information and actual prices may vary. It is also important to confirm the availability and booking conditions for each accommodation, as some have minimum night requirements that may not align with the travel dates.", "gpt-4-1106-preview_direct_sole-planning_parsed_results": [{"day": 1, "current_city": "from North Platte to Grand Junction", "transportation": "Self-driving from North Platte to Grand Junction, duration: 7 hours 27 mins, distance: 809 km", "breakfast": "-", "attraction": "-", "lunch": "-", "dinner": "Austin's BBQ and Oyster Bar, Grand Junction", "accommodation": "NYC Apartment near Central Park!, Grand Junction"}, {"day": 2, "current_city": "Grand Junction", "transportation": "-", "breakfast": "2 Dog, Grand Junction", "attraction": "Museum of the West, Museums of Western Colorado, Grand Junction;", "lunch": "Thakur Bakers, Grand Junction", "dinner": "Pind Balluchi, Grand Junction", "accommodation": "NYC Apartment near Central Park!, Grand Junction"}, {"day": 3, "current_city": "Grand Junction", "transportation": "-", "breakfast": "Shanghai Bar & Lounge - The Bristol Hotel, Grand Junction", "attraction": "Western Colorado Botanical Gardens, Grand Junction;", "lunch": "Cocoa Tree, Grand Junction", "dinner": "Punjab Da Pind, Grand Junction", "accommodation": "NYC Apartment near Central Park!, Grand Junction"}, {"day": 4, "current_city": "from Grand Junction to Durango", "transportation": "Self-driving from Grand Junction to Durango, duration: 3 hours 33 mins, distance: 269 km", "breakfast": "-", "attraction": "Eureka! McConnell Science Museum, Grand Junction;", "lunch": "Cha Bar, Grand Junction", "dinner": "Samurai Japanese Cuisine & Sushi Bar, Durango", "accommodation": "Lux 1BR in the heart of NYC Theater district!, Durango"}, {"day": 5, "current_city": "Durango", "transportation": "-", "breakfast": "Dub's High on the Hog, Durango", "attraction": "Durango & Silverton Narrow Gauge Railroad, Durango;", "lunch": "Hot & Tasty Chinese Food, Durango", "dinner": "Standard Chicken Point, Durango", "accommodation": "Lux 1BR in the heart of NYC Theater district!, Durango"}, {"day": 6, "current_city": "from Durango to Colorado Springs", "transportation": "Self-driving from Durango to Colorado Springs, duration: 5 hours 27 mins, distance: 504 km", "breakfast": "-", "attraction": "Pinkerton Hot Springs, Durango;", "lunch": "Chickenette, Durango", "dinner": "Raglan Road Irish Pub and Restaurant, Colorado Springs", "accommodation": "Large sunny park slope apartment, Colorado Springs"}, {"day": 7, "current_city": "from Colorado Springs to North Platte", "transportation": "Self-driving from Colorado Springs to North Platte, duration: 4 hours 40 mins, distance: 536 km", "breakfast": "Derby, Colorado Springs", "attraction": "Garden of the Gods, Colorado Springs;", "lunch": "Club Tokyo - Best Western Skycity Hotel, Colorado Springs", "dinner": "-", "accommodation": "-"}]}]