[{"gpt-4-1106-preview_direct_sole-planning_results": "Travel Plan:\n\nDays: 1\nCurrent City: from Devils Lake (North Dakota) to Alamosa (Colorado)\nTransportation: Self-driving, from Devils Lake to Alamosa, duration: 17 hours 26 mins, distance: 1,811 km, cost: 90\nBreakfast: -\nAttraction: -\nLunch: -\nDinner: Atlanta Highway Seafood Market, Alamosa, cost: 68, cuisines: Fast Food, Desserts, Seafood\nAccommodation: Comfortable studio suite in midtown Manhattan, Alamosa, cost: 67, maximum occupancy: 2, house rules: No parties & No smoking & No visitors, minimum nights: 30\n\nNumber of people: 1\nTotal cost: 1 x 90 + 1 x 68 + 1 x 67 = 225\nAccommodation minimum nights: 1/30\n\nDays: 2\nCurrent City: Alamosa\nTransportation: -\nBreakfast: Riverwalk Cafe, Alamosa, cost: 97, cuisines: Tea, Pizza, Fast Food\nAttraction: San Luis Valley Museum, Alamosa; Rio Grande Farm Park, Alamosa\nLunch: Viva Hyderabad, Alamosa, cost: 90, cuisines: Pizza, Desserts\nDinner: Coffee to Cocktail Bar - Hyatt Place, Alamosa, cost: 35, cuisines: Tea, Indian, Desserts, Italian\nAccommodation: Comfortable studio suite in midtown Manhattan, Alamosa, cost: 67, maximum occupancy: 2, house rules: No parties & No smoking & No visitors, minimum nights: 30\n\nNumber of people: 1\nTotal cost: 1 x 97 + 1 x 90 + 1 x 35 + 1 x 67 = 289\nAccommodation minimum nights: 2/30\n\nDays: 3\nCurrent City: from Alamosa to Grand Junction\nTransportation: Self-driving, from Alamosa to Grand Junction, duration: 4 hours 29 mins, distance: 396 km, cost: 19\nBreakfast: Burger Singh, Alamosa, cost: 95, cuisines: Desserts, Tea, BBQ, Chinese, Seafood\nAttraction: -\nLunch: Street Foods by Punjab Grill, Alamosa, cost: 55, cuisines: Pizza, BBQ, Fast Food, Chinese, Mediterranean\nDinner: Austin's BBQ and Oyster Bar, Grand Junction, cost: 15, cuisines: Tea, Bakery, Fast Food, Indian, Seafood\nAccommodation: NYC Apartment near Central Park!, Grand Junction, cost: 1118, maximum occupancy: 5, house rules: No children under 10, minimum nights: 3\n\nNumber of people: 1\nTotal cost: 1 x 19 + 1 x 95 + 1 x 55 + 1 x 15 + 1 x 1118 = 1302\nAccommodation minimum nights: 1/3\n\nDays: 4\nCurrent City: Grand Junction\nTransportation: -\nBreakfast: 2 Dog, Grand Junction, cost: 29, cuisines: Desserts, BBQ, Fast Food, Cafe, American\nAttraction: Museum of the West, Grand Junction; Eureka! McConnell Science Museum, Grand Junction\nLunch: Thakur Bakers, Grand Junction, cost: 100, cuisines: French, Pizza, Cafe, BBQ\nDinner: Shanghai Bar & Lounge - The Bristol Hotel, Grand Junction, cost: 31, cuisines: Cafe, Pizza\nAccommodation: NYC Apartment near Central Park!, Grand Junction, cost: 1118, maximum occupancy: 5, house rules: No children under 10, minimum nights: 3\n\nNumber of people: 1\nTotal cost: 1 x 29 + 1 x 100 + 1 x 31 + 1 x 1118 = 1278\nAccommodation minimum nights: 2/3\n\nDays: 5\nCurrent City: from Grand Junction to Gunnison\nTransportation: Self-driving, from Grand Junction to Gunnison, duration: 2 hours 27 mins, distance: 200 km, cost: 10\nBreakfast: Pind Balluchi, Grand Junction, cost: 17, cuisines: Fast Food, Chinese, Seafood\nAttraction: -\nLunch: Cocoa Tree, Grand Junction, cost: 68, cuisines: Tea, Chinese, Cafe, Fast Food\nDinner: Happy Joe's Pizza & Ice Cream, Gunnison, cost: 74, cuisines: Desserts, Italian, Bakery, Indian, Seafood\nAccommodation: Full-size loft bed in East Village, Gunnison, cost: 104, maximum occupancy: 1, house rules: No visitors & No pets & No parties, minimum nights: 1\n\nNumber of people: 1\nTotal cost: 1 x 10 + 1 x 17 + 1 x 68 + 1 x 74 + 1 x 104 = 273\nAccommodation minimum nights: 1/1\n\nDays: 6\nCurrent City: Gunnison\nTransportation: -\nBreakfast: SALT, Gunnison, cost: 44, cuisines: Tea, Chinese, BBQ\nAttraction: I.O.O.F. Park, Gunnison; Jorgensen Park, Gunnison\nLunch: Mocha, Gunnison, cost: 30, cuisines: Tea, Cafe, Pizza, BBQ\nDinner: Paradise Inn, Gunnison, cost: 99, cuisines: BBQ, Bakery, Desserts\nAccommodation: Full-size loft bed in East Village, Gunnison, cost: 104, maximum occupancy: 1, house rules: No visitors & No pets & No parties, minimum nights: 1\n\nNumber of people: 1\nTotal cost: 1 x 44 + 1 x 30 + 1 x 99 + 1 x 104 = 277\nAccommodation minimum nights: 2/1\n\nDays: 7\nCurrent City: from Gunnison to Devils Lake\nTransportation: Self-driving, from Gunnison to Devils Lake, duration: 17 hours 30 mins, distance: 1,881 km, cost: 94\nBreakfast: Cyber Hub Social, Gunnison, cost: 95, cuisines: Tea, Fast Food\nAttraction: -\nLunch: -\nDinner: -\nAccommodation: -\n\nNumber of people: 1\nTotal cost: 1 x 94 + 1 x 95 = 189\n\nTotal cost across all days: 1 x 225 + 1 x 289 + 1 x 1302 + 1 x 1278 + 1 x 273 + 1 x 277 + 1 x 189 = 3833\n\nUnfortunately, the total cost exceeds the specified budget of $3,500. To adjust the plan within the budget, we can consider changing the accommodation in Grand Junction to a more affordable option or reducing meal costs. Please let me know how you would like to proceed.", "gpt-4-1106-preview_direct_sole-planning_parsed_results": [{"day": 1, "current_city": "from Devils Lake to Alamosa", "transportation": "Self-driving, from Devils Lake to Alamosa, duration: 17 hours 26 mins, distance: 1,811 km", "breakfast": "-", "attraction": "-", "lunch": "-", "dinner": "Atlanta Highway Seafood Market, Alamosa", "accommodation": "Comfortable studio suite in midtown Manhattan, Alamosa"}, {"day": 2, "current_city": "Alamosa", "transportation": "-", "breakfast": "Riverwalk Cafe, Alamosa", "attraction": "San Luis Valley Museum, Alamosa;Rio Grande Farm Park, Alamosa", "lunch": "Viva Hyderabad, Alamosa", "dinner": "Coffee to Cocktail Bar - Hyatt Place, Alamosa", "accommodation": "Comfortable studio suite in midtown Manhattan, Alamosa"}, {"day": 3, "current_city": "from Alamosa to Grand Junction", "transportation": "Self-driving, from Alamosa to Grand Junction, duration: 4 hours 29 mins, distance: 396 km", "breakfast": "Burger Singh, Alamosa", "attraction": "-", "lunch": "Street Foods by Punjab Grill, Alamosa", "dinner": "Austin's BBQ and Oyster Bar, Grand Junction", "accommodation": "NYC Apartment near Central Park!, Grand Junction"}, {"day": 4, "current_city": "Grand Junction", "transportation": "-", "breakfast": "2 Dog, Grand Junction", "attraction": "Museum of the West, Grand Junction;Eureka! McConnell Science Museum, Grand Junction", "lunch": "Thakur Bakers, Grand Junction", "dinner": "Shanghai Bar & Lounge - The Bristol Hotel, Grand Junction", "accommodation": "NYC Apartment near Central Park!, Grand Junction"}, {"day": 5, "current_city": "from Grand Junction to Gunnison", "transportation": "Self-driving, from Grand Junction to Gunnison, duration: 2 hours 27 mins, distance: 200 km", "breakfast": "Pind Balluchi, Grand Junction", "attraction": "-", "lunch": "Cocoa Tree, Grand Junction", "dinner": "Happy Joe's Pizza & Ice Cream, Gunnison", "accommodation": "Full-size loft bed in East Village, Gunnison"}, {"day": 6, "current_city": "Gunnison", "transportation": "-", "breakfast": "SALT, Gunnison", "attraction": "I.O.O.F. Park, Gunnison;Jorgensen Park, Gunnison", "lunch": "Mocha, Gunnison", "dinner": "Paradise Inn, Gunnison", "accommodation": "Full-size loft bed in East Village, Gunnison"}, {"day": 7, "current_city": "from Gunnison to Devils Lake", "transportation": "Self-driving, from Gunnison to Devils Lake, duration: 17 hours 30 mins, distance: 1,881 km", "breakfast": "Cyber Hub Social, Gunnison", "attraction": "-", "lunch": "-", "dinner": "-", "accommodation": "-"}]}]