[{"gpt-4-1106-preview_direct_sole-planning_results": "Based on the provided information and constraints, here is a 3-day travel plan for one person departing from St. Louis and heading to Washington with a budget of $1,500:\n\n***** Travel Plan *****\n\nDay 1: March 1st, 2022\nCurrent City: from St. Louis to Washington\nTransportation: Flight F3934368, from St. Louis to Washington, departure: 12:42, arrival: 15:38, duration: 1 hour 56 minutes, cost: $162\nBreakfast: -\nAttraction: -\nLunch: -\nDinner: Los Aztecas, Washington, cost: $46, cuisines: Cafe, Bakery, BBQ, Fast Food\nAccommodation: Stunning 2Bed/2BA + 300sqft deck by the river!, Washington, cost: $209, maximum occupancy: 3, house rules: No visitors, minimum nights: 1\n\nNumber of people: 1\nTotal cost: 1 x $162 + 1 x $46 + 1 x $209 = $417\nAccommodation minimum nights: 1/1\n\nDay 2: March 2nd, 2022\nCurrent City: Washington\nTransportation: -\nBreakfast: Manna Java World Cafe, Washington, cost: $59, cuisines: Cafe, Seafood\nAttraction: Space Needle, Washington; The Seattle Great Wheel, Washington\nLunch: Hemingway's Island Grill, Washington, cost: $57, cuisines: Mexican, BBQ, Fast Food, Cafe, Seafood\nDinner: Thaaliwala, Washington, cost: $88, cuisines: Tea, Pizza, Italian, BBQ, Cafe\nAccommodation: Stunning 2Bed/2BA + 300sqft deck by the river!, Washington, cost: $209, maximum occupancy: 3, house rules: No visitors, minimum nights: 1\n\nNumber of people: 1\nTotal cost: 1 x $59 + 1 x $57 + 1 x $88 + 1 x $209 = $413\nAccommodation minimum nights: 2/2\n\nDay 3: March 3rd, 2022\nCurrent City: from Washington to St. Louis\nTransportation: Flight F3788616, from Washington to St. Louis, departure: 16:09, arrival: 17:42, duration: 2 hours 33 minutes, cost: $146\nBreakfast: Cafe Coffee Day, Washington, cost: $53, cuisines: Tea, Mexican, Fast Food, Cafe, American, Seafood\nAttraction: -\nLunch: -\nDinner: -\nAccommodation: -\n\nNumber of people: 1\nTotal cost: 1 x $53 + 1 x $146 = $199\n\nTotal cost across all days: $417 + $413 + $199 = $1,029\n\nCuisines: The prompt specifies no cuisines, so all cuisine constraints are satisfied.\n\n***** End of Travel Plan *****\n\nPlease note that the attractions listed for Day 2 do not have associated costs in the provided information, so they are assumed to be within the budget. The plan includes transportation, meals, and accommodations within the specified budget of $1,500.", "gpt-4-1106-preview_direct_sole-planning_parsed_results": [{"day": 1, "current_city": "from St. Louis to Washington", "transportation": "Flight Number: F3934368, from St. Louis to Washington, Departure Time: 12:42, Arrival Time: 15:38", "breakfast": "-", "attraction": "-", "lunch": "-", "dinner": "Los Aztecas, Washington", "accommodation": "Stunning 2Bed/2BA + 300sqft deck by the river!, Washington"}, {"day": 2, "current_city": "Washington", "transportation": "-", "breakfast": "Manna Java World Cafe, Washington", "attraction": "Space Needle, Washington;The Seattle Great Wheel, Washington;", "lunch": "Hemingway's Island Grill, Washington", "dinner": "Thaaliwala, Washington", "accommodation": "Stunning 2Bed/2BA + 300sqft deck by the river!, Washington"}, {"day": 3, "current_city": "from Washington to St. Louis", "transportation": "Flight Number: F3788616, from Washington to St. Louis, Departure Time: 16:09, Arrival Time: 17:42", "breakfast": "Cafe Coffee Day, Washington", "attraction": "-", "lunch": "-", "dinner": "-", "accommodation": "-"}]}]