[{"gpt-4-1106-preview_direct_sole-planning_results": "Based on the provided information and constraints, here is a 5-day travel plan starting in Sun Valley and visiting San Diego and Redding in California:\n\n**Day 1: Sun Valley to San Diego**\n- Date: March 22, 2022\n- Transportation: Self-driving from Sun Valley to San Diego, duration: 14 hours 9 mins, distance: 1,461 km, cost: $73\n- Breakfast: -\n- Attraction: -\n- Lunch: -\n- Dinner: Open Yard, San Diego, cost: $33, cuisines: Chinese, Pizza, Cafe, Desserts\n- Accommodation: Spacious Room in Large 2 Bedroom Prewar Apartment, San Diego, cost: $585, room type: Private room, house rules: No parties & No visitors, minimum nights: 1, maximum occupancy: 2\n\n**Day 2: San Diego**\n- Date: March 23, 2022\n- Transportation: -\n- Breakfast: Jetha Lal Ka Dhabha, San Diego, cost: $22, cuisines: Tea, Cafe, Indian, Italian\n- Attraction: Balboa Park, San Diego\n- Lunch: Burger King, San Diego, cost: $20, cuisines: Pizza, Italian, French, Fast Food, Seafood\n- Dinner: Gopala, San Diego, cost: $98, cuisines: Pizza, Mexican, BBQ, American, Seafood\n- Accommodation: Spacious Room in Large 2 Bedroom Prewar Apartment, San Diego, cost: $585, room type: Private room, house rules: No parties & No visitors, minimum nights: 1, maximum occupancy: 2\n\n**Day 3: San Diego to Redding**\n- Date: March 24, 2022\n- Transportation: Self-driving from San Diego to Redding, duration: 10 hours 10 mins, distance: 1,070 km, cost: $53\n- Breakfast: -\n- Attraction: Sundial Bridge, Redding\n- Lunch: New Yorker Deli & Pizzeria, Redding, cost: $78, cuisines: Pizza, Bakery, Desserts, Seafood\n- Dinner: Mosaic - Country Inn & Suites, Redding, cost: $57, cuisines: Pizza, Bakery, BBQ, Fast Food, American, Mediterranean\n- Accommodation: 3 Bedroom Cozy Apartment, Redding, cost: $724, room type: Entire home/apt, house rules: No smoking & No pets & No parties, minimum nights: 4, maximum occupancy: 4\n\n**Day 4: Redding**\n- Date: March 25, 2022\n- Transportation: -\n- Breakfast: Perfect Bake, Redding, cost: $69, cuisines: Tea, Pizza, Fast Food\n- Attraction: Turtle Bay Exploration Park, Redding\n- Lunch: Weird Time Food, Redding, cost: $34, cuisines: Bakery, BBQ, Italian\n- Dinner: Cafe 55 - Park Inn, Redding, cost: $88, cuisines: Tea, Pizza, Italian, Fast Food, Seafood\n- Accommodation: 3 Bedroom Cozy Apartment, Redding, cost: $724, room type: Entire home/apt, house rules: No smoking & No pets & No parties, minimum nights: 4, maximum occupancy: 4\n\n**Day 5: Redding to Sun Valley**\n- Date: March 26, 2022\n- Transportation: Self-driving from Redding to Sun Valley, duration: 11 hours 13 mins, distance: 1,087 km, cost: $54\n- Breakfast: -\n- Attraction: -\n- Lunch: -\n- Dinner: -\n- Accommodation: -\n\n**Total Costs:**\n- Transportation: $73 + $53 + $54 = $180\n- Meals: $33 + $22 + $20 + $98 + $78 + $57 + $69 + $34 + $88 = $499\n- Accommodations: $585 + $585 + $724 + $724 = $2,618\n\n**Total Trip Cost: $180 + $499 + $2,618 = $3,297**\n\nUnfortunately, the total cost of the trip exceeds the specified budget of $2,600. Adjustments will need to be made to the plan to reduce costs, such as selecting more affordable accommodations or dining options. Please note that the trip also exceeds the budget due to the minimum stay requirements for accommodations in Redding. If flexibility is allowed regarding the cities visited or the type of accommodations, further adjustments can be made to fit the budget.", "gpt-4-1106-preview_direct_sole-planning_parsed_results": [{"day": 1, "current_city": "from Sun Valley to San Diego", "transportation": "Self-driving from Sun Valley to San Diego, Duration: 14 hours 9 mins, Distance: 1461 km", "breakfast": "-", "attraction": "-", "lunch": "-", "dinner": "Open Yard, San Diego", "accommodation": "Spacious Room in Large 2 Bedroom Prewar Apartment, San Diego"}, {"day": 2, "current_city": "San Diego", "transportation": "-", "breakfast": "Jetha Lal Ka Dhabha, San Diego", "attraction": "Balboa Park, San Diego", "lunch": "Burger King, San Diego", "dinner": "Gopala, San Diego", "accommodation": "Spacious Room in Large 2 Bedroom Prewar Apartment, San Diego"}, {"day": 3, "current_city": "from San Diego to Redding", "transportation": "Self-driving from San Diego to Redding, Duration: 10 hours 10 mins, Distance: 1070 km", "breakfast": "-", "attraction": "Sundial Bridge, Redding", "lunch": "New Yorker Deli & Pizzeria, Redding", "dinner": "Mosaic - Country Inn & Suites, Redding", "accommodation": "3 Bedroom Cozy Apartment, Redding"}, {"day": 4, "current_city": "Redding", "transportation": "-", "breakfast": "Perfect Bake, Redding", "attraction": "Turtle Bay Exploration Park, Redding", "lunch": "Weird Time Food, Redding", "dinner": "Cafe 55 - Park Inn, Redding", "accommodation": "3 Bedroom Cozy Apartment, Redding"}, {"day": 5, "current_city": "from Redding to Sun Valley", "transportation": "Self-driving from Redding to Sun Valley, Duration: 11 hours 13 mins, Distance: 1087 km", "breakfast": "-", "attraction": "-", "lunch": "-", "dinner": "-", "accommodation": "-"}]}]