[{"gpt-4-1106-preview_direct_sole-planning_results": "Travel Plan:\n\nDay 1: March 18, 2022 - From Newark to Miami\n- Current City: from Newark (New Jersey) to Miami (Florida)\n- Transportation: Flight F3702793, from Newark to Miami, duration: 2 hours 56 minutes, cost: $266 per person\n- Breakfast: -\n- Attraction: -\n- Lunch: -\n- Dinner: Shorts Burger and Shine, Miami, cost: $81, cuisines: Chinese, Cafe, Seafood\n- Accommodation: \"HELLO BROOKLYN\" PARK SIDE VIEW NEWLY RENO APT., Miami, cost: $789, entire home/apt, house rules: No parties & No visitors, minimum nights: 1, maximum occupancy: 6\n\nNumber of people: 3\nTotal cost: 3 x $266 (flight) + 3 x $81 (dinner) + $789 (accommodation) = $1,620\n\nDay 2: March 19, 2022 - Miami\n- Current City: Miami\n- Transportation: -\n- Breakfast: Clocked, Miami, cost: $49, cuisines: Tea, Italian, Mexican, BBQ, Cafe\n- Attraction: Jungle Island, Miami; P\u00e9rez Art Museum Miami, Miami\n- Lunch: Tako Cheena by Pom Pom, Miami, cost: $60, cuisines: Fast Food, Indian, Desserts, Italian\n- Dinner: AB's Absolute Barbecues, Miami, cost: $55, cuisines: Desserts, Tea, Pizza, Italian, Fast Food, American\n- Accommodation: \"HELLO BROOKLYN\" PARK SIDE VIEW NEWLY RENO APT., Miami, cost: $789, entire home/apt, house rules: No parties & No visitors, minimum nights: 1, maximum occupancy: 6\n\nNumber of people: 3\nTotal cost: 3 x $49 (breakfast) + 3 x $60 (lunch) + 3 x $55 (dinner) + $789 (accommodation) = $1,431\n\nDay 3: March 20, 2022 - From Miami to Punta Gorda\n- Current City: from Miami (Florida) to Punta Gorda (Florida)\n- Transportation: Taxi from Miami to Punta Gorda, duration: 2 hours 41 mins, cost: $291\n- Breakfast: Papouli's Mediterranean Cafe & Market, Miami, cost: $26, cuisines: Tea, Desserts\n- Attraction: -\n- Lunch: -\n- Dinner: D.O.C Ristorante, Punta Gorda, cost: $97, cuisines: Chinese, Bakery, American, Cafe\n- Accommodation: Beautiful Manhattan Apt- 20 min to Times Square, Punta Gorda, cost: $79, entire home/apt, house rules: No children under 10, minimum nights: 7, maximum occupancy: 3\n\nNumber of people: 3\nTotal cost: 3 x $26 (breakfast) + $291 (taxi) + 3 x $97 (dinner) + $79 (accommodation) = $739\n\nDay 4: March 21, 2022 - Punta Gorda\n- Current City: Punta Gorda\n- Transportation: -\n- Breakfast: Cookie Shoppe, Punta Gorda, cost: $44, cuisines: Tea, Bakery, BBQ, Mediterranean, Seafood\n- Attraction: Laishley Park, Punta Gorda; Charlotte Harbor Preserve State Park, Punta Gorda\n- Lunch: China Cafe, Punta Gorda, cost: $69, cuisines: Desserts, Bakery, Cafe, Mediterranean, Seafood\n- Dinner: Urban Cuisine, Punta Gorda, cost: $84, cuisines: Desserts, Tea, Mexican, Fast Food, Chinese, Seafood\n- Accommodation: Beautiful Manhattan Apt- 20 min to Times Square, Punta Gorda, cost: $79, entire home/apt, house rules: No children under 10, minimum nights: 7, maximum occupancy: 3\n\nNumber of people: 3\nTotal cost: 3 x $44 (breakfast) + 3 x $69 (lunch) + 3 x $84 (dinner) + $79 (accommodation) = $793\n\nDay 5: March 22, 2022 - From Punta Gorda to Jacksonville\n- Current City: from Punta Gorda (Florida) to Jacksonville (Florida)\n- Transportation: Taxi from Punta Gorda to Jacksonville, duration: 4 hours 26 mins, cost: $474\n- Breakfast: G Thal, Punta Gorda, cost: $61, cuisines: Desserts, Bakery, Cafe, American, Mediterranean\n- Attraction: -\n- Lunch: -\n- Dinner: Villa Gargano, Jacksonville, cost: $51, cuisines: Tea, American, Desserts\n- Accommodation: NYC Sanctuary, Skyline Views & Rooftop, Jacksonville, cost: $954, entire home/apt, house rules: No smoking, minimum nights: 3, maximum occupancy: 6\n\nNumber of people: 3\nTotal cost: 3 x $61 (breakfast) + $474 (taxi) + 3 x $51 (dinner) + $954 (accommodation) = $1,813\n\nDay 6: March 23, 2022 - Jacksonville\n- Current City: Jacksonville\n- Transportation: -\n- Breakfast: Goose Feathers Cafe and Bakery, Jacksonville, cost: $57, cuisines: Tea, Fast Food, Italian\n- Attraction: Jacksonville Zoo and Gardens, Jacksonville; Southbank Riverwalk, Jacksonville\n- Lunch: Ashoka Restaurant, Jacksonville, cost: $11, cuisines: Desserts, Mexican, Bakery, BBQ, Fast Food\n- Dinner: Sanjha Chulha, Jacksonville, cost: $57, cuisines: Tea, Bakery, BBQ\n- Accommodation: NYC Sanctuary, Skyline Views & Rooftop, Jacksonville, cost: $954, entire home/apt, house rules: No smoking, minimum nights: 3, maximum occupancy: 6\n\nNumber of people: 3\nTotal cost: 3 x $57 (breakfast) + 3 x $11 (lunch) + 3 x $57 (dinner) + $954 (accommodation) = $1,404\n\nDay 7: March 24, 2022 - From Jacksonville to Newark\n- Current City: from Jacksonville (Florida) to Newark (New Jersey)\n- Transportation: Flight F4075995, from Jacksonville to Newark, duration: 1 hour 53 minutes, cost: $306 per person\n- Breakfast: Pirates' House Restaurant, Jacksonville, cost: $59, cuisines: Chinese, Pizza, BBQ\n- Attraction: -\n- Lunch: -\n- Dinner: -\n- Accommodation: -\n\nNumber of people: 3\nTotal cost: 3 x $306 (flight) + 3 x $59 (breakfast) = $1,095\n\nTotal cost across all days: $1,620 + $1,431 + $739 + $793 + $1,813 + $1,404 + $1,095 = $8,895\n\nRemaining budget: $10,400 - $8,895 = $1,505\n\nCuisines: The prompt specifies no cuisines, so all cuisine constraints are satisfied.\n\nAccommodations: All accommodations are entire home/apt as requested, and party-friendly locations were selected where possible, within the constraints of the available accommodations.\n\nTransportation: Flights and taxis were used for transportation between cities as per the constraint of not self-driving.", "gpt-4-1106-preview_direct_sole-planning_parsed_results": [{"day": 1, "current_city": "from Newark to Miami", "transportation": "Flight Number: F3702793, from Newark to Miami, Departure Time: -, Arrival Time: -", "breakfast": "-", "attraction": "-", "lunch": "-", "dinner": "Shorts Burger and Shine, Miami", "accommodation": "\"HELLO BROOKLYN\" PARK SIDE VIEW NEWLY RENO APT., Miami"}, {"day": 2, "current_city": "Miami", "transportation": "-", "breakfast": "Clocked, Miami", "attraction": "Jungle Island, Miami;P\u00e9rez Art Museum Miami, Miami;", "lunch": "Tako Cheena by Pom Pom, Miami", "dinner": "AB's Absolute Barbecues, Miami", "accommodation": "\"HELLO BROOKLYN\" PARK SIDE VIEW NEWLY RENO APT., Miami"}, {"day": 3, "current_city": "from Miami to Punta Gorda", "transportation": "Taxi from Miami to Punta Gorda, Departure Time: -, Arrival Time: -", "breakfast": "Papouli's Mediterranean Cafe & Market, Miami", "attraction": "-", "lunch": "-", "dinner": "D.O.C Ristorante, Punta Gorda", "accommodation": "Beautiful Manhattan Apt- 20 min to Times Square, Punta Gorda"}, {"day": 4, "current_city": "Punta Gorda", "transportation": "-", "breakfast": "Cookie Shoppe, Punta Gorda", "attraction": "Laishley Park, Punta Gorda;Charlotte Harbor Preserve State Park, Punta Gorda;", "lunch": "China Cafe, Punta Gorda", "dinner": "Urban Cuisine, Punta Gorda", "accommodation": "Beautiful Manhattan Apt- 20 min to Times Square, Punta Gorda"}, {"day": 5, "current_city": "from Punta Gorda to Jacksonville", "transportation": "Taxi from Punta Gorda to Jacksonville, Departure Time: -, Arrival Time: -", "breakfast": "G Thal, Punta Gorda", "attraction": "-", "lunch": "-", "dinner": "Villa Gargano, Jacksonville", "accommodation": "NYC Sanctuary, Skyline Views & Rooftop, Jacksonville"}, {"day": 6, "current_city": "Jacksonville", "transportation": "-", "breakfast": "Goose Feathers Cafe and Bakery, Jacksonville", "attraction": "Jacksonville Zoo and Gardens, Jacksonville;Southbank Riverwalk, Jacksonville;", "lunch": "Ashoka Restaurant, Jacksonville", "dinner": "Sanjha Chulha, Jacksonville", "accommodation": "NYC Sanctuary, Skyline Views & Rooftop, Jacksonville"}, {"day": 7, "current_city": "from Jacksonville to Newark", "transportation": "Flight Number: F4075995, from Jacksonville to Newark, Departure Time: -, Arrival Time: -", "breakfast": "Pirates' House Restaurant, Jacksonville", "attraction": "-", "lunch": "-", "dinner": "-", "accommodation": "-"}]}]