[{"gpt-4-1106-preview_direct_sole-planning_results": "Based on the provided information and constraints, here is a 7-day travel plan for a trip from Savannah to three different cities in Texas, from March 24th to March 30th, 2022, with a budget of $3,200.\n\n**Day 1: Savannah to Houston**\n- Transportation: Flight F4011368, from Savannah to Houston, cost: $202, departure: 17:38, arrival: 19:12\n- Dinner: Jalapenos, Houston, cost: $57, cuisines: Desserts, Tea, Cafe, Chinese, Seafood\n- Accommodation: Sunny and Airy near Manhattan, Houston, cost: $499, room type: Entire home/apt, house rules: No pets, minimum nights: 2\n\n**Day 2: Houston**\n- Breakfast: Super Bakery, Houston, cost: $30, cuisines: Seafood, Fast Food\n- Attraction: Space Center Houston, Houston; Houston Museum of Natural Science, Houston\n- Lunch: The BrewMaster - The Mix Fine Dine, Houston, cost: $52, cuisines: French, Indian, Cafe, Seafood\n- Dinner: Al Arabian Express, Houston, cost: $74, cuisines: BBQ, Desserts, Seafood\n- Accommodation: Sunny and Airy near Manhattan, Houston, cost: $499\n\n**Day 3: Houston to Longview**\n- Transportation: Self-driving, from Houston to Longview, cost: $17\n- Breakfast: Cyber Adda 24, Houston, cost: $73, cuisines: Chinese, Pizza, Bakery\n- Attraction: Longview World of Wonders, Longview; Gregg County Historical Museum, Longview\n- Lunch: Barbeque Nation, Longview, cost: $26, cuisines: Cafe, Bakery\n- Dinner: Monster's Cafe, Longview, cost: $94, cuisines: Tea, Bakery, Fast Food, Cafe, American, Mediterranean\n- Accommodation: Luxury STUDIO * PVT Entrance * WOW, Longview, cost: $406, room type: Entire home/apt, house rules: No visitors, minimum nights: 1\n\n**Day 4: Longview**\n- Breakfast: Apna Restaurant, Longview, cost: $17, cuisines: American, BBQ, Fast Food\n- Attraction: Longview Museum of Fine Arts, Longview; KidsView Playground, Longview\n- Lunch: Apni Rasoi, Longview, cost: $25, cuisines: Desserts, Tea, Pizza, Italian, Seafood\n- Dinner: Bikaner Sweets & Restaurant, Longview, cost: $98, cuisines: Tea, Seafood\n- Accommodation: Luxury STUDIO * PVT Entrance * WOW, Longview, cost: $406\n\n**Day 5: Longview to Dallas**\n- Transportation: Flight F3589753, from Longview to Dallas, cost: $59, departure: 13:49, arrival: 14:51\n- Breakfast: Sham Sweets, Longview, cost: $69, cuisines: Cafe, Bakery, BBQ, Fast Food, Chinese\n- Attraction: The Dallas World Aquarium, Dallas; The Sixth Floor Museum at Dealey Plaza, Dallas\n- Lunch: Coconuts Fish Cafe, Dallas, cost: $38, cuisines: Cafe, BBQ, Mediterranean, Fast Food\n- Dinner: 1918 Bistro & Grill, Dallas, cost: $90, cuisines: Tea, Pizza, BBQ, Seafood\n- Accommodation: 1BR, elevator, kitchen, doorman!, Dallas, cost: $475, room type: Entire home/apt, house rules: No parties, minimum nights: 1\n\n**Day 6: Dallas**\n- Breakfast: Yanki Sizzlers, Dallas, cost: $96, cuisines: Cafe, French, Tea, Mediterranean\n- Attraction: Reunion Tower, Dallas; Dallas Museum of Art, Dallas\n- Lunch: Delhicacy, Dallas, cost: $67, cuisines: Desserts, Mexican, Bakery, Chinese, Seafood\n- Dinner: L'Opera, Dallas, cost: $77, cuisines: French, Bakery, BBQ, Fast Food, Seafood\n- Accommodation: 1BR, elevator, kitchen, doorman!, Dallas, cost: $475\n\n**Day 7: Dallas to Savannah**\n- Transportation: Flight F3675920, from Dallas to Savannah, cost: $287, departure: 13:39, arrival: 17:02\n- Breakfast: Cafe Gatherings, Dallas, cost: $17, cuisines: Bakery, Indian, Desserts\n- Lunch: (Not applicable due to travel)\n- Dinner: (Not applicable due to travel)\n- Accommodation: (Not applicable due to return to Savannah)\n\n**Total Cost Calculation:**\n- Flights: $202 + $59 + $287 = $548\n- Self-driving: $17\n- Accommodations: $499 + $499 + $406 + $406 + $475 + $475 = $2760\n- Meals: $57 + $30 + $52 + $74 + $73 + $26 + $94 + $17 + $25 + $98 + $69 + $38 + $90 + $96 + $67 + $77 + $17 = $910\n- Attractions: (No entry fees provided, assuming included in budget)\n\n**Total Cost: $548 (flights) + $17 (self-driving) + $2760 (accommodations) + $910 (meals) = $4235**\n\nUnfortunately, the total cost exceeds the budget of $3,200. To fit within the budget, we would need to adjust the plan by selecting more budget-friendly accommodations or meals, or by reducing the number of attractions visited. Please let me know how you would like to proceed, and I can adjust the plan accordingly.", "gpt-4-1106-preview_direct_sole-planning_parsed_results": [{"day": 1, "current_city": "from Savannah to Houston", "transportation": "Flight Number: F4011368, from Savannah to Houston, Departure Time: 17:38, Arrival Time: 19:12", "breakfast": "-", "attraction": "-", "lunch": "-", "dinner": "Jalapenos, Houston", "accommodation": "Sunny and Airy near Manhattan, Houston"}, {"day": 2, "current_city": "Houston", "transportation": "-", "breakfast": "Super Bakery, Houston", "attraction": "Space Center Houston, Houston;Houston Museum of Natural Science, Houston;", "lunch": "The BrewMaster - The Mix Fine Dine, Houston", "dinner": "Al Arabian Express, Houston", "accommodation": "Sunny and Airy near Manhattan, Houston"}, {"day": 3, "current_city": "from Houston to Longview", "transportation": "Self-driving, from Houston to Longview", "breakfast": "Cyber Adda 24, Houston", "attraction": "Longview World of Wonders, Longview;Gregg County Historical Museum, Longview;", "lunch": "Barbeque Nation, Longview", "dinner": "Monster's Cafe, Longview", "accommodation": "Luxury STUDIO * PVT Entrance * WOW, Longview"}, {"day": 4, "current_city": "Longview", "transportation": "-", "breakfast": "Apna Restaurant, Longview", "attraction": "Longview Museum of Fine Arts, Longview;KidsView Playground, Longview;", "lunch": "Apni Rasoi, Longview", "dinner": "Bikaner Sweets & Restaurant, Longview", "accommodation": "Luxury STUDIO * PVT Entrance * WOW, Longview"}, {"day": 5, "current_city": "from Longview to Dallas", "transportation": "Flight Number: F3589753, from Longview to Dallas, Departure Time: 13:49, Arrival Time: 14:51", "breakfast": "Sham Sweets, Longview", "attraction": "The Dallas World Aquarium, Dallas;The Sixth Floor Museum at Dealey Plaza, Dallas;", "lunch": "Coconuts Fish Cafe, Dallas", "dinner": "1918 Bistro & Grill, Dallas", "accommodation": "1BR, elevator, kitchen, doorman!, Dallas"}, {"day": 6, "current_city": "Dallas", "transportation": "-", "breakfast": "Yanki Sizzlers, Dallas", "attraction": "Reunion Tower, Dallas;Dallas Museum of Art, Dallas;", "lunch": "Delhicacy, Dallas", "dinner": "L'Opera, Dallas", "accommodation": "1BR, elevator, kitchen, doorman!, Dallas"}, {"day": 7, "current_city": "from Dallas to Savannah", "transportation": "Flight Number: F3675920, from Dallas to Savannah, Departure Time: 13:39, Arrival Time: 17:02", "breakfast": "Cafe Gatherings, Dallas", "attraction": "-", "lunch": "-", "dinner": "-", "accommodation": "-"}]}]