[{"gpt-4-1106-preview_direct_sole-planning_results": "Based on the provided information and constraints, here is a travel plan for a group of 4 people departing from Baton Rouge to Dallas for 3 days, from March 25th to March 27th, 2022, with a total budget of $5,500 and a requirement for accommodations where smoking is permitted.\n\n***** Travel Plan *****\n\nDay 1: March 25th, Baton Rouge to Dallas\n- Transportation: Flight F3815317, from Baton Rouge to Dallas, cost: $161 per person, total cost: $644\n- Breakfast: Not applicable (assuming departure from Baton Rouge after breakfast)\n- Attraction: The Dallas World Aquarium, cost: $0 (assuming no entry fee is required)\n- Lunch: Coconuts Fish Cafe, Dallas, cost: $38 per person, total cost: $152, cuisines: Cafe, BBQ, Mediterranean, Fast Food\n- Dinner: 1918 Bistro & Grill, Dallas, cost: $90 per person, total cost: $360, cuisines: Tea, Pizza, BBQ, Seafood\n- Accommodation: Friendly hosts, Dallas, cost: $806 per night (smoking permitted), total cost: $806\n\nNumber of people: 4\nTotal cost for Day 1: $644 (flight) + $152 (lunch) + $360 (dinner) + $806 (accommodation) = $1,962\n\nDay 2: March 26th, Dallas\n- Transportation: Not applicable (staying in Dallas)\n- Breakfast: Cafe Gatherings, Dallas, cost: $17 per person, total cost: $68, cuisines: Bakery, Indian, Desserts\n- Attraction: The Sixth Floor Museum at Dealey Plaza, cost: $0 (assuming no entry fee is required)\n- Lunch: Yanki Sizzlers, Dallas, cost: $96 per person, total cost: $384, cuisines: Cafe, French, Tea, Mediterranean\n- Dinner: L'Opera, Dallas, cost: $77 per person, total cost: $308, cuisines: French, Bakery, BBQ, Fast Food, Seafood\n- Accommodation: Friendly hosts, Dallas, cost: $806 per night (smoking permitted), total cost: $806\n\nNumber of people: 4\nTotal cost for Day 2: $68 (breakfast) + $384 (lunch) + $308 (dinner) + $806 (accommodation) = $1,566\n\nDay 3: March 27th, Dallas to Baton Rouge\n- Transportation: Flight F3814165, from Dallas to Baton Rouge, cost: $87 per person, total cost: $348\n- Breakfast: Drifters Cafe, Dallas, cost: $21 per person, total cost: $84, cuisines: Tea, French, Mexican, Cafe, Seafood\n- Attraction: Not applicable (assuming departure from Dallas after breakfast)\n- Lunch: Not applicable (assuming arrival in Baton Rouge after lunch)\n- Dinner: Not applicable (assuming the group is back in Baton Rouge)\n- Accommodation: Not applicable (assuming the group is back in Baton Rouge)\n\nNumber of people: 4\nTotal cost for Day 3: $348 (flight) + $84 (breakfast) = $432\n\nTotal cost across all days: $1,962 (Day 1) + $1,566 (Day 2) + $432 (Day 3) = $3,960\n\nRemaining budget: $5,500 - $3,960 = $1,540\n\nCuisines: All cuisine constraints are satisfied.\nAccommodation: Smoking is permitted in the chosen accommodation.\n\n***** End of Travel Plan *****\n\nPlease note that the costs for attractions are assumed to be $0 as the entry fees were not provided. The total cost is within the specified budget of $5,500. The accommodation selected allows smoking, as per the requirement.", "gpt-4-1106-preview_direct_sole-planning_parsed_results": [{"day": 1, "current_city": "from Baton Rouge to Dallas", "transportation": "Flight Number: F3815317, from Baton Rouge to Dallas, Departure Time: -, Arrival Time: -", "breakfast": "-", "attraction": "The Dallas World Aquarium, Dallas;", "lunch": "Coconuts Fish Cafe, Dallas", "dinner": "1918 Bistro & Grill, Dallas", "accommodation": "Friendly hosts, Dallas"}, {"day": 2, "current_city": "Dallas", "transportation": "-", "breakfast": "Cafe Gatherings, Dallas", "attraction": "The Sixth Floor Museum at Dealey Plaza, Dallas;", "lunch": "Yanki Sizzlers, Dallas", "dinner": "L'Opera, Dallas", "accommodation": "Friendly hosts, Dallas"}, {"day": 3, "current_city": "from Dallas to Baton Rouge", "transportation": "Flight Number: F3814165, from Dallas to Baton Rouge, Departure Time: -, Arrival Time: -", "breakfast": "Drifters Cafe, Dallas", "attraction": "-", "lunch": "-", "dinner": "-", "accommodation": "-"}]}]