[{"gpt-4-1106-preview_direct_sole-planning_results": "Travel Plan:\n\nDays: 1\nCurrent City: from Birmingham to Miami\nTransportation: Flight F3592321, from Birmingham to Miami, duration: 1 hours 56 minutes, cost: 201\nBreakfast: -\nAttraction: -\nLunch: -\nDinner: Clocked, Miami, cost: 49, cuisines: Tea, Italian, Mexican, BBQ, Cafe\nAccommodation: Simple and clean bedroom with good view and light, Miami, cost: 669, maximum occupancy: 2, house rules: No children under 10, minimum nights: 1\n\nNumber of people: 1\nTotal cost: 1 x 201 + 1 x 49 + 1 x 669 = 919\nAccommodation minimum nights: 1/1\n\nDays: 2\nCurrent City: Miami\nTransportation: -\nBreakfast: Papouli's Mediterranean Cafe & Market, Miami, cost: 26, cuisines: Tea, Desserts\nAttraction: Jungle Island, Miami; P\u00e9rez Art Museum Miami, Miami\nLunch: Spice It - Hotel IBIS, Miami, cost: 38, cuisines: Pizza, Indian, Fast Food, American, Seafood\nDinner: AB's Absolute Barbecues, Miami, cost: 55, cuisines: Desserts, Tea, Pizza, Italian, Fast Food, American\nAccommodation: Simple and clean bedroom with good view and light, Miami, cost: 669, maximum occupancy: 2, house rules: No children under 10, minimum nights: 1\n\nNumber of people: 1\nTotal cost: 1 x 26 + 1 x 38 + 1 x 55 + 1 x 669 = 788\nAccommodation minimum nights: 2/2\n\nDays: 3\nCurrent City: from Miami to Orlando\nTransportation: Flight F3670435, from Miami to Orlando, duration: 1 hours 8 minutes, cost: 46\nBreakfast: Cafe 17, Miami, cost: 45, cuisines: Tea, BBQ, Bakery, Desserts\nAttraction: -\nLunch: -\nDinner: Fuji Japanese Steakhouse, Orlando, cost: 75, cuisines: Tea, Bakery, Desserts\nAccommodation: Private furnished bedroom in Williamsburg, Orlando, cost: 179, maximum occupancy: 1, house rules: No parties & No smoking & No children under 10, minimum nights: 5\n\nNumber of people: 1\nTotal cost: 1 x 46 + 1 x 45 + 1 x 75 + 1 x 179 = 345\nAccommodation minimum nights: 1/5\n\nDays: 4\nCurrent City: Orlando\nTransportation: -\nBreakfast: Turquoise Villa, Orlando, cost: 55, cuisines: French, Bakery, BBQ, Fast Food\nAttraction: SeaWorld Orlando, Orlando; The Wheel at ICON Park, Orlando\nLunch: The Tandoori Times, Orlando, cost: 84, cuisines: Tea, Cafe, BBQ, Italian\nDinner: Indochi Cafe & Restaurant, Orlando, cost: 72, cuisines: Pizza, French, Bakery, Fast Food, Indian, Seafood\nAccommodation: Private furnished bedroom in Williamsburg, Orlando, cost: 179, maximum occupancy: 1, house rules: No parties & No smoking & No children under 10, minimum nights: 5\n\nNumber of people: 1\nTotal cost: 1 x 55 + 1 x 84 + 1 x 72 + 1 x 179 = 390\nAccommodation minimum nights: 2/5\n\nDays: 5\nCurrent City: from Orlando to Birmingham\nTransportation: Flight F3987879, from Orlando to Birmingham, duration: 1 hours 48 minutes, cost: 116\nBreakfast: Chaayos, Orlando, cost: 73, cuisines: Tea, Cafe, Mexican\nAttraction: -\nLunch: -\nDinner: -\nAccommodation: -\n\nNumber of people: 1\nTotal cost: 1 x 116 + 1 x 73 = 189\n\nTotal cost across all days: 1 x 919 + 1 x 788 + 1 x 345 + 1 x 390 + 1 x 189 = 2,631\n\nCuisines: The prompt specifies no cuisines, so all cuisine constraints are satisfied.", "gpt-4-1106-preview_direct_sole-planning_parsed_results": [{"day": 1, "current_city": "from Birmingham to Miami", "transportation": "Flight Number: F3592321, from Birmingham to Miami, Duration: 1 hours 56 minutes", "breakfast": "-", "attraction": "-", "lunch": "-", "dinner": "Clocked, Miami", "accommodation": "Simple and clean bedroom with good view and light, Miami"}, {"day": 2, "current_city": "Miami", "transportation": "-", "breakfast": "Papouli's Mediterranean Cafe & Market, Miami", "attraction": "Jungle Island, Miami;P\u00e9rez Art Museum Miami, Miami;", "lunch": "Spice It - Hotel IBIS, Miami", "dinner": "AB's Absolute Barbecues, Miami", "accommodation": "Simple and clean bedroom with good view and light, Miami"}, {"day": 3, "current_city": "from Miami to Orlando", "transportation": "Flight Number: F3670435, from Miami to Orlando, Duration: 1 hours 8 minutes", "breakfast": "Cafe 17, Miami", "attraction": "-", "lunch": "-", "dinner": "Fuji Japanese Steakhouse, Orlando", "accommodation": "Private furnished bedroom in Williamsburg, Orlando"}, {"day": 4, "current_city": "Orlando", "transportation": "-", "breakfast": "Turquoise Villa, Orlando", "attraction": "SeaWorld Orlando, Orlando;The Wheel at ICON Park, Orlando;", "lunch": "The Tandoori Times, Orlando", "dinner": "Indochi Cafe & Restaurant, Orlando", "accommodation": "Private furnished bedroom in Williamsburg, Orlando"}, {"day": 5, "current_city": "from Orlando to Birmingham", "transportation": "Flight Number: F3987879, from Orlando to Birmingham, Duration: 1 hours 48 minutes", "breakfast": "Chaayos, Orlando", "attraction": "-", "lunch": "-", "dinner": "-", "accommodation": "-"}]}]