[{"gpt-4-1106-preview_direct_sole-planning_results": "Based on the provided query and reference information, here is a comprehensive 5-day travel plan for a group of 7 people, starting from Washington and visiting 2 cities in New York (Buffalo and New York City), from March 23rd to March 27th, 2022, with a budget of $9,100. The plan includes entire room accommodations and avoids self-driving for transportation. The dining options will include American, Mexican, Chinese, and Italian cuisines.\n\n**Day 1: Washington to Buffalo (March 23, 2022)**\n\n- Transportation: Flight F3791094 from Washington to Buffalo, cost: $61 per person\n- Total transportation cost: 7 x $61 = $427\n- Breakfast: Not applicable (Assuming departure is in the morning)\n- Lunch: Shokitini, Buffalo, cost: $41 per person, cuisines: Tea, Cafe, Pizza, Mexican, Chinese, Seafood\n- Total lunch cost: 7 x $41 = $287\n- Dinner: Tibby's New Orleans Kitchen, Buffalo, cost: $48 per person, cuisines: Seafood, Indian, BBQ, Italian\n- Total dinner cost: 7 x $48 = $336\n- Attraction: The Buffalo Zoo, Buffalo\n- Accommodation: Cozy Studio in Heart of Ft Greene, Buffalo, cost: $200 per night, entire home/apt\n- Total accommodation cost: $200 x 2 nights = $400 (assuming a 2-night stay)\n- Total cost for Day 1: $427 + $287 + $336 + $400 = $1,450\n\n**Day 2: Buffalo (March 24, 2022)**\n\n- Transportation: Not applicable (Staying in Buffalo)\n- Breakfast: Punjab Grill, Buffalo, cost: $25 per person, cuisines: Bakery, BBQ, Desserts, Seafood\n- Total breakfast cost: 7 x $25 = $175\n- Lunch: Ammu's South Indian Restaurant, Buffalo, cost: $80 per person, cuisines: Desserts, Pizza, French, BBQ, Chinese\n- Total lunch cost: 7 x $80 = $560\n- Dinner: Invitation Foodex, Buffalo, cost: $85 per person, cuisines: Desserts, Pizza, Italian, Bakery, BBQ, Mediterranean\n- Total dinner cost: 7 x $85 = $595\n- Attraction: Buffalo and Erie County Botanical Gardens, Buffalo\n- Accommodation: Cozy Studio in Heart of Ft Greene, Buffalo (already accounted for in Day 1)\n- Total cost for Day 2: $175 + $560 + $595 = $1,330\n\n**Day 3: Buffalo to New York City (March 25, 2022)**\n\n- Transportation: Flight F3644292 from Buffalo to New York, cost: $77 per person\n- Total transportation cost: 7 x $77 = $539\n- Breakfast: Room Service, Buffalo, cost: $94 per person, cuisines: Bakery, Indian, BBQ, Italian\n- Total breakfast cost: 7 x $94 = $658\n- Lunch: Seasons 52 Fresh Grill, New York, cost: $30 per person, cuisines: Seafood, Indian, Desserts, Italian\n- Total lunch cost: 7 x $30 = $210\n- Dinner: Gurgaon Hights, New York, cost: $46 per person, cuisines: Cafe, American, Indian, Fast Food\n- Total dinner cost: 7 x $46 = $322\n- Attraction: Empire State Building, New York\n- Accommodation: A Contemporary Homelike Stay in the Best of BK, New York, cost: $228 per night, entire home/apt\n- Total accommodation cost: $228 x 2 nights = $456 (assuming a 2-night stay)\n- Total cost for Day 3: $539 + $658 + $210 + $322 + $456 = $2,185\n\n**Day 4: New York City (March 26, 2022)**\n\n- Transportation: Not applicable (Staying in New York City)\n- Breakfast: Green Chick Chop, New York, cost: $26 per person, cuisines: Tea, French, Cafe, Seafood\n- Total breakfast cost: 7 x $26 = $182\n- Lunch: Lord of the Drinks Forum, New York, cost: $71 per person, cuisines: Cafe, Bakery, BBQ, Chinese, Indian\n- Total lunch cost: 7 x $71 = $497\n- Dinner: Goosebumps, New York, cost: $94 per person, cuisines: Chinese, Pizza, Bakery\n- Total dinner cost: 7 x $94 = $658\n- Attraction: Statue of Liberty, New York\n- Accommodation: A Contemporary Homelike Stay in the Best of BK, New York (already accounted for in Day 3)\n- Total cost for Day 4: $182 + $497 + $658 = $1,337\n\n**Day 5: New York City to Washington (March 27, 2022)**\n\n- Transportation: Flight F3661892 from New York to Washington, cost: $64 per person\n- Total transportation cost: 7 x $64 = $448\n- Breakfast: Baltazar, New York, cost: $46 per person, cuisines: Tea, Fast Food, Bakery, Seafood\n- Total breakfast cost: 7 x $46 = $322\n- Lunch: Not applicable (Assuming return to Washington is in the afternoon)\n- Dinner: Not applicable (Assuming return to Washington is in the afternoon)\n- Attraction: Central Park, New York (before departure)\n- Accommodation: Not applicable (Returning to Washington)\n- Total cost for Day 5: $448 + $322 = $770\n\n**Total Cost for the Trip: $1,450 + $1,330 + $2,185 + $1,337 + $770 = $7,072**\n\nRemaining Budget: $9,100 - $7,072 = $2,028\n\nThe travel plan includes transportation, meals, attractions, and accommodations for each day, adhering to the specified constraints. The total cost is within the allocated budget, and the plan includes a variety of cuisines as requested.", "gpt-4-1106-preview_direct_sole-planning_parsed_results": [{"day": 1, "current_city": "from Washington to Buffalo", "transportation": "Flight Number: F3791094, from Washington to Buffalo, Departure Time: -, Arrival Time: -", "breakfast": "-", "attraction": "The Buffalo Zoo, Buffalo;", "lunch": "Shokitini, Buffalo", "dinner": "Tibby's New Orleans Kitchen, Buffalo", "accommodation": "Cozy Studio in Heart of Ft Greene, Buffalo"}, {"day": 2, "current_city": "Buffalo", "transportation": "-", "breakfast": "Punjab Grill, Buffalo", "attraction": "Buffalo and Erie County Botanical Gardens, Buffalo;", "lunch": "Ammu's South Indian Restaurant, Buffalo", "dinner": "Invitation Foodex, Buffalo", "accommodation": "Cozy Studio in Heart of Ft Greene, Buffalo"}, {"day": 3, "current_city": "from Buffalo to New York City", "transportation": "Flight Number: F3644292, from Buffalo to New York, Departure Time: -, Arrival Time: -", "breakfast": "Room Service, Buffalo", "attraction": "Empire State Building, New York;", "lunch": "Seasons 52 Fresh Grill, New York", "dinner": "Gurgaon Hights, New York", "accommodation": "A Contemporary Homelike Stay in the Best of BK, New York"}, {"day": 4, "current_city": "New York City", "transportation": "-", "breakfast": "Green Chick Chop, New York", "attraction": "Statue of Liberty, New York;", "lunch": "Lord of the Drinks Forum, New York", "dinner": "Goosebumps, New York", "accommodation": "A Contemporary Homelike Stay in the Best of BK, New York"}, {"day": 5, "current_city": "from New York City to Washington", "transportation": "Flight Number: F3661892, from New York to Washington, Departure Time: -, Arrival Time: -", "breakfast": "Baltazar, New York", "attraction": "Central Park, New York;", "lunch": "-", "dinner": "-", "accommodation": "-"}]}]