[{"gpt-4-1106-preview_direct_sole-planning_results": "Based on the provided information and constraints, here is the travel plan for a 3-day solo trip from Ontario to Honolulu from March 4th to March 6th, 2022, with a total budget of $3,200:\n\n***** Travel Plan *****\n\nDay 1: March 4th, 2022\nCurrent City: from Ontario to Honolulu\nTransportation: Flight F3584294, from Ontario to Honolulu, departure: 10:11, arrival: 14:46, duration: 6 hours 35 minutes, cost: $888\nBreakfast: -\nAttraction: -\nLunch: -\nDinner: Bait El Khetyar, Honolulu, cost: $28, cuisines: Cafe, Seafood\nAccommodation: Harlem 1 BR, Private Master Bath, Honolulu, cost: $396, room type: Private room, house rules: No pets, minimum nights: 2, maximum occupancy: 1\n\nNumber of people: 1\nTotal cost: $888 (flight) + $28 (dinner) + $396 (accommodation) = $1,312\nAccommodation minimum nights: 1/2\n\nDay 2: March 5th, 2022\nCurrent City: Honolulu\nTransportation: -\nBreakfast: Crystal Restaurant, Honolulu, cost: $57, cuisines: Tea, Pizza, Bakery, Fast Food, Chinese\nAttraction: Waikiki Aquarium, Honolulu; Iolani Palace, Honolulu\nLunch: Viva Hyderabad, Honolulu, cost: $29, cuisines: Bakery, BBQ\nDinner: Nimtho, Honolulu, cost: $31, cuisines: Pizza, Mexican, Bakery, BBQ, Cafe, Mediterranean\nAccommodation: Harlem 1 BR, Private Master Bath, Honolulu, cost: $396, room type: Private room, house rules: No pets, minimum nights: 2, maximum occupancy: 1\n\nNumber of people: 1\nTotal cost: $57 (breakfast) + $29 (lunch) + $31 (dinner) + $396 (accommodation) = $513\nAccommodation minimum nights: 2/2\n\nDay 3: March 6th, 2022\nCurrent City: from Honolulu to Ontario\nTransportation: Flight F3584327, from Honolulu to Ontario, departure: 14:35, arrival: 22:02, duration: 5 hours 27 minutes, cost: $1,075\nBreakfast: Dunkin' Donuts, Honolulu, cost: $97, cuisines: Pizza, Desserts\nAttraction: -\nLunch: -\nDinner: -\nAccommodation: -\n\nNumber of people: 1\nTotal cost: $97 (breakfast) + $1,075 (flight) = $1,172\n\nTotal cost across all days: $1,312 (Day 1) + $513 (Day 2) + $1,172 (Day 3) = $2,997\n\nCuisines: The prompt specifies no cuisines, so all cuisine constraints are satisfied.\n\n***** End of Travel Plan *****\n\nNote: The travel plan adheres to the budget constraint of $3,200, with the total cost being $2,997. All accommodations, restaurants, and attractions are located in Honolulu, and the transportation modes are valid as per the provided information. The accommodation type is a private room, which meets the \"not shared room\" constraint. The house rules for each accommodation have been respected, and no restaurant or attraction is repeated across the days.", "gpt-4-1106-preview_direct_sole-planning_parsed_results": [{"day": 1, "current_city": "from Ontario to Honolulu", "transportation": "Flight Number: F3584294, from Ontario to Honolulu, Departure Time: 10:11, Arrival Time: 14:46", "breakfast": "-", "attraction": "-", "lunch": "-", "dinner": "Bait El Khetyar, Honolulu", "accommodation": "Harlem 1 BR, Private Master Bath, Honolulu"}, {"day": 2, "current_city": "Honolulu", "transportation": "-", "breakfast": "Crystal Restaurant, Honolulu", "attraction": "Waikiki Aquarium, Honolulu;Iolani Palace, Honolulu;", "lunch": "Viva Hyderabad, Honolulu", "dinner": "Nimtho, Honolulu", "accommodation": "Harlem 1 BR, Private Master Bath, Honolulu"}, {"day": 3, "current_city": "from Honolulu to Ontario", "transportation": "Flight Number: F3584327, from Honolulu to Ontario, Departure Time: 14:35, Arrival Time: 22:02", "breakfast": "Dunkin' Donuts, Honolulu", "attraction": "-", "lunch": "-", "dinner": "-", "accommodation": "-"}]}]