[{"gpt-4-1106-preview_direct_sole-planning_results": "Travel Plan:\n\nDay 1: March 21, 2022\nCurrent City: from Santa Ana to Houston\nTransportation: Flight F3897390, from Santa Ana to Houston, duration: 3 hours 8 minutes, cost: $340 per person\nBreakfast: -\nAttraction: -\nLunch: -\nDinner: Matchbox, Houston, cost: $33, cuisines: Tea, Italian, Bakery, Fast Food, Seafood\nAccommodation: Sunny and Airy near Manhattan, Houston, cost: $499, room type: Entire home/apt, house rules: Smoking allowed, minimum nights: 2, maximum occupancy: 4\n\nNumber of people: 2\nTotal cost: 2 x $340 (Flight) + 2 x $33 (Dinner) + $499 (Accommodation) = $1,245\nAccommodation minimum nights: 1/2\n\nDay 2: March 22, 2022\nCurrent City: Houston\nTransportation: Taxi around the city, estimated cost: $100\nBreakfast: Earthen Spices, Houston, cost: $28, cuisines: Tea, Mexican, Bakery, BBQ, Fast Food\nAttraction: Space Center Houston, Houston; Houston Museum of Natural Science, Houston\nLunch: Pebble Street, Houston, cost: $73, cuisines: Tea, American, Mediterranean, BBQ\nDinner: Istanbul Restaurant, Houston, cost: $19, cuisines: Tea, Indian, Seafood (Indian cuisine is similar to Mediterranean in terms of spices and flavors, and this restaurant also offers Tea and Seafood, which are part of the requested cuisines)\nAccommodation: Sunny and Airy near Manhattan, Houston, cost: $499, room type: Entire home/apt, house rules: Smoking allowed, minimum nights: 2, maximum occupancy: 4\n\nNumber of people: 2\nTotal cost: 2 x $28 (Breakfast) + 2 x $73 (Lunch) + 2 x $19 (Dinner) + $100 (Taxi) + $499 (Accommodation) = $839\nAccommodation minimum nights: 2/2\n\nDay 3: March 23, 2022\nCurrent City: from Houston to Santa Ana\nTransportation: Flight F3986111, from Houston to Santa Ana, duration: 3 hours 22 minutes, cost: $387 per person\nBreakfast: Truth Coffee, Houston, cost: $29, cuisines: Pizza, American, Seafood\nAttraction: -\nLunch: -\nDinner: -\nAccommodation: -\n\nNumber of people: 2\nTotal cost: 2 x $387 (Flight) + 2 x $29 (Breakfast) = $832\n\nTotal cost across all days: $1,245 (Day 1) + $839 (Day 2) + $832 (Day 3) = $2,916\n\nCuisines: All requested cuisines (American, Italian, Mediterranean, and Mexican) are included in the meals.\nAccommodations: All accommodations allow smoking as requested.\n\nPlease note that the costs for attractions and local transportation (taxi) are estimated and may vary. The total cost is within the revised budget of $3,000.", "gpt-4-1106-preview_direct_sole-planning_parsed_results": [{"day": 1, "current_city": "from Santa Ana to Houston", "transportation": "Flight Number: F3897390, from Santa Ana to Houston, Departure Time: -, Arrival Time: -", "breakfast": "-", "attraction": "-", "lunch": "-", "dinner": "Matchbox, Houston", "accommodation": "Sunny and Airy near Manhattan, Houston"}, {"day": 2, "current_city": "Houston", "transportation": "-", "breakfast": "Earthen Spices, Houston", "attraction": "Space Center Houston, Houston;Houston Museum of Natural Science, Houston;", "lunch": "Pebble Street, Houston", "dinner": "Istanbul Restaurant, Houston", "accommodation": "Sunny and Airy near Manhattan, Houston"}, {"day": 3, "current_city": "from Houston to Santa Ana", "transportation": "Flight Number: F3986111, from Houston to Santa Ana, Departure Time: -, Arrival Time: -", "breakfast": "Truth Coffee, Houston", "attraction": "-", "lunch": "-", "dinner": "-", "accommodation": "-"}]}]