[{"gpt-4-1106-preview_direct_sole-planning_results": "Based on the provided information and constraints, here is a 7-day travel plan for two people, starting in Minneapolis and visiting three different cities in Texas, with a focus on child-friendly accommodations:\n\n**Day 1: Minneapolis to Abilene (March 22, 2022)**\n- Transportation: Self-driving from Minneapolis to Abilene, duration: 15 hours 28 mins, distance: 1,732 km, cost: $86 x 2 = $172\n- Breakfast: -\n- Attraction: -\n- Lunch: -\n- Dinner: Thai Garden, Abilene, cost: $13 x 2 = $26, cuisines: Cafe, American, Desserts\n- Accommodation: Apartment minutes from manhattan, Abilene, cost: $295 x 2 = $590, room type: Entire home/apt, house rules: No pets & No visitors, suitable for children under 10\n\n**Day 2: Abilene (March 23, 2022)**\n- Transportation: -\n- Breakfast: Thai Garden, Abilene, cost: $13 x 2 = $26, cuisines: Cafe, American, Desserts\n- Attraction: The Grace Museum, Frontier Texas!, cost: Free (assuming no entry fee)\n- Lunch: Crispy Crust, Abilene, cost: $54 x 2 = $108, cuisines: Desserts, Bakery, Cafe, American, Seafood\n- Dinner: Finger Licious, Abilene, cost: $35 x 2 = $70, cuisines: Fast Food, Cafe, BBQ, Seafood\n- Accommodation: Apartment minutes from manhattan, Abilene, cost: $295 x 2 = $590\n\n**Day 3: Abilene to Amarillo (March 24, 2022)**\n- Transportation: Self-driving from Abilene to Amarillo, duration: 4 hours 10 mins, distance: 446 km, cost: $22 x 2 = $44\n- Breakfast: Mx Corn, Abilene, cost: $62 x 2 = $124, cuisines: Tea, Cafe, Italian\n- Attraction: Cadillac Ranch, Amarillo Botanical Gardens, cost: Free (assuming no entry fee)\n- Lunch: The Cinnamon Kitchen, Amarillo, cost: $69 x 2 = $138, cuisines: Desserts, Tea, Pizza, Chinese, Seafood\n- Dinner: Komachi, Amarillo, cost: $71 x 2 = $142, cuisines: Desserts, Tea, Fast Food, Chinese, Mediterranean\n- Accommodation: Harlem Humble Abode - 1 bedroom - Cute and Quaint, Amarillo, cost: $409 x 2 = $818, room type: Entire home/apt, house rules: No pets, suitable for children under 10\n\n**Day 4: Amarillo (March 25, 2022)**\n- Transportation: -\n- Breakfast: Kanha North & South Indian Veg., Amarillo, cost: $34 x 2 = $68, cuisines: Tea, Cafe, BBQ, Fast Food\n- Attraction: Amarillo Zoo, Don Harrington Discovery Center, cost: Free (assuming no entry fee)\n- Lunch: Sigree Global Grill, Amarillo, cost: $35 x 2 = $70, cuisines: Chinese, BBQ, Cafe, Desserts\n- Dinner: Anand Restaurant, Amarillo, cost: $53 x 2 = $106, cuisines: Fast Food, Seafood, Desserts, Italian\n- Accommodation: Harlem Humble Abode - 1 bedroom - Cute and Quaint, Amarillo, cost: $409 x 2 = $818\n\n**Day 5: Amarillo to Lubbock (March 26, 2022)**\n- Transportation: Self-driving from Amarillo to Lubbock, duration: 1 hour 47 mins, distance: 197 km, cost: $9 x 2 = $18\n- Breakfast: Wood Box Cafe, Amarillo, cost: $11 x 2 = $22, cuisines: Desserts, French, Fast Food, Cafe, American\n- Attraction: Buddy Holly Center, National Ranching Heritage Center, cost: Free (assuming no entry fee)\n- Lunch: Paris 6 Classique, Lubbock, cost: $91 x 2 = $182, cuisines: Desserts, Cafe, Pizza, Mexican, BBQ, Chinese\n- Dinner: 3 Squares Diner, Lubbock, cost: $73 x 2 = $146, cuisines: Pizza, Indian, Fast Food\n- Accommodation: Private bedroom in UWS Apartment, Lubbock, cost: $709 x 2 = $1418, room type: Private room, house rules: No visitors & No pets, suitable for children under 10\n\n**Day 6: Lubbock (March 27, 2022)**\n- Transportation: -\n- Breakfast: Cantinho da Gula, Lubbock, cost: $78 x 2 = $156, cuisines: Cafe, BBQ, Desserts, Italian\n- Attraction: American Windmill Museum, Mackenzie Main City Park, cost: Free (assuming no entry fee)\n- Lunch: Grand Barbeque Buffet Restaurant, Lubbock, cost: $20 x 2 = $40, cuisines: Tea, French, Fast Food, Cafe, Seafood\n- Dinner: Mosaic - Country Inn & Suites By Carlson, Lubbock, cost: $29 x 2 = $58, cuisines: Chinese, Indian, Desserts, Seafood\n- Accommodation: Private bedroom in UWS Apartment, Lubbock, cost: $709 x 2 = $1418\n\n**Day 7: Lubbock to Minneapolis (March 28, 2022)**\n- Transportation: Self-driving from Lubbock to Minneapolis, duration: 16 hours 17 mins, distance: 1,818 km, cost: $90 x 2 = $180\n- Breakfast: Assam Tea Corner, Lubbock, cost: $52 x 2 = $104, cuisines: Desserts, BBQ, Fast Food, American, Seafood\n- Attraction: -\n- Lunch: -\n- Dinner: -\n\n**Total Cost Calculation:**\n- Transportation: $172 + $44 + $18 + $180 = $414\n- Accommodations: $590 + $590 + $818 + $818 + $1418 + $1418 = $5652\n- Meals and Attractions: $26 + $26 + $108 + $70 + $124 + $138 + $142 + $68 + $70 + $106 + $22 + $182 + $146 + $156 + $40 + $58 + $104 = $1610\n- Total Cost for Two People: $414 + $5652 + $1610 = $7676\n\nThe total cost of the travel plan is $7676, which is well within the budget of $11,900. All accommodations are suitable for children under 10, and the plan includes a variety of attractions and meals across the cities visited.", "gpt-4-1106-preview_direct_sole-planning_parsed_results": [{"day": 1, "current_city": "from Minneapolis to Abilene", "transportation": "Self-driving from Minneapolis to Abilene, duration: 15 hours 28 mins, distance: 1,732 km", "breakfast": "-", "attraction": "-", "lunch": "-", "dinner": "Thai Garden, Abilene", "accommodation": "Apartment minutes from manhattan, Abilene"}, {"day": 2, "current_city": "Abilene", "transportation": "-", "breakfast": "Thai Garden, Abilene", "attraction": "The Grace Museum, Abilene;Frontier Texas!, Abilene;", "lunch": "Crispy Crust, Abilene", "dinner": "Finger Licious, Abilene", "accommodation": "Apartment minutes from manhattan, Abilene"}, {"day": 3, "current_city": "from Abilene to Amarillo", "transportation": "Self-driving from Abilene to Amarillo, duration: 4 hours 10 mins, distance: 446 km", "breakfast": "Mx Corn, Abilene", "attraction": "Cadillac Ranch, Amarillo;Amarillo Botanical Gardens, Amarillo;", "lunch": "The Cinnamon Kitchen, Amarillo", "dinner": "Komachi, Amarillo", "accommodation": "Harlem Humble Abode - 1 bedroom - Cute and Quaint, Amarillo"}, {"day": 4, "current_city": "Amarillo", "transportation": "-", "breakfast": "Kanha North & South Indian Veg., Amarillo", "attraction": "Amarillo Zoo, Amarillo;Don Harrington Discovery Center, Amarillo;", "lunch": "Sigree Global Grill, Amarillo", "dinner": "Anand Restaurant, Amarillo", "accommodation": "Harlem Humble Abode - 1 bedroom - Cute and Quaint, Amarillo"}, {"day": 5, "current_city": "from Amarillo to Lubbock", "transportation": "Self-driving from Amarillo to Lubbock, duration: 1 hour 47 mins, distance: 197 km", "breakfast": "Wood Box Cafe, Amarillo", "attraction": "Buddy Holly Center, Lubbock;National Ranching Heritage Center, Lubbock;", "lunch": "Paris 6 Classique, Lubbock", "dinner": "3 Squares Diner, Lubbock", "accommodation": "Private bedroom in UWS Apartment, Lubbock"}, {"day": 6, "current_city": "Lubbock", "transportation": "-", "breakfast": "Cantinho da Gula, Lubbock", "attraction": "American Windmill Museum, Lubbock;Mackenzie Main City Park, Lubbock;", "lunch": "Grand Barbeque Buffet Restaurant, Lubbock", "dinner": "Mosaic - Country Inn & Suites By Carlson, Lubbock", "accommodation": "Private bedroom in UWS Apartment, Lubbock"}, {"day": 7, "current_city": "from Lubbock to Minneapolis", "transportation": "Self-driving from Lubbock to Minneapolis, duration: 16 hours 17 mins, distance: 1,818 km", "breakfast": "Assam Tea Corner, Lubbock", "attraction": "-", "lunch": "-", "dinner": "-", "accommodation": "-"}]}]