[{"gpt-4-1106-preview_direct_sole-planning_results": "Based on the provided information and constraints, here is a 7-day travel plan for a group of 7 people starting from Rapid City and traveling to 3 cities in Colorado, with a budget of $16,300 and a preference for entire room accommodations.\n\n**Day 1: Rapid City to Colorado Springs**\n- Transportation: Self-driving from Rapid City to Colorado Springs, duration: 6 hours 59 mins, distance: 735 km, cost: $36 x 7 = $252\n- Breakfast: -\n- Attraction: -\n- Lunch: -\n- Dinner: Raglan Road Irish Pub and Restaurant, Colorado Springs, cost: $97 x 7 = $679, cuisines: Chinese, Bakery, Pizza, Mediterranean\n- Accommodation: Large sunny park slope apartment, Colorado Springs, cost: $82 x 7 = $574, room type: Entire home/apt, house rules: No smoking & No parties & No pets, minimum nights: 1\n\n**Day 2: Colorado Springs**\n- Transportation: -\n- Breakfast: Club Tokyo - Best Western Skycity Hotel, Colorado Springs, cost: $64 x 7 = $448, cuisines: Tea, Bakery, Mediterranean, Fast Food\n- Attraction: Garden of the Gods, Colorado Springs\n- Lunch: GoGourmet, Colorado Springs, cost: $66 x 7 = $462, cuisines: Desserts, Bakery, Fast Food, Indian, Seafood\n- Dinner: New Spice World, Colorado Springs, cost: $43 x 7 = $301, cuisines: Desserts, French, Bakery, Fast Food, Cafe\n- Accommodation: Large sunny park slope apartment, Colorado Springs, cost: $82 x 7 = $574\n\n**Day 3: Colorado Springs to Denver**\n- Transportation: Self-driving from Colorado Springs to Denver, duration: 1 hour 9 mins, distance: 113 km, cost: $5 x 7 = $35\n- Breakfast: Mukhtalif Biryanis, Colorado Springs, cost: $95 x 7 = $665, cuisines: Tea, Mexican, Fast Food\n- Attraction: Denver Zoo, Denver\n- Lunch: The Urban Socialite, Denver, cost: $34 x 7 = $238, cuisines: Cafe, Indian, Desserts, Italian\n- Dinner: Tasty Fare, Denver, cost: $79 x 7 = $553, cuisines: French, BBQ, Fast Food\n- Accommodation: Peaceful, beautiful home away, Denver, cost: $414 x 7 = $2,898, room type: Entire home/apt, house rules: No smoking & No visitors & No parties, minimum nights: 2\n\n**Day 4: Denver**\n- Transportation: -\n- Breakfast: Starve Stalkers, Denver, cost: $31 x 7 = $217, cuisines: Fast Food, Indian, BBQ, Seafood\n- Attraction: Denver Botanic Gardens, Denver; Denver Art Museum, Denver\n- Lunch: Woods Spice, Denver, cost: $69 x 7 = $483, cuisines: Tea, Cafe, Mexican, Desserts\n- Dinner: Radhika Sweets, Denver, cost: $26 x 7 = $182, cuisines: Tea, Fast Food, Cafe, Mediterranean, Seafood\n- Accommodation: Peaceful, beautiful home away, Denver, cost: $414 x 7 = $2,898\n\n**Day 5: Denver to Alamosa**\n- Transportation: Self-driving from Denver to Alamosa, duration: 3 hours 40 mins, distance: 377 km, cost: $18 x 7 = $126\n- Breakfast: Rain Tree Grill, Denver, cost: $94 x 7 = $658, cuisines: Tea, Mexican, BBQ, Italian\n- Attraction: San Luis Valley Museum | Alamosa, Alamosa\n- Lunch: Riverwalk Cafe, Alamosa, cost: $97 x 7 = $679, cuisines: Tea, Pizza, Fast Food\n- Dinner: Coffee to Cocktail Bar - Hyatt Place, Alamosa, cost: $35 x 7 = $245, cuisines: Tea, Indian, Desserts, Italian\n- Accommodation: Comfortable studio suite in midtown Manhattan, Alamosa, cost: $67 x 7 = $469, room type: Entire home/apt, house rules: No parties & No smoking & No visitors, minimum nights: 1\n\n**Day 6: Alamosa**\n- Transportation: -\n- Breakfast: Cafe LazyMojo, Alamosa, cost: $26 x 7 = $182, cuisines: Tea, Pizza, American, Fast Food\n- Attraction: Rio Grande Farm Park, Alamosa; Alamosa National Wildlife Refuge and Visitor Center, Alamosa\n- Lunch: The Diet Kitchen, Alamosa, cost: $50 x 7 = $350, cuisines: Pizza, Bakery, BBQ, American, Mediterranean\n- Dinner: Emperor's Lounge - The Taj Mahal Hotel, Alamosa, cost: $65 x 7 = $455, cuisines: Tea, Italian, BBQ, Cafe, Seafood\n- Accommodation: Comfortable studio suite in midtown Manhattan, Alamosa, cost: $67 x 7 = $469\n\n**Day 7: Alamosa to Rapid City**\n- Transportation: Self-driving from Alamosa to Rapid City, duration: 9 hours 27 mins, distance: 998 km, cost: $49 x 7 = $343\n- Breakfast: -\n- Attraction: -\n- Lunch: -\n- Dinner: -\n- Accommodation: -\n\n**Total Cost Calculation:**\n- Transportation: $252 + $35 + $126 + $343 = $756\n- Meals: $679 + $448 + $462 + $301 + $665 + $238 + $553 + $217 + $483 + $182 + $658 + $679 + $245 + $182 + $350 + $455 = $6,995\n- Accommodations: $574 + $574 + $2,898 + $2,898 + $469 + $469 = $7,882\n- Attractions: No cost information provided, assumed to be included in the budget.\n\n**Total Cost: $756 (Transportation) + $6,995 (Meals) + $7,882 (Accommodations) = $15,633**\n\nThe total cost of $15,633 is within the budget of $16,300. The plan includes transportation, meals, attractions, and accommodations for each day, adhering to the constraints provided.", "gpt-4-1106-preview_direct_sole-planning_parsed_results": [{"day": 1, "current_city": "from Rapid City to Colorado Springs", "transportation": "Self-driving from Rapid City to Colorado Springs, duration: 6 hours 59 mins, distance: 735 km", "breakfast": "-", "attraction": "-", "lunch": "-", "dinner": "Raglan Road Irish Pub and Restaurant, Colorado Springs", "accommodation": "Large sunny park slope apartment, Colorado Springs"}, {"day": 2, "current_city": "Colorado Springs", "transportation": "-", "breakfast": "Club Tokyo - Best Western Skycity Hotel, Colorado Springs", "attraction": "Garden of the Gods, Colorado Springs", "lunch": "GoGourmet, Colorado Springs", "dinner": "New Spice World, Colorado Springs", "accommodation": "Large sunny park slope apartment, Colorado Springs"}, {"day": 3, "current_city": "from Colorado Springs to Denver", "transportation": "Self-driving from Colorado Springs to Denver, duration: 1 hour 9 mins, distance: 113 km", "breakfast": "Mukhtalif Biryanis, Colorado Springs", "attraction": "Denver Zoo, Denver", "lunch": "The Urban Socialite, Denver", "dinner": "Tasty Fare, Denver", "accommodation": "Peaceful, beautiful home away, Denver"}, {"day": 4, "current_city": "Denver", "transportation": "-", "breakfast": "Starve Stalkers, Denver", "attraction": "Denver Botanic Gardens, Denver;Denver Art Museum, Denver", "lunch": "Woods Spice, Denver", "dinner": "Radhika Sweets, Denver", "accommodation": "Peaceful, beautiful home away, Denver"}, {"day": 5, "current_city": "from Denver to Alamosa", "transportation": "Self-driving from Denver to Alamosa, duration: 3 hours 40 mins, distance: 377 km", "breakfast": "Rain Tree Grill, Denver", "attraction": "San Luis Valley Museum | Alamosa, Alamosa", "lunch": "Riverwalk Cafe, Alamosa", "dinner": "Coffee to Cocktail Bar - Hyatt Place, Alamosa", "accommodation": "Comfortable studio suite in midtown Manhattan, Alamosa"}, {"day": 6, "current_city": "Alamosa", "transportation": "-", "breakfast": "Cafe LazyMojo, Alamosa", "attraction": "Rio Grande Farm Park, Alamosa;Alamosa National Wildlife Refuge and Visitor Center, Alamosa", "lunch": "The Diet Kitchen, Alamosa", "dinner": "Emperor's Lounge - The Taj Mahal Hotel, Alamosa", "accommodation": "Comfortable studio suite in midtown Manhattan, Alamosa"}, {"day": 7, "current_city": "from Alamosa to Rapid City", "transportation": "Self-driving from Alamosa to Rapid City, duration: 9 hours 27 mins, distance: 998 km", "breakfast": "-", "attraction": "-", "lunch": "-", "dinner": "-", "accommodation": "-"}]}]