[{"gpt-4-1106-preview_direct_sole-planning_results": "Travel Plan:\n\nDays: 1\nCurrent City: from Oakland (California) to Tucson (Arizona)\nTransportation: Flight F4002752, from Oakland to Tucson, duration: 1 hour 53 minutes, cost: 190\nBreakfast: -\nAttraction: -\nLunch: -\nDinner: Villa Tevere, Tucson, cost: 37, cuisines: Mexican, Mediterranean, Desserts, Fast Food\nAccommodation: Private room with private bathroom, Tucson, cost: 58, maximum occupancy: 2, house rules: No smoking, minimum nights: 1\n\nNumber of people: 1\nTotal cost: 1 x 190 + 1 x 37 + 1 x 58 = 285\nAccommodation minimum nights: 1/1\n\nDays: 2\nCurrent City: Tucson\nTransportation: -\nBreakfast: Consort Restaurant, Tucson, cost: 54, cuisines: Bakery, Pizza, Indian, Desserts\nAttraction: Arizona-Sonora Desert Museum, Tucson; Tucson Botanical Gardens, Tucson\nLunch: Magic Spice Wok, Tucson, cost: 31, cuisines: Cafe, Bakery, BBQ, Chinese, Seafood\nDinner: La Plage, Tucson, cost: 93, cuisines: Seafood, Bakery, Desserts, Italian\nAccommodation: Private room with private bathroom, Tucson, cost: 58, maximum occupancy: 2, house rules: No smoking, minimum nights: 1\n\nNumber of people: 1\nTotal cost: 1 x 54 + 1 x 31 + 1 x 93 + 1 x 58 = 236\nAccommodation minimum nights: 1/1\n\nDays: 3\nCurrent City: from Tucson to Oakland\nTransportation: Self-driving from Tucson to Oakland, duration: 12 hours 42 mins, distance: 1,373 km, cost: 68\nBreakfast: Chai Point, Tucson, cost: 62, cuisines: Tea, Bakery, Mexican, American\nAttraction: -\nLunch: -\nDinner: -\nAccommodation: -\n\nNumber of people: 1\nTotal cost: 1 x 68 + 1 x 62 = 130\n\nTotal cost across all days: 1 x 285 + 1 x 236 + 1 x 130 = 651\nCuisines: The prompt specifies no cuisines, so all cuisine constraints are satisfied.\n\nNote: The travel plan includes all required details for each day, adheres to the budget, and follows the constraints provided in the query. Attractions were chosen based on availability and interest, and no attraction or restaurant was repeated. Accommodations were selected to match the city and house rules. The transportation method was chosen based on the available options and the \"no flight\" constraint on the return date.", "gpt-4-1106-preview_direct_sole-planning_parsed_results": [{"day": 1, "current_city": "from Oakland to Tucson", "transportation": "Flight Number: F4002752, from Oakland to Tucson, Departure Time: -, Arrival Time: -", "breakfast": "-", "attraction": "-", "lunch": "-", "dinner": "Villa Tevere, Tucson", "accommodation": "Private room with private bathroom, Tucson"}, {"day": 2, "current_city": "Tucson", "transportation": "-", "breakfast": "Consort Restaurant, Tucson", "attraction": "Arizona-Sonora Desert Museum, Tucson;Tucson Botanical Gardens, Tucson;", "lunch": "Magic Spice Wok, Tucson", "dinner": "La Plage, Tucson", "accommodation": "Private room with private bathroom, Tucson"}, {"day": 3, "current_city": "from Tucson to Oakland", "transportation": "Self-driving from Tucson to Oakland, Departure Time: -, Arrival Time: -", "breakfast": "Chai Point, Tucson", "attraction": "-", "lunch": "-", "dinner": "-", "accommodation": "-"}]}]