[{"gpt-4-1106-preview_direct_sole-planning_results": "Based on the provided information and constraints, here is a 5-day travel plan for two people, starting in Newark and visiting Madison and Mosinee in Wisconsin:\n\n***** Travel Plan *****\n\nDay 1: March 13, 2022 - Newark to Madison\n- Transportation: Flight F4073170 from Newark to Madison, cost: $355 per person\n- Accommodation: Room in two bedroom apartment, Madison, cost: $159 per night, shared room, house rules: No smoking & No pets, minimum nights: 1, maximum occupancy: 2\n\nNumber of people: 2\nTotal cost: 2 x $355 (flight) + $159 (accommodation) = $869\nAccommodation minimum nights: 1/1\n\nDay 2: March 14, 2022 - Madison\n- Breakfast: 99 North Restaurant, Madison, cost: $62, cuisines: Fast Food, Mexican, Indian, Pizza\n- Attraction: Madison Children's Museum, cost: Free\n- Lunch: Unique Food Hut, Madison, cost: $38, cuisines: Desserts, Italian, BBQ, Fast Food, Seafood\n- Dinner: Chini Bowl, Madison, cost: $26, cuisines: Cafe, Seafood\n- Accommodation: Room in two bedroom apartment, Madison, cost: $159 per night, shared room, house rules: No smoking & No pets, minimum nights: 1, maximum occupancy: 2\n\nNumber of people: 2\nTotal cost: 2 x $62 (breakfast) + 2 x $38 (lunch) + 2 x $26 (dinner) + $159 (accommodation) = $411\nAccommodation minimum nights: 1/1\n\nDay 3: March 15, 2022 - Madison to Mosinee\n- Transportation: Self-driving from Madison to Mosinee, cost: $10 per person\n- Accommodation: Where Dreams are made of NYC, Mosinee, cost: $212 per night, shared room, house rules: No smoking & No children under 10, minimum nights: 1, maximum occupancy: 1\n\nNumber of people: 2\nTotal cost: 2 x $10 (transportation) + 2 x $212 (accommodation) = $444\nAccommodation minimum nights: 1/1\n\nDay 4: March 16, 2022 - Mosinee\n- Breakfast: House of China Restaurant II, Mosinee, cost: $96, cuisines: Tea, Pizza, French, Cafe, Seafood\n- Attraction: Walter Zych Park, cost: Free\n- Lunch: Grit, Mosinee, cost: $28, cuisines: Bakery, BBQ, Seafood\n- Dinner: Bake N Shake, Mosinee, cost: $41, cuisines: Pizza, American, BBQ\n- Accommodation: Where Dreams are made of NYC, Mosinee, cost: $212 per night, shared room, house rules: No smoking & No children under 10, minimum nights: 1, maximum occupancy: 1\n\nNumber of people: 2\nTotal cost: 2 x $96 (breakfast) + 2 x $28 (lunch) + 2 x $41 (dinner) + 2 x $212 (accommodation) = $754\nAccommodation minimum nights: 1/1\n\nDay 5: March 17, 2022 - Mosinee to Newark\n- Transportation: Self-driving from Mosinee to Newark, cost: $84 per person\n\nNumber of people: 2\nTotal cost: 2 x $84 (transportation) = $168\n\nTotal cost across all days: $869 (Day 1) + $411 (Day 2) + $444 (Day 3) + $754 (Day 4) + $168 (Day 5) = $2,646\n\nCuisines: All cuisine constraints are satisfied.\nAccommodations: All accommodations are shared rooms as requested.\nTransportation: All transportation modes are valid and meet the constraints specified in the query.\n\n***** End of Travel Plan *****\n\nPlease note that the costs for attractions are assumed to be free unless otherwise stated in the provided information. The total cost of the travel plan is within the specified budget of $2,700.", "gpt-4-1106-preview_direct_sole-planning_parsed_results": [{"day": 1, "current_city": "from Newark to Madison", "transportation": "Flight Number: F4073170, from Newark to Madison", "breakfast": "-", "attraction": "-", "lunch": "-", "dinner": "-", "accommodation": "Room in two bedroom apartment, Madison"}, {"day": 2, "current_city": "Madison", "transportation": "-", "breakfast": "99 North Restaurant, Madison", "attraction": "Madison Children's Museum, Madison;", "lunch": "Unique Food Hut, Madison", "dinner": "Chini Bowl, Madison", "accommodation": "Room in two bedroom apartment, Madison"}, {"day": 3, "current_city": "from Madison to Mosinee", "transportation": "Self-driving, from Madison to Mosinee", "breakfast": "-", "attraction": "-", "lunch": "-", "dinner": "-", "accommodation": "Where Dreams are made of NYC, Mosinee"}, {"day": 4, "current_city": "Mosinee", "transportation": "-", "breakfast": "House of China Restaurant II, Mosinee", "attraction": "Walter Zych Park, Mosinee;", "lunch": "Grit, Mosinee", "dinner": "Bake N Shake, Mosinee", "accommodation": "Where Dreams are made of NYC, Mosinee"}, {"day": 5, "current_city": "from Mosinee to Newark", "transportation": "Self-driving, from Mosinee to Newark", "breakfast": "-", "attraction": "-", "lunch": "-", "dinner": "-", "accommodation": "-"}]}]