[{"gpt-4-1106-preview_direct_sole-planning_results": "Travel Plan:\n\nDay 1: March 7, 2022 - From Reno to Abilene\n- Transportation: Self-driving from Reno to Abilene, duration: 22 hours 27 mins, distance: 2,412 km, cost: $120 x 2 = $240\n- Breakfast: -\n- Attraction: -\n- Lunch: -\n- Dinner: -\n- Accommodation: Joyce and Donovan's, Room for One, Abilene, cost: $83 x 2 = $166, room type: Private room, house rules: No parties, minimum nights: 25, maximum occupancy: 2\n\nNumber of people: 2\nTotal cost for Day 1: $240 (transportation) + $166 (accommodation) = $406\n\nDay 2: March 8, 2022 - Abilene\n- Transportation: -\n- Breakfast: Thai Garden, Abilene, cost: $13 x 2 = $26, cuisines: Cafe, American, Desserts\n- Attraction: The Grace Museum, Frontier Texas!\n- Lunch: Crispy Crust, Abilene, cost: $54 x 2 = $108, cuisines: Desserts, Bakery, Cafe, American, Seafood\n- Dinner: Mediumwelldone, Abilene, cost: $91 x 2 = $182, cuisines: Tea, French, BBQ, Cafe, Seafood\n- Accommodation: Joyce and Donovan's, Room for One, Abilene\n\nNumber of people: 2\nTotal cost for Day 2: $26 (breakfast) + $108 (lunch) + $182 (dinner) = $316\n\nDay 3: March 9, 2022 - From Abilene to Amarillo\n- Transportation: Self-driving from Abilene to Amarillo, duration: 4 hours 10 mins, distance: 446 km, cost: $22 x 2 = $44\n- Breakfast: -\n- Attraction: Cadillac Ranch, Amarillo Botanical Gardens\n- Lunch: The Cinnamon Kitchen, Amarillo, cost: $69 x 2 = $138, cuisines: Desserts, Tea, Pizza, Chinese, Seafood\n- Dinner: Komachi, Amarillo, cost: $71 x 2 = $142, cuisines: Desserts, Tea, Fast Food, Chinese, Mediterranean\n- Accommodation: Harlem Humble Abode - 1 bedroom - Cute and Quaint, Amarillo, cost: $409 x 2 = $818, room type: Entire home/apt, house rules: No pets, minimum nights: 5, maximum occupancy: 3\n\nNumber of people: 2\nTotal cost for Day 3: $44 (transportation) + $138 (lunch) + $142 (dinner) + $818 (accommodation) = $1,142\n\nDay 4: March 10, 2022 - Amarillo\n- Transportation: -\n- Breakfast: Kanha North & South Indian Veg., Amarillo, cost: $34 x 2 = $68, cuisines: Tea, Cafe, BBQ, Fast Food\n- Attraction: Amarillo Zoo, Don Harrington Discovery Center\n- Lunch: Sigree Global Grill, Amarillo, cost: $35 x 2 = $70, cuisines: Chinese, BBQ, Cafe, Desserts\n- Dinner: Anand Restaurant, Amarillo, cost: $53 x 2 = $106, cuisines: Fast Food, Seafood, Desserts, Italian\n- Accommodation: Harlem Humble Abode - 1 bedroom - Cute and Quaint, Amarillo\n\nNumber of people: 2\nTotal cost for Day 4: $68 (breakfast) + $70 (lunch) + $106 (dinner) = $244\n\nDay 5: March 11, 2022 - From Amarillo to Lubbock\n- Transportation: Self-driving from Amarillo to Lubbock, duration: 1 hour 47 mins, distance: 197 km, cost: $9 x 2 = $18\n- Breakfast: -\n- Attraction: Buddy Holly Center, National Ranching Heritage Center\n- Lunch: Paris 6 Classique, Lubbock, cost: $91 x 2 = $182, cuisines: Desserts, Cafe, Pizza, Mexican, BBQ, Chinese\n- Dinner: 3 Squares Diner, Lubbock, cost: $73 x 2 = $146, cuisines: Pizza, Indian, Fast Food\n- Accommodation: Private bedroom in UWS Apartment, Lubbock, cost: $709 x 2 = $1,418, room type: Private room, house rules: No visitors & No pets, minimum nights: 2, maximum occupancy: 2\n\nNumber of people: 2\nTotal cost for Day 5: $18 (transportation) + $182 (lunch) + $146 (dinner) + $1,418 (accommodation) = $1,764\n\nDay 6: March 12, 2022 - Lubbock\n- Transportation: -\n- Breakfast: Assam Tea Corner, Lubbock, cost: $52 x 2 = $104, cuisines: Desserts, BBQ, Fast Food, American, Seafood\n- Attraction: American Windmill Museum, Mackenzie Main City Park\n- Lunch: Sultanat, Lubbock, cost: $72 x 2 = $144, cuisines: Chinese, Bakery, BBQ, Cafe\n- Dinner: The Town House Cafe, Lubbock, cost: $90 x 2 = $180, cuisines: Tea, American, BBQ, Cafe, Indian, Seafood\n- Accommodation: Private bedroom in UWS Apartment, Lubbock\n\nNumber of people: 2\nTotal cost for Day 6: $104 (breakfast) + $144 (lunch) + $180 (dinner) = $428\n\nDay 7: March 13, 2022 - From Lubbock to Reno\n- Transportation: Self-driving from Lubbock to Reno, duration: 20 hours 3 mins, distance: 2,145 km, cost: $107 x 2 = $214\n- Breakfast: -\n- Attraction: -\n- Lunch: -\n- Dinner: -\n- Accommodation: -\n\nNumber of people: 2\nTotal cost for Day 7: $214\n\nTotal cost across all days: $406 (Day 1) + $316 (Day 2) + $1,142 (Day 3) + $244 (Day 4) + $1,764 (Day 5) + $428 (Day 6) + $214 (Day 7) = $4,514\n\nNote: The total cost exceeds the budget by $214. To stay within budget, consider adjusting meal choices or finding more affordable accommodation options.", "gpt-4-1106-preview_direct_sole-planning_parsed_results": [{"day": 1, "current_city": "from Reno to Abilene", "transportation": "Self-driving from Reno to Abilene, duration: 22 hours 27 mins, distance: 2,412 km", "breakfast": "-", "attraction": "-", "lunch": "-", "dinner": "-", "accommodation": "Joyce and Donovan's, Room for One, Abilene"}, {"day": 2, "current_city": "Abilene", "transportation": "-", "breakfast": "Thai Garden, Abilene", "attraction": "The Grace Museum, Abilene;Frontier Texas!, Abilene;", "lunch": "Crispy Crust, Abilene", "dinner": "Mediumwelldone, Abilene", "accommodation": "Joyce and Donovan's, Room for One, Abilene"}, {"day": 3, "current_city": "from Abilene to Amarillo", "transportation": "Self-driving from Abilene to Amarillo, duration: 4 hours 10 mins, distance: 446 km", "breakfast": "-", "attraction": "Cadillac Ranch, Amarillo;Amarillo Botanical Gardens, Amarillo;", "lunch": "The Cinnamon Kitchen, Amarillo", "dinner": "Komachi, Amarillo", "accommodation": "Harlem Humble Abode - 1 bedroom - Cute and Quaint, Amarillo"}, {"day": 4, "current_city": "Amarillo", "transportation": "-", "breakfast": "Kanha North & South Indian Veg., Amarillo", "attraction": "Amarillo Zoo, Amarillo;Don Harrington Discovery Center, Amarillo;", "lunch": "Sigree Global Grill, Amarillo", "dinner": "Anand Restaurant, Amarillo", "accommodation": "Harlem Humble Abode - 1 bedroom - Cute and Quaint, Amarillo"}, {"day": 5, "current_city": "from Amarillo to Lubbock", "transportation": "Self-driving from Amarillo to Lubbock, duration: 1 hour 47 mins, distance: 197 km", "breakfast": "-", "attraction": "Buddy Holly Center, Lubbock;National Ranching Heritage Center, Lubbock;", "lunch": "Paris 6 Classique, Lubbock", "dinner": "3 Squares Diner, Lubbock", "accommodation": "Private bedroom in UWS Apartment, Lubbock"}, {"day": 6, "current_city": "Lubbock", "transportation": "-", "breakfast": "Assam Tea Corner, Lubbock", "attraction": "American Windmill Museum, Lubbock;Mackenzie Main City Park, Lubbock;", "lunch": "Sultanat, Lubbock", "dinner": "The Town House Cafe, Lubbock", "accommodation": "Private bedroom in UWS Apartment, Lubbock"}, {"day": 7, "current_city": "from Lubbock to Reno", "transportation": "Self-driving from Lubbock to Reno, duration: 20 hours 3 mins, distance: 2,145 km", "breakfast": "-", "attraction": "-", "lunch": "-", "dinner": "-", "accommodation": "-"}]}]