[{"gpt-4-1106-preview_direct_sole-planning_results": "Based on the provided information and constraints, here is a 7-day travel plan for one person departing from Wichita to Colorado, visiting 3 cities (Alamosa, Grand Junction, and Durango), with travel dates from March 7th to March 13th, 2022, and a travel budget of $5,900.\n\n**Day 1: Wichita to Alamosa**\n- Transportation: Self-driving from Wichita to Alamosa, duration: 8 hours 27 mins, distance: 819 km, cost: $40\n- Breakfast: -\n- Attraction: -\n- Lunch: -\n- Dinner: Atlanta Highway Seafood Market, Alamosa, cost: $68, cuisines: Fast Food, Desserts, Seafood\n- Accommodation: Comfortable studio suite in midtown Manhattan, Alamosa, cost: $67, room type: Entire home/apt, house rules: No parties & No smoking & No visitors, minimum nights: 1, maximum occupancy: 2\n\n**Day 2: Alamosa**\n- Transportation: -\n- Breakfast: Coffee to Cocktail Bar - Hyatt Place, Alamosa, cost: $35, cuisines: Tea, Indian, Desserts, Italian\n- Attraction: San Luis Valley Museum, Alamosa; Rio Grande Farm Park, Alamosa\n- Lunch: Riverwalk Cafe, Alamosa, cost: $97, cuisines: Tea, Pizza, Fast Food\n- Dinner: Burger Singh, Alamosa, cost: $95, cuisines: Desserts, Tea, BBQ, Chinese, Seafood\n- Accommodation: Comfortable studio suite in midtown Manhattan, Alamosa, cost: $67\n\n**Day 3: Alamosa to Grand Junction**\n- Transportation: Self-driving from Alamosa to Grand Junction, duration: 4 hours 29 mins, distance: 396 km, cost: $19\n- Breakfast: Cafe LazyMojo, Alamosa, cost: $26, cuisines: Tea, Pizza, American, Fast Food\n- Attraction: -\n- Lunch: -\n- Dinner: Austin's BBQ and Oyster Bar, Grand Junction, cost: $15, cuisines: Tea, Bakery, Fast Food, Indian, Seafood\n- Accommodation: NYC Apartment near Central Park!, Grand Junction, cost: $1,118, room type: Entire home/apt, house rules: No children under 10, minimum nights: 1, maximum occupancy: 5\n\n**Day 4: Grand Junction**\n- Transportation: -\n- Breakfast: Shanghai Bar & Lounge - The Bristol Hotel, Grand Junction, cost: $31, cuisines: Cafe, Pizza\n- Attraction: Museum of the West, Grand Junction; Western Colorado Botanical Gardens, Grand Junction\n- Lunch: 2 Dog, Grand Junction, cost: $29, cuisines: Desserts, BBQ, Fast Food, Cafe, American\n- Dinner: Punjab Da Pind, Grand Junction, cost: $52, cuisines: Desserts, Pizza, Bakery, Chinese, Mediterranean, Seafood\n- Accommodation: NYC Apartment near Central Park!, Grand Junction, cost: $1,118\n\n**Day 5: Grand Junction to Durango**\n- Transportation: Self-driving from Grand Junction to Durango, duration: 3 hours 33 mins, distance: 269 km, cost: $13\n- Breakfast: Cocoa Tree, Grand Junction, cost: $68, cuisines: Tea, Chinese, Cafe, Fast Food\n- Attraction: -\n- Lunch: -\n- Dinner: Samurai Japanese Cuisine & Sushi Bar, Durango, cost: $67, cuisines: Bakery, Desserts, Fast Food\n- Accommodation: Lux 1BR in the heart of NYC Theater district!, Durango, cost: $81, room type: Entire home/apt, house rules: No children under 10, minimum nights: 1, maximum occupancy: 3\n\n**Day 6: Durango**\n- Transportation: -\n- Breakfast: Hot & Tasty Chinese Food, Durango, cost: $17, cuisines: Tea, French, Fast Food\n- Attraction: Animas Museum, Durango; Durango & Silverton Narrow Gauge Railroad, Durango\n- Lunch: Dub's High on the Hog, Durango, cost: $98, cuisines: Tea, Italian, French, Cafe, Seafood\n- Dinner: Standard Chicken Point, Durango, cost: $50, cuisines: Mexican, Indian, BBQ, Seafood\n- Accommodation: Lux 1BR in the heart of NYC Theater district!, Durango, cost: $81\n\n**Day 7: Durango to Wichita**\n- Transportation: Self-driving from Durango to Wichita, duration: 11 hours 15 mins, distance: 1,078 km, cost: $53\n- Breakfast: Chickenette, Durango, cost: $31, cuisines: Tea, Pizza, Desserts, Fast Food\n- Attraction: -\n- Lunch: -\n- Dinner: -\n- Accommodation: -\n\n**Total Cost Calculation:**\n- Transportation: $40 + $19 + $13 + $53 = $125\n- Meals: $68 + $35 + $97 + $95 + $26 + $15 + $31 + $29 + $52 + $68 + $67 + $17 + $98 + $50 + $31 = $789\n- Accommodations: $67 + $67 + $1,118 + $1,118 + $81 + $81 = $2,532\n- Total cost: $125 + $789 + $2,532 = $3,446\n\nThe total cost of $3,446 is well within the budget of $5,900. All restaurants and attractions are within the destination cities, and no restaurant or attraction is repeated. Accommodations are booked according to the room type constraints and house rules. The travel plan includes all required details for each day, and the transportation method is consistent with self-driving as there are no available flights. The city sequence forms a closed loop, starting and ending in Wichita, and each city is visited consecutively without repetition, except for the starting and ending city.", "gpt-4-1106-preview_direct_sole-planning_parsed_results": [{"day": 1, "current_city": "from Wichita to Alamosa", "transportation": "Self-driving from Wichita to Alamosa, Duration: 8 hours 27 mins, Distance: 819 km", "breakfast": "-", "attraction": "-", "lunch": "-", "dinner": "Atlanta Highway Seafood Market, Alamosa", "accommodation": "Comfortable studio suite in midtown Manhattan, Alamosa"}, {"day": 2, "current_city": "Alamosa", "transportation": "-", "breakfast": "Coffee to Cocktail Bar - Hyatt Place, Alamosa", "attraction": "San Luis Valley Museum, Alamosa;Rio Grande Farm Park, Alamosa;", "lunch": "Riverwalk Cafe, Alamosa", "dinner": "Burger Singh, Alamosa", "accommodation": "Comfortable studio suite in midtown Manhattan, Alamosa"}, {"day": 3, "current_city": "from Alamosa to Grand Junction", "transportation": "Self-driving from Alamosa to Grand Junction, Duration: 4 hours 29 mins, Distance: 396 km", "breakfast": "Cafe LazyMojo, Alamosa", "attraction": "-", "lunch": "-", "dinner": "Austin's BBQ and Oyster Bar, Grand Junction", "accommodation": "NYC Apartment near Central Park!, Grand Junction"}, {"day": 4, "current_city": "Grand Junction", "transportation": "-", "breakfast": "Shanghai Bar & Lounge - The Bristol Hotel, Grand Junction", "attraction": "Museum of the West, Grand Junction;Western Colorado Botanical Gardens, Grand Junction;", "lunch": "2 Dog, Grand Junction", "dinner": "Punjab Da Pind, Grand Junction", "accommodation": "NYC Apartment near Central Park!, Grand Junction"}, {"day": 5, "current_city": "from Grand Junction to Durango", "transportation": "Self-driving from Grand Junction to Durango, Duration: 3 hours 33 mins, Distance: 269 km", "breakfast": "Cocoa Tree, Grand Junction", "attraction": "-", "lunch": "-", "dinner": "Samurai Japanese Cuisine & Sushi Bar, Durango", "accommodation": "Lux 1BR in the heart of NYC Theater district!, Durango"}, {"day": 6, "current_city": "Durango", "transportation": "-", "breakfast": "Hot & Tasty Chinese Food, Durango", "attraction": "Animas Museum, Durango;Durango & Silverton Narrow Gauge Railroad, Durango;", "lunch": "Dub's High on the Hog, Durango", "dinner": "Standard Chicken Point, Durango", "accommodation": "Lux 1BR in the heart of NYC Theater district!, Durango"}, {"day": 7, "current_city": "from Durango to Wichita", "transportation": "Self-driving from Durango to Wichita, Duration: 11 hours 15 mins, Distance: 1,078 km", "breakfast": "Chickenette, Durango", "attraction": "-", "lunch": "-", "dinner": "-", "accommodation": "-"}]}]