[{"gpt-4-1106-preview_direct_sole-planning_results": "Travel Plan:\n\nDay 1: March 15, 2022\nCurrent City: Philadelphia to Richmond\nTransportation: Flight F3730367, from Philadelphia to Richmond, duration: 1 hour 0 minutes, cost: $73\nBreakfast: -\nAttraction: -\nLunch: -\nDinner: Guang Zhou Chinese Restaurant, Richmond, cost: $84, cuisines: Desserts, Tea, Cafe, Fast Food, Chinese, Indian\nAccommodation: 12 East 86th St full furnished, Richmond, cost: $451, room type: Entire home/apt, house rules: No parties, minimum nights: 30, maximum occupancy: 2\n\nNumber of people: 1\nTotal cost: Flight $73 + Dinner $84 + Accommodation $451 = $608\n\nDay 2: March 16, 2022\nCurrent City: Richmond\nTransportation: -\nBreakfast: Sandpiper Restaurant & Lounge, Richmond, cost: $20, cuisines: Tea, Cafe, Desserts, Seafood\nAttraction: Virginia Museum of Fine Arts, Richmond; Maymont, Richmond\nLunch: Paradise, Richmond, cost: $80, cuisines: Tea, Pizza, Italian, Fast Food, Seafood\nDinner: Welcome, Richmond, cost: $86, cuisines: Tea, French, Bakery, Indian\nAccommodation: 12 East 86th St full furnished, Richmond, cost: $451, room type: Entire home/apt, house rules: No parties, minimum nights: 30, maximum occupancy: 2\n\nNumber of people: 1\nTotal cost: Breakfast $20 + Lunch $80 + Dinner $86 + Accommodation $451 = $637\n\nDay 3: March 17, 2022\nCurrent City: Richmond to Petersburg\nTransportation: Self-driving, from Richmond to Petersburg, duration: 25 mins, cost: $1\nBreakfast: Perfect Bake, Richmond, cost: $33, cuisines: Desserts, Tea, Italian, Bakery, Cafe, American\nAttraction: Petersburg National Battlefield, Petersburg\nLunch: 5 Little Pigs, Petersburg, cost: $46, cuisines: Tea, French, Desserts\nDinner: J's Homestyle Cooking, Petersburg, cost: $63, cuisines: Fast Food, BBQ, Desserts, Italian\nAccommodation: Charming cozy bedroom in Clinton Hill!, Petersburg, cost: $274, room type: Private room, house rules: No smoking & No parties & No pets, minimum nights: 3, maximum occupancy: 2\n\nNumber of people: 1\nTotal cost: Transportation $1 + Breakfast $33 + Lunch $46 + Dinner $63 + Accommodation $274 = $417\n\nDay 4: March 18, 2022\nCurrent City: Petersburg\nTransportation: -\nBreakfast: Tea'se Me - Rooftop Tea Boutique, Petersburg, cost: $49, cuisines: Tea, Cafe, Desserts, Seafood\nAttraction: Centre Hill Mansion-Museum, Petersburg; Pamplin Historical Park, Petersburg\nLunch: Bake-a-boo, Petersburg, cost: $40, cuisines: Tea, Cafe, Pizza, BBQ\nDinner: Silver Crown, Petersburg, cost: $54, cuisines: Pizza, Indian, Desserts, Seafood\nAccommodation: Charming cozy bedroom in Clinton Hill!, Petersburg, cost: $274, room type: Private room, house rules: No smoking & No parties & No pets, minimum nights: 3, maximum occupancy: 2\n\nNumber of people: 1\nTotal cost: Breakfast $49 + Lunch $40 + Dinner $54 + Accommodation $274 = $417\n\nDay 5: March 19, 2022\nCurrent City: Petersburg to Charlottesville\nTransportation: Self-driving, from Petersburg to Charlottesville, duration: 1 hour 30 mins, cost: $7\nBreakfast: Raju Vaishno Amritsari Dhaba, Petersburg, cost: $83, cuisines: BBQ, Mediterranean, Seafood\nAttraction: Monticello, Charlottesville\nLunch: Mama's Fish House, Charlottesville, cost: $63, cuisines: Tea, Pizza, Desserts, Fast Food\nDinner: Restaurant Andre, Charlottesville, cost: $250, cuisines: Desserts, Tea, BBQ, Fast Food, Chinese\nAccommodation: Williamsburg Hidden Gem, Charlottesville, cost: $391, room type: Entire home/apt, house rules: No visitors & No smoking, minimum nights: 1, maximum occupancy: 2\n\nNumber of people: 1\nTotal cost: Transportation $7 + Breakfast $83 + Lunch $63 + Dinner $250 + Accommodation $391 = $794\n\nDay 6: March 20, 2022\nCurrent City: Charlottesville\nTransportation: -\nBreakfast: Takamaka, Charlottesville, cost: $72, cuisines: Tea, Pizza, Italian, BBQ, Fast Food\nAttraction: Virginia Discovery Museum, Charlottesville; The Fralin Museum of Art at the University of Virginia, Charlottesville\nLunch: Sandys Cocktails & Kitchen, Charlottesville, cost: $82, cuisines: Tea, Pizza, BBQ, Indian, Seafood\nDinner: Dawat-e-Ishq, Charlottesville, cost: $26, cuisines: Desserts, Tea, Italian, BBQ, Fast Food\nAccommodation: Williamsburg Hidden Gem, Charlottesville, cost: $391, room type: Entire home/apt, house rules: No visitors & No smoking, minimum nights: 1, maximum occupancy: 2\n\nNumber of people: 1\nTotal cost: Breakfast $72 + Lunch $82 + Dinner $26 + Accommodation $391 = $571\n\nDay 7: March 21, 2022\nCurrent City: Charlottesville to Philadelphia\nTransportation: Self-driving, from Charlottesville to Philadelphia, duration: 4 hours 24 mins, cost: $20\nBreakfast: Firefly, Charlottesville, cost: $30, cuisines: Pizza, Bakery\nAttraction: -\nLunch: -\nDinner: -\nAccommodation: -\n\nNumber of people: 1\nTotal cost: Transportation $20 + Breakfast $30 = $50\n\nTotal cost across all days: $608 + $637 + $417 + $417 + $794 + $571 + $50 = $3,494\n\nUnfortunately, the total cost of $3,494 exceeds the specified budget of $1,800. Adjustments must be made to the plan to reduce costs. This could include choosing less expensive accommodations, dining options, or eliminating certain attractions. Please advise on which areas you would prefer to adjust to meet the budget constraint.", "gpt-4-1106-preview_direct_sole-planning_parsed_results": [{"day": 1, "current_city": "from Philadelphia to Richmond", "transportation": "Flight Number: F3730367, from Philadelphia to Richmond, Departure Time: -, Arrival Time: -", "breakfast": "-", "attraction": "-", "lunch": "-", "dinner": "Guang Zhou Chinese Restaurant, Richmond", "accommodation": "12 East 86th St full furnished, Richmond"}, {"day": 2, "current_city": "Richmond", "transportation": "-", "breakfast": "Sandpiper Restaurant & Lounge, Richmond", "attraction": "Virginia Museum of Fine Arts, Richmond;Maymont, Richmond;", "lunch": "Paradise, Richmond", "dinner": "Welcome, Richmond", "accommodation": "12 East 86th St full furnished, Richmond"}, {"day": 3, "current_city": "from Richmond to Petersburg", "transportation": "Self-driving, from Richmond to Petersburg, Departure Time: -, Arrival Time: -", "breakfast": "Perfect Bake, Richmond", "attraction": "Petersburg National Battlefield, Petersburg", "lunch": "5 Little Pigs, Petersburg", "dinner": "J's Homestyle Cooking, Petersburg", "accommodation": "Charming cozy bedroom in Clinton Hill!, Petersburg"}, {"day": 4, "current_city": "Petersburg", "transportation": "-", "breakfast": "Tea'se Me - Rooftop Tea Boutique, Petersburg", "attraction": "Centre Hill Mansion-Museum, Petersburg;Pamplin Historical Park, Petersburg;", "lunch": "Bake-a-boo, Petersburg", "dinner": "Silver Crown, Petersburg", "accommodation": "Charming cozy bedroom in Clinton Hill!, Petersburg"}, {"day": 5, "current_city": "from Petersburg to Charlottesville", "transportation": "Self-driving, from Petersburg to Charlottesville, Departure Time: -, Arrival Time: -", "breakfast": "Raju Vaishno Amritsari Dhaba, Petersburg", "attraction": "Monticello, Charlottesville", "lunch": "Mama's Fish House, Charlottesville", "dinner": "Restaurant Andre, Charlottesville", "accommodation": "Williamsburg Hidden Gem, Charlottesville"}, {"day": 6, "current_city": "Charlottesville", "transportation": "-", "breakfast": "Takamaka, Charlottesville", "attraction": "Virginia Discovery Museum, Charlottesville;The Fralin Museum of Art at the University of Virginia, Charlottesville;", "lunch": "Sandys Cocktails & Kitchen, Charlottesville", "dinner": "Dawat-e-Ishq, Charlottesville", "accommodation": "Williamsburg Hidden Gem, Charlottesville"}, {"day": 7, "current_city": "from Charlottesville to Philadelphia", "transportation": "Self-driving, from Charlottesville to Philadelphia, Departure Time: -, Arrival Time: -", "breakfast": "Firefly, Charlottesville", "attraction": "-", "lunch": "-", "dinner": "-", "accommodation": "-"}]}]