[{"gpt-4-1106-preview_direct_sole-planning_results": "Travel Plan:\n\n***** Day 1: March 25th, 2022 *****\nCurrent City: from Salt Lake City (Utah) to Twin Falls (Idaho)\nTransportation: Flight F3809095, from Salt Lake City to Twin Falls, duration: 0 hours 55 minutes, cost: $64 per person\nBreakfast: -\nAttraction: -\nLunch: Asia Kitchen, Twin Falls, cost: $67, cuisines: Tea, Cafe, BBQ, Desserts\nDinner: Fresc Co, Twin Falls, cost: $60, cuisines: Desserts, Mexican, BBQ, Mediterranean, Seafood\nAccommodation: Charming studio, great location!!!, Twin Falls, cost: $994, maximum occupancy: 8, house rules: No smoking & No pets, minimum nights: 2\n\nNumber of people: 2\nTotal cost: 2 x $64 (Flight) + 2 x $67 (Lunch) + 2 x $60 (Dinner) + $994 (Accommodation) = $1,376\nAccommodation minimum nights: 1/2\n\n***** Day 2: March 26th, 2022 *****\nCurrent City: Twin Falls\nTransportation: -\nBreakfast: Thai Paradise, Twin Falls, cost: $87, cuisines: Fast Food, Indian, Desserts, Seafood\nAttraction: Shoshone Falls Park, Twin Falls\nLunch: Food Fever, Twin Falls, cost: $83, cuisines: Fast Food, Chinese, BBQ, Seafood\nDinner: Mr. Grill, Twin Falls, cost: $80, cuisines: BBQ, Cafe, American, Desserts\nAccommodation: Charming studio, great location!!!, Twin Falls, cost: $994, maximum occupancy: 8, house rules: No smoking & No pets, minimum nights: 2\n\nNumber of people: 2\nTotal cost: 2 x $87 (Breakfast) + 2 x $83 (Lunch) + 2 x $80 (Dinner) + $994 (Accommodation) = $1,494\nAccommodation minimum nights: 2/2\n\n***** Day 3: March 27th, 2022 *****\nCurrent City: from Twin Falls to Salt Lake City\nTransportation: Self-driving, from Twin Falls to Salt Lake City, duration: 3 hours 14 mins, distance: 351 km, cost: $17 per person\nBreakfast: -\nAttraction: -\nLunch: -\nDinner: -\nAccommodation: -\n\nNumber of people: 2\nTotal cost: 2 x $17 (Transportation) = $34\n\nTotal cost across all days: $1,376 (Day 1) + $1,494 (Day 2) + $34 (Day 3) = $2,904\n\nUnfortunately, the total cost exceeds the specified budget of $1,600. Adjustments are needed to meet the budget constraint. Let's consider alternative transportation and accommodation options to reduce costs.\n\nRevised Travel Plan:\n\n***** Day 1: March 25th, 2022 *****\nTransportation: Self-driving, from Salt Lake City to Twin Falls, duration: 3 hours 13 mins, cost: $17 per person\n\n***** Day 2: March 26th, 2022 *****\nAccommodation: Private room in E. Williamsburg! Budget friendly!, Twin Falls, cost: $283, maximum occupancy: 1, house rules: No pets, minimum nights: 3\n\n***** Day 3: March 27th, 2022 *****\nTransportation: Self-driving, from Twin Falls to Salt Lake City, duration: 3 hours 14 mins, cost: $17 per person\n\nRevised Total cost across all days: 2 x $17 (Day 1 Transportation) + 2 x $67 (Day 1 Lunch) + 2 x $60 (Day 1 Dinner) + $283 (Day 2 Accommodation) + 2 x $87 (Day 2 Breakfast) + 2 x $83 (Day 2 Lunch) + 2 x $80 (Day 2 Dinner) + 2 x $17 (Day 3 Transportation) = $1,071\n\nThe revised plan meets the budget constraint of $1,600. Please note that some meals and attractions have been omitted to stay within budget, and the accommodation on Day 2 has been changed to a private room that requires a 3-night minimum stay, which may not be ideal for a 3-day trip. Adjustments to the plan may be necessary to ensure a comfortable and enjoyable trip while staying within budget.", "gpt-4-1106-preview_direct_sole-planning_parsed_results": [{"day": 1, "current_city": "from Salt Lake City to Twin Falls", "transportation": "Flight Number: F3809095, from Salt Lake City to Twin Falls, Departure Time: -, Arrival Time: -", "breakfast": "-", "attraction": "-", "lunch": "Asia Kitchen, Twin Falls", "dinner": "Fresc Co, Twin Falls", "accommodation": "Charming studio, great location!!!, Twin Falls"}, {"day": 2, "current_city": "Twin Falls", "transportation": "-", "breakfast": "Thai Paradise, Twin Falls", "attraction": "Shoshone Falls Park, Twin Falls", "lunch": "Food Fever, Twin Falls", "dinner": "Mr. Grill, Twin Falls", "accommodation": "Charming studio, great location!!!, Twin Falls"}, {"day": 3, "current_city": "from Twin Falls to Salt Lake City", "transportation": "Self-driving, from Twin Falls to Salt Lake City, Departure Time: -, Arrival Time: -", "breakfast": "-", "attraction": "-", "lunch": "-", "dinner": "-", "accommodation": "-"}]}]