[{"gpt-4-1106-preview_direct_sole-planning_results": "Based on the provided information and constraints, here is a 5-day travel itinerary for a group of 7 departing from Sun Valley, visiting San Diego and Oakland in California, with a budget of $11,400, and preferences for accommodations that allow parties and a variety of cuisines including Mediterranean, American, French, and Indian. The group prefers not to fly between locations.\n\n**Day 1: Sun Valley to San Diego**\n- Transportation: Self-driving from Sun Valley to San Diego, duration: 14 hours 9 mins, distance: 1,461 km, cost: $73 x 7 = $511\n- Breakfast: -\n- Attraction: -\n- Lunch: -\n- Dinner: The Lost Mughal, San Diego, cost: $74 x 7 = $518, cuisines: Tea, Cafe, Italian\n- Accommodation: Luxury 4BR Home, Spacious & Central to Trains, San Diego, cost: $392 x 1 night = $392, allows parties, maximum occupancy: 3 (Booking 3 units for 7 people)\n\n**Day 2: San Diego**\n- Transportation: -\n- Breakfast: Open Yard, San Diego, cost: $33 x 7 = $231, cuisines: Chinese, Pizza, Cafe, Desserts\n- Attraction: San Diego Zoo, cost: Free (assuming no entrance fee is listed)\n- Lunch: Gopala, San Diego, cost: $98 x 7 = $686, cuisines: Pizza, Mexican, BBQ, American, Seafood\n- Dinner: Burger King, San Diego, cost: $20 x 7 = $140, cuisines: Pizza, Italian, French, Fast Food, Seafood\n- Accommodation: Luxury 4BR Home, Spacious & Central to Trains, San Diego, cost: $392 x 1 night = $392\n\n**Day 3: San Diego to Oakland**\n- Transportation: Self-driving from San Diego to Oakland, duration: 7 hours 38 mins, distance: 789 km, cost: $39 x 7 = $273\n- Breakfast: Jetha Lal Ka Dhabha, San Diego, cost: $22 x 7 = $154, cuisines: Tea, Cafe, Indian, Italian\n- Attraction: Balboa Park, cost: Free (assuming no entrance fee is listed)\n- Lunch: Bikaner Sweets, San Diego, cost: $37 x 7 = $259, cuisines: Bakery, Pizza, Indian, Fast Food\n- Dinner: -\n- Accommodation: Conveniently located 2 BR Time Square Apartment, Oakland, cost: $502 x 1 night = $502, allows parties, maximum occupancy: 4 (Booking 2 units for 7 people)\n\n**Day 4: Oakland**\n- Transportation: -\n- Breakfast: Cho Gao - Crowne Plaza Abu Dhabi, Oakland, cost: $52 x 7 = $364, cuisines: Tea, BBQ, Seafood\n- Attraction: Oakland Zoo, cost: Free (assuming no entrance fee is listed)\n- Lunch: Jammu And Kashmir House, Oakland, cost: $100 x 7 = $700, cuisines: Tea, BBQ, American, Mediterranean, Seafood\n- Dinner: Wok On Wheels, Oakland, cost: $100 x 7 = $700, cuisines: Tea, Pizza, Bakery, Mediterranean\n- Accommodation: Conveniently located 2 BR Time Square Apartment, Oakland, cost: $502 x 1 night = $502\n\n**Day 5: Oakland to Sun Valley**\n- Transportation: Self-driving from Oakland to Sun Valley, duration: 11 hours 36 mins, distance: 1,204 km, cost: $60 x 7 = $420\n- Breakfast: Pind Balluchi, Oakland, cost: $61 x 7 = $427, cuisines: Tea, Cafe, BBQ, Seafood\n- Attraction: -\n- Lunch: -\n- Dinner: -\n- Accommodation: -\n\n**Total Costs:**\n- Transportation: $511 + $273 + $420 = $1,204\n- Meals: $518 + $231 + $686 + $140 + $154 + $259 + $364 + $700 + $700 + $427 = $4,179\n- Accommodations: $392 x 3 (San Diego) + $502 x 2 (Oakland) = $2,680\n- Attractions: $0 (assuming no entrance fees are listed)\n\n**Grand Total: $1,204 (Transportation) + $4,179 (Meals) + $2,680 (Accommodations) = $8,063**\n\nThe total cost of $8,063 is within the budget of $11,400. The plan includes a variety of cuisines as requested and accommodations that allow parties. Attractions were chosen based on proximity and assumed no entrance fee. The transportation method is self-driving, adhering to the preference of not flying.", "gpt-4-1106-preview_direct_sole-planning_parsed_results": [{"day": 1, "current_city": "from Sun Valley to San Diego", "transportation": "Self-driving from Sun Valley to San Diego, Duration: 14 hours 9 mins, Distance: 1461 km", "breakfast": "-", "attraction": "-", "lunch": "-", "dinner": "The Lost Mughal, San Diego", "accommodation": "Luxury 4BR Home, Spacious & Central to Trains, San Diego"}, {"day": 2, "current_city": "San Diego", "transportation": "-", "breakfast": "Open Yard, San Diego", "attraction": "San Diego Zoo, San Diego", "lunch": "Gopala, San Diego", "dinner": "Burger King, San Diego", "accommodation": "Luxury 4BR Home, Spacious & Central to Trains, San Diego"}, {"day": 3, "current_city": "from San Diego to Oakland", "transportation": "Self-driving from San Diego to Oakland, Duration: 7 hours 38 mins, Distance: 789 km", "breakfast": "Jetha Lal Ka Dhabha, San Diego", "attraction": "Balboa Park, San Diego", "lunch": "Bikaner Sweets, San Diego", "dinner": "-", "accommodation": "Conveniently located 2 BR Time Square Apartment, Oakland"}, {"day": 4, "current_city": "Oakland", "transportation": "-", "breakfast": "Cho Gao - Crowne Plaza Abu Dhabi, Oakland", "attraction": "Oakland Zoo, Oakland", "lunch": "Jammu And Kashmir House, Oakland", "dinner": "Wok On Wheels, Oakland", "accommodation": "Conveniently located 2 BR Time Square Apartment, Oakland"}, {"day": 5, "current_city": "from Oakland to Sun Valley", "transportation": "Self-driving from Oakland to Sun Valley, Duration: 11 hours 36 mins, Distance: 1204 km", "breakfast": "Pind Balluchi, Oakland", "attraction": "-", "lunch": "-", "dinner": "-", "accommodation": "-"}]}]