[{"gpt-4-1106-preview_direct_sole-planning_results": "Based on the provided information and constraints, here is the travel plan for two people departing from Eugene and heading to Los Angeles for 3 days, from March 14th to March 16th, 2022, with a budget of $1,700 and a preference for entire room accommodations.\n\n***** Travel Plan *****\n\nDay 1: March 14th, Eugene to Los Angeles\n- Transportation: Flight F3818922, from Eugene to Los Angeles, cost: $225 per person, total cost: $450\n- Accommodation: Midtown East 2 Bed/2 Bath Elevator Building Apt, Los Angeles, cost: $540, entire home/apt, house rules: No pets, minimum nights: 7, maximum occupancy: 4\n- Dinner: Heat - Edsa Shangri-La, Los Angeles, cost: $148, cuisines: Bakery, BBQ\n\nNumber of people: 2\nTotal cost for Day 1: 2 x $450 (flight) + $540 (accommodation) + 2 x $148 (dinner) = $1,736\nAccommodation minimum nights: 1/7\n\nDay 2: March 15th, Los Angeles\n- Breakfast: Palmshore, Los Angeles, cost: $25 per person, total cost: $50, cuisines: Desserts, Bakery, Fast Food, American, Seafood\n- Attraction: Santa Monica Pier, Los Angeles; Griffith Observatory, Los Angeles\n- Lunch: Punjabi Zaika, Los Angeles, cost: $46 per person, total cost: $92, cuisines: Pizza, Bakery, BBQ, Cafe, Indian\n- Dinner: The Hangout by 1861, Los Angeles, cost: $64 per person, total cost: $128, cuisines: Tea, Pizza, Seafood\n- Accommodation: Midtown East 2 Bed/2 Bath Elevator Building Apt, Los Angeles, cost: $540, entire home/apt, house rules: No pets, minimum nights: 7, maximum occupancy: 4\n\nNumber of people: 2\nTotal cost for Day 2: $50 (breakfast) + $92 (lunch) + $128 (dinner) + $540 (accommodation) = $810\nAccommodation minimum nights: 2/7\n\nDay 3: March 16th, Los Angeles to Eugene\n- Breakfast: Chicken Minar, Los Angeles, cost: $25 per person, total cost: $50, cuisines: Bakery, Fast Food\n- Transportation: Flight F3819973, from Los Angeles to Eugene, cost: $166 per person, total cost: $332\n- Accommodation: -\n\nNumber of people: 2\nTotal cost for Day 3: $50 (breakfast) + $332 (flight) = $382\n\nTotal cost across all days: $1,736 (Day 1) + $810 (Day 2) + $382 (Day 3) = $2,928\n\n***** End of Travel Plan *****\n\nUnfortunately, the total cost of the travel plan ($2,928) exceeds the specified budget of $1,700. To adhere to the budget, we need to make adjustments:\n\n- Choose the cheapest flight option for Day 1 and Day 3.\n- Select a more affordable accommodation option that meets the entire room requirement.\n- Adjust meal choices to less expensive options.\n\nRevised Travel Plan:\n\nDay 1: March 14th, Eugene to Los Angeles\n- Transportation: Flight F3818922, from Eugene to Los Angeles, cost: $225 per person, total cost: $450\n- Accommodation: Lovely studio, Los Angeles, cost: $117, entire home/apt, house rules: No visitors, minimum nights: 1, maximum occupancy: 3\n- Dinner: Chicken Minar, Los Angeles, cost: $25 per person, total cost: $50, cuisines: Bakery, Fast Food\n\nNumber of people: 2\nTotal cost for Day 1: 2 x $225 (flight) + $117 (accommodation) + 2 x $25 (dinner) = $617\n\nDay 2: March 15th, Los Angeles\n- Breakfast: Palmshore, Los Angeles, cost: $25 per person, total cost: $50, cuisines: Desserts, Bakery, Fast Food, American, Seafood\n- Attraction: Santa Monica Pier, Los Angeles; Griffith Observatory, Los Angeles\n- Lunch: Punjabi Zaika, Los Angeles, cost: $46 per person, total cost: $92, cuisines: Pizza, Bakery, BBQ, Cafe, Indian\n- Dinner: The Hangout by 1861, Los Angeles, cost: $64 per person, total cost: $128, cuisines: Tea, Pizza, Seafood\n- Accommodation: Lovely studio, Los Angeles, cost: $117, entire home/apt, house rules: No visitors, minimum nights: 1, maximum occupancy: 3\n\nNumber of people: 2\nTotal cost for Day 2: $50 (breakfast) + $92 (lunch) + $128 (dinner) + $117 (accommodation) = $387\n\nDay 3: March 16th, Los Angeles to Eugene\n- Breakfast: Chicken Minar, Los Angeles, cost: $25 per person, total cost: $50, cuisines: Bakery, Fast Food\n- Transportation: Flight F3819973, from Los Angeles to Eugene, cost: $166 per person, total cost: $332\n- Accommodation: -\n\nNumber of people: 2\nTotal cost for Day 3: $50 (breakfast) + $332 (flight) = $382\n\nTotal cost across all days: $617 (Day 1) + $387 (Day 2) + $382 (Day 3) = $1,386\n\nThe revised total cost of the travel plan is $1,386, which is within the specified budget of $1,700.", "gpt-4-1106-preview_direct_sole-planning_parsed_results": [{"day": 1, "current_city": "from Eugene to Los Angeles", "transportation": "Flight Number: F3818922, from Eugene to Los Angeles", "breakfast": "-", "attraction": "-", "lunch": "-", "dinner": "Chicken Minar, Los Angeles", "accommodation": "Lovely studio, Los Angeles"}, {"day": 2, "current_city": "Los Angeles", "transportation": "-", "breakfast": "Palmshore, Los Angeles", "attraction": "Santa Monica Pier, Los Angeles;Griffith Observatory, Los Angeles;", "lunch": "Punjabi Zaika, Los Angeles", "dinner": "The Hangout by 1861, Los Angeles", "accommodation": "Lovely studio, Los Angeles"}, {"day": 3, "current_city": "from Los Angeles to Eugene", "transportation": "Flight Number: F3819973, from Los Angeles to Eugene", "breakfast": "Chicken Minar, Los Angeles", "attraction": "-", "lunch": "-", "dinner": "-", "accommodation": "-"}]}]