[{"gpt-4-1106-preview_direct_sole-planning_results": "Based on the provided information and constraints, here is a 3-day travel plan for a group of 3, traveling from Daytona Beach to Atlanta and back, with a budget of $2,100, requiring accommodations that allow children under 10 and preferring entire rooms:\n\n***** Travel Plan *****\n\nDay 1: March 2nd, 2022\nCurrent City: from Daytona Beach (Florida) to Atlanta (Georgia)\nTransportation: Self-driving, from Daytona Beach to Atlanta, duration: 6 hours 18 mins, distance: 696 km, cost: $34 x 3 = $102\nBreakfast: -\nAttraction: -\nLunch: -\nDinner: Saffron, Atlanta, cost: $39 x 3 = $117, cuisines: Tea, Cafe, Fast Food, Seafood\nAccommodation: Bright, Modern, Clean, Spacious, Brooklyn Home, Atlanta, cost: $1034, maximum occupancy: 4, house rules: No children under 10, minimum nights: 3\n\nNumber of people: 3\nTotal cost: $102 + $117 + $1034 = $1253\nAccommodation minimum nights: 1/3\n\nDay 2: March 3rd, 2022\nCurrent City: Atlanta\nTransportation: -\nBreakfast: Asian Bistro, Atlanta, cost: $27 x 3 = $81, cuisines: Tea, Bakery, Seafood\nAttraction: Georgia Aquarium, Atlanta; Centennial Olympic Park, Atlanta\nLunch: Daawat-e-Kashmir, Atlanta, cost: $19 x 3 = $57, cuisines: Cafe, Pizza, American, Seafood\nDinner: Chef Style, Atlanta, cost: $59 x 3 = $177, cuisines: Pizza, American, Desserts, Seafood\nAccommodation: Bright, Modern, Clean, Spacious, Brooklyn Home, Atlanta, cost: $1034, maximum occupancy: 4, house rules: No children under 10, minimum nights: 3\n\nNumber of people: 3\nTotal cost: $81 + $57 + $177 + $1034 = $1349\nAccommodation minimum nights: 2/3\n\nDay 3: March 4th, 2022\nCurrent City: from Atlanta to Daytona Beach\nTransportation: Self-driving from Atlanta to Daytona Beach, duration: 6 hours 20 mins, distance: 706 km, cost: $35 x 3 = $105\nBreakfast: Adda, Atlanta, cost: $22 x 3 = $66, cuisines: Tea, Mexican, Bakery\nAttraction: -\nLunch: -\nDinner: -\nAccommodation: -\n\nNumber of people: 3\nTotal cost: $105 + $66 = $171\n\nTotal cost across all days: $1253 + $1349 + $171 = $2773\n\nUnfortunately, the total cost exceeds the specified budget of $2,100. To adjust the plan to fit within the budget, we need to make some changes:\n\n- We will change the accommodation to a more affordable option that still meets the requirements.\n- We will remove one of the meals to reduce costs.\n\nRevised Accommodation for Day 1 and Day 2:\nAccommodation: Charming Carroll Gardens 2 BR, Atlanta, cost: $576, maximum occupancy: 4, house rules: No parties, minimum nights: 1\n\nRevised Total cost for Day 1: $102 + $117 + $576 = $795\nRevised Total cost for Day 2: $81 + $57 + $177 + $576 = $891\nRevised Total cost for Day 3: $105 + $66 = $171\n\nRevised Total cost across all days: $795 + $891 + $171 = $1857\n\nCuisines: The prompt specifies no cuisines, so all cuisine constraints are satisfied.\n\n***** Revised Travel Plan Ends *****\n\nPlease note that the revised plan now fits within the budget of $2,100.", "gpt-4-1106-preview_direct_sole-planning_parsed_results": [{"day": 1, "current_city": "from Daytona Beach to Atlanta", "transportation": "Self-driving, from Daytona Beach to Atlanta, Duration: 6 hours 18 mins, Distance: 696 km", "breakfast": "-", "attraction": "-", "lunch": "-", "dinner": "Saffron, Atlanta", "accommodation": "Charming Carroll Gardens 2 BR, Atlanta"}, {"day": 2, "current_city": "Atlanta", "transportation": "-", "breakfast": "Asian Bistro, Atlanta", "attraction": "Georgia Aquarium, Atlanta;Centennial Olympic Park, Atlanta;", "lunch": "Daawat-e-Kashmir, Atlanta", "dinner": "Chef Style, Atlanta", "accommodation": "Charming Carroll Gardens 2 BR, Atlanta"}, {"day": 3, "current_city": "from Atlanta to Daytona Beach", "transportation": "Self-driving from Atlanta to Daytona Beach, Duration: 6 hours 20 mins, Distance: 706 km", "breakfast": "Adda, Atlanta", "attraction": "-", "lunch": "-", "dinner": "-", "accommodation": "-"}]}]