[{"gpt-4-1106-preview_direct_sole-planning_results": "Based on the provided information and constraints, here is a 5-day travel plan for 2 people departing from Richmond to visit Houston and Texarkana in Texas, with a focus on Chinese and Indian cuisines:\n\n***** Travel Plan *****\n\nDay 1: Richmond to Houston (March 6th, 2022)\n- Transportation: Flight F4041372 from Richmond to Houston, cost: $371 per person, total cost: $742\n- Breakfast: Not applicable (assuming flight is early morning)\n- Attraction: Space Center Houston, cost: Free (assuming no entry fee is listed)\n- Lunch: Jalapenos, Houston, cost: $57 per person, total cost: $114, cuisines: Desserts, Tea, Cafe, Chinese, Seafood\n- Dinner: The BrewMaster - The Mix Fine Dine, Houston, cost: $52 per person, total cost: $104, cuisines: French, Indian, Cafe, Seafood\n- Accommodation: Sunny and Airy near Manhattan, Houston, cost: $499 per night, room type: Entire home/apt, house rules: No pets\n\nNumber of people: 2\nTotal cost for Day 1: $742 (flight) + $114 (lunch) + $104 (dinner) + $499 (accommodation) = $1,459\n\nDay 2: Houston (March 7th, 2022)\n- Transportation: Not applicable (staying in Houston)\n- Breakfast: Super Bakery, Houston, cost: $30 per person, total cost: $60, cuisines: Seafood, Fast Food\n- Attraction: Houston Museum of Natural Science, cost: Free (assuming no entry fee is listed)\n- Lunch: Royal Mart, Houston, cost: $40 per person, total cost: $80, cuisines: Tea, Bakery, Cafe, Mediterranean, Seafood\n- Dinner: Matchbox, Houston, cost: $33 per person, total cost: $66, cuisines: Tea, Italian, Bakery, Fast Food, Seafood\n- Accommodation: Sunny and Airy near Manhattan, Houston, cost: $499 per night\n\nNumber of people: 2\nTotal cost for Day 2: $60 (breakfast) + $80 (lunch) + $66 (dinner) + $499 (accommodation) = $705\n\nDay 3: Houston to Texarkana (March 8th, 2022)\n- Transportation: Flight F3930024 from Houston to Texarkana, cost: $63 per person, total cost: $126\n- Breakfast: Earthen Spices, Houston, cost: $28 per person, total cost: $56, cuisines: Tea, Mexican, Bakery, BBQ, Fast Food\n- Attraction: Museum of Regional History, Texarkana, cost: Free (assuming no entry fee is listed)\n- Lunch: Columbia Restaurant, Texarkana, cost: $91 per person, total cost: $182, cuisines: Desserts, Tea, Pizza, Indian, Seafood\n- Dinner: Big City Bread Cafe, Texarkana, cost: $61 per person, total cost: $122, cuisines: Cafe, Pizza, Bakery, BBQ\n- Accommodation: Large 2.5 BR Apt In Park Slope, Texarkana, cost: $269 per night, room type: Entire home/apt\n\nNumber of people: 2\nTotal cost for Day 3: $126 (flight) + $56 (breakfast) + $182 (lunch) + $122 (dinner) + $269 (accommodation) = $755\n\nDay 4: Texarkana (March 9th, 2022)\n- Transportation: Not applicable (staying in Texarkana)\n- Breakfast: Poets Cafe, Texarkana, cost: $88 per person, total cost: $176, cuisines: Chinese, Bakery, Indian, Desserts\n- Attraction: Discovery Place Interactive Museum, cost: Free (assuming no entry fee is listed)\n- Lunch: Granma's Homemade, Texarkana, cost: $57 per person, total cost: $114, cuisines: Tea, Mexican, Bakery, Cafe, Seafood\n- Dinner: Teasta, Texarkana, cost: $94 per person, total cost: $188, cuisines: Pizza, Italian, French, Bakery, Cafe, Seafood\n- Accommodation: Large 2.5 BR Apt In Park Slope, Texarkana, cost: $269 per night\n\nNumber of people: 2\nTotal cost for Day 4: $176 (breakfast) + $114 (lunch) + $188 (dinner) + $269 (accommodation) = $747\n\nDay 5: Texarkana to Richmond (March 10th, 2022)\n- Transportation: Self-driving from Texarkana to Richmond, cost: $88 per person, total cost: $176\n- Breakfast: Prime Bakery, Texarkana, cost: $94 per person, total cost: $188, cuisines: Cafe, Pizza, BBQ, Fast Food\n- Attraction: Not applicable (assuming travel day)\n- Lunch: Not applicable (assuming on the road)\n- Dinner: Not applicable (assuming arrival in Richmond is late)\n- Accommodation: Not applicable (returning home)\n\nNumber of people: 2\nTotal cost for Day 5: $176 (transportation) + $188 (breakfast) = $364\n\nTotal cost across all days: $1,459 (Day 1) + $705 (Day 2) + $755 (Day 3) + $747 (Day 4) + $364 (Day 5) = $4,030\n\nRemaining budget: $6,000 - $4,030 = $1,970\n\nCuisines: The plan includes a focus on Chinese and Indian cuisines as requested.\n\n***** End of Travel Plan *****\n\nPlease note that the costs for attractions are assumed to be free as no entry fees are listed. The accommodation costs are for the entire home/apt, and the room type and house rules have been considered. The transportation modes have been selected based on the available options and the constraints provided. The total cost is within the specified budget of $6,000.", "gpt-4-1106-preview_direct_sole-planning_parsed_results": [{"day": 1, "current_city": "from Richmond to Houston", "transportation": "Flight Number: F4041372, from Richmond to Houston", "breakfast": "-", "attraction": "Space Center Houston, Houston", "lunch": "Jalapenos, Houston", "dinner": "The BrewMaster - The Mix Fine Dine, Houston", "accommodation": "Sunny and Airy near Manhattan, Houston"}, {"day": 2, "current_city": "Houston", "transportation": "-", "breakfast": "Super Bakery, Houston", "attraction": "Houston Museum of Natural Science, Houston", "lunch": "Royal Mart, Houston", "dinner": "Matchbox, Houston", "accommodation": "Sunny and Airy near Manhattan, Houston"}, {"day": 3, "current_city": "from Houston to Texarkana", "transportation": "Flight Number: F3930024, from Houston to Texarkana", "breakfast": "Earthen Spices, Houston", "attraction": "Museum of Regional History, Texarkana", "lunch": "Columbia Restaurant, Texarkana", "dinner": "Big City Bread Cafe, Texarkana", "accommodation": "Large 2.5 BR Apt In Park Slope, Texarkana"}, {"day": 4, "current_city": "Texarkana", "transportation": "-", "breakfast": "Poets Cafe, Texarkana", "attraction": "Discovery Place Interactive Museum, Texarkana", "lunch": "Granma's Homemade, Texarkana", "dinner": "Teasta, Texarkana", "accommodation": "Large 2.5 BR Apt In Park Slope, Texarkana"}, {"day": 5, "current_city": "from Texarkana to Richmond", "transportation": "Self-driving from Texarkana to Richmond", "breakfast": "Prime Bakery, Texarkana", "attraction": "-", "lunch": "-", "dinner": "-", "accommodation": "-"}]}]