[{"gpt-4-1106-preview_direct_sole-planning_results": "Based on the provided information and constraints, here is a 7-day travel plan for a solo traveler starting from Augusta and visiting 3 different cities in Texas:\n\n**Day 1: Augusta to Abilene (March 5, 2022)**\n- Transportation: Self-driving from Augusta to Abilene, duration: 15 hours 59 mins, distance: 1,782 km, cost: $89\n- Breakfast: -\n- Attraction: -\n- Lunch: -\n- Dinner: Thai Garden, Abilene, cost: $13, cuisines: Cafe, American, Desserts\n- Accommodation: Joyce and Donovan's, Room for One, Abilene, cost: $83, room type: Private room, house rules: No parties, minimum nights: 25, maximum occupancy: 2\n\n**Day 2: Abilene (March 6, 2022)**\n- Transportation: -\n- Breakfast: Thai Garden, Abilene, cost: $13, cuisines: Cafe, American, Desserts\n- Attraction: The Grace Museum, Frontier Texas!, Historic Fort Phantom Hill\n- Lunch: Crispy Crust, Abilene, cost: $54, cuisines: Desserts, Bakery, Cafe, American, Seafood\n- Dinner: Finger Licious, Abilene, cost: $35, cuisines: Fast Food, Cafe, BBQ, Seafood\n- Accommodation: Joyce and Donovan's, Room for One, Abilene, cost: $83\n\n**Day 3: Abilene to Amarillo (March 7, 2022)**\n- Transportation: Self-driving from Abilene to Amarillo, duration: 4 hours 10 mins, distance: 446 km, cost: $22\n- Breakfast: Mx Corn, Abilene, cost: $62, cuisines: Tea, Cafe, Italian\n- Attraction: Cadillac Ranch, Amarillo Botanical Gardens\n- Lunch: The Cinnamon Kitchen, Amarillo, cost: $69, cuisines: Desserts, Tea, Pizza, Chinese, Seafood\n- Dinner: Komachi, Amarillo, cost: $71, cuisines: Desserts, Tea, Fast Food, Chinese, Mediterranean\n- Accommodation: Harlem Humble Abode - 1 bedroom - Cute and Quaint, Amarillo, cost: $409, room type: Entire home/apt, house rules: No pets, minimum nights: 5, maximum occupancy: 3\n\n**Day 4: Amarillo (March 8, 2022)**\n- Transportation: -\n- Breakfast: Kanha North & South Indian Veg., Amarillo, cost: $34, cuisines: Tea, Cafe, BBQ, Fast Food\n- Attraction: Amarillo Zoo, Don Harrington Discovery Center\n- Lunch: Sigree Global Grill, Amarillo, cost: $35, cuisines: Chinese, BBQ, Cafe, Desserts\n- Dinner: Anand Restaurant, Amarillo, cost: $53, cuisines: Fast Food, Seafood, Desserts, Italian\n- Accommodation: Harlem Humble Abode - 1 bedroom - Cute and Quaint, Amarillo, cost: $409\n\n**Day 5: Amarillo to Lubbock (March 9, 2022)**\n- Transportation: Self-driving from Amarillo to Lubbock, duration: 1 hour 47 mins, distance: 197 km, cost: $9\n- Breakfast: Wood Box Cafe, Amarillo, cost: $11, cuisines: Desserts, French, Fast Food, Cafe, American\n- Attraction: Buddy Holly Center, National Ranching Heritage Center\n- Lunch: Paris 6 Classique, Lubbock, cost: $91, cuisines: Desserts, Cafe, Pizza, Mexican, BBQ, Chinese\n- Dinner: 3 Squares Diner, Lubbock, cost: $73, cuisines: Pizza, Indian, Fast Food\n- Accommodation: Private bedroom in UWS Apartment, Lubbock, cost: $709, room type: Private room, house rules: No visitors & No pets, minimum nights: 2, maximum occupancy: 2\n\n**Day 6: Lubbock (March 10, 2022)**\n- Transportation: -\n- Breakfast: Cantinho da Gula, Lubbock, cost: $78, cuisines: Cafe, BBQ, Desserts, Italian\n- Attraction: American Windmill Museum, Mackenzie Main City Park\n- Lunch: Grand Barbeque Buffet Restaurant, Lubbock, cost: $20, cuisines: Tea, French, Fast Food, Cafe, Seafood\n- Dinner: Mosaic - Country Inn & Suites By Carlson, Lubbock, cost: $29, cuisines: Chinese, Indian, Desserts, Seafood\n- Accommodation: Private bedroom in UWS Apartment, Lubbock, cost: $709\n\n**Day 7: Lubbock to Augusta (March 11, 2022)**\n- Transportation: Self-driving from Lubbock to Augusta, duration: 18 hours 17 mins, distance: 2,047 km, cost: $102\n- Breakfast: Assam Tea Corner, Lubbock, cost: $52, cuisines: Desserts, BBQ, Fast Food, American, Seafood\n- Attraction: -\n- Lunch: -\n- Dinner: -\n- Accommodation: -\n\n**Total Cost Calculation:**\n- Transportation: $89 + $22 + $9 + $102 = $222\n- Meals: $13 + $54 + $35 + $62 + $69 + $71 + $34 + $35 + $53 + $11 + $91 + $73 + $78 + $20 + $29 + $52 = $780\n- Accommodation: $83 + $83 + $409 + $409 + $709 + $709 = $2402\n- Total cost: $222 + $780 + $2402 = $3404\n\n**Remaining Budget:**\n- $4,100 - $3,404 = $696\n\nThe travel plan includes transportation, meals, attractions, and accommodation for each day, adhering to the constraints and ensuring that the total cost does not exceed the specified budget.", "gpt-4-1106-preview_direct_sole-planning_parsed_results": [{"day": 1, "current_city": "from Augusta to Abilene", "transportation": "Self-driving from Augusta to Abilene, duration: 15 hours 59 mins, distance: 1,782 km", "breakfast": "-", "attraction": "-", "lunch": "-", "dinner": "Thai Garden, Abilene", "accommodation": "Joyce and Donovan's, Room for One, Abilene"}, {"day": 2, "current_city": "Abilene", "transportation": "-", "breakfast": "Thai Garden, Abilene", "attraction": "The Grace Museum, Abilene;Frontier Texas!, Abilene;Historic Fort Phantom Hill, Abilene;", "lunch": "Crispy Crust, Abilene", "dinner": "Finger Licious, Abilene", "accommodation": "Joyce and Donovan's, Room for One, Abilene"}, {"day": 3, "current_city": "from Abilene to Amarillo", "transportation": "Self-driving from Abilene to Amarillo, duration: 4 hours 10 mins, distance: 446 km", "breakfast": "Mx Corn, Abilene", "attraction": "Cadillac Ranch, Amarillo;Amarillo Botanical Gardens, Amarillo;", "lunch": "The Cinnamon Kitchen, Amarillo", "dinner": "Komachi, Amarillo", "accommodation": "Harlem Humble Abode - 1 bedroom - Cute and Quaint, Amarillo"}, {"day": 4, "current_city": "Amarillo", "transportation": "-", "breakfast": "Kanha North & South Indian Veg., Amarillo", "attraction": "Amarillo Zoo, Amarillo;Don Harrington Discovery Center, Amarillo;", "lunch": "Sigree Global Grill, Amarillo", "dinner": "Anand Restaurant, Amarillo", "accommodation": "Harlem Humble Abode - 1 bedroom - Cute and Quaint, Amarillo"}, {"day": 5, "current_city": "from Amarillo to Lubbock", "transportation": "Self-driving from Amarillo to Lubbock, duration: 1 hour 47 mins, distance: 197 km", "breakfast": "Wood Box Cafe, Amarillo", "attraction": "Buddy Holly Center, Lubbock;National Ranching Heritage Center, Lubbock;", "lunch": "Paris 6 Classique, Lubbock", "dinner": "3 Squares Diner, Lubbock", "accommodation": "Private bedroom in UWS Apartment, Lubbock"}, {"day": 6, "current_city": "Lubbock", "transportation": "-", "breakfast": "Cantinho da Gula, Lubbock", "attraction": "American Windmill Museum, Lubbock;Mackenzie Main City Park, Lubbock;", "lunch": "Grand Barbeque Buffet Restaurant, Lubbock", "dinner": "Mosaic - Country Inn & Suites By Carlson, Lubbock", "accommodation": "Private bedroom in UWS Apartment, Lubbock"}, {"day": 7, "current_city": "from Lubbock to Augusta", "transportation": "Self-driving from Lubbock to Augusta, duration: 18 hours 17 mins, distance: 2,047 km", "breakfast": "Assam Tea Corner, Lubbock", "attraction": "-", "lunch": "-", "dinner": "-", "accommodation": "-"}]}]