[{"gpt-4-1106-preview_direct_sole-planning_results": "Based on the provided information and constraints, here is a 5-day travel plan starting in Charlotte and visiting Newark and Trenton in New Jersey:\n\n**Day 1: Charlotte to Newark (March 6, 2022)**\n- Transportation: Flight F3715865 from Charlotte to Newark, cost: $135\n- Arrival in Newark: 09:38 AM\n- Breakfast: -\n- Attraction: The Newark Museum of Art, cost: $0 (assuming free entry)\n- Lunch: Artistry, Newark, cost: $79, cuisines: Cafe, Pizza, Desserts, Seafood\n- Dinner: Mirage Restro Bar, Newark, cost: $51, cuisines: Bakery, American, Desserts, Fast Food\n- Accommodation: Large Two Story Loft in the Heart of West Village, Newark, cost: $1127, room type: Entire home/apt, house rules: No pets & No children under 10\n\n**Day 2: Newark (March 7, 2022)**\n- Transportation: -\n- Breakfast: Harmann Restaurant, Newark, cost: $57, cuisines: Tea, Cafe, American, Fast Food\n- Attraction: Military Park, cost: $0 (assuming free entry)\n- Lunch: Escape Terrace Bar Kitchen, Newark, cost: $100, cuisines: Tea, Cafe, Bakery, Chinese, Seafood\n- Dinner: Bernardo's, Newark, cost: $84, cuisines: Desserts, Pizza, BBQ, American, Mediterranean\n- Accommodation: Large Two Story Loft in the Heart of West Village, Newark, cost: $1127\n\n**Day 3: Newark to Trenton (March 8, 2022)**\n- Transportation: Self-driving from Newark to Trenton, cost: $4\n- Breakfast: Drifters Cafe, Newark, cost: $24, cuisines: Tea, BBQ\n- Attraction: Old Barracks Museum, Trenton, cost: $0 (assuming free entry)\n- Lunch: Global Grill, Trenton, cost: $20, cuisines: Desserts, Pizza, BBQ, Chinese, Mediterranean\n- Dinner: The Cheesecake Factory, Trenton, cost: $36, cuisines: Desserts, Fast Food\n- Accommodation: Whole Floor, 2 BR Apt. in Iconic Greenwich Village, Trenton, cost: $239, room type: Entire home/apt, house rules: No visitors & No smoking\n\n**Day 4: Trenton (March 9, 2022)**\n- Transportation: -\n- Breakfast: Tuscan Oven, Trenton, cost: $74, cuisines: Desserts, Tea, Italian, Fast Food, Cafe\n- Attraction: New Jersey State Museum, cost: $0 (assuming free entry)\n- Lunch: Fusilli Reasons, Trenton, cost: $28, cuisines: Tea, Bakery, Desserts, Seafood\n- Dinner: Patang - The Revolving Restaurant, Trenton, cost: $47, cuisines: Cafe, Bakery, BBQ, Pizza\n- Accommodation: Whole Floor, 2 BR Apt. in Iconic Greenwich Village, Trenton, cost: $239\n\n**Day 5: Trenton to Charlotte (March 10, 2022)**\n- Transportation: Flight F3561600 from Trenton to Charlotte, cost: $201\n- Breakfast: -\n- Attraction: -\n- Lunch: -\n- Dinner: -\n- Accommodation: -\n\n**Total Costs:**\n- Flights: $135 + $201 = $336\n- Self-driving: $4\n- Accommodations: $1127 + $1127 + $239 + $239 = $2732\n- Meals: $79 + $51 + $57 + $100 + $84 + $24 + $20 + $36 + $74 + $28 + $47 = $600\n- Attractions: $0 (assuming free entry to all listed attractions)\n\n**Grand Total: $336 + $4 + $2732 + $600 = $3672**\n\n**Remaining Budget: $4200 - $3672 = $528**\n\n**Notes:**\n- The travel plan includes transportation, meals, attractions, and accommodations for each day.\n- No restaurant or attraction is repeated.\n- The transportation method is consistent with the cities visited.\n- The accommodation matches the final city listed for each day.\n- The number of visiting cities matches the specified number (2 cities in New Jersey).\n- The number of days in the plan matches the specified number of days (5 days).\n- The total cost of the travel plan does not exceed the specified budget ($4,200).\n- All accommodations are entire homes or private rooms, adhering to the \"not shared room\" constraint.\n- The house rules for each accommodation have been considered and adhered to.\n- The selected restaurants offer a variety of cuisines, as specified in the query.\n- The travel plan starts and ends in Charlotte, forming a closed circle.\n\nPlease note that the costs for attractions are assumed to be free, which may not be the case. Also, the availability and exact pricing of flights, accommodations, and restaurants should be confirmed as they can vary.", "gpt-4-1106-preview_direct_sole-planning_parsed_results": [{"day": 1, "current_city": "from Charlotte to Newark", "transportation": "Flight Number: F3715865, from Charlotte to Newark, Departure Time: -, Arrival Time: 09:38", "breakfast": "-", "attraction": "The Newark Museum of Art, Newark;", "lunch": "Artistry, Newark", "dinner": "Mirage Restro Bar, Newark", "accommodation": "Large Two Story Loft in the Heart of West Village, Newark"}, {"day": 2, "current_city": "Newark", "transportation": "-", "breakfast": "Harmann Restaurant, Newark", "attraction": "Military Park, Newark;", "lunch": "Escape Terrace Bar Kitchen, Newark", "dinner": "Bernardo's, Newark", "accommodation": "Large Two Story Loft in the Heart of West Village, Newark"}, {"day": 3, "current_city": "from Newark to Trenton", "transportation": "Self-driving, from Newark to Trenton, Departure Time: -, Arrival Time: -", "breakfast": "Drifters Cafe, Newark", "attraction": "Old Barracks Museum, Trenton;", "lunch": "Global Grill, Trenton", "dinner": "The Cheesecake Factory, Trenton", "accommodation": "Whole Floor, 2 BR Apt. in Iconic Greenwich Village, Trenton"}, {"day": 4, "current_city": "Trenton", "transportation": "-", "breakfast": "Tuscan Oven, Trenton", "attraction": "New Jersey State Museum, Trenton;", "lunch": "Fusilli Reasons, Trenton", "dinner": "Patang - The Revolving Restaurant, Trenton", "accommodation": "Whole Floor, 2 BR Apt. in Iconic Greenwich Village, Trenton"}, {"day": 5, "current_city": "from Trenton to Charlotte", "transportation": "Flight Number: F3561600, from Trenton to Charlotte, Departure Time: -, Arrival Time: -", "breakfast": "-", "attraction": "-", "lunch": "-", "dinner": "-", "accommodation": "-"}]}]