[{"gpt-4-1106-preview_direct_sole-planning_results": "Based on the provided information and constraints, here is a 7-day travel plan for a group of 4 from Lexington to Texas, visiting 3 cities in Texas from March 18th to March 24th, 2022:\n\n**Day 1: March 18, 2022 - Lexington to Dallas**\n- Current City: from Lexington to Dallas\n- Transportation: Flight Number F3600281, Price: $222 per person, DepTime: 05:53, ArrTime: 07:27, Duration: 2 hours 34 minutes, Distance: 785 km\n- Breakfast: -\n- Attraction: -\n- Lunch: -\n- Dinner: 1918 Bistro & Grill, Dallas, Average Cost: $90, Cuisines: Tea, Pizza, BBQ, Seafood\n- Accommodation: Luxury Williamsburg duplex, private roof terrace, Dallas, Price: $241, Room type: Entire home/apt, House rules: No visitors, Minimum nights: 4, Maximum occupancy: 3 (Note: Since the accommodation is for 3 people, an additional room will be booked at the same or similar accommodation)\n  \n**Day 2: March 19, 2022 - Dallas**\n- Current City: Dallas\n- Transportation: -\n- Breakfast: Coconuts Fish Cafe, Dallas, Average Cost: $38, Cuisines: Cafe, BBQ, Mediterranean, Fast Food\n- Attraction: The Dallas World Aquarium, The Sixth Floor Museum at Dealey Plaza\n- Lunch: Kebab Xpress, Dallas, Average Cost: $93, Cuisines: Tea, Bakery, Pizza, Mediterranean\n- Dinner: L'Opera, Dallas, Average Cost: $77, Cuisines: French, Bakery, BBQ, Fast Food, Seafood\n- Accommodation: Luxury Williamsburg duplex, private roof terrace, Dallas (continuing stay)\n\n**Day 3: March 20, 2022 - Dallas to San Angelo**\n- Current City: from Dallas to San Angelo\n- Transportation: Flight Number F3608910, Price: $54 per person, DepTime: 12:39, ArrTime: 13:40, Duration: 1 hour 1 minute, Distance: 229 km\n- Breakfast: Cafe Gatherings, Dallas, Average Cost: $17, Cuisines: Bakery, Indian, Desserts\n- Attraction: -\n- Lunch: -\n- Dinner: DePalma's Italian Cafe - Downtown, San Angelo, Average Cost: $38, Cuisines: French, Pizza, Chinese, Seafood\n- Accommodation: Beautiful Brooklyn Vacation Home!, San Angelo, Price: $1058, Room type: Entire home/apt, House rules: No visitors & No smoking & No pets, Minimum nights: 2, Maximum occupancy: 3 (Note: Since the accommodation is for 3 people, an additional room will be booked at the same or similar accommodation)\n\n**Day 4: March 21, 2022 - San Angelo**\n- Current City: San Angelo\n- Transportation: -\n- Breakfast: Break Fast Point, San Angelo, Average Cost: $40, Cuisines: Tea, Cafe, Indian\n- Attraction: San Angelo Museum of Fine Arts, Fort Concho National Historic Landmark\n- Lunch: Kolkata Hot Kathi Roll, San Angelo, Average Cost: $74, Cuisines: Desserts, Tea, Pizza, Bakery, Indian\n- Dinner: Laxmi Ice Cream, San Angelo, Average Cost: $79, Cuisines: Desserts, Mexican, BBQ, Cafe, American, Seafood\n- Accommodation: Beautiful Brooklyn Vacation Home!, San Angelo (continuing stay)\n\n**Day 5: March 22, 2022 - San Angelo to Houston**\n- Current City: from San Angelo to Houston\n- Transportation: Self-driving, Duration: 5 hours 46 mins, Distance: 586 km, Cost: $29 per person\n- Breakfast: -\n- Attraction: -\n- Lunch: -\n- Dinner: Jalapenos, Houston, Average Cost: $57, Cuisines: Desserts, Tea, Cafe, Chinese, Seafood\n- Accommodation: Superhost 3 bedroom DISCOUNT, Houston, Price: $746, Room type: Entire home/apt, House rules: No pets, Minimum nights: 1, Maximum occupancy: 5\n\n**Day 6: March 23, 2022 - Houston**\n- Current City: Houston\n- Transportation: -\n- Breakfast: Super Bakery, Houston, Average Cost: $30, Cuisines: Seafood, Fast Food\n- Attraction: Space Center Houston, Houston Museum of Natural Science\n- Lunch: Matchbox, Houston, Average Cost: $33, Cuisines: Tea, Italian, Bakery, Fast Food, Seafood\n- Dinner: The BrewMaster - The Mix Fine Dine, Houston, Average Cost: $52, Cuisines: French, Indian, Cafe, Seafood\n- Accommodation: Superhost 3 bedroom DISCOUNT, Houston (continuing stay)\n\n**Day 7: March 24, 2022 - Houston to Lexington**\n- Current City: from Houston to Lexington\n- Transportation: Self-driving, Duration: 14 hours 57 mins, Distance: 1,592 km, Cost: $79 per person\n- Breakfast: -\n- Attraction: -\n- Lunch: -\n- Dinner: -\n- Accommodation: -\n\n**Total Cost Calculation:**\n- Flights: 4 people x ($222 + $54) = $1,104\n- Accommodations: 6 nights (prices vary, but under the assumption that an additional room is booked at the same rate for children)\n- Meals and Attractions: Estimated based on average costs provided\n- Transportation: Flight and self-driving costs included\n\nThe total cost will be calculated to ensure it does not exceed the budget of $16,800. Please note that the actual total cost will depend on the exact prices at the time of booking and the availability of accommodations that meet the specified constraints. Additional accommodations for children under 10 have been considered in the plan.", "gpt-4-1106-preview_direct_sole-planning_parsed_results": [{"day": 1, "current_city": "from Lexington to Dallas", "transportation": "Flight Number: F3600281, from Lexington to Dallas, Departure Time: 05:53, Arrival Time: 07:27", "breakfast": "-", "attraction": "-", "lunch": "-", "dinner": "1918 Bistro & Grill, Dallas", "accommodation": "Luxury Williamsburg duplex, private roof terrace, Dallas"}, {"day": 2, "current_city": "Dallas", "transportation": "-", "breakfast": "Coconuts Fish Cafe, Dallas", "attraction": "The Dallas World Aquarium, Dallas;The Sixth Floor Museum at Dealey Plaza, Dallas;", "lunch": "Kebab Xpress, Dallas", "dinner": "L'Opera, Dallas", "accommodation": "Luxury Williamsburg duplex, private roof terrace, Dallas"}, {"day": 3, "current_city": "from Dallas to San Angelo", "transportation": "Flight Number: F3608910, from Dallas to San Angelo, Departure Time: 12:39, Arrival Time: 13:40", "breakfast": "Cafe Gatherings, Dallas", "attraction": "-", "lunch": "-", "dinner": "DePalma's Italian Cafe - Downtown, San Angelo", "accommodation": "Beautiful Brooklyn Vacation Home!, San Angelo"}, {"day": 4, "current_city": "San Angelo", "transportation": "-", "breakfast": "Break Fast Point, San Angelo", "attraction": "San Angelo Museum of Fine Arts, San Angelo;Fort Concho National Historic Landmark, San Angelo;", "lunch": "Kolkata Hot Kathi Roll, San Angelo", "dinner": "Laxmi Ice Cream, San Angelo", "accommodation": "Beautiful Brooklyn Vacation Home!, San Angelo"}, {"day": 5, "current_city": "from San Angelo to Houston", "transportation": "Self-driving, from San Angelo to Houston", "breakfast": "-", "attraction": "-", "lunch": "-", "dinner": "Jalapenos, Houston", "accommodation": "Superhost 3 bedroom DISCOUNT, Houston"}, {"day": 6, "current_city": "Houston", "transportation": "-", "breakfast": "Super Bakery, Houston", "attraction": "Space Center Houston, Houston;Houston Museum of Natural Science, Houston;", "lunch": "Matchbox, Houston", "dinner": "The BrewMaster - The Mix Fine Dine, Houston", "accommodation": "Superhost 3 bedroom DISCOUNT, Houston"}, {"day": 7, "current_city": "from Houston to Lexington", "transportation": "Self-driving, from Houston to Lexington", "breakfast": "-", "attraction": "-", "lunch": "-", "dinner": "-", "accommodation": "-"}]}]