[{"gpt-4-1106-preview_direct_sole-planning_results": "Based on the provided information and constraints, here is a travel plan for a party of 8 departing from Fayetteville and heading to New York, covering 2 cities (Fayetteville, White Plains, and New York) over 5 days, from March 25th to March 29th, 2022, with a focus on American and Mexican cuisines:\n\n**Day 1: Fayetteville to White Plains (March 25, 2022)**\n- Transportation: Self-driving from Fayetteville to White Plains, duration: 8 hours 46 mins, distance: 923 km, cost: $46 x 8 = $368\n- Breakfast: -\n- Attraction: -\n- Lunch: -\n- Dinner: El Kiosco Mexican Restaurant, White Plains, cost: $65 x 8 = $520, cuisines: Tea, Pizza\n- Accommodation: Large Opulent Studio Apartment Near Prospect Park, White Plains, cost: $465 x 2 = $930, room type: Entire home/apt, house rules: No children under 10, minimum nights: 4, maximum occupancy: 3\n\n**Day 2: White Plains (March 26, 2022)**\n- Transportation: -\n- Breakfast: Kinoshita, White Plains, cost: $42 x 8 = $336, cuisines: Tea, Pizza, Fast Food, American, Seafood\n- Attraction: LEGOLAND Discovery Center Westchester, White Plains\n- Lunch: Hangover, White Plains, cost: $88 x 8 = $704, cuisines: Cafe, Pizza, Fast Food\n- Dinner: Mughals Rasoi, White Plains, cost: $92 x 8 = $736, cuisines: Tea, Pizza, Fast Food, Cafe, Mediterranean\n- Accommodation: Large Opulent Studio Apartment Near Prospect Park, White Plains (continued from Day 1)\n\n**Day 3: White Plains (March 27, 2022)**\n- Transportation: -\n- Breakfast: Le Marche Sugar & Spice Cafe, White Plains, cost: $30 x 8 = $240, cuisines: Indian, Desserts, Seafood\n- Attraction: Saxon Woods Park, White Plains\n- Lunch: Sadhana Restaurant, White Plains, cost: $84 x 8 = $672, cuisines: Desserts, Tea, Italian, French, Seafood\n- Dinner: Pan Asian - Sheraton New Delhi Hotel, White Plains, cost: $72 x 8 = $576, cuisines: Mexican, Bakery, Mediterranean, Desserts\n- Accommodation: Large Opulent Studio Apartment Near Prospect Park, White Plains (continued from Day 1)\n\n**Day 4: White Plains to New York (March 28, 2022)**\n- Transportation: Self-driving from White Plains to New York, duration: 54 mins, distance: 57.3 km, cost: $2 x 8 = $16\n- Breakfast: -\n- Attraction: Central Park, New York\n- Lunch: Seasons 52 Fresh Grill, New York, cost: $30 x 8 = $240, cuisines: Seafood, Indian, Desserts, Italian\n- Dinner: G Dot, New York, cost: $75 x 8 = $600, cuisines: Cafe, Mexican, BBQ\n- Accommodation: Beautiful and big 1BR sublet close by Central Park, New York, cost: $983 x 4 = $3,932, room type: Private room, house rules: No parties & No children under 10, minimum nights: 5, maximum occupancy: 2\n\n**Day 5: New York to Fayetteville (March 29, 2022)**\n- Transportation: Flight F4058074 from New York to Fayetteville, cost: $450 x 8 = $3,600, departure: 20:10, arrival: 22:43\n- Breakfast: -\n- Attraction: -\n- Lunch: -\n- Dinner: -\n- Accommodation: -\n\n**Total Cost Calculation:**\n- Transportation: $368 (Day 1 self-driving) + $16 (Day 4 self-driving) + $3,600 (Day 5 flight) = $3,984\n- Meals: $520 (Day 1 dinner) + $336 (Day 2 breakfast) + $704 (Day 2 lunch) + $736 (Day 2 dinner) + $240 (Day 3 breakfast) + $672 (Day 3 lunch) + $576 (Day 3 dinner) + $240 (Day 4 lunch) + $600 (Day 4 dinner) = $4,624\n- Accommodation: $930 (Day 1) + $0 (Day 2, continued) + $0 (Day 3, continued) + $3,932 (Day 4) = $4,862\n- Total cost: $3,984 (transportation) + $4,624 (meals) + $4,862 (accommodation) = $13,470\n\n**Note:** The total cost exceeds the specified budget of $6,900. Adjustments are required to meet the budget constraint. This could involve choosing more affordable restaurants, reducing accommodation costs, or altering transportation methods. However, due to the lack of detailed pricing and availability information, precise adjustments cannot be made within this response. Please consider this plan as a draft and make necessary changes to fit the budget.", "gpt-4-1106-preview_direct_sole-planning_parsed_results": [{"day": 1, "current_city": "from Fayetteville to White Plains", "transportation": "Self-driving from Fayetteville to White Plains, Duration: 8 hours 46 mins, Distance: 923 km", "breakfast": "-", "attraction": "-", "lunch": "-", "dinner": "El Kiosco Mexican Restaurant, White Plains", "accommodation": "Large Opulent Studio Apartment Near Prospect Park, White Plains"}, {"day": 2, "current_city": "White Plains", "transportation": "-", "breakfast": "Kinoshita, White Plains", "attraction": "LEGOLAND Discovery Center Westchester, White Plains", "lunch": "Hangover, White Plains", "dinner": "Mughals Rasoi, White Plains", "accommodation": "Large Opulent Studio Apartment Near Prospect Park, White Plains"}, {"day": 3, "current_city": "White Plains", "transportation": "-", "breakfast": "Le Marche Sugar & Spice Cafe, White Plains", "attraction": "Saxon Woods Park, White Plains", "lunch": "Sadhana Restaurant, White Plains", "dinner": "Pan Asian - Sheraton New Delhi Hotel, White Plains", "accommodation": "Large Opulent Studio Apartment Near Prospect Park, White Plains"}, {"day": 4, "current_city": "from White Plains to New York", "transportation": "Self-driving from White Plains to New York, Duration: 54 mins, Distance: 57.3 km", "breakfast": "-", "attraction": "Central Park, New York", "lunch": "Seasons 52 Fresh Grill, New York", "dinner": "G Dot, New York", "accommodation": "Beautiful and big 1BR sublet close by Central Park, New York"}, {"day": 5, "current_city": "from New York to Fayetteville", "transportation": "Flight Number: F4058074, from New York to Fayetteville, Departure Time: 20:10, Arrival Time: 22:43", "breakfast": "-", "attraction": "-", "lunch": "-", "dinner": "-", "accommodation": "-"}]}]