[{"gpt-4-1106-preview_direct_sole-planning_results": "Based on the provided information and constraints, here is a travel plan for a trip from Atlanta to Knoxville, spanning 3 days from March 29th to March 31st, 2022, with a budget of $1,000 and accommodations suitable for children under the age of 10. Self-driving is not an option per the query.\n\n***** Travel Plan *****\n\nDay 1: March 29th, Atlanta to Knoxville\n- Transportation: Flight F3645549, from Atlanta to Knoxville, cost: $35, departure: 08:13, arrival: 09:00\n- Breakfast: -\n- Attraction: World's Fair Park, Knoxville\n- Lunch: Cafe Arabelle, Knoxville, cost: $29, cuisines: French, BBQ, Desserts, Seafood\n- Dinner: Les 3 Brasseurs, Knoxville, cost: $24, cuisines: Desserts, Pizza, Italian, Cafe, Indian\n- Accommodation: Light-filled Room in Renovated Apt, Knoxville, cost: $310, room type: Private room, house rules: No pets, minimum nights: 2, maximum occupancy: 2\n\nNumber of people: Assuming 2 (1 adult and 1 child under 10)\nTotal cost for Day 1: 2 x $35 (Flight) + 2 x $29 (Lunch) + 2 x $24 (Dinner) + $310 (Accommodation) = $486\n\nDay 2: March 30th, Knoxville\n- Transportation: -\n- Breakfast: Cafe Coffee Day, Knoxville, cost: $82, cuisines: Fast Food, American, BBQ, Italian\n- Attraction: Knoxville Zoo, Knoxville\n- Lunch: Mamagoto, Knoxville, cost: $14, cuisines: Indian, Mediterranean, Desserts, Seafood\n- Dinner: Punjabi Flavour, Knoxville, cost: $41, cuisines: Tea, Bakery, Cafe, Indian, Seafood\n- Accommodation: Light-filled Room in Renovated Apt, Knoxville (continued from Day 1)\n\nNumber of people: Assuming 2 (1 adult and 1 child under 10)\nTotal cost for Day 2: 2 x $82 (Breakfast) + 2 x $14 (Lunch) + 2 x $41 (Dinner) = $274\n\nDay 3: March 31st, Knoxville to Atlanta\n- Transportation: Flight F3517130, from Knoxville to Atlanta, cost: $30, departure: 05:32, arrival: 06:28\n- Breakfast: -\n- Attraction: -\n- Lunch: -\n- Dinner: -\n- Accommodation: -\n\nNumber of people: Assuming 2 (1 adult and 1 child under 10)\nTotal cost for Day 3: 2 x $30 (Flight) = $60\n\nTotal cost across all days: $486 (Day 1) + $274 (Day 2) + $60 (Day 3) = $820\n\nRemaining budget: $1,000 - $820 = $180\n\nCuisines: All cuisine constraints are satisfied as per the restaurants chosen.\nAccommodations: The chosen accommodation is suitable for children under 10 and adheres to the private room constraint.\n\n***** End of Travel Plan *****\n\nPlease note that the costs are estimated based on the provided information and the number of travelers is assumed to be 2 (1 adult and 1 child under 10) to fit the accommodation constraints. The actual number of travelers was not specified in the query. The remaining budget can be used for additional meals, attractions, or saved.", "gpt-4-1106-preview_direct_sole-planning_parsed_results": [{"day": 1, "current_city": "from Atlanta to Knoxville", "transportation": "Flight Number: F3645549, from Atlanta to Knoxville, Departure Time: 08:13, Arrival Time: 09:00", "breakfast": "-", "attraction": "World's Fair Park, Knoxville;", "lunch": "Cafe Arabelle, Knoxville", "dinner": "Les 3 Brasseurs, Knoxville", "accommodation": "Light-filled Room in Renovated Apt, Knoxville"}, {"day": 2, "current_city": "Knoxville", "transportation": "-", "breakfast": "Cafe Coffee Day, Knoxville", "attraction": "Knoxville Zoo, Knoxville;", "lunch": "Mamagoto, Knoxville", "dinner": "Punjabi Flavour, Knoxville", "accommodation": "Light-filled Room in Renovated Apt, Knoxville"}, {"day": 3, "current_city": "from Knoxville to Atlanta", "transportation": "Flight Number: F3517130, from Knoxville to Atlanta, Departure Time: 05:32, Arrival Time: 06:28", "breakfast": "-", "attraction": "-", "lunch": "-", "dinner": "-", "accommodation": "-"}]}]