[{"gpt-4-1106-preview_direct_sole-planning_results": "Travel Plan for Two People from Las Vegas to Idaho (3 Cities: Twin Falls, Pocatello, Boise)\n\n**Day 1: March 4, 2022 - Las Vegas to Twin Falls**\n- Transportation: Self-driving from Las Vegas to Twin Falls, duration: 7 hours 32 mins, distance: 796 km, cost: $39 x 2 = $78\n- Breakfast: -\n- Attraction: -\n- Lunch: -\n- Dinner: Thai Paradise, Twin Falls, cost: $87 x 2 = $174, cuisines: Fast Food, Indian, Desserts, Seafood\n- Accommodation: Charming studio, great location!!!, Twin Falls, cost: $994 x 1 = $994, room type: Entire home/apt, house rules: No smoking & No pets\n\n**Day 2: March 5, 2022 - Twin Falls**\n- Transportation: -\n- Breakfast: Kaushik Bakery, Twin Falls, cost: $29 x 2 = $58, cuisines: Cafe, Pizza, Italian\n- Attraction: Shoshone Falls Park, Twin Falls\n- Lunch: Asia Kitchen, Twin Falls, cost: $67 x 2 = $134, cuisines: Tea, Cafe, BBQ, Desserts\n- Dinner: Food Fever, Twin Falls, cost: $83 x 2 = $166, cuisines: Fast Food, Chinese, BBQ, Seafood\n- Accommodation: Charming studio, great location!!!, Twin Falls, cost: $994 x 1 = $994, room type: Entire home/apt, house rules: No smoking & No pets\n\n**Day 3: March 6, 2022 - Twin Falls to Pocatello**\n- Transportation: Self-driving from Twin Falls to Pocatello, duration: 1 hour 46 mins, distance: 183 km, cost: $9 x 2 = $18\n- Breakfast: Subway, Twin Falls, cost: $77 x 2 = $154, cuisines: French, BBQ, Chinese, Seafood\n- Attraction: Idaho Museum of Natural History, Pocatello\n- Lunch: Harvest Moon, Pocatello, cost: $90 x 2 = $180, cuisines: Pizza, Fast Food\n- Dinner: Deorio's, Pocatello, cost: $59 x 2 = $118, cuisines: Tea, Bakery, Fast Food, Mediterranean, Seafood\n- Accommodation: 2 bedroom family luxury modern, Pocatello, cost: $333 x 1 = $333, room type: Entire home/apt, house rules: No children under 10 & No pets\n\n**Day 4: March 7, 2022 - Pocatello**\n- Transportation: -\n- Breakfast: Oriental Kitchen Express, Pocatello, cost: $36 x 2 = $72, cuisines: Cafe, Bakery, Desserts\n- Attraction: Zoo Idaho, Pocatello\n- Lunch: Ghar Ki Handi, Pocatello, cost: $13 x 2 = $26, cuisines: Cafe, Bakery, American, Fast Food\n- Dinner: 650 - The Global Kitchen, Pocatello, cost: $83 x 2 = $166, cuisines: French, Bakery, Cafe\n- Accommodation: 2 bedroom family luxury modern, Pocatello, cost: $333 x 1 = $333, room type: Entire home/apt, house rules: No children under 10 & No pets\n\n**Day 5: March 8, 2022 - Pocatello to Boise**\n- Transportation: Self-driving from Pocatello to Boise, duration: 3 hours 23 mins, distance: 377 km, cost: $18 x 2 = $36\n- Breakfast: Gola Sizzlers, Pocatello, cost: $34 x 2 = $68, cuisines: Desserts, French, Bakery, Fast Food, Cafe\n- Attraction: Idaho State Museum, Boise\n- Lunch: TGI Friday's, Boise, cost: $33 x 2 = $66, cuisines: Cafe, Mexican, BBQ, Fast Food\n- Dinner: Dhaba By Claridges, Boise, cost: $65 x 2 = $130, cuisines: Desserts, Italian, Fast Food, Chinese, Seafood\n- Accommodation: Modern & Cozy 2 BR Private Apartment in Brooklyn, Boise, cost: $843 x 1 = $843, room type: Entire home/apt, house rules: No children under 10\n\n**Day 6: March 9, 2022 - Boise**\n- Transportation: -\n- Breakfast: Gopala Hari, Boise, cost: $28 x 2 = $56, cuisines: Tea, Pizza, Italian, Fast Food, Mediterranean, Seafood\n- Attraction: Zoo Boise, Boise\n- Lunch: California Pizza Kitchen, Boise, cost: $15 x 2 = $30, cuisines: Tea, BBQ, Fast Food, Chinese, Indian\n- Dinner: The Brewhouse, Boise, cost: $59 x 2 = $118, cuisines: Cafe, Pizza, American, Fast Food\n- Accommodation: Modern & Cozy 2 BR Private Apartment in Brooklyn, Boise, cost: $843 x 1 = $843, room type: Entire home/apt, house rules: No children under 10\n\n**Day 7: March 10, 2022 - Boise to Las Vegas**\n- Transportation: Self-driving from Boise to Las Vegas, duration: 9 hours 30 mins, distance: 1,004 km, cost: $50 x 2 = $100\n- Breakfast: -\n- Attraction: -\n- Lunch: -\n- Dinner: -\n- Accommodation: -\n\n**Total Costs:**\n- Transportation: $78 + $18 + $36 + $100 = $232\n- Meals: $174 + $58 + $134 + $166 + $154 + $180 + $118 + $72 + $26 + $166 + $68 + $66 + $130 + $56 + $30 + $118 = $1,716\n- Accommodations: $994 + $994 + $333 + $333 + $843 + $843 = $4,340\n- Attractions: No entry fees specified, assumed to be free\n\n**Grand Total: $232 (Transportation) + $1,716 (Meals) + $4,340 (Accommodations) = $6,288**\n\nUnfortunately, the total cost of $6,288 exceeds the budget of $5,100. To stay within budget, consider adjusting the accommodations to less expensive options or reducing meal costs.", "gpt-4-1106-preview_direct_sole-planning_parsed_results": [{"day": 1, "current_city": "from Las Vegas to Twin Falls", "transportation": "Self-driving from Las Vegas to Twin Falls, duration: 7 hours 32 mins, distance: 796 km", "breakfast": "-", "attraction": "-", "lunch": "-", "dinner": "Thai Paradise, Twin Falls", "accommodation": "Charming studio, great location!!!, Twin Falls"}, {"day": 2, "current_city": "Twin Falls", "transportation": "-", "breakfast": "Kaushik Bakery, Twin Falls", "attraction": "Shoshone Falls Park, Twin Falls", "lunch": "Asia Kitchen, Twin Falls", "dinner": "Food Fever, Twin Falls", "accommodation": "Charming studio, great location!!!, Twin Falls"}, {"day": 3, "current_city": "from Twin Falls to Pocatello", "transportation": "Self-driving from Twin Falls to Pocatello, duration: 1 hour 46 mins, distance: 183 km", "breakfast": "Subway, Twin Falls", "attraction": "Idaho Museum of Natural History, Pocatello", "lunch": "Harvest Moon, Pocatello", "dinner": "Deorio's, Pocatello", "accommodation": "2 bedroom family luxury modern, Pocatello"}, {"day": 4, "current_city": "Pocatello", "transportation": "-", "breakfast": "Oriental Kitchen Express, Pocatello", "attraction": "Zoo Idaho, Pocatello", "lunch": "Ghar Ki Handi, Pocatello", "dinner": "650 - The Global Kitchen, Pocatello", "accommodation": "2 bedroom family luxury modern, Pocatello"}, {"day": 5, "current_city": "from Pocatello to Boise", "transportation": "Self-driving from Pocatello to Boise, duration: 3 hours 23 mins, distance: 377 km", "breakfast": "Gola Sizzlers, Pocatello", "attraction": "Idaho State Museum, Boise", "lunch": "TGI Friday's, Boise", "dinner": "Dhaba By Claridges, Boise", "accommodation": "Modern & Cozy 2 BR Private Apartment in Brooklyn, Boise"}, {"day": 6, "current_city": "Boise", "transportation": "-", "breakfast": "Gopala Hari, Boise", "attraction": "Zoo Boise, Boise", "lunch": "California Pizza Kitchen, Boise", "dinner": "The Brewhouse, Boise", "accommodation": "Modern & Cozy 2 BR Private Apartment in Brooklyn, Boise"}, {"day": 7, "current_city": "from Boise to Las Vegas", "transportation": "Self-driving from Boise to Las Vegas, duration: 9 hours 30 mins, distance: 1,004 km", "breakfast": "-", "attraction": "-", "lunch": "-", "dinner": "-", "accommodation": "-"}]}]