[{"gpt-4-1106-preview_direct_sole-planning_results": "Based on the provided information and constraints, here is a 5-day travel plan for a group of 4, starting from Evansville and visiting Texarkana and Longview in Texas. The trip spans from March 12th to March 16th, 2022, with a budget of $9,500. The accommodations require entire rooms with no restrictions on parties, and the plan avoids airline transportation.\n\n***** Travel Plan *****\n\nDay 1: March 12th, Evansville to Texarkana\n- Transportation: Self-driving from Evansville to Texarkana, duration: 8 hours 45 mins, distance: 889 km, cost: $44 x 4 = $176\n- Breakfast: -\n- Attraction: -\n- Lunch: -\n- Dinner: Big City Bread Cafe, Texarkana, cost: $61 x 4 = $244, cuisines: Cafe, Pizza, Bakery, BBQ\n- Accommodation: Large 2.5 BR Apt In Park Slope, Texarkana, cost: $269 x 1 = $269, entire home/apt, no restrictions on parties, minimum nights: 1, maximum occupancy: 3\n\nNumber of people: 4\nTotal cost for Day 1: $176 + $244 + $269 = $689\n\nDay 2: March 13th, Texarkana\n- Transportation: -\n- Breakfast: Columbia Restaurant, Texarkana, cost: $91 x 4 = $364, cuisines: Desserts, Tea, Pizza, Indian, Seafood\n- Attraction: Museum of Regional History, Texarkana; Ace of Clubs House, Texarkana\n- Lunch: The Beer Cafe - BIGGIE, Texarkana, cost: $13 x 4 = $52, cuisines: Cafe, Pizza, Mediterranean, Fast Food\n- Dinner: Poets Cafe, Texarkana, cost: $88 x 4 = $352, cuisines: Chinese, Bakery, Indian, Desserts\n- Accommodation: Large 2.5 BR Apt In Park Slope, Texarkana, cost: $269 x 1 = $269, entire home/apt, no restrictions on parties, minimum nights: 1, maximum occupancy: 3\n\nNumber of people: 4\nTotal cost for Day 2: $364 + $52 + $352 + $269 = $1,037\n\nDay 3: March 14th, Texarkana to Longview\n- Transportation: Self-driving from Texarkana to Longview, duration: 1 hour 36 mins, distance: 142 km, cost: $7 x 4 = $28\n- Breakfast: Granma's Homemade, Texarkana, cost: $57 x 4 = $228, cuisines: Tea, Mexican, Bakery, Cafe, Seafood\n- Attraction: Longview World of Wonders, Longview; Gregg County Historical Museum, Longview\n- Lunch: Apna Restaurant, Longview, cost: $17 x 4 = $68, cuisines: American, BBQ, Fast Food\n- Dinner: Monster's Cafe, Longview, cost: $94 x 4 = $376, cuisines: Tea, Bakery, Fast Food, Cafe, American, Mediterranean\n- Accommodation: GREAT sunny 1 bedroom, Longview, cost: $1122 x 1 = $1122, entire home/apt, no restrictions on parties, minimum nights: 1, maximum occupancy: 9\n\nNumber of people: 4\nTotal cost for Day 3: $28 + $228 + $68 + $376 + $1122 = $1,822\n\nDay 4: March 15th, Longview\n- Transportation: -\n- Breakfast: Barbeque Nation, Longview, cost: $26 x 4 = $104, cuisines: Cafe, Bakery\n- Attraction: Longview Museum of Fine Arts, Longview; Lear Park, Longview\n- Lunch: Apni Rasoi, Longview, cost: $25 x 4 = $100, cuisines: Desserts, Tea, Pizza, Italian, Seafood\n- Dinner: Bikaner Sweets & Restaurant, Longview, cost: $98 x 4 = $392, cuisines: Tea, Seafood\n- Accommodation: GREAT sunny 1 bedroom, Longview, cost: $1122 x 1 = $1122, entire home/apt, no restrictions on parties, minimum nights: 1, maximum occupancy: 9\n\nNumber of people: 4\nTotal cost for Day 4: $104 + $100 + $392 + $1122 = $1,718\n\nDay 5: March 16th, Longview to Evansville\n- Transportation: Self-driving from Longview to Evansville, duration: 10 hours 8 mins, distance: 1,045 km, cost: $52 x 4 = $208\n- Breakfast: Sham Sweets, Longview, cost: $69 x 4 = $276, cuisines: Cafe, Bakery, BBQ, Fast Food, Chinese\n- Attraction: -\n- Lunch: -\n- Dinner: -\n- Accommodation: -\n\nNumber of people: 4\nTotal cost for Day 5: $208 + $276 = $484\n\nTotal cost across all days: $689 + $1,037 + $1,822 + $1,718 + $484 = $5,750\n\nRemaining budget: $9,500 - $5,750 = $3,750\n\nCuisines: The prompt specifies no cuisines, so all cuisine constraints are satisfied.\n\n***** End of Travel Plan *****\n\nPlease note that the accommodation on Day 1 and Day 2 is the same and has a maximum occupancy of 3, which does not meet the requirement for 4 people. However, there were no other accommodations listed that allowed parties and had a higher occupancy. Adjustments may be needed based on actual availability and group preferences.", "gpt-4-1106-preview_direct_sole-planning_parsed_results": [{"day": 1, "current_city": "from Evansville to Texarkana", "transportation": "Self-driving from Evansville to Texarkana, Duration: 8 hours 45 mins, Distance: 889 km", "breakfast": "-", "attraction": "-", "lunch": "-", "dinner": "Big City Bread Cafe, Texarkana", "accommodation": "Large 2.5 BR Apt In Park Slope, Texarkana"}, {"day": 2, "current_city": "Texarkana", "transportation": "-", "breakfast": "Columbia Restaurant, Texarkana", "attraction": "Museum of Regional History, Texarkana;Ace of Clubs House, Texarkana;", "lunch": "The Beer Cafe - BIGGIE, Texarkana", "dinner": "Poets Cafe, Texarkana", "accommodation": "Large 2.5 BR Apt In Park Slope, Texarkana"}, {"day": 3, "current_city": "from Texarkana to Longview", "transportation": "Self-driving from Texarkana to Longview, Duration: 1 hour 36 mins, Distance: 142 km", "breakfast": "Granma's Homemade, Texarkana", "attraction": "Longview World of Wonders, Longview;Gregg County Historical Museum, Longview;", "lunch": "Apna Restaurant, Longview", "dinner": "Monster's Cafe, Longview", "accommodation": "GREAT sunny 1 bedroom, Longview"}, {"day": 4, "current_city": "Longview", "transportation": "-", "breakfast": "Barbeque Nation, Longview", "attraction": "Longview Museum of Fine Arts, Longview;Lear Park, Longview;", "lunch": "Apni Rasoi, Longview", "dinner": "Bikaner Sweets & Restaurant, Longview", "accommodation": "GREAT sunny 1 bedroom, Longview"}, {"day": 5, "current_city": "from Longview to Evansville", "transportation": "Self-driving from Longview to Evansville, Duration: 10 hours 8 mins, Distance: 1,045 km", "breakfast": "Sham Sweets, Longview", "attraction": "-", "lunch": "-", "dinner": "-", "accommodation": "-"}]}]