[{"gpt-4-1106-preview_direct_sole-planning_results": "Based on the provided information and constraints, here is a 5-day travel itinerary for a group of 4, starting in Bloomington and visiting two cities in Florida, Orlando and Miami, from March 13th to March 17th, 2022, with a budget of $15,900 and pet-friendly accommodations.\n\n**Day 1: Bloomington to Orlando**\n- Current City: from Bloomington to Orlando\n- Transportation: Flight F3563219, from Bloomington to Orlando, Price: $302, DepTime: 15:35, ArrTime: 19:17, Duration: 2 hours 42 minutes, Distance: 936 km\n- Breakfast: -\n- Attraction: -\n- Lunch: -\n- Dinner: Fuji Japanese Steakhouse, Orlando, Average Cost: $75, Cuisines: Tea, Bakery, Desserts\n- Accommodation: Sixth Ave Chelsea, Studio Serviced Apartment, Orlando, Price: $70, Room Type: Entire home/apt, House Rules: No visitors & No pets, Minimum Nights: 30, Maximum Occupancy: 3, Review Rate Number: 2.0\n\nNumber of people: 4\nTotal cost: 4 x $302 (Flight) + 4 x $75 (Dinner) + $70 (Accommodation) = $1,678\nAccommodation minimum nights: 1/30\n\n**Day 2: Orlando**\n- Current City: Orlando\n- Transportation: -\n- Breakfast: Crust N Cakes, Orlando, Cost: $61, Cuisines: Tea, Cafe, Indian, BBQ\n- Attraction: SeaWorld Orlando; The Wheel at ICON Park\n- Lunch: Turquoise Villa, Orlando, Cost: $55, Cuisines: French, Bakery, BBQ, Fast Food\n- Dinner: The Tandoori Times, Orlando, Cost: $84, Cuisines: Tea, Cafe, BBQ, Italian\n- Accommodation: Sixth Ave Chelsea, Studio Serviced Apartment, Orlando, Price: $70, Room Type: Entire home/apt, House Rules: No visitors & No pets, Minimum Nights: 30, Maximum Occupancy: 3, Review Rate Number: 2.0\n\nNumber of people: 4\nTotal cost: 4 x $61 (Breakfast) + 4 x $55 (Lunch) + 4 x $84 (Dinner) + $70 (Accommodation) = $1,114\nAccommodation minimum nights: 2/30\n\n**Day 3: Orlando to Miami**\n- Current City: from Orlando to Miami\n- Transportation: Flight F3679562, from Orlando to Miami, Price: $65, DepTime: 06:05, ArrTime: 07:03, Duration: 0 hours 58 minutes, Distance: 192 km\n- Breakfast: -\n- Attraction: Jungle Island; P\u00e9rez Art Museum Miami\n- Lunch: Clocked, Miami, Average Cost: $49, Cuisines: Tea, Italian, Mexican, BBQ, Cafe\n- Dinner: Shorts Burger and Shine, Miami, Average Cost: $81, Cuisines: Chinese, Cafe, Seafood\n- Accommodation: Cozy Two-bedroom Apt in a Cute House in Brooklyn!, Miami, Price: $99, Room Type: Private room, House Rules: No children under 10, Minimum Nights: 4, Maximum Occupancy: 1, Review Rate Number: 4.0\n\nNumber of people: 4\nTotal cost: 4 x $65 (Flight) + 4 x $49 (Lunch) + 4 x $81 (Dinner) + 2 x $99 (Accommodation, need 2 apartments due to occupancy limit) = $1,012\nAccommodation minimum nights: 1/4\n\n**Day 4: Miami**\n- Current City: Miami\n- Transportation: -\n- Breakfast: Papouli's Mediterranean Cafe & Market, Miami, Cost: $26, Cuisines: Tea, Desserts\n- Attraction: Bayfront Park; Wynwood Walls\n- Lunch: Tako Cheena by Pom Pom, Miami, Cost: $60, Cuisines: Fast Food, Indian, Desserts, Italian\n- Dinner: AB's Absolute Barbecues, Miami, Cost: $55, Cuisines: Desserts, Tea, Pizza, Italian, Fast Food, American\n- Accommodation: Cozy Two-bedroom Apt in a Cute House in Brooklyn!, Miami, Price: $99, Room Type: Private room, House Rules: No children under 10, Minimum Nights: 4, Maximum Occupancy: 1, Review Rate Number: 4.0\n\nNumber of people: 4\nTotal cost: 4 x $26 (Breakfast) + 4 x $60 (Lunch) + 4 x $55 (Dinner) + 2 x $99 (Accommodation) = $1,004\nAccommodation minimum nights: 2/4\n\n**Day 5: Miami to Bloomington**\n- Current City: from Miami to Bloomington\n- Transportation: Self-driving from Miami to Bloomington, duration: 17 hours 1 min, distance: 1,897 km, cost: $94\n- Breakfast: -\n- Attraction: -\n- Lunch: -\n- Dinner: -\n- Accommodation: -\n\nNumber of people: 4\nTotal cost: 4 x $94 (Self-driving) = $376\n\n**Total cost across all days**: $1,678 (Day 1) + $1,114 (Day 2) + $1,012 (Day 3) + $1,004 (Day 4) + $376 (Day 5) = $5,184\n\nRemaining budget: $15,900 - $5,184 = $10,716\n\nCuisines: The prompt specifies no cuisines, so all cuisine constraints are satisfied.\n\nNote: The accommodation on Day 1 and Day 2 in Orlando does not meet the pet-friendly requirement. However, no pet-friendly options were provided in the data. Therefore, this plan assumes an exception to the pet-friendly requirement or that the travelers will make separate arrangements for their pets. Additionally, the accommodation on Day 3 and Day 4 in Miami exceeds the maximum occupancy, so two apartments are booked to accommodate all travelers. The budget is well within the limit, and the itinerary includes all required details for each day.", "gpt-4-1106-preview_direct_sole-planning_parsed_results": [{"day": 1, "current_city": "from Bloomington to Orlando", "transportation": "Flight Number: F3563219, from Bloomington to Orlando, Departure Time: 15:35, Arrival Time: 19:17", "breakfast": "-", "attraction": "-", "lunch": "-", "dinner": "Fuji Japanese Steakhouse, Orlando", "accommodation": "Sixth Ave Chelsea, Studio Serviced Apartment, Orlando"}, {"day": 2, "current_city": "Orlando", "transportation": "-", "breakfast": "Crust N Cakes, Orlando", "attraction": "SeaWorld Orlando, Orlando;The Wheel at ICON Park, Orlando;", "lunch": "Turquoise Villa, Orlando", "dinner": "The Tandoori Times, Orlando", "accommodation": "Sixth Ave Chelsea, Studio Serviced Apartment, Orlando"}, {"day": 3, "current_city": "from Orlando to Miami", "transportation": "Flight Number: F3679562, from Orlando to Miami, Departure Time: 06:05, Arrival Time: 07:03", "breakfast": "-", "attraction": "Jungle Island, Miami;P\u00e9rez Art Museum Miami, Miami;", "lunch": "Clocked, Miami", "dinner": "Shorts Burger and Shine, Miami", "accommodation": "Cozy Two-bedroom Apt in a Cute House in Brooklyn!, Miami"}, {"day": 4, "current_city": "Miami", "transportation": "-", "breakfast": "Papouli's Mediterranean Cafe & Market, Miami", "attraction": "Bayfront Park, Miami;Wynwood Walls, Miami;", "lunch": "Tako Cheena by Pom Pom, Miami", "dinner": "AB's Absolute Barbecues, Miami", "accommodation": "Cozy Two-bedroom Apt in a Cute House in Brooklyn!, Miami"}, {"day": 5, "current_city": "from Miami to Bloomington", "transportation": "Self-driving from Miami to Bloomington, duration: 17 hours 1 min, distance: 1,897 km", "breakfast": "-", "attraction": "-", "lunch": "-", "dinner": "-", "accommodation": "-"}]}]