[{"gpt-4-1106-preview_direct_sole-planning_results": "Travel Plan:\n\nDay 1: March 27, 2022 - From Austin to Detroit\n- Current City: from Austin (Texas) to Detroit (Michigan)\n- Transportation: Flight F3537671, from Austin to Detroit, duration: 2 hours 53 minutes, cost: $330 per person\n- Breakfast: -\n- Attraction: -\n- Lunch: -\n- Dinner: Southern Bliss Bakery, Detroit, cost: $28 per person, cuisines: Tea, BBQ, Desserts, Seafood\n- Accommodation: Cozy 1 bedroom in the heart of Fort Greene, Detroit, cost: $751, room type: Entire home/apt, house rules: No pets & No parties, minimum nights: 3\n\nNumber of people: 3\nTotal cost: 3 x $330 + 3 x $28 + $751 = $1,825\nAccommodation minimum nights: 1/3\n\nDay 2: March 28, 2022 - Exploring Detroit\n- Current City: Detroit\n- Transportation: -\n- Breakfast: BMG - All Day Dining, Detroit, cost: $15 per person, cuisines: Desserts, Bakery, BBQ, Indian, Seafood\n- Attraction: Detroit Institute of Arts, Detroit; Detroit Historical Museum, Detroit\n- Lunch: A Dong Restaurant, Detroit, cost: $40 per person, cuisines: Tea, Cafe, Pizza\n- Dinner: Zabardast Indian Kitchen, Detroit, cost: $76 per person, cuisines: Bakery, Desserts, Seafood\n- Accommodation: Cozy 1 bedroom in the heart of Fort Greene, Detroit, cost: $751, room type: Entire home/apt, house rules: No pets & No parties, minimum nights: 3\n\nNumber of people: 3\nTotal cost: 3 x $15 + 3 x $40 + 3 x $76 + $751 = $1,404\nAccommodation minimum nights: 2/3\n\nDay 3: March 29, 2022 - From Detroit to Alpena\n- Current City: from Detroit (Michigan) to Alpena (Michigan)\n- Transportation: Flight F3852119, from Detroit to Alpena, duration: 1 hour 5 minutes, cost: $78 per person\n- Breakfast: Cafe And More, Detroit, cost: $41 per person, cuisines: Tea, Bakery, Italian\n- Attraction: -\n- Lunch: -\n- Dinner: A & A Pagliai's Pizza, Alpena, cost: $72 per person, cuisines: Tea, American, Fast Food\n- Accommodation: Ultimate 50th Floor Downtown Penthouse - 4000SqFt, Alpena, cost: $1043, room type: Entire home/apt, house rules: No smoking & No visitors & No children under 10, minimum nights: 2\n\nNumber of people: 3\nTotal cost: 3 x $78 + 3 x $41 + 3 x $72 + $1043 = $1,596\nAccommodation minimum nights: 1/2\n\nDay 4: March 30, 2022 - Exploring Alpena\n- Current City: Alpena\n- Transportation: -\n- Breakfast: Maplai, Alpena, cost: $63 per person, cuisines: Tea, Indian, Bakery, Fast Food, American\n- Attraction: Great Lakes Maritime Heritage Center, Alpena; Besser Museum for Northeast Michigan, Alpena\n- Lunch: Shudh Restaurant, Alpena, cost: $56 per person, cuisines: Cafe, BBQ, Fast Food\n- Dinner: Young Wild Free Cafe, Alpena, cost: $45 per person, cuisines: Bakery, Mexican, BBQ, Fast Food\n- Accommodation: Ultimate 50th Floor Downtown Penthouse - 4000SqFt, Alpena, cost: $1043, room type: Entire home/apt, house rules: No smoking & No visitors & No children under 10, minimum nights: 2\n\nNumber of people: 3\nTotal cost: 3 x $63 + 3 x $56 + 3 x $45 + $1043 = $1,527\nAccommodation minimum nights: 2/2\n\nDay 5: March 31, 2022 - From Alpena to Austin\n- Current City: from Alpena (Michigan) to Austin (Texas)\n- Transportation: Self-driving from Alpena to Austin, duration: 22 hours 42 mins, distance: 2,467 km, cost: $123 per person\n- Breakfast: -\n- Attraction: -\n- Lunch: -\n- Dinner: -\n- Accommodation: -\n\nNumber of people: 3\nTotal cost: 3 x $123 = $369\n\nTotal cost across all days: $1,825 + $1,404 + $1,596 + $1,527 + $369 = $6,721\n\nUnfortunately, the total cost exceeds the specified budget of $5,900. Adjustments will need to be made to the plan to reduce costs. This could involve selecting a less expensive flight or accommodation, or reducing meal costs. Please advise on which aspects of the plan you would like to adjust.", "gpt-4-1106-preview_direct_sole-planning_parsed_results": [{"day": 1, "current_city": "from Austin to Detroit", "transportation": "Flight Number: F3537671, from Austin to Detroit, Departure Time: -, Arrival Time: -", "breakfast": "-", "attraction": "-", "lunch": "-", "dinner": "Southern Bliss Bakery, Detroit", "accommodation": "Cozy 1 bedroom in the heart of Fort Greene, Detroit"}, {"day": 2, "current_city": "Detroit", "transportation": "-", "breakfast": "BMG - All Day Dining, Detroit", "attraction": "Detroit Institute of Arts, Detroit;Detroit Historical Museum, Detroit;", "lunch": "A Dong Restaurant, Detroit", "dinner": "Zabardast Indian Kitchen, Detroit", "accommodation": "Cozy 1 bedroom in the heart of Fort Greene, Detroit"}, {"day": 3, "current_city": "from Detroit to Alpena", "transportation": "Flight Number: F3852119, from Detroit to Alpena, Departure Time: -, Arrival Time: -", "breakfast": "Cafe And More, Detroit", "attraction": "-", "lunch": "-", "dinner": "A & A Pagliai's Pizza, Alpena", "accommodation": "Ultimate 50th Floor Downtown Penthouse - 4000SqFt, Alpena"}, {"day": 4, "current_city": "Alpena", "transportation": "-", "breakfast": "Maplai, Alpena", "attraction": "Great Lakes Maritime Heritage Center, Alpena;Besser Museum for Northeast Michigan, Alpena;", "lunch": "Shudh Restaurant, Alpena", "dinner": "Young Wild Free Cafe, Alpena", "accommodation": "Ultimate 50th Floor Downtown Penthouse - 4000SqFt, Alpena"}, {"day": 5, "current_city": "from Alpena to Austin", "transportation": "Self-driving from Alpena to Austin, Departure Time: -, Arrival Time: -", "breakfast": "-", "attraction": "-", "lunch": "-", "dinner": "-", "accommodation": "-"}]}]