[{"gpt-4-1106-preview_direct_sole-planning_results": "Based on the provided information and constraints, here is a travel plan for a 3-day trip for a group of 4 from Las Vegas to Santa Maria:\n\n***** Travel Plan *****\n\nDay 1: March 10, 2022\nCurrent City: from Las Vegas (Nevada) to Santa Maria (California)\nTransportation: Self-driving, from Las Vegas to Santa Maria, duration: 6 hours 17 mins, distance: 634 km, cost: $31 per person\nBreakfast: -\nAttraction: -\nLunch: -\nDinner: Pirates of Grill, Santa Maria, cost: $90, cuisines: Bakery, BBQ, Fast Food, American, Mediterranean, Seafood\nAccommodation: Cozy apartment near Central Park, Santa Maria, cost: $738, maximum occupancy: 6, house rules: No pets, minimum nights: 1\n\nNumber of people: 4\nTotal cost: 4 x $31 (Transportation) + 4 x $90 (Dinner) + $738 (Accommodation) = $124 + $360 + $738 = $1,222\nAccommodation minimum nights: 1/1\n\nDay 2: March 11, 2022\nCurrent City: Santa Maria\nTransportation: -\nBreakfast: Indian By Nature, Santa Maria, cost: $45, cuisines: Tea, Pizza, Bakery, BBQ, Mediterranean\nAttraction: Santa Maria Valley Discovery Museum, Santa Maria; Santa Maria Museum of Flight, Santa Maria\nLunch: RiverDine Restaurant & Bar, Santa Maria, cost: $71, cuisines: Chinese, BBQ, Seafood\nDinner: The Drunk House, Santa Maria, cost: $91, cuisines: Desserts, Tea, Bakery, Fast Food, American, Mediterranean\nAccommodation: Cozy apartment near Central Park, Santa Maria, cost: $738, maximum occupancy: 6, house rules: No pets, minimum nights: 1\n\nNumber of people: 4\nTotal cost: 4 x $45 (Breakfast) + 4 x $71 (Lunch) + 4 x $91 (Dinner) + $738 (Accommodation) = $180 + $284 + $364 + $738 = $1,566\nAccommodation minimum nights: 1/1\n\nDay 3: March 12, 2022\nCurrent City: from Santa Maria to Las Vegas\nTransportation: Self-driving from Santa Maria to Las Vegas, duration: 6 hours 19 mins, distance: 636 km, cost: $31 per person\nBreakfast: Calendar Khana Laao, Santa Maria, cost: $91, cuisines: Desserts, Tea, Fast Food, Cafe, Indian\nAttraction: -\nLunch: -\nDinner: -\nAccommodation: -\n\nNumber of people: 4\nTotal cost: 4 x $31 (Transportation) + 4 x $91 (Breakfast) = $124 + $364 = $488\n\nTotal cost across all days: $1,222 (Day 1) + $1,566 (Day 2) + $488 (Day 3) = $3,276\n\nCuisines: Preference for American and Mediterranean cuisines has been met with selected restaurants.\n\n***** Travel Plan Ends *****\n\nPlease note that the costs are estimated based on the provided CSV data, and actual prices may vary. The accommodation has been booked for two nights as per the itinerary, and the transportation method is self-driving, which is consistent across the days. Attractions have been included for Day 2, and the cuisine preferences have been considered in the selection of restaurants. The total cost of the travel plan is within the specified budget of $3,700.", "gpt-4-1106-preview_direct_sole-planning_parsed_results": [{"day": 1, "current_city": "from Las Vegas to Santa Maria", "transportation": "Self-driving, from Las Vegas to Santa Maria, duration: 6 hours 17 mins, distance: 634 km", "breakfast": "-", "attraction": "-", "lunch": "-", "dinner": "Pirates of Grill, Santa Maria", "accommodation": "Cozy apartment near Central Park, Santa Maria"}, {"day": 2, "current_city": "Santa Maria", "transportation": "-", "breakfast": "Indian By Nature, Santa Maria", "attraction": "Santa Maria Valley Discovery Museum, Santa Maria;Santa Maria Museum of Flight, Santa Maria;", "lunch": "RiverDine Restaurant & Bar, Santa Maria", "dinner": "The Drunk House, Santa Maria", "accommodation": "Cozy apartment near Central Park, Santa Maria"}, {"day": 3, "current_city": "from Santa Maria to Las Vegas", "transportation": "Self-driving from Santa Maria to Las Vegas, duration: 6 hours 19 mins, distance: 636 km", "breakfast": "Calendar Khana Laao, Santa Maria", "attraction": "-", "lunch": "-", "dinner": "-", "accommodation": "-"}]}]