[{"gpt-4-1106-preview_direct_sole-planning_results": "Based on the provided information and constraints, here is a 3-day travel itinerary for two people, departing from Newark and visiting Savannah from March 3rd to March 5th, 2022, with a budget of $1,400:\n\n***** Travel Plan *****\n\nDay 1: March 3rd, Newark to Savannah\n- Transportation: Flight F4070527, from Newark to Savannah, cost: $242 per person, total: $484\n- Breakfast: Not applicable (assuming flight is early and breakfast is at home or on the go)\n- Attraction: Forsyth Park, Savannah (free)\n- Lunch: Sr. Sol 1, Savannah, cost: $30 per person, total: $60, cuisines: Tea, French, Mediterranean, Desserts\n- Dinner: Bosphorous Turkish Cuisine, Savannah, cost: $58 per person, total: $116, cuisines: Pizza, Indian, Fast Food\n- Accommodation: Cosy Inwood apartment, Savannah, cost: $413 per night, suitable for children under 10\n\nNumber of people: 2\nTotal cost for Day 1: $484 (flight) + $60 (lunch) + $116 (dinner) + $413 (accommodation) = $1,073\n\nDay 2: March 4th, Savannah\n- Transportation: Not applicable (staying in Savannah)\n- Breakfast: Manohar Dairy And Restaurant, Savannah, cost: $23 per person, total: $46, cuisines: Tea, Indian, Fast Food\n- Attraction 1: Savannah Children's Museum, Savannah (cost may vary, estimated $20 total)\n- Attraction 2: Savannah Historic District (free)\n- Lunch: The Mad Teapot/The Wishing Chair, Savannah, cost: $23 per person, total: $46, cuisines: Mexican, Bakery, Fast Food\n- Dinner: Country's Barbecue, Savannah, cost: $59 per person, total: $118, cuisines: Cafe, Bakery\n- Accommodation: Cosy Inwood apartment, Savannah (already paid for Day 1)\n\nNumber of people: 2\nTotal cost for Day 2: $46 (breakfast) + $20 (attractions) + $46 (lunch) + $118 (dinner) = $230\n\nDay 3: March 5th, Savannah to Newark\n- Transportation: Flight F3903501, from Savannah to Newark, cost: $294 per person, total: $588\n- Breakfast: Brown House Cafe, Savannah, cost: $28 per person, total: $56, cuisines: Tea, Pizza, Mexican, Bakery, American, Seafood\n- Attraction: Not applicable (assuming early departure)\n- Lunch: Not applicable (assuming in-flight or upon arrival)\n- Dinner: Not applicable (assuming arrival in Newark)\n- Accommodation: Not applicable (returning home)\n\nNumber of people: 2\nTotal cost for Day 3: $588 (flight) + $56 (breakfast) = $644\n\nTotal cost across all days: $1,073 (Day 1) + $230 (Day 2) + $644 (Day 3) = $1,947\n\n***** End of Travel Plan *****\n\nNote: The total cost exceeds the specified budget of $1,400. To adjust the plan to fit the budget, consider the following options:\n- Choose a less expensive accommodation option.\n- Opt for more budget-friendly meal options or reduce the number of paid meals by including meals with accommodation if available.\n- Review the attractions to include only free or lower-cost options.\n\nPlease review the travel plan and let me know if you would like to proceed with adjustments to fit within the budget.", "gpt-4-1106-preview_direct_sole-planning_parsed_results": [{"day": 1, "current_city": "from Newark to Savannah", "transportation": "Flight Number: F4070527, from Newark to Savannah, Departure Time: -, Arrival Time: -", "breakfast": "-", "attraction": "Forsyth Park, Savannah;", "lunch": "Sr. Sol 1, Savannah", "dinner": "Bosphorous Turkish Cuisine, Savannah", "accommodation": "Cosy Inwood apartment, Savannah"}, {"day": 2, "current_city": "Savannah", "transportation": "-", "breakfast": "Manohar Dairy And Restaurant, Savannah", "attraction": "Savannah Children's Museum, Savannah;Savannah Historic District, Savannah;", "lunch": "The Mad Teapot/The Wishing Chair, Savannah", "dinner": "Country's Barbecue, Savannah", "accommodation": "Cosy Inwood apartment, Savannah"}, {"day": 3, "current_city": "from Savannah to Newark", "transportation": "Flight Number: F3903501, from Savannah to Newark, Departure Time: -, Arrival Time: -", "breakfast": "Brown House Cafe, Savannah", "attraction": "-", "lunch": "-", "dinner": "-", "accommodation": "-"}]}]