[{"gpt-4-1106-preview_direct_sole-planning_results": "Travel Plan:\n\nDay 1: Albuquerque to Houston (March 8, 2022)\n- Transportation: Self-driving from Albuquerque to Houston, duration: 12 hours 51 mins, distance: 1,422 km, cost: $71 x 2 = $142\n- Breakfast: -\n- Attraction: -\n- Lunch: -\n- Dinner: Jalapenos, Houston, cost: $57 x 2 = $114, cuisines: Desserts, Tea, Cafe, Chinese, Seafood\n- Accommodation: Sunny and Airy near Manhattan, Houston, cost: $499 x 1 = $499, room type: Entire home/apt, house rules: No pets, minimum nights: 2, maximum occupancy: 4, review rate number: 5.0\n\nTotal cost for Day 1: $142 + $114 + $499 = $755\n\nDay 2: Houston (March 9, 2022)\n- Transportation: -\n- Breakfast: Super Bakery, Houston, cost: $30 x 2 = $60, cuisines: Seafood, Fast Food\n- Attraction: Space Center Houston, Houston\n- Lunch: Sheetla Dhaba, Houston, cost: $35 x 2 = $70, cuisines: Desserts, Pizza, Bakery, American, Mediterranean\n- Dinner: Royal Mart, Houston, cost: $40 x 2 = $80, cuisines: Tea, Bakery, Cafe, Mediterranean, Seafood\n- Accommodation: Sunny and Airy near Manhattan, Houston (already paid for Day 1)\n\nTotal cost for Day 2: $60 + $70 + $80 = $210\n\nDay 3: Houston to San Antonio (March 10, 2022)\n- Transportation: Self-driving from Houston to San Antonio, duration: 2 hours 56 mins, distance: 317 km, cost: $15 x 2 = $30\n- Breakfast: Matchbox, Houston, cost: $33 x 2 = $66, cuisines: Tea, Italian, Bakery, Fast Food, Seafood\n- Attraction: San Antonio River Walk, San Antonio\n- Lunch: Cafe Le Rue @ The Landings, San Antonio, cost: $19 x 2 = $38, cuisines: French, Mexican, Cafe, Seafood\n- Dinner: Martin's BBQ, San Antonio, cost: $71 x 2 = $142, cuisines: Tea, BBQ, Fast Food, Indian, Seafood\n- Accommodation: Spacious, bright room, prime Williamsburg location, San Antonio, cost: $900 x 1 = $900, room type: Private room, house rules: No pets, minimum nights: 3, maximum occupancy: 2, review rate number: 4.0\n\nTotal cost for Day 3: $30 + $66 + $38 + $142 + $900 = $1,176\n\nDay 4: San Antonio (March 11, 2022)\n- Transportation: -\n- Breakfast: Minerva's Food & Cocktails, San Antonio, cost: $99 x 2 = $198, cuisines: Cafe, Bakery, BBQ, Seafood\n- Attraction: SeaWorld San Antonio, San Antonio\n- Lunch: Barbeque Nation, San Antonio, cost: $16 x 2 = $32, cuisines: Tea, Cafe, Fast Food, Chinese, American\n- Dinner: Cream Stone, San Antonio, cost: $53 x 2 = $106, cuisines: Cafe, BBQ, Mediterranean, Desserts\n- Accommodation: Spacious, bright room, prime Williamsburg location, San Antonio (already paid for Day 3)\n\nTotal cost for Day 4: $198 + $32 + $106 = $336\n\nDay 5: San Antonio to Dallas (March 12, 2022)\n- Transportation: Self-driving from San Antonio to Dallas, duration: 4 hours 4 mins, distance: 440 km, cost: $22 x 2 = $44\n- Breakfast: Pita Pit, San Antonio, cost: $36 x 2 = $72, cuisines: Pizza, French, Bakery, Cafe, Mediterranean\n- Attraction: The Dallas World Aquarium, Dallas\n- Lunch: Coconuts Fish Cafe, Dallas, cost: $38 x 2 = $76, cuisines: Cafe, BBQ, Mediterranean, Fast Food\n- Dinner: 1918 Bistro & Grill, Dallas, cost: $90 x 2 = $180, cuisines: Tea, Pizza, BBQ, Seafood\n- Accommodation: Luxury Williamsburg duplex, private roof terrace, Dallas, cost: $241 x 1 = $241, room type: Entire home/apt, house rules: No visitors, minimum nights: 4, maximum occupancy: 3, review rate number: 5.0\n\nTotal cost for Day 5: $44 + $72 + $76 + $180 + $241 = $613\n\nDay 6: Dallas (March 13, 2022)\n- Transportation: -\n- Breakfast: Yanki Sizzlers, Dallas, cost: $96 x 2 = $192, cuisines: Cafe, French, Tea, Mediterranean\n- Attraction: The Sixth Floor Museum at Dealey Plaza, Dallas\n- Lunch: Aravali Owls, Dallas, cost: $53 x 2 = $106, cuisines: Pizza, Italian, Bakery, Fast Food, Cafe\n- Dinner: Kebab Xpress, Dallas, cost: $93 x 2 = $186, cuisines: Tea, Bakery, Pizza, Mediterranean\n- Accommodation: Luxury Williamsburg duplex, private roof terrace, Dallas (already paid for Day 5)\n\nTotal cost for Day 6: $192 + $106 + $186 = $484\n\nDay 7: Dallas to Albuquerque (March 14, 2022)\n- Transportation: Self-driving from Dallas to Albuquerque, duration: 9 hours 33 mins, distance: 1,045 km, cost: $52 x 2 = $104\n- Breakfast: Haldiram's, Dallas, cost: $94 x 2 = $188, cuisines: Tea, Pizza\n- Attraction: -\n- Lunch: -\n- Dinner: -\n- Accommodation: -\n\nTotal cost for Day 7: $104 + $188 = $292\n\nTotal cost across all days: $755 + $210 + $1,176 + $336 + $613 + $484 + $292 = $3,866\n\nRemaining budget: $5,000 - $3,866 = $1,134\n\nCuisines: All cuisine constraints are satisfied.\nAccommodations: All accommodations allow smoking and are not shared rooms.\nTransportation: No flights were used, adhering to the preference for avoiding flights.\n\nPlease note that the costs for attractions and some meals are not included in the total cost as they were not provided in the reference information. Additional costs may apply for these activities, and the remaining budget can be used to cover these expenses.", "gpt-4-1106-preview_direct_sole-planning_parsed_results": [{"day": 1, "current_city": "from Albuquerque to Houston", "transportation": "Self-driving from Albuquerque to Houston, duration: 12 hours 51 mins, distance: 1,422 km", "breakfast": "-", "attraction": "-", "lunch": "-", "dinner": "Jalapenos, Houston", "accommodation": "Sunny and Airy near Manhattan, Houston"}, {"day": 2, "current_city": "Houston", "transportation": "-", "breakfast": "Super Bakery, Houston", "attraction": "Space Center Houston, Houston", "lunch": "Sheetla Dhaba, Houston", "dinner": "Royal Mart, Houston", "accommodation": "Sunny and Airy near Manhattan, Houston"}, {"day": 3, "current_city": "from Houston to San Antonio", "transportation": "Self-driving from Houston to San Antonio, duration: 2 hours 56 mins, distance: 317 km", "breakfast": "Matchbox, Houston", "attraction": "San Antonio River Walk, San Antonio", "lunch": "Cafe Le Rue @ The Landings, San Antonio", "dinner": "Martin's BBQ, San Antonio", "accommodation": "Spacious, bright room, prime Williamsburg location, San Antonio"}, {"day": 4, "current_city": "San Antonio", "transportation": "-", "breakfast": "Minerva's Food & Cocktails, San Antonio", "attraction": "SeaWorld San Antonio, San Antonio", "lunch": "Barbeque Nation, San Antonio", "dinner": "Cream Stone, San Antonio", "accommodation": "Spacious, bright room, prime Williamsburg location, San Antonio"}, {"day": 5, "current_city": "from San Antonio to Dallas", "transportation": "Self-driving from San Antonio to Dallas, duration: 4 hours 4 mins, distance: 440 km", "breakfast": "Pita Pit, San Antonio", "attraction": "The Dallas World Aquarium, Dallas", "lunch": "Coconuts Fish Cafe, Dallas", "dinner": "1918 Bistro & Grill, Dallas", "accommodation": "Luxury Williamsburg duplex, private roof terrace, Dallas"}, {"day": 6, "current_city": "Dallas", "transportation": "-", "breakfast": "Yanki Sizzlers, Dallas", "attraction": "The Sixth Floor Museum at Dealey Plaza, Dallas", "lunch": "Aravali Owls, Dallas", "dinner": "Kebab Xpress, Dallas", "accommodation": "Luxury Williamsburg duplex, private roof terrace, Dallas"}, {"day": 7, "current_city": "from Dallas to Albuquerque", "transportation": "Self-driving from Dallas to Albuquerque, duration: 9 hours 33 mins, distance: 1,045 km", "breakfast": "Haldiram's, Dallas", "attraction": "-", "lunch": "-", "dinner": "-", "accommodation": "-"}]}]