[{"gpt-4-1106-preview_direct_sole-planning_results": "Based on the provided information and constraints, here is a 3-day travel plan for a group of 5 people, departing from Manchester to Charlotte, from March 29th to March 31st, 2022, with a budget of $4,800 and a preference for entire room accommodations.\n\n***** Travel Plan *****\n\nDay 1: March 29, 2022\nCurrent City: from Manchester to Charlotte\nTransportation: Flight F3791567, from Manchester to Charlotte, duration: 2 hours 9 minutes, cost: $268 per person\nBreakfast: -\nAttraction: -\nLunch: -\nDinner: Olive Tree Cafe, Charlotte, cost: $23 per person, cuisines: Tea, Chinese, Desserts\nAccommodation: Elegant Studio Apt in Prospect Heights, Charlotte, cost: $640 per night, room type: Entire home/apt, house rules: No parties, minimum nights: 2, maximum occupancy: 5\n\nNumber of people: 5\nTotal cost: 5 x $268 (Flight) + 5 x $23 (Dinner) + $640 (Accommodation) = $2,000\nAccommodation minimum nights: 1/2\n\nDay 2: March 30, 2022\nCurrent City: Charlotte\nTransportation: -\nBreakfast: Central Perk 7, Charlotte, cost: $87 per person, cuisines: Pizza, Bakery, BBQ, Fast Food\nAttraction: Freedom Park, Charlotte; Levine Museum of the New South, Charlotte\nLunch: Kylin Skybar, Charlotte, cost: $44 per person, cuisines: Tea, Cafe, Pizza, Italian\nDinner: Unplugged Courtyard, Charlotte, cost: $54 per person, cuisines: Desserts, French, Bakery, Cafe, Seafood\nAccommodation: Elegant Studio Apt in Prospect Heights, Charlotte, cost: $640 per night, room type: Entire home/apt, house rules: No parties, minimum nights: 2, maximum occupancy: 5\n\nNumber of people: 5\nTotal cost: 5 x $87 (Breakfast) + 5 x $44 (Lunch) + 5 x $54 (Dinner) + $640 (Accommodation) = $2,015\nAccommodation minimum nights: 2/2\n\nDay 3: March 31, 2022\nCurrent City: from Charlotte to Manchester\nTransportation: Flight F3786316, from Charlotte to Manchester, duration: 1 hour 59 minutes, cost: $208 per person\nBreakfast: Grover's - The Baker Shop, Charlotte, cost: $30 per person, cuisines: Pizza, Bakery, Chinese, Indian, Seafood\nAttraction: -\nLunch: -\nDinner: -\nAccommodation: -\n\nNumber of people: 5\nTotal cost: 5 x $208 (Flight) + 5 x $30 (Breakfast) = $1,190\n\nTotal cost across all days: $2,000 (Day 1) + $2,015 (Day 2) + $1,190 (Day 3) = $5,205\n\nHowever, the total cost exceeds the specified budget of $4,800. To adjust the plan within the budget, we can opt for a less expensive accommodation option for Day 1 and Day 2:\n\nRevised Accommodation: Luxury 2 bdr/2 bath prime Williamburg, Charlotte, cost: $218 per night, room type: Entire home/apt, house rules: No children under 10 & No smoking & No pets, minimum nights: 1, maximum occupancy: 3\n\nSince the maximum occupancy is 3, we will need to book two units for the group of 5, which will cost us $436 per night.\n\nRevised Total cost for Day 1 and Day 2: $436 (Accommodation) x 2 nights = $872\n\nRevised Total cost across all days: $2,000 (Day 1) + $1,887 (Day 2) + $1,190 (Day 3) - $640 (Original Accommodation) + $872 (Revised Accommodation) = $5,309\n\nThe revised total cost is still above the budget. We will need to make further adjustments, such as choosing less expensive meal options or changing the flight to a cheaper one if available.\n\nUnfortunately, based on the provided information, there are no cheaper flights or accommodations that can bring the total cost within the budget while meeting all the specified constraints. Therefore, we would need to either increase the budget or adjust the travel plan by reducing the number of attractions or dining experiences to fit within the budget constraints.", "gpt-4-1106-preview_direct_sole-planning_parsed_results": [{"day": 1, "current_city": "from Manchester to Charlotte", "transportation": "Flight Number: F3791567, from Manchester to Charlotte, Departure Time: -, Arrival Time: -", "breakfast": "-", "attraction": "-", "lunch": "-", "dinner": "Olive Tree Cafe, Charlotte", "accommodation": "Elegant Studio Apt in Prospect Heights, Charlotte"}, {"day": 2, "current_city": "Charlotte", "transportation": "-", "breakfast": "Central Perk 7, Charlotte", "attraction": "Freedom Park, Charlotte;Levine Museum of the New South, Charlotte;", "lunch": "Kylin Skybar, Charlotte", "dinner": "Unplugged Courtyard, Charlotte", "accommodation": "Elegant Studio Apt in Prospect Heights, Charlotte"}, {"day": 3, "current_city": "from Charlotte to Manchester", "transportation": "Flight Number: F3786316, from Charlotte to Manchester, Departure Time: -, Arrival Time: -", "breakfast": "Grover's - The Baker Shop, Charlotte", "attraction": "-", "lunch": "-", "dinner": "-", "accommodation": "-"}]}]