[{"gpt-4-1106-preview_direct_sole-planning_results": "Based on the provided information and constraints, here is a travel plan for a solo trip from West Palm Beach to Atlanta, lasting 3 days from March 13th to March 15th, 2022, with a budget of $900.\n\n***** Travel Plan *****\n\nDay 1: March 13th, 2022\n- Current City: from West Palm Beach (Florida) to Atlanta (Georgia)\n- Transportation: Flight F3491626, from West Palm Beach to Atlanta, cost: $137\n- Breakfast: Not applicable (assuming departure is after breakfast time)\n- Attraction: Georgia Aquarium, Atlanta, cost: $40 (estimated)\n- Lunch: Saffron, Atlanta, cost: $39, cuisines: Tea, Cafe, Fast Food, Seafood\n- Dinner: Baba Au Rhum, Atlanta, cost: $27, cuisines: Desserts, Pizza, Mexican, BBQ, Fast Food\n- Accommodation: Spacious private room close St. Barnabas Hospital, Atlanta, cost: $144, room type: Private room, house rules: No smoking, minimum nights: 2\n\nNumber of people: 1\nTotal cost for Day 1: $137 (flight) + $40 (attraction) + $39 (lunch) + $27 (dinner) + $144 (accommodation) = $387\n\nDay 2: March 14th, 2022\n- Current City: Atlanta\n- Transportation: Not applicable (staying in Atlanta)\n- Breakfast: Adda, Atlanta, cost: $22, cuisines: Tea, Mexican, Bakery\n- Attraction: Atlanta Botanical Garden, Atlanta, cost: $22 (estimated)\n- Lunch: Asian Bistro, Atlanta, cost: $27, cuisines: Tea, Bakery, Seafood\n- Dinner: Chef Style, Atlanta, cost: $59, cuisines: Pizza, American, Desserts, Seafood\n- Accommodation: Spacious private room close St. Barnabas Hospital, Atlanta (already paid for Day 1)\n\nNumber of people: 1\nTotal cost for Day 2: $22 (breakfast) + $22 (attraction) + $27 (lunch) + $59 (dinner) = $130\n\nDay 3: March 15th, 2022\n- Current City: from Atlanta (Georgia) to West Palm Beach (Florida)\n- Transportation: Flight F3497203, from Atlanta to West Palm Beach, cost: $121\n- Breakfast: Shri Ram Restaurant, Atlanta, cost: $55, cuisines: Tea, Mexican, Indian, Fast Food\n- Attraction: Not applicable (assuming departure is before attraction visit time)\n- Lunch: Not applicable (assuming in-flight or after arrival)\n- Dinner: Not applicable (assuming after arrival back home)\n- Accommodation: Not applicable (returning home)\n\nNumber of people: 1\nTotal cost for Day 3: $121 (flight) + $55 (breakfast) = $176\n\nTotal cost across all days: $387 (Day 1) + $130 (Day 2) + $176 (Day 3) = $693\n\nRemaining budget: $900 - $693 = $207\n\nCuisines: All cuisine constraints are satisfied as no specific cuisines were requested.\nAccommodation: Accommodation adheres to the \"no smoking\" house rule and is not a shared room.\n\n***** End of Travel Plan *****\n\nPlease note that the costs for attractions are estimated as the provided information does not include their prices. The remaining budget can be used for additional expenses such as local transportation, souvenirs, or any unforeseen costs.", "gpt-4-1106-preview_direct_sole-planning_parsed_results": [{"day": 1, "current_city": "from West Palm Beach to Atlanta", "transportation": "Flight Number: F3491626, from West Palm Beach to Atlanta", "breakfast": "-", "attraction": "Georgia Aquarium, Atlanta;", "lunch": "Saffron, Atlanta", "dinner": "Baba Au Rhum, Atlanta", "accommodation": "Spacious private room close St. Barnabas Hospital, Atlanta"}, {"day": 2, "current_city": "Atlanta", "transportation": "-", "breakfast": "Adda, Atlanta", "attraction": "Atlanta Botanical Garden, Atlanta;", "lunch": "Asian Bistro, Atlanta", "dinner": "Chef Style, Atlanta", "accommodation": "Spacious private room close St. Barnabas Hospital, Atlanta"}, {"day": 3, "current_city": "from Atlanta to West Palm Beach", "transportation": "Flight Number: F3497203, from Atlanta to West Palm Beach", "breakfast": "Shri Ram Restaurant, Atlanta", "attraction": "-", "lunch": "-", "dinner": "-", "accommodation": "-"}]}]