[{"gpt-4-1106-preview_direct_sole-planning_results": "Based on the provided information and constraints, here is a 5-day travel plan for a single traveler starting in Colorado Springs and visiting two cities in Illinois (Moline and Rockford) from March 5th to March 9th, 2022, with an overall budget of $1,900.\n\n**Day 1: Colorado Springs to Moline**\n- Transportation: Self-driving from Colorado Springs to Moline, duration: 12 hours 49 mins, distance: 1,467 km, cost: $73\n- Breakfast: -\n- Attraction: -\n- Lunch: -\n- Dinner: Royal Hotel, Moline, cost: $74, cuisines: Tea, Pizza, Mexican, Chinese, Seafood\n- Accommodation: Sunny duplex near Central Park, Moline, cost: $541, room type: Entire home/apt, house rules: No pets, minimum nights: 1, maximum occupancy: 5\n\n**Day 2: Moline**\n- Transportation: -\n- Breakfast: Zoe, Moline, cost: $15, cuisines: French, Cafe, Fast Food\n- Attraction: John Deere Pavilion, Moline; Celebration River Cruises, Moline\n- Lunch: Mummy's Kitchen, Moline, cost: $54, cuisines: Desserts, Indian, Mediterranean, BBQ\n- Dinner: ZASTY, Moline, cost: $82, cuisines: Pizza, Indian, BBQ, Cafe, American, Seafood\n- Accommodation: Sunny duplex near Central Park, Moline, cost: $541, room type: Entire home/apt, house rules: No pets, minimum nights: 1, maximum occupancy: 5\n\n**Day 3: Moline to Rockford**\n- Transportation: Self-driving from Moline to Rockford, duration: 2 hours 1 min, distance: 194 km, cost: $9\n- Breakfast: Lovecrumbs Bakery, Moline, cost: $24, cuisines: Tea, Pizza, American, Desserts\n- Attraction: Anderson Japanese Gardens, Rockford; Burpee Museum of Natural History, Rockford\n- Lunch: Flying Mango, Rockford, cost: $20, cuisines: American, BBQ, Seafood\n- Dinner: Coco Bambu, Rockford, cost: $72, cuisines: Tea, French, Bakery, BBQ, Cafe\n- Accommodation: Spacious 3BDR Prime Location!, Rockford, cost: $1030, room type: Entire home/apt, house rules: No smoking, minimum nights: 2, maximum occupancy: 9\n\n**Day 4: Rockford**\n- Transportation: -\n- Breakfast: Moets Arabica, Rockford, cost: $43, cuisines: Tea, Bakery, Indian, Fast Food\n- Attraction: Discovery Center Museum, Rockford; Sinnissippi Park, Rockford\n- Lunch: Cafe Southall, Rockford, cost: $56, cuisines: Seafood, Pizza, Cafe, Fast Food\n- Dinner: Mirchievous, Rockford, cost: $64, cuisines: American, Indian, BBQ, Seafood\n- Accommodation: Spacious 3BDR Prime Location!, Rockford, cost: $1030, room type: Entire home/apt, house rules: No smoking, minimum nights: 2, maximum occupancy: 9\n\n**Day 5: Rockford to Colorado Springs**\n- Transportation: Self-driving from Rockford to Colorado Springs, duration: 14 hours 38 mins, distance: 1,653 km, cost: $82\n- Breakfast: Nutri Punch, Rockford, cost: $34, cuisines: Tea, Chinese, Cafe, Desserts\n- Attraction: -\n- Lunch: -\n- Dinner: -\n- Accommodation: -\n\n**Total Costs:**\n- Transportation: $73 + $9 + $82 = $164\n- Meals: $74 + $15 + $54 + $82 + $24 + $20 + $72 + $43 + $56 + $64 + $34 = $538\n- Accommodation: $541 + $541 + $1030 + $1030 = $3142\n- Attractions: Included in daily activities, no separate cost provided\n\n**Total cost across all days: $164 + $538 + $3142 = $3844**\n\nUnfortunately, the total cost exceeds the specified budget of $1,900. To adhere to the budget, we need to make adjustments:\n\n- Change accommodation in Rockford to a more affordable option:\n  - New Accommodation: Private Room in a two bedroom apt., Rockford, cost: $210, room type: Private room, house rules: No visitors & No smoking, minimum nights: 1, maximum occupancy: 2\n- Remove one attraction from each city to save time and potentially reduce expenses.\n\n**Adjusted Costs:**\n- Accommodation: $541 + $541 + $210 + $210 = $1502\n\n**Adjusted Total cost across all days: $164 + $538 + $1502 = $2204**\n\nThe adjusted plan is still over budget. Further adjustments are needed, such as choosing less expensive meal options or reducing the number of paid attractions. However, without additional information on costs for attractions and cheaper meal options, it is challenging to provide a detailed plan that meets the budget constraint.", "gpt-4-1106-preview_direct_sole-planning_parsed_results": [{"day": 1, "current_city": "from Colorado Springs to Moline", "transportation": "Self-driving from Colorado Springs to Moline, duration: 12 hours 49 mins, distance: 1,467 km", "breakfast": "-", "attraction": "-", "lunch": "-", "dinner": "Royal Hotel, Moline", "accommodation": "Sunny duplex near Central Park, Moline"}, {"day": 2, "current_city": "Moline", "transportation": "-", "breakfast": "Zoe, Moline", "attraction": "John Deere Pavilion, Moline;Celebration River Cruises, Moline;", "lunch": "Mummy's Kitchen, Moline", "dinner": "ZASTY, Moline", "accommodation": "Sunny duplex near Central Park, Moline"}, {"day": 3, "current_city": "from Moline to Rockford", "transportation": "Self-driving from Moline to Rockford, duration: 2 hours 1 min, distance: 194 km", "breakfast": "Lovecrumbs Bakery, Moline", "attraction": "Anderson Japanese Gardens, Rockford;Burpee Museum of Natural History, Rockford;", "lunch": "Flying Mango, Rockford", "dinner": "Coco Bambu, Rockford", "accommodation": "Spacious 3BDR Prime Location!, Rockford"}, {"day": 4, "current_city": "Rockford", "transportation": "-", "breakfast": "Moets Arabica, Rockford", "attraction": "Discovery Center Museum, Rockford;Sinnissippi Park, Rockford;", "lunch": "Cafe Southall, Rockford", "dinner": "Mirchievous, Rockford", "accommodation": "Spacious 3BDR Prime Location!, Rockford"}, {"day": 5, "current_city": "from Rockford to Colorado Springs", "transportation": "Self-driving from Rockford to Colorado Springs, duration: 14 hours 38 mins, distance: 1,653 km", "breakfast": "Nutri Punch, Rockford", "attraction": "-", "lunch": "-", "dinner": "-", "accommodation": "-"}]}]