[{"gpt-4-1106-preview_direct_sole-planning_results": "Based on the provided information and constraints, here is a 3-day travel plan for 2 people departing from Columbus and heading to Newark, covering 1 city, from March 25th to March 27th, 2022, with a budget of $1,200 and suitable accommodations for children under 10. The plan avoids self-driving as per the request.\n\n***** Travel Plan *****\n\nDay 1: March 25th, Columbus to Newark\n- Transportation: Flight F4076294, from Columbus to Newark, cost: $116 per person, duration: 1 hour 51 minutes\n- Breakfast: Not applicable (assuming departure from Columbus early in the morning)\n- Attraction: The Newark Museum of Art, Newark (free admission for children under 10)\n- Lunch: Artistry, Newark, cost: $79 for 2 people, cuisines: Cafe, Pizza, Desserts, Seafood\n- Dinner: Angeethi Restaurant, Newark, cost: $12 for 2 people, cuisines: French, BBQ, Fast Food\n- Accommodation: Gramercy One Bedroom w Two Beds, Newark, cost: $485 per night, room type: Entire home/apt (suitable for children under 10)\n\nNumber of people: 2\nTotal cost for Day 1: 2 x $116 (flight) + $79 (lunch) + $12 (dinner) + $485 (accommodation) = $808\n\nDay 2: March 26th, Newark\n- Transportation: Not applicable (staying in Newark)\n- Breakfast: Mirage Restro Bar, Newark, cost: $51 for 2 people, cuisines: Bakery, American, Desserts, Fast Food\n- Attraction: Branch Brook Park, Newark (free admission)\n- Lunch: Escape Terrace Bar Kitchen, Newark, cost: $100 for 2 people, cuisines: Tea, Cafe, Bakery, Chinese, Seafood\n- Dinner: Drifters Cafe, Newark, cost: $24 for 2 people, cuisines: Tea, BBQ\n- Accommodation: Gramercy One Bedroom w Two Beds, Newark (second night)\n\nNumber of people: 2\nTotal cost for Day 2: $51 (breakfast) + $100 (lunch) + $24 (dinner) = $175\n\nDay 3: March 27th, Newark to Columbus\n- Transportation: Flight F4076752, from Newark to Columbus, cost: $129 per person, duration: 1 hour 35 minutes\n- Breakfast: Harmann Restaurant, Newark, cost: $57 for 2 people, cuisines: Tea, Cafe, American, Fast Food\n- Attraction: Not applicable (assuming departure from Newark in the afternoon)\n- Lunch: Not applicable (assuming in-flight or after arrival in Columbus)\n- Dinner: Not applicable (back in Columbus)\n- Accommodation: Not applicable (back in Columbus)\n\nNumber of people: 2\nTotal cost for Day 3: 2 x $129 (flight) + $57 (breakfast) = $315\n\nTotal cost across all days: $808 (Day 1) + $175 (Day 2) + $315 (Day 3) = $1,298\n\nNote: The total cost slightly exceeds the budget of $1,200. To adjust, consider choosing a less expensive flight or reducing meal costs.\n\nCuisines: The plan includes a variety of cuisines as per the available options in Newark.\nAccommodations: The chosen accommodation is suitable for children under 10 and provides an entire room as requested.\n\n***** End of Travel Plan *****\n\nPlease note that the actual availability and prices of flights, accommodations, and restaurants may vary, and it is essential to confirm these details at the time of booking. Additionally, the attractions chosen are family-friendly and suitable for children under 10.", "gpt-4-1106-preview_direct_sole-planning_parsed_results": [{"day": 1, "current_city": "from Columbus to Newark", "transportation": "Flight Number: F4076294, from Columbus to Newark, Departure Time: -, Arrival Time: -", "breakfast": "-", "attraction": "The Newark Museum of Art, Newark", "lunch": "Artistry, Newark", "dinner": "Angeethi Restaurant, Newark", "accommodation": "Gramercy One Bedroom w Two Beds, Newark"}, {"day": 2, "current_city": "Newark", "transportation": "-", "breakfast": "Mirage Restro Bar, Newark", "attraction": "Branch Brook Park, Newark", "lunch": "Escape Terrace Bar Kitchen, Newark", "dinner": "Drifters Cafe, Newark", "accommodation": "Gramercy One Bedroom w Two Beds, Newark"}, {"day": 3, "current_city": "from Newark to Columbus", "transportation": "Flight Number: F4076752, from Newark to Columbus, Departure Time: -, Arrival Time: -", "breakfast": "Harmann Restaurant, Newark", "attraction": "-", "lunch": "-", "dinner": "-", "accommodation": "-"}]}]