[{"gpt-4-1106-preview_direct_sole-planning_results": "Travel Plan:\n\nDays: 1\nCurrent City: from Los Angeles to Detroit (Michigan)\nTransportation: Flight Number: F3496477, from Los Angeles to Detroit, Departure Time: 15:30, Arrival Time: 22:51, cost: 411\nBreakfast: -\nAttraction: -\nLunch: -\nDinner: A Dong Restaurant, Detroit (Michigan), cost: 40, cuisines: Tea, Cafe, Pizza\nAccommodation: Cozy 1 bedroom in the heart of Fort Greene, Detroit (Michigan), cost: 751, maximum occupancy: 6, house rules: No pets & No parties, minimum nights: 3\n\nNumber of people: 2\nTotal cost: (411 + 40) * 2 + 751 = 1,653\nAccommodation minimum nights: 1/3\n\nDays: 2\nCurrent City: Detroit (Michigan)\nTransportation: -\nBreakfast: Southern Bliss Bakery, Detroit (Michigan), cost: 28, cuisines: Tea, BBQ, Desserts, Seafood\nAttraction: Detroit Institute of Arts, Detroit (Michigan); Detroit Historical Museum, Detroit (Michigan)\nLunch: Chye Seng Huat Hardware, Detroit (Michigan), cost: 94, cuisines: Tea, Mexican, Seafood\nDinner: Bistro Flamme Bois, Detroit (Michigan), cost: 100, cuisines: Chinese, Bakery, BBQ\nAccommodation: Cozy 1 bedroom in the heart of Fort Greene, Detroit (Michigan), cost: 751, maximum occupancy: 6, house rules: No pets & No parties, minimum nights: 3\n\nNumber of people: 2\nTotal cost: (28 + 94 + 100) * 2 + 751 = 1,195\nAccommodation minimum nights: 2/3\n\nDays: 3\nCurrent City: from Detroit (Michigan) to Los Angeles\nTransportation: Flight Number: F3538108, from Detroit to Los Angeles, Departure Time: 19:15, Arrival Time: 21:16, cost: 446\nBreakfast: Cafe And More, Detroit (Michigan), cost: 41, cuisines: Tea, Bakery, Italian\nAttraction: Motown Museum, Detroit (Michigan); Belle Isle Aquarium, Detroit (Michigan)\nLunch: Mitalis Kitchen, Detroit (Michigan), cost: 28, cuisines: Pizza, BBQ, Chinese, Mediterranean, Seafood\nDinner: -\nAccommodation: -\n\nNumber of people: 2\nTotal cost: (41 + 28) * 2 + 446 * 2 = 1,130\n\nTotal cost across all days: 1,653 + 1,195 + 1,130 = 3,978\n\nUnfortunately, the total cost of $3,978 exceeds the specified budget of $2,000. To adhere to the budget, we need to make adjustments to the travel plan. Here's a revised plan that fits within the budget:\n\nRevised Travel Plan:\n\nDays: 1\nCurrent City: from Los Angeles to Detroit (Michigan)\nTransportation: Flight Number: F3496477, from Los Angeles to Detroit, Departure Time: 15:30, Arrival Time: 22:51, cost: 411\nBreakfast: -\nAttraction: -\nLunch: -\nDinner: A Dong Restaurant, Detroit (Michigan), cost: 40, cuisines: Tea, Cafe, Pizza\nAccommodation: Lovely, charming and clean bedroom in Manhattan, Detroit (Michigan), cost: 69, maximum occupancy: 2, house rules: No smoking, minimum nights: 1\n\nNumber of people: 2\nTotal cost: (411 + 40) * 2 + 69 = 971\nAccommodation minimum nights: 1/1\n\nDays: 2\nCurrent City: Detroit (Michigan)\nTransportation: -\nBreakfast: Southern Bliss Bakery, Detroit (Michigan), cost: 28, cuisines: Tea, BBQ, Desserts, Seafood\nAttraction: Detroit Institute of Arts, Detroit (Michigan); Detroit Historical Museum, Detroit (Michigan)\nLunch: Chye Seng Huat Hardware, Detroit (Michigan), cost: 94, cuisines: Tea, Mexican, Seafood\nDinner: Bistro Flamme Bois, Detroit (Michigan), cost: 100, cuisines: Chinese, Bakery, BBQ\nAccommodation: Lovely, charming and clean bedroom in Manhattan, Detroit (Michigan), cost: 69, maximum occupancy: 2, house rules: No smoking, minimum nights: 1\n\nNumber of people: 2\nTotal cost: (28 + 94 + 100) * 2 + 69 = 541\nAccommodation minimum nights: 2/1\n\nDays: 3\nCurrent City: from Detroit (Michigan) to Los Angeles\nTransportation: Flight Number: F3545846, from Detroit to Los Angeles, Departure Time: 13:31, Arrival Time: 15:14, cost: 399\nBreakfast: Cafe And More, Detroit (Michigan), cost: 41, cuisines: Tea, Bakery, Italian\nAttraction: Motown Museum, Detroit (Michigan); Belle Isle Aquarium, Detroit (Michigan)\nLunch: Mitalis Kitchen, Detroit (Michigan), cost: 28, cuisines: Pizza, BBQ, Chinese, Mediterranean, Seafood\nDinner: -\nAccommodation: -\n\nNumber of people: 2\nTotal cost: (41 + 28) * 2 + 399 * 2 = 974\n\nTotal cost across all days: 971 + 541 + 974 = 2,486\n\nThe revised plan still exceeds the budget. To further reduce costs, we can opt for the cheapest flight options and remove one attraction or meal per day:\n\nFinal Revised Travel Plan:\n\nDays: 1\nCurrent City: from Los Angeles to Detroit (Michigan)\nTransportation: Flight Number: F3496477, from Los Angeles to Detroit, Departure Time: 15:30, Arrival Time: 22:51, cost: 411\nBreakfast: -\nAttraction: -\nLunch: -\nDinner: A Dong Restaurant, Detroit (Michigan), cost: 40, cuisines: Tea, Cafe, Pizza\nAccommodation: Lovely, charming and clean bedroom in Manhattan, Detroit (Michigan), cost: 69, maximum occupancy: 2, house rules: No smoking, minimum nights: 1\n\nNumber of people: 2\nTotal cost: (411 + 40) * 2 + 69 = 971\nAccommodation minimum nights: 1/1\n\nDays: 2\nCurrent City: Detroit (Michigan)\nTransportation: -\nBreakfast: Southern Bliss Bakery, Detroit (Michigan), cost: 28, cuisines: Tea, BBQ, Desserts, Seafood\nAttraction: Detroit Institute of Arts, Detroit (Michigan)\nLunch: -\nDinner: Bistro Flamme Bois, Detroit (Michigan), cost: 100, cuisines: Chinese, Bakery, BBQ\nAccommodation: Lovely, charming and clean bedroom in Manhattan, Detroit (Michigan), cost: 69, maximum occupancy: 2, house rules: No smoking, minimum nights: 1\n\nNumber of people: 2\nTotal cost: (28 + 100) * 2 + 69 = 373\nAccommodation minimum nights: 2/1\n\nDays: 3\nCurrent City: from Detroit (Michigan) to Los Angeles\nTransportation: Flight Number: F3545846, from Detroit to Los Angeles, Departure Time: 13:31, Arrival Time: 15:14, cost: 399\nBreakfast: Cafe And More, Detroit (Michigan), cost: 41, cuisines: Tea, Bakery, Italian\nAttraction: -\nLunch: -\nDinner: -\nAccommodation: -\n\nNumber of people: 2\nTotal cost: 41 * 2 + 399 * 2 = 880\n\nTotal cost across all days: 971 + 373 + 880 = 2,224\n\nThe final revised plan is still slightly over budget. To fit within the $2,000 budget, we may need to choose a less expensive dinner option on Day 1 or remove the breakfast on Day 2. Adjustments will be made based on the travelers' preferences.", "gpt-4-1106-preview_direct_sole-planning_parsed_results": [{"day": 1, "current_city": "from Los Angeles to Detroit", "transportation": "Flight Number: F3496477, from Los Angeles to Detroit, Departure Time: 15:30, Arrival Time: 22:51", "breakfast": "-", "attraction": "-", "lunch": "-", "dinner": "A Dong Restaurant, Detroit", "accommodation": "Lovely, charming and clean bedroom in Manhattan, Detroit"}, {"day": 2, "current_city": "Detroit", "transportation": "-", "breakfast": "Southern Bliss Bakery, Detroit", "attraction": "Detroit Institute of Arts, Detroit", "lunch": "-", "dinner": "Bistro Flamme Bois, Detroit", "accommodation": "Lovely, charming and clean bedroom in Manhattan, Detroit"}, {"day": 3, "current_city": "from Detroit to Los Angeles", "transportation": "Flight Number: F3545846, from Detroit to Los Angeles, Departure Time: 13:31, Arrival Time: 15:14", "breakfast": "Cafe And More, Detroit", "attraction": "-", "lunch": "-", "dinner": "-", "accommodation": "-"}]}]