[{"gpt-4-1106-preview_direct_sole-planning_results": "Travel Plan:\n\nDays: 1\nCurrent City: from Jacksonville to Detroit (Michigan)\nTransportation: Flight Number: F3553781, from Jacksonville to Detroit (Michigan), Departure Time: 12:10, Arrival Time: 14:15, cost: 178\nBreakfast: -\nAttraction: -\nLunch: -\nDinner: Southern Bliss Bakery, Detroit (Michigan), cost: 28, cuisines: Tea, BBQ, Desserts, Seafood\nAccommodation: Comfy King Bed Feet from Subway, Detroit (Michigan), cost: 568, room type: Private room, house rules: No parties, minimum nights: 3, maximum occupancy: 1\n\nNumber of people: 1\nTotal cost: 178 + 28 + 568 = 774\nAccommodation minimum nights: 1/3\n\nDays: 2\nCurrent City: Detroit (Michigan)\nTransportation: -\nBreakfast: BMG - All Day Dining, Detroit (Michigan), cost: 15, cuisines: Desserts, Bakery, BBQ, Indian, Seafood\nAttraction: Detroit Institute of Arts, Detroit (Michigan); Detroit Historical Museum, Detroit (Michigan)\nLunch: A Dong Restaurant, Detroit (Michigan), cost: 40, cuisines: Tea, Cafe, Pizza\nDinner: Bistro Flamme Bois, Detroit (Michigan), cost: 100, cuisines: Chinese, Bakery, BBQ\nAccommodation: Comfy King Bed Feet from Subway, Detroit (Michigan), cost: 568, room type: Private room, house rules: No parties, minimum nights: 3, maximum occupancy: 1\n\nNumber of people: 1\nTotal cost: 15 + 40 + 100 + 568 = 723\nAccommodation minimum nights: 2/3\n\nDays: 3\nCurrent City: from Detroit (Michigan) to Lansing (Michigan)\nTransportation: Flight Number: F3656087, from Detroit (Michigan) to Lansing (Michigan), Departure Time: 10:10, Arrival Time: 10:46, cost: 27\nBreakfast: -\nAttraction: Impression 5 Science Center, Lansing (Michigan); Michigan History Center, Lansing (Michigan)\nLunch: Tony's Italian Restaurant & Pizza, Lansing (Michigan), cost: 83, cuisines: Tea, Pizza, Indian, BBQ, American\nDinner: Huey's On The River, Lansing (Michigan), cost: 75, cuisines: Tea, French, Bakery, Fast Food, Cafe\nAccommodation: 2 bedroom apartment in harlem, Lansing (Michigan), cost: 943, room type: Entire home/apt, house rules: No parties & No pets, minimum nights: 1, maximum occupancy: 7\n\nNumber of people: 1\nTotal cost: 27 + 83 + 75 + 943 = 1128\nAccommodation minimum nights: 1/1\n\nDays: 4\nCurrent City: Lansing (Michigan)\nTransportation: -\nBreakfast: Manuel's Bread Cafe, Lansing (Michigan), cost: 28, cuisines: French, Pizza, Seafood\nAttraction: Potter Park Zoo, Lansing (Michigan); Eli and Edythe Broad Art Museum, Lansing (Michigan)\nLunch: Golden China, Lansing (Michigan), cost: 66, cuisines: Chinese, Indian, Cafe, BBQ\nDinner: Triveni, Lansing (Michigan), cost: 37, cuisines: Desserts, Mexican, Bakery, BBQ, Mediterranean, Seafood\nAccommodation: 2 bedroom apartment in harlem, Lansing (Michigan), cost: 943, room type: Entire home/apt, house rules: No parties & No pets, minimum nights: 1, maximum occupancy: 7\n\nNumber of people: 1\nTotal cost: 28 + 66 + 37 + 943 = 1074\nAccommodation minimum nights: 2/1\n\nDays: 5\nCurrent City: from Lansing (Michigan) to Jacksonville\nTransportation: Self-driving, from Lansing (Michigan) to Jacksonville, duration: 15 hours 55 mins, distance: 1,704 km, cost: 85\nBreakfast: -\nAttraction: -\nLunch: -\nDinner: -\nAccommodation: -\n\nNumber of people: 1\nTotal cost: 85\n\nTotal cost across all days: 774 + 723 + 1128 + 1074 + 85 = 3784\nCuisines: The prompt specifies no particular preference, and a variety of cuisines have been represented in the restaurants chosen.", "gpt-4-1106-preview_direct_sole-planning_parsed_results": [{"day": 1, "current_city": "from Jacksonville to Detroit (Michigan)", "transportation": "Flight Number: F3553781, from Jacksonville to Detroit (Michigan), Departure Time: 12:10, Arrival Time: 14:15", "breakfast": "-", "attraction": "-", "lunch": "-", "dinner": "Southern Bliss Bakery, Detroit (Michigan)", "accommodation": "Comfy King Bed Feet from Subway, Detroit (Michigan)"}, {"day": 2, "current_city": "Detroit (Michigan)", "transportation": "-", "breakfast": "BMG - All Day Dining, Detroit (Michigan)", "attraction": "Detroit Institute of Arts, Detroit (Michigan);Detroit Historical Museum, Detroit (Michigan);", "lunch": "A Dong Restaurant, Detroit (Michigan)", "dinner": "Bistro Flamme Bois, Detroit (Michigan)", "accommodation": "Comfy King Bed Feet from Subway, Detroit (Michigan)"}, {"day": 3, "current_city": "from Detroit (Michigan) to Lansing (Michigan)", "transportation": "Flight Number: F3656087, from Detroit (Michigan) to Lansing (Michigan), Departure Time: 10:10, Arrival Time: 10:46", "breakfast": "-", "attraction": "Impression 5 Science Center, Lansing (Michigan);Michigan History Center, Lansing (Michigan);", "lunch": "Tony's Italian Restaurant & Pizza, Lansing (Michigan)", "dinner": "Huey's On The River, Lansing (Michigan)", "accommodation": "2 bedroom apartment in harlem, Lansing (Michigan)"}, {"day": 4, "current_city": "Lansing (Michigan)", "transportation": "-", "breakfast": "Manuel's Bread Cafe, Lansing (Michigan)", "attraction": "Potter Park Zoo, Lansing (Michigan);Eli and Edythe Broad Art Museum, Lansing (Michigan);", "lunch": "Golden China, Lansing (Michigan)", "dinner": "Triveni, Lansing (Michigan)", "accommodation": "2 bedroom apartment in harlem, Lansing (Michigan)"}, {"day": 5, "current_city": "from Lansing (Michigan) to Jacksonville", "transportation": "Self-driving, from Lansing (Michigan) to Jacksonville, duration: 15 hours 55 mins, distance: 1,704 km", "breakfast": "-", "attraction": "-", "lunch": "-", "dinner": "-", "accommodation": "-"}]}]