[{"gpt-4-1106-preview_direct_sole-planning_results": "Travel Plan:\n\nDays: 1\nCurrent City: from Denver to Buffalo (New York)\nTransportation: Flight Number: F4026791, from Denver to Buffalo (New York), Departure Time: 13:07, Arrival Time: 18:00, cost: 505\nBreakfast: -\nAttraction: -\nLunch: -\nDinner: Tibby's New Orleans Kitchen, Buffalo (New York), cost: 48, cuisines: Seafood, Indian, BBQ, Italian\nAccommodation: Cozy Studio in Heart of Ft Greene, Buffalo (New York), cost: 200, maximum occupancy: 3, house rules: No pets & No children under 10, minimum nights: 4\n\nNumber of people: 2\nTotal cost: (505 + 48) * 2 + 200 = 1,306\nAccommodation minimum nights: 1/4\n\nDays: 2\nCurrent City: Buffalo (New York)\nTransportation: -\nBreakfast: Shokitini, Buffalo (New York), cost: 41, cuisines: Tea, Cafe, Pizza, Mexican, Chinese, Seafood\nAttraction: The Buffalo Zoo, Buffalo (New York); Buffalo Naval Park, Buffalo (New York)\nLunch: Punjab Grill, Buffalo (New York), cost: 25, cuisines: Bakery, BBQ, Desserts, Seafood\nDinner: Ammu's South Indian Restaurant, Buffalo (New York), cost: 80, cuisines: Desserts, Pizza, French, BBQ, Chinese\nAccommodation: Cozy Studio in Heart of Ft Greene, Buffalo (New York), cost: 200, maximum occupancy: 3, house rules: No pets & No children under 10, minimum nights: 4\n\nNumber of people: 2\nTotal cost: (41 + 25 + 80) * 2 + 200 = 574\nAccommodation minimum nights: 2/4\n\nDays: 3\nCurrent City: from Buffalo (New York) to New York City (New York)\nTransportation: Flight Number: F3651086, from Buffalo to New York City (New York), Departure Time: 10:54, Arrival Time: 12:08, cost: 73\nBreakfast: -\nAttraction: Central Park, New York City (New York); Times Square, New York City (New York)\nLunch: Seasons 52 Fresh Grill, New York City (New York), cost: 30, cuisines: Seafood, Indian, Desserts, Italian\nDinner: Lord of the Drinks Forum, New York City (New York), cost: 71, cuisines: Cafe, Bakery, BBQ, Chinese, Indian\nAccommodation: A Contemporary Homelike Stay in the Best of BK, New York City (New York), cost: 228, maximum occupancy: 2, house rules: No pets & No visitors & No children under 10, minimum nights: 2\n\nNumber of people: 2\nTotal cost: (73 + 30 + 71) * 2 + 228 = 676\nAccommodation minimum nights: 1/2\n\nDays: 4\nCurrent City: New York City (New York)\nTransportation: -\nBreakfast: Gurgaon Hights, New York City (New York), cost: 46, cuisines: Cafe, American, Indian, Fast Food\nAttraction: Empire State Building, New York City (New York); The High Line, New York City (New York)\nLunch: Sir John Bakery Cafe, New York City (New York), cost: 78, cuisines: Pizza, Bakery, Desserts\nDinner: Garam Masala Food Corner, New York City (New York), cost: 40, cuisines: Pizza, Bakery, Desserts\nAccommodation: A Contemporary Homelike Stay in the Best of BK, New York City (New York), cost: 228, maximum occupancy: 2, house rules: No pets & No visitors & No children under 10, minimum nights: 2\n\nNumber of people: 2\nTotal cost: (46 + 78 + 40) * 2 + 228 = 656\nAccommodation minimum nights: 2/2\n\nDays: 5\nCurrent City: from New York City (New York) to Denver\nTransportation: Flight Number: F3766607, from New York City (New York) to Denver, Departure Time: 07:23, Arrival Time: 09:56, cost: 327\nBreakfast: -\nAttraction: -\nLunch: -\nDinner: -\nAccommodation: -\n\nNumber of people: 2\nTotal cost: 327 * 2 = 654\n\nTotal cost across all days: 1,306 + 574 + 676 + 656 + 654 = 3,866\nCuisines: The prompt specifies Mexican and Indian, and both of these cuisines have been represented in the restaurants chosen.\n\nPlease note that the accommodation in Buffalo requires a minimum of 4 nights, but the itinerary only allows for 2 nights in Buffalo. Adjustments to the itinerary or accommodations may be necessary to meet this requirement. Additionally, the total cost is well within the specified budget of $6,300.", "gpt-4-1106-preview_direct_sole-planning_parsed_results": [{"day": 1, "current_city": "from Denver to Buffalo (New York)", "transportation": "Flight Number: F4026791, from Denver to Buffalo (New York), Departure Time: 13:07, Arrival Time: 18:00", "breakfast": "-", "attraction": "-", "lunch": "-", "dinner": "Tibby's New Orleans Kitchen, Buffalo (New York)", "accommodation": "Cozy Studio in Heart of Ft Greene, Buffalo (New York)"}, {"day": 2, "current_city": "Buffalo (New York)", "transportation": "-", "breakfast": "Shokitini, Buffalo (New York)", "attraction": "The Buffalo Zoo, Buffalo (New York);Buffalo Naval Park, Buffalo (New York);", "lunch": "Punjab Grill, Buffalo (New York)", "dinner": "Ammu's South Indian Restaurant, Buffalo (New York)", "accommodation": "Cozy Studio in Heart of Ft Greene, Buffalo (New York)"}, {"day": 3, "current_city": "from Buffalo (New York) to New York City (New York)", "transportation": "Flight Number: F3651086, from Buffalo to New York City (New York), Departure Time: 10:54, Arrival Time: 12:08", "breakfast": "-", "attraction": "Central Park, New York City (New York);Times Square, New York City (New York);", "lunch": "Seasons 52 Fresh Grill, New York City (New York)", "dinner": "Lord of the Drinks Forum, New York City (New York)", "accommodation": "A Contemporary Homelike Stay in the Best of BK, New York City (New York)"}, {"day": 4, "current_city": "New York City (New York)", "transportation": "-", "breakfast": "Gurgaon Hights, New York City (New York)", "attraction": "Empire State Building, New York City (New York);The High Line, New York City (New York);", "lunch": "Sir John Bakery Cafe, New York City (New York)", "dinner": "Garam Masala Food Corner, New York City (New York)", "accommodation": "A Contemporary Homelike Stay in the Best of BK, New York City (New York)"}, {"day": 5, "current_city": "from New York City (New York) to Denver", "transportation": "Flight Number: F3766607, from New York City (New York) to Denver, Departure Time: 07:23, Arrival Time: 09:56", "breakfast": "-", "attraction": "-", "lunch": "-", "dinner": "-", "accommodation": "-"}]}]