[{"gpt-4-1106-preview_direct_sole-planning_results": "Travel Plan:\n\nDays: 1\nCurrent City: from Richmond to Houston (Texas)\nTransportation: Flight Number: F4041372, from Richmond to Houston, Departure Time: 08:27, Arrival Time: 10:43, cost: 371\nBreakfast: -\nAttraction: -\nLunch: Jalapenos, Houston (Texas), cost: 57, cuisines: Desserts, Tea, Cafe, Chinese, Seafood\nDinner: Sheetla Dhaba, Houston (Texas), cost: 35, cuisines: Desserts, Pizza, Bakery, American, Mediterranean\nAccommodation: Sunny and Airy near Manhattan, Houston (Texas), cost: 499, room type: Entire home/apt, house rules: No pets, minimum nights: 2, maximum occupancy: 4\n\nNumber of people: 2\nTotal cost: (371 + 57 + 35) * 2 + 499 = 1,420\nAccommodation minimum nights: 1/2\n\nDays: 2\nCurrent City: Houston (Texas)\nTransportation: -\nBreakfast: Super Bakery, Houston (Texas), cost: 30, cuisines: Seafood, Fast Food\nAttraction: Space Center Houston, Houston (Texas); Houston Museum of Natural Science, Houston (Texas)\nLunch: Royal Mart, Houston (Texas), cost: 40, cuisines: Tea, Bakery, Cafe, Mediterranean, Seafood\nDinner: The BrewMaster - The Mix Fine Dine, Houston (Texas), cost: 52, cuisines: French, Indian, Cafe, Seafood\nAccommodation: Sunny and Airy near Manhattan, Houston (Texas), cost: 499, room type: Entire home/apt, house rules: No pets, minimum nights: 2, maximum occupancy: 4\n\nNumber of people: 2\nTotal cost: (30 + 40 + 52) * 2 + 499 = 741\nAccommodation minimum nights: 2/2\n\nDays: 3\nCurrent City: from Houston (Texas) to Texarkana (Texas)\nTransportation: Flight Number: F3930024, from Houston to Texarkana, Departure Time: 17:56, Arrival Time: 19:00, cost: 63\nBreakfast: Earthen Spices, Houston (Texas), cost: 28, cuisines: Tea, Mexican, Bakery, BBQ, Fast Food\nAttraction: Museum of Regional History, Texarkana (Texas); Discovery Place Interactive Museum, Texarkana (Texas)\nLunch: Chawla's\u5b8a, Houston (Texas), cost: 26, cuisines: Chinese, Desserts, Bakery, Cafe, Mediterranean\nDinner: Columbia Restaurant, Texarkana (Texas), cost: 91, cuisines: Desserts, Tea, Pizza, Indian, Seafood\nAccommodation: Large 2.5 BR Apt In Park Slope, Texarkana (Texas), cost: 269, room type: Entire home/apt, house rules: No smoking & No visitors, minimum nights: 1, maximum occupancy: 3\n\nNumber of people: 2\nTotal cost: (63 + 28 + 26 + 91) * 2 + 269 = 694\nAccommodation minimum nights: 1/1\n\nDays: 4\nCurrent City: Texarkana (Texas)\nTransportation: -\nBreakfast: Big City Bread Cafe, Texarkana (Texas), cost: 61, cuisines: Cafe, Pizza, Bakery, BBQ\nAttraction: Spring Lake Park, Texarkana (Texas); Ace of Clubs House, Texarkana (Texas)\nLunch: Poets Cafe, Texarkana (Texas), cost: 88, cuisines: Chinese, Bakery, Indian, Desserts\nDinner: Club Mojo, Texarkana (Texas), cost: 49, cuisines: Desserts, Italian, BBQ, Cafe, American\nAccommodation: Large 2.5 BR Apt In Park Slope, Texarkana (Texas), cost: 269, room type: Entire home/apt, house rules: No smoking & No visitors, minimum nights: 1, maximum occupancy: 3\n\nNumber of people: 2\nTotal cost: (61 + 88 + 49) * 2 + 269 = 655\nAccommodation minimum nights: 2/1\n\nDays: 5\nCurrent City: from Texarkana (Texas) to Richmond\nTransportation: Self-driving, from Texarkana to Richmond, duration: 16 hours 8 mins, distance: 1,773 km, cost: 88\nBreakfast: -\nAttraction: -\nLunch: -\nDinner: -\nAccommodation: -\n\nNumber of people: 2\nTotal cost: 88 * 2 = 176\n\nTotal cost across all days: 1,420 + 741 + 694 + 655 + 176 = 3,686\nCuisines: The prompt specifies Chinese and Indian, and both of these cuisines have been represented in the restaurants chosen.", "gpt-4-1106-preview_direct_sole-planning_parsed_results": [{"day": 1, "current_city": "from Richmond to Houston", "transportation": "Flight Number: F4041372, from Richmond to Houston, Departure Time: 08:27, Arrival Time: 10:43", "breakfast": "-", "attraction": "-", "lunch": "Jalapenos, Houston", "dinner": "Sheetla Dhaba, Houston", "accommodation": "Sunny and Airy near Manhattan, Houston"}, {"day": 2, "current_city": "Houston", "transportation": "-", "breakfast": "Super Bakery, Houston", "attraction": "Space Center Houston, Houston;Houston Museum of Natural Science, Houston;", "lunch": "Royal Mart, Houston", "dinner": "The BrewMaster - The Mix Fine Dine, Houston", "accommodation": "Sunny and Airy near Manhattan, Houston"}, {"day": 3, "current_city": "from Houston to Texarkana", "transportation": "Flight Number: F3930024, from Houston to Texarkana, Departure Time: 17:56, Arrival Time: 19:00", "breakfast": "Earthen Spices, Houston", "attraction": "Museum of Regional History, Texarkana;Discovery Place Interactive Museum, Texarkana;", "lunch": "Chawla's\u5b8a, Houston", "dinner": "Columbia Restaurant, Texarkana", "accommodation": "Large 2.5 BR Apt In Park Slope, Texarkana"}, {"day": 4, "current_city": "Texarkana", "transportation": "-", "breakfast": "Big City Bread Cafe, Texarkana", "attraction": "Spring Lake Park, Texarkana;Ace of Clubs House, Texarkana;", "lunch": "Poets Cafe, Texarkana", "dinner": "Club Mojo, Texarkana", "accommodation": "Large 2.5 BR Apt In Park Slope, Texarkana"}, {"day": 5, "current_city": "from Texarkana to Richmond", "transportation": "Self-driving, from Texarkana to Richmond, duration: 16 hours 8 mins, distance: 1,773 km", "breakfast": "-", "attraction": "-", "lunch": "-", "dinner": "-", "accommodation": "-"}]}]