[{"gpt-4-1106-preview_direct_sole-planning_results": "Travel Plan:\n\nDays: 1\nCurrent City: from Rapid City to Colorado Springs (Colorado)\nTransportation: Self-driving, from Rapid City to Colorado Springs, duration: 6 hours 59 mins, distance: 735 km, cost: 36\nBreakfast: -\nAttraction: -\nLunch: -\nDinner: Raglan Road Irish Pub and Restaurant, Colorado Springs (Colorado), cost: 97, cuisines: Chinese, Bakery, Pizza, Mediterranean\nAccommodation: Large sunny park slope apartment, Colorado Springs (Colorado), cost: 82, room type: Entire home/apt, house rules: No smoking & No parties & No pets, minimum nights: 1, maximum occupancy: 3\n\nNumber of people: 7\nTotal cost: 36 * 7 + 97 * 7 + 82 * 3 = 1,149\nAccommodation minimum nights: 1/1\n\nDays: 2\nCurrent City: Colorado Springs (Colorado)\nTransportation: -\nBreakfast: Club Tokyo - Best Western Skycity Hotel, Colorado Springs (Colorado), cost: 64, cuisines: Tea, Bakery, Mediterranean, Fast Food\nAttraction: Garden of the Gods, Colorado Springs (Colorado)\nLunch: Derby, Colorado Springs (Colorado), cost: 67, cuisines: Desserts, Fast Food\nDinner: GoGourmet, Colorado Springs (Colorado), cost: 66, cuisines: Desserts, Bakery, Fast Food, Indian, Seafood\nAccommodation: HUGE CHEERFUL PRIVATE STUDIO SUITE WITH BACKYARD, Colorado Springs (Colorado), cost: 114, room type: Entire home/apt, house rules: No children under 10, minimum nights: 2, maximum occupancy: 2\n\nNumber of people: 7\nTotal cost: (64 + 67 + 66) * 7 + 114 * 4 = 2,065\nAccommodation minimum nights: 2/2\n\nDays: 3\nCurrent City: from Colorado Springs (Colorado) to Denver (Colorado)\nTransportation: Flight Number: F3822807, from Colorado Springs (Colorado) to Denver (Colorado), Departure Time: 09:08, Arrival Time: 10:22, cost: 24\nBreakfast: -\nAttraction: Denver Zoo, Denver (Colorado)\nLunch: The Fatty Bao - Asian Gastro Bar, Denver (Colorado), cost: 93, cuisines: Bakery, BBQ, Cafe, Indian, Seafood\nDinner: The Urban Socialite, Denver (Colorado), cost: 34, cuisines: Cafe, Indian, Desserts, Italian\nAccommodation: GORGEOUS Newly-Renovated 2-BR Flat, Denver (Colorado), cost: 731, room type: Entire home/apt, house rules: No parties, minimum nights: 30, maximum occupancy: 6\n\nNumber of people: 7\nTotal cost: 24 * 7 + (93 + 34) * 7 + 731 * 2 = 2,065\nAccommodation minimum nights: 1/30\n\nDays: 4\nCurrent City: Denver (Colorado)\nTransportation: -\nBreakfast: Tasty Fare, Denver (Colorado), cost: 79, cuisines: French, BBQ, Fast Food\nAttraction: Denver Art Museum, Denver (Colorado)\nLunch: Woods Spice, Denver (Colorado), cost: 69, cuisines: Tea, Cafe, Mexican, Desserts\nDinner: Rain Tree Grill, Denver (Colorado), cost: 94, cuisines: Tea, Mexican, BBQ, Italian\nAccommodation: GORGEOUS Newly-Renovated 2-BR Flat, Denver (Colorado), cost: 731, room type: Entire home/apt, house rules: No parties, minimum nights: 30, maximum occupancy: 6\n\nNumber of people: 7\nTotal cost: (79 + 69 + 94) * 7 + 731 * 2 = 2,731\nAccommodation minimum nights: 2/30\n\nDays: 5\nCurrent City: from Denver (Colorado) to Alamosa (Colorado)\nTransportation: Self-driving, from Denver to Alamosa, duration: 3 hours 40 mins, distance: 377 km, cost: 18\nBreakfast: -\nAttraction: San Luis Valley Museum | Alamosa, Alamosa (Colorado)\nLunch: Atlanta Highway Seafood Market, Alamosa (Colorado), cost: 68, cuisines: Fast Food, Desserts, Seafood\nDinner: Riverwalk Cafe, Alamosa (Colorado), cost: 97, cuisines: Tea, Pizza, Fast Food\nAccommodation: Comfortable studio suite in midtown Manhattan, Alamosa (Colorado), cost: 67, room type: Entire home/apt, house rules: No parties & No smoking & No visitors, minimum nights: 30, maximum occupancy: 2\n\nNumber of people: 7\nTotal cost: 18 * 7 + (68 + 97) * 7 + 67 * 4 = 1,579\nAccommodation minimum nights: 1/30\n\nDays: 6\nCurrent City: Alamosa (Colorado)\nTransportation: -\nBreakfast: Coffee to Cocktail Bar - Hyatt Place, Alamosa (Colorado), cost: 35, cuisines: Tea, Indian, Desserts, Italian\nAttraction: Alamosa National Wildlife Refuge and Visitor Center, Alamosa (Colorado)\nLunch: Burger Singh, Alamosa (Colorado), cost: 95, cuisines: Desserts, Tea, BBQ, Chinese, Seafood\nDinner: Street Foods by Punjab Grill, Alamosa (Colorado), cost: 55, cuisines: Pizza, BBQ, Fast Food, Chinese, Mediterranean\nAccommodation: Comfortable studio suite in midtown Manhattan, Alamosa (Colorado), cost: 67, room type: Entire home/apt, house rules: No parties & No smoking & No visitors, minimum nights: 30, maximum occupancy: 2\n\nNumber of people: 7\nTotal cost: (35 + 95 + 55) * 7 + 67 * 4 = 1,953\nAccommodation minimum nights: 2/30\n\nDays: 7\nCurrent City: from Alamosa (Colorado) to Rapid City\nTransportation: Self-driving, from Alamosa to Rapid City, duration: 9 hours 27 mins, distance: 998 km, cost: 49\nBreakfast: -\nAttraction: -\nLunch: -\nDinner: -\nAccommodation: -\n\nNumber of people: 7\nTotal cost: 49 * 7 = 343\n\nTotal cost across all days: 1,149 + 2,065 + 2,065 + 2,731 + 1,579 + 1,953 + 343 = 11,885\n\nCuisines: The prompt specifies no particular preference, and a variety of cuisines have been represented in the restaurants chosen.\n\nPlease note that the accommodation on Days 3, 4, and 5 has a minimum stay of 30 nights, which is not ideal for a 7-day travel plan. However, due to the lack of provided information on other accommodations, these were the only available options that fit the criteria of entire home/apt and within the budget. Adjustments to the accommodation should be made if more suitable options are available.", "gpt-4-1106-preview_direct_sole-planning_parsed_results": [{"day": 1, "current_city": "from Rapid City to Colorado Springs", "transportation": "Self-driving, from Rapid City to Colorado Springs, duration: 6 hours 59 mins, distance: 735 km", "breakfast": "-", "attraction": "-", "lunch": "-", "dinner": "Raglan Road Irish Pub and Restaurant, Colorado Springs", "accommodation": "Large sunny park slope apartment, Colorado Springs"}, {"day": 2, "current_city": "Colorado Springs", "transportation": "-", "breakfast": "Club Tokyo - Best Western Skycity Hotel, Colorado Springs", "attraction": "Garden of the Gods, Colorado Springs", "lunch": "Derby, Colorado Springs", "dinner": "GoGourmet, Colorado Springs", "accommodation": "HUGE CHEERFUL PRIVATE STUDIO SUITE WITH BACKYARD, Colorado Springs"}, {"day": 3, "current_city": "from Colorado Springs to Denver", "transportation": "Flight Number: F3822807, from Colorado Springs to Denver, Departure Time: 09:08, Arrival Time: 10:22", "breakfast": "-", "attraction": "Denver Zoo, Denver", "lunch": "The Fatty Bao - Asian Gastro Bar, Denver", "dinner": "The Urban Socialite, Denver", "accommodation": "GORGEOUS Newly-Renovated 2-BR Flat, Denver"}, {"day": 4, "current_city": "Denver", "transportation": "-", "breakfast": "Tasty Fare, Denver", "attraction": "Denver Art Museum, Denver", "lunch": "Woods Spice, Denver", "dinner": "Rain Tree Grill, Denver", "accommodation": "GORGEOUS Newly-Renovated 2-BR Flat, Denver"}, {"day": 5, "current_city": "from Denver to Alamosa", "transportation": "Self-driving, from Denver to Alamosa, duration: 3 hours 40 mins, distance: 377 km", "breakfast": "-", "attraction": "San Luis Valley Museum | Alamosa, Alamosa", "lunch": "Atlanta Highway Seafood Market, Alamosa", "dinner": "Riverwalk Cafe, Alamosa", "accommodation": "Comfortable studio suite in midtown Manhattan, Alamosa"}, {"day": 6, "current_city": "Alamosa", "transportation": "-", "breakfast": "Coffee to Cocktail Bar - Hyatt Place, Alamosa", "attraction": "Alamosa National Wildlife Refuge and Visitor Center, Alamosa", "lunch": "Burger Singh, Alamosa", "dinner": "Street Foods by Punjab Grill, Alamosa", "accommodation": "Comfortable studio suite in midtown Manhattan, Alamosa"}, {"day": 7, "current_city": "from Alamosa to Rapid City", "transportation": "Self-driving, from Alamosa to Rapid City, duration: 9 hours 27 mins, distance: 998 km", "breakfast": "-", "attraction": "-", "lunch": "-", "dinner": "-", "accommodation": "-"}]}]