[{"gpt-4-1106-preview_direct_sole-planning_results": "Travel Plan:\n\nDays: 1\nCurrent City: from St. Petersburg to Appleton\nTransportation: Flight Number: F3574992, from St. Petersburg to Appleton, Departure Time: 22:51, Arrival Time: 00:42, cost: 542\nBreakfast: -\nAttraction: -\nLunch: -\nDinner: -\nAccommodation: Cozy room + bright apartment + rooftop lounge, Appleton, cost: 666, maximum occupancy: 1, house rules: No smoking, minimum nights: 1\n\nNumber of people: 1\nTotal cost: 542 + 666 = 1,208\nAccommodation minimum nights: 1/1\n\nDays: 2\nCurrent City: Appleton\nTransportation: -\nBreakfast: Mathew's Cafe, Appleton, cost: 13, cuisines: Mexican, Bakery, BBQ, Cafe, Indian\nAttraction: The History Museum at the Castle, Appleton; Hearthstone Historic House Museum, Appleton\nLunch: Mikata Japanese Steakhouse, Appleton, cost: 72, cuisines: Cafe, Pizza, Bakery, Italian\nDinner: Brick 29, Appleton, cost: 97, cuisines: Desserts, Tea, BBQ, Cafe, American, Mediterranean\nAccommodation: Cozy room + bright apartment + rooftop lounge, Appleton, cost: 666, maximum occupancy: 1, house rules: No smoking, minimum nights: 1\n\nNumber of people: 1\nTotal cost: 13 + 72 + 97 + 666 = 848\nAccommodation minimum nights: 2/1\n\nDays: 3\nCurrent City: from Appleton to St. Petersburg\nTransportation: Flight Number: F3578689, from Appleton to St. Petersburg, Departure Time: 07:19, Arrival Time: 11:01, cost: 332\nBreakfast: -\nAttraction: -\nLunch: -\nDinner: -\nAccommodation: -\n\nNumber of people: 1\nTotal cost: 332\n\nTotal cost across all days: 1,208 + 848 + 332 = 2,388\n\nUnfortunately, the total cost of the travel plan exceeds the specified budget of $1,200. Adjustments are needed to meet the budget constraint. Since the accommodation cost is the highest, we can look for a less expensive option for the night stay in Appleton.\n\nAdjusted Travel Plan:\n\nDays: 1\nCurrent City: from St. Petersburg to Appleton\nTransportation: Flight Number: F3574992, from St. Petersburg to Appleton, Departure Time: 22:51, Arrival Time: 00:42, cost: 542\nBreakfast: -\nAttraction: -\nLunch: -\nDinner: -\nAccommodation: Stylish, convenient, renovated- 2 min to subway -, Appleton, cost: 64, maximum occupancy: 2, house rules: No smoking & No pets & No children under 10, minimum nights: 1\n\nNumber of people: 1\nTotal cost: 542 + 64 = 606\nAccommodation minimum nights: 1/1\n\nDays: 2\nCurrent City: Appleton\nTransportation: -\nBreakfast: Mathew's Cafe, Appleton, cost: 13, cuisines: Mexican, Bakery, BBQ, Cafe, Indian\nAttraction: The History Museum at the Castle, Appleton; Hearthstone Historic House Museum, Appleton\nLunch: Mikata Japanese Steakhouse, Appleton, cost: 72, cuisines: Cafe, Pizza, Bakery, Italian\nDinner: Brick 29, Appleton, cost: 97, cuisines: Desserts, Tea, BBQ, Cafe, American, Mediterranean\nAccommodation: Stylish, convenient, renovated- 2 min to subway -, Appleton, cost: 64, maximum occupancy: 2, house rules: No smoking & No pets & No children under 10, minimum nights: 1\n\nNumber of people: 1\nTotal cost: 13 + 72 + 97 + 64 = 246\nAccommodation minimum nights: 2/1\n\nDays: 3\nCurrent City: from Appleton to St. Petersburg\nTransportation: Flight Number: F3578689, from Appleton to St. Petersburg, Departure Time: 07:19, Arrival Time: 11:01, cost: 332\nBreakfast: -\nAttraction: -\nLunch: -\nDinner: -\nAccommodation: -\n\nNumber of people: 1\nTotal cost: 332\n\nTotal cost across all days: 606 + 246 + 332 = 1,184\n\nThe adjusted travel plan now fits within the budget of $1,200.", "gpt-4-1106-preview_direct_sole-planning_parsed_results": [{"day": 1, "current_city": "from St. Petersburg to Appleton", "transportation": "Flight Number: F3574992, from St. Petersburg to Appleton, Departure Time: 22:51, Arrival Time: 00:42", "breakfast": "-", "attraction": "-", "lunch": "-", "dinner": "-", "accommodation": "Stylish, convenient, renovated- 2 min to subway, Appleton"}, {"day": 2, "current_city": "Appleton", "transportation": "-", "breakfast": "Mathew's Cafe, Appleton", "attraction": "The History Museum at the Castle, Appleton;Hearthstone Historic House Museum, Appleton;", "lunch": "Mikata Japanese Steakhouse, Appleton", "dinner": "Brick 29, Appleton", "accommodation": "Stylish, convenient, renovated- 2 min to subway, Appleton"}, {"day": 3, "current_city": "from Appleton to St. Petersburg", "transportation": "Flight Number: F3578689, from Appleton to St. Petersburg, Departure Time: 07:19, Arrival Time: 11:01", "breakfast": "-", "attraction": "-", "lunch": "-", "dinner": "-", "accommodation": "-"}]}]