[{"gpt-4-1106-preview_direct_sole-planning_results": "Travel Plan:\n\nDays: 1\nCurrent City: from Providence to Orlando (Florida)\nTransportation: Flight Number: F4011165, from Providence to Orlando (Florida), Departure Time: 18:30, Arrival Time: 21:49, cost: 226\nBreakfast: -\nAttraction: -\nLunch: -\nDinner: Fuji Japanese Steakhouse, Orlando (Florida), cost: 75, cuisines: Tea, Bakery, Desserts\nAccommodation: Sixth Ave Chelsea, Studio Serviced Apartment, Orlando (Florida), cost: 70, room type: Entire home/apt, house rules: No visitors & No pets, minimum nights: 30, maximum occupancy: 3\n\nNumber of people: 1\nTotal cost: 226 + 75 + 70 = 371\nAccommodation minimum nights: 1/30\n\nDays: 2\nCurrent City: Orlando (Florida)\nTransportation: -\nBreakfast: Turquoise Villa, Orlando (Florida), cost: 55, cuisines: French, Bakery, BBQ, Fast Food\nAttraction: The Wheel at ICON Park, Orlando (Florida); SeaWorld Orlando, Orlando (Florida)\nLunch: The Tandoori Times, Orlando (Florida), cost: 84, cuisines: Tea, Cafe, BBQ, Italian\nDinner: Indochi Cafe & Restaurant, Orlando (Florida), cost: 72, cuisines: Pizza, French, Bakery, Fast Food, Indian, Seafood\nAccommodation: Sixth Ave Chelsea, Studio Serviced Apartment, Orlando (Florida), cost: 70, room type: Entire home/apt, house rules: No visitors & No pets, minimum nights: 30, maximum occupancy: 3\n\nNumber of people: 1\nTotal cost: 55 + 84 + 72 + 70 = 281\nAccommodation minimum nights: 2/30\n\nDays: 3\nCurrent City: from Orlando (Florida) to Providence\nTransportation: Flight Number: F4032376, from Orlando (Florida) to Providence, Departure Time: 19:22, Arrival Time: 21:58, cost: 280\nBreakfast: Chaayos, Orlando (Florida), cost: 73, cuisines: Tea, Cafe, Mexican\nAttraction: Universal Orlando Resort, Orlando (Florida)\nLunch: Nirula's Ice Cream, Orlando (Florida), cost: 46, cuisines: Tea, American, BBQ, Indian, Seafood\nDinner: -\nAccommodation: -\n\nNumber of people: 1\nTotal cost: 73 + 46 + 280 = 399\n\nTotal cost across all days: 371 + 281 + 399 = 1,051\nCuisines: The prompt specifies no particular cuisine preferences, and a variety of cuisines have been represented in the restaurants chosen.", "gpt-4-1106-preview_direct_sole-planning_parsed_results": [{"day": 1, "current_city": "from Providence to Orlando", "transportation": "Flight Number: F4011165, from Providence to Orlando, Departure Time: 18:30, Arrival Time: 21:49", "breakfast": "-", "attraction": "-", "lunch": "-", "dinner": "Fuji Japanese Steakhouse, Orlando", "accommodation": "Sixth Ave Chelsea, Studio Serviced Apartment, Orlando"}, {"day": 2, "current_city": "Orlando", "transportation": "-", "breakfast": "Turquoise Villa, Orlando", "attraction": "The Wheel at ICON Park, Orlando;SeaWorld Orlando, Orlando;", "lunch": "The Tandoori Times, Orlando", "dinner": "Indochi Cafe & Restaurant, Orlando", "accommodation": "Sixth Ave Chelsea, Studio Serviced Apartment, Orlando"}, {"day": 3, "current_city": "from Orlando to Providence", "transportation": "Flight Number: F4032376, from Orlando to Providence, Departure Time: 19:22, Arrival Time: 21:58", "breakfast": "Chaayos, Orlando", "attraction": "Universal Orlando Resort, Orlando", "lunch": "Nirula's Ice Cream, Orlando", "dinner": "-", "accommodation": "-"}]}]