[{"gpt-4-1106-preview_direct_sole-planning_results": "Travel Plan:\n\nDays: 1\nCurrent City: from Valparaiso to Belleville\nTransportation: Flight Number: F3579167, from Valparaiso to Belleville, Departure Time: 17:23, Arrival Time: 19:06, cost: 211\nBreakfast: -\nAttraction: -\nLunch: -\nDinner: Shanghai Cafe, Belleville, cost: 96, cuisines: Tea, Pizza, Bakery, Fast Food, Chinese\nAccommodation: 1 Bedroom/1 Bath Apt in Hudson Yards/Midtown West, Belleville, cost: 610, room type: Entire home/apt, house rules: No parties & No pets, minimum nights: 1, maximum occupancy: 2\n\nNumber of people: 8\nTotal cost: (211 + 96) * 8 + 610 * 4 = 3,448\nAccommodation minimum nights: 1/1\n\nDays: 2\nCurrent City: Belleville\nTransportation: -\nBreakfast: Ajeet Fast Food Corner, Belleville, cost: 91, cuisines: Tea, Bakery, Fast Food, American, Mediterranean, Seafood\nAttraction: Labor & Industrial Museum, Belleville; National Shrine of Our Lady of the Snows, Belleville\nLunch: Super Restaurant, Belleville, cost: 96, cuisines: Tea, American, BBQ, Italian\nDinner: RollsKing, Belleville, cost: 27, cuisines: Chinese, Bakery, BBQ, Pizza\nAccommodation: 1 Bedroom/1 Bath Apt in Hudson Yards/Midtown West, Belleville, cost: 610, room type: Entire home/apt, house rules: No parties & No pets, minimum nights: 1, maximum occupancy: 2\n\nNumber of people: 8\nTotal cost: (91 + 96 + 27) * 8 + 610 * 4 = 3,304\nAccommodation minimum nights: 2/1\n\nDays: 3\nCurrent City: from Belleville to Valparaiso\nTransportation: Flight Number: F3571908, from Belleville to Valparaiso, Departure Time: 17:15, Arrival Time: 18:55, cost: 124\nBreakfast: -\nAttraction: -\nLunch: -\nDinner: -\nAccommodation: -\n\nNumber of people: 8\nTotal cost: 124 * 8 = 992\n\nTotal cost across all days: 3,448 + 3,304 + 992 = 7,744\n\nUnfortunately, the total cost exceeds the specified budget of $6,600. Adjustments need to be made to fit within the budget. Here is an adjusted plan:\n\nAdjusted Travel Plan:\n\nDays: 1\nCurrent City: from Valparaiso to Belleville\nTransportation: Flight Number: F3579167, from Valparaiso to Belleville, Departure Time: 17:23, Arrival Time: 19:06, cost: 211\nBreakfast: -\nAttraction: -\nLunch: -\nDinner: Shanghai Cafe, Belleville, cost: 96, cuisines: Tea, Pizza, Bakery, Fast Food, Chinese\nAccommodation: Cozy, Belleville, cost: 184, room type: Private room, house rules: No visitors & No smoking & No children under 10, minimum nights: 1, maximum occupancy: 2\n\nNumber of people: 8\nTotal cost: (211 + 96) * 8 + 184 * 4 = 2,872\nAccommodation minimum nights: 1/1\n\nDays: 2\nCurrent City: Belleville\nTransportation: -\nBreakfast: Ajeet Fast Food Corner, Belleville, cost: 91, cuisines: Tea, Bakery, Fast Food, American, Mediterranean, Seafood\nAttraction: Labor & Industrial Museum, Belleville; National Shrine of Our Lady of the Snows, Belleville\nLunch: Super Restaurant, Belleville, cost: 96, cuisines: Tea, American, BBQ, Italian\nDinner: RollsKing, Belleville, cost: 27, cuisines: Chinese, Bakery, BBQ, Pizza\nAccommodation: Cozy, Belleville, cost: 184, room type: Private room, house rules: No visitors & No smoking & No children under 10, minimum nights: 1, maximum occupancy: 2\n\nNumber of people: 8\nTotal cost: (91 + 96 + 27) * 8 + 184 * 4 = 2,728\nAccommodation minimum nights: 2/1\n\nDays: 3\nCurrent City: from Belleville to Valparaiso\nTransportation: Flight Number: F3571908, from Belleville to Valparaiso, Departure Time: 17:15, Arrival Time: 18:55, cost: 124\nBreakfast: -\nAttraction: -\nLunch: -\nDinner: -\nAccommodation: -\n\nNumber of people: 8\nTotal cost: 124 * 8 = 992\n\nTotal cost across all days: 2,872 + 2,728 + 992 = 6,592\n\nCuisines: The prompt specifies Chinese and American, and both of these cuisines have been represented in the restaurants chosen.", "gpt-4-1106-preview_direct_sole-planning_parsed_results": [{"day": 1, "current_city": "from Valparaiso to Belleville", "transportation": "Flight Number: F3579167, from Valparaiso to Belleville, Departure Time: 17:23, Arrival Time: 19:06", "breakfast": "-", "attraction": "-", "lunch": "-", "dinner": "Shanghai Cafe, Belleville", "accommodation": "Cozy, Belleville"}, {"day": 2, "current_city": "Belleville", "transportation": "-", "breakfast": "Ajeet Fast Food Corner, Belleville", "attraction": "Labor & Industrial Museum, Belleville;National Shrine of Our Lady of the Snows, Belleville;", "lunch": "Super Restaurant, Belleville", "dinner": "RollsKing, Belleville", "accommodation": "Cozy, Belleville"}, {"day": 3, "current_city": "from Belleville to Valparaiso", "transportation": "Flight Number: F3571908, from Belleville to Valparaiso, Departure Time: 17:15, Arrival Time: 18:55", "breakfast": "-", "attraction": "-", "lunch": "-", "dinner": "-", "accommodation": "-"}]}]