[{"gpt-4-1106-preview_direct_sole-planning_results": "Travel Plan:\n\nDays: 1\nCurrent City: from Devils Lake to Alamosa (Colorado)\nTransportation: Self-driving, from Devils Lake to Alamosa, duration: 17 hours 26 mins, distance: 1,811 km, cost: 90\nBreakfast: -\nAttraction: -\nLunch: -\nDinner: Atlanta Highway Seafood Market, Alamosa (Colorado), cost: 68, cuisines: Fast Food, Desserts, Seafood\nAccommodation: Comfortable studio suite in midtown Manhattan, Alamosa (Colorado), cost: 67, room type: Entire home/apt, house rules: No parties & No smoking & No visitors, minimum nights: 30, maximum occupancy: 2\n\nNumber of people: 1\nTotal cost: 90 + 68 + 67 = 225\nAccommodation minimum nights: 1/30\n\nDays: 2\nCurrent City: Alamosa (Colorado)\nTransportation: -\nBreakfast: Riverwalk Cafe, Alamosa (Colorado), cost: 97, cuisines: Tea, Pizza, Fast Food\nAttraction: San Luis Valley Museum, Alamosa (Colorado); Rio Grande Farm Park, Alamosa (Colorado)\nLunch: Burger Singh, Alamosa (Colorado), cost: 95, cuisines: Desserts, Tea, BBQ, Chinese, Seafood\nDinner: Cafe LazyMojo, Alamosa (Colorado), cost: 26, cuisines: Tea, Pizza, American, Fast Food\nAccommodation: Comfortable studio suite in midtown Manhattan, Alamosa (Colorado), cost: 67, room type: Entire home/apt, house rules: No parties & No smoking & No visitors, minimum nights: 30, maximum occupancy: 2\n\nNumber of people: 1\nTotal cost: 97 + 95 + 26 + 67 = 285\nAccommodation minimum nights: 2/30\n\nDays: 3\nCurrent City: from Alamosa (Colorado) to Grand Junction (Colorado)\nTransportation: Self-driving, from Alamosa to Grand Junction, duration: 4 hours 29 mins, distance: 396 km, cost: 19\nBreakfast: -\nAttraction: Museum of the West, Grand Junction (Colorado); Eureka! McConnell Science Museum, Grand Junction (Colorado)\nLunch: Austin's BBQ and Oyster Bar, Grand Junction (Colorado), cost: 15, cuisines: Tea, Bakery, Fast Food, Indian, Seafood\nDinner: 2 Dog, Grand Junction (Colorado), cost: 29, cuisines: Desserts, BBQ, Fast Food, Cafe, American\nAccommodation: NYC Apartment near Central Park!, Grand Junction (Colorado), cost: 1118, room type: Entire home/apt, house rules: No children under 10, minimum nights: 3, maximum occupancy: 5\n\nNumber of people: 1\nTotal cost: 19 + 15 + 29 + 1118 = 1181\nAccommodation minimum nights: 1/3\n\nDays: 4\nCurrent City: Grand Junction (Colorado)\nTransportation: -\nBreakfast: Thakur Bakers, Grand Junction (Colorado), cost: 100, cuisines: French, Pizza, Cafe, BBQ\nAttraction: Bananas Fun Park, Grand Junction (Colorado); Western Colorado Botanical Gardens, Grand Junction (Colorado)\nLunch: Pind Balluchi, Grand Junction (Colorado), cost: 17, cuisines: Fast Food, Chinese, Seafood\nDinner: Cocoa Tree, Grand Junction (Colorado), cost: 68, cuisines: Tea, Chinese, Cafe, Fast Food\nAccommodation: NYC Apartment near Central Park!, Grand Junction (Colorado), cost: 1118, room type: Entire home/apt, house rules: No children under 10, minimum nights: 3, maximum occupancy: 5\n\nNumber of people: 1\nTotal cost: 100 + 17 + 68 + 1118 = 1303\nAccommodation minimum nights: 2/3\n\nDays: 5\nCurrent City: from Grand Junction (Colorado) to Gunnison (Colorado)\nTransportation: Self-driving, from Grand Junction to Gunnison, duration: 2 hours 27 mins, distance: 200 km, cost: 10\nBreakfast: -\nAttraction: Gunnison Pioneer Museum, Gunnison (Colorado); Gunnison Valley Observatory, Gunnison (Colorado)\nLunch: SALT, Gunnison (Colorado), cost: 44, cuisines: Tea, Chinese, BBQ\nDinner: Mocha, Gunnison (Colorado), cost: 30, cuisines: Tea, Cafe, Pizza, BBQ\nAccommodation: Full-size loft bed in East Village, Gunnison (Colorado), cost: 104, room type: Private room, house rules: No visitors & No pets & No parties, minimum nights: 1, maximum occupancy: 1\n\nNumber of people: 1\nTotal cost: 10 + 44 + 30 + 104 = 188\nAccommodation minimum nights: 1/1\n\nDays: 6\nCurrent City: Gunnison (Colorado)\nTransportation: -\nBreakfast: Happy Joe's Pizza & Ice Cream, Gunnison (Colorado), cost: 74, cuisines: Desserts, Italian, Bakery, Indian, Seafood\nAttraction: Hartman Rocks, Gunnison (Colorado); Black Canyon of the Gunnison National Park, Gunnison (Colorado)\nLunch: Paradise Inn, Gunnison (Colorado), cost: 99, cuisines: BBQ, Bakery, Desserts\nDinner: Tughlaq, Gunnison (Colorado), cost: 18, cuisines: French, Pizza, Fast Food\nAccommodation: Full-size loft bed in East Village, Gunnison (Colorado), cost: 104, room type: Private room, house rules: No visitors & No pets & No parties, minimum nights: 1, maximum occupancy: 1\n\nNumber of people: 1\nTotal cost: 74 + 99 + 18 + 104 = 295\nAccommodation minimum nights: 2/1\n\nDays: 7\nCurrent City: from Gunnison (Colorado) to Devils Lake\nTransportation: Self-driving, from Gunnison to Devils Lake, duration: 17 hours 30 mins, distance: 1,881 km, cost: 94\nBreakfast: -\nAttraction: -\nLunch: -\nDinner: -\nAccommodation: -\n\nNumber of people: 1\nTotal cost: 94\n\nTotal cost across all days: 225 + 285 + 1181 + 1303 + 188 + 295 + 94 = 3571\n\nNote: The total cost exceeds the budget by $71. Adjustments to the accommodation or dining options may be necessary to stay within budget.", "gpt-4-1106-preview_direct_sole-planning_parsed_results": [{"day": 1, "current_city": "from Devils Lake to Alamosa (Colorado)", "transportation": "Self-driving, from Devils Lake to Alamosa, duration: 17 hours 26 mins, distance: 1,811 km", "breakfast": "-", "attraction": "-", "lunch": "-", "dinner": "Atlanta Highway Seafood Market, Alamosa (Colorado)", "accommodation": "Comfortable studio suite in midtown Manhattan, Alamosa (Colorado)"}, {"day": 2, "current_city": "Alamosa (Colorado)", "transportation": "-", "breakfast": "Riverwalk Cafe, Alamosa (Colorado)", "attraction": "San Luis Valley Museum, Alamosa (Colorado);Rio Grande Farm Park, Alamosa (Colorado);", "lunch": "Burger Singh, Alamosa (Colorado)", "dinner": "Cafe LazyMojo, Alamosa (Colorado)", "accommodation": "Comfortable studio suite in midtown Manhattan, Alamosa (Colorado)"}, {"day": 3, "current_city": "from Alamosa (Colorado) to Grand Junction (Colorado)", "transportation": "Self-driving, from Alamosa to Grand Junction, duration: 4 hours 29 mins, distance: 396 km", "breakfast": "-", "attraction": "Museum of the West, Grand Junction (Colorado);Eureka! McConnell Science Museum, Grand Junction (Colorado);", "lunch": "Austin's BBQ and Oyster Bar, Grand Junction (Colorado)", "dinner": "2 Dog, Grand Junction (Colorado)", "accommodation": "NYC Apartment near Central Park!, Grand Junction (Colorado)"}, {"day": 4, "current_city": "Grand Junction (Colorado)", "transportation": "-", "breakfast": "Thakur Bakers, Grand Junction (Colorado)", "attraction": "Bananas Fun Park, Grand Junction (Colorado);Western Colorado Botanical Gardens, Grand Junction (Colorado);", "lunch": "Pind Balluchi, Grand Junction (Colorado)", "dinner": "Cocoa Tree, Grand Junction (Colorado)", "accommodation": "NYC Apartment near Central Park!, Grand Junction (Colorado)"}, {"day": 5, "current_city": "from Grand Junction (Colorado) to Gunnison (Colorado)", "transportation": "Self-driving, from Grand Junction to Gunnison, duration: 2 hours 27 mins, distance: 200 km", "breakfast": "-", "attraction": "Gunnison Pioneer Museum, Gunnison (Colorado);Gunnison Valley Observatory, Gunnison (Colorado);", "lunch": "SALT, Gunnison (Colorado)", "dinner": "Mocha, Gunnison (Colorado)", "accommodation": "Full-size loft bed in East Village, Gunnison (Colorado)"}, {"day": 6, "current_city": "Gunnison (Colorado)", "transportation": "-", "breakfast": "Happy Joe's Pizza & Ice Cream, Gunnison (Colorado)", "attraction": "Hartman Rocks, Gunnison (Colorado);Black Canyon of the Gunnison National Park, Gunnison (Colorado);", "lunch": "Paradise Inn, Gunnison (Colorado)", "dinner": "Tughlaq, Gunnison (Colorado)", "accommodation": "Full-size loft bed in East Village, Gunnison (Colorado)"}, {"day": 7, "current_city": "from Gunnison (Colorado) to Devils Lake", "transportation": "Self-driving, from Gunnison to Devils Lake, duration: 17 hours 30 mins, distance: 1,881 km", "breakfast": "-", "attraction": "-", "lunch": "-", "dinner": "-", "accommodation": "-"}]}]