[{"gpt-4-1106-preview_direct_sole-planning_results": "Travel Plan:\n\nDays: 1\nCurrent City: from Los Angeles to Fort Myers (Florida)\nTransportation: Flight Number: F3895072, from Los Angeles to Fort Myers (Florida), Departure Time: 10:21, Arrival Time: 17:55, cost: 990\nBreakfast: -\nAttraction: -\nLunch: -\nDinner: The Refinery, Fort Myers (Florida), cost: 22, cuisines: Bakery, Indian, Seafood\nAccommodation: Quiet and beautiful apartment near central park, Fort Myers (Florida), cost: 930, room type: Entire home/apt, house rules: No parties & No smoking, minimum nights: 7, maximum occupancy: 9\n\nNumber of people: 1\nTotal cost: 990 + 22 + 930 = 1,942\nAccommodation minimum nights: 1/7\n\nDays: 2\nCurrent City: Fort Myers (Florida)\nTransportation: -\nBreakfast: Al Mukhtar Bakery, Fort Myers (Florida), cost: 54, cuisines: BBQ, Tea, American, Desserts\nAttraction: Edison & Ford Winter Estates, Fort Myers (Florida)\nLunch: Haunted, Fort Myers (Florida), cost: 50, cuisines: Desserts, French, Fast Food, Cafe, Seafood\nDinner: Eggers Madhouse, Fort Myers (Florida), cost: 76, cuisines: BBQ, Mediterranean, Seafood\nAccommodation: Quiet and beautiful apartment near central park, Fort Myers (Florida), cost: 930, room type: Entire home/apt, house rules: No parties & No smoking, minimum nights: 7, maximum occupancy: 9\n\nNumber of people: 1\nTotal cost: 54 + 50 + 76 + 930 = 1,110\nAccommodation minimum nights: 2/7\n\nDays: 3\nCurrent City: from Fort Myers (Florida) to Jacksonville (Florida)\nTransportation: Self-driving, from Fort Myers to Jacksonville, duration: 4 hours 52 mins, distance: 510 km, cost: 25\nBreakfast: -\nAttraction: River District, Fort Myers (Florida)\nLunch: Maachh Bhaat, Fort Myers (Florida), cost: 66, cuisines: Desserts, Pizza, Fast Food, Mediterranean, Seafood\nDinner: The Refinery, Jacksonville (Florida), cost: 22, cuisines: Bakery, Indian, Seafood\nAccommodation: Huge Loft - Heart of Williamsburg, Jacksonville (Florida), cost: 518, room type: Entire home/apt, house rules: No smoking, minimum nights: 2, maximum occupancy: 4\n\nNumber of people: 1\nTotal cost: 25 + 66 + 22 + 518 = 631\nAccommodation minimum nights: 1/2\n\nDays: 4\nCurrent City: Jacksonville (Florida)\nTransportation: -\nBreakfast: Villa Gargano, Jacksonville (Florida), cost: 51, cuisines: Tea, American, Desserts\nAttraction: Jacksonville Zoo and Gardens, Jacksonville (Florida)\nLunch: Pirates' House Restaurant, Jacksonville (Florida), cost: 59, cuisines: Chinese, Pizza, BBQ\nDinner: Goose Feathers Cafe and Bakery, Jacksonville (Florida), cost: 57, cuisines: Tea, Fast Food, Italian\nAccommodation: Huge Loft - Heart of Williamsburg, Jacksonville (Florida), cost: 518, room type: Entire home/apt, house rules: No smoking, minimum nights: 2, maximum occupancy: 4\n\nNumber of people: 1\nTotal cost: 51 + 59 + 57 + 518 = 685\nAccommodation minimum nights: 2/2\n\nDays: 5\nCurrent City: from Jacksonville (Florida) to Orlando (Florida)\nTransportation: Self-driving, from Jacksonville to Orlando, duration: 2 hours 7 mins, distance: 227 km, cost: 11\nBreakfast: -\nAttraction: Southbank Riverwalk, Jacksonville (Florida)\nLunch: Ashoka Restaurant, Jacksonville (Florida), cost: 11, cuisines: Desserts, Mexican, Bakery, BBQ, Fast Food\nDinner: Fuji Japanese Steakhouse, Orlando (Florida), cost: 75, cuisines: Tea, Bakery, Desserts\nAccommodation: Private furnished bedroom in Williamsburg, Orlando (Florida), cost: 179, room type: Private room, house rules: No parties & No smoking & No children under 10, minimum nights: 5, maximum occupancy: 1\n\nNumber of people: 1\nTotal cost: 11 + 11 + 75 + 179 = 276\nAccommodation minimum nights: 1/5\n\nDays: 6\nCurrent City: Orlando (Florida)\nTransportation: -\nBreakfast: Turquoise Villa, Orlando (Florida), cost: 55, cuisines: French, Bakery, BBQ, Fast Food\nAttraction: SeaWorld Orlando, Orlando (Florida)\nLunch: The Tandoori Times, Orlando (Florida), cost: 84, cuisines: Tea, Cafe, BBQ, Italian\nDinner: Crust N Cakes, Orlando (Florida), cost: 61, cuisines: Tea, Cafe, Indian, BBQ\nAccommodation: Private furnished bedroom in Williamsburg, Orlando (Florida), cost: 179, room type: Private room, house rules: No parties & No smoking & No children under 10, minimum nights: 5, maximum occupancy: 1\n\nNumber of people: 1\nTotal cost: 55 + 84 + 61 + 179 = 379\nAccommodation minimum nights: 2/5\n\nDays: 7\nCurrent City: from Orlando (Florida) to Los Angeles\nTransportation: Flight Number: F3770225, from Orlando (Florida) to Los Angeles, Departure Time: 05:58, Arrival Time: 08:21, cost: 683\nBreakfast: -\nAttraction: -\nLunch: -\nDinner: -\nAccommodation: -\n\nNumber of people: 1\nTotal cost: 683\n\nTotal cost across all days: 1,942 + 1,110 + 631 + 685 + 276 + 379 + 683 = 5,706\n\nUnfortunately, the total cost exceeds the specified budget of $4,700. Adjustments are needed to meet the budget constraint.", "gpt-4-1106-preview_direct_sole-planning_parsed_results": [{"day": 1, "current_city": "from Los Angeles to Fort Myers (Florida)", "transportation": "Flight Number: F3895072, from Los Angeles to Fort Myers (Florida), Departure Time: 10:21, Arrival Time: 17:55", "breakfast": "-", "attraction": "-", "lunch": "-", "dinner": "The Refinery, Fort Myers (Florida)", "accommodation": "Quiet and beautiful apartment near central park, Fort Myers (Florida)"}, {"day": 2, "current_city": "Fort Myers (Florida)", "transportation": "-", "breakfast": "Al Mukhtar Bakery, Fort Myers (Florida)", "attraction": "Edison & Ford Winter Estates, Fort Myers (Florida)", "lunch": "Haunted, Fort Myers (Florida)", "dinner": "Eggers Madhouse, Fort Myers (Florida)", "accommodation": "Quiet and beautiful apartment near central park, Fort Myers (Florida)"}, {"day": 3, "current_city": "from Fort Myers (Florida) to Jacksonville (Florida)", "transportation": "Self-driving, from Fort Myers to Jacksonville, duration: 4 hours 52 mins, distance: 510 km", "breakfast": "-", "attraction": "River District, Fort Myers (Florida)", "lunch": "Maachh Bhaat, Fort Myers (Florida)", "dinner": "The Refinery, Jacksonville (Florida)", "accommodation": "Huge Loft - Heart of Williamsburg, Jacksonville (Florida)"}, {"day": 4, "current_city": "Jacksonville (Florida)", "transportation": "-", "breakfast": "Villa Gargano, Jacksonville (Florida)", "attraction": "Jacksonville Zoo and Gardens, Jacksonville (Florida)", "lunch": "Pirates' House Restaurant, Jacksonville (Florida)", "dinner": "Goose Feathers Cafe and Bakery, Jacksonville (Florida)", "accommodation": "Huge Loft - Heart of Williamsburg, Jacksonville (Florida)"}, {"day": 5, "current_city": "from Jacksonville (Florida) to Orlando (Florida)", "transportation": "Self-driving, from Jacksonville to Orlando, duration: 2 hours 7 mins, distance: 227 km", "breakfast": "-", "attraction": "Southbank Riverwalk, Jacksonville (Florida)", "lunch": "Ashoka Restaurant, Jacksonville (Florida)", "dinner": "Fuji Japanese Steakhouse, Orlando (Florida)", "accommodation": "Private furnished bedroom in Williamsburg, Orlando (Florida)"}, {"day": 6, "current_city": "Orlando (Florida)", "transportation": "-", "breakfast": "Turquoise Villa, Orlando (Florida)", "attraction": "SeaWorld Orlando, Orlando (Florida)", "lunch": "The Tandoori Times, Orlando (Florida)", "dinner": "Crust N Cakes, Orlando (Florida)", "accommodation": "Private furnished bedroom in Williamsburg, Orlando (Florida)"}, {"day": 7, "current_city": "from Orlando (Florida) to Los Angeles", "transportation": "Flight Number: F3770225, from Orlando (Florida) to Los Angeles, Departure Time: 05:58, Arrival Time: 08:21", "breakfast": "-", "attraction": "-", "lunch": "-", "dinner": "-", "accommodation": "-"}]}]