[{"gpt-4-1106-preview_direct_sole-planning_results": "Travel Plan:\n\nDays: 1\nCurrent City: from Provo to San Diego (California)\nTransportation: Self-driving, from Provo to San Diego, duration: 10 hours 13 mins, distance: 1,137 km, cost: 56 * 5 = 280\nBreakfast: -\nAttraction: -\nLunch: -\nDinner: Burgrill, San Diego (California), cost: 54 * 5 = 270, cuisines: Desserts, Tea, Pizza, Fast Food, Chinese\nAccommodation: Luxury 4BR Home, Spacious & Central to Trains, San Diego (California), cost: 392 * 5 = 1960, maximum occupancy: 3, house rules: No parties, minimum nights: 3\n\nNumber of people: 5\nTotal cost: 280 + 270 + 1960 = 2510\nAccommodation minimum nights: 1/3\n\nDays: 2\nCurrent City: San Diego (California)\nTransportation: -\nBreakfast: Open Yard, San Diego (California), cost: 33 * 5 = 165, cuisines: Chinese, Pizza, Cafe, Desserts\nAttraction: Balboa Park, San Diego (California); USS Midway Museum, San Diego (California)\nLunch: Gopala, San Diego (California), cost: 98 * 5 = 490, cuisines: Pizza, Mexican, BBQ, American, Seafood\nDinner: The Lost Mughal, San Diego (California), cost: 74 * 5 = 370, cuisines: Tea, Cafe, Italian\nAccommodation: Luxury 4BR Home, Spacious & Central to Trains, San Diego (California), cost: 392 * 5 = 1960, maximum occupancy: 3, house rules: No parties, minimum nights: 3\n\nNumber of people: 5\nTotal cost: 165 + 490 + 370 + 1960 = 2985\nAccommodation minimum nights: 2/3\n\nDays: 3\nCurrent City: from San Diego (California) to Santa Ana (California)\nTransportation: Self-driving, from San Diego to Santa Ana, duration: 1 hour 26 mins, distance: 144 km, cost: 7 * 5 = 35\nBreakfast: Burger King, San Diego (California), cost: 20 * 5 = 100, cuisines: Pizza, Italian, French, Fast Food, Seafood\nAttraction: Bowers Museum, Santa Ana (California); Santa Ana Zoo, Santa Ana (California)\nLunch: The Bee's Knees, Santa Ana (California), cost: 12 * 5 = 60, cuisines: Cafe, Pizza, Desserts, Seafood\nDinner: Caf\u6106 Tu Tu Tango, Santa Ana (California), cost: 88 * 5 = 440, cuisines: Tea, Pizza, French, Bakery, Cafe, American\nAccommodation: Sun-filled Artist Home 1BR in convenient L.I.C !, Santa Ana (California), cost: 1065 * 5 = 5325, maximum occupancy: 5, house rules: No children under 10, minimum nights: 2\n\nNumber of people: 5\nTotal cost: 35 + 100 + 60 + 440 + 5325 = 5960\nAccommodation minimum nights: 1/2\n\nDays: 4\nCurrent City: Santa Ana (California)\nTransportation: -\nBreakfast: The Chai Cafe, Santa Ana (California), cost: 52 * 5 = 260, cuisines: Tea, American, Desserts\nAttraction: Heritage Museum of Orange County, Santa Ana (California); Discovery Science Center, Santa Ana (California)\nLunch: Shahi Chicken Corner, Santa Ana (California), cost: 55 * 5 = 275, cuisines: Bakery, BBQ, Italian\nDinner: Eram Rooftop, Santa Ana (California), cost: 77 * 5 = 385, cuisines: Cafe, Bakery, American, BBQ\nAccommodation: Sun-filled Artist Home 1BR in convenient L.I.C !, Santa Ana (California), cost: 1065 * 5 = 5325, maximum occupancy: 5, house rules: No children under 10, minimum nights: 2\n\nNumber of people: 5\nTotal cost: 260 + 275 + 385 + 5325 = 6245\nAccommodation minimum nights: 2/2\n\nDays: 5\nCurrent City: from Santa Ana (California) to Bakersfield (California)\nTransportation: Self-driving, from Santa Ana to Bakersfield, duration: 2 hours 31 mins, distance: 231 km, cost: 11 * 5 = 55\nBreakfast: Jimmie's Hot Dogs, Santa Ana (California), cost: 96 * 5 = 480, cuisines: Fast Food, BBQ, Italian\nAttraction: Kern County Museum, Bakersfield (California); California Living Museum, Bakersfield (California)\nLunch: Kihei Caffe, Bakersfield (California), cost: 47 * 5 = 235, cuisines: Fast Food, BBQ, Desserts, Italian\nDinner: Tybee Island Social Club, Bakersfield (California), cost: 83 * 5 = 415, cuisines: Tea, Bakery, Fast Food, Cafe, American\nAccommodation: Bright & spacious Room in Harlem, Bakersfield (California), cost: 815 * 5 = 4075, maximum occupancy: 2, house rules: No visitors & No children under 10, minimum nights: 1\n\nNumber of people: 5\nTotal cost: 55 + 480 + 235 + 415 + 4075 = 5260\nAccommodation minimum nights: 1/1\n\nDays: 6\nCurrent City: Bakersfield (California)\nTransportation: -\nBreakfast: DePalma's Italian Cafe - East Side, Bakersfield (California), cost: 12 * 5 = 60, cuisines: Chinese, Pizza, Bakery\nAttraction: Buena Vista Museum of Natural History & Science, Bakersfield (California); Central Park at Mill Creek, Bakersfield (California)\nLunch: Pita Pit, Bakersfield (California), cost: 23 * 5 = 115, cuisines: Tea, Pizza, Italian, Bakery, Seafood\nDinner: Momo-Cha, Bakersfield (California), cost: 68 * 5 = 340, cuisines: Desserts, Pizza, BBQ, Fast Food, Mediterranean\nAccommodation: Bright & spacious Room in Harlem, Bakersfield (California), cost: 815 * 5 = 4075, maximum occupancy: 2, house rules: No visitors & No children under 10, minimum nights: 1\n\nNumber of people: 5\nTotal cost: 60 + 115 + 340 + 4075 = 4590\nAccommodation minimum nights: 2/1\n\nDays: 7\nCurrent City: from Bakersfield to Provo\nTransportation: Self-driving, from Bakersfield to Provo, duration: 9 hours 34 mins, distance: 1,063 km, cost: 53 * 5 = 265\nBreakfast: -\nAttraction: -\nLunch: -\nDinner: -\nAccommodation: -\n\nNumber of people: 5\nTotal cost: 265\n\nTotal cost across all days: 2510 + 2985 + 5960 + 6245 + 5260 + 4590 + 265 = 27815\n\nUnfortunately, the total cost of $27,815 exceeds the budget of $14,900. Additionally, the accommodations selected do not allow parties, which is a requirement of the query. Therefore, this travel plan does not meet the constraints and needs to be revised to fit within the budget and meet all specified requirements.", "gpt-4-1106-preview_direct_sole-planning_parsed_results": [{"day": 1, "current_city": "from Provo to San Diego", "transportation": "Self-driving, from Provo to San Diego, duration: 10 hours 13 mins, distance: 1,137 km", "breakfast": "-", "attraction": "-", "lunch": "-", "dinner": "Burgrill, San Diego", "accommodation": "Luxury 4BR Home, Spacious & Central to Trains, San Diego"}, {"day": 2, "current_city": "San Diego", "transportation": "-", "breakfast": "Open Yard, San Diego", "attraction": "Balboa Park, San Diego;USS Midway Museum, San Diego;", "lunch": "Gopala, San Diego", "dinner": "The Lost Mughal, San Diego", "accommodation": "Luxury 4BR Home, Spacious & Central to Trains, San Diego"}, {"day": 3, "current_city": "from San Diego to Santa Ana", "transportation": "Self-driving, from San Diego to Santa Ana, duration: 1 hour 26 mins, distance: 144 km", "breakfast": "Burger King, San Diego", "attraction": "Bowers Museum, Santa Ana;Santa Ana Zoo, Santa Ana;", "lunch": "The Bee's Knees, Santa Ana", "dinner": "Caf\u00e9 Tu Tu Tango, Santa Ana", "accommodation": "Sun-filled Artist Home 1BR in convenient L.I.C !, Santa Ana"}, {"day": 4, "current_city": "Santa Ana", "transportation": "-", "breakfast": "The Chai Cafe, Santa Ana", "attraction": "Heritage Museum of Orange County, Santa Ana;Discovery Science Center, Santa Ana;", "lunch": "Shahi Chicken Corner, Santa Ana", "dinner": "Eram Rooftop, Santa Ana", "accommodation": "Sun-filled Artist Home 1BR in convenient L.I.C !, Santa Ana"}, {"day": 5, "current_city": "from Santa Ana to Bakersfield", "transportation": "Self-driving, from Santa Ana to Bakersfield, duration: 2 hours 31 mins, distance: 231 km", "breakfast": "Jimmie's Hot Dogs, Santa Ana", "attraction": "Kern County Museum, Bakersfield;California Living Museum, Bakersfield;", "lunch": "Kihei Caffe, Bakersfield", "dinner": "Tybee Island Social Club, Bakersfield", "accommodation": "Bright & spacious Room in Harlem, Bakersfield"}, {"day": 6, "current_city": "Bakersfield", "transportation": "-", "breakfast": "DePalma's Italian Cafe - East Side, Bakersfield", "attraction": "Buena Vista Museum of Natural History & Science, Bakersfield;Central Park at Mill Creek, Bakersfield;", "lunch": "Pita Pit, Bakersfield", "dinner": "Momo-Cha, Bakersfield", "accommodation": "Bright & spacious Room in Harlem, Bakersfield"}, {"day": 7, "current_city": "from Bakersfield to Provo", "transportation": "Self-driving, from Bakersfield to Provo, duration: 9 hours 34 mins, distance: 1,063 km", "breakfast": "-", "attraction": "-", "lunch": "-", "dinner": "-", "accommodation": "-"}]}]