[{"gpt-4-1106-preview_direct_sole-planning_results": "Travel Plan:\n\nDays: 1\nCurrent City: from Akron to Augusta (Georgia)\nTransportation: Self-driving, from Akron to Augusta, duration: 9 hours 36 mins, distance: 1,031 km, cost: 51\nBreakfast: -\nAttraction: -\nLunch: -\nDinner: B Merrell's, Augusta (Georgia), cost: 74, cuisines: Tea, Pizza, Desserts, Fast Food\nAccommodation: Large, 2fl/2bdrm Williamsburg Apt, Augusta (Georgia), cost: 445, room type: Entire home/apt, house rules: No visitors, minimum nights: 3, maximum occupancy: 2\n\nNumber of people: 2\nTotal cost: 51 * 2 + 74 * 2 + 445 = 695\nAccommodation minimum nights: 1/3\n\nDays: 2\nCurrent City: Augusta (Georgia)\nTransportation: -\nBreakfast: Fish Tales Lakeside Grille, Augusta (Georgia), cost: 37, cuisines: Tea, Cafe, Bakery, Desserts\nAttraction: Phinizy Swamp Nature Park, Augusta (Georgia); Augusta Riverwalk, Augusta (Georgia)\nLunch: Vinny Vanucchi's, Augusta (Georgia), cost: 45, cuisines: Desserts, Fast Food, Chinese, Indian, Seafood\nDinner: The Charcoal Chimney, Augusta (Georgia), cost: 86, cuisines: Tea, Fast Food, BBQ, Italian\nAccommodation: Large, 2fl/2bdrm Williamsburg Apt, Augusta (Georgia), cost: 445, room type: Entire home/apt, house rules: No visitors, minimum nights: 3, maximum occupancy: 2\n\nNumber of people: 2\nTotal cost: (37 + 45 + 86) * 2 + 445 = 786\nAccommodation minimum nights: 2/3\n\nDays: 3\nCurrent City: from Augusta to Decatur (Georgia)\nTransportation: Self-driving, from Augusta to Decatur, duration: 2 hours 19 mins, distance: 229 km, cost: 11\nBreakfast: -\nAttraction: Augusta Museum of History, Augusta (Georgia)\nLunch: Karari Kurry, Augusta (Georgia), cost: 29, cuisines: Bakery, Indian, Cafe, Fast Food\nDinner: Madhuban Restaurant - Welcome Hotel Rama International, Decatur (Georgia), cost: 47, cuisines: Pizza, Bakery, Seafood\nAccommodation: The Heart of the Lower East Side!, Decatur (Georgia), cost: 587, room type: Entire home/apt, house rules: No children under 10, minimum nights: 2, maximum occupancy: 2\n\nNumber of people: 2\nTotal cost: 11 * 2 + (29 + 47) * 2 + 587 = 761\nAccommodation minimum nights: 1/2\n\nDays: 4\nCurrent City: Decatur (Georgia)\nTransportation: -\nBreakfast: Tandoori Hut, Decatur (Georgia), cost: 82, cuisines: Pizza, American, Indian, Fast Food\nAttraction: DeKalb History Center Museum, Decatur (Georgia); Glenlake Park, Decatur (Georgia)\nLunch: Joey's Pizza, Decatur (Georgia), cost: 69, cuisines: Tea, Pizza, Bakery, Chinese, Seafood\nDinner: Carnatic Cafe, Decatur (Georgia), cost: 66, cuisines: Cafe, Indian, Desserts\nAccommodation: The Heart of the Lower East Side!, Decatur (Georgia), cost: 587, room type: Entire home/apt, house rules: No children under 10, minimum nights: 2, maximum occupancy: 2\n\nNumber of people: 2\nTotal cost: (82 + 69 + 66) * 2 + 587 = 1011\nAccommodation minimum nights: 2/2\n\nDays: 5\nCurrent City: from Decatur to Atlanta (Georgia)\nTransportation: Self-driving, from Decatur to Atlanta, duration: 19 mins, distance: 13.0 km, cost: 0\nBreakfast: -\nAttraction: Atlanta Botanical Garden, Atlanta (Georgia); World of Coca-Cola, Atlanta (Georgia)\nLunch: Saffron, Atlanta (Georgia), cost: 39, cuisines: Tea, Cafe, Fast Food, Seafood\nDinner: Baba Au Rhum, Atlanta (Georgia), cost: 27, cuisines: Desserts, Pizza, Mexican, BBQ, Fast Food\nAccommodation: Bright, Modern, Clean, Spacious, Brooklyn Home, Atlanta (Georgia), cost: 1034, room type: Entire home/apt, house rules: No children under 10, minimum nights: 3, maximum occupancy: 4\n\nNumber of people: 2\nTotal cost: (39 + 27) * 2 + 1034 = 1166\nAccommodation minimum nights: 1/3\n\nDays: 6\nCurrent City: Atlanta (Georgia)\nTransportation: -\nBreakfast: Asian Bistro, Atlanta (Georgia), cost: 27, cuisines: Tea, Bakery, Seafood\nAttraction: Georgia Aquarium, Atlanta (Georgia); Piedmont Park, Atlanta (Georgia)\nLunch: Chef Style, Atlanta (Georgia), cost: 59, cuisines: Pizza, American, Desserts, Seafood\nDinner: Pizza Central, Atlanta (Georgia), cost: 75, cuisines: Cafe, Bakery, BBQ, Fast Food, Chinese, Indian\nAccommodation: Bright, Modern, Clean, Spacious, Brooklyn Home, Atlanta (Georgia), cost: 1034, room type: Entire home/apt, house rules: No children under 10, minimum nights: 3, maximum occupancy: 4\n\nNumber of people: 2\nTotal cost: (27 + 59 + 75) * 2 + 1034 = 1346\nAccommodation minimum nights: 2/3\n\nDays: 7\nCurrent City: from Atlanta to Akron\nTransportation: Self-driving, from Atlanta to Akron, duration: 10 hours 10 mins, distance: 1,114 km, cost: 55\nBreakfast: -\nAttraction: -\nLunch: -\nDinner: -\nAccommodation: -\n\nNumber of people: 2\nTotal cost: 55 * 2 = 110\n\nTotal cost across all days: 695 + 786 + 761 + 1011 + 1166 + 1346 + 110 = 5875\n\nCuisines: The prompt specifies American and Chinese, and both of these cuisines have been represented in the restaurants chosen.", "gpt-4-1106-preview_direct_sole-planning_parsed_results": [{"day": 1, "current_city": "from Akron to Augusta (Georgia)", "transportation": "Self-driving, from Akron to Augusta, duration: 9 hours 36 mins, distance: 1,031 km", "breakfast": "-", "attraction": "-", "lunch": "-", "dinner": "B Merrell's, Augusta (Georgia)", "accommodation": "Large, 2fl/2bdrm Williamsburg Apt, Augusta (Georgia)"}, {"day": 2, "current_city": "Augusta (Georgia)", "transportation": "-", "breakfast": "Fish Tales Lakeside Grille, Augusta (Georgia)", "attraction": "Phinizy Swamp Nature Park, Augusta (Georgia);Augusta Riverwalk, Augusta (Georgia);", "lunch": "Vinny Vanucchi's, Augusta (Georgia)", "dinner": "The Charcoal Chimney, Augusta (Georgia)", "accommodation": "Large, 2fl/2bdrm Williamsburg Apt, Augusta (Georgia)"}, {"day": 3, "current_city": "from Augusta to Decatur (Georgia)", "transportation": "Self-driving, from Augusta to Decatur, duration: 2 hours 19 mins, distance: 229 km", "breakfast": "-", "attraction": "Augusta Museum of History, Augusta (Georgia)", "lunch": "Karari Kurry, Augusta (Georgia)", "dinner": "Madhuban Restaurant - Welcome Hotel Rama International, Decatur (Georgia)", "accommodation": "The Heart of the Lower East Side!, Decatur (Georgia)"}, {"day": 4, "current_city": "Decatur (Georgia)", "transportation": "-", "breakfast": "Tandoori Hut, Decatur (Georgia)", "attraction": "DeKalb History Center Museum, Decatur (Georgia);Glenlake Park, Decatur (Georgia);", "lunch": "Joey's Pizza, Decatur (Georgia)", "dinner": "Carnatic Cafe, Decatur (Georgia)", "accommodation": "The Heart of the Lower East Side!, Decatur (Georgia)"}, {"day": 5, "current_city": "from Decatur to Atlanta (Georgia)", "transportation": "Self-driving, from Decatur to Atlanta, duration: 19 mins, distance: 13.0 km", "breakfast": "-", "attraction": "Atlanta Botanical Garden, Atlanta (Georgia);World of Coca-Cola, Atlanta (Georgia);", "lunch": "Saffron, Atlanta (Georgia)", "dinner": "Baba Au Rhum, Atlanta (Georgia)", "accommodation": "Bright, Modern, Clean, Spacious, Brooklyn Home, Atlanta (Georgia)"}, {"day": 6, "current_city": "Atlanta (Georgia)", "transportation": "-", "breakfast": "Asian Bistro, Atlanta (Georgia)", "attraction": "Georgia Aquarium, Atlanta (Georgia);Piedmont Park, Atlanta (Georgia);", "lunch": "Chef Style, Atlanta (Georgia)", "dinner": "Pizza Central, Atlanta (Georgia)", "accommodation": "Bright, Modern, Clean, Spacious, Brooklyn Home, Atlanta (Georgia)"}, {"day": 7, "current_city": "from Atlanta to Akron", "transportation": "Self-driving, from Atlanta to Akron, duration: 10 hours 10 mins, distance: 1,114 km", "breakfast": "-", "attraction": "-", "lunch": "-", "dinner": "-", "accommodation": "-"}]}]