[{"gpt-4-1106-preview_direct_sole-planning_results": "Travel Plan:\n\nDays: 1\nCurrent City: from Detroit to San Diego (California)\nTransportation: Flight Number: F3528556, from Detroit to San Diego (California), Departure Time: 08:33, Arrival Time: 10:36, cost: 720\nBreakfast: -\nAttraction: Balboa Park, San Diego (California), cost: 0 (assuming no entrance fee)\nLunch: Open Yard, San Diego (California), cost: 33, cuisines: Chinese, Pizza, Cafe, Desserts\nDinner: Burger King, San Diego (California), cost: 20, cuisines: Pizza, Italian, French, Fast Food, Seafood\nAccommodation: Spacious Room in Large 2 Bedroom Prewar Apartment, San Diego (California), cost: 585, maximum occupancy: 2, house rules: No parties & No visitors, minimum nights: 1\n\nNumber of people: 1\nTotal cost: 720 + 33 + 20 + 585 = 1,358\nAccommodation minimum nights: 1/1\n\nDays: 2\nCurrent City: San Diego (California)\nTransportation: -\nBreakfast: Jetha Lal Ka Dhabha, San Diego (California), cost: 22, cuisines: Tea, Cafe, Indian, Italian\nAttraction: USS Midway Museum, San Diego (California), cost: 0 (assuming no entrance fee)\nLunch: Gopala, San Diego (California), cost: 98, cuisines: Pizza, Mexican, BBQ, American, Seafood\nDinner: Bikaner Sweets, San Diego (California), cost: 37, cuisines: Bakery, Pizza, Indian, Fast Food\nAccommodation: Spacious Room in Large 2 Bedroom Prewar Apartment, San Diego (California), cost: 585, maximum occupancy: 2, house rules: No parties & No visitors, minimum nights: 1\n\nNumber of people: 1\nTotal cost: 22 + 98 + 37 + 585 = 742\nAccommodation minimum nights: 2/1\n\nDays: 3\nCurrent City: from San Diego to Detroit\nTransportation: Flight Number: F3519973, from San Diego to Detroit, Departure Time: 22:22, Arrival Time: 05:24, cost: 968\nBreakfast: Harry's Bar + Cafe, San Diego (California), cost: 55, cuisines: Fast Food, French, Cafe, Seafood\nAttraction: San Diego Zoo, San Diego (California), cost: 0 (assuming no entrance fee)\nLunch: The Lost Mughal, San Diego (California), cost: 74, cuisines: Tea, Cafe, Italian\nDinner: -\nAccommodation: -\n\nNumber of people: 1\nTotal cost: 55 + 74 + 968 = 1,097\n\nTotal cost across all days: 1,358 + 742 + 1,097 = 3,197\n\nNote: The total cost exceeds the budget of $3,000. To adjust the plan within the budget, we can consider changing the accommodation to a less expensive option or choosing more budget-friendly meal options. Here's an adjusted plan with a different accommodation:\n\nAdjusted Days: 1\nAccommodation: Harlem Garden Oasis in New York City Brownstone, San Diego (California), cost: 368, maximum occupancy: 3, house rules: No visitors, minimum nights: 31\n\nAdjusted Days: 2\nAccommodation: Harlem Garden Oasis in New York City Brownstone, San Diego (California), cost: 368, maximum occupancy: 3, house rules: No visitors, minimum nights: 31\n\nAdjusted Total cost across all days: 720 + 33 + 20 + 368 + 22 + 98 + 37 + 368 + 55 + 74 + 968 = 2,663\n\nCuisines: The prompt specifies no particular preference, and a variety of cuisines have been represented in the restaurants chosen.\n\nPlease note that the accommodation chosen on the adjusted plan does not meet the minimum nights requirement, but this is a hypothetical adjustment to fit the budget constraint. In reality, the traveller would need to find an accommodation option that allows for a shorter stay.", "gpt-4-1106-preview_direct_sole-planning_parsed_results": [{"day": 1, "current_city": "from Detroit to San Diego", "transportation": "Flight Number: F3528556, from Detroit to San Diego, Departure Time: 08:33, Arrival Time: 10:36", "breakfast": "-", "attraction": "Balboa Park, San Diego;", "lunch": "Open Yard, San Diego", "dinner": "Burger King, San Diego", "accommodation": "Spacious Room in Large 2 Bedroom Prewar Apartment, San Diego"}, {"day": 2, "current_city": "San Diego", "transportation": "-", "breakfast": "Jetha Lal Ka Dhabha, San Diego", "attraction": "USS Midway Museum, San Diego;", "lunch": "Gopala, San Diego", "dinner": "Bikaner Sweets, San Diego", "accommodation": "Spacious Room in Large 2 Bedroom Prewar Apartment, San Diego"}, {"day": 3, "current_city": "from San Diego to Detroit", "transportation": "Flight Number: F3519973, from San Diego to Detroit, Departure Time: 22:22, Arrival Time: 05:24", "breakfast": "Harry's Bar + Cafe, San Diego", "attraction": "San Diego Zoo, San Diego;", "lunch": "The Lost Mughal, San Diego", "dinner": "-", "accommodation": "-"}, {"day": 1, "current_city": "San Diego", "transportation": "-", "breakfast": "-", "attraction": "-", "lunch": "-", "dinner": "-", "accommodation": "Harlem Garden Oasis in New York City Brownstone, San Diego"}, {"day": 2, "current_city": "San Diego", "transportation": "-", "breakfast": "-", "attraction": "-", "lunch": "-", "dinner": "-", "accommodation": "Harlem Garden Oasis in New York City Brownstone, San Diego"}]}]