[{"gpt-4-1106-preview_direct_sole-planning_results": "Travel Plan:\n\nDays: 1\nCurrent City: from Medford to Grand Junction (Colorado)\nTransportation: Self-driving, from Medford to Grand Junction, duration: 15 hours 49 mins, distance: 1,640 km, cost: 82\nBreakfast: -\nAttraction: -\nLunch: -\nDinner: Austin's BBQ and Oyster Bar, Grand Junction (Colorado), cost: 15, cuisines: Tea, Bakery, Fast Food, Indian, Seafood\nAccommodation: NYC Apartment near Central Park!, Grand Junction (Colorado), cost: 1118, room type: Entire home/apt, house rules: No children under 10, minimum nights: 3, maximum occupancy: 5\n\nNumber of people: 1\nTotal cost: 82 + 15 + 1118 = 1,215\nAccommodation minimum nights: 1/3\n\nDays: 2\nCurrent City: Grand Junction (Colorado)\nTransportation: -\nBreakfast: 2 Dog, Grand Junction (Colorado), cost: 29, cuisines: Desserts, BBQ, Fast Food, Cafe, American\nAttraction: Museum of the West, Museums of Western Colorado; Eureka! McConnell Science Museum\nLunch: Thakur Bakers, Grand Junction (Colorado), cost: 100, cuisines: French, Pizza, Cafe, BBQ\nDinner: Pind Balluchi, Grand Junction (Colorado), cost: 17, cuisines: Fast Food, Chinese, Seafood\nAccommodation: NYC Apartment near Central Park!, Grand Junction (Colorado), cost: 1118, room type: Entire home/apt, house rules: No children under 10, minimum nights: 3, maximum occupancy: 5\n\nNumber of people: 1\nTotal cost: 29 + 100 + 17 + 1118 = 1,264\nAccommodation minimum nights: 2/3\n\nDays: 3\nCurrent City: from Grand Junction (Colorado) to Durango (Colorado)\nTransportation: Self-driving, from Grand Junction to Durango, duration: 3 hours 33 mins, distance: 269 km, cost: 13\nBreakfast: -\nAttraction: Animas Museum; The Powerhouse\nLunch: Samurai Japanese Cuisine & Sushi Bar, Durango (Colorado), cost: 67, cuisines: Bakery, Desserts, Fast Food\nDinner: Dub's High on the Hog, Durango (Colorado), cost: 98, cuisines: Tea, Italian, French, Cafe, Seafood\nAccommodation: UES studio walking distance to central park, Durango (Colorado), cost: 997, room type: Entire home/apt, house rules: No pets, minimum nights: 7, maximum occupancy: 6\n\nNumber of people: 1\nTotal cost: 13 + 67 + 98 + 997 = 1,175\nAccommodation minimum nights: 1/7\n\nDays: 4\nCurrent City: Durango (Colorado)\nTransportation: -\nBreakfast: Standard Chicken Point, Durango (Colorado), cost: 50, cuisines: Mexican, Indian, BBQ, Seafood\nAttraction: Durango Wildlife Museum; Whitewater Park\nLunch: Hot & Tasty Chinese Food, Durango (Colorado), cost: 17, cuisines: Tea, French, Fast Food\nDinner: Chickenette, Durango (Colorado), cost: 31, cuisines: Tea, Pizza, Desserts, Fast Food\nAccommodation: UES studio walking distance to central park, Durango (Colorado), cost: 997, room type: Entire home/apt, house rules: No pets, minimum nights: 7, maximum occupancy: 6\n\nNumber of people: 1\nTotal cost: 50 + 17 + 31 + 997 = 1,095\nAccommodation minimum nights: 2/7\n\nDays: 5\nCurrent City: from Durango (Colorado) to Gunnison (Colorado)\nTransportation: Self-driving, from Durango to Gunnison, duration: 3 hours 47 mins, distance: 275 km, cost: 13\nBreakfast: -\nAttraction: I.O.O.F. Park; Jorgensen Park\nLunch: Happy Joe's Pizza & Ice Cream, Gunnison (Colorado), cost: 74, cuisines: Desserts, Italian, Bakery, Indian, Seafood\nDinner: SALT, Gunnison (Colorado), cost: 44, cuisines: Tea, Chinese, BBQ\nAccommodation: Full-size loft bed in East Village, Gunnison (Colorado), cost: 104, room type: Private room, house rules: No visitors & No pets & No parties, minimum nights: 1, maximum occupancy: 1\n\nNumber of people: 1\nTotal cost: 13 + 74 + 44 + 104 = 235\nAccommodation minimum nights: 1/1\n\nDays: 6\nCurrent City: Gunnison (Colorado)\nTransportation: -\nBreakfast: Mocha, Gunnison (Colorado), cost: 30, cuisines: Tea, Cafe, Pizza, BBQ\nAttraction: Gunnison Pioneer Museum; Gunnison Valley Observatory\nLunch: Paradise Inn, Gunnison (Colorado), cost: 99, cuisines: BBQ, Bakery, Desserts\nDinner: Tughlaq, Gunnison (Colorado), cost: 18, cuisines: French, Pizza, Fast Food\nAccommodation: Full-size loft bed in East Village, Gunnison (Colorado), cost: 104, room type: Private room, house rules: No visitors & No pets & No parties, minimum nights: 1, maximum occupancy: 1\n\nNumber of people: 1\nTotal cost: 30 + 99 + 18 + 104 = 251\nAccommodation minimum nights: 2/1\n\nDays: 7\nCurrent City: from Gunnison (Colorado) to Medford\nTransportation: Self-driving, from Gunnison to Medford, duration: 18 hours 4 mins, distance: 1,832 km, cost: 91\nBreakfast: -\nAttraction: -\nLunch: -\nDinner: -\nAccommodation: -\n\nNumber of people: 1\nTotal cost: 91\n\nTotal cost across all days: 1,215 + 1,264 + 1,175 + 1,095 + 235 + 251 + 91 = 5,326\n\nUnfortunately, the total cost of $5,326 exceeds the specified budget of $2,400. Adjustments to the plan, such as choosing more affordable accommodations or dining options, are necessary to meet the budget constraints.", "gpt-4-1106-preview_direct_sole-planning_parsed_results": [{"day": 1, "current_city": "from Medford to Grand Junction (Colorado)", "transportation": "Self-driving, from Medford to Grand Junction, duration: 15 hours 49 mins, distance: 1,640 km", "breakfast": "-", "attraction": "-", "lunch": "-", "dinner": "Austin's BBQ and Oyster Bar, Grand Junction (Colorado)", "accommodation": "NYC Apartment near Central Park!, Grand Junction (Colorado)"}, {"day": 2, "current_city": "Grand Junction (Colorado)", "transportation": "-", "breakfast": "2 Dog, Grand Junction (Colorado)", "attraction": "Museum of the West, Grand Junction (Colorado);Eureka! McConnell Science Museum, Grand Junction (Colorado);", "lunch": "Thakur Bakers, Grand Junction (Colorado)", "dinner": "Pind Balluchi, Grand Junction (Colorado)", "accommodation": "NYC Apartment near Central Park!, Grand Junction (Colorado)"}, {"day": 3, "current_city": "from Grand Junction (Colorado) to Durango (Colorado)", "transportation": "Self-driving, from Grand Junction to Durango, duration: 3 hours 33 mins, distance: 269 km", "breakfast": "-", "attraction": "Animas Museum, Durango (Colorado);The Powerhouse, Durango (Colorado);", "lunch": "Samurai Japanese Cuisine & Sushi Bar, Durango (Colorado)", "dinner": "Dub's High on the Hog, Durango (Colorado)", "accommodation": "UES studio walking distance to central park, Durango (Colorado)"}, {"day": 4, "current_city": "Durango (Colorado)", "transportation": "-", "breakfast": "Standard Chicken Point, Durango (Colorado)", "attraction": "Durango Wildlife Museum, Durango (Colorado);Whitewater Park, Durango (Colorado);", "lunch": "Hot & Tasty Chinese Food, Durango (Colorado)", "dinner": "Chickenette, Durango (Colorado)", "accommodation": "UES studio walking distance to central park, Durango (Colorado)"}, {"day": 5, "current_city": "from Durango (Colorado) to Gunnison (Colorado)", "transportation": "Self-driving, from Durango to Gunnison, duration: 3 hours 47 mins, distance: 275 km", "breakfast": "-", "attraction": "I.O.O.F. Park, Gunnison (Colorado);Jorgensen Park, Gunnison (Colorado);", "lunch": "Happy Joe's Pizza & Ice Cream, Gunnison (Colorado)", "dinner": "SALT, Gunnison (Colorado)", "accommodation": "Full-size loft bed in East Village, Gunnison (Colorado)"}, {"day": 6, "current_city": "Gunnison (Colorado)", "transportation": "-", "breakfast": "Mocha, Gunnison (Colorado)", "attraction": "Gunnison Pioneer Museum, Gunnison (Colorado);Gunnison Valley Observatory, Gunnison (Colorado);", "lunch": "Paradise Inn, Gunnison (Colorado)", "dinner": "Tughlaq, Gunnison (Colorado)", "accommodation": "Full-size loft bed in East Village, Gunnison (Colorado)"}, {"day": 7, "current_city": "from Gunnison (Colorado) to Medford", "transportation": "Self-driving, from Gunnison to Medford, duration: 18 hours 4 mins, distance: 1,832 km", "breakfast": "-", "attraction": "-", "lunch": "-", "dinner": "-", "accommodation": "-"}]}]