[{"gpt-4-1106-preview_direct_sole-planning_results": "Travel Plan:\n\nDays: 1\nCurrent City: from Akron to Tampa (Florida)\nTransportation: Flight Number: F3620346, from Akron to Tampa (Florida), Departure Time: 19:40, Arrival Time: 21:47, cost: 434\nBreakfast: -\nAttraction: -\nLunch: -\nDinner: Kobe Hibachi & Sushi, Tampa (Florida), cost: 63, cuisines: Desserts, French, BBQ, Bakery, Seafood\nAccommodation: Lovely Guestroom in Elevator Building, Tampa (Florida), cost: 359, maximum occupancy: 2, house rules: No smoking & No visitors & No parties, minimum nights: 2\n\nNumber of people: 2\nTotal cost: (434 + 63) * 2 + 359 = 1,353\nAccommodation minimum nights: 1/2\n\nDays: 2\nCurrent City: Tampa (Florida)\nTransportation: -\nBreakfast: Club India Cafe & Restaurant, Tampa (Florida), cost: 98, cuisines: Desserts, Tea, Bakery, Cafe, American\nAttraction: The Florida Aquarium, Tampa (Florida); Busch Gardens Tampa Bay, Tampa (Florida)\nLunch: Gulati, Tampa (Florida), cost: 12, cuisines: Chinese, Bakery, Pizza\nDinner: Gallery Caf\u6106 - Hyatt Place, Tampa (Florida), cost: 42, cuisines: Tea, French, BBQ, Desserts\nAccommodation: Lovely Guestroom in Elevator Building, Tampa (Florida), cost: 359, maximum occupancy: 2, house rules: No smoking & No visitors & No parties, minimum nights: 2\n\nNumber of people: 2\nTotal cost: (98 + 12 + 42) * 2 + 359 = 661\nAccommodation minimum nights: 2/2\n\nDays: 3\nCurrent City: from Tampa (Florida) to Akron\nTransportation: Flight Number: F3620300, from Tampa (Florida) to Akron, Departure Time: 17:00, Arrival Time: 19:18, cost: 438\nBreakfast: -\nAttraction: -\nLunch: -\nDinner: -\nAccommodation: -\n\nNumber of people: 2\nTotal cost: 438 * 2 = 876\n\nTotal cost across all days: 1,353 + 661 + 876 = 2,890\n\nUnfortunately, the total cost exceeds the specified budget of $2,500. To adjust the plan within the budget, we can consider the following changes:\n\n- Opt for a less expensive accommodation option.\n- Choose more budget-friendly restaurants for meals.\n\nRevised Travel Plan with Budget Consideration:\n\nDays: 1\nCurrent City: from Akron to Tampa (Florida)\nTransportation: Flight Number: F3620346, from Akron to Tampa (Florida), Departure Time: 19:40, Arrival Time: 21:47, cost: 434\nBreakfast: -\nAttraction: -\nLunch: -\nDinner: Giani's, Tampa (Florida), cost: 19, cuisines: Desserts, Fast Food, Cafe, American, Seafood\nAccommodation: Bright duplex apartment, Tampa (Florida), cost: 164, maximum occupancy: 3, house rules: No children under 10, minimum nights: 2\n\nNumber of people: 2\nTotal cost: (434 + 19) * 2 + 164 = 1,070\nAccommodation minimum nights: 1/2\n\nDays: 2\nCurrent City: Tampa (Florida)\nTransportation: -\nBreakfast: G Lounge, Tampa (Florida), cost: 33, cuisines: Tea, Cafe, Indian\nAttraction: The Florida Aquarium, Tampa (Florida); Busch Gardens Tampa Bay, Tampa (Florida)\nLunch: Gulati, Tampa (Florida), cost: 12, cuisines: Chinese, Bakery, Pizza\nDinner: Gallery Caf\u6106 - Hyatt Place, Tampa (Florida), cost: 42, cuisines: Tea, French, BBQ, Desserts\nAccommodation: Bright duplex apartment, Tampa (Florida), cost: 164, maximum occupancy: 3, house rules: No children under 10, minimum nights: 2\n\nNumber of people: 2\nTotal cost: (33 + 12 + 42) * 2 + 164 = 338\nAccommodation minimum nights: 2/2\n\nDays: 3\nCurrent City: from Tampa (Florida) to Akron\nTransportation: Flight Number: F3620300, from Tampa (Florida) to Akron, Departure Time: 17:00, Arrival Time: 19:18, cost: 438\nBreakfast: -\nAttraction: -\nLunch: -\nDinner: -\nAccommodation: -\n\nNumber of people: 2\nTotal cost: 438 * 2 = 876\n\nTotal revised cost across all days: 1,070 + 338 + 876 = 2,284\n\nThe revised plan is within the budget of $2,500, and it includes Chinese and American cuisines as requested.", "gpt-4-1106-preview_direct_sole-planning_parsed_results": [{"day": 1, "current_city": "from Akron to Tampa (Florida)", "transportation": "Flight Number: F3620346, from Akron to Tampa (Florida), Departure Time: 19:40, Arrival Time: 21:47", "breakfast": "-", "attraction": "-", "lunch": "-", "dinner": "Kobe Hibachi & Sushi, Tampa (Florida)", "accommodation": "Lovely Guestroom in Elevator Building, Tampa (Florida)"}, {"day": 2, "current_city": "Tampa (Florida)", "transportation": "-", "breakfast": "Club India Cafe & Restaurant, Tampa (Florida)", "attraction": "The Florida Aquarium, Tampa (Florida);Busch Gardens Tampa Bay, Tampa (Florida);", "lunch": "Gulati, Tampa (Florida)", "dinner": "Gallery Caf\u6106 - Hyatt Place, Tampa (Florida)", "accommodation": "Lovely Guestroom in Elevator Building, Tampa (Florida)"}, {"day": 3, "current_city": "from Tampa (Florida) to Akron", "transportation": "Flight Number: F3620300, from Tampa (Florida) to Akron, Departure Time: 17:00, Arrival Time: 19:18", "breakfast": "-", "attraction": "-", "lunch": "-", "dinner": "-", "accommodation": "-"}, {"day": 1, "current_city": "from Akron to Tampa (Florida)", "transportation": "Flight Number: F3620346, from Akron to Tampa (Florida), Departure Time: 19:40, Arrival Time: 21:47", "breakfast": "-", "attraction": "-", "lunch": "-", "dinner": "Giani's, Tampa (Florida)", "accommodation": "Bright duplex apartment, Tampa (Florida)"}, {"day": 2, "current_city": "Tampa (Florida)", "transportation": "-", "breakfast": "G Lounge, Tampa (Florida)", "attraction": "The Florida Aquarium, Tampa (Florida);Busch Gardens Tampa Bay, Tampa (Florida);", "lunch": "Gulati, Tampa (Florida)", "dinner": "Gallery Caf\u6106 - Hyatt Place, Tampa (Florida)", "accommodation": "Bright duplex apartment, Tampa (Florida)"}, {"day": 3, "current_city": "from Tampa (Florida) to Akron", "transportation": "Flight Number: F3620300, from Tampa (Florida) to Akron, Departure Time: 17:00, Arrival Time: 19:18", "breakfast": "-", "attraction": "-", "lunch": "-", "dinner": "-", "accommodation": "-"}]}]