[{"gpt-4-1106-preview_direct_sole-planning_results": "Travel Plan:\n\nDays: 1\nCurrent City: from Louisville to Fort Myers (Florida)\nTransportation: Flight Number: F3987658, from Louisville to Fort Myers (Florida), Departure Time: 06:54, Arrival Time: 09:10, cost: 292\nBreakfast: -\nAttraction: Edison & Ford Winter Estates, Fort Myers (Florida)\nLunch: The Refinery, Fort Myers (Florida), cost: 22, cuisines: Bakery, Indian, Seafood\nDinner: Al Mukhtar Bakery, Fort Myers (Florida), cost: 54, cuisines: BBQ, Tea, American, Desserts\nAccommodation: Quiet and beautiful apartment near central park, Fort Myers (Florida), cost: 930, maximum occupancy: 9, house rules: No parties & No smoking, minimum nights: 7\n\nNumber of people: 1\nTotal cost: 292 + 22 + 54 + 930 = 1,298\nAccommodation minimum nights: 1/7\n\nDays: 2\nCurrent City: Fort Myers (Florida)\nTransportation: -\nBreakfast: Haunted, Fort Myers (Florida), cost: 50, cuisines: Desserts, French, Fast Food, Cafe, Seafood\nAttraction: Six Mile Cypress Slough Preserve, Fort Myers (Florida)\nLunch: Eggers Madhouse, Fort Myers (Florida), cost: 76, cuisines: BBQ, Mediterranean, Seafood\nDinner: Maachh Bhaat, Fort Myers (Florida), cost: 66, cuisines: Desserts, Pizza, Fast Food, Mediterranean, Seafood\nAccommodation: Quiet and beautiful apartment near central park, Fort Myers (Florida), cost: 930, maximum occupancy: 9, house rules: No parties & No smoking, minimum nights: 7\n\nNumber of people: 1\nTotal cost: 50 + 76 + 66 + 930 = 1,122\nAccommodation minimum nights: 2/7\n\nDays: 3\nCurrent City: from Fort Myers (Florida) to Orlando (Florida)\nTransportation: Flight Number: F4014747, from Fort Myers (Florida) to Orlando (Florida), Departure Time: 16:49, Arrival Time: 17:39, cost: 36\nBreakfast: -\nAttraction: SeaWorld Orlando, Orlando (Florida)\nLunch: Fuji Japanese Steakhouse, Orlando (Florida), cost: 75, cuisines: Tea, Bakery, Desserts\nDinner: Turquoise Villa, Orlando (Florida), cost: 55, cuisines: French, Bakery, BBQ, Fast Food\nAccommodation: Private furnished bedroom in Williamsburg, Orlando (Florida), cost: 179, maximum occupancy: 1, house rules: No parties & No smoking & No children under 10, minimum nights: 5\n\nNumber of people: 1\nTotal cost: 36 + 75 + 55 + 179 = 345\nAccommodation minimum nights: 1/5\n\nDays: 4\nCurrent City: Orlando (Florida)\nTransportation: -\nBreakfast: The Tandoori Times, Orlando (Florida), cost: 84, cuisines: Tea, Cafe, BBQ, Italian\nAttraction: The Wheel at ICON Park, Orlando (Florida)\nLunch: Crust N Cakes, Orlando (Florida), cost: 61, cuisines: Tea, Cafe, Indian, BBQ\nDinner: Indochi Cafe & Restaurant, Orlando (Florida), cost: 72, cuisines: Pizza, French, Bakery, Fast Food, Indian, Seafood\nAccommodation: Private furnished bedroom in Williamsburg, Orlando (Florida), cost: 179, maximum occupancy: 1, house rules: No parties & No smoking & No children under 10, minimum nights: 5\n\nNumber of people: 1\nTotal cost: 84 + 61 + 72 + 179 = 396\nAccommodation minimum nights: 2/5\n\nDays: 5\nCurrent City: from Orlando (Florida) to Tampa (Florida)\nTransportation: Self-driving, from Orlando (Florida) to Tampa (Florida), duration: 1 hour 18 mins, distance: 136 km, cost: 6\nBreakfast: -\nAttraction: The Florida Aquarium, Tampa (Florida)\nLunch: Kobe Hibachi & Sushi, Tampa (Florida), cost: 63, cuisines: Desserts, French, BBQ, Bakery, Seafood\nDinner: The Tin Cow, Tampa (Florida), cost: 67, cuisines: BBQ, Desserts, Seafood\nAccommodation: Lovely Guestroom in Elevator Building, Tampa (Florida), cost: 359, maximum occupancy: 2, house rules: No smoking & No visitors & No parties, minimum nights: 2\n\nNumber of people: 1\nTotal cost: 6 + 63 + 67 + 359 = 495\nAccommodation minimum nights: 1/2\n\nDays: 6\nCurrent City: Tampa (Florida)\nTransportation: -\nBreakfast: Peg Leg Pete's, Tampa (Florida), cost: 91, cuisines: French, Bakery, Cafe\nAttraction: Busch Gardens Tampa Bay, Tampa (Florida)\nLunch: Butterburrs, Tampa (Florida), cost: 28, cuisines: Pizza, Seafood\nDinner: Lalit Kathi Rolls Momos, Tampa (Florida), cost: 23, cuisines: Tea, Pizza, Fast Food\nAccommodation: Lovely Guestroom in Elevator Building, Tampa (Florida), cost: 359, maximum occupancy: 2, house rules: No smoking & No visitors & No parties, minimum nights: 2\n\nNumber of people: 1\nTotal cost: 91 + 28 + 23 + 359 = 501\nAccommodation minimum nights: 2/2\n\nDays: 7\nCurrent City: from Tampa (Florida) to Louisville\nTransportation: Flight Number: F3963197, from Tampa (Florida) to Louisville, Departure Time: 11:38, Arrival Time: 13:42, cost: 203\nBreakfast: -\nAttraction: -\nLunch: -\nDinner: -\nAccommodation: -\n\nNumber of people: 1\nTotal cost: 203\n\nTotal cost across all days: 1,298 + 1,122 + 345 + 396 + 495 + 501 + 203 = 4,360\n\nCuisines: The prompt specifies no particular cuisine preferences, and a variety of cuisines have been included in the restaurants chosen.", "gpt-4-1106-preview_direct_sole-planning_parsed_results": [{"day": 1, "current_city": "from Louisville to Fort Myers (Florida)", "transportation": "Flight Number: F3987658, from Louisville to Fort Myers (Florida), Departure Time: 06:54, Arrival Time: 09:10", "breakfast": "-", "attraction": "Edison & Ford Winter Estates, Fort Myers (Florida);", "lunch": "The Refinery, Fort Myers (Florida)", "dinner": "Al Mukhtar Bakery, Fort Myers (Florida)", "accommodation": "Quiet and beautiful apartment near central park, Fort Myers (Florida)"}, {"day": 2, "current_city": "Fort Myers (Florida)", "transportation": "-", "breakfast": "Haunted, Fort Myers (Florida)", "attraction": "Six Mile Cypress Slough Preserve, Fort Myers (Florida);", "lunch": "Eggers Madhouse, Fort Myers (Florida)", "dinner": "Maachh Bhaat, Fort Myers (Florida)", "accommodation": "Quiet and beautiful apartment near central park, Fort Myers (Florida)"}, {"day": 3, "current_city": "from Fort Myers (Florida) to Orlando (Florida)", "transportation": "Flight Number: F4014747, from Fort Myers (Florida) to Orlando (Florida), Departure Time: 16:49, Arrival Time: 17:39", "breakfast": "-", "attraction": "SeaWorld Orlando, Orlando (Florida);", "lunch": "Fuji Japanese Steakhouse, Orlando (Florida)", "dinner": "Turquoise Villa, Orlando (Florida)", "accommodation": "Private furnished bedroom in Williamsburg, Orlando (Florida)"}, {"day": 4, "current_city": "Orlando (Florida)", "transportation": "-", "breakfast": "The Tandoori Times, Orlando (Florida)", "attraction": "The Wheel at ICON Park, Orlando (Florida);", "lunch": "Crust N Cakes, Orlando (Florida)", "dinner": "Indochi Cafe & Restaurant, Orlando (Florida)", "accommodation": "Private furnished bedroom in Williamsburg, Orlando (Florida)"}, {"day": 5, "current_city": "from Orlando (Florida) to Tampa (Florida)", "transportation": "Self-driving, from Orlando (Florida) to Tampa (Florida), duration: 1 hour 18 mins, distance: 136 km", "breakfast": "-", "attraction": "The Florida Aquarium, Tampa (Florida);", "lunch": "Kobe Hibachi & Sushi, Tampa (Florida)", "dinner": "The Tin Cow, Tampa (Florida)", "accommodation": "Lovely Guestroom in Elevator Building, Tampa (Florida)"}, {"day": 6, "current_city": "Tampa (Florida)", "transportation": "-", "breakfast": "Peg Leg Pete's, Tampa (Florida)", "attraction": "Busch Gardens Tampa Bay, Tampa (Florida);", "lunch": "Butterburrs, Tampa (Florida)", "dinner": "Lalit Kathi Rolls Momos, Tampa (Florida)", "accommodation": "Lovely Guestroom in Elevator Building, Tampa (Florida)"}, {"day": 7, "current_city": "from Tampa (Florida) to Louisville", "transportation": "Flight Number: F3963197, from Tampa (Florida) to Louisville, Departure Time: 11:38, Arrival Time: 13:42", "breakfast": "-", "attraction": "-", "lunch": "-", "dinner": "-", "accommodation": "-"}]}]