[{"gpt-4-1106-preview_direct_sole-planning_results": "Travel Plan:\n\nDays: 1\nCurrent City: from Boston to Wilmington (North Carolina)\nTransportation: Taxi, from Boston to Wilmington, duration: 12 hours 27 mins, distance: 1,304 km, cost: 1304\nBreakfast: -\nAttraction: -\nLunch: -\nDinner: Azteca, Wilmington (North Carolina), cost: 56, cuisines: Cafe, Indian, BBQ\nAccommodation: Prime East Village location w/backyard garden!, Wilmington (North Carolina), cost: 978, room type: Entire home/apt, house rules: No pets & No smoking, minimum nights: 4, maximum occupancy: 7\n\nNumber of people: 4\nTotal cost: 1304 + (56 * 4) + 978 = 2,502\nAccommodation minimum nights: 1/4\n\nDays: 2\nCurrent City: Wilmington (North Carolina)\nTransportation: -\nBreakfast: Bandit Burrito, Wilmington (North Carolina), cost: 26, cuisines: Desserts, French, Bakery, Fast Food, Seafood\nAttraction: Bellamy Mansion Museum, Wilmington (North Carolina); Wilmington Riverwalk, Wilmington (North Carolina)\nLunch: Moonie's Texas Barbecue, Wilmington (North Carolina), cost: 38, cuisines: Chinese, Bakery, Fast Food\nDinner: Taco Bus, Wilmington (North Carolina), cost: 59, cuisines: Tea, Cafe, BBQ\nAccommodation: Prime East Village location w/backyard garden!, Wilmington (North Carolina), cost: 978, room type: Entire home/apt, house rules: No pets & No smoking, minimum nights: 4, maximum occupancy: 7\n\nNumber of people: 4\nTotal cost: (26 + 38 + 59) * 4 + 978 = 1,586\nAccommodation minimum nights: 2/4\n\nDays: 3\nCurrent City: from Wilmington (North Carolina) to Charlotte (North Carolina)\nTransportation: Flight Number: F3635146, from Wilmington (North Carolina) to Charlotte (North Carolina), Departure Time: 08:53, Arrival Time: 09:55, cost: 75\nBreakfast: -\nAttraction: Freedom Park, Charlotte (North Carolina); Levine Museum of the New South, Charlotte (North Carolina)\nLunch: Olive Tree Cafe, Charlotte (North Carolina), cost: 23, cuisines: Tea, Chinese, Desserts\nDinner: Central Perk 7, Charlotte (North Carolina), cost: 87, cuisines: Pizza, Bakery, BBQ, Fast Food\nAccommodation: Elegant Studio Apt in Prospect Heights, Charlotte (North Carolina), cost: 640, room type: Entire home/apt, house rules: No parties, minimum nights: 2, maximum occupancy: 5\n\nNumber of people: 4\nTotal cost: (75 + 23 + 87) * 4 + 640 = 1,368\nAccommodation minimum nights: 1/2\n\nDays: 4\nCurrent City: Charlotte (North Carolina)\nTransportation: -\nBreakfast: Subway, Charlotte (North Carolina), cost: 60, cuisines: Tea, Cafe, Mexican, Chinese, Seafood\nAttraction: Discovery Place Science, Charlotte (North Carolina); NASCAR Hall of Fame, Charlotte (North Carolina)\nLunch: Cafe Maple Street, Charlotte (North Carolina), cost: 91, cuisines: Fast Food, Tea, Italian\nDinner: Kylin Skybar, Charlotte (North Carolina), cost: 44, cuisines: Tea, Cafe, Pizza, Italian\nAccommodation: Elegant Studio Apt in Prospect Heights, Charlotte (North Carolina), cost: 640, room type: Entire home/apt, house rules: No parties, minimum nights: 2, maximum occupancy: 5\n\nNumber of people: 4\nTotal cost: (60 + 91 + 44) * 4 + 640 = 1,736\nAccommodation minimum nights: 2/2\n\nDays: 5\nCurrent City: from Charlotte (North Carolina) to Boston\nTransportation: Flight Number: F3662314, from Charlotte (North Carolina) to Boston, Departure Time: 13:21, Arrival Time: 15:18, cost: 328\nBreakfast: -\nAttraction: -\nLunch: -\nDinner: -\nAccommodation: -\n\nNumber of people: 4\nTotal cost: 328 * 4 = 1,312\n\nTotal cost across all days: 2,502 + 1,586 + 1,368 + 1,736 + 1,312 = 8,504\n\nCuisines: The prompt does not specify particular cuisines, but a variety of cuisines have been represented in the restaurants chosen.\n\nNote: The accommodations selected allow visitors and provide entire rooms, as per the query. The transportation modes do not include self-driving, following the preference stated in the query. The total cost is within the specified budget of $8,800.", "gpt-4-1106-preview_direct_sole-planning_parsed_results": [{"day": 1, "current_city": "from Boston to Wilmington (North Carolina)", "transportation": "Taxi, from Boston to Wilmington, duration: 12 hours 27 mins, distance: 1,304 km", "breakfast": "-", "attraction": "-", "lunch": "-", "dinner": "Azteca, Wilmington (North Carolina)", "accommodation": "Prime East Village location w/backyard garden!, Wilmington (North Carolina)"}, {"day": 2, "current_city": "Wilmington (North Carolina)", "transportation": "-", "breakfast": "Bandit Burrito, Wilmington (North Carolina)", "attraction": "Bellamy Mansion Museum, Wilmington (North Carolina);Wilmington Riverwalk, Wilmington (North Carolina);", "lunch": "Moonie's Texas Barbecue, Wilmington (North Carolina)", "dinner": "Taco Bus, Wilmington (North Carolina)", "accommodation": "Prime East Village location w/backyard garden!, Wilmington (North Carolina)"}, {"day": 3, "current_city": "from Wilmington (North Carolina) to Charlotte (North Carolina)", "transportation": "Flight Number: F3635146, from Wilmington (North Carolina) to Charlotte (North Carolina), Departure Time: 08:53, Arrival Time: 09:55", "breakfast": "-", "attraction": "Freedom Park, Charlotte (North Carolina);Levine Museum of the New South, Charlotte (North Carolina);", "lunch": "Olive Tree Cafe, Charlotte (North Carolina)", "dinner": "Central Perk 7, Charlotte (North Carolina)", "accommodation": "Elegant Studio Apt in Prospect Heights, Charlotte (North Carolina)"}, {"day": 4, "current_city": "Charlotte (North Carolina)", "transportation": "-", "breakfast": "Subway, Charlotte (North Carolina)", "attraction": "Discovery Place Science, Charlotte (North Carolina);NASCAR Hall of Fame, Charlotte (North Carolina);", "lunch": "Cafe Maple Street, Charlotte (North Carolina)", "dinner": "Kylin Skybar, Charlotte (North Carolina)", "accommodation": "Elegant Studio Apt in Prospect Heights, Charlotte (North Carolina)"}, {"day": 5, "current_city": "from Charlotte (North Carolina) to Boston", "transportation": "Flight Number: F3662314, from Charlotte (North Carolina) to Boston, Departure Time: 13:21, Arrival Time: 15:18", "breakfast": "-", "attraction": "-", "lunch": "-", "dinner": "-", "accommodation": "-"}]}]