[{"gpt-4-1106-preview_direct_sole-planning_results": "Travel Plan:\n\nDays: 1\nCurrent City: from Boston to San Juan (Puerto Rico)\nTransportation: Flight Number: F3619758, from Boston to San Juan (Puerto Rico), Departure Time: 08:17, Arrival Time: 12:48, cost: 466\nBreakfast: -\nAttraction: -\nLunch: Christian and Jake's Bistro, San Juan (Puerto Rico), cost: 59, cuisines: Tea, French, Bakery, Fast Food, Indian\nDinner: Hoka-Hoka Japanese Steak & Sushi, San Juan (Puerto Rico), cost: 27, cuisines: Tea, French, American, Cafe\nAccommodation: FLUSHING APT!! BEST DEAL IN NYC!!!, San Juan (Puerto Rico), cost: 135, room type: Entire home/apt, house rules: No smoking & No parties, minimum nights: 1, maximum occupancy: 2\n\nNumber of people: 1\nTotal cost: 466 + 59 + 27 + 135 = 687\nAccommodation minimum nights: 1/1\n\nDays: 2\nCurrent City: San Juan (Puerto Rico)\nTransportation: -\nBreakfast: Coldpress Company, San Juan (Puerto Rico), cost: 11, cuisines: Cafe, Pizza, BBQ, Fast Food\nAttraction: Castillo San Felipe del Morro, San Juan (Puerto Rico); Paseo de La Princesa, San Juan (Puerto Rico)\nLunch: Oh My!, San Juan (Puerto Rico), cost: 18, cuisines: Desserts, Tea, Cafe, American, Mediterranean, Seafood\nDinner: Go! Dimsum, San Juan (Puerto Rico), cost: 54, cuisines: French, Bakery, Fast Food\nAccommodation: FLUSHING APT!! BEST DEAL IN NYC!!!, San Juan (Puerto Rico), cost: 135, room type: Entire home/apt, house rules: No smoking & No parties, minimum nights: 1, maximum occupancy: 2\n\nNumber of people: 1\nTotal cost: 11 + 18 + 54 + 135 = 218\nAccommodation minimum nights: 2/1\n\nDays: 3\nCurrent City: from San Juan (Puerto Rico) to Boston\nTransportation: Flight Number: F3619791, from San Juan (Puerto Rico) to Boston, Departure Time: 12:02, Arrival Time: 16:27, cost: 744\nBreakfast: -\nAttraction: -\nLunch: -\nDinner: -\nAccommodation: -\n\nNumber of people: 1\nTotal cost: 744\n\nTotal cost across all days: 687 + 218 + 744 = 1,649\n\nNote: The total cost exceeds the specified budget of $1,400. Adjustments are needed to meet the budget constraint. Possible adjustments could include selecting a cheaper flight or accommodation. However, based on the provided data, the cheapest flight options have been selected, and the accommodation is already the most budget-friendly option available. Therefore, it may not be possible to meet the budget constraint with the current options.", "gpt-4-1106-preview_direct_sole-planning_parsed_results": [{"day": 1, "current_city": "from Boston to San Juan (Puerto Rico)", "transportation": "Flight Number: F3619758, from Boston to San Juan (Puerto Rico), Departure Time: 08:17, Arrival Time: 12:48", "breakfast": "-", "attraction": "-", "lunch": "Christian and Jake's Bistro, San Juan (Puerto Rico)", "dinner": "Hoka-Hoka Japanese Steak & Sushi, San Juan (Puerto Rico)", "accommodation": "FLUSHING APT!! BEST DEAL IN NYC!!!, San Juan (Puerto Rico)"}, {"day": 2, "current_city": "San Juan (Puerto Rico)", "transportation": "-", "breakfast": "Coldpress Company, San Juan (Puerto Rico)", "attraction": "Castillo San Felipe del Morro, San Juan (Puerto Rico);Paseo de La Princesa, San Juan (Puerto Rico);", "lunch": "Oh My!, San Juan (Puerto Rico)", "dinner": "Go! Dimsum, San Juan (Puerto Rico)", "accommodation": "FLUSHING APT!! BEST DEAL IN NYC!!!, San Juan (Puerto Rico)"}, {"day": 3, "current_city": "from San Juan (Puerto Rico) to Boston", "transportation": "Flight Number: F3619791, from San Juan (Puerto Rico) to Boston, Departure Time: 12:02, Arrival Time: 16:27", "breakfast": "-", "attraction": "-", "lunch": "-", "dinner": "-", "accommodation": "-"}]}]