[{"gpt-4-1106-preview_direct_sole-planning_results": "Travel Plan:\n\nDays: 1\nCurrent City: from Monterey to Dallas (Texas)\nTransportation: Flight Number: F4046679, from Monterey to Dallas (Texas), Departure Time: 14:02, Arrival Time: 19:18, cost: 489\nBreakfast: -\nAttraction: -\nLunch: -\nDinner: Coconuts Fish Cafe, Dallas (Texas), cost: 38, cuisines: Cafe, BBQ, Mediterranean, Fast Food\nAccommodation: 1BR, elevator, kitchen, doorman!, Dallas (Texas), cost: 475, maximum occupancy: 3, house rules: No parties, minimum nights: 1\n\nNumber of people: 4\nTotal cost: (489 * 4) + (38 * 4) + 475 = 2,431\nAccommodation minimum nights: 1/1\n\nDays: 2\nCurrent City: Dallas (Texas)\nTransportation: -\nBreakfast: Cafe Gatherings, Dallas (Texas), cost: 17, cuisines: Bakery, Indian, Desserts\nAttraction: The Dallas World Aquarium, Dallas (Texas); The Sixth Floor Museum at Dealey Plaza, Dallas (Texas)\nLunch: L'Opera, Dallas (Texas), cost: 77, cuisines: French, Bakery, BBQ, Fast Food, Seafood\nDinner: 1918 Bistro & Grill, Dallas (Texas), cost: 90, cuisines: Tea, Pizza, BBQ, Seafood\nAccommodation: Luxury Williamsburg duplex, private roof terrace, Dallas (Texas), cost: 241, maximum occupancy: 3, house rules: No visitors, minimum nights: 4\n\nNumber of people: 4\nTotal cost: (17 + 77 + 90) * 4 + 241 = 1,045\nAccommodation minimum nights: 1/4\n\nDays: 3\nCurrent City: from Dallas (Texas) to Del Rio (Texas)\nTransportation: Self-driving, from Dallas to Del Rio, duration: 6 hours 21 mins, distance: 668 km, cost: 33\nBreakfast: -\nAttraction: Whitehead Memorial Museum, Del Rio (Texas)\nLunch: Green Chick Chop, Del Rio (Texas), cost: 82, cuisines: Tea, Bakery, Indian, Mediterranean, Seafood\nDinner: HuHot Mongolian Grill, Del Rio (Texas), cost: 71, cuisines: Cafe, Bakery, BBQ, Fast Food\nAccommodation: 2 bedroom Kid Friendly Cobble Hill, Del Rio (Texas), cost: 129, maximum occupancy: 3, house rules: No visitors & No smoking, minimum nights: 3\n\nNumber of people: 4\nTotal cost: 33 + (82 + 71) * 4 + 129 = 877\nAccommodation minimum nights: 1/3\n\nDays: 4\nCurrent City: Del Rio (Texas)\nTransportation: -\nBreakfast: Jom Jom Malay, Del Rio (Texas), cost: 78, cuisines: Chinese, Indian, Desserts, Fast Food\nAttraction: Amistad National Recreation Area, Del Rio (Texas)\nLunch: Pizzoccheri, Del Rio (Texas), cost: 77, cuisines: Cafe, Seafood, Mediterranean, Italian\nDinner: Chaudhary Chaap & Chinese, Del Rio (Texas), cost: 85, cuisines: Pizza, Mediterranean, Desserts, Italian\nAccommodation: Spacious Brooklyn One Bedroom/Loft***Morgan L Stop, Del Rio (Texas), cost: 1164, maximum occupancy: 4, house rules: No visitors, minimum nights: 4\n\nNumber of people: 4\nTotal cost: (78 + 77 + 85) * 4 + 1164 = 2,452\nAccommodation minimum nights: 1/4\n\nDays: 5\nCurrent City: from Del Rio (Texas) to Amarillo (Texas)\nTransportation: Self-driving, from Del Rio to Amarillo, duration: 7 hours 0 mins, distance: 754 km, cost: 37\nBreakfast: -\nAttraction: Cadillac Ranch, Amarillo (Texas)\nLunch: The Cinnamon Kitchen, Amarillo (Texas), cost: 69, cuisines: Desserts, Tea, Pizza, Chinese, Seafood\nDinner: Komachi, Amarillo (Texas), cost: 71, cuisines: Desserts, Tea, Fast Food, Chinese, Mediterranean\nAccommodation: Gramercy Park restful, cozy, sun-filled home, Amarillo (Texas), cost: 968, maximum occupancy: 8, house rules: No parties, minimum nights: 2\n\nNumber of people: 4\nTotal cost: 37 + (69 + 71) * 4 + 968 = 1,652\nAccommodation minimum nights: 1/2\n\nDays: 6\nCurrent City: Amarillo (Texas)\nTransportation: -\nBreakfast: Wood Box Cafe, Amarillo (Texas), cost: 11, cuisines: Desserts, French, Fast Food, Cafe, American\nAttraction: Amarillo Botanical Gardens, Amarillo (Texas); Amarillo Zoo, Amarillo (Texas)\nLunch: Anand Restaurant, Amarillo (Texas), cost: 53, cuisines: Fast Food, Seafood, Desserts, Italian\nDinner: Sigree Global Grill, Amarillo (Texas), cost: 35, cuisines: Chinese, BBQ, Cafe, Desserts\nAccommodation: Harlem Humble Abode - 1 bedroom - Cute and Quaint, Amarillo (Texas), cost: 409, maximum occupancy: 3, house rules: No pets, minimum nights: 5\n\nNumber of people: 4\nTotal cost: (11 + 53 + 35) * 4 + 409 = 1,073\nAccommodation minimum nights: 1/5\n\nDays: 7\nCurrent City: from Amarillo (Texas) to Monterey\nTransportation: Self-driving, from Amarillo to Monterey, duration: 19 hours 21 mins, distance: 2,104 km, cost: 105\nBreakfast: -\nAttraction: -\nLunch: -\nDinner: -\nAccommodation: -\n\nNumber of people: 4\nTotal cost: 105 * 4 = 420\n\nTotal cost across all days: 2,431 + 1,045 + 877 + 2,452 + 1,652 + 1,073 + 420 = 9,950\nCuisines: The prompt specifies French and Chinese, and both of these cuisines have been represented in the restaurants chosen.", "gpt-4-1106-preview_direct_sole-planning_parsed_results": [{"day": 1, "current_city": "from Monterey to Dallas", "transportation": "Flight Number: F4046679, from Monterey to Dallas, Departure Time: 14:02, Arrival Time: 19:18", "breakfast": "-", "attraction": "-", "lunch": "-", "dinner": "Coconuts Fish Cafe, Dallas", "accommodation": "1BR, elevator, kitchen, doorman!, Dallas"}, {"day": 2, "current_city": "Dallas", "transportation": "-", "breakfast": "Cafe Gatherings, Dallas", "attraction": "The Dallas World Aquarium, Dallas;The Sixth Floor Museum at Dealey Plaza, Dallas;", "lunch": "L'Opera, Dallas", "dinner": "1918 Bistro & Grill, Dallas", "accommodation": "Luxury Williamsburg duplex, private roof terrace, Dallas"}, {"day": 3, "current_city": "from Dallas to Del Rio", "transportation": "Self-driving, from Dallas to Del Rio, duration: 6 hours 21 mins, distance: 668 km", "breakfast": "-", "attraction": "Whitehead Memorial Museum, Del Rio", "lunch": "Green Chick Chop, Del Rio", "dinner": "HuHot Mongolian Grill, Del Rio", "accommodation": "2 bedroom Kid Friendly Cobble Hill, Del Rio"}, {"day": 4, "current_city": "Del Rio", "transportation": "-", "breakfast": "Jom Jom Malay, Del Rio", "attraction": "Amistad National Recreation Area, Del Rio", "lunch": "Pizzoccheri, Del Rio", "dinner": "Chaudhary Chaap & Chinese, Del Rio", "accommodation": "Spacious Brooklyn One Bedroom/Loft***Morgan L Stop, Del Rio"}, {"day": 5, "current_city": "from Del Rio to Amarillo", "transportation": "Self-driving, from Del Rio to Amarillo, duration: 7 hours 0 mins, distance: 754 km", "breakfast": "-", "attraction": "Cadillac Ranch, Amarillo", "lunch": "The Cinnamon Kitchen, Amarillo", "dinner": "Komachi, Amarillo", "accommodation": "Gramercy Park restful, cozy, sun-filled home, Amarillo"}, {"day": 6, "current_city": "Amarillo", "transportation": "-", "breakfast": "Wood Box Cafe, Amarillo", "attraction": "Amarillo Botanical Gardens, Amarillo;Amarillo Zoo, Amarillo;", "lunch": "Anand Restaurant, Amarillo", "dinner": "Sigree Global Grill, Amarillo", "accommodation": "Harlem Humble Abode - 1 bedroom - Cute and Quaint, Amarillo"}, {"day": 7, "current_city": "from Amarillo to Monterey", "transportation": "Self-driving, from Amarillo to Monterey, duration: 19 hours 21 mins, distance: 2,104 km", "breakfast": "-", "attraction": "-", "lunch": "-", "dinner": "-", "accommodation": "-"}]}]