[{"gpt-4-1106-preview_direct_sole-planning_results": "Travel Plan:\n\nDays: 1\nCurrent City: from Cleveland to Fort Myers (Florida)\nTransportation: Flight Number: F3915178, from Cleveland to Fort Myers (Florida), Departure Time: 06:40, Arrival Time: 09:22, cost: 316\nBreakfast: -\nAttraction: Edison & Ford Winter Estates, Fort Myers (Florida)\nLunch: The Refinery, Fort Myers (Florida), cost: 22, cuisines: Bakery, Indian, Seafood\nDinner: Al Mukhtar Bakery, Fort Myers (Florida), cost: 54, cuisines: BBQ, Tea, American, Desserts\nAccommodation: Quiet and beautiful apartment near central park, Fort Myers (Florida), cost: 930, room type: Entire home/apt, house rules: No parties & No smoking, minimum nights: 7, maximum occupancy: 9\n\nNumber of people: 6\nTotal cost: (316 + 22 + 54) * 6 + 930 = 3,612\nAccommodation minimum nights: 1/7\n\nDays: 2\nCurrent City: Fort Myers (Florida)\nTransportation: -\nBreakfast: Enter The Dragon, Fort Myers (Florida), cost: 93, cuisines: Tea, Chinese, Cafe\nAttraction: Six Mile Cypress Slough Preserve, Fort Myers (Florida)\nLunch: Haunted, Fort Myers (Florida), cost: 50, cuisines: Desserts, French, Fast Food, Cafe, Seafood\nDinner: Eggers Madhouse, Fort Myers (Florida), cost: 76, cuisines: BBQ, Mediterranean, Seafood\nAccommodation: Quiet and beautiful apartment near central park, Fort Myers (Florida), cost: 930, room type: Entire home/apt, house rules: No parties & No smoking, minimum nights: 7, maximum occupancy: 9\n\nNumber of people: 6\nTotal cost: (93 + 50 + 76) * 6 + 930 = 2,754\nAccommodation minimum nights: 2/7\n\nDays: 3\nCurrent City: from Fort Myers (Florida) to Tampa (Florida)\nTransportation: Taxi, from Fort Myers (Florida) to Tampa (Florida), duration: 1 hour 58 mins, distance: 204 km, cost: 204\nBreakfast: -\nAttraction: The Florida Aquarium, Tampa (Florida)\nLunch: Kobe Hibachi & Sushi, Tampa (Florida), cost: 63, cuisines: Desserts, French, BBQ, Bakery, Seafood\nDinner: The Tin Cow, Tampa (Florida), cost: 67, cuisines: BBQ, Desserts, Seafood\nAccommodation: Bright duplex apartment, Tampa (Florida), cost: 164, room type: Entire home/apt, house rules: No children under 10, minimum nights: 2, maximum occupancy: 3\n\nNumber of people: 6\nTotal cost: 204 * 6 + (63 + 67) * 6 + 164 * 2 = 2,394\nAccommodation minimum nights: 1/2\n\nDays: 4\nCurrent City: Tampa (Florida)\nTransportation: -\nBreakfast: Lalit Kathi Rolls Momos, Tampa (Florida), cost: 23, cuisines: Tea, Pizza, Fast Food\nAttraction: Busch Gardens Tampa Bay, Tampa (Florida)\nLunch: Uptown Fresh Beer Cafe, Tampa (Florida), cost: 61, cuisines: Pizza, Mexican, BBQ, Cafe, Seafood\nDinner: Aahar, Tampa (Florida), cost: 52, cuisines: Tea, Pizza, Desserts, Fast Food\nAccommodation: Bright duplex apartment, Tampa (Florida), cost: 164, room type: Entire home/apt, house rules: No children under 10, minimum nights: 2, maximum occupancy: 3\n\nNumber of people: 6\nTotal cost: (23 + 61 + 52) * 6 + 164 * 2 = 1,656\nAccommodation minimum nights: 2/2\n\nDays: 5\nCurrent City: from Tampa (Florida) to Cleveland\nTransportation: Flight Number: F3560049, from Tampa (Florida) to Cleveland, Departure Time: 08:53, Arrival Time: 11:22, cost: 211\nBreakfast: -\nAttraction: -\nLunch: -\nDinner: -\nAccommodation: -\n\nNumber of people: 6\nTotal cost: 211 * 6 = 1,266\n\nTotal cost across all days: 3,612 + 2,754 + 2,394 + 1,656 + 1,266 = 11,682\n\nCuisines: The prompt does not specify any particular cuisine preferences, but a variety of cuisines have been included in the restaurants chosen.\n\nPet-friendly accommodations: All accommodations chosen are pet-friendly and are entire home/apt as requested.\n\nTransportation: No self-driving as per the request, only flights and taxi services have been used.\n\nBudget: The total cost of $11,682 is within the specified budget of $13,900.", "gpt-4-1106-preview_direct_sole-planning_parsed_results": [{"day": 1, "current_city": "from Cleveland to Fort Myers (Florida)", "transportation": "Flight Number: F3915178, from Cleveland to Fort Myers (Florida), Departure Time: 06:40, Arrival Time: 09:22", "breakfast": "-", "attraction": "Edison & Ford Winter Estates, Fort Myers (Florida);", "lunch": "The Refinery, Fort Myers (Florida)", "dinner": "Al Mukhtar Bakery, Fort Myers (Florida)", "accommodation": "Quiet and beautiful apartment near central park, Fort Myers (Florida)"}, {"day": 2, "current_city": "Fort Myers (Florida)", "transportation": "-", "breakfast": "Enter The Dragon, Fort Myers (Florida)", "attraction": "Six Mile Cypress Slough Preserve, Fort Myers (Florida);", "lunch": "Haunted, Fort Myers (Florida)", "dinner": "Eggers Madhouse, Fort Myers (Florida)", "accommodation": "Quiet and beautiful apartment near central park, Fort Myers (Florida)"}, {"day": 3, "current_city": "from Fort Myers (Florida) to Tampa (Florida)", "transportation": "Taxi, from Fort Myers (Florida) to Tampa (Florida), duration: 1 hour 58 mins, distance: 204 km", "breakfast": "-", "attraction": "The Florida Aquarium, Tampa (Florida);", "lunch": "Kobe Hibachi & Sushi, Tampa (Florida)", "dinner": "The Tin Cow, Tampa (Florida)", "accommodation": "Bright duplex apartment, Tampa (Florida)"}, {"day": 4, "current_city": "Tampa (Florida)", "transportation": "-", "breakfast": "Lalit Kathi Rolls Momos, Tampa (Florida)", "attraction": "Busch Gardens Tampa Bay, Tampa (Florida);", "lunch": "Uptown Fresh Beer Cafe, Tampa (Florida)", "dinner": "Aahar, Tampa (Florida)", "accommodation": "Bright duplex apartment, Tampa (Florida)"}, {"day": 5, "current_city": "from Tampa (Florida) to Cleveland", "transportation": "Flight Number: F3560049, from Tampa (Florida) to Cleveland, Departure Time: 08:53, Arrival Time: 11:22", "breakfast": "-", "attraction": "-", "lunch": "-", "dinner": "-", "accommodation": "-"}]}]