[{"gpt-4-1106-preview_direct_sole-planning_results": "Travel Plan:\n\nDays: 1\nCurrent City: from Key West to Evansville (Indiana)\nTransportation: Self-driving, from Key West to Evansville, duration: 18 hours 21 mins, distance: 1,961 km, cost: 98\nBreakfast: -\nAttraction: -\nLunch: -\nDinner: Blue Orchid Thai Restaurant, Evansville (Indiana), cost: 86, cuisines: Tea, Mexican, American, Desserts\nAccommodation: Stylish 1 bed room in the East Village, Evansville (Indiana), cost: 674, room type: Entire home/apt, house rules: No children under 10, minimum nights: 3, maximum occupancy: 6\n\nNumber of people: 1\nTotal cost: 98 + 86 + 674 = 858\nAccommodation minimum nights: 1/3\n\nDays: 2\nCurrent City: Evansville (Indiana)\nTransportation: -\nBreakfast: J. Christopher's, Evansville (Indiana), cost: 39, cuisines: Tea, Cafe, Desserts, Seafood\nAttraction: Mesker Park Zoo, Evansville (Indiana); Evansville Museum, Evansville (Indiana)\nLunch: Punjabi Restaurant, Evansville (Indiana), cost: 29, cuisines: Cafe, Bakery, Desserts, Fast Food\nDinner: Twist of Italy, Evansville (Indiana), cost: 85, cuisines: Desserts, Pizza, Mexican, Mediterranean, Seafood\nAccommodation: Stylish 1 bed room in the East Village, Evansville (Indiana), cost: 674, room type: Entire home/apt, house rules: No children under 10, minimum nights: 3, maximum occupancy: 6\n\nNumber of people: 1\nTotal cost: 39 + 29 + 85 + 674 = 827\nAccommodation minimum nights: 2/3\n\nDays: 3\nCurrent City: from Evansville (Indiana) to South Bend (Indiana)\nTransportation: Self-driving, from Evansville to South Bend, duration: 5 hours 1 min, distance: 512 km, cost: 25\nBreakfast: -\nAttraction: -\nLunch: Krips Restaurant, South Bend (Indiana), cost: 59, cuisines: Tea, Mediterranean, Fast Food\nDinner: MOB Brewpub, South Bend (Indiana), cost: 67, cuisines: Cafe, Mexican, American, BBQ\nAccommodation: Just Right in Lovely Greenpoint, South Bend (Indiana), cost: 614, room type: Private room, house rules: No smoking & No visitors, minimum nights: 7, maximum occupancy: 1\n\nNumber of people: 1\nTotal cost: 25 + 59 + 67 + 614 = 765\nAccommodation minimum nights: 1/7\n\nDays: 4\nCurrent City: South Bend (Indiana)\nTransportation: -\nBreakfast: Our Story Bistro & Tea Room, South Bend (Indiana), cost: 10, cuisines: Tea, Pizza, Italian, BBQ, Mediterranean, Seafood\nAttraction: Studebaker National Museum, South Bend (Indiana); South Bend Museum of Art, South Bend (Indiana)\nLunch: Roadhouse Cafe, South Bend (Indiana), cost: 24, cuisines: Desserts, Pizza, Bakery, Fast Food, Chinese\nDinner: Lotus Pond, South Bend (Indiana), cost: 83, cuisines: Tea, Seafood, Italian\nAccommodation: Just Right in Lovely Greenpoint, South Bend (Indiana), cost: 614, room type: Private room, house rules: No smoking & No visitors, minimum nights: 7, maximum occupancy: 1\n\nNumber of people: 1\nTotal cost: 10 + 24 + 83 + 614 = 731\nAccommodation minimum nights: 2/7\n\nDays: 5\nCurrent City: from South Bend (Indiana) to Key West\nTransportation: Self-driving, from South Bend to Key West, duration: 22 hours 38 mins, distance: 2,406 km, cost: 120\nBreakfast: -\nAttraction: -\nLunch: -\nDinner: -\nAccommodation: -\n\nNumber of people: 1\nTotal cost: 120\n\nTotal cost across all days: 858 + 827 + 765 + 731 + 120 = 3,301\n\nUnfortunately, the total cost of $3,301 exceeds the specified budget of $2,000. Adjustments to the plan are required to meet the budget constraint. However, given the high costs of accommodation and transportation, it may not be feasible to create a plan within the budget that includes all required details for each day.", "gpt-4-1106-preview_direct_sole-planning_parsed_results": [{"day": 1, "current_city": "from Key West to Evansville", "transportation": "Self-driving, from Key West to Evansville, duration: 18 hours 21 mins, distance: 1,961 km", "breakfast": "-", "attraction": "-", "lunch": "-", "dinner": "Blue Orchid Thai Restaurant, Evansville", "accommodation": "Stylish 1 bed room in the East Village, Evansville"}, {"day": 2, "current_city": "Evansville", "transportation": "-", "breakfast": "J. Christopher's, Evansville", "attraction": "Mesker Park Zoo, Evansville;Evansville Museum, Evansville;", "lunch": "Punjabi Restaurant, Evansville", "dinner": "Twist of Italy, Evansville", "accommodation": "Stylish 1 bed room in the East Village, Evansville"}, {"day": 3, "current_city": "from Evansville to South Bend", "transportation": "Self-driving, from Evansville to South Bend, duration: 5 hours 1 min, distance: 512 km", "breakfast": "-", "attraction": "-", "lunch": "Krips Restaurant, South Bend", "dinner": "MOB Brewpub, South Bend", "accommodation": "Just Right in Lovely Greenpoint, South Bend"}, {"day": 4, "current_city": "South Bend", "transportation": "-", "breakfast": "Our Story Bistro & Tea Room, South Bend", "attraction": "Studebaker National Museum, South Bend;South Bend Museum of Art, South Bend;", "lunch": "Roadhouse Cafe, South Bend", "dinner": "Lotus Pond, South Bend", "accommodation": "Just Right in Lovely Greenpoint, South Bend"}, {"day": 5, "current_city": "from South Bend to Key West", "transportation": "Self-driving, from South Bend to Key West, duration: 22 hours 38 mins, distance: 2,406 km", "breakfast": "-", "attraction": "-", "lunch": "-", "dinner": "-", "accommodation": "-"}]}]