[{"gpt-4-1106-preview_direct_sole-planning_results": "Travel Plan:\n\nDays: 1\nCurrent City: from Pittsburgh to Rochester (New York)\nTransportation: Self-driving, from Pittsburgh to Rochester, duration: 4 hours 11 mins, distance: 457 km, cost: 22\nBreakfast: -\nAttraction: -\nLunch: -\nDinner: Atlas World Grill, Rochester (New York), cost: 54, cuisines: Tea, Bakery, Mexican, Pizza\nAccommodation: Sun Filled 18ft Ceiling Duplex Noho/East Village, Rochester (New York), cost: 558, maximum occupancy: 5, house rules: No children under 10 & No parties & No smoking, minimum nights: 2\n\nNumber of people: 2\nTotal cost: 22 + (54 * 2) + 558 = 688\nAccommodation minimum nights: 1/2\n\nDays: 2\nCurrent City: Rochester (New York)\nTransportation: -\nBreakfast: Hotel Ravisha Continental, Rochester (New York), cost: 43, cuisines: Cafe, Bakery, Desserts, Fast Food\nAttraction: The Strong National Museum of Play, Rochester (New York); George Eastman Museum, Rochester (New York)\nLunch: Sree Annapoorna, Rochester (New York), cost: 52, cuisines: Tea, Cafe, Mexican\nDinner: The Fisherman's Wharf, Rochester (New York), cost: 14, cuisines: Tea, American, Mediterranean, Seafood\nAccommodation: Sun Filled 18ft Ceiling Duplex Noho/East Village, Rochester (New York), cost: 558, maximum occupancy: 5, house rules: No children under 10 & No parties & No smoking, minimum nights: 2\n\nNumber of people: 2\nTotal cost: (43 + 52 + 14) * 2 + 558 = 772\nAccommodation minimum nights: 2/2\n\nDays: 3\nCurrent City: from Rochester to Niagara Falls (New York)\nTransportation: Self-driving, from Rochester to Niagara Falls, duration: 1 hour 25 mins, distance: 139 km, cost: 6\nBreakfast: -\nAttraction: Journey Behind the Falls, Niagara Falls (New York); Niagara SkyWheel, Niagara Falls (New York)\nLunch: Tony Roma's, Niagara Falls (New York), cost: 47, cuisines: Desserts, Tea, French, Fast Food, Cafe, Mediterranean\nDinner: Scratch, Niagara Falls (New York), cost: 19, cuisines: Tea, American, Seafood\nAccommodation: Sunny Spacious South Slope Studio, Niagara Falls (New York), cost: 337, maximum occupancy: 3, house rules: No parties & No smoking, minimum nights: 2\n\nNumber of people: 2\nTotal cost: 6 + (47 + 19) * 2 + 337 = 475\nAccommodation minimum nights: 1/2\n\nDays: 4\nCurrent City: Niagara Falls (New York)\nTransportation: -\nBreakfast: Raju Dhaba, Niagara Falls (New York), cost: 67, cuisines: American, Desserts, Seafood\nAttraction: Cave of the Winds, Niagara Falls (New York); White Water Walk, Niagara Falls (New York)\nLunch: Sri Meenakshi South Indian Food, Niagara Falls (New York), cost: 77, cuisines: Tea, Seafood, Bakery, Italian\nDinner: Burger Point, Niagara Falls (New York), cost: 59, cuisines: Tea, American, BBQ\nAccommodation: Sunny Spacious South Slope Studio, Niagara Falls (New York), cost: 337, maximum occupancy: 3, house rules: No parties & No smoking, minimum nights: 2\n\nNumber of people: 2\nTotal cost: (67 + 77 + 59) * 2 + 337 = 734\nAccommodation minimum nights: 2/2\n\nDays: 5\nCurrent City: from Niagara Falls to New York (New York)\nTransportation: Self-driving, from Niagara Falls to New York, duration: 6 hours 29 mins, distance: 657 km, cost: 32\nBreakfast: -\nAttraction: Top of The Rock, New York (New York); One World Observatory, New York (New York)\nLunch: Seasons 52 Fresh Grill, New York (New York), cost: 30, cuisines: Seafood, Indian, Desserts, Italian\nDinner: Lord of the Drinks Forum, New York (New York), cost: 71, cuisines: Cafe, Bakery, BBQ, Chinese, Indian\nAccommodation: Beautiful and big 1BR sublet close by Central Park, New York (New York), cost: 983, maximum occupancy: 2, house rules: No parties & No children under 10, minimum nights: 5\n\nNumber of people: 2\nTotal cost: 32 + (30 + 71) * 2 + 983 = 1,217\nAccommodation minimum nights: 1/5\n\nDays: 6\nCurrent City: New York (New York)\nTransportation: -\nBreakfast: Gurgaon Hights, New York (New York), cost: 46, cuisines: Cafe, American, Indian, Fast Food\nAttraction: Empire State Building, New York (New York); The High Line, New York (New York)\nLunch: Goosebumps, New York (New York), cost: 94, cuisines: Chinese, Pizza, Bakery\nDinner: Garam Masala Food Corner, New York (New York), cost: 40, cuisines: Pizza, Bakery, Desserts\nAccommodation: Beautiful and big 1BR sublet close by Central Park, New York (New York), cost: 983, maximum occupancy: 2, house rules: No parties & No children under 10, minimum nights: 5\n\nNumber of people: 2\nTotal cost: (46 + 94 + 40) * 2 + 983 = 1,343\nAccommodation minimum nights: 2/5\n\nDays: 7\nCurrent City: from New York to Pittsburgh (New York)\nTransportation: Self-driving, from New York to Pittsburgh, duration: 5 hours 57 mins, distance: 594 km, cost: 29\nBreakfast: -\nAttraction: -\nLunch: -\nDinner: -\nAccommodation: -\n\nNumber of people: 2\nTotal cost: 29 * 2 = 58\n\nTotal cost across all days: 688 + 772 + 475 + 734 + 1,217 + 1,343 + 58 = 5,287\nCuisines: The prompt specifies French, Italian, Chinese, and American, and all of these cuisines have been represented in the restaurants chosen.", "gpt-4-1106-preview_direct_sole-planning_parsed_results": [{"day": 1, "current_city": "from Pittsburgh to Rochester (New York)", "transportation": "Self-driving, from Pittsburgh to Rochester, duration: 4 hours 11 mins, distance: 457 km", "breakfast": "-", "attraction": "-", "lunch": "-", "dinner": "Atlas World Grill, Rochester (New York)", "accommodation": "Sun Filled 18ft Ceiling Duplex Noho/East Village, Rochester (New York)"}, {"day": 2, "current_city": "Rochester (New York)", "transportation": "-", "breakfast": "Hotel Ravisha Continental, Rochester (New York)", "attraction": "The Strong National Museum of Play, Rochester (New York);George Eastman Museum, Rochester (New York);", "lunch": "Sree Annapoorna, Rochester (New York)", "dinner": "The Fisherman's Wharf, Rochester (New York)", "accommodation": "Sun Filled 18ft Ceiling Duplex Noho/East Village, Rochester (New York)"}, {"day": 3, "current_city": "from Rochester to Niagara Falls (New York)", "transportation": "Self-driving, from Rochester to Niagara Falls, duration: 1 hour 25 mins, distance: 139 km", "breakfast": "-", "attraction": "Journey Behind the Falls, Niagara Falls (New York);Niagara SkyWheel, Niagara Falls (New York);", "lunch": "Tony Roma's, Niagara Falls (New York)", "dinner": "Scratch, Niagara Falls (New York)", "accommodation": "Sunny Spacious South Slope Studio, Niagara Falls (New York)"}, {"day": 4, "current_city": "Niagara Falls (New York)", "transportation": "-", "breakfast": "Raju Dhaba, Niagara Falls (New York)", "attraction": "Cave of the Winds, Niagara Falls (New York);White Water Walk, Niagara Falls (New York);", "lunch": "Sri Meenakshi South Indian Food, Niagara Falls (New York)", "dinner": "Burger Point, Niagara Falls (New York)", "accommodation": "Sunny Spacious South Slope Studio, Niagara Falls (New York)"}, {"day": 5, "current_city": "from Niagara Falls to New York (New York)", "transportation": "Self-driving, from Niagara Falls to New York, duration: 6 hours 29 mins, distance: 657 km", "breakfast": "-", "attraction": "Top of The Rock, New York (New York);One World Observatory, New York (New York);", "lunch": "Seasons 52 Fresh Grill, New York (New York)", "dinner": "Lord of the Drinks Forum, New York (New York)", "accommodation": "Beautiful and big 1BR sublet close by Central Park, New York (New York)"}, {"day": 6, "current_city": "New York (New York)", "transportation": "-", "breakfast": "Gurgaon Hights, New York (New York)", "attraction": "Empire State Building, New York (New York);The High Line, New York (New York);", "lunch": "Goosebumps, New York (New York)", "dinner": "Garam Masala Food Corner, New York (New York)", "accommodation": "Beautiful and big 1BR sublet close by Central Park, New York (New York)"}, {"day": 7, "current_city": "from New York to Pittsburgh (New York)", "transportation": "Self-driving, from New York to Pittsburgh, duration: 5 hours 57 mins, distance: 594 km", "breakfast": "-", "attraction": "-", "lunch": "-", "dinner": "-", "accommodation": "-"}]}]