[{"gpt-4-1106-preview_direct_sole-planning_results": "Travel Plan:\n\nDays: 1\nCurrent City: from Milwaukee to New York\nTransportation: Flight Number: F3649645, from Milwaukee to New York, Departure Time: 10:50, Arrival Time: 14:22, cost: 180\nBreakfast: -\nAttraction: Times Square, New York (New York)\nLunch: Seasons 52 Fresh Grill, New York (New York), cost: 30, cuisines: Seafood, Indian, Desserts, Italian\nDinner: Lord of the Drinks Forum, New York (New York), cost: 71, cuisines: Cafe, Bakery, BBQ, Chinese, Indian\nAccommodation: Beautiful and big 1BR sublet close by Central Park, New York (New York), cost: 983, room type: Private room, house rules: No parties & No children under 10, minimum nights: 5, maximum occupancy: 2\n\nNumber of people: 2\nTotal cost: (180 + 30 + 71) * 2 + 983 = 1,465\nAccommodation minimum nights: 1/5\n\nDays: 2\nCurrent City: New York\nTransportation: -\nBreakfast: Sir John Bakery Cafe, New York (New York), cost: 78, cuisines: Pizza, Bakery, Desserts\nAttraction: Central Park, New York (New York); The High Line, New York (New York)\nLunch: Gurgaon Hights, New York (New York), cost: 46, cuisines: Cafe, American, Indian, Fast Food\nDinner: Goosebumps, New York (New York), cost: 94, cuisines: Chinese, Pizza, Bakery\nAccommodation: Beautiful and big 1BR sublet close by Central Park, New York (New York), cost: 983, room type: Private room, house rules: No parties & No children under 10, minimum nights: 5, maximum occupancy: 2\n\nNumber of people: 2\nTotal cost: (78 + 46 + 94) * 2 + 983 = 1,425\nAccommodation minimum nights: 2/5\n\nDays: 3\nCurrent City: from New York to Milwaukee\nTransportation: Flight Number: F3644990, from New York to Milwaukee, Departure Time: 15:20, Arrival Time: 16:27, cost: 218\nBreakfast: Green Chick Chop, New York (New York), cost: 26, cuisines: Tea, French, Cafe, Seafood\nAttraction: Statue of Liberty, New York (New York)\nLunch: -\nDinner: -\nAccommodation: -\n\nNumber of people: 2\nTotal cost: (218 + 26) * 2 = 488\n\nTotal cost across all days: 1,465 + 1,425 + 488 = 3,378\n\n**Note**: The total cost exceeds the specified budget of $1,900. Adjustments are needed to meet the budget constraint. Possible adjustments include choosing a less expensive flight or accommodation, or reducing meal costs.\n\nAdjusted Travel Plan:\n\nDays: 1\nCurrent City: from Milwaukee to New York\nTransportation: Self-driving, from Milwaukee to New York, duration: 13 hours 29 mins, distance: 1,417 km, cost: 70\nBreakfast: -\nAttraction: Times Square, New York (New York)\nLunch: Seasons 52 Fresh Grill, New York (New York), cost: 30, cuisines: Seafood, Indian, Desserts, Italian\nDinner: Lord of the Drinks Forum, New York (New York), cost: 71, cuisines: Cafe, Bakery, BBQ, Chinese, Indian\nAccommodation: A Contemporary Homelike Stay in the Best of BK, New York (New York), cost: 228, room type: Entire home/apt, house rules: No pets & No visitors & No children under 10, minimum nights: 2, maximum occupancy: 2\n\nNumber of people: 2\nTotal cost: (70 + 30 + 71) * 2 + 228 = 570\nAccommodation minimum nights: 1/2\n\nDays: 2\nCurrent City: New York\nTransportation: -\nBreakfast: Sir John Bakery Cafe, New York (New York), cost: 78, cuisines: Pizza, Bakery, Desserts\nAttraction: Central Park, New York (New York); The High Line, New York (New York)\nLunch: Gurgaon Hights, New York (New York), cost: 46, cuisines: Cafe, American, Indian, Fast Food\nDinner: Goosebumps, New York (New York), cost: 94, cuisines: Chinese, Pizza, Bakery\nAccommodation: A Contemporary Homelike Stay in the Best of BK, New York (New York), cost: 228, room type: Entire home/apt, house rules: No pets & No visitors & No children under 10, minimum nights: 2, maximum occupancy: 2\n\nNumber of people: 2\nTotal cost: (78 + 46 + 94) * 2 + 228 = 664\nAccommodation minimum nights: 2/2\n\nDays: 3\nCurrent City: from New York to Milwaukee\nTransportation: Self-driving, from New York to Milwaukee, duration: 13 hours 28 mins, distance: 1,417 km, cost: 70\nBreakfast: Green Chick Chop, New York (New York), cost: 26, cuisines: Tea, French, Cafe, Seafood\nAttraction: Statue of Liberty, New York (New York)\nLunch: -\nDinner: -\nAccommodation: -\n\nNumber of people: 2\nTotal cost: (70 + 26) * 2 = 192\n\nTotal cost across all days: 570 + 664 + 192 = 1,426\n\nCuisines: The plan includes a variety of cuisines, including the requested Seafood, Indian, Desserts, Italian, Cafe, American, Chinese, Pizza, Bakery, Tea, French, and BBQ.\n\n**Note**: The adjusted travel plan meets the budget constraint of $1,900.", "gpt-4-1106-preview_direct_sole-planning_parsed_results": [{"day": 1, "current_city": "from Milwaukee to New York", "transportation": "Flight Number: F3649645, from Milwaukee to New York, Departure Time: 10:50, Arrival Time: 14:22", "breakfast": "-", "attraction": "Times Square, New York;Seasons 52 Fresh Grill, New York;", "lunch": "Seasons 52 Fresh Grill, New York", "dinner": "Lord of the Drinks Forum, New York", "accommodation": "Beautiful and big 1BR sublet close by Central Park, New York"}, {"day": 2, "current_city": "New York", "transportation": "-", "breakfast": "Sir John Bakery Cafe, New York", "attraction": "Central Park, New York;The High Line, New York;", "lunch": "Gurgaon Hights, New York", "dinner": "Goosebumps, New York", "accommodation": "Beautiful and big 1BR sublet close by Central Park, New York"}, {"day": 3, "current_city": "from New York to Milwaukee", "transportation": "Flight Number: F3644990, from New York to Milwaukee, Departure Time: 15:20, Arrival Time: 16:27", "breakfast": "Green Chick Chop, New York", "attraction": "Statue of Liberty, New York", "lunch": "-", "dinner": "-", "accommodation": "-"}, {"day": 1, "current_city": "from Milwaukee to New York", "transportation": "Self-driving, from Milwaukee to New York, duration: 13 hours 29 mins, distance: 1,417 km", "breakfast": "-", "attraction": "Times Square, New York", "lunch": "Seasons 52 Fresh Grill, New York", "dinner": "Lord of the Drinks Forum, New York", "accommodation": "A Contemporary Homelike Stay in the Best of BK, New York"}, {"day": 2, "current_city": "New York", "transportation": "-", "breakfast": "Sir John Bakery Cafe, New York", "attraction": "Central Park, New York;The High Line, New York;", "lunch": "Gurgaon Hights, New York", "dinner": "Goosebumps, New York", "accommodation": "A Contemporary Homelike Stay in the Best of BK, New York"}, {"day": 3, "current_city": "from New York to Milwaukee", "transportation": "Self-driving, from New York to Milwaukee, duration: 13 hours 28 mins, distance: 1,417 km", "breakfast": "Green Chick Chop, New York", "attraction": "Statue of Liberty, New York", "lunch": "-", "dinner": "-", "accommodation": "-"}]}]