[{"gpt-4-1106-preview_direct_sole-planning_results": "Travel Plan:\n\nDays: 1\nCurrent City: from Missoula to Abilene (Texas)\nTransportation: Self-driving, from Missoula to Abilene, duration: 23 hours 1 min, distance: 2,562 km, cost: 128\nBreakfast: -\nAttraction: -\nLunch: -\nDinner: -\nAccommodation: Apartment minutes from manhattan, Abilene (Texas), cost: 295, room type: Entire home/apt, house rules: No pets & No visitors, minimum nights: 2, maximum occupancy: 2\n\nNumber of people: 5\nTotal cost: 128 * 5 + 295 * 3 = 1,365 (3 units booked to accommodate 5 people)\nAccommodation minimum nights: 1/2\n\nDays: 2\nCurrent City: Abilene (Texas)\nTransportation: -\nBreakfast: Thai Garden, Abilene (Texas), cost: 13, cuisines: Cafe, American, Desserts\nAttraction: The Grace Museum, Abilene (Texas); Frontier Texas!, Abilene (Texas)\nLunch: Mediumwelldone, Abilene (Texas), cost: 91, cuisines: Tea, French, BBQ, Cafe, Seafood\nDinner: LPK Waterfront, Abilene (Texas), cost: 61, cuisines: Pizza, Italian, BBQ, Fast Food, Seafood\nAccommodation: Apartment minutes from manhattan, Abilene (Texas), cost: 295, room type: Entire home/apt, house rules: No pets & No visitors, minimum nights: 2, maximum occupancy: 2\n\nNumber of people: 5\nTotal cost: (13 + 91 + 61) * 5 + 295 * 3 = 1,545\nAccommodation minimum nights: 2/2\n\nDays: 3\nCurrent City: from Abilene (Texas) to Amarillo (Texas)\nTransportation: Self-driving, from Abilene to Amarillo, duration: 4 hours 10 mins, distance: 446 km, cost: 22\nBreakfast: -\nAttraction: Cadillac Ranch, Amarillo (Texas); Amarillo Botanical Gardens, Amarillo (Texas)\nLunch: The Cinnamon Kitchen, Amarillo (Texas), cost: 69, cuisines: Desserts, Tea, Pizza, Chinese, Seafood\nDinner: Komachi, Amarillo (Texas), cost: 71, cuisines: Desserts, Tea, Fast Food, Chinese, Mediterranean\nAccommodation: Gramercy Park restful, cozy, sun-filled home, Amarillo (Texas), cost: 968, room type: Entire home/apt, house rules: No parties, minimum nights: 2, maximum occupancy: 8\n\nNumber of people: 5\nTotal cost: 22 * 5 + (69 + 71) * 5 + 968 = 1,678\nAccommodation minimum nights: 1/2\n\nDays: 4\nCurrent City: Amarillo (Texas)\nTransportation: -\nBreakfast: Wood Box Cafe, Amarillo (Texas), cost: 11, cuisines: Desserts, French, Fast Food, Cafe, American\nAttraction: Amarillo Zoo, Amarillo (Texas); Don Harrington Discovery Center, Amarillo (Texas)\nLunch: Sigree Global Grill, Amarillo (Texas), cost: 35, cuisines: Chinese, BBQ, Cafe, Desserts\nDinner: Anand Restaurant, Amarillo (Texas), cost: 53, cuisines: Fast Food, Seafood, Desserts, Italian\nAccommodation: Gramercy Park restful, cozy, sun-filled home, Amarillo (Texas), cost: 968, room type: Entire home/apt, house rules: No parties, minimum nights: 2, maximum occupancy: 8\n\nNumber of people: 5\nTotal cost: (11 + 35 + 53) * 5 + 968 = 1,468\nAccommodation minimum nights: 2/2\n\nDays: 5\nCurrent City: from Amarillo (Texas) to Missoula\nTransportation: Self-driving, from Amarillo to Missoula, duration: 18 hours 58 mins, distance: 2,102 km, cost: 105\nBreakfast: -\nAttraction: -\nLunch: -\nDinner: -\nAccommodation: -\n\nNumber of people: 5\nTotal cost: 105 * 5 = 525\n\nTotal cost across all days: 1,365 + 1,545 + 1,678 + 1,468 + 525 = 6,581\nCuisines: The prompt specifies Italian and French, and both of these cuisines have been represented in the restaurants chosen.", "gpt-4-1106-preview_direct_sole-planning_parsed_results": [{"day": 1, "current_city": "from Missoula to Abilene", "transportation": "Self-driving, from Missoula to Abilene, duration: 23 hours 1 min, distance: 2,562 km", "breakfast": "-", "attraction": "-", "lunch": "-", "dinner": "-", "accommodation": "Apartment minutes from manhattan, Abilene"}, {"day": 2, "current_city": "Abilene", "transportation": "-", "breakfast": "Thai Garden, Abilene", "attraction": "The Grace Museum, Abilene;Frontier Texas!, Abilene;", "lunch": "Mediumwelldone, Abilene", "dinner": "LPK Waterfront, Abilene", "accommodation": "Apartment minutes from manhattan, Abilene"}, {"day": 3, "current_city": "from Abilene to Amarillo", "transportation": "Self-driving, from Abilene to Amarillo, duration: 4 hours 10 mins, distance: 446 km", "breakfast": "-", "attraction": "Cadillac Ranch, Amarillo;Amarillo Botanical Gardens, Amarillo;", "lunch": "The Cinnamon Kitchen, Amarillo", "dinner": "Komachi, Amarillo", "accommodation": "Gramercy Park restful, cozy, sun-filled home, Amarillo"}, {"day": 4, "current_city": "Amarillo", "transportation": "-", "breakfast": "Wood Box Cafe, Amarillo", "attraction": "Amarillo Zoo, Amarillo;Don Harrington Discovery Center, Amarillo;", "lunch": "Sigree Global Grill, Amarillo", "dinner": "Anand Restaurant, Amarillo", "accommodation": "Gramercy Park restful, cozy, sun-filled home, Amarillo"}, {"day": 5, "current_city": "from Amarillo to Missoula", "transportation": "Self-driving, from Amarillo to Missoula, duration: 18 hours 58 mins, distance: 2,102 km", "breakfast": "-", "attraction": "-", "lunch": "-", "dinner": "-", "accommodation": "-"}]}]