[{"gpt-4-1106-preview_direct_sole-planning_results": "Travel Plan:\n\nDays: 1\nCurrent City: from Little Rock to Houston (Texas)\nTransportation: Flight Number: F3926600, from Little Rock to Houston (Texas), Departure Time: 17:08, Arrival Time: 19:01, cost: 84\nBreakfast: -\nAttraction: -\nLunch: -\nDinner: Jalapenos, Houston (Texas), cost: 57, cuisines: Desserts, Tea, Cafe, Chinese, Seafood\nAccommodation: Sunny and Airy near Manhattan, Houston (Texas), cost: 499, room type: Entire home/apt, house rules: No pets, minimum nights: 2, maximum occupancy: 4\n\nNumber of people: 1\nTotal cost: 84 + 57 + 499 = 640\nAccommodation minimum nights: 1/2\n\nDays: 2\nCurrent City: Houston (Texas)\nTransportation: -\nBreakfast: Super Bakery, Houston (Texas), cost: 30, cuisines: Seafood, Fast Food\nAttraction: Space Center Houston, Houston (Texas); Houston Museum of Natural Science, Houston (Texas)\nLunch: Sheetla Dhaba, Houston (Texas), cost: 35, cuisines: Desserts, Pizza, Bakery, American, Mediterranean\nDinner: Royal Mart, Houston (Texas), cost: 40, cuisines: Tea, Bakery, Cafe, Mediterranean, Seafood\nAccommodation: Sunny and Airy near Manhattan, Houston (Texas), cost: 499, room type: Entire home/apt, house rules: No pets, minimum nights: 2, maximum occupancy: 4\n\nNumber of people: 1\nTotal cost: 30 + 35 + 40 + 499 = 604\nAccommodation minimum nights: 2/2\n\nDays: 3\nCurrent City: from Houston (Texas) to Dallas (Texas)\nTransportation: Flight Number: F3673863, from Houston (Texas) to Dallas (Texas), Departure Time: 07:53, Arrival Time: 09:14, cost: 57\nBreakfast: -\nAttraction: The Dallas World Aquarium, Dallas (Texas); The Sixth Floor Museum at Dealey Plaza, Dallas (Texas)\nLunch: Coconuts Fish Cafe, Dallas (Texas), cost: 38, cuisines: Cafe, BBQ, Mediterranean, Fast Food\nDinner: 1918 Bistro & Grill, Dallas (Texas), cost: 90, cuisines: Tea, Pizza, BBQ, Seafood\nAccommodation: 1BR, elevator, kitchen, doorman!, Dallas (Texas), cost: 475, room type: Entire home/apt, house rules: No parties, minimum nights: 1, maximum occupancy: 3\n\nNumber of people: 1\nTotal cost: 57 + 38 + 90 + 475 = 660\nAccommodation minimum nights: 1/1\n\nDays: 4\nCurrent City: Dallas (Texas)\nTransportation: -\nBreakfast: Yanki Sizzlers, Dallas (Texas), cost: 96, cuisines: Cafe, French, Tea, Mediterranean\nAttraction: Reunion Tower, Dallas (Texas); Dallas Museum of Art, Dallas (Texas)\nLunch: Aravali Owls, Dallas (Texas), cost: 53, cuisines: Pizza, Italian, Bakery, Fast Food, Cafe\nDinner: Kebab Xpress, Dallas (Texas), cost: 93, cuisines: Tea, Bakery, Pizza, Mediterranean\nAccommodation: 1BR, elevator, kitchen, doorman!, Dallas (Texas), cost: 475, room type: Entire home/apt, house rules: No parties, minimum nights: 1, maximum occupancy: 3\n\nNumber of people: 1\nTotal cost: 96 + 53 + 93 + 475 = 717\nAccommodation minimum nights: 1/1\n\nDays: 5\nCurrent City: from Dallas (Texas) to Little Rock\nTransportation: Flight Number: F3592818, from Dallas (Texas) to Little Rock, Departure Time: 10:34, Arrival Time: 11:50, cost: 86\nBreakfast: -\nAttraction: -\nLunch: -\nDinner: -\nAccommodation: -\n\nNumber of people: 1\nTotal cost: 86\n\nTotal cost across all days: 640 + 604 + 660 + 717 + 86 = 2,707\n\nCuisines: The prompt specifies no particular cuisine preferences, and a variety of cuisines have been included in the restaurants chosen.", "gpt-4-1106-preview_direct_sole-planning_parsed_results": [{"day": 1, "current_city": "from Little Rock to Houston", "transportation": "Flight Number: F3926600, from Little Rock to Houston, Departure Time: 17:08, Arrival Time: 19:01", "breakfast": "-", "attraction": "-", "lunch": "-", "dinner": "Jalapenos, Houston", "accommodation": "Sunny and Airy near Manhattan, Houston"}, {"day": 2, "current_city": "Houston", "transportation": "-", "breakfast": "Super Bakery, Houston", "attraction": "Space Center Houston, Houston;Houston Museum of Natural Science, Houston;", "lunch": "Sheetla Dhaba, Houston", "dinner": "Royal Mart, Houston", "accommodation": "Sunny and Airy near Manhattan, Houston"}, {"day": 3, "current_city": "from Houston to Dallas", "transportation": "Flight Number: F3673863, from Houston to Dallas, Departure Time: 07:53, Arrival Time: 09:14", "breakfast": "-", "attraction": "The Dallas World Aquarium, Dallas;The Sixth Floor Museum at Dealey Plaza, Dallas;", "lunch": "Coconuts Fish Cafe, Dallas", "dinner": "1918 Bistro & Grill, Dallas", "accommodation": "1BR, elevator, kitchen, doorman!, Dallas"}, {"day": 4, "current_city": "Dallas", "transportation": "-", "breakfast": "Yanki Sizzlers, Dallas", "attraction": "Reunion Tower, Dallas;Dallas Museum of Art, Dallas;", "lunch": "Aravali Owls, Dallas", "dinner": "Kebab Xpress, Dallas", "accommodation": "1BR, elevator, kitchen, doorman!, Dallas"}, {"day": 5, "current_city": "from Dallas to Little Rock", "transportation": "Flight Number: F3592818, from Dallas to Little Rock, Departure Time: 10:34, Arrival Time: 11:50", "breakfast": "-", "attraction": "-", "lunch": "-", "dinner": "-", "accommodation": "-"}]}]