[{"gpt-4-1106-preview_direct_sole-planning_results": "Travel Plan:\n\nDays: 1\nCurrent City: from Ontario to Honolulu (Hawaii)\nTransportation: Flight Number: F3584294, from Ontario to Honolulu (Hawaii), Departure Time: 10:11, Arrival Time: 14:46, cost: 888\nBreakfast: -\nAttraction: -\nLunch: -\nDinner: Crystal Restaurant, Honolulu (Hawaii), cost: 57, cuisines: Tea, Pizza, Bakery, Fast Food, Chinese\nAccommodation: Sunny Room in Renovated Brooklyn Townhouse, Honolulu (Hawaii), cost: 626, room type: Private room, house rules: No pets & No visitors, minimum nights: 3, maximum occupancy: 2\n\nNumber of people: 1\nTotal cost: 888 + 57 + 626 = 1,571\nAccommodation minimum nights: 1/3\n\nDays: 2\nCurrent City: Honolulu (Hawaii)\nTransportation: -\nBreakfast: Bait El Khetyar, Honolulu (Hawaii), cost: 28, cuisines: Cafe, Seafood\nAttraction: Waikiki Aquarium, Honolulu (Hawaii); Iolani Palace, Honolulu (Hawaii)\nLunch: Nimtho, Honolulu (Hawaii), cost: 31, cuisines: Pizza, Mexican, Bakery, BBQ, Cafe, Mediterranean\nDinner: Dishoom, Honolulu (Hawaii), cost: 63, cuisines: Chinese, Bakery, Desserts\nAccommodation: Sunny Room in Renovated Brooklyn Townhouse, Honolulu (Hawaii), cost: 626, room type: Private room, house rules: No pets & No visitors, minimum nights: 3, maximum occupancy: 2\n\nNumber of people: 1\nTotal cost: 28 + 31 + 63 + 626 = 748\nAccommodation minimum nights: 2/3\n\nDays: 3\nCurrent City: from Honolulu (Hawaii) to Ontario\nTransportation: Flight Number: F3584327, from Honolulu (Hawaii) to Ontario, Departure Time: 14:35, Arrival Time: 22:02, cost: 1075\nBreakfast: -\nAttraction: -\nLunch: -\nDinner: -\nAccommodation: -\n\nNumber of people: 1\nTotal cost: 1075\n\nTotal cost across all days: 1,571 + 748 + 1075 = 3,394\n\nUnfortunately, the total cost exceeds the specified budget of $3,200. To adjust the plan within the budget, we can consider changing the accommodation to a less expensive option.\n\nRevised Accommodation for Days 1 and 2:\nAccommodation: Harlem 1 BR, Private Master Bath, Honolulu (Hawaii), cost: 396, room type: Private room, house rules: No pets, minimum nights: 2, maximum occupancy: 1\n\nRevised Total Costs:\nDays 1 and 2 Accommodation Cost: 396 * 2 = 792\nTotal Revised Cost: 888 + 57 + 792 + 28 + 31 + 63 + 1075 = 2,934\n\nThe revised total cost is now within the budget of $3,200.", "gpt-4-1106-preview_direct_sole-planning_parsed_results": [{"day": 1, "current_city": "from Ontario to Honolulu (Hawaii)", "transportation": "Flight Number: F3584294, from Ontario to Honolulu (Hawaii), Departure Time: 10:11, Arrival Time: 14:46", "breakfast": "-", "attraction": "-", "lunch": "-", "dinner": "Crystal Restaurant, Honolulu (Hawaii)", "accommodation": "Sunny Room in Renovated Brooklyn Townhouse, Honolulu (Hawaii)"}, {"day": 2, "current_city": "Honolulu (Hawaii)", "transportation": "-", "breakfast": "Bait El Khetyar, Honolulu (Hawaii)", "attraction": "Waikiki Aquarium, Honolulu (Hawaii);Iolani Palace, Honolulu (Hawaii);", "lunch": "Nimtho, Honolulu (Hawaii)", "dinner": "Dishoom, Honolulu (Hawaii)", "accommodation": "Harlem 1 BR, Private Master Bath, Honolulu (Hawaii)"}, {"day": 3, "current_city": "from Honolulu (Hawaii) to Ontario", "transportation": "Flight Number: F3584327, from Honolulu (Hawaii) to Ontario, Departure Time: 14:35, Arrival Time: 22:02", "breakfast": "-", "attraction": "-", "lunch": "-", "dinner": "-", "accommodation": "-"}]}]