[{"gpt-4-1106-preview_direct_sole-planning_results": "Travel Plan:\n\nDays: 1\nCurrent City: from Eau Claire to Rockford (Illinois)\nTransportation: Self-driving, from Eau Claire to Rockford, duration: 3 hours 42 mins, distance: 392 km, cost: 19\nBreakfast: -\nAttraction: -\nLunch: -\nDinner: Coco Bambu, Rockford (Illinois), cost: 72, cuisines: Tea, French, Bakery, BBQ, Cafe\nAccommodation: Private Room in a two bedroom apt., Rockford (Illinois), cost: 210, room type: Private room, house rules: No visitors & No smoking, maximum occupancy: 2\n\nNumber of people: 3\nTotal cost: 19 * 3 + 72 * 3 + 210 = 393\nAccommodation minimum nights: 1/1\n\nDays: 2\nCurrent City: Rockford (Illinois)\nTransportation: -\nBreakfast: Flying Mango, Rockford (Illinois), cost: 20, cuisines: American, BBQ, Seafood\nAttraction: Anderson Japanese Gardens, Rockford (Illinois)\nLunch: Aroma Rest O Bar, Rockford (Illinois), cost: 58, cuisines: Bakery, Fast Food, Chinese, American, Seafood\nDinner: Eggspectation - Jaypee Vasant Continental, Rockford (Illinois), cost: 77, cuisines: Tea, Mediterranean, Seafood\nAccommodation: Private Room in a two bedroom apt., Rockford (Illinois), cost: 210, room type: Private room, house rules: No visitors & No smoking, maximum occupancy: 2\n\nNumber of people: 3\nTotal cost: (20 + 58 + 77) * 3 + 210 = 735\nAccommodation minimum nights: 2/1\n\nDays: 3\nCurrent City: from Rockford (Illinois) to Peoria (Illinois)\nTransportation: Self-driving, from Rockford to Peoria, duration: 2 hours 17 mins, distance: 219 km, cost: 10\nBreakfast: -\nAttraction: Peoria Riverfront Museum, Peoria (Illinois)\nLunch: Keventers, Peoria (Illinois), cost: 69, cuisines: Tea, Pizza, Bakery, BBQ, Chinese\nDinner: Barbeque Nation, Peoria (Illinois), cost: 64, cuisines: Desserts, Tea, Pizza, Italian, Indian, Seafood\nAccommodation: Artful UWS King Room - near Central Park, Museums, Peoria (Illinois), cost: 219, room type: Private room, house rules: No smoking, maximum occupancy: 2\n\nNumber of people: 3\nTotal cost: 10 * 3 + (69 + 64) * 3 + 219 = 723\nAccommodation minimum nights: 1/1\n\nDays: 4\nCurrent City: Peoria (Illinois)\nTransportation: -\nBreakfast: The Street- Curries & Grills, Peoria (Illinois), cost: 66, cuisines: Cafe, Pizza, Seafood, Fast Food\nAttraction: Peoria Zoo, Peoria (Illinois)\nLunch: Wasabi Sushi and Thai, Peoria (Illinois), cost: 72, cuisines: Tea, Italian, BBQ, Fast Food, Seafood\nDinner: The Curzon Room - Maidens Hotel, Peoria (Illinois), cost: 50, cuisines: Pizza, French, Bakery, BBQ, Cafe\nAccommodation: Artful UWS King Room - near Central Park, Museums, Peoria (Illinois), cost: 219, room type: Private room, house rules: No smoking, maximum occupancy: 2\n\nNumber of people: 3\nTotal cost: (66 + 72 + 50) * 3 + 219 = 891\nAccommodation minimum nights: 2/1\n\nDays: 5\nCurrent City: from Peoria (Illinois) to Chicago (Illinois)\nTransportation: Self-driving, from Peoria to Chicago, duration: 2 hours 34 mins, distance: 269 km, cost: 13\nBreakfast: -\nAttraction: Navy Pier, Chicago (Illinois)\nLunch: Pantry d'or, Chicago (Illinois), cost: 53, cuisines: Tea, BBQ, Fast Food, Cafe, Indian\nDinner: The Black Pearl, Chicago (Illinois), cost: 63, cuisines: Cafe, Bakery\nAccommodation: NYC Firehouse-Greenpoint BRKLYN, Chicago (Illinois), cost: 109, room type: Entire home/apt, house rules: No smoking & No parties, maximum occupancy: 3\n\nNumber of people: 3\nTotal cost: 13 * 3 + (53 + 63) * 3 + 109 = 529\nAccommodation minimum nights: 1/3\n\nDays: 6\nCurrent City: Chicago (Illinois)\nTransportation: -\nBreakfast: Bro's Kitchenette, Chicago (Illinois), cost: 38, cuisines: Mexican, Desserts, Seafood\nAttraction: Millennium Park, Chicago (Illinois)\nLunch: FIO Cookhouse and Bar, Chicago (Illinois), cost: 31, cuisines: Desserts, Mexican, Fast Food, Cafe, Seafood\nDinner: Mini's Royal Cafe, Chicago (Illinois), cost: 72, cuisines: Tea, Cafe, Bakery\nAccommodation: NYC Firehouse-Greenpoint BRKLYN, Chicago (Illinois), cost: 109, room type: Entire home/apt, house rules: No smoking & No parties, maximum occupancy: 3\n\nNumber of people: 3\nTotal cost: (38 + 31 + 72) * 3 + 109 = 709\nAccommodation minimum nights: 2/3\n\nDays: 7\nCurrent City: from Chicago (Illinois) to Eau Claire\nTransportation: Self-driving, from Chicago to Eau Claire, duration: 4 hours 44 mins, distance: 511 km, cost: 25\nBreakfast: -\nAttraction: -\nLunch: -\nDinner: -\nAccommodation: -\n\nNumber of people: 3\nTotal cost: 25 * 3 = 75\n\nTotal cost across all days: 393 + 735 + 723 + 891 + 529 + 709 + 75 = 4,055\n\nCuisines: The prompt specifies American, Chinese, French, and Italian, and all of these cuisines have been represented in the restaurants chosen.", "gpt-4-1106-preview_direct_sole-planning_parsed_results": [{"day": 1, "current_city": "from Eau Claire to Rockford", "transportation": "Self-driving, from Eau Claire to Rockford, duration: 3 hours 42 mins, distance: 392 km", "breakfast": "-", "attraction": "-", "lunch": "-", "dinner": "Coco Bambu, Rockford", "accommodation": "Private Room in a two bedroom apt., Rockford"}, {"day": 2, "current_city": "Rockford", "transportation": "-", "breakfast": "Flying Mango, Rockford", "attraction": "Anderson Japanese Gardens, Rockford", "lunch": "Aroma Rest O Bar, Rockford", "dinner": "Eggspectation - Jaypee Vasant Continental, Rockford", "accommodation": "Private Room in a two bedroom apt., Rockford"}, {"day": 3, "current_city": "from Rockford to Peoria", "transportation": "Self-driving, from Rockford to Peoria, duration: 2 hours 17 mins, distance: 219 km", "breakfast": "-", "attraction": "Peoria Riverfront Museum, Peoria", "lunch": "Keventers, Peoria", "dinner": "Barbeque Nation, Peoria", "accommodation": "Artful UWS King Room - near Central Park, Museums, Peoria"}, {"day": 4, "current_city": "Peoria", "transportation": "-", "breakfast": "The Street- Curries & Grills, Peoria", "attraction": "Peoria Zoo, Peoria", "lunch": "Wasabi Sushi and Thai, Peoria", "dinner": "The Curzon Room - Maidens Hotel, Peoria", "accommodation": "Artful UWS King Room - near Central Park, Museums, Peoria"}, {"day": 5, "current_city": "from Peoria to Chicago", "transportation": "Self-driving, from Peoria to Chicago, duration: 2 hours 34 mins, distance: 269 km", "breakfast": "-", "attraction": "Navy Pier, Chicago", "lunch": "Pantry d'or, Chicago", "dinner": "The Black Pearl, Chicago", "accommodation": "NYC Firehouse-Greenpoint BRKLYN, Chicago"}, {"day": 6, "current_city": "Chicago", "transportation": "-", "breakfast": "Bro's Kitchenette, Chicago", "attraction": "Millennium Park, Chicago", "lunch": "FIO Cookhouse and Bar, Chicago", "dinner": "Mini's Royal Cafe, Chicago", "accommodation": "NYC Firehouse-Greenpoint BRKLYN, Chicago"}, {"day": 7, "current_city": "from Chicago to Eau Claire", "transportation": "Self-driving, from Chicago to Eau Claire, duration: 4 hours 44 mins, distance: 511 km", "breakfast": "-", "attraction": "-", "lunch": "-", "dinner": "-", "accommodation": "-"}]}]