[{"gpt-4-1106-preview_direct_sole-planning_results": "Travel Plan:\n\nDays: 1\nCurrent City: from Newark to Madison (Wisconsin)\nTransportation: Flight Number: F4073170, from Newark to Madison (Wisconsin), Departure Time: 18:26, Arrival Time: 19:56, cost: 355\nBreakfast: -\nAttraction: -\nLunch: -\nDinner: Barbeque Nation, Madison (Wisconsin), cost: 38, cuisines: Tea, Pizza, French, Bakery, Cafe\nAccommodation: Perfectly Located UpperWest Futon, Madison (Wisconsin), cost: 164, room type: Shared room, house rules: No pets & No children under 10, minimum nights: 2, maximum occupancy: 1\n\nNumber of people: 2\nTotal cost: (355 + 38) * 2 + 164 = 950\nAccommodation minimum nights: 1/2\n\nDays: 2\nCurrent City: Madison (Wisconsin)\nTransportation: -\nBreakfast: Moet's Sizzlers, Madison (Wisconsin), cost: 10, cuisines: French, Bakery, Pizza, Mediterranean\nAttraction: Wisconsin State Capitol, Madison (Wisconsin); Madison Museum of Contemporary Art, Madison (Wisconsin)\nLunch: 99 North Restaurant, Madison (Wisconsin), cost: 62, cuisines: Fast Food, Mexican, Indian, Pizza\nDinner: Food Cafe, Madison (Wisconsin), cost: 85, cuisines: Tea, Pizza, Fast Food, American, Seafood\nAccommodation: Perfectly Located UpperWest Futon, Madison (Wisconsin), cost: 164, room type: Shared room, house rules: No pets & No children under 10, minimum nights: 2, maximum occupancy: 1\n\nNumber of people: 2\nTotal cost: (10 + 62 + 85) * 2 + 164 = 524\nAccommodation minimum nights: 2/2\n\nDays: 3\nCurrent City: from Madison to Mosinee (Wisconsin)\nTransportation: Taxi, from Madison to Mosinee, duration: 2 hours 3 mins, distance: 209 km, cost: 209\nBreakfast: -\nAttraction: Big Eau Pleine County Park, Mosinee (Wisconsin); Rib Mountain State Park, Mosinee (Wisconsin)\nLunch: Cafe Sante, Mosinee (Wisconsin), cost: 49, cuisines: Pizza, BBQ, Cafe, American, Mediterranean, Seafood\nDinner: House of China Restaurant II, Mosinee (Wisconsin), cost: 96, cuisines: Tea, Pizza, French, Cafe, Seafood\nAccommodation: Where Dreams are made of NYC, Mosinee (Wisconsin), cost: 212, room type: Shared room, house rules: No smoking & No children under 10, minimum nights: 1, maximum occupancy: 1\n\nNumber of people: 2\nTotal cost: 209 + (49 + 96) * 2 + 212 = 711\nAccommodation minimum nights: 1/1\n\nDays: 4\nCurrent City: Mosinee (Wisconsin)\nTransportation: -\nBreakfast: Grit, Mosinee (Wisconsin), cost: 28, cuisines: Bakery, BBQ, Seafood\nAttraction: Leigh Yawkey Woodson Art Museum, Mosinee (Wisconsin); Granite Peak Ski Area, Mosinee (Wisconsin)\nLunch: Delifrance - The France Cafe Bakery, Mosinee (Wisconsin), cost: 44, cuisines: Cafe, French, BBQ, Bakery, Fast Food, Chinese\nDinner: Senorita's, Mosinee (Wisconsin), cost: 94, cuisines: Fast Food, Chinese, Cafe, Seafood\nAccommodation: Where Dreams are made of NYC, Mosinee (Wisconsin), cost: 212, room type: Shared room, house rules: No smoking & No children under 10, minimum nights: 1, maximum occupancy: 1\n\nNumber of people: 2\nTotal cost: (28 + 44 + 94) * 2 + 212 = 600\nAccommodation minimum nights: 2/1\n\nDays: 5\nCurrent City: from Mosinee to Newark\nTransportation: Self-driving, from Mosinee to Newark, duration: 15 hours 32 mins, distance: 1,695 km, cost: 84\nBreakfast: -\nAttraction: -\nLunch: -\nDinner: -\nAccommodation: -\n\nNumber of people: 2\nTotal cost: 84 * 2 = 168\n\nTotal cost across all days: 950 + 524 + 711 + 600 + 168 = 2,953\n\nNote: The total cost exceeds the budget by $253. Adjustments to the plan would be required to meet the budget constraint. Options include changing transportation methods, selecting different restaurants, or finding more affordable accommodations.", "gpt-4-1106-preview_direct_sole-planning_parsed_results": [{"day": 1, "current_city": "from Newark to Madison (Wisconsin)", "transportation": "Flight Number: F4073170, from Newark to Madison (Wisconsin), Departure Time: 18:26, Arrival Time: 19:56", "breakfast": "-", "attraction": "-", "lunch": "-", "dinner": "Barbeque Nation, Madison (Wisconsin)", "accommodation": "Perfectly Located UpperWest Futon, Madison (Wisconsin)"}, {"day": 2, "current_city": "Madison (Wisconsin)", "transportation": "-", "breakfast": "Moet's Sizzlers, Madison (Wisconsin)", "attraction": "Wisconsin State Capitol, Madison (Wisconsin);Madison Museum of Contemporary Art, Madison (Wisconsin);", "lunch": "99 North Restaurant, Madison (Wisconsin)", "dinner": "Food Cafe, Madison (Wisconsin)", "accommodation": "Perfectly Located UpperWest Futon, Madison (Wisconsin)"}, {"day": 3, "current_city": "from Madison to Mosinee (Wisconsin)", "transportation": "Taxi, from Madison to Mosinee, duration: 2 hours 3 mins, distance: 209 km", "breakfast": "-", "attraction": "Big Eau Pleine County Park, Mosinee (Wisconsin);Rib Mountain State Park, Mosinee (Wisconsin);", "lunch": "Cafe Sante, Mosinee (Wisconsin)", "dinner": "House of China Restaurant II, Mosinee (Wisconsin)", "accommodation": "Where Dreams are made of NYC, Mosinee (Wisconsin)"}, {"day": 4, "current_city": "Mosinee (Wisconsin)", "transportation": "-", "breakfast": "Grit, Mosinee (Wisconsin)", "attraction": "Leigh Yawkey Woodson Art Museum, Mosinee (Wisconsin);Granite Peak Ski Area, Mosinee (Wisconsin);", "lunch": "Delifrance - The France Cafe Bakery, Mosinee (Wisconsin)", "dinner": "Senorita's, Mosinee (Wisconsin)", "accommodation": "Where Dreams are made of NYC, Mosinee (Wisconsin)"}, {"day": 5, "current_city": "from Mosinee to Newark", "transportation": "Self-driving, from Mosinee to Newark, duration: 15 hours 32 mins, distance: 1,695 km", "breakfast": "-", "attraction": "-", "lunch": "-", "dinner": "-", "accommodation": "-"}]}]