[{"gpt-4-1106-preview_direct_sole-planning_results": "Travel Plan:\n\nDays: 1\nCurrent City: from Las Vegas to Santa Maria (California)\nTransportation: Self-driving, from Las Vegas to Santa Maria, duration: 6 hours 17 mins, distance: 634 km, cost: 31\nBreakfast: -\nAttraction: -\nLunch: -\nDinner: Pirates of Grill, Santa Maria (California), cost: 90, cuisines: Bakery, BBQ, Fast Food, American, Mediterranean, Seafood\nAccommodation: Large Bedroom on upper west/columbia, Santa Maria (California), cost: 98, room type: Private room, house rules: No parties & No pets, minimum nights: 1, maximum occupancy: 2\n\nNumber of people: 4\nTotal cost: (31 * 4) + (90 * 4) + (98 * 2) = 124 + 360 + 196 = 680\nAccommodation minimum nights: 1/1\n\nDays: 2\nCurrent City: Santa Maria (California)\nTransportation: -\nBreakfast: Indian By Nature, Santa Maria (California), cost: 45, cuisines: Tea, Pizza, Bakery, BBQ, Mediterranean\nAttraction: Santa Maria Valley Discovery Museum, Santa Maria (California); Santa Maria Museum of Flight, Santa Maria (California)\nLunch: RiverDine Restaurant & Bar, Santa Maria (California), cost: 71, cuisines: Chinese, BBQ, Seafood\nDinner: Kuremal Mohan Lal Kulfi Wale, Santa Maria (California), cost: 84, cuisines: Desserts, Italian, BBQ, Bakery, American, Seafood\nAccommodation: Large Bedroom on upper west/columbia, Santa Maria (California), cost: 98, room type: Private room, house rules: No parties & No pets, minimum nights: 1, maximum occupancy: 2\n\nNumber of people: 4\nTotal cost: (45 + 71 + 84) * 4 + (98 * 2) = 800 + 196 = 996\nAccommodation minimum nights: 2/1\n\nDays: 3\nCurrent City: from Santa Maria (California) to Las Vegas\nTransportation: Self-driving, from Santa Maria to Las Vegas, duration: 6 hours 19 mins, distance: 636 km, cost: 31\nBreakfast: Nashta, Santa Maria (California), cost: 13, cuisines: Tea, Chinese, Bakery, Mediterranean\nAttraction: -\nLunch: -\nDinner: -\nAccommodation: -\n\nNumber of people: 4\nTotal cost: (31 * 4) + (13 * 4) = 124 + 52 = 176\n\nTotal cost across all days: 680 + 996 + 176 = 1,852\nCuisines: The prompt specifies American and Mediterranean, and both of these cuisines have been represented in the restaurants chosen.\n\nNote: The travel plan adheres to the budget of $3,700, includes American and Mediterranean cuisines, and ensures that the accommodation is not shared and follows the house rules. Attractions are included on the second day, and the transportation method is consistent (self-driving) throughout the trip.", "gpt-4-1106-preview_direct_sole-planning_parsed_results": [{"day": 1, "current_city": "from Las Vegas to Santa Maria", "transportation": "Self-driving, from Las Vegas to Santa Maria, duration: 6 hours 17 mins, distance: 634 km", "breakfast": "-", "attraction": "-", "lunch": "-", "dinner": "Pirates of Grill, Santa Maria", "accommodation": "Large Bedroom on upper west/columbia, Santa Maria"}, {"day": 2, "current_city": "Santa Maria", "transportation": "-", "breakfast": "Indian By Nature, Santa Maria", "attraction": "Santa Maria Valley Discovery Museum, Santa Maria;Santa Maria Museum of Flight, Santa Maria;", "lunch": "RiverDine Restaurant & Bar, Santa Maria", "dinner": "Kuremal Mohan Lal Kulfi Wale, Santa Maria", "accommodation": "Large Bedroom on upper west/columbia, Santa Maria"}, {"day": 3, "current_city": "from Santa Maria to Las Vegas", "transportation": "Self-driving, from Santa Maria to Las Vegas, duration: 6 hours 19 mins, distance: 636 km", "breakfast": "Nashta, Santa Maria", "attraction": "-", "lunch": "-", "dinner": "-", "accommodation": "-"}]}]