[{"gpt-4-1106-preview_direct_sole-planning_results": "Travel Plan:\n\nDays: 1\nCurrent City: from Islip to State College (Pennsylvania)\nTransportation: Self-driving, from Islip to State College, duration: 4 hours 52 mins, distance: 464 km, cost: 23\nBreakfast: -\nAttraction: -\nLunch: -\nDinner: Amici Cafe, State College (Pennsylvania), cost: 96, cuisines: Pizza, Bakery, BBQ, Chinese, Seafood\nAccommodation: Beautiful, Newly Furnished, Luxury, Grand Central, State College (Pennsylvania), cost: 210, room type: Entire home/apt, house rules: No parties, minimum nights: 1, maximum occupancy: 2\n\nNumber of people: 2\nTotal cost: 23 + (96 + 210) * 2 = 635\nAccommodation minimum nights: 1/1\n\nDays: 2\nCurrent City: State College (Pennsylvania)\nTransportation: -\nBreakfast: The Waffle Shop, State College (Pennsylvania), cost: 25, cuisines: American, Breakfast\nAttraction: The Arboretum at Penn State, State College (Pennsylvania)\nLunch: Kawa Sushi, State College (Pennsylvania), cost: 82, cuisines: French, Mexican, Desserts, Fast Food\nDinner: Fusion Food Corner, State College (Pennsylvania), cost: 46, cuisines: Bakery, Mexican, BBQ, Italian\nAccommodation: Beautiful, Newly Furnished, Luxury, Grand Central, State College (Pennsylvania), cost: 210, room type: Entire home/apt, house rules: No parties, minimum nights: 1, maximum occupancy: 2\n\nNumber of people: 2\nTotal cost: (25 + 82 + 46) * 2 + 210 = 526\nAccommodation minimum nights: 2/1\n\nDays: 3\nCurrent City: from State College to Johnstown (Pennsylvania)\nTransportation: Self-driving, from State College to Johnstown, duration: 1 hour 29 mins, distance: 137 km, cost: 6\nBreakfast: -\nAttraction: Johnstown Flood Museum, Johnstown (Pennsylvania)\nLunch: The National, Johnstown (Pennsylvania), cost: 47, cuisines: Chinese, BBQ, Cafe, Seafood\nDinner: Souza Lobo, Johnstown (Pennsylvania), cost: 92, cuisines: Tea, Mexican, Bakery, Cafe, Indian\nAccommodation: Modern duplex 30 minutes to Times Square, Johnstown (Pennsylvania), cost: 334, room type: Entire home/apt, house rules: No smoking, minimum nights: 1, maximum occupancy: 2\n\nNumber of people: 2\nTotal cost: 6 + (47 + 92) * 2 + 334 = 618\nAccommodation minimum nights: 1/1\n\nDays: 4\nCurrent City: Johnstown (Pennsylvania)\nTransportation: -\nBreakfast: The Corner Coffee Shoppe, Johnstown (Pennsylvania), cost: 15, cuisines: Coffee, Bakery\nAttraction: Heritage Discovery Center, Johnstown (Pennsylvania)\nLunch: Palmshore, Johnstown (Pennsylvania), cost: 61, cuisines: Bakery, American, BBQ, Fast Food\nDinner: Chicken Inn Family Meat Shop, Johnstown (Pennsylvania), cost: 79, cuisines: Desserts, Bakery, Fast Food, Mediterranean, Seafood\nAccommodation: Modern duplex 30 minutes to Times Square, Johnstown (Pennsylvania), cost: 334, room type: Entire home/apt, house rules: No smoking, minimum nights: 1, maximum occupancy: 2\n\nNumber of people: 2\nTotal cost: (15 + 61 + 79) * 2 + 334 = 644\nAccommodation minimum nights: 2/1\n\nDays: 5\nCurrent City: from Johnstown to Islip\nTransportation: Self-driving, from Johnstown to Islip, duration: 5 hours 57 mins, distance: 590 km, cost: 29\nBreakfast: -\nAttraction: -\nLunch: -\nDinner: -\nAccommodation: -\n\nNumber of people: 2\nTotal cost: 29 * 2 = 58\n\nTotal cost across all days: 635 + 526 + 618 + 644 + 58 = 2,481\n\nCuisines: The prompt does not specify required cuisines, so a variety of cuisines have been included.\nAccommodations: All accommodations are entire home/apt and allow children under 10, as specified.\nTransportation: No flights have been included, as per the request. All transportation is self-driving.\n\nPlease note that the restaurants and attractions chosen are based on the provided CSV data and are assumed to be open and available during the travel dates. The costs are calculated based on the information provided and are for two people. The travel plan is within the specified budget of $2,700.", "gpt-4-1106-preview_direct_sole-planning_parsed_results": [{"day": 1, "current_city": "from Islip to State College", "transportation": "Self-driving, from Islip to State College, duration: 4 hours 52 mins, distance: 464 km", "breakfast": "-", "attraction": "-", "lunch": "-", "dinner": "Amici Cafe, State College", "accommodation": "Beautiful, Newly Furnished, Luxury, Grand Central, State College"}, {"day": 2, "current_city": "State College", "transportation": "-", "breakfast": "The Waffle Shop, State College", "attraction": "The Arboretum at Penn State, State College;", "lunch": "Kawa Sushi, State College", "dinner": "Fusion Food Corner, State College", "accommodation": "Beautiful, Newly Furnished, Luxury, Grand Central, State College"}, {"day": 3, "current_city": "from State College to Johnstown", "transportation": "Self-driving, from State College to Johnstown, duration: 1 hour 29 mins, distance: 137 km", "breakfast": "-", "attraction": "Johnstown Flood Museum, Johnstown;", "lunch": "The National, Johnstown", "dinner": "Souza Lobo, Johnstown", "accommodation": "Modern duplex 30 minutes to Times Square, Johnstown"}, {"day": 4, "current_city": "Johnstown", "transportation": "-", "breakfast": "The Corner Coffee Shoppe, Johnstown", "attraction": "Heritage Discovery Center, Johnstown;", "lunch": "Palmshore, Johnstown", "dinner": "Chicken Inn Family Meat Shop, Johnstown", "accommodation": "Modern duplex 30 minutes to Times Square, Johnstown"}, {"day": 5, "current_city": "from Johnstown to Islip", "transportation": "Self-driving, from Johnstown to Islip, duration: 5 hours 57 mins, distance: 590 km", "breakfast": "-", "attraction": "-", "lunch": "-", "dinner": "-", "accommodation": "-"}]}]