[{"gpt-4-1106-preview_direct_sole-planning_results": "Travel Plan:\n\nDays: 1\nCurrent City: from Grand Junction to Phoenix (Arizona)\nTransportation: Taxi, from Grand Junction to Phoenix, duration: 9 hours 11 mins, distance: 934 km, cost: 934\nBreakfast: -\nAttraction: -\nLunch: -\nDinner: Pizza Hut, Phoenix (Arizona), cost: 30, cuisines: Tea, Chinese, Desserts, Seafood\nAccommodation: Murray Hill, The Heart of Manhattan, Phoenix (Arizona), cost: 361, room type: Private room, house rules: No smoking, minimum nights: 3, maximum occupancy: 1\n\nNumber of people: 2\nTotal cost: 934 + (30 * 2) + 361 = 1,355\nAccommodation minimum nights: 1/3\n\nDays: 2\nCurrent City: Phoenix (Arizona)\nTransportation: -\nBreakfast: Doughlicious, Phoenix (Arizona), cost: 41, cuisines: French, Pizza, BBQ\nAttraction: Desert Botanical Garden, Phoenix (Arizona); Heard Museum, Phoenix (Arizona)\nLunch: Mama Loca, Phoenix (Arizona), cost: 27, cuisines: Desserts, Pizza, Italian, Bakery, Fast Food\nDinner: Village Restaurant, Phoenix (Arizona), cost: 35, cuisines: Tea, Cafe, Desserts, Italian\nAccommodation: Murray Hill, The Heart of Manhattan, Phoenix (Arizona), cost: 361, room type: Private room, house rules: No smoking, minimum nights: 3, maximum occupancy: 1\n\nNumber of people: 2\nTotal cost: (41 + 27 + 35) * 2 + 361 = 542\nAccommodation minimum nights: 2/3\n\nDays: 3\nCurrent City: from Phoenix (Arizona) to Tucson (Arizona)\nTransportation: Self-driving, from Phoenix to Tucson, duration: 1 hour 44 mins, distance: 181 km, cost: 9\nBreakfast: Mocambo, Phoenix (Arizona), cost: 76, cuisines: Tea, Chinese, Desserts, Fast Food\nAttraction: Pima Air & Space Museum, Tucson (Arizona); Reid Park Zoo, Tucson (Arizona)\nLunch: Villa Tevere, Tucson (Arizona), cost: 37, cuisines: Mexican, Mediterranean, Desserts, Fast Food\nDinner: Consort Restaurant, Tucson (Arizona), cost: 54, cuisines: Bakery, Pizza, Indian, Desserts\nAccommodation: Furnished Room in Williamsburg, Tucson (Arizona), cost: 331, room type: Private room, house rules: No parties, minimum nights: 1, maximum occupancy: 2\n\nNumber of people: 2\nTotal cost: 9 + (76 + 37 + 54) * 2 + 331 = 670\nAccommodation minimum nights: 1/1\n\nDays: 4\nCurrent City: Tucson (Arizona)\nTransportation: -\nBreakfast: Magic Spice Wok, Tucson (Arizona), cost: 31, cuisines: Cafe, Bakery, BBQ, Chinese, Seafood\nAttraction: Tucson Botanical Gardens, Tucson (Arizona); The Mini Time Machine Museum of Miniatures, Tucson (Arizona)\nLunch: Pizza Street, Tucson (Arizona), cost: 22, cuisines: Fast Food, Bakery, Seafood\nDinner: La Plage, Tucson (Arizona), cost: 93, cuisines: Seafood, Bakery, Desserts, Italian\nAccommodation: Furnished Room in Williamsburg, Tucson (Arizona), cost: 331, room type: Private room, house rules: No parties, minimum nights: 1, maximum occupancy: 2\n\nNumber of people: 2\nTotal cost: (31 + 22 + 93) * 2 + 331 = 631\nAccommodation minimum nights: 2/1\n\nDays: 5\nCurrent City: from Tucson to Grand Junction\nTransportation: Taxi, from Tucson to Grand Junction, duration: 10 hours 36 mins, distance: 1,113 km, cost: 1113\nBreakfast: -\nAttraction: -\nLunch: -\nDinner: -\nAccommodation: -\n\nNumber of people: 2\nTotal cost: 1113 * 2 = 2226\n\nTotal cost across all days: 1,355 + 542 + 670 + 631 + 2226 = 5,424\n\nUnfortunately, the total cost of the travel plan exceeds the specified budget of $2,100. Adjustments will need to be made to the plan to reduce costs. This could involve choosing more affordable transportation options, such as self-driving for the return trip, and selecting less expensive accommodations and dining options.", "gpt-4-1106-preview_direct_sole-planning_parsed_results": [{"day": 1, "current_city": "from Grand Junction to Phoenix", "transportation": "Taxi, from Grand Junction to Phoenix, duration: 9 hours 11 mins, distance: 934 km", "breakfast": "-", "attraction": "-", "lunch": "-", "dinner": "Pizza Hut, Phoenix", "accommodation": "Murray Hill, The Heart of Manhattan, Phoenix"}, {"day": 2, "current_city": "Phoenix", "transportation": "-", "breakfast": "Doughlicious, Phoenix", "attraction": "Desert Botanical Garden, Phoenix;Heard Museum, Phoenix;", "lunch": "Mama Loca, Phoenix", "dinner": "Village Restaurant, Phoenix", "accommodation": "Murray Hill, The Heart of Manhattan, Phoenix"}, {"day": 3, "current_city": "from Phoenix to Tucson", "transportation": "Self-driving, from Phoenix to Tucson, duration: 1 hour 44 mins, distance: 181 km", "breakfast": "Mocambo, Phoenix", "attraction": "Pima Air & Space Museum, Tucson;Reid Park Zoo, Tucson;", "lunch": "Villa Tevere, Tucson", "dinner": "Consort Restaurant, Tucson", "accommodation": "Furnished Room in Williamsburg, Tucson"}, {"day": 4, "current_city": "Tucson", "transportation": "-", "breakfast": "Magic Spice Wok, Tucson", "attraction": "Tucson Botanical Gardens, Tucson;The Mini Time Machine Museum of Miniatures, Tucson;", "lunch": "Pizza Street, Tucson", "dinner": "La Plage, Tucson", "accommodation": "Furnished Room in Williamsburg, Tucson"}, {"day": 5, "current_city": "from Tucson to Grand Junction", "transportation": "Taxi, from Tucson to Grand Junction, duration: 10 hours 36 mins, distance: 1,113 km", "breakfast": "-", "attraction": "-", "lunch": "-", "dinner": "-", "accommodation": "-"}]}]