[{"gpt-4-1106-preview_direct_sole-planning_results": "Travel Plan:\n\nDays: 1\nCurrent City: from Gainesville to Wilmington (North Carolina)\nTransportation: Self-driving, from Gainesville to Wilmington, duration: 7 hours 29 mins, distance: 814 km, cost: 40\nBreakfast: -\nAttraction: -\nLunch: -\nDinner: Azteca, Wilmington (North Carolina), cost: 56, cuisines: Cafe, Indian, BBQ\nAccommodation: Private Bedroom in Williamsburg!, Wilmington (North Carolina), cost: 400, room type: Private room, house rules: No pets, minimum nights: 1, maximum occupancy: 2\n\nNumber of people: 1\nTotal cost: 40 + 56 + 400 = 496\nAccommodation minimum nights: 1/1\n\nDays: 2\nCurrent City: Wilmington (North Carolina)\nTransportation: -\nBreakfast: Dunkin' Donuts, Wilmington (North Carolina), cost: 25, cuisines: Desserts, Tea, Pizza, Italian, French\nAttraction: Bellamy Mansion Museum, Wilmington (North Carolina); Wilmington Riverwalk, Wilmington (North Carolina)\nLunch: Bandit Burrito, Wilmington (North Carolina), cost: 26, cuisines: Desserts, French, Bakery, Fast Food, Seafood\nDinner: Moonie's Texas Barbecue, Wilmington (North Carolina), cost: 38, cuisines: Chinese, Bakery, Fast Food\nAccommodation: Private Bedroom in Williamsburg!, Wilmington (North Carolina), cost: 400, room type: Private room, house rules: No pets, minimum nights: 1, maximum occupancy: 2\n\nNumber of people: 1\nTotal cost: 25 + 26 + 38 + 400 = 489\nAccommodation minimum nights: 2/1\n\nDays: 3\nCurrent City: from Wilmington (North Carolina) to Fayetteville (North Carolina)\nTransportation: Self-driving, from Wilmington to Fayetteville, duration: 1 hour 43 mins, distance: 149 km, cost: 7\nBreakfast: -\nAttraction: Airborne & Special Operations Museum Foundation, Fayetteville (North Carolina); Cape Fear Botanical Garden, Fayetteville (North Carolina)\nLunch: DiVine, Fayetteville (North Carolina), cost: 32, cuisines: Mexican, BBQ, Bakery, Cafe, Seafood\nDinner: Eat Street, Fayetteville (North Carolina), cost: 63, cuisines: Tea, French, BBQ, Seafood\nAccommodation: *CoZy Private Williamsburg Home*, Fayetteville (North Carolina), cost: 546, room type: Entire home/apt, house rules: No children under 10 & No smoking & No visitors, minimum nights: 1, maximum occupancy: 5\n\nNumber of people: 1\nTotal cost: 7 + 32 + 63 + 546 = 648\nAccommodation minimum nights: 1/2\n\nDays: 4\nCurrent City: Fayetteville (North Carolina)\nTransportation: -\nBreakfast: Dunkin' Donuts, Fayetteville (North Carolina), cost: 25, cuisines: Desserts, Tea, Pizza, Italian, French\nAttraction: Fayetteville Rose Garden, Fayetteville (North Carolina); ZipQuest - Waterfall & Treetop Adventure, Fayetteville (North Carolina)\nLunch: Pind Balluchi, Fayetteville (North Carolina), cost: 80, cuisines: Cafe, Pizza, BBQ, Fast Food\nDinner: The Great Indian Pub, Fayetteville (North Carolina), cost: 95, cuisines: Fast Food, Tea, Seafood\nAccommodation: *CoZy Private Williamsburg Home*, Fayetteville (North Carolina), cost: 546, room type: Entire home/apt, house rules: No children under 10 & No smoking & No visitors, minimum nights: 1, maximum occupancy: 5\n\nNumber of people: 1\nTotal cost: 25 + 80 + 95 + 546 = 746\nAccommodation minimum nights: 2/2\n\nDays: 5\nCurrent City: from Fayetteville (North Carolina) to Gainesville\nTransportation: Self-driving, from Fayetteville to Gainesville, duration: 6 hours 45 mins, distance: 743 km, cost: 37\nBreakfast: -\nAttraction: -\nLunch: -\nDinner: -\nAccommodation: -\n\nNumber of people: 1\nTotal cost: 37\n\nTotal cost across all days: 496 + 489 + 648 + 746 + 37 = 2,416\n\nCuisines: The itinerary includes a variety of cuisines, with a focus on American, BBQ, and Seafood, which are available in the selected restaurants.\n\nNote: The travel plan adheres to the budget of $2,900, includes all required details for each day, and ensures no restaurant or attraction is repeated. Accommodations are booked according to the constraints, and transportation is consistent with the available options and does not exceed the budget.", "gpt-4-1106-preview_direct_sole-planning_parsed_results": [{"day": 1, "current_city": "from Gainesville to Wilmington (North Carolina)", "transportation": "Self-driving, from Gainesville to Wilmington, duration: 7 hours 29 mins, distance: 814 km", "breakfast": "-", "attraction": "-", "lunch": "-", "dinner": "Azteca, Wilmington (North Carolina)", "accommodation": "Private Bedroom in Williamsburg!, Wilmington (North Carolina)"}, {"day": 2, "current_city": "Wilmington (North Carolina)", "transportation": "-", "breakfast": "Dunkin' Donuts, Wilmington (North Carolina)", "attraction": "Bellamy Mansion Museum, Wilmington (North Carolina);Wilmington Riverwalk, Wilmington (North Carolina);", "lunch": "Bandit Burrito, Wilmington (North Carolina)", "dinner": "Moonie's Texas Barbecue, Wilmington (North Carolina)", "accommodation": "Private Bedroom in Williamsburg!, Wilmington (North Carolina)"}, {"day": 3, "current_city": "from Wilmington (North Carolina) to Fayetteville (North Carolina)", "transportation": "Self-driving, from Wilmington to Fayetteville, duration: 1 hour 43 mins, distance: 149 km", "breakfast": "-", "attraction": "Airborne & Special Operations Museum Foundation, Fayetteville (North Carolina);Cape Fear Botanical Garden, Fayetteville (North Carolina);", "lunch": "DiVine, Fayetteville (North Carolina)", "dinner": "Eat Street, Fayetteville (North Carolina)", "accommodation": "*CoZy Private Williamsburg Home*, Fayetteville (North Carolina)"}, {"day": 4, "current_city": "Fayetteville (North Carolina)", "transportation": "-", "breakfast": "Dunkin' Donuts, Fayetteville (North Carolina)", "attraction": "Fayetteville Rose Garden, Fayetteville (North Carolina);ZipQuest - Waterfall & Treetop Adventure, Fayetteville (North Carolina);", "lunch": "Pind Balluchi, Fayetteville (North Carolina)", "dinner": "The Great Indian Pub, Fayetteville (North Carolina)", "accommodation": "*CoZy Private Williamsburg Home*, Fayetteville (North Carolina)"}, {"day": 5, "current_city": "from Fayetteville (North Carolina) to Gainesville", "transportation": "Self-driving, from Fayetteville to Gainesville, duration: 6 hours 45 mins, distance: 743 km", "breakfast": "-", "attraction": "-", "lunch": "-", "dinner": "-", "accommodation": "-"}]}]