[{"gpt-4-1106-preview_direct_sole-planning_results": "Travel Plan:\n\nDays: 1\nCurrent City: from Savannah to Houston (Texas)\nTransportation: Flight Number: F4011368, from Savannah to Houston (Texas), Departure Time: 17:38, Arrival Time: 19:12, cost: 202\nBreakfast: -\nAttraction: -\nLunch: -\nDinner: Jalapenos, Houston (Texas), cost: 57, cuisines: Desserts, Tea, Cafe, Chinese, Seafood\nAccommodation: Sunny and Airy near Manhattan, Houston (Texas), cost: 499, room type: Entire home/apt, house rules: No pets, minimum nights: 2, maximum occupancy: 4\n\nNumber of people: 1\nTotal cost: 202 + 57 + 499 = 758\nAccommodation minimum nights: 1/2\n\nDays: 2\nCurrent City: Houston (Texas)\nTransportation: -\nBreakfast: Super Bakery, Houston (Texas), cost: 30, cuisines: Seafood, Fast Food\nAttraction: Space Center Houston, Houston (Texas); Houston Museum of Natural Science, Houston (Texas)\nLunch: Sheetla Dhaba, Houston (Texas), cost: 35, cuisines: Desserts, Pizza, Bakery, American, Mediterranean\nDinner: Royal Mart, Houston (Texas), cost: 40, cuisines: Tea, Bakery, Cafe, Mediterranean, Seafood\nAccommodation: Sunny and Airy near Manhattan, Houston (Texas), cost: 499, room type: Entire home/apt, house rules: No pets, minimum nights: 2, maximum occupancy: 4\n\nNumber of people: 1\nTotal cost: 30 + 35 + 40 + 499 = 604\nAccommodation minimum nights: 2/2\n\nDays: 3\nCurrent City: from Houston (Texas) to Longview (Texas)\nTransportation: self-driving, from Houston to Longview, duration: 3 hours 24 mins, distance: 340 km, cost: 17\nBreakfast: Matchbox, Houston (Texas), cost: 33, cuisines: Tea, Italian, Bakery, Fast Food, Seafood\nAttraction: Longview World of Wonders, Longview (Texas); Gregg County Historical Museum, Longview (Texas)\nLunch: Apna Restaurant, Longview (Texas), cost: 17, cuisines: American, BBQ, Fast Food\nDinner: Monster's Cafe, Longview (Texas), cost: 94, cuisines: Tea, Bakery, Fast Food, Cafe, American, Mediterranean\nAccommodation: Cozy, bright Bohemian pad in NYC's Epic Village, Longview (Texas), cost: 478, room type: Entire home/apt, house rules: No parties, minimum nights: 5, maximum occupancy: 4\n\nNumber of people: 1\nTotal cost: 17 + 33 + 17 + 94 + 478 = 639\nAccommodation minimum nights: 1/5\n\nDays: 4\nCurrent City: Longview (Texas)\nTransportation: -\nBreakfast: Barbeque Nation, Longview (Texas), cost: 26, cuisines: Cafe, Bakery\nAttraction: Longview Museum of Fine Arts, Longview (Texas); KidsView Playground, Longview (Texas)\nLunch: Apni Rasoi, Longview (Texas), cost: 25, cuisines: Desserts, Tea, Pizza, Italian, Seafood\nDinner: Bikaner Sweets & Restaurant, Longview (Texas), cost: 98, cuisines: Tea, Seafood\nAccommodation: Cozy, bright Bohemian pad in NYC's Epic Village, Longview (Texas), cost: 478, room type: Entire home/apt, house rules: No parties, minimum nights: 5, maximum occupancy: 4\n\nNumber of people: 1\nTotal cost: 26 + 25 + 98 + 478 = 627\nAccommodation minimum nights: 2/5\n\nDays: 5\nCurrent City: from Longview (Texas) to Dallas (Texas)\nTransportation: Flight Number: F3589753, from Longview (Texas) to Dallas (Texas), Departure Time: 13:49, Arrival Time: 14:51, cost: 59\nBreakfast: Sham Sweets, Longview (Texas), cost: 69, cuisines: Cafe, Bakery, BBQ, Fast Food, Chinese\nAttraction: The Dallas World Aquarium, Dallas (Texas); The Sixth Floor Museum at Dealey Plaza, Dallas (Texas)\nLunch: Coconuts Fish Cafe, Dallas (Texas), cost: 38, cuisines: Cafe, BBQ, Mediterranean, Fast Food\nDinner: 1918 Bistro & Grill, Dallas (Texas), cost: 90, cuisines: Tea, Pizza, BBQ, Seafood\nAccommodation: Luxury Williamsburg duplex, private roof terrace, Dallas (Texas), cost: 241, room type: Entire home/apt, house rules: No visitors, minimum nights: 4, maximum occupancy: 3\n\nNumber of people: 1\nTotal cost: 59 + 69 + 38 + 90 + 241 = 497\nAccommodation minimum nights: 1/4\n\nDays: 6\nCurrent City: Dallas (Texas)\nTransportation: -\nBreakfast: Yanki Sizzlers, Dallas (Texas), cost: 96, cuisines: Cafe, French, Tea, Mediterranean\nAttraction: Reunion Tower, Dallas (Texas); Dallas Museum of Art, Dallas (Texas)\nLunch: Aravali Owls, Dallas (Texas), cost: 53, cuisines: Pizza, Italian, Bakery, Fast Food, Cafe\nDinner: Kebab Xpress, Dallas (Texas), cost: 93, cuisines: Tea, Bakery, Pizza, Mediterranean\nAccommodation: Luxury Williamsburg duplex, private roof terrace, Dallas (Texas), cost: 241, room type: Entire home/apt, house rules: No visitors, minimum nights: 4, maximum occupancy: 3\n\nNumber of people: 1\nTotal cost: 96 + 53 + 93 + 241 = 483\nAccommodation minimum nights: 2/4\n\nDays: 7\nCurrent City: from Dallas (Texas) to Savannah\nTransportation: Flight Number: F3675920, from Dallas (Texas) to Savannah, Departure Time: 13:39, Arrival Time: 17:02, cost: 287\nBreakfast: Haldiram's, Dallas (Texas), cost: 94, cuisines: Tea, Pizza\nAttraction: -\nLunch: -\nDinner: -\nAccommodation: -\n\nNumber of people: 1\nTotal cost: 287 + 94 = 381\n\nTotal cost across all days: 758 + 604 + 639 + 627 + 497 + 483 + 381 = 3,989\n\nUnfortunately, the total cost exceeds the specified budget of $3,200. Adjustments will need to be made to the plan to reduce costs. This could include choosing less expensive accommodations, dining options, or adjusting transportation methods.", "gpt-4-1106-preview_direct_sole-planning_parsed_results": [{"day": 1, "current_city": "from Savannah to Houston (Texas)", "transportation": "Flight Number: F4011368, from Savannah to Houston (Texas), Departure Time: 17:38, Arrival Time: 19:12", "breakfast": "-", "attraction": "-", "lunch": "-", "dinner": "Jalapenos, Houston (Texas)", "accommodation": "Sunny and Airy near Manhattan, Houston (Texas)"}, {"day": 2, "current_city": "Houston (Texas)", "transportation": "-", "breakfast": "Super Bakery, Houston (Texas)", "attraction": "Space Center Houston, Houston (Texas);Houston Museum of Natural Science, Houston (Texas);", "lunch": "Sheetla Dhaba, Houston (Texas)", "dinner": "Royal Mart, Houston (Texas)", "accommodation": "Sunny and Airy near Manhattan, Houston (Texas)"}, {"day": 3, "current_city": "from Houston (Texas) to Longview (Texas)", "transportation": "self-driving, from Houston to Longview, duration: 3 hours 24 mins, distance: 340 km", "breakfast": "Matchbox, Houston (Texas)", "attraction": "Longview World of Wonders, Longview (Texas);Gregg County Historical Museum, Longview (Texas);", "lunch": "Apna Restaurant, Longview (Texas)", "dinner": "Monster's Cafe, Longview (Texas)", "accommodation": "Cozy, bright Bohemian pad in NYC's Epic Village, Longview (Texas)"}, {"day": 4, "current_city": "Longview (Texas)", "transportation": "-", "breakfast": "Barbeque Nation, Longview (Texas)", "attraction": "Longview Museum of Fine Arts, Longview (Texas);KidsView Playground, Longview (Texas);", "lunch": "Apni Rasoi, Longview (Texas)", "dinner": "Bikaner Sweets & Restaurant, Longview (Texas)", "accommodation": "Cozy, bright Bohemian pad in NYC's Epic Village, Longview (Texas)"}, {"day": 5, "current_city": "from Longview (Texas) to Dallas (Texas)", "transportation": "Flight Number: F3589753, from Longview (Texas) to Dallas (Texas), Departure Time: 13:49, Arrival Time: 14:51", "breakfast": "Sham Sweets, Longview (Texas)", "attraction": "The Dallas World Aquarium, Dallas (Texas);The Sixth Floor Museum at Dealey Plaza, Dallas (Texas);", "lunch": "Coconuts Fish Cafe, Dallas (Texas)", "dinner": "1918 Bistro & Grill, Dallas (Texas)", "accommodation": "Luxury Williamsburg duplex, private roof terrace, Dallas (Texas)"}, {"day": 6, "current_city": "Dallas (Texas)", "transportation": "-", "breakfast": "Yanki Sizzlers, Dallas (Texas)", "attraction": "Reunion Tower, Dallas (Texas);Dallas Museum of Art, Dallas (Texas);", "lunch": "Aravali Owls, Dallas (Texas)", "dinner": "Kebab Xpress, Dallas (Texas)", "accommodation": "Luxury Williamsburg duplex, private roof terrace, Dallas (Texas)"}, {"day": 7, "current_city": "from Dallas (Texas) to Savannah", "transportation": "Flight Number: F3675920, from Dallas (Texas) to Savannah, Departure Time: 13:39, Arrival Time: 17:02", "breakfast": "Haldiram's, Dallas (Texas)", "attraction": "-", "lunch": "-", "dinner": "-", "accommodation": "-"}]}]