[{"gpt-4-1106-preview_direct_sole-planning_results": "Travel Plan:\n\nDays: 1\nCurrent City: from Harrisburg to Wichita Falls (Texas)\nTransportation: Self-driving, from Harrisburg to Wichita Falls, duration: 20 hours 58 mins, distance: 2,283 km, cost: 114\nBreakfast: -\nAttraction: -\nLunch: -\nDinner: Mama's Boy Restaurant, Wichita Falls (Texas), cost: 25, cuisines: Bakery, BBQ\nAccommodation: Small, Cozy 1BD Apartment, Wichita Falls (Texas), cost: 712, maximum occupancy: 7, house rules: No parties & No smoking & No children under 10, minimum nights: 3\n\nNumber of people: 2\nTotal cost: 114 * 2 + 25 * 2 + 712 = 990\nAccommodation minimum nights: 1/3\n\nDays: 2\nCurrent City: Wichita Falls (Texas)\nTransportation: -\nBreakfast: The Coffee Bean & Tea Leaf, Wichita Falls (Texas), cost: 21, cuisines: Chinese, Bakery, Desserts\nAttraction: Museum of North Texas History, Wichita Falls (Texas); River Bend Nature Center, Wichita Falls (Texas)\nLunch: Tyre Patty, Wichita Falls (Texas), cost: 92, cuisines: Pizza, BBQ, Bakery, Chinese, American, Seafood\nDinner: Made In Punjab, Wichita Falls (Texas), cost: 37, cuisines: French, Bakery, Seafood\nAccommodation: Small, Cozy 1BD Apartment, Wichita Falls (Texas), cost: 712, maximum occupancy: 7, house rules: No parties & No smoking & No children under 10, minimum nights: 3\n\nNumber of people: 2\nTotal cost: (21 + 92 + 37) * 2 + 712 = 1012\nAccommodation minimum nights: 2/3\n\nDays: 3\nCurrent City: from Wichita Falls (Texas) to Waco (Texas)\nTransportation: Self-driving, from Wichita Falls to Waco, duration: 3 hours 2 mins, distance: 327 km, cost: 16\nBreakfast: -\nAttraction: Dr Pepper Museum, Waco (Texas); Cameron Park Zoo, Waco (Texas)\nLunch: Blue House Cafe, Waco (Texas), cost: 55, cuisines: Tea, Pizza, Mexican, Cafe, Seafood\nDinner: Fork, Waco (Texas), cost: 58, cuisines: Tea, French, Mediterranean, Seafood\nAccommodation: Room 2: Sunny Queen W Private Bathroom & Breakfast, Waco (Texas), cost: 257, maximum occupancy: 2, house rules: No visitors & No children under 10, minimum nights: 1\n\nNumber of people: 2\nTotal cost: 16 * 2 + (55 + 58) * 2 + 257 = 515\nAccommodation minimum nights: 1/1\n\nDays: 4\nCurrent City: Waco (Texas)\nTransportation: -\nBreakfast: Kishu Di Hatti Sweets, Waco (Texas), cost: 15, cuisines: Pizza, Bakery, Mediterranean\nAttraction: Waco Mammoth National Monument, Waco (Texas); Mayborn Museum Complex, Waco (Texas)\nLunch: Punjabi Rasoi, Waco (Texas), cost: 70, cuisines: Fast Food, Cafe, Bakery, Seafood\nDinner: First Gear Cafe, Waco (Texas), cost: 76, cuisines: Desserts, Tea, Fast Food, Chinese, Seafood\nAccommodation: Room 2: Sunny Queen W Private Bathroom & Breakfast, Waco (Texas), cost: 257, maximum occupancy: 2, house rules: No visitors & No children under 10, minimum nights: 1\n\nNumber of people: 2\nTotal cost: (15 + 70 + 76) * 2 + 257 = 569\nAccommodation minimum nights: 2/1\n\nDays: 5\nCurrent City: from Waco (Texas) to Houston (Texas)\nTransportation: Self-driving, from Waco to Houston, duration: 2 hours 50 mins, distance: 298 km, cost: 14\nBreakfast: -\nAttraction: Space Center Houston, Houston (Texas); Houston Museum of Natural Science, Houston (Texas)\nLunch: Jalapenos, Houston (Texas), cost: 57, cuisines: Desserts, Tea, Cafe, Chinese, Seafood\nDinner: Super Bakery, Houston (Texas), cost: 30, cuisines: Seafood, Fast Food\nAccommodation: Sunny and Airy near Manhattan, Houston (Texas), cost: 499, maximum occupancy: 4, house rules: No pets, minimum nights: 2\n\nNumber of people: 2\nTotal cost: 14 * 2 + (57 + 30) * 2 + 499 = 701\nAccommodation minimum nights: 1/2\n\nDays: 6\nCurrent City: Houston (Texas)\nTransportation: -\nBreakfast: Sheetla Dhaba, Houston (Texas), cost: 35, cuisines: Desserts, Pizza, Bakery, American, Mediterranean\nAttraction: Houston Zoo, Houston (Texas); Hermann Park, Houston (Texas)\nLunch: Royal Mart, Houston (Texas), cost: 40, cuisines: Tea, Bakery, Cafe, Mediterranean, Seafood\nDinner: Matchbox, Houston (Texas), cost: 33, cuisines: Tea, Italian, Bakery, Fast Food, Seafood\nAccommodation: Sunny and Airy near Manhattan, Houston (Texas), cost: 499, maximum occupancy: 4, house rules: No pets, minimum nights: 2\n\nNumber of people: 2\nTotal cost: (35 + 40 + 33) * 2 + 499 = 725\nAccommodation minimum nights: 2/2\n\nDays: 7\nCurrent City: from Houston (Texas) to Harrisburg\nTransportation: Self-driving, from Houston to Harrisburg, duration: 21 hours 16 mins, distance: 2,353 km, cost: 117\nBreakfast: -\nAttraction: -\nLunch: -\nDinner: -\nAccommodation: -\n\nNumber of people: 2\nTotal cost: 117 * 2 = 234\n\nTotal cost across all days: 990 + 1012 + 515 + 569 + 701 + 725 + 234 = 4746\n\nUnfortunately, the total cost exceeds the specified budget of $4,100. Adjustments will need to be made to the plan to reduce costs, such as choosing less expensive restaurants or accommodations, or altering the transportation method.", "gpt-4-1106-preview_direct_sole-planning_parsed_results": [{"day": 1, "current_city": "from Harrisburg to Wichita Falls", "transportation": "Self-driving, from Harrisburg to Wichita Falls, duration: 20 hours 58 mins, distance: 2,283 km", "breakfast": "-", "attraction": "-", "lunch": "-", "dinner": "Mama's Boy Restaurant, Wichita Falls", "accommodation": "Small, Cozy 1BD Apartment, Wichita Falls"}, {"day": 2, "current_city": "Wichita Falls", "transportation": "-", "breakfast": "The Coffee Bean & Tea Leaf, Wichita Falls", "attraction": "Museum of North Texas History, Wichita Falls;River Bend Nature Center, Wichita Falls;", "lunch": "Tyre Patty, Wichita Falls", "dinner": "Made In Punjab, Wichita Falls", "accommodation": "Small, Cozy 1BD Apartment, Wichita Falls"}, {"day": 3, "current_city": "from Wichita Falls to Waco", "transportation": "Self-driving, from Wichita Falls to Waco, duration: 3 hours 2 mins, distance: 327 km", "breakfast": "-", "attraction": "Dr Pepper Museum, Waco;Cameron Park Zoo, Waco;", "lunch": "Blue House Cafe, Waco", "dinner": "Fork, Waco", "accommodation": "Room 2: Sunny Queen W Private Bathroom & Breakfast, Waco"}, {"day": 4, "current_city": "Waco", "transportation": "-", "breakfast": "Kishu Di Hatti Sweets, Waco", "attraction": "Waco Mammoth National Monument, Waco;Mayborn Museum Complex, Waco;", "lunch": "Punjabi Rasoi, Waco", "dinner": "First Gear Cafe, Waco", "accommodation": "Room 2: Sunny Queen W Private Bathroom & Breakfast, Waco"}, {"day": 5, "current_city": "from Waco to Houston", "transportation": "Self-driving, from Waco to Houston, duration: 2 hours 50 mins, distance: 298 km", "breakfast": "-", "attraction": "Space Center Houston, Houston;Houston Museum of Natural Science, Houston;", "lunch": "Jalapenos, Houston", "dinner": "Super Bakery, Houston", "accommodation": "Sunny and Airy near Manhattan, Houston"}, {"day": 6, "current_city": "Houston", "transportation": "-", "breakfast": "Sheetla Dhaba, Houston", "attraction": "Houston Zoo, Houston;Hermann Park, Houston;", "lunch": "Royal Mart, Houston", "dinner": "Matchbox, Houston", "accommodation": "Sunny and Airy near Manhattan, Houston"}, {"day": 7, "current_city": "from Houston to Harrisburg", "transportation": "Self-driving, from Houston to Harrisburg, duration: 21 hours 16 mins, distance: 2,353 km", "breakfast": "-", "attraction": "-", "lunch": "-", "dinner": "-", "accommodation": "-"}]}]