[{"gpt-4-1106-preview_direct_sole-planning_results": "Travel Plan:\n\nDays: 1\nCurrent City: from New Orleans to Miami (Florida)\nTransportation: Flight Number: F3660109, from New Orleans to Miami (Florida), Departure Time: 08:24, Arrival Time: 11:43, cost: 188\nBreakfast: -\nAttraction: Jungle Island, Miami (Florida)\nLunch: AB's Absolute Barbecues, Miami (Florida), cost: 55, cuisines: Desserts, Tea, Pizza, Italian, Fast Food, American\nDinner: Shorts Burger and Shine, Miami (Florida), cost: 81, cuisines: Chinese, Cafe, Seafood\nAccommodation: \"HELLO BROOKLYN\" PARK SIDE VIEW NEWLY RENO APT., Miami (Florida), cost: 789, room type: Entire home/apt, house rules: No parties & No visitors, minimum nights: 1, maximum occupancy: 6\n\nNumber of people: 3\nTotal cost: (188 + 55 + 81) * 3 + 789 = 1,335\nAccommodation minimum nights: 1/1\n\nDays: 2\nCurrent City: Miami (Florida)\nTransportation: -\nBreakfast: Papouli's Mediterranean Cafe & Market, Miami (Florida), cost: 26, cuisines: Tea, Desserts\nAttraction: P\u00e9rez Art Museum Miami, Miami (Florida); Vizcaya Museum & Gardens, Miami (Florida)\nLunch: Tako Cheena by Pom Pom, Miami (Florida), cost: 60, cuisines: Fast Food, Indian, Desserts, Italian\nDinner: Anjlika, Miami (Florida), cost: 56, cuisines: Pizza, Italian, Fast Food, Cafe, Mediterranean, Seafood\nAccommodation: \"HELLO BROOKLYN\" PARK SIDE VIEW NEWLY RENO APT., Miami (Florida), cost: 789, room type: Entire home/apt, house rules: No parties & No visitors, minimum nights: 1, maximum occupancy: 6\n\nNumber of people: 3\nTotal cost: (26 + 60 + 56) * 3 + 789 = 1,233\nAccommodation minimum nights: 2/1\n\nDays: 3\nCurrent City: from Miami (Florida) to Tampa (Florida)\nTransportation: Flight Number: F3670101, from Miami (Florida) to Tampa (Florida), Departure Time: 09:44, Arrival Time: 10:38, cost: 56\nBreakfast: -\nAttraction: The Florida Aquarium, Tampa (Florida); Busch Gardens Tampa Bay, Tampa (Florida)\nLunch: Kobe Hibachi & Sushi, Tampa (Florida), cost: 63, cuisines: Desserts, French, BBQ, Bakery, Seafood\nDinner: Peg Leg Pete's, Tampa (Florida), cost: 91, cuisines: French, Bakery, Cafe\nAccommodation: Spacious 1+ bedroom apt in NYC, Tampa (Florida), cost: 547, room type: Entire home/apt, house rules: No smoking & No parties & No children under 10, minimum nights: 1, maximum occupancy: 2\n\nNumber of people: 3\nTotal cost: (56 + 63 + 91) * 3 + 547 = 1,077\nAccommodation minimum nights: 1/1\n\nDays: 4\nCurrent City: Tampa (Florida)\nTransportation: -\nBreakfast: Lalit Kathi Rolls Momos, Tampa (Florida), cost: 23, cuisines: Tea, Pizza, Fast Food\nAttraction: Adventure Island, Tampa (Florida); Tampa Bay History Center, Tampa (Florida)\nLunch: Uptown Fresh Beer Cafe, Tampa (Florida), cost: 61, cuisines: Pizza, Mexican, BBQ, Cafe, Seafood\nDinner: The Zaffran, Tampa (Florida), cost: 35, cuisines: Tea, Bakery, Fast Food, American, Seafood\nAccommodation: Spacious 1+ bedroom apt in NYC, Tampa (Florida), cost: 547, room type: Entire home/apt, house rules: No smoking & No parties & No children under 10, minimum nights: 1, maximum occupancy: 2\n\nNumber of people: 3\nTotal cost: (23 + 61 + 35) * 3 + 547 = 891\nAccommodation minimum nights: 2/1\n\nDays: 5\nCurrent City: from Tampa (Florida) to New Orleans\nTransportation: Flight Number: F4007107, from Tampa (Florida) to New Orleans, Departure Time: 06:58, Arrival Time: 07:30, cost: 124\nBreakfast: -\nAttraction: -\nLunch: -\nDinner: -\nAccommodation: -\n\nNumber of people: 3\nTotal cost: 124 * 3 = 372\n\nTotal cost across all days: 1,335 + 1,233 + 1,077 + 891 + 372 = 4,908\n\nUnfortunately, the total cost of $4,908 exceeds the specified budget of $4,200. To adjust the plan to fit the budget, we can consider changing the flight to a cheaper option or selecting more budget-friendly accommodations or restaurants. However, since the provided data does not include cheaper alternatives, this is the best plan that can be created with the given information and constraints.", "gpt-4-1106-preview_direct_sole-planning_parsed_results": [{"day": 1, "current_city": "from New Orleans to Miami (Florida)", "transportation": "Flight Number: F3660109, from New Orleans to Miami (Florida), Departure Time: 08:24, Arrival Time: 11:43", "breakfast": "-", "attraction": "Jungle Island, Miami (Florida);", "lunch": "AB's Absolute Barbecues, Miami (Florida)", "dinner": "Shorts Burger and Shine, Miami (Florida)", "accommodation": "\"HELLO BROOKLYN\" PARK SIDE VIEW NEWLY RENO APT., Miami (Florida)"}, {"day": 2, "current_city": "Miami (Florida)", "transportation": "-", "breakfast": "Papouli's Mediterranean Cafe & Market, Miami (Florida)", "attraction": "P\u00e9rez Art Museum Miami, Miami (Florida);Vizcaya Museum & Gardens, Miami (Florida);", "lunch": "Tako Cheena by Pom Pom, Miami (Florida)", "dinner": "Anjlika, Miami (Florida)", "accommodation": "\"HELLO BROOKLYN\" PARK SIDE VIEW NEWLY RENO APT., Miami (Florida)"}, {"day": 3, "current_city": "from Miami (Florida) to Tampa (Florida)", "transportation": "Flight Number: F3670101, from Miami (Florida) to Tampa (Florida), Departure Time: 09:44, Arrival Time: 10:38", "breakfast": "-", "attraction": "The Florida Aquarium, Tampa (Florida);Busch Gardens Tampa Bay, Tampa (Florida);", "lunch": "Kobe Hibachi & Sushi, Tampa (Florida)", "dinner": "Peg Leg Pete's, Tampa (Florida)", "accommodation": "Spacious 1+ bedroom apt in NYC, Tampa (Florida)"}, {"day": 4, "current_city": "Tampa (Florida)", "transportation": "-", "breakfast": "Lalit Kathi Rolls Momos, Tampa (Florida)", "attraction": "Adventure Island, Tampa (Florida);Tampa Bay History Center, Tampa (Florida);", "lunch": "Uptown Fresh Beer Cafe, Tampa (Florida)", "dinner": "The Zaffran, Tampa (Florida)", "accommodation": "Spacious 1+ bedroom apt in NYC, Tampa (Florida)"}, {"day": 5, "current_city": "from Tampa (Florida) to New Orleans", "transportation": "Flight Number: F4007107, from Tampa (Florida) to New Orleans, Departure Time: 06:58, Arrival Time: 07:30", "breakfast": "-", "attraction": "-", "lunch": "-", "dinner": "-", "accommodation": "-"}]}]