[{"gpt-4-1106-preview_direct_sole-planning_results": "Travel Plan:\n\nDays: 1\nCurrent City: from Chicago to Boise (Idaho)\nTransportation: Flight Number: F3857813, from Chicago to Boise, Departure Time: 09:48, Arrival Time: 12:51, cost: 311\nBreakfast: -\nAttraction: -\nLunch: -\nDinner: Gopala Hari, Boise (Idaho), cost: 28, cuisines: Tea, Pizza, Italian, Fast Food, Mediterranean, Seafood\nAccommodation: Modern & Cozy 2 BR Private Apartment in Brooklyn, Boise (Idaho), cost: 843, maximum occupancy: 7, house rules: No children under 10, minimum nights: 2645\n\nNumber of people: 8\nTotal cost: (311 * 8) + (28 * 8) + 843 = 3,331\nAccommodation minimum nights: 1/2645\n\nDays: 2\nCurrent City: Boise (Idaho)\nTransportation: -\nBreakfast: Gopala Hari, Boise (Idaho), cost: 28, cuisines: Tea, Pizza, Italian, Fast Food, Mediterranean, Seafood\nAttraction: Zoo Boise, Boise (Idaho); Idaho Botanical Garden, Boise (Idaho)\nLunch: TGI Friday's, Boise (Idaho), cost: 33, cuisines: Cafe, Mexican, BBQ, Fast Food\nDinner: California Pizza Kitchen, Boise (Idaho), cost: 15, cuisines: Tea, BBQ, Fast Food, Chinese, Indian\nAccommodation: Modern & Cozy 2 BR Private Apartment in Brooklyn, Boise (Idaho), cost: 843, maximum occupancy: 7, house rules: No children under 10, minimum nights: 2645\n\nNumber of people: 8\nTotal cost: (28 + 33 + 15) * 8 + 843 = 1,331\nAccommodation minimum nights: 2/2645\n\nDays: 3\nCurrent City: from Boise (Idaho) to Pocatello (Idaho)\nTransportation: Self-driving, from Boise to Pocatello, duration: 3 hours 25 mins, distance: 378 km, cost: 18\nBreakfast: -\nAttraction: Idaho Museum of Natural History, Pocatello (Idaho); Fort Hall Replica and Commemorative Trading Post, Pocatello (Idaho)\nLunch: Deorio's, Pocatello (Idaho), cost: 59, cuisines: Tea, Bakery, Fast Food, Mediterranean, Seafood\nDinner: 650 - The Global Kitchen, Pocatello (Idaho), cost: 83, cuisines: French, Bakery, Cafe\nAccommodation: Entire Modern Studio Apartment/Prime Location, Pocatello (Idaho), cost: 1109, maximum occupancy: 5, house rules: No parties & No smoking, minimum nights: 30\n\nNumber of people: 8\nTotal cost: 18 * 8 + (59 + 83) * 8 + 1109 * 2 = 2,370\nAccommodation minimum nights: 1/30\n\nDays: 4\nCurrent City: Pocatello (Idaho)\nTransportation: -\nBreakfast: Harvest Moon, Pocatello (Idaho), cost: 90, cuisines: Pizza, Fast Food\nAttraction: Museum of Clean, Pocatello (Idaho); Zoo Idaho, Pocatello (Idaho)\nLunch: Oriental Kitchen Express, Pocatello (Idaho), cost: 36, cuisines: Cafe, Bakery, Desserts\nDinner: Ghar Ki Handi, Pocatello (Idaho), cost: 13, cuisines: Cafe, Bakery, American, Fast Food\nAccommodation: Entire Modern Studio Apartment/Prime Location, Pocatello (Idaho), cost: 1109, maximum occupancy: 5, house rules: No parties & No smoking, minimum nights: 30\n\nNumber of people: 8\nTotal cost: (90 + 36 + 13) * 8 + 1109 * 2 = 2,525\nAccommodation minimum nights: 2/30\n\nDays: 5\nCurrent City: from Pocatello (Idaho) to Idaho Falls (Idaho)\nTransportation: Self-driving, from Pocatello to Idaho Falls, duration: 51 mins, distance: 83.6 km, cost: 4\nBreakfast: -\nAttraction: Giant Eagle Waterfall Nest, Idaho Falls (Idaho); Museum of Idaho, Idaho Falls (Idaho)\nLunch: Shiv Restaurant, Idaho Falls (Idaho), cost: 42, cuisines: Bakery, Mexican, Pizza, Desserts\nDinner: Chinese X'Press, Idaho Falls (Idaho), cost: 79, cuisines: French, Desserts, Fast Food\nAccommodation: Sunny & Spacious 2 bdrm apt, Idaho Falls (Idaho), cost: 914, maximum occupancy: 9, house rules: No smoking, minimum nights: 4\n\nNumber of people: 8\nTotal cost: 4 * 8 + (42 + 79) * 8 + 914 = 1,830\nAccommodation minimum nights: 1/4\n\nDays: 6\nCurrent City: Idaho Falls (Idaho)\nTransportation: -\nBreakfast: Karim's, Idaho Falls (Idaho), cost: 58, cuisines: Tea, Pizza, BBQ, Cafe, Indian\nAttraction: Idaho Falls River Walk - Greenbelt Trail, Idaho Falls (Idaho); Idaho Falls Zoo at Tautphaus Park, Idaho Falls (Idaho)\nLunch: Taste of China, Idaho Falls (Idaho), cost: 19, cuisines: French, Bakery, Fast Food, Indian, Seafood\nDinner: Punjabi Rasoi, Idaho Falls (Idaho), cost: 86, cuisines: Desserts, Cafe, Pizza, Chinese, Seafood\nAccommodation: Sunny & Spacious 2 bdrm apt, Idaho Falls (Idaho), cost: 914, maximum occupancy: 9, house rules: No smoking, minimum nights: 4\n\nNumber of people: 8\nTotal cost: (58 + 19 + 86) * 8 + 914 = 2,042\nAccommodation minimum nights: 2/4\n\nDays: 7\nCurrent City: from Idaho Falls (Idaho) to Chicago\nTransportation: Self-driving, from Idaho Falls to Chicago, duration: 21 hours 43 mins, distance: 2,369 km, cost: 118\nBreakfast: -\nAttraction: -\nLunch: -\nDinner: -\nAccommodation: -\n\nNumber of people: 8\nTotal cost: 118 * 8 = 944\n\nTotal cost across all days: 3,331 + 1,331 + 2,370 + 2,525 + 1,830 + 2,042 + 944 = 14,373\n\nCuisines: The prompt specifies Italian and Chinese, and both of these cuisines have been represented in the restaurants chosen.", "gpt-4-1106-preview_direct_sole-planning_parsed_results": [{"day": 1, "current_city": "from Chicago to Boise", "transportation": "Flight Number: F3857813, from Chicago to Boise, Departure Time: 09:48, Arrival Time: 12:51", "breakfast": "-", "attraction": "-", "lunch": "-", "dinner": "Gopala Hari, Boise", "accommodation": "Modern & Cozy 2 BR Private Apartment in Brooklyn, Boise"}, {"day": 2, "current_city": "Boise", "transportation": "-", "breakfast": "Gopala Hari, Boise", "attraction": "Zoo Boise, Boise;Idaho Botanical Garden, Boise;", "lunch": "TGI Friday's, Boise", "dinner": "California Pizza Kitchen, Boise", "accommodation": "Modern & Cozy 2 BR Private Apartment in Brooklyn, Boise"}, {"day": 3, "current_city": "from Boise to Pocatello", "transportation": "Self-driving, from Boise to Pocatello, duration: 3 hours 25 mins, distance: 378 km", "breakfast": "-", "attraction": "Idaho Museum of Natural History, Pocatello;Fort Hall Replica and Commemorative Trading Post, Pocatello;", "lunch": "Deorio's, Pocatello", "dinner": "650 - The Global Kitchen, Pocatello", "accommodation": "Entire Modern Studio Apartment/Prime Location, Pocatello"}, {"day": 4, "current_city": "Pocatello", "transportation": "-", "breakfast": "Harvest Moon, Pocatello", "attraction": "Museum of Clean, Pocatello;Zoo Idaho, Pocatello;", "lunch": "Oriental Kitchen Express, Pocatello", "dinner": "Ghar Ki Handi, Pocatello", "accommodation": "Entire Modern Studio Apartment/Prime Location, Pocatello"}, {"day": 5, "current_city": "from Pocatello to Idaho Falls", "transportation": "Self-driving, from Pocatello to Idaho Falls, duration: 51 mins, distance: 83.6 km", "breakfast": "-", "attraction": "Giant Eagle Waterfall Nest, Idaho Falls;Museum of Idaho, Idaho Falls;", "lunch": "Shiv Restaurant, Idaho Falls", "dinner": "Chinese X'Press, Idaho Falls", "accommodation": "Sunny & Spacious 2 bdrm apt, Idaho Falls"}, {"day": 6, "current_city": "Idaho Falls", "transportation": "-", "breakfast": "Karim's, Idaho Falls", "attraction": "Idaho Falls River Walk - Greenbelt Trail, Idaho Falls;Idaho Falls Zoo at Tautphaus Park, Idaho Falls;", "lunch": "Taste of China, Idaho Falls", "dinner": "Punjabi Rasoi, Idaho Falls", "accommodation": "Sunny & Spacious 2 bdrm apt, Idaho Falls"}, {"day": 7, "current_city": "from Idaho Falls to Chicago", "transportation": "Self-driving, from Idaho Falls to Chicago, duration: 21 hours 43 mins, distance: 2,369 km", "breakfast": "-", "attraction": "-", "lunch": "-", "dinner": "-", "accommodation": "-"}]}]