[{"gpt-4-1106-preview_direct_sole-planning_results": "Travel Plan:\n\nDays: 1\nCurrent City: from Denver to Appleton\nTransportation: Flight Number: F3822209, from Denver to Appleton, Departure Time: 17:30, Arrival Time: 20:44, cost: 286\nBreakfast: -\nAttraction: -\nLunch: -\nDinner: Mikata Japanese Steakhouse, Appleton, cost: 72, cuisines: Cafe, Pizza, Bakery, Italian\nAccommodation: Cozy room + bright apartment + rooftop lounge, Appleton, cost: 666, room type: Private room, house rules: No smoking, minimum nights: 1, maximum occupancy: 1\n\nNumber of people: 1\nTotal cost: 286 + 72 + 666 = 1,024\nAccommodation minimum nights: 1/1\n\nDays: 2\nCurrent City: Appleton\nTransportation: -\nBreakfast: Swati Snacks, Appleton, cost: 84, cuisines: Desserts, Bakery, BBQ, Fast Food, American\nAttraction: The History Museum at the Castle, Appleton; Hearthstone Historic House Museum, Appleton\nLunch: Brick 29, Appleton, cost: 97, cuisines: Desserts, Tea, BBQ, Cafe, American, Mediterranean\nDinner: Colony, Appleton, cost: 110, cuisines: Pizza, BBQ, Fast Food, Chinese, Mediterranean, Seafood\nAccommodation: Cozy room + bright apartment + rooftop lounge, Appleton, cost: 666, room type: Private room, house rules: No smoking, minimum nights: 1, maximum occupancy: 1\n\nNumber of people: 1\nTotal cost: 84 + 97 + 110 + 666 = 957\nAccommodation minimum nights: 2/1\n\nDays: 3\nCurrent City: from Appleton to Denver\nTransportation: Flight Number: F3828308, from Appleton to Denver, Departure Time: 08:23, Arrival Time: 10:37, cost: 295\nBreakfast: -\nAttraction: -\nLunch: -\nDinner: -\nAccommodation: -\n\nNumber of people: 1\nTotal cost: 295\n\nTotal cost across all days: 1,024 + 957 + 295 = 2,276\n\nHowever, the total cost exceeds the budget of $1,800. To adjust the plan within the budget, we can change the accommodation to a more affordable option:\n\nRevised Accommodation for Days 1 and 2:\nAccommodation: Large Rooms with Bar and PullOut Prime Greenpoint, Appleton, cost: 174, room type: Private room, house rules: No visitors & No smoking & No pets, minimum nights: 4, maximum occupancy: 2\n\nRevised Total cost for Days 1 and 2: 286 + 72 + 174 = 532 (Day 1), 84 + 97 + 110 + 174 = 465 (Day 2)\n\nRevised Total cost across all days: 532 + 465 + 295 = 1,292\n\nCuisines: The prompt does not specify any particular cuisine preferences, so the selected restaurants offer a variety of options.\n\nThe revised travel plan is now within the budget of $1,800.", "gpt-4-1106-preview_direct_sole-planning_parsed_results": [{"day": 1, "current_city": "from Denver to Appleton", "transportation": "Flight Number: F3822209, from Denver to Appleton, Departure Time: 17:30, Arrival Time: 20:44", "breakfast": "-", "attraction": "-", "lunch": "-", "dinner": "Mikata Japanese Steakhouse, Appleton", "accommodation": "Large Rooms with Bar and PullOut Prime Greenpoint, Appleton"}, {"day": 2, "current_city": "Appleton", "transportation": "-", "breakfast": "Swati Snacks, Appleton", "attraction": "The History Museum at the Castle, Appleton;Hearthstone Historic House Museum, Appleton;", "lunch": "Brick 29, Appleton", "dinner": "Colony, Appleton", "accommodation": "Large Rooms with Bar and PullOut Prime Greenpoint, Appleton"}, {"day": 3, "current_city": "from Appleton to Denver", "transportation": "Flight Number: F3828308, from Appleton to Denver, Departure Time: 08:23, Arrival Time: 10:37", "breakfast": "-", "attraction": "-", "lunch": "-", "dinner": "-", "accommodation": "-"}]}]