[{"gpt-4-1106-preview_direct_sole-planning_results": "Travel Plan:\nDays: 1,\nCurrent City: from Minneapolis to Seattle,\nTransportation: Flight Number: F3526653, from Minneapolis to Seattle, Departure Time: 08:51, Arrival Time: 10:11, cost: 453\nBreakfast: -,\nAttraction: -,\nLunch: -,\nDinner: Ting's Red Lantern, Seattle, cost: 24, cuisines: \u201cItalian, Bakery, BBQ, Fast Food, Chinese, Seafood\u201d\nAccommodation: Large quiet private studio in East Harlem, Seattle, cost: 181, room type: Entire home/apt, house rules: No children under 10, minimum nights: 7, maximum occupancy: 2\n\nNumber of people = 1\nTotal cost = 453 + 24 + 181 = 658\nAccommodation minimum nights:  1/7\n\nDays: 2,\nCurrent City: Seattle,\nTransportation: -,\nBreakfast: Ceviche Tapas Bar & Restaurant, Seattle, cost: 86, cuisines: \u201cTea, Chinese, Desserts\u201d\nAttraction: Pike Place Market, Seattle; Space Needle, Seattle;,\nLunch: Mother Ringlet, Seattle, cost: 63, cuisines: \u201cTea, Cafe, Mediterranean, Seafood\u201d\nDinner: Caf\u6106 Burger BC, Seattle, cost: 43, cuisines: \u201cTea, French, Bakery, BBQ, Seafood\u201d\nAccommodation: Large quiet private studio in East Harlem, Seattle, cost: 181, room type: Entire home/apt, house rules: No children under 10, minimum nights: 7, maximum occupancy: 2\n\nNumber of people = 1\nTotal cost = 86 + 63 + 43 + 181 = 373\nAccommodation minimum nights:  2/7\n\nDays: 3,\nCurrent City: from Seattle to Minneapolis,\nTransportation: Flight Number: F3502722, from Seattle to Minneapolis, Departure Time: 08:47, Arrival Time: 14:03, cost: 364\nBreakfast: -,\nAttraction: -,\nLunch: -,\nDinner: -,\nAccommodation: -\n\nNumber of people = 1\nTotal cost = 364\n\nTotal cost across all days = 658 + 373 + 364 = 1,395\n\nCuisines: The prompt does not specify cuisines, so all cuisine constraints are satisfied.\nHouse rules: All accommodations chosen do not disallow parties, so parties are allowed.\n\n***** Travel Plan Ends *****\n\nPlease note that the accommodation chosen has a minimum stay of 7 nights, which is not ideal for a 3-day trip. However, due to the lack of provided data for other accommodations, this was the selected option. In a real-world scenario, it would be advisable to find an accommodation that matches the duration of the stay.", "gpt-4-1106-preview_direct_sole-planning_parsed_results": [{"day": 1, "current_city": "from Minneapolis to Seattle", "transportation": "Flight Number: F3526653, from Minneapolis to Seattle, Departure Time: 08:51, Arrival Time: 10:11", "breakfast": "-", "attraction": "-", "lunch": "-", "dinner": "Ting's Red Lantern, Seattle", "accommodation": "Large quiet private studio in East Harlem, Seattle"}, {"day": 2, "current_city": "Seattle", "transportation": "-", "breakfast": "Ceviche Tapas Bar & Restaurant, Seattle", "attraction": "Pike Place Market, Seattle;Space Needle, Seattle;", "lunch": "Mother Ringlet, Seattle", "dinner": "Caf\u00e9 Burger BC, Seattle", "accommodation": "Large quiet private studio in East Harlem, Seattle"}, {"day": 3, "current_city": "from Seattle to Minneapolis", "transportation": "Flight Number: F3502722, from Seattle to Minneapolis, Departure Time: 08:47, Arrival Time: 14:03", "breakfast": "-", "attraction": "-", "lunch": "-", "dinner": "-", "accommodation": "-"}]}]