[{"gpt-4-1106-preview_direct_sole-planning_results": "Travel Plan:\n\nDays: 1,\nCurrent City: from Bloomington to Orlando (Florida),\nTransportation: Flight Number: F3563219, from Bloomington to Orlando (Florida), Departure Time: 15:35, Arrival Time: 19:17, cost: 302\nBreakfast: -,\nAttraction: -,\nLunch: -,\nDinner: Fuji Japanese Steakhouse, Orlando (Florida), cost: 75, cuisines: \u201cTea, Bakery, Desserts\u201d\nAccommodation: Riverside Drive Apartment, Orlando (Florida), cost: 878, room type: Entire home/apt, house rules: No visitors & No parties & No smoking, minimum nights: 31, maximum occupancy: 5\n\nNumber of people = 4\nTotal cost = (302 + 75) * 4 + 878 = 2,286\nAccommodation minimum nights:  1/31\n\nDays: 2,\nCurrent City: Orlando (Florida),\nTransportation: -,\nBreakfast: Turquoise Villa, Orlando (Florida), cost: 55, cuisines: \u201cFrench, Bakery, BBQ, Fast Food\u201d\nAttraction: SeaWorld Orlando, Orlando (Florida); The Wheel at ICON Park, Orlando (Florida);\nLunch: The Tandoori Times, Orlando (Florida), cost: 84, cuisines: \u201cTea, Cafe, BBQ, Italian\u201d\nDinner: Indochi Cafe & Restaurant, Orlando (Florida), cost: 72, cuisines: \u201cPizza, French, Bakery, Fast Food, Indian, Seafood\u201d\nAccommodation: Riverside Drive Apartment, Orlando (Florida), cost: 878, room type: Entire home/apt, house rules: No visitors & No parties & No smoking, minimum nights: 31, maximum occupancy: 5\n\nNumber of people = 4\nTotal cost = (55 + 84 + 72) * 4 + 878 = 1,774\nAccommodation minimum nights:  2/31\n\nDays: 3,\nCurrent City: from Orlando (Florida) to Miami (Florida),\nTransportation: Flight Number: F3670393, from Orlando (Florida) to Miami (Florida), Departure Time: 17:43, Arrival Time: 18:57, cost: 74\nBreakfast: Crust N Cakes, Orlando (Florida), cost: 61, cuisines: \u201cTea, Cafe, Indian, BBQ\u201d\nAttraction: -,\nLunch: -,\nDinner: Shorts Burger and Shine, Miami (Florida), cost: 81, cuisines: \u201cChinese, Cafe, Seafood\u201d\nAccommodation: Charming 1BD Astoria Penthouse, Miami (Florida), cost: 806, room type: Entire home/apt, house rules: No smoking, minimum nights: 2, maximum occupancy: 8\n\nNumber of people = 4\nTotal cost = (74 + 61 + 81) * 4 + 806 = 1,750\nAccommodation minimum nights:  1/2\n\nDays: 4,\nCurrent City: Miami (Florida),\nTransportation: -,\nBreakfast: Papouli's Mediterranean Cafe & Market, Miami (Florida), cost: 26, cuisines: \u201cTea, Desserts\u201d\nAttraction: Jungle Island, Miami (Florida); P\u00e9rez Art Museum Miami, Miami (Florida);\nLunch: Tako Cheena by Pom Pom, Miami (Florida), cost: 60, cuisines: \u201cFast Food, Indian, Desserts, Italian\u201d\nDinner: AB's Absolute Barbecues, Miami (Florida), cost: 55, cuisines: \u201cDesserts, Tea, Pizza, Italian, Fast Food, American\u201d\nAccommodation: Charming 1BD Astoria Penthouse, Miami (Florida), cost: 806, room type: Entire home/apt, house rules: No smoking, minimum nights: 2, maximum occupancy: 8\n\nNumber of people = 4\nTotal cost = (26 + 60 + 55) * 4 + 806 = 1,662\nAccommodation minimum nights:  2/2 (Done!)\n\nDays: 5,\nCurrent City: from Miami (Florida) to Bloomington,\nTransportation: Self-driving, from Miami (Florida) to Bloomington, duration: 17 hours 1 min, distance: 1,897 km, cost: 94\nBreakfast: Anjlika, Miami (Florida), cost: 56, cuisines: \u201cPizza, Italian, Fast Food, Cafe, Mediterranean, Seafood\u201d\nAttraction: -,\nLunch: -,\nDinner: -,\nAccommodation: -\n\nNumber of people = 4\nTotal cost = 94 * 4 + 56 * 4 = 600\n\nTotal cost across all days = 2,286 + 1,774 + 1,750 + 1,662 + 600 = 8,072\nPet-friendly accommodations: All accommodations chosen are pet-friendly as there are no house rules against pets.\n\nRemaining Budget: $15,900 - $8,072 = $7,828\n\nCuisines: The prompt specifies no cuisines, so all cuisine constraints are satisfied.\nHouse rules: All accommodations chosen are pet-friendly, meeting the query's requirement.", "gpt-4-1106-preview_direct_sole-planning_parsed_results": [{"day": 1, "current_city": "from Bloomington to Orlando (Florida)", "transportation": "Flight Number: F3563219, from Bloomington to Orlando (Florida), Departure Time: 15:35, Arrival Time: 19:17", "breakfast": "-", "attraction": "-", "lunch": "-", "dinner": "Fuji Japanese Steakhouse, Orlando (Florida)", "accommodation": "Riverside Drive Apartment, Orlando (Florida)"}, {"day": 2, "current_city": "Orlando (Florida)", "transportation": "-", "breakfast": "Turquoise Villa, Orlando (Florida)", "attraction": "SeaWorld Orlando, Orlando (Florida);The Wheel at ICON Park, Orlando (Florida);", "lunch": "The Tandoori Times, Orlando (Florida)", "dinner": "Indochi Cafe & Restaurant, Orlando (Florida)", "accommodation": "Riverside Drive Apartment, Orlando (Florida)"}, {"day": 3, "current_city": "from Orlando (Florida) to Miami (Florida)", "transportation": "Flight Number: F3670393, from Orlando (Florida) to Miami (Florida), Departure Time: 17:43, Arrival Time: 18:57", "breakfast": "Crust N Cakes, Orlando (Florida)", "attraction": "-", "lunch": "-", "dinner": "Shorts Burger and Shine, Miami (Florida)", "accommodation": "Charming 1BD Astoria Penthouse, Miami (Florida)"}, {"day": 4, "current_city": "Miami (Florida)", "transportation": "-", "breakfast": "Papouli's Mediterranean Cafe & Market, Miami (Florida)", "attraction": "Jungle Island, Miami (Florida);P\u00e9rez Art Museum Miami, Miami (Florida);", "lunch": "Tako Cheena by Pom Pom, Miami (Florida)", "dinner": "AB's Absolute Barbecues, Miami (Florida)", "accommodation": "Charming 1BD Astoria Penthouse, Miami (Florida)"}, {"day": 5, "current_city": "from Miami (Florida) to Bloomington", "transportation": "Self-driving, from Miami (Florida) to Bloomington, duration: 17 hours 1 min, distance: 1,897 km", "breakfast": "Anjlika, Miami (Florida)", "attraction": "-", "lunch": "-", "dinner": "-", "accommodation": "-"}]}]