[{"gpt-4-1106-preview_direct_sole-planning_results": "Travel Plan:\n\nDays: 1,\nCurrent City: from Washington to Los Angeles (California),\nTransportation: Flight Number: F3696906, from Washington to Los Angeles (California), Departure Time: 15:56, Arrival Time: 18:03, cost: 684\nBreakfast: -,\nAttraction: -,\nLunch: -,\nDinner: Palmshore, Los Angeles (California), cost: 25, cuisines: \u201cDesserts, Bakery, Fast Food, American, Seafood\u201d\nAccommodation: Midtown East 2 Bed/2 Bath Elevator Building Apt, Los Angeles (California), cost: 540, room type: Entire home/apt, house rules: No pets, minimum nights: 7, maximum occupancy: 4\n\nNumber of people = 2\nTotal cost = 684 * 2 + 25 * 2 + 540 = 1,958\nAccommodation minimum nights:  1/7\n\nDays: 2,\nCurrent City: Los Angeles (California),\nTransportation: -,\nBreakfast: Heat - Edsa Shangri-La, Los Angeles (California), cost: 148, cuisines: \u201cBakery, BBQ\u201d\nAttraction: Santa Monica Pier, Los Angeles (California); Hollywood Walk of Fame, Los Angeles (California);\nLunch: Punjabi Zaika, Los Angeles (California), cost: 46, cuisines: \u201cPizza, Bakery, BBQ, Cafe, Indian\u201d\nDinner: The Hangout by 1861, Los Angeles (California), cost: 64, cuisines: \u201cTea, Pizza, Seafood\u201d\nAccommodation: Midtown East 2 Bed/2 Bath Elevator Building Apt, Los Angeles (California), cost: 540, room type: Entire home/apt, house rules: No pets, minimum nights: 7, maximum occupancy: 4\n\nNumber of people = 2\nTotal cost = (148 + 46 + 64) * 2 + 540 = 1,050\nAccommodation minimum nights:  2/7\n\nDays: 3,\nCurrent City: from Los Angeles (California) to San Francisco (California),\nTransportation: Flight Number: F3744801, from Los Angeles (California) to San Francisco (California), Departure Time: 05:54, Arrival Time: 07:22, cost: 79\nBreakfast: -,\nAttraction: Golden Gate Bridge, San Francisco (California); Pier 39, San Francisco (California);\nLunch: Coffee & Chai Co., San Francisco (California), cost: 10, cuisines: \u201cTea, Mexican, BBQ, Cafe, Seafood\u201d\nDinner: Bonne Bouche, San Francisco (California), cost: 21, cuisines: \u201cTea, Chinese, American, Cafe\u201d\nAccommodation: Great 1 Bedroom on Upper East, San Francisco (California), cost: 484, room type: Entire home/apt, house rules: No parties, minimum nights: 2, maximum occupancy: 2\n\nNumber of people = 2\nTotal cost = 79 * 2 + (10 + 21) * 2 + 484 = 724\nAccommodation minimum nights:  1/2\n\nDays: 4,\nCurrent City: San Francisco (California),\nTransportation: -,\nBreakfast: Tokyo Sushi, San Francisco (California), cost: 18, cuisines: \u201cCafe, Pizza, BBQ\u201d\nAttraction: Exploratorium, San Francisco (California); California Academy of Sciences, San Francisco (California);\nLunch: Sudarshan, San Francisco (California), cost: 53, cuisines: \u201cFast Food, Bakery, Mediterranean, Italian\u201d\nDinner: Kream's, San Francisco (California), cost: 67, cuisines: \u201cTea, Pizza, BBQ, Chinese, Seafood\u201d\nAccommodation: Great 1 Bedroom on Upper East, San Francisco (California), cost: 484, room type: Entire home/apt, house rules: No parties, minimum nights: 2, maximum occupancy: 2\n\nNumber of people = 2\nTotal cost = (18 + 53 + 67) * 2 + 484 = 760\nAccommodation minimum nights:  2/2 (Done!)\n\nDays: 5,\nCurrent City: from San Francisco (California) to Washington,\nTransportation: Flight Number: F3746364, from San Francisco (California) to Washington, Departure Time: 07:53, Arrival Time: 16:03, cost: 703\nBreakfast: -,\nAttraction: -,\nLunch: -,\nDinner: -,\nAccommodation: -\n\nNumber of people = 2\nTotal cost = 703 * 2 = 1,406\n\nTotal cost across all days = 1,958 + 1,050 + 724 + 760 + 1,406 = 5,898\n\nCuisines: The prompt specifies Chinese, Mexican, American, and Italian, and all of these cuisines have been represented in the restaurants chosen.\n\nHouse rules: All accommodations chosen are non-shared rooms and allow visitors, meeting the requirements.\n\nUnfortunately, the total cost exceeds the specified budget of $4,600. Adjustments would need to be made to the plan to reduce costs, such as selecting cheaper flights, accommodations, or dining options.", "gpt-4-1106-preview_direct_sole-planning_parsed_results": [{"day": 1, "current_city": "from Washington to Los Angeles (California)", "transportation": "Flight Number: F3696906, from Washington to Los Angeles (California), Departure Time: 15:56, Arrival Time: 18:03", "breakfast": "-", "attraction": "-", "lunch": "-", "dinner": "Palmshore, Los Angeles (California)", "accommodation": "Midtown East 2 Bed/2 Bath Elevator Building Apt, Los Angeles (California)"}, {"day": 2, "current_city": "Los Angeles (California)", "transportation": "-", "breakfast": "Heat - Edsa Shangri-La, Los Angeles (California)", "attraction": "Santa Monica Pier, Los Angeles (California);Hollywood Walk of Fame, Los Angeles (California);", "lunch": "Punjabi Zaika, Los Angeles (California)", "dinner": "The Hangout by 1861, Los Angeles (California)", "accommodation": "Midtown East 2 Bed/2 Bath Elevator Building Apt, Los Angeles (California)"}, {"day": 3, "current_city": "from Los Angeles (California) to San Francisco (California)", "transportation": "Flight Number: F3744801, from Los Angeles (California) to San Francisco (California), Departure Time: 05:54, Arrival Time: 07:22", "breakfast": "-", "attraction": "Golden Gate Bridge, San Francisco (California);Pier 39, San Francisco (California);", "lunch": "Coffee & Chai Co., San Francisco (California)", "dinner": "Bonne Bouche, San Francisco (California)", "accommodation": "Great 1 Bedroom on Upper East, San Francisco (California)"}, {"day": 4, "current_city": "San Francisco (California)", "transportation": "-", "breakfast": "Tokyo Sushi, San Francisco (California)", "attraction": "Exploratorium, San Francisco (California);California Academy of Sciences, San Francisco (California);", "lunch": "Sudarshan, San Francisco (California)", "dinner": "Kream's, San Francisco (California)", "accommodation": "Great 1 Bedroom on Upper East, San Francisco (California)"}, {"day": 5, "current_city": "from San Francisco (California) to Washington", "transportation": "Flight Number: F3746364, from San Francisco (California) to Washington, Departure Time: 07:53, Arrival Time: 16:03", "breakfast": "-", "attraction": "-", "lunch": "-", "dinner": "-", "accommodation": "-"}]}]