[{"gpt-4-1106-preview_direct_sole-planning_results": "Travel Plan:\nDays: 1,\nCurrent City: from Providence to Orlando (Florida),\nTransportation: Flight Number: F4011165, from Providence to Orlando (Florida), Departure Time: 18:30, Arrival Time: 21:49, cost: 226\nBreakfast: -,\nAttraction: -,\nLunch: -,\nDinner: Fuji Japanese Steakhouse, Orlando (Florida), cost: 75, cuisines: \u201cTea, Bakery, Desserts\u201d\nAccommodation: Sixth Ave Chelsea, Studio Serviced Apartment, Orlando (Florida), cost: 70, maximum occupancy: 3, house rules: No visitors & No pets, minimum nights: 30\n\nNumber of people = 1\nTotal cost = 226 + 75 + 70 = 371\nAccommodation minimum nights:  1/30\n\nDays: 2,\nCurrent City: Orlando (Florida),\nTransportation: -,\nBreakfast: Turquoise Villa, Orlando (Florida), cost: 55, cuisines: \u201cFrench, Bakery, BBQ, Fast Food\u201d\nAttraction: The Wheel at ICON Park, Orlando (Florida); SeaWorld Orlando, Orlando (Florida),\nLunch: The Tandoori Times, Orlando (Florida), cost: 84, cuisines: \u201cTea, Cafe, BBQ, Italian\u201d\nDinner: Indochi Cafe & Restaurant, Orlando (Florida), cost: 72, cuisines: \u201cPizza, French, Bakery, Fast Food, Indian, Seafood\u201d\nAccommodation: Sixth Ave Chelsea, Studio Serviced Apartment, Orlando (Florida), cost: 70, maximum occupancy: 3, house rules: No visitors & No pets, minimum nights: 30\n\nNumber of people = 1\nTotal cost = 55 + 84 + 72 + 70 = 281\nAccommodation minimum nights:  2/30\n\nDays: 3,\nCurrent City: from Orlando (Florida) to Providence,\nTransportation: Flight Number: F4032376, from Orlando (Florida) to Providence, Departure Time: 19:22, Arrival Time: 21:58, cost: 280\nBreakfast: -,\nAttraction: -,\nLunch: -,\nDinner: -,\nAccommodation: -\n\nNumber of people = 1\nTotal cost = 280\n\nTotal cost across all days = 371 + 281 + 280 = 932\nCuisines: No specific cuisines were requested, so all cuisine constraints are satisfied.\nHouse rules: All accommodations chosen meet the house rules specified in the query.\n\n***** Travel Plan Ends *****\n\nPlease note that the accommodation chosen has a minimum stay of 30 nights, which is not ideal for a 3-day trip. However, since the budget allows, the cost for one night is included in the plan. The traveler should be aware that they may need to negotiate with the property owner for a shorter stay or look for alternative accommodations that allow shorter stays.", "gpt-4-1106-preview_direct_sole-planning_parsed_results": [{"day": 1, "current_city": "from Providence to Orlando", "transportation": "Flight Number: F4011165, from Providence to Orlando, Departure Time: 18:30, Arrival Time: 21:49", "breakfast": "-", "attraction": "-", "lunch": "-", "dinner": "Fuji Japanese Steakhouse, Orlando", "accommodation": "Sixth Ave Chelsea, Studio Serviced Apartment, Orlando"}, {"day": 2, "current_city": "Orlando", "transportation": "-", "breakfast": "Turquoise Villa, Orlando", "attraction": "The Wheel at ICON Park, Orlando;SeaWorld Orlando, Orlando;", "lunch": "The Tandoori Times, Orlando", "dinner": "Indochi Cafe & Restaurant, Orlando", "accommodation": "Sixth Ave Chelsea, Studio Serviced Apartment, Orlando"}, {"day": 3, "current_city": "from Orlando to Providence", "transportation": "Flight Number: F4032376, from Orlando to Providence, Departure Time: 19:22, Arrival Time: 21:58", "breakfast": "-", "attraction": "-", "lunch": "-", "dinner": "-", "accommodation": "-"}]}]