[{"gpt-4-1106-preview_direct_sole-planning_results": "Travel Plan:\nDays: 1,\nCurrent City: from Buffalo to Atlanta,\nTransportation: Flight Number: F3502691, from Buffalo to Atlanta, Departure Time: 18:48, Arrival Time: 20:51, cost: 240\nBreakfast: -,\nAttraction: -,\nLunch: -,\nDinner: Saffron, Atlanta, cost: 39, cuisines: \u201cTea, Cafe, Fast Food, Seafood\u201d\nAccommodation: Unique 2BR Apartment, Atlanta, cost: 394, room type: Entire home/apt, house rules: No parties & No pets & No children under 10, minimum nights: 2, maximum occupancy: 3\n\nNumber of people = 1\nTotal cost = 240 + 39 + 394 = 673\nAccommodation minimum nights:  1/2\n\nDays: 2,\nCurrent City: Atlanta,\nTransportation: -,\nBreakfast: Adda, Atlanta, cost: 22, cuisines: \u201cTea, Mexican, Bakery\u201d\nAttraction: Georgia Aquarium, Atlanta; cost: 35.95 (standard adult admission)\nLunch: Chef Style, Atlanta, cost: 59, cuisines: \u201cPizza, American, Desserts, Seafood\u201d\nDinner: Asian Bistro, Atlanta, cost: 27, cuisines: \u201cTea, Bakery, Seafood\u201d\nAccommodation: Unique 2BR Apartment, Atlanta, cost: 394, room type: Entire home/apt, house rules: No parties & No pets & No children under 10, minimum nights: 2, maximum occupancy: 3\n\nNumber of people = 1\nTotal cost = 22 + 35.95 + 59 + 27 + 394 = 537.95\nAccommodation minimum nights:  2/2 (Done!)\n\nDays: 3,\nCurrent City: from Atlanta to Buffalo,\nTransportation: Flight Number: F3502694, from Atlanta to Buffalo, Departure Time: 15:47, Arrival Time: 17:42, cost: 209\nBreakfast: -,\nAttraction: Centennial Olympic Park, Atlanta; cost: 0 (free entry)\nLunch: Shri Ram Restaurant, Atlanta, cost: 55, cuisines: \u201cTea, Mexican, Indian, Fast Food\u201d\nDinner: -,\nAccommodation: -\n\nNumber of people = 1\nTotal cost = 209 + 55 = 264\n\nTotal cost across all days = 673 + 537.95 + 264 = 1,474.95\n\nUnfortunately, the total cost exceeds the planned budget of $1,100. To adjust the plan within the budget, we can consider the following changes:\n\n- Opt for a cheaper accommodation option.\n- Choose less expensive dining options.\n- Visit attractions with no entry fee.\n\nRevised Travel Plan with Budget Consideration:\nDays: 1,\nCurrent City: from Buffalo to Atlanta,\nTransportation: Flight Number: F3502691, from Buffalo to Atlanta, Departure Time: 18:48, Arrival Time: 20:51, cost: 240\nBreakfast: -,\nAttraction: -,\nLunch: -,\nDinner: Ahata, Atlanta, cost: 17, cuisines: \u201cTea, Indian, Desserts\u201d\nAccommodation: Spacious private room close St. Barnabas Hospital, Atlanta, cost: 144, room type: Private room, house rules: No smoking, minimum nights: 2, maximum occupancy: 1\n\nNumber of people = 1\nTotal cost = 240 + 17 + 144 = 401\nAccommodation minimum nights:  1/2\n\nDays: 2,\nCurrent City: Atlanta,\nTransportation: -,\nBreakfast: Adda, Atlanta, cost: 22, cuisines: \u201cTea, Mexican, Bakery\u201d\nAttraction: Centennial Olympic Park, Atlanta; cost: 0 (free entry)\nLunch: Daawat-e-Kashmir, Atlanta, cost: 19, cuisines: \u201cCafe, Pizza, American, Seafood\u201d\nDinner: Taste of Vishal, Atlanta, cost: 13, cuisines: \u201cDesserts, Tea, American, Bakery, Indian, Seafood\u201d\nAccommodation: Spacious private room close St. Barnabas Hospital, Atlanta, cost: 144, room type: Private room, house rules: No smoking, minimum nights: 2, maximum occupancy: 1\n\nNumber of people = 1\nTotal cost = 22 + 19 + 13 + 144 = 198\nAccommodation minimum nights:  2/2 (Done!)\n\nDays: 3,\nCurrent City: from Atlanta to Buffalo,\nTransportation: Flight Number: F3502694, from Atlanta to Buffalo, Departure Time: 15:47, Arrival Time: 17:42, cost: 209\nBreakfast: -,\nAttraction: Piedmont Park, Atlanta; cost: 0 (free entry)\nLunch: Shri Ram Restaurant, Atlanta, cost: 55, cuisines: \u201cTea, Mexican, Indian, Fast Food\u201d\nDinner: -,\nAccommodation: -\n\nNumber of people = 1\nTotal cost = 209 + 55 = 264\n\nTotal revised cost across all days = 401 + 198 + 264 = 863\n\nThe revised plan is now within the budget of $1,100.", "gpt-4-1106-preview_direct_sole-planning_parsed_results": [{"day": 1, "current_city": "from Buffalo to Atlanta", "transportation": "Flight Number: F3502691, from Buffalo to Atlanta, Departure Time: 18:48, Arrival Time: 20:51", "breakfast": "-", "attraction": "-", "lunch": "-", "dinner": "Saffron, Atlanta", "accommodation": "Unique 2BR Apartment, Atlanta"}, {"day": 2, "current_city": "Atlanta", "transportation": "-", "breakfast": "Adda, Atlanta", "attraction": "Georgia Aquarium, Atlanta;", "lunch": "Chef Style, Atlanta", "dinner": "Asian Bistro, Atlanta", "accommodation": "Unique 2BR Apartment, Atlanta"}, {"day": 3, "current_city": "from Atlanta to Buffalo", "transportation": "Flight Number: F3502694, from Atlanta to Buffalo, Departure Time: 15:47, Arrival Time: 17:42", "breakfast": "-", "attraction": "Centennial Olympic Park, Atlanta;", "lunch": "Shri Ram Restaurant, Atlanta", "dinner": "-", "accommodation": "-"}, {"day": 1, "current_city": "from Buffalo to Atlanta", "transportation": "Flight Number: F3502691, from Buffalo to Atlanta, Departure Time: 18:48, Arrival Time: 20:51", "breakfast": "-", "attraction": "-", "lunch": "-", "dinner": "Ahata, Atlanta", "accommodation": "Spacious private room close St. Barnabas Hospital, Atlanta"}, {"day": 2, "current_city": "Atlanta", "transportation": "-", "breakfast": "Adda, Atlanta", "attraction": "Centennial Olympic Park, Atlanta;", "lunch": "Daawat-e-Kashmir, Atlanta", "dinner": "Taste of Vishal, Atlanta", "accommodation": "Spacious private room close St. Barnabas Hospital, Atlanta"}, {"day": 3, "current_city": "from Atlanta to Buffalo", "transportation": "Flight Number: F3502694, from Atlanta to Buffalo, Departure Time: 15:47, Arrival Time: 17:42", "breakfast": "-", "attraction": "Piedmont Park, Atlanta;", "lunch": "Shri Ram Restaurant, Atlanta", "dinner": "-", "accommodation": "-"}]}]