[{"gpt-4-1106-preview_direct_sole-planning_results": "Travel Plan:\n\nDays: 1,\nCurrent City: from Syracuse to Augusta (Georgia),\nTransportation: Taxi, from Syracuse to Augusta, duration: 13 hours 17 mins, distance: 1,431 km, cost: 1431\nBreakfast: -,\nAttraction: -,\nLunch: -,\nDinner: B Merrell's, Augusta (Georgia), cost: 74, cuisines: \u201cTea, Pizza, Desserts, Fast Food\u201d\nAccommodation: Planta Baja Studio, Augusta (Georgia), cost: 637, room type: Entire home/apt, house rules: No smoking, minimum nights: 1, maximum occupancy: 4\n\nNumber of people = 2\nTotal cost = 1431 + 74 * 2 + 637 = 2216\nAccommodation minimum nights:  1/1\n\nDays: 2,\nCurrent City: Augusta (Georgia),\nTransportation: -,\nBreakfast: Fish Tales Lakeside Grille, Augusta (Georgia), cost: 37, cuisines: \u201cTea, Cafe, Bakery, Desserts\u201d\nAttraction: Phinizy Swamp Nature Park, Augusta (Georgia); Augusta Riverwalk, Augusta (Georgia);\nLunch: The Charcoal Chimney, Augusta (Georgia), cost: 86, cuisines: \u201cTea, Fast Food, BBQ, Italian\u201d\nDinner: Just Kababs, Augusta (Georgia), cost: 31, cuisines: \u201cTea, Pizza, BBQ, American, Seafood\u201d\nAccommodation: Planta Baja Studio, Augusta (Georgia), cost: 637, room type: Entire home/apt, house rules: No smoking, minimum nights: 1, maximum occupancy: 4\n\nNumber of people = 2\nTotal cost = (37 + 86 + 31) * 2 + 637 = 945\nAccommodation minimum nights:  2/1\n\nDays: 3,\nCurrent City: from Augusta (Georgia) to Decatur (Georgia),\nTransportation: Taxi, from Augusta to Decatur, duration: 2 hours 19 mins, distance: 229 km, cost: 229\nBreakfast: -,\nAttraction: Augusta Museum of History, Augusta (Georgia);\nLunch: Vinny Vanucchi's, Augusta (Georgia), cost: 45, cuisines: \u201cDesserts, Fast Food, Chinese, Indian, Seafood\u201d\nDinner: -,\nAccommodation: The Heart of the Lower East Side!, Decatur (Georgia), cost: 587, room type: Entire home/apt, house rules: No children under 10, minimum nights: 2, maximum occupancy: 2\n\nNumber of people = 2\nTotal cost = 229 + 45 * 2 + 587 = 906\nAccommodation minimum nights:  1/2\n\nDays: 4,\nCurrent City: Decatur (Georgia),\nTransportation: -,\nBreakfast: Cafe Coffee Day, Decatur (Georgia), cost: 46, cuisines: \u201cTea, Cafe, BBQ, Mediterranean\u201d\nAttraction: DeKalb History Center Museum, Decatur (Georgia); Glenlake Park, Decatur (Georgia);\nLunch: Madhuban Restaurant - Welcome Hotel Rama International, Decatur (Georgia), cost: 47, cuisines: \u201cPizza, Bakery, Seafood\u201d\nDinner: Joey's Pizza, Decatur (Georgia), cost: 69, cuisines: \u201cTea, Pizza, Bakery, Chinese, Seafood\u201d\nAccommodation: The Heart of the Lower East Side!, Decatur (Georgia), cost: 587, room type: Entire home/apt, house rules: No children under 10, minimum nights: 2, maximum occupancy: 2\n\nNumber of people = 2\nTotal cost = (46 + 47 + 69) * 2 + 587 = 911\nAccommodation minimum nights:  2/2\n\nDays: 5,\nCurrent City: from Decatur (Georgia) to Syracuse,\nTransportation: Taxi, from Decatur to Syracuse, duration: 14 hours 26 mins, distance: 1,542 km, cost: 1542\nBreakfast: -,\nAttraction: -,\nLunch: -,\nDinner: -,\nAccommodation: -\n\nNumber of people = 2\nTotal cost = 1542 * 2 = 3084\n\nTotal cost across all days = 2216 + 945 + 906 + 911 + 3084 = 8062\nCuisines: The prompt specifies American and Mediterranean, and both of these cuisines have been represented in the restaurants chosen.\n\nNote: The total cost exceeds the budget of $2,000. Adjustments would need to be made to the transportation method or accommodations to meet the budget constraint. However, given the provided reference information, the cheapest transportation method (taxi) has already been selected, and the accommodations chosen are the most cost-effective options that meet the house rules and room type constraints. Therefore, it is not possible to create a travel plan within the specified budget using the provided reference information.", "gpt-4-1106-preview_direct_sole-planning_parsed_results": [{"day": 1, "current_city": "from Syracuse to Augusta", "transportation": "Taxi, from Syracuse to Augusta, duration: 13 hours 17 mins, distance: 1,431 km", "breakfast": "-", "attraction": "-", "lunch": "-", "dinner": "B Merrell's, Augusta", "accommodation": "Planta Baja Studio, Augusta"}, {"day": 2, "current_city": "Augusta", "transportation": "-", "breakfast": "Fish Tales Lakeside Grille, Augusta", "attraction": "Phinizy Swamp Nature Park, Augusta;Augusta Riverwalk, Augusta;", "lunch": "The Charcoal Chimney, Augusta", "dinner": "Just Kababs, Augusta", "accommodation": "Planta Baja Studio, Augusta"}, {"day": 3, "current_city": "from Augusta to Decatur", "transportation": "Taxi, from Augusta to Decatur, duration: 2 hours 19 mins, distance: 229 km", "breakfast": "-", "attraction": "Augusta Museum of History, Augusta", "lunch": "Vinny Vanucchi's, Augusta", "dinner": "-", "accommodation": "The Heart of the Lower East Side!, Decatur"}, {"day": 4, "current_city": "Decatur", "transportation": "-", "breakfast": "Cafe Coffee Day, Decatur", "attraction": "DeKalb History Center Museum, Decatur;Glenlake Park, Decatur;", "lunch": "Madhuban Restaurant - Welcome Hotel Rama International, Decatur", "dinner": "Joey's Pizza, Decatur", "accommodation": "The Heart of the Lower East Side!, Decatur"}, {"day": 5, "current_city": "from Decatur to Syracuse", "transportation": "Taxi, from Decatur to Syracuse, duration: 14 hours 26 mins, distance: 1,542 km", "breakfast": "-", "attraction": "-", "lunch": "-", "dinner": "-", "accommodation": "-"}]}]