[{"gpt-4-1106-preview_direct_sole-planning_results": "Travel Plan:\n\nDays: 1,\nCurrent City: from Las Vegas to Twin Falls (Idaho),\nTransportation: Self-driving, from Las Vegas to Twin Falls, duration: 7 hours 32 mins, distance: 796 km, cost: 39\nBreakfast: -,\nAttraction: -,\nLunch: -,\nDinner: Thai Paradise, Twin Falls (Idaho), cost: 87, cuisines: \u201cFast Food, Indian, Desserts, Seafood\u201d\nAccommodation: Charming studio, great location!!!, Twin Falls (Idaho), cost: 994, maximum occupancy: 8, house rules: No smoking & No pets, minimum nights: 2\n\nNumber of people = 2\nTotal cost = 39 * 2 + 87 * 2 + 994 = 1,246\nAccommodation minimum nights:  1/2\n\nDays: 2,\nCurrent City: Twin Falls (Idaho),\nTransportation: -,\nBreakfast: Kaushik Bakery, Twin Falls (Idaho), cost: 29, cuisines: \u201cCafe, Pizza, Italian\u201d\nAttraction: Shoshone Falls Park, Twin Falls (Idaho); Centennial Waterfront Park, Twin Falls (Idaho);\nLunch: Food Fever, Twin Falls (Idaho), cost: 83, cuisines: \u201cFast Food, Chinese, BBQ, Seafood\u201d\nDinner: Asia Kitchen, Twin Falls (Idaho), cost: 67, cuisines: \u201cTea, Cafe, BBQ, Desserts\u201d\nAccommodation: Charming studio, great location!!!, Twin Falls (Idaho), cost: 994, maximum occupancy: 8, house rules: No smoking & No pets, minimum nights: 2\n\nNumber of people = 2\nTotal cost = (29 + 83 + 67) * 2 + 994 = 1,352\nAccommodation minimum nights:  2/2 (Done!)\n\nDays: 3,\nCurrent City: from Twin Falls (Idaho) to Pocatello (Idaho),\nTransportation: Self-driving, from Twin Falls to Pocatello, duration: 1 hour 46 mins, distance: 183 km, cost: 9\nBreakfast: -,\nAttraction: Idaho Museum of Natural History, Pocatello (Idaho); Zoo Idaho, Pocatello (Idaho);\nLunch: Harvest Moon, Pocatello (Idaho), cost: 90, cuisines: \u201cPizza, Fast Food\u201d\nDinner: Deorio's, Pocatello (Idaho), cost: 59, cuisines: \u201cTea, Bakery, Fast Food, Mediterranean, Seafood\u201d\nAccommodation: Entire Modern Studio Apartment/Prime Location, Pocatello (Idaho), cost: 1109, maximum occupancy: 5, house rules: No parties & No smoking, minimum nights: 30\n\nNumber of people = 2\nTotal cost = 9 * 2 + (90 + 59) * 2 + 1109 = 1,425\nAccommodation minimum nights:  1/30\n\nDays: 4,\nCurrent City: Pocatello (Idaho),\nTransportation: -,\nBreakfast: Ghar Ki Handi, Pocatello (Idaho), cost: 13, cuisines: \u201cCafe, Bakery, American, Fast Food\u201d\nAttraction: Fort Hall Replica and Commemorative Trading Post, Pocatello (Idaho); Bannock County Historical Museum, Pocatello (Idaho);\nLunch: 650 - The Global Kitchen, Pocatello (Idaho), cost: 83, cuisines: \u201cFrench, Bakery, Cafe\u201d\nDinner: The Baking Treats N More, Pocatello (Idaho), cost: 75, cuisines: \u201cCafe, Bakery, Fast Food\u201d\nAccommodation: Entire Modern Studio Apartment/Prime Location, Pocatello (Idaho), cost: 1109, maximum occupancy: 5, house rules: No parties & No smoking, minimum nights: 30\n\nNumber of people = 2\nTotal cost = (13 + 83 + 75) * 2 + 1109 = 1,460\nAccommodation minimum nights:  2/30\n\nDays: 5,\nCurrent City: from Pocatello (Idaho) to Boise (Idaho),\nTransportation: Self-driving, from Pocatello to Boise, duration: 3 hours 23 mins, distance: 377 km, cost: 18\nBreakfast: -,\nAttraction: Zoo Boise, Boise (Idaho); Idaho State Museum, Boise (Idaho);\nLunch: Gopala Hari, Boise (Idaho), cost: 28, cuisines: \u201cTea, Pizza, Italian, Fast Food, Mediterranean, Seafood\u201d\nDinner: TGI Friday's, Boise (Idaho), cost: 33, cuisines: \u201cCafe, Mexican, BBQ, Fast Food\u201d\nAccommodation: Modern & Cozy 2 BR Private Apartment in Brooklyn, Boise (Idaho), cost: 843, maximum occupancy: 7, house rules: No children under 10, minimum nights: 2645\n\nNumber of people = 2\nTotal cost = 18 * 2 + (28 + 33) * 2 + 843 = 1,001\nAccommodation minimum nights:  1/2645\n\nDays: 6,\nCurrent City: Boise (Idaho),\nTransportation: -,\nBreakfast: California Pizza Kitchen, Boise (Idaho), cost: 15, cuisines: \u201cTea, BBQ, Fast Food, Chinese, Indian\u201d\nAttraction: Boise Art Museum, Boise (Idaho); Camel's Back Park, Boise (Idaho);\nLunch: 19 Flavours Biryani, Boise (Idaho), cost: 59, cuisines: \u201cCafe, BBQ, Seafood\u201d\nDinner: Express Kitchen, Boise (Idaho), cost: 44, cuisines: \u201cMexican, American, Desserts, Fast Food\u201d\nAccommodation: Modern & Cozy 2 BR Private Apartment in Brooklyn, Boise (Idaho), cost: 843, maximum occupancy: 7, house rules: No children under 10, minimum nights: 2645\n\nNumber of people = 2\nTotal cost = (15 + 59 + 44) * 2 + 843 = 1,078\nAccommodation minimum nights:  2/2645\n\nDays: 7,\nCurrent City: from Boise (Idaho) to Las Vegas,\nTransportation: Self-driving, from Boise to Las Vegas, duration: 9 hours 30 mins, distance: 1,004 km, cost: 50\nBreakfast: -,\nAttraction: -,\nLunch: -,\nDinner: -,\nAccommodation: -\n\nNumber of people = 2\nTotal cost = 50 * 2 = 100\n\nTotal cost across all days = 1,246 + 1,352 + 1,425 + 1,460 + 1,001 + 1,078 + 100 = 7,662\n\nNote: The total cost exceeds the budget of $5,100. Adjustments are needed to meet the budget constraint. Accommodations allowing smoking were not found; all listed accommodations have a \"No smoking\" house rule. The travel plan also exceeds the budget and does not meet the accommodation house rules as specified in the query. Further adjustments and selections are required to create a feasible plan within the given constraints.", "gpt-4-1106-preview_direct_sole-planning_parsed_results": [{"day": 1, "current_city": "from Las Vegas to Twin Falls", "transportation": "Self-driving, from Las Vegas to Twin Falls, duration: 7 hours 32 mins, distance: 796 km", "breakfast": "-", "attraction": "-", "lunch": "-", "dinner": "Thai Paradise, Twin Falls", "accommodation": "Charming studio, great location!!!, Twin Falls"}, {"day": 2, "current_city": "Twin Falls", "transportation": "-", "breakfast": "Kaushik Bakery, Twin Falls", "attraction": "Shoshone Falls Park, Twin Falls; Centennial Waterfront Park, Twin Falls;", "lunch": "Food Fever, Twin Falls", "dinner": "Asia Kitchen, Twin Falls", "accommodation": "Charming studio, great location!!!, Twin Falls"}, {"day": 3, "current_city": "from Twin Falls to Pocatello", "transportation": "Self-driving, from Twin Falls to Pocatello, duration: 1 hour 46 mins, distance: 183 km", "breakfast": "-", "attraction": "Idaho Museum of Natural History, Pocatello; Zoo Idaho, Pocatello;", "lunch": "Harvest Moon, Pocatello", "dinner": "Deorio's, Pocatello", "accommodation": "Entire Modern Studio Apartment/Prime Location, Pocatello"}, {"day": 4, "current_city": "Pocatello", "transportation": "-", "breakfast": "Ghar Ki Handi, Pocatello", "attraction": "Fort Hall Replica and Commemorative Trading Post, Pocatello; Bannock County Historical Museum, Pocatello;", "lunch": "650 - The Global Kitchen, Pocatello", "dinner": "The Baking Treats N More, Pocatello", "accommodation": "Entire Modern Studio Apartment/Prime Location, Pocatello"}, {"day": 5, "current_city": "from Pocatello to Boise", "transportation": "Self-driving, from Pocatello to Boise, duration: 3 hours 23 mins, distance: 377 km", "breakfast": "-", "attraction": "Zoo Boise, Boise; Idaho State Museum, Boise;", "lunch": "Gopala Hari, Boise", "dinner": "TGI Friday's, Boise", "accommodation": "Modern & Cozy 2 BR Private Apartment in Brooklyn, Boise"}, {"day": 6, "current_city": "Boise", "transportation": "-", "breakfast": "California Pizza Kitchen, Boise", "attraction": "Boise Art Museum, Boise; Camel's Back Park, Boise;", "lunch": "19 Flavours Biryani, Boise", "dinner": "Express Kitchen, Boise", "accommodation": "Modern & Cozy 2 BR Private Apartment in Brooklyn, Boise"}, {"day": 7, "current_city": "from Boise to Las Vegas", "transportation": "Self-driving, from Boise to Las Vegas, duration: 9 hours 30 mins, distance: 1,004 km", "breakfast": "-", "attraction": "-", "lunch": "-", "dinner": "-", "accommodation": "-"}]}]