[{"gpt-4-1106-preview_direct_sole-planning_results": "Travel Plan:\nDays: 1,\nCurrent City: from Salt Lake City to Burbank,\nTransportation: Flight Number: F3846241, from Salt Lake City to Burbank, Departure Time: 08:08, Arrival Time: 09:03, cost: 157\nBreakfast: -,\nAttraction: Warner Bros. Studio Tour Hollywood, Burbank (California), cost: (assumed) 100 per person\nLunch: Mellow Mushroom, Burbank (California), cost: 69, cuisines: \u201cTea, Pizza, Mexican, Fast Food, Cafe, American\u201d\nDinner: Dawat-e-Nawab - Radisson Blu, Burbank (California), cost: 94, cuisines: \u201cMexican, Bakery, Cafe, Indian, Seafood\u201d\nAccommodation: Pleasant 1 bedroom apartment in Harlem Brownstone, Burbank (California), cost: 500, maximum occupancy: 5, house rules: No parties & No smoking, minimum nights: 1\n\nNumber of people = 7\nTotal cost = (157 * 7) + (100 * 7) + (69 * 7) + (94 * 7) + (500 * 2) = 1,099 + 700 + 483 + 658 + 1,000 = 3,940\nAccommodation minimum nights:  1/1\n\nDays: 2,\nCurrent City: Burbank,\nTransportation: -,\nBreakfast: Tandoor Restaurant, Burbank (California), cost: 78, cuisines: \u201cTea, Bakery, BBQ, Seafood\u201d\nAttraction: Universal Studios Hollywood, Burbank (California), cost: (assumed) 110 per person\nLunch: Hard Rock Cafe, Burbank (California), cost: 33, cuisines: \u201cDesserts, Tea, Bakery, BBQ, Chinese, Indian\u201d\nDinner: Lucknow - Kingdom of Dreams, Burbank (California), cost: 73, cuisines: \u201cSeafood, Pizza, Desserts, Italian\u201d\nAccommodation: Pleasant 1 bedroom apartment in Harlem Brownstone, Burbank (California), cost: 500, maximum occupancy: 5, house rules: No parties & No smoking, minimum nights: 1\n\nNumber of people = 7\nTotal cost = (78 * 7) + (110 * 7) + (33 * 7) + (73 * 7) + (500 * 2) = 546 + 770 + 231 + 511 + 1,000 = 3,058\nAccommodation minimum nights:  2/1\n\nDays: 3,\nCurrent City: from Burbank to Salt Lake City,\nTransportation: Flight Number: F3848172, from Burbank to Salt Lake City, Departure Time: 07:17, Arrival Time: 10:05, cost: 264\nBreakfast: -,\nAttraction: -,\nLunch: -,\nDinner: -,\nAccommodation: -\n\nNumber of people = 7\nTotal cost = 264 * 7 = 1,848\n\nTotal cost across all days = 3,940 + 3,058 + 1,848 = 8,846\n\nUnfortunately, the total cost exceeds the budget of $7,600. To adjust the plan to fit the budget, we can consider changing the flight to a cheaper option or reducing the cost of attractions and meals. Here's an adjusted plan:\n\nAdjusted Travel Plan:\nDays: 1,\nCurrent City: from Salt Lake City to Burbank,\nTransportation: Flight Number: F3846293, from Salt Lake City to Burbank, Departure Time: 15:29, Arrival Time: 16:21, cost: 165\nBreakfast: -,\nAttraction: -,\nLunch: -,\nDinner: Mellow Mushroom, Burbank (California), cost: 69, cuisines: \u201cTea, Pizza, Mexican, Fast Food, Cafe, American\u201d\nAccommodation: Pleasant 1 bedroom apartment in Harlem Brownstone, Burbank (California), cost: 500, maximum occupancy: 5, house rules: No parties & No smoking, minimum nights: 1\n\nNumber of people = 7\nTotal cost = (165 * 7) + (69 * 7) + (500 * 2) = 1,155 + 483 + 1,000 = 2,638\nAccommodation minimum nights:  1/1\n\nDays: 2,\nCurrent City: Burbank,\nTransportation: -,\nBreakfast: Tandoor Restaurant, Burbank (California), cost: 78, cuisines: \u201cTea, Bakery, BBQ, Seafood\u201d\nAttraction: -,\nLunch: Hard Rock Cafe, Burbank (California), cost: 33, cuisines: \u201cDesserts, Tea, Bakery, BBQ, Chinese, Indian\u201d\nDinner: Lucknow - Kingdom of Dreams, Burbank (California), cost: 73, cuisines: \u201cSeafood, Pizza, Desserts, Italian\u201d\nAccommodation: Pleasant 1 bedroom apartment in Harlem Brownstone, Burbank (California), cost: 500, maximum occupancy: 5, house rules: No parties & No smoking, minimum nights: 1\n\nNumber of people = 7\nTotal cost = (78 * 7) + (33 * 7) + (73 * 7) + (500 * 2) = 546 + 231 + 511 + 1,000 = 2,288\nAccommodation minimum nights:  2/1\n\nDays: 3,\nCurrent City: from Burbank to Salt Lake City,\nTransportation: Flight Number: F3977100, from Burbank to Salt Lake City, Departure Time: 09:29, Arrival Time: 12:16, cost: 181\nBreakfast: -,\nAttraction: -,\nLunch: -,\nDinner: -,\nAccommodation: -\n\nNumber of people = 7\nTotal cost = 181 * 7 = 1,267\n\nTotal adjusted cost across all days = 2,638 + 2,288 + 1,267 = 6,193\n\nThis adjusted plan fits within the budget of $7,600. Please note that attraction costs were not included due to budget constraints, and the accommodation chosen allows for entire rooms as requested.", "gpt-4-1106-preview_direct_sole-planning_parsed_results": [{"day": 1, "current_city": "from Salt Lake City to Burbank", "transportation": "Flight Number: F3846293, from Salt Lake City to Burbank, Departure Time: 15:29, Arrival Time: 16:21", "breakfast": "-", "attraction": "-", "lunch": "-", "dinner": "Mellow Mushroom, Burbank", "accommodation": "Pleasant 1 bedroom apartment in Harlem Brownstone, Burbank"}, {"day": 2, "current_city": "Burbank", "transportation": "-", "breakfast": "Tandoor Restaurant, Burbank", "attraction": "-", "lunch": "Hard Rock Cafe, Burbank", "dinner": "Lucknow - Kingdom of Dreams, Burbank", "accommodation": "Pleasant 1 bedroom apartment in Harlem Brownstone, Burbank"}, {"day": 3, "current_city": "from Burbank to Salt Lake City", "transportation": "Flight Number: F3977100, from Burbank to Salt Lake City, Departure Time: 09:29, Arrival Time: 12:16", "breakfast": "-", "attraction": "-", "lunch": "-", "dinner": "-", "accommodation": "-"}]}]