[{"gpt-4-1106-preview_direct_sole-planning_results": "Travel Plan:\n\nDays: 1,\nCurrent City: from Cedar Rapids to Denver (Colorado),\nTransportation: Flight Number: F3840860, from Cedar Rapids to Denver (Colorado), Departure Time: 16:23, Arrival Time: 17:15, cost: 294\nBreakfast: -,\nAttraction: -,\nLunch: -,\nDinner: The Fatty Bao - Asian Gastro Bar, Denver (Colorado), cost: 93, cuisines: \u201cBakery, BBQ, Cafe, Indian, Seafood\u201d\nAccommodation: *NO GUEST SERVICE FEE* Luxury Studio Suite w/ Free Continental Breakfast, Denver (Colorado), cost: 390, maximum occupancy: 2, house rules: No smoking & No visitors & No parties, minimum nights: 3\n\nNumber of people = 1\nTotal cost = 294 + 93 + 390 = 777\nAccommodation minimum nights:  1/3\n\nDays: 2,\nCurrent City: Denver (Colorado),\nTransportation: -,\nBreakfast: Cafe Diva, Denver (Colorado), cost: 44, cuisines: \u201cChinese, Cafe, Desserts, Fast Food\u201d\nAttraction: Denver Zoo, Denver (Colorado); Denver Botanic Gardens, Denver (Colorado);\nLunch: Tasty Fare, Denver (Colorado), cost: 79, cuisines: \u201cFrench, BBQ, Fast Food\u201d\nDinner: New Town Cafe - Park Plaza, Denver (Colorado), cost: 79, cuisines: \u201cCafe, American, BBQ, Fast Food\u201d\nAccommodation: *NO GUEST SERVICE FEE* Luxury Studio Suite w/ Free Continental Breakfast, Denver (Colorado), cost: 390, maximum occupancy: 2, house rules: No smoking & No visitors & No parties, minimum nights: 3\n\nNumber of people = 1\nTotal cost = 44 + 79 + 79 + 390 = 592\nAccommodation minimum nights:  2/3\n\nDays: 3,\nCurrent City: from Denver (Colorado) to Alamosa (Colorado),\nTransportation: Flight Number: F3857649, from Denver (Colorado) to Alamosa (Colorado), Departure Time: 15:44, Arrival Time: 16:33, cost: 37\nBreakfast: -,\nAttraction: Denver Art Museum, Denver (Colorado);\nLunch: Rain Tree Grill, Denver (Colorado), cost: 94, cuisines: \u201cTea, Mexican, BBQ, Italian\u201d\nDinner: Atlanta Highway Seafood Market, Alamosa (Colorado), cost: 68, cuisines: \u201cFast Food, Desserts, Seafood\u201d\nAccommodation: Comfortable studio suite in midtown Manhattan, Alamosa (Colorado), cost: 67, maximum occupancy: 2, house rules: No parties & No smoking & No visitors, minimum nights: 30\n\nNumber of people = 1\nTotal cost = 37 + 94 + 68 + 67 = 266\nAccommodation minimum nights:  1/30\n\nDays: 4,\nCurrent City: Alamosa (Colorado),\nTransportation: -,\nBreakfast: Riverwalk Cafe, Alamosa (Colorado), cost: 97, cuisines: \u201cTea, Pizza, Fast Food\u201d\nAttraction: San Luis Valley Museum | Alamosa, Alamosa (Colorado); Rio Grande Farm Park, Alamosa (Colorado);\nLunch: Coffee to Cocktail Bar - Hyatt Place, Alamosa (Colorado), cost: 35, cuisines: \u201cTea, Indian, Desserts, Italian\u201d\nDinner: Burger Singh, Alamosa (Colorado), cost: 95, cuisines: \u201cDesserts, Tea, BBQ, Chinese, Seafood\u201d\nAccommodation: Comfortable studio suite in midtown Manhattan, Alamosa (Colorado), cost: 67, maximum occupancy: 2, house rules: No parties & No smoking & No visitors, minimum nights: 30\n\nNumber of people = 1\nTotal cost = 97 + 35 + 95 + 67 = 294\nAccommodation minimum nights:  2/30\n\nDays: 5,\nCurrent City: from Alamosa (Colorado) to Cedar Rapids,\nTransportation: Self-driving, from Alamosa (Colorado) to Cedar Rapids, duration: 14 hours 27 mins, distance: 1,541 km, cost: 77\nBreakfast: -,\nAttraction: -,\nLunch: -,\nDinner: -,\nAccommodation: -\n\nNumber of people = 1\nTotal cost = 77\n\nTotal cost across all days = 777 + 592 + 266 + 294 + 77 = 2006\n\nCuisines: No specific cuisines were requested, so all cuisine constraints are satisfied.\nHouse rules: All accommodations chosen meet the house rules specified in the query.\nTransportation: The travel plan includes flights and self-driving, as requested, with no prohibited transportation types used.\n\nThe total cost of the travel plan is well within the specified budget of $4,300.", "gpt-4-1106-preview_direct_sole-planning_parsed_results": [{"day": 1, "current_city": "from Cedar Rapids to Denver", "transportation": "Flight Number: F3840860, from Cedar Rapids to Denver, Departure Time: 16:23, Arrival Time: 17:15", "breakfast": "-", "attraction": "-", "lunch": "-", "dinner": "The Fatty Bao - Asian Gastro Bar, Denver", "accommodation": "*NO GUEST SERVICE FEE* Luxury Studio Suite w/ Free Continental Breakfast, Denver"}, {"day": 2, "current_city": "Denver", "transportation": "-", "breakfast": "Cafe Diva, Denver", "attraction": "Denver Zoo, Denver;Denver Botanic Gardens, Denver;", "lunch": "Tasty Fare, Denver", "dinner": "New Town Cafe - Park Plaza, Denver", "accommodation": "*NO GUEST SERVICE FEE* Luxury Studio Suite w/ Free Continental Breakfast, Denver"}, {"day": 3, "current_city": "from Denver to Alamosa", "transportation": "Flight Number: F3857649, from Denver to Alamosa, Departure Time: 15:44, Arrival Time: 16:33", "breakfast": "-", "attraction": "Denver Art Museum, Denver", "lunch": "Rain Tree Grill, Denver", "dinner": "Atlanta Highway Seafood Market, Alamosa", "accommodation": "Comfortable studio suite in midtown Manhattan, Alamosa"}, {"day": 4, "current_city": "Alamosa", "transportation": "-", "breakfast": "Riverwalk Cafe, Alamosa", "attraction": "San Luis Valley Museum | Alamosa, Alamosa;Rio Grande Farm Park, Alamosa;", "lunch": "Coffee to Cocktail Bar - Hyatt Place, Alamosa", "dinner": "Burger Singh, Alamosa", "accommodation": "Comfortable studio suite in midtown Manhattan, Alamosa"}, {"day": 5, "current_city": "from Alamosa to Cedar Rapids", "transportation": "Self-driving, from Alamosa to Cedar Rapids, duration: 14 hours 27 mins, distance: 1,541 km", "breakfast": "-", "attraction": "-", "lunch": "-", "dinner": "-", "accommodation": "-"}]}]