[{"gpt-4-1106-preview_direct_sole-planning_results": "Travel Plan:\nDays: 1,\nCurrent City: from Valparaiso to Belleville,\nTransportation: Flight Number: F3579167, from Valparaiso to Belleville, Departure Time: 17:23, Arrival Time: 19:06, cost: 211\nBreakfast: -,\nAttraction: -,\nLunch: -,\nDinner: Fuji Japanese Steak House, Belleville, cost: 70, cuisines: \u201cBakery, Indian, Cafe\u201d\nAccommodation: 1 Bedroom/1 Bath Apt in Hudson Yards/Midtown West, Belleville, cost: 610, room type: Entire home/apt, maximum occupancy: 2, house rules: No parties & No pets, minimum nights: 1\n\nNumber of people = 8\nTotal cost = (211 + 70) * 8 + 610 * 4 = 2,248 + 2,440 = 4,688\nAccommodation minimum nights:  1/1\n\nDays: 2,\nCurrent City: Belleville,\nTransportation: -,\nBreakfast: Super Restaurant, Belleville, cost: 96, cuisines: \u201cTea, American, BBQ, Italian\u201d\nAttraction: National Shrine of Our Lady of the Snows, Belleville; Belleville Square, Belleville;,\nLunch: Ajeet Fast Food Corner, Belleville, cost: 91, cuisines: \u201cTea, Bakery, Fast Food, American, Mediterranean, Seafood\u201d\nDinner: Shanghai Cafe, Belleville, cost: 96, cuisines: \u201cTea, Pizza, Bakery, Fast Food, Chinese\u201d\nAccommodation: 1 Bedroom/1 Bath Apt in Hudson Yards/Midtown West, Belleville, cost: 610, room type: Entire home/apt, maximum occupancy: 2, house rules: No parties & No pets, minimum nights: 1\n\nNumber of people = 8\nTotal cost = (96 + 91 + 96) * 8 + 610 * 4 = 2,216 + 2,440 = 4,656\nAccommodation minimum nights:  2/1\n\nDays: 3,\nCurrent City: from Belleville to Valparaiso,\nTransportation: Flight Number: F3571908, from Belleville to Valparaiso, Departure Time: 17:15, Arrival Time: 18:55, cost: 124\nBreakfast: Moti Mahal Delux, Belleville, cost: 55, cuisines: \u201cCafe, American, Desserts\u201d\nAttraction: -,\nLunch: -,\nDinner: -,\nAccommodation: -\n\nNumber of people = 8\nTotal cost = (124 + 55) * 8 = 1,432\n\nTotal cost across all days = 4,688 + 4,656 + 1,432 = 10,776\n\nHowever, the total cost exceeds the budget of $6,600. To adjust the plan within the budget, we need to change the accommodation to a more affordable option and possibly adjust meal plans.\n\nRevised Travel Plan:\nDays: 1,\nCurrent City: from Valparaiso to Belleville,\nTransportation: Flight Number: F3579167, from Valparaiso to Belleville, Departure Time: 17:23, Arrival Time: 19:06, cost: 211\nBreakfast: -,\nAttraction: -,\nLunch: -,\nDinner: Fuji Japanese Steak House, Belleville, cost: 70, cuisines: \u201cBakery, Indian, Cafe\u201d\nAccommodation: Cozy, Belleville, cost: 184, room type: Private room, maximum occupancy: 2, house rules: No visitors & No smoking & No children under 10, minimum nights: 1\n\nNumber of people = 8\nTotal cost = (211 + 70) * 8 + 184 * 4 = 2,248 + 736 = 2,984\nAccommodation minimum nights:  1/1\n\nDays: 2,\nCurrent City: Belleville,\nTransportation: -,\nBreakfast: Super Restaurant, Belleville, cost: 96, cuisines: \u201cTea, American, BBQ, Italian\u201d\nAttraction: National Shrine of Our Lady of the Snows, Belleville; Belleville Square, Belleville;,\nLunch: Ajeet Fast Food Corner, Belleville, cost: 91, cuisines: \u201cTea, Bakery, Fast Food, American, Mediterranean, Seafood\u201d\nDinner: Shanghai Cafe, Belleville, cost: 96, cuisines: \u201cTea, Pizza, Bakery, Fast Food, Chinese\u201d\nAccommodation: Cozy, Belleville, cost: 184, room type: Private room, maximum occupancy: 2, house rules: No visitors & No smoking & No children under 10, minimum nights: 1\n\nNumber of people = 8\nTotal cost = (96 + 91 + 96) * 8 + 184 * 4 = 2,216 + 736 = 2,952\nAccommodation minimum nights:  2/1\n\nDays: 3,\nCurrent City: from Belleville to Valparaiso,\nTransportation: Flight Number: F3571908, from Belleville to Valparaiso, Departure Time: 17:15, Arrival Time: 18:55, cost: 124\nBreakfast: Moti Mahal Delux, Belleville, cost: 55, cuisines: \u201cCafe, American, Desserts\u201d\nAttraction: -,\nLunch: -,\nDinner: -,\nAccommodation: -\n\nNumber of people = 8\nTotal cost = (124 + 55) * 8 = 1,432\n\nTotal revised cost across all days = 2,984 + 2,952 + 1,432 = 7,368\n\nThe revised plan still exceeds the budget. Further adjustments are needed, such as choosing less expensive meals or reducing the number of attractions visited.\n\nFinal Revised Travel Plan:\nDays: 1,\nCurrent City: from Valparaiso to Belleville,\nTransportation: Flight Number: F3579167, from Valparaiso to Belleville, Departure Time: 17:23, Arrival Time: 19:06, cost: 211\nBreakfast: -,\nAttraction: -,\nLunch: -,\nDinner: Best Biryani, Belleville, cost: 19, cuisines: \u201cCafe, Pizza, Desserts, Fast Food\u201d\nAccommodation: Cozy, Belleville, cost: 184, room type: Private room, maximum occupancy: 2, house rules: No visitors & No smoking & No children under 10, minimum nights: 1\n\nNumber of people = 8\nTotal cost = (211 + 19) * 8 + 184 * 4 = 1,840 + 736 = 2,576\nAccommodation minimum nights:  1/1\n\nDays: 2,\nCurrent City: Belleville,\nTransportation: -,\nBreakfast: Chocolate Temptation, Belleville, cost: 16, cuisines: \u201cTea, Chinese, Fast Food\u201d\nAttraction: National Shrine of Our Lady of the Snows, Belleville; Belleville Square, Belleville;,\nLunch: Best Biryani, Belleville, cost: 19, cuisines: \u201cCafe, Pizza, Desserts, Fast Food\u201d\nDinner: Shanghai Cafe, Belleville, cost: 96, cuisines: \u201cTea, Pizza, Bakery, Fast Food, Chinese\u201d\nAccommodation: Cozy, Belleville, cost: 184, room type: Private room, maximum occupancy: 2, house rules: No visitors & No smoking & No children under 10, minimum nights: 1\n\nNumber of people = 8\nTotal cost = (16 + 19 + 96) * 8 + 184 * 4 = 1,048 + 736 = 1,784\nAccommodation minimum nights:  2/1\n\nDays: 3,\nCurrent City: from Belleville to Valparaiso,\nTransportation: Flight Number: F3571908, from Belleville to Valparaiso, Departure Time: 17:15, Arrival Time: 18:55, cost: 124\nBreakfast: Chocolate Temptation, Belleville, cost: 16, cuisines: \u201cTea, Chinese, Fast Food\u201d\nAttraction: -,\nLunch: -,\nDinner: -,\nAccommodation: -\n\nNumber of people = 8\nTotal cost = (124 + 16) * 8 = 1,120\n\nTotal final revised cost across all days = 2,576 + 1,784 + 1,120 = 5,480\n\nThe final revised plan is within the budget of $6,600 and includes Chinese and American cuisines as requested.", "gpt-4-1106-preview_direct_sole-planning_parsed_results": [{"day": 1, "current_city": "from Valparaiso to Belleville", "transportation": "Flight Number: F3579167, from Valparaiso to Belleville, Departure Time: 17:23, Arrival Time: 19:06", "breakfast": "-", "attraction": "-", "lunch": "-", "dinner": "Best Biryani, Belleville", "accommodation": "Cozy, Belleville"}, {"day": 2, "current_city": "Belleville", "transportation": "-", "breakfast": "Chocolate Temptation, Belleville", "attraction": "National Shrine of Our Lady of the Snows, Belleville;Belleville Square, Belleville;", "lunch": "Best Biryani, Belleville", "dinner": "Shanghai Cafe, Belleville", "accommodation": "Cozy, Belleville"}, {"day": 3, "current_city": "from Belleville to Valparaiso", "transportation": "Flight Number: F3571908, from Belleville to Valparaiso, Departure Time: 17:15, Arrival Time: 18:55", "breakfast": "Chocolate Temptation, Belleville", "attraction": "-", "lunch": "-", "dinner": "-", "accommodation": "-"}]}]