[{"gpt-4-1106-preview_direct_sole-planning_results": "Travel Plan:\n\nDays: 1,\nCurrent City: from Salt Lake City to Twin Falls,\nTransportation: Flight Number: F3809095, from Salt Lake City to Twin Falls, Departure Time: 11:00, Arrival Time: 11:55, cost: 64\nBreakfast: -,\nAttraction: -,\nLunch: Thai Paradise, Twin Falls, cost: 87, cuisines: \u201cFast Food, Indian, Desserts, Seafood\u201d\nDinner: Food Fever, Twin Falls, cost: 83, cuisines: \u201cFast Food, Chinese, BBQ, Seafood\u201d\nAccommodation: Charming studio, great location!!!, Twin Falls, cost: 994, maximum occupancy: 8, house rules: No smoking & No pets, minimum nights: 2\n\nNumber of people = 2\nTotal cost = (64 + 87 + 83) * 2 + 994 = 1,378\nAccommodation minimum nights:  1/2\n\nDays: 2,\nCurrent City: Twin Falls,\nTransportation: -,\nBreakfast: Subway, Twin Falls, cost: 77, cuisines: \u201cFrench, BBQ, Chinese, Seafood\u201d\nAttraction: Shoshone Falls Park, Twin Falls; Centennial Waterfront Park, Twin Falls,\nLunch: Asia Kitchen, Twin Falls, cost: 67, cuisines: \u201cTea, Cafe, BBQ, Desserts\u201d\nDinner: Fresc Co, Twin Falls, cost: 60, cuisines: \u201cDesserts, Mexican, BBQ, Mediterranean, Seafood\u201d\nAccommodation: Charming studio, great location!!!, Twin Falls, cost: 994, maximum occupancy: 8, house rules: No smoking & No pets, minimum nights: 2\n\nNumber of people = 2\nTotal cost = (77 + 67 + 60) * 2 + 994 = 1,332\nAccommodation minimum nights:  2/2 (Done!)\n\nDays: 3,\nCurrent City: from Twin Falls to Salt Lake City,\nTransportation: Flight Number: F3807678, from Twin Falls to Salt Lake City, Departure Time: 12:35, Arrival Time: 13:20, cost: 56\nBreakfast: The Bake Studio, Twin Falls, cost: 23, cuisines: \u201cTea, Pizza, Bakery, Fast Food, Mediterranean\u201d\nAttraction: -,\nLunch: -,\nDinner: -,\nAccommodation: -\n\nNumber of people = 2\nTotal cost = (56 + 23) * 2 = 158\n\nTotal cost across all days = 1,378 + 1,332 + 158 = 2,868\n\nCuisines: The prompt specifies Chinese and Mexican, and both of these cuisines have been represented in the restaurants chosen.\n\nNote: The total cost exceeds the specified budget of $1,600. Adjustments are needed to meet the budget constraint. Possible adjustments could include changing the accommodation to a less expensive option or altering transportation methods. However, given the provided data, there are no cheaper accommodations listed, and the transportation costs are already at the lowest options provided for flights. If self-driving or taxi options are available for a lower cost, they could be considered, but these are not listed in the provided data.", "gpt-4-1106-preview_direct_sole-planning_parsed_results": [{"day": 1, "current_city": "from Salt Lake City to Twin Falls", "transportation": "Flight Number: F3809095, from Salt Lake City to Twin Falls, Departure Time: 11:00, Arrival Time: 11:55", "breakfast": "-", "attraction": "-", "lunch": "Thai Paradise, Twin Falls", "dinner": "Food Fever, Twin Falls", "accommodation": "Charming studio, great location!!!, Twin Falls"}, {"day": 2, "current_city": "Twin Falls", "transportation": "-", "breakfast": "Subway, Twin Falls", "attraction": "Shoshone Falls Park, Twin Falls;Centennial Waterfront Park, Twin Falls;", "lunch": "Asia Kitchen, Twin Falls", "dinner": "Fresc Co, Twin Falls", "accommodation": "Charming studio, great location!!!, Twin Falls"}, {"day": 3, "current_city": "from Twin Falls to Salt Lake City", "transportation": "Flight Number: F3807678, from Twin Falls to Salt Lake City, Departure Time: 12:35, Arrival Time: 13:20", "breakfast": "The Bake Studio, Twin Falls", "attraction": "-", "lunch": "-", "dinner": "-", "accommodation": "-"}]}]