[{"gpt-4-1106-preview_direct_sole-planning_results": "Travel Plan:\nDays: 1,\nCurrent City: from Spokane to San Francisco (California),\nTransportation: Flight Number: F3853330, from Spokane to San Francisco (California), Departure Time: 07:10, Arrival Time: 09:38, cost: 227\nBreakfast: -,\nAttraction: -,\nLunch: Coffee & Chai Co., San Francisco (California), cost: 10, cuisines: \u201cTea, Mexican, BBQ, Cafe, Seafood\u201d\nDinner: Bonne Bouche, San Francisco (California), cost: 21, cuisines: \u201cTea, Chinese, American, Cafe\u201d\nAccommodation: Room in Down town Brooklyn Parkslop, San Francisco (California), cost: 79, room type: Private room, maximum occupancy: 2, house rules: No visitors, minimum nights: 1\n\nNumber of people = 1\nTotal cost = 227 + 10 + 21 + 79 = 337\nAccommodation minimum nights:  1/1\n\nDays: 2,\nCurrent City: San Francisco (California),\nTransportation: -,\nBreakfast: Tokyo Sushi, San Francisco (California), cost: 18, cuisines: \u201cCafe, Pizza, BBQ\u201d\nAttraction: Golden Gate Bridge, San Francisco (California); Golden Gate Park, San Francisco (California);\nLunch: Empress, San Francisco (California), cost: 24, cuisines: \u201cPizza, BBQ, Mediterranean, Fast Food\u201d\nDinner: Kream's, San Francisco (California), cost: 67, cuisines: \u201cTea, Pizza, BBQ, Chinese, Seafood\u201d\nAccommodation: Room in Down town Brooklyn Parkslop, San Francisco (California), cost: 79, room type: Private room, maximum occupancy: 2, house rules: No visitors, minimum nights: 1\n\nNumber of people = 1\nTotal cost = 18 + 24 + 67 + 79 = 188\nAccommodation minimum nights:  2/1\n\nDays: 3,\nCurrent City: from San Francisco (California) to Spokane,\nTransportation: Flight Number: F3840215, from San Francisco (California) to Spokane, Departure Time: 16:21, Arrival Time: 18:29, cost: 343\nBreakfast: Gupta's Rasoi, San Francisco (California), cost: 13, cuisines: \u201cCafe, Bakery, BBQ, Mediterranean\u201d\nAttraction: -,\nLunch: -,\nDinner: -,\nAccommodation: -\n\nNumber of people = 1\nTotal cost = 343 + 13 = 356\n\nTotal cost across all days = 337 + 188 + 356 = 881\n\nCuisines: The prompt does not specify any cuisine preferences, so all cuisine constraints are satisfied.\nHouse rules: All accommodations chosen adhere to the house rules specified in the listings.\n\nNote: The travel plan includes all required details for each day, adheres to the budget, and includes valid transportation modes. The accommodations are private as per the listings, and the attractions are in the destination city. The plan also ensures that the city sequence starts and ends in the same city, forming a closed loop.", "gpt-4-1106-preview_direct_sole-planning_parsed_results": [{"day": 1, "current_city": "from Spokane to San Francisco", "transportation": "Flight Number: F3853330, from Spokane to San Francisco, Departure Time: 07:10, Arrival Time: 09:38", "breakfast": "-", "attraction": "-", "lunch": "Coffee & Chai Co., San Francisco", "dinner": "Bonne Bouche, San Francisco", "accommodation": "Room in Down town Brooklyn Parkslop, San Francisco"}, {"day": 2, "current_city": "San Francisco", "transportation": "-", "breakfast": "Tokyo Sushi, San Francisco", "attraction": "Golden Gate Bridge, San Francisco;Golden Gate Park, San Francisco;", "lunch": "Empress, San Francisco", "dinner": "Kream's, San Francisco", "accommodation": "Room in Down town Brooklyn Parkslop, San Francisco"}, {"day": 3, "current_city": "from San Francisco to Spokane", "transportation": "Flight Number: F3840215, from San Francisco to Spokane, Departure Time: 16:21, Arrival Time: 18:29", "breakfast": "Gupta's Rasoi, San Francisco", "attraction": "-", "lunch": "-", "dinner": "-", "accommodation": "-"}]}]