[{"gpt-4-1106-preview_direct_sole-planning_results": "Travel Plan:\nDays: 1,\nCurrent City: from Atlanta to Knoxville (Tennessee),\nTransportation: Flight Number: F3556207, from Atlanta to Knoxville (Tennessee), Departure Time: 10:57, Arrival Time: 11:42, cost: 45\nBreakfast: -,\nAttraction: -,\nLunch: -,\nDinner: Cafe Arabelle, Knoxville (Tennessee), cost: 29, cuisines: \u201cFrench, BBQ, Desserts, Seafood\u201d\nAccommodation: Light-filled Room in Renovated Apt, Knoxville (Tennessee), cost: 310, maximum occupancy: 2, house rules: No pets, minimum nights: 2\n\nNumber of people = 2 (assuming 1 adult and 1 child under 10)\nTotal cost = (45 * 2) + 29 + 310 = 429\nAccommodation minimum nights:  1/2\n\nDays: 2,\nCurrent City: Knoxville (Tennessee),\nTransportation: -,\nBreakfast: Les 3 Brasseurs, Knoxville (Tennessee), cost: 24, cuisines: \u201cDesserts, Pizza, Italian, Cafe, Indian\u201d\nAttraction: Knoxville Museum of Art, Knoxville (Tennessee); Zoo Knoxville, Knoxville (Tennessee),\nLunch: Rama Vaishnav Bhojnalaya, Knoxville (Tennessee), cost: 46, cuisines: \u201cTea, Cafe, Pizza, Desserts\u201d\nDinner: Punjabi Flavour, Knoxville (Tennessee), cost: 41, cuisines: \u201cTea, Bakery, Cafe, Indian, Seafood\u201d\nAccommodation: Light-filled Room in Renovated Apt, Knoxville (Tennessee), cost: 310, maximum occupancy: 2, house rules: No pets, minimum nights: 2\n\nNumber of people = 2\nTotal cost = (24 + 46 + 41) * 2 + 310 = 582\nAccommodation minimum nights:  2/2 (Done!)\n\nDays: 3,\nCurrent City: from Knoxville (Tennessee) to Atlanta,\nTransportation: Flight Number: F3518895, from Knoxville (Tennessee) to Atlanta, Departure Time: 18:47, Arrival Time: 19:44, cost: 45\nBreakfast: Open Kitchen, Knoxville (Tennessee), cost: 13, cuisines: \"Pizza, Bakery, BBQ, Cafe, Indian, Mediterranean\"\nAttraction: World's Fair Park, Knoxville (Tennessee),\nLunch: Cafe Coffee Day, Knoxville (Tennessee), cost: 82, cuisines: \u201cFast Food, American, BBQ, Italian\u201d\nDinner: -,\nAccommodation: -,\n\nNumber of people = 2\nTotal cost = (45 * 2) + (13 + 82) * 2 = 270\n\nTotal cost across all days = 429 + 582 + 270 = 1,281\n\nUnfortunately, the total cost exceeds the budget of $1,000. To adjust the plan to fit within the budget, we can consider changing the flight to a taxi service, which is more economical.\n\nRevised Travel Plan:\nDays: 1,\nCurrent City: from Atlanta to Knoxville (Tennessee),\nTransportation: Taxi, from Atlanta to Knoxville (Tennessee), duration: 3 hours 8 mins, distance: 344 km, cost: 344\nBreakfast: -,\nAttraction: -,\nLunch: -,\nDinner: Cafe Arabelle, Knoxville (Tennessee), cost: 29, cuisines: \u201cFrench, BBQ, Desserts, Seafood\u201d\nAccommodation: Light-filled Room in Renovated Apt, Knoxville (Tennessee), cost: 310, maximum occupancy: 2, house rules: No pets, minimum nights: 2\n\nNumber of people = 2\nTotal cost = 344 + 29 + 310 = 683\nAccommodation minimum nights:  1/2\n\nDays: 2,\nCurrent City: Knoxville (Tennessee),\nTransportation: -,\nBreakfast: Les 3 Brasseurs, Knoxville (Tennessee), cost: 24, cuisines: \u201cDesserts, Pizza, Italian, Cafe, Indian\u201d\nAttraction: Knoxville Museum of Art, Knoxville (Tennessee); Zoo Knoxville, Knoxville (Tennessee),\nLunch: Rama Vaishnav Bhojnalaya, Knoxville (Tennessee), cost: 46, cuisines: \u201cTea, Cafe, Pizza, Desserts\u201d\nDinner: Punjabi Flavour, Knoxville (Tennessee), cost: 41, cuisines: \u201cTea, Bakery, Cafe, Indian, Seafood\u201d\nAccommodation: Light-filled Room in Renovated Apt, Knoxville (Tennessee), cost: 310, maximum occupancy: 2, house rules: No pets, minimum nights: 2\n\nNumber of people = 2\nTotal cost = (24 + 46 + 41) * 2 + 310 = 582\nAccommodation minimum nights:  2/2 (Done!)\n\nDays: 3,\nCurrent City: from Knoxville (Tennessee) to Atlanta,\nTransportation: Taxi, from Knoxville to Atlanta, duration: 3 hours 9 mins, distance: 344 km, cost: 344\nBreakfast: Open Kitchen, Knoxville (Tennessee), cost: 13, cuisines: \"Pizza, Bakery, BBQ, Cafe, Indian, Mediterranean\"\nAttraction: World's Fair Park, Knoxville (Tennessee),\nLunch: Cafe Coffee Day, Knoxville (Tennessee), cost: 82, cuisines: \u201cFast Food, American, BBQ, Italian\u201d\nDinner: -,\nAccommodation: -,\n\nNumber of people = 2\nTotal cost = 344 + (13 + 82) * 2 = 534\n\nTotal revised cost across all days = 683 + 582 + 534 = 1,799\n\nThe revised plan still exceeds the budget. To further reduce costs, we can opt for a less expensive accommodation option:\n\nFinal Revised Travel Plan:\nDays: 1,\nCurrent City: from Atlanta to Knoxville (Tennessee),\nTransportation: Taxi, from Atlanta to Knoxville (Tennessee), duration: 3 hours 8 mins, distance: 344 km, cost: 344\nBreakfast: -,\nAttraction: -,\nLunch: -,\nDinner: Cafe Arabelle, Knoxville (Tennessee), cost: 29, cuisines: \u201cFrench, BBQ, Desserts, Seafood\u201d\nAccommodation: Cozy Private Room in Chinatown/ Lower East Side, Knoxville (Tennessee), cost: 132, maximum occupancy: 2, house rules: No pets & No visitors, minimum nights: 7\n\nNumber of people = 2\nTotal cost = 344 + 29 + 132 = 505\nAccommodation minimum nights:  1/7\n\nDays: 2,\nCurrent City: Knoxville (Tennessee),\nTransportation: -,\nBreakfast: Les 3 Brasseurs, Knoxville (Tennessee), cost: 24, cuisines: \u201cDesserts, Pizza, Italian, Cafe, Indian\u201d\nAttraction: Knoxville Museum of Art, Knoxville (Tennessee); Zoo Knoxville, Knoxville (Tennessee),\nLunch: Rama Vaishnav Bhojnalaya, Knoxville (Tennessee), cost: 46, cuisines: \u201cTea, Cafe, Pizza, Desserts\u201d\nDinner: Punjabi Flavour, Knoxville (Tennessee), cost: 41, cuisines: \u201cTea, Bakery, Cafe, Indian, Seafood\u201d\nAccommodation: Cozy Private Room in Chinatown/ Lower East Side, Knoxville (Tennessee), cost: 132, maximum occupancy: 2, house rules: No pets & No visitors, minimum nights: 7\n\nNumber of people = 2\nTotal cost = (24 + 46 + 41) * 2 + 132 = 404\nAccommodation minimum nights:  2/7\n\nDays: 3,\nCurrent City: from Knoxville (Tennessee) to Atlanta,\nTransportation: Taxi, from Knoxville to Atlanta, duration: 3 hours 9 mins, distance: 344 km, cost: 344\nBreakfast: Open Kitchen, Knoxville (Tennessee), cost: 13, cuisines: \"Pizza, Bakery, BBQ, Cafe, Indian, Mediterranean\"\nAttraction: World's Fair Park, Knoxville (Tennessee),\nLunch: Cafe Coffee Day, Knoxville (Tennessee), cost: 82, cuisines: \u201cFast Food, American, BBQ, Italian\u201d\nDinner: -,\nAccommodation: -,\n\nNumber of people = 2\nTotal cost = 344 + (13 + 82) * 2 = 534\n\nTotal final revised cost across all days = 505 + 404 + 534 = 1,443\n\nThe final revised plan still exceeds the budget of $1,000. Given the constraints, it is not possible to create a travel plan within the budget of $1,000 for the specified dates, transportation, and accommodation preferences.", "gpt-4-1106-preview_direct_sole-planning_parsed_results": [{"day": 1, "current_city": "from Atlanta to Knoxville (Tennessee)", "transportation": "Taxi, from Atlanta to Knoxville (Tennessee), duration: 3 hours 8 mins, distance: 344 km", "breakfast": "-", "attraction": "-", "lunch": "-", "dinner": "Cafe Arabelle, Knoxville (Tennessee)", "accommodation": "Cozy Private Room in Chinatown/ Lower East Side, Knoxville (Tennessee)"}, {"day": 2, "current_city": "Knoxville (Tennessee)", "transportation": "-", "breakfast": "Les 3 Brasseurs, Knoxville (Tennessee)", "attraction": "Knoxville Museum of Art, Knoxville (Tennessee);Zoo Knoxville, Knoxville (Tennessee);", "lunch": "Rama Vaishnav Bhojnalaya, Knoxville (Tennessee)", "dinner": "Punjabi Flavour, Knoxville (Tennessee)", "accommodation": "Cozy Private Room in Chinatown/ Lower East Side, Knoxville (Tennessee)"}, {"day": 3, "current_city": "from Knoxville (Tennessee) to Atlanta", "transportation": "Taxi, from Knoxville to Atlanta, duration: 3 hours 9 mins, distance: 344 km", "breakfast": "Open Kitchen, Knoxville (Tennessee)", "attraction": "World's Fair Park, Knoxville (Tennessee)", "lunch": "Cafe Coffee Day, Knoxville (Tennessee)", "dinner": "-", "accommodation": "-"}]}]