[{"gpt-4-1106-preview_direct_sole-planning_results": "Travel Plan:\nDays: 1,\nCurrent City: from Eugene to Los Angeles,\nTransportation: Flight Number: F3818922, from Eugene to Los Angeles, Departure Time: 16:33, Arrival Time: 18:47, cost: 225\nBreakfast: -,\nAttraction: -,\nLunch: -,\nDinner: Punjabi Zaika, Los Angeles, cost: 46, cuisines: \u201cPizza, Bakery, BBQ, Cafe, Indian\u201d\nAccommodation: Lovely studio, Los Angeles, cost: 117, room type: Entire home/apt, house rules: No visitors, minimum nights: 1, maximum occupancy: 3\n\nNumber of people = 2\nTotal cost = (225 + 46) * 2 + 117 = 659\nAccommodation minimum nights:  1/1 (Done!)\n\nDays: 2,\nCurrent City: Los Angeles,\nTransportation: -,\nBreakfast: Heat - Edsa Shangri-La, Los Angeles, cost: 148, cuisines: \u201cBakery, BBQ\u201d\nAttraction: Santa Monica Pier, Los Angeles; Griffith Observatory, Los Angeles,\nLunch: The Hangout by 1861, Los Angeles, cost: 64, cuisines: \u201cTea, Pizza, Seafood\u201d\nDinner: Village - The House of Food, Los Angeles, cost: 87, cuisines: \u201cChinese, Pizza, Cafe\u201d\nAccommodation: Lovely studio, Los Angeles, cost: 117, room type: Entire home/apt, house rules: No visitors, minimum nights: 1, maximum occupancy: 3\n\nNumber of people = 2\nTotal cost = (148 + 64 + 87) * 2 + 117 = 715\nAccommodation minimum nights:  2/1 (Done!)\n\nDays: 3,\nCurrent City: from Los Angeles to Eugene,\nTransportation: Flight Number: F3819973, from Los Angeles to Eugene, Departure Time: 13:35, Arrival Time: 16:03, cost: 166\nBreakfast: -,\nAttraction: -,\nLunch: -,\nDinner: -,\nAccommodation: -\n\nNumber of people = 2\nTotal cost = 166 * 2 = 332\n\nTotal cost across all days = 659 + 715 + 332 = 1,706\n\nCuisines: The prompt does not specify any cuisine preferences, so all cuisine constraints are satisfied.\nHouse rules: All accommodations chosen are entire rooms as requested, and the house rules are adhered to.\nBudget: The total cost slightly exceeds the budget by $6, which may require re-evaluation of dining options or seeking a promotional discount on one of the services to stay within budget.", "gpt-4-1106-preview_direct_sole-planning_parsed_results": [{"day": 1, "current_city": "from Eugene to Los Angeles", "transportation": "Flight Number: F3818922, from Eugene to Los Angeles, Departure Time: 16:33, Arrival Time: 18:47", "breakfast": "-", "attraction": "-", "lunch": "-", "dinner": "Punjabi Zaika, Los Angeles", "accommodation": "Lovely studio, Los Angeles"}, {"day": 2, "current_city": "Los Angeles", "transportation": "-", "breakfast": "Heat - Edsa Shangri-La, Los Angeles", "attraction": "Santa Monica Pier, Los Angeles;Griffith Observatory, Los Angeles", "lunch": "The Hangout by 1861, Los Angeles", "dinner": "Village - The House of Food, Los Angeles", "accommodation": "Lovely studio, Los Angeles"}, {"day": 3, "current_city": "from Los Angeles to Eugene", "transportation": "Flight Number: F3819973, from Los Angeles to Eugene, Departure Time: 13:35, Arrival Time: 16:03", "breakfast": "-", "attraction": "-", "lunch": "-", "dinner": "-", "accommodation": "-"}]}]