[{"gpt-4-1106-preview_direct_sole-planning_results": "Travel Plan:\n\nDays: 1,\nCurrent City: from Boston to Syracuse,\nTransportation: Taxi, from Boston to Syracuse, duration: 4 hours 43 mins, distance: 502 km, cost: 502\nBreakfast: -,\nAttraction: -,\nLunch: -,\nDinner: Silantro Fil-Mex, Syracuse, cost: 29, cuisines: \u201cChinese, BBQ, Mediterranean, Fast Food\u201d\nAccommodation: The Gramercy East, Syracuse, cost: 1031, room type: Entire home/apt, house rules: No parties & No pets, minimum nights: 2, maximum occupancy: 3\n\nNumber of people = 2\nTotal cost = 502 * 2 + 29 * 2 + 1031 = 2093\nAccommodation minimum nights:  1/2\n\nDays: 2,\nCurrent City: Syracuse,\nTransportation: -,\nBreakfast: Cafe Coffee Day, Syracuse, cost: 16, cuisines: \u201cTea, Cafe, BBQ\u201d\nAttraction: Erie Canal Museum, Syracuse; Rosamond Gifford Zoo, Syracuse,\nLunch: Tucanos, Syracuse, cost: 36, cuisines: \u201cPizza, BBQ, Desserts\u201d\nDinner: Raj Restaurant, Syracuse, cost: 61, cuisines: \u201cFrench, Bakery, Indian, BBQ\u201d\nAccommodation: The Gramercy East, Syracuse, cost: 1031, room type: Entire home/apt, house rules: No parties & No pets, minimum nights: 2, maximum occupancy: 3\n\nNumber of people = 2\nTotal cost = (16 + 36 + 61) * 2 + 1031 = 1262\nAccommodation minimum nights:  2/2 (Done!)\n\nDays: 3,\nCurrent City: from Syracuse to New York,\nTransportation: Taxi, from Syracuse to New York, duration: 4 hours 4 mins, distance: 397 km, cost: 397\nBreakfast: -,\nAttraction: -,\nLunch: -,\nDinner: Seasons 52 Fresh Grill, New York, cost: 30, cuisines: \u201cSeafood, Indian, Desserts, Italian\u201d\nAccommodation: Versatile private room in Harlem/Hamilton Heights!, New York, cost: 398, room type: Private room, house rules: No pets & No visitors & No parties, minimum nights: 4, maximum occupancy: 1\n\nNumber of people = 2\nTotal cost = 397 * 2 + 30 * 2 + 398 * 2 = 1652\nAccommodation minimum nights:  1/4\n\nDays: 4,\nCurrent City: New York,\nTransportation: -,\nBreakfast: Gurgaon Hights, New York, cost: 46, cuisines: \u201cCafe, American, Indian, Fast Food\u201d\nAttraction: Top of The Rock, New York; The High Line, New York,\nLunch: Rambhog, New York, cost: 95, cuisines: \u201cTea, Seafood, Mexican, Fast Food\u201d\nDinner: Lord of the Drinks Forum, New York, cost: 71, cuisines: \u201cCafe, Bakery, BBQ, Chinese, Indian\u201d\nAccommodation: Versatile private room in Harlem/Hamilton Heights!, New York, cost: 398, room type: Private room, house rules: No pets & No visitors & No parties, minimum nights: 4, maximum occupancy: 1\n\nNumber of people = 2\nTotal cost = (46 + 95 + 71) * 2 + 398 * 2 = 1514\nAccommodation minimum nights:  2/4\n\nDays: 5,\nCurrent City: from New York to Boston,\nTransportation: Taxi, from New York to Boston, duration: 3 hours 41 mins, distance: 346 km, cost: 346\nBreakfast: -,\nAttraction: -,\nLunch: -,\nDinner: -,\nAccommodation: -\n\nNumber of people = 2\nTotal cost = 346 * 2 = 692\n\nTotal cost across all days = 2093 + 1262 + 1652 + 1514 + 692 = 7213\n\nNote: The total cost exceeds the specified budget of $2,700. Adjustments are required to meet the budget constraint. Since the budget is not sufficient to cover the costs of the travel plan, we need to revise the plan to fit within the budget. This could involve choosing more affordable accommodations, dining options, or changing the transportation method. However, given the constraints and the data provided, it is not possible to create a travel plan that fits the budget and meets all the requirements.", "gpt-4-1106-preview_direct_sole-planning_parsed_results": [{"day": 1, "current_city": "from Boston to Syracuse", "transportation": "Taxi, from Boston to Syracuse, duration: 4 hours 43 mins, distance: 502 km", "breakfast": "-", "attraction": "-", "lunch": "-", "dinner": "Silantro Fil-Mex, Syracuse", "accommodation": "The Gramercy East, Syracuse"}, {"day": 2, "current_city": "Syracuse", "transportation": "-", "breakfast": "Cafe Coffee Day, Syracuse", "attraction": "Erie Canal Museum, Syracuse;Rosamond Gifford Zoo, Syracuse;", "lunch": "Tucanos, Syracuse", "dinner": "Raj Restaurant, Syracuse", "accommodation": "The Gramercy East, Syracuse"}, {"day": 3, "current_city": "from Syracuse to New York", "transportation": "Taxi, from Syracuse to New York, duration: 4 hours 4 mins, distance: 397 km", "breakfast": "-", "attraction": "-", "lunch": "-", "dinner": "Seasons 52 Fresh Grill, New York", "accommodation": "Versatile private room in Harlem/Hamilton Heights!, New York"}, {"day": 4, "current_city": "New York", "transportation": "-", "breakfast": "Gurgaon Hights, New York", "attraction": "Top of The Rock, New York;The High Line, New York;", "lunch": "Rambhog, New York", "dinner": "Lord of the Drinks Forum, New York", "accommodation": "Versatile private room in Harlem/Hamilton Heights!, New York"}, {"day": 5, "current_city": "from New York to Boston", "transportation": "Taxi, from New York to Boston, duration: 3 hours 41 mins, distance: 346 km", "breakfast": "-", "attraction": "-", "lunch": "-", "dinner": "-", "accommodation": "-"}]}]