[{"gpt-4-1106-preview_direct_sole-planning_results": "Travel Plan:\n\nDays: 1,\nCurrent City: from Birmingham to Miami (Florida),\nTransportation: Flight Number: F3592186, from Birmingham to Miami (Florida), Departure Time: 18:32, Arrival Time: 21:17, cost: 301\nBreakfast: -,\nAttraction: -,\nLunch: -,\nDinner: Clocked, Miami (Florida), cost: 49, cuisines: \u201cTea, Italian, Mexican, BBQ, Cafe\u201d\nAccommodation: Simple and clean bedroom with good view and light, Miami (Florida), cost: 669, room type: Private room, house rules: No children under 10, minimum nights: 1, maximum occupancy: 2\n\nNumber of people = 1\nTotal cost = 301 + 49 + 669 = 1,019\nAccommodation minimum nights:  1/1\n\nDays: 2,\nCurrent City: Miami (Florida),\nTransportation: -,\nBreakfast: Papouli's Mediterranean Cafe & Market, Miami (Florida), cost: 26, cuisines: \u201cTea, Desserts\u201d\nAttraction: Jungle Island, Miami (Florida); P\u00e9rez Art Museum Miami, Miami (Florida);\nLunch: Tako Cheena by Pom Pom, Miami (Florida), cost: 60, cuisines: \u201cFast Food, Indian, Desserts, Italian\u201d\nDinner: AB's Absolute Barbecues, Miami (Florida), cost: 55, cuisines: \u201cDesserts, Tea, Pizza, Italian, Fast Food, American\u201d\nAccommodation: Simple and clean bedroom with good view and light, Miami (Florida), cost: 669, room type: Private room, house rules: No children under 10, minimum nights: 1, maximum occupancy: 2\n\nNumber of people = 1\nTotal cost = 26 + 60 + 55 + 669 = 810\nAccommodation minimum nights:  2/1\n\nDays: 3,\nCurrent City: from Miami (Florida) to Orlando (Florida),\nTransportation: Flight Number: F3569205, from Miami (Florida) to Orlando (Florida), Departure Time: 07:49, Arrival Time: 08:58, cost: 42\nBreakfast: -,\nAttraction: SeaWorld Orlando, Orlando (Florida); The Wheel at ICON Park, Orlando (Florida);\nLunch: Fuji Japanese Steakhouse, Orlando (Florida), cost: 75, cuisines: \u201cTea, Bakery, Desserts\u201d\nDinner: Turquoise Villa, Orlando (Florida), cost: 55, cuisines: \u201cFrench, Bakery, BBQ, Fast Food\u201d\nAccommodation: Private furnished bedroom in Williamsburg, Orlando (Florida), cost: 179, room type: Private room, house rules: No parties & No smoking & No children under 10, minimum nights: 5, maximum occupancy: 1\n\nNumber of people = 1\nTotal cost = 42 + 75 + 55 + 179 = 351\nAccommodation minimum nights:  1/5\n\nDays: 4,\nCurrent City: Orlando (Florida),\nTransportation: -,\nBreakfast: The Tandoori Times, Orlando (Florida), cost: 84, cuisines: \u201cTea, Cafe, BBQ, Italian\u201d\nAttraction: Universal Orlando Resort, Orlando (Florida); Harry P Leu Gardens, Orlando (Florida);\nLunch: Crust N Cakes, Orlando (Florida), cost: 61, cuisines: \u201cTea, Cafe, Indian, BBQ\u201d\nDinner: Indochi Cafe & Restaurant, Orlando (Florida), cost: 72, cuisines: \u201cPizza, French, Bakery, Fast Food, Indian, Seafood\u201d\nAccommodation: Private furnished bedroom in Williamsburg, Orlando (Florida), cost: 179, room type: Private room, house rules: No parties & No smoking & No children under 10, minimum nights: 5, maximum occupancy: 1\n\nNumber of people = 1\nTotal cost = 84 + 61 + 72 + 179 = 396\nAccommodation minimum nights:  2/5\n\nDays: 5,\nCurrent City: from Orlando (Florida) to Birmingham,\nTransportation: Flight Number: F3987879, from Orlando (Florida) to Birmingham, Departure Time: 14:24, Arrival Time: 15:12, cost: 116\nBreakfast: Bite N Sip, Orlando (Florida), cost: 76, cuisines: \u201cChinese, Bakery, Cafe, Fast Food\u201d\nAttraction: -,\nLunch: -,\nDinner: -,\nAccommodation: -\n\nNumber of people = 1\nTotal cost = 116 + 76 = 192\n\nTotal cost across all days = 1,019 + 810 + 351 + 396 + 192 = 2,768\nCuisines: The prompt does not specify cuisines, so all cuisine constraints are satisfied.\nHouse rules: All accommodations chosen do not disallow solo travelers, and the house rules are respected.\n\nThe total cost of the trip is within the budget of $3,500.", "gpt-4-1106-preview_direct_sole-planning_parsed_results": [{"day": 1, "current_city": "from Birmingham to Miami (Florida)", "transportation": "Flight Number: F3592186, from Birmingham to Miami (Florida), Departure Time: 18:32, Arrival Time: 21:17", "breakfast": "-", "attraction": "-", "lunch": "-", "dinner": "Clocked, Miami (Florida)", "accommodation": "Simple and clean bedroom with good view and light, Miami (Florida)"}, {"day": 2, "current_city": "Miami (Florida)", "transportation": "-", "breakfast": "Papouli's Mediterranean Cafe & Market, Miami (Florida)", "attraction": "Jungle Island, Miami (Florida);P\u00e9rez Art Museum Miami, Miami (Florida);", "lunch": "Tako Cheena by Pom Pom, Miami (Florida)", "dinner": "AB's Absolute Barbecues, Miami (Florida)", "accommodation": "Simple and clean bedroom with good view and light, Miami (Florida)"}, {"day": 3, "current_city": "from Miami (Florida) to Orlando (Florida)", "transportation": "Flight Number: F3569205, from Miami (Florida) to Orlando (Florida), Departure Time: 07:49, Arrival Time: 08:58", "breakfast": "-", "attraction": "SeaWorld Orlando, Orlando (Florida);The Wheel at ICON Park, Orlando (Florida);", "lunch": "Fuji Japanese Steakhouse, Orlando (Florida)", "dinner": "Turquoise Villa, Orlando (Florida)", "accommodation": "Private furnished bedroom in Williamsburg, Orlando (Florida)"}, {"day": 4, "current_city": "Orlando (Florida)", "transportation": "-", "breakfast": "The Tandoori Times, Orlando (Florida)", "attraction": "Universal Orlando Resort, Orlando (Florida);Harry P Leu Gardens, Orlando (Florida);", "lunch": "Crust N Cakes, Orlando (Florida)", "dinner": "Indochi Cafe & Restaurant, Orlando (Florida)", "accommodation": "Private furnished bedroom in Williamsburg, Orlando (Florida)"}, {"day": 5, "current_city": "from Orlando (Florida) to Birmingham", "transportation": "Flight Number: F3987879, from Orlando (Florida) to Birmingham, Departure Time: 14:24, Arrival Time: 15:12", "breakfast": "Bite N Sip, Orlando (Florida)", "attraction": "-", "lunch": "-", "dinner": "-", "accommodation": "-"}]}]