[{"gpt-4-1106-preview_direct_sole-planning_results": "Travel Plan:\nDays: 1,\nCurrent City: from Milwaukee to New York,\nTransportation: Flight Number: F3643145, from Milwaukee to New York, Departure Time: 18:36, Arrival Time: 21:58, cost: 226\nBreakfast: -,\nAttraction: -,\nLunch: -,\nDinner: Seasons 52 Fresh Grill, New York, cost: 30, cuisines: \u201cSeafood, Indian, Desserts, Italian\u201d\nAccommodation: Beautiful and big 1BR sublet close by Central Park, New York, cost: 983, room type: Private room, house rules: No parties & No children under 10, minimum nights: 5, maximum occupancy: 2\n\nNumber of people = 2\nTotal cost = (226 + 30) * 2 + 983 = 1,495\nAccommodation minimum nights:  1/5\n\nDays: 2,\nCurrent City: New York,\nTransportation: -,\nBreakfast: Gurgaon Hights, New York, cost: 46, cuisines: \u201cCafe, American, Indian, Fast Food\u201d\nAttraction: Central Park, New York; Empire State Building, New York;,\nLunch: Lord of the Drinks Forum, New York, cost: 71, cuisines: \u201cCafe, Bakery, BBQ, Chinese, Indian\u201d\nDinner: Goosebumps, New York, cost: 94, cuisines: \u201cChinese, Pizza, Bakery\u201d\nAccommodation: Beautiful and big 1BR sublet close by Central Park, New York, cost: 983, room type: Private room, house rules: No parties & No children under 10, minimum nights: 5, maximum occupancy: 2\n\nNumber of people = 2\nTotal cost = (46 + 71 + 94) * 2 + 983 = 1,406\nAccommodation minimum nights:  2/5\n\nDays: 3,\nCurrent City: from New York to Milwaukee,\nTransportation: Flight Number: F3644990, from New York to Milwaukee, Departure Time: 15:20, Arrival Time: 16:27, cost: 218\nBreakfast: -,\nAttraction: -,\nLunch: -,\nDinner: -,\nAccommodation: -\n\nNumber of people = 2\nTotal cost = 218 * 2 = 436\n\nTotal cost across all days = 1,495 + 1,406 + 436 = 3,337\n\nNote: The total cost exceeds the budget of $1,900. To adjust the plan within the budget, we can consider changing the accommodation to a more affordable option or altering the transportation method. However, given the constraints and the provided data, it is not possible to create a plan that includes all required details and stays within the budget.", "gpt-4-1106-preview_direct_sole-planning_parsed_results": [{"day": 1, "current_city": "from Milwaukee to New York", "transportation": "Flight Number: F3643145, from Milwaukee to New York, Departure Time: 18:36, Arrival Time: 21:58", "breakfast": "-", "attraction": "-", "lunch": "-", "dinner": "Seasons 52 Fresh Grill, New York", "accommodation": "Beautiful and big 1BR sublet close by Central Park, New York"}, {"day": 2, "current_city": "New York", "transportation": "-", "breakfast": "Gurgaon Hights, New York", "attraction": "Central Park, New York;Empire State Building, New York;", "lunch": "Lord of the Drinks Forum, New York", "dinner": "Goosebumps, New York", "accommodation": "Beautiful and big 1BR sublet close by Central Park, New York"}, {"day": 3, "current_city": "from New York to Milwaukee", "transportation": "Flight Number: F3644990, from New York to Milwaukee, Departure Time: 15:20, Arrival Time: 16:27", "breakfast": "-", "attraction": "-", "lunch": "-", "dinner": "-", "accommodation": "-"}]}]