[{"gpt-4-1106-preview_direct_sole-planning_results": "Travel Plan:\n\nDays: 1,\nCurrent City: from Sun Valley to San Diego (California),\nTransportation: Taxi, from Sun Valley to San Diego, duration: 14 hours 9 mins, distance: 1,461 km, cost: 1461\nBreakfast: -,\nAttraction: -,\nLunch: -,\nDinner: Open Yard, San Diego (California), cost: 33, cuisines: \u201cChinese, Pizza, Cafe, Desserts\u201d\nAccommodation: Spacious Room in Large 2 Bedroom Prewar Apartment, San Diego (California), cost: 585, maximum occupancy: 2, house rules: No parties & No visitors, minimum nights: 1\n\nNumber of people = 1\nTotal cost = 1461 + 33 + 585 = 2,079\nAccommodation minimum nights:  1/1\n\nDays: 2,\nCurrent City: San Diego (California),\nTransportation: -,\nBreakfast: Burger King, San Diego (California), cost: 20, cuisines: \u201cPizza, Italian, French, Fast Food, Seafood\u201d\nAttraction: Balboa Park, San Diego (California); USS Midway Museum, San Diego (California);\nLunch: Gopala, San Diego (California), cost: 98, cuisines: \u201cPizza, Mexican, BBQ, American, Seafood\u201d\nDinner: Bikaner Sweets, San Diego (California), cost: 37, cuisines: \u201cBakery, Pizza, Indian, Fast Food\u201d\nAccommodation: Spacious Room in Large 2 Bedroom Prewar Apartment, San Diego (California), cost: 585, maximum occupancy: 2, house rules: No parties & No visitors, minimum nights: 1\n\nNumber of people = 1\nTotal cost = 20 + 98 + 37 + 585 = 740\nAccommodation minimum nights:  2/1\n\nDays: 3,\nCurrent City: from San Diego (California) to Redding (California),\nTransportation: Taxi, from San Diego to Redding, duration: 10 hours 10 mins, distance: 1,070 km, cost: 1070\nBreakfast: -,\nAttraction: Turtle Bay Exploration Park, Redding (California); Sundial Bridge, Redding (California);\nLunch: New Yorker Deli & Pizzeria, Redding (California), cost: 78, cuisines: \u201cPizza, Bakery, Desserts, Seafood\u201d\nDinner: Mosaic - Country Inn & Suites, Redding (California), cost: 57, cuisines: \u201cPizza, Bakery, BBQ, Fast Food, American, Mediterranean\u201d\nAccommodation: **Cozy Space - Private Access**, Redding (California), cost: 954, maximum occupancy: 1, house rules: No smoking & No children under 10, minimum nights: 2\n\nNumber of people = 1\nTotal cost = 1070 + 78 + 57 + 954 = 2,159\nAccommodation minimum nights:  1/2\n\nDays: 4,\nCurrent City: Redding (California),\nTransportation: -,\nBreakfast: Perfect Bake, Redding (California), cost: 69, cuisines: \u201cTea, Pizza, Fast Food\u201d\nAttraction: Fantasy Fountain, Redding (California); Caldwell Park, Redding (California);\nLunch: Weird Time Food, Redding (California), cost: 34, cuisines: \u201cBakery, BBQ, Italian\u201d\nDinner: The Kachori Co., Redding (California), cost: 65, cuisines: \u201cTea, Mediterranean, Desserts\u201d\nAccommodation: **Cozy Space - Private Access**, Redding (California), cost: 954, maximum occupancy: 1, house rules: No smoking & No children under 10, minimum nights: 2\n\nNumber of people = 1\nTotal cost = 69 + 34 + 65 + 954 = 1,122\nAccommodation minimum nights:  2/2 (Done!)\n\nDays: 5,\nCurrent City: from Redding to Sun Valley,\nTransportation: Taxi, from Redding to Sun Valley, duration: 11 hours 13 mins, distance: 1,087 km, cost: 1087\nBreakfast: -,\nAttraction: -,\nLunch: -,\nDinner: -,\nAccommodation: -\n\nNumber of people = 1\nTotal cost = 1087\n\nTotal cost across all days = 2,079 + 740 + 2,159 + 1,122 + 1087 = 7,187\n\nUnfortunately, the total cost of $7,187 exceeds the budget of $2,600. Adjustments must be made to the travel plan to fit within the budget. However, given the high costs of taxi transportation and accommodations, it is not feasible to create a 5-day travel plan with the current constraints and budget. Consider alternative transportation methods or reducing the number of cities visited to stay within budget.", "gpt-4-1106-preview_direct_sole-planning_parsed_results": [{"day": 1, "current_city": "from Sun Valley to San Diego", "transportation": "Taxi, from Sun Valley to San Diego, duration: 14 hours 9 mins, distance: 1,461 km", "breakfast": "-", "attraction": "-", "lunch": "-", "dinner": "Open Yard, San Diego", "accommodation": "Spacious Room in Large 2 Bedroom Prewar Apartment, San Diego"}, {"day": 2, "current_city": "San Diego", "transportation": "-", "breakfast": "Burger King, San Diego", "attraction": "Balboa Park, San Diego;USS Midway Museum, San Diego;", "lunch": "Gopala, San Diego", "dinner": "Bikaner Sweets, San Diego", "accommodation": "Spacious Room in Large 2 Bedroom Prewar Apartment, San Diego"}, {"day": 3, "current_city": "from San Diego to Redding", "transportation": "Taxi, from San Diego to Redding, duration: 10 hours 10 mins, distance: 1,070 km", "breakfast": "-", "attraction": "Turtle Bay Exploration Park, Redding;Sundial Bridge, Redding;", "lunch": "New Yorker Deli & Pizzeria, Redding", "dinner": "Mosaic - Country Inn & Suites, Redding", "accommodation": "Cozy Space - Private Access, Redding"}, {"day": 4, "current_city": "Redding", "transportation": "-", "breakfast": "Perfect Bake, Redding", "attraction": "Fantasy Fountain, Redding;Caldwell Park, Redding;", "lunch": "Weird Time Food, Redding", "dinner": "The Kachori Co., Redding", "accommodation": "Cozy Space - Private Access, Redding"}, {"day": 5, "current_city": "from Redding to Sun Valley", "transportation": "Taxi, from Redding to Sun Valley, duration: 11 hours 13 mins, distance: 1,087 km", "breakfast": "-", "attraction": "-", "lunch": "-", "dinner": "-", "accommodation": "-"}]}]