[{"gpt-4-1106-preview_direct_sole-planning_results": "Travel Plan:\n\nDays: 1,\nCurrent City: from Daytona Beach to Atlanta,\nTransportation: Taxi, from Daytona Beach to Atlanta, duration: 6 hours 18 mins, distance: 696 km, cost: 696\nBreakfast: -,\nAttraction: -,\nLunch: -,\nDinner: Saffron, Atlanta, cost: 39, cuisines: \u201cTea, Cafe, Fast Food, Seafood\u201d\nAccommodation: Bright, Modern, Clean, Spacious, Brooklyn Home, Atlanta, cost: 1034, room type: Entire home/apt, house rules: No children under 10, minimum nights: 3, maximum occupancy: 4\n\nNumber of people = 3\nTotal cost = 696 * 3 + 39 * 3 + 1034 = 3,183\nAccommodation minimum nights: 1/3\n\nDays: 2,\nCurrent City: Atlanta,\nTransportation: -,\nBreakfast: Adda, Atlanta, cost: 22, cuisines: \u201cTea, Mexican, Bakery\u201d\nAttraction: Georgia Aquarium, Atlanta; Centennial Olympic Park, Atlanta,\nLunch: Chef Style, Atlanta, cost: 59, cuisines: \u201cPizza, American, Desserts, Seafood\u201d\nDinner: Pizza Central, Atlanta, cost: 75, cuisines: \u201cCafe, Bakery, BBQ, Fast Food, Chinese, Indian\u201d\nAccommodation: Bright, Modern, Clean, Spacious, Brooklyn Home, Atlanta, cost: 1034, room type: Entire home/apt, house rules: No children under 10, minimum nights: 3, maximum occupancy: 4\n\nNumber of people = 3\nTotal cost = (22 + 59 + 75) * 3 + 1034 = 1,593\nAccommodation minimum nights: 2/3\n\nDays: 3,\nCurrent City: from Atlanta to Daytona Beach,\nTransportation: Taxi, from Atlanta to Daytona Beach, duration: 6 hours 20 mins, distance: 706 km, cost: 706\nBreakfast: The Krib, Atlanta, cost: 45, cuisines: \u201cSeafood, BBQ, Italian\u201d\nAttraction: -,\nLunch: -,\nDinner: -,\nAccommodation: -\n\nNumber of people = 3\nTotal cost = 706 * 3 + 45 * 3 = 2,253\n\nTotal cost across all days = 3,183 + 1,593 + 2,253 = 7,029\n\nUnfortunately, the total cost exceeds the budget of $2,100, and the accommodation chosen does not allow children under 10, which violates the query constraints. Additionally, the accommodation requires a minimum of 3 nights, which cannot be fulfilled within a 3-day travel plan. Let's revise the plan to meet the constraints.\n\nRevised Travel Plan:\n\nDays: 1,\nCurrent City: from Daytona Beach to Atlanta,\nTransportation: Self-driving, from Daytona Beach to Atlanta, duration: 6 hours 18 mins, distance: 696 km, cost: 34\nBreakfast: -,\nAttraction: -,\nLunch: -,\nDinner: Saffron, Atlanta, cost: 39, cuisines: \u201cTea, Cafe, Fast Food, Seafood\u201d\nAccommodation: Charming Carroll Gardens 2 BR, Atlanta, cost: 576, room type: Entire home/apt, house rules: No parties, minimum nights: 1, maximum occupancy: 4\n\nNumber of people = 3\nTotal cost = 34 * 3 + 39 * 3 + 576 = 807\n\nDays: 2,\nCurrent City: Atlanta,\nTransportation: -,\nBreakfast: Adda, Atlanta, cost: 22, cuisines: \u201cTea, Mexican, Bakery\u201d\nAttraction: Georgia Aquarium, Atlanta; Centennial Olympic Park, Atlanta,\nLunch: Chef Style, Atlanta, cost: 59, cuisines: \u201cPizza, American, Desserts, Seafood\u201d\nDinner: Pizza Central, Atlanta, cost: 75, cuisines: \u201cCafe, Bakery, BBQ, Fast Food, Chinese, Indian\u201d\nAccommodation: Charming Carroll Gardens 2 BR, Atlanta, cost: 576, room type: Entire home/apt, house rules: No parties, minimum nights: 1, maximum occupancy: 4\n\nNumber of people = 3\nTotal cost = (22 + 59 + 75) * 3 + 576 = 1,035\n\nDays: 3,\nCurrent City: from Atlanta to Daytona Beach,\nTransportation: Self-driving, from Atlanta to Daytona Beach, duration: 6 hours 20 mins, distance: 706 km, cost: 35\nBreakfast: The Krib, Atlanta, cost: 45, cuisines: \u201cSeafood, BBQ, Italian\u201d\nAttraction: -,\nLunch: -,\nDinner: -,\nAccommodation: -\n\nNumber of people = 3\nTotal cost = 35 * 3 + 45 * 3 = 240\n\nTotal cost across all days = 807 + 1,035 + 240 = 2,082\n\nThe revised travel plan meets the budget constraint of $2,100 and the accommodation requirements, including allowing children under 10 and providing entire rooms.", "gpt-4-1106-preview_direct_sole-planning_parsed_results": [{"day": 1, "current_city": "from Daytona Beach to Atlanta", "transportation": "Self-driving, from Daytona Beach to Atlanta, duration: 6 hours 18 mins, distance: 696 km", "breakfast": "-", "attraction": "-", "lunch": "-", "dinner": "Saffron, Atlanta", "accommodation": "Charming Carroll Gardens 2 BR, Atlanta"}, {"day": 2, "current_city": "Atlanta", "transportation": "-", "breakfast": "Adda, Atlanta", "attraction": "Georgia Aquarium, Atlanta;Centennial Olympic Park, Atlanta;", "lunch": "Chef Style, Atlanta", "dinner": "Pizza Central, Atlanta", "accommodation": "Charming Carroll Gardens 2 BR, Atlanta"}, {"day": 3, "current_city": "from Atlanta to Daytona Beach", "transportation": "Self-driving, from Atlanta to Daytona Beach, duration: 6 hours 20 mins, distance: 706 km", "breakfast": "The Krib, Atlanta", "attraction": "-", "lunch": "-", "dinner": "-", "accommodation": "-"}]}]