[{"gpt-4-1106-preview_direct_sole-planning_results": "Travel Plan:\n\nDays: 1,\nCurrent City: from Jacksonville to Detroit (Michigan),\nTransportation: Flight Number: F3553781, from Jacksonville to Detroit (Michigan), Departure Time: 12:10, Arrival Time: 14:15, cost: 178\nBreakfast: -,\nAttraction: -,\nLunch: -,\nDinner: Southern Bliss Bakery, Detroit (Michigan), cost: 28, cuisines: \u201cTea, BBQ, Desserts, Seafood\u201d\nAccommodation: Cozy 1 bedroom in the heart of Fort Greene, Detroit (Michigan), cost: 751, room type: Entire home/apt, house rules: No pets & No parties, minimum nights: 3, maximum occupancy: 6\n\nNumber of people = 1\nTotal cost = 178 + 28 + 751 = 957\nAccommodation minimum nights:  1/3\n\nDays: 2,\nCurrent City: Detroit (Michigan),\nTransportation: -,\nBreakfast: Cafe And More, Detroit (Michigan), cost: 41, cuisines: \u201cTea, Bakery, Italian\u201d\nAttraction: Detroit Institute of Arts, Detroit (Michigan); Detroit Historical Museum, Detroit (Michigan);\nLunch: A Dong Restaurant, Detroit (Michigan), cost: 40, cuisines: \u201cTea, Cafe, Pizza\u201d\nDinner: Mitalis Kitchen, Detroit (Michigan), cost: 28, cuisines: \u201cPizza, BBQ, Chinese, Mediterranean, Seafood\u201d\nAccommodation: Cozy 1 bedroom in the heart of Fort Greene, Detroit (Michigan), cost: 751, room type: Entire home/apt, house rules: No pets & No parties, minimum nights: 3, maximum occupancy: 6\n\nNumber of people = 1\nTotal cost = 41 + 40 + 28 + 751 = 860\nAccommodation minimum nights:  2/3\n\nDays: 3,\nCurrent City: from Detroit (Michigan) to Lansing (Michigan),\nTransportation: Taxi, from Detroit (Michigan) to Lansing (Michigan), duration: 1 hour 24 mins, distance: 146 km, cost: 146\nBreakfast: -,\nAttraction: Michigan History Center, Lansing (Michigan); Potter Park Zoo, Lansing (Michigan);\nLunch: Manuel's Bread Cafe, Lansing (Michigan), cost: 28, cuisines: \u201cFrench, Pizza, Seafood\u201d\nDinner: Golden China, Lansing (Michigan), cost: 66, cuisines: \u201cChinese, Indian, Cafe, BBQ\u201d\nAccommodation: 2 bedroom apartment in harlem, Lansing (Michigan), cost: 943, room type: Entire home/apt, house rules: No parties & No pets, minimum nights: 1, maximum occupancy: 7\n\nNumber of people = 1\nTotal cost = 146 + 28 + 66 + 943 = 1183\nAccommodation minimum nights:  1/1\n\nDays: 4,\nCurrent City: Lansing (Michigan),\nTransportation: -,\nBreakfast: Tony's Italian Restaurant & Pizza, Lansing (Michigan), cost: 83, cuisines: \u201cTea, Pizza, Indian, BBQ, American\u201d\nAttraction: Eli and Edythe Broad Art Museum, Lansing (Michigan); Hawk Island Park, Lansing (Michigan);\nLunch: Front Street Brewery, Lansing (Michigan), cost: 25, cuisines: \u201cBBQ, Mediterranean, Desserts, Italian\u201d\nDinner: Huey's On The River, Lansing (Michigan), cost: 75, cuisines: \u201cTea, French, Bakery, Fast Food, Cafe\u201d\nAccommodation: 2 bedroom apartment in harlem, Lansing (Michigan), cost: 943, room type: Entire home/apt, house rules: No parties & No pets, minimum nights: 1, maximum occupancy: 7\n\nNumber of people = 1\nTotal cost = 83 + 25 + 75 + 943 = 1126\nAccommodation minimum nights:  2/1\n\nDays: 5,\nCurrent City: from Lansing (Michigan) to Jacksonville,\nTransportation: Taxi, from Lansing (Michigan) to Jacksonville, duration: 15 hours 55 mins, distance: 1,704 km, cost: 1704\nBreakfast: -,\nAttraction: -,\nLunch: -,\nDinner: -,\nAccommodation: -\n\nNumber of people = 1\nTotal cost = 1704\n\nTotal cost across all days = 957 + 860 + 1183 + 1126 + 1704 = 5830\n\nUnfortunately, the total cost of the travel plan ($5,830) exceeds the specified budget of $4,600. To adjust the plan to fit within the budget, we can consider changing the accommodation to a less expensive option or altering the transportation method. However, given the constraints and available data, it may not be possible to create a plan that includes all required details and stays within the budget.", "gpt-4-1106-preview_direct_sole-planning_parsed_results": [{"day": 1, "current_city": "from Jacksonville to Detroit (Michigan)", "transportation": "Flight Number: F3553781, from Jacksonville to Detroit (Michigan), Departure Time: 12:10, Arrival Time: 14:15", "breakfast": "-", "attraction": "-", "lunch": "-", "dinner": "Southern Bliss Bakery, Detroit (Michigan)", "accommodation": "Cozy 1 bedroom in the heart of Fort Greene, Detroit (Michigan)"}, {"day": 2, "current_city": "Detroit (Michigan)", "transportation": "-", "breakfast": "Cafe And More, Detroit (Michigan)", "attraction": "Detroit Institute of Arts, Detroit (Michigan);Detroit Historical Museum, Detroit (Michigan);", "lunch": "A Dong Restaurant, Detroit (Michigan)", "dinner": "Mitalis Kitchen, Detroit (Michigan)", "accommodation": "Cozy 1 bedroom in the heart of Fort Greene, Detroit (Michigan)"}, {"day": 3, "current_city": "from Detroit (Michigan) to Lansing (Michigan)", "transportation": "Taxi, from Detroit (Michigan) to Lansing (Michigan), duration: 1 hour 24 mins, distance: 146 km", "breakfast": "-", "attraction": "Michigan History Center, Lansing (Michigan);Potter Park Zoo, Lansing (Michigan);", "lunch": "Manuel's Bread Cafe, Lansing (Michigan)", "dinner": "Golden China, Lansing (Michigan)", "accommodation": "2 bedroom apartment in harlem, Lansing (Michigan)"}, {"day": 4, "current_city": "Lansing (Michigan)", "transportation": "-", "breakfast": "Tony's Italian Restaurant & Pizza, Lansing (Michigan)", "attraction": "Eli and Edythe Broad Art Museum, Lansing (Michigan);Hawk Island Park, Lansing (Michigan);", "lunch": "Front Street Brewery, Lansing (Michigan)", "dinner": "Huey's On The River, Lansing (Michigan)", "accommodation": "2 bedroom apartment in harlem, Lansing (Michigan)"}, {"day": 5, "current_city": "from Lansing (Michigan) to Jacksonville", "transportation": "Taxi, from Lansing (Michigan) to Jacksonville, duration: 15 hours 55 mins, distance: 1,704 km", "breakfast": "-", "attraction": "-", "lunch": "-", "dinner": "-", "accommodation": "-"}]}]