[{"gpt-4-1106-preview_direct_sole-planning_results": "Travel Plan:\n\nDays: 1,\nCurrent City: from Chicago to Boise (Idaho),\nTransportation: Flight Number: F3857813, from Chicago to Boise (Idaho), Departure Time: 09:48, Arrival Time: 12:51, cost: 311\nBreakfast: -,\nAttraction: -,\nLunch: -,\nDinner: Gopala Hari, Boise (Idaho), cost: 28, cuisines: \u201cTea, Pizza, Italian, Fast Food, Mediterranean, Seafood\u201d\nAccommodation: Modern & Cozy 2 BR Private Apartment in Brooklyn, Boise (Idaho), cost: 843, maximum occupancy: 7, house rules: No children under 10, minimum nights: 2645\n\nNumber of people = 8\nTotal cost = 311 * 8 + 28 * 8 + 843 = 4,011\nAccommodation minimum nights:  1/2645\n\nDays: 2,\nCurrent City: Boise (Idaho),\nTransportation: -,\nBreakfast: Domino's Pizza, Boise (Idaho), cost: 25, cuisines: \u201cPizza, Italian, BBQ, Fast Food, Mediterranean\u201d\nAttraction: Zoo Boise, Boise (Idaho); Idaho State Museum, Boise (Idaho);,\nLunch: California Pizza Kitchen, Boise (Idaho), cost: 15, cuisines: \u201cTea, BBQ, Fast Food, Chinese, Indian\u201d\nDinner: Dhaba By Claridges, Boise (Idaho), cost: 65, cuisines: \u201cDesserts, Italian, Fast Food, Chinese, Seafood\u201d\nAccommodation: Modern & Cozy 2 BR Private Apartment in Brooklyn, Boise (Idaho), cost: 843, maximum occupancy: 7, house rules: No children under 10, minimum nights: 2645\n\nNumber of people = 8\nTotal cost = (25 + 15 + 65) * 8 + 843 = 2,071\nAccommodation minimum nights:  2/2645\n\nDays: 3,\nCurrent City: from Boise (Idaho) to Pocatello (Idaho),\nTransportation: Self-driving, from Boise to Pocatello, duration: 3 hours 25 mins, distance: 378 km, cost: 18\nBreakfast: -,\nAttraction: -,\nLunch: -,\nDinner: Deorio's, Pocatello (Idaho), cost: 59, cuisines: \u201cTea, Bakery, Fast Food, Mediterranean, Seafood\u201d\nAccommodation: Entire Modern Studio Apartment/Prime Location, Pocatello (Idaho), cost: 1109, maximum occupancy: 5, house rules: No parties & No smoking, minimum nights: 30\n\nNumber of people = 8\nTotal cost = 18 * 8 + 59 * 8 + 1109 * 2 = 2,725\nAccommodation minimum nights:  1/30\n\nDays: 4,\nCurrent City: Pocatello (Idaho),\nTransportation: -,\nBreakfast: Joost Juice Bar, Pocatello (Idaho), cost: 51, cuisines: \u201cTea, Cafe, Pizza, Italian, Fast Food, Chinese\u201d\nAttraction: Idaho Museum of Natural History, Pocatello (Idaho); Museum of Clean, Pocatello (Idaho);,\nLunch: 650 - The Global Kitchen, Pocatello (Idaho), cost: 83, cuisines: \u201cFrench, Bakery, Cafe\u201d\nDinner: Harvest Moon, Pocatello (Idaho), cost: 90, cuisines: \u201cPizza, Fast Food\u201d\nAccommodation: Entire Modern Studio Apartment/Prime Location, Pocatello (Idaho), cost: 1109, maximum occupancy: 5, house rules: No parties & No smoking, minimum nights: 30\n\nNumber of people = 8\nTotal cost = (51 + 83 + 90) * 8 + 1109 * 2 = 3,365\nAccommodation minimum nights:  2/30\n\nDays: 5,\nCurrent City: from Pocatello (Idaho) to Idaho Falls (Idaho),\nTransportation: Self-driving, from Pocatello to Idaho Falls, duration: 51 mins, distance: 83.6 km, cost: 4\nBreakfast: -,\nAttraction: -,\nLunch: -,\nDinner: Karim's, Idaho Falls (Idaho), cost: 58, cuisines: \u201cTea, Pizza, BBQ, Cafe, Indian\u201d\nAccommodation: Sunny & Spacious 2 bdrm apt, Idaho Falls (Idaho), cost: 914, maximum occupancy: 9, house rules: No smoking, minimum nights: 4\n\nNumber of people = 8\nTotal cost = 4 * 8 + 58 * 8 + 914 = 1,598\nAccommodation minimum nights:  1/4\n\nDays: 6,\nCurrent City: Idaho Falls (Idaho),\nTransportation: -,\nBreakfast: Shiv Restaurant, Idaho Falls (Idaho), cost: 42, cuisines: \u201cBakery, Mexican, Pizza, Desserts\u201d\nAttraction: Museum of Idaho, Idaho Falls (Idaho); The Art Museum Of Eastern Idaho, Idaho Falls (Idaho);,\nLunch: Taste of China, Idaho Falls (Idaho), cost: 19, cuisines: \u201cFrench, Bakery, Fast Food, Indian, Seafood\u201d\nDinner: Dhuaan, Idaho Falls (Idaho), cost: 97, cuisines: \u201cTea, Pizza, Mexican, BBQ, Fast Food, American\u201d\nAccommodation: Sunny & Spacious 2 bdrm apt, Idaho Falls (Idaho), cost: 914, maximum occupancy: 9, house rules: No smoking, minimum nights: 4\n\nNumber of people = 8\nTotal cost = (42 + 19 + 97) * 8 + 914 = 2,366\nAccommodation minimum nights:  2/4\n\nDays: 7,\nCurrent City: from Idaho Falls (Idaho) to Chicago,\nTransportation: Self-driving, from Idaho Falls to Chicago, duration: 21 hours 43 mins, distance: 2,369 km, cost: 118\nBreakfast: -,\nAttraction: -,\nLunch: -,\nDinner: -,\nAccommodation: -\n\nNumber of people = 8\nTotal cost = 118 * 8 = 944\n\nTotal cost across all days = 4,011 + 2,071 + 2,725 + 3,365 + 1,598 + 2,366 + 944 = 17,080\nCuisines: The prompt specifies Italian and Chinese, and both of these cuisines have been represented in the restaurants chosen.\n\nPlease note that the accommodation in Boise has a minimum stay of 2645 nights, which is not feasible for this travel plan. However, due to the lack of alternative accommodation information provided, I have included it in the plan. Adjustments would need to be made with actual booking options. Additionally, the self-driving costs are calculated based on the assumption that the group will rent vehicles for the intercity travel within Idaho.", "gpt-4-1106-preview_direct_sole-planning_parsed_results": [{"day": 1, "current_city": "from Chicago to Boise", "transportation": "Flight Number: F3857813, from Chicago to Boise, Departure Time: 09:48, Arrival Time: 12:51", "breakfast": "-", "attraction": "-", "lunch": "-", "dinner": "Gopala Hari, Boise", "accommodation": "Modern & Cozy 2 BR Private Apartment in Brooklyn, Boise"}, {"day": 2, "current_city": "Boise", "transportation": "-", "breakfast": "Domino's Pizza, Boise", "attraction": "Zoo Boise, Boise;Idaho State Museum, Boise;", "lunch": "California Pizza Kitchen, Boise", "dinner": "Dhaba By Claridges, Boise", "accommodation": "Modern & Cozy 2 BR Private Apartment in Brooklyn, Boise"}, {"day": 3, "current_city": "from Boise to Pocatello", "transportation": "Self-driving, from Boise to Pocatello, duration: 3 hours 25 mins, distance: 378 km", "breakfast": "-", "attraction": "-", "lunch": "-", "dinner": "Deorio's, Pocatello", "accommodation": "Entire Modern Studio Apartment/Prime Location, Pocatello"}, {"day": 4, "current_city": "Pocatello", "transportation": "-", "breakfast": "Joost Juice Bar, Pocatello", "attraction": "Idaho Museum of Natural History, Pocatello;Museum of Clean, Pocatello;", "lunch": "650 - The Global Kitchen, Pocatello", "dinner": "Harvest Moon, Pocatello", "accommodation": "Entire Modern Studio Apartment/Prime Location, Pocatello"}, {"day": 5, "current_city": "from Pocatello to Idaho Falls", "transportation": "Self-driving, from Pocatello to Idaho Falls, duration: 51 mins, distance: 83.6 km", "breakfast": "-", "attraction": "-", "lunch": "-", "dinner": "Karim's, Idaho Falls", "accommodation": "Sunny & Spacious 2 bdrm apt, Idaho Falls"}, {"day": 6, "current_city": "Idaho Falls", "transportation": "-", "breakfast": "Shiv Restaurant, Idaho Falls", "attraction": "Museum of Idaho, Idaho Falls;The Art Museum Of Eastern Idaho, Idaho Falls;", "lunch": "Taste of China, Idaho Falls", "dinner": "Dhuaan, Idaho Falls", "accommodation": "Sunny & Spacious 2 bdrm apt, Idaho Falls"}, {"day": 7, "current_city": "from Idaho Falls to Chicago", "transportation": "Self-driving, from Idaho Falls to Chicago, duration: 21 hours 43 mins, distance: 2369 km", "breakfast": "-", "attraction": "-", "lunch": "-", "dinner": "-", "accommodation": "-"}]}]