[{"gpt-4-1106-preview_direct_sole-planning_results": "Travel Plan:\nDays: 1,\nCurrent City: from St. Petersburg to Appleton,\nTransportation: Flight Number: F3574992, from St. Petersburg to Appleton, Departure Time: 22:51, Arrival Time: 00:42, cost: 542\nBreakfast: -,\nAttraction: -,\nLunch: -,\nDinner: -,\nAccommodation: Cozy room + bright apartment + rooftop lounge, Appleton, cost: 666, maximum occupancy: 1, house rules: No smoking, minimum nights: 1\n\nNumber of people = 1\nTotal cost = 542 + 666 = 1,208\nAccommodation minimum nights:  1/1\n\nDays: 2,\nCurrent City: Appleton,\nTransportation: -,\nBreakfast: Mikata Japanese Steakhouse, Appleton, cost: 72, cuisines: \u201cCafe, Pizza, Bakery, Italian\u201d\nAttraction: The History Museum at the Castle, Appleton; Hearthstone Historic House Museum, Appleton;,\nLunch: Swati Snacks, Appleton, cost: 84, cuisines: \u201cDesserts, Bakery, BBQ, Fast Food, American\u201d\nDinner: Brick 29, Appleton, cost: 97, cuisines: \u201cDesserts, Tea, BBQ, Cafe, American, Mediterranean\u201d\nAccommodation: Cozy room + bright apartment + rooftop lounge, Appleton, cost: 666, maximum occupancy: 1, house rules: No smoking, minimum nights: 1\n\nNumber of people = 1\nTotal cost = 72 + 84 + 97 + 666 = 919\nAccommodation minimum nights:  2/1\n\nDays: 3,\nCurrent City: from Appleton to St. Petersburg,\nTransportation: Flight Number: F3578689, from Appleton to St. Petersburg, Departure Time: 07:19, Arrival Time: 11:01, cost: 332\nBreakfast: -,\nAttraction: -,\nLunch: -,\nDinner: -,\nAccommodation: -\n\nNumber of people = 1\nTotal cost = 332\n\nTotal cost across all days = 1,208 + 919 + 332 = 2,459\n\nNote: The total cost exceeds the budget of $1,200. Adjustments are needed to meet the budget constraint. Possible adjustments include changing the accommodation to a less expensive option or removing some meals or attractions.\n\nRevised Travel Plan with Budget Consideration:\nDays: 1,\nCurrent City: from St. Petersburg to Appleton,\nTransportation: Flight Number: F3574992, from St. Petersburg to Appleton, Departure Time: 22:51, Arrival Time: 00:42, cost: 542\nBreakfast: -,\nAttraction: -,\nLunch: -,\nDinner: -,\nAccommodation: Stylish, convenient, renovated- 2 min to subway -, Appleton, cost: 64, maximum occupancy: 2, house rules: No smoking & No pets & No children under 10, minimum nights: 1\n\nNumber of people = 1\nTotal cost = 542 + 64 = 606\nAccommodation minimum nights:  1/1\n\nDays: 2,\nCurrent City: Appleton,\nTransportation: -,\nBreakfast: The Kathis, Appleton, cost: 15, cuisines: \u201cDesserts, Pizza, Mexican, Bakery, Seafood\u201d\nAttraction: The History Museum at the Castle, Appleton; Hearthstone Historic House Museum, Appleton;,\nLunch: Destination Live, Appleton, cost: 30, cuisines: \u201cTea, Indian, BBQ\u201d\nDinner: Fat Lulu's, Appleton, cost: 23, cuisines: \u201cTea, Cafe, Seafood, Fast Food\u201d\nAccommodation: Stylish, convenient, renovated- 2 min to subway -, Appleton, cost: 64, maximum occupancy: 2, house rules: No smoking & No pets & No children under 10, minimum nights: 1\n\nNumber of people = 1\nTotal cost = 15 + 30 + 23 + 64 = 132\nAccommodation minimum nights:  2/1\n\nDays: 3,\nCurrent City: from Appleton to St. Petersburg,\nTransportation: Flight Number: F3578689, from Appleton to St. Petersburg, Departure Time: 07:19, Arrival Time: 11:01, cost: 332\nBreakfast: -,\nAttraction: -,\nLunch: -,\nDinner: -,\nAccommodation: -\n\nNumber of people = 1\nTotal cost = 332\n\nTotal revised cost across all days = 606 + 132 + 332 = 1,070\n\nThe revised travel plan meets the budget constraint of $1,200.", "gpt-4-1106-preview_direct_sole-planning_parsed_results": [{"day": 1, "current_city": "from St. Petersburg to Appleton", "transportation": "Flight Number: F3574992, from St. Petersburg to Appleton, Departure Time: 22:51, Arrival Time: 00:42", "breakfast": "-", "attraction": "-", "lunch": "-", "dinner": "-", "accommodation": "Stylish, convenient, renovated- 2 min to subway, Appleton"}, {"day": 2, "current_city": "Appleton", "transportation": "-", "breakfast": "The Kathis, Appleton", "attraction": "The History Museum at the Castle, Appleton;Hearthstone Historic House Museum, Appleton;", "lunch": "Destination Live, Appleton", "dinner": "Fat Lulu's, Appleton", "accommodation": "Stylish, convenient, renovated- 2 min to subway, Appleton"}, {"day": 3, "current_city": "from Appleton to St. Petersburg", "transportation": "Flight Number: F3578689, from Appleton to St. Petersburg, Departure Time: 07:19, Arrival Time: 11:01", "breakfast": "-", "attraction": "-", "lunch": "-", "dinner": "-", "accommodation": "-"}]}]