[{"gpt-4-1106-preview_direct_sole-planning_results": "Travel Plan:\n\nDays: 1,\nCurrent City: from Dallas to Huntsville,\nTransportation: Flight Number: F3601769, from Dallas to Huntsville, Departure Time: 17:14, Arrival Time: 18:57, cost: 129\nBreakfast: -,\nAttraction: -,\nLunch: -,\nDinner: El Vaquero Mexican Restaurant, Huntsville, cost: 82, cuisines: \u201cDesserts, Seafood\u201d\nAccommodation: Brooklyn Charmer, Close to Everything NYC!, Huntsville, cost: 568, room type: Entire home/apt, maximum occupancy: 5, house rules: No children under 10 & No parties, minimum nights: 2\n\nNumber of people = 4\nTotal cost = 129 * 4 + 82 * 4 + 568 = 1,204\nAccommodation minimum nights:  1/2\n\nDays: 2,\nCurrent City: Huntsville,\nTransportation: -,\nBreakfast: Cherry Comet, Huntsville, cost: 16, cuisines: \u201cDesserts, Tea, Pizza, Cafe, Mediterranean\u201d\nAttraction: U.S. Space & Rocket Center, Huntsville; Huntsville Botanical Garden, Huntsville;,\nLunch: Moksh The Restro Lounge, Huntsville, cost: 77, cuisines: \u201cPizza, American, BBQ, Fast Food, Indian\u201d\nDinner: Downtown Grill, Huntsville, cost: 74, cuisines: \u201cPizza, Bakery\u201d\nAccommodation: Brooklyn Charmer, Close to Everything NYC!, Huntsville, cost: 568, room type: Entire home/apt, maximum occupancy: 5, house rules: No children under 10 & No parties, minimum nights: 2\n\nNumber of people = 4\nTotal cost = (16 + 77 + 74) * 4 + 568 = 1,300\nAccommodation minimum nights:  2/2 (Done!)\n\nDays: 3,\nCurrent City: from Huntsville to Dallas,\nTransportation: Flight Number: F3593796, from Huntsville to Dallas, Departure Time: 05:24, Arrival Time: 07:19, cost: 147\nBreakfast: -,\nAttraction: -,\nLunch: -,\nDinner: -,\nAccommodation: -\n\nNumber of people = 4\nTotal cost = 147 * 4 = 588\n\nTotal cost across all days = 1,204 + 1,300 + 588 = 3,092\n\nUnfortunately, the total cost exceeds the budget of $2,700. To adjust the plan within the budget, we can change the flight to a self-driving option:\n\nAdjusted Travel Plan:\n\nDays: 1,\nCurrent City: from Dallas to Huntsville,\nTransportation: Self-driving, from Dallas to Huntsville, duration: 10 hours 10 mins, distance: 1,071 km, cost: 53\nBreakfast: -,\nAttraction: -,\nLunch: -,\nDinner: El Vaquero Mexican Restaurant, Huntsville, cost: 82, cuisines: \u201cDesserts, Seafood\u201d\nAccommodation: Brooklyn Charmer, Close to Everything NYC!, Huntsville, cost: 568, room type: Entire home/apt, maximum occupancy: 5, house rules: No children under 10 & No parties, minimum nights: 2\n\nNumber of people = 4\nTotal cost = 53 * 4 + 82 * 4 + 568 = 1,028\nAccommodation minimum nights:  1/2\n\nDays: 2,\nCurrent City: Huntsville,\nTransportation: -,\nBreakfast: Cherry Comet, Huntsville, cost: 16, cuisines: \u201cDesserts, Tea, Pizza, Cafe, Mediterranean\u201d\nAttraction: U.S. Space & Rocket Center, Huntsville; Huntsville Botanical Garden, Huntsville;,\nLunch: Moksh The Restro Lounge, Huntsville, cost: 77, cuisines: \u201cPizza, American, BBQ, Fast Food, Indian\u201d\nDinner: Downtown Grill, Huntsville, cost: 74, cuisines: \u201cPizza, Bakery\u201d\nAccommodation: Brooklyn Charmer, Close to Everything NYC!, Huntsville, cost: 568, room type: Entire home/apt, maximum occupancy: 5, house rules: No children under 10 & No parties, minimum nights: 2\n\nNumber of people = 4\nTotal cost = (16 + 77 + 74) * 4 + 568 = 1,300\nAccommodation minimum nights:  2/2 (Done!)\n\nDays: 3,\nCurrent City: from Huntsville to Dallas,\nTransportation: Self-driving, from Huntsville to Dallas, duration: 10 hours 13 mins, distance: 1,072 km, cost: 53\nBreakfast: -,\nAttraction: -,\nLunch: -,\nDinner: -,\nAccommodation: -\n\nNumber of people = 4\nTotal cost = 53 * 4 = 212\n\nTotal cost across all days = 1,028 + 1,300 + 212 = 2,540\n\nWith the adjusted transportation, the total cost is now within the budget of $2,700.", "gpt-4-1106-preview_direct_sole-planning_parsed_results": [{"day": 1, "current_city": "from Dallas to Huntsville", "transportation": "Self-driving, from Dallas to Huntsville, duration: 10 hours 10 mins, distance: 1,071 km", "breakfast": "-", "attraction": "-", "lunch": "-", "dinner": "El Vaquero Mexican Restaurant, Huntsville", "accommodation": "Brooklyn Charmer, Close to Everything NYC!, Huntsville"}, {"day": 2, "current_city": "Huntsville", "transportation": "-", "breakfast": "Cherry Comet, Huntsville", "attraction": "U.S. Space & Rocket Center, Huntsville;Huntsville Botanical Garden, Huntsville;", "lunch": "Moksh The Restro Lounge, Huntsville", "dinner": "Downtown Grill, Huntsville", "accommodation": "Brooklyn Charmer, Close to Everything NYC!, Huntsville"}, {"day": 3, "current_city": "from Huntsville to Dallas", "transportation": "Self-driving, from Huntsville to Dallas, duration: 10 hours 13 mins, distance: 1,072 km", "breakfast": "-", "attraction": "-", "lunch": "-", "dinner": "-", "accommodation": "-"}]}]