[{"gpt-4-1106-preview_direct_sole-planning_results": "Travel Plan:\n\nDays: 1,\nCurrent City: from Louisville to Fort Myers (Florida),\nTransportation: Flight Number: F3615988, from Louisville to Fort Myers (Florida), Departure Time: 18:19, Arrival Time: 20:34, cost: 398\nBreakfast: -,\nAttraction: -,\nLunch: -,\nDinner: The Refinery, Fort Myers (Florida), cost: 22, cuisines: \u201cBakery, Indian, Seafood\u201d\nAccommodation: Quiet and beautiful apartment near central park, Fort Myers (Florida), cost: 930, room type: Entire home/apt, house rules: No parties & No smoking, minimum nights: 7, maximum occupancy: 9\n\nNumber of people = 1\nTotal cost = 398 + 22 + 930 = 1,350\nAccommodation minimum nights:  1/7\n\nDays: 2,\nCurrent City: Fort Myers (Florida),\nTransportation: -,\nBreakfast: Al Mukhtar Bakery, Fort Myers (Florida), cost: 54, cuisines: \u201cBBQ, Tea, American, Desserts\u201d\nAttraction: Edison & Ford Winter Estates, Fort Myers (Florida); Six Mile Cypress Slough Preserve, Fort Myers (Florida);\nLunch: Haunted, Fort Myers (Florida), cost: 50, cuisines: \u201cDesserts, French, Fast Food, Cafe, Seafood\u201d\nDinner: Eggers Madhouse, Fort Myers (Florida), cost: 76, cuisines: \u201cBBQ, Mediterranean, Seafood\u201d\nAccommodation: Quiet and beautiful apartment near central park, Fort Myers (Florida), cost: 930, room type: Entire home/apt, house rules: No parties & No smoking, minimum nights: 7, maximum occupancy: 9\n\nNumber of people = 1\nTotal cost = 54 + 50 + 76 + 930 = 1,110\nAccommodation minimum nights:  2/7\n\nDays: 3,\nCurrent City: from Fort Myers (Florida) to Orlando (Florida),\nTransportation: Flight Number: F4014747, from Fort Myers (Florida) to Orlando (Florida), Departure Time: 16:49, Arrival Time: 17:39, cost: 36\nBreakfast: -,\nAttraction: SeaWorld Orlando, Orlando (Florida); The Wheel at ICON Park, Orlando (Florida);\nLunch: Fuji Japanese Steakhouse, Orlando (Florida), cost: 75, cuisines: \u201cTea, Bakery, Desserts\u201d\nDinner: Turquoise Villa, Orlando (Florida), cost: 55, cuisines: \u201cFrench, Bakery, BBQ, Fast Food\u201d\nAccommodation: Sixth Ave Chelsea, Studio Serviced Apartment, Orlando (Florida), cost: 70, room type: Entire home/apt, house rules: No visitors & No pets, minimum nights: 30, maximum occupancy: 3\n\nNumber of people = 1\nTotal cost = 36 + 75 + 55 + 70 = 236\nAccommodation minimum nights:  1/30\n\nDays: 4,\nCurrent City: Orlando (Florida),\nTransportation: -,\nBreakfast: The Tandoori Times, Orlando (Florida), cost: 84, cuisines: \u201cTea, Cafe, BBQ, Italian\u201d\nAttraction: Universal Orlando Resort, Orlando (Florida); Madame Tussauds Orlando, Orlando (Florida);\nLunch: Crust N Cakes, Orlando (Florida), cost: 61, cuisines: \u201cTea, Cafe, Indian, BBQ\u201d\nDinner: Indochi Cafe & Restaurant, Orlando (Florida), cost: 72, cuisines: \u201cPizza, French, Bakery, Fast Food, Indian, Seafood\u201d\nAccommodation: Sixth Ave Chelsea, Studio Serviced Apartment, Orlando (Florida), cost: 70, room type: Entire home/apt, house rules: No visitors & No pets, minimum nights: 30, maximum occupancy: 3\n\nNumber of people = 1\nTotal cost = 84 + 61 + 72 + 70 = 287\nAccommodation minimum nights:  2/30\n\nDays: 5,\nCurrent City: from Orlando (Florida) to Tampa (Florida),\nTransportation: Taxi, from Orlando (Florida) to Tampa (Florida), duration: 1 hour 18 mins, distance: 136 km, cost: 136\nBreakfast: Bite N Sip, Orlando (Florida), cost: 76, cuisines: \u201cChinese, Bakery, Cafe, Fast Food\u201d\nAttraction: The Florida Aquarium, Tampa (Florida); Busch Gardens Tampa Bay, Tampa (Florida);\nLunch: Kobe Hibachi & Sushi, Tampa (Florida), cost: 63, cuisines: \u201cDesserts, French, BBQ, Bakery, Seafood\u201d\nDinner: The Tin Cow, Tampa (Florida), cost: 67, cuisines: \u201cBBQ, Desserts, Seafood\u201d\nAccommodation: Lovely Guestroom in Elevator Building, Tampa (Florida), cost: 359, room type: Private room, house rules: No smoking & No visitors & No parties, minimum nights: 2, maximum occupancy: 2\n\nNumber of people = 1\nTotal cost = 136 + 76 + 63 + 67 + 359 = 701\nAccommodation minimum nights:  1/2\n\nDays: 6,\nCurrent City: Tampa (Florida),\nTransportation: -,\nBreakfast: Peg Leg Pete's, Tampa (Florida), cost: 91, cuisines: \u201cFrench, Bakery, Cafe\u201d\nAttraction: Adventure Island, Tampa (Florida); Henry B. Plant Museum, Tampa (Florida);\nLunch: Butterburrs, Tampa (Florida), cost: 28, cuisines: \u201cPizza, Seafood\u201d\nDinner: Lalit Kathi Rolls Momos, Tampa (Florida), cost: 23, cuisines: \u201cTea, Pizza, Fast Food\u201d\nAccommodation: Lovely Guestroom in Elevator Building, Tampa (Florida), cost: 359, room type: Private room, house rules: No smoking & No visitors & No parties, minimum nights: 2, maximum occupancy: 2\n\nNumber of people = 1\nTotal cost = 91 + 28 + 23 + 359 = 501\nAccommodation minimum nights:  2/2\n\nDays: 7,\nCurrent City: from Tampa (Florida) to Louisville,\nTransportation: Flight Number: F3963197, from Tampa (Florida) to Louisville, Departure Time: 11:38, Arrival Time: 13:42, cost: 203\nBreakfast: -,\nAttraction: -,\nLunch: -,\nDinner: -,\nAccommodation: -\n\nNumber of people = 1\nTotal cost = 203\n\nTotal cost across all days = 1,350 + 1,110 + 236 + 287 + 701 + 501 + 203 = 4,388\n\nCuisines: The travel plan includes a variety of cuisines, with no specific preferences mentioned in the query.\n\nHouse rules: All accommodations chosen adhere to the house rules specified in the query.\n\nPlease note that the accommodation in Fort Myers has a minimum stay of 7 nights, which exceeds the duration of the stay in the city. Adjustments to the accommodation or the duration of the stay in Fort Myers may be necessary to comply with this requirement. The accommodation in Orlando also has a minimum stay of 30 nights, which is not suitable for the travel plan. Alternative accommodation should be considered. The total cost is well within the budget of $7,800.", "gpt-4-1106-preview_direct_sole-planning_parsed_results": [{"day": 1, "current_city": "from Louisville to Fort Myers (Florida)", "transportation": "Flight Number: F3615988, from Louisville to Fort Myers (Florida), Departure Time: 18:19, Arrival Time: 20:34", "breakfast": "-", "attraction": "-", "lunch": "-", "dinner": "The Refinery, Fort Myers (Florida)", "accommodation": "Quiet and beautiful apartment near central park, Fort Myers (Florida)"}, {"day": 2, "current_city": "Fort Myers (Florida)", "transportation": "-", "breakfast": "Al Mukhtar Bakery, Fort Myers (Florida)", "attraction": "Edison & Ford Winter Estates, Fort Myers (Florida);Six Mile Cypress Slough Preserve, Fort Myers (Florida);", "lunch": "Haunted, Fort Myers (Florida)", "dinner": "Eggers Madhouse, Fort Myers (Florida)", "accommodation": "Quiet and beautiful apartment near central park, Fort Myers (Florida)"}, {"day": 3, "current_city": "from Fort Myers (Florida) to Orlando (Florida)", "transportation": "Flight Number: F4014747, from Fort Myers (Florida) to Orlando (Florida), Departure Time: 16:49, Arrival Time: 17:39", "breakfast": "-", "attraction": "SeaWorld Orlando, Orlando (Florida);The Wheel at ICON Park, Orlando (Florida);", "lunch": "Fuji Japanese Steakhouse, Orlando (Florida)", "dinner": "Turquoise Villa, Orlando (Florida)", "accommodation": "Sixth Ave Chelsea, Studio Serviced Apartment, Orlando (Florida)"}, {"day": 4, "current_city": "Orlando (Florida)", "transportation": "-", "breakfast": "The Tandoori Times, Orlando (Florida)", "attraction": "Universal Orlando Resort, Orlando (Florida);Madame Tussauds Orlando, Orlando (Florida);", "lunch": "Crust N Cakes, Orlando (Florida)", "dinner": "Indochi Cafe & Restaurant, Orlando (Florida)", "accommodation": "Sixth Ave Chelsea, Studio Serviced Apartment, Orlando (Florida)"}, {"day": 5, "current_city": "from Orlando (Florida) to Tampa (Florida)", "transportation": "Taxi, from Orlando (Florida) to Tampa (Florida), duration: 1 hour 18 mins, distance: 136 km", "breakfast": "Bite N Sip, Orlando (Florida)", "attraction": "The Florida Aquarium, Tampa (Florida);Busch Gardens Tampa Bay, Tampa (Florida);", "lunch": "Kobe Hibachi & Sushi, Tampa (Florida)", "dinner": "The Tin Cow, Tampa (Florida)", "accommodation": "Lovely Guestroom in Elevator Building, Tampa (Florida)"}, {"day": 6, "current_city": "Tampa (Florida)", "transportation": "-", "breakfast": "Peg Leg Pete's, Tampa (Florida)", "attraction": "Adventure Island, Tampa (Florida);Henry B. Plant Museum, Tampa (Florida);", "lunch": "Butterburrs, Tampa (Florida)", "dinner": "Lalit Kathi Rolls Momos, Tampa (Florida)", "accommodation": "Lovely Guestroom in Elevator Building, Tampa (Florida)"}, {"day": 7, "current_city": "from Tampa (Florida) to Louisville", "transportation": "Flight Number: F3963197, from Tampa (Florida) to Louisville, Departure Time: 11:38, Arrival Time: 13:42", "breakfast": "-", "attraction": "-", "lunch": "-", "dinner": "-", "accommodation": "-"}]}]