[{"gpt-4-1106-preview_direct_sole-planning_results": "Travel Plan:\n\nDays: 1,\nCurrent City: from Albuquerque to Houston (Texas),\nTransportation: Taxi, from Albuquerque to Houston, duration: 12 hours 51 mins, distance: 1,422 km, cost: 1422\nBreakfast: -,\nAttraction: -,\nLunch: -,\nDinner: Jalapenos, Houston (Texas), cost: 57, cuisines: \u201cDesserts, Tea, Cafe, Chinese, Seafood\u201d\nAccommodation: Sunny and Airy near Manhattan, Houston (Texas), cost: 499, room type: Entire home/apt, house rules: No pets, minimum nights: 2, maximum occupancy: 4\n\nNumber of people = 2\nTotal cost = 1422 + 57 * 2 + 499 = 2035\nAccommodation minimum nights:  1/2\n\nDays: 2,\nCurrent City: Houston (Texas),\nTransportation: -,\nBreakfast: Super Bakery, Houston (Texas), cost: 30, cuisines: \u201cSeafood, Fast Food\u201d\nAttraction: Space Center Houston, Houston (Texas); Houston Museum of Natural Science, Houston (Texas);\nLunch: Sheetla Dhaba, Houston (Texas), cost: 35, cuisines: \u201cDesserts, Pizza, Bakery, American, Mediterranean\u201d\nDinner: Royal Mart, Houston (Texas), cost: 40, cuisines: \u201cTea, Bakery, Cafe, Mediterranean, Seafood\u201d\nAccommodation: Sunny and Airy near Manhattan, Houston (Texas), cost: 499, room type: Entire home/apt, house rules: No pets, minimum nights: 2, maximum occupancy: 4\n\nNumber of people = 2\nTotal cost = (30 + 35 + 40) * 2 + 499 = 709\nAccommodation minimum nights:  2/2 (Done!)\n\nDays: 3,\nCurrent City: from Houston (Texas) to San Antonio (Texas),\nTransportation: Taxi, from Houston to San Antonio, duration: 2 hours 56 mins, distance: 317 km, cost: 317\nBreakfast: Earthen Spices, Houston (Texas), cost: 28, cuisines: \u201cTea, Mexican, Bakery, BBQ, Fast Food\u201d\nAttraction: San Antonio River Walk, San Antonio (Texas); The Alamo, San Antonio (Texas);\nLunch: Cafe Le Rue @ The Landings, San Antonio (Texas), cost: 19, cuisines: \u201cFrench, Mexican, Cafe, Seafood\u201d\nDinner: Martin's BBQ, San Antonio (Texas), cost: 71, cuisines: \u201cTea, BBQ, Fast Food, Indian, Seafood\u201d\nAccommodation: Spacious, bright room, prime Williamsburg location, San Antonio (Texas), cost: 900, room type: Private room, house rules: No pets, minimum nights: 3, maximum occupancy: 2\n\nNumber of people = 2\nTotal cost = 317 + (28 + 19 + 71) * 2 + 900 = 1453\nAccommodation minimum nights:  1/3\n\nDays: 4,\nCurrent City: San Antonio (Texas),\nTransportation: -,\nBreakfast: Barbeque Nation, San Antonio (Texas), cost: 16, cuisines: \u201cTea, Cafe, Fast Food, Chinese, American\u201d\nAttraction: SeaWorld San Antonio, San Antonio (Texas); San Antonio Zoo, San Antonio (Texas);\nLunch: Cream Stone, San Antonio (Texas), cost: 53, cuisines: \u201cCafe, BBQ, Mediterranean, Desserts\u201d\nDinner: Minerva's Food & Cocktails, San Antonio (Texas), cost: 99, cuisines: \u201cCafe, Bakery, BBQ, Seafood\u201d\nAccommodation: Spacious, bright room, prime Williamsburg location, San Antonio (Texas), cost: 900, room type: Private room, house rules: No pets, minimum nights: 3, maximum occupancy: 2\n\nNumber of people = 2\nTotal cost = (16 + 53 + 99) * 2 + 900 = 1236\nAccommodation minimum nights:  2/3\n\nDays: 5,\nCurrent City: from San Antonio (Texas) to Dallas (Texas),\nTransportation: Taxi, from San Antonio to Dallas, duration: 4 hours 4 mins, distance: 440 km, cost: 440\nBreakfast: Pita Pit, San Antonio (Texas), cost: 36, cuisines: \u201cPizza, French, Bakery, Cafe, Mediterranean\u201d\nAttraction: The Dallas World Aquarium, Dallas (Texas); Dallas Museum of Art, Dallas (Texas);\nLunch: Coconuts Fish Cafe, Dallas (Texas), cost: 38, cuisines: \u201cCafe, BBQ, Mediterranean, Fast Food\u201d\nDinner: 1918 Bistro & Grill, Dallas (Texas), cost: 90, cuisines: \u201cTea, Pizza, BBQ, Seafood\u201d\nAccommodation: 1BR, elevator, kitchen, doorman!, Dallas (Texas), cost: 475, room type: Entire home/apt, house rules: No parties, minimum nights: 1, maximum occupancy: 3\n\nNumber of people = 2\nTotal cost = 440 + (36 + 38 + 90) * 2 + 475 = 1243\nAccommodation minimum nights:  1/1 (Done!)\n\nDays: 6,\nCurrent City: Dallas (Texas),\nTransportation: -,\nBreakfast: Cafe Gatherings, Dallas (Texas), cost: 17, cuisines: \u201cBakery, Indian, Desserts\u201d\nAttraction: Reunion Tower, Dallas (Texas); Klyde Warren Park, Dallas (Texas);\nLunch: Drifters Cafe, Dallas (Texas), cost: 21, cuisines: \u201cTea, French, Mexican, Cafe, Seafood\u201d\nDinner: Uma Foodies' Hut, Dallas (Texas), cost: 49, cuisines: \u201cFrench, Bakery, Seafood\u201d\nAccommodation: Luxury Williamsburg duplex, private roof terrace, Dallas (Texas), cost: 241, room type: Entire home/apt, house rules: No visitors, minimum nights: 4, maximum occupancy: 3\n\nNumber of people = 2\nTotal cost = (17 + 21 + 49) * 2 + 241 = 414\nAccommodation minimum nights:  1/4\n\nDays: 7,\nCurrent City: from Dallas (Texas) to Albuquerque,\nTransportation: Taxi, from Dallas to Albuquerque, duration: 9 hours 33 mins, distance: 1,045 km, cost: 1045\nBreakfast: -,\nAttraction: -,\nLunch: -,\nDinner: -,\nAccommodation: -\n\nNumber of people = 2\nTotal cost = 1045 * 2 = 2090\n\nTotal cost across all days = 2035 + 709 + 1453 + 1236 + 1243 + 414 + 2090 = 9180\n\nUnfortunately, the total cost of $9,180 exceeds the specified budget of $5,000. Additionally, the accommodation on Day 3 does not allow smoking, which is against the specified requirements. The travel plan needs to be adjusted to meet the budget and accommodation preferences.", "gpt-4-1106-preview_direct_sole-planning_parsed_results": [{"day": 1, "current_city": "from Albuquerque to Houston", "transportation": "Taxi, from Albuquerque to Houston, duration: 12 hours 51 mins, distance: 1,422 km", "breakfast": "-", "attraction": "-", "lunch": "-", "dinner": "Jalapenos, Houston", "accommodation": "Sunny and Airy near Manhattan, Houston"}, {"day": 2, "current_city": "Houston", "transportation": "-", "breakfast": "Super Bakery, Houston", "attraction": "Space Center Houston, Houston;Houston Museum of Natural Science, Houston;", "lunch": "Sheetla Dhaba, Houston", "dinner": "Royal Mart, Houston", "accommodation": "Sunny and Airy near Manhattan, Houston"}, {"day": 3, "current_city": "from Houston to San Antonio", "transportation": "Taxi, from Houston to San Antonio, duration: 2 hours 56 mins, distance: 317 km", "breakfast": "Earthen Spices, Houston", "attraction": "San Antonio River Walk, San Antonio;The Alamo, San Antonio;", "lunch": "Cafe Le Rue @ The Landings, San Antonio", "dinner": "Martin's BBQ, San Antonio", "accommodation": "Spacious, bright room, prime Williamsburg location, San Antonio"}, {"day": 4, "current_city": "San Antonio", "transportation": "-", "breakfast": "Barbeque Nation, San Antonio", "attraction": "SeaWorld San Antonio, San Antonio;San Antonio Zoo, San Antonio;", "lunch": "Cream Stone, San Antonio", "dinner": "Minerva's Food & Cocktails, San Antonio", "accommodation": "Spacious, bright room, prime Williamsburg location, San Antonio"}, {"day": 5, "current_city": "from San Antonio to Dallas", "transportation": "Taxi, from San Antonio to Dallas, duration: 4 hours 4 mins, distance: 440 km", "breakfast": "Pita Pit, San Antonio", "attraction": "The Dallas World Aquarium, Dallas;Dallas Museum of Art, Dallas;", "lunch": "Coconuts Fish Cafe, Dallas", "dinner": "1918 Bistro & Grill, Dallas", "accommodation": "1BR, elevator, kitchen, doorman!, Dallas"}, {"day": 6, "current_city": "Dallas", "transportation": "-", "breakfast": "Cafe Gatherings, Dallas", "attraction": "Reunion Tower, Dallas;Klyde Warren Park, Dallas;", "lunch": "Drifters Cafe, Dallas", "dinner": "Uma Foodies' Hut, Dallas", "accommodation": "Luxury Williamsburg duplex, private roof terrace, Dallas"}, {"day": 7, "current_city": "from Dallas to Albuquerque", "transportation": "Taxi, from Dallas to Albuquerque, duration: 9 hours 33 mins, distance: 1,045 km", "breakfast": "-", "attraction": "-", "lunch": "-", "dinner": "-", "accommodation": "-"}]}]