[{"gpt-4-1106-preview_direct_sole-planning_results": "Travel Plan:\nDays: 1,\nCurrent City: from Newark to Savannah (Georgia),\nTransportation: Flight Number: F4070527, from Newark to Savannah (Georgia), Departure Time: 08:54, Arrival Time: 11:27, cost: 242\nBreakfast: -,\nAttraction: -,\nLunch: Sr. Sol 1, Savannah (Georgia), cost: 30, cuisines: \u201cTea, French, Mediterranean, Desserts\u201d\nDinner: Bosphorous Turkish Cuisine, Savannah (Georgia), cost: 58, cuisines: \u201cPizza, Indian, Fast Food\u201d\nAccommodation: Alpha-Bet City entire floor large cool 2br -L.E.S, Savannah (Georgia), cost: 574, maximum occupancy: 4, house rules: No visitors & No parties, minimum nights: 2\n\nNumber of people = 2\nTotal cost = (242 + 30 + 58) * 2 + 574 = 1,234\nAccommodation minimum nights:  1/2\n\nDays: 2,\nCurrent City: Savannah (Georgia),\nTransportation: -,\nBreakfast: The Mad Teapot/The Wishing Chair, Savannah (Georgia), cost: 23, cuisines: \u201cMexican, Bakery, Fast Food\u201d\nAttraction: Forsyth Park, Savannah (Georgia); Wormsloe State Historic Site, Savannah (Georgia);\nLunch: Manohar Dairy And Restaurant, Savannah (Georgia), cost: 23, cuisines: \u201cTea, Indian, Fast Food\u201d\nDinner: Country's Barbecue, Savannah (Georgia), cost: 59, cuisines: \u201cCafe, Bakery\u201d\nAccommodation: Alpha-Bet City entire floor large cool 2br -L.E.S, Savannah (Georgia), cost: 574, maximum occupancy: 4, house rules: No visitors & No parties, minimum nights: 2\n\nNumber of people = 2\nTotal cost = (23 + 23 + 59) * 2 + 574 = 754\nAccommodation minimum nights:  2/2 (Done!)\n\nDays: 3,\nCurrent City: from Savannah (Georgia) to Newark,\nTransportation: Flight Number: F3903501, from Savannah (Georgia) to Newark, Departure Time: 06:02, Arrival Time: 08:11, cost: 294\nBreakfast: -,\nAttraction: -,\nLunch: -,\nDinner: -,\nAccommodation: -\n\nNumber of people = 2\nTotal cost = 294 * 2 = 588\n\nTotal cost across all days = 1,234 + 754 + 588 = 2,576\n\nCuisines: The prompt specifies Mediterranean, Mexican, French, and Indian, and all of these cuisines have been represented in the restaurants chosen.\n\nHouse rules: All accommodations chosen are suitable for children under 10.\n\nPlease note: The total cost exceeds the specified budget of $1,400. Adjustments are needed to meet the budget constraint. Here is an adjusted plan that fits the budget:\n\nAdjusted Travel Plan:\nDays: 1,\nCurrent City: from Newark to Savannah (Georgia),\nTransportation: Flight Number: F4070527, from Newark to Savannah (Georgia), Departure Time: 08:54, Arrival Time: 11:27, cost: 242\nBreakfast: -,\nAttraction: -,\nLunch: Sr. Sol 1, Savannah (Georgia), cost: 30, cuisines: \u201cTea, French, Mediterranean, Desserts\u201d\nDinner: Manohar Dairy And Restaurant, Savannah (Georgia), cost: 23, cuisines: \u201cTea, Indian, Fast Food\u201d\nAccommodation: Private Oasis (A), Savannah (Georgia), cost: 157, maximum occupancy: 2, house rules: No parties, minimum nights: 2\n\nNumber of people = 2\nTotal cost = (242 + 30 + 23) * 2 + 157 = 747\nAccommodation minimum nights:  1/2\n\nDays: 2,\nCurrent City: Savannah (Georgia),\nTransportation: -,\nBreakfast: The Mad Teapot/The Wishing Chair, Savannah (Georgia), cost: 23, cuisines: \u201cMexican, Bakery, Fast Food\u201d\nAttraction: Forsyth Park, Savannah (Georgia); Wormsloe State Historic Site, Savannah (Georgia);\nLunch: Bosphorous Turkish Cuisine, Savannah (Georgia), cost: 58, cuisines: \u201cPizza, Indian, Fast Food\u201d\nDinner: Country's Barbecue, Savannah (Georgia), cost: 59, cuisines: \u201cCafe, Bakery\u201d\nAccommodation: Private Oasis (A), Savannah (Georgia), cost: 157, maximum occupancy: 2, house rules: No parties, minimum nights: 2\n\nNumber of people = 2\nTotal cost = (23 + 58 + 59) * 2 + 157 = 437\nAccommodation minimum nights:  2/2 (Done!)\n\nDays: 3,\nCurrent City: from Savannah (Georgia) to Newark,\nTransportation: Flight Number: F3903501, from Savannah (Georgia) to Newark, Departure Time: 06:02, Arrival Time: 08:11, cost: 294\nBreakfast: -,\nAttraction: -,\nLunch: -,\nDinner: -,\nAccommodation: -\n\nNumber of people = 2\nTotal cost = 294 * 2 = 588\n\nTotal cost across all days = 747 + 437 + 588 = 1,772\n\nThe adjusted plan still exceeds the budget. To fit the budget, we may need to consider alternative transportation methods or adjust meal and accommodation choices. However, the query specifies not planning on self-driving, which limits the options for transportation adjustments.", "gpt-4-1106-preview_direct_sole-planning_parsed_results": [{"day": 1, "current_city": "from Newark to Savannah (Georgia)", "transportation": "Flight Number: F4070527, from Newark to Savannah (Georgia), Departure Time: 08:54, Arrival Time: 11:27", "breakfast": "-", "attraction": "-", "lunch": "Sr. Sol 1, Savannah (Georgia)", "dinner": "Bosphorous Turkish Cuisine, Savannah (Georgia)", "accommodation": "Alpha-Bet City entire floor large cool 2br -L.E.S, Savannah (Georgia)"}, {"day": 2, "current_city": "Savannah (Georgia)", "transportation": "-", "breakfast": "The Mad Teapot/The Wishing Chair, Savannah (Georgia)", "attraction": "Forsyth Park, Savannah (Georgia);Wormsloe State Historic Site, Savannah (Georgia);", "lunch": "Manohar Dairy And Restaurant, Savannah (Georgia)", "dinner": "Country's Barbecue, Savannah (Georgia)", "accommodation": "Alpha-Bet City entire floor large cool 2br -L.E.S, Savannah (Georgia)"}, {"day": 3, "current_city": "from Savannah (Georgia) to Newark", "transportation": "Flight Number: F3903501, from Savannah (Georgia) to Newark, Departure Time: 06:02, Arrival Time: 08:11", "breakfast": "-", "attraction": "-", "lunch": "-", "dinner": "-", "accommodation": "-"}, {"day": 1, "current_city": "from Newark to Savannah (Georgia)", "transportation": "Flight Number: F4070527, from Newark to Savannah (Georgia), Departure Time: 08:54, Arrival Time: 11:27", "breakfast": "-", "attraction": "-", "lunch": "Sr. Sol 1, Savannah (Georgia)", "dinner": "Manohar Dairy And Restaurant, Savannah (Georgia)", "accommodation": "Private Oasis (A), Savannah (Georgia)"}, {"day": 2, "current_city": "Savannah (Georgia)", "transportation": "-", "breakfast": "The Mad Teapot/The Wishing Chair, Savannah (Georgia)", "attraction": "Forsyth Park, Savannah (Georgia);Wormsloe State Historic Site, Savannah (Georgia);", "lunch": "Bosphorous Turkish Cuisine, Savannah (Georgia)", "dinner": "Country's Barbecue, Savannah (Georgia)", "accommodation": "Private Oasis (A), Savannah (Georgia)"}, {"day": 3, "current_city": "from Savannah (Georgia) to Newark", "transportation": "Flight Number: F3903501, from Savannah (Georgia) to Newark, Departure Time: 06:02, Arrival Time: 08:11", "breakfast": "-", "attraction": "-", "lunch": "-", "dinner": "-", "accommodation": "-"}]}]