[{"gpt-4-1106-preview_direct_sole-planning_results": "Travel Plan:\nDays: 1,\nCurrent City: from New York to Reno (Nevada),\nTransportation: Flight Number: F3767722, from New York to Reno (Nevada), Departure Time: 21:02, Arrival Time: 00:07, cost: 1200\nBreakfast: -,\nAttraction: -,\nLunch: -,\nDinner: -,\nAccommodation: A bright, beautiful treehouse, Reno (Nevada), cost: 361, room type: Entire home/apt, house rules: No visitors, minimum nights: 2, maximum occupancy: 2\n\nNumber of people = 4\nTotal cost = 1200 * 4 + 361 * 2 = 5984\nAccommodation minimum nights: 1/2\n\nDays: 2,\nCurrent City: Reno (Nevada),\nTransportation: -,\nBreakfast: Leme Light, Reno (Nevada), cost: 55, cuisines: \u201cCafe, Mexican, Fast Food\u201d\nAttraction: Nevada Museum of Art, Reno (Nevada); The Discovery, Reno (Nevada); National Automobile Museum, Reno (Nevada),\nLunch: Kanha Sweets, Reno (Nevada), cost: 28, cuisines: \u201cItalian, Bakery, Fast Food, Cafe, American\u201d\nDinner: Queens Cakes, Reno (Nevada), cost: 58, cuisines: \u201cBakery, Desserts, Indian, BBQ\u201d\nAccommodation: A bright, beautiful treehouse, Reno (Nevada), cost: 361, room type: Entire home/apt, house rules: No visitors, minimum nights: 2, maximum occupancy: 2\n\nNumber of people = 4\nTotal cost = (55 + 28 + 58) * 4 + 361 * 2 = 1449\nAccommodation minimum nights: 2/2 (Done!)\n\nDays: 3,\nCurrent City: Reno (Nevada),\nTransportation: -,\nBreakfast: Indian Gourmet, Reno (Nevada), cost: 16, cuisines: \u201cTea, Fast Food, American, Seafood\u201d\nAttraction: Fleischmann Planetarium, Reno (Nevada); Rancho San Rafael Regional Park, Reno (Nevada),\nLunch: Olive Bistro, Reno (Nevada), cost: 66, cuisines: \u201cTea, Cafe, Pizza, BBQ\u201d\nDinner: Mustake Multicuisine Restaurant, Reno (Nevada), cost: 91, cuisines: \u201cTea, Bakery, Pizza, Mediterranean\u201d\nAccommodation: - (As the travel plan ends on this day, no accommodation is needed for the night of the 16th)\n\nNumber of people = 4\nTotal cost = (16 + 66 + 91) * 4 = 692\n\nTotal cost across all days = 5984 + 1449 + 692 = 8125\nCuisines: The prompt does not specify cuisines, so all cuisine constraints are satisfied.\nHouse rules: All accommodations chosen are suitable for children under 10, as required.\n\n***** Travel Plan Ends *****\n\nPlease note that the accommodation \"A bright, beautiful treehouse\" was chosen because it is the only one listed that does not have a \"No children under 10\" house rule, and it is an entire home/apt which is generally more suitable for a family including children. The cost for the accommodation is doubled as it is for two nights, and the maximum occupancy is 2, so two units are required to accommodate 4 people. The total cost remains within the budget of $11,300.", "gpt-4-1106-preview_direct_sole-planning_parsed_results": [{"day": 1, "current_city": "from New York to Reno", "transportation": "Flight Number: F3767722, from New York to Reno, Departure Time: 21:02, Arrival Time: 00:07", "breakfast": "-", "attraction": "-", "lunch": "-", "dinner": "-", "accommodation": "A bright, beautiful treehouse, Reno"}, {"day": 2, "current_city": "Reno", "transportation": "-", "breakfast": "Leme Light, Reno", "attraction": "Nevada Museum of Art, Reno;The Discovery, Reno;National Automobile Museum, Reno;", "lunch": "Kanha Sweets, Reno", "dinner": "Queens Cakes, Reno", "accommodation": "A bright, beautiful treehouse, Reno"}, {"day": 3, "current_city": "Reno", "transportation": "-", "breakfast": "Indian Gourmet, Reno", "attraction": "Fleischmann Planetarium, Reno;Rancho San Rafael Regional Park, Reno;", "lunch": "Olive Bistro, Reno", "dinner": "Mustake Multicuisine Restaurant, Reno", "accommodation": "-"}]}]