[{"gpt-4-1106-preview_direct_sole-planning_results": "Travel Plan:\n\nDays: 1,\nCurrent City: from Milwaukee to Alpena (Michigan),\nTransportation: Taxi, from Milwaukee to Alpena, duration: 7 hours 37 mins, distance: 749 km, cost: 749\nBreakfast: -,\nAttraction: -,\nLunch: -,\nDinner: A & A Pagliai's Pizza, Alpena (Michigan), cost: 72, cuisines: \u201cTea, American, Fast Food\u201d\nAccommodation: Ultimate 50th Floor Downtown Penthouse - 4000SqFt, Alpena (Michigan), cost: 1043, room type: Entire home/apt, house rules: No smoking & No visitors & No children under 10, minimum nights: 2, maximum occupancy: 9\n\nNumber of people = 2\nTotal cost = 749 + 72 * 2 + 1043 = 1936\nAccommodation minimum nights:  1/2\n\n(Note: The total cost exceeds the budget on the first day due to high transportation and accommodation costs. Adjustments will be made in the following days to stay within the overall budget.)\n\nDays: 2,\nCurrent City: Alpena (Michigan),\nTransportation: -,\nBreakfast: @Mango, Alpena (Michigan), cost: 38, cuisines: \u201cBBQ, Cafe, American, Desserts\u201d\nAttraction: Great Lakes Maritime Heritage Center, Alpena (Michigan); Besser Museum for Northeast Michigan, Alpena (Michigan),\nLunch: Shudh Restaurant, Alpena (Michigan), cost: 56, cuisines: \u201cCafe, BBQ, Fast Food\u201d\nDinner: Maplai, Alpena (Michigan), cost: 63, cuisines: \u201cTea, Indian, Bakery, Fast Food, American\u201d\nAccommodation: Ultimate 50th Floor Downtown Penthouse - 4000SqFt, Alpena (Michigan), cost: 1043, room type: Entire home/apt, house rules: No smoking & No visitors & No children under 10, minimum nights: 2, maximum occupancy: 9\n\nNumber of people = 2\nTotal cost = (38 + 56 + 63) * 2 + 1043 = 1356\nAccommodation minimum nights:  2/2 (Done!)\n\nDays: 3,\nCurrent City: from Alpena (Michigan) to Kalamazoo (Michigan),\nTransportation: Taxi, from Alpena to Kalamazoo, duration: 4 hours 33 mins, distance: 464 km, cost: 464\nBreakfast: -,\nAttraction: -,\nLunch: -,\nDinner: Django, Kalamazoo (Michigan), cost: 65, cuisines: \u201cMediterranean, Desserts, Fast Food\u201d\nAccommodation: East 63rd street, Studio Serviced Apartment, Kalamazoo (Michigan), cost: 417, room type: Entire home/apt, house rules: No parties & No visitors & No pets, minimum nights: 30, maximum occupancy: 4\n\nNumber of people = 2\nTotal cost = 464 + 65 * 2 + 417 = 1011\nAccommodation minimum nights:  1/30\n\n(Note: The accommodation selected does not allow parties, which is against the query requirements. However, due to budget constraints and the need for private rooms, this option was chosen.)\n\nDays: 4,\nCurrent City: Kalamazoo (Michigan),\nTransportation: -,\nBreakfast: Giulios Greek & Italian Restaurant, Kalamazoo (Michigan), cost: 76, cuisines: \u201cFast Food, French, Desserts, Seafood\u201d\nAttraction: Kalamazoo Valley Museum, Kalamazoo (Michigan); Kalamazoo Institute of Arts, Kalamazoo (Michigan),\nLunch: Cha cTea, Kalamazoo (Michigan), cost: 77, cuisines: \u201cCafe, Pizza, Mediterranean\u201d\nDinner: Taco Bell, Kalamazoo (Michigan), cost: 54, cuisines: \u201cChinese, Bakery, Pizza, Seafood\u201d\nAccommodation: East 63rd street, Studio Serviced Apartment, Kalamazoo (Michigan), cost: 417, room type: Entire home/apt, house rules: No parties & No visitors & No pets, minimum nights: 30, maximum occupancy: 4\n\nNumber of people = 2\nTotal cost = (76 + 77 + 54) * 2 + 417 = 851\nAccommodation minimum nights:  2/30\n\nDays: 5,\nCurrent City: from Kalamazoo (Michigan) to Milwaukee,\nTransportation: Taxi, from Kalamazoo to Milwaukee, duration: 3 hours 45 mins, distance: 382 km, cost: 382\nBreakfast: -,\nAttraction: -,\nLunch: -,\nDinner: -,\nAccommodation: -\n\nNumber of people = 2\nTotal cost = 382 * 2 = 764\n\nTotal cost across all days = 1936 + 1356 + 1011 + 851 + 764 = 5918\n\n(Note: The total cost far exceeds the budget of $1,700. To stay within budget, consider alternative transportation methods or accommodations. However, given the constraints and available data, this is the proposed plan.)\n\nCuisines: The prompt does not specify cuisines, so all cuisine constraints are satisfied.\nHouse rules: The accommodations chosen do not allow parties, which is against the query requirements. However, due to budget constraints and the need for private rooms, these options were chosen.", "gpt-4-1106-preview_direct_sole-planning_parsed_results": [{"day": 1, "current_city": "from Milwaukee to Alpena", "transportation": "Taxi, from Milwaukee to Alpena, duration: 7 hours 37 mins, distance: 749 km", "breakfast": "-", "attraction": "-", "lunch": "-", "dinner": "A & A Pagliai's Pizza, Alpena", "accommodation": "Ultimate 50th Floor Downtown Penthouse - 4000SqFt, Alpena"}, {"day": 2, "current_city": "Alpena", "transportation": "-", "breakfast": "@Mango, Alpena", "attraction": "Great Lakes Maritime Heritage Center, Alpena;Besser Museum for Northeast Michigan, Alpena;", "lunch": "Shudh Restaurant, Alpena", "dinner": "Maplai, Alpena", "accommodation": "Ultimate 50th Floor Downtown Penthouse - 4000SqFt, Alpena"}, {"day": 3, "current_city": "from Alpena to Kalamazoo", "transportation": "Taxi, from Alpena to Kalamazoo, duration: 4 hours 33 mins, distance: 464 km", "breakfast": "-", "attraction": "-", "lunch": "-", "dinner": "Django, Kalamazoo", "accommodation": "East 63rd street, Studio Serviced Apartment, Kalamazoo"}, {"day": 4, "current_city": "Kalamazoo", "transportation": "-", "breakfast": "Giulios Greek & Italian Restaurant, Kalamazoo", "attraction": "Kalamazoo Valley Museum, Kalamazoo;Kalamazoo Institute of Arts, Kalamazoo;", "lunch": "Cha cTea, Kalamazoo", "dinner": "Taco Bell, Kalamazoo", "accommodation": "East 63rd street, Studio Serviced Apartment, Kalamazoo"}, {"day": 5, "current_city": "from Kalamazoo to Milwaukee", "transportation": "Taxi, from Kalamazoo to Milwaukee, duration: 3 hours 45 mins, distance: 382 km", "breakfast": "-", "attraction": "-", "lunch": "-", "dinner": "-", "accommodation": "-"}]}]