[{"gpt-4-1106-preview_direct_sole-planning_results": "Travel Plan:\n\nDays: 1,\nCurrent City: from Monterey to Dallas (Texas),\nTransportation: Flight Number: F4046679, from Monterey to Dallas (Texas), Departure Time: 14:02, Arrival Time: 19:18, cost: 489\nBreakfast: -,\nAttraction: -,\nLunch: -,\nDinner: Coconuts Fish Cafe, Dallas (Texas), cost: 38, cuisines: \u201cCafe, BBQ, Mediterranean, Fast Food\u201d\nAccommodation: 1BR, elevator, kitchen, doorman!, Dallas (Texas), cost: 475, maximum occupancy: 3, house rules: No parties, minimum nights: 1\n\nNumber of people = 4\nTotal cost = 489 * 4 + 38 * 4 + 475 * 2 = 3,028\nAccommodation minimum nights:  1/1\n\nDays: 2,\nCurrent City: Dallas (Texas),\nTransportation: -,\nBreakfast: Cafe Gatherings, Dallas (Texas), cost: 17, cuisines: \u201cBakery, Indian, Desserts\u201d\nAttraction: The Dallas World Aquarium, Dallas (Texas); The Sixth Floor Museum at Dealey Plaza, Dallas (Texas);\nLunch: 1918 Bistro & Grill, Dallas (Texas), cost: 90, cuisines: \u201cTea, Pizza, BBQ, Seafood\u201d\nDinner: L'Opera, Dallas (Texas), cost: 77, cuisines: \u201cFrench, Bakery, BBQ, Fast Food, Seafood\u201d\nAccommodation: 1BR, elevator, kitchen, doorman!, Dallas (Texas), cost: 475, maximum occupancy: 3, house rules: No parties, minimum nights: 1\n\nNumber of people = 4\nTotal cost = (17 + 90 + 77) * 4 + 475 * 2 = 1,563\nAccommodation minimum nights:  2/1\n\nDays: 3,\nCurrent City: from Dallas (Texas) to Del Rio (Texas),\nTransportation: Flight Number: F3592397, from Dallas (Texas) to Del Rio (Texas), Departure Time: 21:19, Arrival Time: 22:38, cost: 136\nBreakfast: MONKS, Dallas (Texas), cost: 24, cuisines: \u201cTea, Pizza, Cafe, Mediterranean, Seafood\u201d\nAttraction: -,\nLunch: Cafe Coffee Day, Dallas (Texas), cost: 22, cuisines: \u201cCafe, BBQ, Desserts, Seafood\u201d\nDinner: Green Chick Chop, Del Rio (Texas), cost: 82, cuisines: \u201cTea, Bakery, Indian, Mediterranean, Seafood\u201d\nAccommodation: 2 bedroom Kid Friendly Cobble Hill, Del Rio (Texas), cost: 129, maximum occupancy: 3, house rules: No visitors & No smoking, minimum nights: 3\n\nNumber of people = 4\nTotal cost = 136 * 4 + (24 + 22 + 82) * 4 + 129 * 4 = 1,548\nAccommodation minimum nights:  1/3\n\nDays: 4,\nCurrent City: Del Rio (Texas),\nTransportation: -,\nBreakfast: HuHot Mongolian Grill, Del Rio (Texas), cost: 71, cuisines: \u201cCafe, Bakery, BBQ, Fast Food\u201d\nAttraction: Whitehead Memorial Museum, Del Rio (Texas); Amistad National Recreation Area, Del Rio (Texas);\nLunch: Pizzoccheri, Del Rio (Texas), cost: 77, cuisines: \u201cCafe, Seafood, Mediterranean, Italian\u201d\nDinner: Jom Jom Malay, Del Rio (Texas), cost: 78, cuisines: \u201cChinese, Indian, Desserts, Fast Food\u201d\nAccommodation: 2 bedroom Kid Friendly Cobble Hill, Del Rio (Texas), cost: 129, maximum occupancy: 3, house rules: No visitors & No smoking, minimum nights: 3\n\nNumber of people = 4\nTotal cost = (71 + 77 + 78) * 4 + 129 * 4 = 1,452\nAccommodation minimum nights:  2/3\n\nDays: 5,\nCurrent City: from Del Rio (Texas) to Amarillo (Texas),\nTransportation: Taxi, from Del Rio (Texas) to Amarillo (Texas), duration: 7 hours 0 mins, distance: 754 km, cost: 754\nBreakfast: -,\nAttraction: -,\nLunch: -,\nDinner: Komachi, Amarillo (Texas), cost: 71, cuisines: \u201cDesserts, Tea, Fast Food, Chinese, Mediterranean\u201d\nAccommodation: Gramercy Park restful, cozy, sun-filled home, Amarillo (Texas), cost: 968, maximum occupancy: 8, house rules: No parties, minimum nights: 2\n\nNumber of people = 4\nTotal cost = 754 * 4 + 71 * 4 + 968 * 2 = 6,056\nAccommodation minimum nights:  1/2\n\nDays: 6,\nCurrent City: Amarillo (Texas),\nTransportation: -,\nBreakfast: The Cinnamon Kitchen, Amarillo (Texas), cost: 69, cuisines: \u201cDesserts, Tea, Pizza, Chinese, Seafood\u201d\nAttraction: Cadillac Ranch, Amarillo (Texas); Amarillo Botanical Gardens, Amarillo (Texas);\nLunch: Sigree Global Grill, Amarillo (Texas), cost: 35, cuisines: \u201cChinese, BBQ, Cafe, Desserts\u201d\nDinner: Anand Restaurant, Amarillo (Texas), cost: 53, cuisines: \u201cFast Food, Seafood, Desserts, Italian\u201d\nAccommodation: Gramercy Park restful, cozy, sun-filled home, Amarillo (Texas), cost: 968, maximum occupancy: 8, house rules: No parties, minimum nights: 2\n\nNumber of people = 4\nTotal cost = (69 + 35 + 53) * 4 + 968 * 2 = 2,464\nAccommodation minimum nights:  2/2\n\nDays: 7,\nCurrent City: from Amarillo (Texas) to Monterey,\nTransportation: Taxi, from Amarillo (Texas) to Monterey, duration: 19 hours 21 mins, distance: 2,104 km, cost: 2104\nBreakfast: -,\nAttraction: -,\nLunch: -,\nDinner: -,\nAccommodation: -\n\nNumber of people = 4\nTotal cost = 2104 * 4 = 8,416\n\nTotal cost across all days = 3,028 + 1,563 + 1,548 + 1,452 + 6,056 + 2,464 + 8,416 = 24,527\n\nUnfortunately, the total cost of $24,527 exceeds the budget of $15,600. Adjustments will need to be made to the travel plan to fit within the budget. This could involve changing the mode of transportation, selecting different accommodations, or revising the itinerary to visit fewer attractions or dine at less expensive restaurants.", "gpt-4-1106-preview_direct_sole-planning_parsed_results": [{"day": 1, "current_city": "from Monterey to Dallas", "transportation": "Flight Number: F4046679, from Monterey to Dallas, Departure Time: 14:02, Arrival Time: 19:18", "breakfast": "-", "attraction": "-", "lunch": "-", "dinner": "Coconuts Fish Cafe, Dallas", "accommodation": "1BR, elevator, kitchen, doorman!, Dallas"}, {"day": 2, "current_city": "Dallas", "transportation": "-", "breakfast": "Cafe Gatherings, Dallas", "attraction": "The Dallas World Aquarium, Dallas;The Sixth Floor Museum at Dealey Plaza, Dallas;", "lunch": "1918 Bistro & Grill, Dallas", "dinner": "L'Opera, Dallas", "accommodation": "1BR, elevator, kitchen, doorman!, Dallas"}, {"day": 3, "current_city": "from Dallas to Del Rio", "transportation": "Flight Number: F3592397, from Dallas to Del Rio, Departure Time: 21:19, Arrival Time: 22:38", "breakfast": "MONKS, Dallas", "attraction": "-", "lunch": "Cafe Coffee Day, Dallas", "dinner": "Green Chick Chop, Del Rio", "accommodation": "2 bedroom Kid Friendly Cobble Hill, Del Rio"}, {"day": 4, "current_city": "Del Rio", "transportation": "-", "breakfast": "HuHot Mongolian Grill, Del Rio", "attraction": "Whitehead Memorial Museum, Del Rio;Amistad National Recreation Area, Del Rio;", "lunch": "Pizzoccheri, Del Rio", "dinner": "Jom Jom Malay, Del Rio", "accommodation": "2 bedroom Kid Friendly Cobble Hill, Del Rio"}, {"day": 5, "current_city": "from Del Rio to Amarillo", "transportation": "Taxi, from Del Rio to Amarillo, duration: 7 hours 0 mins, distance: 754 km", "breakfast": "-", "attraction": "-", "lunch": "-", "dinner": "Komachi, Amarillo", "accommodation": "Gramercy Park restful, cozy, sun-filled home, Amarillo"}, {"day": 6, "current_city": "Amarillo", "transportation": "-", "breakfast": "The Cinnamon Kitchen, Amarillo", "attraction": "Cadillac Ranch, Amarillo;Amarillo Botanical Gardens, Amarillo;", "lunch": "Sigree Global Grill, Amarillo", "dinner": "Anand Restaurant, Amarillo", "accommodation": "Gramercy Park restful, cozy, sun-filled home, Amarillo"}, {"day": 7, "current_city": "from Amarillo to Monterey", "transportation": "Taxi, from Amarillo to Monterey, duration: 19 hours 21 mins, distance: 2104 km", "breakfast": "-", "attraction": "-", "lunch": "-", "dinner": "-", "accommodation": "-"}]}]