[{"gpt-4-1106-preview_direct_sole-planning_results": "Travel Plan:\nDays: 1,\nCurrent City: from Key West to Evansville (Indiana),\nTransportation: Taxi, from Key West to Evansville, duration: 18 hours 21 mins, distance: 1,961 km, cost: 1961\nBreakfast: -,\nAttraction: -,\nLunch: -,\nDinner: Blue Orchid Thai Restaurant, Evansville (Indiana), cost: 86, cuisines: \u201cTea, Mexican, American, Desserts\u201d\nAccommodation: *Lovely Apt In Heart Of Park Slope*, Evansville (Indiana), cost: 70, maximum occupancy: 3, house rules: No pets, minimum nights: 14\n\nNumber of people = 1\nTotal cost = 1961 + 86 + 70 = 2,117\nAccommodation minimum nights:  1/14\n\nDays: 2,\nCurrent City: Evansville (Indiana),\nTransportation: -,\nBreakfast: J. Christopher's, Evansville (Indiana), cost: 39, cuisines: \u201cTea, Cafe, Desserts, Seafood\u201d\nAttraction: Mesker Park Zoo, Evansville (Indiana); Evansville Museum, Evansville (Indiana);\nLunch: Punjabi Restaurant, Evansville (Indiana), cost: 29, cuisines: \u201cCafe, Bakery, Desserts, Fast Food\u201d\nDinner: Twist of Italy, Evansville (Indiana), cost: 85, cuisines: \u201cDesserts, Pizza, Mexican, Mediterranean, Seafood\u201d\nAccommodation: *Lovely Apt In Heart Of Park Slope*, Evansville (Indiana), cost: 70, maximum occupancy: 3, house rules: No pets, minimum nights: 14\n\nNumber of people = 1\nTotal cost = 39 + 29 + 85 + 70 = 223\nAccommodation minimum nights:  2/14\n\nDays: 3,\nCurrent City: from Evansville (Indiana) to South Bend (Indiana),\nTransportation: Taxi, from Evansville to South Bend, duration: 5 hours 1 min, distance: 512 km, cost: 512\nBreakfast: McDonald's, Evansville (Indiana), cost: 84, cuisines: \u201cTea, Bakery, BBQ, Indian, Seafood\u201d\nAttraction: -,\nLunch: -,\nDinner: Madaan Confectionery, South Bend (Indiana), cost: 62, cuisines: \u201cTea, Cafe, BBQ, Seafood\u201d\nAccommodation: Just Right in Lovely Greenpoint, South Bend (Indiana), cost: 614, maximum occupancy: 1, house rules: No smoking & No visitors, minimum nights: 7\n\nNumber of people = 1\nTotal cost = 512 + 84 + 62 + 614 = 1,272\nAccommodation minimum nights:  1/7\n\nDays: 4,\nCurrent City: South Bend (Indiana),\nTransportation: -,\nBreakfast: Krips Restaurant, South Bend (Indiana), cost: 59, cuisines: \u201cTea, Mediterranean, Fast Food\u201d\nAttraction: Studebaker National Museum, South Bend (Indiana); Potawatomi Zoo, South Bend (Indiana);\nLunch: It\u6f74\u7c79 Sinful, South Bend (Indiana), cost: 26, cuisines: \u201cDesserts, French, BBQ, Bakery, Seafood\u201d\nDinner: MOB Brewpub, South Bend (Indiana), cost: 67, cuisines: \u201cCafe, Mexican, American, BBQ\u201d\nAccommodation: Just Right in Lovely Greenpoint, South Bend (Indiana), cost: 614, maximum occupancy: 1, house rules: No smoking & No visitors, minimum nights: 7\n\nNumber of people = 1\nTotal cost = 59 + 26 + 67 + 614 = 766\nAccommodation minimum nights:  2/7\n\nDays: 5,\nCurrent City: from South Bend (Indiana) to Key West,\nTransportation: Taxi, from South Bend to Key West, duration: 22 hours 38 mins, distance: 2,406 km, cost: 2406\nBreakfast: Roadhouse Cafe, South Bend (Indiana), cost: 24, cuisines: \u201cDesserts, Pizza, Bakery, Fast Food, Chinese\u201d\nAttraction: -,\nLunch: -,\nDinner: -,\nAccommodation: -\n\nNumber of people = 1\nTotal cost = 2406 + 24 = 2,430\n\nTotal cost across all days = 2,117 + 223 + 1,272 + 766 + 2,430 = 6,808\n\nUnfortunately, the total cost of the travel plan ($6,808) exceeds the specified budget of $2,000. Additionally, the minimum nights for accommodations in Evansville and South Bend exceed the duration of the stay, which is not feasible within the travel dates. Therefore, this travel plan is not valid and needs to be adjusted to meet the budget and constraints.", "gpt-4-1106-preview_direct_sole-planning_parsed_results": [{"day": 1, "current_city": "from Key West to Evansville", "transportation": "Taxi, from Key West to Evansville, duration: 18 hours 21 mins, distance: 1,961 km", "breakfast": "-", "attraction": "-", "lunch": "-", "dinner": "Blue Orchid Thai Restaurant, Evansville", "accommodation": "*Lovely Apt In Heart Of Park Slope*, Evansville"}, {"day": 2, "current_city": "Evansville", "transportation": "-", "breakfast": "J. Christopher's, Evansville", "attraction": "Mesker Park Zoo, Evansville;Evansville Museum, Evansville;", "lunch": "Punjabi Restaurant, Evansville", "dinner": "Twist of Italy, Evansville", "accommodation": "*Lovely Apt In Heart Of Park Slope*, Evansville"}, {"day": 3, "current_city": "from Evansville to South Bend", "transportation": "Taxi, from Evansville to South Bend, duration: 5 hours 1 min, distance: 512 km", "breakfast": "McDonald's, Evansville", "attraction": "-", "lunch": "-", "dinner": "Madaan Confectionery, South Bend", "accommodation": "Just Right in Lovely Greenpoint, South Bend"}, {"day": 4, "current_city": "South Bend", "transportation": "-", "breakfast": "Krips Restaurant, South Bend", "attraction": "Studebaker National Museum, South Bend;Potawatomi Zoo, South Bend;", "lunch": "It\u6f74\u7c79 Sinful, South Bend", "dinner": "MOB Brewpub, South Bend", "accommodation": "Just Right in Lovely Greenpoint, South Bend"}, {"day": 5, "current_city": "from South Bend to Key West", "transportation": "Taxi, from South Bend to Key West, duration: 22 hours 38 mins, distance: 2,406 km", "breakfast": "Roadhouse Cafe, South Bend", "attraction": "-", "lunch": "-", "dinner": "-", "accommodation": "-"}]}]