[{"gpt-4-1106-preview_direct_sole-planning_results": "Travel Plan:\n\nDays: 1,\nCurrent City: from Harrisburg to Wichita Falls (Texas),\nTransportation: Self-driving, from Harrisburg to Wichita Falls, duration: 20 hours 58 mins, distance: 2,283 km, cost: 114\nBreakfast: -,\nAttraction: -,\nLunch: -,\nDinner: Mama's Boy Restaurant, Wichita Falls (Texas), cost: 25, cuisines: \u201cBakery, BBQ\u201d\nAccommodation: Small, Cozy 1BD Apartment, Wichita Falls (Texas), cost: 712, room type: Entire home/apt, house rules: No parties & No smoking & No children under 10, minimum nights: 3, maximum occupancy: 7\n\nNumber of people = 2\nTotal cost = 114 * 2 + 25 * 2 + 712 = 990\nAccommodation minimum nights:  1/3\n\nDays: 2,\nCurrent City: Wichita Falls (Texas),\nTransportation: -,\nBreakfast: The Coffee Bean & Tea Leaf, Wichita Falls (Texas), cost: 21, cuisines: \u201cChinese, Bakery, Desserts\u201d\nAttraction: Museum of North Texas History, Wichita Falls (Texas); River Bend Nature Center, Wichita Falls (Texas);\nLunch: Made In Punjab, Wichita Falls (Texas), cost: 37, cuisines: \u201cFrench, Bakery, Seafood\u201d\nDinner: Tyre Patty, Wichita Falls (Texas), cost: 92, cuisines: \u201cPizza, BBQ, Bakery, Chinese, American, Seafood\u201d\nAccommodation: Small, Cozy 1BD Apartment, Wichita Falls (Texas), cost: 712, room type: Entire home/apt, house rules: No parties & No smoking & No children under 10, minimum nights: 3, maximum occupancy: 7\n\nNumber of people = 2\nTotal cost = (21 + 37 + 92) * 2 + 712 = 1012\nAccommodation minimum nights:  2/3\n\nDays: 3,\nCurrent City: Wichita Falls (Texas),\nTransportation: -,\nBreakfast: Platform Nine and Three Quarters, Wichita Falls (Texas), cost: 99, cuisines: \u201cChinese, Bakery, BBQ\u201d\nAttraction: The World's Littlest Skyscraper, Wichita Falls (Texas); Lucy Park, Wichita Falls (Texas);\nLunch: Hunger Strike, Wichita Falls (Texas), cost: 32, cuisines: \u201cDesserts, Tea, BBQ, Indian, Seafood\u201d\nDinner: Cafe Coffee Day, Wichita Falls (Texas), cost: 93, cuisines: \u201cDesserts, Pizza, Italian, BBQ, Mediterranean, Seafood\u201d\nAccommodation: Small, Cozy 1BD Apartment, Wichita Falls (Texas), cost: 712, room type: Entire home/apt, house rules: No parties & No smoking & No children under 10, minimum nights: 3, maximum occupancy: 7\n\nNumber of people = 2\nTotal cost = (99 + 32 + 93) * 2 + 712 = 1160\nAccommodation minimum nights:  3/3 (Done!)\n\nDays: 4,\nCurrent City: from Wichita Falls (Texas) to Waco (Texas),\nTransportation: Self-driving, from Wichita Falls to Waco, duration: 3 hours 2 mins, distance: 327 km, cost: 16\nBreakfast: -,\nAttraction: Dr Pepper Museum, Waco (Texas); Cameron Park Zoo, Waco (Texas);\nLunch: Blue House Cafe, Waco (Texas), cost: 55, cuisines: \u201cTea, Pizza, Mexican, Cafe, Seafood\u201d\nDinner: Fork, Waco (Texas), cost: 58, cuisines: \u201cTea, French, Mediterranean, Seafood\u201d\nAccommodation: Sunny room in the heart of Williamsburg, Waco (Texas), cost: 168, room type: Private room, house rules: No parties & No pets & No smoking, minimum nights: 4, maximum occupancy: 2\n\nNumber of people = 2\nTotal cost = 16 * 2 + (55 + 58) * 2 + 168 = 426\nAccommodation minimum nights:  1/4\n\nDays: 5,\nCurrent City: Waco (Texas),\nTransportation: -,\nBreakfast: First Gear Cafe, Waco (Texas), cost: 76, cuisines: \u201cDesserts, Tea, Fast Food, Chinese, Seafood\u201d\nAttraction: Waco Mammoth National Monument, Waco (Texas); Mayborn Museum Complex, Waco (Texas);\nLunch: Punjabi Rasoi, Waco (Texas), cost: 70, cuisines: \u201cFast Food, Cafe, Bakery, Seafood\u201d\nDinner: Singh Terrace Grill, Waco (Texas), cost: 72, cuisines: \u201cDesserts, Tea, French, Bakery, Fast Food\u201d\nAccommodation: Sunny room in the heart of Williamsburg, Waco (Texas), cost: 168, room type: Private room, house rules: No parties & No pets & No smoking, minimum nights: 4, maximum occupancy: 2\n\nNumber of people = 2\nTotal cost = (76 + 70 + 72) * 2 + 168 = 732\nAccommodation minimum nights:  2/4\n\nDays: 6,\nCurrent City: from Waco (Texas) to Houston (Texas),\nTransportation: Self-driving, from Waco to Houston, duration: 2 hours 50 mins, distance: 298 km, cost: 14\nBreakfast: -,\nAttraction: Space Center Houston, Houston (Texas); Houston Museum of Natural Science, Houston (Texas);\nLunch: Jalapenos, Houston (Texas), cost: 57, cuisines: \u201cDesserts, Tea, Cafe, Chinese, Seafood\u201d\nDinner: Matchbox, Houston (Texas), cost: 33, cuisines: \u201cTea, Italian, Bakery, Fast Food, Seafood\u201d\nAccommodation: Sunny and Airy near Manhattan, Houston (Texas), cost: 499, room type: Entire home/apt, house rules: No pets, minimum nights: 2, maximum occupancy: 4\n\nNumber of people = 2\nTotal cost = 14 * 2 + (57 + 33) * 2 + 499 = 710\nAccommodation minimum nights:  1/2\n\nDays: 7,\nCurrent City: from Houston to Harrisburg,\nTransportation: Self-driving, from Houston to Harrisburg, duration: 21 hours 16 mins, distance: 2,353 km, cost: 117\nBreakfast: -,\nAttraction: -,\nLunch: -,\nDinner: -,\nAccommodation: -\n\nNumber of people = 2\nTotal cost = 117 * 2 = 234\n\nTotal cost across all days = 990 + 1012 + 1160 + 426 + 732 + 710 + 234 = 5264\n\nUnfortunately, the total cost exceeds the budget of $4,100. To adjust the plan within the budget, we may need to consider cheaper accommodation options or dining options, or potentially remove a city from the itinerary.", "gpt-4-1106-preview_direct_sole-planning_parsed_results": [{"day": 1, "current_city": "from Harrisburg to Wichita Falls", "transportation": "Self-driving, from Harrisburg to Wichita Falls, duration: 20 hours 58 mins, distance: 2,283 km", "breakfast": "-", "attraction": "-", "lunch": "-", "dinner": "Mama's Boy Restaurant, Wichita Falls", "accommodation": "Small, Cozy 1BD Apartment, Wichita Falls"}, {"day": 2, "current_city": "Wichita Falls", "transportation": "-", "breakfast": "The Coffee Bean & Tea Leaf, Wichita Falls", "attraction": "Museum of North Texas History, Wichita Falls;River Bend Nature Center, Wichita Falls;", "lunch": "Made In Punjab, Wichita Falls", "dinner": "Tyre Patty, Wichita Falls", "accommodation": "Small, Cozy 1BD Apartment, Wichita Falls"}, {"day": 3, "current_city": "Wichita Falls", "transportation": "-", "breakfast": "Platform Nine and Three Quarters, Wichita Falls", "attraction": "The World's Littlest Skyscraper, Wichita Falls;Lucy Park, Wichita Falls;", "lunch": "Hunger Strike, Wichita Falls", "dinner": "Cafe Coffee Day, Wichita Falls", "accommodation": "Small, Cozy 1BD Apartment, Wichita Falls"}, {"day": 4, "current_city": "from Wichita Falls to Waco", "transportation": "Self-driving, from Wichita Falls to Waco, duration: 3 hours 2 mins, distance: 327 km", "breakfast": "-", "attraction": "Dr Pepper Museum, Waco;Cameron Park Zoo, Waco;", "lunch": "Blue House Cafe, Waco", "dinner": "Fork, Waco", "accommodation": "Sunny room in the heart of Williamsburg, Waco"}, {"day": 5, "current_city": "Waco", "transportation": "-", "breakfast": "First Gear Cafe, Waco", "attraction": "Waco Mammoth National Monument, Waco;Mayborn Museum Complex, Waco;", "lunch": "Punjabi Rasoi, Waco", "dinner": "Singh Terrace Grill, Waco", "accommodation": "Sunny room in the heart of Williamsburg, Waco"}, {"day": 6, "current_city": "from Waco to Houston", "transportation": "Self-driving, from Waco to Houston, duration: 2 hours 50 mins, distance: 298 km", "breakfast": "-", "attraction": "Space Center Houston, Houston;Houston Museum of Natural Science, Houston;", "lunch": "Jalapenos, Houston", "dinner": "Matchbox, Houston", "accommodation": "Sunny and Airy near Manhattan, Houston"}, {"day": 7, "current_city": "from Houston to Harrisburg", "transportation": "Self-driving, from Houston to Harrisburg, duration: 21 hours 16 mins, distance: 2,353 km", "breakfast": "-", "attraction": "-", "lunch": "-", "dinner": "-", "accommodation": "-"}]}]