[{"gpt-4-1106-preview_direct_sole-planning_results": "Travel Plan:\nDays: 1,\nCurrent City: from Richmond to Nashville (Tennessee),\nTransportation: Self-driving, from Richmond to Nashville, duration: 9 hours 3 mins, distance: 989 km, cost: 49\nBreakfast: -,\nAttraction: -,\nLunch: -,\nDinner: Bangkok, Nashville (Tennessee), cost: 44, cuisines: \u201cCafe, Seafood\u201d\nAccommodation: Huge 2 Bedroom, Great Location, Express Metro, Nashville (Tennessee), cost: 745, room type: Entire home/apt, house rules: No smoking & No children under 10 & No pets, minimum nights: 4, maximum occupancy: 4\n\nNumber of people = 1 (since the query does not specify the number of travelers, I will assume it is for 1 person)\nTotal cost = 49 + 44 + 745 = 838\nAccommodation minimum nights: 1/4\n\nDays: 2,\nCurrent City: Nashville (Tennessee),\nTransportation: -,\nBreakfast: Bablu Fast Food, Nashville (Tennessee), cost: 13, cuisines: \u201cDesserts, Pizza, Mexican, BBQ, Fast Food\u201d\nAttraction: Country Music Hall of Fame and Museum, Nashville (Tennessee); Nashville Zoo at Grassmere, Nashville (Tennessee);\nLunch: Veg Hut, Nashville (Tennessee), cost: 35, cuisines: \u201cTea, Mexican, Seafood\u201d\nDinner: Smoke House Deli, Nashville (Tennessee), cost: 59, cuisines: \u201cCafe, Mediterranean, Seafood\u201d\nAccommodation: Huge 2 Bedroom, Great Location, Express Metro, Nashville (Tennessee), cost: 745, room type: Entire home/apt, house rules: No smoking & No children under 10 & No pets, minimum nights: 4, maximum occupancy: 4\n\nTotal cost = 13 + 35 + 59 + 745 = 852\nAccommodation minimum nights: 2/4\n\nDays: 3,\nCurrent City: from Nashville (Tennessee) to Knoxville (Tennessee),\nTransportation: Self-driving, from Nashville to Knoxville, duration: 2 hours 42 mins, distance: 290 km, cost: 14\nBreakfast: Kitchen King, Nashville (Tennessee), cost: 13, cuisines: \u201cPizza, Italian, BBQ, Cafe, Mediterranean\u201d\nAttraction: World's Fair Park, Knoxville (Tennessee); Knoxville Museum of Art, Knoxville (Tennessee);\nLunch: Cafe Arabelle, Knoxville (Tennessee), cost: 29, cuisines: \u201cFrench, BBQ, Desserts, Seafood\u201d\nDinner: Les 3 Brasseurs, Knoxville (Tennessee), cost: 24, cuisines: \u201cDesserts, Pizza, Italian, Cafe, Indian\u201d\nAccommodation: Cozy Private Room in Chinatown/ Lower East Side, Knoxville (Tennessee), cost: 132, room type: Private room, house rules: No pets & No visitors, minimum nights: 7, maximum occupancy: 2\n\nTotal cost = 14 + 13 + 29 + 24 + 132 = 212\nAccommodation minimum nights: 1/7\n\nDays: 4,\nCurrent City: Knoxville (Tennessee),\nTransportation: -,\nBreakfast: Cafe Coffee Day, Knoxville (Tennessee), cost: 82, cuisines: \u201cFast Food, American, BBQ, Italian\u201d\nAttraction: Sunsphere, Knoxville (Tennessee); Ijams Nature Center, Knoxville (Tennessee);\nLunch: Mamagoto, Knoxville (Tennessee), cost: 14, cuisines: \u201cIndian, Mediterranean, Desserts, Seafood\u201d\nDinner: Ali Baba & 41 Dishes, Knoxville (Tennessee), cost: 70, cuisines: \u201cPizza, Desserts, Fast Food\u201d\nAccommodation: Cozy Private Room in Chinatown/ Lower East Side, Knoxville (Tennessee), cost: 132, room type: Private room, house rules: No pets & No visitors, minimum nights: 7, maximum occupancy: 2\n\nTotal cost = 82 + 14 + 70 + 132 = 298\nAccommodation minimum nights: 2/7\n\nDays: 5,\nCurrent City: from Knoxville (Tennessee) to Richmond,\nTransportation: Self-driving, from Knoxville to Richmond, duration: 6 hours 23 mins, distance: 701 km, cost: 35\nBreakfast: -,\nAttraction: -,\nLunch: -,\nDinner: -,\nAccommodation: -\n\nTotal cost = 35\n\nTotal cost across all days = 838 + 852 + 212 + 298 + 35 = 2235\n\nRemaining budget = 2600 - 2235 = 365\n\nAll attractions, restaurants, and accommodations are in the correct cities as per the day's itinerary. The travel plan includes a mix of cuisines and adheres to the house rules specified for accommodations. The transportation method is consistent (self-driving) and the plan is within the specified budget.", "gpt-4-1106-preview_direct_sole-planning_parsed_results": [{"day": 1, "current_city": "from Richmond to Nashville", "transportation": "Self-driving, from Richmond to Nashville, duration: 9 hours 3 mins, distance: 989 km", "breakfast": "-", "attraction": "-", "lunch": "-", "dinner": "Bangkok, Nashville", "accommodation": "Huge 2 Bedroom, Great Location, Express Metro, Nashville"}, {"day": 2, "current_city": "Nashville", "transportation": "-", "breakfast": "Bablu Fast Food, Nashville", "attraction": "Country Music Hall of Fame and Museum, Nashville;Nashville Zoo at Grassmere, Nashville;", "lunch": "Veg Hut, Nashville", "dinner": "Smoke House Deli, Nashville", "accommodation": "Huge 2 Bedroom, Great Location, Express Metro, Nashville"}, {"day": 3, "current_city": "from Nashville to Knoxville", "transportation": "Self-driving, from Nashville to Knoxville, duration: 2 hours 42 mins, distance: 290 km", "breakfast": "Kitchen King, Nashville", "attraction": "World's Fair Park, Knoxville;Knoxville Museum of Art, Knoxville;", "lunch": "Cafe Arabelle, Knoxville", "dinner": "Les 3 Brasseurs, Knoxville", "accommodation": "Cozy Private Room in Chinatown/ Lower East Side, Knoxville"}, {"day": 4, "current_city": "Knoxville", "transportation": "-", "breakfast": "Cafe Coffee Day, Knoxville", "attraction": "Sunsphere, Knoxville;Ijams Nature Center, Knoxville;", "lunch": "Mamagoto, Knoxville", "dinner": "Ali Baba & 41 Dishes, Knoxville", "accommodation": "Cozy Private Room in Chinatown/ Lower East Side, Knoxville"}, {"day": 5, "current_city": "from Knoxville to Richmond", "transportation": "Self-driving, from Knoxville to Richmond, duration: 6 hours 23 mins, distance: 701 km", "breakfast": "-", "attraction": "-", "lunch": "-", "dinner": "-", "accommodation": "-"}]}]