[{"gpt-4-1106-preview_direct_sole-planning_results": "Travel Plan:\nDays: 1,\nCurrent City: from Manchester to Charlotte,\nTransportation: Flight Number: F3785421, from Manchester to Charlotte, Departure Time: 14:16, Arrival Time: 16:46, cost: 223\nBreakfast: -,\nAttraction: -,\nLunch: -,\nDinner: Olive Tree Cafe, Charlotte, cost: 23, cuisines: \u201cTea, Chinese, Desserts\u201d\nAccommodation: Elegant Studio Apt in Prospect Heights, Charlotte, cost: 640, room type: Entire home/apt, house rules: No parties, maximum occupancy: 5, minimum nights: 2\n\nNumber of people = 5\nTotal cost = (223 * 5) + (23 * 5) + 640 = 2,755\nAccommodation minimum nights:  1/2\n\nDays: 2,\nCurrent City: Charlotte,\nTransportation: -,\nBreakfast: Central Perk 7, Charlotte, cost: 87, cuisines: \u201cPizza, Bakery, BBQ, Fast Food\u201d\nAttraction: Freedom Park, Charlotte; Levine Museum of the New South, Charlotte; Discovery Place Science, Charlotte,\nLunch: Subway, Charlotte, cost: 60, cuisines: \u201cTea, Cafe, Mexican, Chinese, Seafood\u201d\nDinner: Cafe Maple Street, Charlotte, cost: 91, cuisines: \u201cFast Food, Tea, Italian\u201d\nAccommodation: Elegant Studio Apt in Prospect Heights, Charlotte, cost: 640, room type: Entire home/apt, house rules: No parties, maximum occupancy: 5, minimum nights: 2\n\nNumber of people = 5\nTotal cost = (87 + 60 + 91) * 5 + 640 = 2,240\nAccommodation minimum nights:  2/2 (Done!)\n\nDays: 3,\nCurrent City: from Charlotte to Manchester,\nTransportation: Flight Number: F3785397, from Charlotte to Manchester, Departure Time: 11:21, Arrival Time: 13:22, cost: 284\nBreakfast: -,\nAttraction: -,\nLunch: -,\nDinner: -,\nAccommodation: -\n\nNumber of people = 5\nTotal cost = 284 * 5 = 1,420\n\nTotal cost across all days = 2,755 + 2,240 + 1,420 = 6,415\n\nUnfortunately, the total cost exceeds the budget of $4,800. Adjustments need to be made to ensure the total cost does not exceed the budget. Here is a revised plan that fits within the budget:\n\nRevised Travel Plan:\nDays: 1,\nCurrent City: from Manchester to Charlotte,\nTransportation: Flight Number: F3785421, from Manchester to Charlotte, Departure Time: 14:16, Arrival Time: 16:46, cost: 223\nBreakfast: -,\nAttraction: -,\nLunch: -,\nDinner: Olive Tree Cafe, Charlotte, cost: 23, cuisines: \u201cTea, Chinese, Desserts\u201d\nAccommodation: Two Bedrooms with Dedicated Bath, Charlotte, cost: 615, room type: Private room, house rules: No visitors & No pets, maximum occupancy: 2, minimum nights: 3\n\nNumber of people = 5\nTotal cost = (223 * 5) + (23 * 5) + (615 * 3) = 3,400\nAccommodation minimum nights:  1/3\n\nDays: 2,\nCurrent City: Charlotte,\nTransportation: -,\nBreakfast: Central Perk 7, Charlotte, cost: 87, cuisines: \u201cPizza, Bakery, BBQ, Fast Food\u201d\nAttraction: Freedom Park, Charlotte; Levine Museum of the New South, Charlotte; Discovery Place Science, Charlotte,\nLunch: Subway, Charlotte, cost: 60, cuisines: \u201cTea, Cafe, Mexican, Chinese, Seafood\u201d\nDinner: Cafe Maple Street, Charlotte, cost: 91, cuisines: \u201cFast Food, Tea, Italian\u201d\nAccommodation: Two Bedrooms with Dedicated Bath, Charlotte, cost: 615, room type: Private room, house rules: No visitors & No pets, maximum occupancy: 2, minimum nights: 3\n\nNumber of people = 5\nTotal cost = (87 + 60 + 91) * 5 + 615 = 1,615\nAccommodation minimum nights:  2/3\n\nDays: 3,\nCurrent City: from Charlotte to Manchester,\nTransportation: Flight Number: F3785397, from Charlotte to Manchester, Departure Time: 11:21, Arrival Time: 13:22, cost: 284\nBreakfast: -,\nAttraction: -,\nLunch: -,\nDinner: -,\nAccommodation: -\n\nNumber of people = 5\nTotal cost = 284 * 5 = 1,420\n\nTotal revised cost across all days = 3,400 + 1,615 + 1,420 = 6,435\n\nThe revised plan still exceeds the budget. To fit within the budget, we may need to choose a less expensive accommodation or adjust meal plans. However, since the provided data does not include cheaper accommodation options or meal costs, further adjustments cannot be made without additional information.", "gpt-4-1106-preview_direct_sole-planning_parsed_results": [{"day": 1, "current_city": "from Manchester to Charlotte", "transportation": "Flight Number: F3785421, from Manchester to Charlotte, Departure Time: 14:16, Arrival Time: 16:46", "breakfast": "-", "attraction": "-", "lunch": "-", "dinner": "Olive Tree Cafe, Charlotte", "accommodation": "Two Bedrooms with Dedicated Bath, Charlotte"}, {"day": 2, "current_city": "Charlotte", "transportation": "-", "breakfast": "Central Perk 7, Charlotte", "attraction": "Freedom Park, Charlotte;Levine Museum of the New South, Charlotte;Discovery Place Science, Charlotte;", "lunch": "Subway, Charlotte", "dinner": "Cafe Maple Street, Charlotte", "accommodation": "Two Bedrooms with Dedicated Bath, Charlotte"}, {"day": 3, "current_city": "from Charlotte to Manchester", "transportation": "Flight Number: F3785397, from Charlotte to Manchester, Departure Time: 11:21, Arrival Time: 13:22", "breakfast": "-", "attraction": "-", "lunch": "-", "dinner": "-", "accommodation": "-"}]}]