[{"gpt-4-1106-preview_direct_sole-planning_results": "Travel Plan:\nDays: 1,\nCurrent City: from Denver to Palm Springs,\nTransportation: Flight Number: F3880999, from Denver to Palm Springs, Departure Time: 11:16, Arrival Time: 12:28, cost: 227\nBreakfast: -,\nAttraction: -,\nLunch: -,\nDinner: Bar Gernika Basque Pub & Eatery, Palm Springs, cost: 50, cuisines: \u201cTea, Pizza, Desserts, Fast Food\u201d\nAccommodation: Brooklyn Gem, Palm Springs, cost: 877, room type: Entire home/apt, house rules: No children under 10, minimum nights: 2, maximum occupancy: 4\n\nNumber of people = 1\nTotal cost = 227 + 50 + 877 = 1,154\nAccommodation minimum nights:  1/2\n\nDays: 2,\nCurrent City: Palm Springs,\nTransportation: -,\nBreakfast: Kahill's Steak-Fish Chophouse, Palm Springs, cost: 38, cuisines: \u201cCafe, Bakery, American\u201d\nAttraction: Palm Springs Art Museum, Palm Springs; Walk of the Stars Palm Springs, Palm Springs;,\nLunch: Houndstooth Grill & Tavern, Palm Springs, cost: 47, cuisines: \u201cTea, Pizza, BBQ, Mediterranean\u201d\nDinner: Hao Ming, Palm Springs, cost: 29, cuisines: \u201cTea, Cafe, Desserts, Fast Food\u201d\nAccommodation: Brooklyn Gem, Palm Springs, cost: 877, room type: Entire home/apt, house rules: No children under 10, minimum nights: 2, maximum occupancy: 4\n\nNumber of people = 1\nTotal cost = 38 + 47 + 29 + 877 = 991\nAccommodation minimum nights:  2/2 (Done!)\n\nDays: 3,\nCurrent City: from Palm Springs to Denver,\nTransportation: Flight Number: F3870469, from Palm Springs to Denver, Departure Time: 16:00, Arrival Time: 19:12, cost: 330\nBreakfast: Sugar & Spice - Le Marche, Palm Springs, cost: 33, cuisines: \u201cTea, French, Cafe\u201d\nAttraction: Moorten Botanical Garden, Palm Springs; Palm Springs Aerial Tramway, Palm Springs;,\nLunch: -,\nDinner: -,\nAccommodation: -\n\nNumber of people = 1\nTotal cost = 330 + 33 = 363\n\nTotal cost across all days = 1,154 + 991 + 363 = 2,508\n\nUnfortunately, the total cost exceeds the budget of $2,200. To adjust the plan within the budget, we can change the accommodation to a less expensive option:\n\nRevised Accommodation for Days 1 and 2:\nAccommodation: Gorgeous 1BR brownstone in Harlem close to trains, Palm Springs, cost: 430, room type: Entire home/apt, house rules: No visitors & No pets, minimum nights: 1, maximum occupancy: 3\n\nRevised Total cost for Days 1 and 2 = 227 + 50 + 430 = 707\nRevised Total cost for Day 2 = 38 + 47 + 29 + 430 = 544\n\nRevised Total cost across all days = 707 + 544 + 363 = 1,614\n\nCuisines: No specific cuisines were requested, so all cuisine constraints are satisfied.\nHouse rules: The chosen accommodation allows for a single person and meets the house rules.\n\n***** Travel Plan Ends *****", "gpt-4-1106-preview_direct_sole-planning_parsed_results": [{"day": 1, "current_city": "from Denver to Palm Springs", "transportation": "Flight Number: F3880999, from Denver to Palm Springs, Departure Time: 11:16, Arrival Time: 12:28", "breakfast": "-", "attraction": "-", "lunch": "-", "dinner": "Bar Gernika Basque Pub & Eatery, Palm Springs", "accommodation": "Gorgeous 1BR brownstone in Harlem close to trains, Palm Springs"}, {"day": 2, "current_city": "Palm Springs", "transportation": "-", "breakfast": "Kahill's Steak-Fish Chophouse, Palm Springs", "attraction": "Palm Springs Art Museum, Palm Springs;Walk of the Stars Palm Springs, Palm Springs;", "lunch": "Houndstooth Grill & Tavern, Palm Springs", "dinner": "Hao Ming, Palm Springs", "accommodation": "Gorgeous 1BR brownstone in Harlem close to trains, Palm Springs"}, {"day": 3, "current_city": "from Palm Springs to Denver", "transportation": "Flight Number: F3870469, from Palm Springs to Denver, Departure Time: 16:00, Arrival Time: 19:12", "breakfast": "Sugar & Spice - Le Marche, Palm Springs", "attraction": "Moorten Botanical Garden, Palm Springs;Palm Springs Aerial Tramway, Palm Springs;", "lunch": "-", "dinner": "-", "accommodation": "-"}]}]