[{"gpt-4-1106-preview_direct_sole-planning_results": "Travel Plan:\n\nDays: 1,\nCurrent City: from Cleveland to Fort Myers (Florida),\nTransportation: Flight Number: F3915178, from Cleveland to Fort Myers (Florida), Departure Time: 06:40, Arrival Time: 09:22, cost: 316\nBreakfast: -,\nAttraction: Edison & Ford Winter Estates, Fort Myers (Florida),\nLunch: The Refinery, Fort Myers (Florida), cost: 22, cuisines: \u201cBakery, Indian, Seafood\u201d\nDinner: Al Mukhtar Bakery, Fort Myers (Florida), cost: 54, cuisines: \u201cBBQ, Tea, American, Desserts\u201d\nAccommodation: Quiet and beautiful apartment near central park, Fort Myers (Florida), cost: 930, room type: Entire home/apt, house rules: No parties & No smoking, minimum nights: 7, pet-friendly: Yes\n\nNumber of people = 6\nTotal cost = 316 * 6 + (22 + 54) * 6 + 930 = 3,804\nAccommodation minimum nights: 1/7\n\nDays: 2,\nCurrent City: Fort Myers (Florida),\nTransportation: -,\nBreakfast: Haunted, Fort Myers (Florida), cost: 50, cuisines: \u201cDesserts, French, Fast Food, Cafe, Seafood\u201d\nAttraction: Six Mile Cypress Slough Preserve, Fort Myers (Florida),\nLunch: Maachh Bhaat, Fort Myers (Florida), cost: 66, cuisines: \u201cDesserts, Pizza, Fast Food, Mediterranean, Seafood\u201d\nDinner: Kujay's Spoon, Fort Myers (Florida), cost: 88, cuisines: \u201cPizza, Mexican, Bakery, Cafe, Mediterranean, Seafood\u201d\nAccommodation: Quiet and beautiful apartment near central park, Fort Myers (Florida), cost: 930, room type: Entire home/apt, house rules: No parties & No smoking, minimum nights: 7, pet-friendly: Yes\n\nNumber of people = 6\nTotal cost = (50 + 66 + 88) * 6 + 930 = 2,844\nAccommodation minimum nights: 2/7\n\nDays: 3,\nCurrent City: from Fort Myers (Florida) to Tampa (Florida),\nTransportation: Taxi, from Fort Myers (Florida) to Tampa (Florida), duration: 1 hour 58 mins, distance: 204 km, cost: 204\nBreakfast: Eggers Madhouse, Fort Myers (Florida), cost: 76, cuisines: \u201cBBQ, Mediterranean, Seafood\u201d\nAttraction: The Florida Aquarium, Tampa (Florida),\nLunch: Kobe Hibachi & Sushi, Tampa (Florida), cost: 63, cuisines: \u201cDesserts, French, BBQ, Bakery, Seafood\u201d\nDinner: Peg Leg Pete's, Tampa (Florida), cost: 91, cuisines: \u201cFrench, Bakery, Cafe\u201d\nAccommodation: Bright duplex apartment, Tampa (Florida), cost: 164, room type: Entire home/apt, house rules: No children under 10, minimum nights: 2, pet-friendly: Yes\n\nNumber of people = 6\nTotal cost = 204 * 6 + (76 + 63 + 91) * 6 + 164 = 2,802\nAccommodation minimum nights: 1/2\n\nDays: 4,\nCurrent City: Tampa (Florida),\nTransportation: -,\nBreakfast: Lalit Kathi Rolls Momos, Tampa (Florida), cost: 23, cuisines: \u201cTea, Pizza, Fast Food\u201d\nAttraction: Busch Gardens Tampa Bay, Tampa (Florida),\nLunch: Uptown Fresh Beer Cafe, Tampa (Florida), cost: 61, cuisines: \u201cPizza, Mexican, BBQ, Cafe, Seafood\u201d\nDinner: Aahar, Tampa (Florida), cost: 52, cuisines: \u201cTea, Pizza, Desserts, Fast Food\u201d\nAccommodation: Bright duplex apartment, Tampa (Florida), cost: 164, room type: Entire home/apt, house rules: No children under 10, minimum nights: 2, pet-friendly: Yes\n\nNumber of people = 6\nTotal cost = (23 + 61 + 52) * 6 + 164 = 1,656\nAccommodation minimum nights: 2/2 (Done!)\n\nDays: 5,\nCurrent City: from Tampa (Florida) to Cleveland,\nTransportation: Flight Number: F3560049, from Tampa (Florida) to Cleveland, Departure Time: 08:53, Arrival Time: 11:22, cost: 211\nBreakfast: Gallery Caf\u6106 - Hyatt Place, Tampa (Florida), cost: 42, cuisines: \u201cTea, French, BBQ, Desserts\u201d\nAttraction: -,\nLunch: -,\nDinner: -,\nAccommodation: -,\n\nNumber of people = 6\nTotal cost = 211 * 6 + 42 * 6 = 1,518\n\nTotal cost across all days = 3,804 + 2,844 + 2,802 + 1,656 + 1,518 = 12,624\nCuisines: The prompt specifies no cuisines, so all cuisine constraints are satisfied.\nHouse rules: All accommodations chosen are pet-friendly and do not disallow pets, meeting the requirement for pet-friendly accommodations.", "gpt-4-1106-preview_direct_sole-planning_parsed_results": [{"day": 1, "current_city": "from Cleveland to Fort Myers (Florida)", "transportation": "Flight Number: F3915178, from Cleveland to Fort Myers (Florida), Departure Time: 06:40, Arrival Time: 09:22", "breakfast": "-", "attraction": "Edison & Ford Winter Estates, Fort Myers (Florida);", "lunch": "The Refinery, Fort Myers (Florida)", "dinner": "Al Mukhtar Bakery, Fort Myers (Florida)", "accommodation": "Quiet and beautiful apartment near central park, Fort Myers (Florida)"}, {"day": 2, "current_city": "Fort Myers (Florida)", "transportation": "-", "breakfast": "Haunted, Fort Myers (Florida)", "attraction": "Six Mile Cypress Slough Preserve, Fort Myers (Florida);", "lunch": "Maachh Bhaat, Fort Myers (Florida)", "dinner": "Kujay's Spoon, Fort Myers (Florida)", "accommodation": "Quiet and beautiful apartment near central park, Fort Myers (Florida)"}, {"day": 3, "current_city": "from Fort Myers (Florida) to Tampa (Florida)", "transportation": "Taxi, from Fort Myers (Florida) to Tampa (Florida), duration: 1 hour 58 mins, distance: 204 km", "breakfast": "Eggers Madhouse, Fort Myers (Florida)", "attraction": "The Florida Aquarium, Tampa (Florida);", "lunch": "Kobe Hibachi & Sushi, Tampa (Florida)", "dinner": "Peg Leg Pete's, Tampa (Florida)", "accommodation": "Bright duplex apartment, Tampa (Florida)"}, {"day": 4, "current_city": "Tampa (Florida)", "transportation": "-", "breakfast": "Lalit Kathi Rolls Momos, Tampa (Florida)", "attraction": "Busch Gardens Tampa Bay, Tampa (Florida);", "lunch": "Uptown Fresh Beer Cafe, Tampa (Florida)", "dinner": "Aahar, Tampa (Florida)", "accommodation": "Bright duplex apartment, Tampa (Florida)"}, {"day": 5, "current_city": "from Tampa (Florida) to Cleveland", "transportation": "Flight Number: F3560049, from Tampa (Florida) to Cleveland, Departure Time: 08:53, Arrival Time: 11:22", "breakfast": "Gallery Caf\u6106 - Hyatt Place, Tampa (Florida)", "attraction": "-", "lunch": "-", "dinner": "-", "accommodation": "-"}]}]