[{"gpt-4-1106-preview_direct_sole-planning_results": "Based on the provided information and constraints, here is a travel plan for a group of 5 people departing from Charlotte to Hilton Head over 3 days, from March 26th to March 28th, 2022, with a preference for Italian and French cuisines and a budget capped at $7,000.\n\n***** Travel Plan *****\n\nDay 1: March 26th, 2022\nCurrent City: from Charlotte to Hilton Head\nTransportation: Self-driving, from Charlotte to Hilton Head, duration: 3 hours 49 mins, distance: 398 km, cost: 19 x 5 = $95\nBreakfast: -\nAttraction: -\nLunch: -\nDinner: Cafe Coffee Day, Hilton Head, cost: 65 x 5 = $325, cuisines: Bakery, BBQ, Italian\nAccommodation: Modern luxury apartment 15 mins to central park!, Hilton Head, cost: 719 x 1 = $719, maximum occupancy: 2, house rules: No pets & No parties, minimum nights: 2\n\nNumber of people: 5\nTotal cost: 95 + 325 + 719 = $1,139\nAccommodation minimum nights: 1/2\n\nDay 2: March 27th, 2022\nCurrent City: Hilton Head\nTransportation: -\nBreakfast: New Town Pastry Shop - Park Plaza, Hilton Head, cost: 51 x 5 = $255, cuisines: Tea, Cafe, Pizza, BBQ\nAttraction: Coastal Discovery Museum, Hilton Head; Harbour Town Lighthouse, Hilton Head\nLunch: The Salad Bowl, Hilton Head, cost: 70 x 5 = $350, cuisines: Cafe, Mexican, BBQ\nDinner: Wrapster, Hilton Head, cost: 18 x 5 = $90, cuisines: French, Seafood, Desserts, Italian\nAccommodation: Modern luxury apartment 15 mins to central park!, Hilton Head, cost: 719 x 1 = $719, maximum occupancy: 2, house rules: No pets & No parties, minimum nights: 2\n\nNumber of people: 5\nTotal cost: 255 + 350 + 90 + 719 = $1,414\nAccommodation minimum nights: 2/2\n\nDay 3: March 28th, 2022\nCurrent City: from Hilton Head to Charlotte\nTransportation: Self-driving from Hilton Head to Charlotte, duration: 3 hours 49 mins, distance: 397 km, cost: 19 x 5 = $95\nBreakfast: MR.D - Deliciousness Delivered, Hilton Head, cost: 18 x 5 = $90, cuisines: Tea, French, Mexican, Fast Food\nAttraction: -\nLunch: -\nDinner: -\nAccommodation: -\n\nNumber of people: 5\nTotal cost: 95 + 90 = $185\n\nTotal cost across all days: 1,139 + 1,414 + 185 = $2,738\nCuisines: Preference for Italian and French cuisines has been met with selected restaurants.\n\n***** End of Travel Plan *****\n\nPlease note that the accommodation chosen has a minimum stay of 2 nights, which fits the travel plan. The total cost of the trip is well within the specified budget of $7,000. All attractions, restaurants, and accommodations are located in Hilton Head, ensuring consistency with the travel plan's destination.", "gpt-4-1106-preview_direct_sole-planning_parsed_results": [{"day": 1, "current_city": "from Charlotte to Hilton Head", "transportation": "Self-driving, from Charlotte to Hilton Head, duration: 3 hours 49 mins, distance: 398 km", "breakfast": "-", "attraction": "-", "lunch": "-", "dinner": "Cafe Coffee Day, Hilton Head", "accommodation": "Modern luxury apartment 15 mins to central park!, Hilton Head"}, {"day": 2, "current_city": "Hilton Head", "transportation": "-", "breakfast": "New Town Pastry Shop - Park Plaza, Hilton Head", "attraction": "Coastal Discovery Museum, Hilton Head;Harbour Town Lighthouse, Hilton Head;", "lunch": "The Salad Bowl, Hilton Head", "dinner": "Wrapster, Hilton Head", "accommodation": "Modern luxury apartment 15 mins to central park!, Hilton Head"}, {"day": 3, "current_city": "from Hilton Head to Charlotte", "transportation": "Self-driving from Hilton Head to Charlotte, duration: 3 hours 49 mins, distance: 397 km", "breakfast": "MR.D - Deliciousness Delivered, Hilton Head", "attraction": "-", "lunch": "-", "dinner": "-", "accommodation": "-"}]}]