[{"gpt-4-1106-preview_direct_sole-planning_results": "Based on the provided information and constraints, here is a tailored 5-day travel plan for two people, departing from Knoxville and visiting Orlando and Miami in Florida from March 20 to March 24, 2022, with a focus on local Chinese and Mediterranean cuisines:\n\n***** Travel Plan *****\n\nDay 1: Knoxville to Orlando (March 20, 2022)\n- Transportation: Flight F3566154 from Knoxville to Orlando, cost: $235 per person\n- Breakfast: -\n- Attraction: -\n- Lunch: -\n- Dinner: Indochi Cafe & Restaurant, Orlando, cost: $72, cuisines: Chinese, Mediterranean\n- Accommodation: Sixth Ave Chelsea, Studio Serviced Apartment, Orlando, cost: $70, room type: Entire home/apt, house rules: No visitors & No pets\n\nNumber of people: 2\nTotal cost: 2 x $235 (flight) + 2 x $72 (dinner) + $70 (accommodation) = $684\nAccommodation minimum nights: 1/30\n\nDay 2: Orlando (March 21, 2022)\n- Transportation: -\n- Breakfast: Fuji Japanese Steakhouse, Orlando, cost: $75, cuisines: Chinese\n- Attraction: The Wheel at ICON Park, Orlando\n- Lunch: Shivani Catering Services, Orlando, cost: $75, cuisines: Chinese, Mediterranean\n- Dinner: Lounge Bakery, Orlando, cost: $31, cuisines: Chinese, Mediterranean\n- Accommodation: Sixth Ave Chelsea, Studio Serviced Apartment, Orlando, cost: $70, room type: Entire home/apt, house rules: No visitors & No pets\n\nNumber of people: 2\nTotal cost: 2 x $75 (breakfast) + 2 x $75 (lunch) + 2 x $31 (dinner) + $70 (accommodation) = $432\nAccommodation minimum nights: 2/30\n\nDay 3: Orlando to Miami (March 22, 2022)\n- Transportation: Flight F3670400 from Orlando to Miami, cost: $58 per person\n- Breakfast: -\n- Attraction: SeaWorld Orlando, Orlando\n- Lunch: Always Eat Green, Orlando, cost: $98, cuisines: Chinese, Mediterranean\n- Dinner: Tako Cheena by Pom Pom, Miami, cost: $60, cuisines: Chinese, Mediterranean\n- Accommodation: King Hotel Room at Wyndham Midtown 45 Resort, Miami, cost: $264, room type: Private room, house rules: No pets & No smoking & No children under 10\n\nNumber of people: 2\nTotal cost: 2 x $58 (flight) + 2 x $98 (lunch) + 2 x $60 (dinner) + $264 (accommodation) = $696\nAccommodation minimum nights: 1/2\n\nDay 4: Miami (March 23, 2022)\n- Transportation: -\n- Breakfast: Papouli's Mediterranean Cafe & Market, Miami, cost: $26, cuisines: Mediterranean\n- Attraction: Jungle Island, Miami\n- Lunch: Spice It - Hotel IBIS, Miami, cost: $38, cuisines: Chinese, Mediterranean\n- Dinner: AB's Absolute Barbecues, Miami, cost: $55, cuisines: Chinese, Mediterranean\n- Accommodation: King Hotel Room at Wyndham Midtown 45 Resort, Miami, cost: $264, room type: Private room, house rules: No pets & No smoking & No children under 10\n\nNumber of people: 2\nTotal cost: 2 x $26 (breakfast) + 2 x $38 (lunch) + 2 x $55 (dinner) + $264 (accommodation) = $502\nAccommodation minimum nights: 2/2\n\nDay 5: Miami to Knoxville (March 24, 2022)\n- Transportation: Flight F3601007 from Miami to Knoxville, cost: $217 per person\n- Breakfast: Shorts Burger and Shine, Miami, cost: $81, cuisines: Chinese\n- Attraction: -\n- Lunch: -\n- Dinner: -\n- Accommodation: -\n\nNumber of people: 2\nTotal cost: 2 x $217 (flight) + 2 x $81 (breakfast) = $596\n\nTotal cost across all days: $684 (Day 1) + $432 (Day 2) + $696 (Day 3) + $502 (Day 4) + $596 (Day 5) = $2,910\n\nCuisines: The plan includes a focus on local Chinese and Mediterranean cuisines as requested.\n\n***** Travel Plan Ends *****\n\nPlease note that the accommodation on Day 1 and Day 2 is the same, as the minimum nights have not been reached. The total cost of the travel plan is within the specified budget of $3,900. All attractions, restaurants, and accommodations are matched to the correct cities and dates, and no restaurant or attraction is repeated. The transportation modes are consistent and adhere to the constraints specified in the query.", "gpt-4-1106-preview_direct_sole-planning_parsed_results": [{"day": 1, "current_city": "from Knoxville to Orlando", "transportation": "Flight Number: F3566154, from Knoxville to Orlando, Departure Time: -, Arrival Time: -", "breakfast": "-", "attraction": "-", "lunch": "-", "dinner": "Indochi Cafe & Restaurant, Orlando", "accommodation": "Sixth Ave Chelsea, Studio Serviced Apartment, Orlando"}, {"day": 2, "current_city": "Orlando", "transportation": "-", "breakfast": "Fuji Japanese Steakhouse, Orlando", "attraction": "The Wheel at ICON Park, Orlando", "lunch": "Shivani Catering Services, Orlando", "dinner": "Lounge Bakery, Orlando", "accommodation": "Sixth Ave Chelsea, Studio Serviced Apartment, Orlando"}, {"day": 3, "current_city": "from Orlando to Miami", "transportation": "Flight Number: F3670400, from Orlando to Miami, Departure Time: -, Arrival Time: -", "breakfast": "-", "attraction": "SeaWorld Orlando, Orlando", "lunch": "Always Eat Green, Orlando", "dinner": "Tako Cheena by Pom Pom, Miami", "accommodation": "King Hotel Room at Wyndham Midtown 45 Resort, Miami"}, {"day": 4, "current_city": "Miami", "transportation": "-", "breakfast": "Papouli's Mediterranean Cafe & Market, Miami", "attraction": "Jungle Island, Miami", "lunch": "Spice It - Hotel IBIS, Miami", "dinner": "AB's Absolute Barbecues, Miami", "accommodation": "King Hotel Room at Wyndham Midtown 45 Resort, Miami"}, {"day": 5, "current_city": "from Miami to Knoxville", "transportation": "Flight Number: F3601007, from Miami to Knoxville, Departure Time: -, Arrival Time: -", "breakfast": "Shorts Burger and Shine, Miami", "attraction": "-", "lunch": "-", "dinner": "-", "accommodation": "-"}]}]