[{"gpt-4-1106-preview_direct_sole-planning_results": "Travel Plan:\n\nDay 1: March 23, 2022 - From Louisville to Fort Myers\n- Transportation: Flight F3987658, from Louisville to Fort Myers, cost: $292, DepTime: 06:54, ArrTime: 09:10\n- Breakfast: -\n- Attraction: Edison & Ford Winter Estates, Fort Myers, cost: $25\n- Lunch: The Refinery, Fort Myers, cost: $22, cuisines: Bakery, Indian, Seafood\n- Dinner: Al Mukhtar Bakery, Fort Myers, cost: $54, cuisines: BBQ, Tea, American, Desserts\n- Accommodation: Quiet and beautiful apartment near central park, Fort Myers, cost: $930, room type: Entire home/apt\n\nNumber of people: 1\nTotal cost: $292 + $25 + $22 + $54 + $930 = $1,323\n\nDay 2: March 24, 2022 - Fort Myers\n- Transportation: -\n- Breakfast: Haunted, Fort Myers, cost: $50, cuisines: Desserts, French, Fast Food, Cafe, Seafood\n- Attraction: Six Mile Cypress Slough Preserve, Fort Myers, cost: $15\n- Lunch: Eggers Madhouse, Fort Myers, cost: $76, cuisines: BBQ, Mediterranean, Seafood\n- Dinner: Maachh Bhaat, Fort Myers, cost: $66, cuisines: Desserts, Pizza, Fast Food, Mediterranean, Seafood\n- Accommodation: Quiet and beautiful apartment near central park, Fort Myers, cost: $930, room type: Entire home/apt\n\nNumber of people: 1\nTotal cost: $50 + $15 + $76 + $66 + $930 = $1,137\n\nDay 3: March 25, 2022 - From Fort Myers to Orlando\n- Transportation: Flight F4014747, from Fort Myers to Orlando, cost: $36, DepTime: 16:49, ArrTime: 17:39\n- Breakfast: -\n- Attraction: Manatee Park, Fort Myers, cost: $20\n- Lunch: Kujay's Spoon, Fort Myers, cost: $88, cuisines: Pizza, Mexican, Bakery, Cafe, Mediterranean, Seafood\n- Dinner: Fuji Japanese Steakhouse, Orlando, cost: $75, cuisines: Tea, Bakery, Desserts\n- Accommodation: Private furnished bedroom in Williamsburg, Orlando, cost: $179, room type: Private room\n\nNumber of people: 1\nTotal cost: $36 + $20 + $88 + $75 + $179 = $398\n\nDay 4: March 26, 2022 - Orlando\n- Transportation: -\n- Breakfast: Turquoise Villa, Orlando, cost: $55, cuisines: French, Bakery, BBQ, Fast Food\n- Attraction: SeaWorld Orlando, cost: $100\n- Lunch: The Tandoori Times, Orlando, cost: $84, cuisines: Tea, Cafe, BBQ, Italian\n- Dinner: Crust N Cakes, Orlando, cost: $61, cuisines: Tea, Cafe, Indian, BBQ\n- Accommodation: Private furnished bedroom in Williamsburg, Orlando, cost: $179, room type: Private room\n\nNumber of people: 1\nTotal cost: $55 + $100 + $84 + $61 + $179 = $479\n\nDay 5: March 27, 2022 - From Orlando to Tampa\n- Transportation: Self-driving, from Orlando to Tampa, cost: $6\n- Breakfast: Indochi Cafe & Restaurant, Orlando, cost: $72, cuisines: Pizza, French, Bakery, Fast Food, Indian, Seafood\n- Attraction: The Florida Aquarium, Tampa, cost: $30\n- Lunch: Kobe Hibachi & Sushi, Tampa, cost: $63, cuisines: Desserts, French, BBQ, Bakery, Seafood\n- Dinner: The Tin Cow, Tampa, cost: $67, cuisines: BBQ, Desserts, Seafood\n- Accommodation: Lovely Guestroom in Elevator Building, Tampa, cost: $359, room type: Private room\n\nNumber of people: 1\nTotal cost: $6 + $72 + $30 + $63 + $67 + $359 = $597\n\nDay 6: March 28, 2022 - Tampa\n- Transportation: -\n- Breakfast: Peg Leg Pete's, Tampa, cost: $91, cuisines: French, Bakery, Cafe\n- Attraction: Busch Gardens Tampa Bay, cost: $110\n- Lunch: Butterburrs, Tampa, cost: $28, cuisines: Pizza, Seafood\n- Dinner: Lalit Kathi Rolls Momos, Tampa, cost: $23, cuisines: Tea, Pizza, Fast Food\n- Accommodation: Lovely Guestroom in Elevator Building, Tampa, cost: $359, room type: Private room\n\nNumber of people: 1\nTotal cost: $91 + $110 + $28 + $23 + $359 = $611\n\nDay 7: March 29, 2022 - From Tampa to Louisville\n- Transportation: Flight F3963197, from Tampa to Louisville, cost: $203, DepTime: 11:38, ArrTime: 13:42\n- Breakfast: Uptown Fresh Beer Cafe, Tampa, cost: $61, cuisines: Pizza, Mexican, BBQ, Cafe, Seafood\n- Attraction: -\n- Lunch: -\n- Dinner: -\n- Accommodation: -\n\nNumber of people: 1\nTotal cost: $203 + $61 = $264\n\nTotal cost across all days: $1,323 + $1,137 + $398 + $479 + $597 + $611 + $264 = $4,809\n\nCuisines: The prompt specifies no cuisines, so all cuisine constraints are satisfied.\n\nNote: All attractions, restaurants, and accommodations were selected based on the provided reference information and within the budget constraints. The plan includes a variety of cuisines and experiences in each city, with no repeated restaurants or attractions. Accommodations were chosen based on availability and adherence to house rules. Transportation modes were selected to ensure a closed loop back to the starting city, Louisville, and to avoid prohibited transportation types. The total cost of the travel plan is within the specified budget of $7,800.", "gpt-4-1106-preview_direct_sole-planning_parsed_results": [{"day": 1, "current_city": "from Louisville to Fort Myers", "transportation": "Flight Number: F3987658, from Louisville to Fort Myers, Departure Time: 06:54, Arrival Time: 09:10", "breakfast": "-", "attraction": "Edison & Ford Winter Estates, Fort Myers;", "lunch": "The Refinery, Fort Myers", "dinner": "Al Mukhtar Bakery, Fort Myers", "accommodation": "Quiet and beautiful apartment near central park, Fort Myers"}, {"day": 2, "current_city": "Fort Myers", "transportation": "-", "breakfast": "Haunted, Fort Myers", "attraction": "Six Mile Cypress Slough Preserve, Fort Myers;", "lunch": "Eggers Madhouse, Fort Myers", "dinner": "Maachh Bhaat, Fort Myers", "accommodation": "Quiet and beautiful apartment near central park, Fort Myers"}, {"day": 3, "current_city": "from Fort Myers to Orlando", "transportation": "Flight Number: F4014747, from Fort Myers to Orlando, Departure Time: 16:49, Arrival Time: 17:39", "breakfast": "-", "attraction": "Manatee Park, Fort Myers;", "lunch": "Kujay's Spoon, Fort Myers", "dinner": "Fuji Japanese Steakhouse, Orlando", "accommodation": "Private furnished bedroom in Williamsburg, Orlando"}, {"day": 4, "current_city": "Orlando", "transportation": "-", "breakfast": "Turquoise Villa, Orlando", "attraction": "SeaWorld Orlando;", "lunch": "The Tandoori Times, Orlando", "dinner": "Crust N Cakes, Orlando", "accommodation": "Private furnished bedroom in Williamsburg, Orlando"}, {"day": 5, "current_city": "from Orlando to Tampa", "transportation": "Self-driving, from Orlando to Tampa", "breakfast": "Indochi Cafe & Restaurant, Orlando", "attraction": "The Florida Aquarium, Tampa;", "lunch": "Kobe Hibachi & Sushi, Tampa", "dinner": "The Tin Cow, Tampa", "accommodation": "Lovely Guestroom in Elevator Building, Tampa"}, {"day": 6, "current_city": "Tampa", "transportation": "-", "breakfast": "Peg Leg Pete's, Tampa", "attraction": "Busch Gardens Tampa Bay;", "lunch": "Butterburrs, Tampa", "dinner": "Lalit Kathi Rolls Momos, Tampa", "accommodation": "Lovely Guestroom in Elevator Building, Tampa"}, {"day": 7, "current_city": "from Tampa to Louisville", "transportation": "Flight Number: F3963197, from Tampa to Louisville, Departure Time: 11:38, Arrival Time: 13:42", "breakfast": "Uptown Fresh Beer Cafe, Tampa", "attraction": "-", "lunch": "-", "dinner": "-", "accommodation": "-"}]}]