[{"gpt-4-1106-preview_direct_sole-planning_results": "Based on the provided information and constraints, here is a one-week travel itinerary for two people departing from Myrtle Beach and covering three cities in Michigan: Detroit, Lansing, and Kalamazoo. The travel plan includes French and American cuisines, as requested.\n\n**Day 1: March 4, 2022 - Myrtle Beach to Detroit**\n- Transportation: Flight F3623834 from Myrtle Beach to Detroit, cost: $258 per person\n- Breakfast: Not applicable (assumed departure from Myrtle Beach)\n- Attraction: Detroit Riverwalk, Detroit\n- Lunch: Southern Bliss Bakery, Detroit, cost: $28, cuisines: Tea, BBQ, Desserts, Seafood\n- Dinner: A Dong Restaurant, Detroit, cost: $40, cuisines: Tea, Cafe, Pizza\n- Accommodation: Cozy 1 bedroom in the heart of Fort Greene, Detroit, cost: $751, Entire home/apt\n\nNumber of people: 2\nTotal cost: 2 x $258 (flight) + 2 x $28 (lunch) + 2 x $40 (dinner) + $751 (accommodation) = $1,403\nAccommodation minimum nights: 1/3\n\n**Day 2: March 5, 2022 - Detroit**\n- Transportation: -\n- Breakfast: BMG - All Day Dining, Detroit, cost: $15, cuisines: Desserts, Bakery, BBQ, Indian, Seafood\n- Attraction: Detroit Institute of Arts, Detroit\n- Lunch: Cafe And More, Detroit, cost: $41, cuisines: Tea, Bakery, Italian\n- Dinner: Bistro Flamme Bois, Detroit, cost: $100, cuisines: Chinese, Bakery, BBQ\n- Accommodation: Cozy 1 bedroom in the heart of Fort Greene, Detroit, cost: $751, Entire home/apt\n\nNumber of people: 2\nTotal cost: 2 x $15 (breakfast) + 2 x $41 (lunch) + 2 x $100 (dinner) + $751 (accommodation) = $1,063\nAccommodation minimum nights: 2/3\n\n**Day 3: March 6, 2022 - Detroit to Lansing**\n- Transportation: Self-driving from Detroit to Lansing, cost: $7 per person\n- Breakfast: Zabardast Indian Kitchen, Detroit, cost: $76, cuisines: Bakery, Desserts, Seafood\n- Attraction: Michigan History Center, Lansing\n- Lunch: Manuel's Bread Cafe, Lansing, cost: $28, cuisines: French, Pizza, Seafood\n- Dinner: Huey's On The River, Lansing, cost: $75, cuisines: Tea, French, Bakery, Fast Food, Cafe\n- Accommodation: Brand New Amazing 1 Bedroom Best Location, Lansing, cost: $1,168, Entire home/apt\n\nNumber of people: 2\nTotal cost: 2 x $7 (transportation) + 2 x $76 (breakfast) + 2 x $28 (lunch) + 2 x $75 (dinner) + $1,168 (accommodation) = $1,530\nAccommodation minimum nights: 1/30\n\n**Day 4: March 7, 2022 - Lansing**\n- Transportation: -\n- Breakfast: Front Street Brewery, Lansing, cost: $25, cuisines: BBQ, Mediterranean, Desserts, Italian\n- Attraction: Potter Park Zoo, Lansing\n- Lunch: Golden China, Lansing, cost: $66, cuisines: Chinese, Indian, Cafe, BBQ\n- Dinner: Triveni, Lansing, cost: $37, cuisines: Desserts, Mexican, Bakery, BBQ, Mediterranean, Seafood\n- Accommodation: Brand New Amazing 1 Bedroom Best Location, Lansing, cost: $1,168, Entire home/apt\n\nNumber of people: 2\nTotal cost: 2 x $25 (breakfast) + 2 x $66 (lunch) + 2 x $37 (dinner) + $1,168 (accommodation) = $1,424\nAccommodation minimum nights: 2/30\n\n**Day 5: March 8, 2022 - Lansing to Kalamazoo**\n- Transportation: Self-driving from Lansing to Kalamazoo, cost: $6 per person\n- Breakfast: Aggarwal Sweets, Lansing, cost: $97, cuisines: Desserts, American, Bakery, Fast Food, Indian, Seafood\n- Attraction: Kalamazoo Valley Museum, Kalamazoo\n- Lunch: Giulios Greek & Italian Restaurant, Kalamazoo, cost: $76, cuisines: Fast Food, French, Desserts, Seafood\n- Dinner: Cha cTea, Kalamazoo, cost: $77, cuisines: Cafe, Pizza, Mediterranean\n- Accommodation: East 63rd street, Studio Serviced Apartment, Kalamazoo, cost: $417, Entire home/apt\n\nNumber of people: 2\nTotal cost: 2 x $6 (transportation) + 2 x $97 (breakfast) + 2 x $76 (lunch) + 2 x $77 (dinner) + $417 (accommodation) = $929\nAccommodation minimum nights: 1/30\n\n**Day 6: March 9, 2022 - Kalamazoo**\n- Transportation: -\n- Breakfast: Django, Kalamazoo, cost: $65, cuisines: Mediterranean, Desserts, Fast Food\n- Attraction: Air Zoo Aerospace & Science Museum, Kalamazoo\n- Lunch: Taco Bell, Kalamazoo, cost: $54, cuisines: Chinese, Bakery, Pizza, Seafood\n- Dinner: Six Degrees, Kalamazoo, cost: $20, cuisines: Cafe, Italian, Bakery, Fast Food, Chinese\n- Accommodation: East 63rd street, Studio Serviced Apartment, Kalamazoo, cost: $417, Entire home/apt\n\nNumber of people: 2\nTotal cost: 2 x $65 (breakfast) + 2 x $54 (lunch) + 2 x $20 (dinner) + $417 (accommodation) = $695\nAccommodation minimum nights: 2/30\n\n**Day 7: March 10, 2022 - Kalamazoo to Myrtle Beach**\n- Transportation: Self-driving from Kalamazoo to Myrtle Beach, cost: $70 per person\n- Breakfast: Not applicable (assumed early departure)\n- Attraction: -\n- Lunch: -\n- Dinner: -\n- Accommodation: -\n\nNumber of people: 2\nTotal cost: 2 x $70 (transportation) = $140\n\n**Total cost across all days: $1,403 + $1,063 + $1,530 + $1,424 + $929 + $695 + $140 = $7,184**\n\nCuisines: French and American cuisines included as requested.\nRemaining budget: $8,300 - $7,184 = $1,116\n\nPlease note that the costs for attractions are not included as they were not provided in the reference information. The remaining budget can be used for these activities or any additional expenses.", "gpt-4-1106-preview_direct_sole-planning_parsed_results": [{"day": 1, "current_city": "from Myrtle Beach to Detroit", "transportation": "Flight Number: F3623834, from Myrtle Beach to Detroit, Departure Time: -, Arrival Time: -", "breakfast": "-", "attraction": "Detroit Riverwalk, Detroit;", "lunch": "Southern Bliss Bakery, Detroit", "dinner": "A Dong Restaurant, Detroit", "accommodation": "Cozy 1 bedroom in the heart of Fort Greene, Detroit"}, {"day": 2, "current_city": "Detroit", "transportation": "-", "breakfast": "BMG - All Day Dining, Detroit", "attraction": "Detroit Institute of Arts, Detroit;", "lunch": "Cafe And More, Detroit", "dinner": "Bistro Flamme Bois, Detroit", "accommodation": "Cozy 1 bedroom in the heart of Fort Greene, Detroit"}, {"day": 3, "current_city": "from Detroit to Lansing", "transportation": "Self-driving, from Detroit to Lansing, Departure Time: -, Arrival Time: -", "breakfast": "Zabardast Indian Kitchen, Detroit", "attraction": "Michigan History Center, Lansing;", "lunch": "Manuel's Bread Cafe, Lansing", "dinner": "Huey's On The River, Lansing", "accommodation": "Brand New Amazing 1 Bedroom Best Location, Lansing"}, {"day": 4, "current_city": "Lansing", "transportation": "-", "breakfast": "Front Street Brewery, Lansing", "attraction": "Potter Park Zoo, Lansing;", "lunch": "Golden China, Lansing", "dinner": "Triveni, Lansing", "accommodation": "Brand New Amazing 1 Bedroom Best Location, Lansing"}, {"day": 5, "current_city": "from Lansing to Kalamazoo", "transportation": "Self-driving, from Lansing to Kalamazoo, Departure Time: -, Arrival Time: -", "breakfast": "Aggarwal Sweets, Lansing", "attraction": "Kalamazoo Valley Museum, Kalamazoo;", "lunch": "Giulios Greek & Italian Restaurant, Kalamazoo", "dinner": "Cha cTea, Kalamazoo", "accommodation": "East 63rd street, Studio Serviced Apartment, Kalamazoo"}, {"day": 6, "current_city": "Kalamazoo", "transportation": "-", "breakfast": "Django, Kalamazoo", "attraction": "Air Zoo Aerospace & Science Museum, Kalamazoo;", "lunch": "Taco Bell, Kalamazoo", "dinner": "Six Degrees, Kalamazoo", "accommodation": "East 63rd street, Studio Serviced Apartment, Kalamazoo"}, {"day": 7, "current_city": "from Kalamazoo to Myrtle Beach", "transportation": "Self-driving, from Kalamazoo to Myrtle Beach, Departure Time: -, Arrival Time: -", "breakfast": "-", "attraction": "-", "lunch": "-", "dinner": "-", "accommodation": "-"}]}]