[{"gpt-4-1106-preview_direct_sole-planning_results": "Travel Plan:\n\nDays: 1\nCurrent City: from Eau Claire to Rockford\nTransportation: Self-driving, from Eau Claire to Rockford, duration: 3 hours 42 mins, distance: 392 km, cost: 19 x 3 = 57\nBreakfast: -\nAttraction: -\nLunch: -\nDinner: Coco Bambu, Rockford, cost: 72 x 3 = 216, cuisines: Tea, French, Bakery, BBQ, Cafe\nAccommodation: Spacious 3BDR Prime Location!, Rockford, cost: 1030, maximum occupancy: 9, house rules: No smoking, minimum nights: 2\n\nNumber of people: 3\nTotal cost: 57 + 216 + 1030 = 1303\nAccommodation minimum nights: 1/2\n\nDays: 2\nCurrent City: Rockford\nTransportation: -\nBreakfast: Moets Arabica, Rockford, cost: 43 x 3 = 129, cuisines: Tea, Bakery, Indian, Fast Food\nAttraction: Anderson Japanese Gardens, Rockford; Burpee Museum of Natural History, Rockford\nLunch: Flying Mango, Rockford, cost: 20 x 3 = 60, cuisines: American, BBQ, Seafood\nDinner: Eggspectation - Jaypee Vasant Continental, Rockford, cost: 77 x 3 = 231, cuisines: Tea, Mediterranean, Seafood\nAccommodation: Spacious 3BDR Prime Location!, Rockford, cost: 1030, maximum occupancy: 9, house rules: No smoking, minimum nights: 2\n\nNumber of people: 3\nTotal cost: 129 + 60 + 231 + 1030 = 1450\nAccommodation minimum nights: 2/2\n\nDays: 3\nCurrent City: from Rockford to Peoria\nTransportation: Self-driving, from Rockford to Peoria, duration: 2 hours 17 mins, distance: 219 km, cost: 10 x 3 = 30\nBreakfast: -\nAttraction: -\nLunch: -\nDinner: Wasabi Sushi and Thai, Peoria, cost: 72 x 3 = 216, cuisines: Tea, Italian, BBQ, Fast Food, Seafood\nAccommodation: Huge Light Filled 1BDR Loft - Modern + Minimalist, Peoria, cost: 443, maximum occupancy: 2, house rules: No smoking & No children under 10, minimum nights: 4\n\nNumber of people: 3\nTotal cost: 30 + 216 + 443 = 689\nAccommodation minimum nights: 1/4\n\nDays: 4\nCurrent City: Peoria\nTransportation: -\nBreakfast: Keventers, Peoria, cost: 69 x 3 = 207, cuisines: Tea, Pizza, Bakery, BBQ, Chinese\nAttraction: Peoria Riverfront Museum, Peoria; Caterpillar Visitors Center, Peoria\nLunch: Slice of Spice, Peoria, cost: 85 x 3 = 255, cuisines: Tea, Fast Food\nDinner: Barbeque Nation, Peoria, cost: 64 x 3 = 192, cuisines: Desserts, Tea, Pizza, Italian, Indian, Seafood\nAccommodation: Huge Light Filled 1BDR Loft - Modern + Minimalist, Peoria, cost: 443, maximum occupancy: 2, house rules: No smoking & No children under 10, minimum nights: 4\n\nNumber of people: 3\nTotal cost: 207 + 255 + 192 + 443 = 1097\nAccommodation minimum nights: 2/4\n\nDays: 5\nCurrent City: Peoria\nTransportation: -\nBreakfast: The Street- Curries & Grills, Peoria, cost: 66 x 3 = 198, cuisines: Cafe, Pizza, Seafood, Fast Food\nAttraction: Luthy Botanical Garden, Peoria; Peoria Zoo, Peoria\nLunch: Aggarwal Sweets & Restaurant, Peoria, cost: 17 x 3 = 51, cuisines: Seafood, Bakery, Fast Food\nDinner: Sakley's The Mountain Cafe, Peoria, cost: 95 x 3 = 285, cuisines: Pizza, Italian, Bakery, BBQ, Mediterranean, Seafood\nAccommodation: Huge Light Filled 1BDR Loft - Modern + Minimalist, Peoria, cost: 443, maximum occupancy: 2, house rules: No smoking & No children under 10, minimum nights: 4\n\nNumber of people: 3\nTotal cost: 198 + 51 + 285 + 443 = 977\nAccommodation minimum nights: 3/4\n\nDays: 6\nCurrent City: from Peoria to Chicago\nTransportation: Self-driving, from Peoria to Chicago, duration: 2 hours 34 mins, distance: 269 km, cost: 13 x 3 = 39\nBreakfast: -\nAttraction: -\nLunch: -\nDinner: The Black Pearl, Chicago, cost: 63 x 3 = 189, cuisines: Cafe, Bakery\nAccommodation: Amazing place close to all, Chicago, cost: 308, maximum occupancy: 3, house rules: No children under 10, minimum nights: 3\n\nNumber of people: 3\nTotal cost: 39 + 189 + 308 = 536\nAccommodation minimum nights: 1/3\n\nDays: 7\nCurrent City: Chicago\nTransportation: -\nBreakfast: Pantry d'or, Chicago, cost: 53 x 3 = 159, cuisines: Tea, BBQ, Fast Food, Cafe, Indian\nAttraction: Navy Pier, Chicago; Millennium Park, Chicago\nLunch: Bro's Kitchenette, Chicago, cost: 38 x 3 = 114, cuisines: Mexican, Desserts, Seafood\nDinner: FIO Cookhouse and Bar, Chicago, cost: 31 x 3 = 93, cuisines: Desserts, Mexican, Fast Food, Cafe, Seafood\nAccommodation: Amazing place close to all, Chicago, cost: 308, maximum occupancy: 3, house rules: No children under 10, minimum nights: 3\n\nNumber of people: 3\nTotal cost: 159 + 114 + 93 + 308 = 674\nAccommodation minimum nights: 2/3\n\nTotal cost across all days: 1303 + 1450 + 689 + 1097 + 977 + 536 + 674 = 6726\nCuisines: The prompt specifies American, Chinese, French, and Italian cuisines, so all cuisine constraints are satisfied.\n\nPlease note that the accommodation on Day 3 in Peoria has a minimum night requirement of 4, so the same accommodation is used for Days 3, 4, and 5. The accommodation on Day 6 in Chicago has a minimum night requirement of 3, so the same accommodation is used for Days 6 and 7. The total cost of the trip is within the specified budget of $10,600.", "gpt-4-1106-preview_direct_sole-planning_parsed_results": [{"day": 1, "current_city": "from Eau Claire to Rockford", "transportation": "Self-driving, from Eau Claire to Rockford, duration: 3 hours 42 mins, distance: 392 km", "breakfast": "-", "attraction": "-", "lunch": "-", "dinner": "Coco Bambu, Rockford", "accommodation": "Spacious 3BDR Prime Location!, Rockford"}, {"day": 2, "current_city": "Rockford", "transportation": "-", "breakfast": "Moets Arabica, Rockford", "attraction": "Anderson Japanese Gardens, Rockford;Burpee Museum of Natural History, Rockford;", "lunch": "Flying Mango, Rockford", "dinner": "Eggspectation - Jaypee Vasant Continental, Rockford", "accommodation": "Spacious 3BDR Prime Location!, Rockford"}, {"day": 3, "current_city": "from Rockford to Peoria", "transportation": "Self-driving, from Rockford to Peoria, duration: 2 hours 17 mins, distance: 219 km", "breakfast": "-", "attraction": "-", "lunch": "-", "dinner": "Wasabi Sushi and Thai, Peoria", "accommodation": "Huge Light Filled 1BDR Loft - Modern + Minimalist, Peoria"}, {"day": 4, "current_city": "Peoria", "transportation": "-", "breakfast": "Keventers, Peoria", "attraction": "Peoria Riverfront Museum, Peoria;Caterpillar Visitors Center, Peoria;", "lunch": "Slice of Spice, Peoria", "dinner": "Barbeque Nation, Peoria", "accommodation": "Huge Light Filled 1BDR Loft - Modern + Minimalist, Peoria"}, {"day": 5, "current_city": "Peoria", "transportation": "-", "breakfast": "The Street- Curries & Grills, Peoria", "attraction": "Luthy Botanical Garden, Peoria;Peoria Zoo, Peoria;", "lunch": "Aggarwal Sweets & Restaurant, Peoria", "dinner": "Sakley's The Mountain Cafe, Peoria", "accommodation": "Huge Light Filled 1BDR Loft - Modern + Minimalist, Peoria"}, {"day": 6, "current_city": "from Peoria to Chicago", "transportation": "Self-driving, from Peoria to Chicago, duration: 2 hours 34 mins, distance: 269 km", "breakfast": "-", "attraction": "-", "lunch": "-", "dinner": "The Black Pearl, Chicago", "accommodation": "Amazing place close to all, Chicago"}, {"day": 7, "current_city": "Chicago", "transportation": "-", "breakfast": "Pantry d'or, Chicago", "attraction": "Navy Pier, Chicago;Millennium Park, Chicago;", "lunch": "Bro's Kitchenette, Chicago", "dinner": "FIO Cookhouse and Bar, Chicago", "accommodation": "Amazing place close to all, Chicago"}]}]