[{"gpt-4-1106-preview_direct_sole-planning_results": "Based on the provided query and reference information, here is the travel plan for a 3-day trip for two people from Atlanta to Chicago:\n\n***** Travel Plan *****\n\nDay 1: March 24, 2022 - From Atlanta to Chicago\n- Transportation: Flight F3505544, from Atlanta to Chicago, cost: $223 per person, total cost: $446\n- Breakfast: Not applicable (assuming flight is early and breakfast is either at home or on the plane)\n- Attraction: Millennium Park, Chicago, no cost listed\n- Lunch: Pantry d'or, Chicago, average cost: $53, total cost: $106\n- Dinner: FIO Cookhouse and Bar, Chicago, average cost: $31, total cost: $62\n- Accommodation: NYC Firehouse-Greenpoint BRKLYN, Chicago, price: $109 per night, total cost for 2 nights: $218\n\nNumber of people: 2\nTotal cost for Day 1: $446 (flight) + $106 (lunch) + $62 (dinner) + $218 (accommodation) = $832\n\nDay 2: March 25, 2022 - Chicago\n- Transportation: Not required (staying in Chicago)\n- Breakfast: The Black Pearl, Chicago, average cost: $63, total cost: $126\n- Attraction: Willis Tower, Chicago, no cost listed\n- Lunch: Bro's Kitchenette, Chicago, average cost: $38, total cost: $76\n- Dinner: Mini's Royal Cafe, Chicago, average cost: $72, total cost: $144\n- Accommodation: NYC Firehouse-Greenpoint BRKLYN, Chicago, already paid for\n\nNumber of people: 2\nTotal cost for Day 2: $126 (breakfast) + $76 (lunch) + $144 (dinner) = $346\n\nDay 3: March 26, 2022 - From Chicago to Atlanta\n- Transportation: Flight F3509458, from Chicago to Atlanta, cost: $241 per person, total cost: $482\n- Breakfast: The Village Caf\u6106, Chicago, average cost: $57, total cost: $114\n- Attraction: Not applicable (assuming flight is in the morning or early afternoon)\n- Lunch: Not applicable (assuming in-flight or upon arrival back in Atlanta)\n- Dinner: Not applicable (back in Atlanta)\n- Accommodation: Not required (back in Atlanta)\n\nNumber of people: 2\nTotal cost for Day 3: $482 (flight) + $114 (breakfast) = $596\n\nTotal cost across all days: $832 (Day 1) + $346 (Day 2) + $596 (Day 3) = $1,774\n\nRemaining budget: $1,900 - $1,774 = $126\n\nCuisines: The prompt specifies no cuisines, so all cuisine constraints are satisfied.\nAccommodation: Entire room provided as per the requirement.\nTransportation: Flights chosen as per the dates and availability.\n\n***** End of Travel Plan *****\n\nPlease note that the costs for attractions are not listed, and it is assumed there are no entry fees. If there are fees, they would need to be factored into the budget. Additionally, the costs for meals are based on average costs, and actual prices may vary. The accommodation has been booked for two nights as the travelers will not require accommodation in Atlanta on the night of their return. The remaining budget can be used for additional expenses such as transportation within the city, tips, or any unforeseen costs.", "gpt-4-1106-preview_direct_sole-planning_parsed_results": [{"day": 1, "current_city": "from Atlanta to Chicago", "transportation": "Flight Number: F3505544, from Atlanta to Chicago", "breakfast": "-", "attraction": "Millennium Park, Chicago", "lunch": "Pantry d'or, Chicago", "dinner": "FIO Cookhouse and Bar, Chicago", "accommodation": "NYC Firehouse-Greenpoint BRKLYN, Chicago"}, {"day": 2, "current_city": "Chicago", "transportation": "-", "breakfast": "The Black Pearl, Chicago", "attraction": "Willis Tower, Chicago", "lunch": "Bro's Kitchenette, Chicago", "dinner": "Mini's Royal Cafe, Chicago", "accommodation": "NYC Firehouse-Greenpoint BRKLYN, Chicago"}, {"day": 3, "current_city": "from Chicago to Atlanta", "transportation": "Flight Number: F3509458, from Chicago to Atlanta", "breakfast": "The Village Caf\u00e9, Chicago", "attraction": "-", "lunch": "-", "dinner": "-", "accommodation": "-"}]}]