[{"gpt-4-1106-preview_direct_sole-planning_results": "Travel Plan for 2 People from Salt Lake City to California (3 Cities)\n\n**Day 1: March 25, 2022 - Salt Lake City to San Diego**\n- Transportation: Flight F3499966, from Salt Lake City to San Diego, cost: $300 x 2 = $600, DepTime: 08:02, ArrTime: 08:55\n- Breakfast: -\n- Attraction: -\n- Lunch: Open Yard, San Diego, cost: $33 x 2 = $66, cuisines: Chinese, Pizza, Cafe, Desserts\n- Dinner: The Lost Mughal, San Diego, cost: $74 x 2 = $148, cuisines: Tea, Cafe, Italian\n- Accommodation: Spacious Room in Large 2 Bedroom Prewar Apartment, San Diego, cost: $585 x 1 = $585, room type: Private room, house rules: Smoking permitted, minimum nights: 1\n\nTotal cost for Day 1: $600 (flight) + $66 (lunch) + $148 (dinner) + $585 (accommodation) = $1,399\n\n**Day 2: March 26, 2022 - San Diego**\n- Transportation: -\n- Breakfast: Jetha Lal Ka Dhabha, San Diego, cost: $22 x 2 = $44, cuisines: Tea, Cafe, Indian, Italian\n- Attraction: USS Midway Museum, San Diego\n- Lunch: Gopala, San Diego, cost: $98 x 2 = $196, cuisines: Pizza, Mexican, BBQ, American, Seafood\n- Dinner: Bun Intended, San Diego, cost: $91 x 2 = $182, cuisines: Cafe, Pizza, Desserts, Seafood\n- Accommodation: Spacious Room in Large 2 Bedroom Prewar Apartment, San Diego, cost: $585 x 1 = $585, room type: Private room, house rules: Smoking permitted, minimum nights: 1\n\nTotal cost for Day 2: $44 (breakfast) + $196 (lunch) + $182 (dinner) + $585 (accommodation) = $1,007\n\n**Day 3: March 27, 2022 - San Diego to San Luis Obispo**\n- Transportation: Flight F3820181, from San Diego to San Luis Obispo, cost: $76 x 2 = $152, DepTime: 09:59, ArrTime: 11:02\n- Breakfast: -\n- Attraction: Mission San Luis Obispo de Tolosa, San Luis Obispo\n- Lunch: Sushi Leblon, San Luis Obispo, cost: $38 x 2 = $76, cuisines: French, BBQ, Fast Food, Indian, Seafood\n- Dinner: Gaucho, San Luis Obispo, cost: $98 x 2 = $196, cuisines: Mexican, Bakery, BBQ, Seafood\n- Accommodation: Experiencing Tranquility in Private Home, Room # 1, San Luis Obispo, cost: $111 x 1 = $111, room type: Private room, house rules: Smoking permitted, minimum nights: 1\n\nTotal cost for Day 3: $152 (flight) + $76 (lunch) + $196 (dinner) + $111 (accommodation) = $535\n\n**Day 4: March 28, 2022 - San Luis Obispo**\n- Transportation: -\n- Breakfast: Cafe Blur, San Luis Obispo, cost: $45 x 2 = $90, cuisines: Tea, Pizza, Italian\n- Attraction: San Luis Obispo Botanical Garden, San Luis Obispo\n- Lunch: Modern Sweets, San Luis Obispo, cost: $12 x 2 = $24, cuisines: Pizza, Seafood\n- Dinner: Jerry's Burger Bar, San Luis Obispo, cost: $29 x 2 = $58, cuisines: Pizza, BBQ, Fast Food, Cafe, Indian\n- Accommodation: Experiencing Tranquility in Private Home, Room # 1, San Luis Obispo, cost: $111 x 1 = $111, room type: Private room, house rules: Smoking permitted, minimum nights: 1\n\nTotal cost for Day 4: $90 (breakfast) + $24 (lunch) + $58 (dinner) + $111 (accommodation) = $283\n\n**Day 5: March 29, 2022 - San Luis Obispo to Los Angeles**\n- Transportation: Flight F3854130, from San Luis Obispo to Los Angeles, cost: $53 x 2 = $106, DepTime: 05:53, ArrTime: 06:55\n- Breakfast: -\n- Attraction: Griffith Observatory, Los Angeles\n- Lunch: Punjabi Zaika, Los Angeles, cost: $46 x 2 = $92, cuisines: Pizza, Bakery, BBQ, Cafe, Indian\n- Dinner: Palmshore, Los Angeles, cost: $25 x 2 = $50, cuisines: Desserts, Bakery, Fast Food, American, Seafood\n- Accommodation: Sunny apartment with easy connections to anywhere., Los Angeles, cost: $968 x 1 = $968, room type: Private room, house rules: Smoking permitted, minimum nights: 1\n\nTotal cost for Day 5: $106 (flight) + $92 (lunch) + $50 (dinner) + $968 (accommodation) = $1,216\n\n**Day 6: March 30, 2022 - Los Angeles**\n- Transportation: -\n- Breakfast: Chicken Minar, Los Angeles, cost: $25 x 2 = $50, cuisines: Bakery, Fast Food\n- Attraction: Universal Studios Hollywood, Los Angeles\n- Lunch: The Hangout by 1861, Los Angeles, cost: $64 x 2 = $128, cuisines: Tea, Pizza, Seafood\n- Dinner: Elan - The Lodhi, Los Angeles, cost: $61 x 2 = $122, cuisines: Seafood, Desserts, Italian\n- Accommodation: Sunny apartment with easy connections to anywhere., Los Angeles, cost: $968 x 1 = $968, room type: Private room, house rules: Smoking permitted, minimum nights: 1\n\nTotal cost for Day 6: $50 (breakfast) + $128 (lunch) + $122 (dinner) + $968 (accommodation) = $1,268\n\n**Day 7: March 31, 2022 - Los Angeles to Salt Lake City**\n- Transportation: Flight F3528613, from Los Angeles to Salt Lake City, cost: $214 x 2 = $428, DepTime: 11:14, ArrTime: 13:55\n- Breakfast: -\n- Attraction: -\n- Lunch: -\n- Dinner: -\n- Accommodation: -\n\nTotal cost for Day 7: $428 (flight)\n\n**Total cost across all days: $1,399 (Day 1) + $1,007 (Day 2) + $535 (Day 3) + $283 (Day 4) + $1,216 (Day 5) + $1,268 (Day 6) + $428 (Day 7) = $6,136**\n\nUnfortunately, the total cost exceeds the budget of $4,600. Adjustments need to be made to fit the budget. This could include choosing less expensive accommodations, dining options, or adjusting the attractions visited.", "gpt-4-1106-preview_direct_sole-planning_parsed_results": [{"day": 1, "current_city": "from Salt Lake City to San Diego", "transportation": "Flight Number: F3499966, from Salt Lake City to San Diego, Departure Time: 08:02, Arrival Time: 08:55", "breakfast": "-", "attraction": "-", "lunch": "Open Yard, San Diego", "dinner": "The Lost Mughal, San Diego", "accommodation": "Spacious Room in Large 2 Bedroom Prewar Apartment, San Diego"}, {"day": 2, "current_city": "San Diego", "transportation": "-", "breakfast": "Jetha Lal Ka Dhabha, San Diego", "attraction": "USS Midway Museum, San Diego", "lunch": "Gopala, San Diego", "dinner": "Bun Intended, San Diego", "accommodation": "Spacious Room in Large 2 Bedroom Prewar Apartment, San Diego"}, {"day": 3, "current_city": "from San Diego to San Luis Obispo", "transportation": "Flight Number: F3820181, from San Diego to San Luis Obispo, Departure Time: 09:59, Arrival Time: 11:02", "breakfast": "-", "attraction": "Mission San Luis Obispo de Tolosa, San Luis Obispo", "lunch": "Sushi Leblon, San Luis Obispo", "dinner": "Gaucho, San Luis Obispo", "accommodation": "Experiencing Tranquility in Private Home, Room # 1, San Luis Obispo"}, {"day": 4, "current_city": "San Luis Obispo", "transportation": "-", "breakfast": "Cafe Blur, San Luis Obispo", "attraction": "San Luis Obispo Botanical Garden, San Luis Obispo", "lunch": "Modern Sweets, San Luis Obispo", "dinner": "Jerry's Burger Bar, San Luis Obispo", "accommodation": "Experiencing Tranquility in Private Home, Room # 1, San Luis Obispo"}, {"day": 5, "current_city": "from San Luis Obispo to Los Angeles", "transportation": "Flight Number: F3854130, from San Luis Obispo to Los Angeles, Departure Time: 05:53, Arrival Time: 06:55", "breakfast": "-", "attraction": "Griffith Observatory, Los Angeles", "lunch": "Punjabi Zaika, Los Angeles", "dinner": "Palmshore, Los Angeles", "accommodation": "Sunny apartment with easy connections to anywhere., Los Angeles"}, {"day": 6, "current_city": "Los Angeles", "transportation": "-", "breakfast": "Chicken Minar, Los Angeles", "attraction": "Universal Studios Hollywood, Los Angeles", "lunch": "The Hangout by 1861, Los Angeles", "dinner": "Elan - The Lodhi, Los Angeles", "accommodation": "Sunny apartment with easy connections to anywhere., Los Angeles"}, {"day": 7, "current_city": "from Los Angeles to Salt Lake City", "transportation": "Flight Number: F3528613, from Los Angeles to Salt Lake City, Departure Time: 11:14, Arrival Time: 13:55", "breakfast": "-", "attraction": "-", "lunch": "-", "dinner": "-", "accommodation": "-"}]}]