[{"gpt-4-1106-preview_direct_sole-planning_results": "Based on the provided information and constraints, here is a travel plan for two people from Chicago to Albany from March 22nd to March 24th, 2022, with a budget of $2,300. The accommodations must allow smoking and be entire rooms, and self-driving is not an option for transportation.\n\n**Day 1: March 22, 2022 - From Chicago to Albany**\n\nTransportation: Flight F3983350, from Chicago to Albany, cost: $160 x 2 = $320, duration: 1 hour 34 minutes, departure: 14:29, arrival: 17:03\n\nBreakfast: - (Assuming breakfast is in Chicago and not included in the travel plan)\n\nAttraction: - (No time for attractions due to travel)\n\nLunch: - (Assuming lunch is in Chicago or during the flight and not included in the travel plan)\n\nDinner: Echoes Satyaniketan, Albany, cost: $91 x 2 = $182, cuisines: Chinese, Bakery, Cafe\n\nAccommodation: Mid Town East Side Apartment, Albany, cost: $737 x 1 = $737, room type: Entire home/apt, house rules: No pets & No children under 10, minimum nights: 1, maximum occupancy: 6\n\nNumber of people: 2\nTotal cost for Day 1: $320 (flight) + $182 (dinner) + $737 (accommodation) = $1,239\n\n**Day 2: March 23, 2022 - Albany**\n\nTransportation: - (Staying in Albany)\n\nBreakfast: Cafe Coffee Day, Albany, cost: $82 x 2 = $164, cuisines: Mexican, Fast Food, Cafe, American, Seafood\n\nAttraction 1: New York State Museum, Albany, cost: Free\n\nAttraction 2: USS SLATER, Albany, cost: Free\n\nLunch: Jahangeer Foods, Albany, cost: $59 x 2 = $118, cuisines: Tea, Pizza, Italian, BBQ, Cafe\n\nDinner: Kaiser, Albany, cost: $96 x 2 = $192, cuisines: Cafe, Pizza, American\n\nAccommodation: Mid Town East Side Apartment, Albany (same as Day 1)\n\nNumber of people: 2\nTotal cost for Day 2: $164 (breakfast) + $118 (lunch) + $192 (dinner) = $474\n\n**Day 3: March 24, 2022 - From Albany to Chicago**\n\nTransportation: Flight F4008387, from Albany to Chicago, cost: $181 x 2 = $362, duration: 2 hours 6 minutes, departure: 05:05, arrival: 06:11\n\nBreakfast: - (Assuming breakfast is in Albany and not included in the travel plan)\n\nAttraction: - (No time for attractions due to travel)\n\nLunch: - (Assuming lunch is in Chicago and not included in the travel plan)\n\nDinner: - (Assuming dinner is in Chicago and not included in the travel plan)\n\nAccommodation: - (Assuming accommodation is not needed as the trip ends)\n\nNumber of people: 2\nTotal cost for Day 3: $362 (flight)\n\n**Total cost across all days**: $1,239 (Day 1) + $474 (Day 2) + $362 (Day 3) = $2,075\n\nCuisines: The prompt specifies no specific cuisines, so all cuisine constraints are satisfied.\n\nRemaining budget: $2,300 - $2,075 = $225\n\nPlease note that the attractions listed for Day 2 are free of charge, and the accommodation cost for Day 2 is already covered in Day 1 as it is the same apartment. The total cost is within the specified budget, and the plan includes transportation, meals, and accommodation as per the constraints.", "gpt-4-1106-preview_direct_sole-planning_parsed_results": [{"day": 1, "current_city": "from Chicago to Albany", "transportation": "Flight Number: F3983350, from Chicago to Albany, Departure Time: 14:29, Arrival Time: 17:03", "breakfast": "-", "attraction": "-", "lunch": "-", "dinner": "Echoes Satyaniketan, Albany", "accommodation": "Mid Town East Side Apartment, Albany"}, {"day": 2, "current_city": "Albany", "transportation": "-", "breakfast": "Cafe Coffee Day, Albany", "attraction": "New York State Museum, Albany;USS SLATER, Albany;", "lunch": "Jahangeer Foods, Albany", "dinner": "Kaiser, Albany", "accommodation": "Mid Town East Side Apartment, Albany"}, {"day": 3, "current_city": "from Albany to Chicago", "transportation": "Flight Number: F4008387, from Albany to Chicago, Departure Time: 05:05, Arrival Time: 06:11", "breakfast": "-", "attraction": "-", "lunch": "-", "dinner": "-", "accommodation": "-"}]}]