[{"gpt-4-1106-preview_direct_sole-planning_results": "Travel Plan:\n\nDay 1: March 18, 2022 - From Newark to Miami\n- Transportation: Flight F3702793, from Newark to Miami, cost: $266, duration: 2 hours 56 minutes\n- Breakfast: Not applicable (Assuming flight is early morning)\n- Attraction: Jungle Island, Miami, cost: $0 (Assuming free entry or covered by a city pass)\n- Lunch: Clocked, Miami, cost: $49 x 3 = $147, cuisines: Tea, Italian, Mexican, BBQ, Cafe\n- Dinner: Shorts Burger and Shine, Miami, cost: $81 x 3 = $243, cuisines: Chinese, Cafe, Seafood\n- Accommodation: \"HELLO BROOKLYN\" PARK SIDE VIEW NEWLY RENO APT., Miami, cost: $789, Entire home/apt, house rules: No parties & No visitors\n\nNumber of people: 3\nTotal cost: 3 x $266 + $147 + $243 + $789 = $2,077\n\nDay 2: March 19, 2022 - Miami\n- Transportation: Not applicable (Staying in Miami)\n- Breakfast: Papouli's Mediterranean Cafe & Market, Miami, cost: $26 x 3 = $78, cuisines: Tea, Desserts\n- Attraction: P\u00e9rez Art Museum Miami, Miami, cost: $0 (Assuming free entry or covered by a city pass)\n- Lunch: Tako Cheena by Pom Pom, Miami, cost: $60 x 3 = $180, cuisines: Fast Food, Indian, Desserts, Italian\n- Dinner: AB's Absolute Barbecues, Miami, cost: $55 x 3 = $165, cuisines: Desserts, Tea, Pizza, Italian, Fast Food, American\n- Accommodation: \"HELLO BROOKLYN\" PARK SIDE VIEW NEWLY RENO APT., Miami, cost: $789\n\nNumber of people: 3\nTotal cost: $78 + $180 + $165 + $789 = $1,212\n\nDay 3: March 20, 2022 - From Miami to Punta Gorda\n- Transportation: Taxi from Miami to Punta Gorda, cost: $291\n- Breakfast: Anjlika, Miami, cost: $56 x 3 = $168, cuisines: Pizza, Italian, Fast Food, Cafe, Mediterranean, Seafood\n- Attraction: Laishley Park, Punta Gorda, cost: $0 (Assuming free entry or covered by a city pass)\n- Lunch: Cookie Shoppe, Punta Gorda, cost: $44 x 3 = $132, cuisines: Tea, Bakery, BBQ, Mediterranean, Seafood\n- Dinner: Pho Bac, Punta Gorda, cost: $19 x 3 = $57, cuisines: Fast Food, Mediterranean, Desserts, Italian\n- Accommodation: Beautiful Manhattan Apt- 20 min to Times Square, Punta Gorda, cost: $79, Entire home/apt, house rules: No children under 10\n\nNumber of people: 3\nTotal cost: $291 + $168 + $132 + $57 + $79 = $727\n\nDay 4: March 21, 2022 - Punta Gorda\n- Transportation: Not applicable (Staying in Punta Gorda)\n- Breakfast: China Cafe, Punta Gorda, cost: $69 x 3 = $207, cuisines: Desserts, Bakery, Cafe, Mediterranean, Seafood\n- Attraction: Charlotte Harbor Preserve State Park, Punta Gorda, cost: $0 (Assuming free entry or covered by a city pass)\n- Lunch: G Thal, Punta Gorda, cost: $61 x 3 = $183, cuisines: Desserts, Bakery, Cafe, American, Mediterranean\n- Dinner: Gelato Vinto, Punta Gorda, cost: $43 x 3 = $129, cuisines: Cafe, BBQ\n- Accommodation: Beautiful Manhattan Apt- 20 min to Times Square, Punta Gorda, cost: $79\n\nNumber of people: 3\nTotal cost: $207 + $183 + $129 + $79 = $598\n\nDay 5: March 22, 2022 - From Punta Gorda to Jacksonville\n- Transportation: Taxi from Punta Gorda to Jacksonville, cost: $474\n- Breakfast: Urban Cuisine, Punta Gorda, cost: $84 x 3 = $252, cuisines: Desserts, Tea, Mexican, Fast Food, Chinese, Seafood\n- Attraction: Jacksonville Zoo and Gardens, Jacksonville, cost: $0 (Assuming free entry or covered by a city pass)\n- Lunch: Villa Gargano, Jacksonville, cost: $51 x 3 = $153, cuisines: Tea, American, Desserts\n- Dinner: Pirates' House Restaurant, Jacksonville, cost: $59 x 3 = $177, cuisines: Chinese, Pizza, BBQ\n- Accommodation: NYC Sanctuary, Skyline Views & Rooftop, Jacksonville, cost: $954, Entire home/apt, house rules: No smoking\n\nNumber of people: 3\nTotal cost: $474 + $252 + $153 + $177 + $954 = $2,010\n\nDay 6: March 23, 2022 - Jacksonville\n- Transportation: Not applicable (Staying in Jacksonville)\n- Breakfast: Goose Feathers Cafe and Bakery, Jacksonville, cost: $57 x 3 = $171, cuisines: Tea, Fast Food, Italian\n- Attraction: Southbank Riverwalk, Jacksonville, cost: $0 (Assuming free entry or covered by a city pass)\n- Lunch: Ashoka Restaurant, Jacksonville, cost: $11 x 3 = $33, cuisines: Desserts, Mexican, Bakery, BBQ, Fast Food\n- Dinner: Sanjha Chulha, Jacksonville, cost: $57 x 3 = $171, cuisines: Tea, Bakery, BBQ\n- Accommodation: NYC Sanctuary, Skyline Views & Rooftop, Jacksonville, cost: $954\n\nNumber of people: 3\nTotal cost: $171 + $33 + $171 + $954 = $1,329\n\nDay 7: March 24, 2022 - From Jacksonville to Newark\n- Transportation: Flight F4075995, from Jacksonville to Newark, cost: $306, duration: 1 hour 53 minutes\n- Breakfast: Touch of Spice, Jacksonville, cost: $70 x 3 = $210, cuisines: French, Bakery, Indian, Seafood\n- Attraction: Not applicable (Assuming travel day)\n- Lunch: Not applicable (Assuming travel day)\n- Dinner: Not applicable (Assuming arrival in Newark in the evening)\n- Accommodation: Not applicable (End of trip)\n\nNumber of people: 3\nTotal cost: 3 x $306 + $210 = $1,128\n\nTotal cost across all days: $2,077 + $1,212 + $727 + $598 + $2,010 + $1,329 + $1,128 = $9,081\n\nRemaining budget: $10,400 - $9,081 = $1,319\n\nCuisines: All cuisine constraints are satisfied.\nAccommodations: All accommodations are entire rooms, meeting the requirement.\nHouse rules: All accommodations allow parties except for those with specific house rules against it.\n\nPlease note that the costs for attractions are assumed to be covered by a city pass or are free of charge. If there are entry fees, they will need to be added to the total cost. Additionally, the costs for transportation, meals, and accommodations are based on the provided reference information and may vary. The actual availability and prices should be confirmed with the service providers.", "gpt-4-1106-preview_direct_sole-planning_parsed_results": [{"day": 1, "current_city": "from Newark to Miami", "transportation": "Flight Number: F3702793, from Newark to Miami, Departure Time: -, Arrival Time: -", "breakfast": "-", "attraction": "Jungle Island, Miami;", "lunch": "Clocked, Miami", "dinner": "Shorts Burger and Shine, Miami", "accommodation": "\"HELLO BROOKLYN\" PARK SIDE VIEW NEWLY RENO APT., Miami"}, {"day": 2, "current_city": "Miami", "transportation": "-", "breakfast": "Papouli's Mediterranean Cafe & Market, Miami", "attraction": "P\u00e9rez Art Museum Miami, Miami;", "lunch": "Tako Cheena by Pom Pom, Miami", "dinner": "AB's Absolute Barbecues, Miami", "accommodation": "\"HELLO BROOKLYN\" PARK SIDE VIEW NEWLY RENO APT., Miami"}, {"day": 3, "current_city": "from Miami to Punta Gorda", "transportation": "Taxi, from Miami to Punta Gorda", "breakfast": "Anjlika, Miami", "attraction": "Laishley Park, Punta Gorda;", "lunch": "Cookie Shoppe, Punta Gorda", "dinner": "Pho Bac, Punta Gorda", "accommodation": "Beautiful Manhattan Apt- 20 min to Times Square, Punta Gorda"}, {"day": 4, "current_city": "Punta Gorda", "transportation": "-", "breakfast": "China Cafe, Punta Gorda", "attraction": "Charlotte Harbor Preserve State Park, Punta Gorda;", "lunch": "G Thal, Punta Gorda", "dinner": "Gelato Vinto, Punta Gorda", "accommodation": "Beautiful Manhattan Apt- 20 min to Times Square, Punta Gorda"}, {"day": 5, "current_city": "from Punta Gorda to Jacksonville", "transportation": "Taxi, from Punta Gorda to Jacksonville", "breakfast": "Urban Cuisine, Punta Gorda", "attraction": "Jacksonville Zoo and Gardens, Jacksonville;", "lunch": "Villa Gargano, Jacksonville", "dinner": "Pirates' House Restaurant, Jacksonville", "accommodation": "NYC Sanctuary, Skyline Views & Rooftop, Jacksonville"}, {"day": 6, "current_city": "Jacksonville", "transportation": "-", "breakfast": "Goose Feathers Cafe and Bakery, Jacksonville", "attraction": "Southbank Riverwalk, Jacksonville;", "lunch": "Ashoka Restaurant, Jacksonville", "dinner": "Sanjha Chulha, Jacksonville", "accommodation": "NYC Sanctuary, Skyline Views & Rooftop, Jacksonville"}, {"day": 7, "current_city": "from Jacksonville to Newark", "transportation": "Flight Number: F4075995, from Jacksonville to Newark, Departure Time: -, Arrival Time: -", "breakfast": "Touch of Spice, Jacksonville", "attraction": "-", "lunch": "-", "dinner": "-", "accommodation": "-"}]}]