[{"gpt-4-1106-preview_direct_sole-planning_results": "Based on the provided information and constraints, here is a 3-day travel itinerary for a party of 2 from Jacksonville to Washington:\n\n***** Travel Plan *****\n\nDay 1: March 3rd, 2022\nCurrent City: from Jacksonville to Washington\nTransportation: Flight F3635008, from Jacksonville to Washington, duration: 1 hour 46 minutes, cost: $133 per person\nBreakfast: -\nAttraction: -\nLunch: -\nDinner: Los Aztecas, Washington, cost: $46, cuisines: Cafe, Bakery, BBQ, Fast Food\nAccommodation: Comfortable & Cozy Times Square Apt, Washington, cost: $499, maximum occupancy: 3, house rules: No parties & No children under 10, minimum nights: 2\n\nNumber of people: 2\nTotal cost: 2 x $133 (Flight) + 2 x $46 (Dinner) + $499 (Accommodation) = $857\nAccommodation minimum nights: 1/2\n\nDay 2: March 4th, 2022\nCurrent City: Washington\nTransportation: -\nBreakfast: Manna Java World Cafe, Washington, cost: $59, cuisines: Cafe, Seafood\nAttraction: The Seattle Great Wheel, Washington\nLunch: Hemingway's Island Grill, Washington, cost: $57, cuisines: Mexican, BBQ, Fast Food, Cafe, Seafood\nDinner: Thaaliwala, Washington, cost: $88, cuisines: Tea, Pizza, Italian, BBQ, Cafe\nAccommodation: Comfortable & Cozy Times Square Apt, Washington, cost: $499, maximum occupancy: 3, house rules: No parties & No children under 10, minimum nights: 2\n\nNumber of people: 2\nTotal cost: 2 x $59 (Breakfast) + 2 x $57 (Lunch) + 2 x $88 (Dinner) + $499 (Accommodation) = $907\nAccommodation minimum nights: 2/2\n\nDay 3: March 5th, 2022\nCurrent City: from Washington to Jacksonville\nTransportation: Flight F3786730, from Washington to Jacksonville, duration: 2 hours 10 minutes, cost: $196 per person\nBreakfast: Cafe Coffee Day, Washington, cost: $53, cuisines: Tea, Mexican, Fast Food, Cafe, American, Seafood\nAttraction: -\nLunch: -\nDinner: -\nAccommodation: -\n\nNumber of people: 2\nTotal cost: 2 x $196 (Flight) + 2 x $53 (Breakfast) = $498\n\nTotal cost across all days: $857 (Day 1) + $907 (Day 2) + $498 (Day 3) = $2,262\n\nUnfortunately, the total cost of $2,262 exceeds the specified budget of $1,000. To meet the budget constraint, we need to make adjustments:\n\n- Choose the cheapest flight options.\n- Opt for more budget-friendly meals.\n- Find accommodations that allow parties but are within budget.\n\nRevised Travel Plan:\n\nDay 1: March 3rd, 2022\nTransportation: Flight F3635008, cost: $133 per person\nDinner: Moradabadi Biryani, cost: $12\nAccommodation: Stunning 2Bed/2BA + 300sqft deck by the river!, cost: $209, house rules: No visitors, minimum nights: 1\n\nTotal cost for Day 1: 2 x $133 + 2 x $12 + $209 = $499\n\nDay 2: March 4th, 2022\nBreakfast: Hearken Caf\u6106, cost: $30\nLunch: Good Foods, cost: $65\nDinner: Republic of Chicken, cost: $91\nAccommodation: Stunning 2Bed/2BA + 300sqft deck by the river!, cost: $209\n\nTotal cost for Day 2: 2 x $30 + 2 x $65 + 2 x $91 + $209 = $581\n\nDay 3: March 5th, 2022\nTransportation: Flight F3786730, cost: $196 per person\nBreakfast: -\n\nTotal cost for Day 3: 2 x $196 = $392\n\nTotal revised cost across all days: $499 (Day 1) + $581 (Day 2) + $392 (Day 3) = $1,472\n\nThe revised plan still exceeds the budget. To fit within the $1,000 budget, we may need to consider self-driving or other transportation methods, and further adjust meal and accommodation choices. However, the provided data does not include cheaper options that would allow us to create a plan within the $1,000 budget while meeting all the constraints.", "gpt-4-1106-preview_direct_sole-planning_parsed_results": [{"day": 1, "current_city": "from Jacksonville to Washington", "transportation": "Flight Number: F3635008, from Jacksonville to Washington, Departure Time: -, Arrival Time: -", "breakfast": "-", "attraction": "-", "lunch": "-", "dinner": "Los Aztecas, Washington", "accommodation": "Comfortable & Cozy Times Square Apt, Washington"}, {"day": 2, "current_city": "Washington", "transportation": "-", "breakfast": "Manna Java World Cafe, Washington", "attraction": "The Seattle Great Wheel, Washington", "lunch": "Hemingway's Island Grill, Washington", "dinner": "Thaaliwala, Washington", "accommodation": "Comfortable & Cozy Times Square Apt, Washington"}, {"day": 3, "current_city": "from Washington to Jacksonville", "transportation": "Flight Number: F3786730, from Washington to Jacksonville, Departure Time: -, Arrival Time: -", "breakfast": "Cafe Coffee Day, Washington", "attraction": "-", "lunch": "-", "dinner": "-", "accommodation": "-"}]}]