[{"gpt-4-1106-preview_direct_sole-planning_results": "Based on the provided information and constraints, here is a 3-day travel plan for a group of 4 people traveling from Dallas to Huntsville:\n\n***** Travel Plan *****\n\nDay 1: March 13th, 2022\n- Current City: from Dallas (Texas) to Huntsville (Alabama)\n- Transportation: Flight F3602997, from Dallas to Huntsville, duration: 2 hours 2 minutes, cost: $264 per person\n- Breakfast: -\n- Attraction: -\n- Lunch: -\n- Dinner: Downtown Grill, Huntsville, cost: $74, cuisines: Pizza, Bakery\n- Accommodation: Artsy Harlem Guest Space, Huntsville, cost: $1186, room type: Entire home/apt, house rules: No smoking & No pets, minimum nights: 3, maximum occupancy: 8\n\nNumber of people: 4\nTotal cost: 4 x $264 (Flight) + 4 x $74 (Dinner) + $1186 (Accommodation) = $2,342\nAccommodation minimum nights: 1/3\n\nDay 2: March 14th, 2022\n- Current City: Huntsville\n- Transportation: -\n- Breakfast: Breakfast Hut, Huntsville, cost: $81, cuisines: Cafe, Bakery, Desserts, Seafood\n- Attraction: U.S. Space & Rocket Center, Huntsville; Huntsville Botanical Garden, Huntsville\n- Lunch: Moksh The Restro Lounge, Huntsville, cost: $77, cuisines: Pizza, American, BBQ, Fast Food, Indian\n- Dinner: Desee Dakshin Coastal Cafe, Huntsville, cost: $96, cuisines: Desserts, Cafe, BBQ, Bakery, Chinese\n- Accommodation: Artsy Harlem Guest Space, Huntsville (same as Day 1)\n\nNumber of people: 4\nTotal cost: 4 x $81 (Breakfast) + 4 x $77 (Lunch) + 4 x $96 (Dinner) + $0 (Accommodation already paid on Day 1) = $1,016\nAccommodation minimum nights: 2/3\n\nDay 3: March 15th, 2022\n- Current City: from Huntsville to Dallas\n- Transportation: Self-driving from Huntsville to Dallas, duration: 10 hours 13 mins, distance: 1,072 km, cost: $53 per person\n- Breakfast: Cherry Comet, Huntsville, cost: $16, cuisines: Desserts, Tea, Pizza, Cafe, Mediterranean\n- Attraction: -\n- Lunch: -\n- Dinner: -\n- Accommodation: -\n\nNumber of people: 4\nTotal cost: 4 x $53 (Self-driving) + 4 x $16 (Breakfast) = $276\n\nTotal cost across all days: $2,342 (Day 1) + $1,016 (Day 2) + $276 (Day 3) = $3,634\n\n***** End of Travel Plan *****\n\nUnfortunately, the total cost of $3,634 exceeds the specified budget of $2,700. To adjust the plan to fit within the budget, we can consider the following changes:\n\n- Opt for self-driving instead of flights to reduce transportation costs.\n- Choose less expensive restaurants for meals.\n- Find accommodations that are within budget while still meeting the requirement for entire rooms.\n\nPlease note that the provided accommodation \"Artsy Harlem Guest Space\" exceeds the budget when considering the cost of meals and transportation. Adjustments to the plan are necessary to stay within the budget.", "gpt-4-1106-preview_direct_sole-planning_parsed_results": [{"day": 1, "current_city": "from Dallas to Huntsville", "transportation": "Flight Number: F3602997, from Dallas to Huntsville, Departure Time: -, Arrival Time: -", "breakfast": "-", "attraction": "-", "lunch": "-", "dinner": "Downtown Grill, Huntsville", "accommodation": "Artsy Harlem Guest Space, Huntsville"}, {"day": 2, "current_city": "Huntsville", "transportation": "-", "breakfast": "Breakfast Hut, Huntsville", "attraction": "U.S. Space & Rocket Center, Huntsville;Huntsville Botanical Garden, Huntsville;", "lunch": "Moksh The Restro Lounge, Huntsville", "dinner": "Desee Dakshin Coastal Cafe, Huntsville", "accommodation": "Artsy Harlem Guest Space, Huntsville"}, {"day": 3, "current_city": "from Huntsville to Dallas", "transportation": "Self-driving from Huntsville to Dallas, Departure Time: -, Arrival Time: -", "breakfast": "Cherry Comet, Huntsville", "attraction": "-", "lunch": "-", "dinner": "-", "accommodation": "-"}]}]