[{"gpt-4-1106-preview_direct_sole-planning_results": "Based on the provided information and constraints, here is a travel plan for a group of 3 from Myrtle Beach to Massachusetts, visiting Boston and Martha's Vineyard over five days, with a budget of $3,800, preference for entire rooms where smoking is allowed, and interest in Indian, Mexican, American, and Mediterranean cuisines.\n\n**Day 1: March 12, 2022 - Myrtle Beach to Boston**\n- Transportation: Flight F3613545 from Myrtle Beach to Boston, cost: $260 per person\n- Dinner: Red Mesa Restaurant, Boston, cost: $65, cuisines: Desserts, Tea, Fast Food, Indian, Seafood\n- Accommodation: IN MINT CONDITION-STUDIOS EAST 44TH/UNITED NATIONS, Boston, cost: $1058, entire home/apt, house rules: No visitors & No smoking, minimum nights: 30\n\nNumber of people: 3\nTotal cost: 3 x $260 (flight) + 3 x $65 (dinner) + $1058 (accommodation) = $1783\nAccommodation minimum nights: 1/30\n\n**Day 2: March 13, 2022 - Boston**\n- Breakfast: Irish Democrat, Boston, cost: $18, cuisines: Tea, Cafe, Bakery, Fast Food\n- Attraction: Museum of Science, Boston; Boston Tea Party Ships & Museum, Boston\n- Lunch: Club Cubana, Boston, cost: $65, cuisines: Desserts, BBQ, Fast Food, Cafe, Indian, Mediterranean\n- Dinner: Double Roti, Boston, cost: $78, cuisines: Desserts, Tea, French, Bakery, Mediterranean, Seafood\n- Accommodation: IN MINT CONDITION-STUDIOS EAST 44TH/UNITED NATIONS, Boston, cost: $1058, entire home/apt, house rules: No visitors & No smoking, minimum nights: 30\n\nNumber of people: 3\nTotal cost: 3 x $18 (breakfast) + 3 x $65 (lunch) + 3 x $78 (dinner) + $1058 (accommodation) = $1443\nAccommodation minimum nights: 2/30\n\n**Day 3: March 14, 2022 - Boston to Martha's Vineyard**\n- Transportation: Self-driving from Boston to Martha's Vineyard, cost: $7 per person\n- Lunch: Bern's Steak House, Martha's Vineyard, cost: $35, cuisines: Desserts, Mexican, Bakery, BBQ, Indian, Seafood\n- Dinner: The Punjab Kitchen, Martha's Vineyard, cost: $80, cuisines: Tea, French, Bakery, Italian\n- Accommodation: One Bed Room Apt In Midtown East, Martha's Vineyard, cost: $450, entire home/apt, house rules: No children under 10 & No smoking, minimum nights: 2\n\nNumber of people: 3\nTotal cost: 3 x $7 (transportation) + 3 x $35 (lunch) + 3 x $80 (dinner) + $450 (accommodation) = $819\nAccommodation minimum nights: 1/2\n\n**Day 4: March 15, 2022 - Martha's Vineyard**\n- Breakfast: Yellow Dog Eats, Martha's Vineyard, cost: $34, cuisines: Cafe, Indian, Desserts, Seafood\n- Attraction: Martha's Vineyard Museum; Aquinnah Cliffs Overlook, Martha's Vineyard\n- Lunch: Prankster, Martha's Vineyard, cost: $34, cuisines: Bakery, BBQ, Fast Food\n- Dinner: Depot Eatery and Oyster Bar, Martha's Vineyard, cost: $75, cuisines: Pizza, Cafe, American, Mediterranean, Seafood\n- Accommodation: One Bed Room Apt In Midtown East, Martha's Vineyard, cost: $450, entire home/apt, house rules: No children under 10 & No smoking, minimum nights: 2\n\nNumber of people: 3\nTotal cost: 3 x $34 (breakfast) + 3 x $34 (lunch) + 3 x $75 (dinner) + $450 (accommodation) = $891\nAccommodation minimum nights: 2/2\n\n**Day 5: March 16, 2022 - Martha's Vineyard to Myrtle Beach**\n- Transportation: Self-driving from Martha's Vineyard to Myrtle Beach, cost: $74 per person\n- Breakfast: Gemelli Cucina Bar, Martha's Vineyard, cost: $42, cuisines: Desserts, Tea, Cafe, French, Chinese, Seafood\n\nNumber of people: 3\nTotal cost: 3 x $74 (transportation) + 3 x $42 (breakfast) = $348\n\n**Total cost across all days: $1783 (Day 1) + $1443 (Day 2) + $819 (Day 3) + $891 (Day 4) + $348 (Day 5) = $5284**\n\nUnfortunately, the total cost exceeds the specified budget of $3,800. To adjust the plan within the budget, we would need to consider alternative accommodations, dining options, or attractions that are less expensive. Additionally, the accommodation selected does not allow smoking, which is against the specified preferences. Adjustments would need to be made to meet all constraints and preferences.", "gpt-4-1106-preview_direct_sole-planning_parsed_results": [{"day": 1, "current_city": "from Myrtle Beach to Boston", "transportation": "Flight Number: F3613545, from Myrtle Beach to Boston", "breakfast": "-", "attraction": "-", "lunch": "-", "dinner": "Red Mesa Restaurant, Boston", "accommodation": "IN MINT CONDITION-STUDIOS EAST 44TH/UNITED NATIONS, Boston"}, {"day": 2, "current_city": "Boston", "transportation": "-", "breakfast": "Irish Democrat, Boston", "attraction": "Museum of Science, Boston;Boston Tea Party Ships & Museum, Boston;", "lunch": "Club Cubana, Boston", "dinner": "Double Roti, Boston", "accommodation": "IN MINT CONDITION-STUDIOS EAST 44TH/UNITED NATIONS, Boston"}, {"day": 3, "current_city": "from Boston to Martha's Vineyard", "transportation": "Self-driving from Boston to Martha's Vineyard", "breakfast": "-", "attraction": "-", "lunch": "Bern's Steak House, Martha's Vineyard", "dinner": "The Punjab Kitchen, Martha's Vineyard", "accommodation": "One Bed Room Apt In Midtown East, Martha's Vineyard"}, {"day": 4, "current_city": "Martha's Vineyard", "transportation": "-", "breakfast": "Yellow Dog Eats, Martha's Vineyard", "attraction": "Martha's Vineyard Museum;Aquinnah Cliffs Overlook, Martha's Vineyard;", "lunch": "Prankster, Martha's Vineyard", "dinner": "Depot Eatery and Oyster Bar, Martha's Vineyard", "accommodation": "One Bed Room Apt In Midtown East, Martha's Vineyard"}, {"day": 5, "current_city": "from Martha's Vineyard to Myrtle Beach", "transportation": "Self-driving from Martha's Vineyard to Myrtle Beach", "breakfast": "Gemelli Cucina Bar, Martha's Vineyard", "attraction": "-", "lunch": "-", "dinner": "-", "accommodation": "-"}]}]