[{"gpt-4-1106-preview_direct_sole-planning_results": "Based on the provided information and constraints, here is the travel plan for an individual from St. Petersburg to Appleton, from March 19th to March 21st, 2022, with a budget of $1,200.\n\n**Day 1: March 19, 2022 - From St. Petersburg to Appleton**\n\n- Current City: St. Petersburg\n- Transportation: Flight F3574992 from St. Petersburg to Appleton, cost: $542, departure: 22:51, arrival: 00:42, duration: 2 hours 51 minutes, distance: 1173 km\n- Breakfast: -\n- Attraction: -\n- Lunch: -\n- Dinner: -\n- Accommodation: Cozy room + bright apartment + rooftop lounge, Appleton, cost: $666, room type: Private room, house rules: No smoking, minimum nights: 1, maximum occupancy: 1\n\nNumber of people: 1\nTotal cost for Day 1: $542 (flight) + $666 (accommodation) = $1,208\n\n**Day 2: March 20, 2022 - Appleton**\n\n- Current City: Appleton\n- Transportation: -\n- Breakfast: Destination Live, Appleton, cost: $30, cuisines: Tea, Indian, BBQ\n- Attraction: The History Museum at the Castle, Appleton; Hearthstone Historic House Museum, Appleton\n- Lunch: Swati Snacks, Appleton, cost: $84, cuisines: Desserts, Bakery, BBQ, Fast Food, American\n- Dinner: Brick 29, Appleton, cost: $97, cuisines: Desserts, Tea, BBQ, Cafe, American, Mediterranean\n- Accommodation: Cozy room + bright apartment + rooftop lounge, Appleton (already paid for Day 1)\n\nNumber of people: 1\nTotal cost for Day 2: $30 (breakfast) + $84 (lunch) + $97 (dinner) = $211\n\n**Day 3: March 21, 2022 - From Appleton to St. Petersburg**\n\n- Current City: Appleton\n- Transportation: Flight F3578689 from Appleton to St. Petersburg, cost: $332, departure: 07:19, arrival: 11:01, duration: 2 hours 42 minutes, distance: 1173 km\n- Breakfast: -\n- Attraction: -\n- Lunch: -\n- Dinner: -\n- Accommodation: -\n\nNumber of people: 1\nTotal cost for Day 3: $332 (flight)\n\n**Total cost across all days: $1,208 (Day 1) + $211 (Day 2) + $332 (Day 3) = $1,751**\n\nUnfortunately, the total cost exceeds the specified budget of $1,200. To adhere to the budget, we need to make adjustments. Since the flights and accommodation on Day 1 already exceed the budget, we cannot proceed with this plan. We need to find alternative transportation and accommodation options within the budget.\n\nHowever, based on the provided information, there are no valid self-driving or taxi options from St. Petersburg to Appleton. Therefore, we cannot create a feasible travel plan within the specified budget using the available data.", "gpt-4-1106-preview_direct_sole-planning_parsed_results": [{"day": 1, "current_city": "from St. Petersburg to Appleton", "transportation": "Flight Number: F3574992, from St. Petersburg to Appleton, Departure Time: 22:51, Arrival Time: 00:42", "breakfast": "-", "attraction": "-", "lunch": "-", "dinner": "-", "accommodation": "Cozy room + bright apartment + rooftop lounge, Appleton"}, {"day": 2, "current_city": "Appleton", "transportation": "-", "breakfast": "Destination Live, Appleton", "attraction": "The History Museum at the Castle, Appleton;Hearthstone Historic House Museum, Appleton;", "lunch": "Swati Snacks, Appleton", "dinner": "Brick 29, Appleton", "accommodation": "Cozy room + bright apartment + rooftop lounge, Appleton"}, {"day": 3, "current_city": "from Appleton to St. Petersburg", "transportation": "Flight Number: F3578689, from Appleton to St. Petersburg, Departure Time: 07:19, Arrival Time: 11:01", "breakfast": "-", "attraction": "-", "lunch": "-", "dinner": "-", "accommodation": "-"}]}]