[{"gpt-4-1106-preview_direct_sole-planning_results": "Travel Plan:\n\nDay 1: March 27th, 2022\nCurrent City: from Denver (Colorado) to Palm Springs (California)\nTransportation: Flight F3880999, from Denver to Palm Springs, duration: 2 hours 12 minutes, cost: $227\nBreakfast: -\nAttraction: -\nLunch: -\nDinner: Bar Gernika Basque Pub & Eatery, Palm Springs, cost: $50, cuisines: Tea, Pizza, Desserts, Fast Food\nAccommodation: Brooklyn Gem, Palm Springs, cost: $877, room type: Entire home/apt, house rules: No children under 10, minimum nights: 2, maximum occupancy: 4\n\nNumber of people: 1\nTotal cost: 1 x $227 + 1 x $50 + 1 x $877 = $1,154\nAccommodation minimum nights: 1/2\n\nDay 2: March 28th, 2022\nCurrent City: Palm Springs\nTransportation: -\nBreakfast: Sugar & Spice - Le Marche, Palm Springs, cost: $33, cuisines: Tea, French, Cafe\nAttraction: Palm Springs Art Museum, Palm Springs\nLunch: Kahill's Steak-Fish Chophouse, Palm Springs, cost: $38, cuisines: Cafe, Bakery, American\nDinner: Jaan, Palm Springs, cost: $215, cuisines: Seafood, Mexican, Fast Food\nAccommodation: Brooklyn Gem, Palm Springs, cost: $877, room type: Entire home/apt, house rules: No children under 10, minimum nights: 2, maximum occupancy: 4\n\nNumber of people: 1\nTotal cost: 1 x $33 + 1 x $38 + 1 x $215 + 1 x $877 = $1,163\nAccommodation minimum nights: 2/2\n\nDay 3: March 29th, 2022\nCurrent City: from Palm Springs to Denver\nTransportation: Flight F3870938, from Palm Springs to Denver, duration: 2 hours 0 minutes, cost: $241\nBreakfast: Hao Ming, Palm Springs, cost: $29, cuisines: Tea, Cafe, Desserts, Fast Food\nAttraction: -\nLunch: -\nDinner: -\nAccommodation: -\n\nNumber of people: 1\nTotal cost: 1 x $241 + 1 x $29 = $270\n\nTotal cost across all days: $1,154 + $1,163 + $270 = $2,587\n\nUnfortunately, the total cost exceeds the specified budget of $2,200. Adjustments are needed to meet the budget constraint. Let's choose a different accommodation to reduce the cost.\n\nRevised Accommodation for Day 1 and Day 2:\nAccommodation: Sunlit Charming Studio in Park Slope, Palm Springs, cost: $812, room type: Entire home/apt, house rules: No visitors, minimum nights: 30, maximum occupancy: 2\n\nRevised Total cost for Day 1: 1 x $227 + 1 x $50 + 1 x $812 = $1,089\nRevised Total cost for Day 2: 1 x $33 + 1 x $38 + 1 x $215 + 1 x $812 = $1,098\n\nRevised Total cost across all days: $1,089 + $1,098 + $270 = $2,457\n\nThe revised total cost still exceeds the budget. We need to choose a more affordable accommodation option.\n\nFinal Revised Accommodation for Day 1 and Day 2:\nAccommodation: Gorgeous 1BR brownstone in Harlem close to trains, Palm Springs, cost: $430, room type: Entire home/apt, house rules: No visitors & No pets, minimum nights: 15, maximum occupancy: 3\n\nFinal Revised Total cost for Day 1: 1 x $227 + 1 x $50 + 1 x $430 = $707\nFinal Revised Total cost for Day 2: 1 x $33 + 1 x $38 + 1 x $215 + 1 x $430 = $716\n\nFinal Revised Total cost across all days: $707 + $716 + $270 = $1,693\n\nThe final revised total cost is within the specified budget of $2,200.", "gpt-4-1106-preview_direct_sole-planning_parsed_results": [{"day": 1, "current_city": "from Denver to Palm Springs", "transportation": "Flight Number: F3880999, from Denver to Palm Springs, Departure Time: -, Arrival Time: -", "breakfast": "-", "attraction": "-", "lunch": "-", "dinner": "Bar Gernika Basque Pub & Eatery, Palm Springs", "accommodation": "Gorgeous 1BR brownstone in Harlem close to trains, Palm Springs"}, {"day": 2, "current_city": "Palm Springs", "transportation": "-", "breakfast": "Sugar & Spice - Le Marche, Palm Springs", "attraction": "Palm Springs Art Museum, Palm Springs", "lunch": "Kahill's Steak-Fish Chophouse, Palm Springs", "dinner": "Jaan, Palm Springs", "accommodation": "Gorgeous 1BR brownstone in Harlem close to trains, Palm Springs"}, {"day": 3, "current_city": "from Palm Springs to Denver", "transportation": "Flight Number: F3870938, from Palm Springs to Denver, Departure Time: -, Arrival Time: -", "breakfast": "Hao Ming, Palm Springs", "attraction": "-", "lunch": "-", "dinner": "-", "accommodation": "-"}]}]