[{"gpt-4-1106-preview_direct_sole-planning_results": "Travel Plan:\n\nDay 1: March 11, 2022 - From Cedar Rapids to Dallas\n- Transportation: Self-driving from Cedar Rapids to Dallas, duration: 12 hours 26 mins, distance: 1,324 km, cost: $66 x 2 = $132\n- Breakfast: -\n- Attraction: -\n- Lunch: -\n- Dinner: Coconuts Fish Cafe, Dallas, cost: $38 x 2 = $76, cuisines: Cafe, BBQ, Mediterranean, Fast Food\n- Accommodation: Luxury Williamsburg duplex, private roof terrace, Dallas, cost: $241 x 2 = $482, house rules: No visitors, minimum nights: 4, maximum occupancy: 3\n\nNumber of people: 2\nTotal cost for Day 1: $132 + $76 + $482 = $690\n\nDay 2: March 12, 2022 - Dallas\n- Transportation: -\n- Breakfast: Cafe Gatherings, Dallas, cost: $17 x 2 = $34, cuisines: Bakery, Indian, Desserts\n- Attraction: The Dallas World Aquarium; The Sixth Floor Museum at Dealey Plaza\n- Lunch: 1918 Bistro & Grill, Dallas, cost: $90 x 2 = $180, cuisines: Tea, Pizza, BBQ, Seafood\n- Dinner: Yanki Sizzlers, Dallas, cost: $96 x 2 = $192, cuisines: Cafe, French, Tea, Mediterranean\n- Accommodation: Luxury Williamsburg duplex, private roof terrace, Dallas, cost: $241 x 2 = $482\n\nNumber of people: 2\nTotal cost for Day 2: $34 + $180 + $192 + $482 = $888\n\nDay 3: March 13, 2022 - From Dallas to Austin\n- Transportation: Self-driving from Dallas to Austin, duration: 2 hours 53 mins, distance: 314 km, cost: $15 x 2 = $30\n- Breakfast: Aravali Owls, Dallas, cost: $53 x 2 = $106, cuisines: Pizza, Italian, Bakery, Fast Food, Cafe\n- Attraction: Zilker Metropolitan Park; Bullock Texas State History Museum\n- Lunch: The Kasbah, Austin, cost: $88 x 2 = $176, cuisines: Cafe, Pizza, BBQ, Fast Food\n- Dinner: Wildflour Cafe + Bakery, Austin, cost: $55 x 2 = $110, cuisines: Desserts, French, Bakery, BBQ, Seafood\n- Accommodation: Entire 2 bedroom top floor in Clinton Hill, Austin, cost: $317 x 2 = $634, house rules: No visitors, minimum nights: 28, maximum occupancy: 3\n\nNumber of people: 2\nTotal cost for Day 3: $30 + $106 + $176 + $110 + $634 = $1056\n\nDay 4: March 14, 2022 - Austin\n- Transportation: -\n- Breakfast: Mehfil-e-Handi, Austin, cost: $96 x 2 = $192, cuisines: Desserts, Tea, Bakery, American, Seafood\n- Attraction: Museum of the Weird; Austin Aquarium\n- Lunch: Tandoori Nights, Austin, cost: $26 x 2 = $52, cuisines: Pizza, Italian, BBQ, Indian, Seafood\n- Dinner: Cup-a-licious, Austin, cost: $85 x 2 = $170, cuisines: Fast Food, Chinese, BBQ, Italian\n- Accommodation: Entire 2 bedroom top floor in Clinton Hill, Austin, cost: $317 x 2 = $634\n\nNumber of people: 2\nTotal cost for Day 4: $192 + $52 + $170 + $634 = $1048\n\nDay 5: March 15, 2022 - From Austin to Cedar Rapids\n- Transportation: Self-driving from Austin to Cedar Rapids, duration: 15 hours 5 mins, distance: 1,695 km, cost: $84 x 2 = $168\n- Breakfast: -\n- Attraction: -\n- Lunch: -\n- Dinner: -\n- Accommodation: -\n\nNumber of people: 2\nTotal cost for Day 5: $168\n\nTotal cost across all days: $690 + $888 + $1056 + $1048 + $168 = $3850\n\nUnfortunately, the total cost of the travel plan ($3850) exceeds the specified budget of $2,400. Adjustments are needed to meet the budget constraint. Since the accommodations chosen do not allow visitors, which is against the query's requirements, and the budget is exceeded, we need to revise the plan.\n\nRevised Travel Plan:\n\nDay 1: March 11, 2022 - From Cedar Rapids to Dallas\n- Transportation: Self-driving from Cedar Rapids to Dallas, duration: 12 hours 26 mins, distance: 1,324 km, cost: $66 x 2 = $132\n- Breakfast: -\n- Attraction: -\n- Lunch: -\n- Dinner: Coconuts Fish Cafe, Dallas, cost: $38 x 2 = $76, cuisines: Cafe, BBQ, Mediterranean, Fast Food\n- Accommodation: Jackson Heights 2 bedrooms housing, Dallas, cost: $747, house rules: No parties & No children under 10 & No smoking, minimum nights: 2, maximum occupancy: 2\n\nNumber of people: 2\nTotal cost for Day 1: $132 + $76 + $747 = $955\n\nDay 2: March 12, 2022 - Dallas\n- Transportation: -\n- Breakfast: Cafe Gatherings, Dallas, cost: $17 x 2 = $34, cuisines: Bakery, Indian, Desserts\n- Attraction: The Dallas World Aquarium; The Sixth Floor Museum at Dealey Plaza\n- Lunch: 1918 Bistro & Grill, Dallas, cost: $90 x 2 = $180, cuisines: Tea, Pizza, BBQ, Seafood\n- Dinner: Yanki Sizzlers, Dallas, cost: $96 x 2 = $192, cuisines: Cafe, French, Tea, Mediterranean\n- Accommodation: Jackson Heights 2 bedrooms housing, Dallas, cost: $747\n\nNumber of people: 2\nTotal cost for Day 2: $34 + $180 + $192 + $747 = $1153\n\nDay 3: March 13, 2022 - From Dallas to Austin\n- Transportation: Self-driving from Dallas to Austin, duration: 2 hours 53 mins, distance: 314 km, cost: $15 x 2 = $30\n- Breakfast: Aravali Owls, Dallas, cost: $53 x 2 = $106, cuisines: Pizza, Italian, Bakery, Fast Food, Cafe\n- Attraction: Zilker Metropolitan Park; Bullock Texas State History Museum\n- Lunch: The Kasbah, Austin, cost: $88 x 2 = $176, cuisines: Cafe, Pizza, BBQ, Fast Food\n- Dinner: Wildflour Cafe + Bakery, Austin, cost: $55 x 2 = $110, cuisines: Desserts, French, Bakery, BBQ, Seafood\n- Accommodation: Cozy room in south Harlem - 10 mins to Columbia, Austin, cost: $564, house rules: No visitors & No children under 10, minimum nights: 1, maximum occupancy: 2\n\nNumber of people: 2\nTotal cost for Day 3: $30 + $106 + $176 + $110 + $564 = $986\n\nDay 4: March 14, 2022 - Austin\n- Transportation: -\n- Breakfast: Mehfil-e-Handi, Austin, cost: $96 x 2 = $192, cuisines: Desserts, Tea, Bakery, American, Seafood\n- Attraction: Museum of the Weird; Austin Aquarium\n- Lunch: Tandoori Nights, Austin, cost: $26 x 2 = $52, cuisines: Pizza, Italian, BBQ, Indian, Seafood\n- Dinner: Cup-a-licious, Austin, cost: $85 x 2 = $170, cuisines: Fast Food, Chinese, BBQ, Italian\n- Accommodation: Cozy room in south Harlem - 10 mins to Columbia, Austin, cost: $564\n\nNumber of people: 2\nTotal cost for Day 4: $192 + $52 + $170 + $564 = $978\n\nDay 5: March 15, 2022 - From Austin to Cedar Rapids\n- Transportation: Self-driving from Austin to Cedar Rapids, duration: 15 hours 5 mins, distance: 1,695 km, cost: $84 x 2 = $168\n- Breakfast: -\n- Attraction: -\n- Lunch: -\n- Dinner: -\n- Accommodation: -\n\nNumber of people: 2\nTotal cost for Day 5: $168\n\nTotal cost across all days: $955 + $1153 + $986 + $978 + $168 = $4240\n\nThe revised plan still exceeds the budget. To meet the budget, we need to make further adjustments, such as choosing more affordable accommodations and dining options. However, given the constraints of the query and the information provided, it is challenging to create a detailed plan that meets all requirements within the budget.", "gpt-4-1106-preview_direct_sole-planning_parsed_results": [{"day": 1, "current_city": "from Cedar Rapids to Dallas", "transportation": "Self-driving from Cedar Rapids to Dallas, duration: 12 hours 26 mins, distance: 1,324 km", "breakfast": "-", "attraction": "-", "lunch": "-", "dinner": "Coconuts Fish Cafe, Dallas", "accommodation": "Luxury Williamsburg duplex, private roof terrace, Dallas"}, {"day": 2, "current_city": "Dallas", "transportation": "-", "breakfast": "Cafe Gatherings, Dallas", "attraction": "The Dallas World Aquarium, Dallas;The Sixth Floor Museum at Dealey Plaza, Dallas;", "lunch": "1918 Bistro & Grill, Dallas", "dinner": "Yanki Sizzlers, Dallas", "accommodation": "Luxury Williamsburg duplex, private roof terrace, Dallas"}, {"day": 3, "current_city": "from Dallas to Austin", "transportation": "Self-driving from Dallas to Austin, duration: 2 hours 53 mins, distance: 314 km", "breakfast": "Aravali Owls, Dallas", "attraction": "Zilker Metropolitan Park, Austin;Bullock Texas State History Museum, Austin;", "lunch": "The Kasbah, Austin", "dinner": "Wildflour Cafe + Bakery, Austin", "accommodation": "Entire 2 bedroom top floor in Clinton Hill, Austin"}, {"day": 4, "current_city": "Austin", "transportation": "-", "breakfast": "Mehfil-e-Handi, Austin", "attraction": "Museum of the Weird, Austin;Austin Aquarium, Austin;", "lunch": "Tandoori Nights, Austin", "dinner": "Cup-a-licious, Austin", "accommodation": "Entire 2 bedroom top floor in Clinton Hill, Austin"}, {"day": 5, "current_city": "from Austin to Cedar Rapids", "transportation": "Self-driving from Austin to Cedar Rapids, duration: 15 hours 5 mins, distance: 1,695 km", "breakfast": "-", "attraction": "-", "lunch": "-", "dinner": "-", "accommodation": "-"}]}]