[{"gpt-4-1106-preview_direct_sole-planning_results": "Based on the provided information and constraints, here is a 5-day travel plan for two people from Greer to New York, covering two cities in the state (Buffalo and Niagara Falls) from March 10th to March 14th, 2022, with a budget of $3,400 and a requirement for private room accommodations.\n\n**Day 1: Greer to Buffalo**\n- Transportation: Self-driving from Greer to Buffalo, duration: 11 hours 19 mins, distance: 1,200 km, cost: $60\n- Breakfast: -\n- Attraction: -\n- Lunch: -\n- Dinner: Shokitini, Buffalo, cost: $41, cuisines: Tea, Cafe, Pizza, Mexican, Chinese, Seafood\n- Accommodation: Yankee baseball stay, Buffalo, cost: $911, room type: Private room, house rules: No visitors, minimum nights: 1, maximum occupancy: 1\n\nNumber of people: 2\nTotal cost: 2 x $60 (transportation) + 2 x $41 (dinner) + 2 x $911 (accommodation) = $1,964\nAccommodation minimum nights: 1/1\n\n**Day 2: Buffalo**\n- Transportation: -\n- Breakfast: Maa Kali Foods, Buffalo, cost: $61, cuisines: Desserts, BBQ, Bakery, Fast Food, Indian\n- Attraction: The Buffalo Zoo; Buffalo and Erie County Botanical Gardens\n- Lunch: Punjab Grill, Buffalo, cost: $25, cuisines: Bakery, BBQ, Desserts, Seafood\n- Dinner: Tibby's New Orleans Kitchen, Buffalo, cost: $48, cuisines: Seafood, Indian, BBQ, Italian\n- Accommodation: Yankee baseball stay, Buffalo, cost: $911, room type: Private room, house rules: No visitors, minimum nights: 1, maximum occupancy: 1\n\nNumber of people: 2\nTotal cost: 2 x $61 (breakfast) + 2 x $25 (lunch) + 2 x $48 (dinner) + 2 x $911 (accommodation) = $2,102\nAccommodation minimum nights: 1/1\n\n**Day 3: Buffalo to Niagara Falls**\n- Transportation: Self-driving from Buffalo to Niagara Falls, duration: 26 mins, distance: 31.9 km, cost: $1\n- Breakfast: Room Service, Buffalo, cost: $94, cuisines: Bakery, Indian, BBQ, Italian\n- Attraction: Journey Behind the Falls; Niagara SkyWheel\n- Lunch: Tony Roma's, Niagara Falls, cost: $47, cuisines: Desserts, Tea, French, Fast Food, Cafe, Mediterranean\n- Dinner: Izakaya Kikufuji, Niagara Falls, cost: $66, cuisines: Desserts, Pizza, French, Fast Food, Mediterranean, Seafood\n- Accommodation: Sunny Spacious South Slope Studio, Niagara Falls, cost: $337, room type: Entire home/apt, house rules: No parties & No smoking, minimum nights: 2, maximum occupancy: 3\n\nNumber of people: 2\nTotal cost: 2 x $1 (transportation) + 2 x $94 (breakfast) + 2 x $47 (lunch) + 2 x $66 (dinner) + 2 x $337 (accommodation) = $1,184\nAccommodation minimum nights: 1/2\n\n**Day 4: Niagara Falls**\n- Transportation: -\n- Breakfast: Scratch, Niagara Falls, cost: $19, cuisines: Tea, American, Seafood\n- Attraction: Cave of the Winds; White Water Walk\n- Lunch: Raju Dhaba, Niagara Falls, cost: $67, cuisines: American, Desserts, Seafood\n- Dinner: Pier 70, Niagara Falls, cost: $60, cuisines: Tea, Bakery, Mediterranean, Seafood\n- Accommodation: Sunny Spacious South Slope Studio, Niagara Falls, cost: $337, room type: Entire home/apt, house rules: No parties & No smoking, minimum nights: 2, maximum occupancy: 3\n\nNumber of people: 2\nTotal cost: 2 x $19 (breakfast) + 2 x $67 (lunch) + 2 x $60 (dinner) + 2 x $337 (accommodation) = $1,070\nAccommodation minimum nights: 2/2\n\n**Day 5: Niagara Falls to Greer**\n- Transportation: Self-driving from Niagara Falls to Greer, duration: 11 hours 41 mins, distance: 1,228 km, cost: $61\n- Breakfast: -\n- Attraction: -\n- Lunch: -\n- Dinner: -\n- Accommodation: -\n\nNumber of people: 2\nTotal cost: 2 x $61 (transportation) = $122\n\n**Total cost across all days**: $1,964 (Day 1) + $2,102 (Day 2) + $1,184 (Day 3) + $1,070 (Day 4) + $122 (Day 5) = $6,442\n\nUnfortunately, the total cost exceeds the specified budget of $3,400. To adjust the plan within the budget, we would need to choose more affordable accommodations and dining options, and possibly reduce the number of attractions visited. However, the provided data does not include cheaper options for accommodations or meals, so we cannot create a plan that fits the budget with the given data.", "gpt-4-1106-preview_direct_sole-planning_parsed_results": [{"day": 1, "current_city": "from Greer to Buffalo", "transportation": "Self-driving from Greer to Buffalo, Duration: 11 hours 19 mins, Distance: 1,200 km", "breakfast": "-", "attraction": "-", "lunch": "-", "dinner": "Shokitini, Buffalo", "accommodation": "Yankee baseball stay, Buffalo"}, {"day": 2, "current_city": "Buffalo", "transportation": "-", "breakfast": "Maa Kali Foods, Buffalo", "attraction": "The Buffalo Zoo, Buffalo;Buffalo and Erie County Botanical Gardens, Buffalo;", "lunch": "Punjab Grill, Buffalo", "dinner": "Tibby's New Orleans Kitchen, Buffalo", "accommodation": "Yankee baseball stay, Buffalo"}, {"day": 3, "current_city": "from Buffalo to Niagara Falls", "transportation": "Self-driving from Buffalo to Niagara Falls, Duration: 26 mins, Distance: 31.9 km", "breakfast": "Room Service, Buffalo", "attraction": "Journey Behind the Falls, Niagara Falls;Niagara SkyWheel, Niagara Falls;", "lunch": "Tony Roma's, Niagara Falls", "dinner": "Izakaya Kikufuji, Niagara Falls", "accommodation": "Sunny Spacious South Slope Studio, Niagara Falls"}, {"day": 4, "current_city": "Niagara Falls", "transportation": "-", "breakfast": "Scratch, Niagara Falls", "attraction": "Cave of the Winds, Niagara Falls;White Water Walk, Niagara Falls;", "lunch": "Raju Dhaba, Niagara Falls", "dinner": "Pier 70, Niagara Falls", "accommodation": "Sunny Spacious South Slope Studio, Niagara Falls"}, {"day": 5, "current_city": "from Niagara Falls to Greer", "transportation": "Self-driving from Niagara Falls to Greer, Duration: 11 hours 41 mins, Distance: 1,228 km", "breakfast": "-", "attraction": "-", "lunch": "-", "dinner": "-", "accommodation": "-"}]}]