[{"gpt-4-1106-preview_direct_sole-planning_results": "Based on the provided information and constraints, here is a 5-day travel plan beginning in Washington, visiting Norfolk and Lynchburg in Virginia, and returning to Washington:\n\n**Day 1: Washington to Norfolk (March 15, 2022)**\n\n- Transportation: Flight F3785353, from Washington to Norfolk, duration: 0 hours 48 minutes, cost: $63\n- Breakfast: -\n- Attraction: -\n- Lunch: -\n- Dinner: Henry Campbell's Steakhouse, Norfolk, cost: $83, cuisines: Chinese, Cafe, Seafood\n- Accommodation: Simple Spacious RM near Queens Center Mall & NYPD, Norfolk, cost: $311, room type: Private room, house rules: No visitors & No parties, minimum nights: 1\n\nNumber of people: 1\nTotal cost: $63 (flight) + $83 (dinner) + $311 (accommodation) = $457\n\n**Day 2: Norfolk (March 16, 2022)**\n\n- Transportation: -\n- Breakfast: Sonya Bakery Cafe, Norfolk, cost: $32, cuisines: Pizza, Indian, BBQ\n- Attraction: Norfolk Botanical Garden, Nauticus\n- Lunch: Game n Grillz, Norfolk, cost: $59, cuisines: Mexican, Bakery, Cafe, American, Seafood\n- Dinner: Jonathan's Kitchen - Holiday Inn Express & Suites, Norfolk, cost: $44, cuisines: Tea, Seafood, BBQ, Fast Food\n- Accommodation: Simple Spacious RM near Queens Center Mall & NYPD, Norfolk, cost: $311, room type: Private room, house rules: No visitors & No parties, minimum nights: 1\n\nNumber of people: 1\nTotal cost: $32 (breakfast) + $59 (lunch) + $44 (dinner) + $311 (accommodation) = $446\n\n**Day 3: Norfolk to Lynchburg (March 17, 2022)**\n\n- Transportation: Self-driving, from Norfolk to Lynchburg, duration: 3 hours 27 mins, cost: $15\n- Breakfast: -\n- Attraction: -\n- Lunch: -\n- Dinner: Uptown Vietnam cuisine, Lynchburg, cost: $63, cuisines: Cafe, Bakery, Indian, Seafood\n- Accommodation: Design Hideaway in a Classic Brooklyn Townhouse, Lynchburg, cost: $216, room type: Entire home/apt, house rules: No smoking, minimum nights: 1\n\nNumber of people: 1\nTotal cost: $15 (transportation) + $63 (dinner) + $216 (accommodation) = $294\n\n**Day 4: Lynchburg (March 18, 2022)**\n\n- Transportation: -\n- Breakfast: Khyen Chyen, Lynchburg, cost: $30, cuisines: Cafe, Bakery, Mediterranean, Desserts\n- Attraction: Amazement Square, Point of Honor\n- Lunch: The BrewMaster, Lynchburg, cost: $87, cuisines: Tea, Chinese, BBQ, Fast Food\n- Dinner: Pirates Of Grill, Lynchburg, cost: $71, cuisines: Tea, Pizza, American, Seafood\n- Accommodation: Design Hideaway in a Classic Brooklyn Townhouse, Lynchburg, cost: $216, room type: Entire home/apt, house rules: No smoking, minimum nights: 1\n\nNumber of people: 1\nTotal cost: $30 (breakfast) + $87 (lunch) + $71 (dinner) + $216 (accommodation) = $404\n\n**Day 5: Lynchburg to Washington (March 19, 2022)**\n\n- Transportation: Self-driving, from Lynchburg to Washington, duration: 3 hours 19 mins, cost: $14\n- Breakfast: -\n- Attraction: -\n- Lunch: -\n- Dinner: -\n- Accommodation: -\n\nNumber of people: 1\nTotal cost: $14 (transportation)\n\n**Total cost across all days**: $457 (Day 1) + $446 (Day 2) + $294 (Day 3) + $404 (Day 4) + $14 (Day 5) = $1,615\n\nThe total cost of $1,615 is within the budget of $2,200. The plan includes transportation, meals, attractions, and accommodations for each day, adhering to the constraints provided.", "gpt-4-1106-preview_direct_sole-planning_parsed_results": [{"day": 1, "current_city": "from Washington to Norfolk", "transportation": "Flight Number: F3785353, from Washington to Norfolk, Departure Time: -, Arrival Time: -", "breakfast": "-", "attraction": "-", "lunch": "-", "dinner": "Henry Campbell's Steakhouse, Norfolk", "accommodation": "Simple Spacious RM near Queens Center Mall & NYPD, Norfolk"}, {"day": 2, "current_city": "Norfolk", "transportation": "-", "breakfast": "Sonya Bakery Cafe, Norfolk", "attraction": "Norfolk Botanical Garden, Norfolk;Nauticus, Norfolk;", "lunch": "Game n Grillz, Norfolk", "dinner": "Jonathan's Kitchen - Holiday Inn Express & Suites, Norfolk", "accommodation": "Simple Spacious RM near Queens Center Mall & NYPD, Norfolk"}, {"day": 3, "current_city": "from Norfolk to Lynchburg", "transportation": "Self-driving, from Norfolk to Lynchburg, Departure Time: -, Arrival Time: -", "breakfast": "-", "attraction": "-", "lunch": "-", "dinner": "Uptown Vietnam cuisine, Lynchburg", "accommodation": "Design Hideaway in a Classic Brooklyn Townhouse, Lynchburg"}, {"day": 4, "current_city": "Lynchburg", "transportation": "-", "breakfast": "Khyen Chyen, Lynchburg", "attraction": "Amazement Square, Lynchburg;Point of Honor, Lynchburg;", "lunch": "The BrewMaster, Lynchburg", "dinner": "Pirates Of Grill, Lynchburg", "accommodation": "Design Hideaway in a Classic Brooklyn Townhouse, Lynchburg"}, {"day": 5, "current_city": "from Lynchburg to Washington", "transportation": "Self-driving, from Lynchburg to Washington, Departure Time: -, Arrival Time: -", "breakfast": "-", "attraction": "-", "lunch": "-", "dinner": "-", "accommodation": "-"}]}]