[{"gpt-4-1106-preview_direct_sole-planning_results": "Based on the provided information and constraints, here is a 5-day travel plan for one person starting from Cedar Rapids and covering 2 cities in Colorado (Denver and Alamosa) from March 23rd to March 27th, 2022, with a budget of $4,300.\n\n**Day 1: Cedar Rapids to Denver**\n- Transportation: Flight F3840860, from Cedar Rapids to Denver, cost: $294\n- Breakfast: Not applicable (assuming departure from Cedar Rapids after breakfast)\n- Attraction: Denver Art Museum, Denver, cost: $0 (assuming free admission or covered by a pass)\n- Lunch: The Urban Socialite, Denver, cost: $34, cuisines: Cafe, Indian, Desserts, Italian\n- Dinner: The Fatty Bao - Asian Gastro Bar, Denver, cost: $93, cuisines: Bakery, BBQ, Cafe, Indian, Seafood\n- Accommodation: Peaceful, beautiful home away, Denver, cost: $414, room type: Entire home/apt, house rules: No smoking & No visitors & No parties\n\n**Day 2: Denver**\n- Transportation: Not applicable (staying in Denver)\n- Breakfast: Starve Stalkers, Denver, cost: $31, cuisines: Fast Food, Indian, BBQ, Seafood\n- Attraction: Denver Botanic Gardens, Denver, cost: $0 (assuming free admission or covered by a pass)\n- Lunch: TBH - The Big House Cafe, Denver, cost: $22, cuisines: Cafe, Indian, Seafood, Fast Food\n- Dinner: Radhika Sweets, Denver, cost: $26, cuisines: Tea, Fast Food, Cafe, Mediterranean, Seafood\n- Accommodation: Peaceful, beautiful home away, Denver, cost: $414, room type: Entire home/apt, house rules: No smoking & No visitors & No parties\n\n**Day 3: Denver to Alamosa**\n- Transportation: Self-driving, from Denver to Alamosa, cost: $18\n- Breakfast: Rain Tree Grill, Denver, cost: $94, cuisines: Tea, Mexican, BBQ, Italian\n- Attraction: Alamosa National Wildlife Refuge and Visitor Center, Alamosa, cost: $0 (assuming free admission or covered by a pass)\n- Lunch: Cafe LazyMojo, Alamosa, cost: $26, cuisines: Tea, Pizza, American, Fast Food\n- Dinner: Atlanta Highway Seafood Market, Alamosa, cost: $68, cuisines: Fast Food, Desserts, Seafood\n- Accommodation: Comfortable studio suite in midtown Manhattan, Alamosa, cost: $67, room type: Entire home/apt, house rules: No parties & No smoking & No visitors\n\n**Day 4: Alamosa**\n- Transportation: Not applicable (staying in Alamosa)\n- Breakfast: Riverwalk Cafe, Alamosa, cost: $97, cuisines: Tea, Pizza, Fast Food\n- Attraction: Los Caminos Antiguos Scenic Byway: Alamosa Entrance, Alamosa, cost: $0 (assuming free admission or covered by a pass)\n- Lunch: Emperor's Lounge - The Taj Mahal Hotel, Alamosa, cost: $65, cuisines: Tea, Italian, BBQ, Cafe, Seafood\n- Dinner: The Midnight Heroes, Alamosa, cost: $10, cuisines: Tea, BBQ, Cafe, Indian, Seafood\n- Accommodation: Comfortable studio suite in midtown Manhattan, Alamosa, cost: $67, room type: Entire home/apt, house rules: No parties & No smoking & No visitors\n\n**Day 5: Alamosa to Cedar Rapids**\n- Transportation: Self-driving, from Alamosa to Cedar Rapids, cost: $77\n- Breakfast: Not applicable (assuming departure from Alamosa after breakfast)\n- Attraction: Not applicable (traveling back to Cedar Rapids)\n- Lunch: Not applicable (on the road)\n- Dinner: Not applicable (assuming arrival in Cedar Rapids after dinner)\n- Accommodation: Not applicable (end of trip)\n\n**Total Costs:**\n- Flights: $294\n- Self-driving: $18 + $77 = $95\n- Accommodations: $414 x 2 (Denver) + $67 x 2 (Alamosa) = $962\n- Meals: $34 + $93 + $31 + $22 + $26 + $94 + $26 + $68 + $97 + $65 + $10 = $566\n- Attractions: $0 (assuming free admission or covered by a pass)\n\n**Grand Total: $294 + $95 + $962 + $566 = $1,917**\n\nThis travel plan is well within the budget of $4,300 and meets all the specified constraints. Please note that the costs for attractions are assumed to be covered by a pass or to be free of charge, which may not be the case. Adjustments to the plan may be necessary if there are entrance fees for the attractions.", "gpt-4-1106-preview_direct_sole-planning_parsed_results": [{"day": 1, "current_city": "from Cedar Rapids to Denver", "transportation": "Flight Number: F3840860, from Cedar Rapids to Denver", "breakfast": "-", "attraction": "Denver Art Museum, Denver;", "lunch": "The Urban Socialite, Denver", "dinner": "The Fatty Bao - Asian Gastro Bar, Denver", "accommodation": "Peaceful, beautiful home away, Denver"}, {"day": 2, "current_city": "Denver", "transportation": "-", "breakfast": "Starve Stalkers, Denver", "attraction": "Denver Botanic Gardens, Denver;", "lunch": "TBH - The Big House Cafe, Denver", "dinner": "Radhika Sweets, Denver", "accommodation": "Peaceful, beautiful home away, Denver"}, {"day": 3, "current_city": "from Denver to Alamosa", "transportation": "Self-driving, from Denver to Alamosa", "breakfast": "Rain Tree Grill, Denver", "attraction": "Alamosa National Wildlife Refuge and Visitor Center, Alamosa;", "lunch": "Cafe LazyMojo, Alamosa", "dinner": "Atlanta Highway Seafood Market, Alamosa", "accommodation": "Comfortable studio suite in midtown Manhattan, Alamosa"}, {"day": 4, "current_city": "Alamosa", "transportation": "-", "breakfast": "Riverwalk Cafe, Alamosa", "attraction": "Los Caminos Antiguos Scenic Byway: Alamosa Entrance, Alamosa;", "lunch": "Emperor's Lounge - The Taj Mahal Hotel, Alamosa", "dinner": "The Midnight Heroes, Alamosa", "accommodation": "Comfortable studio suite in midtown Manhattan, Alamosa"}, {"day": 5, "current_city": "from Alamosa to Cedar Rapids", "transportation": "Self-driving, from Alamosa to Cedar Rapids", "breakfast": "-", "attraction": "-", "lunch": "-", "dinner": "-", "accommodation": "-"}]}]