[{"gpt-4-1106-preview_direct_sole-planning_results": "Based on the provided information and constraints, here is a 7-day travel plan for a group of 8, starting from Rockford and visiting 3 cities in Florida: Gainesville, Daytona Beach, and Jacksonville. The travel plan includes transportation, meals, attractions, and accommodations.\n\n**Day 1: Rockford to Gainesville (March 8, 2022)**\n- Transportation: Self-driving from Rockford to Gainesville, duration: 16 hours 30 mins, distance: 1,822 km, cost: $91 x 8 = $728\n- Breakfast: -\n- Attraction: -\n- Lunch: -\n- Dinner: The Machine Shed Restaurant, Gainesville, cost: $62 x 8 = $496, cuisines: Pizza, Mexican, Bakery, Fast Food, Indian, Seafood\n- Accommodation: Spacious yet Cozy Room in Manhattan, Gainesville, cost: $566 x 2 = $1132, Entire home/apt, maximum occupancy: 4 per unit\n\n**Day 2: Gainesville (March 9, 2022)**\n- Transportation: -\n- Breakfast: Parker's, Gainesville, cost: $74 x 8 = $592, cuisines: Desserts, Tea, Italian, French, Bakery, BBQ\n- Attraction: Florida Museum of Natural History-Exhibits, Devil's Millhopper Geological State Park\n- Lunch: Carnival By Tresind, Gainesville, cost: $67 x 8 = $536, cuisines: Tea, Chinese, Pizza, Mediterranean\n- Dinner: Aggarwal Sweet Corner, Gainesville, cost: $70 x 8 = $560, cuisines: Tea, American, Seafood\n- Accommodation: Spacious yet Cozy Room in Manhattan, Gainesville, cost: $1132\n\n**Day 3: Gainesville to Daytona Beach (March 10, 2022)**\n- Transportation: Self-driving from Gainesville to Daytona Beach, duration: 2 hours 2 mins, distance: 158 km, cost: $7 x 8 = $56\n- Breakfast: The Food Garage, Gainesville, cost: $97 x 8 = $776, cuisines: Desserts, Tea, Bakery, BBQ, Chinese\n- Attraction: Kanapaha Botanical Gardens, Sweetwater Wetlands Park\n- Lunch: CHA, Gainesville, cost: $84 x 8 = $672, cuisines: Desserts, Pizza, Bakery, Fast Food, American\n- Dinner: Outback Steakhouse, Daytona Beach, cost: $58 x 8 = $464, cuisines: Desserts, Pizza, Mexican, Cafe, American\n- Accommodation: Homey 1BR in Fun, Central West Village w/ Doorman by Blueground, Daytona Beach, cost: $262 x 4 = $1048, Entire home/apt, maximum occupancy: 2 per unit\n\n**Day 4: Daytona Beach (March 11, 2022)**\n- Transportation: -\n- Breakfast: Mom & Dad's Italian Restaurant, Daytona Beach, cost: $17 x 8 = $136, cuisines: Tea, Mexican, Cafe, Indian, Seafood\n- Attraction: Daytona Boardwalk Amusements, Daytona Lagoon\n- Lunch: Beach Box Cafe, Daytona Beach, cost: $96 x 8 = $768, cuisines: Chinese, Pizza, BBQ, Cafe\n- Dinner: Rocks on the River, Daytona Beach, cost: $35 x 8 = $280, cuisines: Tea, Indian, BBQ\n- Accommodation: Homey 1BR in Fun, Central West Village w/ Doorman by Blueground, Daytona Beach, cost: $1048\n\n**Day 5: Daytona Beach to Jacksonville (March 12, 2022)**\n- Transportation: Self-driving from Daytona Beach to Jacksonville, duration: 1 hour 28 mins, distance: 143 km, cost: $7 x 8 = $56\n- Breakfast: Khaaja Chowk, Daytona Beach, cost: $61 x 8 = $488, cuisines: French, Bakery, American, Seafood\n- Attraction: World's Most Famous Beach, Daytona Beach Main Street Pier\n- Lunch: Jungle Jamboree, Daytona Beach, cost: $38 x 8 = $304, cuisines: Cafe, Bakery, Desserts\n- Dinner: Au Bon Pain, Daytona Beach, cost: $85 x 8 = $680, cuisines: Tea, Cafe, Pizza, Seafood\n- Accommodation: NYC Sanctuary, Skyline Views & Rooftop, Jacksonville, cost: $954 x 2 = $1908, Entire home/apt, maximum occupancy: 6 per unit\n\n**Day 6: Jacksonville (March 13, 2022)**\n- Transportation: -\n- Breakfast: Goose Feathers Cafe and Bakery, Jacksonville, cost: $57 x 8 = $456, cuisines: Tea, Fast Food, Italian\n- Attraction: Jacksonville Zoo and Gardens, Southbank Riverwalk\n- Lunch: Ashoka Restaurant, Jacksonville, cost: $11 x 8 = $88, cuisines: Desserts, Mexican, Bakery, BBQ, Fast Food\n- Dinner: Sanjha Chulha, Jacksonville, cost: $57 x 8 = $456, cuisines: Tea, Bakery, BBQ\n- Accommodation: NYC Sanctuary, Skyline Views & Rooftop, Jacksonville, cost: $1908\n\n**Day 7: Jacksonville to Rockford (March 14, 2022)**\n- Transportation: Self-driving from Jacksonville to Rockford, duration: 16 hours 42 mins, distance: 1,852 km, cost: $92 x 8 = $736\n- Breakfast: Villa Gargano, Jacksonville, cost: $51 x 8 = $408, cuisines: Tea, American, Desserts\n- Attraction: -\n- Lunch: -\n- Dinner: -\n- Accommodation: -\n\n**Total Cost Calculation:**\n- Transportation: $728 + $56 + $56 + $736 = $1576\n- Meals: $496 + $592 + $536 + $560 + $776 + $672 + $464 + $136 + $768 + $280 + $488 + $304 + $680 + $456 + $88 + $456 + $408 = $7872\n- Accommodation: $1132 + $1132 + $1048 + $1048 + $1908 + $1908 = $8076\n- Attractions: No entry fees provided, assumed to be included in the budget\n\n**Total Cost: $1576 (Transportation) + $7872 (Meals) + $8076 (Accommodation) = $17,524**\n\n**Note:** The total cost exceeds the budget by $524. To stay within budget, consider adjusting meal choices or finding more cost-effective accommodation options. Additionally, the cost of attractions was not included due to lack of pricing information. If there are entry fees, further adjustments will be necessary to stay within budget.", "gpt-4-1106-preview_direct_sole-planning_parsed_results": [{"day": 1, "current_city": "from Rockford to Gainesville", "transportation": "Self-driving from Rockford to Gainesville, duration: 16 hours 30 mins, distance: 1,822 km", "breakfast": "-", "attraction": "-", "lunch": "-", "dinner": "The Machine Shed Restaurant, Gainesville", "accommodation": "Spacious yet Cozy Room in Manhattan, Gainesville"}, {"day": 2, "current_city": "Gainesville", "transportation": "-", "breakfast": "Parker's, Gainesville", "attraction": "Florida Museum of Natural History-Exhibits, Gainesville;Devil's Millhopper Geological State Park, Gainesville;", "lunch": "Carnival By Tresind, Gainesville", "dinner": "Aggarwal Sweet Corner, Gainesville", "accommodation": "Spacious yet Cozy Room in Manhattan, Gainesville"}, {"day": 3, "current_city": "from Gainesville to Daytona Beach", "transportation": "Self-driving from Gainesville to Daytona Beach, duration: 2 hours 2 mins, distance: 158 km", "breakfast": "The Food Garage, Gainesville", "attraction": "Kanapaha Botanical Gardens, Gainesville;Sweetwater Wetlands Park, Gainesville;", "lunch": "CHA, Gainesville", "dinner": "Outback Steakhouse, Daytona Beach", "accommodation": "Homey 1BR in Fun, Central West Village w/ Doorman by Blueground, Daytona Beach"}, {"day": 4, "current_city": "Daytona Beach", "transportation": "-", "breakfast": "Mom & Dad's Italian Restaurant, Daytona Beach", "attraction": "Daytona Boardwalk Amusements, Daytona Beach;Daytona Lagoon, Daytona Beach;", "lunch": "Beach Box Cafe, Daytona Beach", "dinner": "Rocks on the River, Daytona Beach", "accommodation": "Homey 1BR in Fun, Central West Village w/ Doorman by Blueground, Daytona Beach"}, {"day": 5, "current_city": "from Daytona Beach to Jacksonville", "transportation": "Self-driving from Daytona Beach to Jacksonville, duration: 1 hour 28 mins, distance: 143 km", "breakfast": "Khaaja Chowk, Daytona Beach", "attraction": "World's Most Famous Beach, Daytona Beach;Daytona Beach Main Street Pier, Daytona Beach;", "lunch": "Jungle Jamboree, Daytona Beach", "dinner": "Au Bon Pain, Daytona Beach", "accommodation": "NYC Sanctuary, Skyline Views & Rooftop, Jacksonville"}, {"day": 6, "current_city": "Jacksonville", "transportation": "-", "breakfast": "Goose Feathers Cafe and Bakery, Jacksonville", "attraction": "Jacksonville Zoo and Gardens, Jacksonville;Southbank Riverwalk, Jacksonville;", "lunch": "Ashoka Restaurant, Jacksonville", "dinner": "Sanjha Chulha, Jacksonville", "accommodation": "NYC Sanctuary, Skyline Views & Rooftop, Jacksonville"}, {"day": 7, "current_city": "from Jacksonville to Rockford", "transportation": "Self-driving from Jacksonville to Rockford, duration: 16 hours 42 mins, distance: 1,852 km", "breakfast": "Villa Gargano, Jacksonville", "attraction": "-", "lunch": "-", "dinner": "-", "accommodation": "-"}]}]