[{"gpt-4-1106-preview_direct_sole-planning_results": "Travel Plan:\n\nDays: 1\nCurrent City: from Cincinnati (Ohio) to Philadelphia (Pennsylvania)\nTransportation: Flight F3794475, from Cincinnati to Philadelphia, duration: 1 hour 24 minutes, cost: 200 per person\nBreakfast: -\nAttraction: -\nLunch: -\nDinner: Red Ginger Sushi, Grill & Bar, Philadelphia, cost: 98, cuisines: Tea, Cafe, Indian, Fast Food\nAccommodation: Brooklyn Room in Hip Neighborhood - Close to Train, Philadelphia, cost: 742, room type: Private room, house rules: No parties & No children under 10 & No smoking, minimum nights: 1, maximum occupancy: 1\n\nNumber of people: 2\nTotal cost: 2 x 200 + 2 x 98 + 1 x 742 = 1338\nAccommodation minimum nights: 1/1\n\nDays: 2\nCurrent City: Philadelphia\nTransportation: Taxi, within Philadelphia, estimated cost: 50\nBreakfast: Hong Kong Cafe, Philadelphia, cost: 47, cuisines: Tea, Pizza, Italian, BBQ, Cafe\nAttraction: The Franklin Institute, Philadelphia; Liberty Bell, Philadelphia\nLunch: Marukame Udon, Philadelphia, cost: 100, cuisines: Tea, Pizza, Italian, BBQ, Fast Food, Chinese\nDinner: The Moon Under Water, Philadelphia, cost: 94, cuisines: Pizza, Italian, BBQ, Bakery, Fast Food, Mediterranean\nAccommodation: Brooklyn Room in Hip Neighborhood - Close to Train, Philadelphia, cost: 742, room type: Private room, house rules: No parties & No children under 10 & No smoking, minimum nights: 1, maximum occupancy: 1\n\nNumber of people: 2\nTotal cost: 2 x 50 + 2 x 47 + 2 x 100 + 2 x 94 + 1 x 742 = 1324\nAccommodation minimum nights: 2/2\n\nDays: 3\nCurrent City: from Philadelphia to Cincinnati\nTransportation: Flight F3793489, from Philadelphia to Cincinnati, duration: 1 hour 51 minutes, cost: 107 per person\nBreakfast: Pind Balluchi, Philadelphia, cost: 44, cuisines: Desserts, Tea, French, Fast Food, Seafood\nAttraction: -\nLunch: -\nDinner: -\nAccommodation: -\n\nNumber of people: 2\nTotal cost: 2 x 107 + 2 x 44 = 302\n\nTotal cost across all days: 1338 + 1324 + 302 = 2964\n\nUnfortunately, the total cost of the travel plan exceeds the specified budget of $2,000. To adjust the plan within the budget, we can consider the following changes:\n\n- Opt for a less expensive accommodation option.\n- Reduce taxi usage within Philadelphia and consider walking or public transportation.\n- Choose more budget-friendly dining options.\n\nPlease note that the provided accommodation options do not allow children under 10, which contradicts the query requirements. We would need to find an alternative accommodation that meets this criterion. Additionally, the total cost needs to be recalculated after making the necessary adjustments to ensure it fits within the budget.", "gpt-4-1106-preview_direct_sole-planning_parsed_results": [{"day": 1, "current_city": "from Cincinnati to Philadelphia", "transportation": "Flight Number: F3794475, from Cincinnati to Philadelphia, Departure Time: -, Arrival Time: -", "breakfast": "-", "attraction": "-", "lunch": "-", "dinner": "Red Ginger Sushi, Grill & Bar, Philadelphia", "accommodation": "Brooklyn Room in Hip Neighborhood - Close to Train, Philadelphia"}, {"day": 2, "current_city": "Philadelphia", "transportation": "Taxi, within Philadelphia", "breakfast": "Hong Kong Cafe, Philadelphia", "attraction": "The Franklin Institute, Philadelphia;Liberty Bell, Philadelphia;", "lunch": "Marukame Udon, Philadelphia", "dinner": "The Moon Under Water, Philadelphia", "accommodation": "Brooklyn Room in Hip Neighborhood - Close to Train, Philadelphia"}, {"day": 3, "current_city": "from Philadelphia to Cincinnati", "transportation": "Flight Number: F3793489, from Philadelphia to Cincinnati, Departure Time: -, Arrival Time: -", "breakfast": "Pind Balluchi, Philadelphia", "attraction": "-", "lunch": "-", "dinner": "-", "accommodation": "-"}]}]