[{"gpt-4-1106-preview_direct_sole-planning_results": "Based on the provided information and constraints, here is a travel plan for a solo traveler starting from Birmingham and visiting Miami and Orlando in Florida for a duration of 5 days, from March 26th to March 30th, 2022, with a budget of $3,500.\n\n***** Travel Plan *****\n\nDay 1: March 26, 2022 - From Birmingham to Miami\n- Transportation: Flight F3592321, from Birmingham to Miami, cost: $201, departure: 06:13, arrival: 09:09, duration: 1 hour 56 minutes\n- Breakfast: -\n- Attraction: Jungle Island, Miami, cost: $50 (estimated)\n- Lunch: Papouli's Mediterranean Cafe & Market, Miami, cost: $26, cuisines: Tea, Desserts\n- Dinner: AB's Absolute Barbecues, Miami, cost: $55, cuisines: Desserts, Tea, Pizza, Italian, Fast Food, American\n- Accommodation: Simple and clean bedroom with good view and light, Miami, cost: $669, room type: Private room, house rules: No children under 10\n\nTotal cost for Day 1: $201 (flight) + $50 (attraction) + $26 (lunch) + $55 (dinner) + $669 (accommodation) = $1,001\n\nDay 2: March 27, 2022 - Miami\n- Transportation: -\n- Breakfast: Clocked, Miami, cost: $49, cuisines: Tea, Italian, Mexican, BBQ, Cafe\n- Attraction: P\u00e9rez Art Museum Miami, cost: $25 (estimated)\n- Lunch: Tako Cheena by Pom Pom, Miami, cost: $60, cuisines: Fast Food, Indian, Desserts, Italian\n- Dinner: Anjlika, Miami, cost: $56, cuisines: Pizza, Italian, Fast Food, Cafe, Mediterranean, Seafood\n- Accommodation: Simple and clean bedroom with good view and light, Miami, cost: $669, room type: Private room, house rules: No children under 10\n\nTotal cost for Day 2: $49 (breakfast) + $25 (attraction) + $60 (lunch) + $56 (dinner) + $669 (accommodation) = $859\n\nDay 3: March 28, 2022 - From Miami to Orlando\n- Transportation: Flight F3670832, from Miami to Orlando, cost: $87, departure: 08:24, arrival: 09:14, duration: 0 hour 50 minutes\n- Breakfast: -\n- Attraction: SeaWorld Orlando, cost: $110 (estimated)\n- Lunch: Fuji Japanese Steakhouse, Orlando, cost: $75, cuisines: Tea, Bakery, Desserts\n- Dinner: The Tandoori Times, Orlando, cost: $84, cuisines: Tea, Cafe, BBQ, Italian\n- Accommodation: Private furnished bedroom in Williamsburg, Orlando, cost: $179, room type: Private room, house rules: No parties & No smoking & No children under 10\n\nTotal cost for Day 3: $87 (flight) + $110 (attraction) + $75 (lunch) + $84 (dinner) + $179 (accommodation) = $535\n\nDay 4: March 29, 2022 - Orlando\n- Transportation: -\n- Breakfast: Turquoise Villa, Orlando, cost: $55, cuisines: French, Bakery, BBQ, Fast Food\n- Attraction: The Wheel at ICON Park, cost: $30 (estimated)\n- Lunch: Crust N Cakes, Orlando, cost: $61, cuisines: Tea, Cafe, Indian, BBQ\n- Dinner: Indochi Cafe & Restaurant, Orlando, cost: $72, cuisines: Pizza, French, Bakery, Fast Food, Indian, Seafood\n- Accommodation: Private furnished bedroom in Williamsburg, Orlando, cost: $179, room type: Private room, house rules: No parties & No smoking & No children under 10\n\nTotal cost for Day 4: $55 (breakfast) + $30 (attraction) + $61 (lunch) + $72 (dinner) + $179 (accommodation) = $397\n\nDay 5: March 30, 2022 - From Orlando to Birmingham\n- Transportation: Flight F3987879, from Orlando to Birmingham, cost: $116, departure: 14:24, arrival: 15:12, duration: 1 hour 48 minutes\n- Breakfast: Bite N Sip, Orlando, cost: $76, cuisines: Chinese, Bakery, Cafe, Fast Food\n- Attraction: -\n- Lunch: -\n- Dinner: -\n- Accommodation: -\n\nTotal cost for Day 5: $116 (flight) + $76 (breakfast) = $192\n\nTotal cost across all days: $1,001 (Day 1) + $859 (Day 2) + $535 (Day 3) + $397 (Day 4) + $192 (Day 5) = $2,984\n\nRemaining budget: $3,500 - $2,984 = $516\n\nCuisines: All cuisine constraints are satisfied as no specific cuisines were requested.\nAccommodation: All accommodations are private rooms, adhering to the \"not shared room\" constraint.\n\n***** End of Travel Plan *****\n\nPlease note that the costs for attractions are estimated as the provided information does not include attraction prices. The remaining budget can be used for additional meals, transportation within the cities, or other personal expenses.", "gpt-4-1106-preview_direct_sole-planning_parsed_results": [{"day": 1, "current_city": "from Birmingham to Miami", "transportation": "Flight Number: F3592321, from Birmingham to Miami, Departure Time: 06:13, Arrival Time: 09:09", "breakfast": "-", "attraction": "Jungle Island, Miami;", "lunch": "Papouli's Mediterranean Cafe & Market, Miami", "dinner": "AB's Absolute Barbecues, Miami", "accommodation": "Simple and clean bedroom with good view and light, Miami"}, {"day": 2, "current_city": "Miami", "transportation": "-", "breakfast": "Clocked, Miami", "attraction": "P\u00e9rez Art Museum Miami, Miami;", "lunch": "Tako Cheena by Pom Pom, Miami", "dinner": "Anjlika, Miami", "accommodation": "Simple and clean bedroom with good view and light, Miami"}, {"day": 3, "current_city": "from Miami to Orlando", "transportation": "Flight Number: F3670832, from Miami to Orlando, Departure Time: 08:24, Arrival Time: 09:14", "breakfast": "-", "attraction": "SeaWorld Orlando, Orlando;", "lunch": "Fuji Japanese Steakhouse, Orlando", "dinner": "The Tandoori Times, Orlando", "accommodation": "Private furnished bedroom in Williamsburg, Orlando"}, {"day": 4, "current_city": "Orlando", "transportation": "-", "breakfast": "Turquoise Villa, Orlando", "attraction": "The Wheel at ICON Park, Orlando;", "lunch": "Crust N Cakes, Orlando", "dinner": "Indochi Cafe & Restaurant, Orlando", "accommodation": "Private furnished bedroom in Williamsburg, Orlando"}, {"day": 5, "current_city": "from Orlando to Birmingham", "transportation": "Flight Number: F3987879, from Orlando to Birmingham, Departure Time: 14:24, Arrival Time: 15:12", "breakfast": "Bite N Sip, Orlando", "attraction": "-", "lunch": "-", "dinner": "-", "accommodation": "-"}]}]