[{"gpt-4-1106-preview_direct_sole-planning_results": "Travel Plan for 2 People from Minneapolis to Tennessee (Nashville and Knoxville)\n\n**Day 1: March 2nd, 2022 - Minneapolis to Nashville**\n- Current City: Minneapolis to Nashville\n- Transportation: Self-driving, from Minneapolis to Nashville, duration: 12 hours 45 mins, distance: 1,420 km, cost: $71 x 2 = $142\n- Breakfast: -\n- Attraction: -\n- Lunch: -\n- Dinner: Bangkok 1, Nashville, cost: $44 x 2 = $88, cuisines: Cafe, Seafood\n- Accommodation: Huge 2 Bedroom, Great Location, Express Metro, Nashville, cost: $745, room type: Entire home/apt, house rules: Smoking allowed, minimum nights: 4, maximum occupancy: 4\n\nNumber of people: 2\nTotal cost for Day 1: $142 (transportation) + $88 (dinner) + $745 (accommodation) = $975\nAccommodation minimum nights: 1/4\n\n**Day 2: March 3rd, 2022 - Nashville**\n- Current City: Nashville\n- Transportation: -\n- Breakfast: Govinda's Confectionery, Nashville, cost: $15 x 2 = $30, cuisines: Tea, Bakery, Mediterranean, Fast Food\n- Attraction: Country Music Hall of Fame and Museum, Nashville; The Parthenon, Nashville\n- Lunch: Smoke House Deli, Nashville, cost: $59 x 2 = $118, cuisines: Cafe, Mediterranean, Seafood\n- Dinner: Oh! Calcutta, Nashville, cost: $83 x 2 = $166, cuisines: Tea, Mexican, BBQ, Cafe, Indian\n- Accommodation: Huge 2 Bedroom, Great Location, Express Metro, Nashville, cost: $745, room type: Entire home/apt, house rules: Smoking allowed, minimum nights: 4, maximum occupancy: 4\n\nNumber of people: 2\nTotal cost for Day 2: $30 (breakfast) + $118 (lunch) + $166 (dinner) + $745 (accommodation) = $1,059\nAccommodation minimum nights: 2/4\n\n**Day 3: March 4th, 2022 - Nashville to Knoxville**\n- Current City: Nashville to Knoxville\n- Transportation: Self-driving, from Nashville to Knoxville, duration: 2 hours 42 mins, distance: 290 km, cost: $14 x 2 = $28\n- Breakfast: Dialogue Lounge & Caf\u6106, Nashville, cost: $83 x 2 = $166, cuisines: Tea, Indian, BBQ, Cafe, American, Seafood\n- Attraction: -\n- Lunch: -\n- Dinner: Cafe Arabelle, Knoxville, cost: $29 x 2 = $58, cuisines: French, BBQ, Desserts, Seafood\n- Accommodation: Beautiful 1- bdrm apt in tranquil Inwood building, Knoxville, cost: $1,091, room type: Entire home/apt, house rules: Smoking allowed, minimum nights: 2, maximum occupancy: 4\n\nNumber of people: 2\nTotal cost for Day 3: $28 (transportation) + $166 (breakfast) + $58 (dinner) + $1,091 (accommodation) = $1,343\nAccommodation minimum nights: 1/2\n\n**Day 4: March 5th, 2022 - Knoxville**\n- Current City: Knoxville\n- Transportation: -\n- Breakfast: Les 3 Brasseurs, Knoxville, cost: $24 x 2 = $48, cuisines: Desserts, Pizza, Italian, Cafe, Indian\n- Attraction: World's Fair Park, Knoxville; Knoxville Museum of Art, Knoxville\n- Lunch: Mamagoto, Knoxville, cost: $14 x 2 = $28, cuisines: Indian, Mediterranean, Desserts, Seafood\n- Dinner: Cafe El Chico, Knoxville, cost: $67 x 2 = $134, cuisines: Tea, French, Indian, Seafood\n- Accommodation: Beautiful 1- bdrm apt in tranquil Inwood building, Knoxville, cost: $1,091, room type: Entire home/apt, house rules: Smoking allowed, minimum nights: 2, maximum occupancy: 4\n\nNumber of people: 2\nTotal cost for Day 4: $48 (breakfast) + $28 (lunch) + $134 (dinner) + $1,091 (accommodation) = $1,301\nAccommodation minimum nights: 2/2\n\n**Day 5: March 6th, 2022 - Knoxville to Minneapolis**\n- Current City: Knoxville to Minneapolis\n- Transportation: Self-driving, from Knoxville to Minneapolis, duration: 13 hours 58 mins, distance: 1,529 km, cost: $76 x 2 = $152\n- Breakfast: -\n- Attraction: -\n- Lunch: -\n- Dinner: -\n- Accommodation: -\n\nNumber of people: 2\nTotal cost for Day 5: $152 (transportation) = $152\n\n**Total cost across all days**: $975 (Day 1) + $1,059 (Day 2) + $1,343 (Day 3) + $1,301 (Day 4) + $152 (Day 5) = $4,830\n\nUnfortunately, the total cost of $4,830 exceeds the specified budget of $2,000. Adjustments will need to be made to the plan to reduce costs, such as choosing more affordable accommodations or dining options. Please let me know if you would like me to rework the plan to fit within the budget.", "gpt-4-1106-preview_direct_sole-planning_parsed_results": [{"day": 1, "current_city": "from Minneapolis to Nashville", "transportation": "Self-driving, from Minneapolis to Nashville, duration: 12 hours 45 mins, distance: 1,420 km", "breakfast": "-", "attraction": "-", "lunch": "-", "dinner": "Bangkok 1, Nashville", "accommodation": "Huge 2 Bedroom, Great Location, Express Metro, Nashville"}, {"day": 2, "current_city": "Nashville", "transportation": "-", "breakfast": "Govinda's Confectionery, Nashville", "attraction": "Country Music Hall of Fame and Museum, Nashville;The Parthenon, Nashville;", "lunch": "Smoke House Deli, Nashville", "dinner": "Oh! Calcutta, Nashville", "accommodation": "Huge 2 Bedroom, Great Location, Express Metro, Nashville"}, {"day": 3, "current_city": "from Nashville to Knoxville", "transportation": "Self-driving, from Nashville to Knoxville, duration: 2 hours 42 mins, distance: 290 km", "breakfast": "Dialogue Lounge & Caf\u6106, Nashville", "attraction": "-", "lunch": "-", "dinner": "Cafe Arabelle, Knoxville", "accommodation": "Beautiful 1- bdrm apt in tranquil Inwood building, Knoxville"}, {"day": 4, "current_city": "Knoxville", "transportation": "-", "breakfast": "Les 3 Brasseurs, Knoxville", "attraction": "World's Fair Park, Knoxville;Knoxville Museum of Art, Knoxville;", "lunch": "Mamagoto, Knoxville", "dinner": "Cafe El Chico, Knoxville", "accommodation": "Beautiful 1- bdrm apt in tranquil Inwood building, Knoxville"}, {"day": 5, "current_city": "from Knoxville to Minneapolis", "transportation": "Self-driving, from Knoxville to Minneapolis, duration: 13 hours 58 mins, distance: 1,529 km", "breakfast": "-", "attraction": "-", "lunch": "-", "dinner": "-", "accommodation": "-"}]}]