[{"gpt-4-1106-preview_direct_sole-planning_results": "Travel Plan:\n\nDay 1: March 2nd, 2022\nCurrent City: from Daytona Beach (Florida) to Atlanta (Georgia)\nTransportation: Self-driving, from Daytona Beach to Atlanta, duration: 6 hours 18 mins, distance: 696 km, cost: $34 x 3 = $102\nBreakfast: -\nAttraction: -\nLunch: -\nDinner: Saffron, Atlanta, cost: $39 x 3 = $117, cuisines: Tea, Cafe, Fast Food, Seafood\nAccommodation: Bright, Modern, Clean, Spacious, Brooklyn Home, Atlanta, cost: $1034, maximum occupancy: 4, house rules: No children under 10, minimum nights: 3\n\nNumber of people: 3\nTotal cost: $102 + $117 + $1034 = $1253\nAccommodation minimum nights: 1/3\n\nDay 2: March 3rd, 2022\nCurrent City: Atlanta\nTransportation: -\nBreakfast: Adda, Atlanta, cost: $22 x 3 = $66, cuisines: Tea, Mexican, Bakery\nAttraction: Georgia Aquarium, Atlanta; Centennial Olympic Park, Atlanta\nLunch: Baba Au Rhum, Atlanta, cost: $27 x 3 = $81, cuisines: Desserts, Pizza, Mexican, BBQ, Fast Food\nDinner: Asian Bistro, Atlanta, cost: $27 x 3 = $81, cuisines: Tea, Bakery, Seafood\nAccommodation: Bright, Modern, Clean, Spacious, Brooklyn Home, Atlanta, cost: $1034, maximum occupancy: 4, house rules: No children under 10, minimum nights: 3\n\nNumber of people: 3\nTotal cost: $66 + $81 + $81 + $1034 = $1262\nAccommodation minimum nights: 2/3\n\nDay 3: March 4th, 2022\nCurrent City: from Atlanta to Daytona Beach\nTransportation: Self-driving from Atlanta to Daytona Beach, duration: 6 hours 20 mins, distance: 706 km, cost: $35 x 3 = $105\nBreakfast: Chef Style, Atlanta, cost: $59 x 3 = $177, cuisines: Pizza, American, Desserts, Seafood\nAttraction: -\nLunch: -\nDinner: -\nAccommodation: -\n\nNumber of people: 3\nTotal cost: $105 + $177 = $282\n\nTotal cost across all days: $1253 + $1262 + $282 = $2797\n\nUnfortunately, the total cost exceeds the specified budget of $2,100. To adjust the plan to fit within the budget, we need to find more affordable accommodation options and possibly adjust meal choices.\n\nRevised Accommodation:\nAccommodation: Charming Carroll Gardens 2 BR, Atlanta, cost: $576, maximum occupancy: 4, house rules: No parties, minimum nights: 1\n\nRevised Total Costs:\nDay 1: $102 + $117 + $576 = $795\nDay 2: $66 + $81 + $81 + $576 = $804\nDay 3: $105 + $177 = $282\nRevised Total cost across all days: $795 + $804 + $282 = $1881\n\nThe revised plan now fits within the budget of $2,100, and all other constraints are met.", "gpt-4-1106-preview_direct_sole-planning_parsed_results": [{"day": 1, "current_city": "from Daytona Beach to Atlanta", "transportation": "Self-driving, from Daytona Beach to Atlanta, duration: 6 hours 18 mins, distance: 696 km", "breakfast": "-", "attraction": "-", "lunch": "-", "dinner": "Saffron, Atlanta", "accommodation": "Bright, Modern, Clean, Spacious, Brooklyn Home, Atlanta"}, {"day": 2, "current_city": "Atlanta", "transportation": "-", "breakfast": "Adda, Atlanta", "attraction": "Georgia Aquarium, Atlanta;Centennial Olympic Park, Atlanta;", "lunch": "Baba Au Rhum, Atlanta", "dinner": "Asian Bistro, Atlanta", "accommodation": "Bright, Modern, Clean, Spacious, Brooklyn Home, Atlanta"}, {"day": 3, "current_city": "from Atlanta to Daytona Beach", "transportation": "Self-driving from Atlanta to Daytona Beach, duration: 6 hours 20 mins, distance: 706 km", "breakfast": "Chef Style, Atlanta", "attraction": "-", "lunch": "-", "dinner": "-", "accommodation": "-"}]}]