[{"gpt-4-1106-preview_direct_sole-planning_results": "Based on the provided information and constraints, here is the travel plan for two people departing from Eugene and heading to Los Angeles for 3 days, from March 14th to March 16th, 2022, with a budget of $1,700:\n\n***** Travel Plan *****\n\nDay 1: March 14th, Eugene to Los Angeles\n- Transportation: Flight F3818922, from Eugene to Los Angeles, cost: $225 per person, total cost: $450\n- Breakfast: Not applicable (assuming departure is after breakfast)\n- Attraction: Santa Monica Pier, Los Angeles (no cost listed)\n- Lunch: Palmshore, Los Angeles, cost: $25 per person, total cost: $50, cuisines: Desserts, Bakery, Fast Food, American, Seafood\n- Dinner: Punjabi Zaika, Los Angeles, cost: $46 per person, total cost: $92, cuisines: Pizza, Bakery, BBQ, Cafe, Indian\n- Accommodation: Lovely studio, Los Angeles, cost: $117 per night, entire home/apt, house rules: No visitors, minimum nights: 1, maximum occupancy: 3\n\nNumber of people: 2\nTotal cost for Day 1: 2 x $450 + 2 x $25 + 2 x $46 + $117 = $1,158\n\nDay 2: March 15th, Los Angeles\n- Transportation: Not applicable (staying in Los Angeles)\n- Breakfast: Chicken Minar, Los Angeles, cost: $25 per person, total cost: $50, cuisines: Bakery, Fast Food\n- Attraction: Griffith Observatory, Los Angeles (no cost listed)\n- Lunch: The Hangout by 1861, Los Angeles, cost: $64 per person, total cost: $128, cuisines: Tea, Pizza, Seafood\n- Dinner: Saikutir Food, Los Angeles, cost: $96 per person, total cost: $192, cuisines: Tea, Pizza, Italian, Cafe, Mediterranean, Seafood\n- Accommodation: Lovely studio, Los Angeles (already booked for Day 1)\n\nNumber of people: 2\nTotal cost for Day 2: 2 x $25 + 2 x $64 + 2 x $96 = $370\n\nDay 3: March 16th, Los Angeles to Eugene\n- Transportation: Flight F3819973, from Los Angeles to Eugene, cost: $166 per person, total cost: $332\n- Breakfast: Angels in my Kitchen, Los Angeles, cost: $52 per person, total cost: $104, cuisines: Bakery, Pizza, Indian, Desserts\n- Attraction: Not applicable (assuming departure is in the morning)\n- Lunch: Not applicable (assuming arrival in Eugene is after lunch)\n- Dinner: Not applicable (back in Eugene)\n- Accommodation: Not applicable (back in Eugene)\n\nNumber of people: 2\nTotal cost for Day 3: 2 x $166 + 2 x $52 = $436\n\nTotal cost across all days: $1,158 (Day 1) + $370 (Day 2) + $436 (Day 3) = $1,964\n\nHowever, the total cost exceeds the budget of $1,700. To adjust the plan to fit the budget, we can change the transportation method from flights to self-driving, which is significantly cheaper.\n\nAdjusted Day 1:\n- Transportation: Self-driving, from Eugene to Los Angeles, cost: $69 total\n\nAdjusted Day 3:\n- Transportation: Self-driving, from Los Angeles to Eugene, cost: $68 total\n\nAdjusted Total cost across all days: $69 (Day 1) + $370 (Day 2) + $68 (Day 3) + $117 (Accommodation for 2 nights) = $624\n\nThe adjusted total cost of $624 is well within the budget of $1,700.\n\nCuisines: All cuisine constraints are satisfied.\nAccommodations: Entire rooms have been booked as requested.\nTransportation: Self-driving has been used to stay within budget.\n\n***** End of Travel Plan *****\n\nPlease note that the costs for attractions are not listed and assumed to be free. If there are entrance fees, they should be considered within the budget. Additionally, the cost for meals may vary depending on the actual menu prices at the time of the visit.", "gpt-4-1106-preview_direct_sole-planning_parsed_results": [{"day": 1, "current_city": "from Eugene to Los Angeles", "transportation": "Self-driving, from Eugene to Los Angeles", "breakfast": "-", "attraction": "Santa Monica Pier, Los Angeles", "lunch": "Palmshore, Los Angeles", "dinner": "Punjabi Zaika, Los Angeles", "accommodation": "Lovely studio, Los Angeles"}, {"day": 2, "current_city": "Los Angeles", "transportation": "-", "breakfast": "Chicken Minar, Los Angeles", "attraction": "Griffith Observatory, Los Angeles", "lunch": "The Hangout by 1861, Los Angeles", "dinner": "Saikutir Food, Los Angeles", "accommodation": "Lovely studio, Los Angeles"}, {"day": 3, "current_city": "from Los Angeles to Eugene", "transportation": "Self-driving, from Los Angeles to Eugene", "breakfast": "Angels in my Kitchen, Los Angeles", "attraction": "-", "lunch": "-", "dinner": "-", "accommodation": "-"}]}]