[{"gpt-4-1106-preview_direct_sole-planning_results": "Based on the provided information and constraints, here is a travel plan that begins in Key West and covers 2 cities in Indiana (Evansville and South Bend) from March 10th to March 14th, 2022, with a budget of $2,000.\n\n**Day 1: March 10, 2022 - Key West to Evansville**\n- Current City: from Key West (Florida) to Evansville (Indiana)\n- Transportation: Self-driving, from Key West to Evansville, duration: 18 hours 21 mins, distance: 1,961 km, cost: $98\n- Breakfast: -\n- Attraction: -\n- Lunch: -\n- Dinner: Blue Orchid Thai Restaurant, Evansville, cost: $86, cuisines: Tea, Mexican, American, Desserts\n- Accommodation: Stylish 1 bed room in the East Village, Evansville, cost: $674, room type: Entire home/apt, house rules: No children under 10, minimum nights: 3, maximum occupancy: 6\n\nNumber of people: 1\nTotal cost: $98 (transportation) + $86 (dinner) + $674 (accommodation) = $858\nAccommodation minimum nights: 1/3\n\n**Day 2: March 11, 2022 - Evansville**\n- Current City: Evansville\n- Transportation: -\n- Breakfast: J. Christopher's, Evansville, cost: $39, cuisines: Tea, Cafe, Desserts, Seafood\n- Attraction: Mesker Park Zoo, Evansville; Evansville Museum, Evansville\n- Lunch: Punjabi Restaurant, Evansville, cost: $29, cuisines: Cafe, Bakery, Desserts, Fast Food\n- Dinner: Twist of Italy, Evansville, cost: $85, cuisines: Desserts, Pizza, Mexican, Mediterranean, Seafood\n- Accommodation: Stylish 1 bed room in the East Village, Evansville, cost: $674, room type: Entire home/apt, house rules: No children under 10, minimum nights: 3, maximum occupancy: 6\n\nNumber of people: 1\nTotal cost: $39 (breakfast) + $29 (lunch) + $85 (dinner) + $674 (accommodation) = $827\nAccommodation minimum nights: 2/3\n\n**Day 3: March 12, 2022 - Evansville to South Bend**\n- Current City: from Evansville (Indiana) to South Bend (Indiana)\n- Transportation: Self-driving, from Evansville to South Bend, duration: 5 hours 1 min, distance: 512 km, cost: $25\n- Breakfast: -\n- Attraction: -\n- Lunch: Krips Restaurant, South Bend, cost: $59, cuisines: Tea, Mediterranean, Fast Food\n- Dinner: MOB Brewpub, South Bend, cost: $67, cuisines: Cafe, Mexican, American, BBQ\n- Accommodation: Just Right in Lovely Greenpoint, South Bend, cost: $614, room type: Private room, house rules: No smoking & No visitors, minimum nights: 7, maximum occupancy: 1\n\nNumber of people: 1\nTotal cost: $25 (transportation) + $59 (lunch) + $67 (dinner) + $614 (accommodation) = $765\nAccommodation minimum nights: 1/7\n\n**Day 4: March 13, 2022 - South Bend**\n- Current City: South Bend\n- Transportation: -\n- Breakfast: Our Story Bistro & Tea Room, South Bend, cost: $10, cuisines: Tea, Pizza, Italian, BBQ, Mediterranean, Seafood\n- Attraction: Studebaker National Museum, South Bend; Potawatomi Zoo, South Bend\n- Lunch: Roadhouse Cafe, South Bend, cost: $24, cuisines: Desserts, Pizza, Bakery, Fast Food, Chinese\n- Dinner: Lotus Pond, South Bend, cost: $83, cuisines: Tea, Seafood, Italian\n- Accommodation: Just Right in Lovely Greenpoint, South Bend, cost: $614, room type: Private room, house rules: No smoking & No visitors, minimum nights: 7, maximum occupancy: 1\n\nNumber of people: 1\nTotal cost: $10 (breakfast) + $24 (lunch) + $83 (dinner) + $614 (accommodation) = $731\nAccommodation minimum nights: 2/7\n\n**Day 5: March 14, 2022 - South Bend to Key West**\n- Current City: from South Bend (Indiana) to Key West (Florida)\n- Transportation: Self-driving, from South Bend to Key West, duration: 22 hours 38 mins, distance: 2,406 km, cost: $120\n- Breakfast: -\n- Attraction: -\n- Lunch: -\n- Dinner: -\n- Accommodation: -\n\nNumber of people: 1\nTotal cost: $120 (transportation) = $120\n\n**Total cost across all days: $858 (Day 1) + $827 (Day 2) + $765 (Day 3) + $731 (Day 4) + $120 (Day 5) = $3,301**\n\nUnfortunately, the total cost of $3,301 exceeds the specified budget of $2,000. To adhere to the budget, adjustments must be made to the plan, such as choosing more affordable accommodations or dining options. However, with the given data, it is not possible to create a plan that meets all the constraints within the $2,000 budget.", "gpt-4-1106-preview_direct_sole-planning_parsed_results": [{"day": 1, "current_city": "from Key West to Evansville", "transportation": "Self-driving, from Key West to Evansville, duration: 18 hours 21 mins, distance: 1,961 km", "breakfast": "-", "attraction": "-", "lunch": "-", "dinner": "Blue Orchid Thai Restaurant, Evansville", "accommodation": "Stylish 1 bed room in the East Village, Evansville"}, {"day": 2, "current_city": "Evansville", "transportation": "-", "breakfast": "J. Christopher's, Evansville", "attraction": "Mesker Park Zoo, Evansville;Evansville Museum, Evansville;", "lunch": "Punjabi Restaurant, Evansville", "dinner": "Twist of Italy, Evansville", "accommodation": "Stylish 1 bed room in the East Village, Evansville"}, {"day": 3, "current_city": "from Evansville to South Bend", "transportation": "Self-driving, from Evansville to South Bend, duration: 5 hours 1 min, distance: 512 km", "breakfast": "-", "attraction": "-", "lunch": "Krips Restaurant, South Bend", "dinner": "MOB Brewpub, South Bend", "accommodation": "Just Right in Lovely Greenpoint, South Bend"}, {"day": 4, "current_city": "South Bend", "transportation": "-", "breakfast": "Our Story Bistro & Tea Room, South Bend", "attraction": "Studebaker National Museum, South Bend;Potawatomi Zoo, South Bend;", "lunch": "Roadhouse Cafe, South Bend", "dinner": "Lotus Pond, South Bend", "accommodation": "Just Right in Lovely Greenpoint, South Bend"}, {"day": 5, "current_city": "from South Bend to Key West", "transportation": "Self-driving, from South Bend to Key West, duration: 22 hours 38 mins, distance: 2,406 km", "breakfast": "-", "attraction": "-", "lunch": "-", "dinner": "-", "accommodation": "-"}]}]