[{"gpt-4-1106-preview_direct_sole-planning_results": "Travel Plan for Two Persons from Chattanooga to Georgia Cities (No Air Travel)\n\nDay 1: Chattanooga to Augusta (March 9, 2022)\n- Transportation: Self-driving from Chattanooga to Augusta, duration: 3 hours 57 mins, distance: 423 km, cost: $21 x 2 = $42\n- Breakfast: -\n- Attraction: -\n- Lunch: -\n- Dinner: B Merrell's, Augusta, cost: $74 x 2 = $148, cuisines: Tea, Pizza, Desserts, Fast Food\n- Accommodation: Perfect Chanukah apartment for the whole crew!, Augusta, cost: $451 x 1 = $451, room type: Entire home/apt, house rules: No pets\n\nDay 2: Augusta (March 10, 2022)\n- Transportation: -\n- Breakfast: Fish Tales Lakeside Grille, Augusta, cost: $37 x 2 = $74, cuisines: Tea, Cafe, Bakery, Desserts\n- Attraction: Augusta Canal National Heritage Area, Augusta\n- Lunch: Karari Kurry, Augusta, cost: $29 x 2 = $58, cuisines: Bakery, Indian, Cafe, Fast Food\n- Dinner: The Golden Dragon, Augusta, cost: $82 x 2 = $164, cuisines: Desserts, Pizza, Fast Food, Indian, Mediterranean, Seafood\n- Accommodation: Perfect Chanukah apartment for the whole crew!, Augusta, cost: $451 x 1 = $451, room type: Entire home/apt, house rules: No pets\n\nDay 3: Augusta to Decatur (March 11, 2022)\n- Transportation: Self-driving from Augusta to Decatur, duration: 2 hours 19 mins, distance: 229 km, cost: $11 x 2 = $22\n- Breakfast: -\n- Attraction: -\n- Lunch: -\n- Dinner: Madhuban Restaurant - Welcome Hotel Rama International, Decatur, cost: $47 x 2 = $94, cuisines: Pizza, Bakery, Seafood\n- Accommodation: The Heart of the Lower East Side!, Decatur, cost: $587 x 1 = $587, room type: Entire home/apt, house rules: No children under 10\n\nDay 4: Decatur (March 12, 2022)\n- Transportation: -\n- Breakfast: Cafe Coffee Day, Decatur, cost: $46 x 2 = $92, cuisines: Tea, Cafe, BBQ, Mediterranean\n- Attraction: Decatur Square, Decatur\n- Lunch: Dawat-E-Chaman, Decatur, cost: $42 x 2 = $84, cuisines: Chinese, BBQ, Fast Food, Cafe, Mediterranean\n- Dinner: Joey's Pizza, Decatur, cost: $69 x 2 = $138, cuisines: Tea, Pizza, Bakery, Chinese, Seafood\n- Accommodation: The Heart of the Lower East Side!, Decatur, cost: $587 x 1 = $587, room type: Entire home/apt, house rules: No children under 10\n\nDay 5: Decatur to Atlanta (March 13, 2022)\n- Transportation: Self-driving from Decatur to Atlanta, duration: 19 mins, distance: 13.0 km, cost: $0 x 2 = $0\n- Breakfast: -\n- Attraction: -\n- Lunch: -\n- Dinner: Saffron, Atlanta, cost: $39 x 2 = $78, cuisines: Tea, Cafe, Fast Food, Seafood\n- Accommodation: Bright, Modern, Clean, Spacious, Brooklyn Home, Atlanta, cost: $1034 x 1 = $1034, room type: Entire home/apt, house rules: No children under 10\n\nDay 6: Atlanta (March 14, 2022)\n- Transportation: -\n- Breakfast: Asian Bistro, Atlanta, cost: $27 x 2 = $54, cuisines: Tea, Bakery, Seafood\n- Attraction: Georgia Aquarium, Atlanta\n- Lunch: Pizza Central, Atlanta, cost: $75 x 2 = $150, cuisines: Cafe, Bakery, BBQ, Fast Food, Chinese, Indian\n- Dinner: Daawat-e-Kashmir, Atlanta, cost: $19 x 2 = $38, cuisines: Cafe, Pizza, American, Seafood\n- Accommodation: Bright, Modern, Clean, Spacious, Brooklyn Home, Atlanta, cost: $1034 x 1 = $1034, room type: Entire home/apt, house rules: No children under 10\n\nDay 7: Atlanta to Chattanooga (March 15, 2022)\n- Transportation: Self-driving from Atlanta to Chattanooga, duration: 1 hour 47 mins, distance: 190 km, cost: $9 x 2 = $18\n- Breakfast: -\n- Attraction: -\n- Lunch: -\n- Dinner: -\n- Accommodation: -\n\nTotal Cost Calculation:\nTransportation: $42 + $22 + $0 + $18 = $82\nMeals: $148 + $74 + $58 + $164 + $94 + $92 + $84 + $138 + $78 + $54 + $150 + $38 = $1082\nAccommodations: $451 + $451 + $587 + $587 + $1034 + $1034 = $4144\nTotal Cost: $82 + $1082 + $4144 = $5308\n\nRemaining Budget: $6900 - $5308 = $1592\n\nCuisines: All cuisine constraints are satisfied.\nAccommodation: All accommodations are private rooms or entire homes, with no shared rooms or visitor restrictions.\nTransportation: No air travel was included, as per the request.\n\nPlease note that some meals and attractions were not specified due to lack of provided information or to stay within budget. The remaining budget can be used for additional meals, attractions, or any unforeseen expenses.", "gpt-4-1106-preview_direct_sole-planning_parsed_results": [{"day": 1, "current_city": "from Chattanooga to Augusta", "transportation": "Self-driving from Chattanooga to Augusta, duration: 3 hours 57 mins, distance: 423 km", "breakfast": "-", "attraction": "-", "lunch": "-", "dinner": "B Merrell's, Augusta", "accommodation": "Perfect Chanukah apartment for the whole crew!, Augusta"}, {"day": 2, "current_city": "Augusta", "transportation": "-", "breakfast": "Fish Tales Lakeside Grille, Augusta", "attraction": "Augusta Canal National Heritage Area, Augusta", "lunch": "Karari Kurry, Augusta", "dinner": "The Golden Dragon, Augusta", "accommodation": "Perfect Chanukah apartment for the whole crew!, Augusta"}, {"day": 3, "current_city": "from Augusta to Decatur", "transportation": "Self-driving from Augusta to Decatur, duration: 2 hours 19 mins, distance: 229 km", "breakfast": "-", "attraction": "-", "lunch": "-", "dinner": "Madhuban Restaurant - Welcome Hotel Rama International, Decatur", "accommodation": "The Heart of the Lower East Side!, Decatur"}, {"day": 4, "current_city": "Decatur", "transportation": "-", "breakfast": "Cafe Coffee Day, Decatur", "attraction": "Decatur Square, Decatur", "lunch": "Dawat-E-Chaman, Decatur", "dinner": "Joey's Pizza, Decatur", "accommodation": "The Heart of the Lower East Side!, Decatur"}, {"day": 5, "current_city": "from Decatur to Atlanta", "transportation": "Self-driving from Decatur to Atlanta, duration: 19 mins, distance: 13.0 km", "breakfast": "-", "attraction": "-", "lunch": "-", "dinner": "Saffron, Atlanta", "accommodation": "Bright, Modern, Clean, Spacious, Brooklyn Home, Atlanta"}, {"day": 6, "current_city": "Atlanta", "transportation": "-", "breakfast": "Asian Bistro, Atlanta", "attraction": "Georgia Aquarium, Atlanta", "lunch": "Pizza Central, Atlanta", "dinner": "Daawat-e-Kashmir, Atlanta", "accommodation": "Bright, Modern, Clean, Spacious, Brooklyn Home, Atlanta"}, {"day": 7, "current_city": "from Atlanta to Chattanooga", "transportation": "Self-driving from Atlanta to Chattanooga, duration: 1 hour 47 mins, distance: 190 km", "breakfast": "-", "attraction": "-", "lunch": "-", "dinner": "-", "accommodation": "-"}]}]