[{"gpt-4-1106-preview_direct_sole-planning_results": "Based on the provided information and constraints, here is a travel plan for one person departing from Pittsburgh to Baltimore for 3 days, from March 4th to March 6th, 2022, with a maximum budget of $1,200:\n\n***** Travel Plan *****\n\nDay 1: March 4, 2022\n- Current City: Pittsburgh\n- Transportation: Flight F3969954 from Pittsburgh to Baltimore, cost: $52\n- Breakfast: -\n- Attraction: -\n- Lunch: -\n- Dinner: Los Pablos, Baltimore, cost: $47, cuisines: Indian, BBQ, Cafe, American, Seafood\n- Accommodation: Contemporary Home Away from Home, Entire house, Baltimore, cost: $290, maximum occupancy: 2, house rules: No visitors, minimum nights: 2\n\nNumber of people: 1\nTotal cost for Day 1: $52 (flight) + $47 (dinner) + $290 (accommodation) = $389\n\nDay 2: March 5, 2022\n- Current City: Baltimore\n- Transportation: -\n- Breakfast: Salt, Baltimore, cost: $56, cuisines: Tea, Bakery, Fast Food, Chinese, American\n- Attraction: National Aquarium, Baltimore; The Walters Art Museum, Baltimore\n- Lunch: The Thai Bowl, Baltimore, cost: $66, cuisines: BBQ, Pizza, Desserts, Italian\n- Dinner: Farzi Cafe, Baltimore, cost: $96, cuisines: Desserts, American, BBQ, Seafood\n- Accommodation: Contemporary Home Away from Home, Entire house, Baltimore, cost: $290, maximum occupancy: 2, house rules: No visitors, minimum nights: 2\n\nNumber of people: 1\nTotal cost for Day 2: $56 (breakfast) + $66 (lunch) + $96 (dinner) + $290 (accommodation) = $508\n\nDay 3: March 6, 2022\n- Current City: Baltimore\n- Transportation: Self-driving from Baltimore to Pittsburgh, duration: 3 hours 58 mins, distance: 398 km, cost: $19\n- Breakfast: Mr. Dunderbak's Biergarten and Marketplatz, Baltimore, cost: $74, cuisines: Cafe, Pizza, American\n- Attraction: -\n- Lunch: -\n- Dinner: -\n- Accommodation: -\n\nNumber of people: 1\nTotal cost for Day 3: $19 (transportation) + $74 (breakfast) = $93\n\nTotal cost across all days: $389 (Day 1) + $508 (Day 2) + $93 (Day 3) = $990\n\nRemaining budget: $1,200 - $990 = $210\n\nCuisines: The prompt specifies no cuisines, so all cuisine constraints are satisfied.\n\n***** End of Travel Plan *****\n\nPlease note that the attractions listed do not have associated costs in the provided information, so they are included without affecting the budget. The accommodation chosen meets the requirement of not being a shared room and adheres to the house rules specified. The restaurants selected offer a variety of cuisines and are not repeated for breakfast, lunch, or dinner across the days. The transportation modes used are valid and meet the constraints specified in the query. The total cost of the travel plan does not exceed the specified budget.", "gpt-4-1106-preview_direct_sole-planning_parsed_results": [{"day": 1, "current_city": "from Pittsburgh to Baltimore", "transportation": "Flight Number: F3969954, from Pittsburgh to Baltimore", "breakfast": "-", "attraction": "-", "lunch": "-", "dinner": "Los Pablos, Baltimore", "accommodation": "Contemporary Home Away from Home, Baltimore"}, {"day": 2, "current_city": "Baltimore", "transportation": "-", "breakfast": "Salt, Baltimore", "attraction": "National Aquarium, Baltimore;The Walters Art Museum, Baltimore;", "lunch": "The Thai Bowl, Baltimore", "dinner": "Farzi Cafe, Baltimore", "accommodation": "Contemporary Home Away from Home, Baltimore"}, {"day": 3, "current_city": "from Baltimore to Pittsburgh", "transportation": "Self-driving from Baltimore to Pittsburgh", "breakfast": "Mr. Dunderbak's Biergarten and Marketplatz, Baltimore", "attraction": "-", "lunch": "-", "dinner": "-", "accommodation": "-"}]}]