[{"gpt-4-1106-preview_direct_sole-planning_results": "Based on the provided information and constraints, here is a 7-day travel plan for a solo traveler starting from Augusta and visiting 3 different cities in Texas:\n\n**Day 1: Augusta to Abilene**\n- Current City: Augusta\n- Transportation: Self-driving from Augusta to Abilene, duration: 15 hours 59 mins, distance: 1,782 km, cost: $89\n- Breakfast: -\n- Attraction: -\n- Lunch: -\n- Dinner: Thai Garden, Abilene, cost: $13, cuisines: Cafe, American, Desserts\n- Accommodation: Joyce and Donovan's, Room for One, Abilene, cost: $83, room type: Private room, house rules: No parties, minimum nights: 1\n\n**Day 2: Abilene**\n- Current City: Abilene\n- Transportation: -\n- Breakfast: Biryani Express, Abilene, cost: $11, cuisines: Tea, Pizza, French, Bakery, Fast Food\n- Attraction: The Grace Museum, Frontier Texas!\n- Lunch: Finger Licious, Abilene, cost: $35, cuisines: Fast Food, Cafe, BBQ, Seafood\n- Dinner: Mediumwelldone, Abilene, cost: $91, cuisines: Tea, French, BBQ, Cafe, Seafood\n- Accommodation: Joyce and Donovan's, Room for One, Abilene, cost: $83, room type: Private room, house rules: No parties, minimum nights: 1\n\n**Day 3: Abilene to Amarillo**\n- Current City: from Abilene to Amarillo\n- Transportation: Self-driving from Abilene to Amarillo, duration: 4 hours 10 mins, distance: 446 km, cost: $22\n- Breakfast: Mamagoto, Abilene, cost: $93, cuisines: Desserts, Tea, Bakery, Cafe, Indian, Mediterranean\n- Attraction: Cadillac Ranch, Amarillo Botanical Gardens\n- Lunch: The Cinnamon Kitchen, Amarillo, cost: $69, cuisines: Desserts, Tea, Pizza, Chinese, Seafood\n- Dinner: Komachi, Amarillo, cost: $71, cuisines: Desserts, Tea, Fast Food, Chinese, Mediterranean\n- Accommodation: Harlem Humble Abode - 1 bedroom - Cute and Quaint, Amarillo, cost: $409, room type: Entire home/apt, house rules: No pets, minimum nights: 1\n\n**Day 4: Amarillo**\n- Current City: Amarillo\n- Transportation: -\n- Breakfast: Wood Box Cafe, Amarillo, cost: $11, cuisines: Desserts, French, Fast Food, Cafe, American\n- Attraction: Amarillo Zoo, Don Harrington Discovery Center\n- Lunch: Sigree Global Grill, Amarillo, cost: $35, cuisines: Chinese, BBQ, Cafe, Desserts\n- Dinner: Anand Restaurant, Amarillo, cost: $53, cuisines: Fast Food, Seafood, Desserts, Italian\n- Accommodation: Harlem Humble Abode - 1 bedroom - Cute and Quaint, Amarillo, cost: $409, room type: Entire home/apt, house rules: No pets, minimum nights: 1\n\n**Day 5: Amarillo to Lubbock**\n- Current City: from Amarillo to Lubbock\n- Transportation: Self-driving from Amarillo to Lubbock, duration: 1 hour 47 mins, distance: 197 km, cost: $9\n- Breakfast: Thalaivar, Amarillo, cost: $27, cuisines: Tea, Fast Food, American, Seafood\n- Attraction: Buddy Holly Center, National Ranching Heritage Center\n- Lunch: Paris 6 Classique, Lubbock, cost: $91, cuisines: Desserts, Cafe, Pizza, Mexican, BBQ, Chinese\n- Dinner: 3 Squares Diner, Lubbock, cost: $73, cuisines: Pizza, Indian, Fast Food\n- Accommodation: Private bedroom in UWS Apartment, Lubbock, cost: $709, room type: Private room, house rules: No visitors & No pets, minimum nights: 1\n\n**Day 6: Lubbock**\n- Current City: Lubbock\n- Transportation: -\n- Breakfast: Mosaic - Country Inn & Suites By Carlson, Lubbock, cost: $29, cuisines: Chinese, Indian, Desserts, Seafood\n- Attraction: American Windmill Museum, Mackenzie Main City Park\n- Lunch: Sultanat, Lubbock, cost: $72, cuisines: Chinese, Bakery, BBQ, Cafe\n- Dinner: The Town House Cafe, Lubbock, cost: $90, cuisines: Tea, American, BBQ, Cafe, Indian, Seafood\n- Accommodation: Private bedroom in UWS Apartment, Lubbock, cost: $709, room type: Private room, house rules: No visitors & No pets, minimum nights: 1\n\n**Day 7: Lubbock to Augusta**\n- Current City: from Lubbock to Augusta\n- Transportation: Self-driving from Lubbock to Augusta, duration: 18 hours 17 mins, distance: 2,047 km, cost: $102\n- Breakfast: -\n- Attraction: -\n- Lunch: -\n- Dinner: -\n- Accommodation: -\n\n**Total Cost Calculation:**\n- Transportation: $89 + $22 + $9 + $102 = $222\n- Meals: $13 + $11 + $35 + $91 + $93 + $69 + $71 + $11 + $35 + $53 + $27 + $91 + $73 + $29 + $72 + $90 = $764\n- Accommodation: $83 + $83 + $409 + $409 + $709 + $709 = $2,402\n- Total cost: $222 + $764 + $2,402 = $3,388\n\nThe total cost of $3,388 is within the budget of $4,100. The plan includes all required details and adheres to the constraints provided.", "gpt-4-1106-preview_direct_sole-planning_parsed_results": [{"day": 1, "current_city": "from Augusta to Abilene", "transportation": "Self-driving from Augusta to Abilene, duration: 15 hours 59 mins, distance: 1,782 km", "breakfast": "-", "attraction": "-", "lunch": "-", "dinner": "Thai Garden, Abilene", "accommodation": "Joyce and Donovan's, Room for One, Abilene"}, {"day": 2, "current_city": "Abilene", "transportation": "-", "breakfast": "Biryani Express, Abilene", "attraction": "The Grace Museum, Abilene;Frontier Texas!, Abilene;", "lunch": "Finger Licious, Abilene", "dinner": "Mediumwelldone, Abilene", "accommodation": "Joyce and Donovan's, Room for One, Abilene"}, {"day": 3, "current_city": "from Abilene to Amarillo", "transportation": "Self-driving from Abilene to Amarillo, duration: 4 hours 10 mins, distance: 446 km", "breakfast": "Mamagoto, Abilene", "attraction": "Cadillac Ranch, Amarillo;Amarillo Botanical Gardens, Amarillo;", "lunch": "The Cinnamon Kitchen, Amarillo", "dinner": "Komachi, Amarillo", "accommodation": "Harlem Humble Abode - 1 bedroom - Cute and Quaint, Amarillo"}, {"day": 4, "current_city": "Amarillo", "transportation": "-", "breakfast": "Wood Box Cafe, Amarillo", "attraction": "Amarillo Zoo, Amarillo;Don Harrington Discovery Center, Amarillo;", "lunch": "Sigree Global Grill, Amarillo", "dinner": "Anand Restaurant, Amarillo", "accommodation": "Harlem Humble Abode - 1 bedroom - Cute and Quaint, Amarillo"}, {"day": 5, "current_city": "from Amarillo to Lubbock", "transportation": "Self-driving from Amarillo to Lubbock, duration: 1 hour 47 mins, distance: 197 km", "breakfast": "Thalaivar, Amarillo", "attraction": "Buddy Holly Center, Lubbock;National Ranching Heritage Center, Lubbock;", "lunch": "Paris 6 Classique, Lubbock", "dinner": "3 Squares Diner, Lubbock", "accommodation": "Private bedroom in UWS Apartment, Lubbock"}, {"day": 6, "current_city": "Lubbock", "transportation": "-", "breakfast": "Mosaic - Country Inn & Suites By Carlson, Lubbock", "attraction": "American Windmill Museum, Lubbock;Mackenzie Main City Park, Lubbock;", "lunch": "Sultanat, Lubbock", "dinner": "The Town House Cafe, Lubbock", "accommodation": "Private bedroom in UWS Apartment, Lubbock"}, {"day": 7, "current_city": "from Lubbock to Augusta", "transportation": "Self-driving from Lubbock to Augusta, duration: 18 hours 17 mins, distance: 2,047 km", "breakfast": "-", "attraction": "-", "lunch": "-", "dinner": "-", "accommodation": "-"}]}]