[{"gpt-4-1106-preview_direct_sole-planning_results": "Travel Plan:\n\nDay 1: March 18, 2022 - From Lexington to Dallas\n- Transportation: Flight Number F3600281, from Lexington to Dallas, cost: $222 per person, total cost: $888\n- Breakfast: Not applicable (assuming departure is early in the morning)\n- Attraction: Arrival and settling in\n- Lunch: Coconuts Fish Cafe, Dallas, cost: $38, cuisines: Cafe, BBQ, Mediterranean, Fast Food\n- Dinner: 1918 Bistro & Grill, Dallas, cost: $90, cuisines: Tea, Pizza, BBQ, Seafood\n- Accommodation: Luxury Williamsburg duplex, private roof terrace, Dallas, cost: $241, room type: Entire home/apt, suitable for children under 10\n\nNumber of people: 4\nTotal cost: 4 x $888 + 4 x $38 + 4 x $90 + $241 = $4,525\nAccommodation minimum nights: 1/4\n\nDay 2: March 19, 2022 - Dallas\n- Transportation: -\n- Breakfast: Cafe Gatherings, Dallas, cost: $17, cuisines: Bakery, Indian, Desserts\n- Attraction: The Dallas World Aquarium; The Sixth Floor Museum at Dealey Plaza\n- Lunch: Drifters Cafe, Dallas, cost: $21, cuisines: Tea, French, Mexican, Cafe, Seafood\n- Dinner: Uma Foodies' Hut, Dallas, cost: $49, cuisines: French, Bakery, Seafood\n- Accommodation: Luxury Williamsburg duplex, private roof terrace, Dallas, cost: $241, room type: Entire home/apt, suitable for children under 10\n\nNumber of people: 4\nTotal cost: 4 x $17 + 4 x $21 + 4 x $49 + $241 = $673\nAccommodation minimum nights: 2/4\n\nDay 3: March 20, 2022 - From Dallas to San Angelo\n- Transportation: Flight Number F3608910, from Dallas to San Angelo, cost: $54 per person, total cost: $216\n- Breakfast: Puri Bakers, Dallas, cost: $33, cuisines: Pizza, Mexican, Bakery, Fast Food, Cafe, Indian\n- Attraction: Arrival and settling in\n- Lunch: DePalma's Italian Cafe - Downtown, San Angelo, cost: $38, cuisines: French, Pizza, Chinese, Seafood\n- Dinner: Needs Gourmet, San Angelo, cost: $83, cuisines: Bakery, American, Desserts, Italian\n- Accommodation: INCREDIBLE TOWNHOUSE 4 STORIES 5 BEDROOMS 3 BATH, San Angelo, cost: $338, room type: Entire home/apt, suitable for children under 10\n\nNumber of people: 4\nTotal cost: 4 x $54 + 4 x $33 + 4 x $38 + 4 x $83 + $338 = $1,070\nAccommodation minimum nights: 1/2\n\nDay 4: March 21, 2022 - San Angelo\n- Transportation: -\n- Breakfast: District 6, San Angelo, cost: $19, cuisines: Bakery, American, Cafe, BBQ\n- Attraction: San Angelo Museum of Fine Arts; Fort Concho National Historic Landmark\n- Lunch: Break Fast Point, San Angelo, cost: $40, cuisines: Tea, Cafe, Indian\n- Dinner: Delhi Chaat Bhandar, San Angelo, cost: $100, cuisines: Italian, Bakery, Fast Food, Mediterranean, Seafood\n- Accommodation: INCREDIBLE TOWNHOUSE 4 STORIES 5 BEDROOMS 3 BATH, San Angelo, cost: $338, room type: Entire home/apt, suitable for children under 10\n\nNumber of people: 4\nTotal cost: 4 x $19 + 4 x $40 + 4 x $100 + $338 = $1,074\nAccommodation minimum nights: 2/2\n\nDay 5: March 22, 2022 - From San Angelo to Houston\n- Transportation: Self-driving, from San Angelo to Houston, cost: $29 per person, total cost: $116\n- Breakfast: 6 Ballygunge Place, San Angelo, cost: $48, cuisines: Tea, Cafe, Bakery, Desserts\n- Attraction: Arrival and settling in\n- Lunch: Jalapenos, Houston, cost: $57, cuisines: Desserts, Tea, Cafe, Chinese, Seafood\n- Dinner: Super Bakery, Houston, cost: $30, cuisines: Seafood, Fast Food\n- Accommodation: Sunny and Airy near Manhattan, Houston, cost: $499, room type: Entire home/apt, suitable for children under 10\n\nNumber of people: 4\nTotal cost: 4 x $29 + 4 x $48 + 4 x $57 + 4 x $30 + $499 = $1,267\nAccommodation minimum nights: 1/2\n\nDay 6: March 23, 2022 - Houston\n- Transportation: -\n- Breakfast: Matchbox, Houston, cost: $33, cuisines: Tea, Italian, Bakery, Fast Food, Seafood\n- Attraction: Space Center Houston; Houston Museum of Natural Science\n- Lunch: Earthen Spices, Houston, cost: $28, cuisines: Tea, Mexican, Bakery, BBQ, Fast Food\n- Dinner: The BrewMaster - The Mix Fine Dine, Houston, cost: $52, cuisines: French, Indian, Cafe, Seafood\n- Accommodation: Sunny and Airy near Manhattan, Houston, cost: $499, room type: Entire home/apt, suitable for children under 10\n\nNumber of people: 4\nTotal cost: 4 x $33 + 4 x $28 + 4 x $52 + $499 = $1,091\nAccommodation minimum nights: 2/2\n\nDay 7: March 24, 2022 - From Houston to Lexington\n- Transportation: Self-driving, from Houston to Lexington, cost: $79 per person, total cost: $316\n- Breakfast: Vinayaka Mylari, Houston, cost: $14, cuisines: Fast Food, French, Cafe, Italian\n- Attraction: Departure\n- Lunch: Not applicable (assuming travel during lunch hours)\n- Dinner: Not applicable (assuming arrival in Lexington in the evening)\n- Accommodation: Not applicable (returning home)\n\nNumber of people: 4\nTotal cost: 4 x $79 + 4 x $14 = $372\n\nTotal cost across all days: $4,525 + $673 + $1,070 + $1,074 + $1,267 + $1,091 + $372 = $10,072\n\nRemaining budget: $16,800 - $10,072 = $6,728\n\nCuisines: The plan includes a variety of cuisines suitable for all tastes.\nAccommodations: All accommodations are suitable for children under 10 and are entire home/apartment types to ensure privacy and comfort for the family.\n\nPlease note that the costs for attractions and any additional snacks or expenses are not included in the total cost and should be considered within the remaining budget.", "gpt-4-1106-preview_direct_sole-planning_parsed_results": [{"day": 1, "current_city": "from Lexington to Dallas", "transportation": "Flight Number: F3600281, from Lexington to Dallas, Departure Time: -, Arrival Time: -", "breakfast": "-", "attraction": "-", "lunch": "Coconuts Fish Cafe, Dallas", "dinner": "1918 Bistro & Grill, Dallas", "accommodation": "Luxury Williamsburg duplex, private roof terrace, Dallas"}, {"day": 2, "current_city": "Dallas", "transportation": "-", "breakfast": "Cafe Gatherings, Dallas", "attraction": "The Dallas World Aquarium, Dallas;The Sixth Floor Museum at Dealey Plaza, Dallas;", "lunch": "Drifters Cafe, Dallas", "dinner": "Uma Foodies' Hut, Dallas", "accommodation": "Luxury Williamsburg duplex, private roof terrace, Dallas"}, {"day": 3, "current_city": "from Dallas to San Angelo", "transportation": "Flight Number: F3608910, from Dallas to San Angelo, Departure Time: -, Arrival Time: -", "breakfast": "Puri Bakers, Dallas", "attraction": "-", "lunch": "DePalma's Italian Cafe - Downtown, San Angelo", "dinner": "Needs Gourmet, San Angelo", "accommodation": "INCREDIBLE TOWNHOUSE 4 STORIES 5 BEDROOMS 3 BATH, San Angelo"}, {"day": 4, "current_city": "San Angelo", "transportation": "-", "breakfast": "District 6, San Angelo", "attraction": "San Angelo Museum of Fine Arts, San Angelo;Fort Concho National Historic Landmark, San Angelo;", "lunch": "Break Fast Point, San Angelo", "dinner": "Delhi Chaat Bhandar, San Angelo", "accommodation": "INCREDIBLE TOWNHOUSE 4 STORIES 5 BEDROOMS 3 BATH, San Angelo"}, {"day": 5, "current_city": "from San Angelo to Houston", "transportation": "Self-driving, from San Angelo to Houston, Departure Time: -, Arrival Time: -", "breakfast": "6 Ballygunge Place, San Angelo", "attraction": "-", "lunch": "Jalapenos, Houston", "dinner": "Super Bakery, Houston", "accommodation": "Sunny and Airy near Manhattan, Houston"}, {"day": 6, "current_city": "Houston", "transportation": "-", "breakfast": "Matchbox, Houston", "attraction": "Space Center Houston, Houston;Houston Museum of Natural Science, Houston;", "lunch": "Earthen Spices, Houston", "dinner": "The BrewMaster - The Mix Fine Dine, Houston", "accommodation": "Sunny and Airy near Manhattan, Houston"}, {"day": 7, "current_city": "from Houston to Lexington", "transportation": "Self-driving, from Houston to Lexington, Departure Time: -, Arrival Time: -", "breakfast": "Vinayaka Mylari, Houston", "attraction": "-", "lunch": "-", "dinner": "-", "accommodation": "-"}]}]