[{"gpt-4-1106-preview_direct_sole-planning_results": "Based on the provided information and constraints, here is a 5-day travel itinerary for two people departing from Grand Junction to two cities in Arizona, with a budget of $2,100, accommodations allowing visitors, preference for private rooms, and no flight transportation.\n\n**Day 1: Grand Junction to Phoenix (March 19, 2022)**\n\n- Transportation: Self-driving from Grand Junction to Phoenix, duration: 9 hours 11 mins, distance: 934 km, cost: $46 x 2 = $92\n- Breakfast: -\n- Attraction: -\n- Lunch: -\n- Dinner: Pizza Hut, Phoenix, cost: $30 x 2 = $60, cuisines: Tea, Chinese, Desserts, Seafood\n- Accommodation: 1 BR in Carroll Gardens Townhouse, Phoenix, cost: $397 x 2 = $794, room type: Private room, house rules: No visitors & No smoking, minimum nights: 2, maximum occupancy: 1\n\n**Day 2: Phoenix (March 20, 2022)**\n\n- Transportation: -\n- Breakfast: Village Restaurant, Phoenix, cost: $35 x 2 = $70, cuisines: Tea, Cafe, Desserts, Italian\n- Attraction: Desert Botanical Garden, Phoenix; Heard Museum, Phoenix\n- Lunch: Mama Loca, Phoenix, cost: $27 x 2 = $54, cuisines: Desserts, Pizza, Italian, Bakery, Fast Food\n- Dinner: Mocambo, Phoenix, cost: $76 x 2 = $152, cuisines: Tea, Chinese, Desserts, Fast Food\n- Accommodation: 1 BR in Carroll Gardens Townhouse, Phoenix, cost: $397 x 2 = $794, room type: Private room, house rules: No visitors & No smoking, minimum nights: 2, maximum occupancy: 1\n\n**Day 3: Phoenix to Tucson (March 21, 2022)**\n\n- Transportation: Self-driving from Phoenix to Tucson, duration: 1 hour 44 mins, distance: 181 km, cost: $9 x 2 = $18\n- Breakfast: Domino's Pizza, Phoenix, cost: $96 x 2 = $192, cuisines: Cafe, Mexican, Fast Food, Chinese, Seafood\n- Attraction: Pima Air & Space Museum, Tucson; Reid Park Zoo, Tucson\n- Lunch: Villa Tevere, Tucson, cost: $37 x 2 = $74, cuisines: Mexican, Mediterranean, Desserts, Fast Food\n- Dinner: Consort Restaurant, Tucson, cost: $54 x 2 = $108, cuisines: Bakery, Pizza, Indian, Desserts\n- Accommodation: Room for rent shared bathroom, Tucson, cost: $557 x 2 = $1114, room type: Private room, house rules: No smoking, minimum nights: 1, maximum occupancy: 2\n\n**Day 4: Tucson (March 22, 2022)**\n\n- Transportation: -\n- Breakfast: Magic Spice Wok, Tucson, cost: $31 x 2 = $62, cuisines: Cafe, Bakery, BBQ, Chinese, Seafood\n- Attraction: Tucson Botanical Gardens, Tucson; Old Tucson, Tucson\n- Lunch: La Plage, Tucson, cost: $93 x 2 = $186, cuisines: Seafood, Bakery, Desserts, Italian\n- Dinner: iKitchen, Tucson, cost: $69 x 2 = $138, cuisines: Seafood, Pizza, Italian\n- Accommodation: Room for rent shared bathroom, Tucson, cost: $557 x 2 = $1114, room type: Private room, house rules: No smoking, minimum nights: 1, maximum occupancy: 2\n\n**Day 5: Tucson to Grand Junction (March 23, 2022)**\n\n- Transportation: Self-driving from Tucson to Grand Junction, duration: 10 hours 36 mins, distance: 1,113 km, cost: $55 x 2 = $110\n- Breakfast: Pizza Street, Tucson, cost: $22 x 2 = $44, cuisines: Fast Food, Bakery, Seafood\n- Attraction: -\n- Lunch: -\n- Dinner: -\n- Accommodation: -\n\n**Total Cost Calculation:**\n\n- Transportation: $92 + $18 + $110 = $220\n- Meals: $60 + $70 + $54 + $152 + $192 + $74 + $108 + $62 + $186 + $138 + $44 = $1,140\n- Accommodation: $794 + $794 + $1114 + $1114 = $3,816\n- Attractions: No entry fees provided, assumed to be free\n\n**Total Cost for Two People: $220 (Transportation) + $1,140 (Meals) + $3,816 (Accommodation) = $5,176**\n\nUnfortunately, the total cost of $5,176 exceeds the budget of $2,100. To stay within budget, we need to make adjustments:\n\n- Reduce accommodation costs by selecting cheaper options or reducing the number of nights.\n- Opt for more budget-friendly meal options.\n- Revisit the itinerary to ensure that the number of nights matches the number of days and that the accommodation costs are correctly calculated per night, not per person.\n\nPlease note that the provided accommodation options do not allow visitors, which contradicts the query. However, no other options were provided that meet the criteria. Additionally, the accommodation costs are too high, and adjustments are needed to stay within budget.", "gpt-4-1106-preview_direct_sole-planning_parsed_results": [{"day": 1, "current_city": "from Grand Junction to Phoenix", "transportation": "Self-driving from Grand Junction to Phoenix, Duration: 9 hours 11 mins, Distance: 934 km", "breakfast": "-", "attraction": "-", "lunch": "-", "dinner": "Pizza Hut, Phoenix", "accommodation": "1 BR in Carroll Gardens Townhouse, Phoenix"}, {"day": 2, "current_city": "Phoenix", "transportation": "-", "breakfast": "Village Restaurant, Phoenix", "attraction": "Desert Botanical Garden, Phoenix;Heard Museum, Phoenix;", "lunch": "Mama Loca, Phoenix", "dinner": "Mocambo, Phoenix", "accommodation": "1 BR in Carroll Gardens Townhouse, Phoenix"}, {"day": 3, "current_city": "from Phoenix to Tucson", "transportation": "Self-driving from Phoenix to Tucson, Duration: 1 hour 44 mins, Distance: 181 km", "breakfast": "Domino's Pizza, Phoenix", "attraction": "Pima Air & Space Museum, Tucson;Reid Park Zoo, Tucson;", "lunch": "Villa Tevere, Tucson", "dinner": "Consort Restaurant, Tucson", "accommodation": "Room for rent shared bathroom, Tucson"}, {"day": 4, "current_city": "Tucson", "transportation": "-", "breakfast": "Magic Spice Wok, Tucson", "attraction": "Tucson Botanical Gardens, Tucson;Old Tucson, Tucson;", "lunch": "La Plage, Tucson", "dinner": "iKitchen, Tucson", "accommodation": "Room for rent shared bathroom, Tucson"}, {"day": 5, "current_city": "from Tucson to Grand Junction", "transportation": "Self-driving from Tucson to Grand Junction, Duration: 10 hours 36 mins, Distance: 1,113 km", "breakfast": "Pizza Street, Tucson", "attraction": "-", "lunch": "-", "dinner": "-", "accommodation": "-"}]}]