[{"gpt-4o-mini_direct_sole-planning_results": "**Travel Plan:**\n\n**Days: 1**  \nCurrent City: from Billings to Dallas, Texas  \nTransportation: Self-driving, from Billings to Dallas, duration: 19 hours 29 mins, distance: 2,137 km, cost: 106  \nBreakfast: -  \nAttraction: -  \nLunch: -  \nDinner: -  \nAccommodation: 1BR, elevator, kitchen, doorman!, Dallas, Texas, cost: 475, maximum occupancy: 3, house rules: No parties, minimum nights: 1  \n\nNumber of people: 1  \nTotal cost: 106 x 1 + 475 x 1 = 581  \nAccommodation minimum nights: 1/1  \n\n---\n\n**Days: 2**  \nCurrent City: Dallas, Texas  \nTransportation: -  \nBreakfast: Drifters Cafe, Dallas, Texas, cost: 21, cuisines: Tea, French, Mexican, Cafe, Seafood  \nAttraction: The Dallas World Aquarium, Dallas; Reunion Tower, Dallas  \nLunch: Coconuts Fish Cafe, Dallas, Texas, cost: 38, cuisines: Cafe, BBQ, Mediterranean, Fast Food  \nDinner: Wich 'N' Shake, Dallas, Texas, cost: 31, cuisines: Tea, Mexican, Bakery, Fast Food, Cafe  \nAccommodation: 1BR, elevator, kitchen, doorman!, Dallas, Texas, cost: 475, maximum occupancy: 3, house rules: No parties, minimum nights: 1  \n\nNumber of people: 1  \nTotal cost: 21 x 1 + 38 x 1 + 31 x 1 + 475 x 1 = 565  \nAccommodation minimum nights: 2/1  \n\n---\n\n**Days: 3**  \nCurrent City: from Dallas to Longview, Texas  \nTransportation: Self-driving, from Dallas to Longview, duration: 1 hour 56 mins, distance: 206 km, cost: 10  \nBreakfast: Cafe Hera Pheri, Dallas, Texas, cost: 18, cuisines: Cafe, Desserts  \nAttraction: Longview World of Wonders, Longview; Gregg County Historical Museum, Longview  \nLunch: Apna Restaurant, Longview, Texas, cost: 17, cuisines: American, BBQ, Fast Food  \nDinner: Monster's Cafe, Longview, Texas, cost: 94, cuisines: Tea, Bakery, Fast Food, Cafe, American, Mediterranean  \nAccommodation: Luxury STUDIO * PVT Entrance * WOW, Longview, Texas, cost: 406, maximum occupancy: 3, house rules: No visitors, minimum nights: 1  \n\nNumber of people: 1  \nTotal cost: 10 x 1 + 18 x 1 + 17 x 1 + 94 x 1 + 406 x 1 = 545  \nAccommodation minimum nights: 1/1  \n\n---\n\n**Days: 4**  \nCurrent City: Longview, Texas  \nTransportation: -  \nBreakfast: Not Just Paranthas, Longview, Texas, cost: 54, cuisines: Desserts, Bakery, BBQ, Seafood  \nAttraction: Longview Museum of Fine Arts, Longview; KidsView Playground, Longview  \nLunch: Momo Mia, Longview, Texas, cost: 19, cuisines: Desserts, Pizza, French, BBQ, Chinese  \nDinner: Vaga Bond, Longview, Texas, cost: 75, cuisines: Tea, Seafood, BBQ, Italian  \nAccommodation: Luxury STUDIO * PVT Entrance * WOW, Longview, Texas, cost: 406, maximum occupancy: 3, house rules: No visitors, minimum nights: 1  \n\nNumber of people: 1  \nTotal cost: 54 x 1 + 19 x 1 + 75 x 1 + 406 x 1 = 554  \nAccommodation minimum nights: 2/1  \n\n---\n\n**Days: 5**  \nCurrent City: from Longview to Texarkana, Texas  \nTransportation: Self-driving, from Longview to Texarkana, duration: 1 hour 36 mins, distance: 141 km, cost: 7  \nBreakfast: Assam Food Stall, Longview, Texas, cost: 31, cuisines: Bakery, Mediterranean, Fast Food  \nAttraction: Museum of Regional History, Texarkana; Spring Lake Park, Texarkana  \nLunch: Big City Bread Cafe, Texarkana, Texas, cost: 61, cuisines: Cafe, Pizza, Bakery, BBQ  \nDinner: Columbia Restaurant, Texarkana, Texas, cost: 91, cuisines: Desserts, Tea, Pizza, Indian, Seafood  \nAccommodation: Large 2.5 BR Apt In Park Slope, Texarkana, Texas, cost: 269, maximum occupancy: 3, house rules: No smoking & No visitors, minimum nights: 1  \n\nNumber of people: 1  \nTotal cost: 7 x 1 + 31 x 1 + 61 x 1 + 91 x 1 + 269 x 1 = 459  \nAccommodation minimum nights: 1/1  \n\n---\n\n**Days: 6**  \nCurrent City: Texarkana, Texas  \nTransportation: -  \nBreakfast: Granma's Homemade, Texarkana, Texas, cost: 57, cuisines: Tea, Mexican, Bakery, Cafe, Seafood  \nAttraction: Texarkana Museums System, Texarkana; Four States Auto Museum, Texarkana  \nLunch: Polka Pastry & Snack Bar, Texarkana, Texas, cost: 71, cuisines: Fast Food, BBQ, Italian  \nDinner: Amritsari Naan, Texarkana, Texas, cost: 98, cuisines: Bakery, Indian, Desserts, Fast Food  \nAccommodation: Large 2.5 BR Apt In Park Slope, Texarkana, Texas, cost: 269, maximum occupancy: 3, house rules: No smoking & No visitors, minimum nights: 1  \n\nNumber of people: 1  \nTotal cost: 57 x 1 + 71 x 1 + 98 x 1 + 269 x 1 = 495  \nAccommodation minimum nights: 2/1  \n\n---\n\n**Days: 7**  \nCurrent City: from Texarkana to Billings  \nTransportation: Self-driving, from Texarkana to Billings, duration: 21 hours 43 mins, distance: 2,434 km, cost: 121  \nBreakfast: Cafe Coffee Day, Texarkana, Texas, cost: 28, cuisines: Tea, Cafe, BBQ, Seafood  \nAttraction: -  \nLunch: -  \nDinner: -  \nAccommodation: -  \n\nNumber of people: 1  \nTotal cost: 121 x 1 + 28 x 1 = 149  \n\n---\n\n**Total cost across all days:**  \n581 + 565 + 545 + 554 + 459 + 495 + 149 = 2,964  \n\n**Cuisines:** All cuisine constraints are satisfied.  \n**Budget:** Total cost of $2,964 is within the budget of $8,500.", "gpt-4o-mini_direct_sole-planning_parsed_results": [{"day": 1, "current_city": "from Billings to Dallas", "transportation": "Self-driving, from Billings to Dallas, duration: 19 hours 29 mins, distance: 2,137 km", "breakfast": "-", "attraction": "-", "lunch": "-", "dinner": "-", "accommodation": "1BR, elevator, kitchen, doorman!, Dallas"}, {"day": 2, "current_city": "Dallas", "transportation": "-", "breakfast": "Drifters Cafe, Dallas", "attraction": "The Dallas World Aquarium, Dallas;Reunion Tower, Dallas;", "lunch": "Coconuts Fish Cafe, Dallas", "dinner": "Wich 'N' Shake, Dallas", "accommodation": "1BR, elevator, kitchen, doorman!, Dallas"}, {"day": 3, "current_city": "from Dallas to Longview", "transportation": "Self-driving, from Dallas to Longview, duration: 1 hour 56 mins, distance: 206 km", "breakfast": "Cafe Hera Pheri, Dallas", "attraction": "Longview World of Wonders, Longview;Gregg County Historical Museum, Longview;", "lunch": "Apna Restaurant, Longview", "dinner": "Monster's Cafe, Longview", "accommodation": "Luxury STUDIO * PVT Entrance * WOW, Longview"}, {"day": 4, "current_city": "Longview", "transportation": "-", "breakfast": "Not Just Paranthas, Longview", "attraction": "Longview Museum of Fine Arts, Longview;KidsView Playground, Longview;", "lunch": "Momo Mia, Longview", "dinner": "Vaga Bond, Longview", "accommodation": "Luxury STUDIO * PVT Entrance * WOW, Longview"}, {"day": 5, "current_city": "from Longview to Texarkana", "transportation": "Self-driving, from Longview to Texarkana, duration: 1 hour 36 mins, distance: 141 km", "breakfast": "Assam Food Stall, Longview", "attraction": "Museum of Regional History, Texarkana;Spring Lake Park, Texarkana;", "lunch": "Big City Bread Cafe, Texarkana", "dinner": "Columbia Restaurant, Texarkana", "accommodation": "Large 2.5 BR Apt In Park Slope, Texarkana"}, {"day": 6, "current_city": "Texarkana", "transportation": "-", "breakfast": "Granma's Homemade, Texarkana", "attraction": "Texarkana Museums System, Texarkana;Four States Auto Museum, Texarkana;", "lunch": "Polka Pastry & Snack Bar, Texarkana", "dinner": "Amritsari Naan, Texarkana", "accommodation": "Large 2.5 BR Apt In Park Slope, Texarkana"}, {"day": 7, "current_city": "from Texarkana to Billings", "transportation": "Self-driving, from Texarkana to Billings, duration: 21 hours 43 mins, distance: 2,434 km", "breakfast": "Cafe Coffee Day, Texarkana", "attraction": "-", "lunch": "-", "dinner": "-", "accommodation": "-"}]}]