[{"gpt-4o-mini_direct_sole-planning_results": "**Travel Plan:**\n\n**Days: 1**  \nCurrent City: from Palm Springs to Houston, Texas  \nTransportation: Self-driving, from Palm Springs to Houston, duration: 20 hours 47 mins, distance: 2,323 km, cost: 116  \nBreakfast: -  \nAttraction: -  \nLunch: -  \nDinner: -  \nAccommodation: Sunny and Airy near Manhattan, Houston, Texas, cost: 499, maximum occupancy: 4, house rules: No pets, minimum nights: 2  \n\nNumber of people: 1  \nTotal cost: 116 x 1 + 499 x 1 = 615  \nAccommodation minimum nights: 1/2  \n\n---\n\n**Days: 2**  \nCurrent City: Houston, Texas  \nTransportation: -  \nBreakfast: Jalapenos, Houston, Texas, cost: 57, cuisines: Desserts, Tea, Cafe, Chinese, Seafood  \nAttraction: Houston Zoo, Houston; Houston Museum of Natural Science, Houston  \nLunch: Matchbox, Houston, Texas, cost: 33, cuisines: Tea, Italian, Bakery, Fast Food, Seafood  \nDinner: The BrewMaster - The Mix Fine Dine, Houston, Texas, cost: 52, cuisines: French, Indian, Cafe, Seafood  \nAccommodation: Sunny and Airy near Manhattan, Houston, Texas, cost: 499, maximum occupancy: 4, house rules: No pets, minimum nights: 2  \n\nNumber of people: 1  \nTotal cost: 57 x 1 + 33 x 1 + 52 x 1 + 499 x 1 = 641  \nAccommodation minimum nights: 2/2  \n\n---\n\n**Days: 3**  \nCurrent City: from Houston to Austin, Texas  \nTransportation: Self-driving, from Houston to Austin, duration: 2 hours 31 mins, distance: 266 km, cost: 13  \nBreakfast: -  \nAttraction: Texas Capitol, Austin; Zilker Metropolitan Park, Austin  \nLunch: Chili's, Austin, Texas, cost: 48, cuisines: Cafe, American, Seafood  \nDinner: The Blue Door Cafe, Austin, Texas, cost: 95, cuisines: Cafe, Pizza, Mediterranean, Desserts  \nAccommodation: Cozy room in south Harlem - 10 mins to Columbia, Austin, Texas, cost: 564, maximum occupancy: 2, house rules: No visitors & No children under 10, minimum nights: 1  \n\nNumber of people: 1  \nTotal cost: 13 x 1 + 48 x 1 + 95 x 1 + 564 x 1 = 720  \nAccommodation minimum nights: 1/1  \n\n---\n\n**Days: 4**  \nCurrent City: Austin, Texas  \nTransportation: -  \nBreakfast: Wildflour Cafe + Bakery, Austin, Texas, cost: 55, cuisines: Desserts, French, Bakery, BBQ, Seafood  \nAttraction: Bullock Texas State History Museum, Austin; Austin Aquarium, Austin  \nLunch: Tandoori Nights, Austin, Texas, cost: 26, cuisines: Pizza, Italian, BBQ, Indian, Seafood  \nDinner: Chef Joint, Austin, Texas, cost: 89, cuisines: Cafe, Pizza, Italian  \nAccommodation: Cozy room in south Harlem - 10 mins to Columbia, Austin, Texas, cost: 564, maximum occupancy: 2, house rules: No visitors & No children under 10, minimum nights: 1  \n\nNumber of people: 1  \nTotal cost: 55 x 1 + 26 x 1 + 89 x 1 + 564 x 1 = 734  \nAccommodation minimum nights: 1/1  \n\n---\n\n**Days: 5**  \nCurrent City: from Austin to Dallas, Texas  \nTransportation: Self-driving, from Austin to Dallas, duration: 2 hours 53 mins, distance: 314 km, cost: 15  \nBreakfast: -  \nAttraction: The Dallas World Aquarium, Dallas; Dallas Museum of Art, Dallas  \nLunch: Coconuts Fish Cafe, Dallas, Texas, cost: 38, cuisines: Cafe, BBQ, Mediterranean, Fast Food  \nDinner: 1918 Bistro & Grill, Dallas, Texas, cost: 90, cuisines: Tea, Pizza, BBQ, Seafood  \nAccommodation: 1BR, elevator, kitchen, doorman!, Dallas, Texas, cost: 475, maximum occupancy: 3, house rules: No parties, minimum nights: 1  \n\nNumber of people: 1  \nTotal cost: 15 x 1 + 38 x 1 + 90 x 1 + 475 x 1 = 618  \nAccommodation minimum nights: 1/1  \n\n---\n\n**Days: 6**  \nCurrent City: Dallas, Texas  \nTransportation: -  \nBreakfast: Drifters Cafe, Dallas, Texas, cost: 21, cuisines: Tea, French, Mexican, Cafe, Seafood  \nAttraction: Reunion Tower, Dallas; The Sixth Floor Museum at Dealey Plaza, Dallas  \nLunch: Yanki Sizzlers, Dallas, Texas, cost: 96, cuisines: Cafe, French, Tea, Mediterranean  \nDinner: L'Opera, Dallas, Texas, cost: 77, cuisines: French, Bakery, BBQ, Fast Food, Seafood  \nAccommodation: 1BR, elevator, kitchen, doorman!, Dallas, Texas, cost: 475, maximum occupancy: 3, house rules: No parties, minimum nights: 1  \n\nNumber of people: 1  \nTotal cost: 21 x 1 + 96 x 1 + 77 x 1 + 475 x 1 = 669  \nAccommodation minimum nights: 1/1  \n\n---\n\n**Days: 7**  \nCurrent City: from Dallas to Palm Springs  \nTransportation: Self-driving, from Dallas to Palm Springs, duration: 19 hours 15 mins, distance: 2,144 km, cost: 107  \nBreakfast: -  \nAttraction: -  \nLunch: -  \nDinner: -  \nAccommodation: -  \n\nNumber of people: 1  \nTotal cost: 107 x 1 = 107  \n\n---\n\n**Total cost across all days:**  \n615 + 641 + 720 + 734 + 618 + 669 + 107 = 3,614  \n\n**Budget:** $8,100  \n**Remaining Budget:** $8,100 - $3,614 = $4,486  \n\n**Cuisines:** All cuisine constraints are satisfied.  \n**Attractions:** No attractions are repeated across days.  \n**Transportation:** All transportation methods are consistent and valid.  \n**Accommodations:** All accommodations meet house rules and minimum night requirements.  \n**Total Cost:** Within budget.  \n\nThis travel plan meets all specified constraints and requirements.", "gpt-4o-mini_direct_sole-planning_parsed_results": [{"day": 1, "current_city": "from Palm Springs to Houston", "transportation": "Self-driving, from Palm Springs to Houston, duration: 20 hours 47 mins, distance: 2,323 km", "breakfast": "-", "attraction": "-", "lunch": "-", "dinner": "-", "accommodation": "Sunny and Airy near Manhattan, Houston"}, {"day": 2, "current_city": "Houston", "transportation": "-", "breakfast": "Jalapenos, Houston", "attraction": "Houston Zoo, Houston;Houston Museum of Natural Science, Houston;", "lunch": "Matchbox, Houston", "dinner": "The BrewMaster - The Mix Fine Dine, Houston", "accommodation": "Sunny and Airy near Manhattan, Houston"}, {"day": 3, "current_city": "from Houston to Austin", "transportation": "Self-driving, from Houston to Austin, duration: 2 hours 31 mins, distance: 266 km", "breakfast": "-", "attraction": "Texas Capitol, Austin;Zilker Metropolitan Park, Austin;", "lunch": "Chili's, Austin", "dinner": "The Blue Door Cafe, Austin", "accommodation": "Cozy room in south Harlem - 10 mins to Columbia, Austin"}, {"day": 4, "current_city": "Austin", "transportation": "-", "breakfast": "Wildflour Cafe + Bakery, Austin", "attraction": "Bullock Texas State History Museum, Austin;Austin Aquarium, Austin;", "lunch": "Tandoori Nights, Austin", "dinner": "Chef Joint, Austin", "accommodation": "Cozy room in south Harlem - 10 mins to Columbia, Austin"}, {"day": 5, "current_city": "from Austin to Dallas", "transportation": "Self-driving, from Austin to Dallas, duration: 2 hours 53 mins, distance: 314 km", "breakfast": "-", "attraction": "The Dallas World Aquarium, Dallas;Dallas Museum of Art, Dallas;", "lunch": "Coconuts Fish Cafe, Dallas", "dinner": "1918 Bistro & Grill, Dallas", "accommodation": "1BR, elevator, kitchen, doorman!, Dallas"}, {"day": 6, "current_city": "Dallas", "transportation": "-", "breakfast": "Drifters Cafe, Dallas", "attraction": "Reunion Tower, Dallas;The Sixth Floor Museum at Dealey Plaza, Dallas;", "lunch": "Yanki Sizzlers, Dallas", "dinner": "L'Opera, Dallas", "accommodation": "1BR, elevator, kitchen, doorman!, Dallas"}, {"day": 7, "current_city": "from Dallas to Palm Springs", "transportation": "Self-driving, from Dallas to Palm Springs, duration: 19 hours 15 mins, distance: 2,144 km", "breakfast": "-", "attraction": "-", "lunch": "-", "dinner": "-", "accommodation": "-"}]}]