[{"gpt-4o-mini_direct_sole-planning_results": "**Travel Plan:**\n\n**Days: 1**  \nCurrent City: from Birmingham to Miami, Florida  \nTransportation: Flight, F3592186, from Birmingham to Miami, duration: 1 hour 45 minutes, cost: 301  \nBreakfast: -  \nAttraction: -  \nLunch: -  \nDinner: -  \nAccommodation: Simple and clean bedroom with good view and light, Miami, Florida, cost: 669, maximum occupancy: 2, house rules: No children under 10, minimum nights: 1  \n\nNumber of people: 1  \nTotal cost: 301 x 1 + 669 x 1 = 970  \nAccommodation minimum nights: 1/1  \n\n---\n\n**Days: 2**  \nCurrent City: Miami, Florida  \nTransportation: -  \nBreakfast: Clocked, Miami, Florida, cost: 49, cuisines: Tea, Italian, Mexican, BBQ, Cafe  \nAttraction: Jungle Island, Miami; P\u00e9rez Art Museum Miami, Miami  \nLunch: Papouli's Mediterranean Cafe & Market, Miami, Florida, cost: 26, cuisines: Tea, Desserts  \nDinner: AB's Absolute Barbecues, Miami, Florida, cost: 55, cuisines: Desserts, Tea, Pizza, Italian, Fast Food, American  \nAccommodation: Simple and clean bedroom with good view and light, Miami, Florida, cost: 669, maximum occupancy: 2, house rules: No children under 10, minimum nights: 1  \n\nNumber of people: 1  \nTotal cost: 49 x 1 + 26 x 1 + 55 x 1 + 669 x 1 = 799  \nAccommodation minimum nights: 2/1  \n\n---\n\n**Days: 3**  \nCurrent City: from Miami to Orlando, Florida  \nTransportation: Flight, F3677475, from Miami to Orlando, duration: 1 hour 4 minutes, cost: 39  \nBreakfast: -  \nAttraction: Universal Orlando Resort, Orlando; The Wheel at ICON Park, Orlando  \nLunch: Turquoise Villa, Orlando, Florida, cost: 55, cuisines: French, Bakery, BBQ, Fast Food  \nDinner: The Tandoori Times, Orlando, Florida, cost: 84, cuisines: Tea, Cafe, BBQ, Italian  \nAccommodation: Private furnished bedroom in Williamsburg, Orlando, Florida, cost: 179, maximum occupancy: 2, house rules: No parties & No smoking & No children under 10  \n\nNumber of people: 1  \nTotal cost: 39 x 1 + 55 x 1 + 84 x 1 + 179 x 1 = 357  \nAccommodation minimum nights: 1/1  \n\n---\n\n**Days: 4**  \nCurrent City: Orlando, Florida  \nTransportation: -  \nBreakfast: Fuji Japanese Steakhouse, Orlando, Florida, cost: 75, cuisines: Tea, Bakery, Desserts  \nAttraction: SeaWorld Orlando, Orlando; Ripley's Believe It or Not!, Orlando  \nLunch: Crust N Cakes, Orlando, Florida, cost: 61, cuisines: Tea, Cafe, Indian, BBQ  \nDinner: Pure Bliss, Orlando, Florida, cost: 84, cuisines: BBQ, Bakery, Pizza, Desserts  \nAccommodation: Private furnished bedroom in Williamsburg, Orlando, Florida, cost: 179, maximum occupancy: 2, house rules: No parties & No smoking & No children under 10  \n\nNumber of people: 1  \nTotal cost: 75 x 1 + 61 x 1 + 84 x 1 + 179 x 1 = 399  \nAccommodation minimum nights: 2/1  \n\n---\n\n**Days: 5**  \nCurrent City: from Orlando to Birmingham  \nTransportation: Flight, F3987879, from Orlando to Birmingham, duration: 1 hour 48 minutes, cost: 116  \nBreakfast: -  \nAttraction: -  \nLunch: -  \nDinner: -  \nAccommodation: -  \n\nNumber of people: 1  \nTotal cost: 116 x 1 = 116  \n\n---\n\n**Total cost across all days:**  \n970 x 1 + 799 x 1 + 357 x 1 + 399 x 1 + 116 x 1 = 2,641  \n\n**Budget:** $3,500  \n**Remaining Budget:** $3,500 - $2,641 = $859  \n\n**Cuisines:** All cuisine constraints are satisfied.  \n**Attractions:** No attractions are repeated across days.  \n**Transportation:** All transportation methods are valid and consistent.  \n**Accommodation:** All accommodations meet house rules and are valid for the specified number of nights.  \n**Total Days:** 5 days, visiting 2 cities (Miami and Orlando).  \n\nThis travel plan adheres to all specified constraints and requirements.", "gpt-4o-mini_direct_sole-planning_parsed_results": [{"day": 1, "current_city": "from Birmingham to Miami, Florida", "transportation": "Flight Number: F3592186, from Birmingham to Miami, Departure Time: -, Arrival Time: -", "breakfast": "-", "attraction": "-", "lunch": "-", "dinner": "-", "accommodation": "Simple and clean bedroom with good view and light, Miami, Florida"}, {"day": 2, "current_city": "Miami, Florida", "transportation": "-", "breakfast": "Clocked, Miami, Florida", "attraction": "Jungle Island, Miami;P\u00e9rez Art Museum Miami, Miami;", "lunch": "Papouli's Mediterranean Cafe & Market, Miami, Florida", "dinner": "AB's Absolute Barbecues, Miami, Florida", "accommodation": "Simple and clean bedroom with good view and light, Miami, Florida"}, {"day": 3, "current_city": "from Miami to Orlando, Florida", "transportation": "Flight Number: F3677475, from Miami to Orlando, Departure Time: -, Arrival Time: -", "breakfast": "-", "attraction": "Universal Orlando Resort, Orlando;The Wheel at ICON Park, Orlando;", "lunch": "Turquoise Villa, Orlando, Florida", "dinner": "The Tandoori Times, Orlando, Florida", "accommodation": "Private furnished bedroom in Williamsburg, Orlando, Florida"}, {"day": 4, "current_city": "Orlando, Florida", "transportation": "-", "breakfast": "Fuji Japanese Steakhouse, Orlando, Florida", "attraction": "SeaWorld Orlando, Orlando;Ripley's Believe It or Not!, Orlando;", "lunch": "Crust N Cakes, Orlando, Florida", "dinner": "Pure Bliss, Orlando, Florida", "accommodation": "Private furnished bedroom in Williamsburg, Orlando, Florida"}, {"day": 5, "current_city": "from Orlando to Birmingham", "transportation": "Flight Number: F3987879, from Orlando to Birmingham, Departure Time: -, Arrival Time: -", "breakfast": "-", "attraction": "-", "lunch": "-", "dinner": "-", "accommodation": "-"}]}]