[{"gpt-4-1106-preview_direct_sole-planning_results": "Travel Plan:\n\nDays: 1\nCurrent City: from Syracuse to Augusta (Georgia)\nTransportation: Self-driving, from Syracuse to Augusta, duration: 13 hours 17 mins, distance: 1,431 km, cost: 71\nBreakfast: -\nAttraction: -\nLunch: -\nDinner: -\nAccommodation: Perfect Chanukah apartment for the whole crew!, Augusta (Georgia), cost: 451, room type: Entire home/apt, house rules: No pets, minimum nights: 11, maximum occupancy: 3\n\nNumber of people: 2\nTotal cost: 2 x 71 + 1 x 451 = 593\nAccommodation minimum nights: 1/11\n\nDays: 2\nCurrent City: Augusta (Georgia)\nTransportation: -\nBreakfast: Fish Tales Lakeside Grille, Augusta (Georgia), cost: 37, cuisines: Tea, Cafe, Bakery, Desserts\nAttraction: Phinizy Swamp Nature Park, Augusta (Georgia); Augusta Museum of History, Augusta (Georgia); Augusta Riverwalk, Augusta (Georgia)\nLunch: The Charcoal Chimney, Augusta (Georgia), cost: 86, cuisines: Tea, Fast Food, BBQ, Italian\nDinner: B Merrell's, Augusta (Georgia), cost: 74, cuisines: Tea, Pizza, Desserts, Fast Food\nAccommodation: Perfect Chanukah apartment for the whole crew!, Augusta (Georgia), cost: 451, room type: Entire home/apt, house rules: No pets, minimum nights: 11, maximum occupancy: 3\n\nNumber of people: 2\nTotal cost: 2 x 37 + 2 x 86 + 2 x 74 + 1 x 451 = 846\nAccommodation minimum nights: 2/11\n\nDays: 3\nCurrent City: from Augusta (Georgia) to Decatur (Georgia)\nTransportation: Self-driving, from Augusta to Decatur, duration: 2 hours 19 mins, distance: 229 km, cost: 11\nBreakfast: KB's Kulfi & Icecream, Augusta (Georgia), cost: 92, cuisines: American, BBQ, Seafood\nAttraction: Augusta Canal National Heritage Area, Augusta (Georgia)\nLunch: -\nDinner: -\nAccommodation: The Heart of the Lower East Side!, Decatur (Georgia), cost: 587, room type: Entire home/apt, house rules: No children under 10, minimum nights: 2, maximum occupancy: 2\n\nNumber of people: 2\nTotal cost: 2 x 11 + 2 x 92 + 1 x 587 = 793\nAccommodation minimum nights: 1/2\n\nDays: 4\nCurrent City: Decatur (Georgia)\nTransportation: -\nBreakfast: Cafe Coffee Day, Decatur (Georgia), cost: 46, cuisines: Tea, Cafe, BBQ, Mediterranean\nAttraction: DeKalb History Center Museum, Decatur (Georgia); Glenlake Park, Decatur (Georgia); Clyde Shepherd Nature Preserve, Decatur (Georgia)\nLunch: Joey's Pizza, Decatur (Georgia), cost: 69, cuisines: Tea, Pizza, Bakery, Chinese, Seafood\nDinner: Carnatic Cafe, Decatur (Georgia), cost: 66, cuisines: Cafe, Indian, Desserts\nAccommodation: The Heart of the Lower East Side!, Decatur (Georgia), cost: 587, room type: Entire home/apt, house rules: No children under 10, minimum nights: 2, maximum occupancy: 2\n\nNumber of people: 2\nTotal cost: 2 x 46 + 2 x 69 + 2 x 66 + 1 x 587 = 979\nAccommodation minimum nights: 2/2\n\nDays: 5\nCurrent City: from Decatur (Georgia) to Syracuse\nTransportation: Self-driving, from Decatur to Syracuse, duration: 14 hours 26 mins, distance: 1,542 km, cost: 77\nBreakfast: Starbucks, Decatur (Georgia), cost: 70, cuisines: Tea, Chinese, Pizza\nAttraction: Mason Mill Park, Decatur (Georgia); Woodlands Garden, Decatur (Georgia)\nLunch: -\nDinner: -\nAccommodation: -\n\nNumber of people: 2\nTotal cost: 2 x 77 + 2 x 70 = 294\n\nTotal cost across all days: 593 + 846 + 793 + 979 + 294 = 3,505\n\nCuisines: American and Mediterranean cuisines were included in the meals as specified in the query.\nRoom Constraint: All accommodations selected are entire homes, ensuring privacy.\nTransportation Constraint: All travel between cities is managed via self-driving, as no flights are available on the specified dates.\nBudget: The total cost exceeds the specified budget of $2,000. Adjustments are needed to meet the budget constraint.\n\n**Note**: The provided budget is not sufficient to cover the costs of the travel plan as outlined with the given accommodations and meals. To stay within budget, consider adjusting the accommodations to more affordable options, reducing meal costs, or revisiting the transportation method.", "gpt-4-1106-preview_direct_sole-planning_parsed_results": [{"day": 1, "current_city": "from Syracuse to Augusta", "transportation": "Self-driving, from Syracuse to Augusta, duration: 13 hours 17 mins, distance: 1,431 km", "breakfast": "-", "attraction": "-", "lunch": "-", "dinner": "-", "accommodation": "Perfect Chanukah apartment for the whole crew!, Augusta"}, {"day": 2, "current_city": "Augusta", "transportation": "-", "breakfast": "Fish Tales Lakeside Grille, Augusta", "attraction": "Phinizy Swamp Nature Park, Augusta;Augusta Museum of History, Augusta;Augusta Riverwalk, Augusta", "lunch": "The Charcoal Chimney, Augusta", "dinner": "B Merrell's, Augusta", "accommodation": "Perfect Chanukah apartment for the whole crew!, Augusta"}, {"day": 3, "current_city": "from Augusta to Decatur", "transportation": "Self-driving, from Augusta to Decatur, duration: 2 hours 19 mins, distance: 229 km", "breakfast": "KB's Kulfi & Icecream, Augusta", "attraction": "Augusta Canal National Heritage Area, Augusta", "lunch": "-", "dinner": "-", "accommodation": "The Heart of the Lower East Side!, Decatur"}, {"day": 4, "current_city": "Decatur", "transportation": "-", "breakfast": "Cafe Coffee Day, Decatur", "attraction": "DeKalb History Center Museum, Decatur;Glenlake Park, Decatur;Clyde Shepherd Nature Preserve, Decatur", "lunch": "Joey's Pizza, Decatur", "dinner": "Carnatic Cafe, Decatur", "accommodation": "The Heart of the Lower East Side!, Decatur"}, {"day": 5, "current_city": "from Decatur to Syracuse", "transportation": "Self-driving, from Decatur to Syracuse, duration: 14 hours 26 mins, distance: 1,542 km", "breakfast": "Starbucks, Decatur", "attraction": "Mason Mill Park, Decatur;Woodlands Garden, Decatur", "lunch": "-", "dinner": "-", "accommodation": "-"}]}]