[{"gpt-4-1106-preview_direct_sole-planning_results": "Travel Plan:\n\nDays: 1\nCurrent City: from Manchester to Charlotte\nTransportation: Flight Number: F3785421, from Manchester to Charlotte, Departure Time: 14:16, Arrival Time: 16:46, cost: 223\nBreakfast: -\nAttraction: -\nLunch: -\nDinner: Olive Tree Cafe, Charlotte, cost: 23, cuisines: Tea, Chinese, Desserts\nAccommodation: Elegant Studio Apt in Prospect Heights, Charlotte, cost: 640, room type: Entire home/apt, house rules: No parties, minimum nights: 2, maximum occupancy: 5\n\nNumber of people: 5\nTotal cost: 5 x 223 + 5 x 23 + 1 x 640 = 1,755\nAccommodation minimum nights: 1/2\n\nDays: 2\nCurrent City: Charlotte\nTransportation: -\nBreakfast: Central Perk 7, Charlotte, cost: 87, cuisines: Pizza, Bakery, BBQ, Fast Food\nAttraction: Freedom Park, Levine Museum of the New South, Discovery Place Science, Charlotte\nLunch: Subway, Charlotte, cost: 60, cuisines: Tea, Cafe, Mexican, Chinese, Seafood\nDinner: Cafe Maple Street, Charlotte, cost: 91, cuisines: Fast Food, Tea, Italian\nAccommodation: Elegant Studio Apt in Prospect Heights, Charlotte, cost: 640, room type: Entire home/apt, house rules: No parties, minimum nights: 2, maximum occupancy: 5\n\nNumber of people: 5\nTotal cost: 5 x 87 + 5 x 60 + 5 x 91 + 1 x 640 = 2,240\nAccommodation minimum nights: 2/2\n\nDays: 3\nCurrent City: from Charlotte to Manchester\nTransportation: Flight Number: F3785397, from Charlotte to Manchester, Departure Time: 11:21, Arrival Time: 13:22, cost: 284\nBreakfast: Kylin Skybar, Charlotte, cost: 44, cuisines: Tea, Cafe, Pizza, Italian\nAttraction: NASCAR Hall of Fame, The Mint Museum, Charlotte\nLunch: Unplugged Courtyard, Charlotte, cost: 54, cuisines: Desserts, French, Bakery, Cafe, Seafood\nDinner: -\nAccommodation: -\n\nNumber of people: 5\nTotal cost: 5 x 284 + 5 x 44 + 5 x 54 = 1,910\n\nTotal cost across all days: 1,755 + 2,240 + 1,910 = 5,905\n\nUnfortunately, the total cost exceeds the specified budget of $4,800. To adjust the plan to fit within the budget, we can make the following changes:\n\n- Choose a less expensive accommodation option for Days 1 and 2.\n- Opt for more budget-friendly meal options.\n\nRevised Travel Plan:\n\nDays: 1\nCurrent City: from Manchester to Charlotte\nTransportation: Flight Number: F3785421, from Manchester to Charlotte, Departure Time: 14:16, Arrival Time: 16:46, cost: 223\nBreakfast: -\nAttraction: -\nLunch: -\nDinner: Olive Tree Cafe, Charlotte, cost: 23, cuisines: Tea, Chinese, Desserts\nAccommodation: Luxury 2 bdr/2 bath prime Williamburg, Charlotte, cost: 218, room type: Entire home/apt, house rules: No children under 10 & No smoking & No pets, minimum nights: 1, maximum occupancy: 3\n\nNumber of people: 5\nTotal cost: 5 x 223 + 5 x 23 + 1 x 218 = 1,533\nAccommodation minimum nights: 1/1\n\nDays: 2\nCurrent City: Charlotte\nTransportation: -\nBreakfast: Prince Snacks & Momo's Point, Charlotte, cost: 11, cuisines: Tea, Cafe, Desserts, Fast Food\nAttraction: Freedom Park, Levine Museum of the New South, Discovery Place Science, Charlotte\nLunch: China Garden, Charlotte, cost: 14, cuisines: Tea, Mexican, BBQ, Mediterranean\nDinner: Behrouz Biryani, Charlotte, cost: 19, cuisines: Mexican, Bakery, Fast Food, Cafe, American, Seafood\nAccommodation: Luxury 2 bdr/2 bath prime Williamburg, Charlotte, cost: 218, room type: Entire home/apt, house rules: No children under 10 & No smoking & No pets, minimum nights: 1, maximum occupancy: 3\n\nNumber of people: 5\nTotal cost: 5 x 11 + 5 x 14 + 5 x 19 + 1 x 218 = 548\nAccommodation minimum nights: 2/1\n\nDays: 3\nCurrent City: from Charlotte to Manchester\nTransportation: Flight Number: F3785397, from Charlotte to Manchester, Departure Time: 11:21, Arrival Time: 13:22, cost: 284\nBreakfast: Hong Kong Express, Charlotte, cost: 74, cuisines: Chinese, Cafe, Desserts\nAttraction: NASCAR Hall of Fame, The Mint Museum, Charlotte\nLunch: Life Grand Cafe, Charlotte, cost: 25, cuisines: Tea, Bakery, Fast Food, Chinese, Indian\nDinner: -\nAccommodation: -\n\nNumber of people: 5\nTotal cost: 5 x 284 + 5 x 74 + 5 x 25 = 1,915\n\nTotal cost across all days: 1,533 + 548 + 1,915 = 3,996\n\nThe revised travel plan fits within the budget of $4,800, and all accommodations are entire rooms as requested.", "gpt-4-1106-preview_direct_sole-planning_parsed_results": [{"day": 1, "current_city": "from Manchester to Charlotte", "transportation": "Flight Number: F3785421, from Manchester to Charlotte, Departure Time: 14:16, Arrival Time: 16:46", "breakfast": "-", "attraction": "-", "lunch": "-", "dinner": "Olive Tree Cafe, Charlotte", "accommodation": "Luxury 2 bdr/2 bath prime Williamburg, Charlotte"}, {"day": 2, "current_city": "Charlotte", "transportation": "-", "breakfast": "Prince Snacks & Momo's Point, Charlotte", "attraction": "Freedom Park, Charlotte;Levine Museum of the New South, Charlotte;Discovery Place Science, Charlotte;", "lunch": "China Garden, Charlotte", "dinner": "Behrouz Biryani, Charlotte", "accommodation": "Luxury 2 bdr/2 bath prime Williamburg, Charlotte"}, {"day": 3, "current_city": "from Charlotte to Manchester", "transportation": "Flight Number: F3785397, from Charlotte to Manchester, Departure Time: 11:21, Arrival Time: 13:22", "breakfast": "Hong Kong Express, Charlotte", "attraction": "NASCAR Hall of Fame, Charlotte;The Mint Museum, Charlotte;", "lunch": "Life Grand Cafe, Charlotte", "dinner": "-", "accommodation": "-"}]}]