[{"gpt-4-1106-preview_direct_sole-planning_results": "Travel Plan:\n\nDays: 1\nCurrent City: from Fort Lauderdale to Houston (Texas)\nTransportation: Flight Number: F3620044, from Fort Lauderdale to Houston (Texas), Departure Time: 22:23, Arrival Time: 00:10, cost: 303\nBreakfast: -\nAttraction: -\nLunch: -\nDinner: -\nAccommodation: Superhost 3 bedroom DISCOUNT, Houston (Texas), cost: 746, maximum occupancy: 5, house rules: No pets, minimum nights: 1\n\nNumber of people: 2\nTotal cost: 2 x 303 + 1 x 746 = 1,352\nAccommodation minimum nights: 1/1\n\nDays: 2\nCurrent City: Houston (Texas)\nTransportation: -\nBreakfast: Chawla's\u5b8a, Houston (Texas), cost: 26, cuisines: Chinese, Desserts, Bakery, Cafe, Mediterranean\nAttraction: Space Center Houston, Houston (Texas); Houston Zoo, Houston (Texas)\nLunch: Istanbul Restaurant, Houston (Texas), cost: 19, cuisines: Tea, Indian, Seafood\nDinner: The BrewMaster - The Mix Fine Dine, Houston (Texas), cost: 52, cuisines: French, Indian, Cafe, Seafood\nAccommodation: Superhost 3 bedroom DISCOUNT, Houston (Texas), cost: 746, maximum occupancy: 5, house rules: No pets, minimum nights: 1\n\nNumber of people: 2\nTotal cost: 2 x 26 + 2 x 19 + 2 x 52 + 1 x 746 = 940\nAccommodation minimum nights: 2/1\n\nDays: 3\nCurrent City: from Houston (Texas) to Dallas (Texas)\nTransportation: Flight Number: F3667568, from Houston (Texas) to Dallas (Texas), Departure Time: 09:22, Arrival Time: 10:23, cost: 110\nBreakfast: -\nAttraction: The Dallas World Aquarium, Dallas (Texas); Reunion Tower, Dallas (Texas)\nLunch: Drifters Cafe, Dallas (Texas), cost: 21, cuisines: Tea, French, Mexican, Cafe, Seafood\nDinner: Cafe Hera Pheri, Dallas (Texas), cost: 18, cuisines: Cafe, Desserts\nAccommodation: Take it now you won't find better, Dallas (Texas), cost: 609, maximum occupancy: 4, house rules: No pets, minimum nights: 1\n\nNumber of people: 2\nTotal cost: 2 x 110 + 2 x 21 + 2 x 18 + 1 x 609 = 907\nAccommodation minimum nights: 1/1\n\nDays: 4\nCurrent City: Dallas (Texas)\nTransportation: -\nBreakfast: MONKS, Dallas (Texas), cost: 24, cuisines: Tea, Pizza, Cafe, Mediterranean, Seafood\nAttraction: Dallas Museum of Art, Dallas (Texas); Klyde Warren Park, Dallas (Texas)\nLunch: Yanki Sizzlers, Dallas (Texas), cost: 96, cuisines: Cafe, French, Tea, Mediterranean\nDinner: Salsa Mexican Grill, Dallas (Texas), cost: 63, cuisines: Desserts, BBQ, Bakery, Cafe, American\nAccommodation: Take it now you won't find better, Dallas (Texas), cost: 609, maximum occupancy: 4, house rules: No pets, minimum nights: 1\n\nNumber of people: 2\nTotal cost: 2 x 24 + 2 x 96 + 2 x 63 + 1 x 609 = 975\nAccommodation minimum nights: 2/1\n\nDays: 5\nCurrent City: from Dallas (Texas) to Fort Lauderdale\nTransportation: Flight Number: F3618190, from Dallas (Texas) to Fort Lauderdale, Departure Time: 05:34, Arrival Time: 09:07, cost: 481\nBreakfast: -\nAttraction: -\nLunch: -\nDinner: -\nAccommodation: -\n\nNumber of people: 2\nTotal cost: 2 x 481 = 962\n\nTotal cost across all days: 1,352 + 940 + 907 + 975 + 962 = 5,136\n\nUnfortunately, the total cost exceeds the specified budget of $4,200. To adjust the plan within the budget, we can consider the following changes:\n\n- Opt for more budget-friendly accommodations.\n- Choose restaurants with lower average costs.\n- Reduce the number of attractions visited.\n\nPlease let me know if you would like me to rework the plan with these adjustments to fit within the budget.", "gpt-4-1106-preview_direct_sole-planning_parsed_results": [{"day": 1, "current_city": "from Fort Lauderdale to Houston (Texas)", "transportation": "Flight Number: F3620044, from Fort Lauderdale to Houston (Texas), Departure Time: 22:23, Arrival Time: 00:10", "breakfast": "-", "attraction": "-", "lunch": "-", "dinner": "-", "accommodation": "Superhost 3 bedroom DISCOUNT, Houston (Texas)"}, {"day": 2, "current_city": "Houston (Texas)", "transportation": "-", "breakfast": "Chawla's\u5b8a, Houston (Texas)", "attraction": "Space Center Houston, Houston (Texas);Houston Zoo, Houston (Texas);", "lunch": "Istanbul Restaurant, Houston (Texas)", "dinner": "The BrewMaster - The Mix Fine Dine, Houston (Texas)", "accommodation": "Superhost 3 bedroom DISCOUNT, Houston (Texas)"}, {"day": 3, "current_city": "from Houston (Texas) to Dallas (Texas)", "transportation": "Flight Number: F3667568, from Houston (Texas) to Dallas (Texas), Departure Time: 09:22, Arrival Time: 10:23", "breakfast": "-", "attraction": "The Dallas World Aquarium, Dallas (Texas);Reunion Tower, Dallas (Texas);", "lunch": "Drifters Cafe, Dallas (Texas)", "dinner": "Cafe Hera Pheri, Dallas (Texas)", "accommodation": "Take it now you won't find better, Dallas (Texas)"}, {"day": 4, "current_city": "Dallas (Texas)", "transportation": "-", "breakfast": "MONKS, Dallas (Texas)", "attraction": "Dallas Museum of Art, Dallas (Texas);Klyde Warren Park, Dallas (Texas);", "lunch": "Yanki Sizzlers, Dallas (Texas)", "dinner": "Salsa Mexican Grill, Dallas (Texas)", "accommodation": "Take it now you won't find better, Dallas (Texas)"}, {"day": 5, "current_city": "from Dallas (Texas) to Fort Lauderdale", "transportation": "Flight Number: F3618190, from Dallas (Texas) to Fort Lauderdale, Departure Time: 05:34, Arrival Time: 09:07", "breakfast": "-", "attraction": "-", "lunch": "-", "dinner": "-", "accommodation": "-"}]}]