[{"gpt-4-1106-preview_direct_sole-planning_results": "Travel Plan:\n\nDays: 1\nCurrent City: from Omaha to Seattle (Washington)\nTransportation: Flight Number: F3736891, from Omaha to Seattle (Washington), Departure Time: 14:43, Arrival Time: 16:28, cost: 451\nBreakfast: -\nAttraction: -\nLunch: -\nDinner: Ting's Red Lantern, Seattle (Washington), cost: 24, cuisines: Italian, Bakery, BBQ, Fast Food, Chinese, Seafood\nAccommodation: Large quiet private studio in East Harlem, Seattle (Washington), cost: 181, room type: Entire home/apt, house rules: No children under 10, minimum nights: 7, maximum occupancy: 2\n\nNumber of people: 1\nTotal cost: 451 (flight) + 24 (dinner) + 181 (accommodation) = 656\nAccommodation minimum nights: 1/7\n\nDays: 2\nCurrent City: Seattle (Washington)\nTransportation: -\nBreakfast: Mother Ringlet, Seattle (Washington), cost: 63, cuisines: Tea, Cafe, Mediterranean, Seafood\nAttraction: Space Needle, Seattle (Washington); Pike Place Market, Seattle (Washington); The Museum of Flight, Seattle (Washington)\nLunch: Caf\u6106 Burger BC, Seattle (Washington), cost: 43, cuisines: Tea, French, Bakery, BBQ, Seafood\nDinner: The Godinho's, Seattle (Washington), cost: 96, cuisines: Tea, Pizza, American, BBQ, Cafe, Indian\nAccommodation: Large quiet private studio in East Harlem, Seattle (Washington), cost: 181, room type: Entire home/apt, house rules: No children under 10, minimum nights: 7, maximum occupancy: 2\n\nNumber of people: 1\nTotal cost: 63 (breakfast) + 43 (lunch) + 96 (dinner) + 181 (accommodation) = 383\nAccommodation minimum nights: 2/7\n\nDays: 3\nCurrent City: from Seattle to Spokane (Washington)\nTransportation: Flight Number: F3738208, from Seattle to Spokane (Washington), Departure Time: 11:28, Arrival Time: 12:38, cost: 50\nBreakfast: -\nAttraction: Riverfront Park, Spokane (Washington); Manito Park, Spokane (Washington)\nLunch: Friends Grille and Bar, Spokane (Washington), cost: 69, cuisines: Cafe, Desserts, Seafood\nDinner: Moon River Brewing Company, Spokane (Washington), cost: 79, cuisines: Desserts, Cafe, French, Fast Food, Chinese\nAccommodation: Renovated 2 Bedroom Apartment, Spokane (Washington), cost: 372, room type: Entire home/apt, house rules: No parties & No visitors & No pets, minimum nights: 2, maximum occupancy: 2\n\nNumber of people: 1\nTotal cost: 50 (flight) + 69 (lunch) + 79 (dinner) + 372 (accommodation) = 570\nAccommodation minimum nights: 1/2\n\nDays: 4\nCurrent City: Spokane (Washington)\nTransportation: -\nBreakfast: Just for Chai, Spokane (Washington), cost: 32, cuisines: Tea, Mexican, Desserts, Fast Food\nAttraction: Northwest Museum of Arts & Culture, Spokane (Washington); Spokane Falls (Upper Falls), Spokane (Washington)\nLunch: Tanishk Gourmet Indian, Spokane (Washington), cost: 83, cuisines: Seafood, Mediterranean, Fast Food\nDinner: Romi Da Dhaba, Spokane (Washington), cost: 93, cuisines: Tea, Mediterranean, Fast Food\nAccommodation: Renovated 2 Bedroom Apartment, Spokane (Washington), cost: 372, room type: Entire home/apt, house rules: No parties & No visitors & No pets, minimum nights: 2, maximum occupancy: 2\n\nNumber of people: 1\nTotal cost: 32 (breakfast) + 83 (lunch) + 93 (dinner) + 372 (accommodation) = 580\nAccommodation minimum nights: 2/2\n\nDays: 5\nCurrent City: from Spokane to Omaha\nTransportation: Self-driving, from Spokane to Omaha, duration: 20 hours 0 mins, distance: 2,216 km, cost: 110\nBreakfast: -\nAttraction: -\nLunch: -\nDinner: -\nAccommodation: -\n\nNumber of people: 1\nTotal cost: 110 (transportation) = 110\n\nTotal cost across all days: 656 (Day 1) + 383 (Day 2) + 570 (Day 3) + 580 (Day 4) + 110 (Day 5) = 2,299\n\nCuisines: The prompt specifies no cuisines, so all cuisines constraints are satisfied.\nRoom Constraint: All accommodations selected are entire rooms, ensuring privacy and space for the traveler.\nTransportation Constraint: The travel plan includes flights and self-driving, as per the available options and constraints.\n\nPlease note that the accommodation in Seattle has a minimum stay of 7 nights, but for the purpose of the itinerary, the cost is calculated per night. The traveler should be aware that they may need to pay for the full 7 nights even if staying fewer nights. Additionally, the return trip from Spokane to Omaha is by self-driving due to the lack of available flights on the specified date. The traveler should ensure they are comfortable with a long drive to complete the itinerary within the budget and time constraints.", "gpt-4-1106-preview_direct_sole-planning_parsed_results": [{"day": 1, "current_city": "from Omaha to Seattle", "transportation": "Flight Number: F3736891, from Omaha to Seattle, Departure Time: 14:43, Arrival Time: 16:28", "breakfast": "-", "attraction": "-", "lunch": "-", "dinner": "Ting's Red Lantern, Seattle", "accommodation": "Large quiet private studio in East Harlem, Seattle"}, {"day": 2, "current_city": "Seattle", "transportation": "-", "breakfast": "Mother Ringlet, Seattle", "attraction": "Space Needle, Seattle;Pike Place Market, Seattle;The Museum of Flight, Seattle;", "lunch": "Caf\u00e9 Burger BC, Seattle", "dinner": "The Godinho's, Seattle", "accommodation": "Large quiet private studio in East Harlem, Seattle"}, {"day": 3, "current_city": "from Seattle to Spokane", "transportation": "Flight Number: F3738208, from Seattle to Spokane, Departure Time: 11:28, Arrival Time: 12:38", "breakfast": "-", "attraction": "Riverfront Park, Spokane;Manito Park, Spokane;", "lunch": "Friends Grille and Bar, Spokane", "dinner": "Moon River Brewing Company, Spokane", "accommodation": "Renovated 2 Bedroom Apartment, Spokane"}, {"day": 4, "current_city": "Spokane", "transportation": "-", "breakfast": "Just for Chai, Spokane", "attraction": "Northwest Museum of Arts & Culture, Spokane;Spokane Falls (Upper Falls), Spokane;", "lunch": "Tanishk Gourmet Indian, Spokane", "dinner": "Romi Da Dhaba, Spokane", "accommodation": "Renovated 2 Bedroom Apartment, Spokane"}, {"day": 5, "current_city": "from Spokane to Omaha", "transportation": "Self-driving, from Spokane to Omaha, duration: 20 hours 0 mins, distance: 2,216 km", "breakfast": "-", "attraction": "-", "lunch": "-", "dinner": "-", "accommodation": "-"}]}]