[{"gpt-4-1106-preview_direct_sole-planning_results": "Travel Plan:\n\nDays: 1\nCurrent City: from Miami to San Diego (California)\nTransportation: Flight Number: F3726825, from Miami to San Diego, Departure Time: 19:07, Arrival Time: 21:25, cost: 1072\nBreakfast: -\nAttraction: -\nLunch: -\nDinner: -\nAccommodation: Spacious Room in Large 2 Bedroom Prewar Apartment, San Diego (California), cost: 585, room type: Private room, house rules: No parties & No visitors, minimum nights: 1, maximum occupancy: 2\n\nNumber of people: 2\nTotal cost: 2 x 1072 + 1 x 585 = 2,729\nAccommodation minimum nights: 1/1\n\nDays: 2\nCurrent City: San Diego (California)\nTransportation: -\nBreakfast: Open Yard, San Diego (California), cost: 33, cuisines: Chinese, Pizza, Cafe, Desserts\nAttraction: Cabrillo National Monument, San Diego (California); La Jolla Shores Park, San Diego (California)\nLunch: Gopala, San Diego (California), cost: 98, cuisines: Pizza, Mexican, BBQ, American, Seafood\nDinner: Burger King, San Diego (California), cost: 20, cuisines: Pizza, Italian, French, Fast Food, Seafood\nAccommodation: Spacious Room in Large 2 Bedroom Prewar Apartment, San Diego (California), cost: 585, room type: Private room, house rules: No parties & No visitors, minimum nights: 1, maximum occupancy: 2\n\nNumber of people: 2\nTotal cost: 2 x 33 + 2 x 98 + 2 x 20 + 1 x 585 = 887\nAccommodation minimum nights: 2/1\n\nDays: 3\nCurrent City: from San Diego (California) to Sacramento (California)\nTransportation: Flight Number: F3943115, from San Diego to Sacramento, Departure Time: 20:22, Arrival Time: 21:48, cost: 103\nBreakfast: Jetha Lal Ka Dhabha, San Diego (California), cost: 22, cuisines: Tea, Cafe, Indian, Italian\nAttraction: SeaWorld San Diego, San Diego (California); Old Town San Diego, San Diego (California)\nLunch: Chawlas 2, San Diego (California), cost: 67, cuisines: Bakery, Pizza, Indian, Seafood\nDinner: -\nAccommodation: Free Cleaning & WiFi-Near Train + Bars & Nightlife, Sacramento (California), cost: 237, room type: Private room, house rules: No parties, minimum nights: 1, maximum occupancy: 2\n\nNumber of people: 2\nTotal cost: 2 x 103 + 2 x 22 + 2 x 67 + 1 x 237 = 621\nAccommodation minimum nights: 1/1\n\nDays: 4\nCurrent City: Sacramento (California)\nTransportation: -\nBreakfast: Braseiro da G\u00e1vea, Sacramento (California), cost: 37, cuisines: Desserts, Tea, Pizza, Mexican, Fast Food\nAttraction: California State Railroad Museum, Sacramento (California); Sacramento Zoo, Sacramento (California)\nLunch: Bahama Breeze Island Grille, Sacramento (California), cost: 31, cuisines: French, Bakery, BBQ, Fast Food, Seafood\nDinner: Mori's Japanese Steakhouse & Sushi Bar, Sacramento (California), cost: 35, cuisines: Pizza, French, Fast Food, Cafe, Seafood\nAccommodation: Free Cleaning & WiFi-Near Train + Bars & Nightlife, Sacramento (California), cost: 237, room type: Private room, house rules: No parties, minimum nights: 1, maximum occupancy: 2\n\nNumber of people: 2\nTotal cost: 2 x 37 + 2 x 31 + 2 x 35 + 1 x 237 = 443\nAccommodation minimum nights: 2/1\n\nDays: 5\nCurrent City: from Sacramento (California) to Los Angeles (California)\nTransportation: Flight Number: F3972853, from Sacramento to Los Angeles, Departure Time: 12:06, Arrival Time: 13:27, cost: 79\nBreakfast: Gujarati Samaj Santushti, Sacramento (California), cost: 12, cuisines: Tea, Pizza, Fast Food\nAttraction: Old Sacramento Waterfront, Sacramento (California); Crocker Art Museum, Sacramento (California)\nLunch: Kerala Hotel, Sacramento (California), cost: 27, cuisines: Desserts, Tea, BBQ, Fast Food, American\nDinner: -\nAccommodation: Midtown East 2 Bed/2 Bath Elevator Building Apt, Los Angeles (California), cost: 540, room type: Entire home/apt, house rules: No pets, minimum nights: 1, maximum occupancy: 4\n\nNumber of people: 2\nTotal cost: 2 x 79 + 2 x 12 + 2 x 27 + 1 x 540 = 776\nAccommodation minimum nights: 1/1\n\nDays: 6\nCurrent City: Los Angeles (California)\nTransportation: -\nBreakfast: Punjabi Zaika, Los Angeles (California), cost: 46, cuisines: Pizza, Bakery, BBQ, Cafe, Indian\nAttraction: Santa Monica Pier, Los Angeles (California); Hollywood Walk of Fame, Los Angeles (California)\nLunch: Palmshore, Los Angeles (California), cost: 25, cuisines: Desserts, Bakery, Fast Food, American, Seafood\nDinner: Chicken Minar, Los Angeles (California), cost: 25, cuisines: Bakery, Fast Food\nAccommodation: Midtown East 2 Bed/2 Bath Elevator Building Apt, Los Angeles (California), cost: 540, room type: Entire home/apt, house rules: No pets, minimum nights: 1, maximum occupancy: 4\n\nNumber of people: 2\nTotal cost: 2 x 46 + 2 x 25 + 2 x 25 + 1 x 540 = 752\nAccommodation minimum nights: 2/1\n\nDays: 7\nCurrent City: from Los Angeles (California) to Miami\nTransportation: Flight Number: F3659468, from Los Angeles to Miami, Departure Time: 22:14, Arrival Time: 05:42, cost: 489\nBreakfast: The Hangout by 1861, Los Angeles (California), cost: 64, cuisines: Tea, Pizza, Seafood\nAttraction: Griffith Park, Los Angeles (California); The Getty, Los Angeles (California)\nLunch: Choco Kraft, Los Angeles (California), cost: 20, cuisines: French, BBQ, Fast Food, Cafe, Mediterranean\nDinner: -\nAccommodation: -\n\nNumber of people: 2\nTotal cost: 2 x 489 + 2 x 64 + 2 x 20 = 1,146\n\nTotal cost across all days: 2,729 + 887 + 621 + 443 + 776 + 752 + 1,146 = 7,354\n\nCuisines: The plan includes Mexican and American cuisine options for meals.\nRoom Constraint: All accommodations selected are private rooms or entire homes, ensuring privacy for the group of 2.\nTransportation Constraint: All intra-city travel is managed via flights, as self-driving and taxi options were not valid or not provided.\n\nNote: The total cost slightly exceeds the budget of $7,200 by $154. Adjustments to the plan, such as selecting more budget-friendly meals or accommodations, may be necessary to meet the budget constraint.", "gpt-4-1106-preview_direct_sole-planning_parsed_results": [{"day": 1, "current_city": "from Miami to San Diego", "transportation": "Flight Number: F3726825, from Miami to San Diego, Departure Time: 19:07, Arrival Time: 21:25", "breakfast": "-", "attraction": "-", "lunch": "-", "dinner": "-", "accommodation": "Spacious Room in Large 2 Bedroom Prewar Apartment, San Diego"}, {"day": 2, "current_city": "San Diego", "transportation": "-", "breakfast": "Open Yard, San Diego", "attraction": "Cabrillo National Monument, San Diego;La Jolla Shores Park, San Diego;", "lunch": "Gopala, San Diego", "dinner": "Burger King, San Diego", "accommodation": "Spacious Room in Large 2 Bedroom Prewar Apartment, San Diego"}, {"day": 3, "current_city": "from San Diego to Sacramento", "transportation": "Flight Number: F3943115, from San Diego to Sacramento, Departure Time: 20:22, Arrival Time: 21:48", "breakfast": "Jetha Lal Ka Dhabha, San Diego", "attraction": "SeaWorld San Diego, San Diego;Old Town San Diego, San Diego;", "lunch": "Chawlas 2, San Diego", "dinner": "-", "accommodation": "Free Cleaning & WiFi-Near Train + Bars & Nightlife, Sacramento"}, {"day": 4, "current_city": "Sacramento", "transportation": "-", "breakfast": "Braseiro da G\u00e1vea, Sacramento", "attraction": "California State Railroad Museum, Sacramento;Sacramento Zoo, Sacramento;", "lunch": "Bahama Breeze Island Grille, Sacramento", "dinner": "Mori's Japanese Steakhouse & Sushi Bar, Sacramento", "accommodation": "Free Cleaning & WiFi-Near Train + Bars & Nightlife, Sacramento"}, {"day": 5, "current_city": "from Sacramento to Los Angeles", "transportation": "Flight Number: F3972853, from Sacramento to Los Angeles, Departure Time: 12:06, Arrival Time: 13:27", "breakfast": "Gujarati Samaj Santushti, Sacramento", "attraction": "Old Sacramento Waterfront, Sacramento;Crocker Art Museum, Sacramento;", "lunch": "Kerala Hotel, Sacramento", "dinner": "-", "accommodation": "Midtown East 2 Bed/2 Bath Elevator Building Apt, Los Angeles"}, {"day": 6, "current_city": "Los Angeles", "transportation": "-", "breakfast": "Punjabi Zaika, Los Angeles", "attraction": "Santa Monica Pier, Los Angeles;Hollywood Walk of Fame, Los Angeles;", "lunch": "Palmshore, Los Angeles", "dinner": "Chicken Minar, Los Angeles", "accommodation": "Midtown East 2 Bed/2 Bath Elevator Building Apt, Los Angeles"}, {"day": 7, "current_city": "from Los Angeles to Miami", "transportation": "Flight Number: F3659468, from Los Angeles to Miami, Departure Time: 22:14, Arrival Time: 05:42", "breakfast": "The Hangout by 1861, Los Angeles", "attraction": "Griffith Park, Los Angeles;The Getty, Los Angeles;", "lunch": "Choco Kraft, Los Angeles", "dinner": "-", "accommodation": "-"}]}]