[{"gpt-4-1106-preview_direct_sole-planning_results": "Travel Plan:\n\nDays: 1\nCurrent City: from Chicago to Boise (Idaho)\nTransportation: Flight Number: F3857813, from Chicago to Boise (Idaho), Departure Time: 09:48, Arrival Time: 12:51, cost: 311\nBreakfast: -\nAttraction: -\nLunch: -\nDinner: Zerruco - The Ashok, Boise (Idaho), cost: 15, cuisines: Italian, Bakery, Fast Food, Cafe, Indian\nAccommodation: Modern & Cozy 2 BR Private Apartment in Brooklyn, Boise (Idaho), cost: 843, maximum occupancy: 7, house rules: No smoking, minimum nights: 2645\n\nNumber of people: 8\nTotal cost: 8 x 311 + 8/7 x 843 + 8 x 15 = 2,948 + 963 + 120 = 4,031\nAccommodation minimum nights: 1/2645\n\nDays: 2\nCurrent City: Boise (Idaho)\nTransportation: -\nBreakfast: Gopala Hari, Boise (Idaho), cost: 28, cuisines: Tea, Pizza, Italian, Fast Food, Mediterranean, Seafood\nAttraction: Zoo Boise, Boise (Idaho); Idaho Botanical Garden, Boise (Idaho)\nLunch: California Pizza Kitchen, Boise (Idaho), cost: 15, cuisines: Tea, BBQ, Fast Food, Chinese, Indian\nDinner: Dhaba By Claridges, Boise (Idaho), cost: 65, cuisines: Desserts, Italian, Fast Food, Chinese, Seafood\nAccommodation: Modern & Cozy 2 BR Private Apartment in Brooklyn, Boise (Idaho), cost: 843, maximum occupancy: 7, house rules: No smoking, minimum nights: 2645\n\nNumber of people: 8\nTotal cost: 8 x 28 + 8 x 15 + 8 x 65 + 8/7 x 843 = 224 + 120 + 520 + 963 = 1,827\nAccommodation minimum nights: 2/2645\n\nDays: 3\nCurrent City: from Boise (Idaho) to Pocatello (Idaho)\nTransportation: Self-driving, from Boise to Pocatello, duration: 3 hours 25 mins, distance: 378 km, cost: 18\nBreakfast: Underdoggs Sports Bar & Grill, Boise (Idaho), cost: 93, cuisines: Tea, Bakery, Pizza, Seafood\nAttraction: -\nLunch: -\nDinner: Harvest Moon, Pocatello (Idaho), cost: 90, cuisines: Pizza, Fast Food\nAccommodation: Entire Modern Studio Apartment/Prime Location, Pocatello (Idaho), cost: 1109, maximum occupancy: 5, house rules: No parties & No smoking, minimum nights: 30\n\nNumber of people: 8\nTotal cost: 8 x 18 + 8 x 93 + 8 x 90 + 8/5 x 1109 = 144 + 744 + 720 + 1774 = 3,382\nAccommodation minimum nights: 1/30\n\nDays: 4\nCurrent City: Pocatello (Idaho)\nTransportation: -\nBreakfast: Deorio's, Pocatello (Idaho), cost: 59, cuisines: Tea, Bakery, Fast Food, Mediterranean, Seafood\nAttraction: Idaho Museum of Natural History, Pocatello (Idaho); Fort Hall Replica and Commemorative Trading Post, Pocatello (Idaho)\nLunch: 650 - The Global Kitchen, Pocatello (Idaho), cost: 83, cuisines: French, Bakery, Cafe\nDinner: Good to Go, Pocatello (Idaho), cost: 28, cuisines: Tea, Bakery, Cafe, Mediterranean, Seafood\nAccommodation: Entire Modern Studio Apartment/Prime Location, Pocatello (Idaho), cost: 1109, maximum occupancy: 5, house rules: No parties & No smoking, minimum nights: 30\n\nNumber of people: 8\nTotal cost: 8 x 59 + 8 x 83 + 8 x 28 + 8/5 x 1109 = 472 + 664 + 224 + 1774 = 3,134\nAccommodation minimum nights: 2/30\n\nDays: 5\nCurrent City: from Pocatello (Idaho) to Idaho Falls (Idaho)\nTransportation: Self-driving, from Pocatello to Idaho Falls, duration: 51 mins, distance: 83.6 km, cost: 4\nBreakfast: Oriental Kitchen Express, Pocatello (Idaho), cost: 36, cuisines: Cafe, Bakery, Desserts\nAttraction: -\nLunch: -\nDinner: Taste of China, Idaho Falls (Idaho), cost: 19, cuisines: French, Bakery, Fast Food, Indian, Seafood\nAccommodation: Sunny & Spacious 2 bdrm apt, Idaho Falls (Idaho), cost: 914, maximum occupancy: 9, house rules: No smoking, minimum nights: 4\n\nNumber of people: 8\nTotal cost: 8 x 4 + 8 x 36 + 8 x 19 + 8/9 x 914 = 32 + 288 + 152 + 812 = 1,284\nAccommodation minimum nights: 1/4\n\nDays: 6\nCurrent City: Idaho Falls (Idaho)\nTransportation: -\nBreakfast: Karim's, Idaho Falls (Idaho), cost: 58, cuisines: Tea, Pizza, BBQ, Cafe, Indian\nAttraction: Museum of Idaho, Idaho Falls (Idaho); Idaho Falls Zoo at Tautphaus Park, Idaho Falls (Idaho)\nLunch: Shiv Restaurant, Idaho Falls (Idaho), cost: 42, cuisines: Bakery, Mexican, Pizza, Desserts\nDinner: Dhuaan, Idaho Falls (Idaho), cost: 97, cuisines: Tea, Pizza, Mexican, BBQ, Fast Food, American\nAccommodation: Sunny & Spacious 2 bdrm apt, Idaho Falls (Idaho), cost: 914, maximum occupancy: 9, house rules: No smoking, minimum nights: 4\n\nNumber of people: 8\nTotal cost: 8 x 58 + 8 x 42 + 8 x 97 + 8/9 x 914 = 464 + 336 + 776 + 812 = 2,388\nAccommodation minimum nights: 2/4\n\nDays: 7\nCurrent City: from Idaho Falls (Idaho) to Chicago\nTransportation: Self-driving, from Idaho Falls to Chicago, duration: 21 hours 43 mins, distance: 2,369 km, cost: 118\nBreakfast: Indian Fresh Meat Shop, Idaho Falls (Idaho), cost: 92, cuisines: Tea, Cafe, BBQ, Desserts\nAttraction: -\nLunch: -\nDinner: -\nAccommodation: -\n\nNumber of people: 8\nTotal cost: 8 x 118 + 8 x 92 = 944 + 736 = 1,680\n\nTotal cost across all days: 4,031 + 1,827 + 3,382 + 3,134 + 1,284 + 2,388 + 1,680 = 17,726\n\nCuisines: Italian and Chinese cuisines were included in the dining options as requested.\nRoom Constraint: All accommodations selected are entire homes or private rooms, ensuring privacy for the group of 8.\nTransportation Constraint: All intra-city travel is managed via flights and self-driving, as there were no valid taxi or self-driving options for long distances.\nTotal Budget: $22,200\nRemaining Budget: $22,200 - $17,726 = $4,474\n\nPlease note that the accommodation in Boise has a minimum stay of 2645 nights, which is not feasible for this travel plan. This is a placeholder and would need to be replaced with a suitable alternative that matches the travel dates and accommodation requirements. Additionally, the total cost is well within the budget, but the travel plan may require adjustments to ensure all details are accurate and feasible.", "gpt-4-1106-preview_direct_sole-planning_parsed_results": [{"day": 1, "current_city": "from Chicago to Boise", "transportation": "Flight Number: F3857813, from Chicago to Boise, Departure Time: 09:48, Arrival Time: 12:51", "breakfast": "-", "attraction": "-", "lunch": "-", "dinner": "Zerruco - The Ashok, Boise", "accommodation": "Modern & Cozy 2 BR Private Apartment in Brooklyn, Boise"}, {"day": 2, "current_city": "Boise", "transportation": "-", "breakfast": "Gopala Hari, Boise", "attraction": "Zoo Boise, Boise;Idaho Botanical Garden, Boise;", "lunch": "California Pizza Kitchen, Boise", "dinner": "Dhaba By Claridges, Boise", "accommodation": "Modern & Cozy 2 BR Private Apartment in Brooklyn, Boise"}, {"day": 3, "current_city": "from Boise to Pocatello", "transportation": "Self-driving, from Boise to Pocatello, duration: 3 hours 25 mins, distance: 378 km", "breakfast": "Underdoggs Sports Bar & Grill, Boise", "attraction": "-", "lunch": "-", "dinner": "Harvest Moon, Pocatello", "accommodation": "Entire Modern Studio Apartment/Prime Location, Pocatello"}, {"day": 4, "current_city": "Pocatello", "transportation": "-", "breakfast": "Deorio's, Pocatello", "attraction": "Idaho Museum of Natural History, Pocatello;Fort Hall Replica and Commemorative Trading Post, Pocatello;", "lunch": "650 - The Global Kitchen, Pocatello", "dinner": "Good to Go, Pocatello", "accommodation": "Entire Modern Studio Apartment/Prime Location, Pocatello"}, {"day": 5, "current_city": "from Pocatello to Idaho Falls", "transportation": "Self-driving, from Pocatello to Idaho Falls, duration: 51 mins, distance: 83.6 km", "breakfast": "Oriental Kitchen Express, Pocatello", "attraction": "-", "lunch": "-", "dinner": "Taste of China, Idaho Falls", "accommodation": "Sunny & Spacious 2 bdrm apt, Idaho Falls"}, {"day": 6, "current_city": "Idaho Falls", "transportation": "-", "breakfast": "Karim's, Idaho Falls", "attraction": "Museum of Idaho, Idaho Falls;Idaho Falls Zoo at Tautphaus Park, Idaho Falls;", "lunch": "Shiv Restaurant, Idaho Falls", "dinner": "Dhuaan, Idaho Falls", "accommodation": "Sunny & Spacious 2 bdrm apt, Idaho Falls"}, {"day": 7, "current_city": "from Idaho Falls to Chicago", "transportation": "Self-driving, from Idaho Falls to Chicago, duration: 21 hours 43 mins, distance: 2,369 km", "breakfast": "Indian Fresh Meat Shop, Idaho Falls", "attraction": "-", "lunch": "-", "dinner": "-", "accommodation": "-"}]}]