[{"gpt-4-1106-preview_direct_sole-planning_results": "Travel Plan:\n\nDays: 1\nCurrent City: from Elmira to Detroit\nTransportation: Flight Number: F3808914, from Elmira to Detroit, Departure Time: 15:48, Arrival Time: 17:00, cost: $70\nBreakfast: -\nAttraction: -\nLunch: -\nDinner: Chye Seng Huat Hardware, Detroit, cost: $94, cuisines: Tea, Mexican, Seafood\nAccommodation: Cozy 1 bedroom in the heart of Fort Greene, Detroit, cost: $751, room type: Entire home/apt, house rules: No pets & No parties, minimum nights: 3, maximum occupancy: 6\n\nNumber of people: 2\nTotal cost: 2 x $70 + 2 x $94 + 1 x $751 = $1,079\nAccommodation minimum nights: 1/3\n\nDays: 2\nCurrent City: Detroit\nTransportation: -\nBreakfast: Southern Bliss Bakery, Detroit, cost: $28, cuisines: Tea, BBQ, Desserts, Seafood\nAttraction: Detroit Institute of Arts, Detroit; Detroit Historical Museum, Detroit; Campus Martius Park, Detroit\nLunch: A Dong Restaurant, Detroit, cost: $40, cuisines: Tea, Cafe, Pizza\nDinner: Vapour Pub & Brewery, Detroit, cost: $80, cuisines: French, BBQ, Fast Food, Cafe, Seafood\nAccommodation: Cozy 1 bedroom in the heart of Fort Greene, Detroit, cost: $751, room type: Entire home/apt, house rules: No pets & No parties, minimum nights: 3, maximum occupancy: 6\n\nNumber of people: 2\nTotal cost: 2 x $28 + 2 x $40 + 2 x $80 + 1 x $751 = $1,048\nAccommodation minimum nights: 2/3\n\nDays: 3\nCurrent City: Detroit\nTransportation: -\nBreakfast: BMG - All Day Dining, Detroit, cost: $15, cuisines: Desserts, Bakery, BBQ, Indian, Seafood\nAttraction: Motown Museum, Detroit; Detroit Zoo, Detroit\nLunch: Mitalis Kitchen, Detroit, cost: $28, cuisines: Pizza, BBQ, Chinese, Mediterranean, Seafood\nDinner: DV's Chinese Kitchen, Detroit, cost: $91, cuisines: Desserts, Pizza, Italian, Bakery, Cafe, Mediterranean\nAccommodation: Cozy 1 bedroom in the heart of Fort Greene, Detroit, cost: $751, room type: Entire home/apt, house rules: No pets & No parties, minimum nights: 3, maximum occupancy: 6\n\nNumber of people: 2\nTotal cost: 2 x $15 + 2 x $28 + 2 x $91 + 1 x $751 = $1,019\nAccommodation minimum nights: 3/3\n\nTotal cost across all days: $1,079 + $1,048 + $1,019 = $3,146\n\nUnfortunately, the total cost exceeds the specified budget of $2,200. Adjustments need to be made to the plan to fit the budget. Here is a revised plan that fits within the budget:\n\nRevised Travel Plan:\n\nDays: 1\nCurrent City: from Elmira to Detroit\nTransportation: Self-driving, from Elmira to Detroit, duration: 7 hours 7 mins, distance: 764 km, cost: $38\nBreakfast: -\nAttraction: -\nLunch: -\nDinner: Southern Bliss Bakery, Detroit, cost: $28, cuisines: Tea, BBQ, Desserts, Seafood\nAccommodation: Cozy 1 bedroom in the heart of Fort Greene, Detroit, cost: $751, room type: Entire home/apt, house rules: No pets & No parties, minimum nights: 3, maximum occupancy: 6\n\nNumber of people: 2\nTotal cost: $38 + 2 x $28 + 1 x $751 = $845\nAccommodation minimum nights: 1/3\n\nDays: 2\nCurrent City: Detroit\nTransportation: -\nBreakfast: BMG - All Day Dining, Detroit, cost: $15, cuisines: Desserts, Bakery, BBQ, Indian, Seafood\nAttraction: Detroit Institute of Arts, Detroit; Detroit Historical Museum, Detroit\nLunch: A Dong Restaurant, Detroit, cost: $40, cuisines: Tea, Cafe, Pizza\nDinner: Cafe And More, Detroit, cost: $41, cuisines: Tea, Bakery, Italian\nAccommodation: Cozy 1 bedroom in the heart of Fort Greene, Detroit, cost: $751, room type: Entire home/apt, house rules: No pets & No parties, minimum nights: 3, maximum occupancy: 6\n\nNumber of people: 2\nTotal cost: 2 x $15 + 2 x $40 + 2 x $41 + 1 x $751 = $993\nAccommodation minimum nights: 2/3\n\nDays: 3\nCurrent City: Detroit\nTransportation: -\nBreakfast: N. Iqbal Restaurant, Detroit, cost: $11, cuisines: Tea, Cafe, Bakery, Desserts\nAttraction: Belle Isle Aquarium, Detroit; Michigan Science Center, Detroit\nLunch: Desi Spice, Detroit, cost: $16, cuisines: Tea, Pizza, American, Desserts\nDinner: Frequent Bakes, Detroit, cost: $50, cuisines: Cafe, Pizza, BBQ, Desserts\nAccommodation: Cozy 1 bedroom in the heart of Fort Greene, Detroit, cost: $751, room type: Entire home/apt, house rules: No pets & No parties, minimum nights: 3, maximum occupancy: 6\n\nNumber of people: 2\nTotal cost: 2 x $11 + 2 x $16 + 2 x $50 + 1 x $751 = $906\nAccommodation minimum nights: 3/3\n\nTotal revised cost across all days: $845 + $993 + $906 = $2,744\n\nThe revised plan still exceeds the budget. To fit within the budget, we may need to choose a less expensive accommodation or reduce meal costs. However, the provided accommodation options do not meet the pet-friendly requirement, and the budget constraint cannot be met with the given data. Further adjustments or additional information would be needed to create a feasible plan within the budget.", "gpt-4-1106-preview_direct_sole-planning_parsed_results": [{"day": 1, "current_city": "from Elmira to Detroit", "transportation": "Flight Number: F3808914, from Elmira to Detroit, Departure Time: 15:48, Arrival Time: 17:00", "breakfast": "-", "attraction": "-", "lunch": "-", "dinner": "Chye Seng Huat Hardware, Detroit", "accommodation": "Cozy 1 bedroom in the heart of Fort Greene, Detroit"}, {"day": 2, "current_city": "Detroit", "transportation": "-", "breakfast": "Southern Bliss Bakery, Detroit", "attraction": "Detroit Institute of Arts, Detroit; Detroit Historical Museum, Detroit; Campus Martius Park, Detroit", "lunch": "A Dong Restaurant, Detroit", "dinner": "Vapour Pub & Brewery, Detroit", "accommodation": "Cozy 1 bedroom in the heart of Fort Greene, Detroit"}, {"day": 3, "current_city": "Detroit", "transportation": "-", "breakfast": "BMG - All Day Dining, Detroit", "attraction": "Motown Museum, Detroit; Detroit Zoo, Detroit", "lunch": "Mitalis Kitchen, Detroit", "dinner": "DV's Chinese Kitchen, Detroit", "accommodation": "Cozy 1 bedroom in the heart of Fort Greene, Detroit"}, {"day": 1, "current_city": "from Elmira to Detroit", "transportation": "Self-driving, from Elmira to Detroit, duration: 7 hours 7 mins, distance: 764 km", "breakfast": "-", "attraction": "-", "lunch": "-", "dinner": "Southern Bliss Bakery, Detroit", "accommodation": "Cozy 1 bedroom in the heart of Fort Greene, Detroit"}, {"day": 2, "current_city": "Detroit", "transportation": "-", "breakfast": "BMG - All Day Dining, Detroit", "attraction": "Detroit Institute of Arts, Detroit; Detroit Historical Museum, Detroit", "lunch": "A Dong Restaurant, Detroit", "dinner": "Cafe And More, Detroit", "accommodation": "Cozy 1 bedroom in the heart of Fort Greene, Detroit"}, {"day": 3, "current_city": "Detroit", "transportation": "-", "breakfast": "N. Iqbal Restaurant, Detroit", "attraction": "Belle Isle Aquarium, Detroit; Michigan Science Center, Detroit", "lunch": "Desi Spice, Detroit", "dinner": "Frequent Bakes, Detroit", "accommodation": "Cozy 1 bedroom in the heart of Fort Greene, Detroit"}]}]