[{"gpt-4-1106-preview_direct_sole-planning_results": "Travel Plan:\n\nDays: 1\nCurrent City: from Spokane to San Francisco\nTransportation: Flight Number: F3853330, from Spokane to San Francisco, Departure Time: 07:10, Arrival Time: 09:38, cost: 227\nBreakfast: -\nAttraction: Golden Gate Bridge, San Francisco; Golden Gate Park, San Francisco\nLunch: Coffee & Chai Co., San Francisco, cost: 10, cuisines: Tea, Mexican, BBQ, Cafe, Seafood\nDinner: Tokyo Sushi, San Francisco, cost: 18, cuisines: Cafe, Pizza, BBQ\nAccommodation: Gorgeous Park Slope Studio, San Francisco, cost: 641, room type: Entire home/apt, house rules: No smoking & No parties, minimum nights: 14, maximum occupancy: 5\n\nNumber of people: 1\nTotal cost: 1 x 227 + 1 x 10 + 1 x 18 + 1 x 641 = 896\nAccommodation minimum nights: 1/14\n\nDays: 2\nCurrent City: San Francisco\nTransportation: -\nBreakfast: Bonne Bouche, San Francisco, cost: 21, cuisines: Tea, Chinese, American, Cafe\nAttraction: PIER 39, San Francisco; Exploratorium, San Francisco\nLunch: Sudarshan, San Francisco, cost: 53, cuisines: Fast Food, Bakery, Mediterranean, Italian\nDinner: Empress, San Francisco, cost: 24, cuisines: Pizza, BBQ, Mediterranean, Fast Food\nAccommodation: Gorgeous Park Slope Studio, San Francisco, cost: 641, room type: Entire home/apt, house rules: No smoking & No parties, minimum nights: 14, maximum occupancy: 5\n\nNumber of people: 1\nTotal cost: 1 x 21 + 1 x 53 + 1 x 24 + 1 x 641 = 739\nAccommodation minimum nights: 2/14\n\nDays: 3\nCurrent City: from San Francisco to Spokane\nTransportation: Flight Number: F3840215, from San Francisco to Spokane, Departure Time: 16:21, Arrival Time: 18:29, cost: 343\nBreakfast: AK Your Food, San Francisco, cost: 100, cuisines: Bakery, Pizza\nAttraction: San Francisco Museum of Modern Art, San Francisco; California Academy of Sciences, San Francisco\nLunch: That Baat, San Francisco, cost: 59, cuisines: Pizza, Bakery\nDinner: -\nAccommodation: -\n\nNumber of people: 1\nTotal cost: 1 x 343 + 1 x 100 + 1 x 59 = 502\n\nTotal cost across all days: 896 + 739 + 502 = 2,137\n\nGiven that the total cost exceeds the specified budget of $1,200, we need to adjust the plan to fit within the budget. Here's the revised plan:\n\nRevised Travel Plan:\n\nDays: 1\nCurrent City: from Spokane to San Francisco\nTransportation: Flight Number: F3853330, from Spokane to San Francisco, Departure Time: 07:10, Arrival Time: 09:38, cost: 227\nBreakfast: -\nAttraction: Golden Gate Bridge, San Francisco; Golden Gate Park, San Francisco\nLunch: Coffee & Chai Co., San Francisco, cost: 10, cuisines: Tea, Mexican, BBQ, Cafe, Seafood\nDinner: Tokyo Sushi, San Francisco, cost: 18, cuisines: Cafe, Pizza, BBQ\nAccommodation: Perfect Luxury Studio in DUMBO, San Francisco, cost: 247, room type: Entire home/apt, house rules: No smoking & No parties, minimum nights: 2, maximum occupancy: 3\n\nNumber of people: 1\nTotal cost: 1 x 227 + 1 x 10 + 1 x 18 + 1 x 247 = 502\nAccommodation minimum nights: 1/2\n\nDays: 2\nCurrent City: San Francisco\nTransportation: -\nBreakfast: Bonne Bouche, San Francisco, cost: 21, cuisines: Tea, Chinese, American, Cafe\nAttraction: PIER 39, San Francisco; Exploratorium, San Francisco\nLunch: Gupta's Rasoi, San Francisco, cost: 13, cuisines: Cafe, Bakery, BBQ, Mediterranean\nDinner: Empress, San Francisco, cost: 24, cuisines: Pizza, BBQ, Mediterranean, Fast Food\nAccommodation: Perfect Luxury Studio in DUMBO, San Francisco, cost: 247, room type: Entire home/apt, house rules: No smoking & No parties, minimum nights: 2, maximum occupancy: 3\n\nNumber of people: 1\nTotal cost: 1 x 21 + 1 x 13 + 1 x 24 + 1 x 247 = 305\nAccommodation minimum nights: 2/2\n\nDays: 3\nCurrent City: from San Francisco to Spokane\nTransportation: Self-driving, from San Francisco to Spokane, duration: 13 hours 57 mins, distance: 1,409 km, cost: 70\nBreakfast: -\nAttraction: -\nLunch: -\nDinner: -\nAccommodation: -\n\nNumber of people: 1\nTotal cost: 1 x 70 = 70\n\nTotal cost across all days: 502 + 305 + 70 = 877\n\nCuisines: The prompt specifies no cuisines, so all cuisines constraints are satisfied.\nRoom Constraint: All accommodations selected are entire rooms that do not allow parties, ensuring privacy for the individual.\nTransportation Constraint: The revised plan includes a flight and self-driving to stay within the budget.", "gpt-4-1106-preview_direct_sole-planning_parsed_results": [{"day": 1, "current_city": "from Spokane to San Francisco", "transportation": "Flight Number: F3853330, from Spokane to San Francisco, Departure Time: 07:10, Arrival Time: 09:38", "breakfast": "-", "attraction": "Golden Gate Bridge, San Francisco;Golden Gate Park, San Francisco;", "lunch": "Coffee & Chai Co., San Francisco", "dinner": "Tokyo Sushi, San Francisco", "accommodation": "Perfect Luxury Studio in DUMBO, San Francisco"}, {"day": 2, "current_city": "San Francisco", "transportation": "-", "breakfast": "Bonne Bouche, San Francisco", "attraction": "PIER 39, San Francisco;Exploratorium, San Francisco;", "lunch": "Gupta's Rasoi, San Francisco", "dinner": "Empress, San Francisco", "accommodation": "Perfect Luxury Studio in DUMBO, San Francisco"}, {"day": 3, "current_city": "from San Francisco to Spokane", "transportation": "Self-driving, from San Francisco to Spokane, duration: 13 hours 57 mins, distance: 1,409 km", "breakfast": "-", "attraction": "-", "lunch": "-", "dinner": "-", "accommodation": "-"}]}]