[{"gpt-4-1106-preview_direct_sole-planning_results": "Travel Plan:\n\nDays: 1\nCurrent City: from Key West to Houston (Texas)\nTransportation: Flight Number: F4041792, from Key West to Houston, Departure Time: 16:55, Arrival Time: 19:01, cost: $218\nBreakfast: -\nAttraction: -\nLunch: -\nDinner: Jalapenos, Houston (Texas), cost: $57, cuisines: Desserts, Tea, Cafe, Chinese, Seafood\nAccommodation: Superhost 3 bedroom DISCOUNT, Houston (Texas), cost: $746, maximum occupancy: 5, house rules: No pets, minimum nights: 1\n\nNumber of people: 2\nTotal cost: 2 x $218 + 2 x $57 + 1 x $746 = $1,296\nAccommodation minimum nights: 1/1\n\nDays: 2\nCurrent City: Houston (Texas)\nTransportation: -\nBreakfast: Chawla's\u5b8a, Houston (Texas), cost: $26, cuisines: Chinese, Desserts, Bakery, Cafe, Mediterranean\nAttraction: Space Center Houston, Houston (Texas); Houston Zoo, Houston (Texas)\nLunch: Istanbul Restaurant, Houston (Texas), cost: $19, cuisines: Tea, Indian, Seafood\nDinner: Royal Mart, Houston (Texas), cost: $40, cuisines: Tea, Bakery, Cafe, Mediterranean, Seafood\nAccommodation: Superhost 3 bedroom DISCOUNT, Houston (Texas), cost: $746, maximum occupancy: 5, house rules: No pets, minimum nights: 1\n\nNumber of people: 2\nTotal cost: 2 x $26 + 2 x $19 + 2 x $40 + 1 x $746 = $916\nAccommodation minimum nights: 2/1\n\nDays: 3\nCurrent City: from Houston (Texas) to San Antonio (Texas)\nTransportation: Flight Number: F3902584, from Houston to San Antonio, Departure Time: 20:34, Arrival Time: 21:29, cost: $45\nBreakfast: Earthen Spices, Houston (Texas), cost: $28, cuisines: Tea, Mexican, Bakery, BBQ, Fast Food\nAttraction: Gerald D. Hines Waterwall Park, Houston (Texas); Discovery Green, Houston (Texas)\nLunch: Pebble Street, Houston (Texas), cost: $73, cuisines: Tea, American, Mediterranean, BBQ\nDinner: -\nAccommodation: Private House in Trendy Crown Heights, San Antonio (Texas), cost: $642, maximum occupancy: 6, house rules: No smoking, minimum nights: 2\n\nNumber of people: 2\nTotal cost: 2 x $45 + 2 x $28 + 2 x $73 + 1 x $642 = $934\nAccommodation minimum nights: 1/2\n\nDays: 4\nCurrent City: San Antonio (Texas)\nTransportation: -\nBreakfast: Cafe Le Rue @ The Landings, San Antonio (Texas), cost: $19, cuisines: French, Mexican, Cafe, Seafood\nAttraction: San Antonio River Walk, San Antonio (Texas); The Alamo, San Antonio (Texas)\nLunch: Sona Bakers, San Antonio (Texas), cost: $20, cuisines: Mexican, Bakery, Seafood\nDinner: Barbeque Nation, San Antonio (Texas), cost: $16, cuisines: Tea, Cafe, Fast Food, Chinese, American\nAccommodation: Private House in Trendy Crown Heights, San Antonio (Texas), cost: $642, maximum occupancy: 6, house rules: No smoking, minimum nights: 2\n\nNumber of people: 2\nTotal cost: 2 x $19 + 2 x $20 + 2 x $16 + 1 x $642 = $794\nAccommodation minimum nights: 2/2\n\nDays: 5\nCurrent City: from San Antonio (Texas) to Dallas (Texas)\nTransportation: Flight Number: F3999432, from San Antonio to Dallas, Departure Time: 10:01, Arrival Time: 10:54, cost: $75\nBreakfast: The Kylin Experience - Holiday Inn, San Antonio (Texas), cost: $23, cuisines: Tea, Cafe, Pizza, Fast Food\nAttraction: LEGOLAND Discovery Center San Antonio, San Antonio (Texas); San Antonio Zoo, San Antonio (Texas)\nLunch: Spice Deli, San Antonio (Texas), cost: $19, cuisines: Tea, Fast Food, American, Italian\nDinner: Drifters Cafe, Dallas (Texas), cost: $21, cuisines: Tea, French, Mexican, Cafe, Seafood\nAccommodation: Take it now you won't find better, Dallas (Texas), cost: $609, maximum occupancy: 4, house rules: No pets, minimum nights: 1\n\nNumber of people: 2\nTotal cost: 2 x $75 + 2 x $23 + 2 x $19 + 2 x $21 + 1 x $609 = $865\nAccommodation minimum nights: 1/1\n\nDays: 6\nCurrent City: Dallas (Texas)\nTransportation: -\nBreakfast: Cafe Hera Pheri, Dallas (Texas), cost: $18, cuisines: Cafe, Desserts\nAttraction: The Dallas World Aquarium, Dallas (Texas); Reunion Tower, Dallas (Texas)\nLunch: MONKS, Dallas (Texas), cost: $24, cuisines: Tea, Pizza, Cafe, Mediterranean, Seafood\nDinner: Salsa Mexican Grill, Dallas (Texas), cost: $63, cuisines: Desserts, BBQ, Bakery, Cafe, American\nAccommodation: Take it now you won't find better, Dallas (Texas), cost: $609, maximum occupancy: 4, house rules: No pets, minimum nights: 1\n\nNumber of people: 2\nTotal cost: 2 x $18 + 2 x $24 + 2 x $63 + 1 x $609 = $819\nAccommodation minimum nights: 2/1\n\nDays: 7\nCurrent City: from Dallas (Texas) to Key West\nTransportation: Flight Number: F3666117, from Dallas to Key West, Departure Time: 17:01, Arrival Time: 20:41, cost: $222\nBreakfast: Cafe Coffee Day, Dallas (Texas), cost: $22, cuisines: Cafe, BBQ, Desserts, Seafood\nAttraction: Nasher Sculpture Center, Dallas (Texas); Dallas Museum of Art, Dallas (Texas)\nLunch: -\nDinner: -\nAccommodation: -\n\nNumber of people: 2\nTotal cost: 2 x $222 + 2 x $22 = $488\n\nTotal cost across all days: $1,296 + $916 + $934 + $794 + $865 + $819 + $488 = $6,112\nCuisines: Mexican, Italian, Chinese, and American cuisines were included in the dining options.\nRoom Constraint: All accommodations selected are entire rooms that allow parties, ensuring privacy and space for the group of 2.\nTransportation Constraint: All intra-city travel is managed via flights, as per the requirements.\nBudget: The total cost of $6,112 is within the specified budget of $7,200.", "gpt-4-1106-preview_direct_sole-planning_parsed_results": [{"day": 1, "current_city": "from Key West to Houston", "transportation": "Flight Number: F4041792, from Key West to Houston, Departure Time: 16:55, Arrival Time: 19:01", "breakfast": "-", "attraction": "-", "lunch": "-", "dinner": "Jalapenos, Houston", "accommodation": "Superhost 3 bedroom DISCOUNT, Houston"}, {"day": 2, "current_city": "Houston", "transportation": "-", "breakfast": "Chawla's\u5b8a, Houston", "attraction": "Space Center Houston, Houston;Houston Zoo, Houston;", "lunch": "Istanbul Restaurant, Houston", "dinner": "Royal Mart, Houston", "accommodation": "Superhost 3 bedroom DISCOUNT, Houston"}, {"day": 3, "current_city": "from Houston to San Antonio", "transportation": "Flight Number: F3902584, from Houston to San Antonio, Departure Time: 20:34, Arrival Time: 21:29", "breakfast": "Earthen Spices, Houston", "attraction": "Gerald D. Hines Waterwall Park, Houston;Discovery Green, Houston;", "lunch": "Pebble Street, Houston", "dinner": "-", "accommodation": "Private House in Trendy Crown Heights, San Antonio"}, {"day": 4, "current_city": "San Antonio", "transportation": "-", "breakfast": "Cafe Le Rue @ The Landings, San Antonio", "attraction": "San Antonio River Walk, San Antonio;The Alamo, San Antonio;", "lunch": "Sona Bakers, San Antonio", "dinner": "Barbeque Nation, San Antonio", "accommodation": "Private House in Trendy Crown Heights, San Antonio"}, {"day": 5, "current_city": "from San Antonio to Dallas", "transportation": "Flight Number: F3999432, from San Antonio to Dallas, Departure Time: 10:01, Arrival Time: 10:54", "breakfast": "The Kylin Experience - Holiday Inn, San Antonio", "attraction": "LEGOLAND Discovery Center San Antonio, San Antonio;San Antonio Zoo, San Antonio;", "lunch": "Spice Deli, San Antonio", "dinner": "Drifters Cafe, Dallas", "accommodation": "Take it now you won't find better, Dallas"}, {"day": 6, "current_city": "Dallas", "transportation": "-", "breakfast": "Cafe Hera Pheri, Dallas", "attraction": "The Dallas World Aquarium, Dallas;Reunion Tower, Dallas;", "lunch": "MONKS, Dallas", "dinner": "Salsa Mexican Grill, Dallas", "accommodation": "Take it now you won't find better, Dallas"}, {"day": 7, "current_city": "from Dallas to Key West", "transportation": "Flight Number: F3666117, from Dallas to Key West, Departure Time: 17:01, Arrival Time: 20:41", "breakfast": "Cafe Coffee Day, Dallas", "attraction": "Nasher Sculpture Center, Dallas;Dallas Museum of Art, Dallas;", "lunch": "-", "dinner": "-", "accommodation": "-"}]}]