[{"gpt-4-1106-preview_direct_sole-planning_results": "Travel Plan:\n\nDays: 1\nCurrent City: Chattanooga to Augusta (Georgia)\nTransportation: Taxi, from Chattanooga to Augusta, duration: 3 hours 57 mins, distance: 423 km, cost: $423\nBreakfast: -\nAttraction: -\nLunch: -\nDinner: -\nAccommodation: Perfect Chanukah apartment for the whole crew!, Augusta (Georgia), cost: $451, room type: Entire home/apt, house rules: No pets, minimum nights: 11, maximum occupancy: 3\n\nNumber of people: 2\nTotal cost: 2 x $423 + 1 x $451 = $1,297\nAccommodation minimum nights: 1/11\n\nDays: 2\nCurrent City: Augusta (Georgia)\nTransportation: -\nBreakfast: B Merrell's, Augusta (Georgia), cost: $74, cuisines: Tea, Pizza, Desserts, Fast Food\nAttraction: Phinizy Swamp Nature Park, Augusta (Georgia); Augusta Riverwalk, Augusta (Georgia)\nLunch: Vinny Vanucchi's, Augusta (Georgia), cost: $45, cuisines: Desserts, Fast Food, Chinese, Indian, Seafood\nDinner: Fish Tales Lakeside Grille, Augusta (Georgia), cost: $37, cuisines: Tea, Cafe, Bakery, Desserts\nAccommodation: Perfect Chanukah apartment for the whole crew!, Augusta (Georgia), cost: $451, room type: Entire home/apt, house rules: No pets, minimum nights: 11, maximum occupancy: 3\n\nNumber of people: 2\nTotal cost: 2 x $74 + 2 x $45 + 2 x $37 + 1 x $451 = $763\nAccommodation minimum nights: 2/11\n\nDays: 3\nCurrent City: Augusta to Decatur (Georgia)\nTransportation: Taxi, from Augusta to Decatur, duration: 2 hours 19 mins, distance: 229 km, cost: $229\nBreakfast: The Charcoal Chimney, Augusta (Georgia), cost: $86, cuisines: Tea, Fast Food, BBQ, Italian\nAttraction: Augusta Museum of History, Augusta (Georgia); Morris Museum of Art, Augusta (Georgia)\nLunch: Nikhil Food Point, Augusta (Georgia), cost: $87, cuisines: Tea, Mexican, Fast Food, American, Seafood\nDinner: -\nAccommodation: The Heart of the Lower East Side!, Decatur (Georgia), cost: $587, room type: Entire home/apt, house rules: No children under 10, minimum nights: 2, maximum occupancy: 2\n\nNumber of people: 2\nTotal cost: 2 x $229 + 2 x $86 + 2 x $87 + 1 x $587 = $1,391\nAccommodation minimum nights: 1/2\n\nDays: 4\nCurrent City: Decatur (Georgia)\nTransportation: -\nBreakfast: Madhuban Restaurant - Welcome Hotel Rama International, Decatur (Georgia), cost: $47, cuisines: Pizza, Bakery, Seafood\nAttraction: DeKalb History Center Museum, Decatur (Georgia); Glenlake Park, Decatur (Georgia)\nLunch: Tandoori Hut, Decatur (Georgia), cost: $82, cuisines: Pizza, American, Indian, Fast Food\nDinner: Viva Hyderabad, Decatur (Georgia), cost: $12, cuisines: Desserts, Tea, Italian, Fast Food, Indian\nAccommodation: The Heart of the Lower East Side!, Decatur (Georgia), cost: $587, room type: Entire home/apt, house rules: No children under 10, minimum nights: 2, maximum occupancy: 2\n\nNumber of people: 2\nTotal cost: 2 x $47 + 2 x $82 + 2 x $12 + 1 x $587 = $868\nAccommodation minimum nights: 2/2\n\nDays: 5\nCurrent City: Decatur to Atlanta (Georgia)\nTransportation: Taxi, from Decatur to Atlanta, duration: 19 mins, distance: 13.0 km, cost: $13\nBreakfast: Cafe Coffee Day, Decatur (Georgia), cost: $46, cuisines: Tea, Cafe, BBQ, Mediterranean\nAttraction: Clyde Shepherd Nature Preserve, Decatur (Georgia); Mason Mill Park, Decatur (Georgia)\nLunch: Joey's Pizza, Decatur (Georgia), cost: $69, cuisines: Tea, Pizza, Bakery, Chinese, Seafood\nDinner: -\nAccommodation: Bright, Modern, Clean, Spacious, Brooklyn Home, Atlanta (Georgia), cost: $1034, room type: Entire home/apt, house rules: No children under 10, minimum nights: 3, maximum occupancy: 4\n\nNumber of people: 2\nTotal cost: 2 x $13 + 2 x $46 + 2 x $69 + 1 x $1034 = $1,280\nAccommodation minimum nights: 1/3\n\nDays: 6\nCurrent City: Atlanta (Georgia)\nTransportation: -\nBreakfast: Saffron, Atlanta (Georgia), cost: $39, cuisines: Tea, Cafe, Fast Food, Seafood\nAttraction: Atlanta Botanical Garden, Atlanta (Georgia); World of Coca-Cola, Atlanta (Georgia)\nLunch: Adda, Atlanta (Georgia), cost: $22, cuisines: Tea, Mexican, Bakery\nDinner: Ahata, Atlanta (Georgia), cost: $17, cuisines: Tea, Indian, Desserts\nAccommodation: Bright, Modern, Clean, Spacious, Brooklyn Home, Atlanta (Georgia), cost: $1034, room type: Entire home/apt, house rules: No children under 10, minimum nights: 3, maximum occupancy: 4\n\nNumber of people: 2\nTotal cost: 2 x $39 + 2 x $22 + 2 x $17 + 1 x $1034 = $1,190\nAccommodation minimum nights: 2/3\n\nDays: 7\nCurrent City: Atlanta to Chattanooga\nTransportation: Self-driving, from Atlanta to Chattanooga, duration: 1 hour 47 mins, distance: 190 km, cost: $9\nBreakfast: Baba Au Rhum, Atlanta (Georgia), cost: $27, cuisines: Desserts, Pizza, Mexican, BBQ, Fast Food\nAttraction: Georgia Aquarium, Atlanta (Georgia); Piedmont Park, Atlanta (Georgia)\nLunch: Asian Bistro, Atlanta (Georgia), cost: $27, cuisines: Tea, Bakery, Seafood\nDinner: -\nAccommodation: -\n\nNumber of people: 2\nTotal cost: 2 x $9 + 2 x $27 + 2 x $27 = $126\n\nTotal cost across all days: $1,297 + $763 + $1,391 + $868 + $1,280 + $1,190 + $126 = $6,915\n\nCuisines: The prompt specifies no cuisines, so all cuisines constraints are satisfied.\nRoom Constraint: All accommodations selected are entire home/apt with no shared rooms, ensuring privacy and space for the group of 2.\nTransportation Constraint: All intra-city travel is managed via taxi or self-driving, so no flights are necessary.\n\nNote: The total cost slightly exceeds the budget by $15. If this is not acceptable, adjustments can be made by selecting a less expensive accommodation or dining option on one of the days.", "gpt-4-1106-preview_direct_sole-planning_parsed_results": [{"day": 1, "current_city": "from Chattanooga to Augusta (Georgia)", "transportation": "Taxi, from Chattanooga to Augusta, duration: 3 hours 57 mins, distance: 423 km", "breakfast": "-", "attraction": "-", "lunch": "-", "dinner": "-", "accommodation": "Perfect Chanukah apartment for the whole crew!, Augusta (Georgia)"}, {"day": 2, "current_city": "Augusta (Georgia)", "transportation": "-", "breakfast": "B Merrell's, Augusta (Georgia)", "attraction": "Phinizy Swamp Nature Park, Augusta (Georgia);Augusta Riverwalk, Augusta (Georgia);", "lunch": "Vinny Vanucchi's, Augusta (Georgia)", "dinner": "Fish Tales Lakeside Grille, Augusta (Georgia)", "accommodation": "Perfect Chanukah apartment for the whole crew!, Augusta (Georgia)"}, {"day": 3, "current_city": "from Augusta to Decatur (Georgia)", "transportation": "Taxi, from Augusta to Decatur, duration: 2 hours 19 mins, distance: 229 km", "breakfast": "The Charcoal Chimney, Augusta (Georgia)", "attraction": "Augusta Museum of History, Augusta (Georgia);Morris Museum of Art, Augusta (Georgia);", "lunch": "Nikhil Food Point, Augusta (Georgia)", "dinner": "-", "accommodation": "The Heart of the Lower East Side!, Decatur (Georgia)"}, {"day": 4, "current_city": "Decatur (Georgia)", "transportation": "-", "breakfast": "Madhuban Restaurant - Welcome Hotel Rama International, Decatur (Georgia)", "attraction": "DeKalb History Center Museum, Decatur (Georgia);Glenlake Park, Decatur (Georgia);", "lunch": "Tandoori Hut, Decatur (Georgia)", "dinner": "Viva Hyderabad, Decatur (Georgia)", "accommodation": "The Heart of the Lower East Side!, Decatur (Georgia)"}, {"day": 5, "current_city": "from Decatur to Atlanta (Georgia)", "transportation": "Taxi, from Decatur to Atlanta, duration: 19 mins, distance: 13.0 km", "breakfast": "Cafe Coffee Day, Decatur (Georgia)", "attraction": "Clyde Shepherd Nature Preserve, Decatur (Georgia);Mason Mill Park, Decatur (Georgia);", "lunch": "Joey's Pizza, Decatur (Georgia)", "dinner": "-", "accommodation": "Bright, Modern, Clean, Spacious, Brooklyn Home, Atlanta (Georgia)"}, {"day": 6, "current_city": "Atlanta (Georgia)", "transportation": "-", "breakfast": "Saffron, Atlanta (Georgia)", "attraction": "Atlanta Botanical Garden, Atlanta (Georgia);World of Coca-Cola, Atlanta (Georgia);", "lunch": "Adda, Atlanta (Georgia)", "dinner": "Ahata, Atlanta (Georgia)", "accommodation": "Bright, Modern, Clean, Spacious, Brooklyn Home, Atlanta (Georgia)"}, {"day": 7, "current_city": "from Atlanta to Chattanooga", "transportation": "Self-driving, from Atlanta to Chattanooga, duration: 1 hour 47 mins, distance: 190 km", "breakfast": "Baba Au Rhum, Atlanta (Georgia)", "attraction": "Georgia Aquarium, Atlanta (Georgia);Piedmont Park, Atlanta (Georgia);", "lunch": "Asian Bistro, Atlanta (Georgia)", "dinner": "-", "accommodation": "-"}]}]