[{"gpt-4-1106-preview_direct_sole-planning_results": "Based on the provided information and constraints, here is a travel plan for a trip from Palm Springs to Texas, visiting 3 cities over 7 days from March 13th to March 19th, 2022, with a budget of $8,100.\n\n**Travel Plan:**\n\n**Day 1: Palm Springs to Houston**\n- Transportation: Flight Number: F3839269, from Palm Springs to Houston, Departure Time: 14:25, Arrival Time: 19:43, Cost: $524\n- Breakfast: Not applicable (in Palm Springs)\n- Attraction: Not applicable (traveling)\n- Lunch: Not applicable (traveling)\n- Dinner: Jalapenos, Houston (Texas), Average Cost: $57, Cuisines: Desserts, Tea, Cafe, Chinese, Seafood\n- Accommodation: Superhost 3 bedroom DISCOUNT, Houston (Texas), Cost: $746, Room Type: Entire home/apt, House Rules: No pets, Minimum Nights: 1, Maximum Occupancy: 5\n\n**Day 2: Houston**\n- Transportation: Not applicable (staying in Houston)\n- Breakfast: Chawla's\u5b8a, Houston (Texas), Cost: $26, Cuisines: Chinese, Desserts, Bakery, Cafe, Mediterranean\n- Attraction: Space Center Houston; Houston Museum of Natural Science; Houston Zoo\n- Lunch: Istanbul Restaurant, Houston (Texas), Cost: $19, Cuisines: Tea, Indian, Seafood\n- Dinner: Royal Mart, Houston (Texas), Cost: $40, Cuisines: Tea, Bakery, Cafe, Mediterranean, Seafood\n- Accommodation: Superhost 3 bedroom DISCOUNT, Houston (Texas), Cost: $746, Room Type: Entire home/apt, House Rules: No pets, Minimum Nights: 1, Maximum Occupancy: 5\n\n**Day 3: Houston to Austin**\n- Transportation: Flight Number: F3838099, from Houston to Austin, Departure Time: 09:47, Arrival Time: 10:52, Cost: $43\n- Breakfast: Earthen Spices, Houston (Texas), Cost: $28, Cuisines: Tea, Mexican, Bakery, BBQ, Fast Food\n- Attraction: Texas Capitol; Zilker Metropolitan Park; Museum of the Weird\n- Lunch: Wildflour Cafe + Bakery, Austin (Texas), Cost: $55, Cuisines: Desserts, French, Bakery, BBQ, Seafood\n- Dinner: The Kasbah, Austin (Texas), Cost: $88, Cuisines: Cafe, Pizza, BBQ, Fast Food\n- Accommodation: Cozy room in south Harlem - 10 mins to Columbia, Austin (Texas), Cost: $564, Room Type: Private room, House Rules: No visitors & No children under 10, Minimum Nights: 1, Maximum Occupancy: 2\n\n**Day 4: Austin**\n- Transportation: Not applicable (staying in Austin)\n- Breakfast: Mehfil-e-Handi, Austin (Texas), Cost: $96, Cuisines: Desserts, Tea, Bakery, American, Seafood\n- Attraction: Bullock Texas State History Museum; McKinney Falls State Park; Austin Aquarium\n- Lunch: Tandoori Nights, Austin (Texas), Cost: $26, Cuisines: Pizza, Italian, BBQ, Indian, Seafood\n- Dinner: Cup-a-licious, Austin (Texas), Cost: $85, Cuisines: Fast Food, Chinese, BBQ, Italian\n- Accommodation: Cozy room in south Harlem - 10 mins to Columbia, Austin (Texas), Cost: $564, Room Type: Private room, House Rules: No visitors & No children under 10, Minimum Nights: 1, Maximum Occupancy: 2\n\n**Day 5: Austin to Dallas**\n- Transportation: Flight Number: F3601654, from Austin to Dallas, Departure Time: 11:43, Arrival Time: 12:36, Cost: $44\n- Breakfast: Chin Pokli, Austin (Texas), Cost: $15, Cuisines: Desserts, Tea, Fast Food, Chinese, Mediterranean, Seafood\n- Attraction: The Dallas World Aquarium; The Sixth Floor Museum at Dealey Plaza; Dallas Museum of Art\n- Lunch: Drifters Cafe, Dallas (Texas), Cost: $21, Cuisines: Tea, French, Mexican, Cafe, Seafood\n- Dinner: Coconuts Fish Cafe, Dallas (Texas), Cost: $38, Cuisines: Cafe, BBQ, Mediterranean, Fast Food\n- Accommodation: Take it now you won't find better, Dallas (Texas), Cost: $609, Room Type: Entire home/apt, House Rules: No pets, Minimum Nights: 1, Maximum Occupancy: 4\n\n**Day 6: Dallas**\n- Transportation: Not applicable (staying in Dallas)\n- Breakfast: Cafe Gatherings, Dallas (Texas), Cost: $17, Cuisines: Bakery, Indian, Desserts\n- Attraction: Reunion Tower; The Dallas Arboretum and Botanical Garden; Klyde Warren Park\n- Lunch: Yanki Sizzlers, Dallas (Texas), Cost: $96, Cuisines: Cafe, French, Tea, Mediterranean\n- Dinner: L'Opera, Dallas (Texas), Cost: $77, Cuisines: French, Bakery, BBQ, Fast Food, Seafood\n- Accommodation: Take it now you won't find better, Dallas (Texas), Cost: $609, Room Type: Entire home/apt, House Rules: No pets, Minimum Nights: 1, Maximum Occupancy: 4\n\n**Day 7: Dallas to Palm Springs**\n- Transportation: Flight Number: F3673984, from Dallas to Palm Springs, Departure Time: 08:41, Arrival Time: 10:04, Cost: $432\n- Breakfast: Cafe Coffee Day, Dallas (Texas), Cost: $22, Cuisines: Cafe, BBQ, Desserts, Seafood\n- Attraction: Not applicable (traveling)\n- Lunch: Not applicable (traveling)\n- Dinner: Not applicable (in Palm Springs)\n- Accommodation: Not applicable (end of trip)\n\n**Total Cost Calculation:**\n- Flights: $524 + $43 + $44 + $432 = $1,043\n- Accommodations: $746 + $746 + $564 + $564 + $609 + $609 = $3,838\n- Meals and Attractions: Estimated $1,000 (varies based on actual participation and dining choices)\n- Total Estimated Cost: $1,043 (Flights) + $3,838 (Accommodations) + $1,000 (Meals/Attractions) = $5,881\n\n**Remaining Budget:**\n- $8,100 (Total Budget) - $5,881 (Estimated Cost) = $2,219 remaining for additional meals, attractions, or unforeseen expenses.\n\n**Notes:**\n- The plan includes flights as the primary mode of transportation between cities, as self-driving and taxi options are not practical for the distances involved.\n- The accommodations chosen are entire homes or private rooms, adhering to the preference for entire rooms and avoiding shared rooms.\n- The attractions chosen are based on the provided list of attractions in each city.\n- Meal selections are based on the provided list of restaurants in each city, ensuring no repetition and adherence to cuisine types.\n- The plan stays within the specified budget and includes a buffer for additional expenses.\n- The plan does not include transportation within cities (e.g., to attractions or restaurants), which will need to be arranged separately and factored into the remaining budget.", "gpt-4-1106-preview_direct_sole-planning_parsed_results": [{"day": 1, "current_city": "from Palm Springs to Houston", "transportation": "Flight Number: F3839269, from Palm Springs to Houston, Departure Time: 14:25, Arrival Time: 19:43", "breakfast": "-", "attraction": "-", "lunch": "-", "dinner": "Jalapenos, Houston", "accommodation": "Superhost 3 bedroom DISCOUNT, Houston"}, {"day": 2, "current_city": "Houston", "transportation": "-", "breakfast": "Chawla's\u5b8a, Houston", "attraction": "Space Center Houston, Houston;Houston Museum of Natural Science, Houston;Houston Zoo, Houston;", "lunch": "Istanbul Restaurant, Houston", "dinner": "Royal Mart, Houston", "accommodation": "Superhost 3 bedroom DISCOUNT, Houston"}, {"day": 3, "current_city": "from Houston to Austin", "transportation": "Flight Number: F3838099, from Houston to Austin, Departure Time: 09:47, Arrival Time: 10:52", "breakfast": "Earthen Spices, Houston", "attraction": "Texas Capitol, Austin;Zilker Metropolitan Park, Austin;Museum of the Weird, Austin;", "lunch": "Wildflour Cafe + Bakery, Austin", "dinner": "The Kasbah, Austin", "accommodation": "Cozy room in south Harlem - 10 mins to Columbia, Austin"}, {"day": 4, "current_city": "Austin", "transportation": "-", "breakfast": "Mehfil-e-Handi, Austin", "attraction": "Bullock Texas State History Museum, Austin;McKinney Falls State Park, Austin;Austin Aquarium, Austin;", "lunch": "Tandoori Nights, Austin", "dinner": "Cup-a-licious, Austin", "accommodation": "Cozy room in south Harlem - 10 mins to Columbia, Austin"}, {"day": 5, "current_city": "from Austin to Dallas", "transportation": "Flight Number: F3601654, from Austin to Dallas, Departure Time: 11:43, Arrival Time: 12:36", "breakfast": "Chin Pokli, Austin", "attraction": "The Dallas World Aquarium, Dallas;The Sixth Floor Museum at Dealey Plaza, Dallas;Dallas Museum of Art, Dallas;", "lunch": "Drifters Cafe, Dallas", "dinner": "Coconuts Fish Cafe, Dallas", "accommodation": "Take it now you won't find better, Dallas"}, {"day": 6, "current_city": "Dallas", "transportation": "-", "breakfast": "Cafe Gatherings, Dallas", "attraction": "Reunion Tower, Dallas;The Dallas Arboretum and Botanical Garden, Dallas;Klyde Warren Park, Dallas;", "lunch": "Yanki Sizzlers, Dallas", "dinner": "L'Opera, Dallas", "accommodation": "Take it now you won't find better, Dallas"}, {"day": 7, "current_city": "from Dallas to Palm Springs", "transportation": "Flight Number: F3673984, from Dallas to Palm Springs, Departure Time: 08:41, Arrival Time: 10:04", "breakfast": "Cafe Coffee Day, Dallas", "attraction": "-", "lunch": "-", "dinner": "-", "accommodation": "-"}]}]