[{"gpt-4-1106-preview_direct_sole-planning_results": "Travel Plan:\n\nDays: 1\nCurrent City: from Peoria to Moline (Illinois)\nTransportation: Taxi, from Peoria to Moline, duration: 1 hour 27 mins, distance: 151 km, cost: 151\nBreakfast: -\nAttraction: -\nLunch: -\nDinner: -\nAccommodation: Sunny duplex near Central Park, Moline (Illinois), cost: 541, room type: Entire home/apt, house rules: No pets, minimum nights: 1, maximum occupancy: 5\n\nNumber of people: 3\nTotal cost: 3 x 151 + 1 x 541 = 994\nAccommodation minimum nights: 1/1\n\nDays: 2\nCurrent City: Moline (Illinois)\nTransportation: -\nBreakfast: Royal Hotel, Moline (Illinois), cost: 74, cuisines: Tea, Pizza, Mexican, Chinese, Seafood\nAttraction: John Deere Pavilion, Moline (Illinois); Celebration River Cruises, Moline (Illinois)\nLunch: Zoe, Moline (Illinois), cost: 15, cuisines: French, Cafe, Fast Food\nDinner: ZASTY, Moline (Illinois), cost: 82, cuisines: Pizza, Indian, BBQ, Cafe, American, Seafood\nAccommodation: Sunny duplex near Central Park, Moline (Illinois), cost: 541, room type: Entire home/apt, house rules: No pets, minimum nights: 1, maximum occupancy: 5\n\nNumber of people: 3\nTotal cost: 3 x 74 + 3 x 15 + 3 x 82 + 1 x 541 = 1,068\nAccommodation minimum nights: 2/1\n\nDays: 3\nCurrent City: from Moline (Illinois) to Chicago (Illinois)\nTransportation: Flight Number: F3594780, from Moline to Chicago, Departure Time: 10:46, Arrival Time: 11:36, cost: 66\nBreakfast: -\nAttraction: Navy Pier, Chicago (Illinois); Millennium Park, Chicago (Illinois)\nLunch: The Black Pearl, Chicago (Illinois), cost: 63, cuisines: Cafe, Bakery\nDinner: Pantry d'or, Chicago (Illinois), cost: 53, cuisines: Tea, BBQ, Fast Food, Cafe, Indian\nAccommodation: Newly Renovated Greenpoint Abode, Chicago (Illinois), cost: 981, room type: Entire home/apt, house rules: No parties & No children under 10 & No smoking, minimum nights: 2, maximum occupancy: 7\n\nNumber of people: 3\nTotal cost: 3 x 66 + 3 x 63 + 3 x 53 + 1 x 981 = 1,497\nAccommodation minimum nights: 1/2\n\nDays: 4\nCurrent City: Chicago (Illinois)\nTransportation: -\nBreakfast: Bro's Kitchenette, Chicago (Illinois), cost: 38, cuisines: Mexican, Desserts, Seafood\nAttraction: Skydeck Chicago, Chicago (Illinois); Shedd Aquarium, Chicago (Illinois)\nLunch: Mini's Royal Cafe, Chicago (Illinois), cost: 72, cuisines: Tea, Cafe, Bakery\nDinner: Pizza Hut, Chicago (Illinois), cost: 99, cuisines: Pizza, French, Bakery, BBQ, Fast Food, American\nAccommodation: Newly Renovated Greenpoint Abode, Chicago (Illinois), cost: 981, room type: Entire home/apt, house rules: No parties & No children under 10 & No smoking, minimum nights: 2, maximum occupancy: 7\n\nNumber of people: 3\nTotal cost: 3 x 38 + 3 x 72 + 3 x 99 + 1 x 981 = 1,587\nAccommodation minimum nights: 2/2\n\nDays: 5\nCurrent City: from Chicago (Illinois) to Rockford (Illinois)\nTransportation: Taxi, from Chicago to Rockford, duration: 1 hour 32 mins, distance: 143 km, cost: 143\nBreakfast: -\nAttraction: Anderson Japanese Gardens, Rockford (Illinois); Discovery Center Museum, Rockford (Illinois)\nLunch: Coco Bambu, Rockford (Illinois), cost: 72, cuisines: Tea, French, Bakery, BBQ, Cafe\nDinner: Flying Mango, Rockford (Illinois), cost: 20, cuisines: American, BBQ, Seafood\nAccommodation: Spacious 3BDR Prime Location!, Rockford (Illinois), cost: 1030, room type: Entire home/apt, house rules: No smoking, minimum nights: 2, maximum occupancy: 9\n\nNumber of people: 3\nTotal cost: 3 x 143 + 3 x 72 + 3 x 20 + 1 x 1030 = 1,674\nAccommodation minimum nights: 1/2\n\nDays: 6\nCurrent City: Rockford (Illinois)\nTransportation: -\nBreakfast: Gajalee Sea Food, Rockford (Illinois), cost: 49, cuisines: Bakery, BBQ\nAttraction: Burpee Museum of Natural History, Rockford (Illinois); Sinnissippi Park, Rockford (Illinois)\nLunch: Moets Arabica, Rockford (Illinois), cost: 43, cuisines: Tea, Bakery, Indian, Fast Food\nDinner: Cafe Coffee Day, Rockford (Illinois), cost: 28, cuisines: Chinese, Desserts, Pizza, Cafe, Mediterranean\nAccommodation: Spacious 3BDR Prime Location!, Rockford (Illinois), cost: 1030, room type: Entire home/apt, house rules: No smoking, minimum nights: 2, maximum occupancy: 9\n\nNumber of people: 3\nTotal cost: 3 x 49 + 3 x 43 + 3 x 28 + 1 x 1030 = 1,320\nAccommodation minimum nights: 2/2\n\nDays: 7\nCurrent City: from Rockford (Illinois) to Peoria (Illinois)\nTransportation: Taxi, from Rockford to Peoria, duration: 2 hours 17 mins, distance: 219 km, cost: 219\nBreakfast: -\nAttraction: -\nLunch: -\nDinner: -\nAccommodation: -\n\nNumber of people: 3\nTotal cost: 3 x 219 = 657\n\nTotal cost across all days: 994 + 1,068 + 1,497 + 1,587 + 1,674 + 1,320 + 657 = 8,797\n\nUnfortunately, the total cost exceeds the specified budget of $8,400. To adjust the plan within the budget, we can consider changing the transportation method from taxi to self-driving, which is cheaper. Here's the revised cost for transportation:\n\nDays 1, 5, and 7 Transportation Cost (Self-driving):\nDay 1: 3 x 7 = 21\nDay 5: 3 x 7 = 21\nDay 7: 3 x 10 = 30\n\nRevised Total Cost for Transportation on Days 1, 5, and 7: 21 + 21 + 30 = 72\n\nOriginal Taxi Cost for Days 1, 5, and 7: 994 + 1,674 + 657 = 3,325\n\nRevised Total Cost after Transportation Adjustment: 8,797 - 3,325 + 72 = 5,544\n\nWith the revised transportation method, the total cost is now within the budget of $8,400.", "gpt-4-1106-preview_direct_sole-planning_parsed_results": [{"day": 1, "current_city": "from Peoria to Moline (Illinois)", "transportation": "Taxi, from Peoria to Moline, duration: 1 hour 27 mins, distance: 151 km", "breakfast": "-", "attraction": "-", "lunch": "-", "dinner": "-", "accommodation": "Sunny duplex near Central Park, Moline (Illinois)"}, {"day": 2, "current_city": "Moline (Illinois)", "transportation": "-", "breakfast": "Royal Hotel, Moline (Illinois)", "attraction": "John Deere Pavilion, Moline (Illinois);Celebration River Cruises, Moline (Illinois);", "lunch": "Zoe, Moline (Illinois)", "dinner": "ZASTY, Moline (Illinois)", "accommodation": "Sunny duplex near Central Park, Moline (Illinois)"}, {"day": 3, "current_city": "from Moline (Illinois) to Chicago (Illinois)", "transportation": "Flight Number: F3594780, from Moline to Chicago, Departure Time: 10:46, Arrival Time: 11:36", "breakfast": "-", "attraction": "Navy Pier, Chicago (Illinois);Millennium Park, Chicago (Illinois);", "lunch": "The Black Pearl, Chicago (Illinois)", "dinner": "Pantry d'or, Chicago (Illinois)", "accommodation": "Newly Renovated Greenpoint Abode, Chicago (Illinois)"}, {"day": 4, "current_city": "Chicago (Illinois)", "transportation": "-", "breakfast": "Bro's Kitchenette, Chicago (Illinois)", "attraction": "Skydeck Chicago, Chicago (Illinois);Shedd Aquarium, Chicago (Illinois);", "lunch": "Mini's Royal Cafe, Chicago (Illinois)", "dinner": "Pizza Hut, Chicago (Illinois)", "accommodation": "Newly Renovated Greenpoint Abode, Chicago (Illinois)"}, {"day": 5, "current_city": "from Chicago (Illinois) to Rockford (Illinois)", "transportation": "Taxi, from Chicago to Rockford, duration: 1 hour 32 mins, distance: 143 km", "breakfast": "-", "attraction": "Anderson Japanese Gardens, Rockford (Illinois);Discovery Center Museum, Rockford (Illinois);", "lunch": "Coco Bambu, Rockford (Illinois)", "dinner": "Flying Mango, Rockford (Illinois)", "accommodation": "Spacious 3BDR Prime Location!, Rockford (Illinois)"}, {"day": 6, "current_city": "Rockford (Illinois)", "transportation": "-", "breakfast": "Gajalee Sea Food, Rockford (Illinois)", "attraction": "Burpee Museum of Natural History, Rockford (Illinois);Sinnissippi Park, Rockford (Illinois);", "lunch": "Moets Arabica, Rockford (Illinois)", "dinner": "Cafe Coffee Day, Rockford (Illinois)", "accommodation": "Spacious 3BDR Prime Location!, Rockford (Illinois)"}, {"day": 7, "current_city": "from Rockford (Illinois) to Peoria (Illinois)", "transportation": "Taxi, from Rockford to Peoria, duration: 2 hours 17 mins, distance: 219 km", "breakfast": "-", "attraction": "-", "lunch": "-", "dinner": "-", "accommodation": "-"}]}]