[{"gpt-4-1106-preview_direct_sole-planning_results": "Travel Plan:\n\nDays: 1\nCurrent City: from West Palm Beach to Atlanta\nTransportation: Flight Number: F3491626, from West Palm Beach to Atlanta, Departure Time: 13:56, Arrival Time: 16:02, cost: 137\nBreakfast: -\nAttraction: -\nLunch: -\nDinner: Saffron, Atlanta, cost: 39, cuisines: Tea, Cafe, Fast Food, Seafood\nAccommodation: FABULOUS SUNNY BEDROOM IN HARLEM, Atlanta, cost: 587, room type: Private room, house rules: No parties, minimum nights: 20, maximum occupancy: 2\n\nNumber of people: 1\nTotal cost: 1 x 137 + 1 x 39 + 1 x 587 = 763\nAccommodation minimum nights: 1/20\n\nDays: 2\nCurrent City: Atlanta\nTransportation: -\nBreakfast: Adda, Atlanta, cost: 22, cuisines: Tea, Mexican, Bakery\nAttraction: Georgia Aquarium, Atlanta; World of Coca-Cola, Atlanta; Centennial Olympic Park, Atlanta\nLunch: Baba Au Rhum, Atlanta, cost: 27, cuisines: Desserts, Pizza, Mexican, BBQ, Fast Food\nDinner: Asian Bistro, Atlanta, cost: 27, cuisines: Tea, Bakery, Seafood\nAccommodation: FABULOUS SUNNY BEDROOM IN HARLEM, Atlanta, cost: 587, room type: Private room, house rules: No parties, minimum nights: 20, maximum occupancy: 2\n\nNumber of people: 1\nTotal cost: 1 x 22 + 1 x 27 + 1 x 27 + 1 x 587 = 663\nAccommodation minimum nights: 2/20\n\nDays: 3\nCurrent City: from Atlanta to West Palm Beach\nTransportation: Flight Number: F3497203, from Atlanta to West Palm Beach, Departure Time: 19:42, Arrival Time: 21:36, cost: 121\nBreakfast: Ahata, Atlanta, cost: 17, cuisines: Tea, Indian, Desserts\nAttraction: Piedmont Park, Atlanta; High Museum of Art, Atlanta\nLunch: Chef Style, Atlanta, cost: 59, cuisines: Pizza, American, Desserts, Seafood\nDinner: -\nAccommodation: -\n\nNumber of people: 1\nTotal cost: 1 x 17 + 1 x 59 + 1 x 121 = 197\n\nTotal cost across all days: 763 + 663 + 197 = 1,623\n\nUnfortunately, the total cost of $1,623 exceeds the specified budget of $900. To adhere to the budget, we need to make adjustments:\n\nRevised Travel Plan:\n\nDays: 1\nCurrent City: from West Palm Beach to Atlanta\nTransportation: Self-driving, from West Palm Beach to Atlanta, duration: 8 hours 27 mins, distance: 963 km, cost: 48\nBreakfast: -\nAttraction: -\nLunch: -\nDinner: Ahata, Atlanta, cost: 17, cuisines: Tea, Indian, Desserts\nAccommodation: Spacious private room close St. Barnabas Hospital, Atlanta, cost: 144, room type: Private room, house rules: No smoking, minimum nights: 2, maximum occupancy: 1\n\nNumber of people: 1\nTotal cost: 1 x 48 + 1 x 17 + 1 x 144 = 209\nAccommodation minimum nights: 1/2\n\nDays: 2\nCurrent City: Atlanta\nTransportation: -\nBreakfast: Adda, Atlanta, cost: 22, cuisines: Tea, Mexican, Bakery\nAttraction: Georgia Aquarium, Atlanta; World of Coca-Cola, Atlanta\nLunch: Baba Au Rhum, Atlanta, cost: 27, cuisines: Desserts, Pizza, Mexican, BBQ, Fast Food\nDinner: Asian Bistro, Atlanta, cost: 27, cuisines: Tea, Bakery, Seafood\nAccommodation: Spacious private room close St. Barnabas Hospital, Atlanta, cost: 144, room type: Private room, house rules: No smoking, minimum nights: 2, maximum occupancy: 1\n\nNumber of people: 1\nTotal cost: 1 x 22 + 1 x 27 + 1 x 27 + 1 x 144 = 220\nAccommodation minimum nights: 2/2\n\nDays: 3\nCurrent City: from Atlanta to West Palm Beach\nTransportation: Self-driving, from Atlanta to West Palm Beach, duration: 8 hours 29 mins, distance: 962 km, cost: 48\nBreakfast: Shri Ram Restaurant, Atlanta, cost: 55, cuisines: Tea, Mexican, Indian, Fast Food\nAttraction: Piedmont Park, Atlanta; High Museum of Art, Atlanta\nLunch: -\nDinner: -\nAccommodation: -\n\nNumber of people: 1\nTotal cost: 1 x 48 + 1 x 55 = 103\n\nTotal cost across all days: 209 + 220 + 103 = 532\n\nCuisines: All restaurants selected offer a variety of cuisines as per availability.\nRoom Constraint: All accommodations selected are private rooms.\nTransportation Constraint: Only self-driving is used, which is within the budget constraints.\n\nThe revised travel plan stays within the budget of $900, with a total cost of $532.", "gpt-4-1106-preview_direct_sole-planning_parsed_results": [{"day": 1, "current_city": "from West Palm Beach to Atlanta", "transportation": "Self-driving, from West Palm Beach to Atlanta, duration: 8 hours 27 mins, distance: 963 km", "breakfast": "-", "attraction": "-", "lunch": "-", "dinner": "Ahata, Atlanta", "accommodation": "Spacious private room close St. Barnabas Hospital, Atlanta"}, {"day": 2, "current_city": "Atlanta", "transportation": "-", "breakfast": "Adda, Atlanta", "attraction": "Georgia Aquarium, Atlanta;World of Coca-Cola, Atlanta;", "lunch": "Baba Au Rhum, Atlanta", "dinner": "Asian Bistro, Atlanta", "accommodation": "Spacious private room close St. Barnabas Hospital, Atlanta"}, {"day": 3, "current_city": "from Atlanta to West Palm Beach", "transportation": "Self-driving, from Atlanta to West Palm Beach, duration: 8 hours 29 mins, distance: 962 km", "breakfast": "Shri Ram Restaurant, Atlanta", "attraction": "Piedmont Park, Atlanta;High Museum of Art, Atlanta;", "lunch": "-", "dinner": "-", "accommodation": "-"}]}]