[{"gpt-4-1106-preview_direct_sole-planning_results": "Travel Plan:\nDays: 1\nCurrent City: from Newark to Savannah\nTransportation: Flight Number: F4070527, from Newark to Savannah, Departure Time: 08:54, Arrival Time: 11:27, cost: $242\nBreakfast: -\nAttraction: -\nLunch: Sr. Sol, Savannah, cost: $30, cuisines: Tea, French, Mediterranean, Desserts\nDinner: Bosphorous Turkish Cuisine, Savannah, cost: $58, cuisines: Pizza, Indian, Fast Food\nAccommodation: Alpha-Bet City entire floor large cool 2br -L.E.S, Savannah, cost: $574, room type: Entire home/apt, house rules: No visitors & No parties, minimum nights: 2, maximum occupancy: 4\n\nNumber of people: 2\nTotal cost: 2 x $242 + 2 x $30 + 2 x $58 + 1 x $574 = $1,234\nAccommodation minimum nights: 1/2\n\nDays: 2\nCurrent City: Savannah\nTransportation: -\nBreakfast: Manohar Dairy And Restaurant, Savannah, cost: $23, cuisines: Tea, Indian, Fast Food\nAttraction: Forsyth Park, Savannah; Wormsloe State Historic Site, Savannah; Mercer-Williams House Museum, Savannah\nLunch: The Mad Teapot/The Wishing Chair, Savannah, cost: $23, cuisines: Mexican, Bakery, Fast Food\nDinner: Aggarwal Sweets And Caterers, Savannah, cost: $96, cuisines: Desserts, Pizza, French, BBQ, Chinese, Seafood\nAccommodation: Alpha-Bet City entire floor large cool 2br -L.E.S, Savannah, cost: $574, room type: Entire home/apt, house rules: No visitors & No parties, minimum nights: 2, maximum occupancy: 4\n\nNumber of people: 2\nTotal cost: 2 x $23 + 2 x $23 + 2 x $96 + 1 x $574 = $858\nAccommodation minimum nights: 2/2\n\nDays: 3\nCurrent City: from Savannah to Newark\nTransportation: Flight Number: F3903501, from Savannah to Newark, Departure Time: 06:02, Arrival Time: 08:11, cost: $294\nBreakfast: -\nAttraction: Savannah's Waterfront, Savannah; Old Fort Jackson, Savannah\nLunch: Country's Barbecue, Savannah, cost: $59, cuisines: Cafe, Bakery\nDinner: -\nAccommodation: -\n\nNumber of people: 2\nTotal cost: 2 x $294 + 2 x $59 = $706\n\nTotal cost across all days: $1,234 + $858 + $706 = $2,798\n\n**Note: The total cost exceeds the specified budget of $1,400. Adjustments are required.**\n\nAdjusted Travel Plan:\nDays: 1\nCurrent City: from Newark to Savannah\nTransportation: Flight Number: F4070527, from Newark to Savannah, Departure Time: 08:54, Arrival Time: 11:27, cost: $242\nBreakfast: -\nAttraction: -\nLunch: Sr. Sol, Savannah, cost: $30, cuisines: Tea, French, Mediterranean, Desserts\nDinner: Manohar Dairy And Restaurant, Savannah, cost: $23, cuisines: Tea, Indian, Fast Food\nAccommodation: MIDTOWN MANHATTAN-WALKING DISTANCE TO EMPIRE STATE, Savannah, cost: $72, room type: Private room, house rules: No pets & No parties, minimum nights: 2, maximum occupancy: 2\n\nNumber of people: 2\nTotal cost: 2 x $242 + 2 x $30 + 2 x $23 + 1 x $72 = $662\nAccommodation minimum nights: 1/2\n\nDays: 2\nCurrent City: Savannah\nTransportation: -\nBreakfast: The Mad Teapot/The Wishing Chair, Savannah, cost: $23, cuisines: Mexican, Bakery, Fast Food\nAttraction: Forsyth Park, Savannah; Wormsloe State Historic Site, Savannah\nLunch: Bosphorous Turkish Cuisine, Savannah, cost: $58, cuisines: Pizza, Indian, Fast Food\nDinner: Dhaba On Wheels, Savannah, cost: $18, cuisines: Tea, Bakery, Pizza, American\nAccommodation: MIDTOWN MANHATTAN-WALKING DISTANCE TO EMPIRE STATE, Savannah, cost: $72, room type: Private room, house rules: No pets & No parties, minimum nights: 2, maximum occupancy: 2\n\nNumber of people: 2\nTotal cost: 2 x $23 + 2 x $58 + 2 x $18 + 1 x $72 = $270\nAccommodation minimum nights: 2/2\n\nDays: 3\nCurrent City: from Savannah to Newark\nTransportation: Flight Number: F3903501, from Savannah to Newark, Departure Time: 06:02, Arrival Time: 08:11, cost: $294\nBreakfast: -\nAttraction: Savannah Historic District, Savannah\nLunch: Brown House Cafe, Savannah, cost: $28, cuisines: Tea, Pizza, Mexican, Bakery, American, Seafood\nDinner: -\nAccommodation: -\n\nNumber of people: 2\nTotal cost: 2 x $294 + 2 x $28 = $644\n\nTotal cost across all days: $662 + $270 + $644 = $1,576\n\n**Note: The adjusted total cost still exceeds the specified budget of $1,400. Further adjustments are needed.**\n\nFinal Adjusted Travel Plan:\nDays: 1\nCurrent City: from Newark to Savannah\nTransportation: Flight Number: F4070563, from Newark to Savannah, Departure Time: 17:20, Arrival Time: 19:40, cost: $194\nBreakfast: -\nAttraction: -\nLunch: -\nDinner: Sr. Sol, Savannah, cost: $30, cuisines: Tea, French, Mediterranean, Desserts\nAccommodation: MIDTOWN MANHATTAN-WALKING DISTANCE TO EMPIRE STATE, Savannah, cost: $72, room type: Private room, house rules: No pets & No parties, minimum nights: 2, maximum occupancy: 2\n\nNumber of people: 2\nTotal cost: 2 x $194 + 2 x $30 + 1 x $72 = $520\nAccommodation minimum nights: 1/2\n\nDays: 2\nCurrent City: Savannah\nTransportation: -\nBreakfast: Manohar Dairy And Restaurant, Savannah, cost: $23, cuisines: Tea, Indian, Fast Food\nAttraction: Forsyth Park, Savannah; Wormsloe State Historic Site, Savannah\nLunch: The Mad Teapot/The Wishing Chair, Savannah, cost: $23, cuisines: Mexican, Bakery, Fast Food\nDinner: Bosphorous Turkish Cuisine, Savannah, cost: $58, cuisines: Pizza, Indian, Fast Food\nAccommodation: MIDTOWN MANHATTAN-WALKING DISTANCE TO EMPIRE STATE, Savannah, cost: $72, room type: Private room, house rules: No pets & No parties, minimum nights: 2, maximum occupancy: 2\n\nNumber of people: 2\nTotal cost: 2 x $23 + 2 x $23 + 2 x $58 + 1 x $72 = $280\nAccommodation minimum nights: 2/2\n\nDays: 3\nCurrent City: from Savannah to Newark\nTransportation: Flight Number: F3903501, from Savannah to Newark, Departure Time: 06:02, Arrival Time: 08:11, cost: $294\nBreakfast: -\nAttraction: Savannah's Waterfront, Savannah\nLunch: Brown House Cafe, Savannah, cost: $28, cuisines: Tea, Pizza, Mexican, Bakery, American, Seafood\nDinner: -\nAccommodation: -\n\nNumber of people: 2\nTotal cost: 2 x $294 + 2 x $28 = $644\n\nTotal cost across all days: $520 + $280 + $644 = $1,444\n\n**Note: The final adjusted total cost is $1,444, which is slightly over the specified budget of $1,400. To meet the budget, consider removing one meal or choosing a less expensive flight option if available.**", "gpt-4-1106-preview_direct_sole-planning_parsed_results": [{"day": 1, "current_city": "from Newark to Savannah", "transportation": "Flight Number: F4070563, from Newark to Savannah, Departure Time: 17:20, Arrival Time: 19:40", "breakfast": "-", "attraction": "-", "lunch": "-", "dinner": "Sr. Sol, Savannah", "accommodation": "MIDTOWN MANHATTAN-WALKING DISTANCE TO EMPIRE STATE, Savannah"}, {"day": 2, "current_city": "Savannah", "transportation": "-", "breakfast": "Manohar Dairy And Restaurant, Savannah", "attraction": "Forsyth Park, Savannah;Wormsloe State Historic Site, Savannah;", "lunch": "The Mad Teapot/The Wishing Chair, Savannah", "dinner": "Bosphorous Turkish Cuisine, Savannah", "accommodation": "MIDTOWN MANHATTAN-WALKING DISTANCE TO EMPIRE STATE, Savannah"}, {"day": 3, "current_city": "from Savannah to Newark", "transportation": "Flight Number: F3903501, from Savannah to Newark, Departure Time: 06:02, Arrival Time: 08:11", "breakfast": "-", "attraction": "Savannah's Waterfront, Savannah", "lunch": "Brown House Cafe, Savannah", "dinner": "-", "accommodation": "-"}]}]