[{"gpt-4-1106-preview_direct_sole-planning_results": "Travel Plan:\n\nDays: 1\nCurrent City: from Denver to Bozeman\nTransportation: Flight Number: F3826809, from Denver to Bozeman, Departure Time: 07:58, Arrival Time: 10:17, cost: 148\nBreakfast: -\nAttraction: -\nLunch: -\nDinner: -\nAccommodation: SPACIOUS STUDIO APT 3 IN PROSPECT LEFFERTS GARDENS, Bozeman, cost: 1060, maximum occupancy: 6, house rules: No children under 10 & No parties, minimum nights: 5\n\nNumber of people: 8\nTotal cost: 8 x 148 + 2 x 1060 = 2,784\nAccommodation minimum nights: 1/5\n\nDays: 2\nCurrent City: Bozeman\nTransportation: -\nBreakfast: Jiquitaia, Bozeman, cost: 36, cuisines: Tea, Pizza, American\nAttraction: Museum of the Rockies, Bozeman; Gallatin History Museum, Bozeman\nLunch: Saravana Bhavan, Bozeman, cost: 38, cuisines: Tea, American, Desserts\nDinner: Shree Bhog Pure Veg Restaurant, Bozeman, cost: 79, cuisines: Indian, BBQ, Fast Food\nAccommodation: SPACIOUS STUDIO APT 3 IN PROSPECT LEFFERTS GARDENS, Bozeman, cost: 1060, maximum occupancy: 6, house rules: No children under 10 & No parties, minimum nights: 5\n\nNumber of people: 8\nTotal cost: 8 x 36 + 8 x 38 + 8 x 79 + 2 x 1060 = 3,072\nAccommodation minimum nights: 2/5\n\nDays: 3\nCurrent City: from Bozeman to Denver\nTransportation: Flight Number: F3811654, from Bozeman to Denver, Departure Time: 18:26, Arrival Time: 20:06, cost: 190\nBreakfast: Today Pizza, Bozeman, cost: 27, cuisines: French, Bakery, BBQ, Fast Food, Cafe, Indian\nAttraction: American Computer & Robotics Museum, Bozeman; Bozeman Sculpture Park, Bozeman\nLunch: Indo Chinese, Bozeman, cost: 66, cuisines: Italian, BBQ, Bakery, Fast Food, Chinese, Seafood\nDinner: -\nAccommodation: -\n\nNumber of people: 8\nTotal cost: 8 x 27 + 8 x 66 + 8 x 190 = 2,264\n\nTotal cost across all days: 2,784 + 3,072 + 2,264 = 8,120\n\n**Note: The total cost exceeds the specified budget of $7,000. Adjustments are needed to meet the budget constraint.**\n\nAdjusted Travel Plan:\n\nDays: 1\nCurrent City: from Denver to Bozeman\nTransportation: Self-driving, from Denver to Bozeman, duration: 9 hours 54 mins, distance: 1,119 km, cost: 55\nBreakfast: -\nAttraction: -\nLunch: -\nDinner: -\nAccommodation: Sun-Filled Artist Loft in Private Townhouse, Bozeman, cost: 214, maximum occupancy: 2, house rules: No parties, minimum nights: 2\n\nNumber of people: 8\nTotal cost: 8 x 55 + 4 x 214 = 1,296\nAccommodation minimum nights: 1/2\n\nDays: 2\nCurrent City: Bozeman\nTransportation: -\nBreakfast: Jiquitaia, Bozeman, cost: 36, cuisines: Tea, Pizza, American\nAttraction: Museum of the Rockies, Bozeman; Gallatin History Museum, Bozeman\nLunch: Saravana Bhavan, Bozeman, cost: 38, cuisines: Tea, American, Desserts\nDinner: Shree Bhog Pure Veg Restaurant, Bozeman, cost: 79, cuisines: Indian, BBQ, Fast Food\nAccommodation: Sun-Filled Artist Loft in Private Townhouse, Bozeman, cost: 214, maximum occupancy: 2, house rules: No parties, minimum nights: 2\n\nNumber of people: 8\nTotal cost: 8 x 36 + 8 x 38 + 8 x 79 + 4 x 214 = 2,584\nAccommodation minimum nights: 2/2\n\nDays: 3\nCurrent City: from Bozeman to Denver\nTransportation: Self-driving, from Bozeman to Denver, duration: 9 hours 46 mins, distance: 1,115 km, cost: 55\nBreakfast: Today Pizza, Bozeman, cost: 27, cuisines: French, Bakery, BBQ, Fast Food, Cafe, Indian\nAttraction: American Computer & Robotics Museum, Bozeman; Bozeman Sculpture Park, Bozeman\nLunch: Indo Chinese, Bozeman, cost: 66, cuisines: Italian, BBQ, Bakery, Fast Food, Chinese, Seafood\nDinner: -\nAccommodation: -\n\nNumber of people: 8\nTotal cost: 8 x 27 + 8 x 66 + 8 x 55 = 1,184\n\nTotal cost across all days: 1,296 + 2,584 + 1,184 = 5,064\n\nCuisines: The selected restaurants offer American and Indian cuisines as specified.\nRoom Constraint: All accommodations selected are entire rooms, ensuring privacy for the group of 8.\nTransportation Constraint: Self-driving is used for transportation, which is within the budget and meets the group's needs.\nHouse Rules: Accommodations selected meet the house rules specified in the query.\n\n**The adjusted travel plan meets the budget constraint of $7,000 with a total cost of $5,064.**", "gpt-4-1106-preview_direct_sole-planning_parsed_results": [{"day": 1, "current_city": "from Denver to Bozeman", "transportation": "Self-driving, from Denver to Bozeman, duration: 9 hours 54 mins, distance: 1,119 km", "breakfast": "-", "attraction": "-", "lunch": "-", "dinner": "-", "accommodation": "Sun-Filled Artist Loft in Private Townhouse, Bozeman"}, {"day": 2, "current_city": "Bozeman", "transportation": "-", "breakfast": "Jiquitaia, Bozeman", "attraction": "Museum of the Rockies, Bozeman;Gallatin History Museum, Bozeman;", "lunch": "Saravana Bhavan, Bozeman", "dinner": "Shree Bhog Pure Veg Restaurant, Bozeman", "accommodation": "Sun-Filled Artist Loft in Private Townhouse, Bozeman"}, {"day": 3, "current_city": "from Bozeman to Denver", "transportation": "Self-driving, from Bozeman to Denver, duration: 9 hours 46 mins, distance: 1,115 km", "breakfast": "Today Pizza, Bozeman", "attraction": "American Computer & Robotics Museum, Bozeman;Bozeman Sculpture Park, Bozeman;", "lunch": "Indo Chinese, Bozeman", "dinner": "-", "accommodation": "-"}]}]