[{"gpt-4-1106-preview_direct_sole-planning_results": "Travel Plan:\n\nDays: 1\nCurrent City: from Houston to Pensacola\nTransportation: Taxi, from Houston to Pensacola, duration: 7 hours 38 mins, distance: 845 km, cost: 845\nBreakfast: -\nAttraction: -\nLunch: -\nDinner: Frog Hollow Tavern, Pensacola, cost: 20, cuisines: American, BBQ, Fast Food, Cafe, Indian\nAccommodation: Chic Historic Harlem Brownstone, Pensacola, cost: 526, room type: Entire home/apt, house rules: No smoking, minimum nights: 3, maximum occupancy: 2\n\nNumber of people: 2\nTotal cost: 1 x 845 (taxi) + 2 x 20 (dinner) + 1 x 526 (accommodation) = 1,411\nAccommodation minimum nights: 1/3\n\nNote: The total cost exceeds the budget on the first day due to the high taxi fare. To stay within budget, consider self-driving or finding alternative transportation.\n\nDays: 2\nCurrent City: Pensacola\nTransportation: -\nBreakfast: Berry Patch Restaurant, Pensacola, cost: 13, cuisines: Bakery, BBQ, Desserts, Seafood\nAttraction: Historic Pensacola Village, Pensacola; Pensacola Museum of Art, Pensacola\nLunch: Bailey's Bar-B-Que, Pensacola, cost: 13, cuisines: Tea, Bakery, Mediterranean\nDinner: Watershed Cafe, Pensacola, cost: 12, cuisines: Chinese, BBQ, Desserts\nAccommodation: Chic Historic Harlem Brownstone, Pensacola, cost: 526, room type: Entire home/apt, house rules: No smoking, minimum nights: 3, maximum occupancy: 2\n\nNumber of people: 2\nTotal cost: 2 x 13 (breakfast) + 2 x 13 (lunch) + 2 x 12 (dinner) + 1 x 526 (accommodation) = 602\nAccommodation minimum nights: 2/3\n\nDays: 3\nCurrent City: from Pensacola to Houston\nTransportation: Self-driving, from Pensacola to Houston, duration: 7 hours 37 mins, distance: 845 km, cost: 42\nBreakfast: Kalpana Restaurant, Pensacola, cost: 36, cuisines: Tea, Cafe, Bakery, American\nAttraction: Pensacola Lighthouse & Maritime Museum, Pensacola\nLunch: Chicago Pizza, Pensacola, cost: 32, cuisines: Pizza, Mediterranean, Fast Food\nDinner: -\nAccommodation: -\n\nNumber of people: 2\nTotal cost: 1 x 42 (self-driving) + 2 x 36 (breakfast) + 2 x 32 (lunch) = 178\n\nTotal cost across all days: 1,411 + 602 + 178 = 2,191\n\nCuisines: The prompt specifies no cuisines, so all cuisines constraints are satisfied.\nRoom Constraint: All accommodations selected are non-shared rooms that permit smoking, ensuring privacy and comfort for the group of 2.\nTransportation Constraint: The preferred mode of transportation is not flight-based; however, the taxi fare on the first day exceeds the budget. Self-driving is used on the return trip to reduce costs.\n\n***** Travel Plan Ends *****\n\nNote: The provided travel plan exceeds the specified budget of $1,100. To adhere to the budget, consider adjusting transportation methods or reducing accommodation costs. Additionally, the accommodation selected does not allow smoking, which does not meet the specified requirement. Please revise the plan accordingly to meet all constraints.", "gpt-4-1106-preview_direct_sole-planning_parsed_results": [{"day": 1, "current_city": "from Houston to Pensacola", "transportation": "Taxi, from Houston to Pensacola, duration: 7 hours 38 mins, distance: 845 km", "breakfast": "-", "attraction": "-", "lunch": "-", "dinner": "Frog Hollow Tavern, Pensacola", "accommodation": "Chic Historic Harlem Brownstone, Pensacola"}, {"day": 2, "current_city": "Pensacola", "transportation": "-", "breakfast": "Berry Patch Restaurant, Pensacola", "attraction": "Historic Pensacola Village, Pensacola;Pensacola Museum of Art, Pensacola;", "lunch": "Bailey's Bar-B-Que, Pensacola", "dinner": "Watershed Cafe, Pensacola", "accommodation": "Chic Historic Harlem Brownstone, Pensacola"}, {"day": 3, "current_city": "from Pensacola to Houston", "transportation": "Self-driving, from Pensacola to Houston, duration: 7 hours 37 mins, distance: 845 km", "breakfast": "Kalpana Restaurant, Pensacola", "attraction": "Pensacola Lighthouse & Maritime Museum, Pensacola", "lunch": "Chicago Pizza, Pensacola", "dinner": "-", "accommodation": "-"}]}]