[{"gpt-4-1106-preview_direct_sole-planning_results": "Travel Plan:\n\nDays: 1\nCurrent City: from Akron to Augusta (Georgia)\nTransportation: Taxi, from Akron to Augusta, duration: 9 hours 36 mins, distance: 1,031 km, cost: $1,031\nBreakfast: -\nAttraction: -\nLunch: -\nDinner: -\nAccommodation: Perfect Chanukah apartment for the whole crew!, Augusta (Georgia), cost: $451, room type: Entire home/apt, house rules: No pets, minimum nights: 11, maximum occupancy: 3\n\nNumber of people: 2\nTotal cost: 2 x $1,031 + 1 x $451 = $2,513\nAccommodation minimum nights: 1/11\n\nDays: 2\nCurrent City: Augusta (Georgia)\nTransportation: -\nBreakfast: B Merrell's, Augusta (Georgia), cost: $74, cuisines: Tea, Pizza, Desserts, Fast Food\nAttraction: Phinizy Swamp Nature Park, Augusta (Georgia); Augusta Riverwalk, Augusta (Georgia); Augusta Museum of History, Augusta (Georgia)\nLunch: Vinny Vanucchi's, Augusta (Georgia), cost: $45, cuisines: Desserts, Fast Food, Chinese, Indian, Seafood\nDinner: Asian Bistro, Augusta (Georgia), cost: $27, cuisines: Tea, Bakery, Seafood\nAccommodation: Perfect Chanukah apartment for the whole crew!, Augusta (Georgia), cost: $451, room type: Entire home/apt, house rules: No pets, minimum nights: 11, maximum occupancy: 3\n\nNumber of people: 2\nTotal cost: 2 x $74 + 2 x $45 + 2 x $27 + 1 x $451 = $743\nAccommodation minimum nights: 2/11\n\nDays: 3\nCurrent City: from Augusta to Decatur (Georgia)\nTransportation: Taxi, from Augusta to Decatur, duration: 2 hours 19 mins, distance: 229 km, cost: $229\nBreakfast: Fish Tales Lakeside Grille, Augusta (Georgia), cost: $37, cuisines: Tea, Cafe, Bakery, Desserts\nAttraction: Augusta Canal National Heritage Area, Augusta (Georgia)\nLunch: The Charcoal Chimney, Augusta (Georgia), cost: $86, cuisines: Tea, Fast Food, BBQ, Italian\nDinner: -\nAccommodation: The Heart of the Lower East Side!, Decatur (Georgia), cost: $587, room type: Entire home/apt, house rules: No children under 10, minimum nights: 2, maximum occupancy: 2\n\nNumber of people: 2\nTotal cost: 2 x $229 + 2 x $37 + 2 x $86 + 1 x $587 = $1,291\nAccommodation minimum nights: 1/2\n\nDays: 4\nCurrent City: Decatur (Georgia)\nTransportation: -\nBreakfast: Madhuban Restaurant - Welcome Hotel Rama International, Decatur (Georgia), cost: $47, cuisines: Pizza, Bakery, Seafood\nAttraction: DeKalb History Center Museum, Decatur (Georgia); Glenlake Park, Decatur (Georgia); Clyde Shepherd Nature Preserve, Decatur (Georgia)\nLunch: Tandoori Hut, Decatur (Georgia), cost: $82, cuisines: Pizza, American, Indian, Fast Food\nDinner: Cafe Coffee Day, Decatur (Georgia), cost: $46, cuisines: Tea, Cafe, BBQ, Mediterranean\nAccommodation: The Heart of the Lower East Side!, Decatur (Georgia), cost: $587, room type: Entire home/apt, house rules: No children under 10, minimum nights: 2, maximum occupancy: 2\n\nNumber of people: 2\nTotal cost: 2 x $47 + 2 x $82 + 2 x $46 + 1 x $587 = $937\nAccommodation minimum nights: 2/2\n\nDays: 5\nCurrent City: from Decatur to Atlanta (Georgia)\nTransportation: Taxi, from Decatur to Atlanta, duration: 19 mins, distance: 13.0 km, cost: $13\nBreakfast: Joey's Pizza, Decatur (Georgia), cost: $69, cuisines: Tea, Pizza, Bakery, Chinese, Seafood\nAttraction: Decatur Square, Decatur (Georgia); Mason Mill Park, Decatur (Georgia)\nLunch: Dawat-E-Chaman, Decatur (Georgia), cost: $42, cuisines: Chinese, BBQ, Fast Food, Cafe, Mediterranean\nDinner: -\nAccommodation: Bright, Modern, Clean, Spacious, Brooklyn Home, Atlanta (Georgia), cost: $1,034, room type: Entire home/apt, house rules: No children under 10, minimum nights: 3, maximum occupancy: 4\n\nNumber of people: 2\nTotal cost: 2 x $13 + 2 x $69 + 2 x $42 + 1 x $1,034 = $1,282\nAccommodation minimum nights: 1/3\n\nDays: 6\nCurrent City: Atlanta (Georgia)\nTransportation: -\nBreakfast: Saffron, Atlanta (Georgia), cost: $39, cuisines: Tea, Cafe, Fast Food, Seafood\nAttraction: Atlanta Botanical Garden, Atlanta (Georgia); World of Coca-Cola, Atlanta (Georgia); Georgia Aquarium, Atlanta (Georgia)\nLunch: Adda, Atlanta (Georgia), cost: $22, cuisines: Tea, Mexican, Bakery\nDinner: Baba Au Rhum, Atlanta (Georgia), cost: $27, cuisines: Desserts, Pizza, Mexican, BBQ, Fast Food\nAccommodation: Bright, Modern, Clean, Spacious, Brooklyn Home, Atlanta (Georgia), cost: $1,034, room type: Entire home/apt, house rules: No children under 10, minimum nights: 3, maximum occupancy: 4\n\nNumber of people: 2\nTotal cost: 2 x $39 + 2 x $22 + 2 x $27 + 1 x $1,034 = $1,210\nAccommodation minimum nights: 2/3\n\nDays: 7\nCurrent City: from Atlanta to Akron\nTransportation: Taxi, from Atlanta to Akron, duration: 10 hours 10 mins, distance: 1,114 km, cost: $1,114\nBreakfast: Asian Bistro, Atlanta (Georgia), cost: $27, cuisines: Tea, Bakery, Seafood\nAttraction: Piedmont Park, Atlanta (Georgia); High Museum of Art, Atlanta (Georgia)\nLunch: Chef Style, Atlanta (Georgia), cost: $59, cuisines: Pizza, American, Desserts, Seafood\nDinner: -\nAccommodation: -\n\nNumber of people: 2\nTotal cost: 2 x $1,114 + 2 x $27 + 2 x $59 = $2,370\n\nTotal cost across all days: $2,513 + $743 + $1,291 + $937 + $1,282 + $1,210 + $2,370 = $10,346\n\nCuisines: The plan includes American and Chinese cuisine options for meals.\nRoom Constraint: All accommodations selected are entire homes that meet the specified room type constraints.\nTransportation Constraint: All inter-city travel is managed via taxi, as there are no available flights for the specified dates and routes.\n\nNote: The total cost of the travel plan ($10,346) exceeds the specified budget of $8,900. Adjustments to the plan, such as choosing more budget-friendly accommodations or transportation options, would be necessary to meet the budget constraint.", "gpt-4-1106-preview_direct_sole-planning_parsed_results": [{"day": 1, "current_city": "from Akron to Augusta", "transportation": "Taxi, from Akron to Augusta, duration: 9 hours 36 mins, distance: 1,031 km", "breakfast": "-", "attraction": "-", "lunch": "-", "dinner": "-", "accommodation": "Perfect Chanukah apartment for the whole crew!, Augusta"}, {"day": 2, "current_city": "Augusta", "transportation": "-", "breakfast": "B Merrell's, Augusta", "attraction": "Phinizy Swamp Nature Park, Augusta;Augusta Riverwalk, Augusta;Augusta Museum of History, Augusta;", "lunch": "Vinny Vanucchi's, Augusta", "dinner": "Asian Bistro, Augusta", "accommodation": "Perfect Chanukah apartment for the whole crew!, Augusta"}, {"day": 3, "current_city": "from Augusta to Decatur", "transportation": "Taxi, from Augusta to Decatur, duration: 2 hours 19 mins, distance: 229 km", "breakfast": "Fish Tales Lakeside Grille, Augusta", "attraction": "Augusta Canal National Heritage Area, Augusta", "lunch": "The Charcoal Chimney, Augusta", "dinner": "-", "accommodation": "The Heart of the Lower East Side!, Decatur"}, {"day": 4, "current_city": "Decatur", "transportation": "-", "breakfast": "Madhuban Restaurant - Welcome Hotel Rama International, Decatur", "attraction": "DeKalb History Center Museum, Decatur;Glenlake Park, Decatur;Clyde Shepherd Nature Preserve, Decatur;", "lunch": "Tandoori Hut, Decatur", "dinner": "Cafe Coffee Day, Decatur", "accommodation": "The Heart of the Lower East Side!, Decatur"}, {"day": 5, "current_city": "from Decatur to Atlanta", "transportation": "Taxi, from Decatur to Atlanta, duration: 19 mins, distance: 13.0 km", "breakfast": "Joey's Pizza, Decatur", "attraction": "Decatur Square, Decatur;Mason Mill Park, Decatur;", "lunch": "Dawat-E-Chaman, Decatur", "dinner": "-", "accommodation": "Bright, Modern, Clean, Spacious, Brooklyn Home, Atlanta"}, {"day": 6, "current_city": "Atlanta", "transportation": "-", "breakfast": "Saffron, Atlanta", "attraction": "Atlanta Botanical Garden, Atlanta;World of Coca-Cola, Atlanta;Georgia Aquarium, Atlanta;", "lunch": "Adda, Atlanta", "dinner": "Baba Au Rhum, Atlanta", "accommodation": "Bright, Modern, Clean, Spacious, Brooklyn Home, Atlanta"}, {"day": 7, "current_city": "from Atlanta to Akron", "transportation": "Taxi, from Atlanta to Akron, duration: 10 hours 10 mins, distance: 1,114 km", "breakfast": "Asian Bistro, Atlanta", "attraction": "Piedmont Park, Atlanta;High Museum of Art, Atlanta", "lunch": "Chef Style, Atlanta", "dinner": "-", "accommodation": "-"}]}]