[{"gpt-4-1106-preview_direct_sole-planning_results": "Travel Plan:\n\nDays: 1\nCurrent City: from Medford to Grand Junction (Colorado)\nTransportation: Self-driving, from Medford to Grand Junction, duration: 15 hours 49 mins, distance: 1,640 km, cost: 82\nBreakfast: -\nAttraction: -\nLunch: -\nDinner: -\nAccommodation: NYC Apartment near Central Park!, Grand Junction (Colorado), cost: 1118, room type: Entire home/apt, house rules: No children under 10, minimum nights: 3, maximum occupancy: 5\n\nNumber of people: 1\nTotal cost: 1 x 82 + 1 x 1118 = 1,200\nAccommodation minimum nights: 1/3\n\nDays: 2\nCurrent City: Grand Junction (Colorado)\nTransportation: -\nBreakfast: Austin's BBQ and Oyster Bar, Grand Junction (Colorado), cost: 15, cuisines: Tea, Bakery, Fast Food, Indian, Seafood\nAttraction: Museum of the West, Museums of Western Colorado, Grand Junction (Colorado); Eureka! McConnell Science Museum, Grand Junction (Colorado)\nLunch: 2 Dog, Grand Junction (Colorado), cost: 29, cuisines: Desserts, BBQ, Fast Food, Cafe, American\nDinner: Thakur Bakers, Grand Junction (Colorado), cost: 100, cuisines: French, Pizza, Cafe, BBQ\nAccommodation: NYC Apartment near Central Park!, Grand Junction (Colorado), cost: 1118, room type: Entire home/apt, house rules: No children under 10, minimum nights: 3, maximum occupancy: 5\n\nNumber of people: 1\nTotal cost: 1 x 15 + 1 x 29 + 1 x 100 + 1 x 1118 = 1,262\nAccommodation minimum nights: 2/3\n\nDays: 3\nCurrent City: from Grand Junction (Colorado) to Durango (Colorado)\nTransportation: Self-driving, from Grand Junction to Durango, duration: 3 hours 33 mins, distance: 269 km, cost: 13\nBreakfast: -\nAttraction: -\nLunch: -\nDinner: -\nAccommodation: UES studio walking distance to central park, Durango (Colorado), cost: 997, room type: Entire home/apt, house rules: No pets, minimum nights: 7, maximum occupancy: 6\n\nNumber of people: 1\nTotal cost: 1 x 13 + 1 x 997 = 1,010\nAccommodation minimum nights: 1/7\n\nDays: 4\nCurrent City: Durango (Colorado)\nTransportation: -\nBreakfast: Samurai Japanese Cuisine & Sushi Bar, Durango (Colorado), cost: 67, cuisines: Bakery, Desserts, Fast Food\nAttraction: Animas Museum, Durango (Colorado); The Powerhouse, Durango (Colorado)\nLunch: Dub's High on the Hog, Durango (Colorado), cost: 98, cuisines: Tea, Italian, French, Cafe, Seafood\nDinner: Standard Chicken Point, Durango (Colorado), cost: 50, cuisines: Mexican, Indian, BBQ, Seafood\nAccommodation: UES studio walking distance to central park, Durango (Colorado), cost: 997, room type: Entire home/apt, house rules: No pets, minimum nights: 7, maximum occupancy: 6\n\nNumber of people: 1\nTotal cost: 1 x 67 + 1 x 98 + 1 x 50 + 1 x 997 = 1,212\nAccommodation minimum nights: 2/7\n\nDays: 5\nCurrent City: from Durango (Colorado) to Gunnison (Colorado)\nTransportation: Self-driving, from Durango to Gunnison, duration: 3 hours 47 mins, distance: 275 km, cost: 13\nBreakfast: -\nAttraction: -\nLunch: -\nDinner: -\nAccommodation: Full-size loft bed in East Village, Gunnison (Colorado), cost: 104, room type: Private room, house rules: No visitors & No pets & No parties, minimum nights: 1, maximum occupancy: 1\n\nNumber of people: 1\nTotal cost: 1 x 13 + 1 x 104 = 117\nAccommodation minimum nights: 1/1\n\nDays: 6\nCurrent City: Gunnison (Colorado)\nTransportation: -\nBreakfast: Happy Joe's Pizza & Ice Cream, Gunnison (Colorado), cost: 74, cuisines: Desserts, Italian, Bakery, Indian, Seafood\nAttraction: I.O.O.F. Park, Gunnison (Colorado); Jorgensen Park, Gunnison (Colorado)\nLunch: SALT, Gunnison (Colorado), cost: 44, cuisines: Tea, Chinese, BBQ\nDinner: Mocha, Gunnison (Colorado), cost: 30, cuisines: Tea, Cafe, Pizza, BBQ\nAccommodation: Full-size loft bed in East Village, Gunnison (Colorado), cost: 104, room type: Private room, house rules: No visitors & No pets & No parties, minimum nights: 1, maximum occupancy: 1\n\nNumber of people: 1\nTotal cost: 1 x 74 + 1 x 44 + 1 x 30 + 1 x 104 = 252\nAccommodation minimum nights: 2/1\n\nDays: 7\nCurrent City: from Gunnison (Colorado) to Medford\nTransportation: Self-driving, from Gunnison to Medford, duration: 18 hours 4 mins, distance: 1,832 km, cost: 91\nBreakfast: -\nAttraction: -\nLunch: -\nDinner: -\nAccommodation: -\n\nNumber of people: 1\nTotal cost: 1 x 91 = 91\n\nTotal cost across all days: 1,200 + 1,262 + 1,010 + 1,212 + 117 + 252 + 91 = 5,144\n\nUnfortunately, the total cost of $5,144 exceeds the specified budget of $2,400. Adjustments must be made to the travel plan to meet the budget constraints. This could involve changing accommodations to more affordable options, reducing meal costs, or altering the itinerary to visit fewer attractions or cities.", "gpt-4-1106-preview_direct_sole-planning_parsed_results": [{"day": 1, "current_city": "from Medford to Grand Junction (Colorado)", "transportation": "Self-driving, from Medford to Grand Junction, duration: 15 hours 49 mins, distance: 1,640 km", "breakfast": "-", "attraction": "-", "lunch": "-", "dinner": "-", "accommodation": "NYC Apartment near Central Park!, Grand Junction (Colorado)"}, {"day": 2, "current_city": "Grand Junction (Colorado)", "transportation": "-", "breakfast": "Austin's BBQ and Oyster Bar, Grand Junction (Colorado)", "attraction": "Museum of the West, Museums of Western Colorado, Grand Junction (Colorado);Eureka! McConnell Science Museum, Grand Junction (Colorado);", "lunch": "2 Dog, Grand Junction (Colorado)", "dinner": "Thakur Bakers, Grand Junction (Colorado)", "accommodation": "NYC Apartment near Central Park!, Grand Junction (Colorado)"}, {"day": 3, "current_city": "from Grand Junction (Colorado) to Durango (Colorado)", "transportation": "Self-driving, from Grand Junction to Durango, duration: 3 hours 33 mins, distance: 269 km", "breakfast": "-", "attraction": "-", "lunch": "-", "dinner": "-", "accommodation": "UES studio walking distance to central park, Durango (Colorado)"}, {"day": 4, "current_city": "Durango (Colorado)", "transportation": "-", "breakfast": "Samurai Japanese Cuisine & Sushi Bar, Durango (Colorado)", "attraction": "Animas Museum, Durango (Colorado);The Powerhouse, Durango (Colorado);", "lunch": "Dub's High on the Hog, Durango (Colorado)", "dinner": "Standard Chicken Point, Durango (Colorado)", "accommodation": "UES studio walking distance to central park, Durango (Colorado)"}, {"day": 5, "current_city": "from Durango (Colorado) to Gunnison (Colorado)", "transportation": "Self-driving, from Durango to Gunnison, duration: 3 hours 47 mins, distance: 275 km", "breakfast": "-", "attraction": "-", "lunch": "-", "dinner": "-", "accommodation": "Full-size loft bed in East Village, Gunnison (Colorado)"}, {"day": 6, "current_city": "Gunnison (Colorado)", "transportation": "-", "breakfast": "Happy Joe's Pizza & Ice Cream, Gunnison (Colorado)", "attraction": "I.O.O.F. Park, Gunnison (Colorado);Jorgensen Park, Gunnison (Colorado);", "lunch": "SALT, Gunnison (Colorado)", "dinner": "Mocha, Gunnison (Colorado)", "accommodation": "Full-size loft bed in East Village, Gunnison (Colorado)"}, {"day": 7, "current_city": "from Gunnison (Colorado) to Medford", "transportation": "Self-driving, from Gunnison to Medford, duration: 18 hours 4 mins, distance: 1,832 km", "breakfast": "-", "attraction": "-", "lunch": "-", "dinner": "-", "accommodation": "-"}]}]