[{"gpt-4-1106-preview_direct_sole-planning_results": "Travel Plan:\n\nDays: 1\nCurrent City: from Jacksonville to Detroit (Michigan)\nTransportation: Flight Number: F3553781, from Jacksonville to Detroit, Departure Time: 12:10, Arrival Time: 14:15, cost: 178\nBreakfast: -\nAttraction: -\nLunch: -\nDinner: Southern Bliss Bakery, Detroit (Michigan), cost: 28, cuisines: Tea, BBQ, Desserts, Seafood\nAccommodation: Cozy 1 bedroom in the heart of Fort Greene, Detroit (Michigan), cost: 751, maximum occupancy: 6, house rules: No pets & No parties, minimum nights: 3\n\nNumber of people: 1\nTotal cost: 1 x 178 + 1 x 28 + 1 x 751 = 957\nAccommodation minimum nights: 1/3\n\nDays: 2\nCurrent City: Detroit (Michigan)\nTransportation: -\nBreakfast: A Dong Restaurant, Detroit (Michigan), cost: 40, cuisines: Tea, Cafe, Pizza\nAttraction: Detroit Institute of Arts, Detroit (Michigan); Detroit Historical Museum, Detroit (Michigan); Campus Martius Park, Detroit (Michigan)\nLunch: BMG - All Day Dining, Detroit (Michigan), cost: 15, cuisines: Desserts, Bakery, BBQ, Indian, Seafood\nDinner: Cafe And More, Detroit (Michigan), cost: 41, cuisines: Tea, Bakery, Italian\nAccommodation: Cozy 1 bedroom in the heart of Fort Greene, Detroit (Michigan), cost: 751, maximum occupancy: 6, house rules: No pets & No parties, minimum nights: 3\n\nNumber of people: 1\nTotal cost: 1 x 40 + 1 x 15 + 1 x 41 + 1 x 751 = 847\nAccommodation minimum nights: 2/3\n\nDays: 3\nCurrent City: from Detroit (Michigan) to Lansing (Michigan)\nTransportation: Flight Number: F3656087, from Detroit to Lansing, Departure Time: 10:10, Arrival Time: 10:46, cost: 27\nBreakfast: -\nAttraction: Motown Museum, Detroit (Michigan)\nLunch: Mitalis Kitchen, Detroit (Michigan), cost: 28, cuisines: Pizza, BBQ, Chinese, Mediterranean, Seafood\nDinner: Manuel's Bread Cafe, Lansing (Michigan), cost: 28, cuisines: French, Pizza, Seafood\nAccommodation: Brand New Amazing 1 Bedroom Best Location, Lansing (Michigan), cost: 1168, maximum occupancy: 8, house rules: No visitors & No children under 10 & No smoking, minimum nights: 30\n\nNumber of people: 1\nTotal cost: 1 x 27 + 1 x 28 + 1 x 28 + 1 x 1168 = 1251\nAccommodation minimum nights: 1/30\n\nDays: 4\nCurrent City: Lansing (Michigan)\nTransportation: -\nBreakfast: Tony's Italian Restaurant & Pizza, Lansing (Michigan), cost: 83, cuisines: Tea, Pizza, Indian, BBQ, American\nAttraction: Impression 5 Science Center, Lansing (Michigan); Potter Park Zoo, Lansing (Michigan); Michigan History Center, Lansing (Michigan)\nLunch: Front Street Brewery, Lansing (Michigan), cost: 25, cuisines: BBQ, Mediterranean, Desserts, Italian\nDinner: Huey's On The River, Lansing (Michigan), cost: 75, cuisines: Tea, French, Bakery, Fast Food, Cafe\nAccommodation: Brand New Amazing 1 Bedroom Best Location, Lansing (Michigan), cost: 1168, maximum occupancy: 8, house rules: No visitors & No children under 10 & No smoking, minimum nights: 30\n\nNumber of people: 1\nTotal cost: 1 x 83 + 1 x 25 + 1 x 75 + 1 x 1168 = 1351\nAccommodation minimum nights: 2/30\n\nDays: 5\nCurrent City: from Lansing (Michigan) to Jacksonville\nTransportation: Self-driving, from Lansing to Jacksonville, duration: 15 hours 55 mins, distance: 1,704 km, cost: 85\nBreakfast: Golden China, Lansing (Michigan), cost: 66, cuisines: Chinese, Indian, Cafe, BBQ\nAttraction: Hawk Island Park, Lansing (Michigan); Eli and Edythe Broad Art Museum, Lansing (Michigan)\nLunch: Nini's Kitchen, Lansing (Michigan), cost: 30, cuisines: Cafe, Mexican, Desserts\nDinner: -\nAccommodation: -\n\nNumber of people: 1\nTotal cost: 1 x 85 + 1 x 66 + 1 x 30 = 181\n\nTotal cost across all days: 957 + 847 + 1251 + 1351 + 181 = 4587\n\nCuisines: The prompt specifies no cuisines, so all cuisines constraints are satisfied.\nRoom Constraint: All accommodations selected are entire rooms, ensuring privacy and space for the solo traveler.\nTransportation Constraint: The travel plan includes flights and self-driving, as specified in the query.\nHouse Rules: Accommodations were chosen based on house rules that match the query requirements.\n\nPlease note that the accommodation in Lansing has a minimum stay of 30 nights, which is not ideal for a 5-day trip. However, due to the lack of other provided options that fit the constraints, this accommodation was selected to complete the travel plan within the budget.", "gpt-4-1106-preview_direct_sole-planning_parsed_results": [{"day": 1, "current_city": "from Jacksonville to Detroit", "transportation": "Flight Number: F3553781, from Jacksonville to Detroit, Departure Time: 12:10, Arrival Time: 14:15", "breakfast": "-", "attraction": "-", "lunch": "-", "dinner": "Southern Bliss Bakery, Detroit", "accommodation": "Cozy 1 bedroom in the heart of Fort Greene, Detroit"}, {"day": 2, "current_city": "Detroit", "transportation": "-", "breakfast": "A Dong Restaurant, Detroit", "attraction": "Detroit Institute of Arts, Detroit;Detroit Historical Museum, Detroit;Campus Martius Park, Detroit;", "lunch": "BMG - All Day Dining, Detroit", "dinner": "Cafe And More, Detroit", "accommodation": "Cozy 1 bedroom in the heart of Fort Greene, Detroit"}, {"day": 3, "current_city": "from Detroit to Lansing", "transportation": "Flight Number: F3656087, from Detroit to Lansing, Departure Time: 10:10, Arrival Time: 10:46", "breakfast": "-", "attraction": "Motown Museum, Detroit", "lunch": "Mitalis Kitchen, Detroit", "dinner": "Manuel's Bread Cafe, Lansing", "accommodation": "Brand New Amazing 1 Bedroom Best Location, Lansing"}, {"day": 4, "current_city": "Lansing", "transportation": "-", "breakfast": "Tony's Italian Restaurant & Pizza, Lansing", "attraction": "Impression 5 Science Center, Lansing;Potter Park Zoo, Lansing;Michigan History Center, Lansing;", "lunch": "Front Street Brewery, Lansing", "dinner": "Huey's On The River, Lansing", "accommodation": "Brand New Amazing 1 Bedroom Best Location, Lansing"}, {"day": 5, "current_city": "from Lansing to Jacksonville", "transportation": "Self-driving, from Lansing to Jacksonville, duration: 15 hours 55 mins, distance: 1,704 km", "breakfast": "Golden China, Lansing", "attraction": "Hawk Island Park, Lansing;Eli and Edythe Broad Art Museum, Lansing;", "lunch": "Nini's Kitchen, Lansing", "dinner": "-", "accommodation": "-"}]}]