[{"gpt-4-1106-preview_direct_sole-planning_results": "Travel Plan:\n\nDays: 1\nCurrent City: from Salt Lake City to Burbank\nTransportation: Flight Number: F3846241, from Salt Lake City to Burbank, Departure Time: 08:08, Arrival Time: 09:03, cost: 157\nBreakfast: -\nAttraction: -\nLunch: -\nDinner: -\nAccommodation: Pleasant 1 bedroom apartment in Harlem Brownstone, Burbank, cost: 500, maximum occupancy: 5, house rules: No parties & No smoking, minimum nights: 1\n\nNumber of people: 7\nTotal cost: 7 x 157 + 1 x 500 + 1 x 1143 (additional accommodation for 2 people) = 2,545\nAccommodation minimum nights: 1/1\n\nDays: 2\nCurrent City: Burbank\nTransportation: -\nBreakfast: Mellow Mushroom, Burbank, cost: 69, cuisines: Tea, Pizza, Mexican, Fast Food, Cafe, American\nAttraction: Warner Bros. Studio Tour Hollywood, Burbank; The Mystic Museum, Burbank\nLunch: Dawat-e-Nawab - Radisson Blu, Burbank, cost: 94, cuisines: Mexican, Bakery, Cafe, Indian, Seafood\nDinner: Tandoor Restaurant, Burbank, cost: 78, cuisines: Tea, Bakery, BBQ, Seafood\nAccommodation: Pleasant 1 bedroom apartment in Harlem Brownstone, Burbank, cost: 500, maximum occupancy: 5, house rules: No parties & No smoking, minimum nights: 1\n\nNumber of people: 7\nTotal cost: 7 x 69 + 7 x 94 + 7 x 78 + 1 x 500 + 1 x 1143 (additional accommodation for 2 people) = 3,087\nAccommodation minimum nights: 2/1\n\nDays: 3\nCurrent City: from Burbank to Salt Lake City\nTransportation: Flight Number: F3848172, from Burbank to Salt Lake City, Departure Time: 07:17, Arrival Time: 10:05, cost: 264\nBreakfast: -\nAttraction: -\nLunch: -\nDinner: -\nAccommodation: -\n\nNumber of people: 7\nTotal cost: 7 x 264 = 1,848\n\nTotal cost across all days: 2,545 + 3,087 + 1,848 = 7,480\n\nCuisines: The prompt specifies no cuisines, so all cuisines constraints are satisfied.\nRoom Constraint: All accommodations selected are entire rooms, ensuring privacy for the group of 7.\nTransportation Constraint: All travel between Salt Lake City and Burbank is managed via flights, as per the available data.\n\nPlease note that the cost for accommodations has been calculated based on the need to book an additional room due to the maximum occupancy limits. The total cost of the trip is within the specified budget of $7,600.", "gpt-4-1106-preview_direct_sole-planning_parsed_results": [{"day": 1, "current_city": "from Salt Lake City to Burbank", "transportation": "Flight Number: F3846241, from Salt Lake City to Burbank, Departure Time: 08:08, Arrival Time: 09:03", "breakfast": "-", "attraction": "-", "lunch": "-", "dinner": "-", "accommodation": "Pleasant 1 bedroom apartment in Harlem Brownstone, Burbank"}, {"day": 2, "current_city": "Burbank", "transportation": "-", "breakfast": "Mellow Mushroom, Burbank", "attraction": "Warner Bros. Studio Tour Hollywood, Burbank; The Mystic Museum, Burbank", "lunch": "Dawat-e-Nawab - Radisson Blu, Burbank", "dinner": "Tandoor Restaurant, Burbank", "accommodation": "Pleasant 1 bedroom apartment in Harlem Brownstone, Burbank"}, {"day": 3, "current_city": "from Burbank to Salt Lake City", "transportation": "Flight Number: F3848172, from Burbank to Salt Lake City, Departure Time: 07:17, Arrival Time: 10:05", "breakfast": "-", "attraction": "-", "lunch": "-", "dinner": "-", "accommodation": "-"}]}]