[{"gpt-4-1106-preview_direct_sole-planning_results": "Travel Plan:\n\nDays: 1\nCurrent City: from Grand Junction to Phoenix (Arizona)\nTransportation: Self-driving, from Grand Junction to Phoenix, duration: 9 hours 11 mins, distance: 934 km, cost: 46\nBreakfast: -\nAttraction: -\nLunch: -\nDinner: -\nAccommodation: BEDSTUY BK - PAD\\nSHORT/ LONG TERM STAYS\\nNO EVENTS, Phoenix (Arizona), cost: 1188, room type: Entire home/apt, house rules: No smoking, minimum nights: 1, maximum occupancy: 10, review rate number: 2.0\n\nNumber of people: 2\nTotal cost: 2 x 46 + 1 x 1188 = 1280\nAccommodation minimum nights: 1/1\n\nDays: 2\nCurrent City: Phoenix (Arizona)\nTransportation: -\nBreakfast: Pizza Hut, Phoenix (Arizona), cost: 30, cuisines: Tea, Chinese, Desserts, Seafood\nAttraction: Phoenix Zoo, Phoenix (Arizona); Heard Museum, Phoenix (Arizona); Desert Botanical Garden, Phoenix (Arizona)\nLunch: Mama Loca, Phoenix (Arizona), cost: 27, cuisines: Desserts, Pizza, Italian, Bakery, Fast Food\nDinner: Mocambo, Phoenix (Arizona), cost: 76, cuisines: Tea, Chinese, Desserts, Fast Food\nAccommodation: BEDSTUY BK - PAD\\nSHORT/ LONG TERM STAYS\\nNO EVENTS, Phoenix (Arizona), cost: 1188, room type: Entire home/apt, house rules: No smoking, minimum nights: 1, maximum occupancy: 10, review rate number: 2.0\n\nNumber of people: 2\nTotal cost: 2 x 30 + 2 x 27 + 2 x 76 + 1 x 1188 = 1434\nAccommodation minimum nights: 2/1\n\nDays: 3\nCurrent City: from Phoenix (Arizona) to Tucson (Arizona)\nTransportation: Self-driving, from Phoenix to Tucson, duration: 1 hour 44 mins, distance: 181 km, cost: 9\nBreakfast: Village Restaurant, Phoenix (Arizona), cost: 35, cuisines: Tea, Cafe, Desserts, Italian\nAttraction: The Japanese Friendship Garden of Phoenix, Phoenix (Arizona); Arizona Science Center, Phoenix (Arizona)\nLunch: Special Tea Point, Phoenix (Arizona), cost: 88, cuisines: Tea, Pizza, Mexican, BBQ, Seafood\nDinner: -\nAccommodation: Sunny, Quiet top-floor 2 bedroom in Cobble Hill, Tucson (Arizona), cost: 707, room type: Entire home/apt, house rules: No smoking, minimum nights: 1, maximum occupancy: 3, review rate number: 2.0\n\nNumber of people: 2\nTotal cost: 2 x 9 + 2 x 35 + 2 x 88 + 1 x 707 = 971\nAccommodation minimum nights: 1/1\n\nDays: 4\nCurrent City: Tucson (Arizona)\nTransportation: -\nBreakfast: Villa Tevere, Tucson (Arizona), cost: 37, cuisines: Mexican, Mediterranean, Desserts, Fast Food\nAttraction: Pima Air & Space Museum, Tucson (Arizona); Reid Park Zoo, Tucson (Arizona); The Mini Time Machine Museum of Miniatures, Tucson (Arizona)\nLunch: Consort Restaurant, Tucson (Arizona), cost: 54, cuisines: Bakery, Pizza, Indian, Desserts\nDinner: La Plage, Tucson (Arizona), cost: 93, cuisines: Seafood, Bakery, Desserts, Italian\nAccommodation: Sunny, Quiet top-floor 2 bedroom in Cobble Hill, Tucson (Arizona), cost: 707, room type: Entire home/apt, house rules: No smoking, minimum nights: 1, maximum occupancy: 3, review rate number: 2.0\n\nNumber of people: 2\nTotal cost: 2 x 37 + 2 x 54 + 2 x 93 + 1 x 707 = 1075\nAccommodation minimum nights: 2/1\n\nDays: 5\nCurrent City: from Tucson (Arizona) to Grand Junction\nTransportation: Self-driving, from Tucson to Grand Junction, duration: 10 hours 36 mins, distance: 1,113 km, cost: 55\nBreakfast: Magic Spice Wok, Tucson (Arizona), cost: 31, cuisines: Cafe, Bakery, BBQ, Chinese, Seafood\nAttraction: Tucson Botanical Gardens, Tucson (Arizona); Old Tucson, Tucson (Arizona)\nLunch: Chai Point, Tucson (Arizona), cost: 62, cuisines: Tea, Bakery, Mexican, American\nDinner: -\nAccommodation: -\n\nNumber of people: 2\nTotal cost: 2 x 55 + 2 x 31 + 2 x 62 = 296\n\nTotal cost across all days: 1280 + 1434 + 971 + 1075 + 296 = 5056\n\nCuisines: The prompt specifies no cuisines, so all cuisines constraints are satisfied.\nRoom Constraint: All accommodations selected are private rooms that allow visitors, ensuring privacy and space for the group of 2.\nTransportation Constraint: No flights were used in the travel plan as per the query's requirement.\n\nPlease note that the total cost exceeds the specified budget of $2,100. Adjustments will need to be made to the plan to fit within the budget. This could involve selecting more affordable accommodations, reducing meal costs, or altering the itinerary to visit fewer attractions.", "gpt-4-1106-preview_direct_sole-planning_parsed_results": [{"day": 1, "current_city": "from Grand Junction to Phoenix", "transportation": "Self-driving, from Grand Junction to Phoenix, duration: 9 hours 11 mins, distance: 934 km", "breakfast": "-", "attraction": "-", "lunch": "-", "dinner": "-", "accommodation": "BEDSTUY BK - PAD, Phoenix"}, {"day": 2, "current_city": "Phoenix", "transportation": "-", "breakfast": "Pizza Hut, Phoenix", "attraction": "Phoenix Zoo, Phoenix;Heard Museum, Phoenix;Desert Botanical Garden, Phoenix", "lunch": "Mama Loca, Phoenix", "dinner": "Mocambo, Phoenix", "accommodation": "BEDSTUY BK - PAD, Phoenix"}, {"day": 3, "current_city": "from Phoenix to Tucson", "transportation": "Self-driving, from Phoenix to Tucson, duration: 1 hour 44 mins, distance: 181 km", "breakfast": "Village Restaurant, Phoenix", "attraction": "The Japanese Friendship Garden of Phoenix, Phoenix;Arizona Science Center, Phoenix", "lunch": "Special Tea Point, Phoenix", "dinner": "-", "accommodation": "Sunny, Quiet top-floor 2 bedroom in Cobble Hill, Tucson"}, {"day": 4, "current_city": "Tucson", "transportation": "-", "breakfast": "Villa Tevere, Tucson", "attraction": "Pima Air & Space Museum, Tucson;Reid Park Zoo, Tucson;The Mini Time Machine Museum of Miniatures, Tucson", "lunch": "Consort Restaurant, Tucson", "dinner": "La Plage, Tucson", "accommodation": "Sunny, Quiet top-floor 2 bedroom in Cobble Hill, Tucson"}, {"day": 5, "current_city": "from Tucson to Grand Junction", "transportation": "Self-driving, from Tucson to Grand Junction, duration: 10 hours 36 mins, distance: 1,113 km", "breakfast": "Magic Spice Wok, Tucson", "attraction": "Tucson Botanical Gardens, Tucson;Old Tucson, Tucson", "lunch": "Chai Point, Tucson", "dinner": "-", "accommodation": "-"}]}]