[{"gpt-4-1106-preview_direct_sole-planning_results": "Travel Plan:\n\nDays: 1\nCurrent City: from Las Vegas to Twin Falls (Idaho)\nTransportation: Self-driving, from Las Vegas to Twin Falls, duration: 7 hours 32 mins, distance: 796 km, cost: 39\nBreakfast: -\nAttraction: -\nLunch: -\nDinner: -\nAccommodation: Charming studio, great location!!!, Twin Falls (Idaho), cost: 994, room type: Entire home/apt, house rules: No smoking & No pets, minimum nights: 2, maximum occupancy: 8\n\nNumber of people: 2\nTotal cost: 2 x 39 + 1 x 994 = 1,072\nAccommodation minimum nights: 1/2\n\nDays: 2\nCurrent City: Twin Falls (Idaho)\nTransportation: -\nBreakfast: The Bake Studio, Twin Falls (Idaho), cost: 23, cuisines: Tea, Pizza, Bakery, Fast Food, Mediterranean\nAttraction: Shoshone Falls Park, Twin Falls (Idaho); Snake River Canyon Rim Trail, Twin Falls (Idaho)\nLunch: Thai Paradise, Twin Falls (Idaho), cost: 87, cuisines: Fast Food, Indian, Desserts, Seafood\nDinner: Subway, Twin Falls (Idaho), cost: 77, cuisines: French, BBQ, Chinese, Seafood\nAccommodation: Charming studio, great location!!!, Twin Falls (Idaho), cost: 994, room type: Entire home/apt, house rules: No smoking & No pets, minimum nights: 2, maximum occupancy: 8\n\nNumber of people: 2\nTotal cost: 2 x 23 + 2 x 87 + 2 x 77 + 1 x 994 = 1,358\nAccommodation minimum nights: 2/2\n\nDays: 3\nCurrent City: from Twin Falls (Idaho) to Pocatello (Idaho)\nTransportation: Self-driving, from Twin Falls to Pocatello, duration: 1 hour 46 mins, distance: 183 km, cost: 9\nBreakfast: -\nAttraction: -\nLunch: -\nDinner: -\nAccommodation: Entire Modern Studio Apartment/Prime Location, Pocatello (Idaho), cost: 1109, room type: Entire home/apt, house rules: No parties & No smoking, minimum nights: 30, maximum occupancy: 5\n\nNumber of people: 2\nTotal cost: 2 x 9 + 1 x 1109 = 1,127\nAccommodation minimum nights: 1/30\n\nDays: 4\nCurrent City: Pocatello (Idaho)\nTransportation: -\nBreakfast: Deorio's, Pocatello (Idaho), cost: 59, cuisines: Tea, Bakery, Fast Food, Mediterranean, Seafood\nAttraction: Idaho Museum of Natural History, Pocatello (Idaho); Zoo Idaho, Pocatello (Idaho)\nLunch: Harvest Moon, Pocatello (Idaho), cost: 90, cuisines: Pizza, Fast Food\nDinner: 650 - The Global Kitchen, Pocatello (Idaho), cost: 83, cuisines: French, Bakery, Cafe\nAccommodation: Entire Modern Studio Apartment/Prime Location, Pocatello (Idaho), cost: 1109, room type: Entire home/apt, house rules: No parties & No smoking, minimum nights: 30, maximum occupancy: 5\n\nNumber of people: 2\nTotal cost: 2 x 59 + 2 x 90 + 2 x 83 + 1 x 1109 = 1,573\nAccommodation minimum nights: 2/30\n\nDays: 5\nCurrent City: from Pocatello (Idaho) to Boise (Idaho)\nTransportation: Self-driving, from Pocatello to Boise, duration: 3 hours 23 mins, distance: 377 km, cost: 18\nBreakfast: -\nAttraction: -\nLunch: -\nDinner: -\nAccommodation: Modern & Cozy 2 BR Private Apartment in Brooklyn, Boise (Idaho), cost: 843, room type: Entire home/apt, house rules: No children under 10, minimum nights: 2645, maximum occupancy: 7\n\nNumber of people: 2\nTotal cost: 2 x 18 + 1 x 843 = 879\nAccommodation minimum nights: 1/2645\n\nDays: 6\nCurrent City: Boise (Idaho)\nTransportation: -\nBreakfast: Gopala Hari, Boise (Idaho), cost: 28, cuisines: Tea, Pizza, Italian, Fast Food, Mediterranean, Seafood\nAttraction: Zoo Boise, Boise (Idaho); Idaho State Museum, Boise (Idaho)\nLunch: TGI Friday's, Boise (Idaho), cost: 33, cuisines: Cafe, Mexican, BBQ, Fast Food\nDinner: California Pizza Kitchen, Boise (Idaho), cost: 15, cuisines: Tea, BBQ, Fast Food, Chinese, Indian\nAccommodation: Modern & Cozy 2 BR Private Apartment in Brooklyn, Boise (Idaho), cost: 843, room type: Entire home/apt, house rules: No children under 10, minimum nights: 2645, maximum occupancy: 7\n\nNumber of people: 2\nTotal cost: 2 x 28 + 2 x 33 + 2 x 15 + 1 x 843 = 995\nAccommodation minimum nights: 2/2645\n\nDays: 7\nCurrent City: from Boise (Idaho) to Las Vegas\nTransportation: Self-driving, from Boise to Las Vegas, duration: 9 hours 30 mins, distance: 1,004 km, cost: 50\nBreakfast: -\nAttraction: -\nLunch: -\nDinner: -\nAccommodation: -\n\nNumber of people: 2\nTotal cost: 2 x 50 = 100\n\nTotal cost across all days: 1,072 + 1,358 + 1,127 + 1,573 + 879 + 995 + 100 = 7,104\n\nUnfortunately, the total cost of $7,104 exceeds the specified budget of $5,100. Adjustments need to be made to the plan to reduce costs. This could involve selecting more budget-friendly accommodations, reducing meal costs, or altering the itinerary to visit fewer cities.", "gpt-4-1106-preview_direct_sole-planning_parsed_results": [{"day": 1, "current_city": "from Las Vegas to Twin Falls", "transportation": "Self-driving, from Las Vegas to Twin Falls, duration: 7 hours 32 mins, distance: 796 km", "breakfast": "-", "attraction": "-", "lunch": "-", "dinner": "-", "accommodation": "Charming studio, great location!!!, Twin Falls"}, {"day": 2, "current_city": "Twin Falls", "transportation": "-", "breakfast": "The Bake Studio, Twin Falls", "attraction": "Shoshone Falls Park, Twin Falls;Snake River Canyon Rim Trail, Twin Falls", "lunch": "Thai Paradise, Twin Falls", "dinner": "Subway, Twin Falls", "accommodation": "Charming studio, great location!!!, Twin Falls"}, {"day": 3, "current_city": "from Twin Falls to Pocatello", "transportation": "Self-driving, from Twin Falls to Pocatello, duration: 1 hour 46 mins, distance: 183 km", "breakfast": "-", "attraction": "-", "lunch": "-", "dinner": "-", "accommodation": "Entire Modern Studio Apartment/Prime Location, Pocatello"}, {"day": 4, "current_city": "Pocatello", "transportation": "-", "breakfast": "Deorio's, Pocatello", "attraction": "Idaho Museum of Natural History, Pocatello;Zoo Idaho, Pocatello", "lunch": "Harvest Moon, Pocatello", "dinner": "650 - The Global Kitchen, Pocatello", "accommodation": "Entire Modern Studio Apartment/Prime Location, Pocatello"}, {"day": 5, "current_city": "from Pocatello to Boise", "transportation": "Self-driving, from Pocatello to Boise, duration: 3 hours 23 mins, distance: 377 km", "breakfast": "-", "attraction": "-", "lunch": "-", "dinner": "-", "accommodation": "Modern & Cozy 2 BR Private Apartment in Brooklyn, Boise"}, {"day": 6, "current_city": "Boise", "transportation": "-", "breakfast": "Gopala Hari, Boise", "attraction": "Zoo Boise, Boise;Idaho State Museum, Boise", "lunch": "TGI Friday's, Boise", "dinner": "California Pizza Kitchen, Boise", "accommodation": "Modern & Cozy 2 BR Private Apartment in Brooklyn, Boise"}, {"day": 7, "current_city": "from Boise to Las Vegas", "transportation": "Self-driving, from Boise to Las Vegas, duration: 9 hours 30 mins, distance: 1,004 km", "breakfast": "-", "attraction": "-", "lunch": "-", "dinner": "-", "accommodation": "-"}]}]