[{"gpt-4-1106-preview_direct_sole-planning_results": "Travel Plan:\n\nDays: 1\nCurrent City: from Little Rock to Houston (Texas)\nTransportation: Flight Number: F3926600, from Little Rock to Houston (Texas), Departure Time: 17:08, Arrival Time: 19:01, cost: 84\nBreakfast: -\nAttraction: -\nLunch: -\nDinner: Jalapenos, Houston (Texas), cost: 57, cuisines: Desserts, Tea, Cafe, Chinese, Seafood\nAccommodation: Superhost 3 bedroom DISCOUNT, Houston (Texas), cost: 746, maximum occupancy: 5, house rules: No pets, minimum nights: 1\n\nNumber of people: 1\nTotal cost: 1 x 84 + 1 x 57 + 1 x 746 = 887\nAccommodation minimum nights: 1/1\n\nDays: 2\nCurrent City: Houston (Texas)\nTransportation: -\nBreakfast: Sheetla Dhaba, Houston (Texas), cost: 35, cuisines: Desserts, Pizza, Bakery, American, Mediterranean\nAttraction: Space Center Houston, Houston (Texas); Houston Museum of Natural Science, Houston (Texas)\nLunch: Royal Mart, Houston (Texas), cost: 40, cuisines: Tea, Bakery, Cafe, Mediterranean, Seafood\nDinner: Matchbox, Houston (Texas), cost: 33, cuisines: Tea, Italian, Bakery, Fast Food, Seafood\nAccommodation: Superhost 3 bedroom DISCOUNT, Houston (Texas), cost: 746, maximum occupancy: 5, house rules: No pets, minimum nights: 1\n\nNumber of people: 1\nTotal cost: 1 x 35 + 1 x 40 + 1 x 33 + 1 x 746 = 854\nAccommodation minimum nights: 2/1\n\nDays: 3\nCurrent City: from Houston (Texas) to Dallas (Texas)\nTransportation: Flight Number: F4005154, from Houston (Texas) to Dallas (Texas), Departure Time: 08:10, Arrival Time: 09:12, cost: 43\nBreakfast: Earthen Spices, Houston (Texas), cost: 28, cuisines: Tea, Mexican, Bakery, BBQ, Fast Food\nAttraction: The Dallas World Aquarium, Dallas (Texas); The Sixth Floor Museum at Dealey Plaza, Dallas (Texas)\nLunch: Drifters Cafe, Dallas (Texas), cost: 21, cuisines: Tea, French, Mexican, Cafe, Seafood\nDinner: Cafe Hera Pheri, Dallas (Texas), cost: 18, cuisines: Cafe, Desserts\nAccommodation: Take it now you won't find better, Dallas (Texas), cost: 609, maximum occupancy: 4, house rules: No pets, minimum nights: 1\n\nNumber of people: 1\nTotal cost: 1 x 43 + 1 x 28 + 1 x 21 + 1 x 18 + 1 x 609 = 719\nAccommodation minimum nights: 1/1\n\nDays: 4\nCurrent City: Dallas (Texas)\nTransportation: -\nBreakfast: MONKS, Dallas (Texas), cost: 24, cuisines: Tea, Pizza, Cafe, Mediterranean, Seafood\nAttraction: Reunion Tower, Dallas (Texas); Dallas Museum of Art, Dallas (Texas)\nLunch: Salsa Mexican Grill, Dallas (Texas), cost: 63, cuisines: Desserts, BBQ, Bakery, Cafe, American\nDinner: Dem Karak\u00f6y, Dallas (Texas), cost: 44, cuisines: Pizza, Fast Food\nAccommodation: Take it now you won't find better, Dallas (Texas), cost: 609, maximum occupancy: 4, house rules: No pets, minimum nights: 1\n\nNumber of people: 1\nTotal cost: 1 x 24 + 1 x 63 + 1 x 44 + 1 x 609 = 740\nAccommodation minimum nights: 2/1\n\nDays: 5\nCurrent City: from Dallas (Texas) to Little Rock\nTransportation: Flight Number: F3592818, from Dallas (Texas) to Little Rock, Departure Time: 10:34, Arrival Time: 11:50, cost: 86\nBreakfast: Kolkata Biryani House, Dallas (Texas), cost: 11, cuisines: Tea, French, Cafe, Indian, Seafood\nAttraction: -\nLunch: -\nDinner: -\nAccommodation: -\n\nNumber of people: 1\nTotal cost: 1 x 86 + 1 x 11 = 97\n\nTotal cost across all days: 887 + 854 + 719 + 740 + 97 = 3,297\n\nCuisines: All restaurants selected offer a variety of cuisines, matching the requirement for diverse food options.\nRoom Constraint: All accommodations selected are entire rooms, ensuring privacy.\nTransportation Constraint: All inter-city travel is managed via flights, as self-driving is not planned.\nHouse Rules: Accommodations selected have \"No pets\" house rules, which is not a constraint in the query.\n\nThe total cost of the travel plan is $3,297, which is within the specified budget of $3,900.", "gpt-4-1106-preview_direct_sole-planning_parsed_results": [{"day": 1, "current_city": "from Little Rock to Houston", "transportation": "Flight Number: F3926600, from Little Rock to Houston, Departure Time: 17:08, Arrival Time: 19:01", "breakfast": "-", "attraction": "-", "lunch": "-", "dinner": "Jalapenos, Houston", "accommodation": "Superhost 3 bedroom DISCOUNT, Houston"}, {"day": 2, "current_city": "Houston", "transportation": "-", "breakfast": "Sheetla Dhaba, Houston", "attraction": "Space Center Houston, Houston; Houston Museum of Natural Science, Houston;", "lunch": "Royal Mart, Houston", "dinner": "Matchbox, Houston", "accommodation": "Superhost 3 bedroom DISCOUNT, Houston"}, {"day": 3, "current_city": "from Houston to Dallas", "transportation": "Flight Number: F4005154, from Houston to Dallas, Departure Time: 08:10, Arrival Time: 09:12", "breakfast": "Earthen Spices, Houston", "attraction": "The Dallas World Aquarium, Dallas; The Sixth Floor Museum at Dealey Plaza, Dallas;", "lunch": "Drifters Cafe, Dallas", "dinner": "Cafe Hera Pheri, Dallas", "accommodation": "Take it now you won't find better, Dallas"}, {"day": 4, "current_city": "Dallas", "transportation": "-", "breakfast": "MONKS, Dallas", "attraction": "Reunion Tower, Dallas; Dallas Museum of Art, Dallas;", "lunch": "Salsa Mexican Grill, Dallas", "dinner": "Dem Karak\u00f6y, Dallas", "accommodation": "Take it now you won't find better, Dallas"}, {"day": 5, "current_city": "from Dallas to Little Rock", "transportation": "Flight Number: F3592818, from Dallas to Little Rock, Departure Time: 10:34, Arrival Time: 11:50", "breakfast": "Kolkata Biryani House, Dallas", "attraction": "-", "lunch": "-", "dinner": "-", "accommodation": "-"}]}]