[{"gpt-4-1106-preview_direct_sole-planning_results": "Travel Plan:\n\nDays: 1\nCurrent City: from Sarasota to Philadelphia\nTransportation: Flight Number: F3797423, from Sarasota to Philadelphia, Departure Time: 11:54, Arrival Time: 14:46, cost: 289\nBreakfast: -\nAttraction: -\nLunch: -\nDinner: Red Ginger Sushi, Grill & Bar, Philadelphia (Pennsylvania), cost: 98, cuisines: Tea, Cafe, Indian, Fast Food\nAccommodation: Industrial Loft Living in NYC, Philadelphia (Pennsylvania), cost: 178, room type: Entire home/apt, house rules: No smoking, minimum nights: 4, maximum occupancy: 3\n\nNumber of people: 1\nTotal cost: 1 x 289 + 1 x 98 + 1 x 178 = 565\nAccommodation minimum nights: 1/4\n\nDays: 2\nCurrent City: Philadelphia\nTransportation: -\nBreakfast: Hong Kong Cafe, Philadelphia (Pennsylvania), cost: 47, cuisines: Tea, Pizza, Italian, BBQ, Cafe\nAttraction: The Franklin Institute, Philadelphia (Pennsylvania); Liberty Bell, Philadelphia (Pennsylvania); Philadelphia's Magic Gardens, Philadelphia (Pennsylvania)\nLunch: Marukame Udon, Philadelphia (Pennsylvania), cost: 100, cuisines: Tea, Pizza, Italian, BBQ, Fast Food, Chinese\nDinner: Pind Balluchi, Philadelphia (Pennsylvania), cost: 44, cuisines: Desserts, Tea, French, Fast Food, Seafood\nAccommodation: Industrial Loft Living in NYC, Philadelphia (Pennsylvania), cost: 178, room type: Entire home/apt, house rules: No smoking, minimum nights: 4, maximum occupancy: 3\n\nNumber of people: 1\nTotal cost: 1 x 47 + 1 x 100 + 1 x 44 + 1 x 178 = 369\nAccommodation minimum nights: 2/4\n\nDays: 3\nCurrent City: from Philadelphia to Sarasota\nTransportation: Flight Number: F3633008, from Philadelphia to Sarasota, Departure Time: 08:06, Arrival Time: 10:51, cost: 246\nBreakfast: -\nAttraction: -\nLunch: -\nDinner: -\nAccommodation: -\n\nNumber of people: 1\nTotal cost: 1 x 246 = 246\n\nTotal cost across all days: 565 + 369 + 246 = 1,180\n\nCuisines: The prompt specifies no cuisines, so all cuisines constraints are satisfied.\nRoom Constraint: All accommodations selected are entire homes that do not allow smoking, ensuring privacy and adherence to house rules.\nTransportation Constraint: The travel plan includes flights as the mode of transportation, which is valid and meets the constraints specified in the query.\nBudget: The total cost of the travel plan is $1,180, which is within the specified budget of $2,100.", "gpt-4-1106-preview_direct_sole-planning_parsed_results": [{"day": 1, "current_city": "from Sarasota to Philadelphia", "transportation": "Flight Number: F3797423, from Sarasota to Philadelphia, Departure Time: 11:54, Arrival Time: 14:46", "breakfast": "-", "attraction": "-", "lunch": "-", "dinner": "Red Ginger Sushi, Grill & Bar, Philadelphia", "accommodation": "Industrial Loft Living in NYC, Philadelphia"}, {"day": 2, "current_city": "Philadelphia", "transportation": "-", "breakfast": "Hong Kong Cafe, Philadelphia", "attraction": "The Franklin Institute, Philadelphia;Liberty Bell, Philadelphia;Philadelphia's Magic Gardens, Philadelphia;", "lunch": "Marukame Udon, Philadelphia", "dinner": "Pind Balluchi, Philadelphia", "accommodation": "Industrial Loft Living in NYC, Philadelphia"}, {"day": 3, "current_city": "from Philadelphia to Sarasota", "transportation": "Flight Number: F3633008, from Philadelphia to Sarasota, Departure Time: 08:06, Arrival Time: 10:51", "breakfast": "-", "attraction": "-", "lunch": "-", "dinner": "-", "accommodation": "-"}]}]