[{"gpt-4-1106-preview_direct_sole-planning_results": "Travel Plan:\n\nDays: 1\nCurrent City: from Seattle to San Francisco\nTransportation: Flight Number: F3748320, from Seattle to San Francisco, Departure Time: 21:37, Arrival Time: 23:39, cost: 167\nBreakfast: -\nAttraction: -\nLunch: -\nDinner: -\nAccommodation: Cozy, spacious Studio located on Upper East Side, San Francisco, cost: 756, maximum occupancy: 2, house rules: No visitors, minimum nights: 3\n\nNumber of people: 1\nTotal cost: 1 x 167 + 1 x 756 = 923\nAccommodation minimum nights: 1/3\n\nDays: 2\nCurrent City: San Francisco\nTransportation: -\nBreakfast: Coffee & Chai Co., San Francisco, cost: 10, cuisines: Tea, Mexican, BBQ, Cafe, Seafood\nAttraction: Golden Gate Bridge, San Francisco; Golden Gate Park, San Francisco; PIER 39, San Francisco\nLunch: Tokyo Sushi, San Francisco, cost: 18, cuisines: Cafe, Pizza, BBQ\nDinner: Bonne Bouche, San Francisco, cost: 21, cuisines: Tea, Chinese, American, Cafe\nAccommodation: Cozy, spacious Studio located on Upper East Side, San Francisco, cost: 756, maximum occupancy: 2, house rules: No visitors, minimum nights: 3\n\nNumber of people: 1\nTotal cost: 1 x 10 + 1 x 18 + 1 x 21 + 1 x 756 = 805\nAccommodation minimum nights: 2/3\n\nDays: 3\nCurrent City: from San Francisco to Seattle\nTransportation: Flight Number: F3749172, from San Francisco to Seattle, Departure Time: 21:36, Arrival Time: 23:31, cost: 148\nBreakfast: -\nAttraction: Exploratorium, San Francisco; San Francisco Museum of Modern Art, San Francisco\nLunch: The Chic, San Francisco, cost: 92, cuisines: Chinese, Bakery, Indian, Cafe\nDinner: -\nAccommodation: -\n\nNumber of people: 1\nTotal cost: 1 x 148 + 1 x 92 = 240\n\nTotal cost across all days: 923 + 805 + 240 = 1,968\n\nUnfortunately, the total cost exceeds the specified budget of $900. To adjust the plan to fit within the budget, we need to make some changes:\n\n- Choose a less expensive flight for Day 1: Flight Number: F3748356, cost: 157\n- Choose a less expensive accommodation: Room in Down town Brooklyn Parkslop, cost: 79 per night\n- Remove the dinner on Day 2 to save costs.\n\nRevised Travel Plan:\n\nDays: 1\nCurrent City: from Seattle to San Francisco\nTransportation: Flight Number: F3748356, from Seattle to San Francisco, Departure Time: 13:43, Arrival Time: 15:39, cost: 157\nBreakfast: -\nAttraction: -\nLunch: -\nDinner: -\nAccommodation: Room in Down town Brooklyn Parkslop, San Francisco, cost: 79, maximum occupancy: 2, house rules: No visitors, minimum nights: 1\n\nNumber of people: 1\nTotal cost: 1 x 157 + 1 x 79 = 236\nAccommodation minimum nights: 1/1\n\nDays: 2\nCurrent City: San Francisco\nTransportation: -\nBreakfast: Coffee & Chai Co., San Francisco, cost: 10, cuisines: Tea, Mexican, BBQ, Cafe, Seafood\nAttraction: Golden Gate Bridge, San Francisco; Golden Gate Park, San Francisco; PIER 39, San Francisco\nLunch: Tokyo Sushi, San Francisco, cost: 18, cuisines: Cafe, Pizza, BBQ\nDinner: -\nAccommodation: Room in Down town Brooklyn Parkslop, San Francisco, cost: 79, maximum occupancy: 2, house rules: No visitors, minimum nights: 1\n\nNumber of people: 1\nTotal cost: 1 x 10 + 1 x 18 + 1 x 79 = 107\nAccommodation minimum nights: 2/1\n\nDays: 3\nCurrent City: from San Francisco to Seattle\nTransportation: Flight Number: F3749172, from San Francisco to Seattle, Departure Time: 21:36, Arrival Time: 23:31, cost: 148\nBreakfast: -\nAttraction: Exploratorium, San Francisco; San Francisco Museum of Modern Art, San Francisco\nLunch: The Chic, San Francisco, cost: 92, cuisines: Chinese, Bakery, Indian, Cafe\nDinner: -\nAccommodation: -\n\nNumber of people: 1\nTotal cost: 1 x 148 + 1 x 92 = 240\n\nTotal revised cost across all days: 236 + 107 + 240 = 583\n\nThe revised travel plan fits within the budget of $900.", "gpt-4-1106-preview_direct_sole-planning_parsed_results": [{"day": 1, "current_city": "from Seattle to San Francisco", "transportation": "Flight Number: F3748356, from Seattle to San Francisco, Departure Time: 13:43, Arrival Time: 15:39", "breakfast": "-", "attraction": "-", "lunch": "-", "dinner": "-", "accommodation": "Room in Down town Brooklyn Parkslop, San Francisco"}, {"day": 2, "current_city": "San Francisco", "transportation": "-", "breakfast": "Coffee & Chai Co., San Francisco", "attraction": "Golden Gate Bridge, San Francisco;Golden Gate Park, San Francisco;PIER 39, San Francisco;", "lunch": "Tokyo Sushi, San Francisco", "dinner": "-", "accommodation": "Room in Down town Brooklyn Parkslop, San Francisco"}, {"day": 3, "current_city": "from San Francisco to Seattle", "transportation": "Flight Number: F3749172, from San Francisco to Seattle, Departure Time: 21:36, Arrival Time: 23:31", "breakfast": "-", "attraction": "Exploratorium, San Francisco;San Francisco Museum of Modern Art, San Francisco;", "lunch": "The Chic, San Francisco", "dinner": "-", "accommodation": "-"}]}]