[{"gpt-4-1106-preview_direct_sole-planning_results": "Travel Plan:\n\nDays: 1\nCurrent City: from Detroit to La Crosse (Wisconsin)\nTransportation: Taxi, from Detroit to La Crosse, duration: 8 hours 23 mins, distance: 915 km, cost: $915\nBreakfast: -\nAttraction: -\nLunch: -\nDinner: -\nAccommodation: Great location-Newly updated-great new features, La Crosse (Wisconsin), cost: $255, room type: Entire home/apt, house rules: No pets, minimum nights: 3, maximum occupancy: 2\n\nNumber of people: 2\nTotal cost: 2 x 915 + 1 x 255 = $2,085\nAccommodation minimum nights: 1/3\n\nDays: 2\nCurrent City: La Crosse (Wisconsin)\nTransportation: -\nBreakfast: -\nAttraction: Children's Museum of La Crosse, La Crosse (Wisconsin); Riverside Park, La Crosse (Wisconsin)\nLunch: Goldy's Breakfast Bistro, La Crosse (Wisconsin), cost: $94, cuisines: Desserts, Tea, Cafe, American, Seafood\nDinner: Hot Palayok, La Crosse (Wisconsin), cost: $52, cuisines: Fast Food, BBQ, Mediterranean, Seafood\nAccommodation: Great location-Newly updated-great new features, La Crosse (Wisconsin), cost: $255, room type: Entire home/apt, house rules: No pets, minimum nights: 3, maximum occupancy: 2\n\nNumber of people: 2\nTotal cost: 2 x 94 + 2 x 52 + 1 x 255 = $547\nAccommodation minimum nights: 2/3\n\nDays: 3\nCurrent City: La Crosse (Wisconsin)\nTransportation: -\nBreakfast: -\nAttraction: Historic Hixon House Museum, La Crosse (Wisconsin); La Crosse Segway Tours, La Crosse (Wisconsin)\nLunch: Moti Mahal Delux, La Crosse (Wisconsin), cost: $42, cuisines: Desserts, Tea, Pizza, Bakery, Indian, Mediterranean\nDinner: 10 Downing Street, La Crosse (Wisconsin), cost: $35, cuisines: Tea, Cafe, Italian\nAccommodation: Great location-Newly updated-great new features, La Crosse (Wisconsin), cost: $255, room type: Entire home/apt, house rules: No pets, minimum nights: 3, maximum occupancy: 2\n\nNumber of people: 2\nTotal cost: 2 x 42 + 2 x 35 + 1 x 255 = $409\nAccommodation minimum nights: 3/3\n\nDays: 4\nCurrent City: from La Crosse (Wisconsin) to Appleton (Wisconsin)\nTransportation: Taxi, from La Crosse to Appleton, duration: 3 hours 2 mins, distance: 273 km, cost: $273\nBreakfast: -\nAttraction: -\nLunch: -\nDinner: -\nAccommodation: Luxury Apartment in Williamsburg!, Appleton (Wisconsin), cost: $436, room type: Entire home/apt, house rules: No parties & No children under 10 & No smoking, minimum nights: 5, maximum occupancy: 2\n\nNumber of people: 2\nTotal cost: 2 x 273 + 1 x 436 = $982\nAccommodation minimum nights: 1/5\n\nDays: 5\nCurrent City: from Appleton (Wisconsin) to Detroit\nTransportation: Flight Number: F3642011, from Appleton to Detroit, Departure Time: 11:47, Arrival Time: 13:51, cost: $68\nBreakfast: -\nAttraction: The History Museum at the Castle, Appleton (Wisconsin); Hearthstone Historic House Museum, Appleton (Wisconsin)\nLunch: Mikata Japanese Steakhouse, Appleton (Wisconsin), cost: $72, cuisines: Cafe, Pizza, Bakery, Italian\nDinner: -\nAccommodation: -\n\nNumber of people: 2\nTotal cost: 2 x 68 + 2 x 72 = $280\n\nTotal cost across all days: $2,085 + $547 + $409 + $982 + $280 = $4,303\n\nUnfortunately, the total cost of $4,303 exceeds the specified budget of $3,200. To adjust the plan within the budget, we need to change the transportation mode from Detroit to La Crosse and possibly find more budget-friendly accommodations. However, based on the given information, there are no other transportation options provided for the Detroit to La Crosse leg of the trip, and the accommodations listed are already the most budget-friendly options that allow parties and are entire rooms. Therefore, it is not possible to create a travel plan that meets all the specified requirements within the given budget constraint.", "gpt-4-1106-preview_direct_sole-planning_parsed_results": [{"day": 1, "current_city": "from Detroit to La Crosse", "transportation": "Taxi, from Detroit to La Crosse, duration: 8 hours 23 mins, distance: 915 km", "breakfast": "-", "attraction": "-", "lunch": "-", "dinner": "-", "accommodation": "Great location-Newly updated-great new features, La Crosse"}, {"day": 2, "current_city": "La Crosse", "transportation": "-", "breakfast": "-", "attraction": "Children's Museum of La Crosse, La Crosse;Riverside Park, La Crosse;", "lunch": "Goldy's Breakfast Bistro, La Crosse", "dinner": "Hot Palayok, La Crosse", "accommodation": "Great location-Newly updated-great new features, La Crosse"}, {"day": 3, "current_city": "La Crosse", "transportation": "-", "breakfast": "-", "attraction": "Historic Hixon House Museum, La Crosse;La Crosse Segway Tours, La Crosse;", "lunch": "Moti Mahal Delux, La Crosse", "dinner": "10 Downing Street, La Crosse", "accommodation": "Great location-Newly updated-great new features, La Crosse"}, {"day": 4, "current_city": "from La Crosse to Appleton", "transportation": "Taxi, from La Crosse to Appleton, duration: 3 hours 2 mins, distance: 273 km", "breakfast": "-", "attraction": "-", "lunch": "-", "dinner": "-", "accommodation": "Luxury Apartment in Williamsburg!, Appleton"}, {"day": 5, "current_city": "from Appleton to Detroit", "transportation": "Flight Number: F3642011, from Appleton to Detroit, Departure Time: 11:47, Arrival Time: 13:51", "breakfast": "-", "attraction": "The History Museum at the Castle, Appleton;Hearthstone Historic House Museum, Appleton;", "lunch": "Mikata Japanese Steakhouse, Appleton", "dinner": "-", "accommodation": "-"}]}]