[{"gpt-4-1106-preview_direct_sole-planning_results": "Travel Plan:\n\nDays: 1\nCurrent City: from Rockford to Gainesville (Florida)\nTransportation: Self-driving, from Rockford to Gainesville, duration: 16 hours 30 mins, distance: 1,822 km, cost: 91\nBreakfast: -\nAttraction: -\nLunch: -\nDinner: -\nAccommodation: Spacious yet Cozy Room in Manhattan, Gainesville (Florida), cost: 566, room type: Entire home/apt, maximum occupancy: 4, house rules: No visitors, minimum nights: 3\n\nNumber of people: 8\nTotal cost: 8 x 91 + 2 x 566 = 1,800\nAccommodation minimum nights: 1/3\n\nDays: 2\nCurrent City: Gainesville (Florida)\nTransportation: -\nBreakfast: The Machine Shed Restaurant, Gainesville (Florida), cost: 62, cuisines: Pizza, Mexican, Bakery, Fast Food, Indian, Seafood\nAttraction: Florida Museum of Natural History-Exhibits, Gainesville (Florida); Devil's Millhopper Geological State Park, Gainesville (Florida); Kanapaha Botanical Gardens, Gainesville (Florida)\nLunch: Carnival By Tresind, Gainesville (Florida), cost: 67, cuisines: Tea, Chinese, Pizza, Mediterranean\nDinner: Parker's, Gainesville (Florida), cost: 74, cuisines: Desserts, Tea, Italian, French, Bakery, BBQ\nAccommodation: Spacious yet Cozy Room in Manhattan, Gainesville (Florida), cost: 566, room type: Entire home/apt, maximum occupancy: 4, house rules: No visitors, minimum nights: 3\n\nNumber of people: 8\nTotal cost: 8 x 62 + 8 x 67 + 8 x 74 + 2 x 566 = 2,800\nAccommodation minimum nights: 2/3\n\nDays: 3\nCurrent City: from Gainesville (Florida) to Daytona Beach (Florida)\nTransportation: Self-driving, from Gainesville to Daytona Beach, duration: 2 hours 2 mins, distance: 158 km, cost: 7\nBreakfast: Aggarwal Sweet Corner, Gainesville (Florida), cost: 70, cuisines: Tea, American, Seafood\nAttraction: Butterfly Rainforest at the Florida Museum of Natural History, Gainesville (Florida); Cade Museum for Creativity & Invention, Gainesville (Florida)\nLunch: The Food Garage, Gainesville (Florida), cost: 97, cuisines: Desserts, Tea, Bakery, BBQ, Chinese\nDinner: -\nAccommodation: Homey 1BR in Fun, Central West Village w/ Doorman by Blueground, Daytona Beach (Florida), cost: 262, room type: Entire home/apt, maximum occupancy: 2, house rules: No parties, minimum nights: 30\n\nNumber of people: 8\nTotal cost: 8 x 7 + 8 x 70 + 8 x 97 + 4 x 262 = 2,656\nAccommodation minimum nights: 1/30\n\nDays: 4\nCurrent City: Daytona Beach (Florida)\nTransportation: -\nBreakfast: Outback Steakhouse, Daytona Beach (Florida), cost: 58, cuisines: Desserts, Pizza, Mexican, Cafe, American\nAttraction: Daytona Boardwalk Amusements, Daytona Beach (Florida); Daytona Lagoon, Daytona Beach (Florida); World's Most Famous Beach, Daytona Beach (Florida)\nLunch: Bespoke Harvest, Daytona Beach (Florida), cost: 56, cuisines: Cafe, BBQ, Fast Food\nDinner: Beach Box Cafe, Daytona Beach (Florida), cost: 96, cuisines: Chinese, Pizza, BBQ, Cafe\nAccommodation: Homey 1BR in Fun, Central West Village w/ Doorman by Blueground, Daytona Beach (Florida), cost: 262, room type: Entire home/apt, maximum occupancy: 2, house rules: No parties, minimum nights: 30\n\nNumber of people: 8\nTotal cost: 8 x 58 + 8 x 56 + 8 x 96 + 4 x 262 = 2,688\nAccommodation minimum nights: 2/30\n\nDays: 5\nCurrent City: from Daytona Beach (Florida) to Jacksonville (Florida)\nTransportation: Self-driving, from Daytona Beach to Jacksonville, duration: 1 hour 28 mins, distance: 143 km, cost: 7\nBreakfast: Mom & Dad's Italian Restaurant, Daytona Beach (Florida), cost: 17, cuisines: Tea, Mexican, Cafe, Indian, Seafood\nAttraction: Daytona Beach Main Street Pier, Daytona Beach (Florida); Sun Splash Park, Daytona Beach (Florida)\nLunch: Khaaja Chowk, Daytona Beach (Florida), cost: 61, cuisines: French, Bakery, American, Seafood\nDinner: -\nAccommodation: NYC Sanctuary, Skyline Views & Rooftop, Jacksonville (Florida), cost: 954, room type: Entire home/apt, maximum occupancy: 6, house rules: No smoking, minimum nights: 3\n\nNumber of people: 8\nTotal cost: 8 x 7 + 8 x 17 + 8 x 61 + 2 x 954 = 2,656\nAccommodation minimum nights: 1/3\n\nDays: 6\nCurrent City: Jacksonville (Florida)\nTransportation: -\nBreakfast: Villa Gargano, Jacksonville (Florida), cost: 51, cuisines: Tea, American, Desserts\nAttraction: Jacksonville Zoo and Gardens, Jacksonville (Florida); Southbank Riverwalk, Jacksonville (Florida); MOSH (Museum Of Science & History), Jacksonville (Florida)\nLunch: Pirates' House Restaurant, Jacksonville (Florida), cost: 59, cuisines: Chinese, Pizza, BBQ\nDinner: Goose Feathers Cafe and Bakery, Jacksonville (Florida), cost: 57, cuisines: Tea, Fast Food, Italian\nAccommodation: NYC Sanctuary, Skyline Views & Rooftop, Jacksonville (Florida), cost: 954, room type: Entire home/apt, maximum occupancy: 6, house rules: No smoking, minimum nights: 3\n\nNumber of people: 8\nTotal cost: 8 x 51 + 8 x 59 + 8 x 57 + 2 x 954 = 2,688\nAccommodation minimum nights: 2/3\n\nDays: 7\nCurrent City: from Jacksonville (Florida) to Rockford\nTransportation: Self-driving, from Jacksonville to Rockford, duration: 16 hours 42 mins, distance: 1,852 km, cost: 92\nBreakfast: Ashoka Restaurant, Jacksonville (Florida), cost: 11, cuisines: Desserts, Mexican, Bakery, BBQ, Fast Food\nAttraction: Tree Hill Nature Center, Jacksonville (Florida); Kingsley Plantation, Jacksonville (Florida)\nLunch: Sanjha Chulha, Jacksonville (Florida), cost: 57, cuisines: Tea, Bakery, BBQ\nDinner: -\nAccommodation: -\n\nNumber of people: 8\nTotal cost: 8 x 92 + 8 x 11 + 8 x 57 = 1,280\n\nTotal cost across all days: 1,800 + 2,800 + 2,656 + 2,688 + 2,656 + 2,688 + 1,280 = 16,568\nCuisines: All cuisines constraints are satisfied.\nRoom Constraint: All accommodations selected are entire rooms, ensuring privacy and space for the group of 8.\nTransportation Constraint: All intra-city travel is managed via self-driving, as per the available options.\n\nPlease note that the accommodation in Daytona Beach has a minimum stay of 30 nights, which is not ideal for this travel plan. However, due to the lack of provided alternatives, it has been included to meet the requirement of entire rooms for the group. Adjustments to the accommodation should be considered if more suitable options become available.", "gpt-4-1106-preview_direct_sole-planning_parsed_results": [{"day": 1, "current_city": "from Rockford to Gainesville", "transportation": "Self-driving, from Rockford to Gainesville, duration: 16 hours 30 mins, distance: 1,822 km", "breakfast": "-", "attraction": "-", "lunch": "-", "dinner": "-", "accommodation": "Spacious yet Cozy Room in Manhattan, Gainesville"}, {"day": 2, "current_city": "Gainesville", "transportation": "-", "breakfast": "The Machine Shed Restaurant, Gainesville", "attraction": "Florida Museum of Natural History-Exhibits, Gainesville;Devil's Millhopper Geological State Park, Gainesville;Kanapaha Botanical Gardens, Gainesville", "lunch": "Carnival By Tresind, Gainesville", "dinner": "Parker's, Gainesville", "accommodation": "Spacious yet Cozy Room in Manhattan, Gainesville"}, {"day": 3, "current_city": "from Gainesville to Daytona Beach", "transportation": "Self-driving, from Gainesville to Daytona Beach, duration: 2 hours 2 mins, distance: 158 km", "breakfast": "Aggarwal Sweet Corner, Gainesville", "attraction": "Butterfly Rainforest at the Florida Museum of Natural History, Gainesville;Cade Museum for Creativity & Invention, Gainesville", "lunch": "The Food Garage, Gainesville", "dinner": "-", "accommodation": "Homey 1BR in Fun, Central West Village w/ Doorman by Blueground, Daytona Beach"}, {"day": 4, "current_city": "Daytona Beach", "transportation": "-", "breakfast": "Outback Steakhouse, Daytona Beach", "attraction": "Daytona Boardwalk Amusements, Daytona Beach;Daytona Lagoon, Daytona Beach;World's Most Famous Beach, Daytona Beach", "lunch": "Bespoke Harvest, Daytona Beach", "dinner": "Beach Box Cafe, Daytona Beach", "accommodation": "Homey 1BR in Fun, Central West Village w/ Doorman by Blueground, Daytona Beach"}, {"day": 5, "current_city": "from Daytona Beach to Jacksonville", "transportation": "Self-driving, from Daytona Beach to Jacksonville, duration: 1 hour 28 mins, distance: 143 km", "breakfast": "Mom & Dad's Italian Restaurant, Daytona Beach", "attraction": "Daytona Beach Main Street Pier, Daytona Beach;Sun Splash Park, Daytona Beach", "lunch": "Khaaja Chowk, Daytona Beach", "dinner": "-", "accommodation": "NYC Sanctuary, Skyline Views & Rooftop, Jacksonville"}, {"day": 6, "current_city": "Jacksonville", "transportation": "-", "breakfast": "Villa Gargano, Jacksonville", "attraction": "Jacksonville Zoo and Gardens, Jacksonville;Southbank Riverwalk, Jacksonville;MOSH (Museum Of Science & History), Jacksonville", "lunch": "Pirates' House Restaurant, Jacksonville", "dinner": "Goose Feathers Cafe and Bakery, Jacksonville", "accommodation": "NYC Sanctuary, Skyline Views & Rooftop, Jacksonville"}, {"day": 7, "current_city": "from Jacksonville to Rockford", "transportation": "Self-driving, from Jacksonville to Rockford, duration: 16 hours 42 mins, distance: 1,852 km", "breakfast": "Ashoka Restaurant, Jacksonville", "attraction": "Tree Hill Nature Center, Jacksonville;Kingsley Plantation, Jacksonville", "lunch": "Sanjha Chulha, Jacksonville", "dinner": "-", "accommodation": "-"}]}]