[{"gpt-4-1106-preview_direct_sole-planning_results": "Travel Plan:\n\nDays: 1\nCurrent City: from Minneapolis to Abilene (Texas)\nTransportation: Self-driving, from Minneapolis to Abilene, duration: 15 hours 28 mins, distance: 1,732 km, cost: 86\nBreakfast: -\nAttraction: -\nLunch: -\nDinner: -\nAccommodation: Apartment minutes from manhattan, Abilene (Texas), cost: 295, room type: Entire home/apt, house rules: No pets & No visitors, minimum nights: 2, maximum occupancy: 2\n\nNumber of people: 2\nTotal cost: 2 x 86 + 1 x 295 = 467\nAccommodation minimum nights: 1/2\n\nDays: 2\nCurrent City: Abilene (Texas)\nTransportation: -\nBreakfast: Thai Garden, Abilene (Texas), cost: 13, cuisines: Cafe, American, Desserts\nAttraction: The Grace Museum, Abilene (Texas); Frontier Texas!, Abilene (Texas); Abilene Zoo, Abilene (Texas)\nLunch: Crispy Crust, Abilene (Texas), cost: 54, cuisines: Desserts, Bakery, Cafe, American, Seafood\nDinner: Finger Licious, Abilene (Texas), cost: 35, cuisines: Fast Food, Cafe, BBQ, Seafood\nAccommodation: Apartment minutes from manhattan, Abilene (Texas), cost: 295, room type: Entire home/apt, house rules: No pets & No visitors, minimum nights: 2, maximum occupancy: 2\n\nNumber of people: 2\nTotal cost: 2 x 13 + 2 x 54 + 2 x 35 + 1 x 295 = 499\nAccommodation minimum nights: 2/2\n\nDays: 3\nCurrent City: from Abilene (Texas) to Amarillo (Texas)\nTransportation: Self-driving, from Abilene to Amarillo, duration: 4 hours 10 mins, distance: 446 km, cost: 22\nBreakfast: -\nAttraction: -\nLunch: -\nDinner: -\nAccommodation: Harlem Humble Abode - 1 bedroom - Cute and Quaint, Amarillo (Texas), cost: 409, room type: Entire home/apt, house rules: No pets, minimum nights: 5, maximum occupancy: 3\n\nNumber of people: 2\nTotal cost: 2 x 22 + 1 x 409 = 453\nAccommodation minimum nights: 1/5\n\nDays: 4\nCurrent City: Amarillo (Texas)\nTransportation: -\nBreakfast: The Cinnamon Kitchen, Amarillo (Texas), cost: 69, cuisines: Desserts, Tea, Pizza, Chinese, Seafood\nAttraction: Cadillac Ranch, Amarillo (Texas); Amarillo Botanical Gardens, Amarillo (Texas); Amarillo Zoo, Amarillo (Texas)\nLunch: Komachi, Amarillo (Texas), cost: 71, cuisines: Desserts, Tea, Fast Food, Chinese, Mediterranean\nDinner: Kanha North & South Indian Veg., Amarillo (Texas), cost: 34, cuisines: Tea, Cafe, BBQ, Fast Food\nAccommodation: Harlem Humble Abode - 1 bedroom - Cute and Quaint, Amarillo (Texas), cost: 409, room type: Entire home/apt, house rules: No pets, minimum nights: 5, maximum occupancy: 3\n\nNumber of people: 2\nTotal cost: 2 x 69 + 2 x 71 + 2 x 34 + 1 x 409 = 757\nAccommodation minimum nights: 2/5\n\nDays: 5\nCurrent City: from Amarillo (Texas) to Lubbock (Texas)\nTransportation: Self-driving, from Amarillo to Lubbock, duration: 1 hour 47 mins, distance: 197 km, cost: 9\nBreakfast: -\nAttraction: -\nLunch: -\nDinner: -\nAccommodation: Private bedroom in UWS Apartment, Lubbock (Texas), cost: 709, room type: Private room, house rules: No visitors & No pets, minimum nights: 2, maximum occupancy: 2\n\nNumber of people: 2\nTotal cost: 2 x 9 + 1 x 709 = 727\nAccommodation minimum nights: 1/2\n\nDays: 6\nCurrent City: Lubbock (Texas)\nTransportation: -\nBreakfast: Cantinho da Gula, Lubbock (Texas), cost: 78, cuisines: Cafe, BBQ, Desserts, Italian\nAttraction: Buddy Holly Center, Lubbock (Texas); National Ranching Heritage Center, Lubbock (Texas); American Windmill Museum, Lubbock (Texas)\nLunch: Paris 6 Classique, Lubbock (Texas), cost: 91, cuisines: Desserts, Cafe, Pizza, Mexican, BBQ, Chinese\nDinner: 3 Squares Diner, Lubbock (Texas), cost: 73, cuisines: Pizza, Indian, Fast Food\nAccommodation: Private bedroom in UWS Apartment, Lubbock (Texas), cost: 709, room type: Private room, house rules: No visitors & No pets, minimum nights: 2, maximum occupancy: 2\n\nNumber of people: 2\nTotal cost: 2 x 78 + 2 x 91 + 2 x 73 + 1 x 709 = 1193\nAccommodation minimum nights: 2/2\n\nDays: 7\nCurrent City: from Lubbock (Texas) to Minneapolis\nTransportation: Self-driving, from Lubbock to Minneapolis, duration: 16 hours 17 mins, distance: 1,818 km, cost: 90\nBreakfast: -\nAttraction: -\nLunch: -\nDinner: -\nAccommodation: -\n\nNumber of people: 2\nTotal cost: 2 x 90 = 180\n\nTotal cost across all days: 467 + 499 + 453 + 757 + 727 + 1193 + 180 = 4276\n\nCuisines: The prompt specifies no cuisines, so all cuisines constraints are satisfied.\nRoom Constraint: All accommodations selected are suitable for children under 10 years old.\nTransportation Constraint: All intra-city travel is managed via self-driving, as per the available options.\nTotal Budget: $11,900\nTotal Cost of Trip: $4,276\nRemaining Budget: $11,900 - $4,276 = $7,624\n\nPlease note that the costs are estimated based on the provided information and may vary. The accommodations have been chosen to meet the requirement of being suitable for children under 10 years old. The transportation method is self-driving as there are no available flights for the specified dates and routes. The attractions and restaurants have been selected based on their presence in the respective cities.", "gpt-4-1106-preview_direct_sole-planning_parsed_results": [{"day": 1, "current_city": "from Minneapolis to Abilene", "transportation": "Self-driving, from Minneapolis to Abilene, duration: 15 hours 28 mins, distance: 1,732 km", "breakfast": "-", "attraction": "-", "lunch": "-", "dinner": "-", "accommodation": "Apartment minutes from manhattan, Abilene"}, {"day": 2, "current_city": "Abilene", "transportation": "-", "breakfast": "Thai Garden, Abilene", "attraction": "The Grace Museum, Abilene;Frontier Texas!, Abilene;Abilene Zoo, Abilene;", "lunch": "Crispy Crust, Abilene", "dinner": "Finger Licious, Abilene", "accommodation": "Apartment minutes from manhattan, Abilene"}, {"day": 3, "current_city": "from Abilene to Amarillo", "transportation": "Self-driving, from Abilene to Amarillo, duration: 4 hours 10 mins, distance: 446 km", "breakfast": "-", "attraction": "-", "lunch": "-", "dinner": "-", "accommodation": "Harlem Humble Abode - 1 bedroom - Cute and Quaint, Amarillo"}, {"day": 4, "current_city": "Amarillo", "transportation": "-", "breakfast": "The Cinnamon Kitchen, Amarillo", "attraction": "Cadillac Ranch, Amarillo;Amarillo Botanical Gardens, Amarillo;Amarillo Zoo, Amarillo;", "lunch": "Komachi, Amarillo", "dinner": "Kanha North & South Indian Veg., Amarillo", "accommodation": "Harlem Humble Abode - 1 bedroom - Cute and Quaint, Amarillo"}, {"day": 5, "current_city": "from Amarillo to Lubbock", "transportation": "Self-driving, from Amarillo to Lubbock, duration: 1 hour 47 mins, distance: 197 km", "breakfast": "-", "attraction": "-", "lunch": "-", "dinner": "-", "accommodation": "Private bedroom in UWS Apartment, Lubbock"}, {"day": 6, "current_city": "Lubbock", "transportation": "-", "breakfast": "Cantinho da Gula, Lubbock", "attraction": "Buddy Holly Center, Lubbock;National Ranching Heritage Center, Lubbock;American Windmill Museum, Lubbock;", "lunch": "Paris 6 Classique, Lubbock", "dinner": "3 Squares Diner, Lubbock", "accommodation": "Private bedroom in UWS Apartment, Lubbock"}, {"day": 7, "current_city": "from Lubbock to Minneapolis", "transportation": "Self-driving, from Lubbock to Minneapolis, duration: 16 hours 17 mins, distance: 1,818 km", "breakfast": "-", "attraction": "-", "lunch": "-", "dinner": "-", "accommodation": "-"}]}]