[{"gpt-4-1106-preview_direct_sole-planning_results": "Travel Plan:\n\nDays: 1\nCurrent City: from Pittsburgh to Baltimore\nTransportation: Flight Number: F3969954, from Pittsburgh to Baltimore, Departure Time: 16:51, Arrival Time: 17:49, cost: 52\nBreakfast: -\nAttraction: -\nLunch: -\nDinner: Los Pablos, Baltimore, cost: 47, cuisines: Indian, BBQ, Cafe, American, Seafood\nAccommodation: Contemporary Home Away from Home, Entire house, Baltimore, cost: 290, maximum occupancy: 2, house rules: No visitors, minimum nights: 2\n\nNumber of people: 1\nTotal cost: 1 x 52 + 1 x 47 + 1 x 290 = 389\nAccommodation minimum nights: 1/2\n\nDays: 2\nCurrent City: Baltimore\nTransportation: -\nBreakfast: Mr. Dunderbak's Biergarten and Marketplatz, Baltimore, cost: 74, cuisines: Cafe, Pizza, American\nAttraction: National Aquarium, Baltimore; Fort McHenry National Monument and Historic Shrine, Baltimore; The Walters Art Museum, Baltimore\nLunch: The Thai Bowl, Baltimore, cost: 66, cuisines: BBQ, Pizza, Desserts, Italian\nDinner: Salt, Baltimore, cost: 56, cuisines: Tea, Bakery, Fast Food, Chinese, American\nAccommodation: Contemporary Home Away from Home, Entire house, Baltimore, cost: 290, maximum occupancy: 2, house rules: No visitors, minimum nights: 2\n\nNumber of people: 1\nTotal cost: 1 x 74 + 1 x 66 + 1 x 56 + 1 x 290 = 486\nAccommodation minimum nights: 2/2\n\nDays: 3\nCurrent City: from Baltimore to Pittsburgh\nTransportation: Flight Number: F3994096, from Baltimore to Pittsburgh, Departure Time: 21:45, Arrival Time: 22:44, cost: 85\nBreakfast: Tresind - Nassima Royal Hotel, Baltimore, cost: 67, cuisines: Cafe, Pizza, American, Desserts\nAttraction: Baltimore Museum of Industry, Baltimore; Historic Ships in Baltimore, Baltimore\nLunch: Three Dots & A Dash, Baltimore, cost: 47, cuisines: Cafe, Chinese, Mediterranean, Seafood\nDinner: -\nAccommodation: -\n\nNumber of people: 1\nTotal cost: 1 x 85 + 1 x 67 + 1 x 47 = 199\n\nTotal cost across all days: 389 + 486 + 199 = 1,074\n\nCuisines: The prompt specifies no cuisines, so all cuisines constraints are satisfied.\nRoom Constraint: All accommodations selected are entire homes, ensuring privacy.\nTransportation Constraint: All travel between cities is managed via flights, as per the available data.\nHouse Rules: Accommodations selected do not have restrictions against the traveler's needs.\n\nPlease note that the attractions and restaurants were chosen based on the provided CSV data, and the costs were derived from the reference information. The total cost of the travel plan is within the specified budget of $1,200.", "gpt-4-1106-preview_direct_sole-planning_parsed_results": [{"day": 1, "current_city": "from Pittsburgh to Baltimore", "transportation": "Flight Number: F3969954, from Pittsburgh to Baltimore, Departure Time: 16:51, Arrival Time: 17:49", "breakfast": "-", "attraction": "-", "lunch": "-", "dinner": "Los Pablos, Baltimore", "accommodation": "Contemporary Home Away from Home, Baltimore"}, {"day": 2, "current_city": "Baltimore", "transportation": "-", "breakfast": "Mr. Dunderbak's Biergarten and Marketplatz, Baltimore", "attraction": "National Aquarium, Baltimore;Fort McHenry National Monument and Historic Shrine, Baltimore;The Walters Art Museum, Baltimore;", "lunch": "The Thai Bowl, Baltimore", "dinner": "Salt, Baltimore", "accommodation": "Contemporary Home Away from Home, Baltimore"}, {"day": 3, "current_city": "from Baltimore to Pittsburgh", "transportation": "Flight Number: F3994096, from Baltimore to Pittsburgh, Departure Time: 21:45, Arrival Time: 22:44", "breakfast": "Tresind - Nassima Royal Hotel, Baltimore", "attraction": "Baltimore Museum of Industry, Baltimore;Historic Ships in Baltimore, Baltimore;", "lunch": "Three Dots & A Dash, Baltimore", "dinner": "-", "accommodation": "-"}]}]