[{"gpt-4-1106-preview_direct_sole-planning_results": "Travel Plan:\n\nDays: 1\nCurrent City: from Milwaukee to New York\nTransportation: Flight Number: F3643145, from Milwaukee to New York, Departure Time: 18:36, Arrival Time: 21:58, cost: 226\nBreakfast: -\nAttraction: -\nLunch: -\nDinner: -\nAccommodation: A Contemporary Homelike Stay in the Best of BK, New York, cost: 228, maximum occupancy: 2, house rules: No pets & No visitors & No children under 10, minimum nights: 2\n\nNumber of people: 2\nTotal cost: 2 x 226 + 1 x 228 = 680\nAccommodation minimum nights: 1/2\n\nDays: 2\nCurrent City: New York\nTransportation: -\nBreakfast: Green Chick Chop, New York, cost: 26, cuisines: Tea, French, Cafe, Seafood\nAttraction: Top of The Rock, New York; One World Observatory, New York; Central Park, New York\nLunch: Lord of the Drinks Forum, New York, cost: 71, cuisines: Cafe, Bakery, BBQ, Chinese, Indian\nDinner: Seasons 52 Fresh Grill, New York, cost: 30, cuisines: Seafood, Indian, Desserts, Italian\nAccommodation: A Contemporary Homelike Stay in the Best of BK, New York, cost: 228, maximum occupancy: 2, house rules: No pets & No visitors & No children under 10, minimum nights: 2\n\nNumber of people: 2\nTotal cost: 2 x 26 + 2 x 71 + 2 x 30 + 1 x 228 = 482\nAccommodation minimum nights: 2/2\n\nDays: 3\nCurrent City: from New York to Milwaukee\nTransportation: Flight Number: F3644990, from New York to Milwaukee, Departure Time: 15:20, Arrival Time: 16:27, cost: 218\nBreakfast: Sir John Bakery Cafe, New York, cost: 78, cuisines: Pizza, Bakery, Desserts\nAttraction: The High Line, New York; Statue of Liberty, New York\nLunch: Gurgaon Hights, New York, cost: 46, cuisines: Cafe, American, Indian, Fast Food\nDinner: -\nAccommodation: -\n\nNumber of people: 2\nTotal cost: 2 x 218 + 2 x 78 + 2 x 46 = 684\n\nTotal cost across all days: 680 + 482 + 684 = 1,846\nCuisines: The prompt specifies no cuisines, so all cuisines constraints are satisfied.\nRoom Constraint: All accommodations selected are non-shared rooms, ensuring privacy for the two people.\nTransportation Constraint: All travel between cities is managed via flights, as per the available data.\nHouse Rules: Accommodations selected adhere to the \"no shared room\" constraint.\n\n***** Travel Plan Ends *****", "gpt-4-1106-preview_direct_sole-planning_parsed_results": [{"day": 1, "current_city": "from Milwaukee to New York", "transportation": "Flight Number: F3643145, from Milwaukee to New York, Departure Time: 18:36, Arrival Time: 21:58", "breakfast": "-", "attraction": "-", "lunch": "-", "dinner": "-", "accommodation": "A Contemporary Homelike Stay in the Best of BK, New York"}, {"day": 2, "current_city": "New York", "transportation": "-", "breakfast": "Green Chick Chop, New York", "attraction": "Top of The Rock, New York;One World Observatory, New York;Central Park, New York;", "lunch": "Lord of the Drinks Forum, New York", "dinner": "Seasons 52 Fresh Grill, New York", "accommodation": "A Contemporary Homelike Stay in the Best of BK, New York"}, {"day": 3, "current_city": "from New York to Milwaukee", "transportation": "Flight Number: F3644990, from New York to Milwaukee, Departure Time: 15:20, Arrival Time: 16:27", "breakfast": "Sir John Bakery Cafe, New York", "attraction": "The High Line, New York;Statue of Liberty, New York;", "lunch": "Gurgaon Hights, New York", "dinner": "-", "accommodation": "-"}]}]