[{"gpt-4-1106-preview_direct_sole-planning_results": "Travel Plan:\n\nDays: 1\nCurrent City: from West Palm Beach to White Plains\nTransportation: Flight Number: F3756085, from West Palm Beach to White Plains, Departure Time: 05:58, Arrival Time: 08:48, cost: 515\nBreakfast: -\nAttraction: -\nLunch: Kinoshita, White Plains (New York), cost: 42, cuisines: Tea, Pizza, Fast Food, American, Seafood\nDinner: El Cazador, White Plains (New York), cost: 90, cuisines: Mexican, Pizza, BBQ\nAccommodation: Quiet East Village Studio next to snug coffee shop, White Plains (New York), cost: 708, room type: Entire home/apt, house rules: No visitors & No children under 10 & No smoking, minimum nights: 10, maximum occupancy: 6\n\nNumber of people: 2\nTotal cost: 2 x 515 + 2 x 42 + 2 x 90 + 1 x 708 = 2,002\nAccommodation minimum nights: 1/10\n\nDays: 2\nCurrent City: White Plains\nTransportation: -\nBreakfast: Six Pack Kitchen, White Plains (New York), cost: 58, cuisines: Chinese, Mexican, Desserts, Seafood\nAttraction: LEGOLAND Discovery Center Westchester, White Plains (New York)\nLunch: Aravalli Owls, White Plains (New York), cost: 26, cuisines: Pizza, Mediterranean, BBQ\nDinner: Mughals Rasoi, White Plains (New York), cost: 92, cuisines: Tea, Pizza, Fast Food, Cafe, Mediterranean\nAccommodation: Quiet East Village Studio next to snug coffee shop, White Plains (New York), cost: 708, room type: Entire home/apt, house rules: No visitors & No children under 10 & No smoking, minimum nights: 10, maximum occupancy: 6\n\nNumber of people: 2\nTotal cost: 2 x 58 + 2 x 26 + 2 x 92 + 1 x 708 = 1,060\nAccommodation minimum nights: 2/10\n\nDays: 3\nCurrent City: from White Plains to West Palm Beach\nTransportation: Flight Number: F3759006, from White Plains to West Palm Beach, Departure Time: 15:51, Arrival Time: 18:41, cost: 321\nBreakfast: Costa Coffee, White Plains (New York), cost: 43, cuisines: Cafe, Pizza, American, Italian\nAttraction: Kensico Dam Plaza, White Plains (New York)\nLunch: Saffron Mantra, White Plains (New York), cost: 43, cuisines: Bakery, BBQ, Cafe, Mediterranean, Seafood\nDinner: -\nAccommodation: -\n\nNumber of people: 2\nTotal cost: 2 x 321 + 2 x 43 + 2 x 43 = 814\n\nTotal cost across all days: 2,002 + 1,060 + 814 = 3,876\n\nCuisines: All selected restaurants offer Mexican, Chinese, Mediterranean, and/or American cuisines as requested.\nRoom Constraint: All accommodations selected are entire homes/apartments, ensuring no shared rooms.\nTransportation Constraint: All travel is managed via flights, as self-driving is not an option and public transportation is required.\nBudget: The total cost exceeds the specified budget of $2,600. Adjustments are needed to meet the budget constraint.\n\n**Adjustments to meet budget constraints:**\nTo meet the budget constraint, we need to reduce the total cost by at least $1,276. Here are the adjustments:\n\n- Change the accommodation to a less expensive option if available.\n- Opt for more budget-friendly meal options.\n- Consider adjusting flight options to lower-cost alternatives if possible.\n\n**Revised Travel Plan with Budget Adjustments:**\n\nDays: 1\nCurrent City: from West Palm Beach to White Plains\nTransportation: Flight Number: F3765519, from West Palm Beach to White Plains, Departure Time: 18:45, Arrival Time: 21:40, cost: 281\nBreakfast: -\nAttraction: -\nLunch: -\nDinner: El Kiosco Mexican Restaurant, White Plains (New York), cost: 65, cuisines: Tea, Pizza\nAccommodation: Large Opulent Studio Apartment Near Prospect Park, White Plains (New York), cost: 465, room type: Entire home/apt, house rules: No children under 10, minimum nights: 4, maximum occupancy: 3\n\nNumber of people: 2\nTotal cost: 2 x 281 + 2 x 65 + 1 x 465 = 1,157\nAccommodation minimum nights: 1/4\n\nDays: 2\nCurrent City: White Plains\nTransportation: -\nBreakfast: Chaudhary Burfi Wala, White Plains (New York), cost: 19, cuisines: French, Pizza, Desserts, Fast Food\nAttraction: Saxon Woods Park, White Plains (New York)\nLunch: Tulsi Ram Chinese Hut, White Plains (New York), cost: 20, cuisines: Chinese, Pizza, American, Bakery\nDinner: Six Pack Kitchen, White Plains (New York), cost: 58, cuisines: Chinese, Mexican, Desserts, Seafood\nAccommodation: Large Opulent Studio Apartment Near Prospect Park, White Plains (New York), cost: 465, room type: Entire home/apt, house rules: No children under 10, minimum nights: 4, maximum occupancy: 3\n\nNumber of people: 2\nTotal cost: 2 x 19 + 2 x 20 + 2 x 58 + 1 x 465 = 658\nAccommodation minimum nights: 2/4\n\nDays: 3\nCurrent City: from White Plains to West Palm Beach\nTransportation: Flight Number: F3759006, from White Plains to West Palm Beach, Departure Time: 15:51, Arrival Time: 18:41, cost: 321\nBreakfast: Hunter's Kitchen, White Plains (New York), cost: 15, cuisines: Desserts, BBQ, Bakery, Indian, Seafood\nAttraction: Battle of White Plains Park, White Plains (New York)\nLunch: Maa Vaishno Shudh Bhojnalaya, White Plains (New York), cost: 18, cuisines: Bakery, Desserts, Pizza, BBQ\nDinner: -\nAccommodation: -\n\nNumber of people: 2\nTotal cost: 2 x 321 + 2 x 15 + 2 x 18 = 730\n\nTotal cost across all days: 1,157 + 658 + 730 = 2,545\n\nThe revised travel plan now meets the budget constraint of $2,600.", "gpt-4-1106-preview_direct_sole-planning_parsed_results": [{"day": 1, "current_city": "from West Palm Beach to White Plains", "transportation": "Flight Number: F3756085, from West Palm Beach to White Plains, Departure Time: 05:58, Arrival Time: 08:48", "breakfast": "-", "attraction": "-", "lunch": "Kinoshita, White Plains", "dinner": "El Cazador, White Plains", "accommodation": "Quiet East Village Studio next to snug coffee shop, White Plains"}, {"day": 2, "current_city": "White Plains", "transportation": "-", "breakfast": "Six Pack Kitchen, White Plains", "attraction": "LEGOLAND Discovery Center Westchester, White Plains", "lunch": "Aravalli Owls, White Plains", "dinner": "Mughals Rasoi, White Plains", "accommodation": "Quiet East Village Studio next to snug coffee shop, White Plains"}, {"day": 3, "current_city": "from White Plains to West Palm Beach", "transportation": "Flight Number: F3759006, from White Plains to West Palm Beach, Departure Time: 15:51, Arrival Time: 18:41", "breakfast": "Costa Coffee, White Plains", "attraction": "Kensico Dam Plaza, White Plains", "lunch": "Saffron Mantra, White Plains", "dinner": "-", "accommodation": "-"}, {"day": 1, "current_city": "from West Palm Beach to White Plains", "transportation": "Flight Number: F3765519, from West Palm Beach to White Plains, Departure Time: 18:45, Arrival Time: 21:40", "breakfast": "-", "attraction": "-", "lunch": "-", "dinner": "El Kiosco Mexican Restaurant, White Plains", "accommodation": "Large Opulent Studio Apartment Near Prospect Park, White Plains"}, {"day": 2, "current_city": "White Plains", "transportation": "-", "breakfast": "Chaudhary Burfi Wala, White Plains", "attraction": "Saxon Woods Park, White Plains", "lunch": "Tulsi Ram Chinese Hut, White Plains", "dinner": "Six Pack Kitchen, White Plains", "accommodation": "Large Opulent Studio Apartment Near Prospect Park, White Plains"}, {"day": 3, "current_city": "from White Plains to West Palm Beach", "transportation": "Flight Number: F3759006, from White Plains to West Palm Beach, Departure Time: 15:51, Arrival Time: 18:41", "breakfast": "Hunter's Kitchen, White Plains", "attraction": "Battle of White Plains Park, White Plains", "lunch": "Maa Vaishno Shudh Bhojnalaya, White Plains", "dinner": "-", "accommodation": "-"}]}]