[{"gpt-4-1106-preview_direct_sole-planning_results": "Based on the provided information and constraints, here is a 5-day travel plan for a couple leaving from Baton Rouge and visiting 2 cities in Texas (Abilene and Amarillo) from March 16th to March 20th, 2022, with a budget of $2,900, no flights, non-shared rooms, and pet-friendly accommodations.\n\n**Day 1: Baton Rouge to Abilene (March 16, 2022)**\n- Transportation: Self-driving from Baton Rouge to Abilene (cost: $48)\n- Breakfast: [Not provided, assumed in Baton Rouge before departure]\n- Lunch: [On the road, travelers can stop at a suitable restaurant]\n- Dinner: Thai Garden, Abilene (Average Cost: $26 for two)\n- Attraction: The Grace Museum (Free admission)\n- Accommodation: Apartment minutes from Manhattan, Abilene (price: $295, pet-friendly)\n\n**Day 2: Abilene (March 17, 2022)**\n- Breakfast: Crispy Crust, Abilene (Average Cost: $20 for two)\n- Lunch: LPK Waterfront, Abilene (Average Cost: $30 for two)\n- Dinner: Mediumwelldone, Abilene (Average Cost: $50 for two)\n- Attractions: Frontier Texas!, Historic Fort Phantom Hill, Abilene Zoo (Total estimated cost: $50 for two)\n- Accommodation: Apartment minutes from Manhattan, Abilene (price: $295, pet-friendly)\n\n**Day 3: Abilene to Amarillo (March 18, 2022)**\n- Transportation: Self-driving from Abilene to Amarillo (cost: $22)\n- Breakfast: Cakes Degree, Abilene (Average Cost: $18 for two)\n- Lunch: [On the road, travelers can stop at a suitable restaurant]\n- Dinner: The Cinnamon Kitchen, Amarillo (Average Cost: $69 for two)\n- Attraction: Cadillac Ranch (Free admission)\n- Accommodation: Harlem Humble Abode - 1 bedroom - Cute and Quaint, Amarillo (price: $409, pet-friendly)\n\n**Day 4: Amarillo (March 19, 2022)**\n- Breakfast: Wood Box Cafe, Amarillo (Average Cost: $11 for two)\n- Lunch: Sigree Global Grill, Amarillo (Average Cost: $35 for two)\n- Dinner: Anand Restaurant, Amarillo (Average Cost: $53 for two)\n- Attractions: Amarillo Botanical Gardens, Amarillo Zoo, Don Harrington Discovery Center (Total estimated cost: $60 for two)\n- Accommodation: Harlem Humble Abode - 1 bedroom - Cute and Quaint, Amarillo (price: $409, pet-friendly)\n\n**Day 5: Amarillo to Baton Rouge (March 20, 2022)**\n- Transportation: Self-driving from Amarillo to Baton Rouge (cost: $63)\n- Breakfast: Punjabi Chaap Corner, Amarillo (Average Cost: $20 for two)\n- Lunch: [On the road, travelers can stop at a suitable restaurant]\n- Dinner: [Not provided, assumed upon arrival in Baton Rouge]\n\n**Total Estimated Costs:**\n- Transportation: $48 (Day 1) + $22 (Day 3) + $63 (Day 5) = $133\n- Accommodations: $295 (Day 1) + $295 (Day 2) + $409 (Day 3) + $409 (Day 4) = $1408\n- Meals & Attractions: $26 (Dinner Day 1) + $20 (Breakfast Day 2) + $30 (Lunch Day 2) + $50 (Dinner Day 2) + $50 (Attractions Day 2) + $18 (Breakfast Day 3) + $69 (Dinner Day 3) + $11 (Breakfast Day 4) + $35 (Lunch Day 4) + $53 (Dinner Day 4) + $60 (Attractions Day 4) + $20 (Breakfast Day 5) = $442\n- Total: $133 (Transportation) + $1408 (Accommodations) + $442 (Meals & Attractions) = $1983\n\nRemaining Budget: $2900 - $1983 = $917\n\nThe remaining budget can be used for additional meals, attractions, or any incidental expenses during the trip. Please note that the costs for lunch on the road and dinner on the last day are not included and should be considered within the remaining budget. Additionally, the cost for attractions is an estimate and may vary based on actual prices and any discounts that may apply.", "gpt-4-1106-preview_direct_sole-planning_parsed_results": [{"day": 1, "current_city": "from Baton Rouge to Abilene", "transportation": "Self-driving from Baton Rouge to Abilene", "breakfast": "-", "attraction": "The Grace Museum, Abilene;", "lunch": "-", "dinner": "Thai Garden, Abilene", "accommodation": "Apartment minutes from Manhattan, Abilene"}, {"day": 2, "current_city": "Abilene", "transportation": "-", "breakfast": "Crispy Crust, Abilene", "attraction": "Frontier Texas!, Abilene;Historic Fort Phantom Hill, Abilene;Abilene Zoo, Abilene;", "lunch": "LPK Waterfront, Abilene", "dinner": "Mediumwelldone, Abilene", "accommodation": "Apartment minutes from Manhattan, Abilene"}, {"day": 3, "current_city": "from Abilene to Amarillo", "transportation": "Self-driving from Abilene to Amarillo", "breakfast": "Cakes Degree, Abilene", "attraction": "Cadillac Ranch, Amarillo;", "lunch": "-", "dinner": "The Cinnamon Kitchen, Amarillo", "accommodation": "Harlem Humble Abode - 1 bedroom - Cute and Quaint, Amarillo"}, {"day": 4, "current_city": "Amarillo", "transportation": "-", "breakfast": "Wood Box Cafe, Amarillo", "attraction": "Amarillo Botanical Gardens, Amarillo;Amarillo Zoo, Amarillo;Don Harrington Discovery Center, Amarillo;", "lunch": "Sigree Global Grill, Amarillo", "dinner": "Anand Restaurant, Amarillo", "accommodation": "Harlem Humble Abode - 1 bedroom - Cute and Quaint, Amarillo"}, {"day": 5, "current_city": "from Amarillo to Baton Rouge", "transportation": "Self-driving from Amarillo to Baton Rouge", "breakfast": "Punjabi Chaap Corner, Amarillo", "attraction": "-", "lunch": "-", "dinner": "-", "accommodation": "-"}]}]