[{"gpt-4-1106-preview_direct_sole-planning_results": "Based on the provided information and constraints, here is a 7-day travel plan for a group of 8, starting from Rockford and visiting Gainesville, Daytona Beach, and Jacksonville in Florida from March 8th to March 14th, 2022. The budget allocated for this trip is $17,000, and the accommodation preference is to have entire rooms for the group.\n\n**Day 1: March 8, 2022 - Rockford to Gainesville**\n- Transportation: Self-driving from Rockford to Gainesville (16 hours 30 mins, 1,822 km, cost: $91)\n- Breakfast: N/A (Assuming departure early in the morning)\n- Lunch: Packed or on-the-go (Cost estimated at $120)\n- Dinner: The Machine Shed Restaurant, Gainesville (Average Cost: $62, Cuisine: Pizza, Mexican, Bakery, Fast Food, Indian, Seafood)\n- Attractions: No attractions due to travel time\n- Accommodation: Spacious Upper East Side 1BR apt near attractions, Gainesville (Price: $119, Entire home/apt)\n- Total Accommodation Cost: $119 x 4 rooms x 1 night = $476\n- Total Day Cost: $91 (transportation) + $120 (lunch) + $496 (dinner for 8) + $476 (accommodation) = $1,183\n\n**Day 2: March 9, 2022 - Gainesville**\n- Breakfast: The Food Garage, Gainesville (Average Cost: $97, Cuisine: Desserts, Tea, Bakery, BBQ, Chinese)\n- Lunch: Carnival By Tresind, Gainesville (Average Cost: $67, Cuisine: Tea, Chinese, Pizza, Mediterranean)\n- Dinner: Parker's, Gainesville (Average Cost: $74, Cuisine: Desserts, Tea, Italian, French, Bakery, BBQ)\n- Attractions: Florida Museum of Natural History-Exhibits, Butterfly Rainforest, Kanapaha Botanical Gardens\n- Accommodation: Spacious Upper East Side 1BR apt near attractions, Gainesville (Price: $119, Entire home/apt)\n- Total Accommodation Cost: $119 x 4 rooms x 1 night = $476\n- Total Day Cost: $97 (breakfast) + $536 (lunch for 8) + $592 (dinner for 8) + $476 (accommodation) + Attraction costs (estimated at $200) = $1,901\n\n**Day 3: March 10, 2022 - Gainesville to Daytona Beach**\n- Transportation: Self-driving from Gainesville to Daytona Beach (2 hours 2 mins, 158 km, cost: $7)\n- Breakfast: CHA, Gainesville (Average Cost: $84, Cuisine: Desserts, Pizza, Bakery, Fast Food, American)\n- Lunch: On-the-go/packed (Cost estimated at $120)\n- Dinner: Outback Steakhouse, Daytona Beach (Average Cost: $58, Cuisine: Desserts, Pizza, Mexican, Cafe, American)\n- Attractions: Daytona Boardwalk Amusements, Daytona Lagoon\n- Accommodation: Homey 1BR in Fun, Central West Village w/ Doorman by Blueground, Daytona Beach (Price: $262, Entire home/apt)\n- Total Accommodation Cost: $262 x 4 rooms x 1 night = $1,048\n- Total Day Cost: $7 (transportation) + $672 (breakfast for 8) + $120 (lunch) + $464 (dinner for 8) + $1,048 (accommodation) + Attraction costs (estimated at $200) = $2,511\n\n**Day 4: March 11, 2022 - Daytona Beach**\n- Breakfast: Beach Box Cafe, Daytona Beach (Average Cost: $96, Cuisine: Chinese, Pizza, BBQ, Cafe)\n- Lunch: Bespoke Harvest, Daytona Beach (Average Cost: $56, Cuisine: Cafe, BBQ, Fast Food)\n- Dinner: Rocks on the River, Daytona Beach (Average Cost: $35, Cuisine: Tea, Indian, BBQ)\n- Attractions: Daytona Beach Main Street Pier, Sun Splash Park\n- Accommodation: Homey 1BR in Fun, Central West Village w/ Doorman by Blueground, Daytona Beach (Price: $262, Entire home/apt)\n- Total Accommodation Cost: $262 x 4 rooms x 1 night = $1,048\n- Total Day Cost: $768 (breakfast for 8) + $448 (lunch for 8) + $280 (dinner for 8) + $1,048 (accommodation) + Attraction costs (estimated at $200) = $2,744\n\n**Day 5: March 12, 2022 - Daytona Beach to Jacksonville**\n- Transportation: Self-driving from Daytona Beach to Jacksonville (1 hour 28 mins, 143 km, cost: $7)\n- Breakfast: Mom & Dad's Italian Restaurant, Daytona Beach (Average Cost: $17, Cuisine: Tea, Mexican, Cafe, Indian, Seafood)\n- Lunch: On-the-go/packed (Cost estimated at $120)\n- Dinner: Villa Gargano, Jacksonville (Average Cost: $51, Cuisine: Tea, American, Desserts)\n- Attractions: Jacksonville Zoo and Gardens, Southbank Riverwalk\n- Accommodation: NYC Sanctuary, Skyline Views & Rooftop, Jacksonville (Price: $954, Entire home/apt)\n- Total Accommodation Cost: $954 x 4 rooms x 1 night = $3,816\n- Total Day Cost: $7 (transportation) + $136 (breakfast for 8) + $120 (lunch) + $408 (dinner for 8) + $3,816 (accommodation) + Attraction costs (estimated at $200) = $4,687\n\n**Day 6: March 13, 2022 - Jacksonville**\n- Breakfast: Goose Feathers Cafe and Bakery, Jacksonville (Average Cost: $57, Cuisine: Tea, Fast Food, Italian)\n- Lunch: Pirates' House Restaurant, Jacksonville (Average Cost: $59, Cuisine: Chinese, Pizza, BBQ)\n- Dinner: Touch of Spice, Jacksonville (Average Cost: $70, Cuisine: French, Bakery, Indian, Seafood)\n- Attractions: MOSH (Museum Of Science & History), Tree Hill Nature Center\n- Accommodation: NYC Sanctuary, Skyline Views & Rooftop, Jacksonville (Price: $954, Entire home/apt)\n- Total Accommodation Cost: $954 x 4 rooms x 1 night = $3,816\n- Total Day Cost: $456 (breakfast for 8) + $472 (lunch for 8) + $560 (dinner for 8) + $3,816 (accommodation) + Attraction costs (estimated at $200) = $5,504\n\n**Day 7: March 14, 2022 - Jacksonville to Rockford**\n- Transportation: Self-driving from Jacksonville to Rockford (16 hours 42 mins, 1,852 km, cost: $92)\n- Breakfast: Sanjha Chulha, Jacksonville (Average Cost: $57, Cuisine: Tea, Bakery, BBQ)\n- Lunch: Packed or on-the-go (Cost estimated at $120)\n- Dinner: N/A (Assuming arrival late in the evening)\n- Attractions: No attractions due to travel time\n- Accommodation: N/A (Returning home)\n- Total Day Cost: $92 (transportation) + $456 (breakfast for 8) + $120 (lunch) = $668\n\n**Total Trip Cost: $1,183 (Day 1) + $1,901 (Day 2) + $2,511 (Day 3) + $2,744 (Day 4) + $4,687 (Day 5) + $5,504 (Day 6) + $668 (Day 7) = $19,198**\n\nUnfortunately, the total estimated cost of the trip ($19,198) exceeds the budget of $17,000. To stay within budget, consider reducing accommodation costs by choosing less expensive options, limiting the number of attractions visited, or finding more budget-friendly meal options. Additionally, the cost of self-driving has been calculated based on the assumption of renting a vehicle large enough for 8 people and their luggage, which may vary. Please adjust the plan accordingly to meet the budget constraints.", "gpt-4-1106-preview_direct_sole-planning_parsed_results": [{"day": 1, "current_city": "from Rockford to Gainesville", "transportation": "Self-driving from Rockford to Gainesville", "breakfast": "-", "attraction": "-", "lunch": "-", "dinner": "The Machine Shed Restaurant, Gainesville", "accommodation": "Spacious Upper East Side 1BR apt near attractions, Gainesville"}, {"day": 2, "current_city": "Gainesville", "transportation": "-", "breakfast": "The Food Garage, Gainesville", "attraction": "Florida Museum of Natural History-Exhibits, Gainesville;Butterfly Rainforest, Gainesville;Kanapaha Botanical Gardens, Gainesville;", "lunch": "Carnival By Tresind, Gainesville", "dinner": "Parker's, Gainesville", "accommodation": "Spacious Upper East Side 1BR apt near attractions, Gainesville"}, {"day": 3, "current_city": "from Gainesville to Daytona Beach", "transportation": "Self-driving from Gainesville to Daytona Beach", "breakfast": "CHA, Gainesville", "attraction": "Daytona Boardwalk Amusements, Daytona Beach;Daytona Lagoon, Daytona Beach;", "lunch": "-", "dinner": "Outback Steakhouse, Daytona Beach", "accommodation": "Homey 1BR in Fun, Central West Village w/ Doorman by Blueground, Daytona Beach"}, {"day": 4, "current_city": "Daytona Beach", "transportation": "-", "breakfast": "Beach Box Cafe, Daytona Beach", "attraction": "Daytona Beach Main Street Pier, Daytona Beach;Sun Splash Park, Daytona Beach;", "lunch": "Bespoke Harvest, Daytona Beach", "dinner": "Rocks on the River, Daytona Beach", "accommodation": "Homey 1BR in Fun, Central West Village w/ Doorman by Blueground, Daytona Beach"}, {"day": 5, "current_city": "from Daytona Beach to Jacksonville", "transportation": "Self-driving from Daytona Beach to Jacksonville", "breakfast": "Mom & Dad's Italian Restaurant, Daytona Beach", "attraction": "Jacksonville Zoo and Gardens, Jacksonville;Southbank Riverwalk, Jacksonville;", "lunch": "-", "dinner": "Villa Gargano, Jacksonville", "accommodation": "NYC Sanctuary, Skyline Views & Rooftop, Jacksonville"}, {"day": 6, "current_city": "Jacksonville", "transportation": "-", "breakfast": "Goose Feathers Cafe and Bakery, Jacksonville", "attraction": "MOSH (Museum Of Science & History), Jacksonville;Tree Hill Nature Center, Jacksonville;", "lunch": "Pirates' House Restaurant, Jacksonville", "dinner": "Touch of Spice, Jacksonville", "accommodation": "NYC Sanctuary, Skyline Views & Rooftop, Jacksonville"}, {"day": 7, "current_city": "from Jacksonville to Rockford", "transportation": "Self-driving from Jacksonville to Rockford", "breakfast": "Sanjha Chulha, Jacksonville", "attraction": "-", "lunch": "-", "dinner": "-", "accommodation": "-"}]}]