[{"gpt-4-1106-preview_direct_sole-planning_results": "Travel Plan:\n\nDays: 1\nCurrent City: from Atlanta, Georgia to Knoxville, Tennessee\nTransportation: Flight F3556207, from Atlanta to Knoxville, duration: 0 hours 45 minutes, cost: 45\nBreakfast: -\nAttraction: -\nLunch: -\nDinner: Cafe Arabelle, Knoxville, cost: 29, cuisines: French, BBQ, Desserts, Seafood\nAccommodation: Cozy Private Room in Chinatown/ Lower East Side, Knoxville, cost: 132, room type: Private room, house rules: No pets & No visitors, minimum nights: 1, maximum occupancy: 2\n\nNumber of people: 1 (Note: Children under 10 are accommodated but not specified in the number of travelers)\nTotal cost: 45 x 1 + 29 x 1 + 132 x 1 = 206\nAccommodation minimum nights: 1/1\n\nDays: 2\nCurrent City: Knoxville\nTransportation: Taxi within Knoxville (for attractions), estimated cost: 50\nBreakfast: Les 3 Brasseurs, Knoxville, cost: 24, cuisines: Desserts, Pizza, Italian, Cafe, Indian\nAttraction: Zoo Knoxville, Knoxville; Knoxville Museum of Art, Knoxville\nLunch: Mamagoto, Knoxville, cost: 14, cuisines: Indian, Mediterranean, Desserts, Seafood\nDinner: Cafe Coffee Day, Knoxville, cost: 82, cuisines: Fast Food, American, BBQ, Italian\nAccommodation: Cozy Private Room in Chinatown/ Lower East Side, Knoxville, cost: 132, room type: Private room, house rules: No pets & No visitors, minimum nights: 1, maximum occupancy: 2\n\nNumber of people: 1\nTotal cost: 50 x 1 + 24 x 1 + 14 x 1 + 82 x 1 + 132 x 1 = 302\nAccommodation minimum nights: 2/2\n\nDays: 3\nCurrent City: from Knoxville, Tennessee to Atlanta, Georgia\nTransportation: Flight F3517130, from Knoxville to Atlanta, duration: 0 hours 56 minutes, cost: 30\nBreakfast: Punjabi Flavour, Knoxville, cost: 41, cuisines: Tea, Bakery, Cafe, Indian, Seafood\nAttraction: -\nLunch: -\nDinner: -\nAccommodation: -\n\nNumber of people: 1\nTotal cost: 30 x 1 + 41 x 1 = 71\n\nTotal cost across all days: 206 x 1 + 302 x 1 + 71 x 1 = 579\n\nCuisines: The prompt specifies no cuisines, so all cuisine constraints are satisfied\n\nNote: The travel plan includes only one traveler, and the budget is well within the $1,000 limit. The accommodations selected can accommodate children under 10, and no self-driving options were included as per the query constraints.", "gpt-4-1106-preview_direct_sole-planning_parsed_results": [{"day": 1, "current_city": "from Atlanta, Georgia to Knoxville, Tennessee", "transportation": "Flight Number: F3556207, from Atlanta to Knoxville, Departure Time: -, Arrival Time: -", "breakfast": "-", "attraction": "-", "lunch": "-", "dinner": "Cafe Arabelle, Knoxville", "accommodation": "Cozy Private Room in Chinatown/ Lower East Side, Knoxville"}, {"day": 2, "current_city": "Knoxville", "transportation": "Taxi within Knoxville", "breakfast": "Les 3 Brasseurs, Knoxville", "attraction": "Zoo Knoxville, Knoxville;Knoxville Museum of Art, Knoxville;", "lunch": "Mamagoto, Knoxville", "dinner": "Cafe Coffee Day, Knoxville", "accommodation": "Cozy Private Room in Chinatown/ Lower East Side, Knoxville"}, {"day": 3, "current_city": "from Knoxville, Tennessee to Atlanta, Georgia", "transportation": "Flight Number: F3517130, from Knoxville to Atlanta, Departure Time: -, Arrival Time: -", "breakfast": "Punjabi Flavour, Knoxville", "attraction": "-", "lunch": "-", "dinner": "-", "accommodation": "-"}]}]