[{"gpt-4-1106-preview_direct_sole-planning_results": "Travel Plan:\n\nDays: 1\nCurrent City: from Seattle, Washington to San Francisco, California\nTransportation: Flight F3534033, from Seattle to San Francisco, departure: 19:43, arrival: 21:42, duration: 1 hour 59 minutes, cost: $225\nBreakfast: -\nAttraction: -\nLunch: -\nDinner: Coffee & Chai Co., San Francisco, cost: $10, cuisines: Tea, Mexican, BBQ, Cafe, Seafood\nAccommodation: Room in Down town Brooklyn Parkslop, San Francisco, cost: $79, room type: Private room, house rules: No visitors, minimum nights: 1, maximum occupancy: 2\n\nNumber of people: 1\nTotal cost: $225 (flight) + $10 (dinner) + $79 (accommodation) = $314\nAccommodation minimum nights: 1/1\n\nDays: 2\nCurrent City: San Francisco\nTransportation: -\nBreakfast: Tokyo Sushi, San Francisco, cost: $18, cuisines: Cafe, Pizza, BBQ\nAttraction: Golden Gate Bridge, San Francisco; Golden Gate Park, San Francisco\nLunch: That Baat, San Francisco, cost: $59, cuisines: Pizza, Bakery\nDinner: Empress, San Francisco, cost: $24, cuisines: Pizza, BBQ, Mediterranean, Fast Food\nAccommodation: Room in Down town Brooklyn Parkslop, San Francisco, cost: $79, room type: Private room, house rules: No visitors, minimum nights: 1, maximum occupancy: 2\n\nNumber of people: 1\nTotal cost: $18 (breakfast) + $59 (lunch) + $24 (dinner) + $79 (accommodation) = $180\nAccommodation minimum nights: 1/1\n\nDays: 3\nCurrent City: from San Francisco, California to Seattle, Washington\nTransportation: Flight F3749172, from San Francisco to Seattle, departure: 21:36, arrival: 23:31, duration: 1 hour 55 minutes, cost: $148\nBreakfast: Bonne Bouche, San Francisco, cost: $21, cuisines: Tea, Chinese, American, Cafe\nAttraction: Exploratorium, San Francisco\nLunch: Sudarshan, San Francisco, cost: $53, cuisines: Fast Food, Bakery, Mediterranean, Italian\nDinner: -\nAccommodation: -\n\nNumber of people: 1\nTotal cost: $21 (breakfast) + $53 (lunch) + $148 (flight) = $222\n\nTotal cost across all days: $314 (Day 1) + $180 (Day 2) + $222 (Day 3) = $716\n\nCuisines: The prompt specifies no cuisines, so all cuisine constraints are satisfied\n\nNote: The travel plan adheres to the budget of $900, includes all required details for each day, and ensures no repetition of restaurants or attractions. The transportation method is consistent with flights only, and the accommodation is private as per the constraints.", "gpt-4-1106-preview_direct_sole-planning_parsed_results": [{"day": 1, "current_city": "from Seattle, Washington to San Francisco, California", "transportation": "Flight Number: F3534033, from Seattle to San Francisco, Departure Time: 19:43, Arrival Time: 21:42", "breakfast": "-", "attraction": "-", "lunch": "-", "dinner": "Coffee & Chai Co., San Francisco", "accommodation": "Room in Down town Brooklyn Parkslop, San Francisco"}, {"day": 2, "current_city": "San Francisco", "transportation": "-", "breakfast": "Tokyo Sushi, San Francisco", "attraction": "Golden Gate Bridge, San Francisco;Golden Gate Park, San Francisco;", "lunch": "That Baat, San Francisco", "dinner": "Empress, San Francisco", "accommodation": "Room in Down town Brooklyn Parkslop, San Francisco"}, {"day": 3, "current_city": "from San Francisco, California to Seattle, Washington", "transportation": "Flight Number: F3749172, from San Francisco to Seattle, Departure Time: 21:36, Arrival Time: 23:31", "breakfast": "Bonne Bouche, San Francisco", "attraction": "Exploratorium, San Francisco", "lunch": "Sudarshan, San Francisco", "dinner": "-", "accommodation": "-"}]}]