[{"gpt-4-1106-preview_direct_sole-planning_results": "Travel Plan:\n\nDays: 1\nCurrent City: from Monterey, California to Dallas, Texas\nTransportation: Flight F4046679, from Monterey to Dallas, duration: 3 hours 16 minutes, cost: 489 x 4 = 1956\nBreakfast: -\nAttraction: -\nLunch: -\nDinner: 1918 Bistro & Grill, Dallas, cost: 90 x 4 = 360, cuisines: Tea, Pizza, BBQ, Seafood\nAccommodation: Luxury Williamsburg duplex, private roof terrace, Dallas, cost: 241 x 4 = 964, maximum occupancy: 3, house rules: No visitors, minimum nights: 4\n\nNumber of people: 4\nTotal cost: 1956 + 360 + 964 = 3280\nAccommodation minimum nights: 1/4\n\nDays: 2\nCurrent City: Dallas\nTransportation: -\nBreakfast: Coconuts Fish Cafe, Dallas, cost: 38 x 4 = 152, cuisines: Cafe, BBQ, Mediterranean, Fast Food\nAttraction: The Dallas World Aquarium, Dallas; The Sixth Floor Museum at Dealey Plaza, Dallas\nLunch: Yanki Sizzlers, Dallas, cost: 96 x 4 = 384, cuisines: Cafe, French, Tea, Mediterranean\nDinner: L'Opera, Dallas, cost: 77 x 4 = 308, cuisines: French, Bakery, BBQ, Fast Food, Seafood\nAccommodation: Luxury Williamsburg duplex, private roof terrace, Dallas, cost: 241 x 4 = 964, maximum occupancy: 3, house rules: No visitors, minimum nights: 4\n\nNumber of people: 4\nTotal cost: 152 + 384 + 308 + 964 = 1808\nAccommodation minimum nights: 2/4\n\nDays: 3\nCurrent City: Dallas\nTransportation: -\nBreakfast: Cafe Gatherings, Dallas, cost: 17 x 4 = 68, cuisines: Bakery, Indian, Desserts\nAttraction: Reunion Tower, Dallas; Dallas Museum of Art, Dallas\nLunch: Aravali Owls, Dallas, cost: 53 x 4 = 212, cuisines: Pizza, Italian, Bakery, Fast Food, Cafe\nDinner: Firefly India, Dallas, cost: 87 x 4 = 348, cuisines: Cafe, Bakery, American, Italian\nAccommodation: Luxury Williamsburg duplex, private roof terrace, Dallas, cost: 241 x 4 = 964, maximum occupancy: 3, house rules: No visitors, minimum nights: 4\n\nNumber of people: 4\nTotal cost: 68 + 212 + 348 + 964 = 1592\nAccommodation minimum nights: 3/4\n\nDays: 4\nCurrent City: from Dallas, Texas to Del Rio, Texas\nTransportation: Self-driving, from Dallas to Del Rio, duration: 6 hours 21 mins, cost: 33 x 4 = 132\nBreakfast: -\nAttraction: -\nLunch: -\nDinner: Green Chick Chop, Del Rio, cost: 82 x 4 = 328, cuisines: Tea, Bakery, Indian, Mediterranean, Seafood\nAccommodation: Spacious Brooklyn One Bedroom/Loft***Morgan L Stop, Del Rio, cost: 1164 x 4 = 4656, maximum occupancy: 4, house rules: No visitors, minimum nights: 4\n\nNumber of people: 4\nTotal cost: 132 + 328 + 4656 = 5116\nAccommodation minimum nights: 1/4\n\nDays: 5\nCurrent City: Del Rio\nTransportation: -\nBreakfast: HuHot Mongolian Grill, Del Rio, cost: 71 x 4 = 284, cuisines: Cafe, Bakery, BBQ, Fast Food\nAttraction: Whitehead Memorial Museum, Del Rio; Amistad National Recreation Area, Del Rio\nLunch: Chaudhary Chaap & Chinese, Del Rio, cost: 85 x 4 = 340, cuisines: Pizza, Mediterranean, Desserts, Italian\nDinner: Jom Jom Malay, Del Rio, cost: 78 x 4 = 312, cuisines: Chinese, Indian, Desserts, Fast Food\nAccommodation: Spacious Brooklyn One Bedroom/Loft***Morgan L Stop, Del Rio, cost: 1164 x 4 = 4656, maximum occupancy: 4, house rules: No visitors, minimum nights: 4\n\nNumber of people: 4\nTotal cost: 284 + 340 + 312 + 4656 = 5592\nAccommodation minimum nights: 2/4\n\nDays: 6\nCurrent City: Del Rio\nTransportation: -\nBreakfast: Side Wok, Del Rio, cost: 95 x 4 = 380, cuisines: Bakery, Pizza, Desserts, Italian\nAttraction: Devils River State Natural Area, Del Rio; The Brinkley Mansion, Del Rio\nLunch: Pizzoccheri, Del Rio, cost: 77 x 4 = 308, cuisines: Cafe, Seafood, Mediterranean, Italian\nDinner: Locale, Del Rio, cost: 43 x 4 = 172, cuisines: Desserts, Pizza, Fast Food, Chinese, American, Seafood\nAccommodation: Spacious Brooklyn One Bedroom/Loft***Morgan L Stop, Del Rio, cost: 1164 x 4 = 4656, maximum occupancy: 4, house rules: No visitors, minimum nights: 4\n\nNumber of people: 4\nTotal cost: 380 + 308 + 172 + 4656 = 5516\nAccommodation minimum nights: 3/4\n\nDays: 7\nCurrent City: from Del Rio, Texas to Monterey, California\nTransportation: Self-driving from Del Rio to Amarillo, duration: 7 hours 0 mins, cost: 37 x 4 = 148\nSelf-driving from Amarillo to Monterey, duration: 19 hours 21 mins, cost: 105 x 4 = 420\nBreakfast: -\nAttraction: -\nLunch: -\nDinner: -\nAccommodation: -\n\nNumber of people: 4\nTotal cost: 148 + 420 = 568\n\nTotal cost across all days: 3280 + 1808 + 1592 + 5116 + 5592 + 5516 + 568 = 23472\n\nUnfortunately, the total cost of $23,472 exceeds the specified budget of $15,600. Adjustments will need to be made to the travel plan to meet the budget constraints. This could involve changing accommodations, meal plans, or transportation methods.", "gpt-4-1106-preview_direct_sole-planning_parsed_results": [{"day": 1, "current_city": "from Monterey, California to Dallas, Texas", "transportation": "Flight Number: F4046679, from Monterey to Dallas, Departure Time: -, Arrival Time: -", "breakfast": "-", "attraction": "-", "lunch": "-", "dinner": "1918 Bistro & Grill, Dallas", "accommodation": "Luxury Williamsburg duplex, private roof terrace, Dallas"}, {"day": 2, "current_city": "Dallas", "transportation": "-", "breakfast": "Coconuts Fish Cafe, Dallas", "attraction": "The Dallas World Aquarium, Dallas;The Sixth Floor Museum at Dealey Plaza, Dallas;", "lunch": "Yanki Sizzlers, Dallas", "dinner": "L'Opera, Dallas", "accommodation": "Luxury Williamsburg duplex, private roof terrace, Dallas"}, {"day": 3, "current_city": "Dallas", "transportation": "-", "breakfast": "Cafe Gatherings, Dallas", "attraction": "Reunion Tower, Dallas;Dallas Museum of Art, Dallas;", "lunch": "Aravali Owls, Dallas", "dinner": "Firefly India, Dallas", "accommodation": "Luxury Williamsburg duplex, private roof terrace, Dallas"}, {"day": 4, "current_city": "from Dallas, Texas to Del Rio, Texas", "transportation": "Self-driving, from Dallas to Del Rio, Departure Time: -, Arrival Time: -", "breakfast": "-", "attraction": "-", "lunch": "-", "dinner": "Green Chick Chop, Del Rio", "accommodation": "Spacious Brooklyn One Bedroom/Loft***Morgan L Stop, Del Rio"}, {"day": 5, "current_city": "Del Rio", "transportation": "-", "breakfast": "HuHot Mongolian Grill, Del Rio", "attraction": "Whitehead Memorial Museum, Del Rio;Amistad National Recreation Area, Del Rio;", "lunch": "Chaudhary Chaap & Chinese, Del Rio", "dinner": "Jom Jom Malay, Del Rio", "accommodation": "Spacious Brooklyn One Bedroom/Loft***Morgan L Stop, Del Rio"}, {"day": 6, "current_city": "Del Rio", "transportation": "-", "breakfast": "Side Wok, Del Rio", "attraction": "Devils River State Natural Area, Del Rio;The Brinkley Mansion, Del Rio;", "lunch": "Pizzoccheri, Del Rio", "dinner": "Locale, Del Rio", "accommodation": "Spacious Brooklyn One Bedroom/Loft***Morgan L Stop, Del Rio"}, {"day": 7, "current_city": "from Del Rio, Texas to Monterey, California", "transportation": "Self-driving from Del Rio to Amarillo, Departure Time: -, Arrival Time: -;Self-driving from Amarillo to Monterey, Departure Time: -, Arrival Time: -", "breakfast": "-", "attraction": "-", "lunch": "-", "dinner": "-", "accommodation": "-"}]}]