[{"gpt-4-1106-preview_direct_sole-planning_results": "Travel Plan:\n\nDays: 1\nDate: March 8, 2022\nCurrent City: from Rockford to Gainesville\nTransportation: Self-driving, from Rockford to Gainesville, duration: 16 hours 30 mins, distance: 1,822 km, cost: 91 x 8 = 728\nBreakfast: -\nAttraction: -\nLunch: -\nDinner: The Machine Shed Restaurant, Gainesville, cost: 62 x 8 = 496, cuisines: Pizza, Mexican, Bakery, Fast Food, Indian, Seafood\nAccommodation: Spacious yet Cozy Room in Manhattan, Gainesville, cost: 566 x 8 = 4528, room type: Entire home/apt, house rules: No visitors, minimum nights: 3, maximum occupancy: 2\n\nNumber of people: 8\nTotal cost: 728 + 496 + 4528 = 5752\nAccommodation minimum nights: 1/3\n\nDays: 2\nDate: March 9, 2022\nCurrent City: Gainesville\nTransportation: -\nBreakfast: Pirates' House Restaurant, Gainesville, cost: 59 x 8 = 472, cuisines: Chinese, Pizza, BBQ\nAttraction: Florida Museum of Natural History-Exhibits, Gainesville\nLunch: Carnival By Tresind, Gainesville, cost: 67 x 8 = 536, cuisines: Tea, Chinese, Pizza, Mediterranean\nDinner: Parker's, Gainesville, cost: 74 x 8 = 592, cuisines: Desserts, Tea, Italian, French, Bakery, BBQ\nAccommodation: Spacious yet Cozy Room in Manhattan, Gainesville, cost: 566 x 8 = 4528, room type: Entire home/apt, house rules: No visitors, minimum nights: 3, maximum occupancy: 2\n\nNumber of people: 8\nTotal cost: 472 + 536 + 592 + 4528 = 6128\nAccommodation minimum nights: 2/3\n\nDays: 3\nDate: March 10, 2022\nCurrent City: from Gainesville to Daytona Beach\nTransportation: Self-driving, from Gainesville to Daytona Beach, duration: 2 hours 2 mins, distance: 158 km, cost: 7 x 8 = 56\nBreakfast: Goose Feathers Cafe and Bakery, Gainesville, cost: 57 x 8 = 456, cuisines: Tea, Fast Food, Italian\nAttraction: Devil's Millhopper Geological State Park, Gainesville\nLunch: Aggarwal Sweet Corner, Gainesville, cost: 70 x 8 = 560, cuisines: Tea, American, Seafood\nDinner: Outback Steakhouse, Daytona Beach, cost: 58 x 8 = 464, cuisines: Desserts, Pizza, Mexican, Cafe, American\nAccommodation: Homey 1BR in Fun, Central West Village w/ Doorman by Blueground, Daytona Beach, cost: 262 x 8 = 2096, room type: Entire home/apt, house rules: No parties, minimum nights: 30, maximum occupancy: 2\n\nNumber of people: 8\nTotal cost: 56 + 456 + 560 + 464 + 2096 = 3632\nAccommodation minimum nights: 1/30\n\nDays: 4\nDate: March 11, 2022\nCurrent City: Daytona Beach\nTransportation: -\nBreakfast: Bespoke Harvest, Daytona Beach, cost: 56 x 8 = 448, cuisines: Cafe, BBQ, Fast Food\nAttraction: Daytona Boardwalk Amusements, Daytona Beach\nLunch: Beach Box Cafe, Daytona Beach, cost: 96 x 8 = 768, cuisines: Chinese, Pizza, BBQ, Cafe\nDinner: Rocks on the River, Daytona Beach, cost: 35 x 8 = 280, cuisines: Tea, Indian, BBQ\nAccommodation: Homey 1BR in Fun, Central West Village w/ Doorman by Blueground, Daytona Beach, cost: 262 x 8 = 2096, room type: Entire home/apt, house rules: No parties, minimum nights: 30, maximum occupancy: 2\n\nNumber of people: 8\nTotal cost: 448 + 768 + 280 + 2096 = 3592\nAccommodation minimum nights: 2/30\n\nDays: 5\nDate: March 12, 2022\nCurrent City: from Daytona Beach to Jacksonville\nTransportation: Self-driving, from Daytona Beach to Jacksonville, duration: 1 hour 28 mins, distance: 143 km, cost: 7 x 8 = 56\nBreakfast: Mom & Dad's Italian Restaurant, Daytona Beach, cost: 17 x 8 = 136, cuisines: Tea, Mexican, Cafe, Indian, Seafood\nAttraction: Daytona Lagoon, Daytona Beach\nLunch: Khaaja Chowk, Daytona Beach, cost: 61 x 8 = 488, cuisines: French, Bakery, American, Seafood\nDinner: Villa Gargano, Jacksonville, cost: 51 x 8 = 408, cuisines: Tea, American, Desserts\nAccommodation: NYC Sanctuary, Skyline Views & Rooftop, Jacksonville, cost: 954 x 8 = 7632, room type: Entire home/apt, house rules: No smoking, minimum nights: 3, maximum occupancy: 6\n\nNumber of people: 8\nTotal cost: 56 + 136 + 488 + 408 + 7632 = 8720\nAccommodation minimum nights: 1/3\n\nDays: 6\nDate: March 13, 2022\nCurrent City: Jacksonville\nTransportation: -\nBreakfast: Pirates of Grill, Jacksonville, cost: 65 x 8 = 520, cuisines: Tea, Chinese, Desserts\nAttraction: Jacksonville Zoo and Gardens, Jacksonville\nLunch: Keventers, Jacksonville, cost: 96 x 8 = 768, cuisines: Tea, American, Mediterranean, Fast Food\nDinner: Pizza Hut Delivery, Jacksonville, cost: 35 x 8 = 280, cuisines: Tea, Pizza, Fast Food, Chinese, Indian, Seafood\nAccommodation: NYC Sanctuary, Skyline Views & Rooftop, Jacksonville, cost: 954 x 8 = 7632, room type: Entire home/apt, house rules: No smoking, minimum nights: 3, maximum occupancy: 6\n\nNumber of people: 8\nTotal cost: 520 + 768 + 280 + 7632 = 9200\nAccommodation minimum nights: 2/3\n\nDays: 7\nDate: March 14, 2022\nCurrent City: from Jacksonville to Rockford\nTransportation: Self-driving, from Jacksonville to Rockford, duration: 16 hours 42 mins, distance: 1,852 km, cost: 92 x 8 = 736\nBreakfast: Goose Feathers Cafe and Bakery, Jacksonville, cost: 57 x 8 = 456, cuisines: Tea, Fast Food, Italian\nAttraction: -\nLunch: -\nDinner: -\nAccommodation: -\n\nNumber of people: 8\nTotal cost: 736 + 456 = 1192\n\nTotal cost across all days: 5752 + 6128 + 3632 + 3592 + 8720 + 9200 + 1192 = 38216\n\nUnfortunately, the total cost of the travel plan ($38,216) exceeds the specified budget of $17,000. Adjustments will need to be made to the plan to reduce costs, such as choosing more budget-friendly accommodations, reducing meal costs, or altering the itinerary to visit fewer attractions or restaurants.", "gpt-4-1106-preview_direct_sole-planning_parsed_results": [{"day": 1, "current_city": "from Rockford to Gainesville", "transportation": "Self-driving, from Rockford to Gainesville, duration: 16 hours 30 mins, distance: 1,822 km", "breakfast": "-", "attraction": "-", "lunch": "-", "dinner": "The Machine Shed Restaurant, Gainesville", "accommodation": "Spacious yet Cozy Room in Manhattan, Gainesville"}, {"day": 2, "current_city": "Gainesville", "transportation": "-", "breakfast": "Pirates' House Restaurant, Gainesville", "attraction": "Florida Museum of Natural History-Exhibits, Gainesville", "lunch": "Carnival By Tresind, Gainesville", "dinner": "Parker's, Gainesville", "accommodation": "Spacious yet Cozy Room in Manhattan, Gainesville"}, {"day": 3, "current_city": "from Gainesville to Daytona Beach", "transportation": "Self-driving, from Gainesville to Daytona Beach, duration: 2 hours 2 mins, distance: 158 km", "breakfast": "Goose Feathers Cafe and Bakery, Gainesville", "attraction": "Devil's Millhopper Geological State Park, Gainesville", "lunch": "Aggarwal Sweet Corner, Gainesville", "dinner": "Outback Steakhouse, Daytona Beach", "accommodation": "Homey 1BR in Fun, Central West Village w/ Doorman by Blueground, Daytona Beach"}, {"day": 4, "current_city": "Daytona Beach", "transportation": "-", "breakfast": "Bespoke Harvest, Daytona Beach", "attraction": "Daytona Boardwalk Amusements, Daytona Beach", "lunch": "Beach Box Cafe, Daytona Beach", "dinner": "Rocks on the River, Daytona Beach", "accommodation": "Homey 1BR in Fun, Central West Village w/ Doorman by Blueground, Daytona Beach"}, {"day": 5, "current_city": "from Daytona Beach to Jacksonville", "transportation": "Self-driving, from Daytona Beach to Jacksonville, duration: 1 hour 28 mins, distance: 143 km", "breakfast": "Mom & Dad's Italian Restaurant, Daytona Beach", "attraction": "Daytona Lagoon, Daytona Beach", "lunch": "Khaaja Chowk, Daytona Beach", "dinner": "Villa Gargano, Jacksonville", "accommodation": "NYC Sanctuary, Skyline Views & Rooftop, Jacksonville"}, {"day": 6, "current_city": "Jacksonville", "transportation": "-", "breakfast": "Pirates of Grill, Jacksonville", "attraction": "Jacksonville Zoo and Gardens, Jacksonville", "lunch": "Keventers, Jacksonville", "dinner": "Pizza Hut Delivery, Jacksonville", "accommodation": "NYC Sanctuary, Skyline Views & Rooftop, Jacksonville"}, {"day": 7, "current_city": "from Jacksonville to Rockford", "transportation": "Self-driving, from Jacksonville to Rockford, duration: 16 hours 42 mins, distance: 1,852 km", "breakfast": "Goose Feathers Cafe and Bakery, Jacksonville", "attraction": "-", "lunch": "-", "dinner": "-", "accommodation": "-"}]}]