[{"gpt-4-1106-preview_direct_sole-planning_results": "Travel Plan:\n\nDays: 1\nCurrent City: from Grand Junction, Colorado to Phoenix, Arizona\nTransportation: Self-driving, from Grand Junction to Phoenix, duration: 9 hours 11 mins, distance: 934 km, cost: 46 x 2 = 92\nBreakfast: -\nAttraction: -\nLunch: -\nDinner: Pizza Hut, Phoenix, cost: 30 x 2 = 60, cuisines: Tea, Chinese, Desserts, Seafood\nAccommodation: 1 BR in Carroll Gardens Townhouse, Phoenix, cost: 397 x 2 = 794, room type: Private room, house rules: No visitors & No smoking, minimum nights: 2, maximum occupancy: 1\n\nNumber of people: 2\nTotal cost: 92 + 60 + 794 = 946\nAccommodation minimum nights: 1/2\n\nDays: 2\nCurrent City: Phoenix\nTransportation: -\nBreakfast: Doughlicious, Phoenix, cost: 41 x 2 = 82, cuisines: French, Pizza, BBQ\nAttraction: Desert Botanical Garden, Phoenix; Heard Museum, Phoenix\nLunch: Mama Loca, Phoenix, cost: 27 x 2 = 54, cuisines: Desserts, Pizza, Italian, Bakery, Fast Food\nDinner: Mocambo, Phoenix, cost: 76 x 2 = 152, cuisines: Tea, Chinese, Desserts, Fast Food\nAccommodation: 1 BR in Carroll Gardens Townhouse, Phoenix, cost: 397 x 2 = 794, room type: Private room, house rules: No visitors & No smoking, minimum nights: 2, maximum occupancy: 1\n\nNumber of people: 2\nTotal cost: 82 + 54 + 152 + 794 = 1082\nAccommodation minimum nights: 2/2\n\nDays: 3\nCurrent City: from Phoenix to Tucson\nTransportation: Self-driving, from Phoenix to Tucson, duration: 1 hour 44 mins, distance: 181 km, cost: 9 x 2 = 18\nBreakfast: Village Restaurant, Phoenix, cost: 35 x 2 = 70, cuisines: Tea, Cafe, Desserts, Italian\nAttraction: Pima Air & Space Museum, Tucson; Reid Park Zoo, Tucson\nLunch: Villa Tevere, Tucson, cost: 37 x 2 = 74, cuisines: Mexican, Mediterranean, Desserts, Fast Food\nDinner: Consort Restaurant, Tucson, cost: 54 x 2 = 108, cuisines: Bakery, Pizza, Indian, Desserts\nAccommodation: Room for rent shared bathroom, Tucson, cost: 557 x 2 = 1114, room type: Private room, house rules: No smoking, minimum nights: 1, maximum occupancy: 2\n\nNumber of people: 2\nTotal cost: 18 + 70 + 74 + 108 + 1114 = 1384\nAccommodation minimum nights: 1/1\n\nDays: 4\nCurrent City: Tucson\nTransportation: -\nBreakfast: Magic Spice Wok, Tucson, cost: 31 x 2 = 62, cuisines: Cafe, Bakery, BBQ, Chinese, Seafood\nAttraction: Tucson Botanical Gardens, Tucson; Old Tucson, Tucson\nLunch: La Plage, Tucson, cost: 93 x 2 = 186, cuisines: Seafood, Bakery, Desserts, Italian\nDinner: iKitchen, Tucson, cost: 69 x 2 = 138, cuisines: Seafood, Pizza, Italian\nAccommodation: Room for rent shared bathroom, Tucson, cost: 557 x 2 = 1114, room type: Private room, house rules: No smoking, minimum nights: 1, maximum occupancy: 2\n\nNumber of people: 2\nTotal cost: 62 + 186 + 138 + 1114 = 1500\nAccommodation minimum nights: 1/1\n\nDays: 5\nCurrent City: from Tucson to Grand Junction\nTransportation: Self-driving, from Tucson to Grand Junction, duration: 10 hours 36 mins, distance: 1,113 km, cost: 55 x 2 = 110\nBreakfast: Pizza Street, Tucson, cost: 22 x 2 = 44, cuisines: Fast Food, Bakery, Seafood\nAttraction: -\nLunch: -\nDinner: -\nAccommodation: -\n\nNumber of people: 2\nTotal cost: 110 + 44 = 154\n\nTotal cost across all days: 946 + 1082 + 1384 + 1500 + 154 = 5066\n\nUnfortunately, the total cost of $5066 exceeds the specified budget of $2100. To adjust the plan within the budget, we need to make some changes:\n\n- Reduce accommodation costs by selecting cheaper options.\n- Limit dining out to one meal per day and opt for more budget-friendly restaurants.\n- Reduce attraction visits or select free attractions.\n\nPlease note that the provided information does not include cheaper accommodation options that allow visitors and provide private rooms. Additionally, the cost of attractions and some meals is not provided, which could further impact the budget. Therefore, without additional information, it is not possible to create a detailed plan that meets all the specified constraints and stays within the budget.", "gpt-4-1106-preview_direct_sole-planning_parsed_results": [{"day": 1, "current_city": "from Grand Junction, Colorado to Phoenix, Arizona", "transportation": "Self-driving, from Grand Junction to Phoenix, duration: 9 hours 11 mins, distance: 934 km", "breakfast": "-", "attraction": "-", "lunch": "-", "dinner": "Pizza Hut, Phoenix", "accommodation": "1 BR in Carroll Gardens Townhouse, Phoenix"}, {"day": 2, "current_city": "Phoenix", "transportation": "-", "breakfast": "Doughlicious, Phoenix", "attraction": "Desert Botanical Garden, Phoenix;Heard Museum, Phoenix;", "lunch": "Mama Loca, Phoenix", "dinner": "Mocambo, Phoenix", "accommodation": "1 BR in Carroll Gardens Townhouse, Phoenix"}, {"day": 3, "current_city": "from Phoenix to Tucson", "transportation": "Self-driving, from Phoenix to Tucson, duration: 1 hour 44 mins, distance: 181 km", "breakfast": "Village Restaurant, Phoenix", "attraction": "Pima Air & Space Museum, Tucson;Reid Park Zoo, Tucson;", "lunch": "Villa Tevere, Tucson", "dinner": "Consort Restaurant, Tucson", "accommodation": "Room for rent shared bathroom, Tucson"}, {"day": 4, "current_city": "Tucson", "transportation": "-", "breakfast": "Magic Spice Wok, Tucson", "attraction": "Tucson Botanical Gardens, Tucson;Old Tucson, Tucson;", "lunch": "La Plage, Tucson", "dinner": "iKitchen, Tucson", "accommodation": "Room for rent shared bathroom, Tucson"}, {"day": 5, "current_city": "from Tucson to Grand Junction", "transportation": "Self-driving, from Tucson to Grand Junction, duration: 10 hours 36 mins, distance: 1,113 km", "breakfast": "Pizza Street, Tucson", "attraction": "-", "lunch": "-", "dinner": "-", "accommodation": "-"}]}]