[{"gpt-4-1106-preview_direct_sole-planning_results": "Travel Plan:\n\nDays: 1\nCurrent City: from Spokane, Washington to San Francisco, California\nTransportation: Flight F3853330, from Spokane to San Francisco, duration: 2 hours 28 minutes, cost: 227\nBreakfast: -\nAttraction: -\nLunch: -\nDinner: Tokyo Sushi, San Francisco, cost: 18, cuisines: Cafe, Pizza, BBQ\nAccommodation: Gorgeous Park Slope Studio, San Francisco, cost: 641, maximum occupancy: 5, house rules: No smoking & No parties, minimum nights: 14\n\nNumber of people: 1\nTotal cost: 227 x 1 + 18 x 1 + 641 x 1 = 886\nAccommodation minimum nights: 1/14\n\nDays: 2\nCurrent City: San Francisco\nTransportation: -\nBreakfast: Coffee & Chai Co., San Francisco, cost: 10, cuisines: Tea, Mexican, BBQ, Cafe, Seafood\nAttraction: Golden Gate Bridge, San Francisco; Golden Gate Park, San Francisco\nLunch: Empress, San Francisco, cost: 24, cuisines: Pizza, BBQ, Mediterranean, Fast Food\nDinner: Sudarshan, San Francisco, cost: 53, cuisines: Fast Food, Bakery, Mediterranean, Italian\nAccommodation: Gorgeous Park Slope Studio, San Francisco, cost: 641, maximum occupancy: 5, house rules: No smoking & No parties, minimum nights: 14\n\nNumber of people: 1\nTotal cost: 10 x 1 + 24 x 1 + 53 x 1 + 641 x 1 = 728\nAccommodation minimum nights: 2/14\n\nDays: 3\nCurrent City: from San Francisco to Spokane\nTransportation: Flight F3840215, from San Francisco to Spokane, duration: 2 hours 8 minutes, cost: 343\nBreakfast: Bonne Bouche, San Francisco, cost: 21, cuisines: Tea, Chinese, American, Cafe\nAttraction: -\nLunch: -\nDinner: -\nAccommodation: -\n\nNumber of people: 1\nTotal cost: 343 x 1 + 21 x 1 = 364\n\nTotal cost across all days: 886 x 1 + 728 x 1 + 364 x 1 = 1,978\n\nUnfortunately, the total cost exceeds the specified budget of $1,200. Adjustments are needed to meet the budget constraint. Let's consider self-driving instead of flights to reduce costs.\n\nAdjusted Travel Plan:\n\nDays: 1\nCurrent City: from Spokane, Washington to San Francisco, California\nTransportation: Self-driving, from Spokane to San Francisco, duration: 14 hours 5 mins, distance: 1,409 km, cost: 70\nBreakfast: -\nAttraction: -\nLunch: -\nDinner: Tokyo Sushi, San Francisco, cost: 18, cuisines: Cafe, Pizza, BBQ\nAccommodation: Room in Down town Brooklyn Parkslop, San Francisco, cost: 79, maximum occupancy: 2, house rules: No visitors, minimum nights: 1\n\nNumber of people: 1\nTotal cost: 70 x 1 + 18 x 1 + 79 x 1 = 167\nAccommodation minimum nights: 1/1\n\nDays: 2\nCurrent City: San Francisco\nTransportation: -\nBreakfast: Coffee & Chai Co., San Francisco, cost: 10, cuisines: Tea, Mexican, BBQ, Cafe, Seafood\nAttraction: Golden Gate Bridge, San Francisco; Golden Gate Park, San Francisco\nLunch: Empress, San Francisco, cost: 24, cuisines: Pizza, BBQ, Mediterranean, Fast Food\nDinner: Sudarshan, San Francisco, cost: 53, cuisines: Fast Food, Bakery, Mediterranean, Italian\nAccommodation: Room in Down town Brooklyn Parkslop, San Francisco, cost: 79, maximum occupancy: 2, house rules: No visitors, minimum nights: 1\n\nNumber of people: 1\nTotal cost: 10 x 1 + 24 x 1 + 53 x 1 + 79 x 1 = 166\nAccommodation minimum nights: 2/1\n\nDays: 3\nCurrent City: from San Francisco to Spokane\nTransportation: Self-driving, from San Francisco to Spokane, duration: 13 hours 57 mins, distance: 1,409 km, cost: 70\nBreakfast: Bonne Bouche, San Francisco, cost: 21, cuisines: Tea, Chinese, American, Cafe\nAttraction: -\nLunch: -\nDinner: -\nAccommodation: -\n\nNumber of people: 1\nTotal cost: 70 x 1 + 21 x 1 = 91\n\nTotal cost across all days: 167 x 1 + 166 x 1 + 91 x 1 = 424\n\nThe adjusted travel plan meets the budget constraint of $1,200.", "gpt-4-1106-preview_direct_sole-planning_parsed_results": [{"day": 1, "current_city": "from Spokane, Washington to San Francisco, California", "transportation": "Flight Number: F3853330, from Spokane to San Francisco, Departure Time: -, Arrival Time: -", "breakfast": "-", "attraction": "-", "lunch": "-", "dinner": "Tokyo Sushi, San Francisco", "accommodation": "Gorgeous Park Slope Studio, San Francisco"}, {"day": 2, "current_city": "San Francisco", "transportation": "-", "breakfast": "Coffee & Chai Co., San Francisco", "attraction": "Golden Gate Bridge, San Francisco;Golden Gate Park, San Francisco;", "lunch": "Empress, San Francisco", "dinner": "Sudarshan, San Francisco", "accommodation": "Gorgeous Park Slope Studio, San Francisco"}, {"day": 3, "current_city": "from San Francisco to Spokane", "transportation": "Flight Number: F3840215, from San Francisco to Spokane, Departure Time: -, Arrival Time: -", "breakfast": "Bonne Bouche, San Francisco", "attraction": "-", "lunch": "-", "dinner": "-", "accommodation": "-"}, {"day": 1, "current_city": "from Spokane, Washington to San Francisco, California", "transportation": "Self-driving, from Spokane to San Francisco, duration: 14 hours 5 mins, distance: 1,409 km", "breakfast": "-", "attraction": "-", "lunch": "-", "dinner": "Tokyo Sushi, San Francisco", "accommodation": "Room in Down town Brooklyn Parkslop, San Francisco"}, {"day": 2, "current_city": "San Francisco", "transportation": "-", "breakfast": "Coffee & Chai Co., San Francisco", "attraction": "Golden Gate Bridge, San Francisco;Golden Gate Park, San Francisco;", "lunch": "Empress, San Francisco", "dinner": "Sudarshan, San Francisco", "accommodation": "Room in Down town Brooklyn Parkslop, San Francisco"}, {"day": 3, "current_city": "from San Francisco to Spokane", "transportation": "Self-driving, from San Francisco to Spokane, duration: 13 hours 57 mins, distance: 1,409 km", "breakfast": "Bonne Bouche, San Francisco", "attraction": "-", "lunch": "-", "dinner": "-", "accommodation": "-"}]}]