[{"gpt-4-1106-preview_direct_sole-planning_results": "Travel Plan:\n\nDays: 1\nCurrent City: from Jacksonville to Washington\nTransportation: Flight F3790749, from Jacksonville to Washington, price: $239, DepTime: 11:54, ArrTime: 13:38, ActualElapsedTime: 1 hours 44 minutes, FlightDate: 2022-03-03, Distance: 634.0 km\nBreakfast: -\nAttraction: -\nLunch: Los Aztecas, Washington, cost: $46, cuisines: Cafe, Bakery, BBQ, Fast Food\nDinner: Hemingway's Island Grill, Washington, cost: $57, cuisines: Mexican, BBQ, Fast Food, Cafe, Seafood\nAccommodation: Comfortable & Cozy Times Square Apt, Washington, cost: $499, room type: Entire home/apt, house rules: No parties & No children under 10, minimum nights: 2, maximum occupancy: 3\n\nNumber of people: 2\nTotal cost: (239 x 2) + (46 x 2) + (57 x 2) + 499 = 1,133\nAccommodation minimum nights: 1/2\n\nDays: 2\nCurrent City: Washington\nTransportation: -\nBreakfast: Manna Java World Cafe, Washington, cost: $59, cuisines: Cafe, Seafood\nAttraction: Space Needle, Washington; Olympic Sculpture Park, Washington\nLunch: Thaaliwala, Washington, cost: $88, cuisines: Tea, Pizza, Italian, BBQ, Cafe\nDinner: Republic of Chicken, Washington, cost: $91, cuisines: Tea, Bakery, American, Desserts\nAccommodation: Comfortable & Cozy Times Square Apt, Washington, cost: $499, room type: Entire home/apt, house rules: No parties & No children under 10, minimum nights: 2, maximum occupancy: 3\n\nNumber of people: 2\nTotal cost: (59 x 2) + (88 x 2) + (91 x 2) + 499 = 975\nAccommodation minimum nights: 2/2\n\nDays: 3\nCurrent City: from Washington to Jacksonville\nTransportation: Flight F3786730, from Washington to Jacksonville, price: $196, DepTime: 08:48, ArrTime: 10:58, ActualElapsedTime: 2 hours 10 minutes, FlightDate: 2022-03-05, Distance: 634.0 km\nBreakfast: Cafe Coffee Day, Washington, cost: $53, cuisines: Tea, Mexican, Fast Food, Cafe, American, Seafood\nAttraction: -\nLunch: -\nDinner: -\nAccommodation: -\n\nNumber of people: 2\nTotal cost: (196 x 2) + (53 x 2) = 498\n\nTotal cost across all days: 1,133 + 975 + 498 = 2,606\n\nUnfortunately, the total cost of the travel plan ($2,606) exceeds the specified budget of $1,000. Additionally, the chosen accommodation does not allow parties, which is against the specified requirement. Adjustments are needed to meet the budget and accommodation requirements.\n\nRevised Travel Plan:\n\nDays: 1\nCurrent City: from Jacksonville to Washington\nTransportation: Self-driving, from Jacksonville to Washington, duration: 10 hours 13 mins, distance: 1,136 km, cost: $56\nBreakfast: -\nAttraction: -\nLunch: -\nDinner: Los Aztecas, Washington, cost: $46, cuisines: Cafe, Bakery, BBQ, Fast Food\nAccommodation: Chelsea's best kept secret, Washington, cost: $802, room type: Entire home/apt, house rules: No visitors & No smoking, minimum nights: 3, maximum occupancy: 2\n\nNumber of people: 2\nTotal cost: (56 x 2) + (46 x 2) + 802 = 1,006\nAccommodation minimum nights: 1/3\n\nDays: 2\nCurrent City: Washington\nTransportation: -\nBreakfast: Manna Java World Cafe, Washington, cost: $59, cuisines: Cafe, Seafood\nAttraction: Space Needle, Washington; Olympic Sculpture Park, Washington\nLunch: Thaaliwala, Washington, cost: $88, cuisines: Tea, Pizza, Italian, BBQ, Cafe\nDinner: Republic of Chicken, Washington, cost: $91, cuisines: Tea, Bakery, American, Desserts\nAccommodation: Chelsea's best kept secret, Washington, cost: $802, room type: Entire home/apt, house rules: No visitors & No smoking, minimum nights: 3, maximum occupancy: 2\n\nNumber of people: 2\nTotal cost: (59 x 2) + (88 x 2) + (91 x 2) = 476\nAccommodation minimum nights: 2/3\n\nDays: 3\nCurrent City: from Washington to Jacksonville\nTransportation: Self-driving, from Washington to Jacksonville, duration: 10 hours 12 mins, distance: 1,136 km, cost: $56\nBreakfast: -\nAttraction: -\nLunch: -\nDinner: -\nAccommodation: -\n\nNumber of people: 2\nTotal cost: (56 x 2) = 112\n\nTotal cost across all days: 1,006 + 476 + 112 = 1,594\n\nThe revised travel plan still exceeds the budget and does not meet the accommodation requirement for allowing parties. Further adjustments are needed to find cheaper transportation and accommodation options that allow parties and fit within the budget. However, given the constraints and the available data, it is not possible to create a travel plan that meets all the requirements within the $1,000 budget.", "gpt-4-1106-preview_direct_sole-planning_parsed_results": [{"day": 1, "current_city": "from Jacksonville to Washington", "transportation": "Flight Number: F3790749, from Jacksonville to Washington, Departure Time: 11:54, Arrival Time: 13:38", "breakfast": "-", "attraction": "-", "lunch": "Los Aztecas, Washington", "dinner": "Hemingway's Island Grill, Washington", "accommodation": "Comfortable & Cozy Times Square Apt, Washington"}, {"day": 2, "current_city": "Washington", "transportation": "-", "breakfast": "Manna Java World Cafe, Washington", "attraction": "Space Needle, Washington;Olympic Sculpture Park, Washington;", "lunch": "Thaaliwala, Washington", "dinner": "Republic of Chicken, Washington", "accommodation": "Comfortable & Cozy Times Square Apt, Washington"}, {"day": 3, "current_city": "from Washington to Jacksonville", "transportation": "Flight Number: F3786730, from Washington to Jacksonville, Departure Time: 08:48, Arrival Time: 10:58", "breakfast": "Cafe Coffee Day, Washington", "attraction": "-", "lunch": "-", "dinner": "-", "accommodation": "-"}]}]