[{"gpt-4-1106-preview_direct_sole-planning_results": "Travel Plan:\n\nDays: 1\nCurrent City: from Albuquerque, New Mexico to Houston, Texas\nTransportation: Flight F3884406, from Albuquerque to Houston, duration: 1 hours 54 minutes, cost: 153\nBreakfast: -\nAttraction: -\nLunch: -\nDinner: Jalapenos, Houston, cost: 57, cuisines: Desserts, Tea, Cafe, Chinese, Seafood\nAccommodation: Sunny and Airy near Manhattan, Houston, cost: 499, room type: Entire home/apt, house rules: No pets, minimum nights: 2, maximum occupancy: 4\n\nNumber of people: 1\nTotal cost: 153 + 57 + 499 = 709\nAccommodation minimum nights: 1/2\n\nDays: 2\nCurrent City: Houston\nTransportation: -\nBreakfast: Super Bakery, Houston, cost: 30, cuisines: Seafood, Fast Food\nAttraction: Space Center Houston, Houston; Houston Museum of Natural Science, Houston\nLunch: Sheetla Dhaba, Houston, cost: 35, cuisines: Desserts, Pizza, Bakery, American, Mediterranean\nDinner: The BrewMaster - The Mix Fine Dine, Houston, cost: 52, cuisines: French, Indian, Cafe, Seafood\nAccommodation: Sunny and Airy near Manhattan, Houston, cost: 499, room type: Entire home/apt, house rules: No pets, minimum nights: 2, maximum occupancy: 4\n\nNumber of people: 1\nTotal cost: 30 + 35 + 52 + 499 = 616\nAccommodation minimum nights: 2/2\n\nDays: 3\nCurrent City: from Houston to Dallas\nTransportation: Flight F3718973, from Houston to Dallas, duration: 0 hours 56 minutes, cost: 84\nBreakfast: Royal Mart, Houston, cost: 40, cuisines: Tea, Bakery, Cafe, Mediterranean, Seafood\nAttraction: The Dallas World Aquarium, Dallas; The Sixth Floor Museum at Dealey Plaza, Dallas\nLunch: Coconuts Fish Cafe, Dallas, cost: 38, cuisines: Cafe, BBQ, Mediterranean, Fast Food\nDinner: 1918 Bistro & Grill, Dallas, cost: 90, cuisines: Tea, Pizza, BBQ, Seafood\nAccommodation: Luxury Williamsburg duplex, private roof terrace, Dallas, cost: 241, room type: Entire home/apt, house rules: No visitors, minimum nights: 4, maximum occupancy: 3\n\nNumber of people: 1\nTotal cost: 84 + 40 + 38 + 90 + 241 = 493\nAccommodation minimum nights: 1/4\n\nDays: 4\nCurrent City: Dallas\nTransportation: -\nBreakfast: Yanki Sizzlers, Dallas, cost: 96, cuisines: Cafe, French, Tea, Mediterranean\nAttraction: Reunion Tower, Dallas; Dallas Museum of Art, Dallas\nLunch: Delhicacy, Dallas, cost: 67, cuisines: Desserts, Mexican, Bakery, Chinese, Seafood\nDinner: L'Opera, Dallas, cost: 77, cuisines: French, Bakery, BBQ, Fast Food, Seafood\nAccommodation: Luxury Williamsburg duplex, private roof terrace, Dallas, cost: 241, room type: Entire home/apt, house rules: No visitors, minimum nights: 4, maximum occupancy: 3\n\nNumber of people: 1\nTotal cost: 96 + 67 + 77 + 241 = 481\nAccommodation minimum nights: 2/4\n\nDays: 5\nCurrent City: from Dallas, Texas to Albuquerque, New Mexico\nTransportation: Flight F3960534, from Dallas to Albuquerque, duration: 1 hours 41 minutes, cost: 120\nBreakfast: Cafe Gatherings, Dallas, cost: 17, cuisines: Bakery, Indian, Desserts\nAttraction: -\nLunch: -\nDinner: -\nAccommodation: -\n\nNumber of people: 1\nTotal cost: 120 + 17 = 137\n\nTotal cost across all days: 709 + 616 + 493 + 481 + 137 = 2436\n\nUnfortunately, the total cost exceeds the specified budget of $2,100. To adjust the plan within the budget, we can make the following changes:\n\n- Change the accommodation in Houston to a cheaper option.\n- Opt for more budget-friendly meal options.\n- Reduce the number of paid attractions.\n\nRevised Travel Plan:\n\nDays: 1\nAccommodation: Spacious room in front of prospect park, Houston, cost: 259, room type: Private room, house rules: No smoking, minimum nights: 1, maximum occupancy: 1\n\nDays: 2\nAccommodation: Spacious room in front of prospect park, Houston, cost: 259, room type: Private room, house rules: No smoking, minimum nights: 1, maximum occupancy: 1\n\nDays: 3\nAccommodation: *Fresh Budget Room, Dallas, cost: 262, room type: Private room, house rules: No visitors & No smoking, minimum nights: 2, maximum occupancy: 1\n\nDays: 4\nAccommodation: *Fresh Budget Room, Dallas, cost: 262, room type: Private room, house rules: No visitors & No smoking, minimum nights: 2, maximum occupancy: 1\n\nRevised Total cost across all days: 153 + 57 + 259 + 30 + 35 + 52 + 259 + 84 + 40 + 38 + 90 + 262 + 96 + 67 + 77 + 262 + 120 + 17 = 2202\n\nThe revised plan is still slightly over budget. Further adjustments are needed:\n\n- Opt for the cheapest flight options.\n- Further reduce meal costs or choose accommodations with breakfast included.\n\nPlease note that the travel plan may not include all attractions and meals due to budget constraints.", "gpt-4-1106-preview_direct_sole-planning_parsed_results": [{"day": 1, "current_city": "from Albuquerque, New Mexico to Houston, Texas", "transportation": "Flight Number: F3884406, from Albuquerque to Houston, Departure Time: -, Arrival Time: -", "breakfast": "-", "attraction": "-", "lunch": "-", "dinner": "Jalapenos, Houston", "accommodation": "Sunny and Airy near Manhattan, Houston"}, {"day": 2, "current_city": "Houston", "transportation": "-", "breakfast": "Super Bakery, Houston", "attraction": "Space Center Houston, Houston;Houston Museum of Natural Science, Houston;", "lunch": "Sheetla Dhaba, Houston", "dinner": "The BrewMaster - The Mix Fine Dine, Houston", "accommodation": "Sunny and Airy near Manhattan, Houston"}, {"day": 3, "current_city": "from Houston to Dallas", "transportation": "Flight Number: F3718973, from Houston to Dallas, Departure Time: -, Arrival Time: -", "breakfast": "Royal Mart, Houston", "attraction": "The Dallas World Aquarium, Dallas;The Sixth Floor Museum at Dealey Plaza, Dallas;", "lunch": "Coconuts Fish Cafe, Dallas", "dinner": "1918 Bistro & Grill, Dallas", "accommodation": "Luxury Williamsburg duplex, private roof terrace, Dallas"}, {"day": 4, "current_city": "Dallas", "transportation": "-", "breakfast": "Yanki Sizzlers, Dallas", "attraction": "Reunion Tower, Dallas;Dallas Museum of Art, Dallas;", "lunch": "Delhicacy, Dallas", "dinner": "L'Opera, Dallas", "accommodation": "Luxury Williamsburg duplex, private roof terrace, Dallas"}, {"day": 5, "current_city": "from Dallas, Texas to Albuquerque, New Mexico", "transportation": "Flight Number: F3960534, from Dallas to Albuquerque, Departure Time: -, Arrival Time: -", "breakfast": "Cafe Gatherings, Dallas", "attraction": "-", "lunch": "-", "dinner": "-", "accommodation": "-"}]}]