[{"gpt-4-1106-preview_direct_sole-planning_results": "Travel Plan:\n\nDays: 1\nCurrent City: from Charlotte, North Carolina to Newark, New Jersey\nTransportation: Flight F3715865, from Charlotte to Newark, duration: 1 hours 43 minutes, cost: 135\nBreakfast: -\nAttraction: -\nLunch: -\nDinner: Artistry, Newark, cost: 79, cuisines: Cafe, Pizza, Desserts, Seafood\nAccommodation: Gramercy One Bedroom w Two Beds, Newark, cost: 485, room type: Entire home/apt, house rules: No visitors & No children under 10, minimum nights: 7, maximum occupancy: 4\n\nNumber of people: 1\nTotal cost: 135 + 79 + 485 = 699\nAccommodation minimum nights: 1/7\n\nDays: 2\nCurrent City: Newark\nTransportation: -\nBreakfast: Mirage Restro Bar, Newark, cost: 51, cuisines: Bakery, American, Desserts, Fast Food\nAttraction: The Newark Museum of Art, Newark; Military Park, Newark\nLunch: Escape Terrace Bar Kitchen, Newark, cost: 100, cuisines: Tea, Cafe, Bakery, Chinese, Seafood\nDinner: Bernardo's, Newark, cost: 84, cuisines: Desserts, Pizza, BBQ, American, Mediterranean\nAccommodation: Gramercy One Bedroom w Two Beds, Newark, cost: 485, room type: Entire home/apt, house rules: No visitors & No children under 10, minimum nights: 7, maximum occupancy: 4\n\nNumber of people: 1\nTotal cost: 51 + 100 + 84 + 485 = 720\nAccommodation minimum nights: 2/7\n\nDays: 3\nCurrent City: from Newark to Trenton, New Jersey\nTransportation: Self-driving, from Newark to Trenton, duration: 1 hour 5 mins, cost: 4\nBreakfast: Harmann Restaurant, Newark, cost: 57, cuisines: Tea, Cafe, American, Fast Food\nAttraction: New Jersey State Museum, Trenton; Old Barracks Museum, Trenton\nLunch: Global Grill, Trenton, cost: 20, cuisines: Desserts, Pizza, BBQ, Chinese, Mediterranean\nDinner: The Cheesecake Factory, Trenton, cost: 36, cuisines: Desserts, Fast Food\nAccommodation: Clean, Cosy Private 1 Bd Apartment Fort Greene, Trenton, cost: 592, room type: Entire home/apt, house rules: No children under 10, minimum nights: 6, maximum occupancy: 4\n\nNumber of people: 1\nTotal cost: 4 + 57 + 20 + 36 + 592 = 709\nAccommodation minimum nights: 1/6\n\nDays: 4\nCurrent City: Trenton\nTransportation: -\nBreakfast: Mario's Italian Restaurant, Trenton, cost: 13, cuisines: Desserts, Tea, Mexican, Bakery, Cafe, Indian\nAttraction: Grounds For Sculpture, Trenton; Trenton Battle Monument, Trenton\nLunch: Fusilli Reasons, Trenton, cost: 28, cuisines: Tea, Bakery, Desserts, Seafood\nDinner: Duck & Waffle, Trenton, cost: 98, cuisines: Cafe, Pizza, Desserts\nAccommodation: Clean, Cosy Private 1 Bd Apartment Fort Greene, Trenton, cost: 592, room type: Entire home/apt, house rules: No children under 10, minimum nights: 6, maximum occupancy: 4\n\nNumber of people: 1\nTotal cost: 13 + 28 + 98 + 592 = 731\nAccommodation minimum nights: 2/6\n\nDays: 5\nCurrent City: from Trenton, New Jersey to Charlotte, North Carolina\nTransportation: Flight F3561600, from Trenton to Charlotte, duration: 2 hours 0 minutes, cost: 201\nBreakfast: The Lady & Sons, Trenton, cost: 38, cuisines: Tea, Pizza, Bakery, Cafe, American\nAttraction: -\nLunch: -\nDinner: -\nAccommodation: -\n\nNumber of people: 1\nTotal cost: 201 + 38 = 239\n\nTotal cost across all days: 699 + 720 + 709 + 731 + 239 = 3,098\nRemaining budget: 4,200 - 3,098 = 1,102\n\nCuisines: The prompt specifies no cuisines, so all cuisine constraints are satisfied.", "gpt-4-1106-preview_direct_sole-planning_parsed_results": [{"day": 1, "current_city": "from Charlotte, North Carolina to Newark, New Jersey", "transportation": "Flight Number: F3715865, from Charlotte to Newark, Departure Time: -, Arrival Time: -", "breakfast": "-", "attraction": "-", "lunch": "-", "dinner": "Artistry, Newark", "accommodation": "Gramercy One Bedroom w Two Beds, Newark"}, {"day": 2, "current_city": "Newark", "transportation": "-", "breakfast": "Mirage Restro Bar, Newark", "attraction": "The Newark Museum of Art, Newark;Military Park, Newark;", "lunch": "Escape Terrace Bar Kitchen, Newark", "dinner": "Bernardo's, Newark", "accommodation": "Gramercy One Bedroom w Two Beds, Newark"}, {"day": 3, "current_city": "from Newark to Trenton, New Jersey", "transportation": "Self-driving, from Newark to Trenton, Departure Time: -, Arrival Time: -", "breakfast": "Harmann Restaurant, Newark", "attraction": "New Jersey State Museum, Trenton;Old Barracks Museum, Trenton;", "lunch": "Global Grill, Trenton", "dinner": "The Cheesecake Factory, Trenton", "accommodation": "Clean, Cosy Private 1 Bd Apartment Fort Greene, Trenton"}, {"day": 4, "current_city": "Trenton", "transportation": "-", "breakfast": "Mario's Italian Restaurant, Trenton", "attraction": "Grounds For Sculpture, Trenton;Trenton Battle Monument, Trenton;", "lunch": "Fusilli Reasons, Trenton", "dinner": "Duck & Waffle, Trenton", "accommodation": "Clean, Cosy Private 1 Bd Apartment Fort Greene, Trenton"}, {"day": 5, "current_city": "from Trenton, New Jersey to Charlotte, North Carolina", "transportation": "Flight Number: F3561600, from Trenton to Charlotte, Departure Time: -, Arrival Time: -", "breakfast": "The Lady & Sons, Trenton", "attraction": "-", "lunch": "-", "dinner": "-", "accommodation": "-"}]}]