[{"gpt-4-1106-preview_direct_sole-planning_results": "Travel Plan:\n\nDays: 1\nCurrent City: from New Orleans, Louisiana to Miami, Florida\nTransportation: Flight F3660109, from New Orleans to Miami, duration: 2 hours 19 minutes, cost: 188 x 3 = 564\nBreakfast: -\nAttraction: -\nLunch: -\nDinner: Clocked, Miami, cost: 49 x 3 = 147, cuisines: Tea, Italian, Mexican, BBQ, Cafe\nAccommodation: \"HELLO BROOKLYN\" PARK SIDE VIEW NEWLY RENO APT., Miami, cost: 789 x 1 = 789, maximum occupancy: 6, house rules: No parties & No visitors, minimum nights: 1\n\nNumber of people: 3\nTotal cost: 564 + 147 + 789 = 1,500\nAccommodation minimum nights: 1/1\n\nDays: 2\nCurrent City: Miami\nTransportation: -\nBreakfast: Papouli's Mediterranean Cafe & Market, Miami, cost: 26 x 3 = 78, cuisines: Tea, Desserts\nAttraction: Jungle Island, Miami; P\u00e9rez Art Museum Miami, Miami\nLunch: Tako Cheena by Pom Pom, Miami, cost: 60 x 3 = 180, cuisines: Fast Food, Indian, Desserts, Italian\nDinner: AB's Absolute Barbecues, Miami, cost: 55 x 3 = 165, cuisines: Desserts, Tea, Pizza, Italian, Fast Food, American\nAccommodation: \"HELLO BROOKLYN\" PARK SIDE VIEW NEWLY RENO APT., Miami, cost: 789 x 1 = 789, maximum occupancy: 6, house rules: No parties & No visitors, minimum nights: 1\n\nNumber of people: 3\nTotal cost: 78 + 180 + 165 + 789 = 1,212\nAccommodation minimum nights: 2/2\n\nDays: 3\nCurrent City: from Miami to Tampa\nTransportation: Flight F3670101, from Miami to Tampa, duration: 0 hours 54 minutes, cost: 56 x 3 = 168\nBreakfast: -\nAttraction: -\nLunch: -\nDinner: Kobe Hibachi & Sushi, Tampa, cost: 63 x 3 = 189, cuisines: Desserts, French, BBQ, Bakery, Seafood\nAccommodation: Spacious 1+ bedroom apt in NYC, Tampa, cost: 547 x 1 = 547, maximum occupancy: 2, house rules: No smoking & No parties & No children under 10, minimum nights: 1\n\nNumber of people: 3\nTotal cost: 168 + 189 + 547 = 904\nAccommodation minimum nights: 1/1\n\nDays: 4\nCurrent City: Tampa\nTransportation: -\nBreakfast: Lalit Kathi Rolls Momos, Tampa, cost: 23 x 3 = 69, cuisines: Tea, Pizza, Fast Food\nAttraction: The Florida Aquarium, Tampa; Busch Gardens Tampa Bay, Tampa\nLunch: Uptown Fresh Beer Cafe, Tampa, cost: 61 x 3 = 183, cuisines: Pizza, Mexican, BBQ, Cafe, Seafood\nDinner: Peg Leg Pete's, Tampa, cost: 91 x 3 = 273, cuisines: French, Bakery, Cafe\nAccommodation: Spacious 1+ bedroom apt in NYC, Tampa, cost: 547 x 1 = 547, maximum occupancy: 2, house rules: No smoking & No parties & No children under 10, minimum nights: 1\n\nNumber of people: 3\nTotal cost: 69 + 183 + 273 + 547 = 1,072\nAccommodation minimum nights: 2/2\n\nDays: 5\nCurrent City: from Tampa to New Orleans\nTransportation: Flight F4007107, from Tampa to New Orleans, duration: 1 hours 32 minutes, cost: 124 x 3 = 372\nBreakfast: -\nAttraction: -\nLunch: -\nDinner: -\nAccommodation: -\n\nNumber of people: 3\nTotal cost: 372\n\nTotal cost across all days: 1,500 + 1,212 + 904 + 1,072 + 372 = 5,060\n\nUnfortunately, the total cost exceeds the specified budget of $4,200. To adjust the plan to fit within the budget, we can consider the following changes:\n\n- Opt for a less expensive accommodation in Miami and Tampa.\n- Choose more budget-friendly restaurants for meals.\n- Consider self-driving instead of flights if it's cheaper and feasible within the time constraints.\n\nPlease note that the above plan is a draft and adjustments are needed to meet the budget constraint.", "gpt-4-1106-preview_direct_sole-planning_parsed_results": [{"day": 1, "current_city": "from New Orleans, Louisiana to Miami, Florida", "transportation": "Flight Number: F3660109, from New Orleans to Miami, Departure Time: -, Arrival Time: -", "breakfast": "-", "attraction": "-", "lunch": "-", "dinner": "Clocked, Miami", "accommodation": "\"HELLO BROOKLYN\" PARK SIDE VIEW NEWLY RENO APT., Miami"}, {"day": 2, "current_city": "Miami", "transportation": "-", "breakfast": "Papouli's Mediterranean Cafe & Market, Miami", "attraction": "Jungle Island, Miami;P\u00e9rez Art Museum Miami, Miami;", "lunch": "Tako Cheena by Pom Pom, Miami", "dinner": "AB's Absolute Barbecues, Miami", "accommodation": "\"HELLO BROOKLYN\" PARK SIDE VIEW NEWLY RENO APT., Miami"}, {"day": 3, "current_city": "from Miami to Tampa", "transportation": "Flight Number: F3670101, from Miami to Tampa, Departure Time: -, Arrival Time: -", "breakfast": "-", "attraction": "-", "lunch": "-", "dinner": "Kobe Hibachi & Sushi, Tampa", "accommodation": "Spacious 1+ bedroom apt in NYC, Tampa"}, {"day": 4, "current_city": "Tampa", "transportation": "-", "breakfast": "Lalit Kathi Rolls Momos, Tampa", "attraction": "The Florida Aquarium, Tampa;Busch Gardens Tampa Bay, Tampa;", "lunch": "Uptown Fresh Beer Cafe, Tampa", "dinner": "Peg Leg Pete's, Tampa", "accommodation": "Spacious 1+ bedroom apt in NYC, Tampa"}, {"day": 5, "current_city": "from Tampa to New Orleans", "transportation": "Flight Number: F4007107, from Tampa to New Orleans, Departure Time: -, Arrival Time: -", "breakfast": "-", "attraction": "-", "lunch": "-", "dinner": "-", "accommodation": "-"}]}]