[{"gpt-4-1106-preview_direct_sole-planning_results": "Travel Plan:\n\nDays: 1\nCurrent City: from Denver to Appleton\nTransportation: Flight F3822209, from Denver to Appleton, duration: 2 hours 14 minutes, cost: 286\nBreakfast: -\nAttraction: -\nLunch: -\nDinner: Brick 29, Appleton, cost: 97, cuisines: Desserts, Tea, BBQ, Cafe, American, Mediterranean\nAccommodation: Cozy room + bright apartment + rooftop lounge, Appleton, cost: 666, maximum occupancy: 1, house rules: No smoking, minimum nights: 1\n\nNumber of people: 1\nTotal cost: 286 x 1 + 97 x 1 + 666 x 1 = 1,049\nAccommodation minimum nights: 1/1\n\nDays: 2\nCurrent City: Appleton\nTransportation: -\nBreakfast: Destination Live, Appleton, cost: 30, cuisines: Tea, Indian, BBQ\nAttraction: The History Museum at the Castle, Appleton; Hearthstone Historic House Museum, Appleton\nLunch: Parantha Gurus, Appleton, cost: 49, cuisines: Cafe, Mexican, BBQ, Chinese, Seafood\nDinner: Swati Snacks, Appleton, cost: 84, cuisines: Desserts, Bakery, BBQ, Fast Food, American\nAccommodation: Cozy room + bright apartment + rooftop lounge, Appleton, cost: 666, maximum occupancy: 1, house rules: No smoking, minimum nights: 1\n\nNumber of people: 1\nTotal cost: 30 x 1 + 49 x 1 + 84 x 1 + 666 x 1 = 829\nAccommodation minimum nights: 2/1\n\nDays: 3\nCurrent City: from Appleton to Denver\nTransportation: Flight F3828308, from Appleton to Denver, duration: 3 hours 14 minutes, cost: 295\nBreakfast: Mathew's Cafe, Appleton, cost: 13, cuisines: Mexican, Bakery, BBQ, Cafe, Indian\nAttraction: -\nLunch: -\nDinner: -\nAccommodation: -\n\nNumber of people: 1\nTotal cost: 295 x 1 + 13 x 1 = 308\n\nTotal cost across all days: 1,049 x 1 + 829 x 1 + 308 x 1 = 2,186\n\nCuisines: The prompt specifies no cuisines, so all cuisine constraints are satisfied\n\nNote: The total cost exceeds the specified budget of $1,800. Adjustments are needed to meet the budget constraint. Possible adjustments include changing the accommodation to a less expensive option or choosing a different transportation method. However, given the provided data, there are no cheaper accommodations or transportation methods available to fit within the budget while meeting all other constraints.", "gpt-4-1106-preview_direct_sole-planning_parsed_results": [{"day": 1, "current_city": "from Denver to Appleton", "transportation": "Flight Number: F3822209, from Denver to Appleton, Departure Time: -, Arrival Time: -", "breakfast": "-", "attraction": "-", "lunch": "-", "dinner": "Brick 29, Appleton", "accommodation": "Cozy room + bright apartment + rooftop lounge, Appleton"}, {"day": 2, "current_city": "Appleton", "transportation": "-", "breakfast": "Destination Live, Appleton", "attraction": "The History Museum at the Castle, Appleton;Hearthstone Historic House Museum, Appleton;", "lunch": "Parantha Gurus, Appleton", "dinner": "Swati Snacks, Appleton", "accommodation": "Cozy room + bright apartment + rooftop lounge, Appleton"}, {"day": 3, "current_city": "from Appleton to Denver", "transportation": "Flight Number: F3828308, from Appleton to Denver, Departure Time: -, Arrival Time: -", "breakfast": "Mathew's Cafe, Appleton", "attraction": "-", "lunch": "-", "dinner": "-", "accommodation": "-"}]}]