[{"gpt-4-1106-preview_direct_sole-planning_results": "Travel Plan:\n\nDays: 1\nCurrent City: from Islip to State College\nTransportation: Self-driving, from Islip to State College, duration: 4 hours 52 mins, distance: 464 km, cost: 23 x 2 = 46\nBreakfast: -\nAttraction: -\nLunch: -\nDinner: Kawa Sushi, State College, cost: 82 x 2 = 164, cuisines: French, Mexican, Desserts, Fast Food\nAccommodation: Beautiful, Newly Furnished, Luxury, Grand Central, State College, cost: 210 x 2 = 420, maximum occupancy: 2, house rules: No parties, minimum nights: 30\n\nNumber of people: 2\nTotal cost: 46 + 164 + 420 = 630\nAccommodation minimum nights: 1/30\n\nDays: 2\nCurrent City: State College\nTransportation: -\nBreakfast: The Riding Guns Cafe, State College, cost: 51 x 2 = 102, cuisines: Desserts, Pizza, Cafe, Indian, Seafood\nAttraction: The Arboretum at Penn State, State College\nLunch: Fusion Food Corner, State College, cost: 46 x 2 = 92, cuisines: Bakery, Mexican, BBQ, Italian\nDinner: Los Agaves, State College, cost: 39 x 2 = 78, cuisines: French, BBQ, Cafe\nAccommodation: Beautiful, Newly Furnished, Luxury, Grand Central, State College, cost: 210 x 2 = 420, maximum occupancy: 2, house rules: No parties, minimum nights: 30\n\nNumber of people: 2\nTotal cost: 102 + 92 + 78 + 420 = 692\nAccommodation minimum nights: 2/30\n\nDays: 3\nCurrent City: from State College to Johnstown\nTransportation: Self-driving, from State College to Johnstown, duration: 1 hour 29 mins, distance: 137 km, cost: 6 x 2 = 12\nBreakfast: Amici Cafe, State College, cost: 96 x 2 = 192, cuisines: Pizza, Bakery, BBQ, Chinese, Seafood\nAttraction: -\nLunch: -\nDinner: The National, Johnstown, cost: 47 x 2 = 94, cuisines: Chinese, BBQ, Cafe, Seafood\nAccommodation: Modern duplex 30 minutes to Times Square, Johnstown, cost: 334 x 2 = 668, maximum occupancy: 2, house rules: No smoking, minimum nights: 4\n\nNumber of people: 2\nTotal cost: 12 + 192 + 94 + 668 = 966\nAccommodation minimum nights: 1/4\n\nDays: 4\nCurrent City: Johnstown\nTransportation: -\nBreakfast: Palmshore, Johnstown, cost: 61 x 2 = 122, cuisines: Bakery, American, BBQ, Fast Food\nAttraction: Johnstown Flood Museum, Johnstown; Heritage Discovery Center, Johnstown\nLunch: Souza Lobo, Johnstown, cost: 92 x 2 = 184, cuisines: Tea, Mexican, Bakery, Cafe, Indian\nDinner: Chicken Inn Family Meat Shop, Johnstown, cost: 79 x 2 = 158, cuisines: Desserts, Bakery, Fast Food, Mediterranean, Seafood\nAccommodation: Modern duplex 30 minutes to Times Square, Johnstown, cost: 334 x 2 = 668, maximum occupancy: 2, house rules: No smoking, minimum nights: 4\n\nNumber of people: 2\nTotal cost: 122 + 184 + 158 + 668 = 1132\nAccommodation minimum nights: 2/4\n\nDays: 5\nCurrent City: from Johnstown to Islip\nTransportation: Self-driving, from Johnstown to Islip, duration: 5 hours 57 mins, distance: 590 km, cost: 29 x 2 = 58\nBreakfast: -\nAttraction: -\nLunch: -\nDinner: -\nAccommodation: -\n\nNumber of people: 2\nTotal cost: 58\n\nTotal cost across all days: 630 + 692 + 966 + 1132 + 58 = 3478\n\nUnfortunately, the total cost of $3,478 exceeds the specified budget of $2,700. To adjust the plan within the budget, we may need to choose more affordable dining options, find accommodations with a lower cost, or reduce the number of attractions visited. Please let me know how you would like to proceed, or if there are specific areas you would like to adjust to meet the budget.", "gpt-4-1106-preview_direct_sole-planning_parsed_results": [{"day": 1, "current_city": "from Islip to State College", "transportation": "Self-driving, from Islip to State College, duration: 4 hours 52 mins, distance: 464 km", "breakfast": "-", "attraction": "-", "lunch": "-", "dinner": "Kawa Sushi, State College", "accommodation": "Beautiful, Newly Furnished, Luxury, Grand Central, State College"}, {"day": 2, "current_city": "State College", "transportation": "-", "breakfast": "The Riding Guns Cafe, State College", "attraction": "The Arboretum at Penn State, State College", "lunch": "Fusion Food Corner, State College", "dinner": "Los Agaves, State College", "accommodation": "Beautiful, Newly Furnished, Luxury, Grand Central, State College"}, {"day": 3, "current_city": "from State College to Johnstown", "transportation": "Self-driving, from State College to Johnstown, duration: 1 hour 29 mins, distance: 137 km", "breakfast": "Amici Cafe, State College", "attraction": "-", "lunch": "-", "dinner": "The National, Johnstown", "accommodation": "Modern duplex 30 minutes to Times Square, Johnstown"}, {"day": 4, "current_city": "Johnstown", "transportation": "-", "breakfast": "Palmshore, Johnstown", "attraction": "Johnstown Flood Museum, Johnstown;Heritage Discovery Center, Johnstown", "lunch": "Souza Lobo, Johnstown", "dinner": "Chicken Inn Family Meat Shop, Johnstown", "accommodation": "Modern duplex 30 minutes to Times Square, Johnstown"}, {"day": 5, "current_city": "from Johnstown to Islip", "transportation": "Self-driving, from Johnstown to Islip, duration: 5 hours 57 mins, distance: 590 km", "breakfast": "-", "attraction": "-", "lunch": "-", "dinner": "-", "accommodation": "-"}]}]