[{"gpt-4-1106-preview_direct_sole-planning_results": "Travel Plan:\n\nDays: 1\nCurrent City: from Houston, Texas to Wichita, Kansas\nTransportation: Flight F3923935, from Houston to Wichita, duration: 1 hour 52 minutes, cost: 192 per person\nBreakfast: -\nAttraction: -\nLunch: -\nDinner: Jahanpanah, Wichita, cost: 18 per person, cuisines: Indian, Desserts, Fast Food\nAccommodation: Secret Garden Apartment in Bed Stuy, Brooklyn, Wichita, cost: 214, maximum occupancy: 3, house rules: No smoking & No children under 10, minimum nights: 2\n\nNumber of people: 3\nTotal cost: 192 x 3 + 18 x 3 + 214 = 772\nAccommodation minimum nights: 1/2\n\nDays: 2\nCurrent City: Wichita\nTransportation: -\nBreakfast: Koramangala Social, Wichita, cost: 38 per person, cuisines: Tea, Bakery, Cafe, Indian, Mediterranean\nAttraction: Exploration Place, Wichita; Sedgwick County Zoo, Wichita\nLunch: The B.A.W.A, Wichita, cost: 23 per person, cuisines: Tea, Chinese, Pizza, BBQ\nDinner: Rumi's Kitchen, Wichita, cost: 34 per person, cuisines: Bakery, Fast Food, Cafe, Indian, Seafood\nAccommodation: Secret Garden Apartment in Bed Stuy, Brooklyn, Wichita, cost: 214, maximum occupancy: 3, house rules: No smoking & No children under 10, minimum nights: 2\n\nNumber of people: 3\nTotal cost: 38 x 3 + 23 x 3 + 34 x 3 + 214 = 443\nAccommodation minimum nights: 2/2\n\nDays: 3\nCurrent City: from Wichita, Kansas to Houston, Texas\nTransportation: Flight F3827300, from Wichita to Houston, duration: 2 hours 28 minutes, cost: 152 per person\nBreakfast: Cafe Cornucopia, Wichita, cost: 76 per person, cuisines: Tea, Cafe, Bakery\nAttraction: -\nLunch: -\nDinner: -\nAccommodation: -\n\nNumber of people: 3\nTotal cost: 152 x 3 + 76 x 3 = 684\n\nTotal cost across all days: 772 + 443 + 684 = 1,899\nCuisines: The prompt specifies no cuisines, so all cuisine constraints are satisfied\n\nNote: The accommodation selected does not allow smoking, which is a necessity for the group. However, based on the provided data, there are no accommodations listed that allow smoking. The traveler may need to find an alternative accommodation that allows smoking outside of the provided options or consider adjusting their requirements.", "gpt-4-1106-preview_direct_sole-planning_parsed_results": [{"day": 1, "current_city": "from Houston, Texas to Wichita, Kansas", "transportation": "Flight Number: F3923935, from Houston to Wichita, Departure Time: -, Arrival Time: -", "breakfast": "-", "attraction": "-", "lunch": "-", "dinner": "Jahanpanah, Wichita", "accommodation": "Secret Garden Apartment in Bed Stuy, Brooklyn, Wichita"}, {"day": 2, "current_city": "Wichita", "transportation": "-", "breakfast": "Koramangala Social, Wichita", "attraction": "Exploration Place, Wichita;Sedgwick County Zoo, Wichita;", "lunch": "The B.A.W.A, Wichita", "dinner": "Rumi's Kitchen, Wichita", "accommodation": "Secret Garden Apartment in Bed Stuy, Brooklyn, Wichita"}, {"day": 3, "current_city": "from Wichita, Kansas to Houston, Texas", "transportation": "Flight Number: F3827300, from Wichita to Houston, Departure Time: -, Arrival Time: -", "breakfast": "Cafe Cornucopia, Wichita", "attraction": "-", "lunch": "-", "dinner": "-", "accommodation": "-"}]}]