[{"gpt-4-1106-preview_direct_sole-planning_results": "Travel Plan:\n\nDays: 1\nCurrent City: from Buffalo, New York to Atlanta, Georgia\nTransportation: Flight F3555201, from Buffalo to Atlanta, duration: 1 hour 49 minutes, cost: 265\nBreakfast: -\nAttraction: -\nLunch: -\nDinner: Saffron, Atlanta, cost: 39, cuisines: Tea, Cafe, Fast Food, Seafood\nAccommodation: Unique 2BR Apartment, Atlanta, cost: 394, maximum occupancy: 3, house rules: No parties & No pets & No children under 10, minimum nights: 2\n\nNumber of people: 1\nTotal cost: 265 x 1 + 39 x 1 + 394 x 1 = 698\nAccommodation minimum nights: 1/2\n\nDays: 2\nCurrent City: Atlanta\nTransportation: -\nBreakfast: Adda, Atlanta, cost: 22, cuisines: Tea, Mexican, Bakery\nAttraction: Georgia Aquarium, Atlanta; Centennial Olympic Park, Atlanta\nLunch: Baba Au Rhum, Atlanta, cost: 27, cuisines: Desserts, Pizza, Mexican, BBQ, Fast Food\nDinner: Asian Bistro, Atlanta, cost: 27, cuisines: Tea, Bakery, Seafood\nAccommodation: Unique 2BR Apartment, Atlanta, cost: 394, maximum occupancy: 3, house rules: No parties & No pets & No children under 10, minimum nights: 2\n\nNumber of people: 1\nTotal cost: 22 x 1 + 27 x 1 + 27 x 1 + 394 x 1 = 470\nAccommodation minimum nights: 2/2\n\nDays: 3\nCurrent City: from Atlanta, Georgia to Buffalo, New York\nTransportation: Flight F3502694, from Atlanta to Buffalo, duration: 1 hour 55 minutes, cost: 209\nBreakfast: Ahata, Atlanta, cost: 17, cuisines: Tea, Indian, Desserts\nAttraction: -\nLunch: -\nDinner: -\nAccommodation: -\n\nNumber of people: 1\nTotal cost: 209 x 1 + 17 x 1 = 226\n\nTotal cost across all days: 698 x 1 + 470 x 1 + 226 x 1 = 1,394\n\nUnfortunately, the total cost exceeds the specified budget of $1,100. To adjust the plan within the budget, we can consider the following changes:\n\n- Change the accommodation to a less expensive option.\n- Opt for self-driving instead of flights if the budget constraint is strict, despite the longer travel time.\n\nAdjusted Travel Plan with Budget Consideration:\n\nDays: 1\nCurrent City: from Buffalo, New York to Atlanta, Georgia\nTransportation: Self-driving, from Buffalo to Atlanta, duration: 13 hours 7 mins, distance: 1,443 km, cost: 72\nBreakfast: -\nAttraction: -\nLunch: -\nDinner: Saffron, Atlanta, cost: 39, cuisines: Tea, Cafe, Fast Food, Seafood\nAccommodation: Spacious private room close St. Barnabas Hospital, Atlanta, cost: 144, maximum occupancy: 1, house rules: No smoking, minimum nights: 2\n\nNumber of people: 1\nTotal cost: 72 x 1 + 39 x 1 + 144 x 1 = 255\nAccommodation minimum nights: 1/2\n\nDays: 2\nCurrent City: Atlanta\nTransportation: -\nBreakfast: Adda, Atlanta, cost: 22, cuisines: Tea, Mexican, Bakery\nAttraction: Georgia Aquarium, Atlanta; Centennial Olympic Park, Atlanta\nLunch: Baba Au Rhum, Atlanta, cost: 27, cuisines: Desserts, Pizza, Mexican, BBQ, Fast Food\nDinner: Asian Bistro, Atlanta, cost: 27, cuisines: Tea, Bakery, Seafood\nAccommodation: Spacious private room close St. Barnabas Hospital, Atlanta, cost: 144, maximum occupancy: 1, house rules: No smoking, minimum nights: 2\n\nNumber of people: 1\nTotal cost: 22 x 1 + 27 x 1 + 27 x 1 + 144 x 1 = 220\nAccommodation minimum nights: 2/2\n\nDays: 3\nCurrent City: from Atlanta, Georgia to Buffalo, New York\nTransportation: Self-driving, from Atlanta to Buffalo, duration: 13 hours 6 mins, distance: 1,443 km, cost: 72\nBreakfast: Ahata, Atlanta, cost: 17, cuisines: Tea, Indian, Desserts\nAttraction: -\nLunch: -\nDinner: -\nAccommodation: -\n\nNumber of people: 1\nTotal cost: 72 x 1 + 17 x 1 = 89\n\nTotal cost across all days: 255 x 1 + 220 x 1 + 89 x 1 = 564\n\nWith these adjustments, the total cost is now within the budget of $1,100.", "gpt-4-1106-preview_direct_sole-planning_parsed_results": [{"day": 1, "current_city": "from Buffalo, New York to Atlanta, Georgia", "transportation": "Flight Number: F3555201, from Buffalo to Atlanta, Departure Time: -, Arrival Time: -", "breakfast": "-", "attraction": "-", "lunch": "-", "dinner": "Saffron, Atlanta", "accommodation": "Unique 2BR Apartment, Atlanta"}, {"day": 2, "current_city": "Atlanta", "transportation": "-", "breakfast": "Adda, Atlanta", "attraction": "Georgia Aquarium, Atlanta;Centennial Olympic Park, Atlanta;", "lunch": "Baba Au Rhum, Atlanta", "dinner": "Asian Bistro, Atlanta", "accommodation": "Unique 2BR Apartment, Atlanta"}, {"day": 3, "current_city": "from Atlanta, Georgia to Buffalo, New York", "transportation": "Flight Number: F3502694, from Atlanta to Buffalo, Departure Time: -, Arrival Time: -", "breakfast": "Ahata, Atlanta", "attraction": "-", "lunch": "-", "dinner": "-", "accommodation": "-"}, {"day": 1, "current_city": "from Buffalo, New York to Atlanta, Georgia", "transportation": "Self-driving, from Buffalo to Atlanta, Duration: 13 hours 7 mins, Distance: 1443 km", "breakfast": "-", "attraction": "-", "lunch": "-", "dinner": "Saffron, Atlanta", "accommodation": "Spacious private room close St. Barnabas Hospital, Atlanta"}, {"day": 2, "current_city": "Atlanta", "transportation": "-", "breakfast": "Adda, Atlanta", "attraction": "Georgia Aquarium, Atlanta;Centennial Olympic Park, Atlanta;", "lunch": "Baba Au Rhum, Atlanta", "dinner": "Asian Bistro, Atlanta", "accommodation": "Spacious private room close St. Barnabas Hospital, Atlanta"}, {"day": 3, "current_city": "from Atlanta, Georgia to Buffalo, New York", "transportation": "Self-driving, from Atlanta to Buffalo, Duration: 13 hours 6 mins, Distance: 1443 km", "breakfast": "Ahata, Atlanta", "attraction": "-", "lunch": "-", "dinner": "-", "accommodation": "-"}]}]