[{"gpt-4-1106-preview_direct_sole-planning_results": "Travel Plan:\n\nDays: 1\nCurrent City: from Dallas, Texas to Huntsville, Alabama\nTransportation: Self-driving, from Dallas to Huntsville, duration: 10 hours 10 mins, distance: 1,071 km, cost: 53\nBreakfast: -\nAttraction: -\nLunch: -\nDinner: Downtown Grill, Huntsville, cost: 74, cuisines: Pizza, Bakery\nAccommodation: Brooklyn Charmer, Close to Everything NYC!, Huntsville, cost: 568, room type: Entire home/apt, maximum occupancy: 5, house rules: No children under 10 & No parties, minimum nights: 2\n\nNumber of people: 4\nTotal cost: 53 x 4 + 74 x 4 + 568 x 1 = 212 + 296 + 568 = 1,076\nAccommodation minimum nights: 1/2\n\nDays: 2\nCurrent City: Huntsville\nTransportation: -\nBreakfast: Breakfast Hut, Huntsville, cost: 81, cuisines: Cafe, Bakery, Desserts, Seafood\nAttraction: U.S. Space & Rocket Center, Huntsville; Huntsville Botanical Garden, Huntsville\nLunch: Moksh The Restro Lounge, Huntsville, cost: 77, cuisines: Pizza, American, BBQ, Fast Food, Indian\nDinner: Desee Dakshin Coastal Cafe, Huntsville, cost: 96, cuisines: Desserts, Cafe, BBQ, Bakery, Chinese\nAccommodation: Brooklyn Charmer, Close to Everything NYC!, Huntsville, cost: 568, room type: Entire home/apt, maximum occupancy: 5, house rules: No children under 10 & No parties, minimum nights: 2\n\nNumber of people: 4\nTotal cost: 81 x 4 + 77 x 4 + 96 x 4 + 568 x 1 = 324 + 308 + 384 + 568 = 1,584\nAccommodation minimum nights: 2/2\n\nDays: 3\nCurrent City: from Huntsville to Dallas\nTransportation: Self-driving from Huntsville to Dallas, duration: 10 hours 13 mins, distance: 1,072 km, cost: 53\nBreakfast: Cherry Comet, Huntsville, cost: 16, cuisines: Desserts, Tea, Pizza, Cafe, Mediterranean\nAttraction: -\nLunch: -\nDinner: -\nAccommodation: -\n\nNumber of people: 4\nTotal cost: 53 x 4 + 16 x 4 = 212 + 64 = 276\n\nTotal cost across all days: 1,076 + 1,584 + 276 = 2,936\n\nUnfortunately, the total cost exceeds the specified budget of $2,700. To adjust the plan within the budget, we can consider changing the accommodation to a less expensive option or reducing meal costs. Here's an adjusted plan with a different accommodation:\n\nAdjusted Accommodation for Days 1 and 2:\nAccommodation: Sonder | 116 John | Simple 1BR + Gym, Huntsville, cost: 290, room type: Entire home/apt, maximum occupancy: 3, house rules: No children under 10\n\nAdjusted Total cost for Days 1 and 2: 212 + 296 + 290 x 2 = 1,088 (since we need two rooms due to occupancy limits)\n\nAdjusted Total cost across all days: 1,088 + 324 + 308 + 384 + 276 = 2,380\n\nCuisines: The prompt specifies no cuisines, so all cuisine constraints are satisfied.\n\nPlease note that the adjusted plan assumes that the group is willing to book two separate accommodations due to the occupancy limit, and that the cost of attractions and additional meals not listed is within the remaining budget.", "gpt-4-1106-preview_direct_sole-planning_parsed_results": [{"day": 1, "current_city": "from Dallas, Texas to Huntsville, Alabama", "transportation": "Self-driving, from Dallas to Huntsville, duration: 10 hours 10 mins, distance: 1,071 km", "breakfast": "-", "attraction": "-", "lunch": "-", "dinner": "Downtown Grill, Huntsville", "accommodation": "Brooklyn Charmer, Close to Everything NYC!, Huntsville"}, {"day": 2, "current_city": "Huntsville", "transportation": "-", "breakfast": "Breakfast Hut, Huntsville", "attraction": "U.S. Space & Rocket Center, Huntsville;Huntsville Botanical Garden, Huntsville;", "lunch": "Moksh The Restro Lounge, Huntsville", "dinner": "Desee Dakshin Coastal Cafe, Huntsville", "accommodation": "Brooklyn Charmer, Close to Everything NYC!, Huntsville"}, {"day": 3, "current_city": "from Huntsville to Dallas", "transportation": "Self-driving from Huntsville to Dallas, duration: 10 hours 13 mins, distance: 1,072 km", "breakfast": "Cherry Comet, Huntsville", "attraction": "-", "lunch": "-", "dinner": "-", "accommodation": "-"}]}]