[{"gpt-4-1106-preview_direct_sole-planning_results": "Travel Plan:\n\nDays: 1\nCurrent City: from Orlando, Florida to Belleville, Illinois\nTransportation: Self-driving, from Orlando to Belleville, duration: 14 hours 12 mins, distance: 1,579 km, cost: 78\nBreakfast: -\nAttraction: -\nLunch: -\nDinner: Fuji Japanese Steak House, Belleville, cost: 70, cuisines: Bakery, Indian, Cafe\nAccommodation: 1 Bedroom/1 Bath Apt in Hudson Yards/Midtown West, Belleville, cost: 610, room type: Entire home/apt, house rules: No parties & No pets, minimum nights: 1, maximum occupancy: 2\n\nNumber of people: 1\nTotal cost: 78 x 1 + 70 x 1 + 610 x 1 = 758\nAccommodation minimum nights: 1/1\n\nDays: 2\nCurrent City: Belleville\nTransportation: -\nBreakfast: Cafe Amaretto, Belleville, cost: 35, cuisines: Tea, Pizza, French, Mexican, BBQ, Cafe\nAttraction: Labor & Industrial Museum, Belleville; St. Clair County Historical Society, Belleville\nLunch: Romi da Dhaba, Belleville, cost: 24, cuisines: Desserts, BBQ, Fast Food, Cafe, Indian\nDinner: Asian Haus, Belleville, cost: 87, cuisines: Tea, Pizza, Bakery, Mediterranean\nAccommodation: studio for your own, Belleville, cost: 773, room type: Entire home/apt, house rules: No visitors, minimum nights: 3, maximum occupancy: 4\n\nNumber of people: 1\nTotal cost: 35 x 1 + 24 x 1 + 87 x 1 + 773 x 1 = 919\nAccommodation minimum nights: 1/3\n\nDays: 3\nCurrent City: from Belleville, Illinois to Chicago, Illinois\nTransportation: Self-driving, from Belleville to Chicago, duration: 4 hours 36 mins, distance: 474 km, cost: 23\nBreakfast: Baking Bad, Belleville, cost: 99, cuisines: BBQ, Pizza, Desserts, Seafood\nAttraction: -\nLunch: -\nDinner: The Black Pearl, Chicago, cost: 63, cuisines: Cafe, Bakery\nAccommodation: Newly Renovated Greenpoint Abode, Chicago, cost: 981, room type: Entire home/apt, house rules: No parties & No children under 10 & No smoking, minimum nights: 2, maximum occupancy: 7\n\nNumber of people: 1\nTotal cost: 23 x 1 + 99 x 1 + 63 x 1 + 981 x 1 = 1166\nAccommodation minimum nights: 1/2\n\nDays: 4\nCurrent City: Chicago\nTransportation: -\nBreakfast: Pantry d'or, Chicago, cost: 53, cuisines: Tea, BBQ, Fast Food, Cafe, Indian\nAttraction: Navy Pier, Chicago; Millennium Park, Chicago\nLunch: Bro's Kitchenette, Chicago, cost: 38, cuisines: Mexican, Desserts, Seafood\nDinner: Mini's Royal Cafe, Chicago, cost: 72, cuisines: Tea, Cafe, Bakery\nAccommodation: Newly Renovated Greenpoint Abode, Chicago, cost: 981, room type: Entire home/apt, house rules: No parties & No children under 10 & No smoking, minimum nights: 2, maximum occupancy: 7\n\nNumber of people: 1\nTotal cost: 53 x 1 + 38 x 1 + 72 x 1 + 981 x 1 = 1144\nAccommodation minimum nights: 2/2\n\nDays: 5\nCurrent City: from Chicago, Illinois to Orlando, Florida\nTransportation: Flight F3901782, from Chicago to Orlando, cost: 219, FlightDate: 2022-03-06, DepTime: 15:37, ArrTime: 19:07, ActualElapsedTime: 2 hours 30 minutes\nBreakfast: -\nAttraction: -\nLunch: -\nDinner: -\nAccommodation: -\n\nNumber of people: 1\nTotal cost: 219 x 1 = 219\n\nTotal cost across all days: 758 x 1 + 919 x 1 + 1166 x 1 + 1144 x 1 + 219 x 1 = 4206\n\nUnfortunately, the total cost of $4,206 exceeds the specified budget of $2,700. Adjustments must be made to the travel plan to meet the budget constraint. Let's revise the accommodation options to fit within the budget:\n\nRevised Accommodations:\nDay 1: Cozy, Belleville, cost: 184, room type: Private room, house rules: No visitors & No smoking & No children under 10, minimum nights: 1, maximum occupancy: 2\nDay 2: Cozy, Belleville, cost: 184, room type: Private room, house rules: No visitors & No smoking & No children under 10, minimum nights: 1, maximum occupancy: 2\nDay 3: Amazing place close to all, Chicago, cost: 308, room type: Entire home/apt, house rules: No children under 10, minimum nights: 3, maximum occupancy: 3\nDay 4: Amazing place close to all, Chicago, cost: 308, room type: Entire home/apt, house rules: No children under 10, minimum nights: 3, maximum occupancy: 3\n\nRevised Total Costs:\nDay 1: 758 (original) - 610 (original accommodation) + 184 (new accommodation) = 332\nDay 2: 919 (original) - 773 (original accommodation) + 184 (new accommodation) = 330\nDay 3: 1166 (original) - 981 (original accommodation) + 308 (new accommodation) = 493\nDay 4: 1144 (original) - 981 (original accommodation) + 308 (new accommodation) = 471\nDay 5: 219 (original)\n\nRevised Total cost across all days: 332 + 330 + 493 + 471 + 219 = 1845\n\nThe revised total cost of $1,845 is now within the specified budget of $2,700.", "gpt-4-1106-preview_direct_sole-planning_parsed_results": [{"day": 1, "current_city": "from Orlando, Florida to Belleville, Illinois", "transportation": "Self-driving, from Orlando to Belleville, duration: 14 hours 12 mins, distance: 1,579 km", "breakfast": "-", "attraction": "-", "lunch": "-", "dinner": "Fuji Japanese Steak House, Belleville", "accommodation": "1 Bedroom/1 Bath Apt in Hudson Yards/Midtown West, Belleville"}, {"day": 2, "current_city": "Belleville", "transportation": "-", "breakfast": "Cafe Amaretto, Belleville", "attraction": "Labor & Industrial Museum, Belleville;St. Clair County Historical Society, Belleville;", "lunch": "Romi da Dhaba, Belleville", "dinner": "Asian Haus, Belleville", "accommodation": "studio for your own, Belleville"}, {"day": 3, "current_city": "from Belleville, Illinois to Chicago, Illinois", "transportation": "Self-driving, from Belleville to Chicago, duration: 4 hours 36 mins, distance: 474 km", "breakfast": "Baking Bad, Belleville", "attraction": "-", "lunch": "-", "dinner": "The Black Pearl, Chicago", "accommodation": "Newly Renovated Greenpoint Abode, Chicago"}, {"day": 4, "current_city": "Chicago", "transportation": "-", "breakfast": "Pantry d'or, Chicago", "attraction": "Navy Pier, Chicago;Millennium Park, Chicago;", "lunch": "Bro's Kitchenette, Chicago", "dinner": "Mini's Royal Cafe, Chicago", "accommodation": "Newly Renovated Greenpoint Abode, Chicago"}, {"day": 5, "current_city": "from Chicago, Illinois to Orlando, Florida", "transportation": "Flight Number: F3901782, from Chicago to Orlando, FlightDate: 2022-03-06, DepTime: 15:37, ArrTime: 19:07, ActualElapsedTime: 2 hours 30 minutes", "breakfast": "-", "attraction": "-", "lunch": "-", "dinner": "-", "accommodation": "-"}]}]