[{"gpt-4-1106-preview_direct_sole-planning_results": "Travel Plan:\n\nDays: 1\nCurrent City: from Sun Valley to San Diego\nTransportation: Self-driving, from Sun Valley to San Diego, duration: 14 hours 9 mins, distance: 1,461 km, cost: 73 x 7 = 511\nBreakfast: -\nAttraction: -\nLunch: -\nDinner: The Lost Mughal, San Diego, cost: 74 x 7 = 518, cuisines: Tea, Cafe, Italian\nAccommodation: Harlem Garden Oasis in New York City Brownstone, San Diego, cost: 368 x 7 = 2576, maximum occupancy: 3, house rules: No visitors, minimum nights: 31\n\nNumber of people: 7\nTotal cost: 511 + 518 + 2576 = 3605\nAccommodation minimum nights: 1/31\n\nDays: 2\nCurrent City: San Diego\nTransportation: -\nBreakfast: Open Yard, San Diego, cost: 33 x 7 = 231, cuisines: Chinese, Pizza, Cafe, Desserts\nAttraction: San Diego Zoo, San Diego; Balboa Park, San Diego\nLunch: Jetha Lal Ka Dhabha, San Diego, cost: 22 x 7 = 154, cuisines: Tea, Cafe, Indian, Italian\nDinner: Gopala, San Diego, cost: 98 x 7 = 686, cuisines: Pizza, Mexican, BBQ, American, Seafood\nAccommodation: Harlem Garden Oasis in New York City Brownstone, San Diego, cost: 368 x 7 = 2576, maximum occupancy: 3, house rules: No visitors, minimum nights: 31\n\nNumber of people: 7\nTotal cost: 231 + 154 + 686 + 2576 = 3647\nAccommodation minimum nights: 2/31\n\nDays: 3\nCurrent City: from San Diego to Oakland\nTransportation: Self-driving, from San Diego to Oakland, duration: 7 hours 38 mins, distance: 789 km, cost: 39 x 7 = 273\nBreakfast: Bun Intended, San Diego, cost: 91 x 7 = 637, cuisines: Cafe, Pizza, Desserts, Seafood\nAttraction: -\nLunch: -\nDinner: Cho Gao - Crowne Plaza Abu Dhabi, Oakland, cost: 52 x 7 = 364, cuisines: Tea, BBQ, Seafood\nAccommodation: Conveniently located 2 BR Time Square Apartment, Oakland, cost: 502 x 7 = 3514, maximum occupancy: 4, house rules: No parties, No smoking, No children under 10, minimum nights: 2\n\nNumber of people: 7\nTotal cost: 273 + 637 + 364 + 3514 = 4788\nAccommodation minimum nights: 1/2\n\nDays: 4\nCurrent City: Oakland\nTransportation: -\nBreakfast: Malais By Anands, Oakland, cost: 37 x 7 = 259, cuisines: Tea, Cafe, Mexican, Pizza\nAttraction: Oakland Zoo, Oakland; Chabot Space & Science Center, Oakland\nLunch: Pind Balluchi, Oakland, cost: 61 x 7 = 427, cuisines: Tea, Cafe, BBQ, Seafood\nDinner: Wok On Wheels, Oakland, cost: 100 x 7 = 700, cuisines: Tea, Pizza, Bakery, Mediterranean\nAccommodation: Conveniently located 2 BR Time Square Apartment, Oakland, cost: 502 x 7 = 3514, maximum occupancy: 4, house rules: No parties, No smoking, No children under 10, minimum nights: 2\n\nNumber of people: 7\nTotal cost: 259 + 427 + 700 + 3514 = 4900\nAccommodation minimum nights: 2/2\n\nDays: 5\nCurrent City: from Oakland to Sun Valley\nTransportation: Self-driving, from Oakland to Sun Valley, duration: 11 hours 36 mins, distance: 1,204 km, cost: 60 x 7 = 420\nBreakfast: Katyani Rasoi, Oakland, cost: 34 x 7 = 238, cuisines: Tea, French, Bakery, BBQ, Indian, Seafood\nAttraction: -\nLunch: -\nDinner: -\nAccommodation: -\n\nNumber of people: 7\nTotal cost: 420 + 238 = 658\n\nTotal cost across all days: 3605 + 3647 + 4788 + 4900 + 658 = 17598\n\nUnfortunately, the total cost of the travel plan ($17,598) exceeds the specified budget of $11,400. To adhere to the budget, we need to make adjustments to the plan. This could involve choosing more affordable accommodations, dining options, or reducing the number of attractions visited. Please let me know how you would like to proceed or if there are specific areas where you would prefer to cut costs.", "gpt-4-1106-preview_direct_sole-planning_parsed_results": [{"day": 1, "current_city": "from Sun Valley to San Diego", "transportation": "Self-driving, from Sun Valley to San Diego, duration: 14 hours 9 mins, distance: 1,461 km", "breakfast": "-", "attraction": "-", "lunch": "-", "dinner": "The Lost Mughal, San Diego", "accommodation": "Harlem Garden Oasis in New York City Brownstone, San Diego"}, {"day": 2, "current_city": "San Diego", "transportation": "-", "breakfast": "Open Yard, San Diego", "attraction": "San Diego Zoo, San Diego;Balboa Park, San Diego;", "lunch": "Jetha Lal Ka Dhabha, San Diego", "dinner": "Gopala, San Diego", "accommodation": "Harlem Garden Oasis in New York City Brownstone, San Diego"}, {"day": 3, "current_city": "from San Diego to Oakland", "transportation": "Self-driving, from San Diego to Oakland, duration: 7 hours 38 mins, distance: 789 km", "breakfast": "Bun Intended, San Diego", "attraction": "-", "lunch": "-", "dinner": "Cho Gao - Crowne Plaza Abu Dhabi, Oakland", "accommodation": "Conveniently located 2 BR Time Square Apartment, Oakland"}, {"day": 4, "current_city": "Oakland", "transportation": "-", "breakfast": "Malais By Anands, Oakland", "attraction": "Oakland Zoo, Oakland;Chabot Space & Science Center, Oakland;", "lunch": "Pind Balluchi, Oakland", "dinner": "Wok On Wheels, Oakland", "accommodation": "Conveniently located 2 BR Time Square Apartment, Oakland"}, {"day": 5, "current_city": "from Oakland to Sun Valley", "transportation": "Self-driving, from Oakland to Sun Valley, duration: 11 hours 36 mins, distance: 1,204 km", "breakfast": "Katyani Rasoi, Oakland", "attraction": "-", "lunch": "-", "dinner": "-", "accommodation": "-"}]}]