[{"gpt-4-1106-preview_direct_sole-planning_results": "Travel Plan:\n\nDays: 1\nCurrent City: from Palm Springs, California to Houston, Texas\nTransportation: Flight F3839339, from Palm Springs to Houston, duration: 2 hours 52 minutes, cost: 282\nBreakfast: -\nAttraction: -\nLunch: -\nDinner: Jalapenos, Houston, cost: 57, cuisines: Desserts, Tea, Cafe, Chinese, Seafood\nAccommodation: Sunny and Airy near Manhattan, Houston, cost: 499, room type: Entire home/apt, house rules: No pets, minimum nights: 2, maximum occupancy: 4\n\nNumber of people: 1\nTotal cost: 282 + 57 + 499 = 838\nAccommodation minimum nights: 1/2\n\nDays: 2\nCurrent City: Houston\nTransportation: -\nBreakfast: Super Bakery, Houston, cost: 30, cuisines: Seafood, Fast Food\nAttraction: Space Center Houston, Houston; Houston Museum of Natural Science, Houston\nLunch: Sheetla Dhaba, Houston, cost: 35, cuisines: Desserts, Pizza, Bakery, American, Mediterranean\nDinner: Royal Mart, Houston, cost: 40, cuisines: Tea, Bakery, Cafe, Mediterranean, Seafood\nAccommodation: Sunny and Airy near Manhattan, Houston, cost: 499, room type: Entire home/apt, house rules: No pets, minimum nights: 2, maximum occupancy: 4\n\nNumber of people: 1\nTotal cost: 30 + 35 + 40 + 499 = 604\nAccommodation minimum nights: 2/2\n\nDays: 3\nCurrent City: from Houston to Austin, Texas\nTransportation: Flight F3838099, from Houston to Austin, duration: 1 hours 5 minutes, cost: 43\nBreakfast: Earthen Spices, Houston, cost: 28, cuisines: Tea, Mexican, Bakery, BBQ, Fast Food\nAttraction: -\nLunch: -\nDinner: Wildflour Cafe + Bakery, Austin, cost: 55, cuisines: Desserts, French, Bakery, BBQ, Seafood\nAccommodation: Cozy room in south Harlem - 10 mins to Columbia, Austin, cost: 564, room type: Private room, house rules: No visitors & No children under 10, minimum nights: 1, maximum occupancy: 2\n\nNumber of people: 1\nTotal cost: 43 + 28 + 55 + 564 = 690\nAccommodation minimum nights: 1/1\n\nDays: 4\nCurrent City: Austin\nTransportation: -\nBreakfast: Quiosque Chopp Brahma, Austin, cost: 69, cuisines: Tea, Pizza, Bakery, Fast Food, Indian\nAttraction: Texas Capitol, Austin; Zilker Metropolitan Park, Austin\nLunch: The Kasbah, Austin, cost: 88, cuisines: Cafe, Pizza, BBQ, Fast Food\nDinner: Mehfil-e-Handi, Austin, cost: 96, cuisines: Desserts, Tea, Bakery, American, Seafood\nAccommodation: Cozy room in south Harlem - 10 mins to Columbia, Austin, cost: 564, room type: Private room, house rules: No visitors & No children under 10, minimum nights: 1, maximum occupancy: 2\n\nNumber of people: 1\nTotal cost: 69 + 88 + 96 + 564 = 817\nAccommodation minimum nights: 1/1\n\nDays: 5\nCurrent City: from Austin to Dallas, Texas\nTransportation: Flight F3601654, from Austin to Dallas, duration: 0 hours 53 minutes, cost: 44\nBreakfast: Cup-a-licious, Austin, cost: 85, cuisines: Fast Food, Chinese, BBQ, Italian\nAttraction: -\nLunch: -\nDinner: Coconuts Fish Cafe, Dallas, cost: 38, cuisines: Cafe, BBQ, Mediterranean, Fast Food\nAccommodation: 1BR, elevator, kitchen, doorman!, Dallas, cost: 475, room type: Entire home/apt, house rules: No parties, minimum nights: 1, maximum occupancy: 3\n\nNumber of people: 1\nTotal cost: 44 + 85 + 38 + 475 = 642\nAccommodation minimum nights: 1/1\n\nDays: 6\nCurrent City: Dallas\nTransportation: -\nBreakfast: 1918 Bistro & Grill, Dallas, cost: 90, cuisines: Tea, Pizza, BBQ, Seafood\nAttraction: The Dallas World Aquarium, Dallas; The Sixth Floor Museum at Dealey Plaza, Dallas\nLunch: Yanki Sizzlers, Dallas, cost: 96, cuisines: Cafe, French, Tea, Mediterranean\nDinner: Aravali Owls, Dallas, cost: 53, cuisines: Pizza, Italian, Bakery, Fast Food, Cafe\nAccommodation: 1BR, elevator, kitchen, doorman!, Dallas, cost: 475, room type: Entire home/apt, house rules: No parties, minimum nights: 1, maximum occupancy: 3\n\nNumber of people: 1\nTotal cost: 90 + 96 + 53 + 475 = 714\nAccommodation minimum nights: 1/1\n\nDays: 7\nCurrent City: from Dallas, Texas to Palm Springs, California\nTransportation: Flight F3673984, from Dallas to Palm Springs, duration: 3 hours 23 minutes, cost: 432\nBreakfast: Kebab Xpress, Dallas, cost: 93, cuisines: Tea, Bakery, Pizza, Mediterranean\nAttraction: -\nLunch: -\nDinner: -\nAccommodation: -\n\nNumber of people: 1\nTotal cost: 432 + 93 = 525\n\nTotal cost across all days: 838 + 604 + 690 + 817 + 642 + 714 + 525 = 4,830\n\nCuisines: The prompt specifies no cuisines, so all cuisine constraints are satisfied\n\nThe travel plan adheres to the constraints provided, including the budget of $8,100, visiting 3 cities in Texas, and ensuring no repeated restaurants or attractions. The accommodations are booked according to the room type constraints and house rules. The transportation modes are consistent and valid for the cities visited. The total cost of the trip is $4,830, which is well within the budget.", "gpt-4-1106-preview_direct_sole-planning_parsed_results": [{"day": 1, "current_city": "from Palm Springs, California to Houston, Texas", "transportation": "Flight Number: F3839339, from Palm Springs to Houston, Departure Time: -, Arrival Time: -", "breakfast": "-", "attraction": "-", "lunch": "-", "dinner": "Jalapenos, Houston", "accommodation": "Sunny and Airy near Manhattan, Houston"}, {"day": 2, "current_city": "Houston", "transportation": "-", "breakfast": "Super Bakery, Houston", "attraction": "Space Center Houston, Houston;Houston Museum of Natural Science, Houston;", "lunch": "Sheetla Dhaba, Houston", "dinner": "Royal Mart, Houston", "accommodation": "Sunny and Airy near Manhattan, Houston"}, {"day": 3, "current_city": "from Houston to Austin, Texas", "transportation": "Flight Number: F3838099, from Houston to Austin, Departure Time: -, Arrival Time: -", "breakfast": "Earthen Spices, Houston", "attraction": "-", "lunch": "-", "dinner": "Wildflour Cafe + Bakery, Austin", "accommodation": "Cozy room in south Harlem - 10 mins to Columbia, Austin"}, {"day": 4, "current_city": "Austin", "transportation": "-", "breakfast": "Quiosque Chopp Brahma, Austin", "attraction": "Texas Capitol, Austin;Zilker Metropolitan Park, Austin;", "lunch": "The Kasbah, Austin", "dinner": "Mehfil-e-Handi, Austin", "accommodation": "Cozy room in south Harlem - 10 mins to Columbia, Austin"}, {"day": 5, "current_city": "from Austin to Dallas, Texas", "transportation": "Flight Number: F3601654, from Austin to Dallas, Departure Time: -, Arrival Time: -", "breakfast": "Cup-a-licious, Austin", "attraction": "-", "lunch": "-", "dinner": "Coconuts Fish Cafe, Dallas", "accommodation": "1BR, elevator, kitchen, doorman!, Dallas"}, {"day": 6, "current_city": "Dallas", "transportation": "-", "breakfast": "1918 Bistro & Grill, Dallas", "attraction": "The Dallas World Aquarium, Dallas;The Sixth Floor Museum at Dealey Plaza, Dallas;", "lunch": "Yanki Sizzlers, Dallas", "dinner": "Aravali Owls, Dallas", "accommodation": "1BR, elevator, kitchen, doorman!, Dallas"}, {"day": 7, "current_city": "from Dallas, Texas to Palm Springs, California", "transportation": "Flight Number: F3673984, from Dallas to Palm Springs, Departure Time: -, Arrival Time: -", "breakfast": "Kebab Xpress, Dallas", "attraction": "-", "lunch": "-", "dinner": "-", "accommodation": "-"}]}]