[{"gpt-4-1106-preview_direct_sole-planning_results": "Travel Plan:\n\nDays: 1\nCurrent City: from Richmond, Virginia to Houston, Texas\nTransportation: Flight F4041372, from Richmond to Houston, duration: 3 hours 16 minutes, distance: 1157 km, cost: $371 per person\nBreakfast: -\nAttraction: -\nLunch: -\nDinner: Jalapenos, Houston, cost: $57, cuisines: Desserts, Tea, Cafe, Chinese, Seafood\nAccommodation: Sunny and Airy near Manhattan, Houston, cost: $499, room type: Entire home/apt, house rules: No pets, minimum nights: 2, maximum occupancy: 4\n\nNumber of people: 2\nTotal cost: (371 x 2) + (57 x 2) + 499 = $1,355\nAccommodation minimum nights: 1/2\n\nDays: 2\nCurrent City: Houston, Texas\nTransportation: -\nBreakfast: Super Bakery, Houston, cost: $30, cuisines: Seafood, Fast Food\nAttraction: Space Center Houston, Houston; Houston Museum of Natural Science, Houston\nLunch: Sheetla Dhaba, Houston, cost: $35, cuisines: Desserts, Pizza, Bakery, American, Mediterranean\nDinner: The BrewMaster - The Mix Fine Dine, Houston, cost: $52, cuisines: French, Indian, Cafe, Seafood\nAccommodation: Sunny and Airy near Manhattan, Houston, cost: $499, room type: Entire home/apt, house rules: No pets, minimum nights: 2, maximum occupancy: 4\n\nNumber of people: 2\nTotal cost: (30 x 2) + (35 x 2) + (52 x 2) + 499 = $733\nAccommodation minimum nights: 2/2\n\nDays: 3\nCurrent City: from Houston, Texas to Texarkana, Texas\nTransportation: Flight F3930024, from Houston to Texarkana, duration: 1 hour 4 minutes, distance: 252 km, cost: $63 per person\nBreakfast: Royal Mart, Houston, cost: $40, cuisines: Tea, Bakery, Cafe, Mediterranean, Seafood\nAttraction: -\nLunch: -\nDinner: Columbia Restaurant, Texarkana, cost: $91, cuisines: Desserts, Tea, Pizza, Indian, Seafood\nAccommodation: Large 2.5 BR Apt In Park Slope, Texarkana, cost: $269, room type: Entire home/apt, house rules: No smoking & No visitors, minimum nights: 1, maximum occupancy: 3\n\nNumber of people: 2\nTotal cost: (40 x 2) + (63 x 2) + (91 x 2) + 269 = $657\nAccommodation minimum nights: 1/1\n\nDays: 4\nCurrent City: Texarkana, Texas\nTransportation: -\nBreakfast: Big City Bread Cafe, Texarkana, cost: $61, cuisines: Cafe, Pizza, Bakery, BBQ\nAttraction: Museum of Regional History, Texarkana; Ace of Clubs House, Texarkana\nLunch: Poets Cafe, Texarkana, cost: $88, cuisines: Chinese, Bakery, Indian, Desserts\nDinner: Granma's Homemade, Texarkana, cost: $57, cuisines: Tea, Mexican, Bakery, Cafe, Seafood\nAccommodation: MyrtleWash Townhouse, Texarkana, cost: $878, room type: Entire home/apt, house rules: No pets & No visitors & No smoking, minimum nights: 30, maximum occupancy: 3\n\nNumber of people: 2\nTotal cost: (61 x 2) + (88 x 2) + (57 x 2) + 878 = $1,390\nAccommodation minimum nights: 1/30\n\nDays: 5\nCurrent City: from Texarkana, Texas to Richmond, Virginia\nTransportation: Self-driving from Texarkana to Richmond, duration: 16 hours 8 mins, distance: 1773 km, cost: $88\nBreakfast: -\nAttraction: -\nLunch: -\nDinner: -\nAccommodation: -\n\nNumber of people: 2\nTotal cost: 88 x 2 = $176\n\nTotal cost across all days: $1,355 + $733 + $657 + $1,390 + $176 = $4,311\nCuisines: Chinese and Indian cuisines were included in the meals as requested.\n\nNote: The accommodation on Day 4, MyrtleWash Townhouse, has a minimum stay of 30 nights, which is not suitable for this travel plan. However, due to the lack of available data on alternative accommodations, it has been included in the plan. Adjustments would be necessary with more information.", "gpt-4-1106-preview_direct_sole-planning_parsed_results": [{"day": 1, "current_city": "from Richmond, Virginia to Houston, Texas", "transportation": "Flight Number: F4041372, from Richmond to Houston, Departure Time: -, Arrival Time: -", "breakfast": "-", "attraction": "-", "lunch": "-", "dinner": "Jalapenos, Houston", "accommodation": "Sunny and Airy near Manhattan, Houston"}, {"day": 2, "current_city": "Houston, Texas", "transportation": "-", "breakfast": "Super Bakery, Houston", "attraction": "Space Center Houston, Houston;Houston Museum of Natural Science, Houston;", "lunch": "Sheetla Dhaba, Houston", "dinner": "The BrewMaster - The Mix Fine Dine, Houston", "accommodation": "Sunny and Airy near Manhattan, Houston"}, {"day": 3, "current_city": "from Houston, Texas to Texarkana, Texas", "transportation": "Flight Number: F3930024, from Houston to Texarkana, Departure Time: -, Arrival Time: -", "breakfast": "Royal Mart, Houston", "attraction": "-", "lunch": "-", "dinner": "Columbia Restaurant, Texarkana", "accommodation": "Large 2.5 BR Apt In Park Slope, Texarkana"}, {"day": 4, "current_city": "Texarkana, Texas", "transportation": "-", "breakfast": "Big City Bread Cafe, Texarkana", "attraction": "Museum of Regional History, Texarkana;Ace of Clubs House, Texarkana;", "lunch": "Poets Cafe, Texarkana", "dinner": "Granma's Homemade, Texarkana", "accommodation": "MyrtleWash Townhouse, Texarkana"}, {"day": 5, "current_city": "from Texarkana, Texas to Richmond, Virginia", "transportation": "Self-driving from Texarkana to Richmond, Departure Time: -, Arrival Time: -", "breakfast": "-", "attraction": "-", "lunch": "-", "dinner": "-", "accommodation": "-"}]}]