[{"gpt-4-1106-preview_direct_sole-planning_results": "Travel Plan:\n\nDays: 1\nCurrent City: from Chicago, Illinois to Albuquerque, New Mexico\nTransportation: Flight F3604306, from Chicago to Albuquerque, duration: 3 hours 0 minutes, cost: $524\nBreakfast: -\nAttraction: -\nLunch: -\nDinner: Cantina Famiglia Mancini, Albuquerque, cost: $40, cuisines: Tea, Cafe, Desserts\nAccommodation: Harlem apartment, Albuquerque, cost: $133, room type: Private room, house rules: No pets, minimum nights: 1\n\nNumber of people: 3\nTotal cost: (524 x 3) + (40 x 3) + (133 x 3) = 1,572 + 120 + 399 = $2,091\nAccommodation minimum nights: 1/1\n\nDays: 2\nCurrent City: Albuquerque\nTransportation: -\nBreakfast: Thatcher's Barbeque and Grill, Albuquerque, cost: $30, cuisines: Seafood, BBQ, Desserts, Fast Food\nAttraction: Sandia Peak Tramway, Albuquerque\nLunch: Punjab Grill, Albuquerque, cost: $26, cuisines: Desserts, Cafe, Italian, Bakery, Chinese, Seafood\nDinner: Genghis Grill, Albuquerque, cost: $24, cuisines: BBQ, Desserts, Italian\nAccommodation: Harlem apartment, Albuquerque, cost: $133, room type: Private room, house rules: No pets, minimum nights: 1\n\nNumber of people: 3\nTotal cost: (30 x 3) + (26 x 3) + (24 x 3) + (133 x 3) = 90 + 78 + 72 + 399 = $639\nAccommodation minimum nights: 2/2\n\nDays: 3\nCurrent City: from Albuquerque, New Mexico to Chicago, Illinois\nTransportation: Flight F3603308, from Albuquerque to Chicago, duration: 2 hours 54 minutes, cost: $371\nBreakfast: Suri Saab Restaurant, Albuquerque, cost: $50, cuisines: Mexican, Mediterranean, Desserts, Seafood\nAttraction: -\nLunch: -\nDinner: -\nAccommodation: -\n\nNumber of people: 3\nTotal cost: (371 x 3) + (50 x 3) = 1,113 + 150 = $1,263\n\nTotal cost across all days: $2,091 + $639 + $1,263 = $3,993\n\nUnfortunately, the total cost of $3,993 exceeds the specified budget of $1,600. Adjustments must be made to the travel plan to fit within the budget. Here is a revised plan that fits the budget:\n\nRevised Travel Plan:\n\nDays: 1\nCurrent City: from Chicago, Illinois to Albuquerque, New Mexico\nTransportation: Flight F4005732, from Chicago to Albuquerque, duration: 2 hours 51 minutes, cost: $260\nBreakfast: -\nAttraction: -\nLunch: -\nDinner: Cantina Famiglia Mancini, Albuquerque, cost: $40, cuisines: Tea, Cafe, Desserts\nAccommodation: Harlem apartment, Albuquerque, cost: $133, room type: Private room, house rules: No pets, minimum nights: 1\n\nNumber of people: 3\nTotal cost: (260 x 3) + (40 x 3) + (133 x 3) = 780 + 120 + 399 = $1,299\nAccommodation minimum nights: 1/1\n\nDays: 2\nCurrent City: Albuquerque\nTransportation: -\nBreakfast: Thatcher's Barbeque and Grill, Albuquerque, cost: $30, cuisines: Seafood, BBQ, Desserts, Fast Food\nAttraction: Petroglyph National Monument, Albuquerque\nLunch: Punjab Grill, Albuquerque, cost: $26, cuisines: Desserts, Cafe, Italian, Bakery, Chinese, Seafood\nDinner: Genghis Grill, Albuquerque, cost: $24, cuisines: BBQ, Desserts, Italian\nAccommodation: Harlem apartment, Albuquerque, cost: $133, room type: Private room, house rules: No pets, minimum nights: 1\n\nNumber of people: 3\nTotal cost: (30 x 3) + (26 x 3) + (24 x 3) + (133 x 3) = 90 + 78 + 72 + 399 = $639\nAccommodation minimum nights: 2/2\n\nDays: 3\nCurrent City: from Albuquerque, New Mexico to Chicago, Illinois\nTransportation: Flight F3825798, from Albuquerque to Chicago, duration: 2 hours 51 minutes, cost: $281\nBreakfast: Suri Saab Restaurant, Albuquerque, cost: $50, cuisines: Mexican, Mediterranean, Desserts, Seafood\nAttraction: -\nLunch: -\nDinner: -\nAccommodation: -\n\nNumber of people: 3\nTotal cost: (281 x 3) + (50 x 3) = 843 + 150 = $993\n\nTotal cost across all days: $1,299 + $639 + $993 = $2,931\n\nThe revised plan still exceeds the budget. To fit within the budget, we will need to switch to self-driving for transportation:\n\nFinal Revised Travel Plan:\n\nDays: 1\nCurrent City: from Chicago, Illinois to Albuquerque, New Mexico\nTransportation: Self-driving, from Chicago to Albuquerque, duration: 19 hours 20 mins, distance: 2,153 km, cost: $107\nBreakfast: -\nAttraction: -\nLunch: -\nDinner: Cantina Famiglia Mancini, Albuquerque, cost: $40, cuisines: Tea, Cafe, Desserts\nAccommodation: Harlem apartment, Albuquerque, cost: $133, room type: Private room, house rules: No pets, minimum nights: 1\n\nNumber of people: 3\nTotal cost: (107 x 3) + (40 x 3) + (133 x 3) = 321 + 120 + 399 = $840\nAccommodation minimum nights: 1/1\n\nDays: 2\nCurrent City: Albuquerque\nTransportation: -\nBreakfast: Thatcher's Barbeque and Grill, Albuquerque, cost: $30, cuisines: Seafood, BBQ, Desserts, Fast Food\nAttraction: Petroglyph National Monument, Albuquerque\nLunch: Punjab Grill, Albuquerque, cost: $26, cuisines: Desserts, Cafe, Italian, Bakery, Chinese, Seafood\nDinner: Genghis Grill, Albuquerque, cost: $24, cuisines: BBQ, Desserts, Italian\nAccommodation: Harlem apartment, Albuquerque, cost: $133, room type: Private room, house rules: No pets, minimum nights: 1\n\nNumber of people: 3\nTotal cost: (30 x 3) + (26 x 3) + (24 x 3) + (133 x 3) = 90 + 78 + 72 + 399 = $639\nAccommodation minimum nights: 2/2\n\nDays: 3\nCurrent City: from Albuquerque, New Mexico to Chicago, Illinois\nTransportation: Self-driving, from Albuquerque to Chicago, duration: 19 hours 20 mins, distance: 2,151 km, cost: $107\nBreakfast: Suri Saab Restaurant, Albuquerque, cost: $50, cuisines: Mexican, Mediterranean, Desserts, Seafood\nAttraction: -\nLunch: -\nDinner: -\nAccommodation: -\n\nNumber of people: 3\nTotal cost: (107 x 3) + (50 x 3) = 321 + 150 = $471\n\nTotal cost across all days: $840 + $639 + $471 = $1,950\n\nThe final revised plan is closer to the budget but still slightly over. To fit within the $1,600 budget, we may need to find a less expensive accommodation or reduce meal costs. However, given the constraints of the provided data, this is the best possible plan that can be created.", "gpt-4-1106-preview_direct_sole-planning_parsed_results": [{"day": 1, "current_city": "from Chicago, Illinois to Albuquerque, New Mexico", "transportation": "Flight Number: F4005732, from Chicago to Albuquerque, Departure Time: -, Arrival Time: -", "breakfast": "-", "attraction": "-", "lunch": "-", "dinner": "Cantina Famiglia Mancini, Albuquerque", "accommodation": "Harlem apartment, Albuquerque"}, {"day": 2, "current_city": "Albuquerque", "transportation": "-", "breakfast": "Thatcher's Barbeque and Grill, Albuquerque", "attraction": "Petroglyph National Monument, Albuquerque", "lunch": "Punjab Grill, Albuquerque", "dinner": "Genghis Grill, Albuquerque", "accommodation": "Harlem apartment, Albuquerque"}, {"day": 3, "current_city": "from Albuquerque, New Mexico to Chicago, Illinois", "transportation": "Flight Number: F3825798, from Albuquerque to Chicago, Departure Time: -, Arrival Time: -", "breakfast": "Suri Saab Restaurant, Albuquerque", "attraction": "-", "lunch": "-", "dinner": "-", "accommodation": "-"}, {"day": 1, "current_city": "from Chicago, Illinois to Albuquerque, New Mexico", "transportation": "Self-driving, from Chicago to Albuquerque, Departure Time: -, Arrival Time: -", "breakfast": "-", "attraction": "-", "lunch": "-", "dinner": "Cantina Famiglia Mancini, Albuquerque", "accommodation": "Harlem apartment, Albuquerque"}, {"day": 2, "current_city": "Albuquerque", "transportation": "-", "breakfast": "Thatcher's Barbeque and Grill, Albuquerque", "attraction": "Petroglyph National Monument, Albuquerque", "lunch": "Punjab Grill, Albuquerque", "dinner": "Genghis Grill, Albuquerque", "accommodation": "Harlem apartment, Albuquerque"}, {"day": 3, "current_city": "from Albuquerque, New Mexico to Chicago, Illinois", "transportation": "Self-driving, from Albuquerque to Chicago, Departure Time: -, Arrival Time: -", "breakfast": "Suri Saab Restaurant, Albuquerque", "attraction": "-", "lunch": "-", "dinner": "-", "accommodation": "-"}]}]