[{"gpt-4-1106-preview_direct_sole-planning_results": "Travel Plan:\n\nDays: 1\nDate: March 17, 2022\nCurrent City: from Baton Rouge, Louisiana to Texarkana, Texas\nTransportation: Taxi, from Baton Rouge to Texarkana, duration: 4 hours 46 mins, distance: 519 km, cost: $519\nBreakfast: -\nAttraction: -\nLunch: -\nDinner: Big City Bread Cafe, Texarkana, cost: $61, cuisines: Cafe, Pizza, Bakery, BBQ\nAccommodation: Large 2.5 BR Apt In Park Slope, Texarkana, cost: $269, room type: Entire home/apt, house rules: No smoking & No visitors, minimum nights: 1, maximum occupancy: 3\n\nNumber of people: 6\nTotal cost: (Taxi $519 + Dinner $61 + Accommodation $269) x 6 = $5,094\nAccommodation minimum nights: 1/1\n\nDays: 2\nDate: March 18, 2022\nCurrent City: Texarkana\nTransportation: -\nBreakfast: Columbia Restaurant, Texarkana, cost: $91, cuisines: Desserts, Tea, Pizza, Indian, Seafood\nAttraction: Museum of Regional History, Texarkana; Spring Lake Park, Texarkana\nLunch: The Beer Cafe - BIGGIE, Texarkana, cost: $13, cuisines: Cafe, Pizza, Mediterranean, Fast Food\nDinner: Granma's Homemade, Texarkana, cost: $57, cuisines: Tea, Mexican, Bakery, Cafe, Seafood\nAccommodation: Large 2.5 BR Apt In Park Slope, Texarkana, cost: $269, room type: Entire home/apt, house rules: No smoking & No visitors, minimum nights: 1, maximum occupancy: 3\n\nNumber of people: 6\nTotal cost: (Breakfast $91 + Lunch $13 + Dinner $57 + Accommodation $269) x 6 = $2,580\nAccommodation minimum nights: 1/1\n\nDays: 3\nDate: March 19, 2022\nCurrent City: from Texarkana, Texas to Abilene, Texas\nTransportation: Taxi, from Texarkana to Abilene, duration: 5 hours 20 mins, distance: 579 km, cost: $579\nBreakfast: -\nAttraction: -\nLunch: -\nDinner: Thai Garden, Abilene, cost: $13, cuisines: Cafe, American, Desserts\nAccommodation: Apartment minutes from manhattan, Abilene, cost: $295, room type: Entire home/apt, house rules: No pets & No visitors, minimum nights: 2, maximum occupancy: 2\n\nNumber of people: 6\nTotal cost: (Taxi $579 + Dinner $13 + Accommodation $295) x 6 = $5,274\nAccommodation minimum nights: 1/2\n\nDays: 4\nDate: March 20, 2022\nCurrent City: Abilene\nTransportation: -\nBreakfast: Crispy Crust, Abilene, cost: $54, cuisines: Desserts, Bakery, Cafe, American, Seafood\nAttraction: The Grace Museum, Abilene; Frontier Texas!, Abilene\nLunch: LPK Waterfront, Abilene, cost: $61, cuisines: Pizza, Italian, BBQ, Fast Food, Seafood\nDinner: Mediumwelldone, Abilene, cost: $91, cuisines: Tea, French, BBQ, Cafe, Seafood\nAccommodation: Apartment minutes from manhattan, Abilene, cost: $295, room type: Entire home/apt, house rules: No pets & No visitors, minimum nights: 2, maximum occupancy: 2\n\nNumber of people: 6\nTotal cost: (Breakfast $54 + Lunch $61 + Dinner $91 + Accommodation $295) x 6 = $3,006\nAccommodation minimum nights: 2/2\n\nDays: 5\nDate: March 21, 2022\nCurrent City: from Abilene, Texas to Amarillo, Texas\nTransportation: Taxi, from Abilene to Amarillo, duration: 4 hours 10 mins, distance: 446 km, cost: $446\nBreakfast: -\nAttraction: -\nLunch: -\nDinner: The Cinnamon Kitchen, Amarillo, cost: $69, cuisines: Desserts, Tea, Pizza, Chinese, Seafood\nAccommodation: Harlem Humble Abode - 1 bedroom - Cute and Quaint, Amarillo, cost: $409, room type: Entire home/apt, house rules: No pets, minimum nights: 5, maximum occupancy: 3\n\nNumber of people: 6\nTotal cost: (Taxi $446 + Dinner $69 + Accommodation $409) x 6 = $5,670\nAccommodation minimum nights: 1/5\n\nDays: 6\nDate: March 22, 2022\nCurrent City: Amarillo\nTransportation: -\nBreakfast: Komachi, Amarillo, cost: $71, cuisines: Desserts, Tea, Fast Food, Chinese, Mediterranean\nAttraction: Cadillac Ranch, Amarillo; Amarillo Botanical Gardens, Amarillo\nLunch: Sigree Global Grill, Amarillo, cost: $35, cuisines: Chinese, BBQ, Cafe, Desserts\nDinner: Anand Restaurant, Amarillo, cost: $53, cuisines: Fast Food, Seafood, Desserts, Italian\nAccommodation: Harlem Humble Abode - 1 bedroom - Cute and Quaint, Amarillo, cost: $409, room type: Entire home/apt, house rules: No pets, minimum nights: 5, maximum occupancy: 3\n\nNumber of people: 6\nTotal cost: (Breakfast $71 + Lunch $35 + Dinner $53 + Accommodation $409) x 6 = $3,408\nAccommodation minimum nights: 2/5\n\nDays: 7\nDate: March 23, 2022\nCurrent City: from Amarillo, Texas to Baton Rouge, Louisiana\nTransportation: Taxi, from Amarillo to Baton Rouge, duration: 11 hours 42 mins, distance: 1,270 km, cost: $1,270\nBreakfast: -\nAttraction: -\nLunch: -\nDinner: -\nAccommodation: -\n\nNumber of people: 6\nTotal cost: Taxi $1,270 x 6 = $7,620\n\nTotal cost across all days: $5,094 + $2,580 + $5,274 + $3,006 + $5,670 + $3,408 + $7,620 = $32,652\n\nUnfortunately, the total cost of $32,652 exceeds the specified budget of $14,600. To adhere to the budget, we need to revise the travel plan, possibly by choosing more economical transportation options or accommodations. Since self-driving is not preferred, we may need to consider alternative cities within Texas that are closer to each other to reduce taxi costs, or adjust the number of cities visited.", "gpt-4-1106-preview_direct_sole-planning_parsed_results": [{"day": 1, "current_city": "from Baton Rouge, Louisiana to Texarkana, Texas", "transportation": "Taxi, from Baton Rouge to Texarkana, duration: 4 hours 46 mins, distance: 519 km", "breakfast": "-", "attraction": "-", "lunch": "-", "dinner": "Big City Bread Cafe, Texarkana", "accommodation": "Large 2.5 BR Apt In Park Slope, Texarkana"}, {"day": 2, "current_city": "Texarkana", "transportation": "-", "breakfast": "Columbia Restaurant, Texarkana", "attraction": "Museum of Regional History, Texarkana;Spring Lake Park, Texarkana;", "lunch": "The Beer Cafe - BIGGIE, Texarkana", "dinner": "Granma's Homemade, Texarkana", "accommodation": "Large 2.5 BR Apt In Park Slope, Texarkana"}, {"day": 3, "current_city": "from Texarkana, Texas to Abilene, Texas", "transportation": "Taxi, from Texarkana to Abilene, duration: 5 hours 20 mins, distance: 579 km", "breakfast": "-", "attraction": "-", "lunch": "-", "dinner": "Thai Garden, Abilene", "accommodation": "Apartment minutes from manhattan, Abilene"}, {"day": 4, "current_city": "Abilene", "transportation": "-", "breakfast": "Crispy Crust, Abilene", "attraction": "The Grace Museum, Abilene;Frontier Texas!, Abilene;", "lunch": "LPK Waterfront, Abilene", "dinner": "Mediumwelldone, Abilene", "accommodation": "Apartment minutes from manhattan, Abilene"}, {"day": 5, "current_city": "from Abilene, Texas to Amarillo, Texas", "transportation": "Taxi, from Abilene to Amarillo, duration: 4 hours 10 mins, distance: 446 km", "breakfast": "-", "attraction": "-", "lunch": "-", "dinner": "The Cinnamon Kitchen, Amarillo", "accommodation": "Harlem Humble Abode - 1 bedroom - Cute and Quaint, Amarillo"}, {"day": 6, "current_city": "Amarillo", "transportation": "-", "breakfast": "Komachi, Amarillo", "attraction": "Cadillac Ranch, Amarillo;Amarillo Botanical Gardens, Amarillo;", "lunch": "Sigree Global Grill, Amarillo", "dinner": "Anand Restaurant, Amarillo", "accommodation": "Harlem Humble Abode - 1 bedroom - Cute and Quaint, Amarillo"}, {"day": 7, "current_city": "from Amarillo, Texas to Baton Rouge, Louisiana", "transportation": "Taxi, from Amarillo to Baton Rouge, duration: 11 hours 42 mins, distance: 1,270 km", "breakfast": "-", "attraction": "-", "lunch": "-", "dinner": "-", "accommodation": "-"}]}]