[{"gpt-4-1106-preview_direct_sole-planning_results": "Travel Plan:\n\nDays: 1\nCurrent City: from Chicago, Illinois to Wilmington, North Carolina\nTransportation: Self-driving, from Chicago to Wilmington, duration: 14 hours 11 mins, distance: 1,505 km, cost: $75\nBreakfast: -\nAttraction: -\nLunch: -\nDinner: Azteca, Wilmington, cost: $56, cuisines: Cafe, Indian, BBQ\nAccommodation: Prime East Village location w/backyard garden!, Wilmington, cost: $978, room type: Entire home/apt, house rules: No pets & No smoking, minimum nights: 4, maximum occupancy: 7\n\nNumber of people: 2\nTotal cost: ($75 + $56 + $978) x 2 = $2,218\nAccommodation minimum nights: 1/4\n\nDays: 2\nCurrent City: Wilmington\nTransportation: -\nBreakfast: Bandit Burrito, Wilmington, cost: $26, cuisines: Desserts, French, Bakery, Fast Food, Seafood\nAttraction: Bellamy Mansion Museum, Wilmington; Airlie Gardens, Wilmington\nLunch: Moonie's Texas Barbecue, Wilmington, cost: $38, cuisines: Chinese, Bakery, Fast Food\nDinner: Taco Bus, Wilmington, cost: $59, cuisines: Tea, Cafe, BBQ\nAccommodation: Prime East Village location w/backyard garden!, Wilmington, cost: $978, room type: Entire home/apt, house rules: No pets & No smoking, minimum nights: 4, maximum occupancy: 7\n\nNumber of people: 2\nTotal cost: ($26 + $38 + $59 + $978) x 2 = $2,202\nAccommodation minimum nights: 2/4\n\nDays: 3\nCurrent City: from Wilmington to Charlotte, North Carolina\nTransportation: Self-driving, from Wilmington to Charlotte, duration: 3 hours 24 mins, distance: 324 km, cost: $16\nBreakfast: Dunkin' Donuts, Wilmington, cost: $25, cuisines: Desserts, Tea, Pizza, Italian, French\nAttraction: Wilmington Riverwalk, Wilmington\nLunch: The Yellow Chef, Wilmington, cost: $45, cuisines: French, BBQ, Mediterranean, Fast Food\nDinner: Olive Tree Cafe, Charlotte, cost: $23, cuisines: Tea, Chinese, Desserts\nAccommodation: Elegant Studio Apt in Prospect Heights, Charlotte, cost: $640, room type: Entire home/apt, house rules: No parties, minimum nights: 2, maximum occupancy: 5\n\nNumber of people: 2\nTotal cost: ($16 + $25 + $45 + $23 + $640) x 2 = $1,498\nAccommodation minimum nights: 1/2\n\nDays: 4\nCurrent City: Charlotte\nTransportation: -\nBreakfast: Central Perk 7, Charlotte, cost: $87, cuisines: Pizza, Bakery, BBQ, Fast Food\nAttraction: Freedom Park, Charlotte; Levine Museum of the New South, Charlotte\nLunch: Subway, Charlotte, cost: $60, cuisines: Tea, Cafe, Mexican, Chinese, Seafood\nDinner: Cafe Maple Street, Charlotte, cost: $91, cuisines: Fast Food, Tea, Italian\nAccommodation: Elegant Studio Apt in Prospect Heights, Charlotte, cost: $640, room type: Entire home/apt, house rules: No parties, minimum nights: 2, maximum occupancy: 5\n\nNumber of people: 2\nTotal cost: ($87 + $60 + $91 + $640) x 2 = $1,756\nAccommodation minimum nights: 2/2\n\nDays: 5\nCurrent City: from Charlotte, North Carolina to Chicago, Illinois\nTransportation: Self-driving, from Charlotte to Chicago, duration: 11 hours 39 mins, distance: 1,215 km, cost: $60\nBreakfast: Kylin Skybar, Charlotte, cost: $44, cuisines: Tea, Cafe, Pizza, Italian\nAttraction: -\nLunch: -\nDinner: -\nAccommodation: -\n\nNumber of people: 2\nTotal cost: ($60 + $44) x 2 = $208\n\nTotal cost across all days: $2,218 + $2,202 + $1,498 + $1,756 + $208 = $7,882\n\nUnfortunately, the total cost of $7,882 exceeds the specified budget of $3,600. Adjustments must be made to the plan to reduce costs. This could include selecting more affordable accommodations, reducing meal costs, or shortening the stay in each city. Please note that the minimum night stays for accommodations may also need to be adjusted to fit within the budget constraints.", "gpt-4-1106-preview_direct_sole-planning_parsed_results": [{"day": 1, "current_city": "from Chicago, Illinois to Wilmington, North Carolina", "transportation": "Self-driving, from Chicago to Wilmington, duration: 14 hours 11 mins, distance: 1,505 km", "breakfast": "-", "attraction": "-", "lunch": "-", "dinner": "Azteca, Wilmington", "accommodation": "Prime East Village location w/backyard garden!, Wilmington"}, {"day": 2, "current_city": "Wilmington", "transportation": "-", "breakfast": "Bandit Burrito, Wilmington", "attraction": "Bellamy Mansion Museum, Wilmington; Airlie Gardens, Wilmington;", "lunch": "Moonie's Texas Barbecue, Wilmington", "dinner": "Taco Bus, Wilmington", "accommodation": "Prime East Village location w/backyard garden!, Wilmington"}, {"day": 3, "current_city": "from Wilmington to Charlotte, North Carolina", "transportation": "Self-driving, from Wilmington to Charlotte, duration: 3 hours 24 mins, distance: 324 km", "breakfast": "Dunkin' Donuts, Wilmington", "attraction": "Wilmington Riverwalk, Wilmington", "lunch": "The Yellow Chef, Wilmington", "dinner": "Olive Tree Cafe, Charlotte", "accommodation": "Elegant Studio Apt in Prospect Heights, Charlotte"}, {"day": 4, "current_city": "Charlotte", "transportation": "-", "breakfast": "Central Perk 7, Charlotte", "attraction": "Freedom Park, Charlotte; Levine Museum of the New South, Charlotte;", "lunch": "Subway, Charlotte", "dinner": "Cafe Maple Street, Charlotte", "accommodation": "Elegant Studio Apt in Prospect Heights, Charlotte"}, {"day": 5, "current_city": "from Charlotte, North Carolina to Chicago, Illinois", "transportation": "Self-driving, from Charlotte to Chicago, duration: 11 hours 39 mins, distance: 1,215 km", "breakfast": "Kylin Skybar, Charlotte", "attraction": "-", "lunch": "-", "dinner": "-", "accommodation": "-"}]}]