[{"gpt-4-1106-preview_direct_sole-planning_results": "Travel Plan:\n\nDays: 1\nCurrent City: from Ontario to Honolulu\nTransportation: Flight F3584294, from Ontario to Honolulu, duration: 6 hours 35 minutes, cost: 888\nBreakfast: -\nAttraction: -\nLunch: -\nDinner: Bait El Khetyar, Honolulu, cost: 28, cuisines: Cafe, Seafood\nAccommodation: Harlem 1 BR, Private Master Bath, Honolulu, cost: 396, maximum occupancy: 1, house rules: No pets, minimum nights: 2\n\nNumber of people: 1\nTotal cost: 888 x 1 + 28 x 1 + 396 x 1 = 1,312\nAccommodation minimum nights: 1/2\n\nDays: 2\nCurrent City: Honolulu\nTransportation: -\nBreakfast: Crystal Restaurant, Honolulu, cost: 57, cuisines: Tea, Pizza, Bakery, Fast Food, Chinese\nAttraction: Iolani Palace, Honolulu; Waikiki Aquarium, Honolulu\nLunch: Viva Hyderabad, Honolulu, cost: 29, cuisines: Bakery, BBQ\nDinner: Nimtho, Honolulu, cost: 31, cuisines: Pizza, Mexican, Bakery, BBQ, Cafe, Mediterranean\nAccommodation: Harlem 1 BR, Private Master Bath, Honolulu, cost: 396, maximum occupancy: 1, house rules: No pets, minimum nights: 2\n\nNumber of people: 1\nTotal cost: 57 x 1 + 29 x 1 + 31 x 1 + 396 x 1 = 513\nAccommodation minimum nights: 2/2\n\nDays: 3\nCurrent City: from Honolulu to Ontario\nTransportation: Flight F3584327, from Honolulu to Ontario, duration: 5 hours 27 minutes, cost: 1075\nBreakfast: Dunkin' Donuts, Honolulu, cost: 97, cuisines: Pizza, Desserts\nAttraction: -\nLunch: -\nDinner: -\nAccommodation: -\n\nNumber of people: 1\nTotal cost: 1075 x 1 + 97 x 1 = 1,172\n\nTotal cost across all days: 1,312 x 1 + 513 x 1 + 1,172 x 1 = 2,997\nCuisines: The prompt specifies no cuisines, so all cuisine constraints are satisfied\n\nNote: The travel plan adheres to the constraints provided, including the budget limit of $3,200. The total cost of the trip is $2,997, which is within the budget. The accommodations are private as per the constraints, and no restaurant or attraction is repeated. The transportation modes are valid and match the specified cities. The city sequence starts and ends in Ontario, forming a closed circle.", "gpt-4-1106-preview_direct_sole-planning_parsed_results": [{"day": 1, "current_city": "from Ontario to Honolulu", "transportation": "Flight Number: F3584294, from Ontario to Honolulu, Departure Time: -, Arrival Time: -", "breakfast": "-", "attraction": "-", "lunch": "-", "dinner": "Bait El Khetyar, Honolulu", "accommodation": "Harlem 1 BR, Private Master Bath, Honolulu"}, {"day": 2, "current_city": "Honolulu", "transportation": "-", "breakfast": "Crystal Restaurant, Honolulu", "attraction": "Iolani Palace, Honolulu;Waikiki Aquarium, Honolulu;", "lunch": "Viva Hyderabad, Honolulu", "dinner": "Nimtho, Honolulu", "accommodation": "Harlem 1 BR, Private Master Bath, Honolulu"}, {"day": 3, "current_city": "from Honolulu to Ontario", "transportation": "Flight Number: F3584327, from Honolulu to Ontario, Departure Time: -, Arrival Time: -", "breakfast": "Dunkin' Donuts, Honolulu", "attraction": "-", "lunch": "-", "dinner": "-", "accommodation": "-"}]}]