[{"gpt-4-1106-preview_direct_sole-planning_results": "Travel Plan:\n\nDays: 1\nCurrent City: from New York to Reno\nTransportation: Flight F3767722, from New York to Reno, departure: 21:02, arrival: 00:07, duration: 6 hours 5 minutes, distance: 2411 km, cost: 1200\nBreakfast: -\nAttraction: -\nLunch: -\nDinner: -\nAccommodation: A bright, beautiful treehouse, Reno, cost: 361, room type: Entire home/apt, house rules: No visitors, minimum nights: 2, maximum occupancy: 2\n\nNumber of people: 4 (including children under 10)\nTotal cost: 1200 x 4 + 361 x 2 = 4800 + 722 = 5522\nAccommodation minimum nights: 1/2\n\nDays: 2\nCurrent City: Reno\nTransportation: -\nBreakfast: Leme Light, Reno, cost: 55, cuisines: Cafe, Mexican, Fast Food\nAttraction: Nevada Museum of Art, Reno; The Discovery, Reno\nLunch: Kanha Sweets, Reno, cost: 28, cuisines: Italian, Bakery, Fast Food, Cafe, American\nDinner: Olive Bistro, Reno, cost: 66, cuisines: Tea, Cafe, Pizza, BBQ\nAccommodation: A bright, beautiful treehouse, Reno, cost: 361, room type: Entire home/apt, house rules: No visitors, minimum nights: 2, maximum occupancy: 2\n\nNumber of people: 4 (including children under 10)\nTotal cost: 55 x 4 + 28 x 4 + 66 x 4 + 361 x 2 = 220 + 112 + 264 + 722 = 1318\nAccommodation minimum nights: 2/2\n\nDays: 3\nCurrent City: Reno\nTransportation: -\nBreakfast: Queens Cakes, Reno, cost: 58, cuisines: Bakery, Desserts, Indian, BBQ\nAttraction: Rancho San Rafael Regional Park, Reno; Wilbur D. May Center, Reno\nLunch: Indian Gourmet, Reno, cost: 16, cuisines: Tea, Fast Food, American, Seafood\nDinner: Mustake Multicuisine Restaurant, Reno, cost: 91, cuisines: Tea, Bakery, Pizza, Mediterranean\nAccommodation: -\n\nNumber of people: 4 (including children under 10)\nTotal cost: 58 x 4 + 16 x 4 + 91 x 4 = 232 + 64 + 364 = 660\n\nTotal cost across all days: 5522 + 1318 + 660 = 7500\nCuisines: The prompt specifies no cuisines, so all cuisine constraints are satisfied\n\nNote: The accommodation \"A bright, beautiful treehouse\" was chosen for the first two nights as it is suitable for children under 10, and the cost was calculated for two nights to meet the minimum stay requirement. The total cost of the trip is within the specified budget of $11,300.", "gpt-4-1106-preview_direct_sole-planning_parsed_results": [{"day": 1, "current_city": "from New York to Reno", "transportation": "Flight Number: F3767722, from New York to Reno, Departure Time: 21:02, Arrival Time: 00:07", "breakfast": "-", "attraction": "-", "lunch": "-", "dinner": "-", "accommodation": "A bright, beautiful treehouse, Reno"}, {"day": 2, "current_city": "Reno", "transportation": "-", "breakfast": "Leme Light, Reno", "attraction": "Nevada Museum of Art, Reno;The Discovery, Reno;", "lunch": "Kanha Sweets, Reno", "dinner": "Olive Bistro, Reno", "accommodation": "A bright, beautiful treehouse, Reno"}, {"day": 3, "current_city": "Reno", "transportation": "-", "breakfast": "Queens Cakes, Reno", "attraction": "Rancho San Rafael Regional Park, Reno;Wilbur D. May Center, Reno;", "lunch": "Indian Gourmet, Reno", "dinner": "Mustake Multicuisine Restaurant, Reno", "accommodation": "-"}]}]