[{"gpt-4-1106-preview_direct_sole-planning_results": "Travel Plan:\n\nDays: 1\nCurrent City: from West Palm Beach, Florida to Atlanta, Georgia\nTransportation: Flight F3496900, from West Palm Beach to Atlanta, duration: 1 hour 34 minutes, cost: 132\nBreakfast: -\nAttraction: -\nLunch: -\nDinner: Saffron, Atlanta, cost: 39, cuisines: Tea, Cafe, Fast Food, Seafood\nAccommodation: FABULOUS SUNNY BEDROOM IN HARLEM, Atlanta, cost: 587, maximum occupancy: 2, house rules: No parties, minimum nights: 20\n\nNumber of people: 1\nTotal cost: 132 (flight) + 39 (dinner) + 587 (accommodation) = 758\nAccommodation minimum nights: 1/20\n\nDays: 2\nCurrent City: Atlanta\nTransportation: -\nBreakfast: Adda, Atlanta, cost: 22, cuisines: Tea, Mexican, Bakery\nAttraction: Georgia Aquarium, Atlanta; Centennial Olympic Park, Atlanta\nLunch: Baba Au Rhum, Atlanta, cost: 27, cuisines: Desserts, Pizza, Mexican, BBQ, Fast Food\nDinner: Asian Bistro, Atlanta, cost: 27, cuisines: Tea, Bakery, Seafood\nAccommodation: FABULOUS SUNNY BEDROOM IN HARLEM, Atlanta, cost: 587, maximum occupancy: 2, house rules: No parties, minimum nights: 20\n\nNumber of people: 1\nTotal cost: 22 (breakfast) + 27 (lunch) + 27 (dinner) + 587 (accommodation) = 663\nAccommodation minimum nights: 2/20\n\nDays: 3\nCurrent City: from Atlanta, Georgia to West Palm Beach, Florida\nTransportation: Flight F3497203, from Atlanta to West Palm Beach, duration: 1 hour 54 minutes, cost: 121\nBreakfast: -\nAttraction: -\nLunch: -\nDinner: -\nAccommodation: -\n\nNumber of people: 1\nTotal cost: 121 (flight)\n\nTotal cost across all days: 758 + 663 + 121 = 1,542\n\nCuisines: The prompt specifies no cuisines, so all cuisine constraints are satisfied\n\n**Note**: The total cost exceeds the specified budget of $900. Adjustments are needed to meet the budget constraint. Possible adjustments include selecting a less expensive accommodation or using a different mode of transportation. However, given the provided data, the cheapest accommodation is already selected, and the flight is the most cost-effective transportation method for the given distance. Therefore, it is not possible to create a travel plan within the specified budget using the provided data.", "gpt-4-1106-preview_direct_sole-planning_parsed_results": [{"day": 1, "current_city": "from West Palm Beach, Florida to Atlanta, Georgia", "transportation": "Flight Number: F3496900, from West Palm Beach to Atlanta, Departure Time: -, Arrival Time: -", "breakfast": "-", "attraction": "-", "lunch": "-", "dinner": "Saffron, Atlanta", "accommodation": "FABULOUS SUNNY BEDROOM IN HARLEM, Atlanta"}, {"day": 2, "current_city": "Atlanta", "transportation": "-", "breakfast": "Adda, Atlanta", "attraction": "Georgia Aquarium, Atlanta;Centennial Olympic Park, Atlanta;", "lunch": "Baba Au Rhum, Atlanta", "dinner": "Asian Bistro, Atlanta", "accommodation": "FABULOUS SUNNY BEDROOM IN HARLEM, Atlanta"}, {"day": 3, "current_city": "from Atlanta, Georgia to West Palm Beach, Florida", "transportation": "Flight Number: F3497203, from Atlanta to West Palm Beach, Departure Time: -, Arrival Time: -", "breakfast": "-", "attraction": "-", "lunch": "-", "dinner": "-", "accommodation": "-"}]}]