[{"gpt-4-1106-preview_direct_sole-planning_results": "Travel Plan:\n\nDay 1: March 23, 2022\nCurrent City: Washington to Buffalo\nTransportation: Flight F3791094, from Washington to Buffalo, duration: 1 hour 29 minutes, cost: $61 per person\nBreakfast: -\nAttraction: -\nLunch: -\nDinner: Tibby's New Orleans Kitchen, Buffalo, cost: $48 per person, cuisines: Seafood, Indian, BBQ, Italian\nAccommodation: Cozy Studio in Heart of Ft Greene, Buffalo, cost: $200 per night, room type: Entire home/apt, house rules: No pets & No children under 10\n\nNumber of people: 7\nTotal cost: (Flight $61 + Dinner $48) x 7 + Accommodation $200 = $963\nAccommodation minimum nights: 1/4\n\nDay 2: March 24, 2022\nCurrent City: Buffalo\nTransportation: -\nBreakfast: Shokitini, Buffalo, cost: $41 per person, cuisines: Tea, Cafe, Pizza, Mexican, Chinese, Seafood\nAttraction: The Buffalo Zoo, Buffalo; Buffalo and Erie County Botanical Gardens, Buffalo\nLunch: Punjab Grill, Buffalo, cost: $25 per person, cuisines: Bakery, BBQ, Desserts, Seafood\nDinner: Ammu's South Indian Restaurant, Buffalo, cost: $80 per person, cuisines: Desserts, Pizza, French, BBQ, Chinese\nAccommodation: Cozy Studio in Heart of Ft Greene, Buffalo, cost: $200 per night, room type: Entire home/apt, house rules: No pets & No children under 10\n\nNumber of people: 7\nTotal cost: (Breakfast $41 + Lunch $25 + Dinner $80) x 7 + Accommodation $200 = $1,092\nAccommodation minimum nights: 2/4\n\nDay 3: March 25, 2022\nCurrent City: Buffalo to New York\nTransportation: Flight F3644292, from Buffalo to New York, duration: 1 hour 9 minutes, cost: $77 per person\nBreakfast: -\nAttraction: -\nLunch: -\nDinner: Seasons 52 Fresh Grill, New York, cost: $30 per person, cuisines: Seafood, Indian, Desserts, Italian\nAccommodation: A Contemporary Homelike Stay in the Best of BK, New York, cost: $228 per night, room type: Entire home/apt, house rules: No pets & No visitors & No children under 10\n\nNumber of people: 7\nTotal cost: (Flight $77 + Dinner $30) x 7 + Accommodation $228 = $977\nAccommodation minimum nights: 1/2\n\nDay 4: March 26, 2022\nCurrent City: New York\nTransportation: -\nBreakfast: Gurgaon Hights, New York, cost: $46 per person, cuisines: Cafe, American, Indian, Fast Food\nAttraction: Top of The Rock, New York; Statue of Liberty, New York\nLunch: Lord of the Drinks Forum, New York, cost: $71 per person, cuisines: Cafe, Bakery, BBQ, Chinese, Indian\nDinner: Goosebumps, New York, cost: $94 per person, cuisines: Chinese, Pizza, Bakery\nAccommodation: A Contemporary Homelike Stay in the Best of BK, New York, cost: $228 per night, room type: Entire home/apt, house rules: No pets & No visitors & No children under 10\n\nNumber of people: 7\nTotal cost: (Breakfast $46 + Lunch $71 + Dinner $94) x 7 + Accommodation $228 = $1,645\nAccommodation minimum nights: 2/2\n\nDay 5: March 27, 2022\nCurrent City: New York to Washington\nTransportation: Flight F3661892, from New York to Washington, duration: 1 hour 14 minutes, cost: $64 per person\nBreakfast: -\nAttraction: -\nLunch: -\nDinner: -\nAccommodation: -\n\nNumber of people: 7\nTotal cost: Flight $64 x 7 = $448\n\nTotal cost across all days: $963 + $1,092 + $977 + $1,645 + $448 = $5,125\n\nCuisines: The plan includes a variety of American, Mexican, Chinese, and Italian cuisines as requested.\nRemaining Budget: $9,100 - $5,125 = $3,975\n\nPlease note that the costs for attractions and some meals are not included in the total cost as they were not provided in the reference information. Additional expenses should be considered within the remaining budget.", "gpt-4-1106-preview_direct_sole-planning_parsed_results": [{"day": 1, "current_city": "from Washington to Buffalo", "transportation": "Flight Number: F3791094, from Washington to Buffalo, Departure Time: -, Arrival Time: -", "breakfast": "-", "attraction": "-", "lunch": "-", "dinner": "Tibby's New Orleans Kitchen, Buffalo", "accommodation": "Cozy Studio in Heart of Ft Greene, Buffalo"}, {"day": 2, "current_city": "Buffalo", "transportation": "-", "breakfast": "Shokitini, Buffalo", "attraction": "The Buffalo Zoo, Buffalo;Buffalo and Erie County Botanical Gardens, Buffalo;", "lunch": "Punjab Grill, Buffalo", "dinner": "Ammu's South Indian Restaurant, Buffalo", "accommodation": "Cozy Studio in Heart of Ft Greene, Buffalo"}, {"day": 3, "current_city": "from Buffalo to New York", "transportation": "Flight Number: F3644292, from Buffalo to New York, Departure Time: -, Arrival Time: -", "breakfast": "-", "attraction": "-", "lunch": "-", "dinner": "Seasons 52 Fresh Grill, New York", "accommodation": "A Contemporary Homelike Stay in the Best of BK, New York"}, {"day": 4, "current_city": "New York", "transportation": "-", "breakfast": "Gurgaon Hights, New York", "attraction": "Top of The Rock, New York;Statue of Liberty, New York;", "lunch": "Lord of the Drinks Forum, New York", "dinner": "Goosebumps, New York", "accommodation": "A Contemporary Homelike Stay in the Best of BK, New York"}, {"day": 5, "current_city": "from New York to Washington", "transportation": "Flight Number: F3661892, from New York to Washington, Departure Time: -, Arrival Time: -", "breakfast": "-", "attraction": "-", "lunch": "-", "dinner": "-", "accommodation": "-"}]}]