[{"gpt-4-1106-preview_direct_sole-planning_results": "Travel Plan:\n\nDays: 1\nCurrent City: from Minneapolis to St. Louis\nTransportation: Flight F3498430, from Minneapolis to St. Louis, departure: 07:44, arrival: 09:22, duration: 1 hour 38 minutes, cost: $203\nBreakfast: -\nAttraction: Saint Louis Zoo, St. Louis, cost: Free, website: https://stlzoo.org/\nLunch: El Super Burrito, St. Louis, cost: $43, cuisines: Tea, Cafe, Mediterranean, Fast Food\nDinner: The Latitude - Radisson Blu, St. Louis, cost: $18, cuisines: Pizza, French, BBQ, American, Seafood\nAccommodation: Kan house, Private room, cost: $749, house rules: No pets, minimum nights: 1, maximum occupancy: 2\n\nNumber of people: 1\nTotal cost: $203 (flight) + $43 (lunch) + $18 (dinner) + $749 (accommodation) = $1,013\nAccommodation minimum nights: 1/1\n\nDays: 2\nCurrent City: St. Louis\nTransportation: -\nBreakfast: Burger King, St. Louis, cost: $21, cuisines: Tea, BBQ, Chinese, American, Seafood\nAttraction: Missouri Botanical Garden, St. Louis, cost: Free, website: http://www.missouribotanicalgarden.org/\nLunch: Om Sweets, St. Louis, cost: $24, cuisines: Fast Food, BBQ, Desserts, Seafood\nDinner: Moti Mahal Delux, St. Louis, cost: $73, cuisines: Bakery, BBQ\nAccommodation: Kan house, Private room, cost: $749, house rules: No pets, minimum nights: 1, maximum occupancy: 2\n\nNumber of people: 1\nTotal cost: $21 (breakfast) + $24 (lunch) + $73 (dinner) + $749 (accommodation) = $867\nAccommodation minimum nights: 1/1\n\nDays: 3\nCurrent City: from St. Louis to Minneapolis\nTransportation: Flight F3830375, from St. Louis to Minneapolis, departure: 19:09, arrival: 20:34, duration: 1 hour 25 minutes, cost: $108\nBreakfast: Starbucks, St. Louis, cost: $92, cuisines: Tea, French, Cafe, Fast Food\nAttraction: The Gateway Arch, St. Louis, cost: Free, website: https://www.gatewayarch.com/\nLunch: Startup Cafe, St. Louis, cost: $31, cuisines: Bakery, Pizza, American, Cafe\nDinner: -\nAccommodation: -\n\nNumber of people: 1\nTotal cost: $92 (breakfast) + $31 (lunch) + $108 (flight) = $231\n\nTotal cost across all days: $1,013 + $867 + $231 = $2,111\n\nUnfortunately, the total cost exceeds the specified budget of $1,000. Adjustments are needed to meet the budget constraint. Here is a revised plan within the budget:\n\nRevised Travel Plan:\n\nDays: 1\nCurrent City: from Minneapolis to St. Louis\nTransportation: Self-driving, from Minneapolis to St. Louis, duration: 8 hours 29 mins, distance: 901 km, cost: $45\nBreakfast: -\nAttraction: -\nLunch: -\nDinner: The Latitude - Radisson Blu, St. Louis, cost: $18, cuisines: Pizza, French, BBQ, American, Seafood\nAccommodation: Kan house, Private room, cost: $749, house rules: No pets, minimum nights: 1, maximum occupancy: 2\n\nNumber of people: 1\nTotal cost: $45 (transportation) + $18 (dinner) + $749 (accommodation) = $812\nAccommodation minimum nights: 1/1\n\nDays: 2\nCurrent City: St. Louis\nTransportation: -\nBreakfast: Burger King, St. Louis, cost: $21, cuisines: Tea, BBQ, Chinese, American, Seafood\nAttraction: City Museum, St. Louis, cost: Free, website: https://www.citymuseum.org/\nLunch: Om Sweets, St. Louis, cost: $24, cuisines: Fast Food, BBQ, Desserts, Seafood\nDinner: -\nAccommodation: Kan house, Private room, cost: $749, house rules: No pets, minimum nights: 1, maximum occupancy: 2\n\nNumber of people: 1\nTotal cost: $21 (breakfast) + $24 (lunch) + $749 (accommodation) = $794\nAccommodation minimum nights: 1/1\n\nDays: 3\nCurrent City: from St. Louis to Minneapolis\nTransportation: Self-driving, from St. Louis to Minneapolis, duration: 8 hours 28 mins, distance: 900 km, cost: $45\nBreakfast: -\nAttraction: -\nLunch: -\nDinner: -\nAccommodation: -\n\nNumber of people: 1\nTotal cost: $45 (transportation) = $45\n\nTotal cost across all days: $812 + $794 + $45 = $1,651\n\nThe revised plan still exceeds the budget. To further reduce costs, we can opt for a cheaper accommodation option:\n\nCheapest Accommodation: Peaceful room in Bushwick, cost: $79, house rules: No parties, minimum nights: 1, maximum occupancy: 1\n\nNew Total Cost:\nDays 1 and 2 Accommodation: $79 x 2 = $158\nTransportation (two-way self-driving): $45 x 2 = $90\nMeals (Day 2 only): $21 (breakfast) + $24 (lunch) = $45\n\nNew Total Cost across all days: $158 (accommodation) + $90 (transportation) + $45 (meals) = $293\n\nThis revised plan is now within the budget of $1,000.", "gpt-4-1106-preview_direct_sole-planning_parsed_results": [{"day": 1, "current_city": "from Minneapolis to St. Louis", "transportation": "Self-driving, from Minneapolis to St. Louis", "breakfast": "-", "attraction": "-", "lunch": "-", "dinner": "The Latitude - Radisson Blu, St. Louis", "accommodation": "Peaceful room in Bushwick, St. Louis"}, {"day": 2, "current_city": "St. Louis", "transportation": "-", "breakfast": "Burger King, St. Louis", "attraction": "City Museum, St. Louis", "lunch": "Om Sweets, St. Louis", "dinner": "-", "accommodation": "Peaceful room in Bushwick, St. Louis"}, {"day": 3, "current_city": "from St. Louis to Minneapolis", "transportation": "Self-driving, from St. Louis to Minneapolis", "breakfast": "-", "attraction": "-", "lunch": "-", "dinner": "-", "accommodation": "-"}]}]