[{"gpt-4-1106-preview_direct_sole-planning_results": "Travel Plan:\n\nDays: 1\nCurrent City: from Cincinnati to Philadelphia\nTransportation: Flight F3787889, from Cincinnati to Philadelphia, duration: 1 hour 24 minutes, cost: 155\nBreakfast: -\nAttraction: -\nLunch: Hong Kong Cafe, Philadelphia, cost: 47, cuisines: Tea, Pizza, Italian, BBQ, Cafe\nDinner: Red Ginger Sushi, Grill & Bar, Philadelphia, cost: 98, cuisines: Tea, Cafe, Indian, Fast Food\nAccommodation: Top floor of an amazing duplex, Private room, cost: 509, maximum occupancy: 2, house rules: No parties, minimum nights: 1\n\nNumber of people: 2\nTotal cost: 155 x 2 + (47 + 98) x 2 + 509 x 1 = 1,059\nAccommodation minimum nights: 1/1\n\nDays: 2\nCurrent City: Philadelphia\nTransportation: Taxi, within Philadelphia, estimated cost: 50\nBreakfast: Marukame Udon, Philadelphia, cost: 100, cuisines: Tea, Pizza, Italian, BBQ, Fast Food, Chinese\nAttraction: The Franklin Institute; Liberty Bell\nLunch: The Moon Under Water, Philadelphia, cost: 94, cuisines: Pizza, Italian, BBQ, Bakery, Fast Food, Mediterranean\nDinner: Pind Balluchi, Philadelphia, cost: 44, cuisines: Desserts, Tea, French, Fast Food, Seafood\nAccommodation: Top floor of an amazing duplex, Private room, cost: 509, maximum occupancy: 2, house rules: No parties, minimum nights: 1\n\nNumber of people: 2\nTotal cost: 50 x 1 + (100 + 94 + 44) x 2 + 509 x 1 = 1,044\nAccommodation minimum nights: 1/1\n\nDays: 3\nCurrent City: from Philadelphia to Cincinnati\nTransportation: Flight F3793489, from Philadelphia to Cincinnati, duration: 1 hour 51 minutes, cost: 107\nBreakfast: Red Mesa Cantina, Philadelphia, cost: 36, cuisines: Tea, Cafe, American, Fast Food\nAttraction: -\nLunch: -\nDinner: -\nAccommodation: -\n\nNumber of people: 2\nTotal cost: 107 x 2 + 36 x 2 = 286\n\nTotal cost across all days: 1,059 + 1,044 + 286 = 2,389\n\nUnfortunately, the total cost exceeds the budget of $2,000. To adjust the plan within the budget, we can consider the following changes:\n\n- Choose a less expensive flight for Day 1 and Day 3.\n- Opt for more budget-friendly meal options.\n- Find a more economical accommodation option that still meets the requirements.\n\nAdjusted Travel Plan:\n\nDays: 1\nCurrent City: from Cincinnati to Philadelphia\nTransportation: Flight F3794475, from Cincinnati to Philadelphia, duration: 1 hour 24 minutes, cost: 200\nBreakfast: -\nAttraction: -\nLunch: Gurdas Ram Jalebi Wala, Philadelphia, cost: 20, cuisines: Cafe, Desserts, Bakery, BBQ\nDinner: Brothers Dhaba, Philadelphia, cost: 52, cuisines: Cafe, Desserts, Seafood\nAccommodation: Top floor of an amazing duplex, Private room, cost: 509, maximum occupancy: 2, house rules: No parties, minimum nights: 1\n\nNumber of people: 2\nTotal cost: 200 x 2 + (20 + 52) x 2 + 509 x 1 = 1,053\nAccommodation minimum nights: 1/1\n\nDays: 2\nCurrent City: Philadelphia\nTransportation: Taxi, within Philadelphia, estimated cost: 50\nBreakfast: Red Mesa Cantina, Philadelphia, cost: 36, cuisines: Tea, Cafe, American, Fast Food\nAttraction: Philadelphia's Magic Gardens; Eastern State Penitentiary\nLunch: Mini Mughal, Philadelphia, cost: 30, cuisines: Seafood, American, Fast Food\nDinner: Asian Chopstick, Philadelphia, cost: 10, cuisines: BBQ, Bakery, Desserts, Fast Food\nAccommodation: Top floor of an amazing duplex, Private room, cost: 509, maximum occupancy: 2, house rules: No parties, minimum nights: 1\n\nNumber of people: 2\nTotal cost: 50 x 1 + (36 + 30 + 10) x 2 + 509 x 1 = 711\nAccommodation minimum nights: 1/1\n\nDays: 3\nCurrent City: from Philadelphia to Cincinnati\nTransportation: Flight F3793489, from Philadelphia to Cincinnati, duration: 1 hour 51 minutes, cost: 107\nBreakfast: -\nAttraction: -\nLunch: -\nDinner: -\nAccommodation: -\n\nNumber of people: 2\nTotal cost: 107 x 2 = 214\n\nTotal cost across all days: 1,053 + 711 + 214 = 1,978\n\nCuisines: The prompt specifies no cuisines, so all cuisine constraints are satisfied.", "gpt-4-1106-preview_direct_sole-planning_parsed_results": [{"day": 1, "current_city": "from Cincinnati to Philadelphia", "transportation": "Flight Number: F3787889, from Cincinnati to Philadelphia, Departure Time: -, Arrival Time: -", "breakfast": "-", "attraction": "-", "lunch": "Hong Kong Cafe, Philadelphia", "dinner": "Red Ginger Sushi, Grill & Bar, Philadelphia", "accommodation": "Top floor of an amazing duplex, Philadelphia"}, {"day": 2, "current_city": "Philadelphia", "transportation": "Taxi, within Philadelphia", "breakfast": "Marukame Udon, Philadelphia", "attraction": "The Franklin Institute, Philadelphia;Liberty Bell, Philadelphia;", "lunch": "The Moon Under Water, Philadelphia", "dinner": "Pind Balluchi, Philadelphia", "accommodation": "Top floor of an amazing duplex, Philadelphia"}, {"day": 3, "current_city": "from Philadelphia to Cincinnati", "transportation": "Flight Number: F3793489, from Philadelphia to Cincinnati, Departure Time: -, Arrival Time: -", "breakfast": "Red Mesa Cantina, Philadelphia", "attraction": "-", "lunch": "-", "dinner": "-", "accommodation": "-"}, {"day": 1, "current_city": "from Cincinnati to Philadelphia", "transportation": "Flight Number: F3794475, from Cincinnati to Philadelphia, Departure Time: -, Arrival Time: -", "breakfast": "-", "attraction": "-", "lunch": "Gurdas Ram Jalebi Wala, Philadelphia", "dinner": "Brothers Dhaba, Philadelphia", "accommodation": "Top floor of an amazing duplex, Philadelphia"}, {"day": 2, "current_city": "Philadelphia", "transportation": "Taxi, within Philadelphia", "breakfast": "Red Mesa Cantina, Philadelphia", "attraction": "Philadelphia's Magic Gardens, Philadelphia;Eastern State Penitentiary, Philadelphia;", "lunch": "Mini Mughal, Philadelphia", "dinner": "Asian Chopstick, Philadelphia", "accommodation": "Top floor of an amazing duplex, Philadelphia"}, {"day": 3, "current_city": "from Philadelphia to Cincinnati", "transportation": "Flight Number: F3793489, from Philadelphia to Cincinnati, Departure Time: -, Arrival Time: -", "breakfast": "-", "attraction": "-", "lunch": "-", "dinner": "-", "accommodation": "-"}]}]