[{"gpt-4-1106-preview_direct_sole-planning_results": "Travel Plan:\n\nDays: 1\nCurrent City: from Richmond to Houston\nTransportation: Flight F4041372, from Richmond to Houston, duration: 3 hours 16 minutes, cost: 371\nBreakfast: -\nAttraction: -\nLunch: -\nDinner: Jalapenos, Houston, cost: 57, cuisines: Desserts, Tea, Cafe, Chinese, Seafood\nAccommodation: Sunny and Airy near Manhattan, Houston, cost: 499, room type: Entire home/apt, house rules: No pets, minimum nights: 2, maximum occupancy: 4\n\nNumber of people: 2\nTotal cost: (371 + 57 + 499) x 2 = 1,854\nAccommodation minimum nights: 2/2\n\nDays: 2\nCurrent City: Houston\nTransportation: -\nBreakfast: Super Bakery, Houston, cost: 30, cuisines: Seafood, Fast Food\nAttraction: Space Center Houston; Houston Museum of Natural Science\nLunch: Sheetla Dhaba, Houston, cost: 35, cuisines: Desserts, Pizza, Bakery, American, Mediterranean\nDinner: The BrewMaster - The Mix Fine Dine, Houston, cost: 52, cuisines: French, Indian, Cafe, Seafood\nAccommodation: Sunny and Airy near Manhattan, Houston, cost: 499, room type: Entire home/apt, house rules: No pets, minimum nights: 2, maximum occupancy: 4\n\nNumber of people: 2\nTotal cost: (30 + 35 + 52 + 499) x 2 = 1,232\nAccommodation minimum nights: 2/2\n\nDays: 3\nCurrent City: from Houston to Texarkana\nTransportation: Flight F3930024, from Houston to Texarkana, duration: 1 hour 4 minutes, cost: 63\nBreakfast: Earthen Spices, Houston, cost: 28, cuisines: Tea, Mexican, Bakery, BBQ, Fast Food\nAttraction: Museum of Regional History, Texarkana\nLunch: Columbia Restaurant, Texarkana, cost: 91, cuisines: Desserts, Tea, Pizza, Indian, Seafood\nDinner: Big City Bread Cafe, Texarkana, cost: 61, cuisines: Cafe, Pizza, Bakery, BBQ\nAccommodation: sunny airy bohemian rm, private bath! hip 'shwick, Texarkana, cost: 592, room type: Private room, house rules: No smoking, minimum nights: 2, maximum occupancy: 2\n\nNumber of people: 2\nTotal cost: (63 + 28 + 91 + 61 + 592) x 2 = 1,670\nAccommodation minimum nights: 2/2\n\nDays: 4\nCurrent City: Texarkana\nTransportation: -\nBreakfast: Polka Pastry & Snack Bar, Texarkana, cost: 71, cuisines: Fast Food, BBQ, Italian\nAttraction: Ace of Clubs House; Discovery Place Interactive Museum\nLunch: Granma's Homemade, Texarkana, cost: 57, cuisines: Tea, Mexican, Bakery, Cafe, Seafood\nDinner: Teasta, Texarkana, cost: 94, cuisines: Pizza, Italian, French, Bakery, Cafe, Seafood\nAccommodation: sunny airy bohemian rm, private bath! hip 'shwick, Texarkana, cost: 592, room type: Private room, house rules: No smoking, minimum nights: 2, maximum occupancy: 2\n\nNumber of people: 2\nTotal cost: (71 + 57 + 94 + 592) x 2 = 1,628\nAccommodation minimum nights: 2/2\n\nDays: 5\nCurrent City: from Texarkana to Richmond\nTransportation: Self-driving, from Texarkana to Richmond, duration: 16 hours 8 mins, distance: 1,773 km, cost: 88\nBreakfast: -\nAttraction: -\nLunch: -\nDinner: -\nAccommodation: -\n\nNumber of people: 2\nTotal cost: 88 x 2 = 176\n\nTotal cost across all days: 1,854 + 1,232 + 1,670 + 1,628 + 176 = 6,560\n\nCuisines: The prompt specifies an interest in Chinese and Indian cuisines, which have been included in the meal selections.\n\nPlease note that the total cost exceeds the specified budget of $6,000. Adjustments to the plan, such as choosing more budget-friendly meals or accommodations, may be necessary to meet the budget constraint.", "gpt-4-1106-preview_direct_sole-planning_parsed_results": [{"day": 1, "current_city": "from Richmond to Houston", "transportation": "Flight Number: F4041372, from Richmond to Houston, Departure Time: -, Arrival Time: -", "breakfast": "-", "attraction": "-", "lunch": "-", "dinner": "Jalapenos, Houston", "accommodation": "Sunny and Airy near Manhattan, Houston"}, {"day": 2, "current_city": "Houston", "transportation": "-", "breakfast": "Super Bakery, Houston", "attraction": "Space Center Houston, Houston;Houston Museum of Natural Science, Houston;", "lunch": "Sheetla Dhaba, Houston", "dinner": "The BrewMaster - The Mix Fine Dine, Houston", "accommodation": "Sunny and Airy near Manhattan, Houston"}, {"day": 3, "current_city": "from Houston to Texarkana", "transportation": "Flight Number: F3930024, from Houston to Texarkana, Departure Time: -, Arrival Time: -", "breakfast": "Earthen Spices, Houston", "attraction": "Museum of Regional History, Texarkana", "lunch": "Columbia Restaurant, Texarkana", "dinner": "Big City Bread Cafe, Texarkana", "accommodation": "sunny airy bohemian rm, private bath! hip 'shwick, Texarkana"}, {"day": 4, "current_city": "Texarkana", "transportation": "-", "breakfast": "Polka Pastry & Snack Bar, Texarkana", "attraction": "Ace of Clubs House, Texarkana;Discovery Place Interactive Museum, Texarkana;", "lunch": "Granma's Homemade, Texarkana", "dinner": "Teasta, Texarkana", "accommodation": "sunny airy bohemian rm, private bath! hip 'shwick, Texarkana"}, {"day": 5, "current_city": "from Texarkana to Richmond", "transportation": "Self-driving, from Texarkana to Richmond, Departure Time: -, Arrival Time: -", "breakfast": "-", "attraction": "-", "lunch": "-", "dinner": "-", "accommodation": "-"}]}]