[{"gpt-4-1106-preview_direct_sole-planning_results": "Travel Plan:\n\nDays: 1\nCurrent City: from Santa Ana to Durango\nTransportation: Taxi, from Santa Ana to Durango, duration: 11 hours 55 mins, distance: 1,245 km, cost: $1,245\nBreakfast: -\nAttraction: -\nLunch: -\nDinner: Samurai Japanese Cuisine & Sushi Bar, Durango, cost: $67, cuisines: Bakery, Desserts, Fast Food\nAccommodation: Luxury in Best Location, Durango, cost: $70, room type: Entire home/apt, house rules: No children under 10 & No visitors, minimum nights: 1, maximum occupancy: 2\n\nNumber of people: 2\nTotal cost: $1,245 (taxi) + $67 x 2 (dinner) + $70 (accommodation) = $1,449\nAccommodation minimum nights: 1/1\n\nDays: 2\nCurrent City: Durango\nTransportation: -\nBreakfast: Chickenette, Durango, cost: $31, cuisines: Tea, Pizza, Desserts, Fast Food\nAttraction: Durango & Silverton Narrow Gauge Railroad, Durango\nLunch: Dub's High on the Hog, Durango, cost: $98, cuisines: Tea, Italian, French, Cafe, Seafood\nDinner: The Mashal, Durango, cost: $85, cuisines: Italian, BBQ, Fast Food, Cafe, American, Seafood\nAccommodation: Luxury in Best Location, Durango, cost: $70, room type: Entire home/apt, house rules: No children under 10 & No visitors, minimum nights: 1, maximum occupancy: 2\n\nNumber of people: 2\nTotal cost: ($31 + $98 + $85) x 2 + $70 = $630\nAccommodation minimum nights: 1/1\n\nDays: 3\nCurrent City: from Durango to Alamosa\nTransportation: Taxi, from Durango to Alamosa, duration: 2 hours 52 mins, distance: 240 km, cost: $240\nBreakfast: -\nAttraction: -\nLunch: -\nDinner: Atlanta Highway Seafood Market, Alamosa, cost: $68, cuisines: Fast Food, Desserts, Seafood\nAccommodation: Comfortable studio suite in midtown Manhattan, Alamosa, cost: $67, room type: Entire home/apt, house rules: No parties & No smoking & No visitors, minimum nights: 1, maximum occupancy: 2\n\nNumber of people: 2\nTotal cost: $240 (taxi) + $68 x 2 (dinner) + $67 (accommodation) = $443\nAccommodation minimum nights: 1/1\n\nDays: 4\nCurrent City: Alamosa\nTransportation: -\nBreakfast: Cafe LazyMojo, Alamosa, cost: $26, cuisines: Tea, Pizza, American, Fast Food\nAttraction: Alamosa National Wildlife Refuge and Visitor Center, Alamosa\nLunch: Riverwalk Cafe, Alamosa, cost: $97, cuisines: Tea, Pizza, Fast Food\nDinner: Emperor's Lounge - The Taj Mahal Hotel, Alamosa, cost: $65, cuisines: Tea, Italian, BBQ, Cafe, Seafood\nAccommodation: Comfortable studio suite in midtown Manhattan, Alamosa, cost: $67, room type: Entire home/apt, house rules: No parties & No smoking & No visitors, minimum nights: 1, maximum occupancy: 2\n\nNumber of people: 2\nTotal cost: ($26 + $97 + $65) x 2 + $67 = $442\nAccommodation minimum nights: 1/1\n\nDays: 5\nCurrent City: from Alamosa to Colorado Springs\nTransportation: Taxi, from Alamosa to Colorado Springs, duration: 2 hours 36 mins, distance: 263 km, cost: $263\nBreakfast: -\nAttraction: -\nLunch: -\nDinner: Raglan Road Irish Pub and Restaurant, Colorado Springs, cost: $97, cuisines: Chinese, Bakery, Pizza, Mediterranean\nAccommodation: Large sunny park slope apartment, Colorado Springs, cost: $82, room type: Entire home/apt, house rules: No smoking & No parties & No pets, minimum nights: 1, maximum occupancy: 3\n\nNumber of people: 2\nTotal cost: $263 (taxi) + $97 x 2 (dinner) + $82 (accommodation) = $539\nAccommodation minimum nights: 1/1\n\nDays: 6\nCurrent City: Colorado Springs\nTransportation: -\nBreakfast: South Cafe, Colorado Springs, cost: $36, cuisines: Desserts, French, BBQ, Fast Food, Mediterranean\nAttraction: Garden of the Gods, Colorado Springs\nLunch: Club Tokyo - Best Western Skycity Hotel, Colorado Springs, cost: $64, cuisines: Tea, Bakery, Mediterranean, Fast Food\nDinner: LIT Ultrabar, Colorado Springs, cost: $94, cuisines: Cafe, Italian, Fast Food, Chinese, Seafood\nAccommodation: Large sunny park slope apartment, Colorado Springs, cost: $82, room type: Entire home/apt, house rules: No smoking & No parties & No pets, minimum nights: 1, maximum occupancy: 3\n\nNumber of people: 2\nTotal cost: ($36 + $64 + $94) x 2 + $82 = $552\nAccommodation minimum nights: 1/1\n\nDays: 7\nCurrent City: from Colorado Springs to Santa Ana\nTransportation: Taxi, from Colorado Springs to Santa Ana, duration: 15 hours 52 mins, distance: 1,744 km, cost: $1,744\nBreakfast: -\nAttraction: -\nLunch: -\nDinner: -\nAccommodation: -\n\nNumber of people: 2\nTotal cost: $1,744 (taxi)\n\nTotal cost across all days: $1,449 + $630 + $443 + $442 + $539 + $552 + $1,744 = $5,799\nCuisines: Italian, French, Chinese, and American preferences are satisfied\nAccommodation minimum nights: All accommodations are private rooms with a minimum of 1 night each\n\nPlease note that the costs are estimated based on the provided information and may vary. The attractions listed do not include entry fees, and the transportation chosen is taxi as per the constraint of not self-driving. The total cost is within the specified budget of $7,700.", "gpt-4-1106-preview_direct_sole-planning_parsed_results": [{"day": 1, "current_city": "from Santa Ana to Durango", "transportation": "Taxi, from Santa Ana to Durango, duration: 11 hours 55 mins, distance: 1,245 km", "breakfast": "-", "attraction": "-", "lunch": "-", "dinner": "Samurai Japanese Cuisine & Sushi Bar, Durango", "accommodation": "Luxury in Best Location, Durango"}, {"day": 2, "current_city": "Durango", "transportation": "-", "breakfast": "Chickenette, Durango", "attraction": "Durango & Silverton Narrow Gauge Railroad, Durango", "lunch": "Dub's High on the Hog, Durango", "dinner": "The Mashal, Durango", "accommodation": "Luxury in Best Location, Durango"}, {"day": 3, "current_city": "from Durango to Alamosa", "transportation": "Taxi, from Durango to Alamosa, duration: 2 hours 52 mins, distance: 240 km", "breakfast": "-", "attraction": "-", "lunch": "-", "dinner": "Atlanta Highway Seafood Market, Alamosa", "accommodation": "Comfortable studio suite in midtown Manhattan, Alamosa"}, {"day": 4, "current_city": "Alamosa", "transportation": "-", "breakfast": "Cafe LazyMojo, Alamosa", "attraction": "Alamosa National Wildlife Refuge and Visitor Center, Alamosa", "lunch": "Riverwalk Cafe, Alamosa", "dinner": "Emperor's Lounge - The Taj Mahal Hotel, Alamosa", "accommodation": "Comfortable studio suite in midtown Manhattan, Alamosa"}, {"day": 5, "current_city": "from Alamosa to Colorado Springs", "transportation": "Taxi, from Alamosa to Colorado Springs, duration: 2 hours 36 mins, distance: 263 km", "breakfast": "-", "attraction": "-", "lunch": "-", "dinner": "Raglan Road Irish Pub and Restaurant, Colorado Springs", "accommodation": "Large sunny park slope apartment, Colorado Springs"}, {"day": 6, "current_city": "Colorado Springs", "transportation": "-", "breakfast": "South Cafe, Colorado Springs", "attraction": "Garden of the Gods, Colorado Springs", "lunch": "Club Tokyo - Best Western Skycity Hotel, Colorado Springs", "dinner": "LIT Ultrabar, Colorado Springs", "accommodation": "Large sunny park slope apartment, Colorado Springs"}, {"day": 7, "current_city": "from Colorado Springs to Santa Ana", "transportation": "Taxi, from Colorado Springs to Santa Ana, duration: 15 hours 52 mins, distance: 1,744 km", "breakfast": "-", "attraction": "-", "lunch": "-", "dinner": "-", "accommodation": "-"}]}]