[{"gpt-4-1106-preview_direct_sole-planning_results": "Travel Plan:\n\nDays: 1\nCurrent City: from Chicago to Albuquerque\nTransportation: Flight F3809786, from Chicago to Albuquerque, duration: 3 hours 28 minutes, cost: 265\nBreakfast: -\nAttraction: -\nLunch: -\nDinner: Cantina Famiglia Mancini, Albuquerque, cost: 40, cuisines: Tea, Cafe, Desserts\nAccommodation: Private room, Harlem apartment, Albuquerque, cost: 133, maximum occupancy: 1, house rules: No pets, minimum nights: 1\n\nNumber of people: 3\nTotal cost: 265 x 3 + 40 x 3 + 133 x 3 = 1,308\nAccommodation minimum nights: 1/1\n\nDays: 2\nCurrent City: Albuquerque\nTransportation: -\nBreakfast: Thatcher's Barbeque and Grill, Albuquerque, cost: 30, cuisines: Seafood, BBQ, Desserts, Fast Food\nAttraction: Petroglyph National Monument, Albuquerque; Sandia Peak Tramway, Albuquerque\nLunch: Genghis Grill, Albuquerque, cost: 24, cuisines: BBQ, Desserts, Italian\nDinner: Punjab Grill, Albuquerque, cost: 26, cuisines: Desserts, Cafe, Italian, Bakery, Chinese, Seafood\nAccommodation: Private room, Harlem apartment, Albuquerque, cost: 133, maximum occupancy: 1, house rules: No pets, minimum nights: 1\n\nNumber of people: 3\nTotal cost: (30 + 24 + 26) x 3 + 133 x 3 = 738\nAccommodation minimum nights: 1/1\n\nDays: 3\nCurrent City: from Albuquerque to Chicago\nTransportation: Flight F3825798, from Albuquerque to Chicago, duration: 2 hours 51 minutes, cost: 281\nBreakfast: Gung The Palace, Albuquerque, cost: 30, cuisines: Tea, Pizza, French, Bakery, Indian\nAttraction: -\nLunch: -\nDinner: -\nAccommodation: -\n\nNumber of people: 3\nTotal cost: 281 x 3 + 30 x 3 = 933\n\nTotal cost across all days: 1,308 + 738 + 933 = 2,979\n\nUnfortunately, the total cost exceeds the specified budget of $1,600. To adjust the plan to fit the budget, we need to change the transportation method from flights to self-driving, which is significantly cheaper.\n\nRevised Travel Plan:\n\nDays: 1\nCurrent City: from Chicago to Albuquerque\nTransportation: Self-driving, from Chicago to Albuquerque, duration: 19 hours 20 mins, distance: 2,153 km, cost: 107\nBreakfast: -\nAttraction: -\nLunch: -\nDinner: Cantina Famiglia Mancini, Albuquerque, cost: 40, cuisines: Tea, Cafe, Desserts\nAccommodation: Private room, Harlem apartment, Albuquerque, cost: 133, maximum occupancy: 1, house rules: No pets, minimum nights: 1\n\nNumber of people: 3\nTotal cost: 107 x 1 + 40 x 3 + 133 x 3 = 586\nAccommodation minimum nights: 1/1\n\nDays: 2\nCurrent City: Albuquerque\nTransportation: -\nBreakfast: Thatcher's Barbeque and Grill, Albuquerque, cost: 30, cuisines: Seafood, BBQ, Desserts, Fast Food\nAttraction: Petroglyph National Monument, Albuquerque; Sandia Peak Tramway, Albuquerque\nLunch: Genghis Grill, Albuquerque, cost: 24, cuisines: BBQ, Desserts, Italian\nDinner: Punjab Grill, Albuquerque, cost: 26, cuisines: Desserts, Cafe, Italian, Bakery, Chinese, Seafood\nAccommodation: Private room, Harlem apartment, Albuquerque, cost: 133, maximum occupancy: 1, house rules: No pets, minimum nights: 1\n\nNumber of people: 3\nTotal cost: (30 + 24 + 26) x 3 + 133 x 3 = 738\nAccommodation minimum nights: 1/1\n\nDays: 3\nCurrent City: from Albuquerque to Chicago\nTransportation: Self-driving, from Albuquerque to Chicago, duration: 19 hours 20 mins, distance: 2,151 km, cost: 107\nBreakfast: Gung The Palace, Albuquerque, cost: 30, cuisines: Tea, Pizza, French, Bakery, Indian\nAttraction: -\nLunch: -\nDinner: -\nAccommodation: -\n\nNumber of people: 3\nTotal cost: 107 x 1 + 30 x 3 = 197\n\nTotal cost across all days: 586 + 738 + 197 = 1,521\n\nThe revised travel plan now fits within the budget of $1,600.", "gpt-4-1106-preview_direct_sole-planning_parsed_results": [{"day": 1, "current_city": "from Chicago to Albuquerque", "transportation": "Self-driving, from Chicago to Albuquerque, duration: 19 hours 20 mins, distance: 2,153 km", "breakfast": "-", "attraction": "-", "lunch": "-", "dinner": "Cantina Famiglia Mancini, Albuquerque", "accommodation": "Private room, Harlem apartment, Albuquerque"}, {"day": 2, "current_city": "Albuquerque", "transportation": "-", "breakfast": "Thatcher's Barbeque and Grill, Albuquerque", "attraction": "Petroglyph National Monument, Albuquerque;Sandia Peak Tramway, Albuquerque", "lunch": "Genghis Grill, Albuquerque", "dinner": "Punjab Grill, Albuquerque", "accommodation": "Private room, Harlem apartment, Albuquerque"}, {"day": 3, "current_city": "from Albuquerque to Chicago", "transportation": "Self-driving, from Albuquerque to Chicago, duration: 19 hours 20 mins, distance: 2,151 km", "breakfast": "Gung The Palace, Albuquerque", "attraction": "-", "lunch": "-", "dinner": "-", "accommodation": "-"}]}]