[{"gpt-4-1106-preview_direct_sole-planning_results": "Travel Plan:\n\nDays: 1\nCurrent City: from Myrtle Beach to Nashville\nTransportation: Self-driving, from Myrtle Beach to Nashville, duration: 9 hours 11 mins, distance: 949 km, cost: 47\nBreakfast: -\nAttraction: -\nLunch: -\nDinner: Bangkok 1, Nashville, cost: 44, cuisines: Cafe, Seafood\nAccommodation: Clean and large bedroom in a private house, Nashville, cost: 474, room type: Private room, house rules: No smoking, minimum nights: 1, maximum occupancy: 1\n\nNumber of people: 4\nTotal cost: 47 x 1 + (44 x 4) + (474 x 4) = 47 + 176 + 1896 = 2119\nAccommodation minimum nights: 1/1\n\nDays: 2\nCurrent City: Nashville\nTransportation: -\nBreakfast: Govinda's Confectionery, Nashville, cost: 15, cuisines: Tea, Bakery, Mediterranean, Fast Food\nAttraction: Country Music Hall of Fame and Museum, Nashville; Nashville Zoo at Grassmere, Nashville\nLunch: Veg Hut, Nashville, cost: 35, cuisines: Tea, Mexican, Seafood\nDinner: Smoke House Deli, Nashville, cost: 59, cuisines: Cafe, Mediterranean, Seafood\nAccommodation: Clean and large bedroom in a private house, Nashville, cost: 474, room type: Private room, house rules: No smoking, minimum nights: 1, maximum occupancy: 1\n\nNumber of people: 4\nTotal cost: (15 + 35 + 59) x 4 + (474 x 4) = 436 + 1896 = 2332\nAccommodation minimum nights: 1/1\n\nDays: 3\nCurrent City: Nashville to Memphis\nTransportation: Self-driving, from Nashville to Memphis, duration: 3 hours 10 mins, distance: 341 km, cost: 17\nBreakfast: Dialogue Lounge & Caf\u6106, Nashville, cost: 83, cuisines: Tea, Indian, BBQ, Cafe, American, Seafood\nAttraction: -\nLunch: -\nDinner: Sultans of Spice, Memphis, cost: 76, cuisines: Cafe, Bakery, Desserts\nAccommodation: Beautiful, bright and friendly, Memphis, cost: 985, room type: Private room, house rules: No pets, minimum nights: 1, maximum occupancy: 2\n\nNumber of people: 4\nTotal cost: 17 x 1 + (83 x 4) + (76 x 4) + (985 x 2) = 17 + 332 + 304 + 1970 = 2623\nAccommodation minimum nights: 1/1\n\nDays: 4\nCurrent City: Memphis\nTransportation: -\nBreakfast: The Gathering Hut, Memphis, cost: 76, cuisines: Desserts, American, Bakery, BBQ, Fast Food, Indian\nAttraction: National Civil Rights Museum, Memphis; Graceland, Memphis\nLunch: Pizza \u791e Bessa, Memphis, cost: 96, cuisines: Bakery, Mexican, BBQ, Desserts\nDinner: My Spice Kitchen, Memphis, cost: 82, cuisines: Desserts, French, Bakery, Fast Food, Mediterranean, Seafood\nAccommodation: Beautiful, bright and friendly, Memphis, cost: 985, room type: Private room, house rules: No pets, minimum nights: 1, maximum occupancy: 2\n\nNumber of people: 4\nTotal cost: (76 + 96 + 82) x 4 + (985 x 2) = 1016 + 1970 = 2986\nAccommodation minimum nights: 1/1\n\nDays: 5\nCurrent City: from Memphis to Myrtle Beach\nTransportation: Self-driving, from Memphis to Myrtle Beach, duration: 11 hours 12 mins, distance: 1,199 km, cost: 59\nBreakfast: Freakin Beans, Memphis, cost: 67, cuisines: Cafe, Bakery, American, Mediterranean\nAttraction: -\nLunch: -\nDinner: -\nAccommodation: -\n\nNumber of people: 4\nTotal cost: 59 x 1 + (67 x 4) = 59 + 268 = 327\n\nTotal cost across all days: 2119 + 2332 + 2623 + 2986 + 327 = 10387\n\nCuisines: The prompt specifies no cuisines, so all cuisine constraints are satisfied\n\nNote: The total cost exceeds the budget of $5,500. Adjustments are needed to meet the budget constraint. This could involve choosing less expensive restaurants, finding more affordable accommodations, or reducing the number of attractions visited.", "gpt-4-1106-preview_direct_sole-planning_parsed_results": [{"day": 1, "current_city": "from Myrtle Beach to Nashville", "transportation": "Self-driving, from Myrtle Beach to Nashville, duration: 9 hours 11 mins, distance: 949 km", "breakfast": "-", "attraction": "-", "lunch": "-", "dinner": "Bangkok 1, Nashville", "accommodation": "Clean and large bedroom in a private house, Nashville"}, {"day": 2, "current_city": "Nashville", "transportation": "-", "breakfast": "Govinda's Confectionery, Nashville", "attraction": "Country Music Hall of Fame and Museum, Nashville;Nashville Zoo at Grassmere, Nashville;", "lunch": "Veg Hut, Nashville", "dinner": "Smoke House Deli, Nashville", "accommodation": "Clean and large bedroom in a private house, Nashville"}, {"day": 3, "current_city": "from Nashville to Memphis", "transportation": "Self-driving, from Nashville to Memphis, duration: 3 hours 10 mins, distance: 341 km", "breakfast": "Dialogue Lounge & Caf\u6106, Nashville", "attraction": "-", "lunch": "-", "dinner": "Sultans of Spice, Memphis", "accommodation": "Beautiful, bright and friendly, Memphis"}, {"day": 4, "current_city": "Memphis", "transportation": "-", "breakfast": "The Gathering Hut, Memphis", "attraction": "National Civil Rights Museum, Memphis;Graceland, Memphis;", "lunch": "Pizza \u791e Bessa, Memphis", "dinner": "My Spice Kitchen, Memphis", "accommodation": "Beautiful, bright and friendly, Memphis"}, {"day": 5, "current_city": "from Memphis to Myrtle Beach", "transportation": "Self-driving, from Memphis to Myrtle Beach, duration: 11 hours 12 mins, distance: 1,199 km", "breakfast": "Freakin Beans, Memphis", "attraction": "-", "lunch": "-", "dinner": "-", "accommodation": "-"}]}]