[{"gpt-4-1106-preview_direct_sole-planning_results": "Travel Plan:\n\nDays: 1\nCurrent City: from Augusta to Abilene\nTransportation: Self-driving, from Augusta to Abilene, duration: 15 hours 59 mins, distance: 1,782 km, cost: 89\nBreakfast: -\nAttraction: -\nLunch: -\nDinner: Thai Garden, Abilene, cost: 13, cuisines: Cafe, American, Desserts\nAccommodation: Joyce and Donovan's, Room for One, Abilene, cost: 83, room type: Private room, house rules: No parties, minimum nights: 1, maximum occupancy: 2\n\nNumber of people: 1\nTotal cost: 89 + 13 + 83 = 185\nAccommodation minimum nights: 1/1\n\nDays: 2\nCurrent City: Abilene\nTransportation: -\nBreakfast: Crispy Crust, Abilene, cost: 54, cuisines: Desserts, Bakery, Cafe, American, Seafood\nAttraction: The Grace Museum, Abilene; Frontier Texas!, Abilene\nLunch: Finger Licious, cost: 35, cuisines: Fast Food, Cafe, BBQ, Seafood\nDinner: Mx Corn, cost: 62, cuisines: Tea, Cafe, Italian\nAccommodation: Joyce and Donovan's, Room for One, Abilene, cost: 83, room type: Private room, house rules: No parties, minimum nights: 1, maximum occupancy: 2\n\nNumber of people: 1\nTotal cost: 54 + 35 + 62 + 83 = 234\nAccommodation minimum nights: 1/1\n\nDays: 3\nCurrent City: from Abilene to Amarillo\nTransportation: Self-driving, from Abilene to Amarillo, duration: 4 hours 10 mins, distance: 446 km, cost: 22\nBreakfast: LPK Waterfront, Abilene, cost: 61, cuisines: Pizza, Italian, BBQ, Fast Food, Seafood\nAttraction: -\nLunch: -\nDinner: The Cinnamon Kitchen, Amarillo, cost: 69, cuisines: Desserts, Tea, Pizza, Chinese, Seafood\nAccommodation: Harlem Humble Abode - 1 bedroom - Cute and Quaint, Amarillo, cost: 409, room type: Entire home/apt, house rules: No pets, minimum nights: 1, maximum occupancy: 3\n\nNumber of people: 1\nTotal cost: 22 + 61 + 69 + 409 = 561\nAccommodation minimum nights: 1/1\n\nDays: 4\nCurrent City: Amarillo\nTransportation: -\nBreakfast: Komachi, Amarillo, cost: 71, cuisines: Desserts, Tea, Fast Food, Chinese, Mediterranean\nAttraction: Cadillac Ranch, Amarillo; Amarillo Botanical Gardens, Amarillo\nLunch: Sigree Global Grill, cost: 35, cuisines: Chinese, BBQ, Cafe, Desserts\nDinner: Anand Restaurant, cost: 53, cuisines: Fast Food, Seafood, Desserts, Italian\nAccommodation: Harlem Humble Abode - 1 bedroom - Cute and Quaint, Amarillo, cost: 409, room type: Entire home/apt, house rules: No pets, minimum nights: 1, maximum occupancy: 3\n\nNumber of people: 1\nTotal cost: 71 + 35 + 53 + 409 = 568\nAccommodation minimum nights: 1/1\n\nDays: 5\nCurrent City: from Amarillo to Lubbock\nTransportation: Self-driving, from Amarillo to Lubbock, duration: 1 hour 47 mins, distance: 197 km, cost: 9\nBreakfast: Wood Box Cafe, Amarillo, cost: 11, cuisines: Desserts, French, Fast Food, Cafe, American\nAttraction: -\nLunch: -\nDinner: Paris 6 Classique, Lubbock, cost: 91, cuisines: Desserts, Cafe, Pizza, Mexican, BBQ, Chinese\nAccommodation: Private bedroom in UWS Apartment, Lubbock, cost: 709, room type: Private room, house rules: No visitors & No pets, minimum nights: 1, maximum occupancy: 2\n\nNumber of people: 1\nTotal cost: 9 + 11 + 91 + 709 = 820\nAccommodation minimum nights: 1/1\n\nDays: 6\nCurrent City: Lubbock\nTransportation: -\nBreakfast: 3 Squares Diner, Lubbock, cost: 73, cuisines: Pizza, Indian, Fast Food\nAttraction: Buddy Holly Center, Lubbock; National Ranching Heritage Center, Lubbock\nLunch: Grand Barbeque Buffet Restaurant, cost: 20, cuisines: Tea, French, Fast Food, Cafe, Seafood\nDinner: Mosaic - Country Inn & Suites By Carlson, cost: 29, cuisines: Chinese, Indian, Desserts, Seafood\nAccommodation: Private bedroom in UWS Apartment, Lubbock, cost: 709, room type: Private room, house rules: No visitors & No pets, minimum nights: 1, maximum occupancy: 2\n\nNumber of people: 1\nTotal cost: 73 + 20 + 29 + 709 = 831\nAccommodation minimum nights: 1/1\n\nDays: 7\nCurrent City: from Lubbock to Augusta\nTransportation: Self-driving, from Lubbock to Augusta, duration: 18 hours 17 mins, distance: 2,047 km, cost: 102\nBreakfast: Assam Tea Corner, Lubbock, cost: 52, cuisines: Desserts, BBQ, Fast Food, American, Seafood\nAttraction: -\nLunch: -\nDinner: -\nAccommodation: -\n\nNumber of people: 1\nTotal cost: 102 + 52 = 154\n\nTotal cost across all days: 185 + 234 + 561 + 568 + 820 + 831 + 154 = 3,353\n\nRemaining budget: $4,100 - $3,353 = $747\n\nCuisines: All cuisine constraints are satisfied as no specific cuisines were requested.\nAccommodation: All accommodations are private as requested, adhering to house rules and minimum nights.\n\nPlease note that the costs for attractions have not been included as they were not provided in the reference information. If there are entrance fees or other costs associated with the attractions, they will need to be factored into the remaining budget.", "gpt-4-1106-preview_direct_sole-planning_parsed_results": [{"day": 1, "current_city": "from Augusta to Abilene", "transportation": "Self-driving, from Augusta to Abilene, duration: 15 hours 59 mins, distance: 1,782 km", "breakfast": "-", "attraction": "-", "lunch": "-", "dinner": "Thai Garden, Abilene", "accommodation": "Joyce and Donovan's, Room for One, Abilene"}, {"day": 2, "current_city": "Abilene", "transportation": "-", "breakfast": "Crispy Crust, Abilene", "attraction": "The Grace Museum, Abilene; Frontier Texas!, Abilene;", "lunch": "Finger Licious, Abilene", "dinner": "Mx Corn, Abilene", "accommodation": "Joyce and Donovan's, Room for One, Abilene"}, {"day": 3, "current_city": "from Abilene to Amarillo", "transportation": "Self-driving, from Abilene to Amarillo, duration: 4 hours 10 mins, distance: 446 km", "breakfast": "LPK Waterfront, Abilene", "attraction": "-", "lunch": "-", "dinner": "The Cinnamon Kitchen, Amarillo", "accommodation": "Harlem Humble Abode - 1 bedroom - Cute and Quaint, Amarillo"}, {"day": 4, "current_city": "Amarillo", "transportation": "-", "breakfast": "Komachi, Amarillo", "attraction": "Cadillac Ranch, Amarillo; Amarillo Botanical Gardens, Amarillo;", "lunch": "Sigree Global Grill, Amarillo", "dinner": "Anand Restaurant, Amarillo", "accommodation": "Harlem Humble Abode - 1 bedroom - Cute and Quaint, Amarillo"}, {"day": 5, "current_city": "from Amarillo to Lubbock", "transportation": "Self-driving, from Amarillo to Lubbock, duration: 1 hour 47 mins, distance: 197 km", "breakfast": "Wood Box Cafe, Amarillo", "attraction": "-", "lunch": "-", "dinner": "Paris 6 Classique, Lubbock", "accommodation": "Private bedroom in UWS Apartment, Lubbock"}, {"day": 6, "current_city": "Lubbock", "transportation": "-", "breakfast": "3 Squares Diner, Lubbock", "attraction": "Buddy Holly Center, Lubbock; National Ranching Heritage Center, Lubbock;", "lunch": "Grand Barbeque Buffet Restaurant, Lubbock", "dinner": "Mosaic - Country Inn & Suites By Carlson, Lubbock", "accommodation": "Private bedroom in UWS Apartment, Lubbock"}, {"day": 7, "current_city": "from Lubbock to Augusta", "transportation": "Self-driving, from Lubbock to Augusta, duration: 18 hours 17 mins, distance: 2,047 km", "breakfast": "Assam Tea Corner, Lubbock", "attraction": "-", "lunch": "-", "dinner": "-", "accommodation": "-"}]}]