[{"gpt-4-1106-preview_direct_sole-planning_results": "Travel Plan:\n\nDays: 1\nCurrent City: from Baton Rouge to Abilene\nTransportation: Self-driving, from Baton Rouge to Abilene, duration: 8 hours 50 mins, distance: 976 km, cost: 48\nBreakfast: -\nAttraction: -\nLunch: -\nDinner: Thai Garden, Abilene, cost: 26, cuisines: Cafe, American, Desserts\nAccommodation: Joyce and Donovan's, Room for One, Abilene, cost: 83, room type: Private room, house rules: No parties, minimum nights: 25, maximum occupancy: 2\n\nNumber of people: 2\nTotal cost: 48 x 1 + 26 x 2 + 83 x 1 = 183\nAccommodation minimum nights: 25/1\n\nDays: 2\nCurrent City: Abilene\nTransportation: -\nBreakfast: Crispy Crust, Abilene, cost: 54, cuisines: Desserts, Bakery, Cafe, American, Seafood\nAttraction: The Grace Museum, Abilene; Frontier Texas!, Abilene\nLunch: Finger Licious, cost: 35, cuisines: Fast Food, Cafe, BBQ, Seafood\nDinner: LPK Waterfront, cost: 61, cuisines: Pizza, Italian, BBQ, Fast Food, Seafood\nAccommodation: Joyce and Donovan's, Room for One, Abilene, cost: 83, room type: Private room, house rules: No parties, minimum nights: 25, maximum occupancy: 2\n\nNumber of people: 2\nTotal cost: (54 + 35 + 61) x 2 + 83 x 1 = 383\nAccommodation minimum nights: 25/1\n\nDays: 3\nCurrent City: from Abilene to Amarillo\nTransportation: Self-driving, from Abilene to Amarillo, duration: 4 hours 10 mins, distance: 446 km, cost: 22\nBreakfast: -\nAttraction: -\nLunch: -\nDinner: The Cinnamon Kitchen, Amarillo, cost: 69, cuisines: Desserts, Tea, Pizza, Chinese, Seafood\nAccommodation: Harlem Humble Abode - 1 bedroom - Cute and Quaint, Amarillo, cost: 409, room type: Entire home/apt, house rules: No pets, minimum nights: 5, maximum occupancy: 3\n\nNumber of people: 2\nTotal cost: 22 x 1 + 69 x 2 + 409 x 1 = 569\nAccommodation minimum nights: 5/1\n\nDays: 4\nCurrent City: Amarillo\nTransportation: -\nBreakfast: Wood Box Cafe, Amarillo, cost: 11, cuisines: Desserts, French, Fast Food, Cafe, American\nAttraction: Cadillac Ranch, Amarillo; Amarillo Botanical Gardens, Amarillo\nLunch: Sigree Global Grill, cost: 35, cuisines: Chinese, BBQ, Cafe, Desserts\nDinner: Anand Restaurant, cost: 53, cuisines: Fast Food, Seafood, Desserts, Italian\nAccommodation: Harlem Humble Abode - 1 bedroom - Cute and Quaint, Amarillo, cost: 409, room type: Entire home/apt, house rules: No pets, minimum nights: 5, maximum occupancy: 3\n\nNumber of people: 2\nTotal cost: (11 + 35 + 53) x 2 + 409 x 1 = 609\nAccommodation minimum nights: 5/1\n\nDays: 5\nCurrent City: from Amarillo to Baton Rouge\nTransportation: Self-driving, from Amarillo to Baton Rouge, duration: 11 hours 42 mins, distance: 1,270 km, cost: 63\nBreakfast: -\nAttraction: -\nLunch: -\nDinner: -\nAccommodation: -\n\nNumber of people: 2\nTotal cost: 63 x 1 = 63\n\nTotal cost across all days: 183 + 383 + 569 + 609 + 63 = 1807\nCuisines: The prompt specifies no cuisines, so all cuisine constraints are satisfied\n\nNote: The accommodations chosen do not allow pets, which is a requirement in the query. However, the provided data does not include pet-friendly accommodations, so this plan assumes an exception can be made or that alternative pet-friendly accommodations will be found within the budget.", "gpt-4-1106-preview_direct_sole-planning_parsed_results": [{"day": 1, "current_city": "from Baton Rouge to Abilene", "transportation": "Self-driving, from Baton Rouge to Abilene, duration: 8 hours 50 mins, distance: 976 km", "breakfast": "-", "attraction": "-", "lunch": "-", "dinner": "Thai Garden, Abilene", "accommodation": "Joyce and Donovan's, Room for One, Abilene"}, {"day": 2, "current_city": "Abilene", "transportation": "-", "breakfast": "Crispy Crust, Abilene", "attraction": "The Grace Museum, Abilene;Frontier Texas!, Abilene;", "lunch": "Finger Licious, Abilene", "dinner": "LPK Waterfront, Abilene", "accommodation": "Joyce and Donovan's, Room for One, Abilene"}, {"day": 3, "current_city": "from Abilene to Amarillo", "transportation": "Self-driving, from Abilene to Amarillo, duration: 4 hours 10 mins, distance: 446 km", "breakfast": "-", "attraction": "-", "lunch": "-", "dinner": "The Cinnamon Kitchen, Amarillo", "accommodation": "Harlem Humble Abode - 1 bedroom - Cute and Quaint, Amarillo"}, {"day": 4, "current_city": "Amarillo", "transportation": "-", "breakfast": "Wood Box Cafe, Amarillo", "attraction": "Cadillac Ranch, Amarillo;Amarillo Botanical Gardens, Amarillo;", "lunch": "Sigree Global Grill, Amarillo", "dinner": "Anand Restaurant, Amarillo", "accommodation": "Harlem Humble Abode - 1 bedroom - Cute and Quaint, Amarillo"}, {"day": 5, "current_city": "from Amarillo to Baton Rouge", "transportation": "Self-driving, from Amarillo to Baton Rouge, duration: 11 hours 42 mins, distance: 1,270 km", "breakfast": "-", "attraction": "-", "lunch": "-", "dinner": "-", "accommodation": "-"}]}]