[{"gpt-4-1106-preview_direct_sole-planning_results": "Travel Plan:\n\nDays: 1\nCurrent City: from Washington to Bemidji\nTransportation: Self-driving, from Washington to Bemidji, duration: 20 hours 8 mins, distance: 2,120 km, cost: 106\nBreakfast: -\nAttraction: -\nLunch: -\nDinner: Pig and Whistle, Bemidji, cost: 39, cuisines: Fast Food, Mexican, Bakery, Seafood\nAccommodation: Sunny bedroom off Prospect Park, Bemidji, cost: 627, room type: Private room, house rules: No visitors, minimum nights: 3, maximum occupancy: 1\n\nNumber of people: 1\nTotal cost: 106 + 39 + 627 = 772\nAccommodation minimum nights: 3/3\n\nDays: 2\nCurrent City: Bemidji\nTransportation: -\nBreakfast: Flying Cakes, Bemidji, cost: 43, cuisines: Tea, Seafood\nAttraction: Paul Bunyan & Babe the Blue Ox Statues, Bemidji; Headwaters Science Center, Bemidji\nLunch: Outback Bar and Grill - Leisure Inn, Bemidji, cost: 59, cuisines: Indian, Desserts, Fast Food\nDinner: Gastronomica Kitchen & Bar, Bemidji, cost: 84, cuisines: Chinese, BBQ, Cafe, Desserts\nAccommodation: Sunny bedroom off Prospect Park, Bemidji, cost: 627, room type: Private room, house rules: No visitors, minimum nights: 3, maximum occupancy: 1\n\nNumber of people: 1\nTotal cost: (43 + 59 + 84) + 627 = 813\nAccommodation minimum nights: 3/3\n\nDays: 3\nCurrent City: Bemidji\nTransportation: -\nBreakfast: Chao Chinese Bistro - Holiday Inn Jaipur City Centre, Bemidji, cost: 22, cuisines: Fast Food, Seafood\nAttraction: Diamond Point Park, Bemidji; Beltrami County History Center, Bemidji\nLunch: Barbeque Nation, Bemidji, cost: 45, cuisines: Tea, Desserts\nDinner: The Walled City - Caf\u6106 & Lounge, Bemidji, cost: 69, cuisines: Desserts, Pizza, BBQ, Fast Food, Mediterranean\nAccommodation: Sunny bedroom off Prospect Park, Bemidji, cost: 627, room type: Private room, house rules: No visitors, minimum nights: 3, maximum occupancy: 1\n\nNumber of people: 1\nTotal cost: (22 + 45 + 69) + 627 = 763\nAccommodation minimum nights: 3/3\n\nDays: 4\nCurrent City: from Bemidji to Minneapolis\nTransportation: Flight F3847877, from Bemidji to Minneapolis, cost: 63, departure: 08:06, arrival: 10:37, duration: 2 hours 31 minutes\nBreakfast: -\nAttraction: Minneapolis Sculpture Garden, Minneapolis; Minneapolis Institute of Art, Minneapolis\nLunch: The Cafe, Minneapolis, cost: 14, cuisines: Indian, Mediterranean, Desserts, Seafood\nDinner: Court Avenue Brewing Company, Minneapolis, cost: 31, cuisines: Pizza, French, Bakery, BBQ, Seafood\nAccommodation: Light-filled Apartment in great area, close 2 all!, Minneapolis, cost: 343, room type: Entire home/apt, house rules: No visitors, minimum nights: 1, maximum occupancy: 2\n\nNumber of people: 1\nTotal cost: 63 + (14 + 31) + 343 = 451\nAccommodation minimum nights: 1/1\n\nDays: 5\nCurrent City: Minneapolis\nTransportation: -\nBreakfast: Malo, Minneapolis, cost: 80, cuisines: Tea, Chinese, Indian, Cafe\nAttraction: Mill City Museum, Minneapolis; Mill Ruins Park, Minneapolis\nLunch: Texas Roadhouse, Minneapolis, cost: 22, cuisines: Cafe, Pizza, BBQ, Desserts\nDinner: Monkeypod Kitchen by Merriman, Minneapolis, cost: 50, cuisines: Desserts, Pizza, Bakery, Fast Food, Indian, Mediterranean\nAccommodation: Light-filled Apartment in great area, close 2 all!, Minneapolis, cost: 343, room type: Entire home/apt, house rules: No visitors, minimum nights: 1, maximum occupancy: 2\n\nNumber of people: 1\nTotal cost: (80 + 22 + 50) + 343 = 495\nAccommodation minimum nights: 1/1\n\nDays: 6\nCurrent City: from Minneapolis to Duluth\nTransportation: Self-driving, from Minneapolis to Duluth, duration: 2 hours 16 mins, distance: 248 km, cost: 12\nBreakfast: -\nAttraction: Glensheen Mansion, Duluth; Leif Erikson Park, Duluth\nLunch: Sodam Korean Restaurant, Duluth, cost: 25, cuisines: Desserts, Tea, French, Fast Food, Cafe\nDinner: Skye - Hotel Unique, Duluth, cost: 31, cuisines: French, Mexican, Bakery, BBQ\nAccommodation: Beautiful 1 bedroom in city center, Duluth, cost: 1154, room type: Entire home/apt, house rules: No parties & No smoking & No children under 10, minimum nights: 2, maximum occupancy: 3\n\nNumber of people: 1\nTotal cost: 12 + (25 + 31) + 1154 = 1222\nAccommodation minimum nights: 2/2\n\nDays: 7\nCurrent City: from Duluth to Washington\nTransportation: Self-driving, from Duluth to Washington, duration: 17 hours 50 mins, distance: 1,881 km, cost: 94\nBreakfast: -\nAttraction: -\nLunch: -\nDinner: -\nAccommodation: -\n\nNumber of people: 1\nTotal cost: 94\n\nTotal cost across all days: 772 + 813 + 763 + 451 + 495 + 1222 + 94 = 4610\nRemaining budget: 7200 - 4610 = 2590\n\nCuisines: The prompt specifies no cuisines, so all cuisine constraints are satisfied", "gpt-4-1106-preview_direct_sole-planning_parsed_results": [{"day": 1, "current_city": "from Washington to Bemidji", "transportation": "Self-driving, from Washington to Bemidji, duration: 20 hours 8 mins, distance: 2,120 km", "breakfast": "-", "attraction": "-", "lunch": "-", "dinner": "Pig and Whistle, Bemidji", "accommodation": "Sunny bedroom off Prospect Park, Bemidji"}, {"day": 2, "current_city": "Bemidji", "transportation": "-", "breakfast": "Flying Cakes, Bemidji", "attraction": "Paul Bunyan & Babe the Blue Ox Statues, Bemidji;Headwaters Science Center, Bemidji;", "lunch": "Outback Bar and Grill - Leisure Inn, Bemidji", "dinner": "Gastronomica Kitchen & Bar, Bemidji", "accommodation": "Sunny bedroom off Prospect Park, Bemidji"}, {"day": 3, "current_city": "Bemidji", "transportation": "-", "breakfast": "Chao Chinese Bistro - Holiday Inn Jaipur City Centre, Bemidji", "attraction": "Diamond Point Park, Bemidji;Beltrami County History Center, Bemidji;", "lunch": "Barbeque Nation, Bemidji", "dinner": "The Walled City - Caf\u6106 & Lounge, Bemidji", "accommodation": "Sunny bedroom off Prospect Park, Bemidji"}, {"day": 4, "current_city": "from Bemidji to Minneapolis", "transportation": "Flight Number: F3847877, from Bemidji to Minneapolis, Departure Time: 08:06, Arrival Time: 10:37", "breakfast": "-", "attraction": "Minneapolis Sculpture Garden, Minneapolis;Minneapolis Institute of Art, Minneapolis;", "lunch": "The Cafe, Minneapolis", "dinner": "Court Avenue Brewing Company, Minneapolis", "accommodation": "Light-filled Apartment in great area, close 2 all!, Minneapolis"}, {"day": 5, "current_city": "Minneapolis", "transportation": "-", "breakfast": "Malo, Minneapolis", "attraction": "Mill City Museum, Minneapolis;Mill Ruins Park, Minneapolis;", "lunch": "Texas Roadhouse, Minneapolis", "dinner": "Monkeypod Kitchen by Merriman, Minneapolis", "accommodation": "Light-filled Apartment in great area, close 2 all!, Minneapolis"}, {"day": 6, "current_city": "from Minneapolis to Duluth", "transportation": "Self-driving, from Minneapolis to Duluth, duration: 2 hours 16 mins, distance: 248 km", "breakfast": "-", "attraction": "Glensheen Mansion, Duluth;Leif Erikson Park, Duluth;", "lunch": "Sodam Korean Restaurant, Duluth", "dinner": "Skye - Hotel Unique, Duluth", "accommodation": "Beautiful 1 bedroom in city center, Duluth"}, {"day": 7, "current_city": "from Duluth to Washington", "transportation": "Self-driving, from Duluth to Washington, duration: 17 hours 50 mins, distance: 1,881 km", "breakfast": "-", "attraction": "-", "lunch": "-", "dinner": "-", "accommodation": "-"}]}]