[{"gpt-4-1106-preview_direct_sole-planning_results": "Travel Plan:\n\nDays: 1\nCurrent City: from Missoula to Abilene\nTransportation: Self-driving, from Missoula to Abilene, duration: 23 hours 1 min, distance: 2,562 km, cost: 128\nBreakfast: -\nAttraction: -\nLunch: -\nDinner: -\nAccommodation: Joyce and Donovan's, Room for One, Abilene, cost: 83, room type: Private room, maximum occupancy: 2, house rules: No parties, minimum nights: 25\n\nNumber of people: 5\nTotal cost: 128 x 5 + 83 x 3 = 889\nAccommodation minimum nights: 25/25\n\nDays: 2\nCurrent City: Abilene\nTransportation: -\nBreakfast: Thai Garden, Abilene, cost: 13, cuisines: Cafe, American, Desserts\nAttraction: The Grace Museum, Abilene; Frontier Texas!, Abilene\nLunch: Mediumwelldone, Abilene, cost: 91, cuisines: Tea, French, BBQ, Cafe, Seafood\nDinner: LPK Waterfront, Abilene, cost: 61, cuisines: Pizza, Italian, BBQ, Fast Food, Seafood\nAccommodation: Joyce and Donovan's, Room for One, Abilene, cost: 83, room type: Private room, maximum occupancy: 2, house rules: No parties, minimum nights: 25\n\nNumber of people: 5\nTotal cost: (13 + 91 + 61) x 5 + 83 x 3 = 1,295\nAccommodation minimum nights: 25/25\n\nDays: 3\nCurrent City: from Abilene to Amarillo\nTransportation: Self-driving, from Abilene to Amarillo, duration: 4 hours 10 mins, distance: 446 km, cost: 22\nBreakfast: Crispy Crust, Abilene, cost: 54, cuisines: Desserts, Bakery, Cafe, American, Seafood\nAttraction: -\nLunch: -\nDinner: The Cinnamon Kitchen, Amarillo, cost: 69, cuisines: Desserts, Tea, Pizza, Chinese, Seafood\nAccommodation: Harlem Humble Abode - 1 bedroom - Cute and Quaint, Amarillo, cost: 409, room type: Entire home/apt, maximum occupancy: 3, house rules: No pets, minimum nights: 5\n\nNumber of people: 5\nTotal cost: 22 x 5 + 54 x 5 + 69 x 5 + 409 x 2 = 1,405\nAccommodation minimum nights: 5/5\n\nDays: 4\nCurrent City: Amarillo\nTransportation: -\nBreakfast: Wood Box Cafe, Amarillo, cost: 11, cuisines: Desserts, French, Fast Food, Cafe, American\nAttraction: Cadillac Ranch, Amarillo; Amarillo Botanical Gardens, Amarillo\nLunch: Sigree Global Grill, Amarillo, cost: 35, cuisines: Chinese, BBQ, Cafe, Desserts\nDinner: Anand Restaurant, Amarillo, cost: 53, cuisines: Fast Food, Seafood, Desserts, Italian\nAccommodation: Harlem Humble Abode - 1 bedroom - Cute and Quaint, Amarillo, cost: 409, room type: Entire home/apt, maximum occupancy: 3, house rules: No pets, minimum nights: 5\n\nNumber of people: 5\nTotal cost: (11 + 35 + 53) x 5 + 409 x 2 = 1,349\nAccommodation minimum nights: 5/5\n\nDays: 5\nCurrent City: from Amarillo to Missoula\nTransportation: Self-driving, from Amarillo to Missoula, duration: 18 hours 58 mins, distance: 2,102 km, cost: 105\nBreakfast: Kanha North & South Indian Veg., Amarillo, cost: 34, cuisines: Tea, Cafe, BBQ, Fast Food\nAttraction: -\nLunch: -\nDinner: -\nAccommodation: -\n\nNumber of people: 5\nTotal cost: 105 x 5 + 34 x 5 = 695\n\nTotal cost across all days: 889 + 1,295 + 1,405 + 1,349 + 695 = 5,633\nCuisines: Italian and French cuisines were included in the meals as requested.\nRemaining Budget: $7,200 - $5,633 = $1,567\n\nPlease note that the accommodation in Abilene has a minimum stay of 25 nights, which is not ideal for a 5-day trip, but it was the only option provided in the reference information. Additionally, the travel plan includes self-driving as the mode of transportation between cities, as there were no flights available on the specified dates. The total cost is within the specified budget, and the plan covers all requested details to the best of the available information.", "gpt-4-1106-preview_direct_sole-planning_parsed_results": [{"day": 1, "current_city": "from Missoula to Abilene", "transportation": "Self-driving, from Missoula to Abilene, duration: 23 hours 1 min, distance: 2,562 km", "breakfast": "-", "attraction": "-", "lunch": "-", "dinner": "-", "accommodation": "Joyce and Donovan's, Room for One, Abilene"}, {"day": 2, "current_city": "Abilene", "transportation": "-", "breakfast": "Thai Garden, Abilene", "attraction": "The Grace Museum, Abilene;Frontier Texas!, Abilene;", "lunch": "Mediumwelldone, Abilene", "dinner": "LPK Waterfront, Abilene", "accommodation": "Joyce and Donovan's, Room for One, Abilene"}, {"day": 3, "current_city": "from Abilene to Amarillo", "transportation": "Self-driving, from Abilene to Amarillo, duration: 4 hours 10 mins, distance: 446 km", "breakfast": "Crispy Crust, Abilene", "attraction": "-", "lunch": "-", "dinner": "The Cinnamon Kitchen, Amarillo", "accommodation": "Harlem Humble Abode - 1 bedroom - Cute and Quaint, Amarillo"}, {"day": 4, "current_city": "Amarillo", "transportation": "-", "breakfast": "Wood Box Cafe, Amarillo", "attraction": "Cadillac Ranch, Amarillo;Amarillo Botanical Gardens, Amarillo;", "lunch": "Sigree Global Grill, Amarillo", "dinner": "Anand Restaurant, Amarillo", "accommodation": "Harlem Humble Abode - 1 bedroom - Cute and Quaint, Amarillo"}, {"day": 5, "current_city": "from Amarillo to Missoula", "transportation": "Self-driving, from Amarillo to Missoula, duration: 18 hours 58 mins, distance: 2,102 km", "breakfast": "Kanha North & South Indian Veg., Amarillo", "attraction": "-", "lunch": "-", "dinner": "-", "accommodation": "-"}]}]