[{"gpt-4-1106-preview_direct_sole-planning_results": "Travel Plan:\n\nDays: 1\nCurrent City: from Tulsa to Kansas City\nTransportation: Self-driving, from Tulsa to Kansas City, duration: 3 hours 59 mins, distance: 436 km, cost: 21\nBreakfast: -\nAttraction: -\nLunch: -\nDinner: Gero, Kansas City, cost: 65, cuisines: French, Pizza, American, Seafood\nAccommodation: Private room, Brooklyn Brownstone duplex + garden, 126, No pets, minimum nights: 7, maximum occupancy: 2, cost: 126, Kansas City\n\nNumber of people: 2\nTotal cost: 21 x 1 + (65 + 126) x 2 = 403\nAccommodation minimum nights: 7/7\n\nDays: 2\nCurrent City: Kansas City\nTransportation: -\nBreakfast: Antebellum, Kansas City, cost: 50, cuisines: Tea, Bakery\nAttraction: Science City, Kansas City; The Nelson-Atkins Museum of Art, Kansas City\nLunch: MoMo Cafe, Kansas City, cost: 42, cuisines: Cafe, BBQ\nDinner: Downside Up, Kansas City, cost: 63, cuisines: Tea, French, Bakery, BBQ, Fast Food, Indian\nAccommodation: Private room, Brooklyn Brownstone duplex + garden, 126, No pets, minimum nights: 7, maximum occupancy: 2, cost: 126, Kansas City\n\nNumber of people: 2\nTotal cost: (50 + 42 + 63 + 126) x 2 = 562\nAccommodation minimum nights: 7/7\n\nDays: 3\nCurrent City: Kansas City\nTransportation: -\nBreakfast: Eddie's Patisserie, Kansas City, cost: 13, cuisines: Tea, Mexican, Bakery, BBQ, Seafood\nAttraction: Kansas City Zoo & Aquarium, Kansas City; Worlds of Fun, Kansas City\nLunch: Bakers Delight - The Atrium, Kansas City, cost: 45, cuisines: Bakery, Desserts\nDinner: World Cafe - Vibe by The LaLiT Traveller, Kansas City, cost: 53, cuisines: Pizza, BBQ, Fast Food, Indian, Seafood\nAccommodation: Private room, Brooklyn Brownstone duplex + garden, 126, No pets, minimum nights: 7, maximum occupancy: 2, cost: 126, Kansas City\n\nNumber of people: 2\nTotal cost: (13 + 45 + 53 + 126) x 2 = 474\nAccommodation minimum nights: 7/7\n\nDays: 4\nCurrent City: from Kansas City to Cape Girardeau\nTransportation: Self-driving, from Kansas City to Cape Girardeau, duration: 5 hours 12 mins, distance: 563 km, cost: 28\nBreakfast: -\nAttraction: -\nLunch: -\nDinner: El Toreo Mexican Restaurant, Cape Girardeau, cost: 35, cuisines: Desserts, Tea, Italian, BBQ, Seafood\nAccommodation: Private room, Nice and Comfortable Private Room, 761, No smoking & No parties, minimum nights: 2, maximum occupancy: 2, cost: 761, Cape Girardeau\n\nNumber of people: 2\nTotal cost: 28 x 1 + (35 + 761) x 2 = 1620\nAccommodation minimum nights: 2/2\n\nDays: 5\nCurrent City: Cape Girardeau\nTransportation: -\nBreakfast: Onesta, Cape Girardeau, cost: 31, cuisines: Tea, Desserts, Seafood\nAttraction: Cape River Heritage Museum, Cape Girardeau; Cape Girardeau Conservation Nature Center, Cape Girardeau\nLunch: Cafe Totaram, Cape Girardeau, cost: 62, cuisines: Bakery, Pizza, Desserts, Seafood\nDinner: Juice On Go, Cape Girardeau, cost: 97, cuisines: Cafe, Bakery, Mediterranean, BBQ\nAccommodation: Private room, Nice and Comfortable Private Room, 761, No smoking & No parties, minimum nights: 2, maximum occupancy: 2, cost: 761, Cape Girardeau\n\nNumber of people: 2\nTotal cost: (31 + 62 + 97 + 761) x 2 = 1902\nAccommodation minimum nights: 2/2\n\nDays: 6\nCurrent City: from Cape Girardeau to St. Louis\nTransportation: Self-driving, from Cape Girardeau to St. Louis, duration: 1 hour 51 mins, distance: 186 km, cost: 9\nBreakfast: -\nAttraction: -\nLunch: -\nDinner: El Super Burrito, St. Louis, cost: 43, cuisines: Tea, Cafe, Mediterranean, Fast Food\nAccommodation: Private room, Lux 2Bed/2.5Bath Central Park Views, 1004, No pets & No visitors, minimum nights: 30, maximum occupancy: 7, cost: 1004, St. Louis\n\nNumber of people: 2\nTotal cost: 9 x 1 + (43 + 1004) x 2 = 2103\nAccommodation minimum nights: 30/30\n\nDays: 7\nCurrent City: from St. Louis to Tulsa\nTransportation: Flight F3954999, from St. Louis to Tulsa, duration: 1 hours 10 minutes, cost: 124\nBreakfast: The Latitude - Radisson Blu, St. Louis, cost: 18, cuisines: Pizza, French, BBQ, American, Seafood\nAttraction: Saint Louis Zoo, St. Louis; Missouri Botanical Garden, St. Louis\nLunch: Wai Yu Mun Ching, St. Louis, cost: 89, cuisines: Tea, Mexican, BBQ, Bakery, Mediterranean, Seafood\nDinner: -\nAccommodation: -\n\nNumber of people: 2\nTotal cost: 124 x 2 + (18 + 89) x 2 = 442\n\nTotal cost across all days: 403 + 562 + 474 + 1620 + 1902 + 2103 + 442 = 7506\nCuisines: The prompt specifies no cuisines, so all cuisine constraints are satisfied\n\nPlease note that the accommodation in Kansas City exceeds the minimum nights required for the stay, and the accommodation in St. Louis has a minimum of 30 nights, which is not suitable for a one-week itinerary. However, due to the lack of provided information on alternative accommodations, these options were selected to maintain the private room preference. Adjustments to the accommodations should be made to meet the minimum night requirements and budget constraints.", "gpt-4-1106-preview_direct_sole-planning_parsed_results": [{"day": 1, "current_city": "from Tulsa to Kansas City", "transportation": "Self-driving, from Tulsa to Kansas City, duration: 3 hours 59 mins, distance: 436 km", "breakfast": "-", "attraction": "-", "lunch": "-", "dinner": "Gero, Kansas City", "accommodation": "Private room, Brooklyn Brownstone duplex + garden, Kansas City"}, {"day": 2, "current_city": "Kansas City", "transportation": "-", "breakfast": "Antebellum, Kansas City", "attraction": "Science City, Kansas City; The Nelson-Atkins Museum of Art, Kansas City;", "lunch": "MoMo Cafe, Kansas City", "dinner": "Downside Up, Kansas City", "accommodation": "Private room, Brooklyn Brownstone duplex + garden, Kansas City"}, {"day": 3, "current_city": "Kansas City", "transportation": "-", "breakfast": "Eddie's Patisserie, Kansas City", "attraction": "Kansas City Zoo & Aquarium, Kansas City; Worlds of Fun, Kansas City;", "lunch": "Bakers Delight - The Atrium, Kansas City", "dinner": "World Cafe - Vibe by The LaLiT Traveller, Kansas City", "accommodation": "Private room, Brooklyn Brownstone duplex + garden, Kansas City"}, {"day": 4, "current_city": "from Kansas City to Cape Girardeau", "transportation": "Self-driving, from Kansas City to Cape Girardeau, duration: 5 hours 12 mins, distance: 563 km", "breakfast": "-", "attraction": "-", "lunch": "-", "dinner": "El Toreo Mexican Restaurant, Cape Girardeau", "accommodation": "Private room, Nice and Comfortable Private Room, Cape Girardeau"}, {"day": 5, "current_city": "Cape Girardeau", "transportation": "-", "breakfast": "Onesta, Cape Girardeau", "attraction": "Cape River Heritage Museum, Cape Girardeau; Cape Girardeau Conservation Nature Center, Cape Girardeau;", "lunch": "Cafe Totaram, Cape Girardeau", "dinner": "Juice On Go, Cape Girardeau", "accommodation": "Private room, Nice and Comfortable Private Room, Cape Girardeau"}, {"day": 6, "current_city": "from Cape Girardeau to St. Louis", "transportation": "Self-driving, from Cape Girardeau to St. Louis, duration: 1 hour 51 mins, distance: 186 km", "breakfast": "-", "attraction": "-", "lunch": "-", "dinner": "El Super Burrito, St. Louis", "accommodation": "Private room, Lux 2Bed/2.5Bath Central Park Views, St. Louis"}, {"day": 7, "current_city": "from St. Louis to Tulsa", "transportation": "Flight Number: F3954999, from St. Louis to Tulsa, duration: 1 hours 10 minutes", "breakfast": "The Latitude - Radisson Blu, St. Louis", "attraction": "Saint Louis Zoo, St. Louis; Missouri Botanical Garden, St. Louis;", "lunch": "Wai Yu Mun Ching, St. Louis", "dinner": "-", "accommodation": "-"}]}]