[{"gpt-4-1106-preview_direct_sole-planning_results": "Travel Plan:\n\nDays: 1\nCurrent City: from Miami to San Diego\nTransportation: Flight F3726825, from Miami to San Diego, departure: 19:07, arrival: 21:25, duration: 5 hours 18 minutes, cost: 1072\nBreakfast: -\nAttraction: -\nLunch: -\nDinner: Open Yard, San Diego, cost: 33, cuisines: Chinese, Pizza, Cafe, Desserts\nAccommodation: Spacious Room in Large 2 Bedroom Prewar Apartment, San Diego, cost: 585, room type: Private room, maximum occupancy: 2, house rules: No parties & No visitors, minimum nights: 1\n\nNumber of people: 2\nTotal cost: 1072 x 2 + 33 x 2 + 585 x 1 = 2795\nAccommodation minimum nights: 1/1\n\nDays: 2\nCurrent City: San Diego\nTransportation: -\nBreakfast: Jetha Lal Ka Dhabha, San Diego, cost: 22, cuisines: Tea, Cafe, Indian, Italian\nAttraction: Balboa Park, San Diego; USS Midway Museum, San Diego\nLunch: Burger King, San Diego, cost: 20, cuisines: Pizza, Italian, French, Fast Food, Seafood\nDinner: Gopala, San Diego, cost: 98, cuisines: Pizza, Mexican, BBQ, American, Seafood\nAccommodation: Spacious Room in Large 2 Bedroom Prewar Apartment, San Diego, cost: 585, room type: Private room, maximum occupancy: 2, house rules: No parties & No visitors, minimum nights: 1\n\nNumber of people: 2\nTotal cost: (22 + 20 + 98) x 2 + 585 x 1 = 865\nAccommodation minimum nights: 1/1\n\nDays: 3\nCurrent City: from San Diego to Sacramento\nTransportation: Flight F3943115, from San Diego to Sacramento, departure: 20:22, arrival: 21:48, duration: 1 hours 26 minutes, cost: 103\nBreakfast: Bun Intended, San Diego, cost: 91, cuisines: Cafe, Pizza, Desserts, Seafood\nAttraction: Cabrillo National Monument, San Diego\nLunch: Chawlas 2, San Diego, cost: 91, cuisines: Desserts, Fast Food, American, Mediterranean, Seafood\nDinner: Braseiro da G\u00e1vea, Sacramento, cost: 37, cuisines: Desserts, Tea, Pizza, Mexican, Fast Food\nAccommodation: Free Cleaning & WiFi-Near Train + Bars & Nightlife, Sacramento, cost: 237, room type: Private room, maximum occupancy: 2, house rules: No parties, minimum nights: 1\n\nNumber of people: 2\nTotal cost: 103 x 2 + (91 + 91 + 37) x 2 + 237 x 1 = 788\nAccommodation minimum nights: 1/1\n\nDays: 4\nCurrent City: Sacramento\nTransportation: -\nBreakfast: Gujarati Samaj Santushti, Sacramento, cost: 12, cuisines: Tea, Pizza, Fast Food\nAttraction: California State Railroad Museum, Sacramento; Old Sacramento Waterfront, Sacramento\nLunch: Metro Fast Food, Sacramento, cost: 32, cuisines: American, BBQ, Cafe, Indian, Seafood\nDinner: Kerala Hotel, Sacramento, cost: 27, cuisines: Desserts, Tea, BBQ, Fast Food, American\nAccommodation: Free Cleaning & WiFi-Near Train + Bars & Nightlife, Sacramento, cost: 237, room type: Private room, maximum occupancy: 2, house rules: No parties, minimum nights: 1\n\nNumber of people: 2\nTotal cost: (12 + 32 + 27) x 2 + 237 x 1 = 379\nAccommodation minimum nights: 1/1\n\nDays: 5\nCurrent City: from Sacramento to Los Angeles\nTransportation: Flight F3846018, from Sacramento to Los Angeles, departure: 10:22, arrival: 11:54, duration: 1 hours 32 minutes, cost: 74\nBreakfast: Fusion N Food, Sacramento, cost: 22, cuisines: Tea, Cafe, BBQ, Chinese, Indian, Seafood\nAttraction: California State Capitol Museum, Sacramento\nLunch: Pasta Hut, Sacramento, cost: 18, cuisines: Tea, Pizza, BBQ, Indian, Seafood\nDinner: Palmshore, Los Angeles, cost: 25, cuisines: Desserts, Bakery, Fast Food, American, Seafood\nAccommodation: Midtown East 2 Bed/2 Bath Elevator Building Apt, Los Angeles, cost: 540, room type: Entire home/apt, maximum occupancy: 4, house rules: No pets, minimum nights: 1\n\nNumber of people: 2\nTotal cost: 74 x 2 + (22 + 18 + 25) x 2 + 540 x 1 = 798\nAccommodation minimum nights: 1/1\n\nDays: 6\nCurrent City: Los Angeles\nTransportation: -\nBreakfast: Punjabi Zaika, Los Angeles, cost: 46, cuisines: Pizza, Bakery, BBQ, Cafe, Indian\nAttraction: Santa Monica Pier, Los Angeles; Griffith Observatory, Los Angeles\nLunch: Chicken Minar, Los Angeles, cost: 25, cuisines: Bakery, Fast Food\nDinner: Village - The House of Food, Los Angeles, cost: 87, cuisines: Chinese, Pizza, Cafe\nAccommodation: Midtown East 2 Bed/2 Bath Elevator Building Apt, Los Angeles, cost: 540, room type: Entire home/apt, maximum occupancy: 4, house rules: No pets, minimum nights: 1\n\nNumber of people: 2\nTotal cost: (46 + 25 + 87) x 2 + 540 x 1 = 866\nAccommodation minimum nights: 1/1\n\nDays: 7\nCurrent City: from Los Angeles to Miami\nTransportation: Flight F3659468, from Los Angeles to Miami, departure: 22:14, arrival: 05:42, duration: 4 hours 28 minutes, cost: 489\nBreakfast: The Hangout by 1861, Los Angeles, cost: 64, cuisines: Tea, Pizza, Seafood\nAttraction: Hollywood Walk of Fame, Los Angeles; The Getty, Los Angeles\nLunch: Punjabi Tandoori Tikka, Los Angeles, cost: 47, cuisines: Pizza, Italian, Mexican, Bakery, Fast Food, Seafood\nDinner: -\nAccommodation: -\n\nNumber of people: 2\nTotal cost: 489 x 2 + (64 + 47) x 2 = 1300\n\nTotal cost across all days: 2795 + 865 + 788 + 379 + 798 + 866 + 1300 = 7791\n\nCuisines: The prompt specifies Mexican and American cuisines, so all cuisine constraints are satisfied\n\nNote: The total cost exceeds the specified budget of $7,200. Adjustments to the plan, such as choosing more budget-friendly accommodations or dining options, may be necessary to meet the budget constraint.", "gpt-4-1106-preview_direct_sole-planning_parsed_results": [{"day": 1, "current_city": "from Miami to San Diego", "transportation": "Flight Number: F3726825, from Miami to San Diego, Departure Time: 19:07, Arrival Time: 21:25", "breakfast": "-", "attraction": "-", "lunch": "-", "dinner": "Open Yard, San Diego", "accommodation": "Spacious Room in Large 2 Bedroom Prewar Apartment, San Diego"}, {"day": 2, "current_city": "San Diego", "transportation": "-", "breakfast": "Jetha Lal Ka Dhabha, San Diego", "attraction": "Balboa Park, San Diego;USS Midway Museum, San Diego;", "lunch": "Burger King, San Diego", "dinner": "Gopala, San Diego", "accommodation": "Spacious Room in Large 2 Bedroom Prewar Apartment, San Diego"}, {"day": 3, "current_city": "from San Diego to Sacramento", "transportation": "Flight Number: F3943115, from San Diego to Sacramento, Departure Time: 20:22, Arrival Time: 21:48", "breakfast": "Bun Intended, San Diego", "attraction": "Cabrillo National Monument, San Diego", "lunch": "Chawlas 2, San Diego", "dinner": "Braseiro da G\u00e1vea, Sacramento", "accommodation": "Free Cleaning & WiFi-Near Train + Bars & Nightlife, Sacramento"}, {"day": 4, "current_city": "Sacramento", "transportation": "-", "breakfast": "Gujarati Samaj Santushti, Sacramento", "attraction": "California State Railroad Museum, Sacramento;Old Sacramento Waterfront, Sacramento;", "lunch": "Metro Fast Food, Sacramento", "dinner": "Kerala Hotel, Sacramento", "accommodation": "Free Cleaning & WiFi-Near Train + Bars & Nightlife, Sacramento"}, {"day": 5, "current_city": "from Sacramento to Los Angeles", "transportation": "Flight Number: F3846018, from Sacramento to Los Angeles, Departure Time: 10:22, Arrival Time: 11:54", "breakfast": "Fusion N Food, Sacramento", "attraction": "California State Capitol Museum, Sacramento", "lunch": "Pasta Hut, Sacramento", "dinner": "Palmshore, Los Angeles", "accommodation": "Midtown East 2 Bed/2 Bath Elevator Building Apt, Los Angeles"}, {"day": 6, "current_city": "Los Angeles", "transportation": "-", "breakfast": "Punjabi Zaika, Los Angeles", "attraction": "Santa Monica Pier, Los Angeles;Griffith Observatory, Los Angeles;", "lunch": "Chicken Minar, Los Angeles", "dinner": "Village - The House of Food, Los Angeles", "accommodation": "Midtown East 2 Bed/2 Bath Elevator Building Apt, Los Angeles"}, {"day": 7, "current_city": "from Los Angeles to Miami", "transportation": "Flight Number: F3659468, from Los Angeles to Miami, Departure Time: 22:14, Arrival Time: 05:42", "breakfast": "The Hangout by 1861, Los Angeles", "attraction": "Hollywood Walk of Fame, Los Angeles;The Getty, Los Angeles;", "lunch": "Punjabi Tandoori Tikka, Los Angeles", "dinner": "-", "accommodation": "-"}]}]