[{"gpt-4-1106-preview_direct_sole-planning_results": "Travel Plan:\n\nDays: 1\nCurrent City: from Omaha to Traverse City\nTransportation: Self-driving, from Omaha to Traverse City, duration: 11 hours 25 mins, distance: 1,240 km, cost: 62\nBreakfast: -\nAttraction: -\nLunch: -\nDinner: Famous Dave's, Traverse City, cost: 39, cuisines: Desserts, Italian, BBQ, Fast Food, Indian\nAccommodation: Beautiful Room close to JFK, La Guardia, LIR, Private room, cost: 352, maximum occupancy: 1, house rules: No pets, minimum nights: 2\n\nNumber of people: 3\nTotal cost: 62 x 1 + (39 x 3) + (352 x 3) = 62 + 117 + 1056 = 1235\nAccommodation minimum nights: 2/2\n\nDays: 2\nCurrent City: Traverse City\nTransportation: -\nBreakfast: Daily Eats, Traverse City, cost: 44, cuisines: Desserts, Seafood\nAttraction: Clinch Park, Traverse City; Great Lakes Children's Museum, Traverse City\nLunch: Arigato Sushi, cost: 96, cuisines: Desserts, Mexican, Bakery, BBQ, Fast Food, Mediterranean\nDinner: Tasty Bites, cost: 27, cuisines: Chinese, Bakery, Desserts, Seafood\nAccommodation: Beautiful Room close to JFK, La Guardia, LIR, Private room, cost: 352, maximum occupancy: 1, house rules: No pets, minimum nights: 2\n\nNumber of people: 3\nTotal cost: (44 + 96 + 27) x 3 + (352 x 3) = 501 + 1056 = 1557\nAccommodation minimum nights: 2/2\n\nDays: 3\nCurrent City: from Traverse City to Alpena\nTransportation: Self-driving, from Traverse City to Alpena, duration: 2 hours 29 mins, distance: 204 km, cost: 10\nBreakfast: India on my Plate - Fortune Select Excalibur, Traverse City, cost: 53, cuisines: Tea, Chinese, Seafood\nAttraction: -\nLunch: -\nDinner: A & A Pagliai's Pizza, Alpena, cost: 72, cuisines: Tea, American, Fast Food\nAccommodation: CHEERFUL RM IN BROOKLYN! EASY ACCESS TO TRAIN! R3, Private room, cost: 927, maximum occupancy: 2, house rules: No pets, minimum nights: 15\n\nNumber of people: 3\nTotal cost: 10 x 1 + (53 x 3) + (72 x 3) + (927 x 2) = 10 + 159 + 216 + 1854 = 2239\nAccommodation minimum nights: 15/15\n\nDays: 4\nCurrent City: Alpena\nTransportation: -\nBreakfast: Shudh Restaurant, Alpena, cost: 56, cuisines: Cafe, BBQ, Fast Food\nAttraction: Great Lakes Maritime Heritage Center, Alpena; Besser Museum for Northeast Michigan, Alpena\nLunch: Maplai, cost: 63, cuisines: Tea, Indian, Bakery, Fast Food, American\nDinner: Zaffran - The Bristol Hotel, cost: 33, cuisines: Pizza, Desserts, Seafood\nAccommodation: CHEERFUL RM IN BROOKLYN! EASY ACCESS TO TRAIN! R3, Private room, cost: 927, maximum occupancy: 2, house rules: No pets, minimum nights: 15\n\nNumber of people: 3\nTotal cost: (56 + 63 + 33) x 3 + (927 x 2) = 456 + 1854 = 2310\nAccommodation minimum nights: 15/15\n\nDays: 5\nCurrent City: from Alpena to Omaha\nTransportation: Self-driving, from Alpena to Omaha, duration: 12 hours 59 mins, distance: 1,391 km, cost: 69\nBreakfast: Kylin Express, Alpena, cost: 30, cuisines: Chinese, Bakery, BBQ, Seafood\nAttraction: -\nLunch: -\nDinner: -\nAccommodation: -\n\nNumber of people: 3\nTotal cost: 69 x 1 + (30 x 3) = 69 + 90 = 159\n\nTotal cost across all days: 1235 + 1557 + 2239 + 2310 + 159 = 7500\nCuisines: The prompt specifies no cuisines, so all cuisine constraints are satisfied\n\nPlease note that the accommodation on Day 3 has a minimum night requirement of 15, which exceeds the travel plan duration. This is the only available option that meets the private room requirement in the provided data. Adjustments to the plan or budget may be necessary to accommodate this constraint.", "gpt-4-1106-preview_direct_sole-planning_parsed_results": [{"day": 1, "current_city": "from Omaha to Traverse City", "transportation": "Self-driving, from Omaha to Traverse City, duration: 11 hours 25 mins, distance: 1,240 km", "breakfast": "-", "attraction": "-", "lunch": "-", "dinner": "Famous Dave's, Traverse City", "accommodation": "Beautiful Room close to JFK, La Guardia, LIR, Private room"}, {"day": 2, "current_city": "Traverse City", "transportation": "-", "breakfast": "Daily Eats, Traverse City", "attraction": "Clinch Park, Traverse City;Great Lakes Children's Museum, Traverse City;", "lunch": "Arigato Sushi, Traverse City", "dinner": "Tasty Bites, Traverse City", "accommodation": "Beautiful Room close to JFK, La Guardia, LIR, Private room"}, {"day": 3, "current_city": "from Traverse City to Alpena", "transportation": "Self-driving, from Traverse City to Alpena, duration: 2 hours 29 mins, distance: 204 km", "breakfast": "India on my Plate - Fortune Select Excalibur, Traverse City", "attraction": "-", "lunch": "-", "dinner": "A & A Pagliai's Pizza, Alpena", "accommodation": "CHEERFUL RM IN BROOKLYN! EASY ACCESS TO TRAIN! R3, Private room"}, {"day": 4, "current_city": "Alpena", "transportation": "-", "breakfast": "Shudh Restaurant, Alpena", "attraction": "Great Lakes Maritime Heritage Center, Alpena;Besser Museum for Northeast Michigan, Alpena;", "lunch": "Maplai, Alpena", "dinner": "Zaffran - The Bristol Hotel, Alpena", "accommodation": "CHEERFUL RM IN BROOKLYN! EASY ACCESS TO TRAIN! R3, Private room"}, {"day": 5, "current_city": "from Alpena to Omaha", "transportation": "Self-driving, from Alpena to Omaha, duration: 12 hours 59 mins, distance: 1,391 km", "breakfast": "Kylin Express, Alpena", "attraction": "-", "lunch": "-", "dinner": "-", "accommodation": "-"}]}]