[{"gpt-4-1106-preview_direct_sole-planning_results": "Travel Plan:\nDays: 1\nCurrent City: from Houston to Pensacola\nTransportation: Self-driving, from Houston to Pensacola, duration: 7 hours 38 mins, distance: 845 km, cost: 42\nBreakfast: -\nAttraction: -\nLunch: -\nDinner: Frog Hollow Tavern, Pensacola, cost: 20, cuisines: American, BBQ, Fast Food, Cafe, Indian\nAccommodation: Chic Historic Harlem Brownstone, Pensacola, cost: 526, room type: Entire home/apt, house rules: No smoking, minimum nights: 3, maximum occupancy: 2\n\nNumber of people: 2\nTotal cost: 42 x 1 + (20 x 2) + (526 x 1) = 608\nAccommodation minimum nights: 3/3\n\nDays: 2\nCurrent City: Pensacola\nTransportation: -\nBreakfast: Berry Patch Restaurant, Pensacola, cost: 13, cuisines: Bakery, BBQ, Desserts, Seafood\nAttraction: Historic Pensacola Village, Pensacola; Pensacola Museum of Art, Pensacola\nLunch: Bailey's Bar-B-Que, cost: 13, cuisines: Tea, Bakery, Mediterranean\nDinner: Watershed Cafe, cost: 12, cuisines: Chinese, BBQ, Desserts\nAccommodation: Chic Historic Harlem Brownstone, Pensacola, cost: 526, room type: Entire home/apt, house rules: No smoking, minimum nights: 3, maximum occupancy: 2\n\nNumber of people: 2\nTotal cost: (13 + 13 + 12) x 2 + (526 x 1) = 590\nAccommodation minimum nights: 3/3\n\nDays: 3\nCurrent City: from Pensacola to Houston\nTransportation: Self-driving, from Pensacola to Houston, duration: 7 hours 37 mins, distance: 845 km, cost: 42\nBreakfast: Kalpana Restaurant, Pensacola, cost: 36, cuisines: Tea, Cafe, Bakery, American\nAttraction: -\nLunch: -\nDinner: -\nAccommodation: -\n\nNumber of people: 2\nTotal cost: 42 x 1 + (36 x 2) = 114\n\nTotal cost across all days: 608 + 590 + 114 = 1,312\n\nUnfortunately, the total cost exceeds the specified budget of $1,100. To adjust the plan within the budget, we need to change the accommodation to a less expensive option that allows smoking.\n\nRevised Accommodation:\nDays: 1 and 2\nAccommodation: Amazing apartment near museum, gardens & park!, Pensacola, cost: 74, room type: Entire home/apt, house rules: No parties, minimum nights: 17, maximum occupancy: 3\n\nRevised Total Costs:\nDays 1 and 2 Accommodation Cost: 74 x 2 = 148\nDay 3 Transportation Cost: 42 x 1 = 42\nMeals and Other Costs: (20 + 13 + 13 + 12 + 36) x 2 = 188\n\nRevised Total Cost Across All Days: 148 + 42 + 188 = 378\n\nCuisines: The prompt specifies no cuisines, so all cuisine constraints are satisfied.\n\nPlease note that the accommodation \"Amazing apartment near museum, gardens & park!\" does not explicitly state that smoking is allowed, but it does not list \"No smoking\" as a house rule. If smoking is a strict requirement, further adjustments may be needed to find a suitable accommodation that explicitly permits smoking.", "gpt-4-1106-preview_direct_sole-planning_parsed_results": [{"day": 1, "current_city": "from Houston to Pensacola", "transportation": "Self-driving, from Houston to Pensacola, duration: 7 hours 38 mins, distance: 845 km", "breakfast": "-", "attraction": "-", "lunch": "-", "dinner": "Frog Hollow Tavern, Pensacola", "accommodation": "Amazing apartment near museum, gardens & park!, Pensacola"}, {"day": 2, "current_city": "Pensacola", "transportation": "-", "breakfast": "Berry Patch Restaurant, Pensacola", "attraction": "Historic Pensacola Village, Pensacola;Pensacola Museum of Art, Pensacola;", "lunch": "Bailey's Bar-B-Que, Pensacola", "dinner": "Watershed Cafe, Pensacola", "accommodation": "Amazing apartment near museum, gardens & park!, Pensacola"}, {"day": 3, "current_city": "from Pensacola to Houston", "transportation": "Self-driving, from Pensacola to Houston, duration: 7 hours 37 mins, distance: 845 km", "breakfast": "Kalpana Restaurant, Pensacola", "attraction": "-", "lunch": "-", "dinner": "-", "accommodation": "-"}]}]