[{"gpt-4-1106-preview_direct_sole-planning_results": "Travel Plan:\n\nDays: 1\nDate: March 23, 2022\nCurrent City: from Washington to Evansville\nTransportation: Self-driving, from Washington to Evansville, duration: 10 hours 59 mins, distance: 1,168 km, cost: 58\nBreakfast: -\nAttraction: -\nLunch: -\nDinner: Blue Orchid Thai Restaurant, Evansville, cost: 86, cuisines: Tea, Mexican, American, Desserts\nAccommodation: *Lovely Apt In Heart Of Park Slope*, Evansville, cost: 70, room type: Entire home/apt, house rules: No pets, minimum nights: 14, maximum occupancy: 3\n\nNumber of people: 5\nTotal cost: 58 x 1 + (86 x 5) + (70 x 1) = 58 + 430 + 70 = 558\nAccommodation minimum nights: 14/1\n\nDays: 2\nDate: March 24, 2022\nCurrent City: Evansville\nTransportation: -\nBreakfast: J. Christopher's, Evansville, cost: 39, cuisines: Tea, Cafe, Desserts, Seafood\nAttraction: Mesker Park Zoo, Evansville; Children's Museum of Evansville\nLunch: Punjabi Restaurant, cost: 29, cuisines: Cafe, Bakery, Desserts, Fast Food\nDinner: Twist of Italy, cost: 85, cuisines: Desserts, Pizza, Mexican, Mediterranean, Seafood\nAccommodation: *Lovely Apt In Heart Of Park Slope*, Evansville, cost: 70, room type: Entire home/apt, house rules: No pets, minimum nights: 14, maximum occupancy: 3\n\nNumber of people: 5\nTotal cost: (39 + 29 + 85) x 5 + (70 x 1) = 765 + 70 = 835\nAccommodation minimum nights: 14/2\n\nDays: 3\nDate: March 25, 2022\nCurrent City: from Evansville to South Bend\nTransportation: Self-driving, from Evansville to South Bend, duration: 5 hours 1 min, distance: 512 km, cost: 25\nBreakfast: Cake Point, Evansville, cost: 49, cuisines: Tea, Mediterranean, Desserts, Fast Food\nAttraction: -\nLunch: -\nDinner: Madaan Confectionery, South Bend, cost: 62, cuisines: Tea, Cafe, BBQ, Seafood\nAccommodation: Clean + Simple Chelsea 2 Bedroom (sleeps 7), South Bend, cost: 341, room type: Entire home/apt, house rules: No visitors & No pets & No smoking, minimum nights: 30, maximum occupancy: 3\n\nNumber of people: 5\nTotal cost: 25 x 1 + (49 x 5) + (62 x 5) + (341 x 1) = 25 + 245 + 310 + 341 = 921\nAccommodation minimum nights: 30/1\n\nDays: 4\nDate: March 26, 2022\nCurrent City: South Bend\nTransportation: -\nBreakfast: Roadhouse Cafe, South Bend, cost: 24, cuisines: Desserts, Pizza, Bakery, Fast Food, Chinese\nAttraction: Studebaker National Museum, South Bend; South Bend Museum of Art\nLunch: It\u6f74\u7c79 Sinful, cost: 26, cuisines: Desserts, French, BBQ, Bakery, Seafood\nDinner: MOB Brewpub, cost: 67, cuisines: Cafe, Mexican, American, BBQ\nAccommodation: Clean + Simple Chelsea 2 Bedroom (sleeps 7), South Bend, cost: 341, room type: Entire home/apt, house rules: No visitors & No pets & No smoking, minimum nights: 30, maximum occupancy: 3\n\nNumber of people: 5\nTotal cost: (24 + 26 + 67) x 5 + (341 x 1) = 585 + 341 = 926\nAccommodation minimum nights: 30/2\n\nDays: 5\nDate: March 27, 2022\nCurrent City: from South Bend to Fort Wayne\nTransportation: Self-driving, from South Bend to Fort Wayne, duration: 1 hour 46 mins, distance: 145 km, cost: 7\nBreakfast: Our Story Bistro & Tea Room, South Bend, cost: 10, cuisines: Tea, Pizza, Italian, BBQ, Mediterranean, Seafood\nAttraction: -\nLunch: -\nDinner: Shri Bikaner Misthan Bhandar, Fort Wayne, cost: 29, cuisines: Pizza, French, Mexican, BBQ, Bakery, Cafe\nAccommodation: Large room in new Williamsburg apartment, Fort Wayne, cost: 1104, room type: Private room, house rules: No pets, minimum nights: 4, maximum occupancy: 1\n\nNumber of people: 5\nTotal cost: 7 x 1 + (10 x 5) + (29 x 5) + (1104 x 1) = 7 + 50 + 145 + 1104 = 1306\nAccommodation minimum nights: 4/1\n\nDays: 6\nDate: March 28, 2022\nCurrent City: Fort Wayne\nTransportation: -\nBreakfast: Good Food, Fort Wayne, cost: 32, cuisines: Desserts, Pizza, Fast Food, Cafe, Indian\nAttraction: Fort Wayne Museum of Art, Fort Wayne; Science Central\nLunch: Parikrama - The Revolving Restaurant, cost: 80, cuisines: Tea, Pizza, Italian, Mexican, Bakery, BBQ\nDinner: The Barbeque Company, cost: 88, cuisines: Bakery, BBQ, Fast Food, Cafe, American\nAccommodation: Large room in new Williamsburg apartment, Fort Wayne, cost: 1104, room type: Private room, house rules: No pets, minimum nights: 4, maximum occupancy: 1\n\nNumber of people: 5\nTotal cost: (32 + 80 + 88) x 5 + (1104 x 1) = 1000 + 1104 = 2104\nAccommodation minimum nights: 4/2\n\nDays: 7\nDate: March 29, 2022\nCurrent City: from Fort Wayne to Washington\nTransportation: Self-driving, from Fort Wayne to Washington, duration: 8 hours 52 mins, distance: 893 km, cost: 44\nBreakfast: Cafe Coffee Day, Fort Wayne, cost: 48, cuisines: Tea, Fast Food\nAttraction: -\nLunch: -\nDinner: -\nAccommodation: -\n\nNumber of people: 5\nTotal cost: 44 x 1 + (48 x 5) = 44 + 240 = 284\n\nTotal cost across all days: 558 + 835 + 921 + 926 + 1306 + 2104 + 284 = 6934\nRemaining budget: $23,800 - $6,934 = $16,866\nCuisines: The prompt specifies no cuisines, so all cuisine constraints are satisfied\nAccommodation suitable for children: All accommodations chosen are entire homes or private rooms with no restrictions against children under 10 years of age.", "gpt-4-1106-preview_direct_sole-planning_parsed_results": [{"day": 1, "current_city": "from Washington to Evansville", "transportation": "Self-driving, from Washington to Evansville, duration: 10 hours 59 mins, distance: 1,168 km", "breakfast": "-", "attraction": "-", "lunch": "-", "dinner": "Blue Orchid Thai Restaurant, Evansville", "accommodation": "*Lovely Apt In Heart Of Park Slope*, Evansville"}, {"day": 2, "current_city": "Evansville", "transportation": "-", "breakfast": "J. Christopher's, Evansville", "attraction": "Mesker Park Zoo, Evansville;Children's Museum of Evansville, Evansville;", "lunch": "Punjabi Restaurant, Evansville", "dinner": "Twist of Italy, Evansville", "accommodation": "*Lovely Apt In Heart Of Park Slope*, Evansville"}, {"day": 3, "current_city": "from Evansville to South Bend", "transportation": "Self-driving, from Evansville to South Bend, duration: 5 hours 1 min, distance: 512 km", "breakfast": "Cake Point, Evansville", "attraction": "-", "lunch": "-", "dinner": "Madaan Confectionery, South Bend", "accommodation": "Clean + Simple Chelsea 2 Bedroom (sleeps 7), South Bend"}, {"day": 4, "current_city": "South Bend", "transportation": "-", "breakfast": "Roadhouse Cafe, South Bend", "attraction": "Studebaker National Museum, South Bend;South Bend Museum of Art, South Bend;", "lunch": "It\u6f74\u7c79 Sinful, South Bend", "dinner": "MOB Brewpub, South Bend", "accommodation": "Clean + Simple Chelsea 2 Bedroom (sleeps 7), South Bend"}, {"day": 5, "current_city": "from South Bend to Fort Wayne", "transportation": "Self-driving, from South Bend to Fort Wayne, duration: 1 hour 46 mins, distance: 145 km", "breakfast": "Our Story Bistro & Tea Room, South Bend", "attraction": "-", "lunch": "-", "dinner": "Shri Bikaner Misthan Bhandar, Fort Wayne", "accommodation": "Large room in new Williamsburg apartment, Fort Wayne"}, {"day": 6, "current_city": "Fort Wayne", "transportation": "-", "breakfast": "Good Food, Fort Wayne", "attraction": "Fort Wayne Museum of Art, Fort Wayne;Science Central, Fort Wayne;", "lunch": "Parikrama - The Revolving Restaurant, Fort Wayne", "dinner": "The Barbeque Company, Fort Wayne", "accommodation": "Large room in new Williamsburg apartment, Fort Wayne"}, {"day": 7, "current_city": "from Fort Wayne to Washington", "transportation": "Self-driving, from Fort Wayne to Washington, duration: 8 hours 52 mins, distance: 893 km", "breakfast": "Cafe Coffee Day, Fort Wayne", "attraction": "-", "lunch": "-", "dinner": "-", "accommodation": "-"}]}]