[{"gpt-4-1106-preview_direct_sole-planning_results": "Travel Plan:\n\nDays: 1\nCurrent City: from Harrisburg to Wichita Falls\nTransportation: Self-driving, from Harrisburg to Wichita Falls, duration: 20 hours 58 mins, distance: 2,283 km, cost: 114\nBreakfast: -\nAttraction: -\nLunch: -\nDinner: Tyre Patty, Wichita Falls, cost: 92, cuisines: Pizza, BBQ, Bakery, Chinese, American, Seafood\nAccommodation: Modern Apartment on the UES, Wichita Falls, cost: 702, room type: Private room, house rules: No children under 10 & No smoking & No parties, minimum nights: 1, maximum occupancy: 2\n\nNumber of people: 2\nTotal cost: 114 x 1 + 92 x 2 + 702 x 1 = 1,000\nAccommodation minimum nights: 1/1\n\nDays: 2\nCurrent City: Wichita Falls\nTransportation: -\nBreakfast: Mama's Boy Restaurant, Wichita Falls, cost: 25, cuisines: Bakery, BBQ\nAttraction: Museum of North Texas History, Wichita Falls; River Bend Nature Center, Wichita Falls\nLunch: Made In Punjab, Wichita Falls, cost: 37, cuisines: French, Bakery, Seafood\nDinner: The Coffee Bean & Tea Leaf, Wichita Falls, cost: 21, cuisines: Chinese, Bakery, Desserts\nAccommodation: Modern Apartment on the UES, Wichita Falls, cost: 702, room type: Private room, house rules: No children under 10 & No smoking & No parties, minimum nights: 1, maximum occupancy: 2\n\nNumber of people: 2\nTotal cost: (25 + 37 + 21) x 2 + 702 x 1 = 1,070\nAccommodation minimum nights: 1/1\n\nDays: 3\nCurrent City: from Wichita Falls to Waco\nTransportation: Self-driving, from Wichita Falls to Waco, duration: 3 hours 2 mins, distance: 327 km, cost: 16\nBreakfast: -\nAttraction: -\nLunch: -\nDinner: Blue House Cafe, Waco, cost: 55, cuisines: Tea, Pizza, Mexican, Cafe, Seafood\nAccommodation: Room 2: Sunny Queen W Private Bathroom & Breakfast, Waco, cost: 257, room type: Private room, house rules: No visitors & No children under 10, minimum nights: 1, maximum occupancy: 2\n\nNumber of people: 2\nTotal cost: 16 x 1 + 55 x 2 + 257 x 1 = 383\nAccommodation minimum nights: 1/1\n\nDays: 4\nCurrent City: Waco\nTransportation: -\nBreakfast: First Gear Cafe, Waco, cost: 76, cuisines: Desserts, Tea, Fast Food, Chinese, Seafood\nAttraction: Dr Pepper Museum, Waco; Cameron Park Zoo, Waco\nLunch: Punjabi Rasoi, Waco, cost: 70, cuisines: Fast Food, Cafe, Bakery, Seafood\nDinner: Fork, Waco, cost: 58, cuisines: Tea, French, Mediterranean, Seafood\nAccommodation: Room 2: Sunny Queen W Private Bathroom & Breakfast, Waco, cost: 257, room type: Private room, house rules: No visitors & No children under 10, minimum nights: 1, maximum occupancy: 2\n\nNumber of people: 2\nTotal cost: (76 + 70 + 58) x 2 + 257 x 1 = 615\nAccommodation minimum nights: 1/1\n\nDays: 5\nCurrent City: from Waco to Houston\nTransportation: Self-driving, from Waco to Houston, duration: 2 hours 50 mins, distance: 298 km, cost: 14\nBreakfast: -\nAttraction: -\nLunch: -\nDinner: Jalapenos, Houston, cost: 57, cuisines: Desserts, Tea, Cafe, Chinese, Seafood\nAccommodation: Sunny and Airy near Manhattan, Houston, cost: 499, room type: Entire home/apt, house rules: No pets, minimum nights: 2, maximum occupancy: 4\n\nNumber of people: 2\nTotal cost: 14 x 1 + 57 x 2 + 499 x 1 = 627\nAccommodation minimum nights: 2/2\n\nDays: 6\nCurrent City: Houston\nTransportation: -\nBreakfast: Super Bakery, Houston, cost: 30, cuisines: Seafood, Fast Food\nAttraction: Downtown Aquarium, Houston; Space Center Houston\nLunch: Matchbox, Houston, cost: 33, cuisines: Tea, Italian, Bakery, Fast Food, Seafood\nDinner: The BrewMaster - The Mix Fine Dine, Houston, cost: 52, cuisines: French, Indian, Cafe, Seafood\nAccommodation: Sunny and Airy near Manhattan, Houston, cost: 499, room type: Entire home/apt, house rules: No pets, minimum nights: 2, maximum occupancy: 4\n\nNumber of people: 2\nTotal cost: (30 + 33 + 52) x 2 + 499 x 1 = 727\nAccommodation minimum nights: 2/2\n\nDays: 7\nCurrent City: from Houston to Harrisburg\nTransportation: Self-driving, from Houston to Harrisburg, duration: 21 hours 16 mins, distance: 2,353 km, cost: 117\nBreakfast: -\nAttraction: -\nLunch: -\nDinner: -\nAccommodation: -\n\nNumber of people: 2\nTotal cost: 117 x 1 = 117\n\nTotal cost across all days: 1,000 + 1,070 + 383 + 615 + 627 + 727 + 117 = 4,539\n\nCuisines: The prompt specifies Italian and French cuisines, so all cuisine constraints are satisfied\n\nPlease note that the total cost exceeds the specified budget of $4,100. Adjustments to the plan, such as choosing less expensive dining options or accommodations, may be necessary to meet the budget constraint.", "gpt-4-1106-preview_direct_sole-planning_parsed_results": [{"day": 1, "current_city": "from Harrisburg to Wichita Falls", "transportation": "Self-driving, from Harrisburg to Wichita Falls, duration: 20 hours 58 mins, distance: 2,283 km", "breakfast": "-", "attraction": "-", "lunch": "-", "dinner": "Tyre Patty, Wichita Falls", "accommodation": "Modern Apartment on the UES, Wichita Falls"}, {"day": 2, "current_city": "Wichita Falls", "transportation": "-", "breakfast": "Mama's Boy Restaurant, Wichita Falls", "attraction": "Museum of North Texas History, Wichita Falls; River Bend Nature Center, Wichita Falls", "lunch": "Made In Punjab, Wichita Falls", "dinner": "The Coffee Bean & Tea Leaf, Wichita Falls", "accommodation": "Modern Apartment on the UES, Wichita Falls"}, {"day": 3, "current_city": "from Wichita Falls to Waco", "transportation": "Self-driving, from Wichita Falls to Waco, duration: 3 hours 2 mins, distance: 327 km", "breakfast": "-", "attraction": "-", "lunch": "-", "dinner": "Blue House Cafe, Waco", "accommodation": "Room 2: Sunny Queen W Private Bathroom & Breakfast, Waco"}, {"day": 4, "current_city": "Waco", "transportation": "-", "breakfast": "First Gear Cafe, Waco", "attraction": "Dr Pepper Museum, Waco; Cameron Park Zoo, Waco", "lunch": "Punjabi Rasoi, Waco", "dinner": "Fork, Waco", "accommodation": "Room 2: Sunny Queen W Private Bathroom & Breakfast, Waco"}, {"day": 5, "current_city": "from Waco to Houston", "transportation": "Self-driving, from Waco to Houston, duration: 2 hours 50 mins, distance: 298 km", "breakfast": "-", "attraction": "-", "lunch": "-", "dinner": "Jalapenos, Houston", "accommodation": "Sunny and Airy near Manhattan, Houston"}, {"day": 6, "current_city": "Houston", "transportation": "-", "breakfast": "Super Bakery, Houston", "attraction": "Downtown Aquarium, Houston; Space Center Houston", "lunch": "Matchbox, Houston", "dinner": "The BrewMaster - The Mix Fine Dine, Houston", "accommodation": "Sunny and Airy near Manhattan, Houston"}, {"day": 7, "current_city": "from Houston to Harrisburg", "transportation": "Self-driving, from Houston to Harrisburg, duration: 21 hours 16 mins, distance: 2,353 km", "breakfast": "-", "attraction": "-", "lunch": "-", "dinner": "-", "accommodation": "-"}]}]