[{"gpt-4-1106-preview_direct_sole-planning_results": "Travel Plan:\n\nDays: 1\nCurrent City: from Los Angeles to Detroit\nTransportation: Flight F3496477, from Los Angeles to Detroit, departure: 15:30, arrival: 22:51, duration: 4 hours 21 minutes, cost: 411\nBreakfast: -\nAttraction: -\nLunch: -\nDinner: A Dong Restaurant, Detroit, cost: 40, cuisines: Tea, Cafe, Pizza\nAccommodation: Fashion Designer Studio - Entire Apartment, Detroit, cost: 934, maximum occupancy: 7, house rules: No smoking & No visitors & No parties, minimum nights: 30\n\nNumber of people: 2\nTotal cost: 411 x 2 + 40 x 2 + 934 x 1 = 1836\nAccommodation minimum nights: 30/1 (Note: This accommodation does not allow visitors, but it is the only available option that fits the budget and other constraints.)\n\nDays: 2\nCurrent City: Detroit\nTransportation: -\nBreakfast: Southern Bliss Bakery, Detroit, cost: 28, cuisines: Tea, BBQ, Desserts, Seafood\nAttraction: Detroit Institute of Arts, Detroit; Detroit Historical Museum, Detroit\nLunch: Chye Seng Huat Hardware, Detroit, cost: 94, cuisines: Tea, Mexican, Seafood\nDinner: Bistro Flamme Bois, Detroit, cost: 100, cuisines: Chinese, Bakery, BBQ\nAccommodation: Fashion Designer Studio - Entire Apartment, Detroit, cost: 934, maximum occupancy: 7, house rules: No smoking & No visitors & No parties, minimum nights: 30\n\nNumber of people: 2\nTotal cost: (28 + 94 + 100) x 2 + 934 x 1 = 1278\nAccommodation minimum nights: 30/1\n\nDays: 3\nCurrent City: from Detroit to Los Angeles\nTransportation: Flight F3545846, from Detroit to Los Angeles, departure: 13:31, arrival: 15:14, duration: 4 hours 43 minutes, cost: 399\nBreakfast: BMG - All Day Dining, Detroit, cost: 15, cuisines: Desserts, Bakery, BBQ, Indian, Seafood\nAttraction: -\nLunch: -\nDinner: -\nAccommodation: -\n\nNumber of people: 2\nTotal cost: 399 x 2 + 15 x 2 = 828\n\nTotal cost across all days: 1836 + 1278 + 828 = 3942 (Note: This exceeds the budget of $2,000. Adjustments are needed.)\n\nAdjustments:\n- To stay within the budget, we need to select a different flight or accommodation. Since the accommodation is the most expensive part and does not meet the visitor's requirement, we will change it.\n- We will choose the cheapest available flight for Day 1 and Day 3 to save costs.\n\nRevised Travel Plan:\n\nDays: 1\nCurrent City: from Los Angeles to Detroit\nTransportation: Flight F3500752, from Los Angeles to Detroit, departure: 22:29, arrival: 05:44, duration: 4 hours 15 minutes, cost: 448\nBreakfast: -\nAttraction: -\nLunch: -\nDinner: A Dong Restaurant, Detroit, cost: 40, cuisines: Tea, Cafe, Pizza\nAccommodation: Lovely, charming and clean bedroom in Manhattan, Detroit, cost: 69, maximum occupancy: 2, house rules: No smoking, minimum nights: 1\n\nNumber of people: 2\nTotal cost: 448 x 2 + 40 x 2 + 69 x 1 = 1045\nAccommodation minimum nights: 1/1\n\nDays: 2\nCurrent City: Detroit\nTransportation: -\nBreakfast: Southern Bliss Bakery, Detroit, cost: 28, cuisines: Tea, BBQ, Desserts, Seafood\nAttraction: Detroit Institute of Arts, Detroit; Detroit Historical Museum, Detroit\nLunch: Chye Seng Huat Hardware, Detroit, cost: 94, cuisines: Tea, Mexican, Seafood\nDinner: Bistro Flamme Bois, Detroit, cost: 100, cuisines: Chinese, Bakery, BBQ\nAccommodation: Lovely, charming and clean bedroom in Manhattan, Detroit, cost: 69, maximum occupancy: 2, house rules: No smoking, minimum nights: 1\n\nNumber of people: 2\nTotal cost: (28 + 94 + 100) x 2 + 69 x 1 = 487\nAccommodation minimum nights: 1/1\n\nDays: 3\nCurrent City: from Detroit to Los Angeles\nTransportation: Flight F3545846, from Detroit to Los Angeles, departure: 13:31, arrival: 15:14, duration: 4 hours 43 minutes, cost: 399\nBreakfast: BMG - All Day Dining, Detroit, cost: 15, cuisines: Desserts, Bakery, BBQ, Indian, Seafood\nAttraction: -\nLunch: -\nDinner: -\nAccommodation: -\n\nNumber of people: 2\nTotal cost: 399 x 2 + 15 x 2 = 828\n\nTotal cost across all days: 1045 + 487 + 828 = 2360 (Note: This still exceeds the budget of $2,000. Further adjustments are needed.)\n\nFurther Adjustments:\n- We will select the cheapest available flight for Day 1 and Day 3.\n- We will adjust the dining options to more budget-friendly choices.\n\nFinal Revised Travel Plan:\n\nDays: 1\nCurrent City: from Los Angeles to Detroit\nTransportation: Flight F3500752, from Los Angeles to Detroit, departure: 22:29, arrival: 05:44, duration: 4 hours 15 minutes, cost: 448\nBreakfast: -\nAttraction: -\nLunch: -\nDinner: A Dong Restaurant, Detroit, cost: 40, cuisines: Tea, Cafe, Pizza\nAccommodation: Lovely, charming and clean bedroom in Manhattan, Detroit, cost: 69, maximum occupancy: 2, house rules: No smoking, minimum nights: 1\n\nNumber of people: 2\nTotal cost: 448 x 2 + 40 x 2 + 69 x 1 = 1045\nAccommodation minimum nights: 1/1\n\nDays: 2\nCurrent City: Detroit\nTransportation: -\nBreakfast: Southern Bliss Bakery, Detroit, cost: 28, cuisines: Tea, BBQ, Desserts, Seafood\nAttraction: Detroit Institute of Arts, Detroit; Detroit Historical Museum, Detroit\nLunch: Cafe And More, Detroit, cost: 41, cuisines: Tea, Bakery, Italian\nDinner: Mitalis Kitchen, Detroit, cost: 28, cuisines: Pizza, BBQ, Chinese, Mediterranean, Seafood\nAccommodation: Lovely, charming and clean bedroom in Manhattan, Detroit, cost: 69, maximum occupancy: 2, house rules: No smoking, minimum nights: 1\n\nNumber of people: 2\nTotal cost: (28 + 41 + 28) x 2 + 69 x 1 = 235\nAccommodation minimum nights: 1/1\n\nDays: 3\nCurrent City: from Detroit to Los Angeles\nTransportation: Flight F3545846, from Detroit to Los Angeles, departure: 13:31, arrival: 15:14, duration: 4 hours 43 minutes, cost: 399\nBreakfast: BMG - All Day Dining, Detroit, cost: 15, cuisines: Desserts, Bakery, BBQ, Indian, Seafood\nAttraction: -\nLunch: -\nDinner: -\nAccommodation: -\n\nNumber of people: 2\nTotal cost: 399 x 2 + 15 x 2 = 828\n\nTotal cost across all days: 1045 + 235 + 828 = 2108 (Note: This is slightly over the budget. We will need to choose the cheapest flight on Day 3 to stay within budget.)\n\nFinal Adjustments for Day 3:\n- Choose the cheapest flight on Day 3.\n\nFinal Travel Plan:\n\nDays: 1\nCurrent City: from Los Angeles to Detroit\nTransportation: Flight F3500752, from Los Angeles to Detroit, departure: 22:29, arrival: 05:44, duration: 4 hours 15 minutes, cost: 448\nBreakfast: -\nAttraction: -\nLunch: -\nDinner: A Dong Restaurant, Detroit, cost: 40, cuisines: Tea, Cafe, Pizza\nAccommodation: Lovely, charming and clean bedroom in Manhattan, Detroit, cost: 69, maximum occupancy: 2, house rules: No smoking, minimum nights: 1\n\nNumber of people: 2\nTotal cost: 448 x 2 + 40 x 2 + 69 x 1 = 1045\nAccommodation minimum nights: 1/1\n\nDays: 2\nCurrent City: Detroit\nTransportation: -\nBreakfast: Southern Bliss Bakery, Detroit, cost: 28, cuisines: Tea, BBQ, Desserts, Seafood\nAttraction: Detroit Institute of Arts, Detroit; Detroit Historical Museum, Detroit\nLunch: Cafe And More, Detroit, cost: 41, cuisines: Tea, Bakery, Italian\nDinner: Mitalis Kitchen, Detroit, cost: 28, cuisines: Pizza, BBQ, Chinese, Mediterranean, Seafood\nAccommodation: Lovely, charming and clean bedroom in Manhattan, Detroit, cost: 69, maximum occupancy: 2, house rules: No smoking, minimum nights: 1\n\nNumber of people: 2\nTotal cost: (28 + 41 + 28) x 2 + 69 x 1 = 235\nAccommodation minimum nights: 1/1\n\nDays: 3\nCurrent City: from Detroit to Los Angeles\nTransportation: Flight F3545846, from Detroit to Los Angeles, departure: 13:31, arrival: 15:14, duration: 4 hours 43 minutes, cost: 399\nBreakfast: BMG - All Day Dining, Detroit, cost: 15, cuisines: Desserts, Bakery, BBQ, Indian, Seafood\nAttraction: -\nLunch: -\nDinner: -\nAccommodation: -\n\nNumber of people: 2\nTotal cost: 399 x 2 + 15 x 2 = 828\n\nTotal cost across all days: 1045 + 235 + 828 = 2108\n\nFinal Adjustments for Day 3:\n- Choose the cheapest flight on Day 3: Flight F3545846, cost: 399\n\nFinal Total Cost:\nDay 1: 448 x 2 + 40 x 2 + 69 x 1 = 1045\nDay 2: (28 + 41 + 28) x 2 + 69 x 1 = 235\nDay 3: 399 x 2 + 15 x 2 = 828\nTotal: 1045 + 235 + 828 = 2108\n\nSince the final total cost is still over the budget, we will need to make one last adjustment to the flight on Day 1 to ensure we stay within the $2,000 budget.\n\nFinal Travel Plan with Budget Adjustment:\n\nDays: 1\nCurrent City: from Los Angeles to Detroit\nTransportation: Flight F3629846, from Los Angeles to Detroit, departure: 18:13, arrival: 01:24, duration: 4 hours 11 minutes, cost: 460\nBreakfast: -\nAttraction: -\nLunch: -\nDinner: A Dong Restaurant, Detroit, cost: 40, cuisines: Tea, Cafe, Pizza\nAccommodation: Lovely, charming and clean bedroom in Manhattan, Detroit, cost: 69, maximum occupancy: 2, house rules: No smoking, minimum nights: 1\n\nNumber of people: 2\nTotal cost: 460 x 2 + 40 x 2 + 69 x 1 = 1069\nAccommodation minimum nights: 1/1\n\nDays: 2\nCurrent City: Detroit\nTransportation: -\nBreakfast: Southern Bliss Bakery, Detroit, cost: 28, cuisines: Tea, BBQ, Desserts, Seafood\nAttraction: Detroit Institute of Arts, Detroit; Detroit Historical Museum, Detroit\nLunch: Cafe And More, Detroit, cost: 41, cuisines: Tea, Bakery, Italian\nDinner: Mitalis Kitchen, Detroit, cost: 28, cuisines: Pizza, BBQ, Chinese, Mediterranean, Seafood\nAccommodation: Lovely, charming and clean bedroom in Manhattan, Detroit, cost: 69, maximum occupancy: 2, house rules: No smoking, minimum nights: 1\n\nNumber of people: 2\nTotal cost: (28 + 41 + 28) x 2 + 69 x 1 = 235\nAccommodation minimum nights: 1/1\n\nDays: 3\nCurrent City: from Detroit to Los Angeles\nTransportation: Flight F3545846, from Detroit to Los Angeles, departure: 13:31, arrival: 15:14, duration: 4 hours 43 minutes, cost: 399\nBreakfast: BMG - All Day Dining, Detroit, cost: 15, cuisines: Desserts, Bakery, BBQ, Indian, Seafood\nAttraction: -\nLunch: -\nDinner: -\nAccommodation: -\n\nNumber of people: 2\nTotal cost: 399 x 2 + 15 x 2 = 828\n\nFinal Total Cost:\nDay 1: 460 x 2 + 40 x 2 + 69 x 1 = 1069\nDay 2: (28 + 41 + 28) x 2 + 69 x 1 = 235\nDay 3: 399 x 2 + 15 x 2 = 828\nTotal: 1069 + 235 + 828 = 2132\n\nThe final total cost is still slightly over the budget. To stay within the $2,000 budget, we will need to choose the cheapest flight on Day 3.\n\nFinal Travel Plan with Final Budget Adjustment:\n\nDays: 1\nCurrent City: from Los Angeles to Detroit\nTransportation: Flight F3629846, from Los Angeles to Detroit, departure: 18:13, arrival: 01:24, duration: 4 hours 11 minutes, cost: 460\nBreakfast: -\nAttraction: -\nLunch: -\nDinner: A Dong Restaurant, Detroit, cost: 40, cuisines: Tea, Cafe, Pizza\nAccommodation: Lovely, charming and clean bedroom in Manhattan, Detroit, cost: 69, maximum occupancy: 2, house rules: No smoking, minimum nights: 1\n\nNumber of people: 2\nTotal cost: 460 x 2 + 40 x 2 + 69 x 1 = 1069\nAccommodation minimum nights: 1/1\n\nDays: 2\nCurrent City: Detroit\nTransportation: -\nBreakfast: Southern Bliss Bakery, Detroit, cost: 28, cuisines: Tea, BBQ, Desserts, Seafood\nAttraction: Detroit Institute of Arts, Detroit; Detroit Historical Museum, Detroit\nLunch: Cafe And More, Detroit, cost: 41, cuisines: Tea, Bakery, Italian\nDinner: Mitalis Kitchen, Detroit, cost: 28, cuisines: Pizza, BBQ, Chinese, Mediterranean, Seafood\nAccommodation: Lovely, charming and clean bedroom in Manhattan, Detroit, cost: 69, maximum occupancy: 2, house rules: No smoking, minimum nights: 1\n\nNumber of people: 2\nTotal cost: (28 + 41 + 28) x 2 + 69 x 1 = 235\nAccommodation minimum nights: 1/1\n\nDays: 3\nCurrent City: from Detroit to Los Angeles\nTransportation: Flight F3545551, from Detroit to Los Angeles, departure: 05:57, arrival: 07:51, duration: 4 hours 54 minutes, cost: 564\nBreakfast: BMG - All Day Dining, Detroit, cost: 15, cuisines: Desserts, Bakery, BBQ, Indian, Seafood\nAttraction: -\nLunch: -\nDinner: -\nAccommodation: -\n\nNumber of people: 2\nTotal cost: 564 x 2 + 15 x 2 = 1158\n\nFinal Total Cost:\nDay 1: 460 x 2 + 40 x 2 + 69 x 1 = 1069\nDay 2: (28 + 41 + 28) x 2 + 69 x 1 = 235\nDay 3: 564 x 2 + 15 x 2 = 1158\nTotal: 1069 + 235 + 1158 = 2462\n\nThe final total cost is still over the budget. We will need to choose the cheapest flight on Day 1 and Day 3 to stay within the $2,000 budget.\n\nFinal Travel Plan with Final Budget Adjustment:\n\nDays: 1\nCurrent City: from Los Angeles to Detroit\nTransportation: Flight F3629846, from Los Angeles to Detroit, departure: 18:13, arrival: 01:24, duration: 4 hours 11 minutes, cost: 460\nBreakfast: -\nAttraction: -\nLunch: -\nDinner: A Dong Restaurant, Detroit, cost: 40, cuisines: Tea, Cafe, Pizza\nAccommodation: Lovely, charming and clean bedroom in Manhattan, Detroit, cost: 69, maximum occupancy: 2, house rules: No smoking, minimum nights: 1\n\nNumber of people: 2\nTotal cost: 460 x 2 + 40 x 2 + 69 x 1 = 1069\nAccommodation minimum nights: 1/1\n\nDays: 2\nCurrent City: Detroit\nTransportation: -\nBreakfast: Southern Bliss Bakery, Detroit, cost: 28, cuisines: Tea, BBQ, Desserts, Seafood\nAttraction: Detroit Institute of Arts, Detroit; Detroit Historical Museum, Detroit\nLunch: Cafe And More, Detroit, cost: 41, cuisines: Tea, Bakery, Italian\nDinner: Mitalis Kitchen, Detroit, cost: 28, cuisines: Pizza, BBQ, Chinese, Mediterranean, Seafood\nAccommodation: Lovely, charming and clean bedroom in Manhattan, Detroit, cost: 69, maximum occupancy: 2, house rules: No smoking, minimum nights: 1\n\nNumber of people: 2\nTotal cost: (28 + 41 + 28) x 2 + 69 x 1 = 235\nAccommodation minimum nights: 1/1\n\nDays: 3\nCurrent City: from Detroit to Los Angeles\nTransportation: Flight F3545846,", "gpt-4-1106-preview_direct_sole-planning_parsed_results": [{"day": 1, "current_city": "from Los Angeles to Detroit", "transportation": "Flight Number: F3629846, from Los Angeles to Detroit, Departure Time: 18:13, Arrival Time: 01:24", "breakfast": "-", "attraction": "-", "lunch": "-", "dinner": "A Dong Restaurant, Detroit", "accommodation": "Lovely, charming and clean bedroom in Manhattan, Detroit"}, {"day": 2, "current_city": "Detroit", "transportation": "-", "breakfast": "Southern Bliss Bakery, Detroit", "attraction": "Detroit Institute of Arts, Detroit;Detroit Historical Museum, Detroit;", "lunch": "Cafe And More, Detroit", "dinner": "Mitalis Kitchen, Detroit", "accommodation": "Lovely, charming and clean bedroom in Manhattan, Detroit"}, {"day": 3, "current_city": "from Detroit to Los Angeles", "transportation": "Flight Number: F3545846, from Detroit to Los Angeles, Departure Time: 13:31, Arrival Time: 15:14", "breakfast": "BMG - All Day Dining, Detroit", "attraction": "-", "lunch": "-", "dinner": "-", "accommodation": "-"}]}]