[{"gpt-4-1106-preview_direct_sole-planning_results": "Travel Plan:\n\nDays: 1\nCurrent City: from Pittsburgh to Rochester\nTransportation: Self-driving, from Pittsburgh to Rochester, duration: 4 hours 11 mins, distance: 457 km, cost: 22\nBreakfast: -\nAttraction: -\nLunch: -\nDinner: Atlas World Grill, Rochester, cost: 54, cuisines: Tea, Bakery, Mexican, Pizza\nAccommodation: Artsy Bushwick NY 2 Beds with laundry & balcony, Rochester, cost: 1128, maximum occupancy: 8, house rules: No pets, minimum nights: 2\n\nNumber of people: 2\nTotal cost: 22 x 1 + 54 x 2 + 1128 x 1 = 1258\nAccommodation minimum nights: 2/2\n\nDays: 2\nCurrent City: Rochester\nTransportation: -\nBreakfast: Hotel Ravisha Continental, Rochester, cost: 43, cuisines: Cafe, Bakery, Desserts, Fast Food\nAttraction: The Strong National Museum of Play, Rochester; George Eastman Museum, Rochester\nLunch: Sree Annapoorna, cost: 52, cuisines: Tea, Cafe, Mexican\nDinner: The Fisherman's Wharf, cost: 14, cuisines: Tea, American, Mediterranean, Seafood\nAccommodation: Artsy Bushwick NY 2 Beds with laundry & balcony, Rochester, cost: 1128, maximum occupancy: 8, house rules: No pets, minimum nights: 2\n\nNumber of people: 2\nTotal cost: (43 + 52 + 14) x 2 + 1128 x 1 = 1302\nAccommodation minimum nights: 2/2\n\nDays: 3\nCurrent City: from Rochester to Niagara Falls\nTransportation: Self-driving, from Rochester to Niagara Falls, duration: 1 hour 25 mins, distance: 139 km, cost: 6\nBreakfast: Mister Mughal, Rochester, cost: 19, cuisines: Pizza, Bakery, Fast Food, Cafe, Mediterranean\nAttraction: -\nLunch: -\nDinner: Izakaya Kikufuji, Niagara Falls, cost: 66, cuisines: Desserts, Pizza, French, Fast Food, Mediterranean, Seafood\nAccommodation: Sunny Bedroom In The Heart of Bushwick, Niagara Falls, cost: 893, maximum occupancy: 2, house rules: No pets & No parties, minimum nights: 3\n\nNumber of people: 2\nTotal cost: 6 x 1 + 19 x 2 + 66 x 2 + 893 x 1 = 1069\nAccommodation minimum nights: 3/3\n\nDays: 4\nCurrent City: Niagara Falls\nTransportation: -\nBreakfast: Sri Meenakshi South Indian Food, Niagara Falls, cost: 77, cuisines: Tea, Seafood, Bakery, Italian\nAttraction: Journey Behind the Falls, Niagara Falls; Niagara SkyWheel, Niagara Falls\nLunch: Tony Roma's, cost: 47, cuisines: Desserts, Tea, French, Fast Food, Cafe, Mediterranean\nDinner: Scratch, cost: 19, cuisines: Tea, American, Seafood\nAccommodation: Sunny Bedroom In The Heart of Bushwick, Niagara Falls, cost: 893, maximum occupancy: 2, house rules: No pets & No parties, minimum nights: 3\n\nNumber of people: 2\nTotal cost: (77 + 47 + 19) x 2 + 893 x 1 = 1173\nAccommodation minimum nights: 3/3\n\nDays: 5\nCurrent City: from Niagara Falls to New York\nTransportation: Self-driving, from Niagara Falls to New York, duration: 6 hours 29 mins, distance: 657 km, cost: 32\nBreakfast: Burger Point, Niagara Falls, cost: 59, cuisines: Tea, American, BBQ\nAttraction: -\nLunch: -\nDinner: Seasons 52 Fresh Grill, New York, cost: 30, cuisines: Seafood, Indian, Desserts, Italian\nAccommodation: Beautiful and big 1BR sublet close by Central Park, New York, cost: 983, maximum occupancy: 2, house rules: No parties & No children under 10, minimum nights: 5\n\nNumber of people: 2\nTotal cost: 32 x 1 + 59 x 2 + 30 x 2 + 983 x 1 = 1196\nAccommodation minimum nights: 5/5\n\nDays: 6\nCurrent City: New York\nTransportation: -\nBreakfast: Gurgaon Hights, New York, cost: 46, cuisines: Cafe, American, Indian, Fast Food\nAttraction: Top of The Rock, New York; Empire State Building, New York\nLunch: Rambhog, cost: 95, cuisines: Tea, Seafood, Mexican, Fast Food\nDinner: Lord of the Drinks Forum, cost: 71, cuisines: Cafe, Bakery, BBQ, Chinese, Indian\nAccommodation: Beautiful and big 1BR sublet close by Central Park, New York, cost: 983, maximum occupancy: 2, house rules: No parties & No children under 10, minimum nights: 5\n\nNumber of people: 2\nTotal cost: (46 + 95 + 71) x 2 + 983 x 1 = 1408\nAccommodation minimum nights: 5/5\n\nDays: 7\nCurrent City: from New York to Pittsburgh\nTransportation: Self-driving, from New York to Pittsburgh, duration: 5 hours 57 mins, distance: 594 km, cost: 29\nBreakfast: Green Chick Chop, New York, cost: 26, cuisines: Tea, French, Cafe, Seafood\nAttraction: -\nLunch: -\nDinner: -\nAccommodation: -\n\nNumber of people: 2\nTotal cost: 29 x 1 + 26 x 2 = 81\n\nTotal cost across all days: 1258 + 1302 + 1069 + 1173 + 1196 + 1408 + 81 = 7487\n\nUnfortunately, the total cost exceeds the specified budget of $5,300. Adjustments will need to be made to the plan to reduce costs. This could include selecting more affordable accommodations, reducing meal costs, or altering the itinerary.", "gpt-4-1106-preview_direct_sole-planning_parsed_results": [{"day": 1, "current_city": "from Pittsburgh to Rochester", "transportation": "Self-driving, from Pittsburgh to Rochester, duration: 4 hours 11 mins, distance: 457 km", "breakfast": "-", "attraction": "-", "lunch": "-", "dinner": "Atlas World Grill, Rochester", "accommodation": "Artsy Bushwick NY 2 Beds with laundry & balcony, Rochester"}, {"day": 2, "current_city": "Rochester", "transportation": "-", "breakfast": "Hotel Ravisha Continental, Rochester", "attraction": "The Strong National Museum of Play, Rochester;George Eastman Museum, Rochester;", "lunch": "Sree Annapoorna, Rochester", "dinner": "The Fisherman's Wharf, Rochester", "accommodation": "Artsy Bushwick NY 2 Beds with laundry & balcony, Rochester"}, {"day": 3, "current_city": "from Rochester to Niagara Falls", "transportation": "Self-driving, from Rochester to Niagara Falls, duration: 1 hour 25 mins, distance: 139 km", "breakfast": "Mister Mughal, Rochester", "attraction": "-", "lunch": "-", "dinner": "Izakaya Kikufuji, Niagara Falls", "accommodation": "Sunny Bedroom In The Heart of Bushwick, Niagara Falls"}, {"day": 4, "current_city": "Niagara Falls", "transportation": "-", "breakfast": "Sri Meenakshi South Indian Food, Niagara Falls", "attraction": "Journey Behind the Falls, Niagara Falls;Niagara SkyWheel, Niagara Falls;", "lunch": "Tony Roma's, Niagara Falls", "dinner": "Scratch, Niagara Falls", "accommodation": "Sunny Bedroom In The Heart of Bushwick, Niagara Falls"}, {"day": 5, "current_city": "from Niagara Falls to New York", "transportation": "Self-driving, from Niagara Falls to New York, duration: 6 hours 29 mins, distance: 657 km", "breakfast": "Burger Point, Niagara Falls", "attraction": "-", "lunch": "-", "dinner": "Seasons 52 Fresh Grill, New York", "accommodation": "Beautiful and big 1BR sublet close by Central Park, New York"}, {"day": 6, "current_city": "New York", "transportation": "-", "breakfast": "Gurgaon Hights, New York", "attraction": "Top of The Rock, New York;Empire State Building, New York;", "lunch": "Rambhog, New York", "dinner": "Lord of the Drinks Forum, New York", "accommodation": "Beautiful and big 1BR sublet close by Central Park, New York"}, {"day": 7, "current_city": "from New York to Pittsburgh", "transportation": "Self-driving, from New York to Pittsburgh, duration: 5 hours 57 mins, distance: 594 km", "breakfast": "Green Chick Chop, New York", "attraction": "-", "lunch": "-", "dinner": "-", "accommodation": "-"}]}]