[{"gpt-4-1106-preview_direct_sole-planning_results": "Travel Plan:\nDays: 1\nCurrent City: from Milwaukee to New York\nTransportation: Flight F3643145, from Milwaukee to New York, duration: 2 hours 22 minutes, cost: 226\nBreakfast: -\nAttraction: -\nLunch: -\nDinner: Seasons 52 Fresh Grill, New York, cost: 30, cuisines: Seafood, Indian, Desserts, Italian\nAccommodation: Versatile private room in Harlem/Hamilton Heights!, New York, cost: 398, room type: Private room, maximum occupancy: 1, house rules: No pets & No visitors & No parties, minimum nights: 4\n\nNumber of people: 2\nTotal cost: 226 x 2 + 30 x 2 + 398 x 1 = 910\nAccommodation minimum nights: 4/1\n\nDays: 2\nCurrent City: New York\nTransportation: -\nBreakfast: Green Chick Chop, New York, cost: 26, cuisines: Tea, French, Cafe, Seafood\nAttraction: Central Park, New York; Statue of Liberty, New York\nLunch: Lord of the Drinks Forum, New York, cost: 71, cuisines: Cafe, Bakery, BBQ, Chinese, Indian\nDinner: Goosebumps, New York, cost: 94, cuisines: Chinese, Pizza, Bakery\nAccommodation: Versatile private room in Harlem/Hamilton Heights!, New York, cost: 398, room type: Private room, maximum occupancy: 1, house rules: No pets & No visitors & No parties, minimum nights: 4\n\nNumber of people: 2\nTotal cost: (26 + 71 + 94) x 2 + 398 x 1 = 780\nAccommodation minimum nights: 4/2\n\nDays: 3\nCurrent City: from New York to Milwaukee\nTransportation: Flight F3644990, from New York to Milwaukee, duration: 2 hours 7 minutes, cost: 218\nBreakfast: Sir John Bakery Cafe, New York, cost: 78, cuisines: Pizza, Bakery, Desserts\nAttraction: -\nLunch: -\nDinner: -\nAccommodation: -\n\nNumber of people: 2\nTotal cost: 218 x 2 + 78 x 2 = 592\n\nTotal cost across all days: 910 + 780 + 592 = 2,282\n\nUnfortunately, the total cost exceeds the specified budget of $1,900. To adjust the plan within the budget, we can change the transportation method from flights to self-driving, which costs significantly less.\n\nRevised Travel Plan:\nDays: 1\nCurrent City: from Milwaukee to New York\nTransportation: Self-driving, from Milwaukee to New York, duration: 13 hours 29 mins, distance: 1,417 km, cost: 70\nBreakfast: -\nAttraction: -\nLunch: -\nDinner: Seasons 52 Fresh Grill, New York, cost: 30, cuisines: Seafood, Indian, Desserts, Italian\nAccommodation: Versatile private room in Harlem/Hamilton Heights!, New York, cost: 398, room type: Private room, maximum occupancy: 1, house rules: No pets & No visitors & No parties, minimum nights: 4\n\nNumber of people: 2\nTotal cost: 70 x 1 + 30 x 2 + 398 x 1 = 528\nAccommodation minimum nights: 4/1\n\nDays: 2\nCurrent City: New York\nTransportation: -\nBreakfast: Green Chick Chop, New York, cost: 26, cuisines: Tea, French, Cafe, Seafood\nAttraction: Central Park, New York; Statue of Liberty, New York\nLunch: Lord of the Drinks Forum, New York, cost: 71, cuisines: Cafe, Bakery, BBQ, Chinese, Indian\nDinner: Goosebumps, New York, cost: 94, cuisines: Chinese, Pizza, Bakery\nAccommodation: Versatile private room in Harlem/Hamilton Heights!, New York, cost: 398, room type: Private room, maximum occupancy: 1, house rules: No pets & No visitors & No parties, minimum nights: 4\n\nNumber of people: 2\nTotal cost: (26 + 71 + 94) x 2 + 398 x 1 = 780\nAccommodation minimum nights: 4/2\n\nDays: 3\nCurrent City: from New York to Milwaukee\nTransportation: Self-driving, from New York to Milwaukee, duration: 13 hours 28 mins, distance: 1,417 km, cost: 70\nBreakfast: Sir John Bakery Cafe, New York, cost: 78, cuisines: Pizza, Bakery, Desserts\nAttraction: -\nLunch: -\nDinner: -\nAccommodation: -\n\nNumber of people: 2\nTotal cost: 70 x 1 + 78 x 2 = 226\n\nTotal cost across all days: 528 + 780 + 226 = 1,534\n\nThe revised total cost is now within the specified budget of $1,900.", "gpt-4-1106-preview_direct_sole-planning_parsed_results": [{"day": 1, "current_city": "from Milwaukee to New York", "transportation": "Self-driving, from Milwaukee to New York, duration: 13 hours 29 mins, distance: 1,417 km", "breakfast": "-", "attraction": "-", "lunch": "-", "dinner": "Seasons 52 Fresh Grill, New York", "accommodation": "Versatile private room in Harlem/Hamilton Heights!, New York"}, {"day": 2, "current_city": "New York", "transportation": "-", "breakfast": "Green Chick Chop, New York", "attraction": "Central Park, New York;Statue of Liberty, New York;", "lunch": "Lord of the Drinks Forum, New York", "dinner": "Goosebumps, New York", "accommodation": "Versatile private room in Harlem/Hamilton Heights!, New York"}, {"day": 3, "current_city": "from New York to Milwaukee", "transportation": "Self-driving, from New York to Milwaukee, duration: 13 hours 28 mins, distance: 1,417 km", "breakfast": "Sir John Bakery Cafe, New York", "attraction": "-", "lunch": "-", "dinner": "-", "accommodation": "-"}]}]