[{"gpt-4-1106-preview_direct_sole-planning_results": "Travel Plan:\n\nDays: 1\nCurrent City: from Reno to Abilene\nTransportation: Self-driving, from Reno to Abilene, duration: 22 hours 27 mins, distance: 2,412 km, cost: 120\nBreakfast: -\nAttraction: -\nLunch: -\nDinner: Thai Garden, Abilene, cost: 26, cuisines: Cafe, American, Desserts\nAccommodation: Apartment minutes from manhattan, Entire home/apt, No pets & No visitors, cost: 295, minimum nights: 2, maximum occupancy: 2\n\nNumber of people: 2\nTotal cost: 120 x 1 + (26 x 2) + 295 x 1 = 467\nAccommodation minimum nights: 2/2\n\nDays: 2\nCurrent City: Abilene\nTransportation: -\nBreakfast: Cakes Degree, Abilene, cost: 36, cuisines: Cafe, Mexican, BBQ, Desserts\nAttraction: The Grace Museum, Abilene; Frontier Texas!, Abilene\nLunch: Mediumwelldone, Abilene, cost: 182, cuisines: Tea, French, BBQ, Cafe, Seafood\nDinner: Crispy Crust, Abilene, cost: 108, cuisines: Desserts, Bakery, Cafe, American, Seafood\nAccommodation: Apartment minutes from manhattan, Entire home/apt, No pets & No visitors, cost: 295, minimum nights: 2, maximum occupancy: 2\n\nNumber of people: 2\nTotal cost: (36 + 182 + 108) x 2 + 295 x 1 = 839\nAccommodation minimum nights: 2/2\n\nDays: 3\nCurrent City: from Abilene to Amarillo\nTransportation: Self-driving, from Abilene to Amarillo, duration: 4 hours 10 mins, distance: 446 km, cost: 22\nBreakfast: -\nAttraction: -\nLunch: -\nDinner: The Cinnamon Kitchen, Amarillo, cost: 138, cuisines: Desserts, Tea, Pizza, Chinese, Seafood\nAccommodation: Harlem Humble Abode - 1 bedroom - Cute and Quaint, Entire home/apt, No pets, cost: 409, minimum nights: 5, maximum occupancy: 3\n\nNumber of people: 2\nTotal cost: 22 x 1 + (138 x 2) + 409 x 1 = 707\nAccommodation minimum nights: 5/5\n\nDays: 4\nCurrent City: Amarillo\nTransportation: -\nBreakfast: Wood Box Cafe, Amarillo, cost: 22, cuisines: Desserts, French, Fast Food, Cafe, American\nAttraction: Cadillac Ranch, Amarillo; Amarillo Botanical Gardens, Amarillo\nLunch: Sigree Global Grill, Amarillo, cost: 70, cuisines: Chinese, BBQ, Cafe, Desserts\nDinner: Komachi, Amarillo, cost: 142, cuisines: Desserts, Tea, Fast Food, Chinese, Mediterranean\nAccommodation: Harlem Humble Abode - 1 bedroom - Cute and Quaint, Entire home/apt, No pets, cost: 409, minimum nights: 5, maximum occupancy: 3\n\nNumber of people: 2\nTotal cost: (22 + 70 + 142) x 2 + 409 x 1 = 855\nAccommodation minimum nights: 5/5\n\nDays: 5\nCurrent City: from Amarillo to Lubbock\nTransportation: Self-driving, from Amarillo to Lubbock, duration: 1 hour 47 mins, distance: 197 km, cost: 9\nBreakfast: -\nAttraction: -\nLunch: -\nDinner: Paris 6 Classique, Lubbock, cost: 182, cuisines: Desserts, Cafe, Pizza, Mexican, BBQ, Chinese\nAccommodation: Private bedroom in UWS Apartment, Private room, No visitors & No pets, cost: 709, minimum nights: 2, maximum occupancy: 2\n\nNumber of people: 2\nTotal cost: 9 x 1 + (182 x 2) + 709 x 1 = 1082\nAccommodation minimum nights: 2/2\n\nDays: 6\nCurrent City: Lubbock\nTransportation: -\nBreakfast: Assam Tea Corner, Lubbock, cost: 104, cuisines: Desserts, BBQ, Fast Food, American, Seafood\nAttraction: Buddy Holly Center, Lubbock; National Ranching Heritage Center, Lubbock\nLunch: The Town House Cafe, Lubbock, cost: 180, cuisines: Tea, American, BBQ, Cafe, Indian, Seafood\nDinner: Sultanat, Lubbock, cost: 144, cuisines: Chinese, Bakery, BBQ, Cafe\nAccommodation: Private bedroom in UWS Apartment, Private room, No visitors & No pets, cost: 709, minimum nights: 2, maximum occupancy: 2\n\nNumber of people: 2\nTotal cost: (104 + 180 + 144) x 2 + 709 x 1 = 1471\nAccommodation minimum nights: 2/2\n\nDays: 7\nCurrent City: from Lubbock to Reno\nTransportation: Self-driving, from Lubbock to Reno, duration: 20 hours 3 mins, distance: 2,145 km, cost: 107\nBreakfast: -\nAttraction: -\nLunch: -\nDinner: -\nAccommodation: -\n\nNumber of people: 2\nTotal cost: 107 x 1 = 107\n\nTotal cost across all days: 467 + 839 + 707 + 855 + 1082 + 1471 + 107 = 5528\n\nCuisines: The prompt specifies Chinese, French, American, and Mediterranean, all cuisine constraints are satisfied.\n\nNote: The total cost exceeds the specified budget of $4,300. Adjustments to the plan, such as changing accommodations or meal choices, may be necessary to meet the budget constraint.", "gpt-4-1106-preview_direct_sole-planning_parsed_results": [{"day": 1, "current_city": "from Reno to Abilene", "transportation": "Self-driving, from Reno to Abilene, duration: 22 hours 27 mins, distance: 2,412 km", "breakfast": "-", "attraction": "-", "lunch": "-", "dinner": "Thai Garden, Abilene", "accommodation": "Apartment minutes from manhattan, Abilene"}, {"day": 2, "current_city": "Abilene", "transportation": "-", "breakfast": "Cakes Degree, Abilene", "attraction": "The Grace Museum, Abilene;Frontier Texas!, Abilene;", "lunch": "Mediumwelldone, Abilene", "dinner": "Crispy Crust, Abilene", "accommodation": "Apartment minutes from manhattan, Abilene"}, {"day": 3, "current_city": "from Abilene to Amarillo", "transportation": "Self-driving, from Abilene to Amarillo, duration: 4 hours 10 mins, distance: 446 km", "breakfast": "-", "attraction": "-", "lunch": "-", "dinner": "The Cinnamon Kitchen, Amarillo", "accommodation": "Harlem Humble Abode, Amarillo"}, {"day": 4, "current_city": "Amarillo", "transportation": "-", "breakfast": "Wood Box Cafe, Amarillo", "attraction": "Cadillac Ranch, Amarillo;Amarillo Botanical Gardens, Amarillo;", "lunch": "Sigree Global Grill, Amarillo", "dinner": "Komachi, Amarillo", "accommodation": "Harlem Humble Abode, Amarillo"}, {"day": 5, "current_city": "from Amarillo to Lubbock", "transportation": "Self-driving, from Amarillo to Lubbock, duration: 1 hour 47 mins, distance: 197 km", "breakfast": "-", "attraction": "-", "lunch": "-", "dinner": "Paris 6 Classique, Lubbock", "accommodation": "Private bedroom in UWS Apartment, Lubbock"}, {"day": 6, "current_city": "Lubbock", "transportation": "-", "breakfast": "Assam Tea Corner, Lubbock", "attraction": "Buddy Holly Center, Lubbock;National Ranching Heritage Center, Lubbock;", "lunch": "The Town House Cafe, Lubbock", "dinner": "Sultanat, Lubbock", "accommodation": "Private bedroom in UWS Apartment, Lubbock"}, {"day": 7, "current_city": "from Lubbock to Reno", "transportation": "Self-driving, from Lubbock to Reno, duration: 20 hours 3 mins, distance: 2,145 km", "breakfast": "-", "attraction": "-", "lunch": "-", "dinner": "-", "accommodation": "-"}]}]