[{"gpt-4-1106-preview_direct_sole-planning_results": "Travel Plan:\n\nDays: 1\nCurrent City: from Washington to Buffalo\nTransportation: Flight F3791094, from Washington to Buffalo, duration: 1 hours 29 minutes, cost: 61\nBreakfast: -\nAttraction: -\nLunch: -\nDinner: Shokitini, Buffalo, cost: 41, cuisines: Tea, Cafe, Pizza, Mexican, Chinese, Seafood\nAccommodation: Entire, Immaculate 1-Bedroom CHELSEA APARTMENT, Buffalo, cost: 309, room type: Entire home/apt, maximum occupancy: 2, house rules: No smoking & No pets & No parties, minimum nights: 2\n\nNumber of people: 7\nTotal cost: 61 x 7 + 41 x 7 + 309 x 4 = 427 + 287 + 1236 = 1950\nAccommodation minimum nights: 2/2\n\nDays: 2\nCurrent City: Buffalo\nTransportation: -\nBreakfast: Punjab Grill, Buffalo, cost: 25, cuisines: Bakery, BBQ, Desserts, Seafood\nAttraction: The Buffalo Zoo, Buffalo; Buffalo Naval Park, Buffalo\nLunch: Tibby's New Orleans Kitchen, Buffalo, cost: 48, cuisines: Seafood, Indian, BBQ, Italian\nDinner: Pinch Of Spice, Buffalo, cost: 84, cuisines: Cafe, Desserts, Seafood\nAccommodation: Entire, Immaculate 1-Bedroom CHELSEA APARTMENT, Buffalo, cost: 309, room type: Entire home/apt, maximum occupancy: 2, house rules: No smoking & No pets & No parties, minimum nights: 2\n\nNumber of people: 7\nTotal cost: (25 + 48 + 84) x 7 + 309 x 4 = 157 x 7 + 1236 = 1099 + 1236 = 2335\nAccommodation minimum nights: 2/2\n\nDays: 3\nCurrent City: from Buffalo to New York\nTransportation: Flight F3644292, from Buffalo to New York, duration: 1 hours 9 minutes, cost: 77\nBreakfast: -\nAttraction: -\nLunch: -\nDinner: Seasons 52 Fresh Grill, New York, cost: 30, cuisines: Seafood, Indian, Desserts, Italian\nAccommodation: A Contemporary Homelike Stay in the Best of BK, New York, cost: 228, room type: Entire home/apt, maximum occupancy: 2, house rules: No pets & No visitors & No children under 10, minimum nights: 2\n\nNumber of people: 7\nTotal cost: 77 x 7 + 30 x 7 + 228 x 4 = 539 + 210 + 912 = 1661\nAccommodation minimum nights: 2/2\n\nDays: 4\nCurrent City: New York\nTransportation: -\nBreakfast: Lord of the Drinks Forum, New York, cost: 71, cuisines: Cafe, Bakery, BBQ, Chinese, Indian\nAttraction: Statue of Liberty, New York; Central Park, New York\nLunch: Gurgaon Hights, New York, cost: 46, cuisines: Cafe, American, Indian, Fast Food\nDinner: G Dot, New York, cost: 75, cuisines: Cafe, Mexican, BBQ\nAccommodation: A Contemporary Homelike Stay in the Best of BK, New York, cost: 228, room type: Entire home/apt, maximum occupancy: 2, house rules: No pets & No visitors & No children under 10, minimum nights: 2\n\nNumber of people: 7\nTotal cost: (71 + 46 + 75) x 7 + 228 x 4 = 192 x 7 + 912 = 1344 + 912 = 2256\nAccommodation minimum nights: 2/2\n\nDays: 5\nCurrent City: from New York to Washington\nTransportation: Flight F3661892, from New York to Washington, duration: 1 hours 14 minutes, cost: 64\nBreakfast: -\nAttraction: -\nLunch: -\nDinner: -\nAccommodation: -\n\nNumber of people: 7\nTotal cost: 64 x 7 = 448\n\nTotal cost across all days: 1950 + 2335 + 1661 + 2256 + 448 = 8650\nCuisines: American, Mexican, Chinese, Italian - all cuisine constraints are satisfied\n\nNote: The accommodation has been booked for the minimum required nights, and the total cost is within the specified budget of $9,100. The travel plan includes a variety of cuisines as requested, and the transportation method does not include self-driving. Each city is visited consecutively without repetition, except for the starting and ending city, Washington. The plan includes details for transportation, meals, attractions, and accommodation for each day, adhering to the constraints provided.", "gpt-4-1106-preview_direct_sole-planning_parsed_results": [{"day": 1, "current_city": "from Washington to Buffalo", "transportation": "Flight Number: F3791094, from Washington to Buffalo, Departure Time: -, Arrival Time: -", "breakfast": "-", "attraction": "-", "lunch": "-", "dinner": "Shokitini, Buffalo", "accommodation": "Entire, Immaculate 1-Bedroom CHELSEA APARTMENT, Buffalo"}, {"day": 2, "current_city": "Buffalo", "transportation": "-", "breakfast": "Punjab Grill, Buffalo", "attraction": "The Buffalo Zoo, Buffalo;Buffalo Naval Park, Buffalo;", "lunch": "Tibby's New Orleans Kitchen, Buffalo", "dinner": "Pinch Of Spice, Buffalo", "accommodation": "Entire, Immaculate 1-Bedroom CHELSEA APARTMENT, Buffalo"}, {"day": 3, "current_city": "from Buffalo to New York", "transportation": "Flight Number: F3644292, from Buffalo to New York, Departure Time: -, Arrival Time: -", "breakfast": "-", "attraction": "-", "lunch": "-", "dinner": "Seasons 52 Fresh Grill, New York", "accommodation": "A Contemporary Homelike Stay in the Best of BK, New York"}, {"day": 4, "current_city": "New York", "transportation": "-", "breakfast": "Lord of the Drinks Forum, New York", "attraction": "Statue of Liberty, New York;Central Park, New York;", "lunch": "Gurgaon Hights, New York", "dinner": "G Dot, New York", "accommodation": "A Contemporary Homelike Stay in the Best of BK, New York"}, {"day": 5, "current_city": "from New York to Washington", "transportation": "Flight Number: F3661892, from New York to Washington, Departure Time: -, Arrival Time: -", "breakfast": "-", "attraction": "-", "lunch": "-", "dinner": "-", "accommodation": "-"}]}]