[{"gpt-4-1106-preview_direct_sole-planning_results": "Travel Plan:\n\nDays: 1\nCurrent City: from Pittsburgh to Baltimore\nTransportation: Self-driving, from Pittsburgh to Baltimore, duration: 3 hours 58 mins, distance: 400 km, cost: 20\nBreakfast: -\nAttraction: National Aquarium, Baltimore; The Walters Art Museum, Baltimore\nLunch: Los Pablos, Baltimore, cost: 47, cuisines: Indian, BBQ, Cafe, American, Seafood\nDinner: Mr. Dunderbak's Biergarten and Marketplatz, Baltimore, cost: 74, cuisines: Cafe, Pizza, American\nAccommodation: Contemporary Home Away from Home, Entire house, Baltimore, cost: 290, maximum occupancy: 2, house rules: No visitors, minimum nights: 2\n\nNumber of people: 1\nTotal cost: 20 + 47 + 74 + 290 = 431\nAccommodation minimum nights: 1/2\n\nDays: 2\nCurrent City: Baltimore\nTransportation: -\nBreakfast: The Thai Bowl, Baltimore, cost: 66, cuisines: BBQ, Pizza, Desserts, Italian\nAttraction: Fort McHenry National Monument and Historic Shrine, Baltimore; Baltimore Museum of Industry, Baltimore\nLunch: Salt, Baltimore, cost: 56, cuisines: Tea, Bakery, Fast Food, Chinese, American\nDinner: Tresind - Nassima Royal Hotel, Baltimore, cost: 67, cuisines: Cafe, Pizza, American, Desserts\nAccommodation: Contemporary Home Away from Home, Entire house, Baltimore, cost: 290, maximum occupancy: 2, house rules: No visitors, minimum nights: 2\n\nNumber of people: 1\nTotal cost: 66 + 56 + 67 + 290 = 479\nAccommodation minimum nights: 2/2\n\nDays: 3\nCurrent City: from Baltimore to Pittsburgh\nTransportation: Self-driving, from Baltimore to Pittsburgh, duration: 3 hours 58 mins, distance: 398 km, cost: 19\nBreakfast: Three Dots & A Dash, Baltimore, cost: 47, cuisines: Cafe, Chinese, Mediterranean, Seafood\nAttraction: Historic Ships in Baltimore, Baltimore\nLunch: -\nDinner: -\nAccommodation: -\n\nNumber of people: 1\nTotal cost: 19 + 47 = 66\n\nTotal cost across all days: 431 + 479 + 66 = 976\nCuisines: Variety of cuisines including American, Italian, Chinese, and Seafood\n\nConstraints Met:\n- The travel plan starts and ends in Pittsburgh, forming a closed circle.\n- Each city appears consecutively without reappearing once its sequence is over.\n- All cities are real and mapped to their correct states.\n- All required details are included for each day of the trip.\n- No restaurant or attraction is repeated.\n- Transportation methods do not conflict and correspond correctly to the specified cities.\n- The city in the current day matches the city listed in meals and attractions.\n- Each day\u2019s accommodation matches the final city listed for that day.\n- The number of visiting cities matches the specified visiting city number in the query (1 city: Baltimore).\n- The number of days in the plan matches the specified number of days in the query (3 days).\n- At least 50% of required details are provided for each day.\n- Only valid transportation modes are used (self-driving), and no flights are included.\n- Accommodations adhere to the specified room type constraints (no shared rooms).\n- The total cost of the travel plan does not exceed the specified budget ($1,200).\n- All meals are within the destination city, Baltimore, and not in the origin city, Pittsburgh.\n- Availability and details of all flights, accommodations, and restaurants are assumed to be accurate and feasible within the travel dates and locations.\n- Consistency and accuracy in city names and other relevant location information are maintained.", "gpt-4-1106-preview_direct_sole-planning_parsed_results": [{"day": 1, "current_city": "from Pittsburgh to Baltimore", "transportation": "Self-driving, from Pittsburgh to Baltimore, duration: 3 hours 58 mins, distance: 400 km", "breakfast": "-", "attraction": "National Aquarium, Baltimore;The Walters Art Museum, Baltimore;", "lunch": "Los Pablos, Baltimore", "dinner": "Mr. Dunderbak's Biergarten and Marketplatz, Baltimore", "accommodation": "Contemporary Home Away from Home, Baltimore"}, {"day": 2, "current_city": "Baltimore", "transportation": "-", "breakfast": "The Thai Bowl, Baltimore", "attraction": "Fort McHenry National Monument and Historic Shrine, Baltimore;Baltimore Museum of Industry, Baltimore;", "lunch": "Salt, Baltimore", "dinner": "Tresind - Nassima Royal Hotel, Baltimore", "accommodation": "Contemporary Home Away from Home, Baltimore"}, {"day": 3, "current_city": "from Baltimore to Pittsburgh", "transportation": "Self-driving, from Baltimore to Pittsburgh, duration: 3 hours 58 mins, distance: 398 km", "breakfast": "Three Dots & A Dash, Baltimore", "attraction": "Historic Ships in Baltimore, Baltimore", "lunch": "-", "dinner": "-", "accommodation": "-"}]}]