[{"gpt-4-1106-preview_direct_sole-planning_results": "Travel Plan:\n\nDays: 1\nCurrent City: from Houston to Pensacola\nTransportation: Flight F3855861, from Houston to Pensacola, duration: 1 hour 27 minutes, cost: $100 per person\nBreakfast: -\nAttraction: Historic Pensacola Village, Pensacola; Pensacola Museum of Art, Pensacola\nLunch: Frog Hollow Tavern, Pensacola, cost: $20, cuisines: American, BBQ, Fast Food, Cafe, Indian\nDinner: Blue Point Grill, Pensacola, cost: $75, cuisines: French, Indian, Cafe, Desserts\nAccommodation: Luxury East Village Penthouse With Private Deck, Pensacola, cost: $697, room type: Entire home/apt, house rules: No visitors, minimum nights: 2, maximum occupancy: 6\n\nNumber of people: 2\nTotal cost: ($100 * 2) + ($20 + $75) * 2 + $697 = $987\nAccommodation minimum nights: 1/2\n\nDays: 2\nCurrent City: Pensacola\nTransportation: Taxi within Pensacola, estimated cost: $50\nBreakfast: Berry Patch Restaurant, Pensacola, cost: $13, cuisines: Bakery, BBQ, Desserts, Seafood\nAttraction: Palafox Street Downtown Pensacola; Plaza De Luna Memorial Monument, Pensacola\nLunch: Jain Coffee House, Pensacola, cost: $41, cuisines: Cafe, Indian, Mediterranean, BBQ\nDinner: Nizam's Kathi Kabab, Pensacola, cost: $32, cuisines: Desserts, BBQ, Fast Food, American, Mediterranean\nAccommodation: Luxury East Village Penthouse With Private Deck, Pensacola, cost: $697, room type: Entire home/apt, house rules: No visitors, minimum nights: 2, maximum occupancy: 6\n\nNumber of people: 2\nTotal cost: $50 + ($13 + $41 + $32) * 2 + $697 = $869\nAccommodation minimum nights: 2/2\n\nDays: 3\nCurrent City: from Pensacola to Houston\nTransportation: Flight F3890675, from Pensacola to Houston, duration: 1 hour 34 minutes, cost: $128 per person\nBreakfast: Eggspectation - Jaypee Siddharth, Pensacola, cost: $25, cuisines: Cafe, BBQ, Italian\nAttraction: The Graffiti Bridge, Pensacola\nLunch: -\nDinner: -\nAccommodation: -\n\nNumber of people: 2\nTotal cost: ($128 * 2) + $25 * 2 = $306\n\nTotal cost across all days: $987 + $869 + $306 = $2,162\n\nHowever, the total cost exceeds the specified budget of $1,400. To adjust the plan within the budget, we need to make some changes:\n\nRevised Travel Plan:\n\nDays: 1\nCurrent City: from Houston to Pensacola\nTransportation: Flight F3855861, from Houston to Pensacola, duration: 1 hour 27 minutes, cost: $100 per person\nBreakfast: -\nAttraction: Historic Pensacola Village, Pensacola; Pensacola Museum of Art, Pensacola\nLunch: Frog Hollow Tavern, Pensacola, cost: $20, cuisines: American, BBQ, Fast Food, Cafe, Indian\nDinner: Berry Patch Restaurant, Pensacola, cost: $13, cuisines: Bakery, BBQ, Desserts, Seafood\nAccommodation: Amazing apartment near museum, gardens & park!, Pensacola, cost: $74, room type: Entire home/apt, house rules: No parties, minimum nights: 1, maximum occupancy: 3\n\nNumber of people: 2\nTotal cost: ($100 * 2) + ($20 + $13) * 2 + $74 = $340\nAccommodation minimum nights: 1/1\n\nDays: 2\nCurrent City: Pensacola\nTransportation: Taxi within Pensacola, estimated cost: $50\nBreakfast: Watershed Cafe, Pensacola, cost: $12, cuisines: Chinese, BBQ, Desserts\nAttraction: Palafox Street Downtown Pensacola; Plaza De Luna Memorial Monument, Pensacola\nLunch: Jain Coffee House, Pensacola, cost: $41, cuisines: Cafe, Indian, Mediterranean, BBQ\nDinner: Chicago Pizza, Pensacola, cost: $32, cuisines: Pizza, Mediterranean, Fast Food\nAccommodation: Amazing apartment near museum, gardens & park!, Pensacola, cost: $74, room type: Entire home/apt, house rules: No parties, minimum nights: 1, maximum occupancy: 3\n\nNumber of people: 2\nTotal cost: $50 + ($12 + $41 + $32) * 2 + $74 = $294\nAccommodation minimum nights: 1/1\n\nDays: 3\nCurrent City: from Pensacola to Houston\nTransportation: Flight F3890675, from Pensacola to Houston, duration: 1 hour 34 minutes, cost: $128 per person\nBreakfast: -\nAttraction: -\nLunch: -\nDinner: -\nAccommodation: -\n\nNumber of people: 2\nTotal cost: $128 * 2 = $256\n\nTotal revised cost across all days: $340 + $294 + $256 = $890\n\nCuisines: The prompt specifies Indian, American, Chinese, and Italian.\nThe revised travel plan is now within the specified budget of $1,400.", "gpt-4-1106-preview_direct_sole-planning_parsed_results": [{"day": 1, "current_city": "from Houston to Pensacola", "transportation": "Flight Number: F3855861, from Houston to Pensacola, Departure Time: -, Arrival Time: -", "breakfast": "-", "attraction": "Historic Pensacola Village, Pensacola;Pensacola Museum of Art, Pensacola;", "lunch": "Frog Hollow Tavern, Pensacola", "dinner": "Berry Patch Restaurant, Pensacola", "accommodation": "Amazing apartment near museum, gardens & park!, Pensacola"}, {"day": 2, "current_city": "Pensacola", "transportation": "-", "breakfast": "Watershed Cafe, Pensacola", "attraction": "Palafox Street Downtown Pensacola;Plaza De Luna Memorial Monument, Pensacola;", "lunch": "Jain Coffee House, Pensacola", "dinner": "Chicago Pizza, Pensacola", "accommodation": "Amazing apartment near museum, gardens & park!, Pensacola"}, {"day": 3, "current_city": "from Pensacola to Houston", "transportation": "Flight Number: F3890675, from Pensacola to Houston, Departure Time: -, Arrival Time: -", "breakfast": "-", "attraction": "-", "lunch": "-", "dinner": "-", "accommodation": "-"}]}]