[{"gpt-4-1106-preview_direct_sole-planning_results": "Travel Plan:\n\nDays: 1\nCurrent City: from Richmond to Houston, Texas\nTransportation: Self-driving, from Richmond to Houston, duration: 19 hours 11 mins, distance: 2,131 km, cost: 106\nBreakfast: -\nAttraction: -\nLunch: -\nDinner: Jalapenos, Houston, cost: 57, cuisines: Desserts, Tea, Cafe, Chinese, Seafood\nAccommodation: Sunny and Airy near Manhattan, Houston, cost: 499, room type: Entire home/apt, house rules: No pets, minimum nights: 2, maximum occupancy: 4\n\nNumber of people: 2\nTotal cost: 106 + 57 * 2 + 499 = 719\nAccommodation minimum nights: 1/2\n\nDays: 2\nCurrent City: Houston, Texas\nTransportation: -\nBreakfast: Super Bakery, Houston, cost: 30, cuisines: Seafood, Fast Food\nAttraction: Space Center Houston, Houston; Houston Museum of Natural Science, Houston\nLunch: Sheetla Dhaba, Houston, cost: 35, cuisines: Desserts, Pizza, Bakery, American, Mediterranean\nDinner: The BrewMaster - The Mix Fine Dine, Houston, cost: 52, cuisines: French, Indian, Cafe, Seafood\nAccommodation: Sunny and Airy near Manhattan, Houston, cost: 499, room type: Entire home/apt, house rules: No pets, minimum nights: 2, maximum occupancy: 4\n\nNumber of people: 2\nTotal cost: (30 + 35 + 52) * 2 + 499 = 733\nAccommodation minimum nights: 2/2\n\nDays: 3\nCurrent City: from Houston to Texarkana, Texas\nTransportation: Self-driving, from Houston to Texarkana, duration: 4 hours 44 mins, distance: 467 km, cost: 23\nBreakfast: Vinayaka Mylari, Houston, cost: 14, cuisines: Fast Food, French, Cafe, Italian\nAttraction: Museum of Regional History, Texarkana; Ace of Clubs House, Texarkana\nLunch: Columbia Restaurant, Texarkana, cost: 91, cuisines: Desserts, Tea, Pizza, Indian, Seafood\nDinner: Polka Pastry & Snack Bar, Texarkana, cost: 71, cuisines: Fast Food, BBQ, Italian\nAccommodation: Large 2.5 BR Apt In Park Slope, Texarkana, cost: 269, room type: Entire home/apt, house rules: No smoking & No visitors, minimum nights: 1, maximum occupancy: 3\n\nNumber of people: 2\nTotal cost: 23 + (14 + 91 + 71) * 2 + 269 = 644\nAccommodation minimum nights: 1/1\n\nDays: 4\nCurrent City: Texarkana, Texas\nTransportation: -\nBreakfast: Big City Bread Cafe, Texarkana, cost: 61, cuisines: Cafe, Pizza, Bakery, BBQ\nAttraction: Discovery Place Interactive Museum, Texarkana; Spring Lake Park, Texarkana\nLunch: Teasta, Texarkana, cost: 94, cuisines: Pizza, Italian, French, Bakery, Cafe, Seafood\nDinner: Granma's Homemade, Texarkana, cost: 57, cuisines: Tea, Mexican, Bakery, Cafe, Seafood\nAccommodation: Large 2.5 BR Apt In Park Slope, Texarkana, cost: 269, room type: Entire home/apt, house rules: No smoking & No visitors, minimum nights: 1, maximum occupancy: 3\n\nNumber of people: 2\nTotal cost: (61 + 94 + 57) * 2 + 269 = 643\nAccommodation minimum nights: 1/1\n\nDays: 5\nCurrent City: from Texarkana to Richmond\nTransportation: Self-driving, from Texarkana to Richmond, duration: 16 hours 8 mins, distance: 1,773 km, cost: 88\nBreakfast: -\nAttraction: -\nLunch: -\nDinner: -\nAccommodation: -\n\nNumber of people: 2\nTotal cost: 88\n\nTotal cost across all days: 719 + 733 + 644 + 643 + 88 = 2,827\nCuisines: The prompt specifies Chinese and Indian.\n\nNote: The travel plan adheres to the constraints provided, including the budget, cuisine preferences, and no flights for transportation. The accommodations are booked for the required minimum nights, and the attractions and restaurants are within the destination cities. The total cost is well within the specified budget of $6,000.", "gpt-4-1106-preview_direct_sole-planning_parsed_results": [{"day": 1, "current_city": "from Richmond to Houston, Texas", "transportation": "Self-driving, from Richmond to Houston, duration: 19 hours 11 mins, distance: 2,131 km", "breakfast": "-", "attraction": "-", "lunch": "-", "dinner": "Jalapenos, Houston", "accommodation": "Sunny and Airy near Manhattan, Houston"}, {"day": 2, "current_city": "Houston, Texas", "transportation": "-", "breakfast": "Super Bakery, Houston", "attraction": "Space Center Houston, Houston;Houston Museum of Natural Science, Houston;", "lunch": "Sheetla Dhaba, Houston", "dinner": "The BrewMaster - The Mix Fine Dine, Houston", "accommodation": "Sunny and Airy near Manhattan, Houston"}, {"day": 3, "current_city": "from Houston to Texarkana, Texas", "transportation": "Self-driving, from Houston to Texarkana, duration: 4 hours 44 mins, distance: 467 km", "breakfast": "Vinayaka Mylari, Houston", "attraction": "Museum of Regional History, Texarkana;Ace of Clubs House, Texarkana;", "lunch": "Columbia Restaurant, Texarkana", "dinner": "Polka Pastry & Snack Bar, Texarkana", "accommodation": "Large 2.5 BR Apt In Park Slope, Texarkana"}, {"day": 4, "current_city": "Texarkana, Texas", "transportation": "-", "breakfast": "Big City Bread Cafe, Texarkana", "attraction": "Discovery Place Interactive Museum, Texarkana;Spring Lake Park, Texarkana;", "lunch": "Teasta, Texarkana", "dinner": "Granma's Homemade, Texarkana", "accommodation": "Large 2.5 BR Apt In Park Slope, Texarkana"}, {"day": 5, "current_city": "from Texarkana to Richmond", "transportation": "Self-driving, from Texarkana to Richmond, duration: 16 hours 8 mins, distance: 1,773 km", "breakfast": "-", "attraction": "-", "lunch": "-", "dinner": "-", "accommodation": "-"}]}]