[{"gpt-4-1106-preview_direct_sole-planning_results": "Travel Plan:\n\nDays: 1\nCurrent City: from Houston to Wichita\nTransportation: Self-driving, from Houston to Wichita, duration: 8 hours 42 mins, distance: 969 km, cost: 48\nBreakfast: -\nAttraction: Exploration Place, Wichita; Museum of World Treasures, Wichita\nLunch: Jahanpanah, Wichita, cost: 18, cuisines: Indian, Desserts, Fast Food\nDinner: Koramangala Social, Wichita, cost: 38, cuisines: Tea, Bakery, Cafe, Indian, Mediterranean\nAccommodation: Secret Garden Apartment in Bed Stuy, Brooklyn, Wichita, cost: 214, maximum occupancy: 3, house rules: No smoking & No children under 10\n\nNumber of people: 3\nTotal cost: 48 + (18 + 38) * 3 + 214 = 412\nAccommodation minimum nights: 1/2\n\nDays: 2\nCurrent City: Wichita\nTransportation: -\nBreakfast: The B.A.W.A, Wichita, cost: 23, cuisines: Tea, Chinese, Pizza, BBQ\nAttraction: The Keeper of the Plains, Wichita; Wichita Art Museum, Wichita; Sedgwick County Zoo, Wichita\nLunch: Rumi's Kitchen, Wichita, cost: 34, cuisines: Bakery, Fast Food, Cafe, Indian, Seafood\nDinner: The Flying Saucer Cafe, Wichita, cost: 41, cuisines: Tea, Cafe, Pizza, BBQ\nAccommodation: Secret Garden Apartment in Bed Stuy, Brooklyn, Wichita, cost: 214, maximum occupancy: 3, house rules: No smoking & No children under 10\n\nNumber of people: 3\nTotal cost: (23 + 34 + 41) * 3 + 214 = 502\nAccommodation minimum nights: 2/2\n\nDays: 3\nCurrent City: from Wichita to Houston\nTransportation: Self-driving, from Wichita to Houston, duration: 8 hours 42 mins, distance: 969 km, cost: 48\nBreakfast: Cafe Cornucopia, Wichita, cost: 76, cuisines: Tea, Cafe, Bakery\nAttraction: Old Cowtown Museum, Wichita\nLunch: -\nDinner: -\nAccommodation: -\n\nNumber of people: 3\nTotal cost: 48 + 76 * 3 = 276\n\nTotal cost across all days: 412 + 502 + 276 = 1,190\n\nCuisines: No specific cuisines were requested, but a variety of cuisines were included.\n\nNote: Smoking is a necessity, but the available accommodation listed \"No smoking\" in the house rules. Since the query requires smoking accommodations, we would need to find an alternative accommodation that allows smoking. However, the provided data does not include such an option. Therefore, we have selected the best available option that meets the other requirements. It is recommended to check with the accommodation provider if they have smoking rooms or designated smoking areas.", "gpt-4-1106-preview_direct_sole-planning_parsed_results": [{"day": 1, "current_city": "from Houston to Wichita", "transportation": "Self-driving, from Houston to Wichita, duration: 8 hours 42 mins, distance: 969 km", "breakfast": "-", "attraction": "Exploration Place, Wichita;Museum of World Treasures, Wichita;", "lunch": "Jahanpanah, Wichita", "dinner": "Koramangala Social, Wichita", "accommodation": "Secret Garden Apartment in Bed Stuy, Brooklyn, Wichita"}, {"day": 2, "current_city": "Wichita", "transportation": "-", "breakfast": "The B.A.W.A, Wichita", "attraction": "The Keeper of the Plains, Wichita;Wichita Art Museum, Wichita;Sedgwick County Zoo, Wichita;", "lunch": "Rumi's Kitchen, Wichita", "dinner": "The Flying Saucer Cafe, Wichita", "accommodation": "Secret Garden Apartment in Bed Stuy, Brooklyn, Wichita"}, {"day": 3, "current_city": "from Wichita to Houston", "transportation": "Self-driving, from Wichita to Houston, duration: 8 hours 42 mins, distance: 969 km", "breakfast": "Cafe Cornucopia, Wichita", "attraction": "Old Cowtown Museum, Wichita", "lunch": "-", "dinner": "-", "accommodation": "-"}]}]