[{"gpt-4-1106-preview_direct_sole-planning_results": "Travel Plan:\n\nDays: 1\nCurrent City: from Spokane to San Francisco\nTransportation: Self-driving, from Spokane to San Francisco, duration: 14 hours 5 mins, distance: 1,409 km, cost: 70\nBreakfast: -\nAttraction: -\nLunch: -\nDinner: Tokyo Sushi, San Francisco, cost: 18, cuisines: Cafe, Pizza, BBQ\nAccommodation: Gorgeous Park Slope Studio, San Francisco, cost: 641, room type: Entire home/apt, house rules: No smoking & No parties, minimum nights: 1, maximum occupancy: 5\n\nNumber of people: 1\nTotal cost: 70 + 18 + 641 = 729\nAccommodation minimum nights: 1/1\n\nDays: 2\nCurrent City: San Francisco\nTransportation: -\nBreakfast: Coffee & Chai Co., San Francisco, cost: 10, cuisines: Tea, Mexican, BBQ, Cafe, Seafood\nAttraction: Golden Gate Bridge, San Francisco; Golden Gate Park, San Francisco; PIER 39, San Francisco\nLunch: Bonne Bouche, San Francisco, cost: 21, cuisines: Tea, Chinese, American, Cafe\nDinner: Empress, San Francisco, cost: 24, cuisines: Pizza, BBQ, Mediterranean, Fast Food\nAccommodation: Gorgeous Park Slope Studio, San Francisco, cost: 641, room type: Entire home/apt, house rules: No smoking & No parties, minimum nights: 1, maximum occupancy: 5\n\nNumber of people: 1\nTotal cost: 10 + 21 + 24 + 641 = 696\nAccommodation minimum nights: 2/1\n\nDays: 3\nCurrent City: from San Francisco to Spokane\nTransportation: Self-driving, from San Francisco to Spokane, duration: 13 hours 57 mins, distance: 1,409 km, cost: 70\nBreakfast: -\nAttraction: -\nLunch: -\nDinner: -\nAccommodation: -\n\nNumber of people: 1\nTotal cost: 70\n\nTotal cost across all days: 729 + 696 + 70 = 1,495\n\nNote: The total cost exceeds the specified budget of $1,200. To adhere to the budget, we need to make adjustments. Here's the revised plan with cost-saving measures:\n\nRevised Travel Plan:\n\nDays: 1\nCurrent City: from Spokane to San Francisco\nTransportation: Self-driving, from Spokane to San Francisco, duration: 14 hours 5 mins, distance: 1,409 km, cost: 70\nBreakfast: -\nAttraction: -\nLunch: -\nDinner: Coffee & Chai Co., San Francisco, cost: 10, cuisines: Tea, Mexican, BBQ, Cafe, Seafood\nAccommodation: Room in Down town Brooklyn Parkslop, San Francisco, cost: 79, room type: Private room, house rules: No visitors, minimum nights: 1, maximum occupancy: 2\n\nNumber of people: 1\nTotal cost: 70 + 10 + 79 = 159\nAccommodation minimum nights: 1/1\n\nDays: 2\nCurrent City: San Francisco\nTransportation: -\nBreakfast: Coffee & Chai Co., San Francisco, cost: 10, cuisines: Tea, Mexican, BBQ, Cafe, Seafood\nAttraction: Golden Gate Bridge, San Francisco; Golden Gate Park, San Francisco\nLunch: Bonne Bouche, San Francisco, cost: 21, cuisines: Tea, Chinese, American, Cafe\nDinner: -\nAccommodation: Room in Down town Brooklyn Parkslop, San Francisco, cost: 79, room type: Private room, house rules: No visitors, minimum nights: 1, maximum occupancy: 2\n\nNumber of people: 1\nTotal cost: 10 + 21 + 79 = 110\nAccommodation minimum nights: 2/1\n\nDays: 3\nCurrent City: from San Francisco to Spokane\nTransportation: Self-driving, from San Francisco to Spokane, duration: 13 hours 57 mins, distance: 1,409 km, cost: 70\nBreakfast: -\nAttraction: -\nLunch: -\nDinner: -\nAccommodation: -\n\nNumber of people: 1\nTotal cost: 70\n\nTotal revised cost across all days: 159 + 110 + 70 = 339\n\nCuisines: The plan includes a variety of cuisines such as Tea, Mexican, BBQ, Cafe, Seafood, Chinese, and American.\n\nThe revised plan is well within the budget of $1,200.", "gpt-4-1106-preview_direct_sole-planning_parsed_results": [{"day": 1, "current_city": "from Spokane to San Francisco", "transportation": "Self-driving, from Spokane to San Francisco, duration: 14 hours 5 mins, distance: 1,409 km", "breakfast": "-", "attraction": "-", "lunch": "-", "dinner": "Coffee & Chai Co., San Francisco", "accommodation": "Room in Down town Brooklyn Parkslop, San Francisco"}, {"day": 2, "current_city": "San Francisco", "transportation": "-", "breakfast": "Coffee & Chai Co., San Francisco", "attraction": "Golden Gate Bridge, San Francisco;Golden Gate Park, San Francisco;", "lunch": "Bonne Bouche, San Francisco", "dinner": "-", "accommodation": "Room in Down town Brooklyn Parkslop, San Francisco"}, {"day": 3, "current_city": "from San Francisco to Spokane", "transportation": "Self-driving, from San Francisco to Spokane, duration: 13 hours 57 mins, distance: 1,409 km", "breakfast": "-", "attraction": "-", "lunch": "-", "dinner": "-", "accommodation": "-"}]}]