[{"gpt-4-1106-preview_direct_sole-planning_results": "Travel Plan:\nDays: 1\nCurrent City: from Chicago to Albuquerque\nTransportation: Self-driving, from Chicago to Albuquerque, duration: 19 hours 20 mins, distance: 2,153 km, cost: 107\nBreakfast: -\nAttraction: -\nLunch: -\nDinner: Cantina Famiglia Mancini, Albuquerque, cost: 40, cuisines: Tea, Cafe, Desserts\nAccommodation: Luxury 1BD 1.5 Bath In UES in NYC, Albuquerque, cost: 185, room type: Entire home/apt, house rules: No visitors & No smoking, minimum nights: 2, maximum occupancy: 2\n\nNumber of people: 3\nTotal cost: 107 + 40 * 3 + 185 = 412\nAccommodation minimum nights: 1/2\n\nDays: 2\nCurrent City: Albuquerque\nTransportation: -\nBreakfast: Punjab Grill, Albuquerque, cost: 26, cuisines: Desserts, Cafe, Italian, Bakery, Chinese, Seafood\nAttraction: New Mexico Museum of Natural History and Science, Albuquerque; Albuquerque Museum, Albuquerque\nLunch: Genghis Grill, Albuquerque, cost: 24, cuisines: BBQ, Desserts, Italian\nDinner: Thatcher's Barbeque and Grill, Albuquerque, cost: 30, cuisines: Seafood, BBQ, Desserts, Fast Food\nAccommodation: Luxury 1BD 1.5 Bath In UES in NYC, Albuquerque, cost: 185, room type: Entire home/apt, house rules: No visitors & No smoking, minimum nights: 2, maximum occupancy: 2\n\nNumber of people: 3\nTotal cost: (26 + 24 + 30) * 3 + 185 = 437\nAccommodation minimum nights: 2/2\n\nDays: 3\nCurrent City: Albuquerque to Chicago\nTransportation: Self-driving, from Albuquerque to Chicago, duration: 19 hours 20 mins, distance: 2,151 km, cost: 107\nBreakfast: Barbeque Nation, Albuquerque, cost: 85, cuisines: Bakery, BBQ, Desserts\nAttraction: Sandia Peak Tramway, Albuquerque\nLunch: -\nDinner: -\nAccommodation: -\n\nNumber of people: 3\nTotal cost: 107 + 85 * 3 = 362\n\nTotal cost across all days: 412 + 437 + 362 = 1,211\nCuisines: Various cuisines including Tea, Cafe, Desserts, BBQ, Italian, Bakery, Chinese, Seafood, Fast Food\nAccommodation: Private rooms as requested (Entire home/apt)\n\nNote: The accommodation chosen is an entire home/apt which provides a private space for the party, adhering to the request for private rooms. The cost of the travel plan is within the specified budget of $1,600. The attractions, restaurants, and accommodations are all located in Albuquerque, ensuring consistency with the travel plan's destination. The transportation method is self-driving, as per the available options, and no flights are included in the plan.", "gpt-4-1106-preview_direct_sole-planning_parsed_results": [{"day": 1, "current_city": "from Chicago to Albuquerque", "transportation": "Self-driving, from Chicago to Albuquerque, duration: 19 hours 20 mins, distance: 2,153 km", "breakfast": "-", "attraction": "-", "lunch": "-", "dinner": "Cantina Famiglia Mancini, Albuquerque", "accommodation": "Luxury 1BD 1.5 Bath In UES in NYC, Albuquerque"}, {"day": 2, "current_city": "Albuquerque", "transportation": "-", "breakfast": "Punjab Grill, Albuquerque", "attraction": "New Mexico Museum of Natural History and Science, Albuquerque;Albuquerque Museum, Albuquerque;", "lunch": "Genghis Grill, Albuquerque", "dinner": "Thatcher's Barbeque and Grill, Albuquerque", "accommodation": "Luxury 1BD 1.5 Bath In UES in NYC, Albuquerque"}, {"day": 3, "current_city": "from Albuquerque to Chicago", "transportation": "Self-driving, from Albuquerque to Chicago, duration: 19 hours 20 mins, distance: 2,151 km", "breakfast": "Barbeque Nation, Albuquerque", "attraction": "Sandia Peak Tramway, Albuquerque", "lunch": "-", "dinner": "-", "accommodation": "-"}]}]