[{"gpt-4-1106-preview_direct_sole-planning_results": "Travel Plan:\n\nDays: 1\nCurrent City: from Miami to San Diego, California\nTransportation: Flight F3726825, from Miami to San Diego, duration: 5 hours 18 minutes, cost: $1072\nBreakfast: -\nAttraction: Cabrillo National Monument, San Diego; La Jolla Shores Park, San Diego\nLunch: Open Yard, San Diego, cost: $33, cuisines: Chinese, Pizza, Cafe, Desserts\nDinner: Jetha Lal Ka Dhabha, San Diego, cost: $22, cuisines: Tea, Cafe, Indian, Italian\nAccommodation: Spacious Room in Large 2 Bedroom Prewar Apartment, San Diego, cost: $585, maximum occupancy: 2, house rules: No parties & No visitors, minimum nights: 1\n\nNumber of people: 2\nTotal cost: $1072 + ($33 + $22) * 2 + $585 = $1765\n\nDays: 2\nCurrent City: San Diego, California\nTransportation: -\nBreakfast: The Lost Mughal, San Diego, cost: $74, cuisines: Tea, Cafe, Italian\nAttraction: SeaWorld San Diego; Old Town San Diego; Balboa Park\nLunch: Burger King, San Diego, cost: $20, cuisines: Pizza, Italian, French, Fast Food, Seafood\nDinner: Gopala, San Diego, cost: $98, cuisines: Pizza, Mexican, BBQ, American, Seafood\nAccommodation: Spacious Room in Large 2 Bedroom Prewar Apartment, San Diego, cost: $585, maximum occupancy: 2, house rules: No parties & No visitors, minimum nights: 1\n\nNumber of people: 2\nTotal cost: ($74 + $20 + $98) * 2 + $585 = $969\n\nDays: 3\nCurrent City: from San Diego to Sacramento, California\nTransportation: Self-driving, from San Diego to Sacramento, duration: 7 hours 50 mins, cost: $40\nBreakfast: -\nAttraction: California State Railroad Museum, Sacramento; Sacramento Zoo\nLunch: Braseiro da G\u00e1vea, Sacramento, cost: $37, cuisines: Desserts, Tea, Pizza, Mexican, Fast Food\nDinner: Bahama Breeze Island Grille, Sacramento, cost: $31, cuisines: French, Bakery, BBQ, Fast Food, Seafood\nAccommodation: Free Cleaning & WiFi-Near Train + Bars & Nightlife, Sacramento, cost: $237, maximum occupancy: 2, house rules: No parties, minimum nights: 1\n\nNumber of people: 2\nTotal cost: $40 + ($37 + $31) * 2 + $237 = $413\n\nDays: 4\nCurrent City: Sacramento, California\nTransportation: -\nBreakfast: Mori's Japanese Steakhouse & Sushi Bar, Sacramento, cost: $35, cuisines: Pizza, French, Fast Food, Cafe, Seafood\nAttraction: Old Sacramento Waterfront; Crocker Art Museum; Fairytale Town\nLunch: Fresh Food, Sacramento, cost: $56, cuisines: Seafood, BBQ, Desserts, Italian\nDinner: Chinese Fast Food, Sacramento, cost: $76, cuisines: Seafood, BBQ, Italian\nAccommodation: Free Cleaning & WiFi-Near Train + Bars & Nightlife, Sacramento, cost: $237, maximum occupancy: 2, house rules: No parties, minimum nights: 1\n\nNumber of people: 2\nTotal cost: ($35 + $56 + $76) * 2 + $237 = $572\n\nDays: 5\nCurrent City: from Sacramento to Los Angeles, California\nTransportation: Self-driving, from Sacramento to Los Angeles, duration: 5 hours 55 mins, cost: $30\nBreakfast: -\nAttraction: Santa Monica Pier, Los Angeles; Hollywood Walk of Fame; Griffith Park\nLunch: Palmshore, Los Angeles, cost: $25, cuisines: Desserts, Bakery, Fast Food, American, Seafood\nDinner: Punjabi Zaika, Los Angeles, cost: $46, cuisines: Pizza, Bakery, BBQ, Cafe, Indian\nAccommodation: Midtown East 2 Bed/2 Bath Elevator Building Apt, Los Angeles, cost: $540, maximum occupancy: 4, house rules: No pets, minimum nights: 1\n\nNumber of people: 2\nTotal cost: $30 + ($25 + $46) * 2 + $540 = $712\n\nDays: 6\nCurrent City: Los Angeles, California\nTransportation: -\nBreakfast: The Hangout by 1861, Los Angeles, cost: $64, cuisines: Tea, Pizza, Seafood\nAttraction: Universal Studios Hollywood; The Getty; Griffith Observatory\nLunch: Chicken Minar, Los Angeles, cost: $25, cuisines: Bakery, Fast Food\nDinner: Choco Kraft, Los Angeles, cost: $20, cuisines: French, BBQ, Fast Food, Cafe, Mediterranean\nAccommodation: Midtown East 2 Bed/2 Bath Elevator Building Apt, Los Angeles, cost: $540, maximum occupancy: 4, house rules: No pets, minimum nights: 1\n\nNumber of people: 2\nTotal cost: ($64 + $25 + $20) * 2 + $540 = $748\n\nDays: 7\nCurrent City: from Los Angeles to Miami\nTransportation: Flight F3658887, from Los Angeles to Miami, duration: 5 hours 3 minutes, cost: $576\nBreakfast: -\nAttraction: -\nLunch: -\nDinner: -\nAccommodation: -\n\nNumber of people: 2\nTotal cost: $576 * 2 = $1152\n\nTotal cost across all days: $1765 + $969 + $413 + $572 + $712 + $748 + $1152 = $6331\n\nCuisines: The prompt specifies Mexican and American.", "gpt-4-1106-preview_direct_sole-planning_parsed_results": [{"day": 1, "current_city": "from Miami to San Diego, California", "transportation": "Flight Number: F3726825, from Miami to San Diego, duration: 5 hours 18 minutes", "breakfast": "-", "attraction": "Cabrillo National Monument, San Diego;La Jolla Shores Park, San Diego;", "lunch": "Open Yard, San Diego", "dinner": "Jetha Lal Ka Dhabha, San Diego", "accommodation": "Spacious Room in Large 2 Bedroom Prewar Apartment, San Diego"}, {"day": 2, "current_city": "San Diego, California", "transportation": "-", "breakfast": "The Lost Mughal, San Diego", "attraction": "SeaWorld San Diego;Old Town San Diego;Balboa Park;", "lunch": "Burger King, San Diego", "dinner": "Gopala, San Diego", "accommodation": "Spacious Room in Large 2 Bedroom Prewar Apartment, San Diego"}, {"day": 3, "current_city": "from San Diego to Sacramento, California", "transportation": "Self-driving, from San Diego to Sacramento, duration: 7 hours 50 mins", "breakfast": "-", "attraction": "California State Railroad Museum, Sacramento;Sacramento Zoo;", "lunch": "Braseiro da G\u00e1vea, Sacramento", "dinner": "Bahama Breeze Island Grille, Sacramento", "accommodation": "Free Cleaning & WiFi-Near Train + Bars & Nightlife, Sacramento"}, {"day": 4, "current_city": "Sacramento, California", "transportation": "-", "breakfast": "Mori's Japanese Steakhouse & Sushi Bar, Sacramento", "attraction": "Old Sacramento Waterfront;Crocker Art Museum;Fairytale Town;", "lunch": "Fresh Food, Sacramento", "dinner": "Chinese Fast Food, Sacramento", "accommodation": "Free Cleaning & WiFi-Near Train + Bars & Nightlife, Sacramento"}, {"day": 5, "current_city": "from Sacramento to Los Angeles, California", "transportation": "Self-driving, from Sacramento to Los Angeles, duration: 5 hours 55 mins", "breakfast": "-", "attraction": "Santa Monica Pier, Los Angeles;Hollywood Walk of Fame;Griffith Park;", "lunch": "Palmshore, Los Angeles", "dinner": "Punjabi Zaika, Los Angeles", "accommodation": "Midtown East 2 Bed/2 Bath Elevator Building Apt, Los Angeles"}, {"day": 6, "current_city": "Los Angeles, California", "transportation": "-", "breakfast": "The Hangout by 1861, Los Angeles", "attraction": "Universal Studios Hollywood;The Getty;Griffith Observatory;", "lunch": "Chicken Minar, Los Angeles", "dinner": "Choco Kraft, Los Angeles", "accommodation": "Midtown East 2 Bed/2 Bath Elevator Building Apt, Los Angeles"}, {"day": 7, "current_city": "from Los Angeles to Miami", "transportation": "Flight Number: F3658887, from Los Angeles to Miami, duration: 5 hours 3 minutes", "breakfast": "-", "attraction": "-", "lunch": "-", "dinner": "-", "accommodation": "-"}]}]