[{"gpt-4-1106-preview_direct_sole-planning_results": "Travel Plan:\n\nDays: 1\nCurrent City: from Appleton to Charlotte\nTransportation: Self-driving, from Appleton to Charlotte, duration: 14 hours 27 mins, distance: 1,534 km, cost: 76\nBreakfast: -\nAttraction: Freedom Park, Charlotte; Levine Museum of the New South, Charlotte\nLunch: Olive Tree Cafe, Charlotte, cost: 23, cuisines: Tea, Chinese, Desserts\nDinner: Central Perk 7, Charlotte, cost: 87, cuisines: Pizza, Bakery, BBQ, Fast Food\nAccommodation: Elegant Studio Apt in Prospect Heights, Charlotte, cost: 640, maximum occupancy: 5, house rules: No parties, minimum nights: 2\n\nNumber of people: 7\nTotal cost: 76 + (23 + 87) * 7 + 640 = 1,435\nAccommodation minimum nights: 1/2\n\nDays: 2\nCurrent City: Charlotte\nTransportation: -\nBreakfast: Cafe Maple Street, Charlotte, cost: 91, cuisines: Fast Food, Tea, Italian\nAttraction: Discovery Place Science, Charlotte; NASCAR Hall of Fame, Charlotte; The Mint Museum, Charlotte\nLunch: Kylin Skybar, Charlotte, cost: 44, cuisines: Tea, Cafe, Pizza, Italian\nDinner: Unplugged Courtyard, Charlotte, cost: 54, cuisines: Desserts, French, Bakery, Cafe, Seafood\nAccommodation: Elegant Studio Apt in Prospect Heights, Charlotte, cost: 640, maximum occupancy: 5, house rules: No parties, minimum nights: 2\n\nNumber of people: 7\nTotal cost: (91 + 44 + 54) * 7 + 640 = 2,009\nAccommodation minimum nights: 2/2\n\nDays: 3\nCurrent City: from Charlotte to Appleton\nTransportation: Self-driving, from Charlotte to Appleton, duration: 14 hours 32 mins, distance: 1,536 km, cost: 76\nBreakfast: Shree Hari Vaishnav Dhaba, Charlotte, cost: 97, cuisines: Bakery, Pizza, American, Cafe\nAttraction: Romare Bearden Park, Charlotte; The Charlotte Museum of History, Charlotte\nLunch: -\nDinner: -\nAccommodation: -\n\nNumber of people: 7\nTotal cost: 76 + 97 * 7 = 756\n\nTotal cost across all days: 1,435 + 2,009 + 756 = 4,200\n\nCuisines: Various cuisines including Tea, Chinese, Desserts, Pizza, Bakery, BBQ, Fast Food, Italian, French, Seafood, American, Cafe.\n\nNote: The accommodation chosen allows visitors as per the house rules and is within the budget. The travel plan includes transportation, meals, attractions, and accommodation for each day, adhering to the constraints provided. The total cost of the travel plan is $4,200, which is well within the specified budget of $9,500.", "gpt-4-1106-preview_direct_sole-planning_parsed_results": [{"day": 1, "current_city": "from Appleton to Charlotte", "transportation": "Self-driving, from Appleton to Charlotte, duration: 14 hours 27 mins, distance: 1,534 km", "breakfast": "-", "attraction": "Freedom Park, Charlotte;Levine Museum of the New South, Charlotte;", "lunch": "Olive Tree Cafe, Charlotte", "dinner": "Central Perk 7, Charlotte", "accommodation": "Elegant Studio Apt in Prospect Heights, Charlotte"}, {"day": 2, "current_city": "Charlotte", "transportation": "-", "breakfast": "Cafe Maple Street, Charlotte", "attraction": "Discovery Place Science, Charlotte;NASCAR Hall of Fame, Charlotte;The Mint Museum, Charlotte;", "lunch": "Kylin Skybar, Charlotte", "dinner": "Unplugged Courtyard, Charlotte", "accommodation": "Elegant Studio Apt in Prospect Heights, Charlotte"}, {"day": 3, "current_city": "from Charlotte to Appleton", "transportation": "Self-driving, from Charlotte to Appleton, duration: 14 hours 32 mins, distance: 1,536 km", "breakfast": "Shree Hari Vaishnav Dhaba, Charlotte", "attraction": "Romare Bearden Park, Charlotte;The Charlotte Museum of History, Charlotte;", "lunch": "-", "dinner": "-", "accommodation": "-"}]}]