[{"gpt-4-1106-preview_direct_sole-planning_results": "Travel Plan:\n\nDays: 1\nCurrent City: from Provo to San Diego, California\nTransportation: Self-driving, from Provo to San Diego, duration: 10 hours 13 mins, distance: 1,137 km, cost: 56\nBreakfast: -\nAttraction: Cabrillo National Monument, San Diego; La Jolla Shores Park, San Diego\nLunch: Open Yard, San Diego, cost: 33, cuisines: Chinese, Pizza, Cafe, Desserts\nDinner: The Lost Mughal, San Diego, cost: 74, cuisines: Tea, Cafe, Italian\nAccommodation: Spacious Room in Large 2 Bedroom Prewar Apartment, San Diego, cost: 585, maximum occupancy: 2, house rules: No parties & No visitors\n\nNumber of people: 5\nTotal cost: 56 + (33 + 74) * 5 + 585 * 3 = 1,240\nAccommodation minimum nights: 1/1\n\nDays: 2\nCurrent City: San Diego, California\nTransportation: -\nBreakfast: Jetha Lal Ka Dhabha, San Diego, cost: 22, cuisines: Tea, Cafe, Indian, Italian\nAttraction: SeaWorld San Diego; Old Town San Diego; Balboa Park\nLunch: Gopala, San Diego, cost: 98, cuisines: Pizza, Mexican, BBQ, American, Seafood\nDinner: Bun Intended, San Diego, cost: 91, cuisines: Cafe, Pizza, Desserts, Seafood\nAccommodation: Luxury 4BR Home, Spacious & Central to Trains, San Diego, cost: 392, maximum occupancy: 3, house rules: No parties\n\nNumber of people: 5\nTotal cost: (22 + 98 + 91) * 5 + 392 * 3 = 1,995\nAccommodation minimum nights: 1/3\n\nDays: 3\nCurrent City: from San Diego to Santa Ana, California\nTransportation: Self-driving, from San Diego to Santa Ana, duration: 1 hour 26 mins, distance: 144 km, cost: 7\nBreakfast: Harry's Bar + Cafe, San Diego, cost: 55, cuisines: Fast Food, French, Cafe, Seafood\nAttraction: Bowers Museum, Santa Ana; Santa Ana Zoo\nLunch: The Bee's Knees, Santa Ana, cost: 12, cuisines: Cafe, Pizza, Desserts, Seafood\nDinner: Caf\u6106 Tu Tu Tango, Santa Ana, cost: 88, cuisines: Tea, Pizza, French, Bakery, Cafe, American\nAccommodation: Sun-filled Artist Home 1BR in convenient L.I.C !, Santa Ana, cost: 1065, maximum occupancy: 5, house rules: No children under 10\n\nNumber of people: 5\nTotal cost: 7 + (55 + 12 + 88) * 5 + 1065 = 1,880\nAccommodation minimum nights: 1/2\n\nDays: 4\nCurrent City: Santa Ana, California\nTransportation: -\nBreakfast: The Chai Cafe, Santa Ana, cost: 52, cuisines: Tea, American, Desserts\nAttraction: Heritage Museum of Orange County; Discovery Science Center; Lyon Air Museum\nLunch: Bottles and Barrels, Santa Ana, cost: 81, cuisines: Desserts, Tea, French, Bakery, Cafe\nDinner: Nawras Seafood Restaurant, Santa Ana, cost: 83, cuisines: Tea, Bakery, Desserts\nAccommodation: Sun-filled Artist Home 1BR in convenient L.I.C !, Santa Ana, cost: 1065, maximum occupancy: 5, house rules: No children under 10\n\nNumber of people: 5\nTotal cost: (52 + 81 + 83) * 5 + 1065 = 2,330\nAccommodation minimum nights: 2/2\n\nDays: 5\nCurrent City: from Santa Ana to Bakersfield, California\nTransportation: Self-driving, from Santa Ana to Bakersfield, duration: 2 hours 31 mins, distance: 231 km, cost: 11\nBreakfast: Eram Rooftop, Santa Ana, cost: 77, cuisines: Cafe, Bakery, American, BBQ\nAttraction: Kern County Museum, Bakersfield; California Living Museum\nLunch: Kihei Caffe, Bakersfield, cost: 47, cuisines: Fast Food, BBQ, Desserts, Italian\nDinner: Tybee Island Social Club, Bakersfield, cost: 83, cuisines: Tea, Bakery, Fast Food, Cafe, American\nAccommodation: Bright & spacious Room in Harlem, Bakersfield, cost: 815, maximum occupancy: 2, house rules: No visitors & No children under 10\n\nNumber of people: 5\nTotal cost: 11 + (77 + 47 + 83) * 5 + 815 * 3 = 2,045\nAccommodation minimum nights: 1/1\n\nDays: 6\nCurrent City: Bakersfield, California\nTransportation: -\nBreakfast: DePalma's Italian Cafe - East Side, Bakersfield, cost: 12, cuisines: Chinese, Pizza, Bakery\nAttraction: Buena Vista Museum of Natural History & Science; Central Park at Mill Creek; The Park at River Walk\nLunch: Pita Pit, Bakersfield, cost: 23, cuisines: Tea, Pizza, Italian, Bakery, Seafood\nDinner: Domino's Pizza, Bakersfield, cost: 19, cuisines: Pizza, Mediterranean, Desserts\nAccommodation: Bright and Spacious Parkside Apartment, Bakersfield, cost: 1134, maximum occupancy: 11, house rules: No children under 10\n\nNumber of people: 5\nTotal cost: (12 + 23 + 19) * 5 + 1134 * 2 = 2,284\nAccommodation minimum nights: 1/3\n\nDays: 7\nCurrent City: from Bakersfield to Provo\nTransportation: Self-driving, from Bakersfield to Provo, duration: 9 hours 34 mins, distance: 1,063 km, cost: 53\nBreakfast: SM Gopal Ice Cream & Cakes, Bakersfield, cost: 57, cuisines: Pizza, French, Bakery, American, Seafood\nAttraction: -\nLunch: -\nDinner: -\nAccommodation: -\n\nNumber of people: 5\nTotal cost: 53 + 57 * 5 = 338\n\nTotal cost across all days: 1,240 + 1,995 + 1,880 + 2,330 + 2,045 + 2,284 + 338 = 12,112\nCuisines: Various cuisines including Chinese, Pizza, Cafe, Desserts, Tea, Italian, Bakery, Fast Food, Seafood, American, BBQ, Mexican, French\nHouse Rules: Accommodations that allow parties were not available. The closest match was found with no parties as a house rule.", "gpt-4-1106-preview_direct_sole-planning_parsed_results": [{"day": 1, "current_city": "from Provo to San Diego, California", "transportation": "Self-driving, from Provo to San Diego, duration: 10 hours 13 mins, distance: 1,137 km", "breakfast": "-", "attraction": "Cabrillo National Monument, San Diego;La Jolla Shores Park, San Diego;", "lunch": "Open Yard, San Diego", "dinner": "The Lost Mughal, San Diego", "accommodation": "Spacious Room in Large 2 Bedroom Prewar Apartment, San Diego"}, {"day": 2, "current_city": "San Diego, California", "transportation": "-", "breakfast": "Jetha Lal Ka Dhabha, San Diego", "attraction": "SeaWorld San Diego;Old Town San Diego;Balboa Park;", "lunch": "Gopala, San Diego", "dinner": "Bun Intended, San Diego", "accommodation": "Luxury 4BR Home, Spacious & Central to Trains, San Diego"}, {"day": 3, "current_city": "from San Diego to Santa Ana, California", "transportation": "Self-driving, from San Diego to Santa Ana, duration: 1 hour 26 mins, distance: 144 km", "breakfast": "Harry's Bar + Cafe, San Diego", "attraction": "Bowers Museum, Santa Ana;Santa Ana Zoo;", "lunch": "The Bee's Knees, Santa Ana", "dinner": "Caf\u00e9 Tu Tu Tango, Santa Ana", "accommodation": "Sun-filled Artist Home 1BR in convenient L.I.C !, Santa Ana"}, {"day": 4, "current_city": "Santa Ana, California", "transportation": "-", "breakfast": "The Chai Cafe, Santa Ana", "attraction": "Heritage Museum of Orange County;Discovery Science Center;Lyon Air Museum;", "lunch": "Bottles and Barrels, Santa Ana", "dinner": "Nawras Seafood Restaurant, Santa Ana", "accommodation": "Sun-filled Artist Home 1BR in convenient L.I.C !, Santa Ana"}, {"day": 5, "current_city": "from Santa Ana to Bakersfield, California", "transportation": "Self-driving, from Santa Ana to Bakersfield, duration: 2 hours 31 mins, distance: 231 km", "breakfast": "Eram Rooftop, Santa Ana", "attraction": "Kern County Museum, Bakersfield;California Living Museum;", "lunch": "Kihei Caffe, Bakersfield", "dinner": "Tybee Island Social Club, Bakersfield", "accommodation": "Bright & spacious Room in Harlem, Bakersfield"}, {"day": 6, "current_city": "Bakersfield, California", "transportation": "-", "breakfast": "DePalma's Italian Cafe - East Side, Bakersfield", "attraction": "Buena Vista Museum of Natural History & Science;Central Park at Mill Creek;The Park at River Walk;", "lunch": "Pita Pit, Bakersfield", "dinner": "Domino's Pizza, Bakersfield", "accommodation": "Bright and Spacious Parkside Apartment, Bakersfield"}, {"day": 7, "current_city": "from Bakersfield to Provo", "transportation": "Self-driving, from Bakersfield to Provo, duration: 9 hours 34 mins, distance: 1,063 km", "breakfast": "SM Gopal Ice Cream & Cakes, Bakersfield", "attraction": "-", "lunch": "-", "dinner": "-", "accommodation": "-"}]}]