[{"gpt-4-1106-preview_direct_sole-planning_results": "Travel Plan:\n\nDays: 1\nCurrent City: from Cincinnati to Philadelphia\nTransportation: Taxi, from Cincinnati to Philadelphia, duration: 8 hours 44 mins, distance: 921 km, cost: 921\nBreakfast: -\nAttraction: The Franklin Institute, Philadelphia; Liberty Bell, Philadelphia\nLunch: Red Mesa Cantina, Philadelphia, cost: 36, cuisines: Tea, Cafe, American, Fast Food\nDinner: Pind Balluchi, Philadelphia, cost: 44, cuisines: Desserts, Tea, French, Fast Food, Seafood\nAccommodation: Industrial Loft Living in NYC, Philadelphia, cost: 178, room type: Entire home/apt, house rules: No smoking, minimum nights: 4, maximum occupancy: 3\n\nNumber of people: 2\nTotal cost: 921 (transportation) + (36 + 44) * 2 (meals) + 178 (accommodation) = 1,259\nAccommodation minimum nights: 1/4\n\nDays: 2\nCurrent City: Philadelphia\nTransportation: -\nBreakfast: Hong Kong Cafe, Philadelphia, cost: 47, cuisines: Tea, Pizza, Italian, BBQ, Cafe\nAttraction: Philadelphia Museum of Art, Philadelphia; Eastern State Penitentiary, Philadelphia\nLunch: Marukame Udon, Philadelphia, cost: 100, cuisines: Tea, Pizza, Italian, BBQ, Fast Food, Chinese\nDinner: The Moon Under Water, Philadelphia, cost: 94, cuisines: Pizza, Italian, BBQ, Bakery, Fast Food, Mediterranean\nAccommodation: Industrial Loft Living in NYC, Philadelphia, cost: 178, room type: Entire home/apt, house rules: No smoking, minimum nights: 4, maximum occupancy: 3\n\nNumber of people: 2\nTotal cost: (47 + 100 + 94) * 2 (meals) + 178 (accommodation) = 566\nAccommodation minimum nights: 2/4\n\nDays: 3\nCurrent City: from Philadelphia to Cincinnati\nTransportation: Taxi, from Philadelphia to Cincinnati, duration: 8 hours 47 mins, distance: 922 km, cost: 922\nBreakfast: Asian Chopstick, Philadelphia, cost: 10, cuisines: BBQ, Bakery, Desserts, Fast Food\nAttraction: Please Touch Museum, Philadelphia (suitable for children under 10)\nLunch: -\nDinner: -\nAccommodation: -\n\nNumber of people: 2\nTotal cost: 922 (transportation) + 10 * 2 (breakfast) = 942\n\nTotal cost across all days: 1,259 + 566 + 942 = 2,767\n\nHowever, the total cost exceeds the specified budget of $2,000. To adjust the plan to fit the budget, we need to change the transportation method from taxi to flight, as self-driving is not an option per the query.\n\nRevised Transportation:\nDay 1: Flight from Cincinnati to Philadelphia, Flight Number F3794475, Price: 200\nDay 3: Flight from Philadelphia to Cincinnati, Flight Number F3793489, Price: 107\n\nRevised Total Cost:\nDay 1: 200 (flight) + (36 + 44) * 2 (meals) + 178 (accommodation) = 538\nDay 2: (47 + 100 + 94) * 2 (meals) + 178 (accommodation) = 566\nDay 3: 107 (flight) + 10 * 2 (breakfast) = 127\n\nRevised Total Cost Across All Days: 538 + 566 + 127 = 1,231\n\nThe revised total cost of $1,231 is now within the specified budget of $2,000.", "gpt-4-1106-preview_direct_sole-planning_parsed_results": [{"day": 1, "current_city": "from Cincinnati to Philadelphia", "transportation": "Flight Number: F3794475, from Cincinnati to Philadelphia", "breakfast": "-", "attraction": "The Franklin Institute, Philadelphia;Liberty Bell, Philadelphia;", "lunch": "Red Mesa Cantina, Philadelphia", "dinner": "Pind Balluchi, Philadelphia", "accommodation": "Industrial Loft Living in NYC, Philadelphia"}, {"day": 2, "current_city": "Philadelphia", "transportation": "-", "breakfast": "Hong Kong Cafe, Philadelphia", "attraction": "Philadelphia Museum of Art, Philadelphia;Eastern State Penitentiary, Philadelphia;", "lunch": "Marukame Udon, Philadelphia", "dinner": "The Moon Under Water, Philadelphia", "accommodation": "Industrial Loft Living in NYC, Philadelphia"}, {"day": 3, "current_city": "from Philadelphia to Cincinnati", "transportation": "Flight Number: F3793489, from Philadelphia to Cincinnati", "breakfast": "Asian Chopstick, Philadelphia", "attraction": "Please Touch Museum, Philadelphia", "lunch": "-", "dinner": "-", "accommodation": "-"}]}]