[{"gpt-4-1106-preview_direct_sole-planning_results": "Travel Plan:\n\nDays: 1\nCurrent City: from Marquette to Escanaba, Michigan\nTransportation: Self-driving, from Marquette to Escanaba, duration: 3 hours 34 mins, distance: 362 km, cost: 18\nBreakfast: -\nAttraction: Ludington Park, Escanaba; Delta County Historical Society, Escanaba\nLunch: Machine Shed Restaurant, Escanaba, cost: 82, cuisines: Tea, Bakery, Seafood\nDinner: The Grand Marlin, Escanaba, cost: 20, cuisines: Cafe, Mediterranean, Desserts, Italian\nAccommodation: California Vibes in NYC, Escanaba, cost: 206, maximum occupancy: 2, house rules: No parties, minimum nights: 3\n\nNumber of people: 5\nTotal cost: 18 + (82 + 20) * 5 + 206 = 736\nAccommodation minimum nights: 1/3\n\nDays: 2\nCurrent City: Escanaba, Michigan\nTransportation: -\nBreakfast: Butter & Grace, Escanaba, cost: 95, cuisines: Fast Food, Tea, Mexican, Italian\nAttraction: Leigh\u2019s Garden Winery, Escanaba; Escanaba Municipal Beach, Escanaba\nLunch: SOHO South Cafe, Escanaba, cost: 53, cuisines: Seafood, American, BBQ, Fast Food\nDinner: Makhmali Kebabs, Escanaba, cost: 64, cuisines: Desserts, Seafood\nAccommodation: California Vibes in NYC, Escanaba, cost: 206, maximum occupancy: 2, house rules: No parties, minimum nights: 3\n\nNumber of people: 5\nTotal cost: (95 + 53 + 64) * 5 + 206 = 1,476\nAccommodation minimum nights: 2/3\n\nDays: 3\nCurrent City: from Escanaba to Pellston, Michigan\nTransportation: Self-driving, from Escanaba to Pellston, duration: 2 hours 43 mins, distance: 262 km, cost: 13\nBreakfast: Caf\u6106 Healthilicious, Escanaba, cost: 51, cuisines: Tea, French, Bakery, Fast Food, American\nAttraction: Pellston Pioneer Park, Pellston; Pellston Historical Society Museum, Pellston\nLunch: Aroos Damascus, Pellston, cost: 44, cuisines: Desserts, Tea, Italian, Cafe, American\nDinner: Sagar Gaire Fast Food, Pellston, cost: 64, cuisines: Desserts, Tea, Pizza, Italian, BBQ, Mediterranean\nAccommodation: Beautiful apartment ~25min from Times Square, Pellston, cost: 571, maximum occupancy: 5, house rules: No smoking & No visitors, minimum nights: 5\n\nNumber of people: 5\nTotal cost: 13 + (51 + 44 + 64) * 5 + 571 = 1,442\nAccommodation minimum nights: 1/5\n\nDays: 4\nCurrent City: Pellston, Michigan\nTransportation: -\nBreakfast: Premier Bite, Pellston, cost: 53, cuisines: Tea, Bakery, Seafood\nAttraction: Headlands International Dark Sky Park, Pellston; Wilderness State Park, Pellston\nLunch: The Great Kabab Factory - Park Plaza, Pellston, cost: 84, cuisines: Desserts, Pizza, Mexican, BBQ, Seafood\nDinner: The Plaza Solitaire, Pellston, cost: 72, cuisines: Desserts, Tea, BBQ, American, Mediterranean\nAccommodation: Beautiful apartment ~25min from Times Square, Pellston, cost: 571, maximum occupancy: 5, house rules: No smoking & No visitors, minimum nights: 5\n\nNumber of people: 5\nTotal cost: (53 + 84 + 72) * 5 + 571 = 1,926\nAccommodation minimum nights: 2/5\n\nDays: 5\nCurrent City: from Pellston to Detroit, Michigan\nTransportation: Flight, Flight Number: F3832618, Price: 75, DepTime: 06:14, ArrTime: 07:18, Duration: 1 hours 4 minutes, Distance: 243 km\nBreakfast: -\nAttraction: Detroit Institute of Arts, Detroit; Detroit Historical Museum, Detroit\nLunch: Southern Bliss Bakery, Detroit, cost: 28, cuisines: Tea, BBQ, Desserts, Seafood\nDinner: A Dong Restaurant, Detroit, cost: 40, cuisines: Tea, Cafe, Pizza\nAccommodation: Cozy 1 bedroom in the heart of Fort Greene, Detroit, cost: 751, maximum occupancy: 6, house rules: No pets & No parties, minimum nights: 3\n\nNumber of people: 5\nTotal cost: 75 * 5 + (28 + 40) * 5 + 751 = 1,626\nAccommodation minimum nights: 1/3\n\nDays: 6\nCurrent City: Detroit, Michigan\nTransportation: -\nBreakfast: Cafe And More, Detroit, cost: 41, cuisines: Tea, Bakery, Italian\nAttraction: Michigan Science Center, Detroit; Belle Isle Aquarium, Detroit\nLunch: BMG - All Day Dining, Detroit, cost: 15, cuisines: Desserts, Bakery, BBQ, Indian, Seafood\nDinner: Chye Seng Huat Hardware, Detroit, cost: 94, cuisines: Tea, Mexican, Seafood\nAccommodation: Cozy 1 bedroom in the heart of Fort Greene, Detroit, cost: 751, maximum occupancy: 6, house rules: No pets & No parties, minimum nights: 3\n\nNumber of people: 5\nTotal cost: (41 + 15 + 94) * 5 + 751 = 1,701\nAccommodation minimum nights: 2/3\n\nDays: 7\nCurrent City: from Detroit to Marquette\nTransportation: Self-driving, from Detroit to Marquette, duration: 5 hours 40 mins, distance: 602 km, cost: 30\nBreakfast: -\nAttraction: -\nLunch: -\nDinner: -\nAccommodation: -\n\nNumber of people: 5\nTotal cost: 30 * 5 = 150\n\nTotal cost across all days: 736 + 1,476 + 1,442 + 1,926 + 1,626 + 1,701 + 150 = 9,057\n\nCuisines: Various cuisines have been included in the plan, suitable for a variety of tastes.\n\nNote: The accommodations selected are suitable for children under 10, as per the query. The total cost is well within the specified budget of $14,600.", "gpt-4-1106-preview_direct_sole-planning_parsed_results": [{"day": 1, "current_city": "from Marquette to Escanaba, Michigan", "transportation": "Self-driving, from Marquette to Escanaba, duration: 3 hours 34 mins, distance: 362 km", "breakfast": "-", "attraction": "Ludington Park, Escanaba;Delta County Historical Society, Escanaba;", "lunch": "Machine Shed Restaurant, Escanaba", "dinner": "The Grand Marlin, Escanaba", "accommodation": "California Vibes in NYC, Escanaba"}, {"day": 2, "current_city": "Escanaba, Michigan", "transportation": "-", "breakfast": "Butter & Grace, Escanaba", "attraction": "Leigh\u2019s Garden Winery, Escanaba;Escanaba Municipal Beach, Escanaba;", "lunch": "SOHO South Cafe, Escanaba", "dinner": "Makhmali Kebabs, Escanaba", "accommodation": "California Vibes in NYC, Escanaba"}, {"day": 3, "current_city": "from Escanaba to Pellston, Michigan", "transportation": "Self-driving, from Escanaba to Pellston, duration: 2 hours 43 mins, distance: 262 km", "breakfast": "Caf\u00e9 Healthilicious, Escanaba", "attraction": "Pellston Pioneer Park, Pellston;Pellston Historical Society Museum, Pellston;", "lunch": "Aroos Damascus, Pellston", "dinner": "Sagar Gaire Fast Food, Pellston", "accommodation": "Beautiful apartment ~25min from Times Square, Pellston"}, {"day": 4, "current_city": "Pellston, Michigan", "transportation": "-", "breakfast": "Premier Bite, Pellston", "attraction": "Headlands International Dark Sky Park, Pellston;Wilderness State Park, Pellston;", "lunch": "The Great Kabab Factory - Park Plaza, Pellston", "dinner": "The Plaza Solitaire, Pellston", "accommodation": "Beautiful apartment ~25min from Times Square, Pellston"}, {"day": 5, "current_city": "from Pellston to Detroit, Michigan", "transportation": "Flight, Flight Number: F3832618, DepTime: 06:14, ArrTime: 07:18, Duration: 1 hours 4 minutes, Distance: 243 km", "breakfast": "-", "attraction": "Detroit Institute of Arts, Detroit;Detroit Historical Museum, Detroit;", "lunch": "Southern Bliss Bakery, Detroit", "dinner": "A Dong Restaurant, Detroit", "accommodation": "Cozy 1 bedroom in the heart of Fort Greene, Detroit"}, {"day": 6, "current_city": "Detroit, Michigan", "transportation": "-", "breakfast": "Cafe And More, Detroit", "attraction": "Michigan Science Center, Detroit;Belle Isle Aquarium, Detroit;", "lunch": "BMG - All Day Dining, Detroit", "dinner": "Chye Seng Huat Hardware, Detroit", "accommodation": "Cozy 1 bedroom in the heart of Fort Greene, Detroit"}, {"day": 7, "current_city": "from Detroit to Marquette", "transportation": "Self-driving, from Detroit to Marquette, duration: 5 hours 40 mins, distance: 602 km", "breakfast": "-", "attraction": "-", "lunch": "-", "dinner": "-", "accommodation": "-"}]}]