[{"gpt-4-1106-preview_direct_sole-planning_results": "Travel Plan:\n\nDays: 1\nCurrent City: from Newark to Miami, Florida\nTransportation: Flight F3702793, from Newark to Miami, duration: 2 hours 56 minutes, cost: $266\nBreakfast: -\nAttraction: Jungle Island, Miami; P\u00e9rez Art Museum Miami, Miami\nLunch: Clocked, Miami, cost: $49, cuisines: Tea, Italian, Mexican, BBQ, Cafe\nDinner: Shorts Burger and Shine, Miami, cost: $81, cuisines: Chinese, Cafe, Seafood\nAccommodation: \"HELLO BROOKLYN\" PARK SIDE VIEW NEWLY RENO APT., Miami, cost: $789, maximum occupancy: 6, house rules: No parties & No visitors\n\nNumber of people: 3\nTotal cost: $266 * 3 + ($49 + $81) * 3 + $789 = $1,581\n\nDays: 2\nCurrent City: Miami, Florida\nTransportation: -\nBreakfast: Papouli's Mediterranean Cafe & Market, Miami, cost: $26, cuisines: Tea, Desserts\nAttraction: Bayfront Park, Miami; Wynwood Walls, Miami\nLunch: Tako Cheena by Pom Pom, Miami, cost: $60, cuisines: Fast Food, Indian, Desserts, Italian\nDinner: AB's Absolute Barbecues, Miami, cost: $55, cuisines: Desserts, Tea, Pizza, Italian, Fast Food, American\nAccommodation: \"HELLO BROOKLYN\" PARK SIDE VIEW NEWLY RENO APT., Miami, cost: $789, maximum occupancy: 6, house rules: No parties & No visitors\n\nNumber of people: 3\nTotal cost: ($26 + $60 + $55) * 3 + $789 = $1,362\n\nDays: 3\nCurrent City: from Miami to Punta Gorda, Florida\nTransportation: Taxi, from Miami to Punta Gorda, duration: 2 hours 41 mins, cost: $291\nBreakfast: Anjlika, Miami, cost: $56, cuisines: Pizza, Italian, Fast Food, Cafe, Mediterranean, Seafood\nAttraction: Laishley Park, Punta Gorda; Ponce De Leon Park, Punta Gorda\nLunch: D.O.C Ristorante, Punta Gorda, cost: $97, cuisines: Chinese, Bakery, American, Cafe\nDinner: Cookie Shoppe, Punta Gorda, cost: $44, cuisines: Tea, Bakery, BBQ, Mediterranean, Seafood\nAccommodation: Beautiful Manhattan Apt- 20 min to Times Square, Punta Gorda, cost: $79, maximum occupancy: 3, house rules: No children under 10\n\nNumber of people: 3\nTotal cost: $291 * 3 + ($56 + $97 + $44) * 3 + $79 = $1,398\n\nDays: 4\nCurrent City: Punta Gorda, Florida\nTransportation: -\nBreakfast: Pho Bac, Punta Gorda, cost: $19, cuisines: Fast Food, Mediterranean, Desserts, Italian\nAttraction: Charlotte Harbor Preserve State Park, Punta Gorda; Peace River Wildlife Center, Punta Gorda\nLunch: China Cafe, Punta Gorda, cost: $69, cuisines: Desserts, Bakery, Cafe, Mediterranean, Seafood\nDinner: G Thal, Punta Gorda, cost: $61, cuisines: Desserts, Bakery, Cafe, American, Mediterranean\nAccommodation: Beautiful Manhattan Apt- 20 min to Times Square, Punta Gorda, cost: $79, maximum occupancy: 3, house rules: No children under 10\n\nNumber of people: 3\nTotal cost: ($19 + $69 + $61) * 3 + $79 = $707\n\nDays: 5\nCurrent City: from Punta Gorda to Jacksonville, Florida\nTransportation: Taxi, from Punta Gorda to Jacksonville, duration: 4 hours 26 mins, cost: $474\nBreakfast: Gelato Vinto, Punta Gorda, cost: $43, cuisines: Cafe, BBQ\nAttraction: Laishley Park, Punta Gorda; Ponce De Leon Park, Punta Gorda\nLunch: Urban Cuisine, Punta Gorda, cost: $84, cuisines: Desserts, Tea, Mexican, Fast Food, Chinese, Seafood\nDinner: Hide Out The Street Cafe, Punta Gorda, cost: $92, cuisines: Desserts, BBQ, Fast Food, Chinese, Seafood\nAccommodation: NYC Sanctuary, Skyline Views & Rooftop, Jacksonville, cost: $954, maximum occupancy: 6, house rules: No smoking\n\nNumber of people: 3\nTotal cost: $474 * 3 + ($43 + $84 + $92) * 3 + $954 = $2,937\n\nDays: 6\nCurrent City: Jacksonville, Florida\nTransportation: -\nBreakfast: Villa Gargano, Jacksonville, cost: $51, cuisines: Tea, American, Desserts\nAttraction: Jacksonville Zoo and Gardens, Jacksonville; Southbank Riverwalk, Jacksonville\nLunch: Pirates' House Restaurant, Jacksonville, cost: $59, cuisines: Chinese, Pizza, BBQ\nDinner: Goose Feathers Cafe and Bakery, Jacksonville, cost: $57, cuisines: Tea, Fast Food, Italian\nAccommodation: NYC Sanctuary, Skyline Views & Rooftop, Jacksonville, cost: $954, maximum occupancy: 6, house rules: No smoking\n\nNumber of people: 3\nTotal cost: ($51 + $59 + $57) * 3 + $954 = $1,587\n\nDays: 7\nCurrent City: from Jacksonville to Newark\nTransportation: Flight F4075995, from Jacksonville to Newark, duration: 1 hour 53 minutes, cost: $306\nBreakfast: Ashoka Restaurant, Jacksonville, cost: $11, cuisines: Desserts, Mexican, Bakery, BBQ, Fast Food\nAttraction: MOSH (Museum Of Science & History), Jacksonville\nLunch: Sanjha Chulha, Jacksonville, cost: $57, cuisines: Tea, Bakery, BBQ\nDinner: -\nAccommodation: -\n\nNumber of people: 3\nTotal cost: $306 * 3 + ($11 + $57) * 3 = $1,113\n\nTotal cost across all days: $1,581 + $1,362 + $1,398 + $707 + $2,937 + $1,587 + $1,113 = $10,685\n\nUnfortunately, the total cost exceeds the specified budget of $10,400. Adjustments will need to be made to the plan to reduce costs. This could involve selecting less expensive restaurants, finding cheaper flights, or adjusting accommodation choices.", "gpt-4-1106-preview_direct_sole-planning_parsed_results": [{"day": 1, "current_city": "from Newark to Miami, Florida", "transportation": "Flight Number: F3702793, from Newark to Miami, duration: 2 hours 56 minutes", "breakfast": "-", "attraction": "Jungle Island, Miami;P\u00e9rez Art Museum Miami, Miami;", "lunch": "Clocked, Miami", "dinner": "Shorts Burger and Shine, Miami", "accommodation": "\"HELLO BROOKLYN\" PARK SIDE VIEW NEWLY RENO APT., Miami"}, {"day": 2, "current_city": "Miami, Florida", "transportation": "-", "breakfast": "Papouli's Mediterranean Cafe & Market, Miami", "attraction": "Bayfront Park, Miami;Wynwood Walls, Miami;", "lunch": "Tako Cheena by Pom Pom, Miami", "dinner": "AB's Absolute Barbecues, Miami", "accommodation": "\"HELLO BROOKLYN\" PARK SIDE VIEW NEWLY RENO APT., Miami"}, {"day": 3, "current_city": "from Miami to Punta Gorda, Florida", "transportation": "Taxi, from Miami to Punta Gorda, duration: 2 hours 41 mins", "breakfast": "Anjlika, Miami", "attraction": "Laishley Park, Punta Gorda;Ponce De Leon Park, Punta Gorda;", "lunch": "D.O.C Ristorante, Punta Gorda", "dinner": "Cookie Shoppe, Punta Gorda", "accommodation": "Beautiful Manhattan Apt- 20 min to Times Square, Punta Gorda"}, {"day": 4, "current_city": "Punta Gorda, Florida", "transportation": "-", "breakfast": "Pho Bac, Punta Gorda", "attraction": "Charlotte Harbor Preserve State Park, Punta Gorda;Peace River Wildlife Center, Punta Gorda;", "lunch": "China Cafe, Punta Gorda", "dinner": "G Thal, Punta Gorda", "accommodation": "Beautiful Manhattan Apt- 20 min to Times Square, Punta Gorda"}, {"day": 5, "current_city": "from Punta Gorda to Jacksonville, Florida", "transportation": "Taxi, from Punta Gorda to Jacksonville, duration: 4 hours 26 mins", "breakfast": "Gelato Vinto, Punta Gorda", "attraction": "Laishley Park, Punta Gorda;Ponce De Leon Park, Punta Gorda;", "lunch": "Urban Cuisine, Punta Gorda", "dinner": "Hide Out The Street Cafe, Punta Gorda", "accommodation": "NYC Sanctuary, Skyline Views & Rooftop, Jacksonville"}, {"day": 6, "current_city": "Jacksonville, Florida", "transportation": "-", "breakfast": "Villa Gargano, Jacksonville", "attraction": "Jacksonville Zoo and Gardens, Jacksonville;Southbank Riverwalk, Jacksonville;", "lunch": "Pirates' House Restaurant, Jacksonville", "dinner": "Goose Feathers Cafe and Bakery, Jacksonville", "accommodation": "NYC Sanctuary, Skyline Views & Rooftop, Jacksonville"}, {"day": 7, "current_city": "from Jacksonville to Newark", "transportation": "Flight Number: F4075995, from Jacksonville to Newark, duration: 1 hour 53 minutes", "breakfast": "Ashoka Restaurant, Jacksonville", "attraction": "MOSH (Museum Of Science & History), Jacksonville", "lunch": "Sanjha Chulha, Jacksonville", "dinner": "-", "accommodation": "-"}]}]