[{"gpt-4-1106-preview_direct_sole-planning_results": "Travel Plan:\n\nDays: 1\nCurrent City: from Las Vegas to Amarillo, Texas\nTransportation: Self-driving, from Las Vegas to Amarillo, duration: 12 hours 21 mins, distance: 1,386 km, cost: 69\nBreakfast: -\nAttraction: Cadillac Ranch, Amarillo; Amarillo Botanical Gardens, Amarillo\nLunch: Thalaivar, Amarillo, cost: 27, cuisines: Tea, Fast Food, American, Seafood\nDinner: The Cinnamon Kitchen, Amarillo, cost: 69, cuisines: Desserts, Tea, Pizza, Chinese, Seafood\nAccommodation: Gramercy Park restful, cozy, sun-filled home, Amarillo, cost: 968, maximum occupancy: 8, house rules: No parties, minimum nights: 2\n\nNumber of people: 2\nTotal cost: 69 + (27 + 69) * 2 + 968 = 1,229\nAccommodation minimum nights: 1/2\n\nDays: 2\nCurrent City: Amarillo, Texas\nTransportation: -\nBreakfast: Wood Box Cafe, Amarillo, cost: 11, cuisines: Desserts, French, Fast Food, Cafe, American\nAttraction: Don Harrington Discovery Center, Amarillo; Texas Air & Space Museum, Amarillo; Amarillo Museum of Art, Amarillo; 2nd Amendment Cowboy, Amarillo\nLunch: Komachi, Amarillo, cost: 71, cuisines: Desserts, Tea, Fast Food, Chinese, Mediterranean\nDinner: Anand Restaurant, Amarillo, cost: 53, cuisines: Fast Food, Seafood, Desserts, Italian\nAccommodation: Gramercy Park restful, cozy, sun-filled home, Amarillo, cost: 968, maximum occupancy: 8, house rules: No parties, minimum nights: 2\n\nNumber of people: 2\nTotal cost: (11 + 71 + 53) * 2 + 968 = 1,238\nAccommodation minimum nights: 2/2\n\nDays: 3\nCurrent City: from Amarillo, Texas to Lubbock, Texas\nTransportation: Self-driving, from Amarillo to Lubbock, duration: 1 hour 47 mins, distance: 197 km, cost: 9\nBreakfast: Biryani Sons & Co., Amarillo, cost: 14, cuisines: Tea, Pizza, Bakery, BBQ\nAttraction: Buddy Holly Center, Lubbock; National Ranching Heritage Center, Lubbock\nLunch: Grand Barbeque Buffet Restaurant, Lubbock, cost: 20, cuisines: Tea, French, Fast Food, Cafe, Seafood\nDinner: Mosaic - Country Inn & Suites By Carlson, Lubbock, cost: 29, cuisines: Chinese, Indian, Desserts, Seafood\nAccommodation: The Perfect Queens Getaway!, Lubbock, cost: 1,029, maximum occupancy: 8, house rules: No children under 10, minimum nights: 2\n\nNumber of people: 2\nTotal cost: 9 + (14 + 20 + 29) * 2 + 1,029 = 1,144\nAccommodation minimum nights: 1/2\n\nDays: 4\nCurrent City: Lubbock, Texas\nTransportation: -\nBreakfast: Assam Tea Corner, Lubbock, cost: 52, cuisines: Desserts, BBQ, Fast Food, American, Seafood\nAttraction: American Windmill Museum, Lubbock; Mackenzie Main City Park, Lubbock; Prairie Dog Town, Lubbock; Lubbock Lake National Historic Landmark, Lubbock\nLunch: Paris 6 Classique, Lubbock, cost: 91, cuisines: Desserts, Cafe, Pizza, Mexican, BBQ, Chinese\nDinner: Sher -E- Punjab, Lubbock, cost: 38, cuisines: Tea, Pizza, Mediterranean\nAccommodation: The Perfect Queens Getaway!, Lubbock, cost: 1,029, maximum occupancy: 8, house rules: No children under 10, minimum nights: 2\n\nNumber of people: 2\nTotal cost: (52 + 91 + 38) * 2 + 1,029 = 1,391\nAccommodation minimum nights: 2/2\n\nDays: 5\nCurrent City: from Lubbock, Texas to Las Vegas\nTransportation: Self-driving, from Lubbock to Las Vegas, duration: 13 hours 14 mins, distance: 1,440 km, cost: 72\nBreakfast: -\nAttraction: FiberMax Center for Discovery, Lubbock\nLunch: -\nDinner: -\nAccommodation: -\n\nNumber of people: 2\nTotal cost: 72\n\nTotal cost across all days: 1,229 + 1,238 + 1,144 + 1,391 + 72 = 5,074\nCuisines: The prompt specifies American, Indian, Mediterranean, and Mexican.\n\nPlease note that the total cost exceeds the specified budget of $3,700. Adjustments to the plan, such as choosing more budget-friendly accommodations or dining options, would be necessary to meet the budget constraint.", "gpt-4-1106-preview_direct_sole-planning_parsed_results": [{"day": 1, "current_city": "from Las Vegas to Amarillo, Texas", "transportation": "Self-driving, from Las Vegas to Amarillo, duration: 12 hours 21 mins, distance: 1,386 km", "breakfast": "-", "attraction": "Cadillac Ranch, Amarillo;Amarillo Botanical Gardens, Amarillo;", "lunch": "Thalaivar, Amarillo", "dinner": "The Cinnamon Kitchen, Amarillo", "accommodation": "Gramercy Park restful, cozy, sun-filled home, Amarillo"}, {"day": 2, "current_city": "Amarillo, Texas", "transportation": "-", "breakfast": "Wood Box Cafe, Amarillo", "attraction": "Don Harrington Discovery Center, Amarillo;Texas Air & Space Museum, Amarillo;Amarillo Museum of Art, Amarillo;2nd Amendment Cowboy, Amarillo;", "lunch": "Komachi, Amarillo", "dinner": "Anand Restaurant, Amarillo", "accommodation": "Gramercy Park restful, cozy, sun-filled home, Amarillo"}, {"day": 3, "current_city": "from Amarillo, Texas to Lubbock, Texas", "transportation": "Self-driving, from Amarillo to Lubbock, duration: 1 hour 47 mins, distance: 197 km", "breakfast": "Biryani Sons & Co., Amarillo", "attraction": "Buddy Holly Center, Lubbock;National Ranching Heritage Center, Lubbock;", "lunch": "Grand Barbeque Buffet Restaurant, Lubbock", "dinner": "Mosaic - Country Inn & Suites By Carlson, Lubbock", "accommodation": "The Perfect Queens Getaway!, Lubbock"}, {"day": 4, "current_city": "Lubbock, Texas", "transportation": "-", "breakfast": "Assam Tea Corner, Lubbock", "attraction": "American Windmill Museum, Lubbock;Mackenzie Main City Park, Lubbock;Prairie Dog Town, Lubbock;Lubbock Lake National Historic Landmark, Lubbock;", "lunch": "Paris 6 Classique, Lubbock", "dinner": "Sher -E- Punjab, Lubbock", "accommodation": "The Perfect Queens Getaway!, Lubbock"}, {"day": 5, "current_city": "from Lubbock, Texas to Las Vegas", "transportation": "Self-driving, from Lubbock to Las Vegas, duration: 13 hours 14 mins, distance: 1,440 km", "breakfast": "-", "attraction": "FiberMax Center for Discovery, Lubbock", "lunch": "-", "dinner": "-", "accommodation": "-"}]}]