[{"gpt-4-1106-preview_direct_sole-planning_results": "Travel Plan:\n\nDays: 1\nCurrent City: from Harrisburg to Wichita Falls, Texas\nTransportation: Self-driving, from Harrisburg to Wichita Falls, duration: 20 hours 58 mins, distance: 2,283 km, cost: $114\nBreakfast: -\nAttraction: Museum of North Texas History, Wichita Falls; River Bend Nature Center, Wichita Falls\nLunch: Mama's Boy Restaurant, Wichita Falls, cost: $25, cuisines: Bakery, BBQ\nDinner: Made In Punjab, Wichita Falls, cost: $37, cuisines: French, Bakery, Seafood\nAccommodation: Small, Cozy 1BD Apartment, Wichita Falls, cost: $712, room type: Entire home/apt, house rules: No parties & No smoking & No children under 10, maximum occupancy: 7\n\nNumber of people: 2\nTotal cost: $114 + ($25 + $37) * 2 + $712 = $950\nAccommodation minimum nights: 1/3\n\nDays: 2\nCurrent City: Wichita Falls, Texas\nTransportation: -\nBreakfast: The Coffee Bean & Tea Leaf, Wichita Falls, cost: $21, cuisines: Chinese, Bakery, Desserts\nAttraction: The World's Littlest Skyscraper, Wichita Falls; Lucy Park, Wichita Falls\nLunch: Tyre Patty, Wichita Falls, cost: $92, cuisines: Pizza, BBQ, Bakery, Chinese, American, Seafood\nDinner: PM 2 AM Food Bank, Wichita Falls, cost: $45, cuisines: French, Cafe, Desserts\nAccommodation: Small, Cozy 1BD Apartment, Wichita Falls, cost: $712, room type: Entire home/apt, house rules: No parties & No smoking & No children under 10, maximum occupancy: 7\n\nNumber of people: 2\nTotal cost: ($21 + $92 + $45) * 2 + $712 = $1,046\nAccommodation minimum nights: 2/3\n\nDays: 3\nCurrent City: from Wichita Falls to Waco, Texas\nTransportation: Self-driving, from Wichita Falls to Waco, duration: 3 hours 2 mins, distance: 327 km, cost: $16\nBreakfast: Hunger Strike, Wichita Falls, cost: $32, cuisines: Desserts, Tea, BBQ, Indian, Seafood\nAttraction: Dr Pepper Museum, Waco; Cameron Park Zoo, Waco\nLunch: Fork, Waco, cost: $58, cuisines: Tea, French, Mediterranean, Seafood\nDinner: Blue House Cafe, Waco, cost: $55, cuisines: Tea, Pizza, Mexican, Cafe, Seafood\nAccommodation: Sonder | 21 Chelsea | Central 1BR + Rooftop, Waco, cost: $1,105, room type: Entire home/apt, house rules: No visitors & No smoking & No children under 10, maximum occupancy: 9\n\nNumber of people: 2\nTotal cost: $16 + ($32 + $58 + $55) * 2 + $1,105 = $1,411\nAccommodation minimum nights: 1/29\n\nDays: 4\nCurrent City: Waco, Texas\nTransportation: -\nBreakfast: First Gear Cafe, Waco, cost: $76, cuisines: Desserts, Tea, Fast Food, Chinese, Seafood\nAttraction: Waco Mammoth National Monument, Waco; Mayborn Museum Complex, Waco\nLunch: Punjabi Rasoi, Waco, cost: $70, cuisines: Fast Food, Cafe, Bakery, Seafood\nDinner: Singh Terrace Grill, Waco, cost: $72, cuisines: Desserts, Tea, French, Bakery, Fast Food\nAccommodation: Sonder | 21 Chelsea | Central 1BR + Rooftop, Waco, cost: $1,105, room type: Entire home/apt, house rules: No visitors & No smoking & No children under 10, maximum occupancy: 9\n\nNumber of people: 2\nTotal cost: ($76 + $70 + $72) * 2 + $1,105 = $1,571\nAccommodation minimum nights: 2/29\n\nDays: 5\nCurrent City: from Waco to Houston, Texas\nTransportation: Self-driving, from Waco to Houston, duration: 2 hours 50 mins, distance: 298 km, cost: $14\nBreakfast: Sialkoti Vaishno Dhaba, Waco, cost: $15, cuisines: Tea, Cafe, Desserts\nAttraction: Downtown Aquarium, Houston; Space Center Houston, Houston\nLunch: Jalapenos, Houston, cost: $57, cuisines: Desserts, Tea, Cafe, Chinese, Seafood\nDinner: Super Bakery, Houston, cost: $30, cuisines: Seafood, Fast Food\nAccommodation: Sunny and Airy near Manhattan, Houston, cost: $499, room type: Entire home/apt, house rules: No pets, maximum occupancy: 4\n\nNumber of people: 2\nTotal cost: $14 + ($15 + $57 + $30) * 2 + $499 = $717\nAccommodation minimum nights: 1/2\n\nDays: 6\nCurrent City: Houston, Texas\nTransportation: -\nBreakfast: Sheetla Dhaba, Houston, cost: $35, cuisines: Desserts, Pizza, Bakery, American, Mediterranean\nAttraction: Water Wall, Houston; Houston Museum of Natural Science, Houston\nLunch: Royal Mart, Houston, cost: $40, cuisines: Tea, Bakery, Cafe, Mediterranean, Seafood\nDinner: Matchbox, Houston, cost: $33, cuisines: Tea, Italian, Bakery, Fast Food, Seafood\nAccommodation: Sunny and Airy near Manhattan, Houston, cost: $499, room type: Entire home/apt, house rules: No pets, maximum occupancy: 4\n\nNumber of people: 2\nTotal cost: ($35 + $40 + $33) * 2 + $499 = $724\nAccommodation minimum nights: 2/2\n\nDays: 7\nCurrent City: from Houston to Harrisburg\nTransportation: Self-driving, from Houston to Harrisburg, duration: 21 hours 16 mins, distance: 2,353 km, cost: $117\nBreakfast: Earthen Spices, Houston, cost: $28, cuisines: Tea, Mexican, Bakery, BBQ, Fast Food\nAttraction: Hermann Park, Houston; Houston Zoo, Houston\nLunch: -\nDinner: -\nAccommodation: -\n\nNumber of people: 2\nTotal cost: $117 + $28 * 2 = $173\n\nTotal cost across all days: $950 + $1,046 + $1,411 + $1,571 + $717 + $724 + $173 = $6,592\n\nCuisines: The prompt specifies Italian and French.\n\n**Note**: The total cost exceeds the specified budget of $4,100. Adjustments to the plan, such as choosing less expensive restaurants or accommodations, would be necessary to meet the budget constraint. Additionally, the accommodation in Waco exceeds the travel dates, so a different accommodation with a shorter minimum stay would be needed.", "gpt-4-1106-preview_direct_sole-planning_parsed_results": [{"day": 1, "current_city": "from Harrisburg to Wichita Falls", "transportation": "Self-driving, from Harrisburg to Wichita Falls, duration: 20 hours 58 mins, distance: 2,283 km", "breakfast": "-", "attraction": "Museum of North Texas History, Wichita Falls;River Bend Nature Center, Wichita Falls;", "lunch": "Mama's Boy Restaurant, Wichita Falls", "dinner": "Made In Punjab, Wichita Falls", "accommodation": "Small, Cozy 1BD Apartment, Wichita Falls"}, {"day": 2, "current_city": "Wichita Falls", "transportation": "-", "breakfast": "The Coffee Bean & Tea Leaf, Wichita Falls", "attraction": "The World's Littlest Skyscraper, Wichita Falls;Lucy Park, Wichita Falls;", "lunch": "Tyre Patty, Wichita Falls", "dinner": "PM 2 AM Food Bank, Wichita Falls", "accommodation": "Small, Cozy 1BD Apartment, Wichita Falls"}, {"day": 3, "current_city": "from Wichita Falls to Waco", "transportation": "Self-driving, from Wichita Falls to Waco, duration: 3 hours 2 mins, distance: 327 km", "breakfast": "Hunger Strike, Wichita Falls", "attraction": "Dr Pepper Museum, Waco;Cameron Park Zoo, Waco;", "lunch": "Fork, Waco", "dinner": "Blue House Cafe, Waco", "accommodation": "Sonder | 21 Chelsea | Central 1BR + Rooftop, Waco"}, {"day": 4, "current_city": "Waco", "transportation": "-", "breakfast": "First Gear Cafe, Waco", "attraction": "Waco Mammoth National Monument, Waco;Mayborn Museum Complex, Waco;", "lunch": "Punjabi Rasoi, Waco", "dinner": "Singh Terrace Grill, Waco", "accommodation": "Sonder | 21 Chelsea | Central 1BR + Rooftop, Waco"}, {"day": 5, "current_city": "from Waco to Houston", "transportation": "Self-driving, from Waco to Houston, duration: 2 hours 50 mins, distance: 298 km", "breakfast": "Sialkoti Vaishno Dhaba, Waco", "attraction": "Downtown Aquarium, Houston;Space Center Houston, Houston;", "lunch": "Jalapenos, Houston", "dinner": "Super Bakery, Houston", "accommodation": "Sunny and Airy near Manhattan, Houston"}, {"day": 6, "current_city": "Houston", "transportation": "-", "breakfast": "Sheetla Dhaba, Houston", "attraction": "Water Wall, Houston;Houston Museum of Natural Science, Houston;", "lunch": "Royal Mart, Houston", "dinner": "Matchbox, Houston", "accommodation": "Sunny and Airy near Manhattan, Houston"}, {"day": 7, "current_city": "from Houston to Harrisburg", "transportation": "Self-driving, from Houston to Harrisburg, duration: 21 hours 16 mins, distance: 2,353 km", "breakfast": "Earthen Spices, Houston", "attraction": "Hermann Park, Houston;Houston Zoo, Houston;", "lunch": "-", "dinner": "-", "accommodation": "-"}]}]