[{"gpt-4-1106-preview_direct_sole-planning_results": "Travel Plan:\n\nDays: 1\nCurrent City: from New Orleans to Miami, Florida\nTransportation: Self-driving, from New Orleans to Miami, duration: 12 hours 16 mins, distance: 1,389 km, cost: 69\nBreakfast: -\nAttraction: Jungle Island, Miami; P\u00e9rez Art Museum Miami, Miami\nLunch: Papouli's Mediterranean Cafe & Market, Miami, cost: 26, cuisines: Tea, Desserts\nDinner: Tako Cheena by Pom Pom, Miami, cost: 60, cuisines: Fast Food, Indian, Desserts, Italian\nAccommodation: \"HELLO BROOKLYN\" PARK SIDE VIEW NEWLY RENO APT., Miami, cost: 789, room type: Entire home/apt, house rules: No parties & No visitors, minimum nights: 1, maximum occupancy: 6\n\nNumber of people: 3\nTotal cost: 69 + (26 + 60) * 3 + 789 = 1,056\nAccommodation minimum nights: 1/1\n\nDays: 2\nCurrent City: Miami, Florida\nTransportation: -\nBreakfast: AB's Absolute Barbecues, Miami, cost: 55, cuisines: Desserts, Tea, Pizza, Italian, Fast Food, American\nAttraction: Bayfront Park, Miami; Miami Seaquarium, Miami\nLunch: Spice It - Hotel IBIS, Miami, cost: 38, cuisines: Pizza, Indian, Fast Food, American, Seafood\nDinner: L'Opera, Miami, cost: 28, cuisines: Desserts, Seafood\nAccommodation: Charming 1BD Astoria Penthouse, Miami, cost: 806, room type: Entire home/apt, house rules: No smoking, minimum nights: 2, maximum occupancy: 8\n\nNumber of people: 3\nTotal cost: (55 + 38 + 28) * 3 + 806 = 1,155\nAccommodation minimum nights: 1/2\n\nDays: 3\nCurrent City: from Miami to Tampa, Florida\nTransportation: Self-driving, from Miami to Tampa, duration: 4 hours 1 min, distance: 454 km, cost: 22\nBreakfast: Cafe 17, Miami, cost: 45, cuisines: Tea, BBQ, Bakery, Desserts\nAttraction: The Florida Aquarium, Tampa; Busch Gardens Tampa Bay, Tampa\nLunch: Kobe Hibachi & Sushi, Tampa, cost: 63, cuisines: Desserts, French, BBQ, Bakery, Seafood\nDinner: Peg Leg Pete's, Tampa, cost: 91, cuisines: French, Bakery, Cafe\nAccommodation: Perfect Two Bed Railroad Style Apartment, Tampa, cost: 1093, room type: Entire home/apt, house rules: No pets & No parties, minimum nights: 4, maximum occupancy: 4\n\nNumber of people: 3\nTotal cost: 22 + (45 + 63 + 91) * 3 + 1093 = 1,615\nAccommodation minimum nights: 1/4\n\nDays: 4\nCurrent City: Tampa, Florida\nTransportation: -\nBreakfast: Lalit Kathi Rolls Momos, Tampa, cost: 23, cuisines: Tea, Pizza, Fast Food\nAttraction: Adventure Island, Tampa; Henry B. Plant Museum, Tampa\nLunch: Uptown Fresh Beer Cafe, Tampa, cost: 61, cuisines: Pizza, Mexican, BBQ, Cafe, Seafood\nDinner: Gallery Caf\u6106 - Hyatt Place, Tampa, cost: 42, cuisines: Tea, French, BBQ, Desserts\nAccommodation: Perfect Two Bed Railroad Style Apartment, Tampa, cost: 1093, room type: Entire home/apt, house rules: No pets & No parties, minimum nights: 4, maximum occupancy: 4\n\nNumber of people: 3\nTotal cost: (23 + 61 + 42) * 3 + 1093 = 1,356\nAccommodation minimum nights: 2/4\n\nDays: 5\nCurrent City: from Tampa to New Orleans\nTransportation: Self-driving, from Tampa to New Orleans, duration: 9 hours 15 mins, distance: 1,059 km, cost: 52\nBreakfast: The Zaffran, Tampa, cost: 35, cuisines: Tea, Bakery, Fast Food, American, Seafood\nAttraction: -\nLunch: -\nDinner: -\nAccommodation: -\n\nNumber of people: 3\nTotal cost: 52 + 35 * 3 = 157\n\nTotal cost across all days: 1,056 + 1,155 + 1,615 + 1,356 + 157 = 5,339\n\nUnfortunately, the total cost exceeds the specified budget of $4,200. Adjustments need to be made to the plan to reduce costs. This could involve choosing less expensive accommodations, dining options, or attractions.", "gpt-4-1106-preview_direct_sole-planning_parsed_results": [{"day": 1, "current_city": "from New Orleans to Miami, Florida", "transportation": "Self-driving, from New Orleans to Miami, duration: 12 hours 16 mins, distance: 1,389 km", "breakfast": "-", "attraction": "Jungle Island, Miami;P\u00e9rez Art Museum Miami, Miami;", "lunch": "Papouli's Mediterranean Cafe & Market, Miami", "dinner": "Tako Cheena by Pom Pom, Miami", "accommodation": "\"HELLO BROOKLYN\" PARK SIDE VIEW NEWLY RENO APT., Miami"}, {"day": 2, "current_city": "Miami, Florida", "transportation": "-", "breakfast": "AB's Absolute Barbecues, Miami", "attraction": "Bayfront Park, Miami;Miami Seaquarium, Miami;", "lunch": "Spice It - Hotel IBIS, Miami", "dinner": "L'Opera, Miami", "accommodation": "Charming 1BD Astoria Penthouse, Miami"}, {"day": 3, "current_city": "from Miami to Tampa, Florida", "transportation": "Self-driving, from Miami to Tampa, duration: 4 hours 1 min, distance: 454 km", "breakfast": "Cafe 17, Miami", "attraction": "The Florida Aquarium, Tampa;Busch Gardens Tampa Bay, Tampa;", "lunch": "Kobe Hibachi & Sushi, Tampa", "dinner": "Peg Leg Pete's, Tampa", "accommodation": "Perfect Two Bed Railroad Style Apartment, Tampa"}, {"day": 4, "current_city": "Tampa, Florida", "transportation": "-", "breakfast": "Lalit Kathi Rolls Momos, Tampa", "attraction": "Adventure Island, Tampa;Henry B. Plant Museum, Tampa;", "lunch": "Uptown Fresh Beer Cafe, Tampa", "dinner": "Gallery Caf\u6106 - Hyatt Place, Tampa", "accommodation": "Perfect Two Bed Railroad Style Apartment, Tampa"}, {"day": 5, "current_city": "from Tampa to New Orleans", "transportation": "Self-driving, from Tampa to New Orleans, duration: 9 hours 15 mins, distance: 1,059 km", "breakfast": "The Zaffran, Tampa", "attraction": "-", "lunch": "-", "dinner": "-", "accommodation": "-"}]}]