[{"gpt-4-1106-preview_direct_sole-planning_results": "Travel Plan:\n\nDays: 1\nCurrent City: from Little Rock to Houston, Texas\nTransportation: Self-driving, from Little Rock to Houston, duration: 6 hours 47 mins, distance: 698 km, cost: 34\nBreakfast: -\nAttraction: Downtown Aquarium, Houston; Space Center Houston, Houston\nLunch: Jalapenos, Houston, cost: 57, cuisines: Desserts, Tea, Cafe, Chinese, Seafood\nDinner: The BrewMaster - The Mix Fine Dine, Houston, cost: 52, cuisines: French, Indian, Cafe, Seafood\nAccommodation: Sunny and Airy near Manhattan, Houston, cost: 499, room type: Entire home/apt, house rules: No pets, minimum nights: 2, maximum occupancy: 4\n\nNumber of people: 1\nTotal cost: 34 + 57 + 52 + 499 = 642\nAccommodation minimum nights: 1/2\n\nDays: 2\nCurrent City: Houston, Texas\nTransportation: -\nBreakfast: Super Bakery, Houston, cost: 30, cuisines: Seafood, Fast Food\nAttraction: Water Wall, Houston; Houston Museum of Natural Science, Houston; Houston Zoo, Houston\nLunch: Sheetla Dhaba, Houston, cost: 35, cuisines: Desserts, Pizza, Bakery, American, Mediterranean\nDinner: Matchbox, Houston, cost: 33, cuisines: Tea, Italian, Bakery, Fast Food, Seafood\nAccommodation: Sunny and Airy near Manhattan, Houston, cost: 499, room type: Entire home/apt, house rules: No pets, minimum nights: 2, maximum occupancy: 4\n\nNumber of people: 1\nTotal cost: 30 + 35 + 33 + 499 = 597\nAccommodation minimum nights: 2/2\n\nDays: 3\nCurrent City: from Houston to Dallas, Texas\nTransportation: Self-driving, from Houston to Dallas, duration: 3 hours 27 mins, distance: 385 km, cost: 19\nBreakfast: Earthen Spices, Houston, cost: 28, cuisines: Tea, Mexican, Bakery, BBQ, Fast Food\nAttraction: The Dallas World Aquarium, Dallas; The Sixth Floor Museum at Dealey Plaza, Dallas\nLunch: Coconuts Fish Cafe, Dallas, cost: 38, cuisines: Cafe, BBQ, Mediterranean, Fast Food\nDinner: 1918 Bistro & Grill, Dallas, cost: 90, cuisines: Tea, Pizza, BBQ, Seafood\nAccommodation: 1BR, elevator, kitchen, doorman!, Dallas, cost: 475, room type: Entire home/apt, house rules: No parties, minimum nights: 1, maximum occupancy: 3\n\nNumber of people: 1\nTotal cost: 19 + 28 + 38 + 90 + 475 = 650\nAccommodation minimum nights: 1/1\n\nDays: 4\nCurrent City: Dallas, Texas\nTransportation: -\nBreakfast: Cafe Gatherings, Dallas, cost: 17, cuisines: Bakery, Indian, Desserts\nAttraction: Reunion Tower, Dallas; Dallas Museum of Art, Dallas; Klyde Warren Park, Dallas\nLunch: Yanki Sizzlers, Dallas, cost: 96, cuisines: Cafe, French, Tea, Mediterranean\nDinner: Aravali Owls, Dallas, cost: 53, cuisines: Pizza, Italian, Bakery, Fast Food, Cafe\nAccommodation: 1BR, elevator, kitchen, doorman!, Dallas, cost: 475, room type: Entire home/apt, house rules: No parties, minimum nights: 1, maximum occupancy: 3\n\nNumber of people: 1\nTotal cost: 17 + 96 + 53 + 475 = 641\nAccommodation minimum nights: 1/1\n\nDays: 5\nCurrent City: from Dallas to Little Rock\nTransportation: Self-driving, from Dallas to Little Rock, duration: 4 hours 40 mins, distance: 514 km, cost: 25\nBreakfast: Drifters Cafe, Dallas, cost: 21, cuisines: Tea, French, Mexican, Cafe, Seafood\nAttraction: -\nLunch: -\nDinner: -\nAccommodation: -\n\nNumber of people: 1\nTotal cost: 25 + 21 = 46\n\nTotal cost across all days: 642 + 597 + 650 + 641 + 46 = 2,576\n\nCuisines: The prompt specifies a variety of cuisines, including American, French, Mediterranean, and Italian, which have been included in the meal selections.\n\nConstraints and Notes:\n- The travel plan starts and ends in Little Rock, forming a closed circle.\n- Each city in Texas (Houston and Dallas) is visited consecutively without reappearing once its sequence is over.\n- The transportation method is consistent with self-driving, as per the constraint of no flights.\n- The accommodation matches the final city listed for each day and adheres to the house rules specified.\n- The number of visiting cities matches the specified visiting city number in the query (2 cities in Texas).\n- The number of days in the plan matches the specified number of days in the query (5 days).\n- The total cost of the travel plan does not exceed the specified budget in the query ($3,900).\n- All restaurants and attractions are within the destination cities, avoiding the origin city unless specified otherwise.\n- The travel plan includes a variety of cuisines as requested.", "gpt-4-1106-preview_direct_sole-planning_parsed_results": [{"day": 1, "current_city": "from Little Rock to Houston", "transportation": "Self-driving, from Little Rock to Houston, duration: 6 hours 47 mins, distance: 698 km", "breakfast": "-", "attraction": "Downtown Aquarium, Houston;Space Center Houston, Houston;", "lunch": "Jalapenos, Houston", "dinner": "The BrewMaster - The Mix Fine Dine, Houston", "accommodation": "Sunny and Airy near Manhattan, Houston"}, {"day": 2, "current_city": "Houston", "transportation": "-", "breakfast": "Super Bakery, Houston", "attraction": "Water Wall, Houston;Houston Museum of Natural Science, Houston;Houston Zoo, Houston;", "lunch": "Sheetla Dhaba, Houston", "dinner": "Matchbox, Houston", "accommodation": "Sunny and Airy near Manhattan, Houston"}, {"day": 3, "current_city": "from Houston to Dallas", "transportation": "Self-driving, from Houston to Dallas, duration: 3 hours 27 mins, distance: 385 km", "breakfast": "Earthen Spices, Houston", "attraction": "The Dallas World Aquarium, Dallas;The Sixth Floor Museum at Dealey Plaza, Dallas;", "lunch": "Coconuts Fish Cafe, Dallas", "dinner": "1918 Bistro & Grill, Dallas", "accommodation": "1BR, elevator, kitchen, doorman!, Dallas"}, {"day": 4, "current_city": "Dallas", "transportation": "-", "breakfast": "Cafe Gatherings, Dallas", "attraction": "Reunion Tower, Dallas;Dallas Museum of Art, Dallas;Klyde Warren Park, Dallas;", "lunch": "Yanki Sizzlers, Dallas", "dinner": "Aravali Owls, Dallas", "accommodation": "1BR, elevator, kitchen, doorman!, Dallas"}, {"day": 5, "current_city": "from Dallas to Little Rock", "transportation": "Self-driving, from Dallas to Little Rock, duration: 4 hours 40 mins, distance: 514 km", "breakfast": "Drifters Cafe, Dallas", "attraction": "-", "lunch": "-", "dinner": "-", "accommodation": "-"}]}]