[{"gpt-4-1106-preview_direct_sole-planning_results": "Travel Plan:\n\nDays: 1\nCurrent City: from Peoria to Moline, Illinois\nTransportation: Self-driving, from Peoria to Moline, duration: 1 hour 27 mins, distance: 151 km, cost: 7\nBreakfast: -\nAttraction: John Deere Pavilion, Moline; Celebration River Cruises, Moline\nLunch: Royal Hotel, Moline, cost: 74, cuisines: Tea, Pizza, Mexican, Chinese, Seafood\nDinner: Zoe, Moline, cost: 15, cuisines: French, Cafe, Fast Food\nAccommodation: Sunny duplex near Central Park, Moline, cost: 541, room type: Entire home/apt, house rules: No pets, minimum nights: 1, maximum occupancy: 5\n\nNumber of people: 3\nTotal cost: 7 + (74 + 15) * 3 + 541 = 758\nAccommodation minimum nights: 1/1\n\nDays: 2\nCurrent City: Moline, Illinois\nTransportation: -\nBreakfast: Lovecrumbs Bakery, Moline, cost: 24, cuisines: Tea, Pizza, American, Desserts\nAttraction: Sylvan Island, Moline; Ben Butterworth Parkway, Moline\nLunch: Mummy's Kitchen, Moline, cost: 54, cuisines: Desserts, Indian, Mediterranean, BBQ\nDinner: The Bar - Trident Gurgaon, Moline, cost: 48, cuisines: Pizza, French, BBQ, Fast Food, Indian\nAccommodation: Sunny duplex near Central Park, Moline, cost: 541, room type: Entire home/apt, house rules: No pets, minimum nights: 1, maximum occupancy: 5\n\nNumber of people: 3\nTotal cost: (24 + 54 + 48) * 3 + 541 = 793\nAccommodation minimum nights: 2/2\n\nDays: 3\nCurrent City: from Moline to Chicago, Illinois\nTransportation: Self-driving, from Moline to Chicago, duration: 2 hours 43 mins, distance: 266 km, cost: 13\nBreakfast: Hucka, Moline, cost: 29, cuisines: Desserts, Tea, Pizza, Fast Food, American\nAttraction: Navy Pier, Chicago; Millennium Park, Chicago\nLunch: The Black Pearl, Chicago, cost: 63, cuisines: Cafe, Bakery\nDinner: Pantry d'or, Chicago, cost: 53, cuisines: Tea, BBQ, Fast Food, Cafe, Indian\nAccommodation: Newly Renovated Greenpoint Abode, Chicago, cost: 981, room type: Entire home/apt, house rules: No parties & No children under 10 & No smoking, minimum nights: 2, maximum occupancy: 7\n\nNumber of people: 3\nTotal cost: 13 + (29 + 63 + 53) * 3 + 981 = 1,390\nAccommodation minimum nights: 1/2\n\nDays: 4\nCurrent City: Chicago, Illinois\nTransportation: -\nBreakfast: Bro's Kitchenette, Chicago, cost: 38, cuisines: Mexican, Desserts, Seafood\nAttraction: Skydeck Chicago; 360 CHICAGO; Willis Tower\nLunch: Mini's Royal Cafe, Chicago, cost: 72, cuisines: Tea, Cafe, Bakery\nDinner: Pizza Hut, Chicago, cost: 99, cuisines: Pizza, French, Bakery, BBQ, Fast Food, American\nAccommodation: Newly Renovated Greenpoint Abode, Chicago, cost: 981, room type: Entire home/apt, house rules: No parties & No children under 10 & No smoking, minimum nights: 2, maximum occupancy: 7\n\nNumber of people: 3\nTotal cost: (38 + 72 + 99) * 3 + 981 = 1,506\nAccommodation minimum nights: 2/2\n\nDays: 5\nCurrent City: from Chicago to Rockford, Illinois\nTransportation: Self-driving, from Chicago to Rockford, duration: 1 hour 32 mins, distance: 143 km, cost: 7\nBreakfast: Gyan Vaishnav, Chicago, cost: 14, cuisines: Bakery, Desserts\nAttraction: Anderson Japanese Gardens, Rockford; Discovery Center Museum, Rockford\nLunch: Coco Bambu, Rockford, cost: 72, cuisines: Tea, French, Bakery, BBQ, Cafe\nDinner: Flying Mango, Rockford, cost: 20, cuisines: American, BBQ, Seafood\nAccommodation: Spacious 3BDR Prime Location!, Rockford, cost: 1030, room type: Entire home/apt, house rules: No smoking, minimum nights: 2, maximum occupancy: 9\n\nNumber of people: 3\nTotal cost: 7 + (14 + 72 + 20) * 3 + 1030 = 1,271\nAccommodation minimum nights: 1/2\n\nDays: 6\nCurrent City: Rockford, Illinois\nTransportation: -\nBreakfast: Moets Arabica, Rockford, cost: 43, cuisines: Tea, Bakery, Indian, Fast Food\nAttraction: Burpee Museum of Natural History, Rockford; Midway Village Museum, Rockford\nLunch: Cafe Coffee Day, Rockford, cost: 28, cuisines: Chinese, Desserts, Pizza, Cafe, Mediterranean\nDinner: Cafe Southall, Rockford, cost: 56, cuisines: Seafood, Pizza, Cafe, Fast Food\nAccommodation: Spacious 3BDR Prime Location!, Rockford, cost: 1030, room type: Entire home/apt, house rules: No smoking, minimum nights: 2, maximum occupancy: 9\n\nNumber of people: 3\nTotal cost: (43 + 28 + 56) * 3 + 1030 = 1,286\nAccommodation minimum nights: 2/2\n\nDays: 7\nCurrent City: from Rockford to Peoria, Illinois\nTransportation: Self-driving, from Rockford to Peoria, duration: 2 hours 17 mins, distance: 219 km, cost: 10\nBreakfast: Nutri Punch, Rockford, cost: 34, cuisines: Tea, Chinese, Cafe, Desserts\nAttraction: -\nLunch: -\nDinner: -\nAccommodation: -\n\nNumber of people: 3\nTotal cost: 10 + 34 * 3 = 112\n\nTotal cost across all days: 758 + 793 + 1,390 + 1,506 + 1,271 + 1,286 + 112 = 7,116\n\nCuisines: The prompt specifies no specific cuisines, so a variety was chosen.\nTransportation: Self-driving was chosen to comply with the no flight constraint and to allow flexibility with children under 10.", "gpt-4-1106-preview_direct_sole-planning_parsed_results": [{"day": 1, "current_city": "from Peoria to Moline", "transportation": "Self-driving, from Peoria to Moline, duration: 1 hour 27 mins, distance: 151 km", "breakfast": "-", "attraction": "John Deere Pavilion, Moline;Celebration River Cruises, Moline;", "lunch": "Royal Hotel, Moline", "dinner": "Zoe, Moline", "accommodation": "Sunny duplex near Central Park, Moline"}, {"day": 2, "current_city": "Moline", "transportation": "-", "breakfast": "Lovecrumbs Bakery, Moline", "attraction": "Sylvan Island, Moline;Ben Butterworth Parkway, Moline;", "lunch": "Mummy's Kitchen, Moline", "dinner": "The Bar - Trident Gurgaon, Moline", "accommodation": "Sunny duplex near Central Park, Moline"}, {"day": 3, "current_city": "from Moline to Chicago", "transportation": "Self-driving, from Moline to Chicago, duration: 2 hours 43 mins, distance: 266 km", "breakfast": "Hucka, Moline", "attraction": "Navy Pier, Chicago;Millennium Park, Chicago;", "lunch": "The Black Pearl, Chicago", "dinner": "Pantry d'or, Chicago", "accommodation": "Newly Renovated Greenpoint Abode, Chicago"}, {"day": 4, "current_city": "Chicago", "transportation": "-", "breakfast": "Bro's Kitchenette, Chicago", "attraction": "Skydeck Chicago;360 CHICAGO;Willis Tower;", "lunch": "Mini's Royal Cafe, Chicago", "dinner": "Pizza Hut, Chicago", "accommodation": "Newly Renovated Greenpoint Abode, Chicago"}, {"day": 5, "current_city": "from Chicago to Rockford", "transportation": "Self-driving, from Chicago to Rockford, duration: 1 hour 32 mins, distance: 143 km", "breakfast": "Gyan Vaishnav, Chicago", "attraction": "Anderson Japanese Gardens, Rockford;Discovery Center Museum, Rockford;", "lunch": "Coco Bambu, Rockford", "dinner": "Flying Mango, Rockford", "accommodation": "Spacious 3BDR Prime Location!, Rockford"}, {"day": 6, "current_city": "Rockford", "transportation": "-", "breakfast": "Moets Arabica, Rockford", "attraction": "Burpee Museum of Natural History, Rockford;Midway Village Museum, Rockford;", "lunch": "Cafe Coffee Day, Rockford", "dinner": "Cafe Southall, Rockford", "accommodation": "Spacious 3BDR Prime Location!, Rockford"}, {"day": 7, "current_city": "from Rockford to Peoria", "transportation": "Self-driving, from Rockford to Peoria, duration: 2 hours 17 mins, distance: 219 km", "breakfast": "Nutri Punch, Rockford", "attraction": "-", "lunch": "-", "dinner": "-", "accommodation": "-"}]}]