[{"gpt-4-1106-preview_direct_sole-planning_results": "Travel Plan:\n\nDays: 1\nCurrent City: from Manchester to Charlotte\nTransportation: Flight F3785421, from Manchester to Charlotte, departure: 14:16, arrival: 16:46, duration: 2 hours 30 minutes, distance: 737 km, cost: $223 per person\nBreakfast: -\nAttraction: Freedom Park, Charlotte; Levine Museum of the New South, Charlotte\nLunch: Olive Tree Cafe, Charlotte, cost: $23, cuisines: Tea, Chinese, Desserts\nDinner: Central Perk 7, Charlotte, cost: $87, cuisines: Pizza, Bakery, BBQ, Fast Food\nAccommodation: Elegant Studio Apt in Prospect Heights, Charlotte, cost: $640, entire home/apt, house rules: No parties, minimum nights: 2, maximum occupancy: 5\n\nNumber of people: 5\nTotal cost: $223 * 5 + ($23 + $87) * 5 + $640 = $1,115 + $550 + $640 = $2,305\nAccommodation minimum nights: 1/2\n\nDays: 2\nCurrent City: Charlotte\nTransportation: -\nBreakfast: Cafe Maple Street, Charlotte, cost: $91, cuisines: Fast Food, Tea, Italian\nAttraction: Discovery Place Science, Charlotte; NASCAR Hall of Fame, Charlotte\nLunch: Kylin Skybar, Charlotte, cost: $44, cuisines: Tea, Cafe, Pizza, Italian\nDinner: Unplugged Courtyard, Charlotte, cost: $54, cuisines: Desserts, French, Bakery, Cafe, Seafood\nAccommodation: Elegant Studio Apt in Prospect Heights, Charlotte, cost: $640, entire home/apt, house rules: No parties, minimum nights: 2, maximum occupancy: 5\n\nNumber of people: 5\nTotal cost: ($91 + $44 + $54) * 5 + $640 = $945 + $640 = $1,585\nAccommodation minimum nights: 2/2\n\nDays: 3\nCurrent City: from Charlotte to Manchester\nTransportation: Flight F3785397, from Charlotte to Manchester, departure: 11:21, arrival: 13:22, duration: 2 hours 1 minute, distance: 737 km, cost: $284 per person\nBreakfast: -\nAttraction: The Mint Museum, Charlotte\nLunch: -\nDinner: -\nAccommodation: -\n\nNumber of people: 5\nTotal cost: $284 * 5 = $1,420\n\nTotal cost across all days: $2,305 + $1,585 + $1,420 = $5,310\n\nUnfortunately, the total cost exceeds the specified budget of $4,800. To adjust the plan to fit the budget, we can consider changing the flight to a cheaper option or selecting a less expensive accommodation. Here's the adjusted plan:\n\nAdjusted Travel Plan:\n\nDays: 1\nCurrent City: from Manchester to Charlotte\nTransportation: Flight F3791567, from Manchester to Charlotte, departure: 05:24, arrival: 07:33, duration: 2 hours 9 minutes, distance: 737 km, cost: $268 per person\nBreakfast: -\nAttraction: Freedom Park, Charlotte; Levine Museum of the New South, Charlotte\nLunch: Olive Tree Cafe, Charlotte, cost: $23, cuisines: Tea, Chinese, Desserts\nDinner: Central Perk 7, Charlotte, cost: $87, cuisines: Pizza, Bakery, BBQ, Fast Food\nAccommodation: Two Bedrooms with Dedicated Bath, Charlotte, cost: $615, private room, house rules: No visitors & No pets, minimum nights: 3, maximum occupancy: 2\n\nNumber of people: 5\nTotal cost: $268 * 5 + ($23 + $87) * 5 + $615 = $1,340 + $550 + $615 = $2,505\nAccommodation minimum nights: 1/3\n\nDays: 2\nCurrent City: Charlotte\nTransportation: -\nBreakfast: Cafe Maple Street, Charlotte, cost: $91, cuisines: Fast Food, Tea, Italian\nAttraction: Discovery Place Science, Charlotte; NASCAR Hall of Fame, Charlotte\nLunch: Kylin Skybar, Charlotte, cost: $44, cuisines: Tea, Cafe, Pizza, Italian\nDinner: Unplugged Courtyard, Charlotte, cost: $54, cuisines: Desserts, French, Bakery, Cafe, Seafood\nAccommodation: Two Bedrooms with Dedicated Bath, Charlotte, cost: $615, private room, house rules: No visitors & No pets, minimum nights: 3, maximum occupancy: 2\n\nNumber of people: 5\nTotal cost: ($91 + $44 + $54) * 5 + $615 = $945 + $615 = $1,560\nAccommodation minimum nights: 2/3\n\nDays: 3\nCurrent City: from Charlotte to Manchester\nTransportation: Flight F3786316, from Charlotte to Manchester, departure: 17:05, arrival: 19:04, duration: 1 hour 59 minutes, distance: 737 km, cost: $208 per person\nBreakfast: -\nAttraction: The Mint Museum, Charlotte\nLunch: -\nDinner: -\nAccommodation: -\n\nNumber of people: 5\nTotal cost: $208 * 5 = $1,040\n\nTotal cost across all days: $2,505 + $1,560 + $1,040 = $5,105\n\nThe adjusted plan still exceeds the budget. To fit within the budget, we can opt for the cheapest flight option on the return trip:\n\nDays: 3 (Adjusted)\nCurrent City: from Charlotte to Manchester\nTransportation: Flight F3796765, from Charlotte to Manchester, departure: 20:29, arrival: 22:34, duration: 2 hours 5 minutes, distance: 737 km, cost: $240 per person\nBreakfast: -\nAttraction: The Mint Museum, Charlotte\nLunch: -\nDinner: -\nAccommodation: -\n\nNumber of people: 5\nTotal cost: $240 * 5 = $1,200\n\nTotal cost across all days (Adjusted): $2,505 + $1,560 + $1,200 = $5,265\n\nThe plan is still over budget. To further reduce costs, we can select a different accommodation for the second night:\n\nDays: 2 (Adjusted)\nCurrent City: Charlotte\nTransportation: -\nBreakfast: Cafe Maple Street, Charlotte, cost: $91, cuisines: Fast Food, Tea, Italian\nAttraction: Discovery Place Science, Charlotte; NASCAR Hall of Fame, Charlotte\nLunch: Kylin Skybar, Charlotte, cost: $44, cuisines: Tea, Cafe, Pizza, Italian\nDinner: Unplugged Courtyard, Charlotte, cost: $54, cuisines: Desserts, French, Bakery, Cafe, Seafood\nAccommodation: Cute Greenpoint room, Charlotte, cost: $335, private room, house rules: No children under 10 & No pets, minimum nights: 3, maximum occupancy: 1\n\nNumber of people: 5\nTotal cost: ($91 + $44 + $54) * 5 + $335 = $945 + $335 = $1,280\nAccommodation minimum nights: 2/3\n\nTotal cost across all days (Further Adjusted): $2,505 + $1,280 + $1,200 = $4,985\n\nThe plan is still slightly over budget. To ensure we stay within the budget, we can adjust the meal plan to include more affordable options or reduce the number of attractions visited.\n\nPlease note that the provided reference information does not include all necessary details such as the cost of attractions, and the accommodation options may not be suitable for a group of 5 requiring entire rooms. Additionally, the accommodation costs provided are per night, and the minimum stay requirements may not align with the travel dates. Therefore, the travel plan above is a best-effort estimate based on the available information and may require further adjustments to meet all constraints and preferences.", "gpt-4-1106-preview_direct_sole-planning_parsed_results": [{"day": 1, "current_city": "from Manchester to Charlotte", "transportation": "Flight Number: F3785421, from Manchester to Charlotte, Departure Time: 14:16, Arrival Time: 16:46", "breakfast": "-", "attraction": "Freedom Park, Charlotte;Levine Museum of the New South, Charlotte;", "lunch": "Olive Tree Cafe, Charlotte", "dinner": "Central Perk 7, Charlotte", "accommodation": "Elegant Studio Apt in Prospect Heights, Charlotte"}, {"day": 2, "current_city": "Charlotte", "transportation": "-", "breakfast": "Cafe Maple Street, Charlotte", "attraction": "Discovery Place Science, Charlotte;NASCAR Hall of Fame, Charlotte;", "lunch": "Kylin Skybar, Charlotte", "dinner": "Unplugged Courtyard, Charlotte", "accommodation": "Elegant Studio Apt in Prospect Heights, Charlotte"}, {"day": 3, "current_city": "from Charlotte to Manchester", "transportation": "Flight Number: F3785397, from Charlotte to Manchester, Departure Time: 11:21, Arrival Time: 13:22", "breakfast": "-", "attraction": "The Mint Museum, Charlotte", "lunch": "-", "dinner": "-", "accommodation": "-"}, {"day": 1, "current_city": "from Manchester to Charlotte", "transportation": "Flight Number: F3791567, from Manchester to Charlotte, Departure Time: 05:24, Arrival Time: 07:33", "breakfast": "-", "attraction": "Freedom Park, Charlotte;Levine Museum of the New South, Charlotte;", "lunch": "Olive Tree Cafe, Charlotte", "dinner": "Central Perk 7, Charlotte", "accommodation": "Two Bedrooms with Dedicated Bath, Charlotte"}, {"day": 2, "current_city": "Charlotte", "transportation": "-", "breakfast": "Cafe Maple Street, Charlotte", "attraction": "Discovery Place Science, Charlotte;NASCAR Hall of Fame, Charlotte;", "lunch": "Kylin Skybar, Charlotte", "dinner": "Unplugged Courtyard, Charlotte", "accommodation": "Two Bedrooms with Dedicated Bath, Charlotte"}, {"day": 3, "current_city": "from Charlotte to Manchester", "transportation": "Flight Number: F3786316, from Charlotte to Manchester, Departure Time: 17:05, Arrival Time: 19:04", "breakfast": "-", "attraction": "The Mint Museum, Charlotte", "lunch": "-", "dinner": "-", "accommodation": "-"}, {"day": 3, "current_city": "from Charlotte to Manchester", "transportation": "Flight Number: F3796765, from Charlotte to Manchester, Departure Time: 20:29, Arrival Time: 22:34", "breakfast": "-", "attraction": "The Mint Museum, Charlotte", "lunch": "-", "dinner": "-", "accommodation": "-"}, {"day": 2, "current_city": "Charlotte", "transportation": "-", "breakfast": "Cafe Maple Street, Charlotte", "attraction": "Discovery Place Science, Charlotte;NASCAR Hall of Fame, Charlotte;", "lunch": "Kylin Skybar, Charlotte", "dinner": "Unplugged Courtyard, Charlotte", "accommodation": "Cute Greenpoint room, Charlotte"}]}]