[{"gpt-4-1106-preview_direct_sole-planning_results": "Travel Plan:\n\nDays: 1\nCurrent City: from Milwaukee to New York\nTransportation: Self-driving, from Milwaukee to New York, duration: 13 hours 29 mins, distance: 1,417 km, cost: 70\nBreakfast: -\nAttraction: -\nLunch: -\nDinner: Seasons 52 Fresh Grill, New York, cost: 30, cuisines: Seafood, Indian, Desserts, Italian\nAccommodation: Beautiful and big 1BR sublet close by Central Park, New York, cost: 983, room type: Private room, house rules: No parties & No children under 10, minimum nights: 1, maximum occupancy: 2\n\nNumber of people: 2\nTotal cost: 70 + (30 * 2) + 983 = 1,113\nAccommodation minimum nights: 1/1\n\nDays: 2\nCurrent City: New York\nTransportation: -\nBreakfast: Gurgaon Hights, New York, cost: 46, cuisines: Cafe, American, Indian, Fast Food\nAttraction: Central Park, New York; Statue of Liberty, New York\nLunch: Lord of the Drinks Forum, New York, cost: 71, cuisines: Cafe, Bakery, BBQ, Chinese, Indian\nDinner: 736 A.D., New York, cost: 99, cuisines: Desserts, Bakery, Fast Food, American, Mediterranean\nAccommodation: Beautiful and big 1BR sublet close by Central Park, New York, cost: 983, room type: Private room, house rules: No parties & No children under 10, minimum nights: 1, maximum occupancy: 2\n\nNumber of people: 2\nTotal cost: (46 + 71 + 99) * 2 + 983 = 1,344\nAccommodation minimum nights: 2/2\n\nDays: 3\nCurrent City: from New York to Milwaukee\nTransportation: Self-driving, from New York to Milwaukee, duration: 13 hours 28 mins, distance: 1,417 km, cost: 70\nBreakfast: -\nAttraction: -\nLunch: -\nDinner: -\nAccommodation: -\n\nNumber of people: 2\nTotal cost: 70\n\nTotal cost across all days: 1,113 + 1,344 + 70 = 2,527\n\nUnfortunately, the total cost exceeds the specified budget of $1,900. To adjust the plan to fit the budget, we need to make some changes:\n\nRevised Travel Plan:\n\nDays: 1\nCurrent City: from Milwaukee to New York\nTransportation: Self-driving, from Milwaukee to New York, duration: 13 hours 29 mins, distance: 1,417 km, cost: 70\nBreakfast: -\nAttraction: -\nLunch: -\nDinner: Seasons 52 Fresh Grill, New York, cost: 30, cuisines: Seafood, Indian, Desserts, Italian\nAccommodation: A Contemporary Homelike Stay in the Best of BK, New York, cost: 228, room type: Entire home/apt, house rules: No pets & No visitors & No children under 10, minimum nights: 1, maximum occupancy: 2\n\nNumber of people: 2\nTotal cost: 70 + (30 * 2) + 228 = 358\nAccommodation minimum nights: 1/1\n\nDays: 2\nCurrent City: New York\nTransportation: -\nBreakfast: Gurgaon Hights, New York, cost: 46, cuisines: Cafe, American, Indian, Fast Food\nAttraction: Central Park, New York; Statue of Liberty, New York\nLunch: Lord of the Drinks Forum, New York, cost: 71, cuisines: Cafe, Bakery, BBQ, Chinese, Indian\nDinner: 736 A.D., New York, cost: 99, cuisines: Desserts, Bakery, Fast Food, American, Mediterranean\nAccommodation: A Contemporary Homelike Stay in the Best of BK, New York, cost: 228, room type: Entire home/apt, house rules: No pets & No visitors & No children under 10, minimum nights: 1, maximum occupancy: 2\n\nNumber of people: 2\nTotal cost: (46 + 71 + 99) * 2 + 228 = 590\nAccommodation minimum nights: 2/2\n\nDays: 3\nCurrent City: from New York to Milwaukee\nTransportation: Self-driving, from New York to Milwaukee, duration: 13 hours 28 mins, distance: 1,417 km, cost: 70\nBreakfast: -\nAttraction: -\nLunch: -\nDinner: -\nAccommodation: -\n\nNumber of people: 2\nTotal cost: 70\n\nTotal revised cost across all days: 358 + 590 + 70 = 1,018\n\nThe revised travel plan fits within the budget of $1,900.", "gpt-4-1106-preview_direct_sole-planning_parsed_results": [{"day": 1, "current_city": "from Milwaukee to New York", "transportation": "Self-driving, from Milwaukee to New York, duration: 13 hours 29 mins, distance: 1,417 km", "breakfast": "-", "attraction": "-", "lunch": "-", "dinner": "Seasons 52 Fresh Grill, New York", "accommodation": "A Contemporary Homelike Stay in the Best of BK, New York"}, {"day": 2, "current_city": "New York", "transportation": "-", "breakfast": "Gurgaon Hights, New York", "attraction": "Central Park, New York;Statue of Liberty, New York;", "lunch": "Lord of the Drinks Forum, New York", "dinner": "736 A.D., New York", "accommodation": "A Contemporary Homelike Stay in the Best of BK, New York"}, {"day": 3, "current_city": "from New York to Milwaukee", "transportation": "Self-driving, from New York to Milwaukee, duration: 13 hours 28 mins, distance: 1,417 km", "breakfast": "-", "attraction": "-", "lunch": "-", "dinner": "-", "accommodation": "-"}]}]