[{"gpt-4-1106-preview_direct_sole-planning_results": "Travel Plan:\nDays: 1\nCurrent City: from Oakland to Tucson, Arizona\nTransportation: Flight F4002752, from Oakland to Tucson, duration: 1 hour 53 minutes, cost: 190\nBreakfast: -\nAttraction: Pima Air & Space Museum, Tucson; Reid Park Zoo, Tucson\nLunch: Villa Tevere, Tucson, cost: 37, cuisines: Mexican, Mediterranean, Desserts, Fast Food\nDinner: Consort Restaurant, Tucson, cost: 54, cuisines: Bakery, Pizza, Indian, Desserts\nAccommodation: Room for rent shared bathroom, Tucson, cost: 557, room type: Private room, house rules: No smoking, minimum nights: 1, maximum occupancy: 2\n\nNumber of people: 1\nTotal cost: 190 + 37 + 54 + 557 = 838\n\nDays: 2\nCurrent City: Tucson, Arizona\nTransportation: -\nBreakfast: Magic Spice Wok, Tucson, cost: 31, cuisines: Cafe, Bakery, BBQ, Chinese, Seafood\nAttraction: Tucson Botanical Gardens, Tucson; Old Tucson, Tucson\nLunch: Pizza Street, Tucson, cost: 22, cuisines: Fast Food, Bakery, Seafood\nDinner: La Plage, Tucson, cost: 93, cuisines: Seafood, Bakery, Desserts, Italian\nAccommodation: Private and Quiet Room in the Perfect Location, Tucson, cost: 431, room type: Private room, house rules: No smoking & No parties, minimum nights: 1, maximum occupancy: 2\n\nNumber of people: 1\nTotal cost: 31 + 22 + 93 + 431 = 577\n\nDays: 3\nCurrent City: from Tucson, Arizona to Oakland\nTransportation: Self-driving, from Tucson to Oakland, duration: 12 hours 42 mins, distance: 1,373 km, cost: 68\nBreakfast: Chai Point, Tucson, cost: 62, cuisines: Tea, Bakery, Mexican, American\nAttraction: San Xavier del Bac Mission, Tucson\nLunch: -\nDinner: -\nAccommodation: -\n\nNumber of people: 1\nTotal cost: 68 + 62 = 130\n\nTotal cost across all days: 838 + 577 + 130 = 1,545\n\nNote: The total cost exceeds the specified budget of $1,400. To adjust the plan within the budget, we can change the accommodation for Day 1 to a less expensive option:\n\nRevised Accommodation for Day 1: Private room with private bathroom, Tucson, cost: 58, room type: Private room, house rules: No smoking, minimum nights: 2, maximum occupancy: 2\n\nRevised Total cost for Day 1: 190 + 37 + 54 + 58 = 339\nRevised Total cost across all days: 339 + 577 + 130 = 1,046\n\nThe revised travel plan is now within the budget of $1,400.", "gpt-4-1106-preview_direct_sole-planning_parsed_results": [{"day": 1, "current_city": "from Oakland to Tucson, Arizona", "transportation": "Flight Number: F4002752, from Oakland to Tucson, duration: 1 hour 53 minutes", "breakfast": "-", "attraction": "Pima Air & Space Museum, Tucson;Reid Park Zoo, Tucson;", "lunch": "Villa Tevere, Tucson", "dinner": "Consort Restaurant, Tucson", "accommodation": "Private room with private bathroom, Tucson"}, {"day": 2, "current_city": "Tucson, Arizona", "transportation": "-", "breakfast": "Magic Spice Wok, Tucson", "attraction": "Tucson Botanical Gardens, Tucson;Old Tucson, Tucson;", "lunch": "Pizza Street, Tucson", "dinner": "La Plage, Tucson", "accommodation": "Private and Quiet Room in the Perfect Location, Tucson"}, {"day": 3, "current_city": "from Tucson, Arizona to Oakland", "transportation": "Self-driving, from Tucson to Oakland, duration: 12 hours 42 mins, distance: 1,373 km", "breakfast": "Chai Point, Tucson", "attraction": "San Xavier del Bac Mission, Tucson", "lunch": "-", "dinner": "-", "accommodation": "-"}]}]