[{"gpt-4-1106-preview_direct_sole-planning_results": "Travel Plan:\n\nDays: 1\nCurrent City: from Omaha to Colorado Springs, Colorado\nTransportation: Self-driving, from Omaha to Colorado Springs, duration: 8 hours 35 mins, distance: 982 km, cost: 49\nBreakfast: -\nAttraction: Garden of the Gods, Colorado Springs\nLunch: New Spice World, Colorado Springs, cost: 43, cuisines: Desserts, French, Bakery, Fast Food, Cafe\nDinner: Raglan Road Irish Pub and Restaurant, Colorado Springs, cost: 97, cuisines: Chinese, Bakery, Pizza, Mediterranean\nAccommodation: Large sunny park slope apartment, Colorado Springs, cost: 82, maximum occupancy: 3, house rules: No smoking & No parties & No pets, pet-friendly: Yes\n\nNumber of people: 7\nTotal cost: 49 + (43 + 97) * 7 + 82 * 3 = 1,261\nAccommodation minimum nights: 1/1\n\nDays: 2\nCurrent City: Colorado Springs, Colorado\nTransportation: -\nBreakfast: Club Tokyo - Best Western Skycity Hotel, Colorado Springs, cost: 64, cuisines: Tea, Bakery, Mediterranean, Fast Food\nAttraction: Cheyenne Mountain Zoo, Colorado Springs; The Broadmoor Seven Falls, Colorado Springs\nLunch: GoGourmet, Colorado Springs, cost: 66, cuisines: Desserts, Bakery, Fast Food, Indian, Seafood\nDinner: Deepak Rasoi, Colorado Springs, cost: 60, cuisines: Chinese, Pizza, Seafood\nAccommodation: Large sunny park slope apartment, Colorado Springs, cost: 82, maximum occupancy: 3, house rules: No smoking & No parties & No pets, pet-friendly: Yes\n\nNumber of people: 7\nTotal cost: (64 + 66 + 60) * 7 + 82 * 3 = 1,904\nAccommodation minimum nights: 2/2\n\nDays: 3\nCurrent City: from Colorado Springs to Denver, Colorado\nTransportation: Self-driving, from Colorado Springs to Denver, duration: 1 hour 9 mins, distance: 113 km, cost: 5\nBreakfast: Mukhtalif Biryanis, Colorado Springs, cost: 95, cuisines: Tea, Mexican, Fast Food\nAttraction: Denver Zoo, Denver; Denver Botanic Gardens, Denver\nLunch: The Fatty Bao - Asian Gastro Bar, Denver, cost: 93, cuisines: Bakery, BBQ, Cafe, Indian, Seafood\nDinner: The Urban Socialite, Denver, cost: 34, cuisines: Cafe, Indian, Desserts, Italian\nAccommodation: Harlem cozy nights, Denver, cost: 457, maximum occupancy: 3, house rules: No visitors, pet-friendly: Yes\n\nNumber of people: 7\nTotal cost: 5 + (95 + 93 + 34) * 7 + 457 * 3 = 2,457\nAccommodation minimum nights: 1/4\n\nDays: 4\nCurrent City: Denver, Colorado\nTransportation: -\nBreakfast: Cafe Diva, Denver, cost: 44, cuisines: Chinese, Cafe, Desserts, Fast Food\nAttraction: Denver Art Museum, Denver; Denver Museum of Nature & Science, Denver\nLunch: Tasty Fare, Denver, cost: 79, cuisines: French, BBQ, Fast Food\nDinner: Woods Spice, Denver, cost: 69, cuisines: Tea, Cafe, Mexican, Desserts\nAccommodation: Harlem cozy nights, Denver, cost: 457, maximum occupancy: 3, house rules: No visitors, pet-friendly: Yes\n\nNumber of people: 7\nTotal cost: (44 + 79 + 69) * 7 + 457 * 3 = 2,457\nAccommodation minimum nights: 2/4\n\nDays: 5\nCurrent City: from Denver to Omaha\nTransportation: Self-driving, from Denver to Omaha, duration: 7 hours 37 mins, distance: 870 km, cost: 43\nBreakfast: TBH - The Big House Cafe, Denver, cost: 22, cuisines: Cafe, Indian, Seafood, Fast Food\nAttraction: -\nLunch: -\nDinner: -\nAccommodation: -\n\nNumber of people: 7\nTotal cost: 43 + 22 * 7 = 197\n\nTotal cost across all days: 1,261 + 1,904 + 2,457 + 2,457 + 197 = 8,276\nCuisines: Various cuisines as per preferences.\nRemaining Budget: $23,400 - $8,276 = $15,124\n\nPlease note that the accommodation costs are calculated based on the maximum occupancy and the number of rooms required for 7 people. The cost for attractions is not included as it was not provided in the reference information. The travel plan adheres to the constraints of no flights, pet-friendly accommodations, and the specified budget.", "gpt-4-1106-preview_direct_sole-planning_parsed_results": [{"day": 1, "current_city": "from Omaha to Colorado Springs", "transportation": "Self-driving, from Omaha to Colorado Springs, duration: 8 hours 35 mins, distance: 982 km", "breakfast": "-", "attraction": "Garden of the Gods, Colorado Springs;", "lunch": "New Spice World, Colorado Springs", "dinner": "Raglan Road Irish Pub and Restaurant, Colorado Springs", "accommodation": "Large sunny park slope apartment, Colorado Springs"}, {"day": 2, "current_city": "Colorado Springs", "transportation": "-", "breakfast": "Club Tokyo - Best Western Skycity Hotel, Colorado Springs", "attraction": "Cheyenne Mountain Zoo, Colorado Springs;The Broadmoor Seven Falls, Colorado Springs;", "lunch": "GoGourmet, Colorado Springs", "dinner": "Deepak Rasoi, Colorado Springs", "accommodation": "Large sunny park slope apartment, Colorado Springs"}, {"day": 3, "current_city": "from Colorado Springs to Denver", "transportation": "Self-driving, from Colorado Springs to Denver, duration: 1 hour 9 mins, distance: 113 km", "breakfast": "Mukhtalif Biryanis, Colorado Springs", "attraction": "Denver Zoo, Denver;Denver Botanic Gardens, Denver;", "lunch": "The Fatty Bao - Asian Gastro Bar, Denver", "dinner": "The Urban Socialite, Denver", "accommodation": "Harlem cozy nights, Denver"}, {"day": 4, "current_city": "Denver", "transportation": "-", "breakfast": "Cafe Diva, Denver", "attraction": "Denver Art Museum, Denver;Denver Museum of Nature & Science, Denver;", "lunch": "Tasty Fare, Denver", "dinner": "Woods Spice, Denver", "accommodation": "Harlem cozy nights, Denver"}, {"day": 5, "current_city": "from Denver to Omaha", "transportation": "Self-driving, from Denver to Omaha, duration: 7 hours 37 mins, distance: 870 km", "breakfast": "TBH - The Big House Cafe, Denver", "attraction": "-", "lunch": "-", "dinner": "-", "accommodation": "-"}]}]