[{"gpt-4-1106-preview_direct_sole-planning_results": "Travel Plan:\n\nDays: 1\nCurrent City: from Billings to Minneapolis, Minnesota\nTransportation: Self-driving, from Billings to Minneapolis, duration: 11 hours 53 mins, distance: 1,349 km, cost: 67\nBreakfast: -\nAttraction: Minneapolis Sculpture Garden, Minneapolis; Mill City Museum, Minneapolis\nLunch: The Cafe, Minneapolis, cost: 14, cuisines: Indian, Mediterranean, Desserts, Seafood\nDinner: Court Avenue Brewing Company, Minneapolis, cost: 31, cuisines: Pizza, French, Bakery, BBQ, Seafood\nAccommodation: Light-filled Apartment in great area, close 2 all!, Minneapolis, cost: 343, room type: Entire home/apt, house rules: No visitors, minimum nights: 1, maximum occupancy: 2\n\nNumber of people: 1\nTotal cost: 67 + (14 + 31) + 343 = 455\n\nDays: 2\nCurrent City: Minneapolis, Minnesota\nTransportation: -\nBreakfast: Malo, Minneapolis, cost: 80, cuisines: Tea, Chinese, Indian, Cafe\nAttraction: Minneapolis Institute of Art, Minneapolis; Weisman Art Museum, Minneapolis\nLunch: Texas Roadhouse, Minneapolis, cost: 22, cuisines: Cafe, Pizza, BBQ, Desserts\nDinner: Monkeypod Kitchen by Merriman, Minneapolis, cost: 50, cuisines: Desserts, Pizza, Bakery, Fast Food, Indian, Mediterranean\nAccommodation: Light-filled Apartment in great area, close 2 all!, Minneapolis, cost: 343, room type: Entire home/apt, house rules: No visitors, minimum nights: 1, maximum occupancy: 2\n\nNumber of people: 1\nTotal cost: (80 + 22 + 50) + 343 = 495\n\nDays: 3\nCurrent City: from Minneapolis to Bemidji, Minnesota\nTransportation: Self-driving, from Minneapolis to Bemidji, duration: 3 hours 37 mins, distance: 347 km, cost: 17\nBreakfast: FreshMenu, Minneapolis, cost: 88, cuisines: Seafood, Desserts, Fast Food\nAttraction: Paul Bunyan & Babe the Blue Ox Statues, Bemidji; Headwaters Science Center, Bemidji\nLunch: Pig and Whistle, Bemidji, cost: 39, cuisines: Fast Food, Mexican, Bakery, Seafood\nDinner: Outback Bar and Grill - Leisure Inn, Bemidji, cost: 59, cuisines: Indian, Desserts, Fast Food\nAccommodation: Sunny bedroom off Prospect Park, Bemidji, cost: 627, room type: Private room, house rules: No visitors, minimum nights: 3, maximum occupancy: 1\n\nNumber of people: 1\nTotal cost: 17 + (88 + 39 + 59) + 627 = 830\n\nDays: 4\nCurrent City: Bemidji, Minnesota\nTransportation: -\nBreakfast: Flying Cakes, Bemidji, cost: 43, cuisines: Tea, Seafood\nAttraction: Diamond Point Park, Bemidji; Beltrami County History Center, Bemidji\nLunch: Southy, Bemidji, cost: 60, cuisines: Cafe, Pizza\nDinner: Bhaja Govindam, Bemidji, cost: 33, cuisines: Fast Food, Pizza, Desserts, Seafood\nAccommodation: Sunny bedroom off Prospect Park, Bemidji, cost: 627, room type: Private room, house rules: No visitors, minimum nights: 3, maximum occupancy: 1\n\nNumber of people: 1\nTotal cost: (43 + 60 + 33) + 627 = 763\n\nDays: 5\nCurrent City: from Bemidji to Billings\nTransportation: Self-driving, from Bemidji to Billings, duration: 10 hours 49 mins, distance: 1,188 km, cost: 59\nBreakfast: Shree Banke Foods, Bemidji, cost: 22, cuisines: Tea, Seafood, Fast Food\nAttraction: Lake Bemidji State Park, Bemidji\nLunch: -\nDinner: -\nAccommodation: -\n\nNumber of people: 1\nTotal cost: 59 + 22 = 81\n\nTotal cost across all days: 455 + 495 + 830 + 763 + 81 = 2,624\n\nCuisines: The plan includes a variety of cuisines as available in the restaurants chosen for meals.\n\nPlease note that the accommodation in Bemidji has a minimum stay of 3 nights, but since the travel plan is for 5 days and the stay in Bemidji is only for 2 nights, this accommodation is not fully compliant with the minimum stay requirement. However, due to the constraints of the query and the available data, this accommodation was selected to fit within the budget and travel plan.", "gpt-4-1106-preview_direct_sole-planning_parsed_results": [{"day": 1, "current_city": "from Billings to Minneapolis, Minnesota", "transportation": "Self-driving, from Billings to Minneapolis, duration: 11 hours 53 mins, distance: 1,349 km", "breakfast": "-", "attraction": "Minneapolis Sculpture Garden, Minneapolis;Mill City Museum, Minneapolis;", "lunch": "The Cafe, Minneapolis", "dinner": "Court Avenue Brewing Company, Minneapolis", "accommodation": "Light-filled Apartment in great area, close 2 all!, Minneapolis"}, {"day": 2, "current_city": "Minneapolis, Minnesota", "transportation": "-", "breakfast": "Malo, Minneapolis", "attraction": "Minneapolis Institute of Art, Minneapolis;Weisman Art Museum, Minneapolis;", "lunch": "Texas Roadhouse, Minneapolis", "dinner": "Monkeypod Kitchen by Merriman, Minneapolis", "accommodation": "Light-filled Apartment in great area, close 2 all!, Minneapolis"}, {"day": 3, "current_city": "from Minneapolis to Bemidji, Minnesota", "transportation": "Self-driving, from Minneapolis to Bemidji, duration: 3 hours 37 mins, distance: 347 km", "breakfast": "FreshMenu, Minneapolis", "attraction": "Paul Bunyan & Babe the Blue Ox Statues, Bemidji;Headwaters Science Center, Bemidji;", "lunch": "Pig and Whistle, Bemidji", "dinner": "Outback Bar and Grill - Leisure Inn, Bemidji", "accommodation": "Sunny bedroom off Prospect Park, Bemidji"}, {"day": 4, "current_city": "Bemidji, Minnesota", "transportation": "-", "breakfast": "Flying Cakes, Bemidji", "attraction": "Diamond Point Park, Bemidji;Beltrami County History Center, Bemidji;", "lunch": "Southy, Bemidji", "dinner": "Bhaja Govindam, Bemidji", "accommodation": "Sunny bedroom off Prospect Park, Bemidji"}, {"day": 5, "current_city": "from Bemidji to Billings", "transportation": "Self-driving, from Bemidji to Billings, duration: 10 hours 49 mins, distance: 1,188 km", "breakfast": "Shree Banke Foods, Bemidji", "attraction": "Lake Bemidji State Park, Bemidji", "lunch": "-", "dinner": "-", "accommodation": "-"}]}]