[{"gpt-4-1106-preview_direct_sole-planning_results": "Travel Plan:\n\nDays: 1\nCurrent City: from South Bend to Atlanta\nTransportation: Flight F3648988, from South Bend to Atlanta, duration: 1 hour 51 minutes, cost: $170 per person\nBreakfast: -\nAttraction: World of Coca-Cola, Atlanta; Georgia Aquarium, Atlanta\nLunch: Asian Bistro, Atlanta, cost: $27, cuisines: Tea, Bakery, Seafood\nDinner: Daawat-e-Kashmir, Atlanta, cost: $19, cuisines: Cafe, Pizza, American, Seafood\nAccommodation: Bright, Modern, Clean, Spacious, Brooklyn Home, Atlanta, cost: $1034, room type: Entire home/apt, house rules: No children under 10, minimum nights: 3, maximum occupancy: 4\n\nNumber of people: 2\nTotal cost: (170 * 2) + (27 + 19) * 2 + 1034 = $1,476\nAccommodation minimum nights: 1/3\n\nDays: 2\nCurrent City: Atlanta\nTransportation: -\nBreakfast: Saffron, Atlanta, cost: $39, cuisines: Tea, Cafe, Fast Food, Seafood\nAttraction: Atlanta Botanical Garden, Atlanta; Piedmont Park, Atlanta\nLunch: Chef Style, Atlanta, cost: $59, cuisines: Pizza, American, Desserts, Seafood\nDinner: Pizza Central, Atlanta, cost: $75, cuisines: Cafe, Bakery, BBQ, Fast Food, Chinese, Indian\nAccommodation: Bright, Modern, Clean, Spacious, Brooklyn Home, Atlanta, cost: $1034, room type: Entire home/apt, house rules: No children under 10, minimum nights: 3, maximum occupancy: 4\n\nNumber of people: 2\nTotal cost: (39 + 59 + 75) * 2 + 1034 = $1,414\nAccommodation minimum nights: 2/3\n\nDays: 3\nCurrent City: Atlanta to South Bend\nTransportation: Flight F3637050, from Atlanta to South Bend, duration: 1 hour 40 minutes, cost: $159 per person\nBreakfast: Taste of Vishal, Atlanta, cost: $13, cuisines: Desserts, Tea, American, Bakery, Indian, Seafood\nAttraction: High Museum of Art, Atlanta; Centennial Olympic Park, Atlanta\nLunch: -\nDinner: -\nAccommodation: -\n\nNumber of people: 2\nTotal cost: (159 * 2) + (13 * 2) = $344\n\nTotal cost across all days: $1,476 + $1,414 + $344 = $3,234\n\nNote: The total cost exceeds the specified budget of $1,500. Adjustments are needed to meet the budget constraint. Possible adjustments include selecting a cheaper flight or accommodation, or reducing meal costs.\n\nAdjusted Travel Plan:\n\nDays: 1\nCurrent City: from South Bend to Atlanta\nTransportation: Flight F3648988, from South Bend to Atlanta, duration: 1 hour 51 minutes, cost: $170 per person\nBreakfast: -\nAttraction: World of Coca-Cola, Atlanta; Georgia Aquarium, Atlanta\nLunch: Ahata, Atlanta, cost: $17, cuisines: Tea, Indian, Desserts\nDinner: Saffron, Atlanta, cost: $39, cuisines: Tea, Cafe, Fast Food, Seafood\nAccommodation: Unique 2BR Apartment, Atlanta, cost: $394, room type: Entire home/apt, house rules: No parties & No pets & No children under 10, minimum nights: 2, maximum occupancy: 3\n\nNumber of people: 2\nTotal cost: (170 * 2) + (17 + 39) * 2 + 394 = $846\nAccommodation minimum nights: 1/2\n\nDays: 2\nCurrent City: Atlanta\nTransportation: -\nBreakfast: Asian Bistro, Atlanta, cost: $27, cuisines: Tea, Bakery, Seafood\nAttraction: Atlanta Botanical Garden, Atlanta; Piedmont Park, Atlanta\nLunch: Chef Style, Atlanta, cost: $59, cuisines: Pizza, American, Desserts, Seafood\nDinner: Daawat-e-Kashmir, Atlanta, cost: $19, cuisines: Cafe, Pizza, American, Seafood\nAccommodation: Unique 2BR Apartment, Atlanta, cost: $394, room type: Entire home/apt, house rules: No parties & No pets & No children under 10, minimum nights: 2, maximum occupancy: 3\n\nNumber of people: 2\nTotal cost: (27 + 59 + 19) * 2 + 394 = $648\nAccommodation minimum nights: 2/2\n\nDays: 3\nCurrent City: Atlanta to South Bend\nTransportation: Flight F3637050, from Atlanta to South Bend, duration: 1 hour 40 minutes, cost: $159 per person\nBreakfast: -\nAttraction: High Museum of Art, Atlanta; Centennial Olympic Park, Atlanta\nLunch: -\nDinner: -\nAccommodation: -\n\nNumber of people: 2\nTotal cost: 159 * 2 = $318\n\nTotal cost across all days: $846 + $648 + $318 = $1,812\n\nNote: The adjusted plan still exceeds the budget. Further adjustments are needed, such as choosing a cheaper flight or reducing meal costs. However, given the constraints and the available data, it is challenging to create a plan that includes all required details and stays within the $1,500 budget.", "gpt-4-1106-preview_direct_sole-planning_parsed_results": [{"day": 1, "current_city": "from South Bend to Atlanta", "transportation": "Flight Number: F3648988, from South Bend to Atlanta, Departure Time: -, Arrival Time: -", "breakfast": "-", "attraction": "World of Coca-Cola, Atlanta;Georgia Aquarium, Atlanta;", "lunch": "Asian Bistro, Atlanta", "dinner": "Daawat-e-Kashmir, Atlanta", "accommodation": "Bright, Modern, Clean, Spacious, Brooklyn Home, Atlanta"}, {"day": 2, "current_city": "Atlanta", "transportation": "-", "breakfast": "Saffron, Atlanta", "attraction": "Atlanta Botanical Garden, Atlanta;Piedmont Park, Atlanta;", "lunch": "Chef Style, Atlanta", "dinner": "Pizza Central, Atlanta", "accommodation": "Bright, Modern, Clean, Spacious, Brooklyn Home, Atlanta"}, {"day": 3, "current_city": "from Atlanta to South Bend", "transportation": "Flight Number: F3637050, from Atlanta to South Bend, Departure Time: -, Arrival Time: -", "breakfast": "Taste of Vishal, Atlanta", "attraction": "High Museum of Art, Atlanta;Centennial Olympic Park, Atlanta;", "lunch": "-", "dinner": "-", "accommodation": "-"}, {"day": 1, "current_city": "from South Bend to Atlanta", "transportation": "Flight Number: F3648988, from South Bend to Atlanta, Departure Time: -, Arrival Time: -", "breakfast": "-", "attraction": "World of Coca-Cola, Atlanta;Georgia Aquarium, Atlanta;", "lunch": "Ahata, Atlanta", "dinner": "Saffron, Atlanta", "accommodation": "Unique 2BR Apartment, Atlanta"}, {"day": 2, "current_city": "Atlanta", "transportation": "-", "breakfast": "Asian Bistro, Atlanta", "attraction": "Atlanta Botanical Garden, Atlanta;Piedmont Park, Atlanta;", "lunch": "Chef Style, Atlanta", "dinner": "Daawat-e-Kashmir, Atlanta", "accommodation": "Unique 2BR Apartment, Atlanta"}, {"day": 3, "current_city": "from Atlanta to South Bend", "transportation": "Flight Number: F3637050, from Atlanta to South Bend, Departure Time: -, Arrival Time: -", "breakfast": "-", "attraction": "High Museum of Art, Atlanta;Centennial Olympic Park, Atlanta;", "lunch": "-", "dinner": "-", "accommodation": "-"}]}]