[{"gpt-4-1106-preview_direct_sole-planning_results": "Travel Plan:\n\nDays: 1\nCurrent City: from Atlanta to Chicago\nTransportation: Self-driving, from Atlanta to Chicago, duration: 10 hours 44 mins, distance: 1,154 km, cost: $57\nBreakfast: -\nAttraction: Millennium Park, Chicago; Cloud Gate, Chicago\nLunch: Pantry d'or, Chicago, cost: $53, cuisines: Tea, BBQ, Fast Food, Cafe, Indian\nDinner: The Black Pearl, Chicago, cost: $63, cuisines: Cafe, Bakery\nAccommodation: Newly Renovated Greenpoint Abode, Chicago, cost: $981, room type: Entire home/apt, house rules: No parties & No children under 10 & No smoking, minimum nights: 2\n\nNumber of people: 2\nTotal cost: $57 + ($53 + $63) * 2 + $981 = $1,270\nAccommodation minimum nights: 1/2\n\nDays: 2\nCurrent City: Chicago\nTransportation: -\nBreakfast: Bro's Kitchenette, Chicago, cost: $38, cuisines: Mexican, Desserts, Seafood\nAttraction: Willis Tower, Chicago; Navy Pier, Chicago; The Richard H. Driehaus Museum, Chicago\nLunch: FIO Cookhouse and Bar, Chicago, cost: $31, cuisines: Desserts, Mexican, Fast Food, Cafe, Seafood\nDinner: Sethi's Kabab & Curries, Chicago, cost: $69, cuisines: Bakery, BBQ, Cafe, Mediterranean, Seafood\nAccommodation: Newly Renovated Greenpoint Abode, Chicago, cost: $981, room type: Entire home/apt, house rules: No parties & No children under 10 & No smoking, minimum nights: 2\n\nNumber of people: 2\nTotal cost: ($38 + $31 + $69) * 2 + $981 = $1,256\nAccommodation minimum nights: 2/2\n\nDays: 3\nCurrent City: from Chicago to Atlanta\nTransportation: Self-driving, from Chicago to Atlanta, duration: 10 hours 44 mins, distance: 1,153 km, cost: $57\nBreakfast: The Village Caf\u6106, Chicago, cost: $57, cuisines: Tea, Cafe, Mediterranean, Seafood\nAttraction: Garfield Park Conservatory, Chicago\nLunch: -\nDinner: -\nAccommodation: -\n\nNumber of people: 2\nTotal cost: $57 + $57 * 2 = $171\n\nTotal cost across all days: $1,270 + $1,256 + $171 = $2,697\n\nHowever, the total cost exceeds the specified budget of $1,900. To adjust the plan within the budget, we need to make some changes:\n\nRevised Travel Plan:\n\nDays: 1\nCurrent City: from Atlanta to Chicago\nTransportation: Self-driving, from Atlanta to Chicago, duration: 10 hours 44 mins, distance: 1,154 km, cost: $57\nBreakfast: -\nAttraction: Millennium Park, Chicago; Cloud Gate, Chicago\nLunch: Pantry d'or, Chicago, cost: $53, cuisines: Tea, BBQ, Fast Food, Cafe, Indian\nDinner: Bro's Kitchenette, Chicago, cost: $38, cuisines: Mexican, Desserts, Seafood\nAccommodation: NYC Firehouse-Greenpoint BRKLYN, Chicago, cost: $109, room type: Entire home/apt, house rules: No smoking & No parties, minimum nights: 3\n\nNumber of people: 2\nTotal cost: $57 + ($53 + $38) * 2 + $109 = $348\nAccommodation minimum nights: 1/3\n\nDays: 2\nCurrent City: Chicago\nTransportation: -\nBreakfast: Gyan Vaishnav, Chicago, cost: $14, cuisines: Bakery, Desserts\nAttraction: Willis Tower, Chicago; Navy Pier, Chicago\nLunch: FIO Cookhouse and Bar, Chicago, cost: $31, cuisines: Desserts, Mexican, Fast Food, Cafe, Seafood\nDinner: Sethi's Kabab & Curries, Chicago, cost: $69, cuisines: Bakery, BBQ, Cafe, Mediterranean, Seafood\nAccommodation: NYC Firehouse-Greenpoint BRKLYN, Chicago, cost: $109, room type: Entire home/apt, house rules: No smoking & No parties, minimum nights: 3\n\nNumber of people: 2\nTotal cost: ($14 + $31 + $69) * 2 + $109 = $337\nAccommodation minimum nights: 2/3\n\nDays: 3\nCurrent City: from Chicago to Atlanta\nTransportation: Self-driving, from Chicago to Atlanta, duration: 10 hours 44 mins, distance: 1,153 km, cost: $57\nBreakfast: -\nAttraction: -\nLunch: -\nDinner: -\nAccommodation: -\n\nNumber of people: 2\nTotal cost: $57\n\nTotal cost across all days: $348 + $337 + $57 = $742\n\nThe revised travel plan is now within the budget of $1,900.", "gpt-4-1106-preview_direct_sole-planning_parsed_results": [{"day": 1, "current_city": "from Atlanta to Chicago", "transportation": "Self-driving, from Atlanta to Chicago, duration: 10 hours 44 mins, distance: 1,154 km", "breakfast": "-", "attraction": "Millennium Park, Chicago;Cloud Gate, Chicago;", "lunch": "Pantry d'or, Chicago", "dinner": "Bro's Kitchenette, Chicago", "accommodation": "NYC Firehouse-Greenpoint BRKLYN, Chicago"}, {"day": 2, "current_city": "Chicago", "transportation": "-", "breakfast": "Gyan Vaishnav, Chicago", "attraction": "Willis Tower, Chicago;Navy Pier, Chicago;", "lunch": "FIO Cookhouse and Bar, Chicago", "dinner": "Sethi's Kabab & Curries, Chicago", "accommodation": "NYC Firehouse-Greenpoint BRKLYN, Chicago"}, {"day": 3, "current_city": "from Chicago to Atlanta", "transportation": "Self-driving, from Chicago to Atlanta, duration: 10 hours 44 mins, distance: 1,153 km", "breakfast": "-", "attraction": "-", "lunch": "-", "dinner": "-", "accommodation": "-"}]}]