[{"gpt-4-1106-preview_direct_sole-planning_results": "Travel Plan:\n\nDays: 1\nCurrent City: from Rockford to Gainesville, Florida\nTransportation: Self-driving, from Rockford to Gainesville, duration: 16 hours 30 mins, distance: 1,822 km, cost: $91\nBreakfast: -\nAttraction: -\nLunch: -\nDinner: -\nAccommodation: Spacious yet Cozy Room in Manhattan, Gainesville, cost: $566, room type: Entire home/apt, house rules: No visitors, minimum nights: 3, maximum occupancy: 4\n\nNumber of people: 8\nTotal cost: $91 + $566 * 2 = $1,223\nAccommodation minimum nights: 1/3\n\nDays: 2\nCurrent City: Gainesville, Florida\nTransportation: -\nBreakfast: The Machine Shed Restaurant, Gainesville, cost: $62, cuisines: Pizza, Mexican, Bakery, Fast Food, Indian, Seafood\nAttraction: Florida Museum of Natural History-Exhibits, Gainesville; Devil's Millhopper Geological State Park, Gainesville\nLunch: Carnival By Tresind, Gainesville, cost: $67, cuisines: Tea, Chinese, Pizza, Mediterranean\nDinner: Parker's, Gainesville, cost: $74, cuisines: Desserts, Tea, Italian, French, Bakery, BBQ\nAccommodation: Spacious yet Cozy Room in Manhattan, Gainesville, cost: $566, room type: Entire home/apt, house rules: No visitors, minimum nights: 3, maximum occupancy: 4\n\nNumber of people: 8\nTotal cost: ($62 + $67 + $74) * 8 + $566 * 2 = $2,366\nAccommodation minimum nights: 2/3\n\nDays: 3\nCurrent City: Gainesville, Florida\nTransportation: -\nBreakfast: Aggarwal Sweet Corner, Gainesville, cost: $70, cuisines: Tea, American, Seafood\nAttraction: Kanapaha Botanical Gardens, Gainesville; Butterfly Rainforest at the Florida Museum of Natural History, Gainesville\nLunch: The Food Garage, Gainesville, cost: $97, cuisines: Desserts, Tea, Bakery, BBQ, Chinese\nDinner: CHA, Gainesville, cost: $84, cuisines: Desserts, Pizza, Bakery, Fast Food, American\nAccommodation: Spacious yet Cozy Room in Manhattan, Gainesville, cost: $566, room type: Entire home/apt, house rules: No visitors, minimum nights: 3, maximum occupancy: 4\n\nNumber of people: 8\nTotal cost: ($70 + $97 + $84) * 8 + $566 * 2 = $2,870\nAccommodation minimum nights: 3/3\n\nDays: 4\nCurrent City: from Gainesville to Daytona Beach, Florida\nTransportation: Self-driving, from Gainesville to Daytona Beach, duration: 2 hours 2 mins, distance: 158 km, cost: $7\nBreakfast: -\nAttraction: Daytona Boardwalk Amusements, Daytona Beach; Daytona Lagoon, Daytona Beach\nLunch: Outback Steakhouse, Daytona Beach, cost: $58, cuisines: Desserts, Pizza, Mexican, Cafe, American\nDinner: Bespoke Harvest, Daytona Beach, cost: $56, cuisines: Cafe, BBQ, Fast Food\nAccommodation: Homey 1BR in Fun, Central West Village w/ Doorman by Blueground, Daytona Beach, cost: $262, room type: Entire home/apt, house rules: No parties, minimum nights: 30, maximum occupancy: 2\n\nNumber of people: 8\nTotal cost: $7 + ($58 + $56) * 8 + $262 * 4 = $1,498\nAccommodation minimum nights: 1/30\n\nDays: 5\nCurrent City: Daytona Beach, Florida\nTransportation: -\nBreakfast: Beach Box Cafe, Daytona Beach, cost: $96, cuisines: Chinese, Pizza, BBQ, Cafe\nAttraction: World's Most Famous Beach, Daytona Beach; Daytona Beach Main Street Pier, Daytona Beach\nLunch: Rocks on the River, Daytona Beach, cost: $35, cuisines: Tea, Indian, BBQ\nDinner: Mom & Dad's Italian Restaurant, Daytona Beach, cost: $17, cuisines: Tea, Mexican, Cafe, Indian, Seafood\nAccommodation: Homey 1BR in Fun, Central West Village w/ Doorman by Blueground, Daytona Beach, cost: $262, room type: Entire home/apt, house rules: No parties, minimum nights: 30, maximum occupancy: 2\n\nNumber of people: 8\nTotal cost: ($96 + $35 + $17) * 8 + $262 * 4 = $2,002\nAccommodation minimum nights: 2/30\n\nDays: 6\nCurrent City: from Daytona Beach to Jacksonville, Florida\nTransportation: Self-driving, from Daytona Beach to Jacksonville, duration: 1 hour 28 mins, distance: 143 km, cost: $7\nBreakfast: -\nAttraction: Jacksonville Zoo and Gardens, Jacksonville; Southbank Riverwalk, Jacksonville\nLunch: Villa Gargano, Jacksonville, cost: $51, cuisines: Tea, American, Desserts\nDinner: Pirates' House Restaurant, Jacksonville, cost: $59, cuisines: Chinese, Pizza, BBQ\nAccommodation: NYC Sanctuary, Skyline Views & Rooftop, Jacksonville, cost: $954, room type: Entire home/apt, house rules: No smoking, minimum nights: 3, maximum occupancy: 6\n\nNumber of people: 8\nTotal cost: $7 + ($51 + $59) * 8 + $954 * 2 = $2,150\nAccommodation minimum nights: 1/3\n\nDays: 7\nCurrent City: from Jacksonville to Rockford\nTransportation: Self-driving, from Jacksonville to Rockford, duration: 16 hours 42 mins, distance: 1,852 km, cost: $92\nBreakfast: Goose Feathers Cafe and Bakery, Jacksonville, cost: $57, cuisines: Tea, Fast Food, Italian\nAttraction: MOSH (Museum Of Science & History), Jacksonville; Tree Hill Nature Center, Jacksonville\nLunch: -\nDinner: -\nAccommodation: -\n\nNumber of people: 8\nTotal cost: $92 + $57 * 8 = $548\n\nTotal cost across all days: $1,223 + $2,366 + $2,870 + $1,498 + $2,002 + $2,150 + $548 = $12,657\n\nCuisines: Various cuisines including American, Italian, Chinese, BBQ, Seafood, and more have been included.\n\nNote: The accommodations chosen are entire home/apt as per the preference, and the costs have been calculated based on the number of units needed to accommodate 8 people. The transportation method is self-driving as per the available data, and no flights have been included as there were no available flights for the specified dates. Attractions and meals have been selected based on the cities visited each day. The total cost is within the specified budget of $17,000.", "gpt-4-1106-preview_direct_sole-planning_parsed_results": [{"day": 1, "current_city": "from Rockford to Gainesville, Florida", "transportation": "Self-driving, from Rockford to Gainesville, duration: 16 hours 30 mins, distance: 1,822 km", "breakfast": "-", "attraction": "-", "lunch": "-", "dinner": "-", "accommodation": "Spacious yet Cozy Room in Manhattan, Gainesville"}, {"day": 2, "current_city": "Gainesville, Florida", "transportation": "-", "breakfast": "The Machine Shed Restaurant, Gainesville", "attraction": "Florida Museum of Natural History-Exhibits, Gainesville; Devil's Millhopper Geological State Park, Gainesville", "lunch": "Carnival By Tresind, Gainesville", "dinner": "Parker's, Gainesville", "accommodation": "Spacious yet Cozy Room in Manhattan, Gainesville"}, {"day": 3, "current_city": "Gainesville, Florida", "transportation": "-", "breakfast": "Aggarwal Sweet Corner, Gainesville", "attraction": "Kanapaha Botanical Gardens, Gainesville; Butterfly Rainforest at the Florida Museum of Natural History, Gainesville", "lunch": "The Food Garage, Gainesville", "dinner": "CHA, Gainesville", "accommodation": "Spacious yet Cozy Room in Manhattan, Gainesville"}, {"day": 4, "current_city": "from Gainesville to Daytona Beach, Florida", "transportation": "Self-driving, from Gainesville to Daytona Beach, duration: 2 hours 2 mins, distance: 158 km", "breakfast": "-", "attraction": "Daytona Boardwalk Amusements, Daytona Beach; Daytona Lagoon, Daytona Beach", "lunch": "Outback Steakhouse, Daytona Beach", "dinner": "Bespoke Harvest, Daytona Beach", "accommodation": "Homey 1BR in Fun, Central West Village w/ Doorman by Blueground, Daytona Beach"}, {"day": 5, "current_city": "Daytona Beach, Florida", "transportation": "-", "breakfast": "Beach Box Cafe, Daytona Beach", "attraction": "World's Most Famous Beach, Daytona Beach; Daytona Beach Main Street Pier, Daytona Beach", "lunch": "Rocks on the River, Daytona Beach", "dinner": "Mom & Dad's Italian Restaurant, Daytona Beach", "accommodation": "Homey 1BR in Fun, Central West Village w/ Doorman by Blueground, Daytona Beach"}, {"day": 6, "current_city": "from Daytona Beach to Jacksonville, Florida", "transportation": "Self-driving, from Daytona Beach to Jacksonville, duration: 1 hour 28 mins, distance: 143 km", "breakfast": "-", "attraction": "Jacksonville Zoo and Gardens, Jacksonville; Southbank Riverwalk, Jacksonville", "lunch": "Villa Gargano, Jacksonville", "dinner": "Pirates' House Restaurant, Jacksonville", "accommodation": "NYC Sanctuary, Skyline Views & Rooftop, Jacksonville"}, {"day": 7, "current_city": "from Jacksonville to Rockford", "transportation": "Self-driving, from Jacksonville to Rockford, duration: 16 hours 42 mins, distance: 1,852 km", "breakfast": "Goose Feathers Cafe and Bakery, Jacksonville", "attraction": "MOSH (Museum Of Science & History), Jacksonville; Tree Hill Nature Center, Jacksonville", "lunch": "-", "dinner": "-", "accommodation": "-"}]}]