[{"gpt-4-1106-preview_direct_sole-planning_results": "Travel Plan:\n\nDays: 1\nCurrent City: from Washington to Norfolk, Virginia\nTransportation: Self-driving, from Washington to Norfolk, duration: 3 hours 10 mins, distance: 313 km, cost: 15\nBreakfast: -\nAttraction: Norfolk Botanical Garden, Norfolk; Nauticus, Norfolk\nLunch: Sunshine Family Restaurant, Norfolk, cost: 95, cuisines: Tea, American, Desserts, Italian\nDinner: Henry Campbell's Steakhouse, Norfolk, cost: 83, cuisines: Chinese, Cafe, Seafood\nAccommodation: Hudson Yard - Lux King Room, Norfolk, cost: 1066, room type: Private room, house rules: No smoking, minimum nights: 1, maximum occupancy: 1\n\nNumber of people: 1\nTotal cost: 15 + 95 + 83 + 1066 = 1,259\nAccommodation minimum nights: 1/1\n\nDays: 2\nCurrent City: Norfolk, Virginia\nTransportation: -\nBreakfast: Sonya Bakery Cafe, Norfolk, cost: 32, cuisines: Pizza, Indian, BBQ\nAttraction: Chrysler Museum of Art, Norfolk; Hampton Roads Naval Museum, Norfolk\nLunch: Game n Grillz, Norfolk, cost: 59, cuisines: Mexican, Bakery, Cafe, American, Seafood\nDinner: Halki Aanch, Norfolk, cost: 76, cuisines: Tea, BBQ, Fast Food, American, Seafood\nAccommodation: Hudson Yard - Lux King Room, Norfolk, cost: 1066, room type: Private room, house rules: No smoking, minimum nights: 1, maximum occupancy: 1\n\nNumber of people: 1\nTotal cost: 32 + 59 + 76 + 1066 = 1,233\nAccommodation minimum nights: 1/1\n\nDays: 3\nCurrent City: from Norfolk to Lynchburg, Virginia\nTransportation: Self-driving, from Norfolk to Lynchburg, duration: 3 hours 27 mins, distance: 306 km, cost: 15\nBreakfast: Jonathan's Kitchen - Holiday Inn Express & Suites, Norfolk, cost: 44, cuisines: Tea, Seafood, BBQ, Fast Food\nAttraction: Amazement Square, Lynchburg; Point of Honor, Lynchburg\nLunch: Uptown Vietnam cuisine, Lynchburg, cost: 63, cuisines: Cafe, Bakery, Indian, Seafood\nDinner: The BrewMaster, Lynchburg, cost: 87, cuisines: Tea, Chinese, BBQ, Fast Food\nAccommodation: Design Hideaway in a Classic Brooklyn Townhouse, Lynchburg, cost: 216, room type: Entire home/apt, house rules: No smoking, minimum nights: 4, maximum occupancy: 3\n\nNumber of people: 1\nTotal cost: 15 + 44 + 63 + 87 + 216 = 425\nAccommodation minimum nights: 1/4\n\nDays: 4\nCurrent City: Lynchburg, Virginia\nTransportation: -\nBreakfast: Bean Here, Lynchburg, cost: 74, cuisines: Tea, Indian, BBQ, Fast Food\nAttraction: The Anne Spencer House & Garden Museum, Lynchburg; Lynchburg Museum, Lynchburg\nLunch: Pirates Of Grill, Lynchburg, cost: 71, cuisines: Tea, Pizza, American, Seafood\nDinner: Mochamania, Lynchburg, cost: 87, cuisines: Tea, Chinese, Fast Food, Seafood\nAccommodation: Design Hideaway in a Classic Brooklyn Townhouse, Lynchburg, cost: 216, room type: Entire home/apt, house rules: No smoking, minimum nights: 4, maximum occupancy: 3\n\nNumber of people: 1\nTotal cost: 74 + 71 + 87 + 216 = 448\nAccommodation minimum nights: 2/4\n\nDays: 5\nCurrent City: from Lynchburg to Washington\nTransportation: Self-driving, from Lynchburg to Washington, duration: 3 hours 19 mins, distance: 291 km, cost: 14\nBreakfast: Khyen Chyen, Lynchburg, cost: 30, cuisines: Cafe, Bakery, Mediterranean, Desserts\nAttraction: -\nLunch: -\nDinner: -\nAccommodation: -\n\nNumber of people: 1\nTotal cost: 14 + 30 = 44\n\nTotal cost across all days: 1,259 + 1,233 + 425 + 448 + 44 = 3,409\n\nUnfortunately, the total cost exceeds the specified budget of $2,200. Adjustments are needed to meet the budget constraint. Since the budget is exceeded, we need to revise the plan to reduce costs, such as choosing more affordable accommodations or dining options. However, given the provided data, it is not possible to create a detailed revised plan that meets all the constraints within the budget.", "gpt-4-1106-preview_direct_sole-planning_parsed_results": [{"day": 1, "current_city": "from Washington to Norfolk, Virginia", "transportation": "Self-driving, from Washington to Norfolk, duration: 3 hours 10 mins, distance: 313 km", "breakfast": "-", "attraction": "Norfolk Botanical Garden, Norfolk;Nauticus, Norfolk;", "lunch": "Sunshine Family Restaurant, Norfolk", "dinner": "Henry Campbell's Steakhouse, Norfolk", "accommodation": "Hudson Yard - Lux King Room, Norfolk"}, {"day": 2, "current_city": "Norfolk, Virginia", "transportation": "-", "breakfast": "Sonya Bakery Cafe, Norfolk", "attraction": "Chrysler Museum of Art, Norfolk;Hampton Roads Naval Museum, Norfolk;", "lunch": "Game n Grillz, Norfolk", "dinner": "Halki Aanch, Norfolk", "accommodation": "Hudson Yard - Lux King Room, Norfolk"}, {"day": 3, "current_city": "from Norfolk to Lynchburg, Virginia", "transportation": "Self-driving, from Norfolk to Lynchburg, duration: 3 hours 27 mins, distance: 306 km", "breakfast": "Jonathan's Kitchen - Holiday Inn Express & Suites, Norfolk", "attraction": "Amazement Square, Lynchburg;Point of Honor, Lynchburg;", "lunch": "Uptown Vietnam cuisine, Lynchburg", "dinner": "The BrewMaster, Lynchburg", "accommodation": "Design Hideaway in a Classic Brooklyn Townhouse, Lynchburg"}, {"day": 4, "current_city": "Lynchburg, Virginia", "transportation": "-", "breakfast": "Bean Here, Lynchburg", "attraction": "The Anne Spencer House & Garden Museum, Lynchburg;Lynchburg Museum, Lynchburg;", "lunch": "Pirates Of Grill, Lynchburg", "dinner": "Mochamania, Lynchburg", "accommodation": "Design Hideaway in a Classic Brooklyn Townhouse, Lynchburg"}, {"day": 5, "current_city": "from Lynchburg to Washington", "transportation": "Self-driving, from Lynchburg to Washington, duration: 3 hours 19 mins, distance: 291 km", "breakfast": "Khyen Chyen, Lynchburg", "attraction": "-", "lunch": "-", "dinner": "-", "accommodation": "-"}]}]