[{"gpt-4-1106-preview_direct_sole-planning_results": "Travel Plan:\n\nDays: 1\nCurrent City: from St. Louis to Las Vegas\nTransportation: Self-driving, from St. Louis to Las Vegas, duration: 22 hours 55 mins, distance: 2,570 km, cost: 128\nBreakfast: -\nAttraction: -\nLunch: -\nDinner: Chili's Grill & Bar, Las Vegas, cost: 71, cuisines: Pizza, Mexican, Bakery, Fast Food, Cafe\nAccommodation: Steps away from the Heart of the Theater District!, Las Vegas, cost: 389, room type: Private room, house rules: No children under 10, minimum nights: 1, maximum occupancy: 2\n\nNumber of people: 1\nTotal cost: 128 + 71 + 389 = 588\nAccommodation minimum nights: 1/1\n\nDays: 2\nCurrent City: Las Vegas\nTransportation: -\nBreakfast: Ethos Vegan Kitchen, Las Vegas, cost: 42, cuisines: Desserts, Bakery, Cafe, Mediterranean, Seafood\nAttraction: Madame Tussauds Las Vegas; High Roller\nLunch: Portneuf Valley Brewing, Las Vegas, cost: 58, cuisines: Pizza, Mexican, Bakery, Fast Food, Cafe, Mediterranean\nDinner: Big Brewsky, Las Vegas, cost: 23, cuisines: Tea, Bakery, Fast Food\nAccommodation: Steps away from the Heart of the Theater District!, Las Vegas, cost: 389, room type: Private room, house rules: No children under 10, minimum nights: 1, maximum occupancy: 2\n\nNumber of people: 1\nTotal cost: 42 + 58 + 23 + 389 = 512\nAccommodation minimum nights: 2/1\n\nDays: 3\nCurrent City: from Las Vegas to St. Louis\nTransportation: Self-driving, from Las Vegas to St. Louis, duration: 22 hours 50 mins, distance: 2,568 km, cost: 128\nBreakfast: -\nAttraction: -\nLunch: -\nDinner: -\nAccommodation: -\n\nNumber of people: 1\nTotal cost: 128\n\nTotal cost across all days: 588 + 512 + 128 = 1,228\n\nCuisines: Various cuisines including American, Mexican, Mediterranean, and Fast Food.\n\nNote: The travel plan includes self-driving as the mode of transportation, adhering to the budget constraint. Attractions were chosen based on proximity and interest, and meals were selected from the provided list of restaurants in Las Vegas. Accommodation was booked for two nights in Las Vegas, with the same accommodation used for both nights to minimize check-in and check-out hassles. The total cost of the trip is within the specified budget of $1,300.", "gpt-4-1106-preview_direct_sole-planning_parsed_results": [{"day": 1, "current_city": "from St. Louis to Las Vegas", "transportation": "Self-driving, from St. Louis to Las Vegas, duration: 22 hours 55 mins, distance: 2,570 km", "breakfast": "-", "attraction": "-", "lunch": "-", "dinner": "Chili's Grill & Bar, Las Vegas", "accommodation": "Steps away from the Heart of the Theater District!, Las Vegas"}, {"day": 2, "current_city": "Las Vegas", "transportation": "-", "breakfast": "Ethos Vegan Kitchen, Las Vegas", "attraction": "Madame Tussauds Las Vegas, Las Vegas;High Roller, Las Vegas;", "lunch": "Portneuf Valley Brewing, Las Vegas", "dinner": "Big Brewsky, Las Vegas", "accommodation": "Steps away from the Heart of the Theater District!, Las Vegas"}, {"day": 3, "current_city": "from Las Vegas to St. Louis", "transportation": "Self-driving, from Las Vegas to St. Louis, duration: 22 hours 50 mins, distance: 2,568 km", "breakfast": "-", "attraction": "-", "lunch": "-", "dinner": "-", "accommodation": "-"}]}]