[{"gpt-4-1106-preview_direct_sole-planning_results": "Travel Plan:\n\nDays: 1\nCurrent City: from Missoula to Dallas\nTransportation: Flight F3604254, from Missoula to Dallas, departure: 14:27, arrival: 18:26, duration: 2 hours 59 minutes, distance: 1320 km, cost: $288\nBreakfast: -\nAttraction: -\nLunch: -\nDinner: Coconuts Fish Cafe, Dallas, cost: $38, cuisines: Cafe, BBQ, Mediterranean, Fast Food\nAccommodation: 1BR, elevator, kitchen, doorman!, Dallas, cost: $475, room type: Entire home/apt, house rules: No parties, minimum nights: 1, maximum occupancy: 3\n\nNumber of people: 1\nTotal cost: $288 (flight) + $38 (dinner) + $475 (accommodation) = $801\n\nDays: 2\nCurrent City: Dallas\nTransportation: -\nBreakfast: Cafe Gatherings, Dallas, cost: $17, cuisines: Bakery, Indian, Desserts\nAttraction: The Dallas World Aquarium, Dallas; The Sixth Floor Museum at Dealey Plaza, Dallas\nLunch: 1918 Bistro & Grill, Dallas, cost: $90, cuisines: Tea, Pizza, BBQ, Seafood\nDinner: Yanki Sizzlers, Dallas, cost: $96, cuisines: Cafe, French, Tea, Mediterranean\nAccommodation: Luxury Williamsburg duplex, private roof terrace, Dallas, cost: $241, room type: Entire home/apt, house rules: No visitors, minimum nights: 4, maximum occupancy: 3\n\nNumber of people: 1\nTotal cost: $17 (breakfast) + $90 (lunch) + $96 (dinner) + $241 (accommodation) = $444\n\nDays: 3\nCurrent City: from Dallas to Missoula\nTransportation: Flight F3604227, from Dallas to Missoula, departure: 11:28, arrival: 13:48, duration: 3 hours 20 minutes, distance: 1320 km, cost: $356\nBreakfast: Drifters Cafe, Dallas, cost: $21, cuisines: Tea, French, Mexican, Cafe, Seafood\nAttraction: Reunion Tower, Dallas\nLunch: -\nDinner: -\nAccommodation: -\n\nNumber of people: 1\nTotal cost: $21 (breakfast) + $356 (flight) = $377\n\nTotal cost across all days: $801 (Day 1) + $444 (Day 2) + $377 (Day 3) = $1,622\n\nRemaining budget: $1,900 - $1,622 = $278\n\nNote: The travel plan includes one flight each way, as no valid self-driving or taxi information is available for the Missoula to Dallas route. The accommodations selected are entire homes/apartments, adhering to the unspecified room type constraints. Attractions and meals are chosen based on the available information and within the destination city of Dallas. The total cost is within the specified budget of $1,900.", "gpt-4-1106-preview_direct_sole-planning_parsed_results": [{"day": 1, "current_city": "from Missoula to Dallas", "transportation": "Flight Number: F3604254, from Missoula to Dallas, Departure Time: 14:27, Arrival Time: 18:26", "breakfast": "-", "attraction": "-", "lunch": "-", "dinner": "Coconuts Fish Cafe, Dallas", "accommodation": "1BR, Dallas"}, {"day": 2, "current_city": "Dallas", "transportation": "-", "breakfast": "Cafe Gatherings, Dallas", "attraction": "The Dallas World Aquarium, Dallas;The Sixth Floor Museum at Dealey Plaza, Dallas;", "lunch": "1918 Bistro & Grill, Dallas", "dinner": "Yanki Sizzlers, Dallas", "accommodation": "Luxury Williamsburg duplex, Dallas"}, {"day": 3, "current_city": "from Dallas to Missoula", "transportation": "Flight Number: F3604227, from Dallas to Missoula, Departure Time: 11:28, Arrival Time: 13:48", "breakfast": "Drifters Cafe, Dallas", "attraction": "Reunion Tower, Dallas", "lunch": "-", "dinner": "-", "accommodation": "-"}]}]