[{"gpt-4-1106-preview_direct_sole-planning_results": "Travel Plan:\n\nDays: 1\nCurrent City: from Denver to Bozeman, Montana\nTransportation: Self-driving, from Denver to Bozeman, duration: 9 hours 54 mins, distance: 1,119 km, cost: 55\nBreakfast: -\nAttraction: Museum of the Rockies, Bozeman; Gallatin History Museum, Bozeman\nLunch: Jiquitaia, Bozeman, cost: 36, cuisines: Tea, Pizza, American\nDinner: McGuire's Irish Pub & Brewery, Bozeman, cost: 72, cuisines: Fast Food, Desserts, Italian\nAccommodation: SPACIOUS STUDIO APT 3 IN PROSPECT LEFFERTS GARDENS, Bozeman, cost: 1060, maximum occupancy: 6, house rules: No children under 10 & No parties, minimum nights: 5\n\nNumber of people: 8\nTotal cost: 55 + (36 + 72) * 8 + 1060 = 1,873\nAccommodation minimum nights: 1/5\n\nDays: 2\nCurrent City: Bozeman, Montana\nTransportation: -\nBreakfast: Saravana Bhavan, Bozeman, cost: 38, cuisines: Tea, American, Desserts\nAttraction: American Computer & Robotics Museum, Bozeman; Montana Science Center, Bozeman\nLunch: Indo Chinese, Bozeman, cost: 66, cuisines: Italian, BBQ, Bakery, Fast Food, Chinese, Seafood\nDinner: Zaroob, Bozeman, cost: 67, cuisines: Desserts, Tea, French, BBQ, Bakery, Indian\nAccommodation: SPACIOUS STUDIO APT 3 IN PROSPECT LEFFERTS GARDENS, Bozeman, cost: 1060, maximum occupancy: 6, house rules: No children under 10 & No parties, minimum nights: 5\n\nNumber of people: 8\nTotal cost: (38 + 66 + 67) * 8 + 1060 = 2,372\nAccommodation minimum nights: 2/5\n\nDays: 3\nCurrent City: from Bozeman, Montana to Denver\nTransportation: Self-driving, from Bozeman to Denver, duration: 9 hours 46 mins, distance: 1,115 km, cost: 55\nBreakfast: Side Wok, Bozeman, cost: 14, cuisines: Tea, Pizza, Indian\nAttraction: Bozeman Sculpture Park, Bozeman\nLunch: -\nDinner: -\nAccommodation: -\n\nNumber of people: 8\nTotal cost: 55 + 14 * 8 = 167\n\nTotal cost across all days: 1,873 + 2,372 + 167 = 4,412\nCuisines: The prompt specifies American and Indian.\n\nPlease note that the accommodation chosen has a minimum stay of 5 nights, which exceeds the travel plan duration. However, due to the lack of information on other accommodations and the budget constraint, this option was selected. If more accommodation options are available, it would be advisable to choose one that matches the travel plan duration. Additionally, the accommodation's maximum occupancy is 6, but since the group has 8 people, an additional room or alternative accommodation may be required. This plan assumes that the group will manage with the available space or find an additional room within the budget.", "gpt-4-1106-preview_direct_sole-planning_parsed_results": [{"day": 1, "current_city": "from Denver to Bozeman, Montana", "transportation": "Self-driving, from Denver to Bozeman, duration: 9 hours 54 mins, distance: 1,119 km", "breakfast": "-", "attraction": "Museum of the Rockies, Bozeman;Gallatin History Museum, Bozeman;", "lunch": "Jiquitaia, Bozeman", "dinner": "McGuire's Irish Pub & Brewery, Bozeman", "accommodation": "SPACIOUS STUDIO APT 3 IN PROSPECT LEFFERTS GARDENS, Bozeman"}, {"day": 2, "current_city": "Bozeman, Montana", "transportation": "-", "breakfast": "Saravana Bhavan, Bozeman", "attraction": "American Computer & Robotics Museum, Bozeman;Montana Science Center, Bozeman;", "lunch": "Indo Chinese, Bozeman", "dinner": "Zaroob, Bozeman", "accommodation": "SPACIOUS STUDIO APT 3 IN PROSPECT LEFFERTS GARDENS, Bozeman"}, {"day": 3, "current_city": "from Bozeman, Montana to Denver", "transportation": "Self-driving, from Bozeman to Denver, duration: 9 hours 46 mins, distance: 1,115 km", "breakfast": "Side Wok, Bozeman", "attraction": "Bozeman Sculpture Park, Bozeman", "lunch": "-", "dinner": "-", "accommodation": "-"}]}]