[{"gpt-4-1106-preview_direct_sole-planning_results": "Travel Plan:\n\nDays: 1\nCurrent City: from Minneapolis to Seattle\nTransportation: Self-driving, from Minneapolis to Seattle, duration: 23 hours 48 mins, distance: 2,666 km, cost: 133\nBreakfast: -\nAttraction: -\nLunch: -\nDinner: -\nAccommodation: Large quiet private studio in East Harlem, Seattle, cost: 181, maximum occupancy: 2, house rules: No children under 10, minimum nights: 7\n\nNumber of people: 1\nTotal cost: 133 + 181 = 314\nAccommodation minimum nights: 1/7\n\nDays: 2\nCurrent City: Seattle\nTransportation: -\nBreakfast: Ting's Red Lantern, Seattle, cost: 24, cuisines: Italian, Bakery, BBQ, Fast Food, Chinese, Seafood\nAttraction: Seattle Aquarium, Seattle; The Seattle Great Wheel, Seattle; Chihuly Garden and Glass, Seattle\nLunch: Mother Ringlet, Seattle, cost: 63, cuisines: Tea, Cafe, Mediterranean, Seafood\nDinner: Caf\u6106 Burger BC, Seattle, cost: 43, cuisines: Tea, French, Bakery, BBQ, Seafood\nAccommodation: Large quiet private studio in East Harlem, Seattle, cost: 181, maximum occupancy: 2, house rules: No children under 10, minimum nights: 7\n\nNumber of people: 1\nTotal cost: (24 + 63 + 43) + 181 = 311\nAccommodation minimum nights: 2/7\n\nDays: 3\nCurrent City: from Seattle to Minneapolis\nTransportation: Self-driving, from Seattle to Minneapolis, duration: 23 hours 47 mins, distance: 2,665 km, cost: 133\nBreakfast: -\nAttraction: -\nLunch: -\nDinner: -\nAccommodation: -\n\nNumber of people: 1\nTotal cost: 133\n\nTotal cost across all days: 314 + 311 + 133 = 758\nCuisines: Italian, Bakery, BBQ, Fast Food, Chinese, Seafood; Tea, Cafe, Mediterranean, Seafood; Tea, French, Bakery, BBQ, Seafood\n\nNote: The accommodation selected has a minimum stay of 7 nights, which exceeds the travel plan duration. However, due to the budget constraints and the lack of other available options within the provided data, this accommodation was chosen to fit within the budget. The actual booking would need to be discussed with the accommodation provider to ensure they can accommodate a shorter stay.", "gpt-4-1106-preview_direct_sole-planning_parsed_results": [{"day": 1, "current_city": "from Minneapolis to Seattle", "transportation": "Self-driving, from Minneapolis to Seattle, duration: 23 hours 48 mins, distance: 2,666 km", "breakfast": "-", "attraction": "-", "lunch": "-", "dinner": "-", "accommodation": "Large quiet private studio in East Harlem, Seattle"}, {"day": 2, "current_city": "Seattle", "transportation": "-", "breakfast": "Ting's Red Lantern, Seattle", "attraction": "Seattle Aquarium, Seattle;The Seattle Great Wheel, Seattle;Chihuly Garden and Glass, Seattle;", "lunch": "Mother Ringlet, Seattle", "dinner": "Caf\u00e9 Burger BC, Seattle", "accommodation": "Large quiet private studio in East Harlem, Seattle"}, {"day": 3, "current_city": "from Seattle to Minneapolis", "transportation": "Self-driving, from Seattle to Minneapolis, duration: 23 hours 47 mins, distance: 2,665 km", "breakfast": "-", "attraction": "-", "lunch": "-", "dinner": "-", "accommodation": "-"}]}]