[{"gpt-4-1106-preview_direct_sole-planning_results": "Travel Plan:\n\nDays: 1\nCurrent City: from Devils Lake to Alamosa, Colorado\nTransportation: Self-driving, from Devils Lake to Alamosa, duration: 17 hours 26 mins, distance: 1,811 km, cost: $90\nBreakfast: -\nAttraction: San Luis Valley Museum, Alamosa; Rio Grande Farm Park, Alamosa\nLunch: Riverwalk Cafe, Alamosa, cost: $97, cuisines: Tea, Pizza, Fast Food\nDinner: Atlanta Highway Seafood Market, Alamosa, cost: $68, cuisines: Fast Food, Desserts, Seafood\nAccommodation: Comfortable studio suite in midtown Manhattan, Alamosa, cost: $67, room type: Entire home/apt, house rules: No parties & No smoking & No visitors, minimum nights: 30, maximum occupancy: 2\n\nNumber of people: 1\nTotal cost: $90 + $97 + $68 + $67 = $322\nAccommodation minimum nights: 1/30\n\nDays: 2\nCurrent City: Alamosa, Colorado\nTransportation: -\nBreakfast: Coffee to Cocktail Bar - Hyatt Place, Alamosa, cost: $35, cuisines: Tea, Indian, Desserts, Italian\nAttraction: Cole Park, Alamosa; Alamosa National Wildlife Refuge and Visitor Center, Alamosa\nLunch: Cafe LazyMojo, Alamosa, cost: $26, cuisines: Tea, Pizza, American, Fast Food\nDinner: The Arena, Alamosa, cost: $85, cuisines: Tea, French, Desserts\nAccommodation: Comfortable studio suite in midtown Manhattan, Alamosa, cost: $67, room type: Entire home/apt, house rules: No parties & No smoking & No visitors, minimum nights: 30, maximum occupancy: 2\n\nNumber of people: 1\nTotal cost: $35 + $26 + $85 + $67 = $213\nAccommodation minimum nights: 2/30\n\nDays: 3\nCurrent City: from Alamosa to Grand Junction, Colorado\nTransportation: Self-driving, from Alamosa to Grand Junction, duration: 4 hours 29 mins, distance: 396 km, cost: $19\nBreakfast: Urban Crave Express, Alamosa, cost: $38, cuisines: Desserts, French, Bakery, Fast Food, Cafe\nAttraction: Museum of the West, Museums of Western Colorado, Grand Junction; Eureka! McConnell Science Museum, Grand Junction\nLunch: 2 Dog, Grand Junction, cost: $29, cuisines: Desserts, BBQ, Fast Food, Cafe, American\nDinner: Austin's BBQ and Oyster Bar, Grand Junction, cost: $15, cuisines: Tea, Bakery, Fast Food, Indian, Seafood\nAccommodation: NYC Apartment near Central Park!, Grand Junction, cost: $1118, room type: Entire home/apt, house rules: No children under 10, minimum nights: 3, maximum occupancy: 5\n\nNumber of people: 1\nTotal cost: $19 + $38 + $29 + $15 + $1118 = $1219\nAccommodation minimum nights: 1/3\n\nDays: 4\nCurrent City: Grand Junction, Colorado\nTransportation: -\nBreakfast: Shanghai Bar & Lounge - The Bristol Hotel, Grand Junction, cost: $31, cuisines: Cafe, Pizza\nAttraction: Western Colorado Botanical Gardens, Grand Junction; Canyon View Park, Grand Junction\nLunch: Punjab Da Pind, Grand Junction, cost: $52, cuisines: Desserts, Pizza, Bakery, Chinese, Mediterranean, Seafood\nDinner: Penta Cafe, Grand Junction, cost: $66, cuisines: French, Mexican, BBQ, Seafood\nAccommodation: NYC Apartment near Central Park!, Grand Junction, cost: $1118, room type: Entire home/apt, house rules: No children under 10, minimum nights: 3, maximum occupancy: 5\n\nNumber of people: 1\nTotal cost: $31 + $52 + $66 + $1118 = $1267\nAccommodation minimum nights: 2/3\n\nDays: 5\nCurrent City: from Grand Junction to Gunnison, Colorado\nTransportation: Self-driving, from Grand Junction to Gunnison, duration: 2 hours 27 mins, distance: 200 km, cost: $10\nBreakfast: Vedanta's, Grand Junction, cost: $21, cuisines: Tea, French, Bakery, Cafe, Seafood\nAttraction: Gunnison Pioneer Museum, Gunnison; Gunnison Valley Observatory, Gunnison\nLunch: Happy Joe's Pizza & Ice Cream, Gunnison, cost: $74, cuisines: Desserts, Italian, Bakery, Indian, Seafood\nDinner: SALT, Gunnison, cost: $44, cuisines: Tea, Chinese, BBQ\nAccommodation: Full-size loft bed in East Village, Gunnison, cost: $104, room type: Private room, house rules: No visitors & No pets & No parties, minimum nights: 1, maximum occupancy: 1\n\nNumber of people: 1\nTotal cost: $10 + $21 + $74 + $44 + $104 = $253\nAccommodation minimum nights: 1/1\n\nDays: 6\nCurrent City: Gunnison, Colorado\nTransportation: -\nBreakfast: Mocha, Gunnison, cost: $30, cuisines: Tea, Cafe, Pizza, BBQ\nAttraction: Hartman Rocks, Gunnison; Black Canyon of the Gunnison National Park, Gunnison\nLunch: Paradise Inn, Gunnison, cost: $99, cuisines: BBQ, Bakery, Desserts\nDinner: Tughlaq, Gunnison, cost: $18, cuisines: French, Pizza, Fast Food\nAccommodation: Full-size loft bed in East Village, Gunnison, cost: $104, room type: Private room, house rules: No visitors & No pets & No parties, minimum nights: 1, maximum occupancy: 1\n\nNumber of people: 1\nTotal cost: $30 + $99 + $18 + $104 = $251\nAccommodation minimum nights: 2/1\n\nDays: 7\nCurrent City: from Gunnison to Devils Lake\nTransportation: Self-driving, from Gunnison to Devils Lake, duration: 17 hours 30 mins, distance: 1,881 km, cost: $94\nBreakfast: Larry's China - Taj Vivanta, Gunnison, cost: $33, cuisines: Cafe, Bakery, Indian, Italian\nAttraction: -\nLunch: -\nDinner: -\nAccommodation: -\n\nNumber of people: 1\nTotal cost: $94 + $33 = $127\n\nTotal cost across all days: $322 + $213 + $1219 + $1267 + $253 + $251 + $127 = $3652\n\nCuisines: The prompt specifies a variety of cuisines, which have been included in the meals.\n\nNote: The total cost slightly exceeds the budget of $3,500 by $152. Adjustments to the accommodation or dining options may be necessary to stay within budget.", "gpt-4-1106-preview_direct_sole-planning_parsed_results": [{"day": 1, "current_city": "from Devils Lake to Alamosa, Colorado", "transportation": "Self-driving, from Devils Lake to Alamosa, duration: 17 hours 26 mins, distance: 1,811 km", "breakfast": "-", "attraction": "San Luis Valley Museum, Alamosa;Rio Grande Farm Park, Alamosa;", "lunch": "Riverwalk Cafe, Alamosa", "dinner": "Atlanta Highway Seafood Market, Alamosa", "accommodation": "Comfortable studio suite in midtown Manhattan, Alamosa"}, {"day": 2, "current_city": "Alamosa, Colorado", "transportation": "-", "breakfast": "Coffee to Cocktail Bar - Hyatt Place, Alamosa", "attraction": "Cole Park, Alamosa;Alamosa National Wildlife Refuge and Visitor Center, Alamosa;", "lunch": "Cafe LazyMojo, Alamosa", "dinner": "The Arena, Alamosa", "accommodation": "Comfortable studio suite in midtown Manhattan, Alamosa"}, {"day": 3, "current_city": "from Alamosa to Grand Junction, Colorado", "transportation": "Self-driving, from Alamosa to Grand Junction, duration: 4 hours 29 mins, distance: 396 km", "breakfast": "Urban Crave Express, Alamosa", "attraction": "Museum of the West, Museums of Western Colorado, Grand Junction;Eureka! McConnell Science Museum, Grand Junction;", "lunch": "2 Dog, Grand Junction", "dinner": "Austin's BBQ and Oyster Bar, Grand Junction", "accommodation": "NYC Apartment near Central Park!, Grand Junction"}, {"day": 4, "current_city": "Grand Junction, Colorado", "transportation": "-", "breakfast": "Shanghai Bar & Lounge - The Bristol Hotel, Grand Junction", "attraction": "Western Colorado Botanical Gardens, Grand Junction;Canyon View Park, Grand Junction;", "lunch": "Punjab Da Pind, Grand Junction", "dinner": "Penta Cafe, Grand Junction", "accommodation": "NYC Apartment near Central Park!, Grand Junction"}, {"day": 5, "current_city": "from Grand Junction to Gunnison, Colorado", "transportation": "Self-driving, from Grand Junction to Gunnison, duration: 2 hours 27 mins, distance: 200 km", "breakfast": "Vedanta's, Grand Junction", "attraction": "Gunnison Pioneer Museum, Gunnison;Gunnison Valley Observatory, Gunnison;", "lunch": "Happy Joe's Pizza & Ice Cream, Gunnison", "dinner": "SALT, Gunnison", "accommodation": "Full-size loft bed in East Village, Gunnison"}, {"day": 6, "current_city": "Gunnison, Colorado", "transportation": "-", "breakfast": "Mocha, Gunnison", "attraction": "Hartman Rocks, Gunnison;Black Canyon of the Gunnison National Park, Gunnison;", "lunch": "Paradise Inn, Gunnison", "dinner": "Tughlaq, Gunnison", "accommodation": "Full-size loft bed in East Village, Gunnison"}, {"day": 7, "current_city": "from Gunnison to Devils Lake", "transportation": "Self-driving, from Gunnison to Devils Lake, duration: 17 hours 30 mins, distance: 1,881 km", "breakfast": "Larry's China - Taj Vivanta, Gunnison", "attraction": "-", "lunch": "-", "dinner": "-", "accommodation": "-"}]}]