[{"gpt-4-1106-preview_direct_sole-planning_results": "Travel Plan:\n\nDays: 1\nCurrent City: from Boston to Wilmington, North Carolina\nTransportation: Taxi, from Boston to Wilmington, duration: 12 hours 27 mins, distance: 1,304 km, cost: 1304\nBreakfast: -\nAttraction: Wilmington Riverwalk, Wilmington; Bellamy Mansion Museum, Wilmington\nLunch: Bandit Burrito, Wilmington, cost: 26, cuisines: Desserts, French, Bakery, Fast Food, Seafood\nDinner: Azteca, Wilmington, cost: 56, cuisines: Cafe, Indian, BBQ\nAccommodation: Prime East Village location w/backyard garden!, Wilmington, cost: 978, room type: Entire home/apt, house rules: No pets & No smoking, maximum occupancy: 7\n\nNumber of people: 4\nTotal cost: 1304 + (26 + 56) * 4 + 978 = 2,546\nAccommodation minimum nights: 1/4\n\nDays: 2\nCurrent City: Wilmington, North Carolina\nTransportation: -\nBreakfast: Dunkin' Donuts, Wilmington, cost: 25, cuisines: Desserts, Tea, Pizza, Italian, French\nAttraction: Airlie Gardens, Wilmington; Cape Fear Museum of History and Science, Wilmington\nLunch: Momo-Cha, Wilmington, cost: 92, cuisines: Desserts, Cafe, French, BBQ, Chinese\nDinner: The Yellow Chef, Wilmington, cost: 45, cuisines: French, BBQ, Mediterranean, Fast Food\nAccommodation: Prime East Village location w/backyard garden!, Wilmington, cost: 978, room type: Entire home/apt, house rules: No pets & No smoking, maximum occupancy: 7\n\nNumber of people: 4\nTotal cost: (25 + 92 + 45) * 4 + 978 = 1,754\nAccommodation minimum nights: 2/4\n\nDays: 3\nCurrent City: from Wilmington to Charlotte, North Carolina\nTransportation: Flight F3666331, from Wilmington to Charlotte, cost: 38, duration: 1 hours 0 minutes\nBreakfast: Rose Cafe, Wilmington, cost: 96, cuisines: Italian, Bakery, Fast Food, Cafe, American\nAttraction: Freedom Park, Charlotte; Levine Museum of the New South, Charlotte\nLunch: Olive Tree Cafe, Charlotte, cost: 23, cuisines: Tea, Chinese, Desserts\nDinner: Central Perk 7, Charlotte, cost: 87, cuisines: Pizza, Bakery, BBQ, Fast Food\nAccommodation: Elegant Studio Apt in Prospect Heights, Charlotte, cost: 640, room type: Entire home/apt, house rules: No parties, maximum occupancy: 5\n\nNumber of people: 4\nTotal cost: 38 * 4 + (96 + 23 + 87) * 4 + 640 = 1,672\nAccommodation minimum nights: 1/2\n\nDays: 4\nCurrent City: Charlotte, North Carolina\nTransportation: -\nBreakfast: Subway, Charlotte, cost: 60, cuisines: Tea, Cafe, Mexican, Chinese, Seafood\nAttraction: Discovery Place Science, Charlotte; NASCAR Hall of Fame, Charlotte\nLunch: Kylin Skybar, Charlotte, cost: 44, cuisines: Tea, Cafe, Pizza, Italian\nDinner: Unplugged Courtyard, Charlotte, cost: 54, cuisines: Desserts, French, Bakery, Cafe, Seafood\nAccommodation: Elegant Studio Apt in Prospect Heights, Charlotte, cost: 640, room type: Entire home/apt, house rules: No parties, maximum occupancy: 5\n\nNumber of people: 4\nTotal cost: (60 + 44 + 54) * 4 + 640 = 1,568\nAccommodation minimum nights: 2/2\n\nDays: 5\nCurrent City: from Charlotte to Boston\nTransportation: Flight F3663441, from Charlotte to Boston, cost: 152, duration: 2 hours 2 minutes\nBreakfast: Cafe Maple Street, Charlotte, cost: 91, cuisines: Fast Food, Tea, Italian\nAttraction: The Mint Museum, Charlotte\nLunch: -\nDinner: -\nAccommodation: -\n\nNumber of people: 4\nTotal cost: 152 * 4 + 91 * 4 = 972\n\nTotal cost across all days: 2,546 + 1,754 + 1,672 + 1,568 + 972 = 8,512\n\nCuisines: The prompt specifies a variety of cuisines, and the selected restaurants match the required cuisine types.\n\nNote: The travel plan adheres to the constraints of not self-driving, accommodating visitors, providing entire rooms, and staying within the budget of $8,800. The accommodations selected allow for the specified number of minimum nights and the maximum occupancy is suitable for a group of 4. The transportation modes are consistent with the preference of not self-driving, and all attractions and meals are within the destination cities.", "gpt-4-1106-preview_direct_sole-planning_parsed_results": [{"day": 1, "current_city": "from Boston to Wilmington, North Carolina", "transportation": "Taxi, from Boston to Wilmington, duration: 12 hours 27 mins, distance: 1,304 km", "breakfast": "-", "attraction": "Wilmington Riverwalk, Wilmington; Bellamy Mansion Museum, Wilmington;", "lunch": "Bandit Burrito, Wilmington", "dinner": "Azteca, Wilmington", "accommodation": "Prime East Village location w/backyard garden!, Wilmington"}, {"day": 2, "current_city": "Wilmington, North Carolina", "transportation": "-", "breakfast": "Dunkin' Donuts, Wilmington", "attraction": "Airlie Gardens, Wilmington; Cape Fear Museum of History and Science, Wilmington;", "lunch": "Momo-Cha, Wilmington", "dinner": "The Yellow Chef, Wilmington", "accommodation": "Prime East Village location w/backyard garden!, Wilmington"}, {"day": 3, "current_city": "from Wilmington to Charlotte, North Carolina", "transportation": "Flight Number: F3666331, from Wilmington to Charlotte", "breakfast": "Rose Cafe, Wilmington", "attraction": "Freedom Park, Charlotte; Levine Museum of the New South, Charlotte;", "lunch": "Olive Tree Cafe, Charlotte", "dinner": "Central Perk 7, Charlotte", "accommodation": "Elegant Studio Apt in Prospect Heights, Charlotte"}, {"day": 4, "current_city": "Charlotte, North Carolina", "transportation": "-", "breakfast": "Subway, Charlotte", "attraction": "Discovery Place Science, Charlotte; NASCAR Hall of Fame, Charlotte;", "lunch": "Kylin Skybar, Charlotte", "dinner": "Unplugged Courtyard, Charlotte", "accommodation": "Elegant Studio Apt in Prospect Heights, Charlotte"}, {"day": 5, "current_city": "from Charlotte to Boston", "transportation": "Flight Number: F3663441, from Charlotte to Boston", "breakfast": "Cafe Maple Street, Charlotte", "attraction": "The Mint Museum, Charlotte", "lunch": "-", "dinner": "-", "accommodation": "-"}]}]