[{"gpt-4-1106-preview_direct_sole-planning_results": "Travel Plan:\n\nDays: 1\nCurrent City: from Newark to Madison, Wisconsin\nTransportation: Self-driving, from Newark to Madison, duration: 14 hours 3 mins, distance: 1,490 km, cost: 74\nBreakfast: -\nAttraction: -\nLunch: -\nDinner: -\nAccommodation: Room in two bedroom apartment, Madison, cost: 159, room type: Shared room, house rules: No smoking & No pets, minimum nights: 1, maximum occupancy: 2\n\nNumber of people: 2\nTotal cost: 74 + 159 = 233\nAccommodation minimum nights: 1/1\n\nDays: 2\nCurrent City: Madison, Wisconsin\nTransportation: -\nBreakfast: Chini Bowl, Madison, cost: 26, cuisines: Cafe, Seafood\nAttraction: Wisconsin State Capitol, Madison; Madison Children's Museum, Madison\nLunch: Barbeque Nation, Madison, cost: 38, cuisines: Tea, Pizza, French, Bakery, Cafe\nDinner: The Vault Cafe, Madison, cost: 30, cuisines: Cafe, Mexican, Pizza, Desserts\nAccommodation: Room in two bedroom apartment, Madison, cost: 159, room type: Shared room, house rules: No smoking & No pets, minimum nights: 1, maximum occupancy: 2\n\nNumber of people: 2\nTotal cost: (26 + 38 + 30) * 2 + 159 = 317\nAccommodation minimum nights: 1/1\n\nDays: 3\nCurrent City: from Madison to Mosinee, Wisconsin\nTransportation: Self-driving, from Madison to Mosinee, duration: 2 hours 3 mins, distance: 209 km, cost: 10\nBreakfast: De Cafepedia, Madison, cost: 33, cuisines: Pizza, BBQ, Fast Food, Cafe, American\nAttraction: Rib Mountain State Park, Mosinee; Leigh Yawkey Woodson Art Museum, Mosinee\nLunch: Cafe Sante, Mosinee, cost: 49, cuisines: Pizza, BBQ, Cafe, American, Mediterranean, Seafood\nDinner: House of China Restaurant II, Mosinee, cost: 96, cuisines: Tea, Pizza, French, Cafe, Seafood\nAccommodation: Where Dreams are made of NYC, Mosinee, cost: 212, room type: Shared room, house rules: No smoking & No children under 10, minimum nights: 1, maximum occupancy: 1\n\nNumber of people: 2\nTotal cost: 10 + (33 + 49 + 96) * 2 + 212 = 578\nAccommodation minimum nights: 1/1\n\nDays: 4\nCurrent City: Mosinee, Wisconsin\nTransportation: -\nBreakfast: MyLoveBiryani.Com, Mosinee, cost: 17, cuisines: Tea, Bakery, Desserts\nAttraction: Granite Peak Ski Area, Mosinee; Big Eau Pleine County Park, Mosinee\nLunch: Senorita's, Mosinee, cost: 94, cuisines: Fast Food, Chinese, Cafe, Seafood\nDinner: Naturals Ice Cream, Mosinee, cost: 79, cuisines: Italian, Bakery, BBQ, Cafe, Indian\nAccommodation: Where Dreams are made of NYC, Mosinee, cost: 212, room type: Shared room, house rules: No smoking & No children under 10, minimum nights: 1, maximum occupancy: 1\n\nNumber of people: 2\nTotal cost: (17 + 94 + 79) * 2 + 212 = 590\nAccommodation minimum nights: 1/1\n\nDays: 5\nCurrent City: from Mosinee to Newark\nTransportation: Self-driving, from Mosinee to Newark, duration: 15 hours 32 mins, distance: 1,695 km, cost: 84\nBreakfast: -\nAttraction: -\nLunch: -\nDinner: -\nAccommodation: -\n\nNumber of people: 2\nTotal cost: 84\n\nTotal cost across all days: 233 + 317 + 578 + 590 + 84 = 1,802\nCuisines: Various cuisines including Cafe, Seafood, Tea, Pizza, French, Bakery, American, Mexican, Mediterranean, Italian, Chinese, BBQ, Indian, Desserts\n\nRemaining budget: $2,700 - $1,802 = $898\n\nPlease note that the accommodation on Day 3 and Day 4 is a shared room but only accommodates 1 person, so an additional room is booked for the second person, doubling the accommodation cost for those nights. The total cost is within the specified budget, and the travel plan includes a variety of cuisines and attractions in each city. The transportation method is self-driving throughout the trip, and the accommodations are shared rooms as requested.", "gpt-4-1106-preview_direct_sole-planning_parsed_results": [{"day": 1, "current_city": "from Newark to Madison, Wisconsin", "transportation": "Self-driving, from Newark to Madison, duration: 14 hours 3 mins, distance: 1,490 km", "breakfast": "-", "attraction": "-", "lunch": "-", "dinner": "-", "accommodation": "Room in two bedroom apartment, Madison"}, {"day": 2, "current_city": "Madison, Wisconsin", "transportation": "-", "breakfast": "Chini Bowl, Madison", "attraction": "Wisconsin State Capitol, Madison;Madison Children's Museum, Madison;", "lunch": "Barbeque Nation, Madison", "dinner": "The Vault Cafe, Madison", "accommodation": "Room in two bedroom apartment, Madison"}, {"day": 3, "current_city": "from Madison to Mosinee, Wisconsin", "transportation": "Self-driving, from Madison to Mosinee, duration: 2 hours 3 mins, distance: 209 km", "breakfast": "De Cafepedia, Madison", "attraction": "Rib Mountain State Park, Mosinee;Leigh Yawkey Woodson Art Museum, Mosinee;", "lunch": "Cafe Sante, Mosinee", "dinner": "House of China Restaurant II, Mosinee", "accommodation": "Where Dreams are made of NYC, Mosinee"}, {"day": 4, "current_city": "Mosinee, Wisconsin", "transportation": "-", "breakfast": "MyLoveBiryani.Com, Mosinee", "attraction": "Granite Peak Ski Area, Mosinee;Big Eau Pleine County Park, Mosinee;", "lunch": "Senorita's, Mosinee", "dinner": "Naturals Ice Cream, Mosinee", "accommodation": "Where Dreams are made of NYC, Mosinee"}, {"day": 5, "current_city": "from Mosinee to Newark", "transportation": "Self-driving, from Mosinee to Newark, duration: 15 hours 32 mins, distance: 1,695 km", "breakfast": "-", "attraction": "-", "lunch": "-", "dinner": "-", "accommodation": "-"}]}]