[{"gpt-4-1106-preview_direct_sole-planning_results": "Travel Plan:\n\nDays: 1\nCurrent City: from Chicago to Albany\nTransportation: Flight F3983350, from Chicago to Albany, duration: 1 hour 34 minutes, distance: 717 km, cost: $160 per person\nBreakfast: -\nAttraction: -\nLunch: -\nDinner: Kaiser, Albany, cost: $96, cuisines: Cafe, Pizza, American\nAccommodation: Mid Town East Side Apartment, Albany, cost: $737, room type: Entire home/apt, house rules: No pets & No children under 10, minimum nights: 1\n\nNumber of people: 2\nTotal cost: (160 * 2) + 96 * 2 + 737 = $1,249\nAccommodation minimum nights: 1/1\n\nDays: 2\nCurrent City: Albany\nTransportation: -\nBreakfast: Cafe Coffee Day, Albany, cost: $82, cuisines: Mexican, Fast Food, Cafe, American, Seafood\nAttraction: New York State Museum, Albany; Washington Park Lake House, Albany\nLunch: Echoes Satyaniketan, Albany, cost: $91, cuisines: Chinese, Bakery, Cafe\nDinner: Urban Punjab, Albany, cost: $63, cuisines: Desserts, Tea, Pizza, Indian, Mediterranean, Seafood\nAccommodation: Mid Town East Side Apartment, Albany, cost: $737, room type: Entire home/apt, house rules: No pets & No children under 10, minimum nights: 1\n\nNumber of people: 2\nTotal cost: (82 + 91 + 63) * 2 + 737 = $1,126\nAccommodation minimum nights: 2/1\n\nDays: 3\nCurrent City: from Albany to Chicago\nTransportation: Flight F4008387, from Albany to Chicago, duration: 2 hours 6 minutes, distance: 717 km, cost: $181 per person\nBreakfast: -\nAttraction: -\nLunch: -\nDinner: -\nAccommodation: -\n\nNumber of people: 2\nTotal cost: 181 * 2 = $362\n\nTotal cost across all days: $1,249 + $1,126 + $362 = $2,737\n\nUnfortunately, the total cost exceeds the specified budget of $2,300. To adjust the plan within the budget, we can consider changing the accommodation to a less expensive option or choosing more budget-friendly dining options. Here's an adjusted plan:\n\nAdjusted Travel Plan:\n\nDays: 1\nCurrent City: from Chicago to Albany\nTransportation: Flight F3983350, from Chicago to Albany, duration: 1 hour 34 minutes, distance: 717 km, cost: $160 per person\nBreakfast: -\nAttraction: -\nLunch: -\nDinner: PiccoLicko, Albany, cost: $22, cuisines: Cafe, Pizza, BBQ, Seafood\nAccommodation: Huge room 25 min to manhattan. L,M,J,Z train., Albany, cost: $63, room type: Private room, house rules: No visitors, minimum nights: 2\n\nNumber of people: 2\nTotal cost: (160 * 2) + 22 * 2 + 63 = $427\nAccommodation minimum nights: 1/2\n\nDays: 2\nCurrent City: Albany\nTransportation: -\nBreakfast: Starvin' Marvin, Albany, cost: $20, cuisines: Tea, Cafe, Mexican, Indian\nAttraction: Albany Institute of History & Art, Albany; USS SLATER, Albany\nLunch: Desi Villa, Albany, cost: $48, cuisines: Tea, Indian, American, Pizza\nDinner: Jahangeer Foods, Albany, cost: $59, cuisines: Tea, Pizza, Italian, BBQ, Cafe\nAccommodation: Huge room 25 min to manhattan. L,M,J,Z train., Albany, cost: $63, room type: Private room, house rules: No visitors, minimum nights: 2\n\nNumber of people: 2\nTotal cost: (20 + 48 + 59) * 2 + 63 = $317\nAccommodation minimum nights: 2/2\n\nDays: 3\nCurrent City: from Albany to Chicago\nTransportation: Flight F4008387, from Albany to Chicago, duration: 2 hours 6 minutes, distance: 717 km, cost: $181 per person\nBreakfast: -\nAttraction: -\nLunch: -\nDinner: -\nAccommodation: -\n\nNumber of people: 2\nTotal cost: 181 * 2 = $362\n\nTotal cost across all days: $427 + $317 + $362 = $1,106\n\nCuisines: The prompt specifies openness to any suggestions, and the plan includes a variety of cuisines.\n\nThis adjusted plan is within the budget of $2,300.", "gpt-4-1106-preview_direct_sole-planning_parsed_results": [{"day": 1, "current_city": "from Chicago to Albany", "transportation": "Flight Number: F3983350, from Chicago to Albany, Departure Time: -, Arrival Time: -", "breakfast": "-", "attraction": "-", "lunch": "-", "dinner": "PiccoLicko, Albany", "accommodation": "Huge room 25 min to manhattan. L,M,J,Z train., Albany"}, {"day": 2, "current_city": "Albany", "transportation": "-", "breakfast": "Starvin' Marvin, Albany", "attraction": "Albany Institute of History & Art, Albany;USS SLATER, Albany;", "lunch": "Desi Villa, Albany", "dinner": "Jahangeer Foods, Albany", "accommodation": "Huge room 25 min to manhattan. L,M,J,Z train., Albany"}, {"day": 3, "current_city": "from Albany to Chicago", "transportation": "Flight Number: F4008387, from Albany to Chicago, Departure Time: -, Arrival Time: -", "breakfast": "-", "attraction": "-", "lunch": "-", "dinner": "-", "accommodation": "-"}]}]