[{"gpt-4-1106-preview_direct_sole-planning_results": "Travel Plan:\n\nDays: 1,\nCurrent City: from Orlando to Belleville (Illinois),\nTransportation: Self-driving, from Orlando to Belleville, duration: 14 hours 12 mins, distance: 1,579 km, cost: 78\nBreakfast: -,\nAttraction: -,\nLunch: -,\nDinner: Fuji Japanese Steak House, Belleville (Illinois), cost: 70, cuisines: \u201cBakery, Indian, Cafe\u201d\nAccommodation: 1 Bedroom/1 Bath Apt in Hudson Yards/Midtown West, Belleville (Illinois), cost: 610, room type: Entire home/apt, house rules: No parties & No pets, minimum nights: 1, maximum occupancy: 2\n\nNumber of people = 1\nTotal cost = 78 + 70 + 610 = 758\nAccommodation minimum nights: 1/1\n\nDays: 2,\nCurrent City: Belleville (Illinois),\nTransportation: -,\nBreakfast: Cafe Amaretto, Belleville (Illinois), cost: 35, cuisines: \u201cTea, Pizza, French, Mexican, BBQ, Cafe\u201d\nAttraction: Labor & Industrial Museum; St. Clair County Historical Society; Belleville Square,\nLunch: Romi da Dhaba, Belleville (Illinois), cost: 24, cuisines: \u201cDesserts, BBQ, Fast Food, Cafe, Indian\u201d\nDinner: Super Restaurant, Belleville (Illinois), cost: 96, cuisines: \u201cTea, American, BBQ, Italian\u201d\nAccommodation: 1 Bedroom/1 Bath Apt in Hudson Yards/Midtown West, Belleville (Illinois), cost: 610, room type: Entire home/apt, house rules: No parties & No pets, minimum nights: 1, maximum occupancy: 2\n\nNumber of people = 1\nTotal cost = 35 + 24 + 96 + 610 = 765\nAccommodation minimum nights: 2/1\n\nDays: 3,\nCurrent City: from Belleville (Illinois) to Chicago (Illinois),\nTransportation: Self-driving, from Belleville to Chicago, duration: 4 hours 36 mins, distance: 474 km, cost: 23\nBreakfast: -,\nAttraction: Navy Pier; Millennium Park; Willis Tower,\nLunch: Pantry d'or, Chicago (Illinois), cost: 53, cuisines: \u201cTea, BBQ, Fast Food, Cafe, Indian\u201d\nDinner: The Black Pearl, Chicago (Illinois), cost: 63, cuisines: \u201cCafe, Bakery\u201d\nAccommodation: Newly Renovated Greenpoint Abode, Chicago (Illinois), cost: 981, room type: Entire home/apt, house rules: No parties & No children under 10 & No smoking, minimum nights: 2, maximum occupancy: 7\n\nNumber of people = 1\nTotal cost = 23 + 53 + 63 + 981 = 1120\nAccommodation minimum nights: 1/2\n\nDays: 4,\nCurrent City: Chicago (Illinois),\nTransportation: -,\nBreakfast: Mini's Royal Cafe, Chicago (Illinois), cost: 72, cuisines: \u201cTea, Cafe, Bakery\u201d\nAttraction: Skydeck Chicago; 360 CHICAGO; Shedd Aquarium,\nLunch: Bro's Kitchenette, Chicago (Illinois), cost: 38, cuisines: \u201cMexican, Desserts, Seafood\u201d\nDinner: Pizza Hut, Chicago (Illinois), cost: 99, cuisines: \u201cPizza, French, Bakery, BBQ, Fast Food, American\u201d\nAccommodation: Newly Renovated Greenpoint Abode, Chicago (Illinois), cost: 981, room type: Entire home/apt, house rules: No parties & No children under 10 & No smoking, minimum nights: 2, maximum occupancy: 7\n\nNumber of people = 1\nTotal cost = 72 + 38 + 99 + 981 = 1190\nAccommodation minimum nights: 2/2\n\nDays: 5,\nCurrent City: from Chicago (Illinois) to Orlando,\nTransportation: Flight Number: F3560038, from Chicago (Illinois) to Orlando, Departure Time: 05:53, Arrival Time: 09:28, cost: 288\nBreakfast: -,\nAttraction: -,\nLunch: -,\nDinner: -,\nAccommodation: -\n\nNumber of people = 1\nTotal cost = 288\n\nTotal cost across all days = 758 + 765 + 1120 + 1190 + 288 = 4121\n\nUnfortunately, the total cost of $4,121 exceeds the budget of $2,700. Adjustments need to be made to the plan to fit the budget. Here is a revised plan:\n\nRevised Travel Plan:\n\nDays: 1,\nCurrent City: from Orlando to Belleville (Illinois),\nTransportation: Self-driving, from Orlando to Belleville, duration: 14 hours 12 mins, distance: 1,579 km, cost: 78\nBreakfast: -,\nAttraction: -,\nLunch: -,\nDinner: Fuji Japanese Steak House, Belleville (Illinois), cost: 70, cuisines: \u201cBakery, Indian, Cafe\u201d\nAccommodation: Cozy, Belleville (Illinois), cost: 184, room type: Private room, house rules: No visitors & No smoking & No children under 10, minimum nights: 1, maximum occupancy: 2\n\nNumber of people = 1\nTotal cost = 78 + 70 + 184 = 332\nAccommodation minimum nights: 1/1\n\nDays: 2,\nCurrent City: Belleville (Illinois),\nTransportation: -,\nBreakfast: Cafe Amaretto, Belleville (Illinois), cost: 35, cuisines: \u201cTea, Pizza, French, Mexican, BBQ, Cafe\u201d\nAttraction: Labor & Industrial Museum; St. Clair County Historical Society; Belleville Square,\nLunch: Romi da Dhaba, Belleville (Illinois), cost: 24, cuisines: \u201cDesserts, BBQ, Fast Food, Cafe, Indian\u201d\nDinner: Super Restaurant, Belleville (Illinois), cost: 96, cuisines: \u201cTea, American, BBQ, Italian\u201d\nAccommodation: Cozy, Belleville (Illinois), cost: 184, room type: Private room, house rules: No visitors & No smoking & No children under 10, minimum nights: 1, maximum occupancy: 2\n\nNumber of people = 1\nTotal cost = 35 + 24 + 96 + 184 = 339\nAccommodation minimum nights: 2/1\n\nDays: 3,\nCurrent City: from Belleville (Illinois) to Chicago (Illinois),\nTransportation: Self-driving, from Belleville to Chicago, duration: 4 hours 36 mins, distance: 474 km, cost: 23\nBreakfast: -,\nAttraction: Navy Pier; Millennium Park; Willis Tower,\nLunch: Pantry d'or, Chicago (Illinois), cost: 53, cuisines: \u201cTea, BBQ, Fast Food, Cafe, Indian\u201d\nDinner: The Black Pearl, Chicago (Illinois), cost: 63, cuisines: \u201cCafe, Bakery\u201d\nAccommodation: Beautiful 1 BR by Prospect Park, Chicago (Illinois), cost: 328, room type: Entire home/apt, house rules: No parties & No visitors & No children under 10, minimum nights: 5, maximum occupancy: 3\n\nNumber of people = 1\nTotal cost = 23 + 53 + 63 + 328 = 467\nAccommodation minimum nights: 1/5\n\nDays: 4,\nCurrent City: Chicago (Illinois),\nTransportation: -,\nBreakfast: Mini's Royal Cafe, Chicago (Illinois), cost: 72, cuisines: \u201cTea, Cafe, Bakery\u201d\nAttraction: Skydeck Chicago; 360 CHICAGO; Shedd Aquarium,\nLunch: Bro's Kitchenette, Chicago (Illinois), cost: 38, cuisines: \u201cMexican, Desserts, Seafood\u201d\nDinner: Pizza Hut, Chicago (Illinois), cost: 99, cuisines: \u201cPizza, French, Bakery, BBQ, Fast Food, American\u201d\nAccommodation: Beautiful 1 BR by Prospect Park, Chicago (Illinois), cost: 328, room type: Entire home/apt, house rules: No parties & No visitors & No children under 10, minimum nights: 5, maximum occupancy: 3\n\nNumber of people = 1\nTotal cost = 72 + 38 + 99 + 328 = 537\nAccommodation minimum nights: 2/5\n\nDays: 5,\nCurrent City: from Chicago (Illinois) to Orlando,\nTransportation: Flight Number: F3560038, from Chicago (Illinois) to Orlando, Departure Time: 05:53, Arrival Time: 09:28, cost: 288\nBreakfast: -,\nAttraction: -,\nLunch: -,\nDinner: -,\nAccommodation: -\n\nNumber of people = 1\nTotal cost = 288\n\nTotal revised cost across all days = 332 + 339 + 467 + 537 + 288 = 1963\n\nThe revised total cost of $1,963 fits within the budget of $2,700.", "gpt-4-1106-preview_direct_sole-planning_parsed_results": [{"day": 1, "current_city": "from Orlando to Belleville", "transportation": "Self-driving, from Orlando to Belleville, duration: 14 hours 12 mins, distance: 1,579 km", "breakfast": "-", "attraction": "-", "lunch": "-", "dinner": "-", "accommodation": "Cozy, Belleville"}, {"day": 2, "current_city": "Belleville", "transportation": "-", "breakfast": "Fuji Japanese Steak House, Belleville", "attraction": "Labor & Industrial Museum, Belleville;", "lunch": "Romi da Dhaba, Belleville", "dinner": "Cafe Amaretto, Belleville", "accommodation": "Cozy, Belleville"}, {"day": 3, "current_city": "from Belleville to Chicago", "transportation": "Self-driving, from Belleville to Chicago, duration: 4 hours 36 mins, distance: 474 km", "breakfast": "-", "attraction": "St. Clair County Historical Society, Belleville;", "lunch": "-", "dinner": "-", "accommodation": "NYC Firehouse-Greenpoint BRKLYN, Chicago"}, {"day": 4, "current_city": "Chicago", "transportation": "-", "breakfast": "The Black Pearl, Chicago", "attraction": "Navy Pier, Chicago; Millennium Park, Chicago;", "lunch": "Bro's Kitchenette, Chicago", "dinner": "Mini's Royal Cafe, Chicago", "accommodation": "NYC Firehouse-Greenpoint BRKLYN, Chicago"}, {"day": 5, "current_city": "from Chicago to Orlando", "transportation": "Flight Number: F3901782, from Chicago to Orlando, Departure Time: 15:37, Arrival Time: 19:07", "breakfast": "-", "attraction": "Skydeck Chicago, Chicago;", "lunch": "Pantry d'or, Chicago", "dinner": "-", "accommodation": "-"}]}]