[{"gpt-4-1106-preview_direct_sole-planning_results": "Travel Plan:\n\nDay 1: March 23, 2022\nCurrent City: from St. Louis to Philadelphia (Pennsylvania)\nTransportation: Flight Number: F4055118, from St. Louis to Philadelphia, Departure Time: 16:57, Arrival Time: 19:58, cost: $337\nBreakfast: -\nAttraction: -\nLunch: -\nDinner: Red Ginger Sushi, Grill & Bar, Philadelphia (Pennsylvania), cost: $98, cuisines: \u201cTea, Cafe, Indian, Fast Food\u201d\nAccommodation: Brooklyn Room in Hip Neighborhood - Close to Train, Philadelphia (Pennsylvania), cost: $742, maximum occupancy: 1, house rules: No parties & No children under 10 & No smoking, minimum nights: 1\n\nNumber of people = 2\nTotal cost = ($337 + $98) * 2 + $742 = $1,612\nAccommodation minimum nights: 1/1\n\nDay 2: March 24, 2022\nCurrent City: Philadelphia (Pennsylvania)\nTransportation: -\nBreakfast: Hong Kong Cafe, Philadelphia (Pennsylvania), cost: $47, cuisines: \u201cTea, Pizza, Italian, BBQ, Cafe\u201d\nAttraction: Liberty Bell, Philadelphia (Pennsylvania); The Franklin Institute, Philadelphia (Pennsylvania);\nLunch: Marukame Udon, Philadelphia (Pennsylvania), cost: $100, cuisines: \u201cTea, Pizza, Italian, BBQ, Fast Food, Chinese\u201d\nDinner: Red Mesa Cantina, Philadelphia (Pennsylvania), cost: $36, cuisines: \u201cTea, Cafe, American, Fast Food\u201d\nAccommodation: Brooklyn Room in Hip Neighborhood - Close to Train, Philadelphia (Pennsylvania), cost: $742, maximum occupancy: 1, house rules: No parties & No children under 10 & No smoking, minimum nights: 1\n\nNumber of people = 2\nTotal cost = ($47 + $100 + $36) * 2 + $742 = $1,108\nAccommodation minimum nights: 2/1\n\nDay 3: March 25, 2022\nCurrent City: from Philadelphia to Harrisburg (Pennsylvania)\nTransportation: Flight Number: F3732413, from Philadelphia to Harrisburg, Departure Time: 11:17, Arrival Time: 12:01, cost: $22\nBreakfast: -\nAttraction: The National Civil War Museum, Harrisburg (Pennsylvania);\nLunch: Viva! Argentine Cuisine, Harrisburg (Pennsylvania), cost: $28, cuisines: \u201cMexican, Pizza, BBQ\u201d\nDinner: Rustom's Parsi Bhonu, Harrisburg (Pennsylvania), cost: $77, cuisines: \u201cAmerican, Desserts, Fast Food\u201d\nAccommodation: Cozy Nolita Apartment, Harrisburg (Pennsylvania), cost: $170, maximum occupancy: 3, house rules: No smoking & No parties, minimum nights: 2\n\nNumber of people = 2\nTotal cost = ($22 + $28 + $77) * 2 + $170 = $444\nAccommodation minimum nights: 1/2\n\nDay 4: March 26, 2022\nCurrent City: Harrisburg (Pennsylvania)\nTransportation: -\nBreakfast: Spiral - Sofitel Philippine Plaza Manila, Harrisburg (Pennsylvania), cost: $222, cuisines: \u201cTea, Cafe, Pizza\u201d\nAttraction: Pennsylvania National Fire Museum, Harrisburg (Pennsylvania); Riverfront Park, Harrisburg (Pennsylvania);\nLunch: Cakes & More, Harrisburg (Pennsylvania), cost: $98, cuisines: \u201cCafe, Bakery, BBQ, Seafood\u201d\nDinner: Square - Sayaji Hotel, Harrisburg (Pennsylvania), cost: $99, cuisines: \u201cCafe, Mexican, American, BBQ\u201d\nAccommodation: Cozy Nolita Apartment, Harrisburg (Pennsylvania), cost: $170, maximum occupancy: 3, house rules: No smoking & No parties, minimum nights: 2\n\nNumber of people = 2\nTotal cost = ($222 + $98 + $99) * 2 + $170 = $1,008\nAccommodation minimum nights: 2/2\n\nDay 5: March 27, 2022\nCurrent City: from Harrisburg to State College (Pennsylvania)\nTransportation: Self-driving, from Harrisburg to State College, duration: 1 hour 31 mins, distance: 139 km, cost: $6\nBreakfast: -\nAttraction: The Arboretum at Penn State, State College (Pennsylvania);\nLunch: Los Agaves, State College (Pennsylvania), cost: $39, cuisines: \u201cFrench, BBQ, Cafe\u201d\nDinner: Amici Cafe, State College (Pennsylvania), cost: $96, cuisines: \u201cPizza, Bakery, BBQ, Chinese, Seafood\u201d\nAccommodation: Charming 1BR in UES Townhouse, State College (Pennsylvania), cost: $1134, maximum occupancy: 4, house rules: No smoking, minimum nights: 30\n\nNumber of people = 2\nTotal cost = $6 + ($39 + $96) * 2 + $1134 = $1,410\nAccommodation minimum nights: 1/30\n\nDay 6: March 28, 2022\nCurrent City: State College (Pennsylvania)\nTransportation: -\nBreakfast: Kawa Sushi, State College (Pennsylvania), cost: $82, cuisines: \u201cFrench, Mexican, Desserts, Fast Food\u201d\nAttraction: Discovery Space of Central Pennsylvania, State College (Pennsylvania); Penn State All-Sports Museum, State College (Pennsylvania);\nLunch: Salsa's Mexican Restaurant, State College (Pennsylvania), cost: $52, cuisines: \u201cTea, BBQ, Fast Food\u201d\nDinner: The Chocolate Heaven, State College (Pennsylvania), cost: $45, cuisines: \u201cPizza, BBQ\u201d\nAccommodation: Charming 1BR in UES Townhouse, State College (Pennsylvania), cost: $1134, maximum occupancy: 4, house rules: No smoking, minimum nights: 30\n\nNumber of people = 2\nTotal cost = ($82 + $52 + $45) * 2 + $1134 = $1,492\nAccommodation minimum nights: 2/30\n\nDay 7: March 29, 2022\nCurrent City: from State College to St. Louis\nTransportation: Self-driving, from State College to St. Louis, duration: 11 hours 18 mins, distance: 1,195 km, cost: $59\nBreakfast: -\nAttraction: -\nLunch: -\nDinner: -\nAccommodation: -\n\nNumber of people = 2\nTotal cost = $59 * 2 = $118\n\nTotal cost across all days = $1,612 + $1,108 + $444 + $1,008 + $1,410 + $1,492 + $118 = $7,192\n\nCuisines: The prompt specifies Indian and American, and both of these cuisines have been represented in the restaurants chosen.", "gpt-4-1106-preview_direct_sole-planning_parsed_results": [{"day": 1, "current_city": "from St. Louis to Philadelphia", "transportation": "Flight Number: F3787538, from St. Louis to Philadelphia, Departure Time: 05:26, Arrival Time: 08:29", "breakfast": "-", "attraction": "Liberty Bell, Philadelphia;", "lunch": "Red Ginger Sushi, Grill & Bar, Philadelphia", "dinner": "Red Mesa Cantina, Philadelphia", "accommodation": "Industrial Loft Living in NYC, Philadelphia"}, {"day": 2, "current_city": "Philadelphia", "transportation": "-", "breakfast": "Hong Kong Cafe, Philadelphia", "attraction": "Philadelphia Museum of Art, Philadelphia;", "lunch": "Marukame Udon, Philadelphia", "dinner": "The Moon Under Water, Philadelphia", "accommodation": "Industrial Loft Living in NYC, Philadelphia"}, {"day": 3, "current_city": "from Philadelphia to Harrisburg", "transportation": "Flight Number: F3732413, from Philadelphia to Harrisburg, Departure Time: 11:17, Arrival Time: 12:01", "breakfast": "-", "attraction": "The National Civil War Museum, Harrisburg;", "lunch": "Viva! Argentine Cuisine, Harrisburg", "dinner": "Square - Sayaji Hotel, Harrisburg", "accommodation": "Cozy Nolita Apartment, Harrisburg"}, {"day": 4, "current_city": "Harrisburg", "transportation": "-", "breakfast": "Spiral - Sofitel Philippine Plaza Manila, Harrisburg", "attraction": "Pennsylvania National Fire Museum, Harrisburg;", "lunch": "Cakes & More, Harrisburg", "dinner": "Masala Fusion, Harrisburg", "accommodation": "Cozy Nolita Apartment, Harrisburg"}, {"day": 5, "current_city": "from Harrisburg to State College", "transportation": "Self-driving, from Harrisburg to State College", "breakfast": "-", "attraction": "The Arboretum at Penn State, State College;", "lunch": "Los Agaves, State College", "dinner": "Amici Cafe, State College", "accommodation": "\u2606 HUGE, SUNLIT Room - 3 min walk from Train !, State College"}, {"day": 6, "current_city": "State College", "transportation": "-", "breakfast": "Kawa Sushi, State College", "attraction": "Penn State All-Sports Museum, State College;", "lunch": "Fusion Food Corner, State College", "dinner": "The Chocolate Heaven, State College", "accommodation": "\u2606 HUGE, SUNLIT Room - 3 min walk from Train !, State College"}, {"day": 7, "current_city": "from State College to St. Louis", "transportation": "Self-driving, from State College to St. Louis", "breakfast": "-", "attraction": "-", "lunch": "-", "dinner": "-", "accommodation": "-"}]}]