[{"gpt-4-1106-preview_direct_sole-planning_results": "Travel Plan:\n\nDays: 1,\nCurrent City: from Latrobe to Myrtle Beach (South Carolina),\nTransportation: Flight Number: F3615674, from Latrobe to Myrtle Beach (South Carolina), Departure Time: 17:59, Arrival Time: 19:12, cost: 116\nBreakfast: -, \nAttraction: -, \nLunch: -, \nDinner: Exotic India, Myrtle Beach (South Carolina), cost: 81, cuisines: \u201cIndian, BBQ, Fast Food\u201d\nAccommodation: Cozy Brooklyn Room - Next to Pratt Institute, Myrtle Beach (South Carolina), cost: 418, maximum occupancy: 2, house rules: No smoking & No children under 10 & No pets, minimum nights: 5\n\nNumber of people = 1\nTotal cost = 116 + 81 + 418 = 615\nAccommodation minimum nights:  1/5\n\nDays: 2,\nCurrent City: Myrtle Beach (South Carolina),\nTransportation: -, \nBreakfast: Catfish Charlie's, Myrtle Beach (South Carolina), cost: 14, cuisines: \u201cTea, Chinese, Desserts\u201d\nAttraction: SkyWheel Myrtle Beach, Myrtle Beach (South Carolina); Broadway at the Beach, Myrtle Beach (South Carolina);, \nLunch: d' Curry House, Myrtle Beach (South Carolina), cost: 33, cuisines: \u201cTea, Chinese, Desserts, Fast Food\u201d\nDinner: Twigly, Myrtle Beach (South Carolina), cost: 55, cuisines: \u201cTea, Bakery, Mediterranean, Seafood\u201d\nAccommodation: Cozy Brooklyn Room - Next to Pratt Institute, Myrtle Beach (South Carolina), cost: 418, maximum occupancy: 2, house rules: No smoking & No children under 10 & No pets, minimum nights: 5\n\nNumber of people = 1\nTotal cost = 14 + 33 + 55 + 418 = 520\nAccommodation minimum nights:  2/5\n\nDays: 3,\nCurrent City: from Myrtle Beach (South Carolina) to Greenville (South Carolina),\nTransportation: self-driving, from Myrtle Beach to Greenville, duration: 4 hours 4 mins, distance: 405 km, cost: 20\nBreakfast: -, \nAttraction: Falls Park on the Reedy, Greenville (South Carolina); Greenville Zoo, Greenville (South Carolina);, \nLunch: Bhoj Restaurant, Greenville (South Carolina), cost: 71, cuisines: \u201cTea, Chinese, Pizza\u201d\nDinner: Italiano, Greenville (South Carolina), cost: 95, cuisines: \u201cChinese, French, Pizza, Cafe\u201d\nAccommodation: HUGE bedroom available in artsy Bushwick, Greenville (South Carolina), cost: 696, maximum occupancy: 1, house rules: No parties & No children under 10, minimum nights: 1\n\nNumber of people = 1\nTotal cost = 20 + 71 + 95 + 696 = 882\nAccommodation minimum nights:  1/1\n\nDays: 4,\nCurrent City: Greenville (South Carolina),\nTransportation: -, \nBreakfast: Al Bake, Greenville (South Carolina), cost: 90, cuisines: \u201cTea, Cafe, Pizza, Seafood\u201d\nAttraction: The Children\u2019s Museum of the Upstate, Greenville (South Carolina); Greenville County Museum of Art, Greenville (South Carolina);, \nLunch: Indigo Delicatessen, Greenville (South Carolina), cost: 15, cuisines: \u201cChinese, BBQ, Seafood\u201d\nDinner: Sapra Pastry Treat, Greenville (South Carolina), cost: 65, cuisines: \u201cCafe, Pizza, Indian\u201d\nAccommodation: HUGE bedroom available in artsy Bushwick, Greenville (South Carolina), cost: 696, maximum occupancy: 1, house rules: No parties & No children under 10, minimum nights: 1\n\nNumber of people = 1\nTotal cost = 90 + 15 + 65 + 696 = 866\nAccommodation minimum nights:  2/1\n\nDays: 5,\nCurrent City: from Greenville (South Carolina) to Latrobe,\nTransportation: self-driving, from Greenville to Latrobe, duration: 8 hours 34 mins, distance: 858 km, cost: 42\nBreakfast: -, \nAttraction: -, \nLunch: -, \nDinner: -, \nAccommodation: -\n\nNumber of people = 1\nTotal cost = 42\n\nTotal cost across all days = 615 + 520 + 882 + 866 + 42 = 2,925\n\nCuisines: The prompt specifies no particular preference, and a variety of cuisines have been represented in the restaurants chosen.\n\nNote: The accommodation in Myrtle Beach has a minimum of 5 nights, but since the travel plan requires moving to another city, the accommodation is booked for 2 nights only, which may incur additional charges or may not be possible based on the accommodation's policy. This is a limitation of the provided data and should be addressed with the accommodation provider.", "gpt-4-1106-preview_direct_sole-planning_parsed_results": [{"day": 1, "current_city": "from Latrobe to Myrtle Beach", "transportation": "Flight Number: F3615674, from Latrobe to Myrtle Beach, Departure Time: 17:59, Arrival Time: 19:12", "breakfast": "-", "attraction": "-", "lunch": "-", "dinner": "Exotic India, Myrtle Beach", "accommodation": "Cozy Brooklyn Room - Next to Pratt Institute, Myrtle Beach"}, {"day": 2, "current_city": "Myrtle Beach", "transportation": "-", "breakfast": "Catfish Charlie's, Myrtle Beach", "attraction": "SkyWheel Myrtle Beach, Myrtle Beach", "lunch": "d' Curry House, Myrtle Beach", "dinner": "Twigly, Myrtle Beach", "accommodation": "Cozy Brooklyn Room - Next to Pratt Institute, Myrtle Beach"}, {"day": 3, "current_city": "from Myrtle Beach to Greenville", "transportation": "Self-driving, from Myrtle Beach to Greenville, duration: 4 hours 4 mins, distance: 405 km", "breakfast": "First Eat, Myrtle Beach", "attraction": "Falls Park on the Reedy, Greenville", "lunch": "Bhoj Restaurant, Greenville", "dinner": "Al Bake, Greenville", "accommodation": "HUGE bedroom available in artsy Bushwick, Greenville"}, {"day": 4, "current_city": "Greenville", "transportation": "-", "breakfast": "Italiano, Greenville", "attraction": "Greenville Zoo, Greenville", "lunch": "Indigo Delicatessen, Greenville", "dinner": "Sapra Pastry Treat, Greenville", "accommodation": "HUGE bedroom available in artsy Bushwick, Greenville"}, {"day": 5, "current_city": "from Greenville to Latrobe", "transportation": "Self-driving, from Greenville to Latrobe, duration: 8 hours 34 mins, distance: 858 km", "breakfast": "Mughlai Treat, Greenville", "attraction": "The Children\u2019s Museum of the Upstate, Greenville", "lunch": "Bhoj Restaurant, Greenville", "dinner": "-", "accommodation": "-"}]}]