[{"gpt-4-1106-preview_direct_sole-planning_results": "Travel Plan:\n\nDay 1: March 22, 2022\nCurrent City: Jacksonville to Martha's Vineyard (Massachusetts)\nTransportation: Self-driving, from Jacksonville to Martha's Vineyard, duration: 18 hours 51 mins, distance: 1,927 km, cost: $96\nBreakfast: - \nAttraction: - \nLunch: - \nDinner: Yellow Dog Eats, Martha's Vineyard, cost: $34, cuisines: \u201cCafe, Indian, Desserts, Seafood\u201d\nAccommodation: Family-friendly 3-bedroom condo, Martha's Vineyard, cost: $279, room type: Entire home/apt, house rules: No children under 10 & No pets & No smoking, minimum nights: 4, maximum occupancy: 2\n\nTotal cost for Day 1: $96 (transportation) + $34 (dinner) + $279 (accommodation) = $409\n\nDay 2: March 23, 2022\nCurrent City: Martha's Vineyard\nTransportation: - \nBreakfast: Bern's Steak House, Martha's Vineyard, cost: $35, cuisines: \u201cDesserts, Mexican, Bakery, BBQ, Indian, Seafood\u201d\nAttraction: Martha's Vineyard Museum; Edgartown Lighthouse\nLunch: Friends Forever, Martha's Vineyard, cost: $55, cuisines: \u201cFast Food, BBQ, Seafood\u201d\nDinner: Domino's Pizza, Martha's Vineyard, cost: $59, cuisines: \u201cPizza, Mexican, Bakery, BBQ, Seafood\u201d\nAccommodation: Family-friendly 3-bedroom condo, Martha's Vineyard, cost: $279\n\nTotal cost for Day 2: $35 (breakfast) + $55 (lunch) + $59 (dinner) + $279 (accommodation) = $428\n\nDay 3: March 24, 2022\nCurrent City: Martha's Vineyard to Hyannis (Massachusetts)\nTransportation: Self-driving, from Martha's Vineyard to Hyannis, duration: 2 hours 7 mins, distance: 49.5 km, cost: $2\nBreakfast: - \nAttraction: John F. Kennedy Hyannis Museum; Cape Cod Maritime Museum\nLunch: Soho Hibachi, Hyannis, cost: $12, cuisines: \u201cTea, Seafood, Pizza, Fast Food\u201d\nDinner: The Cheesecake Factory, Hyannis, cost: $96, cuisines: \u201cDesserts, Tea, Pizza, Mexican, Seafood\u201d\nAccommodation: Luxury 1 bedroom apt. Downtown Brooklyn/Dumbo, Hyannis, cost: $111, room type: Entire home/apt, house rules: No parties & No children under 10, minimum nights: 5, maximum occupancy: 3\n\nTotal cost for Day 3: $2 (transportation) + $12 (lunch) + $96 (dinner) + $111 (accommodation) = $221\n\nDay 4: March 25, 2022\nCurrent City: Hyannis\nTransportation: - \nBreakfast: Kailash Restaurant, Hyannis, cost: $45, cuisines: \u201cBakery, Pizza, American\u201d\nAttraction: Cape Codder Water Park; Veterans Memorial Park\nLunch: Cafe Grub Up, Hyannis, cost: $19, cuisines: \u201cBBQ, Seafood\u201d\nDinner: Di Miso, Hyannis, cost: $71, cuisines: \u201cTea, Pizza, Mexican, BBQ, Seafood\u201d\nAccommodation: Luxury 1 bedroom apt. Downtown Brooklyn/Dumbo, Hyannis, cost: $111\n\nTotal cost for Day 4: $45 (breakfast) + $19 (lunch) + $71 (dinner) + $111 (accommodation) = $246\n\nDay 5: March 26, 2022\nCurrent City: Hyannis to Nantucket (Massachusetts)\nTransportation: Self-driving, from Hyannis to Nantucket, duration: 2 hours 17 mins, distance: 47.0 km, cost: $2\nBreakfast: - \nAttraction: Whaling Museum; Great Point Lighthouse\nLunch: Sakura, Nantucket, cost: $87, cuisines: \u201cCafe, Indian, Desserts, Italian\u201d\nDinner: Rhinehart's Oyster Bar, Nantucket, cost: $44, cuisines: \u201cTea, Pizza, Mediterranean, Seafood\u201d\nAccommodation: Bohemian Studio Loft in Brooklyn, Nantucket, cost: $817, room type: Entire home/apt, house rules: No visitors, minimum nights: 30, maximum occupancy: 2\n\nTotal cost for Day 5: $2 (transportation) + $87 (lunch) + $44 (dinner) + $817 (accommodation) = $950\n\nDay 6: March 27, 2022\nCurrent City: Nantucket\nTransportation: - \nBreakfast: Chokho Jeeman Marwari Jain Bhojanalya, Nantucket, cost: $15, cuisines: \u201cPizza, BBQ, Desserts, Fast Food\u201d\nAttraction: 'Sconset Bluff Walk; Brant Point Lighthouse\nLunch: Open Oven, Nantucket, cost: $62, cuisines: \u201cTea, French, Fast Food, Cafe, American, Seafood\u201d\nDinner: Prince of China, Nantucket, cost: $41, cuisines: \u201cDesserts, Pizza, Bakery, Fast Food, American\u201d\nAccommodation: Bohemian Studio Loft in Brooklyn, Nantucket, cost: $817\n\nTotal cost for Day 6: $15 (breakfast) + $62 (lunch) + $41 (dinner) + $817 (accommodation) = $935\n\nDay 7: March 28, 2022\nCurrent City: Nantucket to Jacksonville\nTransportation: Self-driving, from Nantucket to Jacksonville, duration: 20 hours 9 mins, distance: 1,967 km, cost: $98\nBreakfast: - \nAttraction: - \nLunch: - \nDinner: - \nAccommodation: -\n\nTotal cost for Day 7: $98 (transportation) = $98\n\nTotal cost across all days: $409 (Day 1) + $428 (Day 2) + $221 (Day 3) + $246 (Day 4) + $950 (Day 5) + $935 (Day 6) + $98 (Day 7) = $3,287\n\nRemaining Budget: $6,600 - $3,287 = $3,313\n\nNote: The travel plan includes all required details such as transportation, meals, attractions, and accommodation for each day of the trip. The plan adheres to the budget and constraints provided in the query.", "gpt-4-1106-preview_direct_sole-planning_parsed_results": [{"day": 1, "current_city": "from Jacksonville to Martha's Vineyard", "transportation": "Self-driving, from Jacksonville to Martha's Vineyard, Duration: 18 hours 51 mins, Distance: 1,927 km", "breakfast": "-", "attraction": "Martha's Vineyard Museum, Martha's Vineyard;", "lunch": "Yellow Dog Eats, Martha's Vineyard", "dinner": "Bern's Steak House, Martha's Vineyard", "accommodation": "Bright and Chill Room in Bushwick for two friends!, Martha's Vineyard"}, {"day": 2, "current_city": "Martha's Vineyard", "transportation": "-", "breakfast": "Pudding & Pie, Martha's Vineyard", "attraction": "East Chop Lighthouse, Martha's Vineyard;", "lunch": "Adarsh Bhojnalaya, Martha's Vineyard", "dinner": "Domino's Pizza, Martha's Vineyard", "accommodation": "Bright and Chill Room in Bushwick for two friends!, Martha's Vineyard"}, {"day": 3, "current_city": "from Martha's Vineyard to Hyannis", "transportation": "Self-driving, from Martha's Vineyard to Hyannis, Duration: 2 hours 7 mins, Distance: 49.5 km", "breakfast": "-", "attraction": "John F. Kennedy Hyannis Museum, Hyannis;", "lunch": "Soho Hibachi, Hyannis", "dinner": "The Cheesecake Factory, Hyannis", "accommodation": "Architect's Bedroom in Large Brooklyn Apartment, Hyannis"}, {"day": 4, "current_city": "Hyannis", "transportation": "-", "breakfast": "Cafe Grub Up, Hyannis", "attraction": "Cape Cod Maritime Museum, Hyannis;", "lunch": "Di Miso, Hyannis", "dinner": "Chilli Indiana, Hyannis", "accommodation": "Architect's Bedroom in Large Brooklyn Apartment, Hyannis"}, {"day": 5, "current_city": "from Hyannis to Nantucket", "transportation": "Self-driving, from Hyannis to Nantucket, Duration: 2 hours 17 mins, Distance: 47.0 km", "breakfast": "-", "attraction": "Whaling Museum, Nantucket;", "lunch": "Sakura, Nantucket", "dinner": "Rhinehart's Oyster Bar, Nantucket", "accommodation": "Serene Spacious and Sun lit Master 5 mins to metro, Nantucket"}, {"day": 6, "current_city": "Nantucket", "transportation": "-", "breakfast": "Uforia, Nantucket", "attraction": "Great Point Lighthouse, Nantucket;", "lunch": "Chokho Jeeman Marwari Jain Bhojanalya, Nantucket", "dinner": "Cake 24x7, Nantucket", "accommodation": "Serene Spacious and Sun lit Master 5 mins to metro, Nantucket"}, {"day": 7, "current_city": "from Nantucket to Jacksonville", "transportation": "Self-driving, from Nantucket to Jacksonville, Duration: 20 hours 9 mins, Distance: 1,967 km", "breakfast": "-", "attraction": "-", "lunch": "-", "dinner": "-", "accommodation": "-"}]}]