[{"gpt-4-1106-preview_direct_sole-planning_results": "Travel Plan:\n\nDays: 1,\nCurrent City: from Augusta to Abilene (Texas),\nTransportation: Self-driving, from Augusta to Abilene, duration: 15 hours 59 mins, distance: 1,782 km, cost: 89\nBreakfast: -,\nAttraction: -,\nLunch: -,\nDinner: Thai Garden, Abilene (Texas), cost: 13, cuisines: \u201cCafe, American, Desserts\u201d\nAccommodation: Joyce and Donovan's, Room for One, Abilene (Texas), cost: 83, maximum occupancy: 2, house rules: No parties, minimum nights: 1\n\nNumber of people = 1\nTotal cost = 89 + 13 + 83 = 185\nAccommodation minimum nights: 1/1\n\nDays: 2,\nCurrent City: Abilene (Texas),\nTransportation: -,\nBreakfast: Crispy Crust, Abilene (Texas), cost: 54, cuisines: \u201cDesserts, Bakery, Cafe, American, Seafood\u201d\nAttraction: The Grace Museum, Abilene (Texas); Frontier Texas!, Abilene (Texas);,\nLunch: Finger Licious, Abilene (Texas), cost: 35, cuisines: \u201cFast Food, Cafe, BBQ, Seafood\u201d\nDinner: LPK Waterfront, Abilene (Texas), cost: 61, cuisines: \u201cPizza, Italian, BBQ, Fast Food, Seafood\u201d\nAccommodation: Joyce and Donovan's, Room for One, Abilene (Texas), cost: 83, maximum occupancy: 2, house rules: No parties, minimum nights: 1\n\nNumber of people = 1\nTotal cost = 54 + 35 + 61 + 83 = 233\nAccommodation minimum nights: 2/1\n\nDays: 3,\nCurrent City: from Abilene (Texas) to Amarillo (Texas),\nTransportation: Self-driving, from Abilene to Amarillo, duration: 4 hours 10 mins, distance: 446 km, cost: 22\nBreakfast: -,\nAttraction: Cadillac Ranch, Amarillo (Texas); Amarillo Botanical Gardens, Amarillo (Texas);,\nLunch: The Cinnamon Kitchen, Amarillo (Texas), cost: 69, cuisines: \u201cDesserts, Tea, Pizza, Chinese, Seafood\u201d\nDinner: Komachi, Amarillo (Texas), cost: 71, cuisines: \u201cDesserts, Tea, Fast Food, Chinese, Mediterranean\u201d\nAccommodation: Harlem Humble Abode - 1 bedroom - Cute and Quaint, Amarillo (Texas), cost: 409, maximum occupancy: 3, house rules: No pets, minimum nights: 5\n\nNumber of people = 1\nTotal cost = 22 + 69 + 71 + 409 = 571\nAccommodation minimum nights: 1/5\n\nDays: 4,\nCurrent City: Amarillo (Texas),\nTransportation: -,\nBreakfast: Kanha North & South Indian Veg., Amarillo (Texas), cost: 34, cuisines: \u201cTea, Cafe, BBQ, Fast Food\u201d\nAttraction: Amarillo Zoo, Amarillo (Texas); Don Harrington Discovery Center, Amarillo (Texas);,\nLunch: Sigree Global Grill, Amarillo (Texas), cost: 35, cuisines: \u201cChinese, BBQ, Cafe, Desserts\u201d\nDinner: Anand Restaurant, Amarillo (Texas), cost: 53, cuisines: \u201cFast Food, Seafood, Desserts, Italian\u201d\nAccommodation: Harlem Humble Abode - 1 bedroom - Cute and Quaint, Amarillo (Texas), cost: 409, maximum occupancy: 3, house rules: No pets, minimum nights: 5\n\nNumber of people = 1\nTotal cost = 34 + 35 + 53 + 409 = 531\nAccommodation minimum nights: 2/5\n\nDays: 5,\nCurrent City: from Amarillo (Texas) to Lubbock (Texas),\nTransportation: Self-driving, from Amarillo to Lubbock, duration: 1 hour 47 mins, distance: 197 km, cost: 9\nBreakfast: -,\nAttraction: Buddy Holly Center, Lubbock (Texas); National Ranching Heritage Center, Lubbock (Texas);,\nLunch: Paris 6 Classique, Lubbock (Texas), cost: 91, cuisines: \u201cDesserts, Cafe, Pizza, Mexican, BBQ, Chinese\u201d\nDinner: 3 Squares Diner, Lubbock (Texas), cost: 73, cuisines: \u201cPizza, Indian, Fast Food\u201d\nAccommodation: Private bedroom in UWS Apartment, Lubbock (Texas), cost: 709, maximum occupancy: 2, house rules: No visitors & No pets, minimum nights: 2\n\nNumber of people = 1\nTotal cost = 9 + 91 + 73 + 709 = 882\nAccommodation minimum nights: 1/2\n\nDays: 6,\nCurrent City: Lubbock (Texas),\nTransportation: -,\nBreakfast: Assam Tea Corner, Lubbock (Texas), cost: 52, cuisines: \u201cDesserts, BBQ, Fast Food, American, Seafood\u201d\nAttraction: American Windmill Museum, Lubbock (Texas); Mackenzie Main City Park, Lubbock (Texas);,\nLunch: Sultanat, Lubbock (Texas), cost: 72, cuisines: \u201cChinese, Bakery, BBQ, Cafe\u201d\nDinner: Annapurna Bhandar, Lubbock (Texas), cost: 78, cuisines: \u201cFrench, Chinese, Desserts, Fast Food\u201d\nAccommodation: Private bedroom in UWS Apartment, Lubbock (Texas), cost: 709, maximum occupancy: 2, house rules: No visitors & No pets, minimum nights: 2\n\nNumber of people = 1\nTotal cost = 52 + 72 + 78 + 709 = 911\nAccommodation minimum nights: 2/2\n\nDays: 7,\nCurrent City: from Lubbock (Texas) to Augusta,\nTransportation: Self-driving, from Lubbock to Augusta, duration: 18 hours 17 mins, distance: 2,047 km, cost: 102\nBreakfast: -,\nAttraction: -,\nLunch: -,\nDinner: -,\nAccommodation: -\n\nNumber of people = 1\nTotal cost = 102\n\nTotal cost across all days = 185 + 233 + 571 + 531 + 882 + 911 + 102 = 3,415\n\nCuisines: The prompt specifies American and Chinese, and both of these cuisines have been represented in the restaurants chosen.", "gpt-4-1106-preview_direct_sole-planning_parsed_results": [{"day": 1, "current_city": "from Augusta to Abilene", "transportation": "Self-driving, from Augusta to Abilene, Duration: 15 hours 59 mins, Distance: 1,782 km", "breakfast": "-", "attraction": "The Grace Museum, Abilene", "lunch": "Thai Garden, Abilene", "dinner": "Biryani Express, Abilene", "accommodation": "Joyce and Donovan's, Room for One, Abilene"}, {"day": 2, "current_city": "Abilene", "transportation": "-", "breakfast": "Thai Garden, Abilene", "attraction": "Frontier Texas!, Abilene", "lunch": "Cakes Degree, Abilene", "dinner": "Crispy Crust, Abilene", "accommodation": "Joyce and Donovan's, Room for One, Abilene"}, {"day": 3, "current_city": "from Abilene to Amarillo", "transportation": "Self-driving, from Abilene to Amarillo, Duration: 4 hours 10 mins, Distance: 446 km", "breakfast": "Thai Garden, Abilene", "attraction": "Cadillac Ranch, Amarillo", "lunch": "Kanha North & South Indian Veg., Amarillo", "dinner": "The Cinnamon Kitchen, Amarillo", "accommodation": "Harlem Humble Abode - 1 bedroom - Cute and Quaint, Amarillo"}, {"day": 4, "current_city": "Amarillo", "transportation": "-", "breakfast": "Wood Box Cafe, Amarillo", "attraction": "Amarillo Botanical Gardens, Amarillo", "lunch": "Sigree Global Grill, Amarillo", "dinner": "Anand Restaurant, Amarillo", "accommodation": "Harlem Humble Abode - 1 bedroom - Cute and Quaint, Amarillo"}, {"day": 5, "current_city": "from Amarillo to Lubbock", "transportation": "Self-driving, from Amarillo to Lubbock, Duration: 1 hour 47 mins, Distance: 197 km", "breakfast": "Wood Box Cafe, Amarillo", "attraction": "Buddy Holly Center, Lubbock", "lunch": "Grand Barbeque Buffet Restaurant, Lubbock", "dinner": "Paris 6 Classique, Lubbock", "accommodation": "Private bedroom in UWS Apartment, Lubbock"}, {"day": 6, "current_city": "Lubbock", "transportation": "-", "breakfast": "Assam Tea Corner, Lubbock", "attraction": "National Ranching Heritage Center, Lubbock", "lunch": "Sultanat, Lubbock", "dinner": "The Town House Cafe, Lubbock", "accommodation": "Private bedroom in UWS Apartment, Lubbock"}, {"day": 7, "current_city": "from Lubbock to Augusta", "transportation": "Self-driving, from Lubbock to Augusta, Duration: 18 hours 17 mins, Distance: 2,047 km", "breakfast": "Assam Tea Corner, Lubbock", "attraction": "-", "lunch": "-", "dinner": "-", "accommodation": "-"}]}]