[{"gpt-4-1106-preview_direct_sole-planning_results": "Travel Plan:\n\nDays: 1,\nCurrent City: from Colorado Springs to Moline (Illinois),\nTransportation: Self-driving, from Colorado Springs to Moline, duration: 12 hours 49 mins, distance: 1,467 km, cost: 73\nBreakfast: -,\nAttraction: -,\nLunch: -,\nDinner: Royal Hotel, Moline (Illinois), cost: 74, cuisines: \u201cTea, Pizza, Mexican, Chinese, Seafood\u201d\nAccommodation: Sunny duplex near Central Park, Moline (Illinois), cost: 541, room type: Entire home/apt, house rules: No pets, minimum nights: 1, maximum occupancy: 5\n\nNumber of people = 1\nTotal cost = 73 + 74 + 541 = 688\nAccommodation minimum nights: 1/1\n\nDays: 2,\nCurrent City: Moline (Illinois),\nTransportation: -,\nBreakfast: Zoe, Moline (Illinois), cost: 15, cuisines: \u201cFrench, Cafe, Fast Food\u201d\nAttraction: John Deere Pavilion, Moline (Illinois); Celebration River Cruises, Moline (Illinois);,\nLunch: Mummy's Kitchen, Moline (Illinois), cost: 54, cuisines: \u201cDesserts, Indian, Mediterranean, BBQ\u201d\nDinner: ZASTY, Moline (Illinois), cost: 82, cuisines: \u201cPizza, Indian, BBQ, Cafe, American, Seafood\u201d\nAccommodation: Sunny duplex near Central Park, Moline (Illinois), cost: 541, room type: Entire home/apt, house rules: No pets, minimum nights: 1, maximum occupancy: 5\n\nNumber of people = 1\nTotal cost = 15 + 54 + 82 + 541 = 692\nAccommodation minimum nights: 2/1\n\nDays: 3,\nCurrent City: from Moline (Illinois) to Rockford (Illinois),\nTransportation: Self-driving, from Moline to Rockford, duration: 2 hours 1 min, distance: 194 km, cost: 9\nBreakfast: -,\nAttraction: Anderson Japanese Gardens, Rockford (Illinois); Discovery Center Museum, Rockford (Illinois);,\nLunch: Flying Mango, Rockford (Illinois), cost: 20, cuisines: \u201cAmerican, BBQ, Seafood\u201d\nDinner: Coco Bambu, Rockford (Illinois), cost: 72, cuisines: \u201cTea, French, Bakery, BBQ, Cafe\u201d\nAccommodation: Park Side Zen Home - Terrace & next to CentralPark, Rockford (Illinois), cost: 250, room type: Entire home/apt, house rules: No children under 10, minimum nights: 3, maximum occupancy: 3\n\nNumber of people = 1\nTotal cost = 9 + 20 + 72 + 250 = 351\nAccommodation minimum nights: 1/3\n\nDays: 4,\nCurrent City: Rockford (Illinois),\nTransportation: -,\nBreakfast: Moets Arabica, Rockford (Illinois), cost: 43, cuisines: \u201cTea, Bakery, Indian, Fast Food\u201d\nAttraction: Burpee Museum of Natural History, Rockford (Illinois); Sinnissippi Park, Rockford (Illinois);,\nLunch: Cafe Southall, Rockford (Illinois), cost: 56, cuisines: \u201cSeafood, Pizza, Cafe, Fast Food\u201d\nDinner: Aroma Rest O Bar, Rockford (Illinois), cost: 58, cuisines: \u201cBakery, Fast Food, Chinese, American, Seafood\u201d\nAccommodation: Park Side Zen Home - Terrace & next to CentralPark, Rockford (Illinois), cost: 250, room type: Entire home/apt, house rules: No children under 10, minimum nights: 3, maximum occupancy: 3\n\nNumber of people = 1\nTotal cost = 43 + 56 + 58 + 250 = 407\nAccommodation minimum nights: 2/3\n\nDays: 5,\nCurrent City: from Rockford (Illinois) to Colorado Springs,\nTransportation: Self-driving, from Rockford to Colorado Springs, duration: 14 hours 38 mins, distance: 1,653 km, cost: 82\nBreakfast: -,\nAttraction: -,\nLunch: -,\nDinner: -,\nAccommodation: -\n\nNumber of people = 1\nTotal cost = 82\n\nTotal cost across all days = 688 + 692 + 351 + 407 + 82 = 2,220\n\nUnfortunately, the total cost exceeds the specified budget of $1,900. To adjust the plan to fit the budget, we can consider the following changes:\n\n- Opt for a less expensive accommodation in Moline and Rockford.\n- Reduce dining costs by choosing more budget-friendly restaurants or meals.\n\nRevised Travel Plan with Budget Adjustments:\n\nDays: 1,\nAccommodation: Private Room Available in 2BedApt, Moline (Illinois), cost: 952, room type: Private room, house rules: No smoking & No parties & No pets, minimum nights: 1, maximum occupancy: 2\n\nDays: 2,\nAccommodation: Private Room Available in 2BedApt, Moline (Illinois), cost: 952, room type: Private room, house rules: No smoking & No parties & No pets, minimum nights: 1, maximum occupancy: 2\n\nDays: 3,\nAccommodation: Private Room in a two bedroom apt., Rockford (Illinois), cost: 210, room type: Private room, house rules: No visitors & No smoking, minimum nights: 1, maximum occupancy: 2\n\nDays: 4,\nAccommodation: Private Room in a two bedroom apt., Rockford (Illinois), cost: 210, room type: Private room, house rules: No visitors & No smoking, minimum nights: 1, maximum occupancy: 2\n\nRevised Total cost across all days = 73 + 74 + 952 + 15 + 54 + 82 + 952 + 9 + 20 + 72 + 210 + 43 + 56 + 58 + 210 + 82 = 2,002\n\nThe revised plan still slightly exceeds the budget. Further adjustments could include:\n\n- Choosing the least expensive meals or skipping some meals.\n- Exploring free attractions or reducing the number of paid attractions visited.\n\nPlease note that the accommodation costs are for one night, but the minimum stay requirements may necessitate booking for more nights, which could affect the total cost. Additionally, the cost of self-driving includes only the estimated fuel cost and does not account for car rental fees, if applicable.", "gpt-4-1106-preview_direct_sole-planning_parsed_results": [{"day": 1, "current_city": "from Colorado Springs to Moline", "transportation": "Self-driving, from Colorado Springs to Moline, Duration: 12 hours 49 mins, Distance: 1,467 km", "breakfast": "-", "attraction": "Sylvan Island, Moline;", "lunch": "-", "dinner": "Royal Hotel, Moline", "accommodation": "Beautiful Sunlit Retreat in Manhattan, Moline"}, {"day": 2, "current_city": "Moline", "transportation": "-", "breakfast": "Lovecrumbs Bakery, Moline", "attraction": "John Deere Pavilion, Moline;", "lunch": "Zoe, Moline", "dinner": "ZASTY, Moline", "accommodation": "Beautiful Sunlit Retreat in Manhattan, Moline"}, {"day": 3, "current_city": "from Moline to Rockford", "transportation": "Self-driving, from Moline to Rockford, Duration: 2 hours 1 min, Distance: 194 km", "breakfast": "Hucka, Moline", "attraction": "Anderson Japanese Gardens, Rockford;", "lunch": "Flying Mango, Rockford", "dinner": "Coco Bambu, Rockford", "accommodation": "Park Side Zen Home - Terrace & next to CentralPark, Rockford"}, {"day": 4, "current_city": "Rockford", "transportation": "-", "breakfast": "Nutri Punch, Rockford", "attraction": "Discovery Center Museum, Rockford;", "lunch": "Cafe Southall, Rockford", "dinner": "Eggspectation - Jaypee Vasant Continental, Rockford", "accommodation": "Park Side Zen Home - Terrace & next to CentralPark, Rockford"}, {"day": 5, "current_city": "from Rockford to Colorado Springs", "transportation": "Self-driving, from Rockford to Colorado Springs, Duration: 14 hours 38 mins, Distance: 1,653 km", "breakfast": "-", "attraction": "-", "lunch": "-", "dinner": "-", "accommodation": "-"}]}]