[{"gpt-4-1106-preview_direct_sole-planning_results": "Travel Plan:\n\nDays: 1,\nCurrent City: from Los Angeles to Colorado Springs (Colorado),\nTransportation: Flight Number: F3822873, from Los Angeles to Colorado Springs, Departure Time: 18:45, Arrival Time: 22:03, cost: 411\nBreakfast: -,\nAttraction: -,\nLunch: -,\nDinner: Raglan Road Irish Pub and Restaurant, Colorado Springs (Colorado), cost: 97, cuisines: \u201cChinese, Bakery, Pizza, Mediterranean\u201d\nAccommodation: Large sunny park slope apartment, Colorado Springs (Colorado), cost: 82, maximum occupancy: 3, house rules: No smoking & No parties & No pets, minimum nights: 1\n\nNumber of people = 1\nTotal cost = 411 + 97 + 82 = 590\nAccommodation minimum nights: 1/1\n\nDays: 2,\nCurrent City: Colorado Springs (Colorado),\nTransportation: -,\nBreakfast: Club Tokyo - Best Western Skycity Hotel, Colorado Springs (Colorado), cost: 64, cuisines: \u201cTea, Bakery, Mediterranean, Fast Food\u201d\nAttraction: Garden of the Gods, Colorado Springs (Colorado); The Broadmoor Seven Falls, Colorado Springs (Colorado);,\nLunch: Deepak Rasoi, Colorado Springs (Colorado), cost: 60, cuisines: \u201cChinese, Pizza, Seafood\u201d\nDinner: GoGourmet, Colorado Springs (Colorado), cost: 66, cuisines: \u201cDesserts, Bakery, Fast Food, Indian, Seafood\u201d\nAccommodation: Large sunny park slope apartment, Colorado Springs (Colorado), cost: 82, maximum occupancy: 3, house rules: No smoking & No parties & No pets, minimum nights: 1\n\nNumber of people = 1\nTotal cost = 64 + 60 + 66 + 82 = 272\nAccommodation minimum nights: 2/1\n\nDays: 3,\nCurrent City: from Colorado Springs (Colorado) to Grand Junction (Colorado),\nTransportation: Self-driving, from Colorado Springs to Grand Junction, duration: 4 hours 48 mins, distance: 500 km, cost: 25\nBreakfast: -,\nAttraction: Museum of the West, Museums of Western Colorado, Grand Junction (Colorado); Western Colorado Botanical Gardens, Grand Junction (Colorado);,\nLunch: Austin's BBQ and Oyster Bar, Grand Junction (Colorado), cost: 15, cuisines: \u201cTea, Bakery, Fast Food, Indian, Seafood\u201d\nDinner: 2 Dog, Grand Junction (Colorado), cost: 29, cuisines: \u201cDesserts, BBQ, Fast Food, Cafe, American\u201d\nAccommodation: Lovely 1 BD on the Upper West Side, Grand Junction (Colorado), cost: 854, maximum occupancy: 3, house rules: No children under 10, minimum nights: 1\n\nNumber of people = 1\nTotal cost = 25 + 15 + 29 + 854 = 923\nAccommodation minimum nights: 1/1\n\nDays: 4,\nCurrent City: Grand Junction (Colorado),\nTransportation: -,\nBreakfast: Shanghai Bar & Lounge - The Bristol Hotel, Grand Junction (Colorado), cost: 31, cuisines: \u201cCafe, Pizza\u201d\nAttraction: Canyon View Park, Grand Junction (Colorado); James M. Robb - Colorado River State Park, Grand Junction (Colorado);,\nLunch: Pind Balluchi, Grand Junction (Colorado), cost: 17, cuisines: \u201cFast Food, Chinese, Seafood\u201d\nDinner: Cocoa Tree, Grand Junction (Colorado), cost: 68, cuisines: \u201cTea, Chinese, Cafe, Fast Food\u201d\nAccommodation: Lovely 1 BD on the Upper West Side, Grand Junction (Colorado), cost: 854, maximum occupancy: 3, house rules: No children under 10, minimum nights: 1\n\nNumber of people = 1\nTotal cost = 31 + 17 + 68 + 854 = 970\nAccommodation minimum nights: 2/1\n\nDays: 5,\nCurrent City: from Grand Junction (Colorado) to Los Angeles,\nTransportation: Self-driving, from Grand Junction to Los Angeles, duration: 11 hours 19 mins, distance: 1,248 km, cost: 62\nBreakfast: -,\nAttraction: -,\nLunch: -,\nDinner: -,\nAccommodation: -\n\nNumber of people = 1\nTotal cost = 62\n\nTotal cost across all days = 590 + 272 + 923 + 970 + 62 = 2,817\n\nCuisines: The prompt specifies no particular cuisine preferences, and a variety of cuisines have been included in the restaurants chosen.\n\nRemaining Budget: $4,700 - $2,817 = $1,883\n\nPlease note that the costs for attractions have not been included as they were not provided in the reference information. If there are entrance fees or other costs associated with the attractions, they would need to be factored into the remaining budget.", "gpt-4-1106-preview_direct_sole-planning_parsed_results": [{"day": 1, "current_city": "from Los Angeles to Colorado Springs", "transportation": "Flight Number: F3822873, from Los Angeles to Colorado Springs, Departure Time: 18:45, Arrival Time: 22:03", "breakfast": "-", "attraction": "-", "lunch": "-", "dinner": "-", "accommodation": "Large sunny park slope apartment, Colorado Springs"}, {"day": 2, "current_city": "Colorado Springs", "transportation": "-", "breakfast": "Raglan Road Irish Pub and Restaurant, Colorado Springs", "attraction": "Garden of the Gods, Colorado Springs;", "lunch": "New Spice World, Colorado Springs", "dinner": "Mamu's Infusion, Colorado Springs", "accommodation": "Large sunny park slope apartment, Colorado Springs"}, {"day": 3, "current_city": "from Colorado Springs to Grand Junction", "transportation": "Self-driving, from Colorado Springs to Grand Junction", "breakfast": "Deepak Rasoi, Colorado Springs", "attraction": "The Broadmoor Seven Falls, Colorado Springs;", "lunch": "Derby, Colorado Springs", "dinner": "-", "accommodation": "Lovely 1 BD on the Upper West Side, Grand Junction"}, {"day": 4, "current_city": "Grand Junction", "transportation": "-", "breakfast": "Austin's BBQ and Oyster Bar, Grand Junction", "attraction": "Museum of the West, Museums of Western Colorado, Grand Junction;", "lunch": "2 Dog, Grand Junction", "dinner": "Punjab Da Pind, Grand Junction", "accommodation": "Lovely 1 BD on the Upper West Side, Grand Junction"}, {"day": 5, "current_city": "from Grand Junction to Los Angeles", "transportation": "Self-driving, from Grand Junction to Los Angeles", "breakfast": "Thakur Bakers, Grand Junction", "attraction": "-", "lunch": "-", "dinner": "-", "accommodation": "-"}]}]