[{"gpt-4-1106-preview_direct_sole-planning_results": "Travel Plan:\n\nDays: 1,\nCurrent City: from Fayetteville to White Plains (New York),\nTransportation: Self-driving, from Fayetteville to White Plains, duration: 8 hours 46 mins, distance: 923 km, cost: 46\nBreakfast: -,\nAttraction: -,\nLunch: -,\nDinner: El Kiosco Mexican Restaurant, White Plains (New York), cost: 65, cuisines: \u201cTea, Pizza\u201d\nAccommodation: Large Opulent Studio Apartment Near Prospect Park, White Plains (New York), cost: 465, maximum occupancy: 3, house rules: No children under 10, minimum nights: 4\n\nNumber of people = 8\nTotal cost = 46 * 8 + 65 * 8 + 465 * 3 = 2,088\nAccommodation minimum nights: 1/4\n\nDays: 2,\nCurrent City: White Plains (New York),\nTransportation: -,\nBreakfast: Kinoshita, White Plains (New York), cost: 42, cuisines: \u201cTea, Pizza, Fast Food, American, Seafood\u201d\nAttraction: J Harvey Turnure Memorial Park, White Plains (New York);\nLunch: El Cazador, White Plains (New York), cost: 90, cuisines: \u201cMexican, Pizza, BBQ\u201d\nDinner: Mughals Rasoi, White Plains (New York), cost: 92, cuisines: \u201cTea, Pizza, Fast Food, Cafe, Mediterranean\u201d\nAccommodation: Large Opulent Studio Apartment Near Prospect Park, White Plains (New York), cost: 465, maximum occupancy: 3, house rules: No children under 10, minimum nights: 4\n\nNumber of people = 8\nTotal cost = (42 + 90 + 92) * 8 + 465 * 3 = 2,733\nAccommodation minimum nights: 2/4\n\nDays: 3,\nCurrent City: from White Plains (New York) to New York,\nTransportation: Self-driving, from White Plains to New York, duration: 54 mins, distance: 57.3 km, cost: 2\nBreakfast: -,\nAttraction: Central Park, New York; Times Square, New York;\nLunch: Seasons 52 Fresh Grill, New York, cost: 30, cuisines: \u201cSeafood, Indian, Desserts, Italian\u201d\nDinner: Lord of the Drinks Forum, New York, cost: 71, cuisines: \u201cCafe, Bakery, BBQ, Chinese, Indian\u201d\nAccommodation: Beautiful and big 1BR sublet close by Central Park, New York, cost: 983, maximum occupancy: 2, house rules: No parties & No children under 10, minimum nights: 5\n\nNumber of people = 8\nTotal cost = 2 * 8 + (30 + 71) * 8 + 983 * 4 = 2,384\nAccommodation minimum nights: 1/5\n\nDays: 4,\nCurrent City: New York,\nTransportation: -,\nBreakfast: Gurgaon Hights, New York, cost: 46, cuisines: \u201cCafe, American, Indian, Fast Food\u201d\nAttraction: Empire State Building, New York; The High Line, New York;\nLunch: Goosebumps, New York, cost: 94, cuisines: \u201cChinese, Pizza, Bakery\u201d\nDinner: Shree Rathnam, New York, cost: 91, cuisines: \u201cTea, Bakery, Fast Food, American, Seafood\u201d\nAccommodation: Beautiful and big 1BR sublet close by Central Park, New York, cost: 983, maximum occupancy: 2, house rules: No parties & No children under 10, minimum nights: 5\n\nNumber of people = 8\nTotal cost = (46 + 94 + 91) * 8 + 983 * 4 = 3,032\nAccommodation minimum nights: 2/5\n\nDays: 5,\nCurrent City: from New York to Fayetteville,\nTransportation: Flight Number: F4058074, from New York to Fayetteville, Departure Time: 20:10, Arrival Time: 22:43, cost: 450\nBreakfast: -,\nAttraction: -,\nLunch: -,\nDinner: -,\nAccommodation: -\n\nNumber of people = 8\nTotal cost = 450 * 8 = 3,600\n\nTotal cost across all days = 2,088 + 2,733 + 2,384 + 3,032 + 3,600 = 13,837\n\nUnfortunately, the total cost of $13,837 exceeds the specified budget of $6,900. Adjustments must be made to the travel plan to fit within the budget. Since the accommodations are the most expensive part, consider finding cheaper options or reducing the number of rooms needed by choosing accommodations with a higher maximum occupancy. Additionally, the flight back to Fayetteville is quite costly, so consider an alternative mode of transportation if available within the constraints.", "gpt-4-1106-preview_direct_sole-planning_parsed_results": [{"day": 1, "current_city": "from Fayetteville to White Plains", "transportation": "Self-driving, from Fayetteville to White Plains, Duration: 8 hours 46 mins, Distance: 923 km", "breakfast": "-", "attraction": "J Harvey Turnure Memorial Park, White Plains;", "lunch": "El Kiosco Mexican Restaurant, White Plains", "dinner": "Kinoshita, White Plains", "accommodation": "Private room in Historic Queens NY, White Plains"}, {"day": 2, "current_city": "White Plains", "transportation": "-", "breakfast": "Kinoshita, White Plains", "attraction": "Saxon Woods Park, White Plains;", "lunch": "El Kiosco Mexican Restaurant, White Plains", "dinner": "Kinoshita, White Plains", "accommodation": "Private room in Historic Queens NY, White Plains"}, {"day": 3, "current_city": "from White Plains to New York", "transportation": "Self-driving, from White Plains to New York, Duration: 54 mins, Distance: 57.3 km", "breakfast": "Kinoshita, White Plains", "attraction": "Central Park, New York;", "lunch": "Gurgaon Hights, New York", "dinner": "G Dot, New York", "accommodation": "Versatile private room in Harlem/Hamilton Heights!, New York"}, {"day": 4, "current_city": "New York", "transportation": "-", "breakfast": "Seasons 52 Fresh Grill, New York", "attraction": "Statue of Liberty, New York;", "lunch": "Gurgaon Hights, New York", "dinner": "G Dot, New York", "accommodation": "Versatile private room in Harlem/Hamilton Heights!, New York"}, {"day": 5, "current_city": "from New York to Fayetteville", "transportation": "Flight Number: F4058074, from New York to Fayetteville, Departure Time: 20:10, Arrival Time: 22:43", "breakfast": "Seasons 52 Fresh Grill, New York", "attraction": "Empire State Building, New York;", "lunch": "Gurgaon Hights, New York", "dinner": "-", "accommodation": "-"}]}]