[{"gpt-4-1106-preview_direct_sole-planning_results": "Travel Plan:\n\nNumber of people = 2 (plus children under 10 years old)\n\nDay 1: Chattanooga to Atlanta (Georgia)\n- Transportation: Self-driving, from Chattanooga to Atlanta, duration: 1 hour 48 mins, distance: 190 km, cost: $9\n- Breakfast: -\n- Attraction: Georgia Aquarium, Atlanta, GA; World of Coca-Cola, Atlanta, GA\n- Lunch: Saffron, Atlanta (Georgia), cost: $39, cuisines: \u201cTea, Cafe, Fast Food, Seafood\u201d\n- Dinner: Adda, Atlanta (Georgia), cost: $22, cuisines: \u201cTea, Mexican, Bakery\u201d\n- Accommodation: Bright, Modern, Clean, Spacious, Brooklyn Home, Atlanta (Georgia), cost: $1034, room type: Entire home/apt, house rules: No children under 10, minimum nights: 3, maximum occupancy: 4\n\nTotal cost for Day 1: $9 (transportation) + $39 (lunch) * 2 + $22 (dinner) * 2 + $1034 (accommodation) = $1165\nAccommodation minimum nights: 1/3\n\nDay 2: Atlanta (Georgia)\n- Transportation: -\n- Breakfast: Baba Au Rhum, Atlanta (Georgia), cost: $27, cuisines: \u201cDesserts, Pizza, Mexican, BBQ, Fast Food\u201d\n- Attraction: Martin Luther King, Jr. National Historical Park, Atlanta, GA; Piedmont Park, Atlanta, GA\n- Lunch: Asian Bistro, Atlanta (Georgia), cost: $27, cuisines: \u201cTea, Bakery, Seafood\u201d\n- Dinner: Chef Style, Atlanta (Georgia), cost: $59, cuisines: \u201cPizza, American, Desserts, Seafood\u201d\n- Accommodation: Bright, Modern, Clean, Spacious, Brooklyn Home, Atlanta (Georgia), cost: $1034, room type: Entire home/apt, house rules: No children under 10, minimum nights: 3, maximum occupancy: 4\n\nTotal cost for Day 2: $27 (breakfast) * 2 + $27 (lunch) * 2 + $59 (dinner) * 2 + $1034 (accommodation) = $1231\nAccommodation minimum nights: 2/3\n\nDay 3: Atlanta to Decatur (Georgia)\n- Transportation: Taxi, from Atlanta to Decatur, duration: 18 mins, distance: 10.0 km, cost: $10\n- Breakfast: -\n- Attraction: DeKalb History Center Museum, Decatur, GA; Decatur Square, Decatur, GA\n- Lunch: Madhuban Restaurant - Welcome Hotel Rama International, Decatur (Georgia), cost: $47, cuisines: \u201cPizza, Bakery, Seafood\u201d\n- Dinner: Tandoori Hut, Decatur (Georgia), cost: $82, cuisines: \u201cPizza, American, Indian, Fast Food\u201d\n- Accommodation: The Heart of the Lower East Side!, Decatur (Georgia), cost: $587, room type: Entire home/apt, house rules: No children under 10, minimum nights: 2, maximum occupancy: 2\n\nTotal cost for Day 3: $10 (transportation) + $47 (lunch) * 2 + $82 (dinner) * 2 + $587 (accommodation) = $855\nAccommodation minimum nights: 1/2\n\nDay 4: Decatur (Georgia)\n- Transportation: -\n- Breakfast: Cafe Coffee Day, Decatur (Georgia), cost: $46, cuisines: \u201cTea, Cafe, BBQ, Mediterranean\u201d\n- Attraction: Glenlake Park, Decatur, GA; Clyde Shepherd Nature Preserve, Decatur, GA\n- Lunch: Joey's Pizza, Decatur (Georgia), cost: $69, cuisines: \u201cTea, Pizza, Bakery, Chinese, Seafood\u201d\n- Dinner: Dawat-E-Chaman, Decatur (Georgia), cost: $42, cuisines: \u201cChinese, BBQ, Fast Food, Cafe, Mediterranean\u201d\n- Accommodation: The Heart of the Lower East Side!, Decatur (Georgia), cost: $587, room type: Entire home/apt, house rules: No children under 10, minimum nights: 2, maximum occupancy: 2\n\nTotal cost for Day 4: $46 (breakfast) * 2 + $69 (lunch) * 2 + $42 (dinner) * 2 + $587 (accommodation) = $901\nAccommodation minimum nights: 2/2\n\nDay 5: Decatur to Augusta (Georgia)\n- Transportation: Taxi, from Decatur to Augusta, duration: 2 hours 17 mins, distance: 228 km, cost: $228\n- Breakfast: -\n- Attraction: Augusta Riverwalk, Augusta, GA; Augusta Museum of History, Augusta, GA\n- Lunch: B Merrell's, Augusta (Georgia), cost: $74, cuisines: \u201cTea, Pizza, Desserts, Fast Food\u201d\n- Dinner: Vinny Vanucchi's, Augusta (Georgia), cost: $45, cuisines: \u201cDesserts, Fast Food, Chinese, Indian, Seafood\u201d\n- Accommodation: Planta Baja Studio, Augusta (Georgia), cost: $637, room type: Entire home/apt, house rules: No smoking, minimum nights: 1, maximum occupancy: 4\n\nTotal cost for Day 5: $228 (transportation) + $74 (lunch) * 2 + $45 (dinner) * 2 + $637 (accommodation) = $1103\nAccommodation minimum nights: 1/1\n\nDay 6: Augusta (Georgia)\n- Transportation: -\n- Breakfast: Fish Tales Lakeside Grille, Augusta (Georgia), cost: $37, cuisines: \u201cTea, Cafe, Bakery, Desserts\u201d\n- Attraction: Morris Museum of Art, Augusta, GA; Meadow Garden, Augusta, GA\n- Lunch: The Charcoal Chimney, Augusta (Georgia), cost: $86, cuisines: \u201cTea, Fast Food, BBQ, Italian\u201d\n- Dinner: Nikhil Food Point, Augusta (Georgia), cost: $87, cuisines: \u201cTea, Mexican, Fast Food, American, Seafood\u201d\n- Accommodation: Planta Baja Studio, Augusta (Georgia), cost: $637, room type: Entire home/apt, house rules: No smoking, minimum nights: 1, maximum occupancy: 4\n\nTotal cost for Day 6: $37 (breakfast) * 2 + $86 (lunch) * 2 + $87 (dinner) * 2 + $637 (accommodation) = $1060\nAccommodation minimum nights: 1/1\n\nDay 7: Augusta to Chattanooga\n- Transportation: Self-driving, from Augusta to Chattanooga, duration: 3 hours 58 mins, distance: 424 km, cost: $21\n- Breakfast: -\n- Attraction: -\n- Lunch: -\n- Dinner: -\n- Accommodation: -\n\nTotal cost for Day 7: $21 (transportation)\n\nTotal cost across all days = $1165 + $1231 + $855 + $901 + $1103 + $1060 + $21 = $6336\n\nRemaining budget: $6800 - $6336 = $464\n\nCuisines: The plan includes a variety of cuisines, with a focus on American, Italian, and Seafood, which are suitable for a family with children.\n\nPlease note that the accommodation choices are based on the requirement for entire rooms and child-friendly options. The costs are calculated for two adults, and children's costs are not explicitly mentioned in the provided data. If there are additional costs for children, please ensure to account for them within the remaining budget.", "gpt-4-1106-preview_direct_sole-planning_parsed_results": [{"day": 1, "current_city": "from Chattanooga to Atlanta", "transportation": "Self-driving, from Chattanooga to Atlanta, Duration: 1 hour 48 mins, Distance: 190 km", "breakfast": "-", "attraction": "Atlanta Botanical Garden, Atlanta", "lunch": "Adda, Atlanta", "dinner": "Ahata, Atlanta", "accommodation": "Bright, Modern, Clean, Spacious, Brooklyn Home, Atlanta"}, {"day": 2, "current_city": "Atlanta", "transportation": "-", "breakfast": "Saffron, Atlanta", "attraction": "Georgia Aquarium, Atlanta", "lunch": "Baba Au Rhum, Atlanta", "dinner": "Asian Bistro, Atlanta", "accommodation": "Bright, Modern, Clean, Spacious, Brooklyn Home, Atlanta"}, {"day": 3, "current_city": "Atlanta", "transportation": "-", "breakfast": "Chef Style, Atlanta", "attraction": "World of Coca-Cola, Atlanta", "lunch": "Pizza Central, Atlanta", "dinner": "Daawat-e-Kashmir, Atlanta", "accommodation": "Bright, Modern, Clean, Spacious, Brooklyn Home, Atlanta"}, {"day": 4, "current_city": "from Atlanta to Decatur", "transportation": "Taxi, from Atlanta to Decatur, Duration: 18 mins, Distance: 10.0 km", "breakfast": "Shri Ram Restaurant, Atlanta", "attraction": "DeKalb History Center Museum, Decatur", "lunch": "Madhuban Restaurant - Welcome Hotel Rama International, Decatur", "dinner": "Tandoori Hut, Decatur", "accommodation": "The Heart of the Lower East Side!, Decatur"}, {"day": 5, "current_city": "Decatur", "transportation": "-", "breakfast": "Cafe Coffee Day, Decatur", "attraction": "Glenlake Park, Decatur", "lunch": "Joey's Pizza, Decatur", "dinner": "Dawat-E-Chaman, Decatur", "accommodation": "The Heart of the Lower East Side!, Decatur"}, {"day": 6, "current_city": "from Decatur to Augusta", "transportation": "Self-driving, from Decatur to Augusta, Duration: 2 hours 17 mins, Distance: 228 km", "breakfast": "Hwealthcafe, Decatur", "attraction": "Augusta Riverwalk, Augusta", "lunch": "B Merrell's, Augusta", "dinner": "Vinny Vanucchi's, Augusta", "accommodation": "Planta Baja Studio, Augusta"}, {"day": 7, "current_city": "from Augusta to Chattanooga", "transportation": "Self-driving, from Augusta to Chattanooga, Duration: 3 hours 58 mins, Distance: 424 km", "breakfast": "Fish Tales Lakeside Grille, Augusta", "attraction": "Augusta Museum of History, Augusta", "lunch": "The Charcoal Chimney, Augusta", "dinner": "-", "accommodation": "-"}]}]