[{"gpt-4-1106-preview_direct_sole-planning_results": "Travel Plan:\n\nDays: 1\nCurrent City: from Chicago to Albany\nTransportation: Flight F3983350, from Chicago to Albany, departure: 14:29, arrival: 17:03, duration: 1 hour 34 minutes, distance: 717 km, cost: $160 per person\nBreakfast: -\nAttraction: -\nLunch: -\nDinner: Kaiser, Albany, cost: $96, cuisines: Cafe, Pizza, American\nAccommodation: Mid Town East Side Apartment, Albany, cost: $737, room type: Entire home/apt, house rules: No pets & No children under 10, minimum nights: 1, maximum occupancy: 6\n\nNumber of people: 2\nTotal cost: $160 * 2 + $96 * 2 + $737 = $1,249\nAccommodation minimum nights: 1/1\n\nDays: 2\nCurrent City: Albany\nTransportation: -\nBreakfast: Cafe Coffee Day, Albany, cost: $82, cuisines: Mexican, Fast Food, Cafe, American, Seafood\nAttraction: New York State Museum, Albany; Washington Park Lake House, Albany\nLunch: Jahangeer Foods, Albany, cost: $59, cuisines: Tea, Pizza, Italian, BBQ, Cafe\nDinner: Echoes Satyaniketan, Albany, cost: $91, cuisines: Chinese, Bakery, Cafe\nAccommodation: Mid Town East Side Apartment, Albany, cost: $737, room type: Entire home/apt, house rules: No pets & No children under 10, minimum nights: 1, maximum occupancy: 6\n\nNumber of people: 2\nTotal cost: $82 + $59 + $91 * 2 + $737 = $1,060\nAccommodation minimum nights: 1/1\n\nDays: 3\nCurrent City: from Albany to Chicago\nTransportation: Flight F4008387, from Albany to Chicago, departure: 05:05, arrival: 06:11, duration: 2 hours 6 minutes, distance: 717 km, cost: $181 per person\nBreakfast: -\nAttraction: -\nLunch: -\nDinner: -\nAccommodation: -\n\nNumber of people: 2\nTotal cost: $181 * 2 = $362\n\nTotal cost across all days: $1,249 + $1,060 + $362 = $2,671\n\nUnfortunately, the total cost exceeds the specified budget of $2,300. Adjustments are needed to meet the budget constraint. Let's choose a less expensive accommodation option for the first two nights:\n\nAdjusted Accommodation for Days 1 & 2:\nAccommodation: Huge room 25 min to manhattan. L,M,J,Z train., Albany, cost: $63, room type: Private room, house rules: No visitors, minimum nights: 2, maximum occupancy: 2\n\nAdjusted Total cost for Days 1 & 2: $160 * 2 + $96 * 2 + $63 = $575\nAdjusted Total cost for Day 3 remains the same: $362\n\nAdjusted Total cost across all days: $575 + $575 + $362 = $1,512\n\nCuisines: Open to any suggestions.\nAccommodation minimum nights: 2/2\n\nThe adjusted travel plan now meets the budget constraint of $2,300.", "gpt-4-1106-preview_direct_sole-planning_parsed_results": [{"day": 1, "current_city": "from Chicago to Albany", "transportation": "Flight Number: F3983350, from Chicago to Albany, Departure Time: 14:29, Arrival Time: 17:03", "breakfast": "-", "attraction": "-", "lunch": "-", "dinner": "Kaiser, Albany", "accommodation": "Huge room 25 min to manhattan. L,M,J,Z train., Albany"}, {"day": 2, "current_city": "Albany", "transportation": "-", "breakfast": "Cafe Coffee Day, Albany", "attraction": "New York State Museum, Albany;Washington Park Lake House, Albany;", "lunch": "Jahangeer Foods, Albany", "dinner": "Echoes Satyaniketan, Albany", "accommodation": "Huge room 25 min to manhattan. L,M,J,Z train., Albany"}, {"day": 3, "current_city": "from Albany to Chicago", "transportation": "Flight Number: F4008387, from Albany to Chicago, Departure Time: 05:05, Arrival Time: 06:11", "breakfast": "-", "attraction": "-", "lunch": "-", "dinner": "-", "accommodation": "-"}]}]