[{"gpt-4-1106-preview_direct_sole-planning_results": "Travel Plan:\n\nDays: 1\nCurrent City: from Seattle to San Francisco\nTransportation: Flight F3747875, from Seattle to San Francisco, duration: 1 hour 55 minutes, cost: $326\nBreakfast: -\nAttraction: -\nLunch: -\nDinner: Tokyo Sushi, San Francisco, cost: $18, cuisines: Cafe, Pizza, BBQ\nAccommodation: Room in Down town Brooklyn Parkslop (Private room), San Francisco, cost: $79, house rules: No visitors, minimum nights: 1\n\nNumber of people: 1\nTotal cost: $326 + $18 + $79 = $423\nAccommodation minimum nights: 1/1\n\nDays: 2\nCurrent City: San Francisco\nTransportation: -\nBreakfast: Coffee & Chai Co., San Francisco, cost: $10, cuisines: Tea, Mexican, BBQ, Cafe, Seafood\nAttraction: Golden Gate Bridge, San Francisco; Golden Gate Park, San Francisco; PIER 39, San Francisco\nLunch: Sudarshan, San Francisco, cost: $53, cuisines: Fast Food, Bakery, Mediterranean, Italian\nDinner: Bonne Bouche, San Francisco, cost: $21, cuisines: Tea, Chinese, American, Cafe\nAccommodation: Room in Down town Brooklyn Parkslop (Private room), San Francisco, cost: $79, house rules: No visitors, minimum nights: 1\n\nNumber of people: 1\nTotal cost: $10 + $53 + $21 + $79 = $163\nAccommodation minimum nights: 1/1\n\nDays: 3\nCurrent City: from San Francisco to Seattle\nTransportation: Flight F3749172, from San Francisco to Seattle, duration: 1 hour 55 minutes, cost: $148\nBreakfast: Uncle Da Dhabha, San Francisco, cost: $60, cuisines: Seafood, Bakery, Fast Food\nAttraction: -\nLunch: -\nDinner: -\nAccommodation: -\n\nNumber of people: 1\nTotal cost: $148 + $60 = $208\n\nTotal cost across all days: $423 + $163 + $208 = $794\nCuisines: Various cuisines including Cafe, Pizza, BBQ, Tea, Mexican, Fast Food, Bakery, Mediterranean, Italian, Chinese, American, Seafood\n\nNote: The travel plan adheres to the budget of $900, includes a variety of cuisines, and ensures that the accommodation is private as requested. Attractions are planned for the full day in San Francisco, and the transportation chosen is flights to save time. The plan also ensures that the same restaurant is not repeated for any meal.", "gpt-4-1106-preview_direct_sole-planning_parsed_results": [{"day": 1, "current_city": "from Seattle to San Francisco", "transportation": "Flight Number: F3747875, from Seattle to San Francisco, Departure Time: -, Arrival Time: -", "breakfast": "-", "attraction": "-", "lunch": "-", "dinner": "Tokyo Sushi, San Francisco", "accommodation": "Room in Down town Brooklyn Parkslop (Private room), San Francisco"}, {"day": 2, "current_city": "San Francisco", "transportation": "-", "breakfast": "Coffee & Chai Co., San Francisco", "attraction": "Golden Gate Bridge, San Francisco;Golden Gate Park, San Francisco;PIER 39, San Francisco;", "lunch": "Sudarshan, San Francisco", "dinner": "Bonne Bouche, San Francisco", "accommodation": "Room in Down town Brooklyn Parkslop (Private room), San Francisco"}, {"day": 3, "current_city": "from San Francisco to Seattle", "transportation": "Flight Number: F3749172, from San Francisco to Seattle, Departure Time: -, Arrival Time: -", "breakfast": "Uncle Da Dhabha, San Francisco", "attraction": "-", "lunch": "-", "dinner": "-", "accommodation": "-"}]}]