[{"gpt-4-1106-preview_direct_sole-planning_results": "Travel Plan:\n\nDays: 1\nCurrent City: from Milwaukee to New York\nTransportation: Flight F3649645, from Milwaukee to New York, duration: 2 hours 32 minutes, cost: 180 per person\nBreakfast: -\nAttraction: -\nLunch: -\nDinner: Seasons 52 Fresh Grill, New York, cost: 30, cuisines: Seafood, Indian, Desserts, Italian\nAccommodation: Beautiful and big 1BR sublet close by Central Park, New York, cost: 983, room type: Private room, house rules: No parties & No children under 10, minimum nights: 5, maximum occupancy: 2\n\nNumber of people: 2\nTotal cost: 180 * 2 + 30 * 2 + 983 = 1,403\nAccommodation minimum nights: 1/5\n\nDays: 2\nCurrent City: New York\nTransportation: -\nBreakfast: Gurgaon Hights, New York, cost: 46, cuisines: Cafe, American, Indian, Fast Food\nAttraction: Central Park, New York; Statue of Liberty, New York; Empire State Building, New York\nLunch: Lord of the Drinks Forum, New York, cost: 71, cuisines: Cafe, Bakery, BBQ, Chinese, Indian\nDinner: QD's Restaurant, New York, cost: 93, cuisines: Tea, Desserts, Indian, BBQ\nAccommodation: Beautiful and big 1BR sublet close by Central Park, New York, cost: 983, room type: Private room, house rules: No parties & No children under 10, minimum nights: 5, maximum occupancy: 2\n\nNumber of people: 2\nTotal cost: 46 + 71 + 93 * 2 + 983 = 1,386\nAccommodation minimum nights: 2/5\n\nDays: 3\nCurrent City: from New York to Milwaukee\nTransportation: Flight F3644990, from New York to Milwaukee, duration: 2 hours 7 minutes, cost: 218 per person\nBreakfast: Sir John Bakery Cafe, New York, cost: 78, cuisines: Pizza, Bakery, Desserts\nAttraction: -\nLunch: -\nDinner: -\nAccommodation: -\n\nNumber of people: 2\nTotal cost: 218 * 2 + 78 * 2 = 592\n\nTotal cost across all days: 1,403 + 1,386 + 592 = 3,381\n\nHowever, the total cost exceeds the specified budget of $1,900. To adjust the plan within the budget, we need to change the accommodation and possibly the transportation method.\n\nRevised Travel Plan:\n\nDays: 1\nCurrent City: from Milwaukee to New York\nTransportation: Self-driving, from Milwaukee to New York, duration: 13 hours 29 mins, distance: 1,417 km, cost: 70\nBreakfast: -\nAttraction: -\nLunch: -\nDinner: Seasons 52 Fresh Grill, New York, cost: 30, cuisines: Seafood, Indian, Desserts, Italian\nAccommodation: Versatile private room in Harlem/Hamilton Heights!, New York, cost: 398, room type: Private room, house rules: No pets & No visitors & No parties, minimum nights: 4, maximum occupancy: 1\n\nNumber of people: 2\nTotal cost: 70 + 30 * 2 + 398 = 528\nAccommodation minimum nights: 1/4\n\nDays: 2\nCurrent City: New York\nTransportation: -\nBreakfast: Gurgaon Hights, New York, cost: 46, cuisines: Cafe, American, Indian, Fast Food\nAttraction: Central Park, New York; Statue of Liberty, New York; Empire State Building, New York\nLunch: Lord of the Drinks Forum, New York, cost: 71, cuisines: Cafe, Bakery, BBQ, Chinese, Indian\nDinner: QD's Restaurant, New York, cost: 93, cuisines: Tea, Desserts, Indian, BBQ\nAccommodation: Versatile private room in Harlem/Hamilton Heights!, New York, cost: 398, room type: Private room, house rules: No pets & No visitors & No parties, minimum nights: 4, maximum occupancy: 1\n\nNumber of people: 2\nTotal cost: 46 + 71 + 93 * 2 + 398 = 801\nAccommodation minimum nights: 2/4\n\nDays: 3\nCurrent City: from New York to Milwaukee\nTransportation: Self-driving, from New York to Milwaukee, duration: 13 hours 28 mins, distance: 1,417 km, cost: 70\nBreakfast: Sir John Bakery Cafe, New York, cost: 78, cuisines: Pizza, Bakery, Desserts\nAttraction: -\nLunch: -\nDinner: -\nAccommodation: -\n\nNumber of people: 2\nTotal cost: 70 + 78 * 2 = 226\n\nTotal cost across all days: 528 + 801 + 226 = 1,555\n\nCuisines: The plan includes a variety of cuisines as per the restaurants selected.\n\nPlease note that the accommodation selected only allows for 1 person per room, so an additional room would be needed for the second person, which would exceed the budget. The travel plan would need further adjustments to fit within the budget and accommodate two people in non-shared rooms.", "gpt-4-1106-preview_direct_sole-planning_parsed_results": [{"day": 1, "current_city": "from Milwaukee to New York", "transportation": "Self-driving, from Milwaukee to New York, duration: 13 hours 29 mins, distance: 1,417 km", "breakfast": "-", "attraction": "-", "lunch": "-", "dinner": "Seasons 52 Fresh Grill, New York", "accommodation": "Versatile private room in Harlem/Hamilton Heights!, New York"}, {"day": 2, "current_city": "New York", "transportation": "-", "breakfast": "Gurgaon Hights, New York", "attraction": "Central Park, New York;Statue of Liberty, New York;Empire State Building, New York;", "lunch": "Lord of the Drinks Forum, New York", "dinner": "QD's Restaurant, New York", "accommodation": "Versatile private room in Harlem/Hamilton Heights!, New York"}, {"day": 3, "current_city": "from New York to Milwaukee", "transportation": "Self-driving, from New York to Milwaukee, duration: 13 hours 28 mins, distance: 1,417 km", "breakfast": "Sir John Bakery Cafe, New York", "attraction": "-", "lunch": "-", "dinner": "-", "accommodation": "-"}]}]