[{"gpt-4-1106-preview_direct_sole-planning_results": "Travel Plan:\n\nDays: 1\nCurrent City: from Minneapolis to St. Louis\nTransportation: Flight F3491757, from Minneapolis to St. Louis, duration: 1 hour 20 minutes, cost: $95\nBreakfast: -\nAttraction: -\nLunch: -\nDinner: The Latitude - Radisson Blu, St. Louis, cost: $18, cuisines: Pizza, French, BBQ, American, Seafood\nAccommodation: Kan house (private room), St. Louis, cost: $749, maximum occupancy: 2, house rules: No pets, minimum nights: 1\n\nNumber of people: 1\nTotal cost: $95 + $18 + $749 = $862\nAccommodation minimum nights: 1/1\n\nDays: 2\nCurrent City: St. Louis\nTransportation: -\nBreakfast: El Super Burrito, St. Louis, cost: $43, cuisines: Tea, Cafe, Mediterranean, Fast Food\nAttraction: Saint Louis Zoo, St. Louis; City Museum, St. Louis; Forest Park, St. Louis\nLunch: Om Sweets, St. Louis, cost: $24, cuisines: Fast Food, BBQ, Desserts, Seafood\nDinner: M Cr\u00e8me, St. Louis, cost: $42, cuisines: French, Pizza, BBQ, Seafood\nAccommodation: Kan house (private room), St. Louis, cost: $749, maximum occupancy: 2, house rules: No pets, minimum nights: 1\n\nNumber of people: 1\nTotal cost: $43 + $24 + $42 + $749 = $858\nAccommodation minimum nights: 1/1\n\nDays: 3\nCurrent City: from St. Louis to Minneapolis\nTransportation: Flight F3830375, from St. Louis to Minneapolis, duration: 1 hour 25 minutes, cost: $108\nBreakfast: -\nAttraction: -\nLunch: -\nDinner: -\nAccommodation: -\n\nNumber of people: 1\nTotal cost: $108\n\nTotal cost across all days: $862 + $858 + $108 = $1,828\n\nUnfortunately, the total cost exceeds the specified budget of $1,000. Adjustments are needed to meet the budget constraint. Here is a revised plan within the budget:\n\nRevised Travel Plan:\n\nDays: 1\nCurrent City: from Minneapolis to St. Louis\nTransportation: Self-driving, from Minneapolis to St. Louis, duration: 8 hours 29 mins, distance: 901 km, cost: $45\nBreakfast: -\nAttraction: -\nLunch: -\nDinner: The Latitude - Radisson Blu, St. Louis, cost: $18, cuisines: Pizza, French, BBQ, American, Seafood\nAccommodation: Pet & Tony's Residence (Entire home/apt), St. Louis, cost: $271, maximum occupancy: 2, house rules: No parties & No visitors & No pets, minimum nights: 1\n\nNumber of people: 1\nTotal cost: $45 + $18 + $271 = $334\nAccommodation minimum nights: 1/1\n\nDays: 2\nCurrent City: St. Louis\nTransportation: -\nBreakfast: El Super Burrito, St. Louis, cost: $43, cuisines: Tea, Cafe, Mediterranean, Fast Food\nAttraction: Saint Louis Zoo, St. Louis; City Museum, St. Louis\nLunch: Om Sweets, St. Louis, cost: $24, cuisines: Fast Food, BBQ, Desserts, Seafood\nDinner: M Cr\u00e8me, St. Louis, cost: $42, cuisines: French, Pizza, BBQ, Seafood\nAccommodation: Pet & Tony's Residence (Entire home/apt), St. Louis, cost: $271, maximum occupancy: 2, house rules: No parties & No visitors & No pets, minimum nights: 1\n\nNumber of people: 1\nTotal cost: $43 + $24 + $42 + $271 = $380\nAccommodation minimum nights: 1/1\n\nDays: 3\nCurrent City: from St. Louis to Minneapolis\nTransportation: Self-driving, from St. Louis to Minneapolis, duration: 8 hours 28 mins, distance: 900 km, cost: $45\nBreakfast: -\nAttraction: -\nLunch: -\nDinner: -\nAccommodation: -\n\nNumber of people: 1\nTotal cost: $45\n\nTotal cost across all days: $334 + $380 + $45 = $759\n\nCuisines: The restaurants selected offer a variety of cuisines including American, French, BBQ, Seafood, Fast Food, and Mediterranean.\n\nThe revised travel plan meets the budget constraint of $1,000.", "gpt-4-1106-preview_direct_sole-planning_parsed_results": [{"day": 1, "current_city": "from Minneapolis to St. Louis", "transportation": "Self-driving, from Minneapolis to St. Louis, duration: 8 hours 29 mins, distance: 901 km", "breakfast": "-", "attraction": "-", "lunch": "-", "dinner": "The Latitude - Radisson Blu, St. Louis", "accommodation": "Pet & Tony's Residence (Entire home/apt), St. Louis"}, {"day": 2, "current_city": "St. Louis", "transportation": "-", "breakfast": "El Super Burrito, St. Louis", "attraction": "Saint Louis Zoo, St. Louis;City Museum, St. Louis;", "lunch": "Om Sweets, St. Louis", "dinner": "M Cr\u00e8me, St. Louis", "accommodation": "Pet & Tony's Residence (Entire home/apt), St. Louis"}, {"day": 3, "current_city": "from St. Louis to Minneapolis", "transportation": "Self-driving, from St. Louis to Minneapolis, duration: 8 hours 28 mins, distance: 900 km", "breakfast": "-", "attraction": "-", "lunch": "-", "dinner": "-", "accommodation": "-"}]}]