[{"gpt-4-1106-preview_direct_sole-planning_results": "Travel Plan:\nDays: 1\nCurrent City: from Atlanta to Knoxville\nTransportation: Flight F3556207, from Atlanta to Knoxville, duration: 0 hours 45 minutes, cost: 45\nBreakfast: -\nAttraction: -\nLunch: -\nDinner: Cafe Arabelle, Knoxville, cost: 29, cuisines: French, BBQ, Desserts, Seafood\nAccommodation: Light-filled Room in Renovated Apt, Knoxville, cost: 310, maximum occupancy: 2, house rules: No pets, minimum nights: 2\n\nNumber of people: 2\nTotal cost: 45 + 29 * 2 + 310 = 413\nAccommodation minimum nights: 1/2\n\nDays: 2\nCurrent City: Knoxville\nTransportation: -\nBreakfast: Les 3 Brasseurs, Knoxville, cost: 24, cuisines: Desserts, Pizza, Italian, Cafe, Indian\nAttraction: World's Fair Park, Knoxville; Knoxville Museum of Art, Knoxville; Sunsphere, Knoxville\nLunch: Mamagoto, Knoxville, cost: 14, cuisines: Indian, Mediterranean, Desserts, Seafood\nDinner: Cafe El Chico, Knoxville, cost: 67, cuisines: Tea, French, Indian, Seafood\nAccommodation: Light-filled Room in Renovated Apt, Knoxville, cost: 310, maximum occupancy: 2, house rules: No pets, minimum nights: 2\n\nNumber of people: 2\nTotal cost: 24 + 14 + 67 * 2 + 310 = 482\nAccommodation minimum nights: 2/2\n\nDays: 3\nCurrent City: from Knoxville to Atlanta\nTransportation: Flight F3517130, from Knoxville to Atlanta, duration: 0 hours 56 minutes, cost: 30\nBreakfast: Punjabi Flavour, Knoxville, cost: 41, cuisines: Tea, Bakery, Cafe, Indian, Seafood\nAttraction: -\nLunch: -\nDinner: -\nAccommodation: -\n\nNumber of people: 2\nTotal cost: 30 + 41 * 2 = 112\n\nTotal cost across all days: 413 + 482 + 112 = 1007\n\nCuisines: Various cuisines including French, BBQ, Desserts, Seafood, Pizza, Italian, Cafe, Indian, Tea, Mediterranean\n\nNote: The total cost slightly exceeds the budget by $7, which may be adjusted by selecting a less expensive dinner option on Day 2 or by choosing a more economical flight option if available.", "gpt-4-1106-preview_direct_sole-planning_parsed_results": [{"day": 1, "current_city": "from Atlanta to Knoxville", "transportation": "Flight Number: F3556207, from Atlanta to Knoxville, Departure Time: -, Arrival Time: -", "breakfast": "-", "attraction": "-", "lunch": "-", "dinner": "Cafe Arabelle, Knoxville", "accommodation": "Light-filled Room in Renovated Apt, Knoxville"}, {"day": 2, "current_city": "Knoxville", "transportation": "-", "breakfast": "Les 3 Brasseurs, Knoxville", "attraction": "World's Fair Park, Knoxville;Knoxville Museum of Art, Knoxville;Sunsphere, Knoxville;", "lunch": "Mamagoto, Knoxville", "dinner": "Cafe El Chico, Knoxville", "accommodation": "Light-filled Room in Renovated Apt, Knoxville"}, {"day": 3, "current_city": "from Knoxville to Atlanta", "transportation": "Flight Number: F3517130, from Knoxville to Atlanta, Departure Time: -, Arrival Time: -", "breakfast": "Punjabi Flavour, Knoxville", "attraction": "-", "lunch": "-", "dinner": "-", "accommodation": "-"}]}]