[{"gpt-4-1106-preview_direct_sole-planning_results": "Travel Plan:\n\nDays: 1\nCurrent City: Philadelphia to Richmond\nTransportation: Self-driving, from Philadelphia to Richmond, duration: 4 hours 2 mins, distance: 407 km, cost: 20\nBreakfast: -\nAttraction: -\nLunch: -\nDinner: Guang Zhou Chinese Restaurant, Richmond, cost: 84, cuisines: Desserts, Tea, Cafe, Fast Food, Chinese, Indian\nAccommodation: Cool Summer Vibes UWS Pent House w/ rooftop, Richmond, cost: 498, room type: Entire home/apt, house rules: No pets & No parties, minimum nights: 3, maximum occupancy: 2\n\nNumber of people: 2\nTotal cost: 20 + 84 * 2 + 498 = 686\nAccommodation minimum nights: 1/3\n\nDays: 2\nCurrent City: Richmond\nTransportation: -\nBreakfast: Sandpiper Restaurant & Lounge, Richmond, cost: 20, cuisines: Tea, Cafe, Desserts, Seafood\nAttraction: Virginia Museum of Fine Arts, Richmond; Maymont, Richmond; The Poe Museum, Richmond\nLunch: Paradise, Richmond, cost: 80, cuisines: Tea, Pizza, Italian, Fast Food, Seafood\nDinner: Welcome, Richmond, cost: 86, cuisines: Tea, French, Bakery, Indian\nAccommodation: Cool Summer Vibes UWS Pent House w/ rooftop, Richmond, cost: 498, room type: Entire home/apt, house rules: No pets & No parties, minimum nights: 3, maximum occupancy: 2\n\nNumber of people: 2\nTotal cost: 20 + 80 + 86 * 2 + 498 = 770\nAccommodation minimum nights: 2/3\n\nDays: 3\nCurrent City: Richmond\nTransportation: -\nBreakfast: Perfect Bake, Richmond, cost: 33, cuisines: Desserts, Tea, Italian, Bakery, Cafe, American\nAttraction: The Grand Kugel, Richmond; Black History Museum and Cultural Center of Virginia, Richmond; Virginia State Capitol, Richmond\nLunch: Mother's Kitchen, Richmond, cost: 46, cuisines: Tea, Cafe, Mexican, Fast Food, Chinese\nDinner: Eat All Nite, Richmond, cost: 55, cuisines: Chinese, Bakery, Cafe, Fast Food\nAccommodation: Cool Summer Vibes UWS Pent House w/ rooftop, Richmond, cost: 498, room type: Entire home/apt, house rules: No pets & No parties, minimum nights: 3, maximum occupancy: 2\n\nNumber of people: 2\nTotal cost: 33 + 46 + 55 * 2 + 498 = 687\nAccommodation minimum nights: 3/3\n\nDays: 4\nCurrent City: Richmond to Jamestown\nTransportation: Self-driving, from Richmond to Jamestown, duration: 1 hour 1 min, distance: 92.4 km, cost: 4\nBreakfast: Sugarcraft Patisserie, Richmond, cost: 38, cuisines: French, Desserts, Fast Food\nAttraction: Historic Jamestowne, Jamestown; Jamestown Settlement, Jamestown; Archaearium Archaeology Museum, Jamestown\nLunch: Cafe Soul Garden, Jamestown, cost: 99, cuisines: Desserts, Bakery, Cafe, American, Seafood\nDinner: Chauhan Hotel, Jamestown, cost: 13, cuisines: Desserts, Mexican, BBQ, Bakery, Cafe\nAccommodation: COZY APT CLOSE TO LGA & JFK AND TRANSPORTATION, Jamestown, cost: 652, room type: Entire home/apt, house rules: No children under 10, minimum nights: 2, maximum occupancy: 2\n\nNumber of people: 2\nTotal cost: 4 + 38 + 99 + 13 * 2 + 652 = 819\nAccommodation minimum nights: 1/2\n\nDays: 5\nCurrent City: Jamestown\nTransportation: -\nBreakfast: BarShala, Jamestown, cost: 13, cuisines: Fast Food, Seafood, Desserts, Italian\nAttraction: Jamestown Glasshouse, Jamestown; Jamestown Beach Event Park, Jamestown; Jamestown Rediscovery, Jamestown\nLunch: Mughlai Flavours, Jamestown, cost: 12, cuisines: Pizza, French, Bakery, BBQ, Cafe\nDinner: The Food Junction, Jamestown, cost: 78, cuisines: Tea, Indian, Fast Food\nAccommodation: COZY APT CLOSE TO LGA & JFK AND TRANSPORTATION, Jamestown, cost: 652, room type: Entire home/apt, house rules: No children under 10, minimum nights: 2, maximum occupancy: 2\n\nNumber of people: 2\nTotal cost: 13 + 12 + 78 * 2 + 652 = 833\nAccommodation minimum nights: 2/2\n\nDays: 6\nCurrent City: Jamestown to Charlottesville\nTransportation: Self-driving, from Jamestown to Charlottesville, duration: 2 hours 2 mins, distance: 206 km, cost: 10\nBreakfast: Punjabi's Veg Grill, Jamestown, cost: 89, cuisines: BBQ, American, Desserts\nAttraction: Monticello, Charlottesville; Virginia Discovery Museum, Charlottesville; The Fralin Museum of Art at the University of Virginia, Charlottesville\nLunch: Restaurant Andre, Charlottesville, cost: 250, cuisines: Desserts, Tea, BBQ, Fast Food, Chinese\nDinner: Takamaka, Charlottesville, cost: 72, cuisines: Tea, Pizza, Italian, BBQ, Fast Food\nAccommodation: Gorgeous natural light in Chelsea photo studio, Charlottesville, cost: 1094, room type: Entire home/apt, house rules: No pets, minimum nights: 1, maximum occupancy: 8\n\nNumber of people: 2\nTotal cost: 10 + 89 + 250 + 72 * 2 + 1094 = 1587\nAccommodation minimum nights: 1/1\n\nDays: 7\nCurrent City: Charlottesville to Philadelphia\nTransportation: Self-driving, from Charlottesville to Philadelphia, duration: 4 hours 24 mins, distance: 411 km, cost: 20\nBreakfast: Mama's Fish House, Charlottesville, cost: 63, cuisines: Tea, Pizza, Desserts, Fast Food\nAttraction: -\nLunch: -\nDinner: -\nAccommodation: -\n\nNumber of people: 2\nTotal cost: 20 + 63 * 2 = 146\n\nTotal cost across all days: 686 + 770 + 687 + 819 + 833 + 1587 + 146 = 5528\n\nNote: The total cost exceeds the specified budget of $2,900. Adjustments to the plan, such as choosing more budget-friendly accommodations or dining options, would be necessary to meet the budget constraint.", "gpt-4-1106-preview_direct_sole-planning_parsed_results": [{"day": 1, "current_city": "from Philadelphia to Richmond", "transportation": "Self-driving, from Philadelphia to Richmond, duration: 4 hours 2 mins, distance: 407 km", "breakfast": "-", "attraction": "-", "lunch": "-", "dinner": "Guang Zhou Chinese Restaurant, Richmond", "accommodation": "Cool Summer Vibes UWS Pent House w/ rooftop, Richmond"}, {"day": 2, "current_city": "Richmond", "transportation": "-", "breakfast": "Sandpiper Restaurant & Lounge, Richmond", "attraction": "Virginia Museum of Fine Arts, Richmond;Maymont, Richmond;The Poe Museum, Richmond;", "lunch": "Paradise, Richmond", "dinner": "Welcome, Richmond", "accommodation": "Cool Summer Vibes UWS Pent House w/ rooftop, Richmond"}, {"day": 3, "current_city": "Richmond", "transportation": "-", "breakfast": "Perfect Bake, Richmond", "attraction": "The Grand Kugel, Richmond;Black History Museum and Cultural Center of Virginia, Richmond;Virginia State Capitol, Richmond;", "lunch": "Mother's Kitchen, Richmond", "dinner": "Eat All Nite, Richmond", "accommodation": "Cool Summer Vibes UWS Pent House w/ rooftop, Richmond"}, {"day": 4, "current_city": "from Richmond to Jamestown", "transportation": "Self-driving, from Richmond to Jamestown, duration: 1 hour 1 min, distance: 92.4 km", "breakfast": "Sugarcraft Patisserie, Richmond", "attraction": "Historic Jamestowne, Jamestown;Jamestown Settlement, Jamestown;Archaearium Archaeology Museum, Jamestown;", "lunch": "Cafe Soul Garden, Jamestown", "dinner": "Chauhan Hotel, Jamestown", "accommodation": "COZY APT CLOSE TO LGA & JFK AND TRANSPORTATION, Jamestown"}, {"day": 5, "current_city": "Jamestown", "transportation": "-", "breakfast": "BarShala, Jamestown", "attraction": "Jamestown Glasshouse, Jamestown;Jamestown Beach Event Park, Jamestown;Jamestown Rediscovery, Jamestown;", "lunch": "Mughlai Flavours, Jamestown", "dinner": "The Food Junction, Jamestown", "accommodation": "COZY APT CLOSE TO LGA & JFK AND TRANSPORTATION, Jamestown"}, {"day": 6, "current_city": "from Jamestown to Charlottesville", "transportation": "Self-driving, from Jamestown to Charlottesville, duration: 2 hours 2 mins, distance: 206 km", "breakfast": "Punjabi's Veg Grill, Jamestown", "attraction": "Monticello, Charlottesville;Virginia Discovery Museum, Charlottesville;The Fralin Museum of Art at the University of Virginia, Charlottesville;", "lunch": "Restaurant Andre, Charlottesville", "dinner": "Takamaka, Charlottesville", "accommodation": "Gorgeous natural light in Chelsea photo studio, Charlottesville"}, {"day": 7, "current_city": "from Charlottesville to Philadelphia", "transportation": "Self-driving, from Charlottesville to Philadelphia, duration: 4 hours 24 mins, distance: 411 km", "breakfast": "Mama's Fish House, Charlottesville", "attraction": "-", "lunch": "-", "dinner": "-", "accommodation": "-"}]}]