[{"gpt-4-1106-preview_direct_sole-planning_results": "Travel Plan:\n\nDays: 1\nCurrent City: from Columbus to Newark\nTransportation: Flight F4076294, from Columbus to Newark, duration: 1 hour 51 minutes, cost: $116 per person\nBreakfast: -\nAttraction: -\nLunch: -\nDinner: Artistry, Newark, cost: $79, cuisines: Cafe, Pizza, Desserts, Seafood\nAccommodation: Gramercy One Bedroom w Two Beds, Newark, cost: $485, room type: Entire home/apt, house rules: No visitors & No children under 10, minimum nights: 7, maximum occupancy: 4\n\nNumber of people: 2\nTotal cost: ($116 * 2) + $79 + $485 = $796\nAccommodation minimum nights: 1/7\n\nDays: 2\nCurrent City: Newark\nTransportation: -\nBreakfast: Mirage Restro Bar, Newark, cost: $51, cuisines: Bakery, American, Desserts, Fast Food\nAttraction: The Newark Museum of Art, Newark; Military Park, Newark; Branch Brook Park, Newark\nLunch: Angeethi Restaurant, Newark, cost: $12, cuisines: French, BBQ, Fast Food\nDinner: Escape Terrace Bar Kitchen, Newark, cost: $100, cuisines: Tea, Cafe, Bakery, Chinese, Seafood\nAccommodation: Gramercy One Bedroom w Two Beds, Newark, cost: $485, room type: Entire home/apt, house rules: No visitors & No children under 10, minimum nights: 7, maximum occupancy: 4\n\nNumber of people: 2\nTotal cost: $51 + $12 + $100 + $485 = $648\nAccommodation minimum nights: 2/7\n\nDays: 3\nCurrent City: from Newark to Columbus\nTransportation: Flight F4076752, from Newark to Columbus, duration: 1 hour 35 minutes, cost: $129 per person\nBreakfast: Harmann Restaurant, Newark, cost: $57, cuisines: Tea, Cafe, American, Fast Food\nAttraction: -\nLunch: -\nDinner: -\nAccommodation: -\n\nNumber of people: 2\nTotal cost: ($129 * 2) + $57 = $315\n\nTotal cost across all days: $796 + $648 + $315 = $1,759\n\nUnfortunately, the total cost exceeds the revised budget of $1,200. To adjust the plan within the budget, we can consider the following changes:\n\n- Choose a less expensive accommodation option if available.\n- Opt for more budget-friendly meal options.\n- Reconsider the transportation method if a cheaper alternative is available.\n\nPlease note that the accommodation chosen does not meet the requirement of being suitable for children under 10, as per the house rules. We need to find an alternative accommodation that allows children under 10.\n\nRevised Travel Plan:\n\nDays: 1\nCurrent City: from Columbus to Newark\nTransportation: Flight F4076294, from Columbus to Newark, duration: 1 hour 51 minutes, cost: $116 per person\nBreakfast: -\nAttraction: -\nLunch: -\nDinner: Artistry, Newark, cost: $79, cuisines: Cafe, Pizza, Desserts, Seafood\nAccommodation: Contemporary Brooklyn Lifestyle Apt /JFK Airport, Newark, cost: $610, room type: Entire home/apt, house rules: No pets, minimum nights: 2, maximum occupancy: 6\n\nNumber of people: 2\nTotal cost: ($116 * 2) + $79 + $610 = $921\nAccommodation minimum nights: 1/2\n\nDays: 2\nCurrent City: Newark\nTransportation: -\nBreakfast: Mirage Restro Bar, Newark, cost: $51, cuisines: Bakery, American, Desserts, Fast Food\nAttraction: The Newark Museum of Art, Newark; Military Park, Newark; Branch Brook Park, Newark\nLunch: Angeethi Restaurant, Newark, cost: $12, cuisines: French, BBQ, Fast Food\nDinner: Escape Terrace Bar Kitchen, Newark, cost: $100, cuisines: Tea, Cafe, Bakery, Chinese, Seafood\nAccommodation: Contemporary Brooklyn Lifestyle Apt /JFK Airport, Newark, cost: $610, room type: Entire home/apt, house rules: No pets, minimum nights: 2, maximum occupancy: 6\n\nNumber of people: 2\nTotal cost: $51 + $12 + $100 + $610 = $773\nAccommodation minimum nights: 2/2\n\nDays: 3\nCurrent City: from Newark to Columbus\nTransportation: Flight F4076752, from Newark to Columbus, duration: 1 hour 35 minutes, cost: $129 per person\nBreakfast: Harmann Restaurant, Newark, cost: $57, cuisines: Tea, Cafe, American, Fast Food\nAttraction: -\nLunch: -\nDinner: -\nAccommodation: -\n\nNumber of people: 2\nTotal cost: ($129 * 2) + $57 = $315\n\nTotal cost across all days: $921 + $773 + $315 = $2,009\n\nThe revised plan still exceeds the budget. To fit within the $1,200 budget, we may need to consider alternative transportation methods, such as taking a taxi or finding a more affordable flight. Additionally, we should look for more budget-friendly dining options and ensure that the accommodation cost is spread over the number of nights stayed to avoid exceeding the budget.", "gpt-4-1106-preview_direct_sole-planning_parsed_results": [{"day": 1, "current_city": "from Columbus to Newark", "transportation": "Flight Number: F4076294, from Columbus to Newark, Departure Time: -, Arrival Time: -", "breakfast": "-", "attraction": "-", "lunch": "-", "dinner": "Artistry, Newark", "accommodation": "Gramercy One Bedroom w Two Beds, Newark"}, {"day": 2, "current_city": "Newark", "transportation": "-", "breakfast": "Mirage Restro Bar, Newark", "attraction": "The Newark Museum of Art, Newark;Military Park, Newark;Branch Brook Park, Newark;", "lunch": "Angeethi Restaurant, Newark", "dinner": "Escape Terrace Bar Kitchen, Newark", "accommodation": "Gramercy One Bedroom w Two Beds, Newark"}, {"day": 3, "current_city": "from Newark to Columbus", "transportation": "Flight Number: F4076752, from Newark to Columbus, Departure Time: -, Arrival Time: -", "breakfast": "Harmann Restaurant, Newark", "attraction": "-", "lunch": "-", "dinner": "-", "accommodation": "-"}, {"day": 1, "current_city": "from Columbus to Newark", "transportation": "Flight Number: F4076294, from Columbus to Newark, Departure Time: -, Arrival Time: -", "breakfast": "-", "attraction": "-", "lunch": "-", "dinner": "Artistry, Newark", "accommodation": "Contemporary Brooklyn Lifestyle Apt /JFK Airport, Newark"}, {"day": 2, "current_city": "Newark", "transportation": "-", "breakfast": "Mirage Restro Bar, Newark", "attraction": "The Newark Museum of Art, Newark;Military Park, Newark;Branch Brook Park, Newark;", "lunch": "Angeethi Restaurant, Newark", "dinner": "Escape Terrace Bar Kitchen, Newark", "accommodation": "Contemporary Brooklyn Lifestyle Apt /JFK Airport, Newark"}, {"day": 3, "current_city": "from Newark to Columbus", "transportation": "Flight Number: F4076752, from Newark to Columbus, Departure Time: -, Arrival Time: -", "breakfast": "Harmann Restaurant, Newark", "attraction": "-", "lunch": "-", "dinner": "-", "accommodation": "-"}]}]