[{"gpt-4-1106-preview_direct_sole-planning_results": "Travel Plan:\n\nDays: 1\nCurrent City: from Sun Valley to San Diego\nTransportation: Self-driving, from Sun Valley to San Diego, duration: 14 hours 9 mins, distance: 1,461 km, cost: 73 * 7 = 511\nBreakfast: -\nAttraction: -\nLunch: -\nDinner: Open Yard, San Diego, cost: 33 * 7 = 231, cuisines: Chinese, Pizza, Cafe, Desserts\nAccommodation: Spacious Room in Large 2 Bedroom Prewar Apartment, San Diego, cost: 585 * 7 = 4095, room type: Private room, house rules: No parties & No visitors, minimum nights: 1, maximum occupancy: 2\n\nNumber of people: 7\nTotal cost: 511 + 231 + 4095 = 4837\nAccommodation minimum nights: 1/1\n\nDays: 2\nCurrent City: San Diego\nTransportation: -\nBreakfast: Jetha Lal Ka Dhabha, San Diego, cost: 22 * 7 = 154, cuisines: Tea, Cafe, Indian, Italian\nAttraction: Balboa Park, San Diego; USS Midway Museum, San Diego; San Diego Zoo, San Diego\nLunch: Gopala, San Diego, cost: 98 * 7 = 686, cuisines: Pizza, Mexican, BBQ, American, Seafood\nDinner: Harry's Bar + Cafe, San Diego, cost: 55 * 7 = 385, cuisines: Fast Food, French, Cafe, Seafood\nAccommodation: Spacious Room in Large 2 Bedroom Prewar Apartment, San Diego, cost: 585 * 7 = 4095, room type: Private room, house rules: No parties & No visitors, minimum nights: 1, maximum occupancy: 2\n\nNumber of people: 7\nTotal cost: 154 + 686 + 385 + 4095 = 5320\nAccommodation minimum nights: 2/2\n\nDays: 3\nCurrent City: from San Diego to Oakland\nTransportation: Self-driving, from San Diego to Oakland, duration: 7 hours 38 mins, distance: 789 km, cost: 39 * 7 = 273\nBreakfast: Bun Intended, San Diego, cost: 91 * 7 = 637, cuisines: Cafe, Pizza, Desserts, Seafood\nAttraction: -\nLunch: -\nDinner: Cho Gao - Crowne Plaza Abu Dhabi, Oakland, cost: 52 * 7 = 364, cuisines: Tea, BBQ, Seafood\nAccommodation: Harlem Garden Oasis in New York City Brownstone, Oakland, cost: 368 * 7 = 2576, room type: Entire home/apt, house rules: No visitors, minimum nights: 31, maximum occupancy: 3\n\nNumber of people: 7\nTotal cost: 273 + 637 + 364 + 2576 = 3850\nAccommodation minimum nights: 1/31\n\nDays: 4\nCurrent City: Oakland\nTransportation: -\nBreakfast: Malais By Anands, Oakland, cost: 37 * 7 = 259, cuisines: Tea, Cafe, Mexican, Pizza\nAttraction: Oakland Zoo, Oakland; Chabot Space & Science Center, Oakland; Children's Fairyland, Oakland\nLunch: Jammu And Kashmir House, Oakland, cost: 100 * 7 = 700, cuisines: Tea, BBQ, American, Mediterranean, Seafood\nDinner: Wok On Wheels, Oakland, cost: 100 * 7 = 700, cuisines: Tea, Pizza, Bakery, Mediterranean\nAccommodation: Harlem Garden Oasis in New York City Brownstone, Oakland, cost: 368 * 7 = 2576, room type: Entire home/apt, house rules: No visitors, minimum nights: 31, maximum occupancy: 3\n\nNumber of people: 7\nTotal cost: 259 + 700 + 700 + 2576 = 4235\nAccommodation minimum nights: 2/31\n\nDays: 5\nCurrent City: from Oakland to Sun Valley\nTransportation: Self-driving, from Oakland to Sun Valley, duration: 11 hours 36 mins, distance: 1,204 km, cost: 60 * 7 = 420\nBreakfast: Katyani Rasoi, Oakland, cost: 34 * 7 = 238, cuisines: Tea, French, Bakery, BBQ, Indian, Seafood\nAttraction: -\nLunch: -\nDinner: -\nAccommodation: -\n\nNumber of people: 7\nTotal cost: 420 + 238 = 658\n\nTotal cost across all days: 4837 + 5320 + 3850 + 4235 + 658 = 18900\n\nCuisines: The prompt specifies Mediterranean, American, French, and Indian.\n\n**Note: The total cost exceeds the specified budget of $11,400. Adjustments to the plan would be required to meet the budget constraints. This could involve choosing more affordable restaurants, finding cheaper accommodations, or reducing the number of attractions visited. Additionally, the accommodation in Oakland does not allow parties, which is against the specified requirements. A different accommodation that allows parties and fits within the budget should be selected.**", "gpt-4-1106-preview_direct_sole-planning_parsed_results": [{"day": 1, "current_city": "from Sun Valley to San Diego", "transportation": "Self-driving, from Sun Valley to San Diego, duration: 14 hours 9 mins, distance: 1,461 km", "breakfast": "-", "attraction": "-", "lunch": "-", "dinner": "Open Yard, San Diego", "accommodation": "Spacious Room in Large 2 Bedroom Prewar Apartment, San Diego"}, {"day": 2, "current_city": "San Diego", "transportation": "-", "breakfast": "Jetha Lal Ka Dhabha, San Diego", "attraction": "Balboa Park, San Diego;USS Midway Museum, San Diego;San Diego Zoo, San Diego;", "lunch": "Gopala, San Diego", "dinner": "Harry's Bar + Cafe, San Diego", "accommodation": "Spacious Room in Large 2 Bedroom Prewar Apartment, San Diego"}, {"day": 3, "current_city": "from San Diego to Oakland", "transportation": "Self-driving, from San Diego to Oakland, duration: 7 hours 38 mins, distance: 789 km", "breakfast": "Bun Intended, San Diego", "attraction": "-", "lunch": "-", "dinner": "Cho Gao - Crowne Plaza Abu Dhabi, Oakland", "accommodation": "Harlem Garden Oasis in New York City Brownstone, Oakland"}, {"day": 4, "current_city": "Oakland", "transportation": "-", "breakfast": "Malais By Anands, Oakland", "attraction": "Oakland Zoo, Oakland;Chabot Space & Science Center, Oakland;Children's Fairyland, Oakland;", "lunch": "Jammu And Kashmir House, Oakland", "dinner": "Wok On Wheels, Oakland", "accommodation": "Harlem Garden Oasis in New York City Brownstone, Oakland"}, {"day": 5, "current_city": "from Oakland to Sun Valley", "transportation": "Self-driving, from Oakland to Sun Valley, duration: 11 hours 36 mins, distance: 1,204 km", "breakfast": "Katyani Rasoi, Oakland", "attraction": "-", "lunch": "-", "dinner": "-", "accommodation": "-"}]}]