[{"gpt-4-1106-preview_direct_sole-planning_results": "Travel Plan:\n\nDays: 1\nCurrent City: from Las Vegas to Twin Falls\nTransportation: Self-driving, from Las Vegas to Twin Falls, duration: 7 hours 32 mins, distance: 796 km, cost: 39\nBreakfast: -\nAttraction: -\nLunch: -\nDinner: Thai Paradise, Twin Falls, cost: 87, cuisines: Fast Food, Indian, Desserts, Seafood\nAccommodation: Charming studio, great location!!!, Twin Falls, cost: 994, room type: Entire home/apt, house rules: No smoking & No pets, minimum nights: 2, maximum occupancy: 8\n\nNumber of people: 2\nTotal cost: 39 + 87 * 2 + 994 = 1,207\nAccommodation minimum nights: 1/2\n\nDays: 2\nCurrent City: Twin Falls\nTransportation: -\nBreakfast: Kaushik Bakery, Twin Falls, cost: 29, cuisines: Cafe, Pizza, Italian\nAttraction: Shoshone Falls Park, Twin Falls; Centennial Waterfront Park, Twin Falls; Snake River Canyon Rim Trail, Twin Falls\nLunch: Food Fever, Twin Falls, cost: 83, cuisines: Fast Food, Chinese, BBQ, Seafood\nDinner: Asia Kitchen, Twin Falls, cost: 67, cuisines: Tea, Cafe, BBQ, Desserts\nAccommodation: Charming studio, great location!!!, Twin Falls, cost: 994, room type: Entire home/apt, house rules: No smoking & No pets, minimum nights: 2, maximum occupancy: 8\n\nNumber of people: 2\nTotal cost: 29 + 83 + 67 * 2 + 994 = 1,240\nAccommodation minimum nights: 2/2\n\nDays: 3\nCurrent City: from Twin Falls to Pocatello\nTransportation: Self-driving, from Twin Falls to Pocatello, duration: 1 hour 46 mins, distance: 183 km, cost: 9\nBreakfast: Mittal Fast Food, Twin Falls, cost: 83, cuisines: Cafe, Seafood, Desserts, Italian\nAttraction: -\nLunch: -\nDinner: Harvest Moon, Pocatello, cost: 90, cuisines: Pizza, Fast Food\nAccommodation: Chill in Alphabet City, Pocatello, cost: 671, room type: Private room, house rules: No pets & No children under 10, minimum nights: 3, maximum occupancy: 1\n\nNumber of people: 2\nTotal cost: 9 + 83 * 2 + 90 * 2 + 671 = 1,026\nAccommodation minimum nights: 1/3\n\nDays: 4\nCurrent City: Pocatello\nTransportation: -\nBreakfast: Ghar Ki Handi, Pocatello, cost: 13, cuisines: Cafe, Bakery, American, Fast Food\nAttraction: Idaho Museum of Natural History, Pocatello; Zoo Idaho, Pocatello; Fort Hall Replica and Commemorative Trading Post, Pocatello\nLunch: Deorio's, Pocatello, cost: 59, cuisines: Tea, Bakery, Fast Food, Mediterranean, Seafood\nDinner: 650 - The Global Kitchen, Pocatello, cost: 83, cuisines: French, Bakery, Cafe\nAccommodation: Chill in Alphabet City, Pocatello, cost: 671, room type: Private room, house rules: No pets & No children under 10, minimum nights: 3, maximum occupancy: 1\n\nNumber of people: 2\nTotal cost: 13 + 59 + 83 * 2 + 671 = 909\nAccommodation minimum nights: 2/3\n\nDays: 5\nCurrent City: from Pocatello to Boise\nTransportation: Self-driving, from Pocatello to Boise, duration: 3 hours 23 mins, distance: 377 km, cost: 18\nBreakfast: Oriental Kitchen Express, Pocatello, cost: 36, cuisines: Cafe, Bakery, Desserts\nAttraction: -\nLunch: -\nDinner: Gopala Hari, Boise, cost: 28, cuisines: Tea, Pizza, Italian, Fast Food, Mediterranean, Seafood\nAccommodation: Modern & Cozy 2 BR Private Apartment in Brooklyn, Boise, cost: 843, room type: Entire home/apt, house rules: No children under 10, minimum nights: 2645, maximum occupancy: 7\n\nNumber of people: 2\nTotal cost: 18 + 36 * 2 + 28 * 2 + 843 = 989\nAccommodation minimum nights: 1/2645\n\nDays: 6\nCurrent City: Boise\nTransportation: -\nBreakfast: The Brewhouse, Boise, cost: 59, cuisines: Cafe, Pizza, American, Fast Food\nAttraction: Zoo Boise, Boise; Idaho State Museum, Boise; Julia Davis Park, Boise\nLunch: TGI Friday's, Boise, cost: 33, cuisines: Cafe, Mexican, BBQ, Fast Food\nDinner: Dhaba By Claridges, Boise, cost: 65, cuisines: Desserts, Italian, Fast Food, Chinese, Seafood\nAccommodation: Modern & Cozy 2 BR Private Apartment in Brooklyn, Boise, cost: 843, room type: Entire home/apt, house rules: No children under 10, minimum nights: 2645, maximum occupancy: 7\n\nNumber of people: 2\nTotal cost: 59 + 33 + 65 * 2 + 843 = 1,065\nAccommodation minimum nights: 2/2645\n\nDays: 7\nCurrent City: from Boise to Las Vegas\nTransportation: Self-driving, from Boise to Las Vegas, duration: 9 hours 30 mins, distance: 1,004 km, cost: 50\nBreakfast: -\nAttraction: -\nLunch: -\nDinner: -\nAccommodation: -\n\nNumber of people: 2\nTotal cost: 50\n\nTotal cost across all days: 1,207 + 1,240 + 1,026 + 909 + 989 + 1,065 + 50 = 6,486\n\nCuisines: The prompt specifies a variety of cuisines across different meals.\n\nPlease note that the total cost exceeds the specified budget of $5,100. Adjustments to the plan, such as choosing more budget-friendly accommodations or dining options, may be necessary to meet the budget constraint. Additionally, the accommodation on Day 5 has an unusually high minimum night requirement, which may be an error in the data. Please confirm the details before booking.", "gpt-4-1106-preview_direct_sole-planning_parsed_results": [{"day": 1, "current_city": "from Las Vegas to Twin Falls", "transportation": "Self-driving, from Las Vegas to Twin Falls, duration: 7 hours 32 mins, distance: 796 km", "breakfast": "-", "attraction": "-", "lunch": "-", "dinner": "Thai Paradise, Twin Falls", "accommodation": "Charming studio, great location!!!, Twin Falls"}, {"day": 2, "current_city": "Twin Falls", "transportation": "-", "breakfast": "Kaushik Bakery, Twin Falls", "attraction": "Shoshone Falls Park, Twin Falls; Centennial Waterfront Park, Twin Falls; Snake River Canyon Rim Trail, Twin Falls", "lunch": "Food Fever, Twin Falls", "dinner": "Asia Kitchen, Twin Falls", "accommodation": "Charming studio, great location!!!, Twin Falls"}, {"day": 3, "current_city": "from Twin Falls to Pocatello", "transportation": "Self-driving, from Twin Falls to Pocatello, duration: 1 hour 46 mins, distance: 183 km", "breakfast": "Mittal Fast Food, Twin Falls", "attraction": "-", "lunch": "-", "dinner": "Harvest Moon, Pocatello", "accommodation": "Chill in Alphabet City, Pocatello"}, {"day": 4, "current_city": "Pocatello", "transportation": "-", "breakfast": "Ghar Ki Handi, Pocatello", "attraction": "Idaho Museum of Natural History, Pocatello; Zoo Idaho, Pocatello; Fort Hall Replica and Commemorative Trading Post, Pocatello", "lunch": "Deorio's, Pocatello", "dinner": "650 - The Global Kitchen, Pocatello", "accommodation": "Chill in Alphabet City, Pocatello"}, {"day": 5, "current_city": "from Pocatello to Boise", "transportation": "Self-driving, from Pocatello to Boise, duration: 3 hours 23 mins, distance: 377 km", "breakfast": "Oriental Kitchen Express, Pocatello", "attraction": "-", "lunch": "-", "dinner": "Gopala Hari, Boise", "accommodation": "Modern & Cozy 2 BR Private Apartment in Brooklyn, Boise"}, {"day": 6, "current_city": "Boise", "transportation": "-", "breakfast": "The Brewhouse, Boise", "attraction": "Zoo Boise, Boise; Idaho State Museum, Boise; Julia Davis Park, Boise", "lunch": "TGI Friday's, Boise", "dinner": "Dhaba By Claridges, Boise", "accommodation": "Modern & Cozy 2 BR Private Apartment in Brooklyn, Boise"}, {"day": 7, "current_city": "from Boise to Las Vegas", "transportation": "Self-driving, from Boise to Las Vegas, duration: 9 hours 30 mins, distance: 1,004 km", "breakfast": "-", "attraction": "-", "lunch": "-", "dinner": "-", "accommodation": "-"}]}]