[{"gpt-4-1106-preview_direct_sole-planning_results": "Travel Plan:\n\nDays: 1\nCurrent City: from Myrtle Beach to Nashville\nTransportation: Self-driving, from Myrtle Beach to Nashville, duration: 9 hours 11 mins, distance: 949 km, cost: 47 * 4 = 188\nBreakfast: -\nAttraction: -\nLunch: -\nDinner: GoGourmet, Nashville, cost: 34 * 4 = 136, cuisines: Tea, Cafe, Indian, Mediterranean\nAccommodation: Clean and large bedroom in a private house, Nashville, cost: 474 * 4 = 1896, maximum occupancy: 1, house rules: No smoking, minimum nights: 1\n\nNumber of people: 4\nTotal cost: 188 + 136 + 1896 = 2220\nAccommodation minimum nights: 1/1\n\nDays: 2\nCurrent City: Nashville\nTransportation: -\nBreakfast: Govinda's Confectionery, Nashville, cost: 15 * 4 = 60, cuisines: Tea, Bakery, Mediterranean, Fast Food\nAttraction: Country Music Hall of Fame and Museum, Nashville; Nashville Zoo at Grassmere, Nashville; The Parthenon, Nashville\nLunch: Dialogue Lounge & Caf\u6106, Nashville, cost: 83 * 4 = 332, cuisines: Tea, Indian, BBQ, Cafe, American, Seafood\nDinner: Smoke House Deli, Nashville, cost: 59 * 4 = 236, cuisines: Cafe, Mediterranean, Seafood\nAccommodation: Clean and large bedroom in a private house, Nashville, cost: 474 * 4 = 1896, maximum occupancy: 1, house rules: No smoking, minimum nights: 1\n\nNumber of people: 4\nTotal cost: 60 + 332 + 236 + 1896 = 2524\nAccommodation minimum nights: 2/2\n\nDays: 3\nCurrent City: from Nashville to Memphis\nTransportation: Self-driving, from Nashville to Memphis, duration: 3 hours 10 mins, distance: 341 km, cost: 17 * 4 = 68\nBreakfast: Meenakshi Bhawan, Nashville, cost: 24 * 4 = 96, cuisines: Tea, Desserts\nAttraction: -\nLunch: -\nDinner: My Spice Kitchen, Memphis, cost: 82 * 4 = 328, cuisines: Desserts, French, Bakery, Fast Food, Mediterranean, Seafood\nAccommodation: Beautiful, bright and friendly, Memphis, cost: 985 * 4 = 3940, maximum occupancy: 2, house rules: No pets, minimum nights: 1\n\nNumber of people: 4\nTotal cost: 68 + 96 + 328 + 3940 = 4432\nAccommodation minimum nights: 1/1\n\nDays: 4\nCurrent City: Memphis\nTransportation: -\nBreakfast: Savannah Bar - Radisson Blu Plaza Delhi, Memphis, cost: 79 * 4 = 316, cuisines: Tea, Italian, Bakery, Cafe, Mediterranean\nAttraction: National Civil Rights Museum, Memphis; Graceland, Memphis; Memphis Zoo, Memphis\nLunch: The Gathering Hut, Memphis, cost: 76 * 4 = 304, cuisines: Desserts, American, Bakery, BBQ, Fast Food, Indian\nDinner: Hops n Grains, Memphis, cost: 95 * 4 = 380, cuisines: Cafe, Bakery, American, Seafood\nAccommodation: Beautiful, bright and friendly, Memphis, cost: 985 * 4 = 3940, maximum occupancy: 2, house rules: No pets, minimum nights: 1\n\nNumber of people: 4\nTotal cost: 316 + 304 + 380 + 3940 = 4940\nAccommodation minimum nights: 2/2\n\nDays: 5\nCurrent City: from Memphis to Myrtle Beach\nTransportation: Self-driving, from Memphis to Myrtle Beach, duration: 11 hours 12 mins, distance: 1,199 km, cost: 59 * 4 = 236\nBreakfast: -\nAttraction: -\nLunch: -\nDinner: -\nAccommodation: -\n\nNumber of people: 4\nTotal cost: 236\n\nTotal cost across all days: 2220 + 2524 + 4432 + 4940 + 236 = 14352\n\nGiven the total cost exceeds the budget of $5,500, we need to revise the plan to fit within the budget. Let's adjust the accommodations to reduce the cost:\n\nRevised Accommodations:\nDays 1 & 2: Clean and large bedroom in a private house, Nashville, cost: 474 * 4 = 1896 (for two nights)\nDays 3 & 4: ~*PLANT HAVEN*~ Private Room -Charming Garden Apt, Memphis, cost: 354 * 4 = 1416 (for two nights)\n\nRevised Total Cost:\nDays 1 & 2: 2220 (original) - 1896 (original accommodation cost) + 1896 (revised accommodation cost) = 2220\nDays 3 & 4: 4432 (original) + 4940 (original) - 3940 (original accommodation cost) - 3940 (original accommodation cost) + 1416 (revised accommodation cost) + 1416 (revised accommodation cost) = 6856\nDay 5: 236\n\nRevised Total Cost across all days: 2220 + 6856 + 236 = 9312\n\nThe revised total cost still exceeds the budget. Further adjustments are needed, such as choosing more affordable restaurants or reducing the number of attractions visited. However, without additional information on costs and options, we cannot provide a further revised plan that meets the budget constraint.", "gpt-4-1106-preview_direct_sole-planning_parsed_results": [{"day": 1, "current_city": "from Myrtle Beach to Nashville", "transportation": "Self-driving, from Myrtle Beach to Nashville, duration: 9 hours 11 mins, distance: 949 km", "breakfast": "-", "attraction": "-", "lunch": "-", "dinner": "GoGourmet, Nashville", "accommodation": "Clean and large bedroom in a private house, Nashville"}, {"day": 2, "current_city": "Nashville", "transportation": "-", "breakfast": "Govinda's Confectionery, Nashville", "attraction": "Country Music Hall of Fame and Museum, Nashville;Nashville Zoo at Grassmere, Nashville;The Parthenon, Nashville", "lunch": "Dialogue Lounge & Caf\u6106, Nashville", "dinner": "Smoke House Deli, Nashville", "accommodation": "Clean and large bedroom in a private house, Nashville"}, {"day": 3, "current_city": "from Nashville to Memphis", "transportation": "Self-driving, from Nashville to Memphis, duration: 3 hours 10 mins, distance: 341 km", "breakfast": "Meenakshi Bhawan, Nashville", "attraction": "-", "lunch": "-", "dinner": "My Spice Kitchen, Memphis", "accommodation": "Beautiful, bright and friendly, Memphis"}, {"day": 4, "current_city": "Memphis", "transportation": "-", "breakfast": "Savannah Bar - Radisson Blu Plaza Delhi, Memphis", "attraction": "National Civil Rights Museum, Memphis;Graceland, Memphis;Memphis Zoo, Memphis", "lunch": "The Gathering Hut, Memphis", "dinner": "Hops n Grains, Memphis", "accommodation": "Beautiful, bright and friendly, Memphis"}, {"day": 5, "current_city": "from Memphis to Myrtle Beach", "transportation": "Self-driving, from Memphis to Myrtle Beach, duration: 11 hours 12 mins, distance: 1,199 km", "breakfast": "-", "attraction": "-", "lunch": "-", "dinner": "-", "accommodation": "-"}]}]