[{"gpt-4-1106-preview_direct_sole-planning_results": "Travel Plan:\n\nDays: 1\nCurrent City: from Charlotte to Pittsburgh\nTransportation: Self-driving, from Charlotte to Pittsburgh, duration: 6 hours 58 mins, distance: 720 km, cost: 36\nBreakfast: -\nAttraction: -\nLunch: -\nDinner: Beijing Cafe, Pittsburgh, cost: 33, cuisines: Desserts, Tea, Pizza, Mexican, Indian\nAccommodation: Sunny 1 BR Brooklyn Loft Apartment, Pittsburgh, cost: 60, room type: Entire home/apt, house rules: No visitors, minimum nights: 4, maximum occupancy: 2\n\nNumber of people: 1\nTotal cost: 36 + 33 + 60 = 129\nAccommodation minimum nights: 1/4\n\nDays: 2\nCurrent City: Pittsburgh\nTransportation: -\nBreakfast: Maharaja Bhog, Pittsburgh, cost: 52, cuisines: Cafe, Pizza\nAttraction: Pittsburgh Zoo & Aquarium, Pittsburgh; Phipps Conservatory and Botanical Gardens, Pittsburgh; The Andy Warhol Museum, Pittsburgh\nLunch: Burger Factory, Pittsburgh, cost: 44, cuisines: Cafe, Pizza, Italian, BBQ, Fast Food, Chinese\nDinner: Indus Flavour, Pittsburgh, cost: 67, cuisines: Tea, Italian, French, Bakery, Cafe, Seafood\nAccommodation: Sunny 1 BR Brooklyn Loft Apartment, Pittsburgh, cost: 60, room type: Entire home/apt, house rules: No visitors, minimum nights: 4, maximum occupancy: 2\n\nNumber of people: 1\nTotal cost: 52 + 44 + 67 + 60 = 223\nAccommodation minimum nights: 2/4\n\nDays: 3\nCurrent City: Pittsburgh\nTransportation: -\nBreakfast: Costa Coffee, Pittsburgh, cost: 21, cuisines: Tea, Cafe, Fast Food, Chinese, Indian, Seafood\nAttraction: Carnegie Museum of Art, Pittsburgh; The Frick Pittsburgh, Pittsburgh; Carnegie Science Center, Pittsburgh\nLunch: Embassy, Pittsburgh, cost: 97, cuisines: French, Bakery, Indian, Pizza\nDinner: The Urban Foundry, Pittsburgh, cost: 91, cuisines: Desserts, Tea, Pizza, Italian, Bakery, Indian\nAccommodation: Sunny 1 BR Brooklyn Loft Apartment, Pittsburgh, cost: 60, room type: Entire home/apt, house rules: No visitors, minimum nights: 4, maximum occupancy: 2\n\nNumber of people: 1\nTotal cost: 21 + 97 + 91 + 60 = 269\nAccommodation minimum nights: 3/4\n\nDays: 4\nCurrent City: from Pittsburgh to Erie\nTransportation: Self-driving, from Pittsburgh to Erie, duration: 1 hour 55 mins, distance: 206 km, cost: 10\nBreakfast: -\nAttraction: Erie Maritime Museum, Erie; Presque Isle State Park, Erie; expERIEnce Children's Museum, Erie\nLunch: Granite City Food & Brewery, Erie, cost: 55, cuisines: BBQ, Cafe, Indian, Desserts\nDinner: Chapter 1 Cafe, Erie, cost: 30, cuisines: French, BBQ, Fast Food, Cafe, American, Seafood\nAccommodation: Sunny, Open, East Harlem 1 bedroom, Erie, cost: 412, room type: Entire home/apt, house rules: No pets & No parties, minimum nights: 2, maximum occupancy: 4\n\nNumber of people: 1\nTotal cost: 10 + 55 + 30 + 412 = 507\nAccommodation minimum nights: 1/2\n\nDays: 5\nCurrent City: Erie\nTransportation: -\nBreakfast: Templo da Carne - Marcos Bassi, Erie, cost: 27, cuisines: Pizza, French, Bakery, Mediterranean, Seafood\nAttraction: Tom Ridge Environmental Center at Presque Isle State Park, Erie; Erie Zoo, Erie; Firefighters Historical Museum, Erie\nLunch: Kona Brewing Company, Erie, cost: 76, cuisines: Cafe, Mexican, Pizza, BBQ\nDinner: Kalsang AMA Cafe, Erie, cost: 58, cuisines: Chinese, Cafe, Seafood\nAccommodation: Sunny, Open, East Harlem 1 bedroom, Erie, cost: 412, room type: Entire home/apt, house rules: No pets & No parties, minimum nights: 2, maximum occupancy: 4\n\nNumber of people: 1\nTotal cost: 27 + 76 + 58 + 412 = 573\nAccommodation minimum nights: 2/2\n\nDays: 6\nCurrent City: from Erie to Philadelphia\nTransportation: Self-driving, from Erie to Philadelphia, duration: 6 hours 22 mins, distance: 678 km, cost: 33\nBreakfast: -\nAttraction: The Franklin Institute, Philadelphia; Independence National Historical Park, Philadelphia; Philadelphia's Magic Gardens, Philadelphia\nLunch: Red Ginger Sushi, Grill & Bar, Philadelphia, cost: 98, cuisines: Tea, Cafe, Indian, Fast Food\nDinner: The Moon Under Water, Philadelphia, cost: 94, cuisines: Pizza, Italian, BBQ, Bakery, Fast Food, Mediterranean\nAccommodation: Industrial Loft Living in NYC, Philadelphia, cost: 178, room type: Entire home/apt, house rules: No smoking, minimum nights: 4, maximum occupancy: 3\n\nNumber of people: 1\nTotal cost: 33 + 98 + 94 + 178 = 403\nAccommodation minimum nights: 1/4\n\nDays: 7\nCurrent City: from Philadelphia to Charlotte\nTransportation: Self-driving, from Philadelphia to Charlotte, duration: 8 hours 14 mins, distance: 876 km, cost: 43\nBreakfast: Hong Kong Cafe, Philadelphia, cost: 47, cuisines: Tea, Pizza, Italian, BBQ, Cafe\nAttraction: Philadelphia Museum of Art, Philadelphia; Liberty Bell, Philadelphia; Eastern State Penitentiary, Philadelphia\nLunch: Pind Balluchi, Philadelphia, cost: 44, cuisines: Desserts, Tea, French, Fast Food, Seafood\nDinner: -\nAccommodation: -\n\nNumber of people: 1\nTotal cost: 43 + 47 + 44 = 134\n\nTotal cost across all days: 129 + 223 + 269 + 507 + 573 + 403 + 134 = 2238\nCuisines: Variety including Indian, American, French, Italian, Chinese, Mexican, BBQ, Cafe, Seafood, Bakery, Mediterranean, Desserts, Tea, Fast Food\nVisiting cities: Pittsburgh, Erie, Philadelphia\n\nThe total cost of the travel plan is well within the allocated budget of $5,100.", "gpt-4-1106-preview_direct_sole-planning_parsed_results": [{"day": 1, "current_city": "from Charlotte to Pittsburgh", "transportation": "Self-driving, from Charlotte to Pittsburgh, duration: 6 hours 58 mins, distance: 720 km", "breakfast": "-", "attraction": "-", "lunch": "-", "dinner": "Beijing Cafe, Pittsburgh", "accommodation": "Sunny 1 BR Brooklyn Loft Apartment, Pittsburgh"}, {"day": 2, "current_city": "Pittsburgh", "transportation": "-", "breakfast": "Maharaja Bhog, Pittsburgh", "attraction": "Pittsburgh Zoo & Aquarium, Pittsburgh;Phipps Conservatory and Botanical Gardens, Pittsburgh;The Andy Warhol Museum, Pittsburgh;", "lunch": "Burger Factory, Pittsburgh", "dinner": "Indus Flavour, Pittsburgh", "accommodation": "Sunny 1 BR Brooklyn Loft Apartment, Pittsburgh"}, {"day": 3, "current_city": "Pittsburgh", "transportation": "-", "breakfast": "Costa Coffee, Pittsburgh", "attraction": "Carnegie Museum of Art, Pittsburgh;The Frick Pittsburgh, Pittsburgh;Carnegie Science Center, Pittsburgh;", "lunch": "Embassy, Pittsburgh", "dinner": "The Urban Foundry, Pittsburgh", "accommodation": "Sunny 1 BR Brooklyn Loft Apartment, Pittsburgh"}, {"day": 4, "current_city": "from Pittsburgh to Erie", "transportation": "Self-driving, from Pittsburgh to Erie, duration: 1 hour 55 mins, distance: 206 km", "breakfast": "-", "attraction": "Erie Maritime Museum, Erie;Presque Isle State Park, Erie;expERIEnce Children's Museum, Erie;", "lunch": "Granite City Food & Brewery, Erie", "dinner": "Chapter 1 Cafe, Erie", "accommodation": "Sunny, Open, East Harlem 1 bedroom, Erie"}, {"day": 5, "current_city": "Erie", "transportation": "-", "breakfast": "Templo da Carne - Marcos Bassi, Erie", "attraction": "Tom Ridge Environmental Center at Presque Isle State Park, Erie;Erie Zoo, Erie;Firefighters Historical Museum, Erie;", "lunch": "Kona Brewing Company, Erie", "dinner": "Kalsang AMA Cafe, Erie", "accommodation": "Sunny, Open, East Harlem 1 bedroom, Erie"}, {"day": 6, "current_city": "from Erie to Philadelphia", "transportation": "Self-driving, from Erie to Philadelphia, duration: 6 hours 22 mins, distance: 678 km", "breakfast": "-", "attraction": "The Franklin Institute, Philadelphia;Independence National Historical Park, Philadelphia;Philadelphia's Magic Gardens, Philadelphia;", "lunch": "Red Ginger Sushi, Grill & Bar, Philadelphia", "dinner": "The Moon Under Water, Philadelphia", "accommodation": "Industrial Loft Living in NYC, Philadelphia"}, {"day": 7, "current_city": "from Philadelphia to Charlotte", "transportation": "Self-driving, from Philadelphia to Charlotte, duration: 8 hours 14 mins, distance: 876 km", "breakfast": "Hong Kong Cafe, Philadelphia", "attraction": "Philadelphia Museum of Art, Philadelphia;Liberty Bell, Philadelphia;Eastern State Penitentiary, Philadelphia;", "lunch": "Pind Balluchi, Philadelphia", "dinner": "-", "accommodation": "-"}]}]