[{"gpt-4-1106-preview_direct_sole-planning_results": "Travel Plan:\nDays: 1\nCurrent City: from Pittsburgh to Baltimore\nTransportation: Self-driving, from Pittsburgh to Baltimore, duration: 3 hours 58 mins, distance: 400 km, cost: 20\nBreakfast: -\nAttraction: -\nLunch: -\nDinner: Los Pablos, Baltimore, cost: 47, cuisines: Indian, BBQ, Cafe, American, Seafood\nAccommodation: Contemporary Home Away from Home (Entire home/apt), Baltimore, cost: 290, maximum occupancy: 2, house rules: No visitors, minimum nights: 2\n\nNumber of people: 1\nTotal cost: 20 + 47 + 290 = 357\nAccommodation minimum nights: 1/2\n\nDays: 2\nCurrent City: Baltimore\nTransportation: -\nBreakfast: Mr. Dunderbak's Biergarten and Marketplatz, Baltimore, cost: 74, cuisines: Cafe, Pizza, American\nAttraction: National Aquarium, Baltimore; Fort McHenry National Monument and Historic Shrine, Baltimore; The Walters Art Museum, Baltimore\nLunch: The Thai Bowl, Baltimore, cost: 66, cuisines: BBQ, Pizza, Desserts, Italian\nDinner: Salt, Baltimore, cost: 56, cuisines: Tea, Bakery, Fast Food, Chinese, American\nAccommodation: Contemporary Home Away from Home (Entire home/apt), Baltimore, cost: 290, maximum occupancy: 2, house rules: No visitors, minimum nights: 2\n\nNumber of people: 1\nTotal cost: 74 + 66 + 56 + 290 = 486\nAccommodation minimum nights: 2/2\n\nDays: 3\nCurrent City: from Baltimore to Pittsburgh\nTransportation: Self-driving, from Baltimore to Pittsburgh, duration: 3 hours 58 mins, distance: 398 km, cost: 19\nBreakfast: Tresind - Nassima Royal Hotel, Baltimore, cost: 67, cuisines: Cafe, Pizza, American, Desserts\nAttraction: -\nLunch: -\nDinner: -\nAccommodation: -\n\nNumber of people: 1\nTotal cost: 19 + 67 = 86\n\nTotal cost across all days: 357 + 486 + 86 = 929\nCuisines: The prompt specifies a variety of cuisines, which have been included across the meals.\nTransportation: Self-driving has been used for both outbound and return trips, adhering to the constraint of not mixing transportation methods.\n\nPlease note that the accommodation has been booked for two nights as per the minimum stay requirement, and the cost has been accounted for in the total budget. The attractions listed for Day 2 are all located in Baltimore, ensuring consistency with the current city. The restaurants selected for each meal are unique and do not repeat across days. The total cost of the travel plan is within the specified budget of $1,200.", "gpt-4-1106-preview_direct_sole-planning_parsed_results": [{"day": 1, "current_city": "from Pittsburgh to Baltimore", "transportation": "Self-driving, from Pittsburgh to Baltimore, duration: 3 hours 58 mins, distance: 400 km", "breakfast": "-", "attraction": "-", "lunch": "-", "dinner": "Los Pablos, Baltimore", "accommodation": "Contemporary Home Away from Home, Baltimore"}, {"day": 2, "current_city": "Baltimore", "transportation": "-", "breakfast": "Mr. Dunderbak's Biergarten and Marketplatz, Baltimore", "attraction": "National Aquarium, Baltimore;Fort McHenry National Monument and Historic Shrine, Baltimore;The Walters Art Museum, Baltimore;", "lunch": "The Thai Bowl, Baltimore", "dinner": "Salt, Baltimore", "accommodation": "Contemporary Home Away from Home, Baltimore"}, {"day": 3, "current_city": "from Baltimore to Pittsburgh", "transportation": "Self-driving, from Baltimore to Pittsburgh, duration: 3 hours 58 mins, distance: 398 km", "breakfast": "Tresind - Nassima Royal Hotel, Baltimore", "attraction": "-", "lunch": "-", "dinner": "-", "accommodation": "-"}]}]