[{"gpt-4-1106-preview_direct_sole-planning_results": "Travel Plan:\n\nDays: 1\nCurrent City: from Albuquerque to Houston\nTransportation: Self-driving, from Albuquerque to Houston, duration: 12 hours 51 mins, distance: 1,422 km, cost: 71\nBreakfast: -\nAttraction: -\nLunch: -\nDinner: The BrewMaster - The Mix Fine Dine, Houston, cost: 52, cuisines: French, Indian, Cafe, Seafood\nAccommodation: Spacious room in front of prospect park (Private room), Houston, cost: 259, maximum occupancy: 1, house rules: No smoking, minimum nights: 1\n\nNumber of people: 2\nTotal cost: 71 + 52 * 2 + 259 = 434\nAccommodation minimum nights: 1/1\n\nDays: 2\nCurrent City: Houston\nTransportation: -\nBreakfast: Jalapenos, Houston, cost: 57, cuisines: Desserts, Tea, Cafe, Chinese, Seafood\nAttraction: Space Center Houston, Houston; Houston Museum of Natural Science, Houston; The Museum of Fine Arts, Houston\nLunch: Vinayaka Mylari, Houston, cost: 14, cuisines: Fast Food, French, Cafe, Italian\nDinner: Al Arabian Express, Houston, cost: 74, cuisines: BBQ, Desserts, Seafood\nAccommodation: Spacious room in front of prospect park (Private room), Houston, cost: 259, maximum occupancy: 1, house rules: No smoking, minimum nights: 1\n\nNumber of people: 2\nTotal cost: 57 + 14 + 74 + 259 = 404\nAccommodation minimum nights: 1/1\n\nDays: 3\nCurrent City: from Houston to San Antonio\nTransportation: Self-driving, from Houston to San Antonio, duration: 2 hours 56 mins, distance: 317 km, cost: 15\nBreakfast: Cyber Adda 24, Houston, cost: 73, cuisines: Chinese, Pizza, Bakery\nAttraction: San Antonio River Walk, San Antonio; The Alamo, San Antonio; San Antonio Botanical Garden, San Antonio\nLunch: Cafe Le Rue @ The Landings, San Antonio, cost: 19, cuisines: French, Mexican, Cafe, Seafood\nDinner: Martin's BBQ, San Antonio, cost: 71, cuisines: Tea, BBQ, Fast Food, Indian, Seafood\nAccommodation: Airy Brooklyn Limestone: 2 bedroom suite (Private room), San Antonio, cost: 603, maximum occupancy: 2, house rules: No visitors & No children under 10, minimum nights: 3\n\nNumber of people: 2\nTotal cost: 15 + 73 + 19 + 71 + 603 = 781\nAccommodation minimum nights: 1/3\n\nDays: 4\nCurrent City: San Antonio\nTransportation: -\nBreakfast: Sona Bakers, San Antonio, cost: 20, cuisines: Mexican, Bakery, Seafood\nAttraction: SeaWorld San Antonio, San Antonio; Six Flags Fiesta Texas, San Antonio; San Antonio Missions National Historical Park, San Antonio\nLunch: Pita Pit, San Antonio, cost: 36, cuisines: Pizza, French, Bakery, Cafe, Mediterranean\nDinner: Barbeque Nation, San Antonio, cost: 16, cuisines: Tea, Cafe, Fast Food, Chinese, American\nAccommodation: Airy Brooklyn Limestone: 2 bedroom suite (Private room), San Antonio, cost: 603, maximum occupancy: 2, house rules: No visitors & No children under 10, minimum nights: 3\n\nNumber of people: 2\nTotal cost: 20 + 36 + 16 + 603 = 675\nAccommodation minimum nights: 2/3\n\nDays: 5\nCurrent City: San Antonio\nTransportation: -\nBreakfast: My Kind Of Cafe, San Antonio, cost: 94, cuisines: Tea, Seafood, Bakery, Fast Food\nAttraction: Natural Bridge Caverns, San Antonio; Brackenridge Park, San Antonio; San Antonio Zoo, San Antonio\nLunch: The Kylin Experience - Holiday Inn, San Antonio, cost: 23, cuisines: Tea, Cafe, Pizza, Fast Food\nDinner: DEL - Roseate House, San Antonio, cost: 63, cuisines: Fast Food, French, Mexican, Seafood\nAccommodation: Airy Brooklyn Limestone: 2 bedroom suite (Private room), San Antonio, cost: 603, maximum occupancy: 2, house rules: No visitors & No children under 10, minimum nights: 3\n\nNumber of people: 2\nTotal cost: 94 + 23 + 63 + 603 = 783\nAccommodation minimum nights: 3/3\n\nDays: 6\nCurrent City: from San Antonio to Dallas\nTransportation: Self-driving, from San Antonio to Dallas, duration: 4 hours 4 mins, distance: 440 km, cost: 22\nBreakfast: Cafe Coffee Day, San Antonio, cost: 22, cuisines: Tea, BBQ, Desserts, Italian\nAttraction: The Dallas World Aquarium, Dallas; The Sixth Floor Museum at Dealey Plaza, Dallas; Dallas Museum of Art, Dallas\nLunch: Coconuts Fish Cafe, Dallas, cost: 38, cuisines: Cafe, BBQ, Mediterranean, Fast Food\nDinner: 1918 Bistro & Grill, Dallas, cost: 90, cuisines: Tea, Pizza, BBQ, Seafood\nAccommodation: Bright and modern apartment in Williamsburg! (Entire home/apt), Dallas, cost: 865, maximum occupancy: 5, house rules: No smoking, minimum nights: 6\n\nNumber of people: 2\nTotal cost: 22 + 22 + 38 + 90 + 865 = 1037\nAccommodation minimum nights: 1/6\n\nDays: 7\nCurrent City: from Dallas to Albuquerque\nTransportation: Self-driving, from Dallas to Albuquerque, duration: 9 hours 33 mins, distance: 1,045 km, cost: 52\nBreakfast: Cafe Gatherings, Dallas, cost: 17, cuisines: Bakery, Indian, Desserts\nAttraction: -\nLunch: -\nDinner: -\nAccommodation: -\n\nNumber of people: 2\nTotal cost: 52 + 17 * 2 = 86\n\nTotal cost across all days: 434 + 404 + 781 + 675 + 783 + 1037 + 86 = 4200\nCuisines: Various cuisines including French, Indian, Cafe, Seafood, Chinese, Mexican, Bakery, Tea, BBQ, Fast Food, American, Pizza, Mediterranean\nAccommodation: Private rooms and entire home/apt, with smoking allowed in some accommodations.\n\nPlease note that the accommodation in San Antonio has a minimum of 3 nights, so the itinerary includes 3 nights in San Antonio to meet this requirement. The accommodation in Dallas has a minimum of 6 nights, but due to the constraints of the travel dates and budget, the plan includes only 1 night in Dallas. The total cost is within the specified budget of $5,000.", "gpt-4-1106-preview_direct_sole-planning_parsed_results": [{"day": 1, "current_city": "from Albuquerque to Houston", "transportation": "Self-driving, from Albuquerque to Houston, duration: 12 hours 51 mins, distance: 1,422 km", "breakfast": "-", "attraction": "-", "lunch": "-", "dinner": "The BrewMaster - The Mix Fine Dine, Houston", "accommodation": "Spacious room in front of prospect park (Private room), Houston"}, {"day": 2, "current_city": "Houston", "transportation": "-", "breakfast": "Jalapenos, Houston", "attraction": "Space Center Houston, Houston;Houston Museum of Natural Science, Houston;The Museum of Fine Arts, Houston;", "lunch": "Vinayaka Mylari, Houston", "dinner": "Al Arabian Express, Houston", "accommodation": "Spacious room in front of prospect park (Private room), Houston"}, {"day": 3, "current_city": "from Houston to San Antonio", "transportation": "Self-driving, from Houston to San Antonio, duration: 2 hours 56 mins, distance: 317 km", "breakfast": "Cyber Adda 24, Houston", "attraction": "San Antonio River Walk, San Antonio;The Alamo, San Antonio;San Antonio Botanical Garden, San Antonio;", "lunch": "Cafe Le Rue @ The Landings, San Antonio", "dinner": "Martin's BBQ, San Antonio", "accommodation": "Airy Brooklyn Limestone: 2 bedroom suite (Private room), San Antonio"}, {"day": 4, "current_city": "San Antonio", "transportation": "-", "breakfast": "Sona Bakers, San Antonio", "attraction": "SeaWorld San Antonio, San Antonio;Six Flags Fiesta Texas, San Antonio;San Antonio Missions National Historical Park, San Antonio;", "lunch": "Pita Pit, San Antonio", "dinner": "Barbeque Nation, San Antonio", "accommodation": "Airy Brooklyn Limestone: 2 bedroom suite (Private room), San Antonio"}, {"day": 5, "current_city": "San Antonio", "transportation": "-", "breakfast": "My Kind Of Cafe, San Antonio", "attraction": "Natural Bridge Caverns, San Antonio;Brackenridge Park, San Antonio;San Antonio Zoo, San Antonio;", "lunch": "The Kylin Experience - Holiday Inn, San Antonio", "dinner": "DEL - Roseate House, San Antonio", "accommodation": "Airy Brooklyn Limestone: 2 bedroom suite (Private room), San Antonio"}, {"day": 6, "current_city": "from San Antonio to Dallas", "transportation": "Self-driving, from San Antonio to Dallas, duration: 4 hours 4 mins, distance: 440 km", "breakfast": "Cafe Coffee Day, San Antonio", "attraction": "The Dallas World Aquarium, Dallas;The Sixth Floor Museum at Dealey Plaza, Dallas;Dallas Museum of Art, Dallas;", "lunch": "Coconuts Fish Cafe, Dallas", "dinner": "1918 Bistro & Grill, Dallas", "accommodation": "Bright and modern apartment in Williamsburg! (Entire home/apt), Dallas"}, {"day": 7, "current_city": "from Dallas to Albuquerque", "transportation": "Self-driving, from Dallas to Albuquerque, duration: 9 hours 33 mins, distance: 1,045 km", "breakfast": "Cafe Gatherings, Dallas", "attraction": "-", "lunch": "-", "dinner": "-", "accommodation": "-"}]}]