[{"gpt-4-1106-preview_direct_sole-planning_results": "Travel Plan:\n\nDays: 1\nCurrent City: from Bloomington to Orlando\nTransportation: Flight F3563219, from Bloomington to Orlando, duration: 2 hours 42 minutes, cost: 302\nBreakfast: -\nAttraction: -\nLunch: -\nDinner: Fuji Japanese Steakhouse, Orlando, cost: 75, cuisines: Tea, Bakery, Desserts\nAccommodation: Private furnished bedroom in Williamsburg, Orlando, cost: 179, room type: Private room, house rules: No parties & No smoking & No children under 10, minimum nights: 5\n\nNumber of people: 4\nTotal cost: 302 * 4 + 75 * 4 + 179 * 4 = 1,208 + 300 + 716 = 2,224\nAccommodation minimum nights: 1/5\n\nDays: 2\nCurrent City: Orlando\nTransportation: -\nBreakfast: Turquoise Villa, Orlando, cost: 55, cuisines: French, Bakery, BBQ, Fast Food\nAttraction: SeaWorld Orlando; The Wheel at ICON Park; Universal Orlando Resort\nLunch: The Tandoori Times, Orlando, cost: 84, cuisines: Tea, Cafe, BBQ, Italian\nDinner: Indochi Cafe & Restaurant, Orlando, cost: 72, cuisines: Pizza, French, Bakery, Fast Food, Indian, Seafood\nAccommodation: Private furnished bedroom in Williamsburg, Orlando, cost: 179, room type: Private room, house rules: No parties & No smoking & No children under 10, minimum nights: 5\n\nNumber of people: 4\nTotal cost: 55 * 4 + 84 * 4 + 72 * 4 + 179 * 4 = 220 + 336 + 288 + 716 = 1,560\nAccommodation minimum nights: 2/5\n\nDays: 3\nCurrent City: from Orlando to Miami\nTransportation: Flight F3670393, from Orlando to Miami, duration: 1 hours 14 minutes, cost: 74\nBreakfast: Crust N Cakes, Orlando, cost: 61, cuisines: Tea, Cafe, Indian, BBQ\nAttraction: -\nLunch: -\nDinner: Clocked, Miami, cost: 49, cuisines: Tea, Italian, Mexican, BBQ, Cafe\nAccommodation: Simple and clean bedroom with good view and light, Miami, cost: 669, room type: Private room, house rules: No children under 10, minimum nights: 1\n\nNumber of people: 4\nTotal cost: 74 * 4 + 61 * 4 + 49 * 4 + 669 * 4 = 296 + 244 + 196 + 2,676 = 3,412\nAccommodation minimum nights: 1/1\n\nDays: 4\nCurrent City: Miami\nTransportation: -\nBreakfast: Papouli's Mediterranean Cafe & Market, Miami, cost: 26, cuisines: Tea, Desserts\nAttraction: Jungle Island; P\u00e9rez Art Museum Miami; Miami Seaquarium\nLunch: Tako Cheena by Pom Pom, Miami, cost: 60, cuisines: Fast Food, Indian, Desserts, Italian\nDinner: AB's Absolute Barbecues, Miami, cost: 55, cuisines: Desserts, Tea, Pizza, Italian, Fast Food, American\nAccommodation: Simple and clean bedroom with good view and light, Miami, cost: 669, room type: Private room, house rules: No children under 10, minimum nights: 1\n\nNumber of people: 4\nTotal cost: 26 * 4 + 60 * 4 + 55 * 4 + 669 * 4 = 104 + 240 + 220 + 2,676 = 3,240\nAccommodation minimum nights: 2/1\n\nDays: 5\nCurrent City: from Miami to Bloomington\nTransportation: Self-driving, from Miami to Bloomington, duration: 17 hours 1 min, distance: 1,897 km, cost: 94\nBreakfast: Shorts Burger and Shine, Miami, cost: 81, cuisines: Chinese, Cafe, Seafood\nAttraction: -\nLunch: -\nDinner: -\nAccommodation: -\n\nNumber of people: 4\nTotal cost: 94 * 4 + 81 * 4 = 376 + 324 = 700\n\nTotal cost across all days: 2,224 + 1,560 + 3,412 + 3,240 + 700 = 11,136\n\nCuisines: Various cuisines including Japanese, French, Italian, Indian, American, Chinese, and Seafood have been included in the plan.\n\nNote: The travel plan adheres to the constraints of pet-friendly accommodations, the budget of $15,900, and the requirement to visit two cities in Florida. The accommodations chosen are private rooms with pet-friendly house rules. The total cost of the travel plan is $11,136, which is within the specified budget.", "gpt-4-1106-preview_direct_sole-planning_parsed_results": [{"day": 1, "current_city": "from Bloomington to Orlando", "transportation": "Flight Number: F3563219, from Bloomington to Orlando, Departure Time: -, Arrival Time: -", "breakfast": "-", "attraction": "-", "lunch": "-", "dinner": "Fuji Japanese Steakhouse, Orlando", "accommodation": "Private furnished bedroom in Williamsburg, Orlando"}, {"day": 2, "current_city": "Orlando", "transportation": "-", "breakfast": "Turquoise Villa, Orlando", "attraction": "SeaWorld Orlando, Orlando;The Wheel at ICON Park, Orlando;Universal Orlando Resort, Orlando;", "lunch": "The Tandoori Times, Orlando", "dinner": "Indochi Cafe & Restaurant, Orlando", "accommodation": "Private furnished bedroom in Williamsburg, Orlando"}, {"day": 3, "current_city": "from Orlando to Miami", "transportation": "Flight Number: F3670393, from Orlando to Miami, Departure Time: -, Arrival Time: -", "breakfast": "Crust N Cakes, Orlando", "attraction": "-", "lunch": "-", "dinner": "Clocked, Miami", "accommodation": "Simple and clean bedroom with good view and light, Miami"}, {"day": 4, "current_city": "Miami", "transportation": "-", "breakfast": "Papouli's Mediterranean Cafe & Market, Miami", "attraction": "Jungle Island, Miami;P\u00e9rez Art Museum Miami, Miami;Miami Seaquarium, Miami;", "lunch": "Tako Cheena by Pom Pom, Miami", "dinner": "AB's Absolute Barbecues, Miami", "accommodation": "Simple and clean bedroom with good view and light, Miami"}, {"day": 5, "current_city": "from Miami to Bloomington", "transportation": "Self-driving, from Miami to Bloomington, Departure Time: -, Arrival Time: -", "breakfast": "Shorts Burger and Shine, Miami", "attraction": "-", "lunch": "-", "dinner": "-", "accommodation": "-"}]}]