[{"gpt-4-1106-preview_direct_sole-planning_results": "Travel Plan:\n\nDays: 1\nCurrent City: from Syracuse to Augusta\nTransportation: Self-driving, from Syracuse to Augusta, duration: 13 hours 17 mins, distance: 1,431 km, cost: 71\nBreakfast: -\nAttraction: -\nLunch: -\nDinner: The Charcoal Chimney, Augusta, cost: 86, cuisines: Tea, Fast Food, BBQ, Italian\nAccommodation: Bright and cozy bedroom in Williamsburg, Augusta, cost: 499, maximum occupancy: 2, house rules: No pets, minimum nights: 1\n\nNumber of people: 2\nTotal cost: 71 + 86 * 2 + 499 = 742\nAccommodation minimum nights: 1/1\n\nDays: 2\nCurrent City: Augusta\nTransportation: -\nBreakfast: B Merrell's, Augusta, cost: 74, cuisines: Tea, Pizza, Desserts, Fast Food\nAttraction: Phinizy Swamp Nature Park, Augusta; Augusta Museum of History, Augusta; Augusta Canal National Heritage Area, Augusta\nLunch: Vinny Vanucchi's, Augusta, cost: 45, cuisines: Desserts, Fast Food, Chinese, Indian, Seafood\nDinner: KB's Kulfi & Icecream, Augusta, cost: 92, cuisines: American, BBQ, Seafood\nAccommodation: Bright and cozy bedroom in Williamsburg, Augusta, cost: 499, maximum occupancy: 2, house rules: No pets, minimum nights: 1\n\nNumber of people: 2\nTotal cost: 74 + 45 + 92 * 2 + 499 = 802\nAccommodation minimum nights: 2/1\n\nDays: 3\nCurrent City: from Augusta to Decatur\nTransportation: Self-driving, from Augusta to Decatur, duration: 2 hours 19 mins, distance: 229 km, cost: 11\nBreakfast: Karari Kurry, Augusta, cost: 29, cuisines: Bakery, Indian, Cafe, Fast Food\nAttraction: Augusta Riverwalk, Augusta\nLunch: The Golden Dragon, Augusta, cost: 82, cuisines: Desserts, Pizza, Fast Food, Indian, Mediterranean, Seafood\nDinner: Cafe Coffee Day, Decatur, cost: 46, cuisines: Tea, Cafe, BBQ, Mediterranean\nAccommodation: Cozy Private Room, Decatur, cost: 69, maximum occupancy: 2, house rules: No children under 10 & No parties & No visitors, minimum nights: 2\n\nNumber of people: 2\nTotal cost: 11 + 29 + 82 + 46 * 2 + 69 = 283\nAccommodation minimum nights: 1/2\n\nDays: 4\nCurrent City: Decatur\nTransportation: -\nBreakfast: Madhuban Restaurant - Welcome Hotel Rama International, Decatur, cost: 47, cuisines: Pizza, Bakery, Seafood\nAttraction: DeKalb History Center Museum, Decatur; Glenlake Park, Decatur; Woodlands Garden, Decatur\nLunch: Joey's Pizza, Decatur, cost: 69, cuisines: Tea, Pizza, Bakery, Chinese, Seafood\nDinner: Dawat-E-Chaman, Decatur, cost: 42, cuisines: Chinese, BBQ, Fast Food, Cafe, Mediterranean\nAccommodation: Cozy Private Room, Decatur, cost: 69, maximum occupancy: 2, house rules: No children under 10 & No parties & No visitors, minimum nights: 2\n\nNumber of people: 2\nTotal cost: 47 + 69 + 42 * 2 + 69 = 269\nAccommodation minimum nights: 2/2\n\nDays: 5\nCurrent City: from Decatur to Syracuse\nTransportation: Self-driving, from Decatur to Syracuse, duration: 14 hours 26 mins, distance: 1,542 km, cost: 77\nBreakfast: Tandoori Hut, Decatur, cost: 82, cuisines: Pizza, American, Indian, Fast Food\nAttraction: -\nLunch: -\nDinner: -\nAccommodation: -\n\nNumber of people: 2\nTotal cost: 77 + 82 * 2 = 241\n\nTotal cost across all days: 742 + 802 + 283 + 269 + 241 = 2,337\n\nCuisines: The prompt specifies American and Mediterranean.\n\nPlease note that the total cost exceeds the specified budget of $2,000. Adjustments to the plan would be required to meet the budget constraint.", "gpt-4-1106-preview_direct_sole-planning_parsed_results": [{"day": 1, "current_city": "from Syracuse to Augusta", "transportation": "Self-driving, from Syracuse to Augusta, duration: 13 hours 17 mins, distance: 1,431 km", "breakfast": "-", "attraction": "-", "lunch": "-", "dinner": "The Charcoal Chimney, Augusta", "accommodation": "Bright and cozy bedroom in Williamsburg, Augusta"}, {"day": 2, "current_city": "Augusta", "transportation": "-", "breakfast": "B Merrell's, Augusta", "attraction": "Phinizy Swamp Nature Park, Augusta;Augusta Museum of History, Augusta;Augusta Canal National Heritage Area, Augusta;", "lunch": "Vinny Vanucchi's, Augusta", "dinner": "KB's Kulfi & Icecream, Augusta", "accommodation": "Bright and cozy bedroom in Williamsburg, Augusta"}, {"day": 3, "current_city": "from Augusta to Decatur", "transportation": "Self-driving, from Augusta to Decatur, duration: 2 hours 19 mins, distance: 229 km", "breakfast": "Karari Kurry, Augusta", "attraction": "Augusta Riverwalk, Augusta", "lunch": "The Golden Dragon, Augusta", "dinner": "Cafe Coffee Day, Decatur", "accommodation": "Cozy Private Room, Decatur"}, {"day": 4, "current_city": "Decatur", "transportation": "-", "breakfast": "Madhuban Restaurant - Welcome Hotel Rama International, Decatur", "attraction": "DeKalb History Center Museum, Decatur;Glenlake Park, Decatur;Woodlands Garden, Decatur;", "lunch": "Joey's Pizza, Decatur", "dinner": "Dawat-E-Chaman, Decatur", "accommodation": "Cozy Private Room, Decatur"}, {"day": 5, "current_city": "from Decatur to Syracuse", "transportation": "Self-driving, from Decatur to Syracuse, duration: 14 hours 26 mins, distance: 1,542 km", "breakfast": "Tandoori Hut, Decatur", "attraction": "-", "lunch": "-", "dinner": "-", "accommodation": "-"}]}]