[{"gpt-4-1106-preview_direct_sole-planning_results": "Travel Plan:\n\nDays: 1\nCurrent City: from Punta Gorda to Pellston\nTransportation: Self-driving, from Punta Gorda to Pellston, duration: 21 hours 40 mins, distance: 2,457 km, cost: 122\nBreakfast: -\nAttraction: -\nLunch: -\nDinner: -\nAccommodation: Beautiful apartment ~25min from Times Square (Entire home/apt), Pellston, cost: 571, house rules: No smoking & No visitors, minimum nights: 5, maximum occupancy: 5\n\nNumber of people: 3\nTotal cost: 122 + 571 = 693\nAccommodation minimum nights: 1/5\n\nDays: 2\nCurrent City: Pellston\nTransportation: -\nBreakfast: Johnnie Mars, Pellston, cost: 33, cuisines: Tea, Fast Food\nAttraction: Pellston Pioneer Park, Pellston; Pellston Historical Society Museum, Pellston\nLunch: Aroos Damascus, Pellston, cost: 44, cuisines: Desserts, Tea, Italian, Cafe, American\nDinner: Sagar Gaire Fast Food, Pellston, cost: 64, cuisines: Desserts, Tea, Pizza, Italian, BBQ, Mediterranean\nAccommodation: Beautiful apartment ~25min from Times Square (Entire home/apt), Pellston, cost: 571, house rules: No smoking & No visitors, minimum nights: 5, maximum occupancy: 5\n\nNumber of people: 3\nTotal cost: 33 + 44 + 64 + 571 = 712\nAccommodation minimum nights: 2/5\n\nDays: 3\nCurrent City: from Pellston to Traverse City\nTransportation: Self-driving, from Pellston to Traverse City, duration: 1 hour 49 mins, distance: 137 km, cost: 6\nBreakfast: Flame & Grill, Pellston, cost: 23, cuisines: Bakery, BBQ\nAttraction: -\nLunch: -\nDinner: Famous Dave's, Traverse City, cost: 39, cuisines: Desserts, Italian, BBQ, Fast Food, Indian\nAccommodation: Heart of Soho! Cute studio with clean finishes! (Entire home/apt), Traverse City, cost: 969, house rules: No parties, minimum nights: 4, maximum occupancy: 2\n\nNumber of people: 3\nTotal cost: 6 + 23 + 39 + 969 = 1037\nAccommodation minimum nights: 1/4\n\nDays: 4\nCurrent City: Traverse City\nTransportation: -\nBreakfast: Daily Eats, Traverse City, cost: 44, cuisines: Desserts, Seafood\nAttraction: Clinch Park, Traverse City; Great Lakes Children's Museum, Traverse City\nLunch: Arigato Sushi, Traverse City, cost: 96, cuisines: Desserts, Mexican, Bakery, BBQ, Fast Food, Mediterranean\nDinner: Tasty Bites, Traverse City, cost: 27, cuisines: Chinese, Bakery, Desserts, Seafood\nAccommodation: Heart of Soho! Cute studio with clean finishes! (Entire home/apt), Traverse City, cost: 969, house rules: No parties, minimum nights: 4, maximum occupancy: 2\n\nNumber of people: 3\nTotal cost: 44 + 96 + 27 + 969 = 1136\nAccommodation minimum nights: 2/4\n\nDays: 5\nCurrent City: from Traverse City to Alpena\nTransportation: Self-driving, from Traverse City to Alpena, duration: 2 hours 29 mins, distance: 204 km, cost: 10\nBreakfast: India on my Plate - Fortune Select Excalibur, Traverse City, cost: 53, cuisines: Tea, Chinese, Seafood\nAttraction: -\nLunch: -\nDinner: A & A Pagliai's Pizza, Alpena, cost: 72, cuisines: Tea, American, Fast Food\nAccommodation: Ultimate 50th Floor Downtown Penthouse - 4000SqFt (Entire home/apt), Alpena, cost: 1043, house rules: No smoking & No visitors & No children under 10, minimum nights: 2, maximum occupancy: 9\n\nNumber of people: 3\nTotal cost: 10 + 53 + 72 + 1043 = 1178\nAccommodation minimum nights: 1/2\n\nDays: 6\nCurrent City: Alpena\nTransportation: -\nBreakfast: @Mango, Alpena, cost: 38, cuisines: BBQ, Cafe, American, Desserts\nAttraction: Great Lakes Maritime Heritage Center, Alpena; Besser Museum for Northeast Michigan, Alpena\nLunch: Maplai, Alpena, cost: 63, cuisines: Tea, Indian, Bakery, Fast Food, American\nDinner: Zaffran - The Bristol Hotel, Alpena, cost: 33, cuisines: Pizza, Desserts, Seafood\nAccommodation: Ultimate 50th Floor Downtown Penthouse - 4000SqFt (Entire home/apt), Alpena, cost: 1043, house rules: No smoking & No visitors & No children under 10, minimum nights: 2, maximum occupancy: 9\n\nNumber of people: 3\nTotal cost: 38 + 63 + 33 + 1043 = 1177\nAccommodation minimum nights: 2/2\n\nDays: 7\nCurrent City: from Alpena to Punta Gorda\nTransportation: Self-driving, from Alpena to Punta Gorda, duration: 21 hours 39 mins, distance: 2,401 km, cost: 120\nBreakfast: -\nAttraction: -\nLunch: -\nDinner: -\nAccommodation: -\n\nNumber of people: 3\nTotal cost: 120\n\nTotal cost across all days: 693 + 712 + 1037 + 1136 + 1178 + 1177 + 120 = 6053\n\nUnfortunately, the total cost of $6053 exceeds the specified budget of $4400. Adjustments will need to be made to the plan to reduce costs, such as choosing less expensive accommodations or dining options.", "gpt-4-1106-preview_direct_sole-planning_parsed_results": [{"day": 1, "current_city": "from Punta Gorda to Pellston", "transportation": "Self-driving, from Punta Gorda to Pellston, duration: 21 hours 40 mins, distance: 2,457 km", "breakfast": "-", "attraction": "-", "lunch": "-", "dinner": "-", "accommodation": "Beautiful apartment ~25min from Times Square, Pellston"}, {"day": 2, "current_city": "Pellston", "transportation": "-", "breakfast": "Johnnie Mars, Pellston", "attraction": "Pellston Pioneer Park, Pellston;Pellston Historical Society Museum, Pellston", "lunch": "Aroos Damascus, Pellston", "dinner": "Sagar Gaire Fast Food, Pellston", "accommodation": "Beautiful apartment ~25min from Times Square, Pellston"}, {"day": 3, "current_city": "from Pellston to Traverse City", "transportation": "Self-driving, from Pellston to Traverse City, duration: 1 hour 49 mins, distance: 137 km", "breakfast": "Flame & Grill, Pellston", "attraction": "-", "lunch": "-", "dinner": "Famous Dave's, Traverse City", "accommodation": "Heart of Soho! Cute studio with clean finishes!, Traverse City"}, {"day": 4, "current_city": "Traverse City", "transportation": "-", "breakfast": "Daily Eats, Traverse City", "attraction": "Clinch Park, Traverse City;Great Lakes Children's Museum, Traverse City", "lunch": "Arigato Sushi, Traverse City", "dinner": "Tasty Bites, Traverse City", "accommodation": "Heart of Soho! Cute studio with clean finishes!, Traverse City"}, {"day": 5, "current_city": "from Traverse City to Alpena", "transportation": "Self-driving, from Traverse City to Alpena, duration: 2 hours 29 mins, distance: 204 km", "breakfast": "India on my Plate - Fortune Select Excalibur, Traverse City", "attraction": "-", "lunch": "-", "dinner": "A & A Pagliai's Pizza, Alpena", "accommodation": "Ultimate 50th Floor Downtown Penthouse - 4000SqFt, Alpena"}, {"day": 6, "current_city": "Alpena", "transportation": "-", "breakfast": "@Mango, Alpena", "attraction": "Great Lakes Maritime Heritage Center, Alpena;Besser Museum for Northeast Michigan, Alpena", "lunch": "Maplai, Alpena", "dinner": "Zaffran - The Bristol Hotel, Alpena", "accommodation": "Ultimate 50th Floor Downtown Penthouse - 4000SqFt, Alpena"}, {"day": 7, "current_city": "from Alpena to Punta Gorda", "transportation": "Self-driving, from Alpena to Punta Gorda, duration: 21 hours 39 mins, distance: 2,401 km", "breakfast": "-", "attraction": "-", "lunch": "-", "dinner": "-", "accommodation": "-"}]}]