[{"gpt-4-1106-preview_direct_sole-planning_results": "Travel Plan:\n\nDays: 1\nCurrent City: from Miami to Dallas\nTransportation: Flight F3677538, from Miami to Dallas, duration: 2 hours 53 minutes, cost: 346\nBreakfast: -\nAttraction: -\nLunch: -\nDinner: Coconuts Fish Cafe, Dallas, cost: 38, cuisines: Cafe, BBQ, Mediterranean, Fast Food\nAccommodation: Luxury Williamsburg duplex, private roof terrace, Dallas, cost: 241, maximum occupancy: 3, house rules: No visitors, minimum nights: 1\n\nNumber of people: 3\nTotal cost: 346 * 3 + 38 * 3 + 241 = 1,387\nAccommodation minimum nights: 1/1\n\nDays: 2\nCurrent City: Dallas\nTransportation: -\nBreakfast: Cafe Gatherings, Dallas, cost: 17, cuisines: Bakery, Indian, Desserts\nAttraction: The Dallas World Aquarium, Dallas; The Sixth Floor Museum at Dealey Plaza, Dallas; Reunion Tower, Dallas\nLunch: 1918 Bistro & Grill, Dallas, cost: 90, cuisines: Tea, Pizza, BBQ, Seafood\nDinner: Yanki Sizzlers, Dallas, cost: 96, cuisines: Cafe, French, Tea, Mediterranean\nAccommodation: Luxury Williamsburg duplex, private roof terrace, Dallas, cost: 241, maximum occupancy: 3, house rules: No visitors, minimum nights: 1\n\nNumber of people: 3\nTotal cost: 17 * 3 + 90 * 3 + 96 * 3 + 241 = 1,008\nAccommodation minimum nights: 1/1\n\nDays: 3\nCurrent City: from Dallas to Houston\nTransportation: Flight F3718944, from Dallas to Houston, duration: 1 hours 17 minutes, cost: 77\nBreakfast: Aravali Owls, Dallas, cost: 53, cuisines: Pizza, Italian, Bakery, Fast Food, Cafe\nAttraction: -\nLunch: -\nDinner: The BrewMaster - The Mix Fine Dine, Houston, cost: 52, cuisines: French, Indian, Cafe, Seafood\nAccommodation: Sunny and Airy near Manhattan, Houston, cost: 499, maximum occupancy: 4, house rules: No pets, minimum nights: 1\n\nNumber of people: 3\nTotal cost: 77 * 3 + 53 * 3 + 52 * 3 + 499 = 1,155\nAccommodation minimum nights: 1/1\n\nDays: 4\nCurrent City: Houston\nTransportation: -\nBreakfast: Jalapenos, Houston, cost: 57, cuisines: Desserts, Tea, Cafe, Chinese, Seafood\nAttraction: Downtown Aquarium, Houston; Space Center Houston, Houston; Water Wall, Houston\nLunch: Vinayaka Mylari, Houston, cost: 14, cuisines: Fast Food, French, Cafe, Italian\nDinner: Al Arabian Express, Houston, cost: 74, cuisines: BBQ, Desserts, Seafood\nAccommodation: Sunny and Airy near Manhattan, Houston, cost: 499, maximum occupancy: 4, house rules: No pets, minimum nights: 1\n\nNumber of people: 3\nTotal cost: 57 * 3 + 14 * 3 + 74 * 3 + 499 = 1,008\nAccommodation minimum nights: 1/1\n\nDays: 5\nCurrent City: from Houston to Miami\nTransportation: Flight F3658491, from Houston to Miami, duration: 2 hours 18 minutes, cost: 290\nBreakfast: Super Bakery, Houston, cost: 30, cuisines: Seafood, Fast Food\nAttraction: -\nLunch: -\nDinner: -\nAccommodation: -\n\nNumber of people: 3\nTotal cost: 290 * 3 + 30 * 3 = 960\n\nTotal cost across all days: 1,387 + 1,008 + 1,155 + 1,008 + 960 = 5,518\n\nCuisines: The prompt specifies Indian and Mediterranean.\n\nPlease note that the costs for attractions and some meals are not included in the total cost as they were not provided in the reference information. The total cost is within the specified budget of $8,500. The accommodations selected are for the entire home or private rooms, as per the preference for privacy. The travel plan includes a variety of Indian and Mediterranean cuisines as requested.", "gpt-4-1106-preview_direct_sole-planning_parsed_results": [{"day": 1, "current_city": "from Miami to Dallas", "transportation": "Flight Number: F3677538, from Miami to Dallas, Departure Time: -, Arrival Time: -", "breakfast": "-", "attraction": "-", "lunch": "-", "dinner": "Coconuts Fish Cafe, Dallas", "accommodation": "Luxury Williamsburg duplex, private roof terrace, Dallas"}, {"day": 2, "current_city": "Dallas", "transportation": "-", "breakfast": "Cafe Gatherings, Dallas", "attraction": "The Dallas World Aquarium, Dallas;The Sixth Floor Museum at Dealey Plaza, Dallas;Reunion Tower, Dallas;", "lunch": "1918 Bistro & Grill, Dallas", "dinner": "Yanki Sizzlers, Dallas", "accommodation": "Luxury Williamsburg duplex, private roof terrace, Dallas"}, {"day": 3, "current_city": "from Dallas to Houston", "transportation": "Flight Number: F3718944, from Dallas to Houston, Departure Time: -, Arrival Time: -", "breakfast": "Aravali Owls, Dallas", "attraction": "-", "lunch": "-", "dinner": "The BrewMaster - The Mix Fine Dine, Houston", "accommodation": "Sunny and Airy near Manhattan, Houston"}, {"day": 4, "current_city": "Houston", "transportation": "-", "breakfast": "Jalapenos, Houston", "attraction": "Downtown Aquarium, Houston;Space Center Houston, Houston;Water Wall, Houston;", "lunch": "Vinayaka Mylari, Houston", "dinner": "Al Arabian Express, Houston", "accommodation": "Sunny and Airy near Manhattan, Houston"}, {"day": 5, "current_city": "from Houston to Miami", "transportation": "Flight Number: F3658491, from Houston to Miami, Departure Time: -, Arrival Time: -", "breakfast": "Super Bakery, Houston", "attraction": "-", "lunch": "-", "dinner": "-", "accommodation": "-"}]}]