[{"gpt-4-1106-preview_direct_sole-planning_results": "Travel Plan:\n\nDays: 1\nCurrent City: from Albuquerque to Houston\nTransportation: Flight F3884406, from Albuquerque to Houston, duration: 1 hours 54 minutes, cost: 153\nBreakfast: -\nAttraction: -\nLunch: -\nDinner: The BrewMaster - The Mix Fine Dine, Houston, cost: 52, cuisines: French, Indian, Cafe, Seafood\nAccommodation: Spacious room in front of prospect park (private room), Houston, cost: 259, maximum occupancy: 1, house rules: No smoking, minimum nights: 1\n\nNumber of people: 1\nTotal cost: 153 + 52 + 259 = 464\n\nDays: 2\nCurrent City: Houston\nTransportation: -\nBreakfast: Jalapenos, Houston, cost: 57, cuisines: Desserts, Tea, Cafe, Chinese, Seafood\nAttraction: Space Center Houston, Houston; Houston Museum of Natural Science, Houston; Houston Zoo, Houston\nLunch: Sheetla Dhaba, Houston, cost: 35, cuisines: Desserts, Pizza, Bakery, American, Mediterranean\nDinner: Al Arabian Express, Houston, cost: 74, cuisines: BBQ, Desserts, Seafood\nAccommodation: Spacious room in front of prospect park (private room), Houston, cost: 259, maximum occupancy: 1, house rules: No smoking, minimum nights: 1\n\nNumber of people: 1\nTotal cost: 57 + 35 + 74 + 259 = 425\n\nDays: 3\nCurrent City: from Houston to Dallas\nTransportation: Flight F3723636, from Houston to Dallas, duration: 0 hours 54 minutes, cost: 62\nBreakfast: Vinayaka Mylari, Houston, cost: 14, cuisines: Fast Food, French, Cafe, Italian\nAttraction: The Dallas World Aquarium, Dallas; The Sixth Floor Museum at Dealey Plaza, Dallas; Reunion Tower, Dallas\nLunch: Coconuts Fish Cafe, Dallas, cost: 38, cuisines: Cafe, BBQ, Mediterranean, Fast Food\nDinner: 1918 Bistro & Grill, Dallas, cost: 90, cuisines: Tea, Pizza, BBQ, Seafood\nAccommodation: E. W'burg Private Room near subway (private room), Dallas, cost: 272, maximum occupancy: 2, house rules: No visitors & No smoking, minimum nights: 1\n\nNumber of people: 1\nTotal cost: 62 + 14 + 38 + 90 + 272 = 476\n\nDays: 4\nCurrent City: Dallas\nTransportation: -\nBreakfast: Cafe Gatherings, Dallas, cost: 17, cuisines: Bakery, Indian, Desserts\nAttraction: Dallas Museum of Art, Dallas; The Dallas Arboretum and Botanical Garden, Dallas; Dallas Zoo, Dallas\nLunch: Drifters Cafe, Dallas, cost: 21, cuisines: Tea, French, Mexican, Cafe, Seafood\nDinner: Belfrance Luxury Chocolates, Dallas, cost: 96, cuisines: Desserts, Pizza, Fast Food, Cafe, American\nAccommodation: E. W'burg Private Room near subway (private room), Dallas, cost: 272, maximum occupancy: 2, house rules: No visitors & No smoking, minimum nights: 1\n\nNumber of people: 1\nTotal cost: 17 + 21 + 96 + 272 = 406\n\nDays: 5\nCurrent City: from Dallas to Albuquerque\nTransportation: Flight F3960534, from Dallas to Albuquerque, duration: 1 hours 41 minutes, cost: 120\nBreakfast: MONKS, Dallas, cost: 24, cuisines: Tea, Pizza, Cafe, Mediterranean, Seafood\nAttraction: -\nLunch: -\nDinner: -\nAccommodation: -\n\nNumber of people: 1\nTotal cost: 120 + 24 = 144\n\nTotal cost across all days: 464 + 425 + 476 + 406 + 144 = 1,915\n\nCuisines: The prompt specifies a variety of cuisines, which have been included across different meals.\n\nNote: All attractions, restaurants, and accommodations are chosen based on the provided reference information and within the specified budget. The travel plan includes private accommodations, adheres to pet-friendly house rules, and offers a variety of cuisines. The city sequence forms a closed loop, starting and ending in Albuquerque, and includes two Texas cities, Houston and Dallas, without repeating any city in the sequence except for the starting and ending city. The transportation modes are consistent and do not conflict with each other. The total cost does not exceed the specified budget of $2,100.", "gpt-4-1106-preview_direct_sole-planning_parsed_results": [{"day": 1, "current_city": "from Albuquerque to Houston", "transportation": "Flight Number: F3884406, from Albuquerque to Houston, Departure Time: -, Arrival Time: -", "breakfast": "-", "attraction": "-", "lunch": "-", "dinner": "The BrewMaster - The Mix Fine Dine, Houston", "accommodation": "Spacious room in front of prospect park (private room), Houston"}, {"day": 2, "current_city": "Houston", "transportation": "-", "breakfast": "Jalapenos, Houston", "attraction": "Space Center Houston, Houston;Houston Museum of Natural Science, Houston;Houston Zoo, Houston;", "lunch": "Sheetla Dhaba, Houston", "dinner": "Al Arabian Express, Houston", "accommodation": "Spacious room in front of prospect park (private room), Houston"}, {"day": 3, "current_city": "from Houston to Dallas", "transportation": "Flight Number: F3723636, from Houston to Dallas, Departure Time: -, Arrival Time: -", "breakfast": "Vinayaka Mylari, Houston", "attraction": "The Dallas World Aquarium, Dallas;The Sixth Floor Museum at Dealey Plaza, Dallas;Reunion Tower, Dallas;", "lunch": "Coconuts Fish Cafe, Dallas", "dinner": "1918 Bistro & Grill, Dallas", "accommodation": "E. W'burg Private Room near subway (private room), Dallas"}, {"day": 4, "current_city": "Dallas", "transportation": "-", "breakfast": "Cafe Gatherings, Dallas", "attraction": "Dallas Museum of Art, Dallas;The Dallas Arboretum and Botanical Garden, Dallas;Dallas Zoo, Dallas;", "lunch": "Drifters Cafe, Dallas", "dinner": "Belfrance Luxury Chocolates, Dallas", "accommodation": "E. W'burg Private Room near subway (private room), Dallas"}, {"day": 5, "current_city": "from Dallas to Albuquerque", "transportation": "Flight Number: F3960534, from Dallas to Albuquerque, Departure Time: -, Arrival Time: -", "breakfast": "MONKS, Dallas", "attraction": "-", "lunch": "-", "dinner": "-", "accommodation": "-"}]}]