[{"gpt-4-1106-preview_direct_sole-planning_results": "Travel Plan:\n\nDays: 1\nCurrent City: from Salt Lake City to Abilene\nTransportation: Self-driving, from Salt Lake City to Abilene, duration: 16 hours 59 mins, distance: 1,740 km, cost: 87 * 8 = 696\nBreakfast: -\nAttraction: -\nLunch: -\nDinner: Thai Garden, Abilene, cost: 13 * 8 = 104, cuisines: Cafe, American, Desserts\nAccommodation: Apartment minutes from manhattan, Abilene, cost: 295 * 8 = 2360, room type: Entire home/apt, house rules: No pets & No visitors, minimum nights: 2, maximum occupancy: 2\n\nNumber of people: 8\nTotal cost: 696 + 104 + 2360 = 3160\nAccommodation minimum nights: 1/2\n\nDays: 2\nCurrent City: Abilene\nTransportation: -\nBreakfast: Cakes Degree, Abilene, cost: 18 * 8 = 144, cuisines: Cafe, Mexican, BBQ, Desserts\nAttraction: The Grace Museum, Abilene; Frontier Texas!, Abilene; Abilene Zoo, Abilene\nLunch: Crispy Crust, Abilene, cost: 54 * 8 = 432, cuisines: Desserts, Bakery, Cafe, American, Seafood\nDinner: LPK Waterfront, Abilene, cost: 61 * 8 = 488, cuisines: Pizza, Italian, BBQ, Fast Food, Seafood\nAccommodation: Apartment minutes from manhattan, Abilene, cost: 295 * 8 = 2360, room type: Entire home/apt, house rules: No pets & No visitors, minimum nights: 2, maximum occupancy: 2\n\nNumber of people: 8\nTotal cost: 144 + 432 + 488 + 2360 = 3424\nAccommodation minimum nights: 2/2\n\nDays: 3\nCurrent City: from Abilene to Amarillo\nTransportation: Self-driving, from Abilene to Amarillo, duration: 4 hours 10 mins, distance: 446 km, cost: 22 * 8 = 176\nBreakfast: Biryani Express, Abilene, cost: 11 * 8 = 88, cuisines: Tea, Pizza, French, Bakery, Fast Food\nAttraction: -\nLunch: -\nDinner: The Cinnamon Kitchen, Amarillo, cost: 69 * 8 = 552, cuisines: Desserts, Tea, Pizza, Chinese, Seafood\nAccommodation: Gramercy Park restful, cozy, sun-filled home, Amarillo, cost: 968 * 8 = 7744, room type: Entire home/apt, house rules: No parties, minimum nights: 2, maximum occupancy: 8\n\nNumber of people: 8\nTotal cost: 176 + 88 + 552 + 7744 = 8560\nAccommodation minimum nights: 1/2\n\nDays: 4\nCurrent City: Amarillo\nTransportation: -\nBreakfast: Wood Box Cafe, Amarillo, cost: 11 * 8 = 88, cuisines: Desserts, French, Fast Food, Cafe, American\nAttraction: Cadillac Ranch, Amarillo; Amarillo Botanical Gardens, Amarillo; Amarillo Zoo, Amarillo\nLunch: Anand Restaurant, Amarillo, cost: 53 * 8 = 424, cuisines: Fast Food, Seafood, Desserts, Italian\nDinner: Punjabi Chaap Corner, Amarillo, cost: 62 * 8 = 496, cuisines: Desserts, Pizza, Italian, Bakery, Fast Food\nAccommodation: Gramercy Park restful, cozy, sun-filled home, Amarillo, cost: 968 * 8 = 7744, room type: Entire home/apt, house rules: No parties, minimum nights: 2, maximum occupancy: 8\n\nNumber of people: 8\nTotal cost: 88 + 424 + 496 + 7744 = 8752\nAccommodation minimum nights: 2/2\n\nDays: 5\nCurrent City: from Amarillo to Salt Lake City\nTransportation: Self-driving, from Amarillo to Salt Lake City, duration: 13 hours 45 mins, distance: 1,419 km, cost: 70 * 8 = 560\nBreakfast: Cafe Coffee Day, Amarillo, cost: 15 * 8 = 120, cuisines: Tea, Bakery, American\nAttraction: -\nLunch: -\nDinner: -\nAccommodation: -\n\nNumber of people: 8\nTotal cost: 560 + 120 = 680\n\nTotal cost across all days: 3160 + 3424 + 8560 + 8752 + 680 = 24576\n\nCuisines: The prompt specifies a variety of cuisines, which have been included in the meals.\n\nPlease note that the total cost exceeds the specified budget of $12,000. Adjustments to the accommodations or transportation methods may be necessary to meet the budget constraints.", "gpt-4-1106-preview_direct_sole-planning_parsed_results": [{"day": 1, "current_city": "from Salt Lake City to Abilene", "transportation": "Self-driving, from Salt Lake City to Abilene, duration: 16 hours 59 mins, distance: 1,740 km", "breakfast": "-", "attraction": "-", "lunch": "-", "dinner": "Thai Garden, Abilene", "accommodation": "Apartment minutes from manhattan, Abilene"}, {"day": 2, "current_city": "Abilene", "transportation": "-", "breakfast": "Cakes Degree, Abilene", "attraction": "The Grace Museum, Abilene; Frontier Texas!, Abilene; Abilene Zoo, Abilene", "lunch": "Crispy Crust, Abilene", "dinner": "LPK Waterfront, Abilene", "accommodation": "Apartment minutes from manhattan, Abilene"}, {"day": 3, "current_city": "from Abilene to Amarillo", "transportation": "Self-driving, from Abilene to Amarillo, duration: 4 hours 10 mins, distance: 446 km", "breakfast": "Biryani Express, Abilene", "attraction": "-", "lunch": "-", "dinner": "The Cinnamon Kitchen, Amarillo", "accommodation": "Gramercy Park restful, cozy, sun-filled home, Amarillo"}, {"day": 4, "current_city": "Amarillo", "transportation": "-", "breakfast": "Wood Box Cafe, Amarillo", "attraction": "Cadillac Ranch, Amarillo; Amarillo Botanical Gardens, Amarillo; Amarillo Zoo, Amarillo", "lunch": "Anand Restaurant, Amarillo", "dinner": "Punjabi Chaap Corner, Amarillo", "accommodation": "Gramercy Park restful, cozy, sun-filled home, Amarillo"}, {"day": 5, "current_city": "from Amarillo to Salt Lake City", "transportation": "Self-driving, from Amarillo to Salt Lake City, duration: 13 hours 45 mins, distance: 1,419 km", "breakfast": "Cafe Coffee Day, Amarillo", "attraction": "-", "lunch": "-", "dinner": "-", "accommodation": "-"}]}]