[{"gpt-4-1106-preview_direct_sole-planning_results": "Travel Plan:\n\nDays: 1\nCurrent City: from New York to Reno\nTransportation: Flight F3767722, from New York to Reno, departure: 21:02, arrival: 00:07, duration: 6 hours 5 minutes, distance: 2411 km, cost: 1200\nBreakfast: -\nAttraction: -\nLunch: -\nDinner: -\nAccommodation: A bright, beautiful treehouse, Reno, cost: 361, room type: Entire home/apt, maximum occupancy: 2, house rules: No visitors, minimum nights: 2\n\nNumber of people: 4\nTotal cost: 1200 * 4 + 361 * 2 = 4800 + 722 = 5522\nAccommodation minimum nights: 1/2\n\nDays: 2\nCurrent City: Reno\nTransportation: -\nBreakfast: Kanha Sweets, Reno, cost: 28, cuisines: Italian, Bakery, Fast Food, Cafe, American\nAttraction: Nevada Museum of Art, Reno; The Discovery, Reno; National Automobile Museum, Reno\nLunch: Leme Light, Reno, cost: 55, cuisines: Cafe, Mexican, Fast Food\nDinner: Queens Cakes, Reno, cost: 58, cuisines: Bakery, Desserts, Indian, BBQ\nAccommodation: A bright, beautiful treehouse, Reno, cost: 361, room type: Entire home/apt, maximum occupancy: 2, house rules: No visitors, minimum nights: 2\n\nNumber of people: 4\nTotal cost: 28 + 55 + 58 * 4 + 361 * 2 = 141 + 220 + 722 = 1083\nAccommodation minimum nights: 2/2\n\nDays: 3\nCurrent City: Reno\nTransportation: -\nBreakfast: Indian Gourmet, Reno, cost: 16, cuisines: Tea, Fast Food, American, Seafood\nAttraction: Fleischmann Planetarium, Reno; Rancho San Rafael Regional Park, Reno\nLunch: Olive Bistro, Reno, cost: 66, cuisines: Tea, Cafe, Pizza, BBQ\nDinner: Mustake Multicuisine Restaurant, Reno, cost: 91, cuisines: Tea, Bakery, Pizza, Mediterranean\nAccommodation: -\n\nNumber of people: 4\nTotal cost: 16 + 66 + 91 * 4 = 82 + 656 = 738\n\nTotal cost across all days: 5522 + 1083 + 738 = 7343\nCuisines: Various cuisines including Italian, American, Mexican, Indian, and BBQ.\n\nNote: The accommodation \"A bright, beautiful treehouse\" has been booked for two nights to meet the minimum stay requirement and is suitable for children under 10. The total cost of the trip is within the specified budget of $11,300.", "gpt-4-1106-preview_direct_sole-planning_parsed_results": [{"day": 1, "current_city": "from New York to Reno", "transportation": "Flight Number: F3767722, from New York to Reno, Departure Time: 21:02, Arrival Time: 00:07", "breakfast": "-", "attraction": "-", "lunch": "-", "dinner": "-", "accommodation": "A bright, beautiful treehouse, Reno"}, {"day": 2, "current_city": "Reno", "transportation": "-", "breakfast": "Kanha Sweets, Reno", "attraction": "Nevada Museum of Art, Reno;The Discovery, Reno;National Automobile Museum, Reno;", "lunch": "Leme Light, Reno", "dinner": "Queens Cakes, Reno", "accommodation": "A bright, beautiful treehouse, Reno"}, {"day": 3, "current_city": "Reno", "transportation": "-", "breakfast": "Indian Gourmet, Reno", "attraction": "Fleischmann Planetarium, Reno;Rancho San Rafael Regional Park, Reno;", "lunch": "Olive Bistro, Reno", "dinner": "Mustake Multicuisine Restaurant, Reno", "accommodation": "-"}]}]