[{"gpt-4-1106-preview_direct_sole-planning_results": "Travel Plan:\nDays: 1\nCurrent City: from Spokane to San Francisco\nTransportation: Flight F3853330, from Spokane to San Francisco, duration: 2 hours 28 minutes, cost: 227\nBreakfast: -\nAttraction: -\nLunch: -\nDinner: Tokyo Sushi, San Francisco, cost: 18, cuisines: Cafe, Pizza, BBQ\nAccommodation: Room in Down town Brooklyn Parkslop (Private room), San Francisco, cost: 79, maximum occupancy: 2, house rules: No visitors, minimum nights: 1\n\nNumber of people: 1\nTotal cost: 227 + 18 + 79 = 324\nAccommodation minimum nights: 1/1\n\nDays: 2\nCurrent City: San Francisco\nTransportation: -\nBreakfast: Coffee & Chai Co., San Francisco, cost: 10, cuisines: Tea, Mexican, BBQ, Cafe, Seafood\nAttraction: Golden Gate Bridge, San Francisco; Golden Gate Park, San Francisco; PIER 39, San Francisco\nLunch: Bonne Bouche, San Francisco, cost: 21, cuisines: Tea, Chinese, American, Cafe\nDinner: Zaika, San Francisco, cost: 57, cuisines: Desserts, BBQ, Bakery, Indian, Mediterranean\nAccommodation: Room in Down town Brooklyn Parkslop (Private room), San Francisco, cost: 79, maximum occupancy: 2, house rules: No visitors, minimum nights: 1\n\nNumber of people: 1\nTotal cost: 10 + 21 + 57 + 79 = 167\nAccommodation minimum nights: 1/1\n\nDays: 3\nCurrent City: from San Francisco to Spokane\nTransportation: Flight F3840215, from San Francisco to Spokane, duration: 2 hours 8 minutes, cost: 343\nBreakfast: Uncle Da Dhabha, San Francisco, cost: 60, cuisines: Seafood, Bakery, Fast Food\nAttraction: -\nLunch: -\nDinner: -\nAccommodation: -\n\nNumber of people: 1\nTotal cost: 343 + 60 = 403\n\nTotal cost across all days: 324 + 167 + 403 = 894\nCuisines: Various cuisines including Cafe, Pizza, BBQ, Tea, Mexican, Chinese, American, Desserts, Indian, Mediterranean, Seafood, Bakery, Fast Food\n\nNote: The travel plan includes a variety of cuisines and ensures that the accommodation is private as per the query. Attractions are listed for the full day in San Francisco, and the transportation modes are flights as per the available data. The total cost is within the budget of $1,200.", "gpt-4-1106-preview_direct_sole-planning_parsed_results": [{"day": 1, "current_city": "from Spokane to San Francisco", "transportation": "Flight Number: F3853330, from Spokane to San Francisco, Departure Time: -, Arrival Time: -", "breakfast": "-", "attraction": "-", "lunch": "-", "dinner": "Tokyo Sushi, San Francisco", "accommodation": "Room in Down town Brooklyn Parkslop (Private room), San Francisco"}, {"day": 2, "current_city": "San Francisco", "transportation": "-", "breakfast": "Coffee & Chai Co., San Francisco", "attraction": "Golden Gate Bridge, San Francisco;Golden Gate Park, San Francisco;PIER 39, San Francisco;", "lunch": "Bonne Bouche, San Francisco", "dinner": "Zaika, San Francisco", "accommodation": "Room in Down town Brooklyn Parkslop (Private room), San Francisco"}, {"day": 3, "current_city": "from San Francisco to Spokane", "transportation": "Flight Number: F3840215, from San Francisco to Spokane, Departure Time: -, Arrival Time: -", "breakfast": "Uncle Da Dhabha, San Francisco", "attraction": "-", "lunch": "-", "dinner": "-", "accommodation": "-"}]}]