[{"gpt-4-1106-preview_direct_sole-planning_results": "Travel Plan:\n\nDays: 1\nCurrent City: from Boston to Syracuse\nTransportation: Self-driving, from Boston to Syracuse, duration: 4 hours 43 mins, distance: 502 km, cost: $25\nBreakfast: -\nAttraction: -\nLunch: -\nDinner: Silantro Fil-Mex, Syracuse, cost: $29, cuisines: Chinese, BBQ, Mediterranean, Fast Food\nAccommodation: Nice Room, Syracuse, cost: $564, room type: Private room, house rules: No smoking, minimum nights: 2, maximum occupancy: 2\n\nNumber of people: 2\nTotal cost: $25 + $29 * 2 + $564 = $647\nAccommodation minimum nights: 1/2\n\nDays: 2\nCurrent City: Syracuse\nTransportation: -\nBreakfast: Cafe Coffee Day, Syracuse, cost: $16, cuisines: Tea, Cafe, BBQ\nAttraction: Erie Canal Museum, Syracuse; Rosamond Gifford Zoo, Syracuse; Museum of Science & Technology, Syracuse\nLunch: Tucanos, Syracuse, cost: $36, cuisines: Pizza, BBQ, Desserts\nDinner: Raj Restaurant, Syracuse, cost: $61, cuisines: French, Bakery, Indian, BBQ\nAccommodation: Nice Room, Syracuse, cost: $564, room type: Private room, house rules: No smoking, minimum nights: 2, maximum occupancy: 2\n\nNumber of people: 2\nTotal cost: $16 + $36 + $61 * 2 + $564 = $788\nAccommodation minimum nights: 2/2\n\nDays: 3\nCurrent City: from Syracuse to New York\nTransportation: Self-driving, from Syracuse to New York, duration: 4 hours 4 mins, distance: 397 km, cost: $19\nBreakfast: Darjeeling Kanchanjanga Momos, Syracuse, cost: $100, cuisines: Tea, Italian, BBQ, Indian, Seafood\nAttraction: -\nLunch: -\nDinner: Seasons 52 Fresh Grill, New York, cost: $30, cuisines: Seafood, Indian, Desserts, Italian\nAccommodation: Beautiful and big 1BR sublet close by Central Park, New York, cost: $983, room type: Private room, house rules: No parties & No children under 10, minimum nights: 5, maximum occupancy: 2\n\nNumber of people: 2\nTotal cost: $19 + $100 + $30 * 2 + $983 = $1,162\nAccommodation minimum nights: 1/5\n\nDays: 4\nCurrent City: New York\nTransportation: -\nBreakfast: Gurgaon Hights, New York, cost: $46, cuisines: Cafe, American, Indian, Fast Food\nAttraction: Top of The Rock, New York; One World Observatory, New York; The High Line, New York\nLunch: Lord of the Drinks Forum, New York, cost: $71, cuisines: Cafe, Bakery, BBQ, Chinese, Indian\nDinner: QD's Restaurant, New York, cost: $93, cuisines: Tea, Desserts, Indian, BBQ\nAccommodation: Beautiful and big 1BR sublet close by Central Park, New York, cost: $983, room type: Private room, house rules: No parties & No children under 10, minimum nights: 5, maximum occupancy: 2\n\nNumber of people: 2\nTotal cost: $46 + $71 + $93 * 2 + $983 = $1,386\nAccommodation minimum nights: 2/5\n\nDays: 5\nCurrent City: from New York to Boston\nTransportation: Self-driving, from New York to Boston, duration: 3 hours 41 mins, distance: 346 km, cost: $17\nBreakfast: -\nAttraction: -\nLunch: -\nDinner: -\nAccommodation: -\n\nNumber of people: 2\nTotal cost: $17\n\nTotal cost across all days: $647 + $788 + $1,162 + $1,386 + $17 = $4,000\n\nUnfortunately, the total cost of the travel plan exceeds the specified budget of $2,700. Adjustments will need to be made to the plan to reduce costs. This could include selecting more budget-friendly accommodations, reducing meal costs, or altering the itinerary to visit fewer attractions.", "gpt-4-1106-preview_direct_sole-planning_parsed_results": [{"day": 1, "current_city": "from Boston to Syracuse", "transportation": "Self-driving, from Boston to Syracuse, duration: 4 hours 43 mins, distance: 502 km", "breakfast": "-", "attraction": "-", "lunch": "-", "dinner": "Silantro Fil-Mex, Syracuse", "accommodation": "Nice Room, Syracuse"}, {"day": 2, "current_city": "Syracuse", "transportation": "-", "breakfast": "Cafe Coffee Day, Syracuse", "attraction": "Erie Canal Museum, Syracuse;Rosamond Gifford Zoo, Syracuse;Museum of Science & Technology, Syracuse;", "lunch": "Tucanos, Syracuse", "dinner": "Raj Restaurant, Syracuse", "accommodation": "Nice Room, Syracuse"}, {"day": 3, "current_city": "from Syracuse to New York", "transportation": "Self-driving, from Syracuse to New York, duration: 4 hours 4 mins, distance: 397 km", "breakfast": "Darjeeling Kanchanjanga Momos, Syracuse", "attraction": "-", "lunch": "-", "dinner": "Seasons 52 Fresh Grill, New York", "accommodation": "Beautiful and big 1BR sublet close by Central Park, New York"}, {"day": 4, "current_city": "New York", "transportation": "-", "breakfast": "Gurgaon Hights, New York", "attraction": "Top of The Rock, New York;One World Observatory, New York;The High Line, New York;", "lunch": "Lord of the Drinks Forum, New York", "dinner": "QD's Restaurant, New York", "accommodation": "Beautiful and big 1BR sublet close by Central Park, New York"}, {"day": 5, "current_city": "from New York to Boston", "transportation": "Self-driving, from New York to Boston, duration: 3 hours 41 mins, distance: 346 km", "breakfast": "-", "attraction": "-", "lunch": "-", "dinner": "-", "accommodation": "-"}]}]