[{"gpt-4-1106-preview_direct_sole-planning_results": "Travel Plan:\n\nDays: 1\nCurrent City: from Monterey to Dallas\nTransportation: Flight F4046679, from Monterey to Dallas, duration: 3 hours 16 minutes, cost: 489\nBreakfast: -\nAttraction: -\nLunch: -\nDinner: L'Opera, Dallas, cost: 77, cuisines: French, Bakery, BBQ, Fast Food, Seafood\nAccommodation: Luxury Williamsburg duplex, private roof terrace, Dallas, cost: 241, maximum occupancy: 3, house rules: No visitors, minimum nights: 4\n\nNumber of people: 4\nTotal cost: 489 * 4 + 77 * 4 + 241 = 2,525\nAccommodation minimum nights: 1/4\n\nDays: 2\nCurrent City: Dallas\nTransportation: -\nBreakfast: Cafe Gatherings, Dallas, cost: 17, cuisines: Bakery, Indian, Desserts\nAttraction: The Dallas World Aquarium, Dallas; The Sixth Floor Museum at Dealey Plaza, Dallas; Reunion Tower, Dallas\nLunch: 1918 Bistro & Grill, Dallas, cost: 90, cuisines: Tea, Pizza, BBQ, Seafood\nDinner: Yanki Sizzlers, Dallas, cost: 96, cuisines: Cafe, French, Tea, Mediterranean\nAccommodation: Luxury Williamsburg duplex, private roof terrace, Dallas, cost: 241, maximum occupancy: 3, house rules: No visitors, minimum nights: 4\n\nNumber of people: 4\nTotal cost: 17 * 4 + 90 * 4 + 96 * 4 + 241 = 1,153\nAccommodation minimum nights: 2/4\n\nDays: 3\nCurrent City: Dallas\nTransportation: -\nBreakfast: Coconuts Fish Cafe, Dallas, cost: 38, cuisines: Cafe, BBQ, Mediterranean, Fast Food\nAttraction: Dallas Museum of Art, Dallas; The Dallas Arboretum and Botanical Garden, Dallas; Klyde Warren Park, Dallas\nLunch: Delhicacy, Dallas, cost: 67, cuisines: Desserts, Mexican, Bakery, Chinese, Seafood\nDinner: Firefly India, Dallas, cost: 87, cuisines: Cafe, Bakery, American, Italian\nAccommodation: Luxury Williamsburg duplex, private roof terrace, Dallas, cost: 241, maximum occupancy: 3, house rules: No visitors, minimum nights: 4\n\nNumber of people: 4\nTotal cost: 38 * 4 + 67 * 4 + 87 * 4 + 241 = 1,153\nAccommodation minimum nights: 3/4\n\nDays: 4\nCurrent City: from Dallas to Del Rio\nTransportation: Self-driving, from Dallas to Del Rio, duration: 6 hours 21 mins, distance: 668 km, cost: 33\nBreakfast: -\nAttraction: -\nLunch: -\nDinner: Pizzoccheri, Del Rio, cost: 77, cuisines: Cafe, Seafood, Mediterranean, Italian\nAccommodation: Spacious Brooklyn One Bedroom/Loft***Morgan L Stop, Del Rio, cost: 1164, maximum occupancy: 4, house rules: No visitors, minimum nights: 4\n\nNumber of people: 4\nTotal cost: 33 * 4 + 77 * 4 + 1164 = 1,804\nAccommodation minimum nights: 1/4\n\nDays: 5\nCurrent City: Del Rio\nTransportation: -\nBreakfast: Green Chick Chop, Del Rio, cost: 82, cuisines: Tea, Bakery, Indian, Mediterranean, Seafood\nAttraction: Whitehead Memorial Museum, Del Rio; Amistad National Recreation Area, Del Rio; Devils River State Natural Area, Del Rio\nLunch: Jom Jom Malay, Del Rio, cost: 78, cuisines: Chinese, Indian, Desserts, Fast Food\nDinner: Locale, Del Rio, cost: 43, cuisines: Desserts, Pizza, Fast Food, Chinese, American, Seafood\nAccommodation: Spacious Brooklyn One Bedroom/Loft***Morgan L Stop, Del Rio, cost: 1164, maximum occupancy: 4, house rules: No visitors, minimum nights: 4\n\nNumber of people: 4\nTotal cost: 82 * 4 + 78 * 4 + 43 * 4 + 1164 = 1,804\nAccommodation minimum nights: 2/4\n\nDays: 6\nCurrent City: from Del Rio to Amarillo\nTransportation: Self-driving, from Del Rio to Amarillo, duration: 7 hours 0 mins, distance: 754 km, cost: 37\nBreakfast: -\nAttraction: -\nLunch: -\nDinner: Anand Restaurant, Amarillo, cost: 53, cuisines: Fast Food, Seafood, Desserts, Italian\nAccommodation: Harlem Humble Abode - 1 bedroom - Cute and Quaint, Amarillo, cost: 409, maximum occupancy: 3, house rules: No pets, minimum nights: 5\n\nNumber of people: 4\nTotal cost: 37 * 4 + 53 * 4 + 409 = 1,073\nAccommodation minimum nights: 1/5\n\nDays: 7\nCurrent City: from Amarillo to Monterey\nTransportation: Self-driving, from Amarillo to Monterey, duration: 19 hours 21 mins, distance: 2,104 km, cost: 105\nBreakfast: -\nAttraction: -\nLunch: -\nDinner: -\nAccommodation: -\n\nNumber of people: 4\nTotal cost: 105 * 4 = 420\n\nTotal cost across all days: 2,525 + 1,153 + 1,153 + 1,804 + 1,804 + 1,073 + 420 = 9,932\n\nCuisines: The prompt specifies French and Chinese.\n\nNote: The accommodation in Dallas is booked for 4 nights to meet the minimum stay requirement, and the accommodation in Del Rio is booked for 4 nights as well. The accommodation in Amarillo is booked for 1 night, and the last day is spent traveling back to Monterey. The total cost is within the specified budget of $15,600.", "gpt-4-1106-preview_direct_sole-planning_parsed_results": [{"day": 1, "current_city": "from Monterey to Dallas", "transportation": "Flight Number: F4046679, from Monterey to Dallas, Departure Time: -, Arrival Time: -", "breakfast": "-", "attraction": "-", "lunch": "-", "dinner": "L'Opera, Dallas", "accommodation": "Luxury Williamsburg duplex, private roof terrace, Dallas"}, {"day": 2, "current_city": "Dallas", "transportation": "-", "breakfast": "Cafe Gatherings, Dallas", "attraction": "The Dallas World Aquarium, Dallas;The Sixth Floor Museum at Dealey Plaza, Dallas;Reunion Tower, Dallas", "lunch": "1918 Bistro & Grill, Dallas", "dinner": "Yanki Sizzlers, Dallas", "accommodation": "Luxury Williamsburg duplex, private roof terrace, Dallas"}, {"day": 3, "current_city": "Dallas", "transportation": "-", "breakfast": "Coconuts Fish Cafe, Dallas", "attraction": "Dallas Museum of Art, Dallas;The Dallas Arboretum and Botanical Garden, Dallas;Klyde Warren Park, Dallas", "lunch": "Delhicacy, Dallas", "dinner": "Firefly India, Dallas", "accommodation": "Luxury Williamsburg duplex, private roof terrace, Dallas"}, {"day": 4, "current_city": "from Dallas to Del Rio", "transportation": "Self-driving, from Dallas to Del Rio, Departure Time: -, Arrival Time: -", "breakfast": "-", "attraction": "-", "lunch": "-", "dinner": "Pizzoccheri, Del Rio", "accommodation": "Spacious Brooklyn One Bedroom/Loft***Morgan L Stop, Del Rio"}, {"day": 5, "current_city": "Del Rio", "transportation": "-", "breakfast": "Green Chick Chop, Del Rio", "attraction": "Whitehead Memorial Museum, Del Rio;Amistad National Recreation Area, Del Rio;Devils River State Natural Area, Del Rio", "lunch": "Jom Jom Malay, Del Rio", "dinner": "Locale, Del Rio", "accommodation": "Spacious Brooklyn One Bedroom/Loft***Morgan L Stop, Del Rio"}, {"day": 6, "current_city": "from Del Rio to Amarillo", "transportation": "Self-driving, from Del Rio to Amarillo, Departure Time: -, Arrival Time: -", "breakfast": "-", "attraction": "-", "lunch": "-", "dinner": "Anand Restaurant, Amarillo", "accommodation": "Harlem Humble Abode - 1 bedroom - Cute and Quaint, Amarillo"}, {"day": 7, "current_city": "from Amarillo to Monterey", "transportation": "Self-driving, from Amarillo to Monterey, Departure Time: -, Arrival Time: -", "breakfast": "-", "attraction": "-", "lunch": "-", "dinner": "-", "accommodation": "-"}]}]