[{"gpt-4-1106-preview_direct_sole-planning_results": "Travel Plan:\n\nDays: 1\nCurrent City: from Chicago to Boise\nTransportation: Flight F3857813, from Chicago to Boise, duration: 4 hours 3 minutes, cost: 311\nBreakfast: -\nAttraction: -\nLunch: -\nDinner: Gopala Hari, Boise, cost: 28, cuisines: Tea, Pizza, Italian, Fast Food, Mediterranean, Seafood\nAccommodation: Modern & Cozy 2 BR Private Apartment in Brooklyn, Boise, cost: 843, maximum occupancy: 7, house rules: No children under 10\n\nNumber of people: 8\nTotal cost: 311 * 8 + 28 * 8 + 843 * 2 = 5,072\nAccommodation minimum nights: 1/1\n\nDays: 2\nCurrent City: Boise\nTransportation: -\nBreakfast: Domino's Pizza, Boise, cost: 25, cuisines: Pizza, Italian, BBQ, Fast Food, Mediterranean\nAttraction: Zoo Boise, Boise; Idaho Botanical Garden, Boise; Old Idaho Penitentiary Site, Boise\nLunch: California Pizza Kitchen, Boise, cost: 15, cuisines: Tea, BBQ, Fast Food, Chinese, Indian\nDinner: Dhaba By Claridges, Boise, cost: 65, cuisines: Desserts, Italian, Fast Food, Chinese, Seafood\nAccommodation: Modern & Cozy 2 BR Private Apartment in Brooklyn, Boise, cost: 843, maximum occupancy: 7, house rules: No children under 10\n\nNumber of people: 8\nTotal cost: 25 * 8 + 15 * 8 + 65 * 8 + 843 * 2 = 2,736\nAccommodation minimum nights: 2/2\n\nDays: 3\nCurrent City: from Boise to Pocatello\nTransportation: Self-driving, from Boise to Pocatello, duration: 3 hours 25 mins, distance: 378 km, cost: 18\nBreakfast: Gopala Hari, Boise, cost: 28, cuisines: Tea, Pizza, Italian, Fast Food, Mediterranean, Seafood\nAttraction: -\nLunch: -\nDinner: Deorio's, Pocatello, cost: 59, cuisines: Tea, Bakery, Fast Food, Mediterranean, Seafood\nAccommodation: Entire Modern Studio Apartment/Prime Location, Pocatello, cost: 1109, maximum occupancy: 5, house rules: No parties & No smoking\n\nNumber of people: 8\nTotal cost: 18 * 8 + 28 * 8 + 59 * 8 + 1109 * 2 = 3,072\nAccommodation minimum nights: 1/1\n\nDays: 4\nCurrent City: Pocatello\nTransportation: -\nBreakfast: Harvest Moon, Pocatello, cost: 90, cuisines: Pizza, Fast Food\nAttraction: Idaho Museum of Natural History, Pocatello; Museum of Clean, Pocatello; Zoo Idaho, Pocatello\nLunch: 650 - The Global Kitchen, Pocatello, cost: 83, cuisines: French, Bakery, Cafe\nDinner: Oriental Kitchen Express, Pocatello, cost: 36, cuisines: Cafe, Bakery, Desserts\nAccommodation: Entire Modern Studio Apartment/Prime Location, Pocatello, cost: 1109, maximum occupancy: 5, house rules: No parties & No smoking\n\nNumber of people: 8\nTotal cost: 90 * 8 + 83 * 8 + 36 * 8 + 1109 * 2 = 3,416\nAccommodation minimum nights: 2/2\n\nDays: 5\nCurrent City: from Pocatello to Idaho Falls\nTransportation: Self-driving, from Pocatello to Idaho Falls, duration: 51 mins, distance: 83.6 km, cost: 4\nBreakfast: Ghar Ki Handi, Pocatello, cost: 13, cuisines: Cafe, Bakery, American, Fast Food\nAttraction: -\nLunch: -\nDinner: Karim's, Idaho Falls, cost: 58, cuisines: Tea, Pizza, BBQ, Cafe, Indian\nAccommodation: Sunny & Spacious 2 bdrm apt, Idaho Falls, cost: 914, maximum occupancy: 9, house rules: No smoking\n\nNumber of people: 8\nTotal cost: 4 * 8 + 13 * 8 + 58 * 8 + 914 * 2 = 2,072\nAccommodation minimum nights: 1/1\n\nDays: 6\nCurrent City: Idaho Falls\nTransportation: -\nBreakfast: Shiv Restaurant, Idaho Falls, cost: 42, cuisines: Bakery, Mexican, Pizza, Desserts\nAttraction: Museum of Idaho, Idaho Falls; The Art Museum Of Eastern Idaho, Idaho Falls; Idaho Falls River Walk - Greenbelt Trail, Idaho Falls\nLunch: Taste of China, Idaho Falls, cost: 19, cuisines: French, Bakery, Fast Food, Indian, Seafood\nDinner: Dhuaan, Idaho Falls, cost: 97, cuisines: Tea, Pizza, Mexican, BBQ, Fast Food, American\nAccommodation: Sunny & Spacious 2 bdrm apt, Idaho Falls, cost: 914, maximum occupancy: 9, house rules: No smoking\n\nNumber of people: 8\nTotal cost: 42 * 8 + 19 * 8 + 97 * 8 + 914 * 2 = 2,648\nAccommodation minimum nights: 2/2\n\nDays: 7\nCurrent City: from Idaho Falls to Chicago\nTransportation: Self-driving, from Idaho Falls to Chicago, duration: 21 hours 43 mins, distance: 2,369 km, cost: 118\nBreakfast: -\nAttraction: -\nLunch: -\nDinner: -\nAccommodation: -\n\nNumber of people: 8\nTotal cost: 118 * 8 = 944\n\nTotal cost across all days: 5,072 + 2,736 + 3,072 + 3,416 + 2,072 + 2,648 + 944 = 19,960\nCuisines: The prompt specifies Italian and Chinese.\n\nPlease note that the accommodation costs are calculated based on the maximum occupancy and the number of rooms required for 8 travelers. The total cost is within the specified budget of $22,200.", "gpt-4-1106-preview_direct_sole-planning_parsed_results": [{"day": 1, "current_city": "from Chicago to Boise", "transportation": "Flight Number: F3857813, from Chicago to Boise, Departure Time: -, Arrival Time: -", "breakfast": "-", "attraction": "-", "lunch": "-", "dinner": "Gopala Hari, Boise", "accommodation": "Modern & Cozy 2 BR Private Apartment in Brooklyn, Boise"}, {"day": 2, "current_city": "Boise", "transportation": "-", "breakfast": "Domino's Pizza, Boise", "attraction": "Zoo Boise, Boise;Idaho Botanical Garden, Boise;Old Idaho Penitentiary Site, Boise;", "lunch": "California Pizza Kitchen, Boise", "dinner": "Dhaba By Claridges, Boise", "accommodation": "Modern & Cozy 2 BR Private Apartment in Brooklyn, Boise"}, {"day": 3, "current_city": "from Boise to Pocatello", "transportation": "Self-driving, from Boise to Pocatello, Departure Time: -, Arrival Time: -", "breakfast": "Gopala Hari, Boise", "attraction": "-", "lunch": "-", "dinner": "Deorio's, Pocatello", "accommodation": "Entire Modern Studio Apartment/Prime Location, Pocatello"}, {"day": 4, "current_city": "Pocatello", "transportation": "-", "breakfast": "Harvest Moon, Pocatello", "attraction": "Idaho Museum of Natural History, Pocatello;Museum of Clean, Pocatello;Zoo Idaho, Pocatello;", "lunch": "650 - The Global Kitchen, Pocatello", "dinner": "Oriental Kitchen Express, Pocatello", "accommodation": "Entire Modern Studio Apartment/Prime Location, Pocatello"}, {"day": 5, "current_city": "from Pocatello to Idaho Falls", "transportation": "Self-driving, from Pocatello to Idaho Falls, Departure Time: -, Arrival Time: -", "breakfast": "Ghar Ki Handi, Pocatello", "attraction": "-", "lunch": "-", "dinner": "Karim's, Idaho Falls", "accommodation": "Sunny & Spacious 2 bdrm apt, Idaho Falls"}, {"day": 6, "current_city": "Idaho Falls", "transportation": "-", "breakfast": "Shiv Restaurant, Idaho Falls", "attraction": "Museum of Idaho, Idaho Falls;The Art Museum Of Eastern Idaho, Idaho Falls;Idaho Falls River Walk - Greenbelt Trail, Idaho Falls;", "lunch": "Taste of China, Idaho Falls", "dinner": "Dhuaan, Idaho Falls", "accommodation": "Sunny & Spacious 2 bdrm apt, Idaho Falls"}, {"day": 7, "current_city": "from Idaho Falls to Chicago", "transportation": "Self-driving, from Idaho Falls to Chicago, Departure Time: -, Arrival Time: -", "breakfast": "-", "attraction": "-", "lunch": "-", "dinner": "-", "accommodation": "-"}]}]