[{"gpt-4-1106-preview_direct_sole-planning_results": "Travel Plan:\n\nDays: 1\nCurrent City: from Elmira to Detroit\nTransportation: Self-driving, from Elmira to Detroit, duration: 7 hours 7 mins, distance: 764 km, cost: 38\nBreakfast: -\nAttraction: -\nLunch: -\nDinner: Vapour Pub & Brewery, Detroit, cost: 80, cuisines: French, BBQ, Fast Food, Cafe, Seafood\nAccommodation: Cozy 1 bedroom in the heart of Fort Greene (entire home/apt), Detroit, cost: 751, maximum occupancy: 6, house rules: No pets & No parties, minimum nights: 3\n\nNumber of people: 2\nTotal cost: 38 + 80 * 2 + 751 = 949\nAccommodation minimum nights: 1/3\n\nDays: 2\nCurrent City: Detroit\nTransportation: -\nBreakfast: Southern Bliss Bakery, Detroit, cost: 28, cuisines: Tea, BBQ, Desserts, Seafood\nAttraction: Detroit Institute of Arts, Detroit; Detroit Historical Museum, Detroit; Campus Martius Park, Detroit\nLunch: Chye Seng Huat Hardware, Detroit, cost: 94, cuisines: Tea, Mexican, Seafood\nDinner: Mitalis Kitchen, Detroit, cost: 28, cuisines: Pizza, BBQ, Chinese, Mediterranean, Seafood\nAccommodation: Cozy 1 bedroom in the heart of Fort Greene (entire home/apt), Detroit, cost: 751, maximum occupancy: 6, house rules: No pets & No parties, minimum nights: 3\n\nNumber of people: 2\nTotal cost: 28 + 94 + 28 * 2 + 751 = 929\nAccommodation minimum nights: 2/3\n\nDays: 3\nCurrent City: Detroit\nTransportation: -\nBreakfast: Cafe And More, Detroit, cost: 41, cuisines: Tea, Bakery, Italian\nAttraction: Motown Museum, Detroit; Detroit Zoo, Detroit; Michigan Science Center, Detroit\nLunch: Old Kheer Shop, Detroit, cost: 54, cuisines: Mexican, Indian, Desserts, Fast Food\nDinner: Turquoise Turkish Ice-cream, Detroit, cost: 79, cuisines: Fast Food, Tea, Desserts, Italian\nAccommodation: Cozy 1 bedroom in the heart of Fort Greene (entire home/apt), Detroit, cost: 751, maximum occupancy: 6, house rules: No pets & No parties, minimum nights: 3\n\nNumber of people: 2\nTotal cost: 41 + 54 + 79 * 2 + 751 = 1004\nAccommodation minimum nights: 3/3\n\nTotal cost across all days: 949 + 929 + 1004 = 2882\n\nUnfortunately, the total cost exceeds the specified budget of $2,200. To adjust the plan to fit the budget, we need to make some changes:\n\n- We can switch the accommodation to \"Lovely, charming and clean bedroom in Manhattan\" which is pet-friendly and costs $69 per night. This will significantly reduce the accommodation costs.\n\nRevised Travel Plan with Adjusted Accommodation:\n\nDays: 1\nAccommodation: Lovely, charming and clean bedroom in Manhattan (private room), Detroit, cost: 69, maximum occupancy: 2, house rules: No smoking, minimum nights: 1\n\nDays: 2\nAccommodation: Lovely, charming and clean bedroom in Manhattan (private room), Detroit, cost: 69, maximum occupancy: 2, house rules: No smoking, minimum nights: 1\n\nDays: 3\nAccommodation: Lovely, charming and clean bedroom in Manhattan (private room), Detroit, cost: 69, maximum occupancy: 2, house rules: No smoking, minimum nights: 1\n\nRevised Total Costs:\nDays 1: 38 + 80 * 2 + 69 = 267\nDays 2: 28 + 94 + 28 * 2 + 69 = 247\nDays 3: 41 + 54 + 79 * 2 + 69 = 322\n\nRevised Total cost across all days: 267 + 247 + 322 = 836\n\nThe revised total cost of $836 is well within the budget of $2,200, and all other constraints have been met.", "gpt-4-1106-preview_direct_sole-planning_parsed_results": [{"day": 1, "current_city": "from Elmira to Detroit", "transportation": "Self-driving, from Elmira to Detroit, duration: 7 hours 7 mins, distance: 764 km", "breakfast": "-", "attraction": "-", "lunch": "-", "dinner": "Vapour Pub & Brewery, Detroit", "accommodation": "Lovely, charming and clean bedroom in Manhattan, Detroit"}, {"day": 2, "current_city": "Detroit", "transportation": "-", "breakfast": "Southern Bliss Bakery, Detroit", "attraction": "Detroit Institute of Arts, Detroit;Detroit Historical Museum, Detroit;Campus Martius Park, Detroit", "lunch": "Chye Seng Huat Hardware, Detroit", "dinner": "Mitalis Kitchen, Detroit", "accommodation": "Lovely, charming and clean bedroom in Manhattan, Detroit"}, {"day": 3, "current_city": "Detroit", "transportation": "-", "breakfast": "Cafe And More, Detroit", "attraction": "Motown Museum, Detroit;Detroit Zoo, Detroit;Michigan Science Center, Detroit", "lunch": "Old Kheer Shop, Detroit", "dinner": "Turquoise Turkish Ice-cream, Detroit", "accommodation": "Lovely, charming and clean bedroom in Manhattan, Detroit"}]}]