[{"gpt-4-1106-preview_direct_sole-planning_results": "Travel Plan:\n\nDays: 1\nCurrent City: from Washington to Buffalo\nTransportation: Flight F3791094, from Washington to Buffalo, duration: 1 hour 29 minutes, cost: $61 per person\nBreakfast: -\nAttraction: -\nLunch: -\nDinner: Tibby's New Orleans Kitchen, Buffalo, cost: $48, cuisines: Seafood, Indian, BBQ, Italian\nAccommodation: Cozy Studio in Heart of Ft Greene, Buffalo, cost: $200, room type: Entire home/apt, house rules: No pets & No children under 10, minimum nights: 4\n\nNumber of people: 7\nTotal cost: (61 * 7) + (48 * 7) + 200 = 427 + 336 + 200 = 963\nAccommodation minimum nights: 1/4\n\nDays: 2\nCurrent City: Buffalo\nTransportation: -\nBreakfast: Shokitini, Buffalo, cost: $41, cuisines: Tea, Cafe, Pizza, Mexican, Chinese, Seafood\nAttraction: The Buffalo Zoo, Buffalo; Buffalo and Erie County Botanical Gardens, Buffalo; Buffalo AKG Art Museum, Buffalo\nLunch: Punjab Grill, Buffalo, cost: $25, cuisines: Bakery, BBQ, Desserts, Seafood\nDinner: Ammu's South Indian Restaurant, Buffalo, cost: $80, cuisines: Desserts, Pizza, French, BBQ, Chinese\nAccommodation: Cozy Studio in Heart of Ft Greene, Buffalo, cost: $200, room type: Entire home/apt, house rules: No pets & No children under 10, minimum nights: 4\n\nNumber of people: 7\nTotal cost: (41 + 25 + 80) * 7 + 200 = 146 * 7 + 200 = 1022 + 200 = 1222\nAccommodation minimum nights: 2/4\n\nDays: 3\nCurrent City: from Buffalo to New York\nTransportation: Flight F3644292, from Buffalo to New York, duration: 1 hour 9 minutes, cost: $77 per person\nBreakfast: Maa Kali Foods, Buffalo, cost: $61, cuisines: Desserts, BBQ, Bakery, Fast Food, Indian\nAttraction: -\nLunch: -\nDinner: Seasons 52 Fresh Grill, New York, cost: $30, cuisines: Seafood, Indian, Desserts, Italian\nAccommodation: A Contemporary Homelike Stay in the Best of BK, New York, cost: $228, room type: Entire home/apt, house rules: No pets & No visitors & No children under 10, minimum nights: 2\n\nNumber of people: 7\nTotal cost: (77 * 7) + (61 * 7) + (30 * 7) + 228 = 539 + 427 + 210 + 228 = 1404\nAccommodation minimum nights: 1/2\n\nDays: 4\nCurrent City: New York\nTransportation: -\nBreakfast: Gurgaon Hights, New York, cost: $46, cuisines: Cafe, American, Indian, Fast Food\nAttraction: Top of The Rock, New York; One World Observatory, New York; Central Park, New York\nLunch: Lord of the Drinks Forum, New York, cost: $71, cuisines: Cafe, Bakery, BBQ, Chinese, Indian\nDinner: G Dot, New York, cost: $75, cuisines: Cafe, Mexican, BBQ\nAccommodation: A Contemporary Homelike Stay in the Best of BK, New York, cost: $228, room type: Entire home/apt, house rules: No pets & No visitors & No children under 10, minimum nights: 2\n\nNumber of people: 7\nTotal cost: (46 + 71 + 75) * 7 + 228 = 192 * 7 + 228 = 1344 + 228 = 1572\nAccommodation minimum nights: 2/2\n\nDays: 5\nCurrent City: from New York to Washington\nTransportation: Flight F3669582, from New York to Washington, duration: 1 hour 8 minutes, cost: $80 per person\nBreakfast: Sir John Bakery Cafe, New York, cost: $78, cuisines: Pizza, Bakery, Desserts\nAttraction: -\nLunch: -\nDinner: -\nAccommodation: -\n\nNumber of people: 7\nTotal cost: (80 * 7) + (78 * 7) = 560 + 546 = 1106\n\nTotal cost across all days: 963 + 1222 + 1404 + 1572 + 1106 = 6267\nCuisines: The prompt specifies American, Mexican, Chinese, and Italian.\n\nPlease note that the accommodation costs are for the entire room/apt per night, not per person. The total cost is within the specified budget of $9,100. The travel plan includes a variety of cuisines as requested and adheres to the accommodation preferences for entire rooms. The transportation method chosen is flights, as self-driving is to be avoided. The plan covers the specified number of days and cities, and all attractions and restaurants are within the destination cities.", "gpt-4-1106-preview_direct_sole-planning_parsed_results": [{"day": 1, "current_city": "from Washington to Buffalo", "transportation": "Flight Number: F3791094, from Washington to Buffalo, Departure Time: -, Arrival Time: -", "breakfast": "-", "attraction": "-", "lunch": "-", "dinner": "Tibby's New Orleans Kitchen, Buffalo", "accommodation": "Cozy Studio in Heart of Ft Greene, Buffalo"}, {"day": 2, "current_city": "Buffalo", "transportation": "-", "breakfast": "Shokitini, Buffalo", "attraction": "The Buffalo Zoo, Buffalo;Buffalo and Erie County Botanical Gardens, Buffalo;Buffalo AKG Art Museum, Buffalo;", "lunch": "Punjab Grill, Buffalo", "dinner": "Ammu's South Indian Restaurant, Buffalo", "accommodation": "Cozy Studio in Heart of Ft Greene, Buffalo"}, {"day": 3, "current_city": "from Buffalo to New York", "transportation": "Flight Number: F3644292, from Buffalo to New York, Departure Time: -, Arrival Time: -", "breakfast": "Maa Kali Foods, Buffalo", "attraction": "-", "lunch": "-", "dinner": "Seasons 52 Fresh Grill, New York", "accommodation": "A Contemporary Homelike Stay in the Best of BK, New York"}, {"day": 4, "current_city": "New York", "transportation": "-", "breakfast": "Gurgaon Hights, New York", "attraction": "Top of The Rock, New York;One World Observatory, New York;Central Park, New York;", "lunch": "Lord of the Drinks Forum, New York", "dinner": "G Dot, New York", "accommodation": "A Contemporary Homelike Stay in the Best of BK, New York"}, {"day": 5, "current_city": "from New York to Washington", "transportation": "Flight Number: F3669582, from New York to Washington, Departure Time: -, Arrival Time: -", "breakfast": "Sir John Bakery Cafe, New York", "attraction": "-", "lunch": "-", "dinner": "-", "accommodation": "-"}]}]