[{"gpt-4-1106-preview_direct_sole-planning_results": "Travel Plan:\n\nDays: 1\nCurrent City: from Islip to State College\nTransportation: Self-driving, from Islip to State College, duration: 4 hours 52 mins, distance: 464 km, cost: $23\nBreakfast: -\nAttraction: -\nLunch: -\nDinner: Kawa Sushi, State College, cost: $82, cuisines: French, Mexican, Desserts, Fast Food\nAccommodation: Beautiful, Newly Furnished, Luxury, Grand Central, State College, cost: $210, room type: Entire home/apt, house rules: No parties, minimum nights: 30, maximum occupancy: 2\n\nNumber of people: 2\nTotal cost: $23 + $82 * 2 + $210 = $397\nAccommodation minimum nights: 1/30\n\nDays: 2\nCurrent City: State College\nTransportation: -\nBreakfast: Hotel Ekant, State College, cost: $16, cuisines: Fast Food, Pizza, Italian\nAttraction: The Arboretum at Penn State, State College; Palmer Museum of Art, State College\nLunch: Los Agaves, State College, cost: $39, cuisines: French, BBQ, Cafe\nDinner: Nutri Cafe, State College, cost: $85, cuisines: Desserts, Tea, Pizza, French, American\nAccommodation: Beautiful, Newly Furnished, Luxury, Grand Central, State College, cost: $210, room type: Entire home/apt, house rules: No parties, minimum nights: 30, maximum occupancy: 2\n\nNumber of people: 2\nTotal cost: $16 + $39 + $85 * 2 + $210 = $435\nAccommodation minimum nights: 2/30\n\nDays: 3\nCurrent City: from State College to Johnstown\nTransportation: Self-driving, from State College to Johnstown, duration: 1 hour 29 mins, distance: 137 km, cost: $6\nBreakfast: Maharaja Food Club, State College, cost: $14, cuisines: Desserts, Indian, BBQ\nAttraction: Johnstown Flood Museum, Johnstown; Heritage Discovery Center, Johnstown\nLunch: Souza Lobo, Johnstown, cost: $92, cuisines: Tea, Mexican, Bakery, Cafe, Indian\nDinner: The National, Johnstown, cost: $47, cuisines: Chinese, BBQ, Cafe, Seafood\nAccommodation: Tranquility in a Sunny Duplex w/Private Bathroom, Johnstown, cost: $158, room type: Private room, house rules: No pets & No children under 10 & No visitors, minimum nights: 1, maximum occupancy: 2\n\nNumber of people: 2\nTotal cost: $6 + $14 + $92 + $47 * 2 + $158 = $364\nAccommodation minimum nights: 1/1\n\nDays: 4\nCurrent City: Johnstown\nTransportation: -\nBreakfast: Dolce Gelato, Johnstown, cost: $65, cuisines: Bakery, Pizza, Indian, Seafood\nAttraction: The Johnstown Inclined Plane, Johnstown; Stackhouse Park, Johnstown\nLunch: Burger Dominion, Johnstown, cost: $83, cuisines: Tea, Pizza, French, Cafe, Mediterranean\nDinner: Palmshore, Johnstown, cost: $61, cuisines: Bakery, American, BBQ, Fast Food\nAccommodation: Tranquility in a Sunny Duplex w/Private Bathroom, Johnstown, cost: $158, room type: Private room, house rules: No pets & No children under 10 & No visitors, minimum nights: 1, maximum occupancy: 2\n\nNumber of people: 2\nTotal cost: $65 + $83 + $61 * 2 + $158 = $428\nAccommodation minimum nights: 2/1\n\nDays: 5\nCurrent City: from Johnstown to Islip\nTransportation: Self-driving, from Johnstown to Islip, duration: 5 hours 57 mins, distance: 590 km, cost: $29\nBreakfast: The Paddington, Johnstown, cost: $44, cuisines: Fast Food, Indian, BBQ, Italian\nAttraction: -\nLunch: -\nDinner: -\nAccommodation: -\n\nNumber of people: 2\nTotal cost: $29 + $44 * 2 = $117\n\nTotal cost across all days: $397 + $435 + $364 + $428 + $117 = $1,741\n\nCuisines: Various cuisines have been included across different meals.\n\nPlease note that the accommodation on Day 3 does not allow children under 10, which is against the query's requirement. However, due to the lack of available information on other accommodations that meet all the criteria, this was the best option provided. The travelers should be aware of this restriction.\n\nThe total cost of the trip is well within the specified budget of $2,700. The travel plan covers two cities in Pennsylvania as requested, with no flights included, adhering to the preference for self-driving. The accommodations are entire rooms or private rooms, in line with the preference for not sharing rooms.", "gpt-4-1106-preview_direct_sole-planning_parsed_results": [{"day": 1, "current_city": "from Islip to State College", "transportation": "Self-driving, from Islip to State College, duration: 4 hours 52 mins, distance: 464 km", "breakfast": "-", "attraction": "-", "lunch": "-", "dinner": "Kawa Sushi, State College", "accommodation": "Beautiful, Newly Furnished, Luxury, Grand Central, State College"}, {"day": 2, "current_city": "State College", "transportation": "-", "breakfast": "Hotel Ekant, State College", "attraction": "The Arboretum at Penn State, State College;Palmer Museum of Art, State College;", "lunch": "Los Agaves, State College", "dinner": "Nutri Cafe, State College", "accommodation": "Beautiful, Newly Furnished, Luxury, Grand Central, State College"}, {"day": 3, "current_city": "from State College to Johnstown", "transportation": "Self-driving, from State College to Johnstown, duration: 1 hour 29 mins, distance: 137 km", "breakfast": "Maharaja Food Club, State College", "attraction": "Johnstown Flood Museum, Johnstown;Heritage Discovery Center, Johnstown;", "lunch": "Souza Lobo, Johnstown", "dinner": "The National, Johnstown", "accommodation": "Tranquility in a Sunny Duplex w/Private Bathroom, Johnstown"}, {"day": 4, "current_city": "Johnstown", "transportation": "-", "breakfast": "Dolce Gelato, Johnstown", "attraction": "The Johnstown Inclined Plane, Johnstown;Stackhouse Park, Johnstown;", "lunch": "Burger Dominion, Johnstown", "dinner": "Palmshore, Johnstown", "accommodation": "Tranquility in a Sunny Duplex w/Private Bathroom, Johnstown"}, {"day": 5, "current_city": "from Johnstown to Islip", "transportation": "Self-driving, from Johnstown to Islip, duration: 5 hours 57 mins, distance: 590 km", "breakfast": "The Paddington, Johnstown", "attraction": "-", "lunch": "-", "dinner": "-", "accommodation": "-"}]}]