[{"gpt-4-1106-preview_direct_sole-planning_results": "Travel Plan:\n\nDays: 1\nCurrent City: from Fort Lauderdale to Atlanta\nTransportation: Flight F3510231, from Fort Lauderdale to Atlanta, duration: 1 hour 32 minutes, cost: $125\nBreakfast: -\nAttraction: -\nLunch: -\nDinner: Baba Au Rhum, Atlanta, cost: $27, cuisines: Desserts, Pizza, Mexican, BBQ, Fast Food\nAccommodation: FABULOUS SUNNY BEDROOM IN HARLEM, Atlanta, cost: $587, room type: Private room, house rules: No parties, minimum nights: 20, maximum occupancy: 2\n\nNumber of people: 2\nTotal cost: $125 * 2 + $27 * 2 + $587 = $891\nAccommodation minimum nights: 1/20\n\nDays: 2\nCurrent City: Atlanta\nTransportation: -\nBreakfast: Saffron, Atlanta, cost: $39, cuisines: Tea, Cafe, Fast Food, Seafood\nAttraction: Georgia Aquarium, Atlanta; World of Coca-Cola, Atlanta; Atlanta Botanical Garden, Atlanta\nLunch: Chef Style, Atlanta, cost: $59, cuisines: Pizza, American, Desserts, Seafood\nDinner: Asian Bistro, Atlanta, cost: $27, cuisines: Tea, Bakery, Seafood\nAccommodation: FABULOUS SUNNY BEDROOM IN HARLEM, Atlanta, cost: $587, room type: Private room, house rules: No parties, minimum nights: 20, maximum occupancy: 2\n\nNumber of people: 2\nTotal cost: $39 + $59 + $27 * 2 + $587 = $789\nAccommodation minimum nights: 2/20\n\nDays: 3\nCurrent City: from Atlanta to Decatur\nTransportation: Taxi, from Atlanta to Decatur, duration: 18 mins, cost: $10\nBreakfast: Ahata, Atlanta, cost: $17, cuisines: Tea, Indian, Desserts\nAttraction: DeKalb History Center Museum, Decatur; Glenlake Park, Decatur\nLunch: Carnatic Cafe, Decatur, cost: $66, cuisines: Cafe, Indian, Desserts\nDinner: Joey's Pizza, Decatur, cost: $69, cuisines: Tea, Pizza, Bakery, Chinese, Seafood\nAccommodation: Cozy Private Room, Decatur, cost: $69, room type: Private room, house rules: No children under 10 & No parties & No visitors, minimum nights: 2, maximum occupancy: 2\n\nNumber of people: 2\nTotal cost: $10 + $17 * 2 + $66 + $69 * 2 + $69 = $317\nAccommodation minimum nights: 1/2\n\nDays: 4\nCurrent City: Decatur\nTransportation: -\nBreakfast: Madhuban Restaurant - Welcome Hotel Rama International, Decatur, cost: $47, cuisines: Pizza, Bakery, Seafood\nAttraction: Clyde Shepherd Nature Preserve, Decatur; Decatur Square, Decatur\nLunch: Dawat-E-Chaman, Decatur, cost: $42, cuisines: Chinese, BBQ, Fast Food, Cafe, Mediterranean\nDinner: Tandoori Hut, Decatur, cost: $82, cuisines: Pizza, American, Indian, Fast Food\nAccommodation: Cozy Private Room, Decatur, cost: $69, room type: Private room, house rules: No children under 10 & No parties & No visitors, minimum nights: 2, maximum occupancy: 2\n\nNumber of people: 2\nTotal cost: $47 + $42 + $82 * 2 + $69 = $322\nAccommodation minimum nights: 2/2\n\nDays: 5\nCurrent City: from Decatur to Augusta\nTransportation: Self-driving, from Decatur to Augusta, duration: 2 hours 17 mins, cost: $11\nBreakfast: Cafe Coffee Day, Decatur, cost: $46, cuisines: Tea, Cafe, BBQ, Mediterranean\nAttraction: Augusta Riverwalk, Augusta; Augusta Museum of History, Augusta\nLunch: The Charcoal Chimney, Augusta, cost: $86, cuisines: Tea, Fast Food, BBQ, Italian\nDinner: B Merrell's, Augusta, cost: $74, cuisines: Tea, Pizza, Desserts, Fast Food\nAccommodation: Planta Baja Studio, Augusta, cost: $637, room type: Entire home/apt, house rules: No smoking, minimum nights: 1, maximum occupancy: 4\n\nNumber of people: 2\nTotal cost: $11 + $46 * 2 + $86 + $74 * 2 + $637 = $974\nAccommodation minimum nights: 1/1\n\nDays: 6\nCurrent City: Augusta\nTransportation: -\nBreakfast: Fish Tales Lakeside Grille, Augusta, cost: $37, cuisines: Tea, Cafe, Bakery, Desserts\nAttraction: Morris Museum of Art, Augusta; Phinizy Swamp Nature Park, Augusta\nLunch: Nikhil Food Point, Augusta, cost: $87, cuisines: Tea, Mexican, Fast Food, American, Seafood\nDinner: KB's Kulfi & Icecream, Augusta, cost: $92, cuisines: American, BBQ, Seafood\nAccommodation: Planta Baja Studio, Augusta, cost: $637, room type: Entire home/apt, house rules: No smoking, minimum nights: 1, maximum occupancy: 4\n\nNumber of people: 2\nTotal cost: $37 + $87 + $92 * 2 + $637 = $945\nAccommodation minimum nights: 1/1\n\nDays: 7\nCurrent City: from Augusta to Fort Lauderdale\nTransportation: Self-driving, from Augusta to Fort Lauderdale, duration: 8 hours 41 mins, cost: $46\nBreakfast: The Flying Saucer Cafe, Augusta, cost: $19, cuisines: Desserts, Pizza, BBQ, Cafe, Indian\nAttraction: -\nLunch: -\nDinner: -\nAccommodation: -\n\nNumber of people: 2\nTotal cost: $46 + $19 * 2 = $84\n\nTotal cost across all days: $891 + $789 + $317 + $322 + $974 + $945 + $84 = $4,322\nCuisines: The prompt specifies Indian, American, Chinese, and Mediterranean.\n\nNote: The accommodation in Atlanta has a minimum stay of 20 nights, which exceeds the travel dates. However, due to the lack of other options provided in the reference information, it has been included for the purpose of this example. In a real-world scenario, alternative accommodation should be sought to meet the travel dates.", "gpt-4-1106-preview_direct_sole-planning_parsed_results": [{"day": 1, "current_city": "from Fort Lauderdale to Atlanta", "transportation": "Flight Number: F3510231, from Fort Lauderdale to Atlanta, Departure Time: -, Arrival Time: -", "breakfast": "-", "attraction": "-", "lunch": "-", "dinner": "Baba Au Rhum, Atlanta", "accommodation": "FABULOUS SUNNY BEDROOM IN HARLEM, Atlanta"}, {"day": 2, "current_city": "Atlanta", "transportation": "-", "breakfast": "Saffron, Atlanta", "attraction": "Georgia Aquarium, Atlanta;World of Coca-Cola, Atlanta;Atlanta Botanical Garden, Atlanta;", "lunch": "Chef Style, Atlanta", "dinner": "Asian Bistro, Atlanta", "accommodation": "FABULOUS SUNNY BEDROOM IN HARLEM, Atlanta"}, {"day": 3, "current_city": "from Atlanta to Decatur", "transportation": "Taxi, from Atlanta to Decatur, Departure Time: -, Arrival Time: -", "breakfast": "Ahata, Atlanta", "attraction": "DeKalb History Center Museum, Decatur;Glenlake Park, Decatur;", "lunch": "Carnatic Cafe, Decatur", "dinner": "Joey's Pizza, Decatur", "accommodation": "Cozy Private Room, Decatur"}, {"day": 4, "current_city": "Decatur", "transportation": "-", "breakfast": "Madhuban Restaurant - Welcome Hotel Rama International, Decatur", "attraction": "Clyde Shepherd Nature Preserve, Decatur;Decatur Square, Decatur;", "lunch": "Dawat-E-Chaman, Decatur", "dinner": "Tandoori Hut, Decatur", "accommodation": "Cozy Private Room, Decatur"}, {"day": 5, "current_city": "from Decatur to Augusta", "transportation": "Self-driving, from Decatur to Augusta, Departure Time: -, Arrival Time: -", "breakfast": "Cafe Coffee Day, Decatur", "attraction": "Augusta Riverwalk, Augusta;Augusta Museum of History, Augusta;", "lunch": "The Charcoal Chimney, Augusta", "dinner": "B Merrell's, Augusta", "accommodation": "Planta Baja Studio, Augusta"}, {"day": 6, "current_city": "Augusta", "transportation": "-", "breakfast": "Fish Tales Lakeside Grille, Augusta", "attraction": "Morris Museum of Art, Augusta;Phinizy Swamp Nature Park, Augusta;", "lunch": "Nikhil Food Point, Augusta", "dinner": "KB's Kulfi & Icecream, Augusta", "accommodation": "Planta Baja Studio, Augusta"}, {"day": 7, "current_city": "from Augusta to Fort Lauderdale", "transportation": "Self-driving, from Augusta to Fort Lauderdale, Departure Time: -, Arrival Time: -", "breakfast": "The Flying Saucer Cafe, Augusta", "attraction": "-", "lunch": "-", "dinner": "-", "accommodation": "-"}]}]