[{"gpt-4-1106-preview_direct_sole-planning_results": "Travel Plan:\n\nDays: 1\nCurrent City: from Ithaca to Newark\nTransportation: Flight F3924332, from Ithaca to Newark, duration: 1 hour 42 minutes, cost: $62 per person\nBreakfast: -\nAttraction: -\nLunch: -\nDinner: Artistry, Newark, cost: $79, cuisines: Cafe, Pizza, Desserts, Seafood\nAccommodation: Gramercy One Bedroom w Two Beds, Newark, cost: $485, room type: Entire home/apt, house rules: No visitors & No children under 10, minimum nights: 7, maximum occupancy: 4\n\nNumber of people: 2\nTotal cost: ($62 + $79) * 2 + $485 = $767\nAccommodation minimum nights: 1/7\n\nDays: 2\nCurrent City: Newark\nTransportation: -\nBreakfast: Mirage Restro Bar, Newark, cost: $51, cuisines: Bakery, American, Desserts, Fast Food\nAttraction: The Newark Museum of Art, Newark; Military Park, Newark; Branch Brook Park, Newark\nLunch: Bernardo's, Newark, cost: $84, cuisines: Desserts, Pizza, BBQ, American, Mediterranean\nDinner: Kettle & Kegs, Newark, cost: $67, cuisines: Fast Food, Seafood, Mediterranean, Italian\nAccommodation: Gramercy One Bedroom w Two Beds, Newark, cost: $485, room type: Entire home/apt, house rules: No visitors & No children under 10, minimum nights: 7, maximum occupancy: 4\n\nNumber of people: 2\nTotal cost: $51 + $84 + $67 * 2 + $485 = $754\nAccommodation minimum nights: 2/7\n\nDays: 3\nCurrent City: from Newark to Ithaca\nTransportation: Flight F3923348, from Newark to Ithaca, duration: 1 hour 2 minutes, cost: $42 per person\nBreakfast: Harmann Restaurant, Newark, cost: $57, cuisines: Tea, Cafe, American, Fast Food\nAttraction: -\nLunch: -\nDinner: -\nAccommodation: -\n\nNumber of people: 2\nTotal cost: $42 * 2 + $57 = $141\n\nTotal cost across all days: $767 + $754 + $141 = $1,662\n\nUnfortunately, the total cost exceeds the specified budget of $1,200. To adjust the travel plan to fit the budget, we need to make some changes:\n\n- Change the accommodation to a more affordable option.\n- Remove some meals or choose less expensive restaurants.\n\nRevised Travel Plan:\n\nDays: 1\nCurrent City: from Ithaca to Newark\nTransportation: Flight F3924332, from Ithaca to Newark, duration: 1 hour 42 minutes, cost: $62 per person\nBreakfast: -\nAttraction: -\nLunch: -\nDinner: Angeethi Restaurant, Newark, cost: $12, cuisines: French, BBQ, Fast Food\nAccommodation: Rustic Modern Brooklyn Apartment, Newark, cost: $294, room type: Entire home/apt, house rules: No pets, minimum nights: 30, maximum occupancy: 2\n\nNumber of people: 2\nTotal cost: ($62 + $12) * 2 + $294 = $442\nAccommodation minimum nights: 1/30\n\nDays: 2\nCurrent City: Newark\nTransportation: -\nBreakfast: Drifters Cafe, Newark, cost: $24, cuisines: Tea, BBQ\nAttraction: The Newark Museum of Art, Newark; Military Park, Newark\nLunch: Suruchee, Newark, cost: $44, cuisines: Tea, Pizza, Bakery, BBQ, Chinese\nDinner: Joshi Eating House, Newark, cost: $52, cuisines: Pizza, Indian, Fast Food\nAccommodation: Rustic Modern Brooklyn Apartment, Newark, cost: $294, room type: Entire home/apt, house rules: No pets, minimum nights: 30, maximum occupancy: 2\n\nNumber of people: 2\nTotal cost: $24 + $44 + $52 * 2 + $294 = $466\nAccommodation minimum nights: 2/30\n\nDays: 3\nCurrent City: from Newark to Ithaca\nTransportation: Flight F3923348, from Newark to Ithaca, duration: 1 hour 2 minutes, cost: $42 per person\nBreakfast: New Garden Hut, Newark, cost: $12, cuisines: Tea, Cafe, Pizza, Fast Food\nAttraction: -\nLunch: -\nDinner: -\nAccommodation: -\n\nNumber of people: 2\nTotal cost: $42 * 2 + $12 = $96\n\nTotal cost across all days: $442 + $466 + $96 = $1,004\n\nCuisines: The restaurants selected offer a variety of cuisines including French, BBQ, Fast Food, Tea, Pizza, Bakery, Chinese, Indian, and American.\n\nPlease note that the accommodation \"Rustic Modern Brooklyn Apartment\" has a minimum stay of 30 nights, which does not fit the 3-day itinerary. However, due to the constraints of the provided data and the budget limit, this accommodation was selected to fit within the budget. In a real-world scenario, we would need to find an alternative accommodation that meets the minimum night stay requirement.", "gpt-4-1106-preview_direct_sole-planning_parsed_results": [{"day": 1, "current_city": "from Ithaca to Newark", "transportation": "Flight Number: F3924332, from Ithaca to Newark, Departure Time: -, Arrival Time: -", "breakfast": "-", "attraction": "-", "lunch": "-", "dinner": "Angeethi Restaurant, Newark", "accommodation": "Rustic Modern Brooklyn Apartment, Newark"}, {"day": 2, "current_city": "Newark", "transportation": "-", "breakfast": "Drifters Cafe, Newark", "attraction": "The Newark Museum of Art, Newark;Military Park, Newark;", "lunch": "Suruchee, Newark", "dinner": "Joshi Eating House, Newark", "accommodation": "Rustic Modern Brooklyn Apartment, Newark"}, {"day": 3, "current_city": "from Newark to Ithaca", "transportation": "Flight Number: F3923348, from Newark to Ithaca, Departure Time: -, Arrival Time: -", "breakfast": "New Garden Hut, Newark", "attraction": "-", "lunch": "-", "dinner": "-", "accommodation": "-"}]}]