[{"gpt-4-1106-preview_direct_sole-planning_results": "Travel Plan:\nDays: 1\nCurrent City: from Valparaiso to Belleville\nTransportation: Flight F3579167, from Valparaiso to Belleville, duration: 1 hour 43 minutes, cost: 211\nBreakfast: -\nAttraction: -\nLunch: -\nDinner: Asian Haus, Belleville, cost: 87, cuisines: Tea, Pizza, Bakery, Mediterranean\nAccommodation: Historic Manhattan Home to make your stay special!, Belleville, cost: 523, maximum occupancy: 3, house rules: No visitors, minimum nights: 2\n\nNumber of people: 8\nTotal cost: (211 + 87) * 8 + 523 * 3 = 2,384 + 1,569 = 3,953\nAccommodation minimum nights: 1/2\n\nDays: 2\nCurrent City: Belleville\nTransportation: -\nBreakfast: Fuji Japanese Steak House, Belleville, cost: 70, cuisines: Bakery, Indian, Cafe\nAttraction: Labor & Industrial Museum, Belleville; St. Clair County Historical Society, Belleville; National Shrine of Our Lady of the Snows, Belleville\nLunch: Super Restaurant, Belleville, cost: 96, cuisines: Tea, American, BBQ, Italian\nDinner: RollsKing, Belleville, cost: 27, cuisines: Chinese, Bakery, BBQ, Pizza\nAccommodation: Historic Manhattan Home to make your stay special!, Belleville, cost: 523, maximum occupancy: 3, house rules: No visitors, minimum nights: 2\n\nNumber of people: 8\nTotal cost: (70 + 96 + 27) * 8 + 523 * 3 = 1,544 + 1,569 = 3,113\nAccommodation minimum nights: 2/2\n\nDays: 3\nCurrent City: from Belleville to Valparaiso\nTransportation: Flight F3571908, from Belleville to Valparaiso, duration: 1 hour 40 minutes, cost: 124\nBreakfast: -\nAttraction: -\nLunch: -\nDinner: -\nAccommodation: -\n\nNumber of people: 8\nTotal cost: 124 * 8 = 992\n\nTotal cost across all days: 3,953 + 3,113 + 992 = 8,058\n\nUnfortunately, the total cost of $8,058 exceeds the specified budget of $6,600. Adjustments must be made to the plan to meet the budget constraints. Since the accommodations are the most expensive part, we can look for cheaper options or reduce the number of rooms if possible. However, given the provided data, there are no cheaper accommodation options that fit the group size and house rules. Therefore, we cannot create a feasible travel plan within the specified budget based on the provided information.", "gpt-4-1106-preview_direct_sole-planning_parsed_results": [{"day": 1, "current_city": "from Valparaiso to Belleville", "transportation": "Flight Number: F3579167, from Valparaiso to Belleville, Departure Time: -, Arrival Time: -", "breakfast": "-", "attraction": "-", "lunch": "-", "dinner": "Asian Haus, Belleville", "accommodation": "Historic Manhattan Home to make your stay special!, Belleville"}, {"day": 2, "current_city": "Belleville", "transportation": "-", "breakfast": "Fuji Japanese Steak House, Belleville", "attraction": "Labor & Industrial Museum, Belleville;St. Clair County Historical Society, Belleville;National Shrine of Our Lady of the Snows, Belleville;", "lunch": "Super Restaurant, Belleville", "dinner": "RollsKing, Belleville", "accommodation": "Historic Manhattan Home to make your stay special!, Belleville"}, {"day": 3, "current_city": "from Belleville to Valparaiso", "transportation": "Flight Number: F3571908, from Belleville to Valparaiso, Departure Time: -, Arrival Time: -", "breakfast": "-", "attraction": "-", "lunch": "-", "dinner": "-", "accommodation": "-"}]}]