[{"gpt-4-1106-preview_direct_sole-planning_results": "Travel Plan:\n\nDays: 1\nCurrent City: from Daytona Beach to Atlanta\nTransportation: Self-driving, from Daytona Beach to Atlanta, duration: 6 hours 18 mins, distance: 696 km, cost: 34 x 3 = 102\nBreakfast: -\nAttraction: -\nLunch: -\nDinner: Saffron, Atlanta, cost: 39 x 3 = 117, cuisines: Tea, Cafe, Fast Food, Seafood\nAccommodation: Bright, Modern, Clean, Spacious, Brooklyn Home, Atlanta, cost: 1034, room type: Entire home/apt, house rules: No children under 10, minimum nights: 3, maximum occupancy: 4\n\nNumber of people: 3\nTotal cost: Transportation 102 + Dinner 117 + Accommodation 1034 = 1253\nAccommodation minimum nights: 1/3\n\nDays: 2\nCurrent City: Atlanta\nTransportation: -\nBreakfast: Adda, Atlanta, cost: 22 x 3 = 66, cuisines: Tea, Mexican, Bakery\nAttraction: Georgia Aquarium, Atlanta; Atlanta Botanical Garden, Atlanta\nLunch: Asian Bistro, Atlanta, cost: 27 x 3 = 81, cuisines: Tea, Bakery, Seafood\nDinner: Chef Style, Atlanta, cost: 59 x 3 = 177, cuisines: Pizza, American, Desserts, Seafood\nAccommodation: Bright, Modern, Clean, Spacious, Brooklyn Home, Atlanta, cost: 1034, room type: Entire home/apt, house rules: No children under 10, minimum nights: 3, maximum occupancy: 4\n\nNumber of people: 3\nTotal cost: Breakfast 66 + Lunch 81 + Dinner 177 + Accommodation 1034 = 1358\nAccommodation minimum nights: 2/3\n\nDays: 3\nCurrent City: Atlanta\nTransportation: -\nBreakfast: Baba Au Rhum, Atlanta, cost: 27 x 3 = 81, cuisines: Desserts, Pizza, Mexican, BBQ, Fast Food\nAttraction: World of Coca-Cola, Atlanta; Centennial Olympic Park, Atlanta\nLunch: Pizza Central, Atlanta, cost: 75 x 3 = 225, cuisines: Cafe, Bakery, BBQ, Fast Food, Chinese, Indian\nDinner: Daawat-e-Kashmir, Atlanta, cost: 19 x 3 = 57, cuisines: Cafe, Pizza, American, Seafood\nAccommodation: Bright, Modern, Clean, Spacious, Brooklyn Home, Atlanta, cost: 1034, room type: Entire home/apt, house rules: No children under 10, minimum nights: 3, maximum occupancy: 4\n\nNumber of people: 3\nTotal cost: Breakfast 81 + Lunch 225 + Dinner 57 + Accommodation 1034 = 1397\nAccommodation minimum nights: 3/3\n\nTotal cost across all days: Day 1 (1253) + Day 2 (1358) + Day 3 (1397) = 4008\n\nUnfortunately, the total cost of $4008 exceeds the specified budget of $2100. To adjust the plan within the budget, we need to change the accommodation to a more affordable option that allows children under 10 and provides an entire room.\n\nRevised Accommodation: Charming Carroll Gardens 2 BR, Atlanta, cost: 576, room type: Entire home/apt, house rules: No parties, minimum nights: 1, maximum occupancy: 4\n\nRevised Total Cost:\nDay 1: Transportation 102 + Dinner 117 + Accommodation 576 = 795\nDay 2: Breakfast 66 + Lunch 81 + Dinner 177 + Accommodation 576 = 900\nDay 3: Breakfast 81 + Lunch 225 + Dinner 57 + Accommodation 576 = 939\n\nRevised Total cost across all days: Day 1 (795) + Day 2 (900) + Day 3 (939) = 2634\n\nThe revised total cost of $2634 still exceeds the budget. We need to further adjust the meal plans or attractions to fit the budget.\n\nFinal Adjustments:\n- Remove one attraction per day to save on entrance fees.\n- Choose more affordable restaurants for one meal per day.\n\nFinal Travel Plan:\n\nDays: 1\nCurrent City: from Daytona Beach to Atlanta\nTransportation: Self-driving, from Daytona Beach to Atlanta, duration: 6 hours 18 mins, distance: 696 km, cost: 34 x 3 = 102\nBreakfast: -\nAttraction: -\nLunch: -\nDinner: Saffron, Atlanta, cost: 39 x 3 = 117, cuisines: Tea, Cafe, Fast Food, Seafood\nAccommodation: Charming Carroll Gardens 2 BR, Atlanta, cost: 576, room type: Entire home/apt, house rules: No parties, minimum nights: 1, maximum occupancy: 4\n\nNumber of people: 3\nTotal cost: Transportation 102 + Dinner 117 + Accommodation 576 = 795\n\nDays: 2\nCurrent City: Atlanta\nTransportation: -\nBreakfast: Adda, Atlanta, cost: 22 x 3 = 66, cuisines: Tea, Mexican, Bakery\nAttraction: Georgia Aquarium, Atlanta\nLunch: Asian Bistro, Atlanta, cost: 27 x 3 = 81, cuisines: Tea, Bakery, Seafood\nDinner: Daawat-e-Kashmir, Atlanta, cost: 19 x 3 = 57, cuisines: Cafe, Pizza, American, Seafood\nAccommodation: Charming Carroll Gardens 2 BR, Atlanta, cost: 576, room type: Entire home/apt, house rules: No parties, minimum nights: 1, maximum occupancy: 4\n\nNumber of people: 3\nTotal cost: Breakfast 66 + Lunch 81 + Dinner 57 + Accommodation 576 = 780\n\nDays: 3\nCurrent City: Atlanta\nTransportation: Self-driving, from Atlanta to Daytona Beach, duration: 6 hours 20 mins, distance: 706 km, cost: 35 x 3 = 105\nBreakfast: Baba Au Rhum, Atlanta, cost: 27 x 3 = 81, cuisines: Desserts, Pizza, Mexican, BBQ, Fast Food\nAttraction: World of Coca-Cola, Atlanta\nLunch: Pizza Central, Atlanta, cost: 75 x 3 = 225, cuisines: Cafe, Bakery, BBQ, Fast Food, Chinese, Indian\nDinner: -\nAccommodation: -\n\nNumber of people: 3\nTotal cost: Breakfast 81 + Lunch 225 + Transportation 105 = 411\n\nTotal cost across all days: Day 1 (795) + Day 2 (780) + Day 3 (411) = 1986\n\nThe final total cost of $1986 fits within the specified budget of $2100.", "gpt-4-1106-preview_direct_sole-planning_parsed_results": [{"day": 1, "current_city": "from Daytona Beach to Atlanta", "transportation": "Self-driving, from Daytona Beach to Atlanta, duration: 6 hours 18 mins, distance: 696 km", "breakfast": "-", "attraction": "-", "lunch": "-", "dinner": "Saffron, Atlanta", "accommodation": "Charming Carroll Gardens 2 BR, Atlanta"}, {"day": 2, "current_city": "Atlanta", "transportation": "-", "breakfast": "Adda, Atlanta", "attraction": "Georgia Aquarium, Atlanta", "lunch": "Asian Bistro, Atlanta", "dinner": "Daawat-e-Kashmir, Atlanta", "accommodation": "Charming Carroll Gardens 2 BR, Atlanta"}, {"day": 3, "current_city": "from Atlanta to Daytona Beach", "transportation": "Self-driving, from Atlanta to Daytona Beach, duration: 6 hours 20 mins, distance: 706 km", "breakfast": "Baba Au Rhum, Atlanta", "attraction": "World of Coca-Cola, Atlanta", "lunch": "Pizza Central, Atlanta", "dinner": "-", "accommodation": "-"}]}]