[{"gpt-4-1106-preview_direct_sole-planning_results": "Travel Plan:\n\nDays: 1\nCurrent City: from San Jose to Portland\nTransportation: Self-driving, from San Jose to Portland, duration: 10 hours 14 mins, distance: 1,073 km, cost: 53 x 2 = 106\nBreakfast: -\nAttraction: -\nLunch: -\nDinner: Cactus Flower Cafe Navarre, Portland, cuisines: Cafe, Italian, BBQ, Fast Food, Chinese, cost: 48 x 2 = 96\nAccommodation: The ocean view room size 12x14, Portland, price: 709, room type: Private room, house rules: No parties, pets allowed, minimum nights: 1, maximum occupancy: 1\n\nNumber of people: 2\nTotal cost: Transportation 106 + Dinner 96 + Accommodation 709 = 911\nAccommodation minimum nights: 1/1\n\nDays: 2\nCurrent City: Portland\nTransportation: -\nBreakfast: Sethi's Delicacy, Portland, cuisines: Bakery, BBQ, Mediterranean, Desserts, cost: 35 x 2 = 70\nAttraction: International Rose Test Garden, Portland; Lan Su Chinese Garden, Portland\nLunch: Bella Italia, Portland, cuisines: Desserts, Mexican, Indian, BBQ, cost: 47 x 2 = 94\nDinner: Barbeque Nation, Portland, cuisines: Mediterranean, Desserts, Fast Food, cost: 79 x 2 = 158\nAccommodation: The ocean view room size 12x14, Portland, price: 709, room type: Private room, house rules: No parties, pets allowed, minimum nights: 1, maximum occupancy: 1\n\nNumber of people: 2\nTotal cost: Breakfast 70 + Lunch 94 + Dinner 158 + Accommodation 709 = 1031\nAccommodation minimum nights: 2/1\n\nDays: 3\nCurrent City: Portland to San Jose\nTransportation: Self-driving, from Portland to San Jose, duration: 10 hours 20 mins, distance: 1,074 km, cost: 53 x 2 = 106\nBreakfast: The Coffee Bean & Tea Leaf, Portland, cuisines: Tea, Cafe, Desserts, cost: 24 x 2 = 48\nAttraction: -\nLunch: -\nDinner: -\nAccommodation: -\n\nNumber of people: 2\nTotal cost: Transportation 106 + Breakfast 48 = 154\n\nTotal cost across all days: Day 1 (911) + Day 2 (1031) + Day 3 (154) = 2096\n\nUnfortunately, the total cost of the proposed travel plan exceeds the specified budget of $1,000. To adhere to the budget, we need to make adjustments:\n\nRevised Travel Plan:\n\nDays: 1\nCurrent City: from San Jose to Portland\nTransportation: Self-driving, from San Jose to Portland, duration: 10 hours 14 mins, distance: 1,073 km, cost: 53 x 2 = 106\nBreakfast: -\nAttraction: -\nLunch: -\nDinner: Desi Zaika, Portland, cuisines: Tea, Cafe, cost: 18 x 2 = 36\nAccommodation: Big and Relaxing studio; great location, Portland, price: 206, room type: Entire home/apt, house rules: No smoking & No children under 10, pets allowed, minimum nights: 1, maximum occupancy: 3\n\nNumber of people: 2\nTotal cost: Transportation 106 + Dinner 36 + Accommodation 206 = 348\nAccommodation minimum nights: 1/1\n\nDays: 2\nCurrent City: Portland\nTransportation: -\nBreakfast: The Coffee Bean & Tea Leaf, Portland, cuisines: Tea, Cafe, Desserts, cost: 24 x 2 = 48\nAttraction: Portland Japanese Garden, Portland; The Grotto, Portland\nLunch: Nacho Mamas Burritos, Portland, cuisines: Chinese, Pizza, Seafood, Italian, cost: 54 x 2 = 108\nDinner: Osaka, Portland, cuisines: Desserts, Tea, Pizza, BBQ, Chinese, cost: 42 x 2 = 84\nAccommodation: Big and Relaxing studio; great location, Portland, price: 206, room type: Entire home/apt, house rules: No smoking & No children under 10, pets allowed, minimum nights: 1, maximum occupancy: 3\n\nNumber of people: 2\nTotal cost: Breakfast 48 + Lunch 108 + Dinner 84 + Accommodation 206 = 446\nAccommodation minimum nights: 2/1\n\nDays: 3\nCurrent City: Portland to San Jose\nTransportation: Self-driving, from Portland to San Jose, duration: 10 hours 20 mins, distance: 1,074 km, cost: 53 x 2 = 106\nBreakfast: -\nAttraction: -\nLunch: -\nDinner: -\nAccommodation: -\n\nNumber of people: 2\nTotal cost: Transportation 106\n\nTotal cost across all days: Day 1 (348) + Day 2 (446) + Day 3 (106) = 900\n\nThe revised travel plan now fits within the $1,000 budget, includes the specified cuisines, and adheres to the accommodation requirement for pets.", "gpt-4-1106-preview_direct_sole-planning_parsed_results": [{"day": 1, "current_city": "from San Jose to Portland", "transportation": "Self-driving, from San Jose to Portland, duration: 10 hours 14 mins, distance: 1,073 km", "breakfast": "-", "attraction": "-", "lunch": "-", "dinner": "Desi Zaika, Portland", "accommodation": "Big and Relaxing studio; great location, Portland"}, {"day": 2, "current_city": "Portland", "transportation": "-", "breakfast": "The Coffee Bean & Tea Leaf, Portland", "attraction": "Portland Japanese Garden, Portland;The Grotto, Portland;", "lunch": "Nacho Mamas Burritos, Portland", "dinner": "Osaka, Portland", "accommodation": "Big and Relaxing studio; great location, Portland"}, {"day": 3, "current_city": "from Portland to San Jose", "transportation": "Self-driving, from Portland to San Jose, duration: 10 hours 20 mins, distance: 1,074 km", "breakfast": "-", "attraction": "-", "lunch": "-", "dinner": "-", "accommodation": "-"}]}]