[{"gpt-4-1106-preview_direct_sole-planning_results": "Travel Plan:\n\nDays: 1\nCurrent City: from Denver to Appleton\nTransportation: Flight F3822209, from Denver to Appleton, duration: 2 hours 14 minutes, cost: 286\nBreakfast: -\nAttraction: -\nLunch: -\nDinner: Mikata Japanese Steakhouse, Appleton, Average Cost: 72, Cuisines: Cafe, Pizza, Bakery, Italian\nAccommodation: Cozy room + bright apartment + rooftop lounge, Appleton, price: 666, room type: Private room, house rules: No smoking, minimum nights: 1, maximum occupancy: 1\n\nNumber of people: 1\nTotal cost: 286 (flight) + 72 (dinner) + 666 (accommodation) = 1024\nAccommodation minimum nights: 1/1\n\nDays: 2\nCurrent City: Appleton\nTransportation: -\nBreakfast: Swati Snacks, Appleton, Average Cost: 84, Cuisines: Desserts, Bakery, BBQ, Fast Food, American\nAttraction: The History Museum at the Castle, Appleton; Hearthstone Historic House Museum, Appleton\nLunch: Destination Live, Appleton, Average Cost: 30, Cuisines: Tea, Indian, BBQ\nDinner: Brick 29, Appleton, Average Cost: 97, Cuisines: Desserts, Tea, BBQ, Cafe, American, Mediterranean\nAccommodation: Cozy room + bright apartment + rooftop lounge, Appleton, price: 666, room type: Private room, house rules: No smoking, minimum nights: 1, maximum occupancy: 1\n\nNumber of people: 1\nTotal cost: 84 (breakfast) + 30 (lunch) + 97 (dinner) + 666 (accommodation) = 877\nAccommodation minimum nights: 2/1\n\nDays: 3\nCurrent City: from Appleton to Denver\nTransportation: Flight F3828308, from Appleton to Denver, duration: 3 hours 14 minutes, cost: 295\nBreakfast: Bliss Bakery, Appleton, Average Cost: 47, Cuisines: Cafe, Bakery, BBQ, Seafood\nAttraction: -\nLunch: -\nDinner: -\nAccommodation: -\n\nNumber of people: 1\nTotal cost: 47 (breakfast) + 295 (flight) = 342\n\nTotal cost across all days: 1024 + 877 + 342 = 2243\n\nUnfortunately, the total cost exceeds the budget of $1,800. To adjust the plan within the budget, we can consider alternative transportation or accommodation options. Here's the revised plan:\n\nRevised Travel Plan:\n\nDays: 1\nCurrent City: from Denver to Appleton\nTransportation: Self-driving, from Denver to Appleton, duration: 15 hours 36 mins, distance: 1,728 km, cost: 86\nBreakfast: -\nAttraction: -\nLunch: -\nDinner: Mikata Japanese Steakhouse, Appleton, Average Cost: 72, Cuisines: Cafe, Pizza, Bakery, Italian\nAccommodation: Large Rooms with Bar and PullOut Prime Greenpoint, Appleton, price: 174, room type: Private room, house rules: No visitors & No smoking & No pets, minimum nights: 4, maximum occupancy: 2\n\nNumber of people: 1\nTotal cost: 86 (self-driving) + 72 (dinner) + 174 (accommodation) = 332\nAccommodation minimum nights: 1/4\n\nDays: 2\nCurrent City: Appleton\nTransportation: -\nBreakfast: Swati Snacks, Appleton, Average Cost: 84, Cuisines: Desserts, Bakery, BBQ, Fast Food, American\nAttraction: The History Museum at the Castle, Appleton; Hearthstone Historic House Museum, Appleton\nLunch: Destination Live, Appleton, Average Cost: 30, Cuisines: Tea, Indian, BBQ\nDinner: Brick 29, Appleton, Average Cost: 97, Cuisines: Desserts, Tea, BBQ, Cafe, American, Mediterranean\nAccommodation: Large Rooms with Bar and PullOut Prime Greenpoint, Appleton, price: 174, room type: Private room, house rules: No visitors & No smoking & No pets, minimum nights: 4, maximum occupancy: 2\n\nNumber of people: 1\nTotal cost: 84 (breakfast) + 30 (lunch) + 97 (dinner) + 174 (accommodation) = 385\nAccommodation minimum nights: 2/4\n\nDays: 3\nCurrent City: from Appleton to Denver\nTransportation: Self-driving, from Appleton to Denver, duration: 15 hours 37 mins, distance: 1,714 km, cost: 85\nBreakfast: Bliss Bakery, Appleton, Average Cost: 47, Cuisines: Cafe, Bakery, BBQ, Seafood\nAttraction: -\nLunch: -\nDinner: -\nAccommodation: -\n\nNumber of people: 1\nTotal cost: 47 (breakfast) + 85 (self-driving) = 132\n\nTotal cost across all days: 332 + 385 + 132 = 849\n\nThe revised total cost is now within the budget of $1,800.", "gpt-4-1106-preview_direct_sole-planning_parsed_results": [{"day": 1, "current_city": "from Denver to Appleton", "transportation": "Self-driving, from Denver to Appleton, duration: 15 hours 36 mins, distance: 1,728 km", "breakfast": "-", "attraction": "-", "lunch": "-", "dinner": "Mikata Japanese Steakhouse, Appleton", "accommodation": "Large Rooms with Bar and PullOut Prime Greenpoint, Appleton"}, {"day": 2, "current_city": "Appleton", "transportation": "-", "breakfast": "Swati Snacks, Appleton", "attraction": "The History Museum at the Castle, Appleton;Hearthstone Historic House Museum, Appleton;", "lunch": "Destination Live, Appleton", "dinner": "Brick 29, Appleton", "accommodation": "Large Rooms with Bar and PullOut Prime Greenpoint, Appleton"}, {"day": 3, "current_city": "from Appleton to Denver", "transportation": "Self-driving, from Appleton to Denver, duration: 15 hours 37 mins, distance: 1,714 km", "breakfast": "Bliss Bakery, Appleton", "attraction": "-", "lunch": "-", "dinner": "-", "accommodation": "-"}]}]