[{"gpt-4-1106-preview_direct_sole-planning_results": "Travel Plan:\n\nDays: 1\nCurrent City: from Indianapolis to Charlotte, North Carolina\nTransportation: Flight F3666612, from Indianapolis to Charlotte, duration: 1 hour 46 minutes, cost: 106\nBreakfast: -\nAttraction: -\nLunch: -\nDinner: Olive Tree Cafe, Charlotte, North Carolina, cost: 23, cuisines: Tea, Chinese, Desserts\nAccommodation: Elegant Studio Apt in Prospect Heights, Charlotte, North Carolina, cost: 640, room type: Entire home/apt, house rules: No parties, maximum occupancy: 5\n\nNumber of people: 1\nTotal cost: 106 (flight) + 23 (dinner) + 640 (accommodation) = 769\nAccommodation minimum nights: 1/2\n\nDays: 2\nCurrent City: Charlotte, North Carolina\nTransportation: -\nBreakfast: Central Perk 7, Charlotte, North Carolina, cost: 87, cuisines: Pizza, Bakery, BBQ, Fast Food\nAttraction: Freedom Park; Levine Museum of the New South\nLunch: Subway, Charlotte, North Carolina, cost: 60, cuisines: Tea, Cafe, Mexican, Chinese, Seafood\nDinner: Cafe Maple Street, Charlotte, North Carolina, cost: 91, cuisines: Fast Food, Tea, Italian\nAccommodation: Elegant Studio Apt in Prospect Heights, Charlotte, North Carolina, cost: 640, room type: Entire home/apt, house rules: No parties, maximum occupancy: 5\n\nNumber of people: 1\nTotal cost: 87 (breakfast) + 60 (lunch) + 91 (dinner) + 640 (accommodation) = 878\nAccommodation minimum nights: 2/2\n\nDays: 3\nCurrent City: from Charlotte to Wilmington, North Carolina\nTransportation: Flight F3783482, from Charlotte to Wilmington, duration: 1 hour 21 minutes, cost: 41\nBreakfast: -\nAttraction: Wilmington Riverwalk; Wilmington Railroad Museum\nLunch: Azteca, Wilmington, North Carolina, cost: 56, cuisines: Cafe, Indian, BBQ\nDinner: Bandit Burrito, Wilmington, North Carolina, cost: 26, cuisines: Desserts, French, Bakery, Fast Food, Seafood\nAccommodation: Prime East Village location w/backyard garden!, Wilmington, North Carolina, cost: 978, room type: Entire home/apt, house rules: No pets & No smoking, maximum occupancy: 7\n\nNumber of people: 1\nTotal cost: 41 (flight) + 56 (lunch) + 26 (dinner) + 978 (accommodation) = 1101\nAccommodation minimum nights: 1/4\n\nDays: 4\nCurrent City: Wilmington, North Carolina\nTransportation: -\nBreakfast: Moonie's Texas Barbecue, Wilmington, North Carolina, cost: 38, cuisines: Chinese, Bakery, Fast Food\nAttraction: Airlie Gardens; The Children's Museum of Wilmington\nLunch: Taco Bus, Wilmington, North Carolina, cost: 59, cuisines: Tea, Cafe, BBQ\nDinner: Momo-Cha, Wilmington, North Carolina, cost: 92, cuisines: Desserts, Cafe, French, BBQ, Chinese\nAccommodation: Prime East Village location w/backyard garden!, Wilmington, North Carolina, cost: 978, room type: Entire home/apt, house rules: No pets & No smoking, maximum occupancy: 7\n\nNumber of people: 1\nTotal cost: 38 (breakfast) + 59 (lunch) + 92 (dinner) + 978 (accommodation) = 1167\nAccommodation minimum nights: 2/4\n\nDays: 5\nCurrent City: from Wilmington to Asheville, North Carolina\nTransportation: Self-driving, from Wilmington to Asheville, duration: 5 hours 19 mins, distance: 541 km, cost: 27\nBreakfast: -\nAttraction: Asheville Pinball Museum; Botanical Gardens at Asheville\nLunch: Vince's Restaurant & Pizzeria, Asheville, North Carolina, cost: 71, cuisines: French, Bakery, Indian, Pizza\nDinner: Vadakkan Pepper, Asheville, North Carolina, cost: 71, cuisines: Pizza, Italian, Bakery, BBQ, Fast Food, Mediterranean\nAccommodation: Beautiful 2BR Apt, 1 Min Walk to Major Subway!, Asheville, North Carolina, cost: 182, room type: Entire home/apt, house rules: No pets & No children under 10 & No visitors, maximum occupancy: 3\n\nNumber of people: 1\nTotal cost: 27 (transportation) + 71 (lunch) + 71 (dinner) + 182 (accommodation) = 351\nAccommodation minimum nights: 1/30\n\nDays: 6\nCurrent City: Asheville, North Carolina\nTransportation: -\nBreakfast: Glen's Bakehouse, Asheville, North Carolina, cost: 22, cuisines: Pizza, Bakery, Cafe, Indian, Seafood\nAttraction: Western North Carolina Nature Center; The North Carolina Arboretum\nLunch: Snax Points, Asheville, North Carolina, cost: 76, cuisines: Desserts, Tea, French, Fast Food, Chinese\nDinner: Bisht Food Court, Asheville, North Carolina, cost: 72, cuisines: Desserts, French, Bakery, BBQ, American, Seafood\nAccommodation: Beautiful 2BR Apt, 1 Min Walk to Major Subway!, Asheville, North Carolina, cost: 182, room type: Entire home/apt, house rules: No pets & No children under 10 & No visitors, maximum occupancy: 3\n\nNumber of people: 1\nTotal cost: 22 (breakfast) + 76 (lunch) + 72 (dinner) + 182 (accommodation) = 352\nAccommodation minimum nights: 2/30\n\nDays: 7\nCurrent City: from Asheville to Indianapolis\nTransportation: Self-driving, from Asheville to Indianapolis, duration: 7 hours 6 mins, distance: 757 km, cost: 37\nBreakfast: -\nAttraction: -\nLunch: -\nDinner: -\nAccommodation: -\n\nNumber of people: 1\nTotal cost: 37 (transportation) = 37\n\nTotal cost across all days: 769 + 878 + 1101 + 1167 + 351 + 352 + 37 = 4655\nCuisines: The prompt specifies no cuisines, so all cuisine constraints are satisfied", "gpt-4-1106-preview_direct_sole-planning_parsed_results": [{"day": 1, "current_city": "from Indianapolis to Charlotte, North Carolina", "transportation": "Flight Number: F3666612, from Indianapolis to Charlotte, Departure Time: -, Arrival Time: -", "breakfast": "-", "attraction": "-", "lunch": "-", "dinner": "Olive Tree Cafe, Charlotte, North Carolina", "accommodation": "Elegant Studio Apt in Prospect Heights, Charlotte, North Carolina"}, {"day": 2, "current_city": "Charlotte, North Carolina", "transportation": "-", "breakfast": "Central Perk 7, Charlotte, North Carolina", "attraction": "Freedom Park, Charlotte, North Carolina;Levine Museum of the New South, Charlotte, North Carolina;", "lunch": "Subway, Charlotte, North Carolina", "dinner": "Cafe Maple Street, Charlotte, North Carolina", "accommodation": "Elegant Studio Apt in Prospect Heights, Charlotte, North Carolina"}, {"day": 3, "current_city": "from Charlotte to Wilmington, North Carolina", "transportation": "Flight Number: F3783482, from Charlotte to Wilmington, Departure Time: -, Arrival Time: -", "breakfast": "-", "attraction": "Wilmington Riverwalk, Wilmington, North Carolina;Wilmington Railroad Museum, Wilmington, North Carolina;", "lunch": "Azteca, Wilmington, North Carolina", "dinner": "Bandit Burrito, Wilmington, North Carolina", "accommodation": "Prime East Village location w/backyard garden!, Wilmington, North Carolina"}, {"day": 4, "current_city": "Wilmington, North Carolina", "transportation": "-", "breakfast": "Moonie's Texas Barbecue, Wilmington, North Carolina", "attraction": "Airlie Gardens, Wilmington, North Carolina;The Children's Museum of Wilmington, Wilmington, North Carolina;", "lunch": "Taco Bus, Wilmington, North Carolina", "dinner": "Momo-Cha, Wilmington, North Carolina", "accommodation": "Prime East Village location w/backyard garden!, Wilmington, North Carolina"}, {"day": 5, "current_city": "from Wilmington to Asheville, North Carolina", "transportation": "Self-driving, from Wilmington to Asheville, Departure Time: -, Arrival Time: -", "breakfast": "-", "attraction": "Asheville Pinball Museum, Asheville, North Carolina;Botanical Gardens at Asheville, Asheville, North Carolina;", "lunch": "Vince's Restaurant & Pizzeria, Asheville, North Carolina", "dinner": "Vadakkan Pepper, Asheville, North Carolina", "accommodation": "Beautiful 2BR Apt, 1 Min Walk to Major Subway!, Asheville, North Carolina"}, {"day": 6, "current_city": "Asheville, North Carolina", "transportation": "-", "breakfast": "Glen's Bakehouse, Asheville, North Carolina", "attraction": "Western North Carolina Nature Center, Asheville, North Carolina;The North Carolina Arboretum, Asheville, North Carolina;", "lunch": "Snax Points, Asheville, North Carolina", "dinner": "Bisht Food Court, Asheville, North Carolina", "accommodation": "Beautiful 2BR Apt, 1 Min Walk to Major Subway!, Asheville, North Carolina"}, {"day": 7, "current_city": "from Asheville to Indianapolis", "transportation": "Self-driving, from Asheville to Indianapolis, Departure Time: -, Arrival Time: -", "breakfast": "-", "attraction": "-", "lunch": "-", "dinner": "-", "accommodation": "-"}]}]