[{"gpt-4-1106-preview_direct_sole-planning_results": "Travel Plan:\n\nDays: 1\nCurrent City: from Chicago to Albuquerque\nTransportation: Flight F4005732, from Chicago to Albuquerque, duration: 2 hours 51 minutes, distance: 1121 km, cost: 260\nBreakfast: -\nAttraction: -\nLunch: -\nDinner: Cantina Famiglia Mancini, Albuquerque, cost: 40, cuisines: Tea, Cafe, Desserts\nAccommodation: Luxury 1BD 1.5 Bath In UES in NYC, Albuquerque, cost: 185, room type: Entire home/apt, house rules: No visitors & No smoking, minimum nights: 2, maximum occupancy: 2\n\nNumber of people: 3\nTotal cost: (260 x 3) + (40 x 3) + (185 x 1) = 1,035\nAccommodation minimum nights: 1/2\n\nDays: 2\nCurrent City: Albuquerque\nTransportation: -\nBreakfast: Thatcher's Barbeque and Grill, Albuquerque, cost: 30, cuisines: Seafood, BBQ, Desserts, Fast Food\nAttraction: Petroglyph National Monument, Albuquerque; Sandia Peak Tramway, Albuquerque\nLunch: Genghis Grill, Albuquerque, cost: 24, cuisines: BBQ, Desserts, Italian\nDinner: Punjab Grill, Albuquerque, cost: 26, cuisines: Desserts, Cafe, Italian, Bakery, Chinese, Seafood\nAccommodation: Luxury 1BD 1.5 Bath In UES in NYC, Albuquerque, cost: 185, room type: Entire home/apt, house rules: No visitors & No smoking, minimum nights: 2, maximum occupancy: 2\n\nNumber of people: 3\nTotal cost: (30 x 3) + (24 x 3) + (26 x 3) + (185 x 1) = 395\nAccommodation minimum nights: 2/2\n\nDays: 3\nCurrent City: from Albuquerque to Chicago\nTransportation: Flight F3603308, from Albuquerque to Chicago, duration: 2 hours 54 minutes, distance: 1118 km, cost: 371\nBreakfast: Barbeque Nation, Albuquerque, cost: 85, cuisines: Bakery, BBQ, Desserts\nAttraction: -\nLunch: -\nDinner: -\nAccommodation: -\n\nNumber of people: 3\nTotal cost: (371 x 3) + (85 x 3) = 1,368\n\nTotal cost across all days: 1,035 + 395 + 1,368 = 2,798\n\nUnfortunately, the total cost of $2,798 exceeds the specified budget of $1,600. To adjust the plan to fit the budget, we need to change the transportation method from flights to self-driving, which is significantly cheaper.\n\nRevised Travel Plan:\n\nDays: 1\nCurrent City: from Chicago to Albuquerque\nTransportation: Self-driving, from Chicago to Albuquerque, duration: 19 hours 20 mins, distance: 2,153 km, cost: 107\nBreakfast: -\nAttraction: -\nLunch: -\nDinner: Cantina Famiglia Mancini, Albuquerque, cost: 40, cuisines: Tea, Cafe, Desserts\nAccommodation: Luxury 1BD 1.5 Bath In UES in NYC, Albuquerque, cost: 185, room type: Entire home/apt, house rules: No visitors & No smoking, minimum nights: 2, maximum occupancy: 2\n\nNumber of people: 3\nTotal cost: (107 x 1) + (40 x 3) + (185 x 1) = 402\nAccommodation minimum nights: 1/2\n\nDays: 2\nCurrent City: Albuquerque\nTransportation: -\nBreakfast: Thatcher's Barbeque and Grill, Albuquerque, cost: 30, cuisines: Seafood, BBQ, Desserts, Fast Food\nAttraction: Petroglyph National Monument, Albuquerque; Sandia Peak Tramway, Albuquerque\nLunch: Genghis Grill, Albuquerque, cost: 24, cuisines: BBQ, Desserts, Italian\nDinner: Punjab Grill, Albuquerque, cost: 26, cuisines: Desserts, Cafe, Italian, Bakery, Chinese, Seafood\nAccommodation: Luxury 1BD 1.5 Bath In UES in NYC, Albuquerque, cost: 185, room type: Entire home/apt, house rules: No visitors & No smoking, minimum nights: 2, maximum occupancy: 2\n\nNumber of people: 3\nTotal cost: (30 x 3) + (24 x 3) + (26 x 3) + (185 x 1) = 395\nAccommodation minimum nights: 2/2\n\nDays: 3\nCurrent City: from Albuquerque to Chicago\nTransportation: Self-driving, from Albuquerque to Chicago, duration: 19 hours 20 mins, distance: 2,151 km, cost: 107\nBreakfast: Barbeque Nation, Albuquerque, cost: 85, cuisines: Bakery, BBQ, Desserts\nAttraction: -\nLunch: -\nDinner: -\nAccommodation: -\n\nNumber of people: 3\nTotal cost: (107 x 1) + (85 x 3) = 362\n\nTotal cost across all days: 402 + 395 + 362 = 1,159\n\nThe revised total cost of $1,159 is now within the specified budget of $1,600.", "gpt-4-1106-preview_direct_sole-planning_parsed_results": [{"day": 1, "current_city": "from Chicago to Albuquerque", "transportation": "Self-driving, from Chicago to Albuquerque, duration: 19 hours 20 mins, distance: 2,153 km", "breakfast": "-", "attraction": "-", "lunch": "-", "dinner": "Cantina Famiglia Mancini, Albuquerque", "accommodation": "Luxury 1BD 1.5 Bath In UES in NYC, Albuquerque"}, {"day": 2, "current_city": "Albuquerque", "transportation": "-", "breakfast": "Thatcher's Barbeque and Grill, Albuquerque", "attraction": "Petroglyph National Monument, Albuquerque;Sandia Peak Tramway, Albuquerque;", "lunch": "Genghis Grill, Albuquerque", "dinner": "Punjab Grill, Albuquerque", "accommodation": "Luxury 1BD 1.5 Bath In UES in NYC, Albuquerque"}, {"day": 3, "current_city": "from Albuquerque to Chicago", "transportation": "Self-driving, from Albuquerque to Chicago, duration: 19 hours 20 mins, distance: 2,151 km", "breakfast": "Barbeque Nation, Albuquerque", "attraction": "-", "lunch": "-", "dinner": "-", "accommodation": "-"}]}]