[{"gpt-4-1106-preview_direct_sole-planning_results": "Travel Plan:\n\nDays: 1\nCurrent City: from South Bend to Atlanta\nTransportation: Flight F3648988, from South Bend to Atlanta, duration: 1 hour 51 minutes, cost: $170 per person\nBreakfast: -\nAttraction: -\nLunch: -\nDinner: Asian Bistro, Atlanta, cost: $27, cuisines: Tea, Bakery, Seafood\nAccommodation: Bright, Modern, Clean, Spacious, Brooklyn Home, Atlanta, cost: $1034, room type: Entire home/apt, house rules: No children under 10, minimum nights: 3, maximum occupancy: 4\n\nNumber of people: 2\nTotal cost: (170 x 2) + (27 x 2) + 1034 = $1428\nAccommodation minimum nights: 1/3\n\nDays: 2\nCurrent City: Atlanta\nTransportation: -\nBreakfast: Saffron, Atlanta, cost: $39, cuisines: Tea, Cafe, Fast Food, Seafood\nAttraction: Georgia Aquarium, Atlanta; World of Coca-Cola, Atlanta\nLunch: Chef Style, Atlanta, cost: $59, cuisines: Pizza, American, Desserts, Seafood\nDinner: Pizza Central, Atlanta, cost: $75, cuisines: Cafe, Bakery, BBQ, Fast Food, Chinese, Indian\nAccommodation: Bright, Modern, Clean, Spacious, Brooklyn Home, Atlanta, cost: $1034, room type: Entire home/apt, house rules: No children under 10, minimum nights: 3, maximum occupancy: 4\n\nNumber of people: 2\nTotal cost: (39 x 2) + (59 x 2) + (75 x 2) + 1034 = $1370\nAccommodation minimum nights: 2/3\n\nDays: 3\nCurrent City: Atlanta to South Bend\nTransportation: Flight F3637050, from Atlanta to South Bend, duration: 1 hour 40 minutes, cost: $159 per person\nBreakfast: The Chinese & Thai Restaurant, Atlanta, cost: $57, cuisines: Desserts, Tea, Italian, Bakery, Fast Food\nAttraction: -\nLunch: -\nDinner: -\nAccommodation: -\n\nNumber of people: 2\nTotal cost: (159 x 2) + (57 x 2) = $432\n\nTotal cost across all days: $1428 + $1370 + $432 = $3230\n\nUnfortunately, the total cost of $3230 exceeds the specified budget of $1500. To adjust the plan within the budget, we need to make some changes:\n\n- Change the accommodation to a more affordable option that allows parties.\n- Opt for less expensive meal options or reduce the number of paid meals by including meals provided at the accommodation if available.\n- Review the attractions to include free or lower-cost options.\n\nRevised Travel Plan:\n\nDays: 1\nCurrent City: from South Bend to Atlanta\nTransportation: Flight F3648988, from South Bend to Atlanta, duration: 1 hour 51 minutes, cost: $170 per person\nBreakfast: -\nAttraction: -\nLunch: -\nDinner: Asian Bistro, Atlanta, cost: $27, cuisines: Tea, Bakery, Seafood\nAccommodation: Unique 2BR Apartment, Atlanta, cost: $394, room type: Entire home/apt, house rules: No parties & No pets & No children under 10, minimum nights: 2, maximum occupancy: 3\n\nNumber of people: 2\nTotal cost: (170 x 2) + (27 x 2) + 394 = $788\nAccommodation minimum nights: 1/2\n\nDays: 2\nCurrent City: Atlanta\nTransportation: -\nBreakfast: Saffron, Atlanta, cost: $39, cuisines: Tea, Cafe, Fast Food, Seafood\nAttraction: Centennial Olympic Park, Atlanta (free)\nLunch: Shri Ram Restaurant, Atlanta, cost: $55, cuisines: Tea, Mexican, Indian, Fast Food\nDinner: Baba Au Rhum, Atlanta, cost: $27, cuisines: Desserts, Pizza, Mexican, BBQ, Fast Food\nAccommodation: Unique 2BR Apartment, Atlanta, cost: $394, room type: Entire home/apt, house rules: No parties & No pets & No children under 10, minimum nights: 2, maximum occupancy: 3\n\nNumber of people: 2\nTotal cost: (39 x 2) + (55 x 2) + (27 x 2) + 394 = $630\nAccommodation minimum nights: 2/2\n\nDays: 3\nCurrent City: Atlanta to South Bend\nTransportation: Flight F3637050, from Atlanta to South Bend, duration: 1 hour 40 minutes, cost: $159 per person\nBreakfast: -\nAttraction: -\nLunch: -\nDinner: -\nAccommodation: -\n\nNumber of people: 2\nTotal cost: (159 x 2) = $318\n\nTotal revised cost across all days: $788 + $630 + $318 = $1736\n\nThe revised plan still exceeds the budget. To further adjust:\n\n- Opt for the cheapest flight option available.\n- Further reduce meal costs or choose accommodations that include breakfast.\n\nPlease note that the provided reference information does not include cheaper accommodation options that allow parties, and the budget constraint is very tight for the requirements. Additional information or adjustments to the requirements may be necessary to create a feasible plan within the budget.", "gpt-4-1106-preview_direct_sole-planning_parsed_results": [{"day": 1, "current_city": "from South Bend to Atlanta", "transportation": "Flight Number: F3648988, from South Bend to Atlanta, Departure Time: -, Arrival Time: -", "breakfast": "-", "attraction": "-", "lunch": "-", "dinner": "Asian Bistro, Atlanta", "accommodation": "Bright, Modern, Clean, Spacious, Brooklyn Home, Atlanta"}, {"day": 2, "current_city": "Atlanta", "transportation": "-", "breakfast": "Saffron, Atlanta", "attraction": "Georgia Aquarium, Atlanta;World of Coca-Cola, Atlanta;", "lunch": "Chef Style, Atlanta", "dinner": "Pizza Central, Atlanta", "accommodation": "Bright, Modern, Clean, Spacious, Brooklyn Home, Atlanta"}, {"day": 3, "current_city": "from Atlanta to South Bend", "transportation": "Flight Number: F3637050, from Atlanta to South Bend, Departure Time: -, Arrival Time: -", "breakfast": "The Chinese & Thai Restaurant, Atlanta", "attraction": "-", "lunch": "-", "dinner": "-", "accommodation": "-"}, {"day": 1, "current_city": "from South Bend to Atlanta", "transportation": "Flight Number: F3648988, from South Bend to Atlanta, Departure Time: -, Arrival Time: -", "breakfast": "-", "attraction": "-", "lunch": "-", "dinner": "Asian Bistro, Atlanta", "accommodation": "Unique 2BR Apartment, Atlanta"}, {"day": 2, "current_city": "Atlanta", "transportation": "-", "breakfast": "Saffron, Atlanta", "attraction": "Centennial Olympic Park, Atlanta", "lunch": "Shri Ram Restaurant, Atlanta", "dinner": "Baba Au Rhum, Atlanta", "accommodation": "Unique 2BR Apartment, Atlanta"}, {"day": 3, "current_city": "from Atlanta to South Bend", "transportation": "Flight Number: F3637050, from Atlanta to South Bend, Departure Time: -, Arrival Time: -", "breakfast": "-", "attraction": "-", "lunch": "-", "dinner": "-", "accommodation": "-"}]}]