[{"gpt-4-1106-preview_direct_sole-planning_results": "Travel Plan:\n\nDays: 1\nCurrent City: from Charlotte to Newark, New Jersey\nTransportation: Flight F3715865, from Charlotte to Newark, duration: 1 hours 43 minutes, cost: 135\nBreakfast: -\nAttraction: -\nLunch: -\nDinner: Artistry, Newark, New Jersey, cost: 79, cuisines: Cafe, Pizza, Desserts, Seafood\nAccommodation: Rustic Modern Brooklyn Apartment, Newark, New Jersey, cost: 294, room type: Entire home/apt, house rules: No pets, minimum nights: 30\n\nNumber of people: 1\nTotal cost: 135 x 1 + 79 x 1 + 294 x 1 = 508\nAccommodation minimum nights: 1/30\n\nDays: 2\nCurrent City: Newark, New Jersey\nTransportation: -\nBreakfast: Mirage Restro Bar, Newark, New Jersey, cost: 51, cuisines: Bakery, American, Desserts, Fast Food\nAttraction: The Newark Museum of Art, Newark, New Jersey; Military Park, Newark, New Jersey\nLunch: Bernardo's, Newark, New Jersey, cost: 84, cuisines: Desserts, Pizza, BBQ, American, Mediterranean\nDinner: Escape Terrace Bar Kitchen, Newark, New Jersey, cost: 100, cuisines: Tea, Cafe, Bakery, Chinese, Seafood\nAccommodation: Rustic Modern Brooklyn Apartment, Newark, New Jersey, cost: 294, room type: Entire home/apt, house rules: No pets, minimum nights: 30\n\nNumber of people: 1\nTotal cost: 51 x 1 + 84 x 1 + 100 x 1 + 294 x 1 = 529\nAccommodation minimum nights: 2/30\n\nDays: 3\nCurrent City: from Newark to Trenton, New Jersey\nTransportation: Self-driving, from Newark to Trenton, duration: 1 hour 5 mins, distance: 93.8 km, cost: 4\nBreakfast: Harmann Restaurant, Newark, New Jersey, cost: 57, cuisines: Tea, Cafe, American, Fast Food\nAttraction: Old Barracks Museum, Trenton, New Jersey; New Jersey State Museum, Trenton, New Jersey\nLunch: Mario's Italian Restaurant, Trenton, New Jersey, cost: 13, cuisines: Desserts, Tea, Mexican, Bakery, Cafe, Indian\nDinner: Global Grill, Trenton, New Jersey, cost: 20, cuisines: Desserts, Pizza, BBQ, Chinese, Mediterranean\nAccommodation: Whole Floor, 2 BR Apt. in Iconic Greenwich Village, Trenton, New Jersey, cost: 239, room type: Entire home/apt, house rules: No visitors & No smoking, minimum nights: 2\n\nNumber of people: 1\nTotal cost: 4 x 1 + 57 x 1 + 13 x 1 + 20 x 1 + 239 x 1 = 333\nAccommodation minimum nights: 1/2\n\nDays: 4\nCurrent City: Trenton, New Jersey\nTransportation: -\nBreakfast: The Lady & Sons, Trenton, New Jersey, cost: 38, cuisines: Tea, Pizza, Bakery, Cafe, American\nAttraction: Grounds For Sculpture, Trenton, New Jersey; Trenton Battle Monument, Trenton, New Jersey\nLunch: Tuscan Oven, Trenton, New Jersey, cost: 74, cuisines: Desserts, Tea, Italian, Fast Food, Cafe\nDinner: The Cheesecake Factory, Trenton, New Jersey, cost: 36, cuisines: Desserts, Fast Food\nAccommodation: Whole Floor, 2 BR Apt. in Iconic Greenwich Village, Trenton, New Jersey, cost: 239, room type: Entire home/apt, house rules: No visitors & No smoking, minimum nights: 2\n\nNumber of people: 1\nTotal cost: 38 x 1 + 74 x 1 + 36 x 1 + 239 x 1 = 387\nAccommodation minimum nights: 2/2\n\nDays: 5\nCurrent City: from Trenton to Charlotte\nTransportation: Flight F3561600, from Trenton to Charlotte, duration: 2 hours 0 minutes, cost: 201\nBreakfast: Sonya Bakery Cafe, Trenton, New Jersey, cost: 63, cuisines: Bakery, Fast Food\nAttraction: -\nLunch: -\nDinner: -\nAccommodation: -\n\nNumber of people: 1\nTotal cost: 201 x 1 + 63 x 1 = 264\n\nTotal cost across all days: 508 + 529 + 333 + 387 + 264 = 2021\nCuisines: The prompt specifies no cuisines, so all cuisine constraints are satisfied\n\nNote: The accommodation \"Rustic Modern Brooklyn Apartment\" in Newark has a minimum stay of 30 nights, which does not fit the travel plan. However, due to the lack of provided alternatives within the reference information, it has been included for the sake of completing the travel plan. Adjustments should be made to find suitable accommodation that meets the travel duration requirements.", "gpt-4-1106-preview_direct_sole-planning_parsed_results": [{"day": 1, "current_city": "from Charlotte to Newark, New Jersey", "transportation": "Flight Number: F3715865, from Charlotte to Newark, Departure Time: -, Arrival Time: -", "breakfast": "-", "attraction": "-", "lunch": "-", "dinner": "Artistry, Newark, New Jersey", "accommodation": "Rustic Modern Brooklyn Apartment, Newark, New Jersey"}, {"day": 2, "current_city": "Newark, New Jersey", "transportation": "-", "breakfast": "Mirage Restro Bar, Newark, New Jersey", "attraction": "The Newark Museum of Art, Newark, New Jersey;Military Park, Newark, New Jersey;", "lunch": "Bernardo's, Newark, New Jersey", "dinner": "Escape Terrace Bar Kitchen, Newark, New Jersey", "accommodation": "Rustic Modern Brooklyn Apartment, Newark, New Jersey"}, {"day": 3, "current_city": "from Newark to Trenton, New Jersey", "transportation": "Self-driving, from Newark to Trenton", "breakfast": "Harmann Restaurant, Newark, New Jersey", "attraction": "Old Barracks Museum, Trenton, New Jersey;New Jersey State Museum, Trenton, New Jersey;", "lunch": "Mario's Italian Restaurant, Trenton, New Jersey", "dinner": "Global Grill, Trenton, New Jersey", "accommodation": "Whole Floor, 2 BR Apt. in Iconic Greenwich Village, Trenton, New Jersey"}, {"day": 4, "current_city": "Trenton, New Jersey", "transportation": "-", "breakfast": "The Lady & Sons, Trenton, New Jersey", "attraction": "Grounds For Sculpture, Trenton, New Jersey;Trenton Battle Monument, Trenton, New Jersey;", "lunch": "Tuscan Oven, Trenton, New Jersey", "dinner": "The Cheesecake Factory, Trenton, New Jersey", "accommodation": "Whole Floor, 2 BR Apt. in Iconic Greenwich Village, Trenton, New Jersey"}, {"day": 5, "current_city": "from Trenton to Charlotte", "transportation": "Flight Number: F3561600, from Trenton to Charlotte, Departure Time: -, Arrival Time: -", "breakfast": "Sonya Bakery Cafe, Trenton, New Jersey", "attraction": "-", "lunch": "-", "dinner": "-", "accommodation": "-"}]}]