[{"gpt-4-1106-preview_direct_sole-planning_results": "Travel Plan:\n\nDays: 1\nCurrent City: from Reno to Abilene, Texas\nTransportation: Self-driving, from Reno to Abilene, duration: 22 hours 27 mins, distance: 2,412 km, cost: $120 x 2 = $240\nBreakfast: -\nAttraction: -\nLunch: -\nDinner: Thai Garden, Abilene, Texas, cost: $13 x 2 = $26, cuisines: Cafe, American, Desserts\nAccommodation: Apartment minutes from manhattan, Abilene, Texas, cost: $295 x 2 = $590, room type: Entire home/apt, house rules: No pets & No visitors, minimum nights: 2, maximum occupancy: 2\n\nNumber of people: 2\nTotal cost: $240 + $26 + $590 = $856\nAccommodation minimum nights: 1/2\n\nDays: 2\nCurrent City: Abilene, Texas\nTransportation: -\nBreakfast: Crispy Crust, Abilene, Texas, cost: $54 x 2 = $108, cuisines: Desserts, Bakery, Cafe, American, Seafood\nAttraction: The Grace Museum, Abilene, Texas; Frontier Texas!, Abilene, Texas\nLunch: Mediumwelldone, Abilene, Texas, cost: $91 x 2 = $182, cuisines: Tea, French, BBQ, Cafe, Seafood\nDinner: Mamagoto, Abilene, Texas, cost: $93 x 2 = $186, cuisines: Desserts, Tea, Bakery, Cafe, Indian, Mediterranean\nAccommodation: Apartment minutes from manhattan, Abilene, Texas, cost: $295 x 2 = $590, room type: Entire home/apt, house rules: No pets & No visitors, minimum nights: 2, maximum occupancy: 2\n\nNumber of people: 2\nTotal cost: $108 + $182 + $186 + $590 = $1066\nAccommodation minimum nights: 2/2\n\nDays: 3\nCurrent City: from Abilene to Amarillo, Texas\nTransportation: Self-driving, from Abilene to Amarillo, duration: 4 hours 10 mins, distance: 446 km, cost: $22 x 2 = $44\nBreakfast: Lotus Kitchen, Abilene, Texas, cost: $15 x 2 = $30, cuisines: French, Bakery, BBQ\nAttraction: Cadillac Ranch, Amarillo, Texas; Amarillo Botanical Gardens, Amarillo, Texas\nLunch: The Cinnamon Kitchen, Amarillo, Texas, cost: $69 x 2 = $138, cuisines: Desserts, Tea, Pizza, Chinese, Seafood\nDinner: Komachi, Amarillo, Texas, cost: $71 x 2 = $142, cuisines: Desserts, Tea, Fast Food, Chinese, Mediterranean\nAccommodation: Harlem Humble Abode - 1 bedroom - Cute and Quaint, Amarillo, Texas, cost: $409 x 2 = $818, room type: Entire home/apt, house rules: No pets, minimum nights: 5, maximum occupancy: 3\n\nNumber of people: 2\nTotal cost: $44 + $30 + $138 + $142 + $818 = $1172\nAccommodation minimum nights: 1/5\n\nDays: 4\nCurrent City: Amarillo, Texas\nTransportation: -\nBreakfast: Wood Box Cafe, Amarillo, Texas, cost: $11 x 2 = $22, cuisines: Desserts, French, Fast Food, Cafe, American\nAttraction: Amarillo Zoo, Amarillo, Texas; Don Harrington Discovery Center, Amarillo, Texas\nLunch: Sigree Global Grill, Amarillo, Texas, cost: $35 x 2 = $70, cuisines: Chinese, BBQ, Cafe, Desserts\nDinner: Anand Restaurant, Amarillo, Texas, cost: $53 x 2 = $106, cuisines: Fast Food, Seafood, Desserts, Italian\nAccommodation: Harlem Humble Abode - 1 bedroom - Cute and Quaint, Amarillo, Texas, cost: $409 x 2 = $818, room type: Entire home/apt, house rules: No pets, minimum nights: 5, maximum occupancy: 3\n\nNumber of people: 2\nTotal cost: $22 + $70 + $106 + $818 = $1016\nAccommodation minimum nights: 2/5\n\nDays: 5\nCurrent City: from Amarillo to Lubbock, Texas\nTransportation: Self-driving, from Amarillo to Lubbock, duration: 1 hour 47 mins, distance: 197 km, cost: $9 x 2 = $18\nBreakfast: Punjabi Chaap Corner, Amarillo, Texas, cost: $62 x 2 = $124, cuisines: Desserts, Pizza, Italian, Bakery, Fast Food\nAttraction: Buddy Holly Center, Lubbock, Texas; National Ranching Heritage Center, Lubbock, Texas\nLunch: Grand Barbeque Buffet Restaurant, Lubbock, Texas, cost: $20 x 2 = $40, cuisines: Tea, French, Fast Food, Cafe, Seafood\nDinner: Paris 6 Classique, Lubbock, Texas, cost: $91 x 2 = $182, cuisines: Desserts, Cafe, Pizza, Mexican, BBQ, Chinese\nAccommodation: Private bedroom in UWS Apartment, Lubbock, Texas, cost: $709 x 2 = $1418, room type: Private room, house rules: No visitors & No pets, minimum nights: 2, maximum occupancy: 2\n\nNumber of people: 2\nTotal cost: $18 + $124 + $40 + $182 + $1418 = $1782\nAccommodation minimum nights: 1/2\n\nDays: 6\nCurrent City: Lubbock, Texas\nTransportation: -\nBreakfast: 3 Squares Diner, Lubbock, Texas, cost: $73 x 2 = $146, cuisines: Pizza, Indian, Fast Food\nAttraction: American Windmill Museum, Lubbock, Texas; Mackenzie Main City Park, Lubbock, Texas\nLunch: Mosaic - Country Inn & Suites By Carlson, Lubbock, Texas, cost: $29 x 2 = $58, cuisines: Chinese, Indian, Desserts, Seafood\nDinner: Sultanat, Lubbock, Texas, cost: $72 x 2 = $144, cuisines: Chinese, Bakery, BBQ, Cafe\nAccommodation: Private bedroom in UWS Apartment, Lubbock, Texas, cost: $709 x 2 = $1418, room type: Private room, house rules: No visitors & No pets, minimum nights: 2, maximum occupancy: 2\n\nNumber of people: 2\nTotal cost: $146 + $58 + $144 + $1418 = $1766\nAccommodation minimum nights: 2/2\n\nDays: 7\nCurrent City: from Lubbock to Reno\nTransportation: Self-driving, from Lubbock to Reno, duration: 20 hours 3 mins, distance: 2,145 km, cost: $107 x 2 = $214\nBreakfast: The Town House Cafe, Lubbock, Texas, cost: $90 x 2 = $180, cuisines: Tea, American, BBQ, Cafe, Indian, Seafood\nAttraction: -\nLunch: -\nDinner: -\nAccommodation: -\n\nNumber of people: 2\nTotal cost: $214 + $180 = $394\n\nTotal cost across all days: $856 + $1066 + $1172 + $1016 + $1782 + $1766 + $394 = $8050\n\n** Adjustments Required: The total cost exceeds the budget of $4,300. To fit within the budget, consider the following changes:\n- Opt for more affordable accommodations.\n- Reduce meal costs by choosing less expensive restaurants.\n- Limit attractions to free or lower-cost options.\n\n** Note: The provided travel plan exceeds the budget and does not meet all constraints. Adjustments are necessary to align with the budget and requirements.", "gpt-4-1106-preview_direct_sole-planning_parsed_results": [{"day": 1, "current_city": "from Reno to Abilene, Texas", "transportation": "Self-driving, from Reno to Abilene, duration: 22 hours 27 mins, distance: 2,412 km", "breakfast": "-", "attraction": "-", "lunch": "-", "dinner": "Thai Garden, Abilene, Texas", "accommodation": "Apartment minutes from manhattan, Abilene, Texas"}, {"day": 2, "current_city": "Abilene, Texas", "transportation": "-", "breakfast": "Crispy Crust, Abilene, Texas", "attraction": "The Grace Museum, Abilene, Texas;Frontier Texas!, Abilene, Texas;", "lunch": "Mediumwelldone, Abilene, Texas", "dinner": "Mamagoto, Abilene, Texas", "accommodation": "Apartment minutes from manhattan, Abilene, Texas"}, {"day": 3, "current_city": "from Abilene to Amarillo, Texas", "transportation": "Self-driving, from Abilene to Amarillo, duration: 4 hours 10 mins, distance: 446 km", "breakfast": "Lotus Kitchen, Abilene, Texas", "attraction": "Cadillac Ranch, Amarillo, Texas;Amarillo Botanical Gardens, Amarillo, Texas;", "lunch": "The Cinnamon Kitchen, Amarillo, Texas", "dinner": "Komachi, Amarillo, Texas", "accommodation": "Harlem Humble Abode - 1 bedroom - Cute and Quaint, Amarillo, Texas"}, {"day": 4, "current_city": "Amarillo, Texas", "transportation": "-", "breakfast": "Wood Box Cafe, Amarillo, Texas", "attraction": "Amarillo Zoo, Amarillo, Texas;Don Harrington Discovery Center, Amarillo, Texas;", "lunch": "Sigree Global Grill, Amarillo, Texas", "dinner": "Anand Restaurant, Amarillo, Texas", "accommodation": "Harlem Humble Abode - 1 bedroom - Cute and Quaint, Amarillo, Texas"}, {"day": 5, "current_city": "from Amarillo to Lubbock, Texas", "transportation": "Self-driving, from Amarillo to Lubbock, duration: 1 hour 47 mins, distance: 197 km", "breakfast": "Punjabi Chaap Corner, Amarillo, Texas", "attraction": "Buddy Holly Center, Lubbock, Texas;National Ranching Heritage Center, Lubbock, Texas;", "lunch": "Grand Barbeque Buffet Restaurant, Lubbock, Texas", "dinner": "Paris 6 Classique, Lubbock, Texas", "accommodation": "Private bedroom in UWS Apartment, Lubbock, Texas"}, {"day": 6, "current_city": "Lubbock, Texas", "transportation": "-", "breakfast": "3 Squares Diner, Lubbock, Texas", "attraction": "American Windmill Museum, Lubbock, Texas;Mackenzie Main City Park, Lubbock, Texas;", "lunch": "Mosaic - Country Inn & Suites By Carlson, Lubbock, Texas", "dinner": "Sultanat, Lubbock, Texas", "accommodation": "Private bedroom in UWS Apartment, Lubbock, Texas"}, {"day": 7, "current_city": "from Lubbock to Reno", "transportation": "Self-driving, from Lubbock to Reno, duration: 20 hours 3 mins, distance: 2,145 km", "breakfast": "The Town House Cafe, Lubbock, Texas", "attraction": "-", "lunch": "-", "dinner": "-", "accommodation": "-"}]}]