[{"gpt-4-1106-preview_direct_sole-planning_results": "Travel Plan:\n\nDays: 1\nCurrent City: from Myrtle Beach to Detroit, Michigan\nTransportation: Flight F3623834, from Myrtle Beach to Detroit, duration: 2 hours 5 minutes, cost: $258 per person\nBreakfast: -\nAttraction: Detroit Institute of Arts, Detroit, Michigan\nLunch: Southern Bliss Bakery, Detroit, Michigan, cost: $28, cuisines: Tea, BBQ, Desserts, Seafood\nDinner: A Dong Restaurant, Detroit, Michigan, cost: $40, cuisines: Tea, Cafe, Pizza\nAccommodation: Comfy King Bed Feet from Subway, Detroit, Michigan, cost: $568, room type: Private room\n\nNumber of people: 2\nTotal cost: (258 x 2) + (28 x 2) + (40 x 2) + (568 x 1) = $972\nAccommodation minimum nights: 1/3\n\nDays: 2\nCurrent City: Detroit, Michigan\nTransportation: -\nBreakfast: BMG - All Day Dining, Detroit, Michigan, cost: $15, cuisines: Desserts, Bakery, BBQ, Indian, Seafood\nAttraction: Detroit Historical Museum, Detroit, Michigan; Campus Martius Park, Detroit, Michigan\nLunch: Cafe And More, Detroit, Michigan, cost: $41, cuisines: Tea, Bakery, Italian\nDinner: Bistro Flamme Bois, Detroit, Michigan, cost: $100, cuisines: Chinese, Bakery, BBQ\nAccommodation: Comfy King Bed Feet from Subway, Detroit, Michigan, cost: $568, room type: Private room\n\nNumber of people: 2\nTotal cost: (15 x 2) + (41 x 2) + (100 x 2) + (568 x 1) = $878\nAccommodation minimum nights: 2/3\n\nDays: 3\nCurrent City: from Detroit to Lansing, Michigan\nTransportation: Self-driving, from Detroit to Lansing, duration: 1 hour 24 mins, distance: 146 km, cost: $7\nBreakfast: Frequent Bakes, Detroit, Michigan, cost: $50, cuisines: Cafe, Pizza, BBQ, Desserts\nAttraction: Impression 5 Science Center, Lansing, Michigan; Potter Park Zoo, Lansing, Michigan\nLunch: Manuel's Bread Cafe, Lansing, Michigan, cost: $28, cuisines: French, Pizza, Seafood\nDinner: Huey's On The River, Lansing, Michigan, cost: $75, cuisines: Tea, French, Bakery, Fast Food, Cafe\nAccommodation: 2 bedroom apartment in harlem, Lansing, Michigan, cost: $943, room type: Entire home/apt\n\nNumber of people: 2\nTotal cost: (7 x 2) + (50 x 2) + (28 x 2) + (75 x 2) + (943 x 1) = $1,229\nAccommodation minimum nights: 1/1\n\nDays: 4\nCurrent City: Lansing, Michigan\nTransportation: -\nBreakfast: Front Street Brewery, Lansing, Michigan, cost: $25, cuisines: BBQ, Mediterranean, Desserts, Italian\nAttraction: Michigan History Center, Lansing, Michigan; Hawk Island Park, Lansing, Michigan\nLunch: Golden China, Lansing, Michigan, cost: $66, cuisines: Chinese, Indian, Cafe, BBQ\nDinner: Tony's Italian Restaurant & Pizza, Lansing, Michigan, cost: $83, cuisines: Tea, Pizza, Indian, BBQ, American\nAccommodation: 2 bedroom apartment in harlem, Lansing, Michigan, cost: $943, room type: Entire home/apt\n\nNumber of people: 2\nTotal cost: (25 x 2) + (66 x 2) + (83 x 2) + (943 x 1) = $1,285\nAccommodation minimum nights: 2/1\n\nDays: 5\nCurrent City: from Lansing to Kalamazoo, Michigan\nTransportation: Self-driving, from Lansing to Kalamazoo, duration: 1 hour 17 mins, distance: 122 km, cost: $6\nBreakfast: Nini's Kitchen, Lansing, Michigan, cost: $30, cuisines: Cafe, Mexican, Desserts\nAttraction: Kalamazoo Valley Museum, Kalamazoo, Michigan; Kalamazoo Institute of Arts, Kalamazoo, Michigan\nLunch: Giulios Greek & Italian Restaurant, Kalamazoo, Michigan, cost: $76, cuisines: Fast Food, French, Desserts, Seafood\nDinner: Cha cTea, Kalamazoo, Michigan, cost: $77, cuisines: Cafe, Pizza, Mediterranean\nAccommodation: East 63rd street, Studio Serviced Apartment, Kalamazoo, Michigan, cost: $417, room type: Entire home/apt\n\nNumber of people: 2\nTotal cost: (6 x 2) + (30 x 2) + (76 x 2) + (77 x 2) + (417 x 1) = $1,135\nAccommodation minimum nights: 1/30\n\nDays: 6\nCurrent City: Kalamazoo, Michigan\nTransportation: -\nBreakfast: Oxy Lounge, Kalamazoo, Michigan, cost: $65, cuisines: Tea, Bakery, BBQ\nAttraction: Kalamazoo Nature Center, Kalamazoo, Michigan; Milham Park, Kalamazoo, Michigan\nLunch: Tamasha In Tafree, Kalamazoo, Michigan, cost: $11, cuisines: Desserts, Italian, French, Bakery, Seafood\nDinner: Shree Rathnam, Kalamazoo, Michigan, cost: $84, cuisines: Cafe, Indian, American, Pizza\nAccommodation: East 63rd street, Studio Serviced Apartment, Kalamazoo, Michigan, cost: $417, room type: Entire home/apt\n\nNumber of people: 2\nTotal cost: (65 x 2) + (11 x 2) + (84 x 2) + (417 x 1) = $1,142\nAccommodation minimum nights: 2/30\n\nDays: 7\nCurrent City: from Kalamazoo to Myrtle Beach\nTransportation: Self-driving, from Kalamazoo to Myrtle Beach, duration: 13 hours 50 mins, distance: 1,400 km, cost: $70\nBreakfast: Django, Kalamazoo, Michigan, cost: $65, cuisines: Mediterranean, Desserts, Fast Food\nAttraction: -\nLunch: -\nDinner: -\nAccommodation: -\n\nNumber of people: 2\nTotal cost: (70 x 2) + (65 x 2) = $270\n\nTotal cost across all days: $972 + $878 + $1,229 + $1,285 + $1,135 + $1,142 + $270 = $6,911\nCuisines: French and American cuisines are included in the plan\nRemaining Budget: $8,300 - $6,911 = $1,389\n\nPlease note that the accommodation on Day 5 has a minimum stay of 30 nights, which is not suitable for this itinerary. However, due to the lack of provided alternatives, it has been included in the plan. Adjustments to the accommodation should be made to adhere to the itinerary's duration.", "gpt-4-1106-preview_direct_sole-planning_parsed_results": [{"day": 1, "current_city": "from Myrtle Beach to Detroit, Michigan", "transportation": "Flight Number: F3623834, from Myrtle Beach to Detroit, duration: 2 hours 5 minutes", "breakfast": "-", "attraction": "Detroit Institute of Arts, Detroit, Michigan;", "lunch": "Southern Bliss Bakery, Detroit, Michigan", "dinner": "A Dong Restaurant, Detroit, Michigan", "accommodation": "Comfy King Bed Feet from Subway, Detroit, Michigan"}, {"day": 2, "current_city": "Detroit, Michigan", "transportation": "-", "breakfast": "BMG - All Day Dining, Detroit, Michigan", "attraction": "Detroit Historical Museum, Detroit, Michigan; Campus Martius Park, Detroit, Michigan;", "lunch": "Cafe And More, Detroit, Michigan", "dinner": "Bistro Flamme Bois, Detroit, Michigan", "accommodation": "Comfy King Bed Feet from Subway, Detroit, Michigan"}, {"day": 3, "current_city": "from Detroit to Lansing, Michigan", "transportation": "Self-driving, from Detroit to Lansing, duration: 1 hour 24 mins, distance: 146 km", "breakfast": "Frequent Bakes, Detroit, Michigan", "attraction": "Impression 5 Science Center, Lansing, Michigan; Potter Park Zoo, Lansing, Michigan;", "lunch": "Manuel's Bread Cafe, Lansing, Michigan", "dinner": "Huey's On The River, Lansing, Michigan", "accommodation": "2 bedroom apartment in harlem, Lansing, Michigan"}, {"day": 4, "current_city": "Lansing, Michigan", "transportation": "-", "breakfast": "Front Street Brewery, Lansing, Michigan", "attraction": "Michigan History Center, Lansing, Michigan; Hawk Island Park, Lansing, Michigan;", "lunch": "Golden China, Lansing, Michigan", "dinner": "Tony's Italian Restaurant & Pizza, Lansing, Michigan", "accommodation": "2 bedroom apartment in harlem, Lansing, Michigan"}, {"day": 5, "current_city": "from Lansing to Kalamazoo, Michigan", "transportation": "Self-driving, from Lansing to Kalamazoo, duration: 1 hour 17 mins, distance: 122 km", "breakfast": "Nini's Kitchen, Lansing, Michigan", "attraction": "Kalamazoo Valley Museum, Kalamazoo, Michigan; Kalamazoo Institute of Arts, Kalamazoo, Michigan;", "lunch": "Giulios Greek & Italian Restaurant, Kalamazoo, Michigan", "dinner": "Cha cTea, Kalamazoo, Michigan", "accommodation": "East 63rd street, Studio Serviced Apartment, Kalamazoo, Michigan"}, {"day": 6, "current_city": "Kalamazoo, Michigan", "transportation": "-", "breakfast": "Oxy Lounge, Kalamazoo, Michigan", "attraction": "Kalamazoo Nature Center, Kalamazoo, Michigan; Milham Park, Kalamazoo, Michigan;", "lunch": "Tamasha In Tafree, Kalamazoo, Michigan", "dinner": "Shree Rathnam, Kalamazoo, Michigan", "accommodation": "East 63rd street, Studio Serviced Apartment, Kalamazoo, Michigan"}, {"day": 7, "current_city": "from Kalamazoo to Myrtle Beach", "transportation": "Self-driving, from Kalamazoo to Myrtle Beach, duration: 13 hours 50 mins, distance: 1,400 km", "breakfast": "Django, Kalamazoo, Michigan", "attraction": "-", "lunch": "-", "dinner": "-", "accommodation": "-"}]}]