[{"gpt-4-1106-preview_direct_sole-planning_results": "Travel Plan:\n\nDays: 1\nCurrent City: from Newark to Cleveland, Ohio\nTransportation: Flight F4075899, from Newark to Cleveland, duration: 1 hours 32 minutes, cost: $132 x 2 = $264\nBreakfast: -\nAttraction: -\nLunch: -\nDinner: Bikanerwala, Cleveland, Ohio, cost: $10 x 2 = $20, cuisines: Tea, Bakery, BBQ, Fast Food\nAccommodation: Richmond Hill 3 Bedroom apartment in Private home!, Cleveland, Ohio, cost: $565 x 1 = $565, maximum occupancy: 4, house rules: No visitors, minimum nights: 1\n\nNumber of people: 2\nTotal cost: $264 + $20 + $565 = $849\nAccommodation minimum nights: 1/1\n\nDays: 2\nCurrent City: Cleveland, Ohio\nTransportation: -\nBreakfast: Big Chicken, Cleveland, Ohio, cost: $27 x 2 = $54, cuisines: Cafe, Pizza, Bakery, Italian\nAttraction: Cleveland Metroparks Zoo, Cleveland, Ohio; The Cleveland Museum of Art, Cleveland, Ohio\nLunch: Me Kong Bowl, Cleveland, Ohio, cost: $19 x 2 = $38, cuisines: Cafe, BBQ, Seafood\nDinner: Green Leaf, Cleveland, Ohio, cost: $73 x 2 = $146, cuisines: Desserts, Tea, Cafe, BBQ, Chinese\nAccommodation: Richmond Hill 3 Bedroom apartment in Private home!, Cleveland, Ohio, cost: $565 x 1 = $565, maximum occupancy: 4, house rules: No visitors, minimum nights: 1\n\nNumber of people: 2\nTotal cost: $54 + $38 + $146 + $565 = $803\nAccommodation minimum nights: 2/1\n\nDays: 3\nCurrent City: from Cleveland to Columbus, Ohio\nTransportation: Taxi, from Cleveland to Columbus, duration: 2 hours 8 mins, cost: $228 x 2 = $456\nBreakfast: -\nAttraction: -\nLunch: Desire Foods, Columbus, Ohio, cost: $23 x 2 = $46, cuisines: Desserts, Tea, French, Mexican, Bakery\nDinner: Gopala, Columbus, Ohio, cost: $86 x 2 = $172, cuisines: Bakery, American, BBQ\nAccommodation: Cozy and Sunny Williamsburg Apartment, Columbus, Ohio, cost: $1100 x 1 = $1100, maximum occupancy: 8, house rules: No pets, minimum nights: 3\n\nNumber of people: 2\nTotal cost: $456 + $46 + $172 + $1100 = $1774\nAccommodation minimum nights: 1/3\n\nDays: 4\nCurrent City: Columbus, Ohio\nTransportation: -\nBreakfast: KC Bakers, Columbus, Ohio, cost: $31 x 2 = $62, cuisines: Desserts, Tea, Pizza, Italian, Bakery\nAttraction: Center of Science and Industry (COSI), Columbus, Ohio; Franklin Park Conservatory and Botanical Gardens, Columbus, Ohio\nLunch: The Irish House, Columbus, Ohio, cost: $65 x 2 = $130, cuisines: Desserts, Tea, Pizza, Mexican, Fast Food, Mediterranean\nDinner: McDonald's, Columbus, Ohio, cost: $75 x 2 = $150, cuisines: Desserts, Pizza, French, BBQ, Indian, Seafood\nAccommodation: Cozy and Sunny Williamsburg Apartment, Columbus, Ohio, cost: $1100 x 1 = $1100, maximum occupancy: 8, house rules: No pets, minimum nights: 3\n\nNumber of people: 2\nTotal cost: $62 + $130 + $150 + $1100 = $1442\nAccommodation minimum nights: 2/3\n\nDays: 5\nCurrent City: from Columbus to Newark\nTransportation: Flight F4076785, from Columbus to Newark, duration: 2 hours 2 minutes, cost: $110 x 2 = $220\nBreakfast: -\nAttraction: -\nLunch: -\nDinner: -\nAccommodation: -\n\nNumber of people: 2\nTotal cost: $220\n\nTotal cost across all days: $849 + $803 + $1774 + $1442 + $220 = $5088\n\nUnfortunately, the total cost of $5088 exceeds the specified budget of $4400. To adjust the plan within the budget, we can consider changing the accommodation to a less expensive option or altering meal plans. Please let me know how you would like to proceed, or if you have any other preferences to adjust the plan accordingly.", "gpt-4-1106-preview_direct_sole-planning_parsed_results": [{"day": 1, "current_city": "from Newark to Cleveland, Ohio", "transportation": "Flight Number: F4075899, from Newark to Cleveland, Ohio, Departure Time: -, Arrival Time: -", "breakfast": "-", "attraction": "-", "lunch": "-", "dinner": "Bikanerwala, Cleveland, Ohio", "accommodation": "Richmond Hill 3 Bedroom apartment in Private home!, Cleveland, Ohio"}, {"day": 2, "current_city": "Cleveland, Ohio", "transportation": "-", "breakfast": "Big Chicken, Cleveland, Ohio", "attraction": "Cleveland Metroparks Zoo, Cleveland, Ohio;The Cleveland Museum of Art, Cleveland, Ohio;", "lunch": "Me Kong Bowl, Cleveland, Ohio", "dinner": "Green Leaf, Cleveland, Ohio", "accommodation": "Richmond Hill 3 Bedroom apartment in Private home!, Cleveland, Ohio"}, {"day": 3, "current_city": "from Cleveland to Columbus, Ohio", "transportation": "Taxi, from Cleveland to Columbus, Ohio, Departure Time: -, Arrival Time: -", "breakfast": "-", "attraction": "-", "lunch": "Desire Foods, Columbus, Ohio", "dinner": "Gopala, Columbus, Ohio", "accommodation": "Cozy and Sunny Williamsburg Apartment, Columbus, Ohio"}, {"day": 4, "current_city": "Columbus, Ohio", "transportation": "-", "breakfast": "KC Bakers, Columbus, Ohio", "attraction": "Center of Science and Industry (COSI), Columbus, Ohio;Franklin Park Conservatory and Botanical Gardens, Columbus, Ohio;", "lunch": "The Irish House, Columbus, Ohio", "dinner": "McDonald's, Columbus, Ohio", "accommodation": "Cozy and Sunny Williamsburg Apartment, Columbus, Ohio"}, {"day": 5, "current_city": "from Columbus to Newark", "transportation": "Flight Number: F4076785, from Columbus to Newark, Departure Time: -, Arrival Time: -", "breakfast": "-", "attraction": "-", "lunch": "-", "dinner": "-", "accommodation": "-"}]}]