[{"gpt-4-1106-preview_direct_sole-planning_results": "Travel Plan:\n\nDays: 1\nDate: March 6th, 2022\nCurrent City: from Houston to Pensacola\nTransportation: Flight F3855861, from Houston to Pensacola, duration: 1 hour 27 minutes, cost: $100 per person\nBreakfast: -\nAttraction: -\nLunch: Frog Hollow Tavern, Pensacola, cost: $20 per person, cuisines: American, BBQ, Fast Food, Cafe, Indian\nDinner: Blue Point Grill, Pensacola, cost: $75 per person, cuisines: French, Indian, Cafe, Desserts\nAccommodation: Luxury East Village Penthouse With Private Deck, Pensacola, cost: $697 per night, room type: Entire home/apt, house rules: No visitors, maximum occupancy: 6\n\nNumber of people: 2\nTotal cost: (Flight $100 x 2) + (Lunch $20 x 2) + (Dinner $75 x 2) + (Accommodation $697) = $200 + $40 + $150 + $697 = $1,087\nAccommodation minimum nights: 1/2\n\nDays: 2\nDate: March 7th, 2022\nCurrent City: Pensacola\nTransportation: -\nBreakfast: Berry Patch Restaurant, Pensacola, cost: $13 per person, cuisines: Bakery, BBQ, Desserts, Seafood\nAttraction: Historic Pensacola Village, Pensacola; Pensacola Museum of Art, Pensacola\nLunch: Kwality Restaurant, Pensacola, cost: $29 per person, cuisines: Desserts, Tea, French, Fast Food, Chinese\nDinner: Nukkad, Pensacola, cost: $100 per person, cuisines: Tea, Cafe, American, Italian\nAccommodation: Luxury East Village Penthouse With Private Deck, Pensacola, cost: $697 per night, room type: Entire home/apt, house rules: No visitors, maximum occupancy: 6\n\nNumber of people: 2\nTotal cost: (Breakfast $13 x 2) + (Lunch $29 x 2) + (Dinner $100 x 2) + (Accommodation $697) = $26 + $58 + $200 + $697 = $981\nAccommodation minimum nights: 2/2\n\nDays: 3\nDate: March 8th, 2022\nCurrent City: from Pensacola to Houston\nTransportation: Flight F3890675, from Pensacola to Houston, duration: 1 hour 34 minutes, cost: $128 per person\nBreakfast: Eggspectation - Jaypee Siddharth, Pensacola, cost: $25 per person, cuisines: Cafe, BBQ, Italian\nAttraction: -\nLunch: -\nDinner: -\nAccommodation: -\n\nNumber of people: 2\nTotal cost: (Flight $128 x 2) + (Breakfast $25 x 2) = $256 + $50 = $306\n\nTotal cost across all days: $1,087 + $981 + $306 = $2,374\n\nUnfortunately, the total cost of $2,374 exceeds the specified budget of $1,400. To adhere to the budget, we need to make adjustments:\n\nRevised Travel Plan:\n\nDays: 1\nTransportation: Flight F3855861, cost: $100 per person\nLunch: Berry Patch Restaurant, cost: $13 per person\nDinner: Bailey's Bar-B-Que, cost: $13 per person\nAccommodation: Amazing apartment near museum, gardens & park!, cost: $74 per night\n\nDays: 2\nBreakfast: Berry Patch Restaurant, cost: $13 per person\nLunch: Kwality Restaurant, cost: $29 per person\nDinner: Chicago Pizza, cost: $32 per person\nAccommodation: Amazing apartment near museum, gardens & park!, cost: $74 per night\n\nDays: 3\nTransportation: Flight F3890675, cost: $128 per person\nBreakfast: Eggspectation - Jaypee Siddharth, cost: $25 per person\n\nRevised Total cost across all days: (Flight $100 x 2) + (Lunch Day 1 $13 x 2) + (Dinner Day 1 $13 x 2) + (Accommodation Day 1 $74) + (Breakfast Day 2 $13 x 2) + (Lunch Day 2 $29 x 2) + (Dinner Day 2 $32 x 2) + (Accommodation Day 2 $74) + (Flight Day 3 $128 x 2) + (Breakfast Day 3 $25 x 2) = $200 + $26 + $26 + $74 + $26 + $58 + $64 + $74 + $256 + $50 = $854\n\nThe revised total cost of $854 is within the specified budget of $1,400. Please note that the accommodation selected is visitor-friendly as per the query, and the restaurants chosen offer the specified cuisines.", "gpt-4-1106-preview_direct_sole-planning_parsed_results": [{"day": 1, "current_city": "from Houston to Pensacola", "transportation": "Flight Number: F3855861, from Houston to Pensacola, Departure Time: -, Arrival Time: -", "breakfast": "-", "attraction": "-", "lunch": "Frog Hollow Tavern, Pensacola", "dinner": "Blue Point Grill, Pensacola", "accommodation": "Luxury East Village Penthouse With Private Deck, Pensacola"}, {"day": 2, "current_city": "Pensacola", "transportation": "-", "breakfast": "Berry Patch Restaurant, Pensacola", "attraction": "Historic Pensacola Village, Pensacola;Pensacola Museum of Art, Pensacola;", "lunch": "Kwality Restaurant, Pensacola", "dinner": "Nukkad, Pensacola", "accommodation": "Luxury East Village Penthouse With Private Deck, Pensacola"}, {"day": 3, "current_city": "from Pensacola to Houston", "transportation": "Flight Number: F3890675, from Pensacola to Houston, Departure Time: -, Arrival Time: -", "breakfast": "Eggspectation - Jaypee Siddharth, Pensacola", "attraction": "-", "lunch": "-", "dinner": "-", "accommodation": "-"}]}]