[{"gpt-4-1106-preview_direct_sole-planning_results": "Travel Plan:\n\nDays: 1\nCurrent City: from Akron to Tampa\nTransportation: Flight F3620346, from Akron to Tampa, duration: 2 hours 7 minutes, cost: 434\nBreakfast: -\nAttraction: -\nLunch: -\nDinner: Kobe Hibachi & Sushi, Tampa, Average Cost: 63, Cuisines: Desserts, French, BBQ, Bakery, Seafood\nAccommodation: Bright duplex apartment, Tampa, price: 164, room type: Entire home/apt, house rules: No children under 10, minimum nights: 2, maximum occupancy: 3\n\nNumber of people: 2\nTotal cost: (434 x 2) + (63 x 2) + (164 x 1) = 1158\nAccommodation minimum nights: 1/2\n\nDays: 2\nCurrent City: Tampa\nTransportation: -\nBreakfast: Gallery Caf\u6106 - Hyatt Place, Tampa, Average Cost: 42, Cuisines: Tea, French, BBQ, Desserts\nAttraction: The Florida Aquarium, Tampa; Tampa Bay History Center, Tampa\nLunch: Giani, Tampa, Average Cost: 59, Cuisines: Pizza, French, Mexican, Bakery, Seafood\nDinner: Club India Cafe & Restaurant, Tampa, Average Cost: 98, Cuisines: Desserts, Tea, Bakery, Cafe, American\nAccommodation: Bright duplex apartment, Tampa, price: 164, room type: Entire home/apt, house rules: No children under 10, minimum nights: 2, maximum occupancy: 3\n\nNumber of people: 2\nTotal cost: (42 x 2) + (59 x 2) + (98 x 2) + (164 x 1) = 562\nAccommodation minimum nights: 2/2\n\nDays: 3\nCurrent City: from Tampa to Akron\nTransportation: Flight F3620300, from Tampa to Akron, duration: 2 hours 18 minutes, cost: 438\nBreakfast: Butterburrs, Tampa, Average Cost: 28, Cuisines: Pizza, Seafood\nAttraction: -\nLunch: -\nDinner: -\nAccommodation: -\n\nNumber of people: 2\nTotal cost: (438 x 2) + (28 x 2) = 932\n\nTotal cost across all days: 1158 + 562 + 932 = 2652\n\nUnfortunately, the total cost exceeds the budget of $2,500. To adjust the plan within the budget, we can change the transportation method from flights to self-driving, which will significantly reduce the cost.\n\nRevised Travel Plan with Self-driving:\n\nDays: 1\nCurrent City: from Akron to Tampa\nTransportation: Self-driving, from Akron to Tampa, duration: 15 hours 37 mins, distance: 1,701 km, cost: 85\nBreakfast: -\nAttraction: -\nLunch: -\nDinner: Kobe Hibachi & Sushi, Tampa, Average Cost: 63, Cuisines: Desserts, French, BBQ, Bakery, Seafood\nAccommodation: Bright duplex apartment, Tampa, price: 164, room type: Entire home/apt, house rules: No children under 10, minimum nights: 2, maximum occupancy: 3\n\nNumber of people: 2\nTotal cost: (85 x 1) + (63 x 2) + (164 x 1) = 375\nAccommodation minimum nights: 1/2\n\nDays: 2\nCurrent City: Tampa\nTransportation: -\nBreakfast: Gallery Caf\u6106 - Hyatt Place, Tampa, Average Cost: 42, Cuisines: Tea, French, BBQ, Desserts\nAttraction: The Florida Aquarium, Tampa; Tampa Bay History Center, Tampa\nLunch: Giani, Tampa, Average Cost: 59, Cuisines: Pizza, French, Mexican, Bakery, Seafood\nDinner: Club India Cafe & Restaurant, Tampa, Average Cost: 98, Cuisines: Desserts, Tea, Bakery, Cafe, American\nAccommodation: Bright duplex apartment, Tampa, price: 164, room type: Entire home/apt, house rules: No children under 10, minimum nights: 2, maximum occupancy: 3\n\nNumber of people: 2\nTotal cost: (42 x 2) + (59 x 2) + (98 x 2) + (164 x 1) = 562\nAccommodation minimum nights: 2/2\n\nDays: 3\nCurrent City: from Tampa to Akron\nTransportation: Self-driving, from Tampa to Akron, duration: 15 hours 40 mins, distance: 1,702 km, cost: 85\nBreakfast: Butterburrs, Tampa, Average Cost: 28, Cuisines: Pizza, Seafood\nAttraction: -\nLunch: -\nDinner: -\nAccommodation: -\n\nNumber of people: 2\nTotal cost: (85 x 1) + (28 x 2) = 141\n\nTotal cost across all days: 375 + 562 + 141 = 1078\n\nThe revised travel plan with self-driving transportation is within the budget of $2,500.", "gpt-4-1106-preview_direct_sole-planning_parsed_results": [{"day": 1, "current_city": "from Akron to Tampa", "transportation": "Self-driving, from Akron to Tampa, duration: 15 hours 37 mins, distance: 1,701 km", "breakfast": "-", "attraction": "-", "lunch": "-", "dinner": "Kobe Hibachi & Sushi, Tampa", "accommodation": "Bright duplex apartment, Tampa"}, {"day": 2, "current_city": "Tampa", "transportation": "-", "breakfast": "Gallery Caf\u00e9 - Hyatt Place, Tampa", "attraction": "The Florida Aquarium, Tampa;Tampa Bay History Center, Tampa;", "lunch": "Giani, Tampa", "dinner": "Club India Cafe & Restaurant, Tampa", "accommodation": "Bright duplex apartment, Tampa"}, {"day": 3, "current_city": "from Tampa to Akron", "transportation": "Self-driving, from Tampa to Akron, duration: 15 hours 40 mins, distance: 1,702 km", "breakfast": "Butterburrs, Tampa", "attraction": "-", "lunch": "-", "dinner": "-", "accommodation": "-"}]}]