[{"gpt-4-1106-preview_direct_sole-planning_results": "Travel Plan:\n\nDays: 1\nCurrent City: from Seattle to Orlando, Florida\nTransportation: Flight F3508009, from Seattle to Orlando, duration: 5 hours 22 minutes, cost: 706 x 4 = 2824\nBreakfast: -\nAttraction: -\nLunch: -\nDinner: Fuji Japanese Steakhouse, Orlando, Florida, cost: 63 x 4 = 252, cuisines: Desserts, French, BBQ, Bakery, Seafood\nAccommodation: Sixth Ave Chelsea, Studio Serviced Apartment, Orlando, Florida, cost: 70 x 4 = 280, room type: Entire home/apt, house rules: No visitors & No pets, maximum occupancy: 3\n\nNumber of people: 4\nTotal cost: 2824 + 252 + 280 = 3356\nAccommodation minimum nights: 1/30\n\nDays: 2\nCurrent City: Orlando, Florida\nTransportation: -\nBreakfast: The Tin Cow, Orlando, Florida, cost: 67 x 4 = 268, cuisines: BBQ, Desserts, Seafood\nAttraction: The Florida Aquarium, Orlando, Florida; Universal Orlando Resort, Orlando, Florida\nLunch: Gallery Caf\u6106 - Hyatt Place, Orlando, Florida, cost: 42 x 4 = 168, cuisines: Tea, French, BBQ, Desserts\nDinner: The Zaffran, Orlando, Florida, cost: 35 x 4 = 140, cuisines: Tea, Bakery, Fast Food, American, Seafood\nAccommodation: Sixth Ave Chelsea, Studio Serviced Apartment, Orlando, Florida, cost: 70 x 4 = 280, room type: Entire home/apt, house rules: No visitors & No pets, maximum occupancy: 3\n\nNumber of people: 4\nTotal cost: 268 + 168 + 140 + 280 = 856\nAccommodation minimum nights: 2/30\n\nDays: 3\nCurrent City: from Orlando to Panama City, Florida\nTransportation: Taxi, from Orlando to Panama City, duration: 5 hours 24 mins, cost: 574 x 4 = 2296\nBreakfast: -\nAttraction: -\nLunch: The Chaiwalas, Panama City, Florida, cost: 39 x 4 = 156, cuisines: Tea, French, Bakery, Fast Food, Seafood\nDinner: The Cakelicious Factory, Panama City, Florida, cost: 86 x 4 = 344, cuisines: Tea, Pizza, Mexican, BBQ, Cafe\nAccommodation: Perfect Location 2bd w Bklyn Charm, Panama City, Florida, cost: 64 x 4 = 256, room type: Entire home/apt, house rules: No visitors & No smoking, maximum occupancy: 3\n\nNumber of people: 4\nTotal cost: 2296 + 156 + 344 + 256 = 3052\nAccommodation minimum nights: 1/3\n\nDays: 4\nCurrent City: Panama City, Florida\nTransportation: -\nBreakfast: Delicieux Ice Cream Rolls, Panama City, Florida, cost: 49 x 4 = 196, cuisines: Tea, Bakery, Pizza\nAttraction: ZooWorld Zoological Park, Panama City, Florida; Gulf World Marine Park, Panama City, Florida\nLunch: The Old School Brew House, Panama City, Florida, cost: 78 x 4 = 312, cuisines: Cafe, Pizza, Indian, BBQ\nDinner: Replay, Panama City, Florida, cost: 62 x 4 = 248, cuisines: Tea, Cafe, Desserts, Seafood\nAccommodation: Perfect Location 2bd w Bklyn Charm, Panama City, Florida, cost: 64 x 4 = 256, room type: Entire home/apt, house rules: No visitors & No smoking, maximum occupancy: 3\n\nNumber of people: 4\nTotal cost: 196 + 312 + 248 + 256 = 1012\nAccommodation minimum nights: 2/3\n\nDays: 5\nCurrent City: from Panama City to Tampa, Florida\nTransportation: Taxi, from Panama City to Tampa, duration: 5 hours 37 mins, cost: 603 x 4 = 2412\nBreakfast: -\nAttraction: -\nLunch: Lalit Kathi Rolls Momos, Tampa, Florida, cost: 23 x 4 = 92, cuisines: Tea, Pizza, Fast Food\nDinner: Uptown Fresh Beer Cafe, Tampa, Florida, cost: 61 x 4 = 244, cuisines: Pizza, Mexican, BBQ, Cafe, Seafood\nAccommodation: Spacious 1+ bedroom apt in NYC, Tampa, Florida, cost: 547 x 4 = 2188, room type: Entire home/apt, house rules: No smoking & No parties & No children under 10, maximum occupancy: 2\n\nNumber of people: 4\nTotal cost: 2412 + 92 + 244 + 2188 = 4936\nAccommodation minimum nights: 1/1\n\nDays: 6\nCurrent City: Tampa, Florida\nTransportation: -\nBreakfast: The Zaffran, Tampa, Florida, cost: 35 x 4 = 140, cuisines: Tea, Bakery, Fast Food, American, Seafood\nAttraction: Busch Gardens Tampa Bay, Tampa, Florida; Adventure Island, Tampa, Florida\nLunch: Gallery Caf\u6106 - Hyatt Place, Tampa, Florida, cost: 42 x 4 = 168, cuisines: Tea, French, BBQ, Desserts\nDinner: Kobe Hibachi & Sushi, Tampa, Florida, cost: 63 x 4 = 252, cuisines: Desserts, French, BBQ, Bakery, Seafood\nAccommodation: Spacious 1+ bedroom apt in NYC, Tampa, Florida, cost: 547 x 4 = 2188, room type: Entire home/apt, house rules: No smoking & No parties & No children under 10, maximum occupancy: 2\n\nNumber of people: 4\nTotal cost: 140 + 168 + 252 + 2188 = 2748\nAccommodation minimum nights: 2/1\n\nDays: 7\nCurrent City: from Tampa to Seattle\nTransportation: Flight F3749393, from Tampa to Seattle, duration: 6 hours 3 minutes, cost: 1049 x 4 = 4196\nBreakfast: -\nAttraction: -\nLunch: -\nDinner: -\nAccommodation: -\n\nNumber of people: 4\nTotal cost: 4196\n\nTotal cost across all days: 3356 + 856 + 3052 + 1012 + 4936 + 2748 + 4196 = 20156\n\nUnfortunately, the total cost of the proposed travel plan exceeds the specified budget of $14,700. To meet the budget constraints, adjustments to the plan would be necessary, such as selecting more affordable accommodations, dining options, or changing the transportation method. Please let me know if you would like me to rework the plan to fit within the budget.", "gpt-4-1106-preview_direct_sole-planning_parsed_results": [{"day": 1, "current_city": "from Seattle to Orlando, Florida", "transportation": "Flight Number: F3508009, from Seattle to Orlando, duration: 5 hours 22 minutes", "breakfast": "-", "attraction": "-", "lunch": "-", "dinner": "Fuji Japanese Steakhouse, Orlando, Florida", "accommodation": "Sixth Ave Chelsea, Studio Serviced Apartment, Orlando, Florida"}, {"day": 2, "current_city": "Orlando, Florida", "transportation": "-", "breakfast": "The Tin Cow, Orlando, Florida", "attraction": "The Florida Aquarium, Orlando, Florida;Universal Orlando Resort, Orlando, Florida", "lunch": "Gallery Caf\u00e9 - Hyatt Place, Orlando, Florida", "dinner": "The Zaffran, Orlando, Florida", "accommodation": "Sixth Ave Chelsea, Studio Serviced Apartment, Orlando, Florida"}, {"day": 3, "current_city": "from Orlando to Panama City, Florida", "transportation": "Taxi, from Orlando to Panama City, duration: 5 hours 24 mins", "breakfast": "-", "attraction": "-", "lunch": "The Chaiwalas, Panama City, Florida", "dinner": "The Cakelicious Factory, Panama City, Florida", "accommodation": "Perfect Location 2bd w Bklyn Charm, Panama City, Florida"}, {"day": 4, "current_city": "Panama City, Florida", "transportation": "-", "breakfast": "Delicieux Ice Cream Rolls, Panama City, Florida", "attraction": "ZooWorld Zoological Park, Panama City, Florida;Gulf World Marine Park, Panama City, Florida", "lunch": "The Old School Brew House, Panama City, Florida", "dinner": "Replay, Panama City, Florida", "accommodation": "Perfect Location 2bd w Bklyn Charm, Panama City, Florida"}, {"day": 5, "current_city": "from Panama City to Tampa, Florida", "transportation": "Taxi, from Panama City to Tampa, duration: 5 hours 37 mins", "breakfast": "-", "attraction": "-", "lunch": "Lalit Kathi Rolls Momos, Tampa, Florida", "dinner": "Uptown Fresh Beer Cafe, Tampa, Florida", "accommodation": "Spacious 1+ bedroom apt in NYC, Tampa, Florida"}, {"day": 6, "current_city": "Tampa, Florida", "transportation": "-", "breakfast": "The Zaffran, Tampa, Florida", "attraction": "Busch Gardens Tampa Bay, Tampa, Florida;Adventure Island, Tampa, Florida", "lunch": "Gallery Caf\u00e9 - Hyatt Place, Tampa, Florida", "dinner": "Kobe Hibachi & Sushi, Tampa, Florida", "accommodation": "Spacious 1+ bedroom apt in NYC, Tampa, Florida"}, {"day": 7, "current_city": "from Tampa to Seattle", "transportation": "Flight Number: F3749393, from Tampa to Seattle, duration: 6 hours 3 minutes", "breakfast": "-", "attraction": "-", "lunch": "-", "dinner": "-", "accommodation": "-"}]}]