[{"gpt-4-1106-preview_direct_sole-planning_results": "Travel Plan:\n\nDays: 1\nCurrent City: from Houston to Pensacola\nTransportation: Self-driving, from Houston to Pensacola, duration: 7 hours 38 mins, distance: 845 km, cost: 42\nBreakfast: -\nAttraction: -\nLunch: -\nDinner: Frog Hollow Tavern, Pensacola, cost: 20, cuisines: American, BBQ, Fast Food, Cafe, Indian\nAccommodation: Chic Historic Harlem Brownstone, Pensacola, cost: 526, room type: Entire home/apt, house rules: No smoking, minimum nights: 3, maximum occupancy: 2\n\nNumber of people: 2\nTotal cost: (42 x 2) + (20 x 2) + (526 x 1) = 650\nAccommodation minimum nights: 1/3\n\nDays: 2\nCurrent City: Pensacola\nTransportation: -\nBreakfast: Berry Patch Restaurant, Pensacola, cost: 13, cuisines: Bakery, BBQ, Desserts, Seafood\nAttraction: Historic Pensacola Village, Pensacola; Pensacola Museum of Art, Pensacola\nLunch: Bailey's Bar-B-Que, Pensacola, cost: 13, cuisines: Tea, Bakery, Mediterranean\nDinner: Blue Point Grill, Pensacola, cost: 75, cuisines: French, Indian, Cafe, Desserts\nAccommodation: Chic Historic Harlem Brownstone, Pensacola, cost: 526, room type: Entire home/apt, house rules: No smoking, minimum nights: 3, maximum occupancy: 2\n\nNumber of people: 2\nTotal cost: (13 x 2) + (13 x 2) + (75 x 2) + (526 x 1) = 715\nAccommodation minimum nights: 2/3\n\nDays: 3\nCurrent City: from Pensacola to Houston\nTransportation: Self-driving, from Pensacola to Houston, duration: 7 hours 37 mins, distance: 845 km, cost: 42\nBreakfast: Watershed Cafe, Pensacola, cost: 12, cuisines: Chinese, BBQ, Desserts\nAttraction: -\nLunch: -\nDinner: -\nAccommodation: -\n\nNumber of people: 2\nTotal cost: (42 x 2) + (12 x 2) = 108\n\nTotal cost across all days: 650 + 715 + 108 = 1,473\n\nNote: The total cost exceeds the specified budget of $1,100. Adjustments are needed to meet the budget constraint. Since the accommodations are the most expensive part of the plan, consider changing to a more affordable option that allows smoking and offers non-shared rooms.\n\nAdjusted Travel Plan:\n\nDays: 1\nCurrent City: from Houston to Pensacola\nTransportation: Self-driving, from Houston to Pensacola, duration: 7 hours 38 mins, distance: 845 km, cost: 42\nBreakfast: -\nAttraction: -\nLunch: -\nDinner: Frog Hollow Tavern, Pensacola, cost: 20, cuisines: American, BBQ, Fast Food, Cafe, Indian\nAccommodation: Amazing apartment near museum, gardens & park!, Pensacola, cost: 74, room type: Entire home/apt, house rules: No parties, minimum nights: 17, maximum occupancy: 3\n\nNumber of people: 2\nTotal cost: (42 x 2) + (20 x 2) + (74 x 1) = 198\nAccommodation minimum nights: 1/17\n\nDays: 2\nCurrent City: Pensacola\nTransportation: -\nBreakfast: Berry Patch Restaurant, Pensacola, cost: 13, cuisines: Bakery, BBQ, Desserts, Seafood\nAttraction: Historic Pensacola Village, Pensacola; Pensacola Museum of Art, Pensacola\nLunch: Bailey's Bar-B-Que, Pensacola, cost: 13, cuisines: Tea, Bakery, Mediterranean\nDinner: Blue Point Grill, Pensacola, cost: 75, cuisines: French, Indian, Cafe, Desserts\nAccommodation: Amazing apartment near museum, gardens & park!, Pensacola, cost: 74, room type: Entire home/apt, house rules: No parties, minimum nights: 17, maximum occupancy: 3\n\nNumber of people: 2\nTotal cost: (13 x 2) + (13 x 2) + (75 x 2) + (74 x 1) = 263\nAccommodation minimum nights: 2/17\n\nDays: 3\nCurrent City: from Pensacola to Houston\nTransportation: Self-driving, from Pensacola to Houston, duration: 7 hours 37 mins, distance: 845 km, cost: 42\nBreakfast: Watershed Cafe, Pensacola, cost: 12, cuisines: Chinese, BBQ, Desserts\nAttraction: -\nLunch: -\nDinner: -\nAccommodation: -\n\nNumber of people: 2\nTotal cost: (42 x 2) + (12 x 2) = 108\n\nTotal cost across all days: 198 + 263 + 108 = 569\n\nCuisines: The prompt specifies no cuisines, so all cuisine constraints are satisfied.\n\nNote: The adjusted travel plan meets the budget constraint of $1,100. However, the accommodation selected does not explicitly state that smoking is permitted. If smoking is a strict requirement, further adjustments to the accommodation may be necessary, and options that explicitly allow smoking should be chosen.", "gpt-4-1106-preview_direct_sole-planning_parsed_results": [{"day": 1, "current_city": "from Houston to Pensacola", "transportation": "Self-driving, from Houston to Pensacola, duration: 7 hours 38 mins, distance: 845 km", "breakfast": "-", "attraction": "-", "lunch": "-", "dinner": "Frog Hollow Tavern, Pensacola", "accommodation": "Amazing apartment near museum, gardens & park!, Pensacola"}, {"day": 2, "current_city": "Pensacola", "transportation": "-", "breakfast": "Berry Patch Restaurant, Pensacola", "attraction": "Historic Pensacola Village, Pensacola;Pensacola Museum of Art, Pensacola;", "lunch": "Bailey's Bar-B-Que, Pensacola", "dinner": "Blue Point Grill, Pensacola", "accommodation": "Amazing apartment near museum, gardens & park!, Pensacola"}, {"day": 3, "current_city": "from Pensacola to Houston", "transportation": "Self-driving, from Pensacola to Houston, duration: 7 hours 37 mins, distance: 845 km", "breakfast": "Watershed Cafe, Pensacola", "attraction": "-", "lunch": "-", "dinner": "-", "accommodation": "-"}]}]