[{"gpt-4-1106-preview_direct_sole-planning_results": "Travel Plan:\n\nDays: 1\nCurrent City: from Las Vegas to Santa Maria\nTransportation: Self-driving, from Las Vegas to Santa Maria, duration: 6 hours 17 mins, distance: 634 km, cost: 31\nBreakfast: -\nAttraction: -\nLunch: Pirates of Grill, Santa Maria, cost: 90, cuisines: Bakery, BBQ, Fast Food, American, Mediterranean, Seafood\nDinner: RiverDine Restaurant & Bar, Santa Maria, cost: 71, cuisines: Chinese, BBQ, Seafood\nAccommodation: Large Bedroom on upper west/columbia, Santa Maria, cost: 98, maximum occupancy: 2, house rules: No parties & No pets, minimum nights: 1\n\nNumber of people: 4\nTotal cost: (31 x 4) + (90 x 4) + (71 x 4) + (98 x 2) = 124 + 360 + 284 + 196 = 964\nAccommodation minimum nights: 1/1\n\nDays: 2\nCurrent City: Santa Maria\nTransportation: -\nBreakfast: Indian By Nature, Santa Maria, cost: 45, cuisines: Tea, Pizza, Bakery, BBQ, Mediterranean\nAttraction: Santa Maria Valley Discovery Museum, Santa Maria; Santa Maria Museum of Flight, Santa Maria\nLunch: The Drunk House, Santa Maria, cost: 91, cuisines: Desserts, Tea, Bakery, Fast Food, American, Mediterranean\nDinner: Kuremal Mohan Lal Kulfi Wale, Santa Maria, cost: 84, cuisines: Desserts, Italian, BBQ, Bakery, American, Seafood\nAccommodation: Large Bedroom on upper west/columbia, Santa Maria, cost: 98, maximum occupancy: 2, house rules: No parties & No pets, minimum nights: 1\n\nNumber of people: 4\nTotal cost: (45 x 4) + (91 x 4) + (84 x 4) + (98 x 2) = 180 + 364 + 336 + 196 = 1076\nAccommodation minimum nights: 2/1\n\nDays: 3\nCurrent City: from Santa Maria to Las Vegas\nTransportation: Self-driving, from Santa Maria to Las Vegas, duration: 6 hours 19 mins, distance: 636 km, cost: 31\nBreakfast: Calendar Khana Laao, Santa Maria, cost: 91, cuisines: Desserts, Tea, Fast Food, Cafe, Indian\nAttraction: -\nLunch: -\nDinner: -\nAccommodation: -\n\nNumber of people: 4\nTotal cost: (31 x 4) + (91 x 4) = 124 + 364 = 488\n\nTotal cost across all days: 964 + 1076 + 488 = 2528\nCuisines: Preference for American and Mediterranean cuisines has been met with selected restaurants.\nRemaining Budget: $3,700 - $2,528 = $1,172\n\nPlease note that the accommodation chosen has a maximum occupancy of 2, so two rooms have been booked for each night to accommodate the group of 4. The total cost includes transportation, meals, and accommodations, and it is within the specified budget. Attractions have been included for the second day, and all restaurants and accommodations adhere to the specified preferences and house rules.", "gpt-4-1106-preview_direct_sole-planning_parsed_results": [{"day": 1, "current_city": "from Las Vegas to Santa Maria", "transportation": "Self-driving, from Las Vegas to Santa Maria, duration: 6 hours 17 mins, distance: 634 km", "breakfast": "-", "attraction": "-", "lunch": "Pirates of Grill, Santa Maria", "dinner": "RiverDine Restaurant & Bar, Santa Maria", "accommodation": "Large Bedroom on upper west/columbia, Santa Maria"}, {"day": 2, "current_city": "Santa Maria", "transportation": "-", "breakfast": "Indian By Nature, Santa Maria", "attraction": "Santa Maria Valley Discovery Museum, Santa Maria;Santa Maria Museum of Flight, Santa Maria;", "lunch": "The Drunk House, Santa Maria", "dinner": "Kuremal Mohan Lal Kulfi Wale, Santa Maria", "accommodation": "Large Bedroom on upper west/columbia, Santa Maria"}, {"day": 3, "current_city": "from Santa Maria to Las Vegas", "transportation": "Self-driving, from Santa Maria to Las Vegas, duration: 6 hours 19 mins, distance: 636 km", "breakfast": "Calendar Khana Laao, Santa Maria", "attraction": "-", "lunch": "-", "dinner": "-", "accommodation": "-"}]}]