[{"gpt-4-1106-preview_direct_sole-planning_results": "Travel Plan:\n\nDays: 1\nCurrent City: from Milwaukee to Alpena, Michigan\nTransportation: Self-driving, from Milwaukee to Alpena, duration: 7 hours 37 mins, distance: 749 km, cost: 37\nBreakfast: -\nAttraction: -\nLunch: -\nDinner: A & A Pagliai's Pizza, Alpena, Michigan, cost: 72, cuisines: Tea, American, Fast Food\nAccommodation: Loft in Times Square with Roof Balcony, Alpena, Michigan, cost: 104, maximum occupancy: 2, house rules: No parties & No visitors\n\nNumber of people: 2\nTotal cost: (37 x 2) + (72 x 2) + (104 x 2) = 426\nAccommodation minimum nights: 1/180\n\nDays: 2\nCurrent City: Alpena, Michigan\nTransportation: -\nBreakfast: @Mango, Alpena, Michigan, cost: 38, cuisines: BBQ, Cafe, American, Desserts\nAttraction: Great Lakes Maritime Heritage Center, Alpena, Michigan; Besser Museum for Northeast Michigan, Alpena, Michigan\nLunch: Shudh Restaurant, Alpena, Michigan, cost: 56, cuisines: Cafe, BBQ, Fast Food\nDinner: Maplai, Alpena, Michigan, cost: 63, cuisines: Tea, Indian, Bakery, Fast Food, American\nAccommodation: Loft in Times Square with Roof Balcony, Alpena, Michigan, cost: 104, maximum occupancy: 2, house rules: No parties & No visitors\n\nNumber of people: 2\nTotal cost: (38 x 2) + (56 x 2) + (63 x 2) + (104 x 2) = 522\nAccommodation minimum nights: 2/180\n\nDays: 3\nCurrent City: from Alpena to Kalamazoo, Michigan\nTransportation: Self-driving, from Alpena to Kalamazoo, duration: 4 hours 33 mins, distance: 464 km, cost: 23\nBreakfast: Jain Chawal Wale, Alpena, Michigan, cost: 20, cuisines: Desserts, Pizza, Italian, Mexican, Cafe\nAttraction: Kalamazoo Valley Museum, Kalamazoo, Michigan; Kalamazoo Institute of Arts, Kalamazoo, Michigan\nLunch: Django, Kalamazoo, Michigan, cost: 65, cuisines: Mediterranean, Desserts, Fast Food\nDinner: Giulios Greek & Italian Restaurant, Kalamazoo, Michigan, cost: 76, cuisines: Fast Food, French, Desserts, Seafood\nAccommodation: Sunny, 1 Bedroom in Bedstuy, Brooklyn, Kalamazoo, Michigan, cost: 160, maximum occupancy: 2, house rules: No smoking\n\nNumber of people: 2\nTotal cost: (23 x 2) + (20 x 2) + (65 x 2) + (76 x 2) + (160 x 2) = 688\nAccommodation minimum nights: 1/7\n\nDays: 4\nCurrent City: Kalamazoo, Michigan\nTransportation: -\nBreakfast: Cha cTea, Kalamazoo, Michigan, cost: 77, cuisines: Cafe, Pizza, Mediterranean\nAttraction: Kalamazoo Nature Center, Kalamazoo, Michigan; Air Zoo Aerospace & Science Museum, Kalamazoo, Michigan\nLunch: Taco Bell, Kalamazoo, Michigan, cost: 54, cuisines: Chinese, Bakery, Pizza, Seafood\nDinner: Oxy Lounge, Kalamazoo, Michigan, cost: 65, cuisines: Tea, Bakery, BBQ\nAccommodation: Sunny, 1 Bedroom in Bedstuy, Brooklyn, Kalamazoo, Michigan, cost: 160, maximum occupancy: 2, house rules: No smoking\n\nNumber of people: 2\nTotal cost: (77 x 2) + (54 x 2) + (65 x 2) + (160 x 2) = 712\nAccommodation minimum nights: 2/7\n\nDays: 5\nCurrent City: from Kalamazoo to Milwaukee\nTransportation: Self-driving, from Kalamazoo to Milwaukee, duration: 3 hours 45 mins, distance: 382 km, cost: 19\nBreakfast: Six Degrees, Kalamazoo, Michigan, cost: 20, cuisines: Cafe, Italian, Bakery, Fast Food, Chinese\nAttraction: -\nLunch: -\nDinner: -\nAccommodation: -\n\nNumber of people: 2\nTotal cost: (19 x 2) + (20 x 2) = 78\n\nTotal cost across all days: 426 + 522 + 688 + 712 + 78 = 2,426\n\nUnfortunately, the total cost of the travel plan ($2,426) exceeds the specified budget of $1,700. Adjustments will need to be made to the plan to reduce costs, such as selecting more affordable restaurants or accommodations. Please note that the accommodation \"Loft in Times Square with Roof Balcony\" does not allow parties, which is against the specified requirement. We would need to find an alternative accommodation that allows parties and fits within the budget constraints.", "gpt-4-1106-preview_direct_sole-planning_parsed_results": [{"day": 1, "current_city": "from Milwaukee to Alpena, Michigan", "transportation": "Self-driving, from Milwaukee to Alpena, duration: 7 hours 37 mins, distance: 749 km", "breakfast": "-", "attraction": "-", "lunch": "-", "dinner": "A & A Pagliai's Pizza, Alpena, Michigan", "accommodation": "Loft in Times Square with Roof Balcony, Alpena, Michigan"}, {"day": 2, "current_city": "Alpena, Michigan", "transportation": "-", "breakfast": "@Mango, Alpena, Michigan", "attraction": "Great Lakes Maritime Heritage Center, Alpena, Michigan;Besser Museum for Northeast Michigan, Alpena, Michigan;", "lunch": "Shudh Restaurant, Alpena, Michigan", "dinner": "Maplai, Alpena, Michigan", "accommodation": "Loft in Times Square with Roof Balcony, Alpena, Michigan"}, {"day": 3, "current_city": "from Alpena to Kalamazoo, Michigan", "transportation": "Self-driving, from Alpena to Kalamazoo, duration: 4 hours 33 mins, distance: 464 km", "breakfast": "Jain Chawal Wale, Alpena, Michigan", "attraction": "Kalamazoo Valley Museum, Kalamazoo, Michigan;Kalamazoo Institute of Arts, Kalamazoo, Michigan;", "lunch": "Django, Kalamazoo, Michigan", "dinner": "Giulios Greek & Italian Restaurant, Kalamazoo, Michigan", "accommodation": "Sunny, 1 Bedroom in Bedstuy, Brooklyn, Kalamazoo, Michigan"}, {"day": 4, "current_city": "Kalamazoo, Michigan", "transportation": "-", "breakfast": "Cha cTea, Kalamazoo, Michigan", "attraction": "Kalamazoo Nature Center, Kalamazoo, Michigan;Air Zoo Aerospace & Science Museum, Kalamazoo, Michigan;", "lunch": "Taco Bell, Kalamazoo, Michigan", "dinner": "Oxy Lounge, Kalamazoo, Michigan", "accommodation": "Sunny, 1 Bedroom in Bedstuy, Brooklyn, Kalamazoo, Michigan"}, {"day": 5, "current_city": "from Kalamazoo to Milwaukee", "transportation": "Self-driving, from Kalamazoo to Milwaukee, duration: 3 hours 45 mins, distance: 382 km", "breakfast": "Six Degrees, Kalamazoo, Michigan", "attraction": "-", "lunch": "-", "dinner": "-", "accommodation": "-"}]}]