[{"gpt-4-1106-preview_direct_sole-planning_results": "Travel Plan:\n\nDays: 1\nCurrent City: from Islip to State College, Pennsylvania\nTransportation: Self-driving, from Islip to State College, duration: 4 hours 52 mins, distance: 464 km, cost: 23\nBreakfast: -\nAttraction: -\nLunch: -\nDinner: Qureshi's Kabab Corner, State College, Pennsylvania, cost: 60, cuisines: Desserts, Tea, Italian, BBQ, Mediterranean\nAccommodation: Beautiful, Newly Furnished, Luxury, Grand Central, State College, Pennsylvania, cost: 210, room type: Entire home/apt, house rules: No parties, minimum nights: 1, maximum occupancy: 2\n\nNumber of people: 2\nTotal cost: (23 x 2) + (60 x 2) + (210 x 2) = 586\nAccommodation minimum nights: 1/1\n\nDays: 2\nCurrent City: State College, Pennsylvania\nTransportation: -\nBreakfast: The Tuck Shop, State College, Pennsylvania, cost: 20, cuisines: Bakery, BBQ, Mediterranean\nAttraction: The Arboretum at Penn State, State College, Pennsylvania; Palmer Museum of Art, State College, Pennsylvania\nLunch: Los Agaves, State College, Pennsylvania, cost: 39, cuisines: French, BBQ, Cafe\nDinner: Maharaja Food Club, State College, Pennsylvania, cost: 14, cuisines: Desserts, Indian, BBQ\nAccommodation: Beautiful, Newly Furnished, Luxury, Grand Central, State College, Pennsylvania, cost: 210, room type: Entire home/apt, house rules: No parties, minimum nights: 1, maximum occupancy: 2\n\nNumber of people: 2\nTotal cost: (20 x 2) + (39 x 2) + (14 x 2) + (210 x 2) = 566\nAccommodation minimum nights: 2/1\n\nDays: 3\nCurrent City: from State College, Pennsylvania to Johnstown, Pennsylvania\nTransportation: Self-driving, from State College to Johnstown, duration: 1 hour 29 mins, distance: 137 km, cost: 6\nBreakfast: Hotel Ekant, State College, Pennsylvania, cost: 16, cuisines: Fast Food, Pizza, Italian\nAttraction: Greenhouse Park, Johnstown, Pennsylvania; Conemaugh Gap Scenic Overlook, Johnstown, Pennsylvania\nLunch: Pita Pan, Johnstown, Pennsylvania, cost: 40, cuisines: Mexican, Pizza, Indian, Fast Food\nDinner: Desi Vibes, Johnstown, Pennsylvania, cost: 18, cuisines: Mexican, BBQ, Pizza\nAccommodation: 2 Bedroom Apartment East Village Amazing Location, Johnstown, Pennsylvania, cost: 158, room type: Entire home/apt, house rules: No pets, minimum nights: 2, maximum occupancy: 3\n\nNumber of people: 2\nTotal cost: (6 x 2) + (16 x 2) + (40 x 2) + (18 x 2) + (158 x 2) = 476\nAccommodation minimum nights: 1/2\n\nDays: 4\nCurrent City: Johnstown, Pennsylvania\nTransportation: -\nBreakfast: Palmshore, Johnstown, Pennsylvania, cost: 61, cuisines: Bakery, American, BBQ, Fast Food\nAttraction: Sandyvale Memorial Gardens and Conservancy, Johnstown, Pennsylvania; I Love Johnstown Mural, Johnstown, Pennsylvania\nLunch: Burger Dominion, Johnstown, Pennsylvania, cost: 83, cuisines: Tea, Pizza, French, Cafe, Mediterranean\nDinner: Daawat-e-Mehak, Johnstown, Pennsylvania, cost: 51, cuisines: Tea, French, Pizza\nAccommodation: 2 Bedroom Apartment East Village Amazing Location, Johnstown, Pennsylvania, cost: 158, room type: Entire home/apt, house rules: No pets, minimum nights: 2, maximum occupancy: 3\n\nNumber of people: 2\nTotal cost: (61 x 2) + (83 x 2) + (51 x 2) + (158 x 2) = 706\nAccommodation minimum nights: 2/2\n\nDays: 5\nCurrent City: from Johnstown, Pennsylvania to Islip\nTransportation: Self-driving, from Johnstown to Islip, duration: 5 hours 57 mins, distance: 590 km, cost: 29\nBreakfast: Wah Ji Wah, Johnstown, Pennsylvania, cost: 35, cuisines: Tea, French, American, Seafood\nAttraction: -\nLunch: -\nDinner: -\nAccommodation: -\n\nNumber of people: 2\nTotal cost: (29 x 2) + (35 x 2) = 128\n\nTotal cost across all days: 586 + 566 + 476 + 706 + 128 = 2,462\nCuisines: The prompt specifies no cuisines, so all cuisine constraints are satisfied\n\nNote: All costs are in USD. The total cost of the trip is within the specified budget of $2,700. The accommodations selected allow children under 10 and are entire rooms, as requested. No flights were included in the transportation, adhering to the preference for no flights.", "gpt-4-1106-preview_direct_sole-planning_parsed_results": [{"day": 1, "current_city": "from Islip to State College, Pennsylvania", "transportation": "Self-driving, from Islip to State College, duration: 4 hours 52 mins, distance: 464 km", "breakfast": "-", "attraction": "-", "lunch": "-", "dinner": "Qureshi's Kabab Corner, State College, Pennsylvania", "accommodation": "Beautiful, Newly Furnished, Luxury, Grand Central, State College, Pennsylvania"}, {"day": 2, "current_city": "State College, Pennsylvania", "transportation": "-", "breakfast": "The Tuck Shop, State College, Pennsylvania", "attraction": "The Arboretum at Penn State, State College, Pennsylvania;Palmer Museum of Art, State College, Pennsylvania;", "lunch": "Los Agaves, State College, Pennsylvania", "dinner": "Maharaja Food Club, State College, Pennsylvania", "accommodation": "Beautiful, Newly Furnished, Luxury, Grand Central, State College, Pennsylvania"}, {"day": 3, "current_city": "from State College, Pennsylvania to Johnstown, Pennsylvania", "transportation": "Self-driving, from State College to Johnstown, duration: 1 hour 29 mins, distance: 137 km", "breakfast": "Hotel Ekant, State College, Pennsylvania", "attraction": "Greenhouse Park, Johnstown, Pennsylvania;Conemaugh Gap Scenic Overlook, Johnstown, Pennsylvania;", "lunch": "Pita Pan, Johnstown, Pennsylvania", "dinner": "Desi Vibes, Johnstown, Pennsylvania", "accommodation": "2 Bedroom Apartment East Village Amazing Location, Johnstown, Pennsylvania"}, {"day": 4, "current_city": "Johnstown, Pennsylvania", "transportation": "-", "breakfast": "Palmshore, Johnstown, Pennsylvania", "attraction": "Sandyvale Memorial Gardens and Conservancy, Johnstown, Pennsylvania;I Love Johnstown Mural, Johnstown, Pennsylvania;", "lunch": "Burger Dominion, Johnstown, Pennsylvania", "dinner": "Daawat-e-Mehak, Johnstown, Pennsylvania", "accommodation": "2 Bedroom Apartment East Village Amazing Location, Johnstown, Pennsylvania"}, {"day": 5, "current_city": "from Johnstown, Pennsylvania to Islip", "transportation": "Self-driving, from Johnstown to Islip, duration: 5 hours 57 mins, distance: 590 km", "breakfast": "Wah Ji Wah, Johnstown, Pennsylvania", "attraction": "-", "lunch": "-", "dinner": "-", "accommodation": "-"}]}]