[{"gpt-4-1106-preview_direct_sole-planning_results": "Travel Plan:\n\nDays: 1\nCurrent City: from St. Louis to Washington\nTransportation: Flight F3934368, from St. Louis to Washington, Price: $162, DepTime: 12:42, ArrTime: 15:38, ActualElapsedTime: 1 hour 56 minutes\nBreakfast: -\nAttraction: -\nLunch: -\nDinner: Los Aztecas, Washington, Average Cost: $46, Cuisines: Cafe, Bakery, BBQ, Fast Food, Aggregate Rating: 3.5\nAccommodation: Stunning 2Bed/2BA + 300sqft deck by the river!, Washington, price: $209, room type: Entire home/apt, house rules: No visitors, minimum nights: 1, maximum occupancy: 3, review rate number: 2.0\n\nNumber of people: 1\nTotal cost: Flight $162 + Dinner $46 + Accommodation $209 = $417\nAccommodation minimum nights: 1/1\n\nDays: 2\nCurrent City: Washington\nTransportation: -\nBreakfast: Manna Java World Cafe, Washington, Average Cost: $59, Cuisines: Cafe, Seafood, Aggregate Rating: 3.5\nAttraction: Space Needle, Washington, Address: 400 Broad St, Seattle, WA 98109, USA\nLunch: Hemingway's Island Grill, Washington, Average Cost: $57, Cuisines: Mexican, BBQ, Fast Food, Cafe, Seafood, Aggregate Rating: 3.5\nDinner: Thaaliwala, Washington, Average Cost: $88, Cuisines: Tea, Pizza, Italian, BBQ, Cafe, Aggregate Rating: 4.1\nAccommodation: Stunning 2Bed/2BA + 300sqft deck by the river!, Washington, price: $209, room type: Entire home/apt, house rules: No visitors, minimum nights: 1, maximum occupancy: 3, review rate number: 2.0\n\nNumber of people: 1\nTotal cost: Breakfast $59 + Lunch $57 + Dinner $88 + Accommodation $209 = $413\nAccommodation minimum nights: 2/1\n\nDays: 3\nCurrent City: from Washington to St. Louis\nTransportation: Flight F3788616, from Washington to St. Louis, Price: $146, DepTime: 16:09, ArrTime: 17:42, ActualElapsedTime: 2 hours 33 minutes\nBreakfast: Republic of Chicken, Washington, Average Cost: $91, Cuisines: Tea, Bakery, American, Desserts, Aggregate Rating: 3.1\nAttraction: -\nLunch: -\nDinner: -\nAccommodation: -\n\nNumber of people: 1\nTotal cost: Breakfast $91 + Flight $146 = $237\n\nTotal cost across all days: $417 (Day 1) + $413 (Day 2) + $237 (Day 3) = $1,067\n\nCuisines: The prompt specifies no cuisines, so all cuisine constraints are satisfied\n\nPlease note that the attractions and restaurants are chosen based on the provided CSV data, and the travel plan adheres to the budget and constraints specified in the query. The accommodation is booked for two nights as per the travel dates, and the transportation modes are flights as per the available data.", "gpt-4-1106-preview_direct_sole-planning_parsed_results": [{"day": 1, "current_city": "from St. Louis to Washington", "transportation": "Flight Number: F3934368, from St. Louis to Washington, Departure Time: 12:42, Arrival Time: 15:38", "breakfast": "-", "attraction": "-", "lunch": "-", "dinner": "Los Aztecas, Washington", "accommodation": "Stunning 2Bed/2BA + 300sqft deck by the river!, Washington"}, {"day": 2, "current_city": "Washington", "transportation": "-", "breakfast": "Manna Java World Cafe, Washington", "attraction": "Space Needle, Washington", "lunch": "Hemingway's Island Grill, Washington", "dinner": "Thaaliwala, Washington", "accommodation": "Stunning 2Bed/2BA + 300sqft deck by the river!, Washington"}, {"day": 3, "current_city": "from Washington to St. Louis", "transportation": "Flight Number: F3788616, from Washington to St. Louis, Departure Time: 16:09, Arrival Time: 17:42", "breakfast": "Republic of Chicken, Washington", "attraction": "-", "lunch": "-", "dinner": "-", "accommodation": "-"}]}]