[{"gpt-4-1106-preview_direct_sole-planning_results": "Travel Plan:\n\nDays: 1\nCurrent City: from Baton Rouge to Dallas\nTransportation: Flight F3815317, from Baton Rouge to Dallas, price: $161, DepTime: 09:48, ArrTime: 11:29, duration: 1 hour 41 minutes, distance: 383 km\nBreakfast: -\nAttraction: The Dallas World Aquarium, Dallas, cost: $20.95 per person\nLunch: Coconuts Fish Cafe, Dallas, cost: $38, cuisines: Cafe, BBQ, Mediterranean, Fast Food\nDinner: 1918 Bistro & Grill, Dallas, cost: $90, cuisines: Tea, Pizza, BBQ, Seafood\nAccommodation: Sunny Brooklyn room, Dallas, cost: $227, room type: Private room, house rules: Smoking allowed, minimum nights: 1, maximum occupancy: 2\n\nNumber of people: 4\nTotal cost: (161 x 4) + (20.95 x 4) + (38 x 4) + (90 x 4) + (227 x 2) = 644 + 83.8 + 152 + 360 + 454 = $1,693.8\nAccommodation minimum nights: 1/1\n\nDays: 2\nCurrent City: Dallas\nTransportation: -\nBreakfast: Cafe Gatherings, Dallas, cost: $17, cuisines: Bakery, Indian, Desserts\nAttraction: Reunion Tower, Dallas, cost: $18 per person\nLunch: Yanki Sizzlers, Dallas, cost: $96, cuisines: Cafe, French, Tea, Mediterranean\nDinner: L'Opera, Dallas, cost: $77, cuisines: French, Bakery, BBQ, Fast Food, Seafood\nAccommodation: Sunny Brooklyn room, Dallas, cost: $227, room type: Private room, house rules: Smoking allowed, minimum nights: 1, maximum occupancy: 2\n\nNumber of people: 4\nTotal cost: (17 x 4) + (18 x 4) + (96 x 4) + (77 x 4) + (227 x 2) = 68 + 72 + 384 + 308 + 454 = $1,286\nAccommodation minimum nights: 2/1\n\nDays: 3\nCurrent City: from Dallas to Baton Rouge\nTransportation: Flight F3814165, from Dallas to Baton Rouge, price: $87, DepTime: 20:39, ArrTime: 21:58, duration: 1 hour 19 minutes, distance: 383 km\nBreakfast: Drifters Cafe, Dallas, cost: $21, cuisines: Tea, French, Mexican, Cafe, Seafood\nAttraction: -\nLunch: -\nDinner: -\nAccommodation: -\n\nNumber of people: 4\nTotal cost: (87 x 4) + (21 x 4) = 348 + 84 = $432\n\nTotal cost across all days: $1,693.8 + $1,286 + $432 = $3,411.8\n\nCuisines: The prompt specifies smoking allowed accommodations, which have been adhered to. No specific cuisines were requested.\n\nNote: The attractions and restaurants were chosen based on the provided CSV data for Dallas. The flight options were selected from the provided flight information, ensuring the travel dates match the query. The accommodation was chosen to allow smoking, as per the query's requirement. The total cost is within the specified budget of $5,500.", "gpt-4-1106-preview_direct_sole-planning_parsed_results": [{"day": 1, "current_city": "from Baton Rouge to Dallas", "transportation": "Flight Number: F3815317, from Baton Rouge to Dallas, Departure Time: 09:48, Arrival Time: 11:29", "breakfast": "-", "attraction": "The Dallas World Aquarium, Dallas;", "lunch": "Coconuts Fish Cafe, Dallas", "dinner": "1918 Bistro & Grill, Dallas", "accommodation": "Sunny Brooklyn room, Dallas"}, {"day": 2, "current_city": "Dallas", "transportation": "-", "breakfast": "Cafe Gatherings, Dallas", "attraction": "Reunion Tower, Dallas;", "lunch": "Yanki Sizzlers, Dallas", "dinner": "L'Opera, Dallas", "accommodation": "Sunny Brooklyn room, Dallas"}, {"day": 3, "current_city": "from Dallas to Baton Rouge", "transportation": "Flight Number: F3814165, from Dallas to Baton Rouge, Departure Time: 20:39, Arrival Time: 21:58", "breakfast": "Drifters Cafe, Dallas", "attraction": "-", "lunch": "-", "dinner": "-", "accommodation": "-"}]}]