[{"gpt-4-1106-preview_direct_sole-planning_results": "Travel Plan:\n\nDays: 1\nCurrent City: from Chicago to Wilmington, North Carolina\nTransportation: Self-driving, from Chicago to Wilmington, duration: 14 hours 11 mins, distance: 1,505 km, cost: 75\nBreakfast: -\nAttraction: -\nLunch: -\nDinner: Azteca, Wilmington, North Carolina, cost: 56, cuisines: Cafe, Indian, BBQ\nAccommodation: Prime East Village location w/backyard garden!, Wilmington, North Carolina, cost: 978, room type: Entire home/apt, house rules: No pets & No smoking, maximum occupancy: 7\n\nNumber of people: 2\nTotal cost: (75 x 2) + (56 x 2) + (978 x 1) = 1,240\nAccommodation minimum nights: 1/4\n\nDays: 2\nCurrent City: Wilmington, North Carolina\nTransportation: -\nBreakfast: Bandit Burrito, Wilmington, North Carolina, cost: 26, cuisines: Desserts, French, Bakery, Fast Food, Seafood\nAttraction: Bellamy Mansion Museum, Wilmington, North Carolina; Airlie Gardens, Wilmington, North Carolina\nLunch: Taco Bus, Wilmington, North Carolina, cost: 59, cuisines: Tea, Cafe, BBQ\nDinner: Momo-Cha, Wilmington, North Carolina, cost: 92, cuisines: Desserts, Cafe, French, BBQ, Chinese\nAccommodation: Prime East Village location w/backyard garden!, Wilmington, North Carolina, cost: 978, room type: Entire home/apt, house rules: No pets & No smoking, maximum occupancy: 7\n\nNumber of people: 2\nTotal cost: (26 x 2) + (59 x 2) + (92 x 2) + (978 x 1) = 1,330\nAccommodation minimum nights: 2/4\n\nDays: 3\nCurrent City: from Wilmington to Charlotte, North Carolina\nTransportation: Self-driving, from Wilmington to Charlotte, duration: 3 hours 24 mins, distance: 324 km, cost: 16\nBreakfast: Dunkin' Donuts, Wilmington, North Carolina, cost: 25, cuisines: Desserts, Tea, Pizza, Italian, French\nAttraction: Wilmington Riverwalk, Wilmington, North Carolina; Battleship North Carolina, Wilmington, North Carolina\nLunch: The Yellow Chef, Wilmington, North Carolina, cost: 45, cuisines: French, BBQ, Mediterranean, Fast Food\nDinner: Olive Tree Cafe, Charlotte, North Carolina, cost: 23, cuisines: Tea, Chinese, Desserts\nAccommodation: Elegant Studio Apt in Prospect Heights, Charlotte, North Carolina, cost: 640, room type: Entire home/apt, house rules: No parties, maximum occupancy: 5\n\nNumber of people: 2\nTotal cost: (16 x 2) + (25 x 2) + (45 x 2) + (23 x 2) + (640 x 1) = 833\nAccommodation minimum nights: 1/2\n\nDays: 4\nCurrent City: Charlotte, North Carolina\nTransportation: -\nBreakfast: Central Perk 7, Charlotte, North Carolina, cost: 87, cuisines: Pizza, Bakery, BBQ, Fast Food\nAttraction: Freedom Park, Charlotte, North Carolina; Levine Museum of the New South, Charlotte, North Carolina\nLunch: Subway, Charlotte, North Carolina, cost: 60, cuisines: Tea, Cafe, Mexican, Chinese, Seafood\nDinner: Cafe Maple Street, Charlotte, North Carolina, cost: 91, cuisines: Fast Food, Tea, Italian\nAccommodation: Elegant Studio Apt in Prospect Heights, Charlotte, North Carolina, cost: 640, room type: Entire home/apt, house rules: No parties, maximum occupancy: 5\n\nNumber of people: 2\nTotal cost: (87 x 2) + (60 x 2) + (91 x 2) + (640 x 1) = 1,016\nAccommodation minimum nights: 2/2\n\nDays: 5\nCurrent City: from Charlotte to Chicago\nTransportation: Self-driving, from Charlotte to Chicago, duration: 11 hours 39 mins, distance: 1,215 km, cost: 60\nBreakfast: Kylin Skybar, Charlotte, North Carolina, cost: 44, cuisines: Tea, Cafe, Pizza, Italian\nAttraction: -\nLunch: -\nDinner: -\nAccommodation: -\n\nNumber of people: 2\nTotal cost: (60 x 2) + (44 x 2) = 208\n\nTotal cost across all days: 1,240 + 1,330 + 833 + 1,016 + 208 = 4,627\n\nUnfortunately, the total cost exceeds the specified budget of $3,600. Adjustments need to be made to the plan to reduce costs. This could include choosing less expensive accommodations or dining options. Please advise on which aspects of the trip are flexible for adjustment.", "gpt-4-1106-preview_direct_sole-planning_parsed_results": [{"day": 1, "current_city": "from Chicago to Wilmington, North Carolina", "transportation": "Self-driving, from Chicago to Wilmington, duration: 14 hours 11 mins, distance: 1,505 km", "breakfast": "-", "attraction": "-", "lunch": "-", "dinner": "Azteca, Wilmington, North Carolina", "accommodation": "Prime East Village location w/backyard garden!, Wilmington, North Carolina"}, {"day": 2, "current_city": "Wilmington, North Carolina", "transportation": "-", "breakfast": "Bandit Burrito, Wilmington, North Carolina", "attraction": "Bellamy Mansion Museum, Wilmington, North Carolina;Airlie Gardens, Wilmington, North Carolina;", "lunch": "Taco Bus, Wilmington, North Carolina", "dinner": "Momo-Cha, Wilmington, North Carolina", "accommodation": "Prime East Village location w/backyard garden!, Wilmington, North Carolina"}, {"day": 3, "current_city": "from Wilmington to Charlotte, North Carolina", "transportation": "Self-driving, from Wilmington to Charlotte, duration: 3 hours 24 mins, distance: 324 km", "breakfast": "Dunkin' Donuts, Wilmington, North Carolina", "attraction": "Wilmington Riverwalk, Wilmington, North Carolina;Battleship North Carolina, Wilmington, North Carolina;", "lunch": "The Yellow Chef, Wilmington, North Carolina", "dinner": "Olive Tree Cafe, Charlotte, North Carolina", "accommodation": "Elegant Studio Apt in Prospect Heights, Charlotte, North Carolina"}, {"day": 4, "current_city": "Charlotte, North Carolina", "transportation": "-", "breakfast": "Central Perk 7, Charlotte, North Carolina", "attraction": "Freedom Park, Charlotte, North Carolina;Levine Museum of the New South, Charlotte, North Carolina;", "lunch": "Subway, Charlotte, North Carolina", "dinner": "Cafe Maple Street, Charlotte, North Carolina", "accommodation": "Elegant Studio Apt in Prospect Heights, Charlotte, North Carolina"}, {"day": 5, "current_city": "from Charlotte to Chicago", "transportation": "Self-driving, from Charlotte to Chicago, duration: 11 hours 39 mins, distance: 1,215 km", "breakfast": "Kylin Skybar, Charlotte, North Carolina", "attraction": "-", "lunch": "-", "dinner": "-", "accommodation": "-"}]}]