[{"gpt-4-1106-preview_direct_sole-planning_results": "Travel Plan:\n\nDays: 1\nCurrent City: from Chicago to Albany\nTransportation: Flight F3983350, from Chicago to Albany, departure: 14:29, arrival: 17:03, duration: 1 hour 34 minutes, cost: $160 per person\nBreakfast: -\nAttraction: -\nLunch: -\nDinner: Kaiser, Albany, New York, cost: $96, cuisines: Cafe, Pizza, American\nAccommodation: Mid Town East Side Apartment, Albany, New York, cost: $737, room type: Entire home/apt, house rules: No pets & No children under 10, minimum nights: 1, maximum occupancy: 6\n\nNumber of people: 2\nTotal cost: (Flight $160 x 2) + (Dinner $96 x 2) + (Accommodation $737 x 1) = $320 + $192 + $737 = $1,249\nAccommodation minimum nights: 1/1\n\nDays: 2\nCurrent City: Albany\nTransportation: -\nBreakfast: Cafe Coffee Day, Albany, New York, cost: $82, cuisines: Mexican, Fast Food, Cafe, American, Seafood\nAttraction: New York State Museum, Albany, New York; Washington Park Lake House, Albany, New York\nLunch: Echoes Satyaniketan, Albany, New York, cost: $91, cuisines: Chinese, Bakery, Cafe\nDinner: Urban Punjab, Albany, New York, cost: $63, cuisines: Desserts, Tea, Pizza, Indian, Mediterranean, Seafood\nAccommodation: Mid Town East Side Apartment, Albany, New York, cost: $737, room type: Entire home/apt, house rules: No pets & No children under 10, minimum nights: 1, maximum occupancy: 6\n\nNumber of people: 2\nTotal cost: (Breakfast $82 x 2) + (Lunch $91 x 2) + (Dinner $63 x 2) + (Accommodation $737 x 1) = $164 + $182 + $126 + $737 = $1,209\nAccommodation minimum nights: 2/1\n\nDays: 3\nCurrent City: from Albany to Chicago\nTransportation: Flight F4008387, from Albany to Chicago, departure: 05:05, arrival: 06:11, duration: 2 hours 6 minutes, cost: $181 per person\nBreakfast: -\nAttraction: -\nLunch: -\nDinner: -\nAccommodation: -\n\nNumber of people: 2\nTotal cost: (Flight $181 x 2) = $362\n\nTotal cost across all days: $1,249 + $1,209 + $362 = $2,820\n\nUnfortunately, the total cost of $2,820 exceeds the specified budget of $2,300. To adjust the plan within the budget, we can consider changing the accommodation to a less expensive option.\n\nRevised Accommodation for Days 1 and 2:\nAccommodation: Spacious room with huge bay window & natural light, Albany, New York, cost: $213, room type: Private room, house rules: No visitors, minimum nights: 2, maximum occupancy: 1\n\nSince the accommodation allows only 1 person per room, we need to book two rooms.\n\nRevised Total cost for Days 1 and 2: (Accommodation $213 x 2 rooms) = $426\n\nRevised Total cost across all days: ($1,249 - $737 + $426) + ($1,209 - $737 + $426) + $362 = $1,938\n\nThe revised total cost of $1,938 is now within the specified budget of $2,300. However, the revised accommodation does not meet the requirement of being an entire room that allows smoking. Unfortunately, based on the provided accommodation options, there are no entire rooms that allow smoking within the budget constraint.", "gpt-4-1106-preview_direct_sole-planning_parsed_results": [{"day": 1, "current_city": "from Chicago to Albany", "transportation": "Flight Number: F3983350, from Chicago to Albany, Departure Time: 14:29, Arrival Time: 17:03", "breakfast": "-", "attraction": "-", "lunch": "-", "dinner": "Kaiser, Albany", "accommodation": "Mid Town East Side Apartment, Albany"}, {"day": 2, "current_city": "Albany", "transportation": "-", "breakfast": "Cafe Coffee Day, Albany", "attraction": "New York State Museum, Albany;Washington Park Lake House, Albany;", "lunch": "Echoes Satyaniketan, Albany", "dinner": "Urban Punjab, Albany", "accommodation": "Mid Town East Side Apartment, Albany"}, {"day": 3, "current_city": "from Albany to Chicago", "transportation": "Flight Number: F4008387, from Albany to Chicago, Departure Time: 05:05, Arrival Time: 06:11", "breakfast": "-", "attraction": "-", "lunch": "-", "dinner": "-", "accommodation": "-"}]}]