[{"gpt-4-1106-preview_direct_sole-planning_results": "Travel Plan:\n\nDays: 1\nCurrent City: from Manchester to Charlotte\nTransportation: Flight F3791567, from Manchester to Charlotte, departure: 05:24, arrival: 07:33, duration: 2 hours 9 minutes, distance: 737 km, cost: 268 per person\nBreakfast: -\nAttraction: -\nLunch: Olive Tree Cafe, Charlotte, North Carolina, cost: 23, cuisines: Tea, Chinese, Desserts\nDinner: Central Perk 7, Charlotte, North Carolina, cost: 87, cuisines: Pizza, Bakery, BBQ, Fast Food\nAccommodation: Elegant Studio Apt in Prospect Heights, Charlotte, North Carolina, cost: 640, room type: Entire home/apt, house rules: No parties, minimum nights: 2, maximum occupancy: 5\n\nNumber of people: 5\nTotal cost: (268 x 5) + (23 x 5) + (87 x 5) + (640 x 1) = 1,340 + 115 + 435 + 640 = 2,530\nAccommodation minimum nights: 1/2\n\nDays: 2\nCurrent City: Charlotte\nTransportation: -\nBreakfast: Grover's - The Baker Shop, Charlotte, North Carolina, cost: 30, cuisines: Pizza, Bakery, Chinese, Indian, Seafood\nAttraction: Freedom Park, Charlotte, North Carolina; Levine Museum of the New South, Charlotte, North Carolina\nLunch: Unplugged Courtyard, Charlotte, North Carolina, cost: 54, cuisines: Desserts, French, Bakery, Cafe, Seafood\nDinner: Nagaland's Kitchen, Charlotte, North Carolina, cost: 73, cuisines: Pizza, American, Desserts\nAccommodation: Elegant Studio Apt in Prospect Heights, Charlotte, North Carolina, cost: 640, room type: Entire home/apt, house rules: No parties, minimum nights: 2, maximum occupancy: 5\n\nNumber of people: 5\nTotal cost: (30 x 5) + (54 x 5) + (73 x 5) + (640 x 1) = 150 + 270 + 365 + 640 = 1,425\nAccommodation minimum nights: 2/2\n\nDays: 3\nCurrent City: from Charlotte to Manchester\nTransportation: Flight F3786316, from Charlotte to Manchester, departure: 17:05, arrival: 19:04, duration: 1 hour 59 minutes, distance: 737 km, cost: 208 per person\nBreakfast: Tuk Tuk Indian Street Food, Charlotte, North Carolina, cost: 29, cuisines: Chinese, Bakery, Seafood, Fast Food\nAttraction: Discovery Place Science, Charlotte, North Carolina; The Mint Museum, Charlotte, North Carolina\nLunch: China Garden, Charlotte, North Carolina, cost: 14, cuisines: Tea, Mexican, BBQ, Mediterranean\nDinner: -\nAccommodation: -\n\nNumber of people: 5\nTotal cost: (208 x 5) + (29 x 5) + (14 x 5) = 1,040 + 145 + 70 = 1,255\n\nTotal cost across all days: 2,530 + 1,425 + 1,255 = 5,210\n\nUnfortunately, the total cost exceeds the specified budget of $4,800. To adjust the plan to fit the budget, we can change the flight to a cheaper option if available or adjust meal and accommodation choices.\n\nRevised Travel Plan with Budget Adjustment:\n\nDays: 1\nCurrent City: from Manchester to Charlotte\nTransportation: Flight F3785421, from Manchester to Charlotte, departure: 14:16, arrival: 16:46, duration: 2 hours 30 minutes, distance: 737 km, cost: 223 per person\nBreakfast: -\nAttraction: -\nLunch: -\nDinner: Olive Tree Cafe, Charlotte, North Carolina, cost: 23, cuisines: Tea, Chinese, Desserts\nAccommodation: Luxury 2 bdr/2 bath prime Williamburg, Charlotte, North Carolina, cost: 218, room type: Entire home/apt, house rules: No children under 10 & No smoking & No pets, minimum nights: 1, maximum occupancy: 3\n\nNumber of people: 5\nTotal cost: (223 x 5) + (23 x 5) + (218 x 2) = 1,115 + 115 + 436 = 1,666\nAccommodation minimum nights: 1/1\n\nDays: 2\nCurrent City: Charlotte\nTransportation: -\nBreakfast: Grover's - The Baker Shop, Charlotte, North Carolina, cost: 30, cuisines: Pizza, Bakery, Chinese, Indian, Seafood\nAttraction: Freedom Park, Charlotte, North Carolina; Levine Museum of the New South, Charlotte, North Carolina\nLunch: Unplugged Courtyard, Charlotte, North Carolina, cost: 54, cuisines: Desserts, French, Bakery, Cafe, Seafood\nDinner: Nagaland's Kitchen, Charlotte, North Carolina, cost: 73, cuisines: Pizza, American, Desserts\nAccommodation: Luxury 2 bdr/2 bath prime Williamburg, Charlotte, North Carolina, cost: 218, room type: Entire home/apt, house rules: No children under 10 & No smoking & No pets, minimum nights: 1, maximum occupancy: 3\n\nNumber of people: 5\nTotal cost: (30 x 5) + (54 x 5) + (73 x 5) + (218 x 2) = 150 + 270 + 365 + 436 = 1,221\nAccommodation minimum nights: 2/1\n\nDays: 3\nCurrent City: from Charlotte to Manchester\nTransportation: Flight F3786316, from Charlotte to Manchester, departure: 17:05, arrival: 19:04, duration: 1 hour 59 minutes, distance: 737 km, cost: 208 per person\nBreakfast: Tuk Tuk Indian Street Food, Charlotte, North Carolina, cost: 29, cuisines: Chinese, Bakery, Seafood, Fast Food\nAttraction: Discovery Place Science, Charlotte, North Carolina; The Mint Museum, Charlotte, North Carolina\nLunch: China Garden, Charlotte, North Carolina, cost: 14, cuisines: Tea, Mexican, BBQ, Mediterranean\nDinner: -\nAccommodation: -\n\nNumber of people: 5\nTotal cost: (208 x 5) + (29 x 5) + (14 x 5) = 1,040 + 145 + 70 = 1,255\n\nTotal cost across all days: 1,666 + 1,221 + 1,255 = 4,142\n\nThe revised plan fits within the budget of $4,800.", "gpt-4-1106-preview_direct_sole-planning_parsed_results": [{"day": 1, "current_city": "from Manchester to Charlotte", "transportation": "Flight Number: F3791567, from Manchester to Charlotte, Departure Time: 05:24, Arrival Time: 07:33", "breakfast": "-", "attraction": "-", "lunch": "Olive Tree Cafe, Charlotte", "dinner": "Central Perk 7, Charlotte", "accommodation": "Elegant Studio Apt in Prospect Heights, Charlotte"}, {"day": 2, "current_city": "Charlotte", "transportation": "-", "breakfast": "Grover's - The Baker Shop, Charlotte", "attraction": "Freedom Park, Charlotte;Levine Museum of the New South, Charlotte;", "lunch": "Unplugged Courtyard, Charlotte", "dinner": "Nagaland's Kitchen, Charlotte", "accommodation": "Elegant Studio Apt in Prospect Heights, Charlotte"}, {"day": 3, "current_city": "from Charlotte to Manchester", "transportation": "Flight Number: F3786316, from Charlotte to Manchester, Departure Time: 17:05, Arrival Time: 19:04", "breakfast": "Tuk Tuk Indian Street Food, Charlotte", "attraction": "Discovery Place Science, Charlotte;The Mint Museum, Charlotte;", "lunch": "China Garden, Charlotte", "dinner": "-", "accommodation": "-"}, {"day": 1, "current_city": "from Manchester to Charlotte", "transportation": "Flight Number: F3785421, from Manchester to Charlotte, Departure Time: 14:16, Arrival Time: 16:46", "breakfast": "-", "attraction": "-", "lunch": "-", "dinner": "Olive Tree Cafe, Charlotte", "accommodation": "Luxury 2 bdr/2 bath prime Williamburg, Charlotte"}, {"day": 2, "current_city": "Charlotte", "transportation": "-", "breakfast": "Grover's - The Baker Shop, Charlotte", "attraction": "Freedom Park, Charlotte;Levine Museum of the New South, Charlotte;", "lunch": "Unplugged Courtyard, Charlotte", "dinner": "Nagaland's Kitchen, Charlotte", "accommodation": "Luxury 2 bdr/2 bath prime Williamburg, Charlotte"}, {"day": 3, "current_city": "from Charlotte to Manchester", "transportation": "Flight Number: F3786316, from Charlotte to Manchester, Departure Time: 17:05, Arrival Time: 19:04", "breakfast": "Tuk Tuk Indian Street Food, Charlotte", "attraction": "Discovery Place Science, Charlotte;The Mint Museum, Charlotte;", "lunch": "China Garden, Charlotte", "dinner": "-", "accommodation": "-"}]}]