[{"gpt-4-1106-preview_direct_sole-planning_results": "Travel Plan:\n\nDays: 1\nCurrent City: from Akron to Augusta, Georgia\nTransportation: Self-driving, from Akron to Augusta, duration: 9 hours 36 mins, distance: 1,031 km, cost: 51\nBreakfast: -\nAttraction: -\nLunch: -\nDinner: B Merrell's, Augusta, Georgia, cost: 74, cuisines: Tea, Pizza, Desserts, Fast Food\nAccommodation: Planta Baja Studio, Augusta, Georgia, cost: 637, room type: Entire home/apt, house rules: No smoking, minimum nights: 1, maximum occupancy: 4\n\nNumber of people: 2\nTotal cost: (51 x 2) + (74 x 2) + (637 x 1) = 887\nAccommodation minimum nights: 1/1\n\nDays: 2\nCurrent City: Augusta, Georgia\nTransportation: -\nBreakfast: Fish Tales Lakeside Grille, Augusta, Georgia, cost: 37, cuisines: Tea, Cafe, Bakery, Desserts\nAttraction: Augusta Riverwalk, Augusta, Georgia; Augusta Museum of History, Augusta, Georgia\nLunch: The Charcoal Chimney, Augusta, Georgia, cost: 86, cuisines: Tea, Fast Food, BBQ, Italian\nDinner: Nikhil Food Point, Augusta, Georgia, cost: 87, cuisines: Tea, Mexican, Fast Food, American, Seafood\nAccommodation: Planta Baja Studio, Augusta, Georgia, cost: 637, room type: Entire home/apt, house rules: No smoking, minimum nights: 1, maximum occupancy: 4\n\nNumber of people: 2\nTotal cost: (37 x 2) + (86 x 2) + (87 x 2) + (637 x 1) = 1067\nAccommodation minimum nights: 2/1\n\nDays: 3\nCurrent City: from Augusta to Decatur, Georgia\nTransportation: Self-driving, from Augusta to Decatur, duration: 2 hours 19 mins, distance: 229 km, cost: 11\nBreakfast: KB's Kulfi & Icecream, Augusta, Georgia, cost: 92, cuisines: American, BBQ, Seafood\nAttraction: -\nLunch: -\nDinner: Joey's Pizza, Decatur, Georgia, cost: 69, cuisines: Tea, Pizza, Bakery, Chinese, Seafood\nAccommodation: The Heart of the Lower East Side!, Decatur, Georgia, cost: 587, room type: Entire home/apt, house rules: No children under 10, minimum nights: 2, maximum occupancy: 2\n\nNumber of people: 2\nTotal cost: (11 x 2) + (92 x 2) + (69 x 2) + (587 x 1) = 921\nAccommodation minimum nights: 1/2\n\nDays: 4\nCurrent City: Decatur, Georgia\nTransportation: -\nBreakfast: Cafe Coffee Day, Decatur, Georgia, cost: 46, cuisines: Tea, Cafe, BBQ, Mediterranean\nAttraction: DeKalb History Center Museum, Decatur, Georgia; Glenlake Park, Decatur, Georgia\nLunch: Dawat-E-Chaman, Decatur, Georgia, cost: 42, cuisines: Chinese, BBQ, Fast Food, Cafe, Mediterranean\nDinner: Carnatic Cafe, Decatur, Georgia, cost: 66, cuisines: Cafe, Indian, Desserts\nAccommodation: The Heart of the Lower East Side!, Decatur, Georgia, cost: 587, room type: Entire home/apt, house rules: No children under 10, minimum nights: 2, maximum occupancy: 2\n\nNumber of people: 2\nTotal cost: (46 x 2) + (42 x 2) + (66 x 2) + (587 x 1) = 905\nAccommodation minimum nights: 2/2\n\nDays: 5\nCurrent City: from Decatur to Atlanta, Georgia\nTransportation: Self-driving, from Decatur to Atlanta, duration: 19 mins, distance: 13.0 km, cost: 0\nBreakfast: Subway, Decatur, Georgia, cost: 40, cuisines: Desserts, BBQ, Bakery, Fast Food, American\nAttraction: Atlanta Botanical Garden, Atlanta, Georgia; Georgia Aquarium, Atlanta, Georgia\nLunch: Asian Bistro, Atlanta, Georgia, cost: 27, cuisines: Tea, Bakery, Seafood\nDinner: Chef Style, Atlanta, Georgia, cost: 59, cuisines: Pizza, American, Desserts, Seafood\nAccommodation: FABULOUS SUNNY BEDROOM IN HARLEM, Atlanta, Georgia, cost: 587, room type: Private room, house rules: No parties, minimum nights: 20, maximum occupancy: 2\n\nNumber of people: 2\nTotal cost: (40 x 2) + (27 x 2) + (59 x 2) + (587 x 1) = 837\nAccommodation minimum nights: 1/20\n\nDays: 6\nCurrent City: Atlanta, Georgia\nTransportation: -\nBreakfast: Saffron, Atlanta, Georgia, cost: 39, cuisines: Tea, Cafe, Fast Food, Seafood\nAttraction: World of Coca-Cola, Atlanta, Georgia; Piedmont Park, Atlanta, Georgia\nLunch: Pizza Central, Atlanta, Georgia, cost: 75, cuisines: Cafe, Bakery, BBQ, Fast Food, Chinese, Indian\nDinner: Daawat-e-Kashmir, Atlanta, Georgia, cost: 19, cuisines: Cafe, Pizza, American, Seafood\nAccommodation: FABULOUS SUNNY BEDROOM IN HARLEM, Atlanta, Georgia, cost: 587, room type: Private room, house rules: No parties, minimum nights: 20, maximum occupancy: 2\n\nNumber of people: 2\nTotal cost: (39 x 2) + (75 x 2) + (19 x 2) + (587 x 1) = 873\nAccommodation minimum nights: 2/20\n\nDays: 7\nCurrent City: from Atlanta to Akron\nTransportation: Self-driving, from Atlanta to Akron, duration: 10 hours 10 mins, distance: 1,114 km, cost: 55\nBreakfast: Adda, Atlanta, Georgia, cost: 22, cuisines: Tea, Mexican, Bakery\nAttraction: -\nLunch: -\nDinner: -\nAccommodation: -\n\nNumber of people: 2\nTotal cost: (55 x 2) + (22 x 2) = 154\n\nTotal cost across all days: 887 + 1067 + 921 + 905 + 837 + 873 + 154 = 5644\nCuisines: American and Chinese cuisine preferences have been met.\nRemaining budget: $8,900 - $5,644 = $3,256\n\nNote: All costs are in USD. The accommodation costs are per night, and the meal costs are per person. The transportation costs are per vehicle. The total cost for each day includes the cost for two people. The accommodation minimum nights are calculated based on the stay required for each booking.", "gpt-4-1106-preview_direct_sole-planning_parsed_results": [{"day": 1, "current_city": "from Akron to Augusta, Georgia", "transportation": "Self-driving, from Akron to Augusta, duration: 9 hours 36 mins, distance: 1,031 km", "breakfast": "-", "attraction": "-", "lunch": "-", "dinner": "B Merrell's, Augusta, Georgia", "accommodation": "Planta Baja Studio, Augusta, Georgia"}, {"day": 2, "current_city": "Augusta, Georgia", "transportation": "-", "breakfast": "Fish Tales Lakeside Grille, Augusta, Georgia", "attraction": "Augusta Riverwalk, Augusta, Georgia;Augusta Museum of History, Augusta, Georgia;", "lunch": "The Charcoal Chimney, Augusta, Georgia", "dinner": "Nikhil Food Point, Augusta, Georgia", "accommodation": "Planta Baja Studio, Augusta, Georgia"}, {"day": 3, "current_city": "from Augusta to Decatur, Georgia", "transportation": "Self-driving, from Augusta to Decatur, duration: 2 hours 19 mins, distance: 229 km", "breakfast": "KB's Kulfi & Icecream, Augusta, Georgia", "attraction": "-", "lunch": "-", "dinner": "Joey's Pizza, Decatur, Georgia", "accommodation": "The Heart of the Lower East Side!, Decatur, Georgia"}, {"day": 4, "current_city": "Decatur, Georgia", "transportation": "-", "breakfast": "Cafe Coffee Day, Decatur, Georgia", "attraction": "DeKalb History Center Museum, Decatur, Georgia;Glenlake Park, Decatur, Georgia;", "lunch": "Dawat-E-Chaman, Decatur, Georgia", "dinner": "Carnatic Cafe, Decatur, Georgia", "accommodation": "The Heart of the Lower East Side!, Decatur, Georgia"}, {"day": 5, "current_city": "from Decatur to Atlanta, Georgia", "transportation": "Self-driving, from Decatur to Atlanta, duration: 19 mins, distance: 13.0 km", "breakfast": "Subway, Decatur, Georgia", "attraction": "Atlanta Botanical Garden, Atlanta, Georgia;Georgia Aquarium, Atlanta, Georgia;", "lunch": "Asian Bistro, Atlanta, Georgia", "dinner": "Chef Style, Atlanta, Georgia", "accommodation": "FABULOUS SUNNY BEDROOM IN HARLEM, Atlanta, Georgia"}, {"day": 6, "current_city": "Atlanta, Georgia", "transportation": "-", "breakfast": "Saffron, Atlanta, Georgia", "attraction": "World of Coca-Cola, Atlanta, Georgia;Piedmont Park, Atlanta, Georgia;", "lunch": "Pizza Central, Atlanta, Georgia", "dinner": "Daawat-e-Kashmir, Atlanta, Georgia", "accommodation": "FABULOUS SUNNY BEDROOM IN HARLEM, Atlanta, Georgia"}, {"day": 7, "current_city": "from Atlanta to Akron", "transportation": "Self-driving, from Atlanta to Akron, duration: 10 hours 10 mins, distance: 1,114 km", "breakfast": "Adda, Atlanta, Georgia", "attraction": "-", "lunch": "-", "dinner": "-", "accommodation": "-"}]}]