[{"gpt-4-1106-preview_direct_sole-planning_results": "Travel Plan:\n\nDays: 1\nCurrent City: from Los Angeles to Fort Myers, Florida\nTransportation: Flight F3895072, from Los Angeles to Fort Myers, duration: 4 hours 34 minutes, cost: 990\nBreakfast: -\nAttraction: -\nLunch: -\nDinner: The Refinery, Fort Myers, Florida, cost: 22, cuisines: Bakery, Indian, Seafood\nAccommodation: Quiet and beautiful apartment near central park, Fort Myers, Florida, cost: 930, room type: Entire home/apt, house rules: No parties & No smoking, minimum nights: 7, maximum occupancy: 9\n\nNumber of people: 1\nTotal cost: 990 (flight) + 22 (dinner) + 930 (accommodation) = 1942\nAccommodation minimum nights: 1/7\n\nDays: 2\nCurrent City: Fort Myers, Florida\nTransportation: -\nBreakfast: Al Mukhtar Bakery, Fort Myers, Florida, cost: 54, cuisines: BBQ, Tea, American, Desserts\nAttraction: Edison & Ford Winter Estates, Fort Myers, Florida; Six Mile Cypress Slough Preserve, Fort Myers, Florida\nLunch: Haunted, Fort Myers, Florida, cost: 50, cuisines: Desserts, French, Fast Food, Cafe, Seafood\nDinner: Eggers Madhouse, Fort Myers, Florida, cost: 76, cuisines: BBQ, Mediterranean, Seafood\nAccommodation: Quiet and beautiful apartment near central park, Fort Myers, Florida, cost: 930, room type: Entire home/apt, house rules: No parties & No smoking, minimum nights: 7, maximum occupancy: 9\n\nNumber of people: 1\nTotal cost: 54 (breakfast) + 50 (lunch) + 76 (dinner) + 930 (accommodation) = 1110\nAccommodation minimum nights: 2/7\n\nDays: 3\nCurrent City: from Fort Myers to Jacksonville, Florida\nTransportation: Self-driving, from Fort Myers to Jacksonville, duration: 4 hours 52 mins, distance: 510 km, cost: 25\nBreakfast: Maachh Bhaat, Fort Myers, Florida, cost: 66, cuisines: Desserts, Pizza, Fast Food, Mediterranean, Seafood\nAttraction: Jacksonville Zoo and Gardens, Jacksonville, Florida; MOSH (Museum Of Science & History), Jacksonville, Florida\nLunch: Villa Gargano, Jacksonville, Florida, cost: 51, cuisines: Tea, American, Desserts\nDinner: Pirates' House Restaurant, Jacksonville, Florida, cost: 59, cuisines: Chinese, Pizza, BBQ\nAccommodation: Huge Loft - Heart of Williamsburg, Jacksonville, Florida, cost: 518, room type: Entire home/apt, house rules: No smoking, minimum nights: 2, maximum occupancy: 4\n\nNumber of people: 1\nTotal cost: 25 (transportation) + 66 (breakfast) + 51 (lunch) + 59 (dinner) + 518 (accommodation) = 719\nAccommodation minimum nights: 1/2\n\nDays: 4\nCurrent City: Jacksonville, Florida\nTransportation: -\nBreakfast: Goose Feathers Cafe and Bakery, Jacksonville, Florida, cost: 57, cuisines: Tea, Fast Food, Italian\nAttraction: Southbank Riverwalk, Jacksonville, Florida; Kingsley Plantation, Jacksonville, Florida\nLunch: Ashoka Restaurant, Jacksonville, Florida, cost: 11, cuisines: Desserts, Mexican, Bakery, BBQ, Fast Food\nDinner: Sanjha Chulha, Jacksonville, Florida, cost: 57, cuisines: Tea, Bakery, BBQ\nAccommodation: Huge Loft - Heart of Williamsburg, Jacksonville, Florida, cost: 518, room type: Entire home/apt, house rules: No smoking, minimum nights: 2, maximum occupancy: 4\n\nNumber of people: 1\nTotal cost: 57 (breakfast) + 11 (lunch) + 57 (dinner) + 518 (accommodation) = 643\nAccommodation minimum nights: 2/2\n\nDays: 5\nCurrent City: from Jacksonville to Orlando, Florida\nTransportation: Self-driving, from Jacksonville to Orlando, duration: 2 hours 7 mins, distance: 227 km, cost: 11\nBreakfast: Touch of Spice, Jacksonville, Florida, cost: 70, cuisines: French, Bakery, Indian, Seafood\nAttraction: SeaWorld Orlando, Orlando, Florida; The Wheel at ICON Park, Orlando, Florida\nLunch: Turquoise Villa, Orlando, Florida, cost: 55, cuisines: French, Bakery, BBQ, Fast Food\nDinner: The Tandoori Times, Orlando, Florida, cost: 84, cuisines: Tea, Cafe, BBQ, Italian\nAccommodation: Private furnished bedroom in Williamsburg, Orlando, Florida, cost: 179, room type: Private room, house rules: No parties & No smoking & No children under 10, minimum nights: 5, maximum occupancy: 1\n\nNumber of people: 1\nTotal cost: 11 (transportation) + 70 (breakfast) + 55 (lunch) + 84 (dinner) + 179 (accommodation) = 399\nAccommodation minimum nights: 1/5\n\nDays: 6\nCurrent City: Orlando, Florida\nTransportation: -\nBreakfast: Crust N Cakes, Orlando, Florida, cost: 61, cuisines: Tea, Cafe, Indian, BBQ\nAttraction: Universal Orlando Resort, Orlando, Florida; Gatorland, Orlando, Florida\nLunch: Indochi Cafe & Restaurant, Orlando, Florida, cost: 72, cuisines: Pizza, French, Bakery, Fast Food, Indian, Seafood\nDinner: Bite N Sip, Orlando, Florida, cost: 76, cuisines: Chinese, Bakery, Cafe, Fast Food\nAccommodation: Private furnished bedroom in Williamsburg, Orlando, Florida, cost: 179, room type: Private room, house rules: No parties & No smoking & No children under 10, minimum nights: 5, maximum occupancy: 1\n\nNumber of people: 1\nTotal cost: 61 (breakfast) + 72 (lunch) + 76 (dinner) + 179 (accommodation) = 388\nAccommodation minimum nights: 2/5\n\nDays: 7\nCurrent City: from Orlando to Los Angeles\nTransportation: Flight F3770225, from Orlando to Los Angeles, duration: 5 hours 23 minutes, cost: 683\nBreakfast: Pure Bliss, Orlando, Florida, cost: 84, cuisines: BBQ, Bakery, Pizza, Desserts\nAttraction: -\nLunch: -\nDinner: -\nAccommodation: -\n\nNumber of people: 1\nTotal cost: 683 (flight) + 84 (breakfast) = 767\n\nTotal cost across all days: 1942 + 1110 + 719 + 643 + 399 + 388 + 767 = 5968\n\nUnfortunately, the total cost of $5,968 exceeds the specified budget of $4,700. Adjustments need to be made to the travel plan to reduce costs. This could include selecting more affordable accommodations, dining options, or adjusting transportation methods where possible.", "gpt-4-1106-preview_direct_sole-planning_parsed_results": [{"day": 1, "current_city": "from Los Angeles to Fort Myers, Florida", "transportation": "Flight Number: F3895072, from Los Angeles to Fort Myers, duration: 4 hours 34 minutes", "breakfast": "-", "attraction": "-", "lunch": "-", "dinner": "The Refinery, Fort Myers, Florida", "accommodation": "Quiet and beautiful apartment near central park, Fort Myers, Florida"}, {"day": 2, "current_city": "Fort Myers, Florida", "transportation": "-", "breakfast": "Al Mukhtar Bakery, Fort Myers, Florida", "attraction": "Edison & Ford Winter Estates, Fort Myers, Florida;Six Mile Cypress Slough Preserve, Fort Myers, Florida", "lunch": "Haunted, Fort Myers, Florida", "dinner": "Eggers Madhouse, Fort Myers, Florida", "accommodation": "Quiet and beautiful apartment near central park, Fort Myers, Florida"}, {"day": 3, "current_city": "from Fort Myers to Jacksonville, Florida", "transportation": "Self-driving, from Fort Myers to Jacksonville, duration: 4 hours 52 mins, distance: 510 km", "breakfast": "Maachh Bhaat, Fort Myers, Florida", "attraction": "Jacksonville Zoo and Gardens, Jacksonville, Florida;MOSH (Museum Of Science & History), Jacksonville, Florida", "lunch": "Villa Gargano, Jacksonville, Florida", "dinner": "Pirates' House Restaurant, Jacksonville, Florida", "accommodation": "Huge Loft - Heart of Williamsburg, Jacksonville, Florida"}, {"day": 4, "current_city": "Jacksonville, Florida", "transportation": "-", "breakfast": "Goose Feathers Cafe and Bakery, Jacksonville, Florida", "attraction": "Southbank Riverwalk, Jacksonville, Florida;Kingsley Plantation, Jacksonville, Florida", "lunch": "Ashoka Restaurant, Jacksonville, Florida", "dinner": "Sanjha Chulha, Jacksonville, Florida", "accommodation": "Huge Loft - Heart of Williamsburg, Jacksonville, Florida"}, {"day": 5, "current_city": "from Jacksonville to Orlando, Florida", "transportation": "Self-driving, from Jacksonville to Orlando, duration: 2 hours 7 mins, distance: 227 km", "breakfast": "Touch of Spice, Jacksonville, Florida", "attraction": "SeaWorld Orlando, Orlando, Florida;The Wheel at ICON Park, Orlando, Florida", "lunch": "Turquoise Villa, Orlando, Florida", "dinner": "The Tandoori Times, Orlando, Florida", "accommodation": "Private furnished bedroom in Williamsburg, Orlando, Florida"}, {"day": 6, "current_city": "Orlando, Florida", "transportation": "-", "breakfast": "Crust N Cakes, Orlando, Florida", "attraction": "Universal Orlando Resort, Orlando, Florida;Gatorland, Orlando, Florida", "lunch": "Indochi Cafe & Restaurant, Orlando, Florida", "dinner": "Bite N Sip, Orlando, Florida", "accommodation": "Private furnished bedroom in Williamsburg, Orlando, Florida"}, {"day": 7, "current_city": "from Orlando to Los Angeles", "transportation": "Flight Number: F3770225, from Orlando to Los Angeles, duration: 5 hours 23 minutes", "breakfast": "Pure Bliss, Orlando, Florida", "attraction": "-", "lunch": "-", "dinner": "-", "accommodation": "-"}]}]