[{"gpt-4-1106-preview_direct_sole-planning_results": "Travel Plan:\n\nDays: 1\nCurrent City: from Gainesville to Wilmington, North Carolina\nTransportation: Self-driving, from Gainesville to Wilmington, duration: 7 hours 29 mins, distance: 814 km, cost: 40\nBreakfast: -\nAttraction: -\nLunch: -\nDinner: Azteca, Wilmington, North Carolina, cost: 56, cuisines: Cafe, Indian, BBQ\nAccommodation: Brooklyn Bedroom - Warm & Cozy Near Subway (1), Wilmington, North Carolina, cost: 339, maximum occupancy: 1, house rules: No visitors & No children under 10, minimum nights: 2\n\nNumber of people: 1\nTotal cost: 40 x 1 + 56 x 1 + 339 x 1 = 435\nAccommodation minimum nights: 1/2\n\nDays: 2\nCurrent City: Wilmington, North Carolina\nTransportation: -\nBreakfast: Dunkin' Donuts, Wilmington, North Carolina, cost: 25, cuisines: Desserts, Tea, Pizza, Italian, French\nAttraction: Bellamy Mansion Museum, Wilmington, North Carolina; Wilmington Riverwalk, Wilmington, North Carolina\nLunch: Bandit Burrito, Wilmington, North Carolina, cost: 26, cuisines: Desserts, French, Bakery, Fast Food, Seafood\nDinner: Taco Bus, Wilmington, North Carolina, cost: 59, cuisines: Tea, Cafe, BBQ\nAccommodation: Brooklyn Bedroom - Warm & Cozy Near Subway (1), Wilmington, North Carolina, cost: 339, maximum occupancy: 1, house rules: No visitors & No children under 10, minimum nights: 2\n\nNumber of people: 1\nTotal cost: 25 x 1 + 26 x 1 + 59 x 1 + 339 x 1 = 449\nAccommodation minimum nights: 2/2\n\nDays: 3\nCurrent City: from Wilmington to Fayetteville, North Carolina\nTransportation: Self-driving, from Wilmington to Fayetteville, duration: 1 hour 43 mins, distance: 149 km, cost: 7\nBreakfast: The Yellow Chef, Wilmington, North Carolina, cost: 45, cuisines: French, BBQ, Mediterranean, Fast Food\nAttraction: Airborne & Special Operations Museum Foundation, Fayetteville, North Carolina; Cape Fear Botanical Garden, Fayetteville, North Carolina\nLunch: DiVine, Fayetteville, North Carolina, cost: 32, cuisines: Mexican, BBQ, Bakery, Cafe, Seafood\nDinner: Eat Street, Fayetteville, North Carolina, cost: 63, cuisines: Tea, French, BBQ, Seafood\nAccommodation: Brownstone Studio, Fayetteville, North Carolina, cost: 396, maximum occupancy: 3, house rules: No smoking, minimum nights: 3\n\nNumber of people: 1\nTotal cost: 7 x 1 + 45 x 1 + 32 x 1 + 63 x 1 + 396 x 1 = 543\nAccommodation minimum nights: 1/3\n\nDays: 4\nCurrent City: Fayetteville, North Carolina\nTransportation: -\nBreakfast: Pind Balluchi, Fayetteville, North Carolina, cost: 80, cuisines: Cafe, Pizza, BBQ, Fast Food\nAttraction: Fayetteville Area Transportation and Local History Museum, Fayetteville, North Carolina; Festival Park, Fayetteville, North Carolina\nLunch: Kay's Food Land, Fayetteville, North Carolina, cost: 87, cuisines: Cafe, Pizza, BBQ\nDinner: The Great Indian Pub, Fayetteville, North Carolina, cost: 95, cuisines: Fast Food, Tea, Seafood\nAccommodation: Brownstone Studio, Fayetteville, North Carolina, cost: 396, maximum occupancy: 3, house rules: No smoking, minimum nights: 3\n\nNumber of people: 1\nTotal cost: 80 x 1 + 87 x 1 + 95 x 1 + 396 x 1 = 658\nAccommodation minimum nights: 2/3\n\nDays: 5\nCurrent City: from Fayetteville to Gainesville\nTransportation: Self-driving, from Fayetteville to Gainesville, duration: 6 hours 45 mins, distance: 743 km, cost: 37\nBreakfast: Biryani By Kilo, Fayetteville, North Carolina, cost: 53, cuisines: Desserts, Pizza, American, Mediterranean, Seafood\nAttraction: -\nLunch: -\nDinner: -\nAccommodation: -\n\nNumber of people: 1\nTotal cost: 37 x 1 + 53 x 1 = 90\n\nTotal cost across all days: 435 + 449 + 543 + 658 + 90 = 2,175\nCuisines: The prompt specifies no cuisines, so all cuisine constraints are satisfied", "gpt-4-1106-preview_direct_sole-planning_parsed_results": [{"day": 1, "current_city": "from Gainesville to Wilmington, North Carolina", "transportation": "Self-driving, from Gainesville to Wilmington, duration: 7 hours 29 mins, distance: 814 km", "breakfast": "-", "attraction": "-", "lunch": "-", "dinner": "Azteca, Wilmington, North Carolina", "accommodation": "Brooklyn Bedroom - Warm & Cozy Near Subway (1), Wilmington, North Carolina"}, {"day": 2, "current_city": "Wilmington, North Carolina", "transportation": "-", "breakfast": "Dunkin' Donuts, Wilmington, North Carolina", "attraction": "Bellamy Mansion Museum, Wilmington, North Carolina;Wilmington Riverwalk, Wilmington, North Carolina;", "lunch": "Bandit Burrito, Wilmington, North Carolina", "dinner": "Taco Bus, Wilmington, North Carolina", "accommodation": "Brooklyn Bedroom - Warm & Cozy Near Subway (1), Wilmington, North Carolina"}, {"day": 3, "current_city": "from Wilmington to Fayetteville, North Carolina", "transportation": "Self-driving, from Wilmington to Fayetteville, duration: 1 hour 43 mins, distance: 149 km", "breakfast": "The Yellow Chef, Wilmington, North Carolina", "attraction": "Airborne & Special Operations Museum Foundation, Fayetteville, North Carolina;Cape Fear Botanical Garden, Fayetteville, North Carolina;", "lunch": "DiVine, Fayetteville, North Carolina", "dinner": "Eat Street, Fayetteville, North Carolina", "accommodation": "Brownstone Studio, Fayetteville, North Carolina"}, {"day": 4, "current_city": "Fayetteville, North Carolina", "transportation": "-", "breakfast": "Pind Balluchi, Fayetteville, North Carolina", "attraction": "Fayetteville Area Transportation and Local History Museum, Fayetteville, North Carolina;Festival Park, Fayetteville, North Carolina;", "lunch": "Kay's Food Land, Fayetteville, North Carolina", "dinner": "The Great Indian Pub, Fayetteville, North Carolina", "accommodation": "Brownstone Studio, Fayetteville, North Carolina"}, {"day": 5, "current_city": "from Fayetteville to Gainesville", "transportation": "Self-driving, from Fayetteville to Gainesville, duration: 6 hours 45 mins, distance: 743 km", "breakfast": "Biryani By Kilo, Fayetteville, North Carolina", "attraction": "-", "lunch": "-", "dinner": "-", "accommodation": "-"}]}]