[{"gpt-4-1106-preview_direct_sole-planning_results": "Travel Plan:\n\nDays: 1\nCurrent City: from Ithaca to Newark, New Jersey\nTransportation: Flight F3924332, from Ithaca to Newark, duration: 1 hour 42 minutes, cost: $62 per person\nBreakfast: -\nAttraction: The Newark Museum of Art, Newark, New Jersey\nLunch: Artistry, Newark, New Jersey, cost: $79, cuisines: Cafe, Pizza, Desserts, Seafood\nDinner: Angeethi Restaurant, Newark, New Jersey, cost: $12, cuisines: French, BBQ, Fast Food\nAccommodation: Gramercy One Bedroom w Two Beds, Newark, New Jersey, cost: $485, room type: Entire home/apt, house rules: No visitors & No children under 10, minimum nights: 7, maximum occupancy: 4\n\nNumber of people: 2\nTotal cost: (Flight $62 x 2) + (Lunch $79 x 2) + (Dinner $12 x 2) + Accommodation $485 = $741\nAccommodation minimum nights: 1/7\n\nDays: 2\nCurrent City: Newark, New Jersey\nTransportation: -\nBreakfast: Mirage Restro Bar, Newark, New Jersey, cost: $51, cuisines: Bakery, American, Desserts, Fast Food\nAttraction: Military Park, Newark, New Jersey; Branch Brook Park, Newark, New Jersey\nLunch: Escape Terrace Bar Kitchen, Newark, New Jersey, cost: $100, cuisines: Tea, Cafe, Bakery, Chinese, Seafood\nDinner: Bernardo's, Newark, New Jersey, cost: $84, cuisines: Desserts, Pizza, BBQ, American, Mediterranean\nAccommodation: Gramercy One Bedroom w Two Beds, Newark, New Jersey, cost: $485, room type: Entire home/apt, house rules: No visitors & No children under 10, minimum nights: 7, maximum occupancy: 4\n\nNumber of people: 2\nTotal cost: (Breakfast $51 x 2) + (Lunch $100 x 2) + (Dinner $84 x 2) + Accommodation $485 = $955\nAccommodation minimum nights: 2/7\n\nDays: 3\nCurrent City: from Newark, New Jersey to Ithaca\nTransportation: Flight F3923348, from Newark to Ithaca, duration: 1 hour 2 minutes, cost: $42 per person\nBreakfast: Harmann Restaurant, Newark, New Jersey, cost: $57, cuisines: Tea, Cafe, American, Fast Food\nAttraction: -\nLunch: -\nDinner: -\nAccommodation: -\n\nNumber of people: 2\nTotal cost: (Flight $42 x 2) + (Breakfast $57 x 2) = $198\n\nTotal cost across all days: $741 + $955 + $198 = $1,894\n\nUnfortunately, the total cost of $1,894 exceeds the specified budget of $1,200. To adhere to the budget, we need to make adjustments:\n\nAdjusted Travel Plan:\n\nDays: 1\nCurrent City: from Ithaca to Newark, New Jersey\nTransportation: Flight F3924332, from Ithaca to Newark, duration: 1 hour 42 minutes, cost: $62 per person\nBreakfast: -\nAttraction: The Newark Museum of Art, Newark, New Jersey\nLunch: Angeethi Restaurant, Newark, New Jersey, cost: $12, cuisines: French, BBQ, Fast Food\nDinner: Mirage Restro Bar, Newark, New Jersey, cost: $51, cuisines: Bakery, American, Desserts, Fast Food\nAccommodation: Rustic Modern Brooklyn Apartment, Newark, New Jersey, cost: $294, room type: Entire home/apt, house rules: No pets, minimum nights: 30, maximum occupancy: 2\n\nNumber of people: 2\nTotal cost: (Flight $62 x 2) + (Lunch $12 x 2) + (Dinner $51 x 2) + Accommodation $294 = $544\nAccommodation minimum nights: 1/30\n\nDays: 2\nCurrent City: Newark, New Jersey\nTransportation: -\nBreakfast: Drifters Cafe, Newark, New Jersey, cost: $24, cuisines: Tea, BBQ\nAttraction: Branch Brook Park, Newark, New Jersey\nLunch: Jaguar, Newark, New Jersey, cost: $38, cuisines: French, Bakery, Seafood\nDinner: Bernardo's, Newark, New Jersey, cost: $84, cuisines: Desserts, Pizza, BBQ, American, Mediterranean\nAccommodation: Rustic Modern Brooklyn Apartment, Newark, New Jersey, cost: $294, room type: Entire home/apt, house rules: No pets, minimum nights: 30, maximum occupancy: 2\n\nNumber of people: 2\nTotal cost: (Breakfast $24 x 2) + (Lunch $38 x 2) + (Dinner $84 x 2) + Accommodation $294 = $586\nAccommodation minimum nights: 2/30\n\nDays: 3\nCurrent City: from Newark, New Jersey to Ithaca\nTransportation: Flight F3923348, from Newark to Ithaca, duration: 1 hour 2 minutes, cost: $42 per person\nBreakfast: New Garden Hut, Newark, New Jersey, cost: $12, cuisines: Tea, Cafe, Pizza, Fast Food\nAttraction: -\nLunch: -\nDinner: -\nAccommodation: -\n\nNumber of people: 2\nTotal cost: (Flight $42 x 2) + (Breakfast $12 x 2) = $108\n\nTotal cost across all days: $544 + $586 + $108 = $1,238\n\nThe adjusted plan still slightly exceeds the budget by $38. To fit within the budget, we can opt for a less expensive dinner on Day 2:\n\nAdjusted Dinner on Day 2:\nDinner: Tunday Kababi, Newark, New Jersey, cost: $10, cuisines: Tea, Bakery, American, Indian\n\nNew total for Day 2: (Breakfast $24 x 2) + (Lunch $38 x 2) + (Dinner $10 x 2) + Accommodation $294 = $532\n\nNew total cost across all days: $544 + $532 + $108 = $1,184\n\nThe adjusted travel plan now fits within the budget of $1,200.", "gpt-4-1106-preview_direct_sole-planning_parsed_results": [{"day": 1, "current_city": "from Ithaca to Newark, New Jersey", "transportation": "Flight Number: F3924332, from Ithaca to Newark, Departure Time: -, Arrival Time: -", "breakfast": "-", "attraction": "The Newark Museum of Art, Newark, New Jersey;", "lunch": "Artistry, Newark, New Jersey", "dinner": "Angeethi Restaurant, Newark, New Jersey", "accommodation": "Gramercy One Bedroom w Two Beds, Newark, New Jersey"}, {"day": 2, "current_city": "Newark, New Jersey", "transportation": "-", "breakfast": "Mirage Restro Bar, Newark, New Jersey", "attraction": "Military Park, Newark, New Jersey;Branch Brook Park, Newark, New Jersey;", "lunch": "Escape Terrace Bar Kitchen, Newark, New Jersey", "dinner": "Bernardo's, Newark, New Jersey", "accommodation": "Gramercy One Bedroom w Two Beds, Newark, New Jersey"}, {"day": 3, "current_city": "from Newark, New Jersey to Ithaca", "transportation": "Flight Number: F3923348, from Newark to Ithaca, Departure Time: -, Arrival Time: -", "breakfast": "Harmann Restaurant, Newark, New Jersey", "attraction": "-", "lunch": "-", "dinner": "-", "accommodation": "-"}, {"day": 1, "current_city": "from Ithaca to Newark, New Jersey", "transportation": "Flight Number: F3924332, from Ithaca to Newark, Departure Time: -, Arrival Time: -", "breakfast": "-", "attraction": "The Newark Museum of Art, Newark, New Jersey", "lunch": "Angeethi Restaurant, Newark, New Jersey", "dinner": "Mirage Restro Bar, Newark, New Jersey", "accommodation": "Rustic Modern Brooklyn Apartment, Newark, New Jersey"}, {"day": 2, "current_city": "Newark, New Jersey", "transportation": "-", "breakfast": "Drifters Cafe, Newark, New Jersey", "attraction": "Branch Brook Park, Newark, New Jersey", "lunch": "Jaguar, Newark, New Jersey", "dinner": "Tunday Kababi, Newark, New Jersey", "accommodation": "Rustic Modern Brooklyn Apartment, Newark, New Jersey"}, {"day": 3, "current_city": "from Newark, New Jersey to Ithaca", "transportation": "Flight Number: F3923348, from Newark to Ithaca, Departure Time: -, Arrival Time: -", "breakfast": "New Garden Hut, Newark, New Jersey", "attraction": "-", "lunch": "-", "dinner": "-", "accommodation": "-"}]}]