[{"gpt-4-1106-preview_direct_sole-planning_results": "Travel Plan:\n\nDays: 1\nCurrent City: from Los Angeles to Detroit\nTransportation: Flight F3496477, from Los Angeles to Detroit, departure: 15:30, arrival: 22:51, duration: 4 hours 21 minutes, cost: $411 per person\nBreakfast: -\nAttraction: -\nLunch: -\nDinner: A Dong Restaurant, Detroit, cuisines: Tea, Cafe, Pizza, cost: $40 per person\nAccommodation: Brooklyn Brownstone, 3-Bdr & Garden, Detroit, cost: $400, room type: Entire home/apt, house rules: No children under 10, minimum nights: 3, maximum occupancy: 2\n\nNumber of people: 2\nTotal cost: (411 x 2) + (40 x 2) + 400 = $1,302\nAccommodation minimum nights: 1/3\n\nDays: 2\nCurrent City: Detroit\nTransportation: -\nBreakfast: Southern Bliss Bakery, Detroit, cuisines: Tea, BBQ, Desserts, Seafood, cost: $28 per person\nAttraction: Detroit Institute of Arts, Detroit; Detroit Historical Museum, Detroit\nLunch: Mitalis Kitchen, Detroit, cuisines: Pizza, BBQ, Chinese, Mediterranean, Seafood, cost: $28 per person\nDinner: Zabardast Indian Kitchen, Detroit, cuisines: Bakery, Desserts, Seafood, cost: $76 per person\nAccommodation: Brooklyn Brownstone, 3-Bdr & Garden, Detroit, cost: $400, room type: Entire home/apt, house rules: No children under 10, minimum nights: 3, maximum occupancy: 2\n\nNumber of people: 2\nTotal cost: (28 x 2) + (28 x 2) + (76 x 2) + 400 = $656\nAccommodation minimum nights: 2/3\n\nDays: 3\nCurrent City: Detroit to Los Angeles\nTransportation: Flight F3538108, from Detroit to Los Angeles, departure: 19:15, arrival: 21:16, duration: 5 hours 1 minute, cost: $446 per person\nBreakfast: BMG - All Day Dining, Detroit, cuisines: Desserts, Bakery, BBQ, Indian, Seafood, cost: $15 per person\nAttraction: Michigan Science Center, Detroit; Belle Isle Aquarium, Detroit\nLunch: Old Kheer Shop, Detroit, cuisines: Mexican, Indian, Desserts, Fast Food, cost: $54 per person\nDinner: -\nAccommodation: -\n\nNumber of people: 2\nTotal cost: (15 x 2) + (54 x 2) + (446 x 2) = $1,030\n\nTotal cost across all days: $1,302 + $656 + $1,030 = $2,988\n\nUnfortunately, the total cost of the proposed travel plan exceeds the specified budget of $2,000. Adjustments need to be made to ensure the total cost does not exceed the budget. Here is a revised plan that fits within the budget:\n\nRevised Travel Plan:\n\nDays: 1\nCurrent City: from Los Angeles to Detroit\nTransportation: Flight F3548634, from Los Angeles to Detroit, departure: 07:08, arrival: 14:11, duration: 4 hours 3 minutes, cost: $632 per person\nBreakfast: -\nAttraction: -\nLunch: -\nDinner: A Dong Restaurant, Detroit, cuisines: Tea, Cafe, Pizza, cost: $40 per person\nAccommodation: Nice Room in Manhattan, Detroit, cost: $300, room type: Private room, house rules: No visitors, minimum nights: 1, maximum occupancy: 1\n\nNumber of people: 2\nTotal cost: (632 x 2) + (40 x 2) + 300 = $1,644\nAccommodation minimum nights: 1/1\n\nDays: 2\nCurrent City: Detroit\nTransportation: -\nBreakfast: Southern Bliss Bakery, Detroit, cuisines: Tea, BBQ, Desserts, Seafood, cost: $28 per person\nAttraction: Detroit Institute of Arts, Detroit; Detroit Historical Museum, Detroit\nLunch: Mitalis Kitchen, Detroit, cuisines: Pizza, BBQ, Chinese, Mediterranean, Seafood, cost: $28 per person\nDinner: Zabardast Indian Kitchen, Detroit, cuisines: Bakery, Desserts, Seafood, cost: $76 per person\nAccommodation: Nice Room in Manhattan, Detroit, cost: $300, room type: Private room, house rules: No visitors, minimum nights: 1, maximum occupancy: 1\n\nNumber of people: 2\nTotal cost: (28 x 2) + (28 x 2) + (76 x 2) + 300 = $556\nAccommodation minimum nights: 2/1\n\nDays: 3\nCurrent City: Detroit to Los Angeles\nTransportation: Flight F3545846, from Detroit to Los Angeles, departure: 13:31, arrival: 15:14, duration: 4 hours 43 minutes, cost: $399 per person\nBreakfast: BMG - All Day Dining, Detroit, cuisines: Desserts, Bakery, BBQ, Indian, Seafood, cost: $15 per person\nAttraction: -\nLunch: -\nDinner: -\nAccommodation: -\n\nNumber of people: 2\nTotal cost: (15 x 2) + (399 x 2) = $828\n\nTotal cost across all days: $1,644 + $556 + $828 = $3,028\n\nThe revised plan still exceeds the budget. To fit within the $2,000 budget, we may need to choose a less expensive flight, reduce meal costs, or find more affordable accommodation. Please note that the availability of flights and accommodations may vary, and prices are subject to change.", "gpt-4-1106-preview_direct_sole-planning_parsed_results": [{"day": 1, "current_city": "from Los Angeles to Detroit", "transportation": "Flight Number: F3548634, from Los Angeles to Detroit, Departure Time: 07:08, Arrival Time: 14:11", "breakfast": "-", "attraction": "-", "lunch": "-", "dinner": "A Dong Restaurant, Detroit", "accommodation": "Nice Room in Manhattan, Detroit"}, {"day": 2, "current_city": "Detroit", "transportation": "-", "breakfast": "Southern Bliss Bakery, Detroit", "attraction": "Detroit Institute of Arts, Detroit;Detroit Historical Museum, Detroit;", "lunch": "Mitalis Kitchen, Detroit", "dinner": "Zabardast Indian Kitchen, Detroit", "accommodation": "Nice Room in Manhattan, Detroit"}, {"day": 3, "current_city": "from Detroit to Los Angeles", "transportation": "Flight Number: F3545846, from Detroit to Los Angeles, Departure Time: 13:31, Arrival Time: 15:14", "breakfast": "BMG - All Day Dining, Detroit", "attraction": "-", "lunch": "-", "dinner": "-", "accommodation": "-"}]}]