[{"gpt-4-1106-preview_direct_sole-planning_results": "Travel Plan:\n\nDays: 1\nCurrent City: from Philadelphia to Richmond, Virginia\nTransportation: Self-driving, from Philadelphia to Richmond, duration: 4 hours 2 mins, distance: 407 km, cost: 20\nBreakfast: -\nAttraction: -\nLunch: -\nDinner: Guang Zhou Chinese Restaurant, Richmond, Virginia, cost: 84, cuisines: Desserts, Tea, Cafe, Fast Food, Chinese, Indian\nAccommodation: Cool Summer Vibes UWS Pent House w/ rooftop, Richmond, Virginia, cost: 498, room type: Entire home/apt, house rules: No pets & No parties, minimum nights: 3, maximum occupancy: 2\n\nNumber of people: 1\nTotal cost: 20 x 1 + 84 x 1 + 498 x 1 = 602\nAccommodation minimum nights: 1/3\n\nDays: 2\nCurrent City: Richmond, Virginia\nTransportation: -\nBreakfast: Sandpiper Restaurant & Lounge, Richmond, Virginia, cost: 20, cuisines: Tea, Cafe, Desserts, Seafood\nAttraction: Virginia Museum of Fine Arts, Richmond, Virginia; Maymont, Richmond, Virginia\nLunch: Paradise, Richmond, Virginia, cost: 80, cuisines: Tea, Pizza, Italian, Fast Food, Seafood\nDinner: Welcome, Richmond, Virginia, cost: 86, cuisines: Tea, French, Bakery, Indian\nAccommodation: Cool Summer Vibes UWS Pent House w/ rooftop, Richmond, Virginia, cost: 498, room type: Entire home/apt, house rules: No pets & No parties, minimum nights: 3, maximum occupancy: 2\n\nNumber of people: 1\nTotal cost: 20 x 1 + 80 x 1 + 86 x 1 + 498 x 1 = 684\nAccommodation minimum nights: 2/3\n\nDays: 3\nCurrent City: from Richmond to Jamestown, Virginia\nTransportation: Self-driving, from Richmond to Jamestown, duration: 1 hour 1 min, distance: 92.4 km, cost: 4\nBreakfast: Perfect Bake, Richmond, Virginia, cost: 33, cuisines: Desserts, Tea, Italian, Bakery, Cafe, American\nAttraction: Historic Jamestowne, Jamestown, Virginia; Jamestown Settlement, Jamestown, Virginia\nLunch: Cafe Soul Garden, Jamestown, Virginia, cost: 99, cuisines: Desserts, Bakery, Cafe, American, Seafood\nDinner: Chauhan Hotel, Jamestown, Virginia, cost: 13, cuisines: Desserts, Mexican, BBQ, Bakery, Cafe\nAccommodation: COZY APT CLOSE TO LGA & JFK AND TRANSPORTATION, Jamestown, Virginia, cost: 652, room type: Entire home/apt, house rules: No children under 10, minimum nights: 2, maximum occupancy: 2\n\nNumber of people: 1\nTotal cost: 4 x 1 + 33 x 1 + 99 x 1 + 13 x 1 + 652 x 1 = 801\nAccommodation minimum nights: 1/2\n\nDays: 4\nCurrent City: Jamestown, Virginia\nTransportation: -\nBreakfast: Beyond Breads, Jamestown, Virginia, cost: 95, cuisines: French, Cafe, Fast Food\nAttraction: Archaearium Archaeology Museum, Jamestown, Virginia; Jamestown Glasshouse, Jamestown, Virginia\nLunch: Mughlai Flavours, Jamestown, Virginia, cost: 12, cuisines: Pizza, French, Bakery, BBQ, Cafe\nDinner: Janaab, Jamestown, Virginia, cost: 38, cuisines: Pizza, Fast Food, Cafe, Indian, Seafood\nAccommodation: COZY APT CLOSE TO LGA & JFK AND TRANSPORTATION, Jamestown, Virginia, cost: 652, room type: Entire home/apt, house rules: No children under 10, minimum nights: 2, maximum occupancy: 2\n\nNumber of people: 1\nTotal cost: 95 x 1 + 12 x 1 + 38 x 1 + 652 x 1 = 797\nAccommodation minimum nights: 2/2\n\nDays: 5\nCurrent City: from Jamestown to Charlottesville, Virginia\nTransportation: Self-driving, from Jamestown to Charlottesville, duration: 2 hours 2 mins, distance: 206 km, cost: 10\nBreakfast: The Food Junction, Jamestown, Virginia, cost: 78, cuisines: Tea, Indian, Fast Food\nAttraction: Monticello, Charlottesville, Virginia; Virginia Discovery Museum, Charlottesville, Virginia\nLunch: Restaurant Andre, Charlottesville, Virginia, cost: 250, cuisines: Desserts, Tea, BBQ, Fast Food, Chinese\nDinner: Takamaka, Charlottesville, Virginia, cost: 72, cuisines: Tea, Pizza, Italian, BBQ, Fast Food\nAccommodation: Gorgeous natural light in Chelsea photo studio, Charlottesville, Virginia, cost: 1094, room type: Entire home/apt, house rules: No pets, minimum nights: 1, maximum occupancy: 8\n\nNumber of people: 1\nTotal cost: 10 x 1 + 78 x 1 + 250 x 1 + 72 x 1 + 1094 x 1 = 1504\nAccommodation minimum nights: 1/1\n\nDays: 6\nCurrent City: Charlottesville, Virginia\nTransportation: -\nBreakfast: Mama's Fish House, Charlottesville, Virginia, cost: 63, cuisines: Tea, Pizza, Desserts, Fast Food\nAttraction: The Fralin Museum of Art at the University of Virginia, Charlottesville, Virginia; Ix Art Park, Charlottesville, Virginia\nLunch: Sandys Cocktails & Kitchen, Charlottesville, Virginia, cost: 82, cuisines: Tea, Pizza, BBQ, Indian, Seafood\nDinner: Dawat-e-Ishq, Charlottesville, Virginia, cost: 26, cuisines: Desserts, Tea, Italian, BBQ, Fast Food\nAccommodation: Gorgeous natural light in Chelsea photo studio, Charlottesville, Virginia, cost: 1094, room type: Entire home/apt, house rules: No pets, minimum nights: 1, maximum occupancy: 8\n\nNumber of people: 1\nTotal cost: 63 x 1 + 82 x 1 + 26 x 1 + 1094 x 1 = 1265\nAccommodation minimum nights: 2/1\n\nDays: 7\nCurrent City: from Charlottesville to Philadelphia\nTransportation: Self-driving, from Charlottesville to Philadelphia, duration: 4 hours 24 mins, distance: 411 km, cost: 20\nBreakfast: Firefly, Charlottesville, Virginia, cost: 30, cuisines: Pizza, Bakery\nAttraction: -\nLunch: -\nDinner: -\nAccommodation: -\n\nNumber of people: 1\nTotal cost: 20 x 1 + 30 x 1 = 50\n\nTotal cost across all days: 602 + 684 + 801 + 797 + 1504 + 1265 + 50 = 5703\n\nNote: The total cost exceeds the specified budget of $2,900. Adjustments to the plan, such as changing accommodations or dining options, are required to meet the budget constraint.", "gpt-4-1106-preview_direct_sole-planning_parsed_results": [{"day": 1, "current_city": "from Philadelphia to Richmond, Virginia", "transportation": "Self-driving, from Philadelphia to Richmond, duration: 4 hours 2 mins, distance: 407 km", "breakfast": "-", "attraction": "-", "lunch": "-", "dinner": "Guang Zhou Chinese Restaurant, Richmond, Virginia", "accommodation": "Cool Summer Vibes UWS Pent House w/ rooftop, Richmond, Virginia"}, {"day": 2, "current_city": "Richmond, Virginia", "transportation": "-", "breakfast": "Sandpiper Restaurant & Lounge, Richmond, Virginia", "attraction": "Virginia Museum of Fine Arts, Richmond, Virginia;Maymont, Richmond, Virginia;", "lunch": "Paradise, Richmond, Virginia", "dinner": "Welcome, Richmond, Virginia", "accommodation": "Cool Summer Vibes UWS Pent House w/ rooftop, Richmond, Virginia"}, {"day": 3, "current_city": "from Richmond to Jamestown, Virginia", "transportation": "Self-driving, from Richmond to Jamestown, duration: 1 hour 1 min, distance: 92.4 km", "breakfast": "Perfect Bake, Richmond, Virginia", "attraction": "Historic Jamestowne, Jamestown, Virginia;Jamestown Settlement, Jamestown, Virginia;", "lunch": "Cafe Soul Garden, Jamestown, Virginia", "dinner": "Chauhan Hotel, Jamestown, Virginia", "accommodation": "COZY APT CLOSE TO LGA & JFK AND TRANSPORTATION, Jamestown, Virginia"}, {"day": 4, "current_city": "Jamestown, Virginia", "transportation": "-", "breakfast": "Beyond Breads, Jamestown, Virginia", "attraction": "Archaearium Archaeology Museum, Jamestown, Virginia;Jamestown Glasshouse, Jamestown, Virginia;", "lunch": "Mughlai Flavours, Jamestown, Virginia", "dinner": "Janaab, Jamestown, Virginia", "accommodation": "COZY APT CLOSE TO LGA & JFK AND TRANSPORTATION, Jamestown, Virginia"}, {"day": 5, "current_city": "from Jamestown to Charlottesville, Virginia", "transportation": "Self-driving, from Jamestown to Charlottesville, duration: 2 hours 2 mins, distance: 206 km", "breakfast": "The Food Junction, Jamestown, Virginia", "attraction": "Monticello, Charlottesville, Virginia;Virginia Discovery Museum, Charlottesville, Virginia;", "lunch": "Restaurant Andre, Charlottesville, Virginia", "dinner": "Takamaka, Charlottesville, Virginia", "accommodation": "Gorgeous natural light in Chelsea photo studio, Charlottesville, Virginia"}, {"day": 6, "current_city": "Charlottesville, Virginia", "transportation": "-", "breakfast": "Mama's Fish House, Charlottesville, Virginia", "attraction": "The Fralin Museum of Art at the University of Virginia, Charlottesville, Virginia;Ix Art Park, Charlottesville, Virginia;", "lunch": "Sandys Cocktails & Kitchen, Charlottesville, Virginia", "dinner": "Dawat-e-Ishq, Charlottesville, Virginia", "accommodation": "Gorgeous natural light in Chelsea photo studio, Charlottesville, Virginia"}, {"day": 7, "current_city": "from Charlottesville to Philadelphia", "transportation": "Self-driving, from Charlottesville to Philadelphia, duration: 4 hours 24 mins, distance: 411 km", "breakfast": "Firefly, Charlottesville, Virginia", "attraction": "-", "lunch": "-", "dinner": "-", "accommodation": "-"}]}]