[{"gpt-4-1106-preview_direct_sole-planning_results": "Travel Plan:\n\nDays: 1\nCurrent City: from Latrobe to Myrtle Beach, South Carolina\nTransportation: Flight F3615674, from Latrobe to Myrtle Beach, duration: 1 hour 13 minutes, cost: 116\nBreakfast: -\nAttraction: -\nLunch: -\nDinner: Exotic India, Myrtle Beach, South Carolina, cost: 81, cuisines: Indian, BBQ, Fast Food\nAccommodation: Cozy Brooklyn Room - Next to Pratt Institute, Myrtle Beach, South Carolina, cost: 418, room type: Private room, house rules: No smoking & No children under 10 & No pets, maximum occupancy: 2\n\nNumber of people: 1\nTotal cost: 116 x 1 + 81 x 1 + 418 x 1 = 615\nAccommodation minimum nights: 1/5\n\nDays: 2\nCurrent City: Myrtle Beach, South Carolina\nTransportation: -\nBreakfast: Catfish Charlie's, Myrtle Beach, South Carolina, cost: 14, cuisines: Tea, Chinese, Desserts\nAttraction: SkyWheel Myrtle Beach; Broadway at the Beach\nLunch: d' Curry House, Myrtle Beach, South Carolina, cost: 33, cuisines: Tea, Chinese, Desserts, Fast Food\nDinner: Twigly, Myrtle Beach, South Carolina, cost: 55, cuisines: Tea, Bakery, Mediterranean, Seafood\nAccommodation: Cozy Brooklyn Room - Next to Pratt Institute, Myrtle Beach, South Carolina, cost: 418, room type: Private room, house rules: No smoking & No children under 10 & No pets, maximum occupancy: 2\n\nNumber of people: 1\nTotal cost: 14 x 1 + 33 x 1 + 55 x 1 + 418 x 1 = 520\nAccommodation minimum nights: 2/5\n\nDays: 3\nCurrent City: from Myrtle Beach to Greenville, South Carolina\nTransportation: Self-driving, from Myrtle Beach to Greenville, duration: 4 hours 4 mins, distance: 405 km, cost: 20\nBreakfast: First Eat, Myrtle Beach, South Carolina, cost: 21, cuisines: Tea, Mexican, Fast Food\nAttraction: Falls Park on the Reedy; Greenville Zoo\nLunch: Bhoj Restaurant, Greenville, South Carolina, cost: 71, cuisines: Tea, Chinese, Pizza\nDinner: Italiano, Greenville, South Carolina, cost: 95, cuisines: Chinese, French, Pizza, Cafe\nAccommodation: HUGE bedroom available in artsy Bushwick, Greenville, South Carolina, cost: 696, room type: Private room, house rules: No parties & No children under 10, maximum occupancy: 1\n\nNumber of people: 1\nTotal cost: 20 x 1 + 21 x 1 + 71 x 1 + 95 x 1 + 696 x 1 = 903\nAccommodation minimum nights: 1/1\n\nDays: 4\nCurrent City: Greenville, South Carolina\nTransportation: -\nBreakfast: Al Bake, Greenville, South Carolina, cost: 90, cuisines: Tea, Cafe, Pizza, Seafood\nAttraction: The Children\u2019s Museum of the Upstate; Greenville County Museum of Art\nLunch: Indigo Delicatessen, Greenville, South Carolina, cost: 15, cuisines: Chinese, BBQ, Seafood\nDinner: Sapra Pastry Treat, Greenville, South Carolina, cost: 65, cuisines: Cafe, Pizza, Indian\nAccommodation: HUGE bedroom available in artsy Bushwick, Greenville, South Carolina, cost: 696, room type: Private room, house rules: No parties & No children under 10, maximum occupancy: 1\n\nNumber of people: 1\nTotal cost: 90 x 1 + 15 x 1 + 65 x 1 + 696 x 1 = 866\nAccommodation minimum nights: 2/1\n\nDays: 5\nCurrent City: from Greenville to Latrobe\nTransportation: Self-driving, from Greenville to Latrobe, duration: 8 hours 34 mins, distance: 858 km, cost: 42\nBreakfast: Mughlai Treat, Greenville, South Carolina, cost: 85, cuisines: BBQ, Cafe, American, Desserts\nAttraction: -\nLunch: -\nDinner: -\nAccommodation: -\n\nNumber of people: 1\nTotal cost: 42 x 1 + 85 x 1 = 127\n\nTotal cost across all days: 615 + 520 + 903 + 866 + 127 = 3,031\n\nCuisines: The prompt specifies no cuisines, so all cuisine constraints are satisfied", "gpt-4-1106-preview_direct_sole-planning_parsed_results": [{"day": 1, "current_city": "from Latrobe to Myrtle Beach, South Carolina", "transportation": "Flight Number: F3615674, from Latrobe to Myrtle Beach, Departure Time: -, Arrival Time: -", "breakfast": "-", "attraction": "-", "lunch": "-", "dinner": "Exotic India, Myrtle Beach, South Carolina", "accommodation": "Cozy Brooklyn Room - Next to Pratt Institute, Myrtle Beach, South Carolina"}, {"day": 2, "current_city": "Myrtle Beach, South Carolina", "transportation": "-", "breakfast": "Catfish Charlie's, Myrtle Beach, South Carolina", "attraction": "SkyWheel Myrtle Beach, Myrtle Beach, South Carolina;Broadway at the Beach, Myrtle Beach, South Carolina;", "lunch": "d' Curry House, Myrtle Beach, South Carolina", "dinner": "Twigly, Myrtle Beach, South Carolina", "accommodation": "Cozy Brooklyn Room - Next to Pratt Institute, Myrtle Beach, South Carolina"}, {"day": 3, "current_city": "from Myrtle Beach to Greenville, South Carolina", "transportation": "Self-driving, from Myrtle Beach to Greenville, Departure Time: -, Arrival Time: -", "breakfast": "First Eat, Myrtle Beach, South Carolina", "attraction": "Falls Park on the Reedy, Greenville, South Carolina;Greenville Zoo, Greenville, South Carolina;", "lunch": "Bhoj Restaurant, Greenville, South Carolina", "dinner": "Italiano, Greenville, South Carolina", "accommodation": "HUGE bedroom available in artsy Bushwick, Greenville, South Carolina"}, {"day": 4, "current_city": "Greenville, South Carolina", "transportation": "-", "breakfast": "Al Bake, Greenville, South Carolina", "attraction": "The Children\u2019s Museum of the Upstate, Greenville, South Carolina;Greenville County Museum of Art, Greenville, South Carolina;", "lunch": "Indigo Delicatessen, Greenville, South Carolina", "dinner": "Sapra Pastry Treat, Greenville, South Carolina", "accommodation": "HUGE bedroom available in artsy Bushwick, Greenville, South Carolina"}, {"day": 5, "current_city": "from Greenville to Latrobe", "transportation": "Self-driving, from Greenville to Latrobe, Departure Time: -, Arrival Time: -", "breakfast": "Mughlai Treat, Greenville, South Carolina", "attraction": "-", "lunch": "-", "dinner": "-", "accommodation": "-"}]}]