[{"gpt-4-1106-preview_direct_sole-planning_results": "Travel Plan:\n\nDays: 1\nCurrent City: from New Orleans to Miami, Florida\nTransportation: Flight F3660109, from New Orleans to Miami, duration: 2 hours 19 minutes, cost: 188 x 3 = 564\nBreakfast: -\nAttraction: -\nLunch: -\nDinner: Tako Cheena by Pom Pom, Miami, Florida, cost: 60 x 3 = 180, cuisines: Fast Food, Indian, Desserts, Italian\nAccommodation: \"HELLO BROOKLYN\" PARK SIDE VIEW NEWLY RENO APT., Miami, Florida, cost: 789 x 1 = 789, maximum occupancy: 6, house rules: No parties & No visitors, minimum nights: 1\n\nNumber of people: 3\nTotal cost: 564 + 180 + 789 = 1533\nAccommodation minimum nights: 1/1\n\nDays: 2\nCurrent City: Miami, Florida\nTransportation: -\nBreakfast: Papouli's Mediterranean Cafe & Market, Miami, Florida, cost: 26 x 3 = 78, cuisines: Tea, Desserts\nAttraction: Jungle Island; P\u00e9rez Art Museum Miami\nLunch: AB's Absolute Barbecues, Miami, Florida, cost: 55 x 3 = 165, cuisines: Desserts, Tea, Pizza, Italian, Fast Food, American\nDinner: Anjlika, Miami, Florida, cost: 56 x 3 = 168, cuisines: Pizza, Italian, Fast Food, Cafe, Mediterranean, Seafood\nAccommodation: \"HELLO BROOKLYN\" PARK SIDE VIEW NEWLY RENO APT., Miami, Florida, cost: 789 x 1 = 789, maximum occupancy: 6, house rules: No parties & No visitors, minimum nights: 1\n\nNumber of people: 3\nTotal cost: 78 + 165 + 168 + 789 = 1200\nAccommodation minimum nights: 2/1\n\nDays: 3\nCurrent City: from Miami to Tampa, Florida\nTransportation: Flight F3670101, from Miami to Tampa, duration: 0 hours 54 minutes, cost: 56 x 3 = 168\nBreakfast: Cafe 17, Miami, Florida, cost: 45 x 3 = 135, cuisines: Tea, BBQ, Bakery, Desserts\nAttraction: The Florida Aquarium; Busch Gardens Tampa Bay\nLunch: Kobe Hibachi & Sushi, Tampa, Florida, cost: 63 x 3 = 189, cuisines: Desserts, French, BBQ, Bakery, Seafood\nDinner: The Tin Cow, Tampa, Florida, cost: 67 x 3 = 201, cuisines: BBQ, Desserts, Seafood\nAccommodation: Spacious 1+ bedroom apt in NYC, Tampa, Florida, cost: 547 x 1 = 547, maximum occupancy: 2, house rules: No smoking & No parties & No children under 10, minimum nights: 1\n\nNumber of people: 3\nTotal cost: 168 + 135 + 189 + 201 + 547 = 1240\nAccommodation minimum nights: 1/1\n\nDays: 4\nCurrent City: Tampa, Florida\nTransportation: -\nBreakfast: Lalit Kathi Rolls Momos, Tampa, Florida, cost: 23 x 3 = 69, cuisines: Tea, Pizza, Fast Food\nAttraction: Adventure Island; Henry B. Plant Museum\nLunch: Uptown Fresh Beer Cafe, Tampa, Florida, cost: 61 x 3 = 183, cuisines: Pizza, Mexican, BBQ, Cafe, Seafood\nDinner: Peg Leg Pete's, Tampa, Florida, cost: 91 x 3 = 273, cuisines: French, Bakery, Cafe\nAccommodation: Spacious 1+ bedroom apt in NYC, Tampa, Florida, cost: 547 x 1 = 547, maximum occupancy: 2, house rules: No smoking & No parties & No children under 10, minimum nights: 1\n\nNumber of people: 3\nTotal cost: 69 + 183 + 273 + 547 = 1072\nAccommodation minimum nights: 2/1\n\nDays: 5\nCurrent City: from Tampa to New Orleans\nTransportation: Flight F4007107, from Tampa to New Orleans, duration: 1 hours 32 minutes, cost: 124 x 3 = 372\nBreakfast: Gallery Caf\u6106 - Hyatt Place, Tampa, Florida, cost: 42 x 3 = 126, cuisines: Tea, French, BBQ, Desserts\nAttraction: -\nLunch: -\nDinner: -\nAccommodation: -\n\nNumber of people: 3\nTotal cost: 372 + 126 = 498\n\nTotal cost across all days: 1533 + 1200 + 1240 + 1072 + 498 = 5543\n\nUnfortunately, the total cost exceeds the specified budget of $4,200. To adjust the plan within the budget, we can consider the following changes:\n\n- Opt for a less expensive accommodation in Miami and Tampa.\n- Choose more budget-friendly restaurants for meals.\n- Consider self-driving instead of flights for transportation between cities, if within the time constraints of the trip.\n\nPlease let me know if you would like me to rework the plan with these adjustments to fit within the budget.", "gpt-4-1106-preview_direct_sole-planning_parsed_results": [{"day": 1, "current_city": "from New Orleans to Miami, Florida", "transportation": "Flight Number: F3660109, from New Orleans to Miami, Florida, Departure Time: -, Arrival Time: -", "breakfast": "-", "attraction": "-", "lunch": "-", "dinner": "Tako Cheena by Pom Pom, Miami, Florida", "accommodation": "\"HELLO BROOKLYN\" PARK SIDE VIEW NEWLY RENO APT., Miami, Florida"}, {"day": 2, "current_city": "Miami, Florida", "transportation": "-", "breakfast": "Papouli's Mediterranean Cafe & Market, Miami, Florida", "attraction": "Jungle Island, Miami, Florida;P\u00e9rez Art Museum Miami, Miami, Florida;", "lunch": "AB's Absolute Barbecues, Miami, Florida", "dinner": "Anjlika, Miami, Florida", "accommodation": "\"HELLO BROOKLYN\" PARK SIDE VIEW NEWLY RENO APT., Miami, Florida"}, {"day": 3, "current_city": "from Miami to Tampa, Florida", "transportation": "Flight Number: F3670101, from Miami to Tampa, Florida, Departure Time: -, Arrival Time: -", "breakfast": "Cafe 17, Miami, Florida", "attraction": "The Florida Aquarium, Tampa, Florida;Busch Gardens Tampa Bay, Tampa, Florida;", "lunch": "Kobe Hibachi & Sushi, Tampa, Florida", "dinner": "The Tin Cow, Tampa, Florida", "accommodation": "Spacious 1+ bedroom apt in NYC, Tampa, Florida"}, {"day": 4, "current_city": "Tampa, Florida", "transportation": "-", "breakfast": "Lalit Kathi Rolls Momos, Tampa, Florida", "attraction": "Adventure Island, Tampa, Florida;Henry B. Plant Museum, Tampa, Florida;", "lunch": "Uptown Fresh Beer Cafe, Tampa, Florida", "dinner": "Peg Leg Pete's, Tampa, Florida", "accommodation": "Spacious 1+ bedroom apt in NYC, Tampa, Florida"}, {"day": 5, "current_city": "from Tampa to New Orleans", "transportation": "Flight Number: F4007107, from Tampa to New Orleans, Departure Time: -, Arrival Time: -", "breakfast": "Gallery Caf\u00e9 - Hyatt Place, Tampa, Florida", "attraction": "-", "lunch": "-", "dinner": "-", "accommodation": "-"}]}]