[{"gpt-4-1106-preview_direct_sole-planning_results": "Travel Plan:\n\nDays: 1\nCurrent City: from Charlotte to Marquette, Wisconsin\nTransportation: Self-driving, from Charlotte to Marquette, duration: 13 hours 1 min, distance: 1,371 km, cost: 68 x 2 = 136\nBreakfast: -\nAttraction: -\nLunch: -\nDinner: The Chop House, Marquette, Wisconsin, cost: 81 x 2 = 162, cuisines: Desserts, Tea, Pizza, Mexican, Bakery, Indian\nAccommodation: Huge Private Room Near Prospect Park, Marquette, Wisconsin, cost: 73 x 2 = 146, room type: Private room, house rules: No smoking & No visitors, minimum nights: 1, maximum occupancy: 2\n\nNumber of people: 2\nTotal cost: 136 + 162 + 146 = 444\nAccommodation minimum nights: 1/1\n\nDays: 2\nCurrent City: Marquette, Wisconsin\nTransportation: -\nBreakfast: Annapurna Sweet House, Marquette, Wisconsin, cost: 36 x 2 = 72, cuisines: French, Bakery, Desserts, Seafood\nAttraction: Presque Isle Park, Marquette, Wisconsin; Marquette Harbor Lighthouse, Marquette, Wisconsin\nLunch: Taste of Balingup, Marquette, Wisconsin, cost: 35 x 2 = 70, cuisines: BBQ, Desserts\nDinner: Dovetail, Marquette, Wisconsin, cost: 95 x 2 = 190, cuisines: Fast Food, Indian, BBQ, Italian\nAccommodation: Huge Private Room Near Prospect Park, Marquette, Wisconsin, cost: 73 x 2 = 146, room type: Private room, house rules: No smoking & No visitors, minimum nights: 1, maximum occupancy: 2\n\nNumber of people: 2\nTotal cost: 72 + 70 + 190 + 146 = 478\nAccommodation minimum nights: 2/1\n\nDays: 3\nCurrent City: from Marquette, Wisconsin to Milwaukee, Wisconsin\nTransportation: Self-driving, from Marquette to Milwaukee, duration: 6 mins, distance: 2.0 km, cost: 0\nBreakfast: Ifthar, Marquette, Wisconsin, cost: 67 x 2 = 134, cuisines: Bakery, American, Cafe, Desserts\nAttraction: Milwaukee Art Museum, Milwaukee, Wisconsin; Milwaukee Public Museum, Milwaukee, Wisconsin\nLunch: Cool Basil, Milwaukee, Wisconsin, cost: 40 x 2 = 80, cuisines: Chinese, Pizza, French, Fast Food, Cafe\nDinner: Berco's, Milwaukee, Wisconsin, cost: 91 x 2 = 182, cuisines: Desserts, Pizza, Italian, Cafe, Seafood\nAccommodation: Affordable bedroom in the East Village!, Milwaukee, Wisconsin, cost: 184 x 2 = 368, room type: Private room, house rules: No parties, minimum nights: 1, maximum occupancy: 2\n\nNumber of people: 2\nTotal cost: 134 + 80 + 182 + 368 = 764\nAccommodation minimum nights: 1/1\n\nDays: 4\nCurrent City: Milwaukee, Wisconsin\nTransportation: -\nBreakfast: Frontier, Milwaukee, Wisconsin, cost: 13 x 2 = 26, cuisines: Fast Food, Seafood, Tea, Italian\nAttraction: North Point Lighthouse, Milwaukee, Wisconsin; Milwaukee County Zoo, Milwaukee, Wisconsin\nLunch: The Pack King, Milwaukee, Wisconsin, cost: 94 x 2 = 188, cuisines: French, Bakery, Pizza\nDinner: Doughlicious, Milwaukee, Wisconsin, cost: 59 x 2 = 118, cuisines: Tea, Cafe, Mediterranean, Italian\nAccommodation: Affordable bedroom in the East Village!, Milwaukee, Wisconsin, cost: 184 x 2 = 368, room type: Private room, house rules: No parties, minimum nights: 1, maximum occupancy: 2\n\nNumber of people: 2\nTotal cost: 26 + 188 + 118 + 368 = 700\nAccommodation minimum nights: 2/1\n\nDays: 5\nCurrent City: from Milwaukee, Wisconsin to Charlotte\nTransportation: Self-driving, from Milwaukee to Charlotte, duration: 12 hours 58 mins, distance: 1,369 km, cost: 68 x 2 = 136\nBreakfast: Himalaya Food Corner, Milwaukee, Wisconsin, cost: 40 x 2 = 80, cuisines: Desserts, Tea, BBQ, Fast Food, Chinese\nAttraction: -\nLunch: -\nDinner: -\nAccommodation: -\n\nNumber of people: 2\nTotal cost: 136 + 80 = 216\n\nTotal cost across all days: 444 + 478 + 764 + 700 + 216 = 2,602\n\nNote: The total cost slightly exceeds the budget by $102. To adjust, consider choosing a less expensive dinner option on Day 2 and/or Day 3, or opt for a more economical accommodation on Day 3 and/or Day 4.\n\nCuisines: All cuisine constraints are satisfied with a variety of options each day.\nAccommodations: All accommodations are private rooms, child-friendly, and adhere to the specified house rules.", "gpt-4-1106-preview_direct_sole-planning_parsed_results": [{"day": 1, "current_city": "from Charlotte to Marquette, Wisconsin", "transportation": "Self-driving, from Charlotte to Marquette, duration: 13 hours 1 min, distance: 1,371 km", "breakfast": "-", "attraction": "-", "lunch": "-", "dinner": "The Chop House, Marquette, Wisconsin", "accommodation": "Huge Private Room Near Prospect Park, Marquette, Wisconsin"}, {"day": 2, "current_city": "Marquette, Wisconsin", "transportation": "-", "breakfast": "Annapurna Sweet House, Marquette, Wisconsin", "attraction": "Presque Isle Park, Marquette, Wisconsin;Marquette Harbor Lighthouse, Marquette, Wisconsin;", "lunch": "Taste of Balingup, Marquette, Wisconsin", "dinner": "Dovetail, Marquette, Wisconsin", "accommodation": "Huge Private Room Near Prospect Park, Marquette, Wisconsin"}, {"day": 3, "current_city": "from Marquette, Wisconsin to Milwaukee, Wisconsin", "transportation": "Self-driving, from Marquette to Milwaukee, duration: 6 mins, distance: 2.0 km", "breakfast": "Ifthar, Marquette, Wisconsin", "attraction": "Milwaukee Art Museum, Milwaukee, Wisconsin;Milwaukee Public Museum, Milwaukee, Wisconsin;", "lunch": "Cool Basil, Milwaukee, Wisconsin", "dinner": "Berco's, Milwaukee, Wisconsin", "accommodation": "Affordable bedroom in the East Village!, Milwaukee, Wisconsin"}, {"day": 4, "current_city": "Milwaukee, Wisconsin", "transportation": "-", "breakfast": "Frontier, Milwaukee, Wisconsin", "attraction": "North Point Lighthouse, Milwaukee, Wisconsin;Milwaukee County Zoo, Milwaukee, Wisconsin;", "lunch": "The Pack King, Milwaukee, Wisconsin", "dinner": "Doughlicious, Milwaukee, Wisconsin", "accommodation": "Affordable bedroom in the East Village!, Milwaukee, Wisconsin"}, {"day": 5, "current_city": "from Milwaukee, Wisconsin to Charlotte", "transportation": "Self-driving, from Milwaukee to Charlotte, duration: 12 hours 58 mins, distance: 1,369 km", "breakfast": "Himalaya Food Corner, Milwaukee, Wisconsin", "attraction": "-", "lunch": "-", "dinner": "-", "accommodation": "-"}]}]