[{"gpt-4-1106-preview_direct_sole-planning_results": "Travel Plan:\n\nDays: 1\nCurrent City: from Newark to Madison, Wisconsin\nTransportation: Flight F4073170, from Newark to Madison, duration: 2 hours 30 minutes, cost: 355 per person\nBreakfast: -\nAttraction: -\nLunch: -\nDinner: 99 North Restaurant, Madison, Wisconsin, cost: 62, cuisines: Fast Food, Mexican, Indian, Pizza\nAccommodation: Perfectly Located UpperWest Futon, Madison, Wisconsin, cost: 164, room type: Shared room, house rules: No pets & No children under 10, maximum occupancy: 1\n\nNumber of people: 2\nTotal cost: (355 x 2) + (62 x 2) + 164 = 998\nAccommodation minimum nights: 1/2\n\nDays: 2\nCurrent City: Madison, Wisconsin\nTransportation: -\nBreakfast: Unique Food Hut, Madison, Wisconsin, cost: 38, cuisines: Desserts, Italian, BBQ, Fast Food, Seafood\nAttraction: Madison Children's Museum, Madison, Wisconsin; Chazen Museum of Art, Madison, Wisconsin\nLunch: Barbeque Nation, Madison, Wisconsin, cost: 38, cuisines: Tea, Pizza, French, Bakery, Cafe\nDinner: The Kathis, Madison, Wisconsin, cost: 67, cuisines: BBQ, Pizza, Desserts, Fast Food\nAccommodation: Perfectly Located UpperWest Futon, Madison, Wisconsin, cost: 164, room type: Shared room, house rules: No pets & No children under 10, maximum occupancy: 1\n\nNumber of people: 2\nTotal cost: (38 x 2) + (38 x 2) + (67 x 2) + 164 = 430\nAccommodation minimum nights: 2/2\n\nDays: 3\nCurrent City: from Madison to Mosinee, Wisconsin\nTransportation: Self-driving, from Madison to Mosinee, duration: 2 hours 3 mins, distance: 209 km, cost: 10 per person\nBreakfast: Moet's Sizzlers, Madison, Wisconsin, cost: 10, cuisines: French, Bakery, Pizza, Mediterranean\nAttraction: Walter Zych Park, Mosinee, Wisconsin; River Park, Mosinee, Wisconsin\nLunch: Grit, Mosinee, Wisconsin, cost: 28, cuisines: Bakery, BBQ, Seafood\nDinner: Bake N Shake, Mosinee, Wisconsin, cost: 41, cuisines: Pizza, American, BBQ\nAccommodation: Where Dreams are made of NYC, Mosinee, Wisconsin, cost: 212, room type: Shared room, house rules: No smoking & No children under 10, maximum occupancy: 1\n\nNumber of people: 2\nTotal cost: (10 x 2) + (10 x 2) + (28 x 2) + (41 x 2) + 212 = 380\nAccommodation minimum nights: 1/1\n\nDays: 4\nCurrent City: Mosinee, Wisconsin\nTransportation: -\nBreakfast: MyLoveBiryani.Com, Mosinee, Wisconsin, cost: 17, cuisines: Tea, Bakery, Desserts\nAttraction: Big Eau Pleine County Park, Mosinee, Wisconsin; The Sand Cliffs, Mosinee, Wisconsin\nLunch: Cafe Sante, Mosinee, Wisconsin, cost: 49, cuisines: Pizza, BBQ, Cafe, American, Mediterranean, Seafood\nDinner: LaDiDa, Mosinee, Wisconsin, cost: 72, cuisines: Fast Food, French, Seafood, Italian\nAccommodation: Where Dreams are made of NYC, Mosinee, Wisconsin, cost: 212, room type: Shared room, house rules: No smoking & No children under 10, maximum occupancy: 1\n\nNumber of people: 2\nTotal cost: (17 x 2) + (49 x 2) + (72 x 2) + 212 = 488\nAccommodation minimum nights: 2/1\n\nDays: 5\nCurrent City: from Mosinee to Newark\nTransportation: Self-driving, from Mosinee to Newark, duration: 15 hours 32 mins, distance: 1,695 km, cost: 84 per person\nBreakfast: Senorita's, Mosinee, Wisconsin, cost: 94, cuisines: Fast Food, Chinese, Cafe, Seafood\nAttraction: -\nLunch: -\nDinner: -\nAccommodation: -\n\nNumber of people: 2\nTotal cost: (84 x 2) + (94 x 2) = 356\n\nTotal cost across all days: 998 + 430 + 380 + 488 + 356 = 2,652\n\nCuisines: The prompt specifies no cuisines, so all cuisine constraints are satisfied\n\nNote: The accommodation on Day 1 and Day 2 is a shared room but only has a maximum occupancy of 1, which does not meet the requirement for two people. However, due to the lack of shared room options in the provided data, this was the best available choice within the budget constraints. If this is not acceptable, alternative accommodations or adjustments to the travel plan will be necessary.", "gpt-4-1106-preview_direct_sole-planning_parsed_results": [{"day": 1, "current_city": "from Newark to Madison", "transportation": "Flight Number: F4073170, from Newark to Madison, Departure Time: -, Arrival Time: -", "breakfast": "-", "attraction": "-", "lunch": "-", "dinner": "99 North Restaurant, Madison", "accommodation": "Perfectly Located UpperWest Futon, Madison"}, {"day": 2, "current_city": "Madison", "transportation": "-", "breakfast": "Unique Food Hut, Madison", "attraction": "Madison Children's Museum, Madison;Chazen Museum of Art, Madison;", "lunch": "Barbeque Nation, Madison", "dinner": "The Kathis, Madison", "accommodation": "Perfectly Located UpperWest Futon, Madison"}, {"day": 3, "current_city": "from Madison to Mosinee", "transportation": "Self-driving, from Madison to Mosinee, Departure Time: -, Arrival Time: -", "breakfast": "Moet's Sizzlers, Madison", "attraction": "Walter Zych Park, Mosinee;River Park, Mosinee;", "lunch": "Grit, Mosinee", "dinner": "Bake N Shake, Mosinee", "accommodation": "Where Dreams are made of NYC, Mosinee"}, {"day": 4, "current_city": "Mosinee", "transportation": "-", "breakfast": "MyLoveBiryani.Com, Mosinee", "attraction": "Big Eau Pleine County Park, Mosinee;The Sand Cliffs, Mosinee;", "lunch": "Cafe Sante, Mosinee", "dinner": "LaDiDa, Mosinee", "accommodation": "Where Dreams are made of NYC, Mosinee"}, {"day": 5, "current_city": "from Mosinee to Newark", "transportation": "Self-driving, from Mosinee to Newark, Departure Time: -, Arrival Time: -", "breakfast": "Senorita's, Mosinee", "attraction": "-", "lunch": "-", "dinner": "-", "accommodation": "-"}]}]