[{"gpt-4-1106-preview_direct_sole-planning_results": "Travel Plan:\n\nDays: 1\nCurrent City: from Boston to San Juan, Puerto Rico\nTransportation: Flight F3764584, from Boston to San Juan, duration: 4 hours 12 minutes, cost: $366\nBreakfast: -\nAttraction: -\nLunch: -\nDinner: Christian and Jake's Bistro, San Juan, Puerto Rico, cost: $59, cuisines: Tea, French, Bakery, Fast Food, Indian\nAccommodation: FLUSHING APT!! BEST DEAL IN NYC!!!, San Juan, Puerto Rico, cost: $135, room type: Entire home/apt, house rules: No smoking & No parties, minimum nights: 1, maximum occupancy: 2\n\nNumber of people: 1\nTotal cost: $366 (flight) + $59 (dinner) + $135 (accommodation) = $560\nAccommodation minimum nights: 1/1\n\nDays: 2\nCurrent City: San Juan, Puerto Rico\nTransportation: -\nBreakfast: Oh My!, San Juan, Puerto Rico, cost: $18, cuisines: Desserts, Tea, Cafe, American, Mediterranean, Seafood\nAttraction: Castillo San Felipe del Morro, San Juan, Puerto Rico; Paseo de La Princesa, San Juan, Puerto Rico\nLunch: Hoka-Hoka Japanese Steak & Sushi, San Juan, Puerto Rico, cost: $27, cuisines: Tea, French, American, Cafe\nDinner: Go! Dimsum, San Juan, Puerto Rico, cost: $54, cuisines: French, Bakery, Fast Food\nAccommodation: FLUSHING APT!! BEST DEAL IN NYC!!!, San Juan, Puerto Rico, cost: $135, room type: Entire home/apt, house rules: No smoking & No parties, minimum nights: 1, maximum occupancy: 2\n\nNumber of people: 1\nTotal cost: $18 (breakfast) + $27 (lunch) + $54 (dinner) + $135 (accommodation) = $234\nAccommodation minimum nights: 2/1\n\nDays: 3\nCurrent City: from San Juan, Puerto Rico to Boston\nTransportation: Flight F3764590, from San Juan to Boston, duration: 4 hours 12 minutes, cost: $569\nBreakfast: Coldpress Company, San Juan, Puerto Rico, cost: $11, cuisines: Cafe, Pizza, BBQ, Fast Food\nAttraction: -\nLunch: -\nDinner: -\nAccommodation: -\n\nNumber of people: 1\nTotal cost: $569 (flight) + $11 (breakfast) = $580\n\nTotal cost across all days: $560 + $234 + $580 = $1,374\n\nCuisines: The prompt specifies no cuisines, so all cuisine constraints are satisfied.", "gpt-4-1106-preview_direct_sole-planning_parsed_results": [{"day": 1, "current_city": "from Boston to San Juan, Puerto Rico", "transportation": "Flight Number: F3764584, from Boston to San Juan, Puerto Rico, Departure Time: -, Arrival Time: -", "breakfast": "-", "attraction": "-", "lunch": "-", "dinner": "Christian and Jake's Bistro, San Juan, Puerto Rico", "accommodation": "FLUSHING APT!! BEST DEAL IN NYC!!!, San Juan, Puerto Rico"}, {"day": 2, "current_city": "San Juan, Puerto Rico", "transportation": "-", "breakfast": "Oh My!, San Juan, Puerto Rico", "attraction": "Castillo San Felipe del Morro, San Juan, Puerto Rico;Paseo de La Princesa, San Juan, Puerto Rico;", "lunch": "Hoka-Hoka Japanese Steak & Sushi, San Juan, Puerto Rico", "dinner": "Go! Dimsum, San Juan, Puerto Rico", "accommodation": "FLUSHING APT!! BEST DEAL IN NYC!!!, San Juan, Puerto Rico"}, {"day": 3, "current_city": "from San Juan, Puerto Rico to Boston", "transportation": "Flight Number: F3764590, from San Juan, Puerto Rico to Boston, Departure Time: -, Arrival Time: -", "breakfast": "Coldpress Company, San Juan, Puerto Rico", "attraction": "-", "lunch": "-", "dinner": "-", "accommodation": "-"}]}]