[{"gpt-4-1106-preview_direct_sole-planning_results": "Travel Plan:\n\nDays: 1\nDate: March 27th, 2022\nCurrent City: from Denver to Palm Springs\nTransportation: Flight F3880999, from Denver to Palm Springs, duration: 2 hours 12 minutes, cost: $227\nBreakfast: -\nAttraction: -\nLunch: -\nDinner: Bar Gernika Basque Pub & Eatery, Palm Springs, Average Cost: $50, Cuisines: Tea, Pizza, Desserts, Fast Food\nAccommodation: Brooklyn Gem, Palm Springs, price: $877, room type: Entire home/apt, house rules: No children under 10, minimum nights: 2, maximum occupancy: 4\n\nNumber of people: 1\nTotal cost: $227 (Flight) + $50 (Dinner) + $877 (Accommodation) = $1,154\nAccommodation minimum nights: 1/2\n\nDays: 2\nDate: March 28th, 2022\nCurrent City: Palm Springs\nTransportation: -\nBreakfast: Kahill's Steak-Fish Chophouse, Palm Springs, Average Cost: $38, Cuisines: Cafe, Bakery, American\nAttraction: Palm Springs Art Museum; Moorten Botanical Garden\nLunch: Houndstooth Grill & Tavern, Palm Springs, Average Cost: $47, Cuisines: Tea, Pizza, BBQ, Mediterranean\nDinner: Sugar & Spice - Le Marche, Palm Springs, Average Cost: $33, Cuisines: Tea, French, Cafe\nAccommodation: Brooklyn Gem, Palm Springs, price: $877, room type: Entire home/apt, house rules: No children under 10, minimum nights: 2, maximum occupancy: 4\n\nNumber of people: 1\nTotal cost: $38 (Breakfast) + $47 (Lunch) + $33 (Dinner) + $877 (Accommodation) = $995\nAccommodation minimum nights: 2/2\n\nDays: 3\nDate: March 29th, 2022\nCurrent City: from Palm Springs to Denver\nTransportation: Flight F3870938, from Palm Springs to Denver, duration: 2 hours 0 minutes, cost: $241\nBreakfast: Pizza Man, Palm Springs, Average Cost: $55, Cuisines: Tea, Italian, Fast Food, Cafe, American\nAttraction: -\nLunch: -\nDinner: -\nAccommodation: -\n\nNumber of people: 1\nTotal cost: $241 (Flight) + $55 (Breakfast) = $296\n\nTotal cost across all days: $1,154 (Day 1) + $995 (Day 2) + $296 (Day 3) = $2,445\n\nNote: The total cost exceeds the specified budget of $2,200. Adjustments are needed to meet the budget constraint. Possible adjustments include selecting a less expensive accommodation or removing some meals or attractions.\n\nAdjusted Travel Plan:\n\nDays: 1\nDate: March 27th, 2022\nCurrent City: from Denver to Palm Springs\nTransportation: Flight F3880999, from Denver to Palm Springs, duration: 2 hours 12 minutes, cost: $227\nBreakfast: -\nAttraction: -\nLunch: -\nDinner: Bar Gernika Basque Pub & Eatery, Palm Springs, Average Cost: $50, Cuisines: Tea, Pizza, Desserts, Fast Food\nAccommodation: Gorgeous 1BR brownstone in Harlem close to trains, Palm Springs, price: $430, room type: Entire home/apt, house rules: No visitors & No pets, minimum nights: 15, maximum occupancy: 3\n\nNumber of people: 1\nTotal cost: $227 (Flight) + $50 (Dinner) + $430 (Accommodation) = $707\nAccommodation minimum nights: 1/15\n\nDays: 2\nDate: March 28th, 2022\nCurrent City: Palm Springs\nTransportation: -\nBreakfast: Kahill's Steak-Fish Chophouse, Palm Springs, Average Cost: $38, Cuisines: Cafe, Bakery, American\nAttraction: Palm Springs Art Museum; Moorten Botanical Garden\nLunch: Houndstooth Grill & Tavern, Palm Springs, Average Cost: $47, Cuisines: Tea, Pizza, BBQ, Mediterranean\nDinner: Sugar & Spice - Le Marche, Palm Springs, Average Cost: $33, Cuisines: Tea, French, Cafe\nAccommodation: Gorgeous 1BR brownstone in Harlem close to trains, Palm Springs, price: $430, room type: Entire home/apt, house rules: No visitors & No pets, minimum nights: 15, maximum occupancy: 3\n\nNumber of people: 1\nTotal cost: $38 (Breakfast) + $47 (Lunch) + $33 (Dinner) + $430 (Accommodation) = $548\nAccommodation minimum nights: 2/15\n\nDays: 3\nDate: March 29th, 2022\nCurrent City: from Palm Springs to Denver\nTransportation: Flight F3870938, from Palm Springs to Denver, duration: 2 hours 0 minutes, cost: $241\nBreakfast: Pizza Man, Palm Springs, Average Cost: $55, Cuisines: Tea, Italian, Fast Food, Cafe, American\nAttraction: -\nLunch: -\nDinner: -\nAccommodation: -\n\nNumber of people: 1\nTotal cost: $241 (Flight) + $55 (Breakfast) = $296\n\nTotal cost across all days: $707 (Day 1) + $548 (Day 2) + $296 (Day 3) = $1,551\n\nThe adjusted travel plan meets the budget constraint of $2,200.", "gpt-4-1106-preview_direct_sole-planning_parsed_results": [{"day": 1, "current_city": "from Denver to Palm Springs", "transportation": "Flight Number: F3880999, from Denver to Palm Springs, Departure Time: -, Arrival Time: -", "breakfast": "-", "attraction": "-", "lunch": "-", "dinner": "Bar Gernika Basque Pub & Eatery, Palm Springs", "accommodation": "Gorgeous 1BR brownstone in Harlem close to trains, Palm Springs"}, {"day": 2, "current_city": "Palm Springs", "transportation": "-", "breakfast": "Kahill's Steak-Fish Chophouse, Palm Springs", "attraction": "Palm Springs Art Museum, Palm Springs;Moorten Botanical Garden, Palm Springs;", "lunch": "Houndstooth Grill & Tavern, Palm Springs", "dinner": "Sugar & Spice - Le Marche, Palm Springs", "accommodation": "Gorgeous 1BR brownstone in Harlem close to trains, Palm Springs"}, {"day": 3, "current_city": "from Palm Springs to Denver", "transportation": "Flight Number: F3870938, from Palm Springs to Denver, Departure Time: -, Arrival Time: -", "breakfast": "Pizza Man, Palm Springs", "attraction": "-", "lunch": "-", "dinner": "-", "accommodation": "-"}]}]