[{"gpt-4-1106-preview_direct_sole-planning_results": "Travel Plan:\n\nDays: 1\nCurrent City: from Devils Lake to Alamosa, Colorado\nTransportation: Self-driving, from Devils Lake to Alamosa, duration: 17 hours 26 mins, distance: 1,811 km, cost: 90\nBreakfast: -\nAttraction: -\nLunch: -\nDinner: Atlanta Highway Seafood Market, Alamosa, Colorado, cost: 68, cuisines: Fast Food, Desserts, Seafood\nAccommodation: Comfortable studio suite in midtown Manhattan, Alamosa, Colorado, cost: 67, room type: Entire home/apt, house rules: No parties & No smoking & No visitors, minimum nights: 30, maximum occupancy: 2\n\nNumber of people: 1\nTotal cost: 90 x 1 + 68 x 1 + 67 x 1 = 225\nAccommodation minimum nights: 1/30\n\nDays: 2\nCurrent City: Alamosa, Colorado\nTransportation: -\nBreakfast: Coffee to Cocktail Bar - Hyatt Place, Alamosa, Colorado, cost: 35, cuisines: Tea, Indian, Desserts, Italian\nAttraction: San Luis Valley Museum, Alamosa, Colorado; Rio Grande Farm Park, Alamosa, Colorado\nLunch: Riverwalk Cafe, Alamosa, Colorado, cost: 97, cuisines: Tea, Pizza, Fast Food\nDinner: Burger Singh, Alamosa, Colorado, cost: 95, cuisines: Desserts, Tea, BBQ, Chinese, Seafood\nAccommodation: Comfortable studio suite in midtown Manhattan, Alamosa, Colorado, cost: 67, room type: Entire home/apt, house rules: No parties & No smoking & No visitors, minimum nights: 30, maximum occupancy: 2\n\nNumber of people: 1\nTotal cost: 35 x 1 + 97 x 1 + 95 x 1 + 67 x 1 = 294\nAccommodation minimum nights: 2/30\n\nDays: 3\nCurrent City: from Alamosa to Grand Junction, Colorado\nTransportation: Self-driving, from Alamosa to Grand Junction, duration: 4 hours 29 mins, distance: 396 km, cost: 19\nBreakfast: Cafe LazyMojo, Alamosa, Colorado, cost: 26, cuisines: Tea, Pizza, American, Fast Food\nAttraction: Museum of the West, Museums of Western Colorado, Grand Junction, Colorado; Eureka! McConnell Science Museum, Grand Junction, Colorado\nLunch: 2 Dog, Grand Junction, Colorado, cost: 29, cuisines: Desserts, BBQ, Fast Food, Cafe, American\nDinner: Austin's BBQ and Oyster Bar, Grand Junction, Colorado, cost: 15, cuisines: Tea, Bakery, Fast Food, Indian, Seafood\nAccommodation: NYC Apartment near Central Park!, Grand Junction, Colorado, cost: 1118, room type: Entire home/apt, house rules: No children under 10, minimum nights: 3, maximum occupancy: 5\n\nNumber of people: 1\nTotal cost: 19 x 1 + 26 x 1 + 29 x 1 + 15 x 1 + 1118 x 1 = 1207\nAccommodation minimum nights: 1/3\n\nDays: 4\nCurrent City: Grand Junction, Colorado\nTransportation: -\nBreakfast: Shanghai Bar & Lounge - The Bristol Hotel, Grand Junction, Colorado, cost: 31, cuisines: Cafe, Pizza\nAttraction: Western Colorado Botanical Gardens, Grand Junction, Colorado; Canyon View Park, Grand Junction, Colorado\nLunch: Punjab Da Pind, Grand Junction, Colorado, cost: 52, cuisines: Desserts, Pizza, Bakery, Chinese, Mediterranean, Seafood\nDinner: Penta Cafe, Grand Junction, Colorado, cost: 66, cuisines: French, Mexican, BBQ, Seafood\nAccommodation: NYC Apartment near Central Park!, Grand Junction, Colorado, cost: 1118, room type: Entire home/apt, house rules: No children under 10, minimum nights: 3, maximum occupancy: 5\n\nNumber of people: 1\nTotal cost: 31 x 1 + 52 x 1 + 66 x 1 + 1118 x 1 = 1267\nAccommodation minimum nights: 2/3\n\nDays: 5\nCurrent City: from Grand Junction to Gunnison, Colorado\nTransportation: Self-driving, from Grand Junction to Gunnison, duration: 2 hours 27 mins, distance: 200 km, cost: 10\nBreakfast: Cocoa Tree, Grand Junction, Colorado, cost: 68, cuisines: Tea, Chinese, Cafe, Fast Food\nAttraction: Gunnison Pioneer Museum, Gunnison, Colorado; Gunnison Valley Observatory, Gunnison, Colorado\nLunch: SALT, Gunnison, Colorado, cost: 44, cuisines: Tea, Chinese, BBQ\nDinner: Happy Joe's Pizza & Ice Cream, Gunnison, Colorado, cost: 74, cuisines: Desserts, Italian, Bakery, Indian, Seafood\nAccommodation: Full-size loft bed in East Village, Gunnison, Colorado, cost: 104, room type: Private room, house rules: No visitors & No pets & No parties, minimum nights: 1, maximum occupancy: 1\n\nNumber of people: 1\nTotal cost: 10 x 1 + 68 x 1 + 44 x 1 + 74 x 1 + 104 x 1 = 300\nAccommodation minimum nights: 1/1\n\nDays: 6\nCurrent City: Gunnison, Colorado\nTransportation: -\nBreakfast: Mocha, Gunnison, Colorado, cost: 30, cuisines: Tea, Cafe, Pizza, BBQ\nAttraction: Hartman Rocks, Gunnison, Colorado; Black Canyon of the Gunnison National Park, Gunnison, Colorado\nLunch: Paradise Inn, Gunnison, Colorado, cost: 99, cuisines: BBQ, Bakery, Desserts\nDinner: Tughlaq, Gunnison, Colorado, cost: 18, cuisines: French, Pizza, Fast Food\nAccommodation: Full-size loft bed in East Village, Gunnison, Colorado, cost: 104, room type: Private room, house rules: No visitors & No pets & No parties, minimum nights: 1, maximum occupancy: 1\n\nNumber of people: 1\nTotal cost: 30 x 1 + 99 x 1 + 18 x 1 + 104 x 1 = 251\nAccommodation minimum nights: 2/1\n\nDays: 7\nCurrent City: from Gunnison to Devils Lake\nTransportation: Self-driving, from Gunnison to Devils Lake, duration: 17 hours 30 mins, distance: 1,881 km, cost: 94\nBreakfast: Cyber Hub Social, Gunnison, Colorado, cost: 95, cuisines: Tea, Fast Food\nAttraction: -\nLunch: -\nDinner: -\nAccommodation: -\n\nNumber of people: 1\nTotal cost: 94 x 1 + 95 x 1 = 189\n\nTotal cost across all days: 225 + 294 + 1207 + 1267 + 300 + 251 + 189 = 3733\n\nCuisines: The prompt specifies no cuisines, so all cuisine constraints are satisfied\n\nNote: The total cost exceeds the budget by $233. Adjustments to the accommodation or dining options may be necessary to meet the budget constraint.", "gpt-4-1106-preview_direct_sole-planning_parsed_results": [{"day": 1, "current_city": "from Devils Lake to Alamosa, Colorado", "transportation": "Self-driving, from Devils Lake to Alamosa, duration: 17 hours 26 mins, distance: 1,811 km", "breakfast": "-", "attraction": "-", "lunch": "-", "dinner": "Atlanta Highway Seafood Market, Alamosa, Colorado", "accommodation": "Comfortable studio suite in midtown Manhattan, Alamosa, Colorado"}, {"day": 2, "current_city": "Alamosa, Colorado", "transportation": "-", "breakfast": "Coffee to Cocktail Bar - Hyatt Place, Alamosa, Colorado", "attraction": "San Luis Valley Museum, Alamosa, Colorado;Rio Grande Farm Park, Alamosa, Colorado;", "lunch": "Riverwalk Cafe, Alamosa, Colorado", "dinner": "Burger Singh, Alamosa, Colorado", "accommodation": "Comfortable studio suite in midtown Manhattan, Alamosa, Colorado"}, {"day": 3, "current_city": "from Alamosa to Grand Junction, Colorado", "transportation": "Self-driving, from Alamosa to Grand Junction, duration: 4 hours 29 mins, distance: 396 km", "breakfast": "Cafe LazyMojo, Alamosa, Colorado", "attraction": "Museum of the West, Museums of Western Colorado, Grand Junction, Colorado;Eureka! McConnell Science Museum, Grand Junction, Colorado;", "lunch": "2 Dog, Grand Junction, Colorado", "dinner": "Austin's BBQ and Oyster Bar, Grand Junction, Colorado", "accommodation": "NYC Apartment near Central Park!, Grand Junction, Colorado"}, {"day": 4, "current_city": "Grand Junction, Colorado", "transportation": "-", "breakfast": "Shanghai Bar & Lounge - The Bristol Hotel, Grand Junction, Colorado", "attraction": "Western Colorado Botanical Gardens, Grand Junction, Colorado;Canyon View Park, Grand Junction, Colorado;", "lunch": "Punjab Da Pind, Grand Junction, Colorado", "dinner": "Penta Cafe, Grand Junction, Colorado", "accommodation": "NYC Apartment near Central Park!, Grand Junction, Colorado"}, {"day": 5, "current_city": "from Grand Junction to Gunnison, Colorado", "transportation": "Self-driving, from Grand Junction to Gunnison, duration: 2 hours 27 mins, distance: 200 km", "breakfast": "Cocoa Tree, Grand Junction, Colorado", "attraction": "Gunnison Pioneer Museum, Gunnison, Colorado;Gunnison Valley Observatory, Gunnison, Colorado;", "lunch": "SALT, Gunnison, Colorado", "dinner": "Happy Joe's Pizza & Ice Cream, Gunnison, Colorado", "accommodation": "Full-size loft bed in East Village, Gunnison, Colorado"}, {"day": 6, "current_city": "Gunnison, Colorado", "transportation": "-", "breakfast": "Mocha, Gunnison, Colorado", "attraction": "Hartman Rocks, Gunnison, Colorado;Black Canyon of the Gunnison National Park, Gunnison, Colorado;", "lunch": "Paradise Inn, Gunnison, Colorado", "dinner": "Tughlaq, Gunnison, Colorado", "accommodation": "Full-size loft bed in East Village, Gunnison, Colorado"}, {"day": 7, "current_city": "from Gunnison to Devils Lake", "transportation": "Self-driving, from Gunnison to Devils Lake, duration: 17 hours 30 mins, distance: 1,881 km", "breakfast": "Cyber Hub Social, Gunnison, Colorado", "attraction": "-", "lunch": "-", "dinner": "-", "accommodation": "-"}]}]