[{"gpt-4-1106-preview_direct_sole-planning_results": "Travel Plan:\n\nDays: 1\nCurrent City: from Columbus to Newark\nTransportation: Flight F4076294, from Columbus to Newark, duration: 1 hour 51 minutes, cost: $116 per person\nBreakfast: -\nAttraction: -\nLunch: -\nDinner: Artistry, Newark, cost: $79, cuisines: Cafe, Pizza, Desserts, Seafood\nAccommodation: Gramercy One Bedroom w Two Beds, Newark, cost: $485, room type: Entire home/apt, house rules: No visitors & No children under 10, maximum occupancy: 4\n\nNumber of people: 2\nTotal cost: (116 x 2) + 79 + 485 = $796\nAccommodation minimum nights: 1/7\n\nDays: 2\nCurrent City: Newark\nTransportation: -\nBreakfast: Mirage Restro Bar, Newark, cost: $51, cuisines: Bakery, American, Desserts, Fast Food\nAttraction: The Newark Museum of Art, Newark; Military Park, Newark\nLunch: Bernardo's, Newark, cost: $84, cuisines: Desserts, Pizza, BBQ, American, Mediterranean\nDinner: Anaicha's Food Joint, Newark, cost: $43, cuisines: Desserts, Pizza, Mexican, Bakery, Seafood\nAccommodation: Gramercy One Bedroom w Two Beds, Newark, cost: $485, room type: Entire home/apt, house rules: No visitors & No children under 10, maximum occupancy: 4\n\nNumber of people: 2\nTotal cost: (51 x 2) + (84 x 2) + (43 x 2) + 485 = $841\nAccommodation minimum nights: 2/7\n\nDays: 3\nCurrent City: from Newark to Columbus\nTransportation: Flight F4076752, from Newark to Columbus, duration: 1 hour 35 minutes, cost: $129 per person\nBreakfast: Harmann Restaurant, Newark, cost: $57, cuisines: Tea, Cafe, American, Fast Food\nAttraction: -\nLunch: -\nDinner: -\nAccommodation: -\n\nNumber of people: 2\nTotal cost: (129 x 2) + (57 x 2) = $372\n\nTotal cost across all days: $796 + $841 + $372 = $2009\n\nUnfortunately, the total cost of $2009 exceeds the revised budget of $1,200. To adjust the plan within the budget, we can consider the following changes:\n\n- Opt for a less expensive flight or transportation method if available.\n- Choose more budget-friendly restaurants for meals.\n- Find accommodations that are within the budget and meet the requirements for children under 10.\n\nPlease note that the provided accommodation \"Gramercy One Bedroom w Two Beds\" does not meet the requirement for children under 10, as per the house rules. We would need to find an alternative accommodation that allows children under 10.\n\nGiven the constraints and the need to stay within budget, it is not possible to provide a complete travel plan that meets all the requirements with the provided data. Further information or adjustments to the constraints may be necessary to create a feasible travel plan.", "gpt-4-1106-preview_direct_sole-planning_parsed_results": [{"day": 1, "current_city": "from Columbus to Newark", "transportation": "Flight Number: F4076294, from Columbus to Newark, Departure Time: -, Arrival Time: -", "breakfast": "-", "attraction": "-", "lunch": "-", "dinner": "Artistry, Newark", "accommodation": "Gramercy One Bedroom w Two Beds, Newark"}, {"day": 2, "current_city": "Newark", "transportation": "-", "breakfast": "Mirage Restro Bar, Newark", "attraction": "The Newark Museum of Art, Newark;Military Park, Newark;", "lunch": "Bernardo's, Newark", "dinner": "Anaicha's Food Joint, Newark", "accommodation": "Gramercy One Bedroom w Two Beds, Newark"}, {"day": 3, "current_city": "from Newark to Columbus", "transportation": "Flight Number: F4076752, from Newark to Columbus, Departure Time: -, Arrival Time: -", "breakfast": "Harmann Restaurant, Newark", "attraction": "-", "lunch": "-", "dinner": "-", "accommodation": "-"}]}]