[{"gpt-4-1106-preview_direct_sole-planning_results": "Travel Plan:\n\nDays: 1\nCurrent City: from Missoula to Abilene, Texas\nTransportation: Self-driving, from Missoula to Abilene, duration: 23 hours 1 min, distance: 2,562 km, cost: 128\nBreakfast: -\nAttraction: -\nLunch: -\nDinner: Crispy Crust, Abilene, Texas, cost: 54, cuisines: Desserts, Bakery, Cafe, American, Seafood\nAccommodation: Apartment minutes from manhattan, Abilene, Texas, cost: 295, room type: Entire home/apt, house rules: No pets & No visitors, maximum occupancy: 2\n\nNumber of people: 5\nTotal cost: (128 x 5) + (54 x 5) + (295 x 3) = 640 + 270 + 885 = 1,795\nAccommodation minimum nights: 1/2\n\nDays: 2\nCurrent City: Abilene, Texas\nTransportation: -\nBreakfast: Thai Garden, Abilene, Texas, cost: 13, cuisines: Cafe, American, Desserts\nAttraction: The Grace Museum, Abilene, Texas; Frontier Texas!, Abilene, Texas\nLunch: Mediumwelldone, Abilene, Texas, cost: 91, cuisines: Tea, French, BBQ, Cafe, Seafood\nDinner: Lotus Kitchen, Abilene, Texas, cost: 15, cuisines: French, Bakery, BBQ\nAccommodation: Apartment minutes from manhattan, Abilene, Texas, cost: 295, room type: Entire home/apt, house rules: No pets & No visitors, maximum occupancy: 2\n\nNumber of people: 5\nTotal cost: (13 x 5) + (91 x 5) + (15 x 5) + (295 x 3) = 65 + 455 + 75 + 885 = 1,480\nAccommodation minimum nights: 2/2\n\nDays: 3\nCurrent City: from Abilene to Amarillo, Texas\nTransportation: Self-driving, from Abilene to Amarillo, duration: 4 hours 10 mins, distance: 446 km, cost: 22\nBreakfast: Biryani Express, Abilene, Texas, cost: 11, cuisines: Tea, Pizza, French, Bakery, Fast Food\nAttraction: Cadillac Ranch, Amarillo, Texas; Amarillo Botanical Gardens, Amarillo, Texas\nLunch: The Cinnamon Kitchen, Amarillo, Texas, cost: 69, cuisines: Desserts, Tea, Pizza, Chinese, Seafood\nDinner: Komachi, Amarillo, Texas, cost: 71, cuisines: Desserts, Tea, Fast Food, Chinese, Mediterranean\nAccommodation: Gramercy Park restful, cozy, sun-filled home, Amarillo, Texas, cost: 968, room type: Entire home/apt, house rules: No parties, maximum occupancy: 8\n\nNumber of people: 5\nTotal cost: (22 x 5) + (11 x 5) + (69 x 5) + (71 x 5) + (968 x 1) = 110 + 55 + 345 + 355 + 968 = 1,833\nAccommodation minimum nights: 1/2\n\nDays: 4\nCurrent City: Amarillo, Texas\nTransportation: -\nBreakfast: Wood Box Cafe, Amarillo, Texas, cost: 11, cuisines: Desserts, French, Fast Food, Cafe, American\nAttraction: Amarillo Zoo, Amarillo, Texas; Don Harrington Discovery Center, Amarillo, Texas\nLunch: Sigree Global Grill, Amarillo, Texas, cost: 35, cuisines: Chinese, BBQ, Cafe, Desserts\nDinner: Anand Restaurant, Amarillo, Texas, cost: 53, cuisines: Fast Food, Seafood, Desserts, Italian\nAccommodation: Gramercy Park restful, cozy, sun-filled home, Amarillo, Texas, cost: 968, room type: Entire home/apt, house rules: No parties, maximum occupancy: 8\n\nNumber of people: 5\nTotal cost: (11 x 5) + (35 x 5) + (53 x 5) + (968 x 1) = 55 + 175 + 265 + 968 = 1,463\nAccommodation minimum nights: 2/2\n\nDays: 5\nCurrent City: from Amarillo to Missoula\nTransportation: Self-driving, from Amarillo to Missoula, duration: 18 hours 58 mins, distance: 2,102 km, cost: 105\nBreakfast: Punjabi Chaap Corner, Amarillo, Texas, cost: 62, cuisines: Desserts, Pizza, Italian, Bakery, Fast Food\nAttraction: -\nLunch: -\nDinner: -\nAccommodation: -\n\nNumber of people: 5\nTotal cost: (105 x 5) + (62 x 5) = 525 + 310 = 835\n\nTotal cost across all days: 1,795 + 1,480 + 1,833 + 1,463 + 835 = 7,406\n\nCuisines: Italian and French cuisines were included as requested.\n\nPlease note that the total cost slightly exceeds the budget by $206. Adjustments to the plan, such as changing accommodations or meal choices, may be necessary to stay within budget.", "gpt-4-1106-preview_direct_sole-planning_parsed_results": [{"day": 1, "current_city": "from Missoula to Abilene, Texas", "transportation": "Self-driving, from Missoula to Abilene, duration: 23 hours 1 min, distance: 2,562 km", "breakfast": "-", "attraction": "-", "lunch": "-", "dinner": "Crispy Crust, Abilene, Texas", "accommodation": "Apartment minutes from manhattan, Abilene, Texas"}, {"day": 2, "current_city": "Abilene, Texas", "transportation": "-", "breakfast": "Thai Garden, Abilene, Texas", "attraction": "The Grace Museum, Abilene, Texas;Frontier Texas!, Abilene, Texas;", "lunch": "Mediumwelldone, Abilene, Texas", "dinner": "Lotus Kitchen, Abilene, Texas", "accommodation": "Apartment minutes from manhattan, Abilene, Texas"}, {"day": 3, "current_city": "from Abilene to Amarillo, Texas", "transportation": "Self-driving, from Abilene to Amarillo, duration: 4 hours 10 mins, distance: 446 km", "breakfast": "Biryani Express, Abilene, Texas", "attraction": "Cadillac Ranch, Amarillo, Texas;Amarillo Botanical Gardens, Amarillo, Texas;", "lunch": "The Cinnamon Kitchen, Amarillo, Texas", "dinner": "Komachi, Amarillo, Texas", "accommodation": "Gramercy Park restful, cozy, sun-filled home, Amarillo, Texas"}, {"day": 4, "current_city": "Amarillo, Texas", "transportation": "-", "breakfast": "Wood Box Cafe, Amarillo, Texas", "attraction": "Amarillo Zoo, Amarillo, Texas;Don Harrington Discovery Center, Amarillo, Texas;", "lunch": "Sigree Global Grill, Amarillo, Texas", "dinner": "Anand Restaurant, Amarillo, Texas", "accommodation": "Gramercy Park restful, cozy, sun-filled home, Amarillo, Texas"}, {"day": 5, "current_city": "from Amarillo to Missoula", "transportation": "Self-driving, from Amarillo to Missoula, duration: 18 hours 58 mins, distance: 2,102 km", "breakfast": "Punjabi Chaap Corner, Amarillo, Texas", "attraction": "-", "lunch": "-", "dinner": "-", "accommodation": "-"}]}]