[{"gpt-4-1106-preview_direct_sole-planning_results": "Travel Plan:\n\nDays: 1\nCurrent City: from Elmira to Detroit\nTransportation: Self-driving, from Elmira to Detroit, duration: 7 hours 7 mins, distance: 764 km, cost: 38\nBreakfast: -\nAttraction: -\nLunch: -\nDinner: Chye Seng Huat Hardware, Detroit, cost: 94, cuisines: Tea, Mexican, Seafood\nAccommodation: Cozy 1 bedroom in the heart of Fort Greene, Detroit, cost: 751, room type: Entire home/apt, house rules: No pets & No parties, minimum nights: 3, maximum occupancy: 6\n\nNumber of people: 2\nTotal cost: (38 x 2) + (94 x 2) + (751 x 1) = 1015\nAccommodation minimum nights: 1/3\n\nDays: 2\nCurrent City: Detroit\nTransportation: -\nBreakfast: Cafe And More, Detroit, cost: 41, cuisines: Tea, Bakery, Italian\nAttraction: Detroit Institute of Arts, Detroit; Detroit Historical Museum, Detroit\nLunch: Vapour Pub & Brewery, Detroit, cost: 80, cuisines: French, BBQ, Fast Food, Cafe, Seafood\nDinner: Bistro Flamme Bois, Detroit, cost: 100, cuisines: Chinese, Bakery, BBQ\nAccommodation: Cozy 1 bedroom in the heart of Fort Greene, Detroit, cost: 751, room type: Entire home/apt, house rules: No pets & No parties, minimum nights: 3, maximum occupancy: 6\n\nNumber of people: 2\nTotal cost: (41 x 2) + (80 x 2) + (100 x 2) + (751 x 1) = 1143\nAccommodation minimum nights: 2/3\n\nDays: 3\nCurrent City: Detroit\nTransportation: -\nBreakfast: Southern Bliss Bakery, Detroit, cost: 28, cuisines: Tea, BBQ, Desserts, Seafood\nAttraction: Belle Isle Aquarium, Detroit; Detroit Riverwalk, Detroit\nLunch: Old Kheer Shop, Detroit, cost: 54, cuisines: Mexican, Indian, Desserts, Fast Food\nDinner: Turquoise Turkish Ice-cream, Detroit, cost: 79, cuisines: Fast Food, Tea, Desserts, Italian\nAccommodation: Cozy 1 bedroom in the heart of Fort Greene, Detroit, cost: 751, room type: Entire home/apt, house rules: No pets & No parties, minimum nights: 3, maximum occupancy: 6\n\nNumber of people: 2\nTotal cost: (28 x 2) + (54 x 2) + (79 x 2) + (751 x 1) = 1065\nAccommodation minimum nights: 3/3\n\nTotal cost across all days: 1015 + 1143 + 1065 = 3223\n\nUnfortunately, the total cost of $3,223 exceeds the specified budget of $2,200. To adjust the plan to fit the budget, we need to make some changes:\n\n- We will switch the accommodation to a more affordable option that is pet-friendly.\n- We will select less expensive restaurants while still adhering to the specified cuisines.\n\nRevised Travel Plan:\n\nDays: 1\nCurrent City: from Elmira to Detroit\nTransportation: Self-driving, from Elmira to Detroit, duration: 7 hours 7 mins, distance: 764 km, cost: 38\nBreakfast: -\nAttraction: -\nLunch: -\nDinner: A Dong Restaurant, Detroit, cost: 40, cuisines: Tea, Cafe, Pizza\nAccommodation: Brooklyn Brownstone, 3-Bdr & Garden, Detroit, cost: 400, room type: Entire home/apt, house rules: No children under 10, minimum nights: 3, maximum occupancy: 2\n\nNumber of people: 2\nTotal cost: (38 x 2) + (40 x 2) + (400 x 1) = 556\nAccommodation minimum nights: 1/3\n\nDays: 2\nCurrent City: Detroit\nTransportation: -\nBreakfast: Southern Bliss Bakery, Detroit, cost: 28, cuisines: Tea, BBQ, Desserts, Seafood\nAttraction: Detroit Institute of Arts, Detroit; Detroit Historical Museum, Detroit\nLunch: Mitalis Kitchen, Detroit, cost: 28, cuisines: Pizza, BBQ, Chinese, Mediterranean, Seafood\nDinner: Vapour Pub & Brewery, Detroit, cost: 80, cuisines: French, BBQ, Fast Food, Cafe, Seafood\nAccommodation: Brooklyn Brownstone, 3-Bdr & Garden, Detroit, cost: 400, room type: Entire home/apt, house rules: No children under 10, minimum nights: 3, maximum occupancy: 2\n\nNumber of people: 2\nTotal cost: (28 x 2) + (28 x 2) + (80 x 2) + (400 x 1) = 592\nAccommodation minimum nights: 2/3\n\nDays: 3\nCurrent City: Detroit\nTransportation: -\nBreakfast: Cafe 6, Detroit, cost: 27, cuisines: BBQ, Pizza, Desserts\nAttraction: Belle Isle Aquarium, Detroit; Detroit Riverwalk, Detroit\nLunch: Urban Punjab, Detroit, cost: 40, cuisines: Tea, Cafe, Fast Food\nDinner: Frequent Bakes, Detroit, cost: 50, cuisines: Cafe, Pizza, BBQ, Desserts\nAccommodation: Brooklyn Brownstone, 3-Bdr & Garden, Detroit, cost: 400, room type: Entire home/apt, house rules: No children under 10, minimum nights: 3, maximum occupancy: 2\n\nNumber of people: 2\nTotal cost: (27 x 2) + (40 x 2) + (50 x 2) + (400 x 1) = 584\nAccommodation minimum nights: 3/3\n\nTotal cost across all days: 556 + 592 + 584 = 1732\n\nThe revised total cost of $1,732 fits within the specified budget of $2,200, and all other constraints have been met.", "gpt-4-1106-preview_direct_sole-planning_parsed_results": [{"day": 1, "current_city": "from Elmira to Detroit", "transportation": "Self-driving, from Elmira to Detroit, duration: 7 hours 7 mins, distance: 764 km", "breakfast": "-", "attraction": "-", "lunch": "-", "dinner": "A Dong Restaurant, Detroit", "accommodation": "Brooklyn Brownstone, 3-Bdr & Garden, Detroit"}, {"day": 2, "current_city": "Detroit", "transportation": "-", "breakfast": "Southern Bliss Bakery, Detroit", "attraction": "Detroit Institute of Arts, Detroit;Detroit Historical Museum, Detroit;", "lunch": "Mitalis Kitchen, Detroit", "dinner": "Vapour Pub & Brewery, Detroit", "accommodation": "Brooklyn Brownstone, 3-Bdr & Garden, Detroit"}, {"day": 3, "current_city": "Detroit", "transportation": "-", "breakfast": "Cafe 6, Detroit", "attraction": "Belle Isle Aquarium, Detroit;Detroit Riverwalk, Detroit;", "lunch": "Urban Punjab, Detroit", "dinner": "Frequent Bakes, Detroit", "accommodation": "Brooklyn Brownstone, 3-Bdr & Garden, Detroit"}]}]