[{"gpt-4-1106-preview_direct_sole-planning_results": "Travel Plan:\n\nDays: 1\nDate: March 24, 2022\nCurrent City: from Milwaukee to New York\nTransportation: Flight F3649645, from Milwaukee to New York, duration: 2 hours 32 minutes, cost: $180 per person\nBreakfast: -\nAttraction: -\nLunch: -\nDinner: Seasons 52 Fresh Grill, New York, cost: $30 per person, cuisines: Seafood, Indian, Desserts, Italian\nAccommodation: Beautiful and big 1BR sublet close by Central Park, New York, cost: $983 per night, room type: Private room, house rules: No parties & No children under 10, maximum occupancy: 2\n\nNumber of people: 2\nTotal cost: (Flight $180 x 2) + (Dinner $30 x 2) + Accommodation $983 = $1,403\nAccommodation minimum nights: 1/5\n\nDays: 2\nDate: March 25, 2022\nCurrent City: New York\nTransportation: -\nBreakfast: Lord of the Drinks Forum, New York, cost: $71 per person, cuisines: Cafe, Bakery, BBQ, Chinese, Indian\nAttraction: Central Park, New York; The Metropolitan Museum of Art, New York\nLunch: Gurgaon Hights, New York, cost: $46 per person, cuisines: Cafe, American, Indian, Fast Food\nDinner: Rambhog, New York, cost: $95 per person, cuisines: Tea, Seafood, Mexican, Fast Food\nAccommodation: Beautiful and big 1BR sublet close by Central Park, New York, cost: $983 per night, room type: Private room, house rules: No parties & No children under 10, maximum occupancy: 2\n\nNumber of people: 2\nTotal cost: (Breakfast $71 x 2) + (Lunch $46 x 2) + (Dinner $95 x 2) + Accommodation $983 = $1,407\nAccommodation minimum nights: 2/5\n\nDays: 3\nDate: March 26, 2022\nCurrent City: from New York to Milwaukee\nTransportation: Flight F3644990, from New York to Milwaukee, duration: 2 hours 7 minutes, cost: $218 per person\nBreakfast: Green Chick Chop, New York, cost: $26 per person, cuisines: Tea, French, Cafe, Seafood\nAttraction: -\nLunch: -\nDinner: -\nAccommodation: -\n\nNumber of people: 2\nTotal cost: (Flight $218 x 2) + (Breakfast $26 x 2) = $488\n\nTotal cost across all days: $1,403 + $1,407 + $488 = $3,298\n\n**Note: The total cost exceeds the specified budget of $1,900. Adjustments are required to meet the budget constraint.**\n\nAdjusted Travel Plan:\n\nDays: 1\nDate: March 24, 2022\nCurrent City: from Milwaukee to New York\nTransportation: Self-driving, from Milwaukee to New York, duration: 13 hours 29 mins, cost: $70 per person\nBreakfast: -\nAttraction: -\nLunch: -\nDinner: Seasons 52 Fresh Grill, New York, cost: $30 per person, cuisines: Seafood, Indian, Desserts, Italian\nAccommodation: A Contemporary Homelike Stay in the Best of BK, New York, cost: $228 per night, room type: Entire home/apt, house rules: No pets & No visitors & No children under 10, maximum occupancy: 2\n\nNumber of people: 2\nTotal cost: (Self-driving $70 x 2) + (Dinner $30 x 2) + Accommodation $228 = $428\nAccommodation minimum nights: 1/2\n\nDays: 2\nDate: March 25, 2022\nCurrent City: New York\nTransportation: -\nBreakfast: Lord of the Drinks Forum, New York, cost: $71 per person, cuisines: Cafe, Bakery, BBQ, Chinese, Indian\nAttraction: Central Park, New York; The Metropolitan Museum of Art, New York\nLunch: Gurgaon Hights, New York, cost: $46 per person, cuisines: Cafe, American, Indian, Fast Food\nDinner: Rambhog, New York, cost: $95 per person, cuisines: Tea, Seafood, Mexican, Fast Food\nAccommodation: A Contemporary Homelike Stay in the Best of BK, New York, cost: $228 per night, room type: Entire home/apt, house rules: No pets & No visitors & No children under 10, maximum occupancy: 2\n\nNumber of people: 2\nTotal cost: (Breakfast $71 x 2) + (Lunch $46 x 2) + (Dinner $95 x 2) + Accommodation $228 = $652\nAccommodation minimum nights: 2/2\n\nDays: 3\nDate: March 26, 2022\nCurrent City: from New York to Milwaukee\nTransportation: Self-driving, from New York to Milwaukee, duration: 13 hours 28 mins, cost: $70 per person\nBreakfast: Green Chick Chop, New York, cost: $26 per person, cuisines: Tea, French, Cafe, Seafood\nAttraction: -\nLunch: -\nDinner: -\nAccommodation: -\n\nNumber of people: 2\nTotal cost: (Self-driving $70 x 2) + (Breakfast $26 x 2) = $192\n\nTotal cost across all days: $428 + $652 + $192 = $1,272\n\nCuisines: The prompt specifies no cuisines, so all cuisine constraints are satisfied.", "gpt-4-1106-preview_direct_sole-planning_parsed_results": [{"day": 1, "current_city": "from Milwaukee to New York", "transportation": "Self-driving, from Milwaukee to New York, duration: 13 hours 29 mins", "breakfast": "-", "attraction": "-", "lunch": "-", "dinner": "Seasons 52 Fresh Grill, New York", "accommodation": "A Contemporary Homelike Stay in the Best of BK, New York"}, {"day": 2, "current_city": "New York", "transportation": "-", "breakfast": "Lord of the Drinks Forum, New York", "attraction": "Central Park, New York;The Metropolitan Museum of Art, New York;", "lunch": "Gurgaon Hights, New York", "dinner": "Rambhog, New York", "accommodation": "A Contemporary Homelike Stay in the Best of BK, New York"}, {"day": 3, "current_city": "from New York to Milwaukee", "transportation": "Self-driving, from New York to Milwaukee, duration: 13 hours 28 mins", "breakfast": "Green Chick Chop, New York", "attraction": "-", "lunch": "-", "dinner": "-", "accommodation": "-"}]}]