[{"gpt-4-1106-preview_direct_sole-planning_results": "Travel Plan:\n\nDays: 1\nCurrent City: from Sun Valley to San Diego, California\nTransportation: Self-driving, from Sun Valley to San Diego, duration: 14 hours 9 mins, distance: 1,461 km, cost: 73 x 7 = 511\nBreakfast: -\nAttraction: -\nLunch: -\nDinner: Gopala, San Diego, California, cost: 98 x 7 = 686, cuisines: Pizza, Mexican, BBQ, American, Seafood\nAccommodation: Spacious Room in Large 2 Bedroom Prewar Apartment, San Diego, California, cost: 585 x 7 = 4095, room type: Entire home/apt, house rules: No parties & No visitors, minimum nights: 1, maximum occupancy: 2\n\nNumber of people: 7\nTotal cost: 511 + 686 + 4095 = 5292\nAccommodation minimum nights: 1/1\n\nDays: 2\nCurrent City: San Diego, California\nTransportation: -\nBreakfast: Open Yard, San Diego, California, cost: 33 x 7 = 231, cuisines: Chinese, Pizza, Cafe, Desserts\nAttraction: Balboa Park, San Diego, California; USS Midway Museum, San Diego, California\nLunch: The Lost Mughal, San Diego, California, cost: 74 x 7 = 518, cuisines: Tea, Cafe, Italian\nDinner: Bikaner Sweets, San Diego, California, cost: 37 x 7 = 259, cuisines: Bakery, Pizza, Indian, Fast Food\nAccommodation: Spacious Room in Large 2 Bedroom Prewar Apartment, San Diego, California, cost: 585 x 7 = 4095, room type: Entire home/apt, house rules: No parties & No visitors, minimum nights: 1, maximum occupancy: 2\n\nNumber of people: 7\nTotal cost: 231 + 518 + 259 + 4095 = 5103\nAccommodation minimum nights: 2/1\n\nDays: 3\nCurrent City: from San Diego to Oakland, California\nTransportation: Self-driving, from San Diego to Oakland, duration: 7 hours 38 mins, distance: 789 km, cost: 39 x 7 = 273\nBreakfast: Harry's Bar + Cafe, San Diego, California, cost: 55 x 7 = 385, cuisines: Fast Food, French, Cafe, Seafood\nAttraction: -\nLunch: -\nDinner: Cho Gao - Crowne Plaza Abu Dhabi, Oakland, California, cost: 52 x 7 = 364, cuisines: Tea, BBQ, Seafood\nAccommodation: Conveniently located 2 BR Time Square Apartment, Oakland, California, cost: 502 x 7 = 3514, room type: Entire home/apt, house rules: No parties & No smoking & No children under 10, minimum nights: 2, maximum occupancy: 4\n\nNumber of people: 7\nTotal cost: 273 + 385 + 364 + 3514 = 4536\nAccommodation minimum nights: 1/2\n\nDays: 4\nCurrent City: Oakland, California\nTransportation: -\nBreakfast: Pind Balluchi, Oakland, California, cost: 61 x 7 = 427, cuisines: Tea, Cafe, BBQ, Seafood\nAttraction: Oakland Zoo, Oakland, California; Chabot Space & Science Center, Oakland, California\nLunch: Malais By Anands, Oakland, California, cost: 37 x 7 = 259, cuisines: Tea, Cafe, Mexican, Pizza\nDinner: Jammu And Kashmir House, Oakland, California, cost: 100 x 7 = 700, cuisines: Tea, BBQ, American, Mediterranean, Seafood\nAccommodation: Conveniently located 2 BR Time Square Apartment, Oakland, California, cost: 502 x 7 = 3514, room type: Entire home/apt, house rules: No parties & No smoking & No children under 10, minimum nights: 2, maximum occupancy: 4\n\nNumber of people: 7\nTotal cost: 427 + 259 + 700 + 3514 = 4900\nAccommodation minimum nights: 2/2\n\nDays: 5\nCurrent City: from Oakland to Sun Valley\nTransportation: Self-driving, from Oakland to Sun Valley, duration: 11 hours 36 mins, distance: 1,204 km, cost: 60 x 7 = 420\nBreakfast: Katyani Rasoi, Oakland, California, cost: 34 x 7 = 238, cuisines: Tea, French, Bakery, BBQ, Indian, Seafood\nAttraction: -\nLunch: -\nDinner: -\nAccommodation: -\n\nNumber of people: 7\nTotal cost: 420 + 238 = 658\n\nTotal cost across all days: 5292 + 5103 + 4536 + 4900 + 658 = 20489\n\nCuisines: The prompt specifies Mediterranean, American, French, and Indian cuisines, and the selected restaurants match these requirements.\n\nPlease note that the total cost exceeds the specified budget of $11,400. Adjustments to the plan, such as changing accommodations or dining options, will be necessary to meet the budget constraint. Additionally, the accommodations selected do not allow parties, which is against the specified requirement. Further adjustments are needed to find accommodations that allow parties.", "gpt-4-1106-preview_direct_sole-planning_parsed_results": [{"day": 1, "current_city": "from Sun Valley to San Diego, California", "transportation": "Self-driving, from Sun Valley to San Diego, duration: 14 hours 9 mins, distance: 1,461 km", "breakfast": "-", "attraction": "-", "lunch": "-", "dinner": "Gopala, San Diego, California", "accommodation": "Spacious Room in Large 2 Bedroom Prewar Apartment, San Diego, California"}, {"day": 2, "current_city": "San Diego, California", "transportation": "-", "breakfast": "Open Yard, San Diego, California", "attraction": "Balboa Park, San Diego, California;USS Midway Museum, San Diego, California;", "lunch": "The Lost Mughal, San Diego, California", "dinner": "Bikaner Sweets, San Diego, California", "accommodation": "Spacious Room in Large 2 Bedroom Prewar Apartment, San Diego, California"}, {"day": 3, "current_city": "from San Diego to Oakland, California", "transportation": "Self-driving, from San Diego to Oakland, duration: 7 hours 38 mins, distance: 789 km", "breakfast": "Harry's Bar + Cafe, San Diego, California", "attraction": "-", "lunch": "-", "dinner": "Cho Gao - Crowne Plaza Abu Dhabi, Oakland, California", "accommodation": "Conveniently located 2 BR Time Square Apartment, Oakland, California"}, {"day": 4, "current_city": "Oakland, California", "transportation": "-", "breakfast": "Pind Balluchi, Oakland, California", "attraction": "Oakland Zoo, Oakland, California;Chabot Space & Science Center, Oakland, California;", "lunch": "Malais By Anands, Oakland, California", "dinner": "Jammu And Kashmir House, Oakland, California", "accommodation": "Conveniently located 2 BR Time Square Apartment, Oakland, California"}, {"day": 5, "current_city": "from Oakland to Sun Valley", "transportation": "Self-driving, from Oakland to Sun Valley, duration: 11 hours 36 mins, distance: 1,204 km", "breakfast": "Katyani Rasoi, Oakland, California", "attraction": "-", "lunch": "-", "dinner": "-", "accommodation": "-"}]}]