[{"gpt-4-1106-preview_direct_sole-planning_results": "Travel Plan:\n\nDays: 1\nCurrent City: from Harrisburg to Wichita Falls, Texas\nTransportation: Self-driving, from Harrisburg to Wichita Falls, duration: 20 hours 58 mins, distance: 2,283 km, cost: 114\nBreakfast: -\nAttraction: -\nLunch: -\nDinner: Mama's Boy Restaurant, Wichita Falls, Texas, cost: 25, cuisines: Bakery, BBQ\nAccommodation: Small, Cozy 1BD Apartment, Wichita Falls, Texas, cost: 712, room type: Entire home/apt, house rules: No parties & No smoking & No children under 10, maximum occupancy: 7\n\nNumber of people: 2\nTotal cost: (114 x 2) + (25 x 2) + (712 x 2) = 1,722\nAccommodation minimum nights: 1/3\n\nDays: 2\nCurrent City: Wichita Falls, Texas\nTransportation: -\nBreakfast: The Coffee Bean & Tea Leaf, Wichita Falls, Texas, cost: 21, cuisines: Chinese, Bakery, Desserts\nAttraction: Museum of North Texas History, Wichita Falls, Texas; River Bend Nature Center, Wichita Falls, Texas\nLunch: Tyre Patty, Wichita Falls, Texas, cost: 92, cuisines: Pizza, BBQ, Bakery, Chinese, American, Seafood\nDinner: Made In Punjab, Wichita Falls, Texas, cost: 37, cuisines: French, Bakery, Seafood\nAccommodation: Small, Cozy 1BD Apartment, Wichita Falls, Texas, cost: 712, room type: Entire home/apt, house rules: No parties & No smoking & No children under 10, maximum occupancy: 7\n\nNumber of people: 2\nTotal cost: (21 x 2) + (92 x 2) + (37 x 2) + (712 x 2) = 1,744\nAccommodation minimum nights: 2/3\n\nDays: 3\nCurrent City: from Wichita Falls to Waco, Texas\nTransportation: Self-driving, from Wichita Falls to Waco, duration: 3 hours 2 mins, distance: 327 km, cost: 16\nBreakfast: Juice Lounge, Wichita Falls, Texas, cost: 68, cuisines: Cafe, Indian, Seafood\nAttraction: Dr Pepper Museum, Waco, Texas; Cameron Park Zoo, Waco, Texas\nLunch: Blue House Cafe, Waco, Texas, cost: 55, cuisines: Tea, Pizza, Mexican, Cafe, Seafood\nDinner: Fork, Waco, Texas, cost: 58, cuisines: Tea, French, Mediterranean, Seafood\nAccommodation: Sonder | 21 Chelsea | Central 1BR + Rooftop, Waco, Texas, cost: 1105, room type: Entire home/apt, house rules: No visitors & No smoking & No children under 10, maximum occupancy: 9\n\nNumber of people: 2\nTotal cost: (16 x 2) + (68 x 2) + (55 x 2) + (58 x 2) + (1105 x 2) = 2,414\nAccommodation minimum nights: 1/29\n\nDays: 4\nCurrent City: Waco, Texas\nTransportation: -\nBreakfast: Kishu Di Hatti Sweets, Waco, Texas, cost: 15, cuisines: Pizza, Bakery, Mediterranean\nAttraction: Waco Mammoth National Monument, Waco, Texas; Mayborn Museum Complex, Waco, Texas\nLunch: Punjabi Rasoi, Waco, Texas, cost: 70, cuisines: Fast Food, Cafe, Bakery, Seafood\nDinner: Blue House Cafe, Waco, Texas, cost: 55, cuisines: Tea, Pizza, Mexican, Cafe, Seafood (repeated due to limited options)\nAccommodation: Sonder | 21 Chelsea | Central 1BR + Rooftop, Waco, Texas, cost: 1105, room type: Entire home/apt, house rules: No visitors & No smoking & No children under 10, maximum occupancy: 9\n\nNumber of people: 2\nTotal cost: (15 x 2) + (70 x 2) + (55 x 2) + (1105 x 2) = 2,490\nAccommodation minimum nights: 2/29\n\nDays: 5\nCurrent City: from Waco to Houston, Texas\nTransportation: Self-driving, from Waco to Houston, duration: 2 hours 50 mins, distance: 298 km, cost: 14\nBreakfast: First Gear Cafe, Waco, Texas, cost: 76, cuisines: Desserts, Tea, Fast Food, Chinese, Seafood\nAttraction: Space Center Houston, Houston, Texas; Water Wall, Houston, Texas\nLunch: Jalapenos, Houston, Texas, cost: 57, cuisines: Desserts, Tea, Cafe, Chinese, Seafood\nDinner: Matchbox, Houston, Texas, cost: 33, cuisines: Tea, Italian, Bakery, Fast Food, Seafood\nAccommodation: Sunny and Airy near Manhattan, Houston, Texas, cost: 499, room type: Entire home/apt, house rules: No pets, maximum occupancy: 4\n\nNumber of people: 2\nTotal cost: (14 x 2) + (76 x 2) + (57 x 2) + (33 x 2) + (499 x 2) = 1,358\nAccommodation minimum nights: 1/2\n\nDays: 6\nCurrent City: Houston, Texas\nTransportation: -\nBreakfast: Super Bakery, Houston, Texas, cost: 30, cuisines: Seafood, Fast Food\nAttraction: Houston Museum of Natural Science, Houston, Texas; Houston Zoo, Houston, Texas\nLunch: Sheetla Dhaba, Houston, Texas, cost: 35, cuisines: Desserts, Pizza, Bakery, American, Mediterranean\nDinner: Royal Mart, Houston, Texas, cost: 40, cuisines: Tea, Bakery, Cafe, Mediterranean, Seafood\nAccommodation: Sunny and Airy near Manhattan, Houston, Texas, cost: 499, room type: Entire home/apt, house rules: No pets, maximum occupancy: 4\n\nNumber of people: 2\nTotal cost: (30 x 2) + (35 x 2) + (40 x 2) + (499 x 2) = 1,208\nAccommodation minimum nights: 2/2\n\nDays: 7\nCurrent City: from Houston to Harrisburg\nTransportation: Self-driving, from Houston to Harrisburg, duration: 21 hours 16 mins, distance: 2,353 km, cost: 117\nBreakfast: Earthen Spices, Houston, Texas, cost: 28, cuisines: Tea, Mexican, Bakery, BBQ, Fast Food\nAttraction: -\nLunch: -\nDinner: -\nAccommodation: -\n\nNumber of people: 2\nTotal cost: (117 x 2) + (28 x 2) = 290\n\nTotal cost across all days: 1,722 + 1,744 + 2,414 + 2,490 + 1,358 + 1,208 + 290 = 11,226\n\nCuisines: Preference for Italian and French cuisines has been considered where possible.\n\nPlease note that the total cost exceeds the specified budget of $4,100. Adjustments to the plan, such as changing accommodation or dining options, may be necessary to meet the budget constraint. Additionally, some restaurants were repeated due to limited options available that match the cuisine preferences.", "gpt-4-1106-preview_direct_sole-planning_parsed_results": [{"day": 1, "current_city": "from Harrisburg to Wichita Falls, Texas", "transportation": "Self-driving, from Harrisburg to Wichita Falls, duration: 20 hours 58 mins, distance: 2,283 km", "breakfast": "-", "attraction": "-", "lunch": "-", "dinner": "Mama's Boy Restaurant, Wichita Falls, Texas", "accommodation": "Small, Cozy 1BD Apartment, Wichita Falls, Texas"}, {"day": 2, "current_city": "Wichita Falls, Texas", "transportation": "-", "breakfast": "The Coffee Bean & Tea Leaf, Wichita Falls, Texas", "attraction": "Museum of North Texas History, Wichita Falls, Texas;River Bend Nature Center, Wichita Falls, Texas", "lunch": "Tyre Patty, Wichita Falls, Texas", "dinner": "Made In Punjab, Wichita Falls, Texas", "accommodation": "Small, Cozy 1BD Apartment, Wichita Falls, Texas"}, {"day": 3, "current_city": "from Wichita Falls to Waco, Texas", "transportation": "Self-driving, from Wichita Falls to Waco, duration: 3 hours 2 mins, distance: 327 km", "breakfast": "Juice Lounge, Wichita Falls, Texas", "attraction": "Dr Pepper Museum, Waco, Texas;Cameron Park Zoo, Waco, Texas", "lunch": "Blue House Cafe, Waco, Texas", "dinner": "Fork, Waco, Texas", "accommodation": "Sonder | 21 Chelsea | Central 1BR + Rooftop, Waco, Texas"}, {"day": 4, "current_city": "Waco, Texas", "transportation": "-", "breakfast": "Kishu Di Hatti Sweets, Waco, Texas", "attraction": "Waco Mammoth National Monument, Waco, Texas;Mayborn Museum Complex, Waco, Texas", "lunch": "Punjabi Rasoi, Waco, Texas", "dinner": "Blue House Cafe, Waco, Texas", "accommodation": "Sonder | 21 Chelsea | Central 1BR + Rooftop, Waco, Texas"}, {"day": 5, "current_city": "from Waco to Houston, Texas", "transportation": "Self-driving, from Waco to Houston, duration: 2 hours 50 mins, distance: 298 km", "breakfast": "First Gear Cafe, Waco, Texas", "attraction": "Space Center Houston, Houston, Texas;Water Wall, Houston, Texas", "lunch": "Jalapenos, Houston, Texas", "dinner": "Matchbox, Houston, Texas", "accommodation": "Sunny and Airy near Manhattan, Houston, Texas"}, {"day": 6, "current_city": "Houston, Texas", "transportation": "-", "breakfast": "Super Bakery, Houston, Texas", "attraction": "Houston Museum of Natural Science, Houston, Texas;Houston Zoo, Houston, Texas", "lunch": "Sheetla Dhaba, Houston, Texas", "dinner": "Royal Mart, Houston, Texas", "accommodation": "Sunny and Airy near Manhattan, Houston, Texas"}, {"day": 7, "current_city": "from Houston to Harrisburg", "transportation": "Self-driving, from Houston to Harrisburg, duration: 21 hours 16 mins, distance: 2,353 km", "breakfast": "Earthen Spices, Houston, Texas", "attraction": "-", "lunch": "-", "dinner": "-", "accommodation": "-"}]}]