[{"gpt-4-1106-preview_direct_sole-planning_results": "Travel Plan:\n\nDays: 1\nCurrent City: from Las Vegas to Twin Falls, Idaho\nTransportation: Self-driving, from Las Vegas to Twin Falls, duration: 7 hours 32 mins, distance: 796 km, cost: 39\nBreakfast: -\nAttraction: -\nLunch: -\nDinner: -\nAccommodation: Charming studio, great location!!!, Twin Falls, Idaho, cost: 994, room type: Entire home/apt, house rules: No smoking & No pets, minimum nights: 2, maximum occupancy: 8\n\nNumber of people: 2\nTotal cost: (39 x 2) + (994 x 1) = 1072\nAccommodation minimum nights: 1/2\n\nDays: 2\nCurrent City: Twin Falls, Idaho\nTransportation: -\nBreakfast: Kaushik Bakery, Twin Falls, Idaho, cost: 29, cuisines: Cafe, Pizza, Italian\nAttraction: Shoshone Falls Park, Twin Falls; Snake River Canyon Rim Trail, Twin Falls\nLunch: Thai Paradise, Twin Falls, Idaho, cost: 87, cuisines: Fast Food, Indian, Desserts, Seafood\nDinner: Asia Kitchen, Twin Falls, Idaho, cost: 67, cuisines: Tea, Cafe, BBQ, Desserts\nAccommodation: Charming studio, great location!!!, Twin Falls, Idaho, cost: 994, room type: Entire home/apt, house rules: No smoking & No pets, minimum nights: 2, maximum occupancy: 8\n\nNumber of people: 2\nTotal cost: (29 x 2) + (87 x 2) + (67 x 2) + (994 x 1) = 1370\nAccommodation minimum nights: 2/2\n\nDays: 3\nCurrent City: from Twin Falls, Idaho to Pocatello, Idaho\nTransportation: Self-driving, from Twin Falls to Pocatello, duration: 1 hour 46 mins, distance: 183 km, cost: 9\nBreakfast: Mittal Fast Food, Twin Falls, Idaho, cost: 83, cuisines: Cafe, Seafood, Desserts, Italian\nAttraction: Idaho Museum of Natural History, Pocatello; Zoo Idaho, Pocatello\nLunch: Harvest Moon, Pocatello, Idaho, cost: 90, cuisines: Pizza, Fast Food\nDinner: Deorio's, Pocatello, Idaho, cost: 59, cuisines: Tea, Bakery, Fast Food, Mediterranean, Seafood\nAccommodation: Large Comfortable Studio in Chelsea, Pocatello, Idaho, cost: 591, room type: Entire home/apt, house rules: No smoking, minimum nights: 2, maximum occupancy: 5\n\nNumber of people: 2\nTotal cost: (9 x 2) + (83 x 2) + (90 x 2) + (59 x 2) + (591 x 1) = 1064\nAccommodation minimum nights: 1/2\n\nDays: 4\nCurrent City: Pocatello, Idaho\nTransportation: -\nBreakfast: Ghar Ki Handi, Pocatello, Idaho, cost: 13, cuisines: Cafe, Bakery, American, Fast Food\nAttraction: Museum of Clean, Pocatello; Fort Hall Replica and Commemorative Trading Post, Pocatello\nLunch: 650 - The Global Kitchen, Pocatello, Idaho, cost: 83, cuisines: French, Bakery, Cafe\nDinner: The Baking Treats N More, Pocatello, Idaho, cost: 75, cuisines: Cafe, Bakery, Fast Food\nAccommodation: Large Comfortable Studio in Chelsea, Pocatello, Idaho, cost: 591, room type: Entire home/apt, house rules: No smoking, minimum nights: 2, maximum occupancy: 5\n\nNumber of people: 2\nTotal cost: (13 x 2) + (83 x 2) + (75 x 2) + (591 x 1) = 933\nAccommodation minimum nights: 2/2\n\nDays: 5\nCurrent City: from Pocatello, Idaho to Boise, Idaho\nTransportation: Self-driving, from Pocatello to Boise, duration: 3 hours 23 mins, distance: 377 km, cost: 18\nBreakfast: Oriental Kitchen Express, Pocatello, Idaho, cost: 36, cuisines: Cafe, Bakery, Desserts\nAttraction: Zoo Boise, Boise; Idaho State Museum, Boise\nLunch: Gopala Hari, Boise, Idaho, cost: 28, cuisines: Tea, Pizza, Italian, Fast Food, Mediterranean, Seafood\nDinner: TGI Friday's, Boise, Idaho, cost: 33, cuisines: Cafe, Mexican, BBQ, Fast Food\nAccommodation: Modern & Cozy 2 BR Private Apartment in Brooklyn, Boise, Idaho, cost: 843, room type: Entire home/apt, house rules: No children under 10, minimum nights: 2645, maximum occupancy: 7\n\nNumber of people: 2\nTotal cost: (18 x 2) + (36 x 2) + (28 x 2) + (33 x 2) + (843 x 1) = 1043\nAccommodation minimum nights: 1/2645\n\nDays: 6\nCurrent City: Boise, Idaho\nTransportation: -\nBreakfast: California Pizza Kitchen, Boise, Idaho, cost: 15, cuisines: Tea, BBQ, Fast Food, Chinese, Indian\nAttraction: Julia Davis Park, Boise; Boise Art Museum, Boise\nLunch: Dhaba By Claridges, Boise, Idaho, cost: 65, cuisines: Desserts, Italian, Fast Food, Chinese, Seafood\nDinner: 19 Flavours Biryani, Boise, Idaho, cost: 59, cuisines: Cafe, BBQ, Seafood\nAccommodation: Modern & Cozy 2 BR Private Apartment in Brooklyn, Boise, Idaho, cost: 843, room type: Entire home/apt, house rules: No children under 10, minimum nights: 2645, maximum occupancy: 7\n\nNumber of people: 2\nTotal cost: (15 x 2) + (65 x 2) + (59 x 2) + (843 x 1) = 1114\nAccommodation minimum nights: 2/2645\n\nDays: 7\nCurrent City: from Boise, Idaho to Las Vegas\nTransportation: Self-driving, from Boise to Las Vegas, duration: 9 hours 30 mins, distance: 1,004 km, cost: 50\nBreakfast: -\nAttraction: -\nLunch: -\nDinner: -\nAccommodation: -\n\nNumber of people: 2\nTotal cost: 50 x 2 = 100\n\nTotal cost across all days: 1072 + 1370 + 1064 + 933 + 1043 + 1114 + 100 = 6696\n\nUnfortunately, the total cost of $6696 exceeds the specified budget of $5100. To adjust the plan within the budget, we may need to consider different accommodations or reduce meal costs. Please let me know if you would like me to rework the plan to fit within the budget.", "gpt-4-1106-preview_direct_sole-planning_parsed_results": [{"day": 1, "current_city": "from Las Vegas to Twin Falls, Idaho", "transportation": "Self-driving, from Las Vegas to Twin Falls, duration: 7 hours 32 mins, distance: 796 km", "breakfast": "-", "attraction": "-", "lunch": "-", "dinner": "-", "accommodation": "Charming studio, great location!!!, Twin Falls, Idaho"}, {"day": 2, "current_city": "Twin Falls, Idaho", "transportation": "-", "breakfast": "Kaushik Bakery, Twin Falls, Idaho", "attraction": "Shoshone Falls Park, Twin Falls;Snake River Canyon Rim Trail, Twin Falls", "lunch": "Thai Paradise, Twin Falls, Idaho", "dinner": "Asia Kitchen, Twin Falls, Idaho", "accommodation": "Charming studio, great location!!!, Twin Falls, Idaho"}, {"day": 3, "current_city": "from Twin Falls, Idaho to Pocatello, Idaho", "transportation": "Self-driving, from Twin Falls to Pocatello, duration: 1 hour 46 mins, distance: 183 km", "breakfast": "Mittal Fast Food, Twin Falls, Idaho", "attraction": "Idaho Museum of Natural History, Pocatello;Zoo Idaho, Pocatello", "lunch": "Harvest Moon, Pocatello, Idaho", "dinner": "Deorio's, Pocatello, Idaho", "accommodation": "Large Comfortable Studio in Chelsea, Pocatello, Idaho"}, {"day": 4, "current_city": "Pocatello, Idaho", "transportation": "-", "breakfast": "Ghar Ki Handi, Pocatello, Idaho", "attraction": "Museum of Clean, Pocatello;Fort Hall Replica and Commemorative Trading Post, Pocatello", "lunch": "650 - The Global Kitchen, Pocatello, Idaho", "dinner": "The Baking Treats N More, Pocatello, Idaho", "accommodation": "Large Comfortable Studio in Chelsea, Pocatello, Idaho"}, {"day": 5, "current_city": "from Pocatello, Idaho to Boise, Idaho", "transportation": "Self-driving, from Pocatello to Boise, duration: 3 hours 23 mins, distance: 377 km", "breakfast": "Oriental Kitchen Express, Pocatello, Idaho", "attraction": "Zoo Boise, Boise;Idaho State Museum, Boise", "lunch": "Gopala Hari, Boise, Idaho", "dinner": "TGI Friday's, Boise, Idaho", "accommodation": "Modern & Cozy 2 BR Private Apartment in Brooklyn, Boise, Idaho"}, {"day": 6, "current_city": "Boise, Idaho", "transportation": "-", "breakfast": "California Pizza Kitchen, Boise, Idaho", "attraction": "Julia Davis Park, Boise;Boise Art Museum, Boise", "lunch": "Dhaba By Claridges, Boise, Idaho", "dinner": "19 Flavours Biryani, Boise, Idaho", "accommodation": "Modern & Cozy 2 BR Private Apartment in Brooklyn, Boise, Idaho"}, {"day": 7, "current_city": "from Boise, Idaho to Las Vegas", "transportation": "Self-driving, from Boise to Las Vegas, duration: 9 hours 30 mins, distance: 1,004 km", "breakfast": "-", "attraction": "-", "lunch": "-", "dinner": "-", "accommodation": "-"}]}]