[{"gpt-4-1106-preview_direct_sole-planning_results": "Travel Plan:\n\nDays: 1\nCurrent City: from Charlotte to Marquette, Wisconsin\nTransportation: Self-driving, from Charlotte to Marquette, duration: 13 hours 1 min, distance: 1,371 km, cost: 68\nBreakfast: -\nAttraction: -\nLunch: -\nDinner: -\nAccommodation: Huge Private Room Near Prospect Park, Marquette, Wisconsin, cost: 73, room type: Private room, house rules: No smoking & No visitors, minimum nights: 7, maximum occupancy: 2\n\nNumber of people: 2\nTotal cost: 68 x 2 + 73 x 2 = 282\nAccommodation minimum nights: 1/7\n\nDays: 2\nCurrent City: Marquette, Wisconsin\nTransportation: -\nBreakfast: The Chop House, Marquette, Wisconsin, cost: 81, cuisines: Desserts, Tea, Pizza, Mexican, Bakery, Indian\nAttraction: Presque Isle Park, Marquette; Marquette Harbor Lighthouse, Marquette\nLunch: Taste of Balingup, Marquette, Wisconsin, cost: 35, cuisines: BBQ, Desserts\nDinner: Dovetail, Marquette, Wisconsin, cost: 95, cuisines: Fast Food, Indian, BBQ, Italian\nAccommodation: Huge Private Room Near Prospect Park, Marquette, Wisconsin, cost: 73, room type: Private room, house rules: No smoking & No visitors, minimum nights: 7, maximum occupancy: 2\n\nNumber of people: 2\nTotal cost: 81 x 2 + 35 x 2 + 95 x 2 + 73 x 2 = 568\nAccommodation minimum nights: 2/7\n\nDays: 3\nCurrent City: from Marquette to Milwaukee, Wisconsin\nTransportation: Self-driving, from Marquette to Milwaukee, duration: 6 mins, distance: 2.0 km, cost: 0\nBreakfast: Papa Mexicano, Marquette, Wisconsin, cost: 17, cuisines: Italian, Bakery, BBQ, Fast Food, Seafood\nAttraction: Milwaukee Art Museum, Milwaukee; Milwaukee Public Museum, Milwaukee\nLunch: Cool Basil, Milwaukee, Wisconsin, cost: 40, cuisines: Chinese, Pizza, French, Fast Food, Cafe\nDinner: Berco's, Milwaukee, Wisconsin, cost: 91, cuisines: Desserts, Pizza, Italian, Cafe, Seafood\nAccommodation: Affordable bedroom in the East Village!, Milwaukee, Wisconsin, cost: 184, room type: Private room, house rules: No parties, minimum nights: 2, maximum occupancy: 2\n\nNumber of people: 2\nTotal cost: 17 x 2 + 40 x 2 + 91 x 2 + 184 x 2 = 664\nAccommodation minimum nights: 1/2\n\nDays: 4\nCurrent City: Milwaukee, Wisconsin\nTransportation: -\nBreakfast: Subway, Milwaukee, Wisconsin, cost: 48, cuisines: Tea, BBQ, Desserts\nAttraction: North Point Lighthouse, Milwaukee; Milwaukee County Zoo, Milwaukee\nLunch: Shankar Sweets, Milwaukee, Wisconsin, cost: 66, cuisines: Tea, Bakery, Pizza, Fast Food\nDinner: Red, Milwaukee, Wisconsin, cost: 98, cuisines: Desserts, BBQ, Fast Food, Cafe, Mediterranean\nAccommodation: Affordable bedroom in the East Village!, Milwaukee, Wisconsin, cost: 184, room type: Private room, house rules: No parties, minimum nights: 2, maximum occupancy: 2\n\nNumber of people: 2\nTotal cost: 48 x 2 + 66 x 2 + 98 x 2 + 184 x 2 = 792\nAccommodation minimum nights: 2/2\n\nDays: 5\nCurrent City: from Milwaukee to Charlotte\nTransportation: Self-driving, from Milwaukee to Charlotte, duration: 12 hours 58 mins, distance: 1,369 km, cost: 68\nBreakfast: Frontier, Milwaukee, Wisconsin, cost: 13, cuisines: Fast Food, Seafood, Tea, Italian\nAttraction: -\nLunch: -\nDinner: -\nAccommodation: -\n\nNumber of people: 2\nTotal cost: 68 x 2 + 13 x 2 = 162\n\nTotal cost across all days: 282 + 568 + 664 + 792 + 162 = 2,468\nCuisines: The prompt specifies no cuisines, so all cuisine constraints are satisfied\nAccommodation: All accommodations are child-friendly and provide private rooms, adhering to the specified constraints.", "gpt-4-1106-preview_direct_sole-planning_parsed_results": [{"day": 1, "current_city": "from Charlotte to Marquette, Wisconsin", "transportation": "Self-driving, from Charlotte to Marquette, duration: 13 hours 1 min, distance: 1,371 km", "breakfast": "-", "attraction": "-", "lunch": "-", "dinner": "-", "accommodation": "Huge Private Room Near Prospect Park, Marquette, Wisconsin"}, {"day": 2, "current_city": "Marquette, Wisconsin", "transportation": "-", "breakfast": "The Chop House, Marquette, Wisconsin", "attraction": "Presque Isle Park, Marquette;Marquette Harbor Lighthouse, Marquette;", "lunch": "Taste of Balingup, Marquette, Wisconsin", "dinner": "Dovetail, Marquette, Wisconsin", "accommodation": "Huge Private Room Near Prospect Park, Marquette, Wisconsin"}, {"day": 3, "current_city": "from Marquette to Milwaukee, Wisconsin", "transportation": "Self-driving, from Marquette to Milwaukee, duration: 6 mins, distance: 2.0 km", "breakfast": "Papa Mexicano, Marquette, Wisconsin", "attraction": "Milwaukee Art Museum, Milwaukee;Milwaukee Public Museum, Milwaukee;", "lunch": "Cool Basil, Milwaukee, Wisconsin", "dinner": "Berco's, Milwaukee, Wisconsin", "accommodation": "Affordable bedroom in the East Village!, Milwaukee, Wisconsin"}, {"day": 4, "current_city": "Milwaukee, Wisconsin", "transportation": "-", "breakfast": "Subway, Milwaukee, Wisconsin", "attraction": "North Point Lighthouse, Milwaukee;Milwaukee County Zoo, Milwaukee;", "lunch": "Shankar Sweets, Milwaukee, Wisconsin", "dinner": "Red, Milwaukee, Wisconsin", "accommodation": "Affordable bedroom in the East Village!, Milwaukee, Wisconsin"}, {"day": 5, "current_city": "from Milwaukee to Charlotte", "transportation": "Self-driving, from Milwaukee to Charlotte, duration: 12 hours 58 mins, distance: 1,369 km", "breakfast": "Frontier, Milwaukee, Wisconsin", "attraction": "-", "lunch": "-", "dinner": "-", "accommodation": "-"}]}]