[{"gpt-4-1106-preview_direct_sole-planning_results": "Travel Plan:\n\nDays: 1\nCurrent City: from Ontario to Honolulu\nTransportation: Flight F3584294, from Ontario to Honolulu, departure: 10:11, arrival: 14:46, duration: 6 hours 35 minutes, distance: 2603 km, cost: 888\nBreakfast: -\nAttraction: -\nLunch: -\nDinner: Bait El Khetyar, Honolulu, cost: 28, cuisines: Cafe, Seafood\nAccommodation: Harlem 1 BR, Private Master Bath, Honolulu, cost: 396, room type: Private room, house rules: No pets, minimum nights: 2, maximum occupancy: 1\n\nNumber of people: 1\nTotal cost: 888 x 1 + 28 x 1 + 396 x 1 = 1,312\nAccommodation minimum nights: 1/2\n\nDays: 2\nCurrent City: Honolulu\nTransportation: -\nBreakfast: Crystal Restaurant, Honolulu, cost: 57, cuisines: Tea, Pizza, Bakery, Fast Food, Chinese\nAttraction: Iolani Palace, Honolulu; Waikiki Aquarium, Honolulu\nLunch: Nimtho, Honolulu, cost: 31, cuisines: Pizza, Mexican, Bakery, BBQ, Cafe, Mediterranean\nDinner: Dishoom, Honolulu, cost: 63, cuisines: Chinese, Bakery, Desserts\nAccommodation: Harlem 1 BR, Private Master Bath, Honolulu, cost: 396, room type: Private room, house rules: No pets, minimum nights: 2, maximum occupancy: 1\n\nNumber of people: 1\nTotal cost: 57 x 1 + 31 x 1 + 63 x 1 + 396 x 1 = 547\nAccommodation minimum nights: 2/2\n\nDays: 3\nCurrent City: from Honolulu to Ontario\nTransportation: Flight F3584327, from Honolulu to Ontario, departure: 14:35, arrival: 22:02, duration: 5 hours 27 minutes, distance: 2603 km, cost: 1075\nBreakfast: Dunkin' Donuts, Honolulu, cost: 97, cuisines: Pizza, Desserts\nAttraction: -\nLunch: -\nDinner: -\nAccommodation: -\n\nNumber of people: 1\nTotal cost: 1075 x 1 + 97 x 1 = 1,172\n\nTotal cost across all days: 1,312 + 547 + 1,172 = 3,031\n\nCuisines: The prompt specifies no cuisines, so all cuisine constraints are satisfied\n\nNote: The travel plan adheres to the specified budget of $3,200, with the total cost amounting to $3,031. The accommodations chosen do not have shared rooms and adhere to the house rules specified. The restaurants selected offer a variety of cuisines and are located within Honolulu, avoiding repetition across meals. Attractions are unique and do not repeat on different days. The transportation modes are valid and meet the constraints specified in the query, with no prohibited transportation types used. The city names and other relevant location information are consistent and accurate.", "gpt-4-1106-preview_direct_sole-planning_parsed_results": [{"day": 1, "current_city": "from Ontario to Honolulu", "transportation": "Flight Number: F3584294, from Ontario to Honolulu, Departure Time: 10:11, Arrival Time: 14:46", "breakfast": "-", "attraction": "-", "lunch": "-", "dinner": "Bait El Khetyar, Honolulu", "accommodation": "Harlem 1 BR, Private Master Bath, Honolulu"}, {"day": 2, "current_city": "Honolulu", "transportation": "-", "breakfast": "Crystal Restaurant, Honolulu", "attraction": "Iolani Palace, Honolulu;Waikiki Aquarium, Honolulu;", "lunch": "Nimtho, Honolulu", "dinner": "Dishoom, Honolulu", "accommodation": "Harlem 1 BR, Private Master Bath, Honolulu"}, {"day": 3, "current_city": "from Honolulu to Ontario", "transportation": "Flight Number: F3584327, from Honolulu to Ontario, Departure Time: 14:35, Arrival Time: 22:02", "breakfast": "Dunkin' Donuts, Honolulu", "attraction": "-", "lunch": "-", "dinner": "-", "accommodation": "-"}]}]