[{"gpt-4-1106-preview_direct_sole-planning_results": "Travel Plan:\n\nDays: 1\nCurrent City: from Salt Lake City to Abilene, Texas\nTransportation: Self-driving, from Salt Lake City to Abilene, duration: 16 hours 59 mins, distance: 1,740 km, cost: 87 x 8 = 696\nBreakfast: -\nAttraction: -\nLunch: -\nDinner: -\nAccommodation: Apartment minutes from manhattan, Abilene, Texas, cost: 295 x 4 = 1180, maximum occupancy: 2, house rules: No pets & No visitors, minimum nights: 2\n\nNumber of people: 8\nTotal cost: 696 + 1180 = 1876\nAccommodation minimum nights: 1/2\n\nDays: 2\nCurrent City: Abilene, Texas\nTransportation: -\nBreakfast: Thai Garden, Abilene, Texas, cost: 13 x 8 = 104, cuisines: Cafe, American, Desserts\nAttraction: The Grace Museum, Abilene; Frontier Texas!\nLunch: Crispy Crust, Abilene, Texas, cost: 54 x 8 = 432, cuisines: Desserts, Bakery, Cafe, American, Seafood\nDinner: LPK Waterfront, Abilene, Texas, cost: 61 x 8 = 488, cuisines: Pizza, Italian, BBQ, Fast Food, Seafood\nAccommodation: Apartment minutes from manhattan, Abilene, Texas, cost: 295 x 4 = 1180, maximum occupancy: 2, house rules: No pets & No visitors, minimum nights: 2\n\nNumber of people: 8\nTotal cost: 104 + 432 + 488 + 1180 = 2204\nAccommodation minimum nights: 2/2\n\nDays: 3\nCurrent City: from Abilene, Texas to Amarillo, Texas\nTransportation: Self-driving, from Abilene to Amarillo, duration: 4 hours 10 mins, distance: 446 km, cost: 22 x 8 = 176\nBreakfast: Biryani Express, Abilene, Texas, cost: 11 x 8 = 88, cuisines: Tea, Pizza, French, Bakery, Fast Food\nAttraction: Cadillac Ranch, Amarillo; Amarillo Botanical Gardens\nLunch: The Cinnamon Kitchen, Amarillo, Texas, cost: 69 x 8 = 552, cuisines: Desserts, Tea, Pizza, Chinese, Seafood\nDinner: Komachi, Amarillo, Texas, cost: 71 x 8 = 568, cuisines: Desserts, Tea, Fast Food, Chinese, Mediterranean\nAccommodation: Gramercy Park restful, cozy, sun-filled home, Amarillo, Texas, cost: 968 x 2 = 1936, maximum occupancy: 8, house rules: No parties, minimum nights: 2\n\nNumber of people: 8\nTotal cost: 176 + 88 + 552 + 568 + 1936 = 3320\nAccommodation minimum nights: 1/2\n\nDays: 4\nCurrent City: Amarillo, Texas\nTransportation: -\nBreakfast: Wood Box Cafe, Amarillo, Texas, cost: 11 x 8 = 88, cuisines: Desserts, French, Fast Food, Cafe, American\nAttraction: Amarillo Zoo; Don Harrington Discovery Center\nLunch: Sigree Global Grill, Amarillo, Texas, cost: 35 x 8 = 280, cuisines: Chinese, BBQ, Cafe, Desserts\nDinner: Anand Restaurant, Amarillo, Texas, cost: 53 x 8 = 424, cuisines: Fast Food, Seafood, Desserts, Italian\nAccommodation: Gramercy Park restful, cozy, sun-filled home, Amarillo, Texas, cost: 968 x 2 = 1936, maximum occupancy: 8, house rules: No parties, minimum nights: 2\n\nNumber of people: 8\nTotal cost: 88 + 280 + 424 + 1936 = 2728\nAccommodation minimum nights: 2/2\n\nDays: 5\nCurrent City: from Amarillo, Texas to Salt Lake City\nTransportation: Self-driving, from Amarillo to Salt Lake City, duration: 13 hours 45 mins, distance: 1,419 km, cost: 70 x 8 = 560\nBreakfast: Guru Om Vanna, Amarillo, Texas, cost: 43 x 8 = 344, cuisines: Desserts, Tea, Bakery, Indian, Seafood\nAttraction: -\nLunch: -\nDinner: -\nAccommodation: -\n\nNumber of people: 8\nTotal cost: 560 + 344 = 904\n\nTotal cost across all days: 1876 + 2204 + 3320 + 2728 + 904 = 11032\n\nCuisines: The prompt specifies no cuisines, so all cuisine constraints are satisfied\n\nNote: The accommodations selected have a \"No visitors\" house rule, which may not align with the \"visitors-friendly\" requirement. However, due to the lack of available options that meet this specific requirement in the provided data, this was the best possible match. Adjustments may be necessary based on actual availability and house rules.", "gpt-4-1106-preview_direct_sole-planning_parsed_results": [{"day": 1, "current_city": "from Salt Lake City to Abilene, Texas", "transportation": "Self-driving, from Salt Lake City to Abilene, duration: 16 hours 59 mins, distance: 1,740 km", "breakfast": "-", "attraction": "-", "lunch": "-", "dinner": "-", "accommodation": "Apartment minutes from manhattan, Abilene, Texas"}, {"day": 2, "current_city": "Abilene, Texas", "transportation": "-", "breakfast": "Thai Garden, Abilene, Texas", "attraction": "The Grace Museum, Abilene;Frontier Texas!, Abilene;", "lunch": "Crispy Crust, Abilene, Texas", "dinner": "LPK Waterfront, Abilene, Texas", "accommodation": "Apartment minutes from manhattan, Abilene, Texas"}, {"day": 3, "current_city": "from Abilene, Texas to Amarillo, Texas", "transportation": "Self-driving, from Abilene to Amarillo, duration: 4 hours 10 mins, distance: 446 km", "breakfast": "Biryani Express, Abilene, Texas", "attraction": "Cadillac Ranch, Amarillo;Amarillo Botanical Gardens, Amarillo;", "lunch": "The Cinnamon Kitchen, Amarillo, Texas", "dinner": "Komachi, Amarillo, Texas", "accommodation": "Gramercy Park restful, cozy, sun-filled home, Amarillo, Texas"}, {"day": 4, "current_city": "Amarillo, Texas", "transportation": "-", "breakfast": "Wood Box Cafe, Amarillo, Texas", "attraction": "Amarillo Zoo, Amarillo;Don Harrington Discovery Center, Amarillo;", "lunch": "Sigree Global Grill, Amarillo, Texas", "dinner": "Anand Restaurant, Amarillo, Texas", "accommodation": "Gramercy Park restful, cozy, sun-filled home, Amarillo, Texas"}, {"day": 5, "current_city": "from Amarillo, Texas to Salt Lake City", "transportation": "Self-driving, from Amarillo to Salt Lake City, duration: 13 hours 45 mins, distance: 1,419 km", "breakfast": "Guru Om Vanna, Amarillo, Texas", "attraction": "-", "lunch": "-", "dinner": "-", "accommodation": "-"}]}]