[{"gpt-4-1106-preview_direct_sole-planning_results": "Travel Plan:\n\nDays: 1\nCurrent City: from Newark to Savannah\nTransportation: Flight F4070527, from Newark to Savannah, duration: 2 hours 33 minutes, cost: $242 per person\nBreakfast: -\nAttraction: Forsyth Park, Savannah\nLunch: Sr. Sol, Savannah, Georgia, cost: $30, cuisines: Tea, French, Mediterranean, Desserts\nDinner: Bosphorous Turkish Cuisine, Savannah, Georgia, cost: $58, cuisines: Pizza, Indian, Fast Food\nAccommodation: Cosy Inwood apartment, Savannah, Georgia, cost: $413, room type: Private room, house rules: No children under 10, minimum nights: 1, maximum occupancy: 1\n\nNumber of people: 2\nTotal cost: (242 x 2) + (30 x 2) + (58 x 2) + 413 = $1,073\nAccommodation minimum nights: 1/1\n\nDays: 2\nCurrent City: Savannah\nTransportation: Taxi within Savannah (estimated cost for the day): $100\nBreakfast: Brown House Cafe, Savannah, Georgia, cost: $28, cuisines: Tea, Pizza, Mexican, Bakery, American, Seafood\nAttraction: Savannah Historic District, Savannah; Savannah's Waterfront, Savannah\nLunch: The Mad Teapot/The Wishing Chair, Savannah, Georgia, cost: $23, cuisines: Mexican, Bakery, Fast Food\nDinner: Manohar Dairy And Restaurant, Savannah, Georgia, cost: $23, cuisines: Tea, Indian, Fast Food\nAccommodation: Cosy Inwood apartment, Savannah, Georgia, cost: $413, room type: Private room, house rules: No children under 10, minimum nights: 1, maximum occupancy: 1\n\nNumber of people: 2\nTotal cost: 100 + (28 x 2) + (23 x 2) + (23 x 2) + 413 = $738\nAccommodation minimum nights: 2/1\n\nDays: 3\nCurrent City: from Savannah to Newark\nTransportation: Flight F3903501, from Savannah to Newark, duration: 2 hours 9 minutes, cost: $294 per person\nBreakfast: Dhaba On Wheels, Savannah, Georgia, cost: $18, cuisines: Tea, Bakery, Pizza, American\nAttraction: -\nLunch: -\nDinner: -\nAccommodation: -\n\nNumber of people: 2\nTotal cost: (294 x 2) + (18 x 2) = $624\n\nTotal cost across all days: $1,073 + $738 + $624 = $2,435\n\nUnfortunately, the total cost of $2,435 exceeds the specified budget of $1,400. To adjust the travel plan to fit within the budget, we need to make some changes:\n\n- We can switch to a less expensive accommodation that allows children under 10 and adjust the meal costs accordingly.\n- We may need to choose a less expensive transportation option within Savannah or limit taxi use.\n\nRevised Travel Plan:\n\nDays: 1\nCurrent City: from Newark to Savannah\nTransportation: Flight F4070527, from Newark to Savannah, duration: 2 hours 33 minutes, cost: $242 per person\nBreakfast: -\nAttraction: Forsyth Park, Savannah\nLunch: Sr. Sol, Savannah, Georgia, cost: $30, cuisines: Tea, French, Mediterranean, Desserts\nDinner: Bosphorous Turkish Cuisine, Savannah, Georgia, cost: $58, cuisines: Pizza, Indian, Fast Food\nAccommodation: MIDTOWN MANHATTAN-WALKING DISTANCE TO EMPIRE STATE, Savannah, Georgia, cost: $72, room type: Private room, house rules: No pets & No parties, minimum nights: 2, maximum occupancy: 2\n\nNumber of people: 2\nTotal cost: (242 x 2) + (30 x 2) + (58 x 2) + 72 = $732\nAccommodation minimum nights: 1/2\n\nDays: 2\nCurrent City: Savannah\nTransportation: Taxi within Savannah (estimated cost for the day): $50\nBreakfast: Brown House Cafe, Savannah, Georgia, cost: $28, cuisines: Tea, Pizza, Mexican, Bakery, American, Seafood\nAttraction: Savannah Historic District, Savannah; Savannah's Waterfront, Savannah\nLunch: The Mad Teapot/The Wishing Chair, Savannah, Georgia, cost: $23, cuisines: Mexican, Bakery, Fast Food\nDinner: Manohar Dairy And Restaurant, Savannah, Georgia, cost: $23, cuisines: Tea, Indian, Fast Food\nAccommodation: MIDTOWN MANHATTAN-WALKING DISTANCE TO EMPIRE STATE, Savannah, Georgia, cost: $72, room type: Private room, house rules: No pets & No parties, minimum nights: 2, maximum occupancy: 2\n\nNumber of people: 2\nTotal cost: 50 + (28 x 2) + (23 x 2) + (23 x 2) + 72 = $347\nAccommodation minimum nights: 2/2\n\nDays: 3\nCurrent City: from Savannah to Newark\nTransportation: Flight F3903501, from Savannah to Newark, duration: 2 hours 9 minutes, cost: $294 per person\nBreakfast: Dhaba On Wheels, Savannah, Georgia, cost: $18, cuisines: Tea, Bakery, Pizza, American\nAttraction: -\nLunch: -\nDinner: -\nAccommodation: -\n\nNumber of people: 2\nTotal cost: (294 x 2) + (18 x 2) = $624\n\nTotal revised cost across all days: $732 + $347 + $624 = $1,703\n\nThe revised plan still exceeds the budget. To fit within the $1,400 budget, we may need to consider the following additional adjustments:\n\n- Opt for a more budget-friendly flight option if available.\n- Further reduce taxi usage and explore public transportation options.\n- Choose more affordable dining options that still meet the dietary preferences.\n\nPlease note that the provided reference information does not include cheaper flight options or public transportation details, and the accommodation options listed do not specify if children under 10 are allowed. Therefore, the travel plan cannot be accurately adjusted to fit the budget without additional information.", "gpt-4-1106-preview_direct_sole-planning_parsed_results": [{"day": 1, "current_city": "from Newark to Savannah", "transportation": "Flight Number: F4070527, from Newark to Savannah, Departure Time: -, Arrival Time: -", "breakfast": "-", "attraction": "Forsyth Park, Savannah;", "lunch": "Sr. Sol, Savannah", "dinner": "Bosphorous Turkish Cuisine, Savannah", "accommodation": "Cosy Inwood apartment, Savannah"}, {"day": 2, "current_city": "Savannah", "transportation": "Taxi within Savannah", "breakfast": "Brown House Cafe, Savannah", "attraction": "Savannah Historic District, Savannah;Savannah's Waterfront, Savannah;", "lunch": "The Mad Teapot/The Wishing Chair, Savannah", "dinner": "Manohar Dairy And Restaurant, Savannah", "accommodation": "Cosy Inwood apartment, Savannah"}, {"day": 3, "current_city": "from Savannah to Newark", "transportation": "Flight Number: F3903501, from Savannah to Newark, Departure Time: -, Arrival Time: -", "breakfast": "Dhaba On Wheels, Savannah", "attraction": "-", "lunch": "-", "dinner": "-", "accommodation": "-"}, {"day": 1, "current_city": "from Newark to Savannah", "transportation": "Flight Number: F4070527, from Newark to Savannah, Departure Time: -, Arrival Time: -", "breakfast": "-", "attraction": "Forsyth Park, Savannah;", "lunch": "Sr. Sol, Savannah", "dinner": "Bosphorous Turkish Cuisine, Savannah", "accommodation": "MIDTOWN MANHATTAN-WALKING DISTANCE TO EMPIRE STATE, Savannah"}, {"day": 2, "current_city": "Savannah", "transportation": "Taxi within Savannah", "breakfast": "Brown House Cafe, Savannah", "attraction": "Savannah Historic District, Savannah;Savannah's Waterfront, Savannah;", "lunch": "The Mad Teapot/The Wishing Chair, Savannah", "dinner": "Manohar Dairy And Restaurant, Savannah", "accommodation": "MIDTOWN MANHATTAN-WALKING DISTANCE TO EMPIRE STATE, Savannah"}, {"day": 3, "current_city": "from Savannah to Newark", "transportation": "Flight Number: F3903501, from Savannah to Newark, Departure Time: -, Arrival Time: -", "breakfast": "Dhaba On Wheels, Savannah", "attraction": "-", "lunch": "-", "dinner": "-", "accommodation": "-"}]}]