[{"gpt-4-1106-preview_direct_sole-planning_results": "Travel Plan:\n\nDays: 1\nCurrent City: from Richmond to Houston, Texas\nTransportation: Flight F4041372, from Richmond to Houston, duration: 3 hours 16 minutes, distance: 1157 km, cost: 371\nBreakfast: -\nAttraction: -\nLunch: -\nDinner: The BrewMaster - The Mix Fine Dine, Houston, Texas, cost: 52, cuisines: French, Indian, Cafe, Seafood\nAccommodation: Sunny and Airy near Manhattan, Houston, Texas, cost: 499, room type: Entire home/apt, house rules: No pets, minimum nights: 2, maximum occupancy: 4\n\nNumber of people: 2\nTotal cost: (371 x 2) + (52 x 2) + (499 x 2) = 1844\nAccommodation minimum nights: 1/2\n\nDays: 2\nCurrent City: Houston, Texas\nTransportation: -\nBreakfast: Jalapenos, Houston, Texas, cost: 57, cuisines: Desserts, Tea, Cafe, Chinese, Seafood\nAttraction: Space Center Houston, Houston; Houston Museum of Natural Science, Houston\nLunch: Sheetla Dhaba, Houston, Texas, cost: 35, cuisines: Desserts, Pizza, Bakery, American, Mediterranean\nDinner: Chawla's\u5b8a, Houston, Texas, cost: 26, cuisines: Chinese, Desserts, Bakery, Cafe, Mediterranean\nAccommodation: Sunny and Airy near Manhattan, Houston, Texas, cost: 499, room type: Entire home/apt, house rules: No pets, minimum nights: 2, maximum occupancy: 4\n\nNumber of people: 2\nTotal cost: (57 x 2) + (35 x 2) + (26 x 2) + (499 x 2) = 1344\nAccommodation minimum nights: 2/2\n\nDays: 3\nCurrent City: from Houston to Texarkana, Texas\nTransportation: Self-driving, from Houston to Texarkana, duration: 4 hours 44 mins, distance: 467 km, cost: 23\nBreakfast: Super Bakery, Houston, Texas, cost: 30, cuisines: Seafood, Fast Food\nAttraction: Museum of Regional History, Texarkana; Discovery Place Interactive Museum, Texarkana\nLunch: Columbia Restaurant, Texarkana, Texas, cost: 91, cuisines: Desserts, Tea, Pizza, Indian, Seafood\nDinner: Teasta, Texarkana, Texas, cost: 94, cuisines: Pizza, Italian, French, Bakery, Cafe, Seafood\nAccommodation: sunny airy bohemian rm, private bath! hip 'shwick, Texarkana, Texas, cost: 592, room type: Private room, house rules: No smoking, minimum nights: 2, maximum occupancy: 2\n\nNumber of people: 2\nTotal cost: (23 x 2) + (30 x 2) + (91 x 2) + (94 x 2) + (592 x 2) = 1860\nAccommodation minimum nights: 1/2\n\nDays: 4\nCurrent City: Texarkana, Texas\nTransportation: -\nBreakfast: Big City Bread Cafe, Texarkana, Texas, cost: 61, cuisines: Cafe, Pizza, Bakery, BBQ\nAttraction: Spring Lake Park, Texarkana; Ace of Clubs House, Texarkana\nLunch: Polka Pastry & Snack Bar, Texarkana, Texas, cost: 71, cuisines: Fast Food, BBQ, Italian\nDinner: Prime Bakery, Texarkana, Texas, cost: 94, cuisines: Cafe, Pizza, BBQ, Fast Food\nAccommodation: sunny airy bohemian rm, private bath! hip 'shwick, Texarkana, Texas, cost: 592, room type: Private room, house rules: No smoking, minimum nights: 2, maximum occupancy: 2\n\nNumber of people: 2\nTotal cost: (61 x 2) + (71 x 2) + (94 x 2) + (592 x 2) = 1636\nAccommodation minimum nights: 2/2\n\nDays: 5\nCurrent City: from Texarkana to Richmond\nTransportation: Self-driving, from Texarkana to Richmond, duration: 16 hours 8 mins, distance: 1773 km, cost: 88\nBreakfast: -\nAttraction: -\nLunch: -\nDinner: -\nAccommodation: -\n\nNumber of people: 2\nTotal cost: 88 x 2 = 176\n\nTotal cost across all days: 1844 + 1344 + 1860 + 1636 + 176 = 6860\n\nUnfortunately, the total cost exceeds the specified budget of $6,000. Adjustments will need to be made to the plan to reduce costs. This could involve selecting more budget-friendly accommodations or dining options, or considering alternative transportation methods within the constraints of the query.", "gpt-4-1106-preview_direct_sole-planning_parsed_results": [{"day": 1, "current_city": "from Richmond to Houston, Texas", "transportation": "Flight Number: F4041372, from Richmond to Houston, duration: 3 hours 16 minutes, distance: 1157 km", "breakfast": "-", "attraction": "-", "lunch": "-", "dinner": "The BrewMaster - The Mix Fine Dine, Houston, Texas", "accommodation": "Sunny and Airy near Manhattan, Houston, Texas"}, {"day": 2, "current_city": "Houston, Texas", "transportation": "-", "breakfast": "Jalapenos, Houston, Texas", "attraction": "Space Center Houston, Houston;Houston Museum of Natural Science, Houston;", "lunch": "Sheetla Dhaba, Houston, Texas", "dinner": "Chawla's\u5b8a, Houston, Texas", "accommodation": "Sunny and Airy near Manhattan, Houston, Texas"}, {"day": 3, "current_city": "from Houston to Texarkana, Texas", "transportation": "Self-driving, from Houston to Texarkana, duration: 4 hours 44 mins, distance: 467 km", "breakfast": "Super Bakery, Houston, Texas", "attraction": "Museum of Regional History, Texarkana;Discovery Place Interactive Museum, Texarkana;", "lunch": "Columbia Restaurant, Texarkana, Texas", "dinner": "Teasta, Texarkana, Texas", "accommodation": "sunny airy bohemian rm, private bath! hip 'shwick, Texarkana, Texas"}, {"day": 4, "current_city": "Texarkana, Texas", "transportation": "-", "breakfast": "Big City Bread Cafe, Texarkana, Texas", "attraction": "Spring Lake Park, Texarkana;Ace of Clubs House, Texarkana;", "lunch": "Polka Pastry & Snack Bar, Texarkana, Texas", "dinner": "Prime Bakery, Texarkana, Texas", "accommodation": "sunny airy bohemian rm, private bath! hip 'shwick, Texarkana, Texas"}, {"day": 5, "current_city": "from Texarkana to Richmond", "transportation": "Self-driving, from Texarkana to Richmond, duration: 16 hours 8 mins, distance: 1773 km", "breakfast": "-", "attraction": "-", "lunch": "-", "dinner": "-", "accommodation": "-"}]}]