[{"gpt-4-1106-preview_direct_sole-planning_results": "Travel Plan:\n\nDays: 1\nCurrent City: from Detroit to San Diego\nTransportation: Flight F3528556, from Detroit to San Diego, departure: 08:33, arrival: 10:36, duration: 5 hours 3 minutes, distance: 1956 km, cost: $720\nBreakfast: -\nAttraction: -\nLunch: Open Yard, San Diego, cost: $33, cuisines: Chinese, Pizza, Cafe, Desserts\nDinner: The Lost Mughal, San Diego, cost: $74, cuisines: Tea, Cafe, Italian\nAccommodation: Spacious Room in Large 2 Bedroom Prewar Apartment, San Diego, cost: $585, room type: Private room, maximum occupancy: 2, house rules: No parties & No visitors, minimum nights: 1\n\nNumber of people: 1\nTotal cost: $720 (flight) + $33 (lunch) + $74 (dinner) + $585 (accommodation) = $1,412\nAccommodation minimum nights: 1/1\n\nDays: 2\nCurrent City: San Diego\nTransportation: -\nBreakfast: Jetha Lal Ka Dhabha, San Diego, cost: $22, cuisines: Tea, Cafe, Indian, Italian\nAttraction: Balboa Park, San Diego; USS Midway Museum, San Diego\nLunch: Harry's Bar + Cafe, San Diego, cost: $55, cuisines: Fast Food, French, Cafe, Seafood\nDinner: Bun Intended, San Diego, cost: $91, cuisines: Cafe, Pizza, Desserts, Seafood\nAccommodation: Spacious Room in Large 2 Bedroom Prewar Apartment, San Diego, cost: $585, room type: Private room, maximum occupancy: 2, house rules: No parties & No visitors, minimum nights: 1\n\nNumber of people: 1\nTotal cost: $22 (breakfast) + $55 (lunch) + $91 (dinner) + $585 (accommodation) = $753\nAccommodation minimum nights: 2/1\n\nDays: 3\nCurrent City: from San Diego to Detroit\nTransportation: Flight F3519973, from San Diego to Detroit, departure: 22:22, arrival: 05:24, duration: 4 hours 2 minutes, distance: 1956 km, cost: $968\nBreakfast: Duggal Snacks, San Diego, cost: $82, cuisines: Desserts, Pizza, Italian, Fast Food, Cafe, Indian\nAttraction: San Diego Zoo, San Diego\nLunch: Gopala, San Diego, cost: $98, cuisines: Pizza, Mexican, BBQ, American, Seafood\nDinner: -\nAccommodation: -\n\nNumber of people: 1\nTotal cost: $82 (breakfast) + $98 (lunch) + $968 (flight) = $1,148\n\nTotal cost across all days: $1,412 (Day 1) + $753 (Day 2) + $1,148 (Day 3) = $3,313\n\nNote: The total cost exceeds the specified budget of $3,000. To adjust the plan within the budget, we can consider changing the accommodation to a less expensive option or choosing more budget-friendly dining options. Here's an adjusted plan with a different accommodation to fit the budget:\n\nAdjusted Accommodation for Days 1 and 2:\nAccommodation: Harlem Garden Oasis in New York City Brownstone, San Diego, cost: $368, room type: Entire home/apt, maximum occupancy: 3, house rules: No visitors, minimum nights: 1\n\nAdjusted Total cost for Days 1 and 2: $720 (flight) + $33 (lunch) + $74 (dinner) + $368 (accommodation) = $1,195 (Day 1)\nAdjusted Total cost for Day 2: $22 (breakfast) + $55 (lunch) + $91 (dinner) + $368 (accommodation) = $536\n\nAdjusted Total cost across all days: $1,195 (Day 1) + $536 (Day 2) + $1,148 (Day 3) = $2,879\n\nThe adjusted plan now fits within the $3,000 budget.", "gpt-4-1106-preview_direct_sole-planning_parsed_results": [{"day": 1, "current_city": "from Detroit to San Diego", "transportation": "Flight Number: F3528556, from Detroit to San Diego, Departure Time: 08:33, Arrival Time: 10:36", "breakfast": "-", "attraction": "-", "lunch": "Open Yard, San Diego", "dinner": "The Lost Mughal, San Diego", "accommodation": "Spacious Room in Large 2 Bedroom Prewar Apartment, San Diego"}, {"day": 2, "current_city": "San Diego", "transportation": "-", "breakfast": "Jetha Lal Ka Dhabha, San Diego", "attraction": "Balboa Park, San Diego;USS Midway Museum, San Diego;", "lunch": "Harry's Bar + Cafe, San Diego", "dinner": "Bun Intended, San Diego", "accommodation": "Spacious Room in Large 2 Bedroom Prewar Apartment, San Diego"}, {"day": 3, "current_city": "from San Diego to Detroit", "transportation": "Flight Number: F3519973, from San Diego to Detroit, Departure Time: 22:22, Arrival Time: 05:24", "breakfast": "Duggal Snacks, San Diego", "attraction": "San Diego Zoo, San Diego", "lunch": "Gopala, San Diego", "dinner": "-", "accommodation": "-"}]}]