[{"gpt-4-1106-preview_direct_sole-planning_results": "Travel Plan:\n\nDays: 1\nCurrent City: from Charlotte to Hilton Head\nTransportation: Self-driving, from Charlotte to Hilton Head, duration: 3 hours 49 mins, distance: 398 km, cost: 19\nBreakfast: -\nAttraction: -\nLunch: -\nDinner: Sikkim Fast Food, Hilton Head, cost: 90, cuisines: French, Bakery, Desserts, Seafood\nAccommodation: Sonder | Upper East Side | Lovely 1BR + Gym, Hilton Head, cost: 130, room type: Entire home/apt, house rules: No children under 10, minimum nights: 29, maximum occupancy: 2\n\nNumber of people: 5\nTotal cost: (19 x 5) + (90 x 5) + (130 x 2) = 95 + 450 + 260 = 805\nAccommodation minimum nights: 1/29\n\nDays: 2\nCurrent City: Hilton Head\nTransportation: -\nBreakfast: New Town Pastry Shop - Park Plaza, Hilton Head, cost: 51, cuisines: Tea, Cafe, Pizza, BBQ\nAttraction: Coastal Discovery Museum, Hilton Head; Harbour Town Lighthouse, Hilton Head\nLunch: Cafe Coffee Day, Hilton Head, cost: 65, cuisines: Bakery, BBQ, Italian\nDinner: Dhaba Ambarsariya, Hilton Head, cost: 47, cuisines: French, BBQ, Mediterranean, Seafood\nAccommodation: Sonder | Upper East Side | Lovely 1BR + Gym, Hilton Head, cost: 130, room type: Entire home/apt, house rules: No children under 10, minimum nights: 29, maximum occupancy: 2\n\nNumber of people: 5\nTotal cost: (51 x 5) + (65 x 5) + (47 x 5) + (130 x 2) = 255 + 325 + 235 + 260 = 1075\nAccommodation minimum nights: 2/29\n\nDays: 3\nCurrent City: from Hilton Head to Charlotte\nTransportation: Self-driving, from Hilton Head to Charlotte, duration: 3 hours 49 mins, distance: 397 km, cost: 19\nBreakfast: Twenty Four Seven, Hilton Head, cost: 51, cuisines: Cafe, Indian, Fast Food\nAttraction: -\nLunch: -\nDinner: -\nAccommodation: -\n\nNumber of people: 5\nTotal cost: (19 x 5) + (51 x 5) = 95 + 255 = 350\n\nTotal cost across all days: 805 + 1075 + 350 = 2230\nCuisines: Preference for Italian and French cuisines has been met with selected restaurants.\nBudget: The total cost of $2230 is well within the $7000 budget cap.\n\nPlease note that the accommodation chosen has a minimum stay of 29 nights, which is not suitable for a 3-day trip. However, due to the lack of other options in the provided data, this accommodation was selected to demonstrate the format of the travel plan. In a real-world scenario, alternative accommodation would need to be found to meet the duration of the stay.", "gpt-4-1106-preview_direct_sole-planning_parsed_results": [{"day": 1, "current_city": "from Charlotte to Hilton Head", "transportation": "Self-driving, from Charlotte to Hilton Head, duration: 3 hours 49 mins, distance: 398 km", "breakfast": "-", "attraction": "-", "lunch": "-", "dinner": "Sikkim Fast Food, Hilton Head", "accommodation": "Sonder | Upper East Side | Lovely 1BR + Gym, Hilton Head"}, {"day": 2, "current_city": "Hilton Head", "transportation": "-", "breakfast": "New Town Pastry Shop - Park Plaza, Hilton Head", "attraction": "Coastal Discovery Museum, Hilton Head;Harbour Town Lighthouse, Hilton Head;", "lunch": "Cafe Coffee Day, Hilton Head", "dinner": "Dhaba Ambarsariya, Hilton Head", "accommodation": "Sonder | Upper East Side | Lovely 1BR + Gym, Hilton Head"}, {"day": 3, "current_city": "from Hilton Head to Charlotte", "transportation": "Self-driving, from Hilton Head to Charlotte, duration: 3 hours 49 mins, distance: 397 km", "breakfast": "Twenty Four Seven, Hilton Head", "attraction": "-", "lunch": "-", "dinner": "-", "accommodation": "-"}]}]