[{"gpt-4-1106-preview_direct_sole-planning_results": "Travel Plan:\n\nDays: 1\nCurrent City: from Milwaukee to New York\nTransportation: Flight F3643145, from Milwaukee to New York, duration: 2 hours 22 minutes, cost: 226 per person\nBreakfast: -\nAttraction: -\nLunch: -\nDinner: Seasons 52 Fresh Grill, New York, cost: 30 per person, cuisines: Seafood, Indian, Desserts, Italian\nAccommodation: Beautiful and big 1BR sublet close by Central Park, New York, cost: 983 per night, room type: Private room, house rules: No parties & No children under 10, minimum nights: 5, maximum occupancy: 2\n\nNumber of people: 2\nTotal cost: (226 x 2) + (30 x 2) + 983 = 1495\nAccommodation minimum nights: 1/5\n\nDays: 2\nCurrent City: New York\nTransportation: -\nBreakfast: Green Chick Chop, New York, cost: 26 per person, cuisines: Tea, French, Cafe, Seafood\nAttraction: Central Park, New York; Empire State Building, New York\nLunch: Lord of the Drinks Forum, New York, cost: 71 per person, cuisines: Cafe, Bakery, BBQ, Chinese, Indian\nDinner: Garam Masala Food Corner, New York, cost: 40 per person, cuisines: Pizza, Bakery, Desserts\nAccommodation: Beautiful and big 1BR sublet close by Central Park, New York, cost: 983 per night, room type: Private room, house rules: No parties & No children under 10, minimum nights: 5, maximum occupancy: 2\n\nNumber of people: 2\nTotal cost: (26 x 2) + (71 x 2) + (40 x 2) + 983 = 1257\nAccommodation minimum nights: 2/5\n\nDays: 3\nCurrent City: from New York to Milwaukee\nTransportation: Flight F3644990, from New York to Milwaukee, duration: 2 hours 7 minutes, cost: 218 per person\nBreakfast: Sir John Bakery Cafe, New York, cost: 78 per person, cuisines: Pizza, Bakery, Desserts\nAttraction: -\nLunch: -\nDinner: -\nAccommodation: -\n\nNumber of people: 2\nTotal cost: (218 x 2) + (78 x 2) = 592\n\nTotal cost across all days: 1495 + 1257 + 592 = 3344\nRemaining budget: 1900 - 3344 = -1444 (This exceeds the budget, adjustments needed)\n\nAdjustments:\n- Change the accommodation to a more affordable option.\n- Opt for less expensive meals.\n\nRevised Travel Plan:\n\nDays: 1\nCurrent City: from Milwaukee to New York\nTransportation: Flight F3643145, from Milwaukee to New York, duration: 2 hours 22 minutes, cost: 226 per person\nBreakfast: -\nAttraction: -\nLunch: -\nDinner: Seasons 52 Fresh Grill, New York, cost: 30 per person, cuisines: Seafood, Indian, Desserts, Italian\nAccommodation: A Contemporary Homelike Stay in the Best of BK, New York, cost: 228 per night, room type: Entire home/apt, house rules: No pets & No visitors & No children under 10, minimum nights: 2, maximum occupancy: 2\n\nNumber of people: 2\nTotal cost: (226 x 2) + (30 x 2) + 228 = 740\nAccommodation minimum nights: 1/2\n\nDays: 2\nCurrent City: New York\nTransportation: -\nBreakfast: Green Chick Chop, New York, cost: 26 per person, cuisines: Tea, French, Cafe, Seafood\nAttraction: Central Park, New York; Empire State Building, New York\nLunch: Lord of the Drinks Forum, New York, cost: 71 per person, cuisines: Cafe, Bakery, BBQ, Chinese, Indian\nDinner: Garam Masala Food Corner, New York, cost: 40 per person, cuisines: Pizza, Bakery, Desserts\nAccommodation: A Contemporary Homelike Stay in the Best of BK, New York, cost: 228 per night, room type: Entire home/apt, house rules: No pets & No visitors & No children under 10, minimum nights: 2, maximum occupancy: 2\n\nNumber of people: 2\nTotal cost: (26 x 2) + (71 x 2) + (40 x 2) + 228 = 502\nAccommodation minimum nights: 2/2\n\nDays: 3\nCurrent City: from New York to Milwaukee\nTransportation: Flight F3644990, from New York to Milwaukee, duration: 2 hours 7 minutes, cost: 218 per person\nBreakfast: Sir John Bakery Cafe, New York, cost: 78 per person, cuisines: Pizza, Bakery, Desserts\nAttraction: -\nLunch: -\nDinner: -\nAccommodation: -\n\nNumber of people: 2\nTotal cost: (218 x 2) + (78 x 2) = 592\n\nTotal cost across all days: 740 + 502 + 592 = 1834\nRemaining budget: 1900 - 1834 = 66\n\nThe revised travel plan is within the budget of $1,900.", "gpt-4-1106-preview_direct_sole-planning_parsed_results": [{"day": 1, "current_city": "from Milwaukee to New York", "transportation": "Flight Number: F3643145, from Milwaukee to New York, Departure Time: -, Arrival Time: -", "breakfast": "-", "attraction": "-", "lunch": "-", "dinner": "Seasons 52 Fresh Grill, New York", "accommodation": "A Contemporary Homelike Stay in the Best of BK, New York"}, {"day": 2, "current_city": "New York", "transportation": "-", "breakfast": "Green Chick Chop, New York", "attraction": "Central Park, New York;Empire State Building, New York;", "lunch": "Lord of the Drinks Forum, New York", "dinner": "Garam Masala Food Corner, New York", "accommodation": "A Contemporary Homelike Stay in the Best of BK, New York"}, {"day": 3, "current_city": "from New York to Milwaukee", "transportation": "Flight Number: F3644990, from New York to Milwaukee, Departure Time: -, Arrival Time: -", "breakfast": "Sir John Bakery Cafe, New York", "attraction": "-", "lunch": "-", "dinner": "-", "accommodation": "-"}]}]