[{"gpt-4-1106-preview_direct_sole-planning_results": "Travel Plan:\n\nDays: 1\nCurrent City: from Palm Springs to Houston, Texas\nTransportation: Flight F3839339, from Palm Springs to Houston, Price: $282, DepTime: 06:07, ArrTime: 10:59, Duration: 2 hours 52 minutes\nBreakfast: -\nAttraction: Downtown Aquarium, Houston; Space Center Houston\nLunch: Jalapenos, Houston, Texas, Average Cost: $57, Cuisines: Desserts, Tea, Cafe, Chinese, Seafood\nDinner: Sheetla Dhaba, Houston, Texas, Average Cost: $35, Cuisines: Desserts, Pizza, Bakery, American, Mediterranean\nAccommodation: Sunny and Airy near Manhattan, Houston, Texas, Price: $499, Room Type: Entire home/apt, House Rules: No pets, Minimum Nights: 2, Maximum Occupancy: 4\n\nNumber of people: 1\nTotal cost: $282 (Flight) + $57 (Lunch) + $35 (Dinner) + $499 (Accommodation) = $873\nAccommodation minimum nights: 1/2\n\nDays: 2\nCurrent City: Houston, Texas\nTransportation: -\nBreakfast: Super Bakery, Houston, Texas, Average Cost: $30, Cuisines: Seafood, Fast Food\nAttraction: Houston Museum of Natural Science; The Museum of Fine Arts, Houston\nLunch: Royal Mart, Houston, Texas, Average Cost: $40, Cuisines: Tea, Bakery, Cafe, Mediterranean, Seafood\nDinner: Matchbox, Houston, Texas, Average Cost: $33, Cuisines: Tea, Italian, Bakery, Fast Food, Seafood\nAccommodation: Sunny and Airy near Manhattan, Houston, Texas, Price: $499, Room Type: Entire home/apt, House Rules: No pets, Minimum Nights: 2, Maximum Occupancy: 4\n\nNumber of people: 1\nTotal cost: $30 (Breakfast) + $40 (Lunch) + $33 (Dinner) + $499 (Accommodation) = $602\nAccommodation minimum nights: 2/2\n\nDays: 3\nCurrent City: from Houston to Austin, Texas\nTransportation: Flight F4001665, from Houston to Austin, Price: $33, DepTime: 10:45, ArrTime: 11:29, Duration: 0 hours 44 minutes\nBreakfast: Earthen Spices, Houston, Texas, Average Cost: $28, Cuisines: Tea, Mexican, Bakery, BBQ, Fast Food\nAttraction: Texas Capitol; Zilker Metropolitan Park\nLunch: Wildflour Cafe + Bakery, Austin, Texas, Average Cost: $55, Cuisines: Desserts, French, Bakery, BBQ, Seafood\nDinner: The Kasbah, Austin, Texas, Average Cost: $88, Cuisines: Cafe, Pizza, BBQ, Fast Food\nAccommodation: Cozy room in south Harlem - 10 mins to Columbia, Austin, Texas, Price: $564, Room Type: Private room, House Rules: No visitors & No children under 10, Minimum Nights: 1, Maximum Occupancy: 2\n\nNumber of people: 1\nTotal cost: $33 (Flight) + $28 (Breakfast) + $55 (Lunch) + $88 (Dinner) + $564 (Accommodation) = $768\nAccommodation minimum nights: 1/1\n\nDays: 4\nCurrent City: Austin, Texas\nTransportation: -\nBreakfast: Quiosque Chopp Brahma, Austin, Texas, Average Cost: $69, Cuisines: Tea, Pizza, Bakery, Fast Food, Indian\nAttraction: Museum of the Weird; Cathedral of Junk\nLunch: Mehfil-e-Handi, Austin, Texas, Average Cost: $96, Cuisines: Desserts, Tea, Bakery, American, Seafood\nDinner: Chili's, Austin, Texas, Average Cost: $48, Cuisines: Cafe, American, Seafood\nAccommodation: Cozy room in south Harlem - 10 mins to Columbia, Austin, Texas, Price: $564, Room Type: Private room, House Rules: No visitors & No children under 10, Minimum Nights: 1, Maximum Occupancy: 2\n\nNumber of people: 1\nTotal cost: $69 (Breakfast) + $96 (Lunch) + $48 (Dinner) + $564 (Accommodation) = $777\nAccommodation minimum nights: 2/1\n\nDays: 5\nCurrent City: from Austin to Dallas, Texas\nTransportation: Flight F4007286, from Austin to Dallas, Price: $44, DepTime: 06:06, ArrTime: 06:55, Duration: 0 hours 49 minutes\nBreakfast: Cup-a-licious, Austin, Texas, Average Cost: $85, Cuisines: Fast Food, Chinese, BBQ, Italian\nAttraction: The Dallas World Aquarium; The Sixth Floor Museum at Dealey Plaza\nLunch: Coconuts Fish Cafe, Dallas, Texas, Average Cost: $38, Cuisines: Cafe, BBQ, Mediterranean, Fast Food\nDinner: 1918 Bistro & Grill, Dallas, Texas, Average Cost: $90, Cuisines: Tea, Pizza, BBQ, Seafood\nAccommodation: *Fresh Budget Room, Dallas, Texas, Price: $262, Room Type: Private room, House Rules: No visitors & No smoking, Minimum Nights: 2, Maximum Occupancy: 1\n\nNumber of people: 1\nTotal cost: $44 (Flight) + $85 (Breakfast) + $38 (Lunch) + $90 (Dinner) + $262 (Accommodation) = $519\nAccommodation minimum nights: 1/2\n\nDays: 6\nCurrent City: Dallas, Texas\nTransportation: -\nBreakfast: Drifters Cafe, Dallas, Texas, Average Cost: $21, Cuisines: Tea, French, Mexican, Cafe, Seafood\nAttraction: Reunion Tower; Dallas Museum of Art\nLunch: Yanki Sizzlers, Dallas, Texas, Average Cost: $96, Cuisines: Cafe, French, Tea, Mediterranean\nDinner: Aravali Owls, Dallas, Texas, Average Cost: $53, Cuisines: Pizza, Italian, Bakery, Fast Food, Cafe\nAccommodation: *Fresh Budget Room, Dallas, Texas, Price: $262, Room Type: Private room, House Rules: No visitors & No smoking, Minimum Nights: 2, Maximum Occupancy: 1\n\nNumber of people: 1\nTotal cost: $21 (Breakfast) + $96 (Lunch) + $53 (Dinner) + $262 (Accommodation) = $432\nAccommodation minimum nights: 2/2\n\nDays: 7\nCurrent City: from Dallas to Palm Springs\nTransportation: Flight F3673984, from Dallas to Palm Springs, Price: $432, DepTime: 08:41, ArrTime: 10:04, Duration: 3 hours 23 minutes\nBreakfast: Kebab Xpress, Dallas, Texas, Average Cost: $93, Cuisines: Tea, Bakery, Pizza, Mediterranean\nAttraction: -\nLunch: -\nDinner: -\nAccommodation: -\n\nNumber of people: 1\nTotal cost: $432 (Flight) + $93 (Breakfast) = $525\n\nTotal cost across all days: $873 + $602 + $768 + $777 + $519 + $432 + $525 = $4,496\n\nCuisines: All cuisine constraints are satisfied as no specific cuisines were requested.\nAccommodation minimum nights: All accommodations meet the minimum night requirements.\n\nRemaining Budget: $8,100 - $4,496 = $3,604\n\nPlease note that the costs for attractions and transportation within the cities (e.g., taxi, public transport) are not included in the total cost and should be considered within the remaining budget. Additionally, the travel plan adheres to the constraints of visiting 3 cities in Texas over 7 days within the specified budget.", "gpt-4-1106-preview_direct_sole-planning_parsed_results": [{"day": 1, "current_city": "from Palm Springs to Houston", "transportation": "Flight Number: F3839339, from Palm Springs to Houston, Departure Time: 06:07, Arrival Time: 10:59", "breakfast": "-", "attraction": "Downtown Aquarium, Houston;Space Center Houston, Houston;", "lunch": "Jalapenos, Houston", "dinner": "Sheetla Dhaba, Houston", "accommodation": "Sunny and Airy near Manhattan, Houston"}, {"day": 2, "current_city": "Houston", "transportation": "-", "breakfast": "Super Bakery, Houston", "attraction": "Houston Museum of Natural Science, Houston;The Museum of Fine Arts, Houston, Houston;", "lunch": "Royal Mart, Houston", "dinner": "Matchbox, Houston", "accommodation": "Sunny and Airy near Manhattan, Houston"}, {"day": 3, "current_city": "from Houston to Austin", "transportation": "Flight Number: F4001665, from Houston to Austin, Departure Time: 10:45, Arrival Time: 11:29", "breakfast": "Earthen Spices, Houston", "attraction": "Texas Capitol, Austin;Zilker Metropolitan Park, Austin;", "lunch": "Wildflour Cafe + Bakery, Austin", "dinner": "The Kasbah, Austin", "accommodation": "Cozy room in south Harlem - 10 mins to Columbia, Austin"}, {"day": 4, "current_city": "Austin", "transportation": "-", "breakfast": "Quiosque Chopp Brahma, Austin", "attraction": "Museum of the Weird, Austin;Cathedral of Junk, Austin;", "lunch": "Mehfil-e-Handi, Austin", "dinner": "Chili's, Austin", "accommodation": "Cozy room in south Harlem - 10 mins to Columbia, Austin"}, {"day": 5, "current_city": "from Austin to Dallas", "transportation": "Flight Number: F4007286, from Austin to Dallas, Departure Time: 06:06, Arrival Time: 06:55", "breakfast": "Cup-a-licious, Austin", "attraction": "The Dallas World Aquarium, Dallas;The Sixth Floor Museum at Dealey Plaza, Dallas;", "lunch": "Coconuts Fish Cafe, Dallas", "dinner": "1918 Bistro & Grill, Dallas", "accommodation": "Fresh Budget Room, Dallas"}, {"day": 6, "current_city": "Dallas", "transportation": "-", "breakfast": "Drifters Cafe, Dallas", "attraction": "Reunion Tower, Dallas;Dallas Museum of Art, Dallas;", "lunch": "Yanki Sizzlers, Dallas", "dinner": "Aravali Owls, Dallas", "accommodation": "Fresh Budget Room, Dallas"}, {"day": 7, "current_city": "from Dallas to Palm Springs", "transportation": "Flight Number: F3673984, from Dallas to Palm Springs, Departure Time: 08:41, Arrival Time: 10:04", "breakfast": "Kebab Xpress, Dallas", "attraction": "-", "lunch": "-", "dinner": "-", "accommodation": "-"}]}]