[{"gpt-4-1106-preview_direct_sole-planning_results": "Travel Plan:\n\nDays: 1\nCurrent City: from Grand Junction to Phoenix, Arizona\nTransportation: Self-driving, from Grand Junction to Phoenix, duration: 9 hours 11 mins, distance: 934 km, cost: 46\nBreakfast: -\nAttraction: -\nLunch: -\nDinner: Pizza Hut, Phoenix, Arizona, cost: 30, cuisines: Tea, Chinese, Desserts, Seafood\nAccommodation: 1 BR in Carroll Gardens Townhouse, Phoenix, Arizona, cost: 397, room type: Private room, house rules: No visitors & No smoking, minimum nights: 2, maximum occupancy: 1\n\nNumber of people: 2\nTotal cost: (46 x 2) + (30 x 2) + (397 x 2) = 906\nAccommodation minimum nights: 1/2\n\nDays: 2\nCurrent City: Phoenix, Arizona\nTransportation: -\nBreakfast: Doughlicious, Phoenix, Arizona, cost: 41, cuisines: French, Pizza, BBQ\nAttraction: Phoenix Zoo, Phoenix; Heard Museum, Phoenix\nLunch: Mama Loca, Phoenix, Arizona, cost: 27, cuisines: Desserts, Pizza, Italian, Bakery, Fast Food\nDinner: Village Restaurant, Phoenix, Arizona, cost: 35, cuisines: Tea, Cafe, Desserts, Italian\nAccommodation: 1 BR in Carroll Gardens Townhouse, Phoenix, Arizona, cost: 397, room type: Private room, house rules: No visitors & No smoking, minimum nights: 2, maximum occupancy: 1\n\nNumber of people: 2\nTotal cost: (41 x 2) + (27 x 2) + (35 x 2) + (397 x 2) = 1080\nAccommodation minimum nights: 2/2\n\nDays: 3\nCurrent City: from Phoenix to Tucson, Arizona\nTransportation: Self-driving, from Phoenix to Tucson, duration: 1 hour 44 mins, distance: 181 km, cost: 9\nBreakfast: Mocambo, Phoenix, Arizona, cost: 76, cuisines: Tea, Chinese, Desserts, Fast Food\nAttraction: Pima Air & Space Museum, Tucson; Reid Park Zoo, Tucson\nLunch: Villa Tevere, Tucson, Arizona, cost: 37, cuisines: Mexican, Mediterranean, Desserts, Fast Food\nDinner: Consort Restaurant, Tucson, Arizona, cost: 54, cuisines: Bakery, Pizza, Indian, Desserts\nAccommodation: Room for rent shared bathroom, Tucson, Arizona, cost: 557, room type: Private room, house rules: No smoking, minimum nights: 1, maximum occupancy: 2\n\nNumber of people: 2\nTotal cost: (9 x 2) + (76 x 2) + (37 x 2) + (54 x 2) + (557 x 2) = 1480\nAccommodation minimum nights: 1/1\n\nDays: 4\nCurrent City: Tucson, Arizona\nTransportation: -\nBreakfast: Magic Spice Wok, Tucson, Arizona, cost: 31, cuisines: Cafe, Bakery, BBQ, Chinese, Seafood\nAttraction: Tucson Botanical Gardens, Tucson; Old Tucson, Tucson\nLunch: La Plage, Tucson, Arizona, cost: 93, cuisines: Seafood, Bakery, Desserts, Italian\nDinner: iKitchen, Tucson, Arizona, cost: 69, cuisines: Seafood, Pizza, Italian\nAccommodation: Room for rent shared bathroom, Tucson, Arizona, cost: 557, room type: Private room, house rules: No smoking, minimum nights: 1, maximum occupancy: 2\n\nNumber of people: 2\nTotal cost: (31 x 2) + (93 x 2) + (69 x 2) + (557 x 2) = 1700\nAccommodation minimum nights: 2/1\n\nDays: 5\nCurrent City: from Tucson to Grand Junction\nTransportation: Self-driving, from Tucson to Grand Junction, duration: 10 hours 36 mins, distance: 1,113 km, cost: 55\nBreakfast: Chai Point, Tucson, Arizona, cost: 62, cuisines: Tea, Bakery, Mexican, American\nAttraction: -\nLunch: -\nDinner: -\nAccommodation: -\n\nNumber of people: 2\nTotal cost: (55 x 2) + (62 x 2) = 234\n\nTotal cost across all days: 906 + 1080 + 1480 + 1700 + 234 = 5400\n\nUnfortunately, the total cost of $5,400 exceeds the specified budget of $2,100. Adjustments are needed to meet the budget constraints. Here is a revised plan that fits within the budget:\n\nRevised Travel Plan:\n\nDays: 1\nCurrent City: from Grand Junction to Phoenix, Arizona\nTransportation: Self-driving, from Grand Junction to Phoenix, duration: 9 hours 11 mins, distance: 934 km, cost: 46\nBreakfast: -\nAttraction: -\nLunch: -\nDinner: Pizza Hut, Phoenix, Arizona, cost: 30, cuisines: Tea, Chinese, Desserts, Seafood\nAccommodation: Twin Cabin with a Window One, Phoenix, Arizona, cost: 234, room type: Private room, house rules: No parties, minimum nights: 1, maximum occupancy: 1\n\nNumber of people: 2\nTotal cost: (46 x 2) + (30 x 2) + (234 x 2) = 620\nAccommodation minimum nights: 1/1\n\nDays: 2\nCurrent City: Phoenix, Arizona\nTransportation: -\nBreakfast: Doughlicious, Phoenix, Arizona, cost: 41, cuisines: French, Pizza, BBQ\nAttraction: Phoenix Zoo, Phoenix; Heard Museum, Phoenix\nLunch: Mama Loca, Phoenix, Arizona, cost: 27, cuisines: Desserts, Pizza, Italian, Bakery, Fast Food\nDinner: Village Restaurant, Phoenix, Arizona, cost: 35, cuisines: Tea, Cafe, Desserts, Italian\nAccommodation: Twin Cabin with a Window One, Phoenix, Arizona, cost: 234, room type: Private room, house rules: No parties, minimum nights: 1, maximum occupancy: 1\n\nNumber of people: 2\nTotal cost: (41 x 2) + (27 x 2) + (35 x 2) + (234 x 2) = 674\nAccommodation minimum nights: 2/1\n\nDays: 3\nCurrent City: from Phoenix to Tucson, Arizona\nTransportation: Self-driving, from Phoenix to Tucson, duration: 1 hour 44 mins, distance: 181 km, cost: 9\nBreakfast: Mocambo, Phoenix, Arizona, cost: 76, cuisines: Tea, Chinese, Desserts, Fast Food\nAttraction: Pima Air & Space Museum, Tucson; Reid Park Zoo, Tucson\nLunch: Villa Tevere, Tucson, Arizona, cost: 37, cuisines: Mexican, Mediterranean, Desserts, Fast Food\nDinner: Consort Restaurant, Tucson, Arizona, cost: 54, cuisines: Bakery, Pizza, Indian, Desserts\nAccommodation: Private room with private bathroom, Tucson, Arizona, cost: 58, room type: Private room, house rules: No smoking, minimum nights: 2, maximum occupancy: 2\n\nNumber of people: 2\nTotal cost: (9 x 2) + (76 x 2) + (37 x 2) + (54 x 2) + (58 x 2) = 484\nAccommodation minimum nights: 1/2\n\nDays: 4\nCurrent City: Tucson, Arizona\nTransportation: -\nBreakfast: Magic Spice Wok, Tucson, Arizona, cost: 31, cuisines: Cafe, Bakery, BBQ, Chinese, Seafood\nAttraction: Tucson Botanical Gardens, Tucson; Old Tucson, Tucson\nLunch: La Plage, Tucson, Arizona, cost: 93, cuisines: Seafood, Bakery, Desserts, Italian\nDinner: iKitchen, Tucson, Arizona, cost: 69, cuisines: Seafood, Pizza, Italian\nAccommodation: Private room with private bathroom, Tucson, Arizona, cost: 58, room type: Private room, house rules: No smoking, minimum nights: 2, maximum occupancy: 2\n\nNumber of people: 2\nTotal cost: (31 x 2) + (93 x 2) + (69 x 2) + (58 x 2) = 502\nAccommodation minimum nights: 2/2\n\nDays: 5\nCurrent City: from Tucson to Grand Junction\nTransportation: Self-driving, from Tucson to Grand Junction, duration: 10 hours 36 mins, distance: 1,113 km, cost: 55\nBreakfast: Chai Point, Tucson, Arizona, cost: 62, cuisines: Tea, Bakery, Mexican, American\nAttraction: -\nLunch: -\nDinner: -\nAccommodation: -\n\nNumber of people: 2\nTotal cost: (55 x 2) + (62 x 2) = 234\n\nTotal cost across all days: 620 + 674 + 484 + 502 + 234 = 2514\n\nThe revised plan still exceeds the budget. Further adjustments are needed, such as choosing more affordable dining options and reducing attraction costs. However, without specific costs for attractions and a more detailed list of dining options with prices, it's challenging to create a plan that fits the budget. Please provide additional information or consider increasing the budget to accommodate the desired itinerary.", "gpt-4-1106-preview_direct_sole-planning_parsed_results": [{"day": 1, "current_city": "from Grand Junction to Phoenix, Arizona", "transportation": "Self-driving, from Grand Junction to Phoenix, duration: 9 hours 11 mins, distance: 934 km", "breakfast": "-", "attraction": "-", "lunch": "-", "dinner": "Pizza Hut, Phoenix, Arizona", "accommodation": "1 BR in Carroll Gardens Townhouse, Phoenix, Arizona"}, {"day": 2, "current_city": "Phoenix, Arizona", "transportation": "-", "breakfast": "Doughlicious, Phoenix, Arizona", "attraction": "Phoenix Zoo, Phoenix;Heard Museum, Phoenix;", "lunch": "Mama Loca, Phoenix, Arizona", "dinner": "Village Restaurant, Phoenix, Arizona", "accommodation": "1 BR in Carroll Gardens Townhouse, Phoenix, Arizona"}, {"day": 3, "current_city": "from Phoenix to Tucson, Arizona", "transportation": "Self-driving, from Phoenix to Tucson, duration: 1 hour 44 mins, distance: 181 km", "breakfast": "Mocambo, Phoenix, Arizona", "attraction": "Pima Air & Space Museum, Tucson;Reid Park Zoo, Tucson;", "lunch": "Villa Tevere, Tucson, Arizona", "dinner": "Consort Restaurant, Tucson, Arizona", "accommodation": "Room for rent shared bathroom, Tucson, Arizona"}, {"day": 4, "current_city": "Tucson, Arizona", "transportation": "-", "breakfast": "Magic Spice Wok, Tucson, Arizona", "attraction": "Tucson Botanical Gardens, Tucson;Old Tucson, Tucson;", "lunch": "La Plage, Tucson, Arizona", "dinner": "iKitchen, Tucson, Arizona", "accommodation": "Room for rent shared bathroom, Tucson, Arizona"}, {"day": 5, "current_city": "from Tucson to Grand Junction", "transportation": "Self-driving, from Tucson to Grand Junction, duration: 10 hours 36 mins, distance: 1,113 km", "breakfast": "Chai Point, Tucson, Arizona", "attraction": "-", "lunch": "-", "dinner": "-", "accommodation": "-"}]}]