[{"gpt-4-1106-preview_direct_sole-planning_results": "Travel Plan:\n\nDays: 1\nCurrent City: from Billings to Flagstaff, Arizona\nTransportation: Self-driving, from Billings to Flagstaff, duration: 16 hours 29 mins, distance: 1,719 km, cost: 85\nBreakfast: -\nAttraction: -\nLunch: -\nDinner: -\nAccommodation: Large Bedroom in 2 Bed Apartment Brighton Beach, Flagstaff, Arizona, cost: 959, room type: Private room, house rules: No children under 10, minimum nights: 1, maximum occupancy: 2\n\nNumber of people: 6\nTotal cost: 85 x 6 + 959 x 3 = 510 + 2877 = 3387\nAccommodation minimum nights: 1/1\n\nDays: 2\nCurrent City: Flagstaff, Arizona\nTransportation: -\nBreakfast: Sushi Thai Restaurant, Flagstaff, Arizona, cost: 49, cuisines: Tea, Bakery, BBQ, Desserts\nAttraction: Riordan Mansion State Historic Park, Flagstaff; Lowell Observatory, Flagstaff\nLunch: Rhubarb Le Restaurant, Flagstaff, Arizona, cost: 157, cuisines: Desserts, Cafe, Mexican, Bakery, Chinese, Seafood\nDinner: Communiti, Flagstaff, Arizona, cost: 16, cuisines: Tea, Mexican, Indian, BBQ\nAccommodation: Large Bedroom in 2 Bed Apartment Brighton Beach, Flagstaff, Arizona, cost: 959, room type: Private room, house rules: No children under 10, minimum nights: 1, maximum occupancy: 2\n\nNumber of people: 6\nTotal cost: (49 + 157 + 16) x 6 + 959 x 3 = 1332 + 2877 = 4209\nAccommodation minimum nights: 2/1\n\nDays: 3\nCurrent City: from Flagstaff to Yuma, Arizona\nTransportation: Self-driving, from Flagstaff to Yuma, duration: 4 hours 46 mins, distance: 504 km, cost: 25\nBreakfast: Bamboo Boat, Flagstaff, Arizona, cost: 77, cuisines: Bakery, Mexican, BBQ, Desserts\nAttraction: -\nLunch: -\nDinner: -\nAccommodation: carriage house apartment, Yuma, Arizona, cost: 468, room type: Entire home/apt, house rules: No visitors & No parties, minimum nights: 1, maximum occupancy: 4\n\nNumber of people: 6\nTotal cost: 25 x 6 + 77 x 6 + 468 x 2 = 150 + 462 + 936 = 1548\nAccommodation minimum nights: 1/1\n\nDays: 4\nCurrent City: Yuma, Arizona\nTransportation: -\nBreakfast: Granite City Food & Brewery, Yuma, Arizona, cost: 63, cuisines: Fast Food, Seafood, Bakery, Italian\nAttraction: Colorado River State Historic Park, Yuma; Yuma Territorial Prison State Historic Park, Yuma\nLunch: Hollerbach's Willow Tree Caf\u00e9, Yuma, Arizona, cost: 73, cuisines: Desserts, BBQ, Fast Food, Cafe, Mediterranean\nDinner: Farzi Cafe, Yuma, Arizona, cost: 32, cuisines: Mexican, Desserts, Seafood\nAccommodation: carriage house apartment, Yuma, Arizona, cost: 468, room type: Entire home/apt, house rules: No visitors & No parties, minimum nights: 1, maximum occupancy: 4\n\nNumber of people: 6\nTotal cost: (63 + 73 + 32) x 6 + 468 x 2 = 1008 + 936 = 1944\nAccommodation minimum nights: 2/1\n\nDays: 5\nCurrent City: from Yuma to Phoenix, Arizona\nTransportation: Self-driving, from Yuma to Phoenix, duration: 2 hours 52 mins, distance: 298 km, cost: 14\nBreakfast: Writer's Cafe, Yuma, Arizona, cost: 14, cuisines: French, Cafe, Fast Food\nAttraction: -\nLunch: -\nDinner: -\nAccommodation: Cozy Room in East Harlem, Phoenix, Arizona, cost: 779, room type: Private room, house rules: No visitors, minimum nights: 3, maximum occupancy: 2\n\nNumber of people: 6\nTotal cost: 14 x 6 + 14 x 6 + 779 x 3 = 84 + 84 + 2337 = 2505\nAccommodation minimum nights: 1/3\n\nDays: 6\nCurrent City: Phoenix, Arizona\nTransportation: -\nBreakfast: Pizza Hut, Phoenix, Arizona, cost: 30, cuisines: Tea, Chinese, Desserts, Seafood\nAttraction: Phoenix Zoo, Phoenix; Heard Museum, Phoenix\nLunch: Doughlicious, Phoenix, Arizona, cost: 41, cuisines: French, Pizza, BBQ\nDinner: Mama Loca, Phoenix, Arizona, cost: 27, cuisines: Desserts, Pizza, Italian, Bakery, Fast Food\nAccommodation: Cozy Room in East Harlem, Phoenix, Arizona, cost: 779, room type: Private room, house rules: No visitors, minimum nights: 3, maximum occupancy: 2\n\nNumber of people: 6\nTotal cost: (30 + 41 + 27) x 6 + 779 x 3 = 588 + 2337 = 2925\nAccommodation minimum nights: 2/3\n\nDays: 7\nCurrent City: from Phoenix to Billings\nTransportation: Self-driving, from Phoenix to Billings, duration: 18 hours 23 mins, distance: 1,946 km, cost: 97\nBreakfast: -\nAttraction: -\nLunch: -\nDinner: -\nAccommodation: -\n\nNumber of people: 6\nTotal cost: 97 x 6 = 582\n\nTotal cost across all days: 3387 + 4209 + 1548 + 1944 + 2505 + 2925 + 582 = 17100\n\nCuisines: The prompt specifies no cuisines, so all cuisine constraints are satisfied\n\nNote: The total cost exceeds the specified budget of $11,700. Adjustments to the plan, such as changing accommodations or meal plans, may be necessary to meet the budget constraint. Additionally, the accommodation on Day 5 requires a minimum of 3 nights, which does not fit the travel plan schedule. This needs to be addressed to ensure a feasible itinerary.", "gpt-4-1106-preview_direct_sole-planning_parsed_results": [{"day": 1, "current_city": "from Billings to Flagstaff, Arizona", "transportation": "Self-driving, from Billings to Flagstaff, Arizona, duration: 16 hours 29 mins, distance: 1,719 km", "breakfast": "-", "attraction": "-", "lunch": "-", "dinner": "-", "accommodation": "Large Bedroom in 2 Bed Apartment Brighton Beach, Flagstaff, Arizona"}, {"day": 2, "current_city": "Flagstaff, Arizona", "transportation": "-", "breakfast": "Sushi Thai Restaurant, Flagstaff, Arizona", "attraction": "Riordan Mansion State Historic Park, Flagstaff;Lowell Observatory, Flagstaff", "lunch": "Rhubarb Le Restaurant, Flagstaff, Arizona", "dinner": "Communiti, Flagstaff, Arizona", "accommodation": "Large Bedroom in 2 Bed Apartment Brighton Beach, Flagstaff, Arizona"}, {"day": 3, "current_city": "from Flagstaff to Yuma, Arizona", "transportation": "Self-driving, from Flagstaff to Yuma, Arizona, duration: 4 hours 46 mins, distance: 504 km", "breakfast": "Bamboo Boat, Flagstaff, Arizona", "attraction": "-", "lunch": "-", "dinner": "-", "accommodation": "carriage house apartment, Yuma, Arizona"}, {"day": 4, "current_city": "Yuma, Arizona", "transportation": "-", "breakfast": "Granite City Food & Brewery, Yuma, Arizona", "attraction": "Colorado River State Historic Park, Yuma;Yuma Territorial Prison State Historic Park, Yuma", "lunch": "Hollerbach's Willow Tree Caf\u00e9, Yuma, Arizona", "dinner": "Farzi Cafe, Yuma, Arizona", "accommodation": "carriage house apartment, Yuma, Arizona"}, {"day": 5, "current_city": "from Yuma to Phoenix, Arizona", "transportation": "Self-driving, from Yuma to Phoenix, Arizona, duration: 2 hours 52 mins, distance: 298 km", "breakfast": "Writer's Cafe, Yuma, Arizona", "attraction": "-", "lunch": "-", "dinner": "-", "accommodation": "Cozy Room in East Harlem, Phoenix, Arizona"}, {"day": 6, "current_city": "Phoenix, Arizona", "transportation": "-", "breakfast": "Pizza Hut, Phoenix, Arizona", "attraction": "Phoenix Zoo, Phoenix;Heard Museum, Phoenix", "lunch": "Doughlicious, Phoenix, Arizona", "dinner": "Mama Loca, Phoenix, Arizona", "accommodation": "Cozy Room in East Harlem, Phoenix, Arizona"}, {"day": 7, "current_city": "from Phoenix to Billings", "transportation": "Self-driving, from Phoenix to Billings, duration: 18 hours 23 mins, distance: 1,946 km", "breakfast": "-", "attraction": "-", "lunch": "-", "dinner": "-", "accommodation": "-"}]}]