[{"gpt-4-1106-preview_direct_sole-planning_results": "Travel Plan:\n\nDay 1: March 25th, 2022\nCurrent City: from Columbus to Newark\nTransportation: Flight F4076294, from Columbus to Newark, duration: 1 hour 51 minutes, cost: $116 per person\nBreakfast: -\nAttraction: -\nLunch: -\nDinner: -\nAccommodation: Large Two Story Loft in the Heart of West Village, Newark, cost: $1127, room type: Entire home/apt, house rules: No pets & No children under 10, minimum nights: 3, maximum occupancy: 5\n\nNumber of people: 2\nTotal cost: (116 x 2) + (1127 x 1) = 1359\nAccommodation minimum nights: 1/3\n\nNote: The accommodation exceeds the budget and does not meet the children under 10 requirement. Adjusting the plan to meet the constraints.\n\nAdjusted Accommodation: Gramercy One Bedroom w Two Beds, Newark, cost: $485, room type: Entire home/apt, house rules: No visitors & No children under 10, minimum nights: 7, maximum occupancy: 4\n\nAdjusted Total cost: (116 x 2) + (485 x 1) = 717\nAccommodation minimum nights: 1/7\n\nNote: The accommodation still does not meet the children under 10 requirement. Adjusting the plan again.\n\nFinal Accommodation: Contemporary Brooklyn Lifestyle Apt /JFK Airport, Newark, cost: $610, room type: Entire home/apt, house rules: No pets, minimum nights: 2, maximum occupancy: 6\n\nFinal Total cost: (116 x 2) + (610 x 1) = 842\nAccommodation minimum nights: 1/2\n\nDay 2: March 26th, 2022\nCurrent City: Newark\nTransportation: -\nBreakfast: Artistry, Newark, cost: $79, cuisines: Cafe, Pizza, Desserts, Seafood\nAttraction: The Newark Museum of Art, Newark\nLunch: Angeethi Restaurant, Newark, cost: $12, cuisines: French, BBQ, Fast Food\nDinner: Mirage Restro Bar, Newark, cost: $51, cuisines: Bakery, American, Desserts, Fast Food\nAccommodation: Contemporary Brooklyn Lifestyle Apt /JFK Airport, Newark, cost: $610, room type: Entire home/apt, house rules: No pets, minimum nights: 2, maximum occupancy: 6\n\nNumber of people: 2\nTotal cost: (79 x 2) + (12 x 2) + (51 x 2) + (610 x 1) = 894\nAccommodation minimum nights: 2/2\n\nDay 3: March 27th, 2022\nCurrent City: from Newark to Columbus\nTransportation: Flight F4076752, from Newark to Columbus, duration: 1 hour 35 minutes, cost: $129 per person\nBreakfast: -\nAttraction: -\nLunch: -\nDinner: -\nAccommodation: -\n\nNumber of people: 2\nTotal cost: 129 x 2 = 258\n\nTotal cost across all days: 842 + 894 + 258 = 1994\n\nCuisines: The prompt specifies no cuisines, so all cuisine constraints are satisfied.\n\nNote: The total cost exceeds the revised budget of $1,200. Adjusting the plan to meet the budget constraint.\n\nAdjusted Day 2 Meals:\nBreakfast: Drifters Cafe, Newark, cost: $24, cuisines: Tea, BBQ\nLunch: New Garden Hut, Newark, cost: $12, cuisines: Tea, Cafe, Pizza, Fast Food\nDinner: Angeethi Restaurant, Newark, cost: $12, cuisines: French, BBQ, Fast Food\n\nAdjusted Day 2 Total cost: (24 x 2) + (12 x 2) + (12 x 2) + (610 x 1) = 694\n\nAdjusted Total cost across all days: 842 + 694 + 258 = 1794\n\nThe plan still exceeds the budget. Since the budget cannot be met with the current constraints, the travel plan cannot be completed within the specified budget of $1,200.", "gpt-4-1106-preview_direct_sole-planning_parsed_results": [{"day": 1, "current_city": "from Columbus to Newark", "transportation": "Flight Number: F4076294, from Columbus to Newark, Departure Time: -, Arrival Time: -", "breakfast": "-", "attraction": "-", "lunch": "-", "dinner": "-", "accommodation": "Contemporary Brooklyn Lifestyle Apt /JFK Airport, Newark"}, {"day": 2, "current_city": "Newark", "transportation": "-", "breakfast": "Drifters Cafe, Newark", "attraction": "The Newark Museum of Art, Newark", "lunch": "New Garden Hut, Newark", "dinner": "Angeethi Restaurant, Newark", "accommodation": "Contemporary Brooklyn Lifestyle Apt /JFK Airport, Newark"}, {"day": 3, "current_city": "from Newark to Columbus", "transportation": "Flight Number: F4076752, from Newark to Columbus, Departure Time: -, Arrival Time: -", "breakfast": "-", "attraction": "-", "lunch": "-", "dinner": "-", "accommodation": "-"}]}]