[{"gpt-4-1106-preview_direct_sole-planning_results": "Travel Plan:\n\nDays: 1\nCurrent City: from Colorado Springs to Moline, Illinois\nTransportation: Self-driving, from Colorado Springs to Moline, duration: 12 hours 49 mins, distance: 1,467 km, cost: 73\nBreakfast: -\nAttraction: -\nLunch: -\nDinner: -\nAccommodation: Sunny duplex near Central Park, Moline, Illinois, cost: 541, room type: Entire home/apt, house rules: No pets, minimum nights: 1, maximum occupancy: 5\n\nNumber of people: 1\nTotal cost: 73 x 1 + 541 x 1 = 614\nAccommodation minimum nights: 1/1\n\nDays: 2\nCurrent City: Moline, Illinois\nTransportation: -\nBreakfast: Royal Hotel, Moline, Illinois, cost: 74, cuisines: Tea, Pizza, Mexican, Chinese, Seafood\nAttraction: John Deere Pavilion, Moline; Celebration River Cruises, Moline\nLunch: Zoe, Moline, Illinois, cost: 15, cuisines: French, Cafe, Fast Food\nDinner: ZASTY, Moline, Illinois, cost: 82, cuisines: Pizza, Indian, BBQ, Cafe, American, Seafood\nAccommodation: Sunny duplex near Central Park, Moline, Illinois, cost: 541, room type: Entire home/apt, house rules: No pets, minimum nights: 1, maximum occupancy: 5\n\nNumber of people: 1\nTotal cost: 74 x 1 + 15 x 1 + 82 x 1 + 541 x 1 = 712\nAccommodation minimum nights: 2/1\n\nDays: 3\nCurrent City: from Moline, Illinois to Rockford, Illinois\nTransportation: Self-driving, from Moline to Rockford, duration: 2 hours 1 min, distance: 194 km, cost: 9\nBreakfast: Lovecrumbs Bakery, Moline, Illinois, cost: 24, cuisines: Tea, Pizza, American, Desserts\nAttraction: Anderson Japanese Gardens, Rockford; Burpee Museum of Natural History, Rockford\nLunch: Flying Mango, Rockford, Illinois, cost: 20, cuisines: American, BBQ, Seafood\nDinner: Coco Bambu, Rockford, Illinois, cost: 72, cuisines: Tea, French, Bakery, BBQ, Cafe\nAccommodation: Park Side Zen Home - Terrace & next to CentralPark, Rockford, Illinois, cost: 250, room type: Entire home/apt, house rules: No children under 10, minimum nights: 3, maximum occupancy: 3\n\nNumber of people: 1\nTotal cost: 9 x 1 + 24 x 1 + 20 x 1 + 72 x 1 + 250 x 1 = 375\nAccommodation minimum nights: 1/3\n\nDays: 4\nCurrent City: Rockford, Illinois\nTransportation: -\nBreakfast: Nutri Punch, Rockford, Illinois, cost: 34, cuisines: Tea, Chinese, Cafe, Desserts\nAttraction: Discovery Center Museum, Rockford; Sinnissippi Park, Rockford\nLunch: Cafe Southall, Rockford, Illinois, cost: 56, cuisines: Seafood, Pizza, Cafe, Fast Food\nDinner: Eggspectation - Jaypee Vasant Continental, Rockford, Illinois, cost: 77, cuisines: Tea, Mediterranean, Seafood\nAccommodation: Park Side Zen Home - Terrace & next to CentralPark, Rockford, Illinois, cost: 250, room type: Entire home/apt, house rules: No children under 10, minimum nights: 3, maximum occupancy: 3\n\nNumber of people: 1\nTotal cost: 34 x 1 + 56 x 1 + 77 x 1 + 250 x 1 = 417\nAccommodation minimum nights: 2/3\n\nDays: 5\nCurrent City: from Rockford, Illinois to Colorado Springs\nTransportation: Self-driving, from Rockford to Colorado Springs, duration: 14 hours 38 mins, distance: 1,653 km, cost: 82\nBreakfast: -\nAttraction: -\nLunch: -\nDinner: -\nAccommodation: -\n\nNumber of people: 1\nTotal cost: 82 x 1 = 82\n\nTotal cost across all days: 614 + 712 + 375 + 417 + 82 = 2,200\n\nUnfortunately, the total cost exceeds the specified budget of $1,900. Adjustments need to be made to the plan to reduce costs. Here are some suggestions:\n\n- Opt for more budget-friendly accommodations.\n- Choose less expensive restaurants for meals.\n- Reduce the number of paid attractions visited.\n\nPlease note that the provided information does not include budget options for accommodations and restaurants, so specific adjustments cannot be made without additional data.", "gpt-4-1106-preview_direct_sole-planning_parsed_results": [{"day": 1, "current_city": "from Colorado Springs to Moline, Illinois", "transportation": "Self-driving, from Colorado Springs to Moline, duration: 12 hours 49 mins, distance: 1,467 km", "breakfast": "-", "attraction": "-", "lunch": "-", "dinner": "-", "accommodation": "Sunny duplex near Central Park, Moline, Illinois"}, {"day": 2, "current_city": "Moline, Illinois", "transportation": "-", "breakfast": "Royal Hotel, Moline, Illinois", "attraction": "John Deere Pavilion, Moline;Celebration River Cruises, Moline;", "lunch": "Zoe, Moline, Illinois", "dinner": "ZASTY, Moline, Illinois", "accommodation": "Sunny duplex near Central Park, Moline, Illinois"}, {"day": 3, "current_city": "from Moline, Illinois to Rockford, Illinois", "transportation": "Self-driving, from Moline to Rockford, duration: 2 hours 1 min, distance: 194 km", "breakfast": "Lovecrumbs Bakery, Moline, Illinois", "attraction": "Anderson Japanese Gardens, Rockford;Burpee Museum of Natural History, Rockford;", "lunch": "Flying Mango, Rockford, Illinois", "dinner": "Coco Bambu, Rockford, Illinois", "accommodation": "Park Side Zen Home - Terrace & next to CentralPark, Rockford, Illinois"}, {"day": 4, "current_city": "Rockford, Illinois", "transportation": "-", "breakfast": "Nutri Punch, Rockford, Illinois", "attraction": "Discovery Center Museum, Rockford;Sinnissippi Park, Rockford;", "lunch": "Cafe Southall, Rockford, Illinois", "dinner": "Eggspectation - Jaypee Vasant Continental, Rockford, Illinois", "accommodation": "Park Side Zen Home - Terrace & next to CentralPark, Rockford, Illinois"}, {"day": 5, "current_city": "from Rockford, Illinois to Colorado Springs", "transportation": "Self-driving, from Rockford to Colorado Springs, duration: 14 hours 38 mins, distance: 1,653 km", "breakfast": "-", "attraction": "-", "lunch": "-", "dinner": "-", "accommodation": "-"}]}]