[{"gpt-4-1106-preview_direct_sole-planning_results": "Travel Plan:\n\nDays: 1\nCurrent City: from Boston to Syracuse\nTransportation: Self-driving, from Boston to Syracuse, duration: 4 hours 43 mins, distance: 502 km, cost: 25\nBreakfast: -\nAttraction: Erie Canal Museum, Syracuse; Rosamond Gifford Zoo, Syracuse\nLunch: Silantro Fil-Mex, Syracuse, New York, cost: 29, cuisines: Chinese, BBQ, Mediterranean, Fast Food\nDinner: Tucanos, Syracuse, New York, cost: 36, cuisines: Pizza, BBQ, Desserts\nAccommodation: The Gramercy East, Syracuse, New York, cost: 1031, room type: Entire home/apt, house rules: No parties & No pets, minimum nights: 2, maximum occupancy: 3\n\nNumber of people: 2\nTotal cost: (25 x 2) + (29 x 2) + (36 x 2) + (1031 x 1) = 1186\nAccommodation minimum nights: 1/2\n\nDays: 2\nCurrent City: Syracuse\nTransportation: -\nBreakfast: Darjeeling Kanchanjanga Momos, Syracuse, New York, cost: 100, cuisines: Tea, Italian, BBQ, Indian, Seafood\nAttraction: Museum of Science & Technology, Syracuse; Everson Museum of Art, Syracuse\nLunch: Raj Restaurant, Syracuse, New York, cost: 61, cuisines: French, Bakery, Indian, BBQ\nDinner: Mezzaluna, Syracuse, New York, cost: 41, cuisines: Pizza, Indian, Desserts, Fast Food\nAccommodation: The Gramercy East, Syracuse, New York, cost: 1031, room type: Entire home/apt, house rules: No parties & No pets, minimum nights: 2, maximum occupancy: 3\n\nNumber of people: 2\nTotal cost: (100 x 2) + (61 x 2) + (41 x 2) + (1031 x 1) = 1435\nAccommodation minimum nights: 2/2\n\nDays: 3\nCurrent City: from Syracuse to New York\nTransportation: Self-driving, from Syracuse to New York, duration: 4 hours 4 mins, distance: 397 km, cost: 19\nBreakfast: KG Confectionery and Pastry Shop, Syracuse, New York, cost: 21, cuisines: Tea, Cafe, Desserts, Seafood\nAttraction: Top of The Rock, New York; One World Observatory, New York\nLunch: Seasons 52 Fresh Grill, New York, cost: 30, cuisines: Seafood, Indian, Desserts, Italian\nDinner: Gurgaon Hights, New York, cost: 46, cuisines: Cafe, American, Indian, Fast Food\nAccommodation: Beautiful and big 1BR sublet close by Central Park, New York, cost: 983, room type: Private room, house rules: No parties & No children under 10, minimum nights: 5, maximum occupancy: 2\n\nNumber of people: 2\nTotal cost: (19 x 2) + (21 x 2) + (30 x 2) + (46 x 2) + (983 x 1) = 1197\nAccommodation minimum nights: 1/5\n\nDays: 4\nCurrent City: New York\nTransportation: -\nBreakfast: Green Chick Chop, New York, cost: 26, cuisines: Tea, French, Cafe, Seafood\nAttraction: The High Line, New York; Empire State Building, New York\nLunch: Lord of the Drinks Forum, New York, cost: 71, cuisines: Cafe, Bakery, BBQ, Chinese, Indian\nDinner: Aryan's Rajasthani Pyaz Ki Kachori, New York, cost: 17, cuisines: Cafe, Pizza, Indian, Seafood\nAccommodation: Beautiful and big 1BR sublet close by Central Park, New York, cost: 983, room type: Private room, house rules: No parties & No children under 10, minimum nights: 5, maximum occupancy: 2\n\nNumber of people: 2\nTotal cost: (26 x 2) + (71 x 2) + (17 x 2) + (983 x 1) = 1219\nAccommodation minimum nights: 2/5\n\nDays: 5\nCurrent City: from New York to Boston\nTransportation: Self-driving, from New York to Boston, duration: 3 hours 41 mins, distance: 346 km, cost: 17\nBreakfast: -\nAttraction: -\nLunch: -\nDinner: -\nAccommodation: -\n\nNumber of people: 2\nTotal cost: 17 x 2 = 34\n\nTotal cost across all days: 1186 + 1435 + 1197 + 1219 + 34 = 5071\n\nUnfortunately, the total cost of $5,071 exceeds the specified budget of $2,700. Adjustments are needed to meet the budget constraint. Let's revise the plan to fit within the budget:\n\nRevised Travel Plan:\n\nDays: 1\nCurrent City: from Boston to Syracuse\nTransportation: Self-driving, from Boston to Syracuse, duration: 4 hours 43 mins, distance: 502 km, cost: 25\nBreakfast: -\nAttraction: Erie Canal Museum, Syracuse\nLunch: Silantro Fil-Mex, Syracuse, New York, cost: 29, cuisines: Chinese, BBQ, Mediterranean, Fast Food\nDinner: Tucanos, Syracuse, New York, cost: 36, cuisines: Pizza, BBQ, Desserts\nAccommodation: Chic Apartment for rent in East Village, Syracuse, New York, cost: 430, room type: Entire home/apt, house rules: No pets, minimum nights: 2, maximum occupancy: 2\n\nNumber of people: 2\nTotal cost: (25 x 2) + (29 x 2) + (36 x 2) + (430 x 1) = 602\nAccommodation minimum nights: 1/2\n\nDays: 2\nCurrent City: Syracuse\nTransportation: -\nBreakfast: Cafe Coffee Day, Syracuse, New York, cost: 16, cuisines: Tea, Cafe, BBQ\nAttraction: Rosamond Gifford Zoo, Syracuse\nLunch: Raj Restaurant, Syracuse, New York, cost: 61, cuisines: French, Bakery, Indian, BBQ\nDinner: Mezzaluna, Syracuse, New York, cost: 41, cuisines: Pizza, Indian, Desserts, Fast Food\nAccommodation: Chic Apartment for rent in East Village, Syracuse, New York, cost: 430, room type: Entire home/apt, house rules: No pets, minimum nights: 2, maximum occupancy: 2\n\nNumber of people: 2\nTotal cost: (16 x 2) + (61 x 2) + (41 x 2) + (430 x 1) = 666\nAccommodation minimum nights: 2/2\n\nDays: 3\nCurrent City: from Syracuse to New York\nTransportation: Self-driving, from Syracuse to New York, duration: 4 hours 4 mins, distance: 397 km, cost: 19\nBreakfast: KG Confectionery and Pastry Shop, Syracuse, New York, cost: 21, cuisines: Tea, Cafe, Desserts, Seafood\nAttraction: Top of The Rock, New York\nLunch: Seasons 52 Fresh Grill, New York, cost: 30, cuisines: Seafood, Indian, Desserts, Italian\nDinner: Gurgaon Hights, New York, cost: 46, cuisines: Cafe, American, Indian, Fast Food\nAccommodation: Sunny 2 bedroom apartment!, New York, cost: 201, room type: Entire home/apt, house rules: No pets & No smoking, minimum nights: 1, maximum occupancy: 3\n\nNumber of people: 2\nTotal cost: (19 x 2) + (21 x 2) + (30 x 2) + (46 x 2) + (201 x 1) = 414\nAccommodation minimum nights: 1/1\n\nDays: 4\nCurrent City: New York\nTransportation: -\nBreakfast: Green Chick Chop, New York, cost: 26, cuisines: Tea, French, Cafe, Seafood\nAttraction: The High Line, New York\nLunch: Lord of the Drinks Forum, New York, cost: 71, cuisines: Cafe, Bakery, BBQ, Chinese, Indian\nDinner: Aryan's Rajasthani Pyaz Ki Kachori, New York, cost: 17, cuisines: Cafe, Pizza, Indian, Seafood\nAccommodation: Sunny 2 bedroom apartment!, New York, cost: 201, room type: Entire home/apt, house rules: No pets & No smoking, minimum nights: 1, maximum occupancy: 3\n\nNumber of people: 2\nTotal cost: (26 x 2) + (71 x 2) + (17 x 2) + (201 x 1) = 429\nAccommodation minimum nights: 2/1\n\nDays: 5\nCurrent City: from New York to Boston\nTransportation: Self-driving, from New York to Boston, duration: 3 hours 41 mins, distance: 346 km, cost: 17\nBreakfast: -\nAttraction: -\nLunch: -\nDinner: -\nAccommodation: -\n\nNumber of people: 2\nTotal cost: 17 x 2 = 34\n\nTotal cost across all days: 602 + 666 + 414 + 429 + 34 = 2145\n\nThe revised total cost of $2,145 is within the specified budget of $2,700.", "gpt-4-1106-preview_direct_sole-planning_parsed_results": [{"day": 1, "current_city": "from Boston to Syracuse", "transportation": "Self-driving, from Boston to Syracuse, duration: 4 hours 43 mins, distance: 502 km", "breakfast": "-", "attraction": "Erie Canal Museum, Syracuse;", "lunch": "Silantro Fil-Mex, Syracuse", "dinner": "Tucanos, Syracuse", "accommodation": "Chic Apartment for rent in East Village, Syracuse"}, {"day": 2, "current_city": "Syracuse", "transportation": "-", "breakfast": "Cafe Coffee Day, Syracuse", "attraction": "Rosamond Gifford Zoo, Syracuse;", "lunch": "Raj Restaurant, Syracuse", "dinner": "Mezzaluna, Syracuse", "accommodation": "Chic Apartment for rent in East Village, Syracuse"}, {"day": 3, "current_city": "from Syracuse to New York", "transportation": "Self-driving, from Syracuse to New York, duration: 4 hours 4 mins, distance: 397 km", "breakfast": "KG Confectionery and Pastry Shop, Syracuse", "attraction": "Top of The Rock, New York;", "lunch": "Seasons 52 Fresh Grill, New York", "dinner": "Gurgaon Hights, New York", "accommodation": "Sunny 2 bedroom apartment!, New York"}, {"day": 4, "current_city": "New York", "transportation": "-", "breakfast": "Green Chick Chop, New York", "attraction": "The High Line, New York;", "lunch": "Lord of the Drinks Forum, New York", "dinner": "Aryan's Rajasthani Pyaz Ki Kachori, New York", "accommodation": "Sunny 2 bedroom apartment!, New York"}, {"day": 5, "current_city": "from New York to Boston", "transportation": "Self-driving, from New York to Boston, duration: 3 hours 41 mins, distance: 346 km", "breakfast": "-", "attraction": "-", "lunch": "-", "dinner": "-", "accommodation": "-"}]}]