[{"gpt-4-1106-preview_direct_sole-planning_results": "Travel Plan:\n\nDays: 1\nCurrent City: from Baton Rouge to Dallas\nTransportation: Self-driving, from Baton Rouge to Dallas, duration: 6 hours 15 mins, distance: 687 km, cost: 34\nBreakfast: -\nAttraction: -\nLunch: -\nDinner: -\nAccommodation: *Fresh Budget Room, Dallas, Texas, cost: 262, maximum occupancy: 1, house rules: No visitors & No smoking, minimum nights: 2\n\nNumber of people: 4\nTotal cost: (34 x 4) + (262 x 4) = 136 + 1048 = 1184\nAccommodation minimum nights: 1/2\n\nDays: 2\nCurrent City: Dallas, Texas\nTransportation: -\nBreakfast: Drifters Cafe, Dallas, Texas, cost: 21, cuisines: Tea, French, Mexican, Cafe, Seafood\nAttraction: Reunion Tower, Dallas; Dallas Zoo, Dallas\nLunch: Coconuts Fish Cafe, Dallas, Texas, cost: 38, cuisines: Cafe, BBQ, Mediterranean, Fast Food\nDinner: Bikaner Sweets, Dallas, Texas, cost: 23, cuisines: Tea, French, Bakery, Cafe, Seafood\nAccommodation: *Fresh Budget Room, Dallas, Texas, cost: 262, maximum occupancy: 1, house rules: No visitors & No smoking, minimum nights: 2\n\nNumber of people: 4\nTotal cost: (21 x 4) + (38 x 4) + (23 x 4) + (262 x 4) = 84 + 152 + 92 + 1048 = 1376\nAccommodation minimum nights: 2/2\n\nDays: 3\nCurrent City: from Dallas to Baton Rouge\nTransportation: Self-driving, from Dallas to Baton Rouge, duration: 6 hours 17 mins, distance: 687 km, cost: 34\nBreakfast: Cafe Coffee Day, Dallas, Texas, cost: 22, cuisines: Cafe, BBQ, Desserts, Seafood\nAttraction: -\nLunch: -\nDinner: -\nAccommodation: -\n\nNumber of people: 4\nTotal cost: (34 x 4) + (22 x 4) = 136 + 88 = 224\n\nTotal cost across all days: 1184 + 1376 + 224 = 2784\n\nCuisines: The prompt specifies no cuisines, so all cuisine constraints are satisfied\n\nNote: The provided accommodation options do not allow smoking, which is a requirement for the group. Since the query specifies that smoking is crucial, we cannot select any of the listed accommodations as they all have \"No smoking\" house rules. Therefore, the accommodation listed in the plan does not meet the smoking requirement, and an alternative accommodation that permits smoking should be found within the budget.", "gpt-4-1106-preview_direct_sole-planning_parsed_results": [{"day": 1, "current_city": "from Baton Rouge to Dallas", "transportation": "Self-driving, from Baton Rouge to Dallas, duration: 6 hours 15 mins, distance: 687 km", "breakfast": "-", "attraction": "-", "lunch": "-", "dinner": "-", "accommodation": "Fresh Budget Room, Dallas"}, {"day": 2, "current_city": "Dallas", "transportation": "-", "breakfast": "Drifters Cafe, Dallas", "attraction": "Reunion Tower, Dallas;Dallas Zoo, Dallas;", "lunch": "Coconuts Fish Cafe, Dallas", "dinner": "Bikaner Sweets, Dallas", "accommodation": "Fresh Budget Room, Dallas"}, {"day": 3, "current_city": "from Dallas to Baton Rouge", "transportation": "Self-driving, from Dallas to Baton Rouge, duration: 6 hours 17 mins, distance: 687 km", "breakfast": "Cafe Coffee Day, Dallas", "attraction": "-", "lunch": "-", "dinner": "-", "accommodation": "-"}]}]