[{"gpt-4-1106-preview_direct_sole-planning_results": "Travel Plan:\n\nDays: 1\nCurrent City: from Miami to Dallas, Texas\nTransportation: Flight F3677538, from Miami to Dallas, duration: 2 hours 53 minutes, cost: $346\nBreakfast: -\nAttraction: -\nLunch: -\nDinner: Cafe Gatherings, Dallas, Texas, cost: $17, cuisines: Bakery, Indian, Desserts\nAccommodation: *Fresh Budget Room, Dallas, Texas, cost: $262, maximum occupancy: 1, house rules: No visitors & No smoking, minimum nights: 2\n\nNumber of people: 3\nTotal cost: ($346 x 3) + ($17 x 3) + ($262 x 3) = $1,875\nAccommodation minimum nights: 1/2\n\nDays: 2\nCurrent City: Dallas, Texas\nTransportation: -\nBreakfast: Drifters Cafe, Dallas, Texas, cost: $21, cuisines: Tea, French, Mexican, Cafe, Seafood\nAttraction: The Dallas Arboretum and Botanical Garden, Dallas; Reunion Tower, Dallas\nLunch: MONKS, Dallas, Texas, cost: $24, cuisines: Tea, Pizza, Cafe, Mediterranean, Seafood\nDinner: Salsa Mexican Grill, Dallas, Texas, cost: $63, cuisines: Desserts, BBQ, Bakery, Cafe, American\nAccommodation: *Fresh Budget Room, Dallas, Texas, cost: $262, maximum occupancy: 1, house rules: No visitors & No smoking, minimum nights: 2\n\nNumber of people: 3\nTotal cost: ($21 x 3) + ($24 x 3) + ($63 x 3) + ($262 x 3) = $1,110\nAccommodation minimum nights: 2/2\n\nDays: 3\nCurrent City: from Dallas to Houston, Texas\nTransportation: Flight F3718944, from Dallas to Houston, duration: 1 hour 17 minutes, cost: $77\nBreakfast: Drifters Cafe, Dallas, Texas, cost: $21, cuisines: Tea, French, Mexican, Cafe, Seafood\nAttraction: Space Center Houston, Houston; Houston Museum of Natural Science, Houston\nLunch: The BrewMaster - The Mix Fine Dine, Houston, Texas, cost: $52, cuisines: French, Indian, Cafe, Seafood\nDinner: Jalapenos, Houston, Texas, cost: $57, cuisines: Desserts, Tea, Cafe, Chinese, Seafood\nAccommodation: Sunny and Airy near Manhattan, Houston, Texas, cost: $499, maximum occupancy: 4, house rules: No pets, minimum nights: 2\n\nNumber of people: 3\nTotal cost: ($77 x 3) + ($21 x 3) + ($52 x 3) + ($57 x 3) + ($499 x 1) = $1,335\nAccommodation minimum nights: 1/2\n\nDays: 4\nCurrent City: Houston, Texas\nTransportation: -\nBreakfast: Vinayaka Mylari, Houston, Texas, cost: $14, cuisines: Fast Food, French, Cafe, Italian\nAttraction: Gerald D. Hines Waterwall Park, Houston; Houston Zoo, Houston\nLunch: Truth Coffee, Houston, Texas, cost: $29, cuisines: Pizza, American, Seafood\nDinner: Istanbul Restaurant, Houston, Texas, cost: $19, cuisines: Tea, Indian, Seafood\nAccommodation: Sunny and Airy near Manhattan, Houston, Texas, cost: $499, maximum occupancy: 4, house rules: No pets, minimum nights: 2\n\nNumber of people: 3\nTotal cost: ($14 x 3) + ($29 x 3) + ($19 x 3) + ($499 x 1) = $703\nAccommodation minimum nights: 2/2\n\nDays: 5\nCurrent City: from Houston to Miami\nTransportation: Flight F3658491, from Houston to Miami, duration: 2 hours 18 minutes, cost: $290\nBreakfast: Vinayaka Mylari, Houston, Texas, cost: $14, cuisines: Fast Food, French, Cafe, Italian\nAttraction: -\nLunch: -\nDinner: -\nAccommodation: -\n\nNumber of people: 3\nTotal cost: ($290 x 3) + ($14 x 3) = $912\n\nTotal cost across all days: $1,875 + $1,110 + $1,335 + $703 + $912 = $5,935\nCuisines: Indian and Mediterranean cuisine preferences have been met.\nRemaining budget: $8,500 - $5,935 = $2,565\n\nPlease note that the accommodation in Dallas is booked for two nights as per the minimum stay requirement, and the accommodation in Houston is also booked for two nights. The travel plan includes Indian and Mediterranean cuisine as requested and stays within the specified budget.", "gpt-4-1106-preview_direct_sole-planning_parsed_results": [{"day": 1, "current_city": "from Miami to Dallas, Texas", "transportation": "Flight Number: F3677538, from Miami to Dallas, Departure Time: -, Arrival Time: -", "breakfast": "-", "attraction": "-", "lunch": "-", "dinner": "Cafe Gatherings, Dallas, Texas", "accommodation": "Fresh Budget Room, Dallas, Texas"}, {"day": 2, "current_city": "Dallas, Texas", "transportation": "-", "breakfast": "Drifters Cafe, Dallas, Texas", "attraction": "The Dallas Arboretum and Botanical Garden, Dallas;Reunion Tower, Dallas;", "lunch": "MONKS, Dallas, Texas", "dinner": "Salsa Mexican Grill, Dallas, Texas", "accommodation": "Fresh Budget Room, Dallas, Texas"}, {"day": 3, "current_city": "from Dallas to Houston, Texas", "transportation": "Flight Number: F3718944, from Dallas to Houston, Departure Time: -, Arrival Time: -", "breakfast": "Drifters Cafe, Dallas, Texas", "attraction": "Space Center Houston, Houston;Houston Museum of Natural Science, Houston;", "lunch": "The BrewMaster - The Mix Fine Dine, Houston, Texas", "dinner": "Jalapenos, Houston, Texas", "accommodation": "Sunny and Airy near Manhattan, Houston, Texas"}, {"day": 4, "current_city": "Houston, Texas", "transportation": "-", "breakfast": "Vinayaka Mylari, Houston, Texas", "attraction": "Gerald D. Hines Waterwall Park, Houston;Houston Zoo, Houston;", "lunch": "Truth Coffee, Houston, Texas", "dinner": "Istanbul Restaurant, Houston, Texas", "accommodation": "Sunny and Airy near Manhattan, Houston, Texas"}, {"day": 5, "current_city": "from Houston to Miami", "transportation": "Flight Number: F3658491, from Houston to Miami, Departure Time: -, Arrival Time: -", "breakfast": "Vinayaka Mylari, Houston, Texas", "attraction": "-", "lunch": "-", "dinner": "-", "accommodation": "-"}]}]