[{"gpt-4-1106-preview_direct_sole-planning_results": "Travel Plan:\n\nDays: 1\nCurrent City: from Orlando to Belleville, Illinois\nTransportation: Self-driving, from Orlando to Belleville, duration: 14 hours 12 mins, distance: 1,579 km, cost: 78\nBreakfast: -\nAttraction: -\nLunch: -\nDinner: -\nAccommodation: Cozy, Belleville, Illinois, cost: 184, maximum occupancy: 2, house rules: No visitors & No smoking & No children under 10, minimum nights: 1\n\nNumber of people: 1\nTotal cost: 78 x 1 + 184 x 1 = 262\nAccommodation minimum nights: 1/1\n\nDays: 2\nCurrent City: Belleville, Illinois\nTransportation: -\nBreakfast: Cafe Amaretto, Belleville, Illinois, cost: 35, cuisines: Tea, Pizza, French, Mexican, BBQ, Cafe\nAttraction: Labor & Industrial Museum, Belleville; St. Clair County Historical Society, Belleville\nLunch: Romi da Dhaba, Belleville, Illinois, cost: 24, cuisines: Desserts, BBQ, Fast Food, Cafe, Indian\nDinner: Fuji Japanese Steak House, Belleville, Illinois, cost: 70, cuisines: Bakery, Indian, Cafe\nAccommodation: Cozy, Belleville, Illinois, cost: 184, maximum occupancy: 2, house rules: No visitors & No smoking & No children under 10, minimum nights: 1\n\nNumber of people: 1\nTotal cost: 35 x 1 + 24 x 1 + 70 x 1 + 184 x 1 = 313\nAccommodation minimum nights: 2/1\n\nDays: 3\nCurrent City: from Belleville, Illinois to Chicago, Illinois\nTransportation: Self-driving, from Belleville to Chicago, duration: 4 hours 36 mins, distance: 474 km, cost: 23\nBreakfast: -\nAttraction: -\nLunch: -\nDinner: -\nAccommodation: Beautiful 1 BR by Prospect Park, Chicago, Illinois, cost: 328, maximum occupancy: 3, house rules: No parties & No visitors & No children under 10, minimum nights: 5\n\nNumber of people: 1\nTotal cost: 23 x 1 + 328 x 1 = 351\nAccommodation minimum nights: 1/5\n\nDays: 4\nCurrent City: Chicago, Illinois\nTransportation: -\nBreakfast: The Black Pearl, Chicago, Illinois, cost: 63, cuisines: Cafe, Bakery\nAttraction: Navy Pier, Chicago; Millennium Park, Chicago\nLunch: Pantry d'or, Chicago, Illinois, cost: 53, cuisines: Tea, BBQ, Fast Food, Cafe, Indian\nDinner: Mini's Royal Cafe, Chicago, Illinois, cost: 72, cuisines: Tea, Cafe, Bakery\nAccommodation: Beautiful 1 BR by Prospect Park, Chicago, Illinois, cost: 328, maximum occupancy: 3, house rules: No parties & No visitors & No children under 10, minimum nights: 5\n\nNumber of people: 1\nTotal cost: 63 x 1 + 53 x 1 + 72 x 1 + 328 x 1 = 516\nAccommodation minimum nights: 2/5\n\nDays: 5\nCurrent City: from Chicago, Illinois to Orlando\nTransportation: Flight, from Chicago to Orlando, Flight Number: F3900656, Price: 259, DepTime: 05:59, ArrTime: 09:37, ActualElapsedTime: 2 hours 38 minutes\nBreakfast: -\nAttraction: -\nLunch: -\nDinner: -\nAccommodation: -\n\nNumber of people: 1\nTotal cost: 259 x 1 = 259\n\nTotal cost across all days: 262 + 313 + 351 + 516 + 259 = 1,701\n\nCuisines: The prompt specifies no cuisines, so all cuisine constraints are satisfied", "gpt-4-1106-preview_direct_sole-planning_parsed_results": [{"day": 1, "current_city": "from Orlando to Belleville, Illinois", "transportation": "Self-driving, from Orlando to Belleville, duration: 14 hours 12 mins, distance: 1,579 km", "breakfast": "-", "attraction": "-", "lunch": "-", "dinner": "-", "accommodation": "Cozy, Belleville, Illinois"}, {"day": 2, "current_city": "Belleville, Illinois", "transportation": "-", "breakfast": "Cafe Amaretto, Belleville, Illinois", "attraction": "Labor & Industrial Museum, Belleville;St. Clair County Historical Society, Belleville;", "lunch": "Romi da Dhaba, Belleville, Illinois", "dinner": "Fuji Japanese Steak House, Belleville, Illinois", "accommodation": "Cozy, Belleville, Illinois"}, {"day": 3, "current_city": "from Belleville, Illinois to Chicago, Illinois", "transportation": "Self-driving, from Belleville to Chicago, duration: 4 hours 36 mins, distance: 474 km", "breakfast": "-", "attraction": "-", "lunch": "-", "dinner": "-", "accommodation": "Beautiful 1 BR by Prospect Park, Chicago, Illinois"}, {"day": 4, "current_city": "Chicago, Illinois", "transportation": "-", "breakfast": "The Black Pearl, Chicago, Illinois", "attraction": "Navy Pier, Chicago;Millennium Park, Chicago;", "lunch": "Pantry d'or, Chicago, Illinois", "dinner": "Mini's Royal Cafe, Chicago, Illinois", "accommodation": "Beautiful 1 BR by Prospect Park, Chicago, Illinois"}, {"day": 5, "current_city": "from Chicago, Illinois to Orlando", "transportation": "Flight Number: F3900656, from Chicago to Orlando, Departure Time: 05:59, Arrival Time: 09:37", "breakfast": "-", "attraction": "-", "lunch": "-", "dinner": "-", "accommodation": "-"}]}]