[{"gpt-4-1106-preview_direct_sole-planning_results": "Travel Plan:\n\nDays: 1\nCurrent City: from Richmond to Nashville, Tennessee\nTransportation: Self-driving, from Richmond to Nashville, duration: 9 hours 3 mins, distance: 989 km, cost: 49\nBreakfast: -\nAttraction: -\nLunch: -\nDinner: -\nAccommodation: Huge 2 Bedroom, Great Location, Express Metro, Nashville, Tennessee, cost: 745, maximum occupancy: 4, house rules: No smoking & No children under 10 & No pets, minimum nights: 4\n\nNumber of people: 1\nTotal cost: 49 x 1 + 745 x 1 = 794\nAccommodation minimum nights: 1/4\n\nDays: 2\nCurrent City: Nashville, Tennessee\nTransportation: -\nBreakfast: Bangkok 1, Nashville, Tennessee, cost: 44, cuisines: Cafe, Seafood\nAttraction: Country Music Hall of Fame and Museum, Nashville; The Parthenon, Nashville\nLunch: Veg Hut, Nashville, Tennessee, cost: 35, cuisines: Tea, Mexican, Seafood\nDinner: Smoke House Deli, Nashville, Tennessee, cost: 59, cuisines: Cafe, Mediterranean, Seafood\nAccommodation: Huge 2 Bedroom, Great Location, Express Metro, Nashville, Tennessee, cost: 745, maximum occupancy: 4, house rules: No smoking & No children under 10 & No pets, minimum nights: 4\n\nNumber of people: 1\nTotal cost: 44 x 1 + 35 x 1 + 59 x 1 + 745 x 1 = 883\nAccommodation minimum nights: 2/4\n\nDays: 3\nCurrent City: Nashville, Tennessee\nTransportation: -\nBreakfast: Govinda's Confectionery, Nashville, Tennessee, cost: 15, cuisines: Tea, Bakery, Mediterranean, Fast Food\nAttraction: Grand Ole Opry, Nashville; Ryman Auditorium, Nashville\nLunch: Dialogue Lounge & Caf\u6106, Nashville, Tennessee, cost: 83, cuisines: Tea, Indian, BBQ, Cafe, American, Seafood\nDinner: Oh! Calcutta, Nashville, Tennessee, cost: 83, cuisines: Tea, Mexican, BBQ, Cafe, Indian\nAccommodation: Huge 2 Bedroom, Great Location, Express Metro, Nashville, Tennessee, cost: 745, maximum occupancy: 4, house rules: No smoking & No children under 10 & No pets, minimum nights: 4\n\nNumber of people: 1\nTotal cost: 15 x 1 + 83 x 1 + 83 x 1 + 745 x 1 = 926\nAccommodation minimum nights: 3/4\n\nDays: 4\nCurrent City: from Nashville, Tennessee to Knoxville, Tennessee\nTransportation: Self-driving, from Nashville to Knoxville, duration: 2 hours 42 mins, distance: 290 km, cost: 14\nBreakfast: -\nAttraction: World's Fair Park, Knoxville; Knoxville Museum of Art, Knoxville\nLunch: Cafe Arabelle, Knoxville, Tennessee, cost: 29, cuisines: French, BBQ, Desserts, Seafood\nDinner: Ali Baba & 41 Dishes, Knoxville, Tennessee, cost: 70, cuisines: Pizza, Desserts, Fast Food\nAccommodation: Cozy Private Room in Chinatown/ Lower East Side, Knoxville, Tennessee, cost: 132, maximum occupancy: 2, house rules: No pets & No visitors, minimum nights: 7\n\nNumber of people: 1\nTotal cost: 14 x 1 + 29 x 1 + 70 x 1 + 132 x 1 = 245\nAccommodation minimum nights: 1/7\n\nDays: 5\nCurrent City: from Knoxville, Tennessee to Richmond\nTransportation: Self-driving, from Knoxville to Richmond, duration: 6 hours 23 mins, distance: 701 km, cost: 35\nBreakfast: -\nAttraction: -\nLunch: -\nDinner: -\nAccommodation: -\n\nNumber of people: 1\nTotal cost: 35 x 1 = 35\n\nTotal cost across all days: 794 + 883 + 926 + 245 + 35 = 2,883\n\nUnfortunately, the total cost exceeds the specified budget of $2,600. Adjustments are needed to meet the budget constraint. Let's revise the accommodation in Nashville to a more affordable option:\n\nRevised Accommodation in Nashville:\nAccommodation: Clean and large bedroom in a private house, Nashville, Tennessee, cost: 474, maximum occupancy: 1, house rules: No smoking, minimum nights: 1\n\nRevised Total Costs:\nDays 1-3 (Nashville): 49 (transportation) + 474 (accommodation) x 3 nights = 1,471\nDay 4 (Knoxville): 14 (transportation) + 29 (lunch) + 70 (dinner) + 132 (accommodation) = 245\nDay 5 (Return to Richmond): 35 (transportation) = 35\n\nRevised Total cost across all days: 1,471 + 245 + 35 = 1,751\n\nThe revised total cost is now within the budget of $2,600.", "gpt-4-1106-preview_direct_sole-planning_parsed_results": [{"day": 1, "current_city": "from Richmond to Nashville, Tennessee", "transportation": "Self-driving, from Richmond to Nashville, duration: 9 hours 3 mins, distance: 989 km", "breakfast": "-", "attraction": "-", "lunch": "-", "dinner": "-", "accommodation": "Huge 2 Bedroom, Great Location, Express Metro, Nashville, Tennessee"}, {"day": 2, "current_city": "Nashville, Tennessee", "transportation": "-", "breakfast": "Bangkok 1, Nashville, Tennessee", "attraction": "Country Music Hall of Fame and Museum, Nashville;The Parthenon, Nashville;", "lunch": "Veg Hut, Nashville, Tennessee", "dinner": "Smoke House Deli, Nashville, Tennessee", "accommodation": "Huge 2 Bedroom, Great Location, Express Metro, Nashville, Tennessee"}, {"day": 3, "current_city": "Nashville, Tennessee", "transportation": "-", "breakfast": "Govinda's Confectionery, Nashville, Tennessee", "attraction": "Grand Ole Opry, Nashville;Ryman Auditorium, Nashville;", "lunch": "Dialogue Lounge & Caf\u6106, Nashville, Tennessee", "dinner": "Oh! Calcutta, Nashville, Tennessee", "accommodation": "Huge 2 Bedroom, Great Location, Express Metro, Nashville, Tennessee"}, {"day": 4, "current_city": "from Nashville, Tennessee to Knoxville, Tennessee", "transportation": "Self-driving, from Nashville to Knoxville, duration: 2 hours 42 mins, distance: 290 km", "breakfast": "-", "attraction": "World's Fair Park, Knoxville;Knoxville Museum of Art, Knoxville;", "lunch": "Cafe Arabelle, Knoxville, Tennessee", "dinner": "Ali Baba & 41 Dishes, Knoxville, Tennessee", "accommodation": "Cozy Private Room in Chinatown/ Lower East Side, Knoxville, Tennessee"}, {"day": 5, "current_city": "from Knoxville, Tennessee to Richmond", "transportation": "Self-driving, from Knoxville to Richmond, duration: 6 hours 23 mins, distance: 701 km", "breakfast": "-", "attraction": "-", "lunch": "-", "dinner": "-", "accommodation": "-"}]}]