[{"gpt-4-1106-preview_direct_sole-planning_results": "Travel Plan:\n\nDays: 1\nCurrent City: from Jacksonville to Washington\nTransportation: Flight F3635008, from Jacksonville to Washington, duration: 1 hours 46 minutes, cost: 133 x 2 = 266\nBreakfast: -\nAttraction: -\nLunch: -\nDinner: Los Aztecas, Washington, Average Cost: 46, Cuisines: Cafe, Bakery, BBQ, Fast Food, cost: 46 x 2 = 92\nAccommodation: Comfortable & Cozy Times Square Apt, Washington, price: 499, room type: Entire home/apt, house rules: No parties & No children under 10, minimum nights: 2, maximum occupancy: 3, review rate number: 3.0\n\nNumber of people: 2\nTotal cost: 266 + 92 + 499 = 857\nAccommodation minimum nights: 1/2\n\nDays: 2\nCurrent City: Washington\nTransportation: -\nBreakfast: Manna Java World Cafe, Washington, Average Cost: 59, Cuisines: Cafe, Seafood, cost: 59 x 2 = 118\nAttraction: The Seattle Great Wheel, Washington; Discovery Park, Washington\nLunch: Hemingway's Island Grill, Washington, Average Cost: 57, Cuisines: Mexican, BBQ, Fast Food, Cafe, Seafood, cost: 57 x 2 = 114\nDinner: Thaaliwala, Washington, Average Cost: 88, Cuisines: Tea, Pizza, Italian, BBQ, Cafe, cost: 88 x 2 = 176\nAccommodation: Comfortable & Cozy Times Square Apt, Washington, price: 499, room type: Entire home/apt, house rules: No parties & No children under 10, minimum nights: 2, maximum occupancy: 3, review rate number: 3.0\n\nNumber of people: 2\nTotal cost: 118 + 114 + 176 + 499 = 907\nAccommodation minimum nights: 2/2\n\nDays: 3\nCurrent City: from Washington to Jacksonville\nTransportation: Flight F3786730, from Washington to Jacksonville, duration: 2 hours 10 minutes, cost: 196 x 2 = 392\nBreakfast: -\nAttraction: -\nLunch: -\nDinner: -\nAccommodation: -\n\nNumber of people: 2\nTotal cost: 392\n\nTotal cost across all days: 857 + 907 + 392 = 2,156\n\nUnfortunately, the total cost exceeds the specified budget of $1,000. To adjust the plan to fit the budget, we need to make some changes:\n\n- Change the flight to a self-driving option, which costs 56 x 2 = 112 for two people.\n- Choose a different accommodation that allows parties and fits within the budget.\n- Adjust meal plans to fit within the remaining budget after transportation and accommodation costs.\n\nRevised Travel Plan:\n\nDays: 1\nCurrent City: from Jacksonville to Washington\nTransportation: Self-driving, from Jacksonville to Washington, duration: 10 hours 13 mins, distance: 1,136 km, cost: 56 x 2 = 112\nBreakfast: -\nAttraction: -\nLunch: -\nDinner: Los Aztecas, Washington, Average Cost: 46, Cuisines: Cafe, Bakery, BBQ, Fast Food, cost: 46 x 2 = 92\nAccommodation: Stunning 2Bed/2BA + 300sqft deck by the river!, Washington, price: 209, room type: Entire home/apt, house rules: No visitors, minimum nights: 1, maximum occupancy: 3, review rate number: 2.0\n\nNumber of people: 2\nTotal cost: 112 + 92 + 209 = 413\nAccommodation minimum nights: 1/1\n\nDays: 2\nCurrent City: Washington\nTransportation: -\nBreakfast: Manna Java World Cafe, Washington, Average Cost: 59, Cuisines: Cafe, Seafood, cost: 59 x 2 = 118\nAttraction: The Seattle Great Wheel, Washington; Discovery Park, Washington\nLunch: Hemingway's Island Grill, Washington, Average Cost: 57, Cuisines: Mexican, BBQ, Fast Food, Cafe, Seafood, cost: 57 x 2 = 114\nDinner: Thaaliwala, Washington, Average Cost: 88, Cuisines: Tea, Pizza, Italian, BBQ, Cafe, cost: 88 x 2 = 176\nAccommodation: Stunning 2Bed/2BA + 300sqft deck by the river!, Washington, price: 209, room type: Entire home/apt, house rules: No visitors, minimum nights: 1, maximum occupancy: 3, review rate number: 2.0\n\nNumber of people: 2\nTotal cost: 118 + 114 + 176 + 209 = 617\nAccommodation minimum nights: 2/1\n\nDays: 3\nCurrent City: from Washington to Jacksonville\nTransportation: Self-driving, from Washington to Jacksonville, duration: 10 hours 12 mins, distance: 1,136 km, cost: 56 x 2 = 112\nBreakfast: -\nAttraction: -\nLunch: -\nDinner: -\nAccommodation: -\n\nNumber of people: 2\nTotal cost: 112\n\nTotal cost across all days: 413 + 617 + 112 = 1,142\n\nThe revised plan still exceeds the budget. To further adjust:\n\n- Opt for more budget-friendly meals.\n- Revisit attractions to select free or lower-cost options.\n- Ensure the accommodation cost does not exceed the budget when combined with transportation and meals.\n\nFinal adjustments are needed to ensure the total cost does not exceed $1,000.", "gpt-4-1106-preview_direct_sole-planning_parsed_results": [{"day": 1, "current_city": "from Jacksonville to Washington", "transportation": "Self-driving, from Jacksonville to Washington, duration: 10 hours 13 mins, distance: 1,136 km", "breakfast": "-", "attraction": "-", "lunch": "-", "dinner": "Los Aztecas, Washington", "accommodation": "Stunning 2Bed/2BA + 300sqft deck by the river!, Washington"}, {"day": 2, "current_city": "Washington", "transportation": "-", "breakfast": "Manna Java World Cafe, Washington", "attraction": "The Seattle Great Wheel, Washington;Discovery Park, Washington", "lunch": "Hemingway's Island Grill, Washington", "dinner": "Thaaliwala, Washington", "accommodation": "Stunning 2Bed/2BA + 300sqft deck by the river!, Washington"}, {"day": 3, "current_city": "from Washington to Jacksonville", "transportation": "Self-driving, from Washington to Jacksonville, duration: 10 hours 12 mins, distance: 1,136 km", "breakfast": "-", "attraction": "-", "lunch": "-", "dinner": "-", "accommodation": "-"}]}]