[{"gpt-4-1106-preview_direct_sole-planning_results": "Travel Plan:\n\nDays: 1\nCurrent City: from Syracuse to Augusta, Georgia\nTransportation: Self-driving, from Syracuse to Augusta, duration: 13 hours 17 mins, distance: 1,431 km, cost: 71\nBreakfast: -\nAttraction: -\nLunch: -\nDinner: -\nAccommodation: Perfect Chanukah apartment for the whole crew!, Augusta, Georgia, cost: 451, room type: Entire home/apt, house rules: No pets, minimum nights: 1, maximum occupancy: 3\n\nNumber of people: 2\nTotal cost: (71 x 2) + (451 x 1) = 593\nAccommodation minimum nights: 1/1\n\nDays: 2\nCurrent City: Augusta, Georgia\nTransportation: -\nBreakfast: B Merrell's, Augusta, Georgia, cost: 74, cuisines: Tea, Pizza, Desserts, Fast Food\nAttraction: Phinizy Swamp Nature Park, Augusta; Augusta Riverwalk, Augusta\nLunch: The Charcoal Chimney, Augusta, Georgia, cost: 86, cuisines: Tea, Fast Food, BBQ, Italian\nDinner: KB's Kulfi & Icecream, Augusta, Georgia, cost: 92, cuisines: American, BBQ, Seafood\nAccommodation: Perfect Chanukah apartment for the whole crew!, Augusta, Georgia, cost: 451, room type: Entire home/apt, house rules: No pets, minimum nights: 1, maximum occupancy: 3\n\nNumber of people: 2\nTotal cost: (74 x 2) + (86 x 2) + (92 x 2) + (451 x 1) = 956\nAccommodation minimum nights: 2/1\n\nDays: 3\nCurrent City: from Augusta, Georgia to Decatur, Georgia\nTransportation: Self-driving, from Augusta to Decatur, duration: 2 hours 19 mins, distance: 229 km, cost: 11\nBreakfast: Fish Tales Lakeside Grille, Augusta, Georgia, cost: 37, cuisines: Tea, Cafe, Bakery, Desserts\nAttraction: DeKalb History Center Museum, Decatur; Decatur Square, Decatur\nLunch: Cafe Coffee Day, Decatur, Georgia, cost: 46, cuisines: Tea, Cafe, BBQ, Mediterranean\nDinner: Joey's Pizza, Decatur, Georgia, cost: 69, cuisines: Tea, Pizza, Bakery, Chinese, Seafood\nAccommodation: Cozy Private Room, Decatur, Georgia, cost: 69, room type: Private room, house rules: No children under 10 & No parties & No visitors, minimum nights: 1, maximum occupancy: 2\n\nNumber of people: 2\nTotal cost: (11 x 2) + (37 x 2) + (46 x 2) + (69 x 2) + (69 x 1) = 404\nAccommodation minimum nights: 1/1\n\nDays: 4\nCurrent City: Decatur, Georgia\nTransportation: -\nBreakfast: Madhuban Restaurant - Welcome Hotel Rama International, Decatur, Georgia, cost: 47, cuisines: Pizza, Bakery, Seafood\nAttraction: Glenlake Park, Decatur; Clyde Shepherd Nature Preserve, Decatur\nLunch: Dawat-E-Chaman, Decatur, Georgia, cost: 42, cuisines: Chinese, BBQ, Fast Food, Cafe, Mediterranean\nDinner: Carnatic Cafe, Decatur, Georgia, cost: 66, cuisines: Cafe, Indian, Desserts\nAccommodation: Cozy Private Room, Decatur, Georgia, cost: 69, room type: Private room, house rules: No children under 10 & No parties & No visitors, minimum nights: 1, maximum occupancy: 2\n\nNumber of people: 2\nTotal cost: (47 x 2) + (42 x 2) + (66 x 2) + (69 x 1) = 428\nAccommodation minimum nights: 2/1\n\nDays: 5\nCurrent City: from Decatur, Georgia to Syracuse\nTransportation: Self-driving, from Decatur to Syracuse, duration: 14 hours 26 mins, distance: 1,542 km, cost: 77\nBreakfast: -\nAttraction: -\nLunch: -\nDinner: -\nAccommodation: -\n\nNumber of people: 2\nTotal cost: 77 x 2 = 154\n\nTotal cost across all days: 593 + 956 + 404 + 428 + 154 = 2,535\n\nUnfortunately, the total cost exceeds the specified budget of $2,000. To adjust the plan within the budget, we can consider the following changes:\n\n- Opt for cheaper accommodations.\n- Reduce meal costs by selecting more budget-friendly restaurants.\n- Limit the number of paid attractions visited.\n\nPlease note that the provided information does not include all meal costs for each day, and some meals are not accounted for in the plan. Additionally, the cost of attractions is not included, as it was not specified in the provided information. If attraction costs are significant, further adjustments may be needed to stay within budget.", "gpt-4-1106-preview_direct_sole-planning_parsed_results": [{"day": 1, "current_city": "from Syracuse to Augusta, Georgia", "transportation": "Self-driving, from Syracuse to Augusta, duration: 13 hours 17 mins, distance: 1,431 km", "breakfast": "-", "attraction": "-", "lunch": "-", "dinner": "-", "accommodation": "Perfect Chanukah apartment for the whole crew!, Augusta, Georgia"}, {"day": 2, "current_city": "Augusta, Georgia", "transportation": "-", "breakfast": "B Merrell's, Augusta, Georgia", "attraction": "Phinizy Swamp Nature Park, Augusta;Augusta Riverwalk, Augusta;", "lunch": "The Charcoal Chimney, Augusta, Georgia", "dinner": "KB's Kulfi & Icecream, Augusta, Georgia", "accommodation": "Perfect Chanukah apartment for the whole crew!, Augusta, Georgia"}, {"day": 3, "current_city": "from Augusta, Georgia to Decatur, Georgia", "transportation": "Self-driving, from Augusta to Decatur, duration: 2 hours 19 mins, distance: 229 km", "breakfast": "Fish Tales Lakeside Grille, Augusta, Georgia", "attraction": "DeKalb History Center Museum, Decatur;Decatur Square, Decatur;", "lunch": "Cafe Coffee Day, Decatur, Georgia", "dinner": "Joey's Pizza, Decatur, Georgia", "accommodation": "Cozy Private Room, Decatur, Georgia"}, {"day": 4, "current_city": "Decatur, Georgia", "transportation": "-", "breakfast": "Madhuban Restaurant - Welcome Hotel Rama International, Decatur, Georgia", "attraction": "Glenlake Park, Decatur;Clyde Shepherd Nature Preserve, Decatur;", "lunch": "Dawat-E-Chaman, Decatur, Georgia", "dinner": "Carnatic Cafe, Decatur, Georgia", "accommodation": "Cozy Private Room, Decatur, Georgia"}, {"day": 5, "current_city": "from Decatur, Georgia to Syracuse", "transportation": "Self-driving, from Decatur to Syracuse, duration: 14 hours 26 mins, distance: 1,542 km", "breakfast": "-", "attraction": "-", "lunch": "-", "dinner": "-", "accommodation": "-"}]}]