[{"gpt-4-1106-preview_direct_sole-planning_results": "Travel Plan:\n\nDays: 1\nCurrent City: from Washington to Norfolk, Virginia\nTransportation: Flight F3785353, from Washington to Norfolk, duration: 0 hours 48 minutes, distance: 142 km, cost: 63\nBreakfast: -\nAttraction: -\nLunch: -\nDinner: Henry Campbell's Steakhouse, Norfolk, Virginia, cost: 83, cuisines: Chinese, Cafe, Seafood\nAccommodation: Simple Spacious RM near Queens Center Mall & NYPD, Norfolk, Virginia, cost: 311, room type: Private room, house rules: No visitors & No parties, minimum nights: 30, maximum occupancy: 2\n\nNumber of people: 1\nTotal cost: 63 x 1 + 83 x 1 + 311 x 1 = 457\nAccommodation minimum nights: 1/30\n\nDays: 2\nCurrent City: Norfolk, Virginia\nTransportation: -\nBreakfast: Sonya Bakery Cafe, Norfolk, Virginia, cost: 32, cuisines: Pizza, Indian, BBQ\nAttraction: Norfolk Botanical Garden, Norfolk; Nauticus, Norfolk\nLunch: Sunshine Family Restaurant, Norfolk, Virginia, cost: 95, cuisines: Tea, American, Desserts, Italian\nDinner: Game n Grillz, Norfolk, Virginia, cost: 59, cuisines: Mexican, Bakery, Cafe, American, Seafood\nAccommodation: Simple Spacious RM near Queens Center Mall & NYPD, Norfolk, Virginia, cost: 311, room type: Private room, house rules: No visitors & No parties, minimum nights: 30, maximum occupancy: 2\n\nNumber of people: 1\nTotal cost: 32 x 1 + 95 x 1 + 59 x 1 + 311 x 1 = 497\nAccommodation minimum nights: 2/30\n\nDays: 3\nCurrent City: from Norfolk to Lynchburg, Virginia\nTransportation: Self-driving, from Norfolk to Lynchburg, duration: 3 hours 27 mins, distance: 306 km, cost: 15\nBreakfast: Lokenath Sweets, Norfolk, Virginia, cost: 15, cuisines: Fast Food, Seafood\nAttraction: Amazement Square, Lynchburg; Point of Honor, Lynchburg\nLunch: Uptown Vietnam cuisine, Lynchburg, Virginia, cost: 63, cuisines: Cafe, Bakery, Indian, Seafood\nDinner: The BrewMaster, Lynchburg, Virginia, cost: 87, cuisines: Tea, Chinese, BBQ, Fast Food\nAccommodation: Design Hideaway in a Classic Brooklyn Townhouse, Lynchburg, Virginia, cost: 216, room type: Entire home/apt, house rules: No smoking, minimum nights: 4, maximum occupancy: 3\n\nNumber of people: 1\nTotal cost: 15 x 1 + 15 x 1 + 63 x 1 + 87 x 1 + 216 x 1 = 396\nAccommodation minimum nights: 1/4\n\nDays: 4\nCurrent City: Lynchburg, Virginia\nTransportation: -\nBreakfast: Khyen Chyen, Lynchburg, Virginia, cost: 30, cuisines: Cafe, Bakery, Mediterranean, Desserts\nAttraction: The Anne Spencer House & Garden Museum, Lynchburg; Lynchburg Museum, Lynchburg\nLunch: Mochamania, Lynchburg, Virginia, cost: 87, cuisines: Tea, Chinese, Fast Food, Seafood\nDinner: Pirates Of Grill, Lynchburg, Virginia, cost: 71, cuisines: Tea, Pizza, American, Seafood\nAccommodation: Design Hideaway in a Classic Brooklyn Townhouse, Lynchburg, Virginia, cost: 216, room type: Entire home/apt, house rules: No smoking, minimum nights: 4, maximum occupancy: 3\n\nNumber of people: 1\nTotal cost: 30 x 1 + 87 x 1 + 71 x 1 + 216 x 1 = 404\nAccommodation minimum nights: 2/4\n\nDays: 5\nCurrent City: from Lynchburg to Washington\nTransportation: Self-driving, from Lynchburg to Washington, duration: 3 hours 19 mins, distance: 291 km, cost: 14\nBreakfast: Bean Here, Lynchburg, Virginia, cost: 74, cuisines: Tea, Indian, BBQ, Fast Food\nAttraction: -\nLunch: -\nDinner: -\nAccommodation: -\n\nNumber of people: 1\nTotal cost: 14 x 1 + 74 x 1 = 88\n\nTotal cost across all days: 457 + 497 + 396 + 404 + 88 = 1,842\n\nCuisines: The prompt specifies no cuisines, so all cuisine constraints are satisfied\n\nNote: The accommodation in Norfolk has a minimum stay of 30 nights, which is not suitable for this travel plan. However, due to the lack of provided alternatives, it has been included. The traveler should seek alternative accommodation that allows for shorter stays. Additionally, the accommodation in Lynchburg has a minimum stay of 4 nights, but since the travel plan requires staying for only 2 nights, this should also be addressed by finding a suitable alternative.", "gpt-4-1106-preview_direct_sole-planning_parsed_results": [{"day": 1, "current_city": "from Washington to Norfolk, Virginia", "transportation": "Flight Number: F3785353, from Washington to Norfolk, Departure Time: -, Arrival Time: -", "breakfast": "-", "attraction": "-", "lunch": "-", "dinner": "Henry Campbell's Steakhouse, Norfolk, Virginia", "accommodation": "Simple Spacious RM near Queens Center Mall & NYPD, Norfolk, Virginia"}, {"day": 2, "current_city": "Norfolk, Virginia", "transportation": "-", "breakfast": "Sonya Bakery Cafe, Norfolk, Virginia", "attraction": "Norfolk Botanical Garden, Norfolk;Nauticus, Norfolk;", "lunch": "Sunshine Family Restaurant, Norfolk, Virginia", "dinner": "Game n Grillz, Norfolk, Virginia", "accommodation": "Simple Spacious RM near Queens Center Mall & NYPD, Norfolk, Virginia"}, {"day": 3, "current_city": "from Norfolk to Lynchburg, Virginia", "transportation": "Self-driving, from Norfolk to Lynchburg, Departure Time: -, Arrival Time: -", "breakfast": "Lokenath Sweets, Norfolk, Virginia", "attraction": "Amazement Square, Lynchburg;Point of Honor, Lynchburg;", "lunch": "Uptown Vietnam cuisine, Lynchburg, Virginia", "dinner": "The BrewMaster, Lynchburg, Virginia", "accommodation": "Design Hideaway in a Classic Brooklyn Townhouse, Lynchburg, Virginia"}, {"day": 4, "current_city": "Lynchburg, Virginia", "transportation": "-", "breakfast": "Khyen Chyen, Lynchburg, Virginia", "attraction": "The Anne Spencer House & Garden Museum, Lynchburg;Lynchburg Museum, Lynchburg;", "lunch": "Mochamania, Lynchburg, Virginia", "dinner": "Pirates Of Grill, Lynchburg, Virginia", "accommodation": "Design Hideaway in a Classic Brooklyn Townhouse, Lynchburg, Virginia"}, {"day": 5, "current_city": "from Lynchburg to Washington", "transportation": "Self-driving, from Lynchburg to Washington, Departure Time: -, Arrival Time: -", "breakfast": "Bean Here, Lynchburg, Virginia", "attraction": "-", "lunch": "-", "dinner": "-", "accommodation": "-"}]}]