[{"gpt-4-1106-preview_direct_sole-planning_results": "Travel Plan:\n\nDays: 1\nDate: March 28, 2022\nCurrent City: from Boston to San Juan, Puerto Rico\nTransportation: Flight F3774524, from Boston to San Juan, Price: $341, DepTime: 09:16, ArrTime: 14:05, Duration: 4 hours 49 minutes\nBreakfast: -\nAttraction: -\nLunch: -\nDinner: Christian and Jake's Bistro, San Juan, Average Cost: $59, Cuisines: Tea, French, Bakery, Fast Food, Indian\nAccommodation: FLUSHING APT!! BEST DEAL IN NYC!!!, San Juan, Price: $135, Room Type: Entire home/apt, House Rules: No smoking & No parties, Minimum Nights: 1, Maximum Occupancy: 2\n\nNumber of people: 1\nTotal cost: $341 (Flight) + $59 (Dinner) + $135 (Accommodation) = $535\nAccommodation minimum nights: 1/1\n\nDays: 2\nDate: March 29, 2022\nCurrent City: San Juan, Puerto Rico\nTransportation: -\nBreakfast: Gopal's 56, San Juan, Average Cost: $10, Cuisines: French, Bakery, Cafe\nAttraction: Castillo San Felipe del Morro, San Juan; Paseo de La Princesa, San Juan\nLunch: Hoka-Hoka Japanese Steak & Sushi, San Juan, Average Cost: $27, Cuisines: Tea, French, American, Cafe\nDinner: Maison Des Desserts, San Juan, Average Cost: $70, Cuisines: Cafe, Mexican, Pizza, Italian\nAccommodation: FLUSHING APT!! BEST DEAL IN NYC!!!, San Juan, Price: $135, Room Type: Entire home/apt, House Rules: No smoking & No parties, Minimum Nights: 1, Maximum Occupancy: 2\n\nNumber of people: 1\nTotal cost: $10 (Breakfast) + $27 (Lunch) + $70 (Dinner) + $135 (Accommodation) = $242\nAccommodation minimum nights: 2/1\n\nDays: 3\nDate: March 30, 2022\nCurrent City: from San Juan, Puerto Rico to Boston\nTransportation: Flight F3764590, from San Juan to Boston, Price: $569, DepTime: 18:50, ArrTime: 23:02, Duration: 4 hours 12 minutes\nBreakfast: Coldpress Company, San Juan, Average Cost: $11, Cuisines: Cafe, Pizza, BBQ, Fast Food\nAttraction: Museo de Arte de Puerto Rico, San Juan\nLunch: Oh My!, San Juan, Average Cost: $18, Cuisines: Desserts, Tea, Cafe, American, Mediterranean, Seafood\nDinner: -\nAccommodation: -\n\nNumber of people: 1\nTotal cost: $569 (Flight) + $11 (Breakfast) + $18 (Lunch) = $598\nAccommodation minimum nights: -\n\nTotal cost across all days: $535 + $242 + $598 = $1,375\n\nCuisines: The prompt specifies no cuisines, so all cuisine constraints are satisfied\n\nNote: The travel plan adheres to the budget of $1,400, includes all required details for each day, and ensures no repetition of restaurants or attractions. The accommodation is consistent with the city of stay and the transportation method is valid for the specified cities.", "gpt-4-1106-preview_direct_sole-planning_parsed_results": [{"day": 1, "current_city": "from Boston to San Juan, Puerto Rico", "transportation": "Flight Number: F3774524, from Boston to San Juan, Departure Time: 09:16, Arrival Time: 14:05", "breakfast": "-", "attraction": "-", "lunch": "-", "dinner": "Christian and Jake's Bistro, San Juan", "accommodation": "FLUSHING APT!! BEST DEAL IN NYC!!!, San Juan"}, {"day": 2, "current_city": "San Juan, Puerto Rico", "transportation": "-", "breakfast": "Gopal's 56, San Juan", "attraction": "Castillo San Felipe del Morro, San Juan;Paseo de La Princesa, San Juan;", "lunch": "Hoka-Hoka Japanese Steak & Sushi, San Juan", "dinner": "Maison Des Desserts, San Juan", "accommodation": "FLUSHING APT!! BEST DEAL IN NYC!!!, San Juan"}, {"day": 3, "current_city": "from San Juan, Puerto Rico to Boston", "transportation": "Flight Number: F3764590, from San Juan to Boston, Departure Time: 18:50, Arrival Time: 23:02", "breakfast": "Coldpress Company, San Juan", "attraction": "Museo de Arte de Puerto Rico, San Juan", "lunch": "Oh My!, San Juan", "dinner": "-", "accommodation": "-"}]}]