[{"gpt-4-1106-preview_direct_sole-planning_results": "Travel Plan:\n\nDays: 1\nCurrent City: from Marquette to Escanaba, Michigan\nTransportation: Self-driving, from Marquette to Escanaba, duration: 3 hours 34 mins, distance: 362 km, cost: 18\nBreakfast: -\nAttraction: -\nLunch: -\nDinner: Machine Shed Restaurant, Escanaba, Michigan, cost: 82, cuisines: Tea, Bakery, Seafood\nAccommodation: Brooklyn Vibes Apartment, Escanaba, Michigan, cost: 978, room type: Private room, house rules: No visitors, minimum nights: 4, maximum occupancy: 2\n\nNumber of people: 5\nTotal cost: (18 x 5) + (82 x 5) + (978 x 1) = 1,478\nAccommodation minimum nights: 1/4\n\nDays: 2\nCurrent City: Escanaba, Michigan\nTransportation: -\nBreakfast: Butter & Grace, Escanaba, Michigan, cost: 95, cuisines: Fast Food, Tea, Mexican, Italian\nAttraction: Ludington Park, Escanaba; Delta County Historical Society, Escanaba\nLunch: The Grand Marlin, Escanaba, Michigan, cost: 20, cuisines: Cafe, Mediterranean, Desserts, Italian\nDinner: SOHO South Cafe, Escanaba, Michigan, cost: 53, cuisines: Seafood, American, BBQ, Fast Food\nAccommodation: Brooklyn Vibes Apartment, Escanaba, Michigan, cost: 978, room type: Private room, house rules: No visitors, minimum nights: 4, maximum occupancy: 2\n\nNumber of people: 5\nTotal cost: (95 x 5) + (20 x 5) + (53 x 5) + (978 x 1) = 1,840\nAccommodation minimum nights: 2/4\n\nDays: 3\nCurrent City: from Escanaba to Pellston, Michigan\nTransportation: Self-driving, from Escanaba to Pellston, duration: 2 hours 43 mins, distance: 262 km, cost: 13\nBreakfast: Cafe Culture, Escanaba, Michigan, cost: 67, cuisines: Cafe, Mexican, BBQ\nAttraction: Pellston Pioneer Park, Pellston; Philip J. Braun Nature Preserve, Pellston\nLunch: Aroos Damascus, Pellston, Michigan, cost: 44, cuisines: Desserts, Tea, Italian, Cafe, American\nDinner: The Great Kabab Factory - Park Plaza, Pellston, Michigan, cost: 84, cuisines: Desserts, Pizza, Mexican, BBQ, Seafood\nAccommodation: Beautiful apartment ~25min from Times Square, Pellston, Michigan, cost: 571, room type: Entire home/apt, house rules: No smoking & No visitors, minimum nights: 5, maximum occupancy: 5\n\nNumber of people: 5\nTotal cost: (13 x 5) + (67 x 5) + (44 x 5) + (84 x 5) + (571 x 1) = 1,785\nAccommodation minimum nights: 1/5\n\nDays: 4\nCurrent City: Pellston, Michigan\nTransportation: -\nBreakfast: Premier Bite, Pellston, Michigan, cost: 53, cuisines: Tea, Bakery, Seafood\nAttraction: Petoskey State Park, Pellston; Headlands International Dark Sky Park, Pellston\nLunch: Flame & Grill, Pellston, Michigan, cost: 23, cuisines: Bakery, BBQ\nDinner: Standard Sweets, Pellston, Michigan, cost: 56, cuisines: Desserts, French, Mexican, BBQ, Fast Food\nAccommodation: Beautiful apartment ~25min from Times Square, Pellston, Michigan, cost: 571, room type: Entire home/apt, house rules: No smoking & No visitors, minimum nights: 5, maximum occupancy: 5\n\nNumber of people: 5\nTotal cost: (53 x 5) + (23 x 5) + (56 x 5) + (571 x 1) = 1,615\nAccommodation minimum nights: 2/5\n\nDays: 5\nCurrent City: from Pellston to Detroit, Michigan\nTransportation: Flight, Flight Number F3832618, Price: 75, DepTime: 06:14, ArrTime: 07:18, duration: 1 hours 4 minutes, distance: 243 km\nBreakfast: -\nAttraction: Detroit Institute of Arts, Detroit; Detroit Historical Museum, Detroit\nLunch: A Dong Restaurant, Detroit, Michigan, cost: 40, cuisines: Tea, Cafe, Pizza\nDinner: BMG - All Day Dining, Detroit, Michigan, cost: 15, cuisines: Desserts, Bakery, BBQ, Indian, Seafood\nAccommodation: Cozy 1 bedroom in the heart of Fort Greene, Detroit, Michigan, cost: 751, room type: Entire home/apt, house rules: No pets & No parties, minimum nights: 3, maximum occupancy: 6\n\nNumber of people: 5\nTotal cost: (75 x 5) + (40 x 5) + (15 x 5) + (751 x 1) = 1,505\nAccommodation minimum nights: 1/3\n\nDays: 6\nCurrent City: Detroit, Michigan\nTransportation: -\nBreakfast: Cafe And More, Detroit, Michigan, cost: 41, cuisines: Tea, Bakery, Italian\nAttraction: Campus Martius Park, Detroit; Motown Museum, Detroit\nLunch: The Dosa King, Detroit, Michigan, cost: 69, cuisines: BBQ, Mediterranean, Desserts, Fast Food\nDinner: Vapour Pub & Brewery, Detroit, Michigan, cost: 80, cuisines: French, BBQ, Fast Food, Cafe, Seafood\nAccommodation: Cozy 1 bedroom in the heart of Fort Greene, Detroit, Michigan, cost: 751, room type: Entire home/apt, house rules: No pets & No parties, minimum nights: 3, maximum occupancy: 6\n\nNumber of people: 5\nTotal cost: (41 x 5) + (69 x 5) + (80 x 5) + (751 x 1) = 1,960\nAccommodation minimum nights: 2/3\n\nDays: 7\nCurrent City: from Detroit to Marquette, Michigan\nTransportation: Flight, Flight Number F3846022, Price: 118, DepTime: 13:35, ArrTime: 14:51, duration: 1 hours 16 minutes, distance: 349 km\nBreakfast: -\nAttraction: -\nLunch: -\nDinner: -\nAccommodation: -\n\nNumber of people: 5\nTotal cost: (118 x 5) = 590\n\nTotal cost across all days: 1,478 + 1,840 + 1,785 + 1,615 + 1,505 + 1,960 + 590 = 10,773\n\nCuisines: The prompt specifies no cuisines, so all cuisine constraints are satisfied\nAccommodation: All accommodations are suitable for children under 10 as per the house rules provided.", "gpt-4-1106-preview_direct_sole-planning_parsed_results": [{"day": 1, "current_city": "from Marquette to Escanaba, Michigan", "transportation": "Self-driving, from Marquette to Escanaba, duration: 3 hours 34 mins, distance: 362 km", "breakfast": "-", "attraction": "-", "lunch": "-", "dinner": "Machine Shed Restaurant, Escanaba, Michigan", "accommodation": "Brooklyn Vibes Apartment, Escanaba, Michigan"}, {"day": 2, "current_city": "Escanaba, Michigan", "transportation": "-", "breakfast": "Butter & Grace, Escanaba, Michigan", "attraction": "Ludington Park, Escanaba;Delta County Historical Society, Escanaba;", "lunch": "The Grand Marlin, Escanaba, Michigan", "dinner": "SOHO South Cafe, Escanaba, Michigan", "accommodation": "Brooklyn Vibes Apartment, Escanaba, Michigan"}, {"day": 3, "current_city": "from Escanaba to Pellston, Michigan", "transportation": "Self-driving, from Escanaba to Pellston, duration: 2 hours 43 mins, distance: 262 km", "breakfast": "Cafe Culture, Escanaba, Michigan", "attraction": "Pellston Pioneer Park, Pellston;Philip J. Braun Nature Preserve, Pellston;", "lunch": "Aroos Damascus, Pellston, Michigan", "dinner": "The Great Kabab Factory - Park Plaza, Pellston, Michigan", "accommodation": "Beautiful apartment ~25min from Times Square, Pellston, Michigan"}, {"day": 4, "current_city": "Pellston, Michigan", "transportation": "-", "breakfast": "Premier Bite, Pellston, Michigan", "attraction": "Petoskey State Park, Pellston;Headlands International Dark Sky Park, Pellston;", "lunch": "Flame & Grill, Pellston, Michigan", "dinner": "Standard Sweets, Pellston, Michigan", "accommodation": "Beautiful apartment ~25min from Times Square, Pellston, Michigan"}, {"day": 5, "current_city": "from Pellston to Detroit, Michigan", "transportation": "Flight, Flight Number: F3832618, DepTime: 06:14, ArrTime: 07:18, duration: 1 hours 4 minutes, distance: 243 km", "breakfast": "-", "attraction": "Detroit Institute of Arts, Detroit;Detroit Historical Museum, Detroit;", "lunch": "A Dong Restaurant, Detroit, Michigan", "dinner": "BMG - All Day Dining, Detroit, Michigan", "accommodation": "Cozy 1 bedroom in the heart of Fort Greene, Detroit, Michigan"}, {"day": 6, "current_city": "Detroit, Michigan", "transportation": "-", "breakfast": "Cafe And More, Detroit, Michigan", "attraction": "Campus Martius Park, Detroit;Motown Museum, Detroit;", "lunch": "The Dosa King, Detroit, Michigan", "dinner": "Vapour Pub & Brewery, Detroit, Michigan", "accommodation": "Cozy 1 bedroom in the heart of Fort Greene, Detroit, Michigan"}, {"day": 7, "current_city": "from Detroit to Marquette, Michigan", "transportation": "Flight, Flight Number: F3846022, DepTime: 13:35, ArrTime: 14:51, duration: 1 hours 16 minutes, distance: 349 km", "breakfast": "-", "attraction": "-", "lunch": "-", "dinner": "-", "accommodation": "-"}]}]