[{"gpt-4-1106-preview_direct_sole-planning_results": "Travel Plan:\n\nDays: 1\nCurrent City: from Missoula to Abilene, Texas\nTransportation: Self-driving, from Missoula to Abilene, duration: 23 hours 1 min, distance: 2,562 km, cost: 128\nBreakfast: -\nAttraction: -\nLunch: -\nDinner: -\nAccommodation: Apartment minutes from manhattan, Abilene, Texas, cost: 295, room type: Entire home/apt, house rules: No pets & No visitors, minimum nights: 2, maximum occupancy: 2\n\nNumber of people: 5\nTotal cost: (128 x 5) + (295 x 2.5) = 640 + 737.5 = 1,377.5\nAccommodation minimum nights: 1/2\n\nDays: 2\nCurrent City: Abilene, Texas\nTransportation: -\nBreakfast: Thai Garden, Abilene, Texas, cost: 13, cuisines: Cafe, American, Desserts\nAttraction: The Grace Museum, Abilene; Frontier Texas!, Abilene\nLunch: Mediumwelldone, Abilene, Texas, cost: 91, cuisines: Tea, French, BBQ, Cafe, Seafood\nDinner: LPK Waterfront, Abilene, Texas, cost: 61, cuisines: Pizza, Italian, BBQ, Fast Food, Seafood\nAccommodation: Apartment minutes from manhattan, Abilene, Texas, cost: 295, room type: Entire home/apt, house rules: No pets & No visitors, minimum nights: 2, maximum occupancy: 2\n\nNumber of people: 5\nTotal cost: (13 x 5) + (91 x 5) + (61 x 5) + (295 x 2.5) = 65 + 455 + 305 + 737.5 = 1,562.5\nAccommodation minimum nights: 2/2\n\nDays: 3\nCurrent City: from Abilene, Texas to Amarillo, Texas\nTransportation: Self-driving, from Abilene to Amarillo, duration: 4 hours 10 mins, distance: 446 km, cost: 22\nBreakfast: Crispy Crust, Abilene, Texas, cost: 54, cuisines: Desserts, Bakery, Cafe, American, Seafood\nAttraction: Cadillac Ranch, Amarillo; Amarillo Botanical Gardens, Amarillo\nLunch: The Cinnamon Kitchen, Amarillo, Texas, cost: 69, cuisines: Desserts, Tea, Pizza, Chinese, Seafood\nDinner: Komachi, Amarillo, Texas, cost: 71, cuisines: Desserts, Tea, Fast Food, Chinese, Mediterranean\nAccommodation: Gramercy Park restful, cozy, sun-filled home, Amarillo, Texas, cost: 968, room type: Entire home/apt, house rules: No parties, minimum nights: 2, maximum occupancy: 8\n\nNumber of people: 5\nTotal cost: (22 x 5) + (54 x 5) + (69 x 5) + (71 x 5) + (968 x 0.625) = 110 + 270 + 345 + 355 + 605 = 1,685\nAccommodation minimum nights: 1/2\n\nDays: 4\nCurrent City: Amarillo, Texas\nTransportation: -\nBreakfast: Wood Box Cafe, Amarillo, Texas, cost: 11, cuisines: Desserts, French, Fast Food, Cafe, American\nAttraction: Amarillo Zoo, Amarillo; Don Harrington Discovery Center, Amarillo\nLunch: Sigree Global Grill, Amarillo, Texas, cost: 35, cuisines: Chinese, BBQ, Cafe, Desserts\nDinner: Anand Restaurant, Amarillo, Texas, cost: 53, cuisines: Fast Food, Seafood, Desserts, Italian\nAccommodation: Gramercy Park restful, cozy, sun-filled home, Amarillo, Texas, cost: 968, room type: Entire home/apt, house rules: No parties, minimum nights: 2, maximum occupancy: 8\n\nNumber of people: 5\nTotal cost: (11 x 5) + (35 x 5) + (53 x 5) + (968 x 0.625) = 55 + 175 + 265 + 605 = 1,100\nAccommodation minimum nights: 2/2\n\nDays: 5\nCurrent City: from Amarillo to Missoula\nTransportation: Self-driving, from Amarillo to Missoula, duration: 18 hours 58 mins, distance: 2,102 km, cost: 105\nBreakfast: Punjabi Chaap Corner, Amarillo, Texas, cost: 62, cuisines: Desserts, Pizza, Italian, Bakery, Fast Food\nAttraction: -\nLunch: -\nDinner: -\nAccommodation: -\n\nNumber of people: 5\nTotal cost: (105 x 5) + (62 x 5) = 525 + 310 = 835\n\nTotal cost across all days: 1,377.5 + 1,562.5 + 1,685 + 1,100 + 835 = 6,560\nCuisines: Italian and French cuisines included as requested\nRemaining Budget: $7,200 - $6,560 = $640\n\nPlease note that the accommodation in Abilene has a minimum of 2 nights stay, so the group will need to book for 2 nights even though they are staying for 1 night. The cost calculation for accommodation is adjusted to account for the number of people (2.5 times the cost for 5 people, as the maximum occupancy is 2). The same applies to the accommodation in Amarillo. The travel plan adheres to the budget and includes Italian and French cuisines as requested.", "gpt-4-1106-preview_direct_sole-planning_parsed_results": [{"day": 1, "current_city": "from Missoula to Abilene, Texas", "transportation": "Self-driving, from Missoula to Abilene, duration: 23 hours 1 min, distance: 2,562 km", "breakfast": "-", "attraction": "-", "lunch": "-", "dinner": "-", "accommodation": "Apartment minutes from manhattan, Abilene, Texas"}, {"day": 2, "current_city": "Abilene, Texas", "transportation": "-", "breakfast": "Thai Garden, Abilene, Texas", "attraction": "The Grace Museum, Abilene; Frontier Texas!, Abilene;", "lunch": "Mediumwelldone, Abilene, Texas", "dinner": "LPK Waterfront, Abilene, Texas", "accommodation": "Apartment minutes from manhattan, Abilene, Texas"}, {"day": 3, "current_city": "from Abilene, Texas to Amarillo, Texas", "transportation": "Self-driving, from Abilene to Amarillo, duration: 4 hours 10 mins, distance: 446 km", "breakfast": "Crispy Crust, Abilene, Texas", "attraction": "Cadillac Ranch, Amarillo; Amarillo Botanical Gardens, Amarillo;", "lunch": "The Cinnamon Kitchen, Amarillo, Texas", "dinner": "Komachi, Amarillo, Texas", "accommodation": "Gramercy Park restful, cozy, sun-filled home, Amarillo, Texas"}, {"day": 4, "current_city": "Amarillo, Texas", "transportation": "-", "breakfast": "Wood Box Cafe, Amarillo, Texas", "attraction": "Amarillo Zoo, Amarillo; Don Harrington Discovery Center, Amarillo;", "lunch": "Sigree Global Grill, Amarillo, Texas", "dinner": "Anand Restaurant, Amarillo, Texas", "accommodation": "Gramercy Park restful, cozy, sun-filled home, Amarillo, Texas"}, {"day": 5, "current_city": "from Amarillo to Missoula", "transportation": "Self-driving, from Amarillo to Missoula, duration: 18 hours 58 mins, distance: 2,102 km", "breakfast": "Punjabi Chaap Corner, Amarillo, Texas", "attraction": "-", "lunch": "-", "dinner": "-", "accommodation": "-"}]}]