[{"gpt-4-1106-preview_direct_sole-planning_results": "Travel Plan:\n\nDays: 1\nDate: March 6th, 2022\nCurrent City: from Houston to Pensacola\nTransportation: Flight F3855861, from Houston to Pensacola, duration: 1 hour 27 minutes, cost: $100 per person\nBreakfast: -\nAttraction: -\nLunch: Frog Hollow Tavern, Pensacola, Average Cost: $20, Cuisines: American, BBQ, Fast Food, Cafe, Indian\nDinner: Kwality Restaurant, Pensacola, Average Cost: $29, Cuisines: Desserts, Tea, French, Fast Food, Chinese\nAccommodation: Amazing apartment near museum, gardens & park!, Pensacola, price: $74, room type: Entire home/apt, house rules: No parties, minimum nights: 17, maximum occupancy: 3\n\nNumber of people: 2\nTotal cost: (Flight $100 x 2) + (Lunch $20 x 2) + (Dinner $29 x 2) + (Accommodation $74 x 1) = $200 + $40 + $58 + $74 = $372\nAccommodation minimum nights: 1/17\n\nDays: 2\nDate: March 7th, 2022\nCurrent City: Pensacola\nTransportation: -\nBreakfast: Berry Patch Restaurant, Pensacola, Average Cost: $13, Cuisines: Bakery, BBQ, Desserts, Seafood\nAttraction: Historic Pensacola Village, Pensacola\nLunch: Nukkad, Pensacola, Average Cost: $100, Cuisines: Tea, Cafe, American, Italian\nDinner: Blue Point Grill, Pensacola, Average Cost: $75, Cuisines: French, Indian, Cafe, Desserts\nAccommodation: Amazing apartment near museum, gardens & park!, Pensacola, price: $74, room type: Entire home/apt, house rules: No parties, minimum nights: 17, maximum occupancy: 3\n\nNumber of people: 2\nTotal cost: (Breakfast $13 x 2) + (Lunch $100 x 2) + (Dinner $75 x 2) + (Accommodation $74 x 1) = $26 + $200 + $150 + $74 = $450\nAccommodation minimum nights: 2/17\n\nDays: 3\nDate: March 8th, 2022\nCurrent City: from Pensacola to Houston\nTransportation: Flight F3890675, from Pensacola to Houston, duration: 1 hour 34 minutes, cost: $128 per person\nBreakfast: -\nAttraction: Pensacola Beach\nLunch: Chicago Pizza, Pensacola, Average Cost: $32, Cuisines: Pizza, Mediterranean, Fast Food\nDinner: -\nAccommodation: -\n\nNumber of people: 2\nTotal cost: (Flight $128 x 2) + (Lunch $32 x 2) = $256 + $64 = $320\n\nTotal cost across all days: $372 + $450 + $320 = $1,142\n\nCuisines: Indian, American, Chinese, and Italian cuisines were included in the dining options.\nVisitor-friendly accommodation was selected as per the requirement.\n\nPlease note that the accommodation selected has a minimum stay of 17 nights, which exceeds the duration of the trip. However, since the query requires visitor-friendly accommodations, this option was chosen due to the lack of specific visitor-friendly options in the provided data. The cost calculation is based on a single night's stay for the purpose of this travel plan.", "gpt-4-1106-preview_direct_sole-planning_parsed_results": [{"day": 1, "current_city": "from Houston to Pensacola", "transportation": "Flight Number: F3855861, from Houston to Pensacola, Departure Time: -, Arrival Time: -", "breakfast": "-", "attraction": "-", "lunch": "Frog Hollow Tavern, Pensacola", "dinner": "Kwality Restaurant, Pensacola", "accommodation": "Amazing apartment near museum, gardens & park!, Pensacola"}, {"day": 2, "current_city": "Pensacola", "transportation": "-", "breakfast": "Berry Patch Restaurant, Pensacola", "attraction": "Historic Pensacola Village, Pensacola", "lunch": "Nukkad, Pensacola", "dinner": "Blue Point Grill, Pensacola", "accommodation": "Amazing apartment near museum, gardens & park!, Pensacola"}, {"day": 3, "current_city": "from Pensacola to Houston", "transportation": "Flight Number: F3890675, from Pensacola to Houston, Departure Time: -, Arrival Time: -", "breakfast": "-", "attraction": "Pensacola Beach, Pensacola", "lunch": "Chicago Pizza, Pensacola", "dinner": "-", "accommodation": "-"}]}]