[{"gpt-4-1106-preview_direct_sole-planning_results": "Travel Plan:\n\nDays: 1\nCurrent City: from Augusta to Abilene, Texas\nTransportation: Self-driving, from Augusta to Abilene, duration: 15 hours 59 mins, distance: 1,782 km, cost: 89\nBreakfast: -\nAttraction: -\nLunch: -\nDinner: -\nAccommodation: Joyce and Donovan's, Room for One, Abilene, Texas, cost: 83, room type: Private room, house rules: No parties, minimum nights: 25, maximum occupancy: 2\n\nNumber of people: 1\nTotal cost: 89 x 1 + 83 x 1 = 172\nAccommodation minimum nights: 1/25\n\nDays: 2\nCurrent City: Abilene, Texas\nTransportation: -\nBreakfast: Thai Garden, Abilene, Texas, cost: 13, cuisines: Cafe, American, Desserts\nAttraction: The Grace Museum, Abilene; Frontier Texas!, Abilene\nLunch: Crispy Crust, Abilene, Texas, cost: 54, cuisines: Desserts, Bakery, Cafe, American, Seafood\nDinner: Finger Licious, Abilene, Texas, cost: 35, cuisines: Fast Food, Cafe, BBQ, Seafood\nAccommodation: Joyce and Donovan's, Room for One, Abilene, Texas, cost: 83, room type: Private room, house rules: No parties, minimum nights: 25, maximum occupancy: 2\n\nNumber of people: 1\nTotal cost: 13 x 1 + 54 x 1 + 35 x 1 + 83 x 1 = 185\nAccommodation minimum nights: 2/25\n\nDays: 3\nCurrent City: from Abilene, Texas to Amarillo, Texas\nTransportation: Self-driving, from Abilene to Amarillo, duration: 4 hours 10 mins, distance: 446 km, cost: 22\nBreakfast: Biryani Express, Abilene, Texas, cost: 11, cuisines: Tea, Pizza, French, Bakery, Fast Food\nAttraction: Cadillac Ranch, Amarillo; Amarillo Botanical Gardens, Amarillo\nLunch: The Cinnamon Kitchen, Amarillo, Texas, cost: 69, cuisines: Desserts, Tea, Pizza, Chinese, Seafood\nDinner: Komachi, Amarillo, Texas, cost: 71, cuisines: Desserts, Tea, Fast Food, Chinese, Mediterranean\nAccommodation: Harlem Humble Abode - 1 bedroom - Cute and Quaint, Amarillo, Texas, cost: 409, room type: Entire home/apt, house rules: No pets, minimum nights: 5, maximum occupancy: 3\n\nNumber of people: 1\nTotal cost: 22 x 1 + 11 x 1 + 69 x 1 + 71 x 1 + 409 x 1 = 582\nAccommodation minimum nights: 1/5\n\nDays: 4\nCurrent City: Amarillo, Texas\nTransportation: -\nBreakfast: Kanha North & South Indian Veg., Amarillo, Texas, cost: 34, cuisines: Tea, Cafe, BBQ, Fast Food\nAttraction: Amarillo Zoo, Amarillo; Don Harrington Discovery Center, Amarillo\nLunch: Sigree Global Grill, Amarillo, Texas, cost: 35, cuisines: Chinese, BBQ, Cafe, Desserts\nDinner: Anand Restaurant, Amarillo, Texas, cost: 53, cuisines: Fast Food, Seafood, Desserts, Italian\nAccommodation: Harlem Humble Abode - 1 bedroom - Cute and Quaint, Amarillo, Texas, cost: 409, room type: Entire home/apt, house rules: No pets, minimum nights: 5, maximum occupancy: 3\n\nNumber of people: 1\nTotal cost: 34 x 1 + 35 x 1 + 53 x 1 + 409 x 1 = 531\nAccommodation minimum nights: 2/5\n\nDays: 5\nCurrent City: from Amarillo, Texas to Lubbock, Texas\nTransportation: Self-driving, from Amarillo to Lubbock, duration: 1 hour 47 mins, distance: 197 km, cost: 9\nBreakfast: Wood Box Cafe, Amarillo, Texas, cost: 11, cuisines: Desserts, French, Fast Food, Cafe, American\nAttraction: Buddy Holly Center, Lubbock; National Ranching Heritage Center, Lubbock\nLunch: Paris 6 Classique, Lubbock, Texas, cost: 91, cuisines: Desserts, Cafe, Pizza, Mexican, BBQ, Chinese\nDinner: 3 Squares Diner, Lubbock, Texas, cost: 73, cuisines: Pizza, Indian, Fast Food\nAccommodation: Private bedroom in UWS Apartment, Lubbock, Texas, cost: 709, room type: Private room, house rules: No visitors & No pets, minimum nights: 2, maximum occupancy: 2\n\nNumber of people: 1\nTotal cost: 9 x 1 + 11 x 1 + 91 x 1 + 73 x 1 + 709 x 1 = 893\nAccommodation minimum nights: 1/2\n\nDays: 6\nCurrent City: Lubbock, Texas\nTransportation: -\nBreakfast: Assam Tea Corner, Lubbock, Texas, cost: 52, cuisines: Desserts, BBQ, Fast Food, American, Seafood\nAttraction: American Windmill Museum, Lubbock; Mackenzie Main City Park, Lubbock\nLunch: Sultanat, Lubbock, Texas, cost: 72, cuisines: Chinese, Bakery, BBQ, Cafe\nDinner: Annapurna Bhandar, Lubbock, Texas, cost: 78, cuisines: French, Chinese, Desserts, Fast Food\nAccommodation: Private bedroom in UWS Apartment, Lubbock, Texas, cost: 709, room type: Private room, house rules: No visitors & No pets, minimum nights: 2, maximum occupancy: 2\n\nNumber of people: 1\nTotal cost: 52 x 1 + 72 x 1 + 78 x 1 + 709 x 1 = 911\nAccommodation minimum nights: 2/2\n\nDays: 7\nCurrent City: from Lubbock, Texas to Augusta\nTransportation: Self-driving, from Lubbock to Augusta, duration: 18 hours 17 mins, distance: 2,047 km, cost: 102\nBreakfast: Cantinho da Gula, Lubbock, Texas, cost: 78, cuisines: Cafe, BBQ, Desserts, Italian\nAttraction: -\nLunch: -\nDinner: -\nAccommodation: -\n\nNumber of people: 1\nTotal cost: 102 x 1 + 78 x 1 = 180\n\nTotal cost across all days: 172 + 185 + 582 + 531 + 893 + 911 + 180 = 3,454\n\nCuisines: The prompt specifies no cuisines, so all cuisine constraints are satisfied\n\nNote: The travel plan adheres to the constraints of visiting 3 distinct cities in Texas, starting and ending in Augusta, and not exceeding the budget of $4,100. The plan includes transportation, meals, attractions, and accommodations for each day, ensuring no repetition of restaurants or attractions and adhering to the house rules and room type constraints for accommodations.", "gpt-4-1106-preview_direct_sole-planning_parsed_results": [{"day": 1, "current_city": "from Augusta to Abilene, Texas", "transportation": "Self-driving, from Augusta to Abilene, duration: 15 hours 59 mins, distance: 1,782 km", "breakfast": "-", "attraction": "-", "lunch": "-", "dinner": "-", "accommodation": "Joyce and Donovan's, Room for One, Abilene, Texas"}, {"day": 2, "current_city": "Abilene, Texas", "transportation": "-", "breakfast": "Thai Garden, Abilene, Texas", "attraction": "The Grace Museum, Abilene; Frontier Texas!, Abilene;", "lunch": "Crispy Crust, Abilene, Texas", "dinner": "Finger Licious, Abilene, Texas", "accommodation": "Joyce and Donovan's, Room for One, Abilene, Texas"}, {"day": 3, "current_city": "from Abilene, Texas to Amarillo, Texas", "transportation": "Self-driving, from Abilene to Amarillo, duration: 4 hours 10 mins, distance: 446 km", "breakfast": "Biryani Express, Abilene, Texas", "attraction": "Cadillac Ranch, Amarillo; Amarillo Botanical Gardens, Amarillo;", "lunch": "The Cinnamon Kitchen, Amarillo, Texas", "dinner": "Komachi, Amarillo, Texas", "accommodation": "Harlem Humble Abode - 1 bedroom - Cute and Quaint, Amarillo, Texas"}, {"day": 4, "current_city": "Amarillo, Texas", "transportation": "-", "breakfast": "Kanha North & South Indian Veg., Amarillo, Texas", "attraction": "Amarillo Zoo, Amarillo; Don Harrington Discovery Center, Amarillo;", "lunch": "Sigree Global Grill, Amarillo, Texas", "dinner": "Anand Restaurant, Amarillo, Texas", "accommodation": "Harlem Humble Abode - 1 bedroom - Cute and Quaint, Amarillo, Texas"}, {"day": 5, "current_city": "from Amarillo, Texas to Lubbock, Texas", "transportation": "Self-driving, from Amarillo to Lubbock, duration: 1 hour 47 mins, distance: 197 km", "breakfast": "Wood Box Cafe, Amarillo, Texas", "attraction": "Buddy Holly Center, Lubbock; National Ranching Heritage Center, Lubbock;", "lunch": "Paris 6 Classique, Lubbock, Texas", "dinner": "3 Squares Diner, Lubbock, Texas", "accommodation": "Private bedroom in UWS Apartment, Lubbock, Texas"}, {"day": 6, "current_city": "Lubbock, Texas", "transportation": "-", "breakfast": "Assam Tea Corner, Lubbock, Texas", "attraction": "American Windmill Museum, Lubbock; Mackenzie Main City Park, Lubbock;", "lunch": "Sultanat, Lubbock, Texas", "dinner": "Annapurna Bhandar, Lubbock, Texas", "accommodation": "Private bedroom in UWS Apartment, Lubbock, Texas"}, {"day": 7, "current_city": "from Lubbock, Texas to Augusta", "transportation": "Self-driving, from Lubbock to Augusta, duration: 18 hours 17 mins, distance: 2,047 km", "breakfast": "Cantinho da Gula, Lubbock, Texas", "attraction": "-", "lunch": "-", "dinner": "-", "accommodation": "-"}]}]