[{"gpt-4-1106-preview_direct_sole-planning_results": "Travel Plan:\n\nDays: 1\nCurrent City: from Tulsa to Kansas City, Missouri\nTransportation: Self-driving, from Tulsa to Kansas City, duration: 3 hours 59 mins, distance: 436 km, cost: 21\nBreakfast: -\nAttraction: -\nLunch: -\nDinner: -\nAccommodation: Beautiful large floor-through apartment, Kansas City, Missouri, cost: 769, room type: Entire home/apt, house rules: No children under 10, minimum nights: 3, maximum occupancy: 4\n\nNumber of people: 2\nTotal cost: 21 x 2 + 769 x 1 = 811\nAccommodation minimum nights: 1/3\n\nDays: 2\nCurrent City: Kansas City, Missouri\nTransportation: -\nBreakfast: Eddie's Patisserie, Kansas City, Missouri, cost: 13, cuisines: Tea, Mexican, Bakery, BBQ, Seafood\nAttraction: Science City, Kansas City; The Nelson-Atkins Museum of Art, Kansas City\nLunch: Gero, Kansas City, Missouri, cost: 65, cuisines: French, Pizza, American, Seafood\nDinner: Antebellum, Kansas City, Missouri, cost: 50, cuisines: Tea, Bakery\nAccommodation: Beautiful large floor-through apartment, Kansas City, Missouri, cost: 769, room type: Entire home/apt, house rules: No children under 10, minimum nights: 3, maximum occupancy: 4\n\nNumber of people: 2\nTotal cost: 13 x 2 + 65 x 2 + 50 x 2 + 769 x 1 = 1025\nAccommodation minimum nights: 2/3\n\nDays: 3\nCurrent City: Kansas City, Missouri\nTransportation: -\nBreakfast: 1UP, Kansas City, Missouri, cost: 17, cuisines: Tea, Bakery, BBQ, Cafe, Mediterranean\nAttraction: Union Station Kansas City; Worlds of Fun, Kansas City\nLunch: World Cafe - Vibe by The LaLiT Traveller, Kansas City, Missouri, cost: 53, cuisines: Pizza, BBQ, Fast Food, Indian, Seafood\nDinner: Megha Vaishno Dhaba, Kansas City, Missouri, cost: 63, cuisines: Tea, Indian, BBQ\nAccommodation: Beautiful large floor-through apartment, Kansas City, Missouri, cost: 769, room type: Entire home/apt, house rules: No children under 10, minimum nights: 3, maximum occupancy: 4\n\nNumber of people: 2\nTotal cost: 17 x 2 + 53 x 2 + 63 x 2 + 769 x 1 = 1035\nAccommodation minimum nights: 3/3\n\nDays: 4\nCurrent City: from Kansas City, Missouri to Cape Girardeau, Missouri\nTransportation: Self-driving, from Kansas City to Cape Girardeau, duration: 5 hours 12 mins, distance: 563 km, cost: 28\nBreakfast: -\nAttraction: -\nLunch: -\nDinner: -\nAccommodation: Cozy apartment near JFK, Cape Girardeau, Missouri, cost: 59, room type: Entire home/apt, house rules: No visitors, minimum nights: 7, maximum occupancy: 3\n\nNumber of people: 2\nTotal cost: 28 x 2 + 59 x 1 = 115\nAccommodation minimum nights: 1/7\n\nDays: 5\nCurrent City: Cape Girardeau, Missouri\nTransportation: -\nBreakfast: Cafe Totaram, Cape Girardeau, Missouri, cost: 62, cuisines: Bakery, Pizza, Desserts, Seafood\nAttraction: Cape River Heritage Museum, Cape Girardeau; Cape Girardeau Conservation Nature Center, Cape Girardeau\nLunch: El Toreo Mexican Restaurant, Cape Girardeau, Missouri, cost: 35, cuisines: Desserts, Tea, Italian, BBQ, Seafood\nDinner: Onesta, Cape Girardeau, Missouri, cost: 31, cuisines: Tea, Desserts, Seafood\nAccommodation: Cozy apartment near JFK, Cape Girardeau, Missouri, cost: 59, room type: Entire home/apt, house rules: No visitors, minimum nights: 7, maximum occupancy: 3\n\nNumber of people: 2\nTotal cost: 62 x 2 + 35 x 2 + 31 x 2 + 59 x 1 = 315\nAccommodation minimum nights: 2/7\n\nDays: 6\nCurrent City: from Cape Girardeau, Missouri to St. Louis, Missouri\nTransportation: Self-driving, from Cape Girardeau to St. Louis, duration: 1 hour 51 mins, distance: 186 km, cost: 9\nBreakfast: -\nAttraction: -\nLunch: -\nDinner: -\nAccommodation: Lux 2Bed/2.5Bath Central Park Views, St. Louis, Missouri, cost: 1004, room type: Entire home/apt, house rules: No pets & No visitors, minimum nights: 30, maximum occupancy: 7\n\nNumber of people: 2\nTotal cost: 9 x 2 + 1004 x 1 = 1022\nAccommodation minimum nights: 1/30\n\nDays: 7\nCurrent City: St. Louis, Missouri\nTransportation: Flight, from St. Louis to Tulsa, Flight Number: F3954999, Price: 124, DepTime: 21:53, ArrTime: 23:03, ActualElapsedTime: 1 hours 10 minutes\nBreakfast: El Super Burrito, St. Louis, Missouri, cost: 43, cuisines: Tea, Cafe, Mediterranean, Fast Food\nAttraction: Saint Louis Zoo, St. Louis; Missouri Botanical Garden, St. Louis\nLunch: The Latitude - Radisson Blu, St. Louis, Missouri, cost: 18, cuisines: Pizza, French, BBQ, American, Seafood\nDinner: Wai Yu Mun Ching, St. Louis, Missouri, cost: 89, cuisines: Tea, Mexican, BBQ, Bakery, Mediterranean, Seafood\nAccommodation: -\n\nNumber of people: 2\nTotal cost: 43 x 2 + 18 x 2 + 89 x 2 + 124 x 2 = 546\n\nTotal cost across all days: 811 + 1025 + 1035 + 115 + 315 + 1022 + 546 = 4869\nRemaining budget: $8,800 - $4,869 = $3,931\n\nCuisines: The prompt specifies no cuisines, so all cuisine constraints are satisfied.", "gpt-4-1106-preview_direct_sole-planning_parsed_results": [{"day": 1, "current_city": "from Tulsa to Kansas City, Missouri", "transportation": "Self-driving, from Tulsa to Kansas City, duration: 3 hours 59 mins, distance: 436 km", "breakfast": "-", "attraction": "-", "lunch": "-", "dinner": "-", "accommodation": "Beautiful large floor-through apartment, Kansas City, Missouri"}, {"day": 2, "current_city": "Kansas City, Missouri", "transportation": "-", "breakfast": "Eddie's Patisserie, Kansas City, Missouri", "attraction": "Science City, Kansas City; The Nelson-Atkins Museum of Art, Kansas City", "lunch": "Gero, Kansas City, Missouri", "dinner": "Antebellum, Kansas City, Missouri", "accommodation": "Beautiful large floor-through apartment, Kansas City, Missouri"}, {"day": 3, "current_city": "Kansas City, Missouri", "transportation": "-", "breakfast": "1UP, Kansas City, Missouri", "attraction": "Union Station Kansas City; Worlds of Fun, Kansas City", "lunch": "World Cafe - Vibe by The LaLiT Traveller, Kansas City, Missouri", "dinner": "Megha Vaishno Dhaba, Kansas City, Missouri", "accommodation": "Beautiful large floor-through apartment, Kansas City, Missouri"}, {"day": 4, "current_city": "from Kansas City, Missouri to Cape Girardeau, Missouri", "transportation": "Self-driving, from Kansas City to Cape Girardeau, duration: 5 hours 12 mins, distance: 563 km", "breakfast": "-", "attraction": "-", "lunch": "-", "dinner": "-", "accommodation": "Cozy apartment near JFK, Cape Girardeau, Missouri"}, {"day": 5, "current_city": "Cape Girardeau, Missouri", "transportation": "-", "breakfast": "Cafe Totaram, Cape Girardeau, Missouri", "attraction": "Cape River Heritage Museum, Cape Girardeau; Cape Girardeau Conservation Nature Center, Cape Girardeau", "lunch": "El Toreo Mexican Restaurant, Cape Girardeau, Missouri", "dinner": "Onesta, Cape Girardeau, Missouri", "accommodation": "Cozy apartment near JFK, Cape Girardeau, Missouri"}, {"day": 6, "current_city": "from Cape Girardeau, Missouri to St. Louis, Missouri", "transportation": "Self-driving, from Cape Girardeau to St. Louis, duration: 1 hour 51 mins, distance: 186 km", "breakfast": "-", "attraction": "-", "lunch": "-", "dinner": "-", "accommodation": "Lux 2Bed/2.5Bath Central Park Views, St. Louis, Missouri"}, {"day": 7, "current_city": "from St. Louis, Missouri to Tulsa", "transportation": "Flight, from St. Louis to Tulsa, Flight Number: F3954999, Departure Time: 21:53, Arrival Time: 23:03", "breakfast": "El Super Burrito, St. Louis, Missouri", "attraction": "Saint Louis Zoo, St. Louis; Missouri Botanical Garden, St. Louis", "lunch": "The Latitude - Radisson Blu, St. Louis, Missouri", "dinner": "Wai Yu Mun Ching, St. Louis, Missouri", "accommodation": "-"}]}]