[{"gpt-4-1106-preview_direct_sole-planning_results": "Travel Plan:\n\nDays: 1\nCurrent City: from Cedar Rapids to Denver, Colorado\nTransportation: Flight F3894390, from Cedar Rapids to Denver, duration: 2 hours 6 minutes, cost: 178\nBreakfast: -\nAttraction: Denver Art Museum, Denver; Denver Zoo, Denver\nLunch: The Urban Socialite, Denver, Colorado, cost: 34, cuisines: Cafe, Indian, Desserts, Italian\nDinner: The Fatty Bao - Asian Gastro Bar, Denver, Colorado, cost: 93, cuisines: Bakery, BBQ, Cafe, Indian, Seafood\nAccommodation: *NO GUEST SERVICE FEE* Luxury Studio Suite w/ Free Continental Breakfast, Denver, Colorado, cost: 390, maximum occupancy: 2, house rules: No smoking & No visitors & No parties, minimum nights: 3\n\nNumber of people: 1\nTotal cost: 178 + 34 + 93 + 390 = 695\nAccommodation minimum nights: 1/3\n\nDays: 2\nCurrent City: Denver, Colorado\nTransportation: -\nBreakfast: Cafe Diva, Denver, Colorado, cost: 44, cuisines: Chinese, Cafe, Desserts, Fast Food\nAttraction: Denver Museum of Nature & Science, Denver; City Park, Denver\nLunch: Woods Spice, Denver, Colorado, cost: 69, cuisines: Tea, Cafe, Mexican, Desserts\nDinner: Rain Tree Grill, Denver, Colorado, cost: 94, cuisines: Tea, Mexican, BBQ, Italian\nAccommodation: *NO GUEST SERVICE FEE* Luxury Studio Suite w/ Free Continental Breakfast, Denver, Colorado, cost: 390, maximum occupancy: 2, house rules: No smoking & No visitors & No parties, minimum nights: 3\n\nNumber of people: 1\nTotal cost: 44 + 69 + 94 + 390 = 597\nAccommodation minimum nights: 2/3\n\nDays: 3\nCurrent City: from Denver to Alamosa, Colorado\nTransportation: Flight F3857649, from Denver to Alamosa, duration: 0 hours 49 minutes, cost: 37\nBreakfast: Nathu's Sweets, Denver, Colorado, cost: 12, cuisines: Tea, Bakery, BBQ, Fast Food\nAttraction: San Luis Valley Museum | Alamosa; Rio Grande Farm Park, Alamosa\nLunch: Atlanta Highway Seafood Market, Alamosa, Colorado, cost: 68, cuisines: Fast Food, Desserts, Seafood\nDinner: Riverwalk Cafe, Alamosa, Colorado, cost: 97, cuisines: Tea, Pizza, Fast Food\nAccommodation: Comfortable studio suite in midtown Manhattan, Alamosa, Colorado, cost: 67, maximum occupancy: 2, house rules: No parties & No smoking & No visitors, minimum nights: 30\n\nNumber of people: 1\nTotal cost: 37 + 12 + 68 + 97 + 67 = 281\nAccommodation minimum nights: 1/30\n\nDays: 4\nCurrent City: Alamosa, Colorado\nTransportation: -\nBreakfast: Cafe LazyMojo, Alamosa, Colorado, cost: 26, cuisines: Tea, Pizza, American, Fast Food\nAttraction: Alamosa National Wildlife Refuge and Visitor Center; Cole Park, Alamosa\nLunch: Emperor's Lounge - The Taj Mahal Hotel, Alamosa, Colorado, cost: 65, cuisines: Tea, Italian, BBQ, Cafe, Seafood\nDinner: The Midnight Heroes, Alamosa, Colorado, cost: 10, cuisines: Tea, BBQ, Cafe, Indian, Seafood\nAccommodation: Comfortable studio suite in midtown Manhattan, Alamosa, Colorado, cost: 67, maximum occupancy: 2, house rules: No parties & No smoking & No visitors, minimum nights: 30\n\nNumber of people: 1\nTotal cost: 26 + 65 + 10 + 67 = 168\nAccommodation minimum nights: 2/30\n\nDays: 5\nCurrent City: from Alamosa to Cedar Rapids\nTransportation: Self-driving, from Alamosa to Cedar Rapids, duration: 14 hours 27 mins, distance: 1,541 km, cost: 77\nBreakfast: Good Luck Cafe, Alamosa, Colorado, cost: 10, cuisines: Cafe, Mexican, Pizza\nAttraction: -\nLunch: -\nDinner: -\nAccommodation: -\n\nNumber of people: 1\nTotal cost: 77 + 10 = 87\n\nTotal cost across all days: 695 + 597 + 281 + 168 + 87 = 1,828\nCuisines: The prompt specifies no cuisines, so all cuisine constraints are satisfied\n\nNote: The accommodation in Alamosa has a minimum stay of 30 nights, which is not ideal for a 5-day trip. However, due to the lack of provided alternatives, it has been included in the plan. The traveler should seek to negotiate a shorter stay or find alternative accommodation.", "gpt-4-1106-preview_direct_sole-planning_parsed_results": [{"day": 1, "current_city": "from Cedar Rapids to Denver, Colorado", "transportation": "Flight Number: F3894390, from Cedar Rapids to Denver, duration: 2 hours 6 minutes", "breakfast": "-", "attraction": "Denver Art Museum, Denver;Denver Zoo, Denver;", "lunch": "The Urban Socialite, Denver, Colorado", "dinner": "The Fatty Bao - Asian Gastro Bar, Denver, Colorado", "accommodation": "*NO GUEST SERVICE FEE* Luxury Studio Suite w/ Free Continental Breakfast, Denver, Colorado"}, {"day": 2, "current_city": "Denver, Colorado", "transportation": "-", "breakfast": "Cafe Diva, Denver, Colorado", "attraction": "Denver Museum of Nature & Science, Denver;City Park, Denver;", "lunch": "Woods Spice, Denver, Colorado", "dinner": "Rain Tree Grill, Denver, Colorado", "accommodation": "*NO GUEST SERVICE FEE* Luxury Studio Suite w/ Free Continental Breakfast, Denver, Colorado"}, {"day": 3, "current_city": "from Denver to Alamosa, Colorado", "transportation": "Flight Number: F3857649, from Denver to Alamosa, duration: 0 hours 49 minutes", "breakfast": "Nathu's Sweets, Denver, Colorado", "attraction": "San Luis Valley Museum | Alamosa;Rio Grande Farm Park, Alamosa;", "lunch": "Atlanta Highway Seafood Market, Alamosa, Colorado", "dinner": "Riverwalk Cafe, Alamosa, Colorado", "accommodation": "Comfortable studio suite in midtown Manhattan, Alamosa, Colorado"}, {"day": 4, "current_city": "Alamosa, Colorado", "transportation": "-", "breakfast": "Cafe LazyMojo, Alamosa, Colorado", "attraction": "Alamosa National Wildlife Refuge and Visitor Center;Cole Park, Alamosa;", "lunch": "Emperor's Lounge - The Taj Mahal Hotel, Alamosa, Colorado", "dinner": "The Midnight Heroes, Alamosa, Colorado", "accommodation": "Comfortable studio suite in midtown Manhattan, Alamosa, Colorado"}, {"day": 5, "current_city": "from Alamosa to Cedar Rapids", "transportation": "Self-driving, from Alamosa to Cedar Rapids, duration: 14 hours 27 mins, distance: 1,541 km", "breakfast": "Good Luck Cafe, Alamosa, Colorado", "attraction": "-", "lunch": "-", "dinner": "-", "accommodation": "-"}]}]