[{"gpt-4-1106-preview_direct_sole-planning_results": "Travel Plan:\n\nDays: 1\nCurrent City: from New Orleans to Miami, Florida\nTransportation: Flight F3660109, from New Orleans to Miami, duration: 2 hours 19 minutes, cost: 188 x 3 = 564\nBreakfast: -\nAttraction: -\nLunch: -\nDinner: -\nAccommodation: \"HELLO BROOKLYN\" PARK SIDE VIEW NEWLY RENO APT., Miami, cost: 789, room type: Entire home/apt, house rules: No parties & No visitors, minimum nights: 1, maximum occupancy: 6\n\nNumber of people: 3\nTotal cost: 564 + 789 = 1353\nAccommodation minimum nights: 1/1\n\nDays: 2\nCurrent City: Miami, Florida\nTransportation: -\nBreakfast: Papouli's Mediterranean Cafe & Market, Miami, cost: 26 x 3 = 78, cuisines: Tea, Desserts\nAttraction: Jungle Island, Miami; P\u00e9rez Art Museum Miami, Miami\nLunch: Tako Cheena by Pom Pom, Miami, cost: 60 x 3 = 180, cuisines: Fast Food, Indian, Desserts, Italian\nDinner: AB's Absolute Barbecues, Miami, cost: 55 x 3 = 165, cuisines: Desserts, Tea, Pizza, Italian, Fast Food, American\nAccommodation: \"HELLO BROOKLYN\" PARK SIDE VIEW NEWLY RENO APT., Miami, cost: 789, room type: Entire home/apt, house rules: No parties & No visitors, minimum nights: 1, maximum occupancy: 6\n\nNumber of people: 3\nTotal cost: 78 + 180 + 165 + 789 = 1212\nAccommodation minimum nights: 2/1\n\nDays: 3\nCurrent City: from Miami to Tampa, Florida\nTransportation: Flight F3670101, from Miami to Tampa, duration: 0 hours 54 minutes, cost: 56 x 3 = 168\nBreakfast: -\nAttraction: -\nLunch: -\nDinner: -\nAccommodation: Spacious 1+ bedroom apt in NYC, Tampa, cost: 547, room type: Entire home/apt, house rules: No smoking & No parties & No children under 10, minimum nights: 1, maximum occupancy: 2\n\nNumber of people: 3\nTotal cost: 168 + 547 = 715\nAccommodation minimum nights: 1/1\n\nDays: 4\nCurrent City: Tampa, Florida\nTransportation: -\nBreakfast: Lalit Kathi Rolls Momos, Tampa, cost: 23 x 3 = 69, cuisines: Tea, Pizza, Fast Food\nAttraction: The Florida Aquarium, Tampa; Busch Gardens Tampa Bay, Tampa\nLunch: Kobe Hibachi & Sushi, Tampa, cost: 63 x 3 = 189, cuisines: Desserts, French, BBQ, Bakery, Seafood\nDinner: Peg Leg Pete's, Tampa, cost: 91 x 3 = 273, cuisines: French, Bakery, Cafe\nAccommodation: Spacious 1+ bedroom apt in NYC, Tampa, cost: 547, room type: Entire home/apt, house rules: No smoking & No parties & No children under 10, minimum nights: 1, maximum occupancy: 2\n\nNumber of people: 3\nTotal cost: 69 + 189 + 273 + 547 = 1078\nAccommodation minimum nights: 2/1\n\nDays: 5\nCurrent City: from Tampa to New Orleans\nTransportation: Flight F4007107, from Tampa to New Orleans, duration: 1 hours 32 minutes, cost: 124 x 3 = 372\nBreakfast: -\nAttraction: -\nLunch: -\nDinner: -\nAccommodation: -\n\nNumber of people: 3\nTotal cost: 372\n\nTotal cost across all days: 1353 + 1212 + 715 + 1078 + 372 = 4730\n\nUnfortunately, the total cost of $4,730 exceeds the specified budget of $4,200. To adjust the plan to fit the budget, we can consider changing the flight to a self-driving option and selecting more budget-friendly accommodations or restaurants. However, without specific costs for each alternative option, it is not possible to provide a revised plan that fits the budget within this response. Please provide the costs for self-driving and alternative accommodations or restaurants if you would like to proceed with adjustments to the travel plan.", "gpt-4-1106-preview_direct_sole-planning_parsed_results": [{"day": 1, "current_city": "from New Orleans to Miami, Florida", "transportation": "Flight Number: F3660109, from New Orleans to Miami, Departure Time: -, Arrival Time: -", "breakfast": "-", "attraction": "-", "lunch": "-", "dinner": "-", "accommodation": "\"HELLO BROOKLYN\" PARK SIDE VIEW NEWLY RENO APT., Miami"}, {"day": 2, "current_city": "Miami, Florida", "transportation": "-", "breakfast": "Papouli's Mediterranean Cafe & Market, Miami", "attraction": "Jungle Island, Miami;P\u00e9rez Art Museum Miami, Miami;", "lunch": "Tako Cheena by Pom Pom, Miami", "dinner": "AB's Absolute Barbecues, Miami", "accommodation": "\"HELLO BROOKLYN\" PARK SIDE VIEW NEWLY RENO APT., Miami"}, {"day": 3, "current_city": "from Miami to Tampa, Florida", "transportation": "Flight Number: F3670101, from Miami to Tampa, Departure Time: -, Arrival Time: -", "breakfast": "-", "attraction": "-", "lunch": "-", "dinner": "-", "accommodation": "Spacious 1+ bedroom apt in NYC, Tampa"}, {"day": 4, "current_city": "Tampa, Florida", "transportation": "-", "breakfast": "Lalit Kathi Rolls Momos, Tampa", "attraction": "The Florida Aquarium, Tampa;Busch Gardens Tampa Bay, Tampa;", "lunch": "Kobe Hibachi & Sushi, Tampa", "dinner": "Peg Leg Pete's, Tampa", "accommodation": "Spacious 1+ bedroom apt in NYC, Tampa"}, {"day": 5, "current_city": "from Tampa to New Orleans", "transportation": "Flight Number: F4007107, from Tampa to New Orleans, Departure Time: -, Arrival Time: -", "breakfast": "-", "attraction": "-", "lunch": "-", "dinner": "-", "accommodation": "-"}]}]