[{"gpt-4-1106-preview_direct_sole-planning_results": "Travel Plan:\n\nDays: 1\nCurrent City: from North Platte to Grand Junction, Colorado\nTransportation: Self-driving, from North Platte to Grand Junction, duration: 7 hours 27 mins, distance: 809 km, cost: 40 x 2 = 80\nBreakfast: -\nAttraction: -\nLunch: -\nDinner: -\nAccommodation: NYC Apartment near Central Park!, Grand Junction, Colorado, cost: 1118 x 2 = 2236, room type: Entire home/apt, house rules: No children under 10, minimum nights: 3, maximum occupancy: 5\n\nNumber of people: 2\nTotal cost: 80 + 2236 = 2316\nAccommodation minimum nights: 1/3\n\nDays: 2\nCurrent City: Grand Junction, Colorado\nTransportation: -\nBreakfast: Austin's BBQ and Oyster Bar, Grand Junction, Colorado, cost: 15 x 2 = 30, cuisines: Tea, Bakery, Fast Food, Indian, Seafood\nAttraction: Museum of the West, Museums of Western Colorado; Western Colorado Botanical Gardens, Grand Junction\nLunch: Punjab Da Pind, Grand Junction, Colorado, cost: 52 x 2 = 104, cuisines: Desserts, Pizza, Bakery, Chinese, Mediterranean, Seafood\nDinner: Coffee Culture, Grand Junction, Colorado, cost: 87 x 2 = 174, cuisines: French, Cafe, Desserts, Seafood\nAccommodation: NYC Apartment near Central Park!, Grand Junction, Colorado, cost: 1118 x 2 = 2236, room type: Entire home/apt, house rules: No children under 10, minimum nights: 3, maximum occupancy: 5\n\nNumber of people: 2\nTotal cost: 30 + 104 + 174 + 2236 = 2544\nAccommodation minimum nights: 2/3\n\nDays: 3\nCurrent City: from Grand Junction, Colorado to Durango, Colorado\nTransportation: Self-driving, from Grand Junction to Durango, duration: 3 hours 33 mins, distance: 269 km, cost: 13 x 2 = 26\nBreakfast: Cha Bar, Grand Junction, Colorado, cost: 10 x 2 = 20, cuisines: Tea, Bakery, American, BBQ\nAttraction: -\nLunch: -\nDinner: -\nAccommodation: Lux 1BR in the heart of NYC Theater district!, Durango, Colorado, cost: 81 x 2 = 162, room type: Entire home/apt, house rules: No children under 10, minimum nights: 30, maximum occupancy: 3\n\nNumber of people: 2\nTotal cost: 26 + 20 + 162 = 208\nAccommodation minimum nights: 1/30\n\nDays: 4\nCurrent City: Durango, Colorado\nTransportation: -\nBreakfast: Samurai Japanese Cuisine & Sushi Bar, Durango, Colorado, cost: 67 x 2 = 134, cuisines: Bakery, Desserts, Fast Food\nAttraction: Animas Museum; Durango & Silverton Narrow Gauge Railroad, Durango\nLunch: Standard Chicken Point, Durango, Colorado, cost: 50 x 2 = 100, cuisines: Mexican, Indian, BBQ, Seafood\nDinner: The Mashal, Durango, Colorado, cost: 85 x 2 = 170, cuisines: Italian, BBQ, Fast Food, Cafe, American, Seafood\nAccommodation: Lux 1BR in the heart of NYC Theater district!, Durango, Colorado, cost: 81 x 2 = 162, room type: Entire home/apt, house rules: No children under 10, minimum nights: 30, maximum occupancy: 3\n\nNumber of people: 2\nTotal cost: 134 + 100 + 170 + 162 = 566\nAccommodation minimum nights: 2/30\n\nDays: 5\nCurrent City: from Durango, Colorado to Colorado Springs, Colorado\nTransportation: Self-driving, from Durango to Colorado Springs, duration: 5 hours 27 mins, distance: 504 km, cost: 25 x 2 = 50\nBreakfast: -\nAttraction: -\nLunch: -\nDinner: -\nAccommodation: Large sunny park slope apartment, Colorado Springs, Colorado, cost: 82 x 2 = 164, room type: Entire home/apt, house rules: No smoking & No parties & No pets, minimum nights: 1, maximum occupancy: 3\n\nNumber of people: 2\nTotal cost: 50 + 164 = 214\nAccommodation minimum nights: 1/1\n\nDays: 6\nCurrent City: Colorado Springs, Colorado\nTransportation: -\nBreakfast: Raglan Road Irish Pub and Restaurant, Colorado Springs, Colorado, cost: 97 x 2 = 194, cuisines: Chinese, Bakery, Pizza, Mediterranean\nAttraction: The Broadmoor Seven Falls; Garden of the Gods, Colorado Springs\nLunch: GoGourmet, Colorado Springs, Colorado, cost: 66 x 2 = 132, cuisines: Desserts, Bakery, Fast Food, Indian, Seafood\nDinner: LIT Ultrabar, Colorado Springs, Colorado, cost: 94 x 2 = 188, cuisines: Cafe, Italian, Fast Food, Chinese, Seafood\nAccommodation: Large sunny park slope apartment, Colorado Springs, Colorado, cost: 82 x 2 = 164, room type: Entire home/apt, house rules: No smoking & No parties & No pets, minimum nights: 1, maximum occupancy: 3\n\nNumber of people: 2\nTotal cost: 194 + 132 + 188 + 164 = 678\nAccommodation minimum nights: 2/1\n\nDays: 7\nCurrent City: from Colorado Springs, Colorado to North Platte\nTransportation: Self-driving, from Colorado Springs to North Platte, duration: 4 hours 40 mins, distance: 536 km, cost: 26 x 2 = 52\nBreakfast: -\nAttraction: -\nLunch: -\nDinner: -\nAccommodation: -\n\nNumber of people: 2\nTotal cost: 52\n\nTotal cost across all days: 2316 + 2544 + 208 + 566 + 214 + 678 + 52 = 6578\n\nCuisines: The prompt specifies no cuisines, so all cuisine constraints are satisfied\n\nNote: The accommodation on Day 3 in Durango has a minimum stay of 30 nights, which is not suitable for the travel plan. However, due to the lack of provided alternatives that allow parties and are non-shared, this accommodation was selected. Adjustments may be necessary based on actual availability and policies.", "gpt-4-1106-preview_direct_sole-planning_parsed_results": [{"day": 1, "current_city": "from North Platte to Grand Junction, Colorado", "transportation": "Self-driving, from North Platte to Grand Junction, Duration: 7 hours 27 mins, Distance: 809 km", "breakfast": "-", "attraction": "-", "lunch": "-", "dinner": "-", "accommodation": "NYC Apartment near Central Park!, Grand Junction, Colorado"}, {"day": 2, "current_city": "Grand Junction, Colorado", "transportation": "-", "breakfast": "Austin's BBQ and Oyster Bar, Grand Junction, Colorado", "attraction": "Museum of the West, Grand Junction;Western Colorado Botanical Gardens, Grand Junction;", "lunch": "Punjab Da Pind, Grand Junction, Colorado", "dinner": "Coffee Culture, Grand Junction, Colorado", "accommodation": "NYC Apartment near Central Park!, Grand Junction, Colorado"}, {"day": 3, "current_city": "from Grand Junction, Colorado to Durango, Colorado", "transportation": "Self-driving, from Grand Junction to Durango, Duration: 3 hours 33 mins, Distance: 269 km", "breakfast": "Cha Bar, Grand Junction, Colorado", "attraction": "-", "lunch": "-", "dinner": "-", "accommodation": "Lux 1BR in the heart of NYC Theater district!, Durango, Colorado"}, {"day": 4, "current_city": "Durango, Colorado", "transportation": "-", "breakfast": "Samurai Japanese Cuisine & Sushi Bar, Durango, Colorado", "attraction": "Animas Museum, Durango;Durango & Silverton Narrow Gauge Railroad, Durango;", "lunch": "Standard Chicken Point, Durango, Colorado", "dinner": "The Mashal, Durango, Colorado", "accommodation": "Lux 1BR in the heart of NYC Theater district!, Durango, Colorado"}, {"day": 5, "current_city": "from Durango, Colorado to Colorado Springs, Colorado", "transportation": "Self-driving, from Durango to Colorado Springs, Duration: 5 hours 27 mins, Distance: 504 km", "breakfast": "-", "attraction": "-", "lunch": "-", "dinner": "-", "accommodation": "Large sunny park slope apartment, Colorado Springs, Colorado"}, {"day": 6, "current_city": "Colorado Springs, Colorado", "transportation": "-", "breakfast": "Raglan Road Irish Pub and Restaurant, Colorado Springs, Colorado", "attraction": "The Broadmoor Seven Falls, Colorado Springs;Garden of the Gods, Colorado Springs;", "lunch": "GoGourmet, Colorado Springs, Colorado", "dinner": "LIT Ultrabar, Colorado Springs, Colorado", "accommodation": "Large sunny park slope apartment, Colorado Springs, Colorado"}, {"day": 7, "current_city": "from Colorado Springs, Colorado to North Platte", "transportation": "Self-driving, from Colorado Springs to North Platte, Duration: 4 hours 40 mins, Distance: 536 km", "breakfast": "-", "attraction": "-", "lunch": "-", "dinner": "-", "accommodation": "-"}]}]