[{"gpt-4-1106-preview_direct_sole-planning_results": "Travel Plan:\n\nDays: 1\nCurrent City: from Chattanooga to Atlanta, Georgia\nTransportation: Self-driving, from Chattanooga to Atlanta, duration: 1 hour 48 mins, distance: 190 km, cost: 9\nBreakfast: -\nAttraction: -\nLunch: -\nDinner: -\nAccommodation: Bright, Modern, Clean, Spacious, Brooklyn Home, Atlanta, Georgia, cost: 1034, room type: Entire home/apt, house rules: No children under 10, minimum nights: 3, maximum occupancy: 4\n\nNumber of people: 2\nTotal cost: 9 x 2 + 1034 x 1 = 1052\nAccommodation minimum nights: 1/3\n\nDays: 2\nCurrent City: Atlanta, Georgia\nTransportation: -\nBreakfast: Saffron, Atlanta, Georgia, cost: 39, cuisines: Tea, Cafe, Fast Food, Seafood\nAttraction: Georgia Aquarium, Atlanta; World of Coca-Cola, Atlanta\nLunch: Baba Au Rhum, Atlanta, Georgia, cost: 27, cuisines: Desserts, Pizza, Mexican, BBQ, Fast Food\nDinner: Chef Style, Atlanta, Georgia, cost: 59, cuisines: Pizza, American, Desserts, Seafood\nAccommodation: Bright, Modern, Clean, Spacious, Brooklyn Home, Atlanta, Georgia, cost: 1034, room type: Entire home/apt, house rules: No children under 10, minimum nights: 3, maximum occupancy: 4\n\nNumber of people: 2\nTotal cost: (39 + 27 + 59) x 2 + 1034 x 1 = 1226\nAccommodation minimum nights: 2/3\n\nDays: 3\nCurrent City: Atlanta, Georgia\nTransportation: -\nBreakfast: Asian Bistro, Atlanta, Georgia, cost: 27, cuisines: Tea, Bakery, Seafood\nAttraction: Atlanta Botanical Garden, Atlanta; Piedmont Park, Atlanta\nLunch: Pizza Central, Atlanta, Georgia, cost: 75, cuisines: Cafe, Bakery, BBQ, Fast Food, Chinese, Indian\nDinner: Daawat-e-Kashmir, Atlanta, Georgia, cost: 19, cuisines: Cafe, Pizza, American, Seafood\nAccommodation: Bright, Modern, Clean, Spacious, Brooklyn Home, Atlanta, Georgia, cost: 1034, room type: Entire home/apt, house rules: No children under 10, minimum nights: 3, maximum occupancy: 4\n\nNumber of people: 2\nTotal cost: (27 + 75 + 19) x 2 + 1034 x 1 = 1302\nAccommodation minimum nights: 3/3\n\nDays: 4\nCurrent City: from Atlanta to Decatur, Georgia\nTransportation: Self-driving, from Atlanta to Decatur, duration: 18 mins, distance: 10.0 km, cost: 0\nBreakfast: -\nAttraction: -\nLunch: -\nDinner: -\nAccommodation: The Heart of the Lower East Side!, Decatur, Georgia, cost: 587, room type: Entire home/apt, house rules: No children under 10, minimum nights: 2, maximum occupancy: 2\n\nNumber of people: 2\nTotal cost: 587 x 1 = 587\nAccommodation minimum nights: 1/2\n\nDays: 5\nCurrent City: Decatur, Georgia\nTransportation: -\nBreakfast: Madhuban Restaurant - Welcome Hotel Rama International, Decatur, Georgia, cost: 47, cuisines: Pizza, Bakery, Seafood\nAttraction: Decatur Square, Decatur; Glenlake Park, Decatur\nLunch: Joey's Pizza, Decatur, Georgia, cost: 69, cuisines: Tea, Pizza, Bakery, Chinese, Seafood\nDinner: Dawat-E-Chaman, Decatur, Georgia, cost: 42, cuisines: Chinese, BBQ, Fast Food, Cafe, Mediterranean\nAccommodation: The Heart of the Lower East Side!, Decatur, Georgia, cost: 587, room type: Entire home/apt, house rules: No children under 10, minimum nights: 2, maximum occupancy: 2\n\nNumber of people: 2\nTotal cost: (47 + 69 + 42) x 2 + 587 x 1 = 903\nAccommodation minimum nights: 2/2\n\nDays: 6\nCurrent City: from Decatur to Augusta, Georgia\nTransportation: Self-driving, from Decatur to Augusta, duration: 2 hours 17 mins, distance: 228 km, cost: 11\nBreakfast: -\nAttraction: -\nLunch: -\nDinner: -\nAccommodation: Planta Baja Studio, Augusta, Georgia, cost: 637, room type: Entire home/apt, house rules: No smoking, minimum nights: 1, maximum occupancy: 4\n\nNumber of people: 2\nTotal cost: 11 x 2 + 637 x 1 = 659\nAccommodation minimum nights: 1/1\n\nDays: 7\nCurrent City: Augusta, Georgia\nTransportation: Self-driving, from Augusta to Chattanooga, duration: 3 hours 58 mins, distance: 424 km, cost: 21\nBreakfast: B Merrell's, Augusta, Georgia, cost: 74, cuisines: Tea, Pizza, Desserts, Fast Food\nAttraction: Augusta Riverwalk, Augusta; Morris Museum of Art, Augusta\nLunch: The Charcoal Chimney, Augusta, Georgia, cost: 86, cuisines: Tea, Fast Food, BBQ, Italian\nDinner: -\nAccommodation: -\n\nNumber of people: 2\nTotal cost: (74 + 86) x 2 + 21 x 2 = 342\n\nTotal cost across all days: 1052 + 1226 + 1302 + 587 + 903 + 659 + 342 = 6071\nCuisines: The prompt specifies no cuisines, so all cuisine constraints are satisfied", "gpt-4-1106-preview_direct_sole-planning_parsed_results": [{"day": 1, "current_city": "from Chattanooga to Atlanta, Georgia", "transportation": "Self-driving, from Chattanooga to Atlanta, duration: 1 hour 48 mins, distance: 190 km", "breakfast": "-", "attraction": "-", "lunch": "-", "dinner": "-", "accommodation": "Bright, Modern, Clean, Spacious, Brooklyn Home, Atlanta, Georgia"}, {"day": 2, "current_city": "Atlanta, Georgia", "transportation": "-", "breakfast": "Saffron, Atlanta, Georgia", "attraction": "Georgia Aquarium, Atlanta; World of Coca-Cola, Atlanta;", "lunch": "Baba Au Rhum, Atlanta, Georgia", "dinner": "Chef Style, Atlanta, Georgia", "accommodation": "Bright, Modern, Clean, Spacious, Brooklyn Home, Atlanta, Georgia"}, {"day": 3, "current_city": "Atlanta, Georgia", "transportation": "-", "breakfast": "Asian Bistro, Atlanta, Georgia", "attraction": "Atlanta Botanical Garden, Atlanta; Piedmont Park, Atlanta;", "lunch": "Pizza Central, Atlanta, Georgia", "dinner": "Daawat-e-Kashmir, Atlanta, Georgia", "accommodation": "Bright, Modern, Clean, Spacious, Brooklyn Home, Atlanta, Georgia"}, {"day": 4, "current_city": "from Atlanta to Decatur, Georgia", "transportation": "Self-driving, from Atlanta to Decatur, duration: 18 mins, distance: 10.0 km", "breakfast": "-", "attraction": "-", "lunch": "-", "dinner": "-", "accommodation": "The Heart of the Lower East Side!, Decatur, Georgia"}, {"day": 5, "current_city": "Decatur, Georgia", "transportation": "-", "breakfast": "Madhuban Restaurant - Welcome Hotel Rama International, Decatur, Georgia", "attraction": "Decatur Square, Decatur; Glenlake Park, Decatur;", "lunch": "Joey's Pizza, Decatur, Georgia", "dinner": "Dawat-E-Chaman, Decatur, Georgia", "accommodation": "The Heart of the Lower East Side!, Decatur, Georgia"}, {"day": 6, "current_city": "from Decatur to Augusta, Georgia", "transportation": "Self-driving, from Decatur to Augusta, duration: 2 hours 17 mins, distance: 228 km", "breakfast": "-", "attraction": "-", "lunch": "-", "dinner": "-", "accommodation": "Planta Baja Studio, Augusta, Georgia"}, {"day": 7, "current_city": "from Augusta to Chattanooga", "transportation": "Self-driving, from Augusta to Chattanooga, duration: 3 hours 58 mins, distance: 424 km", "breakfast": "B Merrell's, Augusta, Georgia", "attraction": "Augusta Riverwalk, Augusta; Morris Museum of Art, Augusta;", "lunch": "The Charcoal Chimney, Augusta, Georgia", "dinner": "-", "accommodation": "-"}]}]