[{"gpt-4-1106-preview_direct_sole-planning_results": "Travel Plan:\n\nDays: 1\nCurrent City: from Washington to Buffalo, New York\nTransportation: Flight F3791084, from Washington to Buffalo, duration: 1 hour 12 minutes, cost: $70\nBreakfast: -\nAttraction: -\nLunch: -\nDinner: -\nAccommodation: Cozy Studio in Heart of Ft Greene, Buffalo, New York, cost: $200, room type: Entire home/apt, house rules: No pets & No children under 10, maximum occupancy: 3\n\nNumber of people: 2\nTotal cost: $70 x 2 + $200 x 1 = $340\nAccommodation minimum nights: 1/4\n\nDays: 2\nCurrent City: Buffalo, New York\nTransportation: -\nBreakfast: Shokitini, Buffalo, New York, cost: $41, cuisines: Tea, Cafe, Pizza, Mexican, Chinese, Seafood\nAttraction: The Buffalo Zoo, Buffalo; Buffalo Naval Park, Buffalo\nLunch: Tibby's New Orleans Kitchen, Buffalo, New York, cost: $48, cuisines: Seafood, Indian, BBQ, Italian\nDinner: Pinch Of Spice, Buffalo, New York, cost: $84, cuisines: Cafe, Desserts, Seafood\nAccommodation: Cozy Studio in Heart of Ft Greene, Buffalo, New York, cost: $200, room type: Entire home/apt, house rules: No pets & No children under 10, maximum occupancy: 3\n\nNumber of people: 2\nTotal cost: ($41 + $48 + $84) x 2 + $200 x 1 = $506\nAccommodation minimum nights: 2/4\n\nDays: 3\nCurrent City: from Buffalo to Watertown, New York\nTransportation: Self-driving, from Buffalo to Watertown, duration: 3 hours 15 mins, distance: 347 km, cost: $17\nBreakfast: Maa Kali Foods, Buffalo, New York, cost: $61, cuisines: Desserts, BBQ, Bakery, Fast Food, Indian\nAttraction: Sci-Tech Museum, Watertown; Jefferson County Historical Society, Watertown\nLunch: The Catch Seafood Room & Oyster Bar, Watertown, New York, cost: $51, cuisines: Tea, BBQ, Fast Food, Mediterranean, Seafood\nDinner: Ruth Ann's Family Restaurant, Watertown, New York, cost: $22, cuisines: Tea, Pizza, Desserts, Italian\nAccommodation: Zen Holiday Getaway, Watertown, New York, cost: $56, room type: Entire home/apt, house rules: No visitors, maximum occupancy: 3\n\nNumber of people: 2\nTotal cost: $17 x 2 + ($61 + $51 + $22) x 2 + $56 x 1 = $340\nAccommodation minimum nights: 1/7\n\nDays: 4\nCurrent City: Watertown, New York\nTransportation: -\nBreakfast: Nik Baker's, Watertown, New York, cost: $12, cuisines: Desserts, Tea, Fast Food, Chinese, Mediterranean\nAttraction: Historic Thompson Park, Watertown; Zoo New York, Watertown\nLunch: Chaat Chowk, Watertown, New York, cost: $86, cuisines: Tea, French, Desserts, Fast Food\nDinner: Baskin Robbins, Watertown, New York, cost: $42, cuisines: Tea, Chinese, Desserts, Fast Food\nAccommodation: Zen Holiday Getaway, Watertown, New York, cost: $56, room type: Entire home/apt, house rules: No visitors, maximum occupancy: 3\n\nNumber of people: 2\nTotal cost: ($12 + $86 + $42) x 2 + $56 x 1 = $376\nAccommodation minimum nights: 2/7\n\nDays: 5\nCurrent City: from Watertown to New York, New York\nTransportation: Self-driving, from Watertown to New York, duration: 5 hours 7 mins, distance: 510 km, cost: $25\nBreakfast: Barista, Watertown, New York, cost: $14, cuisines: Fast Food, Chinese, Cafe, Seafood\nAttraction: -\nLunch: -\nDinner: -\nAccommodation: Beautiful and big 1BR sublet close by Central Park, New York, New York, cost: $983, room type: Private room, house rules: No parties & No children under 10, maximum occupancy: 2\n\nNumber of people: 2\nTotal cost: $25 x 2 + $14 x 2 + $983 x 1 = $1061\nAccommodation minimum nights: 1/5\n\nDays: 6\nCurrent City: New York, New York\nTransportation: -\nBreakfast: Seasons 52 Fresh Grill, New York, New York, cost: $30, cuisines: Seafood, Indian, Desserts, Italian\nAttraction: Top of The Rock, New York; Empire State Building, New York\nLunch: Gurgaon Hights, New York, New York, cost: $46, cuisines: Cafe, American, Indian, Fast Food\nDinner: G Dot, New York, New York, cost: $75, cuisines: Cafe, Mexican, BBQ\nAccommodation: Beautiful and big 1BR sublet close by Central Park, New York, New York, cost: $983, room type: Private room, house rules: No parties & No children under 10, maximum occupancy: 2\n\nNumber of people: 2\nTotal cost: ($30 + $46 + $75) x 2 + $983 x 1 = $1290\nAccommodation minimum nights: 2/5\n\nDays: 7\nCurrent City: from New York to Washington\nTransportation: Flight F3669574, from New York to Washington, duration: 1 hour 17 minutes, cost: $48\nBreakfast: -\nAttraction: -\nLunch: -\nDinner: -\nAccommodation: -\n\nNumber of people: 2\nTotal cost: $48 x 2 = $96\n\nTotal cost across all days: $340 + $506 + $340 + $376 + $1061 + $1290 + $96 = $4009\n\nCuisines: The prompt specifies no cuisines, so all cuisine constraints are satisfied\n\nNote: The accommodations selected allow smoking as per the query's preference. The total cost is within the specified budget of $5,500. The travel plan includes 3 cities in New York as requested, and the trip starts and ends in Washington, forming a closed circle. Each city is visited consecutively without reappearing once its sequence is over, except for the starting and ending city. The number of days matches the specified number of days in the query.", "gpt-4-1106-preview_direct_sole-planning_parsed_results": [{"day": 1, "current_city": "from Washington to Buffalo, New York", "transportation": "Flight Number: F3791084, from Washington to Buffalo, New York, Departure Time: -, Arrival Time: -", "breakfast": "-", "attraction": "-", "lunch": "-", "dinner": "-", "accommodation": "Cozy Studio in Heart of Ft Greene, Buffalo, New York"}, {"day": 2, "current_city": "Buffalo, New York", "transportation": "-", "breakfast": "Shokitini, Buffalo, New York", "attraction": "The Buffalo Zoo, Buffalo;Buffalo Naval Park, Buffalo;", "lunch": "Tibby's New Orleans Kitchen, Buffalo, New York", "dinner": "Pinch Of Spice, Buffalo, New York", "accommodation": "Cozy Studio in Heart of Ft Greene, Buffalo, New York"}, {"day": 3, "current_city": "from Buffalo to Watertown, New York", "transportation": "Self-driving, from Buffalo to Watertown, New York, Departure Time: -, Arrival Time: -", "breakfast": "Maa Kali Foods, Buffalo, New York", "attraction": "Sci-Tech Museum, Watertown;Jefferson County Historical Society, Watertown;", "lunch": "The Catch Seafood Room & Oyster Bar, Watertown, New York", "dinner": "Ruth Ann's Family Restaurant, Watertown, New York", "accommodation": "Zen Holiday Getaway, Watertown, New York"}, {"day": 4, "current_city": "Watertown, New York", "transportation": "-", "breakfast": "Nik Baker's, Watertown, New York", "attraction": "Historic Thompson Park, Watertown;Zoo New York, Watertown;", "lunch": "Chaat Chowk, Watertown, New York", "dinner": "Baskin Robbins, Watertown, New York", "accommodation": "Zen Holiday Getaway, Watertown, New York"}, {"day": 5, "current_city": "from Watertown to New York, New York", "transportation": "Self-driving, from Watertown to New York, New York, Departure Time: -, Arrival Time: -", "breakfast": "Barista, Watertown, New York", "attraction": "-", "lunch": "-", "dinner": "-", "accommodation": "Beautiful and big 1BR sublet close by Central Park, New York, New York"}, {"day": 6, "current_city": "New York, New York", "transportation": "-", "breakfast": "Seasons 52 Fresh Grill, New York, New York", "attraction": "Top of The Rock, New York;Empire State Building, New York;", "lunch": "Gurgaon Hights, New York, New York", "dinner": "G Dot, New York, New York", "accommodation": "Beautiful and big 1BR sublet close by Central Park, New York, New York"}, {"day": 7, "current_city": "from New York to Washington", "transportation": "Flight Number: F3669574, from New York to Washington, Departure Time: -, Arrival Time: -", "breakfast": "-", "attraction": "-", "lunch": "-", "dinner": "-", "accommodation": "-"}]}]