[{"gpt-4-1106-preview_direct_sole-planning_results": "Travel Plan:\n\nDays: 1\nCurrent City: from Pittsburgh to Houston, Texas\nTransportation: Flight F3902409, from Pittsburgh to Houston, duration: 3 hours 13 minutes, cost: $334 per person\nBreakfast: -\nAttraction: -\nLunch: -\nDinner: Jalapenos, Houston, Texas, cost: $57, cuisines: Desserts, Tea, Cafe, Chinese, Seafood\nAccommodation: Sunny and Airy near Manhattan, Houston, Texas, cost: $499, room type: Entire home/apt, house rules: No pets, minimum nights: 2, maximum occupancy: 4\n\nNumber of people: 7\nTotal cost: (334 x 7) + (57 x 7) + (499 x 2) = $2,338 + $399 + $998 = $3,735\nAccommodation minimum nights: 1/2\n\nDays: 2\nCurrent City: Houston, Texas\nTransportation: -\nBreakfast: Super Bakery, Houston, Texas, cost: $30, cuisines: Seafood, Fast Food\nAttraction: Space Center Houston; Houston Museum of Natural Science\nLunch: Sheetla Dhaba, Houston, Texas, cost: $35, cuisines: Desserts, Pizza, Bakery, American, Mediterranean\nDinner: Royal Mart, Houston, Texas, cost: $40, cuisines: Tea, Bakery, Cafe, Mediterranean, Seafood\nAccommodation: Sunny and Airy near Manhattan, Houston, Texas, cost: $499, room type: Entire home/apt, house rules: No pets, minimum nights: 2, maximum occupancy: 4\n\nNumber of people: 7\nTotal cost: (30 x 7) + (35 x 7) + (40 x 7) + (499 x 2) = $210 + $245 + $280 + $998 = $1,733\nAccommodation minimum nights: 2/2\n\nDays: 3\nCurrent City: from Houston to Dallas, Texas\nTransportation: Flight F3673854, from Houston to Dallas, duration: 1 hour 22 minutes, cost: $68 per person\nBreakfast: Matchbox, Houston, Texas, cost: $33, cuisines: Tea, Italian, Bakery, Fast Food, Seafood\nAttraction: -\nLunch: -\nDinner: Coconuts Fish Cafe, Dallas, Texas, cost: $38, cuisines: Cafe, BBQ, Mediterranean, Fast Food\nAccommodation: Fresh Budget Room, Dallas, Texas, cost: $262, room type: Private room, house rules: No visitors & No smoking, minimum nights: 2, maximum occupancy: 1\n\nNumber of people: 7\nTotal cost: (68 x 7) + (33 x 7) + (38 x 7) + (262 x 7) = $476 + $231 + $266 + $1,834 = $2,807\nAccommodation minimum nights: 1/2\n\nDays: 4\nCurrent City: Dallas, Texas\nTransportation: -\nBreakfast: Drifters Cafe, Dallas, Texas, cost: $21, cuisines: Tea, French, Mexican, Cafe, Seafood\nAttraction: The Dallas World Aquarium; Reunion Tower\nLunch: Cafe Hera Pheri, Dallas, Texas, cost: $18, cuisines: Cafe, Desserts\nDinner: Bikaner Sweets, Dallas, Texas, cost: $23, cuisines: Tea, French, Bakery, Cafe, Seafood\nAccommodation: Fresh Budget Room, Dallas, Texas, cost: $262, room type: Private room, house rules: No visitors & No smoking, minimum nights: 2, maximum occupancy: 1\n\nNumber of people: 7\nTotal cost: (21 x 7) + (18 x 7) + (23 x 7) + (262 x 7) = $147 + $126 + $161 + $1,834 = $2,268\nAccommodation minimum nights: 2/2\n\nDays: 5\nCurrent City: from Dallas to Pittsburgh\nTransportation: Self-driving, from Dallas to Pittsburgh, duration: 17 hours 59 mins, distance: 1,964 km, cost: $98 per person\nBreakfast: McDonald's, Dallas, Texas, cost: $56, cuisines: Cafe, Seafood\nAttraction: -\nLunch: -\nDinner: -\nAccommodation: -\n\nNumber of people: 7\nTotal cost: (98 x 7) + (56 x 7) = $686 + $392 = $1,078\n\nTotal cost across all days: $3,735 + $1,733 + $2,807 + $2,268 + $1,078 = $11,621\nRemaining budget: $16,100 - $11,621 = $4,479\nCuisines: All cuisine constraints are satisfied\nAccommodation: All accommodations permit children under the age of 10 and meet the house rules constraints.\n\nPlease note that the accommodation in Dallas is a private room with a maximum occupancy of 1, so multiple rooms have been booked to accommodate all 7 people. The total cost includes the price for all rooms needed. The remaining budget is sufficient to cover the costs of attractions and any additional meals or transportation not included in the plan.", "gpt-4-1106-preview_direct_sole-planning_parsed_results": [{"day": 1, "current_city": "from Pittsburgh to Houston, Texas", "transportation": "Flight Number: F3902409, from Pittsburgh to Houston, Departure Time: -, Arrival Time: -", "breakfast": "-", "attraction": "-", "lunch": "-", "dinner": "Jalapenos, Houston, Texas", "accommodation": "Sunny and Airy near Manhattan, Houston, Texas"}, {"day": 2, "current_city": "Houston, Texas", "transportation": "-", "breakfast": "Super Bakery, Houston, Texas", "attraction": "Space Center Houston, Houston, Texas;Houston Museum of Natural Science, Houston, Texas;", "lunch": "Sheetla Dhaba, Houston, Texas", "dinner": "Royal Mart, Houston, Texas", "accommodation": "Sunny and Airy near Manhattan, Houston, Texas"}, {"day": 3, "current_city": "from Houston to Dallas, Texas", "transportation": "Flight Number: F3673854, from Houston to Dallas, Departure Time: -, Arrival Time: -", "breakfast": "Matchbox, Houston, Texas", "attraction": "-", "lunch": "-", "dinner": "Coconuts Fish Cafe, Dallas, Texas", "accommodation": "Fresh Budget Room, Dallas, Texas"}, {"day": 4, "current_city": "Dallas, Texas", "transportation": "-", "breakfast": "Drifters Cafe, Dallas, Texas", "attraction": "The Dallas World Aquarium, Dallas, Texas;Reunion Tower, Dallas, Texas;", "lunch": "Cafe Hera Pheri, Dallas, Texas", "dinner": "Bikaner Sweets, Dallas, Texas", "accommodation": "Fresh Budget Room, Dallas, Texas"}, {"day": 5, "current_city": "from Dallas to Pittsburgh", "transportation": "Self-driving, from Dallas to Pittsburgh, Departure Time: -, Arrival Time: -", "breakfast": "McDonald's, Dallas, Texas", "attraction": "-", "lunch": "-", "dinner": "-", "accommodation": "-"}]}]