[{"gpt-4-1106-preview_direct_sole-planning_results": "Travel Plan:\n\nDays: 1\nCurrent City: from Minneapolis to Abilene, Texas\nTransportation: Self-driving, from Minneapolis to Abilene, duration: 15 hours 28 mins, distance: 1,732 km, cost: 86\nBreakfast: -\nAttraction: -\nLunch: -\nDinner: -\nAccommodation: Apartment minutes from manhattan, Abilene, Texas, cost: 295, room type: Entire home/apt, house rules: No pets & No visitors, minimum nights: 2, maximum occupancy: 2\n\nNumber of people: 2\nTotal cost: 86 x 2 + 295 x 1 = 467\nAccommodation minimum nights: 1/2\n\nDays: 2\nCurrent City: Abilene, Texas\nTransportation: -\nBreakfast: Thai Garden, Abilene, Texas, cost: 13, cuisines: Cafe, American, Desserts\nAttraction: The Grace Museum, Abilene; Frontier Texas!\nLunch: Crispy Crust, Abilene, Texas, cost: 54, cuisines: Desserts, Bakery, Cafe, American, Seafood\nDinner: LPK Waterfront, Abilene, Texas, cost: 61, cuisines: Pizza, Italian, BBQ, Fast Food, Seafood\nAccommodation: Apartment minutes from manhattan, Abilene, Texas, cost: 295, room type: Entire home/apt, house rules: No pets & No visitors, minimum nights: 2, maximum occupancy: 2\n\nNumber of people: 2\nTotal cost: 13 x 2 + 54 x 2 + 61 x 2 + 295 x 1 = 551\nAccommodation minimum nights: 2/2\n\nDays: 3\nCurrent City: from Abilene to Amarillo, Texas\nTransportation: Self-driving, from Abilene to Amarillo, duration: 4 hours 10 mins, distance: 446 km, cost: 22\nBreakfast: Biryani Express, Abilene, Texas, cost: 11, cuisines: Tea, Pizza, French, Bakery, Fast Food\nAttraction: Cadillac Ranch, Amarillo; Amarillo Botanical Gardens\nLunch: The Cinnamon Kitchen, Amarillo, Texas, cost: 69, cuisines: Desserts, Tea, Pizza, Chinese, Seafood\nDinner: Komachi, Amarillo, Texas, cost: 71, cuisines: Desserts, Tea, Fast Food, Chinese, Mediterranean\nAccommodation: Harlem Humble Abode - 1 bedroom - Cute and Quaint, Amarillo, Texas, cost: 409, room type: Entire home/apt, house rules: No pets, minimum nights: 5, maximum occupancy: 3\n\nNumber of people: 2\nTotal cost: 22 x 2 + 11 x 2 + 69 x 2 + 71 x 2 + 409 x 1 = 733\nAccommodation minimum nights: 1/5\n\nDays: 4\nCurrent City: Amarillo, Texas\nTransportation: -\nBreakfast: Kanha North & South Indian Veg., Amarillo, Texas, cost: 34, cuisines: Tea, Cafe, BBQ, Fast Food\nAttraction: Amarillo Zoo; Don Harrington Discovery Center\nLunch: Sigree Global Grill, Amarillo, Texas, cost: 35, cuisines: Chinese, BBQ, Cafe, Desserts\nDinner: Anand Restaurant, Amarillo, Texas, cost: 53, cuisines: Fast Food, Seafood, Desserts, Italian\nAccommodation: Harlem Humble Abode - 1 bedroom - Cute and Quaint, Amarillo, Texas, cost: 409, room type: Entire home/apt, house rules: No pets, minimum nights: 5, maximum occupancy: 3\n\nNumber of people: 2\nTotal cost: 34 x 2 + 35 x 2 + 53 x 2 + 409 x 1 = 617\nAccommodation minimum nights: 2/5\n\nDays: 5\nCurrent City: from Amarillo to Lubbock, Texas\nTransportation: Self-driving, from Amarillo to Lubbock, duration: 1 hour 47 mins, distance: 197 km, cost: 9\nBreakfast: Wood Box Cafe, Amarillo, Texas, cost: 11, cuisines: Desserts, French, Fast Food, Cafe, American\nAttraction: Buddy Holly Center, Lubbock; National Ranching Heritage Center\nLunch: Paris 6 Classique, Lubbock, Texas, cost: 91, cuisines: Desserts, Cafe, Pizza, Mexican, BBQ, Chinese\nDinner: 3 Squares Diner, Lubbock, Texas, cost: 73, cuisines: Pizza, Indian, Fast Food\nAccommodation: Private bedroom in UWS Apartment, Lubbock, Texas, cost: 709, room type: Private room, house rules: No visitors & No pets, minimum nights: 2, maximum occupancy: 2\n\nNumber of people: 2\nTotal cost: 9 x 2 + 11 x 2 + 91 x 2 + 73 x 2 + 709 x 1 = 1057\nAccommodation minimum nights: 1/2\n\nDays: 6\nCurrent City: Lubbock, Texas\nTransportation: -\nBreakfast: Assam Tea Corner, Lubbock, Texas, cost: 52, cuisines: Desserts, BBQ, Fast Food, American, Seafood\nAttraction: American Windmill Museum; Mackenzie Main City Park\nLunch: Sultanat, Lubbock, Texas, cost: 72, cuisines: Chinese, Bakery, BBQ, Cafe\nDinner: Annapurna Bhandar, Lubbock, Texas, cost: 78, cuisines: French, Chinese, Desserts, Fast Food\nAccommodation: Private bedroom in UWS Apartment, Lubbock, Texas, cost: 709, room type: Private room, house rules: No visitors & No pets, minimum nights: 2, maximum occupancy: 2\n\nNumber of people: 2\nTotal cost: 52 x 2 + 72 x 2 + 78 x 2 + 709 x 1 = 1041\nAccommodation minimum nights: 2/2\n\nDays: 7\nCurrent City: from Lubbock to Minneapolis\nTransportation: Self-driving, from Lubbock to Minneapolis, duration: 16 hours 17 mins, distance: 1,818 km, cost: 90\nBreakfast: Cantinho da Gula, Lubbock, Texas, cost: 78, cuisines: Cafe, BBQ, Desserts, Italian\nAttraction: -\nLunch: -\nDinner: -\nAccommodation: -\n\nNumber of people: 2\nTotal cost: 90 x 2 + 78 x 2 = 336\n\nTotal cost across all days: 467 + 551 + 733 + 617 + 1057 + 1041 + 336 = 4802\n\nCuisines: The prompt specifies no cuisines, so all cuisine constraints are satisfied\n\nNote: The accommodations selected are suitable for children under 10 years old, as per the query. The total cost is well within the specified budget of $11,900.", "gpt-4-1106-preview_direct_sole-planning_parsed_results": [{"day": 1, "current_city": "from Minneapolis to Abilene, Texas", "transportation": "Self-driving, from Minneapolis to Abilene, duration: 15 hours 28 mins, distance: 1,732 km", "breakfast": "-", "attraction": "-", "lunch": "-", "dinner": "-", "accommodation": "Apartment minutes from manhattan, Abilene, Texas"}, {"day": 2, "current_city": "Abilene, Texas", "transportation": "-", "breakfast": "Thai Garden, Abilene, Texas", "attraction": "The Grace Museum, Abilene; Frontier Texas!", "lunch": "Crispy Crust, Abilene, Texas", "dinner": "LPK Waterfront, Abilene, Texas", "accommodation": "Apartment minutes from manhattan, Abilene, Texas"}, {"day": 3, "current_city": "from Abilene to Amarillo, Texas", "transportation": "Self-driving, from Abilene to Amarillo, duration: 4 hours 10 mins, distance: 446 km", "breakfast": "Biryani Express, Abilene, Texas", "attraction": "Cadillac Ranch, Amarillo; Amarillo Botanical Gardens", "lunch": "The Cinnamon Kitchen, Amarillo, Texas", "dinner": "Komachi, Amarillo, Texas", "accommodation": "Harlem Humble Abode - 1 bedroom - Cute and Quaint, Amarillo, Texas"}, {"day": 4, "current_city": "Amarillo, Texas", "transportation": "-", "breakfast": "Kanha North & South Indian Veg., Amarillo, Texas", "attraction": "Amarillo Zoo; Don Harrington Discovery Center", "lunch": "Sigree Global Grill, Amarillo, Texas", "dinner": "Anand Restaurant, Amarillo, Texas", "accommodation": "Harlem Humble Abode - 1 bedroom - Cute and Quaint, Amarillo, Texas"}, {"day": 5, "current_city": "from Amarillo to Lubbock, Texas", "transportation": "Self-driving, from Amarillo to Lubbock, duration: 1 hour 47 mins, distance: 197 km", "breakfast": "Wood Box Cafe, Amarillo, Texas", "attraction": "Buddy Holly Center, Lubbock; National Ranching Heritage Center", "lunch": "Paris 6 Classique, Lubbock, Texas", "dinner": "3 Squares Diner, Lubbock, Texas", "accommodation": "Private bedroom in UWS Apartment, Lubbock, Texas"}, {"day": 6, "current_city": "Lubbock, Texas", "transportation": "-", "breakfast": "Assam Tea Corner, Lubbock, Texas", "attraction": "American Windmill Museum; Mackenzie Main City Park", "lunch": "Sultanat, Lubbock, Texas", "dinner": "Annapurna Bhandar, Lubbock, Texas", "accommodation": "Private bedroom in UWS Apartment, Lubbock, Texas"}, {"day": 7, "current_city": "from Lubbock to Minneapolis", "transportation": "Self-driving, from Lubbock to Minneapolis, duration: 16 hours 17 mins, distance: 1,818 km", "breakfast": "Cantinho da Gula, Lubbock, Texas", "attraction": "-", "lunch": "-", "dinner": "-", "accommodation": "-"}]}]