[{"gpt-4-1106-preview_direct_sole-planning_results": "Travel Plan:\n\nDays: 1\nCurrent City: from Evansville to Texarkana, Texas\nTransportation: Self-driving, from Evansville to Texarkana, duration: 8 hours 45 mins, distance: 889 km, cost: 44\nBreakfast: -\nAttraction: -\nLunch: -\nDinner: -\nAccommodation: Large 2.5 BR Apt In Park Slope, Texarkana, Texas, cost: 269, room type: Entire home/apt, house rules: No smoking & No visitors, minimum nights: 1, maximum occupancy: 3\n\nNumber of people: 4\nTotal cost: 44 x 4 + 269 x 1 = 445\nAccommodation minimum nights: 1/1\n\nDays: 2\nCurrent City: Texarkana, Texas\nTransportation: -\nBreakfast: Big City Bread Cafe, Texarkana, Texas, cost: 61, cuisines: Cafe, Pizza, Bakery, BBQ\nAttraction: Museum of Regional History, Texarkana; Ace of Clubs House, Texarkana\nLunch: Columbia Restaurant, Texarkana, Texas, cost: 91, cuisines: Desserts, Tea, Pizza, Indian, Seafood\nDinner: The Beer Cafe - BIGGIE, Texarkana, Texas, cost: 13, cuisines: Cafe, Pizza, Mediterranean, Fast Food\nAccommodation: Large 2.5 BR Apt In Park Slope, Texarkana, Texas, cost: 269, room type: Entire home/apt, house rules: No smoking & No visitors, minimum nights: 1, maximum occupancy: 3\n\nNumber of people: 4\nTotal cost: 61 x 4 + 91 x 4 + 13 x 4 + 269 x 1 = 1,005\nAccommodation minimum nights: 2/1\n\nDays: 3\nCurrent City: from Texarkana, Texas to Longview, Texas\nTransportation: Self-driving, from Texarkana to Longview, duration: 1 hour 36 mins, distance: 142 km, cost: 7\nBreakfast: Bansiwala Rasoi, Texarkana, Texas, cost: 71, cuisines: Tea, French, BBQ\nAttraction: Longview World of Wonders, Longview; Gregg County Historical Museum, Longview\nLunch: Barbeque Nation, Longview, Texas, cost: 26, cuisines: Cafe, Bakery\nDinner: Apni Rasoi, Longview, Texas, cost: 25, cuisines: Desserts, Tea, Pizza, Italian, Seafood\nAccommodation: Newly renovated 2 bedroom with FREE WIFI, Longview, Texas, cost: 581, room type: Entire home/apt, house rules: No children under 10, minimum nights: 1, maximum occupancy: 5\n\nNumber of people: 4\nTotal cost: 7 x 4 + 71 x 4 + 26 x 4 + 25 x 4 + 581 x 1 = 1,165\nAccommodation minimum nights: 1/1\n\nDays: 4\nCurrent City: Longview, Texas\nTransportation: -\nBreakfast: Monster's Cafe, Longview, Texas, cost: 94, cuisines: Tea, Bakery, Fast Food, Cafe, American, Mediterranean\nAttraction: Longview Museum of Fine Arts, Longview; Lear Park, Longview\nLunch: Sham Sweets, Longview, Texas, cost: 69, cuisines: Cafe, Bakery, BBQ, Fast Food, Chinese\nDinner: Momo Mia, Longview, Texas, cost: 19, cuisines: Desserts, Pizza, French, BBQ, Chinese\nAccommodation: Newly renovated 2 bedroom with FREE WIFI, Longview, Texas, cost: 581, room type: Entire home/apt, house rules: No children under 10, minimum nights: 1, maximum occupancy: 5\n\nNumber of people: 4\nTotal cost: 94 x 4 + 69 x 4 + 19 x 4 + 581 x 1 = 1,581\nAccommodation minimum nights: 2/1\n\nDays: 5\nCurrent City: from Longview, Texas to Evansville\nTransportation: Self-driving, from Longview to Evansville, duration: 10 hours 8 mins, distance: 1,045 km, cost: 52\nBreakfast: Apna Restaurant, Longview, Texas, cost: 17, cuisines: American, BBQ, Fast Food\nAttraction: -\nLunch: -\nDinner: -\nAccommodation: -\n\nNumber of people: 4\nTotal cost: 52 x 4 + 17 x 4 = 276\n\nTotal cost across all days: 445 + 1,005 + 1,165 + 1,581 + 276 = 4,472\n\nCuisines: The prompt specifies no cuisines, so all cuisine constraints are satisfied\n\nNote: The accommodations selected do not restrict parties as per the query. The transportation method is self-driving, avoiding airline transportation as requested. The total cost is within the specified budget of $9,500.", "gpt-4-1106-preview_direct_sole-planning_parsed_results": [{"day": 1, "current_city": "from Evansville to Texarkana, Texas", "transportation": "Self-driving, from Evansville to Texarkana, duration: 8 hours 45 mins, distance: 889 km", "breakfast": "-", "attraction": "-", "lunch": "-", "dinner": "-", "accommodation": "Large 2.5 BR Apt In Park Slope, Texarkana, Texas"}, {"day": 2, "current_city": "Texarkana, Texas", "transportation": "-", "breakfast": "Big City Bread Cafe, Texarkana, Texas", "attraction": "Museum of Regional History, Texarkana;Ace of Clubs House, Texarkana;", "lunch": "Columbia Restaurant, Texarkana, Texas", "dinner": "The Beer Cafe - BIGGIE, Texarkana, Texas", "accommodation": "Large 2.5 BR Apt In Park Slope, Texarkana, Texas"}, {"day": 3, "current_city": "from Texarkana, Texas to Longview, Texas", "transportation": "Self-driving, from Texarkana to Longview, duration: 1 hour 36 mins, distance: 142 km", "breakfast": "Bansiwala Rasoi, Texarkana, Texas", "attraction": "Longview World of Wonders, Longview;Gregg County Historical Museum, Longview;", "lunch": "Barbeque Nation, Longview, Texas", "dinner": "Apni Rasoi, Longview, Texas", "accommodation": "Newly renovated 2 bedroom with FREE WIFI, Longview, Texas"}, {"day": 4, "current_city": "Longview, Texas", "transportation": "-", "breakfast": "Monster's Cafe, Longview, Texas", "attraction": "Longview Museum of Fine Arts, Longview;Lear Park, Longview;", "lunch": "Sham Sweets, Longview, Texas", "dinner": "Momo Mia, Longview, Texas", "accommodation": "Newly renovated 2 bedroom with FREE WIFI, Longview, Texas"}, {"day": 5, "current_city": "from Longview, Texas to Evansville", "transportation": "Self-driving, from Longview to Evansville, duration: 10 hours 8 mins, distance: 1,045 km", "breakfast": "Apna Restaurant, Longview, Texas", "attraction": "-", "lunch": "-", "dinner": "-", "accommodation": "-"}]}]