[{"gpt-4-1106-preview_direct_sole-planning_results": "Travel Plan:\n\nDays: 1\nCurrent City: from Billings to Dallas, Texas\nTransportation: Flight Number F3606099, Price: $455, DepTime: 13:42, ArrTime: 17:08, ActualElapsedTime: 2 hours 26 minutes, FlightDate: 2022-03-25, OriginCityName: Billings, DestCityName: Dallas, Distance: 1081.0 km\nBreakfast: -\nAttraction: -\nLunch: -\nDinner: -\nAccommodation: *Fresh Budget Room, Dallas, Texas, price: $262, room type: Private room, house rules: No visitors & No smoking, minimum nights: 2, maximum occupancy: 1, review rate number: 4\n\nNumber of people: 1\nTotal cost: $455 (flight) + $262 (accommodation) = $717\nAccommodation minimum nights: 1/2\n\nDays: 2\nCurrent City: Dallas, Texas\nTransportation: -\nBreakfast: Drifters Cafe, Dallas, Texas, cost: $21, cuisines: Tea, French, Mexican, Cafe, Seafood\nAttraction: The Dallas World Aquarium; The Sixth Floor Museum at Dealey Plaza\nLunch: Coconuts Fish Cafe, Dallas, Texas, cost: $38, cuisines: Cafe, BBQ, Mediterranean, Fast Food\nDinner: Bikaner Sweets, Dallas, Texas, cost: $23, cuisines: Tea, French, Bakery, Cafe, Seafood\nAccommodation: *Fresh Budget Room, Dallas, Texas, price: $262, room type: Private room, house rules: No visitors & No smoking, minimum nights: 2, maximum occupancy: 1, review rate number: 4\n\nNumber of people: 1\nTotal cost: $21 (breakfast) + $38 (lunch) + $23 (dinner) + $262 (accommodation) = $344\nAccommodation minimum nights: 2/2\n\nDays: 3\nCurrent City: from Dallas to Longview, Texas\nTransportation: Self-driving, from Dallas to Longview, duration: 1 hour 56 mins, distance: 206 km, cost: $10\nBreakfast: -\nAttraction: Longview World of Wonders; Gregg County Historical Museum\nLunch: Barbeque Nation, Longview, Texas, cost: $26, cuisines: Cafe, Bakery\nDinner: Apna Restaurant, Longview, Texas, cost: $17, cuisines: American, BBQ, Fast Food\nAccommodation: Luxury STUDIO * PVT Entrance * WOW, Longview, Texas, price: $406, room type: Entire home/apt, house rules: No visitors, minimum nights: 1, maximum occupancy: 3, review rate number: 4\n\nNumber of people: 1\nTotal cost: $10 (transportation) + $26 (lunch) + $17 (dinner) + $406 (accommodation) = $459\nAccommodation minimum nights: 1/1\n\nDays: 4\nCurrent City: Longview, Texas\nTransportation: -\nBreakfast: Monster's Cafe, Longview, Texas, cost: $94, cuisines: Tea, Bakery, Fast Food, Cafe, American, Mediterranean\nAttraction: Longview Museum of Fine Arts; Lear Park\nLunch: Momo Mia, Longview, Texas, cost: $19, cuisines: Desserts, Pizza, French, BBQ, Chinese\nDinner: Not Just Paranthas, Longview, Texas, cost: $54, cuisines: Desserts, Bakery, BBQ, Seafood\nAccommodation: Luxury STUDIO * PVT Entrance * WOW, Longview, Texas, price: $406, room type: Entire home/apt, house rules: No visitors, minimum nights: 1, maximum occupancy: 3, review rate number: 4\n\nNumber of people: 1\nTotal cost: $94 (breakfast) + $19 (lunch) + $54 (dinner) + $406 (accommodation) = $573\nAccommodation minimum nights: 2/1\n\nDays: 5\nCurrent City: from Longview to Texarkana, Texas\nTransportation: Self-driving, from Longview to Texarkana, duration: 1 hour 36 mins, distance: 141 km, cost: $7\nBreakfast: -\nAttraction: Museum of Regional History; Spring Lake Park\nLunch: Big City Bread Cafe, Texarkana, Texas, cost: $61, cuisines: Cafe, Pizza, Bakery, BBQ\nDinner: Columbia Restaurant, Texarkana, Texas, cost: $91, cuisines: Desserts, Tea, Pizza, Indian, Seafood\nAccommodation: sunny airy bohemian rm, private bath! hip 'shwick, Texarkana, Texas, price: $592, room type: Private room, house rules: No smoking, minimum nights: 2, maximum occupancy: 2, review rate number: 4\n\nNumber of people: 1\nTotal cost: $7 (transportation) + $61 (lunch) + $91 (dinner) + $592 (accommodation) = $751\nAccommodation minimum nights: 1/2\n\nDays: 6\nCurrent City: Texarkana, Texas\nTransportation: -\nBreakfast: Poets Cafe, Texarkana, Texas, cost: $88, cuisines: Chinese, Bakery, Indian, Desserts\nAttraction: Ace of Clubs House; Discovery Place Interactive Museum\nLunch: The Beer Cafe - BIGGIE, Texarkana, Texas, cost: $13, cuisines: Cafe, Pizza, Mediterranean, Fast Food\nDinner: Granma's Homemade, Texarkana, Texas, cost: $57, cuisines: Tea, Mexican, Bakery, Cafe, Seafood\nAccommodation: sunny airy bohemian rm, private bath! hip 'shwick, Texarkana, Texas, price: $592, room type: Private room, house rules: No smoking, minimum nights: 2, maximum occupancy: 2, review rate number: 4\n\nNumber of people: 1\nTotal cost: $88 (breakfast) + $13 (lunch) + $57 (dinner) + $592 (accommodation) = $750\nAccommodation minimum nights: 2/2\n\nDays: 7\nCurrent City: from Texarkana to Billings\nTransportation: Self-driving, from Texarkana to Billings, duration: 21 hours 43 mins, distance: 2,434 km, cost: $121\nBreakfast: -\nAttraction: -\nLunch: -\nDinner: -\nAccommodation: -\n\nNumber of people: 1\nTotal cost: $121 (transportation)\n\nTotal cost across all days: $717 + $344 + $459 + $573 + $751 + $750 + $121 = $3,715\n\nRemaining budget: $8,500 - $3,715 = $4,785\n\nCuisines: All cuisine constraints are satisfied based on the available information.\nAccommodation: All accommodations are private rooms or entire homes, adhering to the \"not shared room\" constraint.\nTransportation: All transportation modes are valid and meet the constraints specified in the query. No prohibited transportation types such as flights were used where not available.\nAttractions: No attraction is repeated on different days.\nRestaurants: No restaurant name is repeated for breakfast, lunch, or dinner across the days.", "gpt-4-1106-preview_direct_sole-planning_parsed_results": [{"day": 1, "current_city": "from Billings to Dallas", "transportation": "Flight Number: F3606099, from Billings to Dallas, Departure Time: 13:42, Arrival Time: 17:08", "breakfast": "-", "attraction": "-", "lunch": "-", "dinner": "-", "accommodation": "Fresh Budget Room, Dallas"}, {"day": 2, "current_city": "Dallas", "transportation": "-", "breakfast": "Drifters Cafe, Dallas", "attraction": "The Dallas World Aquarium, Dallas;The Sixth Floor Museum at Dealey Plaza, Dallas;", "lunch": "Coconuts Fish Cafe, Dallas", "dinner": "Bikaner Sweets, Dallas", "accommodation": "Fresh Budget Room, Dallas"}, {"day": 3, "current_city": "from Dallas to Longview", "transportation": "Self-driving, from Dallas to Longview, duration: 1 hour 56 mins", "breakfast": "-", "attraction": "Longview World of Wonders, Longview;Gregg County Historical Museum, Longview;", "lunch": "Barbeque Nation, Longview", "dinner": "Apna Restaurant, Longview", "accommodation": "Luxury STUDIO PVT Entrance WOW, Longview"}, {"day": 4, "current_city": "Longview", "transportation": "-", "breakfast": "Monster's Cafe, Longview", "attraction": "Longview Museum of Fine Arts, Longview;Lear Park, Longview;", "lunch": "Momo Mia, Longview", "dinner": "Not Just Paranthas, Longview", "accommodation": "Luxury STUDIO PVT Entrance WOW, Longview"}, {"day": 5, "current_city": "from Longview to Texarkana", "transportation": "Self-driving, from Longview to Texarkana, duration: 1 hour 36 mins", "breakfast": "-", "attraction": "Museum of Regional History, Texarkana;Spring Lake Park, Texarkana;", "lunch": "Big City Bread Cafe, Texarkana", "dinner": "Columbia Restaurant, Texarkana", "accommodation": "sunny airy bohemian rm private bath hip 'shwick, Texarkana"}, {"day": 6, "current_city": "Texarkana", "transportation": "-", "breakfast": "Poets Cafe, Texarkana", "attraction": "Ace of Clubs House, Texarkana;Discovery Place Interactive Museum, Texarkana;", "lunch": "The Beer Cafe - BIGGIE, Texarkana", "dinner": "Granma's Homemade, Texarkana", "accommodation": "sunny airy bohemian rm private bath hip 'shwick, Texarkana"}, {"day": 7, "current_city": "from Texarkana to Billings", "transportation": "Self-driving, from Texarkana to Billings, duration: 21 hours 43 mins", "breakfast": "-", "attraction": "-", "lunch": "-", "dinner": "-", "accommodation": "-"}]}]