[{"gpt-4-1106-preview_direct_sole-planning_results": "Travel Plan:\n\nDays: 1\nCurrent City: from Chicago to Wilmington, North Carolina\nTransportation: Self-driving, from Chicago to Wilmington, duration: 14 hours 11 mins, distance: 1,505 km, cost: 75\nBreakfast: -\nAttraction: -\nLunch: -\nDinner: -\nAccommodation: Prime East Village location w/backyard garden!, Wilmington, North Carolina, cost: 978, room type: Entire home/apt, house rules: No pets & No smoking, minimum nights: 4, maximum occupancy: 7\n\nNumber of people: 2\nTotal cost: 75 x 2 + 978 x 1 = 1128\nAccommodation minimum nights: 1/4\n\nDays: 2\nCurrent City: Wilmington, North Carolina\nTransportation: -\nBreakfast: Azteca, Wilmington, North Carolina, cost: 56, cuisines: Cafe, Indian, BBQ\nAttraction: Bellamy Mansion Museum, Wilmington; Wilmington Riverwalk, Wilmington\nLunch: Bandit Burrito, Wilmington, North Carolina, cost: 26, cuisines: Desserts, French, Bakery, Fast Food, Seafood\nDinner: Taco Bus, Wilmington, North Carolina, cost: 59, cuisines: Tea, Cafe, BBQ\nAccommodation: Prime East Village location w/backyard garden!, Wilmington, North Carolina, cost: 978, room type: Entire home/apt, house rules: No pets & No smoking, minimum nights: 4, maximum occupancy: 7\n\nNumber of people: 2\nTotal cost: (56 + 26 + 59) x 2 + 978 x 1 = 1174\nAccommodation minimum nights: 2/4\n\nDays: 3\nCurrent City: from Wilmington to Charlotte, North Carolina\nTransportation: Self-driving, from Wilmington to Charlotte, duration: 3 hours 24 mins, distance: 324 km, cost: 16\nBreakfast: Dunkin' Donuts, Wilmington, North Carolina, cost: 25, cuisines: Desserts, Tea, Pizza, Italian, French\nAttraction: Freedom Park, Charlotte; Levine Museum of the New South, Charlotte\nLunch: Olive Tree Cafe, Charlotte, North Carolina, cost: 23, cuisines: Tea, Chinese, Desserts\nDinner: Central Perk 7, Charlotte, North Carolina, cost: 87, cuisines: Pizza, Bakery, BBQ, Fast Food\nAccommodation: Elegant Studio Apt in Prospect Heights, Charlotte, North Carolina, cost: 640, room type: Entire home/apt, house rules: No parties, minimum nights: 2, maximum occupancy: 5\n\nNumber of people: 2\nTotal cost: 16 x 2 + (25 + 23 + 87) x 2 + 640 x 1 = 944\nAccommodation minimum nights: 1/2\n\nDays: 4\nCurrent City: Charlotte, North Carolina\nTransportation: -\nBreakfast: Subway, Charlotte, North Carolina, cost: 60, cuisines: Tea, Cafe, Mexican, Chinese, Seafood\nAttraction: Discovery Place Science, Charlotte; NASCAR Hall of Fame, Charlotte\nLunch: China Garden, Charlotte, North Carolina, cost: 14, cuisines: Tea, Mexican, BBQ, Mediterranean\nDinner: Kylin Skybar, Charlotte, North Carolina, cost: 44, cuisines: Tea, Cafe, Pizza, Italian\nAccommodation: Elegant Studio Apt in Prospect Heights, Charlotte, North Carolina, cost: 640, room type: Entire home/apt, house rules: No parties, minimum nights: 2, maximum occupancy: 5\n\nNumber of people: 2\nTotal cost: (60 + 14 + 44) x 2 + 640 x 1 = 912\nAccommodation minimum nights: 2/2\n\nDays: 5\nCurrent City: from Charlotte to Chicago\nTransportation: Self-driving, from Charlotte to Chicago, duration: 11 hours 39 mins, distance: 1,215 km, cost: 60\nBreakfast: -\nAttraction: -\nLunch: -\nDinner: -\nAccommodation: -\n\nNumber of people: 2\nTotal cost: 60 x 2 = 120\n\nTotal cost across all days: 1128 + 1174 + 944 + 912 + 120 = 4278\n\nUnfortunately, the total cost exceeds the specified budget of $3,600. Adjustments need to be made to the plan to reduce costs. This could include finding more affordable accommodations or reducing meal costs. However, given the constraints and the provided data, it is not possible to create a plan that fits the budget and meets all requirements.", "gpt-4-1106-preview_direct_sole-planning_parsed_results": [{"day": 1, "current_city": "from Chicago to Wilmington, North Carolina", "transportation": "Self-driving, from Chicago to Wilmington, duration: 14 hours 11 mins, distance: 1,505 km", "breakfast": "-", "attraction": "-", "lunch": "-", "dinner": "-", "accommodation": "Prime East Village location w/backyard garden!, Wilmington, North Carolina"}, {"day": 2, "current_city": "Wilmington, North Carolina", "transportation": "-", "breakfast": "Azteca, Wilmington, North Carolina", "attraction": "Bellamy Mansion Museum, Wilmington; Wilmington Riverwalk, Wilmington;", "lunch": "Bandit Burrito, Wilmington, North Carolina", "dinner": "Taco Bus, Wilmington, North Carolina", "accommodation": "Prime East Village location w/backyard garden!, Wilmington, North Carolina"}, {"day": 3, "current_city": "from Wilmington to Charlotte, North Carolina", "transportation": "Self-driving, from Wilmington to Charlotte, duration: 3 hours 24 mins, distance: 324 km", "breakfast": "Dunkin' Donuts, Wilmington, North Carolina", "attraction": "Freedom Park, Charlotte; Levine Museum of the New South, Charlotte;", "lunch": "Olive Tree Cafe, Charlotte, North Carolina", "dinner": "Central Perk 7, Charlotte, North Carolina", "accommodation": "Elegant Studio Apt in Prospect Heights, Charlotte, North Carolina"}, {"day": 4, "current_city": "Charlotte, North Carolina", "transportation": "-", "breakfast": "Subway, Charlotte, North Carolina", "attraction": "Discovery Place Science, Charlotte; NASCAR Hall of Fame, Charlotte;", "lunch": "China Garden, Charlotte, North Carolina", "dinner": "Kylin Skybar, Charlotte, North Carolina", "accommodation": "Elegant Studio Apt in Prospect Heights, Charlotte, North Carolina"}, {"day": 5, "current_city": "from Charlotte to Chicago", "transportation": "Self-driving, from Charlotte to Chicago, duration: 11 hours 39 mins, distance: 1,215 km", "breakfast": "-", "attraction": "-", "lunch": "-", "dinner": "-", "accommodation": "-"}]}]