[{"gpt-4-1106-preview_direct_sole-planning_results": "Travel Plan:\n\nDays: 1\nCurrent City: from Wichita to Alamosa, Colorado\nTransportation: Self-driving, from Wichita to Alamosa, duration: 8 hours 27 mins, distance: 819 km, cost: 40\nBreakfast: -\nAttraction: -\nLunch: -\nDinner: -\nAccommodation: Comfortable studio suite in midtown Manhattan, Alamosa, Colorado, cost: 67, maximum occupancy: 2, house rules: No parties & No smoking & No visitors, minimum nights: 30\n\nNumber of people: 1\nTotal cost: 40 x 1 + 67 x 1 = 107\nAccommodation minimum nights: 1/30\n\nDays: 2\nCurrent City: Alamosa, Colorado\nTransportation: -\nBreakfast: Atlanta Highway Seafood Market, Alamosa, Colorado, cost: 68, cuisines: Fast Food, Desserts, Seafood\nAttraction: San Luis Valley Museum, Alamosa; Rio Grande Farm Park, Alamosa\nLunch: Riverwalk Cafe, Alamosa, Colorado, cost: 97, cuisines: Tea, Pizza, Fast Food\nDinner: Viva Hyderabad, Alamosa, Colorado, cost: 90, cuisines: Pizza, Desserts\nAccommodation: Comfortable studio suite in midtown Manhattan, Alamosa, Colorado, cost: 67, maximum occupancy: 2, house rules: No parties & No smoking & No visitors, minimum nights: 30\n\nNumber of people: 1\nTotal cost: 68 x 1 + 97 x 1 + 90 x 1 + 67 x 1 = 322\nAccommodation minimum nights: 2/30\n\nDays: 3\nCurrent City: from Alamosa to Grand Junction, Colorado\nTransportation: Self-driving, from Alamosa to Grand Junction, duration: 4 hours 29 mins, distance: 396 km, cost: 19\nBreakfast: Coffee to Cocktail Bar - Hyatt Place, Alamosa, Colorado, cost: 35, cuisines: Tea, Indian, Desserts, Italian\nAttraction: Museum of the West, Grand Junction; Eureka! McConnell Science Museum, Grand Junction\nLunch: Austin's BBQ and Oyster Bar, Grand Junction, Colorado, cost: 15, cuisines: Tea, Bakery, Fast Food, Indian, Seafood\nDinner: 2 Dog, Grand Junction, Colorado, cost: 29, cuisines: Desserts, BBQ, Fast Food, Cafe, American\nAccommodation: NYC Apartment near Central Park!, Grand Junction, Colorado, cost: 1118, maximum occupancy: 5, house rules: No children under 10, minimum nights: 3\n\nNumber of people: 1\nTotal cost: 19 x 1 + 35 x 1 + 15 x 1 + 29 x 1 + 1118 x 1 = 1216\nAccommodation minimum nights: 1/3\n\nDays: 4\nCurrent City: Grand Junction, Colorado\nTransportation: -\nBreakfast: Thakur Bakers, Grand Junction, Colorado, cost: 100, cuisines: French, Pizza, Cafe, BBQ\nAttraction: Bananas Fun Park, Grand Junction; Western Colorado Botanical Gardens, Grand Junction\nLunch: Shanghai Bar & Lounge - The Bristol Hotel, Grand Junction, Colorado, cost: 31, cuisines: Cafe, Pizza\nDinner: Pind Balluchi, Grand Junction, Colorado, cost: 17, cuisines: Fast Food, Chinese, Seafood\nAccommodation: NYC Apartment near Central Park!, Grand Junction, Colorado, cost: 1118, maximum occupancy: 5, house rules: No children under 10, minimum nights: 3\n\nNumber of people: 1\nTotal cost: 100 x 1 + 31 x 1 + 17 x 1 + 1118 x 1 = 1266\nAccommodation minimum nights: 2/3\n\nDays: 5\nCurrent City: from Grand Junction to Durango, Colorado\nTransportation: Self-driving, from Grand Junction to Durango, duration: 3 hours 33 mins, distance: 269 km, cost: 13\nBreakfast: Cocoa Tree, Grand Junction, Colorado, cost: 68, cuisines: Tea, Chinese, Cafe, Fast Food\nAttraction: Animas Museum, Durango; The Powerhouse, Durango\nLunch: Samurai Japanese Cuisine & Sushi Bar, Durango, Colorado, cost: 67, cuisines: Bakery, Desserts, Fast Food\nDinner: Dub's High on the Hog, Durango, Colorado, cost: 98, cuisines: Tea, Italian, French, Cafe, Seafood\nAccommodation: Lux 1BR in the heart of NYC Theater district!, Durango, Colorado, cost: 81, maximum occupancy: 3, house rules: No children under 10, minimum nights: 30\n\nNumber of people: 1\nTotal cost: 13 x 1 + 68 x 1 + 67 x 1 + 98 x 1 + 81 x 1 = 327\nAccommodation minimum nights: 1/30\n\nDays: 6\nCurrent City: Durango, Colorado\nTransportation: -\nBreakfast: Standard Chicken Point, Durango, Colorado, cost: 50, cuisines: Mexican, Indian, BBQ, Seafood\nAttraction: Durango Wildlife Museum, Durango; Whitewater Park, Durango\nLunch: Hot & Tasty Chinese Food, Durango, Colorado, cost: 17, cuisines: Tea, French, Fast Food\nDinner: Chickenette, Durango, Colorado, cost: 31, cuisines: Tea, Pizza, Desserts, Fast Food\nAccommodation: Lux 1BR in the heart of NYC Theater district!, Durango, Colorado, cost: 81, maximum occupancy: 3, house rules: No children under 10, minimum nights: 30\n\nNumber of people: 1\nTotal cost: 50 x 1 + 17 x 1 + 31 x 1 + 81 x 1 = 179\nAccommodation minimum nights: 2/30\n\nDays: 7\nCurrent City: from Durango to Wichita\nTransportation: Self-driving, from Durango to Wichita, duration: 11 hours 15 mins, distance: 1,078 km, cost: 53\nBreakfast: Burger King, Durango, Colorado, cost: 11, cuisines: Desserts, Mexican, Bakery, BBQ, Fast Food\nAttraction: -\nLunch: -\nDinner: -\nAccommodation: -\n\nNumber of people: 1\nTotal cost: 53 x 1 + 11 x 1 = 64\n\nTotal cost across all days: 107 + 322 + 1216 + 1266 + 327 + 179 + 64 = 3481\n\nCuisines: The prompt specifies no cuisines, so all cuisine constraints are satisfied", "gpt-4-1106-preview_direct_sole-planning_parsed_results": [{"day": 1, "current_city": "from Wichita to Alamosa, Colorado", "transportation": "Self-driving, from Wichita to Alamosa, duration: 8 hours 27 mins, distance: 819 km", "breakfast": "-", "attraction": "-", "lunch": "-", "dinner": "-", "accommodation": "Comfortable studio suite in midtown Manhattan, Alamosa, Colorado"}, {"day": 2, "current_city": "Alamosa, Colorado", "transportation": "-", "breakfast": "Atlanta Highway Seafood Market, Alamosa, Colorado", "attraction": "San Luis Valley Museum, Alamosa;Rio Grande Farm Park, Alamosa;", "lunch": "Riverwalk Cafe, Alamosa, Colorado", "dinner": "Viva Hyderabad, Alamosa, Colorado", "accommodation": "Comfortable studio suite in midtown Manhattan, Alamosa, Colorado"}, {"day": 3, "current_city": "from Alamosa to Grand Junction, Colorado", "transportation": "Self-driving, from Alamosa to Grand Junction, duration: 4 hours 29 mins, distance: 396 km", "breakfast": "Coffee to Cocktail Bar - Hyatt Place, Alamosa, Colorado", "attraction": "Museum of the West, Grand Junction;Eureka! McConnell Science Museum, Grand Junction;", "lunch": "Austin's BBQ and Oyster Bar, Grand Junction, Colorado", "dinner": "2 Dog, Grand Junction, Colorado", "accommodation": "NYC Apartment near Central Park!, Grand Junction, Colorado"}, {"day": 4, "current_city": "Grand Junction, Colorado", "transportation": "-", "breakfast": "Thakur Bakers, Grand Junction, Colorado", "attraction": "Bananas Fun Park, Grand Junction;Western Colorado Botanical Gardens, Grand Junction;", "lunch": "Shanghai Bar & Lounge - The Bristol Hotel, Grand Junction, Colorado", "dinner": "Pind Balluchi, Grand Junction, Colorado", "accommodation": "NYC Apartment near Central Park!, Grand Junction, Colorado"}, {"day": 5, "current_city": "from Grand Junction to Durango, Colorado", "transportation": "Self-driving, from Grand Junction to Durango, duration: 3 hours 33 mins, distance: 269 km", "breakfast": "Cocoa Tree, Grand Junction, Colorado", "attraction": "Animas Museum, Durango;The Powerhouse, Durango;", "lunch": "Samurai Japanese Cuisine & Sushi Bar, Durango, Colorado", "dinner": "Dub's High on the Hog, Durango, Colorado", "accommodation": "Lux 1BR in the heart of NYC Theater district!, Durango, Colorado"}, {"day": 6, "current_city": "Durango, Colorado", "transportation": "-", "breakfast": "Standard Chicken Point, Durango, Colorado", "attraction": "Durango Wildlife Museum, Durango;Whitewater Park, Durango;", "lunch": "Hot & Tasty Chinese Food, Durango, Colorado", "dinner": "Chickenette, Durango, Colorado", "accommodation": "Lux 1BR in the heart of NYC Theater district!, Durango, Colorado"}, {"day": 7, "current_city": "from Durango to Wichita", "transportation": "Self-driving, from Durango to Wichita, duration: 11 hours 15 mins, distance: 1,078 km", "breakfast": "Burger King, Durango, Colorado", "attraction": "-", "lunch": "-", "dinner": "-", "accommodation": "-"}]}]