[{"gpt-4-1106-preview_direct_sole-planning_results": "Travel Plan:\n\nDays: 1\nCurrent City: from St. Louis to Orlando, Florida\nTransportation: Flight F4003646, from St. Louis to Orlando, duration: 2 hours 12 minutes, cost: 298\nBreakfast: -\nAttraction: -\nLunch: -\nDinner: Fuji Japanese Steakhouse, Orlando, Florida, cost: 75, cuisines: Tea, Bakery, Desserts\nAccommodation: Sixth Ave Chelsea, Studio Serviced Apartment, Orlando, Florida, cost: 70, maximum occupancy: 3, house rules: No visitors & No pets, minimum nights: 30\n\nNumber of people: 1\nTotal cost: 298 x 1 + 75 x 1 + 70 x 1 = 443\nAccommodation minimum nights: 1/30\n\nDays: 2\nCurrent City: Orlando, Florida\nTransportation: -\nBreakfast: Turquoise Villa, Orlando, Florida, cost: 55, cuisines: French, Bakery, BBQ, Fast Food\nAttraction: The Wheel at ICON Park, Orlando; SeaWorld Orlando, Orlando\nLunch: The Tandoori Times, Orlando, Florida, cost: 84, cuisines: Tea, Cafe, BBQ, Italian\nDinner: Indochi Cafe & Restaurant, Orlando, Florida, cost: 72, cuisines: Pizza, French, Bakery, Fast Food, Indian, Seafood\nAccommodation: Sixth Ave Chelsea, Studio Serviced Apartment, Orlando, Florida, cost: 70, maximum occupancy: 3, house rules: No visitors & No pets, minimum nights: 30\n\nNumber of people: 1\nTotal cost: 55 x 1 + 84 x 1 + 72 x 1 + 70 x 1 = 281\nAccommodation minimum nights: 2/30\n\nDays: 3\nCurrent City: from Orlando to Fort Myers, Florida\nTransportation: Self-driving, from Orlando to Fort Myers, duration: 2 hours 58 mins, distance: 255 km, cost: 12\nBreakfast: Bite N Sip, Orlando, Florida, cost: 76, cuisines: Chinese, Bakery, Cafe, Fast Food\nAttraction: Edison & Ford Winter Estates, Fort Myers; Six Mile Cypress Slough Preserve, Fort Myers\nLunch: The Refinery, Fort Myers, Florida, cost: 22, cuisines: Bakery, Indian, Seafood\nDinner: Al Mukhtar Bakery, Fort Myers, Florida, cost: 54, cuisines: BBQ, Tea, American, Desserts\nAccommodation: Great room in Greenwich Village!, Fort Myers, Florida, cost: 133, maximum occupancy: 1, house rules: No visitors, minimum nights: 1\n\nNumber of people: 1\nTotal cost: 12 x 1 + 76 x 1 + 22 x 1 + 54 x 1 + 133 x 1 = 297\nAccommodation minimum nights: 1/1\n\nDays: 4\nCurrent City: Fort Myers, Florida\nTransportation: -\nBreakfast: Haunted, Fort Myers, Florida, cost: 50, cuisines: Desserts, French, Fast Food, Cafe, Seafood\nAttraction: Manatee Park, Fort Myers; Calusa Nature Center & Planetarium, Fort Myers\nLunch: Eggers Madhouse, Fort Myers, Florida, cost: 76, cuisines: BBQ, Mediterranean, Seafood\nDinner: Maachh Bhaat, Fort Myers, Florida, cost: 66, cuisines: Desserts, Pizza, Fast Food, Mediterranean, Seafood\nAccommodation: Great room in Greenwich Village!, Fort Myers, Florida, cost: 133, maximum occupancy: 1, house rules: No visitors, minimum nights: 1\n\nNumber of people: 1\nTotal cost: 50 x 1 + 76 x 1 + 66 x 1 + 133 x 1 = 325\nAccommodation minimum nights: 2/1\n\nDays: 5\nCurrent City: from Fort Myers to St. Louis\nTransportation: Flight F3951040, from Fort Myers to St. Louis, duration: 2 hours 35 minutes, cost: 236\nBreakfast: Kujay's Spoon, Fort Myers, Florida, cost: 88, cuisines: Pizza, Mexican, Bakery, Cafe, Mediterranean, Seafood\nAttraction: -\nLunch: -\nDinner: -\nAccommodation: -\n\nNumber of people: 1\nTotal cost: 236 x 1 + 88 x 1 = 324\n\nTotal cost across all days: 443 + 281 + 297 + 325 + 324 = 1,670\nCuisines: The prompt specifies no cuisines, so all cuisine constraints are satisfied\n\nNote: The accommodation on Day 1 and Day 2 has a minimum stay of 30 nights, which is not suitable for this itinerary. However, due to the lack of provided alternatives, it has been included to maintain the format. Adjustments should be made to find suitable accommodation that meets the minimum night stay requirement.", "gpt-4-1106-preview_direct_sole-planning_parsed_results": [{"day": 1, "current_city": "from St. Louis to Orlando, Florida", "transportation": "Flight Number: F4003646, from St. Louis to Orlando, Departure Time: -, Arrival Time: -", "breakfast": "-", "attraction": "-", "lunch": "-", "dinner": "Fuji Japanese Steakhouse, Orlando, Florida", "accommodation": "Sixth Ave Chelsea, Studio Serviced Apartment, Orlando, Florida"}, {"day": 2, "current_city": "Orlando, Florida", "transportation": "-", "breakfast": "Turquoise Villa, Orlando, Florida", "attraction": "The Wheel at ICON Park, Orlando;SeaWorld Orlando, Orlando;", "lunch": "The Tandoori Times, Orlando, Florida", "dinner": "Indochi Cafe & Restaurant, Orlando, Florida", "accommodation": "Sixth Ave Chelsea, Studio Serviced Apartment, Orlando, Florida"}, {"day": 3, "current_city": "from Orlando to Fort Myers, Florida", "transportation": "Self-driving, from Orlando to Fort Myers, Departure Time: -, Arrival Time: -", "breakfast": "Bite N Sip, Orlando, Florida", "attraction": "Edison & Ford Winter Estates, Fort Myers;Six Mile Cypress Slough Preserve, Fort Myers;", "lunch": "The Refinery, Fort Myers, Florida", "dinner": "Al Mukhtar Bakery, Fort Myers, Florida", "accommodation": "Great room in Greenwich Village!, Fort Myers, Florida"}, {"day": 4, "current_city": "Fort Myers, Florida", "transportation": "-", "breakfast": "Haunted, Fort Myers, Florida", "attraction": "Manatee Park, Fort Myers;Calusa Nature Center & Planetarium, Fort Myers;", "lunch": "Eggers Madhouse, Fort Myers, Florida", "dinner": "Maachh Bhaat, Fort Myers, Florida", "accommodation": "Great room in Greenwich Village!, Fort Myers, Florida"}, {"day": 5, "current_city": "from Fort Myers to St. Louis", "transportation": "Flight Number: F3951040, from Fort Myers to St. Louis, Departure Time: -, Arrival Time: -", "breakfast": "Kujay's Spoon, Fort Myers, Florida", "attraction": "-", "lunch": "-", "dinner": "-", "accommodation": "-"}]}]