[{"gpt-4-1106-preview_direct_sole-planning_results": "Travel Plan:\n\nDays: 1\nCurrent City: from Devils Lake to Alamosa, Colorado\nTransportation: Self-driving, from Devils Lake to Alamosa, duration: 17 hours 26 mins, distance: 1,811 km, cost: 90\nBreakfast: -\nAttraction: -\nLunch: -\nDinner: -\nAccommodation: Comfortable studio suite in midtown Manhattan, Alamosa, Colorado, cost: 67, maximum occupancy: 2, house rules: No parties & No smoking & No visitors, minimum nights: 30\n\nNumber of people: 1\nTotal cost: 90 x 1 + 67 x 1 = 157\nAccommodation minimum nights: 1/30\n\nDays: 2\nCurrent City: Alamosa, Colorado\nTransportation: -\nBreakfast: Coffee to Cocktail Bar - Hyatt Place, Alamosa, Colorado, cost: 35, cuisines: Tea, Indian, Desserts, Italian\nAttraction: San Luis Valley Museum | Alamosa; Rio Grande Farm Park, Alamosa\nLunch: Atlanta Highway Seafood Market, Alamosa, Colorado, cost: 68, cuisines: Fast Food, Desserts, Seafood\nDinner: Riverwalk Cafe, Alamosa, Colorado, cost: 97, cuisines: Tea, Pizza, Fast Food\nAccommodation: Comfortable studio suite in midtown Manhattan, Alamosa, Colorado, cost: 67, maximum occupancy: 2, house rules: No parties & No smoking & No visitors, minimum nights: 30\n\nNumber of people: 1\nTotal cost: 35 x 1 + 68 x 1 + 97 x 1 + 67 x 1 = 267\nAccommodation minimum nights: 2/30\n\nDays: 3\nCurrent City: from Alamosa to Grand Junction, Colorado\nTransportation: Self-driving, from Alamosa to Grand Junction, duration: 4 hours 29 mins, distance: 396 km, cost: 19\nBreakfast: Cafe LazyMojo, Alamosa, Colorado, cost: 26, cuisines: Tea, Pizza, American, Fast Food\nAttraction: Museum of the West, Museums of Western Colorado; Eureka! McConnell Science Museum, Grand Junction\nLunch: Austin's BBQ and Oyster Bar, Grand Junction, Colorado, cost: 15, cuisines: Tea, Bakery, Fast Food, Indian, Seafood\nDinner: 2 Dog, Grand Junction, Colorado, cost: 29, cuisines: Desserts, BBQ, Fast Food, Cafe, American\nAccommodation: NYC Apartment near Central Park!, Grand Junction, Colorado, cost: 1118, maximum occupancy: 5, house rules: No children under 10, minimum nights: 3\n\nNumber of people: 1\nTotal cost: 19 x 1 + 26 x 1 + 15 x 1 + 29 x 1 + 1118 x 1 = 1207\nAccommodation minimum nights: 1/3\n\nDays: 4\nCurrent City: Grand Junction, Colorado\nTransportation: -\nBreakfast: Shanghai Bar & Lounge - The Bristol Hotel, Grand Junction, Colorado, cost: 31, cuisines: Cafe, Pizza\nAttraction: Western Colorado Botanical Gardens; Canyon View Park, Grand Junction\nLunch: Punjab Da Pind, Grand Junction, Colorado, cost: 52, cuisines: Desserts, Pizza, Bakery, Chinese, Mediterranean, Seafood\nDinner: Penta Cafe, Grand Junction, Colorado, cost: 66, cuisines: French, Mexican, BBQ, Seafood\nAccommodation: NYC Apartment near Central Park!, Grand Junction, Colorado, cost: 1118, maximum occupancy: 5, house rules: No children under 10, minimum nights: 3\n\nNumber of people: 1\nTotal cost: 31 x 1 + 52 x 1 + 66 x 1 + 1118 x 1 = 1267\nAccommodation minimum nights: 2/3\n\nDays: 5\nCurrent City: from Grand Junction to Gunnison, Colorado\nTransportation: Self-driving, from Grand Junction to Gunnison, duration: 2 hours 27 mins, distance: 200 km, cost: 10\nBreakfast: Cocoa Tree, Grand Junction, Colorado, cost: 68, cuisines: Tea, Chinese, Cafe, Fast Food\nAttraction: Gunnison Pioneer Museum; Gunnison Valley Observatory, Gunnison\nLunch: Happy Joe's Pizza & Ice Cream, Gunnison, Colorado, cost: 74, cuisines: Desserts, Italian, Bakery, Indian, Seafood\nDinner: SALT, Gunnison, Colorado, cost: 44, cuisines: Tea, Chinese, BBQ\nAccommodation: Full-size loft bed in East Village, Gunnison, Colorado, cost: 104, maximum occupancy: 1, house rules: No visitors & No pets & No parties, minimum nights: 1\n\nNumber of people: 1\nTotal cost: 10 x 1 + 68 x 1 + 74 x 1 + 44 x 1 + 104 x 1 = 300\nAccommodation minimum nights: 1/1\n\nDays: 6\nCurrent City: Gunnison, Colorado\nTransportation: -\nBreakfast: Mocha, Gunnison, Colorado, cost: 30, cuisines: Tea, Cafe, Pizza, BBQ\nAttraction: Hartman Rocks; Black Canyon of the Gunnison National Park, Gunnison\nLunch: Cyber Hub Social, Gunnison, Colorado, cost: 95, cuisines: Tea, Fast Food\nDinner: Game of Legends - Sports Bar, Grill, & Lounge, Gunnison, Colorado, cost: 65, cuisines: Tea, Pizza, Desserts\nAccommodation: Full-size loft bed in East Village, Gunnison, Colorado, cost: 104, maximum occupancy: 1, house rules: No visitors & No pets & No parties, minimum nights: 1\n\nNumber of people: 1\nTotal cost: 30 x 1 + 95 x 1 + 65 x 1 + 104 x 1 = 294\nAccommodation minimum nights: 2/1\n\nDays: 7\nCurrent City: from Gunnison to Devils Lake\nTransportation: Self-driving, from Gunnison to Devils Lake, duration: 17 hours 30 mins, distance: 1,881 km, cost: 94\nBreakfast: -\nAttraction: -\nLunch: -\nDinner: -\nAccommodation: -\n\nNumber of people: 1\nTotal cost: 94 x 1 = 94\n\nTotal cost across all days: 157 + 267 + 1207 + 1267 + 300 + 294 + 94 = 3586\n\nNote: The total cost exceeds the budget by $86. Adjustments to the accommodation or dining options may be necessary to stay within budget. Additionally, the accommodation in Alamosa has a minimum stay of 30 nights, which is not suitable for this itinerary. A different accommodation option should be selected to meet the travel plan requirements.", "gpt-4-1106-preview_direct_sole-planning_parsed_results": [{"day": 1, "current_city": "from Devils Lake to Alamosa, Colorado", "transportation": "Self-driving, from Devils Lake to Alamosa, duration: 17 hours 26 mins, distance: 1,811 km", "breakfast": "-", "attraction": "-", "lunch": "-", "dinner": "-", "accommodation": "Comfortable studio suite in midtown Manhattan, Alamosa, Colorado"}, {"day": 2, "current_city": "Alamosa, Colorado", "transportation": "-", "breakfast": "Coffee to Cocktail Bar - Hyatt Place, Alamosa, Colorado", "attraction": "San Luis Valley Museum, Alamosa;Rio Grande Farm Park, Alamosa;", "lunch": "Atlanta Highway Seafood Market, Alamosa, Colorado", "dinner": "Riverwalk Cafe, Alamosa, Colorado", "accommodation": "Comfortable studio suite in midtown Manhattan, Alamosa, Colorado"}, {"day": 3, "current_city": "from Alamosa to Grand Junction, Colorado", "transportation": "Self-driving, from Alamosa to Grand Junction, duration: 4 hours 29 mins, distance: 396 km", "breakfast": "Cafe LazyMojo, Alamosa, Colorado", "attraction": "Museum of the West, Grand Junction;Eureka! McConnell Science Museum, Grand Junction;", "lunch": "Austin's BBQ and Oyster Bar, Grand Junction, Colorado", "dinner": "2 Dog, Grand Junction, Colorado", "accommodation": "NYC Apartment near Central Park!, Grand Junction, Colorado"}, {"day": 4, "current_city": "Grand Junction, Colorado", "transportation": "-", "breakfast": "Shanghai Bar & Lounge - The Bristol Hotel, Grand Junction, Colorado", "attraction": "Western Colorado Botanical Gardens, Grand Junction;Canyon View Park, Grand Junction;", "lunch": "Punjab Da Pind, Grand Junction, Colorado", "dinner": "Penta Cafe, Grand Junction, Colorado", "accommodation": "NYC Apartment near Central Park!, Grand Junction, Colorado"}, {"day": 5, "current_city": "from Grand Junction to Gunnison, Colorado", "transportation": "Self-driving, from Grand Junction to Gunnison, duration: 2 hours 27 mins, distance: 200 km", "breakfast": "Cocoa Tree, Grand Junction, Colorado", "attraction": "Gunnison Pioneer Museum, Gunnison;Gunnison Valley Observatory, Gunnison;", "lunch": "Happy Joe's Pizza & Ice Cream, Gunnison, Colorado", "dinner": "SALT, Gunnison, Colorado", "accommodation": "Full-size loft bed in East Village, Gunnison, Colorado"}, {"day": 6, "current_city": "Gunnison, Colorado", "transportation": "-", "breakfast": "Mocha, Gunnison, Colorado", "attraction": "Hartman Rocks, Gunnison;Black Canyon of the Gunnison National Park, Gunnison;", "lunch": "Cyber Hub Social, Gunnison, Colorado", "dinner": "Game of Legends - Sports Bar, Grill, & Lounge, Gunnison, Colorado", "accommodation": "Full-size loft bed in East Village, Gunnison, Colorado"}, {"day": 7, "current_city": "from Gunnison to Devils Lake", "transportation": "Self-driving, from Gunnison to Devils Lake, duration: 17 hours 30 mins, distance: 1,881 km", "breakfast": "-", "attraction": "-", "lunch": "-", "dinner": "-", "accommodation": "-"}]}]