[{"gpt-4-1106-preview_direct_sole-planning_results": "Travel Plan:\n\nDays: 1\nCurrent City: from Albuquerque to Houston, Texas\nTransportation: Self-driving, from Albuquerque to Houston, duration: 12 hours 51 mins, distance: 1,422 km, cost: 71\nBreakfast: -\nAttraction: -\nLunch: -\nDinner: -\nAccommodation: Sunny and Airy near Manhattan, Houston, Texas, cost: 499, room type: Entire home/apt, house rules: Smoking allowed, minimum nights: 2, maximum occupancy: 4\n\nNumber of people: 2\nTotal cost: 71 x 2 + 499 x 1 = 641\nAccommodation minimum nights: 1/2\n\nDays: 2\nCurrent City: Houston, Texas\nTransportation: -\nBreakfast: Jalapenos, Houston, Texas, cost: 57, cuisines: Desserts, Tea, Cafe, Chinese, Seafood\nAttraction: Space Center Houston, Houston; Houston Museum of Natural Science, Houston\nLunch: Super Bakery, Houston, Texas, cost: 30, cuisines: Seafood, Fast Food\nDinner: Sheetla Dhaba, Houston, Texas, cost: 35, cuisines: Desserts, Pizza, Bakery, American, Mediterranean\nAccommodation: Sunny and Airy near Manhattan, Houston, Texas, cost: 499, room type: Entire home/apt, house rules: Smoking allowed, minimum nights: 2, maximum occupancy: 4\n\nNumber of people: 2\nTotal cost: 57 x 2 + 30 x 2 + 35 x 2 + 499 x 1 = 743\nAccommodation minimum nights: 2/2\n\nDays: 3\nCurrent City: from Houston to San Antonio, Texas\nTransportation: Self-driving, from Houston to San Antonio, duration: 2 hours 56 mins, distance: 317 km, cost: 15\nBreakfast: Royal Mart, Houston, Texas, cost: 40, cuisines: Tea, Bakery, Cafe, Mediterranean, Seafood\nAttraction: San Antonio River Walk, San Antonio; The Alamo, San Antonio\nLunch: Cafe Le Rue @ The Landings, San Antonio, Texas, cost: 19, cuisines: French, Mexican, Cafe, Seafood\nDinner: Martin's BBQ, San Antonio, Texas, cost: 71, cuisines: Tea, BBQ, Fast Food, Indian, Seafood\nAccommodation: Charming Bedroom in Gramercy, San Antonio, Texas, cost: 353, room type: Private room, house rules: Smoking allowed, minimum nights: 1, maximum occupancy: 2\n\nNumber of people: 2\nTotal cost: 15 x 2 + 40 x 2 + 19 x 2 + 71 x 2 + 353 x 1 = 671\nAccommodation minimum nights: 1/1\n\nDays: 4\nCurrent City: San Antonio, Texas\nTransportation: -\nBreakfast: Shri Balaji, San Antonio, Texas, cost: 17, cuisines: Desserts, Tea, Pizza, American, Mediterranean, Seafood\nAttraction: San Antonio Museum of Art (SAMA), San Antonio; San Antonio Botanical Garden, San Antonio\nLunch: The Boozy Cow, San Antonio, Texas, cost: 73, cuisines: Pizza, BBQ\nDinner: Sona Bakers, San Antonio, Texas, cost: 20, cuisines: Mexican, Bakery, Seafood\nAccommodation: Charming Bedroom in Gramercy, San Antonio, Texas, cost: 353, room type: Private room, house rules: Smoking allowed, minimum nights: 1, maximum occupancy: 2\n\nNumber of people: 2\nTotal cost: 17 x 2 + 73 x 2 + 20 x 2 + 353 x 1 = 620\nAccommodation minimum nights: 2/1\n\nDays: 5\nCurrent City: from San Antonio to Dallas, Texas\nTransportation: Self-driving, from San Antonio to Dallas, duration: 4 hours 4 mins, distance: 440 km, cost: 22\nBreakfast: Barbeque Nation, San Antonio, Texas, cost: 16, cuisines: Tea, Cafe, Fast Food, Chinese, American\nAttraction: Reunion Tower, Dallas; Dallas Museum of Art, Dallas\nLunch: Coconuts Fish Cafe, Dallas, Texas, cost: 38, cuisines: Cafe, BBQ, Mediterranean, Fast Food\nDinner: Bikaner Sweets, Dallas, Texas, cost: 23, cuisines: Tea, French, Bakery, Cafe, Seafood\nAccommodation: Fresh Budget Room, Dallas, Texas, cost: 262, room type: Private room, house rules: Smoking allowed, minimum nights: 2, maximum occupancy: 1\n\nNumber of people: 2\nTotal cost: 22 x 2 + 16 x 2 + 38 x 2 + 23 x 2 + 262 x 2 = 722\nAccommodation minimum nights: 1/2\n\nDays: 6\nCurrent City: Dallas, Texas\nTransportation: -\nBreakfast: Drifters Cafe, Dallas, Texas, cost: 21, cuisines: Tea, French, Mexican, Cafe, Seafood\nAttraction: The Sixth Floor Museum at Dealey Plaza, Dallas; The Dallas Arboretum and Botanical Garden, Dallas\nLunch: Cafe Hera Pheri, Dallas, Texas, cost: 18, cuisines: Cafe, Desserts\nDinner: Wich 'N' Shake, Dallas, Texas, cost: 31, cuisines: Tea, Mexican, Bakery, Fast Food, Cafe\nAccommodation: Fresh Budget Room, Dallas, Texas, cost: 262, room type: Private room, house rules: Smoking allowed, minimum nights: 2, maximum occupancy: 1\n\nNumber of people: 2\nTotal cost: 21 x 2 + 18 x 2 + 31 x 2 + 262 x 2 = 684\nAccommodation minimum nights: 2/2\n\nDays: 7\nCurrent City: from Dallas to Albuquerque\nTransportation: Self-driving, from Dallas to Albuquerque, duration: 9 hours 33 mins, distance: 1,045 km, cost: 52\nBreakfast: McDonald's, Dallas, Texas, cost: 56, cuisines: Cafe, Seafood\nAttraction: -\nLunch: -\nDinner: -\nAccommodation: -\n\nNumber of people: 2\nTotal cost: 52 x 2 + 56 x 2 = 216\n\nTotal cost across all days: 641 + 743 + 671 + 620 + 722 + 684 + 216 = 4,297\n\nCuisines: The prompt specifies no cuisines, so all cuisine constraints are satisfied\nAccommodation: All accommodations allow smoking and are not shared rooms, meeting the specified constraints.", "gpt-4-1106-preview_direct_sole-planning_parsed_results": [{"day": 1, "current_city": "from Albuquerque to Houston, Texas", "transportation": "Self-driving, from Albuquerque to Houston, duration: 12 hours 51 mins, distance: 1,422 km", "breakfast": "-", "attraction": "-", "lunch": "-", "dinner": "-", "accommodation": "Sunny and Airy near Manhattan, Houston, Texas"}, {"day": 2, "current_city": "Houston, Texas", "transportation": "-", "breakfast": "Jalapenos, Houston, Texas", "attraction": "Space Center Houston, Houston;Houston Museum of Natural Science, Houston;", "lunch": "Super Bakery, Houston, Texas", "dinner": "Sheetla Dhaba, Houston, Texas", "accommodation": "Sunny and Airy near Manhattan, Houston, Texas"}, {"day": 3, "current_city": "from Houston to San Antonio, Texas", "transportation": "Self-driving, from Houston to San Antonio, duration: 2 hours 56 mins, distance: 317 km", "breakfast": "Royal Mart, Houston, Texas", "attraction": "San Antonio River Walk, San Antonio;The Alamo, San Antonio;", "lunch": "Cafe Le Rue @ The Landings, San Antonio, Texas", "dinner": "Martin's BBQ, San Antonio, Texas", "accommodation": "Charming Bedroom in Gramercy, San Antonio, Texas"}, {"day": 4, "current_city": "San Antonio, Texas", "transportation": "-", "breakfast": "Shri Balaji, San Antonio, Texas", "attraction": "San Antonio Museum of Art (SAMA), San Antonio;San Antonio Botanical Garden, San Antonio;", "lunch": "The Boozy Cow, San Antonio, Texas", "dinner": "Sona Bakers, San Antonio, Texas", "accommodation": "Charming Bedroom in Gramercy, San Antonio, Texas"}, {"day": 5, "current_city": "from San Antonio to Dallas, Texas", "transportation": "Self-driving, from San Antonio to Dallas, duration: 4 hours 4 mins, distance: 440 km", "breakfast": "Barbeque Nation, San Antonio, Texas", "attraction": "Reunion Tower, Dallas;Dallas Museum of Art, Dallas;", "lunch": "Coconuts Fish Cafe, Dallas, Texas", "dinner": "Bikaner Sweets, Dallas, Texas", "accommodation": "Fresh Budget Room, Dallas, Texas"}, {"day": 6, "current_city": "Dallas, Texas", "transportation": "-", "breakfast": "Drifters Cafe, Dallas, Texas", "attraction": "The Sixth Floor Museum at Dealey Plaza, Dallas;The Dallas Arboretum and Botanical Garden, Dallas;", "lunch": "Cafe Hera Pheri, Dallas, Texas", "dinner": "Wich 'N' Shake, Dallas, Texas", "accommodation": "Fresh Budget Room, Dallas, Texas"}, {"day": 7, "current_city": "from Dallas to Albuquerque", "transportation": "Self-driving, from Dallas to Albuquerque, duration: 9 hours 33 mins, distance: 1,045 km", "breakfast": "McDonald's, Dallas, Texas", "attraction": "-", "lunch": "-", "dinner": "-", "accommodation": "-"}]}]