[{"gpt-4-1106-preview_direct_sole-planning_results": "Travel Plan:\n\nDays: 1\nCurrent City: from Islip to State College (Pennsylvania)\nTransportation: Self-driving, from Islip to State College, duration: 4 hours 52 mins, distance: 464 km, cost: $23\nBreakfast: -\nAttraction: -\nLunch: -\nDinner: -\nAccommodation: Beautiful, Newly Furnished, Luxury, Grand Central, State College (Pennsylvania), cost: $210, room type: Entire home/apt, house rules: No parties, minimum nights: 30, maximum occupancy: 2\n\nNumber of people: 2\nTotal cost: 2 x $23 (transportation) + 1 x $210 (accommodation) = $256\nAccommodation minimum nights: 1/30\n\nDays: 2\nCurrent City: State College (Pennsylvania)\nTransportation: -\nBreakfast: Kawa Sushi, State College (Pennsylvania), cost: $82, cuisines: French, Mexican, Desserts, Fast Food\nAttraction: The Arboretum at Penn State, State College (Pennsylvania)\nLunch: Los Agaves, State College (Pennsylvania), cost: $39, cuisines: French, BBQ, Cafe\nDinner: Fusion Food Corner, State College (Pennsylvania), cost: $46, cuisines: Bakery, Mexican, BBQ, Italian\nAccommodation: Beautiful, Newly Furnished, Luxury, Grand Central, State College (Pennsylvania), cost: $210, room type: Entire home/apt, house rules: No parties, minimum nights: 30, maximum occupancy: 2\n\nNumber of people: 2\nTotal cost: 2 x $82 (breakfast) + 2 x $39 (lunch) + 2 x $46 (dinner) + 1 x $210 (accommodation) = $544\nAccommodation minimum nights: 2/30\n\nDays: 3\nCurrent City: from State College to Johnstown (Pennsylvania)\nTransportation: Self-driving, from State College to Johnstown, duration: 1 hour 29 mins, distance: 137 km, cost: $6\nBreakfast: Amici Cafe, State College (Pennsylvania), cost: $96, cuisines: Pizza, Bakery, BBQ, Chinese, Seafood\nAttraction: Discovery Space of Central Pennsylvania, State College (Pennsylvania)\nLunch: Best Pizza Hut, State College (Pennsylvania), cost: $44, cuisines: Desserts, French, Bakery, Cafe, Indian\nDinner: -\nAccommodation: Modern duplex 30 minutes to Times Square, Johnstown (Pennsylvania), cost: $334, room type: Entire home/apt, house rules: No smoking, minimum nights: 4, maximum occupancy: 2\n\nNumber of people: 2\nTotal cost: 2 x $6 (transportation) + 2 x $96 (breakfast) + 2 x $44 (lunch) + 1 x $334 (accommodation) = $626\nAccommodation minimum nights: 1/4\n\nDays: 4\nCurrent City: Johnstown (Pennsylvania)\nTransportation: -\nBreakfast: The National, Johnstown (Pennsylvania), cost: $47, cuisines: Chinese, BBQ, Cafe, Seafood\nAttraction: Johnstown Flood Museum, Johnstown (Pennsylvania)\nLunch: Palmshore, Johnstown (Pennsylvania), cost: $61, cuisines: Bakery, American, BBQ, Fast Food\nDinner: Souza Lobo, Johnstown (Pennsylvania), cost: $92, cuisines: Tea, Mexican, Bakery, Cafe, Indian\nAccommodation: Modern duplex 30 minutes to Times Square, Johnstown (Pennsylvania), cost: $334, room type: Entire home/apt, house rules: No smoking, minimum nights: 4, maximum occupancy: 2\n\nNumber of people: 2\nTotal cost: 2 x $47 (breakfast) + 2 x $61 (lunch) + 2 x $92 (dinner) + 1 x $334 (accommodation) = $734\nAccommodation minimum nights: 2/4\n\nDays: 5\nCurrent City: from Johnstown to Islip\nTransportation: Self-driving, from Johnstown to Islip, duration: 5 hours 57 mins, distance: 590 km, cost: $29\nBreakfast: Chicken Inn Family Meat Shop, Johnstown (Pennsylvania), cost: $79, cuisines: Desserts, Bakery, Fast Food, Mediterranean, Seafood\nAttraction: Heritage Discovery Center, Johnstown (Pennsylvania)\nLunch: Burger Dominion, Johnstown (Pennsylvania), cost: $83, cuisines: Tea, Pizza, French, Cafe, Mediterranean\nDinner: -\nAccommodation: -\n\nNumber of people: 2\nTotal cost: 2 x $29 (transportation) + 2 x $79 (breakfast) + 2 x $83 (lunch) = $370\n\nTotal cost across all days: $256 + $544 + $626 + $734 + $370 = $2,530\nCuisines: All cuisines constraints are satisfied.\nRoom Constraint: All accommodations selected are entire rooms that allow children under 10.\nTransportation Constraint: No flights were taken, as per the preference.\nHouse Rules Constraint: All accommodations allow children under 10.\n\nPlease note that the accommodation on Day 1 and Day 2 has a minimum stay of 30 nights, which is not suitable for a 5-day trip. Similarly, the accommodation on Day 3 and Day 4 has a minimum stay of 4 nights. These details are not consistent with the travel plan and would need to be adjusted to meet the requirements of the trip. However, due to the lack of alternative accommodation options in the provided data, these selections were made to demonstrate the format of the travel plan. In a real-world scenario, alternative accommodations that meet the minimum night stay requirements would need to be found.", "gpt-4-1106-preview_direct_sole-planning_parsed_results": [{"day": 1, "current_city": "from Islip to State College", "transportation": "Self-driving, from Islip to State College, duration: 4 hours 52 mins, distance: 464 km", "breakfast": "-", "attraction": "-", "lunch": "-", "dinner": "-", "accommodation": "Beautiful, Newly Furnished, Luxury, Grand Central, State College"}, {"day": 2, "current_city": "State College", "transportation": "-", "breakfast": "Kawa Sushi, State College", "attraction": "The Arboretum at Penn State, State College;", "lunch": "Los Agaves, State College", "dinner": "Fusion Food Corner, State College", "accommodation": "Beautiful, Newly Furnished, Luxury, Grand Central, State College"}, {"day": 3, "current_city": "from State College to Johnstown", "transportation": "Self-driving, from State College to Johnstown, duration: 1 hour 29 mins, distance: 137 km", "breakfast": "Amici Cafe, State College", "attraction": "Discovery Space of Central Pennsylvania, State College;", "lunch": "Best Pizza Hut, State College", "dinner": "-", "accommodation": "Modern duplex 30 minutes to Times Square, Johnstown"}, {"day": 4, "current_city": "Johnstown", "transportation": "-", "breakfast": "The National, Johnstown", "attraction": "Johnstown Flood Museum, Johnstown;", "lunch": "Palmshore, Johnstown", "dinner": "Souza Lobo, Johnstown", "accommodation": "Modern duplex 30 minutes to Times Square, Johnstown"}, {"day": 5, "current_city": "from Johnstown to Islip", "transportation": "Self-driving, from Johnstown to Islip, duration: 5 hours 57 mins, distance: 590 km", "breakfast": "Chicken Inn Family Meat Shop, Johnstown", "attraction": "Heritage Discovery Center, Johnstown;", "lunch": "Burger Dominion, Johnstown", "dinner": "-", "accommodation": "-"}]}]