[{"gpt-4-1106-preview_direct_sole-planning_results": "Travel Plan:\n\nDays: 1\nCurrent City: Key West to Evansville (Indiana)\nTransportation: Self-driving, from Key West to Evansville, duration: 18 hours 21 mins, distance: 1,961 km, cost: 98\nBreakfast: -\nAttraction: -\nLunch: -\nDinner: -\nAccommodation: Stylish 1 bed room in the East Village, Evansville (Indiana), cost: 674, room type: Entire home/apt, house rules: No children under 10, minimum nights: 3, maximum occupancy: 6\n\nNumber of people: 1\nTotal cost: 1 x 98 + 1 x 674 = 772\nAccommodation minimum nights: 1/3\n\nDays: 2\nCurrent City: Evansville (Indiana)\nTransportation: -\nBreakfast: Blue Orchid Thai Restaurant, Evansville (Indiana), cost: 86, cuisines: Tea, Mexican, American, Desserts\nAttraction: Mesker Park Zoo, Evansville (Indiana); Evansville Museum, Evansville (Indiana)\nLunch: Punjabi Restaurant, Evansville (Indiana), cost: 29, cuisines: Cafe, Bakery, Desserts, Fast Food\nDinner: Twist of Italy, Evansville (Indiana), cost: 85, cuisines: Desserts, Pizza, Mexican, Mediterranean, Seafood\nAccommodation: Stylish 1 bed room in the East Village, Evansville (Indiana), cost: 674, room type: Entire home/apt, house rules: No children under 10, minimum nights: 3, maximum occupancy: 6\n\nNumber of people: 1\nTotal cost: 1 x 86 + 1 x 29 + 1 x 85 + 1 x 674 = 874\nAccommodation minimum nights: 2/3\n\nDays: 3\nCurrent City: Evansville (Indiana) to South Bend (Indiana)\nTransportation: Self-driving, from Evansville to South Bend, duration: 5 hours 1 min, distance: 512 km, cost: 25\nBreakfast: J. Christopher's, Evansville (Indiana), cost: 39, cuisines: Tea, Cafe, Desserts, Seafood\nAttraction: Burdette Park, Evansville (Indiana); Angel Mounds State Historic Site, Evansville (Indiana)\nLunch: McDonald's, Evansville (Indiana), cost: 84, cuisines: Tea, Bakery, BBQ, Indian, Seafood\nDinner: -\nAccommodation: Just Right in Lovely Greenpoint, South Bend (Indiana), cost: 614, room type: Private room, house rules: No smoking & No visitors, minimum nights: 7, maximum occupancy: 1\n\nNumber of people: 1\nTotal cost: 1 x 25 + 1 x 39 + 1 x 84 + 1 x 614 = 762\nAccommodation minimum nights: 1/7\n\nDays: 4\nCurrent City: South Bend (Indiana)\nTransportation: -\nBreakfast: Madaan Confectionery, South Bend (Indiana), cost: 62, cuisines: Tea, Cafe, BBQ, Seafood\nAttraction: Studebaker National Museum, South Bend (Indiana); South Bend Museum of Art, South Bend (Indiana)\nLunch: Krips Restaurant, South Bend (Indiana), cost: 59, cuisines: Tea, Mediterranean, Fast Food\nDinner: MOB Brewpub, South Bend (Indiana), cost: 67, cuisines: Cafe, Mexican, American, BBQ\nAccommodation: Just Right in Lovely Greenpoint, South Bend (Indiana), cost: 614, room type: Private room, house rules: No smoking & No visitors, minimum nights: 7, maximum occupancy: 1\n\nNumber of people: 1\nTotal cost: 1 x 62 + 1 x 59 + 1 x 67 + 1 x 614 = 802\nAccommodation minimum nights: 2/7\n\nDays: 5\nCurrent City: South Bend (Indiana) to Key West\nTransportation: Self-driving, from South Bend to Key West, duration: 22 hours 38 mins, distance: 2,406 km, cost: 120\nBreakfast: It\u6f74\u7c79 Sinful, South Bend (Indiana), cost: 26, cuisines: Desserts, French, BBQ, Bakery, Seafood\nAttraction: Potawatomi Zoo, South Bend (Indiana); The Oliver Mansion, South Bend (Indiana)\nLunch: Roadhouse Cafe, South Bend (Indiana), cost: 24, cuisines: Desserts, Pizza, Bakery, Fast Food, Chinese\nDinner: -\nAccommodation: -\n\nNumber of people: 1\nTotal cost: 1 x 120 + 1 x 26 + 1 x 24 = 170\n\nTotal cost across all days: 772 + 874 + 762 + 802 + 170 = 3,380\n\nUnfortunately, the total cost of $3,380 exceeds the specified budget of $2,000. Adjustments to the plan would be required to meet the budget constraint. This could involve choosing more affordable accommodations, reducing meal costs, or altering transportation methods. However, given the constraints and the costs of transportation and accommodation, it may not be possible to create a feasible plan within the $2,000 budget.", "gpt-4-1106-preview_direct_sole-planning_parsed_results": [{"day": 1, "current_city": "from Key West to Evansville", "transportation": "Self-driving, from Key West to Evansville, duration: 18 hours 21 mins, distance: 1,961 km", "breakfast": "-", "attraction": "-", "lunch": "-", "dinner": "-", "accommodation": "Stylish 1 bed room in the East Village, Evansville"}, {"day": 2, "current_city": "Evansville", "transportation": "-", "breakfast": "Blue Orchid Thai Restaurant, Evansville", "attraction": "Mesker Park Zoo, Evansville;Evansville Museum, Evansville;", "lunch": "Punjabi Restaurant, Evansville", "dinner": "Twist of Italy, Evansville", "accommodation": "Stylish 1 bed room in the East Village, Evansville"}, {"day": 3, "current_city": "from Evansville to South Bend", "transportation": "Self-driving, from Evansville to South Bend, duration: 5 hours 1 min, distance: 512 km", "breakfast": "J. Christopher's, Evansville", "attraction": "Burdette Park, Evansville;Angel Mounds State Historic Site, Evansville;", "lunch": "McDonald's, Evansville", "dinner": "-", "accommodation": "Just Right in Lovely Greenpoint, South Bend"}, {"day": 4, "current_city": "South Bend", "transportation": "-", "breakfast": "Madaan Confectionery, South Bend", "attraction": "Studebaker National Museum, South Bend;South Bend Museum of Art, South Bend;", "lunch": "Krips Restaurant, South Bend", "dinner": "MOB Brewpub, South Bend", "accommodation": "Just Right in Lovely Greenpoint, South Bend"}, {"day": 5, "current_city": "from South Bend to Key West", "transportation": "Self-driving, from South Bend to Key West, duration: 22 hours 38 mins, distance: 2,406 km", "breakfast": "It's Sinful, South Bend", "attraction": "Potawatomi Zoo, South Bend;The Oliver Mansion, South Bend;", "lunch": "Roadhouse Cafe, South Bend", "dinner": "-", "accommodation": "-"}]}]