[{"gpt-4-1106-preview_direct_sole-planning_results": "Travel Plan:\n\nDays: 1\nCurrent City: from Buffalo to Atlanta (Georgia)\nTransportation: Flight Number: F3502691, from Buffalo to Atlanta (Georgia), Departure Time: 18:48, Arrival Time: 20:51, cost: $240\nBreakfast: -\nAttraction: -\nLunch: -\nDinner: Saffron, Atlanta (Georgia), cost: $39, cuisines: Tea, Cafe, Fast Food, Seafood\nAccommodation: Bright, Modern, Clean, Spacious, Brooklyn Home, Atlanta (Georgia), cost: $1034, room type: Entire home/apt, house rules: No children under 10, minimum nights: 3, maximum occupancy: 4\n\nNumber of people: 1\nTotal cost: 1 x $240 + 1 x $39 + 1 x $1034 = $1,313\nAccommodation minimum nights: 1/3\n\nDays: 2\nCurrent City: Atlanta (Georgia)\nTransportation: -\nBreakfast: Adda, Atlanta (Georgia), cost: $22, cuisines: Tea, Mexican, Bakery\nAttraction: Georgia Aquarium, Atlanta (Georgia); World of Coca-Cola, Atlanta (Georgia); Centennial Olympic Park, Atlanta (Georgia)\nLunch: Baba Au Rhum, Atlanta (Georgia), cost: $27, cuisines: Desserts, Pizza, Mexican, BBQ, Fast Food\nDinner: Asian Bistro, Atlanta (Georgia), cost: $27, cuisines: Tea, Bakery, Seafood\nAccommodation: Bright, Modern, Clean, Spacious, Brooklyn Home, Atlanta (Georgia), cost: $1034, room type: Entire home/apt, house rules: No children under 10, minimum nights: 3, maximum occupancy: 4\n\nNumber of people: 1\nTotal cost: 1 x $22 + 1 x $27 + 1 x $27 + 1 x $1034 = $1,110\nAccommodation minimum nights: 2/3\n\nDays: 3\nCurrent City: from Atlanta (Georgia) to Buffalo\nTransportation: Flight Number: F3502694, from Atlanta to Buffalo, Departure Time: 15:47, Arrival Time: 17:42, cost: $209\nBreakfast: Ahata, Atlanta (Georgia), cost: $17, cuisines: Tea, Indian, Desserts\nAttraction: Atlanta Botanical Garden, Atlanta (Georgia); Piedmont Park, Atlanta (Georgia)\nLunch: Chef Style, Atlanta (Georgia), cost: $59, cuisines: Pizza, American, Desserts, Seafood\nDinner: -\nAccommodation: -\n\nNumber of people: 1\nTotal cost: 1 x $209 + 1 x $17 + 1 x $59 = $285\n\nTotal cost across all days: $1,313 + $1,110 + $285 = $2,708\n\nUnfortunately, the total cost exceeds the specified budget of $1,100. Adjustments are needed to meet the budget constraint. Here is a revised plan within the budget:\n\nRevised Travel Plan:\n\nDays: 1\nCurrent City: from Buffalo to Atlanta (Georgia)\nTransportation: Flight Number: F3502691, from Buffalo to Atlanta (Georgia), Departure Time: 18:48, Arrival Time: 20:51, cost: $240\nBreakfast: -\nAttraction: -\nLunch: -\nDinner: Ahata, Atlanta (Georgia), cost: $17, cuisines: Tea, Indian, Desserts\nAccommodation: Charming Carroll Gardens 2 BR, Atlanta (Georgia), cost: $576, room type: Entire home/apt, house rules: No parties, minimum nights: 1, maximum occupancy: 4\n\nNumber of people: 1\nTotal cost: 1 x $240 + 1 x $17 + 1 x $576 = $833\nAccommodation minimum nights: 1/1\n\nDays: 2\nCurrent City: Atlanta (Georgia)\nTransportation: -\nBreakfast: Adda, Atlanta (Georgia), cost: $22, cuisines: Tea, Mexican, Bakery\nAttraction: Centennial Olympic Park, Atlanta (Georgia); High Museum of Art, Atlanta (Georgia)\nLunch: Daawat-e-Kashmir, Atlanta (Georgia), cost: $19, cuisines: Cafe, Pizza, American, Seafood\nDinner: Asian Bistro, Atlanta (Georgia), cost: $27, cuisines: Tea, Bakery, Seafood\nAccommodation: Charming Carroll Gardens 2 BR, Atlanta (Georgia), cost: $576, room type: Entire home/apt, house rules: No parties, minimum nights: 1, maximum occupancy: 4\n\nNumber of people: 1\nTotal cost: 1 x $22 + 1 x $19 + 1 x $27 + 1 x $576 = $644\nAccommodation minimum nights: 2/1\n\nDays: 3\nCurrent City: from Atlanta (Georgia) to Buffalo\nTransportation: Flight Number: F3502694, from Atlanta to Buffalo, Departure Time: 15:47, Arrival Time: 17:42, cost: $209\nBreakfast: Saffron, Atlanta (Georgia), cost: $39, cuisines: Tea, Cafe, Fast Food, Seafood\nAttraction: Piedmont Park, Atlanta (Georgia)\nLunch: -\nDinner: -\nAccommodation: -\n\nNumber of people: 1\nTotal cost: 1 x $209 + 1 x $39 = $248\n\nTotal cost across all days: $833 + $644 + $248 = $1,725\n\nThe revised plan still exceeds the budget. To fit within the $1,100 budget, we need to opt for a less expensive accommodation option and reduce meal costs. Here is the final revised plan:\n\nFinal Revised Travel Plan:\n\nDays: 1\nCurrent City: from Buffalo to Atlanta (Georgia)\nTransportation: Flight Number: F3502691, from Buffalo to Atlanta (Georgia), Departure Time: 18:48, Arrival Time: 20:51, cost: $240\nBreakfast: -\nAttraction: -\nLunch: -\nDinner: Ahata, Atlanta (Georgia), cost: $17, cuisines: Tea, Indian, Desserts\nAccommodation: Unique 2BR Apartment, Atlanta (Georgia), cost: $394, room type: Entire home/apt, house rules: No parties & No pets & No children under 10, minimum nights: 2, maximum occupancy: 3\n\nNumber of people: 1\nTotal cost: 1 x $240 + 1 x $17 + 1 x $394 = $651\nAccommodation minimum nights: 1/2\n\nDays: 2\nCurrent City: Atlanta (Georgia)\nTransportation: -\nBreakfast: Adda, Atlanta (Georgia), cost: $22, cuisines: Tea, Mexican, Bakery\nAttraction: Centennial Olympic Park, Atlanta (Georgia)\nLunch: Daawat-e-Kashmir, Atlanta (Georgia), cost: $19, cuisines: Cafe, Pizza, American, Seafood\nDinner: -\nAccommodation: Unique 2BR Apartment, Atlanta (Georgia), cost: $394, room type: Entire home/apt, house rules: No parties & No pets & No children under 10, minimum nights: 2, maximum occupancy: 3\n\nNumber of people: 1\nTotal cost: 1 x $22 + 1 x $19 + 1 x $394 = $435\nAccommodation minimum nights: 2/2\n\nDays: 3\nCurrent City: from Atlanta (Georgia) to Buffalo\nTransportation: Flight Number: F3502694, from Atlanta to Buffalo, Departure Time: 15:47, Arrival Time: 17:42, cost: $209\nBreakfast: -\nAttraction: -\nLunch: -\nDinner: -\nAccommodation: -\n\nNumber of people: 1\nTotal cost: 1 x $209 = $209\n\nTotal cost across all days: $651 + $435 + $209 = $1,295\n\nThe final revised plan is still over budget. To fit within the $1,100 budget, we may need to consider a shared room accommodation or reduce the number of attractions and meals. However, given the constraints of the query, it is not possible to create a travel plan that includes all required details and stays within the budget of $1,100.", "gpt-4-1106-preview_direct_sole-planning_parsed_results": [{"day": 1, "current_city": "from Buffalo to Atlanta (Georgia)", "transportation": "Flight Number: F3502691, from Buffalo to Atlanta (Georgia), Departure Time: 18:48, Arrival Time: 20:51", "breakfast": "-", "attraction": "-", "lunch": "-", "dinner": "Ahata, Atlanta (Georgia)", "accommodation": "Unique 2BR Apartment, Atlanta (Georgia)"}, {"day": 2, "current_city": "Atlanta (Georgia)", "transportation": "-", "breakfast": "Adda, Atlanta (Georgia)", "attraction": "Centennial Olympic Park, Atlanta (Georgia)", "lunch": "Daawat-e-Kashmir, Atlanta (Georgia)", "dinner": "-", "accommodation": "Unique 2BR Apartment, Atlanta (Georgia)"}, {"day": 3, "current_city": "from Atlanta (Georgia) to Buffalo", "transportation": "Flight Number: F3502694, from Atlanta to Buffalo, Departure Time: 15:47, Arrival Time: 17:42", "breakfast": "-", "attraction": "-", "lunch": "-", "dinner": "-", "accommodation": "-"}]}]