[{"gpt-4-1106-preview_direct_sole-planning_results": "Travel Plan:\n\nDays: 1\nCurrent City: from Jacksonville to Martha's Vineyard (Massachusetts)\nTransportation: Self-driving, from Jacksonville to Martha's Vineyard, duration: 18 hours 51 mins, distance: 1,927 km, cost: 96\nBreakfast: -\nAttraction: -\nLunch: -\nDinner: -\nAccommodation: -\n\nNumber of people: 1\nTotal cost: 1 x 96 = 96\nAccommodation minimum nights: -\n\nDays: 2\nCurrent City: Martha's Vineyard (Massachusetts)\nTransportation: -\nBreakfast: -\nAttraction: Martha's Vineyard Museum; East Chop Lighthouse; Vincent House Museum\nLunch: Yellow Dog Eats, Martha's Vineyard, cost: 34, cuisines: Cafe, Indian, Desserts, Seafood\nDinner: Bern's Steak House, Martha's Vineyard, cost: 35, cuisines: Desserts, Mexican, Bakery, BBQ, Indian, Seafood\nAccommodation: One Bed Room Apt In Midtown East, Martha's Vineyard, cost: 450, room type: Entire home/apt, house rules: No children under 10 & No smoking, minimum nights: 2, maximum occupancy: 3\n\nNumber of people: 1\nTotal cost: 1 x 34 + 1 x 35 + 1 x 450 = 519\nAccommodation minimum nights: 1/2\n\nDays: 3\nCurrent City: Martha's Vineyard (Massachusetts)\nTransportation: -\nBreakfast: Friends Forever, Martha's Vineyard, cost: 55, cuisines: Fast Food, BBQ, Seafood\nAttraction: Aquinnah Cliffs Overlook; Gay Head Light; Ocean Park\nLunch: Midnight Chef, Martha's Vineyard, cost: 39, cuisines: Cafe, Desserts\nDinner: Fortune Deli - Fortune Select Excalibur, Martha's Vineyard, cost: 41, cuisines: Tea, Cafe, Indian, Desserts\nAccommodation: One Bed Room Apt In Midtown East, Martha's Vineyard, cost: 450, room type: Entire home/apt, house rules: No children under 10 & No smoking, minimum nights: 2, maximum occupancy: 3\n\nNumber of people: 1\nTotal cost: 1 x 55 + 1 x 39 + 1 x 41 + 1 x 450 = 585\nAccommodation minimum nights: 2/2\n\nDays: 4\nCurrent City: from Martha's Vineyard (Massachusetts) to Hyannis (Massachusetts)\nTransportation: Self-driving, from Martha's Vineyard to Hyannis, duration: 2 hours 7 mins, distance: 49.5 km, cost: 2\nBreakfast: -\nAttraction: -\nLunch: Bridge Road Brewers, Hyannis, cost: 33, cuisines: Pizza, BBQ, Italian\nDinner: Soho Hibachi, Hyannis, cost: 12, cuisines: Tea, Seafood, Pizza, Fast Food\nAccommodation: Luxury 1 bedroom apt. Downtown Brooklyn/Dumbo, Hyannis, cost: 111, room type: Entire home/apt, house rules: No parties & No children under 10, minimum nights: 5, maximum occupancy: 3\n\nNumber of people: 1\nTotal cost: 1 x 2 + 1 x 33 + 1 x 12 + 1 x 111 = 158\nAccommodation minimum nights: 1/5\n\nDays: 5\nCurrent City: Hyannis (Massachusetts)\nTransportation: -\nBreakfast: The Cheesecake Factory, Hyannis, cost: 96, cuisines: Desserts, Tea, Pizza, Mexican, Seafood\nAttraction: John F. Kennedy Hyannis Museum; Cape Cod Maritime Museum; John F. Kennedy Memorial\nLunch: Kailash Restaurant, Hyannis, cost: 45, cuisines: Bakery, Pizza, American\nDinner: Cafe Grub Up, Hyannis, cost: 19, cuisines: BBQ, Seafood\nAccommodation: Luxury 1 bedroom apt. Downtown Brooklyn/Dumbo, Hyannis, cost: 111, room type: Entire home/apt, house rules: No parties & No children under 10, minimum nights: 5, maximum occupancy: 3\n\nNumber of people: 1\nTotal cost: 1 x 96 + 1 x 45 + 1 x 19 + 1 x 111 = 271\nAccommodation minimum nights: 2/5\n\nDays: 6\nCurrent City: from Hyannis (Massachusetts) to Nantucket (Massachusetts)\nTransportation: Self-driving, from Hyannis to Nantucket, duration: 2 hours 17 mins, distance: 47.0 km, cost: 2\nBreakfast: -\nAttraction: -\nLunch: Sakura, Nantucket, cost: 87, cuisines: Cafe, Indian, Desserts, Italian\nDinner: Rhinehart's Oyster Bar, Nantucket, cost: 44, cuisines: Tea, Pizza, Mediterranean, Seafood\nAccommodation: Bohemian Studio Loft in Brooklyn, Nantucket, cost: 817, room type: Entire home/apt, house rules: No visitors, minimum nights: 30, maximum occupancy: 2\n\nNumber of people: 1\nTotal cost: 1 x 2 + 1 x 87 + 1 x 44 + 1 x 817 = 950\nAccommodation minimum nights: 1/30\n\nDays: 7\nCurrent City: from Nantucket (Massachusetts) to Jacksonville\nTransportation: Self-driving, from Nantucket to Jacksonville, duration: 20 hours 9 mins, distance: 1,967 km, cost: 98\nBreakfast: Chokho Jeeman Marwari Jain Bhojanalya, Nantucket, cost: 15, cuisines: Pizza, BBQ, Desserts, Fast Food\nAttraction: Whaling Museum; Great Point Lighthouse; Nantucket Shipwreck and Life Saving Museum\nLunch: Cake 24x7, Nantucket, cost: 85, cuisines: Bakery, Desserts\nDinner: -\nAccommodation: -\n\nNumber of people: 1\nTotal cost: 1 x 98 + 1 x 15 + 1 x 85 = 198\n\nTotal cost across all days: 96 + 519 + 585 + 158 + 271 + 950 + 198 = 2,777\n\nCuisines: The prompt specifies no cuisines, so all cuisines constraints are satisfied.\nRoom Constraint: All accommodations selected are entire rooms or private rooms, ensuring privacy for the solo traveler.\nTransportation Constraint: All intra-city travel is managed via self-driving, as there are no available flights for the specified dates.\nHouse Rules: Accommodations were selected based on the house rules provided in the query, avoiding those with restrictions such as \"no parties\" or \"no children under 10\" where applicable.\n\nPlease note that the travel plan does not include the cost of attractions, additional meals, or any other incidental expenses that may occur during the trip. The traveler should ensure they have a valid driver's license and insurance for self-driving. The total cost is well within the specified budget of $6,600.", "gpt-4-1106-preview_direct_sole-planning_parsed_results": [{"day": 1, "current_city": "from Jacksonville to Martha's Vineyard (Massachusetts)", "transportation": "Self-driving, from Jacksonville to Martha's Vineyard, duration: 18 hours 51 mins, distance: 1,927 km", "breakfast": "-", "attraction": "-", "lunch": "-", "dinner": "-", "accommodation": "-"}, {"day": 2, "current_city": "Martha's Vineyard (Massachusetts)", "transportation": "-", "breakfast": "-", "attraction": "Martha's Vineyard Museum, Martha's Vineyard;East Chop Lighthouse, Martha's Vineyard;Vincent House Museum, Martha's Vineyard;", "lunch": "Yellow Dog Eats, Martha's Vineyard", "dinner": "Bern's Steak House, Martha's Vineyard", "accommodation": "One Bed Room Apt In Midtown East, Martha's Vineyard"}, {"day": 3, "current_city": "Martha's Vineyard (Massachusetts)", "transportation": "-", "breakfast": "Friends Forever, Martha's Vineyard", "attraction": "Aquinnah Cliffs Overlook, Martha's Vineyard;Gay Head Light, Martha's Vineyard;Ocean Park, Martha's Vineyard;", "lunch": "Midnight Chef, Martha's Vineyard", "dinner": "Fortune Deli - Fortune Select Excalibur, Martha's Vineyard", "accommodation": "One Bed Room Apt In Midtown East, Martha's Vineyard"}, {"day": 4, "current_city": "from Martha's Vineyard (Massachusetts) to Hyannis (Massachusetts)", "transportation": "Self-driving, from Martha's Vineyard to Hyannis, duration: 2 hours 7 mins, distance: 49.5 km", "breakfast": "-", "attraction": "-", "lunch": "Bridge Road Brewers, Hyannis", "dinner": "Soho Hibachi, Hyannis", "accommodation": "Luxury 1 bedroom apt. Downtown Brooklyn/Dumbo, Hyannis"}, {"day": 5, "current_city": "Hyannis (Massachusetts)", "transportation": "-", "breakfast": "The Cheesecake Factory, Hyannis", "attraction": "John F. Kennedy Hyannis Museum, Hyannis;Cape Cod Maritime Museum, Hyannis;John F. Kennedy Memorial, Hyannis;", "lunch": "Kailash Restaurant, Hyannis", "dinner": "Cafe Grub Up, Hyannis", "accommodation": "Luxury 1 bedroom apt. Downtown Brooklyn/Dumbo, Hyannis"}, {"day": 6, "current_city": "from Hyannis (Massachusetts) to Nantucket (Massachusetts)", "transportation": "Self-driving, from Hyannis to Nantucket, duration: 2 hours 17 mins, distance: 47.0 km", "breakfast": "-", "attraction": "-", "lunch": "Sakura, Nantucket", "dinner": "Rhinehart's Oyster Bar, Nantucket", "accommodation": "Bohemian Studio Loft in Brooklyn, Nantucket"}, {"day": 7, "current_city": "from Nantucket (Massachusetts) to Jacksonville", "transportation": "Self-driving, from Nantucket to Jacksonville, duration: 20 hours 9 mins, distance: 1,967 km", "breakfast": "Chokho Jeeman Marwari Jain Bhojanalya, Nantucket", "attraction": "Whaling Museum, Nantucket;Great Point Lighthouse, Nantucket;Nantucket Shipwreck and Life Saving Museum, Nantucket;", "lunch": "Cake 24x7, Nantucket", "dinner": "-", "accommodation": "-"}]}]