[{"gpt-4-1106-preview_direct_sole-planning_results": "Travel Plan:\n\nDays: 1\nCurrent City: from Houston to Pensacola\nTransportation: Taxi, from Houston to Pensacola, duration: 7 hours 38 mins, distance: 845 km, cost: 845\nBreakfast: -\nAttraction: -\nLunch: -\nDinner: Frog Hollow Tavern, Pensacola, cost: 20, cuisines: American, BBQ, Fast Food, Cafe, Indian\nAccommodation: CHARMING ONE BEDROOM APT IN LES/CHINATOWN, Pensacola, cost: 430, room type: Entire home/apt, house rules: No parties & No children under 10, minimum nights: 4, maximum occupancy: 4\n\nNumber of people: 2\nTotal cost: 1 x 845 (taxi) + 2 x 20 (dinner) + 1 x 430 (accommodation) = 1,315\nAccommodation minimum nights: 1/4\n\nNote: The total cost exceeds the budget on the first day due to the high cost of taxi transportation. To stay within budget, consider self-driving as an alternative.\n\nDays: 2\nCurrent City: Pensacola\nTransportation: Self-driving, from Houston to Pensacola, duration: 7 hours 38 mins, distance: 845 km, cost: 42\nBreakfast: Berry Patch Restaurant, Pensacola, cost: 13, cuisines: Bakery, BBQ, Desserts, Seafood\nAttraction: Historic Pensacola Village, Pensacola; Pensacola Museum of Art, Pensacola\nLunch: Bailey's Bar-B-Que, Pensacola, cost: 13, cuisines: Tea, Bakery, Mediterranean\nDinner: Watershed Cafe, Pensacola, cost: 12, cuisines: Chinese, BBQ, Desserts\nAccommodation: CHARMING ONE BEDROOM APT IN LES/CHINATOWN, Pensacola, cost: 430, room type: Entire home/apt, house rules: No parties & No children under 10, minimum nights: 4, maximum occupancy: 4\n\nNumber of people: 2\nTotal cost: 2 x 42 (self-driving) + 2 x 13 (breakfast) + 2 x 13 (lunch) + 2 x 12 (dinner) + 1 x 430 (accommodation) = 577\nAccommodation minimum nights: 2/4\n\nDays: 3\nCurrent City: from Pensacola to Houston\nTransportation: Self-driving, from Pensacola to Houston, duration: 7 hours 37 mins, distance: 845 km, cost: 42\nBreakfast: Chicago Pizza, Pensacola, cost: 32, cuisines: Pizza, Mediterranean, Fast Food\nAttraction: Pensacola Lighthouse & Maritime Museum, Pensacola; Splash City Adventures, Pensacola\nLunch: Kalpana Restaurant, Pensacola, cost: 36, cuisines: Tea, Cafe, Bakery, American\nDinner: -\nAccommodation: -\n\nNumber of people: 2\nTotal cost: 2 x 42 (self-driving) + 2 x 32 (breakfast) + 2 x 36 (lunch) = 220\n\nTotal cost across all days: 1,315 (Day 1) + 577 (Day 2) + 220 (Day 3) = 2,112\n\nNote: The total cost exceeds the budget on the first day and overall. To adjust the plan to fit the budget, we need to revise the transportation method and possibly change the accommodation to a more affordable option. Since the preferred mode of transportation is not flight-based, we will use self-driving for all days.\n\nRevised Travel Plan with Budget Consideration:\n\nDays: 1\nCurrent City: from Houston to Pensacola\nTransportation: Self-driving, from Houston to Pensacola, duration: 7 hours 38 mins, distance: 845 km, cost: 42\nBreakfast: -\nAttraction: -\nLunch: -\nDinner: Frog Hollow Tavern, Pensacola, cost: 20, cuisines: American, BBQ, Fast Food, Cafe, Indian\nAccommodation: Amazing apartment near museum, gardens & park!, Pensacola, cost: 74, room type: Entire home/apt, house rules: No parties, minimum nights: 17, maximum occupancy: 3\n\nNumber of people: 2\nTotal cost: 2 x 42 (self-driving) + 2 x 20 (dinner) + 1 x 74 (accommodation) = 198\nAccommodation minimum nights: 1/17\n\nDays: 2\nCurrent City: Pensacola\nTransportation: -\nBreakfast: Berry Patch Restaurant, Pensacola, cost: 13, cuisines: Bakery, BBQ, Desserts, Seafood\nAttraction: Historic Pensacola Village, Pensacola; Pensacola Museum of Art, Pensacola\nLunch: Bailey's Bar-B-Que, Pensacola, cost: 13, cuisines: Tea, Bakery, Mediterranean\nDinner: Watershed Cafe, Pensacola, cost: 12, cuisines: Chinese, BBQ, Desserts\nAccommodation: Amazing apartment near museum, gardens & park!, Pensacola, cost: 74, room type: Entire home/apt, house rules: No parties, minimum nights: 17, maximum occupancy: 3\n\nNumber of people: 2\nTotal cost: 2 x 13 (breakfast) + 2 x 13 (lunch) + 2 x 12 (dinner) + 1 x 74 (accommodation) = 150\nAccommodation minimum nights: 2/17\n\nDays: 3\nCurrent City: from Pensacola to Houston\nTransportation: Self-driving, from Pensacola to Houston, duration: 7 hours 37 mins, distance: 845 km, cost: 42\nBreakfast: Chicago Pizza, Pensacola, cost: 32, cuisines: Pizza, Mediterranean, Fast Food\nAttraction: Pensacola Lighthouse & Maritime Museum, Pensacola; Splash City Adventures, Pensacola\nLunch: Kalpana Restaurant, Pensacola, cost: 36, cuisines: Tea, Cafe, Bakery, American\nDinner: -\nAccommodation: -\n\nNumber of people: 2\nTotal cost: 2 x 42 (self-driving) + 2 x 32 (breakfast) + 2 x 36 (lunch) = 220\n\nTotal cost across all days: 198 (Day 1) + 150 (Day 2) + 220 (Day 3) = 568\n\nCuisines: All restaurants selected offer a variety of cuisines.\nRoom Constraint: All accommodations selected are non-shared rooms that permit smoking.\nTransportation Constraint: All travel is managed via self-driving, as per the preference to avoid flights.\n\nPlease note that the accommodation selected for Days 1 and 2 has a minimum stay of 17 nights, which is not ideal for a 3-day trip. However, due to the budget constraints and the need for smoking-permitted accommodations, this was the best available option within the budget. If the minimum stay requirement is strict, the accommodation will need to be revised, potentially exceeding the budget.", "gpt-4-1106-preview_direct_sole-planning_parsed_results": [{"day": 1, "current_city": "from Houston to Pensacola", "transportation": "Self-driving, from Houston to Pensacola, duration: 7 hours 38 mins, distance: 845 km", "breakfast": "-", "attraction": "-", "lunch": "-", "dinner": "Frog Hollow Tavern, Pensacola", "accommodation": "Amazing apartment near museum, gardens & park!, Pensacola"}, {"day": 2, "current_city": "Pensacola", "transportation": "-", "breakfast": "Berry Patch Restaurant, Pensacola", "attraction": "Historic Pensacola Village, Pensacola;Pensacola Museum of Art, Pensacola;", "lunch": "Bailey's Bar-B-Que, Pensacola", "dinner": "Watershed Cafe, Pensacola", "accommodation": "Amazing apartment near museum, gardens & park!, Pensacola"}, {"day": 3, "current_city": "from Pensacola to Houston", "transportation": "Self-driving, from Pensacola to Houston, duration: 7 hours 37 mins, distance: 845 km", "breakfast": "Chicago Pizza, Pensacola", "attraction": "Pensacola Lighthouse & Maritime Museum, Pensacola;Splash City Adventures, Pensacola;", "lunch": "Kalpana Restaurant, Pensacola", "dinner": "-", "accommodation": "-"}]}]