[{"gpt-4-1106-preview_direct_sole-planning_results": "Travel Plan:\n\nDays: 1\nCurrent City: from Latrobe to Myrtle Beach (South Carolina)\nTransportation: Flight Number: F3615674, from Latrobe to Myrtle Beach (South Carolina), Departure Time: 17:59, Arrival Time: 19:12, cost: 116\nBreakfast: -\nAttraction: -\nLunch: -\nDinner: Exotic India, Myrtle Beach (South Carolina), cost: 81, cuisines: Indian, BBQ, Fast Food\nAccommodation: Williamsburg Domino Park Prime Location 2 bedroom, Myrtle Beach (South Carolina), cost: 461, maximum occupancy: 4, house rules: No parties, minimum nights: 1\n\nNumber of people: 1\nTotal cost: 1 x 116 + 1 x 81 + 1 x 461 = 658\nAccommodation minimum nights: 1/1\n\nDays: 2\nCurrent City: Myrtle Beach (South Carolina)\nTransportation: -\nBreakfast: Catfish Charlie's, Myrtle Beach (South Carolina), cost: 14, cuisines: Tea, Chinese, Desserts\nAttraction: SkyWheel Myrtle Beach, Myrtle Beach (South Carolina); WonderWorks Myrtle Beach, Myrtle Beach (South Carolina); Family Kingdom Amusement Park, Myrtle Beach (South Carolina)\nLunch: d' Curry House, Myrtle Beach (South Carolina), cost: 33, cuisines: Tea, Chinese, Desserts, Fast Food\nDinner: Twigly, Myrtle Beach (South Carolina), cost: 55, cuisines: Tea, Bakery, Mediterranean, Seafood\nAccommodation: Williamsburg Domino Park Prime Location 2 bedroom, Myrtle Beach (South Carolina), cost: 461, maximum occupancy: 4, house rules: No parties, minimum nights: 1\n\nNumber of people: 1\nTotal cost: 1 x 14 + 1 x 33 + 1 x 55 + 1 x 461 = 563\nAccommodation minimum nights: 2/1\n\nDays: 3\nCurrent City: from Myrtle Beach (South Carolina) to Greenville (South Carolina)\nTransportation: Self-driving, from Myrtle Beach to Greenville, duration: 4 hours 4 mins, distance: 405 km, cost: 20\nBreakfast: First Eat, Myrtle Beach (South Carolina), cost: 21, cuisines: Tea, Mexican, Fast Food\nAttraction: -\nLunch: Nagai, Myrtle Beach (South Carolina), cost: 19, cuisines: Desserts, Pizza, Mexican, Fast Food, American, Seafood\nDinner: Bhoj Restaurant, Greenville (South Carolina), cost: 71, cuisines: Tea, Chinese, Pizza\nAccommodation: Beautiful Super Cozy Studio, Greenville (South Carolina), cost: 649, maximum occupancy: 6, house rules: No pets & No smoking, minimum nights: 1\n\nNumber of people: 1\nTotal cost: 1 x 20 + 1 x 21 + 1 x 19 + 1 x 71 + 1 x 649 = 780\nAccommodation minimum nights: 1/1\n\nDays: 4\nCurrent City: Greenville (South Carolina)\nTransportation: -\nBreakfast: Al Bake, Greenville (South Carolina), cost: 90, cuisines: Tea, Cafe, Pizza, Seafood\nAttraction: The Children\u2019s Museum of the Upstate, Greenville (South Carolina); Falls Park on the Reedy, Greenville (South Carolina); Greenville Zoo, Greenville (South Carolina)\nLunch: Italiano, Greenville (South Carolina), cost: 95, cuisines: Chinese, French, Pizza, Cafe\nDinner: Indigo Delicatessen, Greenville (South Carolina), cost: 15, cuisines: Chinese, BBQ, Seafood\nAccommodation: Beautiful Super Cozy Studio, Greenville (South Carolina), cost: 649, maximum occupancy: 6, house rules: No pets & No smoking, minimum nights: 1\n\nNumber of people: 1\nTotal cost: 1 x 90 + 1 x 95 + 1 x 15 + 1 x 649 = 849\nAccommodation minimum nights: 2/1\n\nDays: 5\nCurrent City: from Greenville (South Carolina) to Latrobe\nTransportation: Self-driving, from Greenville to Latrobe, duration: 8 hours 34 mins, distance: 858 km, cost: 42\nBreakfast: Sapra Pastry Treat, Greenville (South Carolina), cost: 65, cuisines: Cafe, Pizza, Indian\nAttraction: -\nLunch: Mughlai Treat, Greenville (South Carolina), cost: 85, cuisines: BBQ, Cafe, American, Desserts\nDinner: -\nAccommodation: -\n\nNumber of people: 1\nTotal cost: 1 x 42 + 1 x 65 + 1 x 85 = 192\n\nTotal cost across all days: 658 + 563 + 780 + 849 + 192 = 3,042\n\nCuisines: All restaurants selected offer a variety of cuisines as per the available data.\nRoom Constraint: All accommodations selected are entire homes or private rooms, ensuring privacy.\nTransportation Constraint: No flights were available from Myrtle Beach to Greenville and from Greenville to Latrobe, so self-driving was chosen as per the available data.\nHouse Rules: All accommodations selected meet the house rules criteria as per the available data.", "gpt-4-1106-preview_direct_sole-planning_parsed_results": [{"day": 1, "current_city": "from Latrobe to Myrtle Beach (South Carolina)", "transportation": "Flight Number: F3615674, from Latrobe to Myrtle Beach (South Carolina), Departure Time: 17:59, Arrival Time: 19:12", "breakfast": "-", "attraction": "-", "lunch": "-", "dinner": "Exotic India, Myrtle Beach (South Carolina)", "accommodation": "Williamsburg Domino Park Prime Location 2 bedroom, Myrtle Beach (South Carolina)"}, {"day": 2, "current_city": "Myrtle Beach (South Carolina)", "transportation": "-", "breakfast": "Catfish Charlie's, Myrtle Beach (South Carolina)", "attraction": "SkyWheel Myrtle Beach, Myrtle Beach (South Carolina);WonderWorks Myrtle Beach, Myrtle Beach (South Carolina);Family Kingdom Amusement Park, Myrtle Beach (South Carolina);", "lunch": "d' Curry House, Myrtle Beach (South Carolina)", "dinner": "Twigly, Myrtle Beach (South Carolina)", "accommodation": "Williamsburg Domino Park Prime Location 2 bedroom, Myrtle Beach (South Carolina)"}, {"day": 3, "current_city": "from Myrtle Beach (South Carolina) to Greenville (South Carolina)", "transportation": "Self-driving, from Myrtle Beach to Greenville, duration: 4 hours 4 mins, distance: 405 km", "breakfast": "First Eat, Myrtle Beach (South Carolina)", "attraction": "-", "lunch": "Nagai, Myrtle Beach (South Carolina)", "dinner": "Bhoj Restaurant, Greenville (South Carolina)", "accommodation": "Beautiful Super Cozy Studio, Greenville (South Carolina)"}, {"day": 4, "current_city": "Greenville (South Carolina)", "transportation": "-", "breakfast": "Al Bake, Greenville (South Carolina)", "attraction": "The Children\u2019s Museum of the Upstate, Greenville (South Carolina);Falls Park on the Reedy, Greenville (South Carolina);Greenville Zoo, Greenville (South Carolina);", "lunch": "Italiano, Greenville (South Carolina)", "dinner": "Indigo Delicatessen, Greenville (South Carolina)", "accommodation": "Beautiful Super Cozy Studio, Greenville (South Carolina)"}, {"day": 5, "current_city": "from Greenville (South Carolina) to Latrobe", "transportation": "Self-driving, from Greenville to Latrobe, duration: 8 hours 34 mins, distance: 858 km", "breakfast": "Sapra Pastry Treat, Greenville (South Carolina)", "attraction": "-", "lunch": "Mughlai Treat, Greenville (South Carolina)", "dinner": "-", "accommodation": "-"}]}]