[{"gpt-4-1106-preview_direct_sole-planning_results": "Travel Plan:\n\nDays: 1\nCurrent City: from West Palm Beach to Atlanta\nTransportation: Flight Number: F3491626, from West Palm Beach to Atlanta, Departure Time: 13:56, Arrival Time: 16:02, cost: 137\nBreakfast: -\nAttraction: -\nLunch: -\nDinner: Saffron, Atlanta, cost: 39, cuisines: Tea, Cafe, Fast Food, Seafood\nAccommodation: Charming Carroll Gardens 2 BR, Atlanta, cost: 576, room type: Entire home/apt, house rules: No parties, minimum nights: 1, maximum occupancy: 4\n\nNumber of people: 1\nTotal cost: 1 x 137 + 1 x 39 + 1 x 576 = 752\nAccommodation minimum nights: 1/1\n\nDays: 2\nCurrent City: Atlanta\nTransportation: -\nBreakfast: Adda, Atlanta, cost: 22, cuisines: Tea, Mexican, Bakery\nAttraction: Georgia Aquarium, Atlanta; World of Coca-Cola, Atlanta; Centennial Olympic Park, Atlanta\nLunch: Baba Au Rhum, Atlanta, cost: 27, cuisines: Desserts, Pizza, Mexican, BBQ, Fast Food\nDinner: Asian Bistro, Atlanta, cost: 27, cuisines: Tea, Bakery, Seafood\nAccommodation: Charming Carroll Gardens 2 BR, Atlanta, cost: 576, room type: Entire home/apt, house rules: No parties, minimum nights: 1, maximum occupancy: 4\n\nNumber of people: 1\nTotal cost: 1 x 22 + 1 x 27 + 1 x 27 + 1 x 576 = 652\nAccommodation minimum nights: 2/1\n\nDays: 3\nCurrent City: from Atlanta to West Palm Beach\nTransportation: Flight Number: F3497203, from Atlanta to West Palm Beach, Departure Time: 19:42, Arrival Time: 21:36, cost: 121\nBreakfast: Ahata, Atlanta, cost: 17, cuisines: Tea, Indian, Desserts\nAttraction: Atlanta Botanical Garden, Atlanta; Piedmont Park, Atlanta\nLunch: Daawat-e-Kashmir, Atlanta, cost: 19, cuisines: Cafe, Pizza, American, Seafood\nDinner: -\nAccommodation: -\n\nNumber of people: 1\nTotal cost: 1 x 17 + 1 x 19 + 1 x 121 = 157\n\nTotal cost across all days: 752 + 652 + 157 = 1,561\n\nUnfortunately, the total cost exceeds the specified budget of $900. To adhere to the budget, we need to make adjustments. Let's choose the cheapest transportation and accommodation options.\n\nRevised Travel Plan:\n\nDays: 1\nCurrent City: from West Palm Beach to Atlanta\nTransportation: Self-driving, from West Palm Beach to Atlanta, duration: 8 hours 27 mins, distance: 963 km, cost: 48\nBreakfast: -\nAttraction: -\nLunch: -\nDinner: Ahata, Atlanta, cost: 17, cuisines: Tea, Indian, Desserts\nAccommodation: Spacious private room close St. Barnabas Hospital, Atlanta, cost: 144, room type: Private room, house rules: No smoking, minimum nights: 2, maximum occupancy: 1\n\nNumber of people: 1\nTotal cost: 1 x 48 + 1 x 17 + 1 x 144 = 209\nAccommodation minimum nights: 1/2\n\nDays: 2\nCurrent City: Atlanta\nTransportation: -\nBreakfast: Adda, Atlanta, cost: 22, cuisines: Tea, Mexican, Bakery\nAttraction: Georgia Aquarium, Atlanta; World of Coca-Cola, Atlanta; Centennial Olympic Park, Atlanta\nLunch: Daawat-e-Kashmir, Atlanta, cost: 19, cuisines: Cafe, Pizza, American, Seafood\nDinner: Asian Bistro, Atlanta, cost: 27, cuisines: Tea, Bakery, Seafood\nAccommodation: Spacious private room close St. Barnabas Hospital, Atlanta, cost: 144, room type: Private room, house rules: No smoking, minimum nights: 2, maximum occupancy: 1\n\nNumber of people: 1\nTotal cost: 1 x 22 + 1 x 19 + 1 x 27 + 1 x 144 = 212\nAccommodation minimum nights: 2/2\n\nDays: 3\nCurrent City: from Atlanta to West Palm Beach\nTransportation: Self-driving, from Atlanta to West Palm Beach, duration: 8 hours 29 mins, distance: 962 km, cost: 48\nBreakfast: Saffron, Atlanta, cost: 39, cuisines: Tea, Cafe, Fast Food, Seafood\nAttraction: Atlanta Botanical Garden, Atlanta; Piedmont Park, Atlanta\nLunch: Baba Au Rhum, Atlanta, cost: 27, cuisines: Desserts, Pizza, Mexican, BBQ, Fast Food\nDinner: -\nAccommodation: -\n\nNumber of people: 1\nTotal cost: 1 x 39 + 1 x 27 + 1 x 48 = 114\n\nTotal cost across all days: 209 + 212 + 114 = 535\n\nCuisines: All restaurants selected offer a variety of cuisines, satisfying the unspecified cuisine requirements.\nRoom Constraint: All accommodations selected are private rooms, ensuring privacy for the individual traveler.\nTransportation Constraint: The revised plan uses self-driving as the mode of transportation, which is within the budget and adheres to the constraints.\nHouse Rules: The selected accommodation adheres to the house rules of no smoking.\n\nThe revised travel plan fits within the budget of $900, with a total cost of $535.", "gpt-4-1106-preview_direct_sole-planning_parsed_results": [{"day": 1, "current_city": "from West Palm Beach to Atlanta", "transportation": "Self-driving, from West Palm Beach to Atlanta, duration: 8 hours 27 mins, distance: 963 km", "breakfast": "-", "attraction": "-", "lunch": "-", "dinner": "Ahata, Atlanta", "accommodation": "Spacious private room close St. Barnabas Hospital, Atlanta"}, {"day": 2, "current_city": "Atlanta", "transportation": "-", "breakfast": "Adda, Atlanta", "attraction": "Georgia Aquarium, Atlanta;World of Coca-Cola, Atlanta;Centennial Olympic Park, Atlanta;", "lunch": "Daawat-e-Kashmir, Atlanta", "dinner": "Asian Bistro, Atlanta", "accommodation": "Spacious private room close St. Barnabas Hospital, Atlanta"}, {"day": 3, "current_city": "from Atlanta to West Palm Beach", "transportation": "Self-driving, from Atlanta to West Palm Beach, duration: 8 hours 29 mins, distance: 962 km", "breakfast": "Saffron, Atlanta", "attraction": "Atlanta Botanical Garden, Atlanta;Piedmont Park, Atlanta;", "lunch": "Baba Au Rhum, Atlanta", "dinner": "-", "accommodation": "-"}]}]