[{"gpt-4-1106-preview_direct_sole-planning_results": "Travel Plan:\nDays: 1\nCurrent City: from Boston to San Juan (Puerto Rico)\nTransportation: Flight Number: F3764584, from Boston to San Juan (Puerto Rico), Departure Time: 14:04, Arrival Time: 18:16, cost: $366\nBreakfast: -\nAttraction: -\nLunch: -\nDinner: Christian and Jake's Bistro, San Juan (Puerto Rico), cost: $59, cuisines: Tea, French, Bakery, Fast Food, Indian\nAccommodation: FLUSHING APT!! BEST DEAL IN NYC!!!, San Juan (Puerto Rico), cost: $135, room type: Entire home/apt, house rules: No smoking & No parties, minimum nights: 1, maximum occupancy: 2\n\nNumber of people: 1\nTotal cost: 1 x $366 + 1 x $59 + 1 x $135 = $560\nAccommodation minimum nights: 1/1\n\nDays: 2\nCurrent City: San Juan (Puerto Rico)\nTransportation: -\nBreakfast: Coldpress Company, San Juan (Puerto Rico), cost: $11, cuisines: Cafe, Pizza, BBQ, Fast Food\nAttraction: Castillo San Felipe del Morro, San Juan (Puerto Rico); Paseo de La Princesa, San Juan (Puerto Rico); Parque de las Palomas, San Juan (Puerto Rico)\nLunch: Hoka-Hoka Japanese Steak & Sushi, San Juan (Puerto Rico), cost: $27, cuisines: Tea, French, American, Cafe\nDinner: Go! Dimsum, San Juan (Puerto Rico), cost: $54, cuisines: French, Bakery, Fast Food\nAccommodation: FLUSHING APT!! BEST DEAL IN NYC!!!, San Juan (Puerto Rico), cost: $135, room type: Entire home/apt, house rules: No smoking & No parties, minimum nights: 1, maximum occupancy: 2\n\nNumber of people: 1\nTotal cost: 1 x $11 + 1 x $27 + 1 x $54 + 1 x $135 = $227\nAccommodation minimum nights: 2/1\n\nDays: 3\nCurrent City: from San Juan (Puerto Rico) to Boston\nTransportation: Flight Number: F3619791, from San Juan (Puerto Rico) to Boston, Departure Time: 12:02, Arrival Time: 16:27, cost: $744\nBreakfast: Maison Des Desserts, San Juan (Puerto Rico), cost: $70, cuisines: Cafe, Mexican, Pizza, Italian\nAttraction: Museo de las Am\u00e9ricas, San Juan (Puerto Rico); La Fortaleza, San Juan (Puerto Rico)\nLunch: -\nDinner: -\nAccommodation: -\n\nNumber of people: 1\nTotal cost: 1 x $744 + 1 x $70 = $814\n\nTotal cost across all days: $560 + $227 + $814 = $1,601\n\nUnfortunately, the total cost exceeds the specified budget of $1,400. To adjust the plan within the budget, we can choose a cheaper flight option for the return trip:\n\nAdjusted Days: 3\nCurrent City: from San Juan (Puerto Rico) to Boston\nTransportation: Flight Number: F3764590, from San Juan (Puerto Rico) to Boston, Departure Time: 18:50, Arrival Time: 23:02, cost: $569\nBreakfast: Maison Des Desserts, San Juan (Puerto Rico), cost: $70, cuisines: Cafe, Mexican, Pizza, Italian\nAttraction: Museo de las Am\u00e9ricas, San Juan (Puerto Rico); La Fortaleza, San Juan (Puerto Rico)\nLunch: -\nDinner: -\nAccommodation: -\n\nNumber of people: 1\nTotal cost: 1 x $569 + 1 x $70 = $639\n\nAdjusted total cost across all days: $560 + $227 + $639 = $1,426\n\nThe adjusted total cost is still slightly over the budget. To further adjust, we can remove the dinner on Day 1:\n\nAdjusted Days: 1\nCurrent City: from Boston to San Juan (Puerto Rico)\nTransportation: Flight Number: F3764584, from Boston to San Juan (Puerto Rico), Departure Time: 14:04, Arrival Time: 18:16, cost: $366\nBreakfast: -\nAttraction: -\nLunch: -\nDinner: -\nAccommodation: FLUSHING APT!! BEST DEAL IN NYC!!!, San Juan (Puerto Rico), cost: $135, room type: Entire home/apt, house rules: No smoking & No parties, minimum nights: 1, maximum occupancy: 2\n\nNumber of people: 1\nTotal cost: 1 x $366 + 1 x $135 = $501\nAccommodation minimum nights: 1/1\n\nAdjusted total cost across all days: $501 + $227 + $639 = $1,367\n\nNow the total cost is within the budget of $1,400.", "gpt-4-1106-preview_direct_sole-planning_parsed_results": [{"day": 1, "current_city": "from Boston to San Juan (Puerto Rico)", "transportation": "Flight Number: F3764584, from Boston to San Juan (Puerto Rico), Departure Time: 14:04, Arrival Time: 18:16", "breakfast": "-", "attraction": "-", "lunch": "-", "dinner": "-", "accommodation": "FLUSHING APT!! BEST DEAL IN NYC!!!, San Juan (Puerto Rico)"}, {"day": 2, "current_city": "San Juan (Puerto Rico)", "transportation": "-", "breakfast": "Coldpress Company, San Juan (Puerto Rico)", "attraction": "Castillo San Felipe del Morro, San Juan (Puerto Rico);Paseo de La Princesa, San Juan (Puerto Rico);Parque de las Palomas, San Juan (Puerto Rico);", "lunch": "Hoka-Hoka Japanese Steak & Sushi, San Juan (Puerto Rico)", "dinner": "Go! Dimsum, San Juan (Puerto Rico)", "accommodation": "FLUSHING APT!! BEST DEAL IN NYC!!!, San Juan (Puerto Rico)"}, {"day": 3, "current_city": "from San Juan (Puerto Rico) to Boston", "transportation": "Flight Number: F3764590, from San Juan (Puerto Rico) to Boston, Departure Time: 18:50, Arrival Time: 23:02", "breakfast": "Maison Des Desserts, San Juan (Puerto Rico)", "attraction": "Museo de las Am\u00e9ricas, San Juan (Puerto Rico);La Fortaleza, San Juan (Puerto Rico);", "lunch": "-", "dinner": "-", "accommodation": "-"}]}]