[{"gpt-4-1106-preview_direct_sole-planning_results": "Travel Plan:\n\nDay 1: March 21, 2022\nCurrent City: from Santa Ana to Houston (Texas)\nTransportation: Flight Number: F3897390, from Santa Ana to Houston, Departure Time: 07:57, Arrival Time: 13:05, cost: $340 per person\nBreakfast: - (Assuming breakfast is had before departure or on the flight)\nAttraction: Water Wall, Houston (Texas), Address: 2800 Post Oak Blvd, Houston, TX 77056, USA\nLunch: Jalapenos, Houston (Texas), Average Cost: $57, Cuisines: Desserts, Tea, Cafe, Chinese, Seafood\nDinner: Matchbox, Houston (Texas), Average Cost: $33, Cuisines: Tea, Italian, Bakery, Fast Food, Seafood\nAccommodation: Sunny and Airy near Manhattan, Houston (Texas), cost: $499, room type: Entire home/apt, house rules: No pets, minimum nights: 2, maximum occupancy: 4\n\nNumber of people: 2\nTotal cost: 2 x $340 (flight) + 2 x $57 (lunch) + 2 x $33 (dinner) + $499 (accommodation) = $1,359\n\nDay 2: March 22, 2022\nCurrent City: Houston (Texas)\nTransportation: Taxi within Houston, estimated cost: $100 (for the day)\nBreakfast: Earthen Spices, Houston (Texas), Average Cost: $28, Cuisines: Tea, Mexican, Bakery, BBQ, Fast Food\nAttraction: Space Center Houston, Houston (Texas), Address: 1601 E NASA Pkwy, Houston, TX 77058, USA\nLunch: Istanbul Restaurant, Houston (Texas), Average Cost: $19, Cuisines: Tea, Indian, Seafood\nDinner: Pebble Street, Houston (Texas), Average Cost: $73, Cuisines: Tea, American, Mediterranean, BBQ\nAccommodation: Sunny and Airy near Manhattan, Houston (Texas), cost: $499, room type: Entire home/apt, house rules: No pets, minimum nights: 2, maximum occupancy: 4\n\nNumber of people: 2\nTotal cost: $100 (taxi) + 2 x $28 (breakfast) + 2 x $19 (lunch) + 2 x $73 (dinner) + $499 (accommodation) = $839\n\nDay 3: March 23, 2022\nCurrent City: from Houston to Santa Ana\nTransportation: Flight Number: F3986111, from Houston to Santa Ana, Departure Time: 15:52, Arrival Time: 17:14, cost: $387 per person\nBreakfast: Tasty Bite, Houston (Texas), Average Cost: $15, Cuisines: Bakery, Fast Food, Cafe, American, Seafood\nAttraction: Houston Museum of Natural Science, Houston (Texas), Address: 5555 Hermann Park Dr, Houston, TX 77030, USA\nLunch: Truth Coffee, Houston (Texas), Average Cost: $29, Cuisines: Pizza, American, Seafood\nDinner: - (Assuming dinner will be had after arrival in Santa Ana or on the flight)\nAccommodation: -\n\nNumber of people: 2\nTotal cost: 2 x $387 (flight) + 2 x $15 (breakfast) + 2 x $29 (lunch) = $872\n\nTotal cost across all days: $1,359 + $839 + $872 = $3,070\n\nNote: The total cost slightly exceeds the budget of $3,000. To stay within budget, consider adjusting meal choices or seeking additional discounts on accommodations or transportation.\n\nCuisines: The itinerary includes American, Italian, Mediterranean, and Mexican cuisines as requested.\nRoom Constraint: The accommodation selected allows smoking as per the requirement.\nTransportation Constraint: Alternative transportation options such as flights and taxis have been used, with no self-driving involved.", "gpt-4-1106-preview_direct_sole-planning_parsed_results": [{"day": 1, "current_city": "from Santa Ana to Houston", "transportation": "Flight Number: F3897390, from Santa Ana to Houston, Departure Time: 07:57, Arrival Time: 13:05", "breakfast": "-", "attraction": "Water Wall, Houston;", "lunch": "Jalapenos, Houston", "dinner": "Matchbox, Houston", "accommodation": "Sunny and Airy near Manhattan, Houston"}, {"day": 2, "current_city": "Houston", "transportation": "Taxi within Houston", "breakfast": "Earthen Spices, Houston", "attraction": "Space Center Houston, Houston;", "lunch": "Istanbul Restaurant, Houston", "dinner": "Pebble Street, Houston", "accommodation": "Sunny and Airy near Manhattan, Houston"}, {"day": 3, "current_city": "from Houston to Santa Ana", "transportation": "Flight Number: F3986111, from Houston to Santa Ana, Departure Time: 15:52, Arrival Time: 17:14", "breakfast": "Tasty Bite, Houston", "attraction": "Houston Museum of Natural Science, Houston;", "lunch": "Truth Coffee, Houston", "dinner": "-", "accommodation": "-"}]}]