[{"gpt-4-1106-preview_direct_sole-planning_results": "Travel Plan:\n\nDays: 1\nCurrent City: from Denver to Palm Springs\nTransportation: Flight Number: F3880936, from Denver to Palm Springs, Departure Time: 17:08, Arrival Time: 18:13, cost: $316\nBreakfast: -\nAttraction: -\nLunch: -\nDinner: Bar Gernika Basque Pub & Eatery, Palm Springs, cost: $50, cuisines: Tea, Pizza, Desserts, Fast Food\nAccommodation: Brooklyn Gem, Palm Springs, cost: $877, room type: Entire home/apt, house rules: No children under 10, minimum nights: 2, maximum occupancy: 4\n\nNumber of people: 1\nTotal cost: 1 x $316 + 1 x $50 + 1 x $877 = $1,243\nAccommodation minimum nights: 1/2\n\nDays: 2\nCurrent City: Palm Springs\nTransportation: -\nBreakfast: Sugar & Spice - Le Marche, Palm Springs, cost: $33, cuisines: Tea, French, Cafe\nAttraction: Palm Springs Art Museum, Palm Springs; Walk of the Stars Palm Springs; Moorten Botanical Garden, Palm Springs\nLunch: Kahill's Steak-Fish Chophouse, Palm Springs, cost: $38, cuisines: Cafe, Bakery, American\nDinner: Houndstooth Grill & Tavern, Palm Springs, cost: $47, cuisines: Tea, Pizza, BBQ, Mediterranean\nAccommodation: Brooklyn Gem, Palm Springs, cost: $877, room type: Entire home/apt, house rules: No children under 10, minimum nights: 2, maximum occupancy: 4\n\nNumber of people: 1\nTotal cost: 1 x $33 + 1 x $38 + 1 x $47 + 1 x $877 = $995\nAccommodation minimum nights: 2/2\n\nDays: 3\nCurrent City: from Palm Springs to Denver\nTransportation: Flight Number: F3870469, from Palm Springs to Denver, Departure Time: 16:00, Arrival Time: 19:12, cost: $330\nBreakfast: Midnight Espresso, Palm Springs, cost: $35, cuisines: Bakery, Mediterranean, BBQ\nAttraction: Palm Springs Aerial Tramway, Palm Springs; Indian Canyons, Palm Springs\nLunch: Pizza Man, Palm Springs, cost: $55, cuisines: Tea, Italian, Fast Food, Cafe, American\nDinner: -\nAccommodation: -\n\nNumber of people: 1\nTotal cost: 1 x $330 + 1 x $35 + 1 x $55 = $420\n\nTotal cost across all days: $1,243 + $995 + $420 = $2,658\n\n**Note: The total cost exceeds the specified budget of $2,200. To adjust the plan within the budget, we can consider changing the accommodation to a less expensive option or removing some meals or attractions.**\n\nRevised Travel Plan with Budget Adjustment:\n\nDays: 1\nCurrent City: from Denver to Palm Springs\nTransportation: Flight Number: F3880936, from Denver to Palm Springs, Departure Time: 17:08, Arrival Time: 18:13, cost: $316\nBreakfast: -\nAttraction: -\nLunch: -\nDinner: Bar Gernika Basque Pub & Eatery, Palm Springs, cost: $50, cuisines: Tea, Pizza, Desserts, Fast Food\nAccommodation: Entire PVT 3BR townhouse apt, Brooklyn.\u2764\ufe0f\u2764\ufe0f\u2764\ufe0f\u2764\ufe0f\u2764\ufe0f, Palm Springs, cost: $499, room type: Entire home/apt, house rules: No children under 10, minimum nights: 2, maximum occupancy: 4\n\nNumber of people: 1\nTotal cost: 1 x $316 + 1 x $50 + 1 x $499 = $865\nAccommodation minimum nights: 1/2\n\nDays: 2\nCurrent City: Palm Springs\nTransportation: -\nBreakfast: Sugar & Spice - Le Marche, Palm Springs, cost: $33, cuisines: Tea, French, Cafe\nAttraction: Palm Springs Art Museum, Palm Springs; Walk of the Stars Palm Springs; Moorten Botanical Garden, Palm Springs\nLunch: Kahill's Steak-Fish Chophouse, Palm Springs, cost: $38, cuisines: Cafe, Bakery, American\nDinner: Houndstooth Grill & Tavern, Palm Springs, cost: $47, cuisines: Tea, Pizza, BBQ, Mediterranean\nAccommodation: Entire PVT 3BR townhouse apt, Brooklyn.\u2764\ufe0f\u2764\ufe0f\u2764\ufe0f\u2764\ufe0f\u2764\ufe0f, Palm Springs, cost: $499, room type: Entire home/apt, house rules: No children under 10, minimum nights: 2, maximum occupancy: 4\n\nNumber of people: 1\nTotal cost: 1 x $33 + 1 x $38 + 1 x $47 + 1 x $499 = $617\nAccommodation minimum nights: 2/2\n\nDays: 3\nCurrent City: from Palm Springs to Denver\nTransportation: Flight Number: F3870469, from Palm Springs to Denver, Departure Time: 16:00, Arrival Time: 19:12, cost: $330\nBreakfast: Midnight Espresso, Palm Springs, cost: $35, cuisines: Bakery, Mediterranean, BBQ\nAttraction: Palm Springs Aerial Tramway, Palm Springs; Indian Canyons, Palm Springs\nLunch: Pizza Man, Palm Springs, cost: $55, cuisines: Tea, Italian, Fast Food, Cafe, American\nDinner: -\nAccommodation: -\n\nNumber of people: 1\nTotal cost: 1 x $330 + 1 x $35 + 1 x $55 = $420\n\nTotal cost across all days: $865 + $617 + $420 = $1,902\n\nThe revised travel plan is now within the specified budget of $2,200.", "gpt-4-1106-preview_direct_sole-planning_parsed_results": [{"day": 1, "current_city": "from Denver to Palm Springs", "transportation": "Flight Number: F3880936, from Denver to Palm Springs, Departure Time: 17:08, Arrival Time: 18:13", "breakfast": "-", "attraction": "-", "lunch": "-", "dinner": "Bar Gernika Basque Pub & Eatery, Palm Springs", "accommodation": "Entire PVT 3BR townhouse apt, Brooklyn.\u2764\ufe0f\u2764\ufe0f\u2764\ufe0f\u2764\ufe0f\u2764\ufe0f, Palm Springs"}, {"day": 2, "current_city": "Palm Springs", "transportation": "-", "breakfast": "Sugar & Spice - Le Marche, Palm Springs", "attraction": "Palm Springs Art Museum, Palm Springs;Walk of the Stars Palm Springs;Moorten Botanical Garden, Palm Springs", "lunch": "Kahill's Steak-Fish Chophouse, Palm Springs", "dinner": "Houndstooth Grill & Tavern, Palm Springs", "accommodation": "Entire PVT 3BR townhouse apt, Brooklyn.\u2764\ufe0f\u2764\ufe0f\u2764\ufe0f\u2764\ufe0f\u2764\ufe0f, Palm Springs"}, {"day": 3, "current_city": "from Palm Springs to Denver", "transportation": "Flight Number: F3870469, from Palm Springs to Denver, Departure Time: 16:00, Arrival Time: 19:12", "breakfast": "Midnight Espresso, Palm Springs", "attraction": "Palm Springs Aerial Tramway, Palm Springs;Indian Canyons, Palm Springs", "lunch": "Pizza Man, Palm Springs", "dinner": "-", "accommodation": "-"}]}]