[{"gpt-4-1106-preview_direct_sole-planning_results": "Travel Plan:\n\nDays: 1\nCurrent City: from Boston to Wilmington (North Carolina)\nTransportation: Taxi, from Boston to Wilmington, duration: 12 hours 27 mins, distance: 1,304 km, cost: 1304\nBreakfast: -\nAttraction: -\nLunch: -\nDinner: -\nAccommodation: Prime East Village location w/backyard garden!, Wilmington (North Carolina), cost: 978, maximum occupancy: 7, house rules: No pets & No smoking, minimum nights: 4\n\nNumber of people: 4\nTotal cost: 1 x 1304 + 1 x 978 = 2,282\nAccommodation minimum nights: 1/4\n\nDays: 2\nCurrent City: Wilmington (North Carolina)\nTransportation: -\nBreakfast: Azteca, Wilmington (North Carolina), cost: 56, cuisines: Cafe, Indian, BBQ\nAttraction: Bellamy Mansion Museum, Wilmington (North Carolina); Cape Fear Museum of History and Science, Wilmington (North Carolina); Wilmington Riverwalk, Wilmington (North Carolina)\nLunch: Bandit Burrito, Wilmington (North Carolina), cost: 26, cuisines: Desserts, French, Bakery, Fast Food, Seafood\nDinner: Moonie's Texas Barbecue, Wilmington (North Carolina), cost: 38, cuisines: Chinese, Bakery, Fast Food\nAccommodation: Prime East Village location w/backyard garden!, Wilmington (North Carolina), cost: 978, maximum occupancy: 7, house rules: No pets & No smoking, minimum nights: 4\n\nNumber of people: 4\nTotal cost: 4 x 56 + 4 x 26 + 4 x 38 + 1 x 978 = 1,586\nAccommodation minimum nights: 2/4\n\nDays: 3\nCurrent City: from Wilmington (North Carolina) to Charlotte (North Carolina)\nTransportation: Flight Number: F3666331, from Wilmington (North Carolina) to Charlotte (North Carolina), Departure Time: 14:30, Arrival Time: 15:30, cost: 38\nBreakfast: Dunkin' Donuts, Wilmington (North Carolina), cost: 25, cuisines: Desserts, Tea, Pizza, Italian, French\nAttraction: Airlie Gardens, Wilmington (North Carolina); Wilmington Railroad Museum, Wilmington (North Carolina)\nLunch: The Yellow Chef, Wilmington (North Carolina), cost: 45, cuisines: French, BBQ, Mediterranean, Fast Food\nDinner: -\nAccommodation: Elegant Studio Apt in Prospect Heights, Charlotte (North Carolina), cost: 640, maximum occupancy: 5, house rules: No parties, minimum nights: 2\n\nNumber of people: 4\nTotal cost: 4 x 38 + 4 x 25 + 4 x 45 + 1 x 640 = 1,132\nAccommodation minimum nights: 1/2\n\nDays: 4\nCurrent City: Charlotte (North Carolina)\nTransportation: -\nBreakfast: Olive Tree Cafe, Charlotte (North Carolina), cost: 23, cuisines: Tea, Chinese, Desserts\nAttraction: Freedom Park, Charlotte (North Carolina); Levine Museum of the New South, Charlotte (North Carolina); Discovery Place Science, Charlotte (North Carolina)\nLunch: Central Perk 7, Charlotte (North Carolina), cost: 87, cuisines: Pizza, Bakery, BBQ, Fast Food\nDinner: Subway, Charlotte (North Carolina), cost: 60, cuisines: Tea, Cafe, Mexican, Chinese, Seafood\nAccommodation: Elegant Studio Apt in Prospect Heights, Charlotte (North Carolina), cost: 640, maximum occupancy: 5, house rules: No parties, minimum nights: 2\n\nNumber of people: 4\nTotal cost: 4 x 23 + 4 x 87 + 4 x 60 + 1 x 640 = 1,368\nAccommodation minimum nights: 2/2\n\nDays: 5\nCurrent City: from Charlotte (North Carolina) to Boston\nTransportation: Flight Number: F3663441, from Charlotte (North Carolina) to Boston, Departure Time: 15:06, Arrival Time: 17:08, cost: 152\nBreakfast: Cafe Maple Street, Charlotte (North Carolina), cost: 91, cuisines: Fast Food, Tea, Italian\nAttraction: NASCAR Hall of Fame, Charlotte (North Carolina); The Mint Museum, Charlotte (North Carolina)\nLunch: Kylin Skybar, Charlotte (North Carolina), cost: 44, cuisines: Tea, Cafe, Pizza, Italian\nDinner: -\nAccommodation: -\n\nNumber of people: 4\nTotal cost: 4 x 152 + 4 x 91 + 4 x 44 = 1,144\n\nTotal cost across all days: 2,282 + 1,586 + 1,132 + 1,368 + 1,144 = 7,512\nCuisines: All cuisines constraints are satisfied.\nRoom Constraint: All accommodations selected are entire rooms that allow visitors, ensuring privacy and space for the group of 4.\nTransportation Constraint: All intra-city travel is managed via flights and taxi, so no self-driving is necessary.", "gpt-4-1106-preview_direct_sole-planning_parsed_results": [{"day": 1, "current_city": "from Boston to Wilmington (North Carolina)", "transportation": "Taxi, from Boston to Wilmington, duration: 12 hours 27 mins, distance: 1,304 km", "breakfast": "-", "attraction": "-", "lunch": "-", "dinner": "-", "accommodation": "Prime East Village location w/backyard garden!, Wilmington (North Carolina)"}, {"day": 2, "current_city": "Wilmington (North Carolina)", "transportation": "-", "breakfast": "Azteca, Wilmington (North Carolina)", "attraction": "Bellamy Mansion Museum, Wilmington (North Carolina);Cape Fear Museum of History and Science, Wilmington (North Carolina);Wilmington Riverwalk, Wilmington (North Carolina)", "lunch": "Bandit Burrito, Wilmington (North Carolina)", "dinner": "Moonie's Texas Barbecue, Wilmington (North Carolina)", "accommodation": "Prime East Village location w/backyard garden!, Wilmington (North Carolina)"}, {"day": 3, "current_city": "from Wilmington (North Carolina) to Charlotte (North Carolina)", "transportation": "Flight Number: F3666331, from Wilmington (North Carolina) to Charlotte (North Carolina), Departure Time: 14:30, Arrival Time: 15:30", "breakfast": "Dunkin' Donuts, Wilmington (North Carolina)", "attraction": "Airlie Gardens, Wilmington (North Carolina);Wilmington Railroad Museum, Wilmington (North Carolina)", "lunch": "The Yellow Chef, Wilmington (North Carolina)", "dinner": "-", "accommodation": "Elegant Studio Apt in Prospect Heights, Charlotte (North Carolina)"}, {"day": 4, "current_city": "Charlotte (North Carolina)", "transportation": "-", "breakfast": "Olive Tree Cafe, Charlotte (North Carolina)", "attraction": "Freedom Park, Charlotte (North Carolina);Levine Museum of the New South, Charlotte (North Carolina);Discovery Place Science, Charlotte (North Carolina)", "lunch": "Central Perk 7, Charlotte (North Carolina)", "dinner": "Subway, Charlotte (North Carolina)", "accommodation": "Elegant Studio Apt in Prospect Heights, Charlotte (North Carolina)"}, {"day": 5, "current_city": "from Charlotte (North Carolina) to Boston", "transportation": "Flight Number: F3663441, from Charlotte (North Carolina) to Boston, Departure Time: 15:06, Arrival Time: 17:08", "breakfast": "Cafe Maple Street, Charlotte (North Carolina)", "attraction": "NASCAR Hall of Fame, Charlotte (North Carolina);The Mint Museum, Charlotte (North Carolina)", "lunch": "Kylin Skybar, Charlotte (North Carolina)", "dinner": "-", "accommodation": "-"}]}]