[{"gpt-4-1106-preview_direct_sole-planning_results": "Travel Plan:\n\nDays: 1\nCurrent City: from Augusta to Abilene (Texas)\nTransportation: Self-driving, from Augusta to Abilene, duration: 15 hours 59 mins, distance: 1,782 km, cost: 89\nBreakfast: -\nAttraction: -\nLunch: -\nDinner: -\nAccommodation: Private 1BR with Private Bathroom feet from subway, Abilene (Texas), cost: 668, room type: Entire home/apt, house rules: No children under 10 & No visitors & No smoking, minimum nights: 1, maximum occupancy: 2\n\nNumber of people: 1\nTotal cost: 1 x 89 + 1 x 668 = 757\nAccommodation minimum nights: 1/1\n\nDays: 2\nCurrent City: Abilene (Texas)\nTransportation: -\nBreakfast: Thai Garden, Abilene (Texas), cost: 13, cuisines: Cafe, American, Desserts\nAttraction: The Grace Museum, Abilene (Texas); Frontier Texas!, Abilene (Texas); Abilene Zoo, Abilene (Texas)\nLunch: Crispy Crust, Abilene (Texas), cost: 54, cuisines: Desserts, Bakery, Cafe, American, Seafood\nDinner: Finger Licious, Abilene (Texas), cost: 35, cuisines: Fast Food, Cafe, BBQ, Seafood\nAccommodation: Private 1BR with Private Bathroom feet from subway, Abilene (Texas), cost: 668, room type: Entire home/apt, house rules: No children under 10 & No visitors & No smoking, minimum nights: 1, maximum occupancy: 2\n\nNumber of people: 1\nTotal cost: 1 x 13 + 1 x 54 + 1 x 35 + 1 x 668 = 770\nAccommodation minimum nights: 2/1\n\nDays: 3\nCurrent City: from Abilene (Texas) to Amarillo (Texas)\nTransportation: Self-driving, from Abilene to Amarillo, duration: 4 hours 10 mins, distance: 446 km, cost: 22\nBreakfast: -\nAttraction: -\nLunch: -\nDinner: -\nAccommodation: Harlem Humble Abode - 1 bedroom - Cute and Quaint, Amarillo (Texas), cost: 409, room type: Entire home/apt, house rules: No pets, minimum nights: 5, maximum occupancy: 3\n\nNumber of people: 1\nTotal cost: 1 x 22 + 1 x 409 = 431\nAccommodation minimum nights: 1/5\n\nDays: 4\nCurrent City: Amarillo (Texas)\nTransportation: -\nBreakfast: The Cinnamon Kitchen, Amarillo (Texas), cost: 69, cuisines: Desserts, Tea, Pizza, Chinese, Seafood\nAttraction: Cadillac Ranch, Amarillo (Texas); Amarillo Botanical Gardens, Amarillo (Texas); Amarillo Zoo, Amarillo (Texas)\nLunch: Komachi, Amarillo (Texas), cost: 71, cuisines: Desserts, Tea, Fast Food, Chinese, Mediterranean\nDinner: Sigree Global Grill, Amarillo (Texas), cost: 35, cuisines: Chinese, BBQ, Cafe, Desserts\nAccommodation: Harlem Humble Abode - 1 bedroom - Cute and Quaint, Amarillo (Texas), cost: 409, room type: Entire home/apt, house rules: No pets, minimum nights: 5, maximum occupancy: 3\n\nNumber of people: 1\nTotal cost: 1 x 69 + 1 x 71 + 1 x 35 + 1 x 409 = 584\nAccommodation minimum nights: 2/5\n\nDays: 5\nCurrent City: from Amarillo (Texas) to Lubbock (Texas)\nTransportation: Self-driving, from Amarillo to Lubbock, duration: 1 hour 47 mins, distance: 197 km, cost: 9\nBreakfast: -\nAttraction: -\nLunch: -\nDinner: -\nAccommodation: Private bedroom in UWS Apartment, Lubbock (Texas), cost: 709, room type: Private room, house rules: No visitors & No pets, minimum nights: 2, maximum occupancy: 2\n\nNumber of people: 1\nTotal cost: 1 x 9 + 1 x 709 = 718\nAccommodation minimum nights: 1/2\n\nDays: 6\nCurrent City: Lubbock (Texas)\nTransportation: -\nBreakfast: Cantinho da Gula, Lubbock (Texas), cost: 78, cuisines: Cafe, BBQ, Desserts, Italian\nAttraction: Buddy Holly Center, Lubbock (Texas); National Ranching Heritage Center, Lubbock (Texas); American Windmill Museum, Lubbock (Texas)\nLunch: Paris 6 Classique, Lubbock (Texas), cost: 91, cuisines: Desserts, Cafe, Pizza, Mexican, BBQ, Chinese\nDinner: 3 Squares Diner, Lubbock (Texas), cost: 73, cuisines: Pizza, Indian, Fast Food\nAccommodation: Private bedroom in UWS Apartment, Lubbock (Texas), cost: 709, room type: Private room, house rules: No visitors & No pets, minimum nights: 2, maximum occupancy: 2\n\nNumber of people: 1\nTotal cost: 1 x 78 + 1 x 91 + 1 x 73 + 1 x 709 = 951\nAccommodation minimum nights: 2/2\n\nDays: 7\nCurrent City: from Lubbock (Texas) to Augusta\nTransportation: Self-driving, from Lubbock to Augusta, duration: 18 hours 17 mins, distance: 2,047 km, cost: 102\nBreakfast: -\nAttraction: -\nLunch: -\nDinner: -\nAccommodation: -\n\nNumber of people: 1\nTotal cost: 1 x 102 = 102\n\nTotal cost across all days: 757 + 770 + 431 + 584 + 718 + 951 + 102 = 4,313\n\nCuisines: The prompt specifies no cuisines, so all cuisines constraints are satisfied.\nRoom Constraint: All accommodations selected are entire rooms or private rooms, ensuring privacy for the solo traveler.\nTransportation Constraint: All intra-city travel is managed via self-driving, as per the available options.\nHouse Rules: All accommodations selected meet the house rules specified in the listings.\n\nNote: The total cost slightly exceeds the budget by $213. Adjustments to the plan, such as changing accommodations or dining options, may be necessary to meet the budget constraint.", "gpt-4-1106-preview_direct_sole-planning_parsed_results": [{"day": 1, "current_city": "from Augusta to Abilene (Texas)", "transportation": "Self-driving, from Augusta to Abilene, duration: 15 hours 59 mins, distance: 1,782 km", "breakfast": "-", "attraction": "-", "lunch": "-", "dinner": "-", "accommodation": "Private 1BR with Private Bathroom feet from subway, Abilene (Texas)"}, {"day": 2, "current_city": "Abilene (Texas)", "transportation": "-", "breakfast": "Thai Garden, Abilene (Texas)", "attraction": "The Grace Museum, Abilene (Texas);Frontier Texas!, Abilene (Texas);Abilene Zoo, Abilene (Texas);", "lunch": "Crispy Crust, Abilene (Texas)", "dinner": "Finger Licious, Abilene (Texas)", "accommodation": "Private 1BR with Private Bathroom feet from subway, Abilene (Texas)"}, {"day": 3, "current_city": "from Abilene (Texas) to Amarillo (Texas)", "transportation": "Self-driving, from Abilene to Amarillo, duration: 4 hours 10 mins, distance: 446 km", "breakfast": "-", "attraction": "-", "lunch": "-", "dinner": "-", "accommodation": "Harlem Humble Abode - 1 bedroom - Cute and Quaint, Amarillo (Texas)"}, {"day": 4, "current_city": "Amarillo (Texas)", "transportation": "-", "breakfast": "The Cinnamon Kitchen, Amarillo (Texas)", "attraction": "Cadillac Ranch, Amarillo (Texas);Amarillo Botanical Gardens, Amarillo (Texas);Amarillo Zoo, Amarillo (Texas);", "lunch": "Komachi, Amarillo (Texas)", "dinner": "Sigree Global Grill, Amarillo (Texas)", "accommodation": "Harlem Humble Abode - 1 bedroom - Cute and Quaint, Amarillo (Texas)"}, {"day": 5, "current_city": "from Amarillo (Texas) to Lubbock (Texas)", "transportation": "Self-driving, from Amarillo to Lubbock, duration: 1 hour 47 mins, distance: 197 km", "breakfast": "-", "attraction": "-", "lunch": "-", "dinner": "-", "accommodation": "Private bedroom in UWS Apartment, Lubbock (Texas)"}, {"day": 6, "current_city": "Lubbock (Texas)", "transportation": "-", "breakfast": "Cantinho da Gula, Lubbock (Texas)", "attraction": "Buddy Holly Center, Lubbock (Texas);National Ranching Heritage Center, Lubbock (Texas);American Windmill Museum, Lubbock (Texas);", "lunch": "Paris 6 Classique, Lubbock (Texas)", "dinner": "3 Squares Diner, Lubbock (Texas)", "accommodation": "Private bedroom in UWS Apartment, Lubbock (Texas)"}, {"day": 7, "current_city": "from Lubbock (Texas) to Augusta", "transportation": "Self-driving, from Lubbock to Augusta, duration: 18 hours 17 mins, distance: 2,047 km", "breakfast": "-", "attraction": "-", "lunch": "-", "dinner": "-", "accommodation": "-"}]}]