[{"gpt-4-1106-preview_direct_sole-planning_results": "Travel Plan:\n\nDays: 1\nCurrent City: from Washington to Norfolk (Virginia)\nTransportation: Flight Number: F3785353, from Washington to Norfolk (Virginia), Departure Time: 08:30, Arrival Time: 09:18, cost: 63\nBreakfast: -\nAttraction: -\nLunch: -\nDinner: -\nAccommodation: The Center Suites, Norfolk (Virginia), cost: 1190, room type: Entire home/apt, house rules: No pets & No parties & No visitors, minimum nights: 2, maximum occupancy: 10\n\nNumber of people: 1\nTotal cost: 1 x 63 + 1 x 1190 = 1,253\nAccommodation minimum nights: 1/2\n\nDays: 2\nCurrent City: Norfolk (Virginia)\nTransportation: -\nBreakfast: Sonya Bakery Cafe, Norfolk (Virginia), cost: 32, cuisines: Pizza, Indian, BBQ\nAttraction: Norfolk Botanical Garden, Norfolk (Virginia); Nauticus, Norfolk (Virginia); Chrysler Museum of Art, Norfolk (Virginia)\nLunch: Henry Campbell's Steakhouse, Norfolk (Virginia), cost: 83, cuisines: Chinese, Cafe, Seafood\nDinner: Game n Grillz, Norfolk (Virginia), cost: 59, cuisines: Mexican, Bakery, Cafe, American, Seafood\nAccommodation: The Center Suites, Norfolk (Virginia), cost: 1190, room type: Entire home/apt, house rules: No pets & No parties & No visitors, minimum nights: 2, maximum occupancy: 10\n\nNumber of people: 1\nTotal cost: 1 x 32 + 1 x 83 + 1 x 59 + 1 x 1190 = 1,364\nAccommodation minimum nights: 2/2\n\nDays: 3\nCurrent City: from Norfolk (Virginia) to Lynchburg (Virginia)\nTransportation: self-driving, from Norfolk to Lynchburg, duration: 3 hours 27 mins, distance: 306 km, cost: 15\nBreakfast: -\nAttraction: -\nLunch: -\nDinner: -\nAccommodation: Design Hideaway in a Classic Brooklyn Townhouse, Lynchburg (Virginia), cost: 216, room type: Entire home/apt, house rules: No smoking, minimum nights: 4, maximum occupancy: 3\n\nNumber of people: 1\nTotal cost: 1 x 15 + 1 x 216 = 231\nAccommodation minimum nights: 1/4\n\nDays: 4\nCurrent City: Lynchburg (Virginia)\nTransportation: -\nBreakfast: Khyen Chyen, Lynchburg (Virginia), cost: 30, cuisines: Cafe, Bakery, Mediterranean, Desserts\nAttraction: Amazement Square, Lynchburg (Virginia); Point of Honor, Lynchburg (Virginia); The Anne Spencer House & Garden Museum, Lynchburg (Virginia)\nLunch: The BrewMaster, Lynchburg (Virginia), cost: 87, cuisines: Tea, Chinese, BBQ, Fast Food\nDinner: Pirates Of Grill, Lynchburg (Virginia), cost: 71, cuisines: Tea, Pizza, American, Seafood\nAccommodation: Design Hideaway in a Classic Brooklyn Townhouse, Lynchburg (Virginia), cost: 216, room type: Entire home/apt, house rules: No smoking, minimum nights: 4, maximum occupancy: 3\n\nNumber of people: 1\nTotal cost: 1 x 30 + 1 x 87 + 1 x 71 + 1 x 216 = 404\nAccommodation minimum nights: 2/4\n\nDays: 5\nCurrent City: from Lynchburg (Virginia) to Washington\nTransportation: self-driving, from Lynchburg to Washington, duration: 3 hours 19 mins, distance: 291 km, cost: 14\nBreakfast: -\nAttraction: -\nLunch: -\nDinner: -\nAccommodation: -\n\nNumber of people: 1\nTotal cost: 1 x 14 = 14\n\nTotal cost across all days: 1,253 + 1,364 + 231 + 404 + 14 = 3,266\n\nUnfortunately, the total cost of $3,266 exceeds the specified budget of $2,200. Adjustments must be made to the travel plan to meet the budget constraints. This could involve changing accommodations to more affordable options, reducing the number of attractions visited, or selecting less expensive dining options. Please advise on which aspects of the trip are flexible for adjustment.", "gpt-4-1106-preview_direct_sole-planning_parsed_results": [{"day": 1, "current_city": "from Washington to Norfolk (Virginia)", "transportation": "Flight Number: F3785353, from Washington to Norfolk (Virginia), Departure Time: 08:30, Arrival Time: 09:18", "breakfast": "-", "attraction": "-", "lunch": "-", "dinner": "-", "accommodation": "The Center Suites, Norfolk (Virginia)"}, {"day": 2, "current_city": "Norfolk (Virginia)", "transportation": "-", "breakfast": "Sonya Bakery Cafe, Norfolk (Virginia)", "attraction": "Norfolk Botanical Garden, Norfolk (Virginia);Nauticus, Norfolk (Virginia);Chrysler Museum of Art, Norfolk (Virginia);", "lunch": "Henry Campbell's Steakhouse, Norfolk (Virginia)", "dinner": "Game n Grillz, Norfolk (Virginia)", "accommodation": "The Center Suites, Norfolk (Virginia)"}, {"day": 3, "current_city": "from Norfolk (Virginia) to Lynchburg (Virginia)", "transportation": "self-driving, from Norfolk to Lynchburg, duration: 3 hours 27 mins, distance: 306 km", "breakfast": "-", "attraction": "-", "lunch": "-", "dinner": "-", "accommodation": "Design Hideaway in a Classic Brooklyn Townhouse, Lynchburg (Virginia)"}, {"day": 4, "current_city": "Lynchburg (Virginia)", "transportation": "-", "breakfast": "Khyen Chyen, Lynchburg (Virginia)", "attraction": "Amazement Square, Lynchburg (Virginia);Point of Honor, Lynchburg (Virginia);The Anne Spencer House & Garden Museum, Lynchburg (Virginia);", "lunch": "The BrewMaster, Lynchburg (Virginia)", "dinner": "Pirates Of Grill, Lynchburg (Virginia)", "accommodation": "Design Hideaway in a Classic Brooklyn Townhouse, Lynchburg (Virginia)"}, {"day": 5, "current_city": "from Lynchburg (Virginia) to Washington", "transportation": "self-driving, from Lynchburg to Washington, duration: 3 hours 19 mins, distance: 291 km", "breakfast": "-", "attraction": "-", "lunch": "-", "dinner": "-", "accommodation": "-"}]}]