[{"gpt-4-1106-preview_direct_sole-planning_results": "Travel Plan:\n\nDays: 1\nCurrent City: from Reno to Abilene (Texas)\nTransportation: Self-driving, from Reno to Abilene, duration: 22 hours 27 mins, distance: 2,412 km, cost: 120\nBreakfast: -\nAttraction: -\nLunch: -\nDinner: -\nAccommodation: Apartment minutes from manhattan, Abilene (Texas), cost: 295, room type: Entire home/apt, house rules: No pets & No visitors, minimum nights: 2, maximum occupancy: 2\n\nNumber of people: 2\nTotal cost: 2 x 120 + 1 x 295 = 535\nAccommodation minimum nights: 1/2\n\nDays: 2\nCurrent City: Abilene (Texas)\nTransportation: -\nBreakfast: Thai Garden, Abilene (Texas), cost: 13, cuisines: Cafe, American, Desserts\nAttraction: The Grace Museum, Frontier Texas!, Historic Fort Phantom Hill\nLunch: Mediumwelldone, Abilene (Texas), cost: 91, cuisines: Tea, French, BBQ, Cafe, Seafood\nDinner: Crispy Crust, Abilene (Texas), cost: 54, cuisines: Desserts, Bakery, Cafe, American, Seafood\nAccommodation: Apartment minutes from manhattan, Abilene (Texas), cost: 295, room type: Entire home/apt, house rules: No pets & No visitors, minimum nights: 2, maximum occupancy: 2\n\nNumber of people: 2\nTotal cost: 2 x 13 + 2 x 91 + 2 x 54 + 1 x 295 = 611\nAccommodation minimum nights: 2/2\n\nDays: 3\nCurrent City: from Abilene to Amarillo (Texas)\nTransportation: Self-driving, from Abilene to Amarillo, duration: 4 hours 10 mins, distance: 446 km, cost: 22\nBreakfast: -\nAttraction: -\nLunch: -\nDinner: -\nAccommodation: Harlem Humble Abode - 1 bedroom - Cute and Quaint, Amarillo (Texas), cost: 409, room type: Entire home/apt, house rules: No pets, minimum nights: 5, maximum occupancy: 3\n\nNumber of people: 2\nTotal cost: 2 x 22 + 1 x 409 = 453\nAccommodation minimum nights: 1/5\n\nDays: 4\nCurrent City: Amarillo (Texas)\nTransportation: -\nBreakfast: The Cinnamon Kitchen, Amarillo (Texas), cost: 69, cuisines: Desserts, Tea, Pizza, Chinese, Seafood\nAttraction: Cadillac Ranch, Amarillo Botanical Gardens, Amarillo Zoo\nLunch: Komachi, Amarillo (Texas), cost: 71, cuisines: Desserts, Tea, Fast Food, Chinese, Mediterranean\nDinner: Anand Restaurant, Amarillo (Texas), cost: 53, cuisines: Fast Food, Seafood, Desserts, Italian\nAccommodation: Harlem Humble Abode - 1 bedroom - Cute and Quaint, Amarillo (Texas), cost: 409, room type: Entire home/apt, house rules: No pets, minimum nights: 5, maximum occupancy: 3\n\nNumber of people: 2\nTotal cost: 2 x 69 + 2 x 71 + 2 x 53 + 1 x 409 = 795\nAccommodation minimum nights: 2/5\n\nDays: 5\nCurrent City: from Amarillo to Lubbock (Texas)\nTransportation: Self-driving, from Amarillo to Lubbock, duration: 1 hour 47 mins, distance: 197 km, cost: 9\nBreakfast: -\nAttraction: -\nLunch: -\nDinner: -\nAccommodation: Private bedroom in UWS Apartment, Lubbock (Texas), cost: 709, room type: Private room, house rules: No visitors & No pets, minimum nights: 2, maximum occupancy: 2\n\nNumber of people: 2\nTotal cost: 2 x 9 + 1 x 709 = 727\nAccommodation minimum nights: 1/2\n\nDays: 6\nCurrent City: Lubbock (Texas)\nTransportation: -\nBreakfast: Paris 6 Classique, Lubbock (Texas), cost: 91, cuisines: Desserts, Cafe, Pizza, Mexican, BBQ, Chinese\nAttraction: Buddy Holly Center, National Ranching Heritage Center, American Windmill Museum\nLunch: Grand Barbeque Buffet Restaurant, Lubbock (Texas), cost: 20, cuisines: Tea, French, Fast Food, Cafe, Seafood\nDinner: Mosaic - Country Inn & Suites By Carlson, Lubbock (Texas), cost: 29, cuisines: Chinese, Indian, Desserts, Seafood\nAccommodation: Private bedroom in UWS Apartment, Lubbock (Texas), cost: 709, room type: Private room, house rules: No visitors & No pets, minimum nights: 2, maximum occupancy: 2\n\nNumber of people: 2\nTotal cost: 2 x 91 + 2 x 20 + 2 x 29 + 1 x 709 = 989\nAccommodation minimum nights: 2/2\n\nDays: 7\nCurrent City: from Lubbock to Reno\nTransportation: Self-driving, from Lubbock to Reno, duration: 20 hours 3 mins, distance: 2,145 km, cost: 107\nBreakfast: -\nAttraction: -\nLunch: -\nDinner: -\nAccommodation: -\n\nNumber of people: 2\nTotal cost: 2 x 107 = 214\n\nTotal cost across all days: 535 + 611 + 453 + 795 + 727 + 989 + 214 = 4,324\n\nCuisines: The itinerary includes a variety of cuisines as requested: Chinese, French, American, and Mediterranean.\nRoom Constraint: All accommodations selected are entire rooms or private rooms that adhere to house rules regarding visitors.\nTransportation Constraint: All intra-city travel is managed via self-driving, as per the available options.\n\nNote: The total cost slightly exceeds the budget by $24. If this is not acceptable, adjustments can be made by selecting a different accommodation or reducing meal costs on one of the days.", "gpt-4-1106-preview_direct_sole-planning_parsed_results": [{"day": 1, "current_city": "from Reno to Abilene", "transportation": "Self-driving, from Reno to Abilene, duration: 22 hours 27 mins, distance: 2,412 km", "breakfast": "-", "attraction": "-", "lunch": "-", "dinner": "-", "accommodation": "Apartment minutes from manhattan, Abilene"}, {"day": 2, "current_city": "Abilene", "transportation": "-", "breakfast": "Thai Garden, Abilene", "attraction": "The Grace Museum, Abilene;Frontier Texas!, Abilene;Historic Fort Phantom Hill, Abilene;", "lunch": "Mediumwelldone, Abilene", "dinner": "Crispy Crust, Abilene", "accommodation": "Apartment minutes from manhattan, Abilene"}, {"day": 3, "current_city": "from Abilene to Amarillo", "transportation": "Self-driving, from Abilene to Amarillo, duration: 4 hours 10 mins, distance: 446 km", "breakfast": "-", "attraction": "-", "lunch": "-", "dinner": "-", "accommodation": "Harlem Humble Abode - 1 bedroom - Cute and Quaint, Amarillo"}, {"day": 4, "current_city": "Amarillo", "transportation": "-", "breakfast": "The Cinnamon Kitchen, Amarillo", "attraction": "Cadillac Ranch, Amarillo;Amarillo Botanical Gardens, Amarillo;Amarillo Zoo, Amarillo;", "lunch": "Komachi, Amarillo", "dinner": "Anand Restaurant, Amarillo", "accommodation": "Harlem Humble Abode - 1 bedroom - Cute and Quaint, Amarillo"}, {"day": 5, "current_city": "from Amarillo to Lubbock", "transportation": "Self-driving, from Amarillo to Lubbock, duration: 1 hour 47 mins, distance: 197 km", "breakfast": "-", "attraction": "-", "lunch": "-", "dinner": "-", "accommodation": "Private bedroom in UWS Apartment, Lubbock"}, {"day": 6, "current_city": "Lubbock", "transportation": "-", "breakfast": "Paris 6 Classique, Lubbock", "attraction": "Buddy Holly Center, Lubbock;National Ranching Heritage Center, Lubbock;American Windmill Museum, Lubbock;", "lunch": "Grand Barbeque Buffet Restaurant, Lubbock", "dinner": "Mosaic - Country Inn & Suites By Carlson, Lubbock", "accommodation": "Private bedroom in UWS Apartment, Lubbock"}, {"day": 7, "current_city": "from Lubbock to Reno", "transportation": "Self-driving, from Lubbock to Reno, duration: 20 hours 3 mins, distance: 2,145 km", "breakfast": "-", "attraction": "-", "lunch": "-", "dinner": "-", "accommodation": "-"}]}]