[{"gpt-4-1106-preview_direct_sole-planning_results": "Travel Plan:\n\nDays: 1\nCurrent City: from Richmond to Nashville (Tennessee)\nTransportation: Self-driving, from Richmond to Nashville, duration: 9 hours 3 mins, distance: 989 km, cost: 49\nBreakfast: -\nAttraction: -\nLunch: -\nDinner: -\nAccommodation: Huge 2 Bedroom, Great Location, Express Metro, Nashville (Tennessee), cost: 745, maximum occupancy: 4, house rules: No smoking & No children under 10 & No pets, minimum nights: 4\n\nNumber of people: 1 (assumed as not specified)\nTotal cost: 1 x 49 + 1 x 745 = 794\nAccommodation minimum nights: 1/4\n\nDays: 2\nCurrent City: Nashville (Tennessee)\nTransportation: -\nBreakfast: Bangkok 1, Nashville (Tennessee), cost: 44, cuisines: Cafe, Seafood\nAttraction: Country Music Hall of Fame and Museum, Nashville (Tennessee); Nashville Zoo at Grassmere, Nashville (Tennessee); Belle Meade Historic Site & Winery, Nashville (Tennessee)\nLunch: Bablu Fast Food, Nashville (Tennessee), cost: 13, cuisines: Desserts, Pizza, Mexican, BBQ, Fast Food\nDinner: Full Dabba, Nashville (Tennessee), cost: 77, cuisines: Pizza, Mexican, Fast Food, Cafe, American\nAccommodation: Huge 2 Bedroom, Great Location, Express Metro, Nashville (Tennessee), cost: 745, maximum occupancy: 4, house rules: No smoking & No children under 10 & No pets, minimum nights: 4\n\nNumber of people: 1 (assumed as not specified)\nTotal cost: 1 x 44 + 1 x 13 + 1 x 77 + 1 x 745 = 879\nAccommodation minimum nights: 2/4\n\nDays: 3\nCurrent City: Nashville (Tennessee)\nTransportation: -\nBreakfast: Twigly, Nashville (Tennessee), cost: 14, cuisines: Pizza, French, Fast Food, Chinese, Seafood\nAttraction: Johnny Cash Museum, Nashville (Tennessee); Centennial Park, Nashville (Tennessee); Grand Ole Opry, Nashville (Tennessee)\nLunch: Veg Hut, Nashville (Tennessee), cost: 35, cuisines: Tea, Mexican, Seafood\nDinner: The Toddy Shop, Nashville (Tennessee), cost: 92, cuisines: Desserts, Fast Food\nAccommodation: Huge 2 Bedroom, Great Location, Express Metro, Nashville (Tennessee), cost: 745, maximum occupancy: 4, house rules: No smoking & No children under 10 & No pets, minimum nights: 4\n\nNumber of people: 1 (assumed as not specified)\nTotal cost: 1 x 14 + 1 x 35 + 1 x 92 + 1 x 745 = 886\nAccommodation minimum nights: 3/4\n\nDays: 4\nCurrent City: from Nashville (Tennessee) to Knoxville (Tennessee)\nTransportation: Self-driving, from Nashville to Knoxville, duration: 2 hours 42 mins, distance: 290 km, cost: 14\nBreakfast: GoGourmet, Nashville (Tennessee), cost: 34, cuisines: Tea, Cafe, Indian, Mediterranean\nAttraction: Frist Art Museum, Nashville (Tennessee); The Parthenon, Nashville (Tennessee)\nLunch: Kitchen King, Nashville (Tennessee), cost: 13, cuisines: Pizza, Italian, BBQ, Cafe, Mediterranean\nDinner: -\nAccommodation: Beautiful 1- bdrm apt in tranquil Inwood building, Knoxville (Tennessee), cost: 1091, maximum occupancy: 4, house rules: No smoking & No pets, minimum nights: 2\n\nNumber of people: 1 (assumed as not specified)\nTotal cost: 1 x 14 + 1 x 34 + 1 x 13 + 1 x 1091 = 1152\nAccommodation minimum nights: 1/2\n\nDays: 5\nCurrent City: from Knoxville (Tennessee) to Richmond\nTransportation: Self-driving, from Knoxville to Richmond, duration: 6 hours 23 mins, distance: 701 km, cost: 35\nBreakfast: Cafe Arabelle, Knoxville (Tennessee), cost: 29, cuisines: French, BBQ, Desserts, Seafood\nAttraction: World's Fair Park, Knoxville (Tennessee); Knoxville Museum of Art, Knoxville (Tennessee)\nLunch: Les 3 Brasseurs, Knoxville (Tennessee), cost: 24, cuisines: Desserts, Pizza, Italian, Cafe, Indian\nDinner: -\nAccommodation: -\n\nNumber of people: 1 (assumed as not specified)\nTotal cost: 1 x 35 + 1 x 29 + 1 x 24 = 88\n\nTotal cost across all days: 794 + 879 + 886 + 1152 + 88 = 3799\n\nUnfortunately, the total cost of $3,799 exceeds the specified budget of $2,600. Adjustments to the plan, such as changing accommodations or reducing meal costs, would be necessary to meet the budget constraint. However, given the provided data, it is not possible to create a plan that fits within the budget while also meeting all the constraints.", "gpt-4-1106-preview_direct_sole-planning_parsed_results": [{"day": 1, "current_city": "from Richmond to Nashville", "transportation": "Self-driving, from Richmond to Nashville, duration: 9 hours 3 mins, distance: 989 km", "breakfast": "-", "attraction": "-", "lunch": "-", "dinner": "-", "accommodation": "Huge 2 Bedroom, Great Location, Express Metro, Nashville"}, {"day": 2, "current_city": "Nashville", "transportation": "-", "breakfast": "Bangkok 1, Nashville", "attraction": "Country Music Hall of Fame and Museum, Nashville;Nashville Zoo at Grassmere, Nashville;Belle Meade Historic Site & Winery, Nashville;", "lunch": "Bablu Fast Food, Nashville", "dinner": "Full Dabba, Nashville", "accommodation": "Huge 2 Bedroom, Great Location, Express Metro, Nashville"}, {"day": 3, "current_city": "Nashville", "transportation": "-", "breakfast": "Twigly, Nashville", "attraction": "Johnny Cash Museum, Nashville;Centennial Park, Nashville;Grand Ole Opry, Nashville;", "lunch": "Veg Hut, Nashville", "dinner": "The Toddy Shop, Nashville", "accommodation": "Huge 2 Bedroom, Great Location, Express Metro, Nashville"}, {"day": 4, "current_city": "from Nashville to Knoxville", "transportation": "Self-driving, from Nashville to Knoxville, duration: 2 hours 42 mins, distance: 290 km", "breakfast": "GoGourmet, Nashville", "attraction": "Frist Art Museum, Nashville;The Parthenon, Nashville;", "lunch": "Kitchen King, Nashville", "dinner": "-", "accommodation": "Beautiful 1- bdrm apt in tranquil Inwood building, Knoxville"}, {"day": 5, "current_city": "from Knoxville to Richmond", "transportation": "Self-driving, from Knoxville to Richmond, duration: 6 hours 23 mins, distance: 701 km", "breakfast": "Cafe Arabelle, Knoxville", "attraction": "World's Fair Park, Knoxville;Knoxville Museum of Art, Knoxville;", "lunch": "Les 3 Brasseurs, Knoxville", "dinner": "-", "accommodation": "-"}]}]