[{"gpt-4-1106-preview_direct_sole-planning_results": "Travel Plan:\n\nDays: 1\nCurrent City: from Chicago to Albuquerque\nTransportation: Flight Number: F4005732, from Chicago to Albuquerque, Departure Time: 08:23, Arrival Time: 10:14, cost: $260\nBreakfast: -\nAttraction: -\nLunch: Cantina Famiglia Mancini, Albuquerque, cost: $40, cuisines: Tea, Cafe, Desserts\nDinner: Thatcher's Barbeque and Grill, Albuquerque, cost: $30, cuisines: Seafood, BBQ, Desserts, Fast Food\nAccommodation: Harlem apartment, Albuquerque, cost: $133, room type: Private room, house rules: No pets, minimum nights: 1, maximum occupancy: 1\n\nNumber of people: 3\nTotal cost: 3 x $260 (flights) + 3 x $40 (lunch) + 3 x $30 (dinner) + 3 x $133 (accommodation) = $780 + $120 + $90 + $399 = $1,389\nAccommodation minimum nights: 1/1\n\nDays: 2\nCurrent City: Albuquerque\nTransportation: -\nBreakfast: Genghis Grill, Albuquerque, cost: $24, cuisines: BBQ, Desserts, Italian\nAttraction: New Mexico Museum of Natural History and Science, Albuquerque; Albuquerque Museum, Albuquerque; Explora Science Center and Children's Museum of Albuquerque, Albuquerque\nLunch: Punjab Grill, Albuquerque, cost: $26, cuisines: Desserts, Cafe, Italian, Bakery, Chinese, Seafood\nDinner: Barbeque Nation, Albuquerque, cost: $85, cuisines: Bakery, BBQ, Desserts\nAccommodation: Good Access to Everywhere:)Bushwick, Brooklyn NY, Albuquerque, cost: $197, room type: Private room, house rules: No children under 10, minimum nights: 1, maximum occupancy: 2\n\nNumber of people: 3\nTotal cost: 3 x $24 (breakfast) + 3 x $26 (lunch) + 3 x $85 (dinner) + 2 x $197 (accommodation, one room shared by two people and one single room) = $72 + $78 + $255 + $394 = $799\nAccommodation minimum nights: 1/1\n\nDays: 3\nCurrent City: from Albuquerque to Chicago\nTransportation: Flight Number: F3603216, from Albuquerque to Chicago, Departure Time: 16:00, Arrival Time: 19:48, cost: $464\nBreakfast: The Hudson Cafe, Albuquerque, cost: $43, cuisines: Pizza, French, Bakery, Fast Food, Cafe\nAttraction: Petroglyph National Monument, Albuquerque; ABQ BioPark - Botanic Garden, Albuquerque\nLunch: Sita Ram Diwan Chand, Albuquerque, cost: $44, cuisines: Tea, Mexican, Fast Food, Cafe, American, Seafood\nDinner: -\nAccommodation: -\n\nNumber of people: 3\nTotal cost: 3 x $464 (flights) + 3 x $43 (breakfast) + 3 x $44 (lunch) = $1,392 + $129 + $132 = $1,653\nAccommodation minimum nights: -\n\nTotal cost across all days: $1,389 + $799 + $1,653 = $3,841\n\nNote: The total cost exceeds the specified budget of $1,600. Adjustments are needed to meet the budget constraint. Possible adjustments include selecting cheaper flights or accommodations, or reducing meal costs.\n\nCuisines: The prompt specifies no cuisines, so all cuisines constraints are satisfied.\nRoom Constraint: All accommodations selected are private rooms, ensuring privacy for the party of 3.\nTransportation Constraint: All travel between cities is managed via flights, as per the available data.\n\nPlease note that the provided budget is not sufficient to cover the costs of the flights, meals, and accommodations as per the given data. The travel plan would need to be adjusted to either increase the budget or reduce the costs by selecting different options or excluding certain meals or attractions.", "gpt-4-1106-preview_direct_sole-planning_parsed_results": [{"day": 1, "current_city": "from Chicago to Albuquerque", "transportation": "Flight Number: F4005732, from Chicago to Albuquerque, Departure Time: 08:23, Arrival Time: 10:14", "breakfast": "-", "attraction": "-", "lunch": "Cantina Famiglia Mancini, Albuquerque", "dinner": "Thatcher's Barbeque and Grill, Albuquerque", "accommodation": "Harlem apartment, Albuquerque"}, {"day": 2, "current_city": "Albuquerque", "transportation": "-", "breakfast": "Genghis Grill, Albuquerque", "attraction": "New Mexico Museum of Natural History and Science, Albuquerque;Albuquerque Museum, Albuquerque;Explora Science Center and Children's Museum of Albuquerque, Albuquerque", "lunch": "Punjab Grill, Albuquerque", "dinner": "Barbeque Nation, Albuquerque", "accommodation": "Good Access to Everywhere:)Bushwick, Brooklyn NY, Albuquerque"}, {"day": 3, "current_city": "from Albuquerque to Chicago", "transportation": "Flight Number: F3603216, from Albuquerque to Chicago, Departure Time: 16:00, Arrival Time: 19:48", "breakfast": "The Hudson Cafe, Albuquerque", "attraction": "Petroglyph National Monument, Albuquerque;ABQ BioPark - Botanic Garden, Albuquerque", "lunch": "Sita Ram Diwan Chand, Albuquerque", "dinner": "-", "accommodation": "-"}]}]