[{"gpt-4-1106-preview_direct_sole-planning_results": "Travel Plan:\n\nDays: 1\nCurrent City: from West Palm Beach to White Plains\nTransportation: Flight Number: F3756085, from West Palm Beach to White Plains, Departure Time: 05:58, Arrival Time: 08:48, cost: $515\nBreakfast: -\nAttraction: -\nLunch: Kinoshita, White Plains, cost: $42, cuisines: Tea, Pizza, Fast Food, American, Seafood\nDinner: El Cazador, White Plains, cost: $90, cuisines: Mexican, Pizza, BBQ\nAccommodation: Large Opulent Studio Apartment Near Prospect Park, White Plains, cost: $465, room type: Entire home/apt, house rules: No children under 10, minimum nights: 4, maximum occupancy: 3\n\nNumber of people: 2\nTotal cost: 2 x $515 + 2 x $42 + 2 x $90 + 1 x $465 = $1,759\nAccommodation minimum nights: 1/4\n\nDays: 2\nCurrent City: White Plains\nTransportation: -\nBreakfast: Six Pack Kitchen, White Plains, cost: $58, cuisines: Chinese, Mexican, Desserts, Seafood\nAttraction: LEGOLAND Discovery Center Westchester, White Plains; Kensico Dam Plaza, White Plains\nLunch: Aravalli Owls, White Plains, cost: $26, cuisines: Pizza, Mediterranean, BBQ\nDinner: Sadhana Restaurant, White Plains, cost: $84, cuisines: Desserts, Tea, Italian, French, Seafood\nAccommodation: Large Opulent Studio Apartment Near Prospect Park, White Plains, cost: $465, room type: Entire home/apt, house rules: No children under 10, minimum nights: 4, maximum occupancy: 3\n\nNumber of people: 2\nTotal cost: 2 x $58 + 2 x $26 + 2 x $84 + 1 x $465 = $801\nAccommodation minimum nights: 2/4\n\nDays: 3\nCurrent City: from White Plains to West Palm Beach\nTransportation: Flight Number: F3759006, from White Plains to West Palm Beach, Departure Time: 15:51, Arrival Time: 18:41, cost: $321\nBreakfast: Costa Coffee, White Plains, cost: $43, cuisines: Cafe, Pizza, American, Italian\nAttraction: The Puzzle Parlour, White Plains; Neuberger Museum of Art, White Plains\nLunch: Mughals Rasoi, White Plains, cost: $92, cuisines: Tea, Pizza, Fast Food, Cafe, Mediterranean\nDinner: -\nAccommodation: -\n\nNumber of people: 2\nTotal cost: 2 x $321 + 2 x $43 + 2 x $92 = $910\n\nTotal cost across all days: $1,759 + $801 + $910 = $3,470\n\nUnfortunately, the total cost exceeds the specified budget of $2,600. Adjustments need to be made to the travel plan to fit within the budget. Here is a revised plan that fits within the budget:\n\nRevised Travel Plan:\n\nDays: 1\nCurrent City: from West Palm Beach to White Plains\nTransportation: Flight Number: F3756085, from West Palm Beach to White Plains, Departure Time: 05:58, Arrival Time: 08:48, cost: $515\nBreakfast: -\nAttraction: -\nLunch: Kinoshita, White Plains, cost: $42, cuisines: Tea, Pizza, Fast Food, American, Seafood\nDinner: El Cazador, White Plains, cost: $90, cuisines: Mexican, Pizza, BBQ\nAccommodation: Quiet East Village Studio next to snug coffee shop, White Plains, cost: $708, room type: Entire home/apt, house rules: No visitors & No children under 10 & No smoking, minimum nights: 10, maximum occupancy: 6\n\nNumber of people: 2\nTotal cost: 2 x $515 + 2 x $42 + 2 x $90 + 1 x $708 = $2,002\nAccommodation minimum nights: 1/10\n\nDays: 2\nCurrent City: White Plains\nTransportation: -\nBreakfast: Six Pack Kitchen, White Plains, cost: $58, cuisines: Chinese, Mexican, Desserts, Seafood\nAttraction: LEGOLAND Discovery Center Westchester, White Plains; Kensico Dam Plaza, White Plains\nLunch: Aravalli Owls, White Plains, cost: $26, cuisines: Pizza, Mediterranean, BBQ\nDinner: Sadhana Restaurant, White Plains, cost: $84, cuisines: Desserts, Tea, Italian, French, Seafood\nAccommodation: Quiet East Village Studio next to snug coffee shop, White Plains, cost: $708, room type: Entire home/apt, house rules: No visitors & No children under 10 & No smoking, minimum nights: 10, maximum occupancy: 6\n\nNumber of people: 2\nTotal cost: 2 x $58 + 2 x $26 + 2 x $84 + 1 x $708 = $1,044\nAccommodation minimum nights: 2/10\n\nDays: 3\nCurrent City: from White Plains to West Palm Beach\nTransportation: Flight Number: F3759006, from White Plains to West Palm Beach, Departure Time: 15:51, Arrival Time: 18:41, cost: $321\nBreakfast: Costa Coffee, White Plains, cost: $43, cuisines: Cafe, Pizza, American, Italian\nAttraction: The Puzzle Parlour, White Plains; Neuberger Museum of Art, White Plains\nLunch: Mughals Rasoi, White Plains, cost: $92, cuisines: Tea, Pizza, Fast Food, Cafe, Mediterranean\nDinner: -\nAccommodation: -\n\nNumber of people: 2\nTotal cost: 2 x $321 + 2 x $43 + 2 x $92 = $910\n\nTotal cost across all days: $2,002 + $1,044 + $910 = $3,956\n\nThe revised plan still exceeds the budget. To fit within the budget, we need to choose the cheapest flight options and reduce meal costs. Here is the final revised plan within the budget:\n\nFinal Revised Travel Plan:\n\nDays: 1\nCurrent City: from West Palm Beach to White Plains\nTransportation: Flight Number: F3765519, from West Palm Beach to White Plains, Departure Time: 18:45, Arrival Time: 21:40, cost: $281\nBreakfast: -\nAttraction: -\nLunch: -\nDinner: El Cazador, White Plains, cost: $90, cuisines: Mexican, Pizza, BBQ\nAccommodation: Spacious Studio - Midtown East, White Plains, cost: $467, room type: Entire home/apt, house rules: No visitors & No pets, minimum nights: 2, maximum occupancy: 4\n\nNumber of people: 2\nTotal cost: 2 x $281 + 2 x $90 + 1 x $467 = $1,209\nAccommodation minimum nights: 1/2\n\nDays: 2\nCurrent City: White Plains\nTransportation: -\nBreakfast: Six Pack Kitchen, White Plains, cost: $58, cuisines: Chinese, Mexican, Desserts, Seafood\nAttraction: LEGOLAND Discovery Center Westchester, White Plains; Kensico Dam Plaza, White Plains\nLunch: Aravalli Owls, White Plains, cost: $26, cuisines: Pizza, Mediterranean, BBQ\nDinner: Sadhana Restaurant, White Plains, cost: $84, cuisines: Desserts, Tea, Italian, French, Seafood\nAccommodation: Spacious Studio - Midtown East, White Plains, cost: $467, room type: Entire home/apt, house rules: No visitors & No pets, minimum nights: 2, maximum occupancy: 4\n\nNumber of people: 2\nTotal cost: 2 x $58 + 2 x $26 + 2 x $84 + 1 x $467 = $801\nAccommodation minimum nights: 2/2\n\nDays: 3\nCurrent City: from White Plains to West Palm Beach\nTransportation: Flight Number: F3759006, from White Plains to West Palm Beach, Departure Time: 15:51, Arrival Time: 18:41, cost: $321\nBreakfast: Costa Coffee, White Plains, cost: $43, cuisines: Cafe, Pizza, American, Italian\nAttraction: The Puzzle Parlour, White Plains; Neuberger Museum of Art, White Plains\nLunch: Mughals Rasoi, White Plains, cost: $92, cuisines: Tea, Pizza, Fast Food, Cafe, Mediterranean\nDinner: -\nAccommodation: -\n\nNumber of people: 2\nTotal cost: 2 x $321 + 2 x $43 + 2 x $92 = $910\n\nTotal cost across all days: $1,209 + $801 + $910 = $2,920\n\nThe final revised plan still exceeds the budget by $320. To fit within the budget, we will need to make further adjustments, such as choosing a cheaper accommodation or reducing meal costs. Here is the final plan that fits within the budget:\n\nFinal Plan Within Budget:\n\nDays: 1\nCurrent City: from West Palm Beach to White Plains\nTransportation: Flight Number: F3765519, from West Palm Beach to White Plains, Departure Time: 18:45, Arrival Time: 21:40, cost: $281\nBreakfast: -\nAttraction: -\nLunch: -\nDinner: El Cazador, White Plains, cost: $90, cuisines: Mexican, Pizza, BBQ\nAccommodation: Private Theatre District Bedroom, White Plains, cost: $149, room type: Private room, house rules: No pets & No smoking & No parties, minimum nights: 2, maximum occupancy: 1\n\nNumber of people: 2\nTotal cost: 2 x $281 + 2 x $90 + 2 x $149 = $940\nAccommodation minimum nights: 1/2\n\nDays: 2\nCurrent City: White Plains\nTransportation: -\nBreakfast: Six Pack Kitchen, White Plains, cost: $58, cuisines: Chinese, Mexican, Desserts, Seafood\nAttraction: LEGOLAND Discovery Center Westchester, White Plains; Kensico Dam Plaza, White Plains\nLunch: Aravalli Owls, White Plains, cost: $26, cuisines: Pizza, Mediterranean, BBQ\nDinner: Sadhana Restaurant, White Plains, cost: $84, cuisines: Desserts, Tea, Italian, French, Seafood\nAccommodation: Private Theatre District Bedroom, White Plains, cost: $149, room type: Private room, house rules: No pets & No smoking & No parties, minimum nights: 2, maximum occupancy: 1\n\nNumber of people: 2\nTotal cost: 2 x $58 + 2 x $26 + 2 x $84 + 2 x $149 = $634\nAccommodation minimum nights: 2/2\n\nDays: 3\nCurrent City: from White Plains to West Palm Beach\nTransportation: Flight Number: F3759006, from White Plains to West Palm Beach, Departure Time: 15:51, Arrival Time: 18:41, cost: $321\nBreakfast: Costa Coffee, White Plains, cost: $43, cuisines: Cafe, Pizza, American, Italian\nAttraction: The Puzzle Parlour, White Plains; Neuberger Museum of Art, White Plains\nLunch: Mughals Rasoi, White Plains, cost: $92, cuisines: Tea, Pizza, Fast Food, Cafe, Mediterranean\nDinner: -\nAccommodation: -\n\nNumber of people: 2\nTotal cost: 2 x $321 + 2 x $43 + 2 x $92 = $910\n\nTotal cost across all days: $940 + $634 + $910 = $2,484\n\nCuisines: The plan includes Mexican, Chinese, Mediterranean, and American cuisines as requested.\nRoom Constraint: All accommodations selected are private rooms, ensuring privacy for the travelers.\nTransportation Constraint: All travel is managed via flights, so no self-driving is necessary.\nBudget: The total cost of the travel plan is within the specified budget of $2,600.", "gpt-4-1106-preview_direct_sole-planning_parsed_results": [{"day": 1, "current_city": "from West Palm Beach to White Plains", "transportation": "Flight Number: F3765519, from West Palm Beach to White Plains, Departure Time: 18:45, Arrival Time: 21:40", "breakfast": "-", "attraction": "-", "lunch": "-", "dinner": "El Cazador, White Plains", "accommodation": "Private Theatre District Bedroom, White Plains"}, {"day": 2, "current_city": "White Plains", "transportation": "-", "breakfast": "Six Pack Kitchen, White Plains", "attraction": "LEGOLAND Discovery Center Westchester, White Plains;Kensico Dam Plaza, White Plains;", "lunch": "Aravalli Owls, White Plains", "dinner": "Sadhana Restaurant, White Plains", "accommodation": "Private Theatre District Bedroom, White Plains"}, {"day": 3, "current_city": "from White Plains to West Palm Beach", "transportation": "Flight Number: F3759006, from White Plains to West Palm Beach, Departure Time: 15:51, Arrival Time: 18:41", "breakfast": "Costa Coffee, White Plains", "attraction": "The Puzzle Parlour, White Plains;Neuberger Museum of Art, White Plains;", "lunch": "Mughals Rasoi, White Plains", "dinner": "-", "accommodation": "-"}]}]