[{"gpt-4-1106-preview_direct_sole-planning_results": "Travel Plan:\n\nDays: 1\nCurrent City: from Cleveland to Baltimore\nTransportation: Flight Number: F4001024, from Cleveland to Baltimore, Departure Time: 06:30, Arrival Time: 07:33, cost: 85\nBreakfast: -\nAttraction: -\nLunch: Los Pablos, Baltimore, cost: 47, cuisines: Indian, BBQ, Cafe, American, Seafood\nDinner: Mr. Dunderbak's Biergarten and Marketplatz, Baltimore, cost: 74, cuisines: Cafe, Pizza, American\nAccommodation: Contemporary Home Away from Home, Entire house, Baltimore, cost: 290, maximum occupancy: 2, house rules: No visitors, minimum nights: 2\n\nNumber of people: 2\nTotal cost: 2 x 85 + 2 x 47 + 2 x 74 + 1 x 290 = 702\nAccommodation minimum nights: 1/2\n\nDays: 2\nCurrent City: Baltimore\nTransportation: -\nBreakfast: The Thai Bowl, Baltimore, cost: 66, cuisines: BBQ, Pizza, Desserts, Italian\nAttraction: National Aquarium, Baltimore; Fort McHenry National Monument and Historic Shrine, Baltimore\nLunch: Salt, Baltimore, cost: 56, cuisines: Tea, Bakery, Fast Food, Chinese, American\nDinner: Tresind - Nassima Royal Hotel, Baltimore, cost: 67, cuisines: Cafe, Pizza, American, Desserts\nAccommodation: Contemporary Home Away from Home, Entire house, Baltimore, cost: 290, maximum occupancy: 2, house rules: No visitors, minimum nights: 2\n\nNumber of people: 2\nTotal cost: 2 x 66 + 2 x 56 + 2 x 67 + 1 x 290 = 678\nAccommodation minimum nights: 2/2\n\nDays: 3\nCurrent City: from Baltimore to Cleveland\nTransportation: Flight Number: F4007632, from Baltimore to Cleveland, Departure Time: 23:21, Arrival Time: 00:24, cost: 101\nBreakfast: Three Dots & A Dash, Baltimore, cost: 47, cuisines: Cafe, Chinese, Mediterranean, Seafood\nAttraction: The Walters Art Museum, Baltimore; Baltimore Museum of Industry, Baltimore\nLunch: Farzi Cafe, Baltimore, cost: 96, cuisines: Desserts, American, BBQ, Seafood\nDinner: -\nAccommodation: -\n\nNumber of people: 2\nTotal cost: 2 x 101 + 2 x 47 + 2 x 96 = 588\n\nTotal cost across all days: 702 + 678 + 588 = 1,968\n\nNote: The total cost exceeds the budget of $1,700. To adjust the plan within the budget, we can consider the following changes:\n\n- Opt for self-driving from Cleveland to Baltimore and back, which costs $30 each way, reducing the transportation cost significantly.\n- Choose a less expensive restaurant for one or more meals.\n- Ensure that the accommodation cost does not exceed the budget when combined with the reduced transportation and meal costs.\n\nAdjusted Travel Plan with Budget Consideration:\n\nDays: 1\nCurrent City: from Cleveland to Baltimore\nTransportation: Self-driving, from Cleveland to Baltimore, duration: 5 hours 52 mins, distance: 603 km, cost: 30\nBreakfast: -\nAttraction: -\nLunch: Los Pablos, Baltimore, cost: 47, cuisines: Indian, BBQ, Cafe, American, Seafood\nDinner: Mr. Dunderbak's Biergarten and Marketplatz, Baltimore, cost: 74, cuisines: Cafe, Pizza, American\nAccommodation: Contemporary Home Away from Home, Entire house, Baltimore, cost: 290, maximum occupancy: 2, house rules: No visitors, minimum nights: 2\n\nNumber of people: 2\nTotal cost: 30 + 2 x 47 + 2 x 74 + 1 x 290 = 562\nAccommodation minimum nights: 1/2\n\nDays: 2\nCurrent City: Baltimore\nTransportation: -\nBreakfast: The Thai Bowl, Baltimore, cost: 66, cuisines: BBQ, Pizza, Desserts, Italian\nAttraction: National Aquarium, Baltimore; Fort McHenry National Monument and Historic Shrine, Baltimore\nLunch: Salt, Baltimore, cost: 56, cuisines: Tea, Bakery, Fast Food, Chinese, American\nDinner: Tresind - Nassima Royal Hotel, Baltimore, cost: 67, cuisines: Cafe, Pizza, American, Desserts\nAccommodation: Contemporary Home Away from Home, Entire house, Baltimore, cost: 290, maximum occupancy: 2, house rules: No visitors, minimum nights: 2\n\nNumber of people: 2\nTotal cost: 2 x 66 + 2 x 56 + 2 x 67 + 1 x 290 = 678\nAccommodation minimum nights: 2/2\n\nDays: 3\nCurrent City: from Baltimore to Cleveland\nTransportation: Self-driving, from Baltimore to Cleveland, duration: 5 hours 51 mins, distance: 601 km, cost: 30\nBreakfast: Three Dots & A Dash, Baltimore, cost: 47, cuisines: Cafe, Chinese, Mediterranean, Seafood\nAttraction: The Walters Art Museum, Baltimore; Baltimore Museum of Industry, Baltimore\nLunch: Farzi Cafe, Baltimore, cost: 96, cuisines: Desserts, American, BBQ, Seafood\nDinner: -\nAccommodation: -\n\nNumber of people: 2\nTotal cost: 30 + 2 x 47 + 2 x 96 = 316\n\nTotal cost across all days: 562 + 678 + 316 = 1,556\n\nThis adjusted plan keeps the total cost within the $1,700 budget.", "gpt-4-1106-preview_direct_sole-planning_parsed_results": [{"day": 1, "current_city": "from Cleveland to Baltimore", "transportation": "Flight Number: F4001024, from Cleveland to Baltimore, Departure Time: 06:30, Arrival Time: 07:33", "breakfast": "-", "attraction": "-", "lunch": "Los Pablos, Baltimore", "dinner": "Mr. Dunderbak's Biergarten and Marketplatz, Baltimore", "accommodation": "Contemporary Home Away from Home, Baltimore"}, {"day": 2, "current_city": "Baltimore", "transportation": "-", "breakfast": "The Thai Bowl, Baltimore", "attraction": "National Aquarium, Baltimore;Fort McHenry National Monument and Historic Shrine, Baltimore;", "lunch": "Salt, Baltimore", "dinner": "Tresind - Nassima Royal Hotel, Baltimore", "accommodation": "Contemporary Home Away from Home, Baltimore"}, {"day": 3, "current_city": "from Baltimore to Cleveland", "transportation": "Flight Number: F4007632, from Baltimore to Cleveland, Departure Time: 23:21, Arrival Time: 00:24", "breakfast": "Three Dots & A Dash, Baltimore", "attraction": "The Walters Art Museum, Baltimore;Baltimore Museum of Industry, Baltimore;", "lunch": "Farzi Cafe, Baltimore", "dinner": "-", "accommodation": "-"}, {"day": 1, "current_city": "from Cleveland to Baltimore", "transportation": "Self-driving, from Cleveland to Baltimore, duration: 5 hours 52 mins, distance: 603 km", "breakfast": "-", "attraction": "-", "lunch": "Los Pablos, Baltimore", "dinner": "Mr. Dunderbak's Biergarten and Marketplatz, Baltimore", "accommodation": "Contemporary Home Away from Home, Baltimore"}, {"day": 2, "current_city": "Baltimore", "transportation": "-", "breakfast": "The Thai Bowl, Baltimore", "attraction": "National Aquarium, Baltimore;Fort McHenry National Monument and Historic Shrine, Baltimore;", "lunch": "Salt, Baltimore", "dinner": "Tresind - Nassima Royal Hotel, Baltimore", "accommodation": "Contemporary Home Away from Home, Baltimore"}, {"day": 3, "current_city": "from Baltimore to Cleveland", "transportation": "Self-driving, from Baltimore to Cleveland, duration: 5 hours 51 mins, distance: 601 km", "breakfast": "Three Dots & A Dash, Baltimore", "attraction": "The Walters Art Museum, Baltimore;Baltimore Museum of Industry, Baltimore;", "lunch": "Farzi Cafe, Baltimore", "dinner": "-", "accommodation": "-"}]}]