[{"gpt-4-1106-preview_direct_sole-planning_results": "Travel Plan:\n\nDays: 1\nCurrent City: from Baton Rouge to Dallas (Texas)\nTransportation: Flight Number: F3594383, from Baton Rouge to Dallas (Texas), Departure Time: 16:24, Arrival Time: 17:55, cost: 113\nBreakfast: -\nAttraction: -\nLunch: -\nDinner: Coconuts Fish Cafe, Dallas (Texas), cost: 38, cuisines: Cafe, BBQ, Mediterranean, Fast Food\nAccommodation: E. W'burg Private Room near subway, Dallas (Texas), cost: 272, maximum occupancy: 2, house rules: No visitors & No smoking, minimum nights: 15\n\nNumber of people: 4\nTotal cost: 4 x 113 + 4 x 38 + 2 x 272 = 1,312\nAccommodation minimum nights: 1/15\n\nDays: 2\nCurrent City: Dallas (Texas)\nTransportation: -\nBreakfast: Drifters Cafe, Dallas (Texas), cost: 21, cuisines: Tea, French, Mexican, Cafe, Seafood\nAttraction: The Dallas World Aquarium, Dallas (Texas); The Sixth Floor Museum at Dealey Plaza, Dallas (Texas); Dallas Museum of Art, Dallas (Texas)\nLunch: 1918 Bistro & Grill, Dallas (Texas), cost: 90, cuisines: Tea, Pizza, BBQ, Seafood\nDinner: Yanki Sizzlers, Dallas (Texas), cost: 96, cuisines: Cafe, French, Tea, Mediterranean\nAccommodation: E. W'burg Private Room near subway, Dallas (Texas), cost: 272, maximum occupancy: 2, house rules: No visitors & No smoking, minimum nights: 15\n\nNumber of people: 4\nTotal cost: 4 x 21 + 4 x 90 + 4 x 96 + 2 x 272 = 1,480\nAccommodation minimum nights: 2/15\n\nDays: 3\nCurrent City: from Dallas (Texas) to Baton Rouge\nTransportation: Flight Number: F3594416, from Dallas (Texas) to Baton Rouge, Departure Time: 14:36, Arrival Time: 15:58, cost: 184\nBreakfast: Cafe Gatherings, Dallas (Texas), cost: 17, cuisines: Bakery, Indian, Desserts\nAttraction: Reunion Tower, Dallas (Texas); Klyde Warren Park, Dallas (Texas)\nLunch: Aravali Owls, Dallas (Texas), cost: 53, cuisines: Pizza, Italian, Bakery, Fast Food, Cafe\nDinner: -\nAccommodation: -\n\nNumber of people: 4\nTotal cost: 4 x 184 + 4 x 17 + 4 x 53 = 1,064\n\nTotal cost across all days: 1,312 + 1,480 + 1,064 = 3,856\n\nCuisines: The prompt specifies no cuisines, so all cuisines constraints are satisfied.\nRoom Constraint: The accommodations selected do not meet the smoking requirement, as no options allowing smoking were provided in the reference information. However, since the query specifically requires accommodations where smoking is permitted, we would need to find an alternative accommodation that meets this requirement, which is not available in the provided data.\nTransportation Constraint: All travel between Baton Rouge and Dallas is managed via flights, as per the available data.\n\nPlease note that the accommodation selected does not allow smoking, which is against the query's requirements. However, based on the provided data, there are no accommodations listed that permit smoking. In a real-world scenario, we would need to source additional accommodation options that meet all the requirements, including the smoking allowance.", "gpt-4-1106-preview_direct_sole-planning_parsed_results": [{"day": 1, "current_city": "from Baton Rouge to Dallas", "transportation": "Flight Number: F3594383, from Baton Rouge to Dallas, Departure Time: 16:24, Arrival Time: 17:55", "breakfast": "-", "attraction": "-", "lunch": "-", "dinner": "Coconuts Fish Cafe, Dallas", "accommodation": "E. W'burg Private Room near subway, Dallas"}, {"day": 2, "current_city": "Dallas", "transportation": "-", "breakfast": "Drifters Cafe, Dallas", "attraction": "The Dallas World Aquarium, Dallas;The Sixth Floor Museum at Dealey Plaza, Dallas;Dallas Museum of Art, Dallas;", "lunch": "1918 Bistro & Grill, Dallas", "dinner": "Yanki Sizzlers, Dallas", "accommodation": "E. W'burg Private Room near subway, Dallas"}, {"day": 3, "current_city": "from Dallas to Baton Rouge", "transportation": "Flight Number: F3594416, from Dallas to Baton Rouge, Departure Time: 14:36, Arrival Time: 15:58", "breakfast": "Cafe Gatherings, Dallas", "attraction": "Reunion Tower, Dallas;Klyde Warren Park, Dallas;", "lunch": "Aravali Owls, Dallas", "dinner": "-", "accommodation": "-"}]}]