[{"gpt-4-1106-preview_direct_sole-planning_results": "Travel Plan:\n\nDays: 1\nCurrent City: from Colorado Springs to Moline (Illinois)\nTransportation: Self-driving, from Colorado Springs to Moline, duration: 12 hours 49 mins, distance: 1,467 km, cost: 73\nBreakfast: -\nAttraction: -\nLunch: -\nDinner: -\nAccommodation: Sunny duplex near Central Park, Moline (Illinois), cost: 541, room type: Entire home/apt, house rules: No pets, minimum nights: 1, maximum occupancy: 5, review rate number: 1\n\nNumber of people: 1\nTotal cost: 1 x 73 + 1 x 541 = 614\nAccommodation minimum nights: 1/1\n\nDays: 2\nCurrent City: Moline (Illinois)\nTransportation: -\nBreakfast: Royal Hotel, Moline (Illinois), cost: 74, cuisines: Tea, Pizza, Mexican, Chinese, Seafood\nAttraction: John Deere Pavilion, Moline (Illinois); Celebration River Cruises, Moline (Illinois)\nLunch: Lovecrumbs Bakery, Moline (Illinois), cost: 24, cuisines: Tea, Pizza, American, Desserts\nDinner: Mummy's Kitchen, Moline (Illinois), cost: 54, cuisines: Desserts, Indian, Mediterranean, BBQ\nAccommodation: Sunny duplex near Central Park, Moline (Illinois), cost: 541, room type: Entire home/apt, house rules: No pets, minimum nights: 1, maximum occupancy: 5, review rate number: 1\n\nNumber of people: 1\nTotal cost: 1 x 74 + 1 x 24 + 1 x 54 + 1 x 541 = 693\nAccommodation minimum nights: 2/1\n\nDays: 3\nCurrent City: from Moline (Illinois) to Rockford (Illinois)\nTransportation: Self-driving, from Moline to Rockford, duration: 2 hours 1 min, distance: 194 km, cost: 9\nBreakfast: Cafe Coffee Day, Moline (Illinois), cost: 89, cuisines: Pizza, French, Fast Food, Cafe, Indian, Seafood\nAttraction: Sylvan Island, Moline (Illinois); Ben Butterworth Parkway, Moline (Illinois)\nLunch: ZASTY, Moline (Illinois), cost: 82, cuisines: Pizza, Indian, BBQ, Cafe, American, Seafood\nDinner: -\nAccommodation: Spacious 3BDR Prime Location!, Rockford (Illinois), cost: 1030, room type: Entire home/apt, house rules: No smoking, minimum nights: 2, maximum occupancy: 9, review rate number: 2\n\nNumber of people: 1\nTotal cost: 1 x 9 + 1 x 89 + 1 x 82 + 1 x 1030 = 1210\nAccommodation minimum nights: 1/2\n\nDays: 4\nCurrent City: Rockford (Illinois)\nTransportation: -\nBreakfast: Coco Bambu, Rockford (Illinois), cost: 72, cuisines: Tea, French, Bakery, BBQ, Cafe\nAttraction: Anderson Japanese Gardens, Rockford (Illinois); Discovery Center Museum, Rockford (Illinois)\nLunch: Flying Mango, Rockford (Illinois), cost: 20, cuisines: American, BBQ, Seafood\nDinner: Gajalee Sea Food, Rockford (Illinois), cost: 49, cuisines: Bakery, BBQ\nAccommodation: Spacious 3BDR Prime Location!, Rockford (Illinois), cost: 1030, room type: Entire home/apt, house rules: No smoking, minimum nights: 2, maximum occupancy: 9, review rate number: 2\n\nNumber of people: 1\nTotal cost: 1 x 72 + 1 x 20 + 1 x 49 + 1 x 1030 = 1171\nAccommodation minimum nights: 2/2\n\nDays: 5\nCurrent City: from Rockford (Illinois) to Colorado Springs\nTransportation: Self-driving, from Rockford to Colorado Springs, duration: 14 hours 38 mins, distance: 1,653 km, cost: 82\nBreakfast: Eggspectation - Jaypee Vasant Continental, Rockford (Illinois), cost: 77, cuisines: Tea, Mediterranean, Seafood\nAttraction: Burpee Museum of Natural History, Rockford (Illinois); Midway Village Museum, Rockford (Illinois)\nLunch: Cafe Southall, Rockford (Illinois), cost: 56, cuisines: Seafood, Pizza, Cafe, Fast Food\nDinner: -\nAccommodation: -\n\nNumber of people: 1\nTotal cost: 1 x 82 + 1 x 77 + 1 x 56 = 215\n\nTotal cost across all days: 614 + 693 + 1210 + 1171 + 215 = 3903\n\nCuisines: The prompt specifies no cuisines, so all cuisines constraints are satisfied.\nRoom Constraint: All accommodations selected are entire rooms.\nTransportation Constraint: All travel is managed via self-driving, as per the available options.\n\n**Note: The total cost exceeds the specified budget of $1,900. Adjustments are required to meet the budget constraint.**\n\nAdjusted Travel Plan to meet the budget:\n\nDays: 1\nCurrent City: from Colorado Springs to Moline (Illinois)\nTransportation: Self-driving, from Colorado Springs to Moline, duration: 12 hours 49 mins, distance: 1,467 km, cost: 73\nAccommodation: Sunny duplex near Central Park, Moline (Illinois), cost: 541\n\nDays: 2\nCurrent City: Moline (Illinois)\nAccommodation: Sunny duplex near Central Park, Moline (Illinois), cost: 541\n\nDays: 3\nCurrent City: from Moline (Illinois) to Rockford (Illinois)\nTransportation: Self-driving, from Moline to Rockford, duration: 2 hours 1 min, distance: 194 km, cost: 9\nAccommodation: Park Side Zen Home - Terrace & next to CentralPark, Rockford (Illinois), cost: 250\n\nDays: 4\nCurrent City: Rockford (Illinois)\nAccommodation: Park Side Zen Home - Terrace & next to CentralPark, Rockford (Illinois), cost: 250\n\nDays: 5\nCurrent City: from Rockford (Illinois) to Colorado Springs\nTransportation: Self-driving, from Rockford to Colorado Springs, duration: 14 hours 38 mins, distance: 1,653 km, cost: 82\n\nTotal cost across all days: 73 + 541 + 541 + 9 + 250 + 250 + 82 = 1746\n\nThis adjusted plan meets the budget constraint of $1,900 but does not include costs for meals, attractions, or additional nights required for accommodations. Further adjustments would be needed to include these while staying within budget.", "gpt-4-1106-preview_direct_sole-planning_parsed_results": [{"day": 1, "current_city": "from Colorado Springs to Moline (Illinois)", "transportation": "Self-driving, from Colorado Springs to Moline, duration: 12 hours 49 mins, distance: 1,467 km", "breakfast": "-", "attraction": "-", "lunch": "-", "dinner": "-", "accommodation": "Sunny duplex near Central Park, Moline (Illinois)"}, {"day": 2, "current_city": "Moline (Illinois)", "transportation": "-", "breakfast": "Royal Hotel, Moline (Illinois)", "attraction": "John Deere Pavilion, Moline (Illinois);Celebration River Cruises, Moline (Illinois);", "lunch": "Lovecrumbs Bakery, Moline (Illinois)", "dinner": "Mummy's Kitchen, Moline (Illinois)", "accommodation": "Sunny duplex near Central Park, Moline (Illinois)"}, {"day": 3, "current_city": "from Moline (Illinois) to Rockford (Illinois)", "transportation": "Self-driving, from Moline to Rockford, duration: 2 hours 1 min, distance: 194 km", "breakfast": "Cafe Coffee Day, Moline (Illinois)", "attraction": "Sylvan Island, Moline (Illinois);Ben Butterworth Parkway, Moline (Illinois);", "lunch": "ZASTY, Moline (Illinois)", "dinner": "-", "accommodation": "Spacious 3BDR Prime Location!, Rockford (Illinois)"}, {"day": 4, "current_city": "Rockford (Illinois)", "transportation": "-", "breakfast": "Coco Bambu, Rockford (Illinois)", "attraction": "Anderson Japanese Gardens, Rockford (Illinois);Discovery Center Museum, Rockford (Illinois);", "lunch": "Flying Mango, Rockford (Illinois)", "dinner": "Gajalee Sea Food, Rockford (Illinois)", "accommodation": "Spacious 3BDR Prime Location!, Rockford (Illinois)"}, {"day": 5, "current_city": "from Rockford (Illinois) to Colorado Springs", "transportation": "Self-driving, from Rockford to Colorado Springs, duration: 14 hours 38 mins, distance: 1,653 km", "breakfast": "Eggspectation - Jaypee Vasant Continental, Rockford (Illinois)", "attraction": "Burpee Museum of Natural History, Rockford (Illinois);Midway Village Museum, Rockford (Illinois);", "lunch": "Cafe Southall, Rockford (Illinois)", "dinner": "-", "accommodation": "-"}]}]