[{"gpt-4-1106-preview_direct_sole-planning_results": "Travel Plan:\n\nDays: 1\nCurrent City: from Appleton to Charlotte\nTransportation: Flight Number: F3796721, from Appleton to Charlotte, Departure Time: 06:58, Arrival Time: 10:25, cost: 314\nBreakfast: -\nAttraction: -\nLunch: Olive Tree Cafe, Charlotte, cost: 23, cuisines: Tea, Chinese, Desserts\nDinner: Central Perk 7, Charlotte, cost: 87, cuisines: Pizza, Bakery, BBQ, Fast Food\nAccommodation: Elegant Studio Apt in Prospect Heights, Charlotte, cost: 640, maximum occupancy: 5, house rules: No parties, minimum nights: 2\n\nNumber of people: 7\nTotal cost: 7 x 314 + 7 x 23 + 7 x 87 + 1 x 640 = 3,675\nAccommodation minimum nights: 1/2\n\nDays: 2\nCurrent City: Charlotte\nTransportation: -\nBreakfast: Subway, Charlotte, cost: 60, cuisines: Tea, Cafe, Mexican, Chinese, Seafood\nAttraction: Freedom Park, Charlotte; Levine Museum of the New South, Charlotte; Discovery Place Science, Charlotte\nLunch: Cafe Maple Street, Charlotte, cost: 91, cuisines: Fast Food, Tea, Italian\nDinner: Kylin Skybar, Charlotte, cost: 44, cuisines: Tea, Cafe, Pizza, Italian\nAccommodation: Elegant Studio Apt in Prospect Heights, Charlotte, cost: 640, maximum occupancy: 5, house rules: No parties, minimum nights: 2\n\nNumber of people: 7\nTotal cost: 7 x 60 + 7 x 91 + 7 x 44 + 1 x 640 = 2,471\nAccommodation minimum nights: 2/2\n\nDays: 3\nCurrent City: from Charlotte to Appleton\nTransportation: Flight Number: F3788979, from Charlotte to Appleton, Departure Time: 22:52, Arrival Time: 00:07, cost: 212\nBreakfast: Grover's - The Baker Shop, Charlotte, cost: 30, cuisines: Pizza, Bakery, Chinese, Indian, Seafood\nAttraction: NASCAR Hall of Fame, Charlotte; The Mint Museum, Charlotte\nLunch: Prince Snacks & Momo's Point, Charlotte, cost: 11, cuisines: Tea, Cafe, Desserts, Fast Food\nDinner: -\nAccommodation: -\n\nNumber of people: 7\nTotal cost: 7 x 212 + 7 x 30 + 7 x 11 = 1,771\n\nTotal cost across all days: 3,675 + 2,471 + 1,771 = 7,917\nCuisines: All restaurants selected offer a variety of cuisines as per the available options.\nRoom Constraint: All accommodations selected are entire homes that do not allow parties, ensuring privacy and space for the group of 7. However, the house rules do not mention allowing visitors, which is a requirement. Unfortunately, none of the accommodations listed in the provided data explicitly state that visitors are allowed, so the closest match was chosen.\nTransportation Constraint: All inter-city travel is managed via flights, and no self-driving or taxi services are used.\n\nPlease note that the accommodation chosen does not meet the house rules requirement of allowing visitors, as none of the listed accommodations explicitly state this. Additionally, the accommodation chosen has a maximum occupancy of 5, but the group consists of 7 people. This discrepancy is due to the limitations of the provided data and the need to adhere to the budget constraint. If this plan is not satisfactory, further adjustments or additional options would need to be considered.", "gpt-4-1106-preview_direct_sole-planning_parsed_results": [{"day": 1, "current_city": "from Appleton to Charlotte", "transportation": "Flight Number: F3796721, from Appleton to Charlotte, Departure Time: 06:58, Arrival Time: 10:25", "breakfast": "-", "attraction": "-", "lunch": "Olive Tree Cafe, Charlotte", "dinner": "Central Perk 7, Charlotte", "accommodation": "Elegant Studio Apt in Prospect Heights, Charlotte"}, {"day": 2, "current_city": "Charlotte", "transportation": "-", "breakfast": "Subway, Charlotte", "attraction": "Freedom Park, Charlotte;Levine Museum of the New South, Charlotte;Discovery Place Science, Charlotte;", "lunch": "Cafe Maple Street, Charlotte", "dinner": "Kylin Skybar, Charlotte", "accommodation": "Elegant Studio Apt in Prospect Heights, Charlotte"}, {"day": 3, "current_city": "from Charlotte to Appleton", "transportation": "Flight Number: F3788979, from Charlotte to Appleton, Departure Time: 22:52, Arrival Time: 00:07", "breakfast": "Grover's - The Baker Shop, Charlotte", "attraction": "NASCAR Hall of Fame, Charlotte;The Mint Museum, Charlotte;", "lunch": "Prince Snacks & Momo's Point, Charlotte", "dinner": "-", "accommodation": "-"}]}]