[{"gpt-4-1106-preview_direct_sole-planning_results": "Travel Plan:\n\nDays: 1\nCurrent City: from Dallas to Huntsville\nTransportation: Flight Number: F3609558, from Dallas to Huntsville, Departure Time: 07:03, Arrival Time: 08:51, cost: 169\nBreakfast: -\nAttraction: -\nLunch: Cherry Comet, Huntsville, cost: 16, cuisines: Desserts, Tea, Pizza, Cafe, Mediterranean\nDinner: Downtown Grill, Huntsville, cost: 74, cuisines: Pizza, Bakery\nAccommodation: Artsy Harlem Guest Space, Huntsville, cost: 1186, room type: Entire home/apt, house rules: No smoking & No pets, minimum nights: 3, maximum occupancy: 8\n\nNumber of people: 4\nTotal cost: 4 x 169 + 4 x 16 + 4 x 74 + 1 x 1186 = 2,022\nAccommodation minimum nights: 1/3\n\nDays: 2\nCurrent City: Huntsville\nTransportation: -\nBreakfast: Breakfast Hut, Huntsville, cost: 81, cuisines: Cafe, Bakery, Desserts, Seafood\nAttraction: U.S. Space & Rocket Center, Huntsville; Huntsville Botanical Garden, Huntsville; Huntsville Museum of Art, Huntsville\nLunch: Lord of the Drinks, Huntsville, cost: 70, cuisines: French, Pizza, Fast Food\nDinner: Moksh The Restro Lounge, Huntsville, cost: 77, cuisines: Pizza, American, BBQ, Fast Food, Indian\nAccommodation: Artsy Harlem Guest Space, Huntsville, cost: 1186, room type: Entire home/apt, house rules: No smoking & No pets, minimum nights: 3, maximum occupancy: 8\n\nNumber of people: 4\nTotal cost: 4 x 81 + 4 x 70 + 4 x 77 + 1 x 1186 = 2,022\nAccommodation minimum nights: 2/3\n\nDays: 3\nCurrent City: from Huntsville to Dallas\nTransportation: Flight Number: F3593796, from Huntsville to Dallas, Departure Time: 05:24, Arrival Time: 07:19, cost: 147\nBreakfast: -\nAttraction: -\nLunch: -\nDinner: -\nAccommodation: -\n\nNumber of people: 4\nTotal cost: 4 x 147 = 588\n\nTotal cost across all days: 2,022 + 2,022 + 588 = 4,632\n\nUnfortunately, the total cost exceeds the specified budget of $2,700. Adjustments are needed to meet the budget constraint. Let's consider alternative transportation and accommodation options to reduce costs.\n\nAdjusted Travel Plan:\n\nDays: 1\nCurrent City: from Dallas to Huntsville\nTransportation: Self-driving, from Dallas to Huntsville, duration: 10 hours 10 mins, distance: 1,071 km, cost: 53\nBreakfast: -\nAttraction: -\nLunch: Cherry Comet, Huntsville, cost: 16, cuisines: Desserts, Tea, Pizza, Cafe, Mediterranean\nDinner: Downtown Grill, Huntsville, cost: 74, cuisines: Pizza, Bakery\nAccommodation: Brooklyn Charmer, Close to Everything NYC!, Huntsville, cost: 568, room type: Entire home/apt, house rules: No children under 10 & No parties, minimum nights: 2, maximum occupancy: 5\n\nNumber of people: 4\nTotal cost: 53 + 4 x 16 + 4 x 74 + 1 x 568 = 1,009\nAccommodation minimum nights: 1/2\n\nDays: 2\nCurrent City: Huntsville\nTransportation: -\nBreakfast: Breakfast Hut, Huntsville, cost: 81, cuisines: Cafe, Bakery, Desserts, Seafood\nAttraction: U.S. Space & Rocket Center, Huntsville; Huntsville Botanical Garden, Huntsville; Huntsville Museum of Art, Huntsville\nLunch: Lord of the Drinks, Huntsville, cost: 70, cuisines: French, Pizza, Fast Food\nDinner: Moksh The Restro Lounge, Huntsville, cost: 77, cuisines: Pizza, American, BBQ, Fast Food, Indian\nAccommodation: Brooklyn Charmer, Close to Everything NYC!, Huntsville, cost: 568, room type: Entire home/apt, house rules: No children under 10 & No parties, minimum nights: 2, maximum occupancy: 5\n\nNumber of people: 4\nTotal cost: 4 x 81 + 4 x 70 + 4 x 77 + 1 x 568 = 1,509\nAccommodation minimum nights: 2/2\n\nDays: 3\nCurrent City: from Huntsville to Dallas\nTransportation: Self-driving, from Huntsville to Dallas, duration: 10 hours 13 mins, distance: 1,072 km, cost: 53\nBreakfast: -\nAttraction: -\nLunch: -\nDinner: -\nAccommodation: -\n\nNumber of people: 4\nTotal cost: 53\n\nTotal cost across all days: 1,009 + 1,509 + 53 = 2,571\n\nThe adjusted travel plan now meets the budget constraint of $2,700.", "gpt-4-1106-preview_direct_sole-planning_parsed_results": [{"day": 1, "current_city": "from Dallas to Huntsville", "transportation": "Self-driving, from Dallas to Huntsville, duration: 10 hours 10 mins, distance: 1,071 km", "breakfast": "-", "attraction": "-", "lunch": "Cherry Comet, Huntsville", "dinner": "Downtown Grill, Huntsville", "accommodation": "Brooklyn Charmer, Close to Everything NYC!, Huntsville"}, {"day": 2, "current_city": "Huntsville", "transportation": "-", "breakfast": "Breakfast Hut, Huntsville", "attraction": "U.S. Space & Rocket Center, Huntsville;Huntsville Botanical Garden, Huntsville;Huntsville Museum of Art, Huntsville", "lunch": "Lord of the Drinks, Huntsville", "dinner": "Moksh The Restro Lounge, Huntsville", "accommodation": "Brooklyn Charmer, Close to Everything NYC!, Huntsville"}, {"day": 3, "current_city": "from Huntsville to Dallas", "transportation": "Self-driving, from Huntsville to Dallas, duration: 10 hours 13 mins, distance: 1,072 km", "breakfast": "-", "attraction": "-", "lunch": "-", "dinner": "-", "accommodation": "-"}]}]