[{"gpt-4-1106-preview_direct_sole-planning_results": "Travel Plan:\n\nDays: 1\nCurrent City: from St. Louis to Orlando (Florida)\nTransportation: Flight Number: F4003646, from St. Louis to Orlando (Florida), Departure Time: 07:31, Arrival Time: 10:43, cost: 298\nBreakfast: -\nAttraction: -\nLunch: -\nDinner: Fuji Japanese Steakhouse, Orlando (Florida), cost: 75, cuisines: Tea, Bakery, Desserts\nAccommodation: Riverside Drive Apartment, Orlando (Florida), cost: 878, maximum occupancy: 5, house rules: No visitors & No parties & No smoking, minimum nights: 31\n\nNumber of people: 1\nTotal cost: 1 x 298 + 1 x 75 + 1 x 878 = 1,251\nAccommodation minimum nights: 1/31\n\nDays: 2\nCurrent City: Orlando (Florida)\nTransportation: -\nBreakfast: Turquoise Villa, Orlando (Florida), cost: 55, cuisines: French, Bakery, BBQ, Fast Food\nAttraction: The Wheel at ICON Park, Orlando (Florida); Madame Tussauds Orlando, Orlando (Florida)\nLunch: The Tandoori Times, Orlando (Florida), cost: 84, cuisines: Tea, Cafe, BBQ, Italian\nDinner: Crust N Cakes, Orlando (Florida), cost: 61, cuisines: Tea, Cafe, Indian, BBQ\nAccommodation: Riverside Drive Apartment, Orlando (Florida), cost: 878, maximum occupancy: 5, house rules: No visitors & No parties & No smoking, minimum nights: 31\n\nNumber of people: 1\nTotal cost: 1 x 55 + 1 x 84 + 1 x 61 + 1 x 878 = 1,078\nAccommodation minimum nights: 2/31\n\nDays: 3\nCurrent City: from Orlando (Florida) to Fort Myers (Florida)\nTransportation: Flight Number: F3564762, from Orlando (Florida) to Fort Myers (Florida), Departure Time: 12:45, Arrival Time: 13:35, cost: 63\nBreakfast: Indochi Cafe & Restaurant, Orlando (Florida), cost: 72, cuisines: Pizza, French, Bakery, Fast Food, Indian, Seafood\nAttraction: SeaWorld Orlando, Orlando (Florida)\nLunch: Bite N Sip, Orlando (Florida), cost: 76, cuisines: Chinese, Bakery, Cafe, Fast Food\nDinner: The Refinery, Fort Myers (Florida), cost: 22, cuisines: Bakery, Indian, Seafood\nAccommodation: Quiet and beautiful apartment near central park, Fort Myers (Florida), cost: 930, maximum occupancy: 9, house rules: No parties & No smoking, minimum nights: 7\n\nNumber of people: 1\nTotal cost: 1 x 63 + 1 x 72 + 1 x 76 + 1 x 22 + 1 x 930 = 1,163\nAccommodation minimum nights: 1/7\n\nDays: 4\nCurrent City: Fort Myers (Florida)\nTransportation: -\nBreakfast: Al Mukhtar Bakery, Fort Myers (Florida), cost: 54, cuisines: BBQ, Tea, American, Desserts\nAttraction: Edison & Ford Winter Estates, Fort Myers (Florida); Six Mile Cypress Slough Preserve, Fort Myers (Florida)\nLunch: Haunted, Fort Myers (Florida), cost: 50, cuisines: Desserts, French, Fast Food, Cafe, Seafood\nDinner: Eggers Madhouse, Fort Myers (Florida), cost: 76, cuisines: BBQ, Mediterranean, Seafood\nAccommodation: Quiet and beautiful apartment near central park, Fort Myers (Florida), cost: 930, maximum occupancy: 9, house rules: No parties & No smoking, minimum nights: 7\n\nNumber of people: 1\nTotal cost: 1 x 54 + 1 x 50 + 1 x 76 + 1 x 930 = 1,110\nAccommodation minimum nights: 2/7\n\nDays: 5\nCurrent City: from Fort Myers (Florida) to St. Louis\nTransportation: Flight Number: F3951040, from Fort Myers (Florida) to St. Louis, Departure Time: 06:03, Arrival Time: 07:38, cost: 236\nBreakfast: Maachh Bhaat, Fort Myers (Florida), cost: 66, cuisines: Desserts, Pizza, Fast Food, Mediterranean, Seafood\nAttraction: Manatee Park, Fort Myers (Florida)\nLunch: -\nDinner: -\nAccommodation: -\n\nNumber of people: 1\nTotal cost: 1 x 236 + 1 x 66 = 302\n\nTotal cost across all days: 1,251 + 1,078 + 1,163 + 1,110 + 302 = 4,904\n\nUnfortunately, the total cost of the travel plan ($4,904) exceeds the specified budget of $2,900. Adjustments need to be made to the plan to reduce costs. This could include selecting cheaper flights, accommodations, or dining options. Please note that the accommodation in Orlando has a minimum stay of 31 nights, which is not suitable for this itinerary. Additionally, the accommodation in Fort Myers has a minimum stay of 7 nights, which also does not fit the itinerary. These accommodations should be replaced with ones that match the duration of the stay and budget constraints.", "gpt-4-1106-preview_direct_sole-planning_parsed_results": [{"day": 1, "current_city": "from St. Louis to Orlando (Florida)", "transportation": "Flight Number: F4003646, from St. Louis to Orlando (Florida), Departure Time: 07:31, Arrival Time: 10:43", "breakfast": "-", "attraction": "-", "lunch": "-", "dinner": "Fuji Japanese Steakhouse, Orlando (Florida)", "accommodation": "Riverside Drive Apartment, Orlando (Florida)"}, {"day": 2, "current_city": "Orlando (Florida)", "transportation": "-", "breakfast": "Turquoise Villa, Orlando (Florida)", "attraction": "The Wheel at ICON Park, Orlando (Florida);Madame Tussauds Orlando, Orlando (Florida);", "lunch": "The Tandoori Times, Orlando (Florida)", "dinner": "Crust N Cakes, Orlando (Florida)", "accommodation": "Riverside Drive Apartment, Orlando (Florida)"}, {"day": 3, "current_city": "from Orlando (Florida) to Fort Myers (Florida)", "transportation": "Flight Number: F3564762, from Orlando (Florida) to Fort Myers (Florida), Departure Time: 12:45, Arrival Time: 13:35", "breakfast": "Indochi Cafe & Restaurant, Orlando (Florida)", "attraction": "SeaWorld Orlando, Orlando (Florida)", "lunch": "Bite N Sip, Orlando (Florida)", "dinner": "The Refinery, Fort Myers (Florida)", "accommodation": "Quiet and beautiful apartment near central park, Fort Myers (Florida)"}, {"day": 4, "current_city": "Fort Myers (Florida)", "transportation": "-", "breakfast": "Al Mukhtar Bakery, Fort Myers (Florida)", "attraction": "Edison & Ford Winter Estates, Fort Myers (Florida);Six Mile Cypress Slough Preserve, Fort Myers (Florida);", "lunch": "Haunted, Fort Myers (Florida)", "dinner": "Eggers Madhouse, Fort Myers (Florida)", "accommodation": "Quiet and beautiful apartment near central park, Fort Myers (Florida)"}, {"day": 5, "current_city": "from Fort Myers (Florida) to St. Louis", "transportation": "Flight Number: F3951040, from Fort Myers (Florida) to St. Louis, Departure Time: 06:03, Arrival Time: 07:38", "breakfast": "Maachh Bhaat, Fort Myers (Florida)", "attraction": "Manatee Park, Fort Myers (Florida)", "lunch": "-", "dinner": "-", "accommodation": "-"}]}]