[{"gpt-4-1106-preview_direct_sole-planning_results": "Travel Plan:\n\nDays: 1\nCurrent City: from Milwaukee to New York\nTransportation: Flight Number: F3643145, from Milwaukee to New York, Departure Time: 18:36, Arrival Time: 21:58, cost: 226\nBreakfast: -\nAttraction: -\nLunch: -\nDinner: -\nAccommodation: A Contemporary Homelike Stay in the Best of BK, New York, cost: 228, maximum occupancy: 2, house rules: No pets & No visitors & No children under 10, minimum nights: 2\n\nNumber of people: 2\nTotal cost: 2 x 226 + 1 x 228 = 680\nAccommodation minimum nights: 1/2\n\nDays: 2\nCurrent City: New York\nTransportation: -\nBreakfast: Green Chick Chop, New York, cost: 26, cuisines: Tea, French, Cafe, Seafood\nAttraction: Central Park, New York; Statue of Liberty, New York; Empire State Building, New York\nLunch: Seasons 52 Fresh Grill, New York, cost: 30, cuisines: Seafood, Indian, Desserts, Italian\nDinner: Lord of the Drinks Forum, New York, cost: 71, cuisines: Cafe, Bakery, BBQ, Chinese, Indian\nAccommodation: A Contemporary Homelike Stay in the Best of BK, New York, cost: 228, maximum occupancy: 2, house rules: No pets & No visitors & No children under 10, minimum nights: 2\n\nNumber of people: 2\nTotal cost: 2 x 26 + 2 x 30 + 2 x 71 + 1 x 228 = 482\nAccommodation minimum nights: 2/2\n\nDays: 3\nCurrent City: from New York to Milwaukee\nTransportation: Flight Number: F3644990, from New York to Milwaukee, Departure Time: 15:20, Arrival Time: 16:27, cost: 218\nBreakfast: Sir John Bakery Cafe, New York, cost: 78, cuisines: Pizza, Bakery, Desserts\nAttraction: The High Line, New York; Times Square, New York\nLunch: Garam Masala Food Corner, New York, cost: 40, cuisines: Pizza, Bakery, Desserts\nDinner: -\nAccommodation: -\n\nNumber of people: 2\nTotal cost: 2 x 218 + 2 x 78 + 2 x 40 = 672\n\nTotal cost across all days: 680 + 482 + 672 = 1,834\nCuisines: All restaurants selected offer a variety of cuisines, satisfying diverse tastes.\nRoom Constraint: All accommodations selected are non-shared rooms, ensuring privacy for the two travelers.\nTransportation Constraint: All travel between cities is managed via flights, with no self-driving or taxis used.\nHouse Rules: Accommodations selected adhere to the preference for no shared rooms and comply with house rules.\n\nNote: The travel plan includes costs for transportation, meals, and accommodations, and the total cost does not exceed the specified budget of $1,900. The plan also ensures that the accommodations are non-shared rooms as requested.", "gpt-4-1106-preview_direct_sole-planning_parsed_results": [{"day": 1, "current_city": "from Milwaukee to New York", "transportation": "Flight Number: F3643145, from Milwaukee to New York, Departure Time: 18:36, Arrival Time: 21:58", "breakfast": "-", "attraction": "-", "lunch": "-", "dinner": "-", "accommodation": "A Contemporary Homelike Stay in the Best of BK, New York"}, {"day": 2, "current_city": "New York", "transportation": "-", "breakfast": "Green Chick Chop, New York", "attraction": "Central Park, New York;Statue of Liberty, New York;Empire State Building, New York", "lunch": "Seasons 52 Fresh Grill, New York", "dinner": "Lord of the Drinks Forum, New York", "accommodation": "A Contemporary Homelike Stay in the Best of BK, New York"}, {"day": 3, "current_city": "from New York to Milwaukee", "transportation": "Flight Number: F3644990, from New York to Milwaukee, Departure Time: 15:20, Arrival Time: 16:27", "breakfast": "Sir John Bakery Cafe, New York", "attraction": "The High Line, New York;Times Square, New York", "lunch": "Garam Masala Food Corner, New York", "dinner": "-", "accommodation": "-"}]}]