[{"gpt-4-1106-preview_direct_sole-planning_results": "Travel Plan:\n\nDays: 1\nCurrent City: from Houston to Wichita\nTransportation: Flight Number: F3811146, from Houston to Wichita, Departure Time: 14:17, Arrival Time: 16:13, cost: 168\nBreakfast: -\nAttraction: -\nLunch: -\nDinner: Jahanpanah, Wichita, cost: 18, cuisines: Indian, Desserts, Fast Food\nAccommodation: Secret Garden Apartment in Bed Stuy, Brooklyn, Wichita, cost: 214, maximum occupancy: 3, house rules: No smoking & No children under 10, minimum nights: 2\n\nNumber of people: 3\nTotal cost: 3 x 168 + 3 x 18 + 1 x 214 = 724\nAccommodation minimum nights: 1/2\n\nDays: 2\nCurrent City: Wichita\nTransportation: -\nBreakfast: Koramangala Social, Wichita, cost: 38, cuisines: Tea, Bakery, Cafe, Indian, Mediterranean\nAttraction: Exploration Place, Wichita; Sedgwick County Zoo, Wichita; Wichita Art Museum, Wichita\nLunch: The B.A.W.A, Wichita, cost: 23, cuisines: Tea, Chinese, Pizza, BBQ\nDinner: Rumi's Kitchen, Wichita, cost: 34, cuisines: Bakery, Fast Food, Cafe, Indian, Seafood\nAccommodation: Secret Garden Apartment in Bed Stuy, Brooklyn, Wichita, cost: 214, maximum occupancy: 3, house rules: No smoking & No children under 10, minimum nights: 2\n\nNumber of people: 3\nTotal cost: 3 x 38 + 3 x 23 + 3 x 34 + 1 x 214 = 547\nAccommodation minimum nights: 2/2\n\nDays: 3\nCurrent City: from Wichita to Houston\nTransportation: Flight Number: F3827300, from Wichita to Houston, Departure Time: 12:10, Arrival Time: 14:38, cost: 152\nBreakfast: Cafe Cornucopia, Wichita, cost: 76, cuisines: Tea, Cafe, Bakery\nAttraction: Old Cowtown Museum, Wichita; The Keeper of the Plains, Wichita\nLunch: -\nDinner: -\nAccommodation: -\n\nNumber of people: 3\nTotal cost: 3 x 152 + 3 x 76 = 684\n\nTotal cost across all days: 724 + 547 + 684 = 1,955\nCuisines: The prompt specifies no cuisines, so all cuisines constraints are satisfied.\nRoom Constraint: All accommodations selected are entire rooms. However, the house rules state \"No smoking,\" which conflicts with the query's requirement for smoking accommodation. Unfortunately, there is no available accommodation listed that allows smoking, so this constraint cannot be met with the given data.\nTransportation Constraint: All travel between cities is managed via flights, as per the available data.\n\nPlease note that the accommodation does not meet the smoking requirement as per the provided data. If smoking is a strict necessity, alternative accommodations not listed in the provided data would need to be sourced.", "gpt-4-1106-preview_direct_sole-planning_parsed_results": [{"day": 1, "current_city": "from Houston to Wichita", "transportation": "Flight Number: F3811146, from Houston to Wichita, Departure Time: 14:17, Arrival Time: 16:13", "breakfast": "-", "attraction": "-", "lunch": "-", "dinner": "Jahanpanah, Wichita", "accommodation": "Secret Garden Apartment in Bed Stuy, Brooklyn, Wichita"}, {"day": 2, "current_city": "Wichita", "transportation": "-", "breakfast": "Koramangala Social, Wichita", "attraction": "Exploration Place, Wichita;Sedgwick County Zoo, Wichita;Wichita Art Museum, Wichita;", "lunch": "The B.A.W.A, Wichita", "dinner": "Rumi's Kitchen, Wichita", "accommodation": "Secret Garden Apartment in Bed Stuy, Brooklyn, Wichita"}, {"day": 3, "current_city": "from Wichita to Houston", "transportation": "Flight Number: F3827300, from Wichita to Houston, Departure Time: 12:10, Arrival Time: 14:38", "breakfast": "Cafe Cornucopia, Wichita", "attraction": "Old Cowtown Museum, Wichita;The Keeper of the Plains, Wichita;", "lunch": "-", "dinner": "-", "accommodation": "-"}]}]