[{"gpt-4-1106-preview_direct_sole-planning_results": "Travel Plan:\n\nDays: 1\nCurrent City: from Washington to Bemidji (Minnesota)\nTransportation: Self-driving, from Washington to Bemidji, duration: 20 hours 8 mins, distance: 2,120 km, cost: 106\nBreakfast: -\nAttraction: -\nLunch: -\nDinner: -\nAccommodation: Beautiful 1 bedroom in city center, Bemidji (Minnesota), cost: 1154, room type: Entire home/apt, house rules: No parties & No smoking & No children under 10, minimum nights: 2, maximum occupancy: 3\n\nNumber of people: 1\nTotal cost: 106 + 1154 = 1,260\nAccommodation minimum nights: 1/2\n\nDays: 2\nCurrent City: Bemidji (Minnesota)\nTransportation: -\nBreakfast: Pig and Whistle, Bemidji (Minnesota), cost: 39, cuisines: Fast Food, Mexican, Bakery, Seafood\nAttraction: Paul Bunyan & Babe the Blue Ox Statues, Bemidji (Minnesota); Headwaters Science Center, Bemidji (Minnesota)\nLunch: Flying Cakes, Bemidji (Minnesota), cost: 43, cuisines: Tea, Seafood\nDinner: Outback Bar and Grill - Leisure Inn, Bemidji (Minnesota), cost: 59, cuisines: Indian, Desserts, Fast Food\nAccommodation: Beautiful 1 bedroom in city center, Bemidji (Minnesota), cost: 1154, room type: Entire home/apt, house rules: No parties & No smoking & No children under 10, minimum nights: 2, maximum occupancy: 3\n\nNumber of people: 1\nTotal cost: 39 + 43 + 59 + 1154 = 1,295\nAccommodation minimum nights: 2/2\n\nDays: 3\nCurrent City: from Bemidji (Minnesota) to Minneapolis (Minnesota)\nTransportation: Flight Number: F3847877, from Bemidji to Minneapolis, Departure Time: 08:06, Arrival Time: 10:37, cost: 63\nBreakfast: -\nAttraction: -\nLunch: The Cafe, Minneapolis (Minnesota), cost: 14, cuisines: Indian, Mediterranean, Desserts, Seafood\nDinner: Malo, Minneapolis (Minnesota), cost: 80, cuisines: Tea, Chinese, Indian, Cafe\nAccommodation: Light-filled Apartment in great area, close 2 all!, Minneapolis (Minnesota), cost: 343, room type: Entire home/apt, house rules: No visitors, minimum nights: 1, maximum occupancy: 2\n\nNumber of people: 1\nTotal cost: 63 + 14 + 80 + 343 = 500\nAccommodation minimum nights: 1/1\n\nDays: 4\nCurrent City: Minneapolis (Minnesota)\nTransportation: -\nBreakfast: Court Avenue Brewing Company, Minneapolis (Minnesota), cost: 31, cuisines: Pizza, French, Bakery, BBQ, Seafood\nAttraction: Minneapolis Sculpture Garden, Minneapolis (Minnesota); Minneapolis Institute of Art, Minneapolis (Minnesota)\nLunch: Troll Tavern, Minneapolis (Minnesota), cost: 71, cuisines: Tea, BBQ, Mediterranean\nDinner: Texas Roadhouse, Minneapolis (Minnesota), cost: 22, cuisines: Cafe, Pizza, BBQ, Desserts\nAccommodation: Light-filled Apartment in great area, close 2 all!, Minneapolis (Minnesota), cost: 343, room type: Entire home/apt, house rules: No visitors, minimum nights: 1, maximum occupancy: 2\n\nNumber of people: 1\nTotal cost: 31 + 71 + 22 + 343 = 467\nAccommodation minimum nights: 2/1\n\nDays: 5\nCurrent City: from Minneapolis (Minnesota) to Duluth (Minnesota)\nTransportation: Flight Number: F3640437, from Minneapolis to Duluth, Departure Time: 08:54, Arrival Time: 10:05, cost: 52\nBreakfast: -\nAttraction: -\nLunch: Sodam Korean Restaurant, Duluth (Minnesota), cost: 25, cuisines: Desserts, Tea, French, Fast Food, Cafe\nDinner: Skye - Hotel Unique, Duluth (Minnesota), cost: 31, cuisines: French, Mexican, Bakery, BBQ\nAccommodation: Renovated 1BR Penthouse Oasis In Brownstone, Duluth (Minnesota), cost: 1172, room type: Entire home/apt, house rules: No visitors & No parties, minimum nights: 3, maximum occupancy: 2\n\nNumber of people: 1\nTotal cost: 52 + 25 + 31 + 1172 = 1,280\nAccommodation minimum nights: 1/3\n\nDays: 6\nCurrent City: Duluth (Minnesota)\nTransportation: -\nBreakfast: Chandlers Steakhouse, Duluth (Minnesota), cost: 98, cuisines: Desserts, Tea, Italian, Bakery, Fast Food, American\nAttraction: Glensheen Mansion, Duluth (Minnesota); Leif Erikson Park, Duluth (Minnesota)\nLunch: Lulu's Chocolate Bar, Duluth (Minnesota), cost: 97, cuisines: Pizza, Desserts\nDinner: Bitters & Love, Duluth (Minnesota), cost: 33, cuisines: Bakery, Pizza, BBQ, Fast Food\nAccommodation: Renovated 1BR Penthouse Oasis In Brownstone, Duluth (Minnesota), cost: 1172, room type: Entire home/apt, house rules: No visitors & No parties, minimum nights: 3, maximum occupancy: 2\n\nNumber of people: 1\nTotal cost: 98 + 97 + 33 + 1172 = 1,400\nAccommodation minimum nights: 2/3\n\nDays: 7\nCurrent City: from Duluth (Minnesota) to Washington\nTransportation: Self-driving, from Duluth to Washington, duration: 17 hours 50 mins, distance: 1,881 km, cost: 94\nBreakfast: Tokyo Japanese Steak House, Duluth (Minnesota), cost: 80, cuisines: Chinese, American, Desserts, Seafood\nAttraction: Lake Superior Railroad Museum, Duluth (Minnesota); Lake Superior Maritime Visitor Center, Duluth (Minnesota)\nLunch: -\nDinner: -\nAccommodation: -\n\nNumber of people: 1\nTotal cost: 94 + 80 = 174\n\nTotal cost across all days: 1,260 + 1,295 + 500 + 467 + 1,280 + 1,400 + 174 = 6,376\n\nCuisines: All cuisines constraints are satisfied as no specific cuisines were requested.\nRoom Constraint: All accommodations selected are entire home/apt ensuring privacy.\nTransportation Constraint: The travel plan includes self-driving and flights, as requested.\nHouse Rules: All accommodations selected meet the house rules specified in the listings.\nBudget: The total cost of the travel plan is within the specified budget of $7,200.", "gpt-4-1106-preview_direct_sole-planning_parsed_results": [{"day": 1, "current_city": "from Washington to Bemidji", "transportation": "Self-driving, from Washington to Bemidji, duration: 20 hours 8 mins, distance: 2,120 km", "breakfast": "-", "attraction": "-", "lunch": "-", "dinner": "-", "accommodation": "Beautiful 1 bedroom in city center, Bemidji"}, {"day": 2, "current_city": "Bemidji", "transportation": "-", "breakfast": "Pig and Whistle, Bemidji", "attraction": "Paul Bunyan & Babe the Blue Ox Statues, Bemidji;Headwaters Science Center, Bemidji;", "lunch": "Flying Cakes, Bemidji", "dinner": "Outback Bar and Grill - Leisure Inn, Bemidji", "accommodation": "Beautiful 1 bedroom in city center, Bemidji"}, {"day": 3, "current_city": "from Bemidji to Minneapolis", "transportation": "Flight Number: F3847877, from Bemidji to Minneapolis, Departure Time: 08:06, Arrival Time: 10:37", "breakfast": "-", "attraction": "-", "lunch": "The Cafe, Minneapolis", "dinner": "Malo, Minneapolis", "accommodation": "Light-filled Apartment in great area, close 2 all!, Minneapolis"}, {"day": 4, "current_city": "Minneapolis", "transportation": "-", "breakfast": "Court Avenue Brewing Company, Minneapolis", "attraction": "Minneapolis Sculpture Garden, Minneapolis;Minneapolis Institute of Art, Minneapolis;", "lunch": "Troll Tavern, Minneapolis", "dinner": "Texas Roadhouse, Minneapolis", "accommodation": "Light-filled Apartment in great area, close 2 all!, Minneapolis"}, {"day": 5, "current_city": "from Minneapolis to Duluth", "transportation": "Flight Number: F3640437, from Minneapolis to Duluth, Departure Time: 08:54, Arrival Time: 10:05", "breakfast": "-", "attraction": "-", "lunch": "Sodam Korean Restaurant, Duluth", "dinner": "Skye - Hotel Unique, Duluth", "accommodation": "Renovated 1BR Penthouse Oasis In Brownstone, Duluth"}, {"day": 6, "current_city": "Duluth", "transportation": "-", "breakfast": "Chandlers Steakhouse, Duluth", "attraction": "Glensheen Mansion, Duluth;Leif Erikson Park, Duluth;", "lunch": "Lulu's Chocolate Bar, Duluth", "dinner": "Bitters & Love, Duluth", "accommodation": "Renovated 1BR Penthouse Oasis In Brownstone, Duluth"}, {"day": 7, "current_city": "from Duluth to Washington", "transportation": "Self-driving, from Duluth to Washington, duration: 17 hours 50 mins, distance: 1,881 km", "breakfast": "Tokyo Japanese Steak House, Duluth", "attraction": "Lake Superior Railroad Museum, Duluth;Lake Superior Maritime Visitor Center, Duluth;", "lunch": "-", "dinner": "-", "accommodation": "-"}]}]