[{"gpt-4-1106-preview_direct_sole-planning_results": "Travel Plan:\n\nDays: 1\nCurrent City: from Atlanta to Knoxville\nTransportation: Flight Number: F3556207, from Atlanta to Knoxville, Departure Time: 10:57, Arrival Time: 11:42, cost: 45\nBreakfast: -\nAttraction: -\nLunch: -\nDinner: Cafe Arabelle, Knoxville, cost: 29, cuisines: French, BBQ, Desserts, Seafood\nAccommodation: Light-filled Room in Renovated Apt, Knoxville, cost: 310, room type: Private room, house rules: No pets, minimum nights: 2, maximum occupancy: 2\n\nNumber of people: 2 adults and 1 child under 10 (assuming 3 travelers based on room occupancy)\nTotal cost: 3 x 45 + 3 x 29 + 1 x 310 = 503\nAccommodation minimum nights: 1/2\n\nDays: 2\nCurrent City: Knoxville\nTransportation: -\nBreakfast: Les 3 Brasseurs, Knoxville, cost: 24, cuisines: Desserts, Pizza, Italian, Cafe, Indian\nAttraction: Zoo Knoxville, Knoxville; Ijams Nature Center, Knoxville\nLunch: Mamagoto, Knoxville, cost: 14, cuisines: Indian, Mediterranean, Desserts, Seafood\nDinner: Cafe Coffee Day, Knoxville, cost: 82, cuisines: Fast Food, American, BBQ, Italian\nAccommodation: Light-filled Room in Renovated Apt, Knoxville, cost: 310, room type: Private room, house rules: No pets, minimum nights: 2, maximum occupancy: 2\n\nNumber of people: 2 adults and 1 child under 10\nTotal cost: 3 x 24 + 3 x 14 + 3 x 82 + 1 x 310 = 682\nAccommodation minimum nights: 2/2\n\nDays: 3\nCurrent City: from Knoxville to Atlanta\nTransportation: Flight Number: F3518895, from Knoxville to Atlanta, Departure Time: 18:47, Arrival Time: 19:44, cost: 45\nBreakfast: Coalition Cafe, Knoxville, cost: 35, cuisines: Desserts, Tea, BBQ, Cafe, Mediterranean\nAttraction: World's Fair Park, Knoxville; Knoxville Museum of Art, Knoxville\nLunch: Punjabi Flavour, Knoxville, cost: 41, cuisines: Tea, Bakery, Cafe, Indian, Seafood\nDinner: -\nAccommodation: -\n\nNumber of people: 2 adults and 1 child under 10\nTotal cost: 3 x 35 + 3 x 41 + 3 x 45 = 363\n\nTotal cost across all days: 503 + 682 + 363 = 1,548\n\nUnfortunately, the total cost exceeds the specified budget of $1,000. To adjust the plan to fit within the budget, we can consider the following changes:\n\n- Opt for the cheapest flight options available.\n- Select more budget-friendly restaurants for meals.\n- Ensure the accommodation chosen is within the budget and meets the minimum night stay requirements.\n\nRevised Travel Plan with Budget Considerations:\n\nDays: 1\nCurrent City: from Atlanta to Knoxville\nTransportation: Flight Number: F3645549, from Atlanta to Knoxville, Departure Time: 08:13, Arrival Time: 09:00, cost: 35\nBreakfast: -\nAttraction: -\nLunch: -\nDinner: Mamagoto, Knoxville, cost: 14, cuisines: Indian, Mediterranean, Desserts, Seafood\nAccommodation: Light-filled Room in Renovated Apt, Knoxville, cost: 310, room type: Private room, house rules: No pets, minimum nights: 2, maximum occupancy: 2\n\nNumber of people: 2 adults and 1 child under 10\nTotal cost: 3 x 35 + 3 x 14 + 1 x 310 = 443\nAccommodation minimum nights: 1/2\n\nDays: 2\nCurrent City: Knoxville\nTransportation: -\nBreakfast: Les 3 Brasseurs, Knoxville, cost: 24, cuisines: Desserts, Pizza, Italian, Cafe, Indian\nAttraction: Sunsphere, Knoxville; Knoxville Walking Tours, Knoxville\nLunch: Tandoori Tadka, Knoxville, cost: 23, cuisines: Chinese, Pizza, Desserts, Fast Food\nDinner: Anand Sweets, Knoxville, cost: 45, cuisines: Fast Food, Pizza, Indian, Seafood\nAccommodation: Light-filled Room in Renovated Apt, Knoxville, cost: 310, room type: Private room, house rules: No pets, minimum nights: 2, maximum occupancy: 2\n\nNumber of people: 2 adults and 1 child under 10\nTotal cost: 3 x 24 + 3 x 23 + 3 x 45 + 1 x 310 = 557\nAccommodation minimum nights: 2/2\n\nDays: 3\nCurrent City: from Knoxville to Atlanta\nTransportation: Flight Number: F3528859, from Knoxville to Atlanta, Departure Time: 15:26, Arrival Time: 16:12, cost: 35\nBreakfast: Open Kitchen, Knoxville, cost: 13, cuisines: Pizza, Bakery, BBQ, Cafe, Indian, Mediterranean\nAttraction: East Tennessee Historical Society and Museum, Knoxville; Charles Krutch Park, Knoxville\nLunch: Biryani By Kilo, Knoxville, cost: 17, cuisines: Chinese, Pizza, Fast Food\nDinner: -\nAccommodation: -\n\nNumber of people: 2 adults and 1 child under 10\nTotal cost: 3 x 13 + 3 x 17 + 3 x 35 = 195\n\nTotal revised cost across all days: 443 + 557 + 195 = 1,195\n\nThe revised plan still slightly exceeds the budget. To further reduce costs, we could consider the following:\n\n- Replace one or more meals with more affordable options.\n- Adjust the attractions to include free or lower-cost options.\n- Re-evaluate the accommodation choice for a less expensive option that still meets the criteria.\n\nPlease note that the above plan is a suggestion and may require further adjustments to fit within the budget while also meeting the specified constraints and preferences.", "gpt-4-1106-preview_direct_sole-planning_parsed_results": [{"day": 1, "current_city": "from Atlanta to Knoxville", "transportation": "Flight Number: F3556207, from Atlanta to Knoxville, Departure Time: 10:57, Arrival Time: 11:42", "breakfast": "-", "attraction": "-", "lunch": "-", "dinner": "Cafe Arabelle, Knoxville", "accommodation": "Light-filled Room in Renovated Apt, Knoxville"}, {"day": 2, "current_city": "Knoxville", "transportation": "-", "breakfast": "Les 3 Brasseurs, Knoxville", "attraction": "Zoo Knoxville, Knoxville;Ijams Nature Center, Knoxville;", "lunch": "Mamagoto, Knoxville", "dinner": "Cafe Coffee Day, Knoxville", "accommodation": "Light-filled Room in Renovated Apt, Knoxville"}, {"day": 3, "current_city": "from Knoxville to Atlanta", "transportation": "Flight Number: F3518895, from Knoxville to Atlanta, Departure Time: 18:47, Arrival Time: 19:44", "breakfast": "Coalition Cafe, Knoxville", "attraction": "World's Fair Park, Knoxville;Knoxville Museum of Art, Knoxville;", "lunch": "Punjabi Flavour, Knoxville", "dinner": "-", "accommodation": "-"}, {"day": 1, "current_city": "from Atlanta to Knoxville", "transportation": "Flight Number: F3645549, from Atlanta to Knoxville, Departure Time: 08:13, Arrival Time: 09:00", "breakfast": "-", "attraction": "-", "lunch": "-", "dinner": "Mamagoto, Knoxville", "accommodation": "Light-filled Room in Renovated Apt, Knoxville"}, {"day": 2, "current_city": "Knoxville", "transportation": "-", "breakfast": "Les 3 Brasseurs, Knoxville", "attraction": "Sunsphere, Knoxville;Knoxville Walking Tours, Knoxville;", "lunch": "Tandoori Tadka, Knoxville", "dinner": "Anand Sweets, Knoxville", "accommodation": "Light-filled Room in Renovated Apt, Knoxville"}, {"day": 3, "current_city": "from Knoxville to Atlanta", "transportation": "Flight Number: F3528859, from Knoxville to Atlanta, Departure Time: 15:26, Arrival Time: 16:12", "breakfast": "Open Kitchen, Knoxville", "attraction": "East Tennessee Historical Society and Museum, Knoxville;Charles Krutch Park, Knoxville;", "lunch": "Biryani By Kilo, Knoxville", "dinner": "-", "accommodation": "-"}]}]