[{"gpt-4-1106-preview_direct_sole-planning_results": "Travel Plan:\n\nDays: 1\nCurrent City: from Rapid City to Colorado Springs (Colorado)\nTransportation: Self-driving, from Rapid City to Colorado Springs, duration: 6 hours 59 mins, distance: 735 km, cost: 36\nBreakfast: -\nAttraction: -\nLunch: -\nDinner: -\nAccommodation: Large sunny park slope apartment, Colorado Springs (Colorado), cost: 82, room type: Entire home/apt, house rules: No smoking & No parties & No pets, minimum nights: 1, maximum occupancy: 3\n\nNumber of people: 7\nTotal cost: 7 x 36 + 3 x 82 = 522\nAccommodation minimum nights: 1/1\n\nDays: 2\nCurrent City: Colorado Springs (Colorado)\nTransportation: -\nBreakfast: Raglan Road Irish Pub and Restaurant, Colorado Springs (Colorado), cost: 97, cuisines: Chinese, Bakery, Pizza, Mediterranean\nAttraction: The Broadmoor Seven Falls, Colorado Springs (Colorado); Garden of the Gods, Colorado Springs (Colorado)\nLunch: Derby, Colorado Springs (Colorado), cost: 67, cuisines: Desserts, Fast Food\nDinner: Club Tokyo - Best Western Skycity Hotel, Colorado Springs (Colorado), cost: 64, cuisines: Tea, Bakery, Mediterranean, Fast Food\nAccommodation: Large sunny park slope apartment, Colorado Springs (Colorado), cost: 82, room type: Entire home/apt, house rules: No smoking & No parties & No pets, minimum nights: 1, maximum occupancy: 3\n\nNumber of people: 7\nTotal cost: 7 x 97 + 7 x 67 + 7 x 64 + 3 x 82 = 2,079\nAccommodation minimum nights: 2/1\n\nDays: 3\nCurrent City: from Colorado Springs (Colorado) to Denver (Colorado)\nTransportation: Flight Number: F3822851, from Colorado Springs to Denver, Departure Time: 05:54, Arrival Time: 06:43, cost: 16\nBreakfast: GoGourmet, Colorado Springs (Colorado), cost: 66, cuisines: Desserts, Bakery, Fast Food, Indian, Seafood\nAttraction: Denver Zoo, Denver (Colorado); Denver Botanic Gardens, Denver (Colorado)\nLunch: The Fatty Bao - Asian Gastro Bar, Denver (Colorado), cost: 93, cuisines: Bakery, BBQ, Cafe, Indian, Seafood\nDinner: The Urban Socialite, Denver (Colorado), cost: 34, cuisines: Cafe, Indian, Desserts, Italian\nAccommodation: Harlem cozy nights, Denver (Colorado), cost: 457, room type: Entire home/apt, house rules: No visitors, minimum nights: 4, maximum occupancy: 3\n\nNumber of people: 7\nTotal cost: 7 x 16 + 7 x 66 + 7 x 93 + 7 x 34 + 3 x 457 = 3,409\nAccommodation minimum nights: 1/4\n\nDays: 4\nCurrent City: Denver (Colorado)\nTransportation: -\nBreakfast: Tasty Fare, Denver (Colorado), cost: 79, cuisines: French, BBQ, Fast Food\nAttraction: Denver Art Museum, Denver (Colorado); Denver Museum of Nature & Science, Denver (Colorado)\nLunch: Woods Spice, Denver (Colorado), cost: 69, cuisines: Tea, Cafe, Mexican, Desserts\nDinner: Al Yousuf, Denver (Colorado), cost: 32, cuisines: Desserts, Tea, Pizza, French, American\nAccommodation: Harlem cozy nights, Denver (Colorado), cost: 457, room type: Entire home/apt, house rules: No visitors, minimum nights: 4, maximum occupancy: 3\n\nNumber of people: 7\nTotal cost: 7 x 79 + 7 x 69 + 7 x 32 + 3 x 457 = 2,695\nAccommodation minimum nights: 2/4\n\nDays: 5\nCurrent City: from Denver (Colorado) to Alamosa (Colorado)\nTransportation: Flight Number: F3837889, from Denver to Alamosa, Departure Time: 16:17, Arrival Time: 17:15, cost: 69\nBreakfast: Cafe Diva, Denver (Colorado), cost: 44, cuisines: Chinese, Cafe, Desserts, Fast Food\nAttraction: San Luis Valley Museum | Alamosa, Alamosa (Colorado); Rio Grande Farm Park, Alamosa (Colorado)\nLunch: TBH - The Big House Cafe, Denver (Colorado), cost: 22, cuisines: Cafe, Indian, Seafood, Fast Food\nDinner: Atlanta Highway Seafood Market, Alamosa (Colorado), cost: 68, cuisines: Fast Food, Desserts, Seafood\nAccommodation: Comfortable studio suite in midtown Manhattan, Alamosa (Colorado), cost: 67, room type: Entire home/apt, house rules: No parties & No smoking & No visitors, minimum nights: 30, maximum occupancy: 2\n\nNumber of people: 7\nTotal cost: 7 x 69 + 7 x 44 + 7 x 22 + 7 x 68 + 4 x 67 = 2,303\nAccommodation minimum nights: 1/30\n\nDays: 6\nCurrent City: Alamosa (Colorado)\nTransportation: -\nBreakfast: Riverwalk Cafe, Alamosa (Colorado), cost: 97, cuisines: Tea, Pizza, Fast Food\nAttraction: Cole Park, Alamosa (Colorado); Alamosa National Wildlife Refuge and Visitor Center, Alamosa (Colorado)\nLunch: Coffee to Cocktail Bar - Hyatt Place, Alamosa (Colorado), cost: 35, cuisines: Tea, Indian, Desserts, Italian\nDinner: Burger Singh, Alamosa (Colorado), cost: 95, cuisines: Desserts, Tea, BBQ, Chinese, Seafood\nAccommodation: Comfortable studio suite in midtown Manhattan, Alamosa (Colorado), cost: 67, room type: Entire home/apt, house rules: No parties & No smoking & No visitors, minimum nights: 30, maximum occupancy: 2\n\nNumber of people: 7\nTotal cost: 7 x 97 + 7 x 35 + 7 x 95 + 4 x 67 = 2,303\nAccommodation minimum nights: 2/30\n\nDays: 7\nCurrent City: from Alamosa (Colorado) to Rapid City\nTransportation: Self-driving, from Alamosa to Rapid City, duration: 9 hours 27 mins, distance: 998 km, cost: 49\nBreakfast: Cafe LazyMojo, Alamosa (Colorado), cost: 26, cuisines: Tea, Pizza, American, Fast Food\nAttraction: -\nLunch: -\nDinner: -\nAccommodation: -\n\nNumber of people: 7\nTotal cost: 7 x 49 + 7 x 26 = 525\n\nTotal cost across all days: 522 + 2,079 + 3,409 + 2,695 + 2,303 + 2,303 + 525 = 13,836\n\nCuisines: The prompt specifies no cuisines, so all cuisines constraints are satisfied.\nRoom Constraint: All accommodations selected are entire rooms.\nTransportation Constraint: The travel plan includes self-driving and flights, as per the available options and constraints.\n\nNote: The accommodation on Day 5 and Day 6 is the same, and the minimum nights constraint is not met due to the travel plan duration. However, since the travel plan is for 7 days, and the accommodation has a 30-night minimum, this is the best available option within the given constraints and budget.", "gpt-4-1106-preview_direct_sole-planning_parsed_results": [{"day": 1, "current_city": "from Rapid City to Colorado Springs", "transportation": "Self-driving, from Rapid City to Colorado Springs, duration: 6 hours 59 mins, distance: 735 km", "breakfast": "-", "attraction": "-", "lunch": "-", "dinner": "-", "accommodation": "Large sunny park slope apartment, Colorado Springs"}, {"day": 2, "current_city": "Colorado Springs", "transportation": "-", "breakfast": "Raglan Road Irish Pub and Restaurant, Colorado Springs", "attraction": "The Broadmoor Seven Falls, Colorado Springs;Garden of the Gods, Colorado Springs;", "lunch": "Derby, Colorado Springs", "dinner": "Club Tokyo - Best Western Skycity Hotel, Colorado Springs", "accommodation": "Large sunny park slope apartment, Colorado Springs"}, {"day": 3, "current_city": "from Colorado Springs to Denver", "transportation": "Flight Number: F3822851, from Colorado Springs to Denver, Departure Time: 05:54, Arrival Time: 06:43", "breakfast": "GoGourmet, Colorado Springs", "attraction": "Denver Zoo, Denver;Denver Botanic Gardens, Denver;", "lunch": "The Fatty Bao - Asian Gastro Bar, Denver", "dinner": "The Urban Socialite, Denver", "accommodation": "Harlem cozy nights, Denver"}, {"day": 4, "current_city": "Denver", "transportation": "-", "breakfast": "Tasty Fare, Denver", "attraction": "Denver Art Museum, Denver;Denver Museum of Nature & Science, Denver;", "lunch": "Woods Spice, Denver", "dinner": "Al Yousuf, Denver", "accommodation": "Harlem cozy nights, Denver"}, {"day": 5, "current_city": "from Denver to Alamosa", "transportation": "Flight Number: F3837889, from Denver to Alamosa, Departure Time: 16:17, Arrival Time: 17:15", "breakfast": "Cafe Diva, Denver", "attraction": "San Luis Valley Museum | Alamosa, Alamosa;Rio Grande Farm Park, Alamosa;", "lunch": "TBH - The Big House Cafe, Denver", "dinner": "Atlanta Highway Seafood Market, Alamosa", "accommodation": "Comfortable studio suite in midtown Manhattan, Alamosa"}, {"day": 6, "current_city": "Alamosa", "transportation": "-", "breakfast": "Riverwalk Cafe, Alamosa", "attraction": "Cole Park, Alamosa;Alamosa National Wildlife Refuge and Visitor Center, Alamosa;", "lunch": "Coffee to Cocktail Bar - Hyatt Place, Alamosa", "dinner": "Burger Singh, Alamosa", "accommodation": "Comfortable studio suite in midtown Manhattan, Alamosa"}, {"day": 7, "current_city": "from Alamosa to Rapid City", "transportation": "Self-driving, from Alamosa to Rapid City, duration: 9 hours 27 mins, distance: 998 km", "breakfast": "Cafe LazyMojo, Alamosa", "attraction": "-", "lunch": "-", "dinner": "-", "accommodation": "-"}]}]