[{"gpt-4-1106-preview_direct_sole-planning_results": "Travel Plan:\nDays: 1\nCurrent City: from Miami to San Diego (California)\nTransportation: Flight Number: F3726825, from Miami to San Diego, Departure Time: 19:07, Arrival Time: 21:25, cost: 1072\nBreakfast: -\nAttraction: -\nLunch: -\nDinner: -\nAccommodation: Spacious Room in Large 2 Bedroom Prewar Apartment, San Diego, cost: 585, room type: Private room, house rules: No parties & No visitors, minimum nights: 1, maximum occupancy: 2\n\nNumber of people: 2\nTotal cost: 2 x 1072 + 1 x 585 = 2,729\nAccommodation minimum nights: 1/1\n\nDays: 2\nCurrent City: San Diego (California)\nTransportation: -\nBreakfast: Open Yard, San Diego, cost: 33, cuisines: Chinese, Pizza, Cafe, Desserts\nAttraction: Cabrillo National Monument, San Diego; La Jolla Shores Park, San Diego; California Tower, San Diego\nLunch: Gopala, San Diego, cost: 98, cuisines: Pizza, Mexican, BBQ, American, Seafood\nDinner: Burger King, San Diego, cost: 20, cuisines: Pizza, Italian, French, Fast Food, Seafood\nAccommodation: Spacious Room in Large 2 Bedroom Prewar Apartment, San Diego, cost: 585, room type: Private room, house rules: No parties & No visitors, minimum nights: 1, maximum occupancy: 2\n\nNumber of people: 2\nTotal cost: 2 x 33 + 2 x 98 + 2 x 20 + 1 x 585 = 887\nAccommodation minimum nights: 2/1\n\nDays: 3\nCurrent City: from San Diego to Sacramento (California)\nTransportation: Flight Number: F3943119, from San Diego to Sacramento, Departure Time: 06:25, Arrival Time: 08:02, cost: 109\nBreakfast: -\nAttraction: California State Railroad Museum, Sacramento; Sacramento Zoo, Sacramento\nLunch: Braseiro da G\u00e1vea, Sacramento, cost: 37, cuisines: Desserts, Tea, Pizza, Mexican, Fast Food\nDinner: Bahama Breeze Island Grille, Sacramento, cost: 31, cuisines: French, Bakery, BBQ, Fast Food, Seafood\nAccommodation: Free Cleaning & WiFi-Near Train + Bars & Nightlife, Sacramento, cost: 237, room type: Private room, house rules: No parties, minimum nights: 1, maximum occupancy: 2\n\nNumber of people: 2\nTotal cost: 2 x 109 + 2 x 37 + 2 x 31 + 1 x 237 = 591\nAccommodation minimum nights: 1/1\n\nDays: 4\nCurrent City: Sacramento (California)\nTransportation: -\nBreakfast: Gujarati Samaj Santushti, Sacramento, cost: 12, cuisines: Tea, Pizza, Fast Food\nAttraction: Old Sacramento Waterfront, Sacramento; Crocker Art Museum, Sacramento\nLunch: Metro Fast Food, Sacramento, cost: 32, cuisines: American, BBQ, Cafe, Indian, Seafood\nDinner: Kerala Hotel, Sacramento, cost: 27, cuisines: Desserts, Tea, BBQ, Fast Food, American\nAccommodation: Free Cleaning & WiFi-Near Train + Bars & Nightlife, Sacramento, cost: 237, room type: Private room, house rules: No parties, minimum nights: 1, maximum occupancy: 2\n\nNumber of people: 2\nTotal cost: 2 x 12 + 2 x 32 + 2 x 27 + 1 x 237 = 379\nAccommodation minimum nights: 2/1\n\nDays: 5\nCurrent City: from Sacramento to Los Angeles (California)\nTransportation: Flight Number: F3972853, from Sacramento to Los Angeles, Departure Time: 12:06, Arrival Time: 13:27, cost: 79\nBreakfast: -\nAttraction: Santa Monica Pier, Los Angeles; Hollywood Walk of Fame, Los Angeles\nLunch: Palmshore, Los Angeles, cost: 25, cuisines: Desserts, Bakery, Fast Food, American, Seafood\nDinner: Punjabi Zaika, Los Angeles, cost: 46, cuisines: Pizza, Bakery, BBQ, Cafe, Indian\nAccommodation: Midtown East 2 Bed/2 Bath Elevator Building Apt, Los Angeles, cost: 540, room type: Entire home/apt, house rules: No pets, minimum nights: 1, maximum occupancy: 4\n\nNumber of people: 2\nTotal cost: 2 x 79 + 2 x 25 + 2 x 46 + 1 x 540 = 840\nAccommodation minimum nights: 1/1\n\nDays: 6\nCurrent City: Los Angeles (California)\nTransportation: -\nBreakfast: Chicken Minar, Los Angeles, cost: 25, cuisines: Bakery, Fast Food\nAttraction: Universal Studios Hollywood, Los Angeles; Griffith Park, Los Angeles\nLunch: The Hangout by 1861, Los Angeles, cost: 64, cuisines: Tea, Pizza, Seafood\nDinner: Choco Kraft, Los Angeles, cost: 20, cuisines: French, BBQ, Fast Food, Cafe, Mediterranean\nAccommodation: Midtown East 2 Bed/2 Bath Elevator Building Apt, Los Angeles, cost: 540, room type: Entire home/apt, house rules: No pets, minimum nights: 1, maximum occupancy: 4\n\nNumber of people: 2\nTotal cost: 2 x 25 + 2 x 64 + 2 x 20 + 1 x 540 = 758\nAccommodation minimum nights: 2/1\n\nDays: 7\nCurrent City: from Los Angeles to Miami\nTransportation: Flight Number: F3659468, from Los Angeles to Miami, Departure Time: 22:14, Arrival Time: 05:42, cost: 489\nBreakfast: -\nAttraction: -\nLunch: -\nDinner: -\nAccommodation: -\n\nNumber of people: 2\nTotal cost: 2 x 489 = 978\n\nTotal cost across all days: 2,729 + 887 + 591 + 379 + 840 + 758 + 978 = 7,162\n\nCuisines: Mexican and American cuisines were included in the meals where possible.\nRoom Constraint: All accommodations selected are private and meet the requirements.\nTransportation Constraint: All inter-city travel is managed via flights, as per the query.\nBudget: The total cost of the trip is within the specified budget of $7,200.", "gpt-4-1106-preview_direct_sole-planning_parsed_results": [{"day": 1, "current_city": "from Miami to San Diego", "transportation": "Flight Number: F3726825, from Miami to San Diego, Departure Time: 19:07, Arrival Time: 21:25", "breakfast": "-", "attraction": "-", "lunch": "-", "dinner": "-", "accommodation": "Spacious Room in Large 2 Bedroom Prewar Apartment, San Diego"}, {"day": 2, "current_city": "San Diego", "transportation": "-", "breakfast": "Open Yard, San Diego", "attraction": "Cabrillo National Monument, San Diego;La Jolla Shores Park, San Diego;California Tower, San Diego;", "lunch": "Gopala, San Diego", "dinner": "Burger King, San Diego", "accommodation": "Spacious Room in Large 2 Bedroom Prewar Apartment, San Diego"}, {"day": 3, "current_city": "from San Diego to Sacramento", "transportation": "Flight Number: F3943119, from San Diego to Sacramento, Departure Time: 06:25, Arrival Time: 08:02", "breakfast": "-", "attraction": "California State Railroad Museum, Sacramento;Sacramento Zoo, Sacramento;", "lunch": "Braseiro da G\u00e1vea, Sacramento", "dinner": "Bahama Breeze Island Grille, Sacramento", "accommodation": "Free Cleaning & WiFi-Near Train + Bars & Nightlife, Sacramento"}, {"day": 4, "current_city": "Sacramento", "transportation": "-", "breakfast": "Gujarati Samaj Santushti, Sacramento", "attraction": "Old Sacramento Waterfront, Sacramento;Crocker Art Museum, Sacramento;", "lunch": "Metro Fast Food, Sacramento", "dinner": "Kerala Hotel, Sacramento", "accommodation": "Free Cleaning & WiFi-Near Train + Bars & Nightlife, Sacramento"}, {"day": 5, "current_city": "from Sacramento to Los Angeles", "transportation": "Flight Number: F3972853, from Sacramento to Los Angeles, Departure Time: 12:06, Arrival Time: 13:27", "breakfast": "-", "attraction": "Santa Monica Pier, Los Angeles;Hollywood Walk of Fame, Los Angeles;", "lunch": "Palmshore, Los Angeles", "dinner": "Punjabi Zaika, Los Angeles", "accommodation": "Midtown East 2 Bed/2 Bath Elevator Building Apt, Los Angeles"}, {"day": 6, "current_city": "Los Angeles", "transportation": "-", "breakfast": "Chicken Minar, Los Angeles", "attraction": "Universal Studios Hollywood, Los Angeles;Griffith Park, Los Angeles;", "lunch": "The Hangout by 1861, Los Angeles", "dinner": "Choco Kraft, Los Angeles", "accommodation": "Midtown East 2 Bed/2 Bath Elevator Building Apt, Los Angeles"}, {"day": 7, "current_city": "from Los Angeles to Miami", "transportation": "Flight Number: F3659468, from Los Angeles to Miami, Departure Time: 22:14, Arrival Time: 05:42", "breakfast": "-", "attraction": "-", "lunch": "-", "dinner": "-", "accommodation": "-"}]}]