[{"gpt-4-1106-preview_direct_sole-planning_results": "Travel Plan:\nDays: 1\nCurrent City: from Jacksonville to Washington\nTransportation: Flight Number: F3635008, from Jacksonville to Washington, Departure Time: 16:58, Arrival Time: 18:44, cost: 133\nBreakfast: -\nAttraction: -\nLunch: -\nDinner: Los Aztecas, Washington, cost: 46, cuisines: Cafe, Bakery, BBQ, Fast Food\nAccommodation: Stunning 2Bed/2BA + 300sqft deck by the river!, Washington, cost: 209, maximum occupancy: 3, house rules: No visitors, minimum nights: 1\n\nNumber of people: 2\nTotal cost: 2 x 133 + 2 x 46 + 1 x 209 = 567\nAccommodation minimum nights: 1/1\n\nDays: 2\nCurrent City: Washington\nTransportation: -\nBreakfast: Manna Java World Cafe, Washington, cost: 59, cuisines: Cafe, Seafood\nAttraction: The Seattle Great Wheel, Washington; Discovery Park, Washington\nLunch: Hemingway's Island Grill, Washington, cost: 57, cuisines: Mexican, BBQ, Fast Food, Cafe, Seafood\nDinner: Thaaliwala, Washington, cost: 88, cuisines: Tea, Pizza, Italian, BBQ, Cafe\nAccommodation: Stunning 2Bed/2BA + 300sqft deck by the river!, Washington, cost: 209, maximum occupancy: 3, house rules: No visitors, minimum nights: 1\n\nNumber of people: 2\nTotal cost: 2 x 59 + 2 x 57 + 2 x 88 + 1 x 209 = 617\nAccommodation minimum nights: 2/1\n\nDays: 3\nCurrent City: from Washington to Jacksonville\nTransportation: Flight Number: F3786730, from Washington to Jacksonville, Departure Time: 08:48, Arrival Time: 10:58, cost: 196\nBreakfast: Cafe Coffee Day, Washington, cost: 53, cuisines: Tea, Mexican, Fast Food, Cafe, American, Seafood\nAttraction: Olympic Sculpture Park, Washington; Space Needle, Washington\nLunch: -\nDinner: -\nAccommodation: -\n\nNumber of people: 2\nTotal cost: 2 x 196 + 2 x 53 = 498\n\nTotal cost across all days: 567 + 617 + 498 = 1,682\n\nUnfortunately, the total cost exceeds the specified budget of $1,000. To adjust the plan within the budget, we need to change the transportation method from flights to self-driving or taxi, and/or select a different accommodation. However, both self-driving and taxi options also exceed the budget when considering round-trip costs. Therefore, we need to revise the accommodation to fit the budget.\n\nRevised Travel Plan:\nDays: 1\nCurrent City: from Jacksonville to Washington\nTransportation: Self-driving, from Jacksonville to Washington, duration: 10 hours 13 mins, distance: 1,136 km, cost: 56\nBreakfast: -\nAttraction: -\nLunch: -\nDinner: Los Aztecas, Washington, cost: 46, cuisines: Cafe, Bakery, BBQ, Fast Food\nAccommodation: Comfortable & Cozy Times Square Apt, Washington, cost: 499, maximum occupancy: 3, house rules: No parties & No children under 10, minimum nights: 2\n\nNumber of people: 2\nTotal cost: 56 + 2 x 46 + 1 x 499 = 647\nAccommodation minimum nights: 1/2\n\nDays: 2\nCurrent City: Washington\nTransportation: -\nBreakfast: Manna Java World Cafe, Washington, cost: 59, cuisines: Cafe, Seafood\nAttraction: The Seattle Great Wheel, Washington; Discovery Park, Washington\nLunch: Hemingway's Island Grill, Washington, cost: 57, cuisines: Mexican, BBQ, Fast Food, Cafe, Seafood\nDinner: Thaaliwala, Washington, cost: 88, cuisines: Tea, Pizza, Italian, BBQ, Cafe\nAccommodation: Comfortable & Cozy Times Square Apt, Washington, cost: 499, maximum occupancy: 3, house rules: No parties & No children under 10, minimum nights: 2\n\nNumber of people: 2\nTotal cost: 2 x 59 + 2 x 57 + 2 x 88 + 1 x 499 = 907\nAccommodation minimum nights: 2/2\n\nDays: 3\nCurrent City: from Washington to Jacksonville\nTransportation: Self-driving, from Washington to Jacksonville, duration: 10 hours 12 mins, distance: 1,136 km, cost: 56\nBreakfast: Cafe Coffee Day, Washington, cost: 53, cuisines: Tea, Mexican, Fast Food, Cafe, American, Seafood\nAttraction: Olympic Sculpture Park, Washington; Space Needle, Washington\nLunch: -\nDinner: -\nAccommodation: -\n\nNumber of people: 2\nTotal cost: 56 + 2 x 53 = 162\n\nTotal cost across all days: 647 + 907 + 162 = 1,716\n\nThe revised plan still exceeds the budget. Given the constraints and the available data, it is not possible to create a 3-day travel itinerary for a party of 2 from Jacksonville to Washington within the specified budget of $1,000, including transportation, meals, and accommodation.", "gpt-4-1106-preview_direct_sole-planning_parsed_results": [{"day": 1, "current_city": "from Jacksonville to Washington", "transportation": "Self-driving, from Jacksonville to Washington, duration: 10 hours 13 mins, distance: 1,136 km", "breakfast": "-", "attraction": "-", "lunch": "-", "dinner": "Los Aztecas, Washington", "accommodation": "Comfortable & Cozy Times Square Apt, Washington"}, {"day": 2, "current_city": "Washington", "transportation": "-", "breakfast": "Manna Java World Cafe, Washington", "attraction": "The Seattle Great Wheel, Washington;Discovery Park, Washington;", "lunch": "Hemingway's Island Grill, Washington", "dinner": "Thaaliwala, Washington", "accommodation": "Comfortable & Cozy Times Square Apt, Washington"}, {"day": 3, "current_city": "from Washington to Jacksonville", "transportation": "Self-driving, from Washington to Jacksonville, duration: 10 hours 12 mins, distance: 1,136 km", "breakfast": "Cafe Coffee Day, Washington", "attraction": "Olympic Sculpture Park, Washington;Space Needle, Washington;", "lunch": "-", "dinner": "-", "accommodation": "-"}]}]