[{"gpt-4-1106-preview_direct_sole-planning_results": "Travel Plan:\n\nDays: 1\nCurrent City: from Denver to Bozeman\nTransportation: Flight Number: F3826809, from Denver to Bozeman, Departure Time: 07:58, Arrival Time: 10:17, cost: 148\nBreakfast: -\nAttraction: -\nLunch: Jiquitaia, Bozeman, cost: 36, cuisines: Tea, Pizza, American\nDinner: Shree Bhog Pure Veg Restaurant, Bozeman, cost: 79, cuisines: Indian, BBQ, Fast Food\nAccommodation: SPACIOUS STUDIO APT 3 IN PROSPECT LEFFERTS GARDENS, Bozeman, cost: 1060, room type: Entire home/apt, house rules: No children under 10 & No parties, minimum nights: 5, maximum occupancy: 6\n\nNumber of people: 8\nTotal cost: 8 x 148 + 8 x 36 + 8 x 79 + 2 x 1060 = 3,712\nAccommodation minimum nights: 1/5\n\nDays: 2\nCurrent City: Bozeman\nTransportation: -\nBreakfast: Saravana Bhavan, Bozeman, cost: 38, cuisines: Tea, American, Desserts\nAttraction: Museum of the Rockies, Bozeman; Gallatin History Museum, Bozeman\nLunch: McGuire's Irish Pub & Brewery, Bozeman, cost: 72, cuisines: Fast Food, Desserts, Italian\nDinner: Zaroob, Bozeman, cost: 67, cuisines: Desserts, Tea, French, BBQ, Bakery, Indian\nAccommodation: SPACIOUS STUDIO APT 3 IN PROSPECT LEFFERTS GARDENS, Bozeman, cost: 1060, room type: Entire home/apt, house rules: No children under 10 & No parties, minimum nights: 5, maximum occupancy: 6\n\nNumber of people: 8\nTotal cost: 8 x 38 + 8 x 72 + 8 x 67 + 2 x 1060 = 3,656\nAccommodation minimum nights: 2/5\n\nDays: 3\nCurrent City: from Bozeman to Denver\nTransportation: Flight Number: F3811654, from Bozeman to Denver, Departure Time: 18:26, Arrival Time: 20:06, cost: 190\nBreakfast: Today Pizza, Bozeman, cost: 27, cuisines: French, Bakery, BBQ, Fast Food, Cafe, Indian\nAttraction: American Computer & Robotics Museum, Bozeman; Bozeman Sculpture Park, Bozeman\nLunch: Indo Chinese, Bozeman, cost: 66, cuisines: Italian, BBQ, Bakery, Fast Food, Chinese, Seafood\nDinner: -\nAccommodation: -\n\nNumber of people: 8\nTotal cost: 8 x 190 + 8 x 27 + 8 x 66 = 2,264\n\nTotal cost across all days: 3,712 + 3,656 + 2,264 = 9,632\n\nCuisines: The plan includes restaurants that offer American and Indian cuisines as specified.\nRoom Constraint: The accommodation selected is an entire home/apt, ensuring privacy and space for the group of 8.\nTransportation Constraint: All travel between cities is managed via flights, as per the available data.\nBudget: The total cost exceeds the specified budget of $7,000. Adjustments are needed to meet the budget constraint.\n\n**Note: The provided budget is not sufficient to cover the costs of the travel plan as calculated. To adhere to the budget, we would need to either find cheaper flights, reduce the cost of meals, or find more affordable accommodation. However, based on the given data, this is the most cost-effective plan that meets the specified requirements. Further information or adjustments to the constraints would be necessary to create a plan within the budget.", "gpt-4-1106-preview_direct_sole-planning_parsed_results": [{"day": 1, "current_city": "from Denver to Bozeman", "transportation": "Flight Number: F3826809, from Denver to Bozeman, Departure Time: 07:58, Arrival Time: 10:17", "breakfast": "-", "attraction": "-", "lunch": "Jiquitaia, Bozeman", "dinner": "Shree Bhog Pure Veg Restaurant, Bozeman", "accommodation": "SPACIOUS STUDIO APT 3 IN PROSPECT LEFFERTS GARDENS, Bozeman"}, {"day": 2, "current_city": "Bozeman", "transportation": "-", "breakfast": "Saravana Bhavan, Bozeman", "attraction": "Museum of the Rockies, Bozeman;Gallatin History Museum, Bozeman;", "lunch": "McGuire's Irish Pub & Brewery, Bozeman", "dinner": "Zaroob, Bozeman", "accommodation": "SPACIOUS STUDIO APT 3 IN PROSPECT LEFFERTS GARDENS, Bozeman"}, {"day": 3, "current_city": "from Bozeman to Denver", "transportation": "Flight Number: F3811654, from Bozeman to Denver, Departure Time: 18:26, Arrival Time: 20:06", "breakfast": "Today Pizza, Bozeman", "attraction": "American Computer & Robotics Museum, Bozeman;Bozeman Sculpture Park, Bozeman;", "lunch": "Indo Chinese, Bozeman", "dinner": "-", "accommodation": "-"}]}]