[{"gpt-4-1106-preview_direct_sole-planning_results": "Travel Plan:\n\nDays: 1\nCurrent City: from Jacksonville to Detroit (Michigan)\nTransportation: Flight Number: F3553781, from Jacksonville to Detroit (Michigan), Departure Time: 12:10, Arrival Time: 14:15, cost: 178\nBreakfast: -\nAttraction: -\nLunch: -\nDinner: Southern Bliss Bakery, Detroit (Michigan), cost: 28, cuisines: Tea, BBQ, Desserts, Seafood\nAccommodation: Cozy 1 bedroom in the heart of Fort Greene, Detroit (Michigan), cost: 751, room type: Entire home/apt, house rules: No pets & No parties, minimum nights: 3, maximum occupancy: 6\n\nNumber of people: 1\nTotal cost: 1 x 178 + 1 x 28 + 1 x 751 = 957\nAccommodation minimum nights: 1/3\n\nDays: 2\nCurrent City: Detroit (Michigan)\nTransportation: -\nBreakfast: A Dong Restaurant, Detroit (Michigan), cost: 40, cuisines: Tea, Cafe, Pizza\nAttraction: Detroit Institute of Arts, Detroit (Michigan); Detroit Historical Museum, Detroit (Michigan); Campus Martius Park, Detroit (Michigan)\nLunch: BMG - All Day Dining, Detroit (Michigan), cost: 15, cuisines: Desserts, Bakery, BBQ, Indian, Seafood\nDinner: Cafe And More, Detroit (Michigan), cost: 41, cuisines: Tea, Bakery, Italian\nAccommodation: Cozy 1 bedroom in the heart of Fort Greene, Detroit (Michigan), cost: 751, room type: Entire home/apt, house rules: No pets & No parties, minimum nights: 3, maximum occupancy: 6\n\nNumber of people: 1\nTotal cost: 1 x 40 + 1 x 15 + 1 x 41 + 1 x 751 = 847\nAccommodation minimum nights: 2/3\n\nDays: 3\nCurrent City: from Detroit (Michigan) to Lansing (Michigan)\nTransportation: Flight Number: F3656087, from Detroit (Michigan) to Lansing (Michigan), Departure Time: 10:10, Arrival Time: 10:46, cost: 27\nBreakfast: Vapour Pub & Brewery, Detroit (Michigan), cost: 80, cuisines: French, BBQ, Fast Food, Cafe, Seafood\nAttraction: Impression 5 Science Center, Lansing (Michigan); Potter Park Zoo, Lansing (Michigan)\nLunch: Manuel's Bread Cafe, Lansing (Michigan), cost: 28, cuisines: French, Pizza, Seafood\nDinner: Huey's On The River, Lansing (Michigan), cost: 75, cuisines: Tea, French, Bakery, Fast Food, Cafe\nAccommodation: Brand New Amazing 1 Bedroom Best Location, Lansing (Michigan), cost: 1168, room type: Entire home/apt, house rules: No visitors & No children under 10 & No smoking, minimum nights: 30, maximum occupancy: 8\n\nNumber of people: 1\nTotal cost: 1 x 27 + 1 x 80 + 1 x 28 + 1 x 75 + 1 x 1168 = 1378\nAccommodation minimum nights: 1/30\n\nDays: 4\nCurrent City: Lansing (Michigan)\nTransportation: -\nBreakfast: Tony's Italian Restaurant & Pizza, Lansing (Michigan), cost: 83, cuisines: Tea, Pizza, Indian, BBQ, American\nAttraction: Michigan History Center, Lansing (Michigan); Hawk Island Park, Lansing (Michigan)\nLunch: Golden China, Lansing (Michigan), cost: 66, cuisines: Chinese, Indian, Cafe, BBQ\nDinner: Nini's Kitchen, Lansing (Michigan), cost: 30, cuisines: Cafe, Mexican, Desserts\nAccommodation: Brand New Amazing 1 Bedroom Best Location, Lansing (Michigan), cost: 1168, room type: Entire home/apt, house rules: No visitors & No children under 10 & No smoking, minimum nights: 30, maximum occupancy: 8\n\nNumber of people: 1\nTotal cost: 1 x 83 + 1 x 66 + 1 x 30 + 1 x 1168 = 1347\nAccommodation minimum nights: 2/30\n\nDays: 5\nCurrent City: from Lansing (Michigan) to Jacksonville\nTransportation: Self-driving, from Lansing (Michigan) to Jacksonville, duration: 15 hours 55 mins, distance: 1,704 km, cost: 85\nBreakfast: Front Street Brewery, Lansing (Michigan), cost: 25, cuisines: BBQ, Mediterranean, Desserts, Italian\nAttraction: -\nLunch: -\nDinner: -\nAccommodation: -\n\nNumber of people: 1\nTotal cost: 1 x 85 + 1 x 25 = 110\n\nTotal cost across all days: 957 + 847 + 1378 + 1347 + 110 = 4639\n\nCuisines: All restaurants selected offer a variety of cuisines as per the available data.\nRoom Constraint: All accommodations selected are entire homes/apartments, ensuring privacy.\nTransportation Constraint: The travel plan includes flights and self-driving, as no specific constraints were mentioned.\nHouse Rules: Accommodations were chosen to respect the house rules, such as \"No pets\" and \"No parties\".", "gpt-4-1106-preview_direct_sole-planning_parsed_results": [{"day": 1, "current_city": "from Jacksonville to Detroit (Michigan)", "transportation": "Flight Number: F3553781, from Jacksonville to Detroit (Michigan), Departure Time: 12:10, Arrival Time: 14:15", "breakfast": "-", "attraction": "-", "lunch": "-", "dinner": "Southern Bliss Bakery, Detroit (Michigan)", "accommodation": "Cozy 1 bedroom in the heart of Fort Greene, Detroit (Michigan)"}, {"day": 2, "current_city": "Detroit (Michigan)", "transportation": "-", "breakfast": "A Dong Restaurant, Detroit (Michigan)", "attraction": "Detroit Institute of Arts, Detroit (Michigan);Detroit Historical Museum, Detroit (Michigan);Campus Martius Park, Detroit (Michigan);", "lunch": "BMG - All Day Dining, Detroit (Michigan)", "dinner": "Cafe And More, Detroit (Michigan)", "accommodation": "Cozy 1 bedroom in the heart of Fort Greene, Detroit (Michigan)"}, {"day": 3, "current_city": "from Detroit (Michigan) to Lansing (Michigan)", "transportation": "Flight Number: F3656087, from Detroit (Michigan) to Lansing (Michigan), Departure Time: 10:10, Arrival Time: 10:46", "breakfast": "Vapour Pub & Brewery, Detroit (Michigan)", "attraction": "Impression 5 Science Center, Lansing (Michigan);Potter Park Zoo, Lansing (Michigan);", "lunch": "Manuel's Bread Cafe, Lansing (Michigan)", "dinner": "Huey's On The River, Lansing (Michigan)", "accommodation": "Brand New Amazing 1 Bedroom Best Location, Lansing (Michigan)"}, {"day": 4, "current_city": "Lansing (Michigan)", "transportation": "-", "breakfast": "Tony's Italian Restaurant & Pizza, Lansing (Michigan)", "attraction": "Michigan History Center, Lansing (Michigan);Hawk Island Park, Lansing (Michigan);", "lunch": "Golden China, Lansing (Michigan)", "dinner": "Nini's Kitchen, Lansing (Michigan)", "accommodation": "Brand New Amazing 1 Bedroom Best Location, Lansing (Michigan)"}, {"day": 5, "current_city": "from Lansing (Michigan) to Jacksonville", "transportation": "Self-driving, from Lansing (Michigan) to Jacksonville, duration: 15 hours 55 mins, distance: 1,704 km", "breakfast": "Front Street Brewery, Lansing (Michigan)", "attraction": "-", "lunch": "-", "dinner": "-", "accommodation": "-"}]}]