[{"gpt-4-1106-preview_direct_sole-planning_results": "Travel Plan:\n\nDays: 1\nCurrent City: from Sun Valley to San Diego (California)\nTransportation: Self-driving, from Sun Valley to San Diego, duration: 14 hours 9 mins, distance: 1,461 km, cost: 73\nBreakfast: -\nAttraction: -\nLunch: -\nDinner: -\nAccommodation: Spacious Room in Large 2 Bedroom Prewar Apartment, San Diego (California), cost: 585, room type: Private room, house rules: No parties & No visitors, minimum nights: 1, maximum occupancy: 2\n\nNumber of people: 1\nTotal cost: 1 x 73 + 1 x 585 = 658\nAccommodation minimum nights: 1/1\n\nDays: 2\nCurrent City: San Diego (California)\nTransportation: -\nBreakfast: Open Yard, San Diego (California), cost: 33, cuisines: Chinese, Pizza, Cafe, Desserts\nAttraction: Balboa Park, San Diego (California); USS Midway Museum, San Diego (California)\nLunch: Jetha Lal Ka Dhabha, San Diego (California), cost: 22, cuisines: Tea, Cafe, Indian, Italian\nDinner: The Lost Mughal, San Diego (California), cost: 74, cuisines: Tea, Cafe, Italian\nAccommodation: Spacious Room in Large 2 Bedroom Prewar Apartment, San Diego (California), cost: 585, room type: Private room, house rules: No parties & No visitors, minimum nights: 1, maximum occupancy: 2\n\nNumber of people: 1\nTotal cost: 1 x 33 + 1 x 22 + 1 x 74 + 1 x 585 = 714\nAccommodation minimum nights: 2/1\n\nDays: 3\nCurrent City: from San Diego (California) to Redding (California)\nTransportation: Self-driving, from San Diego to Redding, duration: 10 hours 10 mins, distance: 1,070 km, cost: 53\nBreakfast: -\nAttraction: -\nLunch: -\nDinner: -\nAccommodation: 3 Bedroom Cozy Apartment, Redding (California), cost: 724, room type: Entire home/apt, house rules: No smoking & No pets & No parties, minimum nights: 4, maximum occupancy: 4\n\nNumber of people: 1\nTotal cost: 1 x 53 + 1 x 724 = 777\nAccommodation minimum nights: 1/4\n\nDays: 4\nCurrent City: Redding (California)\nTransportation: -\nBreakfast: Perfect Bake, Redding (California), cost: 69, cuisines: Tea, Pizza, Fast Food\nAttraction: Sundial Bridge, Redding (California); Turtle Bay Exploration Park, Redding (California)\nLunch: Mosaic - Country Inn & Suites, Redding (California), cost: 57, cuisines: Pizza, Bakery, BBQ, Fast Food, American, Mediterranean\nDinner: Di Ghent Boulangerie, Redding (California), cost: 13, cuisines: French, Pizza, Mediterranean, Seafood\nAccommodation: 3 Bedroom Cozy Apartment, Redding (California), cost: 724, room type: Entire home/apt, house rules: No smoking & No pets & No parties, minimum nights: 4, maximum occupancy: 4\n\nNumber of people: 1\nTotal cost: 1 x 69 + 1 x 57 + 1 x 13 + 1 x 724 = 863\nAccommodation minimum nights: 2/4\n\nDays: 5\nCurrent City: from Redding (California) to Sun Valley\nTransportation: Self-driving, from Redding to Sun Valley, duration: 11 hours 13 mins, distance: 1,087 km, cost: 54\nBreakfast: -\nAttraction: -\nLunch: -\nDinner: -\nAccommodation: -\n\nNumber of people: 1\nTotal cost: 1 x 54 = 54\n\nTotal cost across all days: 658 + 714 + 777 + 863 + 54 = 3,066\n\nUnfortunately, the total cost of $3,066 exceeds the specified budget of $2,600. Adjustments need to be made to the plan to fit within the budget. However, given the constraints of the available data and the high costs of accommodation and transportation, it may not be possible to create a feasible plan within the budget. If flexibility in the budget or the plan is possible, please provide additional details for a revised itinerary.", "gpt-4-1106-preview_direct_sole-planning_parsed_results": [{"day": 1, "current_city": "from Sun Valley to San Diego", "transportation": "Self-driving, from Sun Valley to San Diego, duration: 14 hours 9 mins, distance: 1,461 km", "breakfast": "-", "attraction": "-", "lunch": "-", "dinner": "-", "accommodation": "Spacious Room in Large 2 Bedroom Prewar Apartment, San Diego"}, {"day": 2, "current_city": "San Diego", "transportation": "-", "breakfast": "Open Yard, San Diego", "attraction": "Balboa Park, San Diego;USS Midway Museum, San Diego;", "lunch": "Jetha Lal Ka Dhabha, San Diego", "dinner": "The Lost Mughal, San Diego", "accommodation": "Spacious Room in Large 2 Bedroom Prewar Apartment, San Diego"}, {"day": 3, "current_city": "from San Diego to Redding", "transportation": "Self-driving, from San Diego to Redding, duration: 10 hours 10 mins, distance: 1,070 km", "breakfast": "-", "attraction": "-", "lunch": "-", "dinner": "-", "accommodation": "3 Bedroom Cozy Apartment, Redding"}, {"day": 4, "current_city": "Redding", "transportation": "-", "breakfast": "Perfect Bake, Redding", "attraction": "Sundial Bridge, Redding;Turtle Bay Exploration Park, Redding;", "lunch": "Mosaic - Country Inn & Suites, Redding", "dinner": "Di Ghent Boulangerie, Redding", "accommodation": "3 Bedroom Cozy Apartment, Redding"}, {"day": 5, "current_city": "from Redding to Sun Valley", "transportation": "Self-driving, from Redding to Sun Valley, duration: 11 hours 13 mins, distance: 1,087 km", "breakfast": "-", "attraction": "-", "lunch": "-", "dinner": "-", "accommodation": "-"}]}]