[{"gpt-4-1106-preview_direct_sole-planning_results": "Travel Plan:\n\nDays: 1\nCurrent City: from Myrtle Beach to Nashville (Tennessee)\nTransportation: Flight Number: F3979005, from Myrtle Beach to Nashville (Tennessee), Departure Time: 18:43, Arrival Time: 19:14, cost: 137\nBreakfast: -\nAttraction: -\nLunch: -\nDinner: -\nAccommodation: Huge 2 Bedroom, Great Location, Express Metro, Nashville (Tennessee), cost: 745, room type: Entire home/apt, house rules: No smoking & No children under 10 & No pets, minimum nights: 4, maximum occupancy: 4\n\nNumber of people: 4\nTotal cost: 4 x 137 + 1 x 745 = 1,293\nAccommodation minimum nights: 1/4\n\nDays: 2\nCurrent City: Nashville (Tennessee)\nTransportation: -\nBreakfast: Bangkok 1, Nashville (Tennessee), cost: 44, cuisines: Cafe, Seafood\nAttraction: Country Music Hall of Fame and Museum, Nashville (Tennessee); Nashville Zoo at Grassmere, Nashville (Tennessee); The Parthenon, Nashville (Tennessee)\nLunch: Veg Hut, Nashville (Tennessee), cost: 35, cuisines: Tea, Mexican, Seafood\nDinner: Smoke House Deli, Nashville (Tennessee), cost: 59, cuisines: Cafe, Mediterranean, Seafood\nAccommodation: Huge 2 Bedroom, Great Location, Express Metro, Nashville (Tennessee), cost: 745, room type: Entire home/apt, house rules: No smoking & No children under 10 & No pets, minimum nights: 4, maximum occupancy: 4\n\nNumber of people: 4\nTotal cost: 4 x 44 + 4 x 35 + 4 x 59 + 1 x 745 = 1,373\nAccommodation minimum nights: 2/4\n\nDays: 3\nCurrent City: Nashville (Tennessee)\nTransportation: -\nBreakfast: GoGourmet, Nashville (Tennessee), cost: 34, cuisines: Tea, Cafe, Indian, Mediterranean\nAttraction: Grand Ole Opry, Nashville (Tennessee); Frist Art Museum, Nashville (Tennessee); Nashville Shores, Nashville (Tennessee)\nLunch: Dialogue Lounge & Caf\u6106, Nashville (Tennessee), cost: 83, cuisines: Tea, Indian, BBQ, Cafe, American, Seafood\nDinner: 1911 Bar - The Imperial, Nashville (Tennessee), cost: 76, cuisines: Desserts, Pizza, Italian, American, Seafood\nAccommodation: Huge 2 Bedroom, Great Location, Express Metro, Nashville (Tennessee), cost: 745, room type: Entire home/apt, house rules: No smoking & No children under 10 & No pets, minimum nights: 4, maximum occupancy: 4\n\nNumber of people: 4\nTotal cost: 4 x 34 + 4 x 83 + 4 x 76 + 1 x 745 = 1,621\nAccommodation minimum nights: 3/4\n\nDays: 4\nCurrent City: from Nashville (Tennessee) to Memphis (Tennessee)\nTransportation: Self-driving, from Nashville to Memphis, duration: 3 hours 10 mins, distance: 341 km, cost: 17\nBreakfast: -\nAttraction: -\nLunch: -\nDinner: -\nAccommodation: Cozy Brooklyn Studio, Memphis (Tennessee), cost: 1152, room type: Entire home/apt, house rules: No children under 10 & No pets, minimum nights: 2, maximum occupancy: 11\n\nNumber of people: 4\nTotal cost: 4 x 17 + 1 x 1152 = 1,220\nAccommodation minimum nights: 1/2\n\nDays: 5\nCurrent City: Memphis (Tennessee)\nTransportation: -\nBreakfast: Crust Stone Oven Pizza, Memphis (Tennessee), cost: 73, cuisines: Tea, Pizza, BBQ\nAttraction: National Civil Rights Museum, Memphis (Tennessee); Graceland, Memphis (Tennessee); Memphis Zoo, Memphis (Tennessee)\nLunch: The Gathering Hut, Memphis (Tennessee), cost: 76, cuisines: Desserts, American, Bakery, BBQ, Fast Food, Indian\nDinner: Hops n Grains, Memphis (Tennessee), cost: 95, cuisines: Cafe, Bakery, American, Seafood\nAccommodation: Cozy Brooklyn Studio, Memphis (Tennessee), cost: 1152, room type: Entire home/apt, house rules: No children under 10 & No pets, minimum nights: 2, maximum occupancy: 11\n\nNumber of people: 4\nTotal cost: 4 x 73 + 4 x 76 + 4 x 95 + 1 x 1152 = 1,736\nAccommodation minimum nights: 2/2\n\nTotal cost across all days: 1,293 + 1,373 + 1,621 + 1,220 + 1,736 = 7,243\n\nGiven the total cost exceeds the budget of $5,500, adjustments must be made. To reduce costs, we can consider changing accommodations to private rooms instead of entire homes, and possibly reducing meal costs by selecting more budget-friendly restaurants. However, since the provided data does not include cheaper alternatives, this travel plan cannot be executed within the specified budget based on the given reference information.", "gpt-4-1106-preview_direct_sole-planning_parsed_results": [{"day": 1, "current_city": "from Myrtle Beach to Nashville", "transportation": "Flight Number: F3979005, from Myrtle Beach to Nashville, Departure Time: 18:43, Arrival Time: 19:14", "breakfast": "-", "attraction": "-", "lunch": "-", "dinner": "-", "accommodation": "Huge 2 Bedroom, Great Location, Express Metro, Nashville"}, {"day": 2, "current_city": "Nashville", "transportation": "-", "breakfast": "Bangkok 1, Nashville", "attraction": "Country Music Hall of Fame and Museum, Nashville;Nashville Zoo at Grassmere, Nashville;The Parthenon, Nashville;", "lunch": "Veg Hut, Nashville", "dinner": "Smoke House Deli, Nashville", "accommodation": "Huge 2 Bedroom, Great Location, Express Metro, Nashville"}, {"day": 3, "current_city": "Nashville", "transportation": "-", "breakfast": "GoGourmet, Nashville", "attraction": "Grand Ole Opry, Nashville;Frist Art Museum, Nashville;Nashville Shores, Nashville;", "lunch": "Dialogue Lounge & Caf\u6106, Nashville", "dinner": "1911 Bar - The Imperial, Nashville", "accommodation": "Huge 2 Bedroom, Great Location, Express Metro, Nashville"}, {"day": 4, "current_city": "from Nashville to Memphis", "transportation": "Self-driving, from Nashville to Memphis, duration: 3 hours 10 mins, distance: 341 km", "breakfast": "-", "attraction": "-", "lunch": "-", "dinner": "-", "accommodation": "Cozy Brooklyn Studio, Memphis"}, {"day": 5, "current_city": "Memphis", "transportation": "-", "breakfast": "Crust Stone Oven Pizza, Memphis", "attraction": "National Civil Rights Museum, Memphis;Graceland, Memphis;Memphis Zoo, Memphis;", "lunch": "The Gathering Hut, Memphis", "dinner": "Hops n Grains, Memphis", "accommodation": "Cozy Brooklyn Studio, Memphis"}]}]