[{"gpt-4-1106-preview_direct_sole-planning_results": "Travel Plan:\n\nDays: 1\nCurrent City: from St. Louis to Philadelphia (Pennsylvania)\nTransportation: Flight Number: F3787538, from St. Louis to Philadelphia (Pennsylvania), Departure Time: 05:26, Arrival Time: 08:29, cost: $232\nBreakfast: -\nAttraction: Liberty Bell, Philadelphia (Pennsylvania); Independence National Historical Park, Philadelphia (Pennsylvania)\nLunch: Pind Balluchi, Philadelphia (Pennsylvania), cost: $44, cuisines: Desserts, Tea, French, Fast Food, Seafood\nDinner: Red Ginger Sushi, Grill & Bar, Philadelphia (Pennsylvania), cost: $98, cuisines: Tea, Cafe, Indian, Fast Food\nAccommodation: Industrial Loft Living in NYC, Philadelphia (Pennsylvania), cost: $178, room type: Entire home/apt, house rules: No smoking, minimum nights: 4, maximum occupancy: 3\n\nNumber of people: 2\nTotal cost: 2 x $232 + 2 x $44 + 2 x $98 + 1 x $178 = $926\nAccommodation minimum nights: 1/4\n\nDays: 2\nCurrent City: Philadelphia (Pennsylvania)\nTransportation: -\nBreakfast: Hong Kong Cafe, Philadelphia (Pennsylvania), cost: $47, cuisines: Tea, Pizza, Italian, BBQ, Cafe\nAttraction: The Franklin Institute, Philadelphia (Pennsylvania); Philadelphia's Magic Gardens, Philadelphia (Pennsylvania)\nLunch: Marukame Udon, Philadelphia (Pennsylvania), cost: $100, cuisines: Tea, Pizza, Italian, BBQ, Fast Food, Chinese\nDinner: The Moon Under Water, Philadelphia (Pennsylvania), cost: $94, cuisines: Pizza, Italian, BBQ, Bakery, Fast Food, Mediterranean\nAccommodation: Industrial Loft Living in NYC, Philadelphia (Pennsylvania), cost: $178, room type: Entire home/apt, house rules: No smoking, minimum nights: 4, maximum occupancy: 3\n\nNumber of people: 2\nTotal cost: 2 x $47 + 2 x $100 + 2 x $94 + 1 x $178 = $660\nAccommodation minimum nights: 2/4\n\nDays: 3\nCurrent City: from Philadelphia (Pennsylvania) to Harrisburg (Pennsylvania)\nTransportation: Flight Number: F3732413, from Philadelphia (Pennsylvania) to Harrisburg (Pennsylvania), Departure Time: 11:17, Arrival Time: 12:01, cost: $22\nBreakfast: Brothers Dhaba, Philadelphia (Pennsylvania), cost: $52, cuisines: Cafe, Desserts, Seafood\nAttraction: The National Civil War Museum, Harrisburg (Pennsylvania); The State Museum of Pennsylvania, Harrisburg (Pennsylvania)\nLunch: Viva! Argentine Cuisine, Harrisburg (Pennsylvania), cost: $28, cuisines: Mexican, Pizza, BBQ\nDinner: Rustom's Parsi Bhonu, Harrisburg (Pennsylvania), cost: $77, cuisines: American, Desserts, Fast Food\nAccommodation: Cozy Nolita Apartment, Harrisburg (Pennsylvania), cost: $170, room type: Entire home/apt, house rules: No smoking & No parties, minimum nights: 2, maximum occupancy: 3\n\nNumber of people: 2\nTotal cost: 2 x $22 + 2 x $52 + 2 x $28 + 2 x $77 + 1 x $170 = $528\nAccommodation minimum nights: 1/2\n\nDays: 4\nCurrent City: Harrisburg (Pennsylvania)\nTransportation: -\nBreakfast: Spiral - Sofitel Philippine Plaza Manila, Harrisburg (Pennsylvania), cost: $222, cuisines: Tea, Cafe, Pizza\nAttraction: Wildwood Park, Harrisburg (Pennsylvania); Pennsylvania National Fire Museum, Harrisburg (Pennsylvania)\nLunch: Cakes & More, Harrisburg (Pennsylvania), cost: $98, cuisines: Cafe, Bakery, BBQ, Seafood\nDinner: Square - Sayaji Hotel, Harrisburg (Pennsylvania), cost: $99, cuisines: Cafe, Mexican, American, BBQ\nAccommodation: Cozy Nolita Apartment, Harrisburg (Pennsylvania), cost: $170, room type: Entire home/apt, house rules: No smoking & No parties, minimum nights: 2, maximum occupancy: 3\n\nNumber of people: 2\nTotal cost: 2 x $222 + 2 x $98 + 2 x $99 + 1 x $170 = $1008\nAccommodation minimum nights: 2/2\n\nDays: 5\nCurrent City: from Harrisburg (Pennsylvania) to State College (Pennsylvania)\nTransportation: Self-driving, from Harrisburg to State College, duration: 1 hour 31 mins, distance: 139 km, cost: $6\nBreakfast: Chaayos, Harrisburg (Pennsylvania), cost: $31, cuisines: Desserts, Italian, BBQ, Bakery, Cafe\nAttraction: The Arboretum at Penn State, State College (Pennsylvania); Discovery Space of Central Pennsylvania, State College (Pennsylvania)\nLunch: Kawa Sushi, State College (Pennsylvania), cost: $82, cuisines: French, Mexican, Desserts, Fast Food\nDinner: Los Agaves, State College (Pennsylvania), cost: $39, cuisines: French, BBQ, Cafe\nAccommodation: Charming 1BR in UES Townhouse, State College (Pennsylvania), cost: $1134, room type: Entire home/apt, house rules: No smoking, minimum nights: 30, maximum occupancy: 4\n\nNumber of people: 2\nTotal cost: 2 x $6 + 2 x $31 + 2 x $82 + 2 x $39 + 1 x $1134 = $1460\nAccommodation minimum nights: 1/30\n\nDays: 6\nCurrent City: State College (Pennsylvania)\nTransportation: -\nBreakfast: Nutri Cafe, State College (Pennsylvania), cost: $85, cuisines: Desserts, Tea, Pizza, French, American\nAttraction: Palmer Museum of Art, State College (Pennsylvania); Penn State All-Sports Museum, State College (Pennsylvania)\nLunch: Salsa's Mexican Restaurant, State College (Pennsylvania), cost: $52, cuisines: Tea, BBQ, Fast Food\nDinner: Amici Cafe, State College (Pennsylvania), cost: $96, cuisines: Pizza, Bakery, BBQ, Chinese, Seafood\nAccommodation: Charming 1BR in UES Townhouse, State College (Pennsylvania), cost: $1134, room type: Entire home/apt, house rules: No smoking, minimum nights: 30, maximum occupancy: 4\n\nNumber of people: 2\nTotal cost: 2 x $85 + 2 x $52 + 2 x $96 + 1 x $1134 = $1600\nAccommodation minimum nights: 2/30\n\nDays: 7\nCurrent City: from State College (Pennsylvania) to St. Louis\nTransportation: Self-driving, from State College to St. Louis, duration: 11 hours 18 mins, distance: 1,195 km, cost: $59\nBreakfast: The Riding Guns Cafe, State College (Pennsylvania), cost: $51, cuisines: Desserts, Pizza, Cafe, Indian, Seafood\nAttraction: -\nLunch: -\nDinner: -\nAccommodation: -\n\nNumber of people: 2\nTotal cost: 2 x $59 + 2 x $51 = $220\n\nTotal cost across all days: $926 + $660 + $528 + $1008 + $1460 + $1600 + $220 = $6402\nCuisines: The plan includes a variety of restaurants offering Indian and American cuisine, as specified in the query.\nRoom Constraint: All accommodations selected are entire homes or private rooms, ensuring privacy.\nTransportation Constraint: The plan includes flights and self-driving, as there are no flights available for certain legs of the trip.\n\nPlease note that the costs are based on the provided data and may not include all taxes and fees. The accommodation in State College has a minimum stay requirement that exceeds the trip duration, which may not be ideal but is included due to the lack of provided alternatives. The total cost is within the specified budget of $7,200.", "gpt-4-1106-preview_direct_sole-planning_parsed_results": [{"day": 1, "current_city": "from St. Louis to Philadelphia", "transportation": "Flight Number: F3787538, from St. Louis to Philadelphia, Departure Time: 05:26, Arrival Time: 08:29", "breakfast": "-", "attraction": "Liberty Bell, Philadelphia;Independence National Historical Park, Philadelphia;", "lunch": "Pind Balluchi, Philadelphia", "dinner": "Red Ginger Sushi, Grill & Bar, Philadelphia", "accommodation": "Industrial Loft Living in NYC, Philadelphia"}, {"day": 2, "current_city": "Philadelphia", "transportation": "-", "breakfast": "Hong Kong Cafe, Philadelphia", "attraction": "The Franklin Institute, Philadelphia;Philadelphia's Magic Gardens, Philadelphia;", "lunch": "Marukame Udon, Philadelphia", "dinner": "The Moon Under Water, Philadelphia", "accommodation": "Industrial Loft Living in NYC, Philadelphia"}, {"day": 3, "current_city": "from Philadelphia to Harrisburg", "transportation": "Flight Number: F3732413, from Philadelphia to Harrisburg, Departure Time: 11:17, Arrival Time: 12:01", "breakfast": "Brothers Dhaba, Philadelphia", "attraction": "The National Civil War Museum, Harrisburg;The State Museum of Pennsylvania, Harrisburg;", "lunch": "Viva! Argentine Cuisine, Harrisburg", "dinner": "Rustom's Parsi Bhonu, Harrisburg", "accommodation": "Cozy Nolita Apartment, Harrisburg"}, {"day": 4, "current_city": "Harrisburg", "transportation": "-", "breakfast": "Spiral - Sofitel Philippine Plaza Manila, Harrisburg", "attraction": "Wildwood Park, Harrisburg;Pennsylvania National Fire Museum, Harrisburg;", "lunch": "Cakes & More, Harrisburg", "dinner": "Square - Sayaji Hotel, Harrisburg", "accommodation": "Cozy Nolita Apartment, Harrisburg"}, {"day": 5, "current_city": "from Harrisburg to State College", "transportation": "Self-driving, from Harrisburg to State College, duration: 1 hour 31 mins, distance: 139 km", "breakfast": "Chaayos, Harrisburg", "attraction": "The Arboretum at Penn State, State College;Discovery Space of Central Pennsylvania, State College;", "lunch": "Kawa Sushi, State College", "dinner": "Los Agaves, State College", "accommodation": "Charming 1BR in UES Townhouse, State College"}, {"day": 6, "current_city": "State College", "transportation": "-", "breakfast": "Nutri Cafe, State College", "attraction": "Palmer Museum of Art, State College;Penn State All-Sports Museum, State College;", "lunch": "Salsa's Mexican Restaurant, State College", "dinner": "Amici Cafe, State College", "accommodation": "Charming 1BR in UES Townhouse, State College"}, {"day": 7, "current_city": "from State College to St. Louis", "transportation": "Self-driving, from State College to St. Louis, duration: 11 hours 18 mins, distance: 1,195 km", "breakfast": "The Riding Guns Cafe, State College", "attraction": "-", "lunch": "-", "dinner": "-", "accommodation": "-"}]}]