[{"gpt-4-1106-preview_direct_sole-planning_results": "Travel Plan:\n\nDays: 1\nCurrent City: from Columbus to Dallas (Texas)\nTransportation: Flight Number: F3666359, from Columbus to Dallas (Texas), Departure Time: 07:19, Arrival Time: 09:00, cost: 208\nBreakfast: -\nAttraction: -\nLunch: -\nDinner: -\nAccommodation: Take it now you won't find better, Dallas (Texas), cost: 609, maximum occupancy: 4, house rules: No pets, minimum nights: 1\n\nNumber of people: 1\nTotal cost: 1 x 208 + 1 x 609 = 817\nAccommodation minimum nights: 1/1\n\nDays: 2\nCurrent City: Dallas (Texas)\nTransportation: -\nBreakfast: Drifters Cafe, Dallas (Texas), cost: 21, cuisines: Tea, French, Mexican, Cafe, Seafood\nAttraction: The Dallas World Aquarium, Dallas (Texas); The Sixth Floor Museum at Dealey Plaza, Dallas (Texas); Dallas Museum of Art, Dallas (Texas)\nLunch: Bikaner Sweets, Dallas (Texas), cost: 23, cuisines: Tea, French, Bakery, Cafe, Seafood\nDinner: Cafe Hera Pheri, Dallas (Texas), cost: 18, cuisines: Cafe, Desserts\nAccommodation: Take it now you won't find better, Dallas (Texas), cost: 609, maximum occupancy: 4, house rules: No pets, minimum nights: 1\n\nNumber of people: 1\nTotal cost: 1 x 21 + 1 x 23 + 1 x 18 + 1 x 609 = 671\nAccommodation minimum nights: 2/1\n\nDays: 3\nCurrent City: from Dallas (Texas) to Amarillo (Texas)\nTransportation: Flight Number: F3599952, from Dallas (Texas) to Amarillo (Texas), Departure Time: 19:07, Arrival Time: 20:13, cost: 108\nBreakfast: MONKS, Dallas (Texas), cost: 24, cuisines: Tea, Pizza, Cafe, Mediterranean, Seafood\nAttraction: Klyde Warren Park, Dallas (Texas); Dallas Arboretum and Botanical Garden, Dallas (Texas)\nLunch: Cafe Gatherings, Dallas (Texas), cost: 17, cuisines: Bakery, Indian, Desserts\nDinner: -\nAccommodation: Gramercy Park restful, cozy, sun-filled home, Amarillo (Texas), cost: 968, maximum occupancy: 8, house rules: No parties, minimum nights: 2\n\nNumber of people: 1\nTotal cost: 1 x 108 + 1 x 24 + 1 x 17 + 1 x 968 = 1,117\nAccommodation minimum nights: 1/2\n\nDays: 4\nCurrent City: Amarillo (Texas)\nTransportation: -\nBreakfast: The Cinnamon Kitchen, Amarillo (Texas), cost: 69, cuisines: Desserts, Tea, Pizza, Chinese, Seafood\nAttraction: Cadillac Ranch, Amarillo (Texas); Amarillo Botanical Gardens, Amarillo (Texas)\nLunch: Kanha North & South Indian Veg., Amarillo (Texas), cost: 34, cuisines: Tea, Cafe, BBQ, Fast Food\nDinner: Sigree Global Grill, Amarillo (Texas), cost: 35, cuisines: Chinese, BBQ, Cafe, Desserts\nAccommodation: Gramercy Park restful, cozy, sun-filled home, Amarillo (Texas), cost: 968, maximum occupancy: 8, house rules: No parties, minimum nights: 2\n\nNumber of people: 1\nTotal cost: 1 x 69 + 1 x 34 + 1 x 35 + 1 x 968 = 1,106\nAccommodation minimum nights: 2/2\n\nDays: 5\nCurrent City: from Amarillo (Texas) to Houston (Texas)\nTransportation: Flight Number: F3840460, from Amarillo (Texas) to Houston (Texas), Departure Time: 06:27, Arrival Time: 08:04, cost: 164\nBreakfast: -\nAttraction: -\nLunch: -\nDinner: -\nAccommodation: Superhost 3 bedroom DISCOUNT, Houston (Texas), cost: 746, maximum occupancy: 5, house rules: No pets, minimum nights: 1\n\nNumber of people: 1\nTotal cost: 1 x 164 + 1 x 746 = 910\nAccommodation minimum nights: 1/1\n\nDays: 6\nCurrent City: Houston (Texas)\nTransportation: -\nBreakfast: Jalapenos, Houston (Texas), cost: 57, cuisines: Desserts, Tea, Cafe, Chinese, Seafood\nAttraction: Space Center Houston, Houston (Texas); Water Wall, Houston (Texas); Houston Museum of Natural Science, Houston (Texas)\nLunch: Super Bakery, Houston (Texas), cost: 30, cuisines: Seafood, Fast Food\nDinner: Sheetla Dhaba, Houston (Texas), cost: 35, cuisines: Desserts, Pizza, Bakery, American, Mediterranean\nAccommodation: Superhost 3 bedroom DISCOUNT, Houston (Texas), cost: 746, maximum occupancy: 5, house rules: No pets, minimum nights: 1\n\nNumber of people: 1\nTotal cost: 1 x 57 + 1 x 30 + 1 x 35 + 1 x 746 = 868\nAccommodation minimum nights: 2/1\n\nDays: 7\nCurrent City: from Houston to Columbus\nTransportation: Flight Number: F3997947, from Houston to Columbus, Departure Time: 19:20, Arrival Time: 22:29, cost: 259\nBreakfast: -\nAttraction: -\nLunch: -\nDinner: -\nAccommodation: -\n\nNumber of people: 1\nTotal cost: 1 x 259 = 259\n\nTotal cost across all days: 817 + 671 + 1,117 + 1,106 + 910 + 868 + 259 = 5,748\n\nUnfortunately, the total cost of $5,748 exceeds the specified budget of $4,200. To adhere to the budget, we need to make adjustments to the travel plan. Let's try to find more cost-effective options for transportation and accommodation.\n\nAdjusted Travel Plan:\n\nDays: 1\nCurrent City: from Columbus to Dallas (Texas)\nTransportation: Self-driving, from Columbus to Dallas, duration: 15 hours 17 mins, distance: 1,675 km, cost: 83\nBreakfast: -\nAttraction: -\nLunch: -\nDinner: -\nAccommodation: 1BR, elevator, kitchen, doorman!, Dallas (Texas), cost: 475, maximum occupancy: 3, house rules: No parties, minimum nights: 1\n\nNumber of people: 1\nTotal cost: 1 x 83 + 1 x 475 = 558\nAccommodation minimum nights: 1/1\n\nDays: 2\nCurrent City: Dallas (Texas)\nTransportation: -\nBreakfast: Drifters Cafe, Dallas (Texas), cost: 21, cuisines: Tea, French, Mexican, Cafe, Seafood\nAttraction: The Dallas World Aquarium, Dallas (Texas); The Sixth Floor Museum at Dealey Plaza, Dallas (Texas); Dallas Museum of Art, Dallas (Texas)\nLunch: Bikaner Sweets, Dallas (Texas), cost: 23, cuisines: Tea, French, Bakery, Cafe, Seafood\nDinner: Cafe Hera Pheri, Dallas (Texas), cost: 18, cuisines: Cafe, Desserts\nAccommodation: 1BR, elevator, kitchen, doorman!, Dallas (Texas), cost: 475, maximum occupancy: 3, house rules: No parties, minimum nights: 1\n\nNumber of people: 1\nTotal cost: 1 x 21 + 1 x 23 + 1 x 18 + 1 x 475 = 537\nAccommodation minimum nights: 2/1\n\nDays: 3\nCurrent City: from Dallas (Texas) to Amarillo (Texas)\nTransportation: Self-driving, from Dallas to Amarillo, duration: 5 hours 30 mins, distance: 588 km, cost: 29\nBreakfast: MONKS, Dallas (Texas), cost: 24, cuisines: Tea, Pizza, Cafe, Mediterranean, Seafood\nAttraction: Klyde Warren Park, Dallas (Texas); Dallas Arboretum and Botanical Garden, Dallas (Texas)\nLunch: Cafe Gatherings, Dallas (Texas), cost: 17, cuisines: Bakery, Indian, Desserts\nDinner: -\nAccommodation: Harlem Humble Abode - 1 bedroom - Cute and Quaint, Amarillo (Texas), cost: 409, maximum occupancy: 3, house rules: No pets, minimum nights: 5\n\nNumber of people: 1\nTotal cost: 1 x 29 + 1 x 24 + 1 x 17 + 1 x 409 = 479\nAccommodation minimum nights: 1/5\n\nDays: 4\nCurrent City: Amarillo (Texas)\nTransportation: -\nBreakfast: The Cinnamon Kitchen, Amarillo (Texas), cost: 69, cuisines: Desserts, Tea, Pizza, Chinese, Seafood\nAttraction: Cadillac Ranch, Amarillo (Texas); Amarillo Botanical Gardens, Amarillo (Texas)\nLunch: Kanha North & South Indian Veg., Amarillo (Texas), cost: 34, cuisines: Tea, Cafe, BBQ, Fast Food\nDinner: Sigree Global Grill, Amarillo (Texas), cost: 35, cuisines: Chinese, BBQ, Cafe, Desserts\nAccommodation: Harlem Humble Abode - 1 bedroom - Cute and Quaint, Amarillo (Texas), cost: 409, maximum occupancy: 3, house rules: No pets, minimum nights: 5\n\nNumber of people: 1\nTotal cost: 1 x 69 + 1 x 34 + 1 x 35 + 1 x 409 = 547\nAccommodation minimum nights: 2/5\n\nDays: 5\nCurrent City: from Amarillo (Texas) to Houston (Texas)\nTransportation: Self-driving, from Amarillo to Houston, duration: 8 hours 49 mins, distance: 965 km, cost: 48\nBreakfast: -\nAttraction: -\nLunch: -\nDinner: -\nAccommodation: Sunny and Airy near Manhattan, Houston (Texas), cost: 499, maximum occupancy: 4, house rules: No pets, minimum nights: 2\n\nNumber of people: 1\nTotal cost: 1 x 48 + 1 x 499 = 547\nAccommodation minimum nights: 1/2\n\nDays: 6\nCurrent City: Houston (Texas)\nTransportation: -\nBreakfast: Jalapenos, Houston (Texas), cost: 57, cuisines: Desserts, Tea, Cafe, Chinese, Seafood\nAttraction: Space Center Houston, Houston (Texas); Water Wall, Houston (Texas); Houston Museum of Natural Science, Houston (Texas)\nLunch: Super Bakery, Houston (Texas), cost: 30, cuisines: Seafood, Fast Food\nDinner: Sheetla Dhaba, Houston (Texas), cost: 35, cuisines: Desserts, Pizza, Bakery, American, Mediterranean\nAccommodation: Sunny and Airy near Manhattan, Houston (Texas), cost: 499, maximum occupancy: 4, house rules: No pets, minimum nights: 2\n\nNumber of people: 1\nTotal cost: 1 x 57 + 1 x 30 + 1 x 35 + 1 x 499 = 621\nAccommodation minimum nights: 2/2\n\nDays: 7\nCurrent City: from Houston to Columbus\nTransportation: Self-driving, from Houston to Columbus, duration: 17 hours 20 mins, distance: 1,858 km, cost: 92\nBreakfast: -\nAttraction: -\nLunch: -\nDinner: -\nAccommodation: -\n\nNumber of people: 1\nTotal cost: 1 x 92 = 92\n\nTotal cost across all days: 558 + 537 + 479 + 547 + 547 + 621 + 92 = 3,381\n\nCuisines: The prompt specifies no cuisines, so all cuisines constraints are satisfied.\nRoom Constraint: All accommodations selected are entire rooms, ensuring privacy for the solo traveler.\nTransportation Constraint: All intra-city travel is managed via self-driving, as per the available data.\nHouse Rules: All accommodations selected meet the house rules specified in the query.\n\nThe adjusted travel plan now fits within the specified budget of $4,200, with a total cost of $3,381.", "gpt-4-1106-preview_direct_sole-planning_parsed_results": [{"day": 1, "current_city": "from Columbus to Dallas", "transportation": "Flight Number: F3666359, from Columbus to Dallas, Departure Time: 07:19, Arrival Time: 09:00", "breakfast": "-", "attraction": "-", "lunch": "-", "dinner": "-", "accommodation": "Take it now you won't find better, Dallas"}, {"day": 2, "current_city": "Dallas", "transportation": "-", "breakfast": "Drifters Cafe, Dallas", "attraction": "The Dallas World Aquarium, Dallas;The Sixth Floor Museum at Dealey Plaza, Dallas;Dallas Museum of Art, Dallas;", "lunch": "Bikaner Sweets, Dallas", "dinner": "Cafe Hera Pheri, Dallas", "accommodation": "Take it now you won't find better, Dallas"}, {"day": 3, "current_city": "from Dallas to Amarillo", "transportation": "Flight Number: F3599952, from Dallas to Amarillo, Departure Time: 19:07, Arrival Time: 20:13", "breakfast": "MONKS, Dallas", "attraction": "Klyde Warren Park, Dallas;Dallas Arboretum and Botanical Garden, Dallas;", "lunch": "Cafe Gatherings, Dallas", "dinner": "-", "accommodation": "Gramercy Park restful, cozy, sun-filled home, Amarillo"}, {"day": 4, "current_city": "Amarillo", "transportation": "-", "breakfast": "The Cinnamon Kitchen, Amarillo", "attraction": "Cadillac Ranch, Amarillo;Amarillo Botanical Gardens, Amarillo;", "lunch": "Kanha North & South Indian Veg., Amarillo", "dinner": "Sigree Global Grill, Amarillo", "accommodation": "Gramercy Park restful, cozy, sun-filled home, Amarillo"}, {"day": 5, "current_city": "from Amarillo to Houston", "transportation": "Flight Number: F3840460, from Amarillo to Houston, Departure Time: 06:27, Arrival Time: 08:04", "breakfast": "-", "attraction": "-", "lunch": "-", "dinner": "-", "accommodation": "Superhost 3 bedroom DISCOUNT, Houston"}, {"day": 6, "current_city": "Houston", "transportation": "-", "breakfast": "Jalapenos, Houston", "attraction": "Space Center Houston, Houston;Water Wall, Houston;Houston Museum of Natural Science, Houston;", "lunch": "Super Bakery, Houston", "dinner": "Sheetla Dhaba, Houston", "accommodation": "Superhost 3 bedroom DISCOUNT, Houston"}, {"day": 7, "current_city": "from Houston to Columbus", "transportation": "Flight Number: F3997947, from Houston to Columbus, Departure Time: 19:20, Arrival Time: 22:29", "breakfast": "-", "attraction": "-", "lunch": "-", "dinner": "-", "accommodation": "-"}]}]