[{"gpt-4-1106-preview_direct_sole-planning_results": "Travel Plan:\n\nDays: 1\nCurrent City: from Harrisburg to Wichita Falls (Texas)\nTransportation: Self-driving, from Harrisburg to Wichita Falls, duration: 20 hours 58 mins, distance: 2,283 km, cost: $114\nBreakfast: -\nAttraction: -\nLunch: -\nDinner: -\nAccommodation: Small, Cozy 1BD Apartment, Wichita Falls (Texas), cost: $712, room type: Entire home/apt, house rules: No parties & No smoking & No children under 10, minimum nights: 3, maximum occupancy: 7\n\nNumber of people: 2\nTotal cost: 2 x $114 + 1 x $712 = $940\nAccommodation minimum nights: 1/3\n\nDays: 2\nCurrent City: Wichita Falls (Texas)\nTransportation: -\nBreakfast: PM 2 AM Food Bank, Wichita Falls (Texas), cost: $45, cuisines: French, Cafe, Desserts\nAttraction: Museum of North Texas History, Wichita Falls (Texas); River Bend Nature Center, Wichita Falls (Texas)\nLunch: Made In Punjab, Wichita Falls (Texas), cost: $37, cuisines: French, Bakery, Seafood\nDinner: Mama's Boy Restaurant, Wichita Falls (Texas), cost: $25, cuisines: Bakery, BBQ\nAccommodation: Small, Cozy 1BD Apartment, Wichita Falls (Texas), cost: $712, room type: Entire home/apt, house rules: No parties & No smoking & No children under 10, minimum nights: 3, maximum occupancy: 7\n\nNumber of people: 2\nTotal cost: 2 x $45 + 2 x $37 + 2 x $25 + 1 x $712 = $916\nAccommodation minimum nights: 2/3\n\nDays: 3\nCurrent City: from Wichita Falls (Texas) to Waco (Texas)\nTransportation: Self-driving, from Wichita Falls to Waco, duration: 3 hours 2 mins, distance: 327 km, cost: $16\nBreakfast: The Coffee Bean & Tea Leaf, Wichita Falls (Texas), cost: $21, cuisines: Chinese, Bakery, Desserts\nAttraction: The World's Littlest Skyscraper, Wichita Falls (Texas); Lucy Park, Wichita Falls (Texas)\nLunch: Tyre Patty, Wichita Falls (Texas), cost: $92, cuisines: Pizza, BBQ, Bakery, Chinese, American, Seafood\nDinner: -\nAccommodation: 1 bedroom, large williamsburg loft, Waco (Texas), cost: $930, room type: Private room, house rules: No visitors & No children under 10 & No parties, minimum nights: 7, maximum occupancy: 1\n\nNumber of people: 2\nTotal cost: 2 x $16 + 2 x $21 + 2 x $92 + 1 x $930 = $1,188\nAccommodation minimum nights: 1/7\n\nDays: 4\nCurrent City: Waco (Texas)\nTransportation: -\nBreakfast: Blue House Cafe, Waco (Texas), cost: $55, cuisines: Tea, Pizza, Mexican, Cafe, Seafood\nAttraction: Dr Pepper Museum, Waco (Texas); Cameron Park Zoo, Waco (Texas)\nLunch: Fork, Waco (Texas), cost: $58, cuisines: Tea, French, Mediterranean, Seafood\nDinner: Aunty's Kitchen, Waco (Texas), cost: $97, cuisines: Tea, Pizza, Italian, Cafe, Mediterranean\nAccommodation: 1 bedroom, large williamsburg loft, Waco (Texas), cost: $930, room type: Private room, house rules: No visitors & No children under 10 & No parties, minimum nights: 7, maximum occupancy: 1\n\nNumber of people: 2\nTotal cost: 2 x $55 + 2 x $58 + 2 x $97 + 1 x $930 = $1,350\nAccommodation minimum nights: 2/7\n\nDays: 5\nCurrent City: from Waco (Texas) to Houston (Texas)\nTransportation: Self-driving, from Waco to Houston, duration: 2 hours 50 mins, distance: 298 km, cost: $14\nBreakfast: Punjabi Rasoi, Waco (Texas), cost: $70, cuisines: Fast Food, Cafe, Bakery, Seafood\nAttraction: Waco Mammoth National Monument, Waco (Texas); Texas Ranger Hall of Fame & Museum, Waco (Texas)\nLunch: First Gear Cafe, Waco (Texas), cost: $76, cuisines: Desserts, Tea, Fast Food, Chinese, Seafood\nDinner: -\nAccommodation: Superhost 3 bedroom DISCOUNT, Houston (Texas), cost: $746, room type: Entire home/apt, house rules: No pets, minimum nights: 1, maximum occupancy: 5\n\nNumber of people: 2\nTotal cost: 2 x $14 + 2 x $70 + 2 x $76 + 1 x $746 = $1,066\nAccommodation minimum nights: 1/1\n\nDays: 6\nCurrent City: Houston (Texas)\nTransportation: -\nBreakfast: Jalapenos, Houston (Texas), cost: $57, cuisines: Desserts, Tea, Cafe, Chinese, Seafood\nAttraction: Downtown Aquarium, Houston (Texas); Space Center Houston, Houston (Texas)\nLunch: Istanbul Restaurant, Houston (Texas), cost: $19, cuisines: Tea, Indian, Seafood\nDinner: Taj Cafe, Houston (Texas), cost: $18, cuisines: French, BBQ, Seafood\nAccommodation: Superhost 3 bedroom DISCOUNT, Houston (Texas), cost: $746, room type: Entire home/apt, house rules: No pets, minimum nights: 1, maximum occupancy: 5\n\nNumber of people: 2\nTotal cost: 2 x $57 + 2 x $19 + 2 x $18 + 1 x $746 = $934\nAccommodation minimum nights: 2/1\n\nDays: 7\nCurrent City: from Houston (Texas) to Harrisburg\nTransportation: Self-driving, from Houston to Harrisburg, duration: 21 hours 16 mins, distance: 2,353 km, cost: $117\nBreakfast: Super Bakery, Houston (Texas), cost: $30, cuisines: Seafood, Fast Food\nAttraction: Water Wall, Houston (Texas); Houston Museum of Natural Science, Houston (Texas)\nLunch: Sheetla Dhaba, Houston (Texas), cost: $35, cuisines: Desserts, Pizza, Bakery, American, Mediterranean\nDinner: -\nAccommodation: -\n\nNumber of people: 2\nTotal cost: 2 x $117 + 2 x $30 + 2 x $35 = $344\n\nTotal cost across all days: $940 + $916 + $1,188 + $1,350 + $1,066 + $934 + $344 = $6,738\n\nCuisines: Italian and French cuisines were included in the meals where possible.\nRoom Constraint: All accommodations selected are entire homes or private rooms, ensuring privacy for the two people.\nTransportation Constraint: All intra-city travel is managed via self-driving, as per the available options.\nHouse Rules: Accommodations were chosen to respect the house rules such as \"No pets\" and \"No parties\".\n\nPlease note that the total cost exceeds the specified budget of $4,100, and adjustments would need to be made to align with the budget. Additionally, the accommodation in Waco exceeds the number of people for the room type, and the minimum nights required for the accommodation in Waco are not met within the travel dates. These issues would need to be addressed to finalize the travel plan.", "gpt-4-1106-preview_direct_sole-planning_parsed_results": [{"day": 1, "current_city": "from Harrisburg to Wichita Falls", "transportation": "Self-driving, from Harrisburg to Wichita Falls, duration: 20 hours 58 mins, distance: 2,283 km", "breakfast": "-", "attraction": "-", "lunch": "-", "dinner": "-", "accommodation": "Small, Cozy 1BD Apartment, Wichita Falls"}, {"day": 2, "current_city": "Wichita Falls", "transportation": "-", "breakfast": "PM 2 AM Food Bank, Wichita Falls", "attraction": "Museum of North Texas History, Wichita Falls;River Bend Nature Center, Wichita Falls;", "lunch": "Made In Punjab, Wichita Falls", "dinner": "Mama's Boy Restaurant, Wichita Falls", "accommodation": "Small, Cozy 1BD Apartment, Wichita Falls"}, {"day": 3, "current_city": "from Wichita Falls to Waco", "transportation": "Self-driving, from Wichita Falls to Waco, duration: 3 hours 2 mins, distance: 327 km", "breakfast": "The Coffee Bean & Tea Leaf, Wichita Falls", "attraction": "The World's Littlest Skyscraper, Wichita Falls;Lucy Park, Wichita Falls;", "lunch": "Tyre Patty, Wichita Falls", "dinner": "-", "accommodation": "1 bedroom, large williamsburg loft, Waco"}, {"day": 4, "current_city": "Waco", "transportation": "-", "breakfast": "Blue House Cafe, Waco", "attraction": "Dr Pepper Museum, Waco;Cameron Park Zoo, Waco;", "lunch": "Fork, Waco", "dinner": "Aunty's Kitchen, Waco", "accommodation": "1 bedroom, large williamsburg loft, Waco"}, {"day": 5, "current_city": "from Waco to Houston", "transportation": "Self-driving, from Waco to Houston, duration: 2 hours 50 mins, distance: 298 km", "breakfast": "Punjabi Rasoi, Waco", "attraction": "Waco Mammoth National Monument, Waco;Texas Ranger Hall of Fame & Museum, Waco;", "lunch": "First Gear Cafe, Waco", "dinner": "-", "accommodation": "Superhost 3 bedroom DISCOUNT, Houston"}, {"day": 6, "current_city": "Houston", "transportation": "-", "breakfast": "Jalapenos, Houston", "attraction": "Downtown Aquarium, Houston;Space Center Houston, Houston;", "lunch": "Istanbul Restaurant, Houston", "dinner": "Taj Cafe, Houston", "accommodation": "Superhost 3 bedroom DISCOUNT, Houston"}, {"day": 7, "current_city": "from Houston to Harrisburg", "transportation": "Self-driving, from Houston to Harrisburg, duration: 21 hours 16 mins, distance: 2,353 km", "breakfast": "Super Bakery, Houston", "attraction": "Water Wall, Houston;Houston Museum of Natural Science, Houston;", "lunch": "Sheetla Dhaba, Houston", "dinner": "-", "accommodation": "-"}]}]