[{"gpt-4-1106-preview_direct_sole-planning_results": "Travel Plan:\n\nDays: 1\nCurrent City: from Manchester to Charlotte\nTransportation: Flight Number: F3785421, from Manchester to Charlotte, Departure Time: 14:16, Arrival Time: 16:46, cost: 223\nBreakfast: -\nAttraction: -\nLunch: -\nDinner: Olive Tree Cafe, Charlotte, cost: 23, cuisines: Tea, Chinese, Desserts\nAccommodation: Elegant Studio Apt in Prospect Heights, Charlotte, cost: 640, room type: Entire home/apt, house rules: No parties, minimum nights: 2, maximum occupancy: 5\n\nNumber of people: 5\nTotal cost: 5 x 223 + 5 x 23 + 1 x 640 = 2,755\nAccommodation minimum nights: 1/2\n\nDays: 2\nCurrent City: Charlotte\nTransportation: -\nBreakfast: Central Perk 7, Charlotte, cost: 87, cuisines: Pizza, Bakery, BBQ, Fast Food\nAttraction: Freedom Park, Charlotte; Levine Museum of the New South, Charlotte; Discovery Place Science, Charlotte\nLunch: Subway, Charlotte, cost: 60, cuisines: Tea, Cafe, Mexican, Chinese, Seafood\nDinner: Cafe Maple Street, Charlotte, cost: 91, cuisines: Fast Food, Tea, Italian\nAccommodation: Elegant Studio Apt in Prospect Heights, Charlotte, cost: 640, room type: Entire home/apt, house rules: No parties, minimum nights: 2, maximum occupancy: 5\n\nNumber of people: 5\nTotal cost: 5 x 87 + 5 x 60 + 5 x 91 + 1 x 640 = 2,540\nAccommodation minimum nights: 2/2\n\nDays: 3\nCurrent City: from Charlotte to Manchester\nTransportation: Flight Number: F3785397, from Charlotte to Manchester, Departure Time: 11:21, Arrival Time: 13:22, cost: 284\nBreakfast: Kylin Skybar, Charlotte, cost: 44, cuisines: Tea, Cafe, Pizza, Italian\nAttraction: NASCAR Hall of Fame, Charlotte; The Mint Museum, Charlotte\nLunch: Unplugged Courtyard, Charlotte, cost: 54, cuisines: Desserts, French, Bakery, Cafe, Seafood\nDinner: -\nAccommodation: -\n\nNumber of people: 5\nTotal cost: 5 x 284 + 5 x 44 + 5 x 54 = 1,910\n\nTotal cost across all days: 2,755 + 2,540 + 1,910 = 7,205\n\nUnfortunately, the total cost of the travel plan exceeds the specified budget of $4,800. Adjustments need to be made to ensure the total cost does not exceed the budget. Here is a revised plan that fits within the budget:\n\nRevised Travel Plan:\n\nDays: 1\nCurrent City: from Manchester to Charlotte\nTransportation: Flight Number: F3785421, from Manchester to Charlotte, Departure Time: 14:16, Arrival Time: 16:46, cost: 223\nBreakfast: -\nAttraction: -\nLunch: -\nDinner: Olive Tree Cafe, Charlotte, cost: 23, cuisines: Tea, Chinese, Desserts\nAccommodation: Luxury 2 bdr/2 bath prime Williamburg, Charlotte, cost: 218, room type: Entire home/apt, house rules: No children under 10 & No smoking & No pets, minimum nights: 1, maximum occupancy: 3\n\nNumber of people: 5\nTotal cost: 5 x 223 + 5 x 23 + 1 x 218 = 1,433\nAccommodation minimum nights: 1/1\n\nDays: 2\nCurrent City: Charlotte\nTransportation: -\nBreakfast: Central Perk 7, Charlotte, cost: 87, cuisines: Pizza, Bakery, BBQ, Fast Food\nAttraction: Freedom Park, Charlotte; Levine Museum of the New South, Charlotte; Discovery Place Science, Charlotte\nLunch: Subway, Charlotte, cost: 60, cuisines: Tea, Cafe, Mexican, Chinese, Seafood\nDinner: Cafe Maple Street, Charlotte, cost: 91, cuisines: Fast Food, Tea, Italian\nAccommodation: Luxury 2 bdr/2 bath prime Williamburg, Charlotte, cost: 218, room type: Entire home/apt, house rules: No children under 10 & No smoking & No pets, minimum nights: 1, maximum occupancy: 3\n\nNumber of people: 5\nTotal cost: 5 x 87 + 5 x 60 + 5 x 91 + 1 x 218 = 1,540\nAccommodation minimum nights: 2/1\n\nDays: 3\nCurrent City: from Charlotte to Manchester\nTransportation: Flight Number: F3785397, from Charlotte to Manchester, Departure Time: 11:21, Arrival Time: 13:22, cost: 284\nBreakfast: Kylin Skybar, Charlotte, cost: 44, cuisines: Tea, Cafe, Pizza, Italian\nAttraction: NASCAR Hall of Fame, Charlotte; The Mint Museum, Charlotte\nLunch: Unplugged Courtyard, Charlotte, cost: 54, cuisines: Desserts, French, Bakery, Cafe, Seafood\nDinner: -\nAccommodation: -\n\nNumber of people: 5\nTotal cost: 5 x 284 + 5 x 44 + 5 x 54 = 1,910\n\nTotal cost across all days: 1,433 + 1,540 + 1,910 = 4,883\n\nThe revised plan slightly exceeds the budget by $83. To fit within the budget, we can opt for a less expensive breakfast on Day 3:\n\nRevised Breakfast on Day 3:\nBreakfast: Prince Snacks & Momo's Point, Charlotte, cost: 11, cuisines: Tea, Cafe, Desserts, Fast Food\n\nNew total cost for Day 3: 5 x 284 + 5 x 11 + 5 x 54 = 1,745\n\nNew total cost across all days: 1,433 + 1,540 + 1,745 = 4,718\n\nThe revised travel plan now fits within the budget of $4,800.", "gpt-4-1106-preview_direct_sole-planning_parsed_results": [{"day": 1, "current_city": "from Manchester to Charlotte", "transportation": "Flight Number: F3785421, from Manchester to Charlotte, Departure Time: 14:16, Arrival Time: 16:46", "breakfast": "-", "attraction": "-", "lunch": "-", "dinner": "Olive Tree Cafe, Charlotte", "accommodation": "Luxury 2 bdr/2 bath prime Williamburg, Charlotte"}, {"day": 2, "current_city": "Charlotte", "transportation": "-", "breakfast": "Central Perk 7, Charlotte", "attraction": "Freedom Park, Charlotte;Levine Museum of the New South, Charlotte;Discovery Place Science, Charlotte;", "lunch": "Subway, Charlotte", "dinner": "Cafe Maple Street, Charlotte", "accommodation": "Luxury 2 bdr/2 bath prime Williamburg, Charlotte"}, {"day": 3, "current_city": "from Charlotte to Manchester", "transportation": "Flight Number: F3785397, from Charlotte to Manchester, Departure Time: 11:21, Arrival Time: 13:22", "breakfast": "Prince Snacks & Momo's Point, Charlotte", "attraction": "NASCAR Hall of Fame, Charlotte;The Mint Museum, Charlotte;", "lunch": "Unplugged Courtyard, Charlotte", "dinner": "-", "accommodation": "-"}]}]