[{"gpt-4-1106-preview_direct_sole-planning_results": "Travel Plan:\n\nDays: 1\nCurrent City: from Charlotte to Marquette (Wisconsin)\nTransportation: Self-driving, from Charlotte to Marquette, duration: 13 hours 1 min, distance: 1,371 km, cost: 68\nBreakfast: -\nAttraction: -\nLunch: -\nDinner: -\nAccommodation: Huge Private Room Near Prospect Park, Marquette (Wisconsin), cost: 73, room type: Private room, house rules: No smoking & No visitors, minimum nights: 1, maximum occupancy: 2\n\nNumber of people: 2\nTotal cost: 2 x 68 + 1 x 73 = 209\nAccommodation minimum nights: 1/1\n\nDays: 2\nCurrent City: Marquette (Wisconsin)\nTransportation: -\nBreakfast: The Chop House, Marquette (Wisconsin), cost: 81, cuisines: Desserts, Tea, Pizza, Mexican, Bakery, Indian\nAttraction: Presque Isle Park, Marquette (Wisconsin); Marquette Harbor Lighthouse, Marquette (Wisconsin); Upper Peninsula Children's Museum, Marquette (Wisconsin)\nLunch: Taste of Balingup, Marquette (Wisconsin), cost: 35, cuisines: BBQ, Desserts\nDinner: Dovetail, Marquette (Wisconsin), cost: 95, cuisines: Fast Food, Indian, BBQ, Italian\nAccommodation: Huge Private Room Near Prospect Park, Marquette (Wisconsin), cost: 73, room type: Private room, house rules: No smoking & No visitors, minimum nights: 1, maximum occupancy: 2\n\nNumber of people: 2\nTotal cost: 2 x 81 + 2 x 35 + 2 x 95 + 1 x 73 = 495\nAccommodation minimum nights: 2/1\n\nDays: 3\nCurrent City: from Marquette (Wisconsin) to Milwaukee (Wisconsin)\nTransportation: Taxi, from Marquette to Milwaukee, duration: 6 mins, distance: 2.0 km, cost: 2\nBreakfast: Ifthar, Marquette (Wisconsin), cost: 67, cuisines: Bakery, American, Cafe, Desserts\nAttraction: De Vos Art Museum, Marquette (Wisconsin); Ellwood A Mattson Lower Harbor Park, Marquette (Wisconsin)\nLunch: Annapurna Sweet House, Marquette (Wisconsin), cost: 36, cuisines: French, Bakery, Desserts, Seafood\nDinner: -\nAccommodation: Spacious 1 Bedroom in Midwood, BK!, Milwaukee (Wisconsin), cost: 1125, room type: Private room, house rules: No children under 10, minimum nights: 1, maximum occupancy: 1\n\nNumber of people: 2\nTotal cost: 2 x 2 + 2 x 67 + 2 x 36 + 1 x 1125 = 1333\nAccommodation minimum nights: 1/1\n\nDays: 4\nCurrent City: Milwaukee (Wisconsin)\nTransportation: -\nBreakfast: Cool Basil, Milwaukee (Wisconsin), cost: 40, cuisines: Chinese, Pizza, French, Fast Food, Cafe\nAttraction: Milwaukee Art Museum, Milwaukee (Wisconsin); Milwaukee Public Museum, Milwaukee (Wisconsin); North Point Lighthouse, Milwaukee (Wisconsin)\nLunch: Berco's, Milwaukee (Wisconsin), cost: 91, cuisines: Desserts, Pizza, Italian, Cafe, Seafood\nDinner: Subway, Milwaukee (Wisconsin), cost: 48, cuisines: Tea, BBQ, Desserts\nAccommodation: Spacious 1 Bedroom in Midwood, BK!, Milwaukee (Wisconsin), cost: 1125, room type: Private room, house rules: No children under 10, minimum nights: 1, maximum occupancy: 1\n\nNumber of people: 2\nTotal cost: 2 x 40 + 2 x 91 + 2 x 48 + 1 x 1125 = 1483\nAccommodation minimum nights: 2/1\n\nDays: 5\nCurrent City: from Milwaukee (Wisconsin) to Charlotte\nTransportation: Self-driving, from Milwaukee to Charlotte, duration: 12 hours 58 mins, distance: 1,369 km, cost: 68\nBreakfast: Shankar Sweets, Milwaukee (Wisconsin), cost: 66, cuisines: Tea, Bakery, Pizza, Fast Food\nAttraction: Milwaukee County Zoo, Milwaukee (Wisconsin); Discovery World, Milwaukee (Wisconsin)\nLunch: Frontier, Milwaukee (Wisconsin), cost: 13, cuisines: Fast Food, Seafood, Tea, Italian\nDinner: -\nAccommodation: -\n\nNumber of people: 2\nTotal cost: 2 x 68 + 2 x 66 + 2 x 13 = 230\n\nTotal cost across all days: 209 + 495 + 1333 + 1483 + 230 = 3750\n\nCuisines: The prompt specifies no cuisines, so all cuisines constraints are satisfied.\nRoom Constraint: All accommodations selected are private rooms, but there is an issue with the \"Spacious 1 Bedroom in Midwood, BK!\" in Milwaukee, which does not allow children under 10. This needs to be addressed to meet the query's requirements.\nTransportation Constraint: No flights were involved in the transportation planning, as requested.\n\n**Note: The total cost exceeds the specified budget of $2,500, and there is a conflict with the accommodation's house rules regarding children under 10. Adjustments are needed to meet the budget and accommodation requirements.**", "gpt-4-1106-preview_direct_sole-planning_parsed_results": [{"day": 1, "current_city": "from Charlotte to Marquette (Wisconsin)", "transportation": "Self-driving, from Charlotte to Marquette, duration: 13 hours 1 min, distance: 1,371 km", "breakfast": "-", "attraction": "-", "lunch": "-", "dinner": "-", "accommodation": "Huge Private Room Near Prospect Park, Marquette (Wisconsin)"}, {"day": 2, "current_city": "Marquette (Wisconsin)", "transportation": "-", "breakfast": "The Chop House, Marquette (Wisconsin)", "attraction": "Presque Isle Park, Marquette (Wisconsin);Marquette Harbor Lighthouse, Marquette (Wisconsin);Upper Peninsula Children's Museum, Marquette (Wisconsin);", "lunch": "Taste of Balingup, Marquette (Wisconsin)", "dinner": "Dovetail, Marquette (Wisconsin)", "accommodation": "Huge Private Room Near Prospect Park, Marquette (Wisconsin)"}, {"day": 3, "current_city": "from Marquette (Wisconsin) to Milwaukee (Wisconsin)", "transportation": "Taxi, from Marquette to Milwaukee, duration: 6 mins, distance: 2.0 km", "breakfast": "Ifthar, Marquette (Wisconsin)", "attraction": "De Vos Art Museum, Marquette (Wisconsin);Ellwood A Mattson Lower Harbor Park, Marquette (Wisconsin);", "lunch": "Annapurna Sweet House, Marquette (Wisconsin)", "dinner": "-", "accommodation": "Spacious 1 Bedroom in Midwood, BK!, Milwaukee (Wisconsin)"}, {"day": 4, "current_city": "Milwaukee (Wisconsin)", "transportation": "-", "breakfast": "Cool Basil, Milwaukee (Wisconsin)", "attraction": "Milwaukee Art Museum, Milwaukee (Wisconsin);Milwaukee Public Museum, Milwaukee (Wisconsin);North Point Lighthouse, Milwaukee (Wisconsin);", "lunch": "Berco's, Milwaukee (Wisconsin)", "dinner": "Subway, Milwaukee (Wisconsin)", "accommodation": "Spacious 1 Bedroom in Midwood, BK!, Milwaukee (Wisconsin)"}, {"day": 5, "current_city": "from Milwaukee (Wisconsin) to Charlotte", "transportation": "Self-driving, from Milwaukee to Charlotte, duration: 12 hours 58 mins, distance: 1,369 km", "breakfast": "Shankar Sweets, Milwaukee (Wisconsin)", "attraction": "Milwaukee County Zoo, Milwaukee (Wisconsin);Discovery World, Milwaukee (Wisconsin);", "lunch": "Frontier, Milwaukee (Wisconsin)", "dinner": "-", "accommodation": "-"}]}]