[{"gpt-4-1106-preview_direct_sole-planning_results": "Travel Plan:\n\nDays: 1\nCurrent City: from Detroit to La Crosse (Wisconsin)\nTransportation: Taxi, from Detroit to La Crosse, duration: 8 hours 23 mins, distance: 915 km, cost: $915\nBreakfast: -\nAttraction: -\nLunch: -\nDinner: -\nAccommodation: Great location-Newly updated-great new features, La Crosse (Wisconsin), cost: $255, room type: Entire home/apt, house rules: No pets, minimum nights: 3, maximum occupancy: 2\n\nNumber of people: 2\nTotal cost: 2 x $915 + 1 x $255 = $2,085\nAccommodation minimum nights: 1/3\n\nDays: 2\nCurrent City: La Crosse (Wisconsin)\nTransportation: -\nBreakfast: Goldy's Breakfast Bistro, La Crosse (Wisconsin), cost: $94, cuisines: Desserts, Tea, Cafe, American, Seafood\nAttraction: Children's Museum of La Crosse, La Crosse (Wisconsin); Riverside Park, La Crosse (Wisconsin)\nLunch: Hot Palayok, La Crosse (Wisconsin), cost: $52, cuisines: Fast Food, BBQ, Mediterranean, Seafood\nDinner: Hot Stuff, La Crosse (Wisconsin), cost: $11, cuisines: Chinese, Pizza, BBQ\nAccommodation: Great location-Newly updated-great new features, La Crosse (Wisconsin), cost: $255, room type: Entire home/apt, house rules: No pets, minimum nights: 3, maximum occupancy: 2\n\nNumber of people: 2\nTotal cost: 2 x $94 + 2 x $52 + 2 x $11 + 1 x $255 = $569\nAccommodation minimum nights: 2/3\n\nDays: 3\nCurrent City: from La Crosse (Wisconsin) to Appleton (Wisconsin)\nTransportation: Taxi, from La Crosse to Appleton, duration: 3 hours 2 mins, distance: 273 km, cost: $273\nBreakfast: Moti Mahal Delux, La Crosse (Wisconsin), cost: $42, cuisines: Desserts, Tea, Pizza, Bakery, Indian, Mediterranean\nAttraction: Grandad Bluff Park, La Crosse (Wisconsin); La Crosse Segway Tours, La Crosse (Wisconsin)\nLunch: 10 Downing Street, La Crosse (Wisconsin), cost: $35, cuisines: Tea, Cafe, Italian\nDinner: -\nAccommodation: Luxury Apartment in Williamsburg!, Appleton (Wisconsin), cost: $436, room type: Entire home/apt, house rules: No parties & No children under 10 & No smoking, minimum nights: 5, maximum occupancy: 2\n\nNumber of people: 2\nTotal cost: 2 x $273 + 2 x $42 + 2 x $35 + 1 x $436 = $1,136\nAccommodation minimum nights: 1/5\n\nDays: 4\nCurrent City: Appleton (Wisconsin)\nTransportation: -\nBreakfast: Mikata Japanese Steakhouse, Appleton (Wisconsin), cost: $72, cuisines: Cafe, Pizza, Bakery, Italian\nAttraction: The History Museum at the Castle, Appleton (Wisconsin); Hearthstone Historic House Museum, Appleton (Wisconsin)\nLunch: Colony, Appleton (Wisconsin), cost: $110, cuisines: Pizza, BBQ, Fast Food, Chinese, Mediterranean, Seafood\nDinner: Swati Snacks, Appleton (Wisconsin), cost: $84, cuisines: Desserts, Bakery, BBQ, Fast Food, American\nAccommodation: Luxury Apartment in Williamsburg!, Appleton (Wisconsin), cost: $436, room type: Entire home/apt, house rules: No parties & No children under 10 & No smoking, minimum nights: 5, maximum occupancy: 2\n\nNumber of people: 2\nTotal cost: 2 x $72 + 2 x $110 + 2 x $84 + 1 x $436 = $968\nAccommodation minimum nights: 2/5\n\nDays: 5\nCurrent City: from Appleton (Wisconsin) to Detroit\nTransportation: Flight Number: F3642011, from Appleton to Detroit, Price: $68, DepTime: 11:47, ArrTime: 13:51, ActualElapsedTime: 1 hours 4 minutes\nBreakfast: Destination Live, Appleton (Wisconsin), cost: $30, cuisines: Tea, Indian, BBQ\nAttraction: -\nLunch: -\nDinner: -\nAccommodation: -\n\nNumber of people: 2\nTotal cost: 2 x $68 + 2 x $30 = $196\n\nTotal cost across all days: $2,085 + $569 + $1,136 + $968 + $196 = $4,954\n\nUnfortunately, the total cost of $4,954 exceeds the specified budget of $3,200. Adjustments must be made to the travel plan to fit within the budget. This could involve changing the mode of transportation, selecting different accommodations, or reducing meal costs. However, given the constraints and the information provided, it is not possible to create a travel plan that meets all requirements within the specified budget.", "gpt-4-1106-preview_direct_sole-planning_parsed_results": [{"day": 1, "current_city": "from Detroit to La Crosse", "transportation": "Taxi, from Detroit to La Crosse, duration: 8 hours 23 mins, distance: 915 km", "breakfast": "-", "attraction": "-", "lunch": "-", "dinner": "-", "accommodation": "Great location-Newly updated-great new features, La Crosse"}, {"day": 2, "current_city": "La Crosse", "transportation": "-", "breakfast": "Goldy's Breakfast Bistro, La Crosse", "attraction": "Children's Museum of La Crosse, La Crosse;Riverside Park, La Crosse;", "lunch": "Hot Palayok, La Crosse", "dinner": "Hot Stuff, La Crosse", "accommodation": "Great location-Newly updated-great new features, La Crosse"}, {"day": 3, "current_city": "from La Crosse to Appleton", "transportation": "Taxi, from La Crosse to Appleton, duration: 3 hours 2 mins, distance: 273 km", "breakfast": "Moti Mahal Delux, La Crosse", "attraction": "Grandad Bluff Park, La Crosse;La Crosse Segway Tours, La Crosse;", "lunch": "10 Downing Street, La Crosse", "dinner": "-", "accommodation": "Luxury Apartment in Williamsburg!, Appleton"}, {"day": 4, "current_city": "Appleton", "transportation": "-", "breakfast": "Mikata Japanese Steakhouse, Appleton", "attraction": "The History Museum at the Castle, Appleton;Hearthstone Historic House Museum, Appleton;", "lunch": "Colony, Appleton", "dinner": "Swati Snacks, Appleton", "accommodation": "Luxury Apartment in Williamsburg!, Appleton"}, {"day": 5, "current_city": "from Appleton to Detroit", "transportation": "Flight Number: F3642011, from Appleton to Detroit, DepTime: 11:47, ArrTime: 13:51, ActualElapsedTime: 1 hours 4 minutes", "breakfast": "Destination Live, Appleton", "attraction": "-", "lunch": "-", "dinner": "-", "accommodation": "-"}]}]