[{"gpt-4-1106-preview_direct_sole-planning_results": "Travel Plan:\nNumber of people = 1\n\nDay 1: Kona to San Diego (California)\n- Transportation: Flight Number: F3739867, from Kona to San Diego, Departure Time: 16:33, Arrival Time: 00:04, cost: $778\n- Breakfast: -\n- Attraction: -\n- Lunch: -\n- Dinner: Open Yard, San Diego (California), cost: $33, cuisines: \u201cChinese, Pizza, Cafe, Desserts\u201d\n- Accommodation: Spacious Room in Large 2 Bedroom Prewar Apartment, San Diego (California), cost: $585, maximum occupancy: 2, house rules: No parties & No visitors, minimum nights: 1\n\nTotal cost for Day 1: $778 + $33 + $585 = $1,396\n\nDay 2: San Diego (California)\n- Transportation: -\n- Breakfast: Burger King, San Diego (California), cost: $20, cuisines: \u201cPizza, Italian, French, Fast Food, Seafood\u201d\n- Attraction: Cabrillo National Monument, San Diego (California)\n- Lunch: Gopala, San Diego (California), cost: $98, cuisines: \u201cPizza, Mexican, BBQ, American, Seafood\u201d\n- Dinner: Bikaner Sweets, San Diego (California), cost: $37, cuisines: \u201cBakery, Pizza, Indian, Fast Food\u201d\n- Accommodation: Spacious Room in Large 2 Bedroom Prewar Apartment, San Diego (California), cost: $585, maximum occupancy: 2, house rules: No parties & No visitors, minimum nights: 1\n\nTotal cost for Day 2: $20 + $98 + $37 + $585 = $740\n\nDay 3: San Diego to Redding (California)\n- Transportation: Self-driving, from San Diego to Redding, duration: 10 hours 10 mins, distance: 1,070 km, cost: $53\n- Breakfast: -\n- Attraction: Sundial Bridge, Redding (California)\n- Lunch: -\n- Dinner: New Yorker Deli & Pizzeria, Redding (California), cost: $78, cuisines: \u201cPizza, Bakery, Desserts, Seafood\u201d\n- Accommodation: **Cozy Space - Private Access**, Redding (California), cost: $954, maximum occupancy: 1, house rules: No smoking & No children under 10, minimum nights: 2\n\nTotal cost for Day 3: $53 + $78 + $954 = $1,085\n\nDay 4: Redding (California)\n- Transportation: -\n- Breakfast: Perfect Bake, Redding (California), cost: $69, cuisines: \u201cTea, Pizza, Fast Food\u201d\n- Attraction: Turtle Bay Exploration Park, Redding (California)\n- Lunch: Mosaic - Country Inn & Suites, Redding (California), cost: $57, cuisines: \u201cPizza, Bakery, BBQ, Fast Food, American, Mediterranean\u201d\n- Dinner: Weird Time Food, Redding (California), cost: $34, cuisines: \u201cBakery, BBQ, Italian\u201d\n- Accommodation: **Cozy Space - Private Access**, Redding (California), cost: $954, maximum occupancy: 1, house rules: No smoking & No children under 10, minimum nights: 2\n\nTotal cost for Day 4: $69 + $57 + $34 + $954 = $1,114\n\nDay 5: Redding to San Jose (California)\n- Transportation: Self-driving, from Redding to San Jose, duration: 3 hours 49 mins, distance: 402 km, cost: $20\n- Breakfast: -\n- Attraction: Winchester Mystery House, San Jose (California)\n- Lunch: -\n- Dinner: Wildfire - Crowne Plaza, San Jose (California), cost: $30, cuisines: \u201cDesserts, Cafe, Fast Food, Chinese, Indian, Seafood\u201d\n- Accommodation: A4Long Island City Big Room Great Location, San Jose (California), cost: $808, maximum occupancy: 2, house rules: No visitors & No pets, minimum nights: 1\n\nTotal cost for Day 5: $20 + $30 + $808 = $858\n\nDay 6: San Jose (California)\n- Transportation: -\n- Breakfast: Santa's Fantasea, San Jose (California), cost: $31, cuisines: \u201cCafe, Bakery, Pizza, BBQ\u201d\n- Attraction: Rosicrucian Egyptian Museum, San Jose (California)\n- Lunch: Gola Sizzlers, San Jose (California), cost: $87, cuisines: \u201cPizza, Mexican, BBQ, Fast Food, American\u201d\n- Dinner: China Kitchen - Hyatt Regency, San Jose (California), cost: $94, cuisines: \u201cBakery, Mediterranean, Seafood\u201d\n- Accommodation: A4Long Island City Big Room Great Location, San Jose (California), cost: $808, maximum occupancy: 2, house rules: No visitors & No pets, minimum nights: 1\n\nTotal cost for Day 6: $31 + $87 + $94 + $808 = $1,020\n\nDay 7: San Jose to Kona\n- Transportation: Flight Number: F3976224, from San Jose to Kona, Departure Time: 09:32, Arrival Time: 11:36, cost: $909\n- Breakfast: -\n- Attraction: -\n- Lunch: -\n- Dinner: -\n- Accommodation: -\n\nTotal cost for Day 7: $909\n\nTotal cost across all days: $1,396 + $740 + $1,085 + $1,114 + $858 + $1,020 + $909 = $7,122\n\nUnfortunately, the total cost exceeds the specified budget of $5,800. Adjustments will need to be made to the plan to reduce costs. This could include selecting more budget-friendly accommodations, finding cheaper meal options, or reducing the number of attractions visited.", "gpt-4-1106-preview_direct_sole-planning_parsed_results": [{"day": 1, "current_city": "from Kona to San Diego", "transportation": "Flight Number: F3739867, from Kona to San Diego, Departure Time: 16:33, Arrival Time: 00:04", "breakfast": "-", "attraction": "-", "lunch": "-", "dinner": "Open Yard, San Diego", "accommodation": "Spacious Room in Large 2 Bedroom Prewar Apartment, San Diego"}, {"day": 2, "current_city": "San Diego", "transportation": "-", "breakfast": "Burger King, San Diego", "attraction": "Cabrillo National Monument, San Diego", "lunch": "Gopala, San Diego", "dinner": "Bikaner Sweets, San Diego", "accommodation": "Spacious Room in Large 2 Bedroom Prewar Apartment, San Diego"}, {"day": 3, "current_city": "from San Diego to Redding", "transportation": "Self-driving, from San Diego to Redding, duration: 10 hours 10 mins, distance: 1,070 km", "breakfast": "-", "attraction": "Sundial Bridge, Redding", "lunch": "-", "dinner": "New Yorker Deli & Pizzeria, Redding", "accommodation": "Cozy Space - Private Access, Redding"}, {"day": 4, "current_city": "Redding", "transportation": "-", "breakfast": "Perfect Bake, Redding", "attraction": "Turtle Bay Exploration Park, Redding", "lunch": "Mosaic - Country Inn & Suites, Redding", "dinner": "Weird Time Food, Redding", "accommodation": "Cozy Space - Private Access, Redding"}, {"day": 5, "current_city": "from Redding to San Jose", "transportation": "Self-driving, from Redding to San Jose, duration: 3 hours 49 mins, distance: 402 km", "breakfast": "-", "attraction": "Winchester Mystery House, San Jose", "lunch": "-", "dinner": "Wildfire - Crowne Plaza, San Jose", "accommodation": "A4Long Island City Big Room Great Location, San Jose"}, {"day": 6, "current_city": "San Jose", "transportation": "-", "breakfast": "Santa's Fantasea, San Jose", "attraction": "Rosicrucian Egyptian Museum, San Jose", "lunch": "Gola Sizzlers, San Jose", "dinner": "China Kitchen - Hyatt Regency, San Jose", "accommodation": "A4Long Island City Big Room Great Location, San Jose"}, {"day": 7, "current_city": "from San Jose to Kona", "transportation": "Flight Number: F3976224, from San Jose to Kona, Departure Time: 09:32, Arrival Time: 11:36", "breakfast": "-", "attraction": "-", "lunch": "-", "dinner": "-", "accommodation": "-"}]}]