[{"gpt-4-1106-preview_direct_sole-planning_results": "Travel Plan:\n\nDay 1: March 25, 2022\nCurrent City: from Salt Lake City to Twin Falls\nTransportation: Flight Number: F3809095, from Salt Lake City to Twin Falls, Departure Time: 11:00, Arrival Time: 11:55\nBreakfast: - (Assuming breakfast is had before departure)\nAttraction: Snake River Canyon Rim Trail, Twin Falls\nLunch: Asia Kitchen, Twin Falls (Chinese cuisine)\nDinner: Fresc Co, Twin Falls (Mexican cuisine)\nAccommodation: Charming studio, great location!!!, Twin Falls\n\nDay 2: March 26, 2022\nCurrent City: Twin Falls\nTransportation: -\nBreakfast: Asia Kitchen, Twin Falls (Chinese cuisine)\nAttraction: Shoshone Falls Park, Twin Falls; Evel Knievel Snake River Canyon Jump Site, Twin Falls\nLunch: Food Fever, Twin Falls (Chinese cuisine)\nDinner: Fresc Co, Twin Falls (Mexican cuisine)\nAccommodation: Charming studio, great location!!!, Twin Falls\n\nDay 3: March 27, 2022\nCurrent City: from Twin Falls to Salt Lake City\nTransportation: Flight Number: F3807678, from Twin Falls to Salt Lake City, Departure Time: 12:35, Arrival Time: 13:20\nBreakfast: Asia Kitchen, Twin Falls (Chinese cuisine)\nAttraction: Centennial Waterfront Park, Twin Falls (before departure)\nLunch: - (Assuming lunch is had upon arrival back in Salt Lake City or en route)\nDinner: - (Assuming travelers are back in Salt Lake City)\nAccommodation: -\n\nPlease note that the accommodation chosen is under the assumption that the travelers will be comfortable in an entire home/apt type of accommodation and that it fits within the budget when considering the cost of flights, meals, and other expenses. The restaurants selected offer Chinese and Mexican cuisines as requested. The attractions chosen are based on proximity and relevance to the interests of the travelers.", "gpt-4-1106-preview_direct_sole-planning_parsed_results": [{"day": 1, "current_city": "from Salt Lake City to Twin Falls", "transportation": "Flight Number: F3809095, from Salt Lake City to Twin Falls, Departure Time: 11:00, Arrival Time: 11:55", "breakfast": "-", "attraction": "Snake River Canyon Rim Trail, Twin Falls;", "lunch": "Asia Kitchen, Twin Falls", "dinner": "Fresc Co, Twin Falls", "accommodation": "Charming studio, great location!!!, Twin Falls"}, {"day": 2, "current_city": "Twin Falls", "transportation": "-", "breakfast": "Asia Kitchen, Twin Falls", "attraction": "Shoshone Falls Park, Twin Falls;Evel Knievel Snake River Canyon Jump Site, Twin Falls;", "lunch": "Food Fever, Twin Falls", "dinner": "Fresc Co, Twin Falls", "accommodation": "Charming studio, great location!!!, Twin Falls"}, {"day": 3, "current_city": "from Twin Falls to Salt Lake City", "transportation": "Flight Number: F3807678, from Twin Falls to Salt Lake City, Departure Time: 12:35, Arrival Time: 13:20", "breakfast": "Asia Kitchen, Twin Falls", "attraction": "Centennial Waterfront Park, Twin Falls;", "lunch": "-", "dinner": "-", "accommodation": "-"}]}]