[{"gpt-4-1106-preview_direct_sole-planning_results": "Travel Plan:\n\nNumber of people = 2\n\nDay 1: Santa Ana to Durango (Colorado)\n- Transportation: Taxi, from Santa Ana to Durango, duration: 11 hours 55 mins, distance: 1,245 km, cost: $1,245\n- Breakfast: -\n- Attraction: -\n- Lunch: -\n- Dinner: Samurai Japanese Cuisine & Sushi Bar, Durango (Colorado), cost: $67, cuisines: \u201cBakery, Desserts, Fast Food\u201d\n- Accommodation: Luxury in Best Location, Durango (Colorado), cost: $70, room type: Entire home/apt, house rules: No children under 10 & No visitors, minimum nights: 1, maximum occupancy: 2\n\nTotal cost for Day 1 = ($1,245 + $67) * 2 + $70 = $2,694\n\nDay 2: Durango (Colorado)\n- Transportation: -\n- Breakfast: Samurai Japanese Cuisine & Sushi Bar, Durango (Colorado), cost: $67, cuisines: \u201cBakery, Desserts, Fast Food\u201d\n- Attraction: Durango & Silverton Narrow Gauge Railroad, Durango (Colorado)\n- Lunch: Dub's High on the Hog, Durango (Colorado), cost: $98, cuisines: \u201cTea, Italian, French, Cafe, Seafood\u201d\n- Dinner: The Mashal, Durango (Colorado), cost: $85, cuisines: \u201cItalian, BBQ, Fast Food, Cafe, American, Seafood\u201d\n- Accommodation: Luxury in Best Location, Durango (Colorado), cost: $70, room type: Entire home/apt, house rules: No children under 10 & No visitors, minimum nights: 1, maximum occupancy: 2\n\nTotal cost for Day 2 = ($67 + $98 + $85) * 2 + $70 = $790\n\nDay 3: Durango to Alamosa (Colorado)\n- Transportation: Taxi, from Durango to Alamosa, duration: 2 hours 52 mins, distance: 240 km, cost: $240\n- Breakfast: -\n- Attraction: San Luis Valley Museum | Alamosa, Alamosa (Colorado)\n- Lunch: Cafe LazyMojo, Alamosa (Colorado), cost: $26, cuisines: \u201cTea, Pizza, American, Fast Food\u201d\n- Dinner: The Diet Kitchen, Alamosa (Colorado), cost: $50, cuisines: \u201cPizza, Bakery, BBQ, American, Mediterranean\u201d\n- Accommodation: Comfortable studio suite in midtown Manhattan, Alamosa (Colorado), cost: $67, room type: Entire home/apt, house rules: No parties & No smoking & No visitors, minimum nights: 1, maximum occupancy: 2\n\nTotal cost for Day 3 = ($240 + $26 + $50) * 2 + $67 = $749\n\nDay 4: Alamosa (Colorado)\n- Transportation: -\n- Breakfast: Cafe LazyMojo, Alamosa (Colorado), cost: $26, cuisines: \u201cTea, Pizza, American, Fast Food\u201d\n- Attraction: Rio Grande Farm Park, Alamosa (Colorado)\n- Lunch: Emperor's Lounge - The Taj Mahal Hotel, Alamosa (Colorado), cost: $65, cuisines: \u201cTea, Italian, BBQ, Cafe, Seafood\u201d\n- Dinner: Mehak Restaurant, Alamosa (Colorado), cost: $50, cuisines: \u201cDesserts, Seafood\u201d\n- Accommodation: Comfortable studio suite in midtown Manhattan, Alamosa (Colorado), cost: $67, room type: Entire home/apt, house rules: No parties & No smoking & No visitors, minimum nights: 1, maximum occupancy: 2\n\nTotal cost for Day 4 = ($26 + $65 + $50) * 2 + $67 = $399\n\nDay 5: Alamosa to Colorado Springs (Colorado)\n- Transportation: Taxi, from Alamosa to Colorado Springs, duration: 2 hours 36 mins, distance: 263 km, cost: $263\n- Breakfast: -\n- Attraction: Garden of the Gods, Colorado Springs (Colorado)\n- Lunch: Raglan Road Irish Pub and Restaurant, Colorado Springs (Colorado), cost: $97, cuisines: \u201cChinese, Bakery, Pizza, Mediterranean\u201d\n- Dinner: Club Tokyo - Best Western Skycity Hotel, Colorado Springs (Colorado), cost: $64, cuisines: \u201cTea, Bakery, Mediterranean, Fast Food\u201d\n- Accommodation: Large sunny park slope apartment, Colorado Springs (Colorado), cost: $82, room type: Entire home/apt, house rules: No smoking & No parties & No pets, minimum nights: 1, maximum occupancy: 3\n\nTotal cost for Day 5 = ($263 + $97 + $64) * 2 + $82 = $934\n\nDay 6: Colorado Springs (Colorado)\n- Transportation: -\n- Breakfast: Raglan Road Irish Pub and Restaurant, Colorado Springs (Colorado), cost: $97, cuisines: \u201cChinese, Bakery, Pizza, Mediterranean\u201d\n- Attraction: Cheyenne Mountain Zoo, Colorado Springs (Colorado)\n- Lunch: GoGourmet, Colorado Springs (Colorado), cost: $66, cuisines: \u201cDesserts, Bakery, Fast Food, Indian, Seafood\u201d\n- Dinner: South Cafe, Colorado Springs (Colorado), cost: $36, cuisines: \u201cDesserts, French, BBQ, Fast Food, Mediterranean\u201d\n- Accommodation: Large sunny park slope apartment, Colorado Springs (Colorado), cost: $82, room type: Entire home/apt, house rules: No smoking & No parties & No pets, minimum nights: 1, maximum occupancy: 3\n\nTotal cost for Day 6 = ($97 + $66 + $36) * 2 + $82 = $578\n\nDay 7: Colorado Springs to Santa Ana\n- Transportation: Taxi, from Colorado Springs to Santa Ana, duration: 15 hours 52 mins, distance: 1,744 km, cost: $1,744\n- Breakfast: -\n- Attraction: -\n- Lunch: -\n- Dinner: -\n- Accommodation: -\n\nTotal cost for Day 7 = $1,744 * 2 = $3,488\n\nTotal cost across all days = $2,694 + $790 + $749 + $399 + $934 + $578 + $3,488 = $9,632\n\nUnfortunately, the total cost exceeds the specified budget of $7,700. To adjust the plan to fit within the budget, we would need to reconsider the transportation options, dining choices, and accommodations. However, since self-driving is not an option and flights are not available, the taxi costs are fixed. Therefore, we would need to reduce costs in dining and accommodations or reconsider the feasibility of the trip given the constraints.", "gpt-4-1106-preview_direct_sole-planning_parsed_results": [{"day": 1, "current_city": "from Santa Ana to Durango", "transportation": "Taxi, from Santa Ana to Durango, duration: 11 hours 55 mins, distance: 1,245 km", "breakfast": "-", "attraction": "-", "lunch": "-", "dinner": "Samurai Japanese Cuisine & Sushi Bar, Durango", "accommodation": "Luxury in Best Location, Durango"}, {"day": 2, "current_city": "Durango", "transportation": "-", "breakfast": "Samurai Japanese Cuisine & Sushi Bar, Durango", "attraction": "Durango & Silverton Narrow Gauge Railroad, Durango", "lunch": "Dub's High on the Hog, Durango", "dinner": "The Mashal, Durango", "accommodation": "Luxury in Best Location, Durango"}, {"day": 3, "current_city": "from Durango to Alamosa", "transportation": "Taxi, from Durango to Alamosa, duration: 2 hours 52 mins, distance: 240 km", "breakfast": "-", "attraction": "San Luis Valley Museum | Alamosa, Alamosa", "lunch": "Cafe LazyMojo, Alamosa", "dinner": "The Diet Kitchen, Alamosa", "accommodation": "Comfortable studio suite in midtown Manhattan, Alamosa"}, {"day": 4, "current_city": "Alamosa", "transportation": "-", "breakfast": "Cafe LazyMojo, Alamosa", "attraction": "Rio Grande Farm Park, Alamosa", "lunch": "Emperor's Lounge - The Taj Mahal Hotel, Alamosa", "dinner": "Mehak Restaurant, Alamosa", "accommodation": "Comfortable studio suite in midtown Manhattan, Alamosa"}, {"day": 5, "current_city": "from Alamosa to Colorado Springs", "transportation": "Taxi, from Alamosa to Colorado Springs, duration: 2 hours 36 mins, distance: 263 km", "breakfast": "-", "attraction": "Garden of the Gods, Colorado Springs", "lunch": "Raglan Road Irish Pub and Restaurant, Colorado Springs", "dinner": "Club Tokyo - Best Western Skycity Hotel, Colorado Springs", "accommodation": "Large sunny park slope apartment, Colorado Springs"}, {"day": 6, "current_city": "Colorado Springs", "transportation": "-", "breakfast": "Raglan Road Irish Pub and Restaurant, Colorado Springs", "attraction": "Cheyenne Mountain Zoo, Colorado Springs", "lunch": "GoGourmet, Colorado Springs", "dinner": "South Cafe, Colorado Springs", "accommodation": "Large sunny park slope apartment, Colorado Springs"}, {"day": 7, "current_city": "from Colorado Springs to Santa Ana", "transportation": "Taxi, from Colorado Springs to Santa Ana, duration: 15 hours 52 mins, distance: 1,744 km", "breakfast": "-", "attraction": "-", "lunch": "-", "dinner": "-", "accommodation": "-"}]}]