[{"gpt-4-1106-preview_direct_sole-planning_results": "Travel Plan:\n\nDays: 1,\nCurrent City: from Minneapolis to Nashville (Tennessee),\nTransportation: Self-driving, from Minneapolis to Nashville, duration: 12 hours 45 mins, distance: 1,420 km, cost: 71\nBreakfast: -,\nAttraction: -,\nLunch: -,\nDinner: Bangkok 1, Nashville (Tennessee), cost: 44, cuisines: \u201cCafe, Seafood\u201d\nAccommodation: Huge 2 Bedroom, Great Location, Express Metro, Nashville (Tennessee), cost: 745, room type: Entire home/apt, house rules: No smoking & No children under 10 & No pets, minimum nights: 4, maximum occupancy: 4\n\nNumber of people = 2\nTotal cost = 71 * 2 + 44 * 2 + 745 = 975\nAccommodation minimum nights: 1/4\n\nDays: 2,\nCurrent City: Nashville (Tennessee),\nTransportation: -,\nBreakfast: Bablu Fast Food, Nashville (Tennessee), cost: 13, cuisines: \u201cDesserts, Pizza, Mexican, BBQ, Fast Food\u201d\nAttraction: Country Music Hall of Fame and Museum, Nashville (Tennessee); Nashville Zoo at Grassmere, Nashville (Tennessee);,\nLunch: Full Dabba, Nashville (Tennessee), cost: 77, cuisines: \u201cPizza, Mexican, Fast Food, Cafe, American\u201d\nDinner: Twigly, Nashville (Tennessee), cost: 14, cuisines: \u201cPizza, French, Fast Food, Chinese, Seafood\u201d\nAccommodation: Huge 2 Bedroom, Great Location, Express Metro, Nashville (Tennessee), cost: 745, room type: Entire home/apt, house rules: No smoking & No children under 10 & No pets, minimum nights: 4, maximum occupancy: 4\n\nNumber of people = 2\nTotal cost = (13 + 77 + 14) * 2 + 745 = 939\nAccommodation minimum nights: 2/4\n\nDays: 3,\nCurrent City: from Nashville (Tennessee) to Knoxville (Tennessee),\nTransportation: Self-driving, from Nashville to Knoxville, duration: 2 hours 42 mins, distance: 290 km, cost: 14\nBreakfast: -,\nAttraction: World's Fair Park, Knoxville (Tennessee); Knoxville Museum of Art, Knoxville (Tennessee);,\nLunch: Cafe Arabelle, Knoxville (Tennessee), cost: 29, cuisines: \u201cFrench, BBQ, Desserts, Seafood\u201d\nDinner: Les 3 Brasseurs, Knoxville (Tennessee), cost: 24, cuisines: \u201cDesserts, Pizza, Italian, Cafe, Indian\u201d\nAccommodation: Cozy Private Room in Chinatown/ Lower East Side, Knoxville (Tennessee), cost: 132, room type: Private room, house rules: No pets & No visitors, minimum nights: 7, maximum occupancy: 2\n\nNumber of people = 2\nTotal cost = 14 * 2 + (29 + 24) * 2 + 132 = 266\nAccommodation minimum nights: 1/7\n\nDays: 4,\nCurrent City: Knoxville (Tennessee),\nTransportation: -,\nBreakfast: Sky On 57, Knoxville (Tennessee), cost: 150, cuisines: \u201cTea, Cafe, Pizza, Chinese, Seafood\u201d\nAttraction: Sunsphere, Knoxville (Tennessee); Ijams Nature Center, Knoxville (Tennessee);,\nLunch: Cafe El Chico, Knoxville (Tennessee), cost: 67, cuisines: \u201cTea, French, Indian, Seafood\u201d\nDinner: TcozY, Knoxville (Tennessee), cost: 85, cuisines: \u201cTea, Pizza, Mexican, Fast Food, Cafe\u201d\nAccommodation: Cozy Private Room in Chinatown/ Lower East Side, Knoxville (Tennessee), cost: 132, room type: Private room, house rules: No pets & No visitors, minimum nights: 7, maximum occupancy: 2\n\nNumber of people = 2\nTotal cost = (150 + 67 + 85) * 2 + 132 = 732\nAccommodation minimum nights: 2/7\n\nDays: 5,\nCurrent City: from Knoxville (Tennessee) to Minneapolis,\nTransportation: Self-driving, from Knoxville to Minneapolis, duration: 13 hours 58 mins, distance: 1,529 km, cost: 76\nBreakfast: -,\nAttraction: -,\nLunch: -,\nDinner: -,\nAccommodation: -\n\nNumber of people = 2\nTotal cost = 76 * 2 = 152\n\nTotal cost across all days = 975 + 939 + 266 + 732 + 152 = 3,064\n\nNote: The total cost exceeds the budget of $2,000. Adjustments are needed to meet the budget constraint. Possible adjustments include choosing less expensive meals or accommodations. However, given the constraints and the provided data, it is challenging to create a plan that fits the budget while also meeting all requirements, especially considering the high cost of accommodations and the long distances between cities.", "gpt-4-1106-preview_direct_sole-planning_parsed_results": [{"day": 1, "current_city": "from Minneapolis to Nashville", "transportation": "Self-driving, from Minneapolis to Nashville, duration: 12 hours 45 mins, distance: 1,420 km", "breakfast": "-", "attraction": "-", "lunch": "-", "dinner": "Bangkok 1, Nashville", "accommodation": "Huge 2 Bedroom, Great Location, Express Metro, Nashville"}, {"day": 2, "current_city": "Nashville", "transportation": "-", "breakfast": "Bablu Fast Food, Nashville", "attraction": "Country Music Hall of Fame and Museum, Nashville;Nashville Zoo at Grassmere, Nashville;", "lunch": "Full Dabba, Nashville", "dinner": "Twigly, Nashville", "accommodation": "Huge 2 Bedroom, Great Location, Express Metro, Nashville"}, {"day": 3, "current_city": "from Nashville to Knoxville", "transportation": "Self-driving, from Nashville to Knoxville, duration: 2 hours 42 mins, distance: 290 km", "breakfast": "-", "attraction": "World's Fair Park, Knoxville;Knoxville Museum of Art, Knoxville;", "lunch": "Cafe Arabelle, Knoxville", "dinner": "Les 3 Brasseurs, Knoxville", "accommodation": "Cozy Private Room in Chinatown/ Lower East Side, Knoxville"}, {"day": 4, "current_city": "Knoxville", "transportation": "-", "breakfast": "Sky On 57, Knoxville", "attraction": "Sunsphere, Knoxville;Ijams Nature Center, Knoxville;", "lunch": "Cafe El Chico, Knoxville", "dinner": "TcozY, Knoxville", "accommodation": "Cozy Private Room in Chinatown/ Lower East Side, Knoxville"}, {"day": 5, "current_city": "from Knoxville to Minneapolis", "transportation": "Self-driving, from Knoxville to Minneapolis, duration: 13 hours 58 mins, distance: 1,529 km", "breakfast": "-", "attraction": "-", "lunch": "-", "dinner": "-", "accommodation": "-"}]}]