[{"gpt-4-1106-preview_direct_sole-planning_results": "Travel Plan:\n\nDay 1: March 23, 2022\nCurrent City: from Washington to Buffalo\nTransportation: Flight Number: F3791094, from Washington to Buffalo, Departure Time: 10:24, Arrival Time: 11:53\nBreakfast: -\nAttraction: The Buffalo Zoo, Buffalo\nLunch: Shokitini, Buffalo (Cuisines: Tea, Cafe, Pizza, Mexican, Chinese, Seafood)\nAttraction: Buffalo and Erie County Botanical Gardens, Buffalo\nDinner: Tibby's New Orleans Kitchen, Buffalo (Cuisines: Seafood, Indian, BBQ, Italian)\nAccommodation: Williamsburg Gem: Sleep up to 5, Buffalo (Entire home/apt, accommodates 4, so booking 2 units)\n\nDay 2: March 24, 2022\nCurrent City: Buffalo\nTransportation: -\nBreakfast: Punjab Grill, Buffalo (Cuisines: Bakery, BBQ, Desserts, Seafood)\nAttraction: Buffalo AKG Art Museum, Buffalo\nLunch: The Zuree Urban Kitchen, Buffalo (Cuisines: Fast Food, Seafood, Italian)\nAttraction: Canalside, Buffalo\nDinner: Big Fish Eatery, Buffalo (Cuisine: Bakery, BBQ)\nAccommodation: Williamsburg Gem: Sleep up to 5, Buffalo (Entire home/apt, accommodates 4, so booking 2 units)\n\nDay 3: March 25, 2022\nCurrent City: from Buffalo to New York\nTransportation: Flight Number: F3646103, from Buffalo to New York, Departure Time: 12:02, Arrival Time: 13:19\nBreakfast: -\nAttraction: Empire State Building, New York\nLunch: Seasons 52 Fresh Grill, New York (Cuisines: Seafood, Indian, Desserts, Italian)\nAttraction: Times Square, New York\nDinner: Lord of the Drinks Forum, New York (Cuisines: Cafe, Bakery, BBQ, Chinese, Indian)\nAccommodation: Cool Downtown Apartment in Great Location, New York (Entire home/apt, accommodates 7)\n\nDay 4: March 26, 2022\nCurrent City: New York\nTransportation: -\nBreakfast: Gurgaon Hights, New York (Cuisines: Cafe, American, Indian, Fast Food)\nAttraction: Statue of Liberty, New York\nLunch: Baltazar, New York (Cuisines: Tea, Fast Food, Bakery, Seafood)\nAttraction: Central Park, New York\nDinner: 736 A.D., New York (Cuisines: Desserts, Bakery, Fast Food, American, Mediterranean)\nAccommodation: Cool Downtown Apartment in Great Location, New York (Entire home/apt, accommodates 7)\n\nDay 5: March 27, 2022\nCurrent City: from New York to Washington\nTransportation: Flight Number: F3661892, from New York to Washington, Departure Time: 11:31, Arrival Time: 12:45\nBreakfast: -\nAttraction: -\nLunch: -\nDinner: -\nAccommodation: -\n\nNote: The accommodation \"Williamsburg Gem: Sleep up to 5\" in Buffalo is booked for two units to accommodate 7 people. The \"Cool Downtown Apartment in Great Location\" in New York accommodates 7 people, so only one unit is needed. The restaurants and attractions were chosen based on the cuisines preference and the availability of attractions in the provided data. Breakfast on travel days is not included due to early activities; it is assumed the group will eat at the airport or bring their own. The budget was monitored to ensure it did not exceed $9,100, considering the cost of flights, accommodations, and estimated meal costs based on the average cost provided for restaurants.", "gpt-4-1106-preview_direct_sole-planning_parsed_results": [{"day": 1, "current_city": "from Washington to Buffalo", "transportation": "Flight Number: F3791094, from Washington to Buffalo, Departure Time: 10:24, Arrival Time: 11:53", "breakfast": "-", "attraction": "The Buffalo Zoo, Buffalo;Buffalo and Erie County Botanical Gardens, Buffalo;", "lunch": "Shokitini, Buffalo", "dinner": "Tibby's New Orleans Kitchen, Buffalo", "accommodation": "Williamsburg Gem: Sleep up to 5, Buffalo"}, {"day": 2, "current_city": "Buffalo", "transportation": "-", "breakfast": "Punjab Grill, Buffalo", "attraction": "Buffalo AKG Art Museum, Buffalo;Canalside, Buffalo;", "lunch": "The Zuree Urban Kitchen, Buffalo", "dinner": "Big Fish Eatery, Buffalo", "accommodation": "Williamsburg Gem: Sleep up to 5, Buffalo"}, {"day": 3, "current_city": "from Buffalo to New York", "transportation": "Flight Number: F3646103, from Buffalo to New York, Departure Time: 12:02, Arrival Time: 13:19", "breakfast": "-", "attraction": "Empire State Building, New York;Times Square, New York;", "lunch": "Seasons 52 Fresh Grill, New York", "dinner": "Lord of the Drinks Forum, New York", "accommodation": "Cool Downtown Apartment in Great Location, New York"}, {"day": 4, "current_city": "New York", "transportation": "-", "breakfast": "Gurgaon Hights, New York", "attraction": "Statue of Liberty, New York;Central Park, New York;", "lunch": "Baltazar, New York", "dinner": "736 A.D., New York", "accommodation": "Cool Downtown Apartment in Great Location, New York"}, {"day": 5, "current_city": "from New York to Washington", "transportation": "Flight Number: F3661892, from New York to Washington, Departure Time: 11:31, Arrival Time: 12:45", "breakfast": "-", "attraction": "-", "lunch": "-", "dinner": "-", "accommodation": "-"}]}]