[{"gpt-4-1106-preview_direct_sole-planning_results": "Travel Plan:\nDay 1:\nCurrent City: from Pittsburgh to Baltimore\nTransportation: Flight Number: F3969954, from Pittsburgh to Baltimore, Departure Time: 16:51, Arrival Time: 17:49\nBreakfast: -\nLunch: -\nDinner: Los Pablos, Baltimore\nAccommodation: Contemporary Home Away from Home, Entire house, Baltimore\n\nDay 2:\nCurrent City: Baltimore\nTransportation: -\nBreakfast: Mr. Dunderbak's Biergarten and Marketplatz, Baltimore\nAttraction: National Aquarium, Baltimore; The Walters Art Museum, Baltimore.\nLunch: The Thai Bowl, Baltimore\nDinner: Salt, Baltimore\nAccommodation: Contemporary Home Away from Home, Entire house, Baltimore\n\nDay 3:\nCurrent City: from Baltimore to Pittsburgh\nTransportation: Flight Number: F3994096, from Baltimore to Pittsburgh, Departure Time: 21:45, Arrival Time: 22:44\nBreakfast: Tresind - Nassima Royal Hotel, Baltimore\nAttraction: Fort McHenry National Monument and Historic Shrine, Baltimore.\nLunch: Three Dots & A Dash, Baltimore\nDinner: -\nAccommodation: -", "gpt-4-1106-preview_direct_sole-planning_parsed_results": [{"day": 1, "current_city": "from Pittsburgh to Baltimore", "transportation": "Flight Number: F3969954, from Pittsburgh to Baltimore, Departure Time: 16:51, Arrival Time: 17:49", "breakfast": "-", "attraction": "-", "lunch": "-", "dinner": "Los Pablos, Baltimore", "accommodation": "Contemporary Home Away from Home, Baltimore"}, {"day": 2, "current_city": "Baltimore", "transportation": "-", "breakfast": "Mr. Dunderbak's Biergarten and Marketplatz, Baltimore", "attraction": "National Aquarium, Baltimore;The Walters Art Museum, Baltimore;", "lunch": "The Thai Bowl, Baltimore", "dinner": "Salt, Baltimore", "accommodation": "Contemporary Home Away from Home, Baltimore"}, {"day": 3, "current_city": "from Baltimore to Pittsburgh", "transportation": "Flight Number: F3994096, from Baltimore to Pittsburgh, Departure Time: 21:45, Arrival Time: 22:44", "breakfast": "Tresind - Nassima Royal Hotel, Baltimore", "attraction": "Fort McHenry National Monument and Historic Shrine, Baltimore;", "lunch": "Three Dots & A Dash, Baltimore", "dinner": "-", "accommodation": "-"}]}]