[{"gpt-4-1106-preview_direct_sole-planning_results": "Day 1: March 3, 2022\nCurrent City: from Killeen to Dallas\nTransportation: Flight Number: F3592775, from Killeen to Dallas, Departure Time: 16:32, Arrival Time: 17:33\nDinner: Coconuts Fish Cafe, Dallas\nAccommodation: 1BR, elevator, kitchen, doorman!, Dallas\n\nDay 2: March 4, 2022\nCurrent City: Dallas\nTransportation: -\nBreakfast: Cafe Gatherings, Dallas\nAttraction: The Dallas World Aquarium, Dallas\nLunch: 1918 Bistro & Grill, Dallas\nAttraction: The Sixth Floor Museum at Dealey Plaza, Dallas\nDinner: Yanki Sizzlers, Dallas\nAccommodation: 1BR, elevator, kitchen, doorman!, Dallas\n\nDay 3: March 5, 2022\nCurrent City: from Dallas to El Paso\nTransportation: Flight Number: F3602430, from Dallas to El Paso, Departure Time: 13:36, Arrival Time: 14:17\nLunch: Los Beto's, El Paso\nAttraction: El Paso Zoo and Botanical Gardens, El Paso\nDinner: Ceviche Tapas Bar & Restaurant, El Paso\nAccommodation: Upper West / Morningside Heights Apt, Near Subway, El Paso\n\nDay 4: March 6, 2022\nCurrent City: El Paso\nTransportation: -\nBreakfast: The Garden Cafe - The Fern, El Paso\nAttraction: Franklin Mountains State Park, El Paso\nLunch: Onesta, El Paso\nAttraction: El Paso Museum of Art, El Paso\nDinner: Downtown Kitchen & Bar - Courtyard by Marriott, El Paso\nAccommodation: Upper West / Morningside Heights Apt, Near Subway, El Paso\n\nDay 5: March 7, 2022\nCurrent City: from El Paso to Killeen\nTransportation: Self-driving, from El Paso to Killeen, duration: 8 hours 29 mins, cost: 46\nBreakfast: Knight Rider, El Paso\nAttraction: Chamizal National Memorial, El Paso\nLunch: Panther Restaurant, El Paso\nDinner: -\nAccommodation: -", "gpt-4-1106-preview_direct_sole-planning_parsed_results": [{"day": 1, "current_city": "from Killeen to Dallas", "transportation": "Flight Number: F3592775, from Killeen to Dallas, Departure Time: 16:32, Arrival Time: 17:33", "breakfast": "-", "attraction": "-", "lunch": "-", "dinner": "Coconuts Fish Cafe, Dallas", "accommodation": "1BR, elevator, kitchen, doorman!, Dallas"}, {"day": 2, "current_city": "Dallas", "transportation": "-", "breakfast": "Cafe Gatherings, Dallas", "attraction": "The Dallas World Aquarium, Dallas;The Sixth Floor Museum at Dealey Plaza, Dallas;", "lunch": "1918 Bistro & Grill, Dallas", "dinner": "Yanki Sizzlers, Dallas", "accommodation": "1BR, elevator, kitchen, doorman!, Dallas"}, {"day": 3, "current_city": "from Dallas to El Paso", "transportation": "Flight Number: F3602430, from Dallas to El Paso, Departure Time: 13:36, Arrival Time: 14:17", "breakfast": "-", "attraction": "El Paso Zoo and Botanical Gardens, El Paso;", "lunch": "Los Beto's, El Paso", "dinner": "Ceviche Tapas Bar & Restaurant, El Paso", "accommodation": "Upper West / Morningside Heights Apt, Near Subway, El Paso"}, {"day": 4, "current_city": "El Paso", "transportation": "-", "breakfast": "The Garden Cafe - The Fern, El Paso", "attraction": "Franklin Mountains State Park, El Paso;El Paso Museum of Art, El Paso;", "lunch": "Onesta, El Paso", "dinner": "Downtown Kitchen & Bar - Courtyard by Marriott, El Paso", "accommodation": "Upper West / Morningside Heights Apt, Near Subway, El Paso"}, {"day": 5, "current_city": "from El Paso to Killeen", "transportation": "Self-driving, from El Paso to Killeen, duration: 8 hours 29 mins, Cost: 46", "breakfast": "Knight Rider, El Paso", "attraction": "Chamizal National Memorial, El Paso;", "lunch": "Panther Restaurant, El Paso", "dinner": "-", "accommodation": "-"}]}]