[{"gpt-4-1106-preview_direct_sole-planning_results": "Travel Plan:\n\nDay 1:\nCurrent City: from Cincinnati to Philadelphia\nTransportation: Flight Number: F3794475, from Cincinnati to Philadelphia, Departure Time: 07:44, Arrival Time: 09:08\nBreakfast: -\nAttraction: The Franklin Institute, Philadelphia\nLunch: Hong Kong Cafe, Philadelphia\nDinner: Red Ginger Sushi, Grill & Bar, Philadelphia\nAccommodation: Industrial Loft Living in NYC, Philadelphia\n\nDay 2:\nCurrent City: Philadelphia\nTransportation: -\nBreakfast: Marukame Udon, Philadelphia\nAttraction: Philadelphia's Magic Gardens, Philadelphia; Liberty Bell, Philadelphia\nLunch: Red Mesa Cantina, Philadelphia\nDinner: The Moon Under Water, Philadelphia\nAccommodation: Industrial Loft Living in NYC, Philadelphia\n\nDay 3:\nCurrent City: from Philadelphia to Cincinnati\nTransportation: Flight Number: F3793489, from Philadelphia to Cincinnati, Departure Time: 10:37, Arrival Time: 12:28\nBreakfast: -\nAttraction: Independence National Historical Park, Philadelphia\nLunch: Pind Balluchi, Philadelphia\nDinner: -\nAccommodation: -\n\nNote: The accommodation \"Industrial Loft Living in NYC\" is listed under Philadelphia accommodations and is assumed to be a naming error. It is selected based on the requirement for a private room and allowance for children under 10. Breakfast on Day 1 and Day 3 is not planned due to early flight times, and dinner on Day 3 is not planned due to the return to Cincinnati. The budget is considered in the selection of flights and accommodation, but specific costs for meals and attractions are not provided and should be managed within the remaining budget.", "gpt-4-1106-preview_direct_sole-planning_parsed_results": [{"days": 1, "current_city": "from Cincinnati to Philadelphia", "transportation": "Flight Number: F3794475, from Cincinnati to Philadelphia, Departure Time: 07:44, Arrival Time: 09:08", "breakfast": "-", "attraction": "The Franklin Institute, Philadelphia;", "lunch": "Hong Kong Cafe, Philadelphia", "dinner": "Red Ginger Sushi, Grill & Bar, Philadelphia", "accommodation": "Industrial Loft Living in NYC, Philadelphia"}, {"days": 2, "current_city": "Philadelphia", "transportation": "-", "breakfast": "Marukame Udon, Philadelphia", "attraction": "Philadelphia's Magic Gardens, Philadelphia;Liberty Bell, Philadelphia;", "lunch": "Red Mesa Cantina, Philadelphia", "dinner": "The Moon Under Water, Philadelphia", "accommodation": "Industrial Loft Living in NYC, Philadelphia"}, {"days": 3, "current_city": "from Philadelphia to Cincinnati", "transportation": "Flight Number: F3793489, from Philadelphia to Cincinnati, Departure Time: 10:37, Arrival Time: 12:28", "breakfast": "-", "attraction": "Independence National Historical Park, Philadelphia;", "lunch": "Pind Balluchi, Philadelphia", "dinner": "-", "accommodation": "-"}]}]