[{"gpt-4-1106-preview_direct_sole-planning_results": "Travel Plan:\n\nDay 1: March 23, 2022\nCurrent City: from St. Louis to Philadelphia\nTransportation: Flight Number: F3787538, from St. Louis to Philadelphia, Departure Time: 05:26, Arrival Time: 08:29\nBreakfast: -\nAttraction: The Franklin Institute, Philadelphia\nLunch: Red Ginger Sushi, Grill & Bar, Philadelphia (Indian cuisine)\nDinner: Red Mesa Cantina, Philadelphia (American cuisine)\nAccommodation: Industrial Loft Living in NYC, Philadelphia (Price: $178.00)\n\nDay 2: March 24, 2022\nCurrent City: Philadelphia\nTransportation: -\nBreakfast: Hong Kong Cafe, Philadelphia\nAttraction: Liberty Bell, Philadelphia; Independence National Historical Park, Philadelphia\nLunch: Marukame Udon, Philadelphia (Indian cuisine)\nDinner: The Moon Under Water, Philadelphia (American cuisine)\nAccommodation: Industrial Loft Living in NYC, Philadelphia (Price: $178.00)\n\nDay 3: March 25, 2022\nCurrent City: from Philadelphia to Harrisburg\nTransportation: Flight Number: F3732413, from Philadelphia to Harrisburg, Departure Time: 11:17, Arrival Time: 12:01\nBreakfast: -\nAttraction: The National Civil War Museum, Harrisburg\nLunch: Viva! Argentine Cuisine, Harrisburg (American cuisine)\nDinner: Spiral - Sofitel Philippine Plaza Manila, Harrisburg (Indian cuisine)\nAccommodation: Modern 1 Bedroom Luxury Apartment in Dumbo, Harrisburg (Price: $449.00)\n\nDay 4: March 26, 2022\nCurrent City: Harrisburg\nTransportation: -\nBreakfast: Cakes & More, Harrisburg\nAttraction: The State Museum of Pennsylvania, Harrisburg; Fort Hunter Mansion and Park, Harrisburg\nLunch: Square - Sayaji Hotel, Harrisburg (American cuisine)\nDinner: Masala Fusion, Harrisburg (Indian cuisine)\nAccommodation: Modern 1 Bedroom Luxury Apartment in Dumbo, Harrisburg (Price: $449.00)\n\nDay 5: March 27, 2022\nCurrent City: from Harrisburg to State College\nTransportation: Self-driving, duration: 1 hour 31 mins, distance: 139 km, cost: $6\nBreakfast: -\nAttraction: The Arboretum at Penn State, State College\nLunch: Los Agaves, State College (American cuisine)\nDinner: Qureshi's Kabab Corner, State College (Indian cuisine)\nAccommodation: Beautiful, Newly Furnished, Luxury, Grand Central, State College (Price: $210.00)\n\nDay 6: March 28, 2022\nCurrent City: State College\nTransportation: -\nBreakfast: Kawa Sushi, State College\nAttraction: Discovery Space of Central Pennsylvania, State College; Palmer Museum of Art, State College\nLunch: Amici Cafe, State College (American cuisine)\nDinner: The Chocolate Heaven, State College (Indian cuisine)\nAccommodation: Beautiful, Newly Furnished, Luxury, Grand Central, State College (Price: $210.00)\n\nDay 7: March 29, 2022\nCurrent City: from State College to St. Louis\nTransportation: Self-driving, duration: 11 hours 18 mins, distance: 1,195 km, cost: $59\nBreakfast: -\nAttraction: -\nLunch: -\nDinner: -\nAccommodation: -\n\nTotal Estimated Costs:\nFlights: $232 (F3787538) + $22 (F3732413) = $254\nAccommodations: $178 x 2 (Philadelphia) + $449 x 2 (Harrisburg) + $210 x 2 (State College) = $1,474\nSelf-driving: $6 (Harrisburg to State College) + $59 (State College to St. Louis) = $65\nTotal: $254 (Flights) + $1,474 (Accommodations) + $65 (Self-driving) = $1,793\n\nRemaining Budget for Meals, Attractions, and Miscellaneous: $7,200 - $1,793 = $5,407\n\nNote: The remaining budget should cover meals, attractions, and any other miscellaneous expenses. The plan includes Indian and American cuisine as requested. Prices for meals and attractions are not provided, so they should be managed within the remaining budget.", "gpt-4-1106-preview_direct_sole-planning_parsed_results": [{"day": 1, "current_city": "from St. Louis to Philadelphia", "transportation": "Flight Number: F3787538, from St. Louis to Philadelphia, Departure Time: 05:26, Arrival Time: 08:29", "breakfast": "-", "attraction": "The Franklin Institute, Philadelphia;", "lunch": "Red Ginger Sushi, Grill & Bar, Philadelphia", "dinner": "Red Mesa Cantina, Philadelphia", "accommodation": "Industrial Loft Living in NYC, Philadelphia"}, {"day": 2, "current_city": "Philadelphia", "transportation": "-", "breakfast": "Hong Kong Cafe, Philadelphia", "attraction": "Liberty Bell, Philadelphia; Independence National Historical Park, Philadelphia;", "lunch": "Marukame Udon, Philadelphia", "dinner": "The Moon Under Water, Philadelphia", "accommodation": "Industrial Loft Living in NYC, Philadelphia"}, {"day": 3, "current_city": "from Philadelphia to Harrisburg", "transportation": "Flight Number: F3732413, from Philadelphia to Harrisburg, Departure Time: 11:17, Arrival Time: 12:01", "breakfast": "-", "attraction": "The National Civil War Museum, Harrisburg;", "lunch": "Viva! Argentine Cuisine, Harrisburg", "dinner": "Spiral - Sofitel Philippine Plaza Manila, Harrisburg", "accommodation": "Modern 1 Bedroom Luxury Apartment in Dumbo, Harrisburg"}, {"day": 4, "current_city": "Harrisburg", "transportation": "-", "breakfast": "Cakes & More, Harrisburg", "attraction": "The State Museum of Pennsylvania, Harrisburg; Fort Hunter Mansion and Park, Harrisburg;", "lunch": "Square - Sayaji Hotel, Harrisburg", "dinner": "Masala Fusion, Harrisburg", "accommodation": "Modern 1 Bedroom Luxury Apartment in Dumbo, Harrisburg"}, {"day": 5, "current_city": "from Harrisburg to State College", "transportation": "Self-driving, duration: 1 hour 31 mins, distance: 139 km, Cost: 6", "breakfast": "-", "attraction": "The Arboretum at Penn State, State College;", "lunch": "Los Agaves, State College", "dinner": "Qureshi's Kabab Corner, State College", "accommodation": "Beautiful, Newly Furnished, Luxury, Grand Central, State College"}, {"day": 6, "current_city": "State College", "transportation": "-", "breakfast": "Kawa Sushi, State College", "attraction": "Discovery Space of Central Pennsylvania, State College; Palmer Museum of Art, State College;", "lunch": "Amici Cafe, State College", "dinner": "The Chocolate Heaven, State College", "accommodation": "Beautiful, Newly Furnished, Luxury, Grand Central, State College"}, {"day": 7, "current_city": "from State College to St. Louis", "transportation": "Self-driving, duration: 11 hours 18 mins, distance: 1,195 km, Cost: 59", "breakfast": "-", "attraction": "-", "lunch": "-", "dinner": "-", "accommodation": "-"}]}]