[{"gpt-4-1106-preview_direct_sole-planning_results": "Travel Plan:\n\nDay 1: March 16, 2022\nCurrent City: from Baton Rouge to Abilene\nTransportation: Self-driving, Duration: 8 hours 50 mins, Distance: 976 km, Cost: $48\nBreakfast: - (Assuming breakfast is had before departure)\nLunch: - (On the road, personal choice)\nDinner: Thai Garden, Abilene (Average Cost: $13 * 2 = $26)\nAccommodation: Apartment minutes from manhattan, Abilene (Price: $295, Pet-friendly: No information provided, assuming pet-friendly)\n\nDay 2: March 17, 2022\nCurrent City: Abilene\nTransportation: -\nBreakfast: Cakes Degree, Abilene (Average Cost: $18 * 2 = $36)\nAttraction: The Grace Museum, Abilene; Frontier Texas!, Abilene.\nLunch: Crispy Crust, Abilene (Average Cost: $54 * 2 = $108)\nDinner: LPK Waterfront, Abilene (Average Cost: $61 * 2 = $122)\nAccommodation: Apartment minutes from manhattan, Abilene (Price: $295, Pet-friendly: No information provided, assuming pet-friendly)\n\nDay 3: March 18, 2022\nCurrent City: from Abilene to Amarillo\nTransportation: Self-driving, Duration: 4 hours 10 mins, Distance: 446 km, Cost: $22\nBreakfast: - (Assuming breakfast is had before departure)\nLunch: - (On the road, personal choice)\nDinner: The Cinnamon Kitchen, Amarillo (Average Cost: $69 * 2 = $138)\nAccommodation: Harlem Humble Abode - 1 bedroom - Cute and Quaint, Amarillo (Price: $409, Pet-friendly: No pets)\n\nDay 4: March 19, 2022\nCurrent City: Amarillo\nTransportation: -\nBreakfast: Wood Box Cafe, Amarillo (Average Cost: $11 * 2 = $22)\nAttraction: Cadillac Ranch, Amarillo; Amarillo Botanical Gardens, Amarillo.\nLunch: Sigree Global Grill, Amarillo (Average Cost: $35 * 2 = $70)\nDinner: Anand Restaurant, Amarillo (Average Cost: $53 * 2 = $106)\nAccommodation: Harlem Humble Abode - 1 bedroom - Cute and Quaint, Amarillo (Price: $409, Pet-friendly: No pets)\n\nDay 5: March 20, 2022\nCurrent City: from Amarillo to Baton Rouge\nTransportation: Self-driving, Duration: 11 hours 42 mins, Distance: 1,270 km, Cost: $63\nBreakfast: - (Assuming breakfast is had before departure)\nLunch: - (On the road, personal choice)\nDinner: - (Assuming arrival back in Baton Rouge after dinner time)\nAccommodation: -\n\nTotal Estimated Cost Breakdown:\nTransportation: $48 (to Abilene) + $22 (to Amarillo) + $63 (back to Baton Rouge) = $133\nAccommodation: $295 (Abilene) * 2 nights + $409 (Amarillo) * 2 nights = $1,408\nMeals: $26 (Dinner Day 1) + $36 (Breakfast Day 2) + $108 (Lunch Day 2) + $122 (Dinner Day 2) + $138 (Dinner Day 3) + $22 (Breakfast Day 4) + $70 (Lunch Day 4) + $106 (Dinner Day 4) = $628\nTotal Estimated Cost: $133 (Transportation) + $1,408 (Accommodation) + $628 (Meals) = $2,169\n\nRemaining Budget: $2,900 - $2,169 = $731\n\nNote: The accommodation selected in Amarillo does not allow pets, but no pet-friendly options with prices were provided. The remaining budget may be used to find a pet-friendly alternative. Prices for attractions were not provided, so they are not included in the cost. The remaining budget can also cover any additional expenses such as attractions, snacks, and unforeseen costs.", "gpt-4-1106-preview_direct_sole-planning_parsed_results": [{"day": 1, "current_city": "from Baton Rouge to Abilene", "transportation": "Self-driving, Duration: 8 hours 50 mins, Distance: 976 km, Cost: 48", "breakfast": "-", "attraction": "-", "lunch": "-", "dinner": "Thai Garden, Abilene", "accommodation": "Apartment minutes from manhattan, Abilene"}, {"day": 2, "current_city": "Abilene", "transportation": "-", "breakfast": "Cakes Degree, Abilene", "attraction": "The Grace Museum, Abilene;Frontier Texas!, Abilene;", "lunch": "Crispy Crust, Abilene", "dinner": "LPK Waterfront, Abilene", "accommodation": "Apartment minutes from manhattan, Abilene"}, {"day": 3, "current_city": "from Abilene to Amarillo", "transportation": "Self-driving, Duration: 4 hours 10 mins, Distance: 446 km, Cost: 22", "breakfast": "-", "attraction": "-", "lunch": "-", "dinner": "The Cinnamon Kitchen, Amarillo", "accommodation": "Harlem Humble Abode - 1 bedroom - Cute and Quaint, Amarillo"}, {"day": 4, "current_city": "Amarillo", "transportation": "-", "breakfast": "Wood Box Cafe, Amarillo", "attraction": "Cadillac Ranch, Amarillo;Amarillo Botanical Gardens, Amarillo;", "lunch": "Sigree Global Grill, Amarillo", "dinner": "Anand Restaurant, Amarillo", "accommodation": "Harlem Humble Abode - 1 bedroom - Cute and Quaint, Amarillo"}, {"day": 5, "current_city": "from Amarillo to Baton Rouge", "transportation": "Self-driving, Duration: 11 hours 42 mins, Distance: 1,270 km, Cost: 63", "breakfast": "-", "attraction": "-", "lunch": "-", "dinner": "-", "accommodation": "-"}]}]