[{"gpt-4-1106-preview_direct_sole-planning_results": "Travel Plan:\nDays: 1,\nCurrent City: from Asheville to Minneapolis,\nTransportation: Self-driving, from Asheville to Minneapolis, duration: 15 hours 47 mins, distance: 1,711 km, cost: 85\nBreakfast: -, \nAttraction: -, \nLunch: -, \nDinner: The Cafe, Minneapolis, cost: 14, cuisines: \u201cIndian, Mediterranean, Desserts, Seafood\u201d\nAccommodation: Light-filled Apartment in great area, close 2 all!, Minneapolis, cost: 343, maximum occupancy: 2, house rules: No visitors, minimum nights: 1\n\nNumber of people = 3\nTotal cost = 85 * 3 + (14 * 3) + 343 = 598\nAccommodation minimum nights: 1/1\n\nDays: 2,\nCurrent City: Minneapolis,\nTransportation: -, \nBreakfast: Monkeypod Kitchen by Merriman, Minneapolis, cost: 50, cuisines: \u201cDesserts, Pizza, Bakery, Fast Food, Indian, Mediterranean\u201d\nAttraction: Minneapolis Sculpture Garden, Minneapolis; Minneapolis Institute of Art, Minneapolis; Mill City Museum, Minneapolis,\nLunch: Court Avenue Brewing Company, Minneapolis, cost: 31, cuisines: \u201cPizza, French, Bakery, BBQ, Seafood\u201d\nDinner: Balbeer's Kitchen & Bar, Minneapolis, cost: 81, cuisines: \u201cTea, Chinese, Bakery\u201d\nAccommodation: ENTIRE PLACE! near Columbia-sleeps up to 8 guests!, Minneapolis, cost: 663, maximum occupancy: 6, house rules: No visitors, minimum nights: 1\n\nNumber of people = 3\nTotal cost = (50 + 31 + 81) * 3 + 663 = 1,008\nAccommodation minimum nights: 1/1\n\nDays: 3,\nCurrent City: Minneapolis to Asheville,\nTransportation: Self-driving, from Minneapolis to Asheville, duration: 15 hours 43 mins, distance: 1,710 km, cost: 85\nBreakfast: -, \nAttraction: -, \nLunch: -, \nDinner: -, \nAccommodation: -\n\nNumber of people = 3\nTotal cost = 85 * 3 = 255\n\nTotal cost across all days = 598 + 1,008 + 255 = 1,861\nCuisines: The prompt specifies Indian, Chinese, Mediterranean, and American, and all of these cuisines have been represented in the restaurants chosen.\n\nNote: Since the group enjoys a variety of cuisines, I have selected restaurants that offer a mix of the specified cuisines. The accommodations chosen allow pets and provide entire rooms, as per the query requirements. The total cost of the travel plan is within the specified budget of $2,300. The transportation method is consistent and does not conflict with any other modes of transportation. The city of Minneapolis is the primary location for meals and attractions, and the accommodations match the final city listed for each day. The travel plan adheres to the specified number of days and visiting city number in the query.", "gpt-4-1106-preview_direct_sole-planning_parsed_results": [{"day": 1, "current_city": "from Asheville to Minneapolis", "transportation": "Self-driving, from Asheville to Minneapolis, duration: 15 hours 47 mins, distance: 1,711 km", "breakfast": "-", "attraction": "-", "lunch": "-", "dinner": "The Cafe, Minneapolis", "accommodation": "Light-filled Apartment in great area, close 2 all!, Minneapolis"}, {"day": 2, "current_city": "Minneapolis", "transportation": "-", "breakfast": "Monkeypod Kitchen by Merriman, Minneapolis", "attraction": "Minneapolis Sculpture Garden, Minneapolis;Minneapolis Institute of Art, Minneapolis;Mill City Museum, Minneapolis;", "lunch": "Court Avenue Brewing Company, Minneapolis", "dinner": "Balbeer's Kitchen & Bar, Minneapolis", "accommodation": "ENTIRE PLACE! near Columbia-sleeps up to 8 guests!, Minneapolis"}, {"day": 3, "current_city": "from Minneapolis to Asheville", "transportation": "Self-driving, from Minneapolis to Asheville, duration: 15 hours 43 mins, distance: 1,710 km", "breakfast": "-", "attraction": "-", "lunch": "-", "dinner": "-", "accommodation": "-"}]}]