[{"gpt-4-1106-preview_direct_sole-planning_results": "Travel Plan:\n\nDay 1: March 23, 2022\nCurrent City: from Missoula to Dallas\nTransportation: Flight Number: F3604254, from Missoula to Dallas, Departure Time: 14:27, Arrival Time: 18:26\nBreakfast: -\nLunch: -\nDinner: Coconuts Fish Cafe, Dallas\nAccommodation: 1BR, elevator, kitchen, doorman!, Dallas\n\nDay 2: March 24, 2022\nCurrent City: Dallas\nTransportation: -\nBreakfast: Cafe Gatherings, Dallas\nAttraction: The Dallas World Aquarium, Dallas; The Sixth Floor Museum at Dealey Plaza, Dallas.\nLunch: 1918 Bistro & Grill, Dallas\nDinner: Yanki Sizzlers, Dallas\nAccommodation: 1BR, elevator, kitchen, doorman!, Dallas\n\nDay 3: March 25, 2022\nCurrent City: from Dallas to Missoula\nTransportation: Flight Number: F3604227, from Dallas to Missoula, Departure Time: 11:28, Arrival Time: 13:48\nBreakfast: Cafe Gatherings, Dallas\nAttraction: Reunion Tower, Dallas.\nLunch: -\nDinner: -\nAccommodation: -", "gpt-4-1106-preview_direct_sole-planning_parsed_results": [{"day": 1, "current_city": "from Missoula to Dallas", "transportation": "Flight Number: F3604254, from Missoula to Dallas, Departure Time: 14:27, Arrival Time: 18:26", "breakfast": "-", "attraction": "-", "lunch": "-", "dinner": "Coconuts Fish Cafe, Dallas", "accommodation": "1BR, elevator, kitchen, doorman!, Dallas"}, {"day": 2, "current_city": "Dallas", "transportation": "-", "breakfast": "Cafe Gatherings, Dallas", "attraction": "The Dallas World Aquarium, Dallas;The Sixth Floor Museum at Dealey Plaza, Dallas;", "lunch": "1918 Bistro & Grill, Dallas", "dinner": "Yanki Sizzlers, Dallas", "accommodation": "1BR, elevator, kitchen, doorman!, Dallas"}, {"day": 3, "current_city": "from Dallas to Missoula", "transportation": "Flight Number: F3604227, from Dallas to Missoula, Departure Time: 11:28, Arrival Time: 13:48", "breakfast": "Cafe Gatherings, Dallas", "attraction": "Reunion Tower, Dallas;", "lunch": "-", "dinner": "-", "accommodation": "-"}]}]