[{"gpt-4-1106-preview_direct_sole-planning_results": "Day 1: March 5, 2022\nCurrent City: from Colorado Springs to Moline\nTransportation: Self-driving, Duration: 12 hours 49 mins, Distance: 1,467 km, Cost: $73\nBreakfast: - (Assuming breakfast in Colorado Springs before departure)\nAttraction: - (Traveling most of the day)\nLunch: - (On the road)\nDinner: Royal Hotel, Moline (Average Cost: $74)\nAccommodation: Sunny duplex near Central Park, Moline (Price: $541, Room Type: Entire home/apt)\n\nDay 2: March 6, 2022\nCurrent City: Moline\nTransportation: -\nBreakfast: Cafe Coffee Day, Moline (Average Cost: $89)\nAttraction: John Deere Pavilion, Moline (Address: 1400 River Dr, Moline, IL 61265, USA)\nLunch: Mummy's Kitchen, Moline (Average Cost: $54)\nDinner: Zoe, Moline (Average Cost: $15)\nAccommodation: Sunny duplex near Central Park, Moline (Price: $541, Room Type: Entire home/apt)\n\nDay 3: March 7, 2022\nCurrent City: from Moline to Rockford\nTransportation: Self-driving, Duration: 2 hours 1 min, Distance: 194 km, Cost: $9\nBreakfast: Lovecrumbs Bakery, Moline (Average Cost: $24)\nAttraction: Sylvan Island, Moline (Address: 1st Ave & 2nd Street, Moline, IL 61265, USA)\nLunch: Royal Hotel, Moline (Average Cost: $74)\nDinner: Coco Bambu, Rockford (Average Cost: $72)\nAccommodation: Park Side Zen Home - Terrace & next to CentralPark, Rockford (Price: $250, Room Type: Entire home/apt)\n\nDay 4: March 8, 2022\nCurrent City: Rockford\nTransportation: -\nBreakfast: Eggspectation - Jaypee Vasant Continental, Rockford (Average Cost: $77)\nAttraction: Anderson Japanese Gardens, Rockford (Address: 318 Spring Creek Rd, Rockford, IL 61107, USA)\nLunch: Flying Mango, Rockford (Average Cost: $20)\nDinner: Cafe Southall, Rockford (Average Cost: $56)\nAccommodation: Park Side Zen Home - Terrace & next to CentralPark, Rockford (Price: $250, Room Type: Entire home/apt)\n\nDay 5: March 9, 2022\nCurrent City: from Rockford to Colorado Springs\nTransportation: Self-driving, Duration: 14 hours 38 mins, Distance: 1,653 km, Cost: $82\nBreakfast: Moets Arabica, Rockford (Average Cost: $43)\nAttraction: - (Traveling most of the day)\nLunch: - (On the road)\nDinner: - (Assuming dinner in Colorado Springs after arrival)\nAccommodation: -\n\nTotal Estimated Costs:\nTransportation: $73 (to Moline) + $9 (to Rockford) + $82 (back to Colorado Springs) = $164\nAccommodation: $541 (Moline, 2 nights) + $250 (Rockford, 2 nights) = $791\nMeals and Attractions: Estimated $300 (for meals not included in accommodation and entry fees for attractions)\nRemaining Budget: $1,900 - $164 (transportation) - $791 (accommodation) - $300 (meals/attractions) = $645\n\nPlease note that the costs for meals and attractions are estimated, and actual expenses may vary. The remaining budget can be used for additional meals, attractions, or unforeseen expenses.", "gpt-4-1106-preview_direct_sole-planning_parsed_results": [{"day": 1, "current_city": "from Colorado Springs to Moline", "transportation": "Self-driving, Duration: 12 hours 49 mins, Distance: 1467 km, Cost: 73", "breakfast": "-", "attraction": "-", "lunch": "-", "dinner": "Royal Hotel, Moline", "accommodation": "Sunny duplex near Central Park, Moline"}, {"day": 2, "current_city": "Moline", "transportation": "-", "breakfast": "Cafe Coffee Day, Moline", "attraction": "John Deere Pavilion, Moline", "lunch": "Mummy's Kitchen, Moline", "dinner": "Zoe, Moline", "accommodation": "Sunny duplex near Central Park, Moline"}, {"day": 3, "current_city": "from Moline to Rockford", "transportation": "Self-driving, Duration: 2 hours 1 min, Distance: 194 km, Cost: 9", "breakfast": "Lovecrumbs Bakery, Moline", "attraction": "Sylvan Island, Moline", "lunch": "Royal Hotel, Moline", "dinner": "Coco Bambu, Rockford", "accommodation": "Park Side Zen Home - Terrace & next to CentralPark, Rockford"}, {"day": 4, "current_city": "Rockford", "transportation": "-", "breakfast": "Eggspectation - Jaypee Vasant Continental, Rockford", "attraction": "Anderson Japanese Gardens, Rockford", "lunch": "Flying Mango, Rockford", "dinner": "Cafe Southall, Rockford", "accommodation": "Park Side Zen Home - Terrace & next to CentralPark, Rockford"}, {"day": 5, "current_city": "from Rockford to Colorado Springs", "transportation": "Self-driving, Duration: 14 hours 38 mins, Distance: 1653 km, Cost: 82", "breakfast": "Moets Arabica, Rockford", "attraction": "-", "lunch": "-", "dinner": "-", "accommodation": "-"}]}]