[{"gpt-4-1106-preview_direct_sole-planning_results": "Travel Plan:\nDay 1:\nCurrent City: from Minneapolis to Seattle\nTransportation: Flight Number: F3526653, from Minneapolis to Seattle, Departure Time: 08:51, Arrival Time: 10:11\nBreakfast: -\nAttraction: Pike Place Market, Seattle\nLunch: Ting's Red Lantern, Seattle\nDinner: Ceviche Tapas Bar & Restaurant, Seattle\nAccommodation: Large quiet private studio in East Harlem, Seattle\n\nDay 2:\nCurrent City: Seattle\nTransportation: -\nBreakfast: Mother Ringlet, Seattle\nAttraction: Space Needle, Seattle; Chihuly Garden and Glass, Seattle.\nLunch: Caf\u6106 Burger BC, Seattle\nDinner: The Godinho's, Seattle\nAccommodation: Large quiet private studio in East Harlem, Seattle\n\nDay 3:\nCurrent City: from Seattle to Minneapolis\nTransportation: Flight Number: F3514340, from Seattle to Minneapolis, Departure Time: 13:45, Arrival Time: 19:01\nBreakfast: Teddy Choco Studio, Seattle\nAttraction: Seattle Aquarium, Seattle.\nLunch: Goli Vada Pav No. 1, Seattle\nDinner: -\nAccommodation: -", "gpt-4-1106-preview_direct_sole-planning_parsed_results": [{"days": 1, "current_city": "from Minneapolis to Seattle", "transportation": "Flight Number: F3526653, from Minneapolis to Seattle, Departure Time: 08:51, Arrival Time: 10:11", "breakfast": "-", "attraction": "Pike Place Market, Seattle;", "lunch": "Ting's Red Lantern, Seattle", "dinner": "Ceviche Tapas Bar & Restaurant, Seattle", "accommodation": "Large quiet private studio in East Harlem, Seattle"}, {"days": 2, "current_city": "Seattle", "transportation": "-", "breakfast": "Mother Ringlet, Seattle", "attraction": "Space Needle, Seattle;Chihuly Garden and Glass, Seattle;", "lunch": "Caf\u00e9 Burger BC, Seattle", "dinner": "The Godinho's, Seattle", "accommodation": "Large quiet private studio in East Harlem, Seattle"}, {"days": 3, "current_city": "from Seattle to Minneapolis", "transportation": "Flight Number: F3514340, from Seattle to Minneapolis, Departure Time: 13:45, Arrival Time: 19:01", "breakfast": "Teddy Choco Studio, Seattle", "attraction": "Seattle Aquarium, Seattle;", "lunch": "Goli Vada Pav No. 1, Seattle", "dinner": "-", "accommodation": "-"}]}]