[{"gpt-4-1106-preview_direct_sole-planning_results": "Day 1: March 15, 2022\nCurrent City: from Philadelphia to Richmond\nTransportation: Flight Number: F3730367, from Philadelphia to Richmond, Departure Time: 14:03, Arrival Time: 15:03\nAccommodation: Cool Summer Vibes UWS Pent House w/ rooftop, Richmond (Price: $498.00, Room Type: Entire home/apt)\n\nDay 2: March 16, 2022\nCurrent City: Richmond\nBreakfast: Guang Zhou Chinese Restaurant, Richmond (Average Cost: $84)\nAttraction: Virginia Museum of Fine Arts, Richmond\nLunch: Sandpiper Restaurant & Lounge, Richmond (Average Cost: $20)\nAttraction: Maymont, Richmond\nDinner: Paradise, Richmond (Average Cost: $80)\nAccommodation: Cool Summer Vibes UWS Pent House w/ rooftop, Richmond\n\nDay 3: March 17, 2022\nCurrent City: from Richmond to Petersburg\nTransportation: Taxi, from Richmond to Petersburg, Duration: 25 mins, Cost: $38\nAccommodation: Charming cozy bedroom in Clinton Hill!, Petersburg (Price: $274.00, Room Type: Private room)\n\nDay 4: March 18, 2022\nCurrent City: Petersburg\nBreakfast: 5 Little Pigs, Petersburg (Average Cost: $46)\nAttraction: Petersburg National Battlefield, Petersburg\nLunch: J's Homestyle Cooking, Petersburg (Average Cost: $63)\nAttraction: Pamplin Historical Park, Petersburg\nDinner: Tea'se Me - Rooftop Tea Boutique, Petersburg (Average Cost: $49)\nAccommodation: Charming cozy bedroom in Clinton Hill!, Petersburg\n\nDay 5: March 19, 2022\nCurrent City: from Petersburg to Charlottesville\nTransportation: Self-driving, from Petersburg to Charlottesville, Duration: 1 hour 30 mins, Cost: $7\nAccommodation: Williamsburg Hidden Gem, Charlottesville (Price: $391.00, Room Type: Entire home/apt)\n\nDay 6: March 20, 2022\nCurrent City: Charlottesville\nBreakfast: Mama's Fish House, Charlottesville (Average Cost: $63)\nAttraction: Monticello, Charlottesville\nLunch: Restaurant Andre, Charlottesville (Average Cost: $250)\nAttraction: Virginia Discovery Museum, Charlottesville\nDinner: Domino's Pizza, Charlottesville (Average Cost: $53)\nAccommodation: Williamsburg Hidden Gem, Charlottesville\n\nDay 7: March 21, 2022\nCurrent City: from Charlottesville to Philadelphia\nTransportation: Self-driving, from Charlottesville to Philadelphia, Duration: 4 hours 24 mins, Cost: $20\n\nTotal Estimated Costs:\nFlights: $170 (Philadelphia to Richmond)\nAccommodations: $498 (Richmond) + $274 (Petersburg) + $391 (Charlottesville) = $1163\nTransportation: $38 (Richmond to Petersburg taxi) + $7 (Petersburg to Charlottesville self-driving) + $20 (Charlottesville to Philadelphia self-driving) = $65\nMeals/Attractions/Incidentals: $1,800 - ($170 + $1163 + $65) = $402 remaining for meals, attractions, and incidentals.\n\nNote: The costs for meals and attractions are average and may vary. The remaining budget should be managed accordingly to cover these expenses. The accommodation prices are for the entire stay in each city. The transportation costs are based on the provided data. Flight numbers and times are specific to the dates provided.", "gpt-4-1106-preview_direct_sole-planning_parsed_results": [{"day": 1, "current_city": "from Philadelphia to Richmond", "transportation": "Flight Number: F3730367, from Philadelphia to Richmond, Departure Time: 14:03, Arrival Time: 15:03", "breakfast": "-", "attraction": "-", "lunch": "-", "dinner": "-", "accommodation": "Cool Summer Vibes UWS Pent House w/ rooftop, Richmond"}, {"day": 2, "current_city": "Richmond", "transportation": "-", "breakfast": "Guang Zhou Chinese Restaurant, Richmond", "attraction": "Virginia Museum of Fine Arts, Richmond;Maymont, Richmond;", "lunch": "Sandpiper Restaurant & Lounge, Richmond", "dinner": "Paradise, Richmond", "accommodation": "Cool Summer Vibes UWS Pent House w/ rooftop, Richmond"}, {"day": 3, "current_city": "from Richmond to Petersburg", "transportation": "Taxi, from Richmond to Petersburg, Duration: 25 mins, Cost: 38", "breakfast": "-", "attraction": "-", "lunch": "-", "dinner": "-", "accommodation": "Charming cozy bedroom in Clinton Hill!, Petersburg"}, {"day": 4, "current_city": "Petersburg", "transportation": "-", "breakfast": "5 Little Pigs, Petersburg", "attraction": "Petersburg National Battlefield, Petersburg;Pamplin Historical Park, Petersburg;", "lunch": "J's Homestyle Cooking, Petersburg", "dinner": "Tea'se Me - Rooftop Tea Boutique, Petersburg", "accommodation": "Charming cozy bedroom in Clinton Hill!, Petersburg"}, {"day": 5, "current_city": "from Petersburg to Charlottesville", "transportation": "Self-driving, from Petersburg to Charlottesville, Duration: 1 hour 30 mins, Cost: 7", "breakfast": "-", "attraction": "-", "lunch": "-", "dinner": "-", "accommodation": "Williamsburg Hidden Gem, Charlottesville"}, {"day": 6, "current_city": "Charlottesville", "transportation": "-", "breakfast": "Mama's Fish House, Charlottesville", "attraction": "Monticello, Charlottesville;Virginia Discovery Museum, Charlottesville;", "lunch": "Restaurant Andre, Charlottesville", "dinner": "Domino's Pizza, Charlottesville", "accommodation": "Williamsburg Hidden Gem, Charlottesville"}, {"day": 7, "current_city": "from Charlottesville to Philadelphia", "transportation": "Self-driving, from Charlottesville to Philadelphia, Duration: 4 hours 24 mins, Cost: 20", "breakfast": "-", "attraction": "-", "lunch": "-", "dinner": "-", "accommodation": "-"}]}]