[{"gpt-4-1106-preview_direct_sole-planning_results": "Travel Plan:\n\nDay 1: March 16, 2022\nCurrent City: from San Jose to Portland\nTransportation: Self-driving, from San Jose to Portland, duration: 10 hours 14 mins, distance: 1,073 km, cost: $53\nBreakfast: -\nAttraction: -\nLunch: -\nDinner: Nacho Mamas Burritos, Portland, cost: $54, cuisines: \u201cChinese, Pizza, Seafood, Italian\u201d\nAccommodation: The Palace of Perhaps (Bushwick / Ridgewood), Portland, cost: $761, maximum occupancy: 1, house rules: No children under 10 & No smoking & Pets allowed, minimum nights: 2\n\nNumber of people = 2\nTotal cost = $53 (transportation) + $54 (dinner) * 2 + $761 (accommodation) = $922\nAccommodation minimum nights: 1/2\n\nDay 2: March 17, 2022\nCurrent City: Portland\nTransportation: -\nBreakfast: The Coffee Bean & Tea Leaf, Portland, cost: $24, cuisines: \u201cTea, Cafe, Desserts\u201d\nAttraction: Lan Su Chinese Garden, Portland; International Rose Test Garden, Portland\nLunch: Cactus Flower Cafe Navarre, Portland, cost: $48, cuisines: \u201cCafe, Italian, BBQ, Fast Food, Chinese\u201d\nDinner: Zizo, Portland, cost: $87, cuisines: \u201cPizza, French, BBQ, Cafe, Mediterranean\u201d\nAccommodation: The Palace of Perhaps (Bushwick / Ridgewood), Portland, cost: $761, maximum occupancy: 1, house rules: No children under 10 & No smoking & Pets allowed, minimum nights: 2\n\nNumber of people = 2\nTotal cost = ($24 + $48 + $87) * 2 + $761 = $1,079\nAccommodation minimum nights: 2/2\n\nDay 3: March 18, 2022\nCurrent City: from Portland to San Jose\nTransportation: Self-driving, from Portland to San Jose, duration: 10 hours 20 mins, distance: 1,074 km, cost: $53\nBreakfast: -\nAttraction: -\nLunch: -\nDinner: -\nAccommodation: -\n\nNumber of people = 2\nTotal cost = $53 * 2 = $106\n\nTotal cost across all days = $922 + $1,079 + $106 = $2,107\n\nUnfortunately, the total cost exceeds the specified budget of $1,000. To adjust the plan within the budget, we may need to consider different accommodation options or reduce meal costs. Here's an adjusted plan:\n\nAdjusted Travel Plan:\n\nDay 1: March 16, 2022\nCurrent City: from San Jose to Portland\nTransportation: Self-driving, from San Jose to Portland, duration: 10 hours 14 mins, distance: 1,073 km, cost: $53\nBreakfast: -\nAttraction: -\nLunch: -\nDinner: Nacho Mamas Burritos, Portland, cost: $54, cuisines: \u201cChinese, Pizza, Seafood, Italian\u201d\nAccommodation: Charming Bushwick Shared Space, Portland, cost: $936, maximum occupancy: 2, house rules: No parties & Pets allowed, minimum nights: 2\n\nNumber of people = 2\nTotal cost = $53 (transportation) + $54 (dinner) * 2 + $936 (accommodation) = $1,097\nAccommodation minimum nights: 1/2\n\nDay 2: March 17, 2022\nCurrent City: Portland\nTransportation: -\nBreakfast: The Coffee Bean & Tea Leaf, Portland, cost: $24, cuisines: \u201cTea, Cafe, Desserts\u201d\nAttraction: Lan Su Chinese Garden, Portland; International Rose Test Garden, Portland\nLunch: Cactus Flower Cafe Navarre, Portland, cost: $48, cuisines: \u201cCafe, Italian, BBQ, Fast Food, Chinese\u201d\nDinner: Zizo, Portland, cost: $87, cuisines: \u201cPizza, French, BBQ, Cafe, Mediterranean\u201d\nAccommodation: Charming Bushwick Shared Space, Portland, cost: $936, maximum occupancy: 2, house rules: No parties & Pets allowed, minimum nights: 2\n\nNumber of people = 2\nTotal cost = ($24 + $48 + $87) * 2 + $936 = $1,254\nAccommodation minimum nights: 2/2\n\nDay 3: March 18, 2022\nCurrent City: from Portland to San Jose\nTransportation: Self-driving, from Portland to San Jose, duration: 10 hours 20 mins, distance: 1,074 km, cost: $53\nBreakfast: -\nAttraction: -\nLunch: -\nDinner: -\nAccommodation: -\n\nNumber of people = 2\nTotal cost = $53 * 2 = $106\n\nTotal cost across all days = $1,097 + $1,254 + $106 = $2,457\n\nThe adjusted plan still exceeds the budget. To fit within the $1,000 budget, we would need to find more affordable dining options and potentially change the accommodation to a less expensive option or shorten the stay. Please note that the budget constraint makes it challenging to include all desired activities and meals.", "gpt-4-1106-preview_direct_sole-planning_parsed_results": [{"day": 1, "current_city": "from San Jose to Portland", "transportation": "Self-driving, from San Jose to Portland, Duration: 10 hours 14 mins, Distance: 1,073 km", "breakfast": "-", "attraction": "Washington Park, Portland", "lunch": "Nacho Mamas Burritos, Portland", "dinner": "Osaka, Portland", "accommodation": "The Palace of Perhaps, Portland"}, {"day": 2, "current_city": "Portland", "transportation": "-", "breakfast": "Cactus Flower Cafe Navarre, Portland", "attraction": "Lan Su Chinese Garden, Portland", "lunch": "Barbeque Nation, Portland", "dinner": "Zizo, Portland", "accommodation": "The Palace of Perhaps, Portland"}, {"day": 3, "current_city": "from Portland to San Jose", "transportation": "Self-driving, from Portland to San Jose, Duration: 10 hours 20 mins, Distance: 1,074 km", "breakfast": "The Coffee Bean & Tea Leaf, Portland", "attraction": "Oregon Zoo, Portland", "lunch": "Mighty Mughlai, Portland", "dinner": "-", "accommodation": "-"}]}]