[{"gpt-4-1106-preview_direct_sole-planning_results": "Travel Plan:\nDay 1:\nCurrent City: from St. Louis to Washington\nTransportation: Flight Number: F3934368, from St. Louis to Washington, Departure Time: 12:42, Arrival Time: 15:38\nBreakfast: -\nAttraction: The Seattle Great Wheel, Washington\nLunch: Los Aztecas, Washington\nDinner: Thaaliwala, Washington\nAccommodation: Stunning 2Bed/2BA + 300sqft deck by the river!, Washington\n\nDay 2:\nCurrent City: Washington\nTransportation: -\nBreakfast: Manna Java World Cafe, Washington\nAttraction: Space Needle, Washington; Chihuly Garden and Glass, Washington.\nLunch: Hemingway's Island Grill, Washington\nDinner: Amaze Dining, Washington\nAccommodation: Stunning 2Bed/2BA + 300sqft deck by the river!, Washington\n\nDay 3:\nCurrent City: from Washington to St. Louis\nTransportation: Flight Number: F3785455, from Washington to St. Louis, Departure Time: 14:49, Arrival Time: 16:09\nBreakfast: Hearken Caf\u00e9, Washington\nAttraction: Discovery Park, Washington.\nLunch: Republic of Chicken, Washington\nDinner: -\nAccommodation: -", "gpt-4-1106-preview_direct_sole-planning_parsed_results": [{"days": 1, "current_city": "from St. Louis to Washington", "transportation": "Flight Number: F3934368, from St. Louis to Washington, Departure Time: 12:42, Arrival Time: 15:38", "breakfast": "-", "attraction": "The Seattle Great Wheel, Washington;", "lunch": "Los Aztecas, Washington", "dinner": "Thaaliwala, Washington", "accommodation": "Stunning 2Bed/2BA + 300sqft deck by the river!, Washington"}, {"days": 2, "current_city": "Washington", "transportation": "-", "breakfast": "Manna Java World Cafe, Washington", "attraction": "Space Needle, Washington;Chihuly Garden and Glass, Washington;", "lunch": "Hemingway's Island Grill, Washington", "dinner": "Amaze Dining, Washington", "accommodation": "Stunning 2Bed/2BA + 300sqft deck by the river!, Washington"}, {"days": 3, "current_city": "from Washington to St. Louis", "transportation": "Flight Number: F3785455, from Washington to St. Louis, Departure Time: 14:49, Arrival Time: 16:09", "breakfast": "Hearken Caf\u00e9, Washington", "attraction": "Discovery Park, Washington;", "lunch": "Republic of Chicken, Washington", "dinner": "-", "accommodation": "-"}]}]