[{"gpt-4-1106-preview_direct_sole-planning_results": "Day 1: March 7, 2022\nCurrent City: from Wichita to Alamosa\nTransportation: Self-driving, Duration: 8 hours 27 mins, Distance: 819 km, Cost: $40\nBreakfast: -\nLunch: -\nDinner: Atlanta Highway Seafood Market, Alamosa\nAccommodation: Comfortable studio suite in midtown Manhattan, Alamosa, Price: $67\n\nDay 2: March 8, 2022\nCurrent City: Alamosa\nTransportation: -\nBreakfast: Riverwalk Cafe, Alamosa\nAttraction: San Luis Valley Museum, Alamosa\nLunch: Viva Hyderabad, Alamosa\nDinner: Coffee to Cocktail Bar - Hyatt Place, Alamosa\nAccommodation: Comfortable studio suite in midtown Manhattan, Alamosa, Price: $67\n\nDay 3: March 9, 2022\nCurrent City: from Alamosa to Grand Junction\nTransportation: Self-driving, Duration: 4 hours 29 mins, Distance: 396 km, Cost: $19\nBreakfast: Cafe LazyMojo, Alamosa\nAttraction: Rio Grande Farm Park, Alamosa\nLunch: Urban Crave Express, Alamosa\nDinner: The Arena, Grand Junction\nAccommodation: NYC Apartment near Central Park!, Grand Junction, Price: $1118\n\nDay 4: March 10, 2022\nCurrent City: Grand Junction\nTransportation: -\nBreakfast: Austin's BBQ and Oyster Bar, Grand Junction\nAttraction: Museum of the West, Museums of Western Colorado, Grand Junction\nLunch: 2 Dog, Grand Junction\nDinner: Shanghai Bar & Lounge - The Bristol Hotel, Grand Junction\nAccommodation: NYC Apartment near Central Park!, Grand Junction, Price: $1118\n\nDay 5: March 11, 2022\nCurrent City: from Grand Junction to Durango\nTransportation: Self-driving, Duration: 3 hours 33 mins, Distance: 269 km, Cost: $13\nBreakfast: Punjab Da Pind, Grand Junction\nAttraction: Eureka! McConnell Science Museum, Grand Junction\nLunch: Baba Chicken Ludhiana Wale, Grand Junction\nDinner: Cha Bar, Durango\nAccommodation: Lux 1BR in the heart of NYC Theater district!, Durango, Price: $81\n\nDay 6: March 12, 2022\nCurrent City: Durango\nTransportation: -\nBreakfast: Samurai Japanese Cuisine & Sushi Bar, Durango\nAttraction: Animas Museum, Durango\nLunch: Dub's High on the Hog, Durango\nDinner: Standard Chicken Point, Durango\nAccommodation: Lux 1BR in the heart of NYC Theater district!, Durango, Price: $81\n\nDay 7: March 13, 2022\nCurrent City: from Durango to Wichita\nTransportation: Self-driving, Duration: 11 hours 15 mins, Distance: 1,078 km, Cost: $53\nBreakfast: Hot & Tasty Chinese Food, Durango\nAttraction: The Powerhouse, Durango\nLunch: Chickenette, Durango\nDinner: -\nAccommodation: -\n\nTotal Estimated Cost: Transportation ($40 + $19 + $13 + $53) + Accommodation ($67 + $67 + $1118 + $1118 + $81 + $81) + Estimated Food and Attractions ($50/day * 7 days) = $125 + $2532 + $350 = $3007\n\nNote: The estimated food and attractions cost is a rough estimate and may vary. The accommodation prices are for one night each, and the total cost is well within the budget of $5,900. The plan does not include specific times for activities or meals, and assumes the traveler will find suitable times based on the operating hours of each establishment.", "gpt-4-1106-preview_direct_sole-planning_parsed_results": [{"day": 1, "current_city": "from Wichita to Alamosa", "transportation": "Self-driving, Duration: 8 hours 27 mins, Distance: 819 km, Cost: 40", "breakfast": "-", "lunch": "-", "dinner": "Atlanta Highway Seafood Market, Alamosa", "accommodation": "Comfortable studio suite in midtown Manhattan, Alamosa"}, {"day": 2, "current_city": "Alamosa", "transportation": "-", "breakfast": "Riverwalk Cafe, Alamosa", "attraction": "San Luis Valley Museum, Alamosa;", "lunch": "Viva Hyderabad, Alamosa", "dinner": "Coffee to Cocktail Bar - Hyatt Place, Alamosa", "accommodation": "Comfortable studio suite in midtown Manhattan, Alamosa"}, {"day": 3, "current_city": "from Alamosa to Grand Junction", "transportation": "Self-driving, Duration: 4 hours 29 mins, Distance: 396 km, Cost: 19", "breakfast": "Cafe LazyMojo, Alamosa", "attraction": "Rio Grande Farm Park, Alamosa;", "lunch": "Urban Crave Express, Alamosa", "dinner": "The Arena, Grand Junction", "accommodation": "NYC Apartment near Central Park!, Grand Junction"}, {"day": 4, "current_city": "Grand Junction", "transportation": "-", "breakfast": "Austin's BBQ and Oyster Bar, Grand Junction", "attraction": "Museum of the West, Museums of Western Colorado, Grand Junction;", "lunch": "2 Dog, Grand Junction", "dinner": "Shanghai Bar & Lounge - The Bristol Hotel, Grand Junction", "accommodation": "NYC Apartment near Central Park!, Grand Junction"}, {"day": 5, "current_city": "from Grand Junction to Durango", "transportation": "Self-driving, Duration: 3 hours 33 mins, Distance: 269 km, Cost: 13", "breakfast": "Punjab Da Pind, Grand Junction", "attraction": "Eureka! McConnell Science Museum, Grand Junction;", "lunch": "Baba Chicken Ludhiana Wale, Grand Junction", "dinner": "Cha Bar, Durango", "accommodation": "Lux 1BR in the heart of NYC Theater district!, Durango"}, {"day": 6, "current_city": "Durango", "transportation": "-", "breakfast": "Samurai Japanese Cuisine & Sushi Bar, Durango", "attraction": "Animas Museum, Durango;", "lunch": "Dub's High on the Hog, Durango", "dinner": "Standard Chicken Point, Durango", "accommodation": "Lux 1BR in the heart of NYC Theater district!, Durango"}, {"day": 7, "current_city": "from Durango to Wichita", "transportation": "Self-driving, Duration: 11 hours 15 mins, Distance: 1,078 km, Cost: 53", "breakfast": "Hot & Tasty Chinese Food, Durango", "attraction": "The Powerhouse, Durango;", "lunch": "Chickenette, Durango", "dinner": "-", "accommodation": "-"}]}]