[{"gpt-4-1106-preview_direct_sole-planning_results": "Travel Plan:\n\nDay 1: March 16, 2022\nCurrent City: from Salt Lake City to Billings\nTransportation: Flight Number: F3829434, from Salt Lake City to Billings, Departure Time: 09:43, Arrival Time: 10:59\nBreakfast: - (Assuming breakfast in Salt Lake City before departure)\nAttraction: Western Heritage Center, Billings\nLunch: Holy Smoke, Billings (Cuisine: Indian, Seafood)\nDinner: Hong Kong Express, Billings (Cuisine: BBQ, Mediterranean, Seafood)\nAccommodation: Great Room! Great Price! \\nCan wait to see you!, Billings (Parties allowed)\n\nDay 2: March 17, 2022\nCurrent City: Billings\nTransportation: -\nBreakfast: New Bengal Sweets, Billings (Cuisine: Tea, Pizza, BBQ, Cafe, Indian)\nAttraction: Pictograph Cave State Park, Billings\nLunch: Tsui Wong, Billings (Cuisine: Desserts, Seafood)\nDinner: Elation, Billings (Cuisine: Fast Food, Bakery, Seafood)\nAccommodation: Great Room! Great Price! \\nCan wait to see you!, Billings (Parties allowed)\n\nDay 3: March 18, 2022\nCurrent City: from Billings to Great Falls\nTransportation: Taxi from Billings to Great Falls, duration: 3 hours 35 mins, cost: $352\nBreakfast: - (Assuming breakfast at the accommodation)\nAttraction: C. M. Russell Museum, Great Falls\nLunch: Hula Grill, Great Falls (Cuisine: Pizza, BBQ, Seafood)\nDinner: SpiceKlub, Great Falls (Cuisine: Indian, Fast Food, Cafe, American)\nAccommodation: Comfy & Sunny Studio Rental, Great Falls (Parties allowed)\n\nDay 4: March 19, 2022\nCurrent City: Great Falls\nTransportation: -\nBreakfast: Flying Pie Pizzaria, Great Falls (Cuisine: Desserts, Bakery, Fast Food, Cafe, Indian, Mediterranean)\nAttraction: The Lewis and Clark Interpretive Center, Great Falls\nLunch: Barbeque Nation, Great Falls (Cuisine: Tea, BBQ, Fast Food)\nDinner: Fork with Stick, Great Falls (Cuisine: Cafe, Bakery, Fast Food)\nAccommodation: Comfy & Sunny Studio Rental, Great Falls (Parties allowed)\n\nDay 5: March 20, 2022\nCurrent City: from Great Falls to Bozeman\nTransportation: Taxi from Great Falls to Bozeman, duration: 2 hours 55 mins, cost: $299\nBreakfast: - (Assuming breakfast at the accommodation)\nAttraction: Museum of the Rockies, Bozeman\nLunch: Zaroob, Bozeman (Cuisine: French, BBQ, Bakery, Indian)\nDinner: Indo Chinese, Bozeman (Cuisine: Chinese, Seafood)\nAccommodation: SPACIOUS STUDIO APT 3 IN PROSPECT LEFFERTS GARDENS, Bozeman (Parties allowed)\n\nDay 6: March 21, 2022\nCurrent City: Bozeman\nTransportation: -\nBreakfast: Saravana Bhavan, Bozeman (Cuisine: American, Desserts)\nAttraction: Gallatin History Museum, Bozeman\nLunch: McGuire's Irish Pub & Brewery, Bozeman (Cuisine: Italian, Desserts)\nDinner: Oh Buoy, Bozeman (Cuisine: Seafood)\nAccommodation: SPACIOUS STUDIO APT 3 IN PROSPECT LEFFERTS GARDENS, Bozeman (Parties allowed)\n\nDay 7: March 22, 2022\nCurrent City: from Bozeman to Salt Lake City\nTransportation: Flight Number: F3500804, from Bozeman to Salt Lake City, Departure Time: 05:57, Arrival Time: 07:03\nBreakfast: - (Assuming breakfast in Bozeman before departure)\nAttraction: - (Assuming the day ends with the arrival in Salt Lake City)\nLunch: -\nDinner: -\nAccommodation: -\n\nPlease note that the accommodation options selected allow for parties, as per the request. The restaurants chosen offer a variety of cuisines including American, Mediterranean, Indian, and Chinese. The transportation is by taxi and flight, as self-driving is not preferred. The total cost of flights and taxis is $1,005, leaving $6,195 for accommodation, meals, and other expenses within the $7,200 budget.", "gpt-4-1106-preview_direct_sole-planning_parsed_results": [{"day": 1, "current_city": "from Salt Lake City to Billings", "transportation": "Flight Number: F3829434, from Salt Lake City to Billings, Departure Time: 09:43, Arrival Time: 10:59", "breakfast": "-", "attraction": "Western Heritage Center, Billings;", "lunch": "Holy Smoke, Billings", "dinner": "Hong Kong Express, Billings", "accommodation": "Great Room! Great Price!, Billings"}, {"day": 2, "current_city": "Billings", "transportation": "-", "breakfast": "New Bengal Sweets, Billings", "attraction": "Pictograph Cave State Park, Billings;", "lunch": "Tsui Wong, Billings", "dinner": "Elation, Billings", "accommodation": "Great Room! Great Price!, Billings"}, {"day": 3, "current_city": "from Billings to Great Falls", "transportation": "Taxi from Billings to Great Falls, Duration: 3 hours 35 mins, Cost: 352", "breakfast": "-", "attraction": "C. M. Russell Museum, Great Falls;", "lunch": "Hula Grill, Great Falls", "dinner": "SpiceKlub, Great Falls", "accommodation": "Comfy & Sunny Studio Rental, Great Falls"}, {"day": 4, "current_city": "Great Falls", "transportation": "-", "breakfast": "Flying Pie Pizzaria, Great Falls", "attraction": "The Lewis and Clark Interpretive Center, Great Falls;", "lunch": "Barbeque Nation, Great Falls", "dinner": "Fork with Stick, Great Falls", "accommodation": "Comfy & Sunny Studio Rental, Great Falls"}, {"day": 5, "current_city": "from Great Falls to Bozeman", "transportation": "Taxi from Great Falls to Bozeman, Duration: 2 hours 55 mins, Cost: 299", "breakfast": "-", "attraction": "Museum of the Rockies, Bozeman;", "lunch": "Zaroob, Bozeman", "dinner": "Indo Chinese, Bozeman", "accommodation": "SPACIOUS STUDIO APT 3 IN PROSPECT LEFFERTS GARDENS, Bozeman"}, {"day": 6, "current_city": "Bozeman", "transportation": "-", "breakfast": "Saravana Bhavan, Bozeman", "attraction": "Gallatin History Museum, Bozeman;", "lunch": "McGuire's Irish Pub & Brewery, Bozeman", "dinner": "Oh Buoy, Bozeman", "accommodation": "SPACIOUS STUDIO APT 3 IN PROSPECT LEFFERTS GARDENS, Bozeman"}, {"day": 7, "current_city": "from Bozeman to Salt Lake City", "transportation": "Flight Number: F3500804, from Bozeman to Salt Lake City, Departure Time: 05:57, Arrival Time: 07:03", "breakfast": "-", "attraction": "-", "lunch": "-", "dinner": "-", "accommodation": "-"}]}]