[{"gpt-4-1106-preview_direct_sole-planning_results": "Travel Plan:\n\nDay 1: March 25, 2022\nCurrent City: from Baton Rouge to Dallas\nTransportation: Flight Number: F3815317, from Baton Rouge to Dallas, Departure Time: 09:48, Arrival Time: 11:29\nBreakfast: - (Assuming breakfast will be had before departure or during the flight)\nAttraction: The Sixth Floor Museum at Dealey Plaza, Dallas\nLunch: Coconuts Fish Cafe, Dallas\nDinner: 1918 Bistro & Grill, Dallas\nAccommodation: Sunny Brooklyn room, Dallas (Smoking is not mentioned as prohibited, and it fits the budget and occupancy requirements)\n\nDay 2: March 26, 2022\nCurrent City: Dallas\nTransportation: -\nBreakfast: Cafe Gatherings, Dallas\nAttraction: The Dallas Arboretum and Botanical Garden, Dallas; Reunion Tower, Dallas\nLunch: Yanki Sizzlers, Dallas\nDinner: L'Opera, Dallas\nAccommodation: Sunny Brooklyn room, Dallas\n\nDay 3: March 27, 2022\nCurrent City: from Dallas to Baton Rouge\nTransportation: Flight Number: F3814165, from Dallas to Baton Rouge, Departure Time: 20:39, Arrival Time: 21:58\nBreakfast: Drifters Cafe, Dallas\nAttraction: Dallas Museum of Art, Dallas\nLunch: Haldiram's, Dallas\nDinner: - (Assuming dinner will be had after arrival in Baton Rouge or during the flight)\nAccommodation: -\n\nPlease note that the accommodation chosen allows smoking as it is not explicitly listed as prohibited in the house rules. Smoking-friendly accommodations are not common, and explicit confirmation from the host may be required. The budget has been considered in choosing flights, meals, and accommodation, but incidental costs such as transportation to and from airports, attractions, and meals have not been detailed and should be accounted for within the total budget.", "gpt-4-1106-preview_direct_sole-planning_parsed_results": [{"day": 1, "current_city": "from Baton Rouge to Dallas", "transportation": "Flight Number: F3815317, from Baton Rouge to Dallas, Departure Time: 09:48, Arrival Time: 11:29", "breakfast": "-", "attraction": "The Sixth Floor Museum at Dealey Plaza, Dallas;", "lunch": "Coconuts Fish Cafe, Dallas", "dinner": "1918 Bistro & Grill, Dallas", "accommodation": "Sunny Brooklyn room, Dallas"}, {"day": 2, "current_city": "Dallas", "transportation": "-", "breakfast": "Cafe Gatherings, Dallas", "attraction": "The Dallas Arboretum and Botanical Garden, Dallas;Reunion Tower, Dallas;", "lunch": "Yanki Sizzlers, Dallas", "dinner": "L'Opera, Dallas", "accommodation": "Sunny Brooklyn room, Dallas"}, {"day": 3, "current_city": "from Dallas to Baton Rouge", "transportation": "Flight Number: F3814165, from Dallas to Baton Rouge, Departure Time: 20:39, Arrival Time: 21:58", "breakfast": "Drifters Cafe, Dallas", "attraction": "Dallas Museum of Art, Dallas;", "lunch": "Haldiram's, Dallas", "dinner": "-", "accommodation": "-"}]}]