[{"gpt-4-1106-preview_direct_sole-planning_results": "Travel Plan:\nDays: 1,\nCurrent City: from Buffalo to Atlanta (Georgia),\nTransportation: Flight Number: F3502691, from Buffalo to Atlanta (Georgia), Departure Time: 18:48, Arrival Time: 20:51, cost: 240\nBreakfast: -,\nAttraction: -,\nLunch: -,\nDinner: Saffron, Atlanta (Georgia), cost: 39, cuisines: \u201cTea, Cafe, Fast Food, Seafood\u201d\nAccommodation: Unique 2BR Apartment, Atlanta (Georgia), cost: 394, maximum occupancy: 3, house rules: No parties & No pets & No children under 10, minimum nights: 2\n\nNumber of people = 1\nTotal cost = 240 + 39 + 394 = 673\nAccommodation minimum nights: 1/2\n\nDays: 2,\nCurrent City: Atlanta (Georgia),\nTransportation: -,\nBreakfast: Adda, Atlanta (Georgia), cost: 22, cuisines: \u201cTea, Mexican, Bakery\u201d\nAttraction: Georgia Aquarium, Atlanta (Georgia); Centennial Olympic Park, Atlanta (Georgia);,\nLunch: Chef Style, Atlanta (Georgia), cost: 59, cuisines: \u201cPizza, American, Desserts, Seafood\u201d\nDinner: Asian Bistro, Atlanta (Georgia), cost: 27, cuisines: \u201cTea, Bakery, Seafood\u201d\nAccommodation: Unique 2BR Apartment, Atlanta (Georgia), cost: 394, maximum occupancy: 3, house rules: No parties & No pets & No children under 10, minimum nights: 2\n\nNumber of people = 1\nTotal cost = 22 + 59 + 27 + 394 = 502\nAccommodation minimum nights: 2/2\n\nDays: 3,\nCurrent City: from Atlanta (Georgia) to Buffalo,\nTransportation: Flight Number: F3502694, from Atlanta to Buffalo, Departure Time: 15:47, Arrival Time: 17:42, cost: 209\nBreakfast: -,\nAttraction: -,\nLunch: -,\nDinner: -,\nAccommodation: -\n\nNumber of people = 1\nTotal cost = 209\n\nTotal cost across all days = 673 + 502 + 209 = 1,384\n\nNote: The total cost exceeds the planned budget of $1,100. To adjust the plan within the budget, we can consider changing the flight to a cheaper option or adjusting the accommodation and meal choices.\n\nAdjusted Travel Plan within Budget:\nDays: 1,\nCurrent City: from Buffalo to Atlanta (Georgia),\nTransportation: Flight Number: F3502691, from Buffalo to Atlanta (Georgia), Departure Time: 18:48, Arrival Time: 20:51, cost: 240\nBreakfast: -,\nAttraction: -,\nLunch: -,\nDinner: Ahata, Atlanta (Georgia), cost: 17, cuisines: \u201cTea, Indian, Desserts\u201d\nAccommodation: Spacious private room close St. Barnabas Hospital, Atlanta (Georgia), cost: 144, maximum occupancy: 1, house rules: No smoking, minimum nights: 2\n\nNumber of people = 1\nTotal cost = 240 + 17 + 144 = 401\nAccommodation minimum nights: 1/2\n\nDays: 2,\nCurrent City: Atlanta (Georgia),\nTransportation: -,\nBreakfast: Adda, Atlanta (Georgia), cost: 22, cuisines: \u201cTea, Mexican, Bakery\u201d\nAttraction: Georgia Aquarium, Atlanta (Georgia); Centennial Olympic Park, Atlanta (Georgia);,\nLunch: Daawat-e-Kashmir, Atlanta (Georgia), cost: 19, cuisines: \u201cCafe, Pizza, American, Seafood\u201d\nDinner: Taste of Vishal, Atlanta (Georgia), cost: 13, cuisines: \u201cDesserts, Tea, American, Bakery, Indian, Seafood\u201d\nAccommodation: Spacious private room close St. Barnabas Hospital, Atlanta (Georgia), cost: 144, maximum occupancy: 1, house rules: No smoking, minimum nights: 2\n\nNumber of people = 1\nTotal cost = 22 + 19 + 13 + 144 = 198\nAccommodation minimum nights: 2/2\n\nDays: 3,\nCurrent City: from Atlanta (Georgia) to Buffalo,\nTransportation: Flight Number: F3502694, from Atlanta to Buffalo, Departure Time: 15:47, Arrival Time: 17:42, cost: 209\nBreakfast: -,\nAttraction: -,\nLunch: -,\nDinner: -,\nAccommodation: -\n\nNumber of people = 1\nTotal cost = 209\n\nTotal cost across all days = 401 + 198 + 209 = 808\n\nCuisines: The plan includes a variety of cuisines, with a focus on Tea, American, and Indian, which are available in Atlanta.\n\nThe adjusted plan is within the budget of $1,100.", "gpt-4-1106-preview_direct_sole-planning_parsed_results": [{"day": 1, "current_city": "from Buffalo to Atlanta (Georgia)", "transportation": "Flight Number: F3502691, from Buffalo to Atlanta (Georgia), Departure Time: 18:48, Arrival Time: 20:51", "breakfast": "-", "attraction": "-", "lunch": "-", "dinner": "Saffron, Atlanta (Georgia)", "accommodation": "Unique 2BR Apartment, Atlanta (Georgia)"}, {"day": 2, "current_city": "Atlanta (Georgia)", "transportation": "-", "breakfast": "Adda, Atlanta (Georgia)", "attraction": "Georgia Aquarium, Atlanta (Georgia);Centennial Olympic Park, Atlanta (Georgia);", "lunch": "Chef Style, Atlanta (Georgia)", "dinner": "Asian Bistro, Atlanta (Georgia)", "accommodation": "Unique 2BR Apartment, Atlanta (Georgia)"}, {"day": 3, "current_city": "from Atlanta (Georgia) to Buffalo", "transportation": "Flight Number: F3502694, from Atlanta to Buffalo, Departure Time: 15:47, Arrival Time: 17:42", "breakfast": "-", "attraction": "-", "lunch": "-", "dinner": "-", "accommodation": "-"}, {"day": 1, "current_city": "from Buffalo to Atlanta (Georgia)", "transportation": "Flight Number: F3502691, from Buffalo to Atlanta (Georgia), Departure Time: 18:48, Arrival Time: 20:51", "breakfast": "-", "attraction": "-", "lunch": "-", "dinner": "Ahata, Atlanta (Georgia)", "accommodation": "Spacious private room close St. Barnabas Hospital, Atlanta (Georgia)"}, {"day": 2, "current_city": "Atlanta (Georgia)", "transportation": "-", "breakfast": "Adda, Atlanta (Georgia)", "attraction": "Georgia Aquarium, Atlanta (Georgia);Centennial Olympic Park, Atlanta (Georgia);", "lunch": "Daawat-e-Kashmir, Atlanta (Georgia)", "dinner": "Taste of Vishal, Atlanta (Georgia)", "accommodation": "Spacious private room close St. Barnabas Hospital, Atlanta (Georgia)"}, {"day": 3, "current_city": "from Atlanta (Georgia) to Buffalo", "transportation": "Flight Number: F3502694, from Atlanta to Buffalo, Departure Time: 15:47, Arrival Time: 17:42", "breakfast": "-", "attraction": "-", "lunch": "-", "dinner": "-", "accommodation": "-"}]}]