[{"gpt-4-1106-preview_direct_sole-planning_results": "Travel Plan:\n\nDay 1: March 13, 2022\nCurrent City: from Pittsburgh to Rochester\nTransportation: Taxi, from Pittsburgh to Rochester, Duration: 4 hours 11 mins, Distance: 457 km, Cost: $457\nBreakfast: -\nAttraction: The Strong National Museum of Play, Rochester\nLunch: Atlas World Grill, Rochester\nDinner: Sree Annapoorna, Rochester\nAccommodation: Super Cute Studio in Heart of Greenpoint, Rochester\n\nDay 2: March 14, 2022\nCurrent City: Rochester\nTransportation: -\nBreakfast: Atlas World Grill, Rochester\nAttraction: George Eastman Museum, Rochester; RMSC (Rochester Museum & Science Center), Rochester\nLunch: Sree Annapoorna, Rochester\nDinner: Mister Mughal, Rochester\nAccommodation: Super Cute Studio in Heart of Greenpoint, Rochester\n\nDay 3: March 15, 2022\nCurrent City: from Rochester to Niagara Falls\nTransportation: Taxi, from Rochester to Niagara Falls, Duration: 1 hour 25 mins, Distance: 139 km, Cost: $139\nBreakfast: Atlas World Grill, Rochester\nAttraction: Journey Behind the Falls, Niagara Falls; Niagara SkyWheel, Niagara Falls\nLunch: Izakaya Kikufuji, Niagara Falls\nDinner: Tony Roma's, Niagara Falls\nAccommodation: Sunny Spacious South Slope Studio, Niagara Falls\n\nDay 4: March 16, 2022\nCurrent City: Niagara Falls\nTransportation: -\nBreakfast: Izakaya Kikufuji, Niagara Falls\nAttraction: Cave of the Winds, Niagara Falls; White Water Walk, Niagara Falls\nLunch: Pier 70, Niagara Falls\nDinner: Scratch, Niagara Falls\nAccommodation: Sunny Spacious South Slope Studio, Niagara Falls\n\nDay 5: March 17, 2022\nCurrent City: from Niagara Falls to New York\nTransportation: Taxi, from Niagara Falls to New York, Duration: 6 hours 29 mins, Distance: 657 km, Cost: $657\nBreakfast: Izakaya Kikufuji, Niagara Falls\nAttraction: Top of The Rock, New York; One World Observatory, New York\nLunch: Seasons 52 Fresh Grill, New York\nDinner: Gurgaon Hights, New York\nAccommodation: Beautiful and big 1BR sublet close by Central Park, New York\n\nDay 6: March 18, 2022\nCurrent City: New York\nTransportation: -\nBreakfast: Seasons 52 Fresh Grill, New York\nAttraction: Empire State Building, New York; The High Line, New York\nLunch: Lord of the Drinks Forum, New York\nDinner: Goosebumps, New York\nAccommodation: Beautiful and big 1BR sublet close by Central Park, New York\n\nDay 7: March 19, 2022\nCurrent City: from New York to Pittsburgh\nTransportation: Self-driving, from New York to Pittsburgh, Duration: 5 hours 57 mins, Distance: 594 km, Cost: $29\nBreakfast: Seasons 52 Fresh Grill, New York\nAttraction: Central Park, New York\nLunch: Garam Masala Food Corner, New York\nDinner: -\nAccommodation: -\n\nTotal Estimated Cost: $457 (Taxi to Rochester) + $139 (Taxi to Niagara Falls) + $657 (Taxi to New York) + $29 (Self-driving to Pittsburgh) + $2,456 (Accommodation) + $1,562 (Meals) = $5,300\n\nNote: Accommodation cost is estimated at an average of $351 per night for two people, and meal costs are estimated at an average of $52 per meal for two people. The accommodation allows visitors as per the house rules. Attractions and restaurants were chosen based on the preference for French, Italian, Chinese, and American cuisines. No flights were included in the travel plan as per the request.", "gpt-4-1106-preview_direct_sole-planning_parsed_results": [{"day": 1, "current_city": "from Pittsburgh to Rochester", "transportation": "Taxi, from Pittsburgh to Rochester, Duration: 4 hours 11 mins, Distance: 457 km, Cost: 457", "breakfast": "-", "attraction": "The Strong National Museum of Play, Rochester;", "lunch": "Atlas World Grill, Rochester", "dinner": "Sree Annapoorna, Rochester", "accommodation": "Super Cute Studio in Heart of Greenpoint, Rochester"}, {"day": 2, "current_city": "Rochester", "transportation": "-", "breakfast": "Atlas World Grill, Rochester", "attraction": "George Eastman Museum, Rochester;RMSC (Rochester Museum & Science Center), Rochester;", "lunch": "Sree Annapoorna, Rochester", "dinner": "Mister Mughal, Rochester", "accommodation": "Super Cute Studio in Heart of Greenpoint, Rochester"}, {"day": 3, "current_city": "from Rochester to Niagara Falls", "transportation": "Taxi, from Rochester to Niagara Falls, Duration: 1 hour 25 mins, Distance: 139 km, Cost: 139", "breakfast": "Atlas World Grill, Rochester", "attraction": "Journey Behind the Falls, Niagara Falls;Niagara SkyWheel, Niagara Falls;", "lunch": "Izakaya Kikufuji, Niagara Falls", "dinner": "Tony Roma's, Niagara Falls", "accommodation": "Sunny Spacious South Slope Studio, Niagara Falls"}, {"day": 4, "current_city": "Niagara Falls", "transportation": "-", "breakfast": "Izakaya Kikufuji, Niagara Falls", "attraction": "Cave of the Winds, Niagara Falls;White Water Walk, Niagara Falls;", "lunch": "Pier 70, Niagara Falls", "dinner": "Scratch, Niagara Falls", "accommodation": "Sunny Spacious South Slope Studio, Niagara Falls"}, {"day": 5, "current_city": "from Niagara Falls to New York", "transportation": "Taxi, from Niagara Falls to New York, Duration: 6 hours 29 mins, Distance: 657 km, Cost: 657", "breakfast": "Izakaya Kikufuji, Niagara Falls", "attraction": "Top of The Rock, New York;One World Observatory, New York;", "lunch": "Seasons 52 Fresh Grill, New York", "dinner": "Gurgaon Hights, New York", "accommodation": "Beautiful and big 1BR sublet close by Central Park, New York"}, {"day": 6, "current_city": "New York", "transportation": "-", "breakfast": "Seasons 52 Fresh Grill, New York", "attraction": "Empire State Building, New York;The High Line, New York;", "lunch": "Lord of the Drinks Forum, New York", "dinner": "Goosebumps, New York", "accommodation": "Beautiful and big 1BR sublet close by Central Park, New York"}, {"day": 7, "current_city": "from New York to Pittsburgh", "transportation": "Self-driving, from New York to Pittsburgh, Duration: 5 hours 57 mins, Distance: 594 km, Cost: 29", "breakfast": "Seasons 52 Fresh Grill, New York", "attraction": "Central Park, New York;", "lunch": "Garam Masala Food Corner, New York", "dinner": "-", "accommodation": "-"}]}]