[{"gpt-4-1106-preview_direct_sole-planning_results": "Travel Plan:\n\nDays: 1,\nCurrent City: from Milwaukee to Alpena (Michigan),\nTransportation: Self-driving, from Milwaukee to Alpena, duration: 7 hours 37 mins, distance: 749 km, cost: $37\nBreakfast: -,\nAttraction: -,\nLunch: -,\nDinner: A & A Pagliai's Pizza, Alpena (Michigan), cost: $72, cuisines: \u201cTea, American, Fast Food\u201d\nAccommodation: Loft in Times Square with Roof Balcony, Alpena (Michigan), cost: $104, maximum occupancy: 2, house rules: No parties & No visitors, minimum nights: 180\n\nNumber of people = 2\nTotal cost = ($37 + $72) * 2 + $104 = $322\nAccommodation minimum nights: 1/180\n\nDays: 2,\nCurrent City: Alpena (Michigan),\nTransportation: -,\nBreakfast: @Mango, Alpena (Michigan), cost: $38, cuisines: \u201cBBQ, Cafe, American, Desserts\u201d\nAttraction: Great Lakes Maritime Heritage Center, Alpena (Michigan),\nLunch: Shudh Restaurant, Alpena (Michigan), cost: $56, cuisines: \u201cCafe, BBQ, Fast Food\u201d\nDinner: Maplai, Alpena (Michigan), cost: $63, cuisines: \u201cTea, Indian, Bakery, Fast Food, American\u201d\nAccommodation: Loft in Times Square with Roof Balcony, Alpena (Michigan), cost: $104, maximum occupancy: 2, house rules: No parties & No visitors, minimum nights: 180\n\nNumber of people = 2\nTotal cost = ($38 + $56 + $63) * 2 + $104 = $418\nAccommodation minimum nights: 2/180\n\nDays: 3,\nCurrent City: from Alpena (Michigan) to Kalamazoo (Michigan),\nTransportation: Self-driving, from Alpena to Kalamazoo, duration: 4 hours 33 mins, distance: 464 km, cost: $23\nBreakfast: -,\nAttraction: Kalamazoo Valley Museum, Kalamazoo (Michigan),\nLunch: Django, Kalamazoo (Michigan), cost: $65, cuisines: \u201cMediterranean, Desserts, Fast Food\u201d\nDinner: Giulios Greek & Italian Restaurant, Kalamazoo (Michigan), cost: $76, cuisines: \u201cFast Food, French, Desserts, Seafood\u201d\nAccommodation: Sunny, 1 Bedroom in Bedstuy, Brooklyn, Kalamazoo (Michigan), cost: $160, maximum occupancy: 2, house rules: No smoking, minimum nights: 7\n\nNumber of people = 2\nTotal cost = ($23 + $65 + $76) * 2 + $160 = $488\nAccommodation minimum nights: 1/7\n\nDays: 4,\nCurrent City: Kalamazoo (Michigan),\nTransportation: -,\nBreakfast: Cha cTea, Kalamazoo (Michigan), cost: $77, cuisines: \u201cCafe, Pizza, Mediterranean\u201d\nAttraction: Kalamazoo Institute of Arts, Kalamazoo (Michigan),\nLunch: Taco Bell, Kalamazoo (Michigan), cost: $54, cuisines: \u201cChinese, Bakery, Pizza, Seafood\u201d\nDinner: Oxy Lounge, Kalamazoo (Michigan), cost: $65, cuisines: \u201cTea, Bakery, BBQ\u201d\nAccommodation: Sunny, 1 Bedroom in Bedstuy, Brooklyn, Kalamazoo (Michigan), cost: $160, maximum occupancy: 2, house rules: No smoking, minimum nights: 7\n\nNumber of people = 2\nTotal cost = ($77 + $54 + $65) * 2 + $160 = $552\nAccommodation minimum nights: 2/7\n\nDays: 5,\nCurrent City: from Kalamazoo (Michigan) to Milwaukee,\nTransportation: Self-driving, from Kalamazoo to Milwaukee, duration: 3 hours 45 mins, distance: 382 km, cost: $19\nBreakfast: -,\nAttraction: -,\nLunch: -,\nDinner: -,\nAccommodation: -\n\nNumber of people = 2\nTotal cost = $19 * 2 = $38\n\nTotal cost across all days = $322 + $418 + $488 + $552 + $38 = $1,818\n\nUnfortunately, the total cost exceeds the specified budget of $1,700. To adjust the plan within the budget, we can consider the following changes:\n\n- Opt for cheaper dining options or eliminate one meal out per day.\n- Find more affordable accommodation options that still meet the requirement for private rooms and allow parties.\n\nPlease note that the accommodation \"Loft in Times Square with Roof Balcony\" does not allow parties, which is against the specified requirement. However, due to the limited information provided and the need to adhere to the budget, it was selected. If more accommodation options are available that meet all requirements, they should be considered.\n\nCuisines: The restaurants chosen offer a variety of cuisines, including American, which was not specified as a preference but is commonly acceptable.\n\nPlease confirm if the proposed changes are acceptable or provide additional information to refine the travel plan further.", "gpt-4-1106-preview_direct_sole-planning_parsed_results": [{"day": 1, "current_city": "from Milwaukee to Alpena (Michigan)", "transportation": "Self-driving, from Milwaukee to Alpena, duration: 7 hours 37 mins, distance: 749 km", "breakfast": "-", "attraction": "-", "lunch": "-", "dinner": "A & A Pagliai's Pizza, Alpena (Michigan)", "accommodation": "Loft in Times Square with Roof Balcony, Alpena (Michigan)"}, {"day": 2, "current_city": "Alpena (Michigan)", "transportation": "-", "breakfast": "@Mango, Alpena (Michigan)", "attraction": "Great Lakes Maritime Heritage Center, Alpena (Michigan);", "lunch": "Shudh Restaurant, Alpena (Michigan)", "dinner": "Maplai, Alpena (Michigan)", "accommodation": "Loft in Times Square with Roof Balcony, Alpena (Michigan)"}, {"day": 3, "current_city": "from Alpena (Michigan) to Kalamazoo (Michigan)", "transportation": "Self-driving, from Alpena to Kalamazoo, duration: 4 hours 33 mins, distance: 464 km", "breakfast": "-", "attraction": "Kalamazoo Valley Museum, Kalamazoo (Michigan);", "lunch": "Django, Kalamazoo (Michigan)", "dinner": "Giulios Greek & Italian Restaurant, Kalamazoo (Michigan)", "accommodation": "Sunny, 1 Bedroom in Bedstuy, Brooklyn, Kalamazoo (Michigan)"}, {"day": 4, "current_city": "Kalamazoo (Michigan)", "transportation": "-", "breakfast": "Cha cTea, Kalamazoo (Michigan)", "attraction": "Kalamazoo Institute of Arts, Kalamazoo (Michigan);", "lunch": "Taco Bell, Kalamazoo (Michigan)", "dinner": "Oxy Lounge, Kalamazoo (Michigan)", "accommodation": "Sunny, 1 Bedroom in Bedstuy, Brooklyn, Kalamazoo (Michigan)"}, {"day": 5, "current_city": "from Kalamazoo (Michigan) to Milwaukee", "transportation": "Self-driving, from Kalamazoo to Milwaukee, duration: 3 hours 45 mins, distance: 382 km", "breakfast": "-", "attraction": "-", "lunch": "-", "dinner": "-", "accommodation": "-"}]}]