[{"gpt-4-1106-preview_direct_sole-planning_results": "Travel Plan:\n\nDay 1: March 17, 2022\nCurrent City: from Baton Rouge to Texarkana\nTransportation: Taxi, from Baton Rouge to Texarkana, Duration: 4 hours 46 mins, Distance: 519 km, Cost: $519\nBreakfast: -\nAttraction: Museum of Regional History, Texarkana\nLunch: Big City Bread Cafe, Texarkana\nDinner: Columbia Restaurant, Texarkana\nAccommodation: Large 2.5 BR Apt In Park Slope, Texarkana\n\nDay 2: March 18, 2022\nCurrent City: Texarkana\nTransportation: -\nBreakfast: Big City Bread Cafe, Texarkana\nAttraction: Spring Lake Park, Texarkana; Four States Auto Museum, Texarkana\nLunch: Poets Cafe, Texarkana\nDinner: Club Mojo, Texarkana\nAccommodation: Large 2.5 BR Apt In Park Slope, Texarkana\n\nDay 3: March 19, 2022\nCurrent City: from Texarkana to Abilene\nTransportation: Taxi, from Texarkana to Abilene, Duration: 5 hours 20 mins, Distance: 579 km, Cost: $579\nBreakfast: -\nAttraction: The Grace Museum, Abilene\nLunch: Thai Garden, Abilene\nDinner: Crispy Crust, Abilene\nAccommodation: Apartment minutes from manhattan, Abilene\n\nDay 4: March 20, 2022\nCurrent City: Abilene\nTransportation: -\nBreakfast: Thai Garden, Abilene\nAttraction: Frontier Texas!, Abilene; Historic Fort Phantom Hill, Abilene\nLunch: Finger Licious, Abilene\nDinner: Mx Corn, Abilene\nAccommodation: Apartment minutes from manhattan, Abilene\n\nDay 5: March 21, 2022\nCurrent City: from Abilene to Amarillo\nTransportation: Taxi, from Abilene to Amarillo, Duration: 4 hours 10 mins, Distance: 446 km, Cost: $446\nBreakfast: -\nAttraction: Cadillac Ranch, Amarillo\nLunch: The Cinnamon Kitchen, Amarillo\nDinner: Komachi, Amarillo\nAccommodation: Harlem Humble Abode - 1 bedroom - Cute and Quaint, Amarillo\n\nDay 6: March 22, 2022\nCurrent City: Amarillo\nTransportation: -\nBreakfast: The Cinnamon Kitchen, Amarillo\nAttraction: Amarillo Botanical Gardens, Amarillo; Amarillo Zoo, Amarillo\nLunch: Kanha North & South Indian Veg., Amarillo\nDinner: Sigree Global Grill, Amarillo\nAccommodation: Harlem Humble Abode - 1 bedroom - Cute and Quaint, Amarillo\n\nDay 7: March 23, 2022\nCurrent City: from Amarillo to Baton Rouge\nTransportation: Taxi, from Amarillo to Baton Rouge, Duration: 11 hours 42 mins, Distance: 1,270 km, Cost: $1270\nBreakfast: -\nAttraction: -\nLunch: -\nDinner: -\nAccommodation: -\n\nTotal Transportation Cost: $519 (Day 1) + $579 (Day 3) + $446 (Day 5) + $1270 (Day 7) = $2814\nRemaining Budget for Meals, Attractions, and Accommodations: $14,600 - $2814 = $11,786\n\nPlease note that the accommodation options selected are entire homes or apartments that allow children, as per the request. The restaurants chosen are based on the average cost and variety of cuisines suitable for a group including children. Attractions were selected based on family-friendly activities. The transportation method chosen is taxi, as per the preference not to self-drive. The costs are based on the provided data, and the remaining budget should cover meals, attractions, and accommodations within the specified budget constraints.", "gpt-4-1106-preview_direct_sole-planning_parsed_results": [{"day": 1, "current_city": "from Baton Rouge to Texarkana", "transportation": "Taxi, from Baton Rouge to Texarkana, Duration: 4 hours 46 mins, Distance: 519 km, Cost: 519", "breakfast": "-", "attraction": "Museum of Regional History, Texarkana;", "lunch": "Big City Bread Cafe, Texarkana", "dinner": "Columbia Restaurant, Texarkana", "accommodation": "Large 2.5 BR Apt In Park Slope, Texarkana"}, {"day": 2, "current_city": "Texarkana", "transportation": "-", "breakfast": "Big City Bread Cafe, Texarkana", "attraction": "Spring Lake Park, Texarkana;Four States Auto Museum, Texarkana;", "lunch": "Poets Cafe, Texarkana", "dinner": "Club Mojo, Texarkana", "accommodation": "Large 2.5 BR Apt In Park Slope, Texarkana"}, {"day": 3, "current_city": "from Texarkana to Abilene", "transportation": "Taxi, from Texarkana to Abilene, Duration: 5 hours 20 mins, Distance: 579 km, Cost: 579", "breakfast": "-", "attraction": "The Grace Museum, Abilene;", "lunch": "Thai Garden, Abilene", "dinner": "Crispy Crust, Abilene", "accommodation": "Apartment minutes from manhattan, Abilene"}, {"day": 4, "current_city": "Abilene", "transportation": "-", "breakfast": "Thai Garden, Abilene", "attraction": "Frontier Texas!, Abilene;Historic Fort Phantom Hill, Abilene;", "lunch": "Finger Licious, Abilene", "dinner": "Mx Corn, Abilene", "accommodation": "Apartment minutes from manhattan, Abilene"}, {"day": 5, "current_city": "from Abilene to Amarillo", "transportation": "Taxi, from Abilene to Amarillo, Duration: 4 hours 10 mins, Distance: 446 km, Cost: 446", "breakfast": "-", "attraction": "Cadillac Ranch, Amarillo;", "lunch": "The Cinnamon Kitchen, Amarillo", "dinner": "Komachi, Amarillo", "accommodation": "Harlem Humble Abode - 1 bedroom - Cute and Quaint, Amarillo"}, {"day": 6, "current_city": "Amarillo", "transportation": "-", "breakfast": "The Cinnamon Kitchen, Amarillo", "attraction": "Amarillo Botanical Gardens, Amarillo;Amarillo Zoo, Amarillo;", "lunch": "Kanha North & South Indian Veg., Amarillo", "dinner": "Sigree Global Grill, Amarillo", "accommodation": "Harlem Humble Abode - 1 bedroom - Cute and Quaint, Amarillo"}, {"day": 7, "current_city": "from Amarillo to Baton Rouge", "transportation": "Taxi, from Amarillo to Baton Rouge, Duration: 11 hours 42 mins, Distance: 1,270 km, Cost: 1270", "breakfast": "-", "attraction": "-", "lunch": "-", "dinner": "-", "accommodation": "-"}]}]