[{"gpt-4-1106-preview_direct_sole-planning_results": "Travel Plan:\n\nDay 1: March 15, 2022\nCurrent City: from Washington to Norfolk\nTransportation: Flight Number: F3785353, from Washington to Norfolk, Departure Time: 08:30, Arrival Time: 09:18\nBreakfast: - (Assuming breakfast in Washington before departure)\nAttraction: Norfolk Botanical Garden, Norfolk\nLunch: Sonya Bakery Cafe, Norfolk\nDinner: Henry Campbell's Steakhouse, Norfolk\nAccommodation: Airports Sleep Inn, Norfolk\n\nDay 2: March 16, 2022\nCurrent City: Norfolk\nTransportation: -\nBreakfast: Sunshine Family Restaurant, Norfolk\nAttraction: Nauticus, Norfolk; Chrysler Museum of Art, Norfolk\nLunch: Game n Grillz, Norfolk\nDinner: Jonathan's Kitchen - Holiday Inn Express & Suites, Norfolk\nAccommodation: Airports Sleep Inn, Norfolk\n\nDay 3: March 17, 2022\nCurrent City: from Norfolk to Lynchburg\nTransportation: Self-driving, from Norfolk to Lynchburg, duration: 3 hours 27 mins, distance: 306 km, cost: 15\nBreakfast: Amber, Norfolk\nAttraction: Amazement Square, Lynchburg; Point of Honor, Lynchburg\nLunch: The BrewMaster, Lynchburg\nDinner: Uptown Vietnam cuisine, Lynchburg\nAccommodation: Private Bedroom in Spanish Harlem, Lynchburg\n\nDay 4: March 18, 2022\nCurrent City: Lynchburg\nTransportation: -\nBreakfast: Bean Here, Lynchburg\nAttraction: The Anne Spencer House & Garden Museum, Lynchburg; Maier Museum of Art at Randolph College, Lynchburg\nLunch: Khyen Chyen, Lynchburg\nDinner: Pirates Of Grill, Lynchburg\nAccommodation: Private Bedroom in Spanish Harlem, Lynchburg\n\nDay 5: March 19, 2022\nCurrent City: from Lynchburg to Washington\nTransportation: Self-driving, from Lynchburg to Washington, duration: 3 hours 19 mins, distance: 291 km, cost: 14\nBreakfast: Eat n Joy, Lynchburg\nAttraction: - (Assuming travel back to Washington takes up the majority of the day)\nLunch: - (On the road)\nDinner: - (Assuming arrival in Washington in the evening)\nAccommodation: -\n\nPlease note that the costs for meals, attractions, and accommodations have not been provided, so they should be monitored to ensure the total budget of $2,200 is not exceeded. The transportation costs for self-driving have been included as per the provided information.", "gpt-4-1106-preview_direct_sole-planning_parsed_results": [{"day": 1, "current_city": "from Washington to Norfolk", "transportation": "Flight Number: F3785353, from Washington to Norfolk, Departure Time: 08:30, Arrival Time: 09:18", "breakfast": "-", "attraction": "Norfolk Botanical Garden, Norfolk;", "lunch": "Sonya Bakery Cafe, Norfolk", "dinner": "Henry Campbell's Steakhouse, Norfolk", "accommodation": "Airports Sleep Inn, Norfolk"}, {"day": 2, "current_city": "Norfolk", "transportation": "-", "breakfast": "Sunshine Family Restaurant, Norfolk", "attraction": "Nauticus, Norfolk;Chrysler Museum of Art, Norfolk;", "lunch": "Game n Grillz, Norfolk", "dinner": "Jonathan's Kitchen - Holiday Inn Express & Suites, Norfolk", "accommodation": "Airports Sleep Inn, Norfolk"}, {"day": 3, "current_city": "from Norfolk to Lynchburg", "transportation": "Self-driving, from Norfolk to Lynchburg, duration: 3 hours 27 mins, distance: 306 km, Cost: 15", "breakfast": "Amber, Norfolk", "attraction": "Amazement Square, Lynchburg;Point of Honor, Lynchburg;", "lunch": "The BrewMaster, Lynchburg", "dinner": "Uptown Vietnam cuisine, Lynchburg", "accommodation": "Private Bedroom in Spanish Harlem, Lynchburg"}, {"day": 4, "current_city": "Lynchburg", "transportation": "-", "breakfast": "Bean Here, Lynchburg", "attraction": "The Anne Spencer House & Garden Museum, Lynchburg;Maier Museum of Art at Randolph College, Lynchburg;", "lunch": "Khyen Chyen, Lynchburg", "dinner": "Pirates Of Grill, Lynchburg", "accommodation": "Private Bedroom in Spanish Harlem, Lynchburg"}, {"day": 5, "current_city": "from Lynchburg to Washington", "transportation": "Self-driving, from Lynchburg to Washington, duration: 3 hours 19 mins, distance: 291 km, Cost: 14", "breakfast": "Eat n Joy, Lynchburg", "attraction": "-", "lunch": "-", "dinner": "-", "accommodation": "-"}]}]