[{"gpt-4-1106-preview_direct_sole-planning_results": "Day 1:\nCurrent City: from Charlotte to Newark\nTransportation: Flight Number: F3715865, from Charlotte to Newark, Departure Time: 07:55, Arrival Time: 09:38\nBreakfast: -\nAttraction: The Newark Museum of Art, Newark\nLunch: Artistry, Newark\nDinner: Angeethi Restaurant, Newark\nAccommodation: Large Two Story Loft in the Heart of West Village, Newark\n\nDay 2:\nCurrent City: Newark\nTransportation: -\nBreakfast: Mirage Restro Bar, Newark\nAttraction: Military Park, Newark; Branch Brook Park, Newark\nLunch: Escape Terrace Bar Kitchen, Newark\nDinner: Drifters Cafe, Newark\nAccommodation: Large Two Story Loft in the Heart of West Village, Newark\n\nDay 3:\nCurrent City: from Newark to Trenton\nTransportation: Taxi, from Newark to Trenton, duration: 1 hour 5 mins, cost: 93\nBreakfast: -\nAttraction: Old Barracks Museum, Trenton; New Jersey State Museum, Trenton\nLunch: Global Grill, Trenton\nDinner: Tuscan Oven, Trenton\nAccommodation: Whole Floor, 2 BR Apt. in Iconic Greenwich Village, Trenton\n\nDay 4:\nCurrent City: Trenton\nTransportation: -\nBreakfast: The Lady & Sons, Trenton\nAttraction: Trenton City Museum/ Ellarslie Museum, Trenton; Cadwalader Park, Trenton\nLunch: The Cheesecake Factory, Trenton\nDinner: Patang - The Revolving Restaurant, Trenton\nAccommodation: Whole Floor, 2 BR Apt. in Iconic Greenwich Village, Trenton\n\nDay 5:\nCurrent City: from Trenton to Charlotte\nTransportation: Flight Number: F3561600, from Trenton to Charlotte, Departure Time: 17:23, Arrival Time: 19:23\nBreakfast: Fusilli Reasons, Trenton\nAttraction: Planetarium At NJ State Museum, Trenton\nLunch: Dosa X'press, Trenton\nDinner: -\nAccommodation: -", "gpt-4-1106-preview_direct_sole-planning_parsed_results": [{"day": 1, "current_city": "from Charlotte to Newark", "transportation": "Flight Number: F3715865, from Charlotte to Newark, Departure Time: 07:55, Arrival Time: 09:38", "breakfast": "-", "attraction": "The Newark Museum of Art, Newark;", "lunch": "Artistry, Newark", "dinner": "Angeethi Restaurant, Newark", "accommodation": "Large Two Story Loft in the Heart of West Village, Newark"}, {"day": 2, "current_city": "Newark", "transportation": "-", "breakfast": "Mirage Restro Bar, Newark", "attraction": "Military Park, Newark; Branch Brook Park, Newark;", "lunch": "Escape Terrace Bar Kitchen, Newark", "dinner": "Drifters Cafe, Newark", "accommodation": "Large Two Story Loft in the Heart of West Village, Newark"}, {"day": 3, "current_city": "from Newark to Trenton", "transportation": "Taxi, from Newark to Trenton, duration: 1 hour 5 mins, Cost: 93", "breakfast": "-", "attraction": "Old Barracks Museum, Trenton; New Jersey State Museum, Trenton;", "lunch": "Global Grill, Trenton", "dinner": "Tuscan Oven, Trenton", "accommodation": "Whole Floor, 2 BR Apt. in Iconic Greenwich Village, Trenton"}, {"day": 4, "current_city": "Trenton", "transportation": "-", "breakfast": "The Lady & Sons, Trenton", "attraction": "Trenton City Museum/ Ellarslie Museum, Trenton; Cadwalader Park, Trenton;", "lunch": "The Cheesecake Factory, Trenton", "dinner": "Patang - The Revolving Restaurant, Trenton", "accommodation": "Whole Floor, 2 BR Apt. in Iconic Greenwich Village, Trenton"}, {"day": 5, "current_city": "from Trenton to Charlotte", "transportation": "Flight Number: F3561600, from Trenton to Charlotte, Departure Time: 17:23, Arrival Time: 19:23", "breakfast": "Fusilli Reasons, Trenton", "attraction": "Planetarium At NJ State Museum, Trenton;", "lunch": "Dosa X'press, Trenton", "dinner": "-", "accommodation": "-"}]}]