[{"gpt-4-1106-preview_direct_sole-planning_results": "Travel Plan:\nDays: 1,\nCurrent City: from Manchester to Charlotte,\nTransportation: Flight Number: F3785421, from Manchester to Charlotte, Departure Time: 14:16, Arrival Time: 16:46, cost: 223\nBreakfast: -,\nAttraction: -,\nLunch: -,\nDinner: Olive Tree Cafe, Charlotte, cost: 23, cuisines: \u201cTea, Chinese, Desserts\u201d\nAccommodation: Elegant Studio Apt in Prospect Heights, Charlotte, cost: 640, room type: Entire home/apt, house rules: No parties, minimum nights: 2, maximum occupancy: 5\n\nNumber of people = 5\nTotal cost = (223 * 5) + (23 * 5) + 640 = 1,755\nAccommodation minimum nights: 1/2\n\nDays: 2,\nCurrent City: Charlotte,\nTransportation: -,\nBreakfast: Central Perk 7, Charlotte, cost: 87, cuisines: \u201cPizza, Bakery, BBQ, Fast Food\u201d\nAttraction: Discovery Place Science, Charlotte; The Mint Museum, Charlotte;,\nLunch: Kylin Skybar, Charlotte, cost: 44, cuisines: \u201cTea, Cafe, Pizza, Italian\u201d\nDinner: Unplugged Courtyard, Charlotte, cost: 54, cuisines: \u201cDesserts, French, Bakery, Cafe, Seafood\u201d\nAccommodation: Elegant Studio Apt in Prospect Heights, Charlotte, cost: 640, room type: Entire home/apt, house rules: No parties, minimum nights: 2, maximum occupancy: 5\n\nNumber of people = 5\nTotal cost = (87 + 44 + 54) * 5 + 640 = 1,515\nAccommodation minimum nights: 2/2\n\nDays: 3,\nCurrent City: from Charlotte to Manchester,\nTransportation: Flight Number: F3785397, from Charlotte to Manchester, Departure Time: 11:21, Arrival Time: 13:22, cost: 284\nBreakfast: -,\nAttraction: -,\nLunch: -,\nDinner: -,\nAccommodation: -\n\nNumber of people = 5\nTotal cost = 284 * 5 = 1,420\n\nTotal cost across all days = 1,755 + 1,515 + 1,420 = 4,690\n\nCuisines: No specific cuisines were requested, but a variety of options have been included.\n\n***** Travel Plan Ends *****\n\nPlease note that the costs are estimated based on the provided information and the actual costs may vary. The accommodation chosen meets the requirement for entire rooms and the budget is within the specified limit.", "gpt-4-1106-preview_direct_sole-planning_parsed_results": [{"day": 1, "current_city": "from Manchester to Charlotte", "transportation": "Flight Number: F3785421, from Manchester to Charlotte, Departure Time: 14:16, Arrival Time: 16:46", "breakfast": "-", "attraction": "-", "lunch": "-", "dinner": "Olive Tree Cafe, Charlotte", "accommodation": "Elegant Studio Apt in Prospect Heights, Charlotte"}, {"day": 2, "current_city": "Charlotte", "transportation": "-", "breakfast": "Central Perk 7, Charlotte", "attraction": "Discovery Place Science, Charlotte;The Mint Museum, Charlotte;", "lunch": "Kylin Skybar, Charlotte", "dinner": "Unplugged Courtyard, Charlotte", "accommodation": "Elegant Studio Apt in Prospect Heights, Charlotte"}, {"day": 3, "current_city": "from Charlotte to Manchester", "transportation": "Flight Number: F3785397, from Charlotte to Manchester, Departure Time: 11:21, Arrival Time: 13:22", "breakfast": "-", "attraction": "-", "lunch": "-", "dinner": "-", "accommodation": "-"}]}]