[{"gpt-4-1106-preview_direct_sole-planning_results": "Travel Plan:\n\nDay 1:\nCurrent City: from Fort Wayne to Charlotte\nTransportation: Self-driving, from Fort Wayne to Charlotte, Duration: 9 hours 15 mins, Distance: 938 km, Cost: $46\nBreakfast: - (Assuming breakfast is had before departure)\nAttraction: Freedom Park, Charlotte, Address: 1908 East Blvd, Charlotte, NC 28203, USA\nLunch: Olive Tree Cafe, Charlotte, Average Cost: $23, Cuisines: Tea, Chinese, Desserts\nDinner: Nagaland's Kitchen, Charlotte, Average Cost: $73, Cuisines: Pizza, American, Desserts\nAccommodation: Elegant Studio Apt in Prospect Heights, Charlotte, Price: $640, Room Type: Entire home/apt, House Rules: No parties, Pets allowed\n\nDay 2:\nCurrent City: Charlotte\nTransportation: -\nBreakfast: Central Perk 7, Charlotte, Average Cost: $87, Cuisines: Pizza, Bakery, BBQ, Fast Food\nAttraction: Levine Museum of the New South, Charlotte, Address: 401 S Tryon St, Charlotte, NC 28202, USA; Discovery Place Science, Charlotte, Address: 301 N Tryon St, Charlotte, NC 28202, USA\nLunch: China Garden, Charlotte, Average Cost: $14, Cuisines: Tea, Mexican, BBQ, Mediterranean\nDinner: Kylin Skybar, Charlotte, Average Cost: $44, Cuisines: Tea, Cafe, Pizza, Italian\nAccommodation: Elegant Studio Apt in Prospect Heights, Charlotte, Price: $640, Room Type: Entire home/apt, House Rules: No parties, Pets allowed\n\nDay 3:\nCurrent City: from Charlotte to Fort Wayne\nTransportation: Self-driving, from Charlotte to Fort Wayne, Duration: 9 hours 18 mins, Distance: 939 km, Cost: $46\nBreakfast: - (Assuming breakfast is had before departure)\nAttraction: - (Assuming the group will be traveling back to Fort Wayne)\nLunch: - (Assuming lunch is on the road or after arrival in Fort Wayne)\nDinner: - (Assuming the group has arrived back in Fort Wayne)\nAccommodation: -\n\nTotal Estimated Costs:\nTransportation (Self-driving to and from Charlotte): $46 x 2 = $92\nAccommodation (2 nights at Elegant Studio Apt): $640 x 2 = $1280\nMeals and Attractions (Estimated): $527 (remaining from the budget of $1900)\n\nNote: The meal and attraction costs are estimated based on the average costs provided for restaurants and the assumption of no entry fees for attractions. The group should ensure that the attractions chosen do not have entry fees that would exceed the remaining budget. The accommodation chosen allows pets and provides an entire room, as requested. The travel plan avoids flights, as per the preference.", "gpt-4-1106-preview_direct_sole-planning_parsed_results": [{"day": 1, "current_city": "from Fort Wayne to Charlotte", "transportation": "Self-driving, from Fort Wayne to Charlotte, Duration: 9 hours 15 mins, Distance: 938 km, Cost: 46", "breakfast": "-", "attraction": "Freedom Park, Charlotte;", "lunch": "Olive Tree Cafe, Charlotte", "dinner": "Nagaland's Kitchen, Charlotte", "accommodation": "Elegant Studio Apt in Prospect Heights, Charlotte"}, {"day": 2, "current_city": "Charlotte", "transportation": "-", "breakfast": "Central Perk 7, Charlotte", "attraction": "Levine Museum of the New South, Charlotte;Discovery Place Science, Charlotte;", "lunch": "China Garden, Charlotte", "dinner": "Kylin Skybar, Charlotte", "accommodation": "Elegant Studio Apt in Prospect Heights, Charlotte"}, {"day": 3, "current_city": "from Charlotte to Fort Wayne", "transportation": "Self-driving, from Charlotte to Fort Wayne, Duration: 9 hours 18 mins, Distance: 939 km, Cost: 46", "breakfast": "-", "attraction": "-", "lunch": "-", "dinner": "-", "accommodation": "-"}]}]