[{"gpt-4-1106-preview_direct_sole-planning_results": "Travel Plan:\n\nDays: 1,\nCurrent City: from Washington to Bemidji (Minnesota),\nTransportation: Self-driving, from Washington to Bemidji, duration: 20 hours 8 mins, distance: 2,120 km, cost: 106\nBreakfast: -,\nAttraction: -,\nLunch: -,\nDinner: Pig and Whistle, Bemidji (Minnesota), cost: 39, cuisines: \u201cFast Food, Mexican, Bakery, Seafood\u201d\nAccommodation: Sunny bedroom off Prospect Park, Bemidji (Minnesota), cost: 627, room type: Private room, house rules: No visitors, minimum nights: 3, maximum occupancy: 1\n\nNumber of people = 1\nTotal cost = 106 + 39 + 627 = 772\nAccommodation minimum nights: 1/3\n\nDays: 2,\nCurrent City: Bemidji (Minnesota),\nTransportation: -,\nBreakfast: Flying Cakes, Bemidji (Minnesota), cost: 43, cuisines: \u201cTea, Seafood\u201d\nAttraction: Paul Bunyan & Babe the Blue Ox Statues, Bemidji (Minnesota); Headwaters Science Center, Bemidji (Minnesota);,\nLunch: Outback Bar and Grill - Leisure Inn, Bemidji (Minnesota), cost: 59, cuisines: \u201cIndian, Desserts, Fast Food\u201d\nDinner: The Chocolate Haven, Bemidji (Minnesota), cost: 23, cuisines: \u201cDesserts, Tea, Italian, BBQ, Fast Food, Chinese\u201d\nAccommodation: Sunny bedroom off Prospect Park, Bemidji (Minnesota), cost: 627, room type: Private room, house rules: No visitors, minimum nights: 3, maximum occupancy: 1\n\nNumber of people = 1\nTotal cost = 43 + 59 + 23 + 627 = 752\nAccommodation minimum nights: 2/3\n\nDays: 3,\nCurrent City: from Bemidji (Minnesota) to Minneapolis (Minnesota),\nTransportation: Flight Number: F3847877, from Bemidji (Minnesota) to Minneapolis (Minnesota), Departure Time: 08:06, Arrival Time: 10:37, cost: 63\nBreakfast: -,\nAttraction: Minneapolis Sculpture Garden, Minneapolis (Minnesota); Minneapolis Institute of Art, Minneapolis (Minnesota);,\nLunch: The Cafe, Minneapolis (Minnesota), cost: 14, cuisines: \u201cIndian, Mediterranean, Desserts, Seafood\u201d\nDinner: Court Avenue Brewing Company, Minneapolis (Minnesota), cost: 31, cuisines: \u201cPizza, French, Bakery, BBQ, Seafood\u201d\nAccommodation: Light-filled Apartment in great area, close 2 all!, Minneapolis (Minnesota), cost: 343, room type: Entire home/apt, house rules: No visitors, minimum nights: 1, maximum occupancy: 2\n\nNumber of people = 1\nTotal cost = 63 + 14 + 31 + 343 = 451\nAccommodation minimum nights: 1/1\n\nDays: 4,\nCurrent City: Minneapolis (Minnesota),\nTransportation: -,\nBreakfast: Malo, Minneapolis (Minnesota), cost: 80, cuisines: \u201cTea, Chinese, Indian, Cafe\u201d\nAttraction: Mill City Museum, Minneapolis (Minnesota); Mill Ruins Park, Minneapolis (Minnesota);,\nLunch: Troll Tavern, Minneapolis (Minnesota), cost: 71, cuisines: \u201cTea, BBQ, Mediterranean\u201d\nDinner: Texas Roadhouse, Minneapolis (Minnesota), cost: 22, cuisines: \u201cCafe, Pizza, BBQ, Desserts\u201d\nAccommodation: Light-filled Apartment in great area, close 2 all!, Minneapolis (Minnesota), cost: 343, room type: Entire home/apt, house rules: No visitors, minimum nights: 1, maximum occupancy: 2\n\nNumber of people = 1\nTotal cost = 80 + 71 + 22 + 343 = 516\nAccommodation minimum nights: 2/1\n\nDays: 5,\nCurrent City: from Minneapolis (Minnesota) to Duluth (Minnesota),\nTransportation: Flight Number: F3640437, from Minneapolis (Minnesota) to Duluth (Minnesota), Departure Time: 08:54, Arrival Time: 10:05, cost: 52\nBreakfast: -,\nAttraction: Glensheen Mansion, Duluth (Minnesota); Leif Erikson Park, Duluth (Minnesota);,\nLunch: Sodam Korean Restaurant, Duluth (Minnesota), cost: 25, cuisines: \u201cDesserts, Tea, French, Fast Food, Cafe\u201d\nDinner: Skye - Hotel Unique, Duluth (Minnesota), cost: 31, cuisines: \u201cFrench, Mexican, Bakery, BBQ\u201d\nAccommodation: Beautiful 1 bedroom in city center, Duluth (Minnesota), cost: 1154, room type: Entire home/apt, house rules: No parties & No smoking & No children under 10, minimum nights: 2, maximum occupancy: 3\n\nNumber of people = 1\nTotal cost = 52 + 25 + 31 + 1154 = 1262\nAccommodation minimum nights: 1/2\n\nDays: 6,\nCurrent City: Duluth (Minnesota),\nTransportation: -,\nBreakfast: Chandlers Steakhouse, Duluth (Minnesota), cost: 98, cuisines: \u201cDesserts, Tea, Italian, Bakery, Fast Food, American\u201d\nAttraction: Lake Superior Railroad Museum, Duluth (Minnesota); Lake Superior Maritime Visitor Center, Duluth (Minnesota);,\nLunch: Lulu's Chocolate Bar, Duluth (Minnesota), cost: 97, cuisines: \u201cPizza, Desserts\u201d\nDinner: Bitters & Love, Duluth (Minnesota), cost: 33, cuisines: \u201cBakery, Pizza, BBQ, Fast Food\u201d\nAccommodation: Beautiful 1 bedroom in city center, Duluth (Minnesota), cost: 1154, room type: Entire home/apt, house rules: No parties & No smoking & No children under 10, minimum nights: 2, maximum occupancy: 3\n\nNumber of people = 1\nTotal cost = 98 + 97 + 33 + 1154 = 1382\nAccommodation minimum nights: 2/2\n\nDays: 7,\nCurrent City: from Duluth (Minnesota) to Washington,\nTransportation: Self-driving, from Duluth to Washington, duration: 17 hours 50 mins, distance: 1,881 km, cost: 94\nBreakfast: -,\nAttraction: -,\nLunch: -,\nDinner: -,\nAccommodation: -\n\nNumber of people = 1\nTotal cost = 94\n\nTotal cost across all days = 772 + 752 + 451 + 516 + 1262 + 1382 + 94 = 5229\n\nRemaining budget = 7200 - 5229 = 1971\n\nCuisines: The prompt specifies no particular preference, and a variety of cuisines have been represented in the restaurants chosen.", "gpt-4-1106-preview_direct_sole-planning_parsed_results": [{"day": 1, "current_city": "from Washington to Bemidji", "transportation": "Self-driving, from Washington to Bemidji, Duration: 20 hours 8 mins, Distance: 2,120 km", "breakfast": "-", "attraction": "-", "lunch": "-", "dinner": "-", "accommodation": "Sunny bedroom off Prospect Park, Bemidji"}, {"day": 2, "current_city": "Bemidji", "transportation": "-", "breakfast": "-", "attraction": "Paul Bunyan & Babe the Blue Ox Statues, Bemidji;Headwaters Science Center, Bemidji;", "lunch": "Pig and Whistle, Bemidji", "dinner": "Chao Chinese Bistro - Holiday Inn Jaipur City Centre, Bemidji", "accommodation": "Sunny bedroom off Prospect Park, Bemidji"}, {"day": 3, "current_city": "from Bemidji to Minneapolis", "transportation": "Flight Number: F3847879, from Bemidji to Minneapolis, Departure Time: 17:56, Arrival Time: 18:41", "breakfast": "-", "attraction": "-", "lunch": "-", "dinner": "-", "accommodation": "Light-filled Apartment in great area, close 2 all!, Minneapolis"}, {"day": 4, "current_city": "Minneapolis", "transportation": "-", "breakfast": "-", "attraction": "Minneapolis Sculpture Garden, Minneapolis;Minneapolis Institute of Art, Minneapolis;", "lunch": "The Cafe, Minneapolis", "dinner": "Court Avenue Brewing Company, Minneapolis", "accommodation": "Light-filled Apartment in great area, close 2 all!, Minneapolis"}, {"day": 5, "current_city": "from Minneapolis to Duluth", "transportation": "Flight Number: F3805786, from Minneapolis to Duluth, Departure Time: 20:22, Arrival Time: 21:04", "breakfast": "-", "attraction": "-", "lunch": "-", "dinner": "-", "accommodation": "Studio Apt -Upper East Side, Duluth"}, {"day": 6, "current_city": "Duluth", "transportation": "-", "breakfast": "-", "attraction": "Glensheen Mansion, Duluth;Lake Superior Railroad Museum, Duluth;", "lunch": "Sodam Korean Restaurant, Duluth", "dinner": "Skye - Hotel Unique, Duluth", "accommodation": "Studio Apt -Upper East Side, Duluth"}, {"day": 7, "current_city": "from Duluth to Washington", "transportation": "Self-driving, from Duluth to Washington, Duration: 17 hours 50 mins, Distance: 1,881 km", "breakfast": "-", "attraction": "-", "lunch": "-", "dinner": "-", "accommodation": "-"}]}]