[{"gpt-4-1106-preview_direct_sole-planning_results": "Travel Plan:\n\nDay 1: March 23, 2022\nCurrent City: from Akron to Augusta\nTransportation: Self-driving, Duration: 9 hours 36 mins, Distance: 1,031 km, Cost: $51\nBreakfast: -\nLunch: On the road (American or Chinese cuisine preferred)\nDinner: B Merrell's, Augusta (Average Cost: $74, Cuisines: Tea, Pizza, Desserts, Fast Food)\nAccommodation: Perfect Chanukah apartment for the whole crew!, Augusta (Price: $451, Room Type: Entire home/apt)\n\nDay 2: March 24, 2022\nCurrent City: Augusta\nTransportation: -\nBreakfast: Haldiram's, Augusta (Average Cost: $41, Cuisines: Cafe, Desserts, Fast Food)\nAttraction: Augusta Museum of History, Augusta\nLunch: Just Kababs, Augusta (Average Cost: $31, Cuisines: Tea, Pizza, BBQ, American, Seafood)\nDinner: KB's Kulfi & Icecream, Augusta (Average Cost: $92, Cuisines: American, BBQ, Seafood)\nAccommodation: Perfect Chanukah apartment for the whole crew!, Augusta\n\nDay 3: March 25, 2022\nCurrent City: from Augusta to Decatur\nTransportation: Self-driving, Duration: 2 hours 19 mins, Distance: 229 km, Cost: $11\nBreakfast: Office Office, Augusta (Average Cost: $16, Cuisines: Desserts, Cafe, Bakery, Fast Food, Chinese)\nAttraction: Augusta Canal National Heritage Area, Augusta\nLunch: On the road (American or Chinese cuisine preferred)\nDinner: Joey's Pizza, Decatur (Average Cost: $69, Cuisines: Tea, Pizza, Bakery, Chinese, Seafood)\nAccommodation: Cozy Private Room, Decatur (Price: $69, Room Type: Private room)\n\nDay 4: March 26, 2022\nCurrent City: Decatur\nTransportation: -\nBreakfast: Cafe Coffee Day, Decatur (Average Cost: $46, Cuisines: Tea, Cafe, BBQ, Mediterranean)\nAttraction: DeKalb History Center Museum, Decatur\nLunch: Dawat-E-Chaman, Decatur (Average Cost: $42, Cuisines: Chinese, BBQ, Fast Food, Cafe, Mediterranean)\nDinner: Carnatic Cafe, Decatur (Average Cost: $66, Cuisines: Cafe, Indian, Desserts)\nAccommodation: Cozy Private Room, Decatur\n\nDay 5: March 27, 2022\nCurrent City: from Decatur to Atlanta\nTransportation: Self-driving, Duration: 19 mins, Distance: 13.0 km, Cost: $0\nBreakfast: Hwealthcafe, Decatur (Average Cost: $44, Cuisines: Pizza, Bakery, Desserts, Fast Food)\nAttraction: Atlanta Botanical Garden, Atlanta\nLunch: Asian Bistro, Atlanta (Average Cost: $27, Cuisines: Tea, Bakery, Seafood)\nDinner: Chef Style, Atlanta (Average Cost: $59, Cuisines: Pizza, American, Desserts, Seafood)\nAccommodation: Fantastic Room in Bushwick, Atlanta (Price: $1069, Room Type: Private room)\n\nDay 6: March 28, 2022\nCurrent City: Atlanta\nTransportation: -\nBreakfast: Saffron, Atlanta (Average Cost: $39, Cuisines: Tea, Cafe, Fast Food, Seafood)\nAttraction: Georgia Aquarium, Atlanta\nLunch: Pizza Central, Atlanta (Average Cost: $75, Cuisines: Cafe, Bakery, BBQ, Fast Food, Chinese, Indian)\nDinner: Daawat-e-Kashmir, Atlanta (Average Cost: $19, Cuisines: Cafe, Pizza, American, Seafood)\nAccommodation: Fantastic Room in Bushwick, Atlanta\n\nDay 7: March 29, 2022\nCurrent City: from Atlanta to Akron\nTransportation: Self-driving, Duration: 10 hours 10 mins, Distance: 1,114 km, Cost: $55\nBreakfast: Adda, Atlanta (Average Cost: $22, Cuisines: Tea, Mexican, Bakery)\nAttraction: -\nLunch: On the road (American or Chinese cuisine preferred)\nDinner: -\nAccommodation: -\n\nTotal Estimated Cost: Accommodations ($3,389) + Dining ($1,000 estimated for meals not at specified restaurants) + Transportation ($117) = $4,506 (This is well within the budget of $8,900 and allows for additional spending on attractions, shopping, and unforeseen expenses.)", "gpt-4-1106-preview_direct_sole-planning_parsed_results": [{"day": 1, "current_city": "from Akron to Augusta", "transportation": "Self-driving, Duration: 9 hours 36 mins, Distance: 1031 km, Cost: 51", "breakfast": "-", "attraction": "-", "lunch": "-", "dinner": "B Merrell's, Augusta", "accommodation": "Perfect Chanukah apartment for the whole crew!, Augusta"}, {"day": 2, "current_city": "Augusta", "transportation": "-", "breakfast": "Haldiram's, Augusta", "attraction": "Augusta Museum of History, Augusta", "lunch": "Just Kababs, Augusta", "dinner": "KB's Kulfi & Icecream, Augusta", "accommodation": "Perfect Chanukah apartment for the whole crew!, Augusta"}, {"day": 3, "current_city": "from Augusta to Decatur", "transportation": "Self-driving, Duration: 2 hours 19 mins, Distance: 229 km, Cost: 11", "breakfast": "Office Office, Augusta", "attraction": "Augusta Canal National Heritage Area, Augusta", "lunch": "-", "dinner": "Joey's Pizza, Decatur", "accommodation": "Cozy Private Room, Decatur"}, {"day": 4, "current_city": "Decatur", "transportation": "-", "breakfast": "Cafe Coffee Day, Decatur", "attraction": "DeKalb History Center Museum, Decatur", "lunch": "Dawat-E-Chaman, Decatur", "dinner": "Carnatic Cafe, Decatur", "accommodation": "Cozy Private Room, Decatur"}, {"day": 5, "current_city": "from Decatur to Atlanta", "transportation": "Self-driving, Duration: 19 mins, Distance: 13.0 km, Cost: 0", "breakfast": "Hwealthcafe, Decatur", "attraction": "Atlanta Botanical Garden, Atlanta", "lunch": "Asian Bistro, Atlanta", "dinner": "Chef Style, Atlanta", "accommodation": "Fantastic Room in Bushwick, Atlanta"}, {"day": 6, "current_city": "Atlanta", "transportation": "-", "breakfast": "Saffron, Atlanta", "attraction": "Georgia Aquarium, Atlanta", "lunch": "Pizza Central, Atlanta", "dinner": "Daawat-e-Kashmir, Atlanta", "accommodation": "Fantastic Room in Bushwick, Atlanta"}, {"day": 7, "current_city": "from Atlanta to Akron", "transportation": "Self-driving, Duration: 10 hours 10 mins, Distance: 1114 km, Cost: 55", "breakfast": "Adda, Atlanta", "attraction": "-", "lunch": "-", "dinner": "-", "accommodation": "-"}]}]