[{"gpt-4-1106-preview_direct_sole-planning_results": "Travel Plan:\nDays: 1,\nCurrent City: from Chicago to Albuquerque,\nTransportation: Flight Number: F4005732, from Chicago to Albuquerque, Departure Time: 08:23, Arrival Time: 10:14, cost: 260\nBreakfast: -,\nAttraction: -,\nLunch: Thatcher's Barbeque and Grill, Albuquerque, cost: 30, cuisines: \u201cSeafood, BBQ, Desserts, Fast Food\u201d\nDinner: Punjab Grill, Albuquerque, cost: 26, cuisines: \u201cDesserts, Cafe, Italian, Bakery, Chinese, Seafood\u201d\nAccommodation: Luxury 1BD 1.5 Bath In UES in NYC, Albuquerque, cost: 185, maximum occupancy: 2, house rules: No visitors & No smoking, minimum nights: 2\n\nNumber of people = 3\nTotal cost = (260 * 3) + (30 + 26) * 3 + 185 * 2 = 1,173\nAccommodation minimum nights: 1/2\n\nDays: 2,\nCurrent City: Albuquerque,\nTransportation: -,\nBreakfast: Cantina Famiglia Mancini, Albuquerque, cost: 40, cuisines: \u201cTea, Cafe, Desserts\u201d\nAttraction: Petroglyph National Monument, Albuquerque; Sandia Peak Tramway, Albuquerque;,\nLunch: Genghis Grill, Albuquerque, cost: 24, cuisines: \u201cBBQ, Desserts, Italian\u201d\nDinner: Barbeque Nation, Albuquerque, cost: 85, cuisines: \u201cBakery, BBQ, Desserts\u201d\nAccommodation: Luxury 1BD 1.5 Bath In UES in NYC, Albuquerque, cost: 185, maximum occupancy: 2, house rules: No visitors & No smoking, minimum nights: 2\n\nNumber of people = 3\nTotal cost = (40 + 24 + 85) * 3 + 185 * 2 = 1,012\nAccommodation minimum nights: 2/2\n\nDays: 3,\nCurrent City: from Albuquerque to Chicago,\nTransportation: Flight Number: F3603308, from Albuquerque to Chicago, Departure Time: 05:41, Arrival Time: 09:35, cost: 371\nBreakfast: -,\nAttraction: -,\nLunch: -,\nDinner: -,\nAccommodation: -\n\nNumber of people = 3\nTotal cost = 371 * 3 = 1,113\n\nTotal cost across all days = 1,173 + 1,012 + 1,113 = 3,298\n\nUnfortunately, the total cost exceeds the specified budget of $1,600. To adjust the plan to fit the budget, we can consider alternative transportation or accommodation options. Here's a revised plan:\n\nRevised Travel Plan:\nDays: 1,\nCurrent City: from Chicago to Albuquerque,\nTransportation: Self-driving, from Chicago to Albuquerque, duration: 19 hours 20 mins, distance: 2,153 km, cost: 107\nBreakfast: -,\nAttraction: -,\nLunch: -,\nDinner: Thatcher's Barbeque and Grill, Albuquerque, cost: 30, cuisines: \u201cSeafood, BBQ, Desserts, Fast Food\u201d\nAccommodation: Harlem apartment, Albuquerque, cost: 133, maximum occupancy: 1, house rules: No pets, minimum nights: 1\n\nNumber of people = 3\nTotal cost = 107 + (30 * 3) + 133 * 3 = 596\n\nDays: 2,\nCurrent City: Albuquerque,\nTransportation: -,\nBreakfast: Cantina Famiglia Mancini, Albuquerque, cost: 40, cuisines: \u201cTea, Cafe, Desserts\u201d\nAttraction: Petroglyph National Monument, Albuquerque; Sandia Peak Tramway, Albuquerque;,\nLunch: Genghis Grill, Albuquerque, cost: 24, cuisines: \u201cBBQ, Desserts, Italian\u201d\nDinner: Punjab Grill, Albuquerque, cost: 26, cuisines: \u201cDesserts, Cafe, Italian, Bakery, Chinese, Seafood\u201d\nAccommodation: Harlem apartment, Albuquerque, cost: 133, maximum occupancy: 1, house rules: No pets, minimum nights: 1\n\nNumber of people = 3\nTotal cost = (40 + 24 + 26) * 3 + 133 * 3 = 656\n\nDays: 3,\nCurrent City: from Albuquerque to Chicago,\nTransportation: Self-driving, from Albuquerque to Chicago, duration: 19 hours 20 mins, distance: 2,151 km, cost: 107\nBreakfast: -,\nAttraction: -,\nLunch: -,\nDinner: -,\nAccommodation: -\n\nNumber of people = 3\nTotal cost = 107 * 3 = 321\n\nTotal cost across all days = 596 + 656 + 321 = 1,573\n\nThe revised plan fits within the budget of $1,600.", "gpt-4-1106-preview_direct_sole-planning_parsed_results": [{"day": 1, "current_city": "from Chicago to Albuquerque", "transportation": "Flight Number: F4005732, from Chicago to Albuquerque, Departure Time: 08:23, Arrival Time: 10:14", "breakfast": "-", "attraction": "Petroglyph National Monument, Albuquerque;", "lunch": "Cantina Famiglia Mancini, Albuquerque", "dinner": "Thatcher's Barbeque and Grill, Albuquerque", "accommodation": "Harlem apartment, Albuquerque"}, {"day": 2, "current_city": "Albuquerque", "transportation": "-", "breakfast": "Gung The Palace, Albuquerque", "attraction": "Albuquerque Museum, Albuquerque;", "lunch": "Punjab Grill, Albuquerque", "dinner": "Genghis Grill, Albuquerque", "accommodation": "Harlem apartment, Albuquerque"}, {"day": 3, "current_city": "from Albuquerque to Chicago", "transportation": "Flight Number: F3825798, from Albuquerque to Chicago, Departure Time: 12:38, Arrival Time: 16:29", "breakfast": "D'Casa, Albuquerque", "attraction": "Explora Science Center and Children's Museum of Albuquerque, Albuquerque;", "lunch": "-", "dinner": "-", "accommodation": "-"}]}]