[{"gpt-4-1106-preview_direct_sole-planning_results": "Travel Plan:\n\nDay 1: March 25, 2022\nCurrent City: from Salt Lake City to San Diego\nTransportation: Flight Number: F3499966, from Salt Lake City to San Diego, Departure Time: 08:02, Arrival Time: 08:55\nBreakfast: -\nAttraction: Cabrillo National Monument, San Diego\nLunch: Open Yard, San Diego\nDinner: Jetha Lal Ka Dhabha, San Diego\nAccommodation: Spacious Room in Large 2 Bedroom Prewar Apartment, San Diego\n\nDay 2: March 26, 2022\nCurrent City: San Diego\nTransportation: -\nBreakfast: The Lost Mughal, San Diego\nAttraction: SeaWorld San Diego; Old Town San Diego\nLunch: Burger King, San Diego\nDinner: Bikaner Sweets, San Diego\nAccommodation: Spacious Room in Large 2 Bedroom Prewar Apartment, San Diego\n\nDay 3: March 27, 2022\nCurrent City: from San Diego to San Luis Obispo\nTransportation: Flight Number: F3820181, from San Diego to San Luis Obispo, Departure Time: 09:59, Arrival Time: 11:02\nBreakfast: -\nAttraction: San Luis Obispo Children's Museum; Mission Plaza\nLunch: Ooma, San Luis Obispo\nDinner: Sushi Leblon, San Luis Obispo\nAccommodation: Upper West Side 1 bedroom, San Luis Obispo\n\nDay 4: March 28, 2022\nCurrent City: San Luis Obispo\nTransportation: -\nBreakfast: El Jalisciense Mexican Restaurant, San Luis Obispo\nAttraction: San Luis Obispo Railroad Museum; The Dorn Pyramid\nLunch: Da Pizza Zone, San Luis Obispo\nDinner: Crust N Cakes, San Luis Obispo\nAccommodation: Upper West Side 1 bedroom, San Luis Obispo\n\nDay 5: March 29, 2022\nCurrent City: from San Luis Obispo to Los Angeles\nTransportation: Flight Number: F3854130, from San Luis Obispo to Los Angeles, Departure Time: 05:53, Arrival Time: 06:55\nBreakfast: -\nAttraction: Santa Monica Pier; Hollywood Walk of Fame\nLunch: Heat - Edsa Shangri-La, Los Angeles\nDinner: Palmshore, Los Angeles\nAccommodation: Sunny apartment with easy connections to anywhere., Los Angeles\n\nDay 6: March 30, 2022\nCurrent City: Los Angeles\nTransportation: -\nBreakfast: Punjabi Zaika, Los Angeles\nAttraction: Griffith Park; The Getty\nLunch: The Hangout by 1861, Los Angeles\nDinner: Chicken Minar, Los Angeles\nAccommodation: Sunny apartment with easy connections to anywhere., Los Angeles\n\nDay 7: March 31, 2022\nCurrent City: from Los Angeles to Salt Lake City\nTransportation: Flight Number: F3528613, from Los Angeles to Salt Lake City, Departure Time: 11:14, Arrival Time: 13:55\nBreakfast: Choco Kraft, Los Angeles\nAttraction: Universal Studios Hollywood (before departure)\nLunch: -\nDinner: -\nAccommodation: -\n\nNote: The plan includes only private room accommodations where smoking is permitted, and no self-driving options were selected. The total cost of flights, accommodations, and estimated meal costs should be within the $4,600 budget for 2 people. Please confirm the availability and current prices of flights and accommodations, as well as the smoking policy at the time of booking, as this information is based on the provided data and may have changed.", "gpt-4-1106-preview_direct_sole-planning_parsed_results": [{"day": 1, "current_city": "from Salt Lake City to San Diego", "transportation": "Flight Number: F3499966, from Salt Lake City to San Diego, Departure Time: 08:02, Arrival Time: 08:55", "breakfast": "-", "attraction": "Cabrillo National Monument, San Diego;", "lunch": "Open Yard, San Diego", "dinner": "Jetha Lal Ka Dhabha, San Diego", "accommodation": "Spacious Room in Large 2 Bedroom Prewar Apartment, San Diego"}, {"day": 2, "current_city": "San Diego", "transportation": "-", "breakfast": "The Lost Mughal, San Diego", "attraction": "SeaWorld San Diego;Old Town San Diego;", "lunch": "Burger King, San Diego", "dinner": "Bikaner Sweets, San Diego", "accommodation": "Spacious Room in Large 2 Bedroom Prewar Apartment, San Diego"}, {"day": 3, "current_city": "from San Diego to San Luis Obispo", "transportation": "Flight Number: F3820181, from San Diego to San Luis Obispo, Departure Time: 09:59, Arrival Time: 11:02", "breakfast": "-", "attraction": "San Luis Obispo Children's Museum;Mission Plaza;", "lunch": "Ooma, San Luis Obispo", "dinner": "Sushi Leblon, San Luis Obispo", "accommodation": "Upper West Side 1 bedroom, San Luis Obispo"}, {"day": 4, "current_city": "San Luis Obispo", "transportation": "-", "breakfast": "El Jalisciense Mexican Restaurant, San Luis Obispo", "attraction": "San Luis Obispo Railroad Museum;The Dorn Pyramid;", "lunch": "Da Pizza Zone, San Luis Obispo", "dinner": "Crust N Cakes, San Luis Obispo", "accommodation": "Upper West Side 1 bedroom, San Luis Obispo"}, {"day": 5, "current_city": "from San Luis Obispo to Los Angeles", "transportation": "Flight Number: F3854130, from San Luis Obispo to Los Angeles, Departure Time: 05:53, Arrival Time: 06:55", "breakfast": "-", "attraction": "Santa Monica Pier;Hollywood Walk of Fame;", "lunch": "Heat - Edsa Shangri-La, Los Angeles", "dinner": "Palmshore, Los Angeles", "accommodation": "Sunny apartment with easy connections to anywhere., Los Angeles"}, {"day": 6, "current_city": "Los Angeles", "transportation": "-", "breakfast": "Punjabi Zaika, Los Angeles", "attraction": "Griffith Park;The Getty;", "lunch": "The Hangout by 1861, Los Angeles", "dinner": "Chicken Minar, Los Angeles", "accommodation": "Sunny apartment with easy connections to anywhere., Los Angeles"}, {"day": 7, "current_city": "from Los Angeles to Salt Lake City", "transportation": "Flight Number: F3528613, from Los Angeles to Salt Lake City, Departure Time: 11:14, Arrival Time: 13:55", "breakfast": "Choco Kraft, Los Angeles", "attraction": "Universal Studios Hollywood;", "lunch": "-", "dinner": "-", "accommodation": "-"}]}]