[{"gpt-4-1106-preview_direct_sole-planning_results": "Travel Plan:\n\nDay 1: March 18, 2022\nCurrent City: from Lexington to Dallas\nTransportation: Flight Number: F3600281, from Lexington to Dallas, Departure Time: 05:53, Arrival Time: 07:27\nBreakfast: -\nAttraction: The Dallas World Aquarium, Dallas\nLunch: Coconuts Fish Cafe, Dallas\nAttraction: The Sixth Floor Museum at Dealey Plaza, Dallas\nDinner: 1918 Bistro & Grill, Dallas\nAccommodation: Luxury Williamsburg duplex, private roof terrace, Dallas\n\nDay 2: March 19, 2022\nCurrent City: Dallas\nTransportation: -\nBreakfast: Yanki Sizzlers, Dallas\nAttraction: Reunion Tower, Dallas; Dallas Museum of Art, Dallas\nLunch: Aravali Owls, Dallas\nAttraction: The Dallas Arboretum and Botanical Garden, Dallas\nDinner: Kebab Xpress, Dallas\nAccommodation: Luxury Williamsburg duplex, private roof terrace, Dallas\n\nDay 3: March 20, 2022\nCurrent City: from Dallas to San Angelo\nTransportation: Flight Number: F3608910, from Dallas to San Angelo, Departure Time: 12:39, Arrival Time: 13:40\nBreakfast: Haldiram's, Dallas\nAttraction: San Angelo Museum of Fine Arts, San Angelo\nLunch: DePalma's Italian Cafe - Downtown, San Angelo\nAttraction: Fort Concho National Historic Landmark, San Angelo\nDinner: Chinese Food, San Angelo\nAccommodation: INCREDIBLE TOWNHOUSE 4 STORIES 5 BEDROOMS 3 BATH, San Angelo\n\nDay 4: March 21, 2022\nCurrent City: San Angelo\nTransportation: -\nBreakfast: Needs Gourmet, San Angelo\nAttraction: San Angelo State Park, San Angelo; Railway Museum of San Angelo, San Angelo\nLunch: 6 Ballygunge Place, San Angelo\nAttraction: Miss Hattie's Bordello Museum, San Angelo\nDinner: District 6, San Angelo\nAccommodation: INCREDIBLE TOWNHOUSE 4 STORIES 5 BEDROOMS 3 BATH, San Angelo\n\nDay 5: March 22, 2022\nCurrent City: from San Angelo to Houston\nTransportation: Self-driving, duration: 5 hours 46 mins, distance: 586 km, cost: 29\nBreakfast: Break Fast Point, San Angelo\nAttraction: Downtown Aquarium, Houston\nLunch: Jalapenos, Houston\nAttraction: Space Center Houston, Houston\nDinner: Super Bakery, Houston\nAccommodation: Sunny and Airy near Manhattan, Houston\n\nDay 6: March 23, 2022\nCurrent City: Houston\nTransportation: -\nBreakfast: Sheetla Dhaba, Houston\nAttraction: Water Wall, Houston; Houston Museum of Natural Science, Houston\nLunch: Royal Mart, Houston\nAttraction: Houston Zoo, Houston\nDinner: Matchbox, Houston\nAccommodation: Sunny and Airy near Manhattan, Houston\n\nDay 7: March 24, 2022\nCurrent City: from Houston to Lexington\nTransportation: Self-driving, duration: 14 hours 57 mins, distance: 1,592 km, cost: 79\nBreakfast: Earthen Spices, Houston\nAttraction: The Museum of Fine Arts, Houston\nLunch: Chawla's\u5b8a, Houston\nDinner: -\nAccommodation: -\n\nPlease note that the travel plan does not include specific times for attractions, meals, and accommodations check-in/check-out, as these details were not provided. It is recommended to verify the opening hours of attractions and restaurants, as well as the check-in/check-out times of accommodations, and adjust the plan accordingly. Additionally, the cost of meals, attractions, and other incidental expenses are not included in the plan and should be considered within the overall budget.", "gpt-4-1106-preview_direct_sole-planning_parsed_results": [{"day": 1, "current_city": "from Lexington to Dallas", "transportation": "Flight Number: F3600281, from Lexington to Dallas, Departure Time: 05:53, Arrival Time: 07:27", "breakfast": "-", "attraction": "The Dallas World Aquarium, Dallas;The Sixth Floor Museum at Dealey Plaza, Dallas;", "lunch": "Coconuts Fish Cafe, Dallas", "dinner": "1918 Bistro & Grill, Dallas", "accommodation": "Luxury Williamsburg duplex, private roof terrace, Dallas"}, {"day": 2, "current_city": "Dallas", "transportation": "-", "breakfast": "Yanki Sizzlers, Dallas", "attraction": "Reunion Tower, Dallas;Dallas Museum of Art, Dallas;The Dallas Arboretum and Botanical Garden, Dallas;", "lunch": "Aravali Owls, Dallas", "dinner": "Kebab Xpress, Dallas", "accommodation": "Luxury Williamsburg duplex, private roof terrace, Dallas"}, {"day": 3, "current_city": "from Dallas to San Angelo", "transportation": "Flight Number: F3608910, from Dallas to San Angelo, Departure Time: 12:39, Arrival Time: 13:40", "breakfast": "Haldiram's, Dallas", "attraction": "San Angelo Museum of Fine Arts, San Angelo;Fort Concho National Historic Landmark, San Angelo;", "lunch": "DePalma's Italian Cafe - Downtown, San Angelo", "dinner": "Chinese Food, San Angelo", "accommodation": "INCREDIBLE TOWNHOUSE 4 STORIES 5 BEDROOMS 3 BATH, San Angelo"}, {"day": 4, "current_city": "San Angelo", "transportation": "-", "breakfast": "Needs Gourmet, San Angelo", "attraction": "San Angelo State Park, San Angelo;Railway Museum of San Angelo, San Angelo;Miss Hattie's Bordello Museum, San Angelo;", "lunch": "6 Ballygunge Place, San Angelo", "dinner": "District 6, San Angelo", "accommodation": "INCREDIBLE TOWNHOUSE 4 STORIES 5 BEDROOMS 3 BATH, San Angelo"}, {"day": 5, "current_city": "from San Angelo to Houston", "transportation": "Self-driving, Duration: 5 hours 46 mins, Distance: 586 km, Cost: 29", "breakfast": "Break Fast Point, San Angelo", "attraction": "Downtown Aquarium, Houston;Space Center Houston, Houston;", "lunch": "Jalapenos, Houston", "dinner": "Super Bakery, Houston", "accommodation": "Sunny and Airy near Manhattan, Houston"}, {"day": 6, "current_city": "Houston", "transportation": "-", "breakfast": "Sheetla Dhaba, Houston", "attraction": "Water Wall, Houston;Houston Museum of Natural Science, Houston;Houston Zoo, Houston;", "lunch": "Royal Mart, Houston", "dinner": "Matchbox, Houston", "accommodation": "Sunny and Airy near Manhattan, Houston"}, {"day": 7, "current_city": "from Houston to Lexington", "transportation": "Self-driving, Duration: 14 hours 57 mins, Distance: 1,592 km, Cost: 79", "breakfast": "Earthen Spices, Houston", "attraction": "The Museum of Fine Arts, Houston", "lunch": "Chawla's\u5b8a, Houston", "dinner": "-", "accommodation": "-"}]}]