[{"gpt-4-1106-preview_direct_sole-planning_results": "Travel Plan:\n\nDay 1: Cedar Rapids to Dallas (Texas)\n- Transportation: Taxi, from Cedar Rapids to Dallas, duration: 12 hours 26 mins, distance: 1,324 km, cost: $1,324\n- Breakfast: -\n- Attraction: -\n- Lunch: -\n- Dinner: Coconuts Fish Cafe, Dallas (Texas), cost: $38, cuisines: \u201cCafe, BBQ, Mediterranean, Fast Food\u201d\n- Accommodation: Luxury Williamsburg duplex, private roof terrace, Dallas (Texas), cost: $241, maximum occupancy: 3, house rules: No visitors, minimum nights: 4\n\nNumber of people = 2\nTotal cost = $1,324 + ($38 * 2) + $241 = $1,641\nAccommodation minimum nights: 1/4\n\nDay 2: Dallas (Texas)\n- Transportation: -\n- Breakfast: Cafe Gatherings, Dallas (Texas), cost: $17, cuisines: \u201cBakery, Indian, Desserts\u201d\n- Attraction: The Dallas World Aquarium, Dallas (Texas); The Sixth Floor Museum at Dealey Plaza, Dallas (Texas)\n- Lunch: 1918 Bistro & Grill, Dallas (Texas), cost: $90, cuisines: \u201cTea, Pizza, BBQ, Seafood\u201d\n- Dinner: Yanki Sizzlers, Dallas (Texas), cost: $96, cuisines: \u201cCafe, French, Tea, Mediterranean\u201d\n- Accommodation: Luxury Williamsburg duplex, private roof terrace, Dallas (Texas), cost: $241, maximum occupancy: 3, house rules: No visitors, minimum nights: 4\n\nNumber of people = 2\nTotal cost = ($17 + $90 + $96) * 2 + $241 = $747\nAccommodation minimum nights: 2/4\n\nDay 3: Dallas to Austin (Texas)\n- Transportation: Self-driving, from Dallas to Austin, duration: 2 hours 53 mins, distance: 314 km, cost: $15\n- Breakfast: -\n- Attraction: Texas Capitol, Austin (Texas); Zilker Metropolitan Park, Austin (Texas)\n- Lunch: The Kasbah, Austin (Texas), cost: $88, cuisines: \u201cCafe, Pizza, BBQ, Fast Food\u201d\n- Dinner: Mehfil-e-Handi, Austin (Texas), cost: $96, cuisines: \u201cDesserts, Tea, Bakery, American, Seafood\u201d\n- Accommodation: Cozy room in south Harlem - 10 mins to Columbia, Austin (Texas), cost: $564, maximum occupancy: 2, house rules: No visitors & No children under 10, minimum nights: 1\n\nNumber of people = 2\nTotal cost = $15 + ($88 + $96) * 2 + $564 = $947\nAccommodation minimum nights: 1/1\n\nDay 4: Austin (Texas)\n- Transportation: -\n- Breakfast: Wildflour Cafe + Bakery, Austin (Texas), cost: $55, cuisines: \u201cDesserts, French, Bakery, BBQ, Seafood\u201d\n- Attraction: Museum of the Weird, Austin (Texas); Cathedral of Junk, Austin (Texas)\n- Lunch: Tandoori Nights, Austin (Texas), cost: $26, cuisines: \u201cPizza, Italian, BBQ, Indian, Seafood\u201d\n- Dinner: Cup-a-licious, Austin (Texas), cost: $85, cuisines: \u201cFast Food, Chinese, BBQ, Italian\u201d\n- Accommodation: Cozy room in south Harlem - 10 mins to Columbia, Austin (Texas), cost: $564, maximum occupancy: 2, house rules: No visitors & No children under 10, minimum nights: 1\n\nNumber of people = 2\nTotal cost = ($55 + $26 + $85) * 2 + $564 = $896\nAccommodation minimum nights: 2/1\n\nDay 5: Austin to Cedar Rapids\n- Transportation: Taxi, from Austin to Cedar Rapids, duration: 15 hours 5 mins, distance: 1,695 km, cost: $1,695\n- Breakfast: -\n- Attraction: -\n- Lunch: -\n- Dinner: -\n- Accommodation: -\n\nNumber of people = 2\nTotal cost = $1,695 * 2 = $3,390\n\nTotal cost across all days = $1,641 + $747 + $947 + $896 + $3,390 = $7,621\n\nUnfortunately, the total cost of the travel plan exceeds the specified budget of $2,400. Adjustments need to be made to ensure the total cost does not exceed the budget. However, given the high cost of taxi transportation and the constraint of not using flights, it is not feasible to create a travel plan within the specified budget while also meeting all other requirements.", "gpt-4-1106-preview_direct_sole-planning_parsed_results": [{"day": 1, "current_city": "from Cedar Rapids to Dallas", "transportation": "Self-driving, from Cedar Rapids to Dallas, Duration: 12 hours 26 mins, Distance: 1,324 km", "breakfast": "-", "attraction": "-", "lunch": "-", "dinner": "Coconuts Fish Cafe, Dallas", "accommodation": "Luxury Williamsburg duplex, private roof terrace, Dallas"}, {"day": 2, "current_city": "Dallas", "transportation": "-", "breakfast": "Cafe Gatherings, Dallas", "attraction": "The Dallas World Aquarium, Dallas", "lunch": "Aravali Owls, Dallas", "dinner": "Kebab Xpress, Dallas", "accommodation": "Luxury Williamsburg duplex, private roof terrace, Dallas"}, {"day": 3, "current_city": "from Dallas to Austin", "transportation": "Self-driving, from Dallas to Austin, Duration: 2 hours 53 mins, Distance: 314 km", "breakfast": "Cafe Coffee Day, Dallas", "attraction": "Texas Capitol, Austin", "lunch": "Wildflour Cafe + Bakery, Austin", "dinner": "The Kasbah, Austin", "accommodation": "Cozy room in south Harlem - 10 mins to Columbia, Austin"}, {"day": 4, "current_city": "Austin", "transportation": "-", "breakfast": "Moksha, Austin", "attraction": "Zilker Metropolitan Park, Austin", "lunch": "Mehfil-e-Handi, Austin", "dinner": "Tandoori Nights, Austin", "accommodation": "Cozy room in south Harlem - 10 mins to Columbia, Austin"}, {"day": 5, "current_city": "from Austin to Cedar Rapids", "transportation": "Self-driving, from Austin to Cedar Rapids, Duration: 15 hours 5 mins, Distance: 1,695 km", "breakfast": "-", "attraction": "-", "lunch": "-", "dinner": "-", "accommodation": "-"}]}]