[{"gpt-4-1106-preview_direct_sole-planning_results": "Travel Plan:\n\nDays: 1,\nCurrent City: from Omaha to Traverse City (Michigan),\nTransportation: Self-driving, from Omaha to Traverse City, duration: 11 hours 25 mins, distance: 1,240 km, cost: 62\nBreakfast: -,\nAttraction: -,\nLunch: -,\nDinner: Famous Dave's, Traverse City (Michigan), cost: 39, cuisines: \u201cDesserts, Italian, BBQ, Fast Food, Indian\u201d\nAccommodation: One bedroom apartment in NoLita, Traverse City (Michigan), cost: 172, room type: Entire home/apt, house rules: No children under 10 & No pets, minimum nights: 1, maximum occupancy: 2\n\nNumber of people = 3\nTotal cost = 62 * 3 + 39 * 3 + 172 = 615\nAccommodation minimum nights: 1/1\n\nDays: 2,\nCurrent City: Traverse City (Michigan),\nTransportation: -,\nBreakfast: Daily Eats, Traverse City (Michigan), cost: 44, cuisines: \u201cDesserts, Seafood\u201d\nAttraction: Clinch Park, Traverse City (Michigan); Great Lakes Children's Museum, Traverse City (Michigan);\nLunch: Arigato Sushi, Traverse City (Michigan), cost: 96, cuisines: \u201cDesserts, Mexican, Bakery, BBQ, Fast Food, Mediterranean\u201d\nDinner: Tasty Bites, Traverse City (Michigan), cost: 27, cuisines: \u201cChinese, Bakery, Desserts, Seafood\u201d\nAccommodation: One bedroom apartment in NoLita, Traverse City (Michigan), cost: 172, room type: Entire home/apt, house rules: No children under 10 & No pets, minimum nights: 1, maximum occupancy: 2\n\nNumber of people = 3\nTotal cost = (44 + 96 + 27) * 3 + 172 = 707\nAccommodation minimum nights: 2/1\n\nDays: 3,\nCurrent City: from Traverse City (Michigan) to Alpena (Michigan),\nTransportation: Self-driving, from Traverse City to Alpena, duration: 2 hours 29 mins, distance: 204 km, cost: 10\nBreakfast: -,\nAttraction: Great Lakes Maritime Heritage Center, Alpena (Michigan); Besser Museum for Northeast Michigan, Alpena (Michigan);\nLunch: @Mango, Alpena (Michigan), cost: 38, cuisines: \u201cBBQ, Cafe, American, Desserts\u201d\nDinner: Maplai, Alpena (Michigan), cost: 63, cuisines: \u201cTea, Indian, Bakery, Fast Food, American\u201d\nAccommodation: CHEERFUL RM IN BROOKLYN! EASY ACCESS TO TRAIN! R3, Alpena (Michigan), cost: 927, room type: Private room, house rules: No pets, minimum nights: 15, maximum occupancy: 2\n\nNumber of people = 3\nTotal cost = 10 * 3 + (38 + 63) * 3 + 927 = 1,380\nAccommodation minimum nights: 1/15\n\nDays: 4,\nCurrent City: Alpena (Michigan),\nTransportation: -,\nBreakfast: Shudh Restaurant, Alpena (Michigan), cost: 56, cuisines: \u201cCafe, BBQ, Fast Food\u201d\nAttraction: Mich-e-ke-wis Park, Alpena (Michigan); Island Park, Alpena (Michigan);\nLunch: Kylin Express, Alpena (Michigan), cost: 30, cuisines: \u201cChinese, Bakery, BBQ, Seafood\u201d\nDinner: Jain Chawal Wale, Alpena (Michigan), cost: 20, cuisines: \u201cDesserts, Pizza, Italian, Mexican, Cafe\u201d\nAccommodation: CHEERFUL RM IN BROOKLYN! EASY ACCESS TO TRAIN! R3, Alpena (Michigan), cost: 927, room type: Private room, house rules: No pets, minimum nights: 15, maximum occupancy: 2\n\nNumber of people = 3\nTotal cost = (56 + 30 + 20) * 3 + 927 = 1,227\nAccommodation minimum nights: 2/15\n\nDays: 5,\nCurrent City: from Alpena (Michigan) to Omaha,\nTransportation: Self-driving, from Alpena to Omaha, duration: 12 hours 59 mins, distance: 1,391 km, cost: 69\nBreakfast: -,\nAttraction: -,\nLunch: -,\nDinner: -,\nAccommodation: -\n\nNumber of people = 3\nTotal cost = 69 * 3 = 207\n\nTotal cost across all days = 615 + 707 + 1,380 + 1,227 + 207 = 4,136\n\nCuisines: The plan includes a variety of cuisines, with a focus on American, BBQ, and Fast Food, which are available in the selected restaurants.\n\nNote: The accommodation in Alpena has a minimum stay of 15 nights, which is not ideal for a 5-day trip. However, due to the lack of other options provided in the reference information, this accommodation was selected. The actual booking should seek an alternative that allows for shorter stays. Additionally, the accommodation in Traverse City has a maximum occupancy of 2, but since the party is of 3, an additional room or alternative accommodation should be considered to comply with this requirement. The travel plan stays within the budget of $7,500.", "gpt-4-1106-preview_direct_sole-planning_parsed_results": [{"day": 1, "current_city": "from Omaha to Traverse City", "transportation": "Self-driving, from Omaha to Traverse City, duration: 11 hours 25 mins, distance: 1,240 km", "breakfast": "-", "attraction": "-", "lunch": "-", "dinner": "Famous Dave's, Traverse City", "accommodation": "One bedroom apartment in NoLita, Traverse City"}, {"day": 2, "current_city": "Traverse City", "transportation": "-", "breakfast": "Daily Eats, Traverse City", "attraction": "Clinch Park, Traverse City;Great Lakes Children's Museum, Traverse City;", "lunch": "Arigato Sushi, Traverse City", "dinner": "Tasty Bites, Traverse City", "accommodation": "One bedroom apartment in NoLita, Traverse City"}, {"day": 3, "current_city": "from Traverse City to Alpena", "transportation": "Self-driving, from Traverse City to Alpena, duration: 2 hours 29 mins, distance: 204 km", "breakfast": "-", "attraction": "Great Lakes Maritime Heritage Center, Alpena;Besser Museum for Northeast Michigan, Alpena;", "lunch": "@Mango, Alpena", "dinner": "Maplai, Alpena", "accommodation": "CHEERFUL RM IN BROOKLYN! EASY ACCESS TO TRAIN! R3, Alpena"}, {"day": 4, "current_city": "Alpena", "transportation": "-", "breakfast": "Shudh Restaurant, Alpena", "attraction": "Mich-e-ke-wis Park, Alpena;Island Park, Alpena;", "lunch": "Kylin Express, Alpena", "dinner": "Jain Chawal Wale, Alpena", "accommodation": "CHEERFUL RM IN BROOKLYN! EASY ACCESS TO TRAIN! R3, Alpena"}, {"day": 5, "current_city": "from Alpena to Omaha", "transportation": "Self-driving, from Alpena to Omaha, duration: 12 hours 59 mins, distance: 1,391 km", "breakfast": "-", "attraction": "-", "lunch": "-", "dinner": "-", "accommodation": "-"}]}]