[{"gpt-4-1106-preview_direct_sole-planning_results": "Travel Plan:\n\nDay 1: March 18, 2022\nCurrent City: from La Crosse to Moline\nTransportation: Self-driving, Duration: 3 hours 34 mins, Distance: 310 km, Cost: $15\nBreakfast: -\nAttraction: John Deere Pavilion, Moline\nLunch: Royal Hotel, Moline\nDinner: Zoe, Moline\nAccommodation: Sunny duplex near Central Park, Moline (Entire home/apt suitable for children under 10)\n\nDay 2: March 19, 2022\nCurrent City: Moline\nTransportation: -\nBreakfast: Lovecrumbs Bakery, Moline\nAttraction: Sylvan Island, Moline; Ben Butterworth Parkway, Moline\nLunch: Mummy's Kitchen, Moline\nDinner: The Bar - Trident Gurgaon, Moline\nAccommodation: Sunny duplex near Central Park, Moline (Entire home/apt suitable for children under 10)\n\nDay 3: March 20, 2022\nCurrent City: from Moline to Rockford\nTransportation: Self-driving, Duration: 2 hours 1 min, Distance: 194 km, Cost: $9\nBreakfast: -\nAttraction: Anderson Japanese Gardens, Rockford\nLunch: Flying Mango, Rockford\nDinner: Coco Bambu, Rockford\nAccommodation: Park Side Zen Home - Terrace & next to CentralPark, Rockford (Entire home/apt suitable for children under 10)\n\nDay 4: March 21, 2022\nCurrent City: Rockford\nTransportation: -\nBreakfast: Eggspectation - Jaypee Vasant Continental, Rockford\nAttraction: Discovery Center Museum, Rockford; Burpee Museum of Natural History, Rockford\nLunch: Cafe Southall, Rockford\nDinner: Aroma Rest O Bar, Rockford\nAccommodation: Park Side Zen Home - Terrace & next to CentralPark, Rockford (Entire home/apt suitable for children under 10)\n\nDay 5: March 22, 2022\nCurrent City: from Rockford to Belleville\nTransportation: Self-driving, Duration: 4 hours 29 mins, Distance: 470 km, Cost: $23\nBreakfast: -\nAttraction: National Shrine of Our Lady of the Snows, Belleville\nLunch: Cafe Amaretto, Belleville\nDinner: Asian Haus, Belleville\nAccommodation: Historic Manhattan Home to make your stay special!, Belleville (Entire home/apt suitable for children under 10)\n\nDay 6: March 23, 2022\nCurrent City: Belleville\nTransportation: -\nBreakfast: Fuji Japanese Steak House, Belleville\nAttraction: Labor & Industrial Museum, Belleville; St. Clair County Historical Society, Belleville\nLunch: Shanghai Cafe, Belleville\nDinner: Cafe Terazza, Belleville\nAccommodation: Historic Manhattan Home to make your stay special!, Belleville (Entire home/apt suitable for children under 10)\n\nDay 7: March 24, 2022\nCurrent City: from Belleville to La Crosse\nTransportation: Self-driving, Duration: 7 hours 19 mins, Distance: 792 km, Cost: $39\nBreakfast: -\nAttraction: -\nLunch: -\nDinner: -\nAccommodation: -\n\nTotal Estimated Cost: Transportation ($15 + $9 + $23 + $39) + Accommodations (6 nights) + Meals and Attractions\n\nPlease note that the accommodation prices are not provided, and the meal and attraction costs are also not specified. The transportation costs are calculated based on self-driving expenses. The total estimated cost will need to include these factors to ensure it does not exceed the $4,800 budget.", "gpt-4-1106-preview_direct_sole-planning_parsed_results": [{"day": 1, "current_city": "from La Crosse to Moline", "transportation": "Self-driving, Duration: 3 hours 34 mins, Distance: 310 km, Cost: 15", "breakfast": "-", "attraction": "John Deere Pavilion, Moline;", "lunch": "Royal Hotel, Moline", "dinner": "Zoe, Moline", "accommodation": "Sunny duplex near Central Park, Moline"}, {"day": 2, "current_city": "Moline", "transportation": "-", "breakfast": "Lovecrumbs Bakery, Moline", "attraction": "Sylvan Island, Moline;Ben Butterworth Parkway, Moline;", "lunch": "Mummy's Kitchen, Moline", "dinner": "The Bar - Trident Gurgaon, Moline", "accommodation": "Sunny duplex near Central Park, Moline"}, {"day": 3, "current_city": "from Moline to Rockford", "transportation": "Self-driving, Duration: 2 hours 1 min, Distance: 194 km, Cost: 9", "breakfast": "-", "attraction": "Anderson Japanese Gardens, Rockford;", "lunch": "Flying Mango, Rockford", "dinner": "Coco Bambu, Rockford", "accommodation": "Park Side Zen Home - Terrace & next to CentralPark, Rockford"}, {"day": 4, "current_city": "Rockford", "transportation": "-", "breakfast": "Eggspectation - Jaypee Vasant Continental, Rockford", "attraction": "Discovery Center Museum, Rockford;Burpee Museum of Natural History, Rockford;", "lunch": "Cafe Southall, Rockford", "dinner": "Aroma Rest O Bar, Rockford", "accommodation": "Park Side Zen Home - Terrace & next to CentralPark, Rockford"}, {"day": 5, "current_city": "from Rockford to Belleville", "transportation": "Self-driving, Duration: 4 hours 29 mins, Distance: 470 km, Cost: 23", "breakfast": "-", "attraction": "National Shrine of Our Lady of the Snows, Belleville;", "lunch": "Cafe Amaretto, Belleville", "dinner": "Asian Haus, Belleville", "accommodation": "Historic Manhattan Home to make your stay special!, Belleville"}, {"day": 6, "current_city": "Belleville", "transportation": "-", "breakfast": "Fuji Japanese Steak House, Belleville", "attraction": "Labor & Industrial Museum, Belleville;St. Clair County Historical Society, Belleville;", "lunch": "Shanghai Cafe, Belleville", "dinner": "Cafe Terazza, Belleville", "accommodation": "Historic Manhattan Home to make your stay special!, Belleville"}, {"day": 7, "current_city": "from Belleville to La Crosse", "transportation": "Self-driving, Duration: 7 hours 19 mins, Distance: 792 km, Cost: 39", "breakfast": "-", "attraction": "-", "lunch": "-", "dinner": "-", "accommodation": "-"}]}]