[{"gpt-4-1106-preview_direct_sole-planning_results": "Travel Plan:\nDay 1:\nCurrent City: from Omaha to Seattle\nTransportation: Flight Number: F3736891, from Omaha to Seattle, Departure Time: 14:43, Arrival Time: 16:28\nBreakfast: -\nLunch: -\nDinner: Ting's Red Lantern, Seattle\nAccommodation: Large quiet private studio in East Harlem, Seattle\n\nDay 2:\nCurrent City: Seattle\nTransportation: -\nBreakfast: Ceviche Tapas Bar & Restaurant, Seattle\nAttraction: Seattle Aquarium, Seattle; The Seattle Great Wheel, Seattle.\nLunch: Mother Ringlet, Seattle\nDinner: Caf\u6106 Burger BC, Seattle\nAccommodation: Large quiet private studio in East Harlem, Seattle\n\nDay 3:\nCurrent City: from Seattle to Spokane\nTransportation: Flight Number: F3738208, from Seattle to Spokane, Departure Time: 11:28, Arrival Time: 12:38\nBreakfast: The Godinho's, Seattle\nAttraction: Riverfront Park, Spokane; Manito Park, Spokane.\nLunch: Chick-fil-A, Spokane\nDinner: Moon River Brewing Company, Spokane\nAccommodation: Renovated 2 Bedroom Apartment, Spokane\n\nDay 4:\nCurrent City: Spokane\nTransportation: -\nBreakfast: Friends Grille and Bar, Spokane\nAttraction: Numerica SkyRide at Riverfront Spokane, Spokane; Northwest Museum of Arts & Culture, Spokane.\nLunch: Tanishk Gourmet Indian, Spokane\nDinner: A 1 - Snacks and food corner, Spokane\nAccommodation: Renovated 2 Bedroom Apartment, Spokane\n\nDay 5:\nCurrent City: from Spokane to Omaha\nTransportation: Self-driving, from Spokane to Omaha, duration: 20 hours 0 mins, distance: 2,216 km, cost: 110\nBreakfast: Just for Chai, Spokane\nAttraction: -\nLunch: -\nDinner: -\nAccommodation: -", "gpt-4-1106-preview_direct_sole-planning_parsed_results": [{"days": 1, "current_city": "from Omaha to Seattle", "transportation": "Flight Number: F3736891, from Omaha to Seattle, Departure Time: 14:43, Arrival Time: 16:28", "breakfast": "-", "attraction": "-", "lunch": "-", "dinner": "Ting's Red Lantern, Seattle", "accommodation": "Large quiet private studio in East Harlem, Seattle"}, {"days": 2, "current_city": "Seattle", "transportation": "-", "breakfast": "Ceviche Tapas Bar & Restaurant, Seattle", "attraction": "Seattle Aquarium, Seattle;The Seattle Great Wheel, Seattle;", "lunch": "Mother Ringlet, Seattle", "dinner": "Caf\u00e9 Burger BC, Seattle", "accommodation": "Large quiet private studio in East Harlem, Seattle"}, {"days": 3, "current_city": "from Seattle to Spokane", "transportation": "Flight Number: F3738208, from Seattle to Spokane, Departure Time: 11:28, Arrival Time: 12:38", "breakfast": "The Godinho's, Seattle", "attraction": "Riverfront Park, Spokane;Manito Park, Spokane;", "lunch": "Chick-fil-A, Spokane", "dinner": "Moon River Brewing Company, Spokane", "accommodation": "Renovated 2 Bedroom Apartment, Spokane"}, {"days": 4, "current_city": "Spokane", "transportation": "-", "breakfast": "Friends Grille and Bar, Spokane", "attraction": "Numerica SkyRide at Riverfront Spokane, Spokane;Northwest Museum of Arts & Culture, Spokane;", "lunch": "Tanishk Gourmet Indian, Spokane", "dinner": "A 1 - Snacks and food corner, Spokane", "accommodation": "Renovated 2 Bedroom Apartment, Spokane"}, {"days": 5, "current_city": "from Spokane to Omaha", "transportation": "Self-driving, from Spokane to Omaha, duration: 20 hours 0 mins, distance: 2,216 km, Cost: 110", "breakfast": "Just for Chai, Spokane", "attraction": "-", "lunch": "-", "dinner": "-", "accommodation": "-"}]}]