[{"gpt-4-1106-preview_direct_sole-planning_results": "Travel Plan:\n\nDay 1: March 23, 2022\nCurrent City: from Medford to Grand Junction\nTransportation: Self-driving, Duration: 15 hours 49 mins, Distance: 1,640 km, Cost: $82\nBreakfast: -\nLunch: -\nDinner: -\nAccommodation: NYC Apartment near Central Park!, Grand Junction, Price: $1118.0, Room Type: Entire home/apt, Minimum Nights: 3, Maximum Occupancy: 5, Review Rate Number: 5.0\n\nDay 2: March 24, 2022\nCurrent City: Grand Junction\nTransportation: -\nBreakfast: Austin's BBQ and Oyster Bar, Grand Junction, Average Cost: $15\nAttraction: Museum of the West, Museums of Western Colorado, Grand Junction\nLunch: Punjab Da Pind, Grand Junction, Average Cost: $52\nAttraction: Western Colorado Botanical Gardens, Grand Junction\nDinner: 2 Dog, Grand Junction, Average Cost: $29\nAccommodation: NYC Apartment near Central Park!, Grand Junction\n\nDay 3: March 25, 2022\nCurrent City: from Grand Junction to Durango\nTransportation: Self-driving, Duration: 3 hours 33 mins, Distance: 269 km, Cost: $13\nBreakfast: -\nLunch: -\nDinner: -\nAccommodation: Lux 1BR in the heart of NYC Theater district!, Durango, Price: $81.0, Room Type: Entire home/apt, Minimum Nights: 30, Maximum Occupancy: 3, Review Rate Number: 4.0\n\nDay 4: March 26, 2022\nCurrent City: Durango\nTransportation: -\nBreakfast: Samurai Japanese Cuisine & Sushi Bar, Durango, Average Cost: $67\nAttraction: Durango & Silverton Narrow Gauge Railroad, Durango\nLunch: Dub's High on the Hog, Durango, Average Cost: $98\nAttraction: The Powerhouse, Durango\nDinner: Chickenette, Durango, Average Cost: $31\nAccommodation: Lux 1BR in the heart of NYC Theater district!, Durango\n\nDay 5: March 27, 2022\nCurrent City: from Durango to Gunnison\nTransportation: Self-driving, Duration: 3 hours 47 mins, Distance: 275 km, Cost: $13\nBreakfast: -\nLunch: -\nDinner: -\nAccommodation: Full-size loft bed in East Village, Gunnison, Price: $104.0, Room Type: Private room, Minimum Nights: 1, Maximum Occupancy: 1, Review Rate Number: 4.0\n\nDay 6: March 28, 2022\nCurrent City: Gunnison\nTransportation: -\nBreakfast: Happy Joe's Pizza & Ice Cream, Gunnison, Average Cost: $74\nAttraction: Gunnison Pioneer Museum, Gunnison\nLunch: SALT, Gunnison, Average Cost: $44\nAttraction: Hartman Rocks, Gunnison\nDinner: Mocha, Gunnison, Average Cost: $30\nAccommodation: Full-size loft bed in East Village, Gunnison\n\nDay 7: March 29, 2022\nCurrent City: from Gunnison to Medford\nTransportation: Self-driving, Duration: 18 hours 4 mins, Distance: 1,832 km, Cost: $91\nBreakfast: -\nLunch: -\nDinner: -\nAccommodation: -\n\nTotal Estimated Costs:\nAccommodations: $1118 (Grand Junction) + $81 (Durango) + $104 (Gunnison) = $1303\nTransportation: $82 (Medford to Grand Junction) + $13 (Grand Junction to Durango) + $13 (Durango to Gunnison) + $91 (Gunnison to Medford) = $199\nMeals and Attractions: Assuming two meals and one attraction per day at an average cost of $50 per meal and $20 per attraction = $420\nTotal Estimated Cost: $1303 (Accommodations) + $199 (Transportation) + $420 (Meals and Attractions) = $1922\n\nRemaining Budget: $2400 - $1922 = $478\n\nNote: The remaining budget can be used for additional meals, attractions, or unforeseen expenses. The accommodation in Durango has a minimum stay of 30 nights, which is not suitable for this trip, but no other options were provided. The traveler should look for alternative accommodation in Durango. The prices for meals are average costs and may vary. Attractions were chosen based on proximity and interest; entry fees (if any) are estimated.", "gpt-4-1106-preview_direct_sole-planning_parsed_results": [{"day": 1, "current_city": "from Medford to Grand Junction", "transportation": "Self-driving, Duration: 15 hours 49 mins, Distance: 1640 km, Cost: 82", "breakfast": "-", "attraction": "-", "lunch": "-", "dinner": "-", "accommodation": "NYC Apartment near Central Park!, Grand Junction"}, {"day": 2, "current_city": "Grand Junction", "transportation": "-", "breakfast": "Austin's BBQ and Oyster Bar, Grand Junction", "attraction": "Museum of the West, Museums of Western Colorado, Grand Junction;Western Colorado Botanical Gardens, Grand Junction;", "lunch": "Punjab Da Pind, Grand Junction", "dinner": "2 Dog, Grand Junction", "accommodation": "NYC Apartment near Central Park!, Grand Junction"}, {"day": 3, "current_city": "from Grand Junction to Durango", "transportation": "Self-driving, Duration: 3 hours 33 mins, Distance: 269 km, Cost: 13", "breakfast": "-", "lunch": "-", "dinner": "-", "accommodation": "Lux 1BR in the heart of NYC Theater district!, Durango"}, {"day": 4, "current_city": "Durango", "transportation": "-", "breakfast": "Samurai Japanese Cuisine & Sushi Bar, Durango", "attraction": "Durango & Silverton Narrow Gauge Railroad, Durango;The Powerhouse, Durango;", "lunch": "Dub's High on the Hog, Durango", "dinner": "Chickenette, Durango", "accommodation": "Lux 1BR in the heart of NYC Theater district!, Durango"}, {"day": 5, "current_city": "from Durango to Gunnison", "transportation": "Self-driving, Duration: 3 hours 47 mins, Distance: 275 km, Cost: 13", "breakfast": "-", "lunch": "-", "dinner": "-", "accommodation": "Full-size loft bed in East Village, Gunnison"}, {"day": 6, "current_city": "Gunnison", "transportation": "-", "breakfast": "Happy Joe's Pizza & Ice Cream, Gunnison", "attraction": "Gunnison Pioneer Museum, Gunnison;Hartman Rocks, Gunnison;", "lunch": "SALT, Gunnison", "dinner": "Mocha, Gunnison", "accommodation": "Full-size loft bed in East Village, Gunnison"}, {"day": 7, "current_city": "from Gunnison to Medford", "transportation": "Self-driving, Duration: 18 hours 4 mins, Distance: 1832 km, Cost: 91", "breakfast": "-", "lunch": "-", "dinner": "-", "accommodation": "-"}]}]