[{"gpt-4-1106-preview_direct_sole-planning_results": "Travel Plan:\nDay 1:\nCurrent City: from South Bend to Atlanta\nTransportation: Flight Number: F3648988, from South Bend to Atlanta, Departure Time: 12:30, Arrival Time: 14:21\nBreakfast: -\nAttraction: Georgia Aquarium, Atlanta\nLunch: Pizza Central, Atlanta (Cafe, Bakery, BBQ, Fast Food, Chinese, Indian)\nDinner: Chaina Ram Sindhi Confectioners, Atlanta (Desserts, Pizza, BBQ, Mediterranean, Seafood)\nAccommodation: Bright central designer's apt - steps to train!, Atlanta\n\nDay 2:\nCurrent City: Atlanta\nTransportation: -\nBreakfast: Asian Bistro, Atlanta (Tea, Bakery, Seafood)\nAttraction: World of Coca-Cola, Atlanta; High Museum of Art, Atlanta\nLunch: Chef Style, Atlanta (Pizza, American, Desserts, Seafood)\nDinner: Sethi's Restaurant & Barbeque, Atlanta (Pizza, American, Bakery, Cafe, Indian, Seafood)\nAccommodation: Bright central designer's apt - steps to train!, Atlanta\n\nDay 3:\nCurrent City: Atlanta\nTransportation: Flight Number: F3637050, from Atlanta to South Bend, Departure Time: 10:26, Arrival Time: 12:06\nBreakfast: Saffron, Atlanta (Tea, Cafe, Fast Food, Seafood)\nAttraction: Piedmont Park, Atlanta\nLunch: Daawat-e-Kashmir, Atlanta (Cafe, Pizza, American, Seafood)\nDinner: -\nAccommodation: -", "gpt-4-1106-preview_direct_sole-planning_parsed_results": [{"day": 1, "current_city": "from South Bend to Atlanta", "transportation": "Flight Number: F3648988, from South Bend to Atlanta, Departure Time: 12:30, Arrival Time: 14:21", "breakfast": "-", "attraction": "Georgia Aquarium, Atlanta;", "lunch": "Pizza Central, Atlanta", "dinner": "Chaina Ram Sindhi Confectioners, Atlanta", "accommodation": "Bright central designer's apt - steps to train!, Atlanta"}, {"day": 2, "current_city": "Atlanta", "transportation": "-", "breakfast": "Asian Bistro, Atlanta", "attraction": "World of Coca-Cola, Atlanta; High Museum of Art, Atlanta;", "lunch": "Chef Style, Atlanta", "dinner": "Sethi's Restaurant & Barbeque, Atlanta", "accommodation": "Bright central designer's apt - steps to train!, Atlanta"}, {"day": 3, "current_city": "from Atlanta to South Bend", "transportation": "Flight Number: F3637050, from Atlanta to South Bend, Departure Time: 10:26, Arrival Time: 12:06", "breakfast": "Saffron, Atlanta", "attraction": "Piedmont Park, Atlanta;", "lunch": "Daawat-e-Kashmir, Atlanta", "dinner": "-", "accommodation": "-"}]}]