[{"gpt-4-1106-preview_direct_sole-planning_results": "Travel Plan:\n\nDay 1: March 12, 2022\nCurrent City: from Evansville to Texarkana\nTransportation: Self-driving, Duration: 8 hours 45 mins, Distance: 889 km, Cost: $44 x 4 = $176\nBreakfast: -\nAttraction: Museum of Regional History, Texarkana\nLunch: Big City Bread Cafe, Texarkana\nDinner: Columbia Restaurant, Texarkana\nAccommodation: Lovely Factory Loft in Greenpoint!, Texarkana, Price: $77\n\nDay 2: March 13, 2022\nCurrent City: Texarkana\nTransportation: -\nBreakfast: Big City Bread Cafe, Texarkana\nAttraction: Spring Lake Park, Texarkana; Four States Auto Museum, Texarkana\nLunch: Poets Cafe, Texarkana\nDinner: Club Mojo, Texarkana\nAccommodation: Lovely Factory Loft in Greenpoint!, Texarkana, Price: $77\n\nDay 3: March 14, 2022\nCurrent City: from Texarkana to Longview\nTransportation: Self-driving, Duration: 1 hour 36 mins, Distance: 142 km, Cost: $7 x 4 = $28\nBreakfast: Big City Bread Cafe, Texarkana\nAttraction: Longview World of Wonders, Longview; Gregg County Historical Museum, Longview\nLunch: Barbeque Nation, Longview\nDinner: Monster's Cafe, Longview\nAccommodation: Newly renovated 2 bedroom with FREE WIFI, Longview, Price: $581\n\nDay 4: March 15, 2022\nCurrent City: Longview\nTransportation: -\nBreakfast: Barbeque Nation, Longview\nAttraction: Longview Museum of Fine Arts, Longview; Lear Park, Longview\nLunch: Apna Restaurant, Longview\nDinner: Momo Mia, Longview\nAccommodation: Newly renovated 2 bedroom with FREE WIFI, Longview, Price: $581\n\nDay 5: March 16, 2022\nCurrent City: from Longview to Evansville\nTransportation: Self-driving, Duration: 10 hours 8 mins, Distance: 1,045 km, Cost: $52 x 4 = $208\nBreakfast: Barbeque Nation, Longview\nAttraction: -\nLunch: -\nDinner: -\nAccommodation: -\n\nTotal Estimated Costs:\nTransportation: $176 (Day 1) + $28 (Day 3) + $208 (Day 5) = $412\nAccommodation: $77 (Day 1) + $77 (Day 2) + $581 (Day 3) + $581 (Day 4) = $1,316\nRemaining Budget for Meals and Attractions: $9,500 - $412 (Transportation) - $1,316 (Accommodation) = $7,772\n\nNote: The remaining budget should cover meals, attractions, and any additional expenses. The accommodation options selected do not restrict parties as requested. Prices for meals and attractions are not provided, so they should be managed within the remaining budget. All activities and meals are chosen based on proximity and relevance to the location and day's plan.", "gpt-4-1106-preview_direct_sole-planning_parsed_results": [{"day": 1, "current_city": "from Evansville to Texarkana", "transportation": "Self-driving, Duration: 8 hours 45 mins, Distance: 889 km, Cost: 176", "breakfast": "-", "attraction": "Museum of Regional History, Texarkana;", "lunch": "Big City Bread Cafe, Texarkana", "dinner": "Columbia Restaurant, Texarkana", "accommodation": "Lovely Factory Loft in Greenpoint!, Texarkana"}, {"day": 2, "current_city": "Texarkana", "transportation": "-", "breakfast": "Big City Bread Cafe, Texarkana", "attraction": "Spring Lake Park, Texarkana;Four States Auto Museum, Texarkana;", "lunch": "Poets Cafe, Texarkana", "dinner": "Club Mojo, Texarkana", "accommodation": "Lovely Factory Loft in Greenpoint!, Texarkana"}, {"day": 3, "current_city": "from Texarkana to Longview", "transportation": "Self-driving, Duration: 1 hour 36 mins, Distance: 142 km, Cost: 28", "breakfast": "Big City Bread Cafe, Texarkana", "attraction": "Longview World of Wonders, Longview;Gregg County Historical Museum, Longview;", "lunch": "Barbeque Nation, Longview", "dinner": "Monster's Cafe, Longview", "accommodation": "Newly renovated 2 bedroom with FREE WIFI, Longview"}, {"day": 4, "current_city": "Longview", "transportation": "-", "breakfast": "Barbeque Nation, Longview", "attraction": "Longview Museum of Fine Arts, Longview;Lear Park, Longview;", "lunch": "Apna Restaurant, Longview", "dinner": "Momo Mia, Longview", "accommodation": "Newly renovated 2 bedroom with FREE WIFI, Longview"}, {"day": 5, "current_city": "from Longview to Evansville", "transportation": "Self-driving, Duration: 10 hours 8 mins, Distance: 1,045 km, Cost: 208", "breakfast": "Barbeque Nation, Longview", "attraction": "-", "lunch": "-", "dinner": "-", "accommodation": "-"}]}]