[{"gpt-4-1106-preview_direct_sole-planning_results": "Travel Plan:\nDays: 1,\nCurrent City: from Sarasota to Philadelphia,\nTransportation: Flight Number: F3797423, from Sarasota to Philadelphia, Departure Time: 11:54, Arrival Time: 14:46, cost: 289\nBreakfast: -, \nAttraction: -, \nLunch: -, \nDinner: Hong Kong Cafe, Philadelphia (Pennsylvania), cost: 47, cuisines: \u201cTea, Pizza, Italian, BBQ, Cafe\u201d\nAccommodation: Brooklyn Room in Hip Neighborhood - Close to Train, Philadelphia (Pennsylvania), cost: 742, room type: Private room, house rules: No parties & No children under 10 & No smoking, minimum nights: 1, maximum occupancy: 1\n\nNumber of people = 1\nTotal cost = 289 + 47 + 742 = 1,078\nAccommodation minimum nights: 1/1\n\nDays: 2,\nCurrent City: Philadelphia,\nTransportation: -, \nBreakfast: Red Ginger Sushi, Grill & Bar, Philadelphia (Pennsylvania), cost: 98, cuisines: \u201cTea, Cafe, Indian, Fast Food\u201d\nAttraction: The Franklin Institute, Philadelphia (Pennsylvania); Liberty Bell, Philadelphia (Pennsylvania);, \nLunch: Marukame Udon, Philadelphia (Pennsylvania), cost: 100, cuisines: \u201cTea, Pizza, Italian, BBQ, Fast Food, Chinese\u201d\nDinner: Red Mesa Cantina, Philadelphia (Pennsylvania), cost: 36, cuisines: \u201cTea, Cafe, American, Fast Food\u201d\nAccommodation: Brooklyn Room in Hip Neighborhood - Close to Train, Philadelphia (Pennsylvania), cost: 742, room type: Private room, house rules: No parties & No children under 10 & No smoking, minimum nights: 1, maximum occupancy: 1\n\nNumber of people = 1\nTotal cost = (98 + 100 + 36) + 742 = 976\nAccommodation minimum nights: 2/1\n\nDays: 3,\nCurrent City: from Philadelphia to Sarasota,\nTransportation: Flight Number: F3633008, from Philadelphia to Sarasota, Departure Time: 08:06, Arrival Time: 10:51, cost: 246\nBreakfast: -, \nAttraction: -, \nLunch: -, \nDinner: -, \nAccommodation: -\n\nNumber of people = 1\nTotal cost = 246\n\nTotal cost across all days = 1,078 + 976 + 246 = 2,300\n\nUnfortunately, the total cost exceeds the specified budget of $2,100. To adhere to the budget, we need to make adjustments. Since the accommodation is the most expensive part, we can switch to a less expensive option.\n\nRevised Travel Plan:\nDays: 1,\nCurrent City: from Sarasota to Philadelphia,\nTransportation: Flight Number: F3797423, from Sarasota to Philadelphia, Departure Time: 11:54, Arrival Time: 14:46, cost: 289\nBreakfast: -, \nAttraction: -, \nLunch: -, \nDinner: Hong Kong Cafe, Philadelphia (Pennsylvania), cost: 47, cuisines: \u201cTea, Pizza, Italian, BBQ, Cafe\u201d\nAccommodation: Industrial Loft Living in NYC, Philadelphia (Pennsylvania), cost: 178, room type: Entire home/apt, house rules: No smoking, minimum nights: 4, maximum occupancy: 3\n\nNumber of people = 1\nTotal cost = 289 + 47 + 178 = 514\nAccommodation minimum nights: 1/4\n\nDays: 2,\nCurrent City: Philadelphia,\nTransportation: -, \nBreakfast: Red Ginger Sushi, Grill & Bar, Philadelphia (Pennsylvania), cost: 98, cuisines: \u201cTea, Cafe, Indian, Fast Food\u201d\nAttraction: The Franklin Institute, Philadelphia (Pennsylvania); Liberty Bell, Philadelphia (Pennsylvania);, \nLunch: Marukame Udon, Philadelphia (Pennsylvania), cost: 100, cuisines: \u201cTea, Pizza, Italian, BBQ, Fast Food, Chinese\u201d\nDinner: Red Mesa Cantina, Philadelphia (Pennsylvania), cost: 36, cuisines: \u201cTea, Cafe, American, Fast Food\u201d\nAccommodation: Industrial Loft Living in NYC, Philadelphia (Pennsylvania), cost: 178, room type: Entire home/apt, house rules: No smoking, minimum nights: 4, maximum occupancy: 3\n\nNumber of people = 1\nTotal cost = (98 + 100 + 36) + 178 = 412\nAccommodation minimum nights: 2/4\n\nDays: 3,\nCurrent City: from Philadelphia to Sarasota,\nTransportation: Flight Number: F3633008, from Philadelphia to Sarasota, Departure Time: 08:06, Arrival Time: 10:51, cost: 246\nBreakfast: -, \nAttraction: -, \nLunch: -, \nDinner: -, \nAccommodation: -\n\nNumber of people = 1\nTotal cost = 246\n\nTotal cost across all days = 514 + 412 + 246 = 1,172\n\nThe revised travel plan now adheres to the budget of $2,100.", "gpt-4-1106-preview_direct_sole-planning_parsed_results": [{"day": 1, "current_city": "from Sarasota to Philadelphia", "transportation": "Flight Number: F3797423, from Sarasota to Philadelphia, Departure Time: 11:54, Arrival Time: 14:46", "breakfast": "-", "attraction": "Liberty Bell, Philadelphia;", "lunch": "Gurdas Ram Jalebi Wala, Philadelphia", "dinner": "Bangla Sweet Corner, Philadelphia", "accommodation": "Industrial Loft Living in NYC, Philadelphia"}, {"day": 2, "current_city": "Philadelphia", "transportation": "-", "breakfast": "Hong Kong Cafe, Philadelphia", "attraction": "Philadelphia's Magic Gardens, Philadelphia;", "lunch": "Brothers Dhaba, Philadelphia", "dinner": "Red Mesa Cantina, Philadelphia", "accommodation": "Industrial Loft Living in NYC, Philadelphia"}, {"day": 3, "current_city": "from Philadelphia to Sarasota", "transportation": "Flight Number: F3633008, from Philadelphia to Sarasota, Departure Time: 08:06, Arrival Time: 10:51", "breakfast": "-", "attraction": "The Franklin Institute, Philadelphia;", "lunch": "Marukame Udon, Philadelphia", "dinner": "-", "accommodation": "-"}]}]