[{"gpt-4-1106-preview_direct_sole-planning_results": "Travel Plan:\n\nDay 1: March 10, 2022\nCurrent City: from Kona to Oakland\nTransportation: Flight Number: F4022663, from Kona to Oakland, Departure Time: 12:40, Arrival Time: 20:01\nBreakfast: -\nLunch: -\nDinner: Cho Gao - Crowne Plaza Abu Dhabi, Oakland\nAccommodation: Home away from home, Oakland\n\nDay 2: March 11, 2022\nCurrent City: Oakland\nTransportation: -\nBreakfast: Bikanervala, Oakland\nAttraction: Oakland Zoo, Oakland; Chabot Space & Science Center, Oakland\nLunch: Chef Sack Kitchen, Oakland\nDinner: Malais By Anands, Oakland\nAccommodation: Home away from home, Oakland\n\nDay 3: March 12, 2022\nCurrent City: from Oakland to Bakersfield\nTransportation: Self-driving, from Oakland to Bakersfield, duration: 4 hours 11 mins, distance: 438 km, cost: 21\nBreakfast: Chinese Food, Oakland\nAttraction: Reinhardt Redwood Regional Park, Oakland\nLunch: -\nDinner: DePalma's Italian Cafe - East Side, Bakersfield\nAccommodation: Cozy 2 Bedroom Condominium, Bakersfield\n\nDay 4: March 13, 2022\nCurrent City: Bakersfield\nTransportation: -\nBreakfast: Frick's Tap, Bakersfield\nAttraction: Buena Vista Museum of Natural History & Science, Bakersfield; Kern County Museum, Bakersfield\nLunch: Kihei Caffe, Bakersfield\nDinner: Tybee Island Social Club, Bakersfield\nAccommodation: Cozy 2 Bedroom Condominium, Bakersfield\n\nDay 5: March 14, 2022\nCurrent City: from Bakersfield to Los Angeles\nTransportation: Self-driving, from Bakersfield to Los Angeles, duration: 1 hour 55 mins, distance: 181 km, cost: 9\nBreakfast: Momo-Cha, Bakersfield\nAttraction: Central Park at Mill Creek, Bakersfield\nLunch: -\nDinner: Heat - Edsa Shangri-La, Los Angeles\nAccommodation: Midtown East 2 Bed/2 Bath Elevator Building Apt, Los Angeles\n\nDay 6: March 15, 2022\nCurrent City: Los Angeles\nTransportation: -\nBreakfast: Palmshore, Los Angeles\nAttraction: Santa Monica Pier, Los Angeles; Hollywood Walk of Fame, Los Angeles\nLunch: Punjabi Zaika, Los Angeles\nDinner: The Hangout by 1861, Los Angeles\nAccommodation: Midtown East 2 Bed/2 Bath Elevator Building Apt, Los Angeles\n\nDay 7: March 16, 2022\nCurrent City: from Los Angeles to Kona\nTransportation: Flight Number: F3583996, from Los Angeles to Kona, Departure Time: 10:55, Arrival Time: 13:42\nBreakfast: Chicken Minar, Los Angeles\nAttraction: Griffith Park, Los Angeles\nLunch: -\nDinner: -\nAccommodation: -\n\nPlease note that the costs of meals, attractions, and accommodations are not specified in the provided data, so they have been selected based on the assumption that they fit within the remaining budget after accounting for transportation costs. The total transportation cost is $554 (flight to Oakland) + $21 (self-driving to Bakersfield) + $9 (self-driving to Los Angeles) + $512 (flight back to Kona) = $1096. The remaining budget for meals, attractions, and accommodations is approximately $1404.", "gpt-4-1106-preview_direct_sole-planning_parsed_results": [{"days": 1, "current_city": "from Kona to Oakland", "transportation": "Flight Number: F4022663, from Kona to Oakland, Departure Time: 12:40, Arrival Time: 20:01", "breakfast": "-", "lunch": "-", "dinner": "Cho Gao - Crowne Plaza Abu Dhabi, Oakland", "accommodation": "Home away from home, Oakland"}, {"days": 2, "current_city": "Oakland", "transportation": "-", "breakfast": "Bikanervala, Oakland", "attraction": "Oakland Zoo, Oakland;Chabot Space & Science Center, Oakland;", "lunch": "Chef Sack Kitchen, Oakland", "dinner": "Malais By Anands, Oakland", "accommodation": "Home away from home, Oakland"}, {"days": 3, "current_city": "from Oakland to Bakersfield", "transportation": "Self-driving, from Oakland to Bakersfield, duration: 4 hours 11 mins, distance: 438 km, Cost: 21", "breakfast": "Chinese Food, Oakland", "attraction": "Reinhardt Redwood Regional Park, Oakland", "lunch": "-", "dinner": "DePalma's Italian Cafe - East Side, Bakersfield", "accommodation": "Cozy 2 Bedroom Condominium, Bakersfield"}, {"days": 4, "current_city": "Bakersfield", "transportation": "-", "breakfast": "Frick's Tap, Bakersfield", "attraction": "Buena Vista Museum of Natural History & Science, Bakersfield;Kern County Museum, Bakersfield;", "lunch": "Kihei Caffe, Bakersfield", "dinner": "Tybee Island Social Club, Bakersfield", "accommodation": "Cozy 2 Bedroom Condominium, Bakersfield"}, {"days": 5, "current_city": "from Bakersfield to Los Angeles", "transportation": "Self-driving, from Bakersfield to Los Angeles, duration: 1 hour 55 mins, distance: 181 km, Cost: 9", "breakfast": "Momo-Cha, Bakersfield", "attraction": "Central Park at Mill Creek, Bakersfield", "lunch": "-", "dinner": "Heat - Edsa Shangri-La, Los Angeles", "accommodation": "Midtown East 2 Bed/2 Bath Elevator Building Apt, Los Angeles"}, {"days": 6, "current_city": "Los Angeles", "transportation": "-", "breakfast": "Palmshore, Los Angeles", "attraction": "Santa Monica Pier, Los Angeles;Hollywood Walk of Fame, Los Angeles;", "lunch": "Punjabi Zaika, Los Angeles", "dinner": "The Hangout by 1861, Los Angeles", "accommodation": "Midtown East 2 Bed/2 Bath Elevator Building Apt, Los Angeles"}, {"days": 7, "current_city": "from Los Angeles to Kona", "transportation": "Flight Number: F3583996, from Los Angeles to Kona, Departure Time: 10:55, Arrival Time: 13:42", "breakfast": "Chicken Minar, Los Angeles", "attraction": "Griffith Park, Los Angeles", "lunch": "-", "dinner": "-", "accommodation": "-"}]}]