[{"gpt-4-1106-preview_direct_sole-planning_results": "Travel Plan:\n\nDay 1: March 17, 2022\nCurrent City: from Denver to Bozeman\nTransportation: Flight Number: F3910676, from Denver to Bozeman, Departure Time: 20:11, Arrival Time: 21:48\nBreakfast: - (Assuming breakfast is in Denver and not part of the travel plan)\nAttraction: Museum of the Rockies, Bozeman\nLunch: Jiquitaia, Bozeman (American cuisine)\nDinner: Saravana Bhavan, Bozeman (Indian cuisine)\nAccommodation: SPACIOUS STUDIO APT 3 IN PROSPECT LEFFERTS GARDENS, Bozeman\n\nDay 2: March 18, 2022\nCurrent City: Bozeman\nTransportation: -\nBreakfast: Saravana Bhavan, Bozeman (Indian cuisine)\nAttraction: Gallatin History Museum, Bozeman; American Computer & Robotics Museum, Bozeman\nLunch: McGuire's Irish Pub & Brewery, Bozeman (American cuisine)\nDinner: Shri Bhujia Bhandar, Bozeman (Indian cuisine)\nAccommodation: SPACIOUS STUDIO APT 3 IN PROSPECT LEFFERTS GARDENS, Bozeman\n\nDay 3: March 19, 2022\nCurrent City: from Bozeman to Denver\nTransportation: Flight Number: F3811654, from Bozeman to Denver, Departure Time: 18:26, Arrival Time: 20:06\nBreakfast: Indo Chinese, Bozeman (Indian cuisine)\nAttraction: Montana Science Center, Bozeman\nLunch: Pepper Kitchen, Bozeman (American cuisine)\nDinner: - (Assuming dinner is in Denver and not part of the travel plan)\nAccommodation: -\n\nPlease note that the flight prices and accommodation costs are not explicitly provided for the specific dates of travel. The plan assumes the costs are similar to the provided data and within the $7,000 budget when considering the group size and preferences.", "gpt-4-1106-preview_direct_sole-planning_parsed_results": [{"days": 1, "current_city": "from Denver to Bozeman", "transportation": "Flight Number: F3910676, from Denver to Bozeman, Departure Time: 20:11, Arrival Time: 21:48", "breakfast": "-", "attraction": "Museum of the Rockies, Bozeman;", "lunch": "Jiquitaia, Bozeman", "dinner": "Saravana Bhavan, Bozeman", "accommodation": "SPACIOUS STUDIO APT 3 IN PROSPECT LEFFERTS GARDENS, Bozeman"}, {"days": 2, "current_city": "Bozeman", "transportation": "-", "breakfast": "Saravana Bhavan, Bozeman", "attraction": "Gallatin History Museum, Bozeman;American Computer & Robotics Museum, Bozeman;", "lunch": "McGuire's Irish Pub & Brewery, Bozeman", "dinner": "Shri Bhujia Bhandar, Bozeman", "accommodation": "SPACIOUS STUDIO APT 3 IN PROSPECT LEFFERTS GARDENS, Bozeman"}, {"days": 3, "current_city": "from Bozeman to Denver", "transportation": "Flight Number: F3811654, from Bozeman to Denver, Departure Time: 18:26, Arrival Time: 20:06", "breakfast": "Indo Chinese, Bozeman", "attraction": "Montana Science Center, Bozeman;", "lunch": "Pepper Kitchen, Bozeman", "dinner": "-", "accommodation": "-"}]}]