[{"gpt-4-1106-preview_direct_sole-planning_results": "Travel Plan:\n\nDay 1: Bloomington to Orlando (Florida)\n- Transportation: Flight Number: F3563219, from Bloomington to Orlando, Departure Time: 15:35, Arrival Time: 19:17, cost: $302 per person\n- Breakfast: - (Assuming departure is after breakfast)\n- Attraction: - (Traveling)\n- Lunch: - (On flight or at the airport)\n- Dinner: Fuji Japanese Steakhouse, Orlando (Florida), cost: $75, cuisines: \u201cTea, Bakery, Desserts\u201d\n- Accommodation: Sixth Ave Chelsea, Studio Serviced Apartment, Orlando (Florida), cost: $70, room type: Entire home/apt, house rules: No visitors & No pets, minimum nights: 30, maximum occupancy: 3, pet-friendly: Yes\n\nNumber of people = 4\nTotal cost = (302 + 75) * 4 + 70 = $1,578\nAccommodation minimum nights: 1/30\n\nDay 2: Orlando (Florida)\n- Transportation: -\n- Breakfast: Turquoise Villa, Orlando (Florida), cost: $55, cuisines: \u201cFrench, Bakery, BBQ, Fast Food\u201d\n- Attraction: Universal Orlando Resort, Orlando (Florida)\n- Lunch: The Tandoori Times, Orlando (Florida), cost: $84, cuisines: \u201cTea, Cafe, BBQ, Italian\u201d\n- Dinner: Indochi Cafe & Restaurant, Orlando (Florida), cost: $72, cuisines: \u201cPizza, French, Bakery, Fast Food, Indian, Seafood\u201d\n- Accommodation: Sixth Ave Chelsea, Studio Serviced Apartment, Orlando (Florida), cost: $70, room type: Entire home/apt, house rules: No visitors & No pets, minimum nights: 30, maximum occupancy: 3, pet-friendly: Yes\n\nNumber of people = 4\nTotal cost = (55 + 84 + 72) * 4 + 70 = $1,198\nAccommodation minimum nights: 2/30\n\nDay 3: Orlando to Miami (Florida)\n- Transportation: Flight Number: F3670393, from Orlando to Miami, Departure Time: 17:43, Arrival Time: 18:57, cost: $74 per person\n- Breakfast: Crust N Cakes, Orlando (Florida), cost: $61, cuisines: \u201cTea, Cafe, Indian, BBQ\u201d\n- Attraction: SeaWorld Orlando, Orlando (Florida)\n- Lunch: Bite N Sip, Orlando (Florida), cost: $76, cuisines: \u201cChinese, Bakery, Cafe, Fast Food\u201d\n- Dinner: Shorts Burger and Shine, Miami (Florida), cost: $81, cuisines: \u201cChinese, Cafe, Seafood\u201d\n- Accommodation: King Hotel Room at Wyndham Midtown 45 Resort, Miami (Florida), cost: $264, room type: Private room, house rules: No pets & No smoking & No children under 10, minimum nights: 2, maximum occupancy: 2, pet-friendly: Yes\n\nNumber of people = 4\nTotal cost = (74 + 61 + 76 + 81) * 4 + 264 * 2 = $1,452\nAccommodation minimum nights: 1/2\n\nDay 4: Miami (Florida)\n- Transportation: -\n- Breakfast: Papouli's Mediterranean Cafe & Market, Miami (Florida), cost: $26, cuisines: \u201cTea, Desserts\u201d\n- Attraction: Miami Seaquarium, Miami (Florida)\n- Lunch: Tako Cheena by Pom Pom, Miami (Florida), cost: $60, cuisines: \u201cFast Food, Indian, Desserts, Italian\u201d\n- Dinner: AB's Absolute Barbecues, Miami (Florida), cost: $55, cuisines: \u201cDesserts, Tea, Pizza, Italian, Fast Food, American\u201d\n- Accommodation: King Hotel Room at Wyndham Midtown 45 Resort, Miami (Florida), cost: $264, room type: Private room, house rules: No pets & No smoking & No children under 10, minimum nights: 2, maximum occupancy: 2, pet-friendly: Yes\n\nNumber of people = 4\nTotal cost = (26 + 60 + 55) * 4 + 264 * 2 = $1,168\nAccommodation minimum nights: 2/2\n\nDay 5: Miami to Bloomington\n- Transportation: Self-driving, from Miami to Bloomington, duration: 17 hours 1 min, distance: 1,897 km, cost: $94\n- Breakfast: Anjlika, Miami (Florida), cost: $56, cuisines: \u201cPizza, Italian, Fast Food, Cafe, Mediterranean, Seafood\u201d\n- Attraction: - (Traveling)\n- Lunch: - (On the road)\n- Dinner: - (On the road)\n- Accommodation: -\n\nNumber of people = 4\nTotal cost = (94 + 56) * 4 = $600\n\nTotal cost across all days = $1,578 + $1,198 + $1,452 + $1,168 + $600 = $5,996\n\nRemaining budget: $15,900 - $5,996 = $9,904\n\nCuisines: The itinerary includes a variety of cuisines, with a focus on American, BBQ, and Seafood, which are popular in Florida.\n\nNote: The accommodation in Orlando has a minimum stay of 30 nights, which is not suitable for a 5-day itinerary. However, due to the lack of provided information on alternative pet-friendly accommodations, it has been included. Adjustments would be necessary with more information. Additionally, the accommodation in Miami has a minimum stay of 2 nights, which fits the itinerary. The self-driving cost from Miami to Bloomington is estimated, as the provided cost is for a taxi, which would exceed the budget.", "gpt-4-1106-preview_direct_sole-planning_parsed_results": [{"day": 1, "current_city": "from Bloomington to Orlando", "transportation": "Flight Number: F3563219, from Bloomington to Orlando, Departure Time: 15:35, Arrival Time: 19:17", "breakfast": "-", "attraction": "-", "lunch": "-", "dinner": "Fuji Japanese Steakhouse, Orlando", "accommodation": "Sixth Ave Chelsea, Studio Serviced Apartment, Orlando"}, {"day": 2, "current_city": "Orlando", "transportation": "-", "breakfast": "Turquoise Villa, Orlando", "attraction": "Universal Orlando Resort, Orlando", "lunch": "The Tandoori Times, Orlando", "dinner": "Indochi Cafe & Restaurant, Orlando", "accommodation": "Sixth Ave Chelsea, Studio Serviced Apartment, Orlando"}, {"day": 3, "current_city": "from Orlando to Miami", "transportation": "Flight Number: F3670393, from Orlando to Miami, Departure Time: 17:43, Arrival Time: 18:57", "breakfast": "Crust N Cakes, Orlando", "attraction": "SeaWorld Orlando, Orlando", "lunch": "Bite N Sip, Orlando", "dinner": "Shorts Burger and Shine, Miami", "accommodation": "King Hotel Room at Wyndham Midtown 45 Resort, Miami"}, {"day": 4, "current_city": "Miami", "transportation": "-", "breakfast": "Papouli's Mediterranean Cafe & Market, Miami", "attraction": "Miami Seaquarium, Miami", "lunch": "Tako Cheena by Pom Pom, Miami", "dinner": "AB's Absolute Barbecues, Miami", "accommodation": "King Hotel Room at Wyndham Midtown 45 Resort, Miami"}, {"day": 5, "current_city": "from Miami to Bloomington", "transportation": "Self-driving, from Miami to Bloomington, duration: 17 hours 1 min, distance: 1,897 km", "breakfast": "Anjlika, Miami", "attraction": "-", "lunch": "-", "dinner": "-", "accommodation": "-"}]}]