[{"gpt-4-1106-preview_direct_sole-planning_results": "Travel Plan:\n\nDay 1: March 7, 2022\nCurrent City: from Reno to Abilene\nTransportation: Self-driving, from Reno to Abilene, Duration: 22 hours 27 mins, Distance: 2,412 km, Cost: $120\nBreakfast: -\nLunch: -\nDinner: -\nAccommodation: Apartment minutes from manhattan, Abilene, Price: $295, Room Type: Entire home/apt, House Rules: No pets & No visitors, Minimum Nights: 2, Maximum Occupancy: 2, Review Rate Number: 2\n\nDay 2: March 8, 2022\nCurrent City: Abilene\nTransportation: -\nBreakfast: Thai Garden, Abilene, Average Cost: $13, Cuisines: Cafe, American, Desserts, Aggregate Rating: 4.2\nAttraction: The Grace Museum, Abilene\nLunch: Mediumwelldone, Abilene, Average Cost: $91, Cuisines: Tea, French, BBQ, Cafe, Seafood, Aggregate Rating: 3.5\nDinner: LPK Waterfront, Abilene, Average Cost: $61, Cuisines: Pizza, Italian, BBQ, Fast Food, Seafood, Aggregate Rating: 3.7\nAccommodation: Apartment minutes from manhattan, Abilene\n\nDay 3: March 9, 2022\nCurrent City: from Abilene to Amarillo\nTransportation: Self-driving, from Abilene to Amarillo, Duration: 4 hours 10 mins, Distance: 446 km, Cost: $22\nBreakfast: -\nAttraction: Cadillac Ranch, Amarillo\nLunch: The Cinnamon Kitchen, Amarillo, Average Cost: $69, Cuisines: Desserts, Tea, Pizza, Chinese, Seafood, Aggregate Rating: 3.4\nDinner: Sigree Global Grill, Amarillo, Average Cost: $35, Cuisines: Chinese, BBQ, Cafe, Desserts, Aggregate Rating: 4.1\nAccommodation: Harlem Humble Abode - 1 bedroom - Cute and Quaint, Amarillo, Price: $409, Room Type: Entire home/apt, House Rules: No pets, Minimum Nights: 5, Maximum Occupancy: 3, Review Rate Number: 5\n\nDay 4: March 10, 2022\nCurrent City: Amarillo\nTransportation: -\nBreakfast: Wood Box Cafe, Amarillo, Average Cost: $11, Cuisines: Desserts, French, Fast Food, Cafe, American, Aggregate Rating: 3.8\nAttraction: Amarillo Botanical Gardens, Amarillo\nLunch: Anand Restaurant, Amarillo, Average Cost: $53, Cuisines: Fast Food, Seafood, Desserts, Italian, Aggregate Rating: 3.6\nDinner: Delish BBQ, Amarillo, Average Cost: $92, Cuisines: Mexican, Bakery, Desserts, Seafood, Aggregate Rating: 3.9\nAccommodation: Harlem Humble Abode - 1 bedroom - Cute and Quaint, Amarillo\n\nDay 5: March 11, 2022\nCurrent City: from Amarillo to Lubbock\nTransportation: Self-driving, from Amarillo to Lubbock, Duration: 1 hour 47 mins, Distance: 197 km, Cost: $9\nBreakfast: -\nAttraction: Buddy Holly Center, Lubbock\nLunch: Paris 6 Classique, Lubbock, Average Cost: $91, Cuisines: Desserts, Cafe, Pizza, Mexican, BBQ, Chinese, Aggregate Rating: 3.4\nDinner: The Town House Cafe, Lubbock, Average Cost: $90, Cuisines: Tea, American, BBQ, Cafe, Indian, Seafood, Aggregate Rating: 4.0\nAccommodation: Private bedroom in UWS Apartment, Lubbock, Price: $709, Room Type: Private room, House Rules: No visitors & No pets, Minimum Nights: 2, Maximum Occupancy: 2, Review Rate Number: 5\n\nDay 6: March 12, 2022\nCurrent City: Lubbock\nTransportation: -\nBreakfast: Assam Tea Corner, Lubbock, Average Cost: $52, Cuisines: Desserts, BBQ, Fast Food, American, Seafood, Aggregate Rating: 2.8\nAttraction: National Ranching Heritage Center, Lubbock\nLunch: Sultanat, Lubbock, Average Cost: $72, Cuisines: Chinese, Bakery, BBQ, Cafe, Aggregate Rating: 3.7\nDinner: San Carlo, Lubbock, Average Cost: $56, Cuisines: Tea, Pizza, Mexican, BBQ, Cafe, Mediterranean, Aggregate Rating: 4.2\nAccommodation: Private bedroom in UWS Apartment, Lubbock\n\nDay 7: March 13, 2022\nCurrent City: from Lubbock to Reno\nTransportation: Self-driving, from Lubbock to Reno, Duration: 20 hours 3 mins, Distance: 2,145 km, Cost: $107\nBreakfast: -\nLunch: -\nDinner: -\nAccommodation: -\n\nTotal Estimated Cost Breakdown:\nAccommodations: $295 (Day 1) + $295 (Day 2) + $409 (Day 3) + $409 (Day 4) + $709 (Day 5) + $709 (Day 6) = $2,826\nTransportation: $120 (Reno to Abilene) + $22 (Abilene to Amarillo) + $9 (Amarillo to Lubbock) + $107 (Lubbock to Reno) = $258\nFood: Assuming two meals per day at an average cost of $50 per meal for 2 people: $50 x 2 meals x 6 days = $600\nAttractions: Assuming an average cost of $20 per attraction for 2 people: $20 x 6 attractions = $120\n\nTotal Estimated Cost: $2,826 (Accommodations) + $258 (Transportation) + $600 (Food) + $120 (Attractions) = $3,804\n\nRemaining Budget: $4,300 - $3,804 = $496\n\nPlease note that the costs for meals and attractions are estimated averages and may vary. The remaining budget can be used for additional meals, attractions, or unforeseen expenses.", "gpt-4-1106-preview_direct_sole-planning_parsed_results": [{"day": 1, "current_city": "from Reno to Abilene", "transportation": "Self-driving, from Reno to Abilene, Duration: 22 hours 27 mins, Distance: 2,412 km, Cost: 120", "breakfast": "-", "attraction": "-", "lunch": "-", "dinner": "-", "accommodation": "Apartment minutes from manhattan, Abilene"}, {"day": 2, "current_city": "Abilene", "transportation": "-", "breakfast": "Thai Garden, Abilene", "attraction": "The Grace Museum, Abilene;", "lunch": "Mediumwelldone, Abilene", "dinner": "LPK Waterfront, Abilene", "accommodation": "Apartment minutes from manhattan, Abilene"}, {"day": 3, "current_city": "from Abilene to Amarillo", "transportation": "Self-driving, from Abilene to Amarillo, Duration: 4 hours 10 mins, Distance: 446 km, Cost: 22", "breakfast": "-", "attraction": "Cadillac Ranch, Amarillo;", "lunch": "The Cinnamon Kitchen, Amarillo", "dinner": "Sigree Global Grill, Amarillo", "accommodation": "Harlem Humble Abode - 1 bedroom - Cute and Quaint, Amarillo"}, {"day": 4, "current_city": "Amarillo", "transportation": "-", "breakfast": "Wood Box Cafe, Amarillo", "attraction": "Amarillo Botanical Gardens, Amarillo;", "lunch": "Anand Restaurant, Amarillo", "dinner": "Delish BBQ, Amarillo", "accommodation": "Harlem Humble Abode - 1 bedroom - Cute and Quaint, Amarillo"}, {"day": 5, "current_city": "from Amarillo to Lubbock", "transportation": "Self-driving, from Amarillo to Lubbock, Duration: 1 hour 47 mins, Distance: 197 km, Cost: 9", "breakfast": "-", "attraction": "Buddy Holly Center, Lubbock;", "lunch": "Paris 6 Classique, Lubbock", "dinner": "The Town House Cafe, Lubbock", "accommodation": "Private bedroom in UWS Apartment, Lubbock"}, {"day": 6, "current_city": "Lubbock", "transportation": "-", "breakfast": "Assam Tea Corner, Lubbock", "attraction": "National Ranching Heritage Center, Lubbock;", "lunch": "Sultanat, Lubbock", "dinner": "San Carlo, Lubbock", "accommodation": "Private bedroom in UWS Apartment, Lubbock"}, {"day": 7, "current_city": "from Lubbock to Reno", "transportation": "Self-driving, from Lubbock to Reno, Duration: 20 hours 3 mins, Distance: 2,145 km, Cost: 107", "breakfast": "-", "attraction": "-", "lunch": "-", "dinner": "-", "accommodation": "-"}]}]