[{"gpt-4-1106-preview_direct_sole-planning_results": "Travel Plan:\n\nDay 1: March 10th, 2022\nCurrent City: from Las Vegas to Santa Maria (California)\nTransportation: Self-driving, from Las Vegas to Santa Maria, duration: 6 hours 17 mins, distance: 634 km, cost: 31\nBreakfast: - (Assuming departure after breakfast)\nAttraction: -\nLunch: - (Assuming packed lunch or en route)\nDinner: Pirates of Grill, Santa Maria (California), cost: 90, cuisines: \u201cBakery, BBQ, Fast Food, American, Mediterranean, Seafood\u201d\nAccommodation: Large Bedroom on upper west/columbia, Santa Maria (California), cost: 98, maximum occupancy: 2, house rules: No parties & No pets, minimum nights: 1\n\nNumber of people = 4\nTotal cost = (31 * 4) + (90 * 4) + (98 * 2) = 124 + 360 + 196 = 680\n\nDay 2: March 11th, 2022\nCurrent City: Santa Maria (California)\nTransportation: -\nBreakfast: Indian By Nature, Santa Maria (California), cost: 45, cuisines: \u201cTea, Pizza, Bakery, BBQ, Mediterranean\u201d\nAttraction: Santa Maria Valley Discovery Museum, Santa Maria (California)\nLunch: RiverDine Restaurant & Bar, Santa Maria (California), cost: 71, cuisines: \u201cChinese, BBQ, Seafood\u201d\nDinner: Kuremal Mohan Lal Kulfi Wale, Santa Maria (California), cost: 84, cuisines: \u201cDesserts, Italian, BBQ, Bakery, American, Seafood\u201d\nAccommodation: Large Bedroom on upper west/columbia, Santa Maria (California), cost: 98, maximum occupancy: 2, house rules: No parties & No pets, minimum nights: 1\n\nNumber of people = 4\nTotal cost = (45 + 71 + 84) * 4 + (98 * 2) = 800 + 196 = 996\n\nDay 3: March 12th, 2022\nCurrent City: Santa Maria (California) to Las Vegas\nTransportation: Self-driving, from Santa Maria to Las Vegas, duration: 6 hours 19 mins, distance: 636 km, cost: 31\nBreakfast: Calendar Khana Laao, Santa Maria (California), cost: 91, cuisines: \u201cDesserts, Tea, Fast Food, Cafe, Indian\u201d\nAttraction: -\nLunch: - (Assuming packed lunch or en route)\nDinner: - (Assuming arrival after dinner)\nAccommodation: -\n\nNumber of people = 4\nTotal cost = (31 * 4) + (91 * 4) = 124 + 364 = 488\n\nTotal cost across all days = 680 + 996 + 488 = 2,164\n\nCuisines: The prompt specifies American and Mediterranean, and both of these cuisines have been represented in the restaurants chosen.\n\nRemaining Budget: $3,700 - $2,164 = $1,536\n\nNote: The travel plan includes self-driving as the mode of transportation since there are no flights available between Las Vegas and Santa Maria on the specified dates. The accommodation chosen is a private room to ensure privacy for the group, and the cost is calculated based on two rooms needed for four people. Attractions are limited to one per day to allow for travel time and relaxation. The remaining budget can be used for additional activities or saved.", "gpt-4-1106-preview_direct_sole-planning_parsed_results": [{"day": 1, "current_city": "from Las Vegas to Santa Maria", "transportation": "Self-driving, from Las Vegas to Santa Maria, Duration: 6 hours 17 mins, Distance: 634 km", "breakfast": "-", "attraction": "-", "lunch": "-", "dinner": "Pirates of Grill, Santa Maria", "accommodation": "Large Bedroom on upper west/columbia, Santa Maria"}, {"day": 2, "current_city": "Santa Maria", "transportation": "-", "breakfast": "Indian By Nature, Santa Maria", "attraction": "Santa Maria Valley Discovery Museum, Santa Maria", "lunch": "RiverDine Restaurant & Bar, Santa Maria", "dinner": "Kuremal Mohan Lal Kulfi Wale, Santa Maria", "accommodation": "Large Bedroom on upper west/columbia, Santa Maria"}, {"day": 3, "current_city": "from Santa Maria to Las Vegas", "transportation": "Self-driving, from Santa Maria to Las Vegas, Duration: 6 hours 19 mins, Distance: 636 km", "breakfast": "Calendar Khana Laao, Santa Maria", "attraction": "-", "lunch": "-", "dinner": "-", "accommodation": "-"}]}]