[{"gpt-4-1106-preview_direct_sole-planning_results": "Travel Plan:\n\nDay 1: March 8, 2022\nCurrent City: from Fort Lauderdale to New Orleans\nTransportation: Self-driving, duration: 11 hours 54 mins, distance: 1,356 km, cost: $67\nBreakfast: -\nLunch: -\nDinner: Jimmy's Pancake House, New Orleans\nAccommodation: Lovely One bedroom apartment 20 min to Manhattan, New Orleans\n\nDay 2: March 9, 2022\nCurrent City: New Orleans\nTransportation: -\nBreakfast: The Fish House, New Orleans\nAttraction: New Orleans City Park, New Orleans\nLunch: Town Table Restaurant, New Orleans\nAttraction: Audubon Aquarium, New Orleans\nDinner: Momo-Cha, New Orleans\nAccommodation: Lovely One bedroom apartment 20 min to Manhattan, New Orleans\n\nDay 3: March 10, 2022\nCurrent City: from New Orleans to Baton Rouge\nTransportation: Self-driving, duration: 1 hour 17 mins, distance: 131 km, cost: $6\nBreakfast: Jimmy's Pancake House, New Orleans\nAttraction: Mardi Gras World, New Orleans\nLunch: Sage, New Orleans\nAttraction: New Orleans Museum of Art, New Orleans\nDinner: Uttarakhand Fast Food, New Orleans\nAccommodation: Spacious 1 Bedroom in Historic Brownstone, Baton Rouge\n\nDay 4: March 11, 2022\nCurrent City: Baton Rouge\nTransportation: -\nBreakfast: Bluebird Diner, Baton Rouge\nAttraction: Louisiana's Old State Capitol, Baton Rouge\nLunch: Jimmy Jack's Rib Shack, Baton Rouge\nAttraction: USS KIDD Veterans Museum, Baton Rouge\nDinner: Tursi's Latin King, Baton Rouge\nAccommodation: Spacious 1 Bedroom in Historic Brownstone, Baton Rouge\n\nDay 5: March 12, 2022\nCurrent City: from Baton Rouge to Shreveport\nTransportation: Self-driving, duration: 3 hours 42 mins, distance: 397 km, cost: $19\nBreakfast: Bluebird Diner, Baton Rouge\nAttraction: Capitol Park Museum, Baton Rouge\nLunch: Zen Japanese Steakhouse and Sushi Bar, Baton Rouge\nAttraction: Louisiana Art & Science Museum, Baton Rouge\nDinner: Pizza Di Rocco, Baton Rouge\nAccommodation: Gorgeous 2 bedroom apt in Ditmas Park\\\\n1300 ft.\u00b2, Shreveport\n\nDay 6: March 13, 2022\nCurrent City: Shreveport\nTransportation: -\nBreakfast: Longstreet Cafe, Shreveport\nAttraction: Sci-Port Discovery Center, Shreveport\nLunch: The Coffee Club, Shreveport\nAttraction: Shreveport Aquarium, Shreveport\nDinner: Hungrill, Shreveport\nAccommodation: Gorgeous 2 bedroom apt in Ditmas Park\\\\n1300 ft.\u00b2, Shreveport\n\nDay 7: March 14, 2022\nCurrent City: from Shreveport to Fort Lauderdale\nTransportation: Self-driving, duration: 16 hours 3 mins, distance: 1,772 km, cost: $88\nBreakfast: Longstreet Cafe, Shreveport\nAttraction: Louisiana State Exhibit Museum, Shreveport\nLunch: BBQ Factory, Shreveport\nAttraction: Shreveport Water Works Museum, Shreveport\nDinner: -\nAccommodation: -\n\nTotal Estimated Cost:\nTransportation: $67 (Fort Lauderdale to New Orleans) + $6 (New Orleans to Baton Rouge) + $19 (Baton Rouge to Shreveport) + $88 (Shreveport to Fort Lauderdale) = $180\nAccommodations: $186 x 2 nights (New Orleans) + $670 x 2 nights (Baton Rouge) + $713 x 2 nights (Shreveport) = $3,138\nRemaining Budget for Meals and Attractions: $4,400 - $180 (Transportation) - $3,138 (Accommodations) = $1,082\n\nPlease note that meal and attraction costs are not included in the total estimated cost and should be managed within the remaining budget. Prices for meals and attractions were not provided, so please ensure to check the current rates and availability.", "gpt-4-1106-preview_direct_sole-planning_parsed_results": [{"day": 1, "current_city": "from Fort Lauderdale to New Orleans", "transportation": "Self-driving, Duration: 11 hours 54 mins, Distance: 1356 km, Cost: 67", "breakfast": "-", "attraction": "-", "lunch": "-", "dinner": "Jimmy's Pancake House, New Orleans", "accommodation": "Lovely One bedroom apartment 20 min to Manhattan, New Orleans"}, {"day": 2, "current_city": "New Orleans", "transportation": "-", "breakfast": "The Fish House, New Orleans", "attraction": "New Orleans City Park, New Orleans;Audubon Aquarium, New Orleans;", "lunch": "Town Table Restaurant, New Orleans", "dinner": "Momo-Cha, New Orleans", "accommodation": "Lovely One bedroom apartment 20 min to Manhattan, New Orleans"}, {"day": 3, "current_city": "from New Orleans to Baton Rouge", "transportation": "Self-driving, Duration: 1 hour 17 mins, Distance: 131 km, Cost: 6", "breakfast": "Jimmy's Pancake House, New Orleans", "attraction": "Mardi Gras World, New Orleans;New Orleans Museum of Art, New Orleans;", "lunch": "Sage, New Orleans", "dinner": "Uttarakhand Fast Food, New Orleans", "accommodation": "Spacious 1 Bedroom in Historic Brownstone, Baton Rouge"}, {"day": 4, "current_city": "Baton Rouge", "transportation": "-", "breakfast": "Bluebird Diner, Baton Rouge", "attraction": "Louisiana's Old State Capitol, Baton Rouge;USS KIDD Veterans Museum, Baton Rouge;", "lunch": "Jimmy Jack's Rib Shack, Baton Rouge", "dinner": "Tursi's Latin King, Baton Rouge", "accommodation": "Spacious 1 Bedroom in Historic Brownstone, Baton Rouge"}, {"day": 5, "current_city": "from Baton Rouge to Shreveport", "transportation": "Self-driving, Duration: 3 hours 42 mins, Distance: 397 km, Cost: 19", "breakfast": "Bluebird Diner, Baton Rouge", "attraction": "Capitol Park Museum, Baton Rouge;Louisiana Art & Science Museum, Baton Rouge;", "lunch": "Zen Japanese Steakhouse and Sushi Bar, Baton Rouge", "dinner": "Pizza Di Rocco, Baton Rouge", "accommodation": "Gorgeous 2 bedroom apt in Ditmas Park\\n1300 ft.\u00b2, Shreveport"}, {"day": 6, "current_city": "Shreveport", "transportation": "-", "breakfast": "Longstreet Cafe, Shreveport", "attraction": "Sci-Port Discovery Center, Shreveport;Shreveport Aquarium, Shreveport;", "lunch": "The Coffee Club, Shreveport", "dinner": "Hungrill, Shreveport", "accommodation": "Gorgeous 2 bedroom apt in Ditmas Park\\n1300 ft.\u00b2, Shreveport"}, {"day": 7, "current_city": "from Shreveport to Fort Lauderdale", "transportation": "Self-driving, Duration: 16 hours 3 mins, Distance: 1772 km, Cost: 88", "breakfast": "Longstreet Cafe, Shreveport", "attraction": "Louisiana State Exhibit Museum, Shreveport;Shreveport Water Works Museum, Shreveport;", "lunch": "BBQ Factory, Shreveport", "dinner": "-", "accommodation": "-"}]}]