[{"gpt-4-1106-preview_direct_sole-planning_results": "Travel Plan:\n\nDays: 1\nCurrent City: from Columbus to Newark\nTransportation: Flight Number: F4076294, from Columbus to Newark, Departure Time: 07:03, Arrival Time: 08:54, cost: 116\nBreakfast: -\nAttraction: The Newark Museum of Art, Newark (New Jersey)\nLunch: Artistry, Newark (New Jersey), cost: 79, cuisines: Cafe, Pizza, Desserts, Seafood\nDinner: Angeethi Restaurant, Newark (New Jersey), cost: 12, cuisines: French, BBQ, Fast Food\nAccommodation: Large Two Story Loft in the Heart of West Village, Newark (New Jersey), cost: 1127.0, room type: Entire home/apt, house rules: No pets & No children under 10, minimum nights: 3.0, maximum occupancy: 5\n\nNumber of people: 2\nTotal cost: 2 x 116 + 2 x 79 + 2 x 12 + 1127.0 = 1541 (This exceeds the budget, so we need to find a cheaper accommodation)\n\nRevised Accommodation: Gramercy One Bedroom w Two Beds, Newark (New Jersey), cost: 485.0, room type: Entire home/apt, house rules: No visitors & No children under 10, minimum nights: 7.0, maximum occupancy: 4\n\nRevised Total cost: 2 x 116 + 2 x 79 + 2 x 12 + 485.0 = 899\n\nDays: 2\nCurrent City: Newark\nTransportation: -\nBreakfast: Mirage Restro Bar, Newark (New Jersey), cost: 51, cuisines: Bakery, American, Desserts, Fast Food\nAttraction: Military Park, Newark (New Jersey); Branch Brook Park, Newark (New Jersey)\nLunch: Escape Terrace Bar Kitchen, Newark (New Jersey), cost: 100, cuisines: Tea, Cafe, Bakery, Chinese, Seafood\nDinner: Jaguar, Newark (New Jersey), cost: 38, cuisines: French, Bakery, Seafood\nAccommodation: Gramercy One Bedroom w Two Beds, Newark (New Jersey), cost: 485.0, room type: Entire home/apt, house rules: No visitors & No children under 10, minimum nights: 7.0, maximum occupancy: 4\n\nNumber of people: 2\nTotal cost: 2 x 51 + 2 x 100 + 2 x 38 + 485.0 = 863\n\nDays: 3\nCurrent City: from Newark to Columbus\nTransportation: Flight Number: F4076752, from Newark to Columbus, Departure Time: 21:43, Arrival Time: 23:18, cost: 129\nBreakfast: Harmann Restaurant, Newark (New Jersey), cost: 57, cuisines: Tea, Cafe, American, Fast Food\nAttraction: Weequahic Park, Newark (New Jersey)\nLunch: Drifters Cafe, Newark (New Jersey), cost: 24, cuisines: Tea, BBQ\nDinner: -\nAccommodation: -\n\nNumber of people: 2\nTotal cost: 2 x 57 + 2 x 24 + 2 x 129 = 418\n\nTotal cost across all days: 899 + 863 + 418 = 2180 (This exceeds the budget, so we need to find a cheaper flight option)\n\nRevised Flight for Day 3: Flight Number: F4076953, from Newark to Columbus, Departure Time: 19:37, Arrival Time: 21:43, cost: 159\n\nRevised Total cost for Day 3: 2 x 57 + 2 x 24 + 2 x 159 = 478\n\nRevised Total cost across all days: 899 + 863 + 478 = 2240 (This still exceeds the budget, so we need to adjust further)\n\nSince the budget cannot accommodate the current plan, we need to make further adjustments. However, given the constraints of the query, it is not possible to create a feasible plan within the $1,200 budget. Accommodations and flights are fixed costs that cannot be reduced without changing the travel dates or the number of people traveling.", "gpt-4-1106-preview_direct_sole-planning_parsed_results": [{"day": 1, "current_city": "from Columbus to Newark", "transportation": "Flight Number: F4076294, from Columbus to Newark, Departure Time: 07:03, Arrival Time: 08:54", "breakfast": "-", "attraction": "The Newark Museum of Art, Newark", "lunch": "Artistry, Newark", "dinner": "Angeethi Restaurant, Newark", "accommodation": "Gramercy One Bedroom w Two Beds, Newark"}, {"day": 2, "current_city": "Newark", "transportation": "-", "breakfast": "Mirage Restro Bar, Newark", "attraction": "Military Park, Newark;Branch Brook Park, Newark;", "lunch": "Escape Terrace Bar Kitchen, Newark", "dinner": "Jaguar, Newark", "accommodation": "Gramercy One Bedroom w Two Beds, Newark"}, {"day": 3, "current_city": "from Newark to Columbus", "transportation": "Flight Number: F4076953, from Newark to Columbus, Departure Time: 19:37, Arrival Time: 21:43", "breakfast": "Harmann Restaurant, Newark", "attraction": "Weequahic Park, Newark", "lunch": "Drifters Cafe, Newark", "dinner": "-", "accommodation": "-"}]}]