[{"gpt-4-1106-preview_direct_sole-planning_results": "Travel Plan:\n\nDays: 1\nCurrent City: from Akron to Augusta (Georgia)\nTransportation: Taxi, from Akron to Augusta, duration: 9 hours 36 mins, distance: 1,031 km, cost: 1031\nBreakfast: -\nAttraction: Augusta Riverwalk, Augusta (Georgia)\nLunch: -\nDinner: B Merrell's, Augusta (Georgia), cost: 74, cuisines: Tea, Pizza, Desserts, Fast Food\nAccommodation: Perfect Chanukah apartment for the whole crew!, Augusta (Georgia), cost: 451.0, maximum occupancy: 3, house rules: No pets, minimum nights: 11.0\n\nNumber of people: 2\nTotal cost: 2 x 1031 + 2 x 74 + 451 = 2661\nAccommodation minimum nights: 1/11\n\nDays: 2\nCurrent City: Augusta (Georgia)\nTransportation: -\nBreakfast: Fish Tales Lakeside Grille, Augusta (Georgia), cost: 37, cuisines: Tea, Cafe, Bakery, Desserts\nAttraction: Phinizy Swamp Nature Park, Augusta (Georgia); Augusta Museum of History, Augusta (Georgia)\nLunch: The Charcoal Chimney, Augusta (Georgia), cost: 86, cuisines: Tea, Fast Food, BBQ, Italian\nDinner: The Golden Dragon, Augusta (Georgia), cost: 82, cuisines: Desserts, Pizza, Fast Food, Indian, Mediterranean, Seafood\nAccommodation: Perfect Chanukah apartment for the whole crew!, Augusta (Georgia), cost: 451.0, maximum occupancy: 3, house rules: No pets, minimum nights: 11.0\n\nNumber of people: 2\nTotal cost: 2 x 37 + 2 x 86 + 2 x 82 + 451 = 862\nAccommodation minimum nights: 2/11\n\nDays: 3\nCurrent City: from Augusta (Georgia) to Decatur (Georgia)\nTransportation: Taxi, from Augusta to Decatur, duration: 2 hours 19 mins, distance: 229 km, cost: 229\nBreakfast: Karari Kurry, Augusta (Georgia), cost: 29, cuisines: Bakery, Indian, Cafe, Fast Food\nAttraction: DeKalb History Center Museum, Decatur (Georgia); Glenlake Park, Decatur (Georgia)\nLunch: Madhuban Restaurant - Welcome Hotel Rama International, Decatur (Georgia), cost: 47, cuisines: Pizza, Bakery, Seafood\nDinner: Tandoori Hut, Decatur (Georgia), cost: 82, cuisines: Pizza, American, Indian, Fast Food\nAccommodation: Cozy Private Room, Decatur (Georgia), cost: 69.0, maximum occupancy: 2, house rules: No children under 10 & No parties & No visitors, minimum nights: 2.0\n\nNumber of people: 2\nTotal cost: 2 x 29 + 2 x 47 + 2 x 82 + 2 x 229 + 69 = 764\nAccommodation minimum nights: 1/2\n\nDays: 4\nCurrent City: Decatur (Georgia)\nTransportation: -\nBreakfast: Cafe Coffee Day, Decatur (Georgia), cost: 46, cuisines: Tea, Cafe, BBQ, Mediterranean\nAttraction: Clyde Shepherd Nature Preserve, Decatur (Georgia); Waffle House Museum, Decatur (Georgia)\nLunch: Joey's Pizza, Decatur (Georgia), cost: 69, cuisines: Tea, Pizza, Bakery, Chinese, Seafood\nDinner: Carnatic Cafe, Decatur (Georgia), cost: 66, cuisines: Cafe, Indian, Desserts\nAccommodation: Cozy Private Room, Decatur (Georgia), cost: 69.0, maximum occupancy: 2, house rules: No children under 10 & No parties & No visitors, minimum nights: 2.0\n\nNumber of people: 2\nTotal cost: 2 x 46 + 2 x 69 + 2 x 66 + 69 = 432\nAccommodation minimum nights: 2/2\n\nDays: 5\nCurrent City: from Decatur (Georgia) to Atlanta (Georgia)\nTransportation: Taxi, from Decatur to Atlanta, duration: 19 mins, distance: 13.0 km, cost: 13\nBreakfast: Hwealthcafe, Decatur (Georgia), cost: 44, cuisines: Pizza, Bakery, Desserts, Fast Food\nAttraction: Atlanta Botanical Garden, Atlanta (Georgia); Georgia Aquarium, Atlanta (Georgia)\nLunch: Saffron, Atlanta (Georgia), cost: 39, cuisines: Tea, Cafe, Fast Food, Seafood\nDinner: Asian Bistro, Atlanta (Georgia), cost: 27, cuisines: Tea, Bakery, Seafood\nAccommodation: Fantastic Room in Bushwick, Atlanta (Georgia), cost: 1069.0, maximum occupancy: 2, house rules: No children under 10, minimum nights: 2.0\n\nNumber of people: 2\nTotal cost: 2 x 44 + 2 x 39 + 2 x 27 + 2 x 13 + 1069 = 1302\nAccommodation minimum nights: 1/2\n\nDays: 6\nCurrent City: Atlanta (Georgia)\nTransportation: -\nBreakfast: Adda, Atlanta (Georgia), cost: 22, cuisines: Tea, Mexican, Bakery\nAttraction: World of Coca-Cola, Atlanta (Georgia); Piedmont Park, Atlanta (Georgia)\nLunch: Chef Style, Atlanta (Georgia), cost: 59, cuisines: Pizza, American, Desserts, Seafood\nDinner: Pizza Central, Atlanta (Georgia), cost: 75, cuisines: Cafe, Bakery, BBQ, Fast Food, Chinese, Indian\nAccommodation: Fantastic Room in Bushwick, Atlanta (Georgia), cost: 1069.0, maximum occupancy: 2, house rules: No children under 10, minimum nights: 2.0\n\nNumber of people: 2\nTotal cost: 2 x 22 + 2 x 59 + 2 x 75 + 1069 = 1331\nAccommodation minimum nights: 2/2\n\nDays: 7\nCurrent City: from Atlanta (Georgia) to Akron\nTransportation: Taxi, from Atlanta to Akron, duration: 10 hours 10 mins, distance: 1,114 km, cost: 1114\nBreakfast: Baba Au Rhum, Atlanta (Georgia), cost: 27, cuisines: Desserts, Pizza, Mexican, BBQ, Fast Food\nAttraction: -\nLunch: -\nDinner: -\nAccommodation: -\n\nNumber of people: 2\nTotal cost: 2 x 27 + 2 x 1114 = 2282\n\nTotal cost across all days: 2661 + 862 + 764 + 432 + 1302 + 1331 + 2282 = 9634\n\nCuisines: The prompt specifies American and Chinese, so all cuisine constraints are satisfied.\n\nNote: The total cost exceeds the budget by $734. Adjustments to the accommodation or transportation may be necessary to meet the budget constraint.", "gpt-4-1106-preview_direct_sole-planning_parsed_results": [{"day": 1, "current_city": "from Akron to Augusta (Georgia)", "transportation": "Taxi, from Akron to Augusta, duration: 9 hours 36 mins, distance: 1,031 km", "breakfast": "-", "attraction": "Augusta Riverwalk, Augusta (Georgia);", "lunch": "-", "dinner": "B Merrell's, Augusta (Georgia)", "accommodation": "Perfect Chanukah apartment for the whole crew!, Augusta (Georgia)"}, {"day": 2, "current_city": "Augusta (Georgia)", "transportation": "-", "breakfast": "Fish Tales Lakeside Grille, Augusta (Georgia)", "attraction": "Phinizy Swamp Nature Park, Augusta (Georgia);Augusta Museum of History, Augusta (Georgia);", "lunch": "The Charcoal Chimney, Augusta (Georgia)", "dinner": "The Golden Dragon, Augusta (Georgia)", "accommodation": "Perfect Chanukah apartment for the whole crew!, Augusta (Georgia)"}, {"day": 3, "current_city": "from Augusta (Georgia) to Decatur (Georgia)", "transportation": "Taxi, from Augusta to Decatur, duration: 2 hours 19 mins, distance: 229 km", "breakfast": "Karari Kurry, Augusta (Georgia)", "attraction": "DeKalb History Center Museum, Decatur (Georgia);Glenlake Park, Decatur (Georgia);", "lunch": "Madhuban Restaurant - Welcome Hotel Rama International, Decatur (Georgia)", "dinner": "Tandoori Hut, Decatur (Georgia)", "accommodation": "Cozy Private Room, Decatur (Georgia)"}, {"day": 4, "current_city": "Decatur (Georgia)", "transportation": "-", "breakfast": "Cafe Coffee Day, Decatur (Georgia)", "attraction": "Clyde Shepherd Nature Preserve, Decatur (Georgia);Waffle House Museum, Decatur (Georgia);", "lunch": "Joey's Pizza, Decatur (Georgia)", "dinner": "Carnatic Cafe, Decatur (Georgia)", "accommodation": "Cozy Private Room, Decatur (Georgia)"}, {"day": 5, "current_city": "from Decatur (Georgia) to Atlanta (Georgia)", "transportation": "Taxi, from Decatur to Atlanta, duration: 19 mins, distance: 13.0 km", "breakfast": "Hwealthcafe, Decatur (Georgia)", "attraction": "Atlanta Botanical Garden, Atlanta (Georgia);Georgia Aquarium, Atlanta (Georgia);", "lunch": "Saffron, Atlanta (Georgia)", "dinner": "Asian Bistro, Atlanta (Georgia)", "accommodation": "Fantastic Room in Bushwick, Atlanta (Georgia)"}, {"day": 6, "current_city": "Atlanta (Georgia)", "transportation": "-", "breakfast": "Adda, Atlanta (Georgia)", "attraction": "World of Coca-Cola, Atlanta (Georgia);Piedmont Park, Atlanta (Georgia);", "lunch": "Chef Style, Atlanta (Georgia)", "dinner": "Pizza Central, Atlanta (Georgia)", "accommodation": "Fantastic Room in Bushwick, Atlanta (Georgia)"}, {"day": 7, "current_city": "from Atlanta (Georgia) to Akron", "transportation": "Taxi, from Atlanta to Akron, duration: 10 hours 10 mins, distance: 1,114 km", "breakfast": "Baba Au Rhum, Atlanta (Georgia)", "attraction": "-", "lunch": "-", "dinner": "-", "accommodation": "-"}]}]