[{"gpt-4-1106-preview_direct_sole-planning_results": "Travel Plan:\n\nDays: 1\nCurrent City: from Miami to San Diego (California)\nTransportation: Flight Number: F3726825, from Miami to San Diego, Departure Time: 19:07, Arrival Time: 21:25, cost: 1072\nBreakfast: -\nAttraction: -\nLunch: -\nDinner: Open Yard, San Diego (California), cost: 33, cuisines: Chinese, Pizza, Cafe, Desserts\nAccommodation: Spacious Room in Large 2 Bedroom Prewar Apartment, San Diego (California), cost: 585.0, maximum occupancy: 2, house rules: No parties & No visitors, minimum nights: 1.0\n\nNumber of people: 2\nTotal cost: 2 x 1072 + 2 x 33 + 585 = 2795\nAccommodation minimum nights: 1/1\n\nDays: 2\nCurrent City: San Diego (California)\nTransportation: -\nBreakfast: Jetha Lal Ka Dhabha, San Diego (California), cost: 22, cuisines: Tea, Cafe, Indian, Italian\nAttraction: Cabrillo National Monument, San Diego (California); La Jolla Shores Park, San Diego (California)\nLunch: Burger King, San Diego (California), cost: 20, cuisines: Pizza, Italian, French, Fast Food, Seafood\nDinner: Gopala, San Diego (California), cost: 98, cuisines: Pizza, Mexican, BBQ, American, Seafood\nAccommodation: Spacious Room in Large 2 Bedroom Prewar Apartment, San Diego (California), cost: 585.0, maximum occupancy: 2, house rules: No parties & No visitors, minimum nights: 1.0\n\nNumber of people: 2\nTotal cost: 2 x 22 + 2 x 20 + 2 x 98 + 585 = 865\nAccommodation minimum nights: 2/2\n\nDays: 3\nCurrent City: from San Diego (California) to Sacramento (California)\nTransportation: Flight Number: F3943119, from San Diego to Sacramento, Departure Time: 06:25, Arrival Time: 08:02, cost: 109\nBreakfast: -\nAttraction: California State Railroad Museum, Sacramento (California); Old Sacramento Waterfront, Sacramento (California)\nLunch: Bahama Breeze Island Grille, Sacramento (California), cost: 31, cuisines: French, Bakery, BBQ, Fast Food, Seafood\nDinner: Metro Fast Food, Sacramento (California), cost: 32, cuisines: American, BBQ, Cafe, Indian, Seafood\nAccommodation: Free Cleaning & WiFi-Near Train + Bars & Nightlife, Sacramento (California), cost: 237.0, maximum occupancy: 2, house rules: No parties, minimum nights: 30.0\n\nNumber of people: 2\nTotal cost: 2 x 109 + 2 x 31 + 2 x 32 + 237 = 581\nAccommodation minimum nights: 1/30\n\nDays: 4\nCurrent City: Sacramento (California)\nTransportation: -\nBreakfast: Gujarati Samaj Santushti, Sacramento (California), cost: 12, cuisines: Tea, Pizza, Fast Food\nAttraction: Crocker Art Museum, Sacramento (California); Sutter's Fort State Historic Park, Sacramento (California)\nLunch: Fusion N Food, Sacramento (California), cost: 22, cuisines: Tea, Cafe, BBQ, Chinese, Indian, Seafood\nDinner: Biryani House, Sacramento (California), cost: 23, cuisines: Desserts, Tea, Cafe, Fast Food, Chinese\nAccommodation: Free Cleaning & WiFi-Near Train + Bars & Nightlife, Sacramento (California), cost: 237.0, maximum occupancy: 2, house rules: No parties, minimum nights: 30.0\n\nNumber of people: 2\nTotal cost: 2 x 12 + 2 x 22 + 2 x 23 + 237 = 351\nAccommodation minimum nights: 2/30\n\nDays: 5\nCurrent City: from Sacramento (California) to Los Angeles (California)\nTransportation: Flight Number: F3972853, from Sacramento to Los Angeles, Departure Time: 12:06, Arrival Time: 13:27, cost: 79\nBreakfast: -\nAttraction: Santa Monica Pier, Los Angeles (California); Hollywood Walk of Fame, Los Angeles (California)\nLunch: Palmshore, Los Angeles (California), cost: 25, cuisines: Desserts, Bakery, Fast Food, American, Seafood\nDinner: Punjabi Zaika, Los Angeles (California), cost: 46, cuisines: Pizza, Bakery, BBQ, Cafe, Indian\nAccommodation: Midtown East 2 Bed/2 Bath Elevator Building Apt, Los Angeles (California), cost: 540.0, maximum occupancy: 4, house rules: No pets, minimum nights: 7.0\n\nNumber of people: 2\nTotal cost: 2 x 79 + 2 x 25 + 2 x 46 + 540 = 840\nAccommodation minimum nights: 1/7\n\nDays: 6\nCurrent City: Los Angeles (California)\nTransportation: -\nBreakfast: Punjabi Tandoori Tikka, Los Angeles (California), cost: 47, cuisines: Pizza, Italian, Mexican, Bakery, Fast Food, Seafood\nAttraction: Griffith Observatory, Los Angeles (California); The Getty, Los Angeles (California)\nLunch: Cafe Coffee Day, Los Angeles (California), cost: 71, cuisines: Tea, Bakery, BBQ, Seafood\nDinner: Village - The House of Food, Los Angeles (California), cost: 87, cuisines: Chinese, Pizza, Cafe\nAccommodation: Midtown East 2 Bed/2 Bath Elevator Building Apt, Los Angeles (California), cost: 540.0, maximum occupancy: 4, house rules: No pets, minimum nights: 7.0\n\nNumber of people: 2\nTotal cost: 2 x 47 + 2 x 71 + 2 x 87 + 540 = 950\nAccommodation minimum nights: 2/7\n\nDays: 7\nCurrent City: from Los Angeles (California) to Miami\nTransportation: Flight Number: F3659468, from Los Angeles to Miami, Departure Time: 22:14, Arrival Time: 05:42, cost: 489\nBreakfast: -\nAttraction: -\nLunch: -\nDinner: -\nAccommodation: -\n\nNumber of people: 2\nTotal cost: 2 x 489 = 978\n\nTotal cost across all days: 2795 + 865 + 581 + 351 + 840 + 950 + 978 = 7360\n\nCuisines: The prompt specifies Mexican and American, so all cuisine constraints are satisfied.\n\nNote: The total cost exceeds the budget by $160. To stay within budget, consider adjusting meal choices or selecting a different flight or accommodation.", "gpt-4-1106-preview_direct_sole-planning_parsed_results": [{"day": 1, "current_city": "from Miami to San Diego", "transportation": "Flight Number: F3726825, from Miami to San Diego, Departure Time: 19:07, Arrival Time: 21:25", "breakfast": "-", "attraction": "-", "lunch": "-", "dinner": "Open Yard, San Diego", "accommodation": "Spacious Room in Large 2 Bedroom Prewar Apartment, San Diego"}, {"day": 2, "current_city": "San Diego", "transportation": "-", "breakfast": "Jetha Lal Ka Dhabha, San Diego", "attraction": "Cabrillo National Monument, San Diego;La Jolla Shores Park, San Diego;", "lunch": "Burger King, San Diego", "dinner": "Gopala, San Diego", "accommodation": "Spacious Room in Large 2 Bedroom Prewar Apartment, San Diego"}, {"day": 3, "current_city": "from San Diego to Sacramento", "transportation": "Flight Number: F3943119, from San Diego to Sacramento, Departure Time: 06:25, Arrival Time: 08:02", "breakfast": "-", "attraction": "California State Railroad Museum, Sacramento;Old Sacramento Waterfront, Sacramento;", "lunch": "Bahama Breeze Island Grille, Sacramento", "dinner": "Metro Fast Food, Sacramento", "accommodation": "Free Cleaning & WiFi-Near Train + Bars & Nightlife, Sacramento"}, {"day": 4, "current_city": "Sacramento", "transportation": "-", "breakfast": "Gujarati Samaj Santushti, Sacramento", "attraction": "Crocker Art Museum, Sacramento;Sutter's Fort State Historic Park, Sacramento;", "lunch": "Fusion N Food, Sacramento", "dinner": "Biryani House, Sacramento", "accommodation": "Free Cleaning & WiFi-Near Train + Bars & Nightlife, Sacramento"}, {"day": 5, "current_city": "from Sacramento to Los Angeles", "transportation": "Flight Number: F3972853, from Sacramento to Los Angeles, Departure Time: 12:06, Arrival Time: 13:27", "breakfast": "-", "attraction": "Santa Monica Pier, Los Angeles;Hollywood Walk of Fame, Los Angeles;", "lunch": "Palmshore, Los Angeles", "dinner": "Punjabi Zaika, Los Angeles", "accommodation": "Midtown East 2 Bed/2 Bath Elevator Building Apt, Los Angeles"}, {"day": 6, "current_city": "Los Angeles", "transportation": "-", "breakfast": "Punjabi Tandoori Tikka, Los Angeles", "attraction": "Griffith Observatory, Los Angeles;The Getty, Los Angeles;", "lunch": "Cafe Coffee Day, Los Angeles", "dinner": "Village - The House of Food, Los Angeles", "accommodation": "Midtown East 2 Bed/2 Bath Elevator Building Apt, Los Angeles"}, {"day": 7, "current_city": "from Los Angeles to Miami", "transportation": "Flight Number: F3659468, from Los Angeles to Miami, Departure Time: 22:14, Arrival Time: 05:42", "breakfast": "-", "attraction": "-", "lunch": "-", "dinner": "-", "accommodation": "-"}]}]