[{"gpt-4-1106-preview_direct_sole-planning_results": "Travel Plan:\n\nDays: 1\nCurrent City: from Washington to Buffalo (New York)\nTransportation: Flight Number: F3633555, from Washington to Buffalo (New York), Departure Time: 14:56, Arrival Time: 16:00, cost: 97\nBreakfast: -\nAttraction: The Buffalo Zoo, Buffalo (New York)\nLunch: -\nDinner: Tibby's New Orleans Kitchen, Buffalo (New York), cost: 48, cuisines: Seafood, Indian, BBQ, Italian\nAccommodation: Cozy Studio in Heart of Ft Greene, Buffalo (New York), cost: 200.0, maximum occupancy: 3, house rules: No pets & No children under 10, minimum nights: 4.0\n\nNumber of people: 7\nTotal cost: 7 x 97 + 7 x 48 + 200 x 7 / 3 = 679 + 336 + 466.67 = 1481.67\nAccommodation minimum nights: 1/4\n\nDays: 2\nCurrent City: Buffalo (New York)\nTransportation: -\nBreakfast: Shokitini, Buffalo (New York), cost: 41, cuisines: Tea, Cafe, Pizza, Mexican, Chinese, Seafood\nAttraction: Buffalo and Erie County Botanical Gardens, Buffalo (New York); Buffalo AKG Art Museum, Buffalo (New York)\nLunch: Pinch Of Spice, Buffalo (New York), cost: 84, cuisines: Cafe, Desserts, Seafood\nDinner: Ammu's South Indian Restaurant, Buffalo (New York), cost: 80, cuisines: Desserts, Pizza, French, BBQ, Chinese\nAccommodation: Cozy Studio in Heart of Ft Greene, Buffalo (New York), cost: 200.0, maximum occupancy: 3, house rules: No pets & No children under 10, minimum nights: 4.0\n\nNumber of people: 7\nTotal cost: 7 x 41 + 7 x 84 + 7 x 80 + 200 x 7 / 3 = 287 + 588 + 560 + 466.67 = 1901.67\nAccommodation minimum nights: 2/4\n\nDays: 3\nCurrent City: from Buffalo (New York) to New York City (New York)\nTransportation: Flight Number: F3640947, from Buffalo to New York City (New York), Departure Time: 14:04, Arrival Time: 15:22, cost: 90\nBreakfast: Maa Kali Foods, Buffalo (New York), cost: 61, cuisines: Desserts, BBQ, Bakery, Fast Food, Indian\nAttraction: Top of The Rock, New York City (New York); One World Observatory, New York City (New York)\nLunch: Seasons 52 Fresh Grill, New York City (New York), cost: 30, cuisines: Seafood, Indian, Desserts, Italian\nDinner: Gurgaon Hights, New York City (New York), cost: 46, cuisines: Cafe, American, Indian, Fast Food\nAccommodation: A Contemporary Homelike Stay in the Best of BK, New York City (New York), cost: 228.0, maximum occupancy: 2, house rules: No pets & No visitors & No children under 10, minimum nights: 2.0\n\nNumber of people: 7\nTotal cost: 7 x 90 + 7 x 61 + 7 x 30 + 7 x 46 + 228 x 7 / 2 = 630 + 427 + 210 + 322 + 798 = 2387\nAccommodation minimum nights: 1/2\n\nDays: 4\nCurrent City: New York City (New York)\nTransportation: -\nBreakfast: Green Chick Chop, New York City (New York), cost: 26, cuisines: Tea, French, Cafe, Seafood\nAttraction: The High Line, New York City (New York); Empire State Building, New York City (New York)\nLunch: Lord of the Drinks Forum, New York City (New York), cost: 71, cuisines: Cafe, Bakery, BBQ, Chinese, Indian\nDinner: Goosebumps, New York City (New York), cost: 94, cuisines: Chinese, Pizza, Bakery\nAccommodation: A Contemporary Homelike Stay in the Best of BK, New York City (New York), cost: 228.0, maximum occupancy: 2, house rules: No pets & No visitors & No children under 10, minimum nights: 2.0\n\nNumber of people: 7\nTotal cost: 7 x 26 + 7 x 71 + 7 x 94 + 228 x 7 / 2 = 182 + 497 + 658 + 798 = 2135\nAccommodation minimum nights: 2/2\n\nDays: 5\nCurrent City: from New York City (New York) to Washington\nTransportation: Flight Number: F3661892, from New York City to Washington, Departure Time: 11:31, Arrival Time: 12:45, cost: 64\nBreakfast: Sir John Bakery Cafe, New York City (New York), cost: 78, cuisines: Pizza, Bakery, Desserts\nAttraction: -\nLunch: -\nDinner: -\nAccommodation: -\n\nNumber of people: 7\nTotal cost: 7 x 64 + 7 x 78 = 448 + 546 = 994\n\nTotal cost across all days: 1481.67 + 1901.67 + 2387 + 2135 + 994 = 8899.34\nCuisines: The prompt specifies American, Mexican, Chinese, and Italian, so all cuisine constraints are satisfied.", "gpt-4-1106-preview_direct_sole-planning_parsed_results": [{"day": 1, "current_city": "from Washington to Buffalo (New York)", "transportation": "Flight Number: F3633555, from Washington to Buffalo (New York), Departure Time: 14:56, Arrival Time: 16:00", "breakfast": "-", "attraction": "The Buffalo Zoo, Buffalo (New York);", "lunch": "-", "dinner": "Tibby's New Orleans Kitchen, Buffalo (New York)", "accommodation": "Cozy Studio in Heart of Ft Greene, Buffalo (New York)"}, {"day": 2, "current_city": "Buffalo (New York)", "transportation": "-", "breakfast": "Shokitini, Buffalo (New York)", "attraction": "Buffalo and Erie County Botanical Gardens, Buffalo (New York); Buffalo AKG Art Museum, Buffalo (New York);", "lunch": "Pinch Of Spice, Buffalo (New York)", "dinner": "Ammu's South Indian Restaurant, Buffalo (New York)", "accommodation": "Cozy Studio in Heart of Ft Greene, Buffalo (New York)"}, {"day": 3, "current_city": "from Buffalo (New York) to New York City (New York)", "transportation": "Flight Number: F3640947, from Buffalo to New York City (New York), Departure Time: 14:04, Arrival Time: 15:22", "breakfast": "Maa Kali Foods, Buffalo (New York)", "attraction": "Top of The Rock, New York City (New York); One World Observatory, New York City (New York);", "lunch": "Seasons 52 Fresh Grill, New York City (New York)", "dinner": "Gurgaon Hights, New York City (New York)", "accommodation": "A Contemporary Homelike Stay in the Best of BK, New York City (New York)"}, {"day": 4, "current_city": "New York City (New York)", "transportation": "-", "breakfast": "Green Chick Chop, New York City (New York)", "attraction": "The High Line, New York City (New York); Empire State Building, New York City (New York);", "lunch": "Lord of the Drinks Forum, New York City (New York)", "dinner": "Goosebumps, New York City (New York)", "accommodation": "A Contemporary Homelike Stay in the Best of BK, New York City (New York)"}, {"day": 5, "current_city": "from New York City (New York) to Washington", "transportation": "Flight Number: F3661892, from New York City to Washington, Departure Time: 11:31, Arrival Time: 12:45", "breakfast": "Sir John Bakery Cafe, New York City (New York)", "attraction": "-", "lunch": "-", "dinner": "-", "accommodation": "-"}]}]