[{"gpt-4-1106-preview_direct_sole-planning_results": "Travel Plan:\n\nDays: 1\nCurrent City: from Key West to Evansville (Indiana)\nTransportation: Taxi, from Key West to Evansville, duration: 18 hours 21 mins, distance: 1,961 km, cost: $1,961\nBreakfast: -\nAttraction: -\nLunch: -\nDinner: -\nAccommodation: -\n\nNumber of people: 1\nTotal cost: $1,961\nAccommodation minimum nights: -\n\nDays: 2\nCurrent City: Evansville (Indiana)\nTransportation: -\nBreakfast: Punjabi Restaurant, Evansville (Indiana), cost: $29, cuisines: Cafe, Bakery, Desserts, Fast Food\nAttraction: Mesker Park Zoo, Evansville (Indiana)\nLunch: J. Christopher's, Evansville (Indiana), cost: $39, cuisines: Tea, Cafe, Desserts, Seafood\nDinner: Twist of Italy, Evansville (Indiana), cost: $85, cuisines: Desserts, Pizza, Mexican, Mediterranean, Seafood\nAccommodation: *Lovely Apt In Heart Of Park Slope*, Evansville (Indiana), cost: $70.0, maximum occupancy: 3, house rules: No pets, minimum nights: 14.0\n\nNumber of people: 1\nTotal cost: $29 + $39 + $85 + $70 = $223\nAccommodation minimum nights: 1/14\n\nDays: 3\nCurrent City: from Evansville (Indiana) to South Bend (Indiana)\nTransportation: Self-driving, from Evansville to South Bend, duration: 5 hours 1 min, distance: 512 km, cost: $25\nBreakfast: McDonald's, Evansville (Indiana), cost: $84, cuisines: Tea, Bakery, BBQ, Indian, Seafood\nAttraction: Studebaker National Museum, South Bend (Indiana)\nLunch: Krips Restaurant, South Bend (Indiana), cost: $59, cuisines: Tea, Mediterranean, Fast Food\nDinner: MOB Brewpub, South Bend (Indiana), cost: $67, cuisines: Cafe, Mexican, American, BBQ\nAccommodation: Just Right in Lovely Greenpoint, South Bend (Indiana), cost: $614.0, room type: Private room, house rules: No smoking & No visitors, minimum nights: 7.0, maximum occupancy: 1\n\nNumber of people: 1\nTotal cost: $84 + $59 + $67 + $614 + $25 = $849\nAccommodation minimum nights: 1/7\n\nDays: 4\nCurrent City: South Bend (Indiana)\nTransportation: -\nBreakfast: Our Story Bistro & Tea Room, South Bend (Indiana), cost: $10, cuisines: Tea, Pizza, Italian, BBQ, Mediterranean, Seafood\nAttraction: Potawatomi Zoo, South Bend (Indiana)\nLunch: Roadhouse Cafe, South Bend (Indiana), cost: $24, cuisines: Desserts, Pizza, Bakery, Fast Food, Chinese\nDinner: Lotus Pond, South Bend (Indiana), cost: $83, cuisines: Tea, Seafood, Italian\nAccommodation: Just Right in Lovely Greenpoint, South Bend (Indiana), cost: $614.0, room type: Private room, house rules: No smoking & No visitors, minimum nights: 7.0, maximum occupancy: 1\n\nNumber of people: 1\nTotal cost: $10 + $24 + $83 + $614 = $731\nAccommodation minimum nights: 2/7\n\nDays: 5\nCurrent City: from South Bend (Indiana) to Key West\nTransportation: Self-driving, from South Bend to Key West, duration: 22 hours 38 mins, distance: 2,406 km, cost: $120\nBreakfast: -\nAttraction: -\nLunch: -\nDinner: -\nAccommodation: -\n\nNumber of people: 1\nTotal cost: $120\n\nTotal cost across all days: $1,961 + $223 + $849 + $731 + $120 = $3,884\n\nUnfortunately, the total cost of $3,884 exceeds the specified budget of $2,000. Adjustments must be made to the travel plan to meet the budget constraints. However, given the high cost of transportation (taxi from Key West to Evansville alone costs $1,961), it is not feasible to create a travel plan within the $2,000 budget while covering two cities in Indiana and returning to Key West within the specified dates.", "gpt-4-1106-preview_direct_sole-planning_parsed_results": [{"day": 1, "current_city": "from Key West to Evansville", "transportation": "Taxi, from Key West to Evansville, duration: 18 hours 21 mins, distance: 1,961 km", "breakfast": "-", "attraction": "-", "lunch": "-", "dinner": "-", "accommodation": "-"}, {"day": 2, "current_city": "Evansville", "transportation": "-", "breakfast": "Punjabi Restaurant, Evansville", "attraction": "Mesker Park Zoo, Evansville", "lunch": "J. Christopher's, Evansville", "dinner": "Twist of Italy, Evansville", "accommodation": "*Lovely Apt In Heart Of Park Slope*, Evansville"}, {"day": 3, "current_city": "from Evansville to South Bend", "transportation": "Self-driving, from Evansville to South Bend, duration: 5 hours 1 min, distance: 512 km", "breakfast": "McDonald's, Evansville", "attraction": "Studebaker National Museum, South Bend", "lunch": "Krips Restaurant, South Bend", "dinner": "MOB Brewpub, South Bend", "accommodation": "Just Right in Lovely Greenpoint, South Bend"}, {"day": 4, "current_city": "South Bend", "transportation": "-", "breakfast": "Our Story Bistro & Tea Room, South Bend", "attraction": "Potawatomi Zoo, South Bend", "lunch": "Roadhouse Cafe, South Bend", "dinner": "Lotus Pond, South Bend", "accommodation": "Just Right in Lovely Greenpoint, South Bend"}, {"day": 5, "current_city": "from South Bend to Key West", "transportation": "Self-driving, from South Bend to Key West, duration: 22 hours 38 mins, distance: 2,406 km", "breakfast": "-", "attraction": "-", "lunch": "-", "dinner": "-", "accommodation": "-"}]}]