[{"gpt-4-1106-preview_direct_sole-planning_results": "Travel Plan:\n\nDays: 1\nCurrent City: from Philadelphia to Richmond (Virginia)\nTransportation: Flight Number: F3734535, from Philadelphia to Richmond (Virginia), Departure Time: 09:40, Arrival Time: 10:51, cost: 47\nBreakfast: -\nAttraction: Virginia Museum of Fine Arts, Richmond (Virginia)\nLunch: Guang Zhou Chinese Restaurant, Richmond (Virginia), cost: 84, cuisines: Desserts, Tea, Cafe, Fast Food, Chinese, Indian\nDinner: Sandpiper Restaurant & Lounge, Richmond (Virginia), cost: 20, cuisines: Tea, Cafe, Desserts, Seafood\nAccommodation: 12 East 86th St full furnished, Richmond (Virginia), cost: 451.0, maximum occupancy: 2, house rules: No parties, minimum nights: 30.0\n\nNumber of people: 1\nTotal cost: 47 + 84 + 20 + 451 = 602\n\nDays: 2\nCurrent City: Richmond (Virginia)\nTransportation: -\nBreakfast: Paradise, Richmond (Virginia), cost: 80, cuisines: Tea, Pizza, Italian, Fast Food, Seafood\nAttraction: Maymont, Richmond (Virginia); The Poe Museum, Richmond (Virginia)\nLunch: Perfect Bake, Richmond (Virginia), cost: 33, cuisines: Desserts, Tea, Italian, Bakery, Cafe, American\nDinner: Sugarcraft Patisserie, Richmond (Virginia), cost: 38, cuisines: French, Desserts, Fast Food\nAccommodation: 12 East 86th St full furnished, Richmond (Virginia), cost: 451.0, maximum occupancy: 2, house rules: No parties, minimum nights: 30.0\n\nNumber of people: 1\nTotal cost: 80 + 33 + 38 + 451 = 602\n\nDays: 3\nCurrent City: from Richmond (Virginia) to Jamestown (Virginia)\nTransportation: Self-driving, from Richmond to Jamestown, duration: 1 hour 1 min, distance: 92.4 km, cost: 4\nBreakfast: Welcome, Richmond (Virginia), cost: 86, cuisines: Tea, French, Bakery, Indian\nAttraction: Historic Jamestowne, Jamestown (Virginia); Jamestown Settlement, Jamestown (Virginia)\nLunch: Beyond Breads, Jamestown (Virginia), cost: 95, cuisines: French, Cafe, Fast Food\nDinner: Cafe Soul Garden, Jamestown (Virginia), cost: 99, cuisines: Desserts, Bakery, Cafe, American, Seafood\nAccommodation: New York City Manhattan Midtown Convenient Place, Jamestown (Virginia), cost: 795.0, maximum occupancy: 6, house rules: No visitors & No parties & No children under 10, minimum nights: 1.0\n\nNumber of people: 1\nTotal cost: 4 + 86 + 95 + 99 + 795 = 1079\n\nDays: 4\nCurrent City: Jamestown (Virginia)\nTransportation: -\nBreakfast: Chauhan Hotel, Jamestown (Virginia), cost: 13, cuisines: Desserts, Mexican, BBQ, Bakery, Cafe\nAttraction: Archaearium Archaeology Museum, Jamestown (Virginia); Jamestown Glasshouse, Jamestown (Virginia)\nLunch: Mughlai Flavours, Jamestown (Virginia), cost: 12, cuisines: Pizza, French, Bakery, BBQ, Cafe\nDinner: Janaab, Jamestown (Virginia), cost: 38, cuisines: Pizza, Fast Food, Cafe, Indian, Seafood\nAccommodation: New York City Manhattan Midtown Convenient Place, Jamestown (Virginia), cost: 795.0, maximum occupancy: 6, house rules: No visitors & No parties & No children under 10, minimum nights: 1.0\n\nNumber of people: 1\nTotal cost: 13 + 12 + 38 + 795 = 858\n\nDays: 5\nCurrent City: from Jamestown (Virginia) to Charlottesville (Virginia)\nTransportation: Self-driving, from Jamestown to Charlottesville, duration: 2 hours 2 mins, distance: 206 km, cost: 10\nBreakfast: The Food Junction, Jamestown (Virginia), cost: 78, cuisines: Tea, Indian, Fast Food\nAttraction: Monticello, Charlottesville (Virginia); Virginia Discovery Museum, Charlottesville (Virginia)\nLunch: Mama's Fish House, Charlottesville (Virginia), cost: 63, cuisines: Tea, Pizza, Desserts, Fast Food\nDinner: Restaurant Andre, Charlottesville (Virginia), cost: 250, cuisines: Desserts, Tea, BBQ, Fast Food, Chinese\nAccommodation: Williamsburg Hidden Gem, Charlottesville (Virginia), cost: 391.0, maximum occupancy: 2, house rules: No visitors & No smoking, minimum nights: 1.0\n\nNumber of people: 1\nTotal cost: 10 + 78 + 63 + 250 + 391 = 792\n\nDays: 6\nCurrent City: Charlottesville (Virginia)\nTransportation: -\nBreakfast: Takamaka, Charlottesville (Virginia), cost: 72, cuisines: Tea, Pizza, Italian, BBQ, Fast Food\nAttraction: The Fralin Museum of Art at the University of Virginia, Charlottesville (Virginia); Ix Art Park, Charlottesville (Virginia)\nLunch: Sandys Cocktails & Kitchen, Charlottesville (Virginia), cost: 82, cuisines: Tea, Pizza, BBQ, Indian, Seafood\nDinner: Dawat-e-Ishq, Charlottesville (Virginia), cost: 26, cuisines: Desserts, Tea, Italian, BBQ, Fast Food\nAccommodation: Williamsburg Hidden Gem, Charlottesville (Virginia), cost: 391.0, maximum occupancy: 2, house rules: No visitors & No smoking, minimum nights: 1.0\n\nNumber of people: 1\nTotal cost: 72 + 82 + 26 + 391 = 571\n\nDays: 7\nCurrent City: from Charlottesville (Virginia) to Philadelphia\nTransportation: Self-driving, from Charlottesville to Philadelphia, duration: 4 hours 24 mins, distance: 411 km, cost: 20\nBreakfast: Firefly, Charlottesville (Virginia), cost: 30, cuisines: Pizza, Bakery\nAttraction: -\nLunch: -\nDinner: -\nAccommodation: -\n\nNumber of people: 1\nTotal cost: 20 + 30 = 50\n\nTotal cost across all days: 602 + 602 + 1079 + 858 + 792 + 571 + 50 = 4554\n\nNote: The total cost exceeds the specified budget of $2,900. Adjustments to the plan, such as changing accommodations or dining options, are necessary to meet the budget constraint. Additionally, the travel plan includes all required details for each day, adhering to the constraints provided in the query. However, due to the budget constraint not being met, this plan would require revision.", "gpt-4-1106-preview_direct_sole-planning_parsed_results": [{"day": 1, "current_city": "from Philadelphia to Richmond (Virginia)", "transportation": "Flight Number: F3734535, from Philadelphia to Richmond (Virginia), Departure Time: 09:40, Arrival Time: 10:51", "breakfast": "-", "attraction": "Virginia Museum of Fine Arts, Richmond (Virginia);", "lunch": "Guang Zhou Chinese Restaurant, Richmond (Virginia)", "dinner": "Sandpiper Restaurant & Lounge, Richmond (Virginia)", "accommodation": "12 East 86th St full furnished, Richmond (Virginia)"}, {"day": 2, "current_city": "Richmond (Virginia)", "transportation": "-", "breakfast": "Paradise, Richmond (Virginia)", "attraction": "Maymont, Richmond (Virginia);The Poe Museum, Richmond (Virginia);", "lunch": "Perfect Bake, Richmond (Virginia)", "dinner": "Sugarcraft Patisserie, Richmond (Virginia)", "accommodation": "12 East 86th St full furnished, Richmond (Virginia)"}, {"day": 3, "current_city": "from Richmond (Virginia) to Jamestown (Virginia)", "transportation": "Self-driving, from Richmond to Jamestown, duration: 1 hour 1 min, distance: 92.4 km", "breakfast": "Welcome, Richmond (Virginia)", "attraction": "Historic Jamestowne, Jamestown (Virginia);Jamestown Settlement, Jamestown (Virginia);", "lunch": "Beyond Breads, Jamestown (Virginia)", "dinner": "Cafe Soul Garden, Jamestown (Virginia)", "accommodation": "New York City Manhattan Midtown Convenient Place, Jamestown (Virginia)"}, {"day": 4, "current_city": "Jamestown (Virginia)", "transportation": "-", "breakfast": "Chauhan Hotel, Jamestown (Virginia)", "attraction": "Archaearium Archaeology Museum, Jamestown (Virginia);Jamestown Glasshouse, Jamestown (Virginia);", "lunch": "Mughlai Flavours, Jamestown (Virginia)", "dinner": "Janaab, Jamestown (Virginia)", "accommodation": "New York City Manhattan Midtown Convenient Place, Jamestown (Virginia)"}, {"day": 5, "current_city": "from Jamestown (Virginia) to Charlottesville (Virginia)", "transportation": "Self-driving, from Jamestown to Charlottesville, duration: 2 hours 2 mins, distance: 206 km", "breakfast": "The Food Junction, Jamestown (Virginia)", "attraction": "Monticello, Charlottesville (Virginia);Virginia Discovery Museum, Charlottesville (Virginia);", "lunch": "Mama's Fish House, Charlottesville (Virginia)", "dinner": "Restaurant Andre, Charlottesville (Virginia)", "accommodation": "Williamsburg Hidden Gem, Charlottesville (Virginia)"}, {"day": 6, "current_city": "Charlottesville (Virginia)", "transportation": "-", "breakfast": "Takamaka, Charlottesville (Virginia)", "attraction": "The Fralin Museum of Art at the University of Virginia, Charlottesville (Virginia);Ix Art Park, Charlottesville (Virginia);", "lunch": "Sandys Cocktails & Kitchen, Charlottesville (Virginia)", "dinner": "Dawat-e-Ishq, Charlottesville (Virginia)", "accommodation": "Williamsburg Hidden Gem, Charlottesville (Virginia)"}, {"day": 7, "current_city": "from Charlottesville (Virginia) to Philadelphia", "transportation": "Self-driving, from Charlottesville to Philadelphia, duration: 4 hours 24 mins, distance: 411 km", "breakfast": "Firefly, Charlottesville (Virginia)", "attraction": "-", "lunch": "-", "dinner": "-", "accommodation": "-"}]}]