[{"gpt-4-1106-preview_direct_sole-planning_results": "Travel Plan:\n\nDays: 1\nCurrent City: from Chicago to Wilmington (North Carolina)\nTransportation: Self-driving, from Chicago to Wilmington, duration: 14 hours 11 mins, distance: 1,505 km, cost: 75\nBreakfast: -\nAttraction: -\nLunch: -\nDinner: -\nAccommodation: Prime East Village location w/backyard garden!, Wilmington (North Carolina), cost: 978.0, room type: Entire home/apt, house rules: No pets & No smoking, minimum nights: 4.0, maximum occupancy: 7\n\nNumber of people: 2\nTotal cost: 75 (transportation) + 978 (accommodation) = 1053\nAccommodation minimum nights: 1/4\n\nDays: 2\nCurrent City: Wilmington (North Carolina)\nTransportation: -\nBreakfast: Azteca, Wilmington (North Carolina), cost: 56, cuisines: Cafe, Indian, BBQ\nAttraction: Bellamy Mansion Museum, Wilmington (North Carolina); Cape Fear Museum of History and Science, Wilmington (North Carolina)\nLunch: Bandit Burrito, Wilmington (North Carolina), cost: 26, cuisines: Desserts, French, Bakery, Fast Food, Seafood\nDinner: Taco Bus, Wilmington (North Carolina), cost: 59, cuisines: Tea, Cafe, BBQ\nAccommodation: Prime East Village location w/backyard garden!, Wilmington (North Carolina), cost: 978.0, room type: Entire home/apt, house rules: No pets & No smoking, minimum nights: 4.0, maximum occupancy: 7\n\nNumber of people: 2\nTotal cost: 2 x 56 + 2 x 26 + 2 x 59 + 978 = 1254\nAccommodation minimum nights: 2/4\n\nDays: 3\nCurrent City: from Wilmington (North Carolina) to Charlotte (North Carolina)\nTransportation: Self-driving, from Wilmington to Charlotte, duration: 3 hours 24 mins, distance: 324 km, cost: 16\nBreakfast: -\nAttraction: Wilmington Riverwalk, Wilmington (North Carolina)\nLunch: -\nDinner: -\nAccommodation: Elegant Studio Apt in Prospect Heights, Charlotte (North Carolina), cost: 640.0, room type: Entire home/apt, house rules: No parties, minimum nights: 2.0, maximum occupancy: 5\n\nNumber of people: 2\nTotal cost: 16 (transportation) + 640 (accommodation) = 656\nAccommodation minimum nights: 1/2\n\nDays: 4\nCurrent City: Charlotte (North Carolina)\nTransportation: -\nBreakfast: Olive Tree Cafe, Charlotte (North Carolina), cost: 23, cuisines: Tea, Chinese, Desserts\nAttraction: Freedom Park, Charlotte (North Carolina); Levine Museum of the New South, Charlotte (North Carolina)\nLunch: Central Perk 7, Charlotte (North Carolina), cost: 87, cuisines: Pizza, Bakery, BBQ, Fast Food\nDinner: Subway, Charlotte (North Carolina), cost: 60, cuisines: Tea, Cafe, Mexican, Chinese, Seafood\nAccommodation: Elegant Studio Apt in Prospect Heights, Charlotte (North Carolina), cost: 640.0, room type: Entire home/apt, house rules: No parties, minimum nights: 2.0, maximum occupancy: 5\n\nNumber of people: 2\nTotal cost: 2 x 23 + 2 x 87 + 2 x 60 + 640 = 980\nAccommodation minimum nights: 2/2\n\nDays: 5\nCurrent City: from Charlotte (North Carolina) to Chicago\nTransportation: Self-driving, from Charlotte to Chicago, duration: 11 hours 39 mins, distance: 1,215 km, cost: 60\nBreakfast: -\nAttraction: -\nLunch: -\nDinner: -\nAccommodation: -\n\nNumber of people: 2\nTotal cost: 60 (transportation) = 60\n\nTotal cost across all days: 1053 + 1254 + 656 + 980 + 60 = 4003\n\nNote: The total cost exceeds the budget of $3,600. Adjustments are needed to meet the budget constraint. Options include finding cheaper accommodations or reducing meal costs. Additionally, the accommodation selected does not meet the pet-friendly requirement. Please advise on which preferences to prioritize for adjustments.", "gpt-4-1106-preview_direct_sole-planning_parsed_results": [{"day": 1, "current_city": "from Chicago to Wilmington (North Carolina)", "transportation": "Self-driving, from Chicago to Wilmington, duration: 14 hours 11 mins, distance: 1,505 km", "breakfast": "-", "attraction": "-", "lunch": "-", "dinner": "-", "accommodation": "Prime East Village location w/backyard garden!, Wilmington (North Carolina)"}, {"day": 2, "current_city": "Wilmington (North Carolina)", "transportation": "-", "breakfast": "Azteca, Wilmington (North Carolina)", "attraction": "Bellamy Mansion Museum, Wilmington (North Carolina);Cape Fear Museum of History and Science, Wilmington (North Carolina);", "lunch": "Bandit Burrito, Wilmington (North Carolina)", "dinner": "Taco Bus, Wilmington (North Carolina)", "accommodation": "Prime East Village location w/backyard garden!, Wilmington (North Carolina)"}, {"day": 3, "current_city": "from Wilmington (North Carolina) to Charlotte (North Carolina)", "transportation": "Self-driving, from Wilmington to Charlotte, duration: 3 hours 24 mins, distance: 324 km", "breakfast": "-", "attraction": "Wilmington Riverwalk, Wilmington (North Carolina)", "lunch": "-", "dinner": "-", "accommodation": "Elegant Studio Apt in Prospect Heights, Charlotte (North Carolina)"}, {"day": 4, "current_city": "Charlotte (North Carolina)", "transportation": "-", "breakfast": "Olive Tree Cafe, Charlotte (North Carolina)", "attraction": "Freedom Park, Charlotte (North Carolina);Levine Museum of the New South, Charlotte (North Carolina);", "lunch": "Central Perk 7, Charlotte (North Carolina)", "dinner": "Subway, Charlotte (North Carolina)", "accommodation": "Elegant Studio Apt in Prospect Heights, Charlotte (North Carolina)"}, {"day": 5, "current_city": "from Charlotte (North Carolina) to Chicago", "transportation": "Self-driving, from Charlotte to Chicago, duration: 11 hours 39 mins, distance: 1,215 km", "breakfast": "-", "attraction": "-", "lunch": "-", "dinner": "-", "accommodation": "-"}]}]