[{"gpt-4-1106-preview_direct_sole-planning_results": "Travel Plan:\n\nDays: 1\nCurrent City: from Elmira to Detroit\nTransportation: Flight Number: F3808914, from Elmira to Detroit, Departure Time: 15:48, Arrival Time: 17:00, cost: 70\nBreakfast: -\nAttraction: Detroit Institute of Arts, Detroit (Address: 5200 Woodward Ave, Detroit, MI 48202, USA)\nLunch: -\nDinner: Vapour Pub & Brewery, Detroit, cost: 80, cuisines: French, BBQ, Fast Food, Cafe, Seafood\nAccommodation: Cozy 1 bedroom in the heart of Fort Greene, Detroit, cost: 751.0, maximum occupancy: 6, house rules: No pets & No parties, minimum nights: 3.0\n\nNumber of people: 2\nTotal cost: 2 x 70 + 2 x 80 + 751 = 1051\nAccommodation minimum nights: 1/3\n\nDays: 2\nCurrent City: Detroit\nTransportation: -\nBreakfast: Southern Bliss Bakery, Detroit, cost: 28, cuisines: Tea, BBQ, Desserts, Seafood\nAttraction: Detroit Historical Museum, Detroit (Address: 5401 Woodward Ave, Detroit, MI 48202, USA); Belle Isle Aquarium, Detroit (Address: 3 Inselruhe Ave, Detroit, MI 48207, USA)\nLunch: A Dong Restaurant, Detroit, cost: 40, cuisines: Tea, Cafe, Pizza\nDinner: Bistro Flamme Bois, Detroit, cost: 100, cuisines: Chinese, Bakery, BBQ\nAccommodation: Cozy 1 bedroom in the heart of Fort Greene, Detroit, cost: 751.0, maximum occupancy: 6, house rules: No pets & No parties, minimum nights: 3.0\n\nNumber of people: 2\nTotal cost: 2 x 28 + 2 x 40 + 2 x 100 + 751 = 1087\nAccommodation minimum nights: 2/3\n\nDays: 3\nCurrent City: Detroit\nTransportation: -\nBreakfast: BMG - All Day Dining, Detroit, cost: 15, cuisines: Desserts, Bakery, BBQ, Indian, Seafood\nAttraction: Motown Museum, Detroit (Address: 2648 Berry Gordy Jr. Boulevard, 2648 W Grand Blvd, Detroit, MI 48208, USA); Michigan Science Center, Detroit (Address: 5020 John R St, Detroit, MI 48202, USA)\nLunch: Mitalis Kitchen, Detroit, cost: 28, cuisines: Pizza, BBQ, Chinese, Mediterranean, Seafood\nDinner: Chye Seng Huat Hardware, Detroit, cost: 94, cuisines: Tea, Mexican, Seafood\nAccommodation: Cozy 1 bedroom in the heart of Fort Greene, Detroit, cost: 751.0, maximum occupancy: 6, house rules: No pets & No parties, minimum nights: 3.0\n\nNumber of people: 2\nTotal cost: 2 x 15 + 2 x 28 + 2 x 94 + 751 = 1025\nAccommodation minimum nights: 3/3\n\nTotal cost across all days: 1051 + 1087 + 1025 = 3163\n\nNote: The total cost exceeds the specified budget of $2,200. Adjustments are needed to meet the budget constraint. Since the accommodations are not pet-friendly and exceed the budget, we need to find an alternative that meets both criteria.\n\nAdjusted Travel Plan:\n\nDays: 1\nCurrent City: from Elmira to Detroit\nTransportation: Self-driving, from Elmira to Detroit, duration: 7 hours 7 mins, distance: 764 km, cost: 38\nBreakfast: -\nAttraction: Detroit Institute of Arts, Detroit (Address: 5200 Woodward Ave, Detroit, MI 48202, USA)\nLunch: -\nDinner: Vapour Pub & Brewery, Detroit, cost: 80, cuisines: French, BBQ, Fast Food, Cafe, Seafood\nAccommodation: Romantic Top Floor Brownstone in Crown Heights, Detroit, cost: 1077.0, maximum occupancy: 6, house rules: No pets & No smoking, minimum nights: 1.0\n\nNumber of people: 2\nTotal cost: 2 x 38 + 2 x 80 + 1077 = 1313\nAccommodation minimum nights: 1/1\n\nDays: 2\nCurrent City: Detroit\nTransportation: -\nBreakfast: Southern Bliss Bakery, Detroit, cost: 28, cuisines: Tea, BBQ, Desserts, Seafood\nAttraction: Detroit Historical Museum, Detroit (Address: 5401 Woodward Ave, Detroit, MI 48202, USA); Belle Isle Aquarium, Detroit (Address: 3 Inselruhe Ave, Detroit, MI 48207, USA)\nLunch: A Dong Restaurant, Detroit, cost: 40, cuisines: Tea, Cafe, Pizza\nDinner: Bistro Flamme Bois, Detroit, cost: 100, cuisines: Chinese, Bakery, BBQ\nAccommodation: Romantic Top Floor Brownstone in Crown Heights, Detroit, cost: 1077.0, maximum occupancy: 6, house rules: No pets & No smoking, minimum nights: 1.0\n\nNumber of people: 2\nTotal cost: 2 x 28 + 2 x 40 + 2 x 100 + 1077 = 1413\nAccommodation minimum nights: 1/1\n\nDays: 3\nCurrent City: Detroit\nTransportation: -\nBreakfast: BMG - All Day Dining, Detroit, cost: 15, cuisines: Desserts, Bakery, BBQ, Indian, Seafood\nAttraction: Motown Museum, Detroit (Address: 2648 Berry Gordy Jr. Boulevard, 2648 W Grand Blvd, Detroit, MI 48208, USA); Michigan Science Center, Detroit (Address: 5020 John R St, Detroit, MI 48202, USA)\nLunch: Mitalis Kitchen, Detroit, cost: 28, cuisines: Pizza, BBQ, Chinese, Mediterranean, Seafood\nDinner: Chye Seng Huat Hardware, Detroit, cost: 94, cuisines: Tea, Mexican, Seafood\nAccommodation: Romantic Top Floor Brownstone in Crown Heights, Detroit, cost: 1077.0, maximum occupancy: 6, house rules: No pets & No smoking, minimum nights: 1.0\n\nNumber of people: 2\nTotal cost: 2 x 15 + 2 x 28 + 2 x 94 + 1077 = 1351\nAccommodation minimum nights: 1/1\n\nTotal cost across all days: 1313 + 1413 + 1351 = 4077\n\nNote: The adjusted plan still exceeds the budget and does not meet the pet-friendly requirement. Further adjustments are needed to find accommodations that are pet-friendly and within budget. However, the provided data does not include pet-friendly accommodations, so we cannot complete the travel plan within the given constraints.", "gpt-4-1106-preview_direct_sole-planning_parsed_results": [{"day": 1, "current_city": "from Elmira to Detroit", "transportation": "Flight Number: F3808914, from Elmira to Detroit, Departure Time: 15:48, Arrival Time: 17:00", "breakfast": "-", "attraction": "Detroit Institute of Arts, Detroit", "lunch": "-", "dinner": "Vapour Pub & Brewery, Detroit", "accommodation": "Cozy 1 bedroom in the heart of Fort Greene, Detroit"}, {"day": 2, "current_city": "Detroit", "transportation": "-", "breakfast": "Southern Bliss Bakery, Detroit", "attraction": "Detroit Historical Museum, Detroit;Belle Isle Aquarium, Detroit;", "lunch": "A Dong Restaurant, Detroit", "dinner": "Bistro Flamme Bois, Detroit", "accommodation": "Cozy 1 bedroom in the heart of Fort Greene, Detroit"}, {"day": 3, "current_city": "Detroit", "transportation": "-", "breakfast": "BMG - All Day Dining, Detroit", "attraction": "Motown Museum, Detroit;Michigan Science Center, Detroit;", "lunch": "Mitalis Kitchen, Detroit", "dinner": "Chye Seng Huat Hardware, Detroit", "accommodation": "Cozy 1 bedroom in the heart of Fort Greene, Detroit"}, {"day": 1, "current_city": "from Elmira to Detroit", "transportation": "Self-driving, from Elmira to Detroit, duration: 7 hours 7 mins, distance: 764 km", "breakfast": "-", "attraction": "Detroit Institute of Arts, Detroit", "lunch": "-", "dinner": "Vapour Pub & Brewery, Detroit", "accommodation": "Romantic Top Floor Brownstone in Crown Heights, Detroit"}, {"day": 2, "current_city": "Detroit", "transportation": "-", "breakfast": "Southern Bliss Bakery, Detroit", "attraction": "Detroit Historical Museum, Detroit;Belle Isle Aquarium, Detroit;", "lunch": "A Dong Restaurant, Detroit", "dinner": "Bistro Flamme Bois, Detroit", "accommodation": "Romantic Top Floor Brownstone in Crown Heights, Detroit"}, {"day": 3, "current_city": "Detroit", "transportation": "-", "breakfast": "BMG - All Day Dining, Detroit", "attraction": "Motown Museum, Detroit;Michigan Science Center, Detroit;", "lunch": "Mitalis Kitchen, Detroit", "dinner": "Chye Seng Huat Hardware, Detroit", "accommodation": "Romantic Top Floor Brownstone in Crown Heights, Detroit"}]}]