[{"gpt-4-1106-preview_direct_sole-planning_results": "Travel Plan:\n\nDays: 1\nCurrent City: from Philadelphia to Richmond (Virginia)\nTransportation: Flight Number: F3730367, from Philadelphia to Richmond (Virginia), Departure Time: 14:03, Arrival Time: 15:03, cost: 73\nBreakfast: -\nAttraction: Virginia Museum of Fine Arts, Richmond (Virginia)\nLunch: Sandpiper Restaurant & Lounge, Richmond (Virginia), cost: 20, cuisines: Tea, Cafe, Desserts, Seafood\nDinner: Welcome, Richmond (Virginia), cost: 86, cuisines: Tea, French, Bakery, Indian\nAccommodation: 12 East 86th St full furnished, Richmond (Virginia), cost: 451.0, maximum occupancy: 2, house rules: No parties, minimum nights: 30.0\n\nNumber of people: 1\nTotal cost: 73 (flight) + 20 (lunch) + 86 (dinner) + 451 (accommodation) = 630\nAccommodation minimum nights: 1/30\n\nDays: 2\nCurrent City: Richmond (Virginia)\nTransportation: -\nBreakfast: Perfect Bake, Richmond (Virginia), cost: 33, cuisines: Desserts, Tea, Italian, Bakery, Cafe, American\nAttraction: Maymont, Richmond (Virginia); The Poe Museum, Richmond (Virginia)\nLunch: Paradise, Richmond (Virginia), cost: 80, cuisines: Tea, Pizza, Italian, Fast Food, Seafood\nDinner: Sugarcraft Patisserie, Richmond (Virginia), cost: 38, cuisines: French, Desserts, Fast Food\nAccommodation: 12 East 86th St full furnished, Richmond (Virginia), cost: 451.0, maximum occupancy: 2, house rules: No parties, minimum nights: 30.0\n\nNumber of people: 1\nTotal cost: 33 (breakfast) + 80 (lunch) + 38 (dinner) + 451 (accommodation) = 602\nAccommodation minimum nights: 2/30\n\nDays: 3\nCurrent City: from Richmond (Virginia) to Petersburg (Virginia)\nTransportation: Taxi, from Richmond (Virginia) to Petersburg (Virginia), duration: 25 mins, distance: 38.0 km, cost: 38\nBreakfast: Mother's Kitchen, Richmond (Virginia), cost: 46, cuisines: Tea, Cafe, Mexican, Fast Food, Chinese\nAttraction: Petersburg National Battlefield, Petersburg (Virginia)\nLunch: 5 Little Pigs, Petersburg (Virginia), cost: 46, cuisines: Tea, French, Desserts\nDinner: Midnight Sutra, Petersburg (Virginia), cost: 65, cuisines: Tea, Pizza, Indian, Desserts\nAccommodation: Charming cozy bedroom in Clinton Hill!, Petersburg (Virginia), cost: 274.0, maximum occupancy: 2, house rules: No smoking & No parties & No pets, minimum nights: 3.0\n\nNumber of people: 1\nTotal cost: 38 (taxi) + 46 (breakfast) + 46 (lunch) + 65 (dinner) + 274 (accommodation) = 469\nAccommodation minimum nights: 1/3\n\nDays: 4\nCurrent City: Petersburg (Virginia)\nTransportation: -\nBreakfast: Tea'se Me - Rooftop Tea Boutique, Petersburg (Virginia), cost: 49, cuisines: Tea, Cafe, Desserts, Seafood\nAttraction: Centre Hill Mansion-Museum, Petersburg (Virginia); Pamplin Historical Park, Petersburg (Virginia)\nLunch: Bake-a-boo, Petersburg (Virginia), cost: 40, cuisines: Tea, Cafe, Pizza, BBQ\nDinner: Lemon Chick, Petersburg (Virginia), cost: 34, cuisines: Desserts, Pizza, French, Fast Food, Chinese, Seafood\nAccommodation: Charming cozy bedroom in Clinton Hill!, Petersburg (Virginia), cost: 274.0, maximum occupancy: 2, house rules: No smoking & No parties & No pets, minimum nights: 3.0\n\nNumber of people: 1\nTotal cost: 49 (breakfast) + 40 (lunch) + 34 (dinner) + 274 (accommodation) = 397\nAccommodation minimum nights: 2/3\n\nDays: 5\nCurrent City: from Petersburg (Virginia) to Charlottesville (Virginia)\nTransportation: Self-driving, from Petersburg (Virginia) to Charlottesville (Virginia), duration: 1 hour 30 mins, distance: 152 km, cost: 7\nBreakfast: Chai Point, Petersburg (Virginia), cost: 76, cuisines: Cafe, Pizza\nAttraction: Monticello, Charlottesville (Virginia)\nLunch: Mama's Fish House, Charlottesville (Virginia), cost: 63, cuisines: Tea, Pizza, Desserts, Fast Food\nDinner: Restaurant Andre, Charlottesville (Virginia), cost: 250, cuisines: Desserts, Tea, BBQ, Fast Food, Chinese\nAccommodation: Williamsburg Hidden Gem, Charlottesville (Virginia), cost: 391.0, maximum occupancy: 2, house rules: No visitors & No smoking, minimum nights: 1.0\n\nNumber of people: 1\nTotal cost: 7 (self-driving) + 76 (breakfast) + 63 (lunch) + 250 (dinner) + 391 (accommodation) = 787\nAccommodation minimum nights: 1/1\n\nDays: 6\nCurrent City: Charlottesville (Virginia)\nTransportation: -\nBreakfast: Firefly, Charlottesville (Virginia), cost: 30, cuisines: Pizza, Bakery\nAttraction: The Fralin Museum of Art at the University of Virginia, Charlottesville (Virginia); Ix Art Park, Charlottesville (Virginia)\nLunch: Dawat-e-Ishq, Charlottesville (Virginia), cost: 26, cuisines: Desserts, Tea, Italian, BBQ, Fast Food\nDinner: The Tongue Twister, Charlottesville (Virginia), cost: 81, cuisines: Pizza, French, Bakery, Cafe, Seafood\nAccommodation: Williamsburg Hidden Gem, Charlottesville (Virginia), cost: 391.0, maximum occupancy: 2, house rules: No visitors & No smoking, minimum nights: 1.0\n\nNumber of people: 1\nTotal cost: 30 (breakfast) + 26 (lunch) + 81 (dinner) + 391 (accommodation) = 528\nAccommodation minimum nights: 1/1\n\nDays: 7\nCurrent City: from Charlottesville (Virginia) to Philadelphia\nTransportation: Self-driving, from Charlottesville (Virginia) to Philadelphia, duration: 4 hours 24 mins, distance: 411 km, cost: 20\nBreakfast: Baking Bad, Charlottesville (Virginia), cost: 22, cuisines: Desserts, Tea, Bakery, American, Seafood\nAttraction: -\nLunch: -\nDinner: -\nAccommodation: -\n\nNumber of people: 1\nTotal cost: 20 (self-driving) + 22 (breakfast) = 42\n\nTotal cost across all days: 630 + 602 + 469 + 397 + 787 + 528 + 42 = 3455\n\nCuisines: The prompt specifies no specific cuisine, so all cuisine constraints are satisfied.\n\n**Note**: The total cost exceeds the specified budget of $1,800. Adjustments to the plan, such as changing accommodation or dining options, are necessary to meet the budget constraint.", "gpt-4-1106-preview_direct_sole-planning_parsed_results": [{"day": 1, "current_city": "from Philadelphia to Richmond (Virginia)", "transportation": "Flight Number: F3730367, from Philadelphia to Richmond (Virginia), Departure Time: 14:03, Arrival Time: 15:03", "breakfast": "-", "attraction": "Virginia Museum of Fine Arts, Richmond (Virginia);", "lunch": "Sandpiper Restaurant & Lounge, Richmond (Virginia)", "dinner": "Welcome, Richmond (Virginia)", "accommodation": "12 East 86th St full furnished, Richmond (Virginia)"}, {"day": 2, "current_city": "Richmond (Virginia)", "transportation": "-", "breakfast": "Perfect Bake, Richmond (Virginia)", "attraction": "Maymont, Richmond (Virginia);The Poe Museum, Richmond (Virginia);", "lunch": "Paradise, Richmond (Virginia)", "dinner": "Sugarcraft Patisserie, Richmond (Virginia)", "accommodation": "12 East 86th St full furnished, Richmond (Virginia)"}, {"day": 3, "current_city": "from Richmond (Virginia) to Petersburg (Virginia)", "transportation": "Taxi, from Richmond (Virginia) to Petersburg (Virginia), duration: 25 mins, distance: 38.0 km", "breakfast": "Mother's Kitchen, Richmond (Virginia)", "attraction": "Petersburg National Battlefield, Petersburg (Virginia);", "lunch": "5 Little Pigs, Petersburg (Virginia)", "dinner": "Midnight Sutra, Petersburg (Virginia)", "accommodation": "Charming cozy bedroom in Clinton Hill!, Petersburg (Virginia)"}, {"day": 4, "current_city": "Petersburg (Virginia)", "transportation": "-", "breakfast": "Tea'se Me - Rooftop Tea Boutique, Petersburg (Virginia)", "attraction": "Centre Hill Mansion-Museum, Petersburg (Virginia);Pamplin Historical Park, Petersburg (Virginia);", "lunch": "Bake-a-boo, Petersburg (Virginia)", "dinner": "Lemon Chick, Petersburg (Virginia)", "accommodation": "Charming cozy bedroom in Clinton Hill!, Petersburg (Virginia)"}, {"day": 5, "current_city": "from Petersburg (Virginia) to Charlottesville (Virginia)", "transportation": "Self-driving, from Petersburg (Virginia) to Charlottesville (Virginia), duration: 1 hour 30 mins, distance: 152 km", "breakfast": "Chai Point, Petersburg (Virginia)", "attraction": "Monticello, Charlottesville (Virginia);", "lunch": "Mama's Fish House, Charlottesville (Virginia)", "dinner": "Restaurant Andre, Charlottesville (Virginia)", "accommodation": "Williamsburg Hidden Gem, Charlottesville (Virginia)"}, {"day": 6, "current_city": "Charlottesville (Virginia)", "transportation": "-", "breakfast": "Firefly, Charlottesville (Virginia)", "attraction": "The Fralin Museum of Art at the University of Virginia, Charlottesville (Virginia);Ix Art Park, Charlottesville (Virginia);", "lunch": "Dawat-e-Ishq, Charlottesville (Virginia)", "dinner": "The Tongue Twister, Charlottesville (Virginia)", "accommodation": "Williamsburg Hidden Gem, Charlottesville (Virginia)"}, {"day": 7, "current_city": "from Charlottesville (Virginia) to Philadelphia", "transportation": "Self-driving, from Charlottesville (Virginia) to Philadelphia, duration: 4 hours 24 mins, distance: 411 km", "breakfast": "Baking Bad, Charlottesville (Virginia)", "attraction": "-", "lunch": "-", "dinner": "-", "accommodation": "-"}]}]