[{"gpt-4-1106-preview_direct_sole-planning_results": "Travel Plan:\n\nDays: 1\nCurrent City: from Appleton to Charlotte\nTransportation: Flight Number: F3796721, from Appleton to Charlotte, Departure Time: 06:58, Arrival Time: 10:25, cost: 314\nBreakfast: -\nAttraction: Levine Museum of the New South, Charlotte (Address: 401 S Tryon St, Charlotte, NC 28202, USA)\nLunch: Olive Tree Cafe, Charlotte (Average Cost: 23, Cuisines: Tea, Chinese, Desserts)\nDinner: Central Perk 7, Charlotte (Average Cost: 87, Cuisines: Pizza, Bakery, BBQ, Fast Food)\nAccommodation: Elegant Studio Apt in Prospect Heights, Charlotte (price: 640.0, room type: Entire home/apt, house rules: No parties, minimum nights: 2.0, maximum occupancy: 5)\n\nNumber of people: 7\nTotal cost: 7 x 314 + 7 x 23 + 7 x 87 + 640 = 3942\nAccommodation minimum nights: 1/2\n\nDays: 2\nCurrent City: Charlotte\nTransportation: -\nBreakfast: Kylin Skybar, Charlotte (Average Cost: 44, Cuisines: Tea, Cafe, Pizza, Italian)\nAttraction: Discovery Place Science, Charlotte (Address: 301 N Tryon St, Charlotte, NC 28202, USA); The Mint Museum, Charlotte (Address: 2730 Randolph Rd, Charlotte, NC 28207, USA)\nLunch: Unplugged Courtyard, Charlotte (Average Cost: 54, Cuisines: Desserts, French, Bakery, Cafe, Seafood)\nDinner: Grover's - The Baker Shop, Charlotte (Average Cost: 30, Cuisines: Pizza, Bakery, Chinese, Indian, Seafood)\nAccommodation: Elegant Studio Apt in Prospect Heights, Charlotte (price: 640.0, room type: Entire home/apt, house rules: No parties, minimum nights: 2.0, maximum occupancy: 5)\n\nNumber of people: 7\nTotal cost: 7 x 44 + 7 x 54 + 7 x 30 + 640 = 2184\nAccommodation minimum nights: 2/2\n\nDays: 3\nCurrent City: from Charlotte to Appleton\nTransportation: Flight Number: F3788979, from Charlotte to Appleton, Departure Time: 22:52, Arrival Time: 00:07, cost: 212\nBreakfast: Shree Hari Vaishnav Dhaba, Charlotte (Average Cost: 97, Cuisines: Bakery, Pizza, American, Cafe)\nAttraction: NASCAR Hall of Fame, Charlotte (Address: 400 E M.L.K. Jr Blvd, Charlotte, NC 28202, USA)\nLunch: Prince Snacks & Momo's Point, Charlotte (Average Cost: 11, Cuisines: Tea, Cafe, Desserts, Fast Food)\nDinner: -\nAccommodation: -\n\nNumber of people: 7\nTotal cost: 7 x 97 + 7 x 11 + 7 x 212 = 2310\n\nTotal cost across all days: 3942 + 2184 + 2310 = 8436\nHouse rules: All accommodations allow visitors as per the house rules.\nCuisines: Various cuisines have been included in the meals.\nTransportation: All transportation modes are valid and meet the constraints specified in the query.\n\nPlease note that the costs are estimated based on the average cost of meals and the price of accommodations and flights as provided. The actual costs may vary slightly due to taxes, service charges, or changes in prices.", "gpt-4-1106-preview_direct_sole-planning_parsed_results": [{"day": 1, "current_city": "from Appleton to Charlotte", "transportation": "Flight Number: F3796721, from Appleton to Charlotte, Departure Time: 06:58, Arrival Time: 10:25", "breakfast": "-", "attraction": "Levine Museum of the New South, Charlotte", "lunch": "Olive Tree Cafe, Charlotte", "dinner": "Central Perk 7, Charlotte", "accommodation": "Elegant Studio Apt in Prospect Heights, Charlotte"}, {"day": 2, "current_city": "Charlotte", "transportation": "-", "breakfast": "Kylin Skybar, Charlotte", "attraction": "Discovery Place Science, Charlotte;The Mint Museum, Charlotte", "lunch": "Unplugged Courtyard, Charlotte", "dinner": "Grover's - The Baker Shop, Charlotte", "accommodation": "Elegant Studio Apt in Prospect Heights, Charlotte"}, {"day": 3, "current_city": "from Charlotte to Appleton", "transportation": "Flight Number: F3788979, from Charlotte to Appleton, Departure Time: 22:52, Arrival Time: 00:07", "breakfast": "Shree Hari Vaishnav Dhaba, Charlotte", "attraction": "NASCAR Hall of Fame, Charlotte", "lunch": "Prince Snacks & Momo's Point, Charlotte", "dinner": "-", "accommodation": "-"}]}]