[{"gpt-4-1106-preview_direct_sole-planning_results": "Travel Plan:\n\nDays: 1\nCurrent City: from St. Louis to Philadelphia (Pennsylvania)\nTransportation: Flight Number: F3787538, from St. Louis to Philadelphia, Departure Time: 05:26, Arrival Time: 08:29, cost: 232\nBreakfast: -\nAttraction: The Franklin Institute, Philadelphia (Pennsylvania)\nLunch: Hong Kong Cafe, Philadelphia (Pennsylvania), cost: 47, cuisines: Tea, Pizza, Italian, BBQ, Cafe\nDinner: Red Ginger Sushi, Grill & Bar, Philadelphia (Pennsylvania), cost: 98, cuisines: Tea, Cafe, Indian, Fast Food\nAccommodation: Industrial Loft Living in NYC, Philadelphia (Pennsylvania), cost: 178.0, maximum occupancy: 3, house rules: No smoking, minimum nights: 4.0\n\nNumber of people: 2\nTotal cost: 2 x 232 + 2 x 47 + 2 x 98 + 178 = 832\nAccommodation minimum nights: 1/4\n\nDays: 2\nCurrent City: Philadelphia (Pennsylvania)\nTransportation: -\nBreakfast: Marukame Udon, Philadelphia (Pennsylvania), cost: 100, cuisines: Tea, Pizza, Italian, BBQ, Fast Food, Chinese\nAttraction: Liberty Bell, Philadelphia (Pennsylvania); Philadelphia Museum of Art, Philadelphia (Pennsylvania)\nLunch: Pind Balluchi, Philadelphia (Pennsylvania), cost: 44, cuisines: Desserts, Tea, French, Fast Food, Seafood\nDinner: The Moon Under Water, Philadelphia (Pennsylvania), cost: 94, cuisines: Pizza, Italian, BBQ, Bakery, Fast Food, Mediterranean\nAccommodation: Industrial Loft Living in NYC, Philadelphia (Pennsylvania), cost: 178.0, maximum occupancy: 3, house rules: No smoking, minimum nights: 4.0\n\nNumber of people: 2\nTotal cost: 2 x 100 + 2 x 44 + 2 x 94 + 178 = 654\nAccommodation minimum nights: 2/4\n\nDays: 3\nCurrent City: from Philadelphia to Harrisburg (Pennsylvania)\nTransportation: Flight Number: F3732413, from Philadelphia to Harrisburg, Departure Time: 11:17, Arrival Time: 12:01, cost: 22\nBreakfast: -\nAttraction: The National Civil War Museum, Harrisburg (Pennsylvania)\nLunch: Viva! Argentine Cuisine, Harrisburg (Pennsylvania), cost: 28, cuisines: Mexican, Pizza, BBQ\nDinner: Spiral - Sofitel Philippine Plaza Manila, Harrisburg (Pennsylvania), cost: 222, cuisines: Tea, Cafe, Pizza\nAccommodation: Modern 1 Bedroom Luxury Apartment in Dumbo, Harrisburg (Pennsylvania), cost: 449.0, maximum occupancy: 3, house rules: No pets, minimum nights: 4.0\n\nNumber of people: 2\nTotal cost: 2 x 22 + 2 x 28 + 2 x 222 + 449 = 993\nAccommodation minimum nights: 1/4\n\nDays: 4\nCurrent City: Harrisburg (Pennsylvania)\nTransportation: -\nBreakfast: Cakes & More, Harrisburg (Pennsylvania), cost: 98, cuisines: Cafe, Bakery, BBQ, Seafood\nAttraction: Pennsylvania National Fire Museum, Harrisburg (Pennsylvania); Wildwood Park, Harrisburg (Pennsylvania)\nLunch: Masala Fusion, Harrisburg (Pennsylvania), cost: 13, cuisines: Desserts, Pizza, French, Bakery, Indian\nDinner: Square - Sayaji Hotel, Harrisburg (Pennsylvania), cost: 99, cuisines: Cafe, Mexican, American, BBQ\nAccommodation: Modern 1 Bedroom Luxury Apartment in Dumbo, Harrisburg (Pennsylvania), cost: 449.0, maximum occupancy: 3, house rules: No pets, minimum nights: 4.0\n\nNumber of people: 2\nTotal cost: 2 x 98 + 2 x 13 + 2 x 99 + 449 = 869\nAccommodation minimum nights: 2/4\n\nDays: 5\nCurrent City: from Harrisburg to State College (Pennsylvania)\nTransportation: Self-driving, from Harrisburg to State College, duration: 1 hour 31 mins, distance: 139 km, cost: 6\nBreakfast: -\nAttraction: The Arboretum at Penn State, State College (Pennsylvania)\nLunch: Kawa Sushi, State College (Pennsylvania), cost: 82, cuisines: French, Mexican, Desserts, Fast Food\nDinner: Los Agaves, State College (Pennsylvania), cost: 39, cuisines: French, BBQ, Cafe\nAccommodation: Charming 1BR in UES Townhouse, State College (Pennsylvania), cost: 1134.0, maximum occupancy: 4, house rules: No smoking, minimum nights: 30.0\n\nNumber of people: 2\nTotal cost: 2 x 6 + 2 x 82 + 2 x 39 + 1134 = 1390\nAccommodation minimum nights: 1/30\n\nDays: 6\nCurrent City: State College (Pennsylvania)\nTransportation: -\nBreakfast: Hotel Ekant, State College (Pennsylvania), cost: 16, cuisines: Fast Food, Pizza, Italian\nAttraction: Palmer Museum of Art, State College (Pennsylvania); Penn State All-Sports Museum, State College (Pennsylvania)\nLunch: Amici Cafe, State College (Pennsylvania), cost: 96, cuisines: Pizza, Bakery, BBQ, Chinese, Seafood\nDinner: Best Pizza Hut, State College (Pennsylvania), cost: 44, cuisines: Desserts, French, Bakery, Cafe, Indian\nAccommodation: Charming 1BR in UES Townhouse, State College (Pennsylvania), cost: 1134.0, maximum occupancy: 4, house rules: No smoking, minimum nights: 30.0\n\nNumber of people: 2\nTotal cost: 2 x 16 + 2 x 96 + 2 x 44 + 1134 = 1446\nAccommodation minimum nights: 2/30\n\nDays: 7\nCurrent City: from State College to St. Louis\nTransportation: Self-driving, from State College to St. Louis, duration: 11 hours 18 mins, distance: 1,195 km, cost: 59\nBreakfast: -\nAttraction: -\nLunch: -\nDinner: -\nAccommodation: -\n\nNumber of people: 2\nTotal cost: 2 x 59 = 118\n\nTotal cost across all days: 832 + 654 + 993 + 869 + 1390 + 1446 + 118 = 6302\nCuisines: The prompt specifies Indian and American, so all cuisine constraints are satisfied.\n\n***** Travel Plan Ends *****\n\nPlease note that the accommodation in State College has a minimum stay of 30 nights, which is not suitable for a 7-day trip. However, due to the lack of provided information on alternative accommodations, it has been included in the plan. Adjustments to the accommodation should be made based on actual availability and minimum stay requirements.", "gpt-4-1106-preview_direct_sole-planning_parsed_results": [{"day": 1, "current_city": "from St. Louis to Philadelphia", "transportation": "Flight Number: F3787538, from St. Louis to Philadelphia, Departure Time: 05:26, Arrival Time: 08:29", "breakfast": "-", "attraction": "The Franklin Institute, Philadelphia;", "lunch": "Hong Kong Cafe, Philadelphia", "dinner": "Red Ginger Sushi, Grill & Bar, Philadelphia", "accommodation": "Industrial Loft Living in NYC, Philadelphia"}, {"day": 2, "current_city": "Philadelphia", "transportation": "-", "breakfast": "Marukame Udon, Philadelphia", "attraction": "Liberty Bell, Philadelphia;Philadelphia Museum of Art, Philadelphia;", "lunch": "Pind Balluchi, Philadelphia", "dinner": "The Moon Under Water, Philadelphia", "accommodation": "Industrial Loft Living in NYC, Philadelphia"}, {"day": 3, "current_city": "from Philadelphia to Harrisburg", "transportation": "Flight Number: F3732413, from Philadelphia to Harrisburg, Departure Time: 11:17, Arrival Time: 12:01", "breakfast": "-", "attraction": "The National Civil War Museum, Harrisburg;", "lunch": "Viva! Argentine Cuisine, Harrisburg", "dinner": "Spiral - Sofitel Philippine Plaza Manila, Harrisburg", "accommodation": "Modern 1 Bedroom Luxury Apartment in Dumbo, Harrisburg"}, {"day": 4, "current_city": "Harrisburg", "transportation": "-", "breakfast": "Cakes & More, Harrisburg", "attraction": "Pennsylvania National Fire Museum, Harrisburg;Wildwood Park, Harrisburg;", "lunch": "Masala Fusion, Harrisburg", "dinner": "Square - Sayaji Hotel, Harrisburg", "accommodation": "Modern 1 Bedroom Luxury Apartment in Dumbo, Harrisburg"}, {"day": 5, "current_city": "from Harrisburg to State College", "transportation": "Self-driving, from Harrisburg to State College, duration: 1 hour 31 mins, distance: 139 km", "breakfast": "-", "attraction": "The Arboretum at Penn State, State College;", "lunch": "Kawa Sushi, State College", "dinner": "Los Agaves, State College", "accommodation": "Charming 1BR in UES Townhouse, State College"}, {"day": 6, "current_city": "State College", "transportation": "-", "breakfast": "Hotel Ekant, State College", "attraction": "Palmer Museum of Art, State College;Penn State All-Sports Museum, State College;", "lunch": "Amici Cafe, State College", "dinner": "Best Pizza Hut, State College", "accommodation": "Charming 1BR in UES Townhouse, State College"}, {"day": 7, "current_city": "from State College to St. Louis", "transportation": "Self-driving, from State College to St. Louis, duration: 11 hours 18 mins, distance: 1,195 km", "breakfast": "-", "attraction": "-", "lunch": "-", "dinner": "-", "accommodation": "-"}]}]