[{"gpt-4-1106-preview_direct_sole-planning_results": "Travel Plan:\n\nDays: 1\nCurrent City: from Fort Lauderdale to Atlanta (Georgia)\nTransportation: Flight Number: F3490987, from Fort Lauderdale to Atlanta, Departure Time: 14:31, Arrival Time: 16:17, cost: 278\nBreakfast: -\nAttraction: Georgia Aquarium, Atlanta (Georgia)\nLunch: -\nDinner: Saffron, Atlanta (Georgia), cost: 39, cuisines: Tea, Cafe, Fast Food, Seafood\nAccommodation: Bright, Modern, Clean, Spacious, Brooklyn Home, Atlanta (Georgia), cost: 1034.0, maximum occupancy: 4, house rules: No children under 10, minimum nights: 3.0\n\nNumber of people: 2\nTotal cost: 2 x 278 + 2 x 39 + 1034 = 1668\nAccommodation minimum nights: 1/3\n\nDays: 2\nCurrent City: Atlanta (Georgia)\nTransportation: -\nBreakfast: Asian Bistro, Atlanta (Georgia), cost: 27, cuisines: Tea, Bakery, Seafood\nAttraction: World of Coca-Cola, Atlanta (Georgia); Martin Luther King, Jr. National Historical Park, Atlanta (Georgia)\nLunch: Chef Style, Atlanta (Georgia), cost: 59, cuisines: Pizza, American, Desserts, Seafood\nDinner: Pizza Central, Atlanta (Georgia), cost: 75, cuisines: Cafe, Bakery, BBQ, Fast Food, Chinese, Indian\nAccommodation: Bright, Modern, Clean, Spacious, Brooklyn Home, Atlanta (Georgia), cost: 1034.0, maximum occupancy: 4, house rules: No children under 10, minimum nights: 3.0\n\nNumber of people: 2\nTotal cost: 2 x 27 + 2 x 59 + 2 x 75 + 1034 = 1356\nAccommodation minimum nights: 2/3\n\nDays: 3\nCurrent City: from Atlanta (Georgia) to Decatur (Georgia)\nTransportation: Taxi, from Atlanta to Decatur, duration: 18 mins, distance: 10.0 km, cost: 10\nBreakfast: -\nAttraction: DeKalb History Center Museum, Decatur (Georgia); Glenlake Park, Decatur (Georgia)\nLunch: Madhuban Restaurant - Welcome Hotel Rama International, Decatur (Georgia), cost: 47, cuisines: Pizza, Bakery, Seafood\nDinner: Joey's Pizza, Decatur (Georgia), cost: 69, cuisines: Tea, Pizza, Bakery, Chinese, Seafood\nAccommodation: The Heart of the Lower East Side!, Decatur (Georgia), cost: 587.0, maximum occupancy: 2, house rules: No children under 10, minimum nights: 2.0\n\nNumber of people: 2\nTotal cost: 2 x 10 + 2 x 47 + 2 x 69 + 587 = 829\nAccommodation minimum nights: 1/2\n\nDays: 4\nCurrent City: Decatur (Georgia)\nTransportation: -\nBreakfast: Cafe Coffee Day, Decatur (Georgia), cost: 46, cuisines: Tea, Cafe, BBQ, Mediterranean\nAttraction: Clyde Shepherd Nature Preserve, Decatur (Georgia); Waffle House Museum, Decatur (Georgia)\nLunch: Dawat-E-Chaman, Decatur (Georgia), cost: 42, cuisines: Chinese, BBQ, Fast Food, Cafe, Mediterranean\nDinner: Carnatic Cafe, Decatur (Georgia), cost: 66, cuisines: Cafe, Indian, Desserts\nAccommodation: The Heart of the Lower East Side!, Decatur (Georgia), cost: 587.0, maximum occupancy: 2, house rules: No children under 10, minimum nights: 2.0\n\nNumber of people: 2\nTotal cost: 2 x 46 + 2 x 42 + 2 x 66 + 587 = 895\nAccommodation minimum nights: 2/2\n\nDays: 5\nCurrent City: from Decatur (Georgia) to Augusta (Georgia)\nTransportation: Taxi, from Decatur to Augusta, duration: 2 hours 17 mins, distance: 228 km, cost: 228\nBreakfast: -\nAttraction: Augusta Riverwalk, Augusta (Georgia); Morris Museum of Art, Augusta (Georgia)\nLunch: B Merrell's, Augusta (Georgia), cost: 74, cuisines: Tea, Pizza, Desserts, Fast Food\nDinner: Vinny Vanucchi's, Augusta (Georgia), cost: 45, cuisines: Desserts, Fast Food, Chinese, Indian, Seafood\nAccommodation: Planta Baja Studio, Augusta (Georgia), cost: 637.0, maximum occupancy: 4, house rules: No smoking, minimum nights: 1.0\n\nNumber of people: 2\nTotal cost: 2 x 228 + 2 x 74 + 2 x 45 + 637 = 1331\nAccommodation minimum nights: 1/1\n\nDays: 6\nCurrent City: Augusta (Georgia)\nTransportation: -\nBreakfast: Fish Tales Lakeside Grille, Augusta (Georgia), cost: 37, cuisines: Tea, Cafe, Bakery, Desserts\nAttraction: Augusta Canal National Heritage Area, Augusta (Georgia); Sacred Heart Cultural Center, Augusta (Georgia)\nLunch: Karari Kurry, Augusta (Georgia), cost: 29, cuisines: Bakery, Indian, Cafe, Fast Food\nDinner: The Golden Dragon, Augusta (Georgia), cost: 82, cuisines: Desserts, Pizza, Fast Food, Indian, Mediterranean, Seafood\nAccommodation: Planta Baja Studio, Augusta (Georgia), cost: 637.0, maximum occupancy: 4, house rules: No smoking, minimum nights: 1.0\n\nNumber of people: 2\nTotal cost: 2 x 37 + 2 x 29 + 2 x 82 + 637 = 933\nAccommodation minimum nights: 1/1\n\nDays: 7\nCurrent City: from Augusta (Georgia) to Fort Lauderdale\nTransportation: Self-driving, from Augusta to Fort Lauderdale, duration: 8 hours 41 mins, distance: 938 km, cost: 46\nBreakfast: -\nAttraction: -\nLunch: -\nDinner: -\nAccommodation: -\n\nNumber of people: 2\nTotal cost: 2 x 46 = 92\n\nTotal cost across all days: 1668 + 1356 + 829 + 895 + 1331 + 933 + 92 = 7104\nCuisines: The prompt specifies Indian, American, Chinese, and Mediterranean, so all cuisine constraints are satisfied.", "gpt-4-1106-preview_direct_sole-planning_parsed_results": [{"day": 1, "current_city": "from Fort Lauderdale to Atlanta", "transportation": "Flight Number: F3490987, from Fort Lauderdale to Atlanta, Departure Time: 14:31, Arrival Time: 16:17", "breakfast": "-", "attraction": "Georgia Aquarium, Atlanta;", "lunch": "-", "dinner": "Saffron, Atlanta", "accommodation": "Bright, Modern, Clean, Spacious, Brooklyn Home, Atlanta"}, {"day": 2, "current_city": "Atlanta", "transportation": "-", "breakfast": "Asian Bistro, Atlanta", "attraction": "World of Coca-Cola, Atlanta;Martin Luther King, Jr. National Historical Park, Atlanta;", "lunch": "Chef Style, Atlanta", "dinner": "Pizza Central, Atlanta", "accommodation": "Bright, Modern, Clean, Spacious, Brooklyn Home, Atlanta"}, {"day": 3, "current_city": "from Atlanta to Decatur", "transportation": "Taxi, from Atlanta to Decatur, duration: 18 mins, distance: 10.0 km", "breakfast": "-", "attraction": "DeKalb History Center Museum, Decatur;Glenlake Park, Decatur;", "lunch": "Madhuban Restaurant - Welcome Hotel Rama International, Decatur", "dinner": "Joey's Pizza, Decatur", "accommodation": "The Heart of the Lower East Side!, Decatur"}, {"day": 4, "current_city": "Decatur", "transportation": "-", "breakfast": "Cafe Coffee Day, Decatur", "attraction": "Clyde Shepherd Nature Preserve, Decatur;Waffle House Museum, Decatur;", "lunch": "Dawat-E-Chaman, Decatur", "dinner": "Carnatic Cafe, Decatur", "accommodation": "The Heart of the Lower East Side!, Decatur"}, {"day": 5, "current_city": "from Decatur to Augusta", "transportation": "Taxi, from Decatur to Augusta, duration: 2 hours 17 mins, distance: 228 km", "breakfast": "-", "attraction": "Augusta Riverwalk, Augusta;Morris Museum of Art, Augusta;", "lunch": "B Merrell's, Augusta", "dinner": "Vinny Vanucchi's, Augusta", "accommodation": "Planta Baja Studio, Augusta"}, {"day": 6, "current_city": "Augusta", "transportation": "-", "breakfast": "Fish Tales Lakeside Grille, Augusta", "attraction": "Augusta Canal National Heritage Area, Augusta;Sacred Heart Cultural Center, Augusta;", "lunch": "Karari Kurry, Augusta", "dinner": "The Golden Dragon, Augusta", "accommodation": "Planta Baja Studio, Augusta"}, {"day": 7, "current_city": "from Augusta to Fort Lauderdale", "transportation": "Self-driving, from Augusta to Fort Lauderdale, duration: 8 hours 41 mins, distance: 938 km", "breakfast": "-", "attraction": "-", "lunch": "-", "dinner": "-", "accommodation": "-"}]}]