[{"gpt-4-1106-preview_direct_sole-planning_results": "Travel Plan:\n\nDays: 1\nCurrent City: from Washington to Los Angeles (California)\nTransportation: Flight Number: F3743452, from Washington to Los Angeles, Departure Time: 09:07, Arrival Time: 11:35, cost: 487\nBreakfast: -\nAttraction: Hollywood Walk of Fame, Los Angeles (California)\nLunch: Punjabi Zaika, Los Angeles (California), cost: 46, cuisines: Pizza, Bakery, BBQ, Cafe, Indian\nDinner: Choco Kraft, Los Angeles (California), cost: 20, cuisines: French, BBQ, Fast Food, Cafe, Mediterranean\nAccommodation: Lovely studio, Los Angeles (California), cost: 117.0, maximum occupancy: 3, house rules: No visitors, minimum nights: 1.0\n\nNumber of people: 2\nTotal cost: 2 x 487 + 2 x 46 + 2 x 20 + 117 = 1223\nAccommodation minimum nights: 1/1\n\nDays: 2\nCurrent City: Los Angeles (California)\nTransportation: -\nBreakfast: Heat - Edsa Shangri-La, Los Angeles (California), cost: 148, cuisines: Bakery, BBQ\nAttraction: Universal Studios Hollywood, Los Angeles (California); Griffith Observatory, Los Angeles (California)\nLunch: Palmshore, Los Angeles (California), cost: 25, cuisines: Desserts, Bakery, Fast Food, American, Seafood\nDinner: Chicken Minar, Los Angeles (California), cost: 25, cuisines: Bakery, Fast Food\nAccommodation: Lovely studio, Los Angeles (California), cost: 117.0, maximum occupancy: 3, house rules: No visitors, minimum nights: 1.0\n\nNumber of people: 2\nTotal cost: 2 x 148 + 2 x 25 + 2 x 25 + 117 = 514\nAccommodation minimum nights: 1/1\n\nDays: 3\nCurrent City: from Los Angeles (California) to San Francisco (California)\nTransportation: Flight Number: F3744801, from Los Angeles to San Francisco, Departure Time: 05:54, Arrival Time: 07:22, cost: 79\nBreakfast: -\nAttraction: Golden Gate Bridge, San Francisco (California); Exploratorium, San Francisco (California)\nLunch: Coffee & Chai Co., San Francisco (California), cost: 10, cuisines: Tea, Mexican, BBQ, Cafe, Seafood\nDinner: The Chic, San Francisco (California), cost: 92, cuisines: Chinese, Bakery, Indian, Cafe\nAccommodation: Gorgeous Park Slope Studio, San Francisco (California), cost: 641.0, maximum occupancy: 5, house rules: No smoking & No parties, minimum nights: 14.0\n\nNumber of people: 2\nTotal cost: 2 x 79 + 2 x 10 + 2 x 92 + 641 = 1003\nAccommodation minimum nights: 1/14\n\nDays: 4\nCurrent City: San Francisco (California)\nTransportation: -\nBreakfast: Tokyo Sushi, San Francisco (California), cost: 18, cuisines: Cafe, Pizza, BBQ\nAttraction: San Francisco Museum of Modern Art, San Francisco (California); California Academy of Sciences, San Francisco (California)\nLunch: Sudarshan, San Francisco (California), cost: 53, cuisines: Fast Food, Bakery, Mediterranean, Italian\nDinner: Empress, San Francisco (California), cost: 24, cuisines: Pizza, BBQ, Mediterranean, Fast Food\nAccommodation: Gorgeous Park Slope Studio, San Francisco (California), cost: 641.0, maximum occupancy: 5, house rules: No smoking & No parties, minimum nights: 14.0\n\nNumber of people: 2\nTotal cost: 2 x 18 + 2 x 53 + 2 x 24 + 641 = 830\nAccommodation minimum nights: 2/14\n\nDays: 5\nCurrent City: from San Francisco (California) to Washington\nTransportation: Flight Number: F3907821, from San Francisco to Washington, Departure Time: 22:55, Arrival Time: 06:57, cost: 551\nBreakfast: -\nAttraction: -\nLunch: -\nDinner: -\nAccommodation: -\n\nNumber of people: 2\nTotal cost: 2 x 551 = 1102\n\nTotal cost across all days: 1223 + 514 + 1003 + 830 + 1102 = 4672\nCuisines: The prompt specifies Chinese, Mexican, American, and Italian, so all cuisine constraints are satisfied.\n\nNote: The total cost slightly exceeds the budget by $72. Adjustments to meal choices or accommodation may be necessary to meet the budget constraint.", "gpt-4-1106-preview_direct_sole-planning_parsed_results": [{"day": 1, "current_city": "from Washington to Los Angeles", "transportation": "Flight Number: F3743452, from Washington to Los Angeles, Departure Time: 09:07, Arrival Time: 11:35", "breakfast": "-", "attraction": "Hollywood Walk of Fame, Los Angeles;", "lunch": "Punjabi Zaika, Los Angeles", "dinner": "Choco Kraft, Los Angeles", "accommodation": "Lovely studio, Los Angeles"}, {"day": 2, "current_city": "Los Angeles", "transportation": "-", "breakfast": "Heat - Edsa Shangri-La, Los Angeles", "attraction": "Universal Studios Hollywood, Los Angeles;Griffith Observatory, Los Angeles;", "lunch": "Palmshore, Los Angeles", "dinner": "Chicken Minar, Los Angeles", "accommodation": "Lovely studio, Los Angeles"}, {"day": 3, "current_city": "from Los Angeles to San Francisco", "transportation": "Flight Number: F3744801, from Los Angeles to San Francisco, Departure Time: 05:54, Arrival Time: 07:22", "breakfast": "-", "attraction": "Golden Gate Bridge, San Francisco;Exploratorium, San Francisco;", "lunch": "Coffee & Chai Co., San Francisco", "dinner": "The Chic, San Francisco", "accommodation": "Gorgeous Park Slope Studio, San Francisco"}, {"day": 4, "current_city": "San Francisco", "transportation": "-", "breakfast": "Tokyo Sushi, San Francisco", "attraction": "San Francisco Museum of Modern Art, San Francisco;California Academy of Sciences, San Francisco;", "lunch": "Sudarshan, San Francisco", "dinner": "Empress, San Francisco", "accommodation": "Gorgeous Park Slope Studio, San Francisco"}, {"day": 5, "current_city": "from San Francisco to Washington", "transportation": "Flight Number: F3907821, from San Francisco to Washington, Departure Time: 22:55, Arrival Time: 06:57", "breakfast": "-", "attraction": "-", "lunch": "-", "dinner": "-", "accommodation": "-"}]}]