[{"gpt-4-1106-preview_direct_sole-planning_results": "Travel Plan:\n\nDays: 1\nCurrent City: from Palm Springs to Houston\nTransportation: Flight Number: F3839339, from Palm Springs to Houston, Departure Time: 06:07, Arrival Time: 10:59, cost: 282\nBreakfast: -\nAttraction: Downtown Aquarium, Houston, cost: -\nLunch: Jalapenos, Houston, cost: 57, cuisines: Desserts, Tea, Cafe, Chinese, Seafood\nDinner: The BrewMaster - The Mix Fine Dine, Houston, cost: 52, cuisines: French, Indian, Cafe, Seafood\nAccommodation: Sunny and Airy near Manhattan, Houston, cost: 499.0, room type: Entire home/apt, house rules: No pets, minimum nights: 2.0, maximum occupancy: 4\n\nNumber of people: 1 (assuming single traveler based on query)\nTotal cost: 282 (flight) + 57 (lunch) + 52 (dinner) + 499 (accommodation) = 890\nAccommodation minimum nights: 1/2\n\nDays: 2\nCurrent City: Houston\nTransportation: -\nBreakfast: Super Bakery, Houston, cost: 30, cuisines: Seafood, Fast Food\nAttraction: Space Center Houston, cost: -; Houston Museum of Natural Science, cost: -\nLunch: Royal Mart, Houston, cost: 40, cuisines: Tea, Bakery, Cafe, Mediterranean, Seafood\nDinner: Matchbox, Houston, cost: 33, cuisines: Tea, Italian, Bakery, Fast Food, Seafood\nAccommodation: Sunny and Airy near Manhattan, Houston, cost: 499.0, room type: Entire home/apt, house rules: No pets, minimum nights: 2.0, maximum occupancy: 4\n\nTotal cost: 30 (breakfast) + 40 (lunch) + 33 (dinner) + 499 (accommodation) = 602\nAccommodation minimum nights: 2/2\n\nDays: 3\nCurrent City: from Houston to Austin\nTransportation: Flight Number: F3838099, from Houston to Austin, Departure Time: 09:47, Arrival Time: 10:52, cost: 43\nBreakfast: -\nAttraction: Texas Capitol, cost: -; Zilker Metropolitan Park, cost: -\nLunch: Wildflour Cafe + Bakery, Austin, cost: 55, cuisines: Desserts, French, Bakery, BBQ, Seafood\nDinner: The Kasbah, Austin, cost: 88, cuisines: Cafe, Pizza, BBQ, Fast Food\nAccommodation: Cozy room in south Harlem - 10 mins to Columbia, Austin, cost: 564.0, room type: Private room, house rules: No visitors & No children under 10, minimum nights: 1.0, maximum occupancy: 2\n\nTotal cost: 43 (flight) + 55 (lunch) + 88 (dinner) + 564 (accommodation) = 750\nAccommodation minimum nights: 1/1\n\nDays: 4\nCurrent City: Austin\nTransportation: -\nBreakfast: Quiosque Chopp Brahma, Austin, cost: 69, cuisines: Tea, Pizza, Bakery, Fast Food, Indian\nAttraction: Museum of the Weird, cost: -; Cathedral of Junk, cost: -\nLunch: Mehfil-e-Handi, Austin, cost: 96, cuisines: Desserts, Tea, Bakery, American, Seafood\nDinner: Chili's, Austin, cost: 48, cuisines: Cafe, American, Seafood\nAccommodation: Upper West Side studio with private terrace, Austin, cost: 1142.0, room type: Entire home/apt, house rules: No children under 10 & No visitors, minimum nights: 5.0, maximum occupancy: 11\n\nTotal cost: 69 (breakfast) + 96 (lunch) + 48 (dinner) + 1142 (accommodation) = 1355\nAccommodation minimum nights: 1/5\n\nDays: 5\nCurrent City: from Austin to Dallas\nTransportation: Flight Number: F3601654, from Austin to Dallas, Departure Time: 11:43, Arrival Time: 12:36, cost: 44\nBreakfast: -\nAttraction: The Dallas World Aquarium, cost: -; The Sixth Floor Museum at Dealey Plaza, cost: -\nLunch: Coconuts Fish Cafe, Dallas, cost: 38, cuisines: Cafe, BBQ, Mediterranean, Fast Food\nDinner: 1918 Bistro & Grill, Dallas, cost: 90, cuisines: Tea, Pizza, BBQ, Seafood\nAccommodation: Luxury Williamsburg duplex, private roof terrace, Dallas, cost: 241.0, room type: Entire home/apt, house rules: No visitors, minimum nights: 4.0, maximum occupancy: 3\n\nTotal cost: 44 (flight) + 38 (lunch) + 90 (dinner) + 241 (accommodation) = 413\nAccommodation minimum nights: 1/4\n\nDays: 6\nCurrent City: Dallas\nTransportation: -\nBreakfast: Yanki Sizzlers, Dallas, cost: 96, cuisines: Cafe, French, Tea, Mediterranean\nAttraction: Reunion Tower, cost: -; Dallas Museum of Art, cost: -\nLunch: Aravali Owls, Dallas, cost: 53, cuisines: Pizza, Italian, Bakery, Fast Food, Cafe\nDinner: Kebab Xpress, Dallas, cost: 93, cuisines: Tea, Bakery, Pizza, Mediterranean\nAccommodation: Take it now you won't find better, Dallas, cost: 609.0, room type: Entire home/apt, house rules: No pets, minimum nights: 1.0, maximum occupancy: 4\n\nTotal cost: 96 (breakfast) + 53 (lunch) + 93 (dinner) + 609 (accommodation) = 851\nAccommodation minimum nights: 1/1\n\nDays: 7\nCurrent City: from Dallas to Palm Springs\nTransportation: Flight Number: F3673984, from Dallas to Palm Springs, Departure Time: 08:41, Arrival Time: 10:04, cost: 432\nBreakfast: -\nAttraction: -\nLunch: -\nDinner: -\nAccommodation: -\n\nTotal cost: 432\n\nTotal cost across all days: 890 + 602 + 750 + 1355 + 413 + 851 + 432 = 5293\n\nCuisines: The prompt does not specify any cuisine constraints, so all cuisine constraints are satisfied.\n\nRemaining budget: $8,100 - $5,293 = $2,807\n\nNote: The accommodation costs are for the entire stay, and the cost per night is divided by the number of nights stayed. Attractions are listed without costs as the prices are not provided. The number of people is assumed to be one based on the query. If the number of travelers is different, the costs will need to be adjusted accordingly.", "gpt-4-1106-preview_direct_sole-planning_parsed_results": [{"day": 1, "current_city": "from Palm Springs to Houston", "transportation": "Flight Number: F3839339, from Palm Springs to Houston, Departure Time: 06:07, Arrival Time: 10:59", "breakfast": "-", "attraction": "Downtown Aquarium, Houston;", "lunch": "Jalapenos, Houston", "dinner": "The BrewMaster - The Mix Fine Dine, Houston", "accommodation": "Sunny and Airy near Manhattan, Houston"}, {"day": 2, "current_city": "Houston", "transportation": "-", "breakfast": "Super Bakery, Houston", "attraction": "Space Center Houston, Houston;Houston Museum of Natural Science, Houston;", "lunch": "Royal Mart, Houston", "dinner": "Matchbox, Houston", "accommodation": "Sunny and Airy near Manhattan, Houston"}, {"day": 3, "current_city": "from Houston to Austin", "transportation": "Flight Number: F3838099, from Houston to Austin, Departure Time: 09:47, Arrival Time: 10:52", "breakfast": "-", "attraction": "Texas Capitol, Austin;Zilker Metropolitan Park, Austin;", "lunch": "Wildflour Cafe + Bakery, Austin", "dinner": "The Kasbah, Austin", "accommodation": "Cozy room in south Harlem - 10 mins to Columbia, Austin"}, {"day": 4, "current_city": "Austin", "transportation": "-", "breakfast": "Quiosque Chopp Brahma, Austin", "attraction": "Museum of the Weird, Austin;Cathedral of Junk, Austin;", "lunch": "Mehfil-e-Handi, Austin", "dinner": "Chili's, Austin", "accommodation": "Upper West Side studio with private terrace, Austin"}, {"day": 5, "current_city": "from Austin to Dallas", "transportation": "Flight Number: F3601654, from Austin to Dallas, Departure Time: 11:43, Arrival Time: 12:36", "breakfast": "-", "attraction": "The Dallas World Aquarium, Dallas;The Sixth Floor Museum at Dealey Plaza, Dallas;", "lunch": "Coconuts Fish Cafe, Dallas", "dinner": "1918 Bistro & Grill, Dallas", "accommodation": "Luxury Williamsburg duplex, private roof terrace, Dallas"}, {"day": 6, "current_city": "Dallas", "transportation": "-", "breakfast": "Yanki Sizzlers, Dallas", "attraction": "Reunion Tower, Dallas;Dallas Museum of Art, Dallas;", "lunch": "Aravali Owls, Dallas", "dinner": "Kebab Xpress, Dallas", "accommodation": "Take it now you won't find better, Dallas"}, {"day": 7, "current_city": "from Dallas to Palm Springs", "transportation": "Flight Number: F3673984, from Dallas to Palm Springs, Departure Time: 08:41, Arrival Time: 10:04", "breakfast": "-", "attraction": "-", "lunch": "-", "dinner": "-", "accommodation": "-"}]}]