[{"gpt-4-1106-preview_direct_sole-planning_results": "Travel Plan:\n\nDays: 1\nCurrent City: from Cleveland to Fort Myers (Florida)\nTransportation: Flight Number: F3915178, from Cleveland to Fort Myers (Florida), Departure Time: 06:40, Arrival Time: 09:22, cost: 316\nBreakfast: -\nAttraction: Edison & Ford Winter Estates, Fort Myers (Florida)\nLunch: The Refinery, Fort Myers (Florida), cost: 22, cuisines: Bakery, Indian, Seafood\nDinner: Haunted, Fort Myers (Florida), cost: 50, cuisines: Desserts, French, Fast Food, Cafe, Seafood\nAccommodation: Quiet and beautiful apartment near central park, Fort Myers (Florida), cost: 930.0, room type: Entire home/apt, house rules: No parties & No smoking, minimum nights: 7.0, maximum occupancy: 9\n\nNumber of people: 6\nTotal cost: 6 x 316 + 6 x 22 + 6 x 50 + 930 = 3966\nAccommodation minimum nights: 1/7\n\nDays: 2\nCurrent City: Fort Myers (Florida)\nTransportation: -\nBreakfast: Al Mukhtar Bakery, Fort Myers (Florida), cost: 54, cuisines: BBQ, Tea, American, Desserts\nAttraction: Six Mile Cypress Slough Preserve, Fort Myers (Florida); IMAG History & Science Center, Fort Myers (Florida)\nLunch: Maachh Bhaat, Fort Myers (Florida), cost: 66, cuisines: Desserts, Pizza, Fast Food, Mediterranean, Seafood\nDinner: Kujay's Spoon, Fort Myers (Florida), cost: 88, cuisines: Pizza, Mexican, Bakery, Cafe, Mediterranean, Seafood\nAccommodation: Quiet and beautiful apartment near central park, Fort Myers (Florida), cost: 930.0, room type: Entire home/apt, house rules: No parties & No smoking, minimum nights: 7.0, maximum occupancy: 9\n\nNumber of people: 6\nTotal cost: 6 x 54 + 6 x 66 + 6 x 88 + 930 = 2736\nAccommodation minimum nights: 2/7\n\nDays: 3\nCurrent City: from Fort Myers (Florida) to Tampa (Florida)\nTransportation: Taxi, from Fort Myers (Florida) to Tampa (Florida), duration: 1 hour 58 mins, distance: 204 km, cost: 204\nBreakfast: Puran Chand Ambala Wale Di Hatti, Fort Myers (Florida), cost: 36, cuisines: Bakery, BBQ, Cafe, American, Seafood\nAttraction: The Florida Aquarium, Tampa (Florida); Busch Gardens Tampa Bay, Tampa (Florida)\nLunch: Kobe Hibachi & Sushi, Tampa (Florida), cost: 63, cuisines: Desserts, French, BBQ, Bakery, Seafood\nDinner: Peg Leg Pete's, Tampa (Florida), cost: 91, cuisines: French, Bakery, Cafe\nAccommodation: Bright duplex apartment, Tampa (Florida), cost: 164.0, room type: Entire home/apt, house rules: No children under 10, minimum nights: 2.0, maximum occupancy: 3\n\nNumber of people: 6\nTotal cost: 6 x 36 + 6 x 63 + 6 x 91 + 204 x 6 / 3 + 164 = 2040\nAccommodation minimum nights: 1/2\n\nDays: 4\nCurrent City: Tampa (Florida)\nTransportation: -\nBreakfast: Lalit Kathi Rolls Momos, Tampa (Florida), cost: 23, cuisines: Tea, Pizza, Fast Food\nAttraction: Adventure Island, Tampa (Florida); Henry B. Plant Museum, Tampa (Florida)\nLunch: Uptown Fresh Beer Cafe, Tampa (Florida), cost: 61, cuisines: Pizza, Mexican, BBQ, Cafe, Seafood\nDinner: Aahar, Tampa (Florida), cost: 52, cuisines: Tea, Pizza, Desserts, Fast Food\nAccommodation: Bright duplex apartment, Tampa (Florida), cost: 164.0, room type: Entire home/apt, house rules: No children under 10, minimum nights: 2.0, maximum occupancy: 3\n\nNumber of people: 6\nTotal cost: 6 x 23 + 6 x 61 + 6 x 52 + 164 = 1644\nAccommodation minimum nights: 2/2\n\nDays: 5\nCurrent City: from Tampa (Florida) to Cleveland\nTransportation: Flight Number: F3560049, from Tampa (Florida) to Cleveland, Departure Time: 08:53, Arrival Time: 11:22, cost: 211\nBreakfast: Gallery Caf\u6106 - Hyatt Place, Tampa (Florida), cost: 42, cuisines: Tea, French, BBQ, Desserts\nAttraction: -\nLunch: -\nDinner: -\nAccommodation: -\n\nNumber of people: 6\nTotal cost: 6 x 42 + 6 x 211 = 1518\n\nTotal cost across all days: 3966 + 2736 + 2040 + 1644 + 1518 = 11904\nPet-friendly accommodations: All accommodations are pet-friendly and entire home/apt as requested.\nCuisines: The prompt does not specify cuisine preferences, so all cuisine constraints are satisfied.", "gpt-4-1106-preview_direct_sole-planning_parsed_results": [{"day": 1, "current_city": "from Cleveland to Fort Myers (Florida)", "transportation": "Flight Number: F3915178, from Cleveland to Fort Myers (Florida), Departure Time: 06:40, Arrival Time: 09:22", "breakfast": "-", "attraction": "Edison & Ford Winter Estates, Fort Myers (Florida);", "lunch": "The Refinery, Fort Myers (Florida)", "dinner": "Haunted, Fort Myers (Florida)", "accommodation": "Quiet and beautiful apartment near central park, Fort Myers (Florida)"}, {"day": 2, "current_city": "Fort Myers (Florida)", "transportation": "-", "breakfast": "Al Mukhtar Bakery, Fort Myers (Florida)", "attraction": "Six Mile Cypress Slough Preserve, Fort Myers (Florida);IMAG History & Science Center, Fort Myers (Florida);", "lunch": "Maachh Bhaat, Fort Myers (Florida)", "dinner": "Kujay's Spoon, Fort Myers (Florida)", "accommodation": "Quiet and beautiful apartment near central park, Fort Myers (Florida)"}, {"day": 3, "current_city": "from Fort Myers (Florida) to Tampa (Florida)", "transportation": "Taxi, from Fort Myers (Florida) to Tampa (Florida), duration: 1 hour 58 mins, distance: 204 km", "breakfast": "Puran Chand Ambala Wale Di Hatti, Fort Myers (Florida)", "attraction": "The Florida Aquarium, Tampa (Florida);Busch Gardens Tampa Bay, Tampa (Florida);", "lunch": "Kobe Hibachi & Sushi, Tampa (Florida)", "dinner": "Peg Leg Pete's, Tampa (Florida)", "accommodation": "Bright duplex apartment, Tampa (Florida)"}, {"day": 4, "current_city": "Tampa (Florida)", "transportation": "-", "breakfast": "Lalit Kathi Rolls Momos, Tampa (Florida)", "attraction": "Adventure Island, Tampa (Florida);Henry B. Plant Museum, Tampa (Florida);", "lunch": "Uptown Fresh Beer Cafe, Tampa (Florida)", "dinner": "Aahar, Tampa (Florida)", "accommodation": "Bright duplex apartment, Tampa (Florida)"}, {"day": 5, "current_city": "from Tampa (Florida) to Cleveland", "transportation": "Flight Number: F3560049, from Tampa (Florida) to Cleveland, Departure Time: 08:53, Arrival Time: 11:22", "breakfast": "Gallery Caf\u6106 - Hyatt Place, Tampa (Florida)", "attraction": "-", "lunch": "-", "dinner": "-", "accommodation": "-"}]}]