[{"gpt-4-1106-preview_direct_sole-planning_results": "Travel Plan:\n\nDays: 1\nCurrent City: from Atlanta to Chicago\nTransportation: Flight Number: F3505544, from Atlanta to Chicago, Departure Time: 08:12, Arrival Time: 09:12, cost: 223\nBreakfast: -\nAttraction: Millennium Park, Chicago (Latitude: 41.882552, Longitude: -87.622551)\nLunch: The Black Pearl, Chicago, cost: 63, cuisines: Cafe, Bakery\nDinner: Pantry d'or, Chicago, cost: 53, cuisines: Tea, BBQ, Fast Food, Cafe, Indian\nAccommodation: Newly Renovated Greenpoint Abode, Chicago, cost: 981.0, room type: Entire home/apt, house rules: No parties & No children under 10 & No smoking, minimum nights: 2.0, maximum occupancy: 7\n\nNumber of people: 2\nTotal cost: 2 x 223 + 2 x 63 + 2 x 53 + 981 = 1659\nAccommodation minimum nights: 1/2\n\nDays: 2\nCurrent City: Chicago\nTransportation: -\nBreakfast: Bro's Kitchenette, Chicago, cost: 38, cuisines: Mexican, Desserts, Seafood\nAttraction: Willis Tower, Chicago (Latitude: 41.878876, Longitude: -87.635915); Navy Pier, Chicago (Latitude: 41.891863, Longitude: -87.605094)\nLunch: Mini's Royal Cafe, Chicago, cost: 72, cuisines: Tea, Cafe, Bakery\nDinner: Pizza Hut, Chicago, cost: 99, cuisines: Pizza, French, Bakery, BBQ, Fast Food, American\nAccommodation: Newly Renovated Greenpoint Abode, Chicago, cost: 981.0, room type: Entire home/apt, house rules: No parties & No children under 10 & No smoking, minimum nights: 2.0, maximum occupancy: 7\n\nNumber of people: 2\nTotal cost: 2 x 38 + 2 x 72 + 2 x 99 + 981 = 1399\nAccommodation minimum nights: 2/2\n\nDays: 3\nCurrent City: from Chicago to Atlanta\nTransportation: Flight Number: F3505549, from Chicago to Atlanta, Departure Time: 09:28, Arrival Time: 12:58, cost: 155\nBreakfast: Gyan Vaishnav, Chicago, cost: 14, cuisines: Bakery, Desserts\nAttraction: -\nLunch: -\nDinner: -\nAccommodation: -\n\nNumber of people: 2\nTotal cost: 2 x 155 + 2 x 14 = 338\n\nTotal cost across all days: 1659 + 1399 + 338 = 3396\n\nCuisines: The prompt does not specify any cuisine constraints, so all cuisine constraints are satisfied.\n\n**Note**: The total cost exceeds the specified budget of $1,900. Adjustments are needed to meet the budget constraint. However, given the provided data, the lowest cost for accommodations alone exceeds the budget when considering the minimum stay requirements. Therefore, it is not possible to create a travel plan within the given budget constraint based on the provided data.", "gpt-4-1106-preview_direct_sole-planning_parsed_results": [{"day": 1, "current_city": "from Atlanta to Chicago", "transportation": "Flight Number: F3505544, from Atlanta to Chicago, Departure Time: 08:12, Arrival Time: 09:12", "breakfast": "-", "attraction": "Millennium Park, Chicago", "lunch": "The Black Pearl, Chicago", "dinner": "Pantry d'or, Chicago", "accommodation": "Newly Renovated Greenpoint Abode, Chicago"}, {"day": 2, "current_city": "Chicago", "transportation": "-", "breakfast": "Bro's Kitchenette, Chicago", "attraction": "Willis Tower, Chicago;Navy Pier, Chicago", "lunch": "Mini's Royal Cafe, Chicago", "dinner": "Pizza Hut, Chicago", "accommodation": "Newly Renovated Greenpoint Abode, Chicago"}, {"day": 3, "current_city": "from Chicago to Atlanta", "transportation": "Flight Number: F3505549, from Chicago to Atlanta, Departure Time: 09:28, Arrival Time: 12:58", "breakfast": "Gyan Vaishnav, Chicago", "attraction": "-", "lunch": "-", "dinner": "-", "accommodation": "-"}]}]