[{"gpt-4-1106-preview_direct_sole-planning_results": "Travel Plan:\n\nDays: 1\nCurrent City: from South Bend to Atlanta\nTransportation: Flight Number: F3648988, from South Bend to Atlanta, Departure Time: 12:30, Arrival Time: 14:21, cost: 170\nBreakfast: -\nAttraction: Georgia Aquarium, Atlanta, cost: (included in budget as no cost specified)\nLunch: Asian Bistro, Atlanta, cost: 27, cuisines: Tea, Bakery, Seafood\nDinner: Pizza Central, Atlanta, cost: 75, cuisines: Cafe, Bakery, BBQ, Fast Food, Chinese, Indian\nAccommodation: Bright, Modern, Clean, Spacious, Brooklyn Home, Atlanta, cost: 1034.0, maximum occupancy: 4, house rules: No children under 10, minimum nights: 3.0\n\nNumber of people: 2\nTotal cost: 2 x 170 + 2 x 27 + 2 x 75 + 1034 = 1508\nAccommodation minimum nights: 1/3\n\nDays: 2\nCurrent City: Atlanta\nTransportation: -\nBreakfast: Saffron, Atlanta, cost: 39, cuisines: Tea, Cafe, Fast Food, Seafood\nAttraction: World of Coca-Cola, Atlanta, cost: (included in budget as no cost specified)\nLunch: Chef Style, Atlanta, cost: 59, cuisines: Pizza, American, Desserts, Seafood\nDinner: Daawat-e-Kashmir, Atlanta, cost: 19, cuisines: Cafe, Pizza, American, Seafood\nAccommodation: Bright, Modern, Clean, Spacious, Brooklyn Home, Atlanta, cost: 1034.0, maximum occupancy: 4, house rules: No children under 10, minimum nights: 3.0\n\nNumber of people: 2\nTotal cost: 2 x 39 + 2 x 59 + 2 x 19 + 1034 = 1258\nAccommodation minimum nights: 2/3\n\nDays: 3\nCurrent City: Atlanta to South Bend\nTransportation: Flight Number: F3655481, from Atlanta to South Bend, Departure Time: 21:10, Arrival Time: 23:05, cost: 281\nBreakfast: Shri Ram Restaurant, Atlanta, cost: 55, cuisines: Tea, Mexican, Indian, Fast Food\nAttraction: Piedmont Park, Atlanta, cost: (included in budget as no cost specified)\nLunch: The Chinese & Thai Restaurant, Atlanta, cost: 57, cuisines: Desserts, Tea, Italian, Bakery, Fast Food\nDinner: -\nAccommodation: -\n\nNumber of people: 2\nTotal cost: 2 x 55 + 2 x 57 + 2 x 281 = 786\nAccommodation minimum nights: 3/3\n\nTotal cost across all days: 1508 + 1258 + 786 = 3552\n\nUnfortunately, the total cost of the travel plan exceeds the specified budget of $1,500. To adjust the plan to fit within the budget, we need to make some changes:\n\n- Choose a less expensive accommodation option.\n- Opt for a cheaper transportation method if available.\n- Reduce the number of attractions or meals at restaurants.\n\nRevised Travel Plan:\n\nDays: 1\nCurrent City: from South Bend to Atlanta\nTransportation: Flight Number: F3648988, from South Bend to Atlanta, Departure Time: 12:30, Arrival Time: 14:21, cost: 170\nBreakfast: -\nAttraction: Georgia Aquarium, Atlanta, cost: (included in budget as no cost specified)\nLunch: Asian Bistro, Atlanta, cost: 27, cuisines: Tea, Bakery, Seafood\nDinner: Daawat-e-Kashmir, Atlanta, cost: 19, cuisines: Cafe, Pizza, American, Seafood\nAccommodation: Unique 2BR Apartment, Atlanta, cost: 394.0, maximum occupancy: 3, house rules: No parties & No pets & No children under 10, minimum nights: 2.0\n\nNumber of people: 2\nTotal cost: 2 x 170 + 2 x 27 + 2 x 19 + 394 = 826\nAccommodation minimum nights: 1/2\n\nDays: 2\nCurrent City: Atlanta\nTransportation: -\nBreakfast: Saffron, Atlanta, cost: 39, cuisines: Tea, Cafe, Fast Food, Seafood\nAttraction: World of Coca-Cola, Atlanta, cost: (included in budget as no cost specified)\nLunch: Chef Style, Atlanta, cost: 59, cuisines: Pizza, American, Desserts, Seafood\nDinner: -\nAccommodation: Unique 2BR Apartment, Atlanta, cost: 394.0, maximum occupancy: 3, house rules: No parties & No pets & No children under 10, minimum nights: 2.0\n\nNumber of people: 2\nTotal cost: 2 x 39 + 2 x 59 + 394 = 590\nAccommodation minimum nights: 2/2\n\nDays: 3\nCurrent City: Atlanta to South Bend\nTransportation: Flight Number: F3655481, from Atlanta to South Bend, Departure Time: 21:10, Arrival Time: 23:05, cost: 281\nBreakfast: Shri Ram Restaurant, Atlanta, cost: 55, cuisines: Tea, Mexican, Indian, Fast Food\nAttraction: Piedmont Park, Atlanta, cost: (included in budget as no cost specified)\nLunch: -\nDinner: -\nAccommodation: -\n\nNumber of people: 2\nTotal cost: 2 x 55 + 2 x 281 = 672\n\nTotal cost across all days: 826 + 590 + 672 = 2088\n\nThe revised plan still exceeds the budget. To fit within the $1,500 budget, we may need to consider alternative transportation methods such as a taxi, which may be less expensive than flying. However, the provided data does not offer a cheaper flight or taxi option within the budget constraints. Therefore, we cannot create a feasible travel plan that includes flights and meets all the specified requirements within the $1,500 budget.", "gpt-4-1106-preview_direct_sole-planning_parsed_results": [{"day": 1, "current_city": "from South Bend to Atlanta", "transportation": "Flight Number: F3648988, from South Bend to Atlanta, Departure Time: 12:30, Arrival Time: 14:21", "breakfast": "-", "attraction": "Georgia Aquarium, Atlanta;", "lunch": "Asian Bistro, Atlanta", "dinner": "Pizza Central, Atlanta", "accommodation": "Bright, Modern, Clean, Spacious, Brooklyn Home, Atlanta"}, {"day": 2, "current_city": "Atlanta", "transportation": "-", "breakfast": "Saffron, Atlanta", "attraction": "World of Coca-Cola, Atlanta;", "lunch": "Chef Style, Atlanta", "dinner": "Daawat-e-Kashmir, Atlanta", "accommodation": "Bright, Modern, Clean, Spacious, Brooklyn Home, Atlanta"}, {"day": 3, "current_city": "from Atlanta to South Bend", "transportation": "Flight Number: F3655481, from Atlanta to South Bend, Departure Time: 21:10, Arrival Time: 23:05", "breakfast": "Shri Ram Restaurant, Atlanta", "attraction": "Piedmont Park, Atlanta;", "lunch": "The Chinese & Thai Restaurant, Atlanta", "dinner": "-", "accommodation": "-"}, {"day": 1, "current_city": "from South Bend to Atlanta", "transportation": "Flight Number: F3648988, from South Bend to Atlanta, Departure Time: 12:30, Arrival Time: 14:21", "breakfast": "-", "attraction": "Georgia Aquarium, Atlanta;", "lunch": "Asian Bistro, Atlanta", "dinner": "Daawat-e-Kashmir, Atlanta", "accommodation": "Unique 2BR Apartment, Atlanta"}, {"day": 2, "current_city": "Atlanta", "transportation": "-", "breakfast": "Saffron, Atlanta", "attraction": "World of Coca-Cola, Atlanta;", "lunch": "Chef Style, Atlanta", "dinner": "-", "accommodation": "Unique 2BR Apartment, Atlanta"}, {"day": 3, "current_city": "from Atlanta to South Bend", "transportation": "Flight Number: F3655481, from Atlanta to South Bend, Departure Time: 21:10, Arrival Time: 23:05", "breakfast": "Shri Ram Restaurant, Atlanta", "attraction": "Piedmont Park, Atlanta;", "lunch": "-", "dinner": "-", "accommodation": "-"}]}]