[{"gpt-4-1106-preview_direct_sole-planning_results": "Travel Plan:\n\nDays: 1\nCurrent City: from Jacksonville to Washington\nTransportation: Flight Number: F3790749, from Jacksonville to Washington, Departure Time: 11:54, Arrival Time: 13:38, cost: 239\nBreakfast: -\nAttraction: The Seattle Great Wheel, Washington\nLunch: Los Aztecas, Washington, cost: 46, cuisines: Cafe, Bakery, BBQ, Fast Food\nDinner: Hemingway's Island Grill, Washington, cost: 57, cuisines: Mexican, BBQ, Fast Food, Cafe, Seafood\nAccommodation: Comfortable & Cozy Times Square Apt, Washington, cost: 499.0, maximum occupancy: 3, house rules: No parties & No children under 10, minimum nights: 2.0\n\nNumber of people: 2\nTotal cost: 2 x 239 + 2 x 46 + 2 x 57 + 499 = 1133\nAccommodation minimum nights: 1/2\n\nNote: The accommodation selected does not allow parties, which is against the query's request for accommodations where parties are allowed. However, there are no accommodations listed in the provided data that allow parties. Therefore, the closest match that meets the other criteria has been chosen.\n\nDays: 2\nCurrent City: Washington\nTransportation: -\nBreakfast: Manna Java World Cafe, Washington, cost: 59, cuisines: Cafe, Seafood\nAttraction: Space Needle, Washington; Discovery Park, Washington\nLunch: Thaaliwala, Washington, cost: 88, cuisines: Tea, Pizza, Italian, BBQ, Cafe\nDinner: Amaze Dining, Washington, cost: 92, cuisines: Cafe, Pizza, American, Fast Food\nAccommodation: Comfortable & Cozy Times Square Apt, Washington, cost: 499.0, maximum occupancy: 3, house rules: No parties & No children under 10, minimum nights: 2.0\n\nNumber of people: 2\nTotal cost: 2 x 59 + 2 x 88 + 2 x 92 + 499 = 967\nAccommodation minimum nights: 2/2\n\nDays: 3\nCurrent City: from Washington to Jacksonville\nTransportation: Flight Number: F3786730, from Washington to Jacksonville, Departure Time: 08:48, Arrival Time: 10:58, cost: 196\nBreakfast: -\nAttraction: -\nLunch: -\nDinner: -\nAccommodation: -\n\nNumber of people: 2\nTotal cost: 2 x 196 = 392\n\nTotal cost across all days: 1133 + 967 + 392 = 2492\n\nUnfortunately, the total cost of the travel plan exceeds the specified budget of $1,000. Adjustments to the plan are required to meet the budget constraint. Here is a revised plan that fits within the budget:\n\nRevised Travel Plan:\n\nDays: 1\nCurrent City: from Jacksonville to Washington\nTransportation: Flight Number: F3635008, from Jacksonville to Washington, Departure Time: 16:58, Arrival Time: 18:44, cost: 133\nBreakfast: -\nAttraction: The Seattle Great Wheel, Washington\nLunch: -\nDinner: Los Aztecas, Washington, cost: 46, cuisines: Cafe, Bakery, BBQ, Fast Food\nAccommodation: Stunning 2Bed/2BA + 300sqft deck by the river!, Washington, cost: 209.0, maximum occupancy: 3, house rules: No visitors, minimum nights: 1.0\n\nNumber of people: 2\nTotal cost: 2 x 133 + 2 x 46 + 209 = 567\n\nDays: 2\nCurrent City: Washington\nTransportation: -\nBreakfast: Manna Java World Cafe, Washington, cost: 59, cuisines: Cafe, Seafood\nAttraction: Space Needle, Washington; Discovery Park, Washington\nLunch: Thaaliwala, Washington, cost: 88, cuisines: Tea, Pizza, Italian, BBQ, Cafe\nDinner: -\nAccommodation: Stunning 2Bed/2BA + 300sqft deck by the river!, Washington, cost: 209.0, maximum occupancy: 3, house rules: No visitors, minimum nights: 1.0\n\nNumber of people: 2\nTotal cost: 2 x 59 + 2 x 88 + 209 = 503\n\nDays: 3\nCurrent City: from Washington to Jacksonville\nTransportation: Flight Number: F3786730, from Washington to Jacksonville, Departure Time: 08:48, Arrival Time: 10:58, cost: 196\nBreakfast: -\nAttraction: -\nLunch: -\nDinner: -\nAccommodation: -\n\nNumber of people: 2\nTotal cost: 2 x 196 = 392\n\nTotal cost across all days: 567 + 503 + 392 = 1462\n\nThe revised plan still exceeds the budget. To fit within the $1,000 budget, we must choose the cheapest transportation options and limit dining and accommodation expenses. Here is a final attempt:\n\nFinal Revised Travel Plan:\n\nDays: 1\nCurrent City: from Jacksonville to Washington\nTransportation: Self-driving, from Jacksonville to Washington, duration: 10 hours 13 mins, distance: 1,136 km, cost: 56\nBreakfast: -\nAttraction: -\nLunch: -\nDinner: Los Aztecas, Washington, cost: 46, cuisines: Cafe, Bakery, BBQ, Fast Food\nAccommodation: Stunning 2Bed/2BA + 300sqft deck by the river!, Washington, cost: 209.0, maximum occupancy: 3, house rules: No visitors, minimum nights: 1.0\n\nNumber of people: 2\nTotal cost: 2 x 56 + 2 x 46 + 209 = 413\n\nDays: 2\nCurrent City: Washington\nTransportation: -\nBreakfast: -\nAttraction: Discovery Park, Washington\nLunch: -\nDinner: Thaaliwala, Washington, cost: 88, cuisines: Tea, Pizza, Italian, BBQ, Cafe\nAccommodation: Stunning 2Bed/2BA + 300sqft deck by the river!, Washington, cost: 209.0, maximum occupancy: 3, house rules: No visitors, minimum nights: 1.0\n\nNumber of people: 2\nTotal cost: 2 x 88 + 209 = 385\n\nDays: 3\nCurrent City: from Washington to Jacksonville\nTransportation: Self-driving, from Washington to Jacksonville, duration: 10 hours 12 mins, distance: 1,136 km, cost: 56\nBreakfast: -\nAttraction: -\nLunch: -\nDinner: -\nAccommodation: -\n\nNumber of people: 2\nTotal cost: 2 x 56 = 112\n\nTotal cost across all days: 413 + 385 + 112 = 910\n\nCuisines: The prompt does not specify any cuisine constraints, so all cuisine constraints are satisfied.\n\nThe final revised plan fits within the $1,000 budget, but it does not include attractions on the first day and limits meals to one per day to stay within budget. Additionally, the accommodation selected does not allow parties, as no suitable options were provided in the data.", "gpt-4-1106-preview_direct_sole-planning_parsed_results": [{"day": 1, "current_city": "from Jacksonville to Washington", "transportation": "Flight Number: F3635008, from Jacksonville to Washington, Departure Time: 16:58, Arrival Time: 18:44", "breakfast": "-", "attraction": "The Seattle Great Wheel, Washington", "lunch": "-", "dinner": "Los Aztecas, Washington", "accommodation": "Stunning 2Bed/2BA + 300sqft deck by the river!, Washington"}, {"day": 2, "current_city": "Washington", "transportation": "-", "breakfast": "Manna Java World Cafe, Washington", "attraction": "Space Needle, Washington;Discovery Park, Washington", "lunch": "Thaaliwala, Washington", "dinner": "-", "accommodation": "Stunning 2Bed/2BA + 300sqft deck by the river!, Washington"}, {"day": 3, "current_city": "from Washington to Jacksonville", "transportation": "Self-driving, from Washington to Jacksonville, duration: 10 hours 12 mins, distance: 1,136 km", "breakfast": "-", "attraction": "-", "lunch": "-", "dinner": "-", "accommodation": "-"}]}]