[{"gpt-4-1106-preview_direct_sole-planning_results": "Travel Plan:\n\nDays: 1\nCurrent City: from Rapid City to Colorado Springs (Colorado)\nTransportation: Taxi, from Rapid City to Colorado Springs, duration: 6 hours 59 mins, distance: 735 km, cost: 735\nBreakfast: -\nAttraction: Garden of the Gods, Colorado Springs (Colorado)\nLunch: -\nDinner: Raglan Road Irish Pub and Restaurant, Colorado Springs (Colorado), cost: 97, cuisines: Chinese, Bakery, Pizza, Mediterranean\nAccommodation: Large sunny park slope apartment, Colorado Springs (Colorado), cost: 82.0, maximum occupancy: 3, house rules: No smoking & No parties & No pets, minimum nights: 1.0\n\nNumber of people: 7\nTotal cost: 735 x 7 + 7 x 97 + 82 x 7 / 3 = 5644\nAccommodation minimum nights: 1/1\n\nDays: 2\nCurrent City: Colorado Springs (Colorado)\nTransportation: -\nBreakfast: Club Tokyo - Best Western Skycity Hotel, Colorado Springs (Colorado), cost: 64, cuisines: Tea, Bakery, Mediterranean, Fast Food\nAttraction: Cheyenne Mountain Zoo, Colorado Springs (Colorado); The Broadmoor Seven Falls, Colorado Springs (Colorado)\nLunch: GoGourmet, Colorado Springs (Colorado), cost: 66, cuisines: Desserts, Bakery, Fast Food, Indian, Seafood\nDinner: New Spice World, Colorado Springs (Colorado), cost: 43, cuisines: Desserts, French, Bakery, Fast Food, Cafe\nAccommodation: Large sunny park slope apartment, Colorado Springs (Colorado), cost: 82.0, maximum occupancy: 3, house rules: No smoking & No parties & No pets, minimum nights: 1.0\n\nNumber of people: 7\nTotal cost: 7 x 64 + 7 x 66 + 7 x 43 + 82 x 7 / 3 = 2035\nAccommodation minimum nights: 2/1\n\nDays: 3\nCurrent City: from Colorado Springs (Colorado) to Denver (Colorado)\nTransportation: Flight Number: F3822851, from Colorado Springs to Denver, Departure Time: 05:54, Arrival Time: 06:43, cost: 16\nBreakfast: -\nAttraction: Denver Zoo, Denver (Colorado); Denver Botanic Gardens, Denver (Colorado)\nLunch: The Urban Socialite, Denver (Colorado), cost: 34, cuisines: Cafe, Indian, Desserts, Italian\nDinner: Tasty Fare, Denver (Colorado), cost: 79, cuisines: French, BBQ, Fast Food\nAccommodation: Harlem cozy nights, Denver (Colorado), cost: 457.0, maximum occupancy: 3, house rules: No visitors, minimum nights: 4.0\n\nNumber of people: 7\nTotal cost: 7 x 16 + 7 x 34 + 7 x 79 + 457 x 7 / 3 = 2731\nAccommodation minimum nights: 1/4\n\nDays: 4\nCurrent City: Denver (Colorado)\nTransportation: -\nBreakfast: Woods Spice, Denver (Colorado), cost: 69, cuisines: Tea, Cafe, Mexican, Desserts\nAttraction: Denver Art Museum, Denver (Colorado); Denver Museum of Nature & Science, Denver (Colorado)\nLunch: Al Yousuf, Denver (Colorado), cost: 32, cuisines: Desserts, Tea, Pizza, French, American\nDinner: Starve Stalkers, Denver (Colorado), cost: 31, cuisines: Fast Food, Indian, BBQ, Seafood\nAccommodation: Harlem cozy nights, Denver (Colorado), cost: 457.0, maximum occupancy: 3, house rules: No visitors, minimum nights: 4.0\n\nNumber of people: 7\nTotal cost: 7 x 69 + 7 x 32 + 7 x 31 + 457 x 7 / 3 = 2731\nAccommodation minimum nights: 2/4\n\nDays: 5\nCurrent City: from Denver (Colorado) to Alamosa (Colorado)\nTransportation: Flight Number: F3837889, from Denver to Alamosa, Departure Time: 16:17, Arrival Time: 17:15, cost: 69\nBreakfast: -\nAttraction: San Luis Valley Museum | Alamosa, Alamosa (Colorado); Rio Grande Farm Park, Alamosa (Colorado)\nLunch: Riverwalk Cafe, Alamosa (Colorado), cost: 97, cuisines: Tea, Pizza, Fast Food\nDinner: Burger Singh, Alamosa (Colorado), cost: 95, cuisines: Desserts, Tea, BBQ, Chinese, Seafood\nAccommodation: Comfortable studio suite in midtown Manhattan, Alamosa (Colorado), cost: 67.0, maximum occupancy: 2, house rules: No parties & No smoking & No visitors, minimum nights: 30.0\n\nNumber of people: 7\nTotal cost: 7 x 69 + 7 x 97 + 7 x 95 + 67 x 7 / 2 = 2731\nAccommodation minimum nights: 1/30\n\nDays: 6\nCurrent City: Alamosa (Colorado)\nTransportation: -\nBreakfast: Coffee to Cocktail Bar - Hyatt Place, Alamosa (Colorado), cost: 35, cuisines: Tea, Indian, Desserts, Italian\nAttraction: Cole Park, Alamosa (Colorado); Alamosa National Wildlife Refuge and Visitor Center, Alamosa (Colorado)\nLunch: Cafe LazyMojo, Alamosa (Colorado), cost: 26, cuisines: Tea, Pizza, American, Fast Food\nDinner: The Arena, Alamosa (Colorado), cost: 85, cuisines: Tea, French, Desserts\nAccommodation: Comfortable studio suite in midtown Manhattan, Alamosa (Colorado), cost: 67.0, maximum occupancy: 2, house rules: No parties & No smoking & No visitors, minimum nights: 30.0\n\nNumber of people: 7\nTotal cost: 7 x 35 + 7 x 26 + 7 x 85 + 67 x 7 / 2 = 2035\nAccommodation minimum nights: 2/30\n\nDays: 7\nCurrent City: from Alamosa (Colorado) to Rapid City\nTransportation: Taxi, from Alamosa to Rapid City, duration: 9 hours 27 mins, distance: 998 km, cost: 998\nBreakfast: -\nAttraction: -\nLunch: -\nDinner: -\nAccommodation: -\n\nNumber of people: 7\nTotal cost: 998 x 7 = 6986\n\nTotal cost across all days: 5644 + 2035 + 2731 + 2731 + 2731 + 2035 + 6986 = 21893\n\nUnfortunately, the total cost exceeds the specified budget of $16,300. To adjust the plan within the budget, we may need to consider alternative transportation methods, such as self-driving instead of taxis, or adjust accommodation and dining options.", "gpt-4-1106-preview_direct_sole-planning_parsed_results": [{"day": 1, "current_city": "from Rapid City to Colorado Springs", "transportation": "Taxi, from Rapid City to Colorado Springs, duration: 6 hours 59 mins, distance: 735 km", "breakfast": "-", "attraction": "Garden of the Gods, Colorado Springs;", "lunch": "-", "dinner": "Raglan Road Irish Pub and Restaurant, Colorado Springs", "accommodation": "Large sunny park slope apartment, Colorado Springs"}, {"day": 2, "current_city": "Colorado Springs", "transportation": "-", "breakfast": "Club Tokyo - Best Western Skycity Hotel, Colorado Springs", "attraction": "Cheyenne Mountain Zoo, Colorado Springs;The Broadmoor Seven Falls, Colorado Springs;", "lunch": "GoGourmet, Colorado Springs", "dinner": "New Spice World, Colorado Springs", "accommodation": "Large sunny park slope apartment, Colorado Springs"}, {"day": 3, "current_city": "from Colorado Springs to Denver", "transportation": "Flight Number: F3822851, from Colorado Springs to Denver, Departure Time: 05:54, Arrival Time: 06:43", "breakfast": "-", "attraction": "Denver Zoo, Denver;Denver Botanic Gardens, Denver;", "lunch": "The Urban Socialite, Denver", "dinner": "Tasty Fare, Denver", "accommodation": "Harlem cozy nights, Denver"}, {"day": 4, "current_city": "Denver", "transportation": "-", "breakfast": "Woods Spice, Denver", "attraction": "Denver Art Museum, Denver;Denver Museum of Nature & Science, Denver;", "lunch": "Al Yousuf, Denver", "dinner": "Starve Stalkers, Denver", "accommodation": "Harlem cozy nights, Denver"}, {"day": 5, "current_city": "from Denver to Alamosa", "transportation": "Flight Number: F3837889, from Denver to Alamosa, Departure Time: 16:17, Arrival Time: 17:15", "breakfast": "-", "attraction": "San Luis Valley Museum | Alamosa, Alamosa;Rio Grande Farm Park, Alamosa;", "lunch": "Riverwalk Cafe, Alamosa", "dinner": "Burger Singh, Alamosa", "accommodation": "Comfortable studio suite in midtown Manhattan, Alamosa"}, {"day": 6, "current_city": "Alamosa", "transportation": "-", "breakfast": "Coffee to Cocktail Bar - Hyatt Place, Alamosa", "attraction": "Cole Park, Alamosa;Alamosa National Wildlife Refuge and Visitor Center, Alamosa;", "lunch": "Cafe LazyMojo, Alamosa", "dinner": "The Arena, Alamosa", "accommodation": "Comfortable studio suite in midtown Manhattan, Alamosa"}, {"day": 7, "current_city": "from Alamosa to Rapid City", "transportation": "Taxi, from Alamosa to Rapid City, duration: 9 hours 27 mins, distance: 998 km", "breakfast": "-", "attraction": "-", "lunch": "-", "dinner": "-", "accommodation": "-"}]}]