[{"gpt-4-1106-preview_direct_sole-planning_results": "Travel Plan:\n\nDays: 1\nCurrent City: from Milwaukee to New York\nTransportation: Flight Number: F3643145, from Milwaukee to New York, Departure Time: 18:36, Arrival Time: 21:58, cost: 226\nBreakfast: -\nAttraction: -\nLunch: -\nDinner: Seasons 52 Fresh Grill, New York, cost: 30, cuisines: Seafood, Indian, Desserts, Italian\nAccommodation: Beautiful and big 1BR sublet close by Central Park, New York, cost: 983.0, room type: Private room, house rules: No parties & No children under 10, minimum nights: 5.0, maximum occupancy: 2\n\nNumber of people: 2\nTotal cost: 2 x 226 + 2 x 30 + 983 = 1495\nAccommodation minimum nights: 1/5\n\nDays: 2\nCurrent City: New York\nTransportation: -\nBreakfast: Gurgaon Hights, New York, cost: 46, cuisines: Cafe, American, Indian, Fast Food\nAttraction: Central Park, New York; The High Line, New York\nLunch: Lord of the Drinks Forum, New York, cost: 71, cuisines: Cafe, Bakery, BBQ, Chinese, Indian\nDinner: Rambhog, New York, cost: 95, cuisines: Tea, Seafood, Mexican, Fast Food\nAccommodation: Beautiful and big 1BR sublet close by Central Park, New York, cost: 983.0, room type: Private room, house rules: No parties & No children under 10, minimum nights: 5.0, maximum occupancy: 2\n\nNumber of people: 2\nTotal cost: 2 x 46 + 2 x 71 + 2 x 95 + 983 = 1407\nAccommodation minimum nights: 2/5\n\nDays: 3\nCurrent City: from New York to Milwaukee\nTransportation: Flight Number: F3644990, from New York to Milwaukee, Departure Time: 15:20, Arrival Time: 16:27, cost: 218\nBreakfast: Sir John Bakery Cafe, New York, cost: 78, cuisines: Pizza, Bakery, Desserts\nAttraction: -\nLunch: -\nDinner: -\nAccommodation: -\n\nNumber of people: 2\nTotal cost: 2 x 78 + 2 x 218 = 592\n\nTotal cost across all days: 1495 + 1407 + 592 = 3494\n\nNote: The total cost exceeds the specified budget of $1,900. Adjustments are needed to meet the budget constraint. Here's an adjusted plan:\n\nAdjusted Travel Plan:\n\nDays: 1\nCurrent City: from Milwaukee to New York\nTransportation: Self-driving, from Milwaukee to New York, duration: 13 hours 29 mins, distance: 1,417 km, cost: 70\nBreakfast: -\nAttraction: -\nLunch: -\nDinner: Green Chick Chop, New York, cost: 26, cuisines: Tea, French, Cafe, Seafood\nAccommodation: A Contemporary Homelike Stay in the Best of BK, New York, cost: 228.0, room type: Entire home/apt, house rules: No pets & No visitors & No children under 10, minimum nights: 2.0, maximum occupancy: 2\n\nNumber of people: 2\nTotal cost: 2 x 70 + 2 x 26 + 228 = 420\nAccommodation minimum nights: 1/2\n\nDays: 2\nCurrent City: New York\nTransportation: -\nBreakfast: Gurgaon Hights, New York, cost: 46, cuisines: Cafe, American, Indian, Fast Food\nAttraction: Central Park, New York; The High Line, New York\nLunch: Green Chick Chop, New York, cost: 26, cuisines: Tea, French, Cafe, Seafood\nDinner: Lord of the Drinks Forum, New York, cost: 71, cuisines: Cafe, Bakery, BBQ, Chinese, Indian\nAccommodation: A Contemporary Homelike Stay in the Best of BK, New York, cost: 228.0, room type: Entire home/apt, house rules: No pets & No visitors & No children under 10, minimum nights: 2.0, maximum occupancy: 2\n\nNumber of people: 2\nTotal cost: 2 x 46 + 2 x 26 + 2 x 71 + 228 = 514\nAccommodation minimum nights: 2/2\n\nDays: 3\nCurrent City: from New York to Milwaukee\nTransportation: Self-driving, from New York to Milwaukee, duration: 13 hours 28 mins, distance: 1,417 km, cost: 70\nBreakfast: Sir John Bakery Cafe, New York, cost: 78, cuisines: Pizza, Bakery, Desserts\nAttraction: -\nLunch: -\nDinner: -\nAccommodation: -\n\nNumber of people: 2\nTotal cost: 2 x 78 + 2 x 70 = 296\n\nTotal cost across all days: 420 + 514 + 296 = 1230\n\nCuisines: The plan includes a variety of cuisines, including the requested non-shared room accommodations. The adjusted plan meets the budget constraint of $1,900.", "gpt-4-1106-preview_direct_sole-planning_parsed_results": [{"day": 1, "current_city": "from Milwaukee to New York", "transportation": "Flight Number: F3643145, from Milwaukee to New York, Departure Time: 18:36, Arrival Time: 21:58", "breakfast": "-", "attraction": "-", "lunch": "-", "dinner": "Seasons 52 Fresh Grill, New York", "accommodation": "Beautiful and big 1BR sublet close by Central Park, New York"}, {"day": 2, "current_city": "New York", "transportation": "-", "breakfast": "Gurgaon Hights, New York", "attraction": "Central Park, New York;The High Line, New York;", "lunch": "Lord of the Drinks Forum, New York", "dinner": "Rambhog, New York", "accommodation": "Beautiful and big 1BR sublet close by Central Park, New York"}, {"day": 3, "current_city": "from New York to Milwaukee", "transportation": "Flight Number: F3644990, from New York to Milwaukee, Departure Time: 15:20, Arrival Time: 16:27", "breakfast": "Sir John Bakery Cafe, New York", "attraction": "-", "lunch": "-", "dinner": "-", "accommodation": "-"}, {"day": 1, "current_city": "from Milwaukee to New York", "transportation": "Self-driving, from Milwaukee to New York, duration: 13 hours 29 mins, distance: 1,417 km", "breakfast": "-", "attraction": "-", "lunch": "-", "dinner": "Green Chick Chop, New York", "accommodation": "A Contemporary Homelike Stay in the Best of BK, New York"}, {"day": 2, "current_city": "New York", "transportation": "-", "breakfast": "Gurgaon Hights, New York", "attraction": "Central Park, New York;The High Line, New York;", "lunch": "Green Chick Chop, New York", "dinner": "Lord of the Drinks Forum, New York", "accommodation": "A Contemporary Homelike Stay in the Best of BK, New York"}, {"day": 3, "current_city": "from New York to Milwaukee", "transportation": "Self-driving, from New York to Milwaukee, duration: 13 hours 28 mins, distance: 1,417 km", "breakfast": "Sir John Bakery Cafe, New York", "attraction": "-", "lunch": "-", "dinner": "-", "accommodation": "-"}]}]