[{"gpt-4-1106-preview_direct_sole-planning_results": "Travel Plan:\n\nDays: 1\nCurrent City: from Panama City to Nashville\nTransportation: Flight Number: F3985882, from Panama City to Nashville, Departure Time: 07:24, Arrival Time: 08:51, cost: 126\nBreakfast: -\nAttraction: Country Music Hall of Fame and Museum, Nashville (cost not provided)\nLunch: Bangkok 1, Nashville, cost: 44, cuisines: Cafe, Seafood\nDinner: Dakshin - Sheraton New Delhi Hotel, Nashville, cost: 63, cuisines: Cafe, Pizza, Indian, Bakery\nAccommodation: Huge 2 Bedroom, Great Location, Express Metro, Nashville, cost: 745.0, maximum occupancy: 4, house rules: No smoking & No children under 10 & No pets, minimum nights: 4.0\n\nNumber of people: 2\nTotal cost: 2 x 126 + 2 x 44 + 2 x 63 + 745 = 1211\nAccommodation minimum nights: 1/4\n\nDays: 2\nCurrent City: Nashville\nTransportation: -\nBreakfast: GoGourmet, Nashville, cost: 34, cuisines: Tea, Cafe, Indian, Mediterranean\nAttraction: Nashville Zoo at Grassmere; Belle Meade Historic Site & Winery; The Parthenon (costs not provided)\nLunch: Dialogue Lounge & Caf\u6106, Nashville, cost: 83, cuisines: Tea, Indian, BBQ, Cafe, American, Seafood\nDinner: Smoke House Deli, Nashville, cost: 59, cuisines: Cafe, Mediterranean, Seafood\nAccommodation: Huge 2 Bedroom, Great Location, Express Metro, Nashville, cost: 745.0, maximum occupancy: 4, house rules: No smoking & No children under 10 & No pets, minimum nights: 4.0\n\nNumber of people: 2\nTotal cost: 2 x 34 + 2 x 83 + 2 x 59 + 745 = 1097\nAccommodation minimum nights: 2/4\n\nDays: 3\nCurrent City: Nashville to Panama City\nTransportation: Flight Number: F4012165, from Nashville to Panama City, Departure Time: 07:32, Arrival Time: 08:46, cost: 105\nBreakfast: Meenakshi Bhawan, Nashville, cost: 24, cuisines: Tea, Desserts\nAttraction: -\nLunch: -\nDinner: -\nAccommodation: -\n\nNumber of people: 2\nTotal cost: 2 x 24 + 2 x 105 = 258\n\nTotal cost across all days: 1211 + 1097 + 258 = 2566\nCuisines: The prompt does not specify cuisine constraints, so all selected restaurants are valid.\nAccommodation: All accommodations are entire homes or apartments, meeting the \"not shared room\" constraint.\n\n***** Travel Plan Ends *****\n\nPlease note that the costs for attractions are not provided in the reference information, and the budget limit is $2,900. The total cost of the travel plan is $2,566, which is within the budget. The accommodations selected are not shared rooms, and the house rules are adhered to. The transportation modes are consistent with the cities and dates specified.", "gpt-4-1106-preview_direct_sole-planning_parsed_results": [{"day": 1, "current_city": "from Panama City to Nashville", "transportation": "Flight Number: F3985882, from Panama City to Nashville, Departure Time: 07:24, Arrival Time: 08:51", "breakfast": "-", "attraction": "Country Music Hall of Fame and Museum, Nashville;", "lunch": "Bangkok 1, Nashville", "dinner": "Dakshin - Sheraton New Delhi Hotel, Nashville", "accommodation": "Huge 2 Bedroom, Great Location, Express Metro, Nashville"}, {"day": 2, "current_city": "Nashville", "transportation": "-", "breakfast": "GoGourmet, Nashville", "attraction": "Nashville Zoo at Grassmere, Nashville;Belle Meade Historic Site & Winery, Nashville;The Parthenon, Nashville;", "lunch": "Dialogue Lounge & Caf\u6106, Nashville", "dinner": "Smoke House Deli, Nashville", "accommodation": "Huge 2 Bedroom, Great Location, Express Metro, Nashville"}, {"day": 3, "current_city": "from Nashville to Panama City", "transportation": "Flight Number: F4012165, from Nashville to Panama City, Departure Time: 07:32, Arrival Time: 08:46", "breakfast": "Meenakshi Bhawan, Nashville", "attraction": "-", "lunch": "-", "dinner": "-", "accommodation": "-"}]}]