[{"gpt-4-1106-preview_direct_sole-planning_results": "Travel Plan:\n\nDays: 1\nCurrent City: from Sun Valley to San Diego (California)\nTransportation: Self-driving, from Sun Valley to San Diego, duration: 14 hours 9 mins, distance: 1,461 km, cost: 73\nBreakfast: -\nAttraction: Cabrillo National Monument, San Diego (California)\nLunch: -\nDinner: Open Yard, San Diego (California), cost: 33, cuisines: Chinese, Pizza, Cafe, Desserts\nAccommodation: Spacious Room in Large 2 Bedroom Prewar Apartment, San Diego (California), cost: 585.0, room type: Private room, house rules: No parties & No visitors, minimum nights: 1.0, maximum occupancy: 2\n\nNumber of people: 1\nTotal cost: 73 + 33 + 585 = 691\nAccommodation minimum nights: 1/1\n\nDays: 2\nCurrent City: San Diego (California)\nTransportation: -\nBreakfast: Jetha Lal Ka Dhabha, San Diego (California), cost: 22, cuisines: Tea, Cafe, Indian, Italian\nAttraction: Balboa Park, San Diego (California); SeaWorld San Diego, San Diego (California)\nLunch: Burger King, San Diego (California), cost: 20, cuisines: Pizza, Italian, French, Fast Food, Seafood\nDinner: Gopala, San Diego (California), cost: 98, cuisines: Pizza, Mexican, BBQ, American, Seafood\nAccommodation: Spacious Room in Large 2 Bedroom Prewar Apartment, San Diego (California), cost: 585.0, room type: Private room, house rules: No parties & No visitors, minimum nights: 1.0, maximum occupancy: 2\n\nNumber of people: 1\nTotal cost: 22 + 20 + 98 + 585 = 725\nAccommodation minimum nights: 1/1\n\nDays: 3\nCurrent City: from San Diego (California) to Redding (California)\nTransportation: Self-driving, from San Diego to Redding, duration: 10 hours 10 mins, distance: 1,070 km, cost: 53\nBreakfast: -\nAttraction: Sundial Bridge, Redding (California)\nLunch: Di Ghent Boulangerie, Redding (California), cost: 13, cuisines: French, Pizza, Mediterranean, Seafood\nDinner: New Yorker Deli & Pizzeria, Redding (California), cost: 78, cuisines: Pizza, Bakery, Desserts, Seafood\nAccommodation: 3 Bedroom Cozy Apartment, Redding (California), cost: 724.0, room type: Entire home/apt, house rules: No smoking & No pets & No parties, minimum nights: 4.0, maximum occupancy: 4\n\nNumber of people: 1\nTotal cost: 53 + 13 + 78 + 724 = 868\nAccommodation minimum nights: 1/4\n\nDays: 4\nCurrent City: Redding (California)\nTransportation: -\nBreakfast: Perfect Bake, Redding (California), cost: 69, cuisines: Tea, Pizza, Fast Food\nAttraction: Turtle Bay Exploration Park, Redding (California); Whiskeytown National Recreation Area, Redding (California)\nLunch: Mosaic - Country Inn & Suites, Redding (California), cost: 57, cuisines: Pizza, Bakery, BBQ, Fast Food, American, Mediterranean\nDinner: Evergreen Sweets, Redding (California), cost: 98, cuisines: French, Bakery, Pizza, BBQ\nAccommodation: 3 Bedroom Cozy Apartment, Redding (California), cost: 724.0, room type: Entire home/apt, house rules: No smoking & No pets & No parties, minimum nights: 4.0, maximum occupancy: 4\n\nNumber of people: 1\nTotal cost: 69 + 57 + 98 + 724 = 948\nAccommodation minimum nights: 2/4\n\nDays: 5\nCurrent City: from Redding (California) to Sun Valley\nTransportation: Self-driving, from Redding to Sun Valley, duration: 11 hours 13 mins, distance: 1,087 km, cost: 54\nBreakfast: -\nAttraction: -\nLunch: -\nDinner: -\nAccommodation: -\n\nNumber of people: 1\nTotal cost: 54\n\nTotal cost across all days: 691 + 725 + 868 + 948 + 54 = 3286\n\nUnfortunately, the total cost of $3,286 exceeds the specified budget of $2,600. Adjustments will need to be made to the plan to reduce costs. This could involve choosing less expensive accommodations, dining options, or altering the transportation method if possible. However, given the constraints and the provided data, it may not be feasible to create a plan that fits the budget without additional options or changes to the constraints.", "gpt-4-1106-preview_direct_sole-planning_parsed_results": [{"day": 1, "current_city": "from Sun Valley to San Diego", "transportation": "Self-driving, from Sun Valley to San Diego, duration: 14 hours 9 mins, distance: 1,461 km", "breakfast": "-", "attraction": "Cabrillo National Monument, San Diego;", "lunch": "-", "dinner": "Open Yard, San Diego", "accommodation": "Spacious Room in Large 2 Bedroom Prewar Apartment, San Diego"}, {"day": 2, "current_city": "San Diego", "transportation": "-", "breakfast": "Jetha Lal Ka Dhabha, San Diego", "attraction": "Balboa Park, San Diego;SeaWorld San Diego, San Diego;", "lunch": "Burger King, San Diego", "dinner": "Gopala, San Diego", "accommodation": "Spacious Room in Large 2 Bedroom Prewar Apartment, San Diego"}, {"day": 3, "current_city": "from San Diego to Redding", "transportation": "Self-driving, from San Diego to Redding, duration: 10 hours 10 mins, distance: 1,070 km", "breakfast": "-", "attraction": "Sundial Bridge, Redding;", "lunch": "Di Ghent Boulangerie, Redding", "dinner": "New Yorker Deli & Pizzeria, Redding", "accommodation": "3 Bedroom Cozy Apartment, Redding"}, {"day": 4, "current_city": "Redding", "transportation": "-", "breakfast": "Perfect Bake, Redding", "attraction": "Turtle Bay Exploration Park, Redding;Whiskeytown National Recreation Area, Redding;", "lunch": "Mosaic - Country Inn & Suites, Redding", "dinner": "Evergreen Sweets, Redding", "accommodation": "3 Bedroom Cozy Apartment, Redding"}, {"day": 5, "current_city": "from Redding to Sun Valley", "transportation": "Self-driving, from Redding to Sun Valley, duration: 11 hours 13 mins, distance: 1,087 km", "breakfast": "-", "attraction": "-", "lunch": "-", "dinner": "-", "accommodation": "-"}]}]