[{"gpt-4-1106-preview_direct_sole-planning_results": "Travel Plan:\n\nDays: 1\nCurrent City: from Fayetteville to White Plains\nTransportation: Taxi, from Fayetteville to White Plains, duration: 8 hours 46 mins, distance: 923 km, cost: 923\nBreakfast: -\nAttraction: J Harvey Turnure Memorial Park, White Plains\nLunch: -\nDinner: El Kiosco Mexican Restaurant, White Plains, cost: 65, cuisines: Tea, Pizza\nAccommodation: Private room in Historic Queens NY, White Plains, cost: 865.0, maximum occupancy: 2, house rules: No parties & No smoking, minimum nights: 2.0\n\nNumber of people: 8\nTotal cost: 8 x 923 + 8 x 65 + 865 x 8 / 2 = 11076\nAccommodation minimum nights: 1/2\n\nDays: 2\nCurrent City: White Plains\nTransportation: -\nBreakfast: Kinoshita, White Plains, cost: 42, cuisines: Tea, Pizza, Fast Food, American, Seafood\nAttraction: Saxon Woods Park, White Plains; Battle of White Plains Park, White Plains\nLunch: El Cazador, White Plains, cost: 90, cuisines: Mexican, Pizza, BBQ\nDinner: Six Pack Kitchen, White Plains, cost: 58, cuisines: Chinese, Mexican, Desserts, Seafood\nAccommodation: Private room in Historic Queens NY, White Plains, cost: 865.0, maximum occupancy: 2, house rules: No parties & No smoking, minimum nights: 2.0\n\nNumber of people: 8\nTotal cost: 8 x 42 + 8 x 90 + 8 x 58 + 865 x 8 / 2 = 4656\nAccommodation minimum nights: 2/2\n\nDays: 3\nCurrent City: from White Plains to New York\nTransportation: Taxi, from White Plains to New York, duration: 54 mins, distance: 57.3 km, cost: 57\nBreakfast: -\nAttraction: Top of The Rock, New York; One World Observatory, New York\nLunch: Seasons 52 Fresh Grill, New York, cost: 30, cuisines: Seafood, Indian, Desserts, Italian\nDinner: Lord of the Drinks Forum, New York, cost: 71, cuisines: Cafe, Bakery, BBQ, Chinese, Indian\nAccommodation: Versatile private room in Harlem/Hamilton Heights!, New York, cost: 398.0, maximum occupancy: 1, house rules: No pets & No visitors & No parties, minimum nights: 4.0\n\nNumber of people: 8\nTotal cost: 8 x 57 + 8 x 30 + 8 x 71 + 398 x 8 = 4704\nAccommodation minimum nights: 1/4\n\nDays: 4\nCurrent City: New York\nTransportation: -\nBreakfast: Gurgaon Hights, New York, cost: 46, cuisines: Cafe, American, Indian, Fast Food\nAttraction: The High Line, New York; Empire State Building, New York\nLunch: Goosebumps, New York, cost: 94, cuisines: Chinese, Pizza, Bakery\nDinner: G Dot, New York, cost: 75, cuisines: Cafe, Mexican, BBQ\nAccommodation: Versatile private room in Harlem/Hamilton Heights!, New York, cost: 398.0, maximum occupancy: 1, house rules: No pets & No visitors & No parties, minimum nights: 4.0\n\nNumber of people: 8\nTotal cost: 8 x 46 + 8 x 94 + 8 x 75 + 398 x 8 = 4704\nAccommodation minimum nights: 2/4\n\nDays: 5\nCurrent City: from New York to Fayetteville\nTransportation: Flight Number: F4058074, from New York to Fayetteville, Departure Time: 20:10, Arrival Time: 22:43, cost: 450\nBreakfast: -\nAttraction: -\nLunch: -\nDinner: -\nAccommodation: -\n\nNumber of people: 8\nTotal cost: 8 x 450 = 3600\n\nTotal cost across all days: 11076 + 4656 + 4704 + 4704 + 3600 = 29740\n\nUnfortunately, the total cost of the travel plan ($29,740) exceeds the specified budget of $6,900. Adjustments must be made to the plan to reduce costs, such as changing the mode of transportation, selecting different accommodations, or reducing meal costs. However, given the constraints and the data provided, it is not feasible to create a travel plan within the specified budget.", "gpt-4-1106-preview_direct_sole-planning_parsed_results": [{"day": 1, "current_city": "from Fayetteville to White Plains", "transportation": "Taxi, from Fayetteville to White Plains, duration: 8 hours 46 mins, distance: 923 km", "breakfast": "-", "attraction": "J Harvey Turnure Memorial Park, White Plains;", "lunch": "-", "dinner": "El Kiosco Mexican Restaurant, White Plains", "accommodation": "Private room in Historic Queens NY, White Plains"}, {"day": 2, "current_city": "White Plains", "transportation": "-", "breakfast": "Kinoshita, White Plains", "attraction": "Saxon Woods Park, White Plains;Battle of White Plains Park, White Plains;", "lunch": "El Cazador, White Plains", "dinner": "Six Pack Kitchen, White Plains", "accommodation": "Private room in Historic Queens NY, White Plains"}, {"day": 3, "current_city": "from White Plains to New York", "transportation": "Taxi, from White Plains to New York, duration: 54 mins, distance: 57.3 km", "breakfast": "-", "attraction": "Top of The Rock, New York;One World Observatory, New York;", "lunch": "Seasons 52 Fresh Grill, New York", "dinner": "Lord of the Drinks Forum, New York", "accommodation": "Versatile private room in Harlem/Hamilton Heights!, New York"}, {"day": 4, "current_city": "New York", "transportation": "-", "breakfast": "Gurgaon Hights, New York", "attraction": "The High Line, New York;Empire State Building, New York;", "lunch": "Goosebumps, New York", "dinner": "G Dot, New York", "accommodation": "Versatile private room in Harlem/Hamilton Heights!, New York"}, {"day": 5, "current_city": "from New York to Fayetteville", "transportation": "Flight Number: F4058074, from New York to Fayetteville, Departure Time: 20:10, Arrival Time: 22:43", "breakfast": "-", "attraction": "-", "lunch": "-", "dinner": "-", "accommodation": "-"}]}]