[{"gpt-4-1106-preview_direct_sole-planning_results": "Travel Plan:\n\nDays: 1\nCurrent City: from Salt Lake City to Billings (Montana)\nTransportation: Flight Number: F3829434, from Salt Lake City to Billings (Montana), Departure Time: 09:43, Arrival Time: 10:59, cost: $92 per person\nBreakfast: -\nAttraction: Western Heritage Center, Billings (Montana)\nLunch: Holy Smoke, Billings (Montana), cost: $38, cuisines: Tea, Bakery, Cafe, Indian, Seafood\nDinner: Shree Annapurna, Billings (Montana), cost: $96, cuisines: French, Bakery, Cafe\nAccommodation: Sunny 2 bd + Private rooftop on best GP street, Billings (Montana), cost: $293.0, maximum occupancy: 3, house rules: No visitors & No parties, minimum nights: 3.0\n\nNumber of people: 2\nTotal cost: 2 x $92 + 2 x $38 + 2 x $96 + $293 = $745\nAccommodation minimum nights: 1/3\n\nDays: 2\nCurrent City: Billings (Montana)\nTransportation: -\nBreakfast: L'Angoor, Billings (Montana), cost: $19, cuisines: Cafe, Pizza, Indian, Fast Food\nAttraction: Yellowstone Art Museum, Billings (Montana); ZooMontana, Billings (Montana)\nLunch: Govardhan, Billings (Montana), cost: $59, cuisines: BBQ, Bakery, Desserts\nDinner: Chakhnaa Wala, Billings (Montana), cost: $58, cuisines: Desserts, Tea, Bakery, Mediterranean, Seafood\nAccommodation: Sunny 2 bd + Private rooftop on best GP street, Billings (Montana), cost: $293.0, maximum occupancy: 3, house rules: No visitors & No parties, minimum nights: 3.0\n\nNumber of people: 2\nTotal cost: 2 x $19 + 2 x $59 + 2 x $58 + $293 = $605\nAccommodation minimum nights: 2/3\n\nDays: 3\nCurrent City: from Billings (Montana) to Great Falls (Montana)\nTransportation: Taxi, from Billings (Montana) to Great Falls (Montana), duration: 3 hours 35 mins, distance: 352 km, cost: $352 per person\nBreakfast: New Bengal Sweets, Billings (Montana), cost: $91, cuisines: Tea, Pizza, BBQ, Cafe, Indian\nAttraction: C. M. Russell Museum, Great Falls (Montana); The Lewis and Clark Interpretive Center, Great Falls (Montana)\nLunch: Hula Grill, Great Falls (Montana), cost: $76, cuisines: Pizza, BBQ, Seafood\nDinner: SpiceKlub, Great Falls (Montana), cost: $76, cuisines: Tea, Pizza, Indian, Fast Food, Cafe, American\nAccommodation: Comfy & Sunny Studio Rental, Great Falls (Montana), cost: $413.0, maximum occupancy: 3, house rules: No parties, minimum nights: 2.0\n\nNumber of people: 2\nTotal cost: 2 x $91 + 2 x $76 + 2 x $76 + 2 x $352 + $413 = $1527\nAccommodation minimum nights: 1/2\n\nDays: 4\nCurrent City: Great Falls (Montana)\nTransportation: -\nBreakfast: Flying Pie Pizzaria, Great Falls (Montana), cost: $78, cuisines: Desserts, Bakery, Fast Food, Cafe, Indian, Mediterranean\nAttraction: Giant Springs State Park, Great Falls (Montana); Paris Gibson Square Museum of Art, Great Falls (Montana)\nLunch: Barbeque Nation, Great Falls (Montana), cost: $46, cuisines: Tea, BBQ, Fast Food\nDinner: Silver, Great Falls (Montana), cost: $83, cuisines: Cafe, American, BBQ, Seafood\nAccommodation: Comfy & Sunny Studio Rental, Great Falls (Montana), cost: $413.0, maximum occupancy: 3, house rules: No parties, minimum nights: 2.0\n\nNumber of people: 2\nTotal cost: 2 x $78 + 2 x $46 + 2 x $83 + $413 = $827\nAccommodation minimum nights: 2/2\n\nDays: 5\nCurrent City: from Great Falls (Montana) to Bozeman (Montana)\nTransportation: Taxi, from Great Falls (Montana) to Bozeman (Montana), duration: 2 hours 55 mins, distance: 299 km, cost: $299 per person\nBreakfast: Magical Momos, Great Falls (Montana), cost: $25, cuisines: Cafe, BBQ, Seafood\nAttraction: Museum of the Rockies, Bozeman (Montana); Gallatin History Museum, Bozeman (Montana)\nLunch: McGuire's Irish Pub & Brewery, Bozeman (Montana), cost: $72, cuisines: Fast Food, Desserts, Italian\nDinner: Zaroob, Bozeman (Montana), cost: $67, cuisines: Desserts, Tea, French, BBQ, Bakery, Indian\nAccommodation: SPACIOUS STUDIO APT 3 IN PROSPECT LEFFERTS GARDENS, Bozeman (Montana), cost: $1060.0, maximum occupancy: 6, house rules: No parties, minimum nights: 5.0\n\nNumber of people: 2\nTotal cost: 2 x $25 + 2 x $72 + 2 x $67 + 2 x $299 + $1060 = $1986\nAccommodation minimum nights: 1/5\n\nDays: 6\nCurrent City: Bozeman (Montana)\nTransportation: -\nBreakfast: Saravana Bhavan, Bozeman (Montana), cost: $38, cuisines: Tea, American, Desserts\nAttraction: American Computer & Robotics Museum, Bozeman (Montana); The Story Mansion and Story Park, Bozeman (Montana)\nLunch: Indo Chinese, Bozeman (Montana), cost: $66, cuisines: Italian, BBQ, Bakery, Fast Food, Chinese, Seafood\nDinner: Shri Bhujia Bhandar, Bozeman (Montana), cost: $87, cuisines: Tea, Chinese, Desserts, Italian\nAccommodation: SPACIOUS STUDIO APT 3 IN PROSPECT LEFFERTS GARDENS, Bozeman (Montana), cost: $1060.0, maximum occupancy: 6, house rules: No parties, minimum nights: 5.0\n\nNumber of people: 2\nTotal cost: 2 x $38 + 2 x $66 + 2 x $87 + $1060 = $1352\nAccommodation minimum nights: 2/5\n\nDays: 7\nCurrent City: from Bozeman (Montana) to Salt Lake City\nTransportation: Flight Number: F3500804, from Bozeman to Salt Lake City, Departure Time: 05:57, Arrival Time: 07:03, cost: $71 per person\nBreakfast: Side Wok, Bozeman (Montana), cost: $14, cuisines: Tea, Pizza, Indian\nAttraction: -\nLunch: -\nDinner: -\nAccommodation: -\n\nNumber of people: 2\nTotal cost: 2 x $71 + 2 x $14 = $170\n\nTotal cost across all days: $745 + $605 + $1527 + $827 + $1986 + $1352 + $170 = $7212\n\nCuisines: The prompt specifies American, Mediterranean, Indian, and Chinese, so all cuisine constraints are satisfied.\n\nNote: The total cost slightly exceeds the budget by $12, which may be adjusted by selecting a less expensive meal option on one of the days or by finding a small discount on one of the accommodations or attractions.", "gpt-4-1106-preview_direct_sole-planning_parsed_results": [{"day": 1, "current_city": "from Salt Lake City to Billings", "transportation": "Flight Number: F3829434, from Salt Lake City to Billings, Departure Time: 09:43, Arrival Time: 10:59", "breakfast": "-", "attraction": "Western Heritage Center, Billings;", "lunch": "Holy Smoke, Billings", "dinner": "Shree Annapurna, Billings", "accommodation": "Sunny 2 bd + Private rooftop on best GP street, Billings"}, {"day": 2, "current_city": "Billings", "transportation": "-", "breakfast": "L'Angoor, Billings", "attraction": "Yellowstone Art Museum, Billings;ZooMontana, Billings;", "lunch": "Govardhan, Billings", "dinner": "Chakhnaa Wala, Billings", "accommodation": "Sunny 2 bd + Private rooftop on best GP street, Billings"}, {"day": 3, "current_city": "from Billings to Great Falls", "transportation": "Taxi, from Billings to Great Falls, duration: 3 hours 35 mins, distance: 352 km", "breakfast": "New Bengal Sweets, Billings", "attraction": "C. M. Russell Museum, Great Falls;The Lewis and Clark Interpretive Center, Great Falls;", "lunch": "Hula Grill, Great Falls", "dinner": "SpiceKlub, Great Falls", "accommodation": "Comfy & Sunny Studio Rental, Great Falls"}, {"day": 4, "current_city": "Great Falls", "transportation": "-", "breakfast": "Flying Pie Pizzaria, Great Falls", "attraction": "Giant Springs State Park, Great Falls;Paris Gibson Square Museum of Art, Great Falls;", "lunch": "Barbeque Nation, Great Falls", "dinner": "Silver, Great Falls", "accommodation": "Comfy & Sunny Studio Rental, Great Falls"}, {"day": 5, "current_city": "from Great Falls to Bozeman", "transportation": "Taxi, from Great Falls to Bozeman, duration: 2 hours 55 mins, distance: 299 km", "breakfast": "Magical Momos, Great Falls", "attraction": "Museum of the Rockies, Bozeman;Gallatin History Museum, Bozeman;", "lunch": "McGuire's Irish Pub & Brewery, Bozeman", "dinner": "Zaroob, Bozeman", "accommodation": "SPACIOUS STUDIO APT 3 IN PROSPECT LEFFERTS GARDENS, Bozeman"}, {"day": 6, "current_city": "Bozeman", "transportation": "-", "breakfast": "Saravana Bhavan, Bozeman", "attraction": "American Computer & Robotics Museum, Bozeman;The Story Mansion and Story Park, Bozeman;", "lunch": "Indo Chinese, Bozeman", "dinner": "Shri Bhujia Bhandar, Bozeman", "accommodation": "SPACIOUS STUDIO APT 3 IN PROSPECT LEFFERTS GARDENS, Bozeman"}, {"day": 7, "current_city": "from Bozeman to Salt Lake City", "transportation": "Flight Number: F3500804, from Bozeman to Salt Lake City, Departure Time: 05:57, Arrival Time: 07:03", "breakfast": "Side Wok, Bozeman", "attraction": "-", "lunch": "-", "dinner": "-", "accommodation": "-"}]}]