[{"gpt-4-1106-preview_direct_sole-planning_results": "Travel Plan:\n\nDays: 1\nCurrent City: from Pittsburgh to Houston (Texas)\nTransportation: Flight Number: F3902409, from Pittsburgh to Houston, Departure Time: 06:27, Arrival Time: 08:40, cost: 334\nBreakfast: -\nAttraction: Downtown Aquarium, Houston (Texas)\nLunch: Jalapenos, Houston (Texas), cost: 57, cuisines: Desserts, Tea, Cafe, Chinese, Seafood\nDinner: The BrewMaster - The Mix Fine Dine, Houston (Texas), cost: 52, cuisines: French, Indian, Cafe, Seafood\nAccommodation: Sunny and Airy near Manhattan, Houston (Texas), cost: 499.0, maximum occupancy: 4, house rules: No pets, minimum nights: 2.0\n\nNumber of people: 7\nTotal cost: 7 x 334 + 7 x 57 + 7 x 52 + 499 x 7 / 4 = 3895\nAccommodation minimum nights: 1/2\n\nDays: 2\nCurrent City: Houston (Texas)\nTransportation: -\nBreakfast: Super Bakery, Houston (Texas), cost: 30, cuisines: Seafood, Fast Food\nAttraction: Space Center Houston, Houston (Texas); Water Wall, Houston (Texas); Houston Museum of Natural Science, Houston (Texas)\nLunch: Royal Mart, Houston (Texas), cost: 40, cuisines: Tea, Bakery, Cafe, Mediterranean, Seafood\nDinner: Matchbox, Houston (Texas), cost: 33, cuisines: Tea, Italian, Bakery, Fast Food, Seafood\nAccommodation: Sunny and Airy near Manhattan, Houston (Texas), cost: 499.0, maximum occupancy: 4, house rules: No pets, minimum nights: 2.0\n\nNumber of people: 7\nTotal cost: 7 x 30 + 7 x 40 + 7 x 33 + 499 x 7 / 4 = 2039\nAccommodation minimum nights: 2/2\n\nDays: 3\nCurrent City: from Houston (Texas) to Dallas (Texas)\nTransportation: Flight Number: F3667568, from Houston to Dallas, Departure Time: 09:22, Arrival Time: 10:23, cost: 110\nBreakfast: Earthen Spices, Houston (Texas), cost: 28, cuisines: Tea, Mexican, Bakery, BBQ, Fast Food\nAttraction: The Dallas World Aquarium, Dallas (Texas); The Sixth Floor Museum at Dealey Plaza, Dallas (Texas)\nLunch: Coconuts Fish Cafe, Dallas (Texas), cost: 38, cuisines: Cafe, BBQ, Mediterranean, Fast Food\nDinner: 1918 Bistro & Grill, Dallas (Texas), cost: 90, cuisines: Tea, Pizza, BBQ, Seafood\nAccommodation: Luxury Williamsburg duplex, private roof terrace, Dallas (Texas), cost: 241.0, maximum occupancy: 3, house rules: No visitors, minimum nights: 4.0\n\nNumber of people: 7\nTotal cost: 7 x 28 + 7 x 38 + 7 x 90 + 241 x 7 / 3 + 7 x 110 = 2731\nAccommodation minimum nights: 1/4\n\nDays: 4\nCurrent City: Dallas (Texas)\nTransportation: -\nBreakfast: Cafe Gatherings, Dallas (Texas), cost: 17, cuisines: Bakery, Indian, Desserts\nAttraction: Reunion Tower, Dallas (Texas); Dallas Museum of Art, Dallas (Texas)\nLunch: Drifters Cafe, Dallas (Texas), cost: 21, cuisines: Tea, French, Mexican, Cafe, Seafood\nDinner: L'Opera, Dallas (Texas), cost: 77, cuisines: French, Bakery, BBQ, Fast Food, Seafood\nAccommodation: Luxury Williamsburg duplex, private roof terrace, Dallas (Texas), cost: 241.0, maximum occupancy: 3, house rules: No visitors, minimum nights: 4.0\n\nNumber of people: 7\nTotal cost: 7 x 17 + 7 x 21 + 7 x 77 + 241 x 7 / 3 = 1913\nAccommodation minimum nights: 2/4\n\nDays: 5\nCurrent City: from Dallas (Texas) to Pittsburgh\nTransportation: Flight Number: F3660424, from Dallas to Pittsburgh, Departure Time: 18:25, Arrival Time: 21:39, cost: 389\nBreakfast: Uma Foodies' Hut, Dallas (Texas), cost: 49, cuisines: French, Bakery, Seafood\nAttraction: -\nLunch: -\nDinner: -\nAccommodation: -\n\nNumber of people: 7\nTotal cost: 7 x 49 + 7 x 389 = 3061\n\nTotal cost across all days: 3895 + 2039 + 2731 + 1913 + 3061 = 13639\nCuisines: The prompt specifies no particular cuisine, so all cuisine constraints are satisfied.\nAccommodation: All accommodations permit children under the age of 10, as per the query.", "gpt-4-1106-preview_direct_sole-planning_parsed_results": [{"day": 1, "current_city": "from Pittsburgh to Houston", "transportation": "Flight Number: F3902409, from Pittsburgh to Houston, Departure Time: 06:27, Arrival Time: 08:40", "breakfast": "-", "attraction": "Downtown Aquarium, Houston;", "lunch": "Jalapenos, Houston", "dinner": "The BrewMaster - The Mix Fine Dine, Houston", "accommodation": "Sunny and Airy near Manhattan, Houston"}, {"day": 2, "current_city": "Houston", "transportation": "-", "breakfast": "Super Bakery, Houston", "attraction": "Space Center Houston, Houston;Water Wall, Houston;Houston Museum of Natural Science, Houston;", "lunch": "Royal Mart, Houston", "dinner": "Matchbox, Houston", "accommodation": "Sunny and Airy near Manhattan, Houston"}, {"day": 3, "current_city": "from Houston to Dallas", "transportation": "Flight Number: F3667568, from Houston to Dallas, Departure Time: 09:22, Arrival Time: 10:23", "breakfast": "Earthen Spices, Houston", "attraction": "The Dallas World Aquarium, Dallas;The Sixth Floor Museum at Dealey Plaza, Dallas;", "lunch": "Coconuts Fish Cafe, Dallas", "dinner": "1918 Bistro & Grill, Dallas", "accommodation": "Luxury Williamsburg duplex, private roof terrace, Dallas"}, {"day": 4, "current_city": "Dallas", "transportation": "-", "breakfast": "Cafe Gatherings, Dallas", "attraction": "Reunion Tower, Dallas;Dallas Museum of Art, Dallas;", "lunch": "Drifters Cafe, Dallas", "dinner": "L'Opera, Dallas", "accommodation": "Luxury Williamsburg duplex, private roof terrace, Dallas"}, {"day": 5, "current_city": "from Dallas to Pittsburgh", "transportation": "Flight Number: F3660424, from Dallas to Pittsburgh, Departure Time: 18:25, Arrival Time: 21:39", "breakfast": "Uma Foodies' Hut, Dallas", "attraction": "-", "lunch": "-", "dinner": "-", "accommodation": "-"}]}]