[{"gpt-4-1106-preview_direct_sole-planning_results": "Travel Plan:\n\nDays: 1\nCurrent City: from Los Angeles to Detroit\nTransportation: Flight Number: F3496477, from Los Angeles to Detroit, Departure Time: 15:30, Arrival Time: 22:51, cost: $411\nBreakfast: -\nAttraction: -\nLunch: -\nDinner: A Dong Restaurant, Detroit (Michigan), cost: $40, cuisines: Tea, Cafe, Pizza\nAccommodation: Fashion Designer Studio - Entire Apartment, Detroit (Michigan), cost: $934, maximum occupancy: 7, house rules: No smoking & No visitors & No parties, minimum nights: 30.0\n\nNumber of people: 2\nTotal cost: 2 x $411 + 2 x $40 + $934 = $1836\nAccommodation minimum nights: 1/30\n\nDays: 2\nCurrent City: Detroit\nTransportation: -\nBreakfast: Southern Bliss Bakery, Detroit (Michigan), cost: $28, cuisines: Tea, BBQ, Desserts, Seafood\nAttraction: Detroit Institute of Arts, Detroit (Michigan); Detroit Historical Museum, Detroit (Michigan)\nLunch: Chye Seng Huat Hardware, Detroit (Michigan), cost: $94, cuisines: Tea, Mexican, Seafood\nDinner: DV's Chinese Kitchen, Detroit (Michigan), cost: $91, cuisines: Desserts, Pizza, Italian, Bakery, Cafe, Mediterranean\nAccommodation: Fashion Designer Studio - Entire Apartment, Detroit (Michigan), cost: $934, maximum occupancy: 7, house rules: No smoking & No visitors & No parties, minimum nights: 30.0\n\nNumber of people: 2\nTotal cost: 2 x $28 + 2 x $94 + 2 x $91 + $934 = $1360\nAccommodation minimum nights: 2/30\n\nDays: 3\nCurrent City: from Detroit to Los Angeles\nTransportation: Flight Number: F3538108, from Detroit to Los Angeles, Departure Time: 19:15, Arrival Time: 21:16, cost: $446\nBreakfast: BMG - All Day Dining, Detroit (Michigan), cost: $15, cuisines: Desserts, Bakery, BBQ, Indian, Seafood\nAttraction: -\nLunch: -\nDinner: -\nAccommodation: -\n\nNumber of people: 2\nTotal cost: 2 x $15 + 2 x $446 = $922\n\nTotal cost across all days: $1836 + $1360 + $922 = $4118\n\nCuisines: The prompt specifies Chinese, Indian, Mexican, and Italian, so all cuisine constraints are satisfied.\n\n**Note: The total cost exceeds the specified budget of $2,000. Adjustments are needed to meet the budget constraint.**\n\nAdjusted Travel Plan:\n\nDays: 1\nCurrent City: from Los Angeles to Detroit\nTransportation: Flight Number: F3496477, from Los Angeles to Detroit, Departure Time: 15:30, Arrival Time: 22:51, cost: $411\nBreakfast: -\nAttraction: -\nLunch: -\nDinner: A Dong Restaurant, Detroit (Michigan), cost: $40, cuisines: Tea, Cafe, Pizza\nAccommodation: Lovely, charming and clean bedroom in Manhattan, Detroit (Michigan), cost: $69, maximum occupancy: 2, house rules: No smoking, minimum nights: 1.0\n\nNumber of people: 2\nTotal cost: 2 x $411 + 2 x $40 + $69 = $971\nAccommodation minimum nights: 1/1\n\nDays: 2\nCurrent City: Detroit\nTransportation: -\nBreakfast: Southern Bliss Bakery, Detroit (Michigan), cost: $28, cuisines: Tea, BBQ, Desserts, Seafood\nAttraction: Detroit Institute of Arts, Detroit (Michigan); Detroit Historical Museum, Detroit (Michigan)\nLunch: Chye Seng Huat Hardware, Detroit (Michigan), cost: $94, cuisines: Tea, Mexican, Seafood\nDinner: DV's Chinese Kitchen, Detroit (Michigan), cost: $91, cuisines: Desserts, Pizza, Italian, Bakery, Cafe, Mediterranean\nAccommodation: Lovely, charming and clean bedroom in Manhattan, Detroit (Michigan), cost: $69, maximum occupancy: 2, house rules: No smoking, minimum nights: 1.0\n\nNumber of people: 2\nTotal cost: 2 x $28 + 2 x $94 + 2 x $91 + $69 = $495\nAccommodation minimum nights: 2/1\n\nDays: 3\nCurrent City: from Detroit to Los Angeles\nTransportation: Flight Number: F3545846, from Detroit to Los Angeles, Departure Time: 13:31, Arrival Time: 15:14, cost: $399\nBreakfast: BMG - All Day Dining, Detroit (Michigan), cost: $15, cuisines: Desserts, Bakery, BBQ, Indian, Seafood\nAttraction: -\nLunch: -\nDinner: -\nAccommodation: -\n\nNumber of people: 2\nTotal cost: 2 x $15 + 2 x $399 = $828\n\nTotal cost across all days: $971 + $495 + $828 = $2294\n\n**Note: The adjusted plan still exceeds the budget. Further adjustments are needed, such as choosing a less expensive flight or reducing meal costs.**\n\nFinal Adjusted Travel Plan:\n\nDays: 1\nCurrent City: from Los Angeles to Detroit\nTransportation: Flight Number: F3548634, from Los Angeles to Detroit, Departure Time: 07:08, Arrival Time: 14:11, cost: $632\nBreakfast: -\nAttraction: -\nLunch: -\nDinner: A Dong Restaurant, Detroit (Michigan), cost: $40, cuisines: Tea, Cafe, Pizza\nAccommodation: Lovely, charming and clean bedroom in Manhattan, Detroit (Michigan), cost: $69, maximum occupancy: 2, house rules: No smoking, minimum nights: 1.0\n\nNumber of people: 2\nTotal cost: 2 x $632 + 2 x $40 + $69 = $1413\nAccommodation minimum nights: 1/1\n\nDays: 2\nCurrent City: Detroit\nTransportation: -\nBreakfast: Southern Bliss Bakery, Detroit (Michigan), cost: $28, cuisines: Tea, BBQ, Desserts, Seafood\nAttraction: Detroit Institute of Arts, Detroit (Michigan); Detroit Historical Museum, Detroit (Michigan)\nLunch: Mitalis Kitchen, Detroit (Michigan), cost: $28, cuisines: Pizza, BBQ, Chinese, Mediterranean, Seafood\nDinner: Old Kheer Shop, Detroit (Michigan), cost: $54, cuisines: Mexican, Indian, Desserts, Fast Food\nAccommodation: Lovely, charming and clean bedroom in Manhattan, Detroit (Michigan), cost: $69, maximum occupancy: 2, house rules: No smoking, minimum nights: 1.0\n\nNumber of people: 2\nTotal cost: 2 x $28 + 2 x $28 + 2 x $54 + $69 = $289\nAccommodation minimum nights: 2/1\n\nDays: 3\nCurrent City: from Detroit to Los Angeles\nTransportation: Flight Number: F3545846, from Detroit to Los Angeles, Departure Time: 13:31, Arrival Time: 15:14, cost: $399\nBreakfast: BMG - All Day Dining, Detroit (Michigan), cost: $15, cuisines: Desserts, Bakery, BBQ, Indian, Seafood\nAttraction: -\nLunch: -\nDinner: -\nAccommodation: -\n\nNumber of people: 2\nTotal cost: 2 x $15 + 2 x $399 = $828\n\nTotal cost across all days: $1413 + $289 + $828 = $2530\n\n**Note: The final adjusted plan still exceeds the budget. To meet the budget, consider removing one attraction or choosing a less expensive restaurant for dinner on Day 1.**\n\n**Final Note: Due to the constraints of the provided data and the budget, it is not possible to create a travel plan that includes all requested cuisines, accommodations that allow visitors, and flights within the $2,000 budget. Further adjustments or increased budget would be necessary to meet all requirements.**", "gpt-4-1106-preview_direct_sole-planning_parsed_results": [{"day": 1, "current_city": "from Los Angeles to Detroit", "transportation": "Flight Number: F3496477, from Los Angeles to Detroit, Departure Time: 15:30, Arrival Time: 22:51", "breakfast": "-", "attraction": "-", "lunch": "-", "dinner": "A Dong Restaurant, Detroit", "accommodation": "Fashion Designer Studio - Entire Apartment, Detroit"}, {"day": 2, "current_city": "Detroit", "transportation": "-", "breakfast": "Southern Bliss Bakery, Detroit", "attraction": "Detroit Institute of Arts, Detroit;Detroit Historical Museum, Detroit;", "lunch": "Chye Seng Huat Hardware, Detroit", "dinner": "DV's Chinese Kitchen, Detroit", "accommodation": "Fashion Designer Studio - Entire Apartment, Detroit"}, {"day": 3, "current_city": "from Detroit to Los Angeles", "transportation": "Flight Number: F3538108, from Detroit to Los Angeles, Departure Time: 19:15, Arrival Time: 21:16", "breakfast": "BMG - All Day Dining, Detroit", "attraction": "-", "lunch": "-", "dinner": "-", "accommodation": "-"}, {"day": 1, "current_city": "from Los Angeles to Detroit", "transportation": "Flight Number: F3496477, from Los Angeles to Detroit, Departure Time: 15:30, Arrival Time: 22:51", "breakfast": "-", "attraction": "-", "lunch": "-", "dinner": "A Dong Restaurant, Detroit", "accommodation": "Lovely, charming and clean bedroom in Manhattan, Detroit"}, {"day": 2, "current_city": "Detroit", "transportation": "-", "breakfast": "Southern Bliss Bakery, Detroit", "attraction": "Detroit Institute of Arts, Detroit;Detroit Historical Museum, Detroit;", "lunch": "Chye Seng Huat Hardware, Detroit", "dinner": "DV's Chinese Kitchen, Detroit", "accommodation": "Lovely, charming and clean bedroom in Manhattan, Detroit"}, {"day": 3, "current_city": "from Detroit to Los Angeles", "transportation": "Flight Number: F3545846, from Detroit to Los Angeles, Departure Time: 13:31, Arrival Time: 15:14", "breakfast": "BMG - All Day Dining, Detroit", "attraction": "-", "lunch": "-", "dinner": "-", "accommodation": "-"}, {"day": 1, "current_city": "from Los Angeles to Detroit", "transportation": "Flight Number: F3548634, from Los Angeles to Detroit, Departure Time: 07:08, Arrival Time: 14:11", "breakfast": "-", "attraction": "-", "lunch": "-", "dinner": "A Dong Restaurant, Detroit", "accommodation": "Lovely, charming and clean bedroom in Manhattan, Detroit"}, {"day": 2, "current_city": "Detroit", "transportation": "-", "breakfast": "Southern Bliss Bakery, Detroit", "attraction": "Detroit Institute of Arts, Detroit;Detroit Historical Museum, Detroit;", "lunch": "Mitalis Kitchen, Detroit", "dinner": "Old Kheer Shop, Detroit", "accommodation": "Lovely, charming and clean bedroom in Manhattan, Detroit"}, {"day": 3, "current_city": "from Detroit to Los Angeles", "transportation": "Flight Number: F3545846, from Detroit to Los Angeles, Departure Time: 13:31, Arrival Time: 15:14", "breakfast": "BMG - All Day Dining, Detroit", "attraction": "-", "lunch": "-", "dinner": "-", "accommodation": "-"}]}]