[{"gpt-4-1106-preview_direct_sole-planning_results": "Travel Plan:\n\nDays: 1\nCurrent City: from Denver to Appleton\nTransportation: Flight Number: F3822209, from Denver to Appleton, Departure Time: 17:30, Arrival Time: 20:44, cost: 286\nBreakfast: -\nAttraction: -\nLunch: -\nDinner: Mikata Japanese Steakhouse, Appleton, cost: 72, cuisines: Cafe, Pizza, Bakery, Italian\nAccommodation: Cozy room + bright apartment + rooftop lounge, Appleton, cost: 666.0, maximum occupancy: 1, house rules: No smoking, minimum nights: 1.0\n\nNumber of people: 1\nTotal cost: 286 + 72 + 666 = 1024\n\nDays: 2\nCurrent City: Appleton\nTransportation: -\nBreakfast: Destination Live, Appleton, cost: 30, cuisines: Tea, Indian, BBQ\nAttraction: The History Museum at the Castle, Appleton; Hearthstone Historic House Museum, Appleton; Trout Museum of Art, Appleton\nLunch: Swati Snacks, Appleton, cost: 84, cuisines: Desserts, Bakery, BBQ, Fast Food, American\nDinner: Brick 29, Appleton, cost: 97, cuisines: Desserts, Tea, BBQ, Cafe, American, Mediterranean\nAccommodation: Cozy room + bright apartment + rooftop lounge, Appleton, cost: 666.0, maximum occupancy: 1, house rules: No smoking, minimum nights: 1.0\n\nNumber of people: 1\nTotal cost: 30 + 84 + 97 + 666 = 877\n\nDays: 3\nCurrent City: from Appleton to Denver\nTransportation: Flight Number: F3828308, from Appleton to Denver, Departure Time: 08:23, Arrival Time: 10:37, cost: 295\nBreakfast: -\nAttraction: -\nLunch: -\nDinner: -\nAccommodation: -\n\nNumber of people: 1\nTotal cost: 295\n\nTotal cost across all days: 1024 + 877 + 295 = 2196\n\nUnfortunately, the total cost exceeds the specified budget of $1,800. To adjust the plan within the budget, we can change the accommodation to a more affordable option:\n\nRevised Accommodation for Days 1 and 2:\nAccommodation: Stylish, convenient, renovated- 2 min to subway -, Appleton, cost: 64.0, maximum occupancy: 2, house rules: No smoking & No pets & No children under 10, minimum nights: 1.0\n\nRevised Total Cost for Days 1 and 2: 286 + 72 + 64 = 422 (Day 1)\nRevised Total Cost for Days 2: 30 + 84 + 97 + 64 = 275 (Day 2)\n\nRevised Total cost across all days: 422 + 275 + 295 = 992\n\nThe revised total cost is now within the budget of $1,800.", "gpt-4-1106-preview_direct_sole-planning_parsed_results": [{"day": 1, "current_city": "from Denver to Appleton", "transportation": "Flight Number: F3822209, from Denver to Appleton, Departure Time: 17:30, Arrival Time: 20:44", "breakfast": "-", "attraction": "-", "lunch": "-", "dinner": "Mikata Japanese Steakhouse, Appleton", "accommodation": "Stylish, convenient, renovated- 2 min to subway, Appleton"}, {"day": 2, "current_city": "Appleton", "transportation": "-", "breakfast": "Destination Live, Appleton", "attraction": "The History Museum at the Castle, Appleton;Hearthstone Historic House Museum, Appleton;Trout Museum of Art, Appleton", "lunch": "Swati Snacks, Appleton", "dinner": "Brick 29, Appleton", "accommodation": "Stylish, convenient, renovated- 2 min to subway, Appleton"}, {"day": 3, "current_city": "from Appleton to Denver", "transportation": "Flight Number: F3828308, from Appleton to Denver, Departure Time: 08:23, Arrival Time: 10:37", "breakfast": "-", "attraction": "-", "lunch": "-", "dinner": "-", "accommodation": "-"}]}]