[{"gpt-4-1106-preview_direct_sole-planning_results": "Travel Plan:\n\nDays: 1\nCurrent City: from Oakland to Tucson\nTransportation: Flight Number: F4002752, from Oakland to Tucson, Departure Time: 15:07, Arrival Time: 17:00, cost: 190\nBreakfast: -\nAttraction: Pima Air & Space Museum, Tucson (cost not provided, assumed free for calculation)\nLunch: -\nDinner: Villa Tevere, Tucson, cost: 37, cuisines: Mexican, Mediterranean, Desserts, Fast Food\nAccommodation: Private room with private bathroom, Tucson, cost: 58.0, maximum occupancy: 2, house rules: No smoking, minimum nights: 1.0\n\nNumber of people: 1\nTotal cost: 190 + 37 + 58 = 285\n\nDays: 2\nCurrent City: Tucson\nTransportation: -\nBreakfast: Consort Restaurant, Tucson, cost: 54, cuisines: Bakery, Pizza, Indian, Desserts\nAttraction: Arizona-Sonora Desert Museum, Tucson (cost not provided, assumed free for calculation); Tucson Botanical Gardens, Tucson (cost not provided, assumed free for calculation)\nLunch: Magic Spice Wok, Tucson, cost: 31, cuisines: Cafe, Bakery, BBQ, Chinese, Seafood\nDinner: La Plage, Tucson, cost: 93, cuisines: Seafood, Bakery, Desserts, Italian\nAccommodation: Private room with private bathroom, Tucson, cost: 58.0, maximum occupancy: 2, house rules: No smoking, minimum nights: 1.0\n\nNumber of people: 1\nTotal cost: 54 + 31 + 93 + 58 = 236\n\nDays: 3\nCurrent City: from Tucson to Oakland\nTransportation: Self-driving, from Tucson to Oakland, duration: 12 hours 42 mins, distance: 1,373 km, cost: 68\nBreakfast: Chai Point, Tucson, cost: 62, cuisines: Tea, Bakery, Mexican, American\nAttraction: -\nLunch: -\nDinner: -\nAccommodation: -\n\nNumber of people: 1\nTotal cost: 62 + 68 = 130\n\nTotal cost across all days: 285 + 236 + 130 = 651\n\nCuisines: The prompt does not specify any cuisine constraints, so all cuisine constraints are satisfied.\n\nNote: The attractions listed did not have costs provided, so they were assumed to be free for the purpose of this calculation. If there are entrance fees, they would need to be factored into the total cost. The travel plan is within the specified budget of $1,400.", "gpt-4-1106-preview_direct_sole-planning_parsed_results": [{"day": 1, "current_city": "from Oakland to Tucson", "transportation": "Flight Number: F4002752, from Oakland to Tucson, Departure Time: 15:07, Arrival Time: 17:00", "breakfast": "-", "attraction": "Pima Air & Space Museum, Tucson;", "lunch": "-", "dinner": "Villa Tevere, Tucson", "accommodation": "Private room with private bathroom, Tucson"}, {"day": 2, "current_city": "Tucson", "transportation": "-", "breakfast": "Consort Restaurant, Tucson", "attraction": "Arizona-Sonora Desert Museum, Tucson;Tucson Botanical Gardens, Tucson;", "lunch": "Magic Spice Wok, Tucson", "dinner": "La Plage, Tucson", "accommodation": "Private room with private bathroom, Tucson"}, {"day": 3, "current_city": "from Tucson to Oakland", "transportation": "Self-driving, from Tucson to Oakland, duration: 12 hours 42 mins, distance: 1,373 km", "breakfast": "Chai Point, Tucson", "attraction": "-", "lunch": "-", "dinner": "-", "accommodation": "-"}]}]