[{"gpt-4-1106-preview_direct_sole-planning_results": "Travel Plan:\n\nDays: 1\nCurrent City: from North Platte to Grand Junction (Colorado)\nTransportation: Self-driving, from North Platte to Grand Junction, duration: 7 hours 27 mins, distance: 809 km, cost: 40\nBreakfast: -\nAttraction: Museum of the West, Museums of Western Colorado, Grand Junction\nLunch: -\nDinner: Austin's BBQ and Oyster Bar, Grand Junction, cost: 15, cuisines: Tea, Bakery, Fast Food, Indian, Seafood\nAccommodation: NYC Apartment near Central Park!, Grand Junction, cost: 1118.0, room type: Entire home/apt, house rules: No children under 10, minimum nights: 3.0, maximum occupancy: 5\n\nNumber of people: 2\nTotal cost: 2 x 40 + 2 x 15 + 1118.0 = 1228\nAccommodation minimum nights: 1/3\n\nDays: 2\nCurrent City: Grand Junction (Colorado)\nTransportation: -\nBreakfast: 2 Dog, Grand Junction, cost: 29, cuisines: Desserts, BBQ, Fast Food, Cafe, American\nAttraction: Eureka! McConnell Science Museum, Grand Junction; Western Colorado Botanical Gardens, Grand Junction\nLunch: Punjab Da Pind, Grand Junction, cost: 52, cuisines: Desserts, Pizza, Bakery, Chinese, Mediterranean, Seafood\nDinner: Penta Cafe, Grand Junction, cost: 66, cuisines: French, Mexican, BBQ, Seafood\nAccommodation: NYC Apartment near Central Park!, Grand Junction, cost: 1118.0, room type: Entire home/apt, house rules: No children under 10, minimum nights: 3.0, maximum occupancy: 5\n\nNumber of people: 2\nTotal cost: 2 x 29 + 2 x 52 + 2 x 66 + 1118.0 = 1412\nAccommodation minimum nights: 2/3\n\nDays: 3\nCurrent City: from Grand Junction (Colorado) to Durango (Colorado)\nTransportation: Self-driving, from Grand Junction to Durango, duration: 3 hours 33 mins, distance: 269 km, cost: 13\nBreakfast: -\nAttraction: Animas Museum, Durango; The Powerhouse, Durango\nLunch: Samurai Japanese Cuisine & Sushi Bar, Durango, cost: 67, cuisines: Bakery, Desserts, Fast Food\nDinner: Dub's High on the Hog, Durango, cost: 98, cuisines: Tea, Italian, French, Cafe, Seafood\nAccommodation: Lux 1BR in the heart of NYC Theater district!, Durango, cost: 81.0, room type: Entire home/apt, house rules: No children under 10, minimum nights: 30.0, maximum occupancy: 3\n\nNumber of people: 2\nTotal cost: 2 x 13 + 2 x 67 + 2 x 98 + 81.0 = 437\nAccommodation minimum nights: 1/30\n\nDays: 4\nCurrent City: Durango (Colorado)\nTransportation: -\nBreakfast: Chickenette, Durango, cost: 31, cuisines: Tea, Pizza, Desserts, Fast Food\nAttraction: Durango Wildlife Museum, Durango; Durango Adventures and Zipline Tours, Durango\nLunch: King Bikaneri, Durango, cost: 87, cuisines: Seafood, Indian, BBQ, Fast Food\nDinner: Asian Haus, Durango, cost: 26, cuisines: Fast Food, Seafood, Pizza, Italian\nAccommodation: Lux 1BR in the heart of NYC Theater district!, Durango, cost: 81.0, room type: Entire home/apt, house rules: No children under 10, minimum nights: 30.0, maximum occupancy: 3\n\nNumber of people: 2\nTotal cost: 2 x 31 + 2 x 87 + 2 x 26 + 81.0 = 389\nAccommodation minimum nights: 2/30\n\nDays: 5\nCurrent City: from Durango (Colorado) to Colorado Springs (Colorado)\nTransportation: Self-driving, from Durango to Colorado Springs, duration: 5 hours 27 mins, distance: 504 km, cost: 25\nBreakfast: -\nAttraction: The Broadmoor Seven Falls, Colorado Springs; Garden of the Gods, Colorado Springs\nLunch: Raglan Road Irish Pub and Restaurant, Colorado Springs, cost: 97, cuisines: Chinese, Bakery, Pizza, Mediterranean\nDinner: Club Tokyo - Best Western Skycity Hotel, Colorado Springs, cost: 64, cuisines: Tea, Bakery, Mediterranean, Fast Food\nAccommodation: Large sunny park slope apartment, Colorado Springs, cost: 82.0, room type: Entire home/apt, house rules: No smoking & No parties & No pets, minimum nights: 1.0, maximum occupancy: 3\n\nNumber of people: 2\nTotal cost: 2 x 25 + 2 x 97 + 2 x 64 + 82.0 = 454\nAccommodation minimum nights: 1/1\n\nDays: 6\nCurrent City: Colorado Springs (Colorado)\nTransportation: -\nBreakfast: GoGourmet, Colorado Springs, cost: 66, cuisines: Desserts, Bakery, Fast Food, Indian, Seafood\nAttraction: Cheyenne Mountain Zoo, Colorado Springs; Red Rock Canyon Open Space, Colorado Springs\nLunch: New Spice World, Colorado Springs, cost: 43, cuisines: Desserts, French, Bakery, Fast Food, Cafe\nDinner: South Cafe, Colorado Springs, cost: 36, cuisines: Desserts, French, BBQ, Fast Food, Mediterranean\nAccommodation: Large sunny park slope apartment, Colorado Springs, cost: 82.0, room type: Entire home/apt, house rules: No smoking & No parties & No pets, minimum nights: 1.0, maximum occupancy: 3\n\nNumber of people: 2\nTotal cost: 2 x 66 + 2 x 43 + 2 x 36 + 82.0 = 382\nAccommodation minimum nights: 2/1\n\nDays: 7\nCurrent City: from Colorado Springs (Colorado) to North Platte\nTransportation: Self-driving, from Colorado Springs to North Platte, duration: 4 hours 40 mins, distance: 536 km, cost: 26\nBreakfast: -\nAttraction: -\nLunch: -\nDinner: -\nAccommodation: -\n\nNumber of people: 2\nTotal cost: 2 x 26 = 52\n\nTotal cost across all days: 1228 + 1412 + 437 + 389 + 454 + 382 + 52 = 4354\n\nCuisines: No specific cuisine constraints were mentioned, so all cuisine constraints are satisfied.\nAccommodations: All accommodations are non-shared rooms, and parties are allowed where not specifically prohibited.\nTransportation: No flights were used, as per the constraint to exclude flight options.\n\nRemaining Budget: $6500 - $4354 = $2146\n\nNote: The accommodation in Durango has a minimum stay of 30 nights, which is not suitable for the itinerary. However, due to the lack of provided alternatives, it has been included in the plan. Adjustments would be necessary in a real-world scenario.", "gpt-4-1106-preview_direct_sole-planning_parsed_results": [{"day": 1, "current_city": "from North Platte to Grand Junction", "transportation": "Self-driving, from North Platte to Grand Junction, duration: 7 hours 27 mins, distance: 809 km", "breakfast": "-", "attraction": "Museum of the West, Grand Junction;Museums of Western Colorado, Grand Junction;", "lunch": "-", "dinner": "Austin's BBQ and Oyster Bar, Grand Junction", "accommodation": "NYC Apartment near Central Park!, Grand Junction"}, {"day": 2, "current_city": "Grand Junction", "transportation": "-", "breakfast": "2 Dog, Grand Junction", "attraction": "Eureka! McConnell Science Museum, Grand Junction;Western Colorado Botanical Gardens, Grand Junction;", "lunch": "Punjab Da Pind, Grand Junction", "dinner": "Penta Cafe, Grand Junction", "accommodation": "NYC Apartment near Central Park!, Grand Junction"}, {"day": 3, "current_city": "from Grand Junction to Durango", "transportation": "Self-driving, from Grand Junction to Durango, duration: 3 hours 33 mins, distance: 269 km", "breakfast": "-", "attraction": "Animas Museum, Durango;The Powerhouse, Durango;", "lunch": "Samurai Japanese Cuisine & Sushi Bar, Durango", "dinner": "Dub's High on the Hog, Durango", "accommodation": "Lux 1BR in the heart of NYC Theater district!, Durango"}, {"day": 4, "current_city": "Durango", "transportation": "-", "breakfast": "Chickenette, Durango", "attraction": "Durango Wildlife Museum, Durango;Durango Adventures and Zipline Tours, Durango;", "lunch": "King Bikaneri, Durango", "dinner": "Asian Haus, Durango", "accommodation": "Lux 1BR in the heart of NYC Theater district!, Durango"}, {"day": 5, "current_city": "from Durango to Colorado Springs", "transportation": "Self-driving, from Durango to Colorado Springs, duration: 5 hours 27 mins, distance: 504 km", "breakfast": "-", "attraction": "The Broadmoor Seven Falls, Colorado Springs;Garden of the Gods, Colorado Springs;", "lunch": "Raglan Road Irish Pub and Restaurant, Colorado Springs", "dinner": "Club Tokyo - Best Western Skycity Hotel, Colorado Springs", "accommodation": "Large sunny park slope apartment, Colorado Springs"}, {"day": 6, "current_city": "Colorado Springs", "transportation": "-", "breakfast": "GoGourmet, Colorado Springs", "attraction": "Cheyenne Mountain Zoo, Colorado Springs;Red Rock Canyon Open Space, Colorado Springs;", "lunch": "New Spice World, Colorado Springs", "dinner": "South Cafe, Colorado Springs", "accommodation": "Large sunny park slope apartment, Colorado Springs"}, {"day": 7, "current_city": "from Colorado Springs to North Platte", "transportation": "Self-driving, from Colorado Springs to North Platte, duration: 4 hours 40 mins, distance: 536 km", "breakfast": "-", "attraction": "-", "lunch": "-", "dinner": "-", "accommodation": "-"}]}]