[{"gpt-4-1106-preview_direct_sole-planning_results": "Travel Plan:\n\nDays: 1\nCurrent City: from Cedar Rapids to Denver (Colorado)\nTransportation: Flight Number: F3840884, from Cedar Rapids to Denver (Colorado), Departure Time: 13:11, Arrival Time: 14:09, cost: 207\nBreakfast: -\nAttraction: Denver Art Museum, Denver (Colorado)\nLunch: The Urban Socialite, Denver (Colorado), cost: 34, cuisines: Cafe, Indian, Desserts, Italian\nDinner: Tasty Fare, Denver (Colorado), cost: 79, cuisines: French, BBQ, Fast Food\nAccommodation: *NO GUEST SERVICE FEE* Luxury Studio Suite w/ Free Continental Breakfast, Denver (Colorado), cost: 390.0, maximum occupancy: 2, house rules: No smoking & No visitors & No parties, minimum nights: 3.0\n\nNumber of people: 1\nTotal cost: 207 + 34 + 79 + 390 = 710\nAccommodation minimum nights: 1/3\n\nDays: 2\nCurrent City: Denver (Colorado)\nTransportation: -\nBreakfast: The Fatty Bao - Asian Gastro Bar, Denver (Colorado), cost: 93, cuisines: Bakery, BBQ, Cafe, Indian, Seafood\nAttraction: Denver Zoo, Denver (Colorado); Denver Botanic Gardens, Denver (Colorado)\nLunch: Woods Spice, Denver (Colorado), cost: 69, cuisines: Tea, Cafe, Mexican, Desserts\nDinner: Rain Tree Grill, Denver (Colorado), cost: 94, cuisines: Tea, Mexican, BBQ, Italian\nAccommodation: *NO GUEST SERVICE FEE* Luxury Studio Suite w/ Free Continental Breakfast, Denver (Colorado), cost: 390.0, maximum occupancy: 2, house rules: No smoking & No visitors & No parties, minimum nights: 3.0\n\nNumber of people: 1\nTotal cost: 93 + 69 + 94 + 390 = 646\nAccommodation minimum nights: 2/3\n\nDays: 3\nCurrent City: from Denver (Colorado) to Alamosa (Colorado)\nTransportation: Flight Number: F3857649, from Denver to Alamosa (Colorado), Departure Time: 15:44, Arrival Time: 16:33, cost: 37\nBreakfast: Cafe Diva, Denver (Colorado), cost: 44, cuisines: Chinese, Cafe, Desserts, Fast Food\nAttraction: San Luis Valley Museum | Alamosa, Alamosa (Colorado)\nLunch: Riverwalk Cafe, Alamosa (Colorado), cost: 97, cuisines: Tea, Pizza, Fast Food\nDinner: The Arena, Alamosa (Colorado), cost: 85, cuisines: Tea, French, Desserts\nAccommodation: Comfortable studio suite in midtown Manhattan, Alamosa (Colorado), cost: 67.0, maximum occupancy: 2, house rules: No parties & No smoking & No visitors, minimum nights: 30.0\n\nNumber of people: 1\nTotal cost: 44 + 37 + 97 + 85 + 67 = 330\nAccommodation minimum nights: 1/30\n\nDays: 4\nCurrent City: Alamosa (Colorado)\nTransportation: -\nBreakfast: Emperor's Lounge - The Taj Mahal Hotel, Alamosa (Colorado), cost: 65, cuisines: Tea, Italian, BBQ, Cafe, Seafood\nAttraction: Rio Grande Farm Park, Alamosa (Colorado); Cole Park, Alamosa (Colorado)\nLunch: Cafe LazyMojo, Alamosa (Colorado), cost: 26, cuisines: Tea, Pizza, American, Fast Food\nDinner: Atlanta Highway Seafood Market, Alamosa (Colorado), cost: 68, cuisines: Fast Food, Desserts, Seafood\nAccommodation: Comfortable studio suite in midtown Manhattan, Alamosa (Colorado), cost: 67.0, maximum occupancy: 2, house rules: No parties & No smoking & No visitors, minimum nights: 30.0\n\nNumber of people: 1\nTotal cost: 65 + 26 + 68 + 67 = 226\nAccommodation minimum nights: 2/30\n\nDays: 5\nCurrent City: from Alamosa (Colorado) to Cedar Rapids\nTransportation: Self-driving, from Alamosa to Cedar Rapids, duration: 14 hours 27 mins, distance: 1,541 km, cost: 77\nBreakfast: -\nAttraction: -\nLunch: -\nDinner: -\nAccommodation: -\n\nNumber of people: 1\nTotal cost: 77\n\nTotal cost across all days: 710 + 646 + 330 + 226 + 77 = 1989\nCuisines: The prompt specifies no particular cuisine, so all cuisine constraints are satisfied.", "gpt-4-1106-preview_direct_sole-planning_parsed_results": [{"day": 1, "current_city": "from Cedar Rapids to Denver (Colorado)", "transportation": "Flight Number: F3840884, from Cedar Rapids to Denver (Colorado), Departure Time: 13:11, Arrival Time: 14:09", "breakfast": "-", "attraction": "Denver Art Museum, Denver (Colorado);", "lunch": "The Urban Socialite, Denver (Colorado)", "dinner": "Tasty Fare, Denver (Colorado)", "accommodation": "*NO GUEST SERVICE FEE* Luxury Studio Suite w/ Free Continental Breakfast, Denver (Colorado)"}, {"day": 2, "current_city": "Denver (Colorado)", "transportation": "-", "breakfast": "The Fatty Bao - Asian Gastro Bar, Denver (Colorado)", "attraction": "Denver Zoo, Denver (Colorado);Denver Botanic Gardens, Denver (Colorado);", "lunch": "Woods Spice, Denver (Colorado)", "dinner": "Rain Tree Grill, Denver (Colorado)", "accommodation": "*NO GUEST SERVICE FEE* Luxury Studio Suite w/ Free Continental Breakfast, Denver (Colorado)"}, {"day": 3, "current_city": "from Denver (Colorado) to Alamosa (Colorado)", "transportation": "Flight Number: F3857649, from Denver to Alamosa (Colorado), Departure Time: 15:44, Arrival Time: 16:33", "breakfast": "Cafe Diva, Denver (Colorado)", "attraction": "San Luis Valley Museum | Alamosa, Alamosa (Colorado);", "lunch": "Riverwalk Cafe, Alamosa (Colorado)", "dinner": "The Arena, Alamosa (Colorado)", "accommodation": "Comfortable studio suite in midtown Manhattan, Alamosa (Colorado)"}, {"day": 4, "current_city": "Alamosa (Colorado)", "transportation": "-", "breakfast": "Emperor's Lounge - The Taj Mahal Hotel, Alamosa (Colorado)", "attraction": "Rio Grande Farm Park, Alamosa (Colorado);Cole Park, Alamosa (Colorado);", "lunch": "Cafe LazyMojo, Alamosa (Colorado)", "dinner": "Atlanta Highway Seafood Market, Alamosa (Colorado)", "accommodation": "Comfortable studio suite in midtown Manhattan, Alamosa (Colorado)"}, {"day": 5, "current_city": "from Alamosa (Colorado) to Cedar Rapids", "transportation": "Self-driving, from Alamosa to Cedar Rapids, duration: 14 hours 27 mins, distance: 1,541 km", "breakfast": "-", "attraction": "-", "lunch": "-", "dinner": "-", "accommodation": "-"}]}]