[{"gpt-4-1106-preview_direct_sole-planning_results": "Travel Plan:\n\nDays: 1\nCurrent City: from Santa Ana to Durango (Colorado)\nTransportation: Taxi, from Santa Ana to Durango, duration: 11 hours 55 mins, distance: 1,245 km, cost: $1245\nBreakfast: -\nAttraction: Animas Museum, Durango (Colorado)\nLunch: Samurai Japanese Cuisine & Sushi Bar, Durango (Colorado), cost: $67, cuisines: Bakery, Desserts, Fast Food\nDinner: Dub's High on the Hog, Durango (Colorado), cost: $98, cuisines: Tea, Italian, French, Cafe, Seafood\nAccommodation: Lux 1BR in the heart of NYC Theater district!, Durango (Colorado), cost: $81.0, maximum occupancy: 3, house rules: No children under 10, minimum nights: 30.0\n\nNumber of people: 2\nTotal cost: $1245 (taxi) + 2 x $67 (lunch) + 2 x $98 (dinner) + $81 (accommodation) = $1656\nAccommodation minimum nights: 1/30\n\nDays: 2\nCurrent City: Durango (Colorado)\nTransportation: -\nBreakfast: Samurai Japanese Cuisine & Sushi Bar, Durango (Colorado), cost: $67, cuisines: Bakery, Desserts, Fast Food\nAttraction: Durango & Silverton Narrow Gauge Railroad, Durango (Colorado)\nLunch: Standard Chicken Point, Durango (Colorado), cost: $50, cuisines: Mexican, Indian, BBQ, Seafood\nDinner: Cake Plaza, Durango (Colorado), cost: $95, cuisines: Cafe, Desserts, Italian\nAccommodation: Lux 1BR in the heart of NYC Theater district!, Durango (Colorado), cost: $81.0, maximum occupancy: 3, house rules: No children under 10, minimum nights: 30.0\n\nNumber of people: 2\nTotal cost: 2 x $67 (breakfast) + 2 x $50 (lunch) + 2 x $95 (dinner) + $81 (accommodation) = $505\nAccommodation minimum nights: 2/30\n\nDays: 3\nCurrent City: from Durango to Alamosa (Colorado)\nTransportation: Taxi, from Durango to Alamosa, duration: 2 hours 52 mins, distance: 240 km, cost: $240\nBreakfast: Hot & Tasty Chinese Food, Durango (Colorado), cost: $17, cuisines: Tea, French, Fast Food\nAttraction: San Luis Valley Museum | Alamosa, Alamosa (Colorado)\nLunch: Riverwalk Cafe, Alamosa (Colorado), cost: $97, cuisines: Tea, Pizza, Fast Food\nDinner: Emperor's Lounge - The Taj Mahal Hotel, Alamosa (Colorado), cost: $65, cuisines: Tea, Italian, BBQ, Cafe, Seafood\nAccommodation: Comfortable studio suite in midtown Manhattan, Alamosa (Colorado), cost: $67.0, maximum occupancy: 2, house rules: No parties & No smoking & No visitors, minimum nights: 30.0\n\nNumber of people: 2\nTotal cost: $240 (taxi) + 2 x $17 (breakfast) + 2 x $97 (lunch) + 2 x $65 (dinner) + $67 (accommodation) = $665\nAccommodation minimum nights: 1/30\n\nDays: 4\nCurrent City: Alamosa (Colorado)\nTransportation: -\nBreakfast: Coffee to Cocktail Bar - Hyatt Place, Alamosa (Colorado), cost: $35, cuisines: Tea, Indian, Desserts, Italian\nAttraction: Rio Grande Farm Park, Alamosa (Colorado)\nLunch: The Diet Kitchen, Alamosa (Colorado), cost: $50, cuisines: Pizza, Bakery, BBQ, American, Mediterranean\nDinner: The Midnight Heroes, Alamosa (Colorado), cost: $10, cuisines: Tea, BBQ, Cafe, Indian, Seafood\nAccommodation: Comfortable studio suite in midtown Manhattan, Alamosa (Colorado), cost: $67.0, maximum occupancy: 2, house rules: No parties & No smoking & No visitors, minimum nights: 30.0\n\nNumber of people: 2\nTotal cost: 2 x $35 (breakfast) + 2 x $50 (lunch) + 2 x $10 (dinner) + $67 (accommodation) = $257\nAccommodation minimum nights: 2/30\n\nDays: 5\nCurrent City: from Alamosa to Colorado Springs (Colorado)\nTransportation: Taxi, from Alamosa to Colorado Springs, duration: 2 hours 36 mins, distance: 263 km, cost: $263\nBreakfast: Emperor's Lounge - The Taj Mahal Hotel, Alamosa (Colorado), cost: $65, cuisines: Tea, Italian, BBQ, Cafe, Seafood\nAttraction: The Broadmoor Seven Falls, Colorado Springs (Colorado)\nLunch: Raglan Road Irish Pub and Restaurant, Colorado Springs (Colorado), cost: $97, cuisines: Chinese, Bakery, Pizza, Mediterranean\nDinner: Derby, Colorado Springs (Colorado), cost: $67, cuisines: Desserts, Fast Food\nAccommodation: Large sunny park slope apartment, Colorado Springs (Colorado), cost: $82.0, maximum occupancy: 3, house rules: No smoking & No parties & No pets, minimum nights: 1.0\n\nNumber of people: 2\nTotal cost: $263 (taxi) + 2 x $65 (breakfast) + 2 x $97 (lunch) + 2 x $67 (dinner) + $82 (accommodation) = $803\nAccommodation minimum nights: 1/1\n\nDays: 6\nCurrent City: Colorado Springs (Colorado)\nTransportation: -\nBreakfast: GoGourmet, Colorado Springs (Colorado), cost: $66, cuisines: Desserts, Bakery, Fast Food, Indian, Seafood\nAttraction: Garden of the Gods, Colorado Springs (Colorado)\nLunch: South Cafe, Colorado Springs (Colorado), cost: $36, cuisines: Desserts, French, BBQ, Fast Food, Mediterranean\nDinner: LIT Ultrabar, Colorado Springs (Colorado), cost: $94, cuisines: Cafe, Italian, Fast Food, Chinese, Seafood\nAccommodation: Large sunny park slope apartment, Colorado Springs (Colorado), cost: $82.0, maximum occupancy: 3, house rules: No smoking & No parties & No pets, minimum nights: 1.0\n\nNumber of people: 2\nTotal cost: 2 x $66 (breakfast) + 2 x $36 (lunch) + 2 x $94 (dinner) + $82 (accommodation) = $474\nAccommodation minimum nights: 2/1\n\nDays: 7\nCurrent City: from Colorado Springs to Santa Ana\nTransportation: Taxi, from Colorado Springs to Santa Ana, duration: 15 hours 52 mins, distance: 1,744 km, cost: $1744\nBreakfast: Club Tokyo - Best Western Skycity Hotel, Colorado Springs (Colorado), cost: $64, cuisines: Tea, Bakery, Mediterranean, Fast Food\nAttraction: -\nLunch: -\nDinner: -\nAccommodation: -\n\nNumber of people: 2\nTotal cost: 2 x $64 (breakfast) + $1744 (taxi) = $1872\n\nTotal cost across all days: $1656 + $505 + $665 + $257 + $803 + $474 + $1872 = $6232\nCuisines: The prompt specifies Italian, French, Chinese, and American, so all cuisine constraints are satisfied.", "gpt-4-1106-preview_direct_sole-planning_parsed_results": [{"day": 1, "current_city": "from Santa Ana to Durango (Colorado)", "transportation": "Taxi, from Santa Ana to Durango, duration: 11 hours 55 mins, distance: 1,245 km", "breakfast": "-", "attraction": "Animas Museum, Durango (Colorado);", "lunch": "Samurai Japanese Cuisine & Sushi Bar, Durango (Colorado)", "dinner": "Dub's High on the Hog, Durango (Colorado)", "accommodation": "Lux 1BR in the heart of NYC Theater district!, Durango (Colorado)"}, {"day": 2, "current_city": "Durango (Colorado)", "transportation": "-", "breakfast": "Samurai Japanese Cuisine & Sushi Bar, Durango (Colorado)", "attraction": "Durango & Silverton Narrow Gauge Railroad, Durango (Colorado);", "lunch": "Standard Chicken Point, Durango (Colorado)", "dinner": "Cake Plaza, Durango (Colorado)", "accommodation": "Lux 1BR in the heart of NYC Theater district!, Durango (Colorado)"}, {"day": 3, "current_city": "from Durango to Alamosa (Colorado)", "transportation": "Taxi, from Durango to Alamosa, duration: 2 hours 52 mins, distance: 240 km", "breakfast": "Hot & Tasty Chinese Food, Durango (Colorado)", "attraction": "San Luis Valley Museum | Alamosa, Alamosa (Colorado);", "lunch": "Riverwalk Cafe, Alamosa (Colorado)", "dinner": "Emperor's Lounge - The Taj Mahal Hotel, Alamosa (Colorado)", "accommodation": "Comfortable studio suite in midtown Manhattan, Alamosa (Colorado)"}, {"day": 4, "current_city": "Alamosa (Colorado)", "transportation": "-", "breakfast": "Coffee to Cocktail Bar - Hyatt Place, Alamosa (Colorado)", "attraction": "Rio Grande Farm Park, Alamosa (Colorado);", "lunch": "The Diet Kitchen, Alamosa (Colorado)", "dinner": "The Midnight Heroes, Alamosa (Colorado)", "accommodation": "Comfortable studio suite in midtown Manhattan, Alamosa (Colorado)"}, {"day": 5, "current_city": "from Alamosa to Colorado Springs (Colorado)", "transportation": "Taxi, from Alamosa to Colorado Springs, duration: 2 hours 36 mins, distance: 263 km", "breakfast": "Emperor's Lounge - The Taj Mahal Hotel, Alamosa (Colorado)", "attraction": "The Broadmoor Seven Falls, Colorado Springs (Colorado);", "lunch": "Raglan Road Irish Pub and Restaurant, Colorado Springs (Colorado)", "dinner": "Derby, Colorado Springs (Colorado)", "accommodation": "Large sunny park slope apartment, Colorado Springs (Colorado)"}, {"day": 6, "current_city": "Colorado Springs (Colorado)", "transportation": "-", "breakfast": "GoGourmet, Colorado Springs (Colorado)", "attraction": "Garden of the Gods, Colorado Springs (Colorado);", "lunch": "South Cafe, Colorado Springs (Colorado)", "dinner": "LIT Ultrabar, Colorado Springs (Colorado)", "accommodation": "Large sunny park slope apartment, Colorado Springs (Colorado)"}, {"day": 7, "current_city": "from Colorado Springs to Santa Ana", "transportation": "Taxi, from Colorado Springs to Santa Ana, duration: 15 hours 52 mins, distance: 1,744 km", "breakfast": "Club Tokyo - Best Western Skycity Hotel, Colorado Springs (Colorado)", "attraction": "-", "lunch": "-", "dinner": "-", "accommodation": "-"}]}]