[{"gpt-4-1106-preview_direct_sole-planning_results": "Travel Plan:\n\nDays: 1\nCurrent City: from St. Louis to Washington\nTransportation: Flight Number: F3934368, from St. Louis to Washington, Departure Time: 12:42, Arrival Time: 15:38, cost: $162\nBreakfast: -\nAttraction: The Seattle Great Wheel, Washington, cost: $0 (assuming no entry fee is listed)\nLunch: Los Aztecas, Washington, cost: $46, cuisines: Cafe, Bakery, BBQ, Fast Food\nDinner: Thaaliwala, Washington, cost: $88, cuisines: Tea, Pizza, Italian, BBQ, Cafe\nAccommodation: Stunning 2Bed/2BA + 300sqft deck by the river!, Washington, cost: $209.0, maximum occupancy: 3, house rules: No visitors, minimum nights: 1.0\n\nNumber of people: 1\nTotal cost: $162 (flight) + $46 (lunch) + $88 (dinner) + $209 (accommodation) = $505\n\nDays: 2\nCurrent City: Washington\nTransportation: -\nBreakfast: Manna Java World Cafe, Washington, cost: $59, cuisines: Cafe, Seafood\nAttraction: Space Needle, Washington, cost: $0 (assuming no entry fee is listed)\nLunch: Hemingway's Island Grill, Washington, cost: $57, cuisines: Mexican, BBQ, Fast Food, Cafe, Seafood\nDinner: Republic of Chicken, Washington, cost: $91, cuisines: Tea, Bakery, American, Desserts\nAccommodation: Stunning 2Bed/2BA + 300sqft deck by the river!, Washington, cost: $209.0, maximum occupancy: 3, house rules: No visitors, minimum nights: 1.0\n\nNumber of people: 1\nTotal cost: $59 (breakfast) + $57 (lunch) + $91 (dinner) + $209 (accommodation) = $416\n\nDays: 3\nCurrent City: from Washington to St. Louis\nTransportation: Flight Number: F3942135, from Washington to St. Louis, Departure Time: 19:08, Arrival Time: 20:31, cost: $188\nBreakfast: Cafe Coffee Day, Washington, cost: $53, cuisines: Tea, Mexican, Fast Food, Cafe, American, Seafood\nAttraction: Discovery Park, Washington, cost: $0 (assuming no entry fee is listed)\nLunch: Bikaner Sweet House, Washington, cost: $61, cuisines: BBQ, Desserts\nDinner: -\nAccommodation: -\n\nNumber of people: 1\nTotal cost: $53 (breakfast) + $61 (lunch) + $188 (flight) = $302\n\nTotal cost across all days: $505 + $416 + $302 = $1223\n\nCuisines: The prompt does not specify any cuisine constraints, so all restaurant choices are valid.\nTransportation: All transportation modes are flights, as per the query's allowance and within the budget.\nAccommodations: All accommodations are private and adhere to the house rules specified.\nAttractions: Attractions are in Washington and are not repeated on different days.\n\nRemaining Budget: $1500 - $1223 = $277\n\nNote: The costs for attractions are assumed to be $0 as no entry fees are listed in the provided information. If there are entry fees, they would need to be factored into the total cost. Additionally, the cost for transportation to and from attractions and restaurants is not included, as such details are not provided.", "gpt-4-1106-preview_direct_sole-planning_parsed_results": [{"day": 1, "current_city": "from St. Louis to Washington", "transportation": "Flight Number: F3934368, from St. Louis to Washington, Departure Time: 12:42, Arrival Time: 15:38", "breakfast": "-", "attraction": "The Seattle Great Wheel, Washington;", "lunch": "Los Aztecas, Washington", "dinner": "Thaaliwala, Washington", "accommodation": "Stunning 2Bed/2BA + 300sqft deck by the river!, Washington"}, {"day": 2, "current_city": "Washington", "transportation": "-", "breakfast": "Manna Java World Cafe, Washington", "attraction": "Space Needle, Washington;", "lunch": "Hemingway's Island Grill, Washington", "dinner": "Republic of Chicken, Washington", "accommodation": "Stunning 2Bed/2BA + 300sqft deck by the river!, Washington"}, {"day": 3, "current_city": "from Washington to St. Louis", "transportation": "Flight Number: F3942135, from Washington to St. Louis, Departure Time: 19:08, Arrival Time: 20:31", "breakfast": "Cafe Coffee Day, Washington", "attraction": "Discovery Park, Washington;", "lunch": "Bikaner Sweet House, Washington", "dinner": "-", "accommodation": "-"}]}]