[{"gpt-4-1106-preview_direct_sole-planning_results": "Travel Plan:\n\nDays: 1\nCurrent City: from Washington to Bemidji (Minnesota)\nTransportation: Taxi, from Washington to Bemidji, duration: 20 hours 8 mins, distance: 2,120 km, cost: 2120\nBreakfast: -\nAttraction: Paul Bunyan & Babe the Blue Ox Statues, Bemidji (Minnesota)\nLunch: -\nDinner: Pig and Whistle, Bemidji (Minnesota), cost: 39, cuisines: Fast Food, Mexican, Bakery, Seafood\nAccommodation: Sunny bedroom off Prospect Park, Bemidji (Minnesota), cost: 627.0, room type: Private room, house rules: No visitors, minimum nights: 3.0, maximum occupancy: 1\n\nNumber of people: 1\nTotal cost: 2120 + 39 + 627 = 2786\nAccommodation minimum nights: 1/3\n\nDays: 2\nCurrent City: Bemidji (Minnesota)\nTransportation: -\nBreakfast: Flying Cakes, Bemidji (Minnesota), cost: 43, cuisines: Tea, Seafood\nAttraction: Headwaters Science Center, Bemidji (Minnesota); Diamond Point Park, Bemidji (Minnesota)\nLunch: Outback Bar and Grill - Leisure Inn, Bemidji (Minnesota), cost: 59, cuisines: Indian, Desserts, Fast Food\nDinner: Gastronomica Kitchen & Bar, Bemidji (Minnesota), cost: 84, cuisines: Chinese, BBQ, Cafe, Desserts\nAccommodation: Sunny bedroom off Prospect Park, Bemidji (Minnesota), cost: 627.0, room type: Private room, house rules: No visitors, minimum nights: 3.0, maximum occupancy: 1\n\nNumber of people: 1\nTotal cost: 43 + 59 + 84 + 627 = 813\nAccommodation minimum nights: 2/3\n\nDays: 3\nCurrent City: from Bemidji (Minnesota) to Minneapolis (Minnesota)\nTransportation: Flight Number: F3847877, from Bemidji to Minneapolis, Departure Time: 08:06, Arrival Time: 10:37, cost: 63\nBreakfast: -\nAttraction: Minneapolis Sculpture Garden, Minneapolis (Minnesota); Minneapolis Institute of Art, Minneapolis (Minnesota)\nLunch: Court Avenue Brewing Company, Minneapolis (Minnesota), cost: 31, cuisines: Pizza, French, Bakery, BBQ, Seafood\nDinner: Monkeypod Kitchen by Merriman, Minneapolis (Minnesota), cost: 50, cuisines: Desserts, Pizza, Bakery, Fast Food, Indian, Mediterranean\nAccommodation: Light-filled Apartment in great area, close 2 all!, Minneapolis (Minnesota), cost: 343.0, room type: Entire home/apt, house rules: No visitors, minimum nights: 1.0, maximum occupancy: 2\n\nNumber of people: 1\nTotal cost: 63 + 31 + 50 + 343 = 487\nAccommodation minimum nights: 1/1\n\nDays: 4\nCurrent City: Minneapolis (Minnesota)\nTransportation: -\nBreakfast: The Cafe, Minneapolis (Minnesota), cost: 14, cuisines: Indian, Mediterranean, Desserts, Seafood\nAttraction: Mill City Museum, Minneapolis (Minnesota); Weisman Art Museum, Minneapolis (Minnesota)\nLunch: Balbeer's Kitchen & Bar, Minneapolis (Minnesota), cost: 81, cuisines: Tea, Chinese, Bakery\nDinner: Oregano India, Minneapolis (Minnesota), cost: 91, cuisines: BBQ, French, Bakery, Desserts\nAccommodation: Light-filled Apartment in great area, close 2 all!, Minneapolis (Minnesota), cost: 343.0, room type: Entire home/apt, house rules: No visitors, minimum nights: 1.0, maximum occupancy: 2\n\nNumber of people: 1\nTotal cost: 14 + 81 + 91 + 343 = 529\nAccommodation minimum nights: 1/1\n\nDays: 5\nCurrent City: from Minneapolis (Minnesota) to Duluth (Minnesota)\nTransportation: Flight Number: F3640437, from Minneapolis to Duluth, Departure Time: 08:54, Arrival Time: 10:05, cost: 52\nBreakfast: -\nAttraction: Glensheen Mansion, Duluth (Minnesota); Lake Superior Railroad Museum, Duluth (Minnesota)\nLunch: Skye - Hotel Unique, Duluth (Minnesota), cost: 31, cuisines: French, Mexican, Bakery, BBQ\nDinner: Lulu's Chocolate Bar, Duluth (Minnesota), cost: 97, cuisines: Pizza, Desserts\nAccommodation: Beautiful 1 bedroom in city center, Duluth (Minnesota), cost: 1154.0, room type: Entire home/apt, house rules: No parties & No smoking & No children under 10, minimum nights: 2.0, maximum occupancy: 3\n\nNumber of people: 1\nTotal cost: 52 + 31 + 97 + 1154 = 1334\nAccommodation minimum nights: 1/2\n\nDays: 6\nCurrent City: Duluth (Minnesota)\nTransportation: -\nBreakfast: Sodam Korean Restaurant, Duluth (Minnesota), cost: 25, cuisines: Desserts, Tea, French, Fast Food, Cafe\nAttraction: Enger Park, Duluth (Minnesota); The St. Louis County Depot, Duluth (Minnesota)\nLunch: Tokyo Japanese Steak House, Duluth (Minnesota), cost: 80, cuisines: Chinese, American, Desserts, Seafood\nDinner: Blue - Rooftop Cafe Restaurant Bistro, Duluth (Minnesota), cost: 36, cuisines: Cafe, French, Seafood, Fast Food\nAccommodation: Beautiful 1 bedroom in city center, Duluth (Minnesota), cost: 1154.0, room type: Entire home/apt, house rules: No parties & No smoking & No children under 10, minimum nights: 2.0, maximum occupancy: 3\n\nNumber of people: 1\nTotal cost: 25 + 80 + 36 + 1154 = 1295\nAccommodation minimum nights: 2/2\n\nDays: 7\nCurrent City: from Duluth (Minnesota) to Washington\nTransportation: Self-driving, from Duluth to Washington, duration: 17 hours 50 mins, distance: 1,881 km, cost: 94\nBreakfast: -\nAttraction: -\nLunch: -\nDinner: -\nAccommodation: -\n\nNumber of people: 1\nTotal cost: 94\n\nTotal cost across all days: 2786 + 813 + 487 + 529 + 1334 + 1295 + 94 = 7338\n\nUnfortunately, the total cost exceeds the budget of $7,200. To adjust the plan within the budget, we can consider changing the transportation method from taxi to self-driving on Day 1, which would reduce the cost significantly:\n\nDay 1 Transportation Adjustment:\nTransportation: Self-driving, from Washington to Bemidji, duration: 20 hours 8 mins, distance: 2,120 km, cost: 106\n\nAdjusted Total cost for Day 1: 106 + 39 + 627 = 772\n\nAdjusted Total cost across all days: 772 + 813 + 487 + 529 + 1334 + 1295 + 94 = 5324\n\nWith this adjustment, the total cost is now within the budget of $7,200.", "gpt-4-1106-preview_direct_sole-planning_parsed_results": [{"day": 1, "current_city": "from Washington to Bemidji", "transportation": "Self-driving, from Washington to Bemidji, duration: 20 hours 8 mins, distance: 2,120 km", "breakfast": "-", "attraction": "Paul Bunyan & Babe the Blue Ox Statues, Bemidji;", "lunch": "-", "dinner": "Pig and Whistle, Bemidji", "accommodation": "Sunny bedroom off Prospect Park, Bemidji"}, {"day": 2, "current_city": "Bemidji", "transportation": "-", "breakfast": "Flying Cakes, Bemidji", "attraction": "Headwaters Science Center, Bemidji;Diamond Point Park, Bemidji;", "lunch": "Outback Bar and Grill - Leisure Inn, Bemidji", "dinner": "Gastronomica Kitchen & Bar, Bemidji", "accommodation": "Sunny bedroom off Prospect Park, Bemidji"}, {"day": 3, "current_city": "from Bemidji to Minneapolis", "transportation": "Flight Number: F3847877, from Bemidji to Minneapolis, Departure Time: 08:06, Arrival Time: 10:37", "breakfast": "-", "attraction": "Minneapolis Sculpture Garden, Minneapolis;Minneapolis Institute of Art, Minneapolis;", "lunch": "Court Avenue Brewing Company, Minneapolis", "dinner": "Monkeypod Kitchen by Merriman, Minneapolis", "accommodation": "Light-filled Apartment in great area, close 2 all!, Minneapolis"}, {"day": 4, "current_city": "Minneapolis", "transportation": "-", "breakfast": "The Cafe, Minneapolis", "attraction": "Mill City Museum, Minneapolis;Weisman Art Museum, Minneapolis;", "lunch": "Balbeer's Kitchen & Bar, Minneapolis", "dinner": "Oregano India, Minneapolis", "accommodation": "Light-filled Apartment in great area, close 2 all!, Minneapolis"}, {"day": 5, "current_city": "from Minneapolis to Duluth", "transportation": "Flight Number: F3640437, from Minneapolis to Duluth, Departure Time: 08:54, Arrival Time: 10:05", "breakfast": "-", "attraction": "Glensheen Mansion, Duluth;Lake Superior Railroad Museum, Duluth;", "lunch": "Skye - Hotel Unique, Duluth", "dinner": "Lulu's Chocolate Bar, Duluth", "accommodation": "Beautiful 1 bedroom in city center, Duluth"}, {"day": 6, "current_city": "Duluth", "transportation": "-", "breakfast": "Sodam Korean Restaurant, Duluth", "attraction": "Enger Park, Duluth;The St. Louis County Depot, Duluth;", "lunch": "Tokyo Japanese Steak House, Duluth", "dinner": "Blue - Rooftop Cafe Restaurant Bistro, Duluth", "accommodation": "Beautiful 1 bedroom in city center, Duluth"}, {"day": 7, "current_city": "from Duluth to Washington", "transportation": "Self-driving, from Duluth to Washington, duration: 17 hours 50 mins, distance: 1,881 km", "breakfast": "-", "attraction": "-", "lunch": "-", "dinner": "-", "accommodation": "-"}]}]