[{"gpt-4-1106-preview_direct_sole-planning_results": "Travel Plan:\n\nDays: 1\nCurrent City: from Daytona Beach to Atlanta\nTransportation: Self-driving, from Daytona Beach to Atlanta, duration: 6 hours 18 mins, distance: 696 km, cost: 34\nBreakfast: -\nAttraction: World of Coca-Cola, Atlanta, GA, cost: 18 per person\nLunch: Saffron, Atlanta, GA, cost: 39, cuisines: Tea, Cafe, Fast Food, Seafood\nDinner: Daawat-e-Kashmir, Atlanta, GA, cost: 19, cuisines: Cafe, Pizza, American, Seafood\nAccommodation: Bright, Modern, Clean, Spacious, Brooklyn Home, Atlanta, GA, cost: 1034.0, maximum occupancy: 4, house rules: No children under 10, minimum nights: 3.0\n\nNumber of people: 3\nTotal cost: 3 x 34 + 3 x 18 + 3 x 39 + 3 x 19 + 1034 = 1271\n\nDays: 2\nCurrent City: Atlanta\nTransportation: -\nBreakfast: Adda, Atlanta, GA, cost: 22, cuisines: Tea, Mexican, Bakery\nAttraction: Georgia Aquarium, Atlanta, GA, cost: 36.95 per person\nLunch: Asian Bistro, Atlanta, GA, cost: 27, cuisines: Tea, Bakery, Seafood\nDinner: Chef Style, Atlanta, GA, cost: 59, cuisines: Pizza, American, Desserts, Seafood\nAccommodation: Bright, Modern, Clean, Spacious, Brooklyn Home, Atlanta, GA, cost: 1034.0, maximum occupancy: 4, house rules: No children under 10, minimum nights: 3.0\n\nNumber of people: 3\nTotal cost: 3 x 22 + 3 x 36.95 + 3 x 27 + 3 x 59 + 1034 = 1425.85\n\nDays: 3\nCurrent City: from Atlanta to Daytona Beach\nTransportation: Self-driving, from Atlanta to Daytona Beach, duration: 6 hours 20 mins, distance: 706 km, cost: 35\nBreakfast: Ahata, Atlanta, GA, cost: 17, cuisines: Tea, Indian, Desserts\nAttraction: -\nLunch: -\nDinner: -\nAccommodation: -\n\nNumber of people: 3\nTotal cost: 3 x 17 + 3 x 35 = 156\n\nTotal cost across all days: 1271 + 1425.85 + 156 = 2852.85\n\nUnfortunately, the total cost exceeds the specified budget of $2,100. To adjust the plan within the budget, we need to make some changes:\n\n- Remove the attractions on Day 1 and Day 2 to save costs.\n- Choose a less expensive accommodation option that allows children under 10 and offers entire rooms.\n\nRevised Travel Plan:\n\nDays: 1\nCurrent City: from Daytona Beach to Atlanta\nTransportation: Self-driving, from Daytona Beach to Atlanta, duration: 6 hours 18 mins, distance: 696 km, cost: 34\nBreakfast: -\nLunch: Saffron, Atlanta, GA, cost: 39, cuisines: Tea, Cafe, Fast Food, Seafood\nDinner: Daawat-e-Kashmir, Atlanta, GA, cost: 19, cuisines: Cafe, Pizza, American, Seafood\nAccommodation: Charming Carroll Gardens 2 BR, Atlanta, GA, cost: 576.0, maximum occupancy: 4, house rules: No parties, minimum nights: 1.0\n\nNumber of people: 3\nTotal cost: 3 x 34 + 3 x 39 + 3 x 19 + 576 = 891\n\nDays: 2\nCurrent City: Atlanta\nTransportation: -\nBreakfast: Adda, Atlanta, GA, cost: 22, cuisines: Tea, Mexican, Bakery\nLunch: Asian Bistro, Atlanta, GA, cost: 27, cuisines: Tea, Bakery, Seafood\nDinner: Chef Style, Atlanta, GA, cost: 59, cuisines: Pizza, American, Desserts, Seafood\nAccommodation: Charming Carroll Gardens 2 BR, Atlanta, GA, cost: 576.0, maximum occupancy: 4, house rules: No parties, minimum nights: 1.0\n\nNumber of people: 3\nTotal cost: 3 x 22 + 3 x 27 + 3 x 59 + 576 = 891\n\nDays: 3\nCurrent City: from Atlanta to Daytona Beach\nTransportation: Self-driving, from Atlanta to Daytona Beach, duration: 6 hours 20 mins, distance: 706 km, cost: 35\nBreakfast: Ahata, Atlanta, GA, cost: 17, cuisines: Tea, Indian, Desserts\nLunch: -\nDinner: -\nAccommodation: -\n\nNumber of people: 3\nTotal cost: 3 x 17 + 3 x 35 = 156\n\nTotal revised cost across all days: 891 + 891 + 156 = 1938\n\nThe revised plan is within the budget of $2,100 and meets all specified requirements, including accommodations that allow children under 10 and entire rooms for the group.", "gpt-4-1106-preview_direct_sole-planning_parsed_results": [{"day": 1, "current_city": "from Daytona Beach to Atlanta", "transportation": "Self-driving, from Daytona Beach to Atlanta, duration: 6 hours 18 mins, distance: 696 km", "breakfast": "-", "attraction": "-", "lunch": "Saffron, Atlanta", "dinner": "Daawat-e-Kashmir, Atlanta", "accommodation": "Charming Carroll Gardens 2 BR, Atlanta"}, {"day": 2, "current_city": "Atlanta", "transportation": "-", "breakfast": "Adda, Atlanta", "attraction": "-", "lunch": "Asian Bistro, Atlanta", "dinner": "Chef Style, Atlanta", "accommodation": "Charming Carroll Gardens 2 BR, Atlanta"}, {"day": 3, "current_city": "from Atlanta to Daytona Beach", "transportation": "Self-driving, from Atlanta to Daytona Beach, duration: 6 hours 20 mins, distance: 706 km", "breakfast": "Ahata, Atlanta", "attraction": "-", "lunch": "-", "dinner": "-", "accommodation": "-"}]}]