[{"gpt-4-1106-preview_direct_sole-planning_results": "Travel Plan:\n\nDays: 1\nCurrent City: from Spokane to San Francisco\nTransportation: Flight Number: F3853330, from Spokane to San Francisco, Departure Time: 07:10, Arrival Time: 09:38, cost: 227\nBreakfast: -\nAttraction: Golden Gate Bridge, San Francisco (California)\nLunch: Tokyo Sushi, San Francisco (California), cost: 18, cuisines: Cafe, Pizza, BBQ\nDinner: The Chic, San Francisco (California), cost: 92, cuisines: Chinese, Bakery, Indian, Cafe\nAccommodation: Room in Down town Brooklyn Parkslop, San Francisco (California), cost: 79.0, maximum occupancy: 2, house rules: No visitors, minimum nights: 1.0\n\nNumber of people: 1\nTotal cost: 227 + 18 + 92 + 79 = 416\n\nDays: 2\nCurrent City: San Francisco (California)\nTransportation: -\nBreakfast: Coffee & Chai Co., San Francisco (California), cost: 10, cuisines: Tea, Mexican, BBQ, Cafe, Seafood\nAttraction: Exploratorium, San Francisco (California); California Academy of Sciences, San Francisco (California)\nLunch: Bonne Bouche, San Francisco (California), cost: 21, cuisines: Tea, Chinese, American, Cafe\nDinner: Empress, San Francisco (California), cost: 24, cuisines: Pizza, BBQ, Mediterranean, Fast Food\nAccommodation: Room in Down town Brooklyn Parkslop, San Francisco (California), cost: 79.0, maximum occupancy: 2, house rules: No visitors, minimum nights: 1.0\n\nNumber of people: 1\nTotal cost: 10 + 21 + 24 + 79 = 134\n\nDays: 3\nCurrent City: from San Francisco to Spokane\nTransportation: Flight Number: F3840215, from San Francisco to Spokane, Departure Time: 16:21, Arrival Time: 18:29, cost: 343\nBreakfast: Sudarshan, San Francisco (California), cost: 53, cuisines: Fast Food, Bakery, Mediterranean, Italian\nAttraction: -\nLunch: -\nDinner: -\nAccommodation: -\n\nNumber of people: 1\nTotal cost: 53 + 343 = 396\n\nTotal cost across all days: 416 + 134 + 396 = 946\n\nCuisines: No specific cuisine constraints were mentioned in the query, so all restaurant choices are valid.\n\nNote: The travel plan adheres to the budget of $1,200, includes transportation, meals, and accommodations, and ensures no repeated restaurants or attractions. The accommodations chosen do not have shared rooms and adhere to the house rules. The transportation modes are valid and meet the constraints specified in the query.", "gpt-4-1106-preview_direct_sole-planning_parsed_results": [{"day": 1, "current_city": "from Spokane to San Francisco", "transportation": "Flight Number: F3853330, from Spokane to San Francisco, Departure Time: 07:10, Arrival Time: 09:38", "breakfast": "-", "attraction": "Golden Gate Bridge, San Francisco;", "lunch": "Tokyo Sushi, San Francisco", "dinner": "The Chic, San Francisco", "accommodation": "Room in Down town Brooklyn Parkslop, San Francisco"}, {"day": 2, "current_city": "San Francisco", "transportation": "-", "breakfast": "Coffee & Chai Co., San Francisco", "attraction": "Exploratorium, San Francisco;California Academy of Sciences, San Francisco;", "lunch": "Bonne Bouche, San Francisco", "dinner": "Empress, San Francisco", "accommodation": "Room in Down town Brooklyn Parkslop, San Francisco"}, {"day": 3, "current_city": "from San Francisco to Spokane", "transportation": "Flight Number: F3840215, from San Francisco to Spokane, Departure Time: 16:21, Arrival Time: 18:29", "breakfast": "Sudarshan, San Francisco", "attraction": "-", "lunch": "-", "dinner": "-", "accommodation": "-"}]}]