[{"gpt-4-1106-preview_direct_sole-planning_results": "Travel Plan:\n\nDays: 1\nCurrent City: from Syracuse to Augusta (Georgia)\nTransportation: Self-driving, from Syracuse to Augusta, duration: 13 hours 17 mins, distance: 1,431 km, cost: 71\nBreakfast: -\nAttraction: -\nLunch: -\nDinner: B Merrell's, Augusta (Georgia), cost: 74, cuisines: Tea, Pizza, Desserts, Fast Food\nAccommodation: Planta Baja Studio, Augusta (Georgia), cost: 637.0, room type: Entire home/apt, house rules: No smoking, minimum nights: 1.0, maximum occupancy: 4\n\nNumber of people: 2\nTotal cost: 2 x 71 + 2 x 74 + 637 = 927\nAccommodation minimum nights: 1/1\n\nDays: 2\nCurrent City: Augusta (Georgia)\nTransportation: -\nBreakfast: Fish Tales Lakeside Grille, Augusta (Georgia), cost: 37, cuisines: Tea, Cafe, Bakery, Desserts\nAttraction: Augusta Riverwalk, Augusta (Georgia); Augusta Museum of History, Augusta (Georgia); Morris Museum of Art, Augusta (Georgia)\nLunch: The Charcoal Chimney, Augusta (Georgia), cost: 86, cuisines: Tea, Fast Food, BBQ, Italian\nDinner: KB's Kulfi & Icecream, Augusta (Georgia), cost: 92, cuisines: American, BBQ, Seafood\nAccommodation: Planta Baja Studio, Augusta (Georgia), cost: 637.0, room type: Entire home/apt, house rules: No smoking, minimum nights: 1.0, maximum occupancy: 4\n\nNumber of people: 2\nTotal cost: 2 x 37 + 2 x 86 + 2 x 92 + 637 = 1061\nAccommodation minimum nights: 2/2\n\nDays: 3\nCurrent City: from Augusta (Georgia) to Decatur (Georgia)\nTransportation: Self-driving, from Augusta to Decatur, duration: 2 hours 19 mins, distance: 229 km, cost: 11\nBreakfast: Karari Kurry, Augusta (Georgia), cost: 29, cuisines: Bakery, Indian, Cafe, Fast Food\nAttraction: DeKalb History Center Museum, Decatur (Georgia); Glenlake Park, Decatur (Georgia); Clyde Shepherd Nature Preserve, Decatur (Georgia)\nLunch: Cafe Coffee Day, Decatur (Georgia), cost: 46, cuisines: Tea, Cafe, BBQ, Mediterranean\nDinner: Joey's Pizza, Decatur (Georgia), cost: 69, cuisines: Tea, Pizza, Bakery, Chinese, Seafood\nAccommodation: Cozy Private Room, Decatur (Georgia), cost: 69.0, room type: Private room, house rules: No children under 10 & No parties & No visitors, minimum nights: 2.0, maximum occupancy: 2\n\nNumber of people: 2\nTotal cost: 2 x 11 + 2 x 29 + 2 x 46 + 2 x 69 + 69 = 380\nAccommodation minimum nights: 1/2\n\nDays: 4\nCurrent City: Decatur (Georgia)\nTransportation: -\nBreakfast: Madhuban Restaurant - Welcome Hotel Rama International, Decatur (Georgia), cost: 47, cuisines: Pizza, Bakery, Seafood\nAttraction: Decatur Square, Decatur (Georgia); Mason Mill Park, Decatur (Georgia); Woodlands Garden, Decatur (Georgia)\nLunch: Dawat-E-Chaman, Decatur (Georgia), cost: 42, cuisines: Chinese, BBQ, Fast Food, Cafe, Mediterranean\nDinner: Carnatic Cafe, Decatur (Georgia), cost: 66, cuisines: Cafe, Indian, Desserts\nAccommodation: Cozy Private Room, Decatur (Georgia), cost: 69.0, room type: Private room, house rules: No children under 10 & No parties & No visitors, minimum nights: 2.0, maximum occupancy: 2\n\nNumber of people: 2\nTotal cost: 2 x 47 + 2 x 42 + 2 x 66 + 69 = 379\nAccommodation minimum nights: 2/2\n\nDays: 5\nCurrent City: from Decatur (Georgia) to Syracuse\nTransportation: Self-driving, from Decatur to Syracuse, duration: 14 hours 26 mins, distance: 1,542 km, cost: 77\nBreakfast: Subway, Decatur (Georgia), cost: 40, cuisines: Desserts, BBQ, Bakery, Fast Food, American\nAttraction: -\nLunch: -\nDinner: -\nAccommodation: -\n\nNumber of people: 2\nTotal cost: 2 x 77 + 2 x 40 = 234\n\nTotal cost across all days: 927 + 1061 + 380 + 379 + 234 = 2981\n\nCuisines: The prompt specifies American and Mediterranean, so all cuisine constraints are satisfied.\n\nNote: The total cost exceeds the specified budget of $2,000. Adjustments to the accommodation or dining options may be necessary to meet the budget constraint.", "gpt-4-1106-preview_direct_sole-planning_parsed_results": [{"day": 1, "current_city": "from Syracuse to Augusta", "transportation": "Self-driving, from Syracuse to Augusta, duration: 13 hours 17 mins, distance: 1,431 km", "breakfast": "-", "attraction": "-", "lunch": "-", "dinner": "B Merrell's, Augusta", "accommodation": "Planta Baja Studio, Augusta"}, {"day": 2, "current_city": "Augusta", "transportation": "-", "breakfast": "Fish Tales Lakeside Grille, Augusta", "attraction": "Augusta Riverwalk, Augusta;Augusta Museum of History, Augusta;Morris Museum of Art, Augusta;", "lunch": "The Charcoal Chimney, Augusta", "dinner": "KB's Kulfi & Icecream, Augusta", "accommodation": "Planta Baja Studio, Augusta"}, {"day": 3, "current_city": "from Augusta to Decatur", "transportation": "Self-driving, from Augusta to Decatur, duration: 2 hours 19 mins, distance: 229 km", "breakfast": "Karari Kurry, Augusta", "attraction": "DeKalb History Center Museum, Decatur;Glenlake Park, Decatur;Clyde Shepherd Nature Preserve, Decatur;", "lunch": "Cafe Coffee Day, Decatur", "dinner": "Joey's Pizza, Decatur", "accommodation": "Cozy Private Room, Decatur"}, {"day": 4, "current_city": "Decatur", "transportation": "-", "breakfast": "Madhuban Restaurant - Welcome Hotel Rama International, Decatur", "attraction": "Decatur Square, Decatur;Mason Mill Park, Decatur;Woodlands Garden, Decatur;", "lunch": "Dawat-E-Chaman, Decatur", "dinner": "Carnatic Cafe, Decatur", "accommodation": "Cozy Private Room, Decatur"}, {"day": 5, "current_city": "from Decatur to Syracuse", "transportation": "Self-driving, from Decatur to Syracuse, duration: 14 hours 26 mins, distance: 1,542 km", "breakfast": "Subway, Decatur", "attraction": "-", "lunch": "-", "dinner": "-", "accommodation": "-"}]}]