[{"gpt-4-1106-preview_direct_sole-planning_results": "Travel Plan:\n\nDays: 1\nCurrent City: from Pittsburgh to Rochester\nTransportation: Taxi, from Pittsburgh to Rochester, duration: 4 hours 11 mins, distance: 457 km, cost: $457\nBreakfast: -\nAttraction: The Strong National Museum of Play, Rochester\nLunch: Atlas World Grill, Rochester, cost: $54, cuisines: Tea, Bakery, Mexican, Pizza\nDinner: Sree Annapoorna, Rochester, cost: $52, cuisines: Tea, Cafe, Mexican\nAccommodation: Artsy Bushwick NY 2 Beds with laundry & balcony, Rochester, cost: $1128, room type: Entire home/apt, house rules: No pets, minimum nights: 2.0, maximum occupancy: 8\n\nNumber of people: 2\nTotal cost: 2 x $457 + 2 x $54 + 2 x $52 + $1128 = $2254\nAccommodation minimum nights: 1/2\n\nDays: 2\nCurrent City: Rochester\nTransportation: -\nBreakfast: Hotel Ravisha Continental, Rochester, cost: $43, cuisines: Cafe, Bakery, Desserts, Fast Food\nAttraction: George Eastman Museum, Rochester; Susan B. Anthony Museum & House, Rochester\nLunch: Mister Mughal, Rochester, cost: $19, cuisines: Pizza, Bakery, Fast Food, Cafe, Mediterranean\nDinner: Tandoori KnockOuts, Rochester, cost: $63, cuisines: Bakery, BBQ, Fast Food, Mediterranean, Seafood\nAccommodation: Artsy Bushwick NY 2 Beds with laundry & balcony, Rochester, cost: $1128, room type: Entire home/apt, house rules: No pets, minimum nights: 2.0, maximum occupancy: 8\n\nNumber of people: 2\nTotal cost: 2 x $43 + 2 x $19 + 2 x $63 + $1128 = $1408\nAccommodation minimum nights: 2/2\n\nDays: 3\nCurrent City: from Rochester to Niagara Falls\nTransportation: Taxi, from Rochester to Niagara Falls, duration: 1 hour 25 mins, distance: 139 km, cost: $139\nBreakfast: Sagar Ratna, Rochester, cost: $88, cuisines: Cafe, Bakery, Indian\nAttraction: Journey Behind the Falls, Niagara Falls; Niagara SkyWheel, Niagara Falls\nLunch: Tony Roma's, Niagara Falls, cost: $47, cuisines: Desserts, Tea, French, Fast Food, Cafe, Mediterranean\nDinner: Izakaya Kikufuji, Niagara Falls, cost: $66, cuisines: Desserts, Pizza, French, Fast Food, Mediterranean, Seafood\nAccommodation: Sunny Spacious South Slope Studio, Niagara Falls, cost: $337, room type: Entire home/apt, house rules: No parties & No smoking, minimum nights: 2.0, maximum occupancy: 3\n\nNumber of people: 2\nTotal cost: 2 x $139 + 2 x $88 + 2 x $47 + 2 x $66 + $337 = $1027\nAccommodation minimum nights: 1/2\n\nDays: 4\nCurrent City: Niagara Falls\nTransportation: -\nBreakfast: Raju Dhaba, Niagara Falls, cost: $67, cuisines: American, Desserts, Seafood\nAttraction: Cave of the Winds, Niagara Falls; White Water Walk, Niagara Falls\nLunch: Scratch, Niagara Falls, cost: $19, cuisines: Tea, American, Seafood\nDinner: Capital Grill, Niagara Falls, cost: $74, cuisines: French, Pizza, BBQ\nAccommodation: Sunny Spacious South Slope Studio, Niagara Falls, cost: $337, room type: Entire home/apt, house rules: No parties & No smoking, minimum nights: 2.0, maximum occupancy: 3\n\nNumber of people: 2\nTotal cost: 2 x $67 + 2 x $19 + 2 x $74 + $337 = $657\nAccommodation minimum nights: 2/2\n\nDays: 5\nCurrent City: from Niagara Falls to New York\nTransportation: Taxi, from Niagara Falls to New York, duration: 6 hours 29 mins, distance: 657 km, cost: $657\nBreakfast: Sri Meenakshi South Indian Food, Niagara Falls, cost: $77, cuisines: Tea, Seafood, Bakery, Italian\nAttraction: -\nLunch: -\nDinner: Seasons 52 Fresh Grill, New York, cost: $30, cuisines: Seafood, Indian, Desserts, Italian\nAccommodation: Beautiful and big 1BR sublet close by Central Park, New York, cost: $983, room type: Private room, house rules: No parties & No children under 10, minimum nights: 5.0, maximum occupancy: 2\n\nNumber of people: 2\nTotal cost: 2 x $657 + 2 x $77 + 2 x $30 + $983 = $2511\nAccommodation minimum nights: 1/5\n\nDays: 6\nCurrent City: New York\nTransportation: -\nBreakfast: Gurgaon Hights, New York, cost: $46, cuisines: Cafe, American, Indian, Fast Food\nAttraction: Top of The Rock, New York; Central Park, New York\nLunch: Lord of the Drinks Forum, New York, cost: $71, cuisines: Cafe, Bakery, BBQ, Chinese, Indian\nDinner: Goosebumps, New York, cost: $94, cuisines: Chinese, Pizza, Bakery\nAccommodation: Beautiful and big 1BR sublet close by Central Park, New York, cost: $983, room type: Private room, house rules: No parties & No children under 10, minimum nights: 5.0, maximum occupancy: 2\n\nNumber of people: 2\nTotal cost: 2 x $46 + 2 x $71 + 2 x $94 + $983 = $1405\nAccommodation minimum nights: 2/5\n\nDays: 7\nCurrent City: from New York to Pittsburgh\nTransportation: Taxi, from New York to Pittsburgh, duration: 5 hours 57 mins, distance: 594 km, cost: $594\nBreakfast: Rambhog, New York, cost: $95, cuisines: Tea, Seafood, Mexican, Fast Food\nAttraction: -\nLunch: -\nDinner: -\nAccommodation: -\n\nNumber of people: 2\nTotal cost: 2 x $594 + 2 x $95 = $1378\n\nTotal cost across all days: $2254 + $1408 + $1027 + $657 + $2511 + $1405 + $1378 = $10640\n\nUnfortunately, the total cost of $10,640 exceeds the specified budget of $5,300. Adjustments will need to be made to the travel plan to fit within the budget. This could include choosing more affordable accommodations, dining options, or transportation methods.", "gpt-4-1106-preview_direct_sole-planning_parsed_results": [{"day": 1, "current_city": "from Pittsburgh to Rochester", "transportation": "Taxi, from Pittsburgh to Rochester, duration: 4 hours 11 mins, distance: 457 km", "breakfast": "-", "attraction": "The Strong National Museum of Play, Rochester;", "lunch": "Atlas World Grill, Rochester", "dinner": "Sree Annapoorna, Rochester", "accommodation": "Artsy Bushwick NY 2 Beds with laundry & balcony, Rochester"}, {"day": 2, "current_city": "Rochester", "transportation": "-", "breakfast": "Hotel Ravisha Continental, Rochester", "attraction": "George Eastman Museum, Rochester;Susan B. Anthony Museum & House, Rochester;", "lunch": "Mister Mughal, Rochester", "dinner": "Tandoori KnockOuts, Rochester", "accommodation": "Artsy Bushwick NY 2 Beds with laundry & balcony, Rochester"}, {"day": 3, "current_city": "from Rochester to Niagara Falls", "transportation": "Taxi, from Rochester to Niagara Falls, duration: 1 hour 25 mins, distance: 139 km", "breakfast": "Sagar Ratna, Rochester", "attraction": "Journey Behind the Falls, Niagara Falls;Niagara SkyWheel, Niagara Falls;", "lunch": "Tony Roma's, Niagara Falls", "dinner": "Izakaya Kikufuji, Niagara Falls", "accommodation": "Sunny Spacious South Slope Studio, Niagara Falls"}, {"day": 4, "current_city": "Niagara Falls", "transportation": "-", "breakfast": "Raju Dhaba, Niagara Falls", "attraction": "Cave of the Winds, Niagara Falls;White Water Walk, Niagara Falls;", "lunch": "Scratch, Niagara Falls", "dinner": "Capital Grill, Niagara Falls", "accommodation": "Sunny Spacious South Slope Studio, Niagara Falls"}, {"day": 5, "current_city": "from Niagara Falls to New York", "transportation": "Taxi, from Niagara Falls to New York, duration: 6 hours 29 mins, distance: 657 km", "breakfast": "Sri Meenakshi South Indian Food, Niagara Falls", "attraction": "-", "lunch": "-", "dinner": "Seasons 52 Fresh Grill, New York", "accommodation": "Beautiful and big 1BR sublet close by Central Park, New York"}, {"day": 6, "current_city": "New York", "transportation": "-", "breakfast": "Gurgaon Hights, New York", "attraction": "Top of The Rock, New York;Central Park, New York;", "lunch": "Lord of the Drinks Forum, New York", "dinner": "Goosebumps, New York", "accommodation": "Beautiful and big 1BR sublet close by Central Park, New York"}, {"day": 7, "current_city": "from New York to Pittsburgh", "transportation": "Taxi, from New York to Pittsburgh, duration: 5 hours 57 mins, distance: 594 km", "breakfast": "Rambhog, New York", "attraction": "-", "lunch": "-", "dinner": "-", "accommodation": "-"}]}]