[{"gpt-4-1106-preview_direct_sole-planning_results": "Travel Plan:\n\nDays: 1\nCurrent City: from Valparaiso to Belleville\nTransportation: Flight Number: F3579167, from Valparaiso to Belleville, Departure Time: 17:23, Arrival Time: 19:06, cost: 211\nBreakfast: -\nAttraction: Labor & Industrial Museum, Belleville (Address: 123 N Church St, Belleville, IL 62220, USA)\nLunch: -\nDinner: Asian Haus, Belleville (Average Cost: 87, Cuisines: Tea, Pizza, Bakery, Mediterranean), cost: 87\nAccommodation: 1 Bedroom/1 Bath Apt in Hudson Yards/Midtown West, Belleville (price: 610.0, room type: Entire home/apt, house rules: No parties & No pets, minimum nights: 1.0, maximum occupancy: 2)\n\nNumber of people: 8\nTotal cost: 8 x 211 + 8 x 87 + 610 x 4 = 1688 + 696 + 2440 = 4824\nAccommodation minimum nights: 1/1\n\nDays: 2\nCurrent City: Belleville\nTransportation: -\nBreakfast: Fuji Japanese Steak House, Belleville (Average Cost: 70, Cuisines: Bakery, Indian, Cafe), cost: 70\nAttraction: National Shrine of Our Lady of the Snows, Belleville (Address: 442 S Demazenod Dr, Belleville, IL 62223, USA)\nLunch: Super Restaurant, Belleville (Average Cost: 96, Cuisines: Tea, American, BBQ, Italian), cost: 96\nDinner: Moti Mahal Delux, Belleville (Average Cost: 55, Cuisines: Cafe, American, Desserts), cost: 55\nAccommodation: 1 Bedroom/1 Bath Apt in Hudson Yards/Midtown West, Belleville (price: 610.0, room type: Entire home/apt, house rules: No parties & No pets, minimum nights: 1.0, maximum occupancy: 2)\n\nNumber of people: 8\nTotal cost: 8 x 70 + 8 x 96 + 8 x 55 + 610 x 4 = 560 + 768 + 440 + 2440 = 4208\nAccommodation minimum nights: 2/1\n\nDays: 3\nCurrent City: from Belleville to Valparaiso\nTransportation: Flight Number: F3571908, from Belleville to Valparaiso, Departure Time: 17:15, Arrival Time: 18:55, cost: 124\nBreakfast: Zaiqa Kathi Roll & Momos, Belleville (Average Cost: 80, Cuisines: Cafe, BBQ, Fast Food), cost: 80\nAttraction: -\nLunch: -\nDinner: -\nAccommodation: -\n\nNumber of people: 8\nTotal cost: 8 x 80 + 8 x 124 = 640 + 992 = 1632\n\nTotal cost across all days: 4824 + 4208 + 1632 = 10664\n\nUnfortunately, the total cost of $10,664 exceeds the specified budget of $6,600. Adjustments must be made to the plan to meet the budget constraints. Since the budget cannot accommodate the current plan, we need to revise the accommodations and meal plans to reduce costs. However, given the constraints and the provided data, it is not possible to create a feasible plan within the budget of $6,600.", "gpt-4-1106-preview_direct_sole-planning_parsed_results": [{"day": 1, "current_city": "from Valparaiso to Belleville", "transportation": "Flight Number: F3579167, from Valparaiso to Belleville, Departure Time: 17:23, Arrival Time: 19:06", "breakfast": "-", "attraction": "Labor & Industrial Museum, Belleville", "lunch": "-", "dinner": "Asian Haus, Belleville", "accommodation": "1 Bedroom/1 Bath Apt in Hudson Yards/Midtown West, Belleville"}, {"day": 2, "current_city": "Belleville", "transportation": "-", "breakfast": "Fuji Japanese Steak House, Belleville", "attraction": "National Shrine of Our Lady of the Snows, Belleville", "lunch": "Super Restaurant, Belleville", "dinner": "Moti Mahal Delux, Belleville", "accommodation": "1 Bedroom/1 Bath Apt in Hudson Yards/Midtown West, Belleville"}, {"day": 3, "current_city": "from Belleville to Valparaiso", "transportation": "Flight Number: F3571908, from Belleville to Valparaiso, Departure Time: 17:15, Arrival Time: 18:55", "breakfast": "Zaiqa Kathi Roll & Momos, Belleville", "attraction": "-", "lunch": "-", "dinner": "-", "accommodation": "-"}]}]