[{"gpt-4-1106-preview_direct_sole-planning_results": "Travel Plan:\n\nDays: 1\nCurrent City: from Houston to Pensacola\nTransportation: Taxi, from Houston to Pensacola, duration: 7 hours 38 mins, distance: 845 km, cost: 845\nBreakfast: -\nAttraction: -\nLunch: -\nDinner: Frog Hollow Tavern, Pensacola, cost: 20, cuisines: American, BBQ, Fast Food, Cafe, Indian\nAccommodation: Chic Historic Harlem Brownstone, Pensacola, cost: 526.0, room type: Entire home/apt, house rules: No smoking, minimum nights: 3.0, maximum occupancy: 2\n\nNumber of people: 2\nTotal cost: 845 + 2 x 20 + 526 = 1411 (This exceeds the budget, so we need to choose a different accommodation.)\n\nRevised Accommodation: Amazing apartment near museum, gardens & park!, Pensacola, cost: 74.0, room type: Entire home/apt, house rules: No parties, minimum nights: 17.0, maximum occupancy: 3\n\nRevised Total cost: 845 + 2 x 20 + 74 = 959\n\nDays: 2\nCurrent City: Pensacola\nTransportation: -\nBreakfast: Berry Patch Restaurant, Pensacola, cost: 13, cuisines: Bakery, BBQ, Desserts, Seafood\nAttraction: Historic Pensacola Village, Pensacola; Pensacola Museum of Art, Pensacola\nLunch: Bailey's Bar-B-Que, Pensacola, cost: 13, cuisines: Tea, Bakery, Mediterranean\nDinner: Blue Point Grill, Pensacola, cost: 75, cuisines: French, Indian, Cafe, Desserts\nAccommodation: Amazing apartment near museum, gardens & park!, Pensacola, cost: 74.0, room type: Entire home/apt, house rules: No parties, minimum nights: 17.0, maximum occupancy: 3\n\nNumber of people: 2\nTotal cost: 2 x 13 + 2 x 13 + 2 x 75 + 74 = 276\n\nDays: 3\nCurrent City: from Pensacola to Houston\nTransportation: Self-driving, from Pensacola to Houston, duration: 7 hours 37 mins, distance: 845 km, cost: 42\nBreakfast: Jain Coffee House, Pensacola, cost: 41, cuisines: Cafe, Indian, Mediterranean, BBQ\nAttraction: -\nLunch: -\nDinner: -\nAccommodation: -\n\nNumber of people: 2\nTotal cost: 2 x 41 + 42 = 124\n\nTotal cost across all days: 959 + 276 + 124 = 1359 (This exceeds the budget, so we need to adjust the plan.)\n\nRevised Plan:\n\nDays: 1\nCurrent City: from Houston to Pensacola\nTransportation: Self-driving, from Houston to Pensacola, duration: 7 hours 38 mins, distance: 845 km, cost: 42\nBreakfast: -\nAttraction: -\nLunch: -\nDinner: Frog Hollow Tavern, Pensacola, cost: 20, cuisines: American, BBQ, Fast Food, Cafe, Indian\nAccommodation: Amazing apartment near museum, gardens & park!, Pensacola, cost: 74.0, room type: Entire home/apt, house rules: No parties, minimum nights: 17.0, maximum occupancy: 3\n\nNumber of people: 2\nTotal cost: 42 + 2 x 20 + 74 = 156\n\nDays: 2\nCurrent City: Pensacola\nTransportation: -\nBreakfast: Berry Patch Restaurant, Pensacola, cost: 13, cuisines: Bakery, BBQ, Desserts, Seafood\nAttraction: Historic Pensacola Village, Pensacola; Pensacola Museum of Art, Pensacola\nLunch: Bailey's Bar-B-Que, Pensacola, cost: 13, cuisines: Tea, Bakery, Mediterranean\nDinner: Blue Point Grill, Pensacola, cost: 75, cuisines: French, Indian, Cafe, Desserts\nAccommodation: Amazing apartment near museum, gardens & park!, Pensacola, cost: 74.0, room type: Entire home/apt, house rules: No parties, minimum nights: 17.0, maximum occupancy: 3\n\nNumber of people: 2\nTotal cost: 2 x 13 + 2 x 13 + 2 x 75 + 74 = 276\n\nDays: 3\nCurrent City: from Pensacola to Houston\nTransportation: Self-driving, from Pensacola to Houston, duration: 7 hours 37 mins, distance: 845 km, cost: 42\nBreakfast: Jain Coffee House, Pensacola, cost: 41, cuisines: Cafe, Indian, Mediterranean, BBQ\nAttraction: -\nLunch: -\nDinner: -\nAccommodation: -\n\nNumber of people: 2\nTotal cost: 2 x 41 + 42 = 124\n\nTotal cost across all days: 156 + 276 + 124 = 556\n\nCuisines: The plan includes American, BBQ, Fast Food, Cafe, Indian, Bakery, Desserts, Seafood, Tea, Mediterranean, and French cuisines.\n\nAccommodations: The selected accommodation allows smoking and offers non-shared rooms, meeting the query requirements.\n\nTransportation: The preferred mode of transportation is not flight-based, and the plan adheres to this constraint.\n\nBudget: The total cost of the travel plan is $556, which is within the specified budget of $1,100.", "gpt-4-1106-preview_direct_sole-planning_parsed_results": [{"day": 1, "current_city": "from Houston to Pensacola", "transportation": "Self-driving, from Houston to Pensacola, duration: 7 hours 38 mins, distance: 845 km", "breakfast": "-", "attraction": "-", "lunch": "-", "dinner": "Frog Hollow Tavern, Pensacola", "accommodation": "Amazing apartment near museum, gardens & park!, Pensacola"}, {"day": 2, "current_city": "Pensacola", "transportation": "-", "breakfast": "Berry Patch Restaurant, Pensacola", "attraction": "Historic Pensacola Village, Pensacola;Pensacola Museum of Art, Pensacola;", "lunch": "Bailey's Bar-B-Que, Pensacola", "dinner": "Blue Point Grill, Pensacola", "accommodation": "Amazing apartment near museum, gardens & park!, Pensacola"}, {"day": 3, "current_city": "from Pensacola to Houston", "transportation": "Self-driving, from Pensacola to Houston, duration: 7 hours 37 mins, distance: 845 km", "breakfast": "Jain Coffee House, Pensacola", "attraction": "-", "lunch": "-", "dinner": "-", "accommodation": "-"}]}]