[{"gpt-4-1106-preview_direct_sole-planning_results": "Travel Plan:\n\nDays: 1\nCurrent City: from Minneapolis to St. Louis\nTransportation: Flight Number: F3491757, from Minneapolis to St. Louis, Departure Time: 21:30, Arrival Time: 22:50, cost: 95\nBreakfast: -\nAttraction: -\nLunch: -\nDinner: El Super Burrito, St. Louis, cost: 43, cuisines: Tea, Cafe, Mediterranean, Fast Food\nAccommodation: Peaceful room in Bushwick, St. Louis, cost: 79.0, maximum occupancy: 1, house rules: No parties, minimum nights: 1.0\n\nNumber of people: 1\nTotal cost: 95 + 43 + 79 = 217\n\nDays: 2\nCurrent City: St. Louis\nTransportation: -\nBreakfast: The Latitude - Radisson Blu, St. Louis, cost: 18, cuisines: Pizza, French, BBQ, American, Seafood\nAttraction: Saint Louis Zoo, St. Louis; City Museum, St. Louis\nLunch: Moti Mahal Delux, St. Louis, cost: 73, cuisines: Bakery, BBQ\nDinner: M Cr\u00e8me, St. Louis, cost: 42, cuisines: French, Pizza, BBQ, Seafood\nAccommodation: Peaceful room in Bushwick, St. Louis, cost: 79.0, maximum occupancy: 1, house rules: No parties, minimum nights: 1.0\n\nNumber of people: 1\nTotal cost: 18 + 73 + 42 + 79 = 212\n\nDays: 3\nCurrent City: from St. Louis to Minneapolis\nTransportation: Flight Number: F3830375, from St. Louis to Minneapolis, Departure Time: 19:09, Arrival Time: 20:34, cost: 108\nBreakfast: Starbucks, St. Louis, cost: 92, cuisines: Tea, French, Cafe, Fast Food\nAttraction: Forest Park, St. Louis\nLunch: Om Sweets, St. Louis, cost: 24, cuisines: Fast Food, BBQ, Desserts, Seafood\nDinner: -\nAccommodation: -\n\nNumber of people: 1\nTotal cost: 92 + 24 + 108 = 224\n\nTotal cost across all days: 217 + 212 + 224 = 653\n\nCuisines: No specific cuisine constraints were mentioned in the query, so all restaurant choices are valid.\n\nNote: The budget is $1,000, and the total cost of the travel plan is $653, which is within the budget. The plan includes transportation, meals, attractions, and accommodation for each day, adhering to the constraints provided.", "gpt-4-1106-preview_direct_sole-planning_parsed_results": [{"day": 1, "current_city": "from Minneapolis to St. Louis", "transportation": "Flight Number: F3491757, from Minneapolis to St. Louis, Departure Time: 21:30, Arrival Time: 22:50", "breakfast": "-", "attraction": "-", "lunch": "-", "dinner": "El Super Burrito, St. Louis", "accommodation": "Peaceful room in Bushwick, St. Louis"}, {"day": 2, "current_city": "St. Louis", "transportation": "-", "breakfast": "The Latitude - Radisson Blu, St. Louis", "attraction": "Saint Louis Zoo, St. Louis;City Museum, St. Louis;", "lunch": "Moti Mahal Delux, St. Louis", "dinner": "M Cr\u00e8me, St. Louis", "accommodation": "Peaceful room in Bushwick, St. Louis"}, {"day": 3, "current_city": "from St. Louis to Minneapolis", "transportation": "Flight Number: F3830375, from St. Louis to Minneapolis, Departure Time: 19:09, Arrival Time: 20:34", "breakfast": "Starbucks, St. Louis", "attraction": "Forest Park, St. Louis", "lunch": "Om Sweets, St. Louis", "dinner": "-", "accommodation": "-"}]}]