[{"gpt-4-1106-preview_direct_sole-planning_results": "Travel Plan:\n\nDays: 1\nCurrent City: from Las Vegas to Santa Maria\nTransportation: Self-driving, from Las Vegas to Santa Maria, duration: 6 hours 17 mins, distance: 634 km, cost: 31\nBreakfast: -\nAttraction: -\nLunch: -\nDinner: Pirates of Grill, Santa Maria, cost: 90, cuisines: Bakery, BBQ, Fast Food, American, Mediterranean, Seafood\nAccommodation: Cozy apartment near Central Park, Santa Maria, cost: 738.0, maximum occupancy: 6, house rules: No pets, minimum nights: 1.0\n\nNumber of people: 4\nTotal cost: 4 x 31 + 4 x 90 + 738 = 1034\n\nDays: 2\nCurrent City: Santa Maria\nTransportation: -\nBreakfast: Indian By Nature, Santa Maria, cost: 45, cuisines: Tea, Pizza, Bakery, BBQ, Mediterranean\nAttraction: Santa Maria Valley Discovery Museum, Santa Maria; Santa Maria Museum of Flight, Santa Maria\nLunch: RiverDine Restaurant & Bar, Santa Maria, cost: 71, cuisines: Chinese, BBQ, Seafood\nDinner: Calendar Khana Laao, Santa Maria, cost: 91, cuisines: Desserts, Tea, Fast Food, Cafe, Indian\nAccommodation: Cozy apartment near Central Park, Santa Maria, cost: 738.0, maximum occupancy: 6, house rules: No pets, minimum nights: 1.0\n\nNumber of people: 4\nTotal cost: 4 x 45 + 4 x 71 + 4 x 91 + 738 = 1550\n\nDays: 3\nCurrent City: from Santa Maria to Las Vegas\nTransportation: Self-driving, from Santa Maria to Las Vegas, duration: 6 hours 19 mins, distance: 636 km, cost: 31\nBreakfast: The Cake Basket, Santa Maria, cost: 98, cuisines: Tea, BBQ\nAttraction: -\nLunch: -\nDinner: -\nAccommodation: -\n\nNumber of people: 4\nTotal cost: 4 x 31 + 4 x 98 = 516\n\nTotal cost across all days: 1034 + 1550 + 516 = 3100\nCuisines: The prompt specifies American and Mediterranean, so all cuisine constraints are satisfied.\n\nNote: The travel plan includes all required details for each day, adhering to the budget and cuisine preferences. Attractions are chosen based on the destination city, and accommodations are selected to match the final city for each day. The transportation method is consistent, and no prohibited transportation types are used. The accommodation adheres to the specified room type constraints and house rules.", "gpt-4-1106-preview_direct_sole-planning_parsed_results": [{"day": 1, "current_city": "from Las Vegas to Santa Maria", "transportation": "Self-driving, from Las Vegas to Santa Maria, duration: 6 hours 17 mins, distance: 634 km", "breakfast": "-", "attraction": "-", "lunch": "-", "dinner": "Pirates of Grill, Santa Maria", "accommodation": "Cozy apartment near Central Park, Santa Maria"}, {"day": 2, "current_city": "Santa Maria", "transportation": "-", "breakfast": "Indian By Nature, Santa Maria", "attraction": "Santa Maria Valley Discovery Museum, Santa Maria;Santa Maria Museum of Flight, Santa Maria;", "lunch": "RiverDine Restaurant & Bar, Santa Maria", "dinner": "Calendar Khana Laao, Santa Maria", "accommodation": "Cozy apartment near Central Park, Santa Maria"}, {"day": 3, "current_city": "from Santa Maria to Las Vegas", "transportation": "Self-driving, from Santa Maria to Las Vegas, duration: 6 hours 19 mins, distance: 636 km", "breakfast": "The Cake Basket, Santa Maria", "attraction": "-", "lunch": "-", "dinner": "-", "accommodation": "-"}]}]