[{"gpt-4-1106-preview_direct_sole-planning_results": "Travel Plan:\n\nDays: 1\nCurrent City: from Richmond to Houston (Texas)\nTransportation: Flight Number: F4041372, from Richmond to Houston, Departure Time: 08:27, Arrival Time: 10:43, cost: 371\nBreakfast: -\nAttraction: Downtown Aquarium, Houston (Texas)\nLunch: Jalapenos, Houston (Texas), cost: 57, cuisines: Desserts, Tea, Cafe, Chinese, Seafood\nDinner: The BrewMaster - The Mix Fine Dine, Houston (Texas), cost: 52, cuisines: French, Indian, Cafe, Seafood\nAccommodation: Sunny and Airy near Manhattan, Houston (Texas), cost: 499.0, maximum occupancy: 4, house rules: No pets, minimum nights: 2.0\n\nNumber of people: 2\nTotal cost: 2 x 371 + 2 x 57 + 2 x 52 + 499 = 1459\nAccommodation minimum nights: 1/2\n\nDays: 2\nCurrent City: Houston (Texas)\nTransportation: -\nBreakfast: Super Bakery, Houston (Texas), cost: 30, cuisines: Seafood, Fast Food\nAttraction: Space Center Houston, Houston (Texas); Houston Museum of Natural Science, Houston (Texas); Houston Zoo, Houston (Texas)\nLunch: Sheetla Dhaba, Houston (Texas), cost: 35, cuisines: Desserts, Pizza, Bakery, American, Mediterranean\nDinner: Dana Pani, Houston (Texas), cost: 91, cuisines: Bakery, Indian, Seafood\nAccommodation: Sunny and Airy near Manhattan, Houston (Texas), cost: 499.0, maximum occupancy: 4, house rules: No pets, minimum nights: 2.0\n\nNumber of people: 2\nTotal cost: 2 x 30 + 2 x 35 + 2 x 91 + 499 = 812\nAccommodation minimum nights: 2/2\n\nDays: 3\nCurrent City: from Houston (Texas) to Texarkana (Texas)\nTransportation: Flight Number: F3930024, from Houston to Texarkana, Departure Time: 17:56, Arrival Time: 19:00, cost: 63\nBreakfast: Royal Mart, Houston (Texas), cost: 40, cuisines: Tea, Bakery, Cafe, Mediterranean, Seafood\nAttraction: Museum of Regional History, Texarkana (Texas); Spring Lake Park, Texarkana (Texas)\nLunch: Cyber Adda 24, Houston (Texas), cost: 73, cuisines: Chinese, Pizza, Bakery\nDinner: Columbia Restaurant, Texarkana (Texas), cost: 91, cuisines: Desserts, Tea, Pizza, Indian, Seafood\nAccommodation: Large 2.5 BR Apt In Park Slope, Texarkana (Texas), cost: 269.0, maximum occupancy: 3, house rules: No smoking & No visitors, minimum nights: 1.0\n\nNumber of people: 2\nTotal cost: 2 x 40 + 2 x 73 + 2 x 91 + 2 x 63 + 269 = 802\nAccommodation minimum nights: 1/1\n\nDays: 4\nCurrent City: Texarkana (Texas)\nTransportation: -\nBreakfast: Big City Bread Cafe, Texarkana (Texas), cost: 61, cuisines: Cafe, Pizza, Bakery, BBQ\nAttraction: Texarkana Museums System, Texarkana (Texas); Ace of Clubs House, Texarkana (Texas)\nLunch: Poets Cafe, Texarkana (Texas), cost: 88, cuisines: Chinese, Bakery, Indian, Desserts\nDinner: Curries N More, Texarkana (Texas), cost: 78, cuisines: Tea, French, Cafe, Italian\nAccommodation: Large 2.5 BR Apt In Park Slope, Texarkana (Texas), cost: 269.0, maximum occupancy: 3, house rules: No smoking & No visitors, minimum nights: 1.0\n\nNumber of people: 2\nTotal cost: 2 x 61 + 2 x 88 + 2 x 78 + 269 = 723\nAccommodation minimum nights: 1/1\n\nDays: 5\nCurrent City: from Texarkana (Texas) to Richmond\nTransportation: Self-driving, from Texarkana to Richmond, duration: 16 hours 8 mins, distance: 1,773 km, cost: 88\nBreakfast: Teasta, Texarkana (Texas), cost: 94, cuisines: Pizza, Italian, French, Bakery, Cafe, Seafood\nAttraction: -\nLunch: -\nDinner: -\nAccommodation: -\n\nNumber of people: 2\nTotal cost: 2 x 94 + 2 x 88 = 364\n\nTotal cost across all days: 1459 + 812 + 802 + 723 + 364 = 4160\nCuisines: The prompt specifies Chinese and Indian, so all cuisine constraints are satisfied.", "gpt-4-1106-preview_direct_sole-planning_parsed_results": [{"day": 1, "current_city": "from Richmond to Houston", "transportation": "Flight Number: F4041372, from Richmond to Houston, Departure Time: 08:27, Arrival Time: 10:43", "breakfast": "-", "attraction": "Downtown Aquarium, Houston;", "lunch": "Jalapenos, Houston", "dinner": "The BrewMaster - The Mix Fine Dine, Houston", "accommodation": "Sunny and Airy near Manhattan, Houston"}, {"day": 2, "current_city": "Houston", "transportation": "-", "breakfast": "Super Bakery, Houston", "attraction": "Space Center Houston, Houston;Houston Museum of Natural Science, Houston;Houston Zoo, Houston;", "lunch": "Sheetla Dhaba, Houston", "dinner": "Dana Pani, Houston", "accommodation": "Sunny and Airy near Manhattan, Houston"}, {"day": 3, "current_city": "from Houston to Texarkana", "transportation": "Flight Number: F3930024, from Houston to Texarkana, Departure Time: 17:56, Arrival Time: 19:00", "breakfast": "Royal Mart, Houston", "attraction": "Museum of Regional History, Texarkana;Spring Lake Park, Texarkana;", "lunch": "Cyber Adda 24, Houston", "dinner": "Columbia Restaurant, Texarkana", "accommodation": "Large 2.5 BR Apt In Park Slope, Texarkana"}, {"day": 4, "current_city": "Texarkana", "transportation": "-", "breakfast": "Big City Bread Cafe, Texarkana", "attraction": "Texarkana Museums System, Texarkana;Ace of Clubs House, Texarkana;", "lunch": "Poets Cafe, Texarkana", "dinner": "Curries N More, Texarkana", "accommodation": "Large 2.5 BR Apt In Park Slope, Texarkana"}, {"day": 5, "current_city": "from Texarkana to Richmond", "transportation": "Self-driving, from Texarkana to Richmond, duration: 16 hours 8 mins, distance: 1,773 km", "breakfast": "Teasta, Texarkana", "attraction": "-", "lunch": "-", "dinner": "-", "accommodation": "-"}]}]