[{"gpt-4-1106-preview_direct_sole-planning_results": "Travel Plan:\n\nDays: 1\nCurrent City: from Chattanooga to Augusta (Georgia)\nTransportation: Taxi, from Chattanooga to Augusta, duration: 3 hours 57 mins, distance: 423 km, cost: $423\nBreakfast: -\nAttraction: Phinizy Swamp Nature Park, Augusta (Georgia)\nLunch: -\nDinner: B Merrell's, Augusta (Georgia), cost: $74, cuisines: Tea, Pizza, Desserts, Fast Food\nAccommodation: Perfect Chanukah apartment for the whole crew!, Augusta (Georgia), cost: $451.0, room type: Entire home/apt, house rules: No pets, minimum nights: 1.0, maximum occupancy: 3\n\nNumber of people: 2\nTotal cost: 2 x $423 + 2 x $74 + $451 = $1445\nAccommodation minimum nights: 1/1\n\nDays: 2\nCurrent City: Augusta (Georgia)\nTransportation: -\nBreakfast: Fish Tales Lakeside Grille, Augusta (Georgia), cost: $37, cuisines: Tea, Cafe, Bakery, Desserts\nAttraction: Augusta Riverwalk, Augusta (Georgia); Augusta Museum of History, Augusta (Georgia)\nLunch: The Charcoal Chimney, Augusta (Georgia), cost: $86, cuisines: Tea, Fast Food, BBQ, Italian\nDinner: KB's Kulfi & Icecream, Augusta (Georgia), cost: $92, cuisines: American, BBQ, Seafood\nAccommodation: Perfect Chanukah apartment for the whole crew!, Augusta (Georgia), cost: $451.0, room type: Entire home/apt, house rules: No pets, minimum nights: 1.0, maximum occupancy: 3\n\nNumber of people: 2\nTotal cost: 2 x $37 + 2 x $86 + 2 x $92 + $451 = $882\nAccommodation minimum nights: 2/2\n\nDays: 3\nCurrent City: from Augusta (Georgia) to Decatur (Georgia)\nTransportation: Taxi, from Augusta to Decatur, duration: 2 hours 19 mins, distance: 229 km, cost: $229\nBreakfast: Karari Kurry, Augusta (Georgia), cost: $29, cuisines: Bakery, Indian, Cafe, Fast Food\nAttraction: DeKalb History Center Museum, Decatur (Georgia); Glenlake Park, Decatur (Georgia)\nLunch: Madhuban Restaurant - Welcome Hotel Rama International, Decatur (Georgia), cost: $47, cuisines: Pizza, Bakery, Seafood\nDinner: Tandoori Hut, Decatur (Georgia), cost: $82, cuisines: Pizza, American, Indian, Fast Food\nAccommodation: Cozy Private Room, Decatur (Georgia), cost: $69.0, room type: Private room, house rules: No children under 10 & No parties & No visitors, minimum nights: 2.0, maximum occupancy: 2\n\nNumber of people: 2\nTotal cost: 2 x $229 + 2 x $29 + 2 x $47 + 2 x $82 + $69 = $834\nAccommodation minimum nights: 1/2\n\nDays: 4\nCurrent City: Decatur (Georgia)\nTransportation: -\nBreakfast: Cafe Coffee Day, Decatur (Georgia), cost: $46, cuisines: Tea, Cafe, BBQ, Mediterranean\nAttraction: Clyde Shepherd Nature Preserve, Decatur (Georgia); Waffle House Museum, Decatur (Georgia)\nLunch: Dawat-E-Chaman, Decatur (Georgia), cost: $42, cuisines: Chinese, BBQ, Fast Food, Cafe, Mediterranean\nDinner: Carnatic Cafe, Decatur (Georgia), cost: $66, cuisines: Cafe, Indian, Desserts\nAccommodation: Cozy Private Room, Decatur (Georgia), cost: $69.0, room type: Private room, house rules: No children under 10 & No parties & No visitors, minimum nights: 2.0, maximum occupancy: 2\n\nNumber of people: 2\nTotal cost: 2 x $46 + 2 x $42 + 2 x $66 + $69 = $377\nAccommodation minimum nights: 2/2\n\nDays: 5\nCurrent City: from Decatur (Georgia) to Atlanta (Georgia)\nTransportation: Taxi, from Decatur to Atlanta, duration: 19 mins, distance: 13.0 km, cost: $13\nBreakfast: Hwealthcafe, Decatur (Georgia), cost: $44, cuisines: Pizza, Bakery, Desserts, Fast Food\nAttraction: Atlanta Botanical Garden, Atlanta (Georgia); Georgia Aquarium, Atlanta (Georgia)\nLunch: Saffron, Atlanta (Georgia), cost: $39, cuisines: Tea, Cafe, Fast Food, Seafood\nDinner: Baba Au Rhum, Atlanta (Georgia), cost: $27, cuisines: Desserts, Pizza, Mexican, BBQ, Fast Food\nAccommodation: Fantastic Room in Bushwick, Atlanta (Georgia), cost: $1069.0, room type: Private room, house rules: No children under 10, minimum nights: 2.0, maximum occupancy: 2\n\nNumber of people: 2\nTotal cost: 2 x $13 + 2 x $44 + 2 x $39 + 2 x $27 + $1069 = $1315\nAccommodation minimum nights: 1/2\n\nDays: 6\nCurrent City: Atlanta (Georgia)\nTransportation: -\nBreakfast: Asian Bistro, Atlanta (Georgia), cost: $27, cuisines: Tea, Bakery, Seafood\nAttraction: World of Coca-Cola, Atlanta (Georgia); Piedmont Park, Atlanta (Georgia)\nLunch: Chef Style, Atlanta (Georgia), cost: $59, cuisines: Pizza, American, Desserts, Seafood\nDinner: Pizza Central, Atlanta (Georgia), cost: $75, cuisines: Cafe, Bakery, BBQ, Fast Food, Chinese, Indian\nAccommodation: Fantastic Room in Bushwick, Atlanta (Georgia), cost: $1069.0, room type: Private room, house rules: No children under 10, minimum nights: 2.0, maximum occupancy: 2\n\nNumber of people: 2\nTotal cost: 2 x $27 + 2 x $59 + 2 x $75 + $1069 = $1392\nAccommodation minimum nights: 2/2\n\nDays: 7\nCurrent City: from Atlanta (Georgia) to Chattanooga\nTransportation: Self-driving, from Atlanta to Chattanooga, duration: 1 hour 47 mins, distance: 190 km, cost: $9\nBreakfast: Shri Ram Restaurant, Atlanta (Georgia), cost: $55, cuisines: Tea, Mexican, Indian, Fast Food\nAttraction: -\nLunch: -\nDinner: -\nAccommodation: -\n\nNumber of people: 2\nTotal cost: 2 x $9 + 2 x $55 = $128\n\nTotal cost across all days: $1445 + $882 + $834 + $377 + $1315 + $1392 + $128 = $6473\nCuisines: The plan includes a variety of cuisines, with no specific constraints mentioned.\n***** Travel Plan Ends *****\n\nPlease note that the costs are estimated based on the provided data and may vary. The accommodation has been chosen to meet the private room requirement, and transportation avoids air travel as requested. The plan stays within the specified budget of $6,900.", "gpt-4-1106-preview_direct_sole-planning_parsed_results": [{"day": 1, "current_city": "from Chattanooga to Augusta (Georgia)", "transportation": "Taxi, from Chattanooga to Augusta, duration: 3 hours 57 mins, distance: 423 km", "breakfast": "-", "attraction": "Phinizy Swamp Nature Park, Augusta (Georgia);", "lunch": "-", "dinner": "B Merrell's, Augusta (Georgia)", "accommodation": "Perfect Chanukah apartment for the whole crew!, Augusta (Georgia)"}, {"day": 2, "current_city": "Augusta (Georgia)", "transportation": "-", "breakfast": "Fish Tales Lakeside Grille, Augusta (Georgia)", "attraction": "Augusta Riverwalk, Augusta (Georgia);Augusta Museum of History, Augusta (Georgia);", "lunch": "The Charcoal Chimney, Augusta (Georgia)", "dinner": "KB's Kulfi & Icecream, Augusta (Georgia)", "accommodation": "Perfect Chanukah apartment for the whole crew!, Augusta (Georgia)"}, {"day": 3, "current_city": "from Augusta (Georgia) to Decatur (Georgia)", "transportation": "Taxi, from Augusta to Decatur, duration: 2 hours 19 mins, distance: 229 km", "breakfast": "Karari Kurry, Augusta (Georgia)", "attraction": "DeKalb History Center Museum, Decatur (Georgia);Glenlake Park, Decatur (Georgia);", "lunch": "Madhuban Restaurant - Welcome Hotel Rama International, Decatur (Georgia)", "dinner": "Tandoori Hut, Decatur (Georgia)", "accommodation": "Cozy Private Room, Decatur (Georgia)"}, {"day": 4, "current_city": "Decatur (Georgia)", "transportation": "-", "breakfast": "Cafe Coffee Day, Decatur (Georgia)", "attraction": "Clyde Shepherd Nature Preserve, Decatur (Georgia);Waffle House Museum, Decatur (Georgia);", "lunch": "Dawat-E-Chaman, Decatur (Georgia)", "dinner": "Carnatic Cafe, Decatur (Georgia)", "accommodation": "Cozy Private Room, Decatur (Georgia)"}, {"day": 5, "current_city": "from Decatur (Georgia) to Atlanta (Georgia)", "transportation": "Taxi, from Decatur to Atlanta, duration: 19 mins, distance: 13.0 km", "breakfast": "Hwealthcafe, Decatur (Georgia)", "attraction": "Atlanta Botanical Garden, Atlanta (Georgia);Georgia Aquarium, Atlanta (Georgia);", "lunch": "Saffron, Atlanta (Georgia)", "dinner": "Baba Au Rhum, Atlanta (Georgia)", "accommodation": "Fantastic Room in Bushwick, Atlanta (Georgia)"}, {"day": 6, "current_city": "Atlanta (Georgia)", "transportation": "-", "breakfast": "Asian Bistro, Atlanta (Georgia)", "attraction": "World of Coca-Cola, Atlanta (Georgia);Piedmont Park, Atlanta (Georgia);", "lunch": "Chef Style, Atlanta (Georgia)", "dinner": "Pizza Central, Atlanta (Georgia)", "accommodation": "Fantastic Room in Bushwick, Atlanta (Georgia)"}, {"day": 7, "current_city": "from Atlanta (Georgia) to Chattanooga", "transportation": "Self-driving, from Atlanta to Chattanooga, duration: 1 hour 47 mins, distance: 190 km", "breakfast": "Shri Ram Restaurant, Atlanta (Georgia)", "attraction": "-", "lunch": "-", "dinner": "-", "accommodation": "-"}]}]