[{"gpt-4-1106-preview_direct_sole-planning_results": "Travel Plan:\n\nDays: 1\nCurrent City: from Columbus to Dallas (Texas)\nTransportation: Flight Number: F3666359, from Columbus to Dallas, Departure Time: 07:19, Arrival Time: 09:00, cost: 208\nBreakfast: -\nAttraction: The Sixth Floor Museum at Dealey Plaza, Dallas (Texas)\nLunch: Coconuts Fish Cafe, Dallas (Texas), cost: 38, cuisines: Cafe, BBQ, Mediterranean, Fast Food\nDinner: Yanki Sizzlers, Dallas (Texas), cost: 96, cuisines: Cafe, French, Tea, Mediterranean\nAccommodation: Luxury Williamsburg duplex, private roof terrace, Dallas (Texas), cost: 241.0, maximum occupancy: 3, house rules: No visitors, minimum nights: 4.0\n\nNumber of people: 1\nTotal cost: 208 + 38 + 96 + 241 = 583\n\nDays: 2\nCurrent City: Dallas (Texas)\nTransportation: -\nBreakfast: 1918 Bistro & Grill, Dallas (Texas), cost: 90, cuisines: Tea, Pizza, BBQ, Seafood\nAttraction: Reunion Tower, Dallas (Texas); Dallas Museum of Art, Dallas (Texas)\nLunch: L'Opera, Dallas (Texas), cost: 77, cuisines: French, Bakery, BBQ, Fast Food, Seafood\nDinner: Cafe Gatherings, Dallas (Texas), cost: 17, cuisines: Bakery, Indian, Desserts\nAccommodation: Luxury Williamsburg duplex, private roof terrace, Dallas (Texas), cost: 241.0, maximum occupancy: 3, house rules: No visitors, minimum nights: 4.0\n\nNumber of people: 1\nTotal cost: 90 + 77 + 17 + 241 = 425\n\nDays: 3\nCurrent City: from Dallas (Texas) to Amarillo (Texas)\nTransportation: Flight Number: F3601172, from Dallas to Amarillo, Departure Time: 08:24, Arrival Time: 09:27, cost: 101\nBreakfast: -\nAttraction: Cadillac Ranch, Amarillo (Texas); Amarillo Botanical Gardens, Amarillo (Texas)\nLunch: The Cinnamon Kitchen, Amarillo (Texas), cost: 69, cuisines: Desserts, Tea, Pizza, Chinese, Seafood\nDinner: Komachi, Amarillo (Texas), cost: 71, cuisines: Desserts, Tea, Fast Food, Chinese, Mediterranean\nAccommodation: Harlem Humble Abode - 1 bedroom - Cute and Quaint, Amarillo (Texas), cost: 409.0, maximum occupancy: 3, house rules: No pets, minimum nights: 5.0\n\nNumber of people: 1\nTotal cost: 101 + 69 + 71 + 409 = 650\n\nDays: 4\nCurrent City: Amarillo (Texas)\nTransportation: -\nBreakfast: Kanha North & South Indian Veg., Amarillo (Texas), cost: 34, cuisines: Tea, Cafe, BBQ, Fast Food\nAttraction: Amarillo Zoo, Amarillo (Texas); Don Harrington Discovery Center, Amarillo (Texas)\nLunch: Anand Restaurant, Amarillo (Texas), cost: 53, cuisines: Fast Food, Seafood, Desserts, Italian\nDinner: Wood Box Cafe, Amarillo (Texas), cost: 11, cuisines: Desserts, French, Fast Food, Cafe, American\nAccommodation: Harlem Humble Abode - 1 bedroom - Cute and Quaint, Amarillo (Texas), cost: 409.0, maximum occupancy: 3, house rules: No pets, minimum nights: 5.0\n\nNumber of people: 1\nTotal cost: 34 + 53 + 11 + 409 = 507\n\nDays: 5\nCurrent City: from Amarillo (Texas) to Houston (Texas)\nTransportation: Flight Number: F3840460, from Amarillo to Houston, Departure Time: 06:27, Arrival Time: 08:04, cost: 164\nBreakfast: -\nAttraction: Space Center Houston, Houston (Texas); Houston Museum of Natural Science, Houston (Texas)\nLunch: Jalapenos, Houston (Texas), cost: 57, cuisines: Desserts, Tea, Cafe, Chinese, Seafood\nDinner: Super Bakery, Houston (Texas), cost: 30, cuisines: Seafood, Fast Food\nAccommodation: Sunny and Airy near Manhattan, Houston (Texas), cost: 499.0, maximum occupancy: 4, house rules: No pets, minimum nights: 2.0\n\nNumber of people: 1\nTotal cost: 164 + 57 + 30 + 499 = 750\n\nDays: 6\nCurrent City: Houston (Texas)\nTransportation: -\nBreakfast: Sheetla Dhaba, Houston (Texas), cost: 35, cuisines: Desserts, Pizza, Bakery, American, Mediterranean\nAttraction: Houston Zoo, Houston (Texas); The Museum of Fine Arts, Houston (Texas)\nLunch: Matchbox, Houston (Texas), cost: 33, cuisines: Tea, Italian, Bakery, Fast Food, Seafood\nDinner: Earthen Spices, Houston (Texas), cost: 28, cuisines: Tea, Mexican, Bakery, BBQ, Fast Food\nAccommodation: Sunny and Airy near Manhattan, Houston (Texas), cost: 499.0, maximum occupancy: 4, house rules: No pets, minimum nights: 2.0\n\nNumber of people: 1\nTotal cost: 35 + 33 + 28 + 499 = 595\n\nDays: 7\nCurrent City: from Houston to Columbus\nTransportation: Flight Number: F3997947, from Houston to Columbus, Departure Time: 19:20, Arrival Time: 22:29, cost: 259\nBreakfast: -\nAttraction: -\nLunch: -\nDinner: -\nAccommodation: -\n\nNumber of people: 1\nTotal cost: 259\n\nTotal cost across all days: 583 + 425 + 650 + 507 + 750 + 595 + 259 = 3769\n\nCuisines: The prompt does not specify any cuisine constraints, so all cuisine constraints are satisfied.\n\nRemaining Budget: $4,200 - $3,769 = $431\n\nThe travel plan includes all required details and adheres to the constraints specified in the query. The total cost is within the specified budget, and the traveler will be visiting three distinct cities in Texas as requested.", "gpt-4-1106-preview_direct_sole-planning_parsed_results": [{"day": 1, "current_city": "from Columbus to Dallas", "transportation": "Flight Number: F3666359, from Columbus to Dallas, Departure Time: 07:19, Arrival Time: 09:00", "breakfast": "-", "attraction": "The Sixth Floor Museum at Dealey Plaza, Dallas;", "lunch": "Coconuts Fish Cafe, Dallas", "dinner": "Yanki Sizzlers, Dallas", "accommodation": "Luxury Williamsburg duplex, private roof terrace, Dallas"}, {"day": 2, "current_city": "Dallas", "transportation": "-", "breakfast": "1918 Bistro & Grill, Dallas", "attraction": "Reunion Tower, Dallas;Dallas Museum of Art, Dallas;", "lunch": "L'Opera, Dallas", "dinner": "Cafe Gatherings, Dallas", "accommodation": "Luxury Williamsburg duplex, private roof terrace, Dallas"}, {"day": 3, "current_city": "from Dallas to Amarillo", "transportation": "Flight Number: F3601172, from Dallas to Amarillo, Departure Time: 08:24, Arrival Time: 09:27", "breakfast": "-", "attraction": "Cadillac Ranch, Amarillo;Amarillo Botanical Gardens, Amarillo;", "lunch": "The Cinnamon Kitchen, Amarillo", "dinner": "Komachi, Amarillo", "accommodation": "Harlem Humble Abode - 1 bedroom - Cute and Quaint, Amarillo"}, {"day": 4, "current_city": "Amarillo", "transportation": "-", "breakfast": "Kanha North & South Indian Veg., Amarillo", "attraction": "Amarillo Zoo, Amarillo;Don Harrington Discovery Center, Amarillo;", "lunch": "Anand Restaurant, Amarillo", "dinner": "Wood Box Cafe, Amarillo", "accommodation": "Harlem Humble Abode - 1 bedroom - Cute and Quaint, Amarillo"}, {"day": 5, "current_city": "from Amarillo to Houston", "transportation": "Flight Number: F3840460, from Amarillo to Houston, Departure Time: 06:27, Arrival Time: 08:04", "breakfast": "-", "attraction": "Space Center Houston, Houston;Houston Museum of Natural Science, Houston;", "lunch": "Jalapenos, Houston", "dinner": "Super Bakery, Houston", "accommodation": "Sunny and Airy near Manhattan, Houston"}, {"day": 6, "current_city": "Houston", "transportation": "-", "breakfast": "Sheetla Dhaba, Houston", "attraction": "Houston Zoo, Houston;The Museum of Fine Arts, Houston;", "lunch": "Matchbox, Houston", "dinner": "Earthen Spices, Houston", "accommodation": "Sunny and Airy near Manhattan, Houston"}, {"day": 7, "current_city": "from Houston to Columbus", "transportation": "Flight Number: F3997947, from Houston to Columbus, Departure Time: 19:20, Arrival Time: 22:29", "breakfast": "-", "attraction": "-", "lunch": "-", "dinner": "-", "accommodation": "-"}]}]