[{"gpt-4-1106-preview_direct_sole-planning_results": "Travel Plan:\n\nDays: 1\nCurrent City: from Washington to Norfolk (Virginia)\nTransportation: Flight Number: F3783935, from Washington to Norfolk (Virginia), Departure Time: 13:33, Arrival Time: 14:16, cost: 52\nBreakfast: -\nAttraction: Norfolk Botanical Garden, Norfolk (Virginia)\nLunch: -\nDinner: Henry Campbell's Steakhouse, Norfolk (Virginia), cost: 83, cuisines: Chinese, Cafe, Seafood\nAccommodation: Simple Spacious RM near Queens Center Mall & NYPD, Norfolk (Virginia), cost: 311.0, room type: Private room, house rules: No visitors & No parties, minimum nights: 1.0, maximum occupancy: 2\n\nNumber of people: 1\nTotal cost: 52 + 83 + 311 = 446\nAccommodation minimum nights: 1/1\n\nDays: 2\nCurrent City: Norfolk (Virginia)\nTransportation: -\nBreakfast: Sonya Bakery Cafe, Norfolk (Virginia), cost: 32, cuisines: Pizza, Indian, BBQ\nAttraction: Nauticus, Norfolk (Virginia); Chrysler Museum of Art, Norfolk (Virginia)\nLunch: Sunshine Family Restaurant, Norfolk (Virginia), cost: 95, cuisines: Tea, American, Desserts, Italian\nDinner: Game n Grillz, Norfolk (Virginia), cost: 59, cuisines: Mexican, Bakery, Cafe, American, Seafood\nAccommodation: Simple Spacious RM near Queens Center Mall & NYPD, Norfolk (Virginia), cost: 311.0, room type: Private room, house rules: No visitors & No parties, minimum nights: 1.0, maximum occupancy: 2\n\nNumber of people: 1\nTotal cost: 32 + 95 + 59 + 311 = 497\nAccommodation minimum nights: 2/2\n\nDays: 3\nCurrent City: from Norfolk (Virginia) to Lynchburg (Virginia)\nTransportation: Self-driving, from Norfolk to Lynchburg, duration: 3 hours 27 mins, distance: 306 km, cost: 15\nBreakfast: Jonathan's Kitchen - Holiday Inn Express & Suites, Norfolk (Virginia), cost: 44, cuisines: Tea, Seafood, BBQ, Fast Food\nAttraction: Amazement Square, Lynchburg (Virginia); Point of Honor, Lynchburg (Virginia)\nLunch: Uptown Vietnam cuisine, Lynchburg (Virginia), cost: 63, cuisines: Cafe, Bakery, Indian, Seafood\nDinner: The BrewMaster, Lynchburg (Virginia), cost: 87, cuisines: Tea, Chinese, BBQ, Fast Food\nAccommodation: Design Hideaway in a Classic Brooklyn Townhouse, Lynchburg (Virginia), cost: 216.0, room type: Entire home/apt, house rules: No smoking, minimum nights: 1.0, maximum occupancy: 3\n\nNumber of people: 1\nTotal cost: 15 + 44 + 63 + 87 + 216 = 425\nAccommodation minimum nights: 1/1\n\nDays: 4\nCurrent City: Lynchburg (Virginia)\nTransportation: -\nBreakfast: Bean Here, Lynchburg (Virginia), cost: 74, cuisines: Tea, Indian, BBQ, Fast Food\nAttraction: The Anne Spencer House & Garden Museum, Lynchburg (Virginia); Lynchburg Museum, Lynchburg (Virginia)\nLunch: Pirates Of Grill, Lynchburg (Virginia), cost: 71, cuisines: Tea, Pizza, American, Seafood\nDinner: Mochamania, Lynchburg (Virginia), cost: 87, cuisines: Tea, Chinese, Fast Food, Seafood\nAccommodation: Design Hideaway in a Classic Brooklyn Townhouse, Lynchburg (Virginia), cost: 216.0, room type: Entire home/apt, house rules: No smoking, minimum nights: 1.0, maximum occupancy: 3\n\nNumber of people: 1\nTotal cost: 74 + 71 + 87 + 216 = 448\nAccommodation minimum nights: 2/2\n\nDays: 5\nCurrent City: from Lynchburg (Virginia) to Washington\nTransportation: Self-driving, from Lynchburg to Washington, duration: 3 hours 19 mins, distance: 291 km, cost: 14\nBreakfast: Khyen Chyen, Lynchburg (Virginia), cost: 30, cuisines: Cafe, Bakery, Mediterranean, Desserts\nAttraction: -\nLunch: -\nDinner: -\nAccommodation: -\n\nNumber of people: 1\nTotal cost: 14 + 30 = 44\n\nTotal cost across all days: 446 + 497 + 425 + 448 + 44 = 1860\nCuisines: The prompt specifies no particular cuisine, so all cuisine constraints are satisfied.", "gpt-4-1106-preview_direct_sole-planning_parsed_results": [{"day": 1, "current_city": "from Washington to Norfolk", "transportation": "Flight Number: F3783935, from Washington to Norfolk, Departure Time: 13:33, Arrival Time: 14:16", "breakfast": "-", "attraction": "Norfolk Botanical Garden, Norfolk;", "lunch": "-", "dinner": "Henry Campbell's Steakhouse, Norfolk", "accommodation": "Simple Spacious RM near Queens Center Mall & NYPD, Norfolk"}, {"day": 2, "current_city": "Norfolk", "transportation": "-", "breakfast": "Sonya Bakery Cafe, Norfolk", "attraction": "Nauticus, Norfolk; Chrysler Museum of Art, Norfolk;", "lunch": "Sunshine Family Restaurant, Norfolk", "dinner": "Game n Grillz, Norfolk", "accommodation": "Simple Spacious RM near Queens Center Mall & NYPD, Norfolk"}, {"day": 3, "current_city": "from Norfolk to Lynchburg", "transportation": "Self-driving, from Norfolk to Lynchburg, duration: 3 hours 27 mins, distance: 306 km", "breakfast": "Jonathan's Kitchen - Holiday Inn Express & Suites, Norfolk", "attraction": "Amazement Square, Lynchburg; Point of Honor, Lynchburg;", "lunch": "Uptown Vietnam cuisine, Lynchburg", "dinner": "The BrewMaster, Lynchburg", "accommodation": "Design Hideaway in a Classic Brooklyn Townhouse, Lynchburg"}, {"day": 4, "current_city": "Lynchburg", "transportation": "-", "breakfast": "Bean Here, Lynchburg", "attraction": "The Anne Spencer House & Garden Museum, Lynchburg; Lynchburg Museum, Lynchburg;", "lunch": "Pirates Of Grill, Lynchburg", "dinner": "Mochamania, Lynchburg", "accommodation": "Design Hideaway in a Classic Brooklyn Townhouse, Lynchburg"}, {"day": 5, "current_city": "from Lynchburg to Washington", "transportation": "Self-driving, from Lynchburg to Washington, duration: 3 hours 19 mins, distance: 291 km", "breakfast": "Khyen Chyen, Lynchburg", "attraction": "-", "lunch": "-", "dinner": "-", "accommodation": "-"}]}]