[{"gpt-4-1106-preview_direct_sole-planning_results": "Travel Plan:\n\nDays: 1,\nCurrent City: from Daytona Beach to Atlanta,\nTransportation: Taxi, from Daytona Beach to Atlanta, duration: 6 hours 18 mins, distance: 696 km, cost: 696\nBreakfast: -,\nAttraction: -,\nLunch: -,\nDinner: Saffron, Atlanta, cost: 39, cuisines: \u201cTea, Cafe, Fast Food, Seafood\u201d\nAccommodation: Bright, Modern, Clean, Spacious, Brooklyn Home, Atlanta, cost: 1034, room type: Entire home/apt, house rules: No children under 10, minimum nights: 3, maximum occupancy: 4\n\nNumber of people = 3\nTotal cost = 696 * 3 + 39 * 3 + 1034 = 3,183\nAccommodation minimum nights: 1/3\n\n(Note: The total cost exceeds the budget on the first day due to the high taxi cost and accommodation price. Adjustments will be made in the following days to stay within budget.)\n\nDays: 2,\nCurrent City: Atlanta,\nTransportation: -,\nBreakfast: Adda, Atlanta, cost: 22, cuisines: \u201cTea, Mexican, Bakery\u201d\nAttraction: Atlanta Botanical Garden, Atlanta; Georgia Aquarium, Atlanta,\nLunch: Daawat-e-Kashmir, Atlanta, cost: 19, cuisines: \u201cCafe, Pizza, American, Seafood\u201d\nDinner: Chef Style, Atlanta, cost: 59, cuisines: \u201cPizza, American, Desserts, Seafood\u201d\nAccommodation: Bright, Modern, Clean, Spacious, Brooklyn Home, Atlanta, cost: 1034, room type: Entire home/apt, house rules: No children under 10, minimum nights: 3, maximum occupancy: 4\n\nNumber of people = 3\nTotal cost = (22 + 19 + 59) * 3 + 1034 = 1,317\nAccommodation minimum nights: 2/3\n\nDays: 3,\nCurrent City: from Atlanta to Daytona Beach,\nTransportation: Self-driving, from Atlanta to Daytona Beach, duration: 6 hours 20 mins, distance: 706 km, cost: 35\nBreakfast: The Chinese & Thai Restaurant, Atlanta, cost: 57, cuisines: \u201cDesserts, Tea, Italian, Bakery, Fast Food\u201d\nAttraction: -,\nLunch: -,\nDinner: -,\nAccommodation: -\n\nNumber of people = 3\nTotal cost = 35 * 3 + 57 * 3 = 276\n\nTotal cost across all days = 3,183 + 1,317 + 276 = 4,776\n\n(Note: The total cost significantly exceeds the budget. To stay within the budget, we need to find cheaper transportation and accommodation options.)\n\nRevised Travel Plan:\n\nDays: 1,\nCurrent City: from Daytona Beach to Atlanta,\nTransportation: Self-driving, from Daytona Beach to Atlanta, duration: 6 hours 18 mins, distance: 696 km, cost: 34\nBreakfast: -,\nAttraction: -,\nLunch: -,\nDinner: Saffron, Atlanta, cost: 39, cuisines: \u201cTea, Cafe, Fast Food, Seafood\u201d\nAccommodation: Charming Carroll Gardens 2 BR, Atlanta, cost: 576, room type: Entire home/apt, house rules: No parties, minimum nights: 1, maximum occupancy: 4\n\nNumber of people = 3\nTotal cost = 34 * 3 + 39 * 3 + 576 = 711\nAccommodation minimum nights: 1/1\n\nDays: 2,\nCurrent City: Atlanta,\nTransportation: -,\nBreakfast: Adda, Atlanta, cost: 22, cuisines: \u201cTea, Mexican, Bakery\u201d\nAttraction: Atlanta Botanical Garden, Atlanta; Georgia Aquarium, Atlanta,\nLunch: Daawat-e-Kashmir, Atlanta, cost: 19, cuisines: \u201cCafe, Pizza, American, Seafood\u201d\nDinner: Chef Style, Atlanta, cost: 59, cuisines: \u201cPizza, American, Desserts, Seafood\u201d\nAccommodation: Charming Carroll Gardens 2 BR, Atlanta, cost: 576, room type: Entire home/apt, house rules: No parties, minimum nights: 1, maximum occupancy: 4\n\nNumber of people = 3\nTotal cost = (22 + 19 + 59) * 3 + 576 = 849\nAccommodation minimum nights: 2/1\n\nDays: 3,\nCurrent City: from Atlanta to Daytona Beach,\nTransportation: Self-driving, from Atlanta to Daytona Beach, duration: 6 hours 20 mins, distance: 706 km, cost: 35\nBreakfast: The Chinese & Thai Restaurant, Atlanta, cost: 57, cuisines: \u201cDesserts, Tea, Italian, Bakery, Fast Food\u201d\nAttraction: -,\nLunch: -,\nDinner: -,\nAccommodation: -\n\nNumber of people = 3\nTotal cost = 35 * 3 + 57 * 3 = 276\n\nTotal cost across all days = 711 + 849 + 276 = 1,836\n\n(Note: The revised travel plan stays within the budget of $2,100 and meets the requirements for accommodations and transportation without flights.)", "gpt-4-1106-preview_direct_sole-planning_parsed_results": [{"day": 1, "current_city": "from Daytona Beach to Atlanta", "transportation": "Self-driving, from Daytona Beach to Atlanta, duration: 6 hours 18 mins, distance: 696 km", "breakfast": "-", "attraction": "-", "lunch": "-", "dinner": "Saffron, Atlanta", "accommodation": "Charming Carroll Gardens 2 BR, Atlanta"}, {"day": 2, "current_city": "Atlanta", "transportation": "-", "breakfast": "Adda, Atlanta", "attraction": "Atlanta Botanical Garden, Atlanta;Georgia Aquarium, Atlanta;", "lunch": "Daawat-e-Kashmir, Atlanta", "dinner": "Chef Style, Atlanta", "accommodation": "Charming Carroll Gardens 2 BR, Atlanta"}, {"day": 3, "current_city": "from Atlanta to Daytona Beach", "transportation": "Self-driving, from Atlanta to Daytona Beach, duration: 6 hours 20 mins, distance: 706 km", "breakfast": "The Chinese & Thai Restaurant, Atlanta", "attraction": "-", "lunch": "-", "dinner": "-", "accommodation": "-"}]}]