[{"gpt-4-1106-preview_direct_sole-planning_results": "Travel Plan:\n\nDays: 1,\nCurrent City: from Baton Rouge to Abilene (Texas),\nTransportation: Taxi, from Baton Rouge to Abilene, duration: 8 hours 50 mins, distance: 976 km, cost: 976\nBreakfast: -,\nAttraction: -,\nLunch: -,\nDinner: Thai Garden, Abilene (Texas), cost: 26, cuisines: \u201cCafe, American, Desserts\u201d\nAccommodation: Apartment minutes from manhattan, Abilene (Texas), cost: 295, room type: Entire home/apt, house rules: No pets & No visitors, minimum nights: 2, maximum occupancy: 2\n\nNumber of people = 2\nTotal cost = 976 + (26 * 2) + 295 = 1,323\nAccommodation minimum nights: 1/2\n\nDays: 2,\nCurrent City: Abilene (Texas),\nTransportation: -,\nBreakfast: Crispy Crust, Abilene (Texas), cost: 54, cuisines: \u201cDesserts, Bakery, Cafe, American, Seafood\u201d\nAttraction: The Grace Museum, Abilene (Texas); Frontier Texas!, Abilene (Texas);,\nLunch: Finger Licious, Abilene (Texas), cost: 35, cuisines: \u201cFast Food, Cafe, BBQ, Seafood\u201d\nDinner: LPK Waterfront, Abilene (Texas), cost: 61, cuisines: \u201cPizza, Italian, BBQ, Fast Food, Seafood\u201d\nAccommodation: Apartment minutes from manhattan, Abilene (Texas), cost: 295, room type: Entire home/apt, house rules: No pets & No visitors, minimum nights: 2, maximum occupancy: 2\n\nNumber of people = 2\nTotal cost = (54 + 35 + 61) * 2 + 295 = 595\nAccommodation minimum nights: 2/2 (Done!)\n\nDays: 3,\nCurrent City: from Abilene (Texas) to Amarillo (Texas),\nTransportation: Taxi, from Abilene to Amarillo, duration: 4 hours 10 mins, distance: 446 km, cost: 446\nBreakfast: -,\nAttraction: -,\nLunch: -,\nDinner: The Cinnamon Kitchen, Amarillo (Texas), cost: 69, cuisines: \u201cDesserts, Tea, Pizza, Chinese, Seafood\u201d\nAccommodation: Harlem Humble Abode - 1 bedroom - Cute and Quaint, Amarillo (Texas), cost: 409, room type: Entire home/apt, house rules: No pets, minimum nights: 5, maximum occupancy: 3\n\nNumber of people = 2\nTotal cost = 446 + (69 * 2) + 409 = 993\nAccommodation minimum nights: 1/5\n\nDays: 4,\nCurrent City: Amarillo (Texas),\nTransportation: -,\nBreakfast: Wood Box Cafe, Amarillo (Texas), cost: 11, cuisines: \u201cDesserts, French, Fast Food, Cafe, American\u201d\nAttraction: Cadillac Ranch, Amarillo (Texas); Amarillo Botanical Gardens, Amarillo (Texas);,\nLunch: Sigree Global Grill, Amarillo (Texas), cost: 35, cuisines: \u201cChinese, BBQ, Cafe, Desserts\u201d\nDinner: Anand Restaurant, Amarillo (Texas), cost: 53, cuisines: \u201cFast Food, Seafood, Desserts, Italian\u201d\nAccommodation: Harlem Humble Abode - 1 bedroom - Cute and Quaint, Amarillo (Texas), cost: 409, room type: Entire home/apt, house rules: No pets, minimum nights: 5, maximum occupancy: 3\n\nNumber of people = 2\nTotal cost = (11 + 35 + 53) * 2 + 409 = 607\nAccommodation minimum nights: 2/5\n\nDays: 5,\nCurrent City: from Amarillo (Texas) to Baton Rouge,\nTransportation: Taxi, from Amarillo to Baton Rouge, duration: 11 hours 42 mins, distance: 1,270 km, cost: 1270\nBreakfast: -,\nAttraction: -,\nLunch: -,\nDinner: -,\nAccommodation: -\n\nNumber of people = 2\nTotal cost = 1270 * 2 = 2540\n\nTotal cost across all days = 1,323 + 595 + 993 + 607 + 2540 = 6,058\n\nNote: The total cost exceeds the budget of $2,900. Adjustments are needed to meet the budget constraint. Possible adjustments include changing the mode of transportation to self-driving, which is significantly cheaper, and selecting different accommodations that are pet-friendly and within budget. Additionally, the accommodation on Day 3 does not meet the pet-friendly requirement. Here is an adjusted plan:\n\nAdjusted Travel Plan:\n\nDays: 1,\nCurrent City: from Baton Rouge to Abilene (Texas),\nTransportation: Self-driving, from Baton Rouge to Abilene, duration: 8 hours 50 mins, distance: 976 km, cost: 48\nBreakfast: -,\nAttraction: -,\nLunch: -,\nDinner: Thai Garden, Abilene (Texas), cost: 26, cuisines: \u201cCafe, American, Desserts\u201d\nAccommodation: Joyce and Donovan's, Room for One, Abilene (Texas), cost: 83, room type: Private room, house rules: No parties, minimum nights: 25, maximum occupancy: 2\n\nNumber of people = 2\nTotal cost = 48 + (26 * 2) + 83 = 183\nAccommodation minimum nights: 1/25\n\nDays: 2,\nCurrent City: Abilene (Texas),\nTransportation: -,\nBreakfast: Crispy Crust, Abilene (Texas), cost: 54, cuisines: \u201cDesserts, Bakery, Cafe, American, Seafood\u201d\nAttraction: The Grace Museum, Abilene (Texas); Frontier Texas!, Abilene (Texas);,\nLunch: Finger Licious, Abilene (Texas), cost: 35, cuisines: \u201cFast Food, Cafe, BBQ, Seafood\u201d\nDinner: LPK Waterfront, Abilene (Texas), cost: 61, cuisines: \u201cPizza, Italian, BBQ, Fast Food, Seafood\u201d\nAccommodation: Joyce and Donovan's, Room for One, Abilene (Texas), cost: 83, room type: Private room, house rules: No parties, minimum nights: 25, maximum occupancy: 2\n\nNumber of people = 2\nTotal cost = (54 + 35 + 61) * 2 + 83 = 383\nAccommodation minimum nights: 2/25\n\nDays: 3,\nCurrent City: from Abilene (Texas) to Amarillo (Texas),\nTransportation: Self-driving, from Abilene to Amarillo, duration: 4 hours 10 mins, distance: 446 km, cost: 22\nBreakfast: -,\nAttraction: -,\nLunch: -,\nDinner: The Cinnamon Kitchen, Amarillo (Texas), cost: 69, cuisines: \u201cDesserts, Tea, Pizza, Chinese, Seafood\u201d\nAccommodation: Harlem Humble Abode - 1 bedroom - Cute and Quaint, Amarillo (Texas), cost: 409, room type: Entire home/apt, house rules: No pets, minimum nights: 5, maximum occupancy: 3\n\nNumber of people = 2\nTotal cost = 22 + (69 * 2) + 409 = 569\nAccommodation minimum nights: 1/5\n\nDays: 4,\nCurrent City: Amarillo (Texas),\nTransportation: -,\nBreakfast: Wood Box Cafe, Amarillo (Texas), cost: 11, cuisines: \u201cDesserts, French, Fast Food, Cafe, American\u201d\nAttraction: Cadillac Ranch, Amarillo (Texas); Amarillo Botanical Gardens, Amarillo (Texas);,\nLunch: Sigree Global Grill, Amarillo (Texas), cost: 35, cuisines: \u201cChinese, BBQ, Cafe, Desserts\u201d\nDinner: Anand Restaurant, Amarillo (Texas), cost: 53, cuisines: \u201cFast Food, Seafood, Desserts, Italian\u201d\nAccommodation: Harlem Humble Abode - 1 bedroom - Cute and Quaint, Amarillo (Texas), cost: 409, room type: Entire home/apt, house rules: No pets, minimum nights: 5, maximum occupancy: 3\n\nNumber of people = 2\nTotal cost = (11 + 35 + 53) * 2 + 409 = 607\nAccommodation minimum nights: 2/5\n\nDays: 5,\nCurrent City: from Amarillo (Texas) to Baton Rouge,\nTransportation: Self-driving, from Amarillo to Baton Rouge, duration: 11 hours 42 mins, distance: 1,270 km, cost: 63\nBreakfast: -,\nAttraction: -,\nLunch: -,\nDinner: -,\nAccommodation: -\n\nNumber of people = 2\nTotal cost = 63 * 2 = 126\n\nTotal cost across all days = 183 + 383 + 569 + 607 + 126 = 1,868\n\nCuisines: The prompt specifies no cuisines, so all cuisine constraints are satisfied.\nHouse rules: The accommodations chosen do not disallow pets, except for the Harlem Humble Abode. An alternative pet-friendly accommodation should be selected in Amarillo to meet the house rules requirement.", "gpt-4-1106-preview_direct_sole-planning_parsed_results": [{"day": 1, "current_city": "from Baton Rouge to Abilene (Texas)", "transportation": "Taxi, from Baton Rouge to Abilene, duration: 8 hours 50 mins, distance: 976 km", "breakfast": "-", "attraction": "-", "lunch": "-", "dinner": "Thai Garden, Abilene (Texas)", "accommodation": "Apartment minutes from manhattan, Abilene (Texas)"}, {"day": 2, "current_city": "Abilene (Texas)", "transportation": "-", "breakfast": "Crispy Crust, Abilene (Texas)", "attraction": "The Grace Museum, Abilene (Texas);Frontier Texas!, Abilene (Texas);", "lunch": "Finger Licious, Abilene (Texas)", "dinner": "LPK Waterfront, Abilene (Texas)", "accommodation": "Apartment minutes from manhattan, Abilene (Texas)"}, {"day": 3, "current_city": "from Abilene (Texas) to Amarillo (Texas)", "transportation": "Taxi, from Abilene to Amarillo, duration: 4 hours 10 mins, distance: 446 km", "breakfast": "-", "attraction": "-", "lunch": "-", "dinner": "The Cinnamon Kitchen, Amarillo (Texas)", "accommodation": "Harlem Humble Abode - 1 bedroom - Cute and Quaint, Amarillo (Texas)"}, {"day": 4, "current_city": "Amarillo (Texas)", "transportation": "-", "breakfast": "Wood Box Cafe, Amarillo (Texas)", "attraction": "Cadillac Ranch, Amarillo (Texas);Amarillo Botanical Gardens, Amarillo (Texas);", "lunch": "Sigree Global Grill, Amarillo (Texas)", "dinner": "Anand Restaurant, Amarillo (Texas)", "accommodation": "Harlem Humble Abode - 1 bedroom - Cute and Quaint, Amarillo (Texas)"}, {"day": 5, "current_city": "from Amarillo (Texas) to Baton Rouge", "transportation": "Taxi, from Amarillo to Baton Rouge, duration: 11 hours 42 mins, distance: 1,270 km", "breakfast": "-", "attraction": "-", "lunch": "-", "dinner": "-", "accommodation": "-"}, {"day": 1, "current_city": "from Baton Rouge to Abilene (Texas)", "transportation": "Self-driving, from Baton Rouge to Abilene, duration: 8 hours 50 mins, distance: 976 km", "breakfast": "-", "attraction": "-", "lunch": "-", "dinner": "Thai Garden, Abilene (Texas)", "accommodation": "Joyce and Donovan's, Room for One, Abilene (Texas)"}, {"day": 2, "current_city": "Abilene (Texas)", "transportation": "-", "breakfast": "Crispy Crust, Abilene (Texas)", "attraction": "The Grace Museum, Abilene (Texas);Frontier Texas!, Abilene (Texas);", "lunch": "Finger Licious, Abilene (Texas)", "dinner": "LPK Waterfront, Abilene (Texas)", "accommodation": "Joyce and Donovan's, Room for One, Abilene (Texas)"}, {"day": 3, "current_city": "from Abilene (Texas) to Amarillo (Texas)", "transportation": "Self-driving, from Abilene to Amarillo, duration: 4 hours 10 mins, distance: 446 km", "breakfast": "-", "attraction": "-", "lunch": "-", "dinner": "The Cinnamon Kitchen, Amarillo (Texas)", "accommodation": "Harlem Humble Abode - 1 bedroom - Cute and Quaint, Amarillo (Texas)"}, {"day": 4, "current_city": "Amarillo (Texas)", "transportation": "-", "breakfast": "Wood Box Cafe, Amarillo (Texas)", "attraction": "Cadillac Ranch, Amarillo (Texas);Amarillo Botanical Gardens, Amarillo (Texas);", "lunch": "Sigree Global Grill, Amarillo (Texas)", "dinner": "Anand Restaurant, Amarillo (Texas)", "accommodation": "Harlem Humble Abode - 1 bedroom - Cute and Quaint, Amarillo (Texas)"}, {"day": 5, "current_city": "from Amarillo (Texas) to Baton Rouge", "transportation": "Self-driving, from Amarillo to Baton Rouge, duration: 11 hours 42 mins, distance: 1,270 km", "breakfast": "-", "attraction": "-", "lunch": "-", "dinner": "-", "accommodation": "-"}]}]