[{"gpt-4-1106-preview_direct_sole-planning_results": "Travel Plan:\n\nDays: 1,\nCurrent City: from La Crosse to Moline (Illinois),\nTransportation: Self-driving, from La Crosse to Moline, duration: 3 hours 34 mins, distance: 310 km, cost: 15\nBreakfast: -,\nAttraction: -,\nLunch: -,\nDinner: Royal Hotel, Moline (Illinois), cost: 74, cuisines: \u201cTea, Pizza, Mexican, Chinese, Seafood\u201d\nAccommodation: Sunny duplex near Central Park, Moline (Illinois), cost: 541, room type: Entire home/apt, house rules: No pets, minimum nights: 1, maximum occupancy: 5\n\nNumber of people = 5\nTotal cost = 15 * 5 + 74 * 5 + 541 = 1,205\nAccommodation minimum nights: 1/1\n\nDays: 2,\nCurrent City: Moline (Illinois),\nTransportation: -,\nBreakfast: Lovecrumbs Bakery, Moline (Illinois), cost: 24, cuisines: \u201cTea, Pizza, American, Desserts\u201d\nAttraction: John Deere Pavilion, Moline (Illinois); Celebration River Cruises, Moline (Illinois),\nLunch: ZASTY, Moline (Illinois), cost: 82, cuisines: \u201cPizza, Indian, BBQ, Cafe, American, Seafood\u201d\nDinner: Cafe Coffee Day, Moline (Illinois), cost: 89, cuisines: \u201cPizza, French, Fast Food, Cafe, Indian, Seafood\u201d\nAccommodation: Sunny duplex near Central Park, Moline (Illinois), cost: 541, room type: Entire home/apt, house rules: No pets, minimum nights: 1, maximum occupancy: 5\n\nNumber of people = 5\nTotal cost = (24 + 82 + 89) * 5 + 541 = 1,600\nAccommodation minimum nights: 2/1\n\nDays: 3,\nCurrent City: from Moline (Illinois) to Rockford (Illinois),\nTransportation: Self-driving, from Moline to Rockford, duration: 2 hours 1 min, distance: 194 km, cost: 9\nBreakfast: Hucka, Moline (Illinois), cost: 29, cuisines: \u201cDesserts, Tea, Pizza, Fast Food, American\u201d\nAttraction: -,\nLunch: -,\nDinner: Coco Bambu, Rockford (Illinois), cost: 72, cuisines: \u201cTea, French, Bakery, BBQ, Cafe\u201d\nAccommodation: Park Side Zen Home - Terrace & next to CentralPark, Rockford (Illinois), cost: 250, room type: Entire home/apt, house rules: No children under 10, minimum nights: 3, maximum occupancy: 3\n\nNumber of people = 5\nTotal cost = 9 * 5 + 29 * 5 + 72 * 5 + 250 * 2 = 1,005\nAccommodation minimum nights: 1/3\n\nDays: 4,\nCurrent City: Rockford (Illinois),\nTransportation: -,\nBreakfast: Flying Mango, Rockford (Illinois), cost: 20, cuisines: \u201cAmerican, BBQ, Seafood\u201d\nAttraction: Anderson Japanese Gardens, Rockford (Illinois); Discovery Center Museum, Rockford (Illinois),\nLunch: Cafe Southall, Rockford (Illinois), cost: 56, cuisines: \u201cSeafood, Pizza, Cafe, Fast Food\u201d\nDinner: Aroma Rest O Bar, Rockford (Illinois), cost: 58, cuisines: \u201cBakery, Fast Food, Chinese, American, Seafood\u201d\nAccommodation: Park Side Zen Home - Terrace & next to CentralPark, Rockford (Illinois), cost: 250, room type: Entire home/apt, house rules: No children under 10, minimum nights: 3, maximum occupancy: 3\n\nNumber of people = 5\nTotal cost = (20 + 56 + 58) * 5 + 250 * 2 = 1,170\nAccommodation minimum nights: 2/3\n\nDays: 5,\nCurrent City: Rockford (Illinois),\nTransportation: -,\nBreakfast: Nutri Punch, Rockford (Illinois), cost: 34, cuisines: \u201cTea, Chinese, Cafe, Desserts\u201d\nAttraction: Burpee Museum of Natural History, Rockford (Illinois); Sinnissippi Park, Rockford (Illinois),\nLunch: Eggspectation - Jaypee Vasant Continental, Rockford (Illinois), cost: 77, cuisines: \u201cTea, Mediterranean, Seafood\u201d\nDinner: Mirchievous, Rockford (Illinois), cost: 64, cuisines: \u201cAmerican, Indian, BBQ, Seafood\u201d\nAccommodation: Park Side Zen Home - Terrace & next to CentralPark, Rockford (Illinois), cost: 250, room type: Entire home/apt, house rules: No children under 10, minimum nights: 3, maximum occupancy: 3\n\nNumber of people = 5\nTotal cost = (34 + 77 + 64) * 5 + 250 * 2 = 1,275\nAccommodation minimum nights: 3/3\n\nDays: 6,\nCurrent City: from Rockford (Illinois) to Belleville (Illinois),\nTransportation: Self-driving, from Rockford to Belleville, duration: 4 hours 29 mins, distance: 470 km, cost: 23\nBreakfast: Dunkin' Donuts, Rockford (Illinois), cost: 24, cuisines: \u201cCafe, Bakery, BBQ, Seafood\u201d\nAttraction: -,\nLunch: -,\nDinner: Fuji Japanese Steak House, Belleville (Illinois), cost: 70, cuisines: \u201cBakery, Indian, Cafe\u201d\nAccommodation: Historic Manhattan Home to make your stay special!, Belleville (Illinois), cost: 523, room type: Entire home/apt, house rules: No visitors, minimum nights: 2, maximum occupancy: 3\n\nNumber of people = 5\nTotal cost = 23 * 5 + 24 * 5 + 70 * 5 + 523 = 1,160\nAccommodation minimum nights: 1/2\n\nDays: 7,\nCurrent City: from Belleville (Illinois) to La Crosse,\nTransportation: Self-driving, from Belleville to La Crosse, duration: 7 hours 19 mins, distance: 792 km, cost: 39\nBreakfast: Summer Pavilion, Belleville (Illinois), cost: 150, cuisines: \u201cCafe, Desserts, Bakery, BBQ\u201d\nAttraction: -,\nLunch: -,\nDinner: -,\nAccommodation: -\n\nNumber of people = 5\nTotal cost = 39 * 5 + 150 * 5 = 945\n\nTotal cost across all days = 1,205 + 1,600 + 1,005 + 1,170 + 1,275 + 1,160 + 945 = 8,360 (Over Budget)\n\n**Adjustments Required:**\n- The total cost exceeds the budget of $4,800. We need to make adjustments to the plan.\n- We need to ensure accommodations are suitable for children under 10, which means we cannot book \"Park Side Zen Home - Terrace & next to CentralPark\" in Rockford.\n- We need to find alternative accommodations in Rockford that allow children under 10 and fit within the budget constraints.\n- We need to reduce costs on meals or attractions to stay within budget.\n- We may need to consider cheaper transportation options or reduce the number of attractions visited.\n\n**Note:** Due to the complexity of the constraints and the budget overage, this travel plan requires significant adjustments and cannot be considered final. Please review the available options and make necessary changes to align with the budget and accommodation requirements.", "gpt-4-1106-preview_direct_sole-planning_parsed_results": [{"day": 1, "current_city": "from La Crosse to Moline (Illinois)", "transportation": "Self-driving, from La Crosse to Moline, duration: 3 hours 34 mins, distance: 310 km", "breakfast": "-", "attraction": "-", "lunch": "-", "dinner": "Royal Hotel, Moline (Illinois)", "accommodation": "Sunny duplex near Central Park, Moline (Illinois)"}, {"day": 2, "current_city": "Moline (Illinois)", "transportation": "-", "breakfast": "Lovecrumbs Bakery, Moline (Illinois)", "attraction": "John Deere Pavilion, Moline (Illinois);Celebration River Cruises, Moline (Illinois);", "lunch": "ZASTY, Moline (Illinois)", "dinner": "Cafe Coffee Day, Moline (Illinois)", "accommodation": "Sunny duplex near Central Park, Moline (Illinois)"}, {"day": 3, "current_city": "from Moline (Illinois) to Rockford (Illinois)", "transportation": "Self-driving, from Moline to Rockford, duration: 2 hours 1 min, distance: 194 km", "breakfast": "Hucka, Moline (Illinois)", "attraction": "-", "lunch": "-", "dinner": "Coco Bambu, Rockford (Illinois)", "accommodation": "Park Side Zen Home - Terrace & next to CentralPark, Rockford (Illinois)"}, {"day": 4, "current_city": "Rockford (Illinois)", "transportation": "-", "breakfast": "Flying Mango, Rockford (Illinois)", "attraction": "Anderson Japanese Gardens, Rockford (Illinois);Discovery Center Museum, Rockford (Illinois);", "lunch": "Cafe Southall, Rockford (Illinois)", "dinner": "Aroma Rest O Bar, Rockford (Illinois)", "accommodation": "Park Side Zen Home - Terrace & next to CentralPark, Rockford (Illinois)"}, {"day": 5, "current_city": "Rockford (Illinois)", "transportation": "-", "breakfast": "Nutri Punch, Rockford (Illinois)", "attraction": "Burpee Museum of Natural History, Rockford (Illinois);Sinnissippi Park, Rockford (Illinois);", "lunch": "Eggspectation - Jaypee Vasant Continental, Rockford (Illinois)", "dinner": "Mirchievous, Rockford (Illinois)", "accommodation": "Park Side Zen Home - Terrace & next to CentralPark, Rockford (Illinois)"}, {"day": 6, "current_city": "from Rockford (Illinois) to Belleville (Illinois)", "transportation": "Self-driving, from Rockford to Belleville, duration: 4 hours 29 mins, distance: 470 km", "breakfast": "Dunkin' Donuts, Rockford (Illinois)", "attraction": "-", "lunch": "-", "dinner": "Fuji Japanese Steak House, Belleville (Illinois)", "accommodation": "Historic Manhattan Home to make your stay special!, Belleville (Illinois)"}, {"day": 7, "current_city": "from Belleville (Illinois) to La Crosse", "transportation": "Self-driving, from Belleville to La Crosse, duration: 7 hours 19 mins, distance: 792 km", "breakfast": "Summer Pavilion, Belleville (Illinois)", "attraction": "-", "lunch": "-", "dinner": "-", "accommodation": "-"}]}]