[{"gpt-4-1106-preview_direct_sole-planning_results": "Travel Plan:\n\nDays: 1,\nCurrent City: from Punta Gorda to Pellston (Michigan),\nTransportation: Taxi, from Punta Gorda to Pellston, duration: 21 hours 40 mins, distance: 2,457 km, cost: 2457\nBreakfast: -,\nAttraction: -,\nLunch: -,\nDinner: Johnnie Mars, Pellston (Michigan), cost: 33, cuisines: \u201cTea, Fast Food\u201d\nAccommodation: Beautiful apartment ~25min from Times Square, Pellston (Michigan), cost: 571, room type: Entire home/apt, house rules: No smoking & No visitors, minimum nights: 5, maximum occupancy: 5\n\nNumber of people = 3\nTotal cost = 2457 + 33 * 3 + 571 = 3127\nAccommodation minimum nights: 1/5\n\nDays: 2,\nCurrent City: Pellston (Michigan),\nTransportation: -,\nBreakfast: Aroos Damascus, Pellston (Michigan), cost: 44, cuisines: \u201cDesserts, Tea, Italian, Cafe, American\u201d\nAttraction: Pellston Pioneer Park, Pellston (Michigan),\nLunch: The Square Meal, Pellston (Michigan), cost: 25, cuisines: \u201cDesserts, Tea, BBQ, American, Mediterranean, Seafood\u201d\nDinner: Flame & Grill, Pellston (Michigan), cost: 23, cuisines: \u201cBakery, BBQ\u201d\nAccommodation: Beautiful apartment ~25min from Times Square, Pellston (Michigan), cost: 571, room type: Entire home/apt, house rules: No smoking & No visitors, minimum nights: 5, maximum occupancy: 5\n\nNumber of people = 3\nTotal cost = (44 + 25 + 23) * 3 + 571 = 800\nAccommodation minimum nights: 2/5\n\nDays: 3,\nCurrent City: from Pellston to Traverse City (Michigan),\nTransportation: Taxi, from Pellston to Traverse City, duration: 1 hour 49 mins, distance: 137 km, cost: 137\nBreakfast: -,\nAttraction: Clinch Park, Traverse City (Michigan),\nLunch: Daily Eats, Traverse City (Michigan), cost: 44, cuisines: \u201cDesserts, Seafood\u201d\nDinner: French Toast, Traverse City (Michigan), cost: 18, cuisines: \u201cPizza, Desserts\u201d\nAccommodation: Heart of Soho! Cute studio with clean finishes!, Traverse City (Michigan), cost: 969, room type: Entire home/apt, house rules: No parties, minimum nights: 4, maximum occupancy: 2\n\nNumber of people = 3\nTotal cost = 137 + (44 + 18) * 3 + 969 = 1272\nAccommodation minimum nights: 1/4\n\nDays: 4,\nCurrent City: Traverse City (Michigan),\nTransportation: -,\nBreakfast: India on my Plate - Fortune Select Excalibur, Traverse City (Michigan), cost: 53, cuisines: \u201cTea, Chinese, Seafood\u201d\nAttraction: Great Lakes Children's Museum, Traverse City (Michigan),\nLunch: Tasty But Healthy, Traverse City (Michigan), cost: 77, cuisines: \u201cFast Food, Cafe, Bakery, Seafood\u201d\nDinner: Dragonfly, Traverse City (Michigan), cost: 69, cuisines: \u201cTea, Italian, French, BBQ, Seafood\u201d\nAccommodation: Heart of Soho! Cute studio with clean finishes!, Traverse City (Michigan), cost: 969, room type: Entire home/apt, house rules: No parties, minimum nights: 4, maximum occupancy: 2\n\nNumber of people = 3\nTotal cost = (53 + 77 + 69) * 3 + 969 = 1419\nAccommodation minimum nights: 2/4\n\nDays: 5,\nCurrent City: from Traverse City to Alpena (Michigan),\nTransportation: Taxi, from Traverse City to Alpena, duration: 2 hours 29 mins, distance: 204 km, cost: 204\nBreakfast: -,\nAttraction: Great Lakes Maritime Heritage Center, Alpena (Michigan),\nLunch: @Mango, Alpena (Michigan), cost: 38, cuisines: \u201cBBQ, Cafe, American, Desserts\u201d\nDinner: Maplai, Alpena (Michigan), cost: 63, cuisines: \u201cTea, Indian, Bakery, Fast Food, American\u201d\nAccommodation: Ultimate 50th Floor Downtown Penthouse - 4000SqFt, Alpena (Michigan), cost: 1043, room type: Entire home/apt, house rules: No smoking & No visitors & No children under 10, minimum nights: 2, maximum occupancy: 9\n\nNumber of people = 3\nTotal cost = 204 + (38 + 63) * 3 + 1043 = 1492\nAccommodation minimum nights: 1/2\n\nDays: 6,\nCurrent City: Alpena (Michigan),\nTransportation: -,\nBreakfast: Shudh Restaurant, Alpena (Michigan), cost: 56, cuisines: \u201cCafe, BBQ, Fast Food\u201d\nAttraction: Besser Museum for Northeast Michigan, Alpena (Michigan),\nLunch: Jain Chawal Wale, Alpena (Michigan), cost: 20, cuisines: \u201cDesserts, Pizza, Italian, Mexican, Cafe\u201d\nDinner: Big Fat Sandwich, Alpena (Michigan), cost: 51, cuisines: \u201cTea, Bakery, BBQ, Cafe, Mediterranean\u201d\nAccommodation: Ultimate 50th Floor Downtown Penthouse - 4000SqFt, Alpena (Michigan), cost: 1043, room type: Entire home/apt, house rules: No smoking & No visitors & No children under 10, minimum nights: 2, maximum occupancy: 9\n\nNumber of people = 3\nTotal cost = (56 + 20 + 51) * 3 + 1043 = 1374\nAccommodation minimum nights: 2/2 (Done!)\n\nDays: 7,\nCurrent City: from Alpena to Punta Gorda,\nTransportation: Taxi, from Alpena to Punta Gorda, duration: 21 hours 39 mins, distance: 2,401 km, cost: 2401\nBreakfast: -,\nAttraction: -,\nLunch: -,\nDinner: -,\nAccommodation: -\n\nNumber of people = 3\nTotal cost = 2401 = 2401\n\nTotal cost across all days = 3127 + 800 + 1272 + 1419 + 1492 + 1374 + 2401 = 11885\n\nUnfortunately, the total cost of $11,885 exceeds the specified budget of $4,400. To adhere to the budget, we need to make significant adjustments to the travel plan, such as choosing more affordable transportation options, selecting less expensive accommodations, and reducing dining costs. Please let me know how you would like to proceed or if there are specific areas where you would prefer to adjust the budget.", "gpt-4-1106-preview_direct_sole-planning_parsed_results": [{"day": 1, "current_city": "from Punta Gorda to Pellston", "transportation": "Taxi, from Punta Gorda to Pellston, duration: 21 hours 40 mins, distance: 2,457 km", "breakfast": "-", "attraction": "-", "lunch": "-", "dinner": "Johnnie Mars, Pellston", "accommodation": "Beautiful apartment ~25min from Times Square, Pellston"}, {"day": 2, "current_city": "Pellston", "transportation": "-", "breakfast": "Aroos Damascus, Pellston", "attraction": "Pellston Pioneer Park, Pellston", "lunch": "The Square Meal, Pellston", "dinner": "Flame & Grill, Pellston", "accommodation": "Beautiful apartment ~25min from Times Square, Pellston"}, {"day": 3, "current_city": "from Pellston to Traverse City", "transportation": "Taxi, from Pellston to Traverse City, duration: 1 hour 49 mins, distance: 137 km", "breakfast": "-", "attraction": "Clinch Park, Traverse City", "lunch": "Daily Eats, Traverse City", "dinner": "French Toast, Traverse City", "accommodation": "Heart of Soho! Cute studio with clean finishes!, Traverse City"}, {"day": 4, "current_city": "Traverse City", "transportation": "-", "breakfast": "India on my Plate - Fortune Select Excalibur, Traverse City", "attraction": "Great Lakes Children's Museum, Traverse City", "lunch": "Tasty But Healthy, Traverse City", "dinner": "Dragonfly, Traverse City", "accommodation": "Heart of Soho! Cute studio with clean finishes!, Traverse City"}, {"day": 5, "current_city": "from Traverse City to Alpena", "transportation": "Taxi, from Traverse City to Alpena, duration: 2 hours 29 mins, distance: 204 km", "breakfast": "-", "attraction": "Great Lakes Maritime Heritage Center, Alpena", "lunch": "@Mango, Alpena", "dinner": "Maplai, Alpena", "accommodation": "Ultimate 50th Floor Downtown Penthouse - 4000SqFt, Alpena"}, {"day": 6, "current_city": "Alpena", "transportation": "-", "breakfast": "Shudh Restaurant, Alpena", "attraction": "Besser Museum for Northeast Michigan, Alpena", "lunch": "Jain Chawal Wale, Alpena", "dinner": "Big Fat Sandwich, Alpena", "accommodation": "Ultimate 50th Floor Downtown Penthouse - 4000SqFt, Alpena"}, {"day": 7, "current_city": "from Alpena to Punta Gorda", "transportation": "Taxi, from Alpena to Punta Gorda, duration: 21 hours 39 mins, distance: 2,401 km", "breakfast": "-", "attraction": "-", "lunch": "-", "dinner": "-", "accommodation": "-"}]}]