[{"gpt-4-1106-preview_direct_sole-planning_results": "Travel Plan:\nDays: 1,\nCurrent City: from Ontario to Honolulu,\nTransportation: Flight Number: F3584294, from Ontario to Honolulu, Departure Time: 10:11, Arrival Time: 14:46, cost: 888\nBreakfast: -,\nAttraction: -,\nLunch: -,\nDinner: Crystal Restaurant, Honolulu, cost: 57, cuisines: \u201cTea, Pizza, Bakery, Fast Food, Chinese\u201d\nAccommodation: Harlem 1 BR, Private Master Bath, Honolulu, cost: 396, maximum occupancy: 1, house rules: No pets, minimum nights: 2\n\nNumber of people = 1\nTotal cost = 888 + 57 + 396 = 1,341\nAccommodation minimum nights:  1/2\n\nDays: 2,\nCurrent City: Honolulu,\nTransportation: -,\nBreakfast: Bait El Khetyar, Honolulu, cost: 28, cuisines: \u201cCafe, Seafood\u201d\nAttraction: Iolani Palace, Honolulu; Waikiki Aquarium, Honolulu,\nLunch: Nimtho, Honolulu, cost: 31, cuisines: \u201cPizza, Mexican, Bakery, BBQ, Cafe, Mediterranean\u201d\nDinner: Dishoom, Honolulu, cost: 63, cuisines: \u201cChinese, Bakery, Desserts\u201d\nAccommodation: Harlem 1 BR, Private Master Bath, Honolulu, cost: 396, maximum occupancy: 1, house rules: No pets, minimum nights: 2\n\nNumber of people = 1\nTotal cost = 28 + 31 + 63 + 396 = 518\nAccommodation minimum nights:  2/2 (Done!)\n\nDays: 3,\nCurrent City: from Honolulu to Ontario,\nTransportation: Flight Number: F3584327, from Honolulu to Ontario, Departure Time: 14:35, Arrival Time: 22:02, cost: 1075\nBreakfast: Cafe Beverly, Honolulu, cost: 43, cuisines: \u201cSeafood, Pizza, Bakery, Italian\u201d\nAttraction: -,\nLunch: -,\nDinner: -,\nAccommodation: -\n\nNumber of people = 1\nTotal cost = 1075 + 43 = 1,118\n\nTotal cost across all days = 1,341 + 518 + 1,118 = 2,977\nCuisines: The prompt specifies no cuisines, so all cuisine constraints are satisfied.\n\nNote: The attractions listed for Day 2 do not have an associated cost in the provided data, so they are assumed to be free or within the remaining budget. If there are entrance fees, they would need to be considered within the total budget.", "gpt-4-1106-preview_direct_sole-planning_parsed_results": [{"day": 1, "current_city": "from Ontario to Honolulu", "transportation": "Flight Number: F3584294, from Ontario to Honolulu, Departure Time: 10:11, Arrival Time: 14:46", "breakfast": "-", "attraction": "-", "lunch": "-", "dinner": "Crystal Restaurant, Honolulu", "accommodation": "Harlem 1 BR, Private Master Bath, Honolulu"}, {"day": 2, "current_city": "Honolulu", "transportation": "-", "breakfast": "Bait El Khetyar, Honolulu", "attraction": "Iolani Palace, Honolulu;Waikiki Aquarium, Honolulu;", "lunch": "Nimtho, Honolulu", "dinner": "Dishoom, Honolulu", "accommodation": "Harlem 1 BR, Private Master Bath, Honolulu"}, {"day": 3, "current_city": "from Honolulu to Ontario", "transportation": "Flight Number: F3584327, from Honolulu to Ontario, Departure Time: 14:35, Arrival Time: 22:02", "breakfast": "Cafe Beverly, Honolulu", "attraction": "-", "lunch": "-", "dinner": "-", "accommodation": "-"}]}]