[{"gpt-4-1106-preview_direct_sole-planning_results": "Travel Plan:\nDays: 1,\nCurrent City: from Houston to Pensacola,\nTransportation: Taxi, from Houston to Pensacola, duration: 7 hours 38 mins, distance: 845 km, cost: 845\nBreakfast: -,\nAttraction: -,\nLunch: -,\nDinner: Frog Hollow Tavern, Pensacola, cost: 20, cuisines: \u201cAmerican, BBQ, Fast Food, Cafe, Indian\u201d\nAccommodation: Chic Historic Harlem Brownstone, Pensacola, cost: 526, maximum occupancy: 2, house rules: No smoking, minimum nights: 3\n\nNumber of people = 2\nTotal cost = 845 + (20 * 2) + 526 = 1,411\nAccommodation minimum nights:  1/3\n\nDays: 2,\nCurrent City: Pensacola,\nTransportation: -,\nBreakfast: Berry Patch Restaurant, Pensacola, cost: 13, cuisines: \u201cBakery, BBQ, Desserts, Seafood\u201d\nAttraction: Historic Pensacola Village, Pensacola; Pensacola Museum of Art, Pensacola,\nLunch: Bailey's Bar-B-Que, Pensacola, cost: 13, cuisines: \u201cTea, Bakery, Mediterranean\u201d\nDinner: Watershed Cafe, Pensacola, cost: 12, cuisines: \u201cChinese, BBQ, Desserts\u201d\nAccommodation: Chic Historic Harlem Brownstone, Pensacola, cost: 526, maximum occupancy: 2, house rules: No smoking, minimum nights: 3\n\nNumber of people = 2\nTotal cost = (13 + 13 + 12) * 2 + 526 = 602\nAccommodation minimum nights:  2/3\n\nDays: 3,\nCurrent City: from Pensacola to Houston,\nTransportation: Self-driving, from Pensacola to Houston, duration: 7 hours 37 mins, distance: 845 km, cost: 42\nBreakfast: -,\nAttraction: -,\nLunch: -,\nDinner: -,\nAccommodation: -\n\nNumber of people = 2\nTotal cost = 42 * 2 = 84\n\nTotal cost across all days = 1,411 + 602 + 84 = 2,097\n\nUnfortunately, the total cost exceeds the specified budget of $1,100, and the chosen accommodation does not permit smoking, which is against the query's requirements. Additionally, the accommodation cost for the first day already exceeds the budget. Therefore, we need to revise the travel plan to meet the budget and requirements.\n\nRevised Travel Plan:\nDays: 1,\nCurrent City: from Houston to Pensacola,\nTransportation: Self-driving, from Houston to Pensacola, duration: 7 hours 38 mins, distance: 845 km, cost: 42\nBreakfast: -,\nAttraction: -,\nLunch: -,\nDinner: Berry Patch Restaurant, Pensacola, cost: 13, cuisines: \u201cBakery, BBQ, Desserts, Seafood\u201d\nAccommodation: Amazing apartment near museum, gardens & park!, Pensacola, cost: 74, maximum occupancy: 3, house rules: No parties, minimum nights: 17\n\nNumber of people = 2\nTotal cost = (42 + 13) * 2 + 74 = 184\nAccommodation minimum nights:  1/17\n\nDays: 2,\nCurrent City: Pensacola,\nTransportation: -,\nBreakfast: Bailey's Bar-B-Que, Pensacola, cost: 13, cuisines: \u201cTea, Bakery, Mediterranean\u201d\nAttraction: Pensacola Lighthouse & Maritime Museum, Pensacola; Plaza De Luna Memorial Monument, Pensacola,\nLunch: Watershed Cafe, Pensacola, cost: 12, cuisines: \u201cChinese, BBQ, Desserts\u201d\nDinner: Chicago Pizza, Pensacola, cost: 32, cuisines: \u201cPizza, Mediterranean, Fast Food\u201d\nAccommodation: Amazing apartment near museum, gardens & park!, Pensacola, cost: 74, maximum occupancy: 3, house rules: No parties, minimum nights: 17\n\nNumber of people = 2\nTotal cost = (13 + 12 + 32) * 2 + 74 = 190\nAccommodation minimum nights:  2/17\n\nDays: 3,\nCurrent City: from Pensacola to Houston,\nTransportation: Self-driving, from Pensacola to Houston, duration: 7 hours 37 mins, distance: 845 km, cost: 42\nBreakfast: -,\nAttraction: -,\nLunch: -,\nDinner: -,\nAccommodation: -\n\nNumber of people = 2\nTotal cost = 42 * 2 = 84\n\nTotal cost across all days = 184 + 190 + 84 = 458\n\nThe revised travel plan meets the budget of $1,100 and adheres to the requirement for non-shared rooms and permission for smoking.", "gpt-4-1106-preview_direct_sole-planning_parsed_results": [{"day": 1, "current_city": "from Houston to Pensacola", "transportation": "Self-driving, from Houston to Pensacola, duration: 7 hours 38 mins, distance: 845 km", "breakfast": "-", "attraction": "-", "lunch": "-", "dinner": "Berry Patch Restaurant, Pensacola", "accommodation": "Amazing apartment near museum, gardens & park!, Pensacola"}, {"day": 2, "current_city": "Pensacola", "transportation": "-", "breakfast": "Bailey's Bar-B-Que, Pensacola", "attraction": "Pensacola Lighthouse & Maritime Museum, Pensacola;Plaza De Luna Memorial Monument, Pensacola", "lunch": "Watershed Cafe, Pensacola", "dinner": "Chicago Pizza, Pensacola", "accommodation": "Amazing apartment near museum, gardens & park!, Pensacola"}, {"day": 3, "current_city": "from Pensacola to Houston", "transportation": "Self-driving, from Pensacola to Houston, duration: 7 hours 37 mins, distance: 845 km", "breakfast": "-", "attraction": "-", "lunch": "-", "dinner": "-", "accommodation": "-"}]}]