[{"gpt-4-1106-preview_direct_sole-planning_results": "Travel Plan:\n\nDays: 1,\nCurrent City: from Minneapolis to Abilene (Texas),\nTransportation: Self-driving, from Minneapolis to Abilene, duration: 15 hours 28 mins, distance: 1,732 km, cost: 86\nBreakfast: -,\nAttraction: -,\nLunch: -,\nDinner: Thai Garden, Abilene (Texas), cost: 26, cuisines: \u201cCafe, American, Desserts\u201d\nAccommodation: Apartment minutes from manhattan, Abilene (Texas), cost: 295, room type: Entire home/apt, house rules: No pets & No visitors, minimum nights: 2, maximum occupancy: 2\n\nNumber of people = 2\nTotal cost = (86 * 2) + (26 * 2) + 295 = 519\nAccommodation minimum nights:  1/2\n\nDays: 2,\nCurrent City: Abilene (Texas),\nTransportation: -,\nBreakfast: Crispy Crust, Abilene (Texas), cost: 54, cuisines: \u201cDesserts, Bakery, Cafe, American, Seafood\u201d\nAttraction: The Grace Museum, Abilene (Texas); Frontier Texas!, Abilene (Texas),\nLunch: Finger Licious, Abilene (Texas), cost: 35, cuisines: \u201cFast Food, Cafe, BBQ, Seafood\u201d\nDinner: LPK Waterfront, Abilene (Texas), cost: 61, cuisines: \u201cPizza, Italian, BBQ, Fast Food, Seafood\u201d\nAccommodation: Apartment minutes from manhattan, Abilene (Texas), cost: 295, room type: Entire home/apt, house rules: No pets & No visitors, minimum nights: 2, maximum occupancy: 2\n\nNumber of people = 2\nTotal cost = (54 + 35 + 61) * 2 + 295 = 595\nAccommodation minimum nights:  2/2 (Done!)\n\nDays: 3,\nCurrent City: from Abilene to Amarillo (Texas),\nTransportation: Self-driving, from Abilene to Amarillo, duration: 4 hours 10 mins, distance: 446 km, cost: 22\nBreakfast: -,\nAttraction: -,\nLunch: -,\nDinner: The Cinnamon Kitchen, Amarillo (Texas), cost: 69, cuisines: \u201cDesserts, Tea, Pizza, Chinese, Seafood\u201d\nAccommodation: Harlem Humble Abode - 1 bedroom - Cute and Quaint, Amarillo (Texas), cost: 409, room type: Entire home/apt, house rules: No pets, minimum nights: 5, maximum occupancy: 3\n\nNumber of people = 2\nTotal cost = (22 * 2) + (69 * 2) + 409 = 591\nAccommodation minimum nights:  1/5\n\nDays: 4,\nCurrent City: Amarillo (Texas),\nTransportation: -,\nBreakfast: Kanha North & South Indian Veg., Amarillo (Texas), cost: 34, cuisines: \u201cTea, Cafe, BBQ, Fast Food\u201d\nAttraction: Cadillac Ranch, Amarillo (Texas); Amarillo Botanical Gardens, Amarillo (Texas),\nLunch: Sigree Global Grill, Amarillo (Texas), cost: 35, cuisines: \u201cChinese, BBQ, Cafe, Desserts\u201d\nDinner: Anand Restaurant, Amarillo (Texas), cost: 53, cuisines: \u201cFast Food, Seafood, Desserts, Italian\u201d\nAccommodation: Harlem Humble Abode - 1 bedroom - Cute and Quaint, Amarillo (Texas), cost: 409, room type: Entire home/apt, house rules: No pets, minimum nights: 5, maximum occupancy: 3\n\nNumber of people = 2\nTotal cost = (34 + 35 + 53) * 2 + 409 = 653\nAccommodation minimum nights:  2/5\n\nDays: 5,\nCurrent City: from Amarillo to Lubbock (Texas),\nTransportation: Self-driving, from Amarillo to Lubbock, duration: 1 hour 47 mins, distance: 197 km, cost: 9\nBreakfast: -,\nAttraction: -,\nLunch: -,\nDinner: Paris 6 Classique, Lubbock (Texas), cost: 91, cuisines: \u201cDesserts, Cafe, Pizza, Mexican, BBQ, Chinese\u201d\nAccommodation: Private bedroom in UWS Apartment, Lubbock (Texas), cost: 709, room type: Private room, house rules: No visitors & No pets, minimum nights: 2, maximum occupancy: 2\n\nNumber of people = 2\nTotal cost = (9 * 2) + (91 * 2) + 709 = 909\nAccommodation minimum nights:  1/2\n\nDays: 6,\nCurrent City: Lubbock (Texas),\nTransportation: -,\nBreakfast: 3 Squares Diner, Lubbock (Texas), cost: 73, cuisines: \u201cPizza, Indian, Fast Food\u201d\nAttraction: Buddy Holly Center, Lubbock (Texas); National Ranching Heritage Center, Lubbock (Texas),\nLunch: Grand Barbeque Buffet Restaurant, Lubbock (Texas), cost: 20, cuisines: \u201cTea, French, Fast Food, Cafe, Seafood\u201d\nDinner: Mosaic - Country Inn & Suites By Carlson, Lubbock (Texas), cost: 29, cuisines: \u201cChinese, Indian, Desserts, Seafood\u201d\nAccommodation: Private bedroom in UWS Apartment, Lubbock (Texas), cost: 709, room type: Private room, house rules: No visitors & No pets, minimum nights: 2, maximum occupancy: 2\n\nNumber of people = 2\nTotal cost = (73 + 20 + 29) * 2 + 709 = 923\nAccommodation minimum nights:  2/2 (Done!)\n\nDays: 7,\nCurrent City: from Lubbock to Minneapolis,\nTransportation: Self-driving, from Lubbock to Minneapolis, duration: 16 hours 17 mins, distance: 1,818 km, cost: 90\nBreakfast: -,\nAttraction: -,\nLunch: -,\nDinner: -,\nAccommodation: -\n\nNumber of people = 2\nTotal cost = 90 * 2 = 180\n\nTotal cost across all days = 519 + 595 + 591 + 653 + 909 + 923 + 180 = 4370\nCuisines: The prompt specifies no cuisines, so all cuisine constraints are satisfied.\nHouse rules: All accommodations chosen are suitable for children under 10 years old.\n\nPlease note that the costs for attractions and some meals are not included due to lack of pricing information. Additional costs may apply for these activities. The total cost is well within the specified budget of $11,900.", "gpt-4-1106-preview_direct_sole-planning_parsed_results": [{"day": 1, "current_city": "from Minneapolis to Abilene", "transportation": "Self-driving, from Minneapolis to Abilene, duration: 15 hours 28 mins, distance: 1,732 km", "breakfast": "-", "attraction": "-", "lunch": "-", "dinner": "Thai Garden, Abilene", "accommodation": "Apartment minutes from manhattan, Abilene"}, {"day": 2, "current_city": "Abilene", "transportation": "-", "breakfast": "Crispy Crust, Abilene", "attraction": "The Grace Museum, Abilene;Frontier Texas!, Abilene;", "lunch": "Finger Licious, Abilene", "dinner": "LPK Waterfront, Abilene", "accommodation": "Apartment minutes from manhattan, Abilene"}, {"day": 3, "current_city": "from Abilene to Amarillo", "transportation": "Self-driving, from Abilene to Amarillo, duration: 4 hours 10 mins, distance: 446 km", "breakfast": "-", "attraction": "-", "lunch": "-", "dinner": "The Cinnamon Kitchen, Amarillo", "accommodation": "Harlem Humble Abode - 1 bedroom - Cute and Quaint, Amarillo"}, {"day": 4, "current_city": "Amarillo", "transportation": "-", "breakfast": "Kanha North & South Indian Veg., Amarillo", "attraction": "Cadillac Ranch, Amarillo;Amarillo Botanical Gardens, Amarillo;", "lunch": "Sigree Global Grill, Amarillo", "dinner": "Anand Restaurant, Amarillo", "accommodation": "Harlem Humble Abode - 1 bedroom - Cute and Quaint, Amarillo"}, {"day": 5, "current_city": "from Amarillo to Lubbock", "transportation": "Self-driving, from Amarillo to Lubbock, duration: 1 hour 47 mins, distance: 197 km", "breakfast": "-", "attraction": "-", "lunch": "-", "dinner": "Paris 6 Classique, Lubbock", "accommodation": "Private bedroom in UWS Apartment, Lubbock"}, {"day": 6, "current_city": "Lubbock", "transportation": "-", "breakfast": "3 Squares Diner, Lubbock", "attraction": "Buddy Holly Center, Lubbock;National Ranching Heritage Center, Lubbock;", "lunch": "Grand Barbeque Buffet Restaurant, Lubbock", "dinner": "Mosaic - Country Inn & Suites By Carlson, Lubbock", "accommodation": "Private bedroom in UWS Apartment, Lubbock"}, {"day": 7, "current_city": "from Lubbock to Minneapolis", "transportation": "Self-driving, from Lubbock to Minneapolis, duration: 16 hours 17 mins, distance: 1,818 km", "breakfast": "-", "attraction": "-", "lunch": "-", "dinner": "-", "accommodation": "-"}]}]