[{"gpt-4-1106-preview_direct_sole-planning_results": "Travel Plan:\nDays: 1,\nCurrent City: from Cedar Rapids to Denver (Colorado),\nTransportation: Flight Number: F3840860, from Cedar Rapids to Denver (Colorado), Departure Time: 16:23, Arrival Time: 17:15, cost: 294\nBreakfast: -,\nAttraction: -,\nLunch: -,\nDinner: The Fatty Bao - Asian Gastro Bar, Denver, cost: 93, cuisines: \u201cBakery, BBQ, Cafe, Indian, Seafood\u201d\nAccommodation: Peaceful, beautiful home away, Denver, cost: 414, maximum occupancy: 4, house rules: No smoking & No visitors & No parties, minimum nights: 2\n\nNumber of people = 1\nTotal cost = 294 + 93 + 414 = 801\nAccommodation minimum nights:  1/2\n\nDays: 2,\nCurrent City: Denver (Colorado),\nTransportation: -,\nBreakfast: Starve Stalkers, Denver, cost: 31, cuisines: \u201cFast Food, Indian, BBQ, Seafood\u201d\nAttraction: Denver Botanic Gardens, Denver; Denver Art Museum, Denver,\nLunch: TBH - The Big House Cafe, Denver, cost: 22, cuisines: \u201cCafe, Indian, Seafood, Fast Food\u201d\nDinner: Radhika Sweets, Denver, cost: 26, cuisines: \u201cTea, Fast Food, Cafe, Mediterranean, Seafood\u201d\nAccommodation: Peaceful, beautiful home away, Denver, cost: 414, maximum occupancy: 4, house rules: No smoking & No visitors & No parties, minimum nights: 2\n\nNumber of people = 1\nTotal cost = 31 + 22 + 26 + 414 = 493\nAccommodation minimum nights:  2/2 (Done!)\n\nDays: 3,\nCurrent City: from Denver to Alamosa (Colorado),\nTransportation: Flight Number: F3857649, from Denver to Alamosa (Colorado), Departure Time: 15:44, Arrival Time: 16:33, cost: 37\nBreakfast: -,\nAttraction: Denver Museum of Nature & Science, Denver,\nLunch: Cafe Diva, Denver, cost: 44, cuisines: \u201cChinese, Cafe, Desserts, Fast Food\u201d\nDinner: -,\nAccommodation: Comfortable studio suite in midtown Manhattan, Alamosa, cost: 67, maximum occupancy: 2, house rules: No parties & No smoking & No visitors, minimum nights: 30\n\nNumber of people = 1\nTotal cost = 37 + 44 + 67 = 148\nAccommodation minimum nights:  1/30\n\nDays: 4,\nCurrent City: Alamosa (Colorado),\nTransportation: -,\nBreakfast: Cafe Coffee Day - The Lounge, Alamosa, cost: 23, cuisines: \u201cCafe, American, BBQ, Italian\u201d\nAttraction: San Luis Valley Museum | Alamosa; Rio Grande Farm Park, Alamosa,\nLunch: Atlanta Highway Seafood Market, Alamosa, cost: 68, cuisines: \u201cFast Food, Desserts, Seafood\u201d\nDinner: Riverwalk Cafe, Alamosa, cost: 97, cuisines: \u201cTea, Pizza, Fast Food\u201d\nAccommodation: Comfortable studio suite in midtown Manhattan, Alamosa, cost: 67, maximum occupancy: 2, house rules: No parties & No smoking & No visitors, minimum nights: 30\n\nNumber of people = 1\nTotal cost = 23 + 68 + 97 + 67 = 255\nAccommodation minimum nights:  2/30\n\nDays: 5,\nCurrent City: from Alamosa to Cedar Rapids,\nTransportation: Self-driving, from Alamosa to Cedar Rapids, duration: 14 hours 27 mins, distance: 1,541 km, cost: 77\nBreakfast: -,\nAttraction: -,\nLunch: -,\nDinner: -,\nAccommodation: -\n\nNumber of people = 1\nTotal cost = 77\n\nTotal cost across all days = 801 + 493 + 148 + 255 + 77 = 1,774\n\nCuisines: The prompt specifies no cuisines, so all cuisine constraints are satisfied.\nHouse rules: All accommodations chosen meet the house rules specified in the listings.\n\nNote: The accommodation in Alamosa has a minimum stay of 30 nights, which is not ideal for a 5-day trip. However, due to the lack of available data on other accommodations, this was the chosen option. In a real-world scenario, it would be necessary to find an alternative accommodation that allows for a shorter stay.", "gpt-4-1106-preview_direct_sole-planning_parsed_results": [{"day": 1, "current_city": "from Cedar Rapids to Denver", "transportation": "Flight Number: F3840860, from Cedar Rapids to Denver, Departure Time: 16:23, Arrival Time: 17:15", "breakfast": "-", "attraction": "-", "lunch": "-", "dinner": "The Fatty Bao - Asian Gastro Bar, Denver", "accommodation": "Peaceful, beautiful home away, Denver"}, {"day": 2, "current_city": "Denver", "transportation": "-", "breakfast": "Starve Stalkers, Denver", "attraction": "Denver Botanic Gardens, Denver;Denver Art Museum, Denver;", "lunch": "TBH - The Big House Cafe, Denver", "dinner": "Radhika Sweets, Denver", "accommodation": "Peaceful, beautiful home away, Denver"}, {"day": 3, "current_city": "from Denver to Alamosa", "transportation": "Flight Number: F3857649, from Denver to Alamosa, Departure Time: 15:44, Arrival Time: 16:33", "breakfast": "-", "attraction": "Denver Museum of Nature & Science, Denver", "lunch": "Cafe Diva, Denver", "dinner": "-", "accommodation": "Comfortable studio suite in midtown Manhattan, Alamosa"}, {"day": 4, "current_city": "Alamosa", "transportation": "-", "breakfast": "Cafe Coffee Day - The Lounge, Alamosa", "attraction": "San Luis Valley Museum, Alamosa;Rio Grande Farm Park, Alamosa;", "lunch": "Atlanta Highway Seafood Market, Alamosa", "dinner": "Riverwalk Cafe, Alamosa", "accommodation": "Comfortable studio suite in midtown Manhattan, Alamosa"}, {"day": 5, "current_city": "from Alamosa to Cedar Rapids", "transportation": "Self-driving, from Alamosa to Cedar Rapids, duration: 14 hours 27 mins, distance: 1,541 km", "breakfast": "-", "attraction": "-", "lunch": "-", "dinner": "-", "accommodation": "-"}]}]