[{"gpt-4-1106-preview_direct_sole-planning_results": "Travel Plan:\n\nDays: 1,\nCurrent City: from Washington to Los Angeles (California),\nTransportation: Flight Number: F3743452, from Washington to Los Angeles, Departure Time: 09:07, Arrival Time: 11:35, cost: 487\nBreakfast: -,\nAttraction: -,\nLunch: -,\nDinner: Punjabi Zaika, Los Angeles (California), cost: 46, cuisines: \u201cPizza, Bakery, BBQ, Cafe, Indian\u201d\nAccommodation: Midtown East 2 Bed/2 Bath Elevator Building Apt, Los Angeles (California), cost: 540, room type: Entire home/apt, house rules: No pets, minimum nights: 7, maximum occupancy: 4\n\nNumber of people = 2\nTotal cost = 487 * 2 + 46 * 2 + 540 = 1,606\nAccommodation minimum nights: 1/7\n\nDays: 2,\nCurrent City: Los Angeles (California),\nTransportation: -,\nBreakfast: Palmshore, Los Angeles (California), cost: 25, cuisines: \u201cDesserts, Bakery, Fast Food, American, Seafood\u201d\nAttraction: Santa Monica Pier, Los Angeles (California); Griffith Observatory, Los Angeles (California);\nLunch: The Hangout by 1861, Los Angeles (California), cost: 64, cuisines: \u201cTea, Pizza, Seafood\u201d\nDinner: Village - The House of Food, Los Angeles (California), cost: 87, cuisines: \u201cChinese, Pizza, Cafe\u201d\nAccommodation: Midtown East 2 Bed/2 Bath Elevator Building Apt, Los Angeles (California), cost: 540, room type: Entire home/apt, house rules: No pets, minimum nights: 7, maximum occupancy: 4\n\nNumber of people = 2\nTotal cost = (25 + 64 + 87) * 2 + 540 = 898\nAccommodation minimum nights: 2/7\n\nDays: 3,\nCurrent City: from Los Angeles (California) to San Francisco (California),\nTransportation: Flight Number: F3744801, from Los Angeles to San Francisco, Departure Time: 05:54, Arrival Time: 07:22, cost: 79\nBreakfast: -,\nAttraction: Golden Gate Bridge, San Francisco (California); Exploratorium, San Francisco (California);\nLunch: Coffee & Chai Co., San Francisco (California), cost: 10, cuisines: \u201cTea, Mexican, BBQ, Cafe, Seafood\u201d\nDinner: Green Chick Chop, San Francisco (California), cost: 39, cuisines: \u201cTea, Pizza, Italian, BBQ, Mediterranean, Seafood\u201d\nAccommodation: Great 1 Bedroom on Upper East, San Francisco (California), cost: 484, room type: Entire home/apt, house rules: No parties, minimum nights: 2, maximum occupancy: 2\n\nNumber of people = 2\nTotal cost = 79 * 2 + (10 + 39) * 2 + 484 = 740\nAccommodation minimum nights: 1/2\n\nDays: 4,\nCurrent City: San Francisco (California),\nTransportation: -,\nBreakfast: Bonne Bouche, San Francisco (California), cost: 21, cuisines: \u201cTea, Chinese, American, Cafe\u201d\nAttraction: California Academy of Sciences, San Francisco (California); San Francisco Museum of Modern Art, San Francisco (California);\nLunch: Sudarshan, San Francisco (California), cost: 53, cuisines: \u201cFast Food, Bakery, Mediterranean, Italian\u201d\nDinner: Kream's, San Francisco (California), cost: 67, cuisines: \u201cTea, Pizza, BBQ, Chinese, Seafood\u201d\nAccommodation: Great 1 Bedroom on Upper East, San Francisco (California), cost: 484, room type: Entire home/apt, house rules: No parties, minimum nights: 2, maximum occupancy: 2\n\nNumber of people = 2\nTotal cost = (21 + 53 + 67) * 2 + 484 = 766\nAccommodation minimum nights: 2/2\n\nDays: 5,\nCurrent City: from San Francisco (California) to Washington,\nTransportation: Flight Number: F3746364, from San Francisco to Washington, Departure Time: 07:53, Arrival Time: 16:03, cost: 703\nBreakfast: -,\nAttraction: -,\nLunch: -,\nDinner: -,\nAccommodation: -\n\nNumber of people = 2\nTotal cost = 703 * 2 = 1,406\n\nTotal cost across all days = 1,606 + 898 + 740 + 766 + 1,406 = 5,416\n\nCuisines: The prompt specifies Chinese, Mexican, American, and Italian, and all of these cuisines have been represented in the restaurants chosen.\n\nHouse rules: All accommodations chosen are non-shared rooms and allow visitors, meeting the requirements.\n\nPlease note that the total cost exceeds the specified budget of $4,600. Adjustments to the plan would be required to meet the budget constraint.", "gpt-4-1106-preview_direct_sole-planning_parsed_results": [{"day": 1, "current_city": "from Washington to Los Angeles", "transportation": "Flight Number: F3743452, from Washington to Los Angeles, Departure Time: 09:07, Arrival Time: 11:35", "breakfast": "-", "attraction": "-", "lunch": "-", "dinner": "Punjabi Zaika, Los Angeles", "accommodation": "Midtown East 2 Bed/2 Bath Elevator Building Apt, Los Angeles"}, {"day": 2, "current_city": "Los Angeles", "transportation": "-", "breakfast": "Palmshore, Los Angeles", "attraction": "Santa Monica Pier, Los Angeles;Griffith Observatory, Los Angeles;", "lunch": "The Hangout by 1861, Los Angeles", "dinner": "Village - The House of Food, Los Angeles", "accommodation": "Midtown East 2 Bed/2 Bath Elevator Building Apt, Los Angeles"}, {"day": 3, "current_city": "from Los Angeles to San Francisco", "transportation": "Flight Number: F3744801, from Los Angeles to San Francisco, Departure Time: 05:54, Arrival Time: 07:22", "breakfast": "-", "attraction": "Golden Gate Bridge, San Francisco;Exploratorium, San Francisco;", "lunch": "Coffee & Chai Co., San Francisco", "dinner": "Green Chick Chop, San Francisco", "accommodation": "Great 1 Bedroom on Upper East, San Francisco"}, {"day": 4, "current_city": "San Francisco", "transportation": "-", "breakfast": "Bonne Bouche, San Francisco", "attraction": "California Academy of Sciences, San Francisco;San Francisco Museum of Modern Art, San Francisco;", "lunch": "Sudarshan, San Francisco", "dinner": "Kream's, San Francisco", "accommodation": "Great 1 Bedroom on Upper East, San Francisco"}, {"day": 5, "current_city": "from San Francisco to Washington", "transportation": "Flight Number: F3746364, from San Francisco to Washington, Departure Time: 07:53, Arrival Time: 16:03", "breakfast": "-", "attraction": "-", "lunch": "-", "dinner": "-", "accommodation": "-"}]}]