[{"gpt-4-1106-preview_direct_sole-planning_results": "Travel Plan:\n\nDays: 1,\nCurrent City: from Spokane to San Francisco,\nTransportation: Flight Number: F3853330, from Spokane to San Francisco, Departure Time: 07:10, Arrival Time: 09:38, cost: 227\nBreakfast: -,\nAttraction: -,\nLunch: -,\nDinner: Tokyo Sushi, San Francisco, cost: 18, cuisines: \u201cCafe, Pizza, BBQ\u201d\nAccommodation: Room in Down town Brooklyn Parkslop, San Francisco, cost: 79, maximum occupancy: 2, house rules: No visitors, minimum nights: 1\n\nNumber of people = 1\nTotal cost = 227 + 18 + 79 = 324\nAccommodation minimum nights:  1/1\n\nDays: 2,\nCurrent City: San Francisco,\nTransportation: -,\nBreakfast: Coffee & Chai Co., San Francisco, cost: 10, cuisines: \u201cTea, Mexican, BBQ, Cafe, Seafood\u201d\nAttraction: Golden Gate Bridge, San Francisco; Golden Gate Park, San Francisco,\nLunch: Bonne Bouche, San Francisco, cost: 21, cuisines: \u201cTea, Chinese, American, Cafe\u201d\nDinner: Kream's, San Francisco, cost: 67, cuisines: \u201cTea, Pizza, BBQ, Chinese, Seafood\u201d\nAccommodation: Room in Down town Brooklyn Parkslop, San Francisco, cost: 79, maximum occupancy: 2, house rules: No visitors, minimum nights: 1\n\nNumber of people = 1\nTotal cost = 10 + 21 + 67 + 79 = 177\nAccommodation minimum nights:  2/1\n\nDays: 3,\nCurrent City: from San Francisco to Spokane,\nTransportation: Flight Number: F3840215, from San Francisco to Spokane, Departure Time: 16:21, Arrival Time: 18:29, cost: 343\nBreakfast: Gupta's Rasoi, San Francisco, cost: 13, cuisines: \u201cCafe, Bakery, BBQ, Mediterranean\u201d\nAttraction: -,\nLunch: -,\nDinner: -,\nAccommodation: -\n\nNumber of people = 1\nTotal cost = 343 + 13 = 356\n\nTotal cost across all days = 324 + 177 + 356 = 857\nCuisines: The prompt specifies no cuisines, so all cuisine constraints are satisfied.", "gpt-4-1106-preview_direct_sole-planning_parsed_results": [{"day": 1, "current_city": "from Spokane to San Francisco", "transportation": "Flight Number: F3853330, from Spokane to San Francisco, Departure Time: 07:10, Arrival Time: 09:38", "breakfast": "-", "attraction": "-", "lunch": "-", "dinner": "Tokyo Sushi, San Francisco", "accommodation": "Room in Down town Brooklyn Parkslop, San Francisco"}, {"day": 2, "current_city": "San Francisco", "transportation": "-", "breakfast": "Coffee & Chai Co., San Francisco", "attraction": "Golden Gate Bridge, San Francisco;Golden Gate Park, San Francisco;", "lunch": "Bonne Bouche, San Francisco", "dinner": "Kream's, San Francisco", "accommodation": "Room in Down town Brooklyn Parkslop, San Francisco"}, {"day": 3, "current_city": "from San Francisco to Spokane", "transportation": "Flight Number: F3840215, from San Francisco to Spokane, Departure Time: 16:21, Arrival Time: 18:29", "breakfast": "Gupta's Rasoi, San Francisco", "attraction": "-", "lunch": "-", "dinner": "-", "accommodation": "-"}]}]