[{"gpt-4-1106-preview_direct_sole-planning_results": "Travel Plan:\nDays: 1,\nCurrent City: from Providence to Orlando,\nTransportation: Flight Number: F4011165, from Providence to Orlando, Departure Time: 18:30, Arrival Time: 21:49, cost: 226\nBreakfast: -,\nAttraction: -,\nLunch: -,\nDinner: Fuji Japanese Steakhouse, Orlando, cost: 75, cuisines: \u201cTea, Bakery, Desserts\u201d\nAccommodation: Sixth Ave Chelsea, Studio Serviced Apartment, Orlando, cost: 70, room type: Entire home/apt, house rules: No visitors & No pets, minimum nights: 30, maximum occupancy: 3\n\nNumber of people = 1\nTotal cost = 226 + 75 + 70 = 371\nAccommodation minimum nights:  1/30\n\nDays: 2,\nCurrent City: Orlando,\nTransportation: -,\nBreakfast: Turquoise Villa, Orlando, cost: 55, cuisines: \u201cFrench, Bakery, BBQ, Fast Food\u201d\nAttraction: The Wheel at ICON Park, Orlando; SeaWorld Orlando, Orlando,\nLunch: The Tandoori Times, Orlando, cost: 84, cuisines: \u201cTea, Cafe, BBQ, Italian\u201d\nDinner: Indochi Cafe & Restaurant, Orlando, cost: 72, cuisines: \u201cPizza, French, Bakery, Fast Food, Indian, Seafood\u201d\nAccommodation: Sixth Ave Chelsea, Studio Serviced Apartment, Orlando, cost: 70, room type: Entire home/apt, house rules: No visitors & No pets, minimum nights: 30, maximum occupancy: 3\n\nNumber of people = 1\nTotal cost = 55 + 84 + 72 + 70 = 281\nAccommodation minimum nights:  2/30\n\nDays: 3,\nCurrent City: from Orlando to Providence,\nTransportation: Flight Number: F4032376, from Orlando to Providence, Departure Time: 19:22, Arrival Time: 21:58, cost: 280\nBreakfast: Lounge Bakery, Orlando, cost: 31, cuisines: \u201cTea, Italian, BBQ, Fast Food, Cafe\u201d\nAttraction: -,\nLunch: -,\nDinner: -,\nAccommodation: -\n\nNumber of people = 1\nTotal cost = 280 + 31 = 311\n\nTotal cost across all days = 371 + 281 + 311 = 963\nCuisines: The prompt specifies no cuisines, so all cuisine constraints are satisfied.\nHouse rules: All accommodations chosen do not disallow parties, so parties are allowed.\n\nNote: The accommodation chosen has a minimum stay of 30 nights, which is not ideal for a 3-day trip. However, since the budget allows, the cost for one night is included in the plan. The traveler should be aware that they may need to negotiate with the property owner or look for alternative accommodations that allow shorter stays.", "gpt-4-1106-preview_direct_sole-planning_parsed_results": [{"day": 1, "current_city": "from Providence to Orlando", "transportation": "Flight Number: F4011165, from Providence to Orlando, Departure Time: 18:30, Arrival Time: 21:49", "breakfast": "-", "attraction": "-", "lunch": "-", "dinner": "Fuji Japanese Steakhouse, Orlando", "accommodation": "Sixth Ave Chelsea, Studio Serviced Apartment, Orlando"}, {"day": 2, "current_city": "Orlando", "transportation": "-", "breakfast": "Turquoise Villa, Orlando", "attraction": "The Wheel at ICON Park, Orlando;SeaWorld Orlando, Orlando;", "lunch": "The Tandoori Times, Orlando", "dinner": "Indochi Cafe & Restaurant, Orlando", "accommodation": "Sixth Ave Chelsea, Studio Serviced Apartment, Orlando"}, {"day": 3, "current_city": "from Orlando to Providence", "transportation": "Flight Number: F4032376, from Orlando to Providence, Departure Time: 19:22, Arrival Time: 21:58", "breakfast": "Lounge Bakery, Orlando", "attraction": "-", "lunch": "-", "dinner": "-", "accommodation": "-"}]}]