[{"gpt-4-1106-preview_direct_sole-planning_results": "Travel Plan:\n\nDays: 1,\nCurrent City: from Myrtle Beach to Boston (Massachusetts),\nTransportation: Flight Number: F3613545, from Myrtle Beach to Boston, Departure Time: 18:13, Arrival Time: 20:03, cost: 260\nBreakfast: -,\nAttraction: -,\nLunch: -,\nDinner: Club Cubana, Boston (Massachusetts), cost: 65, cuisines: \u201cDesserts, BBQ, Fast Food, Cafe, Indian, Mediterranean\u201d\nAccommodation: IN MINT CONDITION-STUDIOS EAST 44TH/UNITED NATIONS, Boston (Massachusetts), cost: 1058, room type: Entire home/apt, house rules: No visitors & No smoking, minimum nights: 30, maximum occupancy: 7\n\nNumber of people = 3\nTotal cost = 260 * 3 + 65 * 3 + 1058 = 1771\nAccommodation minimum nights: 1/30\n\nDays: 2,\nCurrent City: Boston (Massachusetts),\nTransportation: -,\nBreakfast: Irish Democrat, Boston (Massachusetts), cost: 18, cuisines: \u201cTea, Cafe, Bakery, Fast Food\u201d\nAttraction: Museum of Science, Boston (Massachusetts); New England Aquarium, Boston (Massachusetts);\nLunch: Apni Rasoi, Boston (Massachusetts), cost: 28, cuisines: \u201cBakery, BBQ, Fast Food, American, Mediterranean, Seafood\u201d\nDinner: Red Mesa Restaurant, Boston (Massachusetts), cost: 65, cuisines: \u201cDesserts, Tea, Fast Food, Indian, Seafood\u201d\nAccommodation: IN MINT CONDITION-STUDIOS EAST 44TH/UNITED NATIONS, Boston (Massachusetts), cost: 1058, room type: Entire home/apt, house rules: No visitors & No smoking, minimum nights: 30, maximum occupancy: 7\n\nNumber of people = 3\nTotal cost = (18 + 28 + 65) * 3 + 1058 = 1415\nAccommodation minimum nights: 2/30\n\nDays: 3,\nCurrent City: from Boston (Massachusetts) to Martha's Vineyard (Massachusetts),\nTransportation: Taxi, from Boston to Martha's Vineyard, duration: 2 hours 34 mins, distance: 146 km, cost: 146\nBreakfast: -,\nAttraction: Martha's Vineyard Museum, Martha's Vineyard (Massachusetts);\nLunch: Yellow Dog Eats, Martha's Vineyard (Massachusetts), cost: 34, cuisines: \u201cCafe, Indian, Desserts, Seafood\u201d\nDinner: Bern's Steak House, Martha's Vineyard (Massachusetts), cost: 35, cuisines: \u201cDesserts, Mexican, Bakery, BBQ, Indian, Seafood\u201d\nAccommodation: One Bed Room Apt In Midtown East, Martha's Vineyard (Massachusetts), cost: 450, room type: Entire home/apt, house rules: No children under 10 & No smoking, minimum nights: 2, maximum occupancy: 3\n\nNumber of people = 3\nTotal cost = 146 * 3 + (34 + 35) * 3 + 450 = 1089\nAccommodation minimum nights: 1/2\n\nDays: 4,\nCurrent City: Martha's Vineyard (Massachusetts),\nTransportation: -,\nBreakfast: Midnight Chef, Martha's Vineyard (Massachusetts), cost: 39, cuisines: \u201cCafe, Desserts\u201d\nAttraction: East Chop Lighthouse, Martha's Vineyard (Massachusetts); Gay Head Light, Martha's Vineyard (Massachusetts);\nLunch: Prankster, Martha's Vineyard (Massachusetts), cost: 34, cuisines: \u201cBakery, BBQ, Fast Food\u201d\nDinner: The Punjab Kitchen, Martha's Vineyard (Massachusetts), cost: 80, cuisines: \u201cTea, French, Bakery, Italian\u201d\nAccommodation: One Bed Room Apt In Midtown East, Martha's Vineyard (Massachusetts), cost: 450, room type: Entire home/apt, house rules: No children under 10 & No smoking, minimum nights: 2, maximum occupancy: 3\n\nNumber of people = 3\nTotal cost = (39 + 34 + 80) * 3 + 450 = 981\nAccommodation minimum nights: 2/2 (Done!)\n\nDays: 5,\nCurrent City: from Martha's Vineyard (Massachusetts) to Myrtle Beach,\nTransportation: Self-driving, from Martha's Vineyard to Myrtle Beach, duration: 15 hours 35 mins, distance: 1,496 km, cost: 74\nBreakfast: -,\nAttraction: -,\nLunch: -,\nDinner: -,\nAccommodation: -\n\nNumber of people = 3\nTotal cost = 74 * 3 = 222\n\nTotal cost across all days = 1771 + 1415 + 1089 + 981 + 222 = 5478\n\nUnfortunately, the total cost exceeds the budget of $3,800. To adjust the plan within the budget, we would need to consider different accommodations or transportation options. Please let us know if you would like us to revise the plan accordingly.", "gpt-4-1106-preview_direct_sole-planning_parsed_results": [{"day": 1, "current_city": "from Myrtle Beach to Boston", "transportation": "Flight Number: F3613545, from Myrtle Beach to Boston, Departure Time: 18:13, Arrival Time: 20:03", "breakfast": "-", "attraction": "-", "lunch": "-", "dinner": "Club Cubana, Boston", "accommodation": "IN MINT CONDITION-STUDIOS EAST 44TH/UNITED NATIONS, Boston"}, {"day": 2, "current_city": "Boston", "transportation": "-", "breakfast": "Irish Democrat, Boston", "attraction": "Museum of Science, Boston; New England Aquarium, Boston;", "lunch": "Apni Rasoi, Boston", "dinner": "Red Mesa Restaurant, Boston", "accommodation": "IN MINT CONDITION-STUDIOS EAST 44TH/UNITED NATIONS, Boston"}, {"day": 3, "current_city": "from Boston to Martha's Vineyard", "transportation": "Taxi, from Boston to Martha's Vineyard, duration: 2 hours 34 mins, distance: 146 km", "breakfast": "-", "attraction": "Martha's Vineyard Museum, Martha's Vineyard", "lunch": "Yellow Dog Eats, Martha's Vineyard", "dinner": "Bern's Steak House, Martha's Vineyard", "accommodation": "One Bed Room Apt In Midtown East, Martha's Vineyard"}, {"day": 4, "current_city": "Martha's Vineyard", "transportation": "-", "breakfast": "Midnight Chef, Martha's Vineyard", "attraction": "East Chop Lighthouse, Martha's Vineyard; Gay Head Light, Martha's Vineyard;", "lunch": "Prankster, Martha's Vineyard", "dinner": "The Punjab Kitchen, Martha's Vineyard", "accommodation": "One Bed Room Apt In Midtown East, Martha's Vineyard"}, {"day": 5, "current_city": "from Martha's Vineyard to Myrtle Beach", "transportation": "Self-driving, from Martha's Vineyard to Myrtle Beach, duration: 15 hours 35 mins, distance: 1,496 km", "breakfast": "-", "attraction": "-", "lunch": "-", "dinner": "-", "accommodation": "-"}]}]