[{"gpt-4-1106-preview_direct_sole-planning_results": "Travel Plan:\nDays: 1,\nCurrent City: from Houston to Wichita,\nTransportation: Flight Number: F3811146, from Houston to Wichita, Departure Time: 14:17, Arrival Time: 16:13, cost: 168\nBreakfast: -,\nAttraction: -,\nLunch: -,\nDinner: Jahanpanah, Wichita, cost: 18, cuisines: \u201cIndian, Desserts, Fast Food\u201d\nAccommodation: Cute, clean studio in Central Harlem, Wichita, cost: 518, maximum occupancy: 3, house rules: No parties, minimum nights: 1\n\nNumber of people = 3\nTotal cost = (168 * 3) + (18 * 3) + 518 = 1,026\nAccommodation minimum nights:  1/1\n\nDays: 2,\nCurrent City: Wichita,\nTransportation: -,\nBreakfast: The Flying Saucer Cafe, Wichita, cost: 41, cuisines: \u201cTea, Cafe, Pizza, BBQ\u201d\nAttraction: Exploration Place, Wichita; The Keeper of the Plains, Wichita,\nLunch: Rumi's Kitchen, Wichita, cost: 34, cuisines: \u201cBakery, Fast Food, Cafe, Indian, Seafood\u201d\nDinner: Koramangala Social, Wichita, cost: 38, cuisines: \u201cTea, Bakery, Cafe, Indian, Mediterranean\u201d\nAccommodation: Cute, clean studio in Central Harlem, Wichita, cost: 518, maximum occupancy: 3, house rules: No parties, minimum nights: 1\n\nNumber of people = 3\nTotal cost = (41 + 34 + 38) * 3 + 518 = 1,035\nAccommodation minimum nights:  2/1\n\nDays: 3,\nCurrent City: from Wichita to Houston,\nTransportation: Flight Number: F3827300, from Wichita to Houston, Departure Time: 12:10, Arrival Time: 14:38, cost: 152\nBreakfast: Cafe Coffee Day, Wichita, cost: 99, cuisines: \u201cFrench, American, BBQ, Fast Food\u201d\nAttraction: -,\nLunch: -,\nDinner: -,\nAccommodation: -\n\nNumber of people = 3\nTotal cost = (152 * 3) + (99 * 3) = 753\n\nTotal cost across all days = 1,026 + 1,035 + 753 = 2,814\n\nNote: The total cost slightly exceeds the budget of $2,700. To adjust, we can consider changing the flight to a less expensive option or adjusting meal costs. However, given the provided data, this is the closest itinerary that meets the requirements and preferences stated in the query, including the necessity for smoking accommodations.", "gpt-4-1106-preview_direct_sole-planning_parsed_results": [{"day": 1, "current_city": "from Houston to Wichita", "transportation": "Flight Number: F3811146, from Houston to Wichita, Departure Time: 14:17, Arrival Time: 16:13", "breakfast": "-", "attraction": "-", "lunch": "-", "dinner": "Jahanpanah, Wichita", "accommodation": "Cute, clean studio in Central Harlem, Wichita"}, {"day": 2, "current_city": "Wichita", "transportation": "-", "breakfast": "The Flying Saucer Cafe, Wichita", "attraction": "Exploration Place, Wichita;The Keeper of the Plains, Wichita;", "lunch": "Rumi's Kitchen, Wichita", "dinner": "Koramangala Social, Wichita", "accommodation": "Cute, clean studio in Central Harlem, Wichita"}, {"day": 3, "current_city": "from Wichita to Houston", "transportation": "Flight Number: F3827300, from Wichita to Houston, Departure Time: 12:10, Arrival Time: 14:38", "breakfast": "Cafe Coffee Day, Wichita", "attraction": "-", "lunch": "-", "dinner": "-", "accommodation": "-"}]}]