[{"gpt-4-1106-preview_direct_sole-planning_results": "Travel Plan:\n\nDays: 1,\nCurrent City: from Akron to Augusta (Georgia),\nTransportation: Taxi, from Akron to Augusta, duration: 9 hours 36 mins, distance: 1,031 km, cost: 1031\nBreakfast: -,\nAttraction: -,\nLunch: -,\nDinner: B Merrell's, Augusta (Georgia), cost: 74, cuisines: \u201cTea, Pizza, Desserts, Fast Food\u201d\nAccommodation: Planta Baja Studio, Augusta (Georgia), cost: 637, room type: Entire home/apt, house rules: No smoking, minimum nights: 1, maximum occupancy: 4\n\nNumber of people = 2\nTotal cost = 1031 + (74 * 2) + 637 = 1816\nAccommodation minimum nights: 1/1\n\nDays: 2,\nCurrent City: Augusta (Georgia),\nTransportation: -,\nBreakfast: Fish Tales Lakeside Grille, Augusta (Georgia), cost: 37, cuisines: \u201cTea, Cafe, Bakery, Desserts\u201d\nAttraction: Augusta Riverwalk, Augusta (Georgia); Augusta Museum of History, Augusta (Georgia);\nLunch: Vinny Vanucchi's, Augusta (Georgia), cost: 45, cuisines: \u201cDesserts, Fast Food, Chinese, Indian, Seafood\u201d\nDinner: The Charcoal Chimney, Augusta (Georgia), cost: 86, cuisines: \u201cTea, Fast Food, BBQ, Italian\u201d\nAccommodation: Planta Baja Studio, Augusta (Georgia), cost: 637, room type: Entire home/apt, house rules: No smoking, minimum nights: 1, maximum occupancy: 4\n\nNumber of people = 2\nTotal cost = (37 + 45 + 86) * 2 + 637 = 973\nAccommodation minimum nights: 2/1\n\nDays: 3,\nCurrent City: from Augusta (Georgia) to Decatur (Georgia),\nTransportation: Taxi, from Augusta to Decatur, duration: 2 hours 19 mins, distance: 229 km, cost: 229\nBreakfast: Karari Kurry, Augusta (Georgia), cost: 29, cuisines: \u201cBakery, Indian, Cafe, Fast Food\u201d\nAttraction: DeKalb History Center Museum, Decatur (Georgia);\nLunch: Madhuban Restaurant - Welcome Hotel Rama International, Decatur (Georgia), cost: 47, cuisines: \u201cPizza, Bakery, Seafood\u201d\nDinner: Cafe Coffee Day, Decatur (Georgia), cost: 46, cuisines: \u201cTea, Cafe, BBQ, Mediterranean\u201d\nAccommodation: The Heart of the Lower East Side!, Decatur (Georgia), cost: 587, room type: Entire home/apt, house rules: No children under 10, minimum nights: 2, maximum occupancy: 2\n\nNumber of people = 2\nTotal cost = 229 + (29 + 47 + 46) * 2 + 587 = 1061\nAccommodation minimum nights: 1/2\n\nDays: 4,\nCurrent City: Decatur (Georgia),\nTransportation: -,\nBreakfast: Tandoori Hut, Decatur (Georgia), cost: 82, cuisines: \u201cPizza, American, Indian, Fast Food\u201d\nAttraction: Glenlake Park, Decatur (Georgia); Clyde Shepherd Nature Preserve, Decatur (Georgia);\nLunch: Dawat-E-Chaman, Decatur (Georgia), cost: 42, cuisines: \u201cChinese, BBQ, Fast Food, Cafe, Mediterranean\u201d\nDinner: Joey's Pizza, Decatur (Georgia), cost: 69, cuisines: \u201cTea, Pizza, Bakery, Chinese, Seafood\u201d\nAccommodation: The Heart of the Lower East Side!, Decatur (Georgia), cost: 587, room type: Entire home/apt, house rules: No children under 10, minimum nights: 2, maximum occupancy: 2\n\nNumber of people = 2\nTotal cost = (82 + 42 + 69) * 2 + 587 = 973\nAccommodation minimum nights: 2/2\n\nDays: 5,\nCurrent City: from Decatur (Georgia) to Atlanta (Georgia),\nTransportation: Taxi, from Decatur to Atlanta, duration: 19 mins, distance: 13.0 km, cost: 13\nBreakfast: Viva Hyderabad, Decatur (Georgia), cost: 12, cuisines: \u201cDesserts, Tea, Italian, Fast Food, Indian\u201d\nAttraction: Atlanta Botanical Garden, Atlanta (Georgia); Georgia Aquarium, Atlanta (Georgia);\nLunch: Saffron, Atlanta (Georgia), cost: 39, cuisines: \u201cTea, Cafe, Fast Food, Seafood\u201d\nDinner: Asian Bistro, Atlanta (Georgia), cost: 27, cuisines: \u201cTea, Bakery, Seafood\u201d\nAccommodation: FABULOUS SUNNY BEDROOM IN HARLEM, Atlanta (Georgia), cost: 587, room type: Private room, house rules: No parties, minimum nights: 20, maximum occupancy: 2\n\nNumber of people = 2\nTotal cost = 13 + (12 + 39 + 27) * 2 + 587 = 756\nAccommodation minimum nights: 1/20\n\nDays: 6,\nCurrent City: Atlanta (Georgia),\nTransportation: -,\nBreakfast: Adda, Atlanta (Georgia), cost: 22, cuisines: \u201cTea, Mexican, Bakery\u201d\nAttraction: World of Coca-Cola, Atlanta (Georgia); Martin Luther King, Jr. National Historical Park, Atlanta (Georgia);\nLunch: Chef Style, Atlanta (Georgia), cost: 59, cuisines: \u201cPizza, American, Desserts, Seafood\u201d\nDinner: Pizza Central, Atlanta (Georgia), cost: 75, cuisines: \u201cCafe, Bakery, BBQ, Fast Food, Chinese, Indian\u201d\nAccommodation: FABULOUS SUNNY BEDROOM IN HARLEM, Atlanta (Georgia), cost: 587, room type: Private room, house rules: No parties, minimum nights: 20, maximum occupancy: 2\n\nNumber of people = 2\nTotal cost = (22 + 59 + 75) * 2 + 587 = 899\nAccommodation minimum nights: 2/20\n\nDays: 7,\nCurrent City: from Atlanta (Georgia) to Akron,\nTransportation: Taxi, from Atlanta to Akron, duration: 10 hours 10 mins, distance: 1,114 km, cost: 1114\nBreakfast: Ahata, Atlanta (Georgia), cost: 17, cuisines: \u201cTea, Indian, Desserts\u201d\nAttraction: -,\nLunch: -,\nDinner: -,\nAccommodation: -\n\nNumber of people = 2\nTotal cost = 1114 + (17 * 2) = 1148\n\nTotal cost across all days = 1816 + 973 + 1061 + 973 + 756 + 899 + 1148 = 7626\nCuisines: The prompt specifies American and Chinese, and both of these cuisines have been represented in the restaurants chosen.", "gpt-4-1106-preview_direct_sole-planning_parsed_results": [{"day": 1, "current_city": "from Akron to Augusta", "transportation": "Taxi, from Akron to Augusta, duration: 9 hours 36 mins, distance: 1,031 km", "breakfast": "-", "attraction": "-", "lunch": "-", "dinner": "B Merrell's, Augusta", "accommodation": "Planta Baja Studio, Augusta"}, {"day": 2, "current_city": "Augusta", "transportation": "-", "breakfast": "Fish Tales Lakeside Grille, Augusta", "attraction": "Augusta Riverwalk, Augusta;Augusta Museum of History, Augusta;", "lunch": "Vinny Vanucchi's, Augusta", "dinner": "The Charcoal Chimney, Augusta", "accommodation": "Planta Baja Studio, Augusta"}, {"day": 3, "current_city": "from Augusta to Decatur", "transportation": "Taxi, from Augusta to Decatur, duration: 2 hours 19 mins, distance: 229 km", "breakfast": "Karari Kurry, Augusta", "attraction": "DeKalb History Center Museum, Decatur", "lunch": "Madhuban Restaurant - Welcome Hotel Rama International, Decatur", "dinner": "Cafe Coffee Day, Decatur", "accommodation": "The Heart of the Lower East Side!, Decatur"}, {"day": 4, "current_city": "Decatur", "transportation": "-", "breakfast": "Tandoori Hut, Decatur", "attraction": "Glenlake Park, Decatur;Clyde Shepherd Nature Preserve, Decatur;", "lunch": "Dawat-E-Chaman, Decatur", "dinner": "Joey's Pizza, Decatur", "accommodation": "The Heart of the Lower East Side!, Decatur"}, {"day": 5, "current_city": "from Decatur to Atlanta", "transportation": "Taxi, from Decatur to Atlanta, duration: 19 mins, distance: 13.0 km", "breakfast": "Viva Hyderabad, Decatur", "attraction": "Atlanta Botanical Garden, Atlanta;Georgia Aquarium, Atlanta;", "lunch": "Saffron, Atlanta", "dinner": "Asian Bistro, Atlanta", "accommodation": "FABULOUS SUNNY BEDROOM IN HARLEM, Atlanta"}, {"day": 6, "current_city": "Atlanta", "transportation": "-", "breakfast": "Adda, Atlanta", "attraction": "World of Coca-Cola, Atlanta;Martin Luther King, Jr. National Historical Park, Atlanta;", "lunch": "Chef Style, Atlanta", "dinner": "Pizza Central, Atlanta", "accommodation": "FABULOUS SUNNY BEDROOM IN HARLEM, Atlanta"}, {"day": 7, "current_city": "from Atlanta to Akron", "transportation": "Taxi, from Atlanta to Akron, duration: 10 hours 10 mins, distance: 1,114 km", "breakfast": "Ahata, Atlanta", "attraction": "-", "lunch": "-", "dinner": "-", "accommodation": "-"}]}]