[{"gpt-4-1106-preview_direct_sole-planning_results": "Travel Plan:\nDays: 1,\nCurrent City: from Sarasota to Philadelphia,\nTransportation: Flight Number: F3797423, from Sarasota to Philadelphia, Departure Time: 11:54, Arrival Time: 14:46, cost: 289\nBreakfast: -,\nAttraction: -,\nLunch: -,\nDinner: Hong Kong Cafe, Philadelphia, cost: 47, cuisines: \u201cTea, Pizza, Italian, BBQ, Cafe\u201d\nAccommodation: Brooklyn Room in Hip Neighborhood - Close to Train, Philadelphia, cost: 742, room type: Private room, house rules: No parties & No children under 10 & No smoking, minimum nights: 1, maximum occupancy: 1\n\nNumber of people = 1\nTotal cost = 289 + 47 + 742 = 1,078\nAccommodation minimum nights:  1/1\n\nDays: 2,\nCurrent City: Philadelphia,\nTransportation: -,\nBreakfast: Red Ginger Sushi, Grill & Bar, Philadelphia, cost: 98, cuisines: \u201cTea, Cafe, Indian, Fast Food\u201d\nAttraction: The Franklin Institute, Philadelphia; Liberty Bell, Philadelphia,\nLunch: Marukame Udon, Philadelphia, cost: 100, cuisines: \u201cTea, Pizza, Italian, BBQ, Fast Food, Chinese\u201d\nDinner: The Moon Under Water, Philadelphia, cost: 94, cuisines: \u201cPizza, Italian, BBQ, Bakery, Fast Food, Mediterranean\u201d\nAccommodation: Industrial Loft Living in NYC, Philadelphia, cost: 178, room type: Entire home/apt, house rules: No smoking, minimum nights: 4, maximum occupancy: 3\n\nNumber of people = 1\nTotal cost = 98 + 100 + 94 + 178 = 470\nAccommodation minimum nights:  1/4\n\nDays: 3,\nCurrent City: from Philadelphia to Sarasota,\nTransportation: Flight Number: F3633008, from Philadelphia to Sarasota, Departure Time: 08:06, Arrival Time: 10:51, cost: 246\nBreakfast: -,\nAttraction: -,\nLunch: -,\nDinner: -,\nAccommodation: -\n\nNumber of people = 1\nTotal cost = 246\n\nTotal cost across all days = 1,078 + 470 + 246 = 1,794\nCuisines: The prompt specifies no cuisines, so all cuisine constraints are satisfied\nHouse rules: All accommodations chosen adhere to the specified house rules.\n\n***** Travel Plan Ends *****", "gpt-4-1106-preview_direct_sole-planning_parsed_results": [{"day": 1, "current_city": "from Sarasota to Philadelphia", "transportation": "Flight Number: F3797423, from Sarasota to Philadelphia, Departure Time: 11:54, Arrival Time: 14:46", "breakfast": "-", "attraction": "-", "lunch": "-", "dinner": "Hong Kong Cafe, Philadelphia", "accommodation": "Brooklyn Room in Hip Neighborhood - Close to Train, Philadelphia"}, {"day": 2, "current_city": "Philadelphia", "transportation": "-", "breakfast": "Red Ginger Sushi, Grill & Bar, Philadelphia", "attraction": "The Franklin Institute, Philadelphia;Liberty Bell, Philadelphia;", "lunch": "Marukame Udon, Philadelphia", "dinner": "The Moon Under Water, Philadelphia", "accommodation": "Industrial Loft Living in NYC, Philadelphia"}, {"day": 3, "current_city": "from Philadelphia to Sarasota", "transportation": "Flight Number: F3633008, from Philadelphia to Sarasota, Departure Time: 08:06, Arrival Time: 10:51", "breakfast": "-", "attraction": "-", "lunch": "-", "dinner": "-", "accommodation": "-"}]}]