[{"gpt-4-1106-preview_direct_sole-planning_results": "Travel Plan:\n\nDays: 1,\nCurrent City: from Salt Lake City to Abilene (Texas),\nTransportation: Self-driving, from Salt Lake City to Abilene, duration: 16 hours 59 mins, distance: 1,740 km, cost: 87\nBreakfast: -,\nAttraction: -,\nLunch: -,\nDinner: Thai Garden, Abilene (Texas), cost: 13, cuisines: \u201cCafe, American, Desserts\u201d\nAccommodation: Apartment minutes from manhattan, Abilene (Texas), cost: 295, room type: Entire home/apt, house rules: No pets & No visitors, minimum nights: 2, maximum occupancy: 2\n\nNumber of people = 8\nTotal cost = 8 * 87 + 8 * 13 + (295 * 4) = 696 + 104 + 1180 = 1980\nAccommodation minimum nights: 1/2\n\nDays: 2,\nCurrent City: Abilene (Texas),\nTransportation: -,\nBreakfast: Crispy Crust, Abilene (Texas), cost: 54, cuisines: \u201cDesserts, Bakery, Cafe, American, Seafood\u201d\nAttraction: The Grace Museum, Abilene (Texas); Frontier Texas!, Abilene (Texas);\nLunch: Finger Licious, Abilene (Texas), cost: 35, cuisines: \u201cFast Food, Cafe, BBQ, Seafood\u201d\nDinner: LPK Waterfront, Abilene (Texas), cost: 61, cuisines: \u201cPizza, Italian, BBQ, Fast Food, Seafood\u201d\nAccommodation: Apartment minutes from manhattan, Abilene (Texas), cost: 295, room type: Entire home/apt, house rules: No pets & No visitors, minimum nights: 2, maximum occupancy: 2\n\nNumber of people = 8\nTotal cost = (54 + 35 + 61) * 8 + (295 * 4) = 1200 + 1180 = 2380\nAccommodation minimum nights: 2/2 (Done!)\n\nDays: 3,\nCurrent City: from Abilene (Texas) to Amarillo (Texas),\nTransportation: Self-driving, from Abilene to Amarillo, duration: 4 hours 10 mins, distance: 446 km, cost: 22\nBreakfast: -,\nAttraction: Cadillac Ranch, Amarillo (Texas); Amarillo Botanical Gardens, Amarillo (Texas);\nLunch: The Cinnamon Kitchen, Amarillo (Texas), cost: 69, cuisines: \u201cDesserts, Tea, Pizza, Chinese, Seafood\u201d\nDinner: Komachi, Amarillo (Texas), cost: 71, cuisines: \u201cDesserts, Tea, Fast Food, Chinese, Mediterranean\u201d\nAccommodation: Gramercy Park restful, cozy, sun-filled home, Amarillo (Texas), cost: 968, room type: Entire home/apt, house rules: No parties, minimum nights: 2, maximum occupancy: 8\n\nNumber of people = 8\nTotal cost = 8 * 22 + (69 + 71) * 8 + 968 = 176 + 1120 + 968 = 2264\nAccommodation minimum nights: 1/2\n\nDays: 4,\nCurrent City: Amarillo (Texas),\nTransportation: -,\nBreakfast: Kanha North & South Indian Veg., Amarillo (Texas), cost: 34, cuisines: \u201cTea, Cafe, BBQ, Fast Food\u201d\nAttraction: Amarillo Zoo, Amarillo (Texas); Don Harrington Discovery Center, Amarillo (Texas);\nLunch: Sigree Global Grill, Amarillo (Texas), cost: 35, cuisines: \u201cChinese, BBQ, Cafe, Desserts\u201d\nDinner: Anand Restaurant, Amarillo (Texas), cost: 53, cuisines: \u201cFast Food, Seafood, Desserts, Italian\u201d\nAccommodation: Gramercy Park restful, cozy, sun-filled home, Amarillo (Texas), cost: 968, room type: Entire home/apt, house rules: No parties, minimum nights: 2, maximum occupancy: 8\n\nNumber of people = 8\nTotal cost = (34 + 35 + 53) * 8 + 968 = 976 + 968 = 1944\nAccommodation minimum nights: 2/2 (Done!)\n\nDays: 5,\nCurrent City: from Amarillo (Texas) to Salt Lake City,\nTransportation: Self-driving, from Amarillo to Salt Lake City, duration: 13 hours 45 mins, distance: 1,419 km, cost: 70\nBreakfast: -,\nAttraction: -,\nLunch: -,\nDinner: -,\nAccommodation: -\n\nNumber of people = 8\nTotal cost = 8 * 70 = 560\n\nTotal cost across all days = 1980 + 2380 + 2264 + 1944 + 560 = 9128\nCuisines: The prompt specifies no cuisines, so all cuisine constraints are satisfied.\nHouse rules: All accommodations chosen are visitors-friendly as per the house rules specified.\n\nPlease note that the accommodation in Abilene has a \"No visitors\" house rule, which may not align with the \"visitors-friendly\" requirement. However, due to the lack of available information on other accommodations in Abilene that allow visitors, this was the best option within the given budget and constraints. If more options are available, an alternative accommodation that allows visitors should be chosen.", "gpt-4-1106-preview_direct_sole-planning_parsed_results": [{"day": 1, "current_city": "from Salt Lake City to Abilene", "transportation": "Self-driving, from Salt Lake City to Abilene, duration: 16 hours 59 mins, distance: 1,740 km", "breakfast": "-", "attraction": "-", "lunch": "-", "dinner": "Thai Garden, Abilene", "accommodation": "Apartment minutes from manhattan, Abilene"}, {"day": 2, "current_city": "Abilene", "transportation": "-", "breakfast": "Crispy Crust, Abilene", "attraction": "The Grace Museum, Abilene;Frontier Texas!, Abilene;", "lunch": "Finger Licious, Abilene", "dinner": "LPK Waterfront, Abilene", "accommodation": "Apartment minutes from manhattan, Abilene"}, {"day": 3, "current_city": "from Abilene to Amarillo", "transportation": "Self-driving, from Abilene to Amarillo, duration: 4 hours 10 mins, distance: 446 km", "breakfast": "-", "attraction": "Cadillac Ranch, Amarillo;Amarillo Botanical Gardens, Amarillo;", "lunch": "The Cinnamon Kitchen, Amarillo", "dinner": "Komachi, Amarillo", "accommodation": "Gramercy Park restful, cozy, sun-filled home, Amarillo"}, {"day": 4, "current_city": "Amarillo", "transportation": "-", "breakfast": "Kanha North & South Indian Veg., Amarillo", "attraction": "Amarillo Zoo, Amarillo;Don Harrington Discovery Center, Amarillo;", "lunch": "Sigree Global Grill, Amarillo", "dinner": "Anand Restaurant, Amarillo", "accommodation": "Gramercy Park restful, cozy, sun-filled home, Amarillo"}, {"day": 5, "current_city": "from Amarillo to Salt Lake City", "transportation": "Self-driving, from Amarillo to Salt Lake City, duration: 13 hours 45 mins, distance: 1,419 km", "breakfast": "-", "attraction": "-", "lunch": "-", "dinner": "-", "accommodation": "-"}]}]