[{"gpt-4-1106-preview_direct_sole-planning_results": "Travel Plan:\n\nDays: 1,\nCurrent City: from Panama City to Nashville,\nTransportation: Flight Number: F3985881, from Panama City to Nashville, Departure Time: 18:07, Arrival Time: 19:13, cost: 124\nBreakfast: -,\nAttraction: -,\nLunch: -,\nDinner: Bablu Fast Food, Nashville, cost: 13, cuisines: \u201cDesserts, Pizza, Mexican, BBQ, Fast Food\u201d\nAccommodation: Huge 2 Bedroom, Great Location, Express Metro, Nashville, cost: 745, room type: Entire home/apt, house rules: No smoking & No children under 10 & No pets, minimum nights: 4, maximum occupancy: 4\n\nNumber of people = 2\nTotal cost = (124 * 2) + (13 * 2) + 745 = 1,019\nAccommodation minimum nights: 1/4\n\nDays: 2,\nCurrent City: Nashville,\nTransportation: -,\nBreakfast: Oh! Calcutta, Nashville, cost: 83, cuisines: \u201cTea, Mexican, BBQ, Cafe, Indian\u201d\nAttraction: Country Music Hall of Fame and Museum, Nashville; Nashville Zoo at Grassmere, Nashville,\nLunch: Twigly, Nashville, cost: 14, cuisines: \u201cPizza, French, Fast Food, Chinese, Seafood\u201d\nDinner: Dialogue Lounge & Caf\u6106, Nashville, cost: 83, cuisines: \u201cTea, Indian, BBQ, Cafe, American, Seafood\u201d\nAccommodation: Huge 2 Bedroom, Great Location, Express Metro, Nashville, cost: 745, room type: Entire home/apt, house rules: No smoking & No children under 10 & No pets, minimum nights: 4, maximum occupancy: 4\n\nNumber of people = 2\nTotal cost = (83 + 14 + 83) * 2 + 745 = 1,021\nAccommodation minimum nights: 2/4\n\nDays: 3,\nCurrent City: from Nashville to Panama City,\nTransportation: Flight Number: F4012165, from Nashville to Panama City, Departure Time: 07:32, Arrival Time: 08:46, cost: 105\nBreakfast: -,\nAttraction: -,\nLunch: -,\nDinner: -,\nAccommodation: -\n\nNumber of people = 2\nTotal cost = 105 * 2 = 210\n\nTotal cost across all days = 1,019 + 1,021 + 210 = 2,250\n\nCuisines: The prompt specifies no cuisines, so all cuisine constraints are satisfied.\nHouse rules: All accommodations chosen are entire homes/apartments and not shared rooms, meeting the query's requirements.\n\n***** Travel Plan Ends *****", "gpt-4-1106-preview_direct_sole-planning_parsed_results": [{"day": 1, "current_city": "from Panama City to Nashville", "transportation": "Flight Number: F3985881, from Panama City to Nashville, Departure Time: 18:07, Arrival Time: 19:13", "breakfast": "-", "attraction": "-", "lunch": "-", "dinner": "Bablu Fast Food, Nashville", "accommodation": "Huge 2 Bedroom, Great Location, Express Metro, Nashville"}, {"day": 2, "current_city": "Nashville", "transportation": "-", "breakfast": "Oh! Calcutta, Nashville", "attraction": "Country Music Hall of Fame and Museum, Nashville;Nashville Zoo at Grassmere, Nashville;", "lunch": "Twigly, Nashville", "dinner": "Dialogue Lounge & Caf\u6106, Nashville", "accommodation": "Huge 2 Bedroom, Great Location, Express Metro, Nashville"}, {"day": 3, "current_city": "from Nashville to Panama City", "transportation": "Flight Number: F4012165, from Nashville to Panama City, Departure Time: 07:32, Arrival Time: 08:46", "breakfast": "-", "attraction": "-", "lunch": "-", "dinner": "-", "accommodation": "-"}]}]