[{"gpt-4-1106-preview_direct_sole-planning_results": "Travel Plan:\n\nDays: 1,\nCurrent City: from Atlanta to Knoxville,\nTransportation: Flight Number: F3556207, from Atlanta to Knoxville, Departure Time: 10:57, Arrival Time: 11:42, cost: 45\nBreakfast: -,\nAttraction: -,\nLunch: -,\nDinner: Cafe Arabelle, Knoxville, cost: 29, cuisines: \u201cFrench, BBQ, Desserts, Seafood\u201d\nAccommodation: Light-filled Room in Renovated Apt, Knoxville, cost: 310, room type: Private room, house rules: No pets, minimum nights: 2, maximum occupancy: 2\n\nNumber of people = 1 (assuming solo traveler as not specified)\nTotal cost = 45 + 29 + 310 = 384\nAccommodation minimum nights: 1/2\n\nDays: 2,\nCurrent City: Knoxville,\nTransportation: -,\nBreakfast: Les 3 Brasseurs, Knoxville, cost: 24, cuisines: \u201cDesserts, Pizza, Italian, Cafe, Indian\u201d\nAttraction: World's Fair Park, Knoxville; Knoxville Museum of Art, Knoxville; Sunsphere, Knoxville,\nLunch: Rama Vaishnav Bhojnalaya, Knoxville, cost: 46, cuisines: \u201cTea, Cafe, Pizza, Desserts\u201d\nDinner: Mamagoto, Knoxville, cost: 14, cuisines: \u201cIndian, Mediterranean, Desserts, Seafood\u201d\nAccommodation: Light-filled Room in Renovated Apt, Knoxville, cost: 310, room type: Private room, house rules: No pets, minimum nights: 2, maximum occupancy: 2\n\nNumber of people = 1\nTotal cost = 24 + 46 + 14 + 310 = 394\nAccommodation minimum nights: 2/2 (Done!)\n\nDays: 3,\nCurrent City: from Knoxville to Atlanta,\nTransportation: Flight Number: F3517130, from Knoxville to Atlanta, Departure Time: 05:32, Arrival Time: 06:28, cost: 30\nBreakfast: -,\nAttraction: -,\nLunch: -,\nDinner: -,\nAccommodation: -\n\nNumber of people = 1\nTotal cost = 30\n\nTotal cost across all days = 384 + 394 + 30 = 808\nCuisines: The prompt specifies no cuisines, so all cuisine constraints are satisfied.\nHouse rules: All accommodations chosen allow children under the age of 10, as requested.\n\nNote: The travel plan assumes a solo traveler since the number of travelers was not specified in the query. If the number of travelers is more than one, the costs for meals and accommodations would need to be adjusted accordingly. The transportation method chosen is flight, as self-driving is not an option per the query. The total cost is within the specified budget of $1,000.", "gpt-4-1106-preview_direct_sole-planning_parsed_results": [{"day": 1, "current_city": "from Atlanta to Knoxville", "transportation": "Flight Number: F3556207, from Atlanta to Knoxville, Departure Time: 10:57, Arrival Time: 11:42", "breakfast": "-", "attraction": "-", "lunch": "-", "dinner": "Cafe Arabelle, Knoxville", "accommodation": "Light-filled Room in Renovated Apt, Knoxville"}, {"day": 2, "current_city": "Knoxville", "transportation": "-", "breakfast": "Les 3 Brasseurs, Knoxville", "attraction": "World's Fair Park, Knoxville;Knoxville Museum of Art, Knoxville;Sunsphere, Knoxville;", "lunch": "Rama Vaishnav Bhojnalaya, Knoxville", "dinner": "Mamagoto, Knoxville", "accommodation": "Light-filled Room in Renovated Apt, Knoxville"}, {"day": 3, "current_city": "from Knoxville to Atlanta", "transportation": "Flight Number: F3517130, from Knoxville to Atlanta, Departure Time: 05:32, Arrival Time: 06:28", "breakfast": "-", "attraction": "-", "lunch": "-", "dinner": "-", "accommodation": "-"}]}]