[{"gpt-4-1106-preview_direct_sole-planning_results": "Travel Plan:\n\nDays: 1,\nCurrent City: from Baton Rouge to Dallas,\nTransportation: Flight Number: F3594383, from Baton Rouge to Dallas, Departure Time: 16:24, Arrival Time: 17:55, cost: 113\nBreakfast: -,\nAttraction: -,\nLunch: -,\nDinner: Coconuts Fish Cafe, Dallas, cost: 38, cuisines: \u201cCafe, BBQ, Mediterranean, Fast Food\u201d\nAccommodation: Sunny Brooklyn room, Dallas, cost: 227, maximum occupancy: 2, house rules: Smoking permitted, minimum nights: 1\n\nNumber of people = 4\nTotal cost = (113 * 4) + (38 * 4) + (227 * 2) = 452 + 152 + 454 = 1,058\nAccommodation minimum nights:  1/1\n\nDays: 2,\nCurrent City: Dallas,\nTransportation: -,\nBreakfast: Cafe Gatherings, Dallas, cost: 17, cuisines: \u201cBakery, Indian, Desserts\u201d\nAttraction: The Dallas World Aquarium, Dallas; The Sixth Floor Museum at Dealey Plaza, Dallas,\nLunch: 1918 Bistro & Grill, Dallas, cost: 90, cuisines: \u201cTea, Pizza, BBQ, Seafood\u201d\nDinner: Yanki Sizzlers, Dallas, cost: 96, cuisines: \u201cCafe, French, Tea, Mediterranean\u201d\nAccommodation: Sunny Brooklyn room, Dallas, cost: 227, maximum occupancy: 2, house rules: Smoking permitted, minimum nights: 1\n\nNumber of people = 4\nTotal cost = (17 + 90 + 96) * 4 + (227 * 2) = 812 + 454 = 1,266\nAccommodation minimum nights:  2/1\n\nDays: 3,\nCurrent City: from Dallas to Baton Rouge,\nTransportation: Flight Number: F3594416, from Dallas to Baton Rouge, Departure Time: 14:36, Arrival Time: 15:58, cost: 184\nBreakfast: MONKS, Dallas, cost: 24, cuisines: \u201cTea, Pizza, Cafe, Mediterranean, Seafood\u201d\nAttraction: -,\nLunch: -,\nDinner: -,\nAccommodation: -\n\nNumber of people = 4\nTotal cost = (184 * 4) + (24 * 4) = 736 + 96 = 832\n\nTotal cost across all days = 1,058 + 1,266 + 832 = 3,156\nCuisines: The prompt specifies no cuisines, so all cuisine constraints are satisfied.\nHouse rules: All accommodations chosen allow smoking, as per the requirement.\n\nPlease note that the accommodation \"Sunny Brooklyn room\" in Dallas allows smoking, which meets the house rules requirement specified in the query. The cost of the travel plan is within the specified budget of $5,500.", "gpt-4-1106-preview_direct_sole-planning_parsed_results": [{"day": 1, "current_city": "from Baton Rouge to Dallas", "transportation": "Flight Number: F3594383, from Baton Rouge to Dallas, Departure Time: 16:24, Arrival Time: 17:55", "breakfast": "-", "attraction": "-", "lunch": "-", "dinner": "Coconuts Fish Cafe, Dallas", "accommodation": "Sunny Brooklyn room, Dallas"}, {"day": 2, "current_city": "Dallas", "transportation": "-", "breakfast": "Cafe Gatherings, Dallas", "attraction": "The Dallas World Aquarium, Dallas;The Sixth Floor Museum at Dealey Plaza, Dallas;", "lunch": "1918 Bistro & Grill, Dallas", "dinner": "Yanki Sizzlers, Dallas", "accommodation": "Sunny Brooklyn room, Dallas"}, {"day": 3, "current_city": "from Dallas to Baton Rouge", "transportation": "Flight Number: F3594416, from Dallas to Baton Rouge, Departure Time: 14:36, Arrival Time: 15:58", "breakfast": "MONKS, Dallas", "attraction": "-", "lunch": "-", "dinner": "-", "accommodation": "-"}]}]