[{"gpt-4-1106-preview_direct_sole-planning_results": "Travel Plan:\n\nDays: 1,\nCurrent City: from Charlotte to Marquette (Wisconsin),\nTransportation: Taxi, from Charlotte to Marquette, duration: 13 hours 1 min, distance: 1,371 km, cost: 1371\nBreakfast: -,\nAttraction: -,\nLunch: -,\nDinner: The Chop House, Marquette (Wisconsin), cost: 81, cuisines: \u201cDesserts, Tea, Pizza, Mexican, Bakery, Indian\u201d\nAccommodation: Huge Private Room Near Prospect Park, Marquette (Wisconsin), cost: 73, room type: Private room, house rules: No smoking & No visitors, minimum nights: 7, maximum occupancy: 2\n\nNumber of people = 2\nTotal cost = 1371 + (81 + 73) * 2 = 1678\nAccommodation minimum nights: 1/7\n\nDays: 2,\nCurrent City: Marquette (Wisconsin),\nTransportation: -,\nBreakfast: Ifthar, Marquette (Wisconsin), cost: 67, cuisines: \u201cBakery, American, Cafe, Desserts\u201d\nAttraction: Presque Isle Park, Marquette (Wisconsin); Marquette Harbor Lighthouse, Marquette (Wisconsin);\nLunch: Taste of Balingup, Marquette (Wisconsin), cost: 35, cuisines: \u201cBBQ, Desserts\u201d\nDinner: Dovetail, Marquette (Wisconsin), cost: 95, cuisines: \u201cFast Food, Indian, BBQ, Italian\u201d\nAccommodation: Huge Private Room Near Prospect Park, Marquette (Wisconsin), cost: 73, room type: Private room, house rules: No smoking & No visitors, minimum nights: 7, maximum occupancy: 2\n\nNumber of people = 2\nTotal cost = (67 + 35 + 95 + 73) * 2 = 540\nAccommodation minimum nights: 2/7\n\nDays: 3,\nCurrent City: from Marquette (Wisconsin) to Milwaukee (Wisconsin),\nTransportation: Taxi, from Marquette to Milwaukee, duration: 6 mins, distance: 2.0 km, cost: 2\nBreakfast: -,\nAttraction: -,\nLunch: -,\nDinner: Berco's, Milwaukee (Wisconsin), cost: 91, cuisines: \u201cDesserts, Pizza, Italian, Cafe, Seafood\u201d\nAccommodation: Affordable bedroom in the East Village!, Milwaukee (Wisconsin), cost: 184, room type: Private room, house rules: No parties, minimum nights: 2, maximum occupancy: 2\n\nNumber of people = 2\nTotal cost = 2 + (91 + 184) * 2 = 642\nAccommodation minimum nights: 1/2\n\nDays: 4,\nCurrent City: Milwaukee (Wisconsin),\nTransportation: -,\nBreakfast: Cool Basil, Milwaukee (Wisconsin), cost: 40, cuisines: \u201cChinese, Pizza, French, Fast Food, Cafe\u201d\nAttraction: Milwaukee Art Museum, Milwaukee (Wisconsin); Milwaukee Public Museum, Milwaukee (Wisconsin);\nLunch: Shankar Sweets, Milwaukee (Wisconsin), cost: 66, cuisines: \u201cTea, Bakery, Pizza, Fast Food\u201d\nDinner: Red, Milwaukee (Wisconsin), cost: 98, cuisines: \u201cDesserts, BBQ, Fast Food, Cafe, Mediterranean\u201d\nAccommodation: Affordable bedroom in the East Village!, Milwaukee (Wisconsin), cost: 184, room type: Private room, house rules: No parties, minimum nights: 2, maximum occupancy: 2\n\nNumber of people = 2\nTotal cost = (40 + 66 + 98 + 184) * 2 = 776\nAccommodation minimum nights: 2/2\n\nDays: 5,\nCurrent City: from Milwaukee (Wisconsin) to Charlotte,\nTransportation: Taxi, from Milwaukee to Charlotte, duration: 12 hours 58 mins, distance: 1,369 km, cost: 1369\nBreakfast: -,\nAttraction: -,\nLunch: -,\nDinner: -,\nAccommodation: -\n\nNumber of people = 2\nTotal cost = 1369 * 2 = 2738\n\nTotal cost across all days = 1678 + 540 + 642 + 776 + 2738 = 6374\n\nUnfortunately, the total cost of $6,374 exceeds the specified budget of $2,500. Adjustments will need to be made to the travel plan to fit within the budget constraints. This could involve selecting more affordable transportation options, such as self-driving instead of taking a taxi, or choosing less expensive accommodations and dining options.", "gpt-4-1106-preview_direct_sole-planning_parsed_results": [{"day": 1, "current_city": "from Charlotte to Marquette (Wisconsin)", "transportation": "Taxi, from Charlotte to Marquette, duration: 13 hours 1 min, distance: 1,371 km", "breakfast": "-", "attraction": "-", "lunch": "-", "dinner": "The Chop House, Marquette (Wisconsin)", "accommodation": "Huge Private Room Near Prospect Park, Marquette (Wisconsin)"}, {"day": 2, "current_city": "Marquette (Wisconsin)", "transportation": "-", "breakfast": "Ifthar, Marquette (Wisconsin)", "attraction": "Presque Isle Park, Marquette (Wisconsin);Marquette Harbor Lighthouse, Marquette (Wisconsin);", "lunch": "Taste of Balingup, Marquette (Wisconsin)", "dinner": "Dovetail, Marquette (Wisconsin)", "accommodation": "Huge Private Room Near Prospect Park, Marquette (Wisconsin)"}, {"day": 3, "current_city": "from Marquette (Wisconsin) to Milwaukee (Wisconsin)", "transportation": "Taxi, from Marquette to Milwaukee, duration: 6 mins, distance: 2.0 km", "breakfast": "-", "attraction": "-", "lunch": "-", "dinner": "Berco's, Milwaukee (Wisconsin)", "accommodation": "Affordable bedroom in the East Village!, Milwaukee (Wisconsin)"}, {"day": 4, "current_city": "Milwaukee (Wisconsin)", "transportation": "-", "breakfast": "Cool Basil, Milwaukee (Wisconsin)", "attraction": "Milwaukee Art Museum, Milwaukee (Wisconsin);Milwaukee Public Museum, Milwaukee (Wisconsin);", "lunch": "Shankar Sweets, Milwaukee (Wisconsin)", "dinner": "Red, Milwaukee (Wisconsin)", "accommodation": "Affordable bedroom in the East Village!, Milwaukee (Wisconsin)"}, {"day": 5, "current_city": "from Milwaukee (Wisconsin) to Charlotte", "transportation": "Taxi, from Milwaukee to Charlotte, duration: 12 hours 58 mins, distance: 1,369 km", "breakfast": "-", "attraction": "-", "lunch": "-", "dinner": "-", "accommodation": "-"}]}]