[{"gpt-4-1106-preview_direct_sole-planning_results": "Travel Plan:\n\nDays: 1,\nCurrent City: from Santa Ana to Durango (Colorado),\nTransportation: Taxi, from Santa Ana to Durango, duration: 11 hours 55 mins, distance: 1,245 km, cost: 1245\nBreakfast: -,\nAttraction: -,\nLunch: -,\nDinner: Samurai Japanese Cuisine & Sushi Bar, Durango (Colorado), cost: 67, cuisines: \u201cBakery, Desserts, Fast Food\u201d\nAccommodation: Luxury in Best Location, Durango (Colorado), cost: 70, room type: Entire home/apt, house rules: No children under 10 & No visitors, minimum nights: 1, maximum occupancy: 2\n\nNumber of people = 2\nTotal cost = 1245 + (67 * 2) + 70 = 1449\nAccommodation minimum nights: 1/1\n\nDays: 2,\nCurrent City: Durango (Colorado),\nTransportation: -,\nBreakfast: Chickenette, Durango (Colorado), cost: 31, cuisines: \u201cTea, Pizza, Desserts, Fast Food\u201d\nAttraction: Durango & Silverton Narrow Gauge Railroad, Durango (Colorado);\nLunch: Dub's High on the Hog, Durango (Colorado), cost: 98, cuisines: \u201cTea, Italian, French, Cafe, Seafood\u201d\nDinner: The Mashal, Durango (Colorado), cost: 85, cuisines: \u201cItalian, BBQ, Fast Food, Cafe, American, Seafood\u201d\nAccommodation: Luxury in Best Location, Durango (Colorado), cost: 70, room type: Entire home/apt, house rules: No children under 10 & No visitors, minimum nights: 1, maximum occupancy: 2\n\nNumber of people = 2\nTotal cost = (31 + 98 + 85) * 2 + 70 = 630\nAccommodation minimum nights: 2/1 (Done!)\n\nDays: 3,\nCurrent City: from Durango (Colorado) to Alamosa (Colorado),\nTransportation: Taxi, from Durango to Alamosa, duration: 2 hours 52 mins, distance: 240 km, cost: 240\nBreakfast: -,\nAttraction: San Luis Valley Museum | Alamosa, Alamosa (Colorado);\nLunch: Riverwalk Cafe, Alamosa (Colorado), cost: 97, cuisines: \u201cTea, Pizza, Fast Food\u201d\nDinner: Burger Singh, Alamosa (Colorado), cost: 95, cuisines: \u201cDesserts, Tea, BBQ, Chinese, Seafood\u201d\nAccommodation: Comfortable studio suite in midtown Manhattan, Alamosa (Colorado), cost: 67, room type: Entire home/apt, house rules: No parties & No smoking & No visitors, minimum nights: 1, maximum occupancy: 2\n\nNumber of people = 2\nTotal cost = 240 + (97 + 95) * 2 + 67 = 691\nAccommodation minimum nights: 1/1 (Done!)\n\nDays: 4,\nCurrent City: Alamosa (Colorado),\nTransportation: -,\nBreakfast: Cafe LazyMojo, Alamosa (Colorado), cost: 26, cuisines: \u201cTea, Pizza, American, Fast Food\u201d\nAttraction: Alamosa National Wildlife Refuge and Visitor Center, Alamosa (Colorado);\nLunch: The Diet Kitchen, Alamosa (Colorado), cost: 50, cuisines: \u201cPizza, Bakery, BBQ, American, Mediterranean\u201d\nDinner: Emperor's Lounge - The Taj Mahal Hotel, Alamosa (Colorado), cost: 65, cuisines: \u201cTea, Italian, BBQ, Cafe, Seafood\u201d\nAccommodation: Comfortable studio suite in midtown Manhattan, Alamosa (Colorado), cost: 67, room type: Entire home/apt, house rules: No parties & No smoking & No visitors, minimum nights: 1, maximum occupancy: 2\n\nNumber of people = 2\nTotal cost = (26 + 50 + 65) * 2 + 67 = 449\nAccommodation minimum nights: 2/1 (Done!)\n\nDays: 5,\nCurrent City: from Alamosa (Colorado) to Colorado Springs (Colorado),\nTransportation: Taxi, from Alamosa to Colorado Springs, duration: 2 hours 36 mins, distance: 263 km, cost: 263\nBreakfast: -,\nAttraction: Garden of the Gods, Colorado Springs (Colorado);\nLunch: Raglan Road Irish Pub and Restaurant, Colorado Springs (Colorado), cost: 97, cuisines: \u201cChinese, Bakery, Pizza, Mediterranean\u201d\nDinner: Derby, Colorado Springs (Colorado), cost: 67, cuisines: \u201cDesserts, Fast Food\u201d\nAccommodation: Large sunny park slope apartment, Colorado Springs (Colorado), cost: 82, room type: Entire home/apt, house rules: No smoking & No parties & No pets, minimum nights: 1, maximum occupancy: 3\n\nNumber of people = 2\nTotal cost = 263 + (97 + 67) * 2 + 82 = 673\nAccommodation minimum nights: 1/1 (Done!)\n\nDays: 6,\nCurrent City: Colorado Springs (Colorado),\nTransportation: -,\nBreakfast: GoGourmet, Colorado Springs (Colorado), cost: 66, cuisines: \u201cDesserts, Bakery, Fast Food, Indian, Seafood\u201d\nAttraction: Cheyenne Mountain Zoo, Colorado Springs (Colorado);\nLunch: Club Tokyo - Best Western Skycity Hotel, Colorado Springs (Colorado), cost: 64, cuisines: \u201cTea, Bakery, Mediterranean, Fast Food\u201d\nDinner: LIT Ultrabar, Colorado Springs (Colorado), cost: 94, cuisines: \u201cCafe, Italian, Fast Food, Chinese, Seafood\u201d\nAccommodation: Large sunny park slope apartment, Colorado Springs (Colorado), cost: 82, room type: Entire home/apt, house rules: No smoking & No parties & No pets, minimum nights: 1, maximum occupancy: 3\n\nNumber of people = 2\nTotal cost = (66 + 64 + 94) * 2 + 82 = 732\nAccommodation minimum nights: 2/1 (Done!)\n\nDays: 7,\nCurrent City: from Colorado Springs (Colorado) to Santa Ana,\nTransportation: Taxi, from Colorado Springs to Santa Ana, duration: 15 hours 52 mins, distance: 1,744 km, cost: 1744\nBreakfast: -,\nAttraction: -,\nLunch: -,\nDinner: -,\nAccommodation: -\n\nNumber of people = 2\nTotal cost = 1744 * 2 = 3488\n\nTotal cost across all days = 1449 + 630 + 691 + 449 + 673 + 732 + 3488 = 8112\n\nUnfortunately, the total cost exceeds the budget of $7,700. To adjust the plan within the budget, we can consider changing the transportation method or selecting different accommodations and restaurants. Please let me know how you would like to proceed.", "gpt-4-1106-preview_direct_sole-planning_parsed_results": [{"day": 1, "current_city": "from Santa Ana to Durango (Colorado)", "transportation": "Taxi, from Santa Ana to Durango, duration: 11 hours 55 mins, distance: 1,245 km", "breakfast": "-", "attraction": "-", "lunch": "-", "dinner": "Samurai Japanese Cuisine & Sushi Bar, Durango (Colorado)", "accommodation": "Luxury in Best Location, Durango (Colorado)"}, {"day": 2, "current_city": "Durango (Colorado)", "transportation": "-", "breakfast": "Chickenette, Durango (Colorado)", "attraction": "Durango & Silverton Narrow Gauge Railroad, Durango (Colorado);", "lunch": "Dub's High on the Hog, Durango (Colorado)", "dinner": "The Mashal, Durango (Colorado)", "accommodation": "Luxury in Best Location, Durango (Colorado)"}, {"day": 3, "current_city": "from Durango (Colorado) to Alamosa (Colorado)", "transportation": "Taxi, from Durango to Alamosa, duration: 2 hours 52 mins, distance: 240 km", "breakfast": "-", "attraction": "San Luis Valley Museum | Alamosa, Alamosa (Colorado);", "lunch": "Riverwalk Cafe, Alamosa (Colorado)", "dinner": "Burger Singh, Alamosa (Colorado)", "accommodation": "Comfortable studio suite in midtown Manhattan, Alamosa (Colorado)"}, {"day": 4, "current_city": "Alamosa (Colorado)", "transportation": "-", "breakfast": "Cafe LazyMojo, Alamosa (Colorado)", "attraction": "Alamosa National Wildlife Refuge and Visitor Center, Alamosa (Colorado);", "lunch": "The Diet Kitchen, Alamosa (Colorado)", "dinner": "Emperor's Lounge - The Taj Mahal Hotel, Alamosa (Colorado)", "accommodation": "Comfortable studio suite in midtown Manhattan, Alamosa (Colorado)"}, {"day": 5, "current_city": "from Alamosa (Colorado) to Colorado Springs (Colorado)", "transportation": "Taxi, from Alamosa to Colorado Springs, duration: 2 hours 36 mins, distance: 263 km", "breakfast": "-", "attraction": "Garden of the Gods, Colorado Springs (Colorado);", "lunch": "Raglan Road Irish Pub and Restaurant, Colorado Springs (Colorado)", "dinner": "Derby, Colorado Springs (Colorado)", "accommodation": "Large sunny park slope apartment, Colorado Springs (Colorado)"}, {"day": 6, "current_city": "Colorado Springs (Colorado)", "transportation": "-", "breakfast": "GoGourmet, Colorado Springs (Colorado)", "attraction": "Cheyenne Mountain Zoo, Colorado Springs (Colorado);", "lunch": "Club Tokyo - Best Western Skycity Hotel, Colorado Springs (Colorado)", "dinner": "LIT Ultrabar, Colorado Springs (Colorado)", "accommodation": "Large sunny park slope apartment, Colorado Springs (Colorado)"}, {"day": 7, "current_city": "from Colorado Springs (Colorado) to Santa Ana", "transportation": "Taxi, from Colorado Springs to Santa Ana, duration: 15 hours 52 mins, distance: 1,744 km", "breakfast": "-", "attraction": "-", "lunch": "-", "dinner": "-", "accommodation": "-"}]}]