[{"gpt-4-1106-preview_direct_sole-planning_results": "Travel Plan:\n\nDays: 1,\nCurrent City: from Las Vegas to Twin Falls (Idaho),\nTransportation: Self-driving, from Las Vegas to Twin Falls, duration: 7 hours 32 mins, distance: 796 km, cost: 39\nBreakfast: -,\nAttraction: -,\nLunch: -,\nDinner: Thai Paradise, Twin Falls (Idaho), cost: 87, cuisines: \u201cFast Food, Indian, Desserts, Seafood\u201d\nAccommodation: Charming studio, great location!!!, Twin Falls (Idaho), cost: 994, room type: Entire home/apt, house rules: No smoking & No pets, minimum nights: 2\n\nNumber of people = 2\nTotal cost = (39 + 87) * 2 + 994 = 1,246\nAccommodation minimum nights:  1/2\n\nDays: 2,\nCurrent City: Twin Falls (Idaho),\nTransportation: -,\nBreakfast: The Bake Studio, Twin Falls (Idaho), cost: 23, cuisines: \u201cTea, Pizza, Bakery, Fast Food, Mediterranean\u201d\nAttraction: Shoshone Falls Park, Twin Falls (Idaho); Centennial Waterfront Park, Twin Falls (Idaho),\nLunch: Subway, Twin Falls (Idaho), cost: 77, cuisines: \u201cFrench, BBQ, Chinese, Seafood\u201d\nDinner: Asia Kitchen, Twin Falls (Idaho), cost: 67, cuisines: \u201cTea, Cafe, BBQ, Desserts\u201d\nAccommodation: Charming studio, great location!!!, Twin Falls (Idaho), cost: 994, room type: Entire home/apt, house rules: No smoking & No pets, minimum nights: 2\n\nNumber of people = 2\nTotal cost = (23 + 77 + 67) * 2 + 994 = 1,328\nAccommodation minimum nights:  2/2 (Done!)\n\nDays: 3,\nCurrent City: from Twin Falls (Idaho) to Pocatello (Idaho),\nTransportation: Self-driving, from Twin Falls to Pocatello, duration: 1 hour 46 mins, distance: 183 km, cost: 9\nBreakfast: -,\nAttraction: Idaho Museum of Natural History, Pocatello (Idaho); Museum of Clean, Pocatello (Idaho),\nLunch: Deorio's, Pocatello (Idaho), cost: 59, cuisines: \u201cTea, Bakery, Fast Food, Mediterranean, Seafood\u201d\nDinner: Harvest Moon, Pocatello (Idaho), cost: 90, cuisines: \u201cPizza, Fast Food\u201d\nAccommodation: Entire Modern Studio Apartment/Prime Location, Pocatello (Idaho), cost: 1109, room type: Entire home/apt, house rules: No parties & No smoking, minimum nights: 30\n\nNumber of people = 2\nTotal cost = (9 + 59 + 90) * 2 + 1109 = 1,425\nAccommodation minimum nights:  1/30\n\nDays: 4,\nCurrent City: Pocatello (Idaho),\nTransportation: -,\nBreakfast: Ghar Ki Handi, Pocatello (Idaho), cost: 13, cuisines: \u201cCafe, Bakery, American, Fast Food\u201d\nAttraction: Zoo Idaho, Pocatello (Idaho); Fort Hall Replica and Commemorative Trading Post, Pocatello (Idaho),\nLunch: Oriental Kitchen Express, Pocatello (Idaho), cost: 36, cuisines: \u201cCafe, Bakery, Desserts\u201d\nDinner: 650 - The Global Kitchen, Pocatello (Idaho), cost: 83, cuisines: \u201cFrench, Bakery, Cafe\u201d\nAccommodation: Entire Modern Studio Apartment/Prime Location, Pocatello (Idaho), cost: 1109, room type: Entire home/apt, house rules: No parties & No smoking, minimum nights: 30\n\nNumber of people = 2\nTotal cost = (13 + 36 + 83) * 2 + 1109 = 1,387\nAccommodation minimum nights:  2/30\n\nDays: 5,\nCurrent City: from Pocatello (Idaho) to Boise (Idaho),\nTransportation: Self-driving, from Pocatello to Boise, duration: 3 hours 23 mins, distance: 377 km, cost: 18\nBreakfast: -,\nAttraction: Idaho State Museum, Boise (Idaho); Boise Art Museum, Boise (Idaho),\nLunch: TGI Friday's, Boise (Idaho), cost: 33, cuisines: \u201cCafe, Mexican, BBQ, Fast Food\u201d\nDinner: Dhaba By Claridges, Boise (Idaho), cost: 65, cuisines: \u201cDesserts, Italian, Fast Food, Chinese, Seafood\u201d\nAccommodation: Modern & Cozy 2 BR Private Apartment in Brooklyn, Boise (Idaho), cost: 843, room type: Entire home/apt, house rules: No children under 10, minimum nights: 2645\n\nNumber of people = 2\nTotal cost = (18 + 33 + 65) * 2 + 843 = 1,075\nAccommodation minimum nights:  1/2645\n\nDays: 6,\nCurrent City: Boise (Idaho),\nTransportation: -,\nBreakfast: Gopala Hari, Boise (Idaho), cost: 28, cuisines: \u201cTea, Pizza, Italian, Fast Food, Mediterranean, Seafood\u201d\nAttraction: Zoo Boise, Boise (Idaho); Camel's Back Park, Boise (Idaho),\nLunch: California Pizza Kitchen, Boise (Idaho), cost: 15, cuisines: \u201cTea, BBQ, Fast Food, Chinese, Indian\u201d\nDinner: 19 Flavours Biryani, Boise (Idaho), cost: 59, cuisines: \u201cCafe, BBQ, Seafood\u201d\nAccommodation: Modern & Cozy 2 BR Private Apartment in Brooklyn, Boise (Idaho), cost: 843, room type: Entire home/apt, house rules: No children under 10, minimum nights: 2645\n\nNumber of people = 2\nTotal cost = (28 + 15 + 59) * 2 + 843 = 1,046\nAccommodation minimum nights:  2/2645\n\nDays: 7,\nCurrent City: from Boise (Idaho) to Las Vegas,\nTransportation: Self-driving, from Boise to Las Vegas, duration: 9 hours 30 mins, distance: 1,004 km, cost: 50\nBreakfast: -,\nAttraction: -,\nLunch: -,\nDinner: -,\nAccommodation: -\n\nNumber of people = 2\nTotal cost = 50 * 2 = 100\n\nTotal cost across all days = 1,246 + 1,328 + 1,425 + 1,387 + 1,075 + 1,046 + 100 = 7,607\n\nUnfortunately, the total cost exceeds the specified budget of $5,100. Adjustments will need to be made to the plan to reduce costs, such as selecting more affordable accommodations or dining options. Additionally, the accommodation in Boise does not allow smoking, which does not meet the specified requirement. Please advise on which aspects of the trip are flexible to adjust the plan accordingly.", "gpt-4-1106-preview_direct_sole-planning_parsed_results": [{"day": 1, "current_city": "from Las Vegas to Twin Falls", "transportation": "Self-driving, from Las Vegas to Twin Falls, duration: 7 hours 32 mins, distance: 796 km", "breakfast": "-", "attraction": "-", "lunch": "-", "dinner": "Thai Paradise, Twin Falls", "accommodation": "Charming studio, great location!!!, Twin Falls"}, {"day": 2, "current_city": "Twin Falls", "transportation": "-", "breakfast": "The Bake Studio, Twin Falls", "attraction": "Shoshone Falls Park, Twin Falls;Centennial Waterfront Park, Twin Falls", "lunch": "Subway, Twin Falls", "dinner": "Asia Kitchen, Twin Falls", "accommodation": "Charming studio, great location!!!, Twin Falls"}, {"day": 3, "current_city": "from Twin Falls to Pocatello", "transportation": "Self-driving, from Twin Falls to Pocatello, duration: 1 hour 46 mins, distance: 183 km", "breakfast": "-", "attraction": "Idaho Museum of Natural History, Pocatello;Museum of Clean, Pocatello", "lunch": "Deorio's, Pocatello", "dinner": "Harvest Moon, Pocatello", "accommodation": "Entire Modern Studio Apartment/Prime Location, Pocatello"}, {"day": 4, "current_city": "Pocatello", "transportation": "-", "breakfast": "Ghar Ki Handi, Pocatello", "attraction": "Zoo Idaho, Pocatello;Fort Hall Replica and Commemorative Trading Post, Pocatello", "lunch": "Oriental Kitchen Express, Pocatello", "dinner": "650 - The Global Kitchen, Pocatello", "accommodation": "Entire Modern Studio Apartment/Prime Location, Pocatello"}, {"day": 5, "current_city": "from Pocatello to Boise", "transportation": "Self-driving, from Pocatello to Boise, duration: 3 hours 23 mins, distance: 377 km", "breakfast": "-", "attraction": "Idaho State Museum, Boise;Boise Art Museum, Boise", "lunch": "TGI Friday's, Boise", "dinner": "Dhaba By Claridges, Boise", "accommodation": "Modern & Cozy 2 BR Private Apartment in Brooklyn, Boise"}, {"day": 6, "current_city": "Boise", "transportation": "-", "breakfast": "Gopala Hari, Boise", "attraction": "Zoo Boise, Boise;Camel's Back Park, Boise", "lunch": "California Pizza Kitchen, Boise", "dinner": "19 Flavours Biryani, Boise", "accommodation": "Modern & Cozy 2 BR Private Apartment in Brooklyn, Boise"}, {"day": 7, "current_city": "from Boise to Las Vegas", "transportation": "Self-driving, from Boise to Las Vegas, duration: 9 hours 30 mins, distance: 1,004 km", "breakfast": "-", "attraction": "-", "lunch": "-", "dinner": "-", "accommodation": "-"}]}]