[{"gpt-4-1106-preview_direct_sole-planning_results": "Travel Plan:\n\nDays: 1,\nCurrent City: from Denver to Bozeman,\nTransportation: Flight Number: F3856156, from Denver to Bozeman, Departure Time: 16:07, Arrival Time: 17:49, cost: 108\nBreakfast: -,\nAttraction: -,\nLunch: -,\nDinner: McGuire's Irish Pub & Brewery, Bozeman, cost: 72, cuisines: \u201cFast Food, Desserts, Italian\u201d\nAccommodation: SPACIOUS STUDIO APT 3 IN PROSPECT LEFFERTS GARDENS, Bozeman, cost: 1060, maximum occupancy: 6, house rules: No children under 10 & No parties, minimum nights: 5\n\nNumber of people = 8\nTotal cost = (108 * 8) + (72 * 8) + (1060 * 2) = 864 + 576 + 2120 = 3560\nAccommodation minimum nights:  1/5\n\nDays: 2,\nCurrent City: Bozeman,\nTransportation: -,\nBreakfast: Jiquitaia, Bozeman, cost: 36, cuisines: \u201cTea, Pizza, American\u201d\nAttraction: Museum of the Rockies, Bozeman; Gallatin History Museum, Bozeman,\nLunch: Indo Chinese, Bozeman, cost: 66, cuisines: \u201cItalian, BBQ, Bakery, Fast Food, Chinese, Seafood\u201d\nDinner: Zaroob, Bozeman, cost: 67, cuisines: \u201cDesserts, Tea, French, BBQ, Bakery, Indian\u201d\nAccommodation: SPACIOUS STUDIO APT 3 IN PROSPECT LEFFERTS GARDENS, Bozeman, cost: 1060, maximum occupancy: 6, house rules: No children under 10 & No parties, minimum nights: 5\n\nNumber of people = 8\nTotal cost = (36 + 66 + 67) * 8 + (1060 * 2) = 1344 + 2120 = 3464\nAccommodation minimum nights:  2/5\n\nDays: 3,\nCurrent City: from Bozeman to Denver,\nTransportation: Flight Number: F3811817, from Bozeman to Denver, Departure Time: 10:50, Arrival Time: 12:23, cost: 187\nBreakfast: -,\nAttraction: -,\nLunch: -,\nDinner: -,\nAccommodation: -\n\nNumber of people = 8\nTotal cost = 187 * 8 = 1496\n\nTotal cost across all days = 3560 + 3464 + 1496 = 8520\n\n** Adjustments Required: The total cost exceeds the budget of $7,000. To fit within the budget, we need to switch from flights to a cheaper transportation method. **\n\nRevised Travel Plan:\n\nDays: 1,\nCurrent City: from Denver to Bozeman,\nTransportation: Taxi, from Denver to Bozeman, duration: 9 hours 54 mins, distance: 1,119 km, cost: 1119\nBreakfast: -,\nAttraction: -,\nLunch: -,\nDinner: McGuire's Irish Pub & Brewery, Bozeman, cost: 72, cuisines: \u201cFast Food, Desserts, Italian\u201d\nAccommodation: SPACIOUS STUDIO APT 3 IN PROSPECT LEFFERTS GARDENS, Bozeman, cost: 1060, maximum occupancy: 6, house rules: No children under 10 & No parties, minimum nights: 5\n\nNumber of people = 8\nTotal cost = (1119 * 8) + (72 * 8) + (1060 * 2) = 8952 + 576 + 2120 = 11648\nAccommodation minimum nights:  1/5\n\n** Adjustments Required: The total cost still exceeds the budget. We need to find a cheaper accommodation option. **\n\nRevised Accommodation:\nAccommodation: Sun-Filled Artist Loft in Private Townhouse, Bozeman, cost: 214, maximum occupancy: 2, house rules: No parties, minimum nights: 2\n\nRevised Total Cost for Day 1:\nTotal cost = (1119 * 8) + (72 * 8) + (214 * 4) = 8952 + 576 + 856 = 10384\n\n** Adjustments Required: The cost is still over budget. We will switch to self-driving to reduce transportation costs. **\n\nFinal Revised Travel Plan:\n\nDays: 1,\nCurrent City: from Denver to Bozeman,\nTransportation: Self-driving, from Denver to Bozeman, duration: 9 hours 54 mins, distance: 1,119 km, cost: 55\nBreakfast: -,\nAttraction: -,\nLunch: -,\nDinner: McGuire's Irish Pub & Brewery, Bozeman, cost: 72, cuisines: \u201cFast Food, Desserts, Italian\u201d\nAccommodation: Sun-Filled Artist Loft in Private Townhouse, Bozeman, cost: 214, maximum occupancy: 2, house rules: No parties, minimum nights: 2\n\nNumber of people = 8\nTotal cost = (55 * 8) + (72 * 8) + (214 * 4) = 440 + 576 + 856 = 1872\nAccommodation minimum nights:  1/2\n\nDays: 2,\nCurrent City: Bozeman,\nTransportation: -,\nBreakfast: Jiquitaia, Bozeman, cost: 36, cuisines: \u201cTea, Pizza, American\u201d\nAttraction: Museum of the Rockies, Bozeman; Gallatin History Museum, Bozeman,\nLunch: Indo Chinese, Bozeman, cost: 66, cuisines: \u201cItalian, BBQ, Bakery, Fast Food, Chinese, Seafood\u201d\nDinner: Zaroob, Bozeman, cost: 67, cuisines: \u201cDesserts, Tea, French, BBQ, Bakery, Indian\u201d\nAccommodation: Sun-Filled Artist Loft in Private Townhouse, Bozeman, cost: 214, maximum occupancy: 2, house rules: No parties, minimum nights: 2\n\nNumber of people = 8\nTotal cost = (36 + 66 + 67) * 8 + (214 * 4) = 1344 + 856 = 2200\nAccommodation minimum nights:  2/2\n\nDays: 3,\nCurrent City: from Bozeman to Denver,\nTransportation: Self-driving, from Bozeman to Denver, duration: 9 hours 46 mins, distance: 1,115 km, cost: 55\nBreakfast: -,\nAttraction: -,\nLunch: -,\nDinner: -,\nAccommodation: -\n\nNumber of people = 8\nTotal cost = 55 * 8 = 440\n\nTotal cost across all days = 1872 + 2200 + 440 = 4512\n\nCuisines: The prompt specifies American and Indian, and both of these cuisines have been represented in the restaurants chosen.", "gpt-4-1106-preview_direct_sole-planning_parsed_results": [{"day": 1, "current_city": "from Denver to Bozeman", "transportation": "Self-driving, from Denver to Bozeman, duration: 9 hours 54 mins, distance: 1,119 km", "breakfast": "-", "attraction": "-", "lunch": "-", "dinner": "McGuire's Irish Pub & Brewery, Bozeman", "accommodation": "Sun-Filled Artist Loft in Private Townhouse, Bozeman"}, {"day": 2, "current_city": "Bozeman", "transportation": "-", "breakfast": "Jiquitaia, Bozeman", "attraction": "Museum of the Rockies, Bozeman;Gallatin History Museum, Bozeman;", "lunch": "Indo Chinese, Bozeman", "dinner": "Zaroob, Bozeman", "accommodation": "Sun-Filled Artist Loft in Private Townhouse, Bozeman"}, {"day": 3, "current_city": "from Bozeman to Denver", "transportation": "Self-driving, from Bozeman to Denver, duration: 9 hours 46 mins, distance: 1,115 km", "breakfast": "-", "attraction": "-", "lunch": "-", "dinner": "-", "accommodation": "-"}]}]