[{"gpt-4-1106-preview_direct_sole-planning_results": "Travel Plan:\n\nDays: 1,\nCurrent City: from Oakland to Tucson,\nTransportation: Flight Number: F4002752, from Oakland to Tucson, Departure Time: 15:07, Arrival Time: 17:00, cost: 190\nBreakfast: -,\nAttraction: -,\nLunch: -,\nDinner: Villa Tevere, Tucson, cost: 37, cuisines: \u201cMexican, Mediterranean, Desserts, Fast Food\u201d\nAccommodation: Private room with private bathroom, Tucson, cost: 58, maximum occupancy: 2, house rules: No smoking, minimum nights: 2\n\nNumber of people = 1\nTotal cost = 190 + 37 + 58 = 285\nAccommodation minimum nights:  1/2\n\nDays: 2,\nCurrent City: Tucson,\nTransportation: -,\nBreakfast: Magic Spice Wok, Tucson, cost: 31, cuisines: \u201cCafe, Bakery, BBQ, Chinese, Seafood\u201d\nAttraction: Pima Air & Space Museum, Tucson; Tucson Botanical Gardens, Tucson,\nLunch: Consort Restaurant, Tucson, cost: 54, cuisines: \u201cBakery, Pizza, Indian, Desserts\u201d\nDinner: La Plage, Tucson, cost: 93, cuisines: \u201cSeafood, Bakery, Desserts, Italian\u201d\nAccommodation: Private room with private bathroom, Tucson, cost: 58, maximum occupancy: 2, house rules: No smoking, minimum nights: 2\n\nNumber of people = 1\nTotal cost = 31 + 54 + 93 + 58 = 236\nAccommodation minimum nights:  2/2 (Done!)\n\nDays: 3,\nCurrent City: from Tucson to Oakland,\nTransportation: Self-driving, from Tucson to Oakland, duration: 12 hours 42 mins, distance: 1,373 km, cost: 68\nBreakfast: -,\nAttraction: -,\nLunch: -,\nDinner: -,\nAccommodation: -\n\nNumber of people = 1\nTotal cost = 68\n\nTotal cost across all days = 285 + 236 + 68 = 589\nCuisines: The prompt specifies no cuisines, so all cuisine constraints are satisfied\nHouse rules: All accommodations chosen do not disallow smoking, and the minimum nights are met.\n\nNote: Since there is no flight from Tucson to Oakland on 2022-03-17, self-driving was chosen as the mode of transportation back to Oakland. The total cost is well within the budget of $1,400.", "gpt-4-1106-preview_direct_sole-planning_parsed_results": [{"day": 1, "current_city": "from Oakland to Tucson", "transportation": "Flight Number: F4002752, from Oakland to Tucson, Departure Time: 15:07, Arrival Time: 17:00", "breakfast": "-", "attraction": "-", "lunch": "-", "dinner": "Villa Tevere, Tucson", "accommodation": "Private room with private bathroom, Tucson"}, {"day": 2, "current_city": "Tucson", "transportation": "-", "breakfast": "Magic Spice Wok, Tucson", "attraction": "Pima Air & Space Museum, Tucson;Tucson Botanical Gardens, Tucson;", "lunch": "Consort Restaurant, Tucson", "dinner": "La Plage, Tucson", "accommodation": "Private room with private bathroom, Tucson"}, {"day": 3, "current_city": "from Tucson to Oakland", "transportation": "Self-driving, from Tucson to Oakland, duration: 12 hours 42 mins, distance: 1,373 km", "breakfast": "-", "attraction": "-", "lunch": "-", "dinner": "-", "accommodation": "-"}]}]