[{"gpt-4-1106-preview_direct_sole-planning_results": "Travel Plan:\n\nDays: 1,\nCurrent City: from Seattle to Orlando (Florida),\nTransportation: Flight Number: F3508009, from Seattle to Orlando (Florida), Departure Time: 08:07, Arrival Time: 16:29, cost: 706\nBreakfast: -,\nAttraction: -,\nLunch: -,\nDinner: Fuji Japanese Steakhouse, Orlando (Florida), cost: 75, cuisines: \u201cTea, Bakery, Desserts\u201d\nAccommodation: Sixth Ave Chelsea, Studio Serviced Apartment, Orlando (Florida), cost: 70, maximum occupancy: 3, house rules: No visitors & No pets, minimum nights: 30\n\nNumber of people = 4\nTotal cost = 706 * 4 + 75 * 4 + 70 * 4 = 3,524\nAccommodation minimum nights:  1/30\n\nDays: 2,\nCurrent City: Orlando (Florida),\nTransportation: -,\nBreakfast: The Tin Cow, Orlando (Florida), cost: 67, cuisines: \u201cBBQ, Desserts, Seafood\u201d\nAttraction: SeaWorld Orlando, Orlando (Florida); The Wheel at ICON Park, Orlando (Florida);\nLunch: Peg Leg Pete's, Orlando (Florida), cost: 91, cuisines: \u201cFrench, Bakery, Cafe\u201d\nDinner: Lalit Kathi Rolls Momos, Orlando (Florida), cost: 23, cuisines: \u201cTea, Pizza, Fast Food\u201d\nAccommodation: Sixth Ave Chelsea, Studio Serviced Apartment, Orlando (Florida), cost: 70, maximum occupancy: 3, house rules: No visitors & No pets, minimum nights: 30\n\nNumber of people = 4\nTotal cost = (67 + 91 + 23) * 4 + 70 * 4 = 1,008\nAccommodation minimum nights:  2/30\n\nDays: 3,\nCurrent City: from Orlando (Florida) to Panama City (Florida),\nTransportation: Taxi, from Orlando (Florida) to Panama City (Florida), duration: 5 hours 24 mins, distance: 574 km, cost: 574\nBreakfast: Butterburrs, Orlando (Florida), cost: 28, cuisines: \u201cPizza, Seafood\u201d\nAttraction: -,\nLunch: -,\nDinner: The Chaiwalas, Panama City (Florida), cost: 39, cuisines: \u201cTea, French, Bakery, Fast Food, Seafood\u201d\nAccommodation: Plant-filled colorful Bushwick bedroom!, Panama City (Florida), cost: 638, maximum occupancy: 1, house rules: No smoking & No parties, minimum nights: 5\n\nNumber of people = 4\nTotal cost = 574 * 4 + 28 * 4 + 39 * 4 + 638 * 4 = 5,108\nAccommodation minimum nights:  1/5\n\nDays: 4,\nCurrent City: Panama City (Florida),\nTransportation: -,\nBreakfast: Delicieux Ice Cream Rolls, Panama City (Florida), cost: 49, cuisines: \u201cTea, Bakery, Pizza\u201d\nAttraction: Sea Dragon Pirate Cruise, Panama City (Florida); ZooWorld Zoological Park, Panama City (Florida);\nLunch: Pind Balluchi, Panama City (Florida), cost: 63, cuisines: \u201cDesserts, Tea, Italian, BBQ, Indian\u201d\nDinner: The Old School Brew House, Panama City (Florida), cost: 78, cuisines: \u201cCafe, Pizza, Indian, BBQ\u201d\nAccommodation: Plant-filled colorful Bushwick bedroom!, Panama City (Florida), cost: 638, maximum occupancy: 1, house rules: No smoking & No parties, minimum nights: 5\n\nNumber of people = 4\nTotal cost = (49 + 63 + 78) * 4 + 638 * 4 = 3,304\nAccommodation minimum nights:  2/5\n\nDays: 5,\nCurrent City: from Panama City (Florida) to Tampa (Florida),\nTransportation: Taxi, from Panama City (Florida) to Tampa (Florida), duration: 5 hours 37 mins, distance: 603 km, cost: 603\nBreakfast: Grub Hub, Panama City (Florida), cost: 32, cuisines: \u201cDesserts, Fast Food\u201d\nAttraction: -,\nLunch: -,\nDinner: Kobe Hibachi & Sushi, Tampa (Florida), cost: 63, cuisines: \u201cDesserts, French, BBQ, Bakery, Seafood\u201d\nAccommodation: Lovely Guestroom in Elevator Building, Tampa (Florida), cost: 359, maximum occupancy: 2, house rules: No smoking & No visitors & No parties, minimum nights: 2\n\nNumber of people = 4\nTotal cost = 603 * 4 + 32 * 4 + 63 * 4 + 359 * 4 = 4,264\nAccommodation minimum nights:  1/2\n\nDays: 6,\nCurrent City: Tampa (Florida),\nTransportation: -,\nBreakfast: The Zaffran, Tampa (Florida), cost: 35, cuisines: \u201cTea, Bakery, Fast Food, American, Seafood\u201d\nAttraction: The Florida Aquarium, Tampa (Florida); Busch Gardens Tampa Bay, Tampa (Florida);\nLunch: Peg Leg Pete's, Tampa (Florida), cost: 91, cuisines: \u201cFrench, Bakery, Cafe\u201d\nDinner: Lalit Kathi Rolls Momos, Tampa (Florida), cost: 23, cuisines: \u201cTea, Pizza, Fast Food\u201d\nAccommodation: Lovely Guestroom in Elevator Building, Tampa (Florida), cost: 359, maximum occupancy: 2, house rules: No smoking & No visitors & No parties, minimum nights: 2\n\nNumber of people = 4\nTotal cost = (35 + 91 + 23) * 4 + 359 * 4 = 2,016\nAccommodation minimum nights:  2/2\n\nDays: 7,\nCurrent City: from Tampa (Florida) to Seattle,\nTransportation: Flight Number: F3749393, from Tampa (Florida) to Seattle, Departure Time: 07:53, Arrival Time: 10:56, cost: 1049\nBreakfast: -,\nAttraction: -,\nLunch: -,\nDinner: -,\nAccommodation: -\n\nNumber of people = 4\nTotal cost = 1049 * 4 = 4,196\n\nTotal cost across all days = 3,524 + 1,008 + 5,108 + 3,304 + 4,264 + 2,016 + 4,196 = 23,420\n\nGiven the provided budget of $14,700, the total cost of the proposed travel plan exceeds the budget. Adjustments will need to be made to the plan to fit within the budget constraints. This could involve selecting more cost-effective accommodations, dining options, or adjusting the transportation method.", "gpt-4-1106-preview_direct_sole-planning_parsed_results": [{"day": 1, "current_city": "from Seattle to Orlando (Florida)", "transportation": "Flight Number: F3508009, from Seattle to Orlando (Florida), Departure Time: 08:07, Arrival Time: 16:29", "breakfast": "-", "attraction": "-", "lunch": "-", "dinner": "Fuji Japanese Steakhouse, Orlando (Florida)", "accommodation": "Sixth Ave Chelsea, Studio Serviced Apartment, Orlando (Florida)"}, {"day": 2, "current_city": "Orlando (Florida)", "transportation": "-", "breakfast": "The Tin Cow, Orlando (Florida)", "attraction": "SeaWorld Orlando, Orlando (Florida);The Wheel at ICON Park, Orlando (Florida);", "lunch": "Peg Leg Pete's, Orlando (Florida)", "dinner": "Lalit Kathi Rolls Momos, Orlando (Florida)", "accommodation": "Sixth Ave Chelsea, Studio Serviced Apartment, Orlando (Florida)"}, {"day": 3, "current_city": "from Orlando (Florida) to Panama City (Florida)", "transportation": "Taxi, from Orlando (Florida) to Panama City (Florida), duration: 5 hours 24 mins, distance: 574 km", "breakfast": "Butterburrs, Orlando (Florida)", "attraction": "-", "lunch": "-", "dinner": "The Chaiwalas, Panama City (Florida)", "accommodation": "Plant-filled colorful Bushwick bedroom!, Panama City (Florida)"}, {"day": 4, "current_city": "Panama City (Florida)", "transportation": "-", "breakfast": "Delicieux Ice Cream Rolls, Panama City (Florida)", "attraction": "Sea Dragon Pirate Cruise, Panama City (Florida);ZooWorld Zoological Park, Panama City (Florida);", "lunch": "Pind Balluchi, Panama City (Florida)", "dinner": "The Old School Brew House, Panama City (Florida)", "accommodation": "Plant-filled colorful Bushwick bedroom!, Panama City (Florida)"}, {"day": 5, "current_city": "from Panama City (Florida) to Tampa (Florida)", "transportation": "Taxi, from Panama City (Florida) to Tampa (Florida), duration: 5 hours 37 mins, distance: 603 km", "breakfast": "Grub Hub, Panama City (Florida)", "attraction": "-", "lunch": "-", "dinner": "Kobe Hibachi & Sushi, Tampa (Florida)", "accommodation": "Lovely Guestroom in Elevator Building, Tampa (Florida)"}, {"day": 6, "current_city": "Tampa (Florida)", "transportation": "-", "breakfast": "The Zaffran, Tampa (Florida)", "attraction": "The Florida Aquarium, Tampa (Florida);Busch Gardens Tampa Bay, Tampa (Florida);", "lunch": "Peg Leg Pete's, Tampa (Florida)", "dinner": "Lalit Kathi Rolls Momos, Tampa (Florida)", "accommodation": "Lovely Guestroom in Elevator Building, Tampa (Florida)"}, {"day": 7, "current_city": "from Tampa (Florida) to Seattle", "transportation": "Flight Number: F3749393, from Tampa (Florida) to Seattle, Departure Time: 07:53, Arrival Time: 10:56", "breakfast": "-", "attraction": "-", "lunch": "-", "dinner": "-", "accommodation": "-"}]}]