[{"gpt-4-1106-preview_direct_sole-planning_results": "Travel Plan:\n\nDays: 1,\nCurrent City: from Salt Lake City to Twin Falls,\nTransportation: Flight Number: F3809095, from Salt Lake City to Twin Falls, Departure Time: 11:00, Arrival Time: 11:55, cost: 64\nBreakfast: -,\nAttraction: -,\nLunch: Subway, Twin Falls, cost: 77, cuisines: \u201cFrench, BBQ, Chinese, Seafood\u201d\nDinner: Fresc Co, Twin Falls, cost: 60, cuisines: \u201cDesserts, Mexican, BBQ, Mediterranean, Seafood\u201d\nAccommodation: Charming studio, great location!!!, Twin Falls, cost: 994, maximum occupancy: 8, house rules: No smoking & No pets, minimum nights: 2\n\nNumber of people = 2\nTotal cost = (64 + 77 + 60) * 2 + 994 = 1,396\nAccommodation minimum nights: 1/2\n\nDays: 2,\nCurrent City: Twin Falls,\nTransportation: -,\nBreakfast: The Bake Studio, Twin Falls, cost: 23, cuisines: \u201cTea, Pizza, Bakery, Fast Food, Mediterranean\u201d\nAttraction: Shoshone Falls Park, Twin Falls; Centennial Waterfront Park, Twin Falls,\nLunch: Asia Kitchen, Twin Falls, cost: 67, cuisines: \u201cTea, Cafe, BBQ, Desserts\u201d\nDinner: Thai Paradise, Twin Falls, cost: 87, cuisines: \u201cFast Food, Indian, Desserts, Seafood\u201d\nAccommodation: Charming studio, great location!!!, Twin Falls, cost: 994, maximum occupancy: 8, house rules: No smoking & No pets, minimum nights: 2\n\nNumber of people = 2\nTotal cost = (23 + 67 + 87) * 2 + 994 = 1,348\nAccommodation minimum nights: 2/2 (Done!)\n\nDays: 3,\nCurrent City: from Twin Falls to Salt Lake City,\nTransportation: Flight Number: F3807678, from Twin Falls to Salt Lake City, Departure Time: 12:35, Arrival Time: 13:20, cost: 56\nBreakfast: -,\nAttraction: -,\nLunch: -,\nDinner: -,\nAccommodation: -\n\nNumber of people = 2\nTotal cost = 56 * 2 = 112\n\nTotal cost across all days = 1,396 + 1,348 + 112 = 2,856\n\nCuisines: The prompt specifies Chinese and Mexican, and both of these cuisines have been represented in the restaurants chosen.\n\n**Note**: The total cost exceeds the specified budget of $1,600. To adjust the plan within the budget, we can consider changing the accommodation to a more affordable option and possibly using a different mode of transportation. Here's the revised plan with adjustments:\n\nRevised Travel Plan:\n\nDays: 1,\nCurrent City: from Salt Lake City to Twin Falls,\nTransportation: Self-driving, from Salt Lake City to Twin Falls, duration: 3 hours 13 mins, distance: 351 km, cost: 17\nBreakfast: -,\nAttraction: -,\nLunch: Subway, Twin Falls, cost: 77, cuisines: \u201cFrench, BBQ, Chinese, Seafood\u201d\nDinner: Fresc Co, Twin Falls, cost: 60, cuisines: \u201cDesserts, Mexican, BBQ, Mediterranean, Seafood\u201d\nAccommodation: Private room in E. Williamsburg! Budget friendly!, Twin Falls, cost: 283, maximum occupancy: 1, house rules: No pets, minimum nights: 3\n\nNumber of people = 2\nTotal cost = (17 + 77 + 60) * 2 + 283 = 541\n\nDays: 2,\nCurrent City: Twin Falls,\nTransportation: -,\nBreakfast: The Bake Studio, Twin Falls, cost: 23, cuisines: \u201cTea, Pizza, Bakery, Fast Food, Mediterranean\u201d\nAttraction: Shoshone Falls Park, Twin Falls; Centennial Waterfront Park, Twin Falls,\nLunch: Asia Kitchen, Twin Falls, cost: 67, cuisines: \u201cTea, Cafe, BBQ, Desserts\u201d\nDinner: Thai Paradise, Twin Falls, cost: 87, cuisines: \u201cFast Food, Indian, Desserts, Seafood\u201d\nAccommodation: Private room in E. Williamsburg! Budget friendly!, Twin Falls, cost: 283, maximum occupancy: 1, house rules: No pets, minimum nights: 3\n\nNumber of people = 2\nTotal cost = (23 + 67 + 87) * 2 + 283 = 680\n\nDays: 3,\nCurrent City: from Twin Falls to Salt Lake City,\nTransportation: Self-driving, from Twin Falls to Salt Lake City, duration: 3 hours 14 mins, distance: 351 km, cost: 17\nBreakfast: -,\nAttraction: -,\nLunch: -,\nDinner: -,\nAccommodation: -\n\nNumber of people = 2\nTotal cost = 17 * 2 = 34\n\nTotal revised cost across all days = 541 + 680 + 34 = 1,255\n\nThis revised plan is within the specified budget of $1,600.", "gpt-4-1106-preview_direct_sole-planning_parsed_results": [{"day": 1, "current_city": "from Salt Lake City to Twin Falls", "transportation": "Flight Number: F3809095, from Salt Lake City to Twin Falls, Departure Time: 11:00, Arrival Time: 11:55", "breakfast": "-", "attraction": "-", "lunch": "Subway, Twin Falls", "dinner": "Fresc Co, Twin Falls", "accommodation": "Charming studio, great location!!!, Twin Falls"}, {"day": 2, "current_city": "Twin Falls", "transportation": "-", "breakfast": "The Bake Studio, Twin Falls", "attraction": "Shoshone Falls Park, Twin Falls;Centennial Waterfront Park, Twin Falls;", "lunch": "Asia Kitchen, Twin Falls", "dinner": "Thai Paradise, Twin Falls", "accommodation": "Charming studio, great location!!!, Twin Falls"}, {"day": 3, "current_city": "from Twin Falls to Salt Lake City", "transportation": "Flight Number: F3807678, from Twin Falls to Salt Lake City, Departure Time: 12:35, Arrival Time: 13:20", "breakfast": "-", "attraction": "-", "lunch": "-", "dinner": "-", "accommodation": "-"}, {"day": 1, "current_city": "from Salt Lake City to Twin Falls", "transportation": "Self-driving, from Salt Lake City to Twin Falls, duration: 3 hours 13 mins, distance: 351 km", "breakfast": "-", "attraction": "-", "lunch": "Subway, Twin Falls", "dinner": "Fresc Co, Twin Falls", "accommodation": "Private room in E. Williamsburg! Budget friendly!, Twin Falls"}, {"day": 2, "current_city": "Twin Falls", "transportation": "-", "breakfast": "The Bake Studio, Twin Falls", "attraction": "Shoshone Falls Park, Twin Falls;Centennial Waterfront Park, Twin Falls;", "lunch": "Asia Kitchen, Twin Falls", "dinner": "Thai Paradise, Twin Falls", "accommodation": "Private room in E. Williamsburg! Budget friendly!, Twin Falls"}, {"day": 3, "current_city": "from Twin Falls to Salt Lake City", "transportation": "Self-driving, from Twin Falls to Salt Lake City, duration: 3 hours 14 mins, distance: 351 km", "breakfast": "-", "attraction": "-", "lunch": "-", "dinner": "-", "accommodation": "-"}]}]