[{"gpt-4-1106-preview_direct_sole-planning_results": "Travel Plan:\n\nDays: 1,\nCurrent City: from Washington to Buffalo (New York),\nTransportation: Flight Number: F3791094, from Washington to Buffalo (New York), Departure Time: 10:24, Arrival Time: 11:53, cost: 61\nBreakfast: -,\nAttraction: -,\nLunch: -,\nDinner: Tibby's New Orleans Kitchen, Buffalo (New York), cost: 48, cuisines: \u201cSeafood, Indian, BBQ, Italian\u201d\nAccommodation: Cozy Studio in Heart of Ft Greene, Buffalo (New York), cost: 200, room type: Entire home/apt, house rules: No pets & No children under 10, minimum nights: 4, maximum occupancy: 3\n\nNumber of people = 7\nTotal cost = 61 * 7 + 48 * 7 + 200 * 7 / 3 = 427 + 336 + 466.67 = 1229.67\nAccommodation minimum nights: 1/4\n\nDays: 2,\nCurrent City: Buffalo (New York),\nTransportation: -,\nBreakfast: Shokitini, Buffalo (New York), cost: 41, cuisines: \u201cTea, Cafe, Pizza, Mexican, Chinese, Seafood\u201d\nAttraction: The Buffalo Zoo, Buffalo (New York); Buffalo and Erie County Botanical Gardens, Buffalo (New York),\nLunch: Punjab Grill, Buffalo (New York), cost: 25, cuisines: \u201cBakery, BBQ, Desserts, Seafood\u201d\nDinner: Ammu's South Indian Restaurant, Buffalo (New York), cost: 80, cuisines: \u201cDesserts, Pizza, French, BBQ, Chinese\u201d\nAccommodation: Cozy Studio in Heart of Ft Greene, Buffalo (New York), cost: 200, room type: Entire home/apt, house rules: No pets & No children under 10, minimum nights: 4, maximum occupancy: 3\n\nNumber of people = 7\nTotal cost = (41 + 25 + 80) * 7 + 200 * 7 / 3 = 146 * 7 + 466.67 = 1022 + 466.67 = 1488.67\nAccommodation minimum nights: 2/4\n\nDays: 3,\nCurrent City: from Buffalo (New York) to New York City (New York),\nTransportation: Flight Number: F3644292, from Buffalo (New York) to New York City (New York), Departure Time: 13:42, Arrival Time: 14:51, cost: 77\nBreakfast: -,\nAttraction: -,\nLunch: -,\nDinner: Seasons 52 Fresh Grill, New York City (New York), cost: 30, cuisines: \u201cSeafood, Indian, Desserts, Italian\u201d\nAccommodation: A Contemporary Homelike Stay in the Best of BK, New York City (New York), cost: 228, room type: Entire home/apt, house rules: No pets & No visitors & No children under 10, minimum nights: 2, maximum occupancy: 2\n\nNumber of people = 7\nTotal cost = 77 * 7 + 30 * 7 + 228 * 7 / 2 = 539 + 210 + 798 = 1547\nAccommodation minimum nights: 1/2\n\nDays: 4,\nCurrent City: New York City (New York),\nTransportation: -,\nBreakfast: Gurgaon Hights, New York City (New York), cost: 46, cuisines: \u201cCafe, American, Indian, Fast Food\u201d\nAttraction: Top of The Rock, New York City (New York); Central Park, New York City (New York),\nLunch: Lord of the Drinks Forum, New York City (New York), cost: 71, cuisines: \u201cCafe, Bakery, BBQ, Chinese, Indian\u201d\nDinner: Goosebumps, New York City (New York), cost: 94, cuisines: \u201cChinese, Pizza, Bakery\u201d\nAccommodation: A Contemporary Homelike Stay in the Best of BK, New York City (New York), cost: 228, room type: Entire home/apt, house rules: No pets & No visitors & No children under 10, minimum nights: 2, maximum occupancy: 2\n\nNumber of people = 7\nTotal cost = (46 + 71 + 94) * 7 + 228 * 7 / 2 = 211 * 7 + 798 = 1477 + 798 = 2275\nAccommodation minimum nights: 2/2 (Done!)\n\nDays: 5,\nCurrent City: from New York City (New York) to Washington,\nTransportation: Flight Number: F3661892, from New York City (New York) to Washington, Departure Time: 11:31, Arrival Time: 12:45, cost: 64\nBreakfast: -,\nAttraction: -,\nLunch: -,\nDinner: -,\nAccommodation: -\n\nNumber of people = 7\nTotal cost = 64 * 7 = 448\n\nTotal cost across all days = 1229.67 + 1488.67 + 1547 + 2275 + 448 = 6988.34\nCuisines: The prompt specifies American, Mexican, Chinese, and Italian, and all of these cuisines have been represented in the restaurants chosen.\nHouse rules: All accommodations chosen are entire rooms, as specified.", "gpt-4-1106-preview_direct_sole-planning_parsed_results": [{"day": 1, "current_city": "from Washington to Buffalo (New York)", "transportation": "Flight Number: F3791094, from Washington to Buffalo (New York), Departure Time: 10:24, Arrival Time: 11:53", "breakfast": "-", "attraction": "-", "lunch": "-", "dinner": "Tibby's New Orleans Kitchen, Buffalo (New York)", "accommodation": "Cozy Studio in Heart of Ft Greene, Buffalo (New York)"}, {"day": 2, "current_city": "Buffalo (New York)", "transportation": "-", "breakfast": "Shokitini, Buffalo (New York)", "attraction": "The Buffalo Zoo, Buffalo (New York);Buffalo and Erie County Botanical Gardens, Buffalo (New York);", "lunch": "Punjab Grill, Buffalo (New York)", "dinner": "Ammu's South Indian Restaurant, Buffalo (New York)", "accommodation": "Cozy Studio in Heart of Ft Greene, Buffalo (New York)"}, {"day": 3, "current_city": "from Buffalo (New York) to New York City (New York)", "transportation": "Flight Number: F3644292, from Buffalo (New York) to New York City (New York), Departure Time: 13:42, Arrival Time: 14:51", "breakfast": "-", "attraction": "-", "lunch": "-", "dinner": "Seasons 52 Fresh Grill, New York City (New York)", "accommodation": "A Contemporary Homelike Stay in the Best of BK, New York City (New York)"}, {"day": 4, "current_city": "New York City (New York)", "transportation": "-", "breakfast": "Gurgaon Hights, New York City (New York)", "attraction": "Top of The Rock, New York City (New York);Central Park, New York City (New York);", "lunch": "Lord of the Drinks Forum, New York City (New York)", "dinner": "Goosebumps, New York City (New York)", "accommodation": "A Contemporary Homelike Stay in the Best of BK, New York City (New York)"}, {"day": 5, "current_city": "from New York City (New York) to Washington", "transportation": "Flight Number: F3661892, from New York City (New York) to Washington, Departure Time: 11:31, Arrival Time: 12:45", "breakfast": "-", "attraction": "-", "lunch": "-", "dinner": "-", "accommodation": "-"}]}]