[{"gpt-4-1106-preview_direct_sole-planning_results": "Travel Plan:\n\nDay 1: March 8, 2022\nCurrent City: Rockford\nTransportation: Self-driving from Rockford to Gainesville, duration: 16 hours 30 mins, distance: 1,822 km, cost: $91 x 8 = $728\nBreakfast: - (Assuming departure early in the morning before breakfast)\nAttraction: - (Traveling)\nLunch: - (On the road)\nDinner: The Machine Shed Restaurant, Gainesville, cost: $62 x 8 = $496, cuisines: Pizza, Mexican, Bakery, Fast Food, Indian, Seafood\nAccommodation: Spacious yet Cozy Room in Manhattan, Gainesville, cost: $566 x 2 = $1132, Entire home/apt, maximum occupancy: 4 per unit\n\nNumber of people = 8\nTotal cost for Day 1 = $728 (Transportation) + $496 (Dinner) + $1132 (Accommodation) = $2356\n\nDay 2: March 9, 2022\nCurrent City: Gainesville\nTransportation: - (Exploring Gainesville)\nBreakfast: Villa Gargano, Gainesville, cost: $51 x 8 = $408, cuisines: Tea, American, Desserts\nAttraction: Florida Museum of Natural History-Exhibits, Gainesville; Devil's Millhopper Geological State Park, Gainesville\nLunch: Pirates' House Restaurant, Gainesville, cost: $59 x 8 = $472, cuisines: Chinese, Pizza, BBQ\nDinner: Ashoka Restaurant, Gainesville, cost: $11 x 8 = $88, cuisines: Desserts, Mexican, Bakery, BBQ, Fast Food\nAccommodation: Spacious yet Cozy Room in Manhattan, Gainesville, cost: $566 x 2 = $1132, Entire home/apt, maximum occupancy: 4 per unit\n\nNumber of people = 8\nTotal cost for Day 2 = $408 (Breakfast) + $472 (Lunch) + $88 (Dinner) + $1132 (Accommodation) = $2100\n\nDay 3: March 10, 2022\nCurrent City: from Gainesville to Daytona Beach\nTransportation: Self-driving from Gainesville to Daytona Beach, duration: 2 hours 2 mins, distance: 158 km, cost: $7 x 8 = $56\nBreakfast: Goose Feathers Cafe and Bakery, Gainesville, cost: $57 x 8 = $456, cuisines: Tea, Fast Food, Italian\nAttraction: - (Traveling)\nLunch: - (On the road)\nDinner: Outback Steakhouse, Daytona Beach, cost: $58 x 8 = $464, cuisines: Desserts, Pizza, Mexican, Cafe, American\nAccommodation: Homey 1BR in Fun, Central West Village w/ Doorman by Blueground, Daytona Beach, cost: $262 x 4 = $1048, Entire home/apt, maximum occupancy: 2 per unit\n\nNumber of people = 8\nTotal cost for Day 3 = $56 (Transportation) + $456 (Breakfast) + $464 (Dinner) + $1048 (Accommodation) = $2024\n\nDay 4: March 11, 2022\nCurrent City: Daytona Beach\nTransportation: - (Exploring Daytona Beach)\nBreakfast: Beach Box Cafe, Daytona Beach, cost: $96 x 8 = $768, cuisines: Chinese, Pizza, BBQ, Cafe\nAttraction: Daytona Boardwalk Amusements, Daytona Beach; Daytona Lagoon, Daytona Beach\nLunch: Rocks on the River, Daytona Beach, cost: $35 x 8 = $280, cuisines: Tea, Indian, BBQ\nDinner: Mom & Dad's Italian Restaurant, Daytona Beach, cost: $17 x 8 = $136, cuisines: Tea, Mexican, Cafe, Indian, Seafood\nAccommodation: Homey 1BR in Fun, Central West Village w/ Doorman by Blueground, Daytona Beach, cost: $262 x 4 = $1048, Entire home/apt, maximum occupancy: 2 per unit\n\nNumber of people = 8\nTotal cost for Day 4 = $768 (Breakfast) + $280 (Lunch) + $136 (Dinner) + $1048 (Accommodation) = $2232\n\nDay 5: March 12, 2022\nCurrent City: from Daytona Beach to Jacksonville\nTransportation: Self-driving from Daytona Beach to Jacksonville, duration: 1 hour 28 mins, distance: 143 km, cost: $7 x 8 = $56\nBreakfast: Bespoke Harvest, Daytona Beach, cost: $56 x 8 = $448, cuisines: Cafe, BBQ, Fast Food\nAttraction: - (Traveling)\nLunch: - (On the road)\nDinner: Villa Gargano, Jacksonville, cost: $51 x 8 = $408, cuisines: Tea, American, Desserts\nAccommodation: NYC Sanctuary, Skyline Views & Rooftop, Jacksonville, cost: $954 x 2 = $1908, Entire home/apt, maximum occupancy: 6 per unit\n\nNumber of people = 8\nTotal cost for Day 5 = $56 (Transportation) + $448 (Breakfast) + $408 (Dinner) + $1908 (Accommodation) = $2820\n\nDay 6: March 13, 2022\nCurrent City: Jacksonville\nTransportation: - (Exploring Jacksonville)\nBreakfast: Pirates' House Restaurant, Jacksonville, cost: $59 x 8 = $472, cuisines: Chinese, Pizza, BBQ\nAttraction: Jacksonville Zoo and Gardens, Jacksonville; Southbank Riverwalk, Jacksonville\nLunch: Goose Feathers Cafe and Bakery, Jacksonville, cost: $57 x 8 = $456, cuisines: Tea, Fast Food, Italian\nDinner: Ashoka Restaurant, Jacksonville, cost: $11 x 8 = $88, cuisines: Desserts, Mexican, Bakery, BBQ, Fast Food\nAccommodation: NYC Sanctuary, Skyline Views & Rooftop, Jacksonville, cost: $954 x 2 = $1908, Entire home/apt, maximum occupancy: 6 per unit\n\nNumber of people = 8\nTotal cost for Day 6 = $472 (Breakfast) + $456 (Lunch) + $88 (Dinner) + $1908 (Accommodation) = $2924\n\nDay 7: March 14, 2022\nCurrent City: from Jacksonville to Rockford\nTransportation: Self-driving from Jacksonville to Rockford, duration: 16 hours 42 mins, distance: 1,852 km, cost: $92 x 8 = $736\nBreakfast: Villa Gargano, Jacksonville, cost: $51 x 8 = $408, cuisines: Tea, American, Desserts\nAttraction: - (Traveling)\nLunch: - (On the road)\nDinner: - (Expected to arrive late)\nAccommodation: - (Returning home)\n\nNumber of people = 8\nTotal cost for Day 7 = $736 (Transportation) + $408 (Breakfast) = $1144\n\nTotal cost across all days = $2356 (Day 1) + $2100 (Day 2) + $2024 (Day 3) + $2232 (Day 4) + $2820 (Day 5) + $2924 (Day 6) + $1144 (Day 7) = $15600\n\nRemaining Budget = $17000 - $15600 = $1400\n\nCuisines: The prompt specifies no cuisines, so all cuisines constraints are satisfied.\nAccommodation: All accommodations are entire homes or apartments, meeting the preference for entire rooms for the group.\n\nPlease note that the costs for attractions and some meals on the road are not included and should be considered within the remaining budget. Additionally, the cost for gas and any potential car rental fees for self-driving are not included and should be accounted for within the remaining budget.", "gpt-4-1106-preview_direct_sole-planning_parsed_results": [{"day": 1, "current_city": "from Rockford to Gainesville", "transportation": "Self-driving from Rockford to Gainesville, duration: 16 hours 30 mins, distance: 1,822 km", "breakfast": "-", "attraction": "-", "lunch": "-", "dinner": "The Machine Shed Restaurant, Gainesville", "accommodation": "Spacious yet Cozy Room in Manhattan, Gainesville"}, {"day": 2, "current_city": "Gainesville", "transportation": "-", "breakfast": "Villa Gargano, Gainesville", "attraction": "Florida Museum of Natural History-Exhibits, Gainesville;Devil's Millhopper Geological State Park, Gainesville;", "lunch": "Pirates' House Restaurant, Gainesville", "dinner": "Ashoka Restaurant, Gainesville", "accommodation": "Spacious yet Cozy Room in Manhattan, Gainesville"}, {"day": 3, "current_city": "from Gainesville to Daytona Beach", "transportation": "Self-driving from Gainesville to Daytona Beach, duration: 2 hours 2 mins, distance: 158 km", "breakfast": "Goose Feathers Cafe and Bakery, Gainesville", "attraction": "-", "lunch": "-", "dinner": "Outback Steakhouse, Daytona Beach", "accommodation": "Homey 1BR in Fun, Central West Village w/ Doorman by Blueground, Daytona Beach"}, {"day": 4, "current_city": "Daytona Beach", "transportation": "-", "breakfast": "Beach Box Cafe, Daytona Beach", "attraction": "Daytona Boardwalk Amusements, Daytona Beach;Daytona Lagoon, Daytona Beach;", "lunch": "Rocks on the River, Daytona Beach", "dinner": "Mom & Dad's Italian Restaurant, Daytona Beach", "accommodation": "Homey 1BR in Fun, Central West Village w/ Doorman by Blueground, Daytona Beach"}, {"day": 5, "current_city": "from Daytona Beach to Jacksonville", "transportation": "Self-driving from Daytona Beach to Jacksonville, duration: 1 hour 28 mins, distance: 143 km", "breakfast": "Bespoke Harvest, Daytona Beach", "attraction": "-", "lunch": "-", "dinner": "Villa Gargano, Jacksonville", "accommodation": "NYC Sanctuary, Skyline Views & Rooftop, Jacksonville"}, {"day": 6, "current_city": "Jacksonville", "transportation": "-", "breakfast": "Pirates' House Restaurant, Jacksonville", "attraction": "Jacksonville Zoo and Gardens, Jacksonville;Southbank Riverwalk, Jacksonville;", "lunch": "Goose Feathers Cafe and Bakery, Jacksonville", "dinner": "Ashoka Restaurant, Jacksonville", "accommodation": "NYC Sanctuary, Skyline Views & Rooftop, Jacksonville"}, {"day": 7, "current_city": "from Jacksonville to Rockford", "transportation": "Self-driving from Jacksonville to Rockford, duration: 16 hours 42 mins, distance: 1,852 km", "breakfast": "Villa Gargano, Jacksonville", "attraction": "-", "lunch": "-", "dinner": "-", "accommodation": "-"}]}]