[{"gpt-4-1106-preview_direct_sole-planning_results": "Travel Plan:\n\nDays: 1\nCurrent City: from Punta Gorda to Pellston,\nTransportation: Self-driving, from Punta Gorda to Pellston, duration: 21 hours 40 mins, distance: 2,457 km, cost: 122\nBreakfast: -, \nAttraction: -,\nLunch: -, \nDinner: Johnnie Mars, Pellston, cost: 33, cuisines: \u201cTea, Fast Food\u201d\nAccommodation: Large Room with Pull-out Sofa and Balcony, Pellston, cost: 443, maximum occupancy: 1, house rules: No parties & No pets & No children under 10, minimum nights: 1\n\nNumber of people = 3\nTotal cost = 122 x 3 + 33 x 3 + 443 x 3 = 1797\nAccommodation minimum nights:  1/1\n\nDays: 2,\nCurrent City: Pellston, \nTransportation: -, \nBreakfast: Aroos Damascus, Pellston, cost: 44, cuisines: Desserts, Tea, Italian, Cafe, American\nAttraction: Pellston Pioneer Park, Pellston; Pellston Historical Society Museum, Pellston\nLunch: The Great Kabab Factory - Park Plaza, Pellston, cost: 84, cuisines: \u201cDesserts, Pizza, Mexican, BBQ, Seafood\u201d\nDinner: Spezia Bistro, Pellston, cost: 84, cuisines: \u201cTea, Mexican, BBQ, Bakery, Cafe\u201d\nAccommodation: Large Room with Pull-out Sofa and Balcony, Pellston, cost: 443, maximum occupancy: 1, house rules: No parties & No pets & No children under 10, minimum nights: 1\n\nNumber of people = 3\nTotal cost = 44 x 3 + 84 x 3 + 84 x 3 + 443 x 3 = 1965\nAccommodation minimum nights:  2/1\n\nDays: 3, \nCurrent City: from Pellston to Traverse City, \nTransportation: Self-driving, from Pellston to Traverse City, duration: 1 hour 49 mins, distance: 137 km, cost: 6\nBreakfast: -, \nAttraction: Clinch Park, Traverse City; Great Lakes Children's Museum, Traverse City\nLunch: Famous Dave's, Traverse City, cost: 39, cuisines: \u201cDesserts, Italian, BBQ, Fast Food, Indian\u201d\nDinner: India on my Plate - Fortune Select Excalibur, Traverse City, cost: 53, cuisines: \u201cTea, Chinese, Seafood\u201d\nAccommodation: Beautiful Room close to JFK, La Guardia, LIR, Traverse City, cost: 352, maximum occupancy: 1, house rules: No pets, minimum nights: 2\n\nNumber of people = 3\nTotal cost = 6 x 3 + 39 x 3 + 53 x 3 + 352 x 3 = 1350\nAccommodation minimum nights:  1/2\n\nDays: 4,\nCurrent City: Traverse City, \nTransportation: -, \nBreakfast: Daily Eats, Traverse City, cost: 44, cuisines: Desserts, Seafood\nAttraction: Mission Point Lighthouse, Traverse City; Great Wolf Lodge Water Park | Traverse City\nLunch: Dragonfly, Traverse City, cost: 69, cuisines: \u201cTea, Italian, French, BBQ, Seafood\u201d\nDinner: Eden Noodles Cafe \u874a_\u8784\u6f18\u552d_\u552d_\u6f70, Traverse City, cost: 80, cuisines: \u201cPizza, BBQ, Fast Food, Cafe, Mediterranean\u201d\nAccommodation: Beautiful Room close to JFK, La Guardia, LIR, Traverse City, cost: 352, maximum occupancy: 1, house rules: No pets, minimum nights: 2\n\nNumber of people = 3\nTotal cost = 44 x 3 + 69 x 3 + 80 x 3 + 352 x 3 = 1635\nAccommodation minimum nights:  2/2\n\nDays: 5, \nCurrent City: from Traverse City to Alpena, \nTransportation: Self-driving, from Traverse City to Alpena, duration: 2 hours 29 mins, distance: 204 km, cost: 10\nBreakfast: -, \nAttraction: Great Lakes Maritime Heritage Center, Alpena; Besser Museum for Northeast Michigan, Alpena\nLunch: A & A Pagliai's Pizza, Alpena, cost: 72, cuisines: \u201cTea, American, Fast Food\u201d\nDinner: Maplai, Alpena, cost: 63, cuisines: \u201cTea, Indian, Bakery, Fast Food, American\u201d\nAccommodation: CHEERFUL RM IN BROOKLYN! EASY ACCESS TO TRAIN! R3, Alpena, cost: 927, maximum occupancy: 2, house rules: No pets, minimum nights: 15\n\nNumber of people = 3\nTotal cost = 10 x 3 + 72 x 3 + 63 x 3 + 927 x 3 = 3216\nAccommodation minimum nights:  1/15\n\nDays: 6,\nCurrent City: Alpena, \nTransportation: -, \nBreakfast: Shudh Restaurant, Alpena, cost: 56, cuisines: Cafe, BBQ, Fast Food\nAttraction: Mich-e-ke-wis Park, Alpena; Island Park, Alpena\nLunch: Sahni Fish Corner, Alpena, cost: 11, cuisines: \u201cDesserts, Pizza, Bakery, Fast Food, Indian\u201d\nDinner: Handi Masala Restaurant, Alpena, cost: 57, cuisines: \u201cFrench, Bakery, BBQ, Fast Food, American, Seafood\u201d\nAccommodation: CHEERFUL RM IN BROOKLYN! EASY ACCESS TO TRAIN! R3, Alpena, cost: 927, maximum occupancy: 2, house rules: No pets, minimum nights: 15\n\nNumber of people = 3\nTotal cost = 56 x 3 + 11 x 3 + 57 x 3 + 927 x 3 = 3159\nAccommodation minimum nights:  2/15\n\nDays: 7, \nCurrent City: from Alpena to Punta Gorda, \nTransportation: Self-driving, from Alpena to Punta Gorda, duration: 21 hours 39 mins, distance: 2,401 km, cost: 120\nBreakfast: -, \nAttraction: -, \nLunch: -, \nDinner: -,\nAccommodation: -,\n\nNumber of people = 3\nTotal cost = 120 x 3 = 360\n\nTotal cost across all days = 1797 + 1965 + 1350 + 1635 + 3216 + 3159 + 360 = 15482 \n\nCuisines: The prompt specifies American and French cuisines, so all cuisine constraints are satisfied.\n\nPlease note that the total cost exceeds the specified budget of $4,400. Adjustments to the plan, such as changing accommodations or dining options, may be necessary to meet the budget constraint.", "gpt-4-1106-preview_direct_sole-planning_parsed_results": [{"day": 1, "current_city": "from Punta Gorda to Pellston", "transportation": "Self-driving, from Punta Gorda to Pellston, duration: 21 hours 40 mins, distance: 2,457 km", "breakfast": "-", "attraction": "-", "lunch": "-", "dinner": "Johnnie Mars, Pellston", "accommodation": "Large Room with Pull-out Sofa and Balcony, Pellston"}, {"day": 2, "current_city": "Pellston", "transportation": "-", "breakfast": "Aroos Damascus, Pellston", "attraction": "Pellston Pioneer Park, Pellston;Pellston Historical Society Museum, Pellston", "lunch": "The Great Kabab Factory - Park Plaza, Pellston", "dinner": "Spezia Bistro, Pellston", "accommodation": "Large Room with Pull-out Sofa and Balcony, Pellston"}, {"day": 3, "current_city": "from Pellston to Traverse City", "transportation": "Self-driving, from Pellston to Traverse City, duration: 1 hour 49 mins, distance: 137 km", "breakfast": "-", "attraction": "Clinch Park, Traverse City;Great Lakes Children's Museum, Traverse City", "lunch": "Famous Dave's, Traverse City", "dinner": "India on my Plate - Fortune Select Excalibur, Traverse City", "accommodation": "Beautiful Room close to JFK, La Guardia, LIR, Traverse City"}, {"day": 4, "current_city": "Traverse City", "transportation": "-", "breakfast": "Daily Eats, Traverse City", "attraction": "Mission Point Lighthouse, Traverse City;Great Wolf Lodge Water Park | Traverse City", "lunch": "Dragonfly, Traverse City", "dinner": "Eden Noodles Cafe \u874a_\u8784\u6f18\u552d_\u552d_\u6f70, Traverse City", "accommodation": "Beautiful Room close to JFK, La Guardia, LIR, Traverse City"}, {"day": 5, "current_city": "from Traverse City to Alpena", "transportation": "Self-driving, from Traverse City to Alpena, duration: 2 hours 29 mins, distance: 204 km", "breakfast": "-", "attraction": "Great Lakes Maritime Heritage Center, Alpena;Besser Museum for Northeast Michigan, Alpena", "lunch": "A & A Pagliai's Pizza, Alpena", "dinner": "Maplai, Alpena", "accommodation": "CHEERFUL RM IN BROOKLYN! EASY ACCESS TO TRAIN! R3, Alpena"}, {"day": 6, "current_city": "Alpena", "transportation": "-", "breakfast": "Shudh Restaurant, Alpena", "attraction": "Mich-e-ke-wis Park, Alpena;Island Park, Alpena", "lunch": "Sahni Fish Corner, Alpena", "dinner": "Handi Masala Restaurant, Alpena", "accommodation": "CHEERFUL RM IN BROOKLYN! EASY ACCESS TO TRAIN! R3, Alpena"}, {"day": 7, "current_city": "from Alpena to Punta Gorda", "transportation": "Self-driving, from Alpena to Punta Gorda, duration: 21 hours 39 mins, distance: 2,401 km", "breakfast": "-", "attraction": "-", "lunch": "-", "dinner": "-", "accommodation": "-"}]}]