[{"gpt-4-1106-preview_direct_sole-planning_results": "Travel Plan:\n\nDays: 1\nCurrent City: from St. Louis to Washington,\nTransportation: Flight Number: F3934368, from St. Louis to Washington, Departure Time: 12:42, Arrival Time: 15:38, cost: 162\nBreakfast: -, \nAttraction: -,\nLunch: -, \nDinner: Los Aztecas, Washington, cost: 46, cuisines: \u201cCafe, Bakery, BBQ, Fast Food\u201d\nAccommodation: Private room in Manhattan, Washington, cost: 218, maximum occupancy: 2, house rules: No visitors, minimum nights: 2\n\nNumber of people = 1\nTotal cost = 162 x 1 + 46 x 1 + 218 x 1 = 426 \nAccommodation minimum nights:  1/2\n\nDays: 2,\nCurrent City: Washington, \nTransportation: -, \nBreakfast: Manna Java World Cafe, Washington, cost: 59, cuisines: \u201cCafe, Seafood\u201d\nAttraction: Space Needle, Washington; Olympic Sculpture Park, Washington\nLunch: Hemingway's Island Grill, Washington, cost: 57, cuisines: \u201cMexican, BBQ, Fast Food, Cafe, Seafood\u201d\nDinner: Thaaliwala, Washington, cost: 88, cuisines: \u201cTea, Pizza, Italian, BBQ, Cafe\u201d\nAccommodation: Private room in Manhattan, Washington, cost: 218, maximum occupancy: 2, house rules: No visitors, minimum nights: 2\n\nNumber of people = 1\nTotal cost = 59 x 1 + 57 x 1 + 88 x 1 + 218 x 1 = 422\nAccommodation minimum nights:  2/2\n\nDays: 3, \nCurrent City: from Washington to St. Louis, \nTransportation: Flight Number: F3788616, from Washington to St. Louis, Departure Time: 16:09, Arrival Time: 17:42, cost: 146\nBreakfast: Cafe Coffee Day, Washington, cost: 53, cuisines: \u201cTea, Mexican, Fast Food, Cafe, American, Seafood\u201d\nAttraction: The Seattle Great Wheel, Washington; Discovery Park, Washington\nLunch: Good Foods, Washington, cost: 65, cuisines: \u201cBBQ, Desserts, Seafood\u201d\nDinner: -, \nAccommodation: -,\n\nNumber of people = 1\nTotal cost = 146 x 1 + 53 x 1 + 65 x 1 = 264\n\nTotal cost across all days = 426 + 422 + 264 = 1112 \nCuisines: The prompt specifies no cuisines, so all cuisines constraints are satisfied\n\nNote: The attractions listed are in Washington, but the specific times for visiting them are not provided due to the lack of detailed scheduling information in the reference data. The traveler can visit these attractions at their convenience during the stay in Washington.", "gpt-4-1106-preview_direct_sole-planning_parsed_results": [{"day": 1, "current_city": "from St. Louis to Washington", "transportation": "Flight Number: F3934368, from St. Louis to Washington, Departure Time: 12:42, Arrival Time: 15:38", "breakfast": "-", "attraction": "-", "lunch": "-", "dinner": "Los Aztecas, Washington", "accommodation": "Private room in Manhattan, Washington"}, {"day": 2, "current_city": "Washington", "transportation": "-", "breakfast": "Manna Java World Cafe, Washington", "attraction": "Space Needle, Washington;Olympic Sculpture Park, Washington;", "lunch": "Hemingway's Island Grill, Washington", "dinner": "Thaaliwala, Washington", "accommodation": "Private room in Manhattan, Washington"}, {"day": 3, "current_city": "from Washington to St. Louis", "transportation": "Flight Number: F3788616, from Washington to St. Louis, Departure Time: 16:09, Arrival Time: 17:42", "breakfast": "Cafe Coffee Day, Washington", "attraction": "The Seattle Great Wheel, Washington;Discovery Park, Washington;", "lunch": "Good Foods, Washington", "dinner": "-", "accommodation": "-"}]}]