[{"gpt-4-1106-preview_direct_sole-planning_results": "Travel Plan:\n\nDays: 1\nCurrent City: from Chicago to Boise,\nTransportation: Flight Number: F3857813, from Chicago to Boise, Departure Time: 09:48, Arrival Time: 12:51, cost: 311\nBreakfast: -, \nAttraction: -,\nLunch: -, \nDinner: California Pizza Kitchen, Boise, cost: 15, cuisines: \u201cTea, BBQ, Fast Food, Chinese, Indian\u201d\nAccommodation: Modern & Cozy 2 BR Private Apartment in Brooklyn, Boise, cost: 843, maximum occupancy: 7, house rules: No children under 10, minimum nights: 1\n\nNumber of people = 8\nTotal cost = 311 x 8 + 15 x 8 + 843 x 1 = 2488 + 120 + 843 = 3451\nAccommodation minimum nights:  1/1\n\nDays: 2,\nCurrent City: Boise, \nTransportation: -, \nBreakfast: Gopala Hari, Boise, cost: 28, cuisines: Tea, Pizza, Italian, Fast Food, Mediterranean, Seafood\nAttraction: Zoo Boise, Boise; Idaho Botanical Garden, Boise\nLunch: Domino's Pizza, Boise, cost: 25, cuisines: \u201cPizza, Italian, BBQ, Fast Food, Mediterranean\u201d\nDinner: Zerruco - The Ashok, Boise, cost: 15, cuisines: \u201cItalian, Bakery, Fast Food, Cafe, Indian\u201d\nAccommodation: Modern & Cozy 2 BR Private Apartment in Brooklyn, Boise, cost: 843, maximum occupancy: 7, house rules: No children under 10, minimum nights: 1\n\nNumber of people = 8\nTotal cost = 28 x 8 + 25 x 8 + 15 x 8 + 843 x 1 = 224 + 200 + 120 + 843 = 1387\nAccommodation minimum nights:  2/1\n\nDays: 3, \nCurrent City: from Boise to Pocatello, \nTransportation: Self-driving, from Boise to Pocatello, duration: 3 hours 25 mins, distance: 378 km, cost: 18\nBreakfast: -, \nAttraction: Idaho Museum of Natural History, Pocatello; Fort Hall Replica and Commemorative Trading Post, Pocatello\nLunch: Deorio's, Pocatello, cost: 59, cuisines: \u201cTea, Bakery, Fast Food, Mediterranean, Seafood\u201d\nDinner: 650 - The Global Kitchen, Pocatello, cost: 83, cuisines: \u201cFrench, Bakery, Cafe\u201d\nAccommodation: Entire Modern Studio Apartment/Prime Location, Pocatello, cost: 1109, maximum occupancy: 5, house rules: No parties & No smoking, minimum nights: 1\n\nNumber of people = 8\nTotal cost = 18 x 8 + 59 x 8 + 83 x 8 + 1109 x 2 = 144 + 472 + 664 + 2218 = 3498\nAccommodation minimum nights:  1/1\n\nDays: 4,\nCurrent City: Pocatello, \nTransportation: -, \nBreakfast: Oriental Kitchen Express, Pocatello, cost: 36, cuisines: \u201cCafe, Bakery, Desserts\u201d\nAttraction: Zoo Idaho, Pocatello; Bannock County Historical Museum, Pocatello\nLunch: Ghar Ki Handi, Pocatello, cost: 13, cuisines: \u201cCafe, Bakery, American, Fast Food\u201d\nDinner: Gola Sizzlers, Pocatello, cost: 34, cuisines: \u201cDesserts, French, Bakery, Fast Food, Cafe\u201d\nAccommodation: Entire Modern Studio Apartment/Prime Location, Pocatello, cost: 1109, maximum occupancy: 5, house rules: No parties & No smoking, minimum nights: 1\n\nNumber of people = 8\nTotal cost = 36 x 8 + 13 x 8 + 34 x 8 + 1109 x 2 = 288 + 104 + 272 + 2218 = 2882\nAccommodation minimum nights:  2/1\n\nDays: 5, \nCurrent City: from Pocatello to Idaho Falls, \nTransportation: Self-driving, from Pocatello to Idaho Falls, duration: 51 mins, distance: 83.6 km, cost: 4\nBreakfast: -, \nAttraction: Museum of Idaho, Idaho Falls; Idaho Falls Zoo at Tautphaus Park, Idaho Falls\nLunch: Shiv Restaurant, Idaho Falls, cost: 42, cuisines: \u201cBakery, Mexican, Pizza, Desserts\u201d\nDinner: Taste of China, Idaho Falls, cost: 19, cuisines: \u201cFrench, Bakery, Fast Food, Indian, Seafood\u201d\nAccommodation: Sunny & Spacious 2 bdrm apt, Idaho Falls, cost: 914, maximum occupancy: 9, house rules: No smoking, minimum nights: 1\n\nNumber of people = 8\nTotal cost = 4 x 8 + 42 x 8 + 19 x 8 + 914 x 1 = 32 + 336 + 152 + 914 = 1434\nAccommodation minimum nights:  1/1\n\nDays: 6,\nCurrent City: Idaho Falls, \nTransportation: -, \nBreakfast: Karim's, Idaho Falls, cost: 58, cuisines: \u201cTea, Pizza, BBQ, Cafe, Indian\u201d\nAttraction: The Art Museum Of Eastern Idaho, Idaho Falls; Idaho Falls River Walk - Greenbelt Trail, Idaho Falls\nLunch: Chinese X'Press, Idaho Falls, cost: 79, cuisines: \u201cFrench, Desserts, Fast Food\u201d\nDinner: Dhuaan, Idaho Falls, cost: 97, cuisines: \u201cTea, Pizza, Mexican, BBQ, Fast Food, American\u201d\nAccommodation: Sunny & Spacious 2 bdrm apt, Idaho Falls, cost: 914, maximum occupancy: 9, house rules: No smoking, minimum nights: 1\n\nNumber of people = 8\nTotal cost = 58 x 8 + 79 x 8 + 97 x 8 + 914 x 1 = 464 + 632 + 776 + 914 = 2786\nAccommodation minimum nights:  2/1\n\nDays: 7, \nCurrent City: from Idaho Falls to Chicago, \nTransportation: Self-driving, from Idaho Falls to Chicago, duration: 21 hours 43 mins, distance: 2,369 km, cost: 118\nBreakfast: -, \nAttraction: -, \nLunch: -, \nDinner: -, \nAccommodation: -,\n\nNumber of people = 8\nTotal cost = 118 x 8 = 944\n\nTotal cost across all days = 3451 + 1387 + 3498 + 2882 + 1434 + 2786 + 944 = 16382 \n\nCuisines: The prompt specifies Italian and Chinese cuisines, so all cuisine constraints are satisfied.\n\nPlease note that the accommodation on Day 3 and Day 4 is the same and only accommodates 5 people, so an additional room will be required for the remaining 3 travelers. The cost of the additional room is not included in the total cost and will need to be factored in. Additionally, the transportation costs for self-driving are calculated based on the cost provided, but actual costs may vary depending on the vehicle used and current fuel prices.", "gpt-4-1106-preview_direct_sole-planning_parsed_results": [{"day": 1, "current_city": "from Chicago to Boise", "transportation": "Flight Number: F3857813, from Chicago to Boise, Departure Time: 09:48, Arrival Time: 12:51", "breakfast": "-", "attraction": "-", "lunch": "-", "dinner": "California Pizza Kitchen, Boise", "accommodation": "Modern & Cozy 2 BR Private Apartment in Brooklyn, Boise"}, {"day": 2, "current_city": "Boise", "transportation": "-", "breakfast": "Gopala Hari, Boise", "attraction": "Zoo Boise, Boise;Idaho Botanical Garden, Boise;", "lunch": "Domino's Pizza, Boise", "dinner": "Zerruco - The Ashok, Boise", "accommodation": "Modern & Cozy 2 BR Private Apartment in Brooklyn, Boise"}, {"day": 3, "current_city": "from Boise to Pocatello", "transportation": "Self-driving, from Boise to Pocatello, duration: 3 hours 25 mins, distance: 378 km", "breakfast": "-", "attraction": "Idaho Museum of Natural History, Pocatello;Fort Hall Replica and Commemorative Trading Post, Pocatello;", "lunch": "Deorio's, Pocatello", "dinner": "650 - The Global Kitchen, Pocatello", "accommodation": "Entire Modern Studio Apartment/Prime Location, Pocatello"}, {"day": 4, "current_city": "Pocatello", "transportation": "-", "breakfast": "Oriental Kitchen Express, Pocatello", "attraction": "Zoo Idaho, Pocatello;Bannock County Historical Museum, Pocatello;", "lunch": "Ghar Ki Handi, Pocatello", "dinner": "Gola Sizzlers, Pocatello", "accommodation": "Entire Modern Studio Apartment/Prime Location, Pocatello"}, {"day": 5, "current_city": "from Pocatello to Idaho Falls", "transportation": "Self-driving, from Pocatello to Idaho Falls, duration: 51 mins, distance: 83.6 km", "breakfast": "-", "attraction": "Museum of Idaho, Idaho Falls;Idaho Falls Zoo at Tautphaus Park, Idaho Falls;", "lunch": "Shiv Restaurant, Idaho Falls", "dinner": "Taste of China, Idaho Falls", "accommodation": "Sunny & Spacious 2 bdrm apt, Idaho Falls"}, {"day": 6, "current_city": "Idaho Falls", "transportation": "-", "breakfast": "Karim's, Idaho Falls", "attraction": "The Art Museum Of Eastern Idaho, Idaho Falls;Idaho Falls River Walk - Greenbelt Trail, Idaho Falls;", "lunch": "Chinese X'Press, Idaho Falls", "dinner": "Dhuaan, Idaho Falls", "accommodation": "Sunny & Spacious 2 bdrm apt, Idaho Falls"}, {"day": 7, "current_city": "from Idaho Falls to Chicago", "transportation": "Self-driving, from Idaho Falls to Chicago, duration: 21 hours 43 mins, distance: 2,369 km", "breakfast": "-", "attraction": "-", "lunch": "-", "dinner": "-", "accommodation": "-"}]}]