[{"gpt-4-1106-preview_direct_sole-planning_results": "Travel Plan:\n\nDays: 1\nCurrent City: from Salt Lake City to San Diego\nTransportation: Flight Number: F3499966, from Salt Lake City to San Diego, Departure Time: 08:02, Arrival Time: 08:55, cost: $300 per person\nBreakfast: -, \nAttraction: -,\nLunch: -, \nDinner: Open Yard, San Diego, cost: $33, cuisines: \u201cChinese, Pizza, Cafe, Desserts\u201d\nAccommodation: Spacious Room in Large 2 Bedroom Prewar Apartment, San Diego, cost: $585, room type: Private room, house rules: No parties & No visitors, minimum nights: 1, maximum occupancy: 2, review rate number: 4.0\n\nNumber of people = 2\nTotal cost = ($300 x 2) + ($33 x 2) + $585 = $1251\nAccommodation minimum nights: 1/1\n\nDays: 2\nCurrent City: San Diego\nTransportation: -, \nBreakfast: Jetha Lal Ka Dhabha, San Diego, cost: $22, cuisines: \u201cTea, Cafe, Indian, Italian\u201d\nAttraction: Cabrillo National Monument, San Diego; La Jolla Shores Park, San Diego\nLunch: The Lost Mughal, San Diego, cost: $74, cuisines: \u201cTea, Cafe, Italian\u201d\nDinner: Gopala, San Diego, cost: $98, cuisines: \u201cPizza, Mexican, BBQ, American, Seafood\u201d\nAccommodation: Spacious Room in Large 2 Bedroom Prewar Apartment, San Diego, cost: $585, room type: Private room, house rules: No parties & No visitors, minimum nights: 1, maximum occupancy: 2, review rate number: 4.0\n\nNumber of people = 2\nTotal cost = ($22 x 2) + ($74 x 2) + ($98 x 2) + $585 = $1073\nAccommodation minimum nights: 2/1\n\nDays: 3\nCurrent City: from San Diego to San Luis Obispo\nTransportation: Flight Number: F3820181, from San Diego to San Luis Obispo, Departure Time: 09:59, Arrival Time: 11:02, cost: $76 per person\nBreakfast: -, \nAttraction: -,\nLunch: -, \nDinner: Ooma, San Luis Obispo, cost: $88, cuisines: \u201cDesserts, Fast Food, Cafe, Indian, Seafood\u201d\nAccommodation: Upper West Side 1 bedroom, San Luis Obispo, cost: $859, room type: Entire home/apt, house rules: No smoking, minimum nights: 1, maximum occupancy: 5, review rate number: 3.0\n\nNumber of people = 2\nTotal cost = ($76 x 2) + ($88 x 2) + $859 = $1187\nAccommodation minimum nights: 3/1\n\nDays: 4\nCurrent City: San Luis Obispo\nTransportation: -, \nBreakfast: Sushi Leblon, San Luis Obispo, cost: $38, cuisines: \u201cFrench, BBQ, Fast Food, Indian, Seafood\u201d\nAttraction: San Luis Obispo Children's Museum, San Luis Obispo; Mission Plaza, San Luis Obispo\nLunch: Najmat Lahore Restaurant, San Luis Obispo, cost: $36, cuisines: \u201cSeafood, American, BBQ, Italian\u201d\nDinner: Gaucho, San Luis Obispo, cost: $98, cuisines: \u201cMexican, Bakery, BBQ, Seafood\u201d\nAccommodation: Upper West Side 1 bedroom, San Luis Obispo, cost: $859, room type: Entire home/apt, house rules: No smoking, minimum nights: 1, maximum occupancy: 5, review rate number: 3.0\n\nNumber of people = 2\nTotal cost = ($38 x 2) + ($36 x 2) + ($98 x 2) + $859 = $1203\nAccommodation minimum nights: 4/1\n\nDays: 5\nCurrent City: from San Luis Obispo to Los Angeles\nTransportation: Flight Number: F3854130, from San Luis Obispo to Los Angeles, Departure Time: 05:53, Arrival Time: 06:55, cost: $53 per person\nBreakfast: -, \nAttraction: -,\nLunch: -, \nDinner: Heat - Edsa Shangri-La, Los Angeles, cost: $148, cuisines: \u201cBakery, BBQ\u201d\nAccommodation: Midtown East 2 Bed/2 Bath Elevator Building Apt, Los Angeles, cost: $540, room type: Entire home/apt, house rules: No pets, minimum nights: 7, maximum occupancy: 4, review rate number: 3.0\n\nNumber of people = 2\nTotal cost = ($53 x 2) + ($148 x 2) + $540 = $942\nAccommodation minimum nights: 5/7\n\nDays: 6\nCurrent City: Los Angeles\nTransportation: -, \nBreakfast: Palmshore, Los Angeles, cost: $25, cuisines: \u201cDesserts, Bakery, Fast Food, American, Seafood\u201d\nAttraction: Santa Monica Pier, Los Angeles; Hollywood Walk of Fame, Los Angeles\nLunch: Punjabi Zaika, Los Angeles, cost: $46, cuisines: \u201cPizza, Bakery, BBQ, Cafe, Indian\u201d\nDinner: The Hangout by 1861, Los Angeles, cost: $64, cuisines: \u201cTea, Pizza, Seafood\u201d\nAccommodation: Midtown East 2 Bed/2 Bath Elevator Building Apt, Los Angeles, cost: $540, room type: Entire home/apt, house rules: No pets, minimum nights: 7, maximum occupancy: 4, review rate number: 3.0\n\nNumber of people = 2\nTotal cost = ($25 x 2) + ($46 x 2) + ($64 x 2) + $540 = $810\nAccommodation minimum nights: 6/7\n\nDays: 7\nCurrent City: from Los Angeles to Salt Lake City\nTransportation: Flight Number: F3528613, from Los Angeles to Salt Lake City, Departure Time: 11:14, Arrival Time: 13:55, cost: $214 per person\nBreakfast: -, \nAttraction: -,\nLunch: -, \nDinner: -, \nAccommodation: -,\n\nNumber of people = 2\nTotal cost = ($214 x 2) = $428\n\nTotal cost across all days = $1251 + $1073 + $1187 + $1203 + $942 + $810 + $428 = $6894\n\nUnfortunately, the total cost exceeds the specified budget of $4,600. Adjustments will need to be made to the plan to reduce costs. This could involve selecting cheaper flights, accommodations, or dining options. Additionally, the accommodation on Day 5 does not meet the smoking requirement, and the minimum nights for the accommodation on Day 5 and Day 6 exceed the duration of the stay in Los Angeles. These issues will need to be addressed in the revised plan.", "gpt-4-1106-preview_direct_sole-planning_parsed_results": [{"day": 1, "current_city": "from Salt Lake City to San Diego", "transportation": "Flight Number: F3499966, from Salt Lake City to San Diego, Departure Time: 08:02, Arrival Time: 08:55", "breakfast": "-", "attraction": "-", "lunch": "-", "dinner": "Open Yard, San Diego", "accommodation": "Spacious Room in Large 2 Bedroom Prewar Apartment, San Diego"}, {"day": 2, "current_city": "San Diego", "transportation": "-", "breakfast": "Jetha Lal Ka Dhabha, San Diego", "attraction": "Cabrillo National Monument, San Diego;La Jolla Shores Park, San Diego;", "lunch": "The Lost Mughal, San Diego", "dinner": "Gopala, San Diego", "accommodation": "Spacious Room in Large 2 Bedroom Prewar Apartment, San Diego"}, {"day": 3, "current_city": "from San Diego to San Luis Obispo", "transportation": "Flight Number: F3820181, from San Diego to San Luis Obispo, Departure Time: 09:59, Arrival Time: 11:02", "breakfast": "-", "attraction": "-", "lunch": "-", "dinner": "Ooma, San Luis Obispo", "accommodation": "Upper West Side 1 bedroom, San Luis Obispo"}, {"day": 4, "current_city": "San Luis Obispo", "transportation": "-", "breakfast": "Sushi Leblon, San Luis Obispo", "attraction": "San Luis Obispo Children's Museum, San Luis Obispo;Mission Plaza, San Luis Obispo;", "lunch": "Najmat Lahore Restaurant, San Luis Obispo", "dinner": "Gaucho, San Luis Obispo", "accommodation": "Upper West Side 1 bedroom, San Luis Obispo"}, {"day": 5, "current_city": "from San Luis Obispo to Los Angeles", "transportation": "Flight Number: F3854130, from San Luis Obispo to Los Angeles, Departure Time: 05:53, Arrival Time: 06:55", "breakfast": "-", "attraction": "-", "lunch": "-", "dinner": "Heat - Edsa Shangri-La, Los Angeles", "accommodation": "Midtown East 2 Bed/2 Bath Elevator Building Apt, Los Angeles"}, {"day": 6, "current_city": "Los Angeles", "transportation": "-", "breakfast": "Palmshore, Los Angeles", "attraction": "Santa Monica Pier, Los Angeles;Hollywood Walk of Fame, Los Angeles;", "lunch": "Punjabi Zaika, Los Angeles", "dinner": "The Hangout by 1861, Los Angeles", "accommodation": "Midtown East 2 Bed/2 Bath Elevator Building Apt, Los Angeles"}, {"day": 7, "current_city": "from Los Angeles to Salt Lake City", "transportation": "Flight Number: F3528613, from Los Angeles to Salt Lake City, Departure Time: 11:14, Arrival Time: 13:55", "breakfast": "-", "attraction": "-", "lunch": "-", "dinner": "-", "accommodation": "-"}]}]