[{"gpt-4-1106-preview_direct_sole-planning_results": "Travel Plan:\nDays: 1\nCurrent City: from Washington to Myrtle Beach,\nTransportation: Flight Number: F3792603, from Washington to Myrtle Beach, Departure Time: 09:19, Arrival Time: 10:59, cost: 164\nBreakfast: -, \nAttraction: -,\nLunch: Exotic India, Myrtle Beach, cost: 81, cuisines: \u201cIndian, BBQ, Fast Food\u201d\nDinner: Catfish Charlie's, Myrtle Beach, cost: 14, cuisines: \u201cTea, Chinese, Desserts\u201d\nAccommodation: Cozy Brooklyn Room - Next to Pratt Institute, Myrtle Beach, cost: 418, maximum occupancy: 2, house rules: No smoking & No children under 10 & No pets, minimum nights: 5\n\nNumber of people = 1\nTotal cost = 164 x 1 + 81 x 1 + 14 x 1 + 418 x 1 = 677\nAccommodation minimum nights:  1/5\n\nDays: 2,\nCurrent City: Myrtle Beach, \nTransportation: -, \nBreakfast: First Eat, Myrtle Beach, cost: 21, cuisines: \u201cTea, Mexican, Fast Food\u201d\nAttraction: SkyWheel Myrtle Beach; WonderWorks Myrtle Beach\nLunch: d' Curry House, Myrtle Beach, cost: 33, cuisines: \u201cTea, Chinese, Desserts, Fast Food\u201d\nDinner: Twigly, Myrtle Beach, cost: 55, cuisines: \u201cTea, Bakery, Mediterranean, Seafood\u201d\nAccommodation: Cozy Brooklyn Room - Next to Pratt Institute, Myrtle Beach, cost: 418, maximum occupancy: 2, house rules: No smoking & No children under 10 & No pets, minimum nights: 5\n\nNumber of people = 1\nTotal cost = 21 x 1 + 33 x 1 + 55 x 1 + 418 x 1 = 527\nAccommodation minimum nights:  2/5\n\nDays: 3, \nCurrent City: from Myrtle Beach to Washington, \nTransportation: Flight Number: F3791200, from Myrtle Beach to Washington, Departure Time: 11:36, Arrival Time: 13:06, cost: 87\nBreakfast: Nagai, Myrtle Beach, cost: 19, cuisines: \u201cDesserts, Pizza, Mexican, Fast Food, American, Seafood\u201d\nAttraction: Family Kingdom Amusement Park; Hollywood Wax Museum\nLunch: -, \nDinner: -, \nAccommodation: -,\n\nNumber of people = 1\nTotal cost = 87 x 1 + 19 x 1 = 106\n\nTotal cost across all days = 677 + 527 + 106 = 1310 \nCuisines: The prompt specifies no cuisines, so all cuisines constraints are satisfied", "gpt-4-1106-preview_direct_sole-planning_parsed_results": [{"day": 1, "current_city": "from Washington to Myrtle Beach", "transportation": "Flight Number: F3792603, from Washington to Myrtle Beach, Departure Time: 09:19, Arrival Time: 10:59", "breakfast": "-", "attraction": "-", "lunch": "Exotic India, Myrtle Beach", "dinner": "Catfish Charlie's, Myrtle Beach", "accommodation": "Cozy Brooklyn Room - Next to Pratt Institute, Myrtle Beach"}, {"day": 2, "current_city": "Myrtle Beach", "transportation": "-", "breakfast": "First Eat, Myrtle Beach", "attraction": "SkyWheel Myrtle Beach, Myrtle Beach;WonderWorks Myrtle Beach, Myrtle Beach;", "lunch": "d' Curry House, Myrtle Beach", "dinner": "Twigly, Myrtle Beach", "accommodation": "Cozy Brooklyn Room - Next to Pratt Institute, Myrtle Beach"}, {"day": 3, "current_city": "from Myrtle Beach to Washington", "transportation": "Flight Number: F3791200, from Myrtle Beach to Washington, Departure Time: 11:36, Arrival Time: 13:06", "breakfast": "Nagai, Myrtle Beach", "attraction": "Family Kingdom Amusement Park, Myrtle Beach;Hollywood Wax Museum, Myrtle Beach;", "lunch": "-", "dinner": "-", "accommodation": "-"}]}]