[{"gpt-4-1106-preview_direct_sole-planning_results": "Travel Plan:\n\nDays: 1\nCurrent City: from Monterey to Dallas,\nTransportation: Flight Number: F4046679, from Monterey to Dallas, Departure Time: 14:02, Arrival Time: 19:18, cost: 489\nBreakfast: -, \nAttraction: -,\nLunch: -, \nDinner: L'Opera, Dallas, cost: 77, cuisines: \u201cFrench, Bakery, BBQ, Fast Food, Seafood\u201d\nAccommodation: Luxury Williamsburg duplex, private roof terrace, Dallas, cost: 241, maximum occupancy: 3, house rules: No visitors, minimum nights: 4\n\nNumber of people = 4\nTotal cost = 489 x 4 + 77 x 4 + 241 x 4 = 3244 \nAccommodation minimum nights:  1/4\n\nDays: 2,\nCurrent City: Dallas, \nTransportation: -, \nBreakfast: Cafe Gatherings, Dallas, cost: 17, cuisines: Bakery, Indian, Desserts\nAttraction: The Dallas World Aquarium, Dallas; The Sixth Floor Museum at Dealey Plaza, Dallas\nLunch: 1918 Bistro & Grill, Dallas, cost: 90, cuisines: \u201cTea, Pizza, BBQ, Seafood\u201d\nDinner: Delhicacy, Dallas, cost: 67, cuisines: \u201cDesserts, Mexican, Bakery, Chinese, Seafood\u201d\nAccommodation: Luxury Williamsburg duplex, private roof terrace, Dallas, cost: 241, maximum occupancy: 3, house rules: No visitors, minimum nights: 4\n\nNumber of people = 4\nTotal cost = 17 x 4 + 90 x 4 + 67 x 4 + 241 x 4 = 1660\nAccommodation minimum nights:  2/4\n\nDays: 3,\nCurrent City: Dallas, \nTransportation: -, \nBreakfast: Cafe Coffee Day, Dallas, cost: 76, cuisines: Fast Food, Desserts, Italian\nAttraction: Reunion Tower, Dallas; Dallas Museum of Art, Dallas\nLunch: Castle 9, Dallas, cost: 32, cuisines: Mexican, Bakery, BBQ, Fast Food, Cafe, American\nDinner: Firefly India, Dallas, cost: 87, cuisines: Cafe, Bakery, American, Italian\nAccommodation: Luxury Williamsburg duplex, private roof terrace, Dallas, cost: 241, maximum occupancy: 3, house rules: No visitors, minimum nights: 4\n\nNumber of people = 4\nTotal cost = 76 x 4 + 32 x 4 + 87 x 4 + 241 x 4 = 1748\nAccommodation minimum nights:  3/4\n\nDays: 4,\nCurrent City: from Dallas to Del Rio, \nTransportation: Self-driving, from Dallas to Del Rio, duration: 6 hours 21 mins, distance: 668 km, cost: 33\nBreakfast: -, \nAttraction: -,\nLunch: -, \nDinner: Green Chick Chop, Del Rio, cost: 82, cuisines: Tea, Bakery, Indian, Mediterranean, Seafood\nAccommodation: Spacious Brooklyn One Bedroom/Loft***Morgan L Stop, Del Rio, cost: 1164, maximum occupancy: 4, house rules: No visitors, minimum nights: 4\n\nNumber of people = 4\nTotal cost = 33 x 4 + 82 x 4 + 1164 x 4 = 5092\nAccommodation minimum nights:  1/4\n\nDays: 5,\nCurrent City: Del Rio, \nTransportation: -, \nBreakfast: Jom Jom Malay, Del Rio, cost: 78, cuisines: Chinese, Indian, Desserts, Fast Food\nAttraction: Whitehead Memorial Museum, Del Rio; Amistad National Recreation Area, Del Rio\nLunch: Pizzoccheri, Del Rio, cost: 77, cuisines: Cafe, Seafood, Mediterranean, Italian\nDinner: Locale, Del Rio, cost: 43, cuisines: Desserts, Pizza, Fast Food, Chinese, American, Seafood\nAccommodation: Spacious Brooklyn One Bedroom/Loft***Morgan L Stop, Del Rio, cost: 1164, maximum occupancy: 4, house rules: No visitors, minimum nights: 4\n\nNumber of people = 4\nTotal cost = 78 x 4 + 77 x 4 + 43 x 4 + 1164 x 4 = 5424\nAccommodation minimum nights:  2/4\n\nDays: 6,\nCurrent City: Del Rio, \nTransportation: -, \nBreakfast: Baba Chicken Ludhiana Wale, Del Rio, cost: 33, cuisines: Tea, Cafe, Pizza\nAttraction: Devils River State Natural Area, Del Rio; Laughlin Heritage Foundation Museum, Del Rio\nLunch: Amici Cafe, Del Rio, cost: 96, cuisines: Cafe, Mexican, Bakery\nDinner: Flip Burger, Del Rio, cost: 49, cuisines: Desserts, Tea, Mexican, BBQ, Cafe\nAccommodation: Spacious Brooklyn One Bedroom/Loft***Morgan L Stop, Del Rio, cost: 1164, maximum occupancy: 4, house rules: No visitors, minimum nights: 4\n\nNumber of people = 4\nTotal cost = 33 x 4 + 96 x 4 + 49 x 4 + 1164 x 4 = 5344\nAccommodation minimum nights:  3/4\n\nDays: 7,\nCurrent City: from Del Rio to Amarillo, \nTransportation: Self-driving, from Del Rio to Amarillo, duration: 7 hours 0 mins, distance: 754 km, cost: 37\nBreakfast: -, \nAttraction: -,\nLunch: -, \nDinner: The Whippet, Amarillo, cost: 58, cuisines: French, Bakery, BBQ, Fast Food, Cafe\nAccommodation: Harlem Humble Abode - 1 bedroom - Cute and Quaint, Amarillo, cost: 409, maximum occupancy: 3, house rules: No pets, minimum nights: 5\n\nNumber of people = 4\nTotal cost = 37 x 4 + 58 x 4 + 409 x 4 = 2016\nAccommodation minimum nights:  1/5\n\nTotal cost across all days = 3244 + 1660 + 1748 + 5092 + 5424 + 5344 + 2016 = 24528 \n\nCuisines: The prompt specifies French and Chinese cuisines, so all cuisine constraints are satisfied\n\nNote: The total cost exceeds the specified budget of $15,600. Adjustments to the plan, such as changing accommodations or dining options, will be necessary to meet the budget constraint.", "gpt-4-1106-preview_direct_sole-planning_parsed_results": [{"day": 1, "current_city": "from Monterey to Dallas", "transportation": "Flight Number: F4046679, from Monterey to Dallas, Departure Time: 14:02, Arrival Time: 19:18", "breakfast": "-", "attraction": "-", "lunch": "-", "dinner": "L'Opera, Dallas", "accommodation": "Luxury Williamsburg duplex, private roof terrace, Dallas"}, {"day": 2, "current_city": "Dallas", "transportation": "-", "breakfast": "Cafe Gatherings, Dallas", "attraction": "The Dallas World Aquarium, Dallas;The Sixth Floor Museum at Dealey Plaza, Dallas;", "lunch": "1918 Bistro & Grill, Dallas", "dinner": "Delhicacy, Dallas", "accommodation": "Luxury Williamsburg duplex, private roof terrace, Dallas"}, {"day": 3, "current_city": "Dallas", "transportation": "-", "breakfast": "Cafe Coffee Day, Dallas", "attraction": "Reunion Tower, Dallas;Dallas Museum of Art, Dallas;", "lunch": "Castle 9, Dallas", "dinner": "Firefly India, Dallas", "accommodation": "Luxury Williamsburg duplex, private roof terrace, Dallas"}, {"day": 4, "current_city": "from Dallas to Del Rio", "transportation": "Self-driving, from Dallas to Del Rio, duration: 6 hours 21 mins, distance: 668 km", "breakfast": "-", "attraction": "-", "lunch": "-", "dinner": "Green Chick Chop, Del Rio", "accommodation": "Spacious Brooklyn One Bedroom/Loft***Morgan L Stop, Del Rio"}, {"day": 5, "current_city": "Del Rio", "transportation": "-", "breakfast": "Jom Jom Malay, Del Rio", "attraction": "Whitehead Memorial Museum, Del Rio;Amistad National Recreation Area, Del Rio;", "lunch": "Pizzoccheri, Del Rio", "dinner": "Locale, Del Rio", "accommodation": "Spacious Brooklyn One Bedroom/Loft***Morgan L Stop, Del Rio"}, {"day": 6, "current_city": "Del Rio", "transportation": "-", "breakfast": "Baba Chicken Ludhiana Wale, Del Rio", "attraction": "Devils River State Natural Area, Del Rio;Laughlin Heritage Foundation Museum, Del Rio;", "lunch": "Amici Cafe, Del Rio", "dinner": "Flip Burger, Del Rio", "accommodation": "Spacious Brooklyn One Bedroom/Loft***Morgan L Stop, Del Rio"}, {"day": 7, "current_city": "from Del Rio to Amarillo", "transportation": "Self-driving, from Del Rio to Amarillo, duration: 7 hours 0 mins, distance: 754 km", "breakfast": "-", "attraction": "-", "lunch": "-", "dinner": "The Whippet, Amarillo", "accommodation": "Harlem Humble Abode - 1 bedroom - Cute and Quaint, Amarillo"}]}]