[{"gpt-4-1106-preview_direct_sole-planning_results": "Travel Plan:\n\nDays: 1\nCurrent City: from Manchester to Charlotte,\nTransportation: Flight Number: F3785421, from Manchester to Charlotte, Departure Time: 14:16, Arrival Time: 16:46, cost: 223\nBreakfast: -, \nAttraction: -,\nLunch: -, \nDinner: Olive Tree Cafe, Charlotte, cost: 23, cuisines: \u201cTea, Chinese, Desserts\u201d\nAccommodation: Elegant Studio Apt in Prospect Heights, Charlotte, cost: 640, maximum occupancy: 5, house rules: No parties, minimum nights: 2\n\nNumber of people = 5\nTotal cost = 223 x 5 + 23 x 5 + 640 x 1 = 1115 + 115 + 640 = 1870\nAccommodation minimum nights:  1/2\n\nDays: 2,\nCurrent City: Charlotte, \nTransportation: -, \nBreakfast: Central Perk 7, Charlotte, cost: 87, cuisines: \u201cPizza, Bakery, BBQ, Fast Food\u201d\nAttraction: Freedom Park, Charlotte; Levine Museum of the New South, Charlotte\nLunch: Kylin Skybar, Charlotte, cost: 44, cuisines: \u201cTea, Cafe, Pizza, Italian\u201d\nDinner: Unplugged Courtyard, Charlotte, cost: 54, cuisines: \u201cDesserts, French, Bakery, Cafe, Seafood\u201d\nAccommodation: Elegant Studio Apt in Prospect Heights, Charlotte, cost: 640, maximum occupancy: 5, house rules: No parties, minimum nights: 2\n\nNumber of people = 5\nTotal cost = 87 x 5 + 44 x 5 + 54 x 5 + 640 x 1 = 435 + 220 + 270 + 640 = 1565\nAccommodation minimum nights:  2/2\n\nDays: 3, \nCurrent City: from Charlotte to Manchester, \nTransportation: Flight Number: F3786316, from Charlotte to Manchester, Departure Time: 17:05, Arrival Time: 19:04, cost: 208\nBreakfast: Grover's - The Baker Shop, Charlotte, cost: 30, cuisines: \u201cPizza, Bakery, Chinese, Indian, Seafood\u201d\nAttraction: Discovery Place Science, Charlotte; NASCAR Hall of Fame, Charlotte\nLunch: Nagaland's Kitchen, Charlotte, cost: 73, cuisines: \u201cPizza, American, Desserts\u201d\nDinner: -, \nAccommodation: -,\n\nNumber of people = 5\nTotal cost = 208 x 5 + 30 x 5 + 73 x 5 = 1040 + 150 + 365 = 1555\n\nTotal cost across all days = 1870 + 1565 + 1555 = 4990\n\nCuisines: The prompt specifies no cuisines, so all cuisines constraints are satisfied\n\nNote: The total cost slightly exceeds the budget by $190. To adjust for this, we can consider changing the flight to a cheaper option or selecting a less expensive accommodation if available. However, based on the provided data, this is the most cost-effective plan that meets the requirements of entire room accommodations and the specified dates.", "gpt-4-1106-preview_direct_sole-planning_parsed_results": [{"day": 1, "current_city": "from Manchester to Charlotte", "transportation": "Flight Number: F3785421, from Manchester to Charlotte, Departure Time: 14:16, Arrival Time: 16:46", "breakfast": "-", "attraction": "-", "lunch": "-", "dinner": "Olive Tree Cafe, Charlotte", "accommodation": "Elegant Studio Apt in Prospect Heights, Charlotte"}, {"day": 2, "current_city": "Charlotte", "transportation": "-", "breakfast": "Central Perk 7, Charlotte", "attraction": "Freedom Park, Charlotte;Levine Museum of the New South, Charlotte;", "lunch": "Kylin Skybar, Charlotte", "dinner": "Unplugged Courtyard, Charlotte", "accommodation": "Elegant Studio Apt in Prospect Heights, Charlotte"}, {"day": 3, "current_city": "from Charlotte to Manchester", "transportation": "Flight Number: F3786316, from Charlotte to Manchester, Departure Time: 17:05, Arrival Time: 19:04", "breakfast": "Grover's - The Baker Shop, Charlotte", "attraction": "Discovery Place Science, Charlotte;NASCAR Hall of Fame, Charlotte;", "lunch": "Nagaland's Kitchen, Charlotte", "dinner": "-", "accommodation": "-"}]}]