[{"gpt-4-1106-preview_direct_sole-planning_results": "Travel Plan:\n\nDays: 1\nCurrent City: from Valparaiso to Belleville,\nTransportation: Flight Number: F3579167, from Valparaiso to Belleville, Departure Time: 17:23, Arrival Time: 19:06, cost: 211\nBreakfast: -, \nAttraction: -,\nLunch: -, \nDinner: Asian Haus, Belleville, cost: 87, cuisines: \u201cTea, Pizza, Bakery, Mediterranean\u201d\nAccommodation: 1 Bedroom/1 Bath Apt in Hudson Yards/Midtown West, Belleville, cost: 610, maximum occupancy: 2, house rules: No parties & No pets, minimum nights: 1\n\nNumber of people = 8\nTotal cost = 211 x 8 + 87 x 8 + 610 x 4 = 1688 + 696 + 2440 = 4824\nAccommodation minimum nights:  1/1\n\nDays: 2,\nCurrent City: Belleville, \nTransportation: -, \nBreakfast: Fuji Japanese Steak House, Belleville, cost: 70, cuisines: Bakery, Indian, Cafe\nAttraction: National Shrine of Our Lady of the Snows, Belleville; St. Clair County Historical Society, Belleville\nLunch: Moti Mahal Delux, Belleville, cost: 55, cuisines: \u201cCafe, American, Desserts\u201d\nDinner: Super Restaurant, Belleville, cost: 96, cuisines: \u201cTea, American, BBQ, Italian\u201d\nAccommodation: 1 Bedroom/1 Bath Apt in Hudson Yards/Midtown West, Belleville, cost: 610, maximum occupancy: 2, house rules: No parties & No pets, minimum nights: 1\n\nNumber of people = 8\nTotal cost = 70 x 8 + 55 x 8 + 96 x 8 + 610 x 4 = 560 + 440 + 768 + 2440 = 4208\nAccommodation minimum nights:  2/1\n\nDays: 3, \nCurrent City: from Belleville to Valparaiso, \nTransportation: Flight Number: F3571908, from Belleville to Valparaiso, Departure Time: 17:15, Arrival Time: 18:55, cost: 124\nBreakfast: Moon Light Sweets, Belleville, cost: 70, cuisines: \u201cPizza, BBQ\u201d\nAttraction: Belleville Square, Belleville; The Weingarten, Belleville\nLunch: RollsKing, Belleville, cost: 27, cuisines: \u201cChinese, Bakery, BBQ, Pizza\u201d\nDinner: -, \nAccommodation: -,\n\nNumber of people = 8\nTotal cost = 124 x 8 + 70 x 8 + 27 x 8 = 992 + 560 + 216 = 1768\n\nTotal cost across all days = 4824 + 4208 + 1768 = 10800\n\nCuisines: The prompt specifies Chinese and American cuisines, so all cuisine constraints are satisfied.\n\n**Note: The total cost exceeds the specified budget of $6,600. Adjustments are needed to meet the budget constraint.**\n\nAdjusted Travel Plan:\n\nDays: 1\nCurrent City: from Valparaiso to Belleville,\nTransportation: Flight Number: F3579167, from Valparaiso to Belleville, Departure Time: 17:23, Arrival Time: 19:06, cost: 211\nBreakfast: -, \nAttraction: -,\nLunch: -, \nDinner: Asian Haus, Belleville, cost: 87, cuisines: \u201cTea, Pizza, Bakery, Mediterranean\u201d\nAccommodation: Cozy, Belleville, cost: 184, maximum occupancy: 2, house rules: No visitors & No smoking & No children under 10, minimum nights: 1\n\nNumber of people = 8\nTotal cost = 211 x 8 + 87 x 8 + 184 x 4 = 1688 + 696 + 736 = 3120\nAccommodation minimum nights:  1/1\n\nDays: 2,\nCurrent City: Belleville, \nTransportation: -, \nBreakfast: Fuji Japanese Steak House, Belleville, cost: 70, cuisines: Bakery, Indian, Cafe\nAttraction: National Shrine of Our Lady of the Snows, Belleville; St. Clair County Historical Society, Belleville\nLunch: Moti Mahal Delux, Belleville, cost: 55, cuisines: \u201cCafe, American, Desserts\u201d\nDinner: Super Restaurant, Belleville, cost: 96, cuisines: \u201cTea, American, BBQ, Italian\u201d\nAccommodation: Cozy, Belleville, cost: 184, maximum occupancy: 2, house rules: No visitors & No smoking & No children under 10, minimum nights: 1\n\nNumber of people = 8\nTotal cost = 70 x 8 + 55 x 8 + 96 x 8 + 184 x 4 = 560 + 440 + 768 + 736 = 2504\nAccommodation minimum nights:  2/1\n\nDays: 3, \nCurrent City: from Belleville to Valparaiso, \nTransportation: Flight Number: F3571908, from Belleville to Valparaiso, Departure Time: 17:15, Arrival Time: 18:55, cost: 124\nBreakfast: Moon Light Sweets, Belleville, cost: 70, cuisines: \u201cPizza, BBQ\u201d\nAttraction: Belleville Square, Belleville; The Weingarten, Belleville\nLunch: RollsKing, Belleville, cost: 27, cuisines: \u201cChinese, Bakery, BBQ, Pizza\u201d\nDinner: -, \nAccommodation: -,\n\nNumber of people = 8\nTotal cost = 124 x 8 + 70 x 8 + 27 x 8 = 992 + 560 + 216 = 1768\n\nTotal cost across all days = 3120 + 2504 + 1768 = 7392\n\n**Note: The adjusted total cost still exceeds the specified budget of $6,600. Further adjustments are needed to meet the budget constraint.**\n\n**Final Adjusted Travel Plan:**\n\nTo meet the budget, we will need to adjust the accommodation and meal costs. We can opt for more budget-friendly restaurants and possibly change the accommodation to a less expensive option or reduce the number of rooms booked.\n\nUnfortunately, without additional information on cheaper accommodations or meal options, I cannot provide a further adjusted plan that meets all the constraints, including the budget limit.", "gpt-4-1106-preview_direct_sole-planning_parsed_results": [{"day": 1, "current_city": "from Valparaiso to Belleville", "transportation": "Flight Number: F3579167, from Valparaiso to Belleville, Departure Time: 17:23, Arrival Time: 19:06", "breakfast": "-", "attraction": "-", "lunch": "-", "dinner": "Asian Haus, Belleville", "accommodation": "1 Bedroom/1 Bath Apt in Hudson Yards/Midtown West, Belleville"}, {"day": 2, "current_city": "Belleville", "transportation": "-", "breakfast": "Fuji Japanese Steak House, Belleville", "attraction": "National Shrine of Our Lady of the Snows, Belleville;St. Clair County Historical Society, Belleville;", "lunch": "Moti Mahal Delux, Belleville", "dinner": "Super Restaurant, Belleville", "accommodation": "1 Bedroom/1 Bath Apt in Hudson Yards/Midtown West, Belleville"}, {"day": 3, "current_city": "from Belleville to Valparaiso", "transportation": "Flight Number: F3571908, from Belleville to Valparaiso, Departure Time: 17:15, Arrival Time: 18:55", "breakfast": "Moon Light Sweets, Belleville", "attraction": "Belleville Square, Belleville;The Weingarten, Belleville;", "lunch": "RollsKing, Belleville", "dinner": "-", "accommodation": "-"}]}]