[{"gpt-4-1106-preview_direct_sole-planning_results": "Travel Plan:\nDays: 1\nCurrent City: from Ontario to Honolulu,\nTransportation: Flight Number: F3584294, from Ontario to Honolulu, Departure Time: 10:11, Arrival Time: 14:46, cost: 888\nBreakfast: -, \nAttraction: -,\nLunch: -, \nDinner: Bait El Khetyar, Honolulu, cost: 28, cuisines: \u201cCafe, Seafood\u201d\nAccommodation: Harlem 1 BR, Private Master Bath, Honolulu, cost: 396, maximum occupancy: 1, house rules: No pets, minimum nights: 2\n\nNumber of people = 1\nTotal cost = 888 x 1 + 28 x 1 + 396 x 1 = 1312 \nAccommodation minimum nights:  1/2\n\nDays: 2,\nCurrent City: Honolulu, \nTransportation: -, \nBreakfast: Viva Hyderabad, Honolulu, cost: 29, cuisines: Bakery, BBQ\nAttraction: Iolani Palace, Honolulu; Waikiki Aquarium, Honolulu\nLunch: The Sugar Story, Honolulu, cost: 60, cuisines: \u201cPizza, Bakery, BBQ, Seafood\u201d\nDinner: Dishoom, Honolulu, cost: 63, cuisines: \u201cChinese, Bakery, Desserts\u201d\nAccommodation: Harlem 1 BR, Private Master Bath, Honolulu, cost: 396, maximum occupancy: 1, house rules: No pets, minimum nights: 2\n\nNumber of people = 1\nTotal cost = 29 x 1 + 60 x 1 + 63 x 1 + 396 x 1 = 548\nAccommodation minimum nights:  2/2\n\nDays: 3, \nCurrent City: from Honolulu to Ontario, \nTransportation: Flight Number: F3584327, from Honolulu to Ontario, Departure Time: 14:35, Arrival Time: 22:02, cost: 1075\nBreakfast: Evergreen Sweet House, Honolulu, cost: 18, cuisines: \u201cBBQ, Desserts, Fast Food\u201d\nAttraction: Pearl Harbor National Memorial, Honolulu; Ala Moana Regional Park, Honolulu\nLunch: Mama's Chinese Kitchen, Honolulu, cost: 13, cuisines: \u201cTea, Pizza, Desserts, Italian\u201d\nDinner: -, \nAccommodation: -,\n\nNumber of people = 1\nTotal cost = 1075 x 1 + 18 x 1 + 13 x 1 = 1106\n\nTotal cost across all days = 1312 + 548 + 1106 = 2966 \nCuisines: The prompt specifies no cuisines, so all cuisines constraints are satisfied\n\nNote: The travel plan adheres to the constraints provided in the query, including the budget limit of $3,200. The total cost of the trip is $2,966, which is within the budget. The accommodations are private as per the query, and no restaurant or attraction is repeated. The transportation is consistent with flights as the only mode of transportation between Ontario and Honolulu. The plan includes all required details for each day, ensuring at least 50% of the details are provided. The city sequence starts and ends in Ontario, forming a closed circle, and Honolulu is the only other city visited, matching the specified number of visiting cities. The number of days in the plan is 3, which matches the specified number of days in the query.", "gpt-4-1106-preview_direct_sole-planning_parsed_results": [{"day": 1, "current_city": "from Ontario to Honolulu", "transportation": "Flight Number: F3584294, from Ontario to Honolulu, Departure Time: 10:11, Arrival Time: 14:46", "breakfast": "-", "attraction": "-", "lunch": "-", "dinner": "Bait El Khetyar, Honolulu", "accommodation": "Harlem 1 BR, Private Master Bath, Honolulu"}, {"day": 2, "current_city": "Honolulu", "transportation": "-", "breakfast": "Viva Hyderabad, Honolulu", "attraction": "Iolani Palace, Honolulu;Waikiki Aquarium, Honolulu;", "lunch": "The Sugar Story, Honolulu", "dinner": "Dishoom, Honolulu", "accommodation": "Harlem 1 BR, Private Master Bath, Honolulu"}, {"day": 3, "current_city": "from Honolulu to Ontario", "transportation": "Flight Number: F3584327, from Honolulu to Ontario, Departure Time: 14:35, Arrival Time: 22:02", "breakfast": "Evergreen Sweet House, Honolulu", "attraction": "Pearl Harbor National Memorial, Honolulu;Ala Moana Regional Park, Honolulu;", "lunch": "Mama's Chinese Kitchen, Honolulu", "dinner": "-", "accommodation": "-"}]}]