[{"gpt-4-1106-preview_direct_sole-planning_results": "Travel Plan:\n\nDays: 1\nCurrent City: from St. Louis to Las Vegas,\nTransportation: Flight Number: F3963080, from St. Louis to Las Vegas, Departure Time: 14:46, Arrival Time: 16:09, cost: 389\nBreakfast: -, \nAttraction: -,\nLunch: -, \nDinner: Ethos Vegan Kitchen, Las Vegas, cost: 42, cuisines: \u201cDesserts, Bakery, Cafe, Mediterranean, Seafood\u201d\nAccommodation: Cozy modern stay, Las Vegas, cost: 100, maximum occupancy: 2, house rules: No children under 10, minimum nights: 1\n\nNumber of people = 1\nTotal cost = 389 x 1 + 42 x 1 + 100 x 1 = 531\nAccommodation minimum nights:  1/1\n\nDays: 2,\nCurrent City: Las Vegas, \nTransportation: -, \nBreakfast: Big Brewsky, Las Vegas, cost: 23, cuisines: \u201cTea, Bakery, Fast Food\u201d\nAttraction: The Mob Museum, Las Vegas; High Roller, Las Vegas\nLunch: Portneuf Valley Brewing, Las Vegas, cost: 58, cuisines: \u201cPizza, Mexican, Bakery, Fast Food, Cafe, Mediterranean\u201d\nDinner: Barbeque Nation, Las Vegas, cost: 88, cuisines: \u201cDesserts, Tea, Italian, Fast Food, American, Seafood\u201d\nAccommodation: Cozy modern stay, Las Vegas, cost: 100, maximum occupancy: 2, house rules: No children under 10, minimum nights: 1\n\nNumber of people = 1\nTotal cost = 23 x 1 + 58 x 1 + 88 x 1 + 100 x 1 = 269\nAccommodation minimum nights:  2/1\n\nDays: 3, \nCurrent City: from Las Vegas to St. Louis, \nTransportation: Flight Number: F3570705, from Las Vegas to St. Louis, Departure Time: 00:43, Arrival Time: 05:50, cost: 331\nBreakfast: Chili's Grill & Bar, Las Vegas, cost: 71, cuisines: \u201cPizza, Mexican, Bakery, Fast Food, Cafe\u201d\nAttraction: Fremont Street Experience, Las Vegas; Shark Reef Aquarium at Mandalay Bay, Las Vegas\nLunch: -, \nDinner: -,\nAccommodation: -,\n\nNumber of people = 1\nTotal cost = 331 x 1 + 71 x 1 = 402\n\nTotal cost across all days = 531 + 269 + 402 = 1202\nCuisines: The prompt specifies no cuisines, so all cuisines constraints are satisfied\n\nNote: Attractions and some meals are not priced as the provided information does not include costs for these items. The total cost is within the specified budget of $1,300. The plan includes transportation, meals, and accommodation for each day, ensuring at least 50% of required details are provided.", "gpt-4-1106-preview_direct_sole-planning_parsed_results": [{"day": 1, "current_city": "from St. Louis to Las Vegas", "transportation": "Flight Number: F3963080, from St. Louis to Las Vegas, Departure Time: 14:46, Arrival Time: 16:09", "breakfast": "-", "attraction": "-", "lunch": "-", "dinner": "Ethos Vegan Kitchen, Las Vegas", "accommodation": "Cozy modern stay, Las Vegas"}, {"day": 2, "current_city": "Las Vegas", "transportation": "-", "breakfast": "Big Brewsky, Las Vegas", "attraction": "The Mob Museum, Las Vegas;High Roller, Las Vegas;", "lunch": "Portneuf Valley Brewing, Las Vegas", "dinner": "Barbeque Nation, Las Vegas", "accommodation": "Cozy modern stay, Las Vegas"}, {"day": 3, "current_city": "from Las Vegas to St. Louis", "transportation": "Flight Number: F3570705, from Las Vegas to St. Louis, Departure Time: 00:43, Arrival Time: 05:50", "breakfast": "Chili's Grill & Bar, Las Vegas", "attraction": "Fremont Street Experience, Las Vegas;Shark Reef Aquarium at Mandalay Bay, Las Vegas;", "lunch": "-", "dinner": "-", "accommodation": "-"}]}]