[{"gpt-4-1106-preview_direct_sole-planning_results": "Travel Plan:\n\nDays: 1\nCurrent City: from West Palm Beach to White Plains\nTransportation: Flight Number: F3756085, from West Palm Beach to White Plains, Departure Time: 05:58, Arrival Time: 08:48, cost: 515\nBreakfast: -, \nAttraction: -,\nLunch: El Kiosco Mexican Restaurant, White Plains, cost: 65, cuisines: \u201cTea, Pizza\u201d\nDinner: Six Pack Kitchen, White Plains, cost: 58, cuisines: \u201cChinese, Mexican, Desserts, Seafood\u201d\nAccommodation: Large Opulent Studio Apartment Near Prospect Park, White Plains, cost: 465, room type: Entire home/apt, house rules: No children under 10, minimum nights: 4, maximum occupancy: 3\n\nNumber of people = 2\nTotal cost = (515 x 2) + (65 x 2) + (58 x 2) + (465 x 1) = 1736\nAccommodation minimum nights: 1/4\n\nDays: 2\nCurrent City: White Plains\nTransportation: -, \nBreakfast: Costa Coffee, White Plains, cost: 43, cuisines: \u201cCafe, Pizza, American, Italian\u201d\nAttraction: LEGOLAND Discovery Center Westchester, White Plains; Kensico Dam Plaza, White Plains\nLunch: Aravalli Owls, White Plains, cost: 26, cuisines: \u201cPizza, Mediterranean, BBQ\u201d\nDinner: Happy Hakka, White Plains, cost: 37, cuisines: \u201cDesserts, Pizza, Fast Food, Chinese, Seafood\u201d\nAccommodation: Large Opulent Studio Apartment Near Prospect Park, White Plains, cost: 465, room type: Entire home/apt, house rules: No children under 10, minimum nights: 4, maximum occupancy: 3\n\nNumber of people = 2\nTotal cost = (43 x 2) + (26 x 2) + (37 x 2) + (465 x 1) = 682\nAccommodation minimum nights: 2/4\n\nDays: 3\nCurrent City: from White Plains to West Palm Beach\nTransportation: Flight Number: F3759006, from White Plains to West Palm Beach, Departure Time: 15:51, Arrival Time: 18:41, cost: 321\nBreakfast: Saffron Mantra, White Plains, cost: 43, cuisines: \u201cBakery, BBQ, Cafe, Mediterranean, Seafood\u201d\nAttraction: Neuberger Museum of Art, White Plains; Battle of White Plains Park, White Plains\nLunch: El Cazador, White Plains, cost: 90, cuisines: \u201cMexican, Pizza, BBQ\u201d\nDinner: -, \nAccommodation: -,\n\nNumber of people = 2\nTotal cost = (321 x 2) + (43 x 2) + (90 x 2) = 908\n\nTotal cost across all days = 1736 + 682 + 908 = 3326\n\nNote: The total cost exceeds the specified budget of $2,600. To adjust the plan within the budget, we can consider changing the flight to a cheaper option or selecting more budget-friendly meal options. However, as the provided data does not include cheaper alternatives that fit the constraints, this is the best possible plan with the given information.\n\nCuisines: The plan includes Mexican, Chinese, Mediterranean, and American cuisines as requested.\nAccommodations: The plan includes accommodations that are not shared rooms, as requested.\nTransportation: The plan does not include self-driving and relies on public transportation (flights), as requested.", "gpt-4-1106-preview_direct_sole-planning_parsed_results": [{"day": 1, "current_city": "from West Palm Beach to White Plains", "transportation": "Flight Number: F3756085, from West Palm Beach to White Plains, Departure Time: 05:58, Arrival Time: 08:48", "breakfast": "-", "attraction": "-", "lunch": "El Kiosco Mexican Restaurant, White Plains", "dinner": "Six Pack Kitchen, White Plains", "accommodation": "Large Opulent Studio Apartment Near Prospect Park, White Plains"}, {"day": 2, "current_city": "White Plains", "transportation": "-", "breakfast": "Costa Coffee, White Plains", "attraction": "LEGOLAND Discovery Center Westchester, White Plains;Kensico Dam Plaza, White Plains", "lunch": "Aravalli Owls, White Plains", "dinner": "Happy Hakka, White Plains", "accommodation": "Large Opulent Studio Apartment Near Prospect Park, White Plains"}, {"day": 3, "current_city": "from White Plains to West Palm Beach", "transportation": "Flight Number: F3759006, from White Plains to West Palm Beach, Departure Time: 15:51, Arrival Time: 18:41", "breakfast": "Saffron Mantra, White Plains", "attraction": "Neuberger Museum of Art, White Plains;Battle of White Plains Park, White Plains", "lunch": "El Cazador, White Plains", "dinner": "-", "accommodation": "-"}]}]