[{"gpt-4-1106-preview_direct_sole-planning_results": "Travel Plan:\n\nDays: 1\nCurrent City: from Baton Rouge to Abilene\nTransportation: Self-driving, from Baton Rouge to Abilene, duration: 8 hours 50 mins, distance: 976 km, cost: 48\nBreakfast: -, \nAttraction: -,\nLunch: -, \nDinner: Thai Garden, Abilene, cost: 26, cuisines: \u201cCafe, American, Desserts\u201d\nAccommodation: Apartment minutes from manhattan, Abilene, cost: 295, room type: Entire home/apt, house rules: No pets & No visitors, minimum nights: 2, maximum occupancy: 2\n\nNumber of people = 2\nTotal cost = 48 x 2 + 26 x 2 + 295 x 2 = 738\nAccommodation minimum nights:  1/2\n\nDays: 2\nCurrent City: Abilene\nTransportation: -, \nBreakfast: Crispy Crust, Abilene, cost: 54, cuisines: \u201cDesserts, Bakery, Cafe, American, Seafood\u201d\nAttraction: The Grace Museum, Abilene; Frontier Texas!, Abilene\nLunch: Finger Licious, Abilene, cost: 35, cuisines: \u201cFast Food, Cafe, BBQ, Seafood\u201d\nDinner: Mx Corn, Abilene, cost: 62, cuisines: \u201cTea, Cafe, Italian\u201d\nAccommodation: Apartment minutes from manhattan, Abilene, cost: 295, room type: Entire home/apt, house rules: No pets & No visitors, minimum nights: 2, maximum occupancy: 2\n\nNumber of people = 2\nTotal cost = 54 x 2 + 35 x 2 + 62 x 2 + 295 x 2 = 892\nAccommodation minimum nights:  2/2\n\nDays: 3\nCurrent City: from Abilene to Amarillo\nTransportation: Self-driving, from Abilene to Amarillo, duration: 4 hours 10 mins, distance: 446 km, cost: 22\nBreakfast: LPK Waterfront, Abilene, cost: 61, cuisines: \u201cPizza, Italian, BBQ, Fast Food, Seafood\u201d\nAttraction: -, \nLunch: -, \nDinner: The Cinnamon Kitchen, Amarillo, cost: 69, cuisines: \u201cDesserts, Tea, Pizza, Chinese, Seafood\u201d\nAccommodation: Harlem Humble Abode - 1 bedroom - Cute and Quaint, Amarillo, cost: 409, room type: Entire home/apt, house rules: No pets, minimum nights: 5, maximum occupancy: 3\n\nNumber of people = 2\nTotal cost = 22 x 2 + 61 x 2 + 69 x 2 + 409 x 2 = 1122\nAccommodation minimum nights:  1/5\n\nDays: 4\nCurrent City: Amarillo\nTransportation: -, \nBreakfast: Komachi, Amarillo, cost: 71, cuisines: \u201cDesserts, Tea, Fast Food, Chinese, Mediterranean\u201d\nAttraction: Cadillac Ranch, Amarillo; Amarillo Botanical Gardens, Amarillo\nLunch: Sigree Global Grill, Amarillo, cost: 35, cuisines: \u201cChinese, BBQ, Cafe, Desserts\u201d\nDinner: Anand Restaurant, Amarillo, cost: 53, cuisines: \u201cFast Food, Seafood, Desserts, Italian\u201d\nAccommodation: Harlem Humble Abode - 1 bedroom - Cute and Quaint, Amarillo, cost: 409, room type: Entire home/apt, house rules: No pets, minimum nights: 5, maximum occupancy: 3\n\nNumber of people = 2\nTotal cost = 71 x 2 + 35 x 2 + 53 x 2 + 409 x 2 = 1138\nAccommodation minimum nights:  2/5\n\nDays: 5\nCurrent City: from Amarillo to Baton Rouge\nTransportation: Self-driving, from Amarillo to Baton Rouge, duration: 11 hours 42 mins, distance: 1,270 km, cost: 63\nBreakfast: Wood Box Cafe, Amarillo, cost: 11, cuisines: \u201cDesserts, French, Fast Food, Cafe, American\u201d\nAttraction: -, \nLunch: -, \nDinner: -, \nAccommodation: -,\n\nNumber of people = 2\nTotal cost = 63 x 2 + 11 x 2 = 148\n\nTotal cost across all days = 738 + 892 + 1122 + 1138 + 148 = 4038\n\nUnfortunately, the total cost of $4038 exceeds the budget of $2900. To adjust the plan within the budget, we can consider the following changes:\n\n- Opt for more affordable accommodations.\n- Reduce meal costs by choosing less expensive restaurants.\n- Limit the number of paid attractions visited.\n\nPlease note that the provided accommodation options do not meet the pet-friendly requirement. Adjustments to the plan will be necessary to find pet-friendly accommodations, which may affect the overall cost.", "gpt-4-1106-preview_direct_sole-planning_parsed_results": [{"day": 1, "current_city": "from Baton Rouge to Abilene", "transportation": "Self-driving, from Baton Rouge to Abilene, duration: 8 hours 50 mins, distance: 976 km", "breakfast": "-", "attraction": "-", "lunch": "-", "dinner": "Thai Garden, Abilene", "accommodation": "Apartment minutes from manhattan, Abilene"}, {"day": 2, "current_city": "Abilene", "transportation": "-", "breakfast": "Crispy Crust, Abilene", "attraction": "The Grace Museum, Abilene;Frontier Texas!, Abilene;", "lunch": "Finger Licious, Abilene", "dinner": "Mx Corn, Abilene", "accommodation": "Apartment minutes from manhattan, Abilene"}, {"day": 3, "current_city": "from Abilene to Amarillo", "transportation": "Self-driving, from Abilene to Amarillo, duration: 4 hours 10 mins, distance: 446 km", "breakfast": "LPK Waterfront, Abilene", "attraction": "-", "lunch": "-", "dinner": "The Cinnamon Kitchen, Amarillo", "accommodation": "Harlem Humble Abode - 1 bedroom - Cute and Quaint, Amarillo"}, {"day": 4, "current_city": "Amarillo", "transportation": "-", "breakfast": "Komachi, Amarillo", "attraction": "Cadillac Ranch, Amarillo;Amarillo Botanical Gardens, Amarillo;", "lunch": "Sigree Global Grill, Amarillo", "dinner": "Anand Restaurant, Amarillo", "accommodation": "Harlem Humble Abode - 1 bedroom - Cute and Quaint, Amarillo"}, {"day": 5, "current_city": "from Amarillo to Baton Rouge", "transportation": "Self-driving, from Amarillo to Baton Rouge, duration: 11 hours 42 mins, distance: 1,270 km", "breakfast": "Wood Box Cafe, Amarillo", "attraction": "-", "lunch": "-", "dinner": "-", "accommodation": "-"}]}]