[{"gpt-4-1106-preview_direct_sole-planning_results": "Travel Plan:\n\nDays: 1\nCurrent City: from Minneapolis to Abilene\nTransportation: Self-driving, from Minneapolis to Abilene, duration: 15 hours 28 mins, distance: 1,732 km, cost: $86 x 2 = $172\nBreakfast: -, \nAttraction: -,\nLunch: -, \nDinner: Thai Garden, Abilene, cost: $13 x 2 = $26, cuisines: Cafe, American, Desserts\nAccommodation: Joyce and Donovan's, Room for One, Abilene, price: $83, room type: Private room, house rules: No parties, minimum nights: 25, maximum occupancy: 2, review rate number: 2\n\nNumber of people = 2\nTotal cost = $172 + $26 + $83 = $281\nAccommodation minimum nights: 1/25\n\nDays: 2\nCurrent City: Abilene\nTransportation: -, \nBreakfast: Crispy Crust, Abilene, cost: $54 x 2 = $108, cuisines: Desserts, Bakery, Cafe, American, Seafood\nAttraction: The Grace Museum, Abilene; Frontier Texas!, Abilene\nLunch: Finger Licious, Abilene, cost: $35 x 2 = $70, cuisines: Fast Food, Cafe, BBQ, Seafood\nDinner: LPK Waterfront, Abilene, cost: $61 x 2 = $122, cuisines: Pizza, Italian, BBQ, Fast Food, Seafood\nAccommodation: Joyce and Donovan's, Room for One, Abilene, price: $83, room type: Private room, house rules: No parties, minimum nights: 25, maximum occupancy: 2, review rate number: 2\n\nNumber of people = 2\nTotal cost = $108 + $70 + $122 + $83 = $383\nAccommodation minimum nights: 2/25\n\nDays: 3\nCurrent City: from Abilene to Amarillo\nTransportation: Self-driving, from Abilene to Amarillo, duration: 4 hours 10 mins, distance: 446 km, cost: $22 x 2 = $44\nBreakfast: Biryani Express, Abilene, cost: $11 x 2 = $22, cuisines: Tea, Pizza, French, Bakery, Fast Food\nAttraction: -, \nLunch: -, \nDinner: The Cinnamon Kitchen, Amarillo, cost: $69 x 2 = $138, cuisines: Desserts, Tea, Pizza, Chinese, Seafood\nAccommodation: Harlem Humble Abode - 1 bedroom - Cute and Quaint, Amarillo, price: $409, room type: Entire home/apt, house rules: No pets, minimum nights: 5, maximum occupancy: 3, review rate number: 5\n\nNumber of people = 2\nTotal cost = $44 + $22 + $138 + $409 = $613\nAccommodation minimum nights: 1/5\n\nDays: 4\nCurrent City: Amarillo\nTransportation: -, \nBreakfast: Wood Box Cafe, Amarillo, cost: $11 x 2 = $22, cuisines: Desserts, French, Fast Food, Cafe, American\nAttraction: Cadillac Ranch, Amarillo; Amarillo Botanical Gardens, Amarillo\nLunch: Sigree Global Grill, Amarillo, cost: $35 x 2 = $70, cuisines: Chinese, BBQ, Cafe, Desserts\nDinner: Anand Restaurant, Amarillo, cost: $53 x 2 = $106, cuisines: Fast Food, Seafood, Desserts, Italian\nAccommodation: Harlem Humble Abode - 1 bedroom - Cute and Quaint, Amarillo, price: $409, room type: Entire home/apt, house rules: No pets, minimum nights: 5, maximum occupancy: 3, review rate number: 5\n\nNumber of people = 2\nTotal cost = $22 + $70 + $106 + $409 = $607\nAccommodation minimum nights: 2/5\n\nDays: 5\nCurrent City: from Amarillo to Lubbock\nTransportation: Self-driving, from Amarillo to Lubbock, duration: 1 hour 47 mins, distance: 197 km, cost: $9 x 2 = $18\nBreakfast: Kanha North & South Indian Veg., Amarillo, cost: $34 x 2 = $68, cuisines: Tea, Cafe, BBQ, Fast Food\nAttraction: -, \nLunch: -, \nDinner: Paris 6 Classique, Lubbock, cost: $91 x 2 = $182, cuisines: Desserts, Cafe, Pizza, Mexican, BBQ, Chinese\nAccommodation: Private bedroom in UWS Apartment, Lubbock, price: $709, room type: Private room, house rules: No visitors & No pets, minimum nights: 2, maximum occupancy: 2, review rate number: 5\n\nNumber of people = 2\nTotal cost = $18 + $68 + $182 + $709 = $977\nAccommodation minimum nights: 1/2\n\nDays: 6\nCurrent City: Lubbock\nTransportation: -, \nBreakfast: 3 Squares Diner, Lubbock, cost: $73 x 2 = $146, cuisines: Pizza, Indian, Fast Food\nAttraction: Buddy Holly Center, Lubbock; National Ranching Heritage Center, Lubbock\nLunch: Grand Barbeque Buffet Restaurant, Lubbock, cost: $20 x 2 = $40, cuisines: Tea, French, Fast Food, Cafe, Seafood\nDinner: Mosaic - Country Inn & Suites By Carlson, Lubbock, cost: $29 x 2 = $58, cuisines: Chinese, Indian, Desserts, Seafood\nAccommodation: Private bedroom in UWS Apartment, Lubbock, price: $709, room type: Private room, house rules: No visitors & No pets, minimum nights: 2, maximum occupancy: 2, review rate number: 5\n\nNumber of people = 2\nTotal cost = $146 + $40 + $58 + $709 = $953\nAccommodation minimum nights: 2/2\n\nDays: 7\nCurrent City: from Lubbock to Minneapolis\nTransportation: Self-driving, from Lubbock to Minneapolis, duration: 16 hours 17 mins, distance: 1,818 km, cost: $90 x 2 = $180\nBreakfast: Sultanat, Lubbock, cost: $72 x 2 = $144, cuisines: Chinese, Bakery, BBQ, Cafe\nAttraction: -, \nLunch: -, \nDinner: -, \nAccommodation: -,\n\nNumber of people = 2\nTotal cost = $180 + $144 = $324\n\nTotal cost across all days = $281 + $383 + $613 + $607 + $977 + $953 + $324 = $4138\n\nCuisines: The prompt specifies accommodations suitable for children under 10, all accommodations chosen are entire home/apt or private room with no parties and no pets, which are generally suitable for children.\n\nRemaining Budget: $11,900 - $4138 = $7762\n\nNote: The travel plan includes self-driving as the mode of transportation between cities, as there are no available flights on the specified dates. Accommodations have been chosen based on the requirement of being suitable for children under 10 years old. Attractions and restaurants have been selected based on their presence in the destination cities. The total cost is within the specified budget, and the plan covers the required number of days and cities.", "gpt-4-1106-preview_direct_sole-planning_parsed_results": [{"day": 1, "current_city": "from Minneapolis to Abilene", "transportation": "Self-driving, from Minneapolis to Abilene, duration: 15 hours 28 mins, distance: 1,732 km", "breakfast": "-", "attraction": "-", "lunch": "-", "dinner": "Thai Garden, Abilene", "accommodation": "Joyce and Donovan's, Room for One, Abilene"}, {"day": 2, "current_city": "Abilene", "transportation": "-", "breakfast": "Crispy Crust, Abilene", "attraction": "The Grace Museum, Abilene; Frontier Texas!, Abilene", "lunch": "Finger Licious, Abilene", "dinner": "LPK Waterfront, Abilene", "accommodation": "Joyce and Donovan's, Room for One, Abilene"}, {"day": 3, "current_city": "from Abilene to Amarillo", "transportation": "Self-driving, from Abilene to Amarillo, duration: 4 hours 10 mins, distance: 446 km", "breakfast": "Biryani Express, Abilene", "attraction": "-", "lunch": "-", "dinner": "The Cinnamon Kitchen, Amarillo", "accommodation": "Harlem Humble Abode - 1 bedroom - Cute and Quaint, Amarillo"}, {"day": 4, "current_city": "Amarillo", "transportation": "-", "breakfast": "Wood Box Cafe, Amarillo", "attraction": "Cadillac Ranch, Amarillo; Amarillo Botanical Gardens, Amarillo", "lunch": "Sigree Global Grill, Amarillo", "dinner": "Anand Restaurant, Amarillo", "accommodation": "Harlem Humble Abode - 1 bedroom - Cute and Quaint, Amarillo"}, {"day": 5, "current_city": "from Amarillo to Lubbock", "transportation": "Self-driving, from Amarillo to Lubbock, duration: 1 hour 47 mins, distance: 197 km", "breakfast": "Kanha North & South Indian Veg., Amarillo", "attraction": "-", "lunch": "-", "dinner": "Paris 6 Classique, Lubbock", "accommodation": "Private bedroom in UWS Apartment, Lubbock"}, {"day": 6, "current_city": "Lubbock", "transportation": "-", "breakfast": "3 Squares Diner, Lubbock", "attraction": "Buddy Holly Center, Lubbock; National Ranching Heritage Center, Lubbock", "lunch": "Grand Barbeque Buffet Restaurant, Lubbock", "dinner": "Mosaic - Country Inn & Suites By Carlson, Lubbock", "accommodation": "Private bedroom in UWS Apartment, Lubbock"}, {"day": 7, "current_city": "from Lubbock to Minneapolis", "transportation": "Self-driving, from Lubbock to Minneapolis, duration: 16 hours 17 mins, distance: 1,818 km", "breakfast": "Sultanat, Lubbock", "attraction": "-", "lunch": "-", "dinner": "-", "accommodation": "-"}]}]