[{"gpt-4-1106-preview_direct_sole-planning_results": "Travel Plan:\n\nDays: 1\nCurrent City: from Fort Lauderdale to Atlanta\nTransportation: Flight Number: F3490987, from Fort Lauderdale to Atlanta, Departure Time: 14:31, Arrival Time: 16:17, cost: 278\nBreakfast: -, \nAttraction: -,\nLunch: -, \nDinner: Asian Bistro, Atlanta, cost: 27, cuisines: \u201cTea, Bakery, Seafood\u201d\nAccommodation: Bright, Modern, Clean, Spacious, Brooklyn Home, Atlanta, cost: 1034, maximum occupancy: 4, house rules: No children under 10, minimum nights: 3\n\nNumber of people = 2\nTotal cost = 278 x 2 + 27 x 2 + 1034 x 2 = 2678\nAccommodation minimum nights:  1/3\n\nDays: 2\nCurrent City: Atlanta\nTransportation: -, \nBreakfast: Saffron, Atlanta, cost: 39, cuisines: Tea, Cafe, Fast Food, Seafood\nAttraction: Georgia Aquarium, Atlanta; Atlanta Botanical Garden, Atlanta\nLunch: Chef Style, Atlanta, cost: 59, cuisines: \u201cPizza, American, Desserts, Seafood\u201d\nDinner: Pizza Central, Atlanta, cost: 75, cuisines: \u201cCafe, Bakery, BBQ, Fast Food, Chinese, Indian\u201d\nAccommodation: Bright, Modern, Clean, Spacious, Brooklyn Home, Atlanta, cost: 1034, maximum occupancy: 4, house rules: No children under 10, minimum nights: 3\n\nNumber of people = 2\nTotal cost = 39 x 2 + 59 x 2 + 75 x 2 + 1034 x 2 = 2498\nAccommodation minimum nights:  2/3\n\nDays: 3\nCurrent City: from Atlanta to Decatur\nTransportation: Taxi, from Atlanta to Decatur, duration: 18 mins, distance: 10.0 km, cost: 10\nBreakfast: Sizzler's Ranch, Atlanta, cost: 36, cuisines: \u201cTea, Cafe, Indian, Italian\u201d\nAttraction: DeKalb History Center Museum, Decatur; Glenlake Park, Decatur\nLunch: Madhuban Restaurant - Welcome Hotel Rama International, Decatur, cost: 47, cuisines: \u201cPizza, Bakery, Seafood\u201d\nDinner: Joey's Pizza, Decatur, cost: 69, cuisines: \u201cTea, Pizza, Bakery, Chinese, Seafood\u201d\nAccommodation: Cozy Private Room, Decatur, cost: 69, maximum occupancy: 2, house rules: No children under 10 & No parties & No visitors, minimum nights: 2\n\nNumber of people = 2\nTotal cost = 10 x 2 + 36 x 2 + 47 x 2 + 69 x 2 + 69 x 2 = 462\nAccommodation minimum nights:  1/2\n\nDays: 4\nCurrent City: Decatur\nTransportation: -, \nBreakfast: Cafe Coffee Day, Decatur, cost: 46, cuisines: \u201cTea, Cafe, BBQ, Mediterranean\u201d\nAttraction: Clyde Shepherd Nature Preserve, Decatur; Waffle House Museum, Decatur\nLunch: Carnatic Cafe, Decatur, cost: 66, cuisines: \u201cCafe, Indian, Desserts\u201d\nDinner: Shake Eat Up, Decatur, cost: 22, cuisines: \u201cPizza, Mexican, BBQ, Fast Food, Chinese, Seafood\u201d\nAccommodation: Cozy Private Room, Decatur, cost: 69, maximum occupancy: 2, house rules: No children under 10 & No parties & No visitors, minimum nights: 2\n\nNumber of people = 2\nTotal cost = 46 x 2 + 66 x 2 + 22 x 2 + 69 x 2 = 406\nAccommodation minimum nights:  2/2\n\nDays: 5\nCurrent City: from Decatur to Augusta\nTransportation: Self-driving, from Decatur to Augusta, duration: 2 hours 17 mins, distance: 228 km, cost: 11\nBreakfast: Subway, Decatur, cost: 40, cuisines: \u201cDesserts, BBQ, Bakery, Fast Food, American\u201d\nAttraction: Augusta Riverwalk, Augusta; Morris Museum of Art, Augusta\nLunch: B Merrell's, Augusta, cost: 74, cuisines: \u201cTea, Pizza, Desserts, Fast Food\u201d\nDinner: Vinny Vanucchi's, Augusta, cost: 45, cuisines: \u201cDesserts, Fast Food, Chinese, Indian, Seafood\u201d\nAccommodation: Planta Baja Studio, Augusta, cost: 637, maximum occupancy: 4, house rules: No smoking, minimum nights: 1\n\nNumber of people = 2\nTotal cost = 11 x 2 + 40 x 2 + 74 x 2 + 45 x 2 + 637 x 2 = 1804\nAccommodation minimum nights:  1/1\n\nDays: 6\nCurrent City: Augusta\nTransportation: -, \nBreakfast: Fish Tales Lakeside Grille, Augusta, cost: 37, cuisines: \u201cTea, Cafe, Bakery, Desserts\u201d\nAttraction: Phinizy Swamp Nature Park, Augusta; Augusta Canal National Heritage Area, Augusta\nLunch: The Charcoal Chimney, Augusta, cost: 86, cuisines: \u201cTea, Fast Food, BBQ, Italian\u201d\nDinner: Nikhil Food Point, Augusta, cost: 87, cuisines: \u201cTea, Mexican, Fast Food, American, Seafood\u201d\nAccommodation: Planta Baja Studio, Augusta, cost: 637, maximum occupancy: 4, house rules: No smoking, minimum nights: 1\n\nNumber of people = 2\nTotal cost = 37 x 2 + 86 x 2 + 87 x 2 + 637 x 2 = 1694\nAccommodation minimum nights:  1/1\n\nDays: 7\nCurrent City: from Augusta to Fort Lauderdale\nTransportation: Self-driving, from Augusta to Fort Lauderdale, duration: 8 hours 41 mins, distance: 938 km, cost: 46\nBreakfast: The Flying Saucer Cafe, Augusta, cost: 19, cuisines: \u201cDesserts, Pizza, BBQ, Cafe, Indian\u201d\nAttraction: -,\nLunch: -, \nDinner: -, \nAccommodation: -,\n\nNumber of people = 2\nTotal cost = 46 x 2 + 19 x 2 = 130\n\nTotal cost across all days = 2678 + 2498 + 462 + 406 + 1804 + 1694 + 130 = 9672\n\nUnfortunately, the total cost exceeds the specified budget of $8,000. To adjust the plan within the budget, we can consider changing the flight to a cheaper option, selecting more budget-friendly restaurants, or choosing accommodations with a lower cost per night. Please let me know how you would like to proceed, or if there are specific areas you would prefer to adjust to stay within budget.", "gpt-4-1106-preview_direct_sole-planning_parsed_results": [{"day": 1, "current_city": "from Fort Lauderdale to Atlanta", "transportation": "Flight Number: F3490987, from Fort Lauderdale to Atlanta, Departure Time: 14:31, Arrival Time: 16:17", "breakfast": "-", "attraction": "-", "lunch": "-", "dinner": "Asian Bistro, Atlanta", "accommodation": "Bright, Modern, Clean, Spacious, Brooklyn Home, Atlanta"}, {"day": 2, "current_city": "Atlanta", "transportation": "-", "breakfast": "Saffron, Atlanta", "attraction": "Georgia Aquarium, Atlanta;Atlanta Botanical Garden, Atlanta;", "lunch": "Chef Style, Atlanta", "dinner": "Pizza Central, Atlanta", "accommodation": "Bright, Modern, Clean, Spacious, Brooklyn Home, Atlanta"}, {"day": 3, "current_city": "from Atlanta to Decatur", "transportation": "Taxi, from Atlanta to Decatur, duration: 18 mins, distance: 10.0 km", "breakfast": "Sizzler's Ranch, Atlanta", "attraction": "DeKalb History Center Museum, Decatur;Glenlake Park, Decatur;", "lunch": "Madhuban Restaurant - Welcome Hotel Rama International, Decatur", "dinner": "Joey's Pizza, Decatur", "accommodation": "Cozy Private Room, Decatur"}, {"day": 4, "current_city": "Decatur", "transportation": "-", "breakfast": "Cafe Coffee Day, Decatur", "attraction": "Clyde Shepherd Nature Preserve, Decatur;Waffle House Museum, Decatur;", "lunch": "Carnatic Cafe, Decatur", "dinner": "Shake Eat Up, Decatur", "accommodation": "Cozy Private Room, Decatur"}, {"day": 5, "current_city": "from Decatur to Augusta", "transportation": "Self-driving, from Decatur to Augusta, duration: 2 hours 17 mins, distance: 228 km", "breakfast": "Subway, Decatur", "attraction": "Augusta Riverwalk, Augusta;Morris Museum of Art, Augusta;", "lunch": "B Merrell's, Augusta", "dinner": "Vinny Vanucchi's, Augusta", "accommodation": "Planta Baja Studio, Augusta"}, {"day": 6, "current_city": "Augusta", "transportation": "-", "breakfast": "Fish Tales Lakeside Grille, Augusta", "attraction": "Phinizy Swamp Nature Park, Augusta;Augusta Canal National Heritage Area, Augusta;", "lunch": "The Charcoal Chimney, Augusta", "dinner": "Nikhil Food Point, Augusta", "accommodation": "Planta Baja Studio, Augusta"}, {"day": 7, "current_city": "from Augusta to Fort Lauderdale", "transportation": "Self-driving, from Augusta to Fort Lauderdale, duration: 8 hours 41 mins, distance: 938 km", "breakfast": "The Flying Saucer Cafe, Augusta", "attraction": "-", "lunch": "-", "dinner": "-", "accommodation": "-"}]}]