[{"gpt-4-1106-preview_direct_sole-planning_results": "Travel Plan:\n\nDays: 1\nCurrent City: from Jacksonville to Washington,\nTransportation: Flight Number: F3635008, from Jacksonville to Washington, Departure Time: 16:58, Arrival Time: 18:44, cost: 133\nBreakfast: -, \nAttraction: -,\nLunch: -, \nDinner: Los Aztecas, Washington, cost: 46, cuisines: \u201cCafe, Bakery, BBQ, Fast Food\u201d\nAccommodation: Comfortable & Cozy Times Square Apt, Washington, cost: 499, maximum occupancy: 3, house rules: No parties & No children under 10, minimum nights: 2\n\nNumber of people = 2\nTotal cost = (133 x 2) + (46 x 2) + 499 = 857 \nAccommodation minimum nights:  1/2\n\nDays: 2,\nCurrent City: Washington, \nTransportation: -, \nBreakfast: Manna Java World Cafe, Washington, cost: 59, cuisines: Cafe, Seafood\nAttraction: Space Needle, Washington; The Seattle Great Wheel, Washington\nLunch: Hemingway's Island Grill, Washington, cost: 57, cuisines: \u201cMexican, BBQ, Fast Food, Cafe, Seafood\u201d\nDinner: Thaaliwala, Washington, cost: 88, cuisines: \u201cTea, Pizza, Italian, BBQ, Cafe\u201d\nAccommodation: Comfortable & Cozy Times Square Apt, Washington, cost: 499, maximum occupancy: 3, house rules: No parties & No children under 10, minimum nights: 2\n\nNumber of people = 2\nTotal cost = (59 x 2) + (57 x 2) + (88 x 2) + 499 = 907\nAccommodation minimum nights:  2/2\n\nDays: 3, \nCurrent City: from Washington to Jacksonville, \nTransportation: Flight Number: F3786730, from Washington to Jacksonville, Departure Time: 08:48, Arrival Time: 10:58, cost: 196\nBreakfast: Cafe Coffee Day, Washington, cost: 53, cuisines: \u201cTea, Mexican, Fast Food, Cafe, American, Seafood\u201d\nAttraction: Olympic Sculpture Park, Washington; Discovery Park, Washington\nLunch: Good Foods, Washington, cost: 65, cuisines: \u201cBBQ, Desserts, Seafood\u201d\nDinner: -, \nAccommodation: -,\n\nNumber of people = 2\nTotal cost = (196 x 2) + (53 x 2) + (65 x 2) = 628\n\nTotal cost across all days = 857 + 907 + 628 = 2392 \nCuisines: The prompt specifies no cuisines, so all cuisines constraints are satisfied\n\nNote: The provided budget of $1,000 is not sufficient to cover the costs of the travel plan as outlined above. The total cost exceeds the budget by $1,392. To stay within budget, adjustments would need to be made, such as choosing more affordable transportation options or accommodations. However, the query also specifies accommodations where parties are allowed, which conflicts with the house rules of the chosen accommodation. Therefore, the travel plan does not meet all the constraints and requires further revision to align with the budget and accommodation requirements.", "gpt-4-1106-preview_direct_sole-planning_parsed_results": [{"day": 1, "current_city": "from Jacksonville to Washington", "transportation": "Flight Number: F3635008, from Jacksonville to Washington, Departure Time: 16:58, Arrival Time: 18:44", "breakfast": "-", "attraction": "-", "lunch": "-", "dinner": "Los Aztecas, Washington", "accommodation": "Comfortable & Cozy Times Square Apt, Washington"}, {"day": 2, "current_city": "Washington", "transportation": "-", "breakfast": "Manna Java World Cafe, Washington", "attraction": "Space Needle, Washington;The Seattle Great Wheel, Washington;", "lunch": "Hemingway's Island Grill, Washington", "dinner": "Thaaliwala, Washington", "accommodation": "Comfortable & Cozy Times Square Apt, Washington"}, {"day": 3, "current_city": "from Washington to Jacksonville", "transportation": "Flight Number: F3786730, from Washington to Jacksonville, Departure Time: 08:48, Arrival Time: 10:58", "breakfast": "Cafe Coffee Day, Washington", "attraction": "Olympic Sculpture Park, Washington;Discovery Park, Washington;", "lunch": "Good Foods, Washington", "dinner": "-", "accommodation": "-"}]}]