[{"gpt-4-1106-preview_direct_sole-planning_results": "Travel Plan:\n\nDays: 1\nCurrent City: from Peoria to Moline\nTransportation: Self-driving, from Peoria to Moline, duration: 1 hour 27 mins, distance: 151 km, cost: 7 x 3 = 21\nBreakfast: -, \nAttraction: -,\nLunch: -, \nDinner: Royal Hotel, Moline, cost: 74 x 3 = 222, cuisines: \u201cTea, Pizza, Mexican, Chinese, Seafood\u201d\nAccommodation: Sunny duplex near Central Park, Moline, cost: 541, room type: Entire home/apt, house rules: No pets, minimum nights: 1, maximum occupancy: 5\n\nNumber of people = 3\nTotal cost = 21 + 222 + 541 = 784\nAccommodation minimum nights: 1/1\n\nDays: 2\nCurrent City: Moline\nTransportation: -, \nBreakfast: Lovecrumbs Bakery, Moline, cost: 24 x 3 = 72, cuisines: Tea, Pizza, American, Desserts\nAttraction: John Deere Pavilion, Moline; Celebration River Cruises, Moline\nLunch: ZASTY, Moline, cost: 82 x 3 = 246, cuisines: \u201cPizza, Indian, BBQ, Cafe, American, Seafood\u201d\nDinner: Cafe Coffee Day, Moline, cost: 89 x 3 = 267, cuisines: \u201cPizza, French, Fast Food, Cafe, Indian, Seafood\u201d\nAccommodation: Sunny duplex near Central Park, Moline, cost: 541, room type: Entire home/apt, house rules: No pets, minimum nights: 1, maximum occupancy: 5\n\nNumber of people = 3\nTotal cost = 72 + 246 + 267 + 541 = 1126\nAccommodation minimum nights: 2/1\n\nDays: 3\nCurrent City: from Moline to Chicago\nTransportation: Flight Number: F3594780, from Moline to Chicago, Departure Time: 10:46, Arrival Time: 11:36, cost: 66 x 3 = 198\nBreakfast: -, \nAttraction: Navy Pier, Chicago; Millennium Park, Chicago\nLunch: Pantry d'or, Chicago, cost: 53 x 3 = 159, cuisines: \u201cTea, BBQ, Fast Food, Cafe, Indian\u201d\nDinner: Bro's Kitchenette, Chicago, cost: 38 x 3 = 114, cuisines: \u201cMexican, Desserts, Seafood\u201d\nAccommodation: Newly Renovated Greenpoint Abode, Chicago, cost: 981, room type: Entire home/apt, house rules: No parties & No children under 10 & No smoking, minimum nights: 2, maximum occupancy: 7\n\nNumber of people = 3\nTotal cost = 198 + 159 + 114 + 981 = 1452\nAccommodation minimum nights: 3/2\n\nDays: 4\nCurrent City: Chicago\nTransportation: -, \nBreakfast: Gyan Vaishnav, Chicago, cost: 14 x 3 = 42, cuisines: Bakery, Desserts\nAttraction: Skydeck Chicago; Shedd Aquarium, Chicago\nLunch: Mini's Royal Cafe, Chicago, cost: 72 x 3 = 216, cuisines: \u201cTea, Cafe, Bakery\u201d\nDinner: FIO Cookhouse and Bar, Chicago, cost: 31 x 3 = 93, cuisines: \u201cDesserts, Mexican, Fast Food, Cafe, Seafood\u201d\nAccommodation: Newly Renovated Greenpoint Abode, Chicago, cost: 981, room type: Entire home/apt, house rules: No parties & No children under 10 & No smoking, minimum nights: 2, maximum occupancy: 7\n\nNumber of people = 3\nTotal cost = 42 + 216 + 93 + 981 = 1332\nAccommodation minimum nights: 4/2\n\nDays: 5\nCurrent City: Chicago\nTransportation: -, \nBreakfast: Bengal Sweet Corner, Chicago, cost: 59 x 3 = 177, cuisines: Desserts, Tea, Bakery, Cafe, American\nAttraction: 360 CHICAGO; Willis Tower, Chicago\nLunch: Sethi's Kabab & Curries, Chicago, cost: 69 x 3 = 207, cuisines: \u201cBakery, BBQ, Cafe, Mediterranean, Seafood\u201d\nDinner: The Village Caf\u6106, Chicago, cost: 57 x 3 = 171, cuisines: \u201cTea, Cafe, Mediterranean, Seafood\u201d\nAccommodation: Newly Renovated Greenpoint Abode, Chicago, cost: 981, room type: Entire home/apt, house rules: No parties & No children under 10 & No smoking, minimum nights: 2, maximum occupancy: 7\n\nNumber of people = 3\nTotal cost = 177 + 207 + 171 + 981 = 1536\nAccommodation minimum nights: 5/2\n\nDays: 6\nCurrent City: from Chicago to Rockford\nTransportation: Self-driving, from Chicago to Rockford, duration: 1 hour 32 mins, distance: 143 km, cost: 7 x 3 = 21\nBreakfast: -, \nAttraction: Anderson Japanese Gardens, Rockford; Midway Village Museum, Rockford\nLunch: Flying Mango, Rockford, cost: 20 x 3 = 60, cuisines: \u201cAmerican, BBQ, Seafood\u201d\nDinner: Aroma Rest O Bar, Rockford, cost: 58 x 3 = 174, cuisines: \u201cBakery, Fast Food, Chinese, American, Seafood\u201d\nAccommodation: Private Room in a two bedroom apt., Rockford, cost: 210, room type: Private room, house rules: No visitors & No smoking, minimum nights: 1, maximum occupancy: 2\n\nNumber of people = 3\nTotal cost = 21 + 60 + 174 + 210 = 465\nAccommodation minimum nights: 6/1\n\nDays: 7\nCurrent City: from Rockford to Peoria\nTransportation: Self-driving, from Rockford to Peoria, duration: 2 hours 17 mins, distance: 219 km, cost: 10 x 3 = 30\nBreakfast: Dial A Cake, Rockford, cost: 29 x 3 = 87, cuisines: \u201cCafe, American, Mediterranean, Desserts\u201d\nAttraction: Ethnic Heritage Museum, Rockford; Blackhawk Springs Forest Preserve, Rockford\nLunch: Subway, Rockford, cost: 26 x 3 = 78, cuisines: \u201cBakery, Pizza, BBQ, Desserts\u201d\nDinner: -, \nAccommodation: -,\n\nNumber of people = 3\nTotal cost = 30 + 87 + 78 = 195\n\nTotal cost across all days = 784 + 1126 + 1452 + 1332 + 1536 + 465 + 195 = 6890\n\nCuisines: The prompt specifies no cuisines, so all cuisines constraints are satisfied\n\nRemaining budget = $8,400 - $6,890 = $1,510\n\nPlease note that the accommodation on Day 6 does not allow for all three travelers in one room due to maximum occupancy restrictions. An additional room may need to be booked, or an alternative accommodation that allows children under 10 and has a higher occupancy limit should be considered.", "gpt-4-1106-preview_direct_sole-planning_parsed_results": [{"day": 1, "current_city": "from Peoria to Moline", "transportation": "Self-driving, from Peoria to Moline, duration: 1 hour 27 mins, distance: 151 km", "breakfast": "-", "attraction": "-", "lunch": "-", "dinner": "Royal Hotel, Moline", "accommodation": "Sunny duplex near Central Park, Moline"}, {"day": 2, "current_city": "Moline", "transportation": "-", "breakfast": "Lovecrumbs Bakery, Moline", "attraction": "John Deere Pavilion, Moline;Celebration River Cruises, Moline;", "lunch": "ZASTY, Moline", "dinner": "Cafe Coffee Day, Moline", "accommodation": "Sunny duplex near Central Park, Moline"}, {"day": 3, "current_city": "from Moline to Chicago", "transportation": "Flight Number: F3594780, from Moline to Chicago, Departure Time: 10:46, Arrival Time: 11:36", "breakfast": "-", "attraction": "Navy Pier, Chicago;Millennium Park, Chicago;", "lunch": "Pantry d'or, Chicago", "dinner": "Bro's Kitchenette, Chicago", "accommodation": "Newly Renovated Greenpoint Abode, Chicago"}, {"day": 4, "current_city": "Chicago", "transportation": "-", "breakfast": "Gyan Vaishnav, Chicago", "attraction": "Skydeck Chicago;Shedd Aquarium, Chicago;", "lunch": "Mini's Royal Cafe, Chicago", "dinner": "FIO Cookhouse and Bar, Chicago", "accommodation": "Newly Renovated Greenpoint Abode, Chicago"}, {"day": 5, "current_city": "Chicago", "transportation": "-", "breakfast": "Bengal Sweet Corner, Chicago", "attraction": "360 CHICAGO;Willis Tower, Chicago;", "lunch": "Sethi's Kabab & Curries, Chicago", "dinner": "The Village Caf\u00e9, Chicago", "accommodation": "Newly Renovated Greenpoint Abode, Chicago"}, {"day": 6, "current_city": "from Chicago to Rockford", "transportation": "Self-driving, from Chicago to Rockford, duration: 1 hour 32 mins, distance: 143 km", "breakfast": "-", "attraction": "Anderson Japanese Gardens, Rockford;Midway Village Museum, Rockford;", "lunch": "Flying Mango, Rockford", "dinner": "Aroma Rest O Bar, Rockford", "accommodation": "Private Room in a two bedroom apt., Rockford"}, {"day": 7, "current_city": "from Rockford to Peoria", "transportation": "Self-driving, from Rockford to Peoria, duration: 2 hours 17 mins, distance: 219 km", "breakfast": "Dial A Cake, Rockford", "attraction": "Ethnic Heritage Museum, Rockford;Blackhawk Springs Forest Preserve, Rockford;", "lunch": "Subway, Rockford", "dinner": "-", "accommodation": "-"}]}]