[{"gpt-4-1106-preview_direct_sole-planning_results": "Travel Plan:\n\nDays: 1\nCurrent City: from Houston to Pensacola\nTransportation: Self-driving, from Houston to Pensacola, duration: 7 hours 38 mins, distance: 845 km, cost: 42\nBreakfast: -, \nAttraction: -,\nLunch: -, \nDinner: Frog Hollow Tavern, Pensacola, cost: 20, cuisines: \u201cAmerican, BBQ, Fast Food, Cafe, Indian\u201d\nAccommodation: Chic Historic Harlem Brownstone, Pensacola, cost: 526, maximum occupancy: 2, house rules: No smoking, minimum nights: 3\n\nNumber of people = 2\nTotal cost = 42 x 2 + 20 x 2 + 526 x 1 = 650\nAccommodation minimum nights:  1/3\n\nDays: 2\nCurrent City: Pensacola\nTransportation: -, \nBreakfast: Berry Patch Restaurant, Pensacola, cost: 13, cuisines: Bakery, BBQ, Desserts, Seafood\nAttraction: Historic Pensacola Village, Pensacola; Pensacola Museum of Art, Pensacola\nLunch: Bailey's Bar-B-Que, Pensacola, cost: 13, cuisines: \u201cTea, Bakery, Mediterranean\u201d\nDinner: Watershed Cafe, Pensacola, cost: 12, cuisines: \u201cChinese, BBQ, Desserts\u201d\nAccommodation: Chic Historic Harlem Brownstone, Pensacola, cost: 526, maximum occupancy: 2, house rules: No smoking, minimum nights: 3\n\nNumber of people = 2\nTotal cost = 13 x 2 + 13 x 2 + 12 x 2 + 526 x 1 = 600\nAccommodation minimum nights:  2/3\n\nDays: 3\nCurrent City: from Pensacola to Houston\nTransportation: Self-driving, from Pensacola to Houston, duration: 7 hours 37 mins, distance: 845 km, cost: 42\nBreakfast: Kalpana Restaurant, Pensacola, cost: 36, cuisines: \u201cTea, Cafe, Bakery, American\u201d\nAttraction: Pensacola Lighthouse & Maritime Museum, Pensacola; Fort Pickens, Pensacola\nLunch: Chicago Pizza, Pensacola, cost: 32, cuisines: \u201cPizza, Mediterranean, Fast Food\u201d\nDinner: -, \nAccommodation: -,\n\nNumber of people = 2\nTotal cost = 42 x 2 + 36 x 2 + 32 x 2 = 220\n\nTotal cost across all days = 650 + 600 + 220 = 1470\n\nCuisines: The prompt specifies no cuisines, so all cuisines constraints are satisfied\n\nNote: The total cost exceeds the specified budget of $1,100. Adjustments need to be made to the plan to reduce costs. Possible changes could include selecting a less expensive accommodation or reducing meal costs. However, given the constraints and the provided data, it is not possible to create a plan that includes all required details and stays within the budget.", "gpt-4-1106-preview_direct_sole-planning_parsed_results": [{"day": 1, "current_city": "from Houston to Pensacola", "transportation": "Self-driving, from Houston to Pensacola, duration: 7 hours 38 mins, distance: 845 km", "breakfast": "-", "attraction": "-", "lunch": "-", "dinner": "Frog Hollow Tavern, Pensacola", "accommodation": "Chic Historic Harlem Brownstone, Pensacola"}, {"day": 2, "current_city": "Pensacola", "transportation": "-", "breakfast": "Berry Patch Restaurant, Pensacola", "attraction": "Historic Pensacola Village, Pensacola;Pensacola Museum of Art, Pensacola;", "lunch": "Bailey's Bar-B-Que, Pensacola", "dinner": "Watershed Cafe, Pensacola", "accommodation": "Chic Historic Harlem Brownstone, Pensacola"}, {"day": 3, "current_city": "from Pensacola to Houston", "transportation": "Self-driving, from Pensacola to Houston, duration: 7 hours 37 mins, distance: 845 km", "breakfast": "Kalpana Restaurant, Pensacola", "attraction": "Pensacola Lighthouse & Maritime Museum, Pensacola;Fort Pickens, Pensacola;", "lunch": "Chicago Pizza, Pensacola", "dinner": "-", "accommodation": "-"}]}]