[{"gpt-4-1106-preview_direct_sole-planning_results": "Travel Plan:\n\nDays: 1\nCurrent City: from New York to Reno,\nTransportation: Flight Number: F3767722, from New York to Reno, Departure Time: 21:02, Arrival Time: 00:07, cost: 1200\nBreakfast: -, \nAttraction: -,\nLunch: -, \nDinner: Leme Light, Reno, cost: 55, cuisines: \u201cCafe, Mexican, Fast Food\u201d\nAccommodation: A bright, beautiful treehouse, Reno, cost: 361, maximum occupancy: 2, house rules: No visitors, minimum nights: 2\n\nNumber of people = 4\nTotal cost = 1200 x 4 + 55 x 4 + 361 x 2 = 4800 + 220 + 722 = 5742\nAccommodation minimum nights:  1/2\n\nDays: 2,\nCurrent City: Reno, \nTransportation: -, \nBreakfast: Kanha Sweets, Reno, cost: 28, cuisines: Italian, Bakery, Fast Food, Cafe, American\nAttraction: Nevada Museum of Art, Reno; The Discovery, Reno\nLunch: Indian Gourmet, Reno, cost: 16, cuisines: \u201cTea, Fast Food, American, Seafood\u201d\nDinner: Olive Bistro, Reno, cost: 66, cuisines: \u201cTea, Cafe, Pizza, BBQ\u201d\nAccommodation: A bright, beautiful treehouse, Reno, cost: 361, maximum occupancy: 2, house rules: No visitors, minimum nights: 2\n\nNumber of people = 4\nTotal cost = 28 x 4 + 16 x 4 + 66 x 4 + 361 x 2 = 112 + 64 + 264 + 722 = 1162\nAccommodation minimum nights:  2/2\n\nDays: 3, \nCurrent City: Reno, \nTransportation: -, \nBreakfast: Queens Cakes, Reno, cost: 58, cuisines: \u201cBakery, Desserts, Indian, BBQ\u201d\nAttraction: National Automobile Museum, Reno; Fleischmann Planetarium, Reno\nLunch: Mustake Multicuisine Restaurant, Reno, cost: 91, cuisines: \u201cTea, Bakery, Pizza, Mediterranean\u201d\nDinner: Nagpal's, Reno, cost: 79, cuisines: \u201cBakery, Mexican, Pizza, Seafood\u201d\nAccommodation: -,\n\nNumber of people = 4\nTotal cost = 58 x 4 + 91 x 4 + 79 x 4 = 232 + 364 + 316 = 912\n\nTotal cost across all days = 5742 + 1162 + 912 = 7816\nCuisines: The prompt specifies no cuisines, so all cuisines constraints are satisfied\n\nNote: The accommodation chosen, \"A bright, beautiful treehouse,\" is suitable for children under 10 and adheres to the house rules. The total cost of the travel plan is within the specified budget of $11,300. The plan includes all required details for each day, ensuring that no restaurant or attraction is repeated. The transportation method is consistent with the specified cities, and the accommodation matches the final city listed for each day. The number of visiting cities is one, as specified in the query, and the number of days in the plan matches the specified number of days.", "gpt-4-1106-preview_direct_sole-planning_parsed_results": [{"day": 1, "current_city": "from New York to Reno", "transportation": "Flight Number: F3767722, from New York to Reno, Departure Time: 21:02, Arrival Time: 00:07", "breakfast": "-", "attraction": "-", "lunch": "-", "dinner": "Leme Light, Reno", "accommodation": "A bright, beautiful treehouse, Reno"}, {"day": 2, "current_city": "Reno", "transportation": "-", "breakfast": "Kanha Sweets, Reno", "attraction": "Nevada Museum of Art, Reno;The Discovery, Reno;", "lunch": "Indian Gourmet, Reno", "dinner": "Olive Bistro, Reno", "accommodation": "A bright, beautiful treehouse, Reno"}, {"day": 3, "current_city": "Reno", "transportation": "-", "breakfast": "Queens Cakes, Reno", "attraction": "National Automobile Museum, Reno;Fleischmann Planetarium, Reno;", "lunch": "Mustake Multicuisine Restaurant, Reno", "dinner": "Nagpal's, Reno", "accommodation": "-"}]}]