[{"gpt-4-1106-preview_direct_sole-planning_results": "Travel Plan:\n\nDays: 1\nCurrent City: from Washington to Los Angeles\nTransportation: Flight Number: F3696906, from Washington to Los Angeles, Departure Time: 15:56, Arrival Time: 18:03, cost: 684\nBreakfast: -, \nAttraction: -,\nLunch: -, \nDinner: Palmshore, Los Angeles, cost: 25, cuisines: \u201cDesserts, Bakery, Fast Food, American, Seafood\u201d\nAccommodation: Sunny apartment with easy connections to anywhere., Los Angeles, cost: 968, maximum occupancy: 1, house rules: No children under 10, minimum nights: 3\n\nNumber of people = 2\nTotal cost = 684 x 2 + 25 x 2 + 968 x 2 = 3354\nAccommodation minimum nights:  1/3\n\nDays: 2\nCurrent City: Los Angeles\nTransportation: -, \nBreakfast: Heat - Edsa Shangri-La, Los Angeles, cost: 148, cuisines: Bakery, BBQ\nAttraction: Santa Monica Pier, Los Angeles; Griffith Observatory, Los Angeles\nLunch: Punjabi Zaika, Los Angeles, cost: 46, cuisines: \u201cPizza, Bakery, BBQ, Cafe, Indian\u201d\nDinner: The Hangout by 1861, Los Angeles, cost: 64, cuisines: \u201cTea, Pizza, Seafood\u201d\nAccommodation: Sunny apartment with easy connections to anywhere., Los Angeles, cost: 968, maximum occupancy: 1, house rules: No children under 10, minimum nights: 3\n\nNumber of people = 2\nTotal cost = 148 x 2 + 46 x 2 + 64 x 2 + 968 x 2 = 2456\nAccommodation minimum nights:  2/3\n\nDays: 3\nCurrent City: from Los Angeles to San Francisco\nTransportation: Flight Number: F3744801, from Los Angeles to San Francisco, Departure Time: 05:54, Arrival Time: 07:22, cost: 79\nBreakfast: -, \nAttraction: Golden Gate Bridge, San Francisco; Exploratorium, San Francisco\nLunch: Coffee & Chai Co., San Francisco, cost: 10, cuisines: \u201cTea, Mexican, BBQ, Cafe, Seafood\u201d\nDinner: Bonne Bouche, San Francisco, cost: 21, cuisines: \u201cTea, Chinese, American, Cafe\u201d\nAccommodation: Cozy, spacious Studio located on Upper East Side, San Francisco, cost: 756, maximum occupancy: 2, house rules: No visitors, minimum nights: 3\n\nNumber of people = 2\nTotal cost = 79 x 2 + 10 x 2 + 21 x 2 + 756 x 2 = 1732\nAccommodation minimum nights:  1/3\n\nDays: 4\nCurrent City: San Francisco\nTransportation: -, \nBreakfast: Tokyo Sushi, San Francisco, cost: 18, cuisines: \u201cCafe, Pizza, BBQ\u201d\nAttraction: Pier 39, San Francisco; San Francisco Museum of Modern Art, San Francisco\nLunch: Sudarshan, San Francisco, cost: 53, cuisines: \u201cFast Food, Bakery, Mediterranean, Italian\u201d\nDinner: Ustad Moinuddin Kebab, San Francisco, cost: 50, cuisines: \u201cTea, Bakery, American, Fast Food\u201d\nAccommodation: Cozy, spacious Studio located on Upper East Side, San Francisco, cost: 756, maximum occupancy: 2, house rules: No visitors, minimum nights: 3\n\nNumber of people = 2\nTotal cost = 18 x 2 + 53 x 2 + 50 x 2 + 756 x 2 = 1754\nAccommodation minimum nights:  2/3\n\nDays: 5\nCurrent City: from San Francisco to Washington\nTransportation: Flight Number: F3907821, from San Francisco to Washington, Departure Time: 22:55, Arrival Time: 06:57, cost: 551\nBreakfast: -, \nAttraction: -, \nLunch: -, \nDinner: -, \nAccommodation: -,\n\nNumber of people = 2\nTotal cost = 551 x 2 = 1102\n\nTotal cost across all days = 3354 + 2456 + 1732 + 1754 + 1102 = 10398\n\nCuisines: Preference for Chinese, Mexican, American, and Italian cuisines are satisfied.\n\nNote: The total cost exceeds the specified budget of $4,600. Adjustments to the plan, such as changing accommodations or dining options, are necessary to meet the budget constraint.", "gpt-4-1106-preview_direct_sole-planning_parsed_results": [{"day": 1, "current_city": "from Washington to Los Angeles", "transportation": "Flight Number: F3696906, from Washington to Los Angeles, Departure Time: 15:56, Arrival Time: 18:03", "breakfast": "-", "attraction": "-", "lunch": "-", "dinner": "Palmshore, Los Angeles", "accommodation": "Sunny apartment with easy connections to anywhere., Los Angeles"}, {"day": 2, "current_city": "Los Angeles", "transportation": "-", "breakfast": "Heat - Edsa Shangri-La, Los Angeles", "attraction": "Santa Monica Pier, Los Angeles;Griffith Observatory, Los Angeles;", "lunch": "Punjabi Zaika, Los Angeles", "dinner": "The Hangout by 1861, Los Angeles", "accommodation": "Sunny apartment with easy connections to anywhere., Los Angeles"}, {"day": 3, "current_city": "from Los Angeles to San Francisco", "transportation": "Flight Number: F3744801, from Los Angeles to San Francisco, Departure Time: 05:54, Arrival Time: 07:22", "breakfast": "-", "attraction": "Golden Gate Bridge, San Francisco;Exploratorium, San Francisco;", "lunch": "Coffee & Chai Co., San Francisco", "dinner": "Bonne Bouche, San Francisco", "accommodation": "Cozy, spacious Studio located on Upper East Side, San Francisco"}, {"day": 4, "current_city": "San Francisco", "transportation": "-", "breakfast": "Tokyo Sushi, San Francisco", "attraction": "Pier 39, San Francisco;San Francisco Museum of Modern Art, San Francisco;", "lunch": "Sudarshan, San Francisco", "dinner": "Ustad Moinuddin Kebab, San Francisco", "accommodation": "Cozy, spacious Studio located on Upper East Side, San Francisco"}, {"day": 5, "current_city": "from San Francisco to Washington", "transportation": "Flight Number: F3907821, from San Francisco to Washington, Departure Time: 22:55, Arrival Time: 06:57", "breakfast": "-", "attraction": "-", "lunch": "-", "dinner": "-", "accommodation": "-"}]}]