[{"gpt-4-1106-preview_direct_sole-planning_results": "Travel Plan:\n\nDays: 1\nCurrent City: from Chicago to Albuquerque,\nTransportation: Flight Number: F3809786, from Chicago to Albuquerque, Departure Time: 09:16, Arrival Time: 11:44, cost: 265\nBreakfast: -, \nAttraction: -,\nLunch: -, \nDinner: Thatcher's Barbeque and Grill, Albuquerque, cost: 30, cuisines: \u201cSeafood, BBQ, Desserts, Fast Food\u201d\nAccommodation: Harlem apartment, Albuquerque, cost: 133, room type: Private room, maximum occupancy: 1, house rules: No pets, minimum nights: 1\n\nNumber of people = 3\nTotal cost = (265 x 3) + (30 x 3) + (133 x 3) = 795 + 90 + 399 = 1284 \nAccommodation minimum nights:  1/1\n\nDays: 2,\nCurrent City: Albuquerque, \nTransportation: -, \nBreakfast: Cantina Famiglia Mancini, Albuquerque, cost: 40, cuisines: Tea, Cafe, Desserts\nAttraction: New Mexico Museum of Natural History and Science, Albuquerque; Petroglyph National Monument, Albuquerque\nLunch: Genghis Grill, Albuquerque, cost: 24, cuisines: \u201cBBQ, Desserts, Italian\u201d\nDinner: Punjab Grill, Albuquerque, cost: 26, cuisines: \u201cDesserts, Cafe, Italian, Bakery, Chinese, Seafood\u201d\nAccommodation: Harlem apartment, Albuquerque, cost: 133, room type: Private room, maximum occupancy: 1, house rules: No pets, minimum nights: 1\n\nNumber of people = 3\nTotal cost = (40 x 3) + (24 x 3) + (26 x 3) + (133 x 3) = 120 + 72 + 78 + 399 = 669\nAccommodation minimum nights:  2/1\n\nDays: 3, \nCurrent City: from Albuquerque to Chicago, \nTransportation: Flight Number: F3825798, from Albuquerque to Chicago, Departure Time: 12:38, Arrival Time: 16:29, cost: 281\nBreakfast: Bakingo, Albuquerque, cost: 61, cuisines: \u201cTea, Cafe, Mediterranean\u201d\nAttraction: Albuquerque Museum, Albuquerque; ABQ BioPark - Botanic Garden, Albuquerque\nLunch: Suri Saab Restaurant, Albuquerque, cost: 50, cuisines: \u201cMexican, Mediterranean, Desserts, Seafood\u201d\nDinner: -, \nAccommodation: -,\n\nNumber of people = 3\nTotal cost = (281 x 3) + (61 x 3) + (50 x 3) = 843 + 183 + 150 = 1176\n\nTotal cost across all days = 1284 + 669 + 1176 = 3129 \n\nGiven that the total cost exceeds the budget of $1,600, we need to adjust the travel plan to fit within the budget. Let's choose the cheapest flight options and adjust the accommodation accordingly.\n\nRevised Travel Plan:\n\nDays: 1\nCurrent City: from Chicago to Albuquerque,\nTransportation: Flight Number: F4005732, from Chicago to Albuquerque, Departure Time: 08:23, Arrival Time: 10:14, cost: 260\nBreakfast: -, \nAttraction: -,\nLunch: -, \nDinner: Thatcher's Barbeque and Grill, Albuquerque, cost: 30, cuisines: \u201cSeafood, BBQ, Desserts, Fast Food\u201d\nAccommodation: Harlem apartment, Albuquerque, cost: 133, room type: Private room, maximum occupancy: 1, house rules: No pets, minimum nights: 1\n\nNumber of people = 3\nTotal cost = (260 x 3) + (30 x 3) + (133 x 3) = 780 + 90 + 399 = 1269 \nAccommodation minimum nights:  1/1\n\nDays: 2,\nCurrent City: Albuquerque, \nTransportation: -, \nBreakfast: Cantina Famiglia Mancini, Albuquerque, cost: 40, cuisines: Tea, Cafe, Desserts\nAttraction: New Mexico Museum of Natural History and Science, Albuquerque; Petroglyph National Monument, Albuquerque\nLunch: Genghis Grill, Albuquerque, cost: 24, cuisines: \u201cBBQ, Desserts, Italian\u201d\nDinner: Punjab Grill, Albuquerque, cost: 26, cuisines: \u201cDesserts, Cafe, Italian, Bakery, Chinese, Seafood\u201d\nAccommodation: Harlem apartment, Albuquerque, cost: 133, room type: Private room, maximum occupancy: 1, house rules: No pets, minimum nights: 1\n\nNumber of people = 3\nTotal cost = (40 x 3) + (24 x 3) + (26 x 3) + (133 x 3) = 120 + 72 + 78 + 399 = 669\nAccommodation minimum nights:  2/1\n\nDays: 3, \nCurrent City: from Albuquerque to Chicago, \nTransportation: Flight Number: F3603308, from Albuquerque to Chicago, Departure Time: 05:41, Arrival Time: 09:35, cost: 371\nBreakfast: Bakingo, Albuquerque, cost: 61, cuisines: \u201cTea, Cafe, Mediterranean\u201d\nAttraction: Albuquerque Museum, Albuquerque; ABQ BioPark - Botanic Garden, Albuquerque\nLunch: Suri Saab Restaurant, Albuquerque, cost: 50, cuisines: \u201cMexican, Mediterranean, Desserts, Seafood\u201d\nDinner: -, \nAccommodation: -,\n\nNumber of people = 3\nTotal cost = (371 x 3) + (61 x 3) + (50 x 3) = 1113 + 183 + 150 = 1446\n\nTotal cost across all days = 1269 + 669 + 1446 = 3384 \n\nThe revised plan still exceeds the budget. To fit within the budget, we may need to consider alternative transportation methods such as self-driving or adjust the accommodation to shared rooms if private rooms are not a strict requirement. However, since the query specifies private rooms, we may need to reduce the cost of meals or attractions. Please provide further guidance on preferences to adjust the plan accordingly.", "gpt-4-1106-preview_direct_sole-planning_parsed_results": [{"day": 1, "current_city": "from Chicago to Albuquerque", "transportation": "Flight Number: F4005732, from Chicago to Albuquerque, Departure Time: 08:23, Arrival Time: 10:14", "breakfast": "-", "attraction": "-", "lunch": "-", "dinner": "Thatcher's Barbeque and Grill, Albuquerque", "accommodation": "Harlem apartment, Albuquerque"}, {"day": 2, "current_city": "Albuquerque", "transportation": "-", "breakfast": "Cantina Famiglia Mancini, Albuquerque", "attraction": "New Mexico Museum of Natural History and Science, Albuquerque;Petroglyph National Monument, Albuquerque;", "lunch": "Genghis Grill, Albuquerque", "dinner": "Punjab Grill, Albuquerque", "accommodation": "Harlem apartment, Albuquerque"}, {"day": 3, "current_city": "from Albuquerque to Chicago", "transportation": "Flight Number: F3603308, from Albuquerque to Chicago, Departure Time: 05:41, Arrival Time: 09:35", "breakfast": "Bakingo, Albuquerque", "attraction": "Albuquerque Museum, Albuquerque;ABQ BioPark - Botanic Garden, Albuquerque;", "lunch": "Suri Saab Restaurant, Albuquerque", "dinner": "-", "accommodation": "-"}]}]