[{"gpt-4-1106-preview_direct_sole-planning_results": "Travel Plan:\n\nDays: 1\nCurrent City: from Sun Valley to San Diego\nTransportation: Self-driving, from Sun Valley to San Diego, duration: 14 hours 9 mins, distance: 1,461 km, cost: 73\nBreakfast: -, \nAttraction: -,\nLunch: -, \nDinner: Open Yard, San Diego, cost: 33, cuisines: \u201cChinese, Pizza, Cafe, Desserts\u201d\nAccommodation: Spacious Room in Large 2 Bedroom Prewar Apartment, San Diego, cost: 585, maximum occupancy: 2, house rules: No parties & No visitors, minimum nights: 1\n\nNumber of people = 1\nTotal cost = 73 + 33 + 585 = 691\nAccommodation minimum nights: 1/1\n\nDays: 2\nCurrent City: San Diego\nTransportation: -, \nBreakfast: Jetha Lal Ka Dhabha, San Diego, cost: 22, cuisines: \u201cTea, Cafe, Indian, Italian\u201d\nAttraction: Balboa Park, San Diego; USS Midway Museum, San Diego\nLunch: Burger King, San Diego, cost: 20, cuisines: \u201cPizza, Italian, French, Fast Food, Seafood\u201d\nDinner: Gopala, San Diego, cost: 98, cuisines: \u201cPizza, Mexican, BBQ, American, Seafood\u201d\nAccommodation: Spacious Room in Large 2 Bedroom Prewar Apartment, San Diego, cost: 585, maximum occupancy: 2, house rules: No parties & No visitors, minimum nights: 1\n\nNumber of people = 1\nTotal cost = 22 + 20 + 98 + 585 = 725\nAccommodation minimum nights: 2/1\n\nDays: 3\nCurrent City: from San Diego to Redding\nTransportation: Self-driving, from San Diego to Redding, duration: 10 hours 10 mins, distance: 1,070 km, cost: 53\nBreakfast: Armaan's Restaurant, San Diego, cost: 29, cuisines: \u201cFast Food, Cafe, Seafood, Italian\u201d\nAttraction: -, \nLunch: -, \nDinner: New Yorker Deli & Pizzeria, Redding, cost: 78, cuisines: \u201cPizza, Bakery, Desserts, Seafood\u201d\nAccommodation: 3 Bedroom Cozy Apartment, Redding, cost: 724, room type: Entire home/apt, house rules: No smoking & No pets & No parties, minimum nights: 4, maximum occupancy: 4\n\nNumber of people = 1\nTotal cost = 53 + 29 + 78 + 724 = 884\nAccommodation minimum nights: 3/4\n\nDays: 4\nCurrent City: Redding\nTransportation: -, \nBreakfast: Perfect Bake, Redding, cost: 69, cuisines: \u201cTea, Pizza, Fast Food\u201d\nAttraction: Turtle Bay Exploration Park, Redding; Sundial Bridge, Redding\nLunch: Mosaic - Country Inn & Suites, Redding, cost: 57, cuisines: \u201cPizza, Bakery, BBQ, Fast Food, American, Mediterranean\u201d\nDinner: The Kachori Co., Redding, cost: 65, cuisines: \u201cTea, Mediterranean, Desserts\u201d\nAccommodation: 3 Bedroom Cozy Apartment, Redding, cost: 724, room type: Entire home/apt, house rules: No smoking & No pets & No parties, minimum nights: 4, maximum occupancy: 4\n\nNumber of people = 1\nTotal cost = 69 + 57 + 65 + 724 = 915\nAccommodation minimum nights: 4/4\n\nDays: 5\nCurrent City: from Redding to Sun Valley\nTransportation: Self-driving, from Redding to Sun Valley, duration: 11 hours 13 mins, distance: 1,087 km, cost: 54\nBreakfast: Evergreen Tandoori Night, Redding, cost: 71, cuisines: \u201cBakery, Mediterranean, Desserts, Fast Food\u201d\nAttraction: -, \nLunch: -, \nDinner: -, \nAccommodation: -,\n\nNumber of people = 1\nTotal cost = 54 + 71 = 125\n\nTotal cost across all days = 691 + 725 + 884 + 915 + 125 = 3340\n\nUnfortunately, the total cost of the travel plan ($3,340) exceeds the specified budget of $2,600. To adjust the plan to fit within the budget, we would need to make some changes, such as opting for more affordable accommodations or dining options. However, since the provided information does not include cheaper alternatives, we cannot revise the plan while adhering to the constraints. Please provide additional options or increase the budget to proceed with the planning.", "gpt-4-1106-preview_direct_sole-planning_parsed_results": [{"day": 1, "current_city": "from Sun Valley to San Diego", "transportation": "Self-driving, from Sun Valley to San Diego, duration: 14 hours 9 mins, distance: 1,461 km", "breakfast": "-", "attraction": "-", "lunch": "-", "dinner": "Open Yard, San Diego", "accommodation": "Spacious Room in Large 2 Bedroom Prewar Apartment, San Diego"}, {"day": 2, "current_city": "San Diego", "transportation": "-", "breakfast": "Jetha Lal Ka Dhabha, San Diego", "attraction": "Balboa Park, San Diego;USS Midway Museum, San Diego;", "lunch": "Burger King, San Diego", "dinner": "Gopala, San Diego", "accommodation": "Spacious Room in Large 2 Bedroom Prewar Apartment, San Diego"}, {"day": 3, "current_city": "from San Diego to Redding", "transportation": "Self-driving, from San Diego to Redding, duration: 10 hours 10 mins, distance: 1,070 km", "breakfast": "Armaan's Restaurant, San Diego", "attraction": "-", "lunch": "-", "dinner": "New Yorker Deli & Pizzeria, Redding", "accommodation": "3 Bedroom Cozy Apartment, Redding"}, {"day": 4, "current_city": "Redding", "transportation": "-", "breakfast": "Perfect Bake, Redding", "attraction": "Turtle Bay Exploration Park, Redding;Sundial Bridge, Redding;", "lunch": "Mosaic - Country Inn & Suites, Redding", "dinner": "The Kachori Co., Redding", "accommodation": "3 Bedroom Cozy Apartment, Redding"}, {"day": 5, "current_city": "from Redding to Sun Valley", "transportation": "Self-driving, from Redding to Sun Valley, duration: 11 hours 13 mins, distance: 1,087 km", "breakfast": "Evergreen Tandoori Night, Redding", "attraction": "-", "lunch": "-", "dinner": "-", "accommodation": "-"}]}]