[{"gpt-4-1106-preview_direct_sole-planning_results": "Travel Plan:\n\nDays: 1\nCurrent City: from Denver to Bozeman,\nTransportation: Flight Number: F3826809, from Denver to Bozeman, Departure Time: 07:58, Arrival Time: 10:17, cost: 148\nBreakfast: -, \nAttraction: -,\nLunch: Jiquitaia, Bozeman, cost: 36, cuisines: \u201cTea, Pizza, American\u201d\nDinner: Saravana Bhavan, Bozeman, cost: 38, cuisines: \u201cTea, American, Desserts\u201d\nAccommodation: Two Bedrooms with Dedicated Bath, Bozeman, cost: 615, maximum occupancy: 2, house rules: No pets & No smoking & No children under 10, minimum nights: 3\n\nNumber of people = 8\nTotal cost = (148 x 8) + (36 x 8) + (38 x 8) + (615 x 4) = 1184 + 288 + 304 + 2460 = 4236\nAccommodation minimum nights:  1/3\n\nDays: 2,\nCurrent City: Bozeman, \nTransportation: -, \nBreakfast: McGuire's Irish Pub & Brewery, Bozeman, cost: 72, cuisines: \u201cFast Food, Desserts, Italian\u201d\nAttraction: Museum of the Rockies, Bozeman; Montana Science Center, Bozeman\nLunch: Indo Chinese, Bozeman, cost: 66, cuisines: \u201cItalian, BBQ, Bakery, Fast Food, Chinese, Seafood\u201d\nDinner: Pepper Kitchen, Bozeman, cost: 75, cuisines: \u201cPizza, BBQ, Seafood\u201d\nAccommodation: Two Bedrooms with Dedicated Bath, Bozeman, cost: 615, maximum occupancy: 2, house rules: No pets & No smoking & No children under 10, minimum nights: 3\n\nNumber of people = 8\nTotal cost = (72 x 8) + (66 x 8) + (75 x 8) + (615 x 4) = 576 + 528 + 600 + 2460 = 4164\nAccommodation minimum nights:  2/3\n\nDays: 3, \nCurrent City: from Bozeman to Denver, \nTransportation: Flight Number: F3811654, from Bozeman to Denver, Departure Time: 18:26, Arrival Time: 20:06, cost: 190\nBreakfast: Today Pizza, Bozeman, cost: 27, cuisines: \u201cFrench, Bakery, BBQ, Fast Food, Cafe, Indian\u201d\nAttraction: Gallatin History Museum, Bozeman; American Computer & Robotics Museum, Bozeman\nLunch: Shree Bhog Pure Veg Restaurant, Bozeman, cost: 79, cuisines: \u201cIndian, BBQ, Fast Food\u201d\nDinner: -, \nAccommodation: -,\n\nNumber of people = 8\nTotal cost = (190 x 8) + (27 x 8) + (79 x 8) = 1520 + 216 + 632 = 2368\n\nTotal cost across all days = 4236 + 4164 + 2368 = 10768\n\nCuisines: The prompt specifies American and Indian cuisines, so all cuisine constraints are satisfied.\n\n**Note: The total cost exceeds the specified budget of $7,000. Adjustments are needed to meet the budget constraint. Possible adjustments could include changing the flight to a less expensive option, selecting more budget-friendly restaurants, or choosing accommodations with a lower cost per night.**\n\n**Adjusted Plan to Meet Budget:**\n\nDays: 1\nCurrent City: from Denver to Bozeman,\nTransportation: Self-driving, from Denver to Bozeman, duration: 9 hours 54 mins, distance: 1,119 km, cost: 55\nBreakfast: -, \nAttraction: -,\nLunch: -, \nDinner: Jiquitaia, Bozeman, cost: 36, cuisines: \u201cTea, Pizza, American\u201d\nAccommodation: Sun-Filled Artist Loft in Private Townhouse, Bozeman, cost: 214, maximum occupancy: 2, house rules: No parties, minimum nights: 2\n\nNumber of people = 8\nTotal cost = (55 x 8) + (36 x 8) + (214 x 4) = 440 + 288 + 856 = 1584\nAccommodation minimum nights:  1/2\n\nDays: 2,\nCurrent City: Bozeman, \nTransportation: -, \nBreakfast: Saravana Bhavan, Bozeman, cost: 38, cuisines: \u201cTea, American, Desserts\u201d\nAttraction: Museum of the Rockies, Bozeman; Montana Science Center, Bozeman\nLunch: Indo Chinese, Bozeman, cost: 66, cuisines: \u201cItalian, BBQ, Bakery, Fast Food, Chinese, Seafood\u201d\nDinner: Pepper Kitchen, Bozeman, cost: 75, cuisines: \u201cPizza, BBQ, Seafood\u201d\nAccommodation: Sun-Filled Artist Loft in Private Townhouse, Bozeman, cost: 214, maximum occupancy: 2, house rules: No parties, minimum nights: 2\n\nNumber of people = 8\nTotal cost = (38 x 8) + (66 x 8) + (75 x 8) + (214 x 4) = 304 + 528 + 600 + 856 = 2288\nAccommodation minimum nights:  2/2\n\nDays: 3, \nCurrent City: from Bozeman to Denver, \nTransportation: Self-driving, from Bozeman to Denver, duration: 9 hours 46 mins, distance: 1,115 km, cost: 55\nBreakfast: Today Pizza, Bozeman, cost: 27, cuisines: \u201cFrench, Bakery, BBQ, Fast Food, Cafe, Indian\u201d\nAttraction: Gallatin History Museum, Bozeman; American Computer & Robotics Museum, Bozeman\nLunch: Shree Bhog Pure Veg Restaurant, Bozeman, cost: 79, cuisines: \u201cIndian, BBQ, Fast Food\u201d\nDinner: -, \nAccommodation: -,\n\nNumber of people = 8\nTotal cost = (55 x 8) + (27 x 8) + (79 x 8) = 440 + 216 + 632 = 1288\n\nTotal cost across all days = 1584 + 2288 + 1288 = 5160\n\nCuisines: The prompt specifies American and Indian cuisines, so all cuisine constraints are satisfied.\n\n**The adjusted plan meets the specified budget of $7,000.**", "gpt-4-1106-preview_direct_sole-planning_parsed_results": [{"day": 1, "current_city": "from Denver to Bozeman", "transportation": "Self-driving, from Denver to Bozeman, duration: 9 hours 54 mins, distance: 1,119 km", "breakfast": "-", "attraction": "-", "lunch": "-", "dinner": "Jiquitaia, Bozeman", "accommodation": "Sun-Filled Artist Loft in Private Townhouse, Bozeman"}, {"day": 2, "current_city": "Bozeman", "transportation": "-", "breakfast": "Saravana Bhavan, Bozeman", "attraction": "Museum of the Rockies, Bozeman;Montana Science Center, Bozeman;", "lunch": "Indo Chinese, Bozeman", "dinner": "Pepper Kitchen, Bozeman", "accommodation": "Sun-Filled Artist Loft in Private Townhouse, Bozeman"}, {"day": 3, "current_city": "from Bozeman to Denver", "transportation": "Self-driving, from Bozeman to Denver, duration: 9 hours 46 mins, distance: 1,115 km", "breakfast": "Today Pizza, Bozeman", "attraction": "Gallatin History Museum, Bozeman;American Computer & Robotics Museum, Bozeman;", "lunch": "Shree Bhog Pure Veg Restaurant, Bozeman", "dinner": "-", "accommodation": "-"}]}]