[{"gpt-4-1106-preview_direct_sole-planning_results": "Travel Plan:\n\nDays: 1\nCurrent City: from Provo to San Diego\nTransportation: Self-driving, from Provo to San Diego, duration: 10 hours 13 mins, distance: 1,137 km, cost: 56 x 5 = 280\nBreakfast: -, \nAttraction: -,\nLunch: -, \nDinner: Open Yard, San Diego, cost: 33 x 5 = 165, cuisines: \u201cChinese, Pizza, Cafe, Desserts\u201d\nAccommodation: Spacious Room in Large 2 Bedroom Prewar Apartment, San Diego, cost: 585 x 5 = 2925, maximum occupancy: 2, house rules: No parties & No visitors, minimum nights: 1\n\nNumber of people = 5\nTotal cost = 280 + 165 + 2925 = 3370\nAccommodation minimum nights: 1/1\n\nDays: 2\nCurrent City: San Diego\nTransportation: -, \nBreakfast: Jetha Lal Ka Dhabha, San Diego, cost: 22 x 5 = 110, cuisines: \u201cTea, Cafe, Indian, Italian\u201d\nAttraction: Cabrillo National Monument, San Diego; La Jolla Shores Park, San Diego\nLunch: The Lost Mughal, San Diego, cost: 74 x 5 = 370, cuisines: \u201cTea, Cafe, Italian\u201d\nDinner: Gopala, San Diego, cost: 98 x 5 = 490, cuisines: \u201cPizza, Mexican, BBQ, American, Seafood\u201d\nAccommodation: Spacious Room in Large 2 Bedroom Prewar Apartment, San Diego, cost: 585 x 5 = 2925, maximum occupancy: 2, house rules: No parties & No visitors, minimum nights: 1\n\nNumber of people = 5\nTotal cost = 110 + 370 + 490 + 2925 = 3895\nAccommodation minimum nights: 2/1\n\nDays: 3\nCurrent City: San Diego\nTransportation: -, \nBreakfast: Armaan's Restaurant, San Diego, cost: 29 x 5 = 145, cuisines: \u201cFast Food, Cafe, Seafood, Italian\u201d\nAttraction: SeaWorld San Diego; Old Town San Diego\nLunch: Bun Intended, San Diego, cost: 91 x 5 = 455, cuisines: \u201cCafe, Pizza, Desserts, Seafood\u201d\nDinner: Harry's Bar + Cafe, San Diego, cost: 55 x 5 = 275, cuisines: \u201cFast Food, French, Cafe, Seafood\u201d\nAccommodation: Spacious Room in Large 2 Bedroom Prewar Apartment, San Diego, cost: 585 x 5 = 2925, maximum occupancy: 2, house rules: No parties & No visitors, minimum nights: 1\n\nNumber of people = 5\nTotal cost = 145 + 455 + 275 + 2925 = 3800\nAccommodation minimum nights: 3/1\n\nDays: 4\nCurrent City: from San Diego to Santa Ana\nTransportation: Self-driving, from San Diego to Santa Ana, duration: 1 hour 26 mins, distance: 144 km, cost: 7 x 5 = 35\nBreakfast: Open Yard, San Diego, cost: 33 x 5 = 165, cuisines: \u201cChinese, Pizza, Cafe, Desserts\u201d\nAttraction: Bowers Museum, Santa Ana; Santa Ana Zoo, Santa Ana\nLunch: The Bee's Knees, Santa Ana, cost: 12 x 5 = 60, cuisines: \u201cCafe, Pizza, Desserts, Seafood\u201d\nDinner: Caf\u6106 Tu Tu Tango, Santa Ana, cost: 88 x 5 = 440, cuisines: \u201cTea, Pizza, French, Bakery, Cafe, American\u201d\nAccommodation: Sunny Two Bedroom in South Slope, Santa Ana, cost: 879 x 5 = 4395, maximum occupancy: 3, house rules: No children under 10 & No pets & No visitors, minimum nights: 7\n\nNumber of people = 5\nTotal cost = 35 + 165 + 60 + 440 + 4395 = 5095\nAccommodation minimum nights: 4/7\n\nDays: 5\nCurrent City: Santa Ana\nTransportation: -, \nBreakfast: Jimmie's Hot Dogs, Santa Ana, cost: 96 x 5 = 480, cuisines: \u201cFast Food, BBQ, Italian\u201d\nAttraction: Heritage Museum of Orange County; Discovery Science Center\nLunch: Eram Rooftop, Santa Ana, cost: 77 x 5 = 385, cuisines: \u201cCafe, Bakery, American, BBQ\u201d\nDinner: Shahi Chicken Corner, Santa Ana, cost: 55 x 5 = 275, cuisines: \u201cBakery, BBQ, Italian\u201d\nAccommodation: Sunny Two Bedroom in South Slope, Santa Ana, cost: 879 x 5 = 4395, maximum occupancy: 3, house rules: No children under 10 & No pets & No visitors, minimum nights: 7\n\nNumber of people = 5\nTotal cost = 480 + 385 + 275 + 4395 = 5535\nAccommodation minimum nights: 5/7\n\nDays: 6\nCurrent City: from Santa Ana to Bakersfield\nTransportation: Self-driving, from Santa Ana to Bakersfield, duration: 2 hours 31 mins, distance: 231 km, cost: 11 x 5 = 55\nBreakfast: The Chai Cafe, Santa Ana, cost: 52 x 5 = 260, cuisines: \u201cTea, American, Desserts\u201d\nAttraction: Kern County Museum, Bakersfield; California Living Museum, Bakersfield\nLunch: Kihei Caffe, Bakersfield, cost: 47 x 5 = 235, cuisines: \u201cFast Food, BBQ, Desserts, Italian\u201d\nDinner: Tybee Island Social Club, Bakersfield, cost: 83 x 5 = 415, cuisines: \u201cTea, Bakery, Fast Food, Cafe, American\u201d\nAccommodation: Sunny Two Bedroom in South Slope, Santa Ana, cost: 879 x 5 = 4395, maximum occupancy: 3, house rules: No children under 10 & No pets & No visitors, minimum nights: 7\n\nNumber of people = 5\nTotal cost = 55 + 260 + 235 + 415 + 4395 = 5360\nAccommodation minimum nights: 6/7\n\nDays: 7\nCurrent City: from Bakersfield to Provo\nTransportation: Self-driving, from Bakersfield to Provo, duration: 9 hours 34 mins, distance: 1,063 km, cost: 53 x 5 = 265\nBreakfast: DePalma's Italian Cafe - East Side, Bakersfield, cost: 12 x 5 = 60, cuisines: \u201cChinese, Pizza, Bakery\u201d\nAttraction: Buena Vista Museum of Natural History & Science, Bakersfield; Central Park at Mill Creek, Bakersfield\nLunch: Momo-Cha, Bakersfield, cost: 68 x 5 = 340, cuisines: \u201cDesserts, Pizza, BBQ, Fast Food, Mediterranean\u201d\nDinner: -, \nAccommodation: -,\n\nNumber of people = 5\nTotal cost = 265 + 60 + 340 = 665\n\nTotal cost across all days = 3370 + 3895 + 3800 + 5095 + 5535 + 5360 + 665 = 27720\n\nGiven the budget of $14,900, the total cost of $27,720 exceeds the budget. Adjustments are needed to fit within the budget constraints. This could involve choosing more affordable accommodations, dining options, or reducing the number of attractions visited.", "gpt-4-1106-preview_direct_sole-planning_parsed_results": [{"day": 1, "current_city": "from Provo to San Diego", "transportation": "Self-driving, from Provo to San Diego, duration: 10 hours 13 mins, distance: 1,137 km", "breakfast": "-", "attraction": "-", "lunch": "-", "dinner": "Open Yard, San Diego", "accommodation": "Spacious Room in Large 2 Bedroom Prewar Apartment, San Diego"}, {"day": 2, "current_city": "San Diego", "transportation": "-", "breakfast": "Jetha Lal Ka Dhabha, San Diego", "attraction": "Cabrillo National Monument, San Diego;La Jolla Shores Park, San Diego;", "lunch": "The Lost Mughal, San Diego", "dinner": "Gopala, San Diego", "accommodation": "Spacious Room in Large 2 Bedroom Prewar Apartment, San Diego"}, {"day": 3, "current_city": "San Diego", "transportation": "-", "breakfast": "Armaan's Restaurant, San Diego", "attraction": "SeaWorld San Diego;Old Town San Diego;", "lunch": "Bun Intended, San Diego", "dinner": "Harry's Bar + Cafe, San Diego", "accommodation": "Spacious Room in Large 2 Bedroom Prewar Apartment, San Diego"}, {"day": 4, "current_city": "from San Diego to Santa Ana", "transportation": "Self-driving, from San Diego to Santa Ana, duration: 1 hour 26 mins, distance: 144 km", "breakfast": "Open Yard, San Diego", "attraction": "Bowers Museum, Santa Ana;Santa Ana Zoo, Santa Ana;", "lunch": "The Bee's Knees, Santa Ana", "dinner": "Caf\u00e9 Tu Tu Tango, Santa Ana", "accommodation": "Sunny Two Bedroom in South Slope, Santa Ana"}, {"day": 5, "current_city": "Santa Ana", "transportation": "-", "breakfast": "Jimmie's Hot Dogs, Santa Ana", "attraction": "Heritage Museum of Orange County;Discovery Science Center;", "lunch": "Eram Rooftop, Santa Ana", "dinner": "Shahi Chicken Corner, Santa Ana", "accommodation": "Sunny Two Bedroom in South Slope, Santa Ana"}, {"day": 6, "current_city": "from Santa Ana to Bakersfield", "transportation": "Self-driving, from Santa Ana to Bakersfield, duration: 2 hours 31 mins, distance: 231 km", "breakfast": "The Chai Cafe, Santa Ana", "attraction": "Kern County Museum, Bakersfield;California Living Museum, Bakersfield;", "lunch": "Kihei Caffe, Bakersfield", "dinner": "Tybee Island Social Club, Bakersfield", "accommodation": "Sunny Two Bedroom in South Slope, Santa Ana"}, {"day": 7, "current_city": "from Bakersfield to Provo", "transportation": "Self-driving, from Bakersfield to Provo, duration: 9 hours 34 mins, distance: 1,063 km", "breakfast": "DePalma's Italian Cafe - East Side, Bakersfield", "attraction": "Buena Vista Museum of Natural History & Science, Bakersfield;Central Park at Mill Creek, Bakersfield;", "lunch": "Momo-Cha, Bakersfield", "dinner": "-", "accommodation": "-"}]}]