[{"gpt-4-1106-preview_direct_sole-planning_results": "Travel Plan:\n\nDays: 1\nCurrent City: from Lake Charles to Houston\nTransportation: Flight Number: F3932451, from Lake Charles to Houston, Departure Time: 07:02, Arrival Time: 08:27, cost: 57\nBreakfast: -, \nAttraction: -,\nLunch: Jalapenos, Houston, cost: 57, cuisines: \u201cDesserts, Tea, Cafe, Chinese, Seafood\u201d\nDinner: The BrewMaster - The Mix Fine Dine, Houston, cost: 52, cuisines: \u201cFrench, Indian, Cafe, Seafood\u201d\nAccommodation: Superhost 3 bedroom DISCOUNT, Houston, cost: 746, maximum occupancy: 5, house rules: No pets, minimum nights: 1\n\nNumber of people = 2\nTotal cost = (57 x 2) + (57 x 2) + (52 x 2) + (746 x 1) = 1026\nAccommodation minimum nights: 1/1\n\nDays: 2\nCurrent City: Houston\nTransportation: -, \nBreakfast: Super Bakery, Houston, cost: 30, cuisines: \u201cSeafood, Fast Food\u201d\nAttraction: Space Center Houston, Houston; Houston Museum of Natural Science, Houston\nLunch: Earthen Spices, Houston, cost: 28, cuisines: \u201cTea, Mexican, Bakery, BBQ, Fast Food\u201d\nDinner: Al Arabian Express, Houston, cost: 74, cuisines: \u201cBBQ, Desserts, Seafood\u201d\nAccommodation: Superhost 3 bedroom DISCOUNT, Houston, cost: 746, maximum occupancy: 5, house rules: No pets, minimum nights: 1\n\nNumber of people = 2\nTotal cost = (30 x 2) + (28 x 2) + (74 x 2) + (746 x 1) = 960\nAccommodation minimum nights: 2/1\n\nDays: 3\nCurrent City: from Houston to Dallas\nTransportation: Flight Number: F3673853, from Houston to Dallas, Departure Time: 07:46, Arrival Time: 09:09, cost: 53\nBreakfast: -, \nAttraction: The Dallas World Aquarium, Dallas; The Sixth Floor Museum at Dealey Plaza, Dallas\nLunch: Coconuts Fish Cafe, Dallas, cost: 38, cuisines: \u201cCafe, BBQ, Mediterranean, Fast Food\u201d\nDinner: 1918 Bistro & Grill, Dallas, cost: 90, cuisines: \u201cTea, Pizza, BBQ, Seafood\u201d\nAccommodation: Exclusive Modern Penthouse Apartment, Dallas, cost: 483, maximum occupancy: 3, house rules: No pets & No visitors, minimum nights: 1\n\nNumber of people = 2\nTotal cost = (53 x 2) + (38 x 2) + (90 x 2) + (483 x 1) = 845\nAccommodation minimum nights: 3/1\n\nDays: 4\nCurrent City: Dallas\nTransportation: -, \nBreakfast: Drifters Cafe, Dallas, cost: 21, cuisines: \u201cTea, French, Mexican, Cafe, Seafood\u201d\nAttraction: Reunion Tower, Dallas; Dallas Museum of Art, Dallas\nLunch: Uma Foodies' Hut, Dallas, cost: 49, cuisines: \u201cFrench, Bakery, Seafood\u201d\nDinner: Belfrance Luxury Chocolates, Dallas, cost: 96, cuisines: \u201cDesserts, Pizza, Fast Food, Cafe, American\u201d\nAccommodation: Exclusive Modern Penthouse Apartment, Dallas, cost: 483, maximum occupancy: 3, house rules: No pets & No visitors, minimum nights: 1\n\nNumber of people = 2\nTotal cost = (21 x 2) + (49 x 2) + (96 x 2) + (483 x 1) = 815\nAccommodation minimum nights: 4/1\n\nDays: 5\nCurrent City: from Dallas to Lake Charles\nTransportation: Flight Number: F3592512, from Dallas to Lake Charles, Departure Time: 16:41, Arrival Time: 17:52, cost: 91\nBreakfast: Metro Fast Food, Dallas, cost: 45, cuisines: \u201cTea, Pizza, Mexican, Bakery, BBQ, American\u201d\nAttraction: Klyde Warren Park, Dallas; Dallas Arboretum and Botanical Garden, Dallas\nLunch: Cafe Gatherings, Dallas, cost: 17, cuisines: \u201cBakery, Indian, Desserts\u201d\nDinner: -, \nAccommodation: -,\n\nNumber of people = 2\nTotal cost = (91 x 2) + (45 x 2) + (17 x 2) = 306\n\nTotal cost across all days = 1026 + 960 + 845 + 815 + 306 = 3952\nCuisines: The prompt specifies no cuisines, so all cuisines constraints are satisfied\n\nNote: The accommodations selected allow for parties as there are no specific house rules against parties. The total cost is within the specified budget of $4,600.", "gpt-4-1106-preview_direct_sole-planning_parsed_results": [{"day": 1, "current_city": "from Lake Charles to Houston", "transportation": "Flight Number: F3932451, from Lake Charles to Houston, Departure Time: 07:02, Arrival Time: 08:27", "breakfast": "-", "attraction": "-", "lunch": "Jalapenos, Houston", "dinner": "The BrewMaster - The Mix Fine Dine, Houston", "accommodation": "Superhost 3 bedroom DISCOUNT, Houston"}, {"day": 2, "current_city": "Houston", "transportation": "-", "breakfast": "Super Bakery, Houston", "attraction": "Space Center Houston, Houston;Houston Museum of Natural Science, Houston;", "lunch": "Earthen Spices, Houston", "dinner": "Al Arabian Express, Houston", "accommodation": "Superhost 3 bedroom DISCOUNT, Houston"}, {"day": 3, "current_city": "from Houston to Dallas", "transportation": "Flight Number: F3673853, from Houston to Dallas, Departure Time: 07:46, Arrival Time: 09:09", "breakfast": "-", "attraction": "The Dallas World Aquarium, Dallas;The Sixth Floor Museum at Dealey Plaza, Dallas;", "lunch": "Coconuts Fish Cafe, Dallas", "dinner": "1918 Bistro & Grill, Dallas", "accommodation": "Exclusive Modern Penthouse Apartment, Dallas"}, {"day": 4, "current_city": "Dallas", "transportation": "-", "breakfast": "Drifters Cafe, Dallas", "attraction": "Reunion Tower, Dallas;Dallas Museum of Art, Dallas;", "lunch": "Uma Foodies' Hut, Dallas", "dinner": "Belfrance Luxury Chocolates, Dallas", "accommodation": "Exclusive Modern Penthouse Apartment, Dallas"}, {"day": 5, "current_city": "from Dallas to Lake Charles", "transportation": "Flight Number: F3592512, from Dallas to Lake Charles, Departure Time: 16:41, Arrival Time: 17:52", "breakfast": "Metro Fast Food, Dallas", "attraction": "Klyde Warren Park, Dallas;Dallas Arboretum and Botanical Garden, Dallas;", "lunch": "Cafe Gatherings, Dallas", "dinner": "-", "accommodation": "-"}]}]