[{"gpt-4-1106-preview_direct_sole-planning_results": "Travel Plan:\n\nDays: 1\nCurrent City: from Syracuse to Augusta\nTransportation: Self-driving, from Syracuse to Augusta, duration: 13 hours 17 mins, distance: 1,431 km, cost: 71 x 2 = 142\nBreakfast: -, \nAttraction: -,\nLunch: -, \nDinner: B Merrell's, Augusta, cost: 74 x 2 = 148, cuisines: \u201cTea, Pizza, Desserts, Fast Food\u201d\nAccommodation: Planta Baja Studio, Augusta, cost: 637 x 1 = 637, room type: Entire home/apt, house rules: No smoking, minimum nights: 1, maximum occupancy: 4\n\nNumber of people = 2\nTotal cost = 142 + 148 + 637 = 927\nAccommodation minimum nights: 1/1\n\nDays: 2\nCurrent City: Augusta\nTransportation: -, \nBreakfast: Fish Tales Lakeside Grille, Augusta, cost: 37 x 2 = 74, cuisines: \u201cTea, Cafe, Bakery, Desserts\u201d\nAttraction: Phinizy Swamp Nature Park, Augusta; Augusta Museum of History, Augusta\nLunch: Karari Kurry, Augusta, cost: 29 x 2 = 58, cuisines: \u201cBakery, Indian, Cafe, Fast Food\u201d\nDinner: The Charcoal Chimney, Augusta, cost: 86 x 2 = 172, cuisines: \u201cTea, Fast Food, BBQ, Italian\u201d\nAccommodation: Planta Baja Studio, Augusta, cost: 637 x 1 = 637, room type: Entire home/apt, house rules: No smoking, minimum nights: 1, maximum occupancy: 4\n\nNumber of people = 2\nTotal cost = 74 + 58 + 172 + 637 = 941\nAccommodation minimum nights: 2/1\n\nDays: 3\nCurrent City: from Augusta to Decatur\nTransportation: Self-driving, from Augusta to Decatur, duration: 2 hours 19 mins, distance: 229 km, cost: 11 x 2 = 22\nBreakfast: -, \nAttraction: Augusta Canal Discovery Center, Augusta; Sacred Heart Cultural Center, Augusta\nLunch: Just Kababs, Augusta, cost: 31 x 2 = 62, cuisines: \u201cTea, Pizza, BBQ, American, Seafood\u201d\nDinner: Cafe Coffee Day, Decatur, cost: 46 x 2 = 92, cuisines: \u201cTea, Cafe, BBQ, Mediterranean\u201d\nAccommodation: Cozy Private Room, Decatur, cost: 69 x 1 = 69, room type: Private room, house rules: No children under 10 & No parties & No visitors, minimum nights: 2, maximum occupancy: 2\n\nNumber of people = 2\nTotal cost = 22 + 62 + 92 + 69 = 245\nAccommodation minimum nights: 1/2\n\nDays: 4\nCurrent City: Decatur\nTransportation: -, \nBreakfast: Cafe Einstein, Decatur, cost: 82 x 2 = 164, cuisines: \u201cTea, Cafe, Bakery, BBQ\u201d\nAttraction: DeKalb History Center Museum, Decatur; Clyde Shepherd Nature Preserve, Decatur\nLunch: Joey's Pizza, Decatur, cost: 69 x 2 = 138, cuisines: \u201cTea, Pizza, Bakery, Chinese, Seafood\u201d\nDinner: Cafe Blue Tomato, Decatur, cost: 36 x 2 = 72, cuisines: \u201cTea, Italian, Fast Food, Chinese, Seafood\u201d\nAccommodation: Cozy Private Room, Decatur, cost: 69 x 1 = 69, room type: Private room, house rules: No children under 10 & No parties & No visitors, minimum nights: 2, maximum occupancy: 2\n\nNumber of people = 2\nTotal cost = 164 + 138 + 72 + 69 = 443\nAccommodation minimum nights: 2/2\n\nDays: 5\nCurrent City: from Decatur to Syracuse\nTransportation: Self-driving, from Decatur to Syracuse, duration: 14 hours 26 mins, distance: 1,542 km, cost: 77 x 2 = 154\nBreakfast: Anjlika Pastry Shop, Decatur, cost: 10 x 2 = 20, cuisines: \u201cTea, French, BBQ, Seafood\u201d\nAttraction: Glenlake Park, Decatur; Waffle House Museum, Decatur\nLunch: -, \nDinner: -, \nAccommodation: -,\n\nNumber of people = 2\nTotal cost = 154 + 20 = 174\n\nTotal cost across all days = 927 + 941 + 245 + 443 + 174 = 2730\n\nCuisines: The prompt specifies American and Mediterranean cuisines, and the selected restaurants match these requirements.\n\nUnfortunately, the total cost of the travel plan ($2,730) exceeds the specified budget of $2,000. Adjustments would need to be made to the plan to reduce costs, such as selecting more affordable accommodations or dining options.", "gpt-4-1106-preview_direct_sole-planning_parsed_results": [{"day": 1, "current_city": "from Syracuse to Augusta", "transportation": "Self-driving, from Syracuse to Augusta, duration: 13 hours 17 mins, distance: 1,431 km", "breakfast": "-", "attraction": "-", "lunch": "-", "dinner": "B Merrell's, Augusta", "accommodation": "Planta Baja Studio, Augusta"}, {"day": 2, "current_city": "Augusta", "transportation": "-", "breakfast": "Fish Tales Lakeside Grille, Augusta", "attraction": "Phinizy Swamp Nature Park, Augusta;Augusta Museum of History, Augusta;", "lunch": "Karari Kurry, Augusta", "dinner": "The Charcoal Chimney, Augusta", "accommodation": "Planta Baja Studio, Augusta"}, {"day": 3, "current_city": "from Augusta to Decatur", "transportation": "Self-driving, from Augusta to Decatur, duration: 2 hours 19 mins, distance: 229 km", "breakfast": "-", "attraction": "Augusta Canal Discovery Center, Augusta;Sacred Heart Cultural Center, Augusta;", "lunch": "Just Kababs, Augusta", "dinner": "Cafe Coffee Day, Decatur", "accommodation": "Cozy Private Room, Decatur"}, {"day": 4, "current_city": "Decatur", "transportation": "-", "breakfast": "Cafe Einstein, Decatur", "attraction": "DeKalb History Center Museum, Decatur;Clyde Shepherd Nature Preserve, Decatur;", "lunch": "Joey's Pizza, Decatur", "dinner": "Cafe Blue Tomato, Decatur", "accommodation": "Cozy Private Room, Decatur"}, {"day": 5, "current_city": "from Decatur to Syracuse", "transportation": "Self-driving, from Decatur to Syracuse, duration: 14 hours 26 mins, distance: 1,542 km", "breakfast": "Anjlika Pastry Shop, Decatur", "attraction": "Glenlake Park, Decatur;Waffle House Museum, Decatur;", "lunch": "-", "dinner": "-", "accommodation": "-"}]}]