[{"gpt-4-1106-preview_direct_sole-planning_results": "Travel Plan:\n\nDays: 1\nCurrent City: from Kona to San Diego\nTransportation: Flight Number: F3739867, from Kona to San Diego, Departure Time: 16:33, Arrival Time: 00:04, cost: 778\nBreakfast: -, \nAttraction: -,\nLunch: -, \nDinner: Open Yard, San Diego, cost: 33, cuisines: \u201cChinese, Pizza, Cafe, Desserts\u201d\nAccommodation: Spacious Room in Large 2 Bedroom Prewar Apartment, San Diego, cost: 585, maximum occupancy: 2, house rules: No parties & No visitors, minimum nights: 1\n\nNumber of people = 1\nTotal cost = 778 x 1 + 33 x 1 + 585 x 1 = 1396\nAccommodation minimum nights: 1/1\n\nDays: 2\nCurrent City: San Diego\nTransportation: -, \nBreakfast: Jetha Lal Ka Dhabha, San Diego, cost: 22, cuisines: \u201cTea, Cafe, Indian, Italian\u201d\nAttraction: Balboa Park, San Diego; USS Midway Museum, San Diego\nLunch: Burger King, San Diego, cost: 20, cuisines: \u201cPizza, Italian, French, Fast Food, Seafood\u201d\nDinner: Gopala, San Diego, cost: 98, cuisines: \u201cPizza, Mexican, BBQ, American, Seafood\u201d\nAccommodation: Spacious Room in Large 2 Bedroom Prewar Apartment, San Diego, cost: 585, maximum occupancy: 2, house rules: No parties & No visitors, minimum nights: 1\n\nNumber of people = 1\nTotal cost = 22 x 1 + 20 x 1 + 98 x 1 + 585 x 1 = 725\nAccommodation minimum nights: 2/1\n\nDays: 3\nCurrent City: from San Diego to Redding\nTransportation: Self-driving, from San Diego to Redding, duration: 10 hours 10 mins, distance: 1,070 km, cost: 53\nBreakfast: Armaan's Restaurant, San Diego, cost: 29, cuisines: \u201cFast Food, Cafe, Seafood, Italian\u201d\nAttraction: -, \nLunch: -, \nDinner: New Yorker Deli & Pizzeria, Redding, cost: 78, cuisines: \u201cPizza, Bakery, Desserts, Seafood\u201d\nAccommodation: 3 Bedroom Cozy Apartment, Redding, cost: 724, maximum occupancy: 4, house rules: No smoking & No pets & No parties, minimum nights: 4\n\nNumber of people = 1\nTotal cost = 53 x 1 + 29 x 1 + 78 x 1 + 724 x 1 = 884\nAccommodation minimum nights: 3/4\n\nDays: 4\nCurrent City: Redding\nTransportation: -, \nBreakfast: Perfect Bake, Redding, cost: 69, cuisines: \u201cTea, Pizza, Fast Food\u201d\nAttraction: Turtle Bay Exploration Park, Redding; Sundial Bridge, Redding\nLunch: Mosaic - Country Inn & Suites, Redding, cost: 57, cuisines: \u201cPizza, Bakery, BBQ, Fast Food, American, Mediterranean\u201d\nDinner: Mumbai Local, Redding, cost: 78, cuisines: \u201cBakery, Pizza, BBQ, Desserts\u201d\nAccommodation: 3 Bedroom Cozy Apartment, Redding, cost: 724, maximum occupancy: 4, house rules: No smoking & No pets & No parties, minimum nights: 4\n\nNumber of people = 1\nTotal cost = 69 x 1 + 57 x 1 + 78 x 1 + 724 x 1 = 928\nAccommodation minimum nights: 4/4\n\nDays: 5\nCurrent City: from Redding to San Jose\nTransportation: Self-driving, from Redding to San Jose, duration: 3 hours 49 mins, distance: 402 km, cost: 20\nBreakfast: Evergreen Tandoori Night, Redding, cost: 71, cuisines: \u201cBakery, Mediterranean, Desserts, Fast Food\u201d\nAttraction: -, \nLunch: -, \nDinner: Wildfire - Crowne Plaza, San Jose, cost: 30, cuisines: \u201cDesserts, Cafe, Fast Food, Chinese, Indian, Seafood\u201d\nAccommodation: The Heart of Williamsburg, San Jose, cost: 938, maximum occupancy: 2, house rules: No pets & No parties & No smoking, minimum nights: 3\n\nNumber of people = 1\nTotal cost = 20 x 1 + 71 x 1 + 30 x 1 + 938 x 1 = 1059\nAccommodation minimum nights: 5/3\n\nDays: 6\nCurrent City: San Jose\nTransportation: -, \nBreakfast: Gola Sizzlers, San Jose, cost: 87, cuisines: \u201cPizza, Mexican, BBQ, Fast Food, American\u201d\nAttraction: Winchester Mystery House, San Jose; The Tech Interactive, San Jose\nLunch: Free Spirit, San Jose, cost: 17, cuisines: \u201cMexican, Bakery, BBQ, Fast Food, Seafood\u201d\nDinner: China Kitchen - Hyatt Regency, San Jose, cost: 94, cuisines: \u201cBakery, Mediterranean, Seafood\u201d\nAccommodation: The Heart of Williamsburg, San Jose, cost: 938, maximum occupancy: 2, house rules: No pets & No parties & No smoking, minimum nights: 3\n\nNumber of people = 1\nTotal cost = 87 x 1 + 17 x 1 + 94 x 1 + 938 x 1 = 1136\nAccommodation minimum nights: 6/3\n\nDays: 7\nCurrent City: from San Jose to Kona\nTransportation: Flight Number: F3976224, from San Jose to Kona, Departure Time: 09:32, Arrival Time: 11:36, cost: 909\nBreakfast: Santa's Fantasea, San Jose, cost: 31, cuisines: \u201cCafe, Bakery, Pizza, BBQ\u201d\nAttraction: -, \nLunch: -, \nDinner: -, \nAccommodation: -,\n\nNumber of people = 1\nTotal cost = 909 x 1 + 31 x 1 = 940\n\nTotal cost across all days = 1396 + 725 + 884 + 928 + 1059 + 1136 + 940 = 7068\n\nUnfortunately, the total cost exceeds the specified budget of $5,800. Adjustments will need to be made to the travel plan to reduce costs. This could include selecting more budget-friendly accommodations, dining options, or adjusting transportation methods where possible.", "gpt-4-1106-preview_direct_sole-planning_parsed_results": [{"day": 1, "current_city": "from Kona to San Diego", "transportation": "Flight Number: F3739867, from Kona to San Diego, Departure Time: 16:33, Arrival Time: 00:04", "breakfast": "-", "attraction": "-", "lunch": "-", "dinner": "Open Yard, San Diego", "accommodation": "Spacious Room in Large 2 Bedroom Prewar Apartment, San Diego"}, {"day": 2, "current_city": "San Diego", "transportation": "-", "breakfast": "Jetha Lal Ka Dhabha, San Diego", "attraction": "Balboa Park, San Diego;USS Midway Museum, San Diego;", "lunch": "Burger King, San Diego", "dinner": "Gopala, San Diego", "accommodation": "Spacious Room in Large 2 Bedroom Prewar Apartment, San Diego"}, {"day": 3, "current_city": "from San Diego to Redding", "transportation": "Self-driving, from San Diego to Redding, duration: 10 hours 10 mins, distance: 1,070 km", "breakfast": "Armaan's Restaurant, San Diego", "attraction": "-", "lunch": "-", "dinner": "New Yorker Deli & Pizzeria, Redding", "accommodation": "3 Bedroom Cozy Apartment, Redding"}, {"day": 4, "current_city": "Redding", "transportation": "-", "breakfast": "Perfect Bake, Redding", "attraction": "Turtle Bay Exploration Park, Redding;Sundial Bridge, Redding;", "lunch": "Mosaic - Country Inn & Suites, Redding", "dinner": "Mumbai Local, Redding", "accommodation": "3 Bedroom Cozy Apartment, Redding"}, {"day": 5, "current_city": "from Redding to San Jose", "transportation": "Self-driving, from Redding to San Jose, duration: 3 hours 49 mins, distance: 402 km", "breakfast": "Evergreen Tandoori Night, Redding", "attraction": "-", "lunch": "-", "dinner": "Wildfire - Crowne Plaza, San Jose", "accommodation": "The Heart of Williamsburg, San Jose"}, {"day": 6, "current_city": "San Jose", "transportation": "-", "breakfast": "Gola Sizzlers, San Jose", "attraction": "Winchester Mystery House, San Jose;The Tech Interactive, San Jose;", "lunch": "Free Spirit, San Jose", "dinner": "China Kitchen - Hyatt Regency, San Jose", "accommodation": "The Heart of Williamsburg, San Jose"}, {"day": 7, "current_city": "from San Jose to Kona", "transportation": "Flight Number: F3976224, from San Jose to Kona, Departure Time: 09:32, Arrival Time: 11:36", "breakfast": "Santa's Fantasea, San Jose", "attraction": "-", "lunch": "-", "dinner": "-", "accommodation": "-"}]}]