[{"gpt-4-1106-preview_direct_sole-planning_results": "Travel Plan:\n\nDays: 1\nCurrent City: from Key West to Evansville\nTransportation: Self-driving, from Key West to Evansville, duration: 18 hours 21 mins, distance: 1,961 km, cost: 98\nBreakfast: -, \nAttraction: -,\nLunch: -, \nDinner: Blue Orchid Thai Restaurant, Evansville, cost: 86, cuisines: \u201cTea, Mexican, American, Desserts\u201d\nAccommodation: Stylish 1 bed room in the East Village, Evansville, cost: 674, room type: Entire home/apt, maximum occupancy: 6, house rules: No children under 10, minimum nights: 3\n\nNumber of people = 1\nTotal cost = 98 x 1 + 86 x 1 + 674 x 1 = 858\nAccommodation minimum nights: 1/3\n\nDays: 2\nCurrent City: Evansville\nTransportation: -, \nBreakfast: J. Christopher's, Evansville, cost: 39, cuisines: \u201cTea, Cafe, Desserts, Seafood\u201d\nAttraction: Mesker Park Zoo, Evansville; Children's Museum of Evansville, Evansville\nLunch: Punjabi Restaurant, Evansville, cost: 29, cuisines: \u201cCafe, Bakery, Desserts, Fast Food\u201d\nDinner: Twist of Italy, Evansville, cost: 85, cuisines: \u201cDesserts, Pizza, Mexican, Mediterranean, Seafood\u201d\nAccommodation: Stylish 1 bed room in the East Village, Evansville, cost: 674, room type: Entire home/apt, maximum occupancy: 6, house rules: No children under 10, minimum nights: 3\n\nNumber of people = 1\nTotal cost = 39 x 1 + 29 x 1 + 85 x 1 + 674 x 1 = 827\nAccommodation minimum nights: 2/3\n\nDays: 3\nCurrent City: from Evansville to South Bend\nTransportation: Self-driving, from Evansville to South Bend, duration: 5 hours 1 min, distance: 512 km, cost: 25\nBreakfast: Cake Point, Evansville, cost: 49, cuisines: \u201cTea, Mediterranean, Desserts, Fast Food\u201d\nAttraction: Burdette Park, Evansville; Evansville Museum, Evansville\nLunch: -, \nDinner: Madaan Confectionery, South Bend, cost: 62, cuisines: \u201cTea, Cafe, BBQ, Seafood\u201d\nAccommodation: Just Right in Lovely Greenpoint, South Bend, cost: 614, room type: Private room, maximum occupancy: 1, house rules: No smoking & No visitors, minimum nights: 7\n\nNumber of people = 1\nTotal cost = 25 x 1 + 49 x 1 + 62 x 1 + 614 x 1 = 750\nAccommodation minimum nights: 1/7\n\nDays: 4\nCurrent City: South Bend\nTransportation: -, \nBreakfast: Krips Restaurant, South Bend, cost: 59, cuisines: \u201cTea, Mediterranean, Fast Food\u201d\nAttraction: Studebaker National Museum, South Bend; Potawatomi Zoo, South Bend\nLunch: It\u6f74\u7c79 Sinful, South Bend, cost: 26, cuisines: \u201cDesserts, French, BBQ, Bakery, Seafood\u201d\nDinner: MOB Brewpub, South Bend, cost: 67, cuisines: \u201cCafe, Mexican, American, BBQ\u201d\nAccommodation: Just Right in Lovely Greenpoint, South Bend, cost: 614, room type: Private room, maximum occupancy: 1, house rules: No smoking & No visitors, minimum nights: 7\n\nNumber of people = 1\nTotal cost = 59 x 1 + 26 x 1 + 67 x 1 + 614 x 1 = 766\nAccommodation minimum nights: 2/7\n\nDays: 5\nCurrent City: from South Bend to Key West\nTransportation: Self-driving, from South Bend to Key West, duration: 22 hours 38 mins, distance: 2,406 km, cost: 120\nBreakfast: Roadhouse Cafe, South Bend, cost: 24, cuisines: \u201cDesserts, Pizza, Bakery, Fast Food, Chinese\u201d\nAttraction: -, \nLunch: -, \nDinner: -, \nAccommodation: -,\n\nNumber of people = 1\nTotal cost = 120 x 1 + 24 x 1 = 144\n\nTotal cost across all days = 858 + 827 + 750 + 766 + 144 = 3345\n\nNote: The total cost exceeds the specified budget of $2,000. Adjustments are needed to meet the budget constraint. Possible adjustments include changing accommodation to a less expensive option, reducing meal costs, or altering transportation methods. However, given the constraints and the provided data, it is not possible to create a travel plan within the $2,000 budget while meeting all requirements.", "gpt-4-1106-preview_direct_sole-planning_parsed_results": [{"day": 1, "current_city": "from Key West to Evansville", "transportation": "Self-driving, from Key West to Evansville, duration: 18 hours 21 mins, distance: 1,961 km", "breakfast": "-", "attraction": "-", "lunch": "-", "dinner": "Blue Orchid Thai Restaurant, Evansville", "accommodation": "Stylish 1 bed room in the East Village, Evansville"}, {"day": 2, "current_city": "Evansville", "transportation": "-", "breakfast": "J. Christopher's, Evansville", "attraction": "Mesker Park Zoo, Evansville;Children's Museum of Evansville, Evansville;", "lunch": "Punjabi Restaurant, Evansville", "dinner": "Twist of Italy, Evansville", "accommodation": "Stylish 1 bed room in the East Village, Evansville"}, {"day": 3, "current_city": "from Evansville to South Bend", "transportation": "Self-driving, from Evansville to South Bend, duration: 5 hours 1 min, distance: 512 km", "breakfast": "Cake Point, Evansville", "attraction": "Burdette Park, Evansville;Evansville Museum, Evansville;", "lunch": "-", "dinner": "Madaan Confectionery, South Bend", "accommodation": "Just Right in Lovely Greenpoint, South Bend"}, {"day": 4, "current_city": "South Bend", "transportation": "-", "breakfast": "Krips Restaurant, South Bend", "attraction": "Studebaker National Museum, South Bend;Potawatomi Zoo, South Bend;", "lunch": "It's Sinful, South Bend", "dinner": "MOB Brewpub, South Bend", "accommodation": "Just Right in Lovely Greenpoint, South Bend"}, {"day": 5, "current_city": "from South Bend to Key West", "transportation": "Self-driving, from South Bend to Key West, duration: 22 hours 38 mins, distance: 2,406 km", "breakfast": "Roadhouse Cafe, South Bend", "attraction": "-", "lunch": "-", "dinner": "-", "accommodation": "-"}]}]