[{"gpt-4-1106-preview_direct_sole-planning_results": "Travel Plan:\n\nDays: 1\nCurrent City: from Appleton to Charlotte,\nTransportation: Flight Number: F3796721, from Appleton to Charlotte, Departure Time: 06:58, Arrival Time: 10:25, cost: 314\nBreakfast: -, \nAttraction: -,\nLunch: -, \nDinner: Olive Tree Cafe, Charlotte, cost: 23, cuisines: \u201cTea, Chinese, Desserts\u201d\nAccommodation: Elegant Studio Apt in Prospect Heights, Charlotte, cost: 640, maximum occupancy: 5, house rules: No parties, minimum nights: 2\n\nNumber of people = 7\nTotal cost = (314 x 7) + (23 x 7) + (640 x 2) = 2198 + 161 + 1280 = 3639\nAccommodation minimum nights:  1/2\n\nDays: 2,\nCurrent City: Charlotte, \nTransportation: -, \nBreakfast: Central Perk 7, Charlotte, cost: 87, cuisines: Pizza, Bakery, BBQ, Fast Food\nAttraction: Freedom Park, Charlotte; Levine Museum of the New South, Charlotte\nLunch: Kylin Skybar, Charlotte, cost: 44, cuisines: \u201cTea, Cafe, Pizza, Italian\u201d\nDinner: Unplugged Courtyard, Charlotte, cost: 54, cuisines: \u201cDesserts, French, Bakery, Cafe, Seafood\u201d\nAccommodation: Elegant Studio Apt in Prospect Heights, Charlotte, cost: 640, maximum occupancy: 5, house rules: No parties, minimum nights: 2\n\nNumber of people = 7\nTotal cost = (87 x 7) + (44 x 7) + (54 x 7) + (640 x 2) = 609 + 308 + 378 + 1280 = 2575\nAccommodation minimum nights:  2/2\n\nDays: 3, \nCurrent City: from Charlotte to Appleton, \nTransportation: Flight Number: F3788979, from Charlotte to Appleton, Departure Time: 22:52, Arrival Time: 00:07, cost: 212\nBreakfast: Grover's - The Baker Shop, Charlotte, cost: 30, cuisines: \u201cPizza, Bakery, Chinese, Indian, Seafood\u201d\nAttraction: Discovery Place Science, Charlotte; NASCAR Hall of Fame, Charlotte\nLunch: Nagaland's Kitchen, Charlotte, cost: 73, cuisines: \u201cPizza, American, Desserts\u201d\nDinner: -, \nAccommodation: -,\n\nNumber of people = 7\nTotal cost = (212 x 7) + (30 x 7) + (73 x 7) = 1484 + 210 + 511 = 2205\n\nTotal cost across all days = 3639 + 2575 + 2205 = 8419\nCuisines: The prompt specifies no cuisines, so all cuisines constraints are satisfied\n\nNote: The accommodation chosen allows visitors as per the house rules. The cost of the trip is within the specified budget of $9,500. The travel plan includes all required details for each day, ensuring that no restaurant or attraction is repeated. The transportation method is consistent with flights on the first and last days, and the accommodation matches the final city listed for each day. The number of visiting cities is one, as specified, and the number of days matches the query. All cities are real and correctly mapped to their states.", "gpt-4-1106-preview_direct_sole-planning_parsed_results": [{"day": 1, "current_city": "from Appleton to Charlotte", "transportation": "Flight Number: F3796721, from Appleton to Charlotte, Departure Time: 06:58, Arrival Time: 10:25", "breakfast": "-", "attraction": "-", "lunch": "-", "dinner": "Olive Tree Cafe, Charlotte", "accommodation": "Elegant Studio Apt in Prospect Heights, Charlotte"}, {"day": 2, "current_city": "Charlotte", "transportation": "-", "breakfast": "Central Perk 7, Charlotte", "attraction": "Freedom Park, Charlotte;Levine Museum of the New South, Charlotte;", "lunch": "Kylin Skybar, Charlotte", "dinner": "Unplugged Courtyard, Charlotte", "accommodation": "Elegant Studio Apt in Prospect Heights, Charlotte"}, {"day": 3, "current_city": "from Charlotte to Appleton", "transportation": "Flight Number: F3788979, from Charlotte to Appleton, Departure Time: 22:52, Arrival Time: 00:07", "breakfast": "Grover's - The Baker Shop, Charlotte", "attraction": "Discovery Place Science, Charlotte;NASCAR Hall of Fame, Charlotte;", "lunch": "Nagaland's Kitchen, Charlotte", "dinner": "-", "accommodation": "-"}]}]