[{"gpt-4-1106-preview_direct_sole-planning_results": "Travel Plan:\n\nDays: 1\nCurrent City: from Denver to Palm Springs,\nTransportation: Flight Number: F3880999, from Denver to Palm Springs, Departure Time: 11:16, Arrival Time: 12:28, cost: 227\nBreakfast: -, \nAttraction: -,\nLunch: Bar Gernika Basque Pub & Eatery, Palm Springs, cost: 50, cuisines: \u201cTea, Pizza, Desserts, Fast Food\u201d\nDinner: Houndstooth Grill & Tavern, Palm Springs, cost: 47, cuisines: \u201cTea, Pizza, BBQ, Mediterranean\u201d\nAccommodation: Brooklyn Gem, Palm Springs, cost: 877, room type: Entire home/apt, maximum occupancy: 4, house rules: No children under 10, minimum nights: 2\n\nNumber of people = 1\nTotal cost = 227 x 1 + 50 x 1 + 47 x 1 + 877 x 1 = 1201 \nAccommodation minimum nights:  1/2\n\nDays: 2,\nCurrent City: Palm Springs, \nTransportation: -, \nBreakfast: Kahill's Steak-Fish Chophouse, Palm Springs, cost: 38, cuisines: \u201cCafe, Bakery, American\u201d\nAttraction: Palm Springs Art Museum, Palm Springs; Palm Springs Aerial Tramway, Palm Springs\nLunch: Sugar & Spice - Le Marche, Palm Springs, cost: 33, cuisines: \u201cTea, French, Cafe\u201d\nDinner: Jaan, Palm Springs, cost: 215, cuisines: \u201cSeafood, Mexican, Fast Food\u201d\nAccommodation: Brooklyn Gem, Palm Springs, cost: 877, room type: Entire home/apt, maximum occupancy: 4, house rules: No children under 10, minimum nights: 2\n\nNumber of people = 1\nTotal cost = 38 x 1 + 33 x 1 + 215 x 1 + 877 x 1 = 1163\nAccommodation minimum nights:  2/2\n\nDays: 3, \nCurrent City: from Palm Springs to Denver, \nTransportation: Flight Number: F3870469, from Palm Springs to Denver, Departure Time: 16:00, Arrival Time: 19:12, cost: 330\nBreakfast: Pizza Man, Palm Springs, cost: 55, cuisines: \u201cTea, Italian, Fast Food, Cafe, American\u201d\nAttraction: Moorten Botanical Garden, Palm Springs; Indian Canyons, Palm Springs\nLunch: Palaaram, Palm Springs, cost: 63, cuisines: \u201cDesserts, Pizza, Italian, BBQ, Cafe\u201d\nDinner: -, \nAccommodation: -,\n\nNumber of people = 1\nTotal cost = 330 x 1 + 55 x 1 + 63 x 1 = 448\n\nTotal cost across all days = 1201 + 1163 + 448 = 2812 \n\nNote: The total cost exceeds the specified budget of $2,200. Adjustments are needed to bring the cost within budget. Possible adjustments include selecting a less expensive accommodation or reducing meal costs.\n\nAdjusted Travel Plan:\n\nDays: 1\nCurrent City: from Denver to Palm Springs,\nTransportation: Flight Number: F3880999, from Denver to Palm Springs, Departure Time: 11:16, Arrival Time: 12:28, cost: 227\nBreakfast: -, \nAttraction: -,\nLunch: Bar Gernika Basque Pub & Eatery, Palm Springs, cost: 50, cuisines: \u201cTea, Pizza, Desserts, Fast Food\u201d\nDinner: Houndstooth Grill & Tavern, Palm Springs, cost: 47, cuisines: \u201cTea, Pizza, BBQ, Mediterranean\u201d\nAccommodation: 1 room available for rent in 3 bedroom, Palm Springs, cost: 462, room type: Private room, maximum occupancy: 1, house rules: No children under 10 & No visitors & No smoking, minimum nights: 8\n\nNumber of people = 1\nTotal cost = 227 x 1 + 50 x 1 + 47 x 1 + 462 x 1 = 786 \nAccommodation minimum nights:  1/8\n\nDays: 2,\nCurrent City: Palm Springs, \nTransportation: -, \nBreakfast: Kahill's Steak-Fish Chophouse, Palm Springs, cost: 38, cuisines: \u201cCafe, Bakery, American\u201d\nAttraction: Palm Springs Art Museum, Palm Springs; Palm Springs Aerial Tramway, Palm Springs\nLunch: Sugar & Spice - Le Marche, Palm Springs, cost: 33, cuisines: \u201cTea, French, Cafe\u201d\nDinner: Jaan, Palm Springs, cost: 215, cuisines: \u201cSeafood, Mexican, Fast Food\u201d\nAccommodation: 1 room available for rent in 3 bedroom, Palm Springs, cost: 462, room type: Private room, maximum occupancy: 1, house rules: No children under 10 & No visitors & No smoking, minimum nights: 8\n\nNumber of people = 1\nTotal cost = 38 x 1 + 33 x 1 + 215 x 1 + 462 x 1 = 748\nAccommodation minimum nights:  2/8\n\nDays: 3, \nCurrent City: from Palm Springs to Denver, \nTransportation: Flight Number: F3870469, from Palm Springs to Denver, Departure Time: 16:00, Arrival Time: 19:12, cost: 330\nBreakfast: Pizza Man, Palm Springs, cost: 55, cuisines: \u201cTea, Italian, Fast Food, Cafe, American\u201d\nAttraction: Moorten Botanical Garden, Palm Springs; Indian Canyons, Palm Springs\nLunch: Palaaram, Palm Springs, cost: 63, cuisines: \u201cDesserts, Pizza, Italian, BBQ, Cafe\u201d\nDinner: -, \nAccommodation: -,\n\nNumber of people = 1\nTotal cost = 330 x 1 + 55 x 1 + 63 x 1 = 448\n\nTotal cost across all days = 786 + 748 + 448 = 1982 \n\nCuisines: The prompt specifies no cuisines, so all cuisines constraints are satisfied.", "gpt-4-1106-preview_direct_sole-planning_parsed_results": [{"day": 1, "current_city": "from Denver to Palm Springs", "transportation": "Flight Number: F3880999, from Denver to Palm Springs, Departure Time: 11:16, Arrival Time: 12:28", "breakfast": "-", "attraction": "-", "lunch": "Bar Gernika Basque Pub & Eatery, Palm Springs", "dinner": "Houndstooth Grill & Tavern, Palm Springs", "accommodation": "1 room available for rent in 3 bedroom, Palm Springs"}, {"day": 2, "current_city": "Palm Springs", "transportation": "-", "breakfast": "Kahill's Steak-Fish Chophouse, Palm Springs", "attraction": "Palm Springs Art Museum, Palm Springs;Palm Springs Aerial Tramway, Palm Springs;", "lunch": "Sugar & Spice - Le Marche, Palm Springs", "dinner": "Jaan, Palm Springs", "accommodation": "1 room available for rent in 3 bedroom, Palm Springs"}, {"day": 3, "current_city": "from Palm Springs to Denver", "transportation": "Flight Number: F3870469, from Palm Springs to Denver, Departure Time: 16:00, Arrival Time: 19:12", "breakfast": "Pizza Man, Palm Springs", "attraction": "Moorten Botanical Garden, Palm Springs;Indian Canyons, Palm Springs;", "lunch": "Palaaram, Palm Springs", "dinner": "-", "accommodation": "-"}]}]