[{"gpt-4-1106-preview_direct_sole-planning_results": "Travel Plan:\n\nDays: 1\nCurrent City: from Baton Rouge to Dallas,\nTransportation: Flight Number: F3608485, from Baton Rouge to Dallas, Departure Time: 14:20, Arrival Time: 15:47, cost: 124\nBreakfast: -, \nAttraction: -,\nLunch: -, \nDinner: Coconuts Fish Cafe, Dallas, cost: 38, cuisines: \u201cCafe, BBQ, Mediterranean, Fast Food\u201d\nAccommodation: *Fresh Budget Room, Dallas, cost: 262, maximum occupancy: 1, house rules: No visitors & No smoking, minimum nights: 1\n\nNumber of people = 4\nTotal cost = (124 x 4) + (38 x 4) + (262 x 4) = 496 + 152 + 1048 = 1696\nAccommodation minimum nights:  1/1\n\nDays: 2,\nCurrent City: Dallas, \nTransportation: -, \nBreakfast: Cafe Gatherings, Dallas, cost: 17, cuisines: Bakery, Indian, Desserts\nAttraction: The Dallas World Aquarium, Dallas; The Sixth Floor Museum at Dealey Plaza, Dallas\nLunch: 1918 Bistro & Grill, Dallas, cost: 90, cuisines: \u201cTea, Pizza, BBQ, Seafood\u201d\nDinner: Yanki Sizzlers, Dallas, cost: 96, cuisines: \u201cCafe, French, Tea, Mediterranean\u201d\nAccommodation: *Fresh Budget Room, Dallas, cost: 262, maximum occupancy: 1, house rules: No visitors & No smoking, minimum nights: 1\n\nNumber of people = 4\nTotal cost = (17 x 4) + (90 x 4) + (96 x 4) + (262 x 4) = 68 + 360 + 384 + 1048 = 1860\nAccommodation minimum nights:  2/1\n\nDays: 3, \nCurrent City: from Dallas to Baton Rouge, \nTransportation: Flight Number: F3814165, from Dallas to Baton Rouge, Departure Time: 20:39, Arrival Time: 21:58, cost: 87\nBreakfast: Drifters Cafe, Dallas, cost: 21, cuisines: \u201cTea, French, Mexican, Cafe, Seafood\u201d\nAttraction: Reunion Tower, Dallas; Dallas Museum of Art, Dallas\nLunch: Delhicacy, Dallas, cost: 67, cuisines: \u201cDesserts, Mexican, Bakery, Chinese, Seafood\u201d\nDinner: -, \nAccommodation: -,\n\nNumber of people = 4\nTotal cost = (87 x 4) + (21 x 4) + (67 x 4) = 348 + 84 + 268 = 700\n\nTotal cost across all days = 1696 + 1860 + 700 = 4256 \nCuisines: The prompt specifies no cuisines, so all cuisines constraints are satisfied\n\nNote: The accommodation selected does not allow smoking, which violates one of the requirements. However, the provided data does not include any accommodation that permits smoking. Therefore, the accommodation chosen is the best available option that meets the other criteria, such as price and occupancy. If smoking is a strict requirement, the plan may need to be adjusted once accommodations that allow smoking are identified.", "gpt-4-1106-preview_direct_sole-planning_parsed_results": [{"day": 1, "current_city": "from Baton Rouge to Dallas", "transportation": "Flight Number: F3608485, from Baton Rouge to Dallas, Departure Time: 14:20, Arrival Time: 15:47", "breakfast": "-", "attraction": "-", "lunch": "-", "dinner": "Coconuts Fish Cafe, Dallas", "accommodation": "Fresh Budget Room, Dallas"}, {"day": 2, "current_city": "Dallas", "transportation": "-", "breakfast": "Cafe Gatherings, Dallas", "attraction": "The Dallas World Aquarium, Dallas;The Sixth Floor Museum at Dealey Plaza, Dallas;", "lunch": "1918 Bistro & Grill, Dallas", "dinner": "Yanki Sizzlers, Dallas", "accommodation": "Fresh Budget Room, Dallas"}, {"day": 3, "current_city": "from Dallas to Baton Rouge", "transportation": "Flight Number: F3814165, from Dallas to Baton Rouge, Departure Time: 20:39, Arrival Time: 21:58", "breakfast": "Drifters Cafe, Dallas", "attraction": "Reunion Tower, Dallas;Dallas Museum of Art, Dallas;", "lunch": "Delhicacy, Dallas", "dinner": "-", "accommodation": "-"}]}]