[{"gpt-4-1106-preview_direct_sole-planning_results": "Travel Plan:\n\nDays: 1\nCurrent City: from Charlotte to Hilton Head\nTransportation: Flight Number: F4059890, from Charlotte to Hilton Head, Departure Time: 13:01, Arrival Time: 14:22, cost: 95\nBreakfast: -, \nAttraction: -,\nLunch: -, \nDinner: Sikkim Fast Food, Hilton Head, cost: 90, cuisines: \u201cFrench, Bakery, Desserts, Seafood\u201d\nAccommodation: Rustic room in renovated Bushwick apartment, Hilton Head, cost: 309, maximum occupancy: 1, house rules: No smoking, minimum nights: 1\n\nNumber of people = 5\nTotal cost = (95 x 5) + (90 x 5) + (309 x 5) = 2470 \nAccommodation minimum nights:  1/1\n\nDays: 2\nCurrent City: Hilton Head\nTransportation: -, \nBreakfast: Cafe Coffee Day, Hilton Head, cost: 65, cuisines: \u201cBakery, BBQ, Italian\u201d\nAttraction: Coastal Discovery Museum, Hilton Head; Harbour Town Lighthouse, Hilton Head\nLunch: Wrapster, Hilton Head, cost: 18, cuisines: \u201cFrench, Seafood, Desserts, Italian\u201d\nDinner: Salato Salad Studio, Hilton Head, cost: 100, cuisines: \u201cTea, Pizza, Mexican, Bakery, Cafe, American\u201d\nAccommodation: Rustic room in renovated Bushwick apartment, Hilton Head, cost: 309, maximum occupancy: 1, house rules: No smoking, minimum nights: 1\n\nNumber of people = 5\nTotal cost = (65 x 5) + (18 x 5) + (100 x 5) + (309 x 5) = 2460\nAccommodation minimum nights:  2/1\n\nDays: 3\nCurrent City: from Hilton Head to Charlotte\nTransportation: Flight Number: F4059921, from Hilton Head to Charlotte, Departure Time: 14:52, Arrival Time: 16:04, cost: 45\nBreakfast: Twenty Four Seven, Hilton Head, cost: 51, cuisines: \u201cCafe, Indian, Fast Food\u201d\nAttraction: Coligny Beach Park, Hilton Head; Sea Pines Forest Preserve, Hilton Head\nLunch: MR.D - Deliciousness Delivered, Hilton Head, cost: 18, cuisines: \u201cTea, French, Mexican, Fast Food\u201d\nDinner: -, \nAccommodation: -,\n\nNumber of people = 5\nTotal cost = (45 x 5) + (51 x 5) + (18 x 5) = 570\n\nTotal cost across all days = 2470 + 2460 + 570 = 5500 \nCuisines: Preference for Italian and French cuisines is satisfied with selected restaurants\nAccommodation: Private rooms booked for each individual, adhering to the \"no shared room\" constraint\n\nPlease note that the accommodation cost is calculated per room, and since the maximum occupancy is 1, each person will need their own room, hence the cost is multiplied by the number of people. The total cost of the trip is within the specified budget of $7,000.", "gpt-4-1106-preview_direct_sole-planning_parsed_results": [{"day": 1, "current_city": "from Charlotte to Hilton Head", "transportation": "Flight Number: F4059890, from Charlotte to Hilton Head, Departure Time: 13:01, Arrival Time: 14:22", "breakfast": "-", "attraction": "-", "lunch": "-", "dinner": "Sikkim Fast Food, Hilton Head", "accommodation": "Rustic room in renovated Bushwick apartment, Hilton Head"}, {"day": 2, "current_city": "Hilton Head", "transportation": "-", "breakfast": "Cafe Coffee Day, Hilton Head", "attraction": "Coastal Discovery Museum, Hilton Head;Harbour Town Lighthouse, Hilton Head;", "lunch": "Wrapster, Hilton Head", "dinner": "Salato Salad Studio, Hilton Head", "accommodation": "Rustic room in renovated Bushwick apartment, Hilton Head"}, {"day": 3, "current_city": "from Hilton Head to Charlotte", "transportation": "Flight Number: F4059921, from Hilton Head to Charlotte, Departure Time: 14:52, Arrival Time: 16:04", "breakfast": "Twenty Four Seven, Hilton Head", "attraction": "Coligny Beach Park, Hilton Head;Sea Pines Forest Preserve, Hilton Head;", "lunch": "MR.D - Deliciousness Delivered, Hilton Head", "dinner": "-", "accommodation": "-"}]}]