[{"gpt-4-1106-preview_direct_sole-planning_results": "Travel Plan:\n\nDays: 1\nCurrent City: from Omaha to Traverse City,\nTransportation: Self-driving, from Omaha to Traverse City, duration: 11 hours 25 mins, distance: 1,240 km, cost: 62 x 3 = 186\nBreakfast: -, \nAttraction: -,\nLunch: -, \nDinner: Famous Dave's, Traverse City, cost: 39 x 3 = 117, cuisines: \u201cDesserts, Italian, BBQ, Fast Food, Indian\u201d\nAccommodation: One bedroom apartment in NoLita, Traverse City, cost: 172 x 3 = 516, room type: Entire home/apt, house rules: No children under 10 & No pets, minimum nights: 1, maximum occupancy: 2\n\nNumber of people = 3\nTotal cost = 186 + 117 + 516 = 819\nAccommodation minimum nights: 1/1\n\nDays: 2,\nCurrent City: Traverse City, \nTransportation: -, \nBreakfast: Daily Eats, Traverse City, cost: 44 x 3 = 132, cuisines: Desserts, Seafood\nAttraction: Clinch Park, Traverse City; Mission Point Lighthouse, Traverse City\nLunch: Arigato Sushi, Traverse City, cost: 96 x 3 = 288, cuisines: \u201cDesserts, Mexican, Bakery, BBQ, Fast Food, Mediterranean\u201d\nDinner: Tasty Bites, Traverse City, cost: 27 x 3 = 81, cuisines: \u201cChinese, Bakery, Desserts, Seafood\u201d\nAccommodation: One bedroom apartment in NoLita, Traverse City, cost: 172 x 3 = 516, room type: Entire home/apt, house rules: No children under 10 & No pets, minimum nights: 1, maximum occupancy: 2\n\nNumber of people = 3\nTotal cost = 132 + 288 + 81 + 516 = 1017\nAccommodation minimum nights: 2/1\n\nDays: 3,\nCurrent City: from Traverse City to Alpena,\nTransportation: Self-driving, from Traverse City to Alpena, duration: 2 hours 29 mins, distance: 204 km, cost: 10 x 3 = 30\nBreakfast: India on my Plate - Fortune Select Excalibur, Traverse City, cost: 53 x 3 = 159, cuisines: \u201cTea, Chinese, Seafood\u201d\nAttraction: Great Lakes Maritime Heritage Center, Alpena; Besser Museum for Northeast Michigan, Alpena\nLunch: @Mango, Alpena, cost: 38 x 3 = 114, cuisines: \u201cBBQ, Cafe, American, Desserts\u201d\nDinner: Maplai, Alpena, cost: 63 x 3 = 189, cuisines: \u201cTea, Indian, Bakery, Fast Food, American\u201d\nAccommodation: Ultimate 50th Floor Downtown Penthouse - 4000SqFt, Alpena, cost: 1043 x 3 = 3129, room type: Entire home/apt, house rules: No smoking & No visitors & No children under 10, minimum nights: 2, maximum occupancy: 9\n\nNumber of people = 3\nTotal cost = 30 + 159 + 114 + 189 + 3129 = 3621\nAccommodation minimum nights: 3/2\n\nDays: 4,\nCurrent City: Alpena, \nTransportation: -, \nBreakfast: Shudh Restaurant, Alpena, cost: 56 x 3 = 168, cuisines: \u201cCafe, BBQ, Fast Food\u201d\nAttraction: Thunder Bay National Marine Sanctuary, Alpena; Island Park, Alpena\nLunch: Zaffran - The Bristol Hotel, Alpena, cost: 33 x 3 = 99, cuisines: \u201cPizza, Desserts, Seafood\u201d\nDinner: Kylin Express, Alpena, cost: 30 x 3 = 90, cuisines: \u201cChinese, Bakery, BBQ, Seafood\u201d\nAccommodation: Ultimate 50th Floor Downtown Penthouse - 4000SqFt, Alpena, cost: 1043 x 3 = 3129, room type: Entire home/apt, house rules: No smoking & No visitors & No children under 10, minimum nights: 2, maximum occupancy: 9\n\nNumber of people = 3\nTotal cost = 168 + 99 + 90 + 3129 = 3486\nAccommodation minimum nights: 4/2\n\nDays: 5, \nCurrent City: from Alpena to Omaha, \nTransportation: Self-driving, from Alpena to Omaha, duration: 12 hours 59 mins, distance: 1,391 km, cost: 69 x 3 = 207\nBreakfast: Jain Chawal Wale, Alpena, cost: 20 x 3 = 60, cuisines: \u201cDesserts, Pizza, Italian, Mexican, Cafe\u201d\nAttraction: -, \nLunch: -, \nDinner: -, \nAccommodation: -,\n\nNumber of people = 3\nTotal cost = 207 + 60 = 267\n\nTotal cost across all days = 819 + 1017 + 3621 + 3486 + 267 = 9210\n\nUnfortunately, the total cost of $9,210 exceeds the specified budget of $7,500. To adjust the plan within the budget, we may need to consider different accommodations or dining options. Please let me know how you would like to proceed, or if you have any specific preferences to adjust within the budget.", "gpt-4-1106-preview_direct_sole-planning_parsed_results": [{"day": 1, "current_city": "from Omaha to Traverse City", "transportation": "Self-driving, from Omaha to Traverse City, duration: 11 hours 25 mins, distance: 1,240 km", "breakfast": "-", "attraction": "-", "lunch": "-", "dinner": "Famous Dave's, Traverse City", "accommodation": "One bedroom apartment in NoLita, Traverse City"}, {"day": 2, "current_city": "Traverse City", "transportation": "-", "breakfast": "Daily Eats, Traverse City", "attraction": "Clinch Park, Traverse City;Mission Point Lighthouse, Traverse City;", "lunch": "Arigato Sushi, Traverse City", "dinner": "Tasty Bites, Traverse City", "accommodation": "One bedroom apartment in NoLita, Traverse City"}, {"day": 3, "current_city": "from Traverse City to Alpena", "transportation": "Self-driving, from Traverse City to Alpena, duration: 2 hours 29 mins, distance: 204 km", "breakfast": "India on my Plate - Fortune Select Excalibur, Traverse City", "attraction": "Great Lakes Maritime Heritage Center, Alpena;Besser Museum for Northeast Michigan, Alpena;", "lunch": "@Mango, Alpena", "dinner": "Maplai, Alpena", "accommodation": "Ultimate 50th Floor Downtown Penthouse - 4000SqFt, Alpena"}, {"day": 4, "current_city": "Alpena", "transportation": "-", "breakfast": "Shudh Restaurant, Alpena", "attraction": "Thunder Bay National Marine Sanctuary, Alpena;Island Park, Alpena;", "lunch": "Zaffran - The Bristol Hotel, Alpena", "dinner": "Kylin Express, Alpena", "accommodation": "Ultimate 50th Floor Downtown Penthouse - 4000SqFt, Alpena"}, {"day": 5, "current_city": "from Alpena to Omaha", "transportation": "Self-driving, from Alpena to Omaha, duration: 12 hours 59 mins, distance: 1,391 km", "breakfast": "Jain Chawal Wale, Alpena", "attraction": "-", "lunch": "-", "dinner": "-", "accommodation": "-"}]}]