[{"gpt-4-1106-preview_direct_sole-planning_results": "Travel Plan:\n\nDays: 1\nCurrent City: from Milwaukee to Alpena,\nTransportation: Self-driving, from Milwaukee to Alpena, duration: 7 hours 37 mins, distance: 749 km, cost: 37 x 2 = 74\nBreakfast: -, \nAttraction: -,\nLunch: -, \nDinner: @Mango, Alpena, cost: 38 x 2 = 76, cuisines: \u201cBBQ, Cafe, American, Desserts\u201d\nAccommodation: Loft in Times Square with Roof Balcony, Alpena, cost: 104 x 2 = 208, maximum occupancy: 2, house rules: No parties & No visitors, minimum nights: 180\n\nNumber of people = 2\nTotal cost = 74 + 76 + 208 = 358\nAccommodation minimum nights:  1/180\n\nDays: 2,\nCurrent City: Alpena, \nTransportation: -, \nBreakfast: A & A Pagliai's Pizza, Alpena, cost: 72 x 2 = 144, cuisines: Tea, American, Fast Food\nAttraction: Great Lakes Maritime Heritage Center, Alpena; Besser Museum for Northeast Michigan, Alpena\nLunch: Shudh Restaurant, Alpena, cost: 56 x 2 = 112, cuisines: \u201cCafe, BBQ, Fast Food\u201d\nDinner: Maplai, Alpena, cost: 63 x 2 = 126, cuisines: \u201cTea, Indian, Bakery, Fast Food, American\u201d\nAccommodation: Loft in Times Square with Roof Balcony, Alpena, cost: 104 x 2 = 208, maximum occupancy: 2, house rules: No parties & No visitors, minimum nights: 180\n\nNumber of people = 2\nTotal cost = 144 + 112 + 126 + 208 = 590\nAccommodation minimum nights:  2/180\n\nDays: 3, \nCurrent City: from Alpena to Kalamazoo, \nTransportation: Self-driving, from Alpena to Kalamazoo, duration: 4 hours 33 mins, distance: 464 km, cost: 23 x 2 = 46\nBreakfast: Jain Chawal Wale, Alpena, cost: 20 x 2 = 40, cuisines: \u201cDesserts, Pizza, Italian, Mexican, Cafe\u201d\nAttraction: Kalamazoo Valley Museum, Kalamazoo; Kalamazoo Institute of Arts, Kalamazoo\nLunch: Django, Kalamazoo, cost: 65 x 2 = 130, cuisines: \u201cMediterranean, Desserts, Fast Food\u201d\nDinner: Giulios Greek & Italian Restaurant, Kalamazoo, cost: 76 x 2 = 152, cuisines: \u201cFast Food, French, Desserts, Seafood\u201d\nAccommodation: Sunny, 1 Bedroom in Bedstuy, Brooklyn, Kalamazoo, cost: 160 x 2 = 320, maximum occupancy: 2, house rules: No smoking, minimum nights: 7\n\nNumber of people = 2\nTotal cost = 46 + 40 + 130 + 152 + 320 = 688\nAccommodation minimum nights:  1/7\n\nDays: 4,\nCurrent City: Kalamazoo, \nTransportation: -, \nBreakfast: Cha cTea, Kalamazoo, cost: 77 x 2 = 154, cuisines: \u201cCafe, Pizza, Mediterranean\u201d\nAttraction: Kalamazoo Nature Center, Kalamazoo; Air Zoo Aerospace & Science Museum, Kalamazoo\nLunch: Taco Bell, Kalamazoo, cost: 54 x 2 = 108, cuisines: \u201cChinese, Bakery, Pizza, Seafood\u201d\nDinner: Oxy Lounge, Kalamazoo, cost: 65 x 2 = 130, cuisines: \u201cTea, Bakery, BBQ\u201d\nAccommodation: Sunny, 1 Bedroom in Bedstuy, Brooklyn, Kalamazoo, cost: 160 x 2 = 320, maximum occupancy: 2, house rules: No smoking, minimum nights: 7\n\nNumber of people = 2\nTotal cost = 154 + 108 + 130 + 320 = 712\nAccommodation minimum nights:  2/7\n\nDays: 5, \nCurrent City: from Kalamazoo to Milwaukee, \nTransportation: Self-driving, from Kalamazoo to Milwaukee, duration: 3 hours 45 mins, distance: 382 km, cost: 19 x 2 = 38\nBreakfast: Six Degrees, Kalamazoo, cost: 20 x 2 = 40, cuisines: \u201cCafe, Italian, Bakery, Fast Food, Chinese\u201d\nAttraction: -, \nLunch: -, \nDinner: -, \nAccommodation: -,\n\nNumber of people = 2\nTotal cost = 38 + 40 = 78\n\nTotal cost across all days = 358 + 590 + 688 + 712 + 78 = 2426\n\nCuisines: The prompt specifies no cuisines, so all cuisines constraints are satisfied\n\nNote: The total cost exceeds the specified budget of $1,700. Adjustments to the plan, such as choosing more budget-friendly restaurants or accommodations, would be necessary to meet the budget constraint.", "gpt-4-1106-preview_direct_sole-planning_parsed_results": [{"day": 1, "current_city": "from Milwaukee to Alpena", "transportation": "Self-driving, from Milwaukee to Alpena, duration: 7 hours 37 mins, distance: 749 km", "breakfast": "-", "attraction": "-", "lunch": "-", "dinner": "@Mango, Alpena", "accommodation": "Loft in Times Square with Roof Balcony, Alpena"}, {"day": 2, "current_city": "Alpena", "transportation": "-", "breakfast": "A & A Pagliai's Pizza, Alpena", "attraction": "Great Lakes Maritime Heritage Center, Alpena;Besser Museum for Northeast Michigan, Alpena;", "lunch": "Shudh Restaurant, Alpena", "dinner": "Maplai, Alpena", "accommodation": "Loft in Times Square with Roof Balcony, Alpena"}, {"day": 3, "current_city": "from Alpena to Kalamazoo", "transportation": "Self-driving, from Alpena to Kalamazoo, duration: 4 hours 33 mins, distance: 464 km", "breakfast": "Jain Chawal Wale, Alpena", "attraction": "Kalamazoo Valley Museum, Kalamazoo;Kalamazoo Institute of Arts, Kalamazoo;", "lunch": "Django, Kalamazoo", "dinner": "Giulios Greek & Italian Restaurant, Kalamazoo", "accommodation": "Sunny, 1 Bedroom in Bedstuy, Brooklyn, Kalamazoo"}, {"day": 4, "current_city": "Kalamazoo", "transportation": "-", "breakfast": "Cha cTea, Kalamazoo", "attraction": "Kalamazoo Nature Center, Kalamazoo;Air Zoo Aerospace & Science Museum, Kalamazoo;", "lunch": "Taco Bell, Kalamazoo", "dinner": "Oxy Lounge, Kalamazoo", "accommodation": "Sunny, 1 Bedroom in Bedstuy, Brooklyn, Kalamazoo"}, {"day": 5, "current_city": "from Kalamazoo to Milwaukee", "transportation": "Self-driving, from Kalamazoo to Milwaukee, duration: 3 hours 45 mins, distance: 382 km", "breakfast": "Six Degrees, Kalamazoo", "attraction": "-", "lunch": "-", "dinner": "-", "accommodation": "-"}]}]