[{"gpt-4-1106-preview_direct_sole-planning_results": "Travel Plan:\n\nDays: 1\nCurrent City: Chattanooga to Atlanta\nTransportation: Self-driving, from Chattanooga to Atlanta, duration: 1 hour 48 mins, distance: 190 km, cost: 9 x 2 = 18\nBreakfast: -, \nAttraction: -,\nLunch: -, \nDinner: Saffron, Atlanta, cost: 39 x 2 = 78, cuisines: \u201cTea, Cafe, Fast Food, Seafood\u201d\nAccommodation: Bright, Modern, Clean, Spacious, Brooklyn Home, Atlanta, cost: 1034 x 2 = 2068, room type: Entire home/apt, house rules: No children under 10, minimum nights: 3\n\nNumber of people = 2\nTotal cost for the day = 18 + 78 + 2068 = 2164\nAccommodation minimum nights: 1/3\n\nDays: 2\nCurrent City: Atlanta\nTransportation: -, \nBreakfast: Asian Bistro, Atlanta, cost: 27 x 2 = 54, cuisines: \u201cTea, Bakery, Seafood\u201d\nAttraction: Georgia Aquarium, Atlanta; Atlanta Botanical Garden, Atlanta\nLunch: Chef Style, Atlanta, cost: 59 x 2 = 118, cuisines: \u201cPizza, American, Desserts, Seafood\u201d\nDinner: Pizza Central, Atlanta, cost: 75 x 2 = 150, cuisines: \u201cCafe, Bakery, BBQ, Fast Food, Chinese, Indian\u201d\nAccommodation: Bright, Modern, Clean, Spacious, Brooklyn Home, Atlanta, cost: 1034 x 2 = 2068, room type: Entire home/apt, house rules: No children under 10, minimum nights: 3\n\nNumber of people = 2\nTotal cost for the day = 54 + 118 + 150 + 2068 = 2390\nAccommodation minimum nights: 2/3\n\nDays: 3\nCurrent City: Atlanta\nTransportation: -, \nBreakfast: Baba Au Rhum, Atlanta, cost: 27 x 2 = 54, cuisines: \u201cDesserts, Pizza, Mexican, BBQ, Fast Food\u201d\nAttraction: World of Coca-Cola, Atlanta; High Museum of Art, Atlanta\nLunch: Daawat-e-Kashmir, Atlanta, cost: 19 x 2 = 38, cuisines: \u201cCafe, Pizza, American, Seafood\u201d\nDinner: Bengali Sweet House, Atlanta, cost: 39 x 2 = 78, cuisines: \u201cDesserts, American, BBQ, Pizza\u201d\nAccommodation: Bright, Modern, Clean, Spacious, Brooklyn Home, Atlanta, cost: 1034 x 2 = 2068, room type: Entire home/apt, house rules: No children under 10, minimum nights: 3\n\nNumber of people = 2\nTotal cost for the day = 54 + 38 + 78 + 2068 = 2238\nAccommodation minimum nights: 3/3\n\nDays: 4\nCurrent City: Atlanta to Decatur\nTransportation: Self-driving, from Atlanta to Decatur, duration: 18 mins, distance: 10.0 km, cost: 0\nBreakfast: -, \nAttraction: -, \nLunch: -, \nDinner: Cafe Coffee Day, Decatur, cost: 46 x 2 = 92, cuisines: \u201cTea, Cafe, BBQ, Mediterranean\u201d\nAccommodation: The Heart of the Lower East Side!, Decatur, cost: 587 x 2 = 1174, room type: Entire home/apt, house rules: No children under 10, minimum nights: 2\n\nNumber of people = 2\nTotal cost for the day = 92 + 1174 = 1266\nAccommodation minimum nights: 1/2\n\nDays: 5\nCurrent City: Decatur\nTransportation: -, \nBreakfast: Madhuban Restaurant - Welcome Hotel Rama International, Decatur, cost: 47 x 2 = 94, cuisines: \u201cPizza, Bakery, Seafood\u201d\nAttraction: DeKalb History Center Museum, Decatur; Glenlake Park, Decatur\nLunch: Joey's Pizza, Decatur, cost: 69 x 2 = 138, cuisines: \u201cTea, Pizza, Bakery, Chinese, Seafood\u201d\nDinner: Carnatic Cafe, Decatur, cost: 66 x 2 = 132, cuisines: \u201cCafe, Indian, Desserts\u201d\nAccommodation: The Heart of the Lower East Side!, Decatur, cost: 587 x 2 = 1174, room type: Entire home/apt, house rules: No children under 10, minimum nights: 2\n\nNumber of people = 2\nTotal cost for the day = 94 + 138 + 132 + 1174 = 1538\nAccommodation minimum nights: 2/2\n\nDays: 6\nCurrent City: Decatur to Augusta\nTransportation: Self-driving, from Decatur to Augusta, duration: 2 hours 17 mins, distance: 228 km, cost: 11 x 2 = 22\nBreakfast: -, \nAttraction: -, \nLunch: -, \nDinner: B Merrell's, Augusta, cost: 74 x 2 = 148, cuisines: \u201cTea, Pizza, Desserts, Fast Food\u201d\nAccommodation: Planta Baja Studio, Augusta, cost: 637 x 2 = 1274, room type: Entire home/apt, house rules: No smoking, minimum nights: 1\n\nNumber of people = 2\nTotal cost for the day = 22 + 148 + 1274 = 1444\nAccommodation minimum nights: 1/1\n\nDays: 7\nCurrent City: Augusta\nTransportation: Self-driving, from Augusta to Chattanooga, duration: 3 hours 58 mins, distance: 424 km, cost: 21 x 2 = 42\nBreakfast: Fish Tales Lakeside Grille, Augusta, cost: 37 x 2 = 74, cuisines: \u201cTea, Cafe, Bakery, Desserts\u201d\nAttraction: Augusta Riverwalk, Augusta; Morris Museum of Art, Augusta\nLunch: The Charcoal Chimney, Augusta, cost: 86 x 2 = 172, cuisines: \u201cTea, Fast Food, BBQ, Italian\u201d\nDinner: -, \nAccommodation: -,\n\nNumber of people = 2\nTotal cost for the day = 42 + 74 + 172 = 288\n\nTotal cost across all days = 2164 + 2390 + 2238 + 1266 + 1538 + 1444 + 288 = 11328\n\nUnfortunately, the total cost exceeds the specified budget of $6,800. Adjustments will need to be made to the plan to reduce costs, such as choosing less expensive accommodations or dining options.", "gpt-4-1106-preview_direct_sole-planning_parsed_results": [{"day": 1, "current_city": "from Chattanooga to Atlanta", "transportation": "Self-driving, from Chattanooga to Atlanta, duration: 1 hour 48 mins, distance: 190 km", "breakfast": "-", "attraction": "-", "lunch": "-", "dinner": "Saffron, Atlanta", "accommodation": "Bright, Modern, Clean, Spacious, Brooklyn Home, Atlanta"}, {"day": 2, "current_city": "Atlanta", "transportation": "-", "breakfast": "Asian Bistro, Atlanta", "attraction": "Georgia Aquarium, Atlanta;Atlanta Botanical Garden, Atlanta;", "lunch": "Chef Style, Atlanta", "dinner": "Pizza Central, Atlanta", "accommodation": "Bright, Modern, Clean, Spacious, Brooklyn Home, Atlanta"}, {"day": 3, "current_city": "Atlanta", "transportation": "-", "breakfast": "Baba Au Rhum, Atlanta", "attraction": "World of Coca-Cola, Atlanta;High Museum of Art, Atlanta;", "lunch": "Daawat-e-Kashmir, Atlanta", "dinner": "Bengali Sweet House, Atlanta", "accommodation": "Bright, Modern, Clean, Spacious, Brooklyn Home, Atlanta"}, {"day": 4, "current_city": "from Atlanta to Decatur", "transportation": "Self-driving, from Atlanta to Decatur, duration: 18 mins, distance: 10.0 km", "breakfast": "-", "attraction": "-", "lunch": "-", "dinner": "Cafe Coffee Day, Decatur", "accommodation": "The Heart of the Lower East Side!, Decatur"}, {"day": 5, "current_city": "Decatur", "transportation": "-", "breakfast": "Madhuban Restaurant - Welcome Hotel Rama International, Decatur", "attraction": "DeKalb History Center Museum, Decatur;Glenlake Park, Decatur;", "lunch": "Joey's Pizza, Decatur", "dinner": "Carnatic Cafe, Decatur", "accommodation": "The Heart of the Lower East Side!, Decatur"}, {"day": 6, "current_city": "from Decatur to Augusta", "transportation": "Self-driving, from Decatur to Augusta, duration: 2 hours 17 mins, distance: 228 km", "breakfast": "-", "attraction": "-", "lunch": "-", "dinner": "B Merrell's, Augusta", "accommodation": "Planta Baja Studio, Augusta"}, {"day": 7, "current_city": "from Augusta to Chattanooga", "transportation": "Self-driving, from Augusta to Chattanooga, duration: 3 hours 58 mins, distance: 424 km", "breakfast": "Fish Tales Lakeside Grille, Augusta", "attraction": "Augusta Riverwalk, Augusta;Morris Museum of Art, Augusta;", "lunch": "The Charcoal Chimney, Augusta", "dinner": "-", "accommodation": "-"}]}]